{
  "abstract" : "A notification that a get report request has been received from the system.",
  "codeExamples" : [

  ],
  "contentHash" : "064b5b140cfd6fd15166f0b23e28a63d742f15cb02efcb064ebed82104f6b4f8",
  "crawledAt" : "2025-12-02T05:56:10Z",
  "declaration" : {
    "code" : "func hidVirtualDevice(_ device: HIDVirtualDevice, receivedGetReportRequestOfType type: HIDReportType, id: HIDReportID?, maxSize: Int) async throws -> Data",
    "language" : "swift"
  },
  "id" : "5E70BD1B-9996-4556-8242-FB63A5A01A31",
  "kind" : "method",
  "module" : "Core HID",
  "overview" : "## Return Value\n\nThe bytes to return in response to the requested report. Determining the correct values can be aided by referencing the device’s report descriptor.\n\n## Discussion\n\nGet report requests are generated by other clients on the system, which includes system processes or other user apps. The response to a get report request is generally determined by the device’s report descriptor. However, a device can respond in whatever way it chooses.\n\nFor more details, see [https:\/\/www.usb.org\/hid].",
  "platforms" : [
    "macOS"
  ],
  "rawMarkdown" : "---\nsource: https:\/\/developer.apple.com\/documentation\/CoreHID\/HIDVirtualDeviceDelegate\/hidVirtualDevice(_:receivedGetReportRequestOfType:id:maxSize:)\ncrawled: 2025-12-02T05:56:10Z\n---\n\n# hidVirtualDevice(_:receivedGetReportRequestOfType:id:maxSize:)\n\n**Instance Method**\n\nA notification that a get report request has been received from the system.\n\n## Declaration\n\n```swift\nfunc hidVirtualDevice(_ device: HIDVirtualDevice, receivedGetReportRequestOfType type: HIDReportType, id: HIDReportID?, maxSize: Int) async throws -> Data\n```\n\n## Parameters\n\n- **device**: The device that received the notification.\n- **type**: The [doc:\/\/com.apple.CoreHID\/documentation\/CoreHID\/HIDReportType] of the requested report.\n- **id**: The ID of the requested report. This may not be populated if the descriptor contains only one report.\n- **maxSize**: The maximum size of data that can be transmitted back to the client. The data returned by this function must not exceed this size.\n\n## Return Value\n\nThe bytes to return in response to the requested report. Determining the correct values can be aided by referencing the device’s report descriptor.\n\n## Discussion\n\nGet report requests are generated by other clients on the system, which includes system processes or other user apps. The response to a get report request is generally determined by the device’s report descriptor. However, a device can respond in whatever way it chooses.\n\nFor more details, see [https:\/\/www.usb.org\/hid].\n\n\n\n## Receive notifications for a device\n\n- **hidVirtualDevice(_:receivedSetReportRequestOfType:id:data:)**: A notification that a set report request has been received from the system.\n\n",
  "sections" : [
    {
      "content" : "",
      "items" : [
        {
          "description" : "A notification that a set report request has been received from the system.",
          "name" : "hidVirtualDevice(_:receivedSetReportRequestOfType:id:data:)",
          "url" : "https:\/\/developer.apple.com\/documentation\/CoreHID\/HIDVirtualDeviceDelegate\/hidVirtualDevice(_:receivedSetReportRequestOfType:id:data:)"
        }
      ],
      "title" : "Receive notifications for a device"
    }
  ],
  "source" : "appleJSON",
  "title" : "hidVirtualDevice(_:receivedGetReportRequestOfType:id:maxSize:)",
  "url" : "https:\/\/developer.apple.com\/documentation\/CoreHID\/HIDVirtualDeviceDelegate\/hidVirtualDevice(_:receivedGetReportRequestOfType:id:maxSize:)"
}