{
  "abstract" : "Finish authorization of a partially-setup accessory.",
  "codeExamples" : [

  ],
  "contentHash" : "775611b8a0ad042f0e03c399a174e8d1cbd056da0c43d397af071a431d8b9be8",
  "crawledAt" : "2025-12-02T16:31:46Z",
  "declaration" : {
    "code" : "func finishAuthorization(for accessory: ASAccessory, settings: ASAccessorySettings, completionHandler: @escaping ((any Error)?) -> Void)",
    "language" : "swift"
  },
  "id" : "F334F762-2C26-4E88-9F47-B6BC9A4E1AD2",
  "kind" : "method",
  "language" : "swift",
  "module" : "AccessorySetupKit",
  "overview" : "## Discussion\n\nUse this method in scenarios where an accessory has multiple wireless interfaces. For example, when an accessory has both Bluetooth and Wi-Fi, and your descriptor may only provides an SSID prefix. In this case, the Bluetooth interface onboards first and your app needs to then finish authorization with the full SSID.",
  "platforms" : [
    "iOS",
    "iPadOS"
  ],
  "rawMarkdown" : "---\nsource: https:\/\/developer.apple.com\/documentation\/AccessorySetupKit\/ASAccessorySession\/finishAuthorization(for:settings:completionHandler:)\ncrawled: 2025-12-02T16:31:46Z\n---\n\n# finishAuthorization(for:settings:completionHandler:)\n\n**Instance Method**\n\nFinish authorization of a partially-setup accessory.\n\n## Declaration\n\n```swift\nfunc finishAuthorization(for accessory: ASAccessory, settings: ASAccessorySettings, completionHandler: @escaping ((any Error)?) -> Void)\n```\n\n```swift\nfunc finishAuthorization(for accessory: ASAccessory, settings: ASAccessorySettings) async throws\n```\n\n## Discussion\n\nUse this method in scenarios where an accessory has multiple wireless interfaces. For example, when an accessory has both Bluetooth and Wi-Fi, and your descriptor may only provides an SSID prefix. In this case, the Bluetooth interface onboards first and your app needs to then finish authorization with the full SSID.\n\n## Managing authorization\n\n- **ASAccessorySettings**: Properties of an accessory.\n- **failAuthorization(for:completionHandler:)**: End authorization of a partially-configured accessory as a failure.\n- **updateAuthorization(for:descriptor:completionHandler:)**: Displays a view to upgrade an accessory with additional technology permissions.\n\n",
  "sections" : [
    {
      "content" : "",
      "items" : [
        {
          "description" : "Properties of an accessory.",
          "name" : "ASAccessorySettings",
          "url" : "https:\/\/developer.apple.com\/documentation\/AccessorySetupKit\/ASAccessorySettings"
        },
        {
          "description" : "End authorization of a partially-configured accessory as a failure.",
          "name" : "failAuthorization(for:completionHandler:)",
          "url" : "https:\/\/developer.apple.com\/documentation\/AccessorySetupKit\/ASAccessorySession\/failAuthorization(for:completionHandler:)"
        },
        {
          "description" : "Displays a view to upgrade an accessory with additional technology permissions.",
          "name" : "updateAuthorization(for:descriptor:completionHandler:)",
          "url" : "https:\/\/developer.apple.com\/documentation\/AccessorySetupKit\/ASAccessorySession\/updateAuthorization(for:descriptor:completionHandler:)"
        }
      ],
      "title" : "Managing authorization"
    }
  ],
  "source" : "appleJSON",
  "title" : "finishAuthorization(for:settings:completionHandler:)",
  "url" : "https:\/\/developer.apple.com\/documentation\/AccessorySetupKit\/ASAccessorySession\/finishAuthorization(for:settings:completionHandler:)"
}