{
  "abstract" : "A class that opens Settings and navigates to the settings for configuring credential providers.",
  "codeExamples" : [

  ],
  "conformsTo" : [
    "CVarArg",
    "CustomDebugStringConvertible",
    "CustomStringConvertible",
    "Equatable",
    "Hashable",
    "NSObjectProtocol"
  ],
  "contentHash" : "6aeede585e64dae813829323719d78705d5c4ba721f0c6951135f05e61139c35",
  "crawledAt" : "2025-12-03T04:23:53Z",
  "declaration" : {
    "code" : "class ASSettingsHelper",
    "language" : "swift"
  },
  "id" : "7A5E2D34-C2F0-4F5F-8A93-824F13465414",
  "kind" : "class",
  "language" : "swift",
  "module" : "Authentication Services",
  "platforms" : [
    "iOS",
    "iPadOS",
    "Mac Catalyst",
    "macOS",
    "visionOS"
  ],
  "rawMarkdown" : "---\nsource: https:\/\/developer.apple.com\/documentation\/AuthenticationServices\/ASSettingsHelper\ncrawled: 2025-12-03T04:23:53Z\n---\n\n# ASSettingsHelper\n\n**Class**\n\nA class that opens Settings and navigates to the settings for configuring credential providers.\n\n## Declaration\n\n```swift\nclass ASSettingsHelper\n```\n\n## Opening the Settings app\n\n- **openCredentialProviderAppSettings(completionHandler:)**: Open the Settings app and navigate to the AutoFill provider settings.\n- **openVerificationCodeAppSettings(completionHandler:)**: Open the Settings app and navigate to the verification code provider settings.\n\n## Type Methods\n\n- **requestToTurnOnCredentialProviderExtension(completionHandler:)**: Call this method from your containing app to request to turn on a contained Credential Provider Extension. If the extension is not currently enabled, a prompt will be shown to allow it to be turned on. The completion handler is called with YES or NO depending on whether the credential provider is enabled. You need to wait 10 seconds in order to make additional request to this API.\n\n## Inherits From\n\n- NSObject\n\n## Conforms To\n\n- CVarArg\n- CustomDebugStringConvertible\n- CustomStringConvertible\n- Equatable\n- Hashable\n- NSObjectProtocol\n\n",
  "sections" : [
    {
      "content" : "",
      "items" : [
        {
          "description" : "Open the Settings app and navigate to the AutoFill provider settings.",
          "name" : "openCredentialProviderAppSettings(completionHandler:)",
          "url" : "https:\/\/developer.apple.com\/documentation\/AuthenticationServices\/ASSettingsHelper\/openCredentialProviderAppSettings(completionHandler:)"
        },
        {
          "description" : "Open the Settings app and navigate to the verification code provider settings.",
          "name" : "openVerificationCodeAppSettings(completionHandler:)",
          "url" : "https:\/\/developer.apple.com\/documentation\/AuthenticationServices\/ASSettingsHelper\/openVerificationCodeAppSettings(completionHandler:)"
        }
      ],
      "title" : "Opening the Settings app"
    },
    {
      "content" : "",
      "items" : [
        {
          "description" : "Call this method from your containing app to request to turn on a contained Credential Provider Extension. If the extension is not currently enabled, a prompt will be shown to allow it to be turned on. The completion handler is called with YES or NO depending on whether the credential provider is enabled. You need to wait 10 seconds in order to make additional request to this API.",
          "name" : "requestToTurnOnCredentialProviderExtension(completionHandler:)",
          "url" : "https:\/\/developer.apple.com\/documentation\/AuthenticationServices\/ASSettingsHelper\/requestToTurnOnCredentialProviderExtension(completionHandler:)"
        }
      ],
      "title" : "Type Methods"
    },
    {
      "content" : "",
      "items" : [
        {
          "name" : "NSObject"
        }
      ],
      "title" : "Inherits From"
    }
  ],
  "source" : "appleJSON",
  "title" : "ASSettingsHelper",
  "url" : "https:\/\/developer.apple.com\/documentation\/AuthenticationServices\/ASSettingsHelper"
}