{
  "abstract" : "The predicate string that identifies invalid credential errors.",
  "codeExamples" : [

  ],
  "contentHash" : "0f7151ef51709787fe7b57d8c400dfe9d4248f55bb56fcea6cd08d923266bc13",
  "crawledAt" : "2025-12-09T17:16:12Z",
  "declaration" : {
    "code" : "var invalidCredentialPredicate: String? { get set }",
    "language" : "swift"
  },
  "id" : "F669A383-5D59-407B-B83E-08F014E5BC4B",
  "kind" : "property",
  "language" : "swift",
  "module" : "Authentication Services",
  "overview" : "## Discussion\n\nIf the server returns an HTTP 400 or HTTP 401 error when authenticating, the system uses this predicate on the response body JSON. It then determines whether the error is due to an invalid password. If this predicate is `nil`, an HTTP 401 error indicates an invalid credential.",
  "platforms" : [
    "macOS"
  ],
  "rawMarkdown" : "---\nsource: https:\/\/developer.apple.com\/documentation\/AuthenticationServices\/ASAuthorizationProviderExtensionLoginConfiguration\/invalidCredentialPredicate\ncrawled: 2025-12-09T17:16:12Z\n---\n\n# invalidCredentialPredicate\n\n**Instance Property**\n\nThe predicate string that identifies invalid credential errors.\n\n## Declaration\n\n```swift\nvar invalidCredentialPredicate: String? { get set }\n```\n\n## Discussion\n\nIf the server returns an HTTP 400 or HTTP 401 error when authenticating, the system uses this predicate on the response body JSON. It then determines whether the error is due to an invalid password. If this predicate is `nil`, an HTTP 401 error indicates an invalid credential.\n\n## Obtaining the recommended configuration\n\n- **accountDisplayName**: The display name for the account.\n\n",
  "sections" : [
    {
      "content" : "",
      "items" : [
        {
          "description" : "The display name for the account.",
          "name" : "accountDisplayName",
          "url" : "https:\/\/developer.apple.com\/documentation\/AuthenticationServices\/ASAuthorizationProviderExtensionLoginConfiguration\/accountDisplayName"
        }
      ],
      "title" : "Obtaining the recommended configuration"
    }
  ],
  "source" : "appleJSON",
  "title" : "invalidCredentialPredicate",
  "url" : "https:\/\/developer.apple.com\/documentation\/AuthenticationServices\/ASAuthorizationProviderExtensionLoginConfiguration\/invalidCredentialPredicate"
}