{
  "abstract" : "Register and authenticate users with passkeys and security keys, without using passwords.",
  "codeExamples" : [

  ],
  "contentHash" : "356b37afcb7dca4e63dd1fed1d3ba65389bce6efff3f1f79f944fafd099aaac1",
  "crawledAt" : "2025-12-02T15:46:44Z",
  "id" : "5646CC09-EB3C-4308-9E15-BFA18F27F99B",
  "kind" : "collection",
  "language" : "swift",
  "module" : "Authentication Services",
  "overview" : "## Overview\n\nEliminating passwords simplifies account creation and authentication for apps and websites. Additionally, it reduces risks that arise from the reuse of one password across multiple services, brute force attacks, and social engineering that bad actors use to obtain credential information. By implementing public-private authentication according to the [https:\/\/www.w3.org\/TR\/webauthn-2\/] specification, your users no longer need to remember complicated passwords or rely on password managers.\n\nInstead of using a password, your macOS, iOS, or iPadOS device, known as the *authenticator*, generates a public-private key pair at account creation time, and sends the public key to the server. The server, known as the *relying party*, holds the public key for subsequent authentication, and uses *assertion* to challenge the authenticator to prove its identity is valid.\n\nThere are two forms of public-private key authentication: *passkeys* and *security keys.* With passkeys, the device stores its public-private key pair in the user’s iCloud Keychain and syncs the keys across the user’s devices. Security keys store the public-private key pair on a physical medium, such as a security card or a USB key.",
  "rawMarkdown" : "---\nsource: https:\/\/developer.apple.com\/documentation\/AuthenticationServices\/public-private-key-authentication\ncrawled: 2025-12-02T15:46:44Z\n---\n\n# Public-Private Key Authentication\n\n**API Collection**\n\nRegister and authenticate users with passkeys and security keys, without using passwords.\n\n## Overview\n\nEliminating passwords simplifies account creation and authentication for apps and websites. Additionally, it reduces risks that arise from the reuse of one password across multiple services, brute force attacks, and social engineering that bad actors use to obtain credential information. By implementing public-private authentication according to the [https:\/\/www.w3.org\/TR\/webauthn-2\/] specification, your users no longer need to remember complicated passwords or rely on password managers.\n\nInstead of using a password, your macOS, iOS, or iPadOS device, known as the *authenticator*, generates a public-private key pair at account creation time, and sends the public key to the server. The server, known as the *relying party*, holds the public key for subsequent authentication, and uses *assertion* to challenge the authenticator to prove its identity is valid.\n\nThere are two forms of public-private key authentication: *passkeys* and *security keys.* With passkeys, the device stores its public-private key pair in the user’s iCloud Keychain and syncs the keys across the user’s devices. Security keys store the public-private key pair on a physical medium, such as a security card or a USB key.\n\n## Fundamentals\n\n- **Connecting to a service with passkeys**: Allow users to sign in to a service without typing a password.\n- **Supporting passkeys**: Eliminate passwords for your users when they sign in to apps and websites.\n- **Supporting Security Key Authentication Using Physical Keys**: Allow users to authenticate using NFC, USB, and Lightning security keys in your app or service.\n\n## Account registration\n\n- **ASAuthorizationPublicKeyCredentialRegistration**: An interface that credential registration requests adhere to.\n- **ASAuthorizationPlatformPublicKeyCredentialRegistration**: A newly created platform credential that results from a credential registration request.\n- **ASAuthorizationSecurityKeyPublicKeyCredentialRegistration**: A newly created security key credential that results from a credential registration request.\n- **ASAuthorizationPublicKeyCredentialRegistrationRequest**: An interface that defines properties for a credential registration request.\n- **ASAuthorizationPlatformPublicKeyCredentialRegistrationRequest**: The object for registering a new platform public key credential.\n- **ASAuthorizationSecurityKeyPublicKeyCredentialRegistrationRequest**: The object for registering a new security key credential.\n\n## Account authentication\n\n- **ASAuthorizationPublicKeyCredentialAssertion**: An interface for establishing a public key-based assertion.\n- **ASAuthorizationPlatformPublicKeyCredentialAssertion**: A class that represents the platform credential assertion type.\n- **ASAuthorizationSecurityKeyPublicKeyCredentialAssertion**: A class that represents the security key credential assertion type.\n- **ASAuthorizationPublicKeyCredentialAssertionRequest**: An interface for requesting a public key-based credential assertion.\n- **ASAuthorizationPlatformPublicKeyCredentialAssertionRequest**: The concrete assertion request type for platform credentials.\n- **ASAuthorizationSecurityKeyPublicKeyCredentialAssertionRequest**: A class that defines the assertion request type for security key credentials.\n\n## Credential providers\n\n- **ASAuthorizationPlatformPublicKeyCredentialProvider**: A mechanism for providing public key credential requests to an app or service with iCloud Keychain.\n- **ASAuthorizationSecurityKeyPublicKeyCredentialProvider**: A mechanism for providing public key credential requests to an app or service with a physical security key.\n\n## Request configuration\n\n- **ASPublicKeyCredential**: An interface that defines the properties of the public key.\n- **ASAuthorizationPublicKeyCredentialParameters**: An object that provides required parameters for the credential during registration.\n- **ASCOSEAlgorithmIdentifier**: An identifier for the algorithm that a credential’s key pair uses.\n- **ASCOSEEllipticCurveIdentifier**: A structure that contains the elliptic curve identifier.\n- **ASAuthorizationPublicKeyCredentialAttestationKind**: A structure that defines the types of attestations a developer can request.\n- **ASAuthorizationPublicKeyCredentialResidentKeyPreference**: A structure that specifies the relying party’s preference for resident key storage.\n- **ASAuthorizationPublicKeyCredentialUserVerificationPreference**: A structure that defines the relying party’s user verification preference.\n- **ASAuthorizationPublicKeyCredentialDescriptor**: An interface that defines the credential identifier.\n- **ASAuthorizationPlatformPublicKeyCredentialDescriptor**: An object that holds the credential.\n- **ASAuthorizationSecurityKeyPublicKeyCredentialDescriptor**: An object that holds public key credential transport information.\n- **ASAuthorizationSecurityKeyPublicKeyCredentialDescriptor.Transport**: A structure that defines the security key credential transport type.\n- **allSupported**: An array of currently supported transport types.\n\n## Passkeys\n\n- **Passkey use in web browsers**: Register and authenticate website users by using passkeys.\n- **Performing fast account creation with passkeys**: Allow people to quickly create an account with passkeys and associated domains.\n- **Connecting to a service with passkeys**: Allow users to sign in to a service without typing a password.\n\n",
  "sections" : [
    {
      "content" : "",
      "items" : [
        {
          "description" : "Allow users to sign in to a service without typing a password.",
          "name" : "Connecting to a service with passkeys",
          "url" : "https:\/\/developer.apple.com\/documentation\/AuthenticationServices\/connecting-to-a-service-with-passkeys"
        },
        {
          "description" : "Eliminate passwords for your users when they sign in to apps and websites.",
          "name" : "Supporting passkeys",
          "url" : "https:\/\/developer.apple.com\/documentation\/AuthenticationServices\/supporting-passkeys"
        },
        {
          "description" : "Allow users to authenticate using NFC, USB, and Lightning security keys in your app or service.",
          "name" : "Supporting Security Key Authentication Using Physical Keys",
          "url" : "https:\/\/developer.apple.com\/documentation\/AuthenticationServices\/supporting-security-key-authentication-using-physical-keys"
        }
      ],
      "title" : "Fundamentals"
    },
    {
      "content" : "",
      "items" : [
        {
          "description" : "An interface that credential registration requests adhere to.",
          "name" : "ASAuthorizationPublicKeyCredentialRegistration",
          "url" : "https:\/\/developer.apple.com\/documentation\/AuthenticationServices\/ASAuthorizationPublicKeyCredentialRegistration"
        },
        {
          "description" : "A newly created platform credential that results from a credential registration request.",
          "name" : "ASAuthorizationPlatformPublicKeyCredentialRegistration",
          "url" : "https:\/\/developer.apple.com\/documentation\/AuthenticationServices\/ASAuthorizationPlatformPublicKeyCredentialRegistration"
        },
        {
          "description" : "A newly created security key credential that results from a credential registration request.",
          "name" : "ASAuthorizationSecurityKeyPublicKeyCredentialRegistration",
          "url" : "https:\/\/developer.apple.com\/documentation\/AuthenticationServices\/ASAuthorizationSecurityKeyPublicKeyCredentialRegistration"
        },
        {
          "description" : "An interface that defines properties for a credential registration request.",
          "name" : "ASAuthorizationPublicKeyCredentialRegistrationRequest",
          "url" : "https:\/\/developer.apple.com\/documentation\/AuthenticationServices\/ASAuthorizationPublicKeyCredentialRegistrationRequest"
        },
        {
          "description" : "The object for registering a new platform public key credential.",
          "name" : "ASAuthorizationPlatformPublicKeyCredentialRegistrationRequest",
          "url" : "https:\/\/developer.apple.com\/documentation\/AuthenticationServices\/ASAuthorizationPlatformPublicKeyCredentialRegistrationRequest"
        },
        {
          "description" : "The object for registering a new security key credential.",
          "name" : "ASAuthorizationSecurityKeyPublicKeyCredentialRegistrationRequest",
          "url" : "https:\/\/developer.apple.com\/documentation\/AuthenticationServices\/ASAuthorizationSecurityKeyPublicKeyCredentialRegistrationRequest"
        }
      ],
      "title" : "Account registration"
    },
    {
      "content" : "",
      "items" : [
        {
          "description" : "An interface for establishing a public key-based assertion.",
          "name" : "ASAuthorizationPublicKeyCredentialAssertion",
          "url" : "https:\/\/developer.apple.com\/documentation\/AuthenticationServices\/ASAuthorizationPublicKeyCredentialAssertion"
        },
        {
          "description" : "A class that represents the platform credential assertion type.",
          "name" : "ASAuthorizationPlatformPublicKeyCredentialAssertion",
          "url" : "https:\/\/developer.apple.com\/documentation\/AuthenticationServices\/ASAuthorizationPlatformPublicKeyCredentialAssertion"
        },
        {
          "description" : "A class that represents the security key credential assertion type.",
          "name" : "ASAuthorizationSecurityKeyPublicKeyCredentialAssertion",
          "url" : "https:\/\/developer.apple.com\/documentation\/AuthenticationServices\/ASAuthorizationSecurityKeyPublicKeyCredentialAssertion"
        },
        {
          "description" : "An interface for requesting a public key-based credential assertion.",
          "name" : "ASAuthorizationPublicKeyCredentialAssertionRequest",
          "url" : "https:\/\/developer.apple.com\/documentation\/AuthenticationServices\/ASAuthorizationPublicKeyCredentialAssertionRequest"
        },
        {
          "description" : "The concrete assertion request type for platform credentials.",
          "name" : "ASAuthorizationPlatformPublicKeyCredentialAssertionRequest",
          "url" : "https:\/\/developer.apple.com\/documentation\/AuthenticationServices\/ASAuthorizationPlatformPublicKeyCredentialAssertionRequest"
        },
        {
          "description" : "A class that defines the assertion request type for security key credentials.",
          "name" : "ASAuthorizationSecurityKeyPublicKeyCredentialAssertionRequest",
          "url" : "https:\/\/developer.apple.com\/documentation\/AuthenticationServices\/ASAuthorizationSecurityKeyPublicKeyCredentialAssertionRequest"
        }
      ],
      "title" : "Account authentication"
    },
    {
      "content" : "",
      "items" : [
        {
          "description" : "A mechanism for providing public key credential requests to an app or service with iCloud Keychain.",
          "name" : "ASAuthorizationPlatformPublicKeyCredentialProvider",
          "url" : "https:\/\/developer.apple.com\/documentation\/AuthenticationServices\/ASAuthorizationPlatformPublicKeyCredentialProvider"
        },
        {
          "description" : "A mechanism for providing public key credential requests to an app or service with a physical security key.",
          "name" : "ASAuthorizationSecurityKeyPublicKeyCredentialProvider",
          "url" : "https:\/\/developer.apple.com\/documentation\/AuthenticationServices\/ASAuthorizationSecurityKeyPublicKeyCredentialProvider"
        }
      ],
      "title" : "Credential providers"
    },
    {
      "content" : "",
      "items" : [
        {
          "description" : "An interface that defines the properties of the public key.",
          "name" : "ASPublicKeyCredential",
          "url" : "https:\/\/developer.apple.com\/documentation\/AuthenticationServices\/ASPublicKeyCredential"
        },
        {
          "description" : "An object that provides required parameters for the credential during registration.",
          "name" : "ASAuthorizationPublicKeyCredentialParameters",
          "url" : "https:\/\/developer.apple.com\/documentation\/AuthenticationServices\/ASAuthorizationPublicKeyCredentialParameters"
        },
        {
          "description" : "An identifier for the algorithm that a credential’s key pair uses.",
          "name" : "ASCOSEAlgorithmIdentifier",
          "url" : "https:\/\/developer.apple.com\/documentation\/AuthenticationServices\/ASCOSEAlgorithmIdentifier"
        },
        {
          "description" : "A structure that contains the elliptic curve identifier.",
          "name" : "ASCOSEEllipticCurveIdentifier",
          "url" : "https:\/\/developer.apple.com\/documentation\/AuthenticationServices\/ASCOSEEllipticCurveIdentifier"
        },
        {
          "description" : "A structure that defines the types of attestations a developer can request.",
          "name" : "ASAuthorizationPublicKeyCredentialAttestationKind",
          "url" : "https:\/\/developer.apple.com\/documentation\/AuthenticationServices\/ASAuthorizationPublicKeyCredentialAttestationKind"
        },
        {
          "description" : "A structure that specifies the relying party’s preference for resident key storage.",
          "name" : "ASAuthorizationPublicKeyCredentialResidentKeyPreference",
          "url" : "https:\/\/developer.apple.com\/documentation\/AuthenticationServices\/ASAuthorizationPublicKeyCredentialResidentKeyPreference"
        },
        {
          "description" : "A structure that defines the relying party’s user verification preference.",
          "name" : "ASAuthorizationPublicKeyCredentialUserVerificationPreference",
          "url" : "https:\/\/developer.apple.com\/documentation\/AuthenticationServices\/ASAuthorizationPublicKeyCredentialUserVerificationPreference"
        },
        {
          "description" : "An interface that defines the credential identifier.",
          "name" : "ASAuthorizationPublicKeyCredentialDescriptor",
          "url" : "https:\/\/developer.apple.com\/documentation\/AuthenticationServices\/ASAuthorizationPublicKeyCredentialDescriptor"
        },
        {
          "description" : "An object that holds the credential.",
          "name" : "ASAuthorizationPlatformPublicKeyCredentialDescriptor",
          "url" : "https:\/\/developer.apple.com\/documentation\/AuthenticationServices\/ASAuthorizationPlatformPublicKeyCredentialDescriptor"
        },
        {
          "description" : "An object that holds public key credential transport information.",
          "name" : "ASAuthorizationSecurityKeyPublicKeyCredentialDescriptor",
          "url" : "https:\/\/developer.apple.com\/documentation\/AuthenticationServices\/ASAuthorizationSecurityKeyPublicKeyCredentialDescriptor"
        },
        {
          "description" : "A structure that defines the security key credential transport type.",
          "name" : "ASAuthorizationSecurityKeyPublicKeyCredentialDescriptor.Transport",
          "url" : "https:\/\/developer.apple.com\/documentation\/AuthenticationServices\/ASAuthorizationSecurityKeyPublicKeyCredentialDescriptor\/Transport"
        },
        {
          "description" : "An array of currently supported transport types.",
          "name" : "allSupported",
          "url" : "https:\/\/developer.apple.com\/documentation\/AuthenticationServices\/ASAuthorizationSecurityKeyPublicKeyCredentialDescriptor\/Transport\/allSupported"
        }
      ],
      "title" : "Request configuration"
    },
    {
      "content" : "",
      "items" : [
        {
          "description" : "Register and authenticate website users by using passkeys.",
          "name" : "Passkey use in web browsers",
          "url" : "https:\/\/developer.apple.com\/documentation\/AuthenticationServices\/passkey-use-in-web-browsers"
        },
        {
          "description" : "Allow people to quickly create an account with passkeys and associated domains.",
          "name" : "Performing fast account creation with passkeys",
          "url" : "https:\/\/developer.apple.com\/documentation\/AuthenticationServices\/performing-fast-account-creation-with-passkeys"
        },
        {
          "description" : "Allow users to sign in to a service without typing a password.",
          "name" : "Connecting to a service with passkeys",
          "url" : "https:\/\/developer.apple.com\/documentation\/AuthenticationServices\/connecting-to-a-service-with-passkeys"
        }
      ],
      "title" : "Passkeys"
    }
  ],
  "source" : "appleJSON",
  "title" : "Public-Private Key Authentication",
  "url" : "https:\/\/developer.apple.com\/documentation\/AuthenticationServices\/public-private-key-authentication"
}