{
  "abstract" : "Build a fluid sign-in experience for your tvOS apps using AuthenticationServices.",
  "codeExamples" : [

  ],
  "contentHash" : "6fede14523e770edcbe467e05794e105bf3bc8ab3637dbef50e855ea327b87d8",
  "crawledAt" : "2025-12-03T11:41:48Z",
  "id" : "66BD9530-8ACC-4579-81C7-A345904F7C92",
  "kind" : "unknown",
  "language" : "swift",
  "module" : "Authentication Services",
  "overview" : "## Overview\n\n### Configure the Sample Code Project\n\nTo configure the sample code project, perform the following steps in Xcode:",
  "rawMarkdown" : "---\nsource: https:\/\/developer.apple.com\/documentation\/authenticationservices\/simplifying-user-authentication-in-a-tvos-app\ncrawled: 2025-12-03T11:41:48Z\n---\n\n# Simplifying User Authentication in a tvOS App\n\n**Sample Code**\n\nBuild a fluid sign-in experience for your tvOS apps using AuthenticationServices.\n\n## Overview\n\n\n\n### Configure the Sample Code Project\n\nTo configure the sample code project, perform the following steps in Xcode:\n\n1. Add your Apple ID account and assign the target to a team so Xcode can enable the `Associated Domains` capability with your provisioning profile.\n2. Configure your [doc:\/\/com.apple.documentation\/documentation\/Xcode\/supporting-associated-domains] in the `Associated Domains` capability and your websiteâ€™s associated domains file.\n3. Set up an Apple TV running tvOS 15 and an iPhone or iPad running iOS 15 or iPadOS 15.\n4. Add the same Apple ID to both devices. Alternatively, you may [https:\/\/support.apple.com\/en-us\/HT208088] the iPhone or iPad with the Apple TV.\n5. Set the Apple TV as the run destination in the scheme pop-up menu.\n6. In the toolbar, click Run, or choose Product > Run.\n\n## Sign In with Apple\n\n- **Implementing User Authentication with Sign in with Apple**: Provide a way for users of your app to set up an account and start using your services.\n- **SignInWithAppleButton**: A SwiftUI view that creates the Sign in with Apple button for display.\n- **Sign in with Apple Entitlement**: An entitlement that lets your app use Sign in with Apple.\n- **ASAuthorizationAppleIDProvider**: A mechanism for generating requests to authenticate users based on their Apple ID.\n- **ASAuthorizationAppleIDCredential**: A credential that results from a successful Apple ID authentication.\n\n",
  "sections" : [
    {
      "content" : "",
      "items" : [
        {
          "description" : "Provide a way for users of your app to set up an account and start using your services.",
          "name" : "Implementing User Authentication with Sign in with Apple",
          "url" : "https:\/\/developer.apple.com\/documentation\/AuthenticationServices\/implementing-user-authentication-with-sign-in-with-apple"
        },
        {
          "description" : "A SwiftUI view that creates the Sign in with Apple button for display.",
          "name" : "SignInWithAppleButton",
          "url" : "https:\/\/developer.apple.com\/documentation\/AuthenticationServices\/SignInWithAppleButton"
        },
        {
          "description" : "An entitlement that lets your app use Sign in with Apple.",
          "name" : "Sign in with Apple Entitlement",
          "url" : "https:\/\/developer.apple.com\/documentation\/BundleResources\/Entitlements\/com.apple.developer.applesignin"
        },
        {
          "description" : "A mechanism for generating requests to authenticate users based on their Apple ID.",
          "name" : "ASAuthorizationAppleIDProvider",
          "url" : "https:\/\/developer.apple.com\/documentation\/AuthenticationServices\/ASAuthorizationAppleIDProvider"
        },
        {
          "description" : "A credential that results from a successful Apple ID authentication.",
          "name" : "ASAuthorizationAppleIDCredential",
          "url" : "https:\/\/developer.apple.com\/documentation\/AuthenticationServices\/ASAuthorizationAppleIDCredential"
        }
      ],
      "title" : "Sign In with Apple"
    }
  ],
  "source" : "appleJSON",
  "title" : "Simplifying User Authentication in a tvOS App",
  "url" : "https:\/\/developer.apple.com\/documentation\/authenticationservices\/simplifying-user-authentication-in-a-tvos-app"
}