{
  "abstract" : "Replaces existing credential identities with new credential identities.",
  "codeExamples" : [

  ],
  "contentHash" : "abf7b6052045e758de1a1c82f40ef25d8853fc1a5581c129e837ddd3b09a94a4",
  "crawledAt" : "2025-12-04T01:33:28Z",
  "declaration" : {
    "code" : "func replaceCredentialIdentities(_ newCredentialIdentities: [any ASCredentialIdentity], completion: ((Bool, (any Error)?) -> Void)? = nil)",
    "language" : "swift"
  },
  "id" : "DE35BC19-21A7-4B2B-8E99-2CD2808EE09F",
  "kind" : "method",
  "language" : "swift",
  "module" : "Authentication Services",
  "overview" : "## Discussion\n\nThis method deletes existing credential identities in the store and saves the newly provided credential identity objects. On failure, this method calls the callback with an error with domain [doc:\/\/com.apple.authenticationservices\/documentation\/AuthenticationServices\/ASCredentialIdentityStoreErrorDomain] and doesn’t save any of the objects in `newCredentialIdentities` to the store.",
  "platforms" : [
    "iOS",
    "iPadOS",
    "Mac Catalyst",
    "macOS",
    "visionOS"
  ],
  "rawMarkdown" : "---\nsource: https:\/\/developer.apple.com\/documentation\/AuthenticationServices\/ASCredentialIdentityStore\/replaceCredentialIdentities(_:completion:)\ncrawled: 2025-12-04T01:33:28Z\n---\n\n# replaceCredentialIdentities(_:completion:)\n\n**Instance Method**\n\nReplaces existing credential identities with new credential identities.\n\n## Declaration\n\n```swift\nfunc replaceCredentialIdentities(_ newCredentialIdentities: [any ASCredentialIdentity], completion: ((Bool, (any Error)?) -> Void)? = nil)\n```\n\n```swift\nfunc replaceCredentialIdentities(_ newCredentialIdentities: [any ASCredentialIdentity]) async throws\n```\n\n## Discussion\n\nThis method deletes existing credential identities in the store and saves the newly provided credential identity objects. On failure, this method calls the callback with an error with domain [doc:\/\/com.apple.authenticationservices\/documentation\/AuthenticationServices\/ASCredentialIdentityStoreErrorDomain] and doesn’t save any of the objects in `newCredentialIdentities` to the store.\n\n## Adding and removing credential identities\n\n- **saveCredentialIdentities(_:completion:)**: Save the supplied credential identities to the store.\n- **removeAllCredentialIdentities(_:)**: Removes all existing credential identities from the store.\n- **removeCredentialIdentities(_:completion:)**: Remove the given credential identities from the store.\n- **ASCredentialIdentity**: A protocol that credential identity classes conform to that uniquely identifies credentials.\n- **ASPasskeyCredentialIdentity**: A description that uniquely identifies a particular passkey credential.\n- **ASPasswordCredentialIdentity**: A description that uniquely identifies a particular password credential.\n\n",
  "sections" : [
    {
      "content" : "",
      "items" : [
        {
          "description" : "Save the supplied credential identities to the store.",
          "name" : "saveCredentialIdentities(_:completion:)",
          "url" : "https:\/\/developer.apple.com\/documentation\/AuthenticationServices\/ASCredentialIdentityStore\/saveCredentialIdentities(_:completion:)-1bbx6"
        },
        {
          "description" : "Removes all existing credential identities from the store.",
          "name" : "removeAllCredentialIdentities(_:)",
          "url" : "https:\/\/developer.apple.com\/documentation\/AuthenticationServices\/ASCredentialIdentityStore\/removeAllCredentialIdentities(_:)"
        },
        {
          "description" : "Remove the given credential identities from the store.",
          "name" : "removeCredentialIdentities(_:completion:)",
          "url" : "https:\/\/developer.apple.com\/documentation\/AuthenticationServices\/ASCredentialIdentityStore\/removeCredentialIdentities(_:completion:)-67lcw"
        },
        {
          "description" : "A protocol that credential identity classes conform to that uniquely identifies credentials.",
          "name" : "ASCredentialIdentity",
          "url" : "https:\/\/developer.apple.com\/documentation\/AuthenticationServices\/ASCredentialIdentity"
        },
        {
          "description" : "A description that uniquely identifies a particular passkey credential.",
          "name" : "ASPasskeyCredentialIdentity",
          "url" : "https:\/\/developer.apple.com\/documentation\/AuthenticationServices\/ASPasskeyCredentialIdentity"
        },
        {
          "description" : "A description that uniquely identifies a particular password credential.",
          "name" : "ASPasswordCredentialIdentity",
          "url" : "https:\/\/developer.apple.com\/documentation\/AuthenticationServices\/ASPasswordCredentialIdentity"
        }
      ],
      "title" : "Adding and removing credential identities"
    }
  ],
  "source" : "appleJSON",
  "title" : "replaceCredentialIdentities(_:completion:)",
  "url" : "https:\/\/developer.apple.com\/documentation\/AuthenticationServices\/ASCredentialIdentityStore\/replaceCredentialIdentities(_:completion:)"
}