{
  "abstract" : "A request to upgrade from using a password to using Sign in with Apple.",
  "codeExamples" : [

  ],
  "conformsTo" : [
    "CVarArg",
    "CustomDebugStringConvertible",
    "CustomStringConvertible",
    "Equatable",
    "Hashable",
    "NSObjectProtocol"
  ],
  "contentHash" : "7908d68b686dfecbdb2d076f405293b204bc8b69d24c0a5c4707419a8d5210ea",
  "crawledAt" : "2025-12-06T08:37:33Z",
  "declaration" : {
    "code" : "class ASAccountAuthenticationModificationReplacePasswordWithSignInWithAppleRequest",
    "language" : "swift"
  },
  "id" : "C16A1D6D-BACB-4FA4-9D5F-0D9770B08244",
  "kind" : "class",
  "language" : "swift",
  "module" : "Authentication Services",
  "overview" : "## Overview\n\nYour app uses this class to initiate an upgrade to Sign in with Apple. After creating the request, your app initiates the upgrade process by instantiating an [doc:\/\/com.apple.authenticationservices\/documentation\/AuthenticationServices\/ASAccountAuthenticationModificationController] object and calling [doc:\/\/com.apple.authenticationservices\/documentation\/AuthenticationServices\/ASAccountAuthenticationModificationController\/perform(_:)] on it. The system invokes your authentication modification extension to complete the upgrade.",
  "platforms" : [
    "iOS",
    "iPadOS",
    "Mac Catalyst",
    "visionOS"
  ],
  "rawMarkdown" : "---\nsource: https:\/\/developer.apple.com\/documentation\/AuthenticationServices\/ASAccountAuthenticationModificationReplacePasswordWithSignInWithAppleRequest\ncrawled: 2025-12-06T08:37:33Z\n---\n\n# ASAccountAuthenticationModificationReplacePasswordWithSignInWithAppleRequest\n\n**Class**\n\nA request to upgrade from using a password to using Sign in with Apple.\n\n## Declaration\n\n```swift\nclass ASAccountAuthenticationModificationReplacePasswordWithSignInWithAppleRequest\n```\n\n## Overview\n\nYour app uses this class to initiate an upgrade to Sign in with Apple. After creating the request, your app initiates the upgrade process by instantiating an [doc:\/\/com.apple.authenticationservices\/documentation\/AuthenticationServices\/ASAccountAuthenticationModificationController] object and calling [doc:\/\/com.apple.authenticationservices\/documentation\/AuthenticationServices\/ASAccountAuthenticationModificationController\/perform(_:)] on it. The system invokes your authentication modification extension to complete the upgrade.\n\n## Creating Upgrade Requests in Your App\n\n- **init(user:serviceIdentifier:userInfo:)**: Creates a request to upgrade from using passwords to using Sign in with Apple.\n- **user**: The user name of the account to upgrade.\n- **serviceIdentifier**: An identifier that represents a particular service that the user needs a credential for, like a web site.\n- **userInfo**: A dictionary that contains values to pass to your account modification extension.\n\n## Initiating Security Upgrades from Your App\n\n- **perform(_:)**: Performs a request to upgrade the authentication credentials for an account to a strong password, or to use Sign in with Apple.\n- **ASAccountAuthenticationModificationUpgradePasswordToStrongPasswordRequest**: A request to automatically upgrade from a weak password to a strong password.\n- **ASAccountAuthenticationModificationRequest**: A request to modify an account’s authentication properties.\n\n## Inherits From\n\n- ASAccountAuthenticationModificationRequest\n\n## Conforms To\n\n- CVarArg\n- CustomDebugStringConvertible\n- CustomStringConvertible\n- Equatable\n- Hashable\n- NSObjectProtocol\n\n",
  "sections" : [
    {
      "content" : "",
      "items" : [
        {
          "description" : "Creates a request to upgrade from using passwords to using Sign in with Apple.",
          "name" : "init(user:serviceIdentifier:userInfo:)",
          "url" : "https:\/\/developer.apple.com\/documentation\/AuthenticationServices\/ASAccountAuthenticationModificationReplacePasswordWithSignInWithAppleRequest\/init(user:serviceIdentifier:userInfo:)"
        },
        {
          "description" : "The user name of the account to upgrade.",
          "name" : "user",
          "url" : "https:\/\/developer.apple.com\/documentation\/AuthenticationServices\/ASAccountAuthenticationModificationReplacePasswordWithSignInWithAppleRequest\/user"
        },
        {
          "description" : "An identifier that represents a particular service that the user needs a credential for, like a web site.",
          "name" : "serviceIdentifier",
          "url" : "https:\/\/developer.apple.com\/documentation\/AuthenticationServices\/ASAccountAuthenticationModificationReplacePasswordWithSignInWithAppleRequest\/serviceIdentifier"
        },
        {
          "description" : "A dictionary that contains values to pass to your account modification extension.",
          "name" : "userInfo",
          "url" : "https:\/\/developer.apple.com\/documentation\/AuthenticationServices\/ASAccountAuthenticationModificationReplacePasswordWithSignInWithAppleRequest\/userInfo"
        }
      ],
      "title" : "Creating Upgrade Requests in Your App"
    },
    {
      "content" : "",
      "items" : [
        {
          "description" : "Performs a request to upgrade the authentication credentials for an account to a strong password, or to use Sign in with Apple.",
          "name" : "perform(_:)",
          "url" : "https:\/\/developer.apple.com\/documentation\/AuthenticationServices\/ASAccountAuthenticationModificationController\/perform(_:)"
        },
        {
          "description" : "A request to automatically upgrade from a weak password to a strong password.",
          "name" : "ASAccountAuthenticationModificationUpgradePasswordToStrongPasswordRequest",
          "url" : "https:\/\/developer.apple.com\/documentation\/AuthenticationServices\/ASAccountAuthenticationModificationUpgradePasswordToStrongPasswordRequest"
        },
        {
          "description" : "A request to modify an account’s authentication properties.",
          "name" : "ASAccountAuthenticationModificationRequest",
          "url" : "https:\/\/developer.apple.com\/documentation\/AuthenticationServices\/ASAccountAuthenticationModificationRequest"
        }
      ],
      "title" : "Initiating Security Upgrades from Your App"
    },
    {
      "content" : "",
      "items" : [
        {
          "name" : "ASAccountAuthenticationModificationRequest"
        }
      ],
      "title" : "Inherits From"
    }
  ],
  "source" : "appleJSON",
  "title" : "ASAccountAuthenticationModificationReplacePasswordWithSignInWithAppleRequest",
  "url" : "https:\/\/developer.apple.com\/documentation\/AuthenticationServices\/ASAccountAuthenticationModificationReplacePasswordWithSignInWithAppleRequest"
}