{
  "abstract" : "A type that provides access to the timing information and data types you need to render a single frame of content.",
  "codeExamples" : [

  ],
  "conformsTo" : [
    "BitwiseCopyable"
  ],
  "contentHash" : "48e9aab7894dbff6bf460c1615b813910506af1a93b1f0b37ca47df9a53c3953",
  "crawledAt" : "2025-12-04T19:22:36Z",
  "declaration" : {
    "code" : "struct Frame",
    "language" : "swift"
  },
  "id" : "68480A05-D15D-4EDF-ADDA-50948D5A4036",
  "kind" : "struct",
  "language" : "swift",
  "module" : "Compositor Services",
  "overview" : "## Overview\n\nA frame represents a snapshot of your app’s content at a single moment in time. In your rendering loop, you render your content into static images many times a second to create the illusion of animation. A [doc:\/\/com.apple.compositorservices\/documentation\/CompositorServices\/LayerRenderer\/Frame] provides the Metal textures and information you need to render one of those images.\n\nDuring each iteration of your app’s rendering loop, call [doc:\/\/com.apple.compositorservices\/documentation\/CompositorServices\/LayerRenderer\/queryNextFrame()] to retrieve the next frame to render. The system manages a finite number of frames and recycles them to maximize efficiency. You typically draw only one frame at a time, starting work on each new frame only after completing the previous frame.\n\nSeparate the work you do for each frame into two phases: the update phase and the encode phase. Use the update phase to perform tasks that don’t depend on the current device pose. For example, you might update your app’s data structures to reflect recent interactions with your content. Use the submission phase to retrieve the current pose and render the frame’s content using that information. Each frame provides a [doc:\/\/com.apple.compositorservices\/documentation\/CompositorServices\/LayerRenderer\/Drawable] type with access to the specific textures and rendering details for that frame.",
  "platforms" : [
    "macOS",
    "visionOS"
  ],
  "rawMarkdown" : "---\nsource: https:\/\/developer.apple.com\/documentation\/CompositorServices\/LayerRenderer\/Frame\ncrawled: 2025-12-04T19:22:36Z\n---\n\n# LayerRenderer.Frame\n\n**Structure**\n\nA type that provides access to the timing information and data types you need to render a single frame of content.\n\n## Declaration\n\n```swift\nstruct Frame\n```\n\n## Overview\n\nA frame represents a snapshot of your app’s content at a single moment in time. In your rendering loop, you render your content into static images many times a second to create the illusion of animation. A [doc:\/\/com.apple.compositorservices\/documentation\/CompositorServices\/LayerRenderer\/Frame] provides the Metal textures and information you need to render one of those images.\n\nDuring each iteration of your app’s rendering loop, call [doc:\/\/com.apple.compositorservices\/documentation\/CompositorServices\/LayerRenderer\/queryNextFrame()] to retrieve the next frame to render. The system manages a finite number of frames and recycles them to maximize efficiency. You typically draw only one frame at a time, starting work on each new frame only after completing the previous frame.\n\nSeparate the work you do for each frame into two phases: the update phase and the encode phase. Use the update phase to perform tasks that don’t depend on the current device pose. For example, you might update your app’s data structures to reflect recent interactions with your content. Use the submission phase to retrieve the current pose and render the frame’s content using that information. Each frame provides a [doc:\/\/com.apple.compositorservices\/documentation\/CompositorServices\/LayerRenderer\/Drawable] type with access to the specific textures and rendering details for that frame.\n\n## Getting timing information\n\n- **predictTiming()**: Computes and returns the predicted timing information for the frame.\n- **LayerRenderer.Frame.Timing**: A type that stores information about a frame’s encoding, rendering, and presentation deadlines.\n\n## Reporting frame update times\n\n- **startUpdate()**: Notifies Compositor Services that you started updating the app-specific content for the frame.\n- **endUpdate()**: Notifies Compositor Services that you finished updating the app-specific content you need to render the frame.\n\n## Getting the drawable environment\n\n- **queryDrawables()**: Returns the array of drawables expected to be used for the given frame. These drawables each have textures, transforms and timing information for drawing the frame.\n- **queryDrawable()**: Retrieves the frame’s drawable, which contains the textures and drawing environment for the frame.\n\n## Reporting frame submission times\n\n- **startSubmission()**: Notifies Compositor Services that you’re ready to generate the Metal commands to render the specified frame.\n- **endSubmission()**: Notifies Compositor Services that you finished generating the GPU commands to render the specified frame.\n\n## Getting frame-related details\n\n- **frameIndex**: The sequential index number of a frame.\n- **LayerFrameIndex**: A frame index in the layer’s timeline.\n- **CompositorFrameIndex**: The sequential index for a frame in the compositor’s timeline.\n\n## Creating a frame\n\n- **init()**: Creates an uninitialized frame.\n\n## Instance Methods\n\n- **binocularFrustumMatrix(convention:increaseTangents:depthRange:)**\n- **binocularFrustumMatrixForDrawableTarget(drawableTarget:convention:increaseTangents:depthRange:)**: Returns the transform which can be used for binocular frustum culling. A matrix to convert between the device coordinate space to normalized device coordinate space. This should be acquired between starting and submitting a frame. Renderer should not utilize this transform for actual rendering output.\n- **drawableTargetViewCount(target:)**: Returns the number of view in the drawable target.\n- **monocularFrustumMatrix(convention:viewIndex:increaseTangents:depthRange:)**\n- **monocularFrustumMatrixForDrawableTarget(drawableTarget:convention:viewIndex:increaseTangents:depthRange:)**: Returns the transform which can be used for monocular frustum culling for given view. A matrix to convert between the device coordinate space to normalized device coordinate space This should be acquired between starting and submitting a frame. Renderer should not utilize this transform for actual rendering output.\n\n## Render-loop setup\n\n- **LayerRenderer**: A type that provides the Metal types and timing information you need to draw your content.\n\n## Conforms To\n\n- BitwiseCopyable\n\n",
  "sections" : [
    {
      "content" : "",
      "items" : [
        {
          "description" : "Computes and returns the predicted timing information for the frame.",
          "name" : "predictTiming()",
          "url" : "https:\/\/developer.apple.com\/documentation\/CompositorServices\/LayerRenderer\/Frame\/predictTiming()"
        },
        {
          "description" : "A type that stores information about a frame’s encoding, rendering, and presentation deadlines.",
          "name" : "LayerRenderer.Frame.Timing",
          "url" : "https:\/\/developer.apple.com\/documentation\/CompositorServices\/LayerRenderer\/Frame\/Timing"
        }
      ],
      "title" : "Getting timing information"
    },
    {
      "content" : "",
      "items" : [
        {
          "description" : "Notifies Compositor Services that you started updating the app-specific content for the frame.",
          "name" : "startUpdate()",
          "url" : "https:\/\/developer.apple.com\/documentation\/CompositorServices\/LayerRenderer\/Frame\/startUpdate()"
        },
        {
          "description" : "Notifies Compositor Services that you finished updating the app-specific content you need to render the frame.",
          "name" : "endUpdate()",
          "url" : "https:\/\/developer.apple.com\/documentation\/CompositorServices\/LayerRenderer\/Frame\/endUpdate()"
        }
      ],
      "title" : "Reporting frame update times"
    },
    {
      "content" : "",
      "items" : [
        {
          "description" : "Returns the array of drawables expected to be used for the given frame. These drawables each have textures, transforms and timing information for drawing the frame.",
          "name" : "queryDrawables()",
          "url" : "https:\/\/developer.apple.com\/documentation\/CompositorServices\/LayerRenderer\/Frame\/queryDrawables()"
        },
        {
          "description" : "Retrieves the frame’s drawable, which contains the textures and drawing environment for the frame.",
          "name" : "queryDrawable()",
          "url" : "https:\/\/developer.apple.com\/documentation\/CompositorServices\/LayerRenderer\/Frame\/queryDrawable()"
        }
      ],
      "title" : "Getting the drawable environment"
    },
    {
      "content" : "",
      "items" : [
        {
          "description" : "Notifies Compositor Services that you’re ready to generate the Metal commands to render the specified frame.",
          "name" : "startSubmission()",
          "url" : "https:\/\/developer.apple.com\/documentation\/CompositorServices\/LayerRenderer\/Frame\/startSubmission()"
        },
        {
          "description" : "Notifies Compositor Services that you finished generating the GPU commands to render the specified frame.",
          "name" : "endSubmission()",
          "url" : "https:\/\/developer.apple.com\/documentation\/CompositorServices\/LayerRenderer\/Frame\/endSubmission()"
        }
      ],
      "title" : "Reporting frame submission times"
    },
    {
      "content" : "",
      "items" : [
        {
          "description" : "The sequential index number of a frame.",
          "name" : "frameIndex",
          "url" : "https:\/\/developer.apple.com\/documentation\/CompositorServices\/LayerRenderer\/Frame\/frameIndex"
        },
        {
          "description" : "A frame index in the layer’s timeline.",
          "name" : "LayerFrameIndex",
          "url" : "https:\/\/developer.apple.com\/documentation\/CompositorServices\/LayerFrameIndex"
        },
        {
          "description" : "The sequential index for a frame in the compositor’s timeline.",
          "name" : "CompositorFrameIndex",
          "url" : "https:\/\/developer.apple.com\/documentation\/CompositorServices\/CompositorFrameIndex"
        }
      ],
      "title" : "Getting frame-related details"
    },
    {
      "content" : "",
      "items" : [
        {
          "description" : "Creates an uninitialized frame.",
          "name" : "init()",
          "url" : "https:\/\/developer.apple.com\/documentation\/CompositorServices\/LayerRenderer\/Frame\/init()"
        }
      ],
      "title" : "Creating a frame"
    },
    {
      "content" : "",
      "items" : [
        {
          "description" : "",
          "name" : "binocularFrustumMatrix(convention:increaseTangents:depthRange:)",
          "url" : "https:\/\/developer.apple.com\/documentation\/CompositorServices\/LayerRenderer\/Frame\/binocularFrustumMatrix(convention:increaseTangents:depthRange:)"
        },
        {
          "description" : "Returns the transform which can be used for binocular frustum culling. A matrix to convert between the device coordinate space to normalized device coordinate space. This should be acquired between starting and submitting a frame. Renderer should not utilize this transform for actual rendering output.",
          "name" : "binocularFrustumMatrixForDrawableTarget(drawableTarget:convention:increaseTangents:depthRange:)",
          "url" : "https:\/\/developer.apple.com\/documentation\/CompositorServices\/LayerRenderer\/Frame\/binocularFrustumMatrixForDrawableTarget(drawableTarget:convention:increaseTangents:depthRange:)"
        },
        {
          "description" : "Returns the number of view in the drawable target.",
          "name" : "drawableTargetViewCount(target:)",
          "url" : "https:\/\/developer.apple.com\/documentation\/CompositorServices\/LayerRenderer\/Frame\/drawableTargetViewCount(target:)"
        },
        {
          "description" : "",
          "name" : "monocularFrustumMatrix(convention:viewIndex:increaseTangents:depthRange:)",
          "url" : "https:\/\/developer.apple.com\/documentation\/CompositorServices\/LayerRenderer\/Frame\/monocularFrustumMatrix(convention:viewIndex:increaseTangents:depthRange:)"
        },
        {
          "description" : "Returns the transform which can be used for monocular frustum culling for given view. A matrix to convert between the device coordinate space to normalized device coordinate space This should be acquired between starting and submitting a frame. Renderer should not utilize this transform for actual rendering output.",
          "name" : "monocularFrustumMatrixForDrawableTarget(drawableTarget:convention:viewIndex:increaseTangents:depthRange:)",
          "url" : "https:\/\/developer.apple.com\/documentation\/CompositorServices\/LayerRenderer\/Frame\/monocularFrustumMatrixForDrawableTarget(drawableTarget:convention:viewIndex:increaseTangents:depthRange:)"
        }
      ],
      "title" : "Instance Methods"
    },
    {
      "content" : "",
      "items" : [
        {
          "description" : "A type that provides the Metal types and timing information you need to draw your content.",
          "name" : "LayerRenderer",
          "url" : "https:\/\/developer.apple.com\/documentation\/CompositorServices\/LayerRenderer"
        }
      ],
      "title" : "Render-loop setup"
    }
  ],
  "source" : "appleJSON",
  "title" : "LayerRenderer.Frame",
  "url" : "https:\/\/developer.apple.com\/documentation\/CompositorServices\/LayerRenderer\/Frame"
}