{
  "abstract" : "A type that provides details about the textures associated with a view.",
  "codeExamples" : [

  ],
  "conformsTo" : [
    "BitwiseCopyable"
  ],
  "contentHash" : "c384324c23a3b7eed69a9b6bc4f59dbb7b0c2401456ce1a6ca846b26cf52d609",
  "crawledAt" : "2025-12-06T04:11:23Z",
  "declaration" : {
    "code" : "struct TextureMap",
    "language" : "swift"
  },
  "id" : "F9024EF1-3F25-499B-BF54-1D1A145E3E41",
  "kind" : "struct",
  "language" : "swift",
  "module" : "Compositor Services",
  "overview" : "## Overview\n\nA texture map helps you locate the content for a specific view within a texture. Texture maps are especially important when a layer uses a single texture to manage multiple views. For example, a head-mounted display might store the images for both the left and right eyes in a single texture. Pass this type to other functions to get specific details about the current texture, such as its view bounds or its index into a texture array.",
  "platforms" : [
    "macOS",
    "visionOS"
  ],
  "rawMarkdown" : "---\nsource: https:\/\/developer.apple.com\/documentation\/CompositorServices\/LayerRenderer\/Drawable\/View\/TextureMap-swift.struct\ncrawled: 2025-12-06T04:11:23Z\n---\n\n# LayerRenderer.Drawable.View.TextureMap\n\n**Structure**\n\nA type that provides details about the textures associated with a view.\n\n## Declaration\n\n```swift\nstruct TextureMap\n```\n\n## Overview\n\nA texture map helps you locate the content for a specific view within a texture. Texture maps are especially important when a layer uses a single texture to manage multiple views. For example, a head-mounted display might store the images for both the left and right eyes in a single texture. Pass this type to other functions to get specific details about the current texture, such as its view bounds or its index into a texture array.\n\n## Getting the viewport\n\n- **viewport**: The portion of the texture that the view uses to draw its content.\n\n## Getting the texture indices\n\n- **sliceIndex**: The index of the view’s texture in an array-based texture type.\n- **textureIndex**: The index of the view’s textures in the drawable.\n\n## Creating a texture map\n\n- **init()**: Creates an uninitialized texture map.\n\n## Getting the view’s texture map\n\n- **textureMap**: The texture map for a view.\n\n## Conforms To\n\n- BitwiseCopyable\n\n",
  "sections" : [
    {
      "content" : "",
      "items" : [
        {
          "description" : "The portion of the texture that the view uses to draw its content.",
          "name" : "viewport",
          "url" : "https:\/\/developer.apple.com\/documentation\/CompositorServices\/LayerRenderer\/Drawable\/View\/TextureMap-swift.struct\/viewport"
        }
      ],
      "title" : "Getting the viewport"
    },
    {
      "content" : "",
      "items" : [
        {
          "description" : "The index of the view’s texture in an array-based texture type.",
          "name" : "sliceIndex",
          "url" : "https:\/\/developer.apple.com\/documentation\/CompositorServices\/LayerRenderer\/Drawable\/View\/TextureMap-swift.struct\/sliceIndex"
        },
        {
          "description" : "The index of the view’s textures in the drawable.",
          "name" : "textureIndex",
          "url" : "https:\/\/developer.apple.com\/documentation\/CompositorServices\/LayerRenderer\/Drawable\/View\/TextureMap-swift.struct\/textureIndex"
        }
      ],
      "title" : "Getting the texture indices"
    },
    {
      "content" : "",
      "items" : [
        {
          "description" : "Creates an uninitialized texture map.",
          "name" : "init()",
          "url" : "https:\/\/developer.apple.com\/documentation\/CompositorServices\/LayerRenderer\/Drawable\/View\/TextureMap-swift.struct\/init()"
        }
      ],
      "title" : "Creating a texture map"
    },
    {
      "content" : "",
      "items" : [
        {
          "description" : "The texture map for a view.",
          "name" : "textureMap",
          "url" : "https:\/\/developer.apple.com\/documentation\/CompositorServices\/LayerRenderer\/Drawable\/View\/textureMap-swift.property"
        }
      ],
      "title" : "Getting the view’s texture map"
    }
  ],
  "source" : "appleJSON",
  "title" : "LayerRenderer.Drawable.View.TextureMap",
  "url" : "https:\/\/developer.apple.com\/documentation\/CompositorServices\/LayerRenderer\/Drawable\/View\/TextureMap-swift.struct"
}