{
  "abstract" : "A Boolean value that indicates whether to perform video frame analysis.",
  "codeExamples" : [

  ],
  "contentHash" : "da2942d8d88276ccfad40fc5e165144d5d49961e6e9cad9afdf08fecedda54b8",
  "crawledAt" : "2025-12-03T08:20:29Z",
  "declaration" : {
    "code" : "@MainActor var allowsVideoFrameAnalysis: Bool { get set }",
    "language" : "swift"
  },
  "id" : "663017FF-F7B4-4346-9537-6DA1654F482D",
  "kind" : "property",
  "language" : "swift",
  "module" : "AVKit",
  "overview" : "## Discussion\n\nIf the value is `true`, a player view tries to find objects, text, and people when you pause media playback. If it finds an object, the user is able to interact with it using a long press to present a context menu.\n\nThe default value is `true`.",
  "platforms" : [
    "macOS"
  ],
  "rawMarkdown" : "---\nsource: https:\/\/developer.apple.com\/documentation\/AVKit\/AVPlayerView\/allowsVideoFrameAnalysis\ncrawled: 2025-12-03T08:20:29Z\n---\n\n# allowsVideoFrameAnalysis\n\n**Instance Property**\n\nA Boolean value that indicates whether to perform video frame analysis.\n\n## Declaration\n\n```swift\n@MainActor var allowsVideoFrameAnalysis: Bool { get set }\n```\n\n## Discussion\n\nIf the value is `true`, a player view tries to find objects, text, and people when you pause media playback. If it finds an object, the user is able to interact with it using a long press to present a context menu.\n\nThe default value is `true`.\n\n## Configuring frame analysis\n\n- **videoFrameAnalysisTypes**\n- **AVVideoFrameAnalysisType**: Constants that define the types of analysis a player view controller may perform on a paused video frame.\n\n",
  "sections" : [
    {
      "content" : "",
      "items" : [
        {
          "description" : "",
          "name" : "videoFrameAnalysisTypes",
          "url" : "https:\/\/developer.apple.com\/documentation\/AVKit\/AVPlayerView\/videoFrameAnalysisTypes"
        },
        {
          "description" : "Constants that define the types of analysis a player view controller may perform on a paused video frame.",
          "name" : "AVVideoFrameAnalysisType",
          "url" : "https:\/\/developer.apple.com\/documentation\/AVKit\/AVVideoFrameAnalysisType"
        }
      ],
      "title" : "Configuring frame analysis"
    }
  ],
  "source" : "appleJSON",
  "title" : "allowsVideoFrameAnalysis",
  "url" : "https:\/\/developer.apple.com\/documentation\/AVKit\/AVPlayerView\/allowsVideoFrameAnalysis"
}