{
  "abstract" : "A view controller that provides an interface to a person so they can select and connect a continuity device to the system.",
  "codeExamples" : [

  ],
  "conformsTo" : [
    "CVarArg",
    "CustomDebugStringConvertible",
    "CustomStringConvertible",
    "Equatable",
    "Hashable",
    "NSCoding",
    "NSExtensionRequestHandling",
    "NSObjectProtocol",
    "Sendable",
    "SendableMetatype",
    "UIActivityItemsConfigurationProviding",
    "UIAppearanceContainer",
    "UIContentContainer",
    "UIFocusEnvironment",
    "UIResponderStandardEditActions",
    "UIStateRestoring",
    "UITraitChangeObservable",
    "UITraitEnvironment",
    "UIUserActivityRestoring"
  ],
  "contentHash" : "d5ac3d285ef002a13bef18cac25e718178c3ec0520b159363b3f1c195a7ffebb",
  "crawledAt" : "2025-12-02T15:59:02Z",
  "declaration" : {
    "code" : "@MainActor class AVContinuityDevicePickerViewController",
    "language" : "swift"
  },
  "id" : "889FD64A-4375-4D55-B790-715CD2B456C5",
  "kind" : "class",
  "language" : "swift",
  "module" : "AVKit",
  "overview" : "## Overview\n\nThe view controller presents an interface on an Apple TV that lets a person choose a nearby continuity device ([doc:\/\/com.apple.documentation\/documentation\/AVFoundation\/AVContinuityDevice]). Your app can then connect to that device’s cameras and microphones (see [doc:\/\/com.apple.documentation\/documentation\/AVFoundation\/AVCaptureDevice] and [doc:\/\/com.apple.documentation\/documentation\/AVFAudio\/AVAudioSessionPortDescription], respectively).\n\nTo respond to the various outcome events from the picker, your app needs to implement the [doc:\/\/com.apple.avkit\/documentation\/AVKit\/AVContinuityDevicePickerViewControllerDelegate] and assign it to the picker’s [doc:\/\/com.apple.avkit\/documentation\/AVKit\/AVContinuityDevicePickerViewController\/delegate] property.",
  "platforms" : [
    "tvOS"
  ],
  "rawMarkdown" : "---\nsource: https:\/\/developer.apple.com\/documentation\/AVKit\/AVContinuityDevicePickerViewController\ncrawled: 2025-12-02T15:59:02Z\n---\n\n# AVContinuityDevicePickerViewController\n\n**Class**\n\nA view controller that provides an interface to a person so they can select and connect a continuity device to the system.\n\n## Declaration\n\n```swift\n@MainActor class AVContinuityDevicePickerViewController\n```\n\n## Overview\n\nThe view controller presents an interface on an Apple TV that lets a person choose a nearby continuity device ([doc:\/\/com.apple.documentation\/documentation\/AVFoundation\/AVContinuityDevice]). Your app can then connect to that device’s cameras and microphones (see [doc:\/\/com.apple.documentation\/documentation\/AVFoundation\/AVCaptureDevice] and [doc:\/\/com.apple.documentation\/documentation\/AVFAudio\/AVAudioSessionPortDescription], respectively).\n\n\n\nTo respond to the various outcome events from the picker, your app needs to implement the [doc:\/\/com.apple.avkit\/documentation\/AVKit\/AVContinuityDevicePickerViewControllerDelegate] and assign it to the picker’s [doc:\/\/com.apple.avkit\/documentation\/AVKit\/AVContinuityDevicePickerViewController\/delegate] property.\n\n\n\n## Checking for feature support\n\n- **isSupported**: A Boolean value that indicates whether the system supports connecting to a continuity device.\n\n## Designating a delegate\n\n- **delegate**: The delegate that responds to events from the continuity device picker view controller.\n\n## tvOS playback and capture\n\n- **Customizing the tvOS Playback Experience**: Adopt the latest features of the redesigned tvOS player user interface to provide a more streamlined way to watch your content.\n- **Presenting Navigation Markers**: Present navigation markers in the Chapters panel to help users quickly navigate your content.\n- **Working with Interstitial Content**: Present additional content alongside your main media presentation using HTTP Live Streaming support.\n- **Presenting Content Proposals in tvOS**: Display a preview of an upcoming media item at the conclusion of the currently playing media item.\n- **Working with Overlays and Parental Controls in tvOS**: Add interactive overlays, parental controls, and livestream channel flipping using a player view controller.\n- **Supporting Continuity Camera in your tvOS app**: Capture high-quality photos, video, and audio in your Apple TV app by connecting an iPhone or iPad as a continuity device.\n- **AVPlayerViewController**: A view controller that displays content from a player and presents a native user interface to control playback.\n- **AVPlayerViewControllerDelegate**: A protocol that defines the methods to implement to respond to player view controller events.\n- **AVInterstitialTimeRange**: A time range in an audiovisual presentation for content with an interstitial designation, such as advertisements or legal notices.\n- **AVNavigationMarkersGroup**: A set of markers for navigating playback of an audiovisual presentation.\n- **AVContentProposalViewController**: A view controller that proposes content to watch next.\n- **AVDisplayManager**: A tvOS management object that controls whether a TV switches modes to match the video’s native mode.\n- **AVContinuityDevicePickerViewControllerDelegate**: An interface that responds to events from a continuity device picker view controller.\n\n## Inherits From\n\n- UIViewController\n\n## Conforms To\n\n- CVarArg\n- CustomDebugStringConvertible\n- CustomStringConvertible\n- Equatable\n- Hashable\n- NSCoding\n- NSExtensionRequestHandling\n- NSObjectProtocol\n- Sendable\n- SendableMetatype\n- UIActivityItemsConfigurationProviding\n- UIAppearanceContainer\n- UIContentContainer\n- UIFocusEnvironment\n- UIResponderStandardEditActions\n- UIStateRestoring\n- UITraitChangeObservable\n- UITraitEnvironment\n- UIUserActivityRestoring\n\n",
  "sections" : [
    {
      "content" : "",
      "items" : [
        {
          "description" : "A Boolean value that indicates whether the system supports connecting to a continuity device.",
          "name" : "isSupported",
          "url" : "https:\/\/developer.apple.com\/documentation\/AVKit\/AVContinuityDevicePickerViewController\/isSupported"
        }
      ],
      "title" : "Checking for feature support"
    },
    {
      "content" : "",
      "items" : [
        {
          "description" : "The delegate that responds to events from the continuity device picker view controller.",
          "name" : "delegate",
          "url" : "https:\/\/developer.apple.com\/documentation\/AVKit\/AVContinuityDevicePickerViewController\/delegate"
        }
      ],
      "title" : "Designating a delegate"
    },
    {
      "content" : "",
      "items" : [
        {
          "description" : "Adopt the latest features of the redesigned tvOS player user interface to provide a more streamlined way to watch your content.",
          "name" : "Customizing the tvOS Playback Experience",
          "url" : "https:\/\/developer.apple.com\/documentation\/AVKit\/customizing-the-tvos-playback-experience"
        },
        {
          "description" : "Present navigation markers in the Chapters panel to help users quickly navigate your content.",
          "name" : "Presenting Navigation Markers",
          "url" : "https:\/\/developer.apple.com\/documentation\/AVKit\/presenting-navigation-markers"
        },
        {
          "description" : "Present additional content alongside your main media presentation using HTTP Live Streaming support.",
          "name" : "Working with Interstitial Content",
          "url" : "https:\/\/developer.apple.com\/documentation\/AVKit\/working-with-interstitial-content"
        },
        {
          "description" : "Display a preview of an upcoming media item at the conclusion of the currently playing media item.",
          "name" : "Presenting Content Proposals in tvOS",
          "url" : "https:\/\/developer.apple.com\/documentation\/AVKit\/presenting-content-proposals-in-tvos"
        },
        {
          "description" : "Add interactive overlays, parental controls, and livestream channel flipping using a player view controller.",
          "name" : "Working with Overlays and Parental Controls in tvOS",
          "url" : "https:\/\/developer.apple.com\/documentation\/AVKit\/working-with-overlays-and-parental-controls-in-tvos"
        },
        {
          "description" : "Capture high-quality photos, video, and audio in your Apple TV app by connecting an iPhone or iPad as a continuity device.",
          "name" : "Supporting Continuity Camera in your tvOS app",
          "url" : "https:\/\/developer.apple.com\/documentation\/AVKit\/supporting-continuity-camera-in-your-tvos-app"
        },
        {
          "description" : "A view controller that displays content from a player and presents a native user interface to control playback.",
          "name" : "AVPlayerViewController",
          "url" : "https:\/\/developer.apple.com\/documentation\/AVKit\/AVPlayerViewController"
        },
        {
          "description" : "A protocol that defines the methods to implement to respond to player view controller events.",
          "name" : "AVPlayerViewControllerDelegate",
          "url" : "https:\/\/developer.apple.com\/documentation\/AVKit\/AVPlayerViewControllerDelegate"
        },
        {
          "description" : "A time range in an audiovisual presentation for content with an interstitial designation, such as advertisements or legal notices.",
          "name" : "AVInterstitialTimeRange",
          "url" : "https:\/\/developer.apple.com\/documentation\/AVKit\/AVInterstitialTimeRange"
        },
        {
          "description" : "A set of markers for navigating playback of an audiovisual presentation.",
          "name" : "AVNavigationMarkersGroup",
          "url" : "https:\/\/developer.apple.com\/documentation\/AVKit\/AVNavigationMarkersGroup"
        },
        {
          "description" : "A view controller that proposes content to watch next.",
          "name" : "AVContentProposalViewController",
          "url" : "https:\/\/developer.apple.com\/documentation\/AVKit\/AVContentProposalViewController"
        },
        {
          "description" : "A tvOS management object that controls whether a TV switches modes to match the video’s native mode.",
          "name" : "AVDisplayManager",
          "url" : "https:\/\/developer.apple.com\/documentation\/AVKit\/AVDisplayManager"
        },
        {
          "description" : "An interface that responds to events from a continuity device picker view controller.",
          "name" : "AVContinuityDevicePickerViewControllerDelegate",
          "url" : "https:\/\/developer.apple.com\/documentation\/AVKit\/AVContinuityDevicePickerViewControllerDelegate"
        }
      ],
      "title" : "tvOS playback and capture"
    },
    {
      "content" : "",
      "items" : [
        {
          "name" : "UIViewController"
        }
      ],
      "title" : "Inherits From"
    }
  ],
  "source" : "appleJSON",
  "title" : "AVContinuityDevicePickerViewController",
  "url" : "https:\/\/developer.apple.com\/documentation\/AVKit\/AVContinuityDevicePickerViewController"
}