{
  "abstract" : "A data model that provides guidance on when electricity is cleaner and less expensive.",
  "codeExamples" : [

  ],
  "conformsTo" : [
    "Decodable",
    "Encodable",
    "Sendable",
    "SendableMetatype"
  ],
  "contentHash" : "f7d67d11935edf22411b35020592b37f8c7e0194680576008ec7c1027d0077ba",
  "crawledAt" : "2025-12-03T04:09:53Z",
  "declaration" : {
    "code" : "struct ElectricityGuidance",
    "language" : "swift"
  },
  "id" : "97F5D7D2-71B4-418B-A686-3926130ECF00",
  "kind" : "struct",
  "language" : "swift",
  "module" : "EnergyKit",
  "overview" : "## Overview\n\n`ElectricityGuidance` provides information on grid quality and electricity cost, if cost information is available. You can use `ElectricityGuidance` to adjust the electricity consumption of your managed devices to times when electricity is cleaner, and optionally reduce the overall electricity consumption or cost of your managed devices.",
  "platforms" : [
    "iOS",
    "iPadOS",
    "Mac Catalyst"
  ],
  "rawMarkdown" : "---\nsource: https:\/\/developer.apple.com\/documentation\/EnergyKit\/ElectricityGuidance\ncrawled: 2025-12-03T04:09:53Z\n---\n\n# ElectricityGuidance\n\n**Structure**\n\nA data model that provides guidance on when electricity is cleaner and less expensive.\n\n## Declaration\n\n```swift\nstruct ElectricityGuidance\n```\n\n## Overview\n\n`ElectricityGuidance` provides information on grid quality and electricity cost, if cost information is available. You can use `ElectricityGuidance` to adjust the electricity consumption of your managed devices to times when electricity is cleaner, and optionally reduce the overall electricity consumption or cost of your managed devices.\n\n## Getting the electricity guidance data\n\n- **ElectricityGuidance.Service**: An interface for obtaining electricity guidance data.\n- **sharedService**: A single, shared guidance service object.\n\n## Getting the electrical load weight\n\n- **ElectricityGuidance.Value**: A normalized weighting value associated with a period of time, describing when to shift or reduce electricity use.\n- **values**: A series of weighted values for intervals of time, describing when to shift or reduce electricity use.\n- **ElectricityGuidance.Options**: An enumeration that describes additional factors that influence the weight of a value.\n- **options**: The additional factors that influence the weight of a value.\n\n## Identifying the guidance parameters\n\n- **interval**: The time range to which the guidance applies.\n- **energyVenueID**: An identifier for the physical location to which the guidance applies.\n- **guidanceToken**: A unique token for the guidance that you use to create an electrical load event.\n\n## Getting the guidance suggestion\n\n- **ElectricityGuidance.Query**: A structure that encapsulates a electricity guidance query request.\n- **suggestedAction**: A property that describes how the electrical load uses the guidance.\n- **ElectricityGuidance.SuggestedAction**: A description of how the electrical load uses the guidance.\n\n## Conforms To\n\n- Decodable\n- Encodable\n- Sendable\n- SendableMetatype\n\n",
  "sections" : [
    {
      "content" : "",
      "items" : [
        {
          "description" : "An interface for obtaining electricity guidance data.",
          "name" : "ElectricityGuidance.Service",
          "url" : "https:\/\/developer.apple.com\/documentation\/EnergyKit\/ElectricityGuidance\/Service"
        },
        {
          "description" : "A single, shared guidance service object.",
          "name" : "sharedService",
          "url" : "https:\/\/developer.apple.com\/documentation\/EnergyKit\/ElectricityGuidance\/sharedService"
        }
      ],
      "title" : "Getting the electricity guidance data"
    },
    {
      "content" : "",
      "items" : [
        {
          "description" : "A normalized weighting value associated with a period of time, describing when to shift or reduce electricity use.",
          "name" : "ElectricityGuidance.Value",
          "url" : "https:\/\/developer.apple.com\/documentation\/EnergyKit\/ElectricityGuidance\/Value"
        },
        {
          "description" : "A series of weighted values for intervals of time, describing when to shift or reduce electricity use.",
          "name" : "values",
          "url" : "https:\/\/developer.apple.com\/documentation\/EnergyKit\/ElectricityGuidance\/values"
        },
        {
          "description" : "An enumeration that describes additional factors that influence the weight of a value.",
          "name" : "ElectricityGuidance.Options",
          "url" : "https:\/\/developer.apple.com\/documentation\/EnergyKit\/ElectricityGuidance\/Options-swift.enum"
        },
        {
          "description" : "The additional factors that influence the weight of a value.",
          "name" : "options",
          "url" : "https:\/\/developer.apple.com\/documentation\/EnergyKit\/ElectricityGuidance\/options-swift.property"
        }
      ],
      "title" : "Getting the electrical load weight"
    },
    {
      "content" : "",
      "items" : [
        {
          "description" : "The time range to which the guidance applies.",
          "name" : "interval",
          "url" : "https:\/\/developer.apple.com\/documentation\/EnergyKit\/ElectricityGuidance\/interval"
        },
        {
          "description" : "An identifier for the physical location to which the guidance applies.",
          "name" : "energyVenueID",
          "url" : "https:\/\/developer.apple.com\/documentation\/EnergyKit\/ElectricityGuidance\/energyVenueID"
        },
        {
          "description" : "A unique token for the guidance that you use to create an electrical load event.",
          "name" : "guidanceToken",
          "url" : "https:\/\/developer.apple.com\/documentation\/EnergyKit\/ElectricityGuidance\/guidanceToken"
        }
      ],
      "title" : "Identifying the guidance parameters"
    },
    {
      "content" : "",
      "items" : [
        {
          "description" : "A structure that encapsulates a electricity guidance query request.",
          "name" : "ElectricityGuidance.Query",
          "url" : "https:\/\/developer.apple.com\/documentation\/EnergyKit\/ElectricityGuidance\/Query"
        },
        {
          "description" : "A property that describes how the electrical load uses the guidance.",
          "name" : "suggestedAction",
          "url" : "https:\/\/developer.apple.com\/documentation\/EnergyKit\/ElectricityGuidance\/suggestedAction-swift.property"
        },
        {
          "description" : "A description of how the electrical load uses the guidance.",
          "name" : "ElectricityGuidance.SuggestedAction",
          "url" : "https:\/\/developer.apple.com\/documentation\/EnergyKit\/ElectricityGuidance\/SuggestedAction-swift.enum"
        }
      ],
      "title" : "Getting the guidance suggestion"
    }
  ],
  "source" : "appleJSON",
  "title" : "ElectricityGuidance",
  "url" : "https:\/\/developer.apple.com\/documentation\/EnergyKit\/ElectricityGuidance"
}