{
  "abstract" : "A description of the edits made to an asset’s photo, video, or Live Photo content, which allows your app to reconstruct or revert the effects of prior editing sessions.",
  "codeExamples" : [

  ],
  "conformsTo" : [
    "CVarArg",
    "CustomDebugStringConvertible",
    "CustomStringConvertible",
    "Equatable",
    "Hashable",
    "NSObjectProtocol"
  ],
  "contentHash" : "007cff99b0f574a0cf40df308522100c5749f55b64d6a8f7108d185906e7ea0b",
  "crawledAt" : "2025-12-07T18:14:02Z",
  "declaration" : {
    "code" : "class PHAdjustmentData",
    "language" : "swift"
  },
  "id" : "896344FD-68D9-4FF9-874A-2B389763ED2C",
  "kind" : "class",
  "language" : "swift",
  "module" : "Photos",
  "overview" : "## Overview\n\nWhen a user edits an asset, Photos saves a [doc:\/\/com.apple.photokit\/documentation\/Photos\/PHAdjustmentData] object along with the modified image or video data. This object provides an application-defined “recipe” you can use to reconstruct the edit. For example, if your app applies filters to a photo, you might create adjustment data that identifies which filters the user picked, the parameters for each, and the order to apply the filters in. Later, the user can resume working with those filters and parameters by using your app or another app that understands your adjustment data format. When iCloud Photos is enabled, a user can revert or resume edits made on a different device.\n\nYou work with adjustment data when editing an asset, using either the [doc:\/\/com.apple.photokit\/documentation\/Photos\/PHAsset\/requestContentEditingInput(with:completionHandler:)] method or a photo extension view controller that implements the [doc:\/\/com.apple.photokit\/documentation\/PhotosUI\/PHContentEditingController] protocol.\n\nFor each asset, Photos stores only one [doc:\/\/com.apple.photokit\/documentation\/Photos\/PHAdjustmentData] object, representing the **most recent** edit made to the asset’s content.",
  "platforms" : [
    "iOS",
    "iPadOS",
    "Mac Catalyst",
    "macOS",
    "tvOS",
    "visionOS"
  ],
  "rawMarkdown" : "---\nsource: https:\/\/developer.apple.com\/documentation\/Photos\/PHAdjustmentData\ncrawled: 2025-12-07T18:14:02Z\n---\n\n# PHAdjustmentData\n\n**Class**\n\nA description of the edits made to an asset’s photo, video, or Live Photo content, which allows your app to reconstruct or revert the effects of prior editing sessions.\n\n## Declaration\n\n```swift\nclass PHAdjustmentData\n```\n\n## Overview\n\nWhen a user edits an asset, Photos saves a [doc:\/\/com.apple.photokit\/documentation\/Photos\/PHAdjustmentData] object along with the modified image or video data. This object provides an application-defined “recipe” you can use to reconstruct the edit. For example, if your app applies filters to a photo, you might create adjustment data that identifies which filters the user picked, the parameters for each, and the order to apply the filters in. Later, the user can resume working with those filters and parameters by using your app or another app that understands your adjustment data format. When iCloud Photos is enabled, a user can revert or resume edits made on a different device.\n\nYou work with adjustment data when editing an asset, using either the [doc:\/\/com.apple.photokit\/documentation\/Photos\/PHAsset\/requestContentEditingInput(with:completionHandler:)] method or a photo extension view controller that implements the [doc:\/\/com.apple.photokit\/documentation\/PhotosUI\/PHContentEditingController] protocol.\n\n- When you begin an edit (through a [doc:\/\/com.apple.photokit\/documentation\/Photos\/PHContentEditingInput] object), examine the editing input’s [doc:\/\/com.apple.photokit\/documentation\/Photos\/PHContentEditingInput\/adjustmentData] property to decide whether the last edit made to the asset is compatible with your app. If so, you can allow the user to resume working with that edit. If not, you can make further edits to the last saved version of the photo.\n- When you commit an edit (through a [doc:\/\/com.apple.photokit\/documentation\/Photos\/PHContentEditingOutput] object), provide a new adjustment whose data represents the changes your app made.\n\nFor each asset, Photos stores only one [doc:\/\/com.apple.photokit\/documentation\/Photos\/PHAdjustmentData] object, representing the **most recent** edit made to the asset’s content.\n\n## Creating an Adjustment\n\n- **init(formatIdentifier:formatVersion:data:)**: Initializes an adjustment object with the specified format and data.\n\n## Identifying the Format of an Adjustment’s Data\n\n- **formatIdentifier**: A string uniquely identifying the format of the adjustment data.\n- **formatVersion**: A version number for the adjustment data format.\n\n## Reading an Adjustment’s Data\n\n- **data**: Data that contains the information necessary to reconstruct the adjustment.\n\n## Editing an Asset\n\n- **Editing Asset Content**: Make a request to modify and save a photo or video asset.\n- **PHContentEditingInput**: A container that provides information about and access to the image, video, or Live Photo content of an asset to be edited.\n- **PHContentEditingOutput**: A container to which you provide the results of editing the photo, video, or Live Photo content of a Photos asset.\n- **PHContentEditingInputRequestOptions**: A set of options affecting the delivery of image or video data when you request to edit the content of a Photos asset.\n- **PHLivePhotoEditingContext**: An editing session for modifying the photo, video, and audio content of a Live Photo.\n- **PHLivePhotoFrame**: A container that provides image content for a single frame of a Live Photo in an editing context.\n- **canPerform(_:)**: Returns whether the asset supports the specified editing operation.\n- **PHAssetEditOperation**: Values identifying possible actions an asset can support, used by the [doc:\/\/com.apple.photokit\/documentation\/Photos\/PHAsset\/canPerform(_:)] method.\n- **requestContentEditingInput(with:completionHandler:)**: Requests asset information for beginning a content editing session.\n- **cancelContentEditingInputRequest(_:)**: Cancels a request for editing the asset’s content.\n- **PHContentEditingInputRequestID**: An identifier for an asset content editing session.\n- **Editing Request Info Keys**: Keys indicating the status of an asset content editing request, used in the completion handler of the [doc:\/\/com.apple.photokit\/documentation\/Photos\/PHAsset\/requestContentEditingInput(with:completionHandler:)] method.\n\n## Inherits From\n\n- NSObject\n\n## Conforms To\n\n- CVarArg\n- CustomDebugStringConvertible\n- CustomStringConvertible\n- Equatable\n- Hashable\n- NSObjectProtocol\n\n",
  "sections" : [
    {
      "content" : "",
      "items" : [
        {
          "description" : "Initializes an adjustment object with the specified format and data.",
          "name" : "init(formatIdentifier:formatVersion:data:)",
          "url" : "https:\/\/developer.apple.com\/documentation\/Photos\/PHAdjustmentData\/init(formatIdentifier:formatVersion:data:)"
        }
      ],
      "title" : "Creating an Adjustment"
    },
    {
      "content" : "",
      "items" : [
        {
          "description" : "A string uniquely identifying the format of the adjustment data.",
          "name" : "formatIdentifier",
          "url" : "https:\/\/developer.apple.com\/documentation\/Photos\/PHAdjustmentData\/formatIdentifier"
        },
        {
          "description" : "A version number for the adjustment data format.",
          "name" : "formatVersion",
          "url" : "https:\/\/developer.apple.com\/documentation\/Photos\/PHAdjustmentData\/formatVersion"
        }
      ],
      "title" : "Identifying the Format of an Adjustment’s Data"
    },
    {
      "content" : "",
      "items" : [
        {
          "description" : "Data that contains the information necessary to reconstruct the adjustment.",
          "name" : "data",
          "url" : "https:\/\/developer.apple.com\/documentation\/Photos\/PHAdjustmentData\/data"
        }
      ],
      "title" : "Reading an Adjustment’s Data"
    },
    {
      "content" : "",
      "items" : [
        {
          "description" : "Make a request to modify and save a photo or video asset.",
          "name" : "Editing Asset Content",
          "url" : "https:\/\/developer.apple.com\/documentation\/PhotoKit\/editing-asset-content"
        },
        {
          "description" : "A container that provides information about and access to the image, video, or Live Photo content of an asset to be edited.",
          "name" : "PHContentEditingInput",
          "url" : "https:\/\/developer.apple.com\/documentation\/Photos\/PHContentEditingInput"
        },
        {
          "description" : "A container to which you provide the results of editing the photo, video, or Live Photo content of a Photos asset.",
          "name" : "PHContentEditingOutput",
          "url" : "https:\/\/developer.apple.com\/documentation\/Photos\/PHContentEditingOutput"
        },
        {
          "description" : "A set of options affecting the delivery of image or video data when you request to edit the content of a Photos asset.",
          "name" : "PHContentEditingInputRequestOptions",
          "url" : "https:\/\/developer.apple.com\/documentation\/Photos\/PHContentEditingInputRequestOptions"
        },
        {
          "description" : "An editing session for modifying the photo, video, and audio content of a Live Photo.",
          "name" : "PHLivePhotoEditingContext",
          "url" : "https:\/\/developer.apple.com\/documentation\/Photos\/PHLivePhotoEditingContext"
        },
        {
          "description" : "A container that provides image content for a single frame of a Live Photo in an editing context.",
          "name" : "PHLivePhotoFrame",
          "url" : "https:\/\/developer.apple.com\/documentation\/Photos\/PHLivePhotoFrame"
        },
        {
          "description" : "Returns whether the asset supports the specified editing operation.",
          "name" : "canPerform(_:)",
          "url" : "https:\/\/developer.apple.com\/documentation\/Photos\/PHAsset\/canPerform(_:)"
        },
        {
          "description" : "Values identifying possible actions an asset can support, used by the [doc:\/\/com.apple.photokit\/documentation\/Photos\/PHAsset\/canPerform(_:)] method.",
          "name" : "PHAssetEditOperation",
          "url" : "https:\/\/developer.apple.com\/documentation\/Photos\/PHAssetEditOperation"
        },
        {
          "description" : "Requests asset information for beginning a content editing session.",
          "name" : "requestContentEditingInput(with:completionHandler:)",
          "url" : "https:\/\/developer.apple.com\/documentation\/Photos\/PHAsset\/requestContentEditingInput(with:completionHandler:)"
        },
        {
          "description" : "Cancels a request for editing the asset’s content.",
          "name" : "cancelContentEditingInputRequest(_:)",
          "url" : "https:\/\/developer.apple.com\/documentation\/Photos\/PHAsset\/cancelContentEditingInputRequest(_:)"
        },
        {
          "description" : "An identifier for an asset content editing session.",
          "name" : "PHContentEditingInputRequestID",
          "url" : "https:\/\/developer.apple.com\/documentation\/Photos\/PHContentEditingInputRequestID"
        },
        {
          "description" : "Keys indicating the status of an asset content editing request, used in the completion handler of the [doc:\/\/com.apple.photokit\/documentation\/Photos\/PHAsset\/requestContentEditingInput(with:completionHandler:)] method.",
          "name" : "Editing Request Info Keys",
          "url" : "https:\/\/developer.apple.com\/documentation\/PhotoKit\/editing-request-info-keys"
        }
      ],
      "title" : "Editing an Asset"
    },
    {
      "content" : "",
      "items" : [
        {
          "name" : "NSObject"
        }
      ],
      "title" : "Inherits From"
    }
  ],
  "source" : "appleJSON",
  "title" : "PHAdjustmentData",
  "url" : "https:\/\/developer.apple.com\/documentation\/Photos\/PHAdjustmentData"
}