{
  "abstract" : "A request to create, delete, or modify a Photos collection list, for use in a photo library change block.",
  "codeExamples" : [

  ],
  "conformsTo" : [
    "CVarArg",
    "CustomDebugStringConvertible",
    "CustomStringConvertible",
    "Equatable",
    "Hashable",
    "NSObjectProtocol"
  ],
  "contentHash" : "ece6dd5c31c8a6d4a5c43250fbe59a220bed1a1e52ec99534b35799ba6bedf0c",
  "crawledAt" : "2025-12-03T04:51:40Z",
  "declaration" : {
    "code" : "class PHCollectionListChangeRequest",
    "language" : "swift"
  },
  "id" : "F8817DA2-4D13-4E40-BD10-381966EADDD2",
  "kind" : "class",
  "language" : "swift",
  "module" : "Photos",
  "overview" : "## Overview\n\nYou use the [doc:\/\/com.apple.photokit\/documentation\/Photos\/PHCollectionListChangeRequest] class to request changes for [doc:\/\/com.apple.photokit\/documentation\/Photos\/PHCollectionList] objects. To make changes to collection lists (such as folders containing user-created albums) in the Photos library, create a change request using the appropriate class method for the change you want to perform.\n\nBefore creating a change request, use the [doc:\/\/com.apple.photokit\/documentation\/Photos\/PHCollection\/canPerform(_:)] method to verify that the collection allows the edit operation you’re requesting. If you attempt to perform an unsupported edit operation, Photos throws an exception.\n\nA change request for creating or modifying a collection list works like a mutable version of the collection list object. Use the change request’s properties and instance methods to request changes to the collection list itself. For example, the following code removes an album from a folder.\n\nAfter Photos runs the change block and calls your completion handler, the collection list’s state reflects the changes you requested in the block.\n\nIf you create or use a change request object outside a photo library change block, Photos raises an Objective-C exception. For details on change blocks, see [doc:\/\/com.apple.photokit\/documentation\/Photos\/PHPhotoLibrary].",
  "platforms" : [
    "iOS",
    "iPadOS",
    "Mac Catalyst",
    "macOS",
    "tvOS",
    "visionOS"
  ],
  "rawMarkdown" : "---\nsource: https:\/\/developer.apple.com\/documentation\/Photos\/PHCollectionListChangeRequest\ncrawled: 2025-12-03T04:51:40Z\n---\n\n# PHCollectionListChangeRequest\n\n**Class**\n\nA request to create, delete, or modify a Photos collection list, for use in a photo library change block.\n\n## Declaration\n\n```swift\nclass PHCollectionListChangeRequest\n```\n\n## Overview\n\nYou use the [doc:\/\/com.apple.photokit\/documentation\/Photos\/PHCollectionListChangeRequest] class to request changes for [doc:\/\/com.apple.photokit\/documentation\/Photos\/PHCollectionList] objects. To make changes to collection lists (such as folders containing user-created albums) in the Photos library, create a change request using the appropriate class method for the change you want to perform.\n\n- Call the [doc:\/\/com.apple.photokit\/documentation\/Photos\/PHCollectionListChangeRequest\/creationRequestForCollectionList(withTitle:)] method to create a new asset collection.\n- Call the [doc:\/\/com.apple.photokit\/documentation\/Photos\/PHCollectionListChangeRequest\/deleteCollectionLists(_:)] method to delete existing asset collections.\n- Call the [doc:\/\/com.apple.photokit\/documentation\/Photos\/PHCollectionListChangeRequest\/init(for:)] or [doc:\/\/com.apple.photokit\/documentation\/Photos\/PHCollectionListChangeRequest\/init(for:childCollections:)] method to modify a collection’s metadata or its list of child collections.\n\nBefore creating a change request, use the [doc:\/\/com.apple.photokit\/documentation\/Photos\/PHCollection\/canPerform(_:)] method to verify that the collection allows the edit operation you’re requesting. If you attempt to perform an unsupported edit operation, Photos throws an exception.\n\nA change request for creating or modifying a collection list works like a mutable version of the collection list object. Use the change request’s properties and instance methods to request changes to the collection list itself. For example, the following code removes an album from a folder.\n\n\n\nAfter Photos runs the change block and calls your completion handler, the collection list’s state reflects the changes you requested in the block.\n\nIf you create or use a change request object outside a photo library change block, Photos raises an Objective-C exception. For details on change blocks, see [doc:\/\/com.apple.photokit\/documentation\/Photos\/PHPhotoLibrary].\n\n## Creating a Change Request\n\n- **init(for:)**: Creates a request for modifying the specified collection list.\n- **init(for:childCollections:)**: Creates a request for modifying the specified collection list, with a fetch result for tracking changes.\n- **init(forTopLevelCollectionListUserCollections:)**: Creates a request to add, remove, or rearrange child collections in the top-level collection list.\n\n## Managing Collection Lists\n\n- **creationRequestForCollectionList(withTitle:)**: Creates a request for adding a new collection list to the Photos library.\n- **placeholderForCreatedCollectionList**: A placeholder object for the collection list that the change request creates.\n- **deleteCollectionLists(_:)**: Requests to delete the specified asset collections.\n\n## Managing Collections\n\n- **addChildCollections(_:)**: Adds the specified collections as children of the collection list.\n- **insertChildCollections(_:at:)**: Inserts the specified collections into the collection list at the specified indexes.\n- **moveChildCollections(at:to:)**: Moves the child collections at the specified indexes in the collection list to a new index.\n- **replaceChildCollections(at:withChildCollections:)**: Replaces the child collections at the specified indexes in the collection list with the specified collections.\n- **removeChildCollections(_:)**: Removes the specified child collections from the collection list.\n- **removeChildCollections(at:)**: Removes the child collections at the specified indexes from the collection list.\n\n## Inspecting the Request\n\n- **title**: The displayed name of the collection list.\n\n## Updating the Library\n\n- **Requesting Changes to the Photo Library**: Create, delete, or modify assets and collections in a photo library by making change requests.\n- **performChanges(_:completionHandler:)**: Asynchronously runs a block that requests changes to the photo library.\n- **performChangesAndWait(_:)**: Synchronously runs a block that requests changes to be performed in the photo library.\n- **PHChangeRequest**: The abstract base class of the framework’s photo library change requests.\n- **PHAssetChangeRequest**: A request to create, delete, change metadata for, or edit the content of a Photos asset, for use in a photo library change block.\n- **PHAssetCollectionChangeRequest**: A request to create, delete, or modify a Photos asset collection, for use in a photo library change block.\n- **PHObjectPlaceholder**: A read-only proxy object that represents a Photos asset or collection to create.\n\n## Inherits From\n\n- PHChangeRequest\n\n## Conforms To\n\n- CVarArg\n- CustomDebugStringConvertible\n- CustomStringConvertible\n- Equatable\n- Hashable\n- NSObjectProtocol\n\n",
  "sections" : [
    {
      "content" : "",
      "items" : [
        {
          "description" : "Creates a request for modifying the specified collection list.",
          "name" : "init(for:)",
          "url" : "https:\/\/developer.apple.com\/documentation\/Photos\/PHCollectionListChangeRequest\/init(for:)"
        },
        {
          "description" : "Creates a request for modifying the specified collection list, with a fetch result for tracking changes.",
          "name" : "init(for:childCollections:)",
          "url" : "https:\/\/developer.apple.com\/documentation\/Photos\/PHCollectionListChangeRequest\/init(for:childCollections:)"
        },
        {
          "description" : "Creates a request to add, remove, or rearrange child collections in the top-level collection list.",
          "name" : "init(forTopLevelCollectionListUserCollections:)",
          "url" : "https:\/\/developer.apple.com\/documentation\/Photos\/PHCollectionListChangeRequest\/init(forTopLevelCollectionListUserCollections:)"
        }
      ],
      "title" : "Creating a Change Request"
    },
    {
      "content" : "",
      "items" : [
        {
          "description" : "Creates a request for adding a new collection list to the Photos library.",
          "name" : "creationRequestForCollectionList(withTitle:)",
          "url" : "https:\/\/developer.apple.com\/documentation\/Photos\/PHCollectionListChangeRequest\/creationRequestForCollectionList(withTitle:)"
        },
        {
          "description" : "A placeholder object for the collection list that the change request creates.",
          "name" : "placeholderForCreatedCollectionList",
          "url" : "https:\/\/developer.apple.com\/documentation\/Photos\/PHCollectionListChangeRequest\/placeholderForCreatedCollectionList"
        },
        {
          "description" : "Requests to delete the specified asset collections.",
          "name" : "deleteCollectionLists(_:)",
          "url" : "https:\/\/developer.apple.com\/documentation\/Photos\/PHCollectionListChangeRequest\/deleteCollectionLists(_:)"
        }
      ],
      "title" : "Managing Collection Lists"
    },
    {
      "content" : "",
      "items" : [
        {
          "description" : "Adds the specified collections as children of the collection list.",
          "name" : "addChildCollections(_:)",
          "url" : "https:\/\/developer.apple.com\/documentation\/Photos\/PHCollectionListChangeRequest\/addChildCollections(_:)"
        },
        {
          "description" : "Inserts the specified collections into the collection list at the specified indexes.",
          "name" : "insertChildCollections(_:at:)",
          "url" : "https:\/\/developer.apple.com\/documentation\/Photos\/PHCollectionListChangeRequest\/insertChildCollections(_:at:)"
        },
        {
          "description" : "Moves the child collections at the specified indexes in the collection list to a new index.",
          "name" : "moveChildCollections(at:to:)",
          "url" : "https:\/\/developer.apple.com\/documentation\/Photos\/PHCollectionListChangeRequest\/moveChildCollections(at:to:)"
        },
        {
          "description" : "Replaces the child collections at the specified indexes in the collection list with the specified collections.",
          "name" : "replaceChildCollections(at:withChildCollections:)",
          "url" : "https:\/\/developer.apple.com\/documentation\/Photos\/PHCollectionListChangeRequest\/replaceChildCollections(at:withChildCollections:)"
        },
        {
          "description" : "Removes the specified child collections from the collection list.",
          "name" : "removeChildCollections(_:)",
          "url" : "https:\/\/developer.apple.com\/documentation\/Photos\/PHCollectionListChangeRequest\/removeChildCollections(_:)"
        },
        {
          "description" : "Removes the child collections at the specified indexes from the collection list.",
          "name" : "removeChildCollections(at:)",
          "url" : "https:\/\/developer.apple.com\/documentation\/Photos\/PHCollectionListChangeRequest\/removeChildCollections(at:)"
        }
      ],
      "title" : "Managing Collections"
    },
    {
      "content" : "",
      "items" : [
        {
          "description" : "The displayed name of the collection list.",
          "name" : "title",
          "url" : "https:\/\/developer.apple.com\/documentation\/Photos\/PHCollectionListChangeRequest\/title"
        }
      ],
      "title" : "Inspecting the Request"
    },
    {
      "content" : "",
      "items" : [
        {
          "description" : "Create, delete, or modify assets and collections in a photo library by making change requests.",
          "name" : "Requesting Changes to the Photo Library",
          "url" : "https:\/\/developer.apple.com\/documentation\/PhotoKit\/requesting-changes-to-the-photo-library"
        },
        {
          "description" : "Asynchronously runs a block that requests changes to the photo library.",
          "name" : "performChanges(_:completionHandler:)",
          "url" : "https:\/\/developer.apple.com\/documentation\/Photos\/PHPhotoLibrary\/performChanges(_:completionHandler:)"
        },
        {
          "description" : "Synchronously runs a block that requests changes to be performed in the photo library.",
          "name" : "performChangesAndWait(_:)",
          "url" : "https:\/\/developer.apple.com\/documentation\/Photos\/PHPhotoLibrary\/performChangesAndWait(_:)"
        },
        {
          "description" : "The abstract base class of the framework’s photo library change requests.",
          "name" : "PHChangeRequest",
          "url" : "https:\/\/developer.apple.com\/documentation\/Photos\/PHChangeRequest"
        },
        {
          "description" : "A request to create, delete, change metadata for, or edit the content of a Photos asset, for use in a photo library change block.",
          "name" : "PHAssetChangeRequest",
          "url" : "https:\/\/developer.apple.com\/documentation\/Photos\/PHAssetChangeRequest"
        },
        {
          "description" : "A request to create, delete, or modify a Photos asset collection, for use in a photo library change block.",
          "name" : "PHAssetCollectionChangeRequest",
          "url" : "https:\/\/developer.apple.com\/documentation\/Photos\/PHAssetCollectionChangeRequest"
        },
        {
          "description" : "A read-only proxy object that represents a Photos asset or collection to create.",
          "name" : "PHObjectPlaceholder",
          "url" : "https:\/\/developer.apple.com\/documentation\/Photos\/PHObjectPlaceholder"
        }
      ],
      "title" : "Updating the Library"
    },
    {
      "content" : "",
      "items" : [
        {
          "name" : "PHChangeRequest"
        }
      ],
      "title" : "Inherits From"
    }
  ],
  "source" : "appleJSON",
  "title" : "PHCollectionListChangeRequest",
  "url" : "https:\/\/developer.apple.com\/documentation\/Photos\/PHCollectionListChangeRequest"
}