{
  "abstract" : "Builds a partial result by combining an accumulated component and a new component.",
  "codeExamples" : [

  ],
  "contentHash" : "382b1770766a6e38aa03803e6ddd0684ca00b3cc2788692baa36df40c1c37c7f",
  "crawledAt" : "2025-12-03T10:09:25Z",
  "declaration" : {
    "code" : "static func buildPartialBlock(accumulated: some ChartContent, next: some ChartContent) -> some ChartContent\n",
    "language" : "swift"
  },
  "id" : "3D3096E1-6D5E-412B-BF71-095D01CDE40D",
  "kind" : "method",
  "language" : "swift",
  "module" : "Swift Charts",
  "platforms" : [
    "Mac Catalyst"
  ],
  "rawMarkdown" : "---\nsource: https:\/\/developer.apple.com\/documentation\/charts\/chartcontentbuilder\/buildpartialblock(accumulated:next:)\ncrawled: 2025-12-03T10:09:25Z\n---\n\n# buildPartialBlock(accumulated:next:)\n\n**Type Method**\n\nBuilds a partial result by combining an accumulated component and a new component.\n\n## Declaration\n\n```swift\nstatic func buildPartialBlock(accumulated: some ChartContent, next: some ChartContent) -> some ChartContent\n\n```\n\n## Parameters\n\n- **accumulated**: The accumulated result.\n- **next**: The next component to accumulate.\n\n## Building chart content\n\n- **buildPartialBlock(first:)**: Builds a partial result from a single, first component.\n- **buildBlock()**: Produces empty chart content.\n\n",
  "sections" : [
    {
      "content" : "",
      "items" : [
        {
          "description" : "Builds a partial result from a single, first component.",
          "name" : "buildPartialBlock(first:)",
          "url" : "https:\/\/developer.apple.com\/documentation\/Charts\/ChartContentBuilder\/buildPartialBlock(first:)"
        },
        {
          "description" : "Produces empty chart content.",
          "name" : "buildBlock()",
          "url" : "https:\/\/developer.apple.com\/documentation\/Charts\/ChartContentBuilder\/buildBlock()"
        }
      ],
      "title" : "Building chart content"
    }
  ],
  "source" : "appleJSON",
  "title" : "buildPartialBlock(accumulated:next:)",
  "url" : "https:\/\/developer.apple.com\/documentation\/charts\/chartcontentbuilder\/buildpartialblock(accumulated:next:)"
}