{
  "abstract" : "A boolean value that indicates whether an adult, teen, or child is eligible for age gated features.",
  "codeExamples" : [

  ],
  "contentHash" : "00ded61ad50d9510cae68f11293ae07105289ca4a4831aea96a7b934f9a6a010",
  "crawledAt" : "2025-12-02T05:51:48Z",
  "declaration" : {
    "code" : "var isEligibleForAgeFeatures: Bool { get async throws }",
    "language" : "swift"
  },
  "id" : "6E6545F4-D560-45A7-9BA4-BCA30527EA31",
  "kind" : "property",
  "module" : "Declared Age Range",
  "overview" : "## Return Value\n\n`true` if your app is eligible for age gated features; otherwise, `false`.\n\n## Discussion\n\nUse this property to determine whether a person using your app is in an applicable region that requires additional age-related obligations for when you distribute apps on the App Store. For more information, refer to [https:\/\/developer.apple.com\/news\/?id=2ezb6jhj].\n\nThis flag returns `true` on iOS and iPadOS based on a person’s eligibility and always returns `false` on macOS.",
  "platforms" : [
    "iOS",
    "iPadOS",
    "macOS"
  ],
  "rawMarkdown" : "---\nsource: https:\/\/developer.apple.com\/documentation\/DeclaredAgeRange\/AgeRangeService\/isEligibleForAgeFeatures\ncrawled: 2025-12-02T05:51:48Z\n---\n\n# isEligibleForAgeFeatures\n\n**Instance Property**\n\nA boolean value that indicates whether an adult, teen, or child is eligible for age gated features.\n\n## Declaration\n\n```swift\nvar isEligibleForAgeFeatures: Bool { get async throws }\n```\n\n## Return Value\n\n`true` if your app is eligible for age gated features; otherwise, `false`.\n\n## Discussion\n\nUse this property to determine whether a person using your app is in an applicable region that requires additional age-related obligations for when you distribute apps on the App Store. For more information, refer to [https:\/\/developer.apple.com\/news\/?id=2ezb6jhj].\n\nThis flag returns `true` on iOS and iPadOS based on a person’s eligibility and always returns `false` on macOS.\n\n\n\n",
  "sections" : [

  ],
  "source" : "appleJSON",
  "title" : "isEligibleForAgeFeatures",
  "url" : "https:\/\/developer.apple.com\/documentation\/DeclaredAgeRange\/AgeRangeService\/isEligibleForAgeFeatures"
}