{
  "abstract" : "The start date of the task.",
  "codeExamples" : [
    {
      "code" : "NSDateComponents *start = myEKReminder.startDateComponents;\nstart.timeZone = myNSTimeZone;\nmyEKReminder.startDateComponents = start;",
      "language" : "objc"
    }
  ],
  "contentHash" : "256ae563f4c3ce5034ddb156eb6768251ba287ddf40f3d6ccda6cd27db752ce2",
  "crawledAt" : "2025-12-02T17:54:22Z",
  "declaration" : {
    "code" : "var startDateComponents: DateComponents? { get set }",
    "language" : "swift"
  },
  "id" : "A8DBA1D7-AFC2-4968-9148-68A43A4431B2",
  "kind" : "property",
  "language" : "swift",
  "module" : "EventKit",
  "overview" : "## Discussion\n\nThe use of date components allows the start date and its time zone to be represented in a single property. A `nil` time zone represents a floating date. Setting a date component without an hour, minute and second component will set the reminder to be an all-day reminder. If this property is set, the calendar must be set to `NSGregorianCalendar`; otherwise an exception is raised.\n\nThe start date components’s `timeZone` property corresponds to the [doc:\/\/com.apple.eventkit\/documentation\/EventKit\/EKCalendarItem\/timeZone] property on `EKCalendarItem`. A change in one value will cause a change in the other. Setting the time zone directly on the components does not guarantee that your changes will be saved; instead, pull this property from the reminder, set the time zone on it, and assign it back to the reminder:",
  "platforms" : [
    "iOS",
    "iPadOS",
    "Mac Catalyst",
    "macOS",
    "visionOS",
    "watchOS"
  ],
  "rawMarkdown" : "---\nsource: https:\/\/developer.apple.com\/documentation\/EventKit\/EKReminder\/startDateComponents\ncrawled: 2025-12-02T17:54:22Z\n---\n\n# startDateComponents\n\n**Instance Property**\n\nThe start date of the task.\n\n## Declaration\n\n```swift\nvar startDateComponents: DateComponents? { get set }\n```\n\n## Discussion\n\nThe use of date components allows the start date and its time zone to be represented in a single property. A `nil` time zone represents a floating date. Setting a date component without an hour, minute and second component will set the reminder to be an all-day reminder. If this property is set, the calendar must be set to `NSGregorianCalendar`; otherwise an exception is raised.\n\nThe start date components’s `timeZone` property corresponds to the [doc:\/\/com.apple.eventkit\/documentation\/EventKit\/EKCalendarItem\/timeZone] property on `EKCalendarItem`. A change in one value will cause a change in the other. Setting the time zone directly on the components does not guarantee that your changes will be saved; instead, pull this property from the reminder, set the time zone on it, and assign it back to the reminder:\n\n```objc\nNSDateComponents *start = myEKReminder.startDateComponents;\nstart.timeZone = myNSTimeZone;\nmyEKReminder.startDateComponents = start;\n```\n\n## Accessing Reminder Properties\n\n- **EKReminderPriority**: The priority of the reminder.\n- **priority**: The reminder’s priority.\n- **dueDateComponents**: The date by which the reminder should be completed.\n- **isCompleted**: A Boolean value determining whether or not the reminder is marked completed.\n- **completionDate**: The date on which the reminder was completed.\n\n",
  "sections" : [
    {
      "content" : "",
      "items" : [
        {
          "description" : "The priority of the reminder.",
          "name" : "EKReminderPriority",
          "url" : "https:\/\/developer.apple.com\/documentation\/EventKit\/EKReminderPriority"
        },
        {
          "description" : "The reminder’s priority.",
          "name" : "priority",
          "url" : "https:\/\/developer.apple.com\/documentation\/EventKit\/EKReminder\/priority"
        },
        {
          "description" : "The date by which the reminder should be completed.",
          "name" : "dueDateComponents",
          "url" : "https:\/\/developer.apple.com\/documentation\/EventKit\/EKReminder\/dueDateComponents"
        },
        {
          "description" : "A Boolean value determining whether or not the reminder is marked completed.",
          "name" : "isCompleted",
          "url" : "https:\/\/developer.apple.com\/documentation\/EventKit\/EKReminder\/isCompleted"
        },
        {
          "description" : "The date on which the reminder was completed.",
          "name" : "completionDate",
          "url" : "https:\/\/developer.apple.com\/documentation\/EventKit\/EKReminder\/completionDate"
        }
      ],
      "title" : "Accessing Reminder Properties"
    }
  ],
  "source" : "appleJSON",
  "title" : "startDateComponents",
  "url" : "https:\/\/developer.apple.com\/documentation\/EventKit\/EKReminder\/startDateComponents"
}