{
  "abstract" : "A type you use to discover the app extensions available for your host app to use.",
  "codeExamples" : [
    {
      "code" : "let someExtensionPoint = AppExtensionPoint.myExampleExtensionPoint\n\n\/\/ Get a snapshot of available extensions.\nlet identitiesSnapshot = try await AppExtensionPoint.Monitor(someExtensionPoint).identities"
    },
    {
      "code" : "let monitor = AppExtensionPoint.Monitor(appExtensionPoint:someExtensionPoint)\n\nlet identitiesUpdates = Observations { monitor.identities }\nTask {\n  for await update in identitiesUpdates {\n    \/\/ Handle update.\n  }\n}"
    }
  ],
  "conformsTo" : [
    "Copyable",
    "Observable",
    "Sendable",
    "SendableMetatype"
  ],
  "contentHash" : "565d085cfefecdb5975187bdb0d93cc1265ef720226172766a3fdf2a2a03547c",
  "crawledAt" : "2025-12-04T01:39:43Z",
  "declaration" : {
    "code" : "final class Monitor",
    "language" : "swift"
  },
  "id" : "65FDBC0F-A8A6-4DC4-9D48-025028E8A146",
  "kind" : "class",
  "language" : "swift",
  "module" : "ExtensionFoundation",
  "overview" : "## Overview\n\nA host app uses this type to discover the app extensions that are ready for it to use. This type provides both a static list of current extensions and a way for you to monitor changes in app extension availability. You can use items from this list to instantiate an [doc:\/\/com.apple.extensionfoundation\/documentation\/ExtensionFoundation\/AppExtensionProcess] type when you’re ready to run the app extension’s code.\n\nCreate a `Monitor` in your code and configure it with the extension points you want to track. When you add an extension point to the monitor, the type adds the associated app extensions to its [doc:\/\/com.apple.extensionfoundation\/documentation\/ExtensionFoundation\/AppExtensionPoint\/Monitor\/identities] property. The property contains only the app extensions that are available for your app to use, and doesn’t include disabled or unapproved app extensions. The following example shows how to use the currently available app extensions for one of the app’s defined extension points.\n\nThe system manages the list of installed app extensions and updates that list when someone installs or removes an app. The device owner must also approve any newly installed extensions before apps can use them. While your app runs, you can observe the [doc:\/\/com.apple.extensionfoundation\/documentation\/ExtensionFoundation\/AppExtensionPoint\/Monitor\/identities] property and respond to these changes asynchronously. The following code creates a task to wait on changes to the list of identities:\n\nTo present a UI with the list of enabled and disabled app extensions, use the [doc:\/\/com.apple.documentation\/documentation\/ExtensionKit\/EXAppExtensionBrowserViewController] type.",
  "platforms" : [
    "iOS",
    "iPadOS",
    "Mac Catalyst",
    "macOS",
    "tvOS",
    "visionOS",
    "watchOS"
  ],
  "rawMarkdown" : "---\nsource: https:\/\/developer.apple.com\/documentation\/ExtensionFoundation\/AppExtensionPoint\/Monitor\ncrawled: 2025-12-04T01:39:43Z\n---\n\n# AppExtensionPoint.Monitor\n\n**Class**\n\nA type you use to discover the app extensions available for your host app to use.\n\n## Declaration\n\n```swift\nfinal class Monitor\n```\n\n## Overview\n\nA host app uses this type to discover the app extensions that are ready for it to use. This type provides both a static list of current extensions and a way for you to monitor changes in app extension availability. You can use items from this list to instantiate an [doc:\/\/com.apple.extensionfoundation\/documentation\/ExtensionFoundation\/AppExtensionProcess] type when you’re ready to run the app extension’s code.\n\nCreate a `Monitor` in your code and configure it with the extension points you want to track. When you add an extension point to the monitor, the type adds the associated app extensions to its [doc:\/\/com.apple.extensionfoundation\/documentation\/ExtensionFoundation\/AppExtensionPoint\/Monitor\/identities] property. The property contains only the app extensions that are available for your app to use, and doesn’t include disabled or unapproved app extensions. The following example shows how to use the currently available app extensions for one of the app’s defined extension points.\n\n```\nlet someExtensionPoint = AppExtensionPoint.myExampleExtensionPoint\n\n\/\/ Get a snapshot of available extensions.\nlet identitiesSnapshot = try await AppExtensionPoint.Monitor(someExtensionPoint).identities\n```\n\nThe system manages the list of installed app extensions and updates that list when someone installs or removes an app. The device owner must also approve any newly installed extensions before apps can use them. While your app runs, you can observe the [doc:\/\/com.apple.extensionfoundation\/documentation\/ExtensionFoundation\/AppExtensionPoint\/Monitor\/identities] property and respond to these changes asynchronously. The following code creates a task to wait on changes to the list of identities:\n\n```\nlet monitor = AppExtensionPoint.Monitor(appExtensionPoint:someExtensionPoint)\n\nlet identitiesUpdates = Observations { monitor.identities }\nTask {\n  for await update in identitiesUpdates {\n    \/\/ Handle update.\n  }\n}\n```\n\nTo present a UI with the list of enabled and disabled app extensions, use the [doc:\/\/com.apple.documentation\/documentation\/ExtensionKit\/EXAppExtensionBrowserViewController] type.\n\n## Creating a monitor\n\n- **init()**: Creates a new monitor without any extension points.\n- **init(appExtensionPoint:)**: Creates a new monitor and configures it with the specified extension point.\n\n## Adding and removing extension points\n\n- **addAppExtensionPoint(_:)**: Begins the tracking of app extensions that support the specified extension point.\n- **removeAppExtensionPoint(_:)**: Removes the specified extension point and stops tracking the associated app extensions.\n\n## Getting the available app extensions\n\n- **identities**: The app extensions currently available to use with the monitored extension points.\n\n## Getting the monitor state\n\n- **state**: The current details about the available, disabled, and unapproved extensions.\n- **AppExtensionPoint.Monitor.State**: A type that contains a snapshot of a monitor’s state information.\n\n## Conforms To\n\n- Copyable\n- Observable\n- Sendable\n- SendableMetatype\n\n",
  "sections" : [
    {
      "content" : "",
      "items" : [
        {
          "description" : "Creates a new monitor without any extension points.",
          "name" : "init()",
          "url" : "https:\/\/developer.apple.com\/documentation\/ExtensionFoundation\/AppExtensionPoint\/Monitor\/init()"
        },
        {
          "description" : "Creates a new monitor and configures it with the specified extension point.",
          "name" : "init(appExtensionPoint:)",
          "url" : "https:\/\/developer.apple.com\/documentation\/ExtensionFoundation\/AppExtensionPoint\/Monitor\/init(appExtensionPoint:)"
        }
      ],
      "title" : "Creating a monitor"
    },
    {
      "content" : "",
      "items" : [
        {
          "description" : "Begins the tracking of app extensions that support the specified extension point.",
          "name" : "addAppExtensionPoint(_:)",
          "url" : "https:\/\/developer.apple.com\/documentation\/ExtensionFoundation\/AppExtensionPoint\/Monitor\/addAppExtensionPoint(_:)"
        },
        {
          "description" : "Removes the specified extension point and stops tracking the associated app extensions.",
          "name" : "removeAppExtensionPoint(_:)",
          "url" : "https:\/\/developer.apple.com\/documentation\/ExtensionFoundation\/AppExtensionPoint\/Monitor\/removeAppExtensionPoint(_:)"
        }
      ],
      "title" : "Adding and removing extension points"
    },
    {
      "content" : "",
      "items" : [
        {
          "description" : "The app extensions currently available to use with the monitored extension points.",
          "name" : "identities",
          "url" : "https:\/\/developer.apple.com\/documentation\/ExtensionFoundation\/AppExtensionPoint\/Monitor\/identities"
        }
      ],
      "title" : "Getting the available app extensions"
    },
    {
      "content" : "",
      "items" : [
        {
          "description" : "The current details about the available, disabled, and unapproved extensions.",
          "name" : "state",
          "url" : "https:\/\/developer.apple.com\/documentation\/ExtensionFoundation\/AppExtensionPoint\/Monitor\/state-swift.property"
        },
        {
          "description" : "A type that contains a snapshot of a monitor’s state information.",
          "name" : "AppExtensionPoint.Monitor.State",
          "url" : "https:\/\/developer.apple.com\/documentation\/ExtensionFoundation\/AppExtensionPoint\/Monitor\/State-swift.struct"
        }
      ],
      "title" : "Getting the monitor state"
    }
  ],
  "source" : "appleJSON",
  "title" : "AppExtensionPoint.Monitor",
  "url" : "https:\/\/developer.apple.com\/documentation\/ExtensionFoundation\/AppExtensionPoint\/Monitor"
}