{
  "abstract" : "A Boolean value indicating whether titles and subtitles are displayed when a lockup view isn’t in focus.",
  "codeExamples" : [

  ],
  "contentHash" : "b1b1ac76c701790a729fac4a7b4e7ae6b3402eb87cb58390a9e93eaf9a495247",
  "crawledAt" : "2025-12-04T09:31:53Z",
  "declaration" : {
    "code" : "@MainActor var showsOnlyWhenAncestorFocused: Bool { get set }",
    "language" : "swift"
  },
  "id" : "9C284578-CFEB-4B17-A23B-58170504310F",
  "kind" : "property",
  "language" : "swift",
  "module" : "TVUIKit",
  "overview" : "## Discussion\n\nSet this value to `FALSE` to display header and footer information while the lockup view is not in focus. Header and footer information is always shown when a lockup view is in focus, regardless of this property’s value.",
  "platforms" : [
    "tvOS"
  ],
  "rawMarkdown" : "---\nsource: https:\/\/developer.apple.com\/documentation\/TVUIKit\/TVLockupHeaderFooterView\/showsOnlyWhenAncestorFocused\ncrawled: 2025-12-04T09:31:53Z\n---\n\n# showsOnlyWhenAncestorFocused\n\n**Instance Property**\n\nA Boolean value indicating whether titles and subtitles are displayed when a lockup view isn’t in focus.\n\n## Declaration\n\n```swift\n@MainActor var showsOnlyWhenAncestorFocused: Bool { get set }\n```\n\n## Discussion\n\nSet this value to `FALSE` to display header and footer information while the lockup view is not in focus. Header and footer information is always shown when a lockup view is in focus, regardless of this property’s value.\n\n",
  "sections" : [

  ],
  "source" : "appleJSON",
  "title" : "showsOnlyWhenAncestorFocused",
  "url" : "https:\/\/developer.apple.com\/documentation\/TVUIKit\/TVLockupHeaderFooterView\/showsOnlyWhenAncestorFocused"
}