{
  "abstract" : "The edge insets of the cell mask.",
  "codeExamples" : [

  ],
  "contentHash" : "a88fec80a72a647b87a2a0efa1e1c48d58654d294e1d7a539f477dbdabd1719f",
  "crawledAt" : "2025-12-02T21:12:55Z",
  "declaration" : {
    "code" : "@MainActor var maskInset: UIEdgeInsets { get set }",
    "language" : "swift"
  },
  "id" : "81635BA9-1236-42F6-80BB-A9EDEE174F86",
  "kind" : "property",
  "language" : "swift",
  "module" : "TVUIKit",
  "overview" : "## Discussion\n\nUse the `maskInset` property to create a mask around the cell that is only revealed when the cell is brought into focus.\n\nThe default value of this property is `UIEdgeInsetsMake(32.0, 120.0, 0.0, 120.0)`.",
  "platforms" : [
    "tvOS"
  ],
  "rawMarkdown" : "---\nsource: https:\/\/developer.apple.com\/documentation\/TVUIKit\/TVCollectionViewFullScreenLayout\/maskInset\ncrawled: 2025-12-02T21:12:55Z\n---\n\n# maskInset\n\n**Instance Property**\n\nThe edge insets of the cell mask.\n\n## Declaration\n\n```swift\n@MainActor var maskInset: UIEdgeInsets { get set }\n```\n\n## Discussion\n\nUse the `maskInset` property to create a mask around the cell that is only revealed when the cell is brought into focus.\n\nThe default value of this property is `UIEdgeInsetsMake(32.0, 120.0, 0.0, 120.0)`.\n\n## Configuring cell masks\n\n- **maskAmount**: The amount by which to mask the cells in a collection view.\n\n",
  "sections" : [
    {
      "content" : "",
      "items" : [
        {
          "description" : "The amount by which to mask the cells in a collection view.",
          "name" : "maskAmount",
          "url" : "https:\/\/developer.apple.com\/documentation\/TVUIKit\/TVCollectionViewFullScreenLayout\/maskAmount"
        }
      ],
      "title" : "Configuring cell masks"
    }
  ],
  "source" : "appleJSON",
  "title" : "maskInset",
  "url" : "https:\/\/developer.apple.com\/documentation\/TVUIKit\/TVCollectionViewFullScreenLayout\/maskInset"
}