{
  "abstract" : "Removes a display configuration change observer.",
  "codeExamples" : [

  ],
  "contentHash" : "eadb190cd472034c1c962d9de5b21d4272a27acb75480354a5bf338635a7c7e6",
  "crawledAt" : "2025-12-05T12:08:31Z",
  "declaration" : {
    "code" : "func removeObserver(_ observer: any VZGraphicsDisplayObserver)",
    "language" : "swift"
  },
  "id" : "D76C3300-B3A4-4945-B8BD-1DF9D73E4A51",
  "kind" : "method",
  "language" : "swift",
  "module" : "Virtualization",
  "platforms" : [
    "macOS"
  ],
  "rawMarkdown" : "---\nsource: https:\/\/developer.apple.com\/documentation\/Virtualization\/VZGraphicsDisplay\/removeObserver(_:)\ncrawled: 2025-12-05T12:08:31Z\n---\n\n# removeObserver(_:)\n\n**Instance Method**\n\nRemoves a display configuration change observer.\n\n## Declaration\n\n```swift\nfunc removeObserver(_ observer: any VZGraphicsDisplayObserver)\n```\n\n## Parameters\n\n- **observer**: The observer to remove from notifications about display configuration changes.\n\n## Observing changes to the display configuration\n\n- **addObserver(_:)**: Adds an observer to notify about display configuration changes.\n- **VZGraphicsDisplayObserver**: A protocol you implement to observe state changes in graphic displays.\n\n",
  "sections" : [
    {
      "content" : "",
      "items" : [
        {
          "description" : "Adds an observer to notify about display configuration changes.",
          "name" : "addObserver(_:)",
          "url" : "https:\/\/developer.apple.com\/documentation\/Virtualization\/VZGraphicsDisplay\/addObserver(_:)"
        },
        {
          "description" : "A protocol you implement to observe state changes in graphic displays.",
          "name" : "VZGraphicsDisplayObserver",
          "url" : "https:\/\/developer.apple.com\/documentation\/Virtualization\/VZGraphicsDisplayObserver"
        }
      ],
      "title" : "Observing changes to the display configuration"
    }
  ],
  "source" : "appleJSON",
  "title" : "removeObserver(_:)",
  "url" : "https:\/\/developer.apple.com\/documentation\/Virtualization\/VZGraphicsDisplay\/removeObserver(_:)"
}