{
  "abstract" : "Creates a block device configuration object that uses the specified storage medium.",
  "codeExamples" : [

  ],
  "contentHash" : "fd2ea4a21b8c6d55faacfbfe789c90d9db59c52fb8ec9e84d1600b90ac709528",
  "crawledAt" : "2025-12-05T13:39:00Z",
  "declaration" : {
    "code" : "init(attachment: VZStorageDeviceAttachment)",
    "language" : "swift"
  },
  "id" : "04FFC42D-65FF-44C6-84A8-2FE68FA8E96A",
  "kind" : "unknown",
  "language" : "swift",
  "module" : "Virtualization",
  "overview" : "## Return Value\n\nA block storage device configuration object to include in your virtual machine’s configuration.",
  "platforms" : [
    "macOS"
  ],
  "rawMarkdown" : "---\nsource: https:\/\/developer.apple.com\/documentation\/Virtualization\/VZVirtioBlockDeviceConfiguration\/init(attachment:)\ncrawled: 2025-12-05T13:39:00Z\n---\n\n# init(attachment:)\n\n**Initializer**\n\nCreates a block device configuration object that uses the specified storage medium.\n\n## Declaration\n\n```swift\ninit(attachment: VZStorageDeviceAttachment)\n```\n\n## Parameters\n\n- **attachment**: The attachment object that provides the storage for the device. For example, specify a [doc:\/\/com.apple.virtualization\/documentation\/Virtualization\/VZDiskImageStorageDeviceAttachment] object to implement the storage using a local disk image on the host computer.\n\n## Return Value\n\nA block storage device configuration object to include in your virtual machine’s configuration.\n\n",
  "sections" : [

  ],
  "source" : "appleJSON",
  "title" : "init(attachment:)",
  "url" : "https:\/\/developer.apple.com\/documentation\/Virtualization\/VZVirtioBlockDeviceConfiguration\/init(attachment:)"
}