{
  "abstract" : "The number of CPUs you make available to the guest operating system.",
  "codeExamples" : [

  ],
  "contentHash" : "65e8bbf6ca21e840e1024482f5bc39b101ac9afad76219369b376cd969bc67ac",
  "crawledAt" : "2025-12-01T22:41:35Z",
  "declaration" : {
    "code" : "var cpuCount: Int { get set }",
    "language" : "swift"
  },
  "id" : "1EF65B5B-8E40-4263-BEBD-73F24AEEF240",
  "kind" : "property",
  "module" : "Virtualization",
  "overview" : "## Discussion\n\nThe value of this property must be greater than or equal to the value in [doc:\/\/com.apple.virtualization\/documentation\/Virtualization\/VZVirtualMachineConfiguration\/minimumAllowedCPUCount], and less than or equal to the value in [doc:\/\/com.apple.virtualization\/documentation\/Virtualization\/VZVirtualMachineConfiguration\/maximumAllowedCPUCount]. The system uses the number of physical CPUs on the current system to determine a default value.",
  "platforms" : [
    "macOS"
  ],
  "rawMarkdown" : "---\nsource: https:\/\/developer.apple.com\/documentation\/Virtualization\/VZVirtualMachineConfiguration\/cpuCount\ncrawled: 2025-12-01T22:41:35Z\n---\n\n# cpuCount\n\n**Instance Property**\n\nThe number of CPUs you make available to the guest operating system.\n\n## Declaration\n\n```swift\nvar cpuCount: Int { get set }\n```\n\n## Discussion\n\nThe value of this property must be greater than or equal to the value in [doc:\/\/com.apple.virtualization\/documentation\/Virtualization\/VZVirtualMachineConfiguration\/minimumAllowedCPUCount], and less than or equal to the value in [doc:\/\/com.apple.virtualization\/documentation\/Virtualization\/VZVirtualMachineConfiguration\/maximumAllowedCPUCount]. The system uses the number of physical CPUs on the current system to determine a default value.\n\n## Setting the number of CPUs\n\n- **minimumAllowedCPUCount**: The minimum number of CPUs you may configure for the VM.\n- **maximumAllowedCPUCount**: The maximum number of CPUs you may configure for the VM.\n\n",
  "sections" : [
    {
      "content" : "",
      "items" : [
        {
          "description" : "The minimum number of CPUs you may configure for the VM.",
          "name" : "minimumAllowedCPUCount",
          "url" : "https:\/\/developer.apple.com\/documentation\/Virtualization\/VZVirtualMachineConfiguration\/minimumAllowedCPUCount"
        },
        {
          "description" : "The maximum number of CPUs you may configure for the VM.",
          "name" : "maximumAllowedCPUCount",
          "url" : "https:\/\/developer.apple.com\/documentation\/Virtualization\/VZVirtualMachineConfiguration\/maximumAllowedCPUCount"
        }
      ],
      "title" : "Setting the number of CPUs"
    }
  ],
  "source" : "appleJSON",
  "title" : "cpuCount",
  "url" : "https:\/\/developer.apple.com\/documentation\/Virtualization\/VZVirtualMachineConfiguration\/cpuCount"
}