{
  "abstract" : "Synchronizes data to the permanent storage holding the disk image.",
  "codeExamples" : [

  ],
  "contentHash" : "062dcd92ff556a6177d3034294f0b0381ab71d7791f15388647cb20b46b9959d",
  "crawledAt" : "2025-12-05T13:39:14Z",
  "declaration" : {
    "code" : "case full",
    "language" : "swift"
  },
  "id" : "40862552-C56A-45B5-A25D-245063757DF4",
  "kind" : "unknown",
  "language" : "swift",
  "module" : "Virtualization",
  "overview" : "## Discussion\n\nThis mode synchronizes the data with the permanent storage holding the disk image and ensures the data moves from the disk’s internal cache to permanent storage. This ensures there’s no loss of already synchronized data in the case of panic or loss of power.",
  "platforms" : [
    "macOS"
  ],
  "rawMarkdown" : "---\nsource: https:\/\/developer.apple.com\/documentation\/Virtualization\/VZDiskImageSynchronizationMode\/full\ncrawled: 2025-12-05T13:39:14Z\n---\n\n# VZDiskImageSynchronizationMode.full\n\n**Case**\n\nSynchronizes data to the permanent storage holding the disk image.\n\n## Declaration\n\n```swift\ncase full\n```\n\n## Discussion\n\nThis mode synchronizes the data with the permanent storage holding the disk image and ensures the data moves from the disk’s internal cache to permanent storage. This ensures there’s no loss of already synchronized data in the case of panic or loss of power.\n\n## Disk image synchronization modes\n\n- **VZDiskImageSynchronizationMode.fsync**: Synchronizes data to the drive using the system’s best-effort synchronization mode.\n- **VZDiskImageSynchronizationMode.none**: Disables data synchronization with the permanent storage.\n\n",
  "sections" : [
    {
      "content" : "",
      "items" : [
        {
          "description" : "Synchronizes data to the drive using the system’s best-effort synchronization mode.",
          "name" : "VZDiskImageSynchronizationMode.fsync",
          "url" : "https:\/\/developer.apple.com\/documentation\/Virtualization\/VZDiskImageSynchronizationMode\/fsync"
        },
        {
          "description" : "Disables data synchronization with the permanent storage.",
          "name" : "VZDiskImageSynchronizationMode.none",
          "url" : "https:\/\/developer.apple.com\/documentation\/Virtualization\/VZDiskImageSynchronizationMode\/none"
        }
      ],
      "title" : "Disk image synchronization modes"
    }
  ],
  "source" : "appleJSON",
  "title" : "VZDiskImageSynchronizationMode.full",
  "url" : "https:\/\/developer.apple.com\/documentation\/Virtualization\/VZDiskImageSynchronizationMode\/full"
}