{
  "abstract" : "A device that manages port-based connections between the guest system and the host computer.",
  "codeExamples" : [

  ],
  "conformsTo" : [
    "CVarArg",
    "CustomDebugStringConvertible",
    "CustomStringConvertible",
    "Equatable",
    "Hashable",
    "NSObjectProtocol"
  ],
  "contentHash" : "0a574c6c04cb9460a646483d62a6ea4cf7f7b3305e02e8353c70f04c4763e16b",
  "crawledAt" : "2025-12-04T01:52:24Z",
  "declaration" : {
    "code" : "class VZVirtioSocketDevice",
    "language" : "swift"
  },
  "id" : "E39FF5FD-9F48-4958-88B6-BEB815696E83",
  "kind" : "class",
  "language" : "swift",
  "module" : "Virtualization",
  "overview" : "## Overview\n\nUse a [doc:\/\/com.apple.virtualization\/documentation\/Virtualization\/VZVirtioSocketDevice] object to configure services and other communication end points in your virtual machine. Host computers make services available using ports, which identify the type of service and the protocol to use when transmitting data. Use this object to specify the ports available to your guest operating system, and to register handlers to manage the communication on those ports.\n\nDon’t create a [doc:\/\/com.apple.virtualization\/documentation\/Virtualization\/VZVirtioSocketDevice] object directly. Instead, when you request a socket device in your configuration, the virtual machine creates it and stores it in the [doc:\/\/com.apple.virtualization\/documentation\/Virtualization\/VZVirtualMachine\/socketDevices] property. For each port you want to make available in your virtual machine, call the [doc:\/\/com.apple.virtualization\/documentation\/Virtualization\/VZVirtioSocketDevice\/setSocketListener(_:forPort:)] method and provide an object to manage the port connections.",
  "platforms" : [
    "macOS"
  ],
  "rawMarkdown" : "---\nsource: https:\/\/developer.apple.com\/documentation\/Virtualization\/VZVirtioSocketDevice\ncrawled: 2025-12-04T01:52:24Z\n---\n\n# VZVirtioSocketDevice\n\n**Class**\n\nA device that manages port-based connections between the guest system and the host computer.\n\n## Declaration\n\n```swift\nclass VZVirtioSocketDevice\n```\n\n## Overview\n\nUse a [doc:\/\/com.apple.virtualization\/documentation\/Virtualization\/VZVirtioSocketDevice] object to configure services and other communication end points in your virtual machine. Host computers make services available using ports, which identify the type of service and the protocol to use when transmitting data. Use this object to specify the ports available to your guest operating system, and to register handlers to manage the communication on those ports.\n\nDon’t create a [doc:\/\/com.apple.virtualization\/documentation\/Virtualization\/VZVirtioSocketDevice] object directly. Instead, when you request a socket device in your configuration, the virtual machine creates it and stores it in the [doc:\/\/com.apple.virtualization\/documentation\/Virtualization\/VZVirtualMachine\/socketDevices] property. For each port you want to make available in your virtual machine, call the [doc:\/\/com.apple.virtualization\/documentation\/Virtualization\/VZVirtioSocketDevice\/setSocketListener(_:forPort:)] method and provide an object to manage the port connections.\n\n## Configuring Port Listeners\n\n- **setSocketListener(_:forPort:)**: Configures an object to monitor the specified port for new connections.\n- **removeSocketListener(forPort:)**: Removes the listener object from the specfied port.\n\n## Connecting to Guest System Ports\n\n- **connect(toPort:completionHandler:)**: Initiates a connection to the specified port of the guest operating system.\n- **connect(toPort:)**: Initiates a connection to the specified port of the guest operating system.\n\n## Devices\n\n- **VZSocketDevice**: The common behavior of socket devices.\n\n## Inherits From\n\n- VZSocketDevice\n\n## Conforms To\n\n- CVarArg\n- CustomDebugStringConvertible\n- CustomStringConvertible\n- Equatable\n- Hashable\n- NSObjectProtocol\n\n",
  "sections" : [
    {
      "content" : "",
      "items" : [
        {
          "description" : "Configures an object to monitor the specified port for new connections.",
          "name" : "setSocketListener(_:forPort:)",
          "url" : "https:\/\/developer.apple.com\/documentation\/Virtualization\/VZVirtioSocketDevice\/setSocketListener(_:forPort:)"
        },
        {
          "description" : "Removes the listener object from the specfied port.",
          "name" : "removeSocketListener(forPort:)",
          "url" : "https:\/\/developer.apple.com\/documentation\/Virtualization\/VZVirtioSocketDevice\/removeSocketListener(forPort:)"
        }
      ],
      "title" : "Configuring Port Listeners"
    },
    {
      "content" : "",
      "items" : [
        {
          "description" : "Initiates a connection to the specified port of the guest operating system.",
          "name" : "connect(toPort:completionHandler:)",
          "url" : "https:\/\/developer.apple.com\/documentation\/Virtualization\/VZVirtioSocketDevice\/connect(toPort:completionHandler:)"
        },
        {
          "description" : "Initiates a connection to the specified port of the guest operating system.",
          "name" : "connect(toPort:)",
          "url" : "https:\/\/developer.apple.com\/documentation\/Virtualization\/VZVirtioSocketDevice\/connect(toPort:)"
        }
      ],
      "title" : "Connecting to Guest System Ports"
    },
    {
      "content" : "",
      "items" : [
        {
          "description" : "The common behavior of socket devices.",
          "name" : "VZSocketDevice",
          "url" : "https:\/\/developer.apple.com\/documentation\/Virtualization\/VZSocketDevice"
        }
      ],
      "title" : "Devices"
    },
    {
      "content" : "",
      "items" : [
        {
          "name" : "VZSocketDevice"
        }
      ],
      "title" : "Inherits From"
    }
  ],
  "source" : "appleJSON",
  "title" : "VZVirtioSocketDevice",
  "url" : "https:\/\/developer.apple.com\/documentation\/Virtualization\/VZVirtioSocketDevice"
}