{
  "abstract" : "A Boolean value that indicates whether the graphics display associated with this view automatically reconfigures with respect to view changes.",
  "codeExamples" : [

  ],
  "contentHash" : "f5a8805214ae1e8901815f4ac0ce204660a54355cb05598ea667276c6491e322",
  "crawledAt" : "2025-12-04T03:23:03Z",
  "declaration" : {
    "code" : "@MainActor var automaticallyReconfiguresDisplay: Bool { get set }",
    "language" : "swift"
  },
  "id" : "E9FE078D-A510-4C55-854F-D99CF617E733",
  "kind" : "property",
  "language" : "swift",
  "module" : "Virtualization",
  "overview" : "## Discussion\n\nSet this property to [doc:\/\/com.apple.documentation\/documentation\/Swift\/true] to automatically resize or reconfigure this graphics display when the view properties update. For example, resizing the display when the view has a live resize operation. When enabled, the graphics display automatically reconfigures to match the host display environment.\n\nYou can set this property on only a single [doc:\/\/com.apple.virtualization\/documentation\/Virtualization\/VZVirtualMachineView] targeting a particular [doc:\/\/com.apple.virtualization\/documentation\/Virtualization\/VZGraphicsDisplay] at a time. If multiple `VZVirtualMachineView` views targeting the same VZGraphicsDisplay enable this property, only one view respects the property, and the framework disables the property on the other views.\n\nThe default is [doc:\/\/com.apple.documentation\/documentation\/Swift\/false].",
  "platforms" : [
    "macOS"
  ],
  "rawMarkdown" : "---\nsource: https:\/\/developer.apple.com\/documentation\/Virtualization\/VZVirtualMachineView\/automaticallyReconfiguresDisplay\ncrawled: 2025-12-04T03:23:03Z\n---\n\n# automaticallyReconfiguresDisplay\n\n**Instance Property**\n\nA Boolean value that indicates whether the graphics display associated with this view automatically reconfigures with respect to view changes.\n\n## Declaration\n\n```swift\n@MainActor var automaticallyReconfiguresDisplay: Bool { get set }\n```\n\n## Discussion\n\nSet this property to [doc:\/\/com.apple.documentation\/documentation\/Swift\/true] to automatically resize or reconfigure this graphics display when the view properties update. For example, resizing the display when the view has a live resize operation. When enabled, the graphics display automatically reconfigures to match the host display environment.\n\nYou can set this property on only a single [doc:\/\/com.apple.virtualization\/documentation\/Virtualization\/VZVirtualMachineView] targeting a particular [doc:\/\/com.apple.virtualization\/documentation\/Virtualization\/VZGraphicsDisplay] at a time. If multiple `VZVirtualMachineView` views targeting the same VZGraphicsDisplay enable this property, only one view respects the property, and the framework disables the property on the other views.\n\nThe default is [doc:\/\/com.apple.documentation\/documentation\/Swift\/false].\n\n## Configuring the VM\n\n- **capturesSystemKeys**: A Boolean value that determines whether the system should send certain system keyboard shortcuts to the guest instead of the host.\n- **virtualMachine**: The VM to display in the view.\n\n",
  "sections" : [
    {
      "content" : "",
      "items" : [
        {
          "description" : "A Boolean value that determines whether the system should send certain system keyboard shortcuts to the guest instead of the host.",
          "name" : "capturesSystemKeys",
          "url" : "https:\/\/developer.apple.com\/documentation\/Virtualization\/VZVirtualMachineView\/capturesSystemKeys"
        },
        {
          "description" : "The VM to display in the view.",
          "name" : "virtualMachine",
          "url" : "https:\/\/developer.apple.com\/documentation\/Virtualization\/VZVirtualMachineView\/virtualMachine"
        }
      ],
      "title" : "Configuring the VM"
    }
  ],
  "source" : "appleJSON",
  "title" : "automaticallyReconfiguresDisplay",
  "url" : "https:\/\/developer.apple.com\/documentation\/Virtualization\/VZVirtualMachineView\/automaticallyReconfiguresDisplay"
}