{
  "abstract" : "Configures an object to monitor the specified port for new connections.",
  "codeExamples" : [

  ],
  "contentHash" : "7cbfe1c3a83f01b2f674758ab8c03730f9e3830584a5c9432a4d58d83c57e729",
  "crawledAt" : "2025-12-05T12:09:13Z",
  "declaration" : {
    "code" : "func setSocketListener(_ listener: VZVirtioSocketListener, forPort port: UInt32)",
    "language" : "swift"
  },
  "id" : "5AF34462-B189-469F-98F3-32227141000A",
  "kind" : "method",
  "language" : "swift",
  "module" : "Virtualization",
  "overview" : "## Discussion\n\nYou can register the same listener object on multiple ports. When the guest operating system opens a connection to the port, the listener object notifies its associated delegate.",
  "platforms" : [
    "macOS"
  ],
  "rawMarkdown" : "---\nsource: https:\/\/developer.apple.com\/documentation\/Virtualization\/VZVirtioSocketDevice\/setSocketListener(_:forPort:)\ncrawled: 2025-12-05T12:09:13Z\n---\n\n# setSocketListener(_:forPort:)\n\n**Instance Method**\n\nConfigures an object to monitor the specified port for new connections.\n\n## Declaration\n\n```swift\nfunc setSocketListener(_ listener: VZVirtioSocketListener, forPort port: UInt32)\n```\n\n## Parameters\n\n- **listener**: The [doc:\/\/com.apple.virtualization\/documentation\/Virtualization\/VZVirtioSocketListener] object to monitor the port. This object replaces the previous listener object, if any.\n- **port**: The port number to monitor.\n\n## Discussion\n\nYou can register the same listener object on multiple ports. When the guest operating system opens a connection to the port, the listener object notifies its associated delegate.\n\n## Configuring Port Listeners\n\n- **removeSocketListener(forPort:)**: Removes the listener object from the specfied port.\n\n",
  "sections" : [
    {
      "content" : "",
      "items" : [
        {
          "description" : "Removes the listener object from the specfied port.",
          "name" : "removeSocketListener(forPort:)",
          "url" : "https:\/\/developer.apple.com\/documentation\/Virtualization\/VZVirtioSocketDevice\/removeSocketListener(forPort:)"
        }
      ],
      "title" : "Configuring Port Listeners"
    }
  ],
  "source" : "appleJSON",
  "title" : "setSocketListener(_:forPort:)",
  "url" : "https:\/\/developer.apple.com\/documentation\/Virtualization\/VZVirtioSocketDevice\/setSocketListener(_:forPort:)"
}