{
  "abstract" : "A view that merchandises a collection of auto-renewable subscription options that belong to the same subscription group.",
  "codeExamples" : [

  ],
  "conformsTo" : [
    "Sendable",
    "SendableMetatype",
    "View"
  ],
  "contentHash" : "03b34331569a116d420f48389ab4a06fbb11c495ccf1caae2b249d16f458e5ac",
  "crawledAt" : "2025-12-04T10:02:35Z",
  "declaration" : {
    "code" : "@MainActor @preconcurrency struct SubscriptionStoreView<Content> where Content : View",
    "language" : "swift"
  },
  "id" : "4CC5BBBE-AF2B-4224-A221-49A5F12A4448",
  "kind" : "struct",
  "language" : "swift",
  "module" : "StoreKit",
  "overview" : "## Overview\n\nA `SubscriptionStoreView` displays localized information about auto-renewable subscriptions, including their localized names, descriptions, and prices, as well as a purchase button.\n\nCreate a subscription store view by using one of the initializers and providing the following information:\n\nIf you provide a subscription group identifier or a collection of product identifiers, the subscription store view automatically loads the subscription data from the App Store, and updates the view when the data is available.\n\n### Provide a background and a decorative icon\n\nThe subscription store view doesn’t draw a background by default. You can add a background as follows:\n\nYou can optionally provide a view as a decorative icon next to each subscription option. Use the [doc:\/\/com.apple.documentation\/documentation\/SwiftUI\/View\/subscriptionStoreControlIcon(icon:)] view modifier to set a view that decorates individual subscription options within a subscription store.\n\n### Order and filter subscriptions\n\nIf you create the subscription store view by providing a subscription group identifier, the system orders the subscription options according to their rank. If the customer is already subscribed, you may want to merchandise upgrade or crossgrade options. By default, the subscription store view lists all the subscriptions in the group. To hide certain subscription options, provide the `visibleRelationships` parameter in the initializer. For more information about the visible relationships, see [doc:\/\/com.apple.storekit\/documentation\/StoreKit\/Product\/SubscriptionRelationship].\n\nIf you create the subscription store view using one of the other initializers, the view orders the subscriptions according to the collection parameter’s order. The view excludes subscriptions that you don’t include in the collection parameter.\n\n### Add terms of service and privacy policies\n\nThe `SubscriptionStoreView` automatically displays buttons for the terms of service and privacy policy that you submit in App Store Connect. To override the destination of these buttons with a URL to custom terms of service and privacy policy pages, or a custom view, use the modifiers [doc:\/\/com.apple.documentation\/documentation\/SwiftUI\/View\/subscriptionStorePolicyDestination(url:for:)] and [doc:\/\/com.apple.documentation\/documentation\/SwiftUI\/View\/subscriptionStorePolicyDestination(for:destination:)].\n\nUse modifiers, such as [doc:\/\/com.apple.documentation\/documentation\/SwiftUI\/View\/subscriptionStorePolicyForegroundStyle(_:)], to customize the button’s style, for example, to make the text more readable against your store’s background.\n\n### Add auxiliary buttons\n\nYou can show auxiliary buttons in the subscription store using view modifiers. Specify the button’s visibility within the subscription store by using the [doc:\/\/com.apple.documentation\/documentation\/SwiftUI\/View\/storeButton(_:for:)] view modifier.\n\nIf you offer your subscription through other services, you can configure the subscription store view to display a sign-in button. Use the [doc:\/\/com.apple.documentation\/documentation\/SwiftUI\/View\/subscriptionStoreSignInAction(_:)] modifier to set the function your app calls when someone uses the sign-in button.\n\nThe subscription store view automatically shows a Close button. To override this behavior, use the `storeButton(_:for:)` modifier to unconditionally show, or hide, the Close button.\n\n### Style the subscription store view\n\nYou can further customize the subscription store’s appearance using control styles. Use subscription store control styles to customize the display of subscription options, and how people interact with your store. To try out standard styles, such as [doc:\/\/com.apple.storekit\/documentation\/StoreKit\/PickerSubscriptionStoreControlStyle], apply the style using the [doc:\/\/com.apple.documentation\/documentation\/SwiftUI\/View\/subscriptionStoreControlStyle(_:)] modifier.",
  "platforms" : [
    "iOS",
    "iPadOS",
    "Mac Catalyst",
    "macOS",
    "tvOS",
    "visionOS",
    "watchOS"
  ],
  "rawMarkdown" : "---\nsource: https:\/\/developer.apple.com\/documentation\/storekit\/subscriptionstoreview\ncrawled: 2025-12-04T10:02:35Z\n---\n\n# SubscriptionStoreView\n\n**Structure**\n\nA view that merchandises a collection of auto-renewable subscription options that belong to the same subscription group.\n\n## Declaration\n\n```swift\n@MainActor @preconcurrency struct SubscriptionStoreView<Content> where Content : View\n```\n\n## Overview\n\nA `SubscriptionStoreView` displays localized information about auto-renewable subscriptions, including their localized names, descriptions, and prices, as well as a purchase button.\n\nCreate a subscription store view by using one of the initializers and providing the following information:\n\n- A subscription group identifier\n- A collection of product identifiers\n- A collection of product values you previously loaded from the App Store\n\nIf you provide a subscription group identifier or a collection of product identifiers, the subscription store view automatically loads the subscription data from the App Store, and updates the view when the data is available.\n\n### Provide a background and a decorative icon\n\nThe subscription store view doesn’t draw a background by default. You can add a background as follows:\n\n- To layer a background behind the view, use a view modifier, such as `background(alignment:content:)`.\n- To set the container background of the subscription store using a view, use the `containerBackground(_:for:)` or `containerBackground(for:alignment:content:)` view modifier and specify a [doc:\/\/com.apple.documentation\/documentation\/SwiftUI\/ContainerBackgroundPlacement], such as [doc:\/\/com.apple.documentation\/documentation\/SwiftUI\/ContainerBackgroundPlacement\/subscriptionStoreHeader].\n\nYou can optionally provide a view as a decorative icon next to each subscription option. Use the [doc:\/\/com.apple.documentation\/documentation\/SwiftUI\/View\/subscriptionStoreControlIcon(icon:)] view modifier to set a view that decorates individual subscription options within a subscription store.\n\n### Order and filter subscriptions\n\nIf you create the subscription store view by providing a subscription group identifier, the system orders the subscription options according to their rank. If the customer is already subscribed, you may want to merchandise upgrade or crossgrade options. By default, the subscription store view lists all the subscriptions in the group. To hide certain subscription options, provide the `visibleRelationships` parameter in the initializer. For more information about the visible relationships, see [doc:\/\/com.apple.storekit\/documentation\/StoreKit\/Product\/SubscriptionRelationship].\n\nIf you create the subscription store view using one of the other initializers, the view orders the subscriptions according to the collection parameter’s order. The view excludes subscriptions that you don’t include in the collection parameter.\n\n### Add terms of service and privacy policies\n\nThe `SubscriptionStoreView` automatically displays buttons for the terms of service and privacy policy that you submit in App Store Connect. To override the destination of these buttons with a URL to custom terms of service and privacy policy pages, or a custom view, use the modifiers [doc:\/\/com.apple.documentation\/documentation\/SwiftUI\/View\/subscriptionStorePolicyDestination(url:for:)] and [doc:\/\/com.apple.documentation\/documentation\/SwiftUI\/View\/subscriptionStorePolicyDestination(for:destination:)].\n\nUse modifiers, such as [doc:\/\/com.apple.documentation\/documentation\/SwiftUI\/View\/subscriptionStorePolicyForegroundStyle(_:)], to customize the button’s style, for example, to make the text more readable against your store’s background.\n\n### Add auxiliary buttons\n\nYou can show auxiliary buttons in the subscription store using view modifiers. Specify the button’s visibility within the subscription store by using the [doc:\/\/com.apple.documentation\/documentation\/SwiftUI\/View\/storeButton(_:for:)] view modifier.\n\nIf you offer your subscription through other services, you can configure the subscription store view to display a sign-in button. Use the [doc:\/\/com.apple.documentation\/documentation\/SwiftUI\/View\/subscriptionStoreSignInAction(_:)] modifier to set the function your app calls when someone uses the sign-in button.\n\nThe subscription store view automatically shows a Close button. To override this behavior, use the `storeButton(_:for:)` modifier to unconditionally show, or hide, the Close button.\n\n### Style the subscription store view\n\nYou can further customize the subscription store’s appearance using control styles. Use subscription store control styles to customize the display of subscription options, and how people interact with your store. To try out standard styles, such as [doc:\/\/com.apple.storekit\/documentation\/StoreKit\/PickerSubscriptionStoreControlStyle], apply the style using the [doc:\/\/com.apple.documentation\/documentation\/SwiftUI\/View\/subscriptionStoreControlStyle(_:)] modifier.\n\n## Creating subscription store views with automatic marketing content\n\n- **init(groupID:visibleRelationships:)**: Creates a view that loads all subscriptions in a subscription group from the App Store, and merchandises them with automatic marketing content.\n- **init(productIDs:)**: Creates a view that loads subscriptions based on a collection of product identifiers, and merchandises them with automatic marketing content.\n- **init(subscriptions:)**: Creates a view that displays a collection of subscription options, and merchandises them with automatic marketing content.\n\n## Creating subscription store views with custom marketing content\n\n- **init(groupID:visibleRelationships:marketingContent:)**: Creates a view that loads all the subscriptions in a subscription group from the App Store, and merchandises them with custom marketing content.\n- **init(productIDs:marketingContent:)**: Creates a view that loads a collection of subscriptions from the App Store, and merchandises them with custom marketing content.\n- **init(subscriptions:marketingContent:)**: Creates a view that displays a collection of subscription options, and merchandises them with custom marketing content.\n\n## Creating subscription store views with a hierarchichal structure\n\n- **init(groupID:visibleRelationships:content:)**\n- **init(productIDs:content:)**\n- **init(subscriptions:content:)**\n\n## Supporting types\n\n- **AutomaticSubscriptionStoreMarketingContent**: A view that represents the default marketing content for a subscription store.\n- **SubscriptionStoreContentView**\n\n## Merchandising In-App Purchases, subscriptions, and offers\n\n- **ProductView**: A view that merchandises an individual In-App Purchase product.\n- **StoreView**: A view that merchandises a collection of In-App Purchase products.\n- **SubscriptionOfferView**\n- **Backyard Birds: Building an app with SwiftData and widgets**: Create an app with persistent data, interactive widgets, and an all new in-app purchase experience.\n\n## Conforms To\n\n- Sendable\n- SendableMetatype\n- View\n\n",
  "sections" : [
    {
      "content" : "",
      "items" : [
        {
          "description" : "Creates a view that loads all subscriptions in a subscription group from the App Store, and merchandises them with automatic marketing content.",
          "name" : "init(groupID:visibleRelationships:)",
          "url" : "https:\/\/developer.apple.com\/documentation\/StoreKit\/SubscriptionStoreView\/init(groupID:visibleRelationships:)"
        },
        {
          "description" : "Creates a view that loads subscriptions based on a collection of product identifiers, and merchandises them with automatic marketing content.",
          "name" : "init(productIDs:)",
          "url" : "https:\/\/developer.apple.com\/documentation\/StoreKit\/SubscriptionStoreView\/init(productIDs:)"
        },
        {
          "description" : "Creates a view that displays a collection of subscription options, and merchandises them with automatic marketing content.",
          "name" : "init(subscriptions:)",
          "url" : "https:\/\/developer.apple.com\/documentation\/StoreKit\/SubscriptionStoreView\/init(subscriptions:)"
        }
      ],
      "title" : "Creating subscription store views with automatic marketing content"
    },
    {
      "content" : "",
      "items" : [
        {
          "description" : "Creates a view that loads all the subscriptions in a subscription group from the App Store, and merchandises them with custom marketing content.",
          "name" : "init(groupID:visibleRelationships:marketingContent:)",
          "url" : "https:\/\/developer.apple.com\/documentation\/StoreKit\/SubscriptionStoreView\/init(groupID:visibleRelationships:marketingContent:)"
        },
        {
          "description" : "Creates a view that loads a collection of subscriptions from the App Store, and merchandises them with custom marketing content.",
          "name" : "init(productIDs:marketingContent:)",
          "url" : "https:\/\/developer.apple.com\/documentation\/StoreKit\/SubscriptionStoreView\/init(productIDs:marketingContent:)"
        },
        {
          "description" : "Creates a view that displays a collection of subscription options, and merchandises them with custom marketing content.",
          "name" : "init(subscriptions:marketingContent:)",
          "url" : "https:\/\/developer.apple.com\/documentation\/StoreKit\/SubscriptionStoreView\/init(subscriptions:marketingContent:)"
        }
      ],
      "title" : "Creating subscription store views with custom marketing content"
    },
    {
      "content" : "",
      "items" : [
        {
          "description" : "",
          "name" : "init(groupID:visibleRelationships:content:)",
          "url" : "https:\/\/developer.apple.com\/documentation\/StoreKit\/SubscriptionStoreView\/init(groupID:visibleRelationships:content:)"
        },
        {
          "description" : "",
          "name" : "init(productIDs:content:)",
          "url" : "https:\/\/developer.apple.com\/documentation\/StoreKit\/SubscriptionStoreView\/init(productIDs:content:)"
        },
        {
          "description" : "",
          "name" : "init(subscriptions:content:)",
          "url" : "https:\/\/developer.apple.com\/documentation\/StoreKit\/SubscriptionStoreView\/init(subscriptions:content:)"
        }
      ],
      "title" : "Creating subscription store views with a hierarchichal structure"
    },
    {
      "content" : "",
      "items" : [
        {
          "description" : "A view that represents the default marketing content for a subscription store.",
          "name" : "AutomaticSubscriptionStoreMarketingContent",
          "url" : "https:\/\/developer.apple.com\/documentation\/StoreKit\/AutomaticSubscriptionStoreMarketingContent"
        },
        {
          "description" : "",
          "name" : "SubscriptionStoreContentView",
          "url" : "https:\/\/developer.apple.com\/documentation\/StoreKit\/SubscriptionStoreContentView"
        }
      ],
      "title" : "Supporting types"
    },
    {
      "content" : "",
      "items" : [
        {
          "description" : "A view that merchandises an individual In-App Purchase product.",
          "name" : "ProductView",
          "url" : "https:\/\/developer.apple.com\/documentation\/StoreKit\/ProductView"
        },
        {
          "description" : "A view that merchandises a collection of In-App Purchase products.",
          "name" : "StoreView",
          "url" : "https:\/\/developer.apple.com\/documentation\/StoreKit\/StoreView"
        },
        {
          "description" : "",
          "name" : "SubscriptionOfferView",
          "url" : "https:\/\/developer.apple.com\/documentation\/StoreKit\/SubscriptionOfferView"
        },
        {
          "description" : "Create an app with persistent data, interactive widgets, and an all new in-app purchase experience.",
          "name" : "Backyard Birds: Building an app with SwiftData and widgets",
          "url" : "https:\/\/developer.apple.com\/documentation\/SwiftUI\/Backyard-birds-sample"
        }
      ],
      "title" : "Merchandising In-App Purchases, subscriptions, and offers"
    }
  ],
  "source" : "appleJSON",
  "title" : "SubscriptionStoreView",
  "url" : "https:\/\/developer.apple.com\/documentation\/storekit\/subscriptionstoreview"
}