{
  "abstract" : "Presents the App Store sheet for managing subscriptions.",
  "codeExamples" : [

  ],
  "contentHash" : "1f5bc75aeca68a7c715949c577175bb6750f887e630ecd665326d0860d8992b0",
  "crawledAt" : "2025-12-01T12:11:09Z",
  "declaration" : {
    "code" : "@MainActor static func showManageSubscriptions(in scene: UIWindowScene) async throws",
    "language" : "swift"
  },
  "id" : "0EBB3A33-54D7-458F-9B9A-D1C1FEDE5DBA",
  "kind" : "method",
  "module" : "StoreKit",
  "overview" : "## Discussion\n\nUse this function to display the manage subscriptions sheet within your app. Consider adding a manage subscriptions option to your app. For design guidance on supporting this functionality, see [https:\/\/developer.apple.com\/design\/human-interface-guidelines\/in-app-purchase\/overview\/auto-renewable-subscriptions\/#helping-people-manage-their-subscriptions].\n\nThe [doc:\/\/com.apple.storekit\/documentation\/StoreKit\/AppStore\/showManageSubscriptions(in:)] function presents a manage subscription sheet that’s the same as what customers can view in their account settings in the App Store app or by choosing Settings > Apple Account > Subscriptions on an iOS or iPadOS device. The sheet displays the customer’s currently active subscription for your app and the options to view, upgrade, downgrade, or cancel their subscription.\n\nIf you’re using SwiftUI, call the [doc:\/\/com.apple.documentation\/documentation\/SwiftUI\/View\/manageSubscriptionsSheet(isPresented:)]view modifier.\n\nAvoid showing the user interface for this feature in Mac apps built with Mac Catalyst and on iOS apps running on Mac computers with Apple silicon because this sheet isn’t supported in macOS.\n\n### Test managing subscriptions\n\nTest the managing subscriptions functionality in the sandbox environment and StoreKit testing in Xcode. For more information about testing, see [doc:\/\/com.apple.storekit\/documentation\/StoreKit\/testing-at-all-stages-of-development-with-xcode-and-the-sandbox] and [doc:\/\/com.apple.documentation\/documentation\/Xcode\/setting-up-storekit-testing-in-xcode].",
  "platforms" : [
    "iOS",
    "iPadOS",
    "Mac Catalyst",
    "visionOS"
  ],
  "rawMarkdown" : "---\nsource: https:\/\/developer.apple.com\/documentation\/StoreKit\/AppStore\/showManageSubscriptions(in:)\ncrawled: 2025-12-01T12:11:09Z\n---\n\n# showManageSubscriptions(in:)\n\n**Type Method**\n\nPresents the App Store sheet for managing subscriptions.\n\n## Declaration\n\n```swift\n@MainActor static func showManageSubscriptions(in scene: UIWindowScene) async throws\n```\n\n## Parameters\n\n- **scene**: The [doc:\/\/com.apple.documentation\/documentation\/UIKit\/UIWindowScene] that the system displays the sheet on.\n\n## Discussion\n\nUse this function to display the manage subscriptions sheet within your app. Consider adding a manage subscriptions option to your app. For design guidance on supporting this functionality, see [https:\/\/developer.apple.com\/design\/human-interface-guidelines\/in-app-purchase\/overview\/auto-renewable-subscriptions\/#helping-people-manage-their-subscriptions].\n\nThe [doc:\/\/com.apple.storekit\/documentation\/StoreKit\/AppStore\/showManageSubscriptions(in:)] function presents a manage subscription sheet that’s the same as what customers can view in their account settings in the App Store app or by choosing Settings > Apple Account > Subscriptions on an iOS or iPadOS device. The sheet displays the customer’s currently active subscription for your app and the options to view, upgrade, downgrade, or cancel their subscription.\n\nIf you’re using SwiftUI, call the [doc:\/\/com.apple.documentation\/documentation\/SwiftUI\/View\/manageSubscriptionsSheet(isPresented:)]view modifier.\n\nAvoid showing the user interface for this feature in Mac apps built with Mac Catalyst and on iOS apps running on Mac computers with Apple silicon because this sheet isn’t supported in macOS.\n\n- In Mac apps built with Mac Catalyst, enclose the code in a compilation conditional block that uses the `targetEnvironment():` platform condition. For more information on Mac Catalyst, see [doc:\/\/com.apple.documentation\/documentation\/UIKit\/creating-a-mac-version-of-your-ipad-app].\n- For iOS apps running on Apple silicon, if [doc:\/\/com.apple.documentation\/documentation\/Foundation\/ProcessInfo\/isiOSAppOnMac] is `true,` avoid showing the user interface for this feature.\n\n### Test managing subscriptions\n\nTest the managing subscriptions functionality in the sandbox environment and StoreKit testing in Xcode. For more information about testing, see [doc:\/\/com.apple.storekit\/documentation\/StoreKit\/testing-at-all-stages-of-development-with-xcode-and-the-sandbox] and [doc:\/\/com.apple.documentation\/documentation\/Xcode\/setting-up-storekit-testing-in-xcode].\n\n## Managing subscriptions\n\n- **showManageSubscriptions(in:subscriptionGroupID:)**: Presents the App Store sheet for managing subscriptions for a subscription group.\n\n",
  "sections" : [
    {
      "content" : "",
      "items" : [
        {
          "description" : "Presents the App Store sheet for managing subscriptions for a subscription group.",
          "name" : "showManageSubscriptions(in:subscriptionGroupID:)",
          "url" : "https:\/\/developer.apple.com\/documentation\/StoreKit\/AppStore\/showManageSubscriptions(in:subscriptionGroupID:)"
        }
      ],
      "title" : "Managing subscriptions"
    }
  ],
  "source" : "appleJSON",
  "title" : "showManageSubscriptions(in:)",
  "url" : "https:\/\/developer.apple.com\/documentation\/StoreKit\/AppStore\/showManageSubscriptions(in:)"
}