{
  "abstract" : "Verify your implementation of In-App Purchases by testing your code throughout its development.",
  "codeExamples" : [

  ],
  "contentHash" : "1878d6e64123526a4dead511633db6da6350348aef4e93c62eedb8c4c1d8f425",
  "crawledAt" : "2025-12-02T17:53:45Z",
  "id" : "A317A597-1D54-4003-B4E8-A9F7EE70F6B9",
  "kind" : "article",
  "language" : "swift",
  "module" : "StoreKit",
  "overview" : "## Overview\n\nUse the Apple sandbox and Xcode test environments to test your implementation of in-app purchases using the StoreKit framework. Comprehensive testing can help you:\n\nThe tools you need to test in-app purchases, non-renewing subscriptions, and auto-renewable subscriptions from early development through beta testing are:\n\nChoose the tools that support the test scenarios you need. Make sure you’re able to perform the setup required for the tools you choose.\n\nDuring the early stages of development, you may not be ready to configure in-app purchases in App Store Connect. StoreKit Testing in Xcode lets you configure the information locally. You can test StoreKit transactions before you create Sandbox Apple Accounts, without a network connection. You can test your app in Simulator or on real devices.\n\nAfter you set up in-app purchases in App Store Connect, start using the sandbox environment to test the product information your app will use in production. Testing in the sandbox lets you test transactions from end-to-end and from your app to your server. You can also test any server-to-server functionalities your app depends on, such as transaction validation and [doc:\/\/com.apple.documentation\/documentation\/AppStoreServerNotifications].\n\nTestFlight lets you get feedback from members of your team or from external testers. TestFlight uses the sandbox environment for in-app purchases. Transactions and purchases that occur in the sandbox don’t incur charges. The following table compares the test environments and features:\n\nNone of the test environments charge users when they test buying a product. The App Store doesn’t send emails for purchases or refunds made in the test environments.\n\n### Control the test environment\n\nTo set up and run test scenarios, you often need to control the test environment. For example, you may want to reset a test account to rerun the same test multiple times, or mimic actions users take outside your app that affect the test conditions. The following table shows the capabilities each tool has to control the test environment:\n\nFor more information about speeding up renewal periods for testing, see [https:\/\/developer.apple.com\/help\/app-store-connect\/test-in-app-purchases-main\/test-in-app-purchases].\n\n### Test common StoreKit scenarios\n\nAll apps that offer in-app purchases need to support restoring purchases, displaying in-app purchases to the customer, and handling basic transactions. The following table lists common test scenarios and whether they’re testable in the sandbox or Xcode:\n\n### Test subscriptions and Ask to Buy\n\nDepending on the in-app purchases your app offers, you may need to test scenarios that involve auto-renewing subscriptions, introductory offers, promotional offers, and Ask to Buy. The following table lists test scenarios and whether they’re testable in the sandbox or Xcode:\n\nFor more information, see [https:\/\/support.apple.com\/en-us\/HT201089] and [doc:\/\/com.apple.storekit\/documentation\/StoreKit\/testing-introductory-offers].",
  "rawMarkdown" : "---\nsource: https:\/\/developer.apple.com\/documentation\/StoreKit\/testing-at-all-stages-of-development-with-xcode-and-the-sandbox\ncrawled: 2025-12-02T17:53:45Z\n---\n\n# Testing at all stages of development with Xcode and the sandbox\n\n**Article**\n\nVerify your implementation of In-App Purchases by testing your code throughout its development.\n\n## Overview\n\nUse the Apple sandbox and Xcode test environments to test your implementation of in-app purchases using the StoreKit framework. Comprehensive testing can help you:\n\n- Ensure a seamless purchase flow to provide a positive customer experience in your app.\n- Implement sound logic that covers all scenarios, such as purchases, restores, and subscription offers.\n- Validate that purchases behave correctly in production after your app is available in the App Store.\n\nThe tools you need to test in-app purchases, non-renewing subscriptions, and auto-renewable subscriptions from early development through beta testing are:\n\n\n\nChoose the tools that support the test scenarios you need. Make sure you’re able to perform the setup required for the tools you choose.\n\nDuring the early stages of development, you may not be ready to configure in-app purchases in App Store Connect. StoreKit Testing in Xcode lets you configure the information locally. You can test StoreKit transactions before you create Sandbox Apple Accounts, without a network connection. You can test your app in Simulator or on real devices.\n\nAfter you set up in-app purchases in App Store Connect, start using the sandbox environment to test the product information your app will use in production. Testing in the sandbox lets you test transactions from end-to-end and from your app to your server. You can also test any server-to-server functionalities your app depends on, such as transaction validation and [doc:\/\/com.apple.documentation\/documentation\/AppStoreServerNotifications].\n\nTestFlight lets you get feedback from members of your team or from external testers. TestFlight uses the sandbox environment for in-app purchases. Transactions and purchases that occur in the sandbox don’t incur charges. The following table compares the test environments and features:\n\n\n\nNone of the test environments charge users when they test buying a product. The App Store doesn’t send emails for purchases or refunds made in the test environments.\n\n### Control the test environment\n\nTo set up and run test scenarios, you often need to control the test environment. For example, you may want to reset a test account to rerun the same test multiple times, or mimic actions users take outside your app that affect the test conditions. The following table shows the capabilities each tool has to control the test environment:\n\n\n\nFor more information about speeding up renewal periods for testing, see [https:\/\/developer.apple.com\/help\/app-store-connect\/test-in-app-purchases-main\/test-in-app-purchases].\n\n### Test common StoreKit scenarios\n\nAll apps that offer in-app purchases need to support restoring purchases, displaying in-app purchases to the customer, and handling basic transactions. The following table lists common test scenarios and whether they’re testable in the sandbox or Xcode:\n\n\n\n### Test subscriptions and Ask to Buy\n\nDepending on the in-app purchases your app offers, you may need to test scenarios that involve auto-renewing subscriptions, introductory offers, promotional offers, and Ask to Buy. The following table lists test scenarios and whether they’re testable in the sandbox or Xcode:\n\n\n\nFor more information, see [https:\/\/support.apple.com\/en-us\/HT201089] and [doc:\/\/com.apple.storekit\/documentation\/StoreKit\/testing-introductory-offers].\n\n## In-App Purchase Testing\n\n- **Testing In-App Purchases with sandbox**: Test your implementation of In-App Purchases using real product information and server-to-server transactions in the sandbox environment.\n- **Testing refund requests**: Test your app’s implementation of refund requests, and your app’s and server’s handling of approved and declined refunds.\n- **Testing win-back offers in Xcode**: Validate your app’s handling of win-back offers that you configure for the testing environment.\n- **Testing Ask to Buy in Xcode**: Validate your app’s handling of Ask To Buy in the testing environment.\n\n",
  "sections" : [
    {
      "content" : "",
      "items" : [
        {
          "description" : "Test your implementation of In-App Purchases using real product information and server-to-server transactions in the sandbox environment.",
          "name" : "Testing In-App Purchases with sandbox",
          "url" : "https:\/\/developer.apple.com\/documentation\/StoreKit\/testing-in-app-purchases-with-sandbox"
        },
        {
          "description" : "Test your app’s implementation of refund requests, and your app’s and server’s handling of approved and declined refunds.",
          "name" : "Testing refund requests",
          "url" : "https:\/\/developer.apple.com\/documentation\/StoreKit\/testing-refund-requests"
        },
        {
          "description" : "Validate your app’s handling of win-back offers that you configure for the testing environment.",
          "name" : "Testing win-back offers in Xcode",
          "url" : "https:\/\/developer.apple.com\/documentation\/StoreKit\/testing-win-back-offers-in-xcode"
        },
        {
          "description" : "Validate your app’s handling of Ask To Buy in the testing environment.",
          "name" : "Testing Ask to Buy in Xcode",
          "url" : "https:\/\/developer.apple.com\/documentation\/StoreKit\/testing-ask-to-buy-in-xcode"
        }
      ],
      "title" : "In-App Purchase Testing"
    }
  ],
  "source" : "appleJSON",
  "title" : "Testing at all stages of development with Xcode and the sandbox",
  "url" : "https:\/\/developer.apple.com\/documentation\/StoreKit\/testing-at-all-stages-of-development-with-xcode-and-the-sandbox"
}