{
  "abstract" : "Verifies the first launch of an app installed as a result of an ad.",
  "codeExamples" : [

  ],
  "contentHash" : "938a2b203fc71ae6a4aa27a15480eef04f29195b17b4118df49de2e60423609f",
  "crawledAt" : "2025-12-05T11:21:55Z",
  "declaration" : {
    "code" : "class func registerAppForAdNetworkAttribution()",
    "language" : "swift"
  },
  "id" : "3A10C3BA-1908-4E22-92E2-08E0700FB25A",
  "kind" : "method",
  "language" : "swift",
  "module" : "StoreKit",
  "overview" : "## Discussion\n\nApps that an ad network campaign advertise call this method or [doc:\/\/com.apple.storekit\/documentation\/StoreKit\/SKAdNetwork\/updateConversionValue(_:)] when the app first launches. Both methods generate an install notification, which is the cryptographically signed data that validates that a user installed and launched this app as a result of an ad.\n\nIn iOS 15.4 and earlier, the first call to [doc:\/\/com.apple.storekit\/documentation\/StoreKit\/SKAdNetwork\/registerAppForAdNetworkAttribution()] generates the notification if the device has attribution data for that app, and starts a 24-hour timer. Subsequent calls to this method have no effect, unless the ad already has a conversion value set, in which case calling [doc:\/\/com.apple.storekit\/documentation\/StoreKit\/SKAdNetwork\/registerAppForAdNetworkAttribution()] resets the conversion value to `0`. You may, however, call [doc:\/\/com.apple.storekit\/documentation\/StoreKit\/SKAdNetwork\/updateConversionValue(_:)] to provide an updated conversion value and restart the timer.\n\nThe device sends one or more install notifications to ad network postback URLs within 0-24 hours after the timer expires. For more information about attribution-winning and non-winning postbacks, see [doc:\/\/com.apple.storekit\/documentation\/StoreKit\/receiving-ad-attributions-and-postbacks].\n\nAd networks must verify the postback after receiving it. For more information, see [doc:\/\/com.apple.storekit\/documentation\/StoreKit\/verifying-an-install-validation-postback].",
  "platforms" : [
    "iOS",
    "iPadOS",
    "Mac Catalyst"
  ],
  "rawMarkdown" : "---\nsource: https:\/\/developer.apple.com\/documentation\/StoreKit\/SKAdNetwork\/registerAppForAdNetworkAttribution()\ncrawled: 2025-12-05T11:21:55Z\n---\n\n# registerAppForAdNetworkAttribution()\n\n**Type Method**\n\nVerifies the first launch of an app installed as a result of an ad.\n\n## Declaration\n\n```swift\nclass func registerAppForAdNetworkAttribution()\n```\n\n## Discussion\n\nApps that an ad network campaign advertise call this method or [doc:\/\/com.apple.storekit\/documentation\/StoreKit\/SKAdNetwork\/updateConversionValue(_:)] when the app first launches. Both methods generate an install notification, which is the cryptographically signed data that validates that a user installed and launched this app as a result of an ad.\n\nIn iOS 15.4 and earlier, the first call to [doc:\/\/com.apple.storekit\/documentation\/StoreKit\/SKAdNetwork\/registerAppForAdNetworkAttribution()] generates the notification if the device has attribution data for that app, and starts a 24-hour timer. Subsequent calls to this method have no effect, unless the ad already has a conversion value set, in which case calling [doc:\/\/com.apple.storekit\/documentation\/StoreKit\/SKAdNetwork\/registerAppForAdNetworkAttribution()] resets the conversion value to `0`. You may, however, call [doc:\/\/com.apple.storekit\/documentation\/StoreKit\/SKAdNetwork\/updateConversionValue(_:)] to provide an updated conversion value and restart the timer.\n\nThe device sends one or more install notifications to ad network postback URLs within 0-24 hours after the timer expires. For more information about attribution-winning and non-winning postbacks, see [doc:\/\/com.apple.storekit\/documentation\/StoreKit\/receiving-ad-attributions-and-postbacks].\n\nAd networks must verify the postback after receiving it. For more information, see [doc:\/\/com.apple.storekit\/documentation\/StoreKit\/verifying-an-install-validation-postback].\n\n## Deprecated\n\n- **updateConversionValue(_:)**: Updates the conversion value and verifies the first launch of an app installed as a result of an ad.\n\n",
  "sections" : [
    {
      "content" : "",
      "items" : [
        {
          "description" : "Updates the conversion value and verifies the first launch of an app installed as a result of an ad.",
          "name" : "updateConversionValue(_:)",
          "url" : "https:\/\/developer.apple.com\/documentation\/StoreKit\/SKAdNetwork\/updateConversionValue(_:)"
        }
      ],
      "title" : "Deprecated"
    }
  ],
  "source" : "appleJSON",
  "title" : "registerAppForAdNetworkAttribution()",
  "url" : "https:\/\/developer.apple.com\/documentation\/StoreKit\/SKAdNetwork\/registerAppForAdNetworkAttribution()"
}