{
  "abstract" : "Allow users to purchase media in the App Store from within your app.",
  "codeExamples" : [
    {
      "code" : "var parametersDictionary = [SKStoreProductParameterITunesItemIdentifier: product.productIdentifier]",
      "language" : "swift"
    },
    {
      "code" : "\/\/ Create a store product view controller.\nlet store = SKStoreProductViewController()\nstore.delegate = self",
      "language" : "swift"
    },
    {
      "code" : "\/*\n   Attempt to load the selected product from the App Store. Display the\n   store product view controller if successful. Print an error message,\n   otherwise.\n*\/\nstore.loadProduct(withParameters: parametersDictionary, completionBlock: {[unowned self] (result: Bool, error: Error?) in\n    if result {\n        self.present(store, animated: true, completion: {\n            print(\"The store view controller was presented.\")\n        })\n    } else {\n        if let error = error {\n            print(\"Error: \\(error.localizedDescription)\")\n        }\n    }})",
      "language" : "swift"
    },
    {
      "code" : "\/*\n    Update `parametersDictionary` with the `campaignToken` and\n    `providerToken` values if they exist and the specified `product`\n    is an app.\n*\/\nif product.isApplication, !product.campaignToken.isEmpty, !product.providerToken.isEmpty {\n    parametersDictionary[SKStoreProductParameterCampaignToken] = product.campaignToken\n    parametersDictionary[SKStoreProductParameterProviderToken] = product.providerToken\n}",
      "language" : "swift"
    }
  ],
  "contentHash" : "f02db631e8fc15d1e97793fc49d5d8898876e1b79c91568d135a08a79deda208",
  "crawledAt" : "2025-12-02T15:50:41Z",
  "id" : "1BE5F6E6-83D2-4859-AC43-D076B5E1FA74",
  "kind" : "unknown",
  "language" : "swift",
  "module" : "StoreKit",
  "overview" : "## Overview\n\nThis sample code project shows how to let users purchase media from your app using the [doc:\/\/com.apple.storekit\/documentation\/StoreKit\/SKStoreProductViewController] class. Additionally, the sample demonstrates how to measure the effectiveness of a cross-promotional campaign for your apps or third-party apps using the [doc:\/\/com.apple.storekit\/documentation\/StoreKit\/SKStoreProductParameterCampaignToken] and [doc:\/\/com.apple.storekit\/documentation\/StoreKit\/SKStoreProductParameterProviderToken] keys. When cross-promoting your apps, set `SKStoreProductParameterProviderToken` to your own provider token. When promoting apps for other developers, set it to their provider token.\n\nThe app in this sample project displays a list of media items that the user can tap to make purchases from the App Store. You can also track advertising and promotions from this interactive list of media items for sale.\n\nThe sample app requires an iOS or iPadOS device.\n\n### Configure the sample code project\n\nThis sample code project defines a `Product` data type to represent media information it saves in the `Products.plist` file. `Products.plist` contains a single `Product` entry. Before you can run this sample on your device, you need to update this entry with your own data.\n\nTo add more data, duplicate and update the `Product` entry in `Products.plist` as necessary.\n\n### Display media from the App Store\n\nThis sample launches to the `TableViewController`, which shows a list of media associated with iTunes identifiers in `Products.plist`. When the user taps any item in the list, `TableViewController` presents a page where they can purchase the media from the App Store.\n\nThe sample creates a parameters dictionary and sets the [doc:\/\/com.apple.storekit\/documentation\/StoreKit\/SKStoreProductParameterITunesItemIdentifier] key to the media’s iTunes identifier.\n\nThe sample creates an `SKStoreProductViewController` object and sets the view controller class as its delegate. Then it passes the dictionary to the [doc:\/\/com.apple.storekit\/documentation\/StoreKit\/SKStoreProductViewController\/loadProduct(withParameters:completionBlock:)] method of the `SKStoreProductViewController` object.\n\nThen the sample presents the `SKStoreProductViewController` object modally.\n\nThe delegate needs to dismiss the store view controller when the purchase completes, or if the user cancels it. `TableViewController` implements the [doc:\/\/com.apple.storekit\/documentation\/StoreKit\/SKStoreProductViewControllerDelegate\/productViewControllerDidFinish(_:)] method to dismiss the presented store product view controller. Apps can also use this method to resume any activities that they pause before presenting the store.\n\n### Track advertising and promotions\n\nThe `SKStoreProductParameterCampaignToken` and `SKStoreProductParameterProviderToken` keys track advertising and promotion for the app. When the user taps an item in the list, `TableViewController` adds these keys and their values to a dictionary, which already contains `SKStoreProductParameterItunesItemIdentifier` with the iTunes identifier.\n\n`TableViewController` passes the dictionary to a created `SKStoreProductViewController` object, and then displays the store product view controller modally.",
  "rawMarkdown" : "---\nsource: https:\/\/developer.apple.com\/documentation\/StoreKit\/offering-media-for-sale-in-your-app\ncrawled: 2025-12-02T15:50:41Z\n---\n\n# Offering media for sale in your app\n\n**Sample Code**\n\nAllow users to purchase media in the App Store from within your app.\n\n## Overview\n\nThis sample code project shows how to let users purchase media from your app using the [doc:\/\/com.apple.storekit\/documentation\/StoreKit\/SKStoreProductViewController] class. Additionally, the sample demonstrates how to measure the effectiveness of a cross-promotional campaign for your apps or third-party apps using the [doc:\/\/com.apple.storekit\/documentation\/StoreKit\/SKStoreProductParameterCampaignToken] and [doc:\/\/com.apple.storekit\/documentation\/StoreKit\/SKStoreProductParameterProviderToken] keys. When cross-promoting your apps, set `SKStoreProductParameterProviderToken` to your own provider token. When promoting apps for other developers, set it to their provider token.\n\nThe app in this sample project displays a list of media items that the user can tap to make purchases from the App Store. You can also track advertising and promotions from this interactive list of media items for sale.\n\nThe sample app requires an iOS or iPadOS device.\n\n### Configure the sample code project\n\nThis sample code project defines a `Product` data type to represent media information it saves in the `Products.plist` file. `Products.plist` contains a single `Product` entry. Before you can run this sample on your device, you need to update this entry with your own data.\n\n1. Set the sample’s `productIdentifier` key to your media’s iTunes identifier. For more information about iTunes identifiers, see [doc:\/\/com.apple.storekit\/documentation\/StoreKit\/SKStoreProductParameterITunesItemIdentifier].\n2. Set the `title` key to your media’s name.\n3. Set the `isApplication` key to YES if your media is an app, and NO, otherwise.\n4. Set the `campaignToken` and `providerToken` keys to the appropriate tokens if you’re cross-promoting apps, and leave them empty if you’re not. For more information about generating campaign and provider tokens, see [https:\/\/help.apple.com\/app-store-connect\/#\/itcfa7936330], [https:\/\/help.apple.com\/app-store-connect\/#\/itc5e30b4d89], and [https:\/\/help.apple.com\/app-store-connect\/#\/itc1ae92f9ee].\n\nTo add more data, duplicate and update the `Product` entry in `Products.plist` as necessary.\n\n### Display media from the App Store\n\nThis sample launches to the `TableViewController`, which shows a list of media associated with iTunes identifiers in `Products.plist`. When the user taps any item in the list, `TableViewController` presents a page where they can purchase the media from the App Store.\n\nThe sample creates a parameters dictionary and sets the [doc:\/\/com.apple.storekit\/documentation\/StoreKit\/SKStoreProductParameterITunesItemIdentifier] key to the media’s iTunes identifier.\n\n```swift\nvar parametersDictionary = [SKStoreProductParameterITunesItemIdentifier: product.productIdentifier]\n```\n\nThe sample creates an `SKStoreProductViewController` object and sets the view controller class as its delegate. Then it passes the dictionary to the [doc:\/\/com.apple.storekit\/documentation\/StoreKit\/SKStoreProductViewController\/loadProduct(withParameters:completionBlock:)] method of the `SKStoreProductViewController` object.\n\n```swift\n\/\/ Create a store product view controller.\nlet store = SKStoreProductViewController()\nstore.delegate = self\n```\n\nThen the sample presents the `SKStoreProductViewController` object modally.\n\n```swift\n\/*\n   Attempt to load the selected product from the App Store. Display the\n   store product view controller if successful. Print an error message,\n   otherwise.\n*\/\nstore.loadProduct(withParameters: parametersDictionary, completionBlock: {[unowned self] (result: Bool, error: Error?) in\n    if result {\n        self.present(store, animated: true, completion: {\n            print(\"The store view controller was presented.\")\n        })\n    } else {\n        if let error = error {\n            print(\"Error: \\(error.localizedDescription)\")\n        }\n    }})\n```\n\nThe delegate needs to dismiss the store view controller when the purchase completes, or if the user cancels it. `TableViewController` implements the [doc:\/\/com.apple.storekit\/documentation\/StoreKit\/SKStoreProductViewControllerDelegate\/productViewControllerDidFinish(_:)] method to dismiss the presented store product view controller. Apps can also use this method to resume any activities that they pause before presenting the store.\n\n### Track advertising and promotions\n\nThe `SKStoreProductParameterCampaignToken` and `SKStoreProductParameterProviderToken` keys track advertising and promotion for the app. When the user taps an item in the list, `TableViewController` adds these keys and their values to a dictionary, which already contains `SKStoreProductParameterItunesItemIdentifier` with the iTunes identifier.\n\n`TableViewController` passes the dictionary to a created `SKStoreProductViewController` object, and then displays the store product view controller modally.\n\n```swift\n\/*\n    Update `parametersDictionary` with the `campaignToken` and\n    `providerToken` values if they exist and the specified `product`\n    is an app.\n*\/\nif product.isApplication, !product.campaignToken.isEmpty, !product.providerToken.isEmpty {\n    parametersDictionary[SKStoreProductParameterCampaignToken] = product.campaignToken\n    parametersDictionary[SKStoreProductParameterProviderToken] = product.providerToken\n}\n```\n\n## Recommendations\n\n- **SKStoreProductViewController**: A view controller that provides a page where customers can purchase media from the App Store.\n- **SKOverlay**: A class that displays an overlay you can use to recommend another app or an App Clip’s corresponding full app.\n\n",
  "sections" : [
    {
      "content" : "",
      "items" : [
        {
          "description" : "A view controller that provides a page where customers can purchase media from the App Store.",
          "name" : "SKStoreProductViewController",
          "url" : "https:\/\/developer.apple.com\/documentation\/StoreKit\/SKStoreProductViewController"
        },
        {
          "description" : "A class that displays an overlay you can use to recommend another app or an App Clip’s corresponding full app.",
          "name" : "SKOverlay",
          "url" : "https:\/\/developer.apple.com\/documentation\/StoreKit\/SKOverlay"
        }
      ],
      "title" : "Recommendations"
    }
  ],
  "source" : "appleJSON",
  "title" : "Offering media for sale in your app",
  "url" : "https:\/\/developer.apple.com\/documentation\/StoreKit\/offering-media-for-sale-in-your-app"
}