{
  "abstract" : "A joint that maintains a minimum and maximum distance between two entity pins.",
  "codeExamples" : [

  ],
  "conformsTo" : [
    "Equatable",
    "PhysicsJoint"
  ],
  "contentHash" : "baf537d829c1a25419c554694e34e4b81ea5c20d4fdd6b47b0c69c9ee63b004d",
  "crawledAt" : "2025-12-02T20:04:20Z",
  "declaration" : {
    "code" : "struct PhysicsDistanceJoint",
    "language" : "swift"
  },
  "id" : "FFE26E96-A752-4072-9784-B69E1B80618E",
  "kind" : "struct",
  "language" : "swift",
  "module" : "RealityKit",
  "overview" : "## Overview\n\nA distance joint restricts the distance between `pin0` and `pin1`. The joint determines this closed range according to [doc:\/\/com.apple.RealityKit\/documentation\/RealityKit\/PhysicsDistanceJoint\/distanceLimit].\n\nThis joint allows full rotational freedom between `pin0` and `pin1`.",
  "platforms" : [
    "iOS",
    "iPadOS",
    "Mac Catalyst",
    "macOS",
    "tvOS",
    "visionOS"
  ],
  "rawMarkdown" : "---\nsource: https:\/\/developer.apple.com\/documentation\/RealityKit\/PhysicsDistanceJoint\ncrawled: 2025-12-02T20:04:20Z\n---\n\n# PhysicsDistanceJoint\n\n**Structure**\n\nA joint that maintains a minimum and maximum distance between two entity pins.\n\n## Declaration\n\n```swift\nstruct PhysicsDistanceJoint\n```\n\n## Overview\n\nA distance joint restricts the distance between `pin0` and `pin1`. The joint determines this closed range according to [doc:\/\/com.apple.RealityKit\/documentation\/RealityKit\/PhysicsDistanceJoint\/distanceLimit].\n\nThis joint allows full rotational freedom between `pin0` and `pin1`.\n\n## Initializers\n\n- **init(pin0:pin1:distanceLimit:checksForInternalCollisions:)**: Creates a new distance joint.\n\n## Instance Properties\n\n- **distanceLimit**: Specifies the minimum and maximum allowed distance between the pins.\n- **tolerance**: An extension of the distance limit, as a percentage-based error tolerance.\n\n## Built-in joint types\n\n- **PhysicsRevoluteJoint**: A joint that allows one degree of rotational freedom between two entity pins, similar to a door swinging on its hinges.\n- **PhysicsPrismaticJoint**: A joint that allows movement along a straight line, similar to a sliding drawer.\n- **PhysicsSphericalJoint**: A spherical joint that allows free rotational movement between two entities’ pins.\n- **PhysicsCustomJoint**: A joint with six degrees of freedom that can be individually specified.\n- **PhysicsFixedJoint**: A joint that rigidly connects two entity pins, with zero degrees of freedom.\n- **PhysicsJoints**: A collection of physics joints.\n\n## Conforms To\n\n- Equatable\n- PhysicsJoint\n\n",
  "sections" : [
    {
      "content" : "",
      "items" : [
        {
          "description" : "Creates a new distance joint.",
          "name" : "init(pin0:pin1:distanceLimit:checksForInternalCollisions:)",
          "url" : "https:\/\/developer.apple.com\/documentation\/RealityKit\/PhysicsDistanceJoint\/init(pin0:pin1:distanceLimit:checksForInternalCollisions:)"
        }
      ],
      "title" : "Initializers"
    },
    {
      "content" : "",
      "items" : [
        {
          "description" : "Specifies the minimum and maximum allowed distance between the pins.",
          "name" : "distanceLimit",
          "url" : "https:\/\/developer.apple.com\/documentation\/RealityKit\/PhysicsDistanceJoint\/distanceLimit"
        },
        {
          "description" : "An extension of the distance limit, as a percentage-based error tolerance.",
          "name" : "tolerance",
          "url" : "https:\/\/developer.apple.com\/documentation\/RealityKit\/PhysicsDistanceJoint\/tolerance"
        }
      ],
      "title" : "Instance Properties"
    },
    {
      "content" : "",
      "items" : [
        {
          "description" : "A joint that allows one degree of rotational freedom between two entity pins, similar to a door swinging on its hinges.",
          "name" : "PhysicsRevoluteJoint",
          "url" : "https:\/\/developer.apple.com\/documentation\/RealityKit\/PhysicsRevoluteJoint"
        },
        {
          "description" : "A joint that allows movement along a straight line, similar to a sliding drawer.",
          "name" : "PhysicsPrismaticJoint",
          "url" : "https:\/\/developer.apple.com\/documentation\/RealityKit\/PhysicsPrismaticJoint"
        },
        {
          "description" : "A spherical joint that allows free rotational movement between two entities’ pins.",
          "name" : "PhysicsSphericalJoint",
          "url" : "https:\/\/developer.apple.com\/documentation\/RealityKit\/PhysicsSphericalJoint"
        },
        {
          "description" : "A joint with six degrees of freedom that can be individually specified.",
          "name" : "PhysicsCustomJoint",
          "url" : "https:\/\/developer.apple.com\/documentation\/RealityKit\/PhysicsCustomJoint"
        },
        {
          "description" : "A joint that rigidly connects two entity pins, with zero degrees of freedom.",
          "name" : "PhysicsFixedJoint",
          "url" : "https:\/\/developer.apple.com\/documentation\/RealityKit\/PhysicsFixedJoint"
        },
        {
          "description" : "A collection of physics joints.",
          "name" : "PhysicsJoints",
          "url" : "https:\/\/developer.apple.com\/documentation\/RealityKit\/PhysicsJoints"
        }
      ],
      "title" : "Built-in joint types"
    }
  ],
  "source" : "appleJSON",
  "title" : "PhysicsDistanceJoint",
  "url" : "https:\/\/developer.apple.com\/documentation\/RealityKit\/PhysicsDistanceJoint"
}