{
  "abstract" : "A blend node that contains an animation.",
  "codeExamples" : [
    {
      "code" : "\/\/ Check if the root node is a source.\nif let blendNode = blendTree.root as? BlendTreeSourceNode {\n    \/\/ Found a source.\n\n\/\/ Check if the root node is a branch.\n} else if let source = blendTree.root as? BlendTreeBlendNode {\n\n        \/\/ Check for a source in the branch's sources.\n        if let source = blendNode.sources[0] as? BlendTreeSourceNode {\n            \/\/ Found a source.\n        }\n    }\n}",
      "language" : "swift"
    }
  ],
  "conformsTo" : [
    "BlendTreeNode"
  ],
  "contentHash" : "3535a240b163a20ed534831b18419c7ddc2b8b20be2c3f0d405530650bfe2340",
  "crawledAt" : "2025-12-03T06:58:33Z",
  "declaration" : {
    "code" : "struct BlendTreeSourceNode",
    "language" : "swift"
  },
  "id" : "830AFBEB-DE51-4A62-B723-3014072279D8",
  "kind" : "struct",
  "language" : "swift",
  "module" : "RealityKit",
  "overview" : "## Overview\n\nThis structure adopts [doc:\/\/com.apple.RealityKit\/documentation\/RealityKit\/BlendTreeNode] and adds the ability to store a single animation. A complete [doc:\/\/com.apple.RealityKit\/documentation\/RealityKit\/BlendTreeAnimation] represents a mix of all the animations that its source nodes contain. Each source node defines a [doc:\/\/com.apple.RealityKit\/documentation\/RealityKit\/BlendTreeSourceNode\/weight] that determines how much effect the source’s animation has in the blend tree’s resulting, mixed animation. To define the source’s animation, set this structure’s [doc:\/\/com.apple.RealityKit\/documentation\/RealityKit\/BlendTreeSourceNode\/source] property.\n\n### Access a source node of a blend tree\n\nA source may exist in any leaf-node position in the blend animation’s tree. The following code checks the root node for a source. If instead the root node is a branch, the code begins checking the branches sources.",
  "platforms" : [
    "iOS",
    "iPadOS",
    "Mac Catalyst",
    "macOS",
    "tvOS",
    "visionOS"
  ],
  "rawMarkdown" : "---\nsource: https:\/\/developer.apple.com\/documentation\/RealityKit\/BlendTreeSourceNode\ncrawled: 2025-12-03T06:58:33Z\n---\n\n# BlendTreeSourceNode\n\n**Structure**\n\nA blend node that contains an animation.\n\n## Declaration\n\n```swift\nstruct BlendTreeSourceNode\n```\n\n## Overview\n\nThis structure adopts [doc:\/\/com.apple.RealityKit\/documentation\/RealityKit\/BlendTreeNode] and adds the ability to store a single animation. A complete [doc:\/\/com.apple.RealityKit\/documentation\/RealityKit\/BlendTreeAnimation] represents a mix of all the animations that its source nodes contain. Each source node defines a [doc:\/\/com.apple.RealityKit\/documentation\/RealityKit\/BlendTreeSourceNode\/weight] that determines how much effect the source’s animation has in the blend tree’s resulting, mixed animation. To define the source’s animation, set this structure’s [doc:\/\/com.apple.RealityKit\/documentation\/RealityKit\/BlendTreeSourceNode\/source] property.\n\n### Access a source node of a blend tree\n\nA source may exist in any leaf-node position in the blend animation’s tree. The following code checks the root node for a source. If instead the root node is a branch, the code begins checking the branches sources.\n\n```swift\n\/\/ Check if the root node is a source.\nif let blendNode = blendTree.root as? BlendTreeSourceNode {\n    \/\/ Found a source.\n\n\/\/ Check if the root node is a branch.\n} else if let source = blendTree.root as? BlendTreeBlendNode {\n\n        \/\/ Check for a source in the branch's sources.\n        if let source = blendNode.sources[0] as? BlendTreeSourceNode {\n            \/\/ Found a source.\n        }\n    }\n}\n```\n\n## Creating a blend tree animation node\n\n- **init(source:name:weight:)**: Creates a node that defines an animation within a tree of other blend nodes.\n\n## Configuring a blend tree animation node\n\n- **name**: A textual name for the blend node.\n- **source**: The blend node’s animation.\n- **weight**: A normalized percentage that designates how much effect this node has compared to peer nodes.\n\n## Blend trees\n\n- **BlendTreeAnimation**: A collection of animations on the same property that the framework blends to a single animation.\n- **BlendTreeNode**: An interface for a node that’s a member of a blend tree.\n- **BlendTreeBlendNode**: A source node for an animation that mixes several animations to form a single animation.\n- **BlendTreeInvalidNode**: A blend tree node that’s internal only or sources from an invalid definition.\n- **BlendWeight**: A numerical representation of the impact an animation has on a scene or entity.\n\n## Conforms To\n\n- BlendTreeNode\n\n",
  "sections" : [
    {
      "content" : "",
      "items" : [
        {
          "description" : "Creates a node that defines an animation within a tree of other blend nodes.",
          "name" : "init(source:name:weight:)",
          "url" : "https:\/\/developer.apple.com\/documentation\/RealityKit\/BlendTreeSourceNode\/init(source:name:weight:)"
        }
      ],
      "title" : "Creating a blend tree animation node"
    },
    {
      "content" : "",
      "items" : [
        {
          "description" : "A textual name for the blend node.",
          "name" : "name",
          "url" : "https:\/\/developer.apple.com\/documentation\/RealityKit\/BlendTreeSourceNode\/name"
        },
        {
          "description" : "The blend node’s animation.",
          "name" : "source",
          "url" : "https:\/\/developer.apple.com\/documentation\/RealityKit\/BlendTreeSourceNode\/source"
        },
        {
          "description" : "A normalized percentage that designates how much effect this node has compared to peer nodes.",
          "name" : "weight",
          "url" : "https:\/\/developer.apple.com\/documentation\/RealityKit\/BlendTreeSourceNode\/weight"
        }
      ],
      "title" : "Configuring a blend tree animation node"
    },
    {
      "content" : "",
      "items" : [
        {
          "description" : "A collection of animations on the same property that the framework blends to a single animation.",
          "name" : "BlendTreeAnimation",
          "url" : "https:\/\/developer.apple.com\/documentation\/RealityKit\/BlendTreeAnimation"
        },
        {
          "description" : "An interface for a node that’s a member of a blend tree.",
          "name" : "BlendTreeNode",
          "url" : "https:\/\/developer.apple.com\/documentation\/RealityKit\/BlendTreeNode"
        },
        {
          "description" : "A source node for an animation that mixes several animations to form a single animation.",
          "name" : "BlendTreeBlendNode",
          "url" : "https:\/\/developer.apple.com\/documentation\/RealityKit\/BlendTreeBlendNode"
        },
        {
          "description" : "A blend tree node that’s internal only or sources from an invalid definition.",
          "name" : "BlendTreeInvalidNode",
          "url" : "https:\/\/developer.apple.com\/documentation\/RealityKit\/BlendTreeInvalidNode"
        },
        {
          "description" : "A numerical representation of the impact an animation has on a scene or entity.",
          "name" : "BlendWeight",
          "url" : "https:\/\/developer.apple.com\/documentation\/RealityKit\/BlendWeight"
        }
      ],
      "title" : "Blend trees"
    }
  ],
  "source" : "appleJSON",
  "title" : "BlendTreeSourceNode",
  "url" : "https:\/\/developer.apple.com\/documentation\/RealityKit\/BlendTreeSourceNode"
}