{
  "abstract" : "The base protocol for action handlers.",
  "codeExamples" : [
    {
      "code" : "struct MyAction: EntityAction {\n    ...\n}\nMyAction.subscribe(to: .started) { event in\n    let action = event.action\n    \/\/ Do something with the action.\n}",
      "language" : "swift"
    },
    {
      "code" : "struct MyAction: EntityAction { }\n\nstruct MyActionHandler: ActionHandlerProtocol {\n\n   typealias ActionType = MyAction\n\n   \/\/ Application data can be stored within the handler.\n   var applicationData: ApplicationData\n\n   \/\/ Customizable init\n   init(action: MyAction, player: Entity, currentLevel: Int) { ... }\n\n   \/\/ Process start events\n   mutating func actionStarted(event: EventType) { }\n}\n\nMyActionHandler.register { event in\n    \/\/ Create the handler.\n    return MyActionHandler(applicationData: appData)\n}",
      "language" : "swift"
    }
  ],
  "contentHash" : "2ed657031202fb151e1b7ea19c6df56b44a6e588b34931ba2ab7fbd5bde854d7",
  "crawledAt" : "2025-12-01T12:06:03Z",
  "declaration" : {
    "code" : "protocol ActionHandlerProtocol",
    "language" : "swift"
  },
  "id" : "E051518F-7152-4A3C-99B8-6D149388A899",
  "kind" : "protocol",
  "module" : "RealityKit",
  "overview" : "## Overview\n\nOne of two approaches can be taken when subscribing to, and responding to action events. Which approach is taken is dictated by complexity of the action, and user preference.\n\nThe simplest approach is to process action events using an external closure. This saves having to define a formal handler for the action. For example:\n\nThe other approach is to use a formal handler. This requires defining a structure for the handler that conforms to the `ActionHandlerProtocol` and registering the handler so it can be instantiated when the action animation is played. It is only necessary to define the event functions for the event types that one wishes to respond to.\n\nFor example:",
  "platforms" : [
    "iOS",
    "iPadOS",
    "Mac Catalyst",
    "macOS",
    "tvOS",
    "visionOS"
  ],
  "rawMarkdown" : "---\nsource: https:\/\/developer.apple.com\/documentation\/RealityKit\/ActionHandlerProtocol\ncrawled: 2025-12-01T12:06:03Z\n---\n\n# ActionHandlerProtocol\n\n**Protocol**\n\nThe base protocol for action handlers.\n\n## Declaration\n\n```swift\nprotocol ActionHandlerProtocol\n```\n\n## Overview\n\nOne of two approaches can be taken when subscribing to, and responding to action events. Which approach is taken is dictated by complexity of the action, and user preference.\n\nThe simplest approach is to process action events using an external closure. This saves having to define a formal handler for the action. For example:\n\n```swift\nstruct MyAction: EntityAction {\n    ...\n}\nMyAction.subscribe(to: .started) { event in\n    let action = event.action\n    \/\/ Do something with the action.\n}\n```\n\nThe other approach is to use a formal handler. This requires defining a structure for the handler that conforms to the `ActionHandlerProtocol` and registering the handler so it can be instantiated when the action animation is played. It is only necessary to define the event functions for the event types that one wishes to respond to.\n\nFor example:\n\n```swift\nstruct MyAction: EntityAction { }\n\nstruct MyActionHandler: ActionHandlerProtocol {\n\n   typealias ActionType = MyAction\n\n   \/\/ Application data can be stored within the handler.\n   var applicationData: ApplicationData\n\n   \/\/ Customizable init\n   init(action: MyAction, player: Entity, currentLevel: Int) { ... }\n\n   \/\/ Process start events\n   mutating func actionStarted(event: EventType) { }\n}\n\nMyActionHandler.register { event in\n    \/\/ Create the handler.\n    return MyActionHandler(applicationData: appData)\n}\n```\n\n## Associated Types\n\n- **ActionType**: The action type associated that is associated with the handler.\n\n## Instance Methods\n\n- **actionEnded(event:)**: The function used to respond to action ended events.\n- **actionPaused(event:)**: The function used to respond to action paused events.\n- **actionResumed(event:)**: The function used to respond to action resumed events.\n- **actionSkipped(event:)**: The function used to respond to action skipped events.\n- **actionStarted(event:)**: The function used to respond to action started events.\n- **actionTerminated(event:)**: The function used to respond to action terminated events.\n- **actionUpdated(event:)**: The function used to respond to action updated events.\n\n## Type Aliases\n\n- **ActionHandlerProtocol.EventType**: The event type returned to each event function in the handler.\n\n## Type Methods\n\n- **register(_:)**: Registers a handler that responds to raised action events for a particular action type.\n\n## Action management\n\n- **EntityAction**: A protocol that defines an action for an entity.\n- **ActionAnimation**: Defines an an action animation.\n- **ActionEntityResolution**: Options available to determine the resolution method for a target entity in an action.\n\n",
  "sections" : [
    {
      "content" : "",
      "items" : [
        {
          "description" : "The action type associated that is associated with the handler.",
          "name" : "ActionType",
          "url" : "https:\/\/developer.apple.com\/documentation\/RealityKit\/ActionHandlerProtocol\/ActionType"
        }
      ],
      "title" : "Associated Types"
    },
    {
      "content" : "",
      "items" : [
        {
          "description" : "The function used to respond to action ended events.",
          "name" : "actionEnded(event:)",
          "url" : "https:\/\/developer.apple.com\/documentation\/RealityKit\/ActionHandlerProtocol\/actionEnded(event:)"
        },
        {
          "description" : "The function used to respond to action paused events.",
          "name" : "actionPaused(event:)",
          "url" : "https:\/\/developer.apple.com\/documentation\/RealityKit\/ActionHandlerProtocol\/actionPaused(event:)"
        },
        {
          "description" : "The function used to respond to action resumed events.",
          "name" : "actionResumed(event:)",
          "url" : "https:\/\/developer.apple.com\/documentation\/RealityKit\/ActionHandlerProtocol\/actionResumed(event:)"
        },
        {
          "description" : "The function used to respond to action skipped events.",
          "name" : "actionSkipped(event:)",
          "url" : "https:\/\/developer.apple.com\/documentation\/RealityKit\/ActionHandlerProtocol\/actionSkipped(event:)"
        },
        {
          "description" : "The function used to respond to action started events.",
          "name" : "actionStarted(event:)",
          "url" : "https:\/\/developer.apple.com\/documentation\/RealityKit\/ActionHandlerProtocol\/actionStarted(event:)"
        },
        {
          "description" : "The function used to respond to action terminated events.",
          "name" : "actionTerminated(event:)",
          "url" : "https:\/\/developer.apple.com\/documentation\/RealityKit\/ActionHandlerProtocol\/actionTerminated(event:)"
        },
        {
          "description" : "The function used to respond to action updated events.",
          "name" : "actionUpdated(event:)",
          "url" : "https:\/\/developer.apple.com\/documentation\/RealityKit\/ActionHandlerProtocol\/actionUpdated(event:)"
        }
      ],
      "title" : "Instance Methods"
    },
    {
      "content" : "",
      "items" : [
        {
          "description" : "The event type returned to each event function in the handler.",
          "name" : "ActionHandlerProtocol.EventType",
          "url" : "https:\/\/developer.apple.com\/documentation\/RealityKit\/ActionHandlerProtocol\/EventType"
        }
      ],
      "title" : "Type Aliases"
    },
    {
      "content" : "",
      "items" : [
        {
          "description" : "Registers a handler that responds to raised action events for a particular action type.",
          "name" : "register(_:)",
          "url" : "https:\/\/developer.apple.com\/documentation\/RealityKit\/ActionHandlerProtocol\/register(_:)"
        }
      ],
      "title" : "Type Methods"
    },
    {
      "content" : "",
      "items" : [
        {
          "description" : "A protocol that defines an action for an entity.",
          "name" : "EntityAction",
          "url" : "https:\/\/developer.apple.com\/documentation\/RealityKit\/EntityAction"
        },
        {
          "description" : "Defines an an action animation.",
          "name" : "ActionAnimation",
          "url" : "https:\/\/developer.apple.com\/documentation\/RealityKit\/ActionAnimation"
        },
        {
          "description" : "Options available to determine the resolution method for a target entity in an action.",
          "name" : "ActionEntityResolution",
          "url" : "https:\/\/developer.apple.com\/documentation\/RealityKit\/ActionEntityResolution"
        }
      ],
      "title" : "Action management"
    }
  ],
  "source" : "appleJSON",
  "title" : "ActionHandlerProtocol",
  "url" : "https:\/\/developer.apple.com\/documentation\/RealityKit\/ActionHandlerProtocol"
}