{
  "abstract" : "Options for specifying the axis about which the particle will be oriented, used by the `billboardMode` property.",
  "codeExamples" : [

  ],
  "conformsTo" : [
    "Decodable",
    "Encodable",
    "Equatable",
    "Hashable"
  ],
  "contentHash" : "1f7f2552d4b624e61ea073b25ae637215d10d2a189d04e2208b451061c48127b",
  "crawledAt" : "2025-12-02T20:03:53Z",
  "declaration" : {
    "code" : "enum BillboardMode",
    "language" : "swift"
  },
  "id" : "A5A7C0C1-D2E9-4F43-9D69-3DDA91FE45C3",
  "kind" : "enum",
  "language" : "swift",
  "module" : "RealityKit",
  "platforms" : [
    "iOS",
    "iPadOS",
    "Mac Catalyst",
    "macOS",
    "tvOS",
    "visionOS"
  ],
  "rawMarkdown" : "---\nsource: https:\/\/developer.apple.com\/documentation\/realitykit\/particleemittercomponent\/particleemitter\/billboardmode-swift.enum\ncrawled: 2025-12-02T20:03:53Z\n---\n\n# ParticleEmitterComponent.ParticleEmitter.BillboardMode\n\n**Enumeration**\n\nOptions for specifying the axis about which the particle will be oriented, used by the `billboardMode` property.\n\n## Declaration\n\n```swift\nenum BillboardMode\n```\n\n## Enumeration Cases\n\n- **ParticleEmitterComponent.ParticleEmitter.BillboardMode.billboard**: Each particle is oriented to face the camera.\n- **ParticleEmitterComponent.ParticleEmitter.BillboardMode.billboardYAligned**: Each particle is oriented to face the camera but remains fixed about the y-axis\n- **ParticleEmitterComponent.ParticleEmitter.BillboardMode.free(axis:variation:)**: The axis about which the particle will be oriented is the given `axis`. The `variation` is a unit multiplier that determines how far from the given axis the particle is allowed to actually be oriented.\n\n## Conforms To\n\n- Decodable\n- Encodable\n- Equatable\n- Hashable\n\n",
  "sections" : [
    {
      "content" : "",
      "items" : [
        {
          "description" : "Each particle is oriented to face the camera.",
          "name" : "ParticleEmitterComponent.ParticleEmitter.BillboardMode.billboard",
          "url" : "https:\/\/developer.apple.com\/documentation\/RealityKit\/ParticleEmitterComponent\/ParticleEmitter\/BillboardMode-swift.enum\/billboard"
        },
        {
          "description" : "Each particle is oriented to face the camera but remains fixed about the y-axis",
          "name" : "ParticleEmitterComponent.ParticleEmitter.BillboardMode.billboardYAligned",
          "url" : "https:\/\/developer.apple.com\/documentation\/RealityKit\/ParticleEmitterComponent\/ParticleEmitter\/BillboardMode-swift.enum\/billboardYAligned"
        },
        {
          "description" : "The axis about which the particle will be oriented is the given `axis`. The `variation` is a unit multiplier that determines how far from the given axis the particle is allowed to actually be oriented.",
          "name" : "ParticleEmitterComponent.ParticleEmitter.BillboardMode.free(axis:variation:)",
          "url" : "https:\/\/developer.apple.com\/documentation\/RealityKit\/ParticleEmitterComponent\/ParticleEmitter\/BillboardMode-swift.enum\/free(axis:variation:)"
        }
      ],
      "title" : "Enumeration Cases"
    }
  ],
  "source" : "appleJSON",
  "title" : "ParticleEmitterComponent.ParticleEmitter.BillboardMode",
  "url" : "https:\/\/developer.apple.com\/documentation\/realitykit\/particleemittercomponent\/particleemitter\/billboardmode-swift.enum"
}