{
  "abstract" : "A mode that displays the normal vectors as a color.",
  "codeExamples" : [
    {
      "code" : "if let television = try? await ModelEntity(named: \"tv_retro\") {\n    let component = ModelDebugOptionsComponent(visualizationMode: .normal)\n    television.components.set(component)\n}",
      "language" : "swift"
    }
  ],
  "contentHash" : "8a13a5647b6b8c9489c9bc897210c6382be33eadf1f6eaaa6345621d73fdf37d",
  "crawledAt" : "2025-12-05T01:22:06Z",
  "declaration" : {
    "code" : "case normal",
    "language" : "swift"
  },
  "id" : "370742E0-0DCB-4C66-90F8-472D6B3CCA97",
  "kind" : "unknown",
  "language" : "swift",
  "module" : "RealityKit",
  "overview" : "## Discussion\n\nAdd a [doc:\/\/com.apple.RealityKit\/documentation\/RealityKit\/ModelDebugOptionsComponent] with a visualization mode of `normal` to an entity to tell RealityKit to draw that entity’s *surface normal vectors* as its surface color. A normal vector is an imaginary line perpendicular to the surface of the object at a specific point. RealityKit draws a normal vector by using its `X`, `Y`, and `Z` values as the `R`, `G`, and `B` components of the color.\n\nRealityKit calculates normals for entities with a [doc:\/\/com.apple.RealityKit\/documentation\/RealityKit\/VideoMaterial], [doc:\/\/com.apple.RealityKit\/documentation\/RealityKit\/UnlitMaterial], or [doc:\/\/com.apple.RealityKit\/documentation\/RealityKit\/SimpleMaterial] as well as for entities imported from a USDZ file. If an entity doesn’t fall within those parameters, this option has no effect on the rendering.\n\nHere’s how to enable surface normal visualization for an entity:",
  "platforms" : [
    "iOS",
    "iPadOS",
    "Mac Catalyst",
    "macOS",
    "tvOS",
    "visionOS"
  ],
  "rawMarkdown" : "---\nsource: https:\/\/developer.apple.com\/documentation\/RealityKit\/ModelDebugOptionsComponent\/VisualizationMode-swift.enum\/normal\ncrawled: 2025-12-05T01:22:06Z\n---\n\n# ModelDebugOptionsComponent.VisualizationMode.normal\n\n**Case**\n\nA mode that displays the normal vectors as a color.\n\n## Declaration\n\n```swift\ncase normal\n```\n\n## Discussion\n\nAdd a [doc:\/\/com.apple.RealityKit\/documentation\/RealityKit\/ModelDebugOptionsComponent] with a visualization mode of `normal` to an entity to tell RealityKit to draw that entity’s *surface normal vectors* as its surface color. A normal vector is an imaginary line perpendicular to the surface of the object at a specific point. RealityKit draws a normal vector by using its `X`, `Y`, and `Z` values as the `R`, `G`, and `B` components of the color.\n\nRealityKit calculates normals for entities with a [doc:\/\/com.apple.RealityKit\/documentation\/RealityKit\/VideoMaterial], [doc:\/\/com.apple.RealityKit\/documentation\/RealityKit\/UnlitMaterial], or [doc:\/\/com.apple.RealityKit\/documentation\/RealityKit\/SimpleMaterial] as well as for entities imported from a USDZ file. If an entity doesn’t fall within those parameters, this option has no effect on the rendering.\n\nHere’s how to enable surface normal visualization for an entity:\n\n```swift\nif let television = try? await ModelEntity(named: \"tv_retro\") {\n    let component = ModelDebugOptionsComponent(visualizationMode: .normal)\n    television.components.set(component)\n}\n```\n\n\n\n## Visualization modes\n\n- **ModelDebugOptionsComponent.VisualizationMode.none**: A mode that doesn’t display a visualization.\n- **ModelDebugOptionsComponent.VisualizationMode.tangent**: A mode that displays the surface tangent vectors as a color.\n- **ModelDebugOptionsComponent.VisualizationMode.bitangent**: A mode that displays the surface bitangent vectors as a color.\n- **ModelDebugOptionsComponent.VisualizationMode.baseColor**: A mode that displays the entity’s base color with no lighting or material properties applied.\n- **ModelDebugOptionsComponent.VisualizationMode.textureCoordinates**: A mode that displays the texture coordinates as a color.\n- **ModelDebugOptionsComponent.VisualizationMode.finalColor**: A mode that displays the entity’s calculated color, ignoring transparency.\n- **ModelDebugOptionsComponent.VisualizationMode.finalAlpha**: A mode that displays the entity’s calculated transparency as its surface color.\n- **ModelDebugOptionsComponent.VisualizationMode.roughness**: A mode that displays the shininess of a material as the surface color.\n- **ModelDebugOptionsComponent.VisualizationMode.metallic**: A mode that displays the reflectiveness of an entity as its surface color.\n- **ModelDebugOptionsComponent.VisualizationMode.ambientOcclusion**: A mode that displays the calculated ambient occlusion value as the surface color.\n- **ModelDebugOptionsComponent.VisualizationMode.specular**: A mode that displays en entity’s shininess as its surface color.\n- **ModelDebugOptionsComponent.VisualizationMode.emissive**: A mode that displays the emissive channel of a material as the surface color.\n- **ModelDebugOptionsComponent.VisualizationMode.clearcoat**: A mode that displays the clearcoat channel of a material as the surface color.\n- **ModelDebugOptionsComponent.VisualizationMode.clearcoatRoughness**: A mode that displays the clearcoat roughness channel of a material as the surface color.\n- **ModelDebugOptionsComponent.VisualizationMode.lightingDiffuse**: A mode that displays the intensity of indirect light hitting the entity as its surface color.\n\n",
  "sections" : [
    {
      "content" : "",
      "items" : [
        {
          "description" : "A mode that doesn’t display a visualization.",
          "name" : "ModelDebugOptionsComponent.VisualizationMode.none",
          "url" : "https:\/\/developer.apple.com\/documentation\/RealityKit\/ModelDebugOptionsComponent\/VisualizationMode-swift.enum\/none"
        },
        {
          "description" : "A mode that displays the surface tangent vectors as a color.",
          "name" : "ModelDebugOptionsComponent.VisualizationMode.tangent",
          "url" : "https:\/\/developer.apple.com\/documentation\/RealityKit\/ModelDebugOptionsComponent\/VisualizationMode-swift.enum\/tangent"
        },
        {
          "description" : "A mode that displays the surface bitangent vectors as a color.",
          "name" : "ModelDebugOptionsComponent.VisualizationMode.bitangent",
          "url" : "https:\/\/developer.apple.com\/documentation\/RealityKit\/ModelDebugOptionsComponent\/VisualizationMode-swift.enum\/bitangent"
        },
        {
          "description" : "A mode that displays the entity’s base color with no lighting or material properties applied.",
          "name" : "ModelDebugOptionsComponent.VisualizationMode.baseColor",
          "url" : "https:\/\/developer.apple.com\/documentation\/RealityKit\/ModelDebugOptionsComponent\/VisualizationMode-swift.enum\/baseColor"
        },
        {
          "description" : "A mode that displays the texture coordinates as a color.",
          "name" : "ModelDebugOptionsComponent.VisualizationMode.textureCoordinates",
          "url" : "https:\/\/developer.apple.com\/documentation\/RealityKit\/ModelDebugOptionsComponent\/VisualizationMode-swift.enum\/textureCoordinates"
        },
        {
          "description" : "A mode that displays the entity’s calculated color, ignoring transparency.",
          "name" : "ModelDebugOptionsComponent.VisualizationMode.finalColor",
          "url" : "https:\/\/developer.apple.com\/documentation\/RealityKit\/ModelDebugOptionsComponent\/VisualizationMode-swift.enum\/finalColor"
        },
        {
          "description" : "A mode that displays the entity’s calculated transparency as its surface color.",
          "name" : "ModelDebugOptionsComponent.VisualizationMode.finalAlpha",
          "url" : "https:\/\/developer.apple.com\/documentation\/RealityKit\/ModelDebugOptionsComponent\/VisualizationMode-swift.enum\/finalAlpha"
        },
        {
          "description" : "A mode that displays the shininess of a material as the surface color.",
          "name" : "ModelDebugOptionsComponent.VisualizationMode.roughness",
          "url" : "https:\/\/developer.apple.com\/documentation\/RealityKit\/ModelDebugOptionsComponent\/VisualizationMode-swift.enum\/roughness"
        },
        {
          "description" : "A mode that displays the reflectiveness of an entity as its surface color.",
          "name" : "ModelDebugOptionsComponent.VisualizationMode.metallic",
          "url" : "https:\/\/developer.apple.com\/documentation\/RealityKit\/ModelDebugOptionsComponent\/VisualizationMode-swift.enum\/metallic"
        },
        {
          "description" : "A mode that displays the calculated ambient occlusion value as the surface color.",
          "name" : "ModelDebugOptionsComponent.VisualizationMode.ambientOcclusion",
          "url" : "https:\/\/developer.apple.com\/documentation\/RealityKit\/ModelDebugOptionsComponent\/VisualizationMode-swift.enum\/ambientOcclusion"
        },
        {
          "description" : "A mode that displays en entity’s shininess as its surface color.",
          "name" : "ModelDebugOptionsComponent.VisualizationMode.specular",
          "url" : "https:\/\/developer.apple.com\/documentation\/RealityKit\/ModelDebugOptionsComponent\/VisualizationMode-swift.enum\/specular"
        },
        {
          "description" : "A mode that displays the emissive channel of a material as the surface color.",
          "name" : "ModelDebugOptionsComponent.VisualizationMode.emissive",
          "url" : "https:\/\/developer.apple.com\/documentation\/RealityKit\/ModelDebugOptionsComponent\/VisualizationMode-swift.enum\/emissive"
        },
        {
          "description" : "A mode that displays the clearcoat channel of a material as the surface color.",
          "name" : "ModelDebugOptionsComponent.VisualizationMode.clearcoat",
          "url" : "https:\/\/developer.apple.com\/documentation\/RealityKit\/ModelDebugOptionsComponent\/VisualizationMode-swift.enum\/clearcoat"
        },
        {
          "description" : "A mode that displays the clearcoat roughness channel of a material as the surface color.",
          "name" : "ModelDebugOptionsComponent.VisualizationMode.clearcoatRoughness",
          "url" : "https:\/\/developer.apple.com\/documentation\/RealityKit\/ModelDebugOptionsComponent\/VisualizationMode-swift.enum\/clearcoatRoughness"
        },
        {
          "description" : "A mode that displays the intensity of indirect light hitting the entity as its surface color.",
          "name" : "ModelDebugOptionsComponent.VisualizationMode.lightingDiffuse",
          "url" : "https:\/\/developer.apple.com\/documentation\/RealityKit\/ModelDebugOptionsComponent\/VisualizationMode-swift.enum\/lightingDiffuse"
        }
      ],
      "title" : "Visualization modes"
    }
  ],
  "source" : "appleJSON",
  "title" : "ModelDebugOptionsComponent.VisualizationMode.normal",
  "url" : "https:\/\/developer.apple.com\/documentation\/RealityKit\/ModelDebugOptionsComponent\/VisualizationMode-swift.enum\/normal"
}