{
  "abstract" : "A set of events that an action responds to.",
  "codeExamples" : [

  ],
  "conformsTo" : [
    "Equatable",
    "ExpressibleByArrayLiteral",
    "Hashable",
    "OptionSet",
    "RawRepresentable",
    "SetAlgebra"
  ],
  "contentHash" : "b8bc3b3ac80b9dc2c6912763e44591130192155f1d40899fb6f8af211bb4f9e4",
  "crawledAt" : "2025-12-03T07:16:58Z",
  "declaration" : {
    "code" : "struct ActionEventType",
    "language" : "swift"
  },
  "id" : "240C636B-53C8-43FF-B9C8-32342418E742",
  "kind" : "struct",
  "language" : "swift",
  "module" : "RealityKit",
  "overview" : "## Overview\n\nActions can respond to specific events with one or more custom event handlers that you associate with each event type.\n\nRealityKit calls the event handlers when the animation time enters, exits, or continues within a time interval for an [doc:\/\/com.apple.RealityKit\/documentation\/RealityKit\/ActionEventDefinition].\n\nA time interval for an event begins at its starting time and spans up to, but doesn’t include, the event’s starting time plus its duration.",
  "platforms" : [
    "iOS",
    "iPadOS",
    "Mac Catalyst",
    "macOS",
    "tvOS",
    "visionOS"
  ],
  "rawMarkdown" : "---\nsource: https:\/\/developer.apple.com\/documentation\/RealityKit\/ActionEventType\ncrawled: 2025-12-03T07:16:58Z\n---\n\n# ActionEventType\n\n**Structure**\n\nA set of events that an action responds to.\n\n## Declaration\n\n```swift\nstruct ActionEventType\n```\n\n## Overview\n\nActions can respond to specific events with one or more custom event handlers that you associate with each event type.\n\nRealityKit calls the event handlers when the animation time enters, exits, or continues within a time interval for an [doc:\/\/com.apple.RealityKit\/documentation\/RealityKit\/ActionEventDefinition].\n\nA time interval for an event begins at its starting time and spans up to, but doesn’t include, the event’s starting time plus its duration.\n\n## Event types\n\n- **started**: An event that takes place when a new action event begins.\n- **ended**: An event that takes place when the action event exits its time interval.\n- **paused**: An event that takes place when the animation pauses.\n- **resumed**: An event that takes place when the animation resumes after a pause.\n- **updated**: An event that takes place after an action event starts and is within its time interval.\n- **skipped**: An event that takes place when the system misses an action event’s time interval.\n- **terminated**: An event that takes place when the animation ends.\n\n## Protocol support\n\n- **init(rawValue:)**: Creates an action event type from a raw value.\n- **rawValue**: The backing storage for action event types.\n\n## Action events\n\n- **ActionEvent**: The structure returned to all action event handlers.\n- **AnimationState**: The concretely typed animation state structure.\n- **ActionEventDefinition**: Defines an action event interval, and any associated parameters.\n- **AnimationStateProtocol**: The protocol representing the current animation state of an action animation.\n\n## Conforms To\n\n- Equatable\n- ExpressibleByArrayLiteral\n- Hashable\n- OptionSet\n- RawRepresentable\n- SetAlgebra\n\n",
  "sections" : [
    {
      "content" : "",
      "items" : [
        {
          "description" : "An event that takes place when a new action event begins.",
          "name" : "started",
          "url" : "https:\/\/developer.apple.com\/documentation\/RealityKit\/ActionEventType\/started"
        },
        {
          "description" : "An event that takes place when the action event exits its time interval.",
          "name" : "ended",
          "url" : "https:\/\/developer.apple.com\/documentation\/RealityKit\/ActionEventType\/ended"
        },
        {
          "description" : "An event that takes place when the animation pauses.",
          "name" : "paused",
          "url" : "https:\/\/developer.apple.com\/documentation\/RealityKit\/ActionEventType\/paused"
        },
        {
          "description" : "An event that takes place when the animation resumes after a pause.",
          "name" : "resumed",
          "url" : "https:\/\/developer.apple.com\/documentation\/RealityKit\/ActionEventType\/resumed"
        },
        {
          "description" : "An event that takes place after an action event starts and is within its time interval.",
          "name" : "updated",
          "url" : "https:\/\/developer.apple.com\/documentation\/RealityKit\/ActionEventType\/updated"
        },
        {
          "description" : "An event that takes place when the system misses an action event’s time interval.",
          "name" : "skipped",
          "url" : "https:\/\/developer.apple.com\/documentation\/RealityKit\/ActionEventType\/skipped"
        },
        {
          "description" : "An event that takes place when the animation ends.",
          "name" : "terminated",
          "url" : "https:\/\/developer.apple.com\/documentation\/RealityKit\/ActionEventType\/terminated"
        }
      ],
      "title" : "Event types"
    },
    {
      "content" : "",
      "items" : [
        {
          "description" : "Creates an action event type from a raw value.",
          "name" : "init(rawValue:)",
          "url" : "https:\/\/developer.apple.com\/documentation\/RealityKit\/ActionEventType\/init(rawValue:)"
        },
        {
          "description" : "The backing storage for action event types.",
          "name" : "rawValue",
          "url" : "https:\/\/developer.apple.com\/documentation\/RealityKit\/ActionEventType\/rawValue"
        }
      ],
      "title" : "Protocol support"
    },
    {
      "content" : "",
      "items" : [
        {
          "description" : "The structure returned to all action event handlers.",
          "name" : "ActionEvent",
          "url" : "https:\/\/developer.apple.com\/documentation\/RealityKit\/ActionEvent"
        },
        {
          "description" : "The concretely typed animation state structure.",
          "name" : "AnimationState",
          "url" : "https:\/\/developer.apple.com\/documentation\/RealityKit\/AnimationState"
        },
        {
          "description" : "Defines an action event interval, and any associated parameters.",
          "name" : "ActionEventDefinition",
          "url" : "https:\/\/developer.apple.com\/documentation\/RealityKit\/ActionEventDefinition"
        },
        {
          "description" : "The protocol representing the current animation state of an action animation.",
          "name" : "AnimationStateProtocol",
          "url" : "https:\/\/developer.apple.com\/documentation\/RealityKit\/AnimationStateProtocol"
        }
      ],
      "title" : "Action events"
    }
  ],
  "source" : "appleJSON",
  "title" : "ActionEventType",
  "url" : "https:\/\/developer.apple.com\/documentation\/RealityKit\/ActionEventType"
}