{
  "abstract" : "A component that provides functionality for controlling the playback of audio you assign to mix groups in a scene.",
  "codeExamples" : [
    {
      "code" : "let sceneEntity = Entity(named: \"ContainsAudio\", in: realityKitContentBundle)\n\n\/\/ AudioMixGroupsComponent exists on the first descendant Entity in a scene.\nvar audioMixGroupsEntity = sceneEntity.children[0]\n\n\/\/ If no audio mix groups are configured for this scene in Reality Composer Pro, this component won't exist.\nguard var audioMixGroupsComponent = audioMixGroupsEntity.components[AudioMixGroupsComponent.self], \n    var sfxGroup = audioMixGroupsComponent.mixGroup(named: \"SFX\") else {\n    return\n}\n\n\/\/ This code remaps a percent value between 0 and 100 to a decibel value between -60.0 and 0.0.\n\/\/ Because -60.0 dB is near the low-end of human hearing ability, this is a good value to use in this example.\nlet volumePercent: Float = 50\nlet decibels = Audio.Decibel(-40.0 + (20 * log10(volumePercent)))\n\n\/\/ Control the playback volume with the gain property on an AudioMixGroup.\nsfxGroup.gain = decibels\n\naudioMixGroupsComponent.set(sfxGroup)\naudioMixGroupsEntity.components.set(audioMixGroupsComponent)",
      "language" : "swift"
    }
  ],
  "conformsTo" : [
    "Component",
    "Copyable",
    "Equatable",
    "Hashable"
  ],
  "contentHash" : "b2ec7e7ac71b48a38e59c35cb8b999ba33e110e2d3641d48b76639a21352b10c",
  "crawledAt" : "2025-12-02T19:51:11Z",
  "declaration" : {
    "code" : "struct AudioMixGroupsComponent",
    "language" : "swift"
  },
  "id" : "23F3967D-873A-4FC4-985D-B9DCFCEAC42A",
  "kind" : "struct",
  "language" : "swift",
  "module" : "RealityKit",
  "overview" : "## Overview\n\nWhen defining an [doc:\/\/com.apple.RealityKit\/documentation\/RealityKit\/AudioMixGroup] for a scene in the Audio Mixer section of Reality Composer Pro, this component exists on the first descendant [doc:\/\/com.apple.RealityKit\/documentation\/RealityKit\/Entity] in the scene at runtime.\n\nA common use case for `AudioMixGroupsComponent` is to simultaneously control the playback volume of every [doc:\/\/com.apple.RealityKit\/documentation\/RealityKit\/AudioResource] in an `AudioMixGroup`, such as the sound effects in a scene. The following example sets the playback volume of every `AudioResource` in the `AudioMixGroup` named SFX:\n\nTo completely silence an `AudioMixGroup`, use the [doc:\/\/com.apple.RealityKit\/documentation\/RealityKit\/AudioMixGroup\/isMuted] property.\n\nUse [doc:\/\/com.apple.RealityKit\/documentation\/RealityKit\/AudioMixGroup\/fade(to:duration:)] to fade the volume of an `AudioMixGroup` over time.",
  "platforms" : [
    "iOS",
    "iPadOS",
    "Mac Catalyst",
    "macOS",
    "tvOS",
    "visionOS"
  ],
  "rawMarkdown" : "---\nsource: https:\/\/developer.apple.com\/documentation\/RealityKit\/AudioMixGroupsComponent\ncrawled: 2025-12-02T19:51:11Z\n---\n\n# AudioMixGroupsComponent\n\n**Structure**\n\nA component that provides functionality for controlling the playback of audio you assign to mix groups in a scene.\n\n## Declaration\n\n```swift\nstruct AudioMixGroupsComponent\n```\n\n## Overview\n\nWhen defining an [doc:\/\/com.apple.RealityKit\/documentation\/RealityKit\/AudioMixGroup] for a scene in the Audio Mixer section of Reality Composer Pro, this component exists on the first descendant [doc:\/\/com.apple.RealityKit\/documentation\/RealityKit\/Entity] in the scene at runtime.\n\nA common use case for `AudioMixGroupsComponent` is to simultaneously control the playback volume of every [doc:\/\/com.apple.RealityKit\/documentation\/RealityKit\/AudioResource] in an `AudioMixGroup`, such as the sound effects in a scene. The following example sets the playback volume of every `AudioResource` in the `AudioMixGroup` named SFX:\n\n```swift\nlet sceneEntity = Entity(named: \"ContainsAudio\", in: realityKitContentBundle)\n\n\/\/ AudioMixGroupsComponent exists on the first descendant Entity in a scene.\nvar audioMixGroupsEntity = sceneEntity.children[0]\n\n\/\/ If no audio mix groups are configured for this scene in Reality Composer Pro, this component won't exist.\nguard var audioMixGroupsComponent = audioMixGroupsEntity.components[AudioMixGroupsComponent.self], \n    var sfxGroup = audioMixGroupsComponent.mixGroup(named: \"SFX\") else {\n    return\n}\n\n\/\/ This code remaps a percent value between 0 and 100 to a decibel value between -60.0 and 0.0.\n\/\/ Because -60.0 dB is near the low-end of human hearing ability, this is a good value to use in this example.\nlet volumePercent: Float = 50\nlet decibels = Audio.Decibel(-40.0 + (20 * log10(volumePercent)))\n\n\/\/ Control the playback volume with the gain property on an AudioMixGroup.\nsfxGroup.gain = decibels\n\naudioMixGroupsComponent.set(sfxGroup)\naudioMixGroupsEntity.components.set(audioMixGroupsComponent)\n```\n\nTo completely silence an `AudioMixGroup`, use the [doc:\/\/com.apple.RealityKit\/documentation\/RealityKit\/AudioMixGroup\/isMuted] property.\n\nUse [doc:\/\/com.apple.RealityKit\/documentation\/RealityKit\/AudioMixGroup\/fade(to:duration:)] to fade the volume of an `AudioMixGroup` over time.\n\n## Initializers\n\n- **init(mixGroups:)**: Initializes an `AudioMixGroupsComponent`.\n\n## Instance Methods\n\n- **mixGroup(named:)**: Returns the audio mix group with the given name, if it exists.\n- **remove(named:)**: Removes the audio mix group with the given name, if it exists, from the component.\n- **set(_:)**: Adds the given `AudioMixGroup` to the component.\n\n## Audio mixing\n\n- **AudioMixGroup**: A group that manages the playback properties of multiple playing sounds.\n\n## Conforms To\n\n- Component\n- Copyable\n- Equatable\n- Hashable\n\n",
  "sections" : [
    {
      "content" : "",
      "items" : [
        {
          "description" : "Initializes an `AudioMixGroupsComponent`.",
          "name" : "init(mixGroups:)",
          "url" : "https:\/\/developer.apple.com\/documentation\/RealityKit\/AudioMixGroupsComponent\/init(mixGroups:)"
        }
      ],
      "title" : "Initializers"
    },
    {
      "content" : "",
      "items" : [
        {
          "description" : "Returns the audio mix group with the given name, if it exists.",
          "name" : "mixGroup(named:)",
          "url" : "https:\/\/developer.apple.com\/documentation\/RealityKit\/AudioMixGroupsComponent\/mixGroup(named:)"
        },
        {
          "description" : "Removes the audio mix group with the given name, if it exists, from the component.",
          "name" : "remove(named:)",
          "url" : "https:\/\/developer.apple.com\/documentation\/RealityKit\/AudioMixGroupsComponent\/remove(named:)"
        },
        {
          "description" : "Adds the given `AudioMixGroup` to the component.",
          "name" : "set(_:)",
          "url" : "https:\/\/developer.apple.com\/documentation\/RealityKit\/AudioMixGroupsComponent\/set(_:)"
        }
      ],
      "title" : "Instance Methods"
    },
    {
      "content" : "",
      "items" : [
        {
          "description" : "A group that manages the playback properties of multiple playing sounds.",
          "name" : "AudioMixGroup",
          "url" : "https:\/\/developer.apple.com\/documentation\/RealityKit\/AudioMixGroup"
        }
      ],
      "title" : "Audio mixing"
    }
  ],
  "source" : "appleJSON",
  "title" : "AudioMixGroupsComponent",
  "url" : "https:\/\/developer.apple.com\/documentation\/RealityKit\/AudioMixGroupsComponent"
}