{
  "abstract" : "A mode that displays the clearcoat roughness channel of a material as the surface color.",
  "codeExamples" : [
    {
      "code" : "if let television = try? await ModelEntity(named: \"tv_retro\") {\n    let component = ModelDebugOptionsComponent(visualizationMode: .clearcoatRoughness)\n    television.components.set(component)\n}",
      "language" : "swift"
    }
  ],
  "contentHash" : "e3af83b59b17918f417edd7a3dd0139859eb25c162b544fc9eb6c8dbb4f38038",
  "crawledAt" : "2025-12-04T23:50:53Z",
  "declaration" : {
    "code" : "case clearcoatRoughness",
    "language" : "swift"
  },
  "id" : "BCA60C95-31C7-4111-933F-35A8EB481254",
  "kind" : "unknown",
  "language" : "swift",
  "module" : "RealityKit",
  "overview" : "## Discussion\n\nAdd a [doc:\/\/com.apple.RealityKit\/documentation\/RealityKit\/ModelDebugOptionsComponent] with a visualization mode of `clearcoatRoughness` to an entity to tell RealityKit to draw the entity’s calculated clearcoat roughness as its surface color. Clearcoat is a way to render objects that have a shiny transparent coating or veneer, such as the surface of a car with a coat of wax or items shrinkwrapped in clear plastic. The clearcoat roughness value represents the shininess of the clearcoat and is only used on parts of the entity that have a `clearcoat` value greater than zero. RealityKit draws the clearcoat roughness value as a grayscale value from black (`0.0`) to white (`1.0`), with lighter areas representing parts with a shinier clearcoat.\n\nRealityKit calculates clearcoat roughness for entities with a [doc:\/\/com.apple.RealityKit\/documentation\/RealityKit\/SimpleMaterial] and for entities imported from a USDZ file. For other entities, this option has no effect.\n\nHere’s how to enable roughness visualization for an entity:",
  "platforms" : [
    "iOS",
    "iPadOS",
    "Mac Catalyst",
    "macOS",
    "tvOS",
    "visionOS"
  ],
  "rawMarkdown" : "---\nsource: https:\/\/developer.apple.com\/documentation\/RealityKit\/ModelDebugOptionsComponent\/VisualizationMode-swift.enum\/clearcoatRoughness\ncrawled: 2025-12-04T23:50:53Z\n---\n\n# ModelDebugOptionsComponent.VisualizationMode.clearcoatRoughness\n\n**Case**\n\nA mode that displays the clearcoat roughness channel of a material as the surface color.\n\n## Declaration\n\n```swift\ncase clearcoatRoughness\n```\n\n## Discussion\n\nAdd a [doc:\/\/com.apple.RealityKit\/documentation\/RealityKit\/ModelDebugOptionsComponent] with a visualization mode of `clearcoatRoughness` to an entity to tell RealityKit to draw the entity’s calculated clearcoat roughness as its surface color. Clearcoat is a way to render objects that have a shiny transparent coating or veneer, such as the surface of a car with a coat of wax or items shrinkwrapped in clear plastic. The clearcoat roughness value represents the shininess of the clearcoat and is only used on parts of the entity that have a `clearcoat` value greater than zero. RealityKit draws the clearcoat roughness value as a grayscale value from black (`0.0`) to white (`1.0`), with lighter areas representing parts with a shinier clearcoat.\n\nRealityKit calculates clearcoat roughness for entities with a [doc:\/\/com.apple.RealityKit\/documentation\/RealityKit\/SimpleMaterial] and for entities imported from a USDZ file. For other entities, this option has no effect.\n\nHere’s how to enable roughness visualization for an entity:\n\n```swift\nif let television = try? await ModelEntity(named: \"tv_retro\") {\n    let component = ModelDebugOptionsComponent(visualizationMode: .clearcoatRoughness)\n    television.components.set(component)\n}\n```\n\n\n\n## Visualization modes\n\n- **ModelDebugOptionsComponent.VisualizationMode.none**: A mode that doesn’t display a visualization.\n- **ModelDebugOptionsComponent.VisualizationMode.normal**: A mode that displays the normal vectors as a color.\n- **ModelDebugOptionsComponent.VisualizationMode.tangent**: A mode that displays the surface tangent vectors as a color.\n- **ModelDebugOptionsComponent.VisualizationMode.bitangent**: A mode that displays the surface bitangent vectors as a color.\n- **ModelDebugOptionsComponent.VisualizationMode.baseColor**: A mode that displays the entity’s base color with no lighting or material properties applied.\n- **ModelDebugOptionsComponent.VisualizationMode.textureCoordinates**: A mode that displays the texture coordinates as a color.\n- **ModelDebugOptionsComponent.VisualizationMode.finalColor**: A mode that displays the entity’s calculated color, ignoring transparency.\n- **ModelDebugOptionsComponent.VisualizationMode.finalAlpha**: A mode that displays the entity’s calculated transparency as its surface color.\n- **ModelDebugOptionsComponent.VisualizationMode.roughness**: A mode that displays the shininess of a material as the surface color.\n- **ModelDebugOptionsComponent.VisualizationMode.metallic**: A mode that displays the reflectiveness of an entity as its surface color.\n- **ModelDebugOptionsComponent.VisualizationMode.ambientOcclusion**: A mode that displays the calculated ambient occlusion value as the surface color.\n- **ModelDebugOptionsComponent.VisualizationMode.specular**: A mode that displays en entity’s shininess as its surface color.\n- **ModelDebugOptionsComponent.VisualizationMode.emissive**: A mode that displays the emissive channel of a material as the surface color.\n- **ModelDebugOptionsComponent.VisualizationMode.clearcoat**: A mode that displays the clearcoat channel of a material as the surface color.\n- **ModelDebugOptionsComponent.VisualizationMode.lightingDiffuse**: A mode that displays the intensity of indirect light hitting the entity as its surface color.\n\n",
  "sections" : [
    {
      "content" : "",
      "items" : [
        {
          "description" : "A mode that doesn’t display a visualization.",
          "name" : "ModelDebugOptionsComponent.VisualizationMode.none",
          "url" : "https:\/\/developer.apple.com\/documentation\/RealityKit\/ModelDebugOptionsComponent\/VisualizationMode-swift.enum\/none"
        },
        {
          "description" : "A mode that displays the normal vectors as a color.",
          "name" : "ModelDebugOptionsComponent.VisualizationMode.normal",
          "url" : "https:\/\/developer.apple.com\/documentation\/RealityKit\/ModelDebugOptionsComponent\/VisualizationMode-swift.enum\/normal"
        },
        {
          "description" : "A mode that displays the surface tangent vectors as a color.",
          "name" : "ModelDebugOptionsComponent.VisualizationMode.tangent",
          "url" : "https:\/\/developer.apple.com\/documentation\/RealityKit\/ModelDebugOptionsComponent\/VisualizationMode-swift.enum\/tangent"
        },
        {
          "description" : "A mode that displays the surface bitangent vectors as a color.",
          "name" : "ModelDebugOptionsComponent.VisualizationMode.bitangent",
          "url" : "https:\/\/developer.apple.com\/documentation\/RealityKit\/ModelDebugOptionsComponent\/VisualizationMode-swift.enum\/bitangent"
        },
        {
          "description" : "A mode that displays the entity’s base color with no lighting or material properties applied.",
          "name" : "ModelDebugOptionsComponent.VisualizationMode.baseColor",
          "url" : "https:\/\/developer.apple.com\/documentation\/RealityKit\/ModelDebugOptionsComponent\/VisualizationMode-swift.enum\/baseColor"
        },
        {
          "description" : "A mode that displays the texture coordinates as a color.",
          "name" : "ModelDebugOptionsComponent.VisualizationMode.textureCoordinates",
          "url" : "https:\/\/developer.apple.com\/documentation\/RealityKit\/ModelDebugOptionsComponent\/VisualizationMode-swift.enum\/textureCoordinates"
        },
        {
          "description" : "A mode that displays the entity’s calculated color, ignoring transparency.",
          "name" : "ModelDebugOptionsComponent.VisualizationMode.finalColor",
          "url" : "https:\/\/developer.apple.com\/documentation\/RealityKit\/ModelDebugOptionsComponent\/VisualizationMode-swift.enum\/finalColor"
        },
        {
          "description" : "A mode that displays the entity’s calculated transparency as its surface color.",
          "name" : "ModelDebugOptionsComponent.VisualizationMode.finalAlpha",
          "url" : "https:\/\/developer.apple.com\/documentation\/RealityKit\/ModelDebugOptionsComponent\/VisualizationMode-swift.enum\/finalAlpha"
        },
        {
          "description" : "A mode that displays the shininess of a material as the surface color.",
          "name" : "ModelDebugOptionsComponent.VisualizationMode.roughness",
          "url" : "https:\/\/developer.apple.com\/documentation\/RealityKit\/ModelDebugOptionsComponent\/VisualizationMode-swift.enum\/roughness"
        },
        {
          "description" : "A mode that displays the reflectiveness of an entity as its surface color.",
          "name" : "ModelDebugOptionsComponent.VisualizationMode.metallic",
          "url" : "https:\/\/developer.apple.com\/documentation\/RealityKit\/ModelDebugOptionsComponent\/VisualizationMode-swift.enum\/metallic"
        },
        {
          "description" : "A mode that displays the calculated ambient occlusion value as the surface color.",
          "name" : "ModelDebugOptionsComponent.VisualizationMode.ambientOcclusion",
          "url" : "https:\/\/developer.apple.com\/documentation\/RealityKit\/ModelDebugOptionsComponent\/VisualizationMode-swift.enum\/ambientOcclusion"
        },
        {
          "description" : "A mode that displays en entity’s shininess as its surface color.",
          "name" : "ModelDebugOptionsComponent.VisualizationMode.specular",
          "url" : "https:\/\/developer.apple.com\/documentation\/RealityKit\/ModelDebugOptionsComponent\/VisualizationMode-swift.enum\/specular"
        },
        {
          "description" : "A mode that displays the emissive channel of a material as the surface color.",
          "name" : "ModelDebugOptionsComponent.VisualizationMode.emissive",
          "url" : "https:\/\/developer.apple.com\/documentation\/RealityKit\/ModelDebugOptionsComponent\/VisualizationMode-swift.enum\/emissive"
        },
        {
          "description" : "A mode that displays the clearcoat channel of a material as the surface color.",
          "name" : "ModelDebugOptionsComponent.VisualizationMode.clearcoat",
          "url" : "https:\/\/developer.apple.com\/documentation\/RealityKit\/ModelDebugOptionsComponent\/VisualizationMode-swift.enum\/clearcoat"
        },
        {
          "description" : "A mode that displays the intensity of indirect light hitting the entity as its surface color.",
          "name" : "ModelDebugOptionsComponent.VisualizationMode.lightingDiffuse",
          "url" : "https:\/\/developer.apple.com\/documentation\/RealityKit\/ModelDebugOptionsComponent\/VisualizationMode-swift.enum\/lightingDiffuse"
        }
      ],
      "title" : "Visualization modes"
    }
  ],
  "source" : "appleJSON",
  "title" : "ModelDebugOptionsComponent.VisualizationMode.clearcoatRoughness",
  "url" : "https:\/\/developer.apple.com\/documentation\/RealityKit\/ModelDebugOptionsComponent\/VisualizationMode-swift.enum\/clearcoatRoughness"
}