{
  "abstract" : "An object that retrieves entities from a scene.",
  "codeExamples" : [
    {
      "code" : "\/\/ Build a query to retrieve all anchor components.\nlet query = EntityQuery(where: .has(AnchorComponent.self))\n\n\/\/ Find and modify the scene's entities that have an anchor component.\nscene.performQuery(query).forEach { entity in\n    \/\/ Make any needed changes to entities.\n}",
      "language" : "swift"
    }
  ],
  "conformsTo" : [
    "Sendable",
    "SendableMetatype"
  ],
  "contentHash" : "4a7eea58049c4f0f446b060e0b1a670130bd12d6815646be4ed31ef4701816ae",
  "crawledAt" : "2025-12-02T16:03:58Z",
  "declaration" : {
    "code" : "struct EntityQuery",
    "language" : "swift"
  },
  "id" : "A077295B-F44A-4BA6-B876-A0C7EFAAEF2E",
  "kind" : "struct",
  "language" : "swift",
  "module" : "RealityKit",
  "overview" : "## Overview\n\nUse entity queries to iterate through all entities in a RealityKit scene that meet certain criteria. To specify which entities to retrieve, use a [doc:\/\/com.apple.RealityKit\/documentation\/RealityKit\/QueryPredicate].\n\nTo execute the query, pass it into the scene’s [doc:\/\/com.apple.RealityKit\/documentation\/RealityKit\/Scene\/performQuery(_:)] method and then iterate over the results.",
  "platforms" : [
    "iOS",
    "iPadOS",
    "Mac Catalyst",
    "macOS",
    "tvOS",
    "visionOS"
  ],
  "rawMarkdown" : "---\nsource: https:\/\/developer.apple.com\/documentation\/RealityKit\/EntityQuery\ncrawled: 2025-12-02T16:03:58Z\n---\n\n# EntityQuery\n\n**Structure**\n\nAn object that retrieves entities from a scene.\n\n## Declaration\n\n```swift\nstruct EntityQuery\n```\n\n## Overview\n\nUse entity queries to iterate through all entities in a RealityKit scene that meet certain criteria. To specify which entities to retrieve, use a [doc:\/\/com.apple.RealityKit\/documentation\/RealityKit\/QueryPredicate].\n\nTo execute the query, pass it into the scene’s [doc:\/\/com.apple.RealityKit\/documentation\/RealityKit\/Scene\/performQuery(_:)] method and then iterate over the results.\n\n```swift\n\/\/ Build a query to retrieve all anchor components.\nlet query = EntityQuery(where: .has(AnchorComponent.self))\n\n\/\/ Find and modify the scene's entities that have an anchor component.\nscene.performQuery(query).forEach { entity in\n    \/\/ Make any needed changes to entities.\n}\n```\n\n## Creating an entity query\n\n- **init()**: Creates a query that returns all entities in a scene.\n- **init(where:)**: Creates a query that returns all entities in a scene that match specific criteria.\n\n## Entity queries\n\n- **QueryPredicate**: An object that defines the criteria for an entity query.\n- **QueryResult**: An object that returns the results of an entity query.\n\n## Conforms To\n\n- Sendable\n- SendableMetatype\n\n",
  "sections" : [
    {
      "content" : "",
      "items" : [
        {
          "description" : "Creates a query that returns all entities in a scene.",
          "name" : "init()",
          "url" : "https:\/\/developer.apple.com\/documentation\/RealityKit\/EntityQuery\/init()"
        },
        {
          "description" : "Creates a query that returns all entities in a scene that match specific criteria.",
          "name" : "init(where:)",
          "url" : "https:\/\/developer.apple.com\/documentation\/RealityKit\/EntityQuery\/init(where:)"
        }
      ],
      "title" : "Creating an entity query"
    },
    {
      "content" : "",
      "items" : [
        {
          "description" : "An object that defines the criteria for an entity query.",
          "name" : "QueryPredicate",
          "url" : "https:\/\/developer.apple.com\/documentation\/RealityKit\/QueryPredicate"
        },
        {
          "description" : "An object that returns the results of an entity query.",
          "name" : "QueryResult",
          "url" : "https:\/\/developer.apple.com\/documentation\/RealityKit\/QueryResult"
        }
      ],
      "title" : "Entity queries"
    }
  ],
  "source" : "appleJSON",
  "title" : "EntityQuery",
  "url" : "https:\/\/developer.apple.com\/documentation\/RealityKit\/EntityQuery"
}