{
  "abstract" : "Informs the view that the user has pressed the left mouse button.",
  "codeExamples" : [

  ],
  "contentHash" : "a88f182d3faaa8534cfe269f5b828d4231ebb60600617a9c131a90373eceabac",
  "crawledAt" : "2025-12-01T20:29:08Z",
  "declaration" : {
    "code" : "@MainActor @preconcurrency override dynamic func mouseDown(with event: NSEvent)",
    "language" : "swift"
  },
  "id" : "DB4DD71F-25BB-4C0D-BAD9-48576855EF4F",
  "kind" : "method",
  "module" : "RealityKit",
  "overview" : "## Discussion\n\nThe view handles the event instead of passing it to the next responder. See [doc:\/\/com.apple.documentation\/documentation\/AppKit\/NSResponder] for more information about the responder chain.",
  "platforms" : [
    "macOS"
  ],
  "rawMarkdown" : "---\nsource: https:\/\/developer.apple.com\/documentation\/RealityKit\/ARView\/mouseDown(with:)\ncrawled: 2025-12-01T20:29:08Z\n---\n\n# mouseDown(with:)\n\n**Instance Method**\n\nInforms the view that the user has pressed the left mouse button.\n\n## Declaration\n\n```swift\n@MainActor @preconcurrency override dynamic func mouseDown(with event: NSEvent)\n```\n\n## Parameters\n\n- **event**: An object encapsulating information about the mouse event.\n\n## Discussion\n\nThe view handles the event instead of passing it to the next responder. See [doc:\/\/com.apple.documentation\/documentation\/AppKit\/NSResponder] for more information about the responder chain.\n\n## Handling mouse input\n\n- **mouseDragged(with:)**: Informs the view that the user has moved the mouse with the left button pressed.\n- **mouseUp(with:)**: Informs the view that the user has released the left mouse button.\n- **mouseMoved(with:)**: Informs the view that the mouse has moved.\n- **rightMouseDown(with:)**: Informs the view that the user has pressed the right mouse button.\n- **rightMouseDragged(with:)**: Informs the view that the user has moved the mouse with the right button pressed.\n- **rightMouseUp(with:)**: Informs the view that the user has released the right mouse button.\n- **otherMouseDown(with:)**: Informs the view that the user has pressed a mouse button other than the left or right one.\n- **otherMouseDragged(with:)**: Informs the view that the user has moved the mouse with a button other than the left or right button pressed.\n- **otherMouseUp(with:)**: Informs the view that the user has released a mouse button other than the left or right button.\n- **scrollWheel(with:)**: Informs the view that the mouse’s scroll wheel has moved.\n\n",
  "sections" : [
    {
      "content" : "",
      "items" : [
        {
          "description" : "Informs the view that the user has moved the mouse with the left button pressed.",
          "name" : "mouseDragged(with:)",
          "url" : "https:\/\/developer.apple.com\/documentation\/RealityKit\/ARView\/mouseDragged(with:)"
        },
        {
          "description" : "Informs the view that the user has released the left mouse button.",
          "name" : "mouseUp(with:)",
          "url" : "https:\/\/developer.apple.com\/documentation\/RealityKit\/ARView\/mouseUp(with:)"
        },
        {
          "description" : "Informs the view that the mouse has moved.",
          "name" : "mouseMoved(with:)",
          "url" : "https:\/\/developer.apple.com\/documentation\/RealityKit\/ARView\/mouseMoved(with:)"
        },
        {
          "description" : "Informs the view that the user has pressed the right mouse button.",
          "name" : "rightMouseDown(with:)",
          "url" : "https:\/\/developer.apple.com\/documentation\/RealityKit\/ARView\/rightMouseDown(with:)"
        },
        {
          "description" : "Informs the view that the user has moved the mouse with the right button pressed.",
          "name" : "rightMouseDragged(with:)",
          "url" : "https:\/\/developer.apple.com\/documentation\/RealityKit\/ARView\/rightMouseDragged(with:)"
        },
        {
          "description" : "Informs the view that the user has released the right mouse button.",
          "name" : "rightMouseUp(with:)",
          "url" : "https:\/\/developer.apple.com\/documentation\/RealityKit\/ARView\/rightMouseUp(with:)"
        },
        {
          "description" : "Informs the view that the user has pressed a mouse button other than the left or right one.",
          "name" : "otherMouseDown(with:)",
          "url" : "https:\/\/developer.apple.com\/documentation\/RealityKit\/ARView\/otherMouseDown(with:)"
        },
        {
          "description" : "Informs the view that the user has moved the mouse with a button other than the left or right button pressed.",
          "name" : "otherMouseDragged(with:)",
          "url" : "https:\/\/developer.apple.com\/documentation\/RealityKit\/ARView\/otherMouseDragged(with:)"
        },
        {
          "description" : "Informs the view that the user has released a mouse button other than the left or right button.",
          "name" : "otherMouseUp(with:)",
          "url" : "https:\/\/developer.apple.com\/documentation\/RealityKit\/ARView\/otherMouseUp(with:)"
        },
        {
          "description" : "Informs the view that the mouse’s scroll wheel has moved.",
          "name" : "scrollWheel(with:)",
          "url" : "https:\/\/developer.apple.com\/documentation\/RealityKit\/ARView\/scrollWheel(with:)"
        }
      ],
      "title" : "Handling mouse input"
    }
  ],
  "source" : "appleJSON",
  "title" : "mouseDown(with:)",
  "url" : "https:\/\/developer.apple.com\/documentation\/RealityKit\/ARView\/mouseDown(with:)"
}