{
  "abstract" : "An amount of time that elapses before the animation plays.",
  "codeExamples" : [

  ],
  "contentHash" : "73ab4653ea914fcd9a995411d2d90e894e1fdada859319de75eb44078c875b3f",
  "crawledAt" : "2025-12-04T17:06:39Z",
  "declaration" : {
    "code" : "var delay: TimeInterval { get set }",
    "language" : "swift"
  },
  "id" : "86E3D52F-A3E1-4E39-BB13-97F4054AB01A",
  "kind" : "property",
  "language" : "swift",
  "module" : "RealityKit",
  "overview" : "## Discussion\n\nThe default value is `0`, which indicates that the animation plays with no delay. If you set a value for this property, the animation plays from its start time after the specified delay lapses.\n\nDuring the delayed time, the animation doesn’t update. However, to fill the delayed time with some portion of animation, set a negative [doc:\/\/com.apple.RealityKit\/documentation\/RealityKit\/SampledAnimation\/trimStart] instead and choose a [doc:\/\/com.apple.RealityKit\/documentation\/RealityKit\/SampledAnimation\/fillMode] that displays the desired portion of animation.",
  "platforms" : [
    "iOS",
    "iPadOS",
    "Mac Catalyst",
    "macOS",
    "tvOS",
    "visionOS"
  ],
  "rawMarkdown" : "---\nsource: https:\/\/developer.apple.com\/documentation\/RealityKit\/SampledAnimation\/delay\ncrawled: 2025-12-04T17:06:39Z\n---\n\n# delay\n\n**Instance Property**\n\nAn amount of time that elapses before the animation plays.\n\n## Declaration\n\n```swift\nvar delay: TimeInterval { get set }\n```\n\n## Discussion\n\nThe default value is `0`, which indicates that the animation plays with no delay. If you set a value for this property, the animation plays from its start time after the specified delay lapses.\n\nDuring the delayed time, the animation doesn’t update. However, to fill the delayed time with some portion of animation, set a negative [doc:\/\/com.apple.RealityKit\/documentation\/RealityKit\/SampledAnimation\/trimStart] instead and choose a [doc:\/\/com.apple.RealityKit\/documentation\/RealityKit\/SampledAnimation\/fillMode] that displays the desired portion of animation.\n\n## Timing the animation\n\n- **frameInterval**: The duration within the animation timeline for each frame in the frames array.\n- **start**: An integer multiple of the frame interval at which the animation plays.\n- **end**: An integer multiple of the frame interval at which the animation stops.\n- **speed**: A factor that changes the animation’s rate of playback.\n- **duration**: The total playback time of the animation.\n- **offset**: The time, in seconds, at which the animation begins within the duration.\n- **trimDuration**: An optional duration that overrides the calculated duration.\n- **trimStart**: The optional time, in seconds, at which the animation plays.\n- **trimEnd**: The optional time, in seconds, at which the animation stops.\n\n",
  "sections" : [
    {
      "content" : "",
      "items" : [
        {
          "description" : "The duration within the animation timeline for each frame in the frames array.",
          "name" : "frameInterval",
          "url" : "https:\/\/developer.apple.com\/documentation\/RealityKit\/SampledAnimation\/frameInterval"
        },
        {
          "description" : "An integer multiple of the frame interval at which the animation plays.",
          "name" : "start",
          "url" : "https:\/\/developer.apple.com\/documentation\/RealityKit\/SampledAnimation\/start"
        },
        {
          "description" : "An integer multiple of the frame interval at which the animation stops.",
          "name" : "end",
          "url" : "https:\/\/developer.apple.com\/documentation\/RealityKit\/SampledAnimation\/end"
        },
        {
          "description" : "A factor that changes the animation’s rate of playback.",
          "name" : "speed",
          "url" : "https:\/\/developer.apple.com\/documentation\/RealityKit\/SampledAnimation\/speed"
        },
        {
          "description" : "The total playback time of the animation.",
          "name" : "duration",
          "url" : "https:\/\/developer.apple.com\/documentation\/RealityKit\/SampledAnimation\/duration"
        },
        {
          "description" : "The time, in seconds, at which the animation begins within the duration.",
          "name" : "offset",
          "url" : "https:\/\/developer.apple.com\/documentation\/RealityKit\/SampledAnimation\/offset"
        },
        {
          "description" : "An optional duration that overrides the calculated duration.",
          "name" : "trimDuration",
          "url" : "https:\/\/developer.apple.com\/documentation\/RealityKit\/SampledAnimation\/trimDuration"
        },
        {
          "description" : "The optional time, in seconds, at which the animation plays.",
          "name" : "trimStart",
          "url" : "https:\/\/developer.apple.com\/documentation\/RealityKit\/SampledAnimation\/trimStart"
        },
        {
          "description" : "The optional time, in seconds, at which the animation stops.",
          "name" : "trimEnd",
          "url" : "https:\/\/developer.apple.com\/documentation\/RealityKit\/SampledAnimation\/trimEnd"
        }
      ],
      "title" : "Timing the animation"
    }
  ],
  "source" : "appleJSON",
  "title" : "delay",
  "url" : "https:\/\/developer.apple.com\/documentation\/RealityKit\/SampledAnimation\/delay"
}