{
  "abstract" : "Implement a variety of postprocessing techniques to alter RealityKit rendering.",
  "codeExamples" : [

  ],
  "contentHash" : "caf30ae54543dcac09b41be3292ff1a085120080c5d21ce80280593082ab4ee5",
  "crawledAt" : "2025-12-02T15:32:17Z",
  "id" : "4705E6C3-AD68-4E0F-BC67-80E0660A9DB1",
  "kind" : "unknown",
  "language" : "swift",
  "module" : "RealityKit",
  "overview" : "## Overview\n\nFor more information about the app and how it works, see [doc:\/\/com.apple.documentation\/documentation\/RealityKit\/implementing-special-rendering-effects-with-realitykit-postprocessing] in the developer documentation.",
  "rawMarkdown" : "---\nsource: https:\/\/developer.apple.com\/documentation\/RealityKit\/implementing-special-rendering-effects-with-realitykit-postprocessing\ncrawled: 2025-12-02T15:32:17Z\n---\n\n# Implementing special rendering effects with RealityKit postprocessing\n\n**Sample Code**\n\nImplement a variety of postprocessing techniques to alter RealityKit rendering.\n\n## Overview\n\nFor more information about the app and how it works, see [doc:\/\/com.apple.documentation\/documentation\/RealityKit\/implementing-special-rendering-effects-with-realitykit-postprocessing] in the developer documentation.\n\n## Metal effects\n\n- **Using Metal performance shaders to create custom postprocess effects**: Leverage the Metal Performance Shaders framework to create special rendering effects for your RealityKit scenes.\n- **Checking the pixel format of a postprocess effect’s output texture**: Make sure your postprocess effect works on all devices.\n- **Passing Structured Data to a Metal Compute Function**: Send nontexture data from Swift to your Metal shaders using a shared header file.\n- **Implementing postprocess effects using Metal compute functions**: Create custom shaders to implement postprocess effects.\n\n",
  "sections" : [
    {
      "content" : "",
      "items" : [
        {
          "description" : "Leverage the Metal Performance Shaders framework to create special rendering effects for your RealityKit scenes.",
          "name" : "Using Metal performance shaders to create custom postprocess effects",
          "url" : "https:\/\/developer.apple.com\/documentation\/RealityKit\/using-metal-performance-shaders-to-create-custom-postprocess-effects"
        },
        {
          "description" : "Make sure your postprocess effect works on all devices.",
          "name" : "Checking the pixel format of a postprocess effect’s output texture",
          "url" : "https:\/\/developer.apple.com\/documentation\/RealityKit\/checking-the-pixel-format-of-a-postprocess-effect-s-output-texture"
        },
        {
          "description" : "Send nontexture data from Swift to your Metal shaders using a shared header file.",
          "name" : "Passing Structured Data to a Metal Compute Function",
          "url" : "https:\/\/developer.apple.com\/documentation\/RealityKit\/passing-structured-data-to-a-metal-compute-function"
        },
        {
          "description" : "Create custom shaders to implement postprocess effects.",
          "name" : "Implementing postprocess effects using Metal compute functions",
          "url" : "https:\/\/developer.apple.com\/documentation\/RealityKit\/implementing-postprocess-effects-using-metal-compute-functions"
        }
      ],
      "title" : "Metal effects"
    }
  ],
  "source" : "appleJSON",
  "title" : "Implementing special rendering effects with RealityKit postprocessing",
  "url" : "https:\/\/developer.apple.com\/documentation\/RealityKit\/implementing-special-rendering-effects-with-realitykit-postprocessing"
}