{
  "abstract" : "A component that defines a directional light source.",
  "codeExamples" : [
    {
      "code" : "let lightEntity = Entity()\n\nlet redLightComponent = DirectionalLightComponent(\n    color: .red, intensity: 10_000\n)\nlet lightShadowComponent = DirectionalLightComponent.Shadow()\nlightEntity.components.set([redLightComponent, lightShadowComponent])",
      "language" : "swift"
    }
  ],
  "conformsTo" : [
    "Component",
    "Copyable",
    "Equatable"
  ],
  "contentHash" : "7529ad29f3b6a6a96e82cd1d9b85de7d2951a3f240008b970f3eaa27c1e89ab5",
  "crawledAt" : "2025-12-03T15:15:58Z",
  "declaration" : {
    "code" : "struct DirectionalLightComponent",
    "language" : "swift"
  },
  "id" : "1A440DA1-6822-4ED1-98E7-9288A08123B8",
  "kind" : "struct",
  "language" : "swift",
  "module" : "RealityKit",
  "overview" : "## Overview\n\nA directional light shines in the entity’s forward direction `[0, 0, -1]`.\n\nChange the a directional light’s direction with the `Entity\/orientation` or [doc:\/\/com.apple.RealityKit\/documentation\/RealityKit\/HasTransform\/look(at:from:upVector:relativeTo:)] method of the [doc:\/\/com.apple.RealityKit\/documentation\/RealityKit\/Entity] with a `DirectionalLightComponent`. The position of the entity does not play a part in the directional light’s effect.\n\nUse this component with shadows by adding `DirectionalLightComponent` and [doc:\/\/com.apple.RealityKit\/documentation\/RealityKit\/DirectionalLightComponent\/Shadow] to an entity’s [doc:\/\/com.apple.RealityKit\/documentation\/RealityKit\/Entity\/components] set. In this example, the light’s color is red, and the intensity is `10_000`, which is an approximate lux for ambient daylight:\n\nThe directional light illuminates entities evenly in the direction it derives from the orientation of `lightEntity`. Here is a visual example of how the above code snippet could illuminates entities in a scene:",
  "platforms" : [
    "iOS",
    "iPadOS",
    "Mac Catalyst",
    "macOS",
    "tvOS",
    "visionOS"
  ],
  "rawMarkdown" : "---\nsource: https:\/\/developer.apple.com\/documentation\/realitykit\/directionallightcomponent\ncrawled: 2025-12-03T15:15:58Z\n---\n\n# DirectionalLightComponent\n\n**Structure**\n\nA component that defines a directional light source.\n\n## Declaration\n\n```swift\nstruct DirectionalLightComponent\n```\n\n## Overview\n\nA directional light shines in the entity’s forward direction `[0, 0, -1]`.\n\nChange the a directional light’s direction with the `Entity\/orientation` or [doc:\/\/com.apple.RealityKit\/documentation\/RealityKit\/HasTransform\/look(at:from:upVector:relativeTo:)] method of the [doc:\/\/com.apple.RealityKit\/documentation\/RealityKit\/Entity] with a `DirectionalLightComponent`. The position of the entity does not play a part in the directional light’s effect.\n\n\n\nUse this component with shadows by adding `DirectionalLightComponent` and [doc:\/\/com.apple.RealityKit\/documentation\/RealityKit\/DirectionalLightComponent\/Shadow] to an entity’s [doc:\/\/com.apple.RealityKit\/documentation\/RealityKit\/Entity\/components] set. In this example, the light’s color is red, and the intensity is `10_000`, which is an approximate lux for ambient daylight:\n\n```swift\nlet lightEntity = Entity()\n\nlet redLightComponent = DirectionalLightComponent(\n    color: .red, intensity: 10_000\n)\nlet lightShadowComponent = DirectionalLightComponent.Shadow()\nlightEntity.components.set([redLightComponent, lightShadowComponent])\n```\n\nThe directional light illuminates entities evenly in the direction it derives from the orientation of `lightEntity`. Here is a visual example of how the above code snippet could illuminates entities in a scene:\n\n\n\n\n\n## Creating a directional light\n\n- **init(color:intensity:)**: Creates a directional light with a configuration.\n\n## Setting intensity and shadows\n\n- **intensity**: The intensity of the directional light, measured in lumen per square meter.\n- **isRealWorldProxy**: A Boolean that you use to control whether the directional light operates as a proxy for a real-world light.\n\n## Supporting types\n\n- **DirectionalLightComponent.Color**: A platform-specific type used to define color for a directional light.\n\n## Structures\n\n- **DirectionalLightComponent.Shadow**: A directional light component that adds shadows to entities that it illuminates\n\n## Initializers\n\n- **init(color:intensity:isRealWorldProxy:)**: Creates a directional light with a configuration.\n\n## Instance Properties\n\n- **color**: A color for the directional light.\n- **color**: A color for the directional light.\n\n## Directional lights and their shadows\n\n- **DirectionalLightComponent.Shadow**: A directional light component that adds shadows to entities that it illuminates\n- **DirectionalLightComponent.Shadow.ShadowProjectionType**\n- **DirectionalLightComponent.Shadow.ShadowMapCullMode**\n\n## Conforms To\n\n- Component\n- Copyable\n- Equatable\n\n",
  "sections" : [
    {
      "content" : "",
      "items" : [
        {
          "description" : "Creates a directional light with a configuration.",
          "name" : "init(color:intensity:)",
          "url" : "https:\/\/developer.apple.com\/documentation\/RealityKit\/DirectionalLightComponent\/init(color:intensity:)"
        }
      ],
      "title" : "Creating a directional light"
    },
    {
      "content" : "",
      "items" : [
        {
          "description" : "The intensity of the directional light, measured in lumen per square meter.",
          "name" : "intensity",
          "url" : "https:\/\/developer.apple.com\/documentation\/RealityKit\/DirectionalLightComponent\/intensity"
        },
        {
          "description" : "A Boolean that you use to control whether the directional light operates as a proxy for a real-world light.",
          "name" : "isRealWorldProxy",
          "url" : "https:\/\/developer.apple.com\/documentation\/RealityKit\/DirectionalLightComponent\/isRealWorldProxy"
        }
      ],
      "title" : "Setting intensity and shadows"
    },
    {
      "content" : "",
      "items" : [
        {
          "description" : "A platform-specific type used to define color for a directional light.",
          "name" : "DirectionalLightComponent.Color",
          "url" : "https:\/\/developer.apple.com\/documentation\/RealityKit\/DirectionalLightComponent\/Color-swift.typealias"
        }
      ],
      "title" : "Supporting types"
    },
    {
      "content" : "",
      "items" : [
        {
          "description" : "A directional light component that adds shadows to entities that it illuminates",
          "name" : "DirectionalLightComponent.Shadow",
          "url" : "https:\/\/developer.apple.com\/documentation\/RealityKit\/DirectionalLightComponent\/Shadow"
        }
      ],
      "title" : "Structures"
    },
    {
      "content" : "",
      "items" : [
        {
          "description" : "Creates a directional light with a configuration.",
          "name" : "init(color:intensity:isRealWorldProxy:)",
          "url" : "https:\/\/developer.apple.com\/documentation\/RealityKit\/DirectionalLightComponent\/init(color:intensity:isRealWorldProxy:)"
        }
      ],
      "title" : "Initializers"
    },
    {
      "content" : "",
      "items" : [
        {
          "description" : "A color for the directional light.",
          "name" : "color",
          "url" : "https:\/\/developer.apple.com\/documentation\/RealityKit\/DirectionalLightComponent\/color-5ebuh"
        },
        {
          "description" : "A color for the directional light.",
          "name" : "color",
          "url" : "https:\/\/developer.apple.com\/documentation\/RealityKit\/DirectionalLightComponent\/color-7hs4n"
        }
      ],
      "title" : "Instance Properties"
    },
    {
      "content" : "",
      "items" : [
        {
          "description" : "A directional light component that adds shadows to entities that it illuminates",
          "name" : "DirectionalLightComponent.Shadow",
          "url" : "https:\/\/developer.apple.com\/documentation\/RealityKit\/DirectionalLightComponent\/Shadow"
        },
        {
          "description" : "",
          "name" : "DirectionalLightComponent.Shadow.ShadowProjectionType",
          "url" : "https:\/\/developer.apple.com\/documentation\/RealityKit\/DirectionalLightComponent\/Shadow\/ShadowProjectionType"
        },
        {
          "description" : "",
          "name" : "DirectionalLightComponent.Shadow.ShadowMapCullMode",
          "url" : "https:\/\/developer.apple.com\/documentation\/RealityKit\/DirectionalLightComponent\/Shadow\/ShadowMapCullMode"
        }
      ],
      "title" : "Directional lights and their shadows"
    }
  ],
  "source" : "appleJSON",
  "title" : "DirectionalLightComponent",
  "url" : "https:\/\/developer.apple.com\/documentation\/realitykit\/directionallightcomponent"
}