{
  "abstract" : "A container that holds the collection of entities that an AR view renders.",
  "codeExamples" : [

  ],
  "conformsTo" : [
    "CoordinateSpace3D",
    "CoordinateSpace3DFloat",
    "Copyable",
    "Equatable",
    "EventSource",
    "Hashable",
    "Identifiable",
    "Sendable",
    "SendableMetatype"
  ],
  "contentHash" : "0b38d01c0451aefd722355fef8fae67ac6013d7c173ca8547389a6226415ec4a",
  "crawledAt" : "2025-12-02T20:17:28Z",
  "declaration" : {
    "code" : "@MainActor @preconcurrency class Scene",
    "language" : "swift"
  },
  "id" : "DB247321-4080-485C-8E61-A6162502A03B",
  "kind" : "class",
  "language" : "swift",
  "module" : "RealityKit",
  "overview" : "## Overview\n\nYou don’t create a [doc:\/\/com.apple.RealityKit\/documentation\/RealityKit\/Scene] instance directly. Instead, you get the one and only scene associated with a view from the [doc:\/\/com.apple.RealityKit\/documentation\/RealityKit\/ARView\/scene] property of an [doc:\/\/com.apple.RealityKit\/documentation\/RealityKit\/ARView] instance.\n\n\n\nTo add content to the view’s scene, you first create and add one or more [doc:\/\/com.apple.RealityKit\/documentation\/RealityKit\/AnchorEntity] instances to the scene’s [doc:\/\/com.apple.RealityKit\/documentation\/RealityKit\/Scene\/anchors] collection. Anchors tell RealityKit how to pin virtual content to real world objects, like flat surfaces or images. You then add a hierarchy of other [doc:\/\/com.apple.RealityKit\/documentation\/RealityKit\/Entity] instances to each anchor to indicate the geometry and behaviors that RealityKit should render at a given anchor point.",
  "platforms" : [
    "iOS",
    "iPadOS",
    "Mac Catalyst",
    "macOS",
    "tvOS",
    "visionOS"
  ],
  "rawMarkdown" : "---\nsource: https:\/\/developer.apple.com\/documentation\/RealityKit\/Scene\ncrawled: 2025-12-02T20:17:28Z\n---\n\n# Scene\n\n**Class**\n\nA container that holds the collection of entities that an AR view renders.\n\n## Declaration\n\n```swift\n@MainActor @preconcurrency class Scene\n```\n\n## Overview\n\nYou don’t create a [doc:\/\/com.apple.RealityKit\/documentation\/RealityKit\/Scene] instance directly. Instead, you get the one and only scene associated with a view from the [doc:\/\/com.apple.RealityKit\/documentation\/RealityKit\/ARView\/scene] property of an [doc:\/\/com.apple.RealityKit\/documentation\/RealityKit\/ARView] instance.\n\n\n\nTo add content to the view’s scene, you first create and add one or more [doc:\/\/com.apple.RealityKit\/documentation\/RealityKit\/AnchorEntity] instances to the scene’s [doc:\/\/com.apple.RealityKit\/documentation\/RealityKit\/Scene\/anchors] collection. Anchors tell RealityKit how to pin virtual content to real world objects, like flat surfaces or images. You then add a hierarchy of other [doc:\/\/com.apple.RealityKit\/documentation\/RealityKit\/Entity] instances to each anchor to indicate the geometry and behaviors that RealityKit should render at a given anchor point.\n\n## Identifying the scene\n\n- **name**: A name for the scene.\n\n## Adding and removing anchors\n\n- **anchors**: The collection of anchors contained in the scene.\n- **addAnchor(_:)**: Adds an anchor to the scene’s list of anchors.\n- **removeAnchor(_:)**: Removes the specified anchor from the scene.\n\n## Finding entities\n\n- **findEntity(named:)**: Searches the scene’s anchor entity hierarchies for an entity with the given name.\n- **performQuery(_:)**: Returns all entities of the scene which pass the query.\n- **findEntity(id:)**: Returns `Entity` with the given `Entity.ID` in the `Scene`.\n\n## Detecting intersections\n\n- **raycast(origin:direction:length:query:mask:relativeTo:)**: Performs a ray cast against all the geometry in the scene for a ray of a given origin, direction, and length.\n- **raycast(from:to:query:mask:relativeTo:)**: Performs a ray cast against all the geometry in the scene for a ray between two end points.\n- **convexCast(convexShape:fromPosition:fromOrientation:toPosition:toOrientation:query:mask:relativeTo:)**: Performs a convex shape cast against all the geometry in the scene.\n- **pixelCast(from:to:)**: Performs a ray cast against all the geometry in the scene for a ray between two end points.\n- **pixelCast(origin:direction:length:)**: Performs a ray cast against all the geometry in the scene for a ray of a given origin, direction, and length.\n\n## Synchronizing entities with other devices\n\n- **synchronizationService**: The service to use for network synchronization.\n\n## Publishing and subscribing to events\n\n- **publisher(for:on:)**: Generates a publisher for events of the specified type.\n- **subscribe(to:on:_:)**: Subscribes to an event type, optionally limited to events affecting a source entity or scene.\n- **publisher(for:on:componentType:)**: Returns a `Publisher` for events of the specified type in a `Scene`.\n- **subscribe(to:on:componentType:_:)**: Subscribes to an event type, optionally limited to events affecting a source entity or scene, or limited to a specific component type for component events.\n\n## Comparing scenes\n\n- **==(_:_:)**: Indicates whether two scenes are equal.\n- **hash(into:)**: Hashes the essential components of the scene by feeding them into the given hash function.\n\n## Structures\n\n- **Scene.AnchorCollection**: A collection of anchor entities.\n- **Scene.Publisher**: A publisher for the given event type in the scene.\n\n## Instance Properties\n\n- **timebase**: The default timebase for the scene, useful for driving custom times managed by the user which are derived from the scene time.\n\n## Default Implementations\n\n- **Equatable Implementations**\n- **Hashable Implementations**\n\n## Scene management\n\n- **Scene.AnchorCollection**: A collection of anchor entities.\n\n## Conforms To\n\n- CoordinateSpace3D\n- CoordinateSpace3DFloat\n- Copyable\n- Equatable\n- EventSource\n- Hashable\n- Identifiable\n- Sendable\n- SendableMetatype\n\n",
  "sections" : [
    {
      "content" : "",
      "items" : [
        {
          "description" : "A name for the scene.",
          "name" : "name",
          "url" : "https:\/\/developer.apple.com\/documentation\/RealityKit\/Scene\/name"
        }
      ],
      "title" : "Identifying the scene"
    },
    {
      "content" : "",
      "items" : [
        {
          "description" : "The collection of anchors contained in the scene.",
          "name" : "anchors",
          "url" : "https:\/\/developer.apple.com\/documentation\/RealityKit\/Scene\/anchors"
        },
        {
          "description" : "Adds an anchor to the scene’s list of anchors.",
          "name" : "addAnchor(_:)",
          "url" : "https:\/\/developer.apple.com\/documentation\/RealityKit\/Scene\/addAnchor(_:)"
        },
        {
          "description" : "Removes the specified anchor from the scene.",
          "name" : "removeAnchor(_:)",
          "url" : "https:\/\/developer.apple.com\/documentation\/RealityKit\/Scene\/removeAnchor(_:)"
        }
      ],
      "title" : "Adding and removing anchors"
    },
    {
      "content" : "",
      "items" : [
        {
          "description" : "Searches the scene’s anchor entity hierarchies for an entity with the given name.",
          "name" : "findEntity(named:)",
          "url" : "https:\/\/developer.apple.com\/documentation\/RealityKit\/Scene\/findEntity(named:)"
        },
        {
          "description" : "Returns all entities of the scene which pass the query.",
          "name" : "performQuery(_:)",
          "url" : "https:\/\/developer.apple.com\/documentation\/RealityKit\/Scene\/performQuery(_:)"
        },
        {
          "description" : "Returns `Entity` with the given `Entity.ID` in the `Scene`.",
          "name" : "findEntity(id:)",
          "url" : "https:\/\/developer.apple.com\/documentation\/RealityKit\/Scene\/findEntity(id:)"
        }
      ],
      "title" : "Finding entities"
    },
    {
      "content" : "",
      "items" : [
        {
          "description" : "Performs a ray cast against all the geometry in the scene for a ray of a given origin, direction, and length.",
          "name" : "raycast(origin:direction:length:query:mask:relativeTo:)",
          "url" : "https:\/\/developer.apple.com\/documentation\/RealityKit\/Scene\/raycast(origin:direction:length:query:mask:relativeTo:)"
        },
        {
          "description" : "Performs a ray cast against all the geometry in the scene for a ray between two end points.",
          "name" : "raycast(from:to:query:mask:relativeTo:)",
          "url" : "https:\/\/developer.apple.com\/documentation\/RealityKit\/Scene\/raycast(from:to:query:mask:relativeTo:)"
        },
        {
          "description" : "Performs a convex shape cast against all the geometry in the scene.",
          "name" : "convexCast(convexShape:fromPosition:fromOrientation:toPosition:toOrientation:query:mask:relativeTo:)",
          "url" : "https:\/\/developer.apple.com\/documentation\/RealityKit\/Scene\/convexCast(convexShape:fromPosition:fromOrientation:toPosition:toOrientation:query:mask:relativeTo:)"
        },
        {
          "description" : "Performs a ray cast against all the geometry in the scene for a ray between two end points.",
          "name" : "pixelCast(from:to:)",
          "url" : "https:\/\/developer.apple.com\/documentation\/RealityKit\/Scene\/pixelCast(from:to:)"
        },
        {
          "description" : "Performs a ray cast against all the geometry in the scene for a ray of a given origin, direction, and length.",
          "name" : "pixelCast(origin:direction:length:)",
          "url" : "https:\/\/developer.apple.com\/documentation\/RealityKit\/Scene\/pixelCast(origin:direction:length:)"
        }
      ],
      "title" : "Detecting intersections"
    },
    {
      "content" : "",
      "items" : [
        {
          "description" : "The service to use for network synchronization.",
          "name" : "synchronizationService",
          "url" : "https:\/\/developer.apple.com\/documentation\/RealityKit\/Scene\/synchronizationService"
        }
      ],
      "title" : "Synchronizing entities with other devices"
    },
    {
      "content" : "",
      "items" : [
        {
          "description" : "Generates a publisher for events of the specified type.",
          "name" : "publisher(for:on:)",
          "url" : "https:\/\/developer.apple.com\/documentation\/RealityKit\/Scene\/publisher(for:on:)"
        },
        {
          "description" : "Subscribes to an event type, optionally limited to events affecting a source entity or scene.",
          "name" : "subscribe(to:on:_:)",
          "url" : "https:\/\/developer.apple.com\/documentation\/RealityKit\/Scene\/subscribe(to:on:_:)"
        },
        {
          "description" : "Returns a `Publisher` for events of the specified type in a `Scene`.",
          "name" : "publisher(for:on:componentType:)",
          "url" : "https:\/\/developer.apple.com\/documentation\/RealityKit\/Scene\/publisher(for:on:componentType:)"
        },
        {
          "description" : "Subscribes to an event type, optionally limited to events affecting a source entity or scene, or limited to a specific component type for component events.",
          "name" : "subscribe(to:on:componentType:_:)",
          "url" : "https:\/\/developer.apple.com\/documentation\/RealityKit\/Scene\/subscribe(to:on:componentType:_:)"
        }
      ],
      "title" : "Publishing and subscribing to events"
    },
    {
      "content" : "",
      "items" : [
        {
          "description" : "Indicates whether two scenes are equal.",
          "name" : "==(_:_:)",
          "url" : "https:\/\/developer.apple.com\/documentation\/RealityKit\/Scene\/==(_:_:)"
        },
        {
          "description" : "Hashes the essential components of the scene by feeding them into the given hash function.",
          "name" : "hash(into:)",
          "url" : "https:\/\/developer.apple.com\/documentation\/RealityKit\/Scene\/hash(into:)"
        }
      ],
      "title" : "Comparing scenes"
    },
    {
      "content" : "",
      "items" : [
        {
          "description" : "A collection of anchor entities.",
          "name" : "Scene.AnchorCollection",
          "url" : "https:\/\/developer.apple.com\/documentation\/RealityKit\/Scene\/AnchorCollection"
        },
        {
          "description" : "A publisher for the given event type in the scene.",
          "name" : "Scene.Publisher",
          "url" : "https:\/\/developer.apple.com\/documentation\/RealityKit\/Scene\/Publisher"
        }
      ],
      "title" : "Structures"
    },
    {
      "content" : "",
      "items" : [
        {
          "description" : "The default timebase for the scene, useful for driving custom times managed by the user which are derived from the scene time.",
          "name" : "timebase",
          "url" : "https:\/\/developer.apple.com\/documentation\/RealityKit\/Scene\/timebase"
        }
      ],
      "title" : "Instance Properties"
    },
    {
      "content" : "",
      "items" : [
        {
          "description" : "",
          "name" : "Equatable Implementations",
          "url" : "https:\/\/developer.apple.com\/documentation\/RealityKit\/Scene\/Equatable-Implementations"
        },
        {
          "description" : "",
          "name" : "Hashable Implementations",
          "url" : "https:\/\/developer.apple.com\/documentation\/RealityKit\/Scene\/Hashable-Implementations"
        }
      ],
      "title" : "Default Implementations"
    },
    {
      "content" : "",
      "items" : [
        {
          "description" : "A collection of anchor entities.",
          "name" : "Scene.AnchorCollection",
          "url" : "https:\/\/developer.apple.com\/documentation\/RealityKit\/Scene\/AnchorCollection"
        }
      ],
      "title" : "Scene management"
    }
  ],
  "source" : "appleJSON",
  "title" : "Scene",
  "url" : "https:\/\/developer.apple.com\/documentation\/RealityKit\/Scene"
}