{
  "abstract" : "Creates a sheen color in macOS.",
  "codeExamples" : [

  ],
  "contentHash" : "73f28a5e555f7e530c406a97da5f76581b3462723aeacfcfc141c98d39912e96",
  "crawledAt" : "2025-12-03T15:27:12Z",
  "declaration" : {
    "code" : "init(tint: NSColor = .white, texture: MaterialParameters.Texture? = nil)",
    "language" : "swift"
  },
  "id" : "D5D5841E-B285-4968-A22A-B44F0D0C6EE2",
  "kind" : "unknown",
  "language" : "swift",
  "module" : "RealityKit",
  "overview" : "## Discussion\n\nThis initializer creates an object from a color, an image texture, or from both. If you don’t provide a `tint` color, `tint` defaults to white.\n\nIf you specify `texture`, RealityKit calculates the final sheen color for the entity by UV-mapping `texture` onto the entity and then multiplying the color at any given pixel by `tint`. If `tint` is white, RealityKit uses the texture untinted.\n\nIf you don’t specify `texture`, then RealityKit uses `tint` as the entity’s sheen color.",
  "platforms" : [
    "macOS"
  ],
  "rawMarkdown" : "---\nsource: https:\/\/developer.apple.com\/documentation\/RealityKit\/PhysicallyBasedMaterial\/SheenColor\/init(tint:texture:)\ncrawled: 2025-12-03T15:27:12Z\n---\n\n# init(tint:texture:)\n\n**Initializer**\n\nCreates a sheen color in macOS.\n\n## Declaration\n\n```swift\ninit(tint: NSColor = .white, texture: MaterialParameters.Texture? = nil)\n```\n\n## Parameters\n\n- **tint**: The tint color.\n- **texture**: The optional image texture.\n\n## Discussion\n\nThis initializer creates an object from a color, an image texture, or from both. If you don’t provide a `tint` color, `tint` defaults to white.\n\nIf you specify `texture`, RealityKit calculates the final sheen color for the entity by UV-mapping `texture` onto the entity and then multiplying the color at any given pixel by `tint`. If `tint` is white, RealityKit uses the texture untinted.\n\nIf you don’t specify `texture`, then RealityKit uses `tint` as the entity’s sheen color.\n\n",
  "sections" : [

  ],
  "source" : "appleJSON",
  "title" : "init(tint:texture:)",
  "url" : "https:\/\/developer.apple.com\/documentation\/RealityKit\/PhysicallyBasedMaterial\/SheenColor\/init(tint:texture:)"
}