{
  "abstract" : "A custom collection of named blend shape weights.",
  "codeExamples" : [

  ],
  "conformsTo" : [
    "Collection",
    "Copyable",
    "Sequence"
  ],
  "contentHash" : "2aaec7a24f28d5268a5c38634169b693c285a7dffc916545a69421f6b4df40f3",
  "crawledAt" : "2025-12-02T20:12:15Z",
  "declaration" : {
    "code" : "struct BlendShapeWeightsSet",
    "language" : "swift"
  },
  "id" : "D5542BCF-BA32-465C-AF0D-2CD98F3E87BD",
  "kind" : "struct",
  "language" : "swift",
  "module" : "RealityKit",
  "overview" : "## Overview\n\nRetrieve a `BlendShapeWeightsSet` from a [doc:\/\/com.apple.RealityKit\/documentation\/RealityKit\/BlendShapeWeightsComponent] to access the current weights and weight names for each blend shape managed by the component.\n\nSet the current weights for a blend shape by assigning a `BlendShapeWeightsSet` to a [doc:\/\/com.apple.RealityKit\/documentation\/RealityKit\/BlendShapeWeightsComponent] for a specific blend shape.\n\nThe collection allows:\n\n[doc:\/\/com.apple.RealityKit\/documentation\/RealityKit\/BlendShapeWeightsSet] does not support addition\/removal of elements, as the blend shape weights are defined in the asset and the number and names of the weights are immutable.",
  "platforms" : [
    "iOS",
    "iPadOS",
    "Mac Catalyst",
    "macOS",
    "tvOS",
    "visionOS"
  ],
  "rawMarkdown" : "---\nsource: https:\/\/developer.apple.com\/documentation\/RealityKit\/BlendShapeWeightsSet\ncrawled: 2025-12-02T20:12:15Z\n---\n\n# BlendShapeWeightsSet\n\n**Structure**\n\nA custom collection of named blend shape weights.\n\n## Declaration\n\n```swift\nstruct BlendShapeWeightsSet\n```\n\n## Overview\n\nRetrieve a `BlendShapeWeightsSet` from a [doc:\/\/com.apple.RealityKit\/documentation\/RealityKit\/BlendShapeWeightsComponent] to access the current weights and weight names for each blend shape managed by the component.\n\nSet the current weights for a blend shape by assigning a `BlendShapeWeightsSet` to a [doc:\/\/com.apple.RealityKit\/documentation\/RealityKit\/BlendShapeWeightsComponent] for a specific blend shape.\n\nThe collection allows:\n\n- Access to elements by name.\n- Protection that prohibits updating an element, where such an update would try to rename the stored element.\n\n[doc:\/\/com.apple.RealityKit\/documentation\/RealityKit\/BlendShapeWeightsSet] does not support addition\/removal of elements, as the blend shape weights are defined in the asset and the number and names of the weights are immutable.\n\n## Initializers\n\n- **init()**: Creates an empty set.\n\n## Instance Properties\n\n- **count**: Number of blend shape weight data in the set.\n- **default**: The blend shape weights data set that drives the model.\n- **isEmpty**: Checks if the set contains any blend shape weights data.\n\n## Instance Methods\n\n- **contains(_:)**: Checks if the set contains a blend shape weights data instance with the given name.\n- **index(of:)**: Returns the index where the specified blend shape weights data appears in the collection.\n- **set(_:)**: Updates a blend shape weights data instance in the set based on its name. If blend shape weights data with this ID does not exist, does nothing.\n\n## Subscripts\n\n- **subscript(_:)**: Accessor for reading a blend shape weights data in the set.\n\n## Default Implementations\n\n- **Collection Implementations**\n\n## Blend shape management\n\n- **BlendShapeWeightsComponent**: A component that provides access to the current weights associated with all blend shape meshes on an entity.\n- **BlendShapeWeightsMapping**: A mapping of blend weights to the target meshes that those weights affect.\n- **BlendShapeWeights**: A set of animatable weight values that collectively represent the blending amounts for all the blend shapes’ blend targets.\n- **BlendShapeWeightsData**: A structure that encapsulates the blend shape name, blend shape weights and the names of those weights to be stored by the blend shape weights set.\n\n## Conforms To\n\n- Collection\n- Copyable\n- Sequence\n\n",
  "sections" : [
    {
      "content" : "",
      "items" : [
        {
          "description" : "Creates an empty set.",
          "name" : "init()",
          "url" : "https:\/\/developer.apple.com\/documentation\/RealityKit\/BlendShapeWeightsSet\/init()"
        }
      ],
      "title" : "Initializers"
    },
    {
      "content" : "",
      "items" : [
        {
          "description" : "Number of blend shape weight data in the set.",
          "name" : "count",
          "url" : "https:\/\/developer.apple.com\/documentation\/RealityKit\/BlendShapeWeightsSet\/count"
        },
        {
          "description" : "The blend shape weights data set that drives the model.",
          "name" : "default",
          "url" : "https:\/\/developer.apple.com\/documentation\/RealityKit\/BlendShapeWeightsSet\/default"
        },
        {
          "description" : "Checks if the set contains any blend shape weights data.",
          "name" : "isEmpty",
          "url" : "https:\/\/developer.apple.com\/documentation\/RealityKit\/BlendShapeWeightsSet\/isEmpty"
        }
      ],
      "title" : "Instance Properties"
    },
    {
      "content" : "",
      "items" : [
        {
          "description" : "Checks if the set contains a blend shape weights data instance with the given name.",
          "name" : "contains(_:)",
          "url" : "https:\/\/developer.apple.com\/documentation\/RealityKit\/BlendShapeWeightsSet\/contains(_:)"
        },
        {
          "description" : "Returns the index where the specified blend shape weights data appears in the collection.",
          "name" : "index(of:)",
          "url" : "https:\/\/developer.apple.com\/documentation\/RealityKit\/BlendShapeWeightsSet\/index(of:)"
        },
        {
          "description" : "Updates a blend shape weights data instance in the set based on its name. If blend shape weights data with this ID does not exist, does nothing.",
          "name" : "set(_:)",
          "url" : "https:\/\/developer.apple.com\/documentation\/RealityKit\/BlendShapeWeightsSet\/set(_:)"
        }
      ],
      "title" : "Instance Methods"
    },
    {
      "content" : "",
      "items" : [
        {
          "description" : "Accessor for reading a blend shape weights data in the set.",
          "name" : "subscript(_:)",
          "url" : "https:\/\/developer.apple.com\/documentation\/RealityKit\/BlendShapeWeightsSet\/subscript(_:)"
        }
      ],
      "title" : "Subscripts"
    },
    {
      "content" : "",
      "items" : [
        {
          "description" : "",
          "name" : "Collection Implementations",
          "url" : "https:\/\/developer.apple.com\/documentation\/RealityKit\/BlendShapeWeightsSet\/Collection-Implementations"
        }
      ],
      "title" : "Default Implementations"
    },
    {
      "content" : "",
      "items" : [
        {
          "description" : "A component that provides access to the current weights associated with all blend shape meshes on an entity.",
          "name" : "BlendShapeWeightsComponent",
          "url" : "https:\/\/developer.apple.com\/documentation\/RealityKit\/BlendShapeWeightsComponent"
        },
        {
          "description" : "A mapping of blend weights to the target meshes that those weights affect.",
          "name" : "BlendShapeWeightsMapping",
          "url" : "https:\/\/developer.apple.com\/documentation\/RealityKit\/BlendShapeWeightsMapping"
        },
        {
          "description" : "A set of animatable weight values that collectively represent the blending amounts for all the blend shapes’ blend targets.",
          "name" : "BlendShapeWeights",
          "url" : "https:\/\/developer.apple.com\/documentation\/RealityKit\/BlendShapeWeights"
        },
        {
          "description" : "A structure that encapsulates the blend shape name, blend shape weights and the names of those weights to be stored by the blend shape weights set.",
          "name" : "BlendShapeWeightsData",
          "url" : "https:\/\/developer.apple.com\/documentation\/RealityKit\/BlendShapeWeightsData"
        }
      ],
      "title" : "Blend shape management"
    }
  ],
  "source" : "appleJSON",
  "title" : "BlendShapeWeightsSet",
  "url" : "https:\/\/developer.apple.com\/documentation\/RealityKit\/BlendShapeWeightsSet"
}