{
  "abstract" : "A material that supports animated textures.",
  "codeExamples" : [
    {
      "code" : "\/\/ Create a URL that points to the movie file.\nif let url = Bundle.main.url(forResource: \"MyMovie\", withExtension: \"mp4\") {\n\n    \/\/ Create an AVPlayer instance to control playback of that movie.\n    let player = AVPlayer(url: url)\n\n    \/\/ Instantiate and configure the video material.\n    let material = VideoMaterial(avPlayer: player)\n\n    \/\/ Configure audio playback mode.\n    material.controller.audioInputMode = .spatial\n\n    \/\/ Create a new model entity using the video material.\n    let modelEntity = ModelEntity(mesh: cube, materials: [material])\n\n    \/\/ Start playing the video.\n    player.play()\n}",
      "language" : "swift"
    }
  ],
  "conformsTo" : [
    "Material"
  ],
  "contentHash" : "1a8c690bece541a76106978cd0050f8ed1d8c493541e67cb2babbb5d401576bd",
  "crawledAt" : "2025-12-02T19:56:07Z",
  "declaration" : {
    "code" : "struct VideoMaterial",
    "language" : "swift"
  },
  "id" : "84963CA0-51CC-4134-B17D-29E72987B7BC",
  "kind" : "struct",
  "language" : "swift",
  "module" : "RealityKit",
  "overview" : "## Overview\n\nIn RealityKit, a *material* is an object that defines the surface properties of a rendered 3D object. A `VideoMaterial` is a material that maps a movie file on to the surface of an entity. Video materials are *unlit*, which means that scene lighting doesn’t affect them. Video materials support transparency if the source video’s file format also supports transparency.\n\nVideo materials use an [doc:\/\/com.apple.documentation\/documentation\/AVFoundation\/AVPlayer] instance to control movie playback. You can use any movie file format that [doc:\/\/com.apple.documentation\/documentation\/AVFoundation\/AVPlayer] supports to create a video material. To control playback of the material’s video, use the [doc:\/\/com.apple.RealityKit\/documentation\/RealityKit\/VideoMaterial\/avPlayer] property, which offers methods like [doc:\/\/com.apple.documentation\/documentation\/AVFoundation\/AVPlayer\/play()] and [doc:\/\/com.apple.documentation\/documentation\/AVFoundation\/AVPlayer\/pause()].\n\nThe following code demonstrates how to create and start playing a video material using a movie file from your application bundle.\n\nTo see an example of using a video texture in RealityKit, see [doc:\/\/com.apple.documentation\/documentation\/RealityKit\/creating-a-game-with-scene-understanding].",
  "platforms" : [
    "iOS",
    "iPadOS",
    "Mac Catalyst",
    "macOS",
    "tvOS",
    "visionOS"
  ],
  "rawMarkdown" : "---\nsource: https:\/\/developer.apple.com\/documentation\/realitykit\/videomaterial\ncrawled: 2025-12-02T19:56:07Z\n---\n\n# VideoMaterial\n\n**Structure**\n\nA material that supports animated textures.\n\n## Declaration\n\n```swift\nstruct VideoMaterial\n```\n\n## Overview\n\nIn RealityKit, a *material* is an object that defines the surface properties of a rendered 3D object. A `VideoMaterial` is a material that maps a movie file on to the surface of an entity. Video materials are *unlit*, which means that scene lighting doesn’t affect them. Video materials support transparency if the source video’s file format also supports transparency.\n\nVideo materials use an [doc:\/\/com.apple.documentation\/documentation\/AVFoundation\/AVPlayer] instance to control movie playback. You can use any movie file format that [doc:\/\/com.apple.documentation\/documentation\/AVFoundation\/AVPlayer] supports to create a video material. To control playback of the material’s video, use the [doc:\/\/com.apple.RealityKit\/documentation\/RealityKit\/VideoMaterial\/avPlayer] property, which offers methods like [doc:\/\/com.apple.documentation\/documentation\/AVFoundation\/AVPlayer\/play()] and [doc:\/\/com.apple.documentation\/documentation\/AVFoundation\/AVPlayer\/pause()].\n\nThe following code demonstrates how to create and start playing a video material using a movie file from your application bundle.\n\n```swift\n\/\/ Create a URL that points to the movie file.\nif let url = Bundle.main.url(forResource: \"MyMovie\", withExtension: \"mp4\") {\n\n    \/\/ Create an AVPlayer instance to control playback of that movie.\n    let player = AVPlayer(url: url)\n\n    \/\/ Instantiate and configure the video material.\n    let material = VideoMaterial(avPlayer: player)\n\n    \/\/ Configure audio playback mode.\n    material.controller.audioInputMode = .spatial\n\n    \/\/ Create a new model entity using the video material.\n    let modelEntity = ModelEntity(mesh: cube, materials: [material])\n\n    \/\/ Start playing the video.\n    player.play()\n}\n```\n\nTo see an example of using a video texture in RealityKit, see [doc:\/\/com.apple.documentation\/documentation\/RealityKit\/creating-a-game-with-scene-understanding].\n\n## Creating a video material\n\n- **init(avPlayer:)**: Creates a new video material.\n\n## Controlling playback\n\n- **avPlayer**: The material’s video playback controller.\n- **controller**: An object that configures framework-specific video options.\n\n## Initializers\n\n- **init(videoRenderer:)**: Creates and initializes a video material for a sample buffer video renderer object.\n\n## Instance Properties\n\n- **faceCulling**: A process in which the system specifies polygons to remove before rendering a mesh using this material.\n- **readsDepth**: A boolean value that determines whether this material performs the depth test by reading RealityKit’s depth buffer.\n- **triangleFillMode**: The object that controls how RealityKit draws triangles.\n- **videoRenderer**: The material’s video renderer.\n- **writesDepth**: A boolean value that determines whether this material writes its depth into RealityKit’s depth buffer.\n\n## Type Aliases\n\n- **VideoMaterial.FaceCulling**: An alias for the cull mode object that’s appropriate for this material class.\n- **VideoMaterial.TriangleFillMode**\n\n## Video materials\n\n- **VideoMaterial.FaceCulling**: An alias for the cull mode object that’s appropriate for this material class.\n- **VideoMaterial.TriangleFillMode**\n\n## Conforms To\n\n- Material\n\n",
  "sections" : [
    {
      "content" : "",
      "items" : [
        {
          "description" : "Creates a new video material.",
          "name" : "init(avPlayer:)",
          "url" : "https:\/\/developer.apple.com\/documentation\/RealityKit\/VideoMaterial\/init(avPlayer:)"
        }
      ],
      "title" : "Creating a video material"
    },
    {
      "content" : "",
      "items" : [
        {
          "description" : "The material’s video playback controller.",
          "name" : "avPlayer",
          "url" : "https:\/\/developer.apple.com\/documentation\/RealityKit\/VideoMaterial\/avPlayer"
        },
        {
          "description" : "An object that configures framework-specific video options.",
          "name" : "controller",
          "url" : "https:\/\/developer.apple.com\/documentation\/RealityKit\/VideoMaterial\/controller"
        }
      ],
      "title" : "Controlling playback"
    },
    {
      "content" : "",
      "items" : [
        {
          "description" : "Creates and initializes a video material for a sample buffer video renderer object.",
          "name" : "init(videoRenderer:)",
          "url" : "https:\/\/developer.apple.com\/documentation\/RealityKit\/VideoMaterial\/init(videoRenderer:)"
        }
      ],
      "title" : "Initializers"
    },
    {
      "content" : "",
      "items" : [
        {
          "description" : "A process in which the system specifies polygons to remove before rendering a mesh using this material.",
          "name" : "faceCulling",
          "url" : "https:\/\/developer.apple.com\/documentation\/RealityKit\/VideoMaterial\/faceCulling-swift.property"
        },
        {
          "description" : "A boolean value that determines whether this material performs the depth test by reading RealityKit’s depth buffer.",
          "name" : "readsDepth",
          "url" : "https:\/\/developer.apple.com\/documentation\/RealityKit\/VideoMaterial\/readsDepth"
        },
        {
          "description" : "The object that controls how RealityKit draws triangles.",
          "name" : "triangleFillMode",
          "url" : "https:\/\/developer.apple.com\/documentation\/RealityKit\/VideoMaterial\/triangleFillMode-swift.property"
        },
        {
          "description" : "The material’s video renderer.",
          "name" : "videoRenderer",
          "url" : "https:\/\/developer.apple.com\/documentation\/RealityKit\/VideoMaterial\/videoRenderer"
        },
        {
          "description" : "A boolean value that determines whether this material writes its depth into RealityKit’s depth buffer.",
          "name" : "writesDepth",
          "url" : "https:\/\/developer.apple.com\/documentation\/RealityKit\/VideoMaterial\/writesDepth"
        }
      ],
      "title" : "Instance Properties"
    },
    {
      "content" : "",
      "items" : [
        {
          "description" : "An alias for the cull mode object that’s appropriate for this material class.",
          "name" : "VideoMaterial.FaceCulling",
          "url" : "https:\/\/developer.apple.com\/documentation\/RealityKit\/VideoMaterial\/FaceCulling-swift.typealias"
        },
        {
          "description" : "",
          "name" : "VideoMaterial.TriangleFillMode",
          "url" : "https:\/\/developer.apple.com\/documentation\/RealityKit\/VideoMaterial\/TriangleFillMode-swift.typealias"
        }
      ],
      "title" : "Type Aliases"
    },
    {
      "content" : "",
      "items" : [
        {
          "description" : "An alias for the cull mode object that’s appropriate for this material class.",
          "name" : "VideoMaterial.FaceCulling",
          "url" : "https:\/\/developer.apple.com\/documentation\/RealityKit\/VideoMaterial\/FaceCulling-swift.typealias"
        },
        {
          "description" : "",
          "name" : "VideoMaterial.TriangleFillMode",
          "url" : "https:\/\/developer.apple.com\/documentation\/RealityKit\/VideoMaterial\/TriangleFillMode-swift.typealias"
        }
      ],
      "title" : "Video materials"
    }
  ],
  "source" : "appleJSON",
  "title" : "VideoMaterial",
  "url" : "https:\/\/developer.apple.com\/documentation\/realitykit\/videomaterial"
}