{
  "abstract" : "A component that defines the reverberation of spatial audio sources.",
  "codeExamples" : [
    {
      "code" : "\/\/ Create an entity to hold the reverb component and\n\/\/ use the concert hall preset.\nlet reverbEntity = Entity()\nreverbEntity.components.set(ReverbComponent(reverb: .preset(.concertHall)))\n\n\/\/ Add the reverb entity to the reality view.\ncontent.add(reverbEntity)\n\n\/\/ Load an audio file of a violin.\nif let violin = try? await AudioFileResource(named: \"violin\") {\n\n    \/\/ Create an entity for playing the violin audio and\n    \/\/ set the spatial audio component.\n    let violinEntity = Entity()\n    violinEntity.components.set(\n        SpatialAudioComponent(\n            directivity: .beam(focus: 0.2)\n        )\n    )\n    violinEntity.playAudio(violin)\n\n    \/\/ Add the violin entity to the reality view.\n    content.add(violinEntity)\n}",
      "language" : "swift"
    }
  ],
  "conformsTo" : [
    "Component",
    "Equatable",
    "Hashable",
    "Sendable",
    "SendableMetatype"
  ],
  "contentHash" : "9300965b1778bf8e157b422d1bdfb3047493436058e9a8255f13c8e757c6afc7",
  "crawledAt" : "2025-12-02T16:03:19Z",
  "declaration" : {
    "code" : "struct ReverbComponent",
    "language" : "swift"
  },
  "id" : "9639B921-605E-4316-A8A4-F755635802C1",
  "kind" : "struct",
  "language" : "swift",
  "module" : "RealityKit",
  "overview" : "## Overview\n\nBring your spatial audio to life by setting a reverb appropriate for your immersive environment. In visionOS, an acoustic simulation of a person’s real environment reverberates the spatial audio sources by default. When presenting your content in [doc:\/\/com.apple.documentation\/documentation\/SwiftUI\/ImmersionStyle\/progressive] and [doc:\/\/com.apple.documentation\/documentation\/SwiftUI\/ImmersionStyle\/full] immersive spaces, consider setting a reverb component to make your spatial audio sound like it exists within the environment that your visuals represent.\n\nFor example, a desert, living room, and concert hall each have unique acoustical characteristics. When the visuals and acoustic properties of sounds in your content are congruent, the environment becomes more effective as a whole.\n\nUse the [doc:\/\/com.apple.RealityKit\/documentation\/RealityKit\/SpatialAudioComponent\/reverbLevel] property to adjust the level of audio you send to the spatial modeler. Use the [doc:\/\/com.apple.RealityKit\/documentation\/RealityKit\/SpatialAudioComponent\/directLevel] property to adjust the level of audio you send directly to a person’s ears, without additional reverberation. Use the [doc:\/\/com.apple.RealityKit\/documentation\/RealityKit\/SpatialAudioComponent\/directivity] property to define the pattern that disperses sound into the acoustic environment.\n\nIn macOS and iOS, only one `ReverbComponent` can be active at a time per [doc:\/\/com.apple.RealityKit\/documentation\/RealityKit\/ARView] or [doc:\/\/com.apple.RealityKit\/documentation\/RealityKit\/RealityView]. In visionOS, a `ReverbComponent` is only active while an app has a [doc:\/\/com.apple.documentation\/documentation\/SwiftUI\/ImmersionStyle\/progressive] or [doc:\/\/com.apple.documentation\/documentation\/SwiftUI\/ImmersionStyle\/full] immersive space open.\n\nWhen the content is within a [doc:\/\/com.apple.documentation\/documentation\/SwiftUI\/ImmersionStyle\/progressive] immersive space, the Digital Crown adjusts how RealityKit blends:\n\nWhen your app is in a Shared Space [doc:\/\/com.apple.documentation\/documentation\/SwiftUI\/WindowGroup] or an [doc:\/\/com.apple.documentation\/documentation\/SwiftUI\/ImmersiveSpace] using a [doc:\/\/com.apple.documentation\/documentation\/SwiftUI\/ImmersionStyle\/mixed] style, RealityKit reverberates the spatial audio from the acoustics simulation and ignores the reverberation from the `ReverbComponent`.",
  "platforms" : [
    "iOS",
    "iPadOS",
    "Mac Catalyst",
    "macOS",
    "tvOS",
    "visionOS"
  ],
  "rawMarkdown" : "---\nsource: https:\/\/developer.apple.com\/documentation\/RealityKit\/ReverbComponent\ncrawled: 2025-12-02T16:03:19Z\n---\n\n# ReverbComponent\n\n**Structure**\n\nA component that defines the reverberation of spatial audio sources.\n\n## Declaration\n\n```swift\nstruct ReverbComponent\n```\n\n## Overview\n\nBring your spatial audio to life by setting a reverb appropriate for your immersive environment. In visionOS, an acoustic simulation of a person’s real environment reverberates the spatial audio sources by default. When presenting your content in [doc:\/\/com.apple.documentation\/documentation\/SwiftUI\/ImmersionStyle\/progressive] and [doc:\/\/com.apple.documentation\/documentation\/SwiftUI\/ImmersionStyle\/full] immersive spaces, consider setting a reverb component to make your spatial audio sound like it exists within the environment that your visuals represent.\n\nFor example, a desert, living room, and concert hall each have unique acoustical characteristics. When the visuals and acoustic properties of sounds in your content are congruent, the environment becomes more effective as a whole.\n\n```swift\n\/\/ Create an entity to hold the reverb component and\n\/\/ use the concert hall preset.\nlet reverbEntity = Entity()\nreverbEntity.components.set(ReverbComponent(reverb: .preset(.concertHall)))\n\n\/\/ Add the reverb entity to the reality view.\ncontent.add(reverbEntity)\n\n\/\/ Load an audio file of a violin.\nif let violin = try? await AudioFileResource(named: \"violin\") {\n\n    \/\/ Create an entity for playing the violin audio and\n    \/\/ set the spatial audio component.\n    let violinEntity = Entity()\n    violinEntity.components.set(\n        SpatialAudioComponent(\n            directivity: .beam(focus: 0.2)\n        )\n    )\n    violinEntity.playAudio(violin)\n\n    \/\/ Add the violin entity to the reality view.\n    content.add(violinEntity)\n}\n```\n\nUse the [doc:\/\/com.apple.RealityKit\/documentation\/RealityKit\/SpatialAudioComponent\/reverbLevel] property to adjust the level of audio you send to the spatial modeler. Use the [doc:\/\/com.apple.RealityKit\/documentation\/RealityKit\/SpatialAudioComponent\/directLevel] property to adjust the level of audio you send directly to a person’s ears, without additional reverberation. Use the [doc:\/\/com.apple.RealityKit\/documentation\/RealityKit\/SpatialAudioComponent\/directivity] property to define the pattern that disperses sound into the acoustic environment.\n\nIn macOS and iOS, only one `ReverbComponent` can be active at a time per [doc:\/\/com.apple.RealityKit\/documentation\/RealityKit\/ARView] or [doc:\/\/com.apple.RealityKit\/documentation\/RealityKit\/RealityView]. In visionOS, a `ReverbComponent` is only active while an app has a [doc:\/\/com.apple.documentation\/documentation\/SwiftUI\/ImmersionStyle\/progressive] or [doc:\/\/com.apple.documentation\/documentation\/SwiftUI\/ImmersionStyle\/full] immersive space open.\n\nWhen the content is within a [doc:\/\/com.apple.documentation\/documentation\/SwiftUI\/ImmersionStyle\/progressive] immersive space, the Digital Crown adjusts how RealityKit blends:\n\n- The acoustics simulation of a person’s real-world environment\n- The reverberation the `ReverbComponent` generates\n\nWhen your app is in a Shared Space [doc:\/\/com.apple.documentation\/documentation\/SwiftUI\/WindowGroup] or an [doc:\/\/com.apple.documentation\/documentation\/SwiftUI\/ImmersiveSpace] using a [doc:\/\/com.apple.documentation\/documentation\/SwiftUI\/ImmersionStyle\/mixed] style, RealityKit reverberates the spatial audio from the acoustics simulation and ignores the reverberation from the `ReverbComponent`.\n\n## Initializers\n\n- **init(reverb:)**: Creates a component from a reverberation setting.\n\n## Instance Properties\n\n- **reverb**: A reverberation setting the component applies to spatial audio.\n\n## Reverb\n\n- **Reverb**: The reverberation RealityKit applies to spatial audio sources.\n- **Reverb.Preset**: Reverbs defined by a preset environment.\n\n## Conforms To\n\n- Component\n- Equatable\n- Hashable\n- Sendable\n- SendableMetatype\n\n",
  "sections" : [
    {
      "content" : "",
      "items" : [
        {
          "description" : "Creates a component from a reverberation setting.",
          "name" : "init(reverb:)",
          "url" : "https:\/\/developer.apple.com\/documentation\/RealityKit\/ReverbComponent\/init(reverb:)"
        }
      ],
      "title" : "Initializers"
    },
    {
      "content" : "",
      "items" : [
        {
          "description" : "A reverberation setting the component applies to spatial audio.",
          "name" : "reverb",
          "url" : "https:\/\/developer.apple.com\/documentation\/RealityKit\/ReverbComponent\/reverb"
        }
      ],
      "title" : "Instance Properties"
    },
    {
      "content" : "",
      "items" : [
        {
          "description" : "The reverberation RealityKit applies to spatial audio sources.",
          "name" : "Reverb",
          "url" : "https:\/\/developer.apple.com\/documentation\/RealityKit\/Reverb"
        },
        {
          "description" : "Reverbs defined by a preset environment.",
          "name" : "Reverb.Preset",
          "url" : "https:\/\/developer.apple.com\/documentation\/RealityKit\/Reverb\/Preset"
        }
      ],
      "title" : "Reverb"
    }
  ],
  "source" : "appleJSON",
  "title" : "ReverbComponent",
  "url" : "https:\/\/developer.apple.com\/documentation\/RealityKit\/ReverbComponent"
}