{
  "abstract" : "A flag to indicate whether sample bits use all available bits of the channel.",
  "codeExamples" : [

  ],
  "contentHash" : "133f1335695897c7c36e1d4e5f343a579de7c3a5ddce03ed9f1962467706e05d",
  "crawledAt" : "2025-12-05T17:20:36Z",
  "declaration" : {
    "code" : "FormatFlagIsPacked",
    "language" : "swift"
  },
  "id" : "B742FC51-5464-418A-B814-A9F4CC6DF72E",
  "kind" : "unknown",
  "language" : "occ",
  "module" : "AudioDriverKit",
  "overview" : "## Discussion\n\nSet this value to use all bits with in the channel; clear to use either the high or low end, as indicated by [doc:\/\/com.apple.audiodriverkit\/documentation\/AudioDriverKit\/AudioDriverKit\/IOUserAudioFormatFlags\/FormatFlagIsAlignedHigh]. Even if this flag is clear, the framework assumes it’s actually set if the [doc:\/\/com.apple.audiodriverkit\/documentation\/AudioDriverKit\/AudioDriverKit\/IOUserAudioStreamBasicDescription] contains the relationship `((mBitsPerSample \/ 8) * mChannelsPerFrame) == mBytesPerFrame`.",
  "platforms" : [
    "Unsupported OS: driverkit"
  ],
  "rawMarkdown" : "---\nsource: https:\/\/developer.apple.com\/documentation\/AudioDriverKit\/AudioDriverKit\/IOUserAudioFormatFlags\/FormatFlagIsPacked\ncrawled: 2025-12-05T17:20:36Z\n---\n\n# FormatFlagIsPacked\n\n**Enumeration Case**\n\nA flag to indicate whether sample bits use all available bits of the channel.\n\n## Declaration\n\n```swift\nFormatFlagIsPacked\n```\n\n## Discussion\n\nSet this value to use all bits with in the channel; clear to use either the high or low end, as indicated by [doc:\/\/com.apple.audiodriverkit\/documentation\/AudioDriverKit\/AudioDriverKit\/IOUserAudioFormatFlags\/FormatFlagIsAlignedHigh]. Even if this flag is clear, the framework assumes it’s actually set if the [doc:\/\/com.apple.audiodriverkit\/documentation\/AudioDriverKit\/AudioDriverKit\/IOUserAudioStreamBasicDescription] contains the relationship `((mBitsPerSample \/ 8) * mChannelsPerFrame) == mBytesPerFrame`.\n\n## Bitwise Layout Flags\n\n- **FormatFlagIsAlignedHigh**: A flag to indicate whether sample bits use the high bits of the channel.\n- **LinearPCMFormatFlagIsAlignedHigh**: A flag to indicate whether PCM sample bits use the high bits of the channel.\n- **LinearPCMFormatFlagIsPacked**: A flag to indicate whether PCM sample bits use all available bits of the channel.\n- **FormatFlagsNativeFloatPacked**: A flag indicating native-endian packed floating-point values.\n\n",
  "sections" : [
    {
      "content" : "",
      "items" : [
        {
          "description" : "A flag to indicate whether sample bits use the high bits of the channel.",
          "name" : "FormatFlagIsAlignedHigh",
          "url" : "https:\/\/developer.apple.com\/documentation\/AudioDriverKit\/AudioDriverKit\/IOUserAudioFormatFlags\/FormatFlagIsAlignedHigh"
        },
        {
          "description" : "A flag to indicate whether PCM sample bits use the high bits of the channel.",
          "name" : "LinearPCMFormatFlagIsAlignedHigh",
          "url" : "https:\/\/developer.apple.com\/documentation\/AudioDriverKit\/AudioDriverKit\/IOUserAudioFormatFlags\/LinearPCMFormatFlagIsAlignedHigh"
        },
        {
          "description" : "A flag to indicate whether PCM sample bits use all available bits of the channel.",
          "name" : "LinearPCMFormatFlagIsPacked",
          "url" : "https:\/\/developer.apple.com\/documentation\/AudioDriverKit\/AudioDriverKit\/IOUserAudioFormatFlags\/LinearPCMFormatFlagIsPacked"
        },
        {
          "description" : "A flag indicating native-endian packed floating-point values.",
          "name" : "FormatFlagsNativeFloatPacked",
          "url" : "https:\/\/developer.apple.com\/documentation\/AudioDriverKit\/AudioDriverKit\/IOUserAudioFormatFlags\/FormatFlagsNativeFloatPacked"
        }
      ],
      "title" : "Bitwise Layout Flags"
    }
  ],
  "source" : "appleJSON",
  "title" : "FormatFlagIsPacked",
  "url" : "https:\/\/developer.apple.com\/documentation\/AudioDriverKit\/AudioDriverKit\/IOUserAudioFormatFlags\/FormatFlagIsPacked"
}