{
  "abstract" : "Indicates whether the app processes raw scan results immediately after a scan session stops.",
  "codeExamples" : [

  ],
  "contentHash" : "1327acfe2b449fc33b21968d5d689ad4224cd8699df2f25ce9805535ccf16b31",
  "crawledAt" : "2025-12-02T07:48:53Z",
  "declaration" : {
    "code" : "func captureView(shouldPresent roomDataForProcessing: CapturedRoomData, error: (any Error)?) -> Bool",
    "language" : "swift"
  },
  "id" : "BAB0C821-1888-48C1-8BBA-555D3EEF4D0A",
  "kind" : "method",
  "module" : "RoomPlan",
  "overview" : "## Return Value\n\nA Boolean value that determines whether the app receives and displays post-processed scan results when the scan session stops.\n\n## Discussion\n\nIf your app returns `true`:\n\nTo omit processing, return `false`. You can save the raw scan results (`roomDataForProcessing`) to an encoder for processing at a later date or send the raw data to a server for processing on a different device.\n\nThe default implementation returns `true`.",
  "platforms" : [
    "iOS",
    "iPadOS",
    "Mac Catalyst"
  ],
  "rawMarkdown" : "---\nsource: https:\/\/developer.apple.com\/documentation\/RoomPlan\/RoomCaptureViewDelegate\/captureView(shouldPresent:error:)\ncrawled: 2025-12-02T07:48:53Z\n---\n\n# captureView(shouldPresent:error:)\n\n**Instance Method**\n\nIndicates whether the app processes raw scan results immediately after a scan session stops.\n\n## Declaration\n\n```swift\nfunc captureView(shouldPresent roomDataForProcessing: CapturedRoomData, error: (any Error)?) -> Bool\n```\n\n## Parameters\n\n- **roomDataForProcessing**: A data object that contains the raw scan results.\n- **error**: An object that describes the problem when an error occurs; otherwise, `nil`.\n\n## Return Value\n\nA Boolean value that determines whether the app receives and displays post-processed scan results when the scan session stops.\n\n## Discussion\n\nIf your app returns `true`:\n\n- The framework processes the scan results immediately and calls [doc:\/\/com.apple.RoomPlan\/documentation\/RoomPlan\/RoomCaptureViewDelegate\/captureView(didPresent:error:)].\n- The view ([doc:\/\/com.apple.RoomPlan\/documentation\/RoomPlan\/RoomCaptureView]) displays the scanned room in a 3D rendition that the user can inspect using touch gestures. The user can view the room from different angles by panning, pinching, or expanding. After inspecting the scanned room, the user can decide whether to export the room to a file or whether to begin another scan.\n\nTo omit processing, return `false`. You can save the raw scan results (`roomDataForProcessing`) to an encoder for processing at a later date or send the raw data to a server for processing on a different device.\n\nThe default implementation returns `true`.\n\n## Post-processing scan results\n\n- **captureView(didPresent:error:)**: Provides the delegate with the processed scan results as the view presents them.\n\n",
  "sections" : [
    {
      "content" : "",
      "items" : [
        {
          "description" : "Provides the delegate with the processed scan results as the view presents them.",
          "name" : "captureView(didPresent:error:)",
          "url" : "https:\/\/developer.apple.com\/documentation\/RoomPlan\/RoomCaptureViewDelegate\/captureView(didPresent:error:)"
        }
      ],
      "title" : "Post-processing scan results"
    }
  ],
  "source" : "appleJSON",
  "title" : "captureView(shouldPresent:error:)",
  "url" : "https:\/\/developer.apple.com\/documentation\/RoomPlan\/RoomCaptureViewDelegate\/captureView(shouldPresent:error:)"
}