{
  "abstract" : "Errors that can occur during a captured room export.",
  "codeExamples" : [

  ],
  "conformsTo" : [
    "Copyable",
    "Equatable",
    "Error",
    "Hashable",
    "LocalizedError",
    "Sendable",
    "SendableMetatype"
  ],
  "contentHash" : "2683593117f99ccd47315e21f8259b0d41a33a2a2f5dd051943f1c97883653a4",
  "crawledAt" : "2025-12-02T19:45:26Z",
  "declaration" : {
    "code" : "enum Error",
    "language" : "swift"
  },
  "id" : "54AD9C05-56BC-4F18-9F3E-76F68BC7B979",
  "kind" : "enum",
  "language" : "swift",
  "module" : "RoomPlan",
  "overview" : "## Overview\n\nThe captured room ([doc:\/\/com.apple.RoomPlan\/documentation\/RoomPlan\/CapturedRoom]) function [doc:\/\/com.apple.RoomPlan\/documentation\/RoomPlan\/CapturedRoom\/export(to:metadataURL:modelProvider:exportOptions:)] can throw an error of this type.",
  "platforms" : [
    "iOS",
    "iPadOS",
    "Mac Catalyst"
  ],
  "rawMarkdown" : "---\nsource: https:\/\/developer.apple.com\/documentation\/RoomPlan\/CapturedRoom\/Error\ncrawled: 2025-12-02T19:45:26Z\n---\n\n# CapturedRoom.Error\n\n**Enumeration**\n\nErrors that can occur during a captured room export.\n\n## Declaration\n\n```swift\nenum Error\n```\n\n## Overview\n\nThe captured room ([doc:\/\/com.apple.RoomPlan\/documentation\/RoomPlan\/CapturedRoom]) function [doc:\/\/com.apple.RoomPlan\/documentation\/RoomPlan\/CapturedRoom\/export(to:metadataURL:modelProvider:exportOptions:)] can throw an error of this type.\n\n## Interpreting the error\n\n- **CapturedRoom.Error.deviceNotSupported**: An error that indicates that the framework doesn’t support the user’s device.\n- **CapturedRoom.Error.urlInvalidFileExtension**: An error that indicates that the URL contains an unsupported file extension.\n- **CapturedRoom.Error.urlInvalidFilePath**: An error that indicates that the URL references an invalid file path.\n- **CapturedRoom.Error.urlInvalidScheme**: An error that indicates that the URL prefix represents an unsupported scheme.\n- **CapturedRoom.Error.urlMissingFileExtension**: An error that indicates that the URL lacks a necessary file extension.\n\n## Inspecting error information\n\n- **errorDescription**: A human-readable explanation of the error.\n\n## Conforms To\n\n- Copyable\n- Equatable\n- Error\n- Hashable\n- LocalizedError\n- Sendable\n- SendableMetatype\n\n",
  "sections" : [
    {
      "content" : "",
      "items" : [
        {
          "description" : "An error that indicates that the framework doesn’t support the user’s device.",
          "name" : "CapturedRoom.Error.deviceNotSupported",
          "url" : "https:\/\/developer.apple.com\/documentation\/RoomPlan\/CapturedRoom\/Error\/deviceNotSupported"
        },
        {
          "description" : "An error that indicates that the URL contains an unsupported file extension.",
          "name" : "CapturedRoom.Error.urlInvalidFileExtension",
          "url" : "https:\/\/developer.apple.com\/documentation\/RoomPlan\/CapturedRoom\/Error\/urlInvalidFileExtension"
        },
        {
          "description" : "An error that indicates that the URL references an invalid file path.",
          "name" : "CapturedRoom.Error.urlInvalidFilePath",
          "url" : "https:\/\/developer.apple.com\/documentation\/RoomPlan\/CapturedRoom\/Error\/urlInvalidFilePath"
        },
        {
          "description" : "An error that indicates that the URL prefix represents an unsupported scheme.",
          "name" : "CapturedRoom.Error.urlInvalidScheme",
          "url" : "https:\/\/developer.apple.com\/documentation\/RoomPlan\/CapturedRoom\/Error\/urlInvalidScheme"
        },
        {
          "description" : "An error that indicates that the URL lacks a necessary file extension.",
          "name" : "CapturedRoom.Error.urlMissingFileExtension",
          "url" : "https:\/\/developer.apple.com\/documentation\/RoomPlan\/CapturedRoom\/Error\/urlMissingFileExtension"
        }
      ],
      "title" : "Interpreting the error"
    },
    {
      "content" : "",
      "items" : [
        {
          "description" : "A human-readable explanation of the error.",
          "name" : "errorDescription",
          "url" : "https:\/\/developer.apple.com\/documentation\/RoomPlan\/CapturedRoom\/Error\/errorDescription"
        }
      ],
      "title" : "Inspecting error information"
    }
  ],
  "source" : "appleJSON",
  "title" : "CapturedRoom.Error",
  "url" : "https:\/\/developer.apple.com\/documentation\/RoomPlan\/CapturedRoom\/Error"
}