{
  "abstract" : "A view that enables the user to scan their room with the device’s camera.",
  "codeExamples" : [

  ],
  "conformsTo" : [
    "CALayerDelegate",
    "CVarArg",
    "CustomDebugStringConvertible",
    "CustomStringConvertible",
    "Equatable",
    "Hashable",
    "NSCoding",
    "NSObjectProtocol",
    "NSTouchBarProvider",
    "UIAccessibilityIdentification",
    "UIActivityItemsConfigurationProviding",
    "UIAppearance",
    "UIAppearanceContainer",
    "UICoordinateSpace",
    "UIDynamicItem",
    "UIFocusEnvironment",
    "UIFocusItem",
    "UIFocusItemContainer",
    "UILargeContentViewerItem",
    "UIPasteConfigurationSupporting",
    "UIPopoverPresentationControllerSourceItem",
    "UIResponderStandardEditActions",
    "UITraitChangeObservable",
    "UITraitEnvironment",
    "UIUserActivityRestoring"
  ],
  "contentHash" : "61af690c05107c650ec6ba9f4e40a8fe061cd755c9a62d67ca64c66b12bca733",
  "crawledAt" : "2025-12-03T04:37:19Z",
  "declaration" : {
    "code" : "@MainActor @objc @preconcurrency class RoomCaptureView",
    "language" : "swift"
  },
  "id" : "5B2B26C5-AAB8-4CCC-8824-6024C5A8811C",
  "kind" : "class",
  "language" : "swift",
  "module" : "RoomPlan",
  "overview" : "## Overview\n\nThis class provides your app with a view that manages the scan process from start to finish, including:\n\nWhen the app determines that the current scan is complete, the view displays a small-scale version of the scanned room for the user to approve.\n\nAlternatively, your app can display custom graphics during the scanning process by creating and using a scan session object ([doc:\/\/com.apple.RoomPlan\/documentation\/RoomPlan\/RoomCaptureSession]) directly.\n\nSee [doc:\/\/com.apple.RoomPlan\/documentation\/RoomPlan\/create-a-3d-model-of-an-interior-room-by-guiding-the-user-through-an-ar-experience] for a sample code project that demonstrates `RoomCaptureView`.",
  "platforms" : [
    "iOS",
    "iPadOS",
    "Mac Catalyst"
  ],
  "rawMarkdown" : "---\nsource: https:\/\/developer.apple.com\/documentation\/RoomPlan\/RoomCaptureView\ncrawled: 2025-12-03T04:37:19Z\n---\n\n# RoomCaptureView\n\n**Class**\n\nA view that enables the user to scan their room with the device’s camera.\n\n## Declaration\n\n```swift\n@MainActor @objc @preconcurrency class RoomCaptureView\n```\n\n## Overview\n\nThis class provides your app with a view that manages the scan process from start to finish, including:\n\n- A camera feed that users look through to see their room in AR.\n- Real-time graphic overlays that display on top of physical structures in the room to convey scanning progress.\n- User instructions that explain how to position the device, if the framework requires a specific kind of device movement or perspective to complete the capture.\n\nWhen the app determines that the current scan is complete, the view displays a small-scale version of the scanned room for the user to approve.\n\nAlternatively, your app can display custom graphics during the scanning process by creating and using a scan session object ([doc:\/\/com.apple.RoomPlan\/documentation\/RoomPlan\/RoomCaptureSession]) directly.\n\nSee [doc:\/\/com.apple.RoomPlan\/documentation\/RoomPlan\/create-a-3d-model-of-an-interior-room-by-guiding-the-user-through-an-ar-experience] for a sample code project that demonstrates `RoomCaptureView`.\n\n## Creating a room-capture view\n\n- **init(frame:arSession:)**: Creates a room-capture view with the given AR session.\n- **init(frame:)**: Creates a view that sizes to the specified frame.\n- **init(coder:)**: Creates a view by deserializing from the specified coder.\n\n## Reacting to scan events\n\n- **captureSession**: An object that notifies a delegate of particular events in the room-scanning life cycle.\n- **delegate**: An object that determines whether to post-process the results of a scan.\n\n## Displaying scan progress\n\n- **isModelEnabled**: A Boolean value that determines whether the view displays a miniature rendering of the scanned room at the bottom of its bounds.\n\n## Accessing view features\n\n- **subviews**: An array that contains the view’s subviews.\n- **layoutSubviews()**: Instructs the view’s subviews to position within the view.\n- **encode(with:)**: Serializes the view to the specified coder.\n- **traitCollectionDidChange(_:)**: Notifies the view when the device orientation changes.\n\n## User Interface\n\n- **RoomCaptureViewDelegate**: A specification to post-process the results of a scan.\n\n## Inherits From\n\n- UIView\n\n## Conforms To\n\n- CALayerDelegate\n- CVarArg\n- CustomDebugStringConvertible\n- CustomStringConvertible\n- Equatable\n- Hashable\n- NSCoding\n- NSObjectProtocol\n- NSTouchBarProvider\n- UIAccessibilityIdentification\n- UIActivityItemsConfigurationProviding\n- UIAppearance\n- UIAppearanceContainer\n- UICoordinateSpace\n- UIDynamicItem\n- UIFocusEnvironment\n- UIFocusItem\n- UIFocusItemContainer\n- UILargeContentViewerItem\n- UIPasteConfigurationSupporting\n- UIPopoverPresentationControllerSourceItem\n- UIResponderStandardEditActions\n- UITraitChangeObservable\n- UITraitEnvironment\n- UIUserActivityRestoring\n\n",
  "sections" : [
    {
      "content" : "",
      "items" : [
        {
          "description" : "Creates a room-capture view with the given AR session.",
          "name" : "init(frame:arSession:)",
          "url" : "https:\/\/developer.apple.com\/documentation\/RoomPlan\/RoomCaptureView\/init(frame:arSession:)"
        },
        {
          "description" : "Creates a view that sizes to the specified frame.",
          "name" : "init(frame:)",
          "url" : "https:\/\/developer.apple.com\/documentation\/RoomPlan\/RoomCaptureView\/init(frame:)"
        },
        {
          "description" : "Creates a view by deserializing from the specified coder.",
          "name" : "init(coder:)",
          "url" : "https:\/\/developer.apple.com\/documentation\/RoomPlan\/RoomCaptureView\/init(coder:)"
        }
      ],
      "title" : "Creating a room-capture view"
    },
    {
      "content" : "",
      "items" : [
        {
          "description" : "An object that notifies a delegate of particular events in the room-scanning life cycle.",
          "name" : "captureSession",
          "url" : "https:\/\/developer.apple.com\/documentation\/RoomPlan\/RoomCaptureView\/captureSession"
        },
        {
          "description" : "An object that determines whether to post-process the results of a scan.",
          "name" : "delegate",
          "url" : "https:\/\/developer.apple.com\/documentation\/RoomPlan\/RoomCaptureView\/delegate"
        }
      ],
      "title" : "Reacting to scan events"
    },
    {
      "content" : "",
      "items" : [
        {
          "description" : "A Boolean value that determines whether the view displays a miniature rendering of the scanned room at the bottom of its bounds.",
          "name" : "isModelEnabled",
          "url" : "https:\/\/developer.apple.com\/documentation\/RoomPlan\/RoomCaptureView\/isModelEnabled"
        }
      ],
      "title" : "Displaying scan progress"
    },
    {
      "content" : "",
      "items" : [
        {
          "description" : "An array that contains the view’s subviews.",
          "name" : "subviews",
          "url" : "https:\/\/developer.apple.com\/documentation\/RoomPlan\/RoomCaptureView\/subviews"
        },
        {
          "description" : "Instructs the view’s subviews to position within the view.",
          "name" : "layoutSubviews()",
          "url" : "https:\/\/developer.apple.com\/documentation\/RoomPlan\/RoomCaptureView\/layoutSubviews()"
        },
        {
          "description" : "Serializes the view to the specified coder.",
          "name" : "encode(with:)",
          "url" : "https:\/\/developer.apple.com\/documentation\/RoomPlan\/RoomCaptureView\/encode(with:)"
        },
        {
          "description" : "Notifies the view when the device orientation changes.",
          "name" : "traitCollectionDidChange(_:)",
          "url" : "https:\/\/developer.apple.com\/documentation\/RoomPlan\/RoomCaptureView\/traitCollectionDidChange(_:)"
        }
      ],
      "title" : "Accessing view features"
    },
    {
      "content" : "",
      "items" : [
        {
          "description" : "A specification to post-process the results of a scan.",
          "name" : "RoomCaptureViewDelegate",
          "url" : "https:\/\/developer.apple.com\/documentation\/RoomPlan\/RoomCaptureViewDelegate"
        }
      ],
      "title" : "User Interface"
    },
    {
      "content" : "",
      "items" : [
        {
          "name" : "UIView"
        }
      ],
      "title" : "Inherits From"
    }
  ],
  "source" : "appleJSON",
  "title" : "RoomCaptureView",
  "url" : "https:\/\/developer.apple.com\/documentation\/RoomPlan\/RoomCaptureView"
}