{
  "abstract" : "The merchant’s two-letter ISO-3166 country code.",
  "codeExamples" : [

  ],
  "contentHash" : "eea05223f6e8994d06645958ed9ae67ac046a1e9754f64c0df96c646604f2b69",
  "crawledAt" : "2025-12-02T14:18:23Z",
  "declaration" : {
    "code" : "required DOMString countryCode;",
    "language" : "swift"
  },
  "id" : "8202BADD-6285-4C61-9C7F-38406557F5EB",
  "kind" : "property",
  "module" : "Apple Pay on the Web",
  "overview" : "## Discussion\n\nSet this property to the two-letter ISO-3166 code for the country or region of the merchant’s principle place of business. This is often the location for settling the payment. Consult with your payment service provider (PSP) to determine the appropriate country code.\n\nApple Pay may use the `countryCode` to generate payment data that complies with local regulations. For more information on regional compliance, see [doc:\/\/com.apple.documentation\/documentation\/PassKit\/complying-with-regional-regulations].",
  "platforms" : [
    "Unsupported OS: Safari Desktop",
    "Unsupported OS: Safari Mobile"
  ],
  "rawMarkdown" : "---\nsource: https:\/\/developer.apple.com\/documentation\/ApplePayontheWeb\/ApplePayRequestBase\/countryCode\ncrawled: 2025-12-02T14:18:23Z\n---\n\n# countryCode\n\n**Instance Property**\n\nThe merchant’s two-letter ISO-3166 country code.\n\n## Declaration\n\n```swift\nrequired DOMString countryCode;\n```\n\n## Discussion\n\nSet this property to the two-letter ISO-3166 code for the country or region of the merchant’s principle place of business. This is often the location for settling the payment. Consult with your payment service provider (PSP) to determine the appropriate country code.\n\nApple Pay may use the `countryCode` to generate payment data that complies with local regulations. For more information on regional compliance, see [doc:\/\/com.apple.documentation\/documentation\/PassKit\/complying-with-regional-regulations].\n\n## Setting the transaction information\n\n- **merchantCapabilities**: An array of the payment capabilities that the merchant supports, such as credit or debit card payments.\n- **supportedNetworks**: The payment networks the merchant provides to their customers.\n- **supportedCountries**: A list of two-letter country codes for limiting payment to credit cards from specific countries or regions.\n\n",
  "sections" : [
    {
      "content" : "",
      "items" : [
        {
          "description" : "An array of the payment capabilities that the merchant supports, such as credit or debit card payments.",
          "name" : "merchantCapabilities",
          "url" : "https:\/\/developer.apple.com\/documentation\/ApplePayontheWeb\/ApplePayRequestBase\/merchantCapabilities"
        },
        {
          "description" : "The payment networks the merchant provides to their customers.",
          "name" : "supportedNetworks",
          "url" : "https:\/\/developer.apple.com\/documentation\/ApplePayontheWeb\/ApplePayRequestBase\/supportedNetworks"
        },
        {
          "description" : "A list of two-letter country codes for limiting payment to credit cards from specific countries or regions.",
          "name" : "supportedCountries",
          "url" : "https:\/\/developer.apple.com\/documentation\/ApplePayontheWeb\/ApplePayRequestBase\/supportedCountries"
        }
      ],
      "title" : "Setting the transaction information"
    }
  ],
  "source" : "appleJSON",
  "title" : "countryCode",
  "url" : "https:\/\/developer.apple.com\/documentation\/ApplePayontheWeb\/ApplePayRequestBase\/countryCode"
}