{
  "abstract" : "A dictionary that represents a request to set up an automatic reload payment, such as a store card top-up or a prepaid account.",
  "codeExamples" : [

  ],
  "contentHash" : "426ebdd20c0c526b3bac5e2823d6ec121d031b3787d1fddcf8aa2654fabf90ff",
  "crawledAt" : "2025-12-03T05:12:37Z",
  "declaration" : {
    "code" : "dictionary ApplePayAutomaticReloadPaymentRequest {\n\trequired DOMString paymentDescription;\n\trequired ApplePayLineItem automaticReloadBilling;\n\tDOMString billingAgreement;\n\trequired DOMString managementURL;\n\tDOMString tokenNotificationURL;\n};",
    "language" : "swift"
  },
  "id" : "431319F8-7C4F-4E73-AE2D-3301187F80B0",
  "kind" : "struct",
  "language" : "data",
  "module" : "Apple Pay on the Web",
  "overview" : "## Overview\n\nUse an [doc:\/\/com.apple.applepayontheweb\/documentation\/ApplePayontheWeb\/ApplePayAutomaticReloadPaymentRequest] object to provide the user with payment details and a way to manage payment methods for an automatic reload payment. You can optionally display a billing agreement and set up merchant token life-cycle notifications for the request. For more information about the merchant token life-cycle notifications, see [doc:\/\/com.apple.documentation\/documentation\/MerchantTokenNotificationServices].\n\nApple Pay issues an Apple Pay Merchant Token if the user’s payment network supports merchant-specific payment tokens. Otherwise, Apple Pay issues a device token for the payment request.",
  "platforms" : [
    "Unsupported OS: Safari Desktop",
    "Unsupported OS: Safari Mobile"
  ],
  "rawMarkdown" : "---\nsource: https:\/\/developer.apple.com\/documentation\/ApplePayontheWeb\/ApplePayAutomaticReloadPaymentRequest\ncrawled: 2025-12-03T05:12:37Z\n---\n\n# ApplePayAutomaticReloadPaymentRequest\n\n**Structure**\n\nA dictionary that represents a request to set up an automatic reload payment, such as a store card top-up or a prepaid account.\n\n## Declaration\n\n```swift\ndictionary ApplePayAutomaticReloadPaymentRequest {\n\trequired DOMString paymentDescription;\n\trequired ApplePayLineItem automaticReloadBilling;\n\tDOMString billingAgreement;\n\trequired DOMString managementURL;\n\tDOMString tokenNotificationURL;\n};\n```\n\n## Overview\n\n\n\nUse an [doc:\/\/com.apple.applepayontheweb\/documentation\/ApplePayontheWeb\/ApplePayAutomaticReloadPaymentRequest] object to provide the user with payment details and a way to manage payment methods for an automatic reload payment. You can optionally display a billing agreement and set up merchant token life-cycle notifications for the request. For more information about the merchant token life-cycle notifications, see [doc:\/\/com.apple.documentation\/documentation\/MerchantTokenNotificationServices].\n\nApple Pay issues an Apple Pay Merchant Token if the user’s payment network supports merchant-specific payment tokens. Otherwise, Apple Pay issues a device token for the payment request.\n\n## Describing an automatic reload payment\n\n- **paymentDescription**: A description of the automatic reload payment that Apple Pay displays in the payment sheet.\n- **billingAgreement**: A localized billing agreement that the payment sheet displays to the user before the user authorizes the payment.\n\n## Setting the payment summary items\n\n- **automaticReloadBilling**: A line item that contains the reload amount and balance threshold for the automatic reload payment.\n- **ApplePayLineItem**: A line item in a payment request—for example, total, tax, discount, or grand total.\n\n## Receiving payment token notifications\n\n- **tokenNotificationURL**: A URL you provide to receive life-cycle notifications from the Apple Pay servers about the Apple Pay merchant token for the recurring payment.\n\n## Managing the automatic reload payment\n\n- **managementURL**: A URL to a web page where the user can update or delete the payment method for the automatic reload payment.\n\n## Requesting automatic reload payments\n\n- **automaticReloadPaymentRequest**: A property that requests an automatic reload payment, such as a store card top-up.\n\n",
  "sections" : [
    {
      "content" : "",
      "items" : [
        {
          "description" : "A description of the automatic reload payment that Apple Pay displays in the payment sheet.",
          "name" : "paymentDescription",
          "url" : "https:\/\/developer.apple.com\/documentation\/ApplePayontheWeb\/ApplePayAutomaticReloadPaymentRequest\/paymentDescription"
        },
        {
          "description" : "A localized billing agreement that the payment sheet displays to the user before the user authorizes the payment.",
          "name" : "billingAgreement",
          "url" : "https:\/\/developer.apple.com\/documentation\/ApplePayontheWeb\/ApplePayAutomaticReloadPaymentRequest\/billingAgreement"
        }
      ],
      "title" : "Describing an automatic reload payment"
    },
    {
      "content" : "",
      "items" : [
        {
          "description" : "A line item that contains the reload amount and balance threshold for the automatic reload payment.",
          "name" : "automaticReloadBilling",
          "url" : "https:\/\/developer.apple.com\/documentation\/ApplePayontheWeb\/ApplePayAutomaticReloadPaymentRequest\/automaticReloadBilling"
        },
        {
          "description" : "A line item in a payment request—for example, total, tax, discount, or grand total.",
          "name" : "ApplePayLineItem",
          "url" : "https:\/\/developer.apple.com\/documentation\/ApplePayontheWeb\/ApplePayLineItem"
        }
      ],
      "title" : "Setting the payment summary items"
    },
    {
      "content" : "",
      "items" : [
        {
          "description" : "A URL you provide to receive life-cycle notifications from the Apple Pay servers about the Apple Pay merchant token for the recurring payment.",
          "name" : "tokenNotificationURL",
          "url" : "https:\/\/developer.apple.com\/documentation\/ApplePayontheWeb\/ApplePayAutomaticReloadPaymentRequest\/tokenNotificationURL"
        }
      ],
      "title" : "Receiving payment token notifications"
    },
    {
      "content" : "",
      "items" : [
        {
          "description" : "A URL to a web page where the user can update or delete the payment method for the automatic reload payment.",
          "name" : "managementURL",
          "url" : "https:\/\/developer.apple.com\/documentation\/ApplePayontheWeb\/ApplePayAutomaticReloadPaymentRequest\/managementURL"
        }
      ],
      "title" : "Managing the automatic reload payment"
    },
    {
      "content" : "",
      "items" : [
        {
          "description" : "A property that requests an automatic reload payment, such as a store card top-up.",
          "name" : "automaticReloadPaymentRequest",
          "url" : "https:\/\/developer.apple.com\/documentation\/ApplePayontheWeb\/ApplePayPaymentRequest\/automaticReloadPaymentRequest"
        }
      ],
      "title" : "Requesting automatic reload payments"
    }
  ],
  "source" : "appleJSON",
  "title" : "ApplePayAutomaticReloadPaymentRequest",
  "url" : "https:\/\/developer.apple.com\/documentation\/ApplePayontheWeb\/ApplePayAutomaticReloadPaymentRequest"
}