{
  "abstract" : "Shipping contact information for the user.",
  "codeExamples" : [

  ],
  "contentHash" : "0ad0f7f03226a72dc66b118849b451c796b6eb5382820b3be3765abfd08658dd",
  "crawledAt" : "2025-12-02T14:17:22Z",
  "declaration" : {
    "code" : "ApplePayPaymentContact shippingContact;",
    "language" : "swift"
  },
  "id" : "C3CEBBDC-97B1-4B31-9499-0E084298F6EB",
  "kind" : "property",
  "module" : "Apple Pay on the Web",
  "overview" : "## Discussion\n\nIf you have an up-to-date shipping address on file, you can set it here. See [doc:\/\/com.apple.applepayontheweb\/documentation\/ApplePayontheWeb\/ApplePayPaymentContact] for the fields in [doc:\/\/com.apple.applepayontheweb\/documentation\/ApplePayontheWeb\/ApplePayPaymentRequest\/shippingContact].\n\nThe information you provide in [doc:\/\/com.apple.applepayontheweb\/documentation\/ApplePayontheWeb\/ApplePayPaymentRequest\/shippingContact] is displayed in the payment sheet as the default shipping address. The user can either keep the address you provided or select another address.\n\nProvide your user’s shipping contact info only if you are requiring shipping contact information.",
  "platforms" : [
    "Unsupported OS: Safari Desktop",
    "Unsupported OS: Safari Mobile"
  ],
  "rawMarkdown" : "---\nsource: https:\/\/developer.apple.com\/documentation\/ApplePayontheWeb\/ApplePayPaymentRequest\/shippingContact\ncrawled: 2025-12-02T14:17:22Z\n---\n\n# shippingContact\n\n**Instance Property**\n\nShipping contact information for the user.\n\n## Declaration\n\n```swift\nApplePayPaymentContact shippingContact;\n```\n\n## Discussion\n\nIf you have an up-to-date shipping address on file, you can set it here. See [doc:\/\/com.apple.applepayontheweb\/documentation\/ApplePayontheWeb\/ApplePayPaymentContact] for the fields in [doc:\/\/com.apple.applepayontheweb\/documentation\/ApplePayontheWeb\/ApplePayPaymentRequest\/shippingContact].\n\nThe information you provide in [doc:\/\/com.apple.applepayontheweb\/documentation\/ApplePayontheWeb\/ApplePayPaymentRequest\/shippingContact] is displayed in the payment sheet as the default shipping address. The user can either keep the address you provided or select another address.\n\nProvide your user’s shipping contact info only if you are requiring shipping contact information.\n\n## Providing known contact information\n\n- **billingContact**: Billing contact information for the user.\n- **ApplePayPaymentContact**: Contact information fields to use for billing and shipping contact information.\n\n",
  "sections" : [
    {
      "content" : "",
      "items" : [
        {
          "description" : "Billing contact information for the user.",
          "name" : "billingContact",
          "url" : "https:\/\/developer.apple.com\/documentation\/ApplePayontheWeb\/ApplePayPaymentRequest\/billingContact"
        },
        {
          "description" : "Contact information fields to use for billing and shipping contact information.",
          "name" : "ApplePayPaymentContact",
          "url" : "https:\/\/developer.apple.com\/documentation\/ApplePayontheWeb\/ApplePayPaymentContact"
        }
      ],
      "title" : "Providing known contact information"
    }
  ],
  "source" : "appleJSON",
  "title" : "shippingContact",
  "url" : "https:\/\/developer.apple.com\/documentation\/ApplePayontheWeb\/ApplePayPaymentRequest\/shippingContact"
}