{
  "abstract" : "The payment networks the merchant provides to their customers.",
  "codeExamples" : [
    {
      "code" : "var session = new ApplePaySession(2, paymentRequest);",
      "language" : "swift"
    }
  ],
  "contentHash" : "e66c0ac0ed66f75f69f5dffc5888d8f420e56ddf28e67c6b26cf1be198af65ff",
  "crawledAt" : "2025-12-04T10:46:01Z",
  "declaration" : {
    "code" : "required sequence <DOMString> supportedNetworks;",
    "language" : "swift"
  },
  "id" : "598A8C8A-E3B8-4495-8988-1709F2A07A0F",
  "kind" : "property",
  "language" : "data",
  "module" : "Apple Pay on the Web",
  "overview" : "## Discussion\n\nYou must set this property to one or more of the payment network values in the following table:\n\nTo use a network introduced with a specific Apple Pay version, set the [doc:\/\/com.apple.applepayontheweb\/documentation\/ApplePayontheWeb\/ApplePaySession\/ApplePaySession] version parameter to the required version number, like this:\n\nFor the best compatibility with operating systems and browsers, use the lowest possible version number that supports your payment networks and other required features.\n\nIn macOS 12.3, iOS 15.4, watchOS 8.5, and Mac Catalyst 15.4 or later, specify payment methods in the order you prefer. For example, to specify the default network to use for cobadged cards, set the first element in the array to the default network, and alternate networks afterward in the order you prefer.",
  "platforms" : [
    "Unsupported OS: Safari Desktop",
    "Unsupported OS: Safari Mobile"
  ],
  "rawMarkdown" : "---\nsource: https:\/\/developer.apple.com\/documentation\/ApplePayontheWeb\/ApplePayRequestBase\/supportedNetworks\ncrawled: 2025-12-04T10:46:01Z\n---\n\n# supportedNetworks\n\n**Instance Property**\n\nThe payment networks the merchant provides to their customers.\n\n## Declaration\n\n```swift\nrequired sequence <DOMString> supportedNetworks;\n```\n\n## Discussion\n\nYou must set this property to one or more of the payment network values in the following table:\n\n\n\nTo use a network introduced with a specific Apple Pay version, set the [doc:\/\/com.apple.applepayontheweb\/documentation\/ApplePayontheWeb\/ApplePaySession\/ApplePaySession] version parameter to the required version number, like this:\n\n```swift\nvar session = new ApplePaySession(2, paymentRequest);\n```\n\nFor the best compatibility with operating systems and browsers, use the lowest possible version number that supports your payment networks and other required features.\n\nIn macOS 12.3, iOS 15.4, watchOS 8.5, and Mac Catalyst 15.4 or later, specify payment methods in the order you prefer. For example, to specify the default network to use for cobadged cards, set the first element in the array to the default network, and alternate networks afterward in the order you prefer.\n\n\n\n## Setting the transaction information\n\n- **countryCode**: The merchant’s two-letter ISO-3166 country code.\n- **merchantCapabilities**: An array of the payment capabilities that the merchant supports, such as credit or debit card payments.\n- **supportedCountries**: A list of two-letter country codes for limiting payment to credit cards from specific countries or regions.\n\n",
  "sections" : [
    {
      "content" : "",
      "items" : [
        {
          "description" : "The merchant’s two-letter ISO-3166 country code.",
          "name" : "countryCode",
          "url" : "https:\/\/developer.apple.com\/documentation\/ApplePayontheWeb\/ApplePayRequestBase\/countryCode"
        },
        {
          "description" : "An array of the payment capabilities that the merchant supports, such as credit or debit card payments.",
          "name" : "merchantCapabilities",
          "url" : "https:\/\/developer.apple.com\/documentation\/ApplePayontheWeb\/ApplePayRequestBase\/merchantCapabilities"
        },
        {
          "description" : "A list of two-letter country codes for limiting payment to credit cards from specific countries or regions.",
          "name" : "supportedCountries",
          "url" : "https:\/\/developer.apple.com\/documentation\/ApplePayontheWeb\/ApplePayRequestBase\/supportedCountries"
        }
      ],
      "title" : "Setting the transaction information"
    }
  ],
  "source" : "appleJSON",
  "title" : "supportedNetworks",
  "url" : "https:\/\/developer.apple.com\/documentation\/ApplePayontheWeb\/ApplePayRequestBase\/supportedNetworks"
}