{
  "abstract" : "The fields of shipping information the user must provide to fulfill the order.",
  "codeExamples" : [
    {
      "code" : "\"requiredShippingContactFields\": [\n    \"postalAddress\",\n    \"name\",\n    \"phoneticName\",\n    \"phone\",\n    \"email\"\n]",
      "language" : "javascript"
    }
  ],
  "contentHash" : "51edbe9829b919119fab95853ea253bf2155833fe202d255cd405166cc982a46",
  "crawledAt" : "2025-12-01T10:01:27Z",
  "declaration" : {
    "code" : "sequence <ApplePayContactField> requiredShippingContactFields;",
    "language" : "swift"
  },
  "id" : "D0A10F9A-A7E9-4E2D-9959-999CDEFDCC8A",
  "kind" : "property",
  "module" : "Apple Pay on the Web",
  "overview" : "## Discussion\n\nUse `requiredShippingContactFields` to request the user’s address and other contact information that you require to fulfill the order.\n\nYou will receive the customer’s name when you request `postalAddress`. If you don’t need the customer’s address, you can request the `name` contact field directly.\n\nThe following listing is an example of requesting fields for a shipping contact:\n\nThe source of the information may be the user’s “My card” in Contacts, Wallet settings, or may be entered into the payment sheet by the user, either directly or through Contacts.",
  "platforms" : [
    "Unsupported OS: Safari Desktop",
    "Unsupported OS: Safari Mobile"
  ],
  "rawMarkdown" : "---\nsource: https:\/\/developer.apple.com\/documentation\/ApplePayontheWeb\/ApplePayPaymentRequest\/requiredShippingContactFields\ncrawled: 2025-12-01T10:01:27Z\n---\n\n# requiredShippingContactFields\n\n**Instance Property**\n\nThe fields of shipping information the user must provide to fulfill the order.\n\n## Declaration\n\n```swift\nsequence <ApplePayContactField> requiredShippingContactFields;\n```\n\n## Discussion\n\nUse `requiredShippingContactFields` to request the user’s address and other contact information that you require to fulfill the order.\n\nYou will receive the customer’s name when you request `postalAddress`. If you don’t need the customer’s address, you can request the `name` contact field directly.\n\nThe following listing is an example of requesting fields for a shipping contact:\n\n```javascript\n\"requiredShippingContactFields\": [\n    \"postalAddress\",\n    \"name\",\n    \"phoneticName\",\n    \"phone\",\n    \"email\"\n]\n```\n\nThe source of the information may be the user’s “My card” in Contacts, Wallet settings, or may be entered into the payment sheet by the user, either directly or through Contacts.\n\n## Requesting billing and shipping contact information\n\n- **requiredBillingContactFields**: The fields of billing information the user must provide to process the transaction.\n- **shippingContactEditingMode**: A value that indicates whether the shipping mode prevents the user from editing the shipping address.\n- **ApplePayContactField**: Field names for requesting contact information in a payment request.\n- **ApplePayShippingContactEditingMode**: Values that indicate whether the shipping mode prevents the user from editing fields of the shipping address.\n\n",
  "sections" : [
    {
      "content" : "",
      "items" : [
        {
          "description" : "The fields of billing information the user must provide to process the transaction.",
          "name" : "requiredBillingContactFields",
          "url" : "https:\/\/developer.apple.com\/documentation\/ApplePayontheWeb\/ApplePayPaymentRequest\/requiredBillingContactFields"
        },
        {
          "description" : "A value that indicates whether the shipping mode prevents the user from editing the shipping address.",
          "name" : "shippingContactEditingMode",
          "url" : "https:\/\/developer.apple.com\/documentation\/ApplePayontheWeb\/ApplePayPaymentRequest\/shippingContactEditingMode"
        },
        {
          "description" : "Field names for requesting contact information in a payment request.",
          "name" : "ApplePayContactField",
          "url" : "https:\/\/developer.apple.com\/documentation\/ApplePayontheWeb\/ApplePayContactField"
        },
        {
          "description" : "Values that indicate whether the shipping mode prevents the user from editing fields of the shipping address.",
          "name" : "ApplePayShippingContactEditingMode",
          "url" : "https:\/\/developer.apple.com\/documentation\/ApplePayontheWeb\/ApplePayShippingContactEditingMode"
        }
      ],
      "title" : "Requesting billing and shipping contact information"
    }
  ],
  "source" : "appleJSON",
  "title" : "requiredShippingContactFields",
  "url" : "https:\/\/developer.apple.com\/documentation\/ApplePayontheWeb\/ApplePayPaymentRequest\/requiredShippingContactFields"
}