{
  "abstract" : "A set of methods a responder uses to implement simple text entry.",
  "codeExamples" : [

  ],
  "conformingTypes" : [
    "UISearchTextField",
    "UITextField",
    "UITextView"
  ],
  "contentHash" : "502f51a0be16ca9ea526d0f05cd332afedc4f44ad554aac756ba1e4cbee027ba",
  "crawledAt" : "2025-12-03T05:30:06Z",
  "declaration" : {
    "code" : "@MainActor protocol UIKeyInput : UITextInputTraits",
    "language" : "swift"
  },
  "id" : "DD23F0EC-6C62-42FA-9CA2-5C755818A4B9",
  "inheritedBy" : [
    "UITextDocumentProxy",
    "UITextDraggable",
    "UITextDroppable",
    "UITextInput"
  ],
  "kind" : "protocol",
  "language" : "swift",
  "module" : "UIKit",
  "overview" : "## Overview\n\nAdopt this protocol in a subclass of [doc:\/\/com.apple.uikit\/documentation\/UIKit\/UIResponder] to support text entry. When instances of this subclass are the first responder, the system keyboard displays. Only a small subset of the available keyboards and languages are available to classes that adopt this protocol.",
  "platforms" : [
    "iOS",
    "iPadOS",
    "Mac Catalyst",
    "tvOS",
    "visionOS"
  ],
  "rawMarkdown" : "---\nsource: https:\/\/developer.apple.com\/documentation\/UIKit\/UIKeyInput\ncrawled: 2025-12-03T05:30:06Z\n---\n\n# UIKeyInput\n\n**Protocol**\n\nA set of methods a responder uses to implement simple text entry.\n\n## Declaration\n\n```swift\n@MainActor protocol UIKeyInput : UITextInputTraits\n```\n\n## Overview\n\nAdopt this protocol in a subclass of [doc:\/\/com.apple.uikit\/documentation\/UIKit\/UIResponder] to support text entry. When instances of this subclass are the first responder, the system keyboard displays. Only a small subset of the available keyboards and languages are available to classes that adopt this protocol.\n\n## Inserting and deleting text\n\n- **insertText(_:)**: Inserts a character into the displayed text.\n- **deleteBackward()**: Deletes a character from the displayed text.\n- **hasText**: A Boolean value that indicates whether the text-entry object has any text.\n\n## Text input\n\n- **UITextInput**: A set of methods for interacting with the text input system and enabling features in documents.\n- **UITextInputDelegate**: An intermediary between a document and the text input system.\n- **UITextInputTraits**: A set of methods that defines features for keyboard input to a text object.\n- **UITextInputContext**: An object that reports the type of input your app receives.\n- **UITextInputMode**: The current text input mode.\n- **UITextInputAssistantItem**: An object that manages custom bar button items that you add to the shortcuts bar above the keyboard on iPad.\n- **UIDictationPhrase**: An object that represents the textual interpretation of a spoken phrase that the user dictates.\n\n## Inherits From\n\n- NSObjectProtocol\n- UITextInputTraits\n\n## Inherited By\n\n- UITextDocumentProxy\n- UITextDraggable\n- UITextDroppable\n- UITextInput\n\n## Conforming Types\n\n- UISearchTextField\n- UITextField\n- UITextView\n\n",
  "sections" : [
    {
      "content" : "",
      "items" : [
        {
          "description" : "Inserts a character into the displayed text.",
          "name" : "insertText(_:)",
          "url" : "https:\/\/developer.apple.com\/documentation\/UIKit\/UIKeyInput\/insertText(_:)"
        },
        {
          "description" : "Deletes a character from the displayed text.",
          "name" : "deleteBackward()",
          "url" : "https:\/\/developer.apple.com\/documentation\/UIKit\/UIKeyInput\/deleteBackward()"
        },
        {
          "description" : "A Boolean value that indicates whether the text-entry object has any text.",
          "name" : "hasText",
          "url" : "https:\/\/developer.apple.com\/documentation\/UIKit\/UIKeyInput\/hasText"
        }
      ],
      "title" : "Inserting and deleting text"
    },
    {
      "content" : "",
      "items" : [
        {
          "description" : "A set of methods for interacting with the text input system and enabling features in documents.",
          "name" : "UITextInput",
          "url" : "https:\/\/developer.apple.com\/documentation\/UIKit\/UITextInput"
        },
        {
          "description" : "An intermediary between a document and the text input system.",
          "name" : "UITextInputDelegate",
          "url" : "https:\/\/developer.apple.com\/documentation\/UIKit\/UITextInputDelegate"
        },
        {
          "description" : "A set of methods that defines features for keyboard input to a text object.",
          "name" : "UITextInputTraits",
          "url" : "https:\/\/developer.apple.com\/documentation\/UIKit\/UITextInputTraits"
        },
        {
          "description" : "An object that reports the type of input your app receives.",
          "name" : "UITextInputContext",
          "url" : "https:\/\/developer.apple.com\/documentation\/UIKit\/UITextInputContext"
        },
        {
          "description" : "The current text input mode.",
          "name" : "UITextInputMode",
          "url" : "https:\/\/developer.apple.com\/documentation\/UIKit\/UITextInputMode"
        },
        {
          "description" : "An object that manages custom bar button items that you add to the shortcuts bar above the keyboard on iPad.",
          "name" : "UITextInputAssistantItem",
          "url" : "https:\/\/developer.apple.com\/documentation\/UIKit\/UITextInputAssistantItem"
        },
        {
          "description" : "An object that represents the textual interpretation of a spoken phrase that the user dictates.",
          "name" : "UIDictationPhrase",
          "url" : "https:\/\/developer.apple.com\/documentation\/UIKit\/UIDictationPhrase"
        }
      ],
      "title" : "Text input"
    },
    {
      "content" : "",
      "items" : [
        {
          "name" : "NSObjectProtocol"
        },
        {
          "name" : "UITextInputTraits"
        }
      ],
      "title" : "Inherits From"
    }
  ],
  "source" : "appleJSON",
  "title" : "UIKeyInput",
  "url" : "https:\/\/developer.apple.com\/documentation\/UIKit\/UIKeyInput"
}