{
  "abstract" : "Notifies you when the drag operation ends.",
  "codeExamples" : [

  ],
  "contentHash" : "ed7055ff0325fdf18faad8eddb6005c5d9f2401fb0ec3f150e2fc6bd07413739",
  "crawledAt" : "2025-12-03T17:46:22Z",
  "declaration" : {
    "code" : "@MainActor optional func collectionView(_ collectionView: UICollectionView, dropSessionDidEnd session: any UIDropSession)",
    "language" : "swift"
  },
  "id" : "4FE963E7-C42A-459F-85D4-5C402DC190F8",
  "kind" : "method",
  "language" : "swift",
  "module" : "UIKit",
  "overview" : "## Discussion\n\nThe collection view calls this method at the conclusion of a drag that was over the collection view at one point. Use it to clean up any state information that you used to handle the drag. This method is called regardless of whether the data was actually dropped onto the collection view.",
  "platforms" : [
    "iOS",
    "iPadOS",
    "Mac Catalyst",
    "visionOS"
  ],
  "rawMarkdown" : "---\nsource: https:\/\/developer.apple.com\/documentation\/UIKit\/UICollectionViewDropDelegate\/collectionView(_:dropSessionDidEnd:)\ncrawled: 2025-12-03T17:46:22Z\n---\n\n# collectionView(_:dropSessionDidEnd:)\n\n**Instance Method**\n\nNotifies you when the drag operation ends.\n\n## Declaration\n\n```swift\n@MainActor optional func collectionView(_ collectionView: UICollectionView, dropSessionDidEnd session: any UIDropSession)\n```\n\n## Parameters\n\n- **collectionView**: The collection view that’s tracking the dragged content.\n- **session**: The drop session object containing information about the data being dragged.\n\n## Discussion\n\nThe collection view calls this method at the conclusion of a drag that was over the collection view at one point. Use it to clean up any state information that you used to handle the drag. This method is called regardless of whether the data was actually dropped onto the collection view.\n\n## Tracking the drag movements\n\n- **collectionView(_:dropSessionDidUpdate:withDestinationIndexPath:)**: Tells your delegate that the position of the dragged data over the collection view changed.\n- **collectionView(_:dropSessionDidEnter:)**: Notifies you when dragged content enters the collection view’s bounds rectangle.\n- **collectionView(_:dropSessionDidExit:)**: Notifies you when dragged content exits the collection view’s bounds rectangle.\n\n",
  "sections" : [
    {
      "content" : "",
      "items" : [
        {
          "description" : "Tells your delegate that the position of the dragged data over the collection view changed.",
          "name" : "collectionView(_:dropSessionDidUpdate:withDestinationIndexPath:)",
          "url" : "https:\/\/developer.apple.com\/documentation\/UIKit\/UICollectionViewDropDelegate\/collectionView(_:dropSessionDidUpdate:withDestinationIndexPath:)"
        },
        {
          "description" : "Notifies you when dragged content enters the collection view’s bounds rectangle.",
          "name" : "collectionView(_:dropSessionDidEnter:)",
          "url" : "https:\/\/developer.apple.com\/documentation\/UIKit\/UICollectionViewDropDelegate\/collectionView(_:dropSessionDidEnter:)"
        },
        {
          "description" : "Notifies you when dragged content exits the collection view’s bounds rectangle.",
          "name" : "collectionView(_:dropSessionDidExit:)",
          "url" : "https:\/\/developer.apple.com\/documentation\/UIKit\/UICollectionViewDropDelegate\/collectionView(_:dropSessionDidExit:)"
        }
      ],
      "title" : "Tracking the drag movements"
    }
  ],
  "source" : "appleJSON",
  "title" : "collectionView(_:dropSessionDidEnd:)",
  "url" : "https:\/\/developer.apple.com\/documentation\/UIKit\/UICollectionViewDropDelegate\/collectionView(_:dropSessionDidEnd:)"
}