{
  "abstract" : "Stops active scroll and zoom animations.",
  "codeExamples" : [

  ],
  "contentHash" : "2a64f8b8e06627a1463e4c3f8475ab7d163deccc217cb7afd6b9482195a69772",
  "crawledAt" : "2025-12-03T18:24:04Z",
  "declaration" : {
    "code" : "@MainActor func stopScrollingAndZooming()",
    "language" : "swift"
  },
  "id" : "92C2AE89-0B5E-4DC5-957C-DEEC540DE0E8",
  "kind" : "method",
  "language" : "swift",
  "module" : "UIKit",
  "overview" : "## Discussion\n\nThe scroll view’s content offset remains at the value it has when you call this method, unless:",
  "platforms" : [
    "iOS",
    "iPadOS",
    "Mac Catalyst",
    "tvOS",
    "visionOS"
  ],
  "rawMarkdown" : "---\nsource: https:\/\/developer.apple.com\/documentation\/UIKit\/UIScrollView\/stopScrollingAndZooming()\ncrawled: 2025-12-03T18:24:04Z\n---\n\n# stopScrollingAndZooming()\n\n**Instance Method**\n\nStops active scroll and zoom animations.\n\n## Declaration\n\n```swift\n@MainActor func stopScrollingAndZooming()\n```\n\n## Discussion\n\nThe scroll view’s content offset remains at the value it has when you call this method, unless:\n\n- The scroll view is bouncing, in which case the content offset returns to the edge of the document.\n- The scroll view is paging its content, in which case the content offset updates to a page boundary.\n\n## Managing the scrolling state\n\n- **isTracking**: A Boolean value that indicates whether the user has touched the content to initiate scrolling.\n- **isDragging**: A Boolean value that indicates whether the user has begun scrolling the content.\n- **isDecelerating**: A Boolean value that indicates whether the content is moving in the scroll view after the user lifted their finger.\n- **isScrollAnimating**: A Boolean value that indicates whether the scroll view is currently animating a scroll update.\n- **decelerationRate**: A floating-point value that determines the rate of deceleration after the user lifts their finger.\n- **UIScrollView.DecelerationRate**: Deceleration rates for the scroll view.\n\n",
  "sections" : [
    {
      "content" : "",
      "items" : [
        {
          "description" : "A Boolean value that indicates whether the user has touched the content to initiate scrolling.",
          "name" : "isTracking",
          "url" : "https:\/\/developer.apple.com\/documentation\/UIKit\/UIScrollView\/isTracking"
        },
        {
          "description" : "A Boolean value that indicates whether the user has begun scrolling the content.",
          "name" : "isDragging",
          "url" : "https:\/\/developer.apple.com\/documentation\/UIKit\/UIScrollView\/isDragging"
        },
        {
          "description" : "A Boolean value that indicates whether the content is moving in the scroll view after the user lifted their finger.",
          "name" : "isDecelerating",
          "url" : "https:\/\/developer.apple.com\/documentation\/UIKit\/UIScrollView\/isDecelerating"
        },
        {
          "description" : "A Boolean value that indicates whether the scroll view is currently animating a scroll update.",
          "name" : "isScrollAnimating",
          "url" : "https:\/\/developer.apple.com\/documentation\/UIKit\/UIScrollView\/isScrollAnimating"
        },
        {
          "description" : "A floating-point value that determines the rate of deceleration after the user lifts their finger.",
          "name" : "decelerationRate",
          "url" : "https:\/\/developer.apple.com\/documentation\/UIKit\/UIScrollView\/decelerationRate-swift.property"
        },
        {
          "description" : "Deceleration rates for the scroll view.",
          "name" : "UIScrollView.DecelerationRate",
          "url" : "https:\/\/developer.apple.com\/documentation\/UIKit\/UIScrollView\/DecelerationRate-swift.struct"
        }
      ],
      "title" : "Managing the scrolling state"
    }
  ],
  "source" : "appleJSON",
  "title" : "stopScrollingAndZooming()",
  "url" : "https:\/\/developer.apple.com\/documentation\/UIKit\/UIScrollView\/stopScrollingAndZooming()"
}