{
  "abstract" : "The interface for the delegate of an action sheet object.",
  "codeExamples" : [

  ],
  "conformingTypes" : [
    "UIDocumentInteractionController"
  ],
  "contentHash" : "d5daa5dea33814754ad32ed64159b0004c08b97a2cb5839032d194b67e0f8859",
  "crawledAt" : "2025-12-01T01:06:23Z",
  "declaration" : {
    "code" : "@MainActor protocol UIActionSheetDelegate : NSObjectProtocol",
    "language" : "swift"
  },
  "id" : "DBCF5485-1F97-4F42-B8B4-3C11C618102C",
  "kind" : "protocol",
  "module" : "UIKit",
  "overview" : "## Overview\n\nThe delegate implements the button actions and any other custom behavior. Some of the methods defined in this protocol are optional.\n\nIf you add your own buttons or customize the behavior of an action sheet, implement a delegate conforming to this protocol to handle the corresponding delegate messages. Use the [doc:\/\/com.apple.uikit\/documentation\/UIKit\/UIActionSheet\/delegate] property of the action sheet object to specify one of your application objects as the delegate.\n\nIf you add your own buttons to an action sheet, the delegate must implement the [doc:\/\/com.apple.uikit\/documentation\/UIKit\/UIActionSheetDelegate\/actionSheet(_:clickedButtonAt:)] message to respond when those buttons are clicked; otherwise, your custom buttons do nothing. The action sheet is automatically dismissed after the [doc:\/\/com.apple.uikit\/documentation\/UIKit\/UIActionSheetDelegate\/actionSheet(_:clickedButtonAt:)] delegate method is invoked.\n\nOptionally, you can implement the [doc:\/\/com.apple.uikit\/documentation\/UIKit\/UIActionSheetDelegate\/actionSheetCancel(_:)] method to take the appropriate action when the system cancels your action sheet. If the delegate does not implement this method, the default behavior is to simulate the user clicking the cancel button and closing the view.\n\nYou can also optionally augment the behavior of presenting and dismissing action sheets using the methods in Customizing behavior.",
  "platforms" : [
    "iOS",
    "iPadOS",
    "Mac Catalyst",
    "visionOS"
  ],
  "rawMarkdown" : "---\nsource: https:\/\/developer.apple.com\/documentation\/UIKit\/UIActionSheetDelegate\ncrawled: 2025-12-01T01:06:23Z\n---\n\n# UIActionSheetDelegate\n\n**Protocol**\n\nThe interface for the delegate of an action sheet object.\n\n## Declaration\n\n```swift\n@MainActor protocol UIActionSheetDelegate : NSObjectProtocol\n```\n\n## Overview\n\nThe delegate implements the button actions and any other custom behavior. Some of the methods defined in this protocol are optional.\n\nIf you add your own buttons or customize the behavior of an action sheet, implement a delegate conforming to this protocol to handle the corresponding delegate messages. Use the [doc:\/\/com.apple.uikit\/documentation\/UIKit\/UIActionSheet\/delegate] property of the action sheet object to specify one of your application objects as the delegate.\n\nIf you add your own buttons to an action sheet, the delegate must implement the [doc:\/\/com.apple.uikit\/documentation\/UIKit\/UIActionSheetDelegate\/actionSheet(_:clickedButtonAt:)] message to respond when those buttons are clicked; otherwise, your custom buttons do nothing. The action sheet is automatically dismissed after the [doc:\/\/com.apple.uikit\/documentation\/UIKit\/UIActionSheetDelegate\/actionSheet(_:clickedButtonAt:)] delegate method is invoked.\n\nOptionally, you can implement the [doc:\/\/com.apple.uikit\/documentation\/UIKit\/UIActionSheetDelegate\/actionSheetCancel(_:)] method to take the appropriate action when the system cancels your action sheet. If the delegate does not implement this method, the default behavior is to simulate the user clicking the cancel button and closing the view.\n\nYou can also optionally augment the behavior of presenting and dismissing action sheets using the methods in Customizing behavior.\n\n## Responding to actions\n\n- **actionSheet(_:clickedButtonAt:)**: Sent to the delegate when the user clicks a button on an action sheet.\n\n## Customizing behavior\n\n- **willPresent(_:)**: Sent to the delegate before an action sheet is presented to the user.\n- **didPresent(_:)**: Sent to the delegate after an action sheet is presented to the user.\n- **actionSheet(_:willDismissWithButtonIndex:)**: Sent to the delegate before an action sheet is dismissed.\n- **actionSheet(_:didDismissWithButtonIndex:)**: Sent to the delegate after an action sheet is dismissed from the screen.\n\n## Canceling\n\n- **actionSheetCancel(_:)**: Sent to the delegate before an action sheet is canceled.\n\n## Deprecated protocols\n\n- **UIAccelerometerDelegate**: The interface for receiving acceleration-related data from the system.\n- **UIAlertViewDelegate**: The interface for the delegate of an alert view object.\n- **UIPopoverControllerDelegate**: The interface for the delegate of a popover controller object.\n- **UISearchDisplayDelegate**: The interface for the delegate of a search display controller.\n- **UIViewControllerPreviewing**: A set of methods that define the interface for configuring a previewing view controller on devices that support 3D Touch.\n- **UIViewControllerPreviewingDelegate**: A set of methods used by the delegate to respond, with a preview view controller and a commit view controller, to the user pressing a view object on the screen of a device that supports 3D Touch.\n\n## Inherits From\n\n- NSObjectProtocol\n\n## Conforming Types\n\n- UIDocumentInteractionController\n\n",
  "sections" : [
    {
      "content" : "",
      "items" : [
        {
          "description" : "Sent to the delegate when the user clicks a button on an action sheet.",
          "name" : "actionSheet(_:clickedButtonAt:)",
          "url" : "https:\/\/developer.apple.com\/documentation\/UIKit\/UIActionSheetDelegate\/actionSheet(_:clickedButtonAt:)"
        }
      ],
      "title" : "Responding to actions"
    },
    {
      "content" : "",
      "items" : [
        {
          "description" : "Sent to the delegate before an action sheet is presented to the user.",
          "name" : "willPresent(_:)",
          "url" : "https:\/\/developer.apple.com\/documentation\/UIKit\/UIActionSheetDelegate\/willPresent(_:)"
        },
        {
          "description" : "Sent to the delegate after an action sheet is presented to the user.",
          "name" : "didPresent(_:)",
          "url" : "https:\/\/developer.apple.com\/documentation\/UIKit\/UIActionSheetDelegate\/didPresent(_:)"
        },
        {
          "description" : "Sent to the delegate before an action sheet is dismissed.",
          "name" : "actionSheet(_:willDismissWithButtonIndex:)",
          "url" : "https:\/\/developer.apple.com\/documentation\/UIKit\/UIActionSheetDelegate\/actionSheet(_:willDismissWithButtonIndex:)"
        },
        {
          "description" : "Sent to the delegate after an action sheet is dismissed from the screen.",
          "name" : "actionSheet(_:didDismissWithButtonIndex:)",
          "url" : "https:\/\/developer.apple.com\/documentation\/UIKit\/UIActionSheetDelegate\/actionSheet(_:didDismissWithButtonIndex:)"
        }
      ],
      "title" : "Customizing behavior"
    },
    {
      "content" : "",
      "items" : [
        {
          "description" : "Sent to the delegate before an action sheet is canceled.",
          "name" : "actionSheetCancel(_:)",
          "url" : "https:\/\/developer.apple.com\/documentation\/UIKit\/UIActionSheetDelegate\/actionSheetCancel(_:)"
        }
      ],
      "title" : "Canceling"
    },
    {
      "content" : "",
      "items" : [
        {
          "description" : "The interface for receiving acceleration-related data from the system.",
          "name" : "UIAccelerometerDelegate",
          "url" : "https:\/\/developer.apple.com\/documentation\/UIKit\/UIAccelerometerDelegate"
        },
        {
          "description" : "The interface for the delegate of an alert view object.",
          "name" : "UIAlertViewDelegate",
          "url" : "https:\/\/developer.apple.com\/documentation\/UIKit\/UIAlertViewDelegate"
        },
        {
          "description" : "The interface for the delegate of a popover controller object.",
          "name" : "UIPopoverControllerDelegate",
          "url" : "https:\/\/developer.apple.com\/documentation\/UIKit\/UIPopoverControllerDelegate"
        },
        {
          "description" : "The interface for the delegate of a search display controller.",
          "name" : "UISearchDisplayDelegate",
          "url" : "https:\/\/developer.apple.com\/documentation\/UIKit\/UISearchDisplayDelegate"
        },
        {
          "description" : "A set of methods that define the interface for configuring a previewing view controller on devices that support 3D Touch.",
          "name" : "UIViewControllerPreviewing",
          "url" : "https:\/\/developer.apple.com\/documentation\/UIKit\/UIViewControllerPreviewing"
        },
        {
          "description" : "A set of methods used by the delegate to respond, with a preview view controller and a commit view controller, to the user pressing a view object on the screen of a device that supports 3D Touch.",
          "name" : "UIViewControllerPreviewingDelegate",
          "url" : "https:\/\/developer.apple.com\/documentation\/UIKit\/UIViewControllerPreviewingDelegate"
        }
      ],
      "title" : "Deprecated protocols"
    },
    {
      "content" : "",
      "items" : [
        {
          "name" : "NSObjectProtocol"
        }
      ],
      "title" : "Inherits From"
    }
  ],
  "source" : "appleJSON",
  "title" : "UIActionSheetDelegate",
  "url" : "https:\/\/developer.apple.com\/documentation\/UIKit\/UIActionSheetDelegate"
}