{
  "abstract" : "An overlay fill color for large areas that contain complex content.",
  "codeExamples" : [

  ],
  "contentHash" : "701e5b8ee44429a9dfebeb55349565561140e543cdad7a84b86b01e86c0fe346",
  "crawledAt" : "2025-12-05T21:24:56Z",
  "declaration" : {
    "code" : "class var quaternarySystemFill: UIColor { get }",
    "language" : "swift"
  },
  "id" : "81EB842C-835E-45CF-B5D4-409829AD6D84",
  "kind" : "property",
  "language" : "swift",
  "module" : "UIKit",
  "overview" : "## Discussion\n\nUse system fill colors for items situated on top of an existing background color. System fill colors incorporate transparency to allow the background color to show through.\n\nUse this color to fill large areas that contain complex content, such as an expanded table cell.",
  "platforms" : [
    "iOS",
    "iPadOS",
    "Mac Catalyst",
    "visionOS"
  ],
  "rawMarkdown" : "---\nsource: https:\/\/developer.apple.com\/documentation\/UIKit\/UIColor\/quaternarySystemFill\ncrawled: 2025-12-05T21:24:56Z\n---\n\n# quaternarySystemFill\n\n**Type Property**\n\nAn overlay fill color for large areas that contain complex content.\n\n## Declaration\n\n```swift\nclass var quaternarySystemFill: UIColor { get }\n```\n\n## Discussion\n\nUse system fill colors for items situated on top of an existing background color. System fill colors incorporate transparency to allow the background color to show through.\n\nUse this color to fill large areas that contain complex content, such as an expanded table cell.\n\n## Fill colors\n\n- **systemFill**: An overlay fill color for thin and small shapes.\n- **secondarySystemFill**: An overlay fill color for medium-size shapes.\n- **tertiarySystemFill**: An overlay fill color for large shapes.\n\n",
  "sections" : [
    {
      "content" : "",
      "items" : [
        {
          "description" : "An overlay fill color for thin and small shapes.",
          "name" : "systemFill",
          "url" : "https:\/\/developer.apple.com\/documentation\/UIKit\/UIColor\/systemFill"
        },
        {
          "description" : "An overlay fill color for medium-size shapes.",
          "name" : "secondarySystemFill",
          "url" : "https:\/\/developer.apple.com\/documentation\/UIKit\/UIColor\/secondarySystemFill"
        },
        {
          "description" : "An overlay fill color for large shapes.",
          "name" : "tertiarySystemFill",
          "url" : "https:\/\/developer.apple.com\/documentation\/UIKit\/UIColor\/tertiarySystemFill"
        }
      ],
      "title" : "Fill colors"
    }
  ],
  "source" : "appleJSON",
  "title" : "quaternarySystemFill",
  "url" : "https:\/\/developer.apple.com\/documentation\/UIKit\/UIColor\/quaternarySystemFill"
}