{
  "abstract" : "A key indicating that a remote notification is available for the app to process.",
  "codeExamples" : [

  ],
  "contentHash" : "3dc3b74e455a8664b8e55dd7e3863ac19f0c14bdce337eb4bc3a51b7b75b0e9e",
  "crawledAt" : "2025-12-07T13:43:39Z",
  "declaration" : {
    "code" : "static let remoteNotification: UIApplication.LaunchOptionsKey",
    "language" : "swift"
  },
  "id" : "1A049110-915E-41F8-82AB-42FC0665533B",
  "kind" : "property",
  "language" : "swift",
  "module" : "UIKit",
  "overview" : "## Discussion\n\nThe value of this key is an [doc:\/\/com.apple.documentation\/documentation\/Foundation\/NSDictionary] containing the payload of the remote notification. See the description of [doc:\/\/com.apple.uikit\/documentation\/UIKit\/UIApplicationDelegate\/application(_:didReceiveRemoteNotification:)] for further information about handling remote notifications.\n\nThis key is also used to access the same value in the `userInfo` dictionary of the notification named [doc:\/\/com.apple.uikit\/documentation\/UIKit\/UIApplication\/didFinishLaunchingNotification].",
  "platforms" : [
    "iOS",
    "iPadOS",
    "Mac Catalyst",
    "visionOS"
  ],
  "rawMarkdown" : "---\nsource: https:\/\/developer.apple.com\/documentation\/uikit\/uiapplication\/launchoptionskey\/remotenotification\ncrawled: 2025-12-07T13:43:39Z\n---\n\n# remoteNotification\n\n**Type Property**\n\nA key indicating that a remote notification is available for the app to process.\n\n## Declaration\n\n```swift\nstatic let remoteNotification: UIApplication.LaunchOptionsKey\n```\n\n## Discussion\n\nThe value of this key is an [doc:\/\/com.apple.documentation\/documentation\/Foundation\/NSDictionary] containing the payload of the remote notification. See the description of [doc:\/\/com.apple.uikit\/documentation\/UIKit\/UIApplicationDelegate\/application(_:didReceiveRemoteNotification:)] for further information about handling remote notifications.\n\nThis key is also used to access the same value in the `userInfo` dictionary of the notification named [doc:\/\/com.apple.uikit\/documentation\/UIKit\/UIApplication\/didFinishLaunchingNotification].\n\n## Accessing launch options\n\n- **bluetoothCentrals**: A key indicating that the app was relaunched to handle Bluetooth-related events.\n- **bluetoothPeripherals**: A key indicating that the app should continue actions associated with its Bluetooth peripheral objects.\n- **cloudKitShareMetadata**: A key indicating that the app received a CloudKit share invitation.\n- **eventAttribution**\n- **location**: A key indicating that the app was launched to handle an incoming location event.\n- **newsstandDownloads**: A key indicating that the app was launched to process newly downloaded Newsstand assets.\n- **shortcutItem**: A key indicating that the app was launched in response to the user selecting a Home screen quick action.\n- **sourceApplication**: A key indicating that another app requested the launch of your app.\n- **url**: A key indicating that the app was launched so that it could open the specified URL.\n- **userActivityDictionary**: A key indicating a dictionary associated with an activity that the user wants to continue.\n- **userActivityType**: A key indicating the type of user activity that the user wants to continue.\n- **annotation**: A key indicating that the URL passed to your app contained custom annotation data from the source app.\n- **localNotification**: A key indicating that the app was launched to handle a local notification.\n\n",
  "sections" : [
    {
      "content" : "",
      "items" : [
        {
          "description" : "A key indicating that the app was relaunched to handle Bluetooth-related events.",
          "name" : "bluetoothCentrals",
          "url" : "https:\/\/developer.apple.com\/documentation\/UIKit\/UIApplication\/LaunchOptionsKey\/bluetoothCentrals"
        },
        {
          "description" : "A key indicating that the app should continue actions associated with its Bluetooth peripheral objects.",
          "name" : "bluetoothPeripherals",
          "url" : "https:\/\/developer.apple.com\/documentation\/UIKit\/UIApplication\/LaunchOptionsKey\/bluetoothPeripherals"
        },
        {
          "description" : "A key indicating that the app received a CloudKit share invitation.",
          "name" : "cloudKitShareMetadata",
          "url" : "https:\/\/developer.apple.com\/documentation\/UIKit\/UIApplication\/LaunchOptionsKey\/cloudKitShareMetadata"
        },
        {
          "description" : "",
          "name" : "eventAttribution",
          "url" : "https:\/\/developer.apple.com\/documentation\/UIKit\/UIApplication\/LaunchOptionsKey\/eventAttribution"
        },
        {
          "description" : "A key indicating that the app was launched to handle an incoming location event.",
          "name" : "location",
          "url" : "https:\/\/developer.apple.com\/documentation\/UIKit\/UIApplication\/LaunchOptionsKey\/location"
        },
        {
          "description" : "A key indicating that the app was launched to process newly downloaded Newsstand assets.",
          "name" : "newsstandDownloads",
          "url" : "https:\/\/developer.apple.com\/documentation\/UIKit\/UIApplication\/LaunchOptionsKey\/newsstandDownloads"
        },
        {
          "description" : "A key indicating that the app was launched in response to the user selecting a Home screen quick action.",
          "name" : "shortcutItem",
          "url" : "https:\/\/developer.apple.com\/documentation\/UIKit\/UIApplication\/LaunchOptionsKey\/shortcutItem"
        },
        {
          "description" : "A key indicating that another app requested the launch of your app.",
          "name" : "sourceApplication",
          "url" : "https:\/\/developer.apple.com\/documentation\/UIKit\/UIApplication\/LaunchOptionsKey\/sourceApplication"
        },
        {
          "description" : "A key indicating that the app was launched so that it could open the specified URL.",
          "name" : "url",
          "url" : "https:\/\/developer.apple.com\/documentation\/UIKit\/UIApplication\/LaunchOptionsKey\/url"
        },
        {
          "description" : "A key indicating a dictionary associated with an activity that the user wants to continue.",
          "name" : "userActivityDictionary",
          "url" : "https:\/\/developer.apple.com\/documentation\/UIKit\/UIApplication\/LaunchOptionsKey\/userActivityDictionary"
        },
        {
          "description" : "A key indicating the type of user activity that the user wants to continue.",
          "name" : "userActivityType",
          "url" : "https:\/\/developer.apple.com\/documentation\/UIKit\/UIApplication\/LaunchOptionsKey\/userActivityType"
        },
        {
          "description" : "A key indicating that the URL passed to your app contained custom annotation data from the source app.",
          "name" : "annotation",
          "url" : "https:\/\/developer.apple.com\/documentation\/UIKit\/UIApplication\/LaunchOptionsKey\/annotation"
        },
        {
          "description" : "A key indicating that the app was launched to handle a local notification.",
          "name" : "localNotification",
          "url" : "https:\/\/developer.apple.com\/documentation\/UIKit\/UIApplication\/LaunchOptionsKey\/localNotification"
        }
      ],
      "title" : "Accessing launch options"
    }
  ],
  "source" : "appleJSON",
  "title" : "remoteNotification",
  "url" : "https:\/\/developer.apple.com\/documentation\/uikit\/uiapplication\/launchoptionskey\/remotenotification"
}