{
  "abstract" : "An elaborated title that explains the purpose of the command.",
  "codeExamples" : [

  ],
  "contentHash" : "16768f98bfcdad0cba6c404b314270bd961a7d4b71318426b00d226db2b86d18",
  "crawledAt" : "2025-12-02T21:19:16Z",
  "declaration" : {
    "code" : "@MainActor var discoverabilityTitle: String? { get set }",
    "language" : "swift"
  },
  "id" : "B4474584-4F0D-4413-9EE5-C4E047A30B43",
  "kind" : "property",
  "language" : "swift",
  "module" : "UIKit",
  "overview" : "## Discussion\n\nThe system uses this property to display information about the command. In iOS, the system displays this title in the discoverability heads-up display (HUD). If this property is `nil`, the HUD displays the [doc:\/\/com.apple.uikit\/documentation\/UIKit\/UICommand\/title] property.\n\nIn Mac apps built with Mac Catalyst, the system displays the discoverability title as a tooltip.",
  "platforms" : [
    "iOS",
    "iPadOS",
    "Mac Catalyst",
    "tvOS",
    "visionOS"
  ],
  "rawMarkdown" : "---\nsource: https:\/\/developer.apple.com\/documentation\/UIKit\/UICommand\/discoverabilityTitle\ncrawled: 2025-12-02T21:19:16Z\n---\n\n# discoverabilityTitle\n\n**Instance Property**\n\nAn elaborated title that explains the purpose of the command.\n\n## Declaration\n\n```swift\n@MainActor var discoverabilityTitle: String? { get set }\n```\n\n## Discussion\n\nThe system uses this property to display information about the command. In iOS, the system displays this title in the discoverability heads-up display (HUD). If this property is `nil`, the HUD displays the [doc:\/\/com.apple.uikit\/documentation\/UIKit\/UICommand\/title] property.\n\nIn Mac apps built with Mac Catalyst, the system displays the discoverability title as a tooltip.\n\n## Getting information about the command\n\n- **title**: The command’s title.\n- **image**: The command’s image.\n- **action**: The selector identifying the action method called after the user selects the command.\n- **attributes**: The attributes indicating the style of the command.\n- **state**: The state of the command.\n\n",
  "sections" : [
    {
      "content" : "",
      "items" : [
        {
          "description" : "The command’s title.",
          "name" : "title",
          "url" : "https:\/\/developer.apple.com\/documentation\/UIKit\/UICommand\/title"
        },
        {
          "description" : "The command’s image.",
          "name" : "image",
          "url" : "https:\/\/developer.apple.com\/documentation\/UIKit\/UICommand\/image"
        },
        {
          "description" : "The selector identifying the action method called after the user selects the command.",
          "name" : "action",
          "url" : "https:\/\/developer.apple.com\/documentation\/UIKit\/UICommand\/action"
        },
        {
          "description" : "The attributes indicating the style of the command.",
          "name" : "attributes",
          "url" : "https:\/\/developer.apple.com\/documentation\/UIKit\/UICommand\/attributes"
        },
        {
          "description" : "The state of the command.",
          "name" : "state",
          "url" : "https:\/\/developer.apple.com\/documentation\/UIKit\/UICommand\/state"
        }
      ],
      "title" : "Getting information about the command"
    }
  ],
  "source" : "appleJSON",
  "title" : "discoverabilityTitle",
  "url" : "https:\/\/developer.apple.com\/documentation\/UIKit\/UICommand\/discoverabilityTitle"
}