{
  "abstract" : "Replaces the current text content manager with a new one you provide.",
  "codeExamples" : [

  ],
  "contentHash" : "28d097910e5e26ee0eb2df77b9b40bb686b0a6d65dc05f590cf277661d5d58ec",
  "crawledAt" : "2025-12-02T21:09:50Z",
  "declaration" : {
    "code" : "func replace(_ textContentManager: NSTextContentManager)",
    "language" : "swift"
  },
  "id" : "F3770797-B50A-46E7-92A8-9E141DAAC34C",
  "kind" : "method",
  "language" : "swift",
  "module" : "UIKit",
  "overview" : "## Discussion\n\nUse this method to replace the current [doc:\/\/com.apple.uikit\/documentation\/UIKit\/NSTextContentManager] with a new one, leaving all related objects intact. This method makes sure the [doc:\/\/com.apple.uikit\/documentation\/UIKit\/NSTextLayoutManager] doesn’t get deallocated while migrating to the new manager.",
  "platforms" : [
    "iOS",
    "iPadOS",
    "Mac Catalyst",
    "tvOS",
    "visionOS"
  ],
  "rawMarkdown" : "---\nsource: https:\/\/developer.apple.com\/documentation\/UIKit\/NSTextLayoutManager\/replace(_:)\ncrawled: 2025-12-02T21:09:50Z\n---\n\n# replace(_:)\n\n**Instance Method**\n\nReplaces the current text content manager with a new one you provide.\n\n## Declaration\n\n```swift\nfunc replace(_ textContentManager: NSTextContentManager)\n```\n\n## Parameters\n\n- **textContentManager**: The new text context manager.\n\n## Discussion\n\nUse this method to replace the current [doc:\/\/com.apple.uikit\/documentation\/UIKit\/NSTextContentManager] with a new one, leaving all related objects intact. This method makes sure the [doc:\/\/com.apple.uikit\/documentation\/UIKit\/NSTextLayoutManager] doesn’t get deallocated while migrating to the new manager.\n\n## Accessing the text storage\n\n- **textContentManager**: Returns the text content manager associated with this text layout manager.\n- **textContainer**: The text container object that provides geometric information for the layout destination.\n- **textSelectionNavigation**: Returns a text selection manager configured to have the text layout manager as its data source.\n- **textSelections**: An array of text selections associated by the text layout manager.\n- **usageBoundsForTextContainer**: Returns the usage bounds for the text container.\n- **enumerateTextSegments(in:type:options:using:)**: Enumerates text segments of a specific type and in the text range you provide.\n- **replaceContents(in:with:)**: Replaces content at the location you specify with an attributed string you provide.\n- **replaceContents(in:with:)**: Replaces content at the location you specify with the text elements string you provide.\n\n",
  "sections" : [
    {
      "content" : "",
      "items" : [
        {
          "description" : "Returns the text content manager associated with this text layout manager.",
          "name" : "textContentManager",
          "url" : "https:\/\/developer.apple.com\/documentation\/UIKit\/NSTextLayoutManager\/textContentManager"
        },
        {
          "description" : "The text container object that provides geometric information for the layout destination.",
          "name" : "textContainer",
          "url" : "https:\/\/developer.apple.com\/documentation\/UIKit\/NSTextLayoutManager\/textContainer"
        },
        {
          "description" : "Returns a text selection manager configured to have the text layout manager as its data source.",
          "name" : "textSelectionNavigation",
          "url" : "https:\/\/developer.apple.com\/documentation\/UIKit\/NSTextLayoutManager\/textSelectionNavigation"
        },
        {
          "description" : "An array of text selections associated by the text layout manager.",
          "name" : "textSelections",
          "url" : "https:\/\/developer.apple.com\/documentation\/UIKit\/NSTextLayoutManager\/textSelections"
        },
        {
          "description" : "Returns the usage bounds for the text container.",
          "name" : "usageBoundsForTextContainer",
          "url" : "https:\/\/developer.apple.com\/documentation\/UIKit\/NSTextLayoutManager\/usageBoundsForTextContainer"
        },
        {
          "description" : "Enumerates text segments of a specific type and in the text range you provide.",
          "name" : "enumerateTextSegments(in:type:options:using:)",
          "url" : "https:\/\/developer.apple.com\/documentation\/UIKit\/NSTextLayoutManager\/enumerateTextSegments(in:type:options:using:)"
        },
        {
          "description" : "Replaces content at the location you specify with an attributed string you provide.",
          "name" : "replaceContents(in:with:)",
          "url" : "https:\/\/developer.apple.com\/documentation\/UIKit\/NSTextLayoutManager\/replaceContents(in:with:)-2elb"
        },
        {
          "description" : "Replaces content at the location you specify with the text elements string you provide.",
          "name" : "replaceContents(in:with:)",
          "url" : "https:\/\/developer.apple.com\/documentation\/UIKit\/NSTextLayoutManager\/replaceContents(in:with:)-80j0b"
        }
      ],
      "title" : "Accessing the text storage"
    }
  ],
  "source" : "appleJSON",
  "title" : "replace(_:)",
  "url" : "https:\/\/developer.apple.com\/documentation\/UIKit\/NSTextLayoutManager\/replace(_:)"
}