{
  "abstract" : "The item you can use as an anchor for subsequent presentations.",
  "codeExamples" : [
    {
      "code" : "let share = UIAction(title: \"Share\") { [unowned self] action in\n    let shareVC = UIActivityViewController(activityItems: items, applicationActivities: activities)\n    shareVC.modalPresentationStyle = .popover\n    shareVC.popoverPresentationController?.sourceItem = action.presentationSourceItem\n    present(shareVC, animated: true)\n}",
      "language" : "swift"
    }
  ],
  "contentHash" : "8f88b30396ad598c65f0e349c7f98eb12e1b0e9457432992dc0a847d2b5ef81f",
  "crawledAt" : "2025-12-02T21:01:16Z",
  "declaration" : {
    "code" : "@MainActor var presentationSourceItem: (any UIPopoverPresentationControllerSourceItem)? { get }",
    "language" : "swift"
  },
  "id" : "8597A46D-ECCA-4C71-90B6-FF2B02F74356",
  "kind" : "property",
  "language" : "swift",
  "module" : "UIKit",
  "overview" : "## Discussion\n\nThe system populates this property during the execution of the menu element’s action (its handler or selector). For example, for a menu element in a menu that presents from a [doc:\/\/com.apple.uikit\/documentation\/UIKit\/UIButton], the system may populate this property with that button.\n\nUse this property to specify where to anchor popovers when a person taps the menu element, like in the following code.",
  "platforms" : [
    "iOS",
    "iPadOS",
    "Mac Catalyst",
    "visionOS"
  ],
  "rawMarkdown" : "---\nsource: https:\/\/developer.apple.com\/documentation\/UIKit\/UIMenuLeaf\/presentationSourceItem\ncrawled: 2025-12-02T21:01:16Z\n---\n\n# presentationSourceItem\n\n**Instance Property**\n\nThe item you can use as an anchor for subsequent presentations.\n\n## Declaration\n\n```swift\n@MainActor var presentationSourceItem: (any UIPopoverPresentationControllerSourceItem)? { get }\n```\n\n## Discussion\n\nThe system populates this property during the execution of the menu element’s action (its handler or selector). For example, for a menu element in a menu that presents from a [doc:\/\/com.apple.uikit\/documentation\/UIKit\/UIButton], the system may populate this property with that button.\n\nUse this property to specify where to anchor popovers when a person taps the menu element, like in the following code.\n\n```swift\nlet share = UIAction(title: \"Share\") { [unowned self] action in\n    let shareVC = UIActivityViewController(activityItems: items, applicationActivities: activities)\n    shareVC.modalPresentationStyle = .popover\n    shareVC.popoverPresentationController?.sourceItem = action.presentationSourceItem\n    present(shareVC, animated: true)\n}\n```\n\n## Managing the appearance\n\n- **title**: A short display title for the menu element.\n- **discoverabilityTitle**: A long, informative title to use in the keyboard shortcut overlay.\n- **image**: An image that appears next to the menu element.\n- **attributes**: The attributes that determine the style of the menu element.\n\n",
  "sections" : [
    {
      "content" : "",
      "items" : [
        {
          "description" : "A short display title for the menu element.",
          "name" : "title",
          "url" : "https:\/\/developer.apple.com\/documentation\/UIKit\/UIMenuLeaf\/title"
        },
        {
          "description" : "A long, informative title to use in the keyboard shortcut overlay.",
          "name" : "discoverabilityTitle",
          "url" : "https:\/\/developer.apple.com\/documentation\/UIKit\/UIMenuLeaf\/discoverabilityTitle"
        },
        {
          "description" : "An image that appears next to the menu element.",
          "name" : "image",
          "url" : "https:\/\/developer.apple.com\/documentation\/UIKit\/UIMenuLeaf\/image"
        },
        {
          "description" : "The attributes that determine the style of the menu element.",
          "name" : "attributes",
          "url" : "https:\/\/developer.apple.com\/documentation\/UIKit\/UIMenuLeaf\/attributes"
        }
      ],
      "title" : "Managing the appearance"
    }
  ],
  "source" : "appleJSON",
  "title" : "presentationSourceItem",
  "url" : "https:\/\/developer.apple.com\/documentation\/UIKit\/UIMenuLeaf\/presentationSourceItem"
}