{
  "abstract" : "Fill connected displays with additional content from your app.",
  "codeExamples" : [
    {
      "code" : "func scene(_ scene: UIScene, willConnectTo session: UISceneSession, options connectionOptions: UIScene.ConnectionOptions) {\n    guard let windowScene = (scene as? UIWindowScene) else { return }\n\n    if session.role == .windowApplication {\n        let window = UIWindow(windowScene: windowScene)\n        window.rootViewController = ViewController()\n        self.window = window\n        window.makeKeyAndVisible()\n    }\n}",
      "language" : "swift"
    },
    {
      "code" : "class ExternalDisplaySceneDelegate: UIResponder, UIWindowSceneDelegate {\n    var window: UIWindow?\n    var screen: UIScreen?\n\n    func scene(_ scene: UIScene, willConnectTo session: UISceneSession, options connectionOptions: UIScene.ConnectionOptions) {\n        guard let windowScene = (scene as? UIWindowScene) else { return }\n\n        if session.role == .windowExternalDisplayNonInteractive {\n            let window = UIWindow(windowScene: windowScene)\n            window.rootViewController = ExternalDisplayViewController()\n            self.window = window\n            window.makeKeyAndVisible()\n            ...\n            setupDisplayLinkIfNecessary()\n        }\n    }\n\n    func windowScene(_ windowScene: UIWindowScene, didUpdate previousCoordinateSpace: UICoordinateSpace, interfaceOrientation previousInterfaceOrientation: UIInterfaceOrientation, traitCollection previousTraitCollection: UITraitCollection) {\n        setupDisplayLinkIfNecessary()\n    }\n\n    weak var linkedScreen: UIScreen?\n\n    func setupDisplayLinkIfNecessary() {\n        let currentScreen = self.screen\n        if currentScreen != linkedScreen {\n            \/\/ Set up display link\n            ...\n            self.linkedScreen = currentScreen\n        }\n    }\n\n    ...\n}",
      "language" : "swift"
    }
  ],
  "contentHash" : "2f8721cce87f86a05345d43b8d1a77abc76a5fded07394007ec897862ac0cb55",
  "crawledAt" : "2025-12-02T17:03:38Z",
  "id" : "84F0649D-AF7C-4BF1-812B-0263E7E4E49D",
  "kind" : "article",
  "language" : "swift",
  "module" : "UIKit",
  "overview" : "## Overview\n\nThe user can connect additional displays to an iOS device at any time using AirPlay or a physical cable. Each additional display represents new space on which to present your app’s content. To present content on a connected display, you attach windows to [doc:\/\/com.apple.uikit\/documentation\/UIKit\/UIWindowScene] objects that the system provides and respond to life-cycle events using scene delegates.\n\nUIKit defines different [doc:\/\/com.apple.uikit\/documentation\/UIKit\/UISceneSession\/Role-swift.struct] types to indicate how the user interacts with the content for a scene. The following types relate to content displayed on a connected screen:\n\n### Configure your project for scenes\n\nYou provide the system with scene configurations to specify the information it uses to create scenes for your app and indicate the types of scenes your app supports.\n\nBy default, Xcode preconfigures new projects to use scenes with the [doc:\/\/com.apple.uikit\/documentation\/UIKit\/UISceneSession\/Role-swift.struct\/windowApplication] role. iPad models with the M1 chip can present interactive content on the connected screen through this type of scene, when using Stage Manager, an external keyboard, and a pointing device.\n\nTo use the connected display to present noninteractive content that supplements the interactive content your app presents on the built-in screen, provide a new configuration for the [doc:\/\/com.apple.uikit\/documentation\/UIKit\/UISceneSession\/Role-swift.struct\/windowExternalDisplayNonInteractive] role. When an external display connects, the system provides an additional scene for your app to add the noninteractive content to. For example, a game might show its content on a connected display and show game controls on the built-in screen.\n\n\n\nFor more information, see [doc:\/\/com.apple.uikit\/documentation\/UIKit\/specifying-the-scenes-your-app-supports].\n\n### Attach a window to a scene\n\nWhen a display connects to an iOS device, the system provides a scene for your app. Your app receives the scene through the [doc:\/\/com.apple.uikit\/documentation\/UIKit\/UISceneDelegate\/scene(_:willConnectTo:options:)] method on your scene delegate. You can use the method and the session object it provides to configure and attach a window to the scene. The system displays the window you provide on the window scene’s current screen.\n\nThis example configures a window to render on a scene’s display.\n\nWhen using a storyboard, the system initializes and attaches a window to the scene for you.\n\nIn addition to calling this method, UIKit also posts the [doc:\/\/com.apple.uikit\/documentation\/UIKit\/UIScene\/willConnectNotification] notification.\n\n### Handle disconnection\n\nWhen the system disconnects a scene from your app, which may occur if a user disconnects the display, your app receives a call through the [doc:\/\/com.apple.uikit\/documentation\/UIKit\/UISceneDelegate\/sceneDidDisconnect(_:)] method on the scene’s delegate. Use this method to perform any final cleanup and update the content other scenes present, when necessary.\n\nUIKit also posts the [doc:\/\/com.apple.uikit\/documentation\/UIKit\/UIScene\/didDisconnectNotification] notification in addition to calling this method.\n\n### Handle transitions to and from connected displays\n\nScenes may appear on different displays during their lifetime. If you use information from a [doc:\/\/com.apple.uikit\/documentation\/UIKit\/UIScreen] object, obtain it contextually using a windows scene’s [doc:\/\/com.apple.uikit\/documentation\/UIKit\/UIWindowScene\/screen] property.\n\nUse the scene delegate’s [doc:\/\/com.apple.uikit\/documentation\/UIKit\/UIWindowSceneDelegate\/windowScene(_:didUpdate:interfaceOrientation:traitCollection:)] method if your app needs to know when a scene is changing screens.\n\nThis examples uses a display link and updates the link when the scene changes screens.\n\n### Change the screen mode of an external display\n\nMany displays support multiple resolutions, some of which use different pixel aspect ratios. Screen objects use the most common screen mode by default, but they support changing that mode when they display content for a scene with the [doc:\/\/com.apple.uikit\/documentation\/UIKit\/UISceneSession\/Role-swift.struct\/windowExternalDisplayNonInteractive] role. For example, if you’re implementing a game using textures for a 640 x 480 pixel screen, you might change the screen mode for screens with higher default resolutions. Don’t attempt to change the mode of a screen for a scene with the [doc:\/\/com.apple.uikit\/documentation\/UIKit\/UISceneSession\/Role-swift.struct\/windowApplication] role.\n\nIf you plan to use a screen mode other than the default one, apply that mode to the [doc:\/\/com.apple.uikit\/documentation\/UIKit\/UIScreen] object before associating the screen with a window. The [doc:\/\/com.apple.uikit\/documentation\/UIKit\/UIScreenMode] class defines the attributes of a single screen mode. You can get a list of the modes supported by a screen from its [doc:\/\/com.apple.uikit\/documentation\/UIKit\/UIScreen\/availableModes] property and then iterate through the list for one that matches your needs.\n\nFor more information about screen modes, see [doc:\/\/com.apple.uikit\/documentation\/UIKit\/UIScreenMode].",
  "rawMarkdown" : "---\nsource: https:\/\/developer.apple.com\/documentation\/UIKit\/presenting-content-on-a-connected-display\ncrawled: 2025-12-02T17:03:38Z\n---\n\n# Presenting content on a connected display\n\n**Article**\n\nFill connected displays with additional content from your app.\n\n## Overview\n\nThe user can connect additional displays to an iOS device at any time using AirPlay or a physical cable. Each additional display represents new space on which to present your app’s content. To present content on a connected display, you attach windows to [doc:\/\/com.apple.uikit\/documentation\/UIKit\/UIWindowScene] objects that the system provides and respond to life-cycle events using scene delegates.\n\nUIKit defines different [doc:\/\/com.apple.uikit\/documentation\/UIKit\/UISceneSession\/Role-swift.struct] types to indicate how the user interacts with the content for a scene. The following types relate to content displayed on a connected screen:\n\n- Scenes with the [doc:\/\/com.apple.uikit\/documentation\/UIKit\/UISceneSession\/Role-swift.struct\/windowApplication] role present interactive windows. The windows render on the built-in display or a connected display for some iPad models. Windows for more than one scene may present concurrently and may not take up the full screen.\n- Scenes with the [doc:\/\/com.apple.uikit\/documentation\/UIKit\/UISceneSession\/Role-swift.struct\/windowExternalDisplayNonInteractive] role present noninteractive windows on connected displays. When an app presents content for this scene, it spans the full screen.\n\n### Configure your project for scenes\n\nYou provide the system with scene configurations to specify the information it uses to create scenes for your app and indicate the types of scenes your app supports.\n\nBy default, Xcode preconfigures new projects to use scenes with the [doc:\/\/com.apple.uikit\/documentation\/UIKit\/UISceneSession\/Role-swift.struct\/windowApplication] role. iPad models with the M1 chip can present interactive content on the connected screen through this type of scene, when using Stage Manager, an external keyboard, and a pointing device.\n\nTo use the connected display to present noninteractive content that supplements the interactive content your app presents on the built-in screen, provide a new configuration for the [doc:\/\/com.apple.uikit\/documentation\/UIKit\/UISceneSession\/Role-swift.struct\/windowExternalDisplayNonInteractive] role. When an external display connects, the system provides an additional scene for your app to add the noninteractive content to. For example, a game might show its content on a connected display and show game controls on the built-in screen.\n\n\n\nFor more information, see [doc:\/\/com.apple.uikit\/documentation\/UIKit\/specifying-the-scenes-your-app-supports].\n\n### Attach a window to a scene\n\nWhen a display connects to an iOS device, the system provides a scene for your app. Your app receives the scene through the [doc:\/\/com.apple.uikit\/documentation\/UIKit\/UISceneDelegate\/scene(_:willConnectTo:options:)] method on your scene delegate. You can use the method and the session object it provides to configure and attach a window to the scene. The system displays the window you provide on the window scene’s current screen.\n\nThis example configures a window to render on a scene’s display.\n\n```swift\nfunc scene(_ scene: UIScene, willConnectTo session: UISceneSession, options connectionOptions: UIScene.ConnectionOptions) {\n    guard let windowScene = (scene as? UIWindowScene) else { return }\n\n    if session.role == .windowApplication {\n        let window = UIWindow(windowScene: windowScene)\n        window.rootViewController = ViewController()\n        self.window = window\n        window.makeKeyAndVisible()\n    }\n}\n```\n\nWhen using a storyboard, the system initializes and attaches a window to the scene for you.\n\nIn addition to calling this method, UIKit also posts the [doc:\/\/com.apple.uikit\/documentation\/UIKit\/UIScene\/willConnectNotification] notification.\n\n### Handle disconnection\n\nWhen the system disconnects a scene from your app, which may occur if a user disconnects the display, your app receives a call through the [doc:\/\/com.apple.uikit\/documentation\/UIKit\/UISceneDelegate\/sceneDidDisconnect(_:)] method on the scene’s delegate. Use this method to perform any final cleanup and update the content other scenes present, when necessary.\n\nUIKit also posts the [doc:\/\/com.apple.uikit\/documentation\/UIKit\/UIScene\/didDisconnectNotification] notification in addition to calling this method.\n\n### Handle transitions to and from connected displays\n\nScenes may appear on different displays during their lifetime. If you use information from a [doc:\/\/com.apple.uikit\/documentation\/UIKit\/UIScreen] object, obtain it contextually using a windows scene’s [doc:\/\/com.apple.uikit\/documentation\/UIKit\/UIWindowScene\/screen] property.\n\nUse the scene delegate’s [doc:\/\/com.apple.uikit\/documentation\/UIKit\/UIWindowSceneDelegate\/windowScene(_:didUpdate:interfaceOrientation:traitCollection:)] method if your app needs to know when a scene is changing screens.\n\nThis examples uses a display link and updates the link when the scene changes screens.\n\n```swift\nclass ExternalDisplaySceneDelegate: UIResponder, UIWindowSceneDelegate {\n    var window: UIWindow?\n    var screen: UIScreen?\n\n    func scene(_ scene: UIScene, willConnectTo session: UISceneSession, options connectionOptions: UIScene.ConnectionOptions) {\n        guard let windowScene = (scene as? UIWindowScene) else { return }\n\n        if session.role == .windowExternalDisplayNonInteractive {\n            let window = UIWindow(windowScene: windowScene)\n            window.rootViewController = ExternalDisplayViewController()\n            self.window = window\n            window.makeKeyAndVisible()\n            ...\n            setupDisplayLinkIfNecessary()\n        }\n    }\n\n    func windowScene(_ windowScene: UIWindowScene, didUpdate previousCoordinateSpace: UICoordinateSpace, interfaceOrientation previousInterfaceOrientation: UIInterfaceOrientation, traitCollection previousTraitCollection: UITraitCollection) {\n        setupDisplayLinkIfNecessary()\n    }\n\n    weak var linkedScreen: UIScreen?\n\n    func setupDisplayLinkIfNecessary() {\n        let currentScreen = self.screen\n        if currentScreen != linkedScreen {\n            \/\/ Set up display link\n            ...\n            self.linkedScreen = currentScreen\n        }\n    }\n\n    ...\n}\n```\n\n### Change the screen mode of an external display\n\nMany displays support multiple resolutions, some of which use different pixel aspect ratios. Screen objects use the most common screen mode by default, but they support changing that mode when they display content for a scene with the [doc:\/\/com.apple.uikit\/documentation\/UIKit\/UISceneSession\/Role-swift.struct\/windowExternalDisplayNonInteractive] role. For example, if you’re implementing a game using textures for a 640 x 480 pixel screen, you might change the screen mode for screens with higher default resolutions. Don’t attempt to change the mode of a screen for a scene with the [doc:\/\/com.apple.uikit\/documentation\/UIKit\/UISceneSession\/Role-swift.struct\/windowApplication] role.\n\nIf you plan to use a screen mode other than the default one, apply that mode to the [doc:\/\/com.apple.uikit\/documentation\/UIKit\/UIScreen] object before associating the screen with a window. The [doc:\/\/com.apple.uikit\/documentation\/UIKit\/UIScreenMode] class defines the attributes of a single screen mode. You can get a list of the modes supported by a screen from its [doc:\/\/com.apple.uikit\/documentation\/UIKit\/UIScreen\/availableModes] property and then iterate through the list for one that matches your needs.\n\nFor more information about screen modes, see [doc:\/\/com.apple.uikit\/documentation\/UIKit\/UIScreenMode].\n\n## Related Documentation\n\n- **Multitasking on iPad, Mac, and Apple Vision Pro**: Implement multitasking APIs to seamlessly integrate your app with iPadOS, macOS, and visionOS.\n- **Managing your app’s life cycle**: Respond to system notifications when your app is in the foreground or background, and handle other significant system-related events.\n- **Building a desktop-class iPad app**: Optimize your iPad app’s user experience by adopting desktop-class enhancements for multitasking with Stage Manager, document interactions, text editing, search, and more.\n\n## Screens\n\n- **UIScreen**: An object that defines the properties associated with a hardware-based display.\n- **UIScreenMode**: A possible set of attributes that can apply to a screen object.\n\n",
  "sections" : [
    {
      "content" : "",
      "items" : [
        {
          "description" : "Implement multitasking APIs to seamlessly integrate your app with iPadOS, macOS, and visionOS.",
          "name" : "Multitasking on iPad, Mac, and Apple Vision Pro",
          "url" : "https:\/\/developer.apple.com\/documentation\/UIKit\/multitasking-on-ipad-mac-and-apple-vision-pro"
        },
        {
          "description" : "Respond to system notifications when your app is in the foreground or background, and handle other significant system-related events.",
          "name" : "Managing your app’s life cycle",
          "url" : "https:\/\/developer.apple.com\/documentation\/UIKit\/managing-your-app-s-life-cycle"
        },
        {
          "description" : "Optimize your iPad app’s user experience by adopting desktop-class enhancements for multitasking with Stage Manager, document interactions, text editing, search, and more.",
          "name" : "Building a desktop-class iPad app",
          "url" : "https:\/\/developer.apple.com\/documentation\/UIKit\/building-a-desktop-class-ipad-app"
        }
      ],
      "title" : "Related Documentation"
    },
    {
      "content" : "",
      "items" : [
        {
          "description" : "An object that defines the properties associated with a hardware-based display.",
          "name" : "UIScreen",
          "url" : "https:\/\/developer.apple.com\/documentation\/UIKit\/UIScreen"
        },
        {
          "description" : "A possible set of attributes that can apply to a screen object.",
          "name" : "UIScreenMode",
          "url" : "https:\/\/developer.apple.com\/documentation\/UIKit\/UIScreenMode"
        }
      ],
      "title" : "Screens"
    }
  ],
  "source" : "appleJSON",
  "title" : "Presenting content on a connected display",
  "url" : "https:\/\/developer.apple.com\/documentation\/UIKit\/presenting-content-on-a-connected-display"
}