{
  "abstract" : "Changes the default title of the delete-confirmation button.",
  "codeExamples" : [

  ],
  "contentHash" : "92921a1904540febf3c3c9c8b35aaf76a7c5b61ae1eb49b0eaf7f69d8eb49820",
  "crawledAt" : "2025-12-05T05:19:09Z",
  "declaration" : {
    "code" : "@MainActor optional func tableView(_ tableView: UITableView, titleForDeleteConfirmationButtonForRowAt indexPath: IndexPath) -> String?",
    "language" : "swift"
  },
  "id" : "CAC1825D-C78A-4AEF-BE46-DAF046E67F98",
  "kind" : "method",
  "language" : "swift",
  "module" : "UIKit",
  "overview" : "## Return Value\n\nA localized string to used as the title of the delete-confirmation button.\n\n## Discussion\n\nBy default, the delete-confirmation button, which appears on the right side of the cell, has the title of “Delete”. The table view displays this button when the user attempts to delete a row, either by swiping the row or tapping the red minus icon in editing mode. You can implement this method to return an alternative title, which should be localized.",
  "platforms" : [
    "iOS",
    "iPadOS",
    "Mac Catalyst",
    "visionOS"
  ],
  "rawMarkdown" : "---\nsource: https:\/\/developer.apple.com\/documentation\/UIKit\/UITableViewDelegate\/tableView(_:titleForDeleteConfirmationButtonForRowAt:)\ncrawled: 2025-12-05T05:19:09Z\n---\n\n# tableView(_:titleForDeleteConfirmationButtonForRowAt:)\n\n**Instance Method**\n\nChanges the default title of the delete-confirmation button.\n\n## Declaration\n\n```swift\n@MainActor optional func tableView(_ tableView: UITableView, titleForDeleteConfirmationButtonForRowAt indexPath: IndexPath) -> String?\n```\n\n## Parameters\n\n- **tableView**: The table view requesting this information.\n- **indexPath**: An index path locating the row in its section.\n\n## Return Value\n\nA localized string to used as the title of the delete-confirmation button.\n\n## Discussion\n\nBy default, the delete-confirmation button, which appears on the right side of the cell, has the title of “Delete”. The table view displays this button when the user attempts to delete a row, either by swiping the row or tapping the red minus icon in editing mode. You can implement this method to return an alternative title, which should be localized.\n\n## Editing table rows\n\n- **tableView(_:willBeginEditingRowAt:)**: Tells the delegate that the table view is about to go into editing mode.\n- **tableView(_:didEndEditingRowAt:)**: Tells the delegate that the table view has left editing mode.\n- **tableView(_:editingStyleForRowAt:)**: Asks the delegate for the editing style of a row at a particular location in a table view.\n- **tableView(_:shouldIndentWhileEditingRowAt:)**: Asks the delegate whether the background of the specified row should be indented while the table view is in editing mode.\n\n",
  "sections" : [
    {
      "content" : "",
      "items" : [
        {
          "description" : "Tells the delegate that the table view is about to go into editing mode.",
          "name" : "tableView(_:willBeginEditingRowAt:)",
          "url" : "https:\/\/developer.apple.com\/documentation\/UIKit\/UITableViewDelegate\/tableView(_:willBeginEditingRowAt:)"
        },
        {
          "description" : "Tells the delegate that the table view has left editing mode.",
          "name" : "tableView(_:didEndEditingRowAt:)",
          "url" : "https:\/\/developer.apple.com\/documentation\/UIKit\/UITableViewDelegate\/tableView(_:didEndEditingRowAt:)"
        },
        {
          "description" : "Asks the delegate for the editing style of a row at a particular location in a table view.",
          "name" : "tableView(_:editingStyleForRowAt:)",
          "url" : "https:\/\/developer.apple.com\/documentation\/UIKit\/UITableViewDelegate\/tableView(_:editingStyleForRowAt:)"
        },
        {
          "description" : "Asks the delegate whether the background of the specified row should be indented while the table view is in editing mode.",
          "name" : "tableView(_:shouldIndentWhileEditingRowAt:)",
          "url" : "https:\/\/developer.apple.com\/documentation\/UIKit\/UITableViewDelegate\/tableView(_:shouldIndentWhileEditingRowAt:)"
        }
      ],
      "title" : "Editing table rows"
    }
  ],
  "source" : "appleJSON",
  "title" : "tableView(_:titleForDeleteConfirmationButtonForRowAt:)",
  "url" : "https:\/\/developer.apple.com\/documentation\/UIKit\/UITableViewDelegate\/tableView(_:titleForDeleteConfirmationButtonForRowAt:)"
}