{
  "abstract" : "The appearance settings for a standard-height toolbar when the edge of scrollable content aligns with the edge of the toolbar.",
  "codeExamples" : [

  ],
  "contentHash" : "c459a13c39cad7a2b5a959000ac636f7377cd780ab84106845303d1cb8495143",
  "crawledAt" : "2025-12-03T18:55:33Z",
  "declaration" : {
    "code" : "@NSCopying @MainActor var scrollEdgeAppearance: UIToolbarAppearance? { get set }",
    "language" : "swift"
  },
  "id" : "E2CEB881-8CE5-46B4-B381-F6A77566FA6D",
  "kind" : "property",
  "language" : "swift",
  "module" : "UIKit",
  "overview" : "## Discussion\n\nWhen a navigation controller contains a toolbar and a scroll view, part of the scroll view’s content appears underneath the toolbar. If the edge of the scrolled content reaches the toolbar, UIKit applies the appearance settings in this property.\n\nThis property applies to standard-height toolbars. If the value of this property is `nil`, UIKit uses the value of the [doc:\/\/com.apple.uikit\/documentation\/UIKit\/UIToolbar\/standardAppearance] property, modified to have a transparent background. If no navigation controller manages your toolbar, UIKit ignores this property and uses the tool bar’s standard appearance.",
  "platforms" : [
    "iOS",
    "iPadOS",
    "Mac Catalyst",
    "visionOS"
  ],
  "rawMarkdown" : "---\nsource: https:\/\/developer.apple.com\/documentation\/UIKit\/UIToolbar\/scrollEdgeAppearance\ncrawled: 2025-12-03T18:55:33Z\n---\n\n# scrollEdgeAppearance\n\n**Instance Property**\n\nThe appearance settings for a standard-height toolbar when the edge of scrollable content aligns with the edge of the toolbar.\n\n## Declaration\n\n```swift\n@NSCopying @MainActor var scrollEdgeAppearance: UIToolbarAppearance? { get set }\n```\n\n## Discussion\n\nWhen a navigation controller contains a toolbar and a scroll view, part of the scroll view’s content appears underneath the toolbar. If the edge of the scrolled content reaches the toolbar, UIKit applies the appearance settings in this property.\n\nThis property applies to standard-height toolbars. If the value of this property is `nil`, UIKit uses the value of the [doc:\/\/com.apple.uikit\/documentation\/UIKit\/UIToolbar\/standardAppearance] property, modified to have a transparent background. If no navigation controller manages your toolbar, UIKit ignores this property and uses the tool bar’s standard appearance.\n\n## Customizing appearance\n\n- **standardAppearance**: The appearance settings to use for a standard-height toolbar.\n- **compactAppearance**: The appearance settings to use for a compact-height toolbar.\n- **compactScrollEdgeAppearance**: The appearance settings for a compact-height toolbar when the edge of any scrollable content aligns with the edge of a compact-height toolbar.\n- **isTranslucent**: A Boolean value that indicates whether the toolbar is translucent.\n- **Legacy customizations**: Customize appearance information directly on the toolbar object.\n\n",
  "sections" : [
    {
      "content" : "",
      "items" : [
        {
          "description" : "The appearance settings to use for a standard-height toolbar.",
          "name" : "standardAppearance",
          "url" : "https:\/\/developer.apple.com\/documentation\/UIKit\/UIToolbar\/standardAppearance"
        },
        {
          "description" : "The appearance settings to use for a compact-height toolbar.",
          "name" : "compactAppearance",
          "url" : "https:\/\/developer.apple.com\/documentation\/UIKit\/UIToolbar\/compactAppearance"
        },
        {
          "description" : "The appearance settings for a compact-height toolbar when the edge of any scrollable content aligns with the edge of a compact-height toolbar.",
          "name" : "compactScrollEdgeAppearance",
          "url" : "https:\/\/developer.apple.com\/documentation\/UIKit\/UIToolbar\/compactScrollEdgeAppearance"
        },
        {
          "description" : "A Boolean value that indicates whether the toolbar is translucent.",
          "name" : "isTranslucent",
          "url" : "https:\/\/developer.apple.com\/documentation\/UIKit\/UIToolbar\/isTranslucent"
        },
        {
          "description" : "Customize appearance information directly on the toolbar object.",
          "name" : "Legacy customizations",
          "url" : "https:\/\/developer.apple.com\/documentation\/UIKit\/uitoolbar-legacy-customizations"
        }
      ],
      "title" : "Customizing appearance"
    }
  ],
  "source" : "appleJSON",
  "title" : "scrollEdgeAppearance",
  "url" : "https:\/\/developer.apple.com\/documentation\/UIKit\/UIToolbar\/scrollEdgeAppearance"
}