{
  "abstract" : "The bounding rectangle of the text in the middle of the drag preview.",
  "codeExamples" : [

  ],
  "contentHash" : "3e95a1398d96a4b6c6b8ebcad6a7feb2faffbfd39fc99b5c418ebbb6ae872efd",
  "crawledAt" : "2025-12-05T21:15:21Z",
  "declaration" : {
    "code" : "@MainActor var bodyRect: CGRect { get }",
    "language" : "swift"
  },
  "id" : "409DB1DF-CFEB-4F8D-89BA-8283137D3255",
  "kind" : "property",
  "language" : "swift",
  "module" : "UIKit",
  "overview" : "## Discussion\n\nThe body rectangle contains the full lines of text in the middle of the drag preview that doesn’t include the first line and last line. This property can be a zero rectangle. The initial value is also not calculated until the first time it’s used.",
  "platforms" : [
    "iOS",
    "iPadOS",
    "Mac Catalyst",
    "visionOS"
  ],
  "rawMarkdown" : "---\nsource: https:\/\/developer.apple.com\/documentation\/UIKit\/UITextDragPreviewRenderer\/bodyRect\ncrawled: 2025-12-05T21:15:21Z\n---\n\n# bodyRect\n\n**Instance Property**\n\nThe bounding rectangle of the text in the middle of the drag preview.\n\n## Declaration\n\n```swift\n@MainActor var bodyRect: CGRect { get }\n```\n\n## Discussion\n\nThe body rectangle contains the full lines of text in the middle of the drag preview that doesn’t include the first line and last line. This property can be a zero rectangle. The initial value is also not calculated until the first time it’s used.\n\n## Getting and setting bounding rectangles\n\n- **firstLineRect**: The bounding rectangle of the first line of text in the drag preview.\n- **lastLineRect**: The bounding rectangle of the last line of text in the drag preview.\n- **adjust(firstLineRect:bodyRect:lastLineRect:textOrigin:)**: Adjusts the size and origin of the bounding rectangles during a text drag operation.\n\n",
  "sections" : [
    {
      "content" : "",
      "items" : [
        {
          "description" : "The bounding rectangle of the first line of text in the drag preview.",
          "name" : "firstLineRect",
          "url" : "https:\/\/developer.apple.com\/documentation\/UIKit\/UITextDragPreviewRenderer\/firstLineRect"
        },
        {
          "description" : "The bounding rectangle of the last line of text in the drag preview.",
          "name" : "lastLineRect",
          "url" : "https:\/\/developer.apple.com\/documentation\/UIKit\/UITextDragPreviewRenderer\/lastLineRect"
        },
        {
          "description" : "Adjusts the size and origin of the bounding rectangles during a text drag operation.",
          "name" : "adjust(firstLineRect:bodyRect:lastLineRect:textOrigin:)",
          "url" : "https:\/\/developer.apple.com\/documentation\/UIKit\/UITextDragPreviewRenderer\/adjust(firstLineRect:bodyRect:lastLineRect:textOrigin:)"
        }
      ],
      "title" : "Getting and setting bounding rectangles"
    }
  ],
  "source" : "appleJSON",
  "title" : "bodyRect",
  "url" : "https:\/\/developer.apple.com\/documentation\/UIKit\/UITextDragPreviewRenderer\/bodyRect"
}