{
  "abstract" : "Constants that specify the animation of the status bar as it’s hidden or made visible.",
  "codeExamples" : [

  ],
  "conformsTo" : [
    "BitwiseCopyable",
    "Equatable",
    "Hashable",
    "RawRepresentable",
    "Sendable",
    "SendableMetatype"
  ],
  "contentHash" : "be8bb84f1991f769718f5e9b664dcdb18abde842a778deea2ce5ae8691556e16",
  "crawledAt" : "2025-12-03T05:49:51Z",
  "declaration" : {
    "code" : "enum UIStatusBarAnimation",
    "language" : "swift"
  },
  "id" : "292FD920-FCB2-4DC1-8512-465C01A2C50A",
  "kind" : "enum",
  "language" : "swift",
  "module" : "UIKit",
  "overview" : "## Overview\n\nConstants of the [doc:\/\/com.apple.uikit\/documentation\/UIKit\/UIStatusBarAnimation] type are arguments of the [doc:\/\/com.apple.uikit\/documentation\/UIKit\/UIApplication\/setStatusBarHidden(_:with:)] method.",
  "platforms" : [
    "iOS",
    "iPadOS",
    "Mac Catalyst",
    "visionOS"
  ],
  "rawMarkdown" : "---\nsource: https:\/\/developer.apple.com\/documentation\/UIKit\/UIStatusBarAnimation\ncrawled: 2025-12-03T05:49:51Z\n---\n\n# UIStatusBarAnimation\n\n**Enumeration**\n\nConstants that specify the animation of the status bar as it’s hidden or made visible.\n\n## Declaration\n\n```swift\nenum UIStatusBarAnimation\n```\n\n## Overview\n\nConstants of the [doc:\/\/com.apple.uikit\/documentation\/UIKit\/UIStatusBarAnimation] type are arguments of the [doc:\/\/com.apple.uikit\/documentation\/UIKit\/UIApplication\/setStatusBarHidden(_:with:)] method.\n\n## Constants\n\n- **UIStatusBarAnimation.none**: No animation is applied to the status bar as it is shown or hidden.\n- **UIStatusBarAnimation.fade**: The status bar fades in and out as it is shown or hidden, respectively.\n- **UIStatusBarAnimation.slide**: The status bar slides in or out as it is shown or hidden, respectively.\n\n## Initializers\n\n- **init(rawValue:)**\n\n## Deprecated enumerations\n\n- **UIDirectionalRectEdge**: Constants that specify an edge or a set of edges, taking the user interface layout direction into account.\n\n## Conforms To\n\n- BitwiseCopyable\n- Equatable\n- Hashable\n- RawRepresentable\n- Sendable\n- SendableMetatype\n\n",
  "sections" : [
    {
      "content" : "",
      "items" : [
        {
          "description" : "No animation is applied to the status bar as it is shown or hidden.",
          "name" : "UIStatusBarAnimation.none",
          "url" : "https:\/\/developer.apple.com\/documentation\/UIKit\/UIStatusBarAnimation\/none"
        },
        {
          "description" : "The status bar fades in and out as it is shown or hidden, respectively.",
          "name" : "UIStatusBarAnimation.fade",
          "url" : "https:\/\/developer.apple.com\/documentation\/UIKit\/UIStatusBarAnimation\/fade"
        },
        {
          "description" : "The status bar slides in or out as it is shown or hidden, respectively.",
          "name" : "UIStatusBarAnimation.slide",
          "url" : "https:\/\/developer.apple.com\/documentation\/UIKit\/UIStatusBarAnimation\/slide"
        }
      ],
      "title" : "Constants"
    },
    {
      "content" : "",
      "items" : [
        {
          "description" : "",
          "name" : "init(rawValue:)",
          "url" : "https:\/\/developer.apple.com\/documentation\/UIKit\/UIStatusBarAnimation\/init(rawValue:)"
        }
      ],
      "title" : "Initializers"
    },
    {
      "content" : "",
      "items" : [
        {
          "description" : "Constants that specify an edge or a set of edges, taking the user interface layout direction into account.",
          "name" : "UIDirectionalRectEdge",
          "url" : "https:\/\/developer.apple.com\/documentation\/UIKit\/UIDirectionalRectEdge"
        }
      ],
      "title" : "Deprecated enumerations"
    }
  ],
  "source" : "appleJSON",
  "title" : "UIStatusBarAnimation",
  "url" : "https:\/\/developer.apple.com\/documentation\/UIKit\/UIStatusBarAnimation"
}