{
  "abstract" : "Returns the child view controller that is consulted about its preference for displaying a visual indicator for returning to the Home screen.",
  "codeExamples" : [

  ],
  "contentHash" : "c5df1b1ac577dc2644c9a945525a1082c5b34317292c6781a82f923d6019a16c",
  "crawledAt" : "2025-12-01T14:51:28Z",
  "declaration" : {
    "code" : "@MainActor var childForHomeIndicatorAutoHidden: UIViewController? { get }",
    "language" : "swift"
  },
  "id" : "098DD6CE-222D-4C66-85A4-D20FC0D8FEF9",
  "kind" : "property",
  "module" : "UIKit",
  "overview" : "## Return Value\n\nThe child view controller to consult. The default implementation of this method returns `nil`.\n\n## Discussion\n\nWhen implementing a container view controller, override this method if you want one your child view controllers to determine whether to display the visual indicator. If you do, the system calls the [doc:\/\/com.apple.uikit\/documentation\/UIKit\/UIViewController\/prefersHomeIndicatorAutoHidden] method of the returned view controller. If the method returns `nil`, the system calls the [doc:\/\/com.apple.uikit\/documentation\/UIKit\/UIViewController\/prefersHomeIndicatorAutoHidden] method of the current view controller.",
  "platforms" : [
    "iOS",
    "iPadOS",
    "Mac Catalyst",
    "visionOS"
  ],
  "rawMarkdown" : "---\nsource: https:\/\/developer.apple.com\/documentation\/UIKit\/UIViewController\/childForHomeIndicatorAutoHidden\ncrawled: 2025-12-01T14:51:28Z\n---\n\n# childForHomeIndicatorAutoHidden\n\n**Instance Property**\n\nReturns the child view controller that is consulted about its preference for displaying a visual indicator for returning to the Home screen.\n\n## Declaration\n\n```swift\n@MainActor var childForHomeIndicatorAutoHidden: UIViewController? { get }\n```\n\n## Return Value\n\nThe child view controller to consult. The default implementation of this method returns `nil`.\n\n## Discussion\n\nWhen implementing a container view controller, override this method if you want one your child view controllers to determine whether to display the visual indicator. If you do, the system calls the [doc:\/\/com.apple.uikit\/documentation\/UIKit\/UIViewController\/prefersHomeIndicatorAutoHidden] method of the returned view controller. If the method returns `nil`, the system calls the [doc:\/\/com.apple.uikit\/documentation\/UIKit\/UIViewController\/prefersHomeIndicatorAutoHidden] method of the current view controller.\n\n## Coordinating with system gestures\n\n- **preferredScreenEdgesDeferringSystemGestures**: The screen edges for which you want your gestures to take precedence over the system gestures.\n- **childForScreenEdgesDeferringSystemGestures**: Returns the child view controller that should be queried to see if its gestures should take precedence.\n- **setNeedsUpdateOfScreenEdgesDeferringSystemGestures()**: Notifies the system of changes to the screen edges that defer system gestures.\n- **prefersHomeIndicatorAutoHidden**: A Boolean that indicates whether the system is allowed to hide the visual indicator for returning to the Home Screen.\n- **setNeedsUpdateOfHomeIndicatorAutoHidden()**: Notifies UIKit that your view controller updated its preference regarding the visual indicator for returning to the Home screen.\n\n",
  "sections" : [
    {
      "content" : "",
      "items" : [
        {
          "description" : "The screen edges for which you want your gestures to take precedence over the system gestures.",
          "name" : "preferredScreenEdgesDeferringSystemGestures",
          "url" : "https:\/\/developer.apple.com\/documentation\/UIKit\/UIViewController\/preferredScreenEdgesDeferringSystemGestures"
        },
        {
          "description" : "Returns the child view controller that should be queried to see if its gestures should take precedence.",
          "name" : "childForScreenEdgesDeferringSystemGestures",
          "url" : "https:\/\/developer.apple.com\/documentation\/UIKit\/UIViewController\/childForScreenEdgesDeferringSystemGestures"
        },
        {
          "description" : "Notifies the system of changes to the screen edges that defer system gestures.",
          "name" : "setNeedsUpdateOfScreenEdgesDeferringSystemGestures()",
          "url" : "https:\/\/developer.apple.com\/documentation\/UIKit\/UIViewController\/setNeedsUpdateOfScreenEdgesDeferringSystemGestures()"
        },
        {
          "description" : "A Boolean that indicates whether the system is allowed to hide the visual indicator for returning to the Home Screen.",
          "name" : "prefersHomeIndicatorAutoHidden",
          "url" : "https:\/\/developer.apple.com\/documentation\/UIKit\/UIViewController\/prefersHomeIndicatorAutoHidden"
        },
        {
          "description" : "Notifies UIKit that your view controller updated its preference regarding the visual indicator for returning to the Home screen.",
          "name" : "setNeedsUpdateOfHomeIndicatorAutoHidden()",
          "url" : "https:\/\/developer.apple.com\/documentation\/UIKit\/UIViewController\/setNeedsUpdateOfHomeIndicatorAutoHidden()"
        }
      ],
      "title" : "Coordinating with system gestures"
    }
  ],
  "source" : "appleJSON",
  "title" : "childForHomeIndicatorAutoHidden",
  "url" : "https:\/\/developer.apple.com\/documentation\/UIKit\/UIViewController\/childForHomeIndicatorAutoHidden"
}