{
  "abstract" : "The appearance settings for a standard-height navigation bar.",
  "codeExamples" : [

  ],
  "contentHash" : "cbd51ffb32e68629d2c3c664553ead38b4badecc27d8f83d0e3b5afef65e16dc",
  "crawledAt" : "2025-12-03T18:41:30Z",
  "declaration" : {
    "code" : "@NSCopying @MainActor var standardAppearance: UINavigationBarAppearance { get set }",
    "language" : "swift"
  },
  "id" : "B1CDF82C-8A36-4709-A77D-94DD5E071A9D",
  "kind" : "property",
  "language" : "swift",
  "module" : "UIKit",
  "overview" : "## Discussion\n\nThe default value of this property is an appearance object containing the system’s default appearance settings. You can customize the navigation bar appearance for specific navigation items with the [doc:\/\/com.apple.uikit\/documentation\/UIKit\/UINavigationItem\/standardAppearance] property of [doc:\/\/com.apple.uikit\/documentation\/UIKit\/UINavigationItem].",
  "platforms" : [
    "iOS",
    "iPadOS",
    "Mac Catalyst",
    "tvOS",
    "visionOS"
  ],
  "rawMarkdown" : "---\nsource: https:\/\/developer.apple.com\/documentation\/UIKit\/UINavigationBar\/standardAppearance\ncrawled: 2025-12-03T18:41:30Z\n---\n\n# standardAppearance\n\n**Instance Property**\n\nThe appearance settings for a standard-height navigation bar.\n\n## Declaration\n\n```swift\n@NSCopying @MainActor var standardAppearance: UINavigationBarAppearance { get set }\n```\n\n## Discussion\n\nThe default value of this property is an appearance object containing the system’s default appearance settings. You can customize the navigation bar appearance for specific navigation items with the [doc:\/\/com.apple.uikit\/documentation\/UIKit\/UINavigationItem\/standardAppearance] property of [doc:\/\/com.apple.uikit\/documentation\/UIKit\/UINavigationItem].\n\n## Customizing the bar’s appearance\n\n- **prefersLargeTitles**: A Boolean value that indicates whether the title displays in a large format.\n- **compactAppearance**: The appearance settings for a compact-height navigation bar.\n- **scrollEdgeAppearance**: The appearance settings for the navigation bar when the edge of scrollable content aligns with the edge of the navigation bar.\n- **compactScrollEdgeAppearance**: The appearance settings for a compact-height navigation bar when the edge of scrollable content aligns with the edge of the navigation bar.\n- **isTranslucent**: A Boolean value that indicates whether the navigation bar is translucent.\n- **Legacy customizations**: Customize appearance information directly on the navigation bar object.\n\n",
  "sections" : [
    {
      "content" : "",
      "items" : [
        {
          "description" : "A Boolean value that indicates whether the title displays in a large format.",
          "name" : "prefersLargeTitles",
          "url" : "https:\/\/developer.apple.com\/documentation\/UIKit\/UINavigationBar\/prefersLargeTitles"
        },
        {
          "description" : "The appearance settings for a compact-height navigation bar.",
          "name" : "compactAppearance",
          "url" : "https:\/\/developer.apple.com\/documentation\/UIKit\/UINavigationBar\/compactAppearance"
        },
        {
          "description" : "The appearance settings for the navigation bar when the edge of scrollable content aligns with the edge of the navigation bar.",
          "name" : "scrollEdgeAppearance",
          "url" : "https:\/\/developer.apple.com\/documentation\/UIKit\/UINavigationBar\/scrollEdgeAppearance"
        },
        {
          "description" : "The appearance settings for a compact-height navigation bar when the edge of scrollable content aligns with the edge of the navigation bar.",
          "name" : "compactScrollEdgeAppearance",
          "url" : "https:\/\/developer.apple.com\/documentation\/UIKit\/UINavigationBar\/compactScrollEdgeAppearance"
        },
        {
          "description" : "A Boolean value that indicates whether the navigation bar is translucent.",
          "name" : "isTranslucent",
          "url" : "https:\/\/developer.apple.com\/documentation\/UIKit\/UINavigationBar\/isTranslucent"
        },
        {
          "description" : "Customize appearance information directly on the navigation bar object.",
          "name" : "Legacy customizations",
          "url" : "https:\/\/developer.apple.com\/documentation\/UIKit\/uinavigationbar-legacy-customizations"
        }
      ],
      "title" : "Customizing the bar’s appearance"
    }
  ],
  "source" : "appleJSON",
  "title" : "standardAppearance",
  "url" : "https:\/\/developer.apple.com\/documentation\/UIKit\/UINavigationBar\/standardAppearance"
}