{
  "abstract" : "Tells the delegate that a focus update occurred.",
  "codeExamples" : [

  ],
  "contentHash" : "0cf02d96fc91826dd831c6337ca225310766f7cb51808d39e001d37be6795f9d",
  "crawledAt" : "2025-12-05T05:19:51Z",
  "declaration" : {
    "code" : "@MainActor optional func collectionView(_ collectionView: UICollectionView, didUpdateFocusIn context: UICollectionViewFocusUpdateContext, with coordinator: UIFocusAnimationCoordinator)",
    "language" : "swift"
  },
  "id" : "08C774C1-6BB8-4DB9-8E02-7040BCD262BD",
  "kind" : "method",
  "language" : "swift",
  "module" : "UIKit",
  "overview" : "## Discussion\n\nThe collection view calls this method when a focus-related change occurs. You can use this method to update your app’s state information or to animate changes to your app’s visual appearance.\n\nIf you subclass [doc:\/\/com.apple.uikit\/documentation\/UIKit\/UICollectionView], you can also implement the same behavior by overriding the [doc:\/\/com.apple.uikit\/documentation\/UIKit\/UIFocusEnvironment\/didUpdateFocus(in:with:)] method, which is defined by the [doc:\/\/com.apple.uikit\/documentation\/UIKit\/UIFocusEnvironment] protocol and adopted by all views.",
  "platforms" : [
    "iOS",
    "iPadOS",
    "Mac Catalyst",
    "tvOS",
    "visionOS"
  ],
  "rawMarkdown" : "---\nsource: https:\/\/developer.apple.com\/documentation\/UIKit\/UICollectionViewDelegate\/collectionView(_:didUpdateFocusIn:with:)\ncrawled: 2025-12-05T05:19:51Z\n---\n\n# collectionView(_:didUpdateFocusIn:with:)\n\n**Instance Method**\n\nTells the delegate that a focus update occurred.\n\n## Declaration\n\n```swift\n@MainActor optional func collectionView(_ collectionView: UICollectionView, didUpdateFocusIn context: UICollectionViewFocusUpdateContext, with coordinator: UIFocusAnimationCoordinator)\n```\n\n## Parameters\n\n- **collectionView**: The collection view object notifying you of the focus change.\n- **context**: The context object containing metadata associated with the focus change. This object contains the index path of the previously focused item and the currently focused item.\n- **coordinator**: The animation coordinator to use when creating any additional animations.\n\n## Discussion\n\nThe collection view calls this method when a focus-related change occurs. You can use this method to update your app’s state information or to animate changes to your app’s visual appearance.\n\nIf you subclass [doc:\/\/com.apple.uikit\/documentation\/UIKit\/UICollectionView], you can also implement the same behavior by overriding the [doc:\/\/com.apple.uikit\/documentation\/UIKit\/UIFocusEnvironment\/didUpdateFocus(in:with:)] method, which is defined by the [doc:\/\/com.apple.uikit\/documentation\/UIKit\/UIFocusEnvironment] protocol and adopted by all views.\n\n## Related Documentation\n\n- **didUpdateFocus(in:with:)**: Called immediately after the system updates the focus to a new view.\n\n## Working with focus\n\n- **collectionView(_:canFocusItemAt:)**: Asks the delegate whether the item at the specified index path can be focused.\n- **indexPathForPreferredFocusedView(in:)**: Asks the delegate for the index path of the cell that should be focused.\n- **collectionView(_:shouldUpdateFocusIn:)**: Asks the delegate whether a change in focus should occur.\n- **collectionView(_:selectionFollowsFocusForItemAt:)**: Asks the delegate whether to relate selection and focus behavior for the cell at the corresponding index path.\n\n",
  "sections" : [
    {
      "content" : "",
      "items" : [
        {
          "description" : "Called immediately after the system updates the focus to a new view.",
          "name" : "didUpdateFocus(in:with:)",
          "url" : "https:\/\/developer.apple.com\/documentation\/UIKit\/UIFocusEnvironment\/didUpdateFocus(in:with:)"
        }
      ],
      "title" : "Related Documentation"
    },
    {
      "content" : "",
      "items" : [
        {
          "description" : "Asks the delegate whether the item at the specified index path can be focused.",
          "name" : "collectionView(_:canFocusItemAt:)",
          "url" : "https:\/\/developer.apple.com\/documentation\/UIKit\/UICollectionViewDelegate\/collectionView(_:canFocusItemAt:)"
        },
        {
          "description" : "Asks the delegate for the index path of the cell that should be focused.",
          "name" : "indexPathForPreferredFocusedView(in:)",
          "url" : "https:\/\/developer.apple.com\/documentation\/UIKit\/UICollectionViewDelegate\/indexPathForPreferredFocusedView(in:)"
        },
        {
          "description" : "Asks the delegate whether a change in focus should occur.",
          "name" : "collectionView(_:shouldUpdateFocusIn:)",
          "url" : "https:\/\/developer.apple.com\/documentation\/UIKit\/UICollectionViewDelegate\/collectionView(_:shouldUpdateFocusIn:)"
        },
        {
          "description" : "Asks the delegate whether to relate selection and focus behavior for the cell at the corresponding index path.",
          "name" : "collectionView(_:selectionFollowsFocusForItemAt:)",
          "url" : "https:\/\/developer.apple.com\/documentation\/UIKit\/UICollectionViewDelegate\/collectionView(_:selectionFollowsFocusForItemAt:)"
        }
      ],
      "title" : "Working with focus"
    }
  ],
  "source" : "appleJSON",
  "title" : "collectionView(_:didUpdateFocusIn:with:)",
  "url" : "https:\/\/developer.apple.com\/documentation\/UIKit\/UICollectionViewDelegate\/collectionView(_:didUpdateFocusIn:with:)"
}