{
  "abstract" : "An encapsulation of information about a selected range of text in a document.",
  "codeExamples" : [

  ],
  "conformsTo" : [
    "CVarArg",
    "CustomDebugStringConvertible",
    "CustomStringConvertible",
    "Equatable",
    "Hashable",
    "NSObjectProtocol",
    "Sendable"
  ],
  "contentHash" : "de9ece2fc2087ef646226a96ee27b22def58e2ed868542d820244b4fe7607fc2",
  "crawledAt" : "2025-12-01T10:38:04Z",
  "declaration" : {
    "code" : "@MainActor class UITextSelectionRect",
    "language" : "swift"
  },
  "id" : "FD4B8A8E-8DE3-48E1-81B3-94BE3D64A7A8",
  "kind" : "class",
  "module" : "UIKit",
  "overview" : "## Overview\n\nThis class is an abstract class and must be subclassed to be used. The system text input views provide their own concrete implementations of this class.\n\n### Subclassing Notes\n\nIf you are implementing a custom text input view, you can subclass and use your custom class to return selection-related information. When subclassing, you should override and reimplement all properties. In your custom implementations, do not call `super`.",
  "platforms" : [
    "iOS",
    "iPadOS",
    "Mac Catalyst",
    "tvOS",
    "visionOS"
  ],
  "rawMarkdown" : "---\nsource: https:\/\/developer.apple.com\/documentation\/UIKit\/UITextSelectionRect\ncrawled: 2025-12-01T10:38:04Z\n---\n\n# UITextSelectionRect\n\n**Class**\n\nAn encapsulation of information about a selected range of text in a document.\n\n## Declaration\n\n```swift\n@MainActor class UITextSelectionRect\n```\n\n## Overview\n\nThis class is an abstract class and must be subclassed to be used. The system text input views provide their own concrete implementations of this class.\n\n### Subclassing Notes\n\nIf you are implementing a custom text input view, you can subclass and use your custom class to return selection-related information. When subclassing, you should override and reimplement all properties. In your custom implementations, do not call `super`.\n\n## Accessing the Selection Rectangle\n\n- **rect**: The rectangle that encloses the text selection rectangle’s text range.\n\n## Accessing Text-Related Attributes\n\n- **writingDirection**: The writing direction of text in the text selection rectangle’s text range.\n- **isVertical**: A Boolean value that indicates whether the text is vertical.\n\n## Determining the Selection Status\n\n- **containsStart**: A Boolean value that indicates whether the rectangle contains the start of the selection.\n- **containsEnd**: A Boolean value that indicates whether the rectangle contains the end of the selection.\n\n## Instance Properties\n\n- **transform**\n\n## Metrics\n\n- **UITextPosition**: A position in a text container—that is, an index into the backing string in a text-display view.\n- **UITextRange**: A range of characters in a text container with a starting index and an ending index in string backing a text-entry object.\n\n## Inherits From\n\n- NSObject\n\n## Conforms To\n\n- CVarArg\n- CustomDebugStringConvertible\n- CustomStringConvertible\n- Equatable\n- Hashable\n- NSObjectProtocol\n- Sendable\n\n",
  "sections" : [
    {
      "content" : "",
      "items" : [
        {
          "description" : "The rectangle that encloses the text selection rectangle’s text range.",
          "name" : "rect",
          "url" : "https:\/\/developer.apple.com\/documentation\/UIKit\/UITextSelectionRect\/rect"
        }
      ],
      "title" : "Accessing the Selection Rectangle"
    },
    {
      "content" : "",
      "items" : [
        {
          "description" : "The writing direction of text in the text selection rectangle’s text range.",
          "name" : "writingDirection",
          "url" : "https:\/\/developer.apple.com\/documentation\/UIKit\/UITextSelectionRect\/writingDirection"
        },
        {
          "description" : "A Boolean value that indicates whether the text is vertical.",
          "name" : "isVertical",
          "url" : "https:\/\/developer.apple.com\/documentation\/UIKit\/UITextSelectionRect\/isVertical"
        }
      ],
      "title" : "Accessing Text-Related Attributes"
    },
    {
      "content" : "",
      "items" : [
        {
          "description" : "A Boolean value that indicates whether the rectangle contains the start of the selection.",
          "name" : "containsStart",
          "url" : "https:\/\/developer.apple.com\/documentation\/UIKit\/UITextSelectionRect\/containsStart"
        },
        {
          "description" : "A Boolean value that indicates whether the rectangle contains the end of the selection.",
          "name" : "containsEnd",
          "url" : "https:\/\/developer.apple.com\/documentation\/UIKit\/UITextSelectionRect\/containsEnd"
        }
      ],
      "title" : "Determining the Selection Status"
    },
    {
      "content" : "",
      "items" : [
        {
          "description" : "",
          "name" : "transform",
          "url" : "https:\/\/developer.apple.com\/documentation\/UIKit\/UITextSelectionRect\/transform"
        }
      ],
      "title" : "Instance Properties"
    },
    {
      "content" : "",
      "items" : [
        {
          "description" : "A position in a text container—that is, an index into the backing string in a text-display view.",
          "name" : "UITextPosition",
          "url" : "https:\/\/developer.apple.com\/documentation\/UIKit\/UITextPosition"
        },
        {
          "description" : "A range of characters in a text container with a starting index and an ending index in string backing a text-entry object.",
          "name" : "UITextRange",
          "url" : "https:\/\/developer.apple.com\/documentation\/UIKit\/UITextRange"
        }
      ],
      "title" : "Metrics"
    },
    {
      "content" : "",
      "items" : [
        {
          "name" : "NSObject"
        }
      ],
      "title" : "Inherits From"
    }
  ],
  "source" : "appleJSON",
  "title" : "UITextSelectionRect",
  "url" : "https:\/\/developer.apple.com\/documentation\/UIKit\/UITextSelectionRect"
}