{
  "abstract" : "A set of methods that support the positioning of a bar that conforms to the [doc:\/\/com.apple.uikit\/documentation\/UIKit\/UIBarPositioning] protocol.",
  "codeExamples" : [

  ],
  "contentHash" : "34bd83db763901944d27549b9ea85f235df20fa8acb39e5c1ec89c331e7fc2cd",
  "crawledAt" : "2025-12-03T05:28:12Z",
  "declaration" : {
    "code" : "@MainActor protocol UIBarPositioningDelegate : NSObjectProtocol",
    "language" : "swift"
  },
  "id" : "678C05DB-21F7-40F2-B0F6-624E2CFDB58C",
  "inheritedBy" : [
    "UINavigationBarDelegate",
    "UISearchBarDelegate",
    "UIToolbarDelegate"
  ],
  "kind" : "protocol",
  "language" : "swift",
  "module" : "UIKit",
  "overview" : "## Overview\n\nNavigation bars, toolbars, and search bars all have delegates that support the [doc:\/\/com.apple.uikit\/documentation\/UIKit\/UIBarPositioning] protocol. The delegate can use the method of this protocol to specify the bar’s position when that bar is moved to a window. The [doc:\/\/com.apple.uikit\/documentation\/UIKit\/UINavigationBarDelegate], [doc:\/\/com.apple.uikit\/documentation\/UIKit\/UISearchBarDelegate], and [doc:\/\/com.apple.uikit\/documentation\/UIKit\/UIToolbarDelegate] protocols extend this protocol to allow for the positioning of those bars on the screen.",
  "platforms" : [
    "iOS",
    "iPadOS",
    "Mac Catalyst",
    "tvOS",
    "visionOS"
  ],
  "rawMarkdown" : "---\nsource: https:\/\/developer.apple.com\/documentation\/UIKit\/UIBarPositioningDelegate\ncrawled: 2025-12-03T05:28:12Z\n---\n\n# UIBarPositioningDelegate\n\n**Protocol**\n\nA set of methods that support the positioning of a bar that conforms to the [doc:\/\/com.apple.uikit\/documentation\/UIKit\/UIBarPositioning] protocol.\n\n## Declaration\n\n```swift\n@MainActor protocol UIBarPositioningDelegate : NSObjectProtocol\n```\n\n## Overview\n\nNavigation bars, toolbars, and search bars all have delegates that support the [doc:\/\/com.apple.uikit\/documentation\/UIKit\/UIBarPositioning] protocol. The delegate can use the method of this protocol to specify the bar’s position when that bar is moved to a window. The [doc:\/\/com.apple.uikit\/documentation\/UIKit\/UINavigationBarDelegate], [doc:\/\/com.apple.uikit\/documentation\/UIKit\/UISearchBarDelegate], and [doc:\/\/com.apple.uikit\/documentation\/UIKit\/UIToolbarDelegate] protocols extend this protocol to allow for the positioning of those bars on the screen.\n\n## Positioning Bars\n\n- **position(for:)**: Asks the delegate for the position of the specified bar in its new window.\n\n## Bars\n\n- **UIBarItem**: An abstract superclass for items that you can add to a bar that appears at the bottom of the screen.\n- **UIBarButtonItem**: A specialized button for placement on a toolbar, navigation bar, or shortcuts bar.\n- **UIBarButtonItemGroup**: A group of one or more bar button items for placement on a navigation bar or shortcuts bar.\n- **UINavigationBar**: Navigational controls that display in a bar along the top of the screen, usually in conjunction with a navigation controller.\n- **UISearchBar**: A specialized view for receiving search-related information from the user.\n- **UIToolbar**: A control that displays one or more buttons along an edge of your interface.\n- **UITabBar**: A control that displays one or more buttons in a tab bar for selecting between different subtasks, views, or modes in an app.\n- **UITabBarItem**: An object that describes an item in a tab bar.\n- **UIBarPositioning**: A set of methods for defining the positioning of bars in iOS apps.\n\n## Inherits From\n\n- NSObjectProtocol\n\n## Inherited By\n\n- UINavigationBarDelegate\n- UISearchBarDelegate\n- UIToolbarDelegate\n\n",
  "sections" : [
    {
      "content" : "",
      "items" : [
        {
          "description" : "Asks the delegate for the position of the specified bar in its new window.",
          "name" : "position(for:)",
          "url" : "https:\/\/developer.apple.com\/documentation\/UIKit\/UIBarPositioningDelegate\/position(for:)"
        }
      ],
      "title" : "Positioning Bars"
    },
    {
      "content" : "",
      "items" : [
        {
          "description" : "An abstract superclass for items that you can add to a bar that appears at the bottom of the screen.",
          "name" : "UIBarItem",
          "url" : "https:\/\/developer.apple.com\/documentation\/UIKit\/UIBarItem"
        },
        {
          "description" : "A specialized button for placement on a toolbar, navigation bar, or shortcuts bar.",
          "name" : "UIBarButtonItem",
          "url" : "https:\/\/developer.apple.com\/documentation\/UIKit\/UIBarButtonItem"
        },
        {
          "description" : "A group of one or more bar button items for placement on a navigation bar or shortcuts bar.",
          "name" : "UIBarButtonItemGroup",
          "url" : "https:\/\/developer.apple.com\/documentation\/UIKit\/UIBarButtonItemGroup"
        },
        {
          "description" : "Navigational controls that display in a bar along the top of the screen, usually in conjunction with a navigation controller.",
          "name" : "UINavigationBar",
          "url" : "https:\/\/developer.apple.com\/documentation\/UIKit\/UINavigationBar"
        },
        {
          "description" : "A specialized view for receiving search-related information from the user.",
          "name" : "UISearchBar",
          "url" : "https:\/\/developer.apple.com\/documentation\/UIKit\/UISearchBar"
        },
        {
          "description" : "A control that displays one or more buttons along an edge of your interface.",
          "name" : "UIToolbar",
          "url" : "https:\/\/developer.apple.com\/documentation\/UIKit\/UIToolbar"
        },
        {
          "description" : "A control that displays one or more buttons in a tab bar for selecting between different subtasks, views, or modes in an app.",
          "name" : "UITabBar",
          "url" : "https:\/\/developer.apple.com\/documentation\/UIKit\/UITabBar"
        },
        {
          "description" : "An object that describes an item in a tab bar.",
          "name" : "UITabBarItem",
          "url" : "https:\/\/developer.apple.com\/documentation\/UIKit\/UITabBarItem"
        },
        {
          "description" : "A set of methods for defining the positioning of bars in iOS apps.",
          "name" : "UIBarPositioning",
          "url" : "https:\/\/developer.apple.com\/documentation\/UIKit\/UIBarPositioning"
        }
      ],
      "title" : "Bars"
    },
    {
      "content" : "",
      "items" : [
        {
          "name" : "NSObjectProtocol"
        }
      ],
      "title" : "Inherits From"
    }
  ],
  "source" : "appleJSON",
  "title" : "UIBarPositioningDelegate",
  "url" : "https:\/\/developer.apple.com\/documentation\/UIKit\/UIBarPositioningDelegate"
}