{
  "abstract" : "Adds a specified linear velocity to a dynamic item.",
  "codeExamples" : [

  ],
  "contentHash" : "d8dc5b333156e6df0d5c0f76c99aedb771d689d6107bfce650b75e23c04499c7",
  "crawledAt" : "2025-12-05T05:24:22Z",
  "declaration" : {
    "code" : "@MainActor func addLinearVelocity(_ velocity: CGPoint, for item: any UIDynamicItem)",
    "language" : "swift"
  },
  "id" : "99B3AD59-8172-45AD-90FF-F4F3842CD23A",
  "kind" : "method",
  "language" : "swift",
  "module" : "UIKit",
  "platforms" : [
    "iOS",
    "iPadOS",
    "Mac Catalyst",
    "tvOS",
    "visionOS"
  ],
  "rawMarkdown" : "---\nsource: https:\/\/developer.apple.com\/documentation\/UIKit\/UIDynamicItemBehavior\/addLinearVelocity(_:for:)\ncrawled: 2025-12-05T05:24:22Z\n---\n\n# addLinearVelocity(_:for:)\n\n**Instance Method**\n\nAdds a specified linear velocity to a dynamic item.\n\n## Declaration\n\n```swift\n@MainActor func addLinearVelocity(_ velocity: CGPoint, for item: any UIDynamicItem)\n```\n\n## Parameters\n\n- **velocity**: The linear velocity, expressed in points per second, that you want to add to the specified dynamic item. Default value is `0`. Applying a negative value reduces the linear velocity by the specified amount.\n- **item**: The dynamic item whose linear velocity you want to increase (or decrease).\n\n## Configuring a dynamic item behavior\n\n- **addAngularVelocity(_:for:)**: Adds a specified angular velocity to a dynamic item.\n- **allowsRotation**: Specifies whether rotation is allowed for the behavior’s dynamic items.\n- **angularResistance**: The angular resistance for the behavior’s dynamic items.\n- **angularVelocity(for:)**: Returns the angular velocity for a specified dynamic item.\n- **linearVelocity(for:)**: Returns the linear velocity for a specified dynamic item.\n- **density**: The relative mass density of the behavior’s dynamic items.\n- **elasticity**: The amount of elasticity applied to collisions for the behavior’s dynamic items.\n- **friction**: The linear resistance for the behavior’s dynamic items when two slide against each other.\n- **resistance**: The linear resistance for the behavior’s dynamic items, which reduces their linear velocity over time.\n- **charge**: The charge associated with the item.\n- **isAnchored**: A Boolean value indicating whether the item is anchored to its current position.\n\n",
  "sections" : [
    {
      "content" : "",
      "items" : [
        {
          "description" : "Adds a specified angular velocity to a dynamic item.",
          "name" : "addAngularVelocity(_:for:)",
          "url" : "https:\/\/developer.apple.com\/documentation\/UIKit\/UIDynamicItemBehavior\/addAngularVelocity(_:for:)"
        },
        {
          "description" : "Specifies whether rotation is allowed for the behavior’s dynamic items.",
          "name" : "allowsRotation",
          "url" : "https:\/\/developer.apple.com\/documentation\/UIKit\/UIDynamicItemBehavior\/allowsRotation"
        },
        {
          "description" : "The angular resistance for the behavior’s dynamic items.",
          "name" : "angularResistance",
          "url" : "https:\/\/developer.apple.com\/documentation\/UIKit\/UIDynamicItemBehavior\/angularResistance"
        },
        {
          "description" : "Returns the angular velocity for a specified dynamic item.",
          "name" : "angularVelocity(for:)",
          "url" : "https:\/\/developer.apple.com\/documentation\/UIKit\/UIDynamicItemBehavior\/angularVelocity(for:)"
        },
        {
          "description" : "Returns the linear velocity for a specified dynamic item.",
          "name" : "linearVelocity(for:)",
          "url" : "https:\/\/developer.apple.com\/documentation\/UIKit\/UIDynamicItemBehavior\/linearVelocity(for:)"
        },
        {
          "description" : "The relative mass density of the behavior’s dynamic items.",
          "name" : "density",
          "url" : "https:\/\/developer.apple.com\/documentation\/UIKit\/UIDynamicItemBehavior\/density"
        },
        {
          "description" : "The amount of elasticity applied to collisions for the behavior’s dynamic items.",
          "name" : "elasticity",
          "url" : "https:\/\/developer.apple.com\/documentation\/UIKit\/UIDynamicItemBehavior\/elasticity"
        },
        {
          "description" : "The linear resistance for the behavior’s dynamic items when two slide against each other.",
          "name" : "friction",
          "url" : "https:\/\/developer.apple.com\/documentation\/UIKit\/UIDynamicItemBehavior\/friction"
        },
        {
          "description" : "The linear resistance for the behavior’s dynamic items, which reduces their linear velocity over time.",
          "name" : "resistance",
          "url" : "https:\/\/developer.apple.com\/documentation\/UIKit\/UIDynamicItemBehavior\/resistance"
        },
        {
          "description" : "The charge associated with the item.",
          "name" : "charge",
          "url" : "https:\/\/developer.apple.com\/documentation\/UIKit\/UIDynamicItemBehavior\/charge"
        },
        {
          "description" : "A Boolean value indicating whether the item is anchored to its current position.",
          "name" : "isAnchored",
          "url" : "https:\/\/developer.apple.com\/documentation\/UIKit\/UIDynamicItemBehavior\/isAnchored"
        }
      ],
      "title" : "Configuring a dynamic item behavior"
    }
  ],
  "source" : "appleJSON",
  "title" : "addLinearVelocity(_:for:)",
  "url" : "https:\/\/developer.apple.com\/documentation\/UIKit\/UIDynamicItemBehavior\/addLinearVelocity(_:for:)"
}