{
  "abstract" : "Tells the view that a subview is about to be removed.",
  "codeExamples" : [

  ],
  "contentHash" : "309013d2a8551d36868ae9a2f17504bdec50d312f686b2bbd736c41a0c243fd4",
  "crawledAt" : "2025-12-01T23:14:59Z",
  "declaration" : {
    "code" : "@MainActor func willRemoveSubview(_ subview: UIView)",
    "language" : "swift"
  },
  "id" : "0A209C08-E8BD-4A3C-B022-8F6498382A8B",
  "kind" : "method",
  "module" : "UIKit",
  "overview" : "## Discussion\n\nThe default implementation of this method does nothing. Subclasses can override it to perform additional actions whenever subviews are removed. This method is called when the subview’s superview changes or when the subview is removed from the view hierarchy completely.",
  "platforms" : [
    "iOS",
    "iPadOS",
    "Mac Catalyst",
    "tvOS",
    "visionOS"
  ],
  "rawMarkdown" : "---\nsource: https:\/\/developer.apple.com\/documentation\/UIKit\/UIView\/willRemoveSubview(_:)\ncrawled: 2025-12-01T23:14:59Z\n---\n\n# willRemoveSubview(_:)\n\n**Instance Method**\n\nTells the view that a subview is about to be removed.\n\n## Declaration\n\n```swift\n@MainActor func willRemoveSubview(_ subview: UIView)\n```\n\n## Parameters\n\n- **subview**: The subview that will be removed.\n\n## Discussion\n\nThe default implementation of this method does nothing. Subclasses can override it to perform additional actions whenever subviews are removed. This method is called when the subview’s superview changes or when the subview is removed from the view hierarchy completely.\n\n## Related Documentation\n\n- **removeFromSuperview()**: Unlinks the view from its superview and its window, and removes it from the responder chain.\n\n## Observing view-related changes\n\n- **didAddSubview(_:)**: Tells the view that a subview was added.\n- **willMove(toSuperview:)**: Tells the view that its superview is about to change to the specified superview.\n- **didMoveToSuperview()**: Tells the view that its superview changed.\n- **willMove(toWindow:)**: Tells the view that its window object is about to change.\n- **didMoveToWindow()**: Tells the view that its window object changed.\n\n",
  "sections" : [
    {
      "content" : "",
      "items" : [
        {
          "description" : "Unlinks the view from its superview and its window, and removes it from the responder chain.",
          "name" : "removeFromSuperview()",
          "url" : "https:\/\/developer.apple.com\/documentation\/UIKit\/UIView\/removeFromSuperview()"
        }
      ],
      "title" : "Related Documentation"
    },
    {
      "content" : "",
      "items" : [
        {
          "description" : "Tells the view that a subview was added.",
          "name" : "didAddSubview(_:)",
          "url" : "https:\/\/developer.apple.com\/documentation\/UIKit\/UIView\/didAddSubview(_:)"
        },
        {
          "description" : "Tells the view that its superview is about to change to the specified superview.",
          "name" : "willMove(toSuperview:)",
          "url" : "https:\/\/developer.apple.com\/documentation\/UIKit\/UIView\/willMove(toSuperview:)"
        },
        {
          "description" : "Tells the view that its superview changed.",
          "name" : "didMoveToSuperview()",
          "url" : "https:\/\/developer.apple.com\/documentation\/UIKit\/UIView\/didMoveToSuperview()"
        },
        {
          "description" : "Tells the view that its window object is about to change.",
          "name" : "willMove(toWindow:)",
          "url" : "https:\/\/developer.apple.com\/documentation\/UIKit\/UIView\/willMove(toWindow:)"
        },
        {
          "description" : "Tells the view that its window object changed.",
          "name" : "didMoveToWindow()",
          "url" : "https:\/\/developer.apple.com\/documentation\/UIKit\/UIView\/didMoveToWindow()"
        }
      ],
      "title" : "Observing view-related changes"
    }
  ],
  "source" : "appleJSON",
  "title" : "willRemoveSubview(_:)",
  "url" : "https:\/\/developer.apple.com\/documentation\/UIKit\/UIView\/willRemoveSubview(_:)"
}