{
  "abstract" : "Determines whether the searchable object allows replacement of the text range you provide.",
  "codeExamples" : [

  ],
  "contentHash" : "bc676cce34916b777736266dc5bdefdd904673230f2b64357b944e2d5c949633",
  "crawledAt" : "2025-12-03T23:42:40Z",
  "declaration" : {
    "code" : "func shouldReplace(foundTextRange: UITextRange, document: Self.DocumentIdentifier?, withText: String) -> Bool",
    "language" : "swift"
  },
  "id" : "87507B00-BA17-4244-8C07-1EB529658325",
  "kind" : "method",
  "language" : "swift",
  "module" : "UIKit",
  "overview" : "## Return Value\n\nReturn `No` to prevent the replacement of a particular text range.\n\n## Discussion\n\nReturning `NO` from this method disables the “replace” button in the find panel. If you don’t implement this method, the system assumes all results are replacable.",
  "platforms" : [
    "iOS",
    "iPadOS",
    "Mac Catalyst",
    "visionOS"
  ],
  "rawMarkdown" : "---\nsource: https:\/\/developer.apple.com\/documentation\/UIKit\/UITextSearching-3wkjv\/shouldReplace(foundTextRange:document:withText:)\ncrawled: 2025-12-03T23:42:40Z\n---\n\n# shouldReplace(foundTextRange:document:withText:)\n\n**Instance Method**\n\nDetermines whether the searchable object allows replacement of the text range you provide.\n\n## Declaration\n\n```swift\nfunc shouldReplace(foundTextRange: UITextRange, document: Self.DocumentIdentifier?, withText: String) -> Bool\n```\n\n## Parameters\n\n- **foundTextRange**: The range of characters in a text container to consider a replacement for.\n- **document**: A string that uniquely identifies the document containing the text range.\n- **withText**: The string to replace the text with.\n\n## Return Value\n\nReturn `No` to prevent the replacement of a particular text range.\n\n## Discussion\n\nReturning `NO` from this method disables the “replace” button in the find panel. If you don’t implement this method, the system assumes all results are replacable.\n\n## Handling replacements\n\n- **supportsTextReplacement**: A Boolean value that indicates whether the searchable object supports replacing text.\n- **replace(foundTextRange:document:withText:)**: Informs the searchable object to replace the text range for the highlighted search result.\n- **replaceAll(queryString:options:withText:)**: Informs the searchable object to replace all matching text across all searchable documents.\n\n",
  "sections" : [
    {
      "content" : "",
      "items" : [
        {
          "description" : "A Boolean value that indicates whether the searchable object supports replacing text.",
          "name" : "supportsTextReplacement",
          "url" : "https:\/\/developer.apple.com\/documentation\/UIKit\/UITextSearching-3wkjv\/supportsTextReplacement"
        },
        {
          "description" : "Informs the searchable object to replace the text range for the highlighted search result.",
          "name" : "replace(foundTextRange:document:withText:)",
          "url" : "https:\/\/developer.apple.com\/documentation\/UIKit\/UITextSearching-3wkjv\/replace(foundTextRange:document:withText:)"
        },
        {
          "description" : "Informs the searchable object to replace all matching text across all searchable documents.",
          "name" : "replaceAll(queryString:options:withText:)",
          "url" : "https:\/\/developer.apple.com\/documentation\/UIKit\/UITextSearching-3wkjv\/replaceAll(queryString:options:withText:)"
        }
      ],
      "title" : "Handling replacements"
    }
  ],
  "source" : "appleJSON",
  "title" : "shouldReplace(foundTextRange:document:withText:)",
  "url" : "https:\/\/developer.apple.com\/documentation\/UIKit\/UITextSearching-3wkjv\/shouldReplace(foundTextRange:document:withText:)"
}