{
  "abstract" : "An interface for modifying an animation while it’s running.",
  "codeExamples" : [

  ],
  "conformingTypes" : [
    "UIViewPropertyAnimator"
  ],
  "contentHash" : "1aed0566d8c1ddfd08fd75b5c52716465b2edef9e82913cc9f02d475128a571e",
  "crawledAt" : "2025-12-04T10:19:26Z",
  "declaration" : {
    "code" : "@MainActor protocol UIViewImplicitlyAnimating : UIViewAnimating",
    "language" : "swift"
  },
  "id" : "AC1865D6-815F-4A75-8F41-DFCD4CA40816",
  "kind" : "protocol",
  "language" : "swift",
  "module" : "UIKit",
  "overview" : "## Overview\n\nAnimator objects used in interruptible view controller transitions adopt the [doc:\/\/com.apple.uikit\/documentation\/UIKit\/UIViewImplicitlyAnimating] protocol to modify in-flight transition animations. This protocol also conforms to the [doc:\/\/com.apple.uikit\/documentation\/UIKit\/UIViewAnimating] protocol, which specifies methods for starting and stopping animations and for updating their state.\n\nThe [doc:\/\/com.apple.uikit\/documentation\/UIKit\/UIViewPropertyAnimator] class adopts this protocol and implements all of its methods. You can adopt this protocol in your own classes to implement custom animator objects. When adopting this protocol, it’s recommended that you implement all of the methods.",
  "platforms" : [
    "iOS",
    "iPadOS",
    "Mac Catalyst",
    "tvOS",
    "visionOS"
  ],
  "rawMarkdown" : "---\nsource: https:\/\/developer.apple.com\/documentation\/UIKit\/UIViewImplicitlyAnimating\ncrawled: 2025-12-04T10:19:26Z\n---\n\n# UIViewImplicitlyAnimating\n\n**Protocol**\n\nAn interface for modifying an animation while it’s running.\n\n## Declaration\n\n```swift\n@MainActor protocol UIViewImplicitlyAnimating : UIViewAnimating\n```\n\n## Overview\n\nAnimator objects used in interruptible view controller transitions adopt the [doc:\/\/com.apple.uikit\/documentation\/UIKit\/UIViewImplicitlyAnimating] protocol to modify in-flight transition animations. This protocol also conforms to the [doc:\/\/com.apple.uikit\/documentation\/UIKit\/UIViewAnimating] protocol, which specifies methods for starting and stopping animations and for updating their state.\n\nThe [doc:\/\/com.apple.uikit\/documentation\/UIKit\/UIViewPropertyAnimator] class adopts this protocol and implements all of its methods. You can adopt this protocol in your own classes to implement custom animator objects. When adopting this protocol, it’s recommended that you implement all of the methods.\n\n## Modifying animations\n\n- **addAnimations(_:)**: Adds the specified animation block to the animator.\n- **addAnimations(_:delayFactor:)**: Adds the specified animation block to the animator with a delay.\n- **addCompletion(_:)**: Adds the specified completion block to the animator.\n- **continueAnimation(withTimingParameters:durationFactor:)**: Adjusts the final timing and duration of a paused animation.\n\n## Inherits From\n\n- NSObjectProtocol\n- UIViewAnimating\n\n## Conforming Types\n\n- UIViewPropertyAnimator\n\n",
  "sections" : [
    {
      "content" : "",
      "items" : [
        {
          "description" : "Adds the specified animation block to the animator.",
          "name" : "addAnimations(_:)",
          "url" : "https:\/\/developer.apple.com\/documentation\/UIKit\/UIViewImplicitlyAnimating\/addAnimations(_:)"
        },
        {
          "description" : "Adds the specified animation block to the animator with a delay.",
          "name" : "addAnimations(_:delayFactor:)",
          "url" : "https:\/\/developer.apple.com\/documentation\/UIKit\/UIViewImplicitlyAnimating\/addAnimations(_:delayFactor:)"
        },
        {
          "description" : "Adds the specified completion block to the animator.",
          "name" : "addCompletion(_:)",
          "url" : "https:\/\/developer.apple.com\/documentation\/UIKit\/UIViewImplicitlyAnimating\/addCompletion(_:)"
        },
        {
          "description" : "Adjusts the final timing and duration of a paused animation.",
          "name" : "continueAnimation(withTimingParameters:durationFactor:)",
          "url" : "https:\/\/developer.apple.com\/documentation\/UIKit\/UIViewImplicitlyAnimating\/continueAnimation(withTimingParameters:durationFactor:)"
        }
      ],
      "title" : "Modifying animations"
    },
    {
      "content" : "",
      "items" : [
        {
          "name" : "NSObjectProtocol"
        },
        {
          "name" : "UIViewAnimating"
        }
      ],
      "title" : "Inherits From"
    }
  ],
  "source" : "appleJSON",
  "title" : "UIViewImplicitlyAnimating",
  "url" : "https:\/\/developer.apple.com\/documentation\/UIKit\/UIViewImplicitlyAnimating"
}