{
  "abstract" : "Presents the picker from a view controller of your app.",
  "codeExamples" : [

  ],
  "contentHash" : "45115fa2584dd6ba8b6325a55617325f00881cae95d3ddbfc733d2925160c4bf",
  "crawledAt" : "2025-12-02T15:24:41Z",
  "declaration" : {
    "code" : "@MainActor func present(animated: Bool, completionHandler completion: UIPrinterPickerController.CompletionHandler? = nil) -> Bool",
    "language" : "swift"
  },
  "id" : "A937F0AF-3205-4157-9332-032E7F987AC8",
  "kind" : "method",
  "module" : "UIKit",
  "overview" : "## Return Value\n\n[doc:\/\/com.apple.documentation\/documentation\/Swift\/true] if the picker was displayed or [doc:\/\/com.apple.documentation\/documentation\/Swift\/false] if the picker was already visible.\n\n## Discussion\n\nThis method presents the picker from one of your app’s view controllers and returns immediately. If you provide a delegate object and that object implements the [doc:\/\/com.apple.uikit\/documentation\/UIKit\/UIPrinterPickerControllerDelegate\/printerPickerControllerParentViewController(_:)] method, UIKit uses the view controller you provide to present the picker. If you do not provide a delegate, or your delegate object does not implement the [doc:\/\/com.apple.uikit\/documentation\/UIKit\/UIPrinterPickerControllerDelegate\/printerPickerControllerParentViewController(_:)] method, UIKit presents the picker from the root view controller of your app’s main window.\n\nAfter presenting the picker, the picker interface runs until the user or your app dismisses it. The picker interface provides ways for the user to cancel printing directly, all of which dismiss the picker. You can also dismiss the printer picker programmatically by calling the [doc:\/\/com.apple.uikit\/documentation\/UIKit\/UIPrinterPickerController\/dismiss(animated:)] method.",
  "platforms" : [
    "iOS",
    "iPadOS",
    "Mac Catalyst",
    "visionOS"
  ],
  "rawMarkdown" : "---\nsource: https:\/\/developer.apple.com\/documentation\/UIKit\/UIPrinterPickerController\/present(animated:completionHandler:)\ncrawled: 2025-12-02T15:24:41Z\n---\n\n# present(animated:completionHandler:)\n\n**Instance Method**\n\nPresents the picker from a view controller of your app.\n\n## Declaration\n\n```swift\n@MainActor func present(animated: Bool, completionHandler completion: UIPrinterPickerController.CompletionHandler? = nil) -> Bool\n```\n\n## Parameters\n\n- **animated**: [doc:\/\/com.apple.documentation\/documentation\/Swift\/true] to animate the display of the picker or [doc:\/\/com.apple.documentation\/documentation\/Swift\/false] to display it without animations.\n- **completion**: A block to execute when the picker is dismissed. Use this block to receive information about the selected printer or information about any errors that occurred.\n\n## Return Value\n\n[doc:\/\/com.apple.documentation\/documentation\/Swift\/true] if the picker was displayed or [doc:\/\/com.apple.documentation\/documentation\/Swift\/false] if the picker was already visible.\n\n## Discussion\n\nThis method presents the picker from one of your app’s view controllers and returns immediately. If you provide a delegate object and that object implements the [doc:\/\/com.apple.uikit\/documentation\/UIKit\/UIPrinterPickerControllerDelegate\/printerPickerControllerParentViewController(_:)] method, UIKit uses the view controller you provide to present the picker. If you do not provide a delegate, or your delegate object does not implement the [doc:\/\/com.apple.uikit\/documentation\/UIKit\/UIPrinterPickerControllerDelegate\/printerPickerControllerParentViewController(_:)] method, UIKit presents the picker from the root view controller of your app’s main window.\n\nAfter presenting the picker, the picker interface runs until the user or your app dismisses it. The picker interface provides ways for the user to cancel printing directly, all of which dismiss the picker. You can also dismiss the printer picker programmatically by calling the [doc:\/\/com.apple.uikit\/documentation\/UIKit\/UIPrinterPickerController\/dismiss(animated:)] method.\n\n## Presenting and dismissing the picker\n\n- **present(from:animated:completionHandler:)**: Presents the picker in a popover that anchors to the specified bar button item.\n- **present(from:in:animated:completionHandler:)**: Presents the picker in a popover that anchors to a rectangle in the specified view.\n- **dismiss(animated:)**: Dismisses the picker.\n\n",
  "sections" : [
    {
      "content" : "",
      "items" : [
        {
          "description" : "Presents the picker in a popover that anchors to the specified bar button item.",
          "name" : "present(from:animated:completionHandler:)",
          "url" : "https:\/\/developer.apple.com\/documentation\/UIKit\/UIPrinterPickerController\/present(from:animated:completionHandler:)"
        },
        {
          "description" : "Presents the picker in a popover that anchors to a rectangle in the specified view.",
          "name" : "present(from:in:animated:completionHandler:)",
          "url" : "https:\/\/developer.apple.com\/documentation\/UIKit\/UIPrinterPickerController\/present(from:in:animated:completionHandler:)"
        },
        {
          "description" : "Dismisses the picker.",
          "name" : "dismiss(animated:)",
          "url" : "https:\/\/developer.apple.com\/documentation\/UIKit\/UIPrinterPickerController\/dismiss(animated:)"
        }
      ],
      "title" : "Presenting and dismissing the picker"
    }
  ],
  "source" : "appleJSON",
  "title" : "present(animated:completionHandler:)",
  "url" : "https:\/\/developer.apple.com\/documentation\/UIKit\/UIPrinterPickerController\/present(animated:completionHandler:)"
}