{
  "abstract" : "The Core Graphics representation of the path.",
  "codeExamples" : [

  ],
  "contentHash" : "2904cd70c0a4f1ac1f9b28a7fd26e38830940af27c4cbae5df4529aafe7ef0cf",
  "crawledAt" : "2025-12-04T11:51:58Z",
  "declaration" : {
    "code" : "var cgPath: CGPath { get set }",
    "language" : "swift"
  },
  "id" : "8E5D45A0-58F0-400E-B93C-9184C886F739",
  "kind" : "property",
  "language" : "swift",
  "module" : "UIKit",
  "overview" : "## Discussion\n\nThis property contains a snapshot of the path at any given point in time. Getting this property returns an immutable path object that you can pass to Core Graphics functions. The path object itself is owned by the `UIBezierPath` object and is valid only until you make further modifications to the path.\n\nYou can set the value of this property to a path you built using the functions of the Core Graphics framework. When setting a new path, this method makes a copy of the path you provide.",
  "platforms" : [
    "iOS",
    "iPadOS",
    "Mac Catalyst",
    "tvOS",
    "visionOS",
    "watchOS"
  ],
  "rawMarkdown" : "---\nsource: https:\/\/developer.apple.com\/documentation\/UIKit\/UIBezierPath\/cgPath\ncrawled: 2025-12-04T11:51:58Z\n---\n\n# cgPath\n\n**Instance Property**\n\nThe Core Graphics representation of the path.\n\n## Declaration\n\n```swift\nvar cgPath: CGPath { get set }\n```\n\n## Discussion\n\nThis property contains a snapshot of the path at any given point in time. Getting this property returns an immutable path object that you can pass to Core Graphics functions. The path object itself is owned by the `UIBezierPath` object and is valid only until you make further modifications to the path.\n\nYou can set the value of this property to a path you built using the functions of the Core Graphics framework. When setting a new path, this method makes a copy of the path you provide.\n\n## Constructing a path\n\n- **move(to:)**: Moves the path’s current point to the specified location.\n- **addLine(to:)**: Appends a straight line to the path.\n- **addArc(withCenter:radius:startAngle:endAngle:clockwise:)**: Appends an arc to the path.\n- **addCurve(to:controlPoint1:controlPoint2:)**: Appends a cubic Bézier curve to the path.\n- **addQuadCurve(to:controlPoint:)**: Appends a quadratic Bézier curve to the path.\n- **close()**: Closes the most recent subpath.\n- **removeAllPoints()**: Removes all points from the path, effectively deleting all subpaths.\n- **append(_:)**: Appends the contents of the specified path object to the path.\n- **currentPoint**: The current point in the graphics path.\n\n",
  "sections" : [
    {
      "content" : "",
      "items" : [
        {
          "description" : "Moves the path’s current point to the specified location.",
          "name" : "move(to:)",
          "url" : "https:\/\/developer.apple.com\/documentation\/UIKit\/UIBezierPath\/move(to:)"
        },
        {
          "description" : "Appends a straight line to the path.",
          "name" : "addLine(to:)",
          "url" : "https:\/\/developer.apple.com\/documentation\/UIKit\/UIBezierPath\/addLine(to:)"
        },
        {
          "description" : "Appends an arc to the path.",
          "name" : "addArc(withCenter:radius:startAngle:endAngle:clockwise:)",
          "url" : "https:\/\/developer.apple.com\/documentation\/UIKit\/UIBezierPath\/addArc(withCenter:radius:startAngle:endAngle:clockwise:)"
        },
        {
          "description" : "Appends a cubic Bézier curve to the path.",
          "name" : "addCurve(to:controlPoint1:controlPoint2:)",
          "url" : "https:\/\/developer.apple.com\/documentation\/UIKit\/UIBezierPath\/addCurve(to:controlPoint1:controlPoint2:)"
        },
        {
          "description" : "Appends a quadratic Bézier curve to the path.",
          "name" : "addQuadCurve(to:controlPoint:)",
          "url" : "https:\/\/developer.apple.com\/documentation\/UIKit\/UIBezierPath\/addQuadCurve(to:controlPoint:)"
        },
        {
          "description" : "Closes the most recent subpath.",
          "name" : "close()",
          "url" : "https:\/\/developer.apple.com\/documentation\/UIKit\/UIBezierPath\/close()"
        },
        {
          "description" : "Removes all points from the path, effectively deleting all subpaths.",
          "name" : "removeAllPoints()",
          "url" : "https:\/\/developer.apple.com\/documentation\/UIKit\/UIBezierPath\/removeAllPoints()"
        },
        {
          "description" : "Appends the contents of the specified path object to the path.",
          "name" : "append(_:)",
          "url" : "https:\/\/developer.apple.com\/documentation\/UIKit\/UIBezierPath\/append(_:)"
        },
        {
          "description" : "The current point in the graphics path.",
          "name" : "currentPoint",
          "url" : "https:\/\/developer.apple.com\/documentation\/UIKit\/UIBezierPath\/currentPoint"
        }
      ],
      "title" : "Constructing a path"
    }
  ],
  "source" : "appleJSON",
  "title" : "cgPath",
  "url" : "https:\/\/developer.apple.com\/documentation\/UIKit\/UIBezierPath\/cgPath"
}