{
  "abstract" : "Returns the text field’s border rectangle.",
  "codeExamples" : [

  ],
  "contentHash" : "e8ce04daf4f49bd465ca297c29cf8fca5b3d03480bc1aed1b2e0b533fed0e149",
  "crawledAt" : "2025-12-01T23:34:11Z",
  "declaration" : {
    "code" : "@MainActor func borderRect(forBounds bounds: CGRect) -> CGRect",
    "language" : "swift"
  },
  "id" : "734D0D96-C852-43BA-BB5D-E8AF33F76924",
  "kind" : "method",
  "module" : "UIKit",
  "overview" : "## Return Value\n\nThe border rectangle for the receiver.\n\n## Discussion\n\nYou should not call this method directly. If you want to provide a different border rectangle for drawing, you can override this method and return that rectangle.\n\nThe default implementation of this method returns the original `bounds` rectangle.",
  "platforms" : [
    "iOS",
    "iPadOS",
    "Mac Catalyst",
    "tvOS",
    "visionOS"
  ],
  "rawMarkdown" : "---\nsource: https:\/\/developer.apple.com\/documentation\/UIKit\/UITextField\/borderRect(forBounds:)\ncrawled: 2025-12-01T23:34:11Z\n---\n\n# borderRect(forBounds:)\n\n**Instance Method**\n\nReturns the text field’s border rectangle.\n\n## Declaration\n\n```swift\n@MainActor func borderRect(forBounds bounds: CGRect) -> CGRect\n```\n\n## Parameters\n\n- **bounds**: The bounding rectangle of the receiver.\n\n## Return Value\n\nThe border rectangle for the receiver.\n\n## Discussion\n\nYou should not call this method directly. If you want to provide a different border rectangle for drawing, you can override this method and return that rectangle.\n\nThe default implementation of this method returns the original `bounds` rectangle.\n\n## Drawing and positioning overrides\n\n- **textRect(forBounds:)**: Returns the drawing rectangle for the text field’s text.\n- **drawText(in:)**: Draws the text field’s text in the specified rectangle.\n- **placeholderRect(forBounds:)**: Returns the drawing rectangle for the text field’s placeholder text.\n- **drawPlaceholder(in:)**: Draws the text field’s placeholder text in the specified rectangle.\n- **editingRect(forBounds:)**: Returns the rectangle for displaying editable text.\n- **clearButtonRect(forBounds:)**: Returns the drawing rectangle for the built-in Clear button.\n- **leftViewRect(forBounds:)**: Returns the drawing rectangle of the text field’s left overlay view.\n- **rightViewRect(forBounds:)**: Returns the drawing location of the text field’s right overlay view.\n\n",
  "sections" : [
    {
      "content" : "",
      "items" : [
        {
          "description" : "Returns the drawing rectangle for the text field’s text.",
          "name" : "textRect(forBounds:)",
          "url" : "https:\/\/developer.apple.com\/documentation\/UIKit\/UITextField\/textRect(forBounds:)"
        },
        {
          "description" : "Draws the text field’s text in the specified rectangle.",
          "name" : "drawText(in:)",
          "url" : "https:\/\/developer.apple.com\/documentation\/UIKit\/UITextField\/drawText(in:)"
        },
        {
          "description" : "Returns the drawing rectangle for the text field’s placeholder text.",
          "name" : "placeholderRect(forBounds:)",
          "url" : "https:\/\/developer.apple.com\/documentation\/UIKit\/UITextField\/placeholderRect(forBounds:)"
        },
        {
          "description" : "Draws the text field’s placeholder text in the specified rectangle.",
          "name" : "drawPlaceholder(in:)",
          "url" : "https:\/\/developer.apple.com\/documentation\/UIKit\/UITextField\/drawPlaceholder(in:)"
        },
        {
          "description" : "Returns the rectangle for displaying editable text.",
          "name" : "editingRect(forBounds:)",
          "url" : "https:\/\/developer.apple.com\/documentation\/UIKit\/UITextField\/editingRect(forBounds:)"
        },
        {
          "description" : "Returns the drawing rectangle for the built-in Clear button.",
          "name" : "clearButtonRect(forBounds:)",
          "url" : "https:\/\/developer.apple.com\/documentation\/UIKit\/UITextField\/clearButtonRect(forBounds:)"
        },
        {
          "description" : "Returns the drawing rectangle of the text field’s left overlay view.",
          "name" : "leftViewRect(forBounds:)",
          "url" : "https:\/\/developer.apple.com\/documentation\/UIKit\/UITextField\/leftViewRect(forBounds:)"
        },
        {
          "description" : "Returns the drawing location of the text field’s right overlay view.",
          "name" : "rightViewRect(forBounds:)",
          "url" : "https:\/\/developer.apple.com\/documentation\/UIKit\/UITextField\/rightViewRect(forBounds:)"
        }
      ],
      "title" : "Drawing and positioning overrides"
    }
  ],
  "source" : "appleJSON",
  "title" : "borderRect(forBounds:)",
  "url" : "https:\/\/developer.apple.com\/documentation\/UIKit\/UITextField\/borderRect(forBounds:)"
}