{
  "abstract" : "Appends a cubic Bézier curve to the path.",
  "codeExamples" : [

  ],
  "contentHash" : "ae1d97f765ace086d60ab6d309cb305569e192d3d8dca8a36bafb74f85d023e9",
  "crawledAt" : "2025-12-04T11:51:55Z",
  "declaration" : {
    "code" : "func addCurve(to endPoint: CGPoint, controlPoint1: CGPoint, controlPoint2: CGPoint)",
    "language" : "swift"
  },
  "id" : "C2429AF2-66D0-40E9-8200-183C8E39E49C",
  "kind" : "method",
  "language" : "swift",
  "module" : "UIKit",
  "overview" : "## Discussion\n\nThis method appends a cubic Bézier curve from the current point to the end point specified by the `endPoint` parameter. The two control points define the curvature of the segment. The following image shows an approximation of a cubic Bézier curve given a set of initial points. The exact curvature of the segment involves a complex mathematical relationship between all of the points and is well documented online.\n\n\n\nYou must set the path’s current point (using the [doc:\/\/com.apple.uikit\/documentation\/UIKit\/UIBezierPath\/move(to:)] method or through the previous creation of a line or curve segment) before you call this method. If the path is empty, this method does nothing. After adding the curve segment, this method updates the current point to the value in `point`.",
  "platforms" : [
    "iOS",
    "iPadOS",
    "Mac Catalyst",
    "tvOS",
    "visionOS",
    "watchOS"
  ],
  "rawMarkdown" : "---\nsource: https:\/\/developer.apple.com\/documentation\/UIKit\/UIBezierPath\/addCurve(to:controlPoint1:controlPoint2:)\ncrawled: 2025-12-04T11:51:55Z\n---\n\n# addCurve(to:controlPoint1:controlPoint2:)\n\n**Instance Method**\n\nAppends a cubic Bézier curve to the path.\n\n## Declaration\n\n```swift\nfunc addCurve(to endPoint: CGPoint, controlPoint1: CGPoint, controlPoint2: CGPoint)\n```\n\n## Parameters\n\n- **endPoint**: The end point of the curve.\n- **controlPoint1**: The first control point to use when computing the curve.\n- **controlPoint2**: The second control point to use when computing the curve.\n\n## Discussion\n\nThis method appends a cubic Bézier curve from the current point to the end point specified by the `endPoint` parameter. The two control points define the curvature of the segment. The following image shows an approximation of a cubic Bézier curve given a set of initial points. The exact curvature of the segment involves a complex mathematical relationship between all of the points and is well documented online.\n\n\n\nYou must set the path’s current point (using the [doc:\/\/com.apple.uikit\/documentation\/UIKit\/UIBezierPath\/move(to:)] method or through the previous creation of a line or curve segment) before you call this method. If the path is empty, this method does nothing. After adding the curve segment, this method updates the current point to the value in `point`.\n\n## Constructing a path\n\n- **move(to:)**: Moves the path’s current point to the specified location.\n- **addLine(to:)**: Appends a straight line to the path.\n- **addArc(withCenter:radius:startAngle:endAngle:clockwise:)**: Appends an arc to the path.\n- **addQuadCurve(to:controlPoint:)**: Appends a quadratic Bézier curve to the path.\n- **close()**: Closes the most recent subpath.\n- **removeAllPoints()**: Removes all points from the path, effectively deleting all subpaths.\n- **append(_:)**: Appends the contents of the specified path object to the path.\n- **cgPath**: The Core Graphics representation of the path.\n- **currentPoint**: The current point in the graphics path.\n\n",
  "sections" : [
    {
      "content" : "",
      "items" : [
        {
          "description" : "Moves the path’s current point to the specified location.",
          "name" : "move(to:)",
          "url" : "https:\/\/developer.apple.com\/documentation\/UIKit\/UIBezierPath\/move(to:)"
        },
        {
          "description" : "Appends a straight line to the path.",
          "name" : "addLine(to:)",
          "url" : "https:\/\/developer.apple.com\/documentation\/UIKit\/UIBezierPath\/addLine(to:)"
        },
        {
          "description" : "Appends an arc to the path.",
          "name" : "addArc(withCenter:radius:startAngle:endAngle:clockwise:)",
          "url" : "https:\/\/developer.apple.com\/documentation\/UIKit\/UIBezierPath\/addArc(withCenter:radius:startAngle:endAngle:clockwise:)"
        },
        {
          "description" : "Appends a quadratic Bézier curve to the path.",
          "name" : "addQuadCurve(to:controlPoint:)",
          "url" : "https:\/\/developer.apple.com\/documentation\/UIKit\/UIBezierPath\/addQuadCurve(to:controlPoint:)"
        },
        {
          "description" : "Closes the most recent subpath.",
          "name" : "close()",
          "url" : "https:\/\/developer.apple.com\/documentation\/UIKit\/UIBezierPath\/close()"
        },
        {
          "description" : "Removes all points from the path, effectively deleting all subpaths.",
          "name" : "removeAllPoints()",
          "url" : "https:\/\/developer.apple.com\/documentation\/UIKit\/UIBezierPath\/removeAllPoints()"
        },
        {
          "description" : "Appends the contents of the specified path object to the path.",
          "name" : "append(_:)",
          "url" : "https:\/\/developer.apple.com\/documentation\/UIKit\/UIBezierPath\/append(_:)"
        },
        {
          "description" : "The Core Graphics representation of the path.",
          "name" : "cgPath",
          "url" : "https:\/\/developer.apple.com\/documentation\/UIKit\/UIBezierPath\/cgPath"
        },
        {
          "description" : "The current point in the graphics path.",
          "name" : "currentPoint",
          "url" : "https:\/\/developer.apple.com\/documentation\/UIKit\/UIBezierPath\/currentPoint"
        }
      ],
      "title" : "Constructing a path"
    }
  ],
  "source" : "appleJSON",
  "title" : "addCurve(to:controlPoint1:controlPoint2:)",
  "url" : "https:\/\/developer.apple.com\/documentation\/UIKit\/UIBezierPath\/addCurve(to:controlPoint1:controlPoint2:)"
}