{
  "abstract" : "Returns a constraint that defines the anchor’s size attribute as less than or equal to the specified anchor multiplied by the constant.",
  "codeExamples" : [

  ],
  "contentHash" : "d7bdea0d5611b38dd0e6343f91a420dfbee4c1edd3e6d6940e33e7fb7edb9c2a",
  "crawledAt" : "2025-12-02T15:25:19Z",
  "declaration" : {
    "code" : "@MainActor func constraint(lessThanOrEqualTo anchor: NSLayoutDimension, multiplier m: CGFloat) -> NSLayoutConstraint",
    "language" : "swift"
  },
  "id" : "20DDAD50-635A-4272-A00F-2FE3A624BAD2",
  "kind" : "method",
  "module" : "UIKit",
  "overview" : "## Return Value\n\nAn [doc:\/\/com.apple.uikit\/documentation\/UIKit\/NSLayoutConstraint] object that defines the attribute represented by this layout anchor as less than or equal to the attribute represented by the `anchor` parameter multiplied by the `m` constant.\n\n## Discussion\n\nThis method defines the relationship `first attribute <= m * second attribute` . Where `first attribute` is the layout attribute represented by the anchor receiving this method call, and `second attribute` is the layout attribute represented by the `anchor` parameter.\n\nThe constraints produced by the following two examples are identical.",
  "platforms" : [
    "iOS",
    "iPadOS",
    "Mac Catalyst",
    "tvOS",
    "visionOS"
  ],
  "rawMarkdown" : "---\nsource: https:\/\/developer.apple.com\/documentation\/UIKit\/NSLayoutDimension\/constraint(lessThanOrEqualTo:multiplier:)\ncrawled: 2025-12-02T15:25:19Z\n---\n\n# constraint(lessThanOrEqualTo:multiplier:)\n\n**Instance Method**\n\nReturns a constraint that defines the anchor’s size attribute as less than or equal to the specified anchor multiplied by the constant.\n\n## Declaration\n\n```swift\n@MainActor func constraint(lessThanOrEqualTo anchor: NSLayoutDimension, multiplier m: CGFloat) -> NSLayoutConstraint\n```\n\n## Parameters\n\n- **anchor**: A dimension anchor from a [doc:\/\/com.apple.uikit\/documentation\/UIKit\/UIView], [doc:\/\/com.apple.documentation\/documentation\/AppKit\/NSView], or [doc:\/\/com.apple.uikit\/documentation\/UIKit\/UILayoutGuide] object.\n- **m**: The multiplier constant for the constraint.\n\n## Return Value\n\nAn [doc:\/\/com.apple.uikit\/documentation\/UIKit\/NSLayoutConstraint] object that defines the attribute represented by this layout anchor as less than or equal to the attribute represented by the `anchor` parameter multiplied by the `m` constant.\n\n## Discussion\n\nThis method defines the relationship `first attribute <= m * second attribute` . Where `first attribute` is the layout attribute represented by the anchor receiving this method call, and `second attribute` is the layout attribute represented by the `anchor` parameter.\n\nThe constraints produced by the following two examples are identical.\n\n\n\n## Building constraints\n\n- **constraint(equalTo:multiplier:)**: Returns a constraint that defines the anchor’s size attribute as equal to the specified anchor multiplied by the constant.\n- **constraint(equalTo:multiplier:constant:)**: Returns a constraint that defines the anchor’s size attribute as equal to the specified size attribute multiplied by a constant plus an offset.\n- **constraint(equalToConstant:)**: Returns a constraint that defines a constant size for the anchor’s size attribute.\n- **constraint(greaterThanOrEqualTo:multiplier:)**: Returns a constraint that defines the anchor’s size attribute as greater than or equal to the specified anchor multiplied by the constant.\n- **constraint(greaterThanOrEqualTo:multiplier:constant:)**: Returns a constraint that defines the anchor’s size attribute as greater than or equal to the specified anchor multiplied by the constant plus an offset.\n- **constraint(greaterThanOrEqualToConstant:)**: Returns a constraint that defines the minimum size for the anchor’s size attribute.\n- **constraint(lessThanOrEqualTo:multiplier:constant:)**: Returns a constraint that defines the anchor’s size attribute as greater than or equal to the specified anchor multiplied by the constant plus an offset.\n- **constraint(lessThanOrEqualToConstant:)**: Returns a constraint that defines the maximum size for the anchor’s size attribute.\n\n",
  "sections" : [
    {
      "content" : "",
      "items" : [
        {
          "description" : "Returns a constraint that defines the anchor’s size attribute as equal to the specified anchor multiplied by the constant.",
          "name" : "constraint(equalTo:multiplier:)",
          "url" : "https:\/\/developer.apple.com\/documentation\/UIKit\/NSLayoutDimension\/constraint(equalTo:multiplier:)"
        },
        {
          "description" : "Returns a constraint that defines the anchor’s size attribute as equal to the specified size attribute multiplied by a constant plus an offset.",
          "name" : "constraint(equalTo:multiplier:constant:)",
          "url" : "https:\/\/developer.apple.com\/documentation\/UIKit\/NSLayoutDimension\/constraint(equalTo:multiplier:constant:)"
        },
        {
          "description" : "Returns a constraint that defines a constant size for the anchor’s size attribute.",
          "name" : "constraint(equalToConstant:)",
          "url" : "https:\/\/developer.apple.com\/documentation\/UIKit\/NSLayoutDimension\/constraint(equalToConstant:)"
        },
        {
          "description" : "Returns a constraint that defines the anchor’s size attribute as greater than or equal to the specified anchor multiplied by the constant.",
          "name" : "constraint(greaterThanOrEqualTo:multiplier:)",
          "url" : "https:\/\/developer.apple.com\/documentation\/UIKit\/NSLayoutDimension\/constraint(greaterThanOrEqualTo:multiplier:)"
        },
        {
          "description" : "Returns a constraint that defines the anchor’s size attribute as greater than or equal to the specified anchor multiplied by the constant plus an offset.",
          "name" : "constraint(greaterThanOrEqualTo:multiplier:constant:)",
          "url" : "https:\/\/developer.apple.com\/documentation\/UIKit\/NSLayoutDimension\/constraint(greaterThanOrEqualTo:multiplier:constant:)"
        },
        {
          "description" : "Returns a constraint that defines the minimum size for the anchor’s size attribute.",
          "name" : "constraint(greaterThanOrEqualToConstant:)",
          "url" : "https:\/\/developer.apple.com\/documentation\/UIKit\/NSLayoutDimension\/constraint(greaterThanOrEqualToConstant:)"
        },
        {
          "description" : "Returns a constraint that defines the anchor’s size attribute as greater than or equal to the specified anchor multiplied by the constant plus an offset.",
          "name" : "constraint(lessThanOrEqualTo:multiplier:constant:)",
          "url" : "https:\/\/developer.apple.com\/documentation\/UIKit\/NSLayoutDimension\/constraint(lessThanOrEqualTo:multiplier:constant:)"
        },
        {
          "description" : "Returns a constraint that defines the maximum size for the anchor’s size attribute.",
          "name" : "constraint(lessThanOrEqualToConstant:)",
          "url" : "https:\/\/developer.apple.com\/documentation\/UIKit\/NSLayoutDimension\/constraint(lessThanOrEqualToConstant:)"
        }
      ],
      "title" : "Building constraints"
    }
  ],
  "source" : "appleJSON",
  "title" : "constraint(lessThanOrEqualTo:multiplier:)",
  "url" : "https:\/\/developer.apple.com\/documentation\/UIKit\/NSLayoutDimension\/constraint(lessThanOrEqualTo:multiplier:)"
}