{
  "abstract" : "Adds the specified image to the user’s Camera Roll album.",
  "codeExamples" : [

  ],
  "contentHash" : "9928ae76bb740b4554195380fbbe4dfa88c026c6eedf9e856ce9963fc927dbb4",
  "crawledAt" : "2025-12-03T05:29:13Z",
  "declaration" : {
    "code" : "func UIImageWriteToSavedPhotosAlbum(_ image: UIImage, _ completionTarget: Any?, _ completionSelector: Selector?, _ contextInfo: UnsafeMutableRawPointer?)",
    "language" : "swift"
  },
  "id" : "25194D17-8E39-4EB2-9AD9-7FB3A1E1F638",
  "kind" : "function",
  "language" : "swift",
  "module" : "UIKit",
  "overview" : "## Discussion\n\nWhen used with an image picker controller, you would typically call this function within your [doc:\/\/com.apple.uikit\/documentation\/UIKit\/UIImagePickerControllerDelegate\/imagePickerController(_:didFinishPickingMediaWithInfo:)] delegate method implementation.\n\nThe use of the `completionTarget`, `completionSelector`, and `contextInfo` parameters is optional and necessary only if you want to be notified asynchronously when the function finishes writing the image to the user’s Camera Roll or Saved Photos album. If you do not want to be notified, pass `nil` for these parameters.\n\nWhen used on an iOS device without a camera, this method adds the image to the Saved Photos album rather than to the Camera Roll album.",
  "platforms" : [
    "iOS",
    "iPadOS",
    "Mac Catalyst",
    "visionOS"
  ],
  "rawMarkdown" : "---\nsource: https:\/\/developer.apple.com\/documentation\/UIKit\/UIImageWriteToSavedPhotosAlbum(_:_:_:_:)\ncrawled: 2025-12-03T05:29:13Z\n---\n\n# UIImageWriteToSavedPhotosAlbum(_:_:_:_:)\n\n**Function**\n\nAdds the specified image to the user’s Camera Roll album.\n\n## Declaration\n\n```swift\nfunc UIImageWriteToSavedPhotosAlbum(_ image: UIImage, _ completionTarget: Any?, _ completionSelector: Selector?, _ contextInfo: UnsafeMutableRawPointer?)\n```\n\n## Parameters\n\n- **image**: The image to write to the Camera Roll album.\n- **completionTarget**: Optionally, the object whose selector should be called after the image has been written to the Camera Roll album.\n- **completionSelector**: The method selector of the `completionTarget` object to call. This optional method should conform to the following signature:\n\n```objc\n- (void)image:(UIImage *)image\n    didFinishSavingWithError:(NSError *)error\n                 contextInfo:(void *)contextInfo;\n```\n- **contextInfo**: An optional pointer to any context-specific data that you want passed to the completion selector.\n\n## Discussion\n\nWhen used with an image picker controller, you would typically call this function within your [doc:\/\/com.apple.uikit\/documentation\/UIKit\/UIImagePickerControllerDelegate\/imagePickerController(_:didFinishPickingMediaWithInfo:)] delegate method implementation.\n\nThe use of the `completionTarget`, `completionSelector`, and `contextInfo` parameters is optional and necessary only if you want to be notified asynchronously when the function finishes writing the image to the user’s Camera Roll or Saved Photos album. If you do not want to be notified, pass `nil` for these parameters.\n\nWhen used on an iOS device without a camera, this method adds the image to the Saved Photos album rather than to the Camera Roll album.\n\n## Photo album\n\n- **UISaveVideoAtPathToSavedPhotosAlbum(_:_:_:_:)**: Adds the movie from the specified path to the user’s Camera Roll album.\n- **UIVideoAtPathIsCompatibleWithSavedPhotosAlbum(_:)**: Returns a Boolean value that indicates whether the specified video is compatible to save to the user’s Camera Roll album.\n\n",
  "sections" : [
    {
      "content" : "",
      "items" : [
        {
          "description" : "Adds the movie from the specified path to the user’s Camera Roll album.",
          "name" : "UISaveVideoAtPathToSavedPhotosAlbum(_:_:_:_:)",
          "url" : "https:\/\/developer.apple.com\/documentation\/UIKit\/UISaveVideoAtPathToSavedPhotosAlbum(_:_:_:_:)"
        },
        {
          "description" : "Returns a Boolean value that indicates whether the specified video is compatible to save to the user’s Camera Roll album.",
          "name" : "UIVideoAtPathIsCompatibleWithSavedPhotosAlbum(_:)",
          "url" : "https:\/\/developer.apple.com\/documentation\/UIKit\/UIVideoAtPathIsCompatibleWithSavedPhotosAlbum(_:)"
        }
      ],
      "title" : "Photo album"
    }
  ],
  "source" : "appleJSON",
  "title" : "UIImageWriteToSavedPhotosAlbum(_:_:_:_:)",
  "url" : "https:\/\/developer.apple.com\/documentation\/UIKit\/UIImageWriteToSavedPhotosAlbum(_:_:_:_:)"
}