{
  "abstract" : "A Boolean value that determines whether HTML5 videos can play automatically or require the user to start playing them.",
  "codeExamples" : [

  ],
  "contentHash" : "8a5dc2a90befabcacc07a267291dde96e8549ce89448379b17818075d95520b3",
  "crawledAt" : "2025-12-01T23:41:13Z",
  "declaration" : {
    "code" : "@MainActor var mediaPlaybackRequiresUserAction: Bool { get set }",
    "language" : "swift"
  },
  "id" : "337E4644-E6C7-458F-A8C0-B4B14FCEA623",
  "kind" : "property",
  "module" : "UIKit",
  "overview" : "## Discussion\n\nThe default value on both iPad and iPhone is [doc:\/\/com.apple.documentation\/documentation\/Swift\/true]. To make media play automatically when loaded, set this property to [doc:\/\/com.apple.documentation\/documentation\/Swift\/false] and ensure the `<audio>` or `<video>` element you want to play has the `autoplay` attribute set.",
  "platforms" : [
    "iOS",
    "iPadOS"
  ],
  "rawMarkdown" : "---\nsource: https:\/\/developer.apple.com\/documentation\/UIKit\/UIWebView\/mediaPlaybackRequiresUserAction\ncrawled: 2025-12-01T23:41:13Z\n---\n\n# mediaPlaybackRequiresUserAction\n\n**Instance Property**\n\nA Boolean value that determines whether HTML5 videos can play automatically or require the user to start playing them.\n\n## Declaration\n\n```swift\n@MainActor var mediaPlaybackRequiresUserAction: Bool { get set }\n```\n\n## Discussion\n\nThe default value on both iPad and iPhone is [doc:\/\/com.apple.documentation\/documentation\/Swift\/true]. To make media play automatically when loaded, set this property to [doc:\/\/com.apple.documentation\/documentation\/Swift\/false] and ensure the `<audio>` or `<video>` element you want to play has the `autoplay` attribute set.\n\n## Managing media playback\n\n- **allowsInlineMediaPlayback**: A Boolean value that determines whether HTML5 videos play inline or use the native full-screen controller.\n- **mediaPlaybackAllowsAirPlay**: A Boolean value that determines whether Air Play is allowed from this view.\n- **allowsPictureInPictureMediaPlayback**: A Boolean value that determines whether Picture in Picture playback is allowed from this view.\n\n",
  "sections" : [
    {
      "content" : "",
      "items" : [
        {
          "description" : "A Boolean value that determines whether HTML5 videos play inline or use the native full-screen controller.",
          "name" : "allowsInlineMediaPlayback",
          "url" : "https:\/\/developer.apple.com\/documentation\/UIKit\/UIWebView\/allowsInlineMediaPlayback"
        },
        {
          "description" : "A Boolean value that determines whether Air Play is allowed from this view.",
          "name" : "mediaPlaybackAllowsAirPlay",
          "url" : "https:\/\/developer.apple.com\/documentation\/UIKit\/UIWebView\/mediaPlaybackAllowsAirPlay"
        },
        {
          "description" : "A Boolean value that determines whether Picture in Picture playback is allowed from this view.",
          "name" : "allowsPictureInPictureMediaPlayback",
          "url" : "https:\/\/developer.apple.com\/documentation\/UIKit\/UIWebView\/allowsPictureInPictureMediaPlayback"
        }
      ],
      "title" : "Managing media playback"
    }
  ],
  "source" : "appleJSON",
  "title" : "mediaPlaybackRequiresUserAction",
  "url" : "https:\/\/developer.apple.com\/documentation\/UIKit\/UIWebView\/mediaPlaybackRequiresUserAction"
}