{
  "abstract" : "Retrieves an array of index paths for the supplementary views you want to add to the layout.",
  "codeExamples" : [

  ],
  "contentHash" : "698b3088f181196948bf5239df3e7061207fb0dc008db8f8c500939962b6dc59",
  "crawledAt" : "2025-12-02T21:23:57Z",
  "declaration" : {
    "code" : "@MainActor func indexPathsToInsertForSupplementaryView(ofKind elementKind: String) -> [IndexPath]",
    "language" : "swift"
  },
  "id" : "AE1723E0-9BF5-4882-B0F4-D24958144A10",
  "kind" : "method",
  "language" : "swift",
  "module" : "UIKit",
  "overview" : "## Return Value\n\nAn array of [doc:\/\/com.apple.documentation\/documentation\/Foundation\/NSIndexPath] objects indicating the location of the new supplementary views, or an empty array if you don’t want to add any supplementary views.\n\n## Discussion\n\nThe collection view calls this method whenever you add cells or sections to the collection view. Implementing this method gives your layout object an opportunity to add new supplementary views to complement the additions.\n\nThe collection view calls this method between its calls to [doc:\/\/com.apple.uikit\/documentation\/UIKit\/UICollectionViewLayout\/prepare(forCollectionViewUpdates:)] and [doc:\/\/com.apple.uikit\/documentation\/UIKit\/UICollectionViewLayout\/finalizeCollectionViewUpdates()].",
  "platforms" : [
    "iOS",
    "iPadOS",
    "Mac Catalyst",
    "tvOS",
    "visionOS"
  ],
  "rawMarkdown" : "---\nsource: https:\/\/developer.apple.com\/documentation\/UIKit\/UICollectionViewLayout\/indexPathsToInsertForSupplementaryView(ofKind:)\ncrawled: 2025-12-02T21:23:57Z\n---\n\n# indexPathsToInsertForSupplementaryView(ofKind:)\n\n**Instance Method**\n\nRetrieves an array of index paths for the supplementary views you want to add to the layout.\n\n## Declaration\n\n```swift\n@MainActor func indexPathsToInsertForSupplementaryView(ofKind elementKind: String) -> [IndexPath]\n```\n\n## Parameters\n\n- **elementKind**: The specific type of supplementary view.\n\n## Return Value\n\nAn array of [doc:\/\/com.apple.documentation\/documentation\/Foundation\/NSIndexPath] objects indicating the location of the new supplementary views, or an empty array if you don’t want to add any supplementary views.\n\n## Discussion\n\nThe collection view calls this method whenever you add cells or sections to the collection view. Implementing this method gives your layout object an opportunity to add new supplementary views to complement the additions.\n\nThe collection view calls this method between its calls to [doc:\/\/com.apple.uikit\/documentation\/UIKit\/UICollectionViewLayout\/prepare(forCollectionViewUpdates:)] and [doc:\/\/com.apple.uikit\/documentation\/UIKit\/UICollectionViewLayout\/finalizeCollectionViewUpdates()].\n\n## Responding to collection view updates\n\n- **prepare(forCollectionViewUpdates:)**: Notifies the layout object that the contents of the collection view are about to change.\n- **finalizeCollectionViewUpdates()**: Performs any additional animations or clean up needed during a collection view update.\n- **indexPathsToInsertForDecorationView(ofKind:)**: Retrieves an array of index paths representing the decoration views to add.\n- **initialLayoutAttributesForAppearingItem(at:)**: Retrieves the starting layout information for an item being inserted into the collection view.\n- **initialLayoutAttributesForAppearingSupplementaryElement(ofKind:at:)**: Retrieves the starting layout information for a supplementary view being inserted into the collection view.\n- **initialLayoutAttributesForAppearingDecorationElement(ofKind:at:)**: Retrieves the starting layout information for a decoration view being inserted into the collection view.\n- **indexPathsToDeleteForSupplementaryView(ofKind:)**: Retrieves an array of index paths representing the supplementary views to remove.\n- **indexPathsToDeleteForDecorationView(ofKind:)**: Retrieves an array of index paths representing the decoration views to remove.\n- **finalLayoutAttributesForDisappearingItem(at:)**: Retrieves the final layout information for an item that is about to be removed from the collection view.\n- **finalLayoutAttributesForDisappearingSupplementaryElement(ofKind:at:)**: Retrieves the final layout information for a supplementary view that is about to be removed from the collection view.\n- **finalLayoutAttributesForDisappearingDecorationElement(ofKind:at:)**: Retrieves the final layout information for a decoration view that is about to be removed from the collection view.\n- **targetIndexPath(forInteractivelyMovingItem:withPosition:)**: Retrieves the index path to for an item when it is at the specified location in the collection view’s bounds.\n\n",
  "sections" : [
    {
      "content" : "",
      "items" : [
        {
          "description" : "Notifies the layout object that the contents of the collection view are about to change.",
          "name" : "prepare(forCollectionViewUpdates:)",
          "url" : "https:\/\/developer.apple.com\/documentation\/UIKit\/UICollectionViewLayout\/prepare(forCollectionViewUpdates:)"
        },
        {
          "description" : "Performs any additional animations or clean up needed during a collection view update.",
          "name" : "finalizeCollectionViewUpdates()",
          "url" : "https:\/\/developer.apple.com\/documentation\/UIKit\/UICollectionViewLayout\/finalizeCollectionViewUpdates()"
        },
        {
          "description" : "Retrieves an array of index paths representing the decoration views to add.",
          "name" : "indexPathsToInsertForDecorationView(ofKind:)",
          "url" : "https:\/\/developer.apple.com\/documentation\/UIKit\/UICollectionViewLayout\/indexPathsToInsertForDecorationView(ofKind:)"
        },
        {
          "description" : "Retrieves the starting layout information for an item being inserted into the collection view.",
          "name" : "initialLayoutAttributesForAppearingItem(at:)",
          "url" : "https:\/\/developer.apple.com\/documentation\/UIKit\/UICollectionViewLayout\/initialLayoutAttributesForAppearingItem(at:)"
        },
        {
          "description" : "Retrieves the starting layout information for a supplementary view being inserted into the collection view.",
          "name" : "initialLayoutAttributesForAppearingSupplementaryElement(ofKind:at:)",
          "url" : "https:\/\/developer.apple.com\/documentation\/UIKit\/UICollectionViewLayout\/initialLayoutAttributesForAppearingSupplementaryElement(ofKind:at:)"
        },
        {
          "description" : "Retrieves the starting layout information for a decoration view being inserted into the collection view.",
          "name" : "initialLayoutAttributesForAppearingDecorationElement(ofKind:at:)",
          "url" : "https:\/\/developer.apple.com\/documentation\/UIKit\/UICollectionViewLayout\/initialLayoutAttributesForAppearingDecorationElement(ofKind:at:)"
        },
        {
          "description" : "Retrieves an array of index paths representing the supplementary views to remove.",
          "name" : "indexPathsToDeleteForSupplementaryView(ofKind:)",
          "url" : "https:\/\/developer.apple.com\/documentation\/UIKit\/UICollectionViewLayout\/indexPathsToDeleteForSupplementaryView(ofKind:)"
        },
        {
          "description" : "Retrieves an array of index paths representing the decoration views to remove.",
          "name" : "indexPathsToDeleteForDecorationView(ofKind:)",
          "url" : "https:\/\/developer.apple.com\/documentation\/UIKit\/UICollectionViewLayout\/indexPathsToDeleteForDecorationView(ofKind:)"
        },
        {
          "description" : "Retrieves the final layout information for an item that is about to be removed from the collection view.",
          "name" : "finalLayoutAttributesForDisappearingItem(at:)",
          "url" : "https:\/\/developer.apple.com\/documentation\/UIKit\/UICollectionViewLayout\/finalLayoutAttributesForDisappearingItem(at:)"
        },
        {
          "description" : "Retrieves the final layout information for a supplementary view that is about to be removed from the collection view.",
          "name" : "finalLayoutAttributesForDisappearingSupplementaryElement(ofKind:at:)",
          "url" : "https:\/\/developer.apple.com\/documentation\/UIKit\/UICollectionViewLayout\/finalLayoutAttributesForDisappearingSupplementaryElement(ofKind:at:)"
        },
        {
          "description" : "Retrieves the final layout information for a decoration view that is about to be removed from the collection view.",
          "name" : "finalLayoutAttributesForDisappearingDecorationElement(ofKind:at:)",
          "url" : "https:\/\/developer.apple.com\/documentation\/UIKit\/UICollectionViewLayout\/finalLayoutAttributesForDisappearingDecorationElement(ofKind:at:)"
        },
        {
          "description" : "Retrieves the index path to for an item when it is at the specified location in the collection view’s bounds.",
          "name" : "targetIndexPath(forInteractivelyMovingItem:withPosition:)",
          "url" : "https:\/\/developer.apple.com\/documentation\/UIKit\/UICollectionViewLayout\/targetIndexPath(forInteractivelyMovingItem:withPosition:)"
        }
      ],
      "title" : "Responding to collection view updates"
    }
  ],
  "source" : "appleJSON",
  "title" : "indexPathsToInsertForSupplementaryView(ofKind:)",
  "url" : "https:\/\/developer.apple.com\/documentation\/UIKit\/UICollectionViewLayout\/indexPathsToInsertForSupplementaryView(ofKind:)"
}