{
  "abstract" : "The natural scale factor associated with the screen.",
  "codeExamples" : [

  ],
  "contentHash" : "4a2af5ce56872d9d10b99d3a4cffc7f206d634d8a33925d4f93754f0890d7861",
  "crawledAt" : "2025-12-04T03:35:52Z",
  "declaration" : {
    "code" : "@MainActor var scale: CGFloat { get }",
    "language" : "swift"
  },
  "id" : "1A3D19AF-3FCD-44A8-A3A8-0642C0525D6B",
  "kind" : "property",
  "language" : "swift",
  "module" : "UIKit",
  "overview" : "## Discussion\n\nThis value reflects the scale factor needed to convert from the default logical coordinate space into the device coordinate space of this screen. The default logical coordinate space is measured using points. For Retina displays, the scale factor may be `3.0` or `2.0` and one point can represented by nine or four pixels, respectively. For standard-resolution displays, the scale factor is `1.0` and one point equals one pixel.",
  "platforms" : [
    "iOS",
    "iPadOS",
    "Mac Catalyst",
    "tvOS"
  ],
  "rawMarkdown" : "---\nsource: https:\/\/developer.apple.com\/documentation\/UIKit\/UIScreen\/scale\ncrawled: 2025-12-04T03:35:52Z\n---\n\n# scale\n\n**Instance Property**\n\nThe natural scale factor associated with the screen.\n\n## Declaration\n\n```swift\n@MainActor var scale: CGFloat { get }\n```\n\n## Discussion\n\nThis value reflects the scale factor needed to convert from the default logical coordinate space into the device coordinate space of this screen. The default logical coordinate space is measured using points. For Retina displays, the scale factor may be `3.0` or `2.0` and one point can represented by nine or four pixels, respectively. For standard-resolution displays, the scale factor is `1.0` and one point equals one pixel.\n\n## Getting the size and scale\n\n- **bounds**: The bounding rectangle of the screen, measured in points.\n- **nativeBounds**: The bounding rectangle of the physical screen, measured in pixels.\n- **nativeScale**: The native scale factor for the physical screen.\n\n",
  "sections" : [
    {
      "content" : "",
      "items" : [
        {
          "description" : "The bounding rectangle of the screen, measured in points.",
          "name" : "bounds",
          "url" : "https:\/\/developer.apple.com\/documentation\/UIKit\/UIScreen\/bounds"
        },
        {
          "description" : "The bounding rectangle of the physical screen, measured in pixels.",
          "name" : "nativeBounds",
          "url" : "https:\/\/developer.apple.com\/documentation\/UIKit\/UIScreen\/nativeBounds"
        },
        {
          "description" : "The native scale factor for the physical screen.",
          "name" : "nativeScale",
          "url" : "https:\/\/developer.apple.com\/documentation\/UIKit\/UIScreen\/nativeScale"
        }
      ],
      "title" : "Getting the size and scale"
    }
  ],
  "source" : "appleJSON",
  "title" : "scale",
  "url" : "https:\/\/developer.apple.com\/documentation\/UIKit\/UIScreen\/scale"
}