{
  "abstract" : "The video quality to use when saving a trimmed movie.",
  "codeExamples" : [

  ],
  "contentHash" : "a657698ac50615abdb0b272d347f8f9b1d59e7e699b84b69068c5578f625ef3e",
  "crawledAt" : "2025-12-03T18:36:40Z",
  "declaration" : {
    "code" : "@MainActor var videoQuality: UIImagePickerController.QualityType { get set }",
    "language" : "swift"
  },
  "id" : "3EDB0B30-F225-4D71-8C9B-85721DD8496D",
  "kind" : "property",
  "language" : "swift",
  "module" : "UIKit",
  "overview" : "## Discussion\n\nThe available video qualities are described in the [doc:\/\/com.apple.uikit\/documentation\/UIKit\/UIImagePickerController\/QualityType] enumeration. The default value for this property is [doc:\/\/com.apple.uikit\/documentation\/UIKit\/UIImagePickerController\/QualityType\/typeLow].\n\nIf a user attempts to reencode a movie to a higher quality, the movie is saved at its existing quality. Reencoding never increases movie dimensions, frame rate, or bit rate.",
  "platforms" : [
    "iOS",
    "iPadOS",
    "Mac Catalyst"
  ],
  "rawMarkdown" : "---\nsource: https:\/\/developer.apple.com\/documentation\/UIKit\/UIVideoEditorController\/videoQuality\ncrawled: 2025-12-03T18:36:40Z\n---\n\n# videoQuality\n\n**Instance Property**\n\nThe video quality to use when saving a trimmed movie.\n\n## Declaration\n\n```swift\n@MainActor var videoQuality: UIImagePickerController.QualityType { get set }\n```\n\n## Discussion\n\nThe available video qualities are described in the [doc:\/\/com.apple.uikit\/documentation\/UIKit\/UIImagePickerController\/QualityType] enumeration. The default value for this property is [doc:\/\/com.apple.uikit\/documentation\/UIKit\/UIImagePickerController\/QualityType\/typeLow].\n\nIf a user attempts to reencode a movie to a higher quality, the movie is saved at its existing quality. Reencoding never increases movie dimensions, frame rate, or bit rate.\n\n## Configuring the editor\n\n- **videoMaximumDuration**: The maximum duration, in seconds, permitted for trimmed movies saved by the video editor.\n- **videoPath**: The filesystem path to the movie to be loaded by the video editor.\n\n",
  "sections" : [
    {
      "content" : "",
      "items" : [
        {
          "description" : "The maximum duration, in seconds, permitted for trimmed movies saved by the video editor.",
          "name" : "videoMaximumDuration",
          "url" : "https:\/\/developer.apple.com\/documentation\/UIKit\/UIVideoEditorController\/videoMaximumDuration"
        },
        {
          "description" : "The filesystem path to the movie to be loaded by the video editor.",
          "name" : "videoPath",
          "url" : "https:\/\/developer.apple.com\/documentation\/UIKit\/UIVideoEditorController\/videoPath"
        }
      ],
      "title" : "Configuring the editor"
    }
  ],
  "source" : "appleJSON",
  "title" : "videoQuality",
  "url" : "https:\/\/developer.apple.com\/documentation\/UIKit\/UIVideoEditorController\/videoQuality"
}