{
  "abstract" : "Posted when the app is about to change the frame of the status bar.",
  "codeExamples" : [

  ],
  "contentHash" : "879ace555fc5dad657b47d5e23d015be7fcac06665598babb9e66234e4524f3d",
  "crawledAt" : "2025-12-05T06:47:21Z",
  "declaration" : {
    "code" : "nonisolated class let willChangeStatusBarFrameNotification: NSNotification.Name",
    "language" : "swift"
  },
  "id" : "C8242DDA-0195-4A11-9400-52C4BE0EC896",
  "kind" : "property",
  "language" : "swift",
  "module" : "UIKit",
  "overview" : "## Discussion\n\nThe `userInfo` dictionary contains an [doc:\/\/com.apple.documentation\/documentation\/Foundation\/NSValue] object that encapsulates a [doc:\/\/com.apple.documentation\/documentation\/CoreFoundation\/CGRect] structure expressing the location and size of the new status bar frame. Use [doc:\/\/com.apple.uikit\/documentation\/UIKit\/UIApplication\/statusBarFrameUserInfoKey] to access this value.",
  "platforms" : [
    "iOS",
    "iPadOS",
    "Mac Catalyst"
  ],
  "rawMarkdown" : "---\nsource: https:\/\/developer.apple.com\/documentation\/UIKit\/UIApplication\/willChangeStatusBarFrameNotification\ncrawled: 2025-12-05T06:47:21Z\n---\n\n# willChangeStatusBarFrameNotification\n\n**Type Property**\n\nPosted when the app is about to change the frame of the status bar.\n\n## Declaration\n\n```swift\nnonisolated class let willChangeStatusBarFrameNotification: NSNotification.Name\n```\n\n## Discussion\n\nThe `userInfo` dictionary contains an [doc:\/\/com.apple.documentation\/documentation\/Foundation\/NSValue] object that encapsulates a [doc:\/\/com.apple.documentation\/documentation\/CoreFoundation\/CGRect] structure expressing the location and size of the new status bar frame. Use [doc:\/\/com.apple.uikit\/documentation\/UIKit\/UIApplication\/statusBarFrameUserInfoKey] to access this value.\n\n## Deprecated notifications\n\n- **didChangeStatusBarFrameNotification**: Posted when the frame of the status bar changes.\n- **willChangeStatusBarOrientationNotification**: Posted when the app is about to change the orientation of its interface.\n- **didChangeStatusBarOrientationNotification**: Posted when the orientation of the app’s user interface changes.\n\n",
  "sections" : [
    {
      "content" : "",
      "items" : [
        {
          "description" : "Posted when the frame of the status bar changes.",
          "name" : "didChangeStatusBarFrameNotification",
          "url" : "https:\/\/developer.apple.com\/documentation\/UIKit\/UIApplication\/didChangeStatusBarFrameNotification"
        },
        {
          "description" : "Posted when the app is about to change the orientation of its interface.",
          "name" : "willChangeStatusBarOrientationNotification",
          "url" : "https:\/\/developer.apple.com\/documentation\/UIKit\/UIApplication\/willChangeStatusBarOrientationNotification"
        },
        {
          "description" : "Posted when the orientation of the app’s user interface changes.",
          "name" : "didChangeStatusBarOrientationNotification",
          "url" : "https:\/\/developer.apple.com\/documentation\/UIKit\/UIApplication\/didChangeStatusBarOrientationNotification"
        }
      ],
      "title" : "Deprecated notifications"
    }
  ],
  "source" : "appleJSON",
  "title" : "willChangeStatusBarFrameNotification",
  "url" : "https:\/\/developer.apple.com\/documentation\/UIKit\/UIApplication\/willChangeStatusBarFrameNotification"
}