{
  "abstract" : "The image has been rotated 90° counterclockwise and flipped horizontally from the orientation of its original pixel data.",
  "codeExamples" : [

  ],
  "contentHash" : "4e2f2375815feea8e9c8414fba9d718ff715c3480c40eaaf99f579567cd56e50",
  "crawledAt" : "2025-12-02T07:16:36Z",
  "declaration" : {
    "code" : "case rightMirrored",
    "language" : "swift"
  },
  "id" : "651A8C48-ECE8-4BE0-9925-E97B6C2DFF54",
  "kind" : "unknown",
  "module" : "UIKit",
  "overview" : "## Discussion\n\nIf an image is encoded with this orientation, then displayed by software unaware of orientation metadata, the image appears to be horizontally mirrored, then rotated 90° clockwise. (That is, to present the image in its intended orientation, you can rotate  90° counter-clockwise, then flip horizontally.)\n\n",
  "platforms" : [
    "iOS",
    "iPadOS",
    "Mac Catalyst",
    "tvOS",
    "visionOS",
    "watchOS"
  ],
  "rawMarkdown" : "---\nsource: https:\/\/developer.apple.com\/documentation\/UIKit\/UIImage\/Orientation\/rightMirrored\ncrawled: 2025-12-02T07:16:36Z\n---\n\n# UIImage.Orientation.rightMirrored\n\n**Case**\n\nThe image has been rotated 90° counterclockwise and flipped horizontally from the orientation of its original pixel data.\n\n## Declaration\n\n```swift\ncase rightMirrored\n```\n\n## Discussion\n\nIf an image is encoded with this orientation, then displayed by software unaware of orientation metadata, the image appears to be horizontally mirrored, then rotated 90° clockwise. (That is, to present the image in its intended orientation, you can rotate  90° counter-clockwise, then flip horizontally.)\n\n\n\n## Related Documentation\n\n- **CGImagePropertyOrientation.rightMirrored**: The encoded image data is horizontally flipped and rotated 90° clockwise from the image’s intended display orientation.\n\n## Image orientations\n\n- **UIImage.Orientation.up**: The original pixel data matches the image’s intended display orientation.\n- **UIImage.Orientation.down**: The image has been rotated 180° from the orientation of its original pixel data.\n- **UIImage.Orientation.left**: The image has been rotated 90° counterclockwise from the orientation of its original pixel data.\n- **UIImage.Orientation.right**: The image has been rotated 90° clockwise from the orientation of its original pixel data.\n- **UIImage.Orientation.upMirrored**: The image has been horizontally flipped from the orientation of its original pixel data.\n- **UIImage.Orientation.downMirrored**: The image has been vertically flipped from the orientation of its original pixel data.\n- **UIImage.Orientation.leftMirrored**: The image has been rotated 90° clockwise and flipped horizontally from the orientation of its original pixel data.\n\n",
  "sections" : [
    {
      "content" : "",
      "items" : [
        {
          "description" : "The encoded image data is horizontally flipped and rotated 90° clockwise from the image’s intended display orientation.",
          "name" : "CGImagePropertyOrientation.rightMirrored",
          "url" : "https:\/\/developer.apple.com\/documentation\/ImageIO\/CGImagePropertyOrientation\/rightMirrored"
        }
      ],
      "title" : "Related Documentation"
    },
    {
      "content" : "",
      "items" : [
        {
          "description" : "The original pixel data matches the image’s intended display orientation.",
          "name" : "UIImage.Orientation.up",
          "url" : "https:\/\/developer.apple.com\/documentation\/UIKit\/UIImage\/Orientation\/up"
        },
        {
          "description" : "The image has been rotated 180° from the orientation of its original pixel data.",
          "name" : "UIImage.Orientation.down",
          "url" : "https:\/\/developer.apple.com\/documentation\/UIKit\/UIImage\/Orientation\/down"
        },
        {
          "description" : "The image has been rotated 90° counterclockwise from the orientation of its original pixel data.",
          "name" : "UIImage.Orientation.left",
          "url" : "https:\/\/developer.apple.com\/documentation\/UIKit\/UIImage\/Orientation\/left"
        },
        {
          "description" : "The image has been rotated 90° clockwise from the orientation of its original pixel data.",
          "name" : "UIImage.Orientation.right",
          "url" : "https:\/\/developer.apple.com\/documentation\/UIKit\/UIImage\/Orientation\/right"
        },
        {
          "description" : "The image has been horizontally flipped from the orientation of its original pixel data.",
          "name" : "UIImage.Orientation.upMirrored",
          "url" : "https:\/\/developer.apple.com\/documentation\/UIKit\/UIImage\/Orientation\/upMirrored"
        },
        {
          "description" : "The image has been vertically flipped from the orientation of its original pixel data.",
          "name" : "UIImage.Orientation.downMirrored",
          "url" : "https:\/\/developer.apple.com\/documentation\/UIKit\/UIImage\/Orientation\/downMirrored"
        },
        {
          "description" : "The image has been rotated 90° clockwise and flipped horizontally from the orientation of its original pixel data.",
          "name" : "UIImage.Orientation.leftMirrored",
          "url" : "https:\/\/developer.apple.com\/documentation\/UIKit\/UIImage\/Orientation\/leftMirrored"
        }
      ],
      "title" : "Image orientations"
    }
  ],
  "source" : "appleJSON",
  "title" : "UIImage.Orientation.rightMirrored",
  "url" : "https:\/\/developer.apple.com\/documentation\/UIKit\/UIImage\/Orientation\/rightMirrored"
}