{
  "abstract" : "Notifies the delegate when dragged content exits the table view’s bounds rectangle.",
  "codeExamples" : [

  ],
  "contentHash" : "5e14a3110e33f9cfcde018c5baca2b94842be15a218e925f8eb252a9bbc993e8",
  "crawledAt" : "2025-12-05T05:21:23Z",
  "declaration" : {
    "code" : "@MainActor optional func tableView(_ tableView: UITableView, dropSessionDidExit session: any UIDropSession)",
    "language" : "swift"
  },
  "id" : "9E0E7659-4F73-43E4-AFCF-7B65239D451A",
  "kind" : "method",
  "language" : "swift",
  "module" : "UIKit",
  "overview" : "## Discussion\n\nThe table view calls this method when dragged content exits its bounds rectangle. This method isn’t called again until the dragged content enters the table view’s bounds (triggering a call to the [doc:\/\/com.apple.uikit\/documentation\/UIKit\/UITableViewDropDelegate\/tableView(_:dropSessionDidEnter:)] method) and exits again.\n\nUse this method to clean up any state information that you configured in your [doc:\/\/com.apple.uikit\/documentation\/UIKit\/UITableViewDropDelegate\/tableView(_:dropSessionDidEnter:)] method.",
  "platforms" : [
    "iOS",
    "iPadOS",
    "Mac Catalyst",
    "visionOS"
  ],
  "rawMarkdown" : "---\nsource: https:\/\/developer.apple.com\/documentation\/UIKit\/UITableViewDropDelegate\/tableView(_:dropSessionDidExit:)\ncrawled: 2025-12-05T05:21:23Z\n---\n\n# tableView(_:dropSessionDidExit:)\n\n**Instance Method**\n\nNotifies the delegate when dragged content exits the table view’s bounds rectangle.\n\n## Declaration\n\n```swift\n@MainActor optional func tableView(_ tableView: UITableView, dropSessionDidExit session: any UIDropSession)\n```\n\n## Parameters\n\n- **tableView**: The collection view that was tracking the dragged content.\n- **session**: The drop session object containing information about the data being dragged.\n\n## Discussion\n\nThe table view calls this method when dragged content exits its bounds rectangle. This method isn’t called again until the dragged content enters the table view’s bounds (triggering a call to the [doc:\/\/com.apple.uikit\/documentation\/UIKit\/UITableViewDropDelegate\/tableView(_:dropSessionDidEnter:)] method) and exits again.\n\nUse this method to clean up any state information that you configured in your [doc:\/\/com.apple.uikit\/documentation\/UIKit\/UITableViewDropDelegate\/tableView(_:dropSessionDidEnter:)] method.\n\n## Tracking the drag movements\n\n- **tableView(_:dropSessionDidUpdate:withDestinationIndexPath:)**: Proposes how to handle a drop at the specified location in the table view.\n- **tableView(_:dropSessionDidEnter:)**: Notifies the delegate when dragged content enters the table view’s bounds rectangle.\n- **tableView(_:dropSessionDidEnd:)**: Notifies the delegate when the drag operation ends.\n\n",
  "sections" : [
    {
      "content" : "",
      "items" : [
        {
          "description" : "Proposes how to handle a drop at the specified location in the table view.",
          "name" : "tableView(_:dropSessionDidUpdate:withDestinationIndexPath:)",
          "url" : "https:\/\/developer.apple.com\/documentation\/UIKit\/UITableViewDropDelegate\/tableView(_:dropSessionDidUpdate:withDestinationIndexPath:)"
        },
        {
          "description" : "Notifies the delegate when dragged content enters the table view’s bounds rectangle.",
          "name" : "tableView(_:dropSessionDidEnter:)",
          "url" : "https:\/\/developer.apple.com\/documentation\/UIKit\/UITableViewDropDelegate\/tableView(_:dropSessionDidEnter:)"
        },
        {
          "description" : "Notifies the delegate when the drag operation ends.",
          "name" : "tableView(_:dropSessionDidEnd:)",
          "url" : "https:\/\/developer.apple.com\/documentation\/UIKit\/UITableViewDropDelegate\/tableView(_:dropSessionDidEnd:)"
        }
      ],
      "title" : "Tracking the drag movements"
    }
  ],
  "source" : "appleJSON",
  "title" : "tableView(_:dropSessionDidExit:)",
  "url" : "https:\/\/developer.apple.com\/documentation\/UIKit\/UITableViewDropDelegate\/tableView(_:dropSessionDidExit:)"
}