{
  "abstract" : "A bitmask of the notification types that your app is allowed to use.",
  "codeExamples" : [

  ],
  "contentHash" : "a8e263471befb52f896c637699bcef21a5c5d5e85463a0b9981c0c0d3cab91d0",
  "crawledAt" : "2025-12-04T12:02:37Z",
  "declaration" : {
    "code" : "@MainActor var types: UIUserNotificationType { get }",
    "language" : "swift"
  },
  "id" : "88846163-F31A-4DEF-A676-0CCBC6E772C1",
  "kind" : "property",
  "language" : "swift",
  "module" : "UIKit",
  "overview" : "## Discussion\n\nWhen you create a new settings object, this property contains all of the types you specified. After you register your request with the app, the app provides you with a new settings object that contains only the types that your app is allowed to use.",
  "platforms" : [
    "iOS",
    "iPadOS",
    "Mac Catalyst"
  ],
  "rawMarkdown" : "---\nsource: https:\/\/developer.apple.com\/documentation\/UIKit\/UIUserNotificationSettings\/types\ncrawled: 2025-12-04T12:02:37Z\n---\n\n# types\n\n**Instance Property**\n\nA bitmask of the notification types that your app is allowed to use.\n\n## Declaration\n\n```swift\n@MainActor var types: UIUserNotificationType { get }\n```\n\n## Discussion\n\nWhen you create a new settings object, this property contains all of the types you specified. After you register your request with the app, the app provides you with a new settings object that contains only the types that your app is allowed to use.\n\n## Related Documentation\n\n- **UIUserNotificationSettings**: The types of notifications that can be displayed to the user by your app.\n\n## Getting the configured settings\n\n- **categories**: The app’s registered groups of actions.\n\n",
  "sections" : [
    {
      "content" : "",
      "items" : [
        {
          "description" : "The types of notifications that can be displayed to the user by your app.",
          "name" : "UIUserNotificationSettings",
          "url" : "https:\/\/developer.apple.com\/documentation\/UIKit\/UIUserNotificationSettings"
        }
      ],
      "title" : "Related Documentation"
    },
    {
      "content" : "",
      "items" : [
        {
          "description" : "The app’s registered groups of actions.",
          "name" : "categories",
          "url" : "https:\/\/developer.apple.com\/documentation\/UIKit\/UIUserNotificationSettings\/categories"
        }
      ],
      "title" : "Getting the configured settings"
    }
  ],
  "source" : "appleJSON",
  "title" : "types",
  "url" : "https:\/\/developer.apple.com\/documentation\/UIKit\/UIUserNotificationSettings\/types"
}