{
  "abstract" : "An object that can provide shareable items for a scene.",
  "codeExamples" : [

  ],
  "contentHash" : "a73e22bc55e286792fea98f77ea5f8fb21d7ae2e0efa071dbd1e344d8a43fe27",
  "crawledAt" : "2025-12-03T19:06:19Z",
  "declaration" : {
    "code" : "@MainActor weak var activityItemsConfigurationSource: (any UIActivityItemsConfigurationProviding)? { get set }",
    "language" : "swift"
  },
  "id" : "4B4C0526-1D40-42AD-BAA8-CBD136ED7407",
  "kind" : "property",
  "language" : "swift",
  "module" : "UIKit",
  "overview" : "## Discussion\n\nWhen a user asks Siri to “share this” on iOS, or clicks an [doc:\/\/com.apple.documentation\/documentation\/AppKit\/NSSharingServicePickerToolbarItem] in the toolbar of an app built with Mac Catalyst, the system asks the current scene or view controller what to share. You can supply multiple representations of the current content, such as a file, image, and URL.\n\nYou can implement this property or provide configurations from view controllers with [doc:\/\/com.apple.uikit\/documentation\/UIKit\/UIActivityItemsConfigurationProviding\/activityItemsConfiguration].\n\nIf you don’t provide a [doc:\/\/com.apple.uikit\/documentation\/UIKit\/UIActivityItemsConfiguration] in either of these ways, the system may fall back to sharing either the [doc:\/\/com.apple.documentation\/documentation\/Foundation\/NSUserActivity\/webpageURL] of your app’s current user activity or a screenshot of the scene.",
  "platforms" : [
    "iOS",
    "iPadOS",
    "Mac Catalyst",
    "visionOS"
  ],
  "rawMarkdown" : "---\nsource: https:\/\/developer.apple.com\/documentation\/UIKit\/UIWindowScene\/activityItemsConfigurationSource\ncrawled: 2025-12-03T19:06:19Z\n---\n\n# activityItemsConfigurationSource\n\n**Instance Property**\n\nAn object that can provide shareable items for a scene.\n\n## Declaration\n\n```swift\n@MainActor weak var activityItemsConfigurationSource: (any UIActivityItemsConfigurationProviding)? { get set }\n```\n\n## Discussion\n\nWhen a user asks Siri to “share this” on iOS, or clicks an [doc:\/\/com.apple.documentation\/documentation\/AppKit\/NSSharingServicePickerToolbarItem] in the toolbar of an app built with Mac Catalyst, the system asks the current scene or view controller what to share. You can supply multiple representations of the current content, such as a file, image, and URL.\n\nYou can implement this property or provide configurations from view controllers with [doc:\/\/com.apple.uikit\/documentation\/UIKit\/UIActivityItemsConfigurationProviding\/activityItemsConfiguration].\n\nIf you don’t provide a [doc:\/\/com.apple.uikit\/documentation\/UIKit\/UIActivityItemsConfiguration] in either of these ways, the system may fall back to sharing either the [doc:\/\/com.apple.documentation\/documentation\/Foundation\/NSUserActivity\/webpageURL] of your app’s current user activity or a screenshot of the scene.\n\n## Sharing content\n\n- **UIActivityItemsConfigurationProviding**: An interface that provides a source for shareable content to fulfill user requests to share current content.\n\n",
  "sections" : [
    {
      "content" : "",
      "items" : [
        {
          "description" : "An interface that provides a source for shareable content to fulfill user requests to share current content.",
          "name" : "UIActivityItemsConfigurationProviding",
          "url" : "https:\/\/developer.apple.com\/documentation\/UIKit\/UIActivityItemsConfigurationProviding"
        }
      ],
      "title" : "Sharing content"
    }
  ],
  "source" : "appleJSON",
  "title" : "activityItemsConfigurationSource",
  "url" : "https:\/\/developer.apple.com\/documentation\/UIKit\/UIWindowScene\/activityItemsConfigurationSource"
}