{
  "abstract" : "A notification that posts whenever a window becomes the key window.",
  "codeExamples" : [

  ],
  "contentHash" : "96975031609cddd793fc273771a40cce96a926b9c9797a60329049ed33278ffe",
  "crawledAt" : "2025-12-01T23:41:38Z",
  "declaration" : {
    "code" : "nonisolated class let didBecomeKeyNotification: NSNotification.Name",
    "language" : "swift"
  },
  "id" : "0E43F74E-E903-4B4A-ADC4-32C4FA5CB47B",
  "kind" : "property",
  "module" : "UIKit",
  "overview" : "## Discussion\n\nThe notification object is the window that became key. This notification doesn’t contain a `userInfo` dictionary.\n\nThe system posts this notification on the main actor. In iOS 15 and later, the system posts this notification when the window becomes the key window of its scene. In iOS 14 and earlier, the system posts this notification when the window becomes the key window of the app.",
  "platforms" : [
    "iOS",
    "iPadOS",
    "Mac Catalyst",
    "tvOS",
    "visionOS"
  ],
  "rawMarkdown" : "---\nsource: https:\/\/developer.apple.com\/documentation\/UIKit\/UIWindow\/didBecomeKeyNotification\ncrawled: 2025-12-01T23:41:38Z\n---\n\n# didBecomeKeyNotification\n\n**Type Property**\n\nA notification that posts whenever a window becomes the key window.\n\n## Declaration\n\n```swift\nnonisolated class let didBecomeKeyNotification: NSNotification.Name\n```\n\n## Discussion\n\nThe notification object is the window that became key. This notification doesn’t contain a `userInfo` dictionary.\n\nThe system posts this notification on the main actor. In iOS 15 and later, the system posts this notification when the window becomes the key window of its scene. In iOS 14 and earlier, the system posts this notification when the window becomes the key window of the app.\n\n## Responding to window-related notifications\n\n- **didBecomeVisibleNotification**: A notification that posts when a window becomes visible.\n- **didBecomeHiddenNotification**: A notification that posts when a window becomes hidden.\n- **didResignKeyNotification**: A notification that posts whenever a window resigns its status as main window.\n\n",
  "sections" : [
    {
      "content" : "",
      "items" : [
        {
          "description" : "A notification that posts when a window becomes visible.",
          "name" : "didBecomeVisibleNotification",
          "url" : "https:\/\/developer.apple.com\/documentation\/UIKit\/UIWindow\/didBecomeVisibleNotification"
        },
        {
          "description" : "A notification that posts when a window becomes hidden.",
          "name" : "didBecomeHiddenNotification",
          "url" : "https:\/\/developer.apple.com\/documentation\/UIKit\/UIWindow\/didBecomeHiddenNotification"
        },
        {
          "description" : "A notification that posts whenever a window resigns its status as main window.",
          "name" : "didResignKeyNotification",
          "url" : "https:\/\/developer.apple.com\/documentation\/UIKit\/UIWindow\/didResignKeyNotification"
        }
      ],
      "title" : "Responding to window-related notifications"
    }
  ],
  "source" : "appleJSON",
  "title" : "didBecomeKeyNotification",
  "url" : "https:\/\/developer.apple.com\/documentation\/UIKit\/UIWindow\/didBecomeKeyNotification"
}