{
  "abstract" : "The visibility state of the search interface.",
  "codeExamples" : [

  ],
  "contentHash" : "6d87b37027668f085e3f442a82d7e452142598d7c5a5e4a260de7ffafa2e67db",
  "crawledAt" : "2025-12-04T10:31:58Z",
  "declaration" : {
    "code" : "@MainActor var isActive: Bool { get set }",
    "language" : "swift"
  },
  "id" : "5C412938-95FA-4AAD-AF08-D089A2FABF98",
  "kind" : "property",
  "language" : "swift",
  "module" : "UIKit",
  "overview" : "## Discussion\n\nThe default value is [doc:\/\/com.apple.documentation\/documentation\/Swift\/false].\n\nIf you set this value directly, any change is performed without animation. Use [doc:\/\/com.apple.uikit\/documentation\/UIKit\/UISearchDisplayController\/setActive(_:animated:)] if a change in state should be animated.\n\nWhen the user focus in the search field of a managed search bar, the search display controller automatically displays the search interface. You can use this property to force the search interface to appear.",
  "platforms" : [
    "iOS",
    "iPadOS",
    "Mac Catalyst"
  ],
  "rawMarkdown" : "---\nsource: https:\/\/developer.apple.com\/documentation\/UIKit\/UISearchDisplayController\/isActive\ncrawled: 2025-12-04T10:31:58Z\n---\n\n# isActive\n\n**Instance Property**\n\nThe visibility state of the search interface.\n\n## Declaration\n\n```swift\n@MainActor var isActive: Bool { get set }\n```\n\n## Discussion\n\nThe default value is [doc:\/\/com.apple.documentation\/documentation\/Swift\/false].\n\nIf you set this value directly, any change is performed without animation. Use [doc:\/\/com.apple.uikit\/documentation\/UIKit\/UISearchDisplayController\/setActive(_:animated:)] if a change in state should be animated.\n\nWhen the user focus in the search field of a managed search bar, the search display controller automatically displays the search interface. You can use this property to force the search interface to appear.\n\n## Displaying the search Interface\n\n- **setActive(_:animated:)**: Displays or hides the search interface, optionally with animation.\n\n",
  "sections" : [
    {
      "content" : "",
      "items" : [
        {
          "description" : "Displays or hides the search interface, optionally with animation.",
          "name" : "setActive(_:animated:)",
          "url" : "https:\/\/developer.apple.com\/documentation\/UIKit\/UISearchDisplayController\/setActive(_:animated:)"
        }
      ],
      "title" : "Displaying the search Interface"
    }
  ],
  "source" : "appleJSON",
  "title" : "isActive",
  "url" : "https:\/\/developer.apple.com\/documentation\/UIKit\/UISearchDisplayController\/isActive"
}