{
  "abstract" : "Change the system’s interpretation of a color value for display by selecting a color space.",
  "codeExamples" : [

  ],
  "contentHash" : "f764cbe84ef517b7f23a039c49749209df1675f5e49e3ef427b877ccfbd0b471",
  "crawledAt" : "2025-12-04T10:20:31Z",
  "id" : "2C247488-4823-4306-95E3-895358B88944",
  "kind" : "article",
  "language" : "swift",
  "module" : "UIKit",
  "overview" : "## Overview\n\nA [doc:\/\/com.apple.uikit\/documentation\/UIKit\/UIColor] object typically stores its color value as a Core Graphics color ([doc:\/\/com.apple.documentation\/documentation\/CoreGraphics\/CGColor]) in a Core Graphics color space ([doc:\/\/com.apple.documentation\/documentation\/CoreGraphics\/CGColorSpace]). When creating a custom color, the underlying color space and the range of values for each color component vary based on the iOS version.\n\n### Create colors with color spaces\n\nFor apps running on iOS 9 and earlier, colors use one of two color spaces:\n\nThese device color spaces correspond closely to the display characteristics of the sRGB color space. Component values within these color spaces are in the range `0.0` to `1.0`. When you create a color, the color object clamps values to ensure they fit within this range.\n\n### Use extended color spaces\n\nFor apps running on iOS 10 or later, colors use the following extended color spaces:\n\nIn the extended color spaces, [doc:\/\/com.apple.uikit\/documentation\/UIKit\/UIColor] doesn’t clamp values to fit inside the color gamut. Component values may be less than `0.0` or greater than `1.0`. On an sRGB display, such colors are outside the gamut and won’t render accurately. However, the extended color spaces are useful when you want a pixel format and representation that extended color spaces can convert into other color spaces. For example, you can still convert color in the display P3 color space to an extended sRGB format, even if that color isn’t within the sRGB color gamut. When you convert such a color, some of its values fall outside the `0.0` to `1.0` range. However, the color still renders correctly on a device with a P3 display gamut.\n\nWhen employing custom colors, use extended color spaces to store your color values. When representing a color as closely as possible, convert the color from the extended color space into the target color space.",
  "rawMarkdown" : "---\nsource: https:\/\/developer.apple.com\/documentation\/UIKit\/determining-color-values-with-color-spaces\ncrawled: 2025-12-04T10:20:31Z\n---\n\n# Determining color values with color spaces\n\n**Article**\n\nChange the system’s interpretation of a color value for display by selecting a color space.\n\n## Overview\n\nA [doc:\/\/com.apple.uikit\/documentation\/UIKit\/UIColor] object typically stores its color value as a Core Graphics color ([doc:\/\/com.apple.documentation\/documentation\/CoreGraphics\/CGColor]) in a Core Graphics color space ([doc:\/\/com.apple.documentation\/documentation\/CoreGraphics\/CGColorSpace]). When creating a custom color, the underlying color space and the range of values for each color component vary based on the iOS version.\n\n### Create colors with color spaces\n\nFor apps running on iOS 9 and earlier, colors use one of two color spaces:\n\n- Device-dependent Gray\n- Device-dependent RGB\n\nThese device color spaces correspond closely to the display characteristics of the sRGB color space. Component values within these color spaces are in the range `0.0` to `1.0`. When you create a color, the color object clamps values to ensure they fit within this range.\n\n### Use extended color spaces\n\nFor apps running on iOS 10 or later, colors use the following extended color spaces:\n\n- [doc:\/\/com.apple.documentation\/documentation\/CoreGraphics\/CGColorSpace\/extendedGray]\n- [doc:\/\/com.apple.documentation\/documentation\/CoreGraphics\/CGColorSpace\/extendedSRGB]\n\nIn the extended color spaces, [doc:\/\/com.apple.uikit\/documentation\/UIKit\/UIColor] doesn’t clamp values to fit inside the color gamut. Component values may be less than `0.0` or greater than `1.0`. On an sRGB display, such colors are outside the gamut and won’t render accurately. However, the extended color spaces are useful when you want a pixel format and representation that extended color spaces can convert into other color spaces. For example, you can still convert color in the display P3 color space to an extended sRGB format, even if that color isn’t within the sRGB color gamut. When you convert such a color, some of its values fall outside the `0.0` to `1.0` range. However, the color still renders correctly on a device with a P3 display gamut.\n\nWhen employing custom colors, use extended color spaces to store your color values. When representing a color as closely as possible, convert the color from the extended color space into the target color space.\n\n## Getting the color information\n\n- **cgColor**: The Quartz color that corresponds to the color object.\n- **ciColor**: The Core Image color that corresponds to the color object.\n- **getHue(_:saturation:brightness:alpha:)**: Returns the components that form the color in the HSB color space.\n- **getRed(_:green:blue:alpha:)**: Returns the components that form the color in the RGB color space.\n- **getWhite(_:alpha:)**: Returns the grayscale components of the color.\n- **linearExposure**: The linear brightness multiplier that was applied when generating this color. Colors created with an exposure by UIColor create CGColors that are tagged with a contentHeadroom value. While CGColors created without a contentHeadroom tag will return 0 from CGColorGetHeadroom, UIColors generated in a similar fashion return a linearExposure of 1.0.\n- **accessibilityName**: A localized description of the color for accessibility attributes.\n\n",
  "sections" : [
    {
      "content" : "",
      "items" : [
        {
          "description" : "The Quartz color that corresponds to the color object.",
          "name" : "cgColor",
          "url" : "https:\/\/developer.apple.com\/documentation\/UIKit\/UIColor\/cgColor"
        },
        {
          "description" : "The Core Image color that corresponds to the color object.",
          "name" : "ciColor",
          "url" : "https:\/\/developer.apple.com\/documentation\/UIKit\/UIColor\/ciColor"
        },
        {
          "description" : "Returns the components that form the color in the HSB color space.",
          "name" : "getHue(_:saturation:brightness:alpha:)",
          "url" : "https:\/\/developer.apple.com\/documentation\/UIKit\/UIColor\/getHue(_:saturation:brightness:alpha:)"
        },
        {
          "description" : "Returns the components that form the color in the RGB color space.",
          "name" : "getRed(_:green:blue:alpha:)",
          "url" : "https:\/\/developer.apple.com\/documentation\/UIKit\/UIColor\/getRed(_:green:blue:alpha:)"
        },
        {
          "description" : "Returns the grayscale components of the color.",
          "name" : "getWhite(_:alpha:)",
          "url" : "https:\/\/developer.apple.com\/documentation\/UIKit\/UIColor\/getWhite(_:alpha:)"
        },
        {
          "description" : "The linear brightness multiplier that was applied when generating this color. Colors created with an exposure by UIColor create CGColors that are tagged with a contentHeadroom value. While CGColors created without a contentHeadroom tag will return 0 from CGColorGetHeadroom, UIColors generated in a similar fashion return a linearExposure of 1.0.",
          "name" : "linearExposure",
          "url" : "https:\/\/developer.apple.com\/documentation\/UIKit\/UIColor\/linearExposure"
        },
        {
          "description" : "A localized description of the color for accessibility attributes.",
          "name" : "accessibilityName",
          "url" : "https:\/\/developer.apple.com\/documentation\/UIKit\/UIColor\/accessibilityName"
        }
      ],
      "title" : "Getting the color information"
    }
  ],
  "source" : "appleJSON",
  "title" : "Determining color values with color spaces",
  "url" : "https:\/\/developer.apple.com\/documentation\/UIKit\/determining-color-values-with-color-spaces"
}