{
  "abstract" : "The type of picker interface to be displayed by the controller.",
  "codeExamples" : [

  ],
  "contentHash" : "5d05fbb3f8b72188cd31b768c29dee08dffe3f7a59f5cef9e752dfe146a12640",
  "crawledAt" : "2025-12-01T23:24:47Z",
  "declaration" : {
    "code" : "@MainActor var sourceType: UIImagePickerController.SourceType { get set }",
    "language" : "swift"
  },
  "id" : "28556C98-CBE4-4A1E-B11A-8C3831A953F9",
  "kind" : "property",
  "module" : "UIKit",
  "overview" : "## Discussion\n\nPrior to running the picker interface, set this value to the desired source type. The source type you set must be available and an exception is thrown if it is not. If you change this property while the picker is visible, the picker interface changes to match the new value in this property.\n\nThe various source types are listed in the [doc:\/\/com.apple.uikit\/documentation\/UIKit\/UIImagePickerController\/SourceType-swift.enum] enumeration. The default value is [doc:\/\/com.apple.uikit\/documentation\/UIKit\/UIImagePickerController\/SourceType-swift.enum\/photoLibrary].",
  "platforms" : [
    "iOS",
    "iPadOS",
    "Mac Catalyst",
    "visionOS"
  ],
  "rawMarkdown" : "---\nsource: https:\/\/developer.apple.com\/documentation\/UIKit\/UIImagePickerController\/sourceType-swift.property\ncrawled: 2025-12-01T23:24:47Z\n---\n\n# sourceType\n\n**Instance Property**\n\nThe type of picker interface to be displayed by the controller.\n\n## Declaration\n\n```swift\n@MainActor var sourceType: UIImagePickerController.SourceType { get set }\n```\n\n## Discussion\n\nPrior to running the picker interface, set this value to the desired source type. The source type you set must be available and an exception is thrown if it is not. If you change this property while the picker is visible, the picker interface changes to match the new value in this property.\n\nThe various source types are listed in the [doc:\/\/com.apple.uikit\/documentation\/UIKit\/UIImagePickerController\/SourceType-swift.enum] enumeration. The default value is [doc:\/\/com.apple.uikit\/documentation\/UIKit\/UIImagePickerController\/SourceType-swift.enum\/photoLibrary].\n\n## Setting the picker source\n\n- **availableMediaTypes(for:)**: Retrieves the available media types for the specified source type.\n- **isSourceTypeAvailable(_:)**: Queries whether the device supports picking media using the specified source type.\n- **UIImagePickerController.SourceType**: Constants that describe the source to use when picking an image or when determining available media types.\n\n",
  "sections" : [
    {
      "content" : "",
      "items" : [
        {
          "description" : "Retrieves the available media types for the specified source type.",
          "name" : "availableMediaTypes(for:)",
          "url" : "https:\/\/developer.apple.com\/documentation\/UIKit\/UIImagePickerController\/availableMediaTypes(for:)"
        },
        {
          "description" : "Queries whether the device supports picking media using the specified source type.",
          "name" : "isSourceTypeAvailable(_:)",
          "url" : "https:\/\/developer.apple.com\/documentation\/UIKit\/UIImagePickerController\/isSourceTypeAvailable(_:)"
        },
        {
          "description" : "Constants that describe the source to use when picking an image or when determining available media types.",
          "name" : "UIImagePickerController.SourceType",
          "url" : "https:\/\/developer.apple.com\/documentation\/UIKit\/UIImagePickerController\/SourceType-swift.enum"
        }
      ],
      "title" : "Setting the picker source"
    }
  ],
  "source" : "appleJSON",
  "title" : "sourceType",
  "url" : "https:\/\/developer.apple.com\/documentation\/UIKit\/UIImagePickerController\/sourceType-swift.property"
}