{
  "abstract" : "The set of actions to perform when swiping on rows of a table.",
  "codeExamples" : [

  ],
  "conformsTo" : [
    "CVarArg",
    "CustomDebugStringConvertible",
    "CustomStringConvertible",
    "Equatable",
    "Hashable",
    "NSObjectProtocol",
    "Sendable"
  ],
  "contentHash" : "fbdde56ddac748f9d3bbb1f566ceedfe754fdb70ce24997f9948034de23256b4",
  "crawledAt" : "2025-12-04T10:13:58Z",
  "declaration" : {
    "code" : "@MainActor class UISwipeActionsConfiguration",
    "language" : "swift"
  },
  "id" : "6FB6F0F3-A51F-48D9-951A-3B5D3B68A1BB",
  "kind" : "class",
  "language" : "swift",
  "module" : "UIKit",
  "overview" : "## Overview\n\nCreate a [doc:\/\/com.apple.uikit\/documentation\/UIKit\/UISwipeActionsConfiguration] object to associate custom swipe actions with a row of your table view. Users swipe horizontally left or right in a table view to reveal the actions associated with a row. Each swipe-actions object contains the set of actions to display for each type of swipe.\n\nTo add custom actions to your table view’s rows, implement the [doc:\/\/com.apple.uikit\/documentation\/UIKit\/UITableViewDelegate\/tableView(_:leadingSwipeActionsConfigurationForRowAt:)] or [doc:\/\/com.apple.uikit\/documentation\/UIKit\/UITableViewDelegate\/tableView(_:trailingSwipeActionsConfigurationForRowAt:)] method of your table view’s delegate. In those methods, create and return the actions for the indicated row. The table displays your action buttons and executes the appropriate handler block when the user taps one of them.",
  "platforms" : [
    "iOS",
    "iPadOS",
    "Mac Catalyst",
    "visionOS"
  ],
  "rawMarkdown" : "---\nsource: https:\/\/developer.apple.com\/documentation\/UIKit\/UISwipeActionsConfiguration\ncrawled: 2025-12-04T10:13:58Z\n---\n\n# UISwipeActionsConfiguration\n\n**Class**\n\nThe set of actions to perform when swiping on rows of a table.\n\n## Declaration\n\n```swift\n@MainActor class UISwipeActionsConfiguration\n```\n\n## Overview\n\nCreate a [doc:\/\/com.apple.uikit\/documentation\/UIKit\/UISwipeActionsConfiguration] object to associate custom swipe actions with a row of your table view. Users swipe horizontally left or right in a table view to reveal the actions associated with a row. Each swipe-actions object contains the set of actions to display for each type of swipe.\n\nTo add custom actions to your table view’s rows, implement the [doc:\/\/com.apple.uikit\/documentation\/UIKit\/UITableViewDelegate\/tableView(_:leadingSwipeActionsConfigurationForRowAt:)] or [doc:\/\/com.apple.uikit\/documentation\/UIKit\/UITableViewDelegate\/tableView(_:trailingSwipeActionsConfigurationForRowAt:)] method of your table view’s delegate. In those methods, create and return the actions for the indicated row. The table displays your action buttons and executes the appropriate handler block when the user taps one of them.\n\n## Initializing the swipe actions\n\n- **init(actions:)**: Creates a swipe action configuration object with the specified set of actions.\n\n## Getting the swipe action information\n\n- **actions**: The swipe actions.\n- **performsFirstActionWithFullSwipe**: A Boolean value indicating whether a full swipe automatically performs the first action.\n\n## Row actions\n\n- **UIContextualAction**: An action to display when the user swipes a table row.\n- **UITableViewRowAction**: A single action to present when the user swipes horizontally in a table row.\n\n## Inherits From\n\n- NSObject\n\n## Conforms To\n\n- CVarArg\n- CustomDebugStringConvertible\n- CustomStringConvertible\n- Equatable\n- Hashable\n- NSObjectProtocol\n- Sendable\n\n",
  "sections" : [
    {
      "content" : "",
      "items" : [
        {
          "description" : "Creates a swipe action configuration object with the specified set of actions.",
          "name" : "init(actions:)",
          "url" : "https:\/\/developer.apple.com\/documentation\/UIKit\/UISwipeActionsConfiguration\/init(actions:)"
        }
      ],
      "title" : "Initializing the swipe actions"
    },
    {
      "content" : "",
      "items" : [
        {
          "description" : "The swipe actions.",
          "name" : "actions",
          "url" : "https:\/\/developer.apple.com\/documentation\/UIKit\/UISwipeActionsConfiguration\/actions"
        },
        {
          "description" : "A Boolean value indicating whether a full swipe automatically performs the first action.",
          "name" : "performsFirstActionWithFullSwipe",
          "url" : "https:\/\/developer.apple.com\/documentation\/UIKit\/UISwipeActionsConfiguration\/performsFirstActionWithFullSwipe"
        }
      ],
      "title" : "Getting the swipe action information"
    },
    {
      "content" : "",
      "items" : [
        {
          "description" : "An action to display when the user swipes a table row.",
          "name" : "UIContextualAction",
          "url" : "https:\/\/developer.apple.com\/documentation\/UIKit\/UIContextualAction"
        },
        {
          "description" : "A single action to present when the user swipes horizontally in a table row.",
          "name" : "UITableViewRowAction",
          "url" : "https:\/\/developer.apple.com\/documentation\/UIKit\/UITableViewRowAction"
        }
      ],
      "title" : "Row actions"
    },
    {
      "content" : "",
      "items" : [
        {
          "name" : "NSObject"
        }
      ],
      "title" : "Inherits From"
    }
  ],
  "source" : "appleJSON",
  "title" : "UISwipeActionsConfiguration",
  "url" : "https:\/\/developer.apple.com\/documentation\/UIKit\/UISwipeActionsConfiguration"
}