{
  "abstract" : "A continuous gesture recognizer that interprets long-press gestures.",
  "codeExamples" : [

  ],
  "conformsTo" : [
    "CVarArg",
    "CustomDebugStringConvertible",
    "CustomStringConvertible",
    "Equatable",
    "Hashable",
    "NSObjectProtocol",
    "Sendable",
    "SendableMetatype"
  ],
  "contentHash" : "e73bb306ad31575a6d802fb7e647cbfc87315d128dad55d0287ade2ee43ba6f9",
  "crawledAt" : "2025-12-02T16:18:10Z",
  "declaration" : {
    "code" : "@MainActor class UILongPressGestureRecognizer",
    "language" : "swift"
  },
  "id" : "77F61BF0-2DC8-4994-8B31-5343CFAEB7F2",
  "kind" : "class",
  "language" : "swift",
  "module" : "UIKit",
  "overview" : "## Overview\n\n[doc:\/\/com.apple.uikit\/documentation\/UIKit\/UILongPressGestureRecognizer] is a concrete subclass of [doc:\/\/com.apple.uikit\/documentation\/UIKit\/UIGestureRecognizer].\n\nThe user must press one or more fingers on a view and hold them there for a minimum period of time before the action triggers. While down, the userʼs fingers canʼt move more than a specified distance or the gesture fails.\n\nA long-press gesture is continuous. The gesture begins ([doc:\/\/com.apple.uikit\/documentation\/UIKit\/UIGestureRecognizer\/State-swift.enum\/began]) when the user presses the number of allowable fingers ([doc:\/\/com.apple.uikit\/documentation\/UIKit\/UILongPressGestureRecognizer\/numberOfTouchesRequired]) for the specified period ([doc:\/\/com.apple.uikit\/documentation\/UIKit\/UILongPressGestureRecognizer\/minimumPressDuration]) and the touches don’t move beyond the allowable range of movement ([doc:\/\/com.apple.uikit\/documentation\/UIKit\/UILongPressGestureRecognizer\/allowableMovement]). The gesture recognizer transitions to the Change state whenever a finger moves, and it ends ([doc:\/\/com.apple.uikit\/documentation\/UIKit\/UIGestureRecognizer\/State-swift.enum\/ended]) when the user lifts any of the fingers.",
  "platforms" : [
    "iOS",
    "iPadOS",
    "Mac Catalyst",
    "tvOS",
    "visionOS"
  ],
  "rawMarkdown" : "---\nsource: https:\/\/developer.apple.com\/documentation\/UIKit\/UILongPressGestureRecognizer\ncrawled: 2025-12-02T16:18:10Z\n---\n\n# UILongPressGestureRecognizer\n\n**Class**\n\nA continuous gesture recognizer that interprets long-press gestures.\n\n## Declaration\n\n```swift\n@MainActor class UILongPressGestureRecognizer\n```\n\n## Overview\n\n[doc:\/\/com.apple.uikit\/documentation\/UIKit\/UILongPressGestureRecognizer] is a concrete subclass of [doc:\/\/com.apple.uikit\/documentation\/UIKit\/UIGestureRecognizer].\n\nThe user must press one or more fingers on a view and hold them there for a minimum period of time before the action triggers. While down, the userʼs fingers canʼt move more than a specified distance or the gesture fails.\n\nA long-press gesture is continuous. The gesture begins ([doc:\/\/com.apple.uikit\/documentation\/UIKit\/UIGestureRecognizer\/State-swift.enum\/began]) when the user presses the number of allowable fingers ([doc:\/\/com.apple.uikit\/documentation\/UIKit\/UILongPressGestureRecognizer\/numberOfTouchesRequired]) for the specified period ([doc:\/\/com.apple.uikit\/documentation\/UIKit\/UILongPressGestureRecognizer\/minimumPressDuration]) and the touches don’t move beyond the allowable range of movement ([doc:\/\/com.apple.uikit\/documentation\/UIKit\/UILongPressGestureRecognizer\/allowableMovement]). The gesture recognizer transitions to the Change state whenever a finger moves, and it ends ([doc:\/\/com.apple.uikit\/documentation\/UIKit\/UIGestureRecognizer\/State-swift.enum\/ended]) when the user lifts any of the fingers.\n\n## Configuring the gesture recognizer\n\n- **minimumPressDuration**: The minimum time that the user must press on the view for the gesture to be recognized.\n- **numberOfTouchesRequired**: The number of fingers that must touch the view for gesture recognition.\n- **numberOfTapsRequired**: The number of taps on the view necessary for gesture recognition.\n- **allowableMovement**: The maximum movement of the fingers on the view before the gesture fails.\n\n## Standard gestures\n\n- **Handling UIKit gestures**: Use gesture recognizers to simplify touch handling and create a consistent user experience.\n- **Coordinating multiple gesture recognizers**: Discover how to use multiple gesture recognizers on the same view.\n- **Adopting hover support for Apple Pencil**: Enhance user feedback for your iPadOS app with a hover preview for Apple Pencil input.\n- **Supporting gesture interaction in your apps**: Enrich your app’s user experience by supporting standard and custom gesture interaction.\n- **UIHoverGestureRecognizer**: A continuous gesture recognizer that interprets pointer movement over a view.\n- **UIPanGestureRecognizer**: A continuous gesture recognizer that interprets panning gestures.\n- **UIPinchGestureRecognizer**: A continuous gesture recognizer that interprets pinching gestures involving two touches.\n- **UIRotationGestureRecognizer**: A continuous gesture recognizer that interprets rotation gestures involving two touches.\n- **UIScreenEdgePanGestureRecognizer**: A continuous gesture recognizer that interprets panning gestures that start near an edge of the screen.\n- **UISwipeGestureRecognizer**: A discrete gesture recognizer that interprets swiping gestures in one or more directions.\n- **UITapGestureRecognizer**: A discrete gesture recognizer that interprets single or multiple taps.\n\n## Inherits From\n\n- UIGestureRecognizer\n\n## Conforms To\n\n- CVarArg\n- CustomDebugStringConvertible\n- CustomStringConvertible\n- Equatable\n- Hashable\n- NSObjectProtocol\n- Sendable\n- SendableMetatype\n\n",
  "sections" : [
    {
      "content" : "",
      "items" : [
        {
          "description" : "The minimum time that the user must press on the view for the gesture to be recognized.",
          "name" : "minimumPressDuration",
          "url" : "https:\/\/developer.apple.com\/documentation\/UIKit\/UILongPressGestureRecognizer\/minimumPressDuration"
        },
        {
          "description" : "The number of fingers that must touch the view for gesture recognition.",
          "name" : "numberOfTouchesRequired",
          "url" : "https:\/\/developer.apple.com\/documentation\/UIKit\/UILongPressGestureRecognizer\/numberOfTouchesRequired"
        },
        {
          "description" : "The number of taps on the view necessary for gesture recognition.",
          "name" : "numberOfTapsRequired",
          "url" : "https:\/\/developer.apple.com\/documentation\/UIKit\/UILongPressGestureRecognizer\/numberOfTapsRequired"
        },
        {
          "description" : "The maximum movement of the fingers on the view before the gesture fails.",
          "name" : "allowableMovement",
          "url" : "https:\/\/developer.apple.com\/documentation\/UIKit\/UILongPressGestureRecognizer\/allowableMovement"
        }
      ],
      "title" : "Configuring the gesture recognizer"
    },
    {
      "content" : "",
      "items" : [
        {
          "description" : "Use gesture recognizers to simplify touch handling and create a consistent user experience.",
          "name" : "Handling UIKit gestures",
          "url" : "https:\/\/developer.apple.com\/documentation\/UIKit\/handling-uikit-gestures"
        },
        {
          "description" : "Discover how to use multiple gesture recognizers on the same view.",
          "name" : "Coordinating multiple gesture recognizers",
          "url" : "https:\/\/developer.apple.com\/documentation\/UIKit\/coordinating-multiple-gesture-recognizers"
        },
        {
          "description" : "Enhance user feedback for your iPadOS app with a hover preview for Apple Pencil input.",
          "name" : "Adopting hover support for Apple Pencil",
          "url" : "https:\/\/developer.apple.com\/documentation\/UIKit\/adopting-hover-support-for-apple-pencil"
        },
        {
          "description" : "Enrich your app’s user experience by supporting standard and custom gesture interaction.",
          "name" : "Supporting gesture interaction in your apps",
          "url" : "https:\/\/developer.apple.com\/documentation\/UIKit\/supporting-gesture-interaction-in-your-apps"
        },
        {
          "description" : "A continuous gesture recognizer that interprets pointer movement over a view.",
          "name" : "UIHoverGestureRecognizer",
          "url" : "https:\/\/developer.apple.com\/documentation\/UIKit\/UIHoverGestureRecognizer"
        },
        {
          "description" : "A continuous gesture recognizer that interprets panning gestures.",
          "name" : "UIPanGestureRecognizer",
          "url" : "https:\/\/developer.apple.com\/documentation\/UIKit\/UIPanGestureRecognizer"
        },
        {
          "description" : "A continuous gesture recognizer that interprets pinching gestures involving two touches.",
          "name" : "UIPinchGestureRecognizer",
          "url" : "https:\/\/developer.apple.com\/documentation\/UIKit\/UIPinchGestureRecognizer"
        },
        {
          "description" : "A continuous gesture recognizer that interprets rotation gestures involving two touches.",
          "name" : "UIRotationGestureRecognizer",
          "url" : "https:\/\/developer.apple.com\/documentation\/UIKit\/UIRotationGestureRecognizer"
        },
        {
          "description" : "A continuous gesture recognizer that interprets panning gestures that start near an edge of the screen.",
          "name" : "UIScreenEdgePanGestureRecognizer",
          "url" : "https:\/\/developer.apple.com\/documentation\/UIKit\/UIScreenEdgePanGestureRecognizer"
        },
        {
          "description" : "A discrete gesture recognizer that interprets swiping gestures in one or more directions.",
          "name" : "UISwipeGestureRecognizer",
          "url" : "https:\/\/developer.apple.com\/documentation\/UIKit\/UISwipeGestureRecognizer"
        },
        {
          "description" : "A discrete gesture recognizer that interprets single or multiple taps.",
          "name" : "UITapGestureRecognizer",
          "url" : "https:\/\/developer.apple.com\/documentation\/UIKit\/UITapGestureRecognizer"
        }
      ],
      "title" : "Standard gestures"
    },
    {
      "content" : "",
      "items" : [
        {
          "name" : "UIGestureRecognizer"
        }
      ],
      "title" : "Inherits From"
    }
  ],
  "source" : "appleJSON",
  "title" : "UILongPressGestureRecognizer",
  "url" : "https:\/\/developer.apple.com\/documentation\/UIKit\/UILongPressGestureRecognizer"
}