{
  "abstract" : "Requests an update to the window scene’s geometry using the specified geometry preferences object.",
  "codeExamples" : [
    {
      "code" : "\/\/ In a view controller, get the window scene.\nguard let windowScene = view.window?.windowScene else { return }\n\n\/\/ Request the window scene to rotate to any landscape orientation.\nwindowScene.requestGeometryUpdate(.iOS(interfaceOrientations: .landscape)) { error in\n    \/\/ Handle denial of request.\n}",
      "language" : "swift"
    }
  ],
  "contentHash" : "ae2a2b4220718d9290e870997e53c5c0c7bde7685be9be81943f9879e242ba91",
  "crawledAt" : "2025-12-01T23:51:36Z",
  "declaration" : {
    "code" : "@MainActor func requestGeometryUpdate(_ geometryPreferences: UIWindowScene.GeometryPreferences, errorHandler: ((any Error) -> Void)? = nil)",
    "language" : "swift"
  },
  "id" : "2DCBA7BB-7752-456A-9DF3-B39EA7544C2A",
  "kind" : "method",
  "module" : "UIKit",
  "overview" : "## Discussion\n\nUse this method to explicitly request geometry changes to the window scene. The following code shows an example of requesting the window scene to rotate to a landscape orientation in iOS.",
  "platforms" : [
    "iOS",
    "iPadOS",
    "Mac Catalyst",
    "tvOS",
    "visionOS"
  ],
  "rawMarkdown" : "---\nsource: https:\/\/developer.apple.com\/documentation\/UIKit\/UIWindowScene\/requestGeometryUpdate(_:errorHandler:)\ncrawled: 2025-12-01T23:51:36Z\n---\n\n# requestGeometryUpdate(_:errorHandler:)\n\n**Instance Method**\n\nRequests an update to the window scene’s geometry using the specified geometry preferences object.\n\n## Declaration\n\n```swift\n@MainActor func requestGeometryUpdate(_ geometryPreferences: UIWindowScene.GeometryPreferences, errorHandler: ((any Error) -> Void)? = nil)\n```\n\n## Parameters\n\n- **geometryPreferences**: The geometry information to use for the request.\n- **errorHandler**: An optional closure to call when an error occurs. The system may call the error handler asynchronously.\n\n## Discussion\n\nUse this method to explicitly request geometry changes to the window scene. The following code shows an example of requesting the window scene to rotate to a landscape orientation in iOS.\n\n```swift\n\/\/ In a view controller, get the window scene.\nguard let windowScene = view.window?.windowScene else { return }\n\n\/\/ Request the window scene to rotate to any landscape orientation.\nwindowScene.requestGeometryUpdate(.iOS(interfaceOrientations: .landscape)) { error in\n    \/\/ Handle denial of request.\n}\n```\n\n## Working with window geometry\n\n- **effectiveGeometry**: The current values for the window scene’s geometry in system space.\n- **UIWindowScene.Geometry**: An object that provides geometry information about the window scene.\n- **UIWindowScene.GeometryPreferences**: An abstract superclass for representing window scene geometry preferences.\n- **UIWindowScene.GeometryPreferences.iOS**: An object that represents the geometry preferences for a window scene in an iOS app.\n- **UIWindowScene.GeometryPreferences.Mac**: An object that represents the geometry preferences for a window scene in an app built with Mac Catalyst.\n- **UIWindowScene.GeometryPreferences.Vision**\n- **UIProposedSceneSizeNoPreference**\n\n",
  "sections" : [
    {
      "content" : "",
      "items" : [
        {
          "description" : "The current values for the window scene’s geometry in system space.",
          "name" : "effectiveGeometry",
          "url" : "https:\/\/developer.apple.com\/documentation\/UIKit\/UIWindowScene\/effectiveGeometry"
        },
        {
          "description" : "An object that provides geometry information about the window scene.",
          "name" : "UIWindowScene.Geometry",
          "url" : "https:\/\/developer.apple.com\/documentation\/UIKit\/UIWindowScene\/Geometry"
        },
        {
          "description" : "An abstract superclass for representing window scene geometry preferences.",
          "name" : "UIWindowScene.GeometryPreferences",
          "url" : "https:\/\/developer.apple.com\/documentation\/UIKit\/UIWindowScene\/GeometryPreferences"
        },
        {
          "description" : "An object that represents the geometry preferences for a window scene in an iOS app.",
          "name" : "UIWindowScene.GeometryPreferences.iOS",
          "url" : "https:\/\/developer.apple.com\/documentation\/UIKit\/UIWindowScene\/GeometryPreferences\/iOS"
        },
        {
          "description" : "An object that represents the geometry preferences for a window scene in an app built with Mac Catalyst.",
          "name" : "UIWindowScene.GeometryPreferences.Mac",
          "url" : "https:\/\/developer.apple.com\/documentation\/UIKit\/UIWindowScene\/GeometryPreferences\/Mac"
        },
        {
          "description" : "",
          "name" : "UIWindowScene.GeometryPreferences.Vision",
          "url" : "https:\/\/developer.apple.com\/documentation\/UIKit\/UIWindowScene\/GeometryPreferences\/Vision"
        },
        {
          "description" : "",
          "name" : "UIProposedSceneSizeNoPreference",
          "url" : "https:\/\/developer.apple.com\/documentation\/UIKit\/UIProposedSceneSizeNoPreference"
        }
      ],
      "title" : "Working with window geometry"
    }
  ],
  "source" : "appleJSON",
  "title" : "requestGeometryUpdate(_:errorHandler:)",
  "url" : "https:\/\/developer.apple.com\/documentation\/UIKit\/UIWindowScene\/requestGeometryUpdate(_:errorHandler:)"
}