{
  "abstract" : "Presents a view controller in a secondary (or detail) context.",
  "codeExamples" : [

  ],
  "contentHash" : "710f5fc8ba2d8ca35c4b694017aa5b2326df03a9f27416173bb57b9f660716ca",
  "crawledAt" : "2025-12-01T14:50:45Z",
  "declaration" : {
    "code" : "@MainActor func showDetailViewController(_ vc: UIViewController, sender: Any?)",
    "language" : "swift"
  },
  "id" : "2D446A5F-DBF4-4BF2-907D-A7528D6C5002",
  "kind" : "method",
  "module" : "UIKit",
  "overview" : "## Discussion\n\nYou use this method to decouple the need to display a view controller from the process of actually presenting that view controller onscreen. Using this method, a view controller does not need to know whether it is embedded inside a navigation controller or split-view controller. It calls the same method for both. In a regular environment, the [doc:\/\/com.apple.uikit\/documentation\/UIKit\/UISplitViewController] class overrides this method and installs `vc` as its detail view controller; in a compact environment, the split view controller’s implementation of this method calls [doc:\/\/com.apple.uikit\/documentation\/UIKit\/UIViewController\/show(_:sender:)] instead.\n\nThe default implementation of this method calls the [doc:\/\/com.apple.uikit\/documentation\/UIKit\/UIViewController\/targetViewController(forAction:sender:)] method to locate an object in the view controller hierarchy that overrides this method. It then calls the method on that target object, which displays the view controller in an appropriate way. If the [doc:\/\/com.apple.uikit\/documentation\/UIKit\/UIViewController\/targetViewController(forAction:sender:)] method returns `nil`, this method uses the window’s root view controller to present `vc` modally.\n\nYou can override this method in custom view controllers to display `vc` yourself. Use this method to display `vc` in a secondary context. For example, a container view controller might use this method to replace its secondary child. Your implementation should adapt its behavior for both regular and compact environments.",
  "platforms" : [
    "iOS",
    "iPadOS",
    "Mac Catalyst",
    "tvOS",
    "visionOS"
  ],
  "rawMarkdown" : "---\nsource: https:\/\/developer.apple.com\/documentation\/UIKit\/UIViewController\/showDetailViewController(_:sender:)\ncrawled: 2025-12-01T14:50:45Z\n---\n\n# showDetailViewController(_:sender:)\n\n**Instance Method**\n\nPresents a view controller in a secondary (or detail) context.\n\n## Declaration\n\n```swift\n@MainActor func showDetailViewController(_ vc: UIViewController, sender: Any?)\n```\n\n## Parameters\n\n- **vc**: The current view controller.\n- **sender**: The object being acted upon.\n\n## Discussion\n\nYou use this method to decouple the need to display a view controller from the process of actually presenting that view controller onscreen. Using this method, a view controller does not need to know whether it is embedded inside a navigation controller or split-view controller. It calls the same method for both. In a regular environment, the [doc:\/\/com.apple.uikit\/documentation\/UIKit\/UISplitViewController] class overrides this method and installs `vc` as its detail view controller; in a compact environment, the split view controller’s implementation of this method calls [doc:\/\/com.apple.uikit\/documentation\/UIKit\/UIViewController\/show(_:sender:)] instead.\n\nThe default implementation of this method calls the [doc:\/\/com.apple.uikit\/documentation\/UIKit\/UIViewController\/targetViewController(forAction:sender:)] method to locate an object in the view controller hierarchy that overrides this method. It then calls the method on that target object, which displays the view controller in an appropriate way. If the [doc:\/\/com.apple.uikit\/documentation\/UIKit\/UIViewController\/targetViewController(forAction:sender:)] method returns `nil`, this method uses the window’s root view controller to present `vc` modally.\n\nYou can override this method in custom view controllers to display `vc` yourself. Use this method to display `vc` in a secondary context. For example, a container view controller might use this method to replace its secondary child. Your implementation should adapt its behavior for both regular and compact environments.\n\n## Presenting a view controller\n\n- **show(_:sender:)**: Presents a view controller in a primary context.\n- **present(_:animated:completion:)**: Presents a view controller modally.\n- **dismiss(animated:completion:)**: Dismisses the view controller that was presented modally by the view controller.\n- **modalPresentationStyle**: The presentation style for modal view controllers.\n- **UIModalPresentationStyle**: Modal presentation styles available when presenting view controllers.\n- **modalTransitionStyle**: The transition style to use when presenting the view controller.\n- **UIModalTransitionStyle**: Transition styles available when presenting view controllers.\n- **isModalInPresentation**: A Boolean value indicating whether the view controller enforces a modal behavior.\n- **definesPresentationContext**: A Boolean value that indicates whether this view controller’s view is covered when the view controller or one of its descendants presents a view controller.\n- **providesPresentationContextTransitionStyle**: A Boolean value that indicates whether the view controller specifies the transition style for view controllers it presents.\n- **disablesAutomaticKeyboardDismissal**: Returns a Boolean indicating whether the current input view is dismissed automatically when changing controls.\n- **showDetailTargetDidChangeNotification**: Posted when a split view controller is expanded or collapsed.\n\n",
  "sections" : [
    {
      "content" : "",
      "items" : [
        {
          "description" : "Presents a view controller in a primary context.",
          "name" : "show(_:sender:)",
          "url" : "https:\/\/developer.apple.com\/documentation\/UIKit\/UIViewController\/show(_:sender:)"
        },
        {
          "description" : "Presents a view controller modally.",
          "name" : "present(_:animated:completion:)",
          "url" : "https:\/\/developer.apple.com\/documentation\/UIKit\/UIViewController\/present(_:animated:completion:)"
        },
        {
          "description" : "Dismisses the view controller that was presented modally by the view controller.",
          "name" : "dismiss(animated:completion:)",
          "url" : "https:\/\/developer.apple.com\/documentation\/UIKit\/UIViewController\/dismiss(animated:completion:)"
        },
        {
          "description" : "The presentation style for modal view controllers.",
          "name" : "modalPresentationStyle",
          "url" : "https:\/\/developer.apple.com\/documentation\/UIKit\/UIViewController\/modalPresentationStyle"
        },
        {
          "description" : "Modal presentation styles available when presenting view controllers.",
          "name" : "UIModalPresentationStyle",
          "url" : "https:\/\/developer.apple.com\/documentation\/UIKit\/UIModalPresentationStyle"
        },
        {
          "description" : "The transition style to use when presenting the view controller.",
          "name" : "modalTransitionStyle",
          "url" : "https:\/\/developer.apple.com\/documentation\/UIKit\/UIViewController\/modalTransitionStyle"
        },
        {
          "description" : "Transition styles available when presenting view controllers.",
          "name" : "UIModalTransitionStyle",
          "url" : "https:\/\/developer.apple.com\/documentation\/UIKit\/UIModalTransitionStyle"
        },
        {
          "description" : "A Boolean value indicating whether the view controller enforces a modal behavior.",
          "name" : "isModalInPresentation",
          "url" : "https:\/\/developer.apple.com\/documentation\/UIKit\/UIViewController\/isModalInPresentation"
        },
        {
          "description" : "A Boolean value that indicates whether this view controller’s view is covered when the view controller or one of its descendants presents a view controller.",
          "name" : "definesPresentationContext",
          "url" : "https:\/\/developer.apple.com\/documentation\/UIKit\/UIViewController\/definesPresentationContext"
        },
        {
          "description" : "A Boolean value that indicates whether the view controller specifies the transition style for view controllers it presents.",
          "name" : "providesPresentationContextTransitionStyle",
          "url" : "https:\/\/developer.apple.com\/documentation\/UIKit\/UIViewController\/providesPresentationContextTransitionStyle"
        },
        {
          "description" : "Returns a Boolean indicating whether the current input view is dismissed automatically when changing controls.",
          "name" : "disablesAutomaticKeyboardDismissal",
          "url" : "https:\/\/developer.apple.com\/documentation\/UIKit\/UIViewController\/disablesAutomaticKeyboardDismissal"
        },
        {
          "description" : "Posted when a split view controller is expanded or collapsed.",
          "name" : "showDetailTargetDidChangeNotification",
          "url" : "https:\/\/developer.apple.com\/documentation\/UIKit\/UIViewController\/showDetailTargetDidChangeNotification"
        }
      ],
      "title" : "Presenting a view controller"
    }
  ],
  "source" : "appleJSON",
  "title" : "showDetailViewController(_:sender:)",
  "url" : "https:\/\/developer.apple.com\/documentation\/UIKit\/UIViewController\/showDetailViewController(_:sender:)"
}