{
  "abstract" : "A closure that creates and returns each of the custom group’s items.",
  "codeExamples" : [

  ],
  "contentHash" : "da1efa30d81d1d6385a902270d7d54ba2e48e11024d883fded8ebeba20063c6d",
  "crawledAt" : "2025-12-05T21:14:23Z",
  "declaration" : {
    "code" : "typealias NSCollectionLayoutGroupCustomItemProvider = (any NSCollectionLayoutEnvironment) -> [NSCollectionLayoutGroupCustomItem]",
    "language" : "swift"
  },
  "id" : "90885265-594A-4CB6-BB3D-511E19D7F0AD",
  "kind" : "typealias",
  "language" : "swift",
  "module" : "UIKit",
  "overview" : "## Discussion\n\nYou use a custom item provider to supply the item arrangement when creating a group using the [doc:\/\/com.apple.uikit\/documentation\/UIKit\/NSCollectionLayoutGroup\/custom(layoutSize:itemProvider:)] initializer.",
  "platforms" : [
    "iOS",
    "iPadOS",
    "Mac Catalyst",
    "tvOS",
    "visionOS"
  ],
  "rawMarkdown" : "---\nsource: https:\/\/developer.apple.com\/documentation\/UIKit\/NSCollectionLayoutGroupCustomItemProvider\ncrawled: 2025-12-05T21:14:23Z\n---\n\n# NSCollectionLayoutGroupCustomItemProvider\n\n**Type Alias**\n\nA closure that creates and returns each of the custom group’s items.\n\n## Declaration\n\n```swift\ntypealias NSCollectionLayoutGroupCustomItemProvider = (any NSCollectionLayoutEnvironment) -> [NSCollectionLayoutGroupCustomItem]\n```\n\n## Discussion\n\nYou use a custom item provider to supply the item arrangement when creating a group using the [doc:\/\/com.apple.uikit\/documentation\/UIKit\/NSCollectionLayoutGroup\/custom(layoutSize:itemProvider:)] initializer.\n\n## Advanced layouts\n\n- **NSCollectionLayoutGroupCustomItem**: An item used in a group with a custom layout arrangement.\n\n",
  "sections" : [
    {
      "content" : "",
      "items" : [
        {
          "description" : "An item used in a group with a custom layout arrangement.",
          "name" : "NSCollectionLayoutGroupCustomItem",
          "url" : "https:\/\/developer.apple.com\/documentation\/UIKit\/NSCollectionLayoutGroupCustomItem"
        }
      ],
      "title" : "Advanced layouts"
    }
  ],
  "source" : "appleJSON",
  "title" : "NSCollectionLayoutGroupCustomItemProvider",
  "url" : "https:\/\/developer.apple.com\/documentation\/UIKit\/NSCollectionLayoutGroupCustomItemProvider"
}