{
  "abstract" : "The protocol you implement to provide additional information to, and receive notifications from, the CloudKit sharing controller.",
  "codeExamples" : [

  ],
  "contentHash" : "5a2849a7f436051416b31ddbc01cfb69f2a48b123ce934106a1f08c44e09867a",
  "crawledAt" : "2025-12-02T18:30:55Z",
  "declaration" : {
    "code" : "@MainActor protocol UICloudSharingControllerDelegate : NSObjectProtocol",
    "language" : "swift"
  },
  "id" : "6D2031E1-B1AD-48B9-B284-12B5DABDB7A2",
  "kind" : "protocol",
  "language" : "swift",
  "module" : "UIKit",
  "overview" : "## Overview\n\nImplement an object that conforms to the [doc:\/\/com.apple.uikit\/documentation\/UIKit\/UICloudSharingControllerDelegate] protocol when you want to:",
  "platforms" : [
    "iOS",
    "iPadOS",
    "Mac Catalyst",
    "visionOS"
  ],
  "rawMarkdown" : "---\nsource: https:\/\/developer.apple.com\/documentation\/UIKit\/UICloudSharingControllerDelegate\ncrawled: 2025-12-02T18:30:55Z\n---\n\n# UICloudSharingControllerDelegate\n\n**Protocol**\n\nThe protocol you implement to provide additional information to, and receive notifications from, the CloudKit sharing controller.\n\n## Declaration\n\n```swift\n@MainActor protocol UICloudSharingControllerDelegate : NSObjectProtocol\n```\n\n## Overview\n\nImplement an object that conforms to the [doc:\/\/com.apple.uikit\/documentation\/UIKit\/UICloudSharingControllerDelegate] protocol when you want to:\n\n- Configure a [doc:\/\/com.apple.uikit\/documentation\/UIKit\/UICloudSharingController] instance.\n- Receive notifications from a [doc:\/\/com.apple.uikit\/documentation\/UIKit\/UICloudSharingController] instance as it attempts to save or remove the [doc:\/\/com.apple.documentation\/documentation\/CloudKit\/CKShare] record based on user interactions on the Invitation and People screens.\n\n## Configuring the view controller\n\n- **itemTitle(for:)**: Asks the delegate for the title to display on the invitation screen.\n- **itemType(for:)**: Asks the delegate for the Uniform Type Identifier (UTI) of the item.\n- **itemThumbnailData(for:)**: Asks the delegate for the thumbnail image data to display on the invitation.\n\n## Processing shared items\n\n- **cloudSharingController(_:failedToSaveShareWithError:)**: Tells the delegate that the CloudKit sharing controller failed to save the share record.\n- **cloudSharingControllerDidStopSharing(_:)**: Tells the delegate that the user has stopped sharing the record.\n- **cloudSharingControllerDidSaveShare(_:)**: Tells the delegate that the CloudKit sharing controller saved the share record.\n\n## Customizing the cloud sharing controller behavior\n\n- **delegate**: A reference to an object that conforms to the CloudKit sharing controller delegate protocol.\n\n## Inherits From\n\n- NSObjectProtocol\n\n",
  "sections" : [
    {
      "content" : "",
      "items" : [
        {
          "description" : "Asks the delegate for the title to display on the invitation screen.",
          "name" : "itemTitle(for:)",
          "url" : "https:\/\/developer.apple.com\/documentation\/UIKit\/UICloudSharingControllerDelegate\/itemTitle(for:)"
        },
        {
          "description" : "Asks the delegate for the Uniform Type Identifier (UTI) of the item.",
          "name" : "itemType(for:)",
          "url" : "https:\/\/developer.apple.com\/documentation\/UIKit\/UICloudSharingControllerDelegate\/itemType(for:)"
        },
        {
          "description" : "Asks the delegate for the thumbnail image data to display on the invitation.",
          "name" : "itemThumbnailData(for:)",
          "url" : "https:\/\/developer.apple.com\/documentation\/UIKit\/UICloudSharingControllerDelegate\/itemThumbnailData(for:)"
        }
      ],
      "title" : "Configuring the view controller"
    },
    {
      "content" : "",
      "items" : [
        {
          "description" : "Tells the delegate that the CloudKit sharing controller failed to save the share record.",
          "name" : "cloudSharingController(_:failedToSaveShareWithError:)",
          "url" : "https:\/\/developer.apple.com\/documentation\/UIKit\/UICloudSharingControllerDelegate\/cloudSharingController(_:failedToSaveShareWithError:)"
        },
        {
          "description" : "Tells the delegate that the user has stopped sharing the record.",
          "name" : "cloudSharingControllerDidStopSharing(_:)",
          "url" : "https:\/\/developer.apple.com\/documentation\/UIKit\/UICloudSharingControllerDelegate\/cloudSharingControllerDidStopSharing(_:)"
        },
        {
          "description" : "Tells the delegate that the CloudKit sharing controller saved the share record.",
          "name" : "cloudSharingControllerDidSaveShare(_:)",
          "url" : "https:\/\/developer.apple.com\/documentation\/UIKit\/UICloudSharingControllerDelegate\/cloudSharingControllerDidSaveShare(_:)"
        }
      ],
      "title" : "Processing shared items"
    },
    {
      "content" : "",
      "items" : [
        {
          "description" : "A reference to an object that conforms to the CloudKit sharing controller delegate protocol.",
          "name" : "delegate",
          "url" : "https:\/\/developer.apple.com\/documentation\/UIKit\/UICloudSharingController\/delegate"
        }
      ],
      "title" : "Customizing the cloud sharing controller behavior"
    },
    {
      "content" : "",
      "items" : [
        {
          "name" : "NSObjectProtocol"
        }
      ],
      "title" : "Inherits From"
    }
  ],
  "source" : "appleJSON",
  "title" : "UICloudSharingControllerDelegate",
  "url" : "https:\/\/developer.apple.com\/documentation\/UIKit\/UICloudSharingControllerDelegate"
}