{
  "abstract" : "A continuous gesture recognizer that interprets panning gestures that start near an edge of the screen.",
  "codeExamples" : [

  ],
  "conformsTo" : [
    "CVarArg",
    "CustomDebugStringConvertible",
    "CustomStringConvertible",
    "Equatable",
    "Hashable",
    "NSObjectProtocol",
    "Sendable",
    "SendableMetatype"
  ],
  "contentHash" : "92a133bedc576433882e8ca4c4df31c892820e988e3d4d84ba17e174f17e3c48",
  "crawledAt" : "2025-12-02T15:59:17Z",
  "declaration" : {
    "code" : "@MainActor class UIScreenEdgePanGestureRecognizer",
    "language" : "swift"
  },
  "id" : "25BD8A00-699D-485E-B499-B0DE1D2BF3D7",
  "kind" : "class",
  "language" : "swift",
  "module" : "UIKit",
  "overview" : "## Overview\n\nThe system uses screen edge gestures in some cases to initiate view controller transitions. You can use this class to replicate the same gesture behavior for your own actions.\n\nAfter creating a screen edge pan gesture recognizer, assign an appropriate value to the [doc:\/\/com.apple.uikit\/documentation\/UIKit\/UIScreenEdgePanGestureRecognizer\/edges] property before attaching the gesture recognizer to your view. You use this property to specify the edges where the gesture can start. This gesture recognizer ignores any touches beyond the first touch.",
  "platforms" : [
    "iOS",
    "iPadOS",
    "Mac Catalyst"
  ],
  "rawMarkdown" : "---\nsource: https:\/\/developer.apple.com\/documentation\/UIKit\/UIScreenEdgePanGestureRecognizer\ncrawled: 2025-12-02T15:59:17Z\n---\n\n# UIScreenEdgePanGestureRecognizer\n\n**Class**\n\nA continuous gesture recognizer that interprets panning gestures that start near an edge of the screen.\n\n## Declaration\n\n```swift\n@MainActor class UIScreenEdgePanGestureRecognizer\n```\n\n## Overview\n\nThe system uses screen edge gestures in some cases to initiate view controller transitions. You can use this class to replicate the same gesture behavior for your own actions.\n\nAfter creating a screen edge pan gesture recognizer, assign an appropriate value to the [doc:\/\/com.apple.uikit\/documentation\/UIKit\/UIScreenEdgePanGestureRecognizer\/edges] property before attaching the gesture recognizer to your view. You use this property to specify the edges where the gesture can start. This gesture recognizer ignores any touches beyond the first touch.\n\n## Specifying the starting edges\n\n- **edges**: The acceptable starting edges for the gesture.\n- **UIRectEdge**: Constants that specify the edges of a rectangle.\n\n## Standard gestures\n\n- **Handling UIKit gestures**: Use gesture recognizers to simplify touch handling and create a consistent user experience.\n- **Coordinating multiple gesture recognizers**: Discover how to use multiple gesture recognizers on the same view.\n- **Adopting hover support for Apple Pencil**: Enhance user feedback for your iPadOS app with a hover preview for Apple Pencil input.\n- **Supporting gesture interaction in your apps**: Enrich your app’s user experience by supporting standard and custom gesture interaction.\n- **UIHoverGestureRecognizer**: A continuous gesture recognizer that interprets pointer movement over a view.\n- **UILongPressGestureRecognizer**: A continuous gesture recognizer that interprets long-press gestures.\n- **UIPanGestureRecognizer**: A continuous gesture recognizer that interprets panning gestures.\n- **UIPinchGestureRecognizer**: A continuous gesture recognizer that interprets pinching gestures involving two touches.\n- **UIRotationGestureRecognizer**: A continuous gesture recognizer that interprets rotation gestures involving two touches.\n- **UISwipeGestureRecognizer**: A discrete gesture recognizer that interprets swiping gestures in one or more directions.\n- **UITapGestureRecognizer**: A discrete gesture recognizer that interprets single or multiple taps.\n\n## Inherits From\n\n- UIPanGestureRecognizer\n\n## Conforms To\n\n- CVarArg\n- CustomDebugStringConvertible\n- CustomStringConvertible\n- Equatable\n- Hashable\n- NSObjectProtocol\n- Sendable\n- SendableMetatype\n\n",
  "sections" : [
    {
      "content" : "",
      "items" : [
        {
          "description" : "The acceptable starting edges for the gesture.",
          "name" : "edges",
          "url" : "https:\/\/developer.apple.com\/documentation\/UIKit\/UIScreenEdgePanGestureRecognizer\/edges"
        },
        {
          "description" : "Constants that specify the edges of a rectangle.",
          "name" : "UIRectEdge",
          "url" : "https:\/\/developer.apple.com\/documentation\/UIKit\/UIRectEdge"
        }
      ],
      "title" : "Specifying the starting edges"
    },
    {
      "content" : "",
      "items" : [
        {
          "description" : "Use gesture recognizers to simplify touch handling and create a consistent user experience.",
          "name" : "Handling UIKit gestures",
          "url" : "https:\/\/developer.apple.com\/documentation\/UIKit\/handling-uikit-gestures"
        },
        {
          "description" : "Discover how to use multiple gesture recognizers on the same view.",
          "name" : "Coordinating multiple gesture recognizers",
          "url" : "https:\/\/developer.apple.com\/documentation\/UIKit\/coordinating-multiple-gesture-recognizers"
        },
        {
          "description" : "Enhance user feedback for your iPadOS app with a hover preview for Apple Pencil input.",
          "name" : "Adopting hover support for Apple Pencil",
          "url" : "https:\/\/developer.apple.com\/documentation\/UIKit\/adopting-hover-support-for-apple-pencil"
        },
        {
          "description" : "Enrich your app’s user experience by supporting standard and custom gesture interaction.",
          "name" : "Supporting gesture interaction in your apps",
          "url" : "https:\/\/developer.apple.com\/documentation\/UIKit\/supporting-gesture-interaction-in-your-apps"
        },
        {
          "description" : "A continuous gesture recognizer that interprets pointer movement over a view.",
          "name" : "UIHoverGestureRecognizer",
          "url" : "https:\/\/developer.apple.com\/documentation\/UIKit\/UIHoverGestureRecognizer"
        },
        {
          "description" : "A continuous gesture recognizer that interprets long-press gestures.",
          "name" : "UILongPressGestureRecognizer",
          "url" : "https:\/\/developer.apple.com\/documentation\/UIKit\/UILongPressGestureRecognizer"
        },
        {
          "description" : "A continuous gesture recognizer that interprets panning gestures.",
          "name" : "UIPanGestureRecognizer",
          "url" : "https:\/\/developer.apple.com\/documentation\/UIKit\/UIPanGestureRecognizer"
        },
        {
          "description" : "A continuous gesture recognizer that interprets pinching gestures involving two touches.",
          "name" : "UIPinchGestureRecognizer",
          "url" : "https:\/\/developer.apple.com\/documentation\/UIKit\/UIPinchGestureRecognizer"
        },
        {
          "description" : "A continuous gesture recognizer that interprets rotation gestures involving two touches.",
          "name" : "UIRotationGestureRecognizer",
          "url" : "https:\/\/developer.apple.com\/documentation\/UIKit\/UIRotationGestureRecognizer"
        },
        {
          "description" : "A discrete gesture recognizer that interprets swiping gestures in one or more directions.",
          "name" : "UISwipeGestureRecognizer",
          "url" : "https:\/\/developer.apple.com\/documentation\/UIKit\/UISwipeGestureRecognizer"
        },
        {
          "description" : "A discrete gesture recognizer that interprets single or multiple taps.",
          "name" : "UITapGestureRecognizer",
          "url" : "https:\/\/developer.apple.com\/documentation\/UIKit\/UITapGestureRecognizer"
        }
      ],
      "title" : "Standard gestures"
    },
    {
      "content" : "",
      "items" : [
        {
          "name" : "UIPanGestureRecognizer"
        }
      ],
      "title" : "Inherits From"
    }
  ],
  "source" : "appleJSON",
  "title" : "UIScreenEdgePanGestureRecognizer",
  "url" : "https:\/\/developer.apple.com\/documentation\/UIKit\/UIScreenEdgePanGestureRecognizer"
}