{
  "abstract" : "Extend the standard drag and drop support for text views to include custom types of content.",
  "codeExamples" : [

  ],
  "contentHash" : "a1691e2a590eed40a936db6b401906d3f025ba00b3331cf56003b9c3dbda0101",
  "crawledAt" : "2025-12-03T05:46:49Z",
  "id" : "86090A49-C9EF-4E2C-BA5F-4BC6CB05F524",
  "kind" : "collection",
  "language" : "swift",
  "module" : "UIKit",
  "overview" : "## Overview\n\nThe [doc:\/\/com.apple.uikit\/documentation\/UIKit\/UITextField] and [doc:\/\/com.apple.uikit\/documentation\/UIKit\/UITextView] classes provide built-in support for dragging and dropping text and images. You can extend this support to your own custom data types by adding a text drag delegate or text drop delegate to your views. Your text drag delegate adopts the [doc:\/\/com.apple.uikit\/documentation\/UIKit\/UITextDragDelegate] protocol and is responsible for providing the items to be dragged. Your text drop delegate adopts the [doc:\/\/com.apple.uikit\/documentation\/UIKit\/UITextDropDelegate] protocol and handles drops containing items with your custom data types.",
  "rawMarkdown" : "---\nsource: https:\/\/developer.apple.com\/documentation\/UIKit\/drag-and-drop-customization\ncrawled: 2025-12-03T05:46:49Z\n---\n\n# Drag and drop customization\n\n**API Collection**\n\nExtend the standard drag and drop support for text views to include custom types of content.\n\n## Overview\n\nThe [doc:\/\/com.apple.uikit\/documentation\/UIKit\/UITextField] and [doc:\/\/com.apple.uikit\/documentation\/UIKit\/UITextView] classes provide built-in support for dragging and dropping text and images. You can extend this support to your own custom data types by adding a text drag delegate or text drop delegate to your views. Your text drag delegate adopts the [doc:\/\/com.apple.uikit\/documentation\/UIKit\/UITextDragDelegate] protocol and is responsible for providing the items to be dragged. Your text drop delegate adopts the [doc:\/\/com.apple.uikit\/documentation\/UIKit\/UITextDropDelegate] protocol and handles drops containing items with your custom data types.\n\n## Text view additions\n\n- **UITextDragDelegate**: The interface for customizing the behavior of a drag activity for a text view.\n- **UITextDropDelegate**: The interface for configuring a text view’s drop behavior.\n- **UITextDraggable**: The interface that determines if a text view is a drag source.\n- **UITextDragOptions**: A set of options that determine the behavior of a draggable text view.\n- **UITextDroppable**: The interface that determines if a text view is a drop destination.\n- **UITextDropEditability**: The text-drop editability styles for noneditable text views.\n\n## Drag content\n\n- **UITextDragRequest**: The interface for describing the attributes of a drag activity originating in a text view.\n- **UITextDragPreviewRenderer**: Renders previews of text dragged by the user.\n\n## Drop management\n\n- **UITextDropRequest**: The interface for specifying the attributes of a drop request for a text view.\n- **UITextDropProposal**: A proposed configuration for the behavior of a text drop interaction.\n- **UITextDropProposal.Action**: The text drop action styles for text views.\n- **UITextDropProposal.Performer**: The performers that are responsible for handling the drop operation.\n- **UITextDropProposal.ProgressMode**: The text drop progress styles for user-visible progress indication.\n\n## Pasteboard support\n\n- **UITextPasteItem**: The interface for obtaining information about, and interacting with, a text item for pasting or dropping.\n- **UISearchTextFieldPasteItem**: A protocol that supports pasting tokens.\n- **UITextPasteDelegate**: The interface for handling pasting and dropping of text, using item providers.\n- **UITextPasteConfigurationSupporting**: The interface for text-oriented responder objects to participate in the unified paste and drop system in iOS.\n\n## Text views\n\n- **UILabel**: A view that displays one or more lines of informational text.\n- **UITextField**: An object that displays an editable text area in your interface.\n- **UITextView**: A scrollable, multiline text region.\n\n",
  "sections" : [
    {
      "content" : "",
      "items" : [
        {
          "description" : "The interface for customizing the behavior of a drag activity for a text view.",
          "name" : "UITextDragDelegate",
          "url" : "https:\/\/developer.apple.com\/documentation\/UIKit\/UITextDragDelegate"
        },
        {
          "description" : "The interface for configuring a text view’s drop behavior.",
          "name" : "UITextDropDelegate",
          "url" : "https:\/\/developer.apple.com\/documentation\/UIKit\/UITextDropDelegate"
        },
        {
          "description" : "The interface that determines if a text view is a drag source.",
          "name" : "UITextDraggable",
          "url" : "https:\/\/developer.apple.com\/documentation\/UIKit\/UITextDraggable"
        },
        {
          "description" : "A set of options that determine the behavior of a draggable text view.",
          "name" : "UITextDragOptions",
          "url" : "https:\/\/developer.apple.com\/documentation\/UIKit\/UITextDragOptions"
        },
        {
          "description" : "The interface that determines if a text view is a drop destination.",
          "name" : "UITextDroppable",
          "url" : "https:\/\/developer.apple.com\/documentation\/UIKit\/UITextDroppable"
        },
        {
          "description" : "The text-drop editability styles for noneditable text views.",
          "name" : "UITextDropEditability",
          "url" : "https:\/\/developer.apple.com\/documentation\/UIKit\/UITextDropEditability"
        }
      ],
      "title" : "Text view additions"
    },
    {
      "content" : "",
      "items" : [
        {
          "description" : "The interface for describing the attributes of a drag activity originating in a text view.",
          "name" : "UITextDragRequest",
          "url" : "https:\/\/developer.apple.com\/documentation\/UIKit\/UITextDragRequest"
        },
        {
          "description" : "Renders previews of text dragged by the user.",
          "name" : "UITextDragPreviewRenderer",
          "url" : "https:\/\/developer.apple.com\/documentation\/UIKit\/UITextDragPreviewRenderer"
        }
      ],
      "title" : "Drag content"
    },
    {
      "content" : "",
      "items" : [
        {
          "description" : "The interface for specifying the attributes of a drop request for a text view.",
          "name" : "UITextDropRequest",
          "url" : "https:\/\/developer.apple.com\/documentation\/UIKit\/UITextDropRequest"
        },
        {
          "description" : "A proposed configuration for the behavior of a text drop interaction.",
          "name" : "UITextDropProposal",
          "url" : "https:\/\/developer.apple.com\/documentation\/UIKit\/UITextDropProposal"
        },
        {
          "description" : "The text drop action styles for text views.",
          "name" : "UITextDropProposal.Action",
          "url" : "https:\/\/developer.apple.com\/documentation\/UIKit\/UITextDropProposal\/Action"
        },
        {
          "description" : "The performers that are responsible for handling the drop operation.",
          "name" : "UITextDropProposal.Performer",
          "url" : "https:\/\/developer.apple.com\/documentation\/UIKit\/UITextDropProposal\/Performer"
        },
        {
          "description" : "The text drop progress styles for user-visible progress indication.",
          "name" : "UITextDropProposal.ProgressMode",
          "url" : "https:\/\/developer.apple.com\/documentation\/UIKit\/UITextDropProposal\/ProgressMode"
        }
      ],
      "title" : "Drop management"
    },
    {
      "content" : "",
      "items" : [
        {
          "description" : "The interface for obtaining information about, and interacting with, a text item for pasting or dropping.",
          "name" : "UITextPasteItem",
          "url" : "https:\/\/developer.apple.com\/documentation\/UIKit\/UITextPasteItem"
        },
        {
          "description" : "A protocol that supports pasting tokens.",
          "name" : "UISearchTextFieldPasteItem",
          "url" : "https:\/\/developer.apple.com\/documentation\/UIKit\/UISearchTextFieldPasteItem"
        },
        {
          "description" : "The interface for handling pasting and dropping of text, using item providers.",
          "name" : "UITextPasteDelegate",
          "url" : "https:\/\/developer.apple.com\/documentation\/UIKit\/UITextPasteDelegate"
        },
        {
          "description" : "The interface for text-oriented responder objects to participate in the unified paste and drop system in iOS.",
          "name" : "UITextPasteConfigurationSupporting",
          "url" : "https:\/\/developer.apple.com\/documentation\/UIKit\/UITextPasteConfigurationSupporting"
        }
      ],
      "title" : "Pasteboard support"
    },
    {
      "content" : "",
      "items" : [
        {
          "description" : "A view that displays one or more lines of informational text.",
          "name" : "UILabel",
          "url" : "https:\/\/developer.apple.com\/documentation\/UIKit\/UILabel"
        },
        {
          "description" : "An object that displays an editable text area in your interface.",
          "name" : "UITextField",
          "url" : "https:\/\/developer.apple.com\/documentation\/UIKit\/UITextField"
        },
        {
          "description" : "A scrollable, multiline text region.",
          "name" : "UITextView",
          "url" : "https:\/\/developer.apple.com\/documentation\/UIKit\/UITextView"
        }
      ],
      "title" : "Text views"
    }
  ],
  "source" : "appleJSON",
  "title" : "Drag and drop customization",
  "url" : "https:\/\/developer.apple.com\/documentation\/UIKit\/drag-and-drop-customization"
}