{
  "abstract" : "The behavior that specifies how a new scene joins a scene collection.",
  "codeExamples" : [

  ],
  "contentHash" : "89e86f3f7efa273f33eec5ddfe8e157fc4098be25d8980d626975f904e660c2f",
  "crawledAt" : "2025-12-03T18:49:32Z",
  "declaration" : {
    "code" : "@MainActor var collectionJoinBehavior: UISceneCollectionJoinBehavior { get set }",
    "language" : "swift"
  },
  "id" : "288A39A5-8AE8-4B55-9E4D-FFBB93E3E242",
  "kind" : "property",
  "language" : "swift",
  "module" : "UIKit",
  "overview" : "## Discussion\n\nA scene collection is a group of scenes that display together. In apps built with Mac Catalyst, you use this behavior to add windows to an [doc:\/\/com.apple.documentation\/documentation\/AppKit\/NSWindowTabGroup].",
  "platforms" : [
    "Mac Catalyst"
  ],
  "rawMarkdown" : "---\nsource: https:\/\/developer.apple.com\/documentation\/UIKit\/UIScene\/ActivationRequestOptions\/collectionJoinBehavior\ncrawled: 2025-12-03T18:49:32Z\n---\n\n# collectionJoinBehavior\n\n**Instance Property**\n\nThe behavior that specifies how a new scene joins a scene collection.\n\n## Declaration\n\n```swift\n@MainActor var collectionJoinBehavior: UISceneCollectionJoinBehavior { get set }\n```\n\n## Discussion\n\nA scene collection is a group of scenes that display together. In apps built with Mac Catalyst, you use this behavior to add windows to an [doc:\/\/com.apple.documentation\/documentation\/AppKit\/NSWindowTabGroup].\n\n## Specifying collection join behavior\n\n- **UISceneCollectionJoinBehavior**: A set of behaviors that specify how a new scene joins a scene collection.\n\n",
  "sections" : [
    {
      "content" : "",
      "items" : [
        {
          "description" : "A set of behaviors that specify how a new scene joins a scene collection.",
          "name" : "UISceneCollectionJoinBehavior",
          "url" : "https:\/\/developer.apple.com\/documentation\/UIKit\/UISceneCollectionJoinBehavior"
        }
      ],
      "title" : "Specifying collection join behavior"
    }
  ],
  "source" : "appleJSON",
  "title" : "collectionJoinBehavior",
  "url" : "https:\/\/developer.apple.com\/documentation\/UIKit\/UIScene\/ActivationRequestOptions\/collectionJoinBehavior"
}