{
  "abstract" : "The identifier of the most recently selected detent.",
  "codeExamples" : [

  ],
  "contentHash" : "86f9b91ba81c0db71625653be29c91a023019d7ac8f4f29ba928f8f6104c203a",
  "crawledAt" : "2025-12-02T21:08:12Z",
  "declaration" : {
    "code" : "@MainActor var selectedDetentIdentifier: UISheetPresentationController.Detent.Identifier? { get set }",
    "language" : "swift"
  },
  "id" : "50A12EF9-99B1-40D0-A570-6FC6A9FA04CC",
  "kind" : "property",
  "language" : "swift",
  "module" : "UIKit",
  "overview" : "## Discussion\n\nThis property represents the most recent detent that the user selects or that you set programmatically. The default value is `nil`, which means the sheet displays at the smallest detent you specify in [doc:\/\/com.apple.uikit\/documentation\/UIKit\/UISheetPresentationController\/detents].",
  "platforms" : [
    "iOS",
    "iPadOS",
    "Mac Catalyst"
  ],
  "rawMarkdown" : "---\nsource: https:\/\/developer.apple.com\/documentation\/UIKit\/UISheetPresentationController\/selectedDetentIdentifier\ncrawled: 2025-12-02T21:08:12Z\n---\n\n# selectedDetentIdentifier\n\n**Instance Property**\n\nThe identifier of the most recently selected detent.\n\n## Declaration\n\n```swift\n@MainActor var selectedDetentIdentifier: UISheetPresentationController.Detent.Identifier? { get set }\n```\n\n## Discussion\n\nThis property represents the most recent detent that the user selects or that you set programmatically. The default value is `nil`, which means the sheet displays at the smallest detent you specify in [doc:\/\/com.apple.uikit\/documentation\/UIKit\/UISheetPresentationController\/detents].\n\n## Specifying the height\n\n- **detents**: The array of heights where a sheet can rest.\n- **UISheetPresentationController.Detent**: An object that represents a height where a sheet naturally rests.\n\n",
  "sections" : [
    {
      "content" : "",
      "items" : [
        {
          "description" : "The array of heights where a sheet can rest.",
          "name" : "detents",
          "url" : "https:\/\/developer.apple.com\/documentation\/UIKit\/UISheetPresentationController\/detents"
        },
        {
          "description" : "An object that represents a height where a sheet naturally rests.",
          "name" : "UISheetPresentationController.Detent",
          "url" : "https:\/\/developer.apple.com\/documentation\/UIKit\/UISheetPresentationController\/Detent"
        }
      ],
      "title" : "Specifying the height"
    }
  ],
  "source" : "appleJSON",
  "title" : "selectedDetentIdentifier",
  "url" : "https:\/\/developer.apple.com\/documentation\/UIKit\/UISheetPresentationController\/selectedDetentIdentifier"
}