{
  "abstract" : "The array of heights where a sheet can rest.",
  "codeExamples" : [

  ],
  "contentHash" : "1d39caa104df00fc268f48918d78ed7822a0bd0e27571df2550946fcc8a1988d",
  "crawledAt" : "2025-12-01T01:10:42Z",
  "declaration" : {
    "code" : "@MainActor var detents: [UISheetPresentationController.Detent] { get set }",
    "language" : "swift"
  },
  "id" : "E91E1794-99FF-4154-A59B-EFB3A5A4CDB2",
  "kind" : "property",
  "module" : "UIKit",
  "overview" : "## Discussion\n\nThe default value is an array that contains the value [doc:\/\/com.apple.uikit\/documentation\/UIKit\/UISheetPresentationController\/Detent\/large()]. This array must contain at least one element. When you set this value, specify detents in order from smallest to largest height.",
  "platforms" : [
    "iOS",
    "iPadOS",
    "Mac Catalyst"
  ],
  "rawMarkdown" : "---\nsource: https:\/\/developer.apple.com\/documentation\/UIKit\/UISheetPresentationController\/detents\ncrawled: 2025-12-01T01:10:42Z\n---\n\n# detents\n\n**Instance Property**\n\nThe array of heights where a sheet can rest.\n\n## Declaration\n\n```swift\n@MainActor var detents: [UISheetPresentationController.Detent] { get set }\n```\n\n## Discussion\n\nThe default value is an array that contains the value [doc:\/\/com.apple.uikit\/documentation\/UIKit\/UISheetPresentationController\/Detent\/large()]. This array must contain at least one element. When you set this value, specify detents in order from smallest to largest height.\n\n## Specifying the height\n\n- **selectedDetentIdentifier**: The identifier of the most recently selected detent.\n- **UISheetPresentationController.Detent**: An object that represents a height where a sheet naturally rests.\n\n",
  "sections" : [
    {
      "content" : "",
      "items" : [
        {
          "description" : "The identifier of the most recently selected detent.",
          "name" : "selectedDetentIdentifier",
          "url" : "https:\/\/developer.apple.com\/documentation\/UIKit\/UISheetPresentationController\/selectedDetentIdentifier"
        },
        {
          "description" : "An object that represents a height where a sheet naturally rests.",
          "name" : "UISheetPresentationController.Detent",
          "url" : "https:\/\/developer.apple.com\/documentation\/UIKit\/UISheetPresentationController\/Detent"
        }
      ],
      "title" : "Specifying the height"
    }
  ],
  "source" : "appleJSON",
  "title" : "detents",
  "url" : "https:\/\/developer.apple.com\/documentation\/UIKit\/UISheetPresentationController\/detents"
}