{
  "abstract" : "A control that displays one or more buttons in a tab bar for selecting between different subtasks, views, or modes in an app.",
  "codeExamples" : [

  ],
  "conformsTo" : [
    "CALayerDelegate",
    "CVarArg",
    "Copyable",
    "CustomDebugStringConvertible",
    "CustomStringConvertible",
    "Equatable",
    "Hashable",
    "NSCoding",
    "NSObjectProtocol",
    "NSTouchBarProvider",
    "Sendable",
    "SendableMetatype",
    "UIAccessibilityIdentification",
    "UIActivityItemsConfigurationProviding",
    "UIAppearance",
    "UIAppearanceContainer",
    "UICoordinateSpace",
    "UIDynamicItem",
    "UIFocusEnvironment",
    "UIFocusItem",
    "UIFocusItemContainer",
    "UILargeContentViewerItem",
    "UIPasteConfigurationSupporting",
    "UIPopoverPresentationControllerSourceItem",
    "UIResponderStandardEditActions",
    "UISpringLoadedInteractionSupporting",
    "UITraitChangeObservable",
    "UITraitEnvironment",
    "UIUserActivityRestoring"
  ],
  "contentHash" : "58d998765972b0f9ee46d9b4145837b3d60b7df03fba6c3361992389261c43e0",
  "crawledAt" : "2025-12-04T10:17:02Z",
  "declaration" : {
    "code" : "@MainActor class UITabBar",
    "language" : "swift"
  },
  "id" : "335D4FBF-A3C8-4FC2-920F-71A9027DBBAC",
  "kind" : "class",
  "language" : "swift",
  "module" : "UIKit",
  "overview" : "## Overview\n\nTypically, you use tab bars in conjunction with a [doc:\/\/com.apple.uikit\/documentation\/UIKit\/UITabBarController] object, but you can also use them as standalone controls in your app. Tab bars always appear across the bottom edge of the screen and display the contents of one or more [doc:\/\/com.apple.uikit\/documentation\/UIKit\/UITabBarItem] objects. A tab bar’s appearance can be customized with a background image or tint color to suit the needs of your interface. Tapping an item selects and highlights that item, and you use the selection of the item to enable the corresponding mode for your app.\n\nYou can configure tab bars programmatically or in Interface Builder. A [doc:\/\/com.apple.uikit\/documentation\/UIKit\/UITabBarController] object provides its own tab bar object and you must configure the object provided to you. When creating a tab bar programmatically, use the [doc:\/\/com.apple.uikit\/documentation\/UIKit\/UIView\/init(frame:)] method or another view initializer method to set its initial configuration. Use the methods of this class to configure the appearance of the tab bar. For tab bars you create yourself, you also use the methods of this class to specify the items displayed by the tab bar.\n\nA tab bar reports selections and user customizations to its delegate object. For tab bars you create yourself, use the delegate to respond to selections or to the addition, removal, or reordering of items in the tab bar. (A [doc:\/\/com.apple.uikit\/documentation\/UIKit\/UITabBarController] object acts as the delegate for the tab bar it manages.) For more information on implementing a tab bar delegate, see [doc:\/\/com.apple.uikit\/documentation\/UIKit\/UITabBarDelegate].\n\n### Configure the tab bar items\n\nYou can configure tab bar items using Interface Builder or create and configure them programmatically in your code. Tab bars in Interface Builder come preconfigured with some initial items and you can add, remove, or reorder items as needed. How you configure items at design time depends on whether your tab bar is associated with a [doc:\/\/com.apple.uikit\/documentation\/UIKit\/UITabBarController] object:\n\nA tab bar displays all of its tabs onscreen at once, using the [doc:\/\/com.apple.uikit\/documentation\/UIKit\/UITabBar\/itemPositioning-swift.property] property to determine how to position items in the available space. If you have more items than can fit in the available space, display only a subset of them and let the user select which tabs are displayed. The [doc:\/\/com.apple.uikit\/documentation\/UIKit\/UITabBar\/beginCustomizingItems(_:)] method displays an interface for selecting which tab bar items to display.\n\nThe contents of each item are stored in a [doc:\/\/com.apple.uikit\/documentation\/UIKit\/UITabBarItem] object. Each item contains a title and an image to display in the tab. You can also use tab bar items to add a badge to the corresponding tab. For more information about creating and configuring items, see [doc:\/\/com.apple.uikit\/documentation\/UIKit\/UITabBarItem].\n\n### Respond to tab selections\n\nFor tab bars with an associated tab bar controller, the tab bar controller automatically manages selections and displays the appropriate view controller. The only time you have to manage selections yourself is when you create the tab bar without a tab bar controller. The tab bar reports selections to the [doc:\/\/com.apple.uikit\/documentation\/UIKit\/UITabBarDelegate\/tabBar(_:didSelect:)] method of its [doc:\/\/com.apple.uikit\/documentation\/UIKit\/UITabBar\/delegate] object, which you can use to respond to selection changes. For more information about implementing the delegate object, see [doc:\/\/com.apple.uikit\/documentation\/UIKit\/UITabBarDelegate].\n\n### Configure a tab bar with Interface Builder\n\nThe following table lists the attributes that you configure for tab bars in Interface Builder.\n\n### Internationalize a tab bar\n\nTo internationalize a tab bar, you must provide localized strings for the tab bar item titles.\n\nFor more information, see `Localization`.\n\n### Make a tab bar accessible\n\nTab bars are accessible by default.\n\nWith VoiceOver enabled on an iOS device, when a user touches a tab in a tab bar, VoiceOver reads the title of the tab, its position in the bar, and whether it’s selected. For example in the iTunes app on iPad, you might hear “Selected, Audiobooks, four of seven” or “Genius, six of seven.”\n\nFor general information about making your interface accessible, see [doc:\/\/com.apple.uikit\/documentation\/UIKit\/accessibility-for-uikit].\n\nFor design guidance, see [https:\/\/developer.apple.com\/design\/human-interface-guidelines\/components\/navigation-and-search\/tab-bars].",
  "platforms" : [
    "iOS",
    "iPadOS",
    "Mac Catalyst",
    "tvOS",
    "visionOS"
  ],
  "rawMarkdown" : "---\nsource: https:\/\/developer.apple.com\/documentation\/uikit\/uitabbar\ncrawled: 2025-12-04T10:17:02Z\n---\n\n# UITabBar\n\n**Class**\n\nA control that displays one or more buttons in a tab bar for selecting between different subtasks, views, or modes in an app.\n\n## Declaration\n\n```swift\n@MainActor class UITabBar\n```\n\n## Overview\n\nTypically, you use tab bars in conjunction with a [doc:\/\/com.apple.uikit\/documentation\/UIKit\/UITabBarController] object, but you can also use them as standalone controls in your app. Tab bars always appear across the bottom edge of the screen and display the contents of one or more [doc:\/\/com.apple.uikit\/documentation\/UIKit\/UITabBarItem] objects. A tab bar’s appearance can be customized with a background image or tint color to suit the needs of your interface. Tapping an item selects and highlights that item, and you use the selection of the item to enable the corresponding mode for your app.\n\nYou can configure tab bars programmatically or in Interface Builder. A [doc:\/\/com.apple.uikit\/documentation\/UIKit\/UITabBarController] object provides its own tab bar object and you must configure the object provided to you. When creating a tab bar programmatically, use the [doc:\/\/com.apple.uikit\/documentation\/UIKit\/UIView\/init(frame:)] method or another view initializer method to set its initial configuration. Use the methods of this class to configure the appearance of the tab bar. For tab bars you create yourself, you also use the methods of this class to specify the items displayed by the tab bar.\n\n\n\nA tab bar reports selections and user customizations to its delegate object. For tab bars you create yourself, use the delegate to respond to selections or to the addition, removal, or reordering of items in the tab bar. (A [doc:\/\/com.apple.uikit\/documentation\/UIKit\/UITabBarController] object acts as the delegate for the tab bar it manages.) For more information on implementing a tab bar delegate, see [doc:\/\/com.apple.uikit\/documentation\/UIKit\/UITabBarDelegate].\n\n### Configure the tab bar items\n\nYou can configure tab bar items using Interface Builder or create and configure them programmatically in your code. Tab bars in Interface Builder come preconfigured with some initial items and you can add, remove, or reorder items as needed. How you configure items at design time depends on whether your tab bar is associated with a [doc:\/\/com.apple.uikit\/documentation\/UIKit\/UITabBarController] object:\n\n- Configuring your tab bar in Interface Builder:\n- When a [doc:\/\/com.apple.uikit\/documentation\/UIKit\/UITabBarController] object is present, add or remove view controllers to your scene and create relationship segues between the tab bar controller and each new view controller. Creating a relationship segue automatically adds a new item to the tab bar, and deleting an existing relationship segue removes the corresponding tab bar item.\n- When a tab bar controller isn’t present, drag tab bar items from the library onto your tab bar.\n- Configuring your tab bar programmatically:\n- To configure the tab bar associated with a [doc:\/\/com.apple.uikit\/documentation\/UIKit\/UITabBarController] object, configure the view controllers associated with the tab bar controller. The tab bar automatically obtains its items from the [doc:\/\/com.apple.uikit\/documentation\/UIKit\/UIViewController\/tabBarItem] property of each view controller associated with the tab bar controller.\n- To configure tab bar items directly, use the [doc:\/\/com.apple.uikit\/documentation\/UIKit\/UITabBar\/setItems(_:animated:)] method of the tab bar itself.\n\nA tab bar displays all of its tabs onscreen at once, using the [doc:\/\/com.apple.uikit\/documentation\/UIKit\/UITabBar\/itemPositioning-swift.property] property to determine how to position items in the available space. If you have more items than can fit in the available space, display only a subset of them and let the user select which tabs are displayed. The [doc:\/\/com.apple.uikit\/documentation\/UIKit\/UITabBar\/beginCustomizingItems(_:)] method displays an interface for selecting which tab bar items to display.\n\nThe contents of each item are stored in a [doc:\/\/com.apple.uikit\/documentation\/UIKit\/UITabBarItem] object. Each item contains a title and an image to display in the tab. You can also use tab bar items to add a badge to the corresponding tab. For more information about creating and configuring items, see [doc:\/\/com.apple.uikit\/documentation\/UIKit\/UITabBarItem].\n\n### Respond to tab selections\n\nFor tab bars with an associated tab bar controller, the tab bar controller automatically manages selections and displays the appropriate view controller. The only time you have to manage selections yourself is when you create the tab bar without a tab bar controller. The tab bar reports selections to the [doc:\/\/com.apple.uikit\/documentation\/UIKit\/UITabBarDelegate\/tabBar(_:didSelect:)] method of its [doc:\/\/com.apple.uikit\/documentation\/UIKit\/UITabBar\/delegate] object, which you can use to respond to selection changes. For more information about implementing the delegate object, see [doc:\/\/com.apple.uikit\/documentation\/UIKit\/UITabBarDelegate].\n\n### Configure a tab bar with Interface Builder\n\nThe following table lists the attributes that you configure for tab bars in Interface Builder.\n\n\n\n### Internationalize a tab bar\n\nTo internationalize a tab bar, you must provide localized strings for the tab bar item titles.\n\nFor more information, see `Localization`.\n\n### Make a tab bar accessible\n\nTab bars are accessible by default.\n\nWith VoiceOver enabled on an iOS device, when a user touches a tab in a tab bar, VoiceOver reads the title of the tab, its position in the bar, and whether it’s selected. For example in the iTunes app on iPad, you might hear “Selected, Audiobooks, four of seven” or “Genius, six of seven.”\n\nFor general information about making your interface accessible, see [doc:\/\/com.apple.uikit\/documentation\/UIKit\/accessibility-for-uikit].\n\nFor design guidance, see [https:\/\/developer.apple.com\/design\/human-interface-guidelines\/components\/navigation-and-search\/tab-bars].\n\n## Customizing the tab bar behavior\n\n- **delegate**: The tab bar’s delegate object.\n- **UITabBarDelegate**: The [doc:\/\/com.apple.uikit\/documentation\/UIKit\/UITabBarDelegate] protocol defines optional methods for a delegate of a [doc:\/\/com.apple.uikit\/documentation\/UIKit\/UITabBar] object. The [doc:\/\/com.apple.uikit\/documentation\/UIKit\/UITabBar] class provides the ability for the user to reorder, remove, and add items to the tab bar; this process is referred to as customizing the tab bar. The tab bar delegate receives messages when customizing occurs.\n\n## Configuring tab bar items\n\n- **items**: The items displayed by the tab bar.\n- **setItems(_:animated:)**: Sets the items on the tab bar, optionally animating any changes into position.\n- **selectedItem**: The currently selected item on the tab bar.\n\n## Customizing tab bar appearance\n\n- **standardAppearance**: The appearance settings for a standard-height tab bar.\n- **scrollEdgeAppearance**: The appearance settings for the tab bar when the edge of scrollable content aligns with the edge of the tab bar.\n- **leadingAccessoryView**: The view at the leading edge of a tab bar on tvOS.\n- **trailingAccessoryView**: The view at the trailing edge of a tab bar on tvOS.\n- **isTranslucent**: A Boolean value that indicates whether the tab bar is translucent.\n- **Legacy customizations**: Customize appearance information directly on the tab bar object.\n\n## Supporting user customization of tab bars\n\n- **beginCustomizingItems(_:)**: Presents a standard interface that lets the user customize the contents of the tab bar.\n- **endCustomizing(animated:)**: Dismisses the standard interface used to customize the tab bar.\n- **isCustomizing**: A Boolean value indicating whether the user is currently customizing the tab bar.\n\n## Container view controllers\n\n- **Creating a custom container view controller**: Create a composite interface by combining content from one or more view controllers with other custom views.\n- **UISplitViewController**: A container view controller that implements a hierarchical interface.\n- **UINavigationController**: A container view controller that defines a stack-based scheme for navigating hierarchical content.\n- **UINavigationBar**: Navigational controls that display in a bar along the top of the screen, usually in conjunction with a navigation controller.\n- **UINavigationItem**: The items that a navigation bar displays when the associated view controller is visible.\n- **UITabBarController**: A container view controller that manages a multiselection interface, where the selection determines which child view controller to display.\n- **UITabBarItem**: An object that describes an item in a tab bar.\n- **UITab**: An object that manages a tab in a tab bar.\n- **UITabAccessory**\n- **UISearchTab**: A tab subclass that represents the system’s search tab.\n- **UITabGroup**: An object that manages a collection of tab objects.\n- **UIPageViewController**: A container view controller that manages navigation between pages of content, where a subview controller manages each page.\n\n## Inherits From\n\n- UIView\n\n## Conforms To\n\n- CALayerDelegate\n- CVarArg\n- Copyable\n- CustomDebugStringConvertible\n- CustomStringConvertible\n- Equatable\n- Hashable\n- NSCoding\n- NSObjectProtocol\n- NSTouchBarProvider\n- Sendable\n- SendableMetatype\n- UIAccessibilityIdentification\n- UIActivityItemsConfigurationProviding\n- UIAppearance\n- UIAppearanceContainer\n- UICoordinateSpace\n- UIDynamicItem\n- UIFocusEnvironment\n- UIFocusItem\n- UIFocusItemContainer\n- UILargeContentViewerItem\n- UIPasteConfigurationSupporting\n- UIPopoverPresentationControllerSourceItem\n- UIResponderStandardEditActions\n- UISpringLoadedInteractionSupporting\n- UITraitChangeObservable\n- UITraitEnvironment\n- UIUserActivityRestoring\n\n",
  "sections" : [
    {
      "content" : "",
      "items" : [
        {
          "description" : "The tab bar’s delegate object.",
          "name" : "delegate",
          "url" : "https:\/\/developer.apple.com\/documentation\/UIKit\/UITabBar\/delegate"
        },
        {
          "description" : "The [doc:\/\/com.apple.uikit\/documentation\/UIKit\/UITabBarDelegate] protocol defines optional methods for a delegate of a [doc:\/\/com.apple.uikit\/documentation\/UIKit\/UITabBar] object. The [doc:\/\/com.apple.uikit\/documentation\/UIKit\/UITabBar] class provides the ability for the user to reorder, remove, and add items to the tab bar; this process is referred to as customizing the tab bar. The tab bar delegate receives messages when customizing occurs.",
          "name" : "UITabBarDelegate",
          "url" : "https:\/\/developer.apple.com\/documentation\/UIKit\/UITabBarDelegate"
        }
      ],
      "title" : "Customizing the tab bar behavior"
    },
    {
      "content" : "",
      "items" : [
        {
          "description" : "The items displayed by the tab bar.",
          "name" : "items",
          "url" : "https:\/\/developer.apple.com\/documentation\/UIKit\/UITabBar\/items"
        },
        {
          "description" : "Sets the items on the tab bar, optionally animating any changes into position.",
          "name" : "setItems(_:animated:)",
          "url" : "https:\/\/developer.apple.com\/documentation\/UIKit\/UITabBar\/setItems(_:animated:)"
        },
        {
          "description" : "The currently selected item on the tab bar.",
          "name" : "selectedItem",
          "url" : "https:\/\/developer.apple.com\/documentation\/UIKit\/UITabBar\/selectedItem"
        }
      ],
      "title" : "Configuring tab bar items"
    },
    {
      "content" : "",
      "items" : [
        {
          "description" : "The appearance settings for a standard-height tab bar.",
          "name" : "standardAppearance",
          "url" : "https:\/\/developer.apple.com\/documentation\/UIKit\/UITabBar\/standardAppearance"
        },
        {
          "description" : "The appearance settings for the tab bar when the edge of scrollable content aligns with the edge of the tab bar.",
          "name" : "scrollEdgeAppearance",
          "url" : "https:\/\/developer.apple.com\/documentation\/UIKit\/UITabBar\/scrollEdgeAppearance"
        },
        {
          "description" : "The view at the leading edge of a tab bar on tvOS.",
          "name" : "leadingAccessoryView",
          "url" : "https:\/\/developer.apple.com\/documentation\/UIKit\/UITabBar\/leadingAccessoryView"
        },
        {
          "description" : "The view at the trailing edge of a tab bar on tvOS.",
          "name" : "trailingAccessoryView",
          "url" : "https:\/\/developer.apple.com\/documentation\/UIKit\/UITabBar\/trailingAccessoryView"
        },
        {
          "description" : "A Boolean value that indicates whether the tab bar is translucent.",
          "name" : "isTranslucent",
          "url" : "https:\/\/developer.apple.com\/documentation\/UIKit\/UITabBar\/isTranslucent"
        },
        {
          "description" : "Customize appearance information directly on the tab bar object.",
          "name" : "Legacy customizations",
          "url" : "https:\/\/developer.apple.com\/documentation\/UIKit\/uitabbar-legacy-customizations"
        }
      ],
      "title" : "Customizing tab bar appearance"
    },
    {
      "content" : "",
      "items" : [
        {
          "description" : "Presents a standard interface that lets the user customize the contents of the tab bar.",
          "name" : "beginCustomizingItems(_:)",
          "url" : "https:\/\/developer.apple.com\/documentation\/UIKit\/UITabBar\/beginCustomizingItems(_:)"
        },
        {
          "description" : "Dismisses the standard interface used to customize the tab bar.",
          "name" : "endCustomizing(animated:)",
          "url" : "https:\/\/developer.apple.com\/documentation\/UIKit\/UITabBar\/endCustomizing(animated:)"
        },
        {
          "description" : "A Boolean value indicating whether the user is currently customizing the tab bar.",
          "name" : "isCustomizing",
          "url" : "https:\/\/developer.apple.com\/documentation\/UIKit\/UITabBar\/isCustomizing"
        }
      ],
      "title" : "Supporting user customization of tab bars"
    },
    {
      "content" : "",
      "items" : [
        {
          "description" : "Create a composite interface by combining content from one or more view controllers with other custom views.",
          "name" : "Creating a custom container view controller",
          "url" : "https:\/\/developer.apple.com\/documentation\/UIKit\/creating-a-custom-container-view-controller"
        },
        {
          "description" : "A container view controller that implements a hierarchical interface.",
          "name" : "UISplitViewController",
          "url" : "https:\/\/developer.apple.com\/documentation\/UIKit\/UISplitViewController"
        },
        {
          "description" : "A container view controller that defines a stack-based scheme for navigating hierarchical content.",
          "name" : "UINavigationController",
          "url" : "https:\/\/developer.apple.com\/documentation\/UIKit\/UINavigationController"
        },
        {
          "description" : "Navigational controls that display in a bar along the top of the screen, usually in conjunction with a navigation controller.",
          "name" : "UINavigationBar",
          "url" : "https:\/\/developer.apple.com\/documentation\/UIKit\/UINavigationBar"
        },
        {
          "description" : "The items that a navigation bar displays when the associated view controller is visible.",
          "name" : "UINavigationItem",
          "url" : "https:\/\/developer.apple.com\/documentation\/UIKit\/UINavigationItem"
        },
        {
          "description" : "A container view controller that manages a multiselection interface, where the selection determines which child view controller to display.",
          "name" : "UITabBarController",
          "url" : "https:\/\/developer.apple.com\/documentation\/UIKit\/UITabBarController"
        },
        {
          "description" : "An object that describes an item in a tab bar.",
          "name" : "UITabBarItem",
          "url" : "https:\/\/developer.apple.com\/documentation\/UIKit\/UITabBarItem"
        },
        {
          "description" : "An object that manages a tab in a tab bar.",
          "name" : "UITab",
          "url" : "https:\/\/developer.apple.com\/documentation\/UIKit\/UITab"
        },
        {
          "description" : "",
          "name" : "UITabAccessory",
          "url" : "https:\/\/developer.apple.com\/documentation\/UIKit\/UITabAccessory"
        },
        {
          "description" : "A tab subclass that represents the system’s search tab.",
          "name" : "UISearchTab",
          "url" : "https:\/\/developer.apple.com\/documentation\/UIKit\/UISearchTab"
        },
        {
          "description" : "An object that manages a collection of tab objects.",
          "name" : "UITabGroup",
          "url" : "https:\/\/developer.apple.com\/documentation\/UIKit\/UITabGroup"
        },
        {
          "description" : "A container view controller that manages navigation between pages of content, where a subview controller manages each page.",
          "name" : "UIPageViewController",
          "url" : "https:\/\/developer.apple.com\/documentation\/UIKit\/UIPageViewController"
        }
      ],
      "title" : "Container view controllers"
    },
    {
      "content" : "",
      "items" : [
        {
          "name" : "UIView"
        }
      ],
      "title" : "Inherits From"
    }
  ],
  "source" : "appleJSON",
  "title" : "UITabBar",
  "url" : "https:\/\/developer.apple.com\/documentation\/uikit\/uitabbar"
}