{
  "abstract" : "The view that displays above the table’s content.",
  "codeExamples" : [

  ],
  "contentHash" : "36c30d1b2de35c92e93f0a3e1fc6c525cee1e72b623dcb3531b2eddf0cb82b21",
  "crawledAt" : "2025-12-01T22:51:59Z",
  "declaration" : {
    "code" : "@MainActor var tableHeaderView: UIView? { get set }",
    "language" : "swift"
  },
  "id" : "E9F519CA-BC99-43D2-89A3-8E94958589B0",
  "kind" : "property",
  "module" : "UIKit",
  "overview" : "## Discussion\n\nUse this property to specify a header view for your entire table. The header view is the first item to appear in the table’s view’s scrolling content, and it’s separate from the header views you add to individual sections. The default value of this property is `nil`.\n\nWhen assigning a view to this property, set the height of that view to a nonzero value. The table view respects only the height of your view’s frame rectangle; it adjusts the width of your header view automatically to match the table view’s width.",
  "platforms" : [
    "iOS",
    "iPadOS",
    "Mac Catalyst",
    "tvOS",
    "visionOS"
  ],
  "rawMarkdown" : "---\nsource: https:\/\/developer.apple.com\/documentation\/UIKit\/UITableView\/tableHeaderView\ncrawled: 2025-12-01T22:51:59Z\n---\n\n# tableHeaderView\n\n**Instance Property**\n\nThe view that displays above the table’s content.\n\n## Declaration\n\n```swift\n@MainActor var tableHeaderView: UIView? { get set }\n```\n\n## Discussion\n\nUse this property to specify a header view for your entire table. The header view is the first item to appear in the table’s view’s scrolling content, and it’s separate from the header views you add to individual sections. The default value of this property is `nil`.\n\nWhen assigning a view to this property, set the height of that view to a nonzero value. The table view respects only the height of your view’s frame rectangle; it adjusts the width of your header view automatically to match the table view’s width.\n\n## Related Documentation\n\n- **sectionHeaderHeight**: The height of section headers in the table view.\n\n## Configuring the table’s appearance\n\n- **style**: The style of the table view.\n- **UITableView.Style**: Constants for the table view styles.\n- **tableFooterView**: The view that displays below the table’s content.\n- **backgroundView**: The background view of the table view.\n\n",
  "sections" : [
    {
      "content" : "",
      "items" : [
        {
          "description" : "The height of section headers in the table view.",
          "name" : "sectionHeaderHeight",
          "url" : "https:\/\/developer.apple.com\/documentation\/UIKit\/UITableView\/sectionHeaderHeight"
        }
      ],
      "title" : "Related Documentation"
    },
    {
      "content" : "",
      "items" : [
        {
          "description" : "The style of the table view.",
          "name" : "style",
          "url" : "https:\/\/developer.apple.com\/documentation\/UIKit\/UITableView\/style-swift.property"
        },
        {
          "description" : "Constants for the table view styles.",
          "name" : "UITableView.Style",
          "url" : "https:\/\/developer.apple.com\/documentation\/UIKit\/UITableView\/Style-swift.enum"
        },
        {
          "description" : "The view that displays below the table’s content.",
          "name" : "tableFooterView",
          "url" : "https:\/\/developer.apple.com\/documentation\/UIKit\/UITableView\/tableFooterView"
        },
        {
          "description" : "The background view of the table view.",
          "name" : "backgroundView",
          "url" : "https:\/\/developer.apple.com\/documentation\/UIKit\/UITableView\/backgroundView"
        }
      ],
      "title" : "Configuring the table’s appearance"
    }
  ],
  "source" : "appleJSON",
  "title" : "tableHeaderView",
  "url" : "https:\/\/developer.apple.com\/documentation\/UIKit\/UITableView\/tableHeaderView"
}