{
  "abstract" : "Tells the delegate when the user starts using a two-finger pan gesture to select multiple items in a collection view.",
  "codeExamples" : [
    {
      "code" : "func collectionView(_ collectionView: UICollectionView, didBeginMultipleSelectionInteractionAt indexPath: IndexPath) {\n    \/\/ Replace the Select button with Done, and put the \n    \/\/ collection view into editing mode.\n    setEditing(true, animated: true)\n}",
      "language" : "swift"
    }
  ],
  "contentHash" : "ed305cf5c08b0f1acfc40bb6b7e94c40fe11b6cda4f60c9fbbb75f5227d787ed",
  "crawledAt" : "2025-12-05T03:48:03Z",
  "declaration" : {
    "code" : "@MainActor optional func collectionView(_ collectionView: UICollectionView, didBeginMultipleSelectionInteractionAt indexPath: IndexPath)",
    "language" : "swift"
  },
  "id" : "FCF92C6A-B3C7-457A-B9F1-2CAEFFDF9B51",
  "kind" : "method",
  "language" : "swift",
  "module" : "UIKit",
  "overview" : "## Discussion\n\nYour implementation of this method is a good place to indicate, in the app’s user interface, that the user is selecting multiple items; for example, you could replace an Edit or Select button with a Done button.",
  "platforms" : [
    "iOS",
    "iPadOS",
    "Mac Catalyst",
    "visionOS"
  ],
  "rawMarkdown" : "---\nsource: https:\/\/developer.apple.com\/documentation\/UIKit\/UICollectionViewDelegate\/collectionView(_:didBeginMultipleSelectionInteractionAt:)\ncrawled: 2025-12-05T03:48:03Z\n---\n\n# collectionView(_:didBeginMultipleSelectionInteractionAt:)\n\n**Instance Method**\n\nTells the delegate when the user starts using a two-finger pan gesture to select multiple items in a collection view.\n\n## Declaration\n\n```swift\n@MainActor optional func collectionView(_ collectionView: UICollectionView, didBeginMultipleSelectionInteractionAt indexPath: IndexPath)\n```\n\n## Parameters\n\n- **collectionView**: The collection view calling this method.\n- **indexPath**: The index path of the item that the user touched to start the two-finger pan gesture.\n\n## Discussion\n\nYour implementation of this method is a good place to indicate, in the app’s user interface, that the user is selecting multiple items; for example, you could replace an Edit or Select button with a Done button.\n\n```swift\nfunc collectionView(_ collectionView: UICollectionView, didBeginMultipleSelectionInteractionAt indexPath: IndexPath) {\n    \/\/ Replace the Select button with Done, and put the \n    \/\/ collection view into editing mode.\n    setEditing(true, animated: true)\n}\n```\n\n## Managing the selected cells\n\n- **Changing the appearance of selected and highlighted cells**: Provide visual feedback to the user about the state of a cell and the transition between states.\n- **Selecting multiple items with a two-finger pan gesture**: Accelerate user selection of multiple items using the multiselect gesture on table and collection views.\n- **collectionView(_:shouldSelectItemAt:)**: Asks the delegate if the specified item should be selected.\n- **collectionView(_:didSelectItemAt:)**: Tells the delegate that the item at the specified index path was selected.\n- **collectionView(_:shouldDeselectItemAt:)**: Asks the delegate if the specified item should be deselected.\n- **collectionView(_:didDeselectItemAt:)**: Tells the delegate that the item at the specified path was deselected.\n- **collectionView(_:shouldBeginMultipleSelectionInteractionAt:)**: Asks the delegate whether the user can select multiple items using a two-finger pan gesture in a collection view.\n- **collectionViewDidEndMultipleSelectionInteraction(_:)**: Tells the delegate when the user stops using a two-finger pan gesture to select multiple items in a collection view.\n\n",
  "sections" : [
    {
      "content" : "",
      "items" : [
        {
          "description" : "Provide visual feedback to the user about the state of a cell and the transition between states.",
          "name" : "Changing the appearance of selected and highlighted cells",
          "url" : "https:\/\/developer.apple.com\/documentation\/UIKit\/changing-the-appearance-of-selected-and-highlighted-cells"
        },
        {
          "description" : "Accelerate user selection of multiple items using the multiselect gesture on table and collection views.",
          "name" : "Selecting multiple items with a two-finger pan gesture",
          "url" : "https:\/\/developer.apple.com\/documentation\/UIKit\/selecting-multiple-items-with-a-two-finger-pan-gesture"
        },
        {
          "description" : "Asks the delegate if the specified item should be selected.",
          "name" : "collectionView(_:shouldSelectItemAt:)",
          "url" : "https:\/\/developer.apple.com\/documentation\/UIKit\/UICollectionViewDelegate\/collectionView(_:shouldSelectItemAt:)"
        },
        {
          "description" : "Tells the delegate that the item at the specified index path was selected.",
          "name" : "collectionView(_:didSelectItemAt:)",
          "url" : "https:\/\/developer.apple.com\/documentation\/UIKit\/UICollectionViewDelegate\/collectionView(_:didSelectItemAt:)"
        },
        {
          "description" : "Asks the delegate if the specified item should be deselected.",
          "name" : "collectionView(_:shouldDeselectItemAt:)",
          "url" : "https:\/\/developer.apple.com\/documentation\/UIKit\/UICollectionViewDelegate\/collectionView(_:shouldDeselectItemAt:)"
        },
        {
          "description" : "Tells the delegate that the item at the specified path was deselected.",
          "name" : "collectionView(_:didDeselectItemAt:)",
          "url" : "https:\/\/developer.apple.com\/documentation\/UIKit\/UICollectionViewDelegate\/collectionView(_:didDeselectItemAt:)"
        },
        {
          "description" : "Asks the delegate whether the user can select multiple items using a two-finger pan gesture in a collection view.",
          "name" : "collectionView(_:shouldBeginMultipleSelectionInteractionAt:)",
          "url" : "https:\/\/developer.apple.com\/documentation\/UIKit\/UICollectionViewDelegate\/collectionView(_:shouldBeginMultipleSelectionInteractionAt:)"
        },
        {
          "description" : "Tells the delegate when the user stops using a two-finger pan gesture to select multiple items in a collection view.",
          "name" : "collectionViewDidEndMultipleSelectionInteraction(_:)",
          "url" : "https:\/\/developer.apple.com\/documentation\/UIKit\/UICollectionViewDelegate\/collectionViewDidEndMultipleSelectionInteraction(_:)"
        }
      ],
      "title" : "Managing the selected cells"
    }
  ],
  "source" : "appleJSON",
  "title" : "collectionView(_:didBeginMultipleSelectionInteractionAt:)",
  "url" : "https:\/\/developer.apple.com\/documentation\/UIKit\/UICollectionViewDelegate\/collectionView(_:didBeginMultipleSelectionInteractionAt:)"
}