{
  "abstract" : "The appearance settings for a standard-height navigation bar when the edge of scrollable content aligns with the edge of the navigation bar.",
  "codeExamples" : [

  ],
  "contentHash" : "bb3456dd4264f50a33c59f7c9b534cf814a08198494a22ed4c38c0ff8a507e12",
  "crawledAt" : "2025-12-02T15:23:54Z",
  "declaration" : {
    "code" : "@NSCopying @MainActor var scrollEdgeAppearance: UINavigationBarAppearance? { get set }",
    "language" : "swift"
  },
  "id" : "2B294976-CFFA-44A4-A715-13D051C98C9E",
  "kind" : "property",
  "module" : "UIKit",
  "overview" : "## Discussion\n\nWhen the navigation bar displays the top navigation item, the appearance settings in this property override the settings provided by the [doc:\/\/com.apple.uikit\/documentation\/UIKit\/UINavigationBar\/scrollEdgeAppearance] property of [doc:\/\/com.apple.uikit\/documentation\/UIKit\/UINavigationBar].\n\nUse this property to apply appearance settings to the navigation bar based on the navigation item stored in the [doc:\/\/com.apple.uikit\/documentation\/UIKit\/UINavigationBar\/topItem] property. If the top item’s [doc:\/\/com.apple.uikit\/documentation\/UIKit\/UITabBarItem\/scrollEdgeAppearance] property is `nil`, UIKit uses the navigation bar’s scroll edge appearance.\n\nWhen running on apps that use iOS 14 or earlier, this property applies to navigation bars with large titles. In iOS 15, this property applies to all navigation bars.",
  "platforms" : [
    "iOS",
    "iPadOS",
    "Mac Catalyst",
    "tvOS",
    "visionOS"
  ],
  "rawMarkdown" : "---\nsource: https:\/\/developer.apple.com\/documentation\/UIKit\/UINavigationItem\/scrollEdgeAppearance\ncrawled: 2025-12-02T15:23:54Z\n---\n\n# scrollEdgeAppearance\n\n**Instance Property**\n\nThe appearance settings for a standard-height navigation bar when the edge of scrollable content aligns with the edge of the navigation bar.\n\n## Declaration\n\n```swift\n@NSCopying @MainActor var scrollEdgeAppearance: UINavigationBarAppearance? { get set }\n```\n\n## Discussion\n\nWhen the navigation bar displays the top navigation item, the appearance settings in this property override the settings provided by the [doc:\/\/com.apple.uikit\/documentation\/UIKit\/UINavigationBar\/scrollEdgeAppearance] property of [doc:\/\/com.apple.uikit\/documentation\/UIKit\/UINavigationBar].\n\nUse this property to apply appearance settings to the navigation bar based on the navigation item stored in the [doc:\/\/com.apple.uikit\/documentation\/UIKit\/UINavigationBar\/topItem] property. If the top item’s [doc:\/\/com.apple.uikit\/documentation\/UIKit\/UITabBarItem\/scrollEdgeAppearance] property is `nil`, UIKit uses the navigation bar’s scroll edge appearance.\n\nWhen running on apps that use iOS 14 or earlier, this property applies to navigation bars with large titles. In iOS 15, this property applies to all navigation bars.\n\n## Overriding the navigation bar’s appearance settings\n\n- **standardAppearance**: The appearance settings for a standard-height navigation bar.\n- **compactAppearance**: The appearance settings for a compact-height navigation bar.\n- **compactScrollEdgeAppearance**: The appearance settings for a compact-height navigation bar when the edge of scrollable content aligns with the edge of the navigation bar.\n\n",
  "sections" : [
    {
      "content" : "",
      "items" : [
        {
          "description" : "The appearance settings for a standard-height navigation bar.",
          "name" : "standardAppearance",
          "url" : "https:\/\/developer.apple.com\/documentation\/UIKit\/UINavigationItem\/standardAppearance"
        },
        {
          "description" : "The appearance settings for a compact-height navigation bar.",
          "name" : "compactAppearance",
          "url" : "https:\/\/developer.apple.com\/documentation\/UIKit\/UINavigationItem\/compactAppearance"
        },
        {
          "description" : "The appearance settings for a compact-height navigation bar when the edge of scrollable content aligns with the edge of the navigation bar.",
          "name" : "compactScrollEdgeAppearance",
          "url" : "https:\/\/developer.apple.com\/documentation\/UIKit\/UINavigationItem\/compactScrollEdgeAppearance"
        }
      ],
      "title" : "Overriding the navigation bar’s appearance settings"
    }
  ],
  "source" : "appleJSON",
  "title" : "scrollEdgeAppearance",
  "url" : "https:\/\/developer.apple.com\/documentation\/UIKit\/UINavigationItem\/scrollEdgeAppearance"
}