{
  "abstract" : "An object that provides configuration options for a window scene request.",
  "codeExamples" : [

  ],
  "conformsTo" : [
    "CVarArg",
    "CustomDebugStringConvertible",
    "CustomStringConvertible",
    "Equatable",
    "Hashable",
    "NSObjectProtocol"
  ],
  "contentHash" : "68a0798bf80eb9f90d8ba6c6b3947e6ed20f882ce0f58e76b0cd32879bd97442",
  "crawledAt" : "2025-12-01T22:48:13Z",
  "declaration" : {
    "code" : "class ActivationConfiguration",
    "language" : "swift"
  },
  "id" : "F2CE6B5E-8B27-4580-8573-C5DB5E396D2C",
  "kind" : "class",
  "module" : "UIKit",
  "overview" : "## Overview\n\nUse a [doc:\/\/com.apple.uikit\/documentation\/UIKit\/UIWindowScene\/ActivationConfiguration] object to request a new window scene from the system. An activation configuration requires a [doc:\/\/com.apple.documentation\/documentation\/Foundation\/NSUserActivity] object that represents the scene’s content. You can specify a preferred presentation style for the new scene by including an optional [doc:\/\/com.apple.uikit\/documentation\/UIKit\/UIWindowScene\/ActivationRequestOptions] object. The system automatically animates the transition to the new scene, but you can customize the transition by providing an optional targeted preview.\n\nTo request scene activation from a view interaction, use an instance of this class with [doc:\/\/com.apple.uikit\/documentation\/UIKit\/UIWindowScene\/ActivationInteraction]. To request scene activation from a context menu, use an instance of this class with [doc:\/\/com.apple.uikit\/documentation\/UIKit\/UIWindowScene\/ActivationAction].",
  "platforms" : [
    "iOS",
    "iPadOS",
    "Mac Catalyst",
    "visionOS"
  ],
  "rawMarkdown" : "---\nsource: https:\/\/developer.apple.com\/documentation\/UIKit\/UIWindowScene\/ActivationConfiguration\ncrawled: 2025-12-01T22:48:13Z\n---\n\n# UIWindowScene.ActivationConfiguration\n\n**Class**\n\nAn object that provides configuration options for a window scene request.\n\n## Declaration\n\n```swift\nclass ActivationConfiguration\n```\n\n## Overview\n\nUse a [doc:\/\/com.apple.uikit\/documentation\/UIKit\/UIWindowScene\/ActivationConfiguration] object to request a new window scene from the system. An activation configuration requires a [doc:\/\/com.apple.documentation\/documentation\/Foundation\/NSUserActivity] object that represents the scene’s content. You can specify a preferred presentation style for the new scene by including an optional [doc:\/\/com.apple.uikit\/documentation\/UIKit\/UIWindowScene\/ActivationRequestOptions] object. The system automatically animates the transition to the new scene, but you can customize the transition by providing an optional targeted preview.\n\nTo request scene activation from a view interaction, use an instance of this class with [doc:\/\/com.apple.uikit\/documentation\/UIKit\/UIWindowScene\/ActivationInteraction]. To request scene activation from a context menu, use an instance of this class with [doc:\/\/com.apple.uikit\/documentation\/UIKit\/UIWindowScene\/ActivationAction].\n\n## Creating an activation configuration\n\n- **init(userActivity:options:preview:)**: Creates an activation configuration.\n\n## Getting information about the activation configuration\n\n- **userActivity**: The user activity used to request a scene.\n- **options**: Options for customizing the scene request.\n- **UIWindowScene.ActivationRequestOptions**: An object that contains information you want the system to use when activating a new window scene.\n- **preview**: An optional targeted preview that the system uses to animate the transition to the new scene.\n\n## Supporting types\n\n- **UIWindowScene.ActivationAction**: A menu element that requests a window scene.\n- **UIWindowScene.ActivationInteraction**: An interaction that facilitates activating a window scene when a user pinches out on the interaction’s view.\n- **UIWindowScene.ActivationRequestOptions**: An object that contains information you want the system to use when activating a new window scene.\n- **UIWindowSceneDestructionRequestOptions**: An object that contains information to use when removing a window scene from your app.\n- **UIWindowScene.DismissalAnimation**: Constants that indicate the types of animations available for dismissing a scene’s windows.\n- **UIWindowSceneDragInteraction**: An interaction you add to a view that enables pan gestures to change the containing window scene’s position.\n- **UIWindowScene.ResizingRestrictions**\n- **UIWindowSceneResizingRestrictions**\n- **UIWindowScene.PresentationStyle**: The placement of a window scene relative to other scenes in the workspace.\n\n## Inherits From\n\n- NSObject\n\n## Conforms To\n\n- CVarArg\n- CustomDebugStringConvertible\n- CustomStringConvertible\n- Equatable\n- Hashable\n- NSObjectProtocol\n\n",
  "sections" : [
    {
      "content" : "",
      "items" : [
        {
          "description" : "Creates an activation configuration.",
          "name" : "init(userActivity:options:preview:)",
          "url" : "https:\/\/developer.apple.com\/documentation\/UIKit\/UIWindowScene\/ActivationConfiguration\/init(userActivity:options:preview:)"
        }
      ],
      "title" : "Creating an activation configuration"
    },
    {
      "content" : "",
      "items" : [
        {
          "description" : "The user activity used to request a scene.",
          "name" : "userActivity",
          "url" : "https:\/\/developer.apple.com\/documentation\/UIKit\/UIWindowScene\/ActivationConfiguration\/userActivity"
        },
        {
          "description" : "Options for customizing the scene request.",
          "name" : "options",
          "url" : "https:\/\/developer.apple.com\/documentation\/UIKit\/UIWindowScene\/ActivationConfiguration\/options"
        },
        {
          "description" : "An object that contains information you want the system to use when activating a new window scene.",
          "name" : "UIWindowScene.ActivationRequestOptions",
          "url" : "https:\/\/developer.apple.com\/documentation\/UIKit\/UIWindowScene\/ActivationRequestOptions"
        },
        {
          "description" : "An optional targeted preview that the system uses to animate the transition to the new scene.",
          "name" : "preview",
          "url" : "https:\/\/developer.apple.com\/documentation\/UIKit\/UIWindowScene\/ActivationConfiguration\/preview"
        }
      ],
      "title" : "Getting information about the activation configuration"
    },
    {
      "content" : "",
      "items" : [
        {
          "description" : "A menu element that requests a window scene.",
          "name" : "UIWindowScene.ActivationAction",
          "url" : "https:\/\/developer.apple.com\/documentation\/UIKit\/UIWindowScene\/ActivationAction"
        },
        {
          "description" : "An interaction that facilitates activating a window scene when a user pinches out on the interaction’s view.",
          "name" : "UIWindowScene.ActivationInteraction",
          "url" : "https:\/\/developer.apple.com\/documentation\/UIKit\/UIWindowScene\/ActivationInteraction"
        },
        {
          "description" : "An object that contains information you want the system to use when activating a new window scene.",
          "name" : "UIWindowScene.ActivationRequestOptions",
          "url" : "https:\/\/developer.apple.com\/documentation\/UIKit\/UIWindowScene\/ActivationRequestOptions"
        },
        {
          "description" : "An object that contains information to use when removing a window scene from your app.",
          "name" : "UIWindowSceneDestructionRequestOptions",
          "url" : "https:\/\/developer.apple.com\/documentation\/UIKit\/UIWindowSceneDestructionRequestOptions"
        },
        {
          "description" : "Constants that indicate the types of animations available for dismissing a scene’s windows.",
          "name" : "UIWindowScene.DismissalAnimation",
          "url" : "https:\/\/developer.apple.com\/documentation\/UIKit\/UIWindowScene\/DismissalAnimation"
        },
        {
          "description" : "An interaction you add to a view that enables pan gestures to change the containing window scene’s position.",
          "name" : "UIWindowSceneDragInteraction",
          "url" : "https:\/\/developer.apple.com\/documentation\/UIKit\/UIWindowSceneDragInteraction"
        },
        {
          "description" : "",
          "name" : "UIWindowScene.ResizingRestrictions",
          "url" : "https:\/\/developer.apple.com\/documentation\/UIKit\/UIWindowScene\/ResizingRestrictions"
        },
        {
          "description" : "",
          "name" : "UIWindowSceneResizingRestrictions",
          "url" : "https:\/\/developer.apple.com\/documentation\/UIKit\/UIWindowSceneResizingRestrictions"
        },
        {
          "description" : "The placement of a window scene relative to other scenes in the workspace.",
          "name" : "UIWindowScene.PresentationStyle",
          "url" : "https:\/\/developer.apple.com\/documentation\/UIKit\/UIWindowScene\/PresentationStyle"
        }
      ],
      "title" : "Supporting types"
    },
    {
      "content" : "",
      "items" : [
        {
          "name" : "NSObject"
        }
      ],
      "title" : "Inherits From"
    }
  ],
  "source" : "appleJSON",
  "title" : "UIWindowScene.ActivationConfiguration",
  "url" : "https:\/\/developer.apple.com\/documentation\/UIKit\/UIWindowScene\/ActivationConfiguration"
}