{
  "abstract" : "Returns a version of the specified font that adopts the current font metrics and is constrained to the specified traits and size.",
  "codeExamples" : [

  ],
  "contentHash" : "042a25e88b63711f3831d3446661cb31157822e4c91fa90bfd0132f3ee02ad82",
  "crawledAt" : "2025-12-03T18:21:49Z",
  "declaration" : {
    "code" : "func scaledFont(for font: UIFont, maximumPointSize: CGFloat, compatibleWith traitCollection: UITraitCollection?) -> UIFont",
    "language" : "swift"
  },
  "id" : "AA919C26-C83F-462E-9CAA-0567891187F4",
  "kind" : "method",
  "language" : "swift",
  "module" : "UIKit",
  "overview" : "## Return Value\n\nA version of the specified font with the appropriate style information applied to it, and scaled appropriately for the specified settings.",
  "platforms" : [
    "iOS",
    "iPadOS",
    "Mac Catalyst",
    "tvOS",
    "visionOS"
  ],
  "rawMarkdown" : "---\nsource: https:\/\/developer.apple.com\/documentation\/UIKit\/UIFontMetrics\/scaledFont(for:maximumPointSize:compatibleWith:)\ncrawled: 2025-12-03T18:21:49Z\n---\n\n# scaledFont(for:maximumPointSize:compatibleWith:)\n\n**Instance Method**\n\nReturns a version of the specified font that adopts the current font metrics and is constrained to the specified traits and size.\n\n## Declaration\n\n```swift\nfunc scaledFont(for font: UIFont, maximumPointSize: CGFloat, compatibleWith traitCollection: UITraitCollection?) -> UIFont\n```\n\n## Parameters\n\n- **font**: The base font to use when applying the style information. Set the size of your font to the standard Dynamic Type size that you use for the corresponding content. Do not specify a font that has already been scaled; doing so results in an exception.\n- **maximumPointSize**: The maximum point size allowed for the font. Use this value to constrain the font to the specified size when your interface cannot accommodate text that is any larger.\n- **traitCollection**: The trait collection to use when determining compatibility. The returned font is appropriate for use in an interface that adopts the specified traits.\n\n## Return Value\n\nA version of the specified font with the appropriate style information applied to it, and scaled appropriately for the specified settings.\n\n## Creating Scaled Fonts\n\n- **Scaling Fonts Automatically**: Scale text in your interface automatically using Dynamic Type.\n- **scaledFont(for:)**: Returns a version of the specified font that adopts the current font metrics.\n- **scaledFont(for:compatibleWith:)**: Returns a version of the specified font that adopts the current font metrics and supports the specified traits.\n- **scaledFont(for:maximumPointSize:)**: Returns a version of the specified font that adopts the current font metrics and is constrained to the specified maximum size.\n\n",
  "sections" : [
    {
      "content" : "",
      "items" : [
        {
          "description" : "Scale text in your interface automatically using Dynamic Type.",
          "name" : "Scaling Fonts Automatically",
          "url" : "https:\/\/developer.apple.com\/documentation\/UIKit\/scaling-fonts-automatically"
        },
        {
          "description" : "Returns a version of the specified font that adopts the current font metrics.",
          "name" : "scaledFont(for:)",
          "url" : "https:\/\/developer.apple.com\/documentation\/UIKit\/UIFontMetrics\/scaledFont(for:)"
        },
        {
          "description" : "Returns a version of the specified font that adopts the current font metrics and supports the specified traits.",
          "name" : "scaledFont(for:compatibleWith:)",
          "url" : "https:\/\/developer.apple.com\/documentation\/UIKit\/UIFontMetrics\/scaledFont(for:compatibleWith:)"
        },
        {
          "description" : "Returns a version of the specified font that adopts the current font metrics and is constrained to the specified maximum size.",
          "name" : "scaledFont(for:maximumPointSize:)",
          "url" : "https:\/\/developer.apple.com\/documentation\/UIKit\/UIFontMetrics\/scaledFont(for:maximumPointSize:)"
        }
      ],
      "title" : "Creating Scaled Fonts"
    }
  ],
  "source" : "appleJSON",
  "title" : "scaledFont(for:maximumPointSize:compatibleWith:)",
  "url" : "https:\/\/developer.apple.com\/documentation\/UIKit\/UIFontMetrics\/scaledFont(for:maximumPointSize:compatibleWith:)"
}