{
  "abstract" : "Marks the end of a specific long-running background task.",
  "codeExamples" : [

  ],
  "contentHash" : "b1bc5225b8df5ba70b422ff343b2f0f63b36f6ddf50a4257e9ff27ff9c772759",
  "crawledAt" : "2025-12-03T18:50:09Z",
  "declaration" : {
    "code" : "nonisolated func endBackgroundTask(_ identifier: UIBackgroundTaskIdentifier)",
    "language" : "swift"
  },
  "id" : "BB54181A-BA42-439D-A9C6-C52843ACF2CE",
  "kind" : "method",
  "language" : "swift",
  "module" : "UIKit",
  "overview" : "## Discussion\n\nYou must call this method to end a task that was started using the [doc:\/\/com.apple.uikit\/documentation\/UIKit\/UIApplication\/beginBackgroundTask(expirationHandler:)] method. If you do not, the system may terminate your app.\n\nThis method can be safely called on a non-main thread.",
  "platforms" : [
    "iOS",
    "iPadOS",
    "Mac Catalyst",
    "tvOS",
    "visionOS"
  ],
  "rawMarkdown" : "---\nsource: https:\/\/developer.apple.com\/documentation\/UIKit\/UIApplication\/endBackgroundTask(_:)\ncrawled: 2025-12-03T18:50:09Z\n---\n\n# endBackgroundTask(_:)\n\n**Instance Method**\n\nMarks the end of a specific long-running background task.\n\n## Declaration\n\n```swift\nnonisolated func endBackgroundTask(_ identifier: UIBackgroundTaskIdentifier)\n```\n\n## Parameters\n\n- **identifier**: An identifier returned by the [doc:\/\/com.apple.uikit\/documentation\/UIKit\/UIApplication\/beginBackgroundTask(expirationHandler:)] method.\n\n## Discussion\n\nYou must call this method to end a task that was started using the [doc:\/\/com.apple.uikit\/documentation\/UIKit\/UIApplication\/beginBackgroundTask(expirationHandler:)] method. If you do not, the system may terminate your app.\n\nThis method can be safely called on a non-main thread.\n\n## Managing background tasks\n\n- **backgroundRefreshStatus**: Indicates whether the app can refresh content when running in the background.\n- **UIBackgroundRefreshStatus**: Constants that indicate whether background execution is enabled for the app.\n- **backgroundRefreshStatusDidChangeNotification**: A notification that posts when the app’s status for downloading content in the background changes.\n- **beginBackgroundTask(withName:expirationHandler:)**: Marks the start of a task with a custom name that should continue if the app enters the background.\n- **beginBackgroundTask(expirationHandler:)**: Marks the start of a task that should continue if the app enters the background.\n- **UIBackgroundTaskIdentifier**: A unique token that identifies a request to run in the background.\n- **backgroundTimeRemaining**: The maximum amount of time remaining for the app to run in the background.\n\n",
  "sections" : [
    {
      "content" : "",
      "items" : [
        {
          "description" : "Indicates whether the app can refresh content when running in the background.",
          "name" : "backgroundRefreshStatus",
          "url" : "https:\/\/developer.apple.com\/documentation\/UIKit\/UIApplication\/backgroundRefreshStatus"
        },
        {
          "description" : "Constants that indicate whether background execution is enabled for the app.",
          "name" : "UIBackgroundRefreshStatus",
          "url" : "https:\/\/developer.apple.com\/documentation\/UIKit\/UIBackgroundRefreshStatus"
        },
        {
          "description" : "A notification that posts when the app’s status for downloading content in the background changes.",
          "name" : "backgroundRefreshStatusDidChangeNotification",
          "url" : "https:\/\/developer.apple.com\/documentation\/UIKit\/UIApplication\/backgroundRefreshStatusDidChangeNotification"
        },
        {
          "description" : "Marks the start of a task with a custom name that should continue if the app enters the background.",
          "name" : "beginBackgroundTask(withName:expirationHandler:)",
          "url" : "https:\/\/developer.apple.com\/documentation\/UIKit\/UIApplication\/beginBackgroundTask(withName:expirationHandler:)"
        },
        {
          "description" : "Marks the start of a task that should continue if the app enters the background.",
          "name" : "beginBackgroundTask(expirationHandler:)",
          "url" : "https:\/\/developer.apple.com\/documentation\/UIKit\/UIApplication\/beginBackgroundTask(expirationHandler:)"
        },
        {
          "description" : "A unique token that identifies a request to run in the background.",
          "name" : "UIBackgroundTaskIdentifier",
          "url" : "https:\/\/developer.apple.com\/documentation\/UIKit\/UIBackgroundTaskIdentifier"
        },
        {
          "description" : "The maximum amount of time remaining for the app to run in the background.",
          "name" : "backgroundTimeRemaining",
          "url" : "https:\/\/developer.apple.com\/documentation\/UIKit\/UIApplication\/backgroundTimeRemaining"
        }
      ],
      "title" : "Managing background tasks"
    }
  ],
  "source" : "appleJSON",
  "title" : "endBackgroundTask(_:)",
  "url" : "https:\/\/developer.apple.com\/documentation\/UIKit\/UIApplication\/endBackgroundTask(_:)"
}