{
  "abstract" : "A notification that posts when a screen’s brightness changes.",
  "codeExamples" : [

  ],
  "contentHash" : "6a54831e84f6d0d1464db27c241783b613cd468356b0852613d4cb1afb81399b",
  "crawledAt" : "2025-12-04T02:04:36Z",
  "declaration" : {
    "code" : "nonisolated class let brightnessDidChangeNotification: NSNotification.Name",
    "language" : "swift"
  },
  "id" : "2C6AE231-A452-4E25-8299-A6CCF24442AD",
  "kind" : "property",
  "language" : "swift",
  "module" : "UIKit",
  "overview" : "## Discussion\n\nThe object of the notification is the [doc:\/\/com.apple.uikit\/documentation\/UIKit\/UIScreen] object whose [doc:\/\/com.apple.uikit\/documentation\/UIKit\/UIScreen\/brightness] property changed. There is no `userInfo` dictionary.",
  "platforms" : [
    "iOS",
    "iPadOS",
    "Mac Catalyst",
    "tvOS"
  ],
  "rawMarkdown" : "---\nsource: https:\/\/developer.apple.com\/documentation\/UIKit\/UIScreen\/brightnessDidChangeNotification\ncrawled: 2025-12-04T02:04:36Z\n---\n\n# brightnessDidChangeNotification\n\n**Type Property**\n\nA notification that posts when a screen’s brightness changes.\n\n## Declaration\n\n```swift\nnonisolated class let brightnessDidChangeNotification: NSNotification.Name\n```\n\n## Discussion\n\nThe object of the notification is the [doc:\/\/com.apple.uikit\/documentation\/UIKit\/UIScreen] object whose [doc:\/\/com.apple.uikit\/documentation\/UIKit\/UIScreen\/brightness] property changed. There is no `userInfo` dictionary.\n\n## Notifications\n\n- **modeDidChangeNotification**: A notification that posts when a screen’s mode changes.\n- **capturedDidChangeNotification**: A notification that posts when the capture status of a screen changes.\n- **referenceDisplayModeStatusDidChangeNotification**: A notification that posts when there’s a change to a screen’s reference display mode status.\n\n",
  "sections" : [
    {
      "content" : "",
      "items" : [
        {
          "description" : "A notification that posts when a screen’s mode changes.",
          "name" : "modeDidChangeNotification",
          "url" : "https:\/\/developer.apple.com\/documentation\/UIKit\/UIScreen\/modeDidChangeNotification"
        },
        {
          "description" : "A notification that posts when the capture status of a screen changes.",
          "name" : "capturedDidChangeNotification",
          "url" : "https:\/\/developer.apple.com\/documentation\/UIKit\/UIScreen\/capturedDidChangeNotification"
        },
        {
          "description" : "A notification that posts when there’s a change to a screen’s reference display mode status.",
          "name" : "referenceDisplayModeStatusDidChangeNotification",
          "url" : "https:\/\/developer.apple.com\/documentation\/UIKit\/UIScreen\/referenceDisplayModeStatusDidChangeNotification"
        }
      ],
      "title" : "Notifications"
    }
  ],
  "source" : "appleJSON",
  "title" : "brightnessDidChangeNotification",
  "url" : "https:\/\/developer.apple.com\/documentation\/UIKit\/UIScreen\/brightnessDidChangeNotification"
}