{
  "abstract" : "An array of the visible items in the collection view.",
  "codeExamples" : [

  ],
  "contentHash" : "04fcb77727becd52b5a60d300c21ed6b004ab6b1aa0e4f5f0fd43145b3bdac6e",
  "crawledAt" : "2025-12-03T17:47:20Z",
  "declaration" : {
    "code" : "@MainActor var indexPathsForVisibleItems: [IndexPath] { get }",
    "language" : "swift"
  },
  "id" : "F2C8DE6B-93E1-4A4F-9416-F5649FB001EC",
  "kind" : "property",
  "language" : "swift",
  "module" : "UIKit",
  "overview" : "## Discussion\n\nThe value of this property is an unsorted array of [doc:\/\/com.apple.documentation\/documentation\/Foundation\/NSIndexPath] objects, each of which corresponds to a visible cell in the collection view. This array doesn’t include any supplementary views that are currently visible. If there are no visible items, the value of this property is an empty array.",
  "platforms" : [
    "iOS",
    "iPadOS",
    "Mac Catalyst",
    "tvOS",
    "visionOS"
  ],
  "rawMarkdown" : "---\nsource: https:\/\/developer.apple.com\/documentation\/UIKit\/UICollectionView\/indexPathsForVisibleItems\ncrawled: 2025-12-03T17:47:20Z\n---\n\n# indexPathsForVisibleItems\n\n**Instance Property**\n\nAn array of the visible items in the collection view.\n\n## Declaration\n\n```swift\n@MainActor var indexPathsForVisibleItems: [IndexPath] { get }\n```\n\n## Discussion\n\nThe value of this property is an unsorted array of [doc:\/\/com.apple.documentation\/documentation\/Foundation\/NSIndexPath] objects, each of which corresponds to a visible cell in the collection view. This array doesn’t include any supplementary views that are currently visible. If there are no visible items, the value of this property is an empty array.\n\n## Related Documentation\n\n- **visibleCells**: An array of visible cells currently displayed by the collection view.\n\n## Locating items and views in the collection view\n\n- **indexPathForItem(at:)**: Gets the index path of the item at the specified point in the collection view.\n- **indexPath(for:)**: Gets the index path of the specified cell.\n- **cellForItem(at:)**: Gets the cell object at the index path you specify.\n- **indexPathsForVisibleSupplementaryElements(ofKind:)**: Gets the index paths of all visible supplementary views of the specified type.\n- **supplementaryView(forElementKind:at:)**: Gets the supplementary view at the specified index path.\n- **visibleSupplementaryViews(ofKind:)**: Gets an array of the visible supplementary views of the specified kind.\n\n",
  "sections" : [
    {
      "content" : "",
      "items" : [
        {
          "description" : "An array of visible cells currently displayed by the collection view.",
          "name" : "visibleCells",
          "url" : "https:\/\/developer.apple.com\/documentation\/UIKit\/UICollectionView\/visibleCells"
        }
      ],
      "title" : "Related Documentation"
    },
    {
      "content" : "",
      "items" : [
        {
          "description" : "Gets the index path of the item at the specified point in the collection view.",
          "name" : "indexPathForItem(at:)",
          "url" : "https:\/\/developer.apple.com\/documentation\/UIKit\/UICollectionView\/indexPathForItem(at:)"
        },
        {
          "description" : "Gets the index path of the specified cell.",
          "name" : "indexPath(for:)",
          "url" : "https:\/\/developer.apple.com\/documentation\/UIKit\/UICollectionView\/indexPath(for:)"
        },
        {
          "description" : "Gets the cell object at the index path you specify.",
          "name" : "cellForItem(at:)",
          "url" : "https:\/\/developer.apple.com\/documentation\/UIKit\/UICollectionView\/cellForItem(at:)"
        },
        {
          "description" : "Gets the index paths of all visible supplementary views of the specified type.",
          "name" : "indexPathsForVisibleSupplementaryElements(ofKind:)",
          "url" : "https:\/\/developer.apple.com\/documentation\/UIKit\/UICollectionView\/indexPathsForVisibleSupplementaryElements(ofKind:)"
        },
        {
          "description" : "Gets the supplementary view at the specified index path.",
          "name" : "supplementaryView(forElementKind:at:)",
          "url" : "https:\/\/developer.apple.com\/documentation\/UIKit\/UICollectionView\/supplementaryView(forElementKind:at:)"
        },
        {
          "description" : "Gets an array of the visible supplementary views of the specified kind.",
          "name" : "visibleSupplementaryViews(ofKind:)",
          "url" : "https:\/\/developer.apple.com\/documentation\/UIKit\/UICollectionView\/visibleSupplementaryViews(ofKind:)"
        }
      ],
      "title" : "Locating items and views in the collection view"
    }
  ],
  "source" : "appleJSON",
  "title" : "indexPathsForVisibleItems",
  "url" : "https:\/\/developer.apple.com\/documentation\/UIKit\/UICollectionView\/indexPathsForVisibleItems"
}