{
  "abstract" : "A Boolean value that indicates whether proximity monitoring is enabled.",
  "codeExamples" : [

  ],
  "contentHash" : "bd857079cb619dc564d156f63007b3c848ec5472ca114a77adc0c981ddd05c3d",
  "crawledAt" : "2025-12-04T10:06:45Z",
  "declaration" : {
    "code" : "@MainActor var isProximityMonitoringEnabled: Bool { get set }",
    "language" : "swift"
  },
  "id" : "91BB25E0-5AD3-47CE-8290-82E523E0FA51",
  "kind" : "property",
  "language" : "swift",
  "module" : "UIKit",
  "overview" : "## Discussion\n\nEnable proximity monitoring only when your application needs to be notified of changes to the proximity state. Otherwise, disable proximity monitoring. The default value is [doc:\/\/com.apple.documentation\/documentation\/Swift\/false].\n\nNot all iOS devices have proximity sensors. To determine if proximity monitoring is available, attempt to enable it. If the value of the [doc:\/\/com.apple.uikit\/documentation\/UIKit\/UIDevice\/isProximityMonitoringEnabled] property remains [doc:\/\/com.apple.documentation\/documentation\/Swift\/false], proximity monitoring isn’t available.",
  "platforms" : [
    "iOS",
    "iPadOS",
    "Mac Catalyst",
    "tvOS",
    "visionOS"
  ],
  "rawMarkdown" : "---\nsource: https:\/\/developer.apple.com\/documentation\/UIKit\/UIDevice\/isProximityMonitoringEnabled\ncrawled: 2025-12-04T10:06:45Z\n---\n\n# isProximityMonitoringEnabled\n\n**Instance Property**\n\nA Boolean value that indicates whether proximity monitoring is enabled.\n\n## Declaration\n\n```swift\n@MainActor var isProximityMonitoringEnabled: Bool { get set }\n```\n\n## Discussion\n\nEnable proximity monitoring only when your application needs to be notified of changes to the proximity state. Otherwise, disable proximity monitoring. The default value is [doc:\/\/com.apple.documentation\/documentation\/Swift\/false].\n\nNot all iOS devices have proximity sensors. To determine if proximity monitoring is available, attempt to enable it. If the value of the [doc:\/\/com.apple.uikit\/documentation\/UIKit\/UIDevice\/isProximityMonitoringEnabled] property remains [doc:\/\/com.apple.documentation\/documentation\/Swift\/false], proximity monitoring isn’t available.\n\n## Using the proximity sensor\n\n- **proximityState**: A Boolean value that indicates whether the proximity sensor is close to the user.\n\n",
  "sections" : [
    {
      "content" : "",
      "items" : [
        {
          "description" : "A Boolean value that indicates whether the proximity sensor is close to the user.",
          "name" : "proximityState",
          "url" : "https:\/\/developer.apple.com\/documentation\/UIKit\/UIDevice\/proximityState"
        }
      ],
      "title" : "Using the proximity sensor"
    }
  ],
  "source" : "appleJSON",
  "title" : "isProximityMonitoringEnabled",
  "url" : "https:\/\/developer.apple.com\/documentation\/UIKit\/UIDevice\/isProximityMonitoringEnabled"
}