{
  "abstract" : "An object that manages interactions between Writing Tools and your custom text view.",
  "codeExamples" : [

  ],
  "conformsTo" : [
    "CVarArg",
    "CustomDebugStringConvertible",
    "CustomStringConvertible",
    "Equatable",
    "Hashable",
    "NSObjectProtocol",
    "Sendable",
    "UIInteraction"
  ],
  "contentHash" : "73537615558c44a980d5a6b72d305a34cff35234825268b61d30cea105bb2f76",
  "crawledAt" : "2025-12-01T10:38:39Z",
  "declaration" : {
    "code" : "@MainActor class UIWritingToolsCoordinator",
    "language" : "swift"
  },
  "id" : "3C6EA4EF-26E4-4269-A15C-924E93E414C0",
  "kind" : "class",
  "module" : "UIKit",
  "overview" : "## Overview\n\nAdd a `UIWritingToolsCoordinator` object to a custom view when you want to add Writing Tools support to that view. The coordinator manages interactions between your view and the Writing Tools UI and back-end capabilities. When creating a coordinator, you supply a delegate object to respond to requests from the system and provide needed information. Your delegate delivers your view’s text to Writing Tools, incorporates suggested changes back into your text storage, and supports the animations that Writing Tools creates to show the state of an operation.\n\nCreate the `UIWritingToolsCoordinator` object when setting up your UI, and initialize it with a custom object that adopts the [doc:\/\/com.apple.uikit\/documentation\/UIKit\/UIWritingToolsCoordinator\/Delegate-swift.protocol] protocol. Add the coordinator to your view using the [doc:\/\/com.apple.uikit\/documentation\/UIKit\/UIView\/addInteraction(_:)] method. When a coordinator is present on a view, the system adds UI elements to initiate Writing Tools operations.\n\nWhen defining the delegate, choose an object from your app that has access to your view and its text storage. You can adopt the [doc:\/\/com.apple.uikit\/documentation\/UIKit\/UIWritingToolsCoordinator\/Delegate-swift.protocol] protocol in the view itself, or in another type that your view uses to manage content. During the interactions with Writing Tools, the delegate gets and sets the contents of the view’s text storage and supports Writing Tools behaviors.",
  "platforms" : [
    "iOS",
    "iPadOS",
    "Mac Catalyst",
    "visionOS"
  ],
  "rawMarkdown" : "---\nsource: https:\/\/developer.apple.com\/documentation\/UIKit\/UIWritingToolsCoordinator\ncrawled: 2025-12-01T10:38:39Z\n---\n\n# UIWritingToolsCoordinator\n\n**Class**\n\nAn object that manages interactions between Writing Tools and your custom text view.\n\n## Declaration\n\n```swift\n@MainActor class UIWritingToolsCoordinator\n```\n\n## Overview\n\nAdd a `UIWritingToolsCoordinator` object to a custom view when you want to add Writing Tools support to that view. The coordinator manages interactions between your view and the Writing Tools UI and back-end capabilities. When creating a coordinator, you supply a delegate object to respond to requests from the system and provide needed information. Your delegate delivers your view’s text to Writing Tools, incorporates suggested changes back into your text storage, and supports the animations that Writing Tools creates to show the state of an operation.\n\nCreate the `UIWritingToolsCoordinator` object when setting up your UI, and initialize it with a custom object that adopts the [doc:\/\/com.apple.uikit\/documentation\/UIKit\/UIWritingToolsCoordinator\/Delegate-swift.protocol] protocol. Add the coordinator to your view using the [doc:\/\/com.apple.uikit\/documentation\/UIKit\/UIView\/addInteraction(_:)] method. When a coordinator is present on a view, the system adds UI elements to initiate Writing Tools operations.\n\nWhen defining the delegate, choose an object from your app that has access to your view and its text storage. You can adopt the [doc:\/\/com.apple.uikit\/documentation\/UIKit\/UIWritingToolsCoordinator\/Delegate-swift.protocol] protocol in the view itself, or in another type that your view uses to manage content. During the interactions with Writing Tools, the delegate gets and sets the contents of the view’s text storage and supports Writing Tools behaviors.\n\n\n\n## Creating a coordinator object\n\n- **init(delegate:)**: Creates a writing tools coordinator and assigns the specified delegate object to it.\n\n## Checking the availability of Writing Tools\n\n- **isWritingToolsAvailable**: A Boolean value that indicates whether Writing Tools features are currently available.\n\n## Managing Writing Tools interactions\n\n- **delegate**: The object that handles Writing Tools interactions for your view.\n- **UIWritingToolsCoordinator.Delegate**: An interface that you use to manage interactions between Writing Tools and your custom text view.\n\n## Getting the host views for effects\n\n- **effectContainerView**: The view that Writing Tools uses to display visual effects during the text-rewriting process.\n- **decorationContainerView**: The view that Writing Tools uses to display background decorations such as proofreading marks.\n\n## Configuring the experience\n\n- **preferredBehavior**: The level of Writing Tools support you want the system to provide for your view.\n- **behavior**: The actual level of Writing Tools support the system provides for your view.\n- **preferredResultOptions**: The type of content you allow Writing Tools to generate for your custom text view.\n- **resultOptions**: The type of content the system generates for your custom text view.\n\n## Reporting changes to Writing Tools\n\n- **updateRange(_:with:reason:forContextWithIdentifier:)**: Informs the coordinator about changes your app made to the text in the specified context object.\n- **updateForReflowedTextInContextWithIdentifier(_:)**: Informs the coordinator that a change occurred to the view or its text that requires a layout update.\n- **UIWritingToolsCoordinator.TextUpdateReason**: Constants that specify the reason you updated your view’s content outside of the Writing Tools workflow.\n\n## Managing the current state\n\n- **stopWritingTools()**: Stops the current Writing Tools operation and dismisses the system UI.\n- **state**: The current level of Writing Tools activity in your view.\n- **UIWritingToolsCoordinator.State**: The states that indicate the current activity, if any, Writing Tools is performing in your view.\n\n## Getting the supporting types\n\n- **UIWritingToolsCoordinator.ContextScope**: Options that indicate how much of your content Writing Tools requested.\n- **UIWritingToolsCoordinator.TextReplacementReason**: Options that indicate whether Writing Tools is animating changes to your view’s text.\n- **UIWritingToolsCoordinator.TextAnimation**: The types of animations that Writing Tools performs during an interactive update of your view.\n\n## Instance Properties\n\n- **includesTextListMarkers**\n\n## Writing Tools for custom views\n\n- **Adding Writing Tools support to a custom UIKit view**: Add Writing Tools support, including support for inline replacement animations, to your custom iOS views that contain text.\n- **UIWritingToolsCoordinator.Delegate**: An interface that you use to manage interactions between Writing Tools and your custom text view.\n- **UIWritingToolsCoordinator.Context**: A data object that you use to share your custom view’s text with Writing Tools.\n- **UIWritingToolsCoordinator.AnimationParameters**: An object you use to configure additional tasks or animations to run alongside the Writing Tools animations.\n\n## Inherits From\n\n- NSObject\n\n## Conforms To\n\n- CVarArg\n- CustomDebugStringConvertible\n- CustomStringConvertible\n- Equatable\n- Hashable\n- NSObjectProtocol\n- Sendable\n- UIInteraction\n\n",
  "sections" : [
    {
      "content" : "",
      "items" : [
        {
          "description" : "Creates a writing tools coordinator and assigns the specified delegate object to it.",
          "name" : "init(delegate:)",
          "url" : "https:\/\/developer.apple.com\/documentation\/UIKit\/UIWritingToolsCoordinator\/init(delegate:)"
        }
      ],
      "title" : "Creating a coordinator object"
    },
    {
      "content" : "",
      "items" : [
        {
          "description" : "A Boolean value that indicates whether Writing Tools features are currently available.",
          "name" : "isWritingToolsAvailable",
          "url" : "https:\/\/developer.apple.com\/documentation\/UIKit\/UIWritingToolsCoordinator\/isWritingToolsAvailable"
        }
      ],
      "title" : "Checking the availability of Writing Tools"
    },
    {
      "content" : "",
      "items" : [
        {
          "description" : "The object that handles Writing Tools interactions for your view.",
          "name" : "delegate",
          "url" : "https:\/\/developer.apple.com\/documentation\/UIKit\/UIWritingToolsCoordinator\/delegate-swift.property"
        },
        {
          "description" : "An interface that you use to manage interactions between Writing Tools and your custom text view.",
          "name" : "UIWritingToolsCoordinator.Delegate",
          "url" : "https:\/\/developer.apple.com\/documentation\/UIKit\/UIWritingToolsCoordinator\/Delegate-swift.protocol"
        }
      ],
      "title" : "Managing Writing Tools interactions"
    },
    {
      "content" : "",
      "items" : [
        {
          "description" : "The view that Writing Tools uses to display visual effects during the text-rewriting process.",
          "name" : "effectContainerView",
          "url" : "https:\/\/developer.apple.com\/documentation\/UIKit\/UIWritingToolsCoordinator\/effectContainerView"
        },
        {
          "description" : "The view that Writing Tools uses to display background decorations such as proofreading marks.",
          "name" : "decorationContainerView",
          "url" : "https:\/\/developer.apple.com\/documentation\/UIKit\/UIWritingToolsCoordinator\/decorationContainerView"
        }
      ],
      "title" : "Getting the host views for effects"
    },
    {
      "content" : "",
      "items" : [
        {
          "description" : "The level of Writing Tools support you want the system to provide for your view.",
          "name" : "preferredBehavior",
          "url" : "https:\/\/developer.apple.com\/documentation\/UIKit\/UIWritingToolsCoordinator\/preferredBehavior"
        },
        {
          "description" : "The actual level of Writing Tools support the system provides for your view.",
          "name" : "behavior",
          "url" : "https:\/\/developer.apple.com\/documentation\/UIKit\/UIWritingToolsCoordinator\/behavior"
        },
        {
          "description" : "The type of content you allow Writing Tools to generate for your custom text view.",
          "name" : "preferredResultOptions",
          "url" : "https:\/\/developer.apple.com\/documentation\/UIKit\/UIWritingToolsCoordinator\/preferredResultOptions"
        },
        {
          "description" : "The type of content the system generates for your custom text view.",
          "name" : "resultOptions",
          "url" : "https:\/\/developer.apple.com\/documentation\/UIKit\/UIWritingToolsCoordinator\/resultOptions"
        }
      ],
      "title" : "Configuring the experience"
    },
    {
      "content" : "",
      "items" : [
        {
          "description" : "Informs the coordinator about changes your app made to the text in the specified context object.",
          "name" : "updateRange(_:with:reason:forContextWithIdentifier:)",
          "url" : "https:\/\/developer.apple.com\/documentation\/UIKit\/UIWritingToolsCoordinator\/updateRange(_:with:reason:forContextWithIdentifier:)"
        },
        {
          "description" : "Informs the coordinator that a change occurred to the view or its text that requires a layout update.",
          "name" : "updateForReflowedTextInContextWithIdentifier(_:)",
          "url" : "https:\/\/developer.apple.com\/documentation\/UIKit\/UIWritingToolsCoordinator\/updateForReflowedTextInContextWithIdentifier(_:)"
        },
        {
          "description" : "Constants that specify the reason you updated your view’s content outside of the Writing Tools workflow.",
          "name" : "UIWritingToolsCoordinator.TextUpdateReason",
          "url" : "https:\/\/developer.apple.com\/documentation\/UIKit\/UIWritingToolsCoordinator\/TextUpdateReason"
        }
      ],
      "title" : "Reporting changes to Writing Tools"
    },
    {
      "content" : "",
      "items" : [
        {
          "description" : "Stops the current Writing Tools operation and dismisses the system UI.",
          "name" : "stopWritingTools()",
          "url" : "https:\/\/developer.apple.com\/documentation\/UIKit\/UIWritingToolsCoordinator\/stopWritingTools()"
        },
        {
          "description" : "The current level of Writing Tools activity in your view.",
          "name" : "state",
          "url" : "https:\/\/developer.apple.com\/documentation\/UIKit\/UIWritingToolsCoordinator\/state-swift.property"
        },
        {
          "description" : "The states that indicate the current activity, if any, Writing Tools is performing in your view.",
          "name" : "UIWritingToolsCoordinator.State",
          "url" : "https:\/\/developer.apple.com\/documentation\/UIKit\/UIWritingToolsCoordinator\/State-swift.enum"
        }
      ],
      "title" : "Managing the current state"
    },
    {
      "content" : "",
      "items" : [
        {
          "description" : "Options that indicate how much of your content Writing Tools requested.",
          "name" : "UIWritingToolsCoordinator.ContextScope",
          "url" : "https:\/\/developer.apple.com\/documentation\/UIKit\/UIWritingToolsCoordinator\/ContextScope"
        },
        {
          "description" : "Options that indicate whether Writing Tools is animating changes to your view’s text.",
          "name" : "UIWritingToolsCoordinator.TextReplacementReason",
          "url" : "https:\/\/developer.apple.com\/documentation\/UIKit\/UIWritingToolsCoordinator\/TextReplacementReason"
        },
        {
          "description" : "The types of animations that Writing Tools performs during an interactive update of your view.",
          "name" : "UIWritingToolsCoordinator.TextAnimation",
          "url" : "https:\/\/developer.apple.com\/documentation\/UIKit\/UIWritingToolsCoordinator\/TextAnimation"
        }
      ],
      "title" : "Getting the supporting types"
    },
    {
      "content" : "",
      "items" : [
        {
          "description" : "",
          "name" : "includesTextListMarkers",
          "url" : "https:\/\/developer.apple.com\/documentation\/UIKit\/UIWritingToolsCoordinator\/includesTextListMarkers"
        }
      ],
      "title" : "Instance Properties"
    },
    {
      "content" : "",
      "items" : [
        {
          "description" : "Add Writing Tools support, including support for inline replacement animations, to your custom iOS views that contain text.",
          "name" : "Adding Writing Tools support to a custom UIKit view",
          "url" : "https:\/\/developer.apple.com\/documentation\/UIKit\/adding-writing-tools-support-to-a-custom-uiview"
        },
        {
          "description" : "An interface that you use to manage interactions between Writing Tools and your custom text view.",
          "name" : "UIWritingToolsCoordinator.Delegate",
          "url" : "https:\/\/developer.apple.com\/documentation\/UIKit\/UIWritingToolsCoordinator\/Delegate-swift.protocol"
        },
        {
          "description" : "A data object that you use to share your custom view’s text with Writing Tools.",
          "name" : "UIWritingToolsCoordinator.Context",
          "url" : "https:\/\/developer.apple.com\/documentation\/UIKit\/UIWritingToolsCoordinator\/Context"
        },
        {
          "description" : "An object you use to configure additional tasks or animations to run alongside the Writing Tools animations.",
          "name" : "UIWritingToolsCoordinator.AnimationParameters",
          "url" : "https:\/\/developer.apple.com\/documentation\/UIKit\/UIWritingToolsCoordinator\/AnimationParameters"
        }
      ],
      "title" : "Writing Tools for custom views"
    },
    {
      "content" : "",
      "items" : [
        {
          "name" : "NSObject"
        }
      ],
      "title" : "Inherits From"
    }
  ],
  "source" : "appleJSON",
  "title" : "UIWritingToolsCoordinator",
  "url" : "https:\/\/developer.apple.com\/documentation\/UIKit\/UIWritingToolsCoordinator"
}