{
  "abstract" : "The preferred action for the user to take from an alert.",
  "codeExamples" : [

  ],
  "contentHash" : "83f09622898b20462f253b80d375306fd4bd030577fd97fbf9ee882f062621cd",
  "crawledAt" : "2025-12-03T18:37:37Z",
  "declaration" : {
    "code" : "@MainActor var preferredAction: UIAlertAction? { get set }",
    "language" : "swift"
  },
  "id" : "E1B61515-92CB-4887-9DD8-191397CD6A28",
  "kind" : "property",
  "language" : "swift",
  "module" : "UIKit",
  "overview" : "## Discussion\n\nThe preferred action is relevant for the [doc:\/\/com.apple.uikit\/documentation\/UIKit\/UIAlertController\/Style\/alert] style only; it isn’t used by action sheets. When you specify a preferred action, the alert controller highlights the text of that action to give it emphasis. (If the alert also contains a cancel button, the preferred action receives the highlighting instead of the cancel button.) If the iOS device is connected to a physical keyboard, pressing the Return key triggers the preferred action.\n\nThe action object you assign to this property must have already been added to the alert controller’s list of actions. Assigning an object to this property before adding it with the [doc:\/\/com.apple.uikit\/documentation\/UIKit\/UIAlertController\/addAction(_:)] method is a programmer error.\n\nThe default value of this property is `nil`.",
  "platforms" : [
    "iOS",
    "iPadOS",
    "Mac Catalyst",
    "tvOS",
    "visionOS"
  ],
  "rawMarkdown" : "---\nsource: https:\/\/developer.apple.com\/documentation\/UIKit\/UIAlertController\/preferredAction\ncrawled: 2025-12-03T18:37:37Z\n---\n\n# preferredAction\n\n**Instance Property**\n\nThe preferred action for the user to take from an alert.\n\n## Declaration\n\n```swift\n@MainActor var preferredAction: UIAlertAction? { get set }\n```\n\n## Discussion\n\nThe preferred action is relevant for the [doc:\/\/com.apple.uikit\/documentation\/UIKit\/UIAlertController\/Style\/alert] style only; it isn’t used by action sheets. When you specify a preferred action, the alert controller highlights the text of that action to give it emphasis. (If the alert also contains a cancel button, the preferred action receives the highlighting instead of the cancel button.) If the iOS device is connected to a physical keyboard, pressing the Return key triggers the preferred action.\n\nThe action object you assign to this property must have already been added to the alert controller’s list of actions. Assigning an object to this property before adding it with the [doc:\/\/com.apple.uikit\/documentation\/UIKit\/UIAlertController\/addAction(_:)] method is a programmer error.\n\nThe default value of this property is `nil`.\n\n## Configuring the user actions\n\n- **addAction(_:)**: Attaches an action object to the alert or action sheet.\n- **actions**: The actions that the user can take in response to the alert or action sheet.\n\n",
  "sections" : [
    {
      "content" : "",
      "items" : [
        {
          "description" : "Attaches an action object to the alert or action sheet.",
          "name" : "addAction(_:)",
          "url" : "https:\/\/developer.apple.com\/documentation\/UIKit\/UIAlertController\/addAction(_:)"
        },
        {
          "description" : "The actions that the user can take in response to the alert or action sheet.",
          "name" : "actions",
          "url" : "https:\/\/developer.apple.com\/documentation\/UIKit\/UIAlertController\/actions"
        }
      ],
      "title" : "Configuring the user actions"
    }
  ],
  "source" : "appleJSON",
  "title" : "preferredAction",
  "url" : "https:\/\/developer.apple.com\/documentation\/UIKit\/UIAlertController\/preferredAction"
}