{
  "abstract" : "Methods you use to generate PDF data that accompanies a user-requested screenshot.",
  "codeExamples" : [

  ],
  "contentHash" : "6a4c1efcc5f71cacd2477580220517500ddb29358fc874ee9220e371fd7ad12c",
  "crawledAt" : "2025-12-04T11:50:13Z",
  "declaration" : {
    "code" : "@MainActor protocol UIScreenshotServiceDelegate : NSObjectProtocol",
    "language" : "swift"
  },
  "id" : "7EA39FE6-BD27-4514-BC2D-E1E1D964A26B",
  "kind" : "protocol",
  "language" : "swift",
  "module" : "UIKit",
  "overview" : "## Overview\n\nWhen the user captures a screenshot of your app’s windows, UIKit calls the methods of this protocol to retrieve PDF data for those windows, and then it provides that data to the user. Adopt this protocol in a custom object of your app, and assign that object to the [doc:\/\/com.apple.uikit\/documentation\/UIKit\/UIScreenshotService] object associated with one of your window scenes. Use your custom delegate object to generate PDF content for the windows in the associated window-scene object.",
  "platforms" : [
    "iOS",
    "iPadOS",
    "Mac Catalyst",
    "tvOS"
  ],
  "rawMarkdown" : "---\nsource: https:\/\/developer.apple.com\/documentation\/UIKit\/UIScreenshotServiceDelegate\ncrawled: 2025-12-04T11:50:13Z\n---\n\n# UIScreenshotServiceDelegate\n\n**Protocol**\n\nMethods you use to generate PDF data that accompanies a user-requested screenshot.\n\n## Declaration\n\n```swift\n@MainActor protocol UIScreenshotServiceDelegate : NSObjectProtocol\n```\n\n## Overview\n\nWhen the user captures a screenshot of your app’s windows, UIKit calls the methods of this protocol to retrieve PDF data for those windows, and then it provides that data to the user. Adopt this protocol in a custom object of your app, and assign that object to the [doc:\/\/com.apple.uikit\/documentation\/UIKit\/UIScreenshotService] object associated with one of your window scenes. Use your custom delegate object to generate PDF content for the windows in the associated window-scene object.\n\n## Providing the PDF data\n\n- **screenshotService(_:generatePDFRepresentationWithCompletion:)**: Generates a high-fidelity PDF version of the entire content in a given window scene.\n\n## Responding to screenshot requests\n\n- **delegate**: The custom object you use to provide PDF data for a screenshot.\n\n## Inherits From\n\n- NSObjectProtocol\n\n",
  "sections" : [
    {
      "content" : "",
      "items" : [
        {
          "description" : "Generates a high-fidelity PDF version of the entire content in a given window scene.",
          "name" : "screenshotService(_:generatePDFRepresentationWithCompletion:)",
          "url" : "https:\/\/developer.apple.com\/documentation\/UIKit\/UIScreenshotServiceDelegate\/screenshotService(_:generatePDFRepresentationWithCompletion:)"
        }
      ],
      "title" : "Providing the PDF data"
    },
    {
      "content" : "",
      "items" : [
        {
          "description" : "The custom object you use to provide PDF data for a screenshot.",
          "name" : "delegate",
          "url" : "https:\/\/developer.apple.com\/documentation\/UIKit\/UIScreenshotService\/delegate"
        }
      ],
      "title" : "Responding to screenshot requests"
    },
    {
      "content" : "",
      "items" : [
        {
          "name" : "NSObjectProtocol"
        }
      ],
      "title" : "Inherits From"
    }
  ],
  "source" : "appleJSON",
  "title" : "UIScreenshotServiceDelegate",
  "url" : "https:\/\/developer.apple.com\/documentation\/UIKit\/UIScreenshotServiceDelegate"
}