{
  "abstract" : "The custom input accessory view controller to display when the responder becomes the first responder.",
  "codeExamples" : [

  ],
  "contentHash" : "468bd56bd8012d31e6b8be9568c92fb2b97f303f3bcba479298955f241416c98",
  "crawledAt" : "2025-12-03T23:37:55Z",
  "declaration" : {
    "code" : "@MainActor var inputAccessoryViewController: UIInputViewController? { get }",
    "language" : "swift"
  },
  "id" : "A21AAF8B-BE9A-4E6D-AC10-82538D7CEB36",
  "kind" : "property",
  "language" : "swift",
  "module" : "UIKit",
  "overview" : "## Discussion\n\nThis property is typically used to attach an accessory view controller to the system-supplied keyboard that’s presented for [doc:\/\/com.apple.uikit\/documentation\/UIKit\/UITextField] and [doc:\/\/com.apple.uikit\/documentation\/UIKit\/UITextView] objects.\n\nThe value of this read-only property is `nil`. If you want to attach custom controls to a system-supplied input view controller (such as the system keyboard) or to a custom input view (one you provide in the [doc:\/\/com.apple.uikit\/documentation\/UIKit\/UIResponder\/inputViewController] property), redeclare this property as read-write in a [doc:\/\/com.apple.uikit\/documentation\/UIKit\/UIResponder] subclass. You can then use this property to manage a custom accessory view. When the responder becomes the first responder, the responder infrastructure attaches the accessory view to the appropriate input view before displaying it.",
  "platforms" : [
    "iOS",
    "iPadOS",
    "Mac Catalyst",
    "tvOS"
  ],
  "rawMarkdown" : "---\nsource: https:\/\/developer.apple.com\/documentation\/UIKit\/UIResponder\/inputAccessoryViewController\ncrawled: 2025-12-03T23:37:55Z\n---\n\n# inputAccessoryViewController\n\n**Instance Property**\n\nThe custom input accessory view controller to display when the responder becomes the first responder.\n\n## Declaration\n\n```swift\n@MainActor var inputAccessoryViewController: UIInputViewController? { get }\n```\n\n## Discussion\n\nThis property is typically used to attach an accessory view controller to the system-supplied keyboard that’s presented for [doc:\/\/com.apple.uikit\/documentation\/UIKit\/UITextField] and [doc:\/\/com.apple.uikit\/documentation\/UIKit\/UITextView] objects.\n\nThe value of this read-only property is `nil`. If you want to attach custom controls to a system-supplied input view controller (such as the system keyboard) or to a custom input view (one you provide in the [doc:\/\/com.apple.uikit\/documentation\/UIKit\/UIResponder\/inputViewController] property), redeclare this property as read-write in a [doc:\/\/com.apple.uikit\/documentation\/UIKit\/UIResponder] subclass. You can then use this property to manage a custom accessory view. When the responder becomes the first responder, the responder infrastructure attaches the accessory view to the appropriate input view before displaying it.\n\n## Managing input views\n\n- **inputView**: The custom input view to display when the responder becomes the first responder.\n- **inputViewController**: The custom input view controller to use when the responder becomes the first responder.\n- **inputAccessoryView**: The custom input accessory view to display when the responder becomes the first responder.\n- **reloadInputViews()**: Updates the custom input and accessory views when the object is the first responder.\n\n",
  "sections" : [
    {
      "content" : "",
      "items" : [
        {
          "description" : "The custom input view to display when the responder becomes the first responder.",
          "name" : "inputView",
          "url" : "https:\/\/developer.apple.com\/documentation\/UIKit\/UIResponder\/inputView"
        },
        {
          "description" : "The custom input view controller to use when the responder becomes the first responder.",
          "name" : "inputViewController",
          "url" : "https:\/\/developer.apple.com\/documentation\/UIKit\/UIResponder\/inputViewController"
        },
        {
          "description" : "The custom input accessory view to display when the responder becomes the first responder.",
          "name" : "inputAccessoryView",
          "url" : "https:\/\/developer.apple.com\/documentation\/UIKit\/UIResponder\/inputAccessoryView"
        },
        {
          "description" : "Updates the custom input and accessory views when the object is the first responder.",
          "name" : "reloadInputViews()",
          "url" : "https:\/\/developer.apple.com\/documentation\/UIKit\/UIResponder\/reloadInputViews()"
        }
      ],
      "title" : "Managing input views"
    }
  ],
  "source" : "appleJSON",
  "title" : "inputAccessoryViewController",
  "url" : "https:\/\/developer.apple.com\/documentation\/UIKit\/UIResponder\/inputAccessoryViewController"
}