{
  "abstract" : "Returns the actions to be displayed for the given notification context.",
  "codeExamples" : [

  ],
  "contentHash" : "86c31abc125064c84439bac84177e14c6951a912c77cfdf9096965d1e6a6287e",
  "crawledAt" : "2025-12-04T12:02:34Z",
  "declaration" : {
    "code" : "@MainActor func actions(for context: UIUserNotificationActionContext) -> [UIUserNotificationAction]?",
    "language" : "swift"
  },
  "id" : "928217D1-6057-4610-A22F-6987E5800F0B",
  "kind" : "method",
  "language" : "swift",
  "module" : "UIKit",
  "overview" : "## Return Value\n\nAn array of [doc:\/\/com.apple.uikit\/documentation\/UIKit\/UIUserNotificationAction] objects to be displayed in the specified context. The order of the objects in the array represents the order that they are displayed in the resulting notification.\n\n## Discussion\n\nThis method returns the actions associated with the specified display context. To set the actions for a given context, you must create a [doc:\/\/com.apple.uikit\/documentation\/UIKit\/UIMutableUserNotificationCategory] object and use its setActions:forContext: method to specify your actions.",
  "platforms" : [
    "iOS",
    "iPadOS",
    "Mac Catalyst"
  ],
  "rawMarkdown" : "---\nsource: https:\/\/developer.apple.com\/documentation\/UIKit\/UIUserNotificationCategory\/actions(for:)\ncrawled: 2025-12-04T12:02:34Z\n---\n\n# actions(for:)\n\n**Instance Method**\n\nReturns the actions to be displayed for the given notification context.\n\n## Declaration\n\n```swift\n@MainActor func actions(for context: UIUserNotificationActionContext) -> [UIUserNotificationAction]?\n```\n\n## Parameters\n\n- **context**: The context in which the notification is displayed. Notifications can have a default context or a minimal context depending on whether the notification was just delivered or the user is looking at it in more detail.\n\n## Return Value\n\nAn array of [doc:\/\/com.apple.uikit\/documentation\/UIKit\/UIUserNotificationAction] objects to be displayed in the specified context. The order of the objects in the array represents the order that they are displayed in the resulting notification.\n\n## Discussion\n\nThis method returns the actions associated with the specified display context. To set the actions for a given context, you must create a [doc:\/\/com.apple.uikit\/documentation\/UIKit\/UIMutableUserNotificationCategory] object and use its setActions:forContext: method to specify your actions.\n\n## Getting the group configuration\n\n- **identifier**: The name of the action group.\n\n",
  "sections" : [
    {
      "content" : "",
      "items" : [
        {
          "description" : "The name of the action group.",
          "name" : "identifier",
          "url" : "https:\/\/developer.apple.com\/documentation\/UIKit\/UIUserNotificationCategory\/identifier"
        }
      ],
      "title" : "Getting the group configuration"
    }
  ],
  "source" : "appleJSON",
  "title" : "actions(for:)",
  "url" : "https:\/\/developer.apple.com\/documentation\/UIKit\/UIUserNotificationCategory\/actions(for:)"
}