{
  "abstract" : "Tells the delegate the drop session has moved out of the drop interaction’s view.",
  "codeExamples" : [

  ],
  "contentHash" : "d864034bb3c6f846d44266a272d968553248e34e7fbb236ce2d0b1c5152d5d18",
  "crawledAt" : "2025-12-02T04:45:54Z",
  "declaration" : {
    "code" : "@MainActor optional func dropInteraction(_ interaction: UIDropInteraction, sessionDidExit session: any UIDropSession)",
    "language" : "swift"
  },
  "id" : "683E1A28-21AD-4192-823E-188FD6A18E77",
  "kind" : "method",
  "module" : "UIKit",
  "platforms" : [
    "iOS",
    "iPadOS",
    "Mac Catalyst",
    "visionOS"
  ],
  "rawMarkdown" : "---\nsource: https:\/\/developer.apple.com\/documentation\/UIKit\/UIDropInteractionDelegate\/dropInteraction(_:sessionDidExit:)\ncrawled: 2025-12-02T04:45:54Z\n---\n\n# dropInteraction(_:sessionDidExit:)\n\n**Instance Method**\n\nTells the delegate the drop session has moved out of the drop interaction’s view.\n\n## Declaration\n\n```swift\n@MainActor optional func dropInteraction(_ interaction: UIDropInteraction, sessionDidExit session: any UIDropSession)\n```\n\n## Parameters\n\n- **interaction**: The interaction that called this method.\n- **session**: The drop session that has moved out of the interaction’s view.\n\n## Tracking the drop movements\n\n- **dropInteraction(_:sessionDidEnter:)**: Tells the delegate the drop session has moved into the drop interaction’s view.\n- **dropInteraction(_:sessionDidUpdate:)**: Tells the delegate the drop session has changed.\n- **dropInteraction(_:sessionDidEnd:)**: Tells the delegate the drop session has ended.\n\n",
  "sections" : [
    {
      "content" : "",
      "items" : [
        {
          "description" : "Tells the delegate the drop session has moved into the drop interaction’s view.",
          "name" : "dropInteraction(_:sessionDidEnter:)",
          "url" : "https:\/\/developer.apple.com\/documentation\/UIKit\/UIDropInteractionDelegate\/dropInteraction(_:sessionDidEnter:)"
        },
        {
          "description" : "Tells the delegate the drop session has changed.",
          "name" : "dropInteraction(_:sessionDidUpdate:)",
          "url" : "https:\/\/developer.apple.com\/documentation\/UIKit\/UIDropInteractionDelegate\/dropInteraction(_:sessionDidUpdate:)"
        },
        {
          "description" : "Tells the delegate the drop session has ended.",
          "name" : "dropInteraction(_:sessionDidEnd:)",
          "url" : "https:\/\/developer.apple.com\/documentation\/UIKit\/UIDropInteractionDelegate\/dropInteraction(_:sessionDidEnd:)"
        }
      ],
      "title" : "Tracking the drop movements"
    }
  ],
  "source" : "appleJSON",
  "title" : "dropInteraction(_:sessionDidExit:)",
  "url" : "https:\/\/developer.apple.com\/documentation\/UIKit\/UIDropInteractionDelegate\/dropInteraction(_:sessionDidExit:)"
}