{
  "abstract" : "Presents the iPad printing user interface in a popover view, optionally animating it from any area in a view.",
  "codeExamples" : [

  ],
  "contentHash" : "ae64f54b2776bb96374732b3fe6f0c2913fac6d6444e0efa1c35c8d9a28552d8",
  "crawledAt" : "2025-12-02T15:29:57Z",
  "declaration" : {
    "code" : "@MainActor func present(from rect: CGRect, in view: UIView, animated: Bool, completionHandler completion: UIPrintInteractionController.CompletionHandler? = nil) -> Bool",
    "language" : "swift"
  },
  "id" : "0C77A25A-3C1B-42CF-B3F0-CE4DA1D10DF3",
  "kind" : "method",
  "module" : "UIKit",
  "overview" : "## Discussion\n\nIt is valid to call this method for applications on iPad devices. Calling this method on an iPhone or iPod touch with `animated` set to [doc:\/\/com.apple.documentation\/documentation\/Swift\/true] causes the printing options view to animate upward from the bottom of the screen.\n\nIf you call this method when the printing options are already displayed, `UIPrintInteractionController` hides the printing-options popover view. You must call the method again to display the options.",
  "platforms" : [
    "iOS",
    "iPadOS",
    "Mac Catalyst",
    "visionOS"
  ],
  "rawMarkdown" : "---\nsource: https:\/\/developer.apple.com\/documentation\/UIKit\/UIPrintInteractionController\/present(from:in:animated:completionHandler:)\ncrawled: 2025-12-02T15:29:57Z\n---\n\n# present(from:in:animated:completionHandler:)\n\n**Instance Method**\n\nPresents the iPad printing user interface in a popover view, optionally animating it from any area in a view.\n\n## Declaration\n\n```swift\n@MainActor func present(from rect: CGRect, in view: UIView, animated: Bool, completionHandler completion: UIPrintInteractionController.CompletionHandler? = nil) -> Bool\n```\n\n## Parameters\n\n- **rect**: A rectangle that defines the area from which the printing popover view is animated.\n- **view**: The view providing the coordinate system for `rect`.\n- **animated**: [doc:\/\/com.apple.documentation\/documentation\/Swift\/true] to animate the printing popover view from `item`, [doc:\/\/com.apple.documentation\/documentation\/Swift\/false] to display it immediately.\n- **completion**: A block of type [doc:\/\/com.apple.uikit\/documentation\/UIKit\/UIPrintInteractionController\/CompletionHandler] that you implement to handle the conclusion of the print job (for instance, to reset state) and to handle any errors encountered in printing.\n\n## Discussion\n\nIt is valid to call this method for applications on iPad devices. Calling this method on an iPhone or iPod touch with `animated` set to [doc:\/\/com.apple.documentation\/documentation\/Swift\/true] causes the printing options view to animate upward from the bottom of the screen.\n\nIf you call this method when the printing options are already displayed, `UIPrintInteractionController` hides the printing-options popover view. You must call the method again to display the options.\n\n## Presenting the printing user interface\n\n- **present(animated:completionHandler:)**: Presents the iPhone printing user interface in a sheet, optionally animating it to slide up from the bottom of the screen.\n- **present(from:animated:completionHandler:)**: Presents the iPad printing user interface in a popover view, optionally animating it from a bar-button item.\n- **dismiss(animated:)**: Dismisses the printing-options sheet or popover.\n\n",
  "sections" : [
    {
      "content" : "",
      "items" : [
        {
          "description" : "Presents the iPhone printing user interface in a sheet, optionally animating it to slide up from the bottom of the screen.",
          "name" : "present(animated:completionHandler:)",
          "url" : "https:\/\/developer.apple.com\/documentation\/UIKit\/UIPrintInteractionController\/present(animated:completionHandler:)"
        },
        {
          "description" : "Presents the iPad printing user interface in a popover view, optionally animating it from a bar-button item.",
          "name" : "present(from:animated:completionHandler:)",
          "url" : "https:\/\/developer.apple.com\/documentation\/UIKit\/UIPrintInteractionController\/present(from:animated:completionHandler:)"
        },
        {
          "description" : "Dismisses the printing-options sheet or popover.",
          "name" : "dismiss(animated:)",
          "url" : "https:\/\/developer.apple.com\/documentation\/UIKit\/UIPrintInteractionController\/dismiss(animated:)"
        }
      ],
      "title" : "Presenting the printing user interface"
    }
  ],
  "source" : "appleJSON",
  "title" : "present(from:in:animated:completionHandler:)",
  "url" : "https:\/\/developer.apple.com\/documentation\/UIKit\/UIPrintInteractionController\/present(from:in:animated:completionHandler:)"
}