{
  "abstract" : "Returns a change token for a specific save operation.",
  "codeExamples" : [

  ],
  "contentHash" : "4e9ad9f40bc1d035a2731cb41beeb9d9c8552a30747935355cd897ee49e28cfc",
  "crawledAt" : "2025-12-01T02:25:37Z",
  "declaration" : {
    "code" : "func changeCountToken(for saveOperation: UIDocument.SaveOperation) -> Any",
    "language" : "swift"
  },
  "id" : "7A0F6402-0E8D-4A8A-BDA5-371D629C7AED",
  "kind" : "method",
  "module" : "UIKit",
  "overview" : "## Return Value\n\nAn object to use as a change-count token.\n\n## Discussion\n\nTo get autosaving capabilities for your documents, you must implement change tracking. Typically you do this by using an [doc:\/\/com.apple.documentation\/documentation\/Foundation\/UndoManager] object (assigned to [doc:\/\/com.apple.uikit\/documentation\/UIKit\/UIDocument\/undoManager] property) to register changes or by calling the [doc:\/\/com.apple.uikit\/documentation\/UIKit\/UIDocument\/updateChangeCount(_:)] method every time the user makes a change; UIKit then automatically determines whether there are unsaved changes and returns the proper value from [doc:\/\/com.apple.uikit\/documentation\/UIKit\/UIDocument\/hasUnsavedChanges]. If you take neither of these approaches (and you want the autosaving feature), you must implement this method as well as [doc:\/\/com.apple.uikit\/documentation\/UIKit\/UIDocument\/updateChangeCount(withToken:for:)] and [doc:\/\/com.apple.uikit\/documentation\/UIKit\/UIDocument\/hasUnsavedChanges].\n\nYou implement this particular method to return a change-count token that UIKit uses to encapsulate the history of document changes for a particular save operation. The token can be any object that represents the current change state of the document. This method is called at the start of the default implementation of the [doc:\/\/com.apple.uikit\/documentation\/UIKit\/UIDocument\/save(to:for:completionHandler:)] method. At the end of this default implementation, it calls the [doc:\/\/com.apple.uikit\/documentation\/UIKit\/UIDocument\/updateChangeCount(withToken:for:)] method, passing in the change-count token. You implement the latter method to compare the token with the one returned earlier; by doing so, you can determine if the document has acquired new unsaved changes between the start and end of an asynchronous write operation. You can then return the proper value from your override of [doc:\/\/com.apple.uikit\/documentation\/UIKit\/UIDocument\/hasUnsavedChanges].",
  "platforms" : [
    "iOS",
    "iPadOS",
    "Mac Catalyst",
    "visionOS"
  ],
  "rawMarkdown" : "---\nsource: https:\/\/developer.apple.com\/documentation\/UIKit\/UIDocument\/changeCountToken(for:)\ncrawled: 2025-12-01T02:25:37Z\n---\n\n# changeCountToken(for:)\n\n**Instance Method**\n\nReturns a change token for a specific save operation.\n\n## Declaration\n\n```swift\nfunc changeCountToken(for saveOperation: UIDocument.SaveOperation) -> Any\n```\n\n## Parameters\n\n- **saveOperation**: A constant that indicates whether the save operation is writing a new file or overwriting an existing one. See [doc:\/\/com.apple.uikit\/documentation\/UIKit\/UIDocument\/SaveOperation] for descriptions of these constants.\n\n## Return Value\n\nAn object to use as a change-count token.\n\n## Discussion\n\nTo get autosaving capabilities for your documents, you must implement change tracking. Typically you do this by using an [doc:\/\/com.apple.documentation\/documentation\/Foundation\/UndoManager] object (assigned to [doc:\/\/com.apple.uikit\/documentation\/UIKit\/UIDocument\/undoManager] property) to register changes or by calling the [doc:\/\/com.apple.uikit\/documentation\/UIKit\/UIDocument\/updateChangeCount(_:)] method every time the user makes a change; UIKit then automatically determines whether there are unsaved changes and returns the proper value from [doc:\/\/com.apple.uikit\/documentation\/UIKit\/UIDocument\/hasUnsavedChanges]. If you take neither of these approaches (and you want the autosaving feature), you must implement this method as well as [doc:\/\/com.apple.uikit\/documentation\/UIKit\/UIDocument\/updateChangeCount(withToken:for:)] and [doc:\/\/com.apple.uikit\/documentation\/UIKit\/UIDocument\/hasUnsavedChanges].\n\nYou implement this particular method to return a change-count token that UIKit uses to encapsulate the history of document changes for a particular save operation. The token can be any object that represents the current change state of the document. This method is called at the start of the default implementation of the [doc:\/\/com.apple.uikit\/documentation\/UIKit\/UIDocument\/save(to:for:completionHandler:)] method. At the end of this default implementation, it calls the [doc:\/\/com.apple.uikit\/documentation\/UIKit\/UIDocument\/updateChangeCount(withToken:for:)] method, passing in the change-count token. You implement the latter method to compare the token with the one returned earlier; by doing so, you can determine if the document has acquired new unsaved changes between the start and end of an asynchronous write operation. You can then return the proper value from your override of [doc:\/\/com.apple.uikit\/documentation\/UIKit\/UIDocument\/hasUnsavedChanges].\n\n## Tracking changes and autosaving\n\n- **hasUnsavedChanges**: A Boolean value that indicates whether the document has any unsaved changes.\n- **updateChangeCount(_:)**: Updates the change counter by indicating the kind of change.\n- **undoManager**: The undo manager for the document.\n- **updateChangeCount(withToken:for:)**: Updates the change count with reference to a change-count token passed in by UIKit.\n- **autosave(completionHandler:)**: Initiates automatic saving of documents with unsaved changes.\n\n",
  "sections" : [
    {
      "content" : "",
      "items" : [
        {
          "description" : "A Boolean value that indicates whether the document has any unsaved changes.",
          "name" : "hasUnsavedChanges",
          "url" : "https:\/\/developer.apple.com\/documentation\/UIKit\/UIDocument\/hasUnsavedChanges"
        },
        {
          "description" : "Updates the change counter by indicating the kind of change.",
          "name" : "updateChangeCount(_:)",
          "url" : "https:\/\/developer.apple.com\/documentation\/UIKit\/UIDocument\/updateChangeCount(_:)"
        },
        {
          "description" : "The undo manager for the document.",
          "name" : "undoManager",
          "url" : "https:\/\/developer.apple.com\/documentation\/UIKit\/UIDocument\/undoManager"
        },
        {
          "description" : "Updates the change count with reference to a change-count token passed in by UIKit.",
          "name" : "updateChangeCount(withToken:for:)",
          "url" : "https:\/\/developer.apple.com\/documentation\/UIKit\/UIDocument\/updateChangeCount(withToken:for:)"
        },
        {
          "description" : "Initiates automatic saving of documents with unsaved changes.",
          "name" : "autosave(completionHandler:)",
          "url" : "https:\/\/developer.apple.com\/documentation\/UIKit\/UIDocument\/autosave(completionHandler:)"
        }
      ],
      "title" : "Tracking changes and autosaving"
    }
  ],
  "source" : "appleJSON",
  "title" : "changeCountToken(for:)",
  "url" : "https:\/\/developer.apple.com\/documentation\/UIKit\/UIDocument\/changeCountToken(for:)"
}