{
  "abstract" : "Specifies whether a view controller, presented non-fullscreen, takes over control of status bar appearance from the presenting view controller.",
  "codeExamples" : [

  ],
  "contentHash" : "210af4bef7da10ae14277ae20b9b3da93cf7beb83673e0cbc7114f40d50803e7",
  "crawledAt" : "2025-12-03T09:45:23Z",
  "declaration" : {
    "code" : "@MainActor var modalPresentationCapturesStatusBarAppearance: Bool { get set }",
    "language" : "swift"
  },
  "id" : "5A034B13-3A6E-4797-B23E-654FEF8532CF",
  "kind" : "property",
  "language" : "swift",
  "module" : "UIKit",
  "overview" : "## Discussion\n\nThe default value of this property is [doc:\/\/com.apple.documentation\/documentation\/Swift\/false].\n\nWhen you present a view controller by calling the [doc:\/\/com.apple.uikit\/documentation\/UIKit\/UIViewController\/present(_:animated:completion:)] method, status bar appearance control is transferred from the presenting to the presented view controller only if the presented controller’s [doc:\/\/com.apple.uikit\/documentation\/UIKit\/UIViewController\/modalPresentationStyle] value is [doc:\/\/com.apple.uikit\/documentation\/UIKit\/UIModalPresentationStyle\/fullScreen]. By setting this property to [doc:\/\/com.apple.documentation\/documentation\/Swift\/true], you specify the presented view controller controls status bar appearance, even though presented non-fullscreen.\n\nThe system ignores this property’s value for a view controller presented fullscreen.",
  "platforms" : [
    "iOS",
    "iPadOS",
    "Mac Catalyst",
    "visionOS"
  ],
  "rawMarkdown" : "---\nsource: https:\/\/developer.apple.com\/documentation\/UIKit\/UIViewController\/modalPresentationCapturesStatusBarAppearance\ncrawled: 2025-12-03T09:45:23Z\n---\n\n# modalPresentationCapturesStatusBarAppearance\n\n**Instance Property**\n\nSpecifies whether a view controller, presented non-fullscreen, takes over control of status bar appearance from the presenting view controller.\n\n## Declaration\n\n```swift\n@MainActor var modalPresentationCapturesStatusBarAppearance: Bool { get set }\n```\n\n## Discussion\n\nThe default value of this property is [doc:\/\/com.apple.documentation\/documentation\/Swift\/false].\n\nWhen you present a view controller by calling the [doc:\/\/com.apple.uikit\/documentation\/UIKit\/UIViewController\/present(_:animated:completion:)] method, status bar appearance control is transferred from the presenting to the presented view controller only if the presented controller’s [doc:\/\/com.apple.uikit\/documentation\/UIKit\/UIViewController\/modalPresentationStyle] value is [doc:\/\/com.apple.uikit\/documentation\/UIKit\/UIModalPresentationStyle\/fullScreen]. By setting this property to [doc:\/\/com.apple.documentation\/documentation\/Swift\/true], you specify the presented view controller controls status bar appearance, even though presented non-fullscreen.\n\nThe system ignores this property’s value for a view controller presented fullscreen.\n\n## Managing the status bar\n\n- **prefersStatusBarHidden**: Specifies whether the view controller prefers the status bar to be hidden or shown.\n- **childForStatusBarHidden**: The view controller to use for determining the hidden state of the status bar.\n- **childForStatusBarStyle**: Called when the system needs the view controller to use for determining status bar style.\n- **preferredStatusBarStyle**: The preferred status bar style for the view controller.\n- **UIStatusBarStyle**: Constants that describe the style of the device’s status bar.\n- **preferredStatusBarUpdateAnimation**: Specifies the animation style to use for hiding and showing the status bar for the view controller.\n- **setNeedsStatusBarAppearanceUpdate()**: Indicates to the system that the view controller status bar attributes have changed.\n\n",
  "sections" : [
    {
      "content" : "",
      "items" : [
        {
          "description" : "Specifies whether the view controller prefers the status bar to be hidden or shown.",
          "name" : "prefersStatusBarHidden",
          "url" : "https:\/\/developer.apple.com\/documentation\/UIKit\/UIViewController\/prefersStatusBarHidden"
        },
        {
          "description" : "The view controller to use for determining the hidden state of the status bar.",
          "name" : "childForStatusBarHidden",
          "url" : "https:\/\/developer.apple.com\/documentation\/UIKit\/UIViewController\/childForStatusBarHidden"
        },
        {
          "description" : "Called when the system needs the view controller to use for determining status bar style.",
          "name" : "childForStatusBarStyle",
          "url" : "https:\/\/developer.apple.com\/documentation\/UIKit\/UIViewController\/childForStatusBarStyle"
        },
        {
          "description" : "The preferred status bar style for the view controller.",
          "name" : "preferredStatusBarStyle",
          "url" : "https:\/\/developer.apple.com\/documentation\/UIKit\/UIViewController\/preferredStatusBarStyle"
        },
        {
          "description" : "Constants that describe the style of the device’s status bar.",
          "name" : "UIStatusBarStyle",
          "url" : "https:\/\/developer.apple.com\/documentation\/UIKit\/UIStatusBarStyle"
        },
        {
          "description" : "Specifies the animation style to use for hiding and showing the status bar for the view controller.",
          "name" : "preferredStatusBarUpdateAnimation",
          "url" : "https:\/\/developer.apple.com\/documentation\/UIKit\/UIViewController\/preferredStatusBarUpdateAnimation"
        },
        {
          "description" : "Indicates to the system that the view controller status bar attributes have changed.",
          "name" : "setNeedsStatusBarAppearanceUpdate()",
          "url" : "https:\/\/developer.apple.com\/documentation\/UIKit\/UIViewController\/setNeedsStatusBarAppearanceUpdate()"
        }
      ],
      "title" : "Managing the status bar"
    }
  ],
  "source" : "appleJSON",
  "title" : "modalPresentationCapturesStatusBarAppearance",
  "url" : "https:\/\/developer.apple.com\/documentation\/UIKit\/UIViewController\/modalPresentationCapturesStatusBarAppearance"
}