{
  "abstract" : "An interaction that enables a gesture to present the large content viewer for cases when supporting the largest dynamic type sizes isn’t appropriate.",
  "codeExamples" : [

  ],
  "conformsTo" : [
    "CVarArg",
    "CustomDebugStringConvertible",
    "CustomStringConvertible",
    "Equatable",
    "Hashable",
    "NSObjectProtocol",
    "Sendable",
    "UIInteraction"
  ],
  "contentHash" : "c4f41a404e72149294e7ab73f04d9a2a21fd8c0b4238e6156b53b5460d11eded",
  "crawledAt" : "2025-12-03T05:28:12Z",
  "declaration" : {
    "code" : "@MainActor class UILargeContentViewerInteraction",
    "language" : "swift"
  },
  "id" : "B6992315-A005-47C5-B1EA-6FD0849A30E4",
  "kind" : "class",
  "language" : "swift",
  "module" : "UIKit",
  "overview" : "## Overview\n\nDon’t use the large content viewer as a replacement for proper Dynamic Type support. For example, Dynamic Type allows items in a list to grow or shrink vertically to accommodate the user’s preferred font size. Rely on the large content viewer only in situations where items must remain small due to unavoidable design constraints. For example, buttons in a tab bar remain small to leave more room for the main app content.\n\nFor more information about allowing your app’s content to adjust to varying font sizes, see [doc:\/\/com.apple.uikit\/documentation\/UIKit\/creating-self-sizing-table-view-cells#Add-Dynamic-Type-support] and the [https:\/\/developer.apple.com\/design\/human-interface-guidelines\/accessibility\/overview\/text-size-and-weight\/].",
  "platforms" : [
    "iOS",
    "iPadOS",
    "Mac Catalyst",
    "visionOS"
  ],
  "rawMarkdown" : "---\nsource: https:\/\/developer.apple.com\/documentation\/UIKit\/UILargeContentViewerInteraction\ncrawled: 2025-12-03T05:28:12Z\n---\n\n# UILargeContentViewerInteraction\n\n**Class**\n\nAn interaction that enables a gesture to present the large content viewer for cases when supporting the largest dynamic type sizes isn’t appropriate.\n\n## Declaration\n\n```swift\n@MainActor class UILargeContentViewerInteraction\n```\n\n## Overview\n\nDon’t use the large content viewer as a replacement for proper Dynamic Type support. For example, Dynamic Type allows items in a list to grow or shrink vertically to accommodate the user’s preferred font size. Rely on the large content viewer only in situations where items must remain small due to unavoidable design constraints. For example, buttons in a tab bar remain small to leave more room for the main app content.\n\nFor more information about allowing your app’s content to adjust to varying font sizes, see [doc:\/\/com.apple.uikit\/documentation\/UIKit\/creating-self-sizing-table-view-cells#Add-Dynamic-Type-support] and the [https:\/\/developer.apple.com\/design\/human-interface-guidelines\/accessibility\/overview\/text-size-and-weight\/].\n\n## Creating large content viewer interactions\n\n- **init(delegate:)**: Creates an interaction object with the specified delegate.\n\n## Customizing large content viewer interactions\n\n- **delegate**: An object that can fine-tune the large content viewer interactions, especially in the presence of other gesture recognizers.\n- **gestureRecognizerForExclusionRelationship**: A gesture recognizer that you can use to set up simultaneous recognition or failure relationships with other gesture recognizers.\n\n## Detecting the large content viewer\n\n- **isEnabled**: A Boolean value that indicates whether the large content viewer is enabled on the device.\n- **enabledStatusDidChangeNotification**: A notification the system posts when it enables or disables the large content viewer.\n\n## Content viewer\n\n- **UILargeContentViewerInteractionDelegate**: An object that customizes the behavior of the large content viewer interactions.\n- **UILargeContentViewerItem**: Methods that provide details about how to display your custom content in the large content viewer.\n\n## Inherits From\n\n- NSObject\n\n## Conforms To\n\n- CVarArg\n- CustomDebugStringConvertible\n- CustomStringConvertible\n- Equatable\n- Hashable\n- NSObjectProtocol\n- Sendable\n- UIInteraction\n\n",
  "sections" : [
    {
      "content" : "",
      "items" : [
        {
          "description" : "Creates an interaction object with the specified delegate.",
          "name" : "init(delegate:)",
          "url" : "https:\/\/developer.apple.com\/documentation\/UIKit\/UILargeContentViewerInteraction\/init(delegate:)"
        }
      ],
      "title" : "Creating large content viewer interactions"
    },
    {
      "content" : "",
      "items" : [
        {
          "description" : "An object that can fine-tune the large content viewer interactions, especially in the presence of other gesture recognizers.",
          "name" : "delegate",
          "url" : "https:\/\/developer.apple.com\/documentation\/UIKit\/UILargeContentViewerInteraction\/delegate"
        },
        {
          "description" : "A gesture recognizer that you can use to set up simultaneous recognition or failure relationships with other gesture recognizers.",
          "name" : "gestureRecognizerForExclusionRelationship",
          "url" : "https:\/\/developer.apple.com\/documentation\/UIKit\/UILargeContentViewerInteraction\/gestureRecognizerForExclusionRelationship"
        }
      ],
      "title" : "Customizing large content viewer interactions"
    },
    {
      "content" : "",
      "items" : [
        {
          "description" : "A Boolean value that indicates whether the large content viewer is enabled on the device.",
          "name" : "isEnabled",
          "url" : "https:\/\/developer.apple.com\/documentation\/UIKit\/UILargeContentViewerInteraction\/isEnabled"
        },
        {
          "description" : "A notification the system posts when it enables or disables the large content viewer.",
          "name" : "enabledStatusDidChangeNotification",
          "url" : "https:\/\/developer.apple.com\/documentation\/UIKit\/UILargeContentViewerInteraction\/enabledStatusDidChangeNotification"
        }
      ],
      "title" : "Detecting the large content viewer"
    },
    {
      "content" : "",
      "items" : [
        {
          "description" : "An object that customizes the behavior of the large content viewer interactions.",
          "name" : "UILargeContentViewerInteractionDelegate",
          "url" : "https:\/\/developer.apple.com\/documentation\/UIKit\/UILargeContentViewerInteractionDelegate"
        },
        {
          "description" : "Methods that provide details about how to display your custom content in the large content viewer.",
          "name" : "UILargeContentViewerItem",
          "url" : "https:\/\/developer.apple.com\/documentation\/UIKit\/UILargeContentViewerItem"
        }
      ],
      "title" : "Content viewer"
    },
    {
      "content" : "",
      "items" : [
        {
          "name" : "NSObject"
        }
      ],
      "title" : "Inherits From"
    }
  ],
  "source" : "appleJSON",
  "title" : "UILargeContentViewerInteraction",
  "url" : "https:\/\/developer.apple.com\/documentation\/UIKit\/UILargeContentViewerInteraction"
}