{
  "abstract" : "The system displays the content as either a tab bar or a sidebar, depending on the context.",
  "codeExamples" : [

  ],
  "contentHash" : "bb4f6276a22d83e9bd5bbbaf3048afbf916bffbdd9687059c52345f8fe6dc1a4",
  "crawledAt" : "2025-12-05T04:50:10Z",
  "declaration" : {
    "code" : "case tabSidebar",
    "language" : "swift"
  },
  "id" : "98A38C6A-20A3-4C1F-8E2C-36E254D7086B",
  "kind" : "unknown",
  "language" : "swift",
  "module" : "UIKit",
  "overview" : "## Discussion\n\nDifferent platforms handle the mode differently:\n\nFor more information, see [doc:\/\/com.apple.uikit\/documentation\/UIKit\/elevating-your-ipad-app-with-a-tab-bar-and-sidebar].",
  "platforms" : [
    "iOS",
    "iPadOS",
    "Mac Catalyst",
    "visionOS"
  ],
  "rawMarkdown" : "---\nsource: https:\/\/developer.apple.com\/documentation\/UIKit\/UITabBarController\/Mode-swift.enum\/tabSidebar\ncrawled: 2025-12-05T04:50:10Z\n---\n\n# UITabBarController.Mode.tabSidebar\n\n**Case**\n\nThe system displays the content as either a tab bar or a sidebar, depending on the context.\n\n## Declaration\n\n```swift\ncase tabSidebar\n```\n\n## Discussion\n\nDifferent platforms handle the mode differently:\n\n- On iPad, the system displays the content as either a tab bar or a sidebar, depending on the context.\n- On Mac Catalyst, the system displays a sidebar.\n- On iPhone and Apple TV, the system displays the platform’s regular tab bar.\n- In visionOS, the system displays the platform’s regular tabs, but a [doc:\/\/com.apple.uikit\/documentation\/UIKit\/UITabGroup] can display a sidebar when it displays the group’s view controller.\n\nFor more information, see [doc:\/\/com.apple.uikit\/documentation\/UIKit\/elevating-your-ipad-app-with-a-tab-bar-and-sidebar].\n\n## Setting modes\n\n- **UITabBarController.Mode.automatic**: The system sets the display mode based on the tab’s content.\n- **UITabBarController.Mode.tabBar**: The system displays the content only as a tab bar.\n\n",
  "sections" : [
    {
      "content" : "",
      "items" : [
        {
          "description" : "The system sets the display mode based on the tab’s content.",
          "name" : "UITabBarController.Mode.automatic",
          "url" : "https:\/\/developer.apple.com\/documentation\/UIKit\/UITabBarController\/Mode-swift.enum\/automatic"
        },
        {
          "description" : "The system displays the content only as a tab bar.",
          "name" : "UITabBarController.Mode.tabBar",
          "url" : "https:\/\/developer.apple.com\/documentation\/UIKit\/UITabBarController\/Mode-swift.enum\/tabBar"
        }
      ],
      "title" : "Setting modes"
    }
  ],
  "source" : "appleJSON",
  "title" : "UITabBarController.Mode.tabSidebar",
  "url" : "https:\/\/developer.apple.com\/documentation\/UIKit\/UITabBarController\/Mode-swift.enum\/tabSidebar"
}