{
  "abstract" : "A configuration that describes a specific background appearance.",
  "codeExamples" : [
    {
      "code" : "var backgroundConfig = UIBackgroundConfiguration.listPlainCell()\n\n\/\/ Set a nil background color to use the view's tint color. \nbackgroundConfig.backgroundColor = nil \n\ncell.backgroundConfiguration = backgroundConfig",
      "language" : "swift"
    },
    {
      "code" : "override func updateConfiguration(using state: UIConfigurationState) {\n    \/\/ Get the system default background configuration for a plain style list cell in the current state. \n    var backgroundConfig = UIBackgroundConfiguration.listPlainCell().updated(for: state) \n\n    \/\/ Customize the background color to use the tint color when the cell is highlighted or selected. \n     if state.isHighlighted || state.isSelected { \n        backgroundConfig.backgroundColor = nil \n     } \n\n    \/\/ Apply the background configuration to the cell. \n    self.backgroundConfiguration = backgroundConfig \n} ",
      "language" : "swift"
    }
  ],
  "conformsTo" : [
    "Copyable",
    "CustomDebugStringConvertible",
    "CustomReflectable",
    "CustomStringConvertible",
    "Equatable",
    "Hashable"
  ],
  "contentHash" : "36597afff9979b86571c0aa75ce3861cddecc3546f6bfee0e60bcff48c9f0d88",
  "crawledAt" : "2025-12-07T13:37:24Z",
  "declaration" : {
    "code" : "struct UIBackgroundConfiguration",
    "language" : "swift"
  },
  "id" : "1C6976E9-C10D-402D-A245-3FB18E5CA3F8",
  "kind" : "struct",
  "language" : "swift",
  "module" : "UIKit",
  "overview" : "## Overview\n\nBackground configurations provide a lightweight way for you to create backgrounds for your views. Using a background configuration, you can obtain system default background styling for a variety of different view states. You apply background configurations directly to [doc:\/\/com.apple.uikit\/documentation\/UIKit\/UIButton] or to cells, headers, and footers in [doc:\/\/com.apple.uikit\/documentation\/UIKit\/UICollectionView] and [doc:\/\/com.apple.uikit\/documentation\/UIKit\/UITableView].\n\nTo use a background configuration:\n\nYou can also start by creating an empty background configuration using `clear()`, which produces a transparent background.\n\nEach of the system background styles provides system default values for different configuration states ([doc:\/\/com.apple.uikit\/documentation\/UIKit\/UIConfigurationState-8d7pd]). If you apply a background configuration to a view whose [doc:\/\/com.apple.uikit\/documentation\/UIKit\/UICollectionViewCell\/automaticallyUpdatesBackgroundConfiguration] property is [doc:\/\/com.apple.documentation\/documentation\/Swift\/true], the system automatically updates the background configuration when the view’s state changes.\n\nIf you want additional customization beyond the system default values, you can choose to manually update the background configuration by overriding the view’s [doc:\/\/com.apple.uikit\/documentation\/UIKit\/UICollectionViewCell\/updateConfiguration(using:)] method.\n\nWhen you apply a configuration to a view, UIKit performs the actual drawing and rendering of the background. When you use background configurations instead of rendering your own backgrounds, the system provides automatic view hierarchy management, support for interactive and interruptible animations and transitions, and performance optimizations.",
  "platforms" : [
    "iOS",
    "iPadOS",
    "Mac Catalyst",
    "tvOS",
    "visionOS"
  ],
  "rawMarkdown" : "---\nsource: https:\/\/developer.apple.com\/documentation\/uikit\/uibackgroundconfiguration-swift.struct\ncrawled: 2025-12-07T13:37:24Z\n---\n\n# UIBackgroundConfiguration\n\n**Structure**\n\nA configuration that describes a specific background appearance.\n\n## Declaration\n\n```swift\nstruct UIBackgroundConfiguration\n```\n\n## Overview\n\nBackground configurations provide a lightweight way for you to create backgrounds for your views. Using a background configuration, you can obtain system default background styling for a variety of different view states. You apply background configurations directly to [doc:\/\/com.apple.uikit\/documentation\/UIKit\/UIButton] or to cells, headers, and footers in [doc:\/\/com.apple.uikit\/documentation\/UIKit\/UICollectionView] and [doc:\/\/com.apple.uikit\/documentation\/UIKit\/UITableView].\n\nTo use a background configuration:\n\n1. Create a background configuration with one of the default system styles.\n2. Modify the configuration to match your view’s style if you need additional customization.\n3. Set the view’s current background configuration to your configuration.\n\n```swift\nvar backgroundConfig = UIBackgroundConfiguration.listPlainCell()\n\n\/\/ Set a nil background color to use the view's tint color. \nbackgroundConfig.backgroundColor = nil \n\ncell.backgroundConfiguration = backgroundConfig\n```\n\nYou can also start by creating an empty background configuration using `clear()`, which produces a transparent background.\n\nEach of the system background styles provides system default values for different configuration states ([doc:\/\/com.apple.uikit\/documentation\/UIKit\/UIConfigurationState-8d7pd]). If you apply a background configuration to a view whose [doc:\/\/com.apple.uikit\/documentation\/UIKit\/UICollectionViewCell\/automaticallyUpdatesBackgroundConfiguration] property is [doc:\/\/com.apple.documentation\/documentation\/Swift\/true], the system automatically updates the background configuration when the view’s state changes.\n\nIf you want additional customization beyond the system default values, you can choose to manually update the background configuration by overriding the view’s [doc:\/\/com.apple.uikit\/documentation\/UIKit\/UICollectionViewCell\/updateConfiguration(using:)] method.\n\n```swift\noverride func updateConfiguration(using state: UIConfigurationState) {\n    \/\/ Get the system default background configuration for a plain style list cell in the current state. \n    var backgroundConfig = UIBackgroundConfiguration.listPlainCell().updated(for: state) \n\n    \/\/ Customize the background color to use the tint color when the cell is highlighted or selected. \n     if state.isHighlighted || state.isSelected { \n        backgroundConfig.backgroundColor = nil \n     } \n\n    \/\/ Apply the background configuration to the cell. \n    self.backgroundConfiguration = backgroundConfig \n} \n```\n\nWhen you apply a configuration to a view, UIKit performs the actual drawing and rendering of the background. When you use background configurations instead of rendering your own backgrounds, the system provides automatic view hierarchy management, support for interactive and interruptible animations and transitions, and performance optimizations.\n\n## Creating cell background configurations\n\n- **listPlainCell()**: Creates the default configuration you use to style a cell in a plain list.\n- **listGroupedCell()**: Creates the default configuration you use to style a cell in a grouped list.\n- **listSidebarCell()**: Creates the default configuration you use to style a cell in a sidebar list.\n- **listAccompaniedSidebarCell()**: Creates the default configuration you use to style a cell in an accompanied sidebar list.\n\n## Creating header and footer background configurations\n\n- **listPlainHeaderFooter()**: Creates the default configuration you use to style a plain list header or footer.\n- **listGroupedHeaderFooter()**: Creates the default configuration you use to style a grouped list header or footer.\n- **listSidebarHeader()**: Creates the default configuration you use to style a sidebar list header.\n\n## Creating an empty background configuration\n\n- **clear()**: Creates an empty background configuration with a transparent background and no default styling.\n\n## Customizing the background\n\n- **customView**: A custom view for the background.\n- **cornerRadius**: The preferred corner radius, using a continuous corner curve, for the background and stroke.\n- **backgroundInsets**: The insets (or outsets, if negative) for the background and stroke, relative to the edges of the containing view.\n- **edgesAddingLayoutMarginsToBackgroundInsets**: The edges on which the configuration adds the containing view’s layout margins to the background insets.\n- **backgroundColor**: The color of the background.\n- **backgroundColorTransformer**: The color transformer for resolving the background color.\n- **resolvedBackgroundColor(for:)**: Generates the resolved background color for the specified tint color, using the background color and color transformer.\n- **visualEffect**: The visual effect that the configuration applies to the background.\n- **shadowProperties**\n- **UIShadowProperties**\n- **strokeColor**: The color of the stroke.\n- **strokeColorTransformer**: The color transformer for resolving the stroke color.\n- **resolvedStrokeColor(for:)**: Generates the resolved stroke color for the specified tint color, using the stroke color and color transformer.\n- **strokeWidth**: The width of the stroke.\n- **strokeOutset**: The outset (or inset, if negative) for the stroke.\n- **image**: The image displayed in the view’s background.\n- **imageContentMode**: A property that determines the layout of a background image in a view when its bounds change.\n\n## Updating background configurations\n\n- **updated(for:)**: Generates a configuration for the specified state by applying the configuration’s default values for that state to any properties that you haven’t customized.\n\n## Type Methods\n\n- **listCell()**\n- **listFooter()**\n- **listHeader()**\n\n## Conforms To\n\n- Copyable\n- CustomDebugStringConvertible\n- CustomReflectable\n- CustomStringConvertible\n- Equatable\n- Hashable\n\n",
  "sections" : [
    {
      "content" : "",
      "items" : [
        {
          "description" : "Creates the default configuration you use to style a cell in a plain list.",
          "name" : "listPlainCell()",
          "url" : "https:\/\/developer.apple.com\/documentation\/UIKit\/UIBackgroundConfiguration-swift.struct\/listPlainCell()"
        },
        {
          "description" : "Creates the default configuration you use to style a cell in a grouped list.",
          "name" : "listGroupedCell()",
          "url" : "https:\/\/developer.apple.com\/documentation\/UIKit\/UIBackgroundConfiguration-swift.struct\/listGroupedCell()"
        },
        {
          "description" : "Creates the default configuration you use to style a cell in a sidebar list.",
          "name" : "listSidebarCell()",
          "url" : "https:\/\/developer.apple.com\/documentation\/UIKit\/UIBackgroundConfiguration-swift.struct\/listSidebarCell()"
        },
        {
          "description" : "Creates the default configuration you use to style a cell in an accompanied sidebar list.",
          "name" : "listAccompaniedSidebarCell()",
          "url" : "https:\/\/developer.apple.com\/documentation\/UIKit\/UIBackgroundConfiguration-swift.struct\/listAccompaniedSidebarCell()"
        }
      ],
      "title" : "Creating cell background configurations"
    },
    {
      "content" : "",
      "items" : [
        {
          "description" : "Creates the default configuration you use to style a plain list header or footer.",
          "name" : "listPlainHeaderFooter()",
          "url" : "https:\/\/developer.apple.com\/documentation\/UIKit\/UIBackgroundConfiguration-swift.struct\/listPlainHeaderFooter()"
        },
        {
          "description" : "Creates the default configuration you use to style a grouped list header or footer.",
          "name" : "listGroupedHeaderFooter()",
          "url" : "https:\/\/developer.apple.com\/documentation\/UIKit\/UIBackgroundConfiguration-swift.struct\/listGroupedHeaderFooter()"
        },
        {
          "description" : "Creates the default configuration you use to style a sidebar list header.",
          "name" : "listSidebarHeader()",
          "url" : "https:\/\/developer.apple.com\/documentation\/UIKit\/UIBackgroundConfiguration-swift.struct\/listSidebarHeader()"
        }
      ],
      "title" : "Creating header and footer background configurations"
    },
    {
      "content" : "",
      "items" : [
        {
          "description" : "Creates an empty background configuration with a transparent background and no default styling.",
          "name" : "clear()",
          "url" : "https:\/\/developer.apple.com\/documentation\/UIKit\/UIBackgroundConfiguration-swift.struct\/clear()"
        }
      ],
      "title" : "Creating an empty background configuration"
    },
    {
      "content" : "",
      "items" : [
        {
          "description" : "A custom view for the background.",
          "name" : "customView",
          "url" : "https:\/\/developer.apple.com\/documentation\/UIKit\/UIBackgroundConfiguration-swift.struct\/customView"
        },
        {
          "description" : "The preferred corner radius, using a continuous corner curve, for the background and stroke.",
          "name" : "cornerRadius",
          "url" : "https:\/\/developer.apple.com\/documentation\/UIKit\/UIBackgroundConfiguration-swift.struct\/cornerRadius"
        },
        {
          "description" : "The insets (or outsets, if negative) for the background and stroke, relative to the edges of the containing view.",
          "name" : "backgroundInsets",
          "url" : "https:\/\/developer.apple.com\/documentation\/UIKit\/UIBackgroundConfiguration-swift.struct\/backgroundInsets"
        },
        {
          "description" : "The edges on which the configuration adds the containing view’s layout margins to the background insets.",
          "name" : "edgesAddingLayoutMarginsToBackgroundInsets",
          "url" : "https:\/\/developer.apple.com\/documentation\/UIKit\/UIBackgroundConfiguration-swift.struct\/edgesAddingLayoutMarginsToBackgroundInsets"
        },
        {
          "description" : "The color of the background.",
          "name" : "backgroundColor",
          "url" : "https:\/\/developer.apple.com\/documentation\/UIKit\/UIBackgroundConfiguration-swift.struct\/backgroundColor"
        },
        {
          "description" : "The color transformer for resolving the background color.",
          "name" : "backgroundColorTransformer",
          "url" : "https:\/\/developer.apple.com\/documentation\/UIKit\/UIBackgroundConfiguration-swift.struct\/backgroundColorTransformer"
        },
        {
          "description" : "Generates the resolved background color for the specified tint color, using the background color and color transformer.",
          "name" : "resolvedBackgroundColor(for:)",
          "url" : "https:\/\/developer.apple.com\/documentation\/UIKit\/UIBackgroundConfiguration-swift.struct\/resolvedBackgroundColor(for:)"
        },
        {
          "description" : "The visual effect that the configuration applies to the background.",
          "name" : "visualEffect",
          "url" : "https:\/\/developer.apple.com\/documentation\/UIKit\/UIBackgroundConfiguration-swift.struct\/visualEffect"
        },
        {
          "description" : "",
          "name" : "shadowProperties",
          "url" : "https:\/\/developer.apple.com\/documentation\/UIKit\/UIBackgroundConfiguration-swift.struct\/shadowProperties"
        },
        {
          "description" : "",
          "name" : "UIShadowProperties",
          "url" : "https:\/\/developer.apple.com\/documentation\/UIKit\/UIShadowProperties-swift.struct"
        },
        {
          "description" : "The color of the stroke.",
          "name" : "strokeColor",
          "url" : "https:\/\/developer.apple.com\/documentation\/UIKit\/UIBackgroundConfiguration-swift.struct\/strokeColor"
        },
        {
          "description" : "The color transformer for resolving the stroke color.",
          "name" : "strokeColorTransformer",
          "url" : "https:\/\/developer.apple.com\/documentation\/UIKit\/UIBackgroundConfiguration-swift.struct\/strokeColorTransformer"
        },
        {
          "description" : "Generates the resolved stroke color for the specified tint color, using the stroke color and color transformer.",
          "name" : "resolvedStrokeColor(for:)",
          "url" : "https:\/\/developer.apple.com\/documentation\/UIKit\/UIBackgroundConfiguration-swift.struct\/resolvedStrokeColor(for:)"
        },
        {
          "description" : "The width of the stroke.",
          "name" : "strokeWidth",
          "url" : "https:\/\/developer.apple.com\/documentation\/UIKit\/UIBackgroundConfiguration-swift.struct\/strokeWidth"
        },
        {
          "description" : "The outset (or inset, if negative) for the stroke.",
          "name" : "strokeOutset",
          "url" : "https:\/\/developer.apple.com\/documentation\/UIKit\/UIBackgroundConfiguration-swift.struct\/strokeOutset"
        },
        {
          "description" : "The image displayed in the view’s background.",
          "name" : "image",
          "url" : "https:\/\/developer.apple.com\/documentation\/UIKit\/UIBackgroundConfiguration-swift.struct\/image"
        },
        {
          "description" : "A property that determines the layout of a background image in a view when its bounds change.",
          "name" : "imageContentMode",
          "url" : "https:\/\/developer.apple.com\/documentation\/UIKit\/UIBackgroundConfiguration-swift.struct\/imageContentMode"
        }
      ],
      "title" : "Customizing the background"
    },
    {
      "content" : "",
      "items" : [
        {
          "description" : "Generates a configuration for the specified state by applying the configuration’s default values for that state to any properties that you haven’t customized.",
          "name" : "updated(for:)",
          "url" : "https:\/\/developer.apple.com\/documentation\/UIKit\/UIBackgroundConfiguration-swift.struct\/updated(for:)"
        }
      ],
      "title" : "Updating background configurations"
    },
    {
      "content" : "",
      "items" : [
        {
          "description" : "",
          "name" : "listCell()",
          "url" : "https:\/\/developer.apple.com\/documentation\/UIKit\/UIBackgroundConfiguration-swift.struct\/listCell()"
        },
        {
          "description" : "",
          "name" : "listFooter()",
          "url" : "https:\/\/developer.apple.com\/documentation\/UIKit\/UIBackgroundConfiguration-swift.struct\/listFooter()"
        },
        {
          "description" : "",
          "name" : "listHeader()",
          "url" : "https:\/\/developer.apple.com\/documentation\/UIKit\/UIBackgroundConfiguration-swift.struct\/listHeader()"
        }
      ],
      "title" : "Type Methods"
    }
  ],
  "source" : "appleJSON",
  "title" : "UIBackgroundConfiguration",
  "url" : "https:\/\/developer.apple.com\/documentation\/uikit\/uibackgroundconfiguration-swift.struct"
}