{
  "abstract" : "A set of methods that provide contextual information for transition animations between view controllers.",
  "codeExamples" : [

  ],
  "contentHash" : "39efc176a650665423e4568a84521221bcff5f1037cec6f80e33cbac4a1471f7",
  "crawledAt" : "2025-12-03T18:09:27Z",
  "declaration" : {
    "code" : "@MainActor protocol UIViewControllerContextTransitioning : NSObjectProtocol",
    "language" : "swift"
  },
  "id" : "982D117B-BDA9-4526-8E9F-BDA77BEB4D0F",
  "kind" : "protocol",
  "language" : "swift",
  "module" : "UIKit",
  "overview" : "## Overview\n\nDon’t adopt this protocol in your own classes, nor should you directly create objects that adopt this protocol. During a transition, the animator objects involved in that transition receive a fully configured context object from UIKit. Custom animator objects — objects that adopt the [doc:\/\/com.apple.uikit\/documentation\/UIKit\/UIViewControllerAnimatedTransitioning] or [doc:\/\/com.apple.uikit\/documentation\/UIKit\/UIViewControllerInteractiveTransitioning] protocol — should simply retrieve the information they need from the provided object.\n\nA context object encapsulates information about the views and view controllers involved in the transition. It also contains details about the how to execute the transition. For interactive transitions, the interactive animator object uses the methods of this protocol to report the animation’s progress. When the animation starts, the interactive animator object must save a pointer to the context object. Based on user interactions, the animator object then calls the [doc:\/\/com.apple.uikit\/documentation\/UIKit\/UIViewControllerContextTransitioning\/updateInteractiveTransition(_:)], [doc:\/\/com.apple.uikit\/documentation\/UIKit\/UIViewControllerContextTransitioning\/finishInteractiveTransition()], or [doc:\/\/com.apple.uikit\/documentation\/UIKit\/UIViewControllerContextTransitioning\/cancelInteractiveTransition()] methods to report the progress toward completing the animation. Those methods send that information to UIKit so that it can drive the timing of the animations.",
  "platforms" : [
    "iOS",
    "iPadOS",
    "Mac Catalyst",
    "tvOS",
    "visionOS"
  ],
  "rawMarkdown" : "---\nsource: https:\/\/developer.apple.com\/documentation\/UIKit\/UIViewControllerContextTransitioning\ncrawled: 2025-12-03T18:09:27Z\n---\n\n# UIViewControllerContextTransitioning\n\n**Protocol**\n\nA set of methods that provide contextual information for transition animations between view controllers.\n\n## Declaration\n\n```swift\n@MainActor protocol UIViewControllerContextTransitioning : NSObjectProtocol\n```\n\n## Overview\n\nDon’t adopt this protocol in your own classes, nor should you directly create objects that adopt this protocol. During a transition, the animator objects involved in that transition receive a fully configured context object from UIKit. Custom animator objects — objects that adopt the [doc:\/\/com.apple.uikit\/documentation\/UIKit\/UIViewControllerAnimatedTransitioning] or [doc:\/\/com.apple.uikit\/documentation\/UIKit\/UIViewControllerInteractiveTransitioning] protocol — should simply retrieve the information they need from the provided object.\n\nA context object encapsulates information about the views and view controllers involved in the transition. It also contains details about the how to execute the transition. For interactive transitions, the interactive animator object uses the methods of this protocol to report the animation’s progress. When the animation starts, the interactive animator object must save a pointer to the context object. Based on user interactions, the animator object then calls the [doc:\/\/com.apple.uikit\/documentation\/UIKit\/UIViewControllerContextTransitioning\/updateInteractiveTransition(_:)], [doc:\/\/com.apple.uikit\/documentation\/UIKit\/UIViewControllerContextTransitioning\/finishInteractiveTransition()], or [doc:\/\/com.apple.uikit\/documentation\/UIKit\/UIViewControllerContextTransitioning\/cancelInteractiveTransition()] methods to report the progress toward completing the animation. Those methods send that information to UIKit so that it can drive the timing of the animations.\n\n\n\n## Accessing the transition objects\n\n- **containerView**: The view that acts as the superview for the views involved in the transition.\n- **viewController(forKey:)**: Returns a view controller involved in the transition.\n- **view(forKey:)**: Returns the specified view involved in the transition.\n\n## Getting the transition frame rectangles\n\n- **initialFrame(for:)**: Returns the starting frame rectangle for the specified view controller’s view.\n- **finalFrame(for:)**: Returns the ending frame rectangle for the specified view controller’s view.\n\n## Getting the transition behaviors\n\n- **isAnimated**: A Boolean value indicating whether the transition should be animated.\n- **isInteractive**: A Boolean value indicating whether the transition is currently interactive.\n- **presentationStyle**: Returns the presentation style for the view controller transition.\n\n## Reporting the transition progress\n\n- **completeTransition(_:)**: Notifies the system that the transition animation is done.\n- **updateInteractiveTransition(_:)**: Updates the completion percentage of the transition.\n- **pauseInteractiveTransition()**: Tells the system to pause the animations.\n- **finishInteractiveTransition()**: Notifies the system that user interactions signaled the completion of the transition.\n- **cancelInteractiveTransition()**: Notifies the system that user interactions canceled the transition.\n- **transitionWasCancelled**: Returns a Boolean value indicating whether the transition was canceled.\n\n## Getting the rotation factor\n\n- **targetTransform**: Returns a transform indicating the amount of rotation being applied during the transition.\n\n## Constants\n\n- **UITransitionContextViewControllerKey**: The keys you use to identify the view controllers involved in a transition.\n- **UITransitionContextViewKey**: The keys you use to identify the views involved in a transition.\n\n## Non-interactive transitions\n\n- **UIViewControllerAnimatedTransitioning**: A set of methods for implementing the animations for a custom view controller transition.\n\n## Inherits From\n\n- NSObjectProtocol\n\n",
  "sections" : [
    {
      "content" : "",
      "items" : [
        {
          "description" : "The view that acts as the superview for the views involved in the transition.",
          "name" : "containerView",
          "url" : "https:\/\/developer.apple.com\/documentation\/UIKit\/UIViewControllerContextTransitioning\/containerView"
        },
        {
          "description" : "Returns a view controller involved in the transition.",
          "name" : "viewController(forKey:)",
          "url" : "https:\/\/developer.apple.com\/documentation\/UIKit\/UIViewControllerContextTransitioning\/viewController(forKey:)"
        },
        {
          "description" : "Returns the specified view involved in the transition.",
          "name" : "view(forKey:)",
          "url" : "https:\/\/developer.apple.com\/documentation\/UIKit\/UIViewControllerContextTransitioning\/view(forKey:)"
        }
      ],
      "title" : "Accessing the transition objects"
    },
    {
      "content" : "",
      "items" : [
        {
          "description" : "Returns the starting frame rectangle for the specified view controller’s view.",
          "name" : "initialFrame(for:)",
          "url" : "https:\/\/developer.apple.com\/documentation\/UIKit\/UIViewControllerContextTransitioning\/initialFrame(for:)"
        },
        {
          "description" : "Returns the ending frame rectangle for the specified view controller’s view.",
          "name" : "finalFrame(for:)",
          "url" : "https:\/\/developer.apple.com\/documentation\/UIKit\/UIViewControllerContextTransitioning\/finalFrame(for:)"
        }
      ],
      "title" : "Getting the transition frame rectangles"
    },
    {
      "content" : "",
      "items" : [
        {
          "description" : "A Boolean value indicating whether the transition should be animated.",
          "name" : "isAnimated",
          "url" : "https:\/\/developer.apple.com\/documentation\/UIKit\/UIViewControllerContextTransitioning\/isAnimated"
        },
        {
          "description" : "A Boolean value indicating whether the transition is currently interactive.",
          "name" : "isInteractive",
          "url" : "https:\/\/developer.apple.com\/documentation\/UIKit\/UIViewControllerContextTransitioning\/isInteractive"
        },
        {
          "description" : "Returns the presentation style for the view controller transition.",
          "name" : "presentationStyle",
          "url" : "https:\/\/developer.apple.com\/documentation\/UIKit\/UIViewControllerContextTransitioning\/presentationStyle"
        }
      ],
      "title" : "Getting the transition behaviors"
    },
    {
      "content" : "",
      "items" : [
        {
          "description" : "Notifies the system that the transition animation is done.",
          "name" : "completeTransition(_:)",
          "url" : "https:\/\/developer.apple.com\/documentation\/UIKit\/UIViewControllerContextTransitioning\/completeTransition(_:)"
        },
        {
          "description" : "Updates the completion percentage of the transition.",
          "name" : "updateInteractiveTransition(_:)",
          "url" : "https:\/\/developer.apple.com\/documentation\/UIKit\/UIViewControllerContextTransitioning\/updateInteractiveTransition(_:)"
        },
        {
          "description" : "Tells the system to pause the animations.",
          "name" : "pauseInteractiveTransition()",
          "url" : "https:\/\/developer.apple.com\/documentation\/UIKit\/UIViewControllerContextTransitioning\/pauseInteractiveTransition()"
        },
        {
          "description" : "Notifies the system that user interactions signaled the completion of the transition.",
          "name" : "finishInteractiveTransition()",
          "url" : "https:\/\/developer.apple.com\/documentation\/UIKit\/UIViewControllerContextTransitioning\/finishInteractiveTransition()"
        },
        {
          "description" : "Notifies the system that user interactions canceled the transition.",
          "name" : "cancelInteractiveTransition()",
          "url" : "https:\/\/developer.apple.com\/documentation\/UIKit\/UIViewControllerContextTransitioning\/cancelInteractiveTransition()"
        },
        {
          "description" : "Returns a Boolean value indicating whether the transition was canceled.",
          "name" : "transitionWasCancelled",
          "url" : "https:\/\/developer.apple.com\/documentation\/UIKit\/UIViewControllerContextTransitioning\/transitionWasCancelled"
        }
      ],
      "title" : "Reporting the transition progress"
    },
    {
      "content" : "",
      "items" : [
        {
          "description" : "Returns a transform indicating the amount of rotation being applied during the transition.",
          "name" : "targetTransform",
          "url" : "https:\/\/developer.apple.com\/documentation\/UIKit\/UIViewControllerContextTransitioning\/targetTransform"
        }
      ],
      "title" : "Getting the rotation factor"
    },
    {
      "content" : "",
      "items" : [
        {
          "description" : "The keys you use to identify the view controllers involved in a transition.",
          "name" : "UITransitionContextViewControllerKey",
          "url" : "https:\/\/developer.apple.com\/documentation\/UIKit\/UITransitionContextViewControllerKey"
        },
        {
          "description" : "The keys you use to identify the views involved in a transition.",
          "name" : "UITransitionContextViewKey",
          "url" : "https:\/\/developer.apple.com\/documentation\/UIKit\/UITransitionContextViewKey"
        }
      ],
      "title" : "Constants"
    },
    {
      "content" : "",
      "items" : [
        {
          "description" : "A set of methods for implementing the animations for a custom view controller transition.",
          "name" : "UIViewControllerAnimatedTransitioning",
          "url" : "https:\/\/developer.apple.com\/documentation\/UIKit\/UIViewControllerAnimatedTransitioning"
        }
      ],
      "title" : "Non-interactive transitions"
    },
    {
      "content" : "",
      "items" : [
        {
          "name" : "NSObjectProtocol"
        }
      ],
      "title" : "Inherits From"
    }
  ],
  "source" : "appleJSON",
  "title" : "UIViewControllerContextTransitioning",
  "url" : "https:\/\/developer.apple.com\/documentation\/UIKit\/UIViewControllerContextTransitioning"
}