{
  "abstract" : "An object that prepares for and performs the visual transition between two view controllers.",
  "codeExamples" : [

  ],
  "conformsTo" : [
    "CVarArg",
    "CustomDebugStringConvertible",
    "CustomStringConvertible",
    "Equatable",
    "Hashable",
    "NSObjectProtocol",
    "Sendable"
  ],
  "contentHash" : "c9037941b1f307a0053217ac41ad9a200e0ce8a3881c6bdba9314865ec65c96f",
  "crawledAt" : "2025-12-01T10:35:48Z",
  "declaration" : {
    "code" : "@MainActor class UIStoryboardSegue",
    "language" : "swift"
  },
  "id" : "DA66B233-ACCF-4624-9337-4B2850B17F14",
  "inheritedBy" : [
    "UIStoryboardPopoverSegue"
  ],
  "kind" : "class",
  "module" : "UIKit",
  "overview" : "## Overview\n\nThe [doc:\/\/com.apple.uikit\/documentation\/UIKit\/UIStoryboardSegue] class supports the standard visual transitions available in UIKit. You can also subclass to define custom transitions between the view controllers in your storyboard file.\n\nSegue objects contain information about the view controllers involved in a transition. When a segue is triggered, but before the visual transition occurs, the storyboard runtime calls the current view controller’s [doc:\/\/com.apple.uikit\/documentation\/UIKit\/UIViewController\/prepare(for:sender:)] method so that it can pass any needed data to the view controller that’s about to be displayed.\n\nYou don’t create segue objects directly. Instead, the storyboard runtime creates them when it must perform a segue between two view controllers. You can still initiate a segue programmatically using the [doc:\/\/com.apple.uikit\/documentation\/UIKit\/UIViewController\/performSegue(withIdentifier:sender:)] method of [doc:\/\/com.apple.uikit\/documentation\/UIKit\/UIViewController] if you want. You might do so to initiate a segue from a source that was added programmatically and therefore not available in Interface Builder.\n\n### Subclassing notes\n\nYou can subclass [doc:\/\/com.apple.uikit\/documentation\/UIKit\/UIStoryboardSegue] in situations where you want to provide a custom transition between view controllers in your application. To use your custom segue, create a segue line between the appropriate view controllers in Interface Builder and set its type to Custom in the inspector; you must also specify the class name of the segue to use in the inspector.\n\nWhen the storyboard runtime detects a custom segue, it creates a new instance of your class, configures it with the view controller objects, asks the view controller source to prepare for the segue, and then performs the segue.\n\n#### Methods to override\n\nFor custom segues, the main method you need to override is the [doc:\/\/com.apple.uikit\/documentation\/UIKit\/UIStoryboardSegue\/perform()] method. The storyboard runtime calls this method when it’s time to perform the visual transition from the view controller in [doc:\/\/com.apple.uikit\/documentation\/UIKit\/UIStoryboardSegue\/source] to the view controller in [doc:\/\/com.apple.uikit\/documentation\/UIKit\/UIStoryboardSegue\/destination]. If you need to initialize any variables in your custom segue subclass, you can also override the [doc:\/\/com.apple.uikit\/documentation\/UIKit\/UIStoryboardSegue\/init(identifier:source:destination:)] method and initialize them in your custom implementation.\n\n#### Alternatives to subclassing\n\nIf your segue doesn’t need to store additional information or provide anything other than a [doc:\/\/com.apple.uikit\/documentation\/UIKit\/UIStoryboardSegue\/perform()] method, consider using the [doc:\/\/com.apple.uikit\/documentation\/UIKit\/UIStoryboardSegue\/init(identifier:source:destination:performHandler:)] method instead.",
  "platforms" : [
    "iOS",
    "iPadOS",
    "Mac Catalyst",
    "tvOS",
    "visionOS"
  ],
  "rawMarkdown" : "---\nsource: https:\/\/developer.apple.com\/documentation\/UIKit\/UIStoryboardSegue\ncrawled: 2025-12-01T10:35:48Z\n---\n\n# UIStoryboardSegue\n\n**Class**\n\nAn object that prepares for and performs the visual transition between two view controllers.\n\n## Declaration\n\n```swift\n@MainActor class UIStoryboardSegue\n```\n\n## Overview\n\nThe [doc:\/\/com.apple.uikit\/documentation\/UIKit\/UIStoryboardSegue] class supports the standard visual transitions available in UIKit. You can also subclass to define custom transitions between the view controllers in your storyboard file.\n\nSegue objects contain information about the view controllers involved in a transition. When a segue is triggered, but before the visual transition occurs, the storyboard runtime calls the current view controller’s [doc:\/\/com.apple.uikit\/documentation\/UIKit\/UIViewController\/prepare(for:sender:)] method so that it can pass any needed data to the view controller that’s about to be displayed.\n\nYou don’t create segue objects directly. Instead, the storyboard runtime creates them when it must perform a segue between two view controllers. You can still initiate a segue programmatically using the [doc:\/\/com.apple.uikit\/documentation\/UIKit\/UIViewController\/performSegue(withIdentifier:sender:)] method of [doc:\/\/com.apple.uikit\/documentation\/UIKit\/UIViewController] if you want. You might do so to initiate a segue from a source that was added programmatically and therefore not available in Interface Builder.\n\n### Subclassing notes\n\nYou can subclass [doc:\/\/com.apple.uikit\/documentation\/UIKit\/UIStoryboardSegue] in situations where you want to provide a custom transition between view controllers in your application. To use your custom segue, create a segue line between the appropriate view controllers in Interface Builder and set its type to Custom in the inspector; you must also specify the class name of the segue to use in the inspector.\n\nWhen the storyboard runtime detects a custom segue, it creates a new instance of your class, configures it with the view controller objects, asks the view controller source to prepare for the segue, and then performs the segue.\n\n#### Methods to override\n\nFor custom segues, the main method you need to override is the [doc:\/\/com.apple.uikit\/documentation\/UIKit\/UIStoryboardSegue\/perform()] method. The storyboard runtime calls this method when it’s time to perform the visual transition from the view controller in [doc:\/\/com.apple.uikit\/documentation\/UIKit\/UIStoryboardSegue\/source] to the view controller in [doc:\/\/com.apple.uikit\/documentation\/UIKit\/UIStoryboardSegue\/destination]. If you need to initialize any variables in your custom segue subclass, you can also override the [doc:\/\/com.apple.uikit\/documentation\/UIKit\/UIStoryboardSegue\/init(identifier:source:destination:)] method and initialize them in your custom implementation.\n\n#### Alternatives to subclassing\n\nIf your segue doesn’t need to store additional information or provide anything other than a [doc:\/\/com.apple.uikit\/documentation\/UIKit\/UIStoryboardSegue\/perform()] method, consider using the [doc:\/\/com.apple.uikit\/documentation\/UIKit\/UIStoryboardSegue\/init(identifier:source:destination:performHandler:)] method instead.\n\n## Initializing a storyboard segue\n\n- **init(identifier:source:destination:)**: Initializes and returns a storyboard segue object for use in performing a segue.\n\n## Accessing the segue attributes\n\n- **source**: The source view controller for the segue.\n- **destination**: The destination view controller for the segue.\n- **identifier**: The identifier for the segue object.\n\n## Performing the segue\n\n- **perform()**: Performs the visual transition for the segue.\n\n## Creating a custom segue\n\n- **init(identifier:source:destination:performHandler:)**: Creates a segue that calls a block to perform the segue transition.\n\n## Storyboards\n\n- **Customizing the behavior of segue-based presentations**: Pass data between view controllers during a segue, and programmatically control when segues occur.\n- **Dismissing a view controller with an unwind segue**: Configure an unwind segue in your storyboard file that dynamically chooses the most appropriate view controller to display next.\n- **UIStoryboard**: An encapsulation of the design-time view controller graph represented in an Interface Builder storyboard resource file.\n- **UIStoryboardUnwindSegueSource**: An encapsulation of information about an unwind segue.\n\n## Inherits From\n\n- NSObject\n\n## Inherited By\n\n- UIStoryboardPopoverSegue\n\n## Conforms To\n\n- CVarArg\n- CustomDebugStringConvertible\n- CustomStringConvertible\n- Equatable\n- Hashable\n- NSObjectProtocol\n- Sendable\n\n",
  "sections" : [
    {
      "content" : "",
      "items" : [
        {
          "description" : "Initializes and returns a storyboard segue object for use in performing a segue.",
          "name" : "init(identifier:source:destination:)",
          "url" : "https:\/\/developer.apple.com\/documentation\/UIKit\/UIStoryboardSegue\/init(identifier:source:destination:)"
        }
      ],
      "title" : "Initializing a storyboard segue"
    },
    {
      "content" : "",
      "items" : [
        {
          "description" : "The source view controller for the segue.",
          "name" : "source",
          "url" : "https:\/\/developer.apple.com\/documentation\/UIKit\/UIStoryboardSegue\/source"
        },
        {
          "description" : "The destination view controller for the segue.",
          "name" : "destination",
          "url" : "https:\/\/developer.apple.com\/documentation\/UIKit\/UIStoryboardSegue\/destination"
        },
        {
          "description" : "The identifier for the segue object.",
          "name" : "identifier",
          "url" : "https:\/\/developer.apple.com\/documentation\/UIKit\/UIStoryboardSegue\/identifier"
        }
      ],
      "title" : "Accessing the segue attributes"
    },
    {
      "content" : "",
      "items" : [
        {
          "description" : "Performs the visual transition for the segue.",
          "name" : "perform()",
          "url" : "https:\/\/developer.apple.com\/documentation\/UIKit\/UIStoryboardSegue\/perform()"
        }
      ],
      "title" : "Performing the segue"
    },
    {
      "content" : "",
      "items" : [
        {
          "description" : "Creates a segue that calls a block to perform the segue transition.",
          "name" : "init(identifier:source:destination:performHandler:)",
          "url" : "https:\/\/developer.apple.com\/documentation\/UIKit\/UIStoryboardSegue\/init(identifier:source:destination:performHandler:)"
        }
      ],
      "title" : "Creating a custom segue"
    },
    {
      "content" : "",
      "items" : [
        {
          "description" : "Pass data between view controllers during a segue, and programmatically control when segues occur.",
          "name" : "Customizing the behavior of segue-based presentations",
          "url" : "https:\/\/developer.apple.com\/documentation\/UIKit\/customizing-the-behavior-of-segue-based-presentations"
        },
        {
          "description" : "Configure an unwind segue in your storyboard file that dynamically chooses the most appropriate view controller to display next.",
          "name" : "Dismissing a view controller with an unwind segue",
          "url" : "https:\/\/developer.apple.com\/documentation\/UIKit\/dismissing-a-view-controller-with-an-unwind-segue"
        },
        {
          "description" : "An encapsulation of the design-time view controller graph represented in an Interface Builder storyboard resource file.",
          "name" : "UIStoryboard",
          "url" : "https:\/\/developer.apple.com\/documentation\/UIKit\/UIStoryboard"
        },
        {
          "description" : "An encapsulation of information about an unwind segue.",
          "name" : "UIStoryboardUnwindSegueSource",
          "url" : "https:\/\/developer.apple.com\/documentation\/UIKit\/UIStoryboardUnwindSegueSource"
        }
      ],
      "title" : "Storyboards"
    },
    {
      "content" : "",
      "items" : [
        {
          "name" : "NSObject"
        }
      ],
      "title" : "Inherits From"
    }
  ],
  "source" : "appleJSON",
  "title" : "UIStoryboardSegue",
  "url" : "https:\/\/developer.apple.com\/documentation\/UIKit\/UIStoryboardSegue"
}