{
  "abstract" : "A button that a person taps to place pasteboard contents in your app.",
  "codeExamples" : [
    {
      "code" : "let textView = UITextView(frame: view.bounds)\nview.addSubview(textView)\n\nlet configuration = UIPasteControl.Configuration()\nconfiguration.baseBackgroundColor = .red\nconfiguration.baseForegroundColor = .magenta\nconfiguration.cornerStyle = .capsule\nconfiguration.displayMode = .iconAndLabel\n                    \nlet pasteButton = UIPasteControl(configuration: configuration)\npasteButton.frame = CGRect(x: view.bounds.width\/2.0, y: view.bounds.height\/2.0, width: 150, height: 60)\ntextView.addSubview(pasteButton)\n\npasteButton.target = textView",
      "language" : "swift"
    }
  ],
  "conformsTo" : [
    "CALayerDelegate",
    "CVarArg",
    "CustomDebugStringConvertible",
    "CustomStringConvertible",
    "Equatable",
    "Hashable",
    "NSCoding",
    "NSObjectProtocol",
    "NSTouchBarProvider",
    "Sendable",
    "SendableMetatype",
    "UIAccessibilityIdentification",
    "UIActivityItemsConfigurationProviding",
    "UIAppearance",
    "UIAppearanceContainer",
    "UIContextMenuInteractionDelegate",
    "UICoordinateSpace",
    "UIDynamicItem",
    "UIFocusEnvironment",
    "UIFocusItem",
    "UIFocusItemContainer",
    "UILargeContentViewerItem",
    "UIPasteConfigurationSupporting",
    "UIPopoverPresentationControllerSourceItem",
    "UIResponderStandardEditActions",
    "UITraitChangeObservable",
    "UITraitEnvironment",
    "UIUserActivityRestoring"
  ],
  "contentHash" : "54e333ac2bc72131074d2e3d71ec0b38988efd1a008edfcf3d4d4879dd1e3bb3",
  "crawledAt" : "2025-12-05T19:41:02Z",
  "declaration" : {
    "code" : "@MainActor class UIPasteControl",
    "language" : "swift"
  },
  "id" : "C5DA2DC4-1301-4E0D-8127-96068FC9C0F7",
  "kind" : "class",
  "language" : "swift",
  "module" : "UIKit",
  "overview" : "## Overview\n\nYou can configure the button to appear as an icon, text, or both. The following button represents the icon and text option:\n\n\n\nIn iOS 16 and later, programmatic pasting raises a user alert that prompts the user for approval before the app gains access to pasteboard contents (`UIPasteboard.general.string`). Use this class to paste without a user prompt.\n\n### Add a paste button to a text view\n\nThe following code displays a paste button and assigns a text view as the recipient of pasteboard contents:",
  "platforms" : [
    "iOS",
    "iPadOS",
    "Mac Catalyst",
    "visionOS"
  ],
  "rawMarkdown" : "---\nsource: https:\/\/developer.apple.com\/documentation\/uikit\/uipastecontrol\ncrawled: 2025-12-05T19:41:02Z\n---\n\n# UIPasteControl\n\n**Class**\n\nA button that a person taps to place pasteboard contents in your app.\n\n## Declaration\n\n```swift\n@MainActor class UIPasteControl\n```\n\n## Overview\n\nYou can configure the button to appear as an icon, text, or both. The following button represents the icon and text option:\n\n\n\nIn iOS 16 and later, programmatic pasting raises a user alert that prompts the user for approval before the app gains access to pasteboard contents (`UIPasteboard.general.string`). Use this class to paste without a user prompt.\n\n### Add a paste button to a text view\n\nThe following code displays a paste button and assigns a text view as the recipient of pasteboard contents:\n\n```swift\nlet textView = UITextView(frame: view.bounds)\nview.addSubview(textView)\n\nlet configuration = UIPasteControl.Configuration()\nconfiguration.baseBackgroundColor = .red\nconfiguration.baseForegroundColor = .magenta\nconfiguration.cornerStyle = .capsule\nconfiguration.displayMode = .iconAndLabel\n                    \nlet pasteButton = UIPasteControl(configuration: configuration)\npasteButton.frame = CGRect(x: view.bounds.width\/2.0, y: view.bounds.height\/2.0, width: 150, height: 60)\ntextView.addSubview(pasteButton)\n\npasteButton.target = textView\n```\n\n## Creating a paste button\n\n- **init(coder:)**: Creates a paste button by deserializing the specified coder.\n- **init(configuration:)**: Creates a paste button that conforms to the specified configuration.\n- **init(frame:)**: Creates a paste button with the specified size and position.\n\n## Identifying the content recipient\n\n- **target**: The UI control that receives pasted content.\n\n## Determining the button’s look\n\n- **configuration**: An object that customizes the look of the paste button.\n- **UIPasteControl.Configuration**: An object that determines a paste button’s color, corner style, icon, and text.\n\n## Pasteboard\n\n- **UIPasteControl.Configuration**: An object that determines a paste button’s color, corner style, icon, and text.\n- **UIPasteControl.DisplayMode**: Options that determine whether a paste button composes an icon, textual label, or both.\n- **UIPasteboard**: An object that helps a user share data from one place to another within your app, and from your app to other apps.\n- **UIPasteConfiguration**: The interface that an object implements to declare its ability to accept specific data types for pasting and for drag-and-drop activities.\n- **UIPasteConfigurationSupporting**: The interface that determines whether a responder object supports paste configuration.\n\n## Inherits From\n\n- UIControl\n\n## Conforms To\n\n- CALayerDelegate\n- CVarArg\n- CustomDebugStringConvertible\n- CustomStringConvertible\n- Equatable\n- Hashable\n- NSCoding\n- NSObjectProtocol\n- NSTouchBarProvider\n- Sendable\n- SendableMetatype\n- UIAccessibilityIdentification\n- UIActivityItemsConfigurationProviding\n- UIAppearance\n- UIAppearanceContainer\n- UIContextMenuInteractionDelegate\n- UICoordinateSpace\n- UIDynamicItem\n- UIFocusEnvironment\n- UIFocusItem\n- UIFocusItemContainer\n- UILargeContentViewerItem\n- UIPasteConfigurationSupporting\n- UIPopoverPresentationControllerSourceItem\n- UIResponderStandardEditActions\n- UITraitChangeObservable\n- UITraitEnvironment\n- UIUserActivityRestoring\n\n",
  "sections" : [
    {
      "content" : "",
      "items" : [
        {
          "description" : "Creates a paste button by deserializing the specified coder.",
          "name" : "init(coder:)",
          "url" : "https:\/\/developer.apple.com\/documentation\/UIKit\/UIPasteControl\/init(coder:)"
        },
        {
          "description" : "Creates a paste button that conforms to the specified configuration.",
          "name" : "init(configuration:)",
          "url" : "https:\/\/developer.apple.com\/documentation\/UIKit\/UIPasteControl\/init(configuration:)"
        },
        {
          "description" : "Creates a paste button with the specified size and position.",
          "name" : "init(frame:)",
          "url" : "https:\/\/developer.apple.com\/documentation\/UIKit\/UIPasteControl\/init(frame:)"
        }
      ],
      "title" : "Creating a paste button"
    },
    {
      "content" : "",
      "items" : [
        {
          "description" : "The UI control that receives pasted content.",
          "name" : "target",
          "url" : "https:\/\/developer.apple.com\/documentation\/UIKit\/UIPasteControl\/target"
        }
      ],
      "title" : "Identifying the content recipient"
    },
    {
      "content" : "",
      "items" : [
        {
          "description" : "An object that customizes the look of the paste button.",
          "name" : "configuration",
          "url" : "https:\/\/developer.apple.com\/documentation\/UIKit\/UIPasteControl\/configuration-swift.property"
        },
        {
          "description" : "An object that determines a paste button’s color, corner style, icon, and text.",
          "name" : "UIPasteControl.Configuration",
          "url" : "https:\/\/developer.apple.com\/documentation\/UIKit\/UIPasteControl\/Configuration-swift.class"
        }
      ],
      "title" : "Determining the button’s look"
    },
    {
      "content" : "",
      "items" : [
        {
          "description" : "An object that determines a paste button’s color, corner style, icon, and text.",
          "name" : "UIPasteControl.Configuration",
          "url" : "https:\/\/developer.apple.com\/documentation\/UIKit\/UIPasteControl\/Configuration-swift.class"
        },
        {
          "description" : "Options that determine whether a paste button composes an icon, textual label, or both.",
          "name" : "UIPasteControl.DisplayMode",
          "url" : "https:\/\/developer.apple.com\/documentation\/UIKit\/UIPasteControl\/DisplayMode"
        },
        {
          "description" : "An object that helps a user share data from one place to another within your app, and from your app to other apps.",
          "name" : "UIPasteboard",
          "url" : "https:\/\/developer.apple.com\/documentation\/UIKit\/UIPasteboard"
        },
        {
          "description" : "The interface that an object implements to declare its ability to accept specific data types for pasting and for drag-and-drop activities.",
          "name" : "UIPasteConfiguration",
          "url" : "https:\/\/developer.apple.com\/documentation\/UIKit\/UIPasteConfiguration"
        },
        {
          "description" : "The interface that determines whether a responder object supports paste configuration.",
          "name" : "UIPasteConfigurationSupporting",
          "url" : "https:\/\/developer.apple.com\/documentation\/UIKit\/UIPasteConfigurationSupporting"
        }
      ],
      "title" : "Pasteboard"
    },
    {
      "content" : "",
      "items" : [
        {
          "name" : "UIControl"
        }
      ],
      "title" : "Inherits From"
    }
  ],
  "source" : "appleJSON",
  "title" : "UIPasteControl",
  "url" : "https:\/\/developer.apple.com\/documentation\/uikit\/uipastecontrol"
}