{
  "abstract" : "Constants that specify the orientation of the app’s user interface.",
  "codeExamples" : [

  ],
  "conformsTo" : [
    "BitwiseCopyable",
    "Equatable",
    "Hashable",
    "RawRepresentable",
    "Sendable",
    "SendableMetatype"
  ],
  "contentHash" : "add1fcebc56247cd85a567c54b21b026099e58bb6a32e9e85cbd7a0b0aadef64",
  "crawledAt" : "2025-12-04T10:36:06Z",
  "declaration" : {
    "code" : "enum UIInterfaceOrientation",
    "language" : "swift"
  },
  "id" : "3500C93E-544F-47B5-A772-41F6A03EE4A9",
  "kind" : "enum",
  "language" : "swift",
  "module" : "UIKit",
  "overview" : "## Overview\n\nStarting in iOS 8, you should employ the [doc:\/\/com.apple.uikit\/documentation\/UIKit\/UITraitCollection] and [doc:\/\/com.apple.uikit\/documentation\/UIKit\/UITraitEnvironment] APIs, and size class properties as used in those APIs, instead of using [doc:\/\/com.apple.uikit\/documentation\/UIKit\/UIInterfaceOrientation] constants or otherwise writing your app in terms of interface orientation.\n\nIn earlier versions of iOS, you used these constants in the [doc:\/\/com.apple.uikit\/documentation\/UIKit\/UIApplication\/statusBarOrientation] property and the [doc:\/\/com.apple.uikit\/documentation\/UIKit\/UIApplication\/setStatusBarOrientation(_:animated:)] method.",
  "platforms" : [
    "iOS",
    "iPadOS",
    "Mac Catalyst",
    "visionOS"
  ],
  "rawMarkdown" : "---\nsource: https:\/\/developer.apple.com\/documentation\/uikit\/uiinterfaceorientation\ncrawled: 2025-12-04T10:36:06Z\n---\n\n# UIInterfaceOrientation\n\n**Enumeration**\n\nConstants that specify the orientation of the app’s user interface.\n\n## Declaration\n\n```swift\nenum UIInterfaceOrientation\n```\n\n## Overview\n\nStarting in iOS 8, you should employ the [doc:\/\/com.apple.uikit\/documentation\/UIKit\/UITraitCollection] and [doc:\/\/com.apple.uikit\/documentation\/UIKit\/UITraitEnvironment] APIs, and size class properties as used in those APIs, instead of using [doc:\/\/com.apple.uikit\/documentation\/UIKit\/UIInterfaceOrientation] constants or otherwise writing your app in terms of interface orientation.\n\nIn earlier versions of iOS, you used these constants in the [doc:\/\/com.apple.uikit\/documentation\/UIKit\/UIApplication\/statusBarOrientation] property and the [doc:\/\/com.apple.uikit\/documentation\/UIKit\/UIApplication\/setStatusBarOrientation(_:animated:)] method.\n\n\n\n## Orientations\n\n- **UIInterfaceOrientation.unknown**: The orientation of the device is unknown.\n- **UIInterfaceOrientation.portrait**: The device is in portrait mode, with the device upright and the Home button on the bottom.\n- **UIInterfaceOrientation.portraitUpsideDown**: The device is in portrait mode but is upside down, with the device upright and the Home button at the top.\n- **UIInterfaceOrientation.landscapeLeft**: The device is in landscape mode, with the device upright and the Home button on the left.\n- **UIInterfaceOrientation.landscapeRight**: The device is in landscape mode, with the device upright and the Home button on the right.\n\n## Orientation Checks\n\n- **isLandscape**: A Boolean value that indicates whether the user interface is currently presented in a landscape orientation.\n- **isPortrait**: A Boolean value that indicates whether the user interface is currently presented in a portrait orientation.\n\n## Initializers\n\n- **init(rawValue:)**\n\n## Managing interface geometry\n\n- **application(_:supportedInterfaceOrientationsFor:)**: Asks the delegate for the interface orientations to use for the view controllers in the specified window.\n- **UIInterfaceOrientationMask**: Constants that specify a view controller’s supported interface orientations.\n- **invalidInterfaceOrientationException**: An exception that’s thrown if a view controller or the app returns an invalid set of supported interface orientations.\n\n## Conforms To\n\n- BitwiseCopyable\n- Equatable\n- Hashable\n- RawRepresentable\n- Sendable\n- SendableMetatype\n\n",
  "sections" : [
    {
      "content" : "",
      "items" : [
        {
          "description" : "The orientation of the device is unknown.",
          "name" : "UIInterfaceOrientation.unknown",
          "url" : "https:\/\/developer.apple.com\/documentation\/UIKit\/UIInterfaceOrientation\/unknown"
        },
        {
          "description" : "The device is in portrait mode, with the device upright and the Home button on the bottom.",
          "name" : "UIInterfaceOrientation.portrait",
          "url" : "https:\/\/developer.apple.com\/documentation\/UIKit\/UIInterfaceOrientation\/portrait"
        },
        {
          "description" : "The device is in portrait mode but is upside down, with the device upright and the Home button at the top.",
          "name" : "UIInterfaceOrientation.portraitUpsideDown",
          "url" : "https:\/\/developer.apple.com\/documentation\/UIKit\/UIInterfaceOrientation\/portraitUpsideDown"
        },
        {
          "description" : "The device is in landscape mode, with the device upright and the Home button on the left.",
          "name" : "UIInterfaceOrientation.landscapeLeft",
          "url" : "https:\/\/developer.apple.com\/documentation\/UIKit\/UIInterfaceOrientation\/landscapeLeft"
        },
        {
          "description" : "The device is in landscape mode, with the device upright and the Home button on the right.",
          "name" : "UIInterfaceOrientation.landscapeRight",
          "url" : "https:\/\/developer.apple.com\/documentation\/UIKit\/UIInterfaceOrientation\/landscapeRight"
        }
      ],
      "title" : "Orientations"
    },
    {
      "content" : "",
      "items" : [
        {
          "description" : "A Boolean value that indicates whether the user interface is currently presented in a landscape orientation.",
          "name" : "isLandscape",
          "url" : "https:\/\/developer.apple.com\/documentation\/UIKit\/UIInterfaceOrientation\/isLandscape"
        },
        {
          "description" : "A Boolean value that indicates whether the user interface is currently presented in a portrait orientation.",
          "name" : "isPortrait",
          "url" : "https:\/\/developer.apple.com\/documentation\/UIKit\/UIInterfaceOrientation\/isPortrait"
        }
      ],
      "title" : "Orientation Checks"
    },
    {
      "content" : "",
      "items" : [
        {
          "description" : "",
          "name" : "init(rawValue:)",
          "url" : "https:\/\/developer.apple.com\/documentation\/UIKit\/UIInterfaceOrientation\/init(rawValue:)"
        }
      ],
      "title" : "Initializers"
    },
    {
      "content" : "",
      "items" : [
        {
          "description" : "Asks the delegate for the interface orientations to use for the view controllers in the specified window.",
          "name" : "application(_:supportedInterfaceOrientationsFor:)",
          "url" : "https:\/\/developer.apple.com\/documentation\/UIKit\/UIApplicationDelegate\/application(_:supportedInterfaceOrientationsFor:)"
        },
        {
          "description" : "Constants that specify a view controller’s supported interface orientations.",
          "name" : "UIInterfaceOrientationMask",
          "url" : "https:\/\/developer.apple.com\/documentation\/UIKit\/UIInterfaceOrientationMask"
        },
        {
          "description" : "An exception that’s thrown if a view controller or the app returns an invalid set of supported interface orientations.",
          "name" : "invalidInterfaceOrientationException",
          "url" : "https:\/\/developer.apple.com\/documentation\/UIKit\/UIApplication\/invalidInterfaceOrientationException"
        }
      ],
      "title" : "Managing interface geometry"
    }
  ],
  "source" : "appleJSON",
  "title" : "UIInterfaceOrientation",
  "url" : "https:\/\/developer.apple.com\/documentation\/uikit\/uiinterfaceorientation"
}