{
  "abstract" : "The estimated size of cells in the collection view.",
  "codeExamples" : [

  ],
  "contentHash" : "96f66a9646274e14939fdd6bc2bba90e612c6ef726b0a08ef50a27bfffaf3c49",
  "crawledAt" : "2025-12-01T01:08:04Z",
  "declaration" : {
    "code" : "@MainActor var estimatedItemSize: CGSize { get set }",
    "language" : "swift"
  },
  "id" : "CB84D625-6D5B-4FC7-B064-5B631870E9E4",
  "kind" : "property",
  "module" : "UIKit",
  "overview" : "## Discussion\n\nProviding an estimated cell size can improve the performance of the collection view when the cells adjust their size dynamically. The estimated value lets the collection view defer some calculations to determine the actual size of its content. Cells that aren’t onscreen are assumed to be the estimated height.\n\nThe default value of this property is [doc:\/\/com.apple.documentation\/documentation\/CoreGraphics\/CGSizeZero]. Setting it to any other value, like [doc:\/\/com.apple.uikit\/documentation\/UIKit\/UICollectionViewFlowLayout\/automaticSize], causes the collection view to query each cell for its actual size using the cell’s [doc:\/\/com.apple.uikit\/documentation\/UIKit\/UICollectionReusableView\/preferredLayoutAttributesFitting(_:)] method.\n\nIf all of your cells are the same size, use the [doc:\/\/com.apple.uikit\/documentation\/UIKit\/UICollectionViewFlowLayout\/itemSize] property, instead of this property, to specify the cell size instead.",
  "platforms" : [
    "iOS",
    "iPadOS",
    "Mac Catalyst",
    "tvOS",
    "visionOS"
  ],
  "rawMarkdown" : "---\nsource: https:\/\/developer.apple.com\/documentation\/UIKit\/UICollectionViewFlowLayout\/estimatedItemSize\ncrawled: 2025-12-01T01:08:04Z\n---\n\n# estimatedItemSize\n\n**Instance Property**\n\nThe estimated size of cells in the collection view.\n\n## Declaration\n\n```swift\n@MainActor var estimatedItemSize: CGSize { get set }\n```\n\n## Discussion\n\nProviding an estimated cell size can improve the performance of the collection view when the cells adjust their size dynamically. The estimated value lets the collection view defer some calculations to determine the actual size of its content. Cells that aren’t onscreen are assumed to be the estimated height.\n\nThe default value of this property is [doc:\/\/com.apple.documentation\/documentation\/CoreGraphics\/CGSizeZero]. Setting it to any other value, like [doc:\/\/com.apple.uikit\/documentation\/UIKit\/UICollectionViewFlowLayout\/automaticSize], causes the collection view to query each cell for its actual size using the cell’s [doc:\/\/com.apple.uikit\/documentation\/UIKit\/UICollectionReusableView\/preferredLayoutAttributesFitting(_:)] method.\n\nIf all of your cells are the same size, use the [doc:\/\/com.apple.uikit\/documentation\/UIKit\/UICollectionViewFlowLayout\/itemSize] property, instead of this property, to specify the cell size instead.\n\n## Configuring item spacing\n\n- **minimumLineSpacing**: The minimum spacing to use between lines of items in the grid.\n- **minimumInteritemSpacing**: The minimum spacing to use between items in the same row.\n- **itemSize**: The default size to use for cells.\n- **automaticSize**: A placeholder size for self-sizing cells.\n- **sectionInset**: The margins used to lay out content in a section.\n- **sectionInsetReference**: The boundary that section insets are defined in relation to.\n- **UICollectionViewFlowLayout.SectionInsetReference**: Constants that describe the reference point of the section insets.\n\n",
  "sections" : [
    {
      "content" : "",
      "items" : [
        {
          "description" : "The minimum spacing to use between lines of items in the grid.",
          "name" : "minimumLineSpacing",
          "url" : "https:\/\/developer.apple.com\/documentation\/UIKit\/UICollectionViewFlowLayout\/minimumLineSpacing"
        },
        {
          "description" : "The minimum spacing to use between items in the same row.",
          "name" : "minimumInteritemSpacing",
          "url" : "https:\/\/developer.apple.com\/documentation\/UIKit\/UICollectionViewFlowLayout\/minimumInteritemSpacing"
        },
        {
          "description" : "The default size to use for cells.",
          "name" : "itemSize",
          "url" : "https:\/\/developer.apple.com\/documentation\/UIKit\/UICollectionViewFlowLayout\/itemSize"
        },
        {
          "description" : "A placeholder size for self-sizing cells.",
          "name" : "automaticSize",
          "url" : "https:\/\/developer.apple.com\/documentation\/UIKit\/UICollectionViewFlowLayout\/automaticSize"
        },
        {
          "description" : "The margins used to lay out content in a section.",
          "name" : "sectionInset",
          "url" : "https:\/\/developer.apple.com\/documentation\/UIKit\/UICollectionViewFlowLayout\/sectionInset"
        },
        {
          "description" : "The boundary that section insets are defined in relation to.",
          "name" : "sectionInsetReference",
          "url" : "https:\/\/developer.apple.com\/documentation\/UIKit\/UICollectionViewFlowLayout\/sectionInsetReference-swift.property"
        },
        {
          "description" : "Constants that describe the reference point of the section insets.",
          "name" : "UICollectionViewFlowLayout.SectionInsetReference",
          "url" : "https:\/\/developer.apple.com\/documentation\/UIKit\/UICollectionViewFlowLayout\/SectionInsetReference-swift.enum"
        }
      ],
      "title" : "Configuring item spacing"
    }
  ],
  "source" : "appleJSON",
  "title" : "estimatedItemSize",
  "url" : "https:\/\/developer.apple.com\/documentation\/UIKit\/UICollectionViewFlowLayout\/estimatedItemSize"
}