{
  "abstract" : "The line height multiple.",
  "codeExamples" : [

  ],
  "contentHash" : "e512890d03f9aa3a7ecda323cfc93a302c86c81c63fe7de46402be652f43d34c",
  "crawledAt" : "2025-12-02T07:10:48Z",
  "declaration" : {
    "code" : "var lineHeightMultiple: CGFloat { get }",
    "language" : "swift"
  },
  "id" : "51A068F7-754B-46BC-B471-A8D3DE9A4A81",
  "kind" : "property",
  "module" : "UIKit",
  "overview" : "## Discussion\n\nThe framework multiplies the natural line height of the receiver by this factor (if positive), and constrains the resulting value by the minimum and maximum line height. The default value of this property is `0.0`.",
  "platforms" : [
    "iOS",
    "iPadOS",
    "Mac Catalyst",
    "tvOS",
    "visionOS",
    "watchOS"
  ],
  "rawMarkdown" : "---\nsource: https:\/\/developer.apple.com\/documentation\/UIKit\/NSParagraphStyle\/lineHeightMultiple\ncrawled: 2025-12-02T07:10:48Z\n---\n\n# lineHeightMultiple\n\n**Instance Property**\n\nThe line height multiple.\n\n## Declaration\n\n```swift\nvar lineHeightMultiple: CGFloat { get }\n```\n\n## Discussion\n\nThe framework multiplies the natural line height of the receiver by this factor (if positive), and constrains the resulting value by the minimum and maximum line height. The default value of this property is `0.0`.\n\n## Accessing style information\n\n- **alignment**: The text alignment of the paragraph.\n- **NSTextAlignment**: Constants that specify text alignment.\n- **firstLineHeadIndent**: The indentation of the first line of the paragraph.\n- **headIndent**: The indentation of the paragraph’s lines other than the first.\n- **tailIndent**: The trailing indentation of the paragraph.\n- **maximumLineHeight**: The paragraph’s maximum line height.\n- **minimumLineHeight**: The paragraph’s minimum line height.\n- **lineSpacing**: The distance in points between the bottom of one line fragment and the top of the next.\n- **paragraphSpacing**: Distance between the bottom of this paragraph and top of next.\n- **paragraphSpacingBefore**: The distance between the paragraph’s top and the beginning of its text content.\n\n",
  "sections" : [
    {
      "content" : "",
      "items" : [
        {
          "description" : "The text alignment of the paragraph.",
          "name" : "alignment",
          "url" : "https:\/\/developer.apple.com\/documentation\/UIKit\/NSParagraphStyle\/alignment"
        },
        {
          "description" : "Constants that specify text alignment.",
          "name" : "NSTextAlignment",
          "url" : "https:\/\/developer.apple.com\/documentation\/UIKit\/NSTextAlignment"
        },
        {
          "description" : "The indentation of the first line of the paragraph.",
          "name" : "firstLineHeadIndent",
          "url" : "https:\/\/developer.apple.com\/documentation\/UIKit\/NSParagraphStyle\/firstLineHeadIndent"
        },
        {
          "description" : "The indentation of the paragraph’s lines other than the first.",
          "name" : "headIndent",
          "url" : "https:\/\/developer.apple.com\/documentation\/UIKit\/NSParagraphStyle\/headIndent"
        },
        {
          "description" : "The trailing indentation of the paragraph.",
          "name" : "tailIndent",
          "url" : "https:\/\/developer.apple.com\/documentation\/UIKit\/NSParagraphStyle\/tailIndent"
        },
        {
          "description" : "The paragraph’s maximum line height.",
          "name" : "maximumLineHeight",
          "url" : "https:\/\/developer.apple.com\/documentation\/UIKit\/NSParagraphStyle\/maximumLineHeight"
        },
        {
          "description" : "The paragraph’s minimum line height.",
          "name" : "minimumLineHeight",
          "url" : "https:\/\/developer.apple.com\/documentation\/UIKit\/NSParagraphStyle\/minimumLineHeight"
        },
        {
          "description" : "The distance in points between the bottom of one line fragment and the top of the next.",
          "name" : "lineSpacing",
          "url" : "https:\/\/developer.apple.com\/documentation\/UIKit\/NSParagraphStyle\/lineSpacing"
        },
        {
          "description" : "Distance between the bottom of this paragraph and top of next.",
          "name" : "paragraphSpacing",
          "url" : "https:\/\/developer.apple.com\/documentation\/UIKit\/NSParagraphStyle\/paragraphSpacing"
        },
        {
          "description" : "The distance between the paragraph’s top and the beginning of its text content.",
          "name" : "paragraphSpacingBefore",
          "url" : "https:\/\/developer.apple.com\/documentation\/UIKit\/NSParagraphStyle\/paragraphSpacingBefore"
        }
      ],
      "title" : "Accessing style information"
    }
  ],
  "source" : "appleJSON",
  "title" : "lineHeightMultiple",
  "url" : "https:\/\/developer.apple.com\/documentation\/UIKit\/NSParagraphStyle\/lineHeightMultiple"
}