{
  "abstract" : "Creates the default configuration you use to style a cell in an accompanied sidebar list.",
  "codeExamples" : [

  ],
  "contentHash" : "f1e27bfb1f040a3c7496db7a7cdf892d30f1c6c42d0cb5292226bee2e23fb01a",
  "crawledAt" : "2025-12-05T19:49:55Z",
  "declaration" : {
    "code" : "static func listAccompaniedSidebarCell() -> UIBackgroundConfiguration",
    "language" : "swift"
  },
  "id" : "D2211DE6-00DA-4CF7-8B9A-4ABEDCC43361",
  "kind" : "method",
  "language" : "swift",
  "module" : "UIKit",
  "overview" : "## Return Value\n\nThe default configuration for a cell in an accompanied sidebar list.\n\n## Discussion\n\nCreate this configuration to update the styling for the background of a cell in a list. When you apply this configuration to a cell, the background of the cell matches the system default styling for a cell in an accompanied sidebar collection view list, including styling for highlighted and selected states. An accompanied sidebar collection view list is a list that’s in the primary column of a split view controller, accompanied by another list in the split view controller’s supplementary column.\n\nFor an appearance consistent with system defaults, use this background configuration for a cell in an accompanied sidebar collection view list that you configure with the [doc:\/\/com.apple.uikit\/documentation\/UIKit\/UICollectionLayoutListConfiguration-swift.struct\/Appearance-swift.enum\/sidebar] or [doc:\/\/com.apple.uikit\/documentation\/UIKit\/UICollectionLayoutListConfiguration-swift.struct\/Appearance-swift.enum\/sidebarPlain] enumeration case.",
  "platforms" : [
    "iOS",
    "iPadOS",
    "Mac Catalyst",
    "visionOS"
  ],
  "rawMarkdown" : "---\nsource: https:\/\/developer.apple.com\/documentation\/UIKit\/UIBackgroundConfiguration-swift.struct\/listAccompaniedSidebarCell()\ncrawled: 2025-12-05T19:49:55Z\n---\n\n# listAccompaniedSidebarCell()\n\n**Type Method**\n\nCreates the default configuration you use to style a cell in an accompanied sidebar list.\n\n## Declaration\n\n```swift\nstatic func listAccompaniedSidebarCell() -> UIBackgroundConfiguration\n```\n\n## Return Value\n\nThe default configuration for a cell in an accompanied sidebar list.\n\n## Discussion\n\nCreate this configuration to update the styling for the background of a cell in a list. When you apply this configuration to a cell, the background of the cell matches the system default styling for a cell in an accompanied sidebar collection view list, including styling for highlighted and selected states. An accompanied sidebar collection view list is a list that’s in the primary column of a split view controller, accompanied by another list in the split view controller’s supplementary column.\n\nFor an appearance consistent with system defaults, use this background configuration for a cell in an accompanied sidebar collection view list that you configure with the [doc:\/\/com.apple.uikit\/documentation\/UIKit\/UICollectionLayoutListConfiguration-swift.struct\/Appearance-swift.enum\/sidebar] or [doc:\/\/com.apple.uikit\/documentation\/UIKit\/UICollectionLayoutListConfiguration-swift.struct\/Appearance-swift.enum\/sidebarPlain] enumeration case.\n\n## Creating cell background configurations\n\n- **listPlainCell()**: Creates the default configuration you use to style a cell in a plain list.\n- **listGroupedCell()**: Creates the default configuration you use to style a cell in a grouped list.\n- **listSidebarCell()**: Creates the default configuration you use to style a cell in a sidebar list.\n\n",
  "sections" : [
    {
      "content" : "",
      "items" : [
        {
          "description" : "Creates the default configuration you use to style a cell in a plain list.",
          "name" : "listPlainCell()",
          "url" : "https:\/\/developer.apple.com\/documentation\/UIKit\/UIBackgroundConfiguration-swift.struct\/listPlainCell()"
        },
        {
          "description" : "Creates the default configuration you use to style a cell in a grouped list.",
          "name" : "listGroupedCell()",
          "url" : "https:\/\/developer.apple.com\/documentation\/UIKit\/UIBackgroundConfiguration-swift.struct\/listGroupedCell()"
        },
        {
          "description" : "Creates the default configuration you use to style a cell in a sidebar list.",
          "name" : "listSidebarCell()",
          "url" : "https:\/\/developer.apple.com\/documentation\/UIKit\/UIBackgroundConfiguration-swift.struct\/listSidebarCell()"
        }
      ],
      "title" : "Creating cell background configurations"
    }
  ],
  "source" : "appleJSON",
  "title" : "listAccompaniedSidebarCell()",
  "url" : "https:\/\/developer.apple.com\/documentation\/UIKit\/UIBackgroundConfiguration-swift.struct\/listAccompaniedSidebarCell()"
}