{
  "abstract" : "Presents the picker in a popover that anchors to the specified bar button item.",
  "codeExamples" : [

  ],
  "contentHash" : "77c404a87be0fa7095f3ef2259735cc8c6e0f4035636cc4dae6fdd3cbde61afe",
  "crawledAt" : "2025-12-04T10:17:23Z",
  "declaration" : {
    "code" : "@MainActor func present(from item: UIBarButtonItem, animated: Bool, completionHandler completion: UIPrinterPickerController.CompletionHandler? = nil) -> Bool",
    "language" : "swift"
  },
  "id" : "38FA621E-9CDE-4FDD-90B5-707A3AD4656B",
  "kind" : "method",
  "language" : "swift",
  "module" : "UIKit",
  "overview" : "## Return Value\n\n[doc:\/\/com.apple.documentation\/documentation\/Swift\/true] if the picker was displayed or [doc:\/\/com.apple.documentation\/documentation\/Swift\/false] if the picker was already visible.\n\n## Discussion\n\nThis method presents the picker from a popover or from the view controller you specify using your delegate object. If you provide a delegate object and that object implements the [doc:\/\/com.apple.uikit\/documentation\/UIKit\/UIPrinterPickerControllerDelegate\/printerPickerControllerParentViewController(_:)] method, UIKit presents the picker using the view controller you specify. If you do not provide a delegate, or your delegate object does not implement the [doc:\/\/com.apple.uikit\/documentation\/UIKit\/UIPrinterPickerControllerDelegate\/printerPickerControllerParentViewController(_:)] method, UIKit presents the picker using a popover attached the bar button you specified in the `item` parameter.\n\nAfter presenting the picker, the picker interface runs until the user or your app dismisses it. The picker interface provides ways for the user to cancel printing directly, all of which dismiss the picker. You can also dismiss the printer picker programmatically by calling the [doc:\/\/com.apple.uikit\/documentation\/UIKit\/UIPrinterPickerController\/dismiss(animated:)] method.\n\nCalling this method while the picker is currently displayed in a popover dismisses the popover.",
  "platforms" : [
    "iOS",
    "iPadOS",
    "Mac Catalyst",
    "visionOS"
  ],
  "rawMarkdown" : "---\nsource: https:\/\/developer.apple.com\/documentation\/UIKit\/UIPrinterPickerController\/present(from:animated:completionHandler:)\ncrawled: 2025-12-04T10:17:23Z\n---\n\n# present(from:animated:completionHandler:)\n\n**Instance Method**\n\nPresents the picker in a popover that anchors to the specified bar button item.\n\n## Declaration\n\n```swift\n@MainActor func present(from item: UIBarButtonItem, animated: Bool, completionHandler completion: UIPrinterPickerController.CompletionHandler? = nil) -> Bool\n```\n\n## Parameters\n\n- **item**: The bar button item to use as the anchor for the popover.\n- **animated**: [doc:\/\/com.apple.documentation\/documentation\/Swift\/true] to animate the display of the picker or [doc:\/\/com.apple.documentation\/documentation\/Swift\/false] to display it without animations.\n- **completion**: A block to execute when the picker is dismissed. Use this block to receive information about the selected printer or information about any errors that occurred.\n\n## Return Value\n\n[doc:\/\/com.apple.documentation\/documentation\/Swift\/true] if the picker was displayed or [doc:\/\/com.apple.documentation\/documentation\/Swift\/false] if the picker was already visible.\n\n## Discussion\n\nThis method presents the picker from a popover or from the view controller you specify using your delegate object. If you provide a delegate object and that object implements the [doc:\/\/com.apple.uikit\/documentation\/UIKit\/UIPrinterPickerControllerDelegate\/printerPickerControllerParentViewController(_:)] method, UIKit presents the picker using the view controller you specify. If you do not provide a delegate, or your delegate object does not implement the [doc:\/\/com.apple.uikit\/documentation\/UIKit\/UIPrinterPickerControllerDelegate\/printerPickerControllerParentViewController(_:)] method, UIKit presents the picker using a popover attached the bar button you specified in the `item` parameter.\n\nAfter presenting the picker, the picker interface runs until the user or your app dismisses it. The picker interface provides ways for the user to cancel printing directly, all of which dismiss the picker. You can also dismiss the printer picker programmatically by calling the [doc:\/\/com.apple.uikit\/documentation\/UIKit\/UIPrinterPickerController\/dismiss(animated:)] method.\n\nCalling this method while the picker is currently displayed in a popover dismisses the popover.\n\n## Presenting and dismissing the picker\n\n- **present(animated:completionHandler:)**: Presents the picker from a view controller of your app.\n- **present(from:in:animated:completionHandler:)**: Presents the picker in a popover that anchors to a rectangle in the specified view.\n- **dismiss(animated:)**: Dismisses the picker.\n\n",
  "sections" : [
    {
      "content" : "",
      "items" : [
        {
          "description" : "Presents the picker from a view controller of your app.",
          "name" : "present(animated:completionHandler:)",
          "url" : "https:\/\/developer.apple.com\/documentation\/UIKit\/UIPrinterPickerController\/present(animated:completionHandler:)"
        },
        {
          "description" : "Presents the picker in a popover that anchors to a rectangle in the specified view.",
          "name" : "present(from:in:animated:completionHandler:)",
          "url" : "https:\/\/developer.apple.com\/documentation\/UIKit\/UIPrinterPickerController\/present(from:in:animated:completionHandler:)"
        },
        {
          "description" : "Dismisses the picker.",
          "name" : "dismiss(animated:)",
          "url" : "https:\/\/developer.apple.com\/documentation\/UIKit\/UIPrinterPickerController\/dismiss(animated:)"
        }
      ],
      "title" : "Presenting and dismissing the picker"
    }
  ],
  "source" : "appleJSON",
  "title" : "present(from:animated:completionHandler:)",
  "url" : "https:\/\/developer.apple.com\/documentation\/UIKit\/UIPrinterPickerController\/present(from:animated:completionHandler:)"
}