{
  "abstract" : "An object that applies a gravity-like force to all of its associated dynamic items.",
  "codeExamples" : [

  ],
  "conformsTo" : [
    "CVarArg",
    "CustomDebugStringConvertible",
    "CustomStringConvertible",
    "Equatable",
    "Hashable",
    "NSObjectProtocol",
    "Sendable",
    "SendableMetatype"
  ],
  "contentHash" : "8fd57aefee36dba593e0ceb31bee2c9687fd934bdb3388ce07457ef4ce269533",
  "crawledAt" : "2025-12-04T10:19:35Z",
  "declaration" : {
    "code" : "@MainActor class UIGravityBehavior",
    "language" : "swift"
  },
  "id" : "460C72D4-3EAD-4750-B7F7-84A7642ADCB5",
  "kind" : "class",
  "language" : "swift",
  "module" : "UIKit",
  "overview" : "## Overview\n\nThe magnitude and direction of the gravity force are configurable and are applied equally to all associated items. Use this behavior to modify the position of views and other dynamic items in your app’s interface.\n\nYou specify the magnitude and direction of the gravity force as a two-dimensional vector in the reference view’s coordinate system. A value of `1.0` imparts the standard UIKit gravity, which corresponds to an acceleration of 1000 points \/ second² in the direction of the given axis. The default vector in the [doc:\/\/com.apple.uikit\/documentation\/UIKit\/UIGravityBehavior\/gravityDirection] property is (`0.0`, `1.0`), which causes items to accelerate downward along the positive y axis. If you prefer to set the vector [doc:\/\/com.apple.uikit\/documentation\/UIKit\/UIGravityBehavior\/angle] and [doc:\/\/com.apple.uikit\/documentation\/UIKit\/UIGravityBehavior\/magnitude] separately, you can do so using the corresponding properties.\n\nIf you want to influence a gravity behavior at each step of a dynamic animation, assign an appropriate block to the inherited [doc:\/\/com.apple.uikit\/documentation\/UIKit\/UIDynamicBehavior\/action] property. Use your block to make any needed changes to the dynamic items associated with the gravity behavior.\n\n### Applying a Gravity Behavior to an Item\n\nTo apply a gravity behavior to one or more dynamic items, do the following:\n\nThe gravity behavior derives its coordinate system from the reference view of its associated dynamic animator object. For more information about the dynamic animator and the reference coordinate system, see [doc:\/\/com.apple.uikit\/documentation\/UIKit\/UIDynamicAnimator].",
  "platforms" : [
    "iOS",
    "iPadOS",
    "Mac Catalyst",
    "tvOS",
    "visionOS"
  ],
  "rawMarkdown" : "---\nsource: https:\/\/developer.apple.com\/documentation\/UIKit\/UIGravityBehavior\ncrawled: 2025-12-04T10:19:35Z\n---\n\n# UIGravityBehavior\n\n**Class**\n\nAn object that applies a gravity-like force to all of its associated dynamic items.\n\n## Declaration\n\n```swift\n@MainActor class UIGravityBehavior\n```\n\n## Overview\n\nThe magnitude and direction of the gravity force are configurable and are applied equally to all associated items. Use this behavior to modify the position of views and other dynamic items in your app’s interface.\n\nYou specify the magnitude and direction of the gravity force as a two-dimensional vector in the reference view’s coordinate system. A value of `1.0` imparts the standard UIKit gravity, which corresponds to an acceleration of 1000 points \/ second² in the direction of the given axis. The default vector in the [doc:\/\/com.apple.uikit\/documentation\/UIKit\/UIGravityBehavior\/gravityDirection] property is (`0.0`, `1.0`), which causes items to accelerate downward along the positive y axis. If you prefer to set the vector [doc:\/\/com.apple.uikit\/documentation\/UIKit\/UIGravityBehavior\/angle] and [doc:\/\/com.apple.uikit\/documentation\/UIKit\/UIGravityBehavior\/magnitude] separately, you can do so using the corresponding properties.\n\n\n\nIf you want to influence a gravity behavior at each step of a dynamic animation, assign an appropriate block to the inherited [doc:\/\/com.apple.uikit\/documentation\/UIKit\/UIDynamicBehavior\/action] property. Use your block to make any needed changes to the dynamic items associated with the gravity behavior.\n\n### Applying a Gravity Behavior to an Item\n\nTo apply a gravity behavior to one or more dynamic items, do the following:\n\n1. Initialize the behavior using the [doc:\/\/com.apple.uikit\/documentation\/UIKit\/UIGravityBehavior\/init(items:)] method, passing in the items you want associated with the behavior. Use the [doc:\/\/com.apple.uikit\/documentation\/UIKit\/UIGravityBehavior\/addItem(_:)] method to add items after initialization. For more information about dynamic items, see [doc:\/\/com.apple.uikit\/documentation\/UIKit\/UIDynamicItem].\n2. Enable the gravity behavior by adding it to your [doc:\/\/com.apple.uikit\/documentation\/UIKit\/UIDynamicAnimator] object using the [doc:\/\/com.apple.uikit\/documentation\/UIKit\/UIDynamicAnimator\/addBehavior(_:)] method. (Do not add more than one gravity behavior to an animator.)\n\nThe gravity behavior derives its coordinate system from the reference view of its associated dynamic animator object. For more information about the dynamic animator and the reference coordinate system, see [doc:\/\/com.apple.uikit\/documentation\/UIKit\/UIDynamicAnimator].\n\n## Initializing a gravity behavior\n\n- **init(items:)**: Initializes a gravity behavior with an array of dynamic items.\n\n## Managing a gravity behavior’s items\n\n- **items**: The set of dynamic items associated with the gravity behavior.\n- **addItem(_:)**: Associates the specified dynamic item with the gravity behavior.\n- **removeItem(_:)**: Removes the specified dynamic item from the gravity behavior.\n\n## Configuring a gravity behavior\n\n- **gravityDirection**: The direction and magnitude of the gravitational force, expressed as a vector.\n- **angle**: The direction of the gravity vector, expressed in radians in the reference coordinate system.\n- **magnitude**: The magnitude of the gravity vector.\n- **setAngle(_:magnitude:)**: Sets the angle and magnitude of the gravity vector for the behavior.\n\n## Behaviors\n\n- **UIDynamicBehavior**: An object that confers a behavioral configuration on one or more dynamic items, for their participation in 2D animation.\n- **UIAttachmentBehavior**: A relationship between two dynamic items, or between a dynamic item and an anchor point.\n- **UICollisionBehavior**: An object that confers to a specified array of dynamic items the ability to engage in collisions with each other and with the behavior’s specified boundaries.\n- **UIFieldBehavior**: An object that applies field-based physics to dynamic items.\n- **UIPushBehavior**: A behavior that applies a continuous or instantaneous force to one or more dynamic items, causing those items to change position accordingly.\n- **UISnapBehavior**: A spring-like behavior whose initial motion is damped over time so that the object settles at a specific point.\n\n## Inherits From\n\n- UIDynamicBehavior\n\n## Conforms To\n\n- CVarArg\n- CustomDebugStringConvertible\n- CustomStringConvertible\n- Equatable\n- Hashable\n- NSObjectProtocol\n- Sendable\n- SendableMetatype\n\n",
  "sections" : [
    {
      "content" : "",
      "items" : [
        {
          "description" : "Initializes a gravity behavior with an array of dynamic items.",
          "name" : "init(items:)",
          "url" : "https:\/\/developer.apple.com\/documentation\/UIKit\/UIGravityBehavior\/init(items:)"
        }
      ],
      "title" : "Initializing a gravity behavior"
    },
    {
      "content" : "",
      "items" : [
        {
          "description" : "The set of dynamic items associated with the gravity behavior.",
          "name" : "items",
          "url" : "https:\/\/developer.apple.com\/documentation\/UIKit\/UIGravityBehavior\/items"
        },
        {
          "description" : "Associates the specified dynamic item with the gravity behavior.",
          "name" : "addItem(_:)",
          "url" : "https:\/\/developer.apple.com\/documentation\/UIKit\/UIGravityBehavior\/addItem(_:)"
        },
        {
          "description" : "Removes the specified dynamic item from the gravity behavior.",
          "name" : "removeItem(_:)",
          "url" : "https:\/\/developer.apple.com\/documentation\/UIKit\/UIGravityBehavior\/removeItem(_:)"
        }
      ],
      "title" : "Managing a gravity behavior’s items"
    },
    {
      "content" : "",
      "items" : [
        {
          "description" : "The direction and magnitude of the gravitational force, expressed as a vector.",
          "name" : "gravityDirection",
          "url" : "https:\/\/developer.apple.com\/documentation\/UIKit\/UIGravityBehavior\/gravityDirection"
        },
        {
          "description" : "The direction of the gravity vector, expressed in radians in the reference coordinate system.",
          "name" : "angle",
          "url" : "https:\/\/developer.apple.com\/documentation\/UIKit\/UIGravityBehavior\/angle"
        },
        {
          "description" : "The magnitude of the gravity vector.",
          "name" : "magnitude",
          "url" : "https:\/\/developer.apple.com\/documentation\/UIKit\/UIGravityBehavior\/magnitude"
        },
        {
          "description" : "Sets the angle and magnitude of the gravity vector for the behavior.",
          "name" : "setAngle(_:magnitude:)",
          "url" : "https:\/\/developer.apple.com\/documentation\/UIKit\/UIGravityBehavior\/setAngle(_:magnitude:)"
        }
      ],
      "title" : "Configuring a gravity behavior"
    },
    {
      "content" : "",
      "items" : [
        {
          "description" : "An object that confers a behavioral configuration on one or more dynamic items, for their participation in 2D animation.",
          "name" : "UIDynamicBehavior",
          "url" : "https:\/\/developer.apple.com\/documentation\/UIKit\/UIDynamicBehavior"
        },
        {
          "description" : "A relationship between two dynamic items, or between a dynamic item and an anchor point.",
          "name" : "UIAttachmentBehavior",
          "url" : "https:\/\/developer.apple.com\/documentation\/UIKit\/UIAttachmentBehavior"
        },
        {
          "description" : "An object that confers to a specified array of dynamic items the ability to engage in collisions with each other and with the behavior’s specified boundaries.",
          "name" : "UICollisionBehavior",
          "url" : "https:\/\/developer.apple.com\/documentation\/UIKit\/UICollisionBehavior"
        },
        {
          "description" : "An object that applies field-based physics to dynamic items.",
          "name" : "UIFieldBehavior",
          "url" : "https:\/\/developer.apple.com\/documentation\/UIKit\/UIFieldBehavior"
        },
        {
          "description" : "A behavior that applies a continuous or instantaneous force to one or more dynamic items, causing those items to change position accordingly.",
          "name" : "UIPushBehavior",
          "url" : "https:\/\/developer.apple.com\/documentation\/UIKit\/UIPushBehavior"
        },
        {
          "description" : "A spring-like behavior whose initial motion is damped over time so that the object settles at a specific point.",
          "name" : "UISnapBehavior",
          "url" : "https:\/\/developer.apple.com\/documentation\/UIKit\/UISnapBehavior"
        }
      ],
      "title" : "Behaviors"
    },
    {
      "content" : "",
      "items" : [
        {
          "name" : "UIDynamicBehavior"
        }
      ],
      "title" : "Inherits From"
    }
  ],
  "source" : "appleJSON",
  "title" : "UIGravityBehavior",
  "url" : "https:\/\/developer.apple.com\/documentation\/UIKit\/UIGravityBehavior"
}