{
  "abstract" : "Asks the delegate for the identifier of the sound to play when the object gains focus.",
  "codeExamples" : [

  ],
  "contentHash" : "a3930de17b51cec610ff497af2e895b85643deebcff14f149823d31cc6e68ffe",
  "crawledAt" : "2025-12-01T01:15:34Z",
  "declaration" : {
    "code" : "@MainActor optional func soundIdentifierForFocusUpdate(in context: UIFocusUpdateContext) -> UIFocusSoundIdentifier?",
    "language" : "swift"
  },
  "id" : "EFB0110A-9608-4044-A22A-7037588A30BF",
  "kind" : "method",
  "module" : "UIKit",
  "overview" : "## Return Value\n\nThe identifier of the sound to be played. Return `nil` if you want to let the parent focus environment determine which sound to play.\n\n## Discussion\n\nUse this method to return a custom sound when the focus environment object gains focus. Return [doc:\/\/com.apple.uikit\/documentation\/UIKit\/UIFocusSoundIdentifier\/default] to play the default system sound, or return [doc:\/\/com.apple.uikit\/documentation\/UIKit\/UIFocusSoundIdentifier\/none] to avoid playing a sound altogether. If you previously registered custom sounds using the [doc:\/\/com.apple.uikit\/documentation\/UIKit\/UIFocusSystem\/register(_:forSoundIdentifier:)] method of [doc:\/\/com.apple.uikit\/documentation\/UIKit\/UIFocusSystem], you may also return an identifier for a sound that you registered.\n\nIf you do not implement this method, the system assumes a `nil` return value. If no ancestor environment defines a custom sound, the system plays the [doc:\/\/com.apple.uikit\/documentation\/UIKit\/UIFocusSoundIdentifier\/default] sound.",
  "platforms" : [
    "tvOS"
  ],
  "rawMarkdown" : "---\nsource: https:\/\/developer.apple.com\/documentation\/UIKit\/UIFocusEnvironment\/soundIdentifierForFocusUpdate(in:)\ncrawled: 2025-12-01T01:15:34Z\n---\n\n# soundIdentifierForFocusUpdate(in:)\n\n**Instance Method**\n\nAsks the delegate for the identifier of the sound to play when the object gains focus.\n\n## Declaration\n\n```swift\n@MainActor optional func soundIdentifierForFocusUpdate(in context: UIFocusUpdateContext) -> UIFocusSoundIdentifier?\n```\n\n## Parameters\n\n- **context**: The context object associated with the update.\n\n## Return Value\n\nThe identifier of the sound to be played. Return `nil` if you want to let the parent focus environment determine which sound to play.\n\n## Discussion\n\nUse this method to return a custom sound when the focus environment object gains focus. Return [doc:\/\/com.apple.uikit\/documentation\/UIKit\/UIFocusSoundIdentifier\/default] to play the default system sound, or return [doc:\/\/com.apple.uikit\/documentation\/UIKit\/UIFocusSoundIdentifier\/none] to avoid playing a sound altogether. If you previously registered custom sounds using the [doc:\/\/com.apple.uikit\/documentation\/UIKit\/UIFocusSystem\/register(_:forSoundIdentifier:)] method of [doc:\/\/com.apple.uikit\/documentation\/UIKit\/UIFocusSystem], you may also return an identifier for a sound that you registered.\n\nIf you do not implement this method, the system assumes a `nil` return value. If no ancestor environment defines a custom sound, the system plays the [doc:\/\/com.apple.uikit\/documentation\/UIKit\/UIFocusSoundIdentifier\/default] sound.\n\n\n\n## Getting the sound to play during updates\n\n- **Using custom sounds for focus movement**: Customize the sounds users hear when focus moves.\n- **UIFocusSoundIdentifier**: An identifier for a focus-related sound.\n\n",
  "sections" : [
    {
      "content" : "",
      "items" : [
        {
          "description" : "Customize the sounds users hear when focus moves.",
          "name" : "Using custom sounds for focus movement",
          "url" : "https:\/\/developer.apple.com\/documentation\/UIKit\/using-custom-sounds-for-focus-movement"
        },
        {
          "description" : "An identifier for a focus-related sound.",
          "name" : "UIFocusSoundIdentifier",
          "url" : "https:\/\/developer.apple.com\/documentation\/UIKit\/UIFocusSoundIdentifier"
        }
      ],
      "title" : "Getting the sound to play during updates"
    }
  ],
  "source" : "appleJSON",
  "title" : "soundIdentifierForFocusUpdate(in:)",
  "url" : "https:\/\/developer.apple.com\/documentation\/UIKit\/UIFocusEnvironment\/soundIdentifierForFocusUpdate(in:)"
}