{
  "abstract" : "The presentation controller that’s managing the current view controller.",
  "codeExamples" : [

  ],
  "contentHash" : "9880db6961276c1ac9d4d9acc2441411318fab5f7b2dbec6152c1f231e628a6d",
  "crawledAt" : "2025-12-02T16:19:02Z",
  "declaration" : {
    "code" : "@MainActor var presentationController: UIPresentationController? { get }",
    "language" : "swift"
  },
  "id" : "D354DC3F-16BB-4D08-833E-CC62F964A585",
  "kind" : "property",
  "language" : "swift",
  "module" : "UIKit",
  "overview" : "## Discussion\n\nIf the view controller is managed by a presentation controller, this property contains that object. This property is `nil` if the view controller isn’t managed by a presentation controller.\n\nIf you’ve not yet presented the current view controller, accessing this property creates a presentation controller based on the current value in the [doc:\/\/com.apple.uikit\/documentation\/UIKit\/UIViewController\/modalPresentationStyle] property. Always set the value of that property before accessing any presentation controllers.",
  "platforms" : [
    "iOS",
    "iPadOS",
    "Mac Catalyst",
    "tvOS",
    "visionOS"
  ],
  "rawMarkdown" : "---\nsource: https:\/\/developer.apple.com\/documentation\/UIKit\/UIViewController\/presentationController\ncrawled: 2025-12-02T16:19:02Z\n---\n\n# presentationController\n\n**Instance Property**\n\nThe presentation controller that’s managing the current view controller.\n\n## Declaration\n\n```swift\n@MainActor var presentationController: UIPresentationController? { get }\n```\n\n## Discussion\n\nIf the view controller is managed by a presentation controller, this property contains that object. This property is `nil` if the view controller isn’t managed by a presentation controller.\n\nIf you’ve not yet presented the current view controller, accessing this property creates a presentation controller based on the current value in the [doc:\/\/com.apple.uikit\/documentation\/UIKit\/UIViewController\/modalPresentationStyle] property. Always set the value of that property before accessing any presentation controllers.\n\n## Adding a custom transition or presentation\n\n- **transitioningDelegate**: The delegate object that provides transition animator, interactive controller, and custom presentation controller objects.\n- **transitionCoordinator**: Returns the active transition coordinator object.\n- **targetViewController(forAction:sender:)**: Returns the view controller that responds to the action.\n- **popoverPresentationController**: The nearest popover presentation controller that is managing the current view controller.\n- **sheetPresentationController**: The sheet presentation controller for the view controller.\n- **activePresentationController**: The presentation controller that’s managing the view controller.\n- **restoresFocusAfterTransition**: A Boolean value that indicates whether an item that previously was focused should again become focused when the item’s view controller becomes visible and focusable.\n- **Customizing and resizing sheets in UIKit**: Discover how to create a layered and customized sheet experience in UIKit.\n\n",
  "sections" : [
    {
      "content" : "",
      "items" : [
        {
          "description" : "The delegate object that provides transition animator, interactive controller, and custom presentation controller objects.",
          "name" : "transitioningDelegate",
          "url" : "https:\/\/developer.apple.com\/documentation\/UIKit\/UIViewController\/transitioningDelegate"
        },
        {
          "description" : "Returns the active transition coordinator object.",
          "name" : "transitionCoordinator",
          "url" : "https:\/\/developer.apple.com\/documentation\/UIKit\/UIViewController\/transitionCoordinator"
        },
        {
          "description" : "Returns the view controller that responds to the action.",
          "name" : "targetViewController(forAction:sender:)",
          "url" : "https:\/\/developer.apple.com\/documentation\/UIKit\/UIViewController\/targetViewController(forAction:sender:)"
        },
        {
          "description" : "The nearest popover presentation controller that is managing the current view controller.",
          "name" : "popoverPresentationController",
          "url" : "https:\/\/developer.apple.com\/documentation\/UIKit\/UIViewController\/popoverPresentationController"
        },
        {
          "description" : "The sheet presentation controller for the view controller.",
          "name" : "sheetPresentationController",
          "url" : "https:\/\/developer.apple.com\/documentation\/UIKit\/UIViewController\/sheetPresentationController"
        },
        {
          "description" : "The presentation controller that’s managing the view controller.",
          "name" : "activePresentationController",
          "url" : "https:\/\/developer.apple.com\/documentation\/UIKit\/UIViewController\/activePresentationController"
        },
        {
          "description" : "A Boolean value that indicates whether an item that previously was focused should again become focused when the item’s view controller becomes visible and focusable.",
          "name" : "restoresFocusAfterTransition",
          "url" : "https:\/\/developer.apple.com\/documentation\/UIKit\/UIViewController\/restoresFocusAfterTransition"
        },
        {
          "description" : "Discover how to create a layered and customized sheet experience in UIKit.",
          "name" : "Customizing and resizing sheets in UIKit",
          "url" : "https:\/\/developer.apple.com\/documentation\/UIKit\/customizing-and-resizing-sheets-in-uikit"
        }
      ],
      "title" : "Adding a custom transition or presentation"
    }
  ],
  "source" : "appleJSON",
  "title" : "presentationController",
  "url" : "https:\/\/developer.apple.com\/documentation\/UIKit\/UIViewController\/presentationController"
}