{
  "abstract" : "Archives a filter generator object to a filter generator file.",
  "codeExamples" : [

  ],
  "contentHash" : "22695b498713201ae885e9cdbbf9a9fb906b12bcad1f452259283c0faac55f8d",
  "crawledAt" : "2025-12-06T10:40:31Z",
  "declaration" : {
    "code" : "func write(to aURL: URL, atomically flag: Bool) -> Bool",
    "language" : "swift"
  },
  "id" : "B771D673-B8DB-4030-A3E0-F6651B210FB2",
  "kind" : "method",
  "language" : "swift",
  "module" : "Core Image",
  "overview" : "## Return Value\n\nReturns `true` if the the object is successfully archived to the file.\n\n## Discussion\n\nUse this method to save your filter chain to a file for later use.",
  "platforms" : [
    "macOS"
  ],
  "rawMarkdown" : "---\nsource: https:\/\/developer.apple.com\/documentation\/CoreImage\/CIFilterGenerator\/write(to:atomically:)\ncrawled: 2025-12-06T10:40:31Z\n---\n\n# write(to:atomically:)\n\n**Instance Method**\n\nArchives a filter generator object to a filter generator file.\n\n## Declaration\n\n```swift\nfunc write(to aURL: URL, atomically flag: Bool) -> Bool\n```\n\n## Parameters\n\n- **aURL**: A  location for the file generator file.\n- **flag**: Pass `true` to specify that Core Image should create an interim file to avoid overwriting an existing file.\n\n## Return Value\n\nReturns `true` if the the object is successfully archived to the file.\n\n## Discussion\n\nUse this method to save your filter chain to a file for later use.\n\n",
  "sections" : [

  ],
  "source" : "appleJSON",
  "title" : "write(to:atomically:)",
  "url" : "https:\/\/developer.apple.com\/documentation\/CoreImage\/CIFilterGenerator\/write(to:atomically:)"
}