{
  "abstract" : "Distorts an image by generating a light tunnel.",
  "codeExamples" : [
    {
      "code" : "func lightTunnel(inputImage: CIImage) -> CIImage {\n    let filter = CIFilter.lightTunnel()\n    filter.inputImage = inputImage\n    filter.radius = 100\n    filter.rotation = .pi\n    filter.center = CGPoint(\n        x: inputImage.extent.width \/ 2,\n        y: inputImage.extent.size.height \/ 2\n    )\n    return filter.outputImage!.cropped(to: inputImage.extent)\n}",
      "language" : "swift"
    }
  ],
  "contentHash" : "da63215ddf4e9fc77e4d29585d7869ee06b903c112461f9b2839ad67cc67cc35",
  "crawledAt" : "2025-12-06T10:30:16Z",
  "declaration" : {
    "code" : "class func lightTunnel() -> any CIFilter & CILightTunnel",
    "language" : "swift"
  },
  "id" : "438703AE-EE57-45BF-ACBD-78F758A4C83D",
  "kind" : "method",
  "language" : "swift",
  "module" : "Core Image",
  "overview" : "## Return Value\n\nThe distorted image.\n\n## Discussion\n\nThis method applies the light tunnel filter to an image. This effect distorts the input image by warping the image to cylinder shape.\n\nThe light tunnel filter uses the following properties:\n\nThe following code creates a filter that generates a swirling pattern from the input image:\n\n",
  "platforms" : [
    "iOS",
    "iPadOS",
    "Mac Catalyst",
    "macOS",
    "tvOS",
    "visionOS"
  ],
  "rawMarkdown" : "---\nsource: https:\/\/developer.apple.com\/documentation\/CoreImage\/CIFilter-swift.class\/lightTunnel()\ncrawled: 2025-12-06T10:30:16Z\n---\n\n# lightTunnel()\n\n**Type Method**\n\nDistorts an image by generating a light tunnel.\n\n## Declaration\n\n```swift\nclass func lightTunnel() -> any CIFilter & CILightTunnel\n```\n\n## Return Value\n\nThe distorted image.\n\n## Discussion\n\nThis method applies the light tunnel filter to an image. This effect distorts the input image by warping the image to cylinder shape.\n\nThe light tunnel filter uses the following properties:\n\n\n\nThe following code creates a filter that generates a swirling pattern from the input image:\n\n```swift\nfunc lightTunnel(inputImage: CIImage) -> CIImage {\n    let filter = CIFilter.lightTunnel()\n    filter.inputImage = inputImage\n    filter.radius = 100\n    filter.rotation = .pi\n    filter.center = CGPoint(\n        x: inputImage.extent.width \/ 2,\n        y: inputImage.extent.size.height \/ 2\n    )\n    return filter.outputImage!.cropped(to: inputImage.extent)\n}\n```\n\n\n\n## Filters\n\n- **bumpDistortion()**: Distorts an image with a concave or convex bump.\n- **bumpDistortionLinear()**: Linearly distorts an image with a concave or convex bump.\n- **circleSplashDistortion()**: Distorts an image with radiating circles to the periphery of the image.\n- **circularWrap()**: Distorts an image by increasing the distance of the center of the image.\n- **displacementDistortion()**: Applies the grayscale values of the second image to the first image.\n- **droste()**: Stylizes an image with the Droste effect.\n- **glassDistortion()**: Distorts an image by applying a glass-like texture.\n- **glassLozenge()**: Creates a lozenge-shaped lens and distorts the image.\n- **holeDistortion()**: Distorts an image with a circular area that pushes the image outward.\n- **ninePartStretched()**: Distorts an image by stretching it between two breakpoints.\n- **ninePartTiled()**: Distorts an image by tiling portions of it.\n- **pinchDistortion()**: Distorts an image by creating a pinch effect with stronger distortion in the center.\n- **stretchCrop()**: Distorts an image by stretching or cropping to fit a specified size.\n- **torusLensDistortion()**: Creates a torus-shaped lens to distort the image.\n- **twirlDistortion()**: Distorts an image by rotating pixels around a center point.\n\n",
  "sections" : [
    {
      "content" : "",
      "items" : [
        {
          "description" : "Distorts an image with a concave or convex bump.",
          "name" : "bumpDistortion()",
          "url" : "https:\/\/developer.apple.com\/documentation\/CoreImage\/CIFilter-swift.class\/bumpDistortion()"
        },
        {
          "description" : "Linearly distorts an image with a concave or convex bump.",
          "name" : "bumpDistortionLinear()",
          "url" : "https:\/\/developer.apple.com\/documentation\/CoreImage\/CIFilter-swift.class\/bumpDistortionLinear()"
        },
        {
          "description" : "Distorts an image with radiating circles to the periphery of the image.",
          "name" : "circleSplashDistortion()",
          "url" : "https:\/\/developer.apple.com\/documentation\/CoreImage\/CIFilter-swift.class\/circleSplashDistortion()"
        },
        {
          "description" : "Distorts an image by increasing the distance of the center of the image.",
          "name" : "circularWrap()",
          "url" : "https:\/\/developer.apple.com\/documentation\/CoreImage\/CIFilter-swift.class\/circularWrap()"
        },
        {
          "description" : "Applies the grayscale values of the second image to the first image.",
          "name" : "displacementDistortion()",
          "url" : "https:\/\/developer.apple.com\/documentation\/CoreImage\/CIFilter-swift.class\/displacementDistortion()"
        },
        {
          "description" : "Stylizes an image with the Droste effect.",
          "name" : "droste()",
          "url" : "https:\/\/developer.apple.com\/documentation\/CoreImage\/CIFilter-swift.class\/droste()"
        },
        {
          "description" : "Distorts an image by applying a glass-like texture.",
          "name" : "glassDistortion()",
          "url" : "https:\/\/developer.apple.com\/documentation\/CoreImage\/CIFilter-swift.class\/glassDistortion()"
        },
        {
          "description" : "Creates a lozenge-shaped lens and distorts the image.",
          "name" : "glassLozenge()",
          "url" : "https:\/\/developer.apple.com\/documentation\/CoreImage\/CIFilter-swift.class\/glassLozenge()"
        },
        {
          "description" : "Distorts an image with a circular area that pushes the image outward.",
          "name" : "holeDistortion()",
          "url" : "https:\/\/developer.apple.com\/documentation\/CoreImage\/CIFilter-swift.class\/holeDistortion()"
        },
        {
          "description" : "Distorts an image by stretching it between two breakpoints.",
          "name" : "ninePartStretched()",
          "url" : "https:\/\/developer.apple.com\/documentation\/CoreImage\/CIFilter-swift.class\/ninePartStretched()"
        },
        {
          "description" : "Distorts an image by tiling portions of it.",
          "name" : "ninePartTiled()",
          "url" : "https:\/\/developer.apple.com\/documentation\/CoreImage\/CIFilter-swift.class\/ninePartTiled()"
        },
        {
          "description" : "Distorts an image by creating a pinch effect with stronger distortion in the center.",
          "name" : "pinchDistortion()",
          "url" : "https:\/\/developer.apple.com\/documentation\/CoreImage\/CIFilter-swift.class\/pinchDistortion()"
        },
        {
          "description" : "Distorts an image by stretching or cropping to fit a specified size.",
          "name" : "stretchCrop()",
          "url" : "https:\/\/developer.apple.com\/documentation\/CoreImage\/CIFilter-swift.class\/stretchCrop()"
        },
        {
          "description" : "Creates a torus-shaped lens to distort the image.",
          "name" : "torusLensDistortion()",
          "url" : "https:\/\/developer.apple.com\/documentation\/CoreImage\/CIFilter-swift.class\/torusLensDistortion()"
        },
        {
          "description" : "Distorts an image by rotating pixels around a center point.",
          "name" : "twirlDistortion()",
          "url" : "https:\/\/developer.apple.com\/documentation\/CoreImage\/CIFilter-swift.class\/twirlDistortion()"
        }
      ],
      "title" : "Filters"
    }
  ],
  "source" : "appleJSON",
  "title" : "lightTunnel()",
  "url" : "https:\/\/developer.apple.com\/documentation\/CoreImage\/CIFilter-swift.class\/lightTunnel()"
}