{
  "abstract" : "Performs a transform on the image and tiles the result.",
  "codeExamples" : [
    {
      "code" : "func affineTile(inputImage: CIImage) -> CIImage {\n    let affineTileEffect = CIFilter.affineTile()\n    affineTileEffect.inputImage = inputImage\n    affineTileEffect.transform = CGAffineTransform(a: 1, b: 2, c: 2, d: 3, tx: 4, ty: 4)\n    return affineTileEffect.outputImage!\n}",
      "language" : "swift"
    }
  ],
  "contentHash" : "bfda572d9d9bc10ef9b5978da1b964259a76bf0e7bc8cac945110cec31ecf55a",
  "crawledAt" : "2025-12-06T10:36:10Z",
  "declaration" : {
    "code" : "class func affineTile() -> any CIFilter & CIAffineTile",
    "language" : "swift"
  },
  "id" : "E5211B39-6130-4324-94CB-F21A78DC2AE2",
  "kind" : "method",
  "language" : "swift",
  "module" : "Core Image",
  "overview" : "## Return Value\n\nThe tiled image.\n\n## Discussion\n\nThis method applies the affine tile filter to an image. This effect performs an [doc:\/\/com.apple.documentation\/documentation\/CoreFoundation\/CGAffineTransform] and then tiles the transformed image.\n\nThe affine tile filter uses the following properties:\n\nThe following code creates a filter that results in the image becoming tiled:\n\n",
  "platforms" : [
    "iOS",
    "iPadOS",
    "Mac Catalyst",
    "macOS",
    "tvOS",
    "visionOS"
  ],
  "rawMarkdown" : "---\nsource: https:\/\/developer.apple.com\/documentation\/CoreImage\/CIFilter-swift.class\/affineTile()\ncrawled: 2025-12-06T10:36:10Z\n---\n\n# affineTile()\n\n**Type Method**\n\nPerforms a transform on the image and tiles the result.\n\n## Declaration\n\n```swift\nclass func affineTile() -> any CIFilter & CIAffineTile\n```\n\n## Return Value\n\nThe tiled image.\n\n## Discussion\n\nThis method applies the affine tile filter to an image. This effect performs an [doc:\/\/com.apple.documentation\/documentation\/CoreFoundation\/CGAffineTransform] and then tiles the transformed image.\n\nThe affine tile filter uses the following properties:\n\n\n\nThe following code creates a filter that results in the image becoming tiled:\n\n```swift\nfunc affineTile(inputImage: CIImage) -> CIImage {\n    let affineTileEffect = CIFilter.affineTile()\n    affineTileEffect.inputImage = inputImage\n    affineTileEffect.transform = CGAffineTransform(a: 1, b: 2, c: 2, d: 3, tx: 4, ty: 4)\n    return affineTileEffect.outputImage!\n}\n```\n\n\n\n## Filters\n\n- **affineClamp()**: Performs a transform on the image and extends the image edges to infinity.\n- **eightfoldReflectedTile()**: Creates an eight-way reflected pattern.\n- **fourfoldReflectedTile()**: Creates a four-way reflected pattern.\n- **fourfoldRotatedTile()**: Creates a tiled image by rotating a tile in increments of 90 degrees.\n- **fourfoldTranslatedTile()**: Creates a tiled image by applying four translation operations.\n- **glideReflectedTile()**: Tiles an image by rotating and reflecting a tile from the image.\n- **kaleidoscope()**: Creates a 12-way kaleidoscopic image from an image.\n- **opTile()**: Produces an effect that mimics a style of visual art that uses optical illusions.\n- **parallelogramTile()**: Warps the image to create a parallelogram and tiles the result.\n- **perspectiveTile()**: Tiles an image by adjusting the perspective of the image.\n- **sixfoldReflectedTile()**: Produces a tiled image from a source image by applying a six-way reflected symmetry.\n- **sixfoldRotatedTile()**: Creates a tiled image by rotating in increments of 60 degrees.\n- **triangleKaleidoscope()**: Create a triangular kaleidoscope effect and then tiles the result.\n- **triangleTile()**: Tiles a triangular area of an image.\n- **twelvefoldReflectedTile()**: Creates a tiled image by rotating in increments of 30 degrees.\n\n",
  "sections" : [
    {
      "content" : "",
      "items" : [
        {
          "description" : "Performs a transform on the image and extends the image edges to infinity.",
          "name" : "affineClamp()",
          "url" : "https:\/\/developer.apple.com\/documentation\/CoreImage\/CIFilter-swift.class\/affineClamp()"
        },
        {
          "description" : "Creates an eight-way reflected pattern.",
          "name" : "eightfoldReflectedTile()",
          "url" : "https:\/\/developer.apple.com\/documentation\/CoreImage\/CIFilter-swift.class\/eightfoldReflectedTile()"
        },
        {
          "description" : "Creates a four-way reflected pattern.",
          "name" : "fourfoldReflectedTile()",
          "url" : "https:\/\/developer.apple.com\/documentation\/CoreImage\/CIFilter-swift.class\/fourfoldReflectedTile()"
        },
        {
          "description" : "Creates a tiled image by rotating a tile in increments of 90 degrees.",
          "name" : "fourfoldRotatedTile()",
          "url" : "https:\/\/developer.apple.com\/documentation\/CoreImage\/CIFilter-swift.class\/fourfoldRotatedTile()"
        },
        {
          "description" : "Creates a tiled image by applying four translation operations.",
          "name" : "fourfoldTranslatedTile()",
          "url" : "https:\/\/developer.apple.com\/documentation\/CoreImage\/CIFilter-swift.class\/fourfoldTranslatedTile()"
        },
        {
          "description" : "Tiles an image by rotating and reflecting a tile from the image.",
          "name" : "glideReflectedTile()",
          "url" : "https:\/\/developer.apple.com\/documentation\/CoreImage\/CIFilter-swift.class\/glideReflectedTile()"
        },
        {
          "description" : "Creates a 12-way kaleidoscopic image from an image.",
          "name" : "kaleidoscope()",
          "url" : "https:\/\/developer.apple.com\/documentation\/CoreImage\/CIFilter-swift.class\/kaleidoscope()"
        },
        {
          "description" : "Produces an effect that mimics a style of visual art that uses optical illusions.",
          "name" : "opTile()",
          "url" : "https:\/\/developer.apple.com\/documentation\/CoreImage\/CIFilter-swift.class\/opTile()"
        },
        {
          "description" : "Warps the image to create a parallelogram and tiles the result.",
          "name" : "parallelogramTile()",
          "url" : "https:\/\/developer.apple.com\/documentation\/CoreImage\/CIFilter-swift.class\/parallelogramTile()"
        },
        {
          "description" : "Tiles an image by adjusting the perspective of the image.",
          "name" : "perspectiveTile()",
          "url" : "https:\/\/developer.apple.com\/documentation\/CoreImage\/CIFilter-swift.class\/perspectiveTile()"
        },
        {
          "description" : "Produces a tiled image from a source image by applying a six-way reflected symmetry.",
          "name" : "sixfoldReflectedTile()",
          "url" : "https:\/\/developer.apple.com\/documentation\/CoreImage\/CIFilter-swift.class\/sixfoldReflectedTile()"
        },
        {
          "description" : "Creates a tiled image by rotating in increments of 60 degrees.",
          "name" : "sixfoldRotatedTile()",
          "url" : "https:\/\/developer.apple.com\/documentation\/CoreImage\/CIFilter-swift.class\/sixfoldRotatedTile()"
        },
        {
          "description" : "Create a triangular kaleidoscope effect and then tiles the result.",
          "name" : "triangleKaleidoscope()",
          "url" : "https:\/\/developer.apple.com\/documentation\/CoreImage\/CIFilter-swift.class\/triangleKaleidoscope()"
        },
        {
          "description" : "Tiles a triangular area of an image.",
          "name" : "triangleTile()",
          "url" : "https:\/\/developer.apple.com\/documentation\/CoreImage\/CIFilter-swift.class\/triangleTile()"
        },
        {
          "description" : "Creates a tiled image by rotating in increments of 30 degrees.",
          "name" : "twelvefoldReflectedTile()",
          "url" : "https:\/\/developer.apple.com\/documentation\/CoreImage\/CIFilter-swift.class\/twelvefoldReflectedTile()"
        }
      ],
      "title" : "Filters"
    }
  ],
  "source" : "appleJSON",
  "title" : "affineTile()",
  "url" : "https:\/\/developer.apple.com\/documentation\/CoreImage\/CIFilter-swift.class\/affineTile()"
}