{
  "abstract" : "Subtracts non-overlapping areas of two images, resulting in one image.",
  "codeExamples" : [
    {
      "code" : "func sourceInCompositing(inputImage: CIImage, backgroundImage: CIImage) -> CIImage {\n    let colorBlendFilter = CIFilter.sourceInCompositing()\n    colorBlendFilter.inputImage = inputImage\n    colorBlendFilter.backgroundImage = backgroundImage\n    return colorBlendFilter.outputImage!\n}",
      "language" : "swift"
    }
  ],
  "contentHash" : "f9fc9371391828fdc4e11856f1057b148a8d6e367714c4305d57ab9c5f658434",
  "crawledAt" : "2025-12-06T10:29:54Z",
  "declaration" : {
    "code" : "class func sourceInCompositing() -> any CIFilter & CICompositeOperation",
    "language" : "swift"
  },
  "id" : "727C0DF6-D13C-4929-BF73-E6A973DEA69D",
  "kind" : "method",
  "language" : "swift",
  "module" : "Core Image",
  "overview" : "## Return Value\n\nThe modified image.\n\n## Discussion\n\nThis method applies the source-in compositing filter to an image. The effect creates the result by overlaying the input image over the background image. The filter then removes the non-overlapping area of both images.\n\nThe source-in compositing filter uses the following properties:\n\nThe following code creates a filter that results in an output image that shows the portion of the background image that overlaps with the input:\n\n",
  "platforms" : [
    "iOS",
    "iPadOS",
    "Mac Catalyst",
    "macOS",
    "tvOS",
    "visionOS"
  ],
  "rawMarkdown" : "---\nsource: https:\/\/developer.apple.com\/documentation\/CoreImage\/CIFilter-swift.class\/sourceInCompositing()\ncrawled: 2025-12-06T10:29:54Z\n---\n\n# sourceInCompositing()\n\n**Type Method**\n\nSubtracts non-overlapping areas of two images, resulting in one image.\n\n## Declaration\n\n```swift\nclass func sourceInCompositing() -> any CIFilter & CICompositeOperation\n```\n\n## Return Value\n\nThe modified image.\n\n## Discussion\n\nThis method applies the source-in compositing filter to an image. The effect creates the result by overlaying the input image over the background image. The filter then removes the non-overlapping area of both images.\n\nThe source-in compositing filter uses the following properties:\n\n\n\nThe following code creates a filter that results in an output image that shows the portion of the background image that overlaps with the input:\n\n```swift\nfunc sourceInCompositing(inputImage: CIImage, backgroundImage: CIImage) -> CIImage {\n    let colorBlendFilter = CIFilter.sourceInCompositing()\n    colorBlendFilter.inputImage = inputImage\n    colorBlendFilter.backgroundImage = backgroundImage\n    return colorBlendFilter.outputImage!\n}\n```\n\n\n\n## Filters\n\n- **additionCompositing()**: Blends colors from two images by addition.\n- **colorBlendMode()**: Blends color from two images using the luminance values from the background image and the hue and saturation values from the input image.\n- **colorBurnBlendMode()**: Blends color from two images while darkening the image.\n- **colorDodgeBlendMode()**: Blends color from two images using dodging.\n- **darkenBlendMode()**: Blends colors from two images while darkening lighter pixels.\n- **differenceBlendMode()**: Subtracts color values to blend colors.\n- **divideBlendMode()**: Divides color values to blend colors.\n- **exclusionBlendMode()**: Subtracts color values to blend colors with less contrast.\n- **hardLightBlendMode()**: Blends colors of two images by screening and multiplying.\n- **hueBlendMode()**: Blends colors of two images by computing the sum of image color values.\n- **lightenBlendMode()**: Blends colors from two images by brightening colors.\n- **linearBurnBlendMode()**: Blends color from two images while increasing contrast.\n- **linearDodgeBlendMode()**: Blends colors of two images with dodging.\n- **linearLightBlendMode()**: A combination of linear burn and linear dodge blend modes.\n- **luminosityBlendMode()**: Blends color from two images by calculating the color, hue, and saturation.\n\n",
  "sections" : [
    {
      "content" : "",
      "items" : [
        {
          "description" : "Blends colors from two images by addition.",
          "name" : "additionCompositing()",
          "url" : "https:\/\/developer.apple.com\/documentation\/CoreImage\/CIFilter-swift.class\/additionCompositing()"
        },
        {
          "description" : "Blends color from two images using the luminance values from the background image and the hue and saturation values from the input image.",
          "name" : "colorBlendMode()",
          "url" : "https:\/\/developer.apple.com\/documentation\/CoreImage\/CIFilter-swift.class\/colorBlendMode()"
        },
        {
          "description" : "Blends color from two images while darkening the image.",
          "name" : "colorBurnBlendMode()",
          "url" : "https:\/\/developer.apple.com\/documentation\/CoreImage\/CIFilter-swift.class\/colorBurnBlendMode()"
        },
        {
          "description" : "Blends color from two images using dodging.",
          "name" : "colorDodgeBlendMode()",
          "url" : "https:\/\/developer.apple.com\/documentation\/CoreImage\/CIFilter-swift.class\/colorDodgeBlendMode()"
        },
        {
          "description" : "Blends colors from two images while darkening lighter pixels.",
          "name" : "darkenBlendMode()",
          "url" : "https:\/\/developer.apple.com\/documentation\/CoreImage\/CIFilter-swift.class\/darkenBlendMode()"
        },
        {
          "description" : "Subtracts color values to blend colors.",
          "name" : "differenceBlendMode()",
          "url" : "https:\/\/developer.apple.com\/documentation\/CoreImage\/CIFilter-swift.class\/differenceBlendMode()"
        },
        {
          "description" : "Divides color values to blend colors.",
          "name" : "divideBlendMode()",
          "url" : "https:\/\/developer.apple.com\/documentation\/CoreImage\/CIFilter-swift.class\/divideBlendMode()"
        },
        {
          "description" : "Subtracts color values to blend colors with less contrast.",
          "name" : "exclusionBlendMode()",
          "url" : "https:\/\/developer.apple.com\/documentation\/CoreImage\/CIFilter-swift.class\/exclusionBlendMode()"
        },
        {
          "description" : "Blends colors of two images by screening and multiplying.",
          "name" : "hardLightBlendMode()",
          "url" : "https:\/\/developer.apple.com\/documentation\/CoreImage\/CIFilter-swift.class\/hardLightBlendMode()"
        },
        {
          "description" : "Blends colors of two images by computing the sum of image color values.",
          "name" : "hueBlendMode()",
          "url" : "https:\/\/developer.apple.com\/documentation\/CoreImage\/CIFilter-swift.class\/hueBlendMode()"
        },
        {
          "description" : "Blends colors from two images by brightening colors.",
          "name" : "lightenBlendMode()",
          "url" : "https:\/\/developer.apple.com\/documentation\/CoreImage\/CIFilter-swift.class\/lightenBlendMode()"
        },
        {
          "description" : "Blends color from two images while increasing contrast.",
          "name" : "linearBurnBlendMode()",
          "url" : "https:\/\/developer.apple.com\/documentation\/CoreImage\/CIFilter-swift.class\/linearBurnBlendMode()"
        },
        {
          "description" : "Blends colors of two images with dodging.",
          "name" : "linearDodgeBlendMode()",
          "url" : "https:\/\/developer.apple.com\/documentation\/CoreImage\/CIFilter-swift.class\/linearDodgeBlendMode()"
        },
        {
          "description" : "A combination of linear burn and linear dodge blend modes.",
          "name" : "linearLightBlendMode()",
          "url" : "https:\/\/developer.apple.com\/documentation\/CoreImage\/CIFilter-swift.class\/linearLightBlendMode()"
        },
        {
          "description" : "Blends color from two images by calculating the color, hue, and saturation.",
          "name" : "luminosityBlendMode()",
          "url" : "https:\/\/developer.apple.com\/documentation\/CoreImage\/CIFilter-swift.class\/luminosityBlendMode()"
        }
      ],
      "title" : "Filters"
    }
  ],
  "source" : "appleJSON",
  "title" : "sourceInCompositing()",
  "url" : "https:\/\/developer.apple.com\/documentation\/CoreImage\/CIFilter-swift.class\/sourceInCompositing()"
}