{
  "abstract" : "Alters an image’s transition between black and white.",
  "codeExamples" : [
    {
      "code" : "func gammaAdjust(inputImage: CIImage) -> CIImage {\n    let gammaAdjustFilter = CIFilter.gammaAdjust()\n    gammaAdjustFilter.inputImage = inputImage\n    gammaAdjustFilter.power = 4\n    return gammaAdjustFilter.outputImage!\n}",
      "language" : "swift"
    }
  ],
  "contentHash" : "459059e66e001297ff83738df87c214ef91b340c1c6c9f60542696563ebd4709",
  "crawledAt" : "2025-12-06T09:04:43Z",
  "declaration" : {
    "code" : "class func gammaAdjust() -> any CIFilter & CIGammaAdjust",
    "language" : "swift"
  },
  "id" : "F1D4B96D-6914-4450-82E0-3B10E3CEF480",
  "kind" : "method",
  "language" : "swift",
  "module" : "Core Image",
  "overview" : "## Return Value\n\nThe modified image.\n\n## Discussion\n\nThis method applies the gamma-adjust filter to an image. The effect adjusts the image’s mid-tone brightness. This filter is typically used to compensate for distortion caused by displays.\n\nThe gamma-adjust filter uses the following properties:\n\nThe following code creates a filter that adds darker colors to the input image:\n\n",
  "platforms" : [
    "iOS",
    "iPadOS",
    "Mac Catalyst",
    "macOS",
    "tvOS",
    "visionOS"
  ],
  "rawMarkdown" : "---\nsource: https:\/\/developer.apple.com\/documentation\/CoreImage\/CIFilter-swift.class\/gammaAdjust()\ncrawled: 2025-12-06T09:04:43Z\n---\n\n# gammaAdjust()\n\n**Type Method**\n\nAlters an image’s transition between black and white.\n\n## Declaration\n\n```swift\nclass func gammaAdjust() -> any CIFilter & CIGammaAdjust\n```\n\n## Return Value\n\nThe modified image.\n\n## Discussion\n\nThis method applies the gamma-adjust filter to an image. The effect adjusts the image’s mid-tone brightness. This filter is typically used to compensate for distortion caused by displays.\n\nThe gamma-adjust filter uses the following properties:\n\n\n\nThe following code creates a filter that adds darker colors to the input image:\n\n```swift\nfunc gammaAdjust(inputImage: CIImage) -> CIImage {\n    let gammaAdjustFilter = CIFilter.gammaAdjust()\n    gammaAdjustFilter.inputImage = inputImage\n    gammaAdjustFilter.power = 4\n    return gammaAdjustFilter.outputImage!\n}\n```\n\n\n\n## Filters\n\n- **colorAbsoluteDifference()**: Calculates the absolute difference between each color component in the input images.\n- **colorClamp()**: Alters the colors in an image based on color components.\n- **colorControls()**: Alters the brightness, contrast, and saturation of an image’s colors.\n- **colorMatrix()**: Alters the colors in an image based on vectors provided.\n- **colorPolynomial()**: Alters an image’s colors.\n- **colorThreshold()**: Compares the red, green, and blue components of the input image to a threshold and sets them to 1 or 0.\n- **colorThresholdOtsu()**: Compares the red, green, and blue components of the input image against a threshold calculated using Otsu’s algorithm.\n- **depthToDisparity()**: Converts from an image containing depth data to an image containing disparity data.\n- **disparityToDepth()**: Creates depth data from an image containing disparity data.\n- **exposureAdjust()**: Adjusts an image’s exposure.\n- **hueAdjust()**: Modifies an image’s hue.\n- **linearToSRGBToneCurve()**: Alters an image’s color intensity.\n- **sRGBToneCurveToLinear()**: Converts the colors in an image from sRGB to linear.\n- **temperatureAndTint()**: Alters an image’s temperature and tint.\n- **toneCurve()**: Alters an image’s tone curve according to a series of data points.\n\n",
  "sections" : [
    {
      "content" : "",
      "items" : [
        {
          "description" : "Calculates the absolute difference between each color component in the input images.",
          "name" : "colorAbsoluteDifference()",
          "url" : "https:\/\/developer.apple.com\/documentation\/CoreImage\/CIFilter-swift.class\/colorAbsoluteDifference()"
        },
        {
          "description" : "Alters the colors in an image based on color components.",
          "name" : "colorClamp()",
          "url" : "https:\/\/developer.apple.com\/documentation\/CoreImage\/CIFilter-swift.class\/colorClamp()"
        },
        {
          "description" : "Alters the brightness, contrast, and saturation of an image’s colors.",
          "name" : "colorControls()",
          "url" : "https:\/\/developer.apple.com\/documentation\/CoreImage\/CIFilter-swift.class\/colorControls()"
        },
        {
          "description" : "Alters the colors in an image based on vectors provided.",
          "name" : "colorMatrix()",
          "url" : "https:\/\/developer.apple.com\/documentation\/CoreImage\/CIFilter-swift.class\/colorMatrix()"
        },
        {
          "description" : "Alters an image’s colors.",
          "name" : "colorPolynomial()",
          "url" : "https:\/\/developer.apple.com\/documentation\/CoreImage\/CIFilter-swift.class\/colorPolynomial()"
        },
        {
          "description" : "Compares the red, green, and blue components of the input image to a threshold and sets them to 1 or 0.",
          "name" : "colorThreshold()",
          "url" : "https:\/\/developer.apple.com\/documentation\/CoreImage\/CIFilter-swift.class\/colorThreshold()"
        },
        {
          "description" : "Compares the red, green, and blue components of the input image against a threshold calculated using Otsu’s algorithm.",
          "name" : "colorThresholdOtsu()",
          "url" : "https:\/\/developer.apple.com\/documentation\/CoreImage\/CIFilter-swift.class\/colorThresholdOtsu()"
        },
        {
          "description" : "Converts from an image containing depth data to an image containing disparity data.",
          "name" : "depthToDisparity()",
          "url" : "https:\/\/developer.apple.com\/documentation\/CoreImage\/CIFilter-swift.class\/depthToDisparity()"
        },
        {
          "description" : "Creates depth data from an image containing disparity data.",
          "name" : "disparityToDepth()",
          "url" : "https:\/\/developer.apple.com\/documentation\/CoreImage\/CIFilter-swift.class\/disparityToDepth()"
        },
        {
          "description" : "Adjusts an image’s exposure.",
          "name" : "exposureAdjust()",
          "url" : "https:\/\/developer.apple.com\/documentation\/CoreImage\/CIFilter-swift.class\/exposureAdjust()"
        },
        {
          "description" : "Modifies an image’s hue.",
          "name" : "hueAdjust()",
          "url" : "https:\/\/developer.apple.com\/documentation\/CoreImage\/CIFilter-swift.class\/hueAdjust()"
        },
        {
          "description" : "Alters an image’s color intensity.",
          "name" : "linearToSRGBToneCurve()",
          "url" : "https:\/\/developer.apple.com\/documentation\/CoreImage\/CIFilter-swift.class\/linearToSRGBToneCurve()"
        },
        {
          "description" : "Converts the colors in an image from sRGB to linear.",
          "name" : "sRGBToneCurveToLinear()",
          "url" : "https:\/\/developer.apple.com\/documentation\/CoreImage\/CIFilter-swift.class\/sRGBToneCurveToLinear()"
        },
        {
          "description" : "Alters an image’s temperature and tint.",
          "name" : "temperatureAndTint()",
          "url" : "https:\/\/developer.apple.com\/documentation\/CoreImage\/CIFilter-swift.class\/temperatureAndTint()"
        },
        {
          "description" : "Alters an image’s tone curve according to a series of data points.",
          "name" : "toneCurve()",
          "url" : "https:\/\/developer.apple.com\/documentation\/CoreImage\/CIFilter-swift.class\/toneCurve()"
        }
      ],
      "title" : "Filters"
    }
  ],
  "source" : "appleJSON",
  "title" : "gammaAdjust()",
  "url" : "https:\/\/developer.apple.com\/documentation\/CoreImage\/CIFilter-swift.class\/gammaAdjust()"
}