{
  "abstract" : "The Core Image class that defines a color object.",
  "codeExamples" : [

  ],
  "conformsTo" : [
    "CVarArg",
    "CustomDebugStringConvertible",
    "CustomStringConvertible",
    "Equatable",
    "Hashable",
    "NSCoding",
    "NSCopying",
    "NSObjectProtocol",
    "NSSecureCoding",
    "Sendable",
    "SendableMetatype"
  ],
  "contentHash" : "9cdffaaef13ac93db7e5ac1b55ed9131a1598aa2660c4f0ea12d4e5e84c09a5a",
  "crawledAt" : "2025-12-04T22:51:36Z",
  "declaration" : {
    "code" : "class CIColor",
    "language" : "swift"
  },
  "id" : "F8AD385E-D895-486E-BCF1-80A5BDBB713B",
  "kind" : "class",
  "language" : "swift",
  "module" : "Core Image",
  "overview" : "## Overview\n\nUse `CIColor` instances in conjunction with other Core Image classes, such as [doc:\/\/com.apple.coreimage\/documentation\/CoreImage\/CIFilter-swift.class] and [doc:\/\/com.apple.coreimage\/documentation\/CoreImage\/CIKernel]. Many of the built-in Core Image filters have one or more `CIColor` inputs that you can set to affect the filter’s behavior.\n\n### Color Model\n\nA color is defined as a N-dimensional model where each dimension’s color component is represented by intensity values. A color component may also be referred to as a color channel. An RGB color model, for example, is three-dimensional and the red, green, and blue component intensities define each unique color.\n\n### Color Space\n\nA color is also defined by a color space that locates the axes of N-dimensional model within the greater volume of human perceivable colors.  Core Image uses `CGColorSpace` instances to specify a variety of different color spaces such as sRGB, P3, BT.2020, etc. The `CGColorSpace` also defines if the color space is coded linearly or in a non-linear perceptual curve. (For more information on `CGColorSpace` see [doc:\/\/com.apple.documentation\/documentation\/CoreGraphics\/CGColorSpace])\n\n### Color Range\n\nStandard dynamic range (SDR) color color component values range from `0.0` to `1.0`, with `0.0` representing an 0% of that component and `1.0` representing 100%. In contrast, high dynamic range (HDR) color values can be less than `0.0` (for more saturation) or greater than `1.0` (for more brightness).\n\n### Color Opacity\n\n`CIColor` instances also have an alpha component, which represents the opacity of the color, with 0.0 meaning completely transparent and 1.0 meaning completely opaque. If a color does not have an explicit alpha component, Core Image assumes that the alpha component equals 1.0. With `CIColor` that color components values are not premultiplied. So for example, a semi-transparent pure red `CIColor` is represented by RGB `1.0,0.0,0.0` and A `0.5`.  In contrast color components values in [doc:\/\/com.apple.coreimage\/documentation\/CoreImage\/CIImage] buffers or read in [doc:\/\/com.apple.coreimage\/documentation\/CoreImage\/CIKernel] samplers are premultiplied by default.",
  "platforms" : [
    "iOS",
    "iPadOS",
    "Mac Catalyst",
    "macOS",
    "tvOS",
    "visionOS"
  ],
  "rawMarkdown" : "---\nsource: https:\/\/developer.apple.com\/documentation\/CoreImage\/CIColor\ncrawled: 2025-12-04T22:51:36Z\n---\n\n# CIColor\n\n**Class**\n\nThe Core Image class that defines a color object.\n\n## Declaration\n\n```swift\nclass CIColor\n```\n\n## Overview\n\nUse `CIColor` instances in conjunction with other Core Image classes, such as [doc:\/\/com.apple.coreimage\/documentation\/CoreImage\/CIFilter-swift.class] and [doc:\/\/com.apple.coreimage\/documentation\/CoreImage\/CIKernel]. Many of the built-in Core Image filters have one or more `CIColor` inputs that you can set to affect the filter’s behavior.\n\n### Color Model\n\nA color is defined as a N-dimensional model where each dimension’s color component is represented by intensity values. A color component may also be referred to as a color channel. An RGB color model, for example, is three-dimensional and the red, green, and blue component intensities define each unique color.\n\n### Color Space\n\nA color is also defined by a color space that locates the axes of N-dimensional model within the greater volume of human perceivable colors.  Core Image uses `CGColorSpace` instances to specify a variety of different color spaces such as sRGB, P3, BT.2020, etc. The `CGColorSpace` also defines if the color space is coded linearly or in a non-linear perceptual curve. (For more information on `CGColorSpace` see [doc:\/\/com.apple.documentation\/documentation\/CoreGraphics\/CGColorSpace])\n\n### Color Range\n\nStandard dynamic range (SDR) color color component values range from `0.0` to `1.0`, with `0.0` representing an 0% of that component and `1.0` representing 100%. In contrast, high dynamic range (HDR) color values can be less than `0.0` (for more saturation) or greater than `1.0` (for more brightness).\n\n### Color Opacity\n\n`CIColor` instances also have an alpha component, which represents the opacity of the color, with 0.0 meaning completely transparent and 1.0 meaning completely opaque. If a color does not have an explicit alpha component, Core Image assumes that the alpha component equals 1.0. With `CIColor` that color components values are not premultiplied. So for example, a semi-transparent pure red `CIColor` is represented by RGB `1.0,0.0,0.0` and A `0.5`.  In contrast color components values in [doc:\/\/com.apple.coreimage\/documentation\/CoreImage\/CIImage] buffers or read in [doc:\/\/com.apple.coreimage\/documentation\/CoreImage\/CIKernel] samplers are premultiplied by default.\n\n## Initializing Color Objects\n\n- **init(cgColor:)**: Create a Core Image color object with a Core Graphics color object.\n- **init(color:)**\n- **init(red:green:blue:alpha:)**: Initialize a Core Image color object in the sRGB color space with the specified red, green, blue, and alpha component values.\n- **init(red:green:blue:colorSpace:)**: Initialize a Core Image color object with the specified red, green, and blue component values as measured in the specified color space.\n- **init(red:green:blue:alpha:colorSpace:)**: Initialize a Core Image color object with the specified red, green, and blue component values as measured in the specified color space.\n\n## Creating Color Objects\n\n- **init(red:green:blue:)**: Create a Core Image color object in the sRGB color space with the specified red, green, and blue component values.\n- **init(string:)**: Create a Core Image color object in the sRGB color space using a string containing the RGBA color component values.\n\n## Getting Color Components\n\n- **colorSpace**: Returns the `CGColorSpace` associated with the color\n- **components**: Return a pointer to an array of `CGFloat` values including alpha.\n- **numberOfComponents**: Returns the color components of the color including alpha.\n- **red**: Returns the unpremultiplied red component of the color.\n- **green**: Returns the unpremultiplied green component of the color.\n- **blue**: Returns the unpremultiplied blue component of the color.\n- **alpha**: Returns the alpha value of the color.\n- **stringRepresentation**: Returns a formatted string with the unpremultiplied color and alpha components of the color.\n\n## Creating a CIColor Object with Preset Components\n\n- **black**: Returns a singleton Core Image color instance in the sRGB color space with RGB values `0,0,0` and alpha value `1`.\n- **blue**: Returns a singleton Core Image color instance in the sRGB color space with RGB values `0,0,1` and alpha value `1`.\n- **clear**: Returns a singleton Core Image color instance in the sRGB color space with RGB values `0,0,0` and alpha value `0`.\n- **cyan**: Returns a singleton Core Image color instance in the sRGB color space with RGB values `0,1,1` and alpha value `1`.\n- **gray**: Returns a singleton Core Image color instance in the sRGB color space with RGB values `0.5,0.5,0.5` and alpha value `1`.\n- **green**: Returns a singleton Core Image color instance in the sRGB color space with RGB values `0,1,0` and alpha value `1`.\n- **magenta**: Returns a singleton Core Image color instance in the sRGB color space with RGB values `1,0,1` and alpha value `1`.\n- **red**: Returns a singleton Core Image color instance in the sRGB color space with RGB values `1,0,0` and alpha value `1`.\n- **white**: Returns a singleton Core Image color instance in the sRGB color space with RGB values `1,1,1` and alpha value `1`.\n- **yellow**: Returns a singleton Core Image color instance in the sRGB color space with RGB values `1,1,0` and alpha value `1`.\n\n## Filters\n\n- **CIFilter**: An image processor that produces an image by manipulating one or more input images or by generating new image data.\n- **CIRAWFilter**: A filter subclass that produces an image by manipulating RAW image sensor data from a digital camera or scanner.\n- **CIVector**: The Core Image class that defines a vector object.\n\n## Inherits From\n\n- NSObject\n\n## Conforms To\n\n- CVarArg\n- CustomDebugStringConvertible\n- CustomStringConvertible\n- Equatable\n- Hashable\n- NSCoding\n- NSCopying\n- NSObjectProtocol\n- NSSecureCoding\n- Sendable\n- SendableMetatype\n\n",
  "sections" : [
    {
      "content" : "",
      "items" : [
        {
          "description" : "Create a Core Image color object with a Core Graphics color object.",
          "name" : "init(cgColor:)",
          "url" : "https:\/\/developer.apple.com\/documentation\/CoreImage\/CIColor\/init(cgColor:)"
        },
        {
          "description" : "",
          "name" : "init(color:)",
          "url" : "https:\/\/developer.apple.com\/documentation\/CoreImage\/CIColor\/init(color:)"
        },
        {
          "description" : "Initialize a Core Image color object in the sRGB color space with the specified red, green, blue, and alpha component values.",
          "name" : "init(red:green:blue:alpha:)",
          "url" : "https:\/\/developer.apple.com\/documentation\/CoreImage\/CIColor\/init(red:green:blue:alpha:)"
        },
        {
          "description" : "Initialize a Core Image color object with the specified red, green, and blue component values as measured in the specified color space.",
          "name" : "init(red:green:blue:colorSpace:)",
          "url" : "https:\/\/developer.apple.com\/documentation\/CoreImage\/CIColor\/init(red:green:blue:colorSpace:)"
        },
        {
          "description" : "Initialize a Core Image color object with the specified red, green, and blue component values as measured in the specified color space.",
          "name" : "init(red:green:blue:alpha:colorSpace:)",
          "url" : "https:\/\/developer.apple.com\/documentation\/CoreImage\/CIColor\/init(red:green:blue:alpha:colorSpace:)"
        }
      ],
      "title" : "Initializing Color Objects"
    },
    {
      "content" : "",
      "items" : [
        {
          "description" : "Create a Core Image color object in the sRGB color space with the specified red, green, and blue component values.",
          "name" : "init(red:green:blue:)",
          "url" : "https:\/\/developer.apple.com\/documentation\/CoreImage\/CIColor\/init(red:green:blue:)"
        },
        {
          "description" : "Create a Core Image color object in the sRGB color space using a string containing the RGBA color component values.",
          "name" : "init(string:)",
          "url" : "https:\/\/developer.apple.com\/documentation\/CoreImage\/CIColor\/init(string:)"
        }
      ],
      "title" : "Creating Color Objects"
    },
    {
      "content" : "",
      "items" : [
        {
          "description" : "Returns the `CGColorSpace` associated with the color",
          "name" : "colorSpace",
          "url" : "https:\/\/developer.apple.com\/documentation\/CoreImage\/CIColor\/colorSpace"
        },
        {
          "description" : "Return a pointer to an array of `CGFloat` values including alpha.",
          "name" : "components",
          "url" : "https:\/\/developer.apple.com\/documentation\/CoreImage\/CIColor\/components"
        },
        {
          "description" : "Returns the color components of the color including alpha.",
          "name" : "numberOfComponents",
          "url" : "https:\/\/developer.apple.com\/documentation\/CoreImage\/CIColor\/numberOfComponents"
        },
        {
          "description" : "Returns the unpremultiplied red component of the color.",
          "name" : "red",
          "url" : "https:\/\/developer.apple.com\/documentation\/CoreImage\/CIColor\/red-swift.property"
        },
        {
          "description" : "Returns the unpremultiplied green component of the color.",
          "name" : "green",
          "url" : "https:\/\/developer.apple.com\/documentation\/CoreImage\/CIColor\/green-swift.property"
        },
        {
          "description" : "Returns the unpremultiplied blue component of the color.",
          "name" : "blue",
          "url" : "https:\/\/developer.apple.com\/documentation\/CoreImage\/CIColor\/blue-swift.property"
        },
        {
          "description" : "Returns the alpha value of the color.",
          "name" : "alpha",
          "url" : "https:\/\/developer.apple.com\/documentation\/CoreImage\/CIColor\/alpha"
        },
        {
          "description" : "Returns a formatted string with the unpremultiplied color and alpha components of the color.",
          "name" : "stringRepresentation",
          "url" : "https:\/\/developer.apple.com\/documentation\/CoreImage\/CIColor\/stringRepresentation"
        }
      ],
      "title" : "Getting Color Components"
    },
    {
      "content" : "",
      "items" : [
        {
          "description" : "Returns a singleton Core Image color instance in the sRGB color space with RGB values `0,0,0` and alpha value `1`.",
          "name" : "black",
          "url" : "https:\/\/developer.apple.com\/documentation\/CoreImage\/CIColor\/black"
        },
        {
          "description" : "Returns a singleton Core Image color instance in the sRGB color space with RGB values `0,0,1` and alpha value `1`.",
          "name" : "blue",
          "url" : "https:\/\/developer.apple.com\/documentation\/CoreImage\/CIColor\/blue-swift.type.property"
        },
        {
          "description" : "Returns a singleton Core Image color instance in the sRGB color space with RGB values `0,0,0` and alpha value `0`.",
          "name" : "clear",
          "url" : "https:\/\/developer.apple.com\/documentation\/CoreImage\/CIColor\/clear"
        },
        {
          "description" : "Returns a singleton Core Image color instance in the sRGB color space with RGB values `0,1,1` and alpha value `1`.",
          "name" : "cyan",
          "url" : "https:\/\/developer.apple.com\/documentation\/CoreImage\/CIColor\/cyan"
        },
        {
          "description" : "Returns a singleton Core Image color instance in the sRGB color space with RGB values `0.5,0.5,0.5` and alpha value `1`.",
          "name" : "gray",
          "url" : "https:\/\/developer.apple.com\/documentation\/CoreImage\/CIColor\/gray"
        },
        {
          "description" : "Returns a singleton Core Image color instance in the sRGB color space with RGB values `0,1,0` and alpha value `1`.",
          "name" : "green",
          "url" : "https:\/\/developer.apple.com\/documentation\/CoreImage\/CIColor\/green-swift.type.property"
        },
        {
          "description" : "Returns a singleton Core Image color instance in the sRGB color space with RGB values `1,0,1` and alpha value `1`.",
          "name" : "magenta",
          "url" : "https:\/\/developer.apple.com\/documentation\/CoreImage\/CIColor\/magenta"
        },
        {
          "description" : "Returns a singleton Core Image color instance in the sRGB color space with RGB values `1,0,0` and alpha value `1`.",
          "name" : "red",
          "url" : "https:\/\/developer.apple.com\/documentation\/CoreImage\/CIColor\/red-swift.type.property"
        },
        {
          "description" : "Returns a singleton Core Image color instance in the sRGB color space with RGB values `1,1,1` and alpha value `1`.",
          "name" : "white",
          "url" : "https:\/\/developer.apple.com\/documentation\/CoreImage\/CIColor\/white"
        },
        {
          "description" : "Returns a singleton Core Image color instance in the sRGB color space with RGB values `1,1,0` and alpha value `1`.",
          "name" : "yellow",
          "url" : "https:\/\/developer.apple.com\/documentation\/CoreImage\/CIColor\/yellow"
        }
      ],
      "title" : "Creating a CIColor Object with Preset Components"
    },
    {
      "content" : "",
      "items" : [
        {
          "description" : "An image processor that produces an image by manipulating one or more input images or by generating new image data.",
          "name" : "CIFilter",
          "url" : "https:\/\/developer.apple.com\/documentation\/CoreImage\/CIFilter-swift.class"
        },
        {
          "description" : "A filter subclass that produces an image by manipulating RAW image sensor data from a digital camera or scanner.",
          "name" : "CIRAWFilter",
          "url" : "https:\/\/developer.apple.com\/documentation\/CoreImage\/CIRAWFilter"
        },
        {
          "description" : "The Core Image class that defines a vector object.",
          "name" : "CIVector",
          "url" : "https:\/\/developer.apple.com\/documentation\/CoreImage\/CIVector"
        }
      ],
      "title" : "Filters"
    },
    {
      "content" : "",
      "items" : [
        {
          "name" : "NSObject"
        }
      ],
      "title" : "Inherits From"
    }
  ],
  "source" : "appleJSON",
  "title" : "CIColor",
  "url" : "https:\/\/developer.apple.com\/documentation\/CoreImage\/CIColor"
}