{
  "abstract" : "Alters an image’s colors.",
  "codeExamples" : [
    {
      "code" : "func colorPolynomial(inputImage: CIImage) -> CIImage {\n    let colorPolynomialFilter = CIFilter.colorPolynomial()\n    colorPolynomialFilter.alphaCoefficients = CIVector (x: 0, y: 0.6, z: 0, w: 0)\n    colorPolynomialFilter.redCoefficients = CIVector (x: 0, y: 1, z: 0.1, w: 0)\n    colorPolynomialFilter.greenCoefficients = CIVector(x: 0, y: 1, z: 0, w: 0)\n    colorPolynomialFilter.blueCoefficients = CIVector(x: 0, y: 1, z: 0, w: 0)\n    colorPolynomialFilter.inputImage = inputImage\n    return colorPolynomialFilter.outputImage!\n}",
      "language" : "swift"
    }
  ],
  "contentHash" : "b272223aec1a162b0865535def1fbdf3d02e2b1f46339c479c7a300e09f4faf2",
  "crawledAt" : "2025-12-06T10:28:02Z",
  "declaration" : {
    "code" : "class func colorPolynomial() -> any CIFilter & CIColorPolynomial",
    "language" : "swift"
  },
  "id" : "16B74AE5-BB28-4C4F-8C60-023FF391D880",
  "kind" : "method",
  "language" : "swift",
  "module" : "Core Image",
  "overview" : "## Return Value\n\nThe modified image.\n\n## Discussion\n\nThis method applies the color polynomial filter to an image. The effect calculates the sum of each pixel’s color component value and the coefficient properties together to produce the output image.\n\nThe color polynomial filter uses the following properties:\n\nThe following code creates a filter that adds a lighter contrast to the input image:\n\n",
  "platforms" : [
    "iOS",
    "iPadOS",
    "Mac Catalyst",
    "macOS",
    "tvOS",
    "visionOS"
  ],
  "rawMarkdown" : "---\nsource: https:\/\/developer.apple.com\/documentation\/CoreImage\/CIFilter-swift.class\/colorPolynomial()\ncrawled: 2025-12-06T10:28:02Z\n---\n\n# colorPolynomial()\n\n**Type Method**\n\nAlters an image’s colors.\n\n## Declaration\n\n```swift\nclass func colorPolynomial() -> any CIFilter & CIColorPolynomial\n```\n\n## Return Value\n\nThe modified image.\n\n## Discussion\n\nThis method applies the color polynomial filter to an image. The effect calculates the sum of each pixel’s color component value and the coefficient properties together to produce the output image.\n\nThe color polynomial filter uses the following properties:\n\n\n\nThe following code creates a filter that adds a lighter contrast to the input image:\n\n```swift\nfunc colorPolynomial(inputImage: CIImage) -> CIImage {\n    let colorPolynomialFilter = CIFilter.colorPolynomial()\n    colorPolynomialFilter.alphaCoefficients = CIVector (x: 0, y: 0.6, z: 0, w: 0)\n    colorPolynomialFilter.redCoefficients = CIVector (x: 0, y: 1, z: 0.1, w: 0)\n    colorPolynomialFilter.greenCoefficients = CIVector(x: 0, y: 1, z: 0, w: 0)\n    colorPolynomialFilter.blueCoefficients = CIVector(x: 0, y: 1, z: 0, w: 0)\n    colorPolynomialFilter.inputImage = inputImage\n    return colorPolynomialFilter.outputImage!\n}\n```\n\n\n\n## Filters\n\n- **colorAbsoluteDifference()**: Calculates the absolute difference between each color component in the input images.\n- **colorClamp()**: Alters the colors in an image based on color components.\n- **colorControls()**: Alters the brightness, contrast, and saturation of an image’s colors.\n- **colorMatrix()**: Alters the colors in an image based on vectors provided.\n- **colorThreshold()**: Compares the red, green, and blue components of the input image to a threshold and sets them to 1 or 0.\n- **colorThresholdOtsu()**: Compares the red, green, and blue components of the input image against a threshold calculated using Otsu’s algorithm.\n- **depthToDisparity()**: Converts from an image containing depth data to an image containing disparity data.\n- **disparityToDepth()**: Creates depth data from an image containing disparity data.\n- **exposureAdjust()**: Adjusts an image’s exposure.\n- **gammaAdjust()**: Alters an image’s transition between black and white.\n- **hueAdjust()**: Modifies an image’s hue.\n- **linearToSRGBToneCurve()**: Alters an image’s color intensity.\n- **sRGBToneCurveToLinear()**: Converts the colors in an image from sRGB to linear.\n- **temperatureAndTint()**: Alters an image’s temperature and tint.\n- **toneCurve()**: Alters an image’s tone curve according to a series of data points.\n\n",
  "sections" : [
    {
      "content" : "",
      "items" : [
        {
          "description" : "Calculates the absolute difference between each color component in the input images.",
          "name" : "colorAbsoluteDifference()",
          "url" : "https:\/\/developer.apple.com\/documentation\/CoreImage\/CIFilter-swift.class\/colorAbsoluteDifference()"
        },
        {
          "description" : "Alters the colors in an image based on color components.",
          "name" : "colorClamp()",
          "url" : "https:\/\/developer.apple.com\/documentation\/CoreImage\/CIFilter-swift.class\/colorClamp()"
        },
        {
          "description" : "Alters the brightness, contrast, and saturation of an image’s colors.",
          "name" : "colorControls()",
          "url" : "https:\/\/developer.apple.com\/documentation\/CoreImage\/CIFilter-swift.class\/colorControls()"
        },
        {
          "description" : "Alters the colors in an image based on vectors provided.",
          "name" : "colorMatrix()",
          "url" : "https:\/\/developer.apple.com\/documentation\/CoreImage\/CIFilter-swift.class\/colorMatrix()"
        },
        {
          "description" : "Compares the red, green, and blue components of the input image to a threshold and sets them to 1 or 0.",
          "name" : "colorThreshold()",
          "url" : "https:\/\/developer.apple.com\/documentation\/CoreImage\/CIFilter-swift.class\/colorThreshold()"
        },
        {
          "description" : "Compares the red, green, and blue components of the input image against a threshold calculated using Otsu’s algorithm.",
          "name" : "colorThresholdOtsu()",
          "url" : "https:\/\/developer.apple.com\/documentation\/CoreImage\/CIFilter-swift.class\/colorThresholdOtsu()"
        },
        {
          "description" : "Converts from an image containing depth data to an image containing disparity data.",
          "name" : "depthToDisparity()",
          "url" : "https:\/\/developer.apple.com\/documentation\/CoreImage\/CIFilter-swift.class\/depthToDisparity()"
        },
        {
          "description" : "Creates depth data from an image containing disparity data.",
          "name" : "disparityToDepth()",
          "url" : "https:\/\/developer.apple.com\/documentation\/CoreImage\/CIFilter-swift.class\/disparityToDepth()"
        },
        {
          "description" : "Adjusts an image’s exposure.",
          "name" : "exposureAdjust()",
          "url" : "https:\/\/developer.apple.com\/documentation\/CoreImage\/CIFilter-swift.class\/exposureAdjust()"
        },
        {
          "description" : "Alters an image’s transition between black and white.",
          "name" : "gammaAdjust()",
          "url" : "https:\/\/developer.apple.com\/documentation\/CoreImage\/CIFilter-swift.class\/gammaAdjust()"
        },
        {
          "description" : "Modifies an image’s hue.",
          "name" : "hueAdjust()",
          "url" : "https:\/\/developer.apple.com\/documentation\/CoreImage\/CIFilter-swift.class\/hueAdjust()"
        },
        {
          "description" : "Alters an image’s color intensity.",
          "name" : "linearToSRGBToneCurve()",
          "url" : "https:\/\/developer.apple.com\/documentation\/CoreImage\/CIFilter-swift.class\/linearToSRGBToneCurve()"
        },
        {
          "description" : "Converts the colors in an image from sRGB to linear.",
          "name" : "sRGBToneCurveToLinear()",
          "url" : "https:\/\/developer.apple.com\/documentation\/CoreImage\/CIFilter-swift.class\/sRGBToneCurveToLinear()"
        },
        {
          "description" : "Alters an image’s temperature and tint.",
          "name" : "temperatureAndTint()",
          "url" : "https:\/\/developer.apple.com\/documentation\/CoreImage\/CIFilter-swift.class\/temperatureAndTint()"
        },
        {
          "description" : "Alters an image’s tone curve according to a series of data points.",
          "name" : "toneCurve()",
          "url" : "https:\/\/developer.apple.com\/documentation\/CoreImage\/CIFilter-swift.class\/toneCurve()"
        }
      ],
      "title" : "Filters"
    }
  ],
  "source" : "appleJSON",
  "title" : "colorPolynomial()",
  "url" : "https:\/\/developer.apple.com\/documentation\/CoreImage\/CIFilter-swift.class\/colorPolynomial()"
}