{
  "abstract" : "Subtracts overlapping area of two images to create the output image.",
  "codeExamples" : [
    {
      "code" : "func sourceOutCompositing(inputImage: CIImage, backgroundImage: CIImage) -> CIImage {\n    let colorBlendFilter = CIFilter.sourceOutCompositing()\n    colorBlendFilter.inputImage = inputImage\n    colorBlendFilter.backgroundImage = backgroundImage\n    return colorBlendFilter.outputImage!\n}",
      "language" : "swift"
    }
  ],
  "contentHash" : "80bf10d475ed06c761367c47720a9bec8ba5ccfe7cd2852b939b1ec7f676c2c7",
  "crawledAt" : "2025-12-06T10:29:55Z",
  "declaration" : {
    "code" : "class func sourceOutCompositing() -> any CIFilter & CICompositeOperation",
    "language" : "swift"
  },
  "id" : "63FF17AE-D07B-4D21-B1B8-29685AE5BEC1",
  "kind" : "method",
  "language" : "swift",
  "module" : "Core Image",
  "overview" : "## Return Value\n\nThe modified image.\n\n## Discussion\n\nThis method applies the source-out compositing filter to an image. The effect creates the result by overlaying the input image over the background image. The filter then removes the overlapping area of the background image from the result.\n\nThe source-out compositing filter uses the following properties:\n\nThe following code creates a filter that results in an output image that shows the portion of the background image that doesn’t overlap with the input image:\n\n",
  "platforms" : [
    "iOS",
    "iPadOS",
    "Mac Catalyst",
    "macOS",
    "tvOS",
    "visionOS"
  ],
  "rawMarkdown" : "---\nsource: https:\/\/developer.apple.com\/documentation\/CoreImage\/CIFilter-swift.class\/sourceOutCompositing()\ncrawled: 2025-12-06T10:29:55Z\n---\n\n# sourceOutCompositing()\n\n**Type Method**\n\nSubtracts overlapping area of two images to create the output image.\n\n## Declaration\n\n```swift\nclass func sourceOutCompositing() -> any CIFilter & CICompositeOperation\n```\n\n## Return Value\n\nThe modified image.\n\n## Discussion\n\nThis method applies the source-out compositing filter to an image. The effect creates the result by overlaying the input image over the background image. The filter then removes the overlapping area of the background image from the result.\n\nThe source-out compositing filter uses the following properties:\n\n\n\nThe following code creates a filter that results in an output image that shows the portion of the background image that doesn’t overlap with the input image:\n\n```swift\nfunc sourceOutCompositing(inputImage: CIImage, backgroundImage: CIImage) -> CIImage {\n    let colorBlendFilter = CIFilter.sourceOutCompositing()\n    colorBlendFilter.inputImage = inputImage\n    colorBlendFilter.backgroundImage = backgroundImage\n    return colorBlendFilter.outputImage!\n}\n```\n\n\n\n## Filters\n\n- **additionCompositing()**: Blends colors from two images by addition.\n- **colorBlendMode()**: Blends color from two images using the luminance values from the background image and the hue and saturation values from the input image.\n- **colorBurnBlendMode()**: Blends color from two images while darkening the image.\n- **colorDodgeBlendMode()**: Blends color from two images using dodging.\n- **darkenBlendMode()**: Blends colors from two images while darkening lighter pixels.\n- **differenceBlendMode()**: Subtracts color values to blend colors.\n- **divideBlendMode()**: Divides color values to blend colors.\n- **exclusionBlendMode()**: Subtracts color values to blend colors with less contrast.\n- **hardLightBlendMode()**: Blends colors of two images by screening and multiplying.\n- **hueBlendMode()**: Blends colors of two images by computing the sum of image color values.\n- **lightenBlendMode()**: Blends colors from two images by brightening colors.\n- **linearBurnBlendMode()**: Blends color from two images while increasing contrast.\n- **linearDodgeBlendMode()**: Blends colors of two images with dodging.\n- **linearLightBlendMode()**: A combination of linear burn and linear dodge blend modes.\n- **luminosityBlendMode()**: Blends color from two images by calculating the color, hue, and saturation.\n\n",
  "sections" : [
    {
      "content" : "",
      "items" : [
        {
          "description" : "Blends colors from two images by addition.",
          "name" : "additionCompositing()",
          "url" : "https:\/\/developer.apple.com\/documentation\/CoreImage\/CIFilter-swift.class\/additionCompositing()"
        },
        {
          "description" : "Blends color from two images using the luminance values from the background image and the hue and saturation values from the input image.",
          "name" : "colorBlendMode()",
          "url" : "https:\/\/developer.apple.com\/documentation\/CoreImage\/CIFilter-swift.class\/colorBlendMode()"
        },
        {
          "description" : "Blends color from two images while darkening the image.",
          "name" : "colorBurnBlendMode()",
          "url" : "https:\/\/developer.apple.com\/documentation\/CoreImage\/CIFilter-swift.class\/colorBurnBlendMode()"
        },
        {
          "description" : "Blends color from two images using dodging.",
          "name" : "colorDodgeBlendMode()",
          "url" : "https:\/\/developer.apple.com\/documentation\/CoreImage\/CIFilter-swift.class\/colorDodgeBlendMode()"
        },
        {
          "description" : "Blends colors from two images while darkening lighter pixels.",
          "name" : "darkenBlendMode()",
          "url" : "https:\/\/developer.apple.com\/documentation\/CoreImage\/CIFilter-swift.class\/darkenBlendMode()"
        },
        {
          "description" : "Subtracts color values to blend colors.",
          "name" : "differenceBlendMode()",
          "url" : "https:\/\/developer.apple.com\/documentation\/CoreImage\/CIFilter-swift.class\/differenceBlendMode()"
        },
        {
          "description" : "Divides color values to blend colors.",
          "name" : "divideBlendMode()",
          "url" : "https:\/\/developer.apple.com\/documentation\/CoreImage\/CIFilter-swift.class\/divideBlendMode()"
        },
        {
          "description" : "Subtracts color values to blend colors with less contrast.",
          "name" : "exclusionBlendMode()",
          "url" : "https:\/\/developer.apple.com\/documentation\/CoreImage\/CIFilter-swift.class\/exclusionBlendMode()"
        },
        {
          "description" : "Blends colors of two images by screening and multiplying.",
          "name" : "hardLightBlendMode()",
          "url" : "https:\/\/developer.apple.com\/documentation\/CoreImage\/CIFilter-swift.class\/hardLightBlendMode()"
        },
        {
          "description" : "Blends colors of two images by computing the sum of image color values.",
          "name" : "hueBlendMode()",
          "url" : "https:\/\/developer.apple.com\/documentation\/CoreImage\/CIFilter-swift.class\/hueBlendMode()"
        },
        {
          "description" : "Blends colors from two images by brightening colors.",
          "name" : "lightenBlendMode()",
          "url" : "https:\/\/developer.apple.com\/documentation\/CoreImage\/CIFilter-swift.class\/lightenBlendMode()"
        },
        {
          "description" : "Blends color from two images while increasing contrast.",
          "name" : "linearBurnBlendMode()",
          "url" : "https:\/\/developer.apple.com\/documentation\/CoreImage\/CIFilter-swift.class\/linearBurnBlendMode()"
        },
        {
          "description" : "Blends colors of two images with dodging.",
          "name" : "linearDodgeBlendMode()",
          "url" : "https:\/\/developer.apple.com\/documentation\/CoreImage\/CIFilter-swift.class\/linearDodgeBlendMode()"
        },
        {
          "description" : "A combination of linear burn and linear dodge blend modes.",
          "name" : "linearLightBlendMode()",
          "url" : "https:\/\/developer.apple.com\/documentation\/CoreImage\/CIFilter-swift.class\/linearLightBlendMode()"
        },
        {
          "description" : "Blends color from two images by calculating the color, hue, and saturation.",
          "name" : "luminosityBlendMode()",
          "url" : "https:\/\/developer.apple.com\/documentation\/CoreImage\/CIFilter-swift.class\/luminosityBlendMode()"
        }
      ],
      "title" : "Filters"
    }
  ],
  "source" : "appleJSON",
  "title" : "sourceOutCompositing()",
  "url" : "https:\/\/developer.apple.com\/documentation\/CoreImage\/CIFilter-swift.class\/sourceOutCompositing()"
}