{
  "abstract" : "Exports an input or output key of an object in the filter chain.",
  "codeExamples" : [

  ],
  "contentHash" : "db6911e80c8bd9b97731cfed41800d279216c18fd765ba59349a55686a54f777",
  "crawledAt" : "2025-12-06T10:40:28Z",
  "declaration" : {
    "code" : "func exportKey(_ key: String, from targetObject: Any, withName exportedKeyName: String?)",
    "language" : "swift"
  },
  "id" : "3E0AACEB-8AB1-4574-B75C-028EF1AFF8A3",
  "kind" : "method",
  "language" : "swift",
  "module" : "Core Image",
  "overview" : "## Discussion\n\nWhen you create a [doc:\/\/com.apple.coreimage\/documentation\/CoreImage\/CIFilter-swift.class] object from a [doc:\/\/com.apple.coreimage\/documentation\/CoreImage\/CIFilterGenerator] object, you might want the filter client to be able to set some of the parameters associated with the filter chain. You can make a parameter settable by  exporting the key associated with the parameter. If the exported key represents an input parameter of the filter, the key is exported as an input key. If the key represents an output parameter, it is exported as an output key.",
  "platforms" : [
    "macOS"
  ],
  "rawMarkdown" : "---\nsource: https:\/\/developer.apple.com\/documentation\/CoreImage\/CIFilterGenerator\/exportKey(_:from:withName:)\ncrawled: 2025-12-06T10:40:28Z\n---\n\n# exportKey(_:from:withName:)\n\n**Instance Method**\n\nExports an input or output key of an object in the filter chain.\n\n## Declaration\n\n```swift\nfunc exportKey(_ key: String, from targetObject: Any, withName exportedKeyName: String?)\n```\n\n## Parameters\n\n- **key**: The key to export from the target object (for example, `inputImage`).\n- **targetObject**: The object associated with the key (for example, the filter).\n- **exportedKeyName**: A unique name to use for the exported key. Pass `nil` to use the original key name.\n\n## Discussion\n\nWhen you create a [doc:\/\/com.apple.coreimage\/documentation\/CoreImage\/CIFilter-swift.class] object from a [doc:\/\/com.apple.coreimage\/documentation\/CoreImage\/CIFilterGenerator] object, you might want the filter client to be able to set some of the parameters associated with the filter chain. You can make a parameter settable by  exporting the key associated with the parameter. If the exported key represents an input parameter of the filter, the key is exported as an input key. If the key represents an output parameter, it is exported as an output key.\n\n## Managing Exported Keys\n\n- **exportedKeys**: Returns an array of the exported keys.\n- **removeExportedKey(_:)**: Removes a key that was previously exported.\n- **setAttributes(_:forExportedKey:)**: Sets a dictionary of attributes for an exported key.\n\n",
  "sections" : [
    {
      "content" : "",
      "items" : [
        {
          "description" : "Returns an array of the exported keys.",
          "name" : "exportedKeys",
          "url" : "https:\/\/developer.apple.com\/documentation\/CoreImage\/CIFilterGenerator\/exportedKeys"
        },
        {
          "description" : "Removes a key that was previously exported.",
          "name" : "removeExportedKey(_:)",
          "url" : "https:\/\/developer.apple.com\/documentation\/CoreImage\/CIFilterGenerator\/removeExportedKey(_:)"
        },
        {
          "description" : "Sets a dictionary of attributes for an exported key.",
          "name" : "setAttributes(_:forExportedKey:)",
          "url" : "https:\/\/developer.apple.com\/documentation\/CoreImage\/CIFilterGenerator\/setAttributes(_:forExportedKey:)"
        }
      ],
      "title" : "Managing Exported Keys"
    }
  ],
  "source" : "appleJSON",
  "title" : "exportKey(_:from:withName:)",
  "url" : "https:\/\/developer.apple.com\/documentation\/CoreImage\/CIFilterGenerator\/exportKey(_:from:withName:)"
}