{
  "abstract" : "Blends two images by using a blue mask image.",
  "codeExamples" : [
    {
      "code" : "func blendWithBlueMask(inputimage: CIImage, backgroundimage: CIImage, maskimage: CIImage) -> CIImage {\n    let  blendWithBlueMaskFilter = CIFilter.blendWithBlueMask()\n    blendWithBlueMaskFilter.inputImage = inputimage\n    blendWithBlueMaskFilter.maskImage = maskimage\n    blendWithBlueMaskFilter.backgroundImage = backgroundimage\n    return blendWithBlueMaskFilter.outputImage!\n}",
      "language" : "swift"
    }
  ],
  "contentHash" : "07a5c811e371b47936b0ffbcef7f94d8eb23f304a463787cff830a6362b13907",
  "crawledAt" : "2025-12-06T10:35:11Z",
  "declaration" : {
    "code" : "class func blendWithBlueMask() -> any CIFilter & CIBlendWithMask",
    "language" : "swift"
  },
  "id" : "EEC07D67-97A9-4D45-B441-7C4DD4E6F6E9",
  "kind" : "method",
  "language" : "swift",
  "module" : "Core Image",
  "overview" : "## Return Value\n\nThe modified image.\n\n## Discussion\n\nThis method applies the blend with blue mask filter to an image. The effect uses values from the blue mask image to interpolate between the input and background images. The mask image is made of shades of blue that define the strength of the interpolation from zero (where the mask image is black) to the specified `radius` (where the mask image is blue).\n\nThe blend with blue mask filter uses the following properties:\n\nThe following code creates a filter that results in the replacement of blue in the mask image with the detail of the input image:\n\n",
  "platforms" : [
    "iOS",
    "iPadOS",
    "Mac Catalyst",
    "macOS",
    "tvOS",
    "visionOS"
  ],
  "rawMarkdown" : "---\nsource: https:\/\/developer.apple.com\/documentation\/CoreImage\/CIFilter-swift.class\/blendWithBlueMask()\ncrawled: 2025-12-06T10:35:11Z\n---\n\n# blendWithBlueMask()\n\n**Type Method**\n\nBlends two images by using a blue mask image.\n\n## Declaration\n\n```swift\nclass func blendWithBlueMask() -> any CIFilter & CIBlendWithMask\n```\n\n## Return Value\n\nThe modified image.\n\n## Discussion\n\nThis method applies the blend with blue mask filter to an image. The effect uses values from the blue mask image to interpolate between the input and background images. The mask image is made of shades of blue that define the strength of the interpolation from zero (where the mask image is black) to the specified `radius` (where the mask image is blue).\n\nThe blend with blue mask filter uses the following properties:\n\n\n\nThe following code creates a filter that results in the replacement of blue in the mask image with the detail of the input image:\n\n```swift\nfunc blendWithBlueMask(inputimage: CIImage, backgroundimage: CIImage, maskimage: CIImage) -> CIImage {\n    let  blendWithBlueMaskFilter = CIFilter.blendWithBlueMask()\n    blendWithBlueMaskFilter.inputImage = inputimage\n    blendWithBlueMaskFilter.maskImage = maskimage\n    blendWithBlueMaskFilter.backgroundImage = backgroundimage\n    return blendWithBlueMaskFilter.outputImage!\n}\n```\n\n\n\n## Filters\n\n- **blendWithAlphaMask()**: Blends two images by using an alpha mask image.\n- **blendWithMask()**: Blends two images by using a mask image.\n- **blendWithRedMask()**: Blends two images by using a red mask image.\n- **bloom()**: Adjusts an image’s colors by applying a blur effect.\n- **cannyEdgeDetector()**: Applies the Canny edge-detection algorithm to an image.\n- **comicEffect()**: Creates an image with a comic book effect.\n- **coreMLModel()**: Filters an image with a Core ML model.\n- **crystallize()**: Creates an image made with a series of colorful polygons.\n- **depthOfField()**: Simulates a depth of field effect.\n- **edges()**: Hilghlights edges of objects found within an image.\n- **edgeWork()**: Produces a black-and-white image that looks similar to a woodblock print.\n- **gaborGradients()**: Highlights textures in an image.\n- **gloom()**: Adjusts an image’s color by applying a gloom filter.\n- **heightFieldFromMask()**: Creates a realistic shaded height-field image.\n- **hexagonalPixellate()**: Creates an image made of a series of colorful hexagons.\n\n",
  "sections" : [
    {
      "content" : "",
      "items" : [
        {
          "description" : "Blends two images by using an alpha mask image.",
          "name" : "blendWithAlphaMask()",
          "url" : "https:\/\/developer.apple.com\/documentation\/CoreImage\/CIFilter-swift.class\/blendWithAlphaMask()"
        },
        {
          "description" : "Blends two images by using a mask image.",
          "name" : "blendWithMask()",
          "url" : "https:\/\/developer.apple.com\/documentation\/CoreImage\/CIFilter-swift.class\/blendWithMask()"
        },
        {
          "description" : "Blends two images by using a red mask image.",
          "name" : "blendWithRedMask()",
          "url" : "https:\/\/developer.apple.com\/documentation\/CoreImage\/CIFilter-swift.class\/blendWithRedMask()"
        },
        {
          "description" : "Adjusts an image’s colors by applying a blur effect.",
          "name" : "bloom()",
          "url" : "https:\/\/developer.apple.com\/documentation\/CoreImage\/CIFilter-swift.class\/bloom()"
        },
        {
          "description" : "Applies the Canny edge-detection algorithm to an image.",
          "name" : "cannyEdgeDetector()",
          "url" : "https:\/\/developer.apple.com\/documentation\/CoreImage\/CIFilter-swift.class\/cannyEdgeDetector()"
        },
        {
          "description" : "Creates an image with a comic book effect.",
          "name" : "comicEffect()",
          "url" : "https:\/\/developer.apple.com\/documentation\/CoreImage\/CIFilter-swift.class\/comicEffect()"
        },
        {
          "description" : "Filters an image with a Core ML model.",
          "name" : "coreMLModel()",
          "url" : "https:\/\/developer.apple.com\/documentation\/CoreImage\/CIFilter-swift.class\/coreMLModel()"
        },
        {
          "description" : "Creates an image made with a series of colorful polygons.",
          "name" : "crystallize()",
          "url" : "https:\/\/developer.apple.com\/documentation\/CoreImage\/CIFilter-swift.class\/crystallize()"
        },
        {
          "description" : "Simulates a depth of field effect.",
          "name" : "depthOfField()",
          "url" : "https:\/\/developer.apple.com\/documentation\/CoreImage\/CIFilter-swift.class\/depthOfField()"
        },
        {
          "description" : "Hilghlights edges of objects found within an image.",
          "name" : "edges()",
          "url" : "https:\/\/developer.apple.com\/documentation\/CoreImage\/CIFilter-swift.class\/edges()"
        },
        {
          "description" : "Produces a black-and-white image that looks similar to a woodblock print.",
          "name" : "edgeWork()",
          "url" : "https:\/\/developer.apple.com\/documentation\/CoreImage\/CIFilter-swift.class\/edgeWork()"
        },
        {
          "description" : "Highlights textures in an image.",
          "name" : "gaborGradients()",
          "url" : "https:\/\/developer.apple.com\/documentation\/CoreImage\/CIFilter-swift.class\/gaborGradients()"
        },
        {
          "description" : "Adjusts an image’s color by applying a gloom filter.",
          "name" : "gloom()",
          "url" : "https:\/\/developer.apple.com\/documentation\/CoreImage\/CIFilter-swift.class\/gloom()"
        },
        {
          "description" : "Creates a realistic shaded height-field image.",
          "name" : "heightFieldFromMask()",
          "url" : "https:\/\/developer.apple.com\/documentation\/CoreImage\/CIFilter-swift.class\/heightFieldFromMask()"
        },
        {
          "description" : "Creates an image made of a series of colorful hexagons.",
          "name" : "hexagonalPixellate()",
          "url" : "https:\/\/developer.apple.com\/documentation\/CoreImage\/CIFilter-swift.class\/hexagonalPixellate()"
        }
      ],
      "title" : "Filters"
    }
  ],
  "source" : "appleJSON",
  "title" : "blendWithBlueMask()",
  "url" : "https:\/\/developer.apple.com\/documentation\/CoreImage\/CIFilter-swift.class\/blendWithBlueMask()"
}