{
  "abstract" : "Divides color values to blend colors.",
  "codeExamples" : [
    {
      "code" : "func divideBlendMode(inputImage: CIImage, backgroundImage: CIImage) -> CIImage {\n    let divideBlendMode = CIFilter.divideBlendMode()\n    divideBlendMode.inputImage = inputImage\n    divideBlendMode.backgroundImage = backgroundImage\n    return divideBlendMode.outputImage!\n}",
      "language" : "swift"
    }
  ],
  "contentHash" : "c7ab91753d39a630a100310d41fe53e2df276ef15bfa6da52b4964d818aebc9e",
  "crawledAt" : "2025-12-06T10:29:40Z",
  "declaration" : {
    "code" : "class func divideBlendMode() -> any CIFilter & CICompositeOperation",
    "language" : "swift"
  },
  "id" : "16DC0032-4BB4-466B-A39D-B53762F7BACD",
  "kind" : "method",
  "language" : "swift",
  "module" : "Core Image",
  "overview" : "## Return Value\n\nThe modified image.\n\n## Discussion\n\nThis method applies the divide-blend mode filter to an image. The effect divides the background image color values by the color values of the input image, resulting in the output image.\n\nThe divide-blend mode filter uses the following properties:\n\nThe following code creates a filter that brightens and inverts colors in the background image:\n\n",
  "platforms" : [
    "iOS",
    "iPadOS",
    "Mac Catalyst",
    "macOS",
    "tvOS",
    "visionOS"
  ],
  "rawMarkdown" : "---\nsource: https:\/\/developer.apple.com\/documentation\/CoreImage\/CIFilter-swift.class\/divideBlendMode()\ncrawled: 2025-12-06T10:29:40Z\n---\n\n# divideBlendMode()\n\n**Type Method**\n\nDivides color values to blend colors.\n\n## Declaration\n\n```swift\nclass func divideBlendMode() -> any CIFilter & CICompositeOperation\n```\n\n## Return Value\n\nThe modified image.\n\n## Discussion\n\nThis method applies the divide-blend mode filter to an image. The effect divides the background image color values by the color values of the input image, resulting in the output image.\n\nThe divide-blend mode filter uses the following properties:\n\n\n\nThe following code creates a filter that brightens and inverts colors in the background image:\n\n```swift\nfunc divideBlendMode(inputImage: CIImage, backgroundImage: CIImage) -> CIImage {\n    let divideBlendMode = CIFilter.divideBlendMode()\n    divideBlendMode.inputImage = inputImage\n    divideBlendMode.backgroundImage = backgroundImage\n    return divideBlendMode.outputImage!\n}\n```\n\n\n\n## Filters\n\n- **additionCompositing()**: Blends colors from two images by addition.\n- **colorBlendMode()**: Blends color from two images using the luminance values from the background image and the hue and saturation values from the input image.\n- **colorBurnBlendMode()**: Blends color from two images while darkening the image.\n- **colorDodgeBlendMode()**: Blends color from two images using dodging.\n- **darkenBlendMode()**: Blends colors from two images while darkening lighter pixels.\n- **differenceBlendMode()**: Subtracts color values to blend colors.\n- **exclusionBlendMode()**: Subtracts color values to blend colors with less contrast.\n- **hardLightBlendMode()**: Blends colors of two images by screening and multiplying.\n- **hueBlendMode()**: Blends colors of two images by computing the sum of image color values.\n- **lightenBlendMode()**: Blends colors from two images by brightening colors.\n- **linearBurnBlendMode()**: Blends color from two images while increasing contrast.\n- **linearDodgeBlendMode()**: Blends colors of two images with dodging.\n- **linearLightBlendMode()**: A combination of linear burn and linear dodge blend modes.\n- **luminosityBlendMode()**: Blends color from two images by calculating the color, hue, and saturation.\n- **minimumCompositing()**: Blends colors from two images by computing minimum values.\n\n",
  "sections" : [
    {
      "content" : "",
      "items" : [
        {
          "description" : "Blends colors from two images by addition.",
          "name" : "additionCompositing()",
          "url" : "https:\/\/developer.apple.com\/documentation\/CoreImage\/CIFilter-swift.class\/additionCompositing()"
        },
        {
          "description" : "Blends color from two images using the luminance values from the background image and the hue and saturation values from the input image.",
          "name" : "colorBlendMode()",
          "url" : "https:\/\/developer.apple.com\/documentation\/CoreImage\/CIFilter-swift.class\/colorBlendMode()"
        },
        {
          "description" : "Blends color from two images while darkening the image.",
          "name" : "colorBurnBlendMode()",
          "url" : "https:\/\/developer.apple.com\/documentation\/CoreImage\/CIFilter-swift.class\/colorBurnBlendMode()"
        },
        {
          "description" : "Blends color from two images using dodging.",
          "name" : "colorDodgeBlendMode()",
          "url" : "https:\/\/developer.apple.com\/documentation\/CoreImage\/CIFilter-swift.class\/colorDodgeBlendMode()"
        },
        {
          "description" : "Blends colors from two images while darkening lighter pixels.",
          "name" : "darkenBlendMode()",
          "url" : "https:\/\/developer.apple.com\/documentation\/CoreImage\/CIFilter-swift.class\/darkenBlendMode()"
        },
        {
          "description" : "Subtracts color values to blend colors.",
          "name" : "differenceBlendMode()",
          "url" : "https:\/\/developer.apple.com\/documentation\/CoreImage\/CIFilter-swift.class\/differenceBlendMode()"
        },
        {
          "description" : "Subtracts color values to blend colors with less contrast.",
          "name" : "exclusionBlendMode()",
          "url" : "https:\/\/developer.apple.com\/documentation\/CoreImage\/CIFilter-swift.class\/exclusionBlendMode()"
        },
        {
          "description" : "Blends colors of two images by screening and multiplying.",
          "name" : "hardLightBlendMode()",
          "url" : "https:\/\/developer.apple.com\/documentation\/CoreImage\/CIFilter-swift.class\/hardLightBlendMode()"
        },
        {
          "description" : "Blends colors of two images by computing the sum of image color values.",
          "name" : "hueBlendMode()",
          "url" : "https:\/\/developer.apple.com\/documentation\/CoreImage\/CIFilter-swift.class\/hueBlendMode()"
        },
        {
          "description" : "Blends colors from two images by brightening colors.",
          "name" : "lightenBlendMode()",
          "url" : "https:\/\/developer.apple.com\/documentation\/CoreImage\/CIFilter-swift.class\/lightenBlendMode()"
        },
        {
          "description" : "Blends color from two images while increasing contrast.",
          "name" : "linearBurnBlendMode()",
          "url" : "https:\/\/developer.apple.com\/documentation\/CoreImage\/CIFilter-swift.class\/linearBurnBlendMode()"
        },
        {
          "description" : "Blends colors of two images with dodging.",
          "name" : "linearDodgeBlendMode()",
          "url" : "https:\/\/developer.apple.com\/documentation\/CoreImage\/CIFilter-swift.class\/linearDodgeBlendMode()"
        },
        {
          "description" : "A combination of linear burn and linear dodge blend modes.",
          "name" : "linearLightBlendMode()",
          "url" : "https:\/\/developer.apple.com\/documentation\/CoreImage\/CIFilter-swift.class\/linearLightBlendMode()"
        },
        {
          "description" : "Blends color from two images by calculating the color, hue, and saturation.",
          "name" : "luminosityBlendMode()",
          "url" : "https:\/\/developer.apple.com\/documentation\/CoreImage\/CIFilter-swift.class\/luminosityBlendMode()"
        },
        {
          "description" : "Blends colors from two images by computing minimum values.",
          "name" : "minimumCompositing()",
          "url" : "https:\/\/developer.apple.com\/documentation\/CoreImage\/CIFilter-swift.class\/minimumCompositing()"
        }
      ],
      "title" : "Filters"
    }
  ],
  "source" : "appleJSON",
  "title" : "divideBlendMode()",
  "url" : "https:\/\/developer.apple.com\/documentation\/CoreImage\/CIFilter-swift.class\/divideBlendMode()"
}