{
  "abstract" : "Converts an image from CIELAB to RGB color space.",
  "codeExamples" : [
    {
      "code" : "func convertLabToRGB(inputImage: CIImage) -> CIImage {\n    let filter = CIFilter.convertLabToRGB()\n    filter.inputImage = inputImage\n    filter.normalize = true\n    return filter.outputImage!\n}",
      "language" : "swift"
    }
  ],
  "contentHash" : "60085b18d0d7e0a47547a969973e4ffb62e1dda6fd7b648baa6c9a69638a89a0",
  "crawledAt" : "2025-12-06T09:05:27Z",
  "declaration" : {
    "code" : "class func convertLabToRGB() -> any CIFilter & CIConvertLab",
    "language" : "swift"
  },
  "id" : "55902DD0-BE23-49AB-B9B7-FB6707CE62A2",
  "kind" : "method",
  "language" : "swift",
  "module" : "Core Image",
  "overview" : "## Return Value\n\nThe converted [doc:\/\/com.apple.coreimage\/documentation\/CoreImage\/CIImage].\n\n## Discussion\n\nThis filter converts an image from CIELAB color space to RGB. The CIELAB color space expresses color as three values: L* for the perceptual lightness, and a*b* for the colors red, green, blue, and yellow. The RGB color space expresses colors using the intensities of the three primary colors: red, green, and blue.\n\nThe following code applies the `convertLabToRGBFilter` to an image with the `normalize` flag set to the `true`:\n\n",
  "platforms" : [
    "iOS",
    "iPadOS",
    "Mac Catalyst",
    "macOS",
    "tvOS",
    "visionOS"
  ],
  "rawMarkdown" : "---\nsource: https:\/\/developer.apple.com\/documentation\/CoreImage\/CIFilter-swift.class\/convertLabToRGB()\ncrawled: 2025-12-06T09:05:27Z\n---\n\n# convertLabToRGB()\n\n**Type Method**\n\nConverts an image from CIELAB to RGB color space.\n\n## Declaration\n\n```swift\nclass func convertLabToRGB() -> any CIFilter & CIConvertLab\n```\n\n## Return Value\n\nThe converted [doc:\/\/com.apple.coreimage\/documentation\/CoreImage\/CIImage].\n\n## Discussion\n\nThis filter converts an image from CIELAB color space to RGB. The CIELAB color space expresses color as three values: L* for the perceptual lightness, and a*b* for the colors red, green, blue, and yellow. The RGB color space expresses colors using the intensities of the three primary colors: red, green, and blue.\n\n\n\nThe following code applies the `convertLabToRGBFilter` to an image with the `normalize` flag set to the `true`:\n\n```swift\nfunc convertLabToRGB(inputImage: CIImage) -> CIImage {\n    let filter = CIFilter.convertLabToRGB()\n    filter.inputImage = inputImage\n    filter.normalize = true\n    return filter.outputImage!\n}\n```\n\n\n\n## Color Effect Filters\n\n- **colorCrossPolynomial()**: Adjusts an image’s color by applying polynomial cross-products.\n- **colorCube()**: Adjusts an image’s pixels using a three-dimensional color table.\n- **colorCubeWithColorSpace()**: Adjusts an image’s pixels using a three-dimensional color table in specified color space.\n- **colorCubesMixedWithMask()**: Alters an image’s pixels using a three-dimensional color tables and a mask image.\n- **colorCurves()**: Adjusts an image’s color curves.\n- **colorInvert()**: Inverts an image’s colors.\n- **colorMap()**: Performs a transformation of the input image colors to colors from a gradient image.\n- **colorMonochrome()**: Adjusts an image’s colors to shades of a single color.\n- **colorPosterize()**: Flattens an image’s colors.\n- **convertRGBtoLab()**: Converts an image from RGB to CIELAB color space.\n- **dither()**: Applies randomized noise to produce a processed look.\n- **documentEnhancer()**: Adjusts an image’s shadows and contrast.\n- **falseColor()**: Replaces an image’s colors with specified colors.\n- **labDeltaE()**: Compares an image’s color values.\n- **maskToAlpha()**: Converts an image to a white image with an alpha component.\n\n",
  "sections" : [
    {
      "content" : "",
      "items" : [
        {
          "description" : "Adjusts an image’s color by applying polynomial cross-products.",
          "name" : "colorCrossPolynomial()",
          "url" : "https:\/\/developer.apple.com\/documentation\/CoreImage\/CIFilter-swift.class\/colorCrossPolynomial()"
        },
        {
          "description" : "Adjusts an image’s pixels using a three-dimensional color table.",
          "name" : "colorCube()",
          "url" : "https:\/\/developer.apple.com\/documentation\/CoreImage\/CIFilter-swift.class\/colorCube()"
        },
        {
          "description" : "Adjusts an image’s pixels using a three-dimensional color table in specified color space.",
          "name" : "colorCubeWithColorSpace()",
          "url" : "https:\/\/developer.apple.com\/documentation\/CoreImage\/CIFilter-swift.class\/colorCubeWithColorSpace()"
        },
        {
          "description" : "Alters an image’s pixels using a three-dimensional color tables and a mask image.",
          "name" : "colorCubesMixedWithMask()",
          "url" : "https:\/\/developer.apple.com\/documentation\/CoreImage\/CIFilter-swift.class\/colorCubesMixedWithMask()"
        },
        {
          "description" : "Adjusts an image’s color curves.",
          "name" : "colorCurves()",
          "url" : "https:\/\/developer.apple.com\/documentation\/CoreImage\/CIFilter-swift.class\/colorCurves()"
        },
        {
          "description" : "Inverts an image’s colors.",
          "name" : "colorInvert()",
          "url" : "https:\/\/developer.apple.com\/documentation\/CoreImage\/CIFilter-swift.class\/colorInvert()"
        },
        {
          "description" : "Performs a transformation of the input image colors to colors from a gradient image.",
          "name" : "colorMap()",
          "url" : "https:\/\/developer.apple.com\/documentation\/CoreImage\/CIFilter-swift.class\/colorMap()"
        },
        {
          "description" : "Adjusts an image’s colors to shades of a single color.",
          "name" : "colorMonochrome()",
          "url" : "https:\/\/developer.apple.com\/documentation\/CoreImage\/CIFilter-swift.class\/colorMonochrome()"
        },
        {
          "description" : "Flattens an image’s colors.",
          "name" : "colorPosterize()",
          "url" : "https:\/\/developer.apple.com\/documentation\/CoreImage\/CIFilter-swift.class\/colorPosterize()"
        },
        {
          "description" : "Converts an image from RGB to CIELAB color space.",
          "name" : "convertRGBtoLab()",
          "url" : "https:\/\/developer.apple.com\/documentation\/CoreImage\/CIFilter-swift.class\/convertRGBtoLab()"
        },
        {
          "description" : "Applies randomized noise to produce a processed look.",
          "name" : "dither()",
          "url" : "https:\/\/developer.apple.com\/documentation\/CoreImage\/CIFilter-swift.class\/dither()"
        },
        {
          "description" : "Adjusts an image’s shadows and contrast.",
          "name" : "documentEnhancer()",
          "url" : "https:\/\/developer.apple.com\/documentation\/CoreImage\/CIFilter-swift.class\/documentEnhancer()"
        },
        {
          "description" : "Replaces an image’s colors with specified colors.",
          "name" : "falseColor()",
          "url" : "https:\/\/developer.apple.com\/documentation\/CoreImage\/CIFilter-swift.class\/falseColor()"
        },
        {
          "description" : "Compares an image’s color values.",
          "name" : "labDeltaE()",
          "url" : "https:\/\/developer.apple.com\/documentation\/CoreImage\/CIFilter-swift.class\/labDeltaE()"
        },
        {
          "description" : "Converts an image to a white image with an alpha component.",
          "name" : "maskToAlpha()",
          "url" : "https:\/\/developer.apple.com\/documentation\/CoreImage\/CIFilter-swift.class\/maskToAlpha()"
        }
      ],
      "title" : "Color Effect Filters"
    }
  ],
  "source" : "appleJSON",
  "title" : "convertLabToRGB()",
  "url" : "https:\/\/developer.apple.com\/documentation\/CoreImage\/CIFilter-swift.class\/convertLabToRGB()"
}