{
  "abstract" : "Initializes, using the specified format and options, an image with the contents of a specific data plane in an IOSurface.",
  "codeExamples" : [

  ],
  "contentHash" : "3c6137e1d3060ac44f698ddee1420cea4684fbd7fbfae44a46f1e2c6a4f4819d",
  "crawledAt" : "2025-12-04T22:58:06Z",
  "declaration" : {
    "code" : "init(ioSurface surface: IOSurfaceRef, plane: Int, format: CIFormat, options: [CIImageOption : Any]? = nil)",
    "language" : "swift"
  },
  "id" : "48586B82-C8E5-409B-841D-F7FA15FB293C",
  "kind" : "unknown",
  "language" : "swift",
  "module" : "Core Image",
  "overview" : "## Return Value\n\nAn image object initialized with the data from the IOSurface.",
  "platforms" : [
    "macOS"
  ],
  "rawMarkdown" : "---\nsource: https:\/\/developer.apple.com\/documentation\/CoreImage\/CIImage\/init(ioSurface:plane:format:options:)\ncrawled: 2025-12-04T22:58:06Z\n---\n\n# init(ioSurface:plane:format:options:)\n\n**Initializer**\n\nInitializes, using the specified format and options, an image with the contents of a specific data plane in an IOSurface.\n\n## Declaration\n\n```swift\ninit(ioSurface surface: IOSurfaceRef, plane: Int, format: CIFormat, options: [CIImageOption : Any]? = nil)\n```\n\n## Parameters\n\n- **surface**: An IOSurface object.\n- **plane**: The index of the data plane in the IOSurface object containing bitmap data for initializing the image.\n- **format**: A pixel format constant. See `Pixel Formats`.\n- **options**: A dictionary specifying image options. (See `Image Dictionary Keys`.)\n\n## Return Value\n\nAn image object initialized with the data from the IOSurface.\n\n## Deprecated\n\n- **init(cgLayer:)**: Initializes an image object  from the contents supplied by a CGLayer object.\n- **init(cgLayer:options:)**: Initializes an image object  from the contents supplied by a CGLayer object, using the  specified options.\n- **init(texture:size:flipped:colorSpace:)**: Initializes an image object with data supplied by an OpenGL texture.\n- **init(texture:size:flipped:options:)**: Initializes an image object with data supplied by an OpenGL texture.\n- **textureTarget**: The key for an OpenGL texture target.\n- **textureFormat**: The key for an OpenGL texture format.\n\n",
  "sections" : [
    {
      "content" : "",
      "items" : [
        {
          "description" : "Initializes an image object  from the contents supplied by a CGLayer object.",
          "name" : "init(cgLayer:)",
          "url" : "https:\/\/developer.apple.com\/documentation\/CoreImage\/CIImage\/init(cgLayer:)"
        },
        {
          "description" : "Initializes an image object  from the contents supplied by a CGLayer object, using the  specified options.",
          "name" : "init(cgLayer:options:)",
          "url" : "https:\/\/developer.apple.com\/documentation\/CoreImage\/CIImage\/init(cgLayer:options:)"
        },
        {
          "description" : "Initializes an image object with data supplied by an OpenGL texture.",
          "name" : "init(texture:size:flipped:colorSpace:)",
          "url" : "https:\/\/developer.apple.com\/documentation\/CoreImage\/CIImage\/init(texture:size:flipped:colorSpace:)"
        },
        {
          "description" : "Initializes an image object with data supplied by an OpenGL texture.",
          "name" : "init(texture:size:flipped:options:)",
          "url" : "https:\/\/developer.apple.com\/documentation\/CoreImage\/CIImage\/init(texture:size:flipped:options:)"
        },
        {
          "description" : "The key for an OpenGL texture target.",
          "name" : "textureTarget",
          "url" : "https:\/\/developer.apple.com\/documentation\/CoreImage\/CIImageOption\/textureTarget"
        },
        {
          "description" : "The key for an OpenGL texture format.",
          "name" : "textureFormat",
          "url" : "https:\/\/developer.apple.com\/documentation\/CoreImage\/CIImageOption\/textureFormat"
        }
      ],
      "title" : "Deprecated"
    }
  ],
  "source" : "appleJSON",
  "title" : "init(ioSurface:plane:format:options:)",
  "url" : "https:\/\/developer.apple.com\/documentation\/CoreImage\/CIImage\/init(ioSurface:plane:format:options:)"
}