{
  "abstract" : "Applies a square-shaped blur to an area of an image.",
  "codeExamples" : [
    {
      "code" : "    func boxBlur(inputImage: CIImage) -> CIImage? {\n\n        let boxBlurFilter = CIFilter.boxBlur()\n        boxBlurFilter.inputImage = inputImage\n        boxBlurFilter.radius = 10\n        return boxBlurFilter.outputImage\n    }",
      "language" : "swift"
    }
  ],
  "contentHash" : "7acc494c03b9abbf5a598796ffff090f181572ef1cc022c0eec951a4d5b87db7",
  "crawledAt" : "2025-12-04T21:31:00Z",
  "declaration" : {
    "code" : "class func boxBlur() -> any CIFilter & CIBoxBlur",
    "language" : "swift"
  },
  "id" : "B602FF29-9AAC-44B5-A2C4-F01F87EDE4BF",
  "kind" : "method",
  "language" : "swift",
  "module" : "Core Image",
  "overview" : "## Return Value\n\nThe blurred image.\n\n## Discussion\n\nThis method applies the box blur filter to an image. The effect targets a square area and calculates the median color value of the pixels to create the output image. The `radius` is the width of a square area with a larger area, resulting in a stronger blur effect on the output image.\n\nThe box blur filter uses the following properties:\n\nThe following code creates a filter that results in less detail in the input image:\n\n",
  "platforms" : [
    "iOS",
    "iPadOS",
    "Mac Catalyst",
    "macOS",
    "tvOS",
    "visionOS"
  ],
  "rawMarkdown" : "---\nsource: https:\/\/developer.apple.com\/documentation\/CoreImage\/CIFilter-swift.class\/boxBlur()\ncrawled: 2025-12-04T21:31:00Z\n---\n\n# boxBlur()\n\n**Type Method**\n\nApplies a square-shaped blur to an area of an image.\n\n## Declaration\n\n```swift\nclass func boxBlur() -> any CIFilter & CIBoxBlur\n```\n\n## Return Value\n\nThe blurred image.\n\n## Discussion\n\nThis method applies the box blur filter to an image. The effect targets a square area and calculates the median color value of the pixels to create the output image. The `radius` is the width of a square area with a larger area, resulting in a stronger blur effect on the output image.\n\nThe box blur filter uses the following properties:\n\n\n\nThe following code creates a filter that results in less detail in the input image:\n\n```swift\n    func boxBlur(inputImage: CIImage) -> CIImage? {\n\n        let boxBlurFilter = CIFilter.boxBlur()\n        boxBlurFilter.inputImage = inputImage\n        boxBlurFilter.radius = 10\n        return boxBlurFilter.outputImage\n    }\n```\n\n\n\n## Filters\n\n- **bokehBlur()**: Applies a bokeh effect to an image.\n- **discBlur()**: Applies a circle-shaped blur to an area of an image.\n- **gaussianBlur()**: Blurs an image with a Gaussian distribution pattern.\n- **maskedVariableBlur()**: Blurs a specified portion of an image.\n- **median()**: Calculates the median of an image to refine detail.\n- **morphologyGradient()**: Detects and highlights edges of objects.\n- **morphologyMaximum()**: Blurs a circular area by enlarging contrasting pixels.\n- **morphologyMinimum()**: Blurs a circular area by reducing contrasting pixels.\n- **morphologyRectangleMaximum()**: Blurs a rectangular area by enlarging contrasting pixels.\n- **morphologyRectangleMinimum()**: Blurs a rectangular area by reducing contrasting pixels.\n- **motionBlur()**: Creates motion blur on an image.\n- **noiseReduction()**: Reduces noise by sharpening the edges of objects.\n- **zoomBlur()**: Creates a zoom blur centered around a single point on the image.\n\n",
  "sections" : [
    {
      "content" : "",
      "items" : [
        {
          "description" : "Applies a bokeh effect to an image.",
          "name" : "bokehBlur()",
          "url" : "https:\/\/developer.apple.com\/documentation\/CoreImage\/CIFilter-swift.class\/bokehBlur()"
        },
        {
          "description" : "Applies a circle-shaped blur to an area of an image.",
          "name" : "discBlur()",
          "url" : "https:\/\/developer.apple.com\/documentation\/CoreImage\/CIFilter-swift.class\/discBlur()"
        },
        {
          "description" : "Blurs an image with a Gaussian distribution pattern.",
          "name" : "gaussianBlur()",
          "url" : "https:\/\/developer.apple.com\/documentation\/CoreImage\/CIFilter-swift.class\/gaussianBlur()"
        },
        {
          "description" : "Blurs a specified portion of an image.",
          "name" : "maskedVariableBlur()",
          "url" : "https:\/\/developer.apple.com\/documentation\/CoreImage\/CIFilter-swift.class\/maskedVariableBlur()"
        },
        {
          "description" : "Calculates the median of an image to refine detail.",
          "name" : "median()",
          "url" : "https:\/\/developer.apple.com\/documentation\/CoreImage\/CIFilter-swift.class\/median()"
        },
        {
          "description" : "Detects and highlights edges of objects.",
          "name" : "morphologyGradient()",
          "url" : "https:\/\/developer.apple.com\/documentation\/CoreImage\/CIFilter-swift.class\/morphologyGradient()"
        },
        {
          "description" : "Blurs a circular area by enlarging contrasting pixels.",
          "name" : "morphologyMaximum()",
          "url" : "https:\/\/developer.apple.com\/documentation\/CoreImage\/CIFilter-swift.class\/morphologyMaximum()"
        },
        {
          "description" : "Blurs a circular area by reducing contrasting pixels.",
          "name" : "morphologyMinimum()",
          "url" : "https:\/\/developer.apple.com\/documentation\/CoreImage\/CIFilter-swift.class\/morphologyMinimum()"
        },
        {
          "description" : "Blurs a rectangular area by enlarging contrasting pixels.",
          "name" : "morphologyRectangleMaximum()",
          "url" : "https:\/\/developer.apple.com\/documentation\/CoreImage\/CIFilter-swift.class\/morphologyRectangleMaximum()"
        },
        {
          "description" : "Blurs a rectangular area by reducing contrasting pixels.",
          "name" : "morphologyRectangleMinimum()",
          "url" : "https:\/\/developer.apple.com\/documentation\/CoreImage\/CIFilter-swift.class\/morphologyRectangleMinimum()"
        },
        {
          "description" : "Creates motion blur on an image.",
          "name" : "motionBlur()",
          "url" : "https:\/\/developer.apple.com\/documentation\/CoreImage\/CIFilter-swift.class\/motionBlur()"
        },
        {
          "description" : "Reduces noise by sharpening the edges of objects.",
          "name" : "noiseReduction()",
          "url" : "https:\/\/developer.apple.com\/documentation\/CoreImage\/CIFilter-swift.class\/noiseReduction()"
        },
        {
          "description" : "Creates a zoom blur centered around a single point on the image.",
          "name" : "zoomBlur()",
          "url" : "https:\/\/developer.apple.com\/documentation\/CoreImage\/CIFilter-swift.class\/zoomBlur()"
        }
      ],
      "title" : "Filters"
    }
  ],
  "source" : "appleJSON",
  "title" : "boxBlur()",
  "url" : "https:\/\/developer.apple.com\/documentation\/CoreImage\/CIFilter-swift.class\/boxBlur()"
}