{
  "abstract" : "Returns the application’s distributed notification center.",
  "codeExamples" : [

  ],
  "contentHash" : "c3f32455e1e85aec36e19539f10a7e86b6b9b576299cc00c6ece24a9f03bfedd",
  "crawledAt" : "2025-12-07T14:08:26Z",
  "declaration" : {
    "code" : "func CFNotificationCenterGetDistributedCenter() -> CFNotificationCenter!",
    "language" : "swift"
  },
  "id" : "33B5D30C-0611-4B63-AEE9-2D312E9D4D88",
  "kind" : "function",
  "language" : "swift",
  "module" : "Core Foundation",
  "overview" : "## Return Value\n\nThe application’s distributed notification center. An application has only one distributed notification center, so this function returns the same value each time it is called.\n\n## Discussion\n\nA distributed notification center delivers notifications between applications. A notification object used with a distributed notification center must always be a CFString object and the notification dictionary must contain only property list values.",
  "platforms" : [
    "macOS"
  ],
  "rawMarkdown" : "---\nsource: https:\/\/developer.apple.com\/documentation\/CoreFoundation\/CFNotificationCenterGetDistributedCenter()\ncrawled: 2025-12-07T14:08:26Z\n---\n\n# CFNotificationCenterGetDistributedCenter()\n\n**Function**\n\nReturns the application’s distributed notification center.\n\n## Declaration\n\n```swift\nfunc CFNotificationCenterGetDistributedCenter() -> CFNotificationCenter!\n```\n\n## Return Value\n\nThe application’s distributed notification center. An application has only one distributed notification center, so this function returns the same value each time it is called.\n\n## Discussion\n\nA distributed notification center delivers notifications between applications. A notification object used with a distributed notification center must always be a CFString object and the notification dictionary must contain only property list values.\n\n## Accessing a Notification Center\n\n- **CFNotificationCenterGetDarwinNotifyCenter()**: Returns the application’s Darwin notification center.\n- **CFNotificationCenterGetLocalCenter()**: Returns the application’s local notification center.\n\n",
  "sections" : [
    {
      "content" : "",
      "items" : [
        {
          "description" : "Returns the application’s Darwin notification center.",
          "name" : "CFNotificationCenterGetDarwinNotifyCenter()",
          "url" : "https:\/\/developer.apple.com\/documentation\/CoreFoundation\/CFNotificationCenterGetDarwinNotifyCenter()"
        },
        {
          "description" : "Returns the application’s local notification center.",
          "name" : "CFNotificationCenterGetLocalCenter()",
          "url" : "https:\/\/developer.apple.com\/documentation\/CoreFoundation\/CFNotificationCenterGetLocalCenter()"
        }
      ],
      "title" : "Accessing a Notification Center"
    }
  ],
  "source" : "appleJSON",
  "title" : "CFNotificationCenterGetDistributedCenter()",
  "url" : "https:\/\/developer.apple.com\/documentation\/CoreFoundation\/CFNotificationCenterGetDistributedCenter()"
}