{
  "abstract" : "Options used when resolving bookmark data.",
  "codeExamples" : [

  ],
  "contentHash" : "45f0acfdf7415a625ddb4e0fb2be982d7ffe8dd76f0cf61d891edc5a77e75810",
  "crawledAt" : "2025-12-07T14:20:04Z",
  "id" : "4830C77C-8F46-478C-9018-A7EC643067B3",
  "kind" : "collection",
  "language" : "swift",
  "module" : "Core Foundation",
  "overview" : "## Overview\n\nWhen resolving a bookmark to obtain a URL, use bitwise `OR` operators to combine the options you want to specify, and provide them to the `options` parameter of the [doc:\/\/com.apple.corefoundation\/documentation\/CoreFoundation\/CFURLCreateByResolvingBookmarkData(_:_:_:_:_:_:_:)] function.\n\n### Version-Notes\n\nSecurity-scoped bookmarks are not available in versions of macOS prior to OS X v10.7.3.",
  "rawMarkdown" : "---\nsource: https:\/\/developer.apple.com\/documentation\/CoreFoundation\/bookmark-data-resolution-options\ncrawled: 2025-12-07T14:20:04Z\n---\n\n# Bookmark Data Resolution Options\n\n**API Collection**\n\nOptions used when resolving bookmark data.\n\n## Overview\n\nWhen resolving a bookmark to obtain a URL, use bitwise `OR` operators to combine the options you want to specify, and provide them to the `options` parameter of the [doc:\/\/com.apple.corefoundation\/documentation\/CoreFoundation\/CFURLCreateByResolvingBookmarkData(_:_:_:_:_:_:_:)] function.\n\n### Version-Notes\n\nSecurity-scoped bookmarks are not available in versions of macOS prior to OS X v10.7.3.\n\n## Constants\n\n- **cfBookmarkResolutionWithoutUIMask**: Specifies that no UI feedback accompany resolution of the bookmark data.\n- **cfBookmarkResolutionWithoutMountingMask**: Specifies that no volume should be mounted during resolution of the bookmark data.\n- **cfurlBookmarkResolutionWithSecurityScope**: Specifies that the security scope, applied to the bookmark when it was created, should be used during resolution of the bookmark data.\n\n## Bookmark Data Constants\n\n- **Bookmark Data Creation Options**: Options used when creating bookmark data.\n\n",
  "sections" : [
    {
      "content" : "",
      "items" : [
        {
          "description" : "Specifies that no UI feedback accompany resolution of the bookmark data.",
          "name" : "cfBookmarkResolutionWithoutUIMask",
          "url" : "https:\/\/developer.apple.com\/documentation\/CoreFoundation\/CFURLBookmarkResolutionOptions\/cfBookmarkResolutionWithoutUIMask"
        },
        {
          "description" : "Specifies that no volume should be mounted during resolution of the bookmark data.",
          "name" : "cfBookmarkResolutionWithoutMountingMask",
          "url" : "https:\/\/developer.apple.com\/documentation\/CoreFoundation\/CFURLBookmarkResolutionOptions\/cfBookmarkResolutionWithoutMountingMask"
        },
        {
          "description" : "Specifies that the security scope, applied to the bookmark when it was created, should be used during resolution of the bookmark data.",
          "name" : "cfurlBookmarkResolutionWithSecurityScope",
          "url" : "https:\/\/developer.apple.com\/documentation\/CoreFoundation\/CFURLBookmarkResolutionOptions\/cfurlBookmarkResolutionWithSecurityScope"
        }
      ],
      "title" : "Constants"
    },
    {
      "content" : "",
      "items" : [
        {
          "description" : "Options used when creating bookmark data.",
          "name" : "Bookmark Data Creation Options",
          "url" : "https:\/\/developer.apple.com\/documentation\/CoreFoundation\/bookmark-data-creation-options"
        }
      ],
      "title" : "Bookmark Data Constants"
    }
  ],
  "source" : "appleJSON",
  "title" : "Bookmark Data Resolution Options",
  "url" : "https:\/\/developer.apple.com\/documentation\/CoreFoundation\/bookmark-data-resolution-options"
}