{
  "abstract" : "Returns the class of the value that will be returned for the specified binding.",
  "codeExamples" : [

  ],
  "contentHash" : "ffb77a183b6c9aa33a13ab785e1546b171b29d188dcd703b90d8d45afe277ba1",
  "crawledAt" : "2025-12-04T10:53:24Z",
  "declaration" : {
    "code" : "func valueClassForBinding(_ binding: NSBindingName) -> AnyClass?",
    "language" : "swift"
  },
  "id" : "B1B6FD81-D1E6-4B63-AACC-B8E89E47B975",
  "kind" : "method",
  "language" : "swift",
  "module" : "Objective-C Runtime",
  "overview" : "## Return Value\n\nThe class of the value that will be returned for `binding`.\n\n## Discussion\n\nThis method is used by Interface Builder to determine the appropriate transformers for a binding.\n\nImplementation of this method is optional.",
  "platforms" : [
    "macOS"
  ],
  "rawMarkdown" : "---\nsource: https:\/\/developer.apple.com\/documentation\/ObjectiveC\/NSObject-swift.class\/valueClassForBinding(_:)\ncrawled: 2025-12-04T10:53:24Z\n---\n\n# valueClassForBinding(_:)\n\n**Instance Method**\n\nReturns the class of the value that will be returned for the specified binding.\n\n## Declaration\n\n```swift\nfunc valueClassForBinding(_ binding: NSBindingName) -> AnyClass?\n```\n\n## Parameters\n\n- **binding**: The name of a binding.\n\n## Return Value\n\nThe class of the value that will be returned for `binding`.\n\n## Discussion\n\nThis method is used by Interface Builder to determine the appropriate transformers for a binding.\n\nImplementation of this method is optional.\n\n## Managing bindings\n\n- **bind(_:to:withKeyPath:options:)**: Establishes a binding between a given property of the receiver and the property of a given object specified by a given key path.\n- **optionDescriptionsForBinding(_:)**: Returns an array describing the options for the specified binding.\n- **infoForBinding(_:)**: Returns a dictionary describing the receiver’s `binding`.\n- **NSBindingInfoKey**\n- **unbind(_:)**: Removes a given binding between the receiver and a controller.\n- **NSIsControllerMarker(_:)**: Tests whether a given object is special marker object used for indicating the state of a selection in relation to a key.\n\n",
  "sections" : [
    {
      "content" : "",
      "items" : [
        {
          "description" : "Establishes a binding between a given property of the receiver and the property of a given object specified by a given key path.",
          "name" : "bind(_:to:withKeyPath:options:)",
          "url" : "https:\/\/developer.apple.com\/documentation\/ObjectiveC\/NSObject-swift.class\/bind(_:to:withKeyPath:options:)"
        },
        {
          "description" : "Returns an array describing the options for the specified binding.",
          "name" : "optionDescriptionsForBinding(_:)",
          "url" : "https:\/\/developer.apple.com\/documentation\/ObjectiveC\/NSObject-swift.class\/optionDescriptionsForBinding(_:)"
        },
        {
          "description" : "Returns a dictionary describing the receiver’s `binding`.",
          "name" : "infoForBinding(_:)",
          "url" : "https:\/\/developer.apple.com\/documentation\/ObjectiveC\/NSObject-swift.class\/infoForBinding(_:)"
        },
        {
          "description" : "",
          "name" : "NSBindingInfoKey",
          "url" : "https:\/\/developer.apple.com\/documentation\/AppKit\/NSBindingInfoKey"
        },
        {
          "description" : "Removes a given binding between the receiver and a controller.",
          "name" : "unbind(_:)",
          "url" : "https:\/\/developer.apple.com\/documentation\/ObjectiveC\/NSObject-swift.class\/unbind(_:)"
        },
        {
          "description" : "Tests whether a given object is special marker object used for indicating the state of a selection in relation to a key.",
          "name" : "NSIsControllerMarker(_:)",
          "url" : "https:\/\/developer.apple.com\/documentation\/AppKit\/NSIsControllerMarker(_:)"
        }
      ],
      "title" : "Managing bindings"
    }
  ],
  "source" : "appleJSON",
  "title" : "valueClassForBinding(_:)",
  "url" : "https:\/\/developer.apple.com\/documentation\/ObjectiveC\/NSObject-swift.class\/valueClassForBinding(_:)"
}