{
  "abstract" : "An object that describes a user’s website usage.",
  "codeExamples" : [

  ],
  "conformsTo" : [
    "CVarArg",
    "CustomDebugStringConvertible",
    "CustomStringConvertible",
    "Equatable",
    "Hashable",
    "NSObjectProtocol"
  ],
  "contentHash" : "ad1b7dcfeda10b1c93dc1882f36b8eac349ada5eecd54ae0cd47f0edb340078f",
  "crawledAt" : "2025-12-04T01:47:54Z",
  "declaration" : {
    "code" : "class WebUsage",
    "language" : "swift"
  },
  "id" : "0841B32A-D1A4-404A-9576-9A65AE388B80",
  "kind" : "class",
  "language" : "swift",
  "module" : "SensorKit",
  "overview" : "## Overview\n\nEach instance of this class represents a website in a particular app category. For more information, see [doc:\/\/com.apple.sensorkit\/documentation\/SensorKit\/SRDeviceUsageReport\/webUsageByCategory].",
  "platforms" : [
    "iOS",
    "iPadOS",
    "Mac Catalyst"
  ],
  "rawMarkdown" : "---\nsource: https:\/\/developer.apple.com\/documentation\/SensorKit\/SRDeviceUsageReport\/WebUsage\ncrawled: 2025-12-04T01:47:54Z\n---\n\n# SRDeviceUsageReport.WebUsage\n\n**Class**\n\nAn object that describes a user’s website usage.\n\n## Declaration\n\n```swift\nclass WebUsage\n```\n\n## Overview\n\nEach instance of this class represents a website in a particular app category. For more information, see [doc:\/\/com.apple.sensorkit\/documentation\/SensorKit\/SRDeviceUsageReport\/webUsageByCategory].\n\n## Timing Web Use\n\n- **totalUsageTime**: The amount of web usage time that the report spans.\n\n## Analyzing Web Use\n\n- **webUsageByCategory**: The amount of time the user accesses domains per category.\n\n## Inherits From\n\n- NSObject\n\n## Conforms To\n\n- CVarArg\n- CustomDebugStringConvertible\n- CustomStringConvertible\n- Equatable\n- Hashable\n- NSObjectProtocol\n\n",
  "sections" : [
    {
      "content" : "",
      "items" : [
        {
          "description" : "The amount of web usage time that the report spans.",
          "name" : "totalUsageTime",
          "url" : "https:\/\/developer.apple.com\/documentation\/SensorKit\/SRDeviceUsageReport\/WebUsage\/totalUsageTime"
        }
      ],
      "title" : "Timing Web Use"
    },
    {
      "content" : "",
      "items" : [
        {
          "description" : "The amount of time the user accesses domains per category.",
          "name" : "webUsageByCategory",
          "url" : "https:\/\/developer.apple.com\/documentation\/SensorKit\/SRDeviceUsageReport\/webUsageByCategory"
        }
      ],
      "title" : "Analyzing Web Use"
    },
    {
      "content" : "",
      "items" : [
        {
          "name" : "NSObject"
        }
      ],
      "title" : "Inherits From"
    }
  ],
  "source" : "appleJSON",
  "title" : "SRDeviceUsageReport.WebUsage",
  "url" : "https:\/\/developer.apple.com\/documentation\/SensorKit\/SRDeviceUsageReport\/WebUsage"
}