{
  "abstract" : "Occurs when the app lacks the required entitlement.",
  "codeExamples" : [

  ],
  "contentHash" : "e82643674b3bb9e91b899ee78ec63dfbfefabfeb29ab0deccbf49c642643e6cc",
  "crawledAt" : "2025-12-07T15:36:37Z",
  "declaration" : {
    "code" : "static var invalidEntitlement: SRError.Code { get }",
    "language" : "swift"
  },
  "id" : "E0E06212-C6E1-4210-A077-4CEFE666CD4F",
  "kind" : "property",
  "language" : "swift",
  "module" : "SensorKit",
  "overview" : "## Discussion\n\nTo allow the app to read sensor data, the system requires that the app’s code signature contain a special entitlement. For more information, see [doc:\/\/com.apple.sensorkit\/documentation\/SensorKit\/configuring-your-project-for-sensor-reading].",
  "platforms" : [
    "iOS",
    "iPadOS",
    "Mac Catalyst"
  ],
  "rawMarkdown" : "---\nsource: https:\/\/developer.apple.com\/documentation\/SensorKit\/SRError\/invalidEntitlement\ncrawled: 2025-12-07T15:36:37Z\n---\n\n# invalidEntitlement\n\n**Type Property**\n\nOccurs when the app lacks the required entitlement.\n\n## Declaration\n\n```swift\nstatic var invalidEntitlement: SRError.Code { get }\n```\n\n## Discussion\n\nTo allow the app to read sensor data, the system requires that the app’s code signature contain a special entitlement. For more information, see [doc:\/\/com.apple.sensorkit\/documentation\/SensorKit\/configuring-your-project-for-sensor-reading].\n\n## Identifying an Error Cause\n\n- **promptDeclined**: Occurs when the user cancels the sensor approval workflow.\n- **dataInaccessible**: Occurs when the app can’t access the sensor’s data.\n- **fetchRequestInvalid**: Occurs when the app misconfigures a fetch request.\n- **noAuthorization**: Occurs when the user declines sensor access in the Settings app.\n\n",
  "sections" : [
    {
      "content" : "",
      "items" : [
        {
          "description" : "Occurs when the user cancels the sensor approval workflow.",
          "name" : "promptDeclined",
          "url" : "https:\/\/developer.apple.com\/documentation\/SensorKit\/SRError\/promptDeclined"
        },
        {
          "description" : "Occurs when the app can’t access the sensor’s data.",
          "name" : "dataInaccessible",
          "url" : "https:\/\/developer.apple.com\/documentation\/SensorKit\/SRError\/dataInaccessible"
        },
        {
          "description" : "Occurs when the app misconfigures a fetch request.",
          "name" : "fetchRequestInvalid",
          "url" : "https:\/\/developer.apple.com\/documentation\/SensorKit\/SRError\/fetchRequestInvalid"
        },
        {
          "description" : "Occurs when the user declines sensor access in the Settings app.",
          "name" : "noAuthorization",
          "url" : "https:\/\/developer.apple.com\/documentation\/SensorKit\/SRError\/noAuthorization"
        }
      ],
      "title" : "Identifying an Error Cause"
    }
  ],
  "source" : "appleJSON",
  "title" : "invalidEntitlement",
  "url" : "https:\/\/developer.apple.com\/documentation\/SensorKit\/SRError\/invalidEntitlement"
}