{
  "abstract" : "The identifier for a signal that photodiodes and emitters produce.",
  "codeExamples" : [

  ],
  "contentHash" : "6e1a9d5a3921ba38b2f87a0247d14846ccfebf2e48c0d762f9b6158f00bf6b26",
  "crawledAt" : "2025-12-05T12:06:01Z",
  "declaration" : {
    "code" : "var signalIdentifier: Int { get }",
    "language" : "swift"
  },
  "id" : "0DE56B78-2044-4B05-9DBB-83593A2CC540",
  "kind" : "property",
  "language" : "swift",
  "module" : "SensorKit",
  "overview" : "## Discussion\n\nTo provide the same quality of service, certain system conditions may require that you configure the PPG sensor behavior differently while using the same photodiodes and emitters. Use this identifier to distinguish between the signals that the different configurations generate.\n\nSamples with matching identifiers indicate that the sensor preserves the emitter-photodiode configuration during signal acquisition.",
  "platforms" : [
    "iOS",
    "iPadOS",
    "Mac Catalyst"
  ],
  "rawMarkdown" : "---\nsource: https:\/\/developer.apple.com\/documentation\/SensorKit\/SRPhotoplethysmogramOpticalSample\/signalIdentifier\ncrawled: 2025-12-05T12:06:01Z\n---\n\n# signalIdentifier\n\n**Instance Property**\n\nThe identifier for a signal that photodiodes and emitters produce.\n\n## Declaration\n\n```swift\nvar signalIdentifier: Int { get }\n```\n\n## Discussion\n\nTo provide the same quality of service, certain system conditions may require that you configure the PPG sensor behavior differently while using the same photodiodes and emitters. Use this identifier to distinguish between the signals that the different configurations generate.\n\nSamples with matching identifiers indicate that the sensor preserves the emitter-photodiode configuration during signal acquisition.\n\n## Accessing optical data\n\n- **emitter**: The index of the LED in use during the sample.\n- **activePhotodiodeIndexes**: The set of photodiodes in use during the sample.\n- **nominalWavelength**: The wavelength in nanometers that the emitter produces while operating at a specific temperature.\n- **effectiveWavelength**: A temperature-compensated wavelength estimate in nanometers that the emitter produces.\n- **samplingFrequency**: The sampling frequency of the photoplethysmogram (PPG) data in hertz.\n- **nanosecondsSinceStart**: The time in nanoseconds since the system turns on the sensor.\n- **conditions**: The sensor context or conditions that may affect the sample.\n- **SRPhotoplethysmogramOpticalSample.Condition**: The conditions that may occur when recording photoplethysmogram optical data.\n- **noiseTerms**: The mathematical terms for computing the noise in this sample.\n- **SRPhotoplethysmogramOpticalSample.NoiseTerms**: The mathematical terms that you use to compute the photoplethysmogram (PPG) noise.\n- **normalizedReflectance**: The normalized photoplethysmogram (PPG) waveform.\n\n",
  "sections" : [
    {
      "content" : "",
      "items" : [
        {
          "description" : "The index of the LED in use during the sample.",
          "name" : "emitter",
          "url" : "https:\/\/developer.apple.com\/documentation\/SensorKit\/SRPhotoplethysmogramOpticalSample\/emitter"
        },
        {
          "description" : "The set of photodiodes in use during the sample.",
          "name" : "activePhotodiodeIndexes",
          "url" : "https:\/\/developer.apple.com\/documentation\/SensorKit\/SRPhotoplethysmogramOpticalSample\/activePhotodiodeIndexes"
        },
        {
          "description" : "The wavelength in nanometers that the emitter produces while operating at a specific temperature.",
          "name" : "nominalWavelength",
          "url" : "https:\/\/developer.apple.com\/documentation\/SensorKit\/SRPhotoplethysmogramOpticalSample\/nominalWavelength"
        },
        {
          "description" : "A temperature-compensated wavelength estimate in nanometers that the emitter produces.",
          "name" : "effectiveWavelength",
          "url" : "https:\/\/developer.apple.com\/documentation\/SensorKit\/SRPhotoplethysmogramOpticalSample\/effectiveWavelength"
        },
        {
          "description" : "The sampling frequency of the photoplethysmogram (PPG) data in hertz.",
          "name" : "samplingFrequency",
          "url" : "https:\/\/developer.apple.com\/documentation\/SensorKit\/SRPhotoplethysmogramOpticalSample\/samplingFrequency"
        },
        {
          "description" : "The time in nanoseconds since the system turns on the sensor.",
          "name" : "nanosecondsSinceStart",
          "url" : "https:\/\/developer.apple.com\/documentation\/SensorKit\/SRPhotoplethysmogramOpticalSample\/nanosecondsSinceStart"
        },
        {
          "description" : "The sensor context or conditions that may affect the sample.",
          "name" : "conditions",
          "url" : "https:\/\/developer.apple.com\/documentation\/SensorKit\/SRPhotoplethysmogramOpticalSample\/conditions"
        },
        {
          "description" : "The conditions that may occur when recording photoplethysmogram optical data.",
          "name" : "SRPhotoplethysmogramOpticalSample.Condition",
          "url" : "https:\/\/developer.apple.com\/documentation\/SensorKit\/SRPhotoplethysmogramOpticalSample\/Condition"
        },
        {
          "description" : "The mathematical terms for computing the noise in this sample.",
          "name" : "noiseTerms",
          "url" : "https:\/\/developer.apple.com\/documentation\/SensorKit\/SRPhotoplethysmogramOpticalSample\/noiseTerms-swift.property"
        },
        {
          "description" : "The mathematical terms that you use to compute the photoplethysmogram (PPG) noise.",
          "name" : "SRPhotoplethysmogramOpticalSample.NoiseTerms",
          "url" : "https:\/\/developer.apple.com\/documentation\/SensorKit\/SRPhotoplethysmogramOpticalSample\/NoiseTerms-swift.struct"
        },
        {
          "description" : "The normalized photoplethysmogram (PPG) waveform.",
          "name" : "normalizedReflectance",
          "url" : "https:\/\/developer.apple.com\/documentation\/SensorKit\/SRPhotoplethysmogramOpticalSample\/normalizedReflectance-15f2k"
        }
      ],
      "title" : "Accessing optical data"
    }
  ],
  "source" : "appleJSON",
  "title" : "signalIdentifier",
  "url" : "https:\/\/developer.apple.com\/documentation\/SensorKit\/SRPhotoplethysmogramOpticalSample\/signalIdentifier"
}