{
  "abstract" : "The index of the LED in use during the sample.",
  "codeExamples" : [

  ],
  "contentHash" : "44fc5f9cf60e308bf74d855a9b8f7478b3dc08a7d31e2a7e8fcc547c8bb18080",
  "crawledAt" : "2025-12-05T13:35:41Z",
  "declaration" : {
    "code" : "var emitter: Int { get }",
    "language" : "swift"
  },
  "id" : "D50AE5A1-ACAC-4E0F-8607-207843E37F2F",
  "kind" : "property",
  "language" : "swift",
  "module" : "SensorKit",
  "overview" : "## Discussion\n\nTo map the spatial location of the emitter, see the Apple Watch diagrams and emitter tables in [doc:\/\/com.apple.sensorkit\/documentation\/SensorKit\/SRPhotoplethysmogramOpticalSample#Interpret-second-generation-PPG-sensors-data] and [doc:\/\/com.apple.sensorkit\/documentation\/SensorKit\/SRPhotoplethysmogramOpticalSample#Interpret-third-generation-PPG-sensors].",
  "platforms" : [
    "iOS",
    "iPadOS",
    "Mac Catalyst"
  ],
  "rawMarkdown" : "---\nsource: https:\/\/developer.apple.com\/documentation\/SensorKit\/SRPhotoplethysmogramOpticalSample\/emitter\ncrawled: 2025-12-05T13:35:41Z\n---\n\n# emitter\n\n**Instance Property**\n\nThe index of the LED in use during the sample.\n\n## Declaration\n\n```swift\nvar emitter: Int { get }\n```\n\n## Discussion\n\nTo map the spatial location of the emitter, see the Apple Watch diagrams and emitter tables in [doc:\/\/com.apple.sensorkit\/documentation\/SensorKit\/SRPhotoplethysmogramOpticalSample#Interpret-second-generation-PPG-sensors-data] and [doc:\/\/com.apple.sensorkit\/documentation\/SensorKit\/SRPhotoplethysmogramOpticalSample#Interpret-third-generation-PPG-sensors].\n\n## Accessing optical data\n\n- **activePhotodiodeIndexes**: The set of photodiodes in use during the sample.\n- **signalIdentifier**: The identifier for a signal that photodiodes and emitters produce.\n- **nominalWavelength**: The wavelength in nanometers that the emitter produces while operating at a specific temperature.\n- **effectiveWavelength**: A temperature-compensated wavelength estimate in nanometers that the emitter produces.\n- **samplingFrequency**: The sampling frequency of the photoplethysmogram (PPG) data in hertz.\n- **nanosecondsSinceStart**: The time in nanoseconds since the system turns on the sensor.\n- **conditions**: The sensor context or conditions that may affect the sample.\n- **SRPhotoplethysmogramOpticalSample.Condition**: The conditions that may occur when recording photoplethysmogram optical data.\n- **noiseTerms**: The mathematical terms for computing the noise in this sample.\n- **SRPhotoplethysmogramOpticalSample.NoiseTerms**: The mathematical terms that you use to compute the photoplethysmogram (PPG) noise.\n- **normalizedReflectance**: The normalized photoplethysmogram (PPG) waveform.\n\n",
  "sections" : [
    {
      "content" : "",
      "items" : [
        {
          "description" : "The set of photodiodes in use during the sample.",
          "name" : "activePhotodiodeIndexes",
          "url" : "https:\/\/developer.apple.com\/documentation\/SensorKit\/SRPhotoplethysmogramOpticalSample\/activePhotodiodeIndexes"
        },
        {
          "description" : "The identifier for a signal that photodiodes and emitters produce.",
          "name" : "signalIdentifier",
          "url" : "https:\/\/developer.apple.com\/documentation\/SensorKit\/SRPhotoplethysmogramOpticalSample\/signalIdentifier"
        },
        {
          "description" : "The wavelength in nanometers that the emitter produces while operating at a specific temperature.",
          "name" : "nominalWavelength",
          "url" : "https:\/\/developer.apple.com\/documentation\/SensorKit\/SRPhotoplethysmogramOpticalSample\/nominalWavelength"
        },
        {
          "description" : "A temperature-compensated wavelength estimate in nanometers that the emitter produces.",
          "name" : "effectiveWavelength",
          "url" : "https:\/\/developer.apple.com\/documentation\/SensorKit\/SRPhotoplethysmogramOpticalSample\/effectiveWavelength"
        },
        {
          "description" : "The sampling frequency of the photoplethysmogram (PPG) data in hertz.",
          "name" : "samplingFrequency",
          "url" : "https:\/\/developer.apple.com\/documentation\/SensorKit\/SRPhotoplethysmogramOpticalSample\/samplingFrequency"
        },
        {
          "description" : "The time in nanoseconds since the system turns on the sensor.",
          "name" : "nanosecondsSinceStart",
          "url" : "https:\/\/developer.apple.com\/documentation\/SensorKit\/SRPhotoplethysmogramOpticalSample\/nanosecondsSinceStart"
        },
        {
          "description" : "The sensor context or conditions that may affect the sample.",
          "name" : "conditions",
          "url" : "https:\/\/developer.apple.com\/documentation\/SensorKit\/SRPhotoplethysmogramOpticalSample\/conditions"
        },
        {
          "description" : "The conditions that may occur when recording photoplethysmogram optical data.",
          "name" : "SRPhotoplethysmogramOpticalSample.Condition",
          "url" : "https:\/\/developer.apple.com\/documentation\/SensorKit\/SRPhotoplethysmogramOpticalSample\/Condition"
        },
        {
          "description" : "The mathematical terms for computing the noise in this sample.",
          "name" : "noiseTerms",
          "url" : "https:\/\/developer.apple.com\/documentation\/SensorKit\/SRPhotoplethysmogramOpticalSample\/noiseTerms-swift.property"
        },
        {
          "description" : "The mathematical terms that you use to compute the photoplethysmogram (PPG) noise.",
          "name" : "SRPhotoplethysmogramOpticalSample.NoiseTerms",
          "url" : "https:\/\/developer.apple.com\/documentation\/SensorKit\/SRPhotoplethysmogramOpticalSample\/NoiseTerms-swift.struct"
        },
        {
          "description" : "The normalized photoplethysmogram (PPG) waveform.",
          "name" : "normalizedReflectance",
          "url" : "https:\/\/developer.apple.com\/documentation\/SensorKit\/SRPhotoplethysmogramOpticalSample\/normalizedReflectance-15f2k"
        }
      ],
      "title" : "Accessing optical data"
    }
  ],
  "source" : "appleJSON",
  "title" : "emitter",
  "url" : "https:\/\/developer.apple.com\/documentation\/SensorKit\/SRPhotoplethysmogramOpticalSample\/emitter"
}