{
  "abstract" : "The device to query for sample data.",
  "codeExamples" : [

  ],
  "contentHash" : "be87832ae1556c2f6d03e4cfd96c85d74445805660ef008be0682832a8a4e9a1",
  "crawledAt" : "2025-12-04T01:47:35Z",
  "declaration" : {
    "code" : "var device: SRDevice { get set }",
    "language" : "swift"
  },
  "id" : "8A45B16D-ADA4-4CE1-AE4D-BD6A141BA660",
  "kind" : "property",
  "language" : "swift",
  "module" : "SensorKit",
  "overview" : "## Discussion\n\nIf the app doesn’t define a value for this property, the framework queries the current device. To get a list of available devices, the app calls [doc:\/\/com.apple.sensorkit\/documentation\/SensorKit\/SRSensorReader\/fetchDevices()] on its sensor reader.",
  "platforms" : [
    "iOS",
    "iPadOS",
    "Mac Catalyst"
  ],
  "rawMarkdown" : "---\nsource: https:\/\/developer.apple.com\/documentation\/SensorKit\/SRFetchRequest\/device\ncrawled: 2025-12-04T01:47:35Z\n---\n\n# device\n\n**Instance Property**\n\nThe device to query for sample data.\n\n## Declaration\n\n```swift\nvar device: SRDevice { get set }\n```\n\n## Discussion\n\nIf the app doesn’t define a value for this property, the framework queries the current device. To get a list of available devices, the app calls [doc:\/\/com.apple.sensorkit\/documentation\/SensorKit\/SRSensorReader\/fetchDevices()] on its sensor reader.\n\n## Selecting the Device\n\n- **SRDevice**: A representation of a device that provides sample data.\n\n",
  "sections" : [
    {
      "content" : "",
      "items" : [
        {
          "description" : "A representation of a device that provides sample data.",
          "name" : "SRDevice",
          "url" : "https:\/\/developer.apple.com\/documentation\/SensorKit\/SRDevice"
        }
      ],
      "title" : "Selecting the Device"
    }
  ],
  "source" : "appleJSON",
  "title" : "device",
  "url" : "https:\/\/developer.apple.com\/documentation\/SensorKit\/SRFetchRequest\/device"
}