{
  "abstract" : "A collection of facial features that a request detects.",
  "codeExamples" : [

  ],
  "conformsTo" : [
    "CVarArg",
    "CustomDebugStringConvertible",
    "CustomStringConvertible",
    "Equatable",
    "Hashable",
    "NSCoding",
    "NSCopying",
    "NSObjectProtocol",
    "NSSecureCoding",
    "VNRequestRevisionProviding"
  ],
  "contentHash" : "1e13a0eb40651d098e7d455a514d4d8ebd7f411a94088445d97f5674a584cd7c",
  "crawledAt" : "2025-12-03T18:53:53Z",
  "declaration" : {
    "code" : "class VNFaceLandmarks2D",
    "language" : "swift"
  },
  "id" : "C2098E91-92F6-4608-8CCF-93B896F7728F",
  "kind" : "class",
  "language" : "swift",
  "module" : "Vision",
  "overview" : "## Overview\n\nThis class represents the set of all detectable 2D face landmarks and regions, exposed as properties. The coordinates of the face landmarks are normalized to the dimensions of the face observation’s [doc:\/\/Vision\/documentation\/Vision\/VNDetectedObjectObservation\/boundingBox], with the origin at the bounding box’s lower-left corner. Use the [doc:\/\/Vision\/documentation\/Vision\/VNImagePointForFaceLandmarkPoint(_:_:_:_:)] function to convert normalized face landmark points into absolute points within the image’s coordinate system.",
  "platforms" : [
    "iOS",
    "iPadOS",
    "Mac Catalyst",
    "macOS",
    "tvOS",
    "visionOS"
  ],
  "rawMarkdown" : "---\nsource: https:\/\/developer.apple.com\/documentation\/Vision\/VNFaceLandmarks2D\ncrawled: 2025-12-03T18:53:53Z\n---\n\n# VNFaceLandmarks2D\n\n**Class**\n\nA collection of facial features that a request detects.\n\n## Declaration\n\n```swift\nclass VNFaceLandmarks2D\n```\n\n## Overview\n\nThis class represents the set of all detectable 2D face landmarks and regions, exposed as properties. The coordinates of the face landmarks are normalized to the dimensions of the face observation’s [doc:\/\/Vision\/documentation\/Vision\/VNDetectedObjectObservation\/boundingBox], with the origin at the bounding box’s lower-left corner. Use the [doc:\/\/Vision\/documentation\/Vision\/VNImagePointForFaceLandmarkPoint(_:_:_:_:)] function to convert normalized face landmark points into absolute points within the image’s coordinate system.\n\n## Face Landmark Points\n\n- **allPoints**: The region containing all face landmark points.\n- **faceContour**: The region containing points that trace the face contour from the left cheek, over the chin, to the right cheek.\n- **leftEye**: The region containing points that outline the left eye.\n- **rightEye**: The region containing points that outline the right eye.\n- **leftEyebrow**: The region containing points that trace the left eyebrow.\n- **rightEyebrow**: The region containing points that trace the right eyebrow.\n- **nose**: The region containing points that outline the nose.\n- **noseCrest**: The region containing points that trace the center crest of the nose.\n- **medianLine**: The region containing points that trace a vertical line down the center of the face.\n- **outerLips**: The region containing points that outline the outside of the lips.\n- **innerLips**: The region containing points that outline the space between the lips.\n- **leftPupil**: The region containing the point where the left pupil is located.\n- **rightPupil**: The region containing the point where the right pupil is located.\n\n## Identifying Landmarks\n\n- **landmarks**: The facial features of the detected face.\n- **VNFaceLandmarkRegion2D**: 2D geometry information for a specific facial feature.\n- **VNFaceLandmarks**: The abstract superclass for containers of face landmark information.\n- **VNFaceLandmarkRegion**: The abstract superclass for information about a specific face landmark.\n\n## Inherits From\n\n- VNFaceLandmarks\n\n## Conforms To\n\n- CVarArg\n- CustomDebugStringConvertible\n- CustomStringConvertible\n- Equatable\n- Hashable\n- NSCoding\n- NSCopying\n- NSObjectProtocol\n- NSSecureCoding\n- VNRequestRevisionProviding\n\n",
  "sections" : [
    {
      "content" : "",
      "items" : [
        {
          "description" : "The region containing all face landmark points.",
          "name" : "allPoints",
          "url" : "https:\/\/developer.apple.com\/documentation\/Vision\/VNFaceLandmarks2D\/allPoints"
        },
        {
          "description" : "The region containing points that trace the face contour from the left cheek, over the chin, to the right cheek.",
          "name" : "faceContour",
          "url" : "https:\/\/developer.apple.com\/documentation\/Vision\/VNFaceLandmarks2D\/faceContour"
        },
        {
          "description" : "The region containing points that outline the left eye.",
          "name" : "leftEye",
          "url" : "https:\/\/developer.apple.com\/documentation\/Vision\/VNFaceLandmarks2D\/leftEye"
        },
        {
          "description" : "The region containing points that outline the right eye.",
          "name" : "rightEye",
          "url" : "https:\/\/developer.apple.com\/documentation\/Vision\/VNFaceLandmarks2D\/rightEye"
        },
        {
          "description" : "The region containing points that trace the left eyebrow.",
          "name" : "leftEyebrow",
          "url" : "https:\/\/developer.apple.com\/documentation\/Vision\/VNFaceLandmarks2D\/leftEyebrow"
        },
        {
          "description" : "The region containing points that trace the right eyebrow.",
          "name" : "rightEyebrow",
          "url" : "https:\/\/developer.apple.com\/documentation\/Vision\/VNFaceLandmarks2D\/rightEyebrow"
        },
        {
          "description" : "The region containing points that outline the nose.",
          "name" : "nose",
          "url" : "https:\/\/developer.apple.com\/documentation\/Vision\/VNFaceLandmarks2D\/nose"
        },
        {
          "description" : "The region containing points that trace the center crest of the nose.",
          "name" : "noseCrest",
          "url" : "https:\/\/developer.apple.com\/documentation\/Vision\/VNFaceLandmarks2D\/noseCrest"
        },
        {
          "description" : "The region containing points that trace a vertical line down the center of the face.",
          "name" : "medianLine",
          "url" : "https:\/\/developer.apple.com\/documentation\/Vision\/VNFaceLandmarks2D\/medianLine"
        },
        {
          "description" : "The region containing points that outline the outside of the lips.",
          "name" : "outerLips",
          "url" : "https:\/\/developer.apple.com\/documentation\/Vision\/VNFaceLandmarks2D\/outerLips"
        },
        {
          "description" : "The region containing points that outline the space between the lips.",
          "name" : "innerLips",
          "url" : "https:\/\/developer.apple.com\/documentation\/Vision\/VNFaceLandmarks2D\/innerLips"
        },
        {
          "description" : "The region containing the point where the left pupil is located.",
          "name" : "leftPupil",
          "url" : "https:\/\/developer.apple.com\/documentation\/Vision\/VNFaceLandmarks2D\/leftPupil"
        },
        {
          "description" : "The region containing the point where the right pupil is located.",
          "name" : "rightPupil",
          "url" : "https:\/\/developer.apple.com\/documentation\/Vision\/VNFaceLandmarks2D\/rightPupil"
        }
      ],
      "title" : "Face Landmark Points"
    },
    {
      "content" : "",
      "items" : [
        {
          "description" : "The facial features of the detected face.",
          "name" : "landmarks",
          "url" : "https:\/\/developer.apple.com\/documentation\/Vision\/VNFaceObservation\/landmarks"
        },
        {
          "description" : "2D geometry information for a specific facial feature.",
          "name" : "VNFaceLandmarkRegion2D",
          "url" : "https:\/\/developer.apple.com\/documentation\/Vision\/VNFaceLandmarkRegion2D"
        },
        {
          "description" : "The abstract superclass for containers of face landmark information.",
          "name" : "VNFaceLandmarks",
          "url" : "https:\/\/developer.apple.com\/documentation\/Vision\/VNFaceLandmarks"
        },
        {
          "description" : "The abstract superclass for information about a specific face landmark.",
          "name" : "VNFaceLandmarkRegion",
          "url" : "https:\/\/developer.apple.com\/documentation\/Vision\/VNFaceLandmarkRegion"
        }
      ],
      "title" : "Identifying Landmarks"
    },
    {
      "content" : "",
      "items" : [
        {
          "name" : "VNFaceLandmarks"
        }
      ],
      "title" : "Inherits From"
    }
  ],
  "source" : "appleJSON",
  "title" : "VNFaceLandmarks2D",
  "url" : "https:\/\/developer.apple.com\/documentation\/Vision\/VNFaceLandmarks2D"
}