{
  "abstract" : "A type alias for expressing rectangle aspect ratios in Vision.",
  "codeExamples" : [

  ],
  "contentHash" : "8a13e0d5bb2f5423943898b7e345ab2d8e3814fac39e86f617e643071e423445",
  "crawledAt" : "2025-12-01T23:58:30Z",
  "declaration" : {
    "code" : "typealias VNAspectRatio = Float",
    "language" : "swift"
  },
  "id" : "8553E5C0-D26F-40E2-9C64-F1A9D74BD005",
  "kind" : "typealias",
  "module" : "Vision",
  "overview" : "## Discussion\n\nThe value is a [https:\/\/developer.apple.com\/library\/archive\/documentation\/AppleApplications\/Reference\/SafariCSSRef\/Articles\/StandardCSSProperties.html#\/\/apple_ref\/doc\/uid\/TP30001266-float], but limited to a range of `0.0` to `1.0`, inclusive, with the default of `0.5` indicating a square image. It defines aspect ratio as the shorter dimension over the longer dimension.",
  "platforms" : [
    "iOS",
    "iPadOS",
    "Mac Catalyst",
    "macOS",
    "tvOS",
    "visionOS"
  ],
  "rawMarkdown" : "---\nsource: https:\/\/developer.apple.com\/documentation\/Vision\/VNAspectRatio\ncrawled: 2025-12-01T23:58:30Z\n---\n\n# VNAspectRatio\n\n**Type Alias**\n\nA type alias for expressing rectangle aspect ratios in Vision.\n\n## Declaration\n\n```swift\ntypealias VNAspectRatio = Float\n```\n\n## Discussion\n\nThe value is a [https:\/\/developer.apple.com\/library\/archive\/documentation\/AppleApplications\/Reference\/SafariCSSRef\/Articles\/StandardCSSProperties.html#\/\/apple_ref\/doc\/uid\/TP30001266-float], but limited to a range of `0.0` to `1.0`, inclusive, with the default of `0.5` indicating a square image. It defines aspect ratio as the shorter dimension over the longer dimension.\n\n## Configuring Detection\n\n- **minimumAspectRatio**: A `float` specifying the minimum aspect ratio of the rectangle to detect, defined as the shorter dimension over the longer dimension.\n- **maximumAspectRatio**: A `float` specifying the maximum aspect ratio of the rectangle to detect, defined as the shorter dimension over the longer dimension.\n- **quadratureTolerance**: A float specifying the number of degrees a rectangle corner angle can deviate from 90°.\n- **VNDegrees**: A typealias for expressing tolerance angles in Vision.\n- **minimumSize**: The minimum size of a rectangle to detect, as a proportion of the smallest dimension.\n- **minimumConfidence**: A value specifying the minimum acceptable confidence level.\n- **VNConfidence**: A type alias for the confidence value of an observation.\n- **maximumObservations**: An integer specifying the maximum number of rectangles Vision returns.\n\n",
  "sections" : [
    {
      "content" : "",
      "items" : [
        {
          "description" : "A `float` specifying the minimum aspect ratio of the rectangle to detect, defined as the shorter dimension over the longer dimension.",
          "name" : "minimumAspectRatio",
          "url" : "https:\/\/developer.apple.com\/documentation\/Vision\/VNDetectRectanglesRequest\/minimumAspectRatio"
        },
        {
          "description" : "A `float` specifying the maximum aspect ratio of the rectangle to detect, defined as the shorter dimension over the longer dimension.",
          "name" : "maximumAspectRatio",
          "url" : "https:\/\/developer.apple.com\/documentation\/Vision\/VNDetectRectanglesRequest\/maximumAspectRatio"
        },
        {
          "description" : "A float specifying the number of degrees a rectangle corner angle can deviate from 90°.",
          "name" : "quadratureTolerance",
          "url" : "https:\/\/developer.apple.com\/documentation\/Vision\/VNDetectRectanglesRequest\/quadratureTolerance"
        },
        {
          "description" : "A typealias for expressing tolerance angles in Vision.",
          "name" : "VNDegrees",
          "url" : "https:\/\/developer.apple.com\/documentation\/Vision\/VNDegrees"
        },
        {
          "description" : "The minimum size of a rectangle to detect, as a proportion of the smallest dimension.",
          "name" : "minimumSize",
          "url" : "https:\/\/developer.apple.com\/documentation\/Vision\/VNDetectRectanglesRequest\/minimumSize"
        },
        {
          "description" : "A value specifying the minimum acceptable confidence level.",
          "name" : "minimumConfidence",
          "url" : "https:\/\/developer.apple.com\/documentation\/Vision\/VNDetectRectanglesRequest\/minimumConfidence"
        },
        {
          "description" : "A type alias for the confidence value of an observation.",
          "name" : "VNConfidence",
          "url" : "https:\/\/developer.apple.com\/documentation\/Vision\/VNConfidence"
        },
        {
          "description" : "An integer specifying the maximum number of rectangles Vision returns.",
          "name" : "maximumObservations",
          "url" : "https:\/\/developer.apple.com\/documentation\/Vision\/VNDetectRectanglesRequest\/maximumObservations"
        }
      ],
      "title" : "Configuring Detection"
    }
  ],
  "source" : "appleJSON",
  "title" : "VNAspectRatio",
  "url" : "https:\/\/developer.apple.com\/documentation\/Vision\/VNAspectRatio"
}