{
  "abstract" : "A request that produces a floating-point number that represents the capture quality of a face in a photo.",
  "codeExamples" : [

  ],
  "conformsTo" : [
    "CVarArg",
    "CustomDebugStringConvertible",
    "CustomStringConvertible",
    "Equatable",
    "Hashable",
    "NSCopying",
    "NSObjectProtocol",
    "VNFaceObservationAccepting"
  ],
  "contentHash" : "104b7a564d306d3ae95e3a56cd2ef699f546fdc2072386fbb74be52754984c83",
  "crawledAt" : "2025-12-04T01:02:47Z",
  "declaration" : {
    "code" : "class VNDetectFaceCaptureQualityRequest",
    "language" : "swift"
  },
  "id" : "6F66D5C1-82F1-4E82-AA3B-052099104A7B",
  "kind" : "class",
  "language" : "swift",
  "module" : "Vision",
  "overview" : "## Overview\n\nThis request produces or updates a [doc:\/\/Vision\/documentation\/Vision\/VNFaceObservation] object’s property [doc:\/\/Vision\/documentation\/Vision\/VNFaceObservation\/faceCaptureQuality-bjg5] with a floating-point value. The value ranges from `0` to `1`. Faces with quality closer to `1` are better lit, sharper, and more centrally positioned than faces with quality closer to `0`.\n\nIf you don’t execute the request, or the request fails, the property [doc:\/\/Vision\/documentation\/Vision\/VNFaceObservation\/faceCaptureQuality-bjg5] is [doc:\/\/com.apple.documentation\/documentation\/ObjectiveC\/nil-227m0].",
  "platforms" : [
    "iOS",
    "iPadOS",
    "Mac Catalyst",
    "macOS",
    "tvOS",
    "visionOS"
  ],
  "rawMarkdown" : "---\nsource: https:\/\/developer.apple.com\/documentation\/vision\/vndetectfacecapturequalityrequest\ncrawled: 2025-12-04T01:02:47Z\n---\n\n# VNDetectFaceCaptureQualityRequest\n\n**Class**\n\nA request that produces a floating-point number that represents the capture quality of a face in a photo.\n\n## Declaration\n\n```swift\nclass VNDetectFaceCaptureQualityRequest\n```\n\n## Overview\n\nThis request produces or updates a [doc:\/\/Vision\/documentation\/Vision\/VNFaceObservation] object’s property [doc:\/\/Vision\/documentation\/Vision\/VNFaceObservation\/faceCaptureQuality-bjg5] with a floating-point value. The value ranges from `0` to `1`. Faces with quality closer to `1` are better lit, sharper, and more centrally positioned than faces with quality closer to `0`.\n\nIf you don’t execute the request, or the request fails, the property [doc:\/\/Vision\/documentation\/Vision\/VNFaceObservation\/faceCaptureQuality-bjg5] is [doc:\/\/com.apple.documentation\/documentation\/ObjectiveC\/nil-227m0].\n\n## Accessing the Results\n\n- **results**: The results of the face-capture quality request.\n- **VNFaceObservation**: Face or facial-feature information that an image analysis request detects.\n\n## Identifying Request Revisions\n\n- **VNDetectFaceCaptureQualityRequestRevision2**: Revision 2 of the request algorithm.\n- **VNDetectFaceCaptureQualityRequestRevision1**: A constant for specifying revision 1 of the face capture detection request.\n\n## Face and body detection\n\n- **Selecting a selfie based on capture quality**: Compare face-capture quality in a set of images by using Vision.\n- **VNDetectFaceLandmarksRequest**: An image-analysis request that finds facial features like eyes and mouth in an image.\n- **VNDetectFaceRectanglesRequest**: A request that finds faces within an image.\n- **VNDetectHumanRectanglesRequest**: A request that finds rectangular regions that contain people in an image.\n- **VNHumanObservation**: An object that represents a person that the request detects.\n\n## Inherits From\n\n- VNImageBasedRequest\n\n## Conforms To\n\n- CVarArg\n- CustomDebugStringConvertible\n- CustomStringConvertible\n- Equatable\n- Hashable\n- NSCopying\n- NSObjectProtocol\n- VNFaceObservationAccepting\n\n",
  "sections" : [
    {
      "content" : "",
      "items" : [
        {
          "description" : "The results of the face-capture quality request.",
          "name" : "results",
          "url" : "https:\/\/developer.apple.com\/documentation\/Vision\/VNDetectFaceCaptureQualityRequest\/results"
        },
        {
          "description" : "Face or facial-feature information that an image analysis request detects.",
          "name" : "VNFaceObservation",
          "url" : "https:\/\/developer.apple.com\/documentation\/Vision\/VNFaceObservation"
        }
      ],
      "title" : "Accessing the Results"
    },
    {
      "content" : "",
      "items" : [
        {
          "description" : "Revision 2 of the request algorithm.",
          "name" : "VNDetectFaceCaptureQualityRequestRevision2",
          "url" : "https:\/\/developer.apple.com\/documentation\/Vision\/VNDetectFaceCaptureQualityRequestRevision2"
        },
        {
          "description" : "A constant for specifying revision 1 of the face capture detection request.",
          "name" : "VNDetectFaceCaptureQualityRequestRevision1",
          "url" : "https:\/\/developer.apple.com\/documentation\/Vision\/VNDetectFaceCaptureQualityRequestRevision1"
        }
      ],
      "title" : "Identifying Request Revisions"
    },
    {
      "content" : "",
      "items" : [
        {
          "description" : "Compare face-capture quality in a set of images by using Vision.",
          "name" : "Selecting a selfie based on capture quality",
          "url" : "https:\/\/developer.apple.com\/documentation\/Vision\/selecting-a-selfie-based-on-capture-quality"
        },
        {
          "description" : "An image-analysis request that finds facial features like eyes and mouth in an image.",
          "name" : "VNDetectFaceLandmarksRequest",
          "url" : "https:\/\/developer.apple.com\/documentation\/Vision\/VNDetectFaceLandmarksRequest"
        },
        {
          "description" : "A request that finds faces within an image.",
          "name" : "VNDetectFaceRectanglesRequest",
          "url" : "https:\/\/developer.apple.com\/documentation\/Vision\/VNDetectFaceRectanglesRequest"
        },
        {
          "description" : "A request that finds rectangular regions that contain people in an image.",
          "name" : "VNDetectHumanRectanglesRequest",
          "url" : "https:\/\/developer.apple.com\/documentation\/Vision\/VNDetectHumanRectanglesRequest"
        },
        {
          "description" : "An object that represents a person that the request detects.",
          "name" : "VNHumanObservation",
          "url" : "https:\/\/developer.apple.com\/documentation\/Vision\/VNHumanObservation"
        }
      ],
      "title" : "Face and body detection"
    },
    {
      "content" : "",
      "items" : [
        {
          "name" : "VNImageBasedRequest"
        }
      ],
      "title" : "Inherits From"
    }
  ],
  "source" : "appleJSON",
  "title" : "VNDetectFaceCaptureQualityRequest",
  "url" : "https:\/\/developer.apple.com\/documentation\/vision\/vndetectfacecapturequalityrequest"
}