{
  "abstract" : "A string that provides details about select notification types in version 2.",
  "codeExamples" : [

  ],
  "contentHash" : "3aa8705c4afb11dfdb26bb67be0e0a734f252948861e5b33e73fb638070568ba",
  "crawledAt" : "2025-12-01T09:33:10Z",
  "declaration" : {
    "code" : "string subtype",
    "language" : "swift"
  },
  "id" : "F6C1D118-981B-4315-A02E-DE27EDF95028",
  "kind" : "unknown",
  "module" : "App Store Server Notifications",
  "overview" : "## Discussion\n\nThis `subtype` field is part of the [doc:\/\/com.apple.appstoreservernotifications\/documentation\/AppStoreServerNotifications\/responseBodyV2DecodedPayload], and further describes an event of type [doc:\/\/com.apple.appstoreservernotifications\/documentation\/AppStoreServerNotifications\/notificationType]. It’s present only for specific version 2 notifications.",
  "platforms" : [
    "Unsupported OS: App Store Server Notifications"
  ],
  "rawMarkdown" : "---\nsource: https:\/\/developer.apple.com\/documentation\/AppStoreServerNotifications\/subtype\ncrawled: 2025-12-01T09:33:10Z\n---\n\n# subtype\n\n**Type**\n\nA string that provides details about select notification types in version 2.\n\n## Declaration\n\n```swift\nstring subtype\n```\n\n## Discussion\n\nThis `subtype` field is part of the [doc:\/\/com.apple.appstoreservernotifications\/documentation\/AppStoreServerNotifications\/responseBodyV2DecodedPayload], and further describes an event of type [doc:\/\/com.apple.appstoreservernotifications\/documentation\/AppStoreServerNotifications\/notificationType]. It’s present only for specific version 2 notifications.\n\n## Server notifications version 2\n\n- **App Store Server Notifications V2**: Specify your secure server’s URL in App Store Connect to receive version 2 notifications.\n- **responseBodyV2**: The response body the App Store sends in a version 2 server notification.\n- **responseBodyV2DecodedPayload**: A decoded payload that contains the version 2 notification data.\n- **notificationType**: The type that describes the In-App Purchase or external purchase event for which the App Store sends the version 2 notification.\n\n",
  "sections" : [
    {
      "content" : "",
      "items" : [
        {
          "description" : "Specify your secure server’s URL in App Store Connect to receive version 2 notifications.",
          "name" : "App Store Server Notifications V2",
          "url" : "https:\/\/developer.apple.com\/documentation\/AppStoreServerNotifications\/App-Store-Server-Notifications-V2"
        },
        {
          "description" : "The response body the App Store sends in a version 2 server notification.",
          "name" : "responseBodyV2",
          "url" : "https:\/\/developer.apple.com\/documentation\/AppStoreServerNotifications\/responseBodyV2"
        },
        {
          "description" : "A decoded payload that contains the version 2 notification data.",
          "name" : "responseBodyV2DecodedPayload",
          "url" : "https:\/\/developer.apple.com\/documentation\/AppStoreServerNotifications\/responseBodyV2DecodedPayload"
        },
        {
          "description" : "The type that describes the In-App Purchase or external purchase event for which the App Store sends the version 2 notification.",
          "name" : "notificationType",
          "url" : "https:\/\/developer.apple.com\/documentation\/AppStoreServerNotifications\/notificationType"
        }
      ],
      "title" : "Server notifications version 2"
    }
  ],
  "source" : "appleJSON",
  "title" : "subtype",
  "url" : "https:\/\/developer.apple.com\/documentation\/AppStoreServerNotifications\/subtype"
}