{
  "abstract" : "A string that indicates the notification’s App Store Server Notifications version number.",
  "codeExamples" : [

  ],
  "contentHash" : "a1c372468efa9c6e1a1727544ad78e7d1a1755d60d5332921e6fd8189a6bde03",
  "crawledAt" : "2025-12-02T08:23:06Z",
  "declaration" : {
    "code" : "string version",
    "language" : "swift"
  },
  "id" : "F3158742-08E9-4F41-8B97-8ACC2317FCFE",
  "kind" : "unknown",
  "module" : "App Store Server Notifications",
  "overview" : "## Discussion\n\nThe version string is `“2.0”`. It’s present in [doc:\/\/com.apple.appstoreservernotifications\/documentation\/AppStoreServerNotifications\/responseBodyV2DecodedPayload] for version 2 notifications.\n\nFor more information about App Store Server Notification changes, see [doc:\/\/com.apple.appstoreservernotifications\/documentation\/AppStoreServerNotifications\/app-store-server-notifications-changelog].",
  "platforms" : [
    "Unsupported OS: App Store Server Notifications"
  ],
  "rawMarkdown" : "---\nsource: https:\/\/developer.apple.com\/documentation\/AppStoreServerNotifications\/version\ncrawled: 2025-12-02T08:23:06Z\n---\n\n# version\n\n**Type**\n\nA string that indicates the notification’s App Store Server Notifications version number.\n\n## Declaration\n\n```swift\nstring version\n```\n\n## Discussion\n\nThe version string is `“2.0”`. It’s present in [doc:\/\/com.apple.appstoreservernotifications\/documentation\/AppStoreServerNotifications\/responseBodyV2DecodedPayload] for version 2 notifications.\n\nFor more information about App Store Server Notification changes, see [doc:\/\/com.apple.appstoreservernotifications\/documentation\/AppStoreServerNotifications\/app-store-server-notifications-changelog].\n\n## Response types\n\n- **notificationType**: The type that describes the In-App Purchase or external purchase event for which the App Store sends the version 2 notification.\n- **subtype**: A string that provides details about select notification types in version 2.\n- **signedDate**: The UNIX time, in milliseconds, that the App Store signed the JSON Web Signature data.\n- **notificationUUID**: A unique identifier for the notification.\n\n",
  "sections" : [
    {
      "content" : "",
      "items" : [
        {
          "description" : "The type that describes the In-App Purchase or external purchase event for which the App Store sends the version 2 notification.",
          "name" : "notificationType",
          "url" : "https:\/\/developer.apple.com\/documentation\/AppStoreServerNotifications\/notificationType"
        },
        {
          "description" : "A string that provides details about select notification types in version 2.",
          "name" : "subtype",
          "url" : "https:\/\/developer.apple.com\/documentation\/AppStoreServerNotifications\/subtype"
        },
        {
          "description" : "The UNIX time, in milliseconds, that the App Store signed the JSON Web Signature data.",
          "name" : "signedDate",
          "url" : "https:\/\/developer.apple.com\/documentation\/AppStoreServerNotifications\/signedDate"
        },
        {
          "description" : "A unique identifier for the notification.",
          "name" : "notificationUUID",
          "url" : "https:\/\/developer.apple.com\/documentation\/AppStoreServerNotifications\/notificationUUID"
        }
      ],
      "title" : "Response types"
    }
  ],
  "source" : "appleJSON",
  "title" : "version",
  "url" : "https:\/\/developer.apple.com\/documentation\/AppStoreServerNotifications\/version"
}