{
  "abstract" : "Sets the current fill color to a value in the DeviceRGB color space.",
  "codeExamples" : [

  ],
  "contentHash" : "87f2eb5359a2a650a027c32d62ceac0b37c4ff5e2ebb4bb15d063184a9f0d742",
  "crawledAt" : "2025-12-09T20:15:56Z",
  "declaration" : {
    "code" : "func setFillColor(red: CGFloat, green: CGFloat, blue: CGFloat, alpha: CGFloat)",
    "language" : "swift"
  },
  "id" : "5D6BB2B4-CBB6-457C-923F-BC6069D8237C",
  "kind" : "method",
  "language" : "swift",
  "module" : "Core Graphics",
  "overview" : "## Discussion\n\nWhen you call this function, two things happen:",
  "platforms" : [
    "iOS",
    "iPadOS",
    "Mac Catalyst",
    "macOS",
    "tvOS",
    "visionOS",
    "watchOS"
  ],
  "rawMarkdown" : "---\nsource: https:\/\/developer.apple.com\/documentation\/CoreGraphics\/CGContext\/setFillColor(red:green:blue:alpha:)\ncrawled: 2025-12-09T20:15:56Z\n---\n\n# setFillColor(red:green:blue:alpha:)\n\n**Instance Method**\n\nSets the current fill color to a value in the DeviceRGB color space.\n\n## Declaration\n\n```swift\nfunc setFillColor(red: CGFloat, green: CGFloat, blue: CGFloat, alpha: CGFloat)\n```\n\n## Parameters\n\n- **red**: The red intensity value for the color to set. The DeviceRGB color space permits the specification of a value ranging from `0.0` (zero intensity) to `1.0` (full intensity).\n- **green**: The green intensity value for the color to set. The DeviceRGB color space permits the specification of a value ranging from `0.0` (zero intensity) to `1.0` (full intensity).\n- **blue**: The blue intensity value for the color to set. The DeviceRGB color space permits the specification of a value ranging from `0.0` (zero intensity) to `1.0` (full intensity).\n- **alpha**: A value that specifies the opacity level. Values can range from `0.0` (transparent) to `1.0` (opaque). Values outside this range are clipped to `0.0` or `1.0`.\n\n## Discussion\n\nWhen you call this function, two things happen:\n\n- Core Graphics sets the current fill color space to DeviceRGB.\n- Core Graphics sets the current fill color to the value specified by the `red`, `green`, `blue`, and `alpha` parameters.\n\n## Setting Fill, Stroke, and Shadow Colors\n\n- **setFillColor(_:)**: Sets the current fill color in a graphics context, using a CGColor.\n- **setFillColor(_:)**: Sets the current fill color.\n- **setFillColor(cyan:magenta:yellow:black:alpha:)**: Sets the current fill color to a value in the DeviceCMYK color space.\n- **setFillColor(gray:alpha:)**: Sets the current fill color to a value in the DeviceGray color space.\n- **setFillColorSpace(_:)**: Sets the fill color space in a graphics context.\n- **setShadow(offset:blur:)**: Enables shadowing in a graphics context.\n- **setShadow(offset:blur:color:)**: Enables shadowing with color a graphics context.\n- **setStrokeColor(_:)**: Sets the current stroke color in a context, using a CGColor.\n- **setStrokeColor(_:)**: Sets the current stroke color.\n- **setStrokeColor(cyan:magenta:yellow:black:alpha:)**: Sets the current stroke color to a value in the DeviceCMYK color space.\n- **setStrokeColor(gray:alpha:)**: Sets the current stroke color to a value in the DeviceGray color space.\n- **setStrokeColor(red:green:blue:alpha:)**: Sets the current stroke color to a value in the DeviceRGB color space.\n- **setStrokeColorSpace(_:)**: Sets the stroke color space in a graphics context.\n- **setStrokePattern(_:colorComponents:)**: Sets the stroke pattern in the specified graphics context.\n- **setAlpha(_:)**: Sets the opacity level for objects drawn in a graphics context.\n\n",
  "sections" : [
    {
      "content" : "",
      "items" : [
        {
          "description" : "Sets the current fill color in a graphics context, using a CGColor.",
          "name" : "setFillColor(_:)",
          "url" : "https:\/\/developer.apple.com\/documentation\/CoreGraphics\/CGContext\/setFillColor(_:)-8lhn8"
        },
        {
          "description" : "Sets the current fill color.",
          "name" : "setFillColor(_:)",
          "url" : "https:\/\/developer.apple.com\/documentation\/CoreGraphics\/CGContext\/setFillColor(_:)-756dy"
        },
        {
          "description" : "Sets the current fill color to a value in the DeviceCMYK color space.",
          "name" : "setFillColor(cyan:magenta:yellow:black:alpha:)",
          "url" : "https:\/\/developer.apple.com\/documentation\/CoreGraphics\/CGContext\/setFillColor(cyan:magenta:yellow:black:alpha:)"
        },
        {
          "description" : "Sets the current fill color to a value in the DeviceGray color space.",
          "name" : "setFillColor(gray:alpha:)",
          "url" : "https:\/\/developer.apple.com\/documentation\/CoreGraphics\/CGContext\/setFillColor(gray:alpha:)"
        },
        {
          "description" : "Sets the fill color space in a graphics context.",
          "name" : "setFillColorSpace(_:)",
          "url" : "https:\/\/developer.apple.com\/documentation\/CoreGraphics\/CGContext\/setFillColorSpace(_:)"
        },
        {
          "description" : "Enables shadowing in a graphics context.",
          "name" : "setShadow(offset:blur:)",
          "url" : "https:\/\/developer.apple.com\/documentation\/CoreGraphics\/CGContext\/setShadow(offset:blur:)"
        },
        {
          "description" : "Enables shadowing with color a graphics context.",
          "name" : "setShadow(offset:blur:color:)",
          "url" : "https:\/\/developer.apple.com\/documentation\/CoreGraphics\/CGContext\/setShadow(offset:blur:color:)"
        },
        {
          "description" : "Sets the current stroke color in a context, using a CGColor.",
          "name" : "setStrokeColor(_:)",
          "url" : "https:\/\/developer.apple.com\/documentation\/CoreGraphics\/CGContext\/setStrokeColor(_:)-1sskg"
        },
        {
          "description" : "Sets the current stroke color.",
          "name" : "setStrokeColor(_:)",
          "url" : "https:\/\/developer.apple.com\/documentation\/CoreGraphics\/CGContext\/setStrokeColor(_:)-4pd8p"
        },
        {
          "description" : "Sets the current stroke color to a value in the DeviceCMYK color space.",
          "name" : "setStrokeColor(cyan:magenta:yellow:black:alpha:)",
          "url" : "https:\/\/developer.apple.com\/documentation\/CoreGraphics\/CGContext\/setStrokeColor(cyan:magenta:yellow:black:alpha:)"
        },
        {
          "description" : "Sets the current stroke color to a value in the DeviceGray color space.",
          "name" : "setStrokeColor(gray:alpha:)",
          "url" : "https:\/\/developer.apple.com\/documentation\/CoreGraphics\/CGContext\/setStrokeColor(gray:alpha:)"
        },
        {
          "description" : "Sets the current stroke color to a value in the DeviceRGB color space.",
          "name" : "setStrokeColor(red:green:blue:alpha:)",
          "url" : "https:\/\/developer.apple.com\/documentation\/CoreGraphics\/CGContext\/setStrokeColor(red:green:blue:alpha:)"
        },
        {
          "description" : "Sets the stroke color space in a graphics context.",
          "name" : "setStrokeColorSpace(_:)",
          "url" : "https:\/\/developer.apple.com\/documentation\/CoreGraphics\/CGContext\/setStrokeColorSpace(_:)"
        },
        {
          "description" : "Sets the stroke pattern in the specified graphics context.",
          "name" : "setStrokePattern(_:colorComponents:)",
          "url" : "https:\/\/developer.apple.com\/documentation\/CoreGraphics\/CGContext\/setStrokePattern(_:colorComponents:)"
        },
        {
          "description" : "Sets the opacity level for objects drawn in a graphics context.",
          "name" : "setAlpha(_:)",
          "url" : "https:\/\/developer.apple.com\/documentation\/CoreGraphics\/CGContext\/setAlpha(_:)"
        }
      ],
      "title" : "Setting Fill, Stroke, and Shadow Colors"
    }
  ],
  "source" : "appleJSON",
  "title" : "setFillColor(red:green:blue:alpha:)",
  "url" : "https:\/\/developer.apple.com\/documentation\/CoreGraphics\/CGContext\/setFillColor(red:green:blue:alpha:)"
}