{
  "abstract" : "Enables or disables stereo operation for a display, as part of a display configuration.",
  "codeExamples" : [

  ],
  "contentHash" : "31fb9fdc5afeb290147eb9ad9b1026343b13576fe525c912beb56f694d2d5775",
  "crawledAt" : "2025-12-05T06:09:57Z",
  "declaration" : {
    "code" : "func CGConfigureDisplayStereoOperation(_ config: CGDisplayConfigRef?, _ display: CGDirectDisplayID, _ stereo: boolean_t, _ forceBlueLine: boolean_t) -> CGError",
    "language" : "swift"
  },
  "id" : "FF4B895E-D90E-45AF-80BB-104D11075BEB",
  "kind" : "function",
  "language" : "swift",
  "module" : "Core Graphics",
  "overview" : "## Return Value\n\nA result code. See `Core Graphics Data Types and Constants`.\n\n## Discussion\n\nThe system normally detects the presence of a stereo window and automatically switches a display containing a stereo window to stereo operation. This function provides a mechanism to force a display to stereo operation, and to set options (blue line sync signal) when in stereo operation.\n\nOn success, the display resolution, mirroring mode, and available display modes may change due to hardware-specific capabilities and limitations. You should check these settings to verify that they are appropriate for your application.",
  "platforms" : [
    "Mac Catalyst",
    "macOS"
  ],
  "rawMarkdown" : "---\nsource: https:\/\/developer.apple.com\/documentation\/CoreGraphics\/CGConfigureDisplayStereoOperation(_:_:_:_:)\ncrawled: 2025-12-05T06:09:57Z\n---\n\n# CGConfigureDisplayStereoOperation(_:_:_:_:)\n\n**Function**\n\nEnables or disables stereo operation for a display, as part of a display configuration.\n\n## Declaration\n\n```swift\nfunc CGConfigureDisplayStereoOperation(_ config: CGDisplayConfigRef?, _ display: CGDirectDisplayID, _ stereo: boolean_t, _ forceBlueLine: boolean_t) -> CGError\n```\n\n## Parameters\n\n- **config**: A display configuration, acquired by calling [doc:\/\/com.apple.coregraphics\/documentation\/CoreGraphics\/CGBeginDisplayConfiguration(_:)].\n- **display**: The identifier of the display being configured.\n- **stereo**: Pass `true` if you want to enable stereo operation. To disable it, pass `false`.\n- **forceBlueLine**: When in stereo operation, a display may need to generate a special stereo sync signal as part of the video output.  The sync signal consists of a blue line which occupies the first 25% of the last scan line for the left eye view, and the first 75% of the last scan line for the right eye view. The remainder of the scan line is black. To force the display to generate this sync signal, pass `true`; otherwise, pass `false`.\n\n## Return Value\n\nA result code. See `Core Graphics Data Types and Constants`.\n\n## Discussion\n\nThe system normally detects the presence of a stereo window and automatically switches a display containing a stereo window to stereo operation. This function provides a mechanism to force a display to stereo operation, and to set options (blue line sync signal) when in stereo operation.\n\nOn success, the display resolution, mirroring mode, and available display modes may change due to hardware-specific capabilities and limitations. You should check these settings to verify that they are appropriate for your application.\n\n## Functions\n\n- **CGAcquireDisplayFadeReservation(_:_:)**: Reserves the fade hardware for a specified time interval.\n- **CGAssociateMouseAndMouseCursorPosition(_:)**: Connects or disconnects the mouse and cursor while an application is in the foreground.\n- **CGBeginDisplayConfiguration(_:)**: Begins a new set of display configuration changes.\n- **CGCancelDisplayConfiguration(_:)**: Cancels a set of display configuration changes.\n- **CGCaptureAllDisplays()**: Obtains exclusive use of all active displays, preventing other applications and system services from using the display or changing its configuration.\n- **CGCaptureAllDisplaysWithOptions(_:)**: Captures all attached displays, using the specified options.\n- **CGCompleteDisplayConfiguration(_:_:)**: Completes a set of display configuration changes.\n- **CGConfigureDisplayFadeEffect(_:_:_:_:_:_:)**: Modifies the settings of the built-in fade effect that occurs during a display configuration.\n- **CGConfigureDisplayMirrorOfDisplay(_:_:_:)**: Changes the configuration of a mirroring set.\n- **CGConfigureDisplayMode(_:_:_:)**: Configures the display mode of a display.\n- **CGConfigureDisplayOrigin(_:_:_:_:)**: Configures the origin of a display relative to the global display coordinate space.\n- **CGConfigureDisplayWithDisplayMode(_:_:_:_:)**: Configures the display mode of a display.\n- **CGCursorIsDrawnInFramebuffer()**: Returns a Boolean value indicating whether the mouse cursor is drawn in framebuffer memory.\n- **CGCursorIsVisible()**: Returns a Boolean value indicating whether the mouse cursor is visible.\n- **CGDirectDisplayCopyCurrentMetalDevice(_:)**: Returns the GPU device instance that’s currently driving a display.\n\n",
  "sections" : [
    {
      "content" : "",
      "items" : [
        {
          "description" : "Reserves the fade hardware for a specified time interval.",
          "name" : "CGAcquireDisplayFadeReservation(_:_:)",
          "url" : "https:\/\/developer.apple.com\/documentation\/CoreGraphics\/CGAcquireDisplayFadeReservation(_:_:)"
        },
        {
          "description" : "Connects or disconnects the mouse and cursor while an application is in the foreground.",
          "name" : "CGAssociateMouseAndMouseCursorPosition(_:)",
          "url" : "https:\/\/developer.apple.com\/documentation\/CoreGraphics\/CGAssociateMouseAndMouseCursorPosition(_:)"
        },
        {
          "description" : "Begins a new set of display configuration changes.",
          "name" : "CGBeginDisplayConfiguration(_:)",
          "url" : "https:\/\/developer.apple.com\/documentation\/CoreGraphics\/CGBeginDisplayConfiguration(_:)"
        },
        {
          "description" : "Cancels a set of display configuration changes.",
          "name" : "CGCancelDisplayConfiguration(_:)",
          "url" : "https:\/\/developer.apple.com\/documentation\/CoreGraphics\/CGCancelDisplayConfiguration(_:)"
        },
        {
          "description" : "Obtains exclusive use of all active displays, preventing other applications and system services from using the display or changing its configuration.",
          "name" : "CGCaptureAllDisplays()",
          "url" : "https:\/\/developer.apple.com\/documentation\/CoreGraphics\/CGCaptureAllDisplays()"
        },
        {
          "description" : "Captures all attached displays, using the specified options.",
          "name" : "CGCaptureAllDisplaysWithOptions(_:)",
          "url" : "https:\/\/developer.apple.com\/documentation\/CoreGraphics\/CGCaptureAllDisplaysWithOptions(_:)"
        },
        {
          "description" : "Completes a set of display configuration changes.",
          "name" : "CGCompleteDisplayConfiguration(_:_:)",
          "url" : "https:\/\/developer.apple.com\/documentation\/CoreGraphics\/CGCompleteDisplayConfiguration(_:_:)"
        },
        {
          "description" : "Modifies the settings of the built-in fade effect that occurs during a display configuration.",
          "name" : "CGConfigureDisplayFadeEffect(_:_:_:_:_:_:)",
          "url" : "https:\/\/developer.apple.com\/documentation\/CoreGraphics\/CGConfigureDisplayFadeEffect(_:_:_:_:_:_:)"
        },
        {
          "description" : "Changes the configuration of a mirroring set.",
          "name" : "CGConfigureDisplayMirrorOfDisplay(_:_:_:)",
          "url" : "https:\/\/developer.apple.com\/documentation\/CoreGraphics\/CGConfigureDisplayMirrorOfDisplay(_:_:_:)"
        },
        {
          "description" : "Configures the display mode of a display.",
          "name" : "CGConfigureDisplayMode(_:_:_:)",
          "url" : "https:\/\/developer.apple.com\/documentation\/CoreGraphics\/CGConfigureDisplayMode(_:_:_:)"
        },
        {
          "description" : "Configures the origin of a display relative to the global display coordinate space.",
          "name" : "CGConfigureDisplayOrigin(_:_:_:_:)",
          "url" : "https:\/\/developer.apple.com\/documentation\/CoreGraphics\/CGConfigureDisplayOrigin(_:_:_:_:)"
        },
        {
          "description" : "Configures the display mode of a display.",
          "name" : "CGConfigureDisplayWithDisplayMode(_:_:_:_:)",
          "url" : "https:\/\/developer.apple.com\/documentation\/CoreGraphics\/CGConfigureDisplayWithDisplayMode(_:_:_:_:)"
        },
        {
          "description" : "Returns a Boolean value indicating whether the mouse cursor is drawn in framebuffer memory.",
          "name" : "CGCursorIsDrawnInFramebuffer()",
          "url" : "https:\/\/developer.apple.com\/documentation\/CoreGraphics\/CGCursorIsDrawnInFramebuffer()"
        },
        {
          "description" : "Returns a Boolean value indicating whether the mouse cursor is visible.",
          "name" : "CGCursorIsVisible()",
          "url" : "https:\/\/developer.apple.com\/documentation\/CoreGraphics\/CGCursorIsVisible()"
        },
        {
          "description" : "Returns the GPU device instance that’s currently driving a display.",
          "name" : "CGDirectDisplayCopyCurrentMetalDevice(_:)",
          "url" : "https:\/\/developer.apple.com\/documentation\/CoreGraphics\/CGDirectDisplayCopyCurrentMetalDevice(_:)"
        }
      ],
      "title" : "Functions"
    }
  ],
  "source" : "appleJSON",
  "title" : "CGConfigureDisplayStereoOperation(_:_:_:_:)",
  "url" : "https:\/\/developer.apple.com\/documentation\/CoreGraphics\/CGConfigureDisplayStereoOperation(_:_:_:_:)"
}