{
  "abstract" : "A list of descriptors that specify the extent or scope of the media.",
  "codeExamples" : [

  ],
  "contentHash" : "eb61d5e30be6e4090903fa57c94d04cb7abcd9382e43361abfcf800da5cc77c4",
  "crawledAt" : "2025-12-02T07:59:37Z",
  "declaration" : {
    "code" : "var coverage: [String]? { get set }",
    "language" : "swift"
  },
  "id" : "5920254E-97DB-4B05-98F0-A2F8BB6A0C8D",
  "kind" : "property",
  "module" : "Core Spotlight",
  "overview" : "## Discussion\n\nThe string values in this property typically include a location (such as a place name or geographic coordinates), a temporal period (such as a period label, date, or date range), or a jurisdiction (such as a named administrative entity).\n\nIt’s recommended that you select a value from a controlled vocabulary, and that when you need to specify a place or time period, you use a name instead of a numeric identifier, such as a set of coordinates or a date range.",
  "platforms" : [
    "iOS",
    "iPadOS",
    "Mac Catalyst",
    "macOS",
    "visionOS"
  ],
  "rawMarkdown" : "---\nsource: https:\/\/developer.apple.com\/documentation\/CoreSpotlight\/CSSearchableItemAttributeSet\/coverage\ncrawled: 2025-12-02T07:59:37Z\n---\n\n# coverage\n\n**Instance Property**\n\nA list of descriptors that specify the extent or scope of the media.\n\n## Declaration\n\n```swift\nvar coverage: [String]? { get set }\n```\n\n## Discussion\n\nThe string values in this property typically include a location (such as a place name or geographic coordinates), a temporal period (such as a period label, date, or date range), or a jurisdiction (such as a named administrative entity).\n\nIt’s recommended that you select a value from a controlled vocabulary, and that when you need to specify a place or time period, you use a name instead of a numeric identifier, such as a set of coordinates or a date range.\n\n## Describing media\n\n- **comment**: A comment related to the media file.\n- **contentCreationDate**: The creation date of an edited or optimized version of the song or composition.\n- **contentModificationDate**: The date on which the contents of the file was last modified.\n- **contentSources**: An array of sources from which the media was obtained.\n- **copyright**: The copyright date of the content.\n- **downloadedDate**: The most recent date on which the file was downloaded or received.\n- **editors**: A list of editors who have worked on the file.\n- **lastUsedDate**: The date on which the file was last used.\n- **participants**: A list of people who are visible in an image or movie or written about in a document.\n- **projects**: A list of projects of which this file is a part.\n- **addedDate**: The date on which the item was moved into its current location.\n- **codecs**: The codecs used to encode\/decode the media.\n- **contactKeywords**: A list of contacts who are associated with the content in some way, not including the author.\n- **deliveryType**: The delivery type of the file.\n- **duration**: The duration (if appropriate) of the content of the file, in seconds.\n\n",
  "sections" : [
    {
      "content" : "",
      "items" : [
        {
          "description" : "A comment related to the media file.",
          "name" : "comment",
          "url" : "https:\/\/developer.apple.com\/documentation\/CoreSpotlight\/CSSearchableItemAttributeSet\/comment"
        },
        {
          "description" : "The creation date of an edited or optimized version of the song or composition.",
          "name" : "contentCreationDate",
          "url" : "https:\/\/developer.apple.com\/documentation\/CoreSpotlight\/CSSearchableItemAttributeSet\/contentCreationDate"
        },
        {
          "description" : "The date on which the contents of the file was last modified.",
          "name" : "contentModificationDate",
          "url" : "https:\/\/developer.apple.com\/documentation\/CoreSpotlight\/CSSearchableItemAttributeSet\/contentModificationDate"
        },
        {
          "description" : "An array of sources from which the media was obtained.",
          "name" : "contentSources",
          "url" : "https:\/\/developer.apple.com\/documentation\/CoreSpotlight\/CSSearchableItemAttributeSet\/contentSources"
        },
        {
          "description" : "The copyright date of the content.",
          "name" : "copyright",
          "url" : "https:\/\/developer.apple.com\/documentation\/CoreSpotlight\/CSSearchableItemAttributeSet\/copyright"
        },
        {
          "description" : "The most recent date on which the file was downloaded or received.",
          "name" : "downloadedDate",
          "url" : "https:\/\/developer.apple.com\/documentation\/CoreSpotlight\/CSSearchableItemAttributeSet\/downloadedDate"
        },
        {
          "description" : "A list of editors who have worked on the file.",
          "name" : "editors",
          "url" : "https:\/\/developer.apple.com\/documentation\/CoreSpotlight\/CSSearchableItemAttributeSet\/editors"
        },
        {
          "description" : "The date on which the file was last used.",
          "name" : "lastUsedDate",
          "url" : "https:\/\/developer.apple.com\/documentation\/CoreSpotlight\/CSSearchableItemAttributeSet\/lastUsedDate"
        },
        {
          "description" : "A list of people who are visible in an image or movie or written about in a document.",
          "name" : "participants",
          "url" : "https:\/\/developer.apple.com\/documentation\/CoreSpotlight\/CSSearchableItemAttributeSet\/participants"
        },
        {
          "description" : "A list of projects of which this file is a part.",
          "name" : "projects",
          "url" : "https:\/\/developer.apple.com\/documentation\/CoreSpotlight\/CSSearchableItemAttributeSet\/projects"
        },
        {
          "description" : "The date on which the item was moved into its current location.",
          "name" : "addedDate",
          "url" : "https:\/\/developer.apple.com\/documentation\/CoreSpotlight\/CSSearchableItemAttributeSet\/addedDate"
        },
        {
          "description" : "The codecs used to encode\/decode the media.",
          "name" : "codecs",
          "url" : "https:\/\/developer.apple.com\/documentation\/CoreSpotlight\/CSSearchableItemAttributeSet\/codecs"
        },
        {
          "description" : "A list of contacts who are associated with the content in some way, not including the author.",
          "name" : "contactKeywords",
          "url" : "https:\/\/developer.apple.com\/documentation\/CoreSpotlight\/CSSearchableItemAttributeSet\/contactKeywords"
        },
        {
          "description" : "The delivery type of the file.",
          "name" : "deliveryType",
          "url" : "https:\/\/developer.apple.com\/documentation\/CoreSpotlight\/CSSearchableItemAttributeSet\/deliveryType"
        },
        {
          "description" : "The duration (if appropriate) of the content of the file, in seconds.",
          "name" : "duration",
          "url" : "https:\/\/developer.apple.com\/documentation\/CoreSpotlight\/CSSearchableItemAttributeSet\/duration"
        }
      ],
      "title" : "Describing media"
    }
  ],
  "source" : "appleJSON",
  "title" : "coverage",
  "url" : "https:\/\/developer.apple.com\/documentation\/CoreSpotlight\/CSSearchableItemAttributeSet\/coverage"
}