{
  "abstract" : "The unique identifier for the item to which the activity is related.",
  "codeExamples" : [

  ],
  "contentHash" : "32231f076efe2a2e6e8b6a0a827ef0fbc3bf8a9a0f8b5ca4604b7b9cddf5d6bf",
  "crawledAt" : "2025-12-02T07:58:38Z",
  "declaration" : {
    "code" : "var relatedUniqueIdentifier: String? { get set }",
    "language" : "swift"
  },
  "id" : "7D7BB866-0335-4156-A068-23A54075D19A",
  "kind" : "property",
  "module" : "Core Spotlight",
  "overview" : "## Discussion\n\nIf you’re using both [doc:\/\/com.apple.documentation\/documentation\/Foundation\/NSUserActivity] and Core Spotlight APIs to index the same item, set this property in the activity to specify the unique identifier of the Core Spotlight item to which the activity is related, and to avoid displaying duplicate results in Spotlight.\n\nIf the unique identifier to which the activity is related hasn’t already been indexed with Core Spotlight, the activity won’t be indexed. Note that when the item is deleted, the related activity is also deleted, unlike the behavior of [doc:\/\/com.apple.corespotlight\/documentation\/CoreSpotlight\/CSSearchableItemAttributeSet\/weakRelatedUniqueIdentifier].",
  "platforms" : [
    "iOS",
    "iPadOS",
    "Mac Catalyst",
    "macOS",
    "visionOS"
  ],
  "rawMarkdown" : "---\nsource: https:\/\/developer.apple.com\/documentation\/CoreSpotlight\/CSSearchableItemAttributeSet\/relatedUniqueIdentifier\ncrawled: 2025-12-02T07:58:38Z\n---\n\n# relatedUniqueIdentifier\n\n**Instance Property**\n\nThe unique identifier for the item to which the activity is related.\n\n## Declaration\n\n```swift\nvar relatedUniqueIdentifier: String? { get set }\n```\n\n## Discussion\n\nIf you’re using both [doc:\/\/com.apple.documentation\/documentation\/Foundation\/NSUserActivity] and Core Spotlight APIs to index the same item, set this property in the activity to specify the unique identifier of the Core Spotlight item to which the activity is related, and to avoid displaying duplicate results in Spotlight.\n\nIf the unique identifier to which the activity is related hasn’t already been indexed with Core Spotlight, the activity won’t be indexed. Note that when the item is deleted, the related activity is also deleted, unlike the behavior of [doc:\/\/com.apple.corespotlight\/documentation\/CoreSpotlight\/CSSearchableItemAttributeSet\/weakRelatedUniqueIdentifier].\n\n## Describing general attributes\n\n- **alternateNames**: An array of localized strings that represent alternate display names for the item.\n- **contentType**: The uniform type identifier (UTI) of the item.\n- **contentTypeTree**: An attribute type that identifies a custom hierarchy of types to describe the attributes of your item.\n- **contentURL**: The file URL of the content to index.\n- **darkThumbnailURL**: The local file URL of the thumbnail image for the item when Dark Mode is active.\n- **displayName**: A localized string that contains the name of the item, suitable to display in the user interface.\n- **keywords**: An array of keywords associated with the item, such as work, birthday, important, and so on.\n- **metadataModificationDate**: The date on which the last metadata attribute was changed.\n- **path**: The complete path to the item.\n- **rankingHint**: A number that indicates the relative importance of the item among other items from the app.\n- **thumbnailData**: Image data that represents the thumbnail of the item.\n- **thumbnailURL**: The local file URL of the thumbnail image for the item.\n- **title**: The title of the item.\n- **domainIdentifier**: An identifier that represents the domain or owner of the item.\n- **weakRelatedUniqueIdentifier**: The unique identifier for the item to which the activity is related, but not linked.\n\n",
  "sections" : [
    {
      "content" : "",
      "items" : [
        {
          "description" : "An array of localized strings that represent alternate display names for the item.",
          "name" : "alternateNames",
          "url" : "https:\/\/developer.apple.com\/documentation\/CoreSpotlight\/CSSearchableItemAttributeSet\/alternateNames"
        },
        {
          "description" : "The uniform type identifier (UTI) of the item.",
          "name" : "contentType",
          "url" : "https:\/\/developer.apple.com\/documentation\/CoreSpotlight\/CSSearchableItemAttributeSet\/contentType"
        },
        {
          "description" : "An attribute type that identifies a custom hierarchy of types to describe the attributes of your item.",
          "name" : "contentTypeTree",
          "url" : "https:\/\/developer.apple.com\/documentation\/CoreSpotlight\/CSSearchableItemAttributeSet\/contentTypeTree"
        },
        {
          "description" : "The file URL of the content to index.",
          "name" : "contentURL",
          "url" : "https:\/\/developer.apple.com\/documentation\/CoreSpotlight\/CSSearchableItemAttributeSet\/contentURL"
        },
        {
          "description" : "The local file URL of the thumbnail image for the item when Dark Mode is active.",
          "name" : "darkThumbnailURL",
          "url" : "https:\/\/developer.apple.com\/documentation\/CoreSpotlight\/CSSearchableItemAttributeSet\/darkThumbnailURL"
        },
        {
          "description" : "A localized string that contains the name of the item, suitable to display in the user interface.",
          "name" : "displayName",
          "url" : "https:\/\/developer.apple.com\/documentation\/CoreSpotlight\/CSSearchableItemAttributeSet\/displayName"
        },
        {
          "description" : "An array of keywords associated with the item, such as work, birthday, important, and so on.",
          "name" : "keywords",
          "url" : "https:\/\/developer.apple.com\/documentation\/CoreSpotlight\/CSSearchableItemAttributeSet\/keywords"
        },
        {
          "description" : "The date on which the last metadata attribute was changed.",
          "name" : "metadataModificationDate",
          "url" : "https:\/\/developer.apple.com\/documentation\/CoreSpotlight\/CSSearchableItemAttributeSet\/metadataModificationDate"
        },
        {
          "description" : "The complete path to the item.",
          "name" : "path",
          "url" : "https:\/\/developer.apple.com\/documentation\/CoreSpotlight\/CSSearchableItemAttributeSet\/path"
        },
        {
          "description" : "A number that indicates the relative importance of the item among other items from the app.",
          "name" : "rankingHint",
          "url" : "https:\/\/developer.apple.com\/documentation\/CoreSpotlight\/CSSearchableItemAttributeSet\/rankingHint"
        },
        {
          "description" : "Image data that represents the thumbnail of the item.",
          "name" : "thumbnailData",
          "url" : "https:\/\/developer.apple.com\/documentation\/CoreSpotlight\/CSSearchableItemAttributeSet\/thumbnailData"
        },
        {
          "description" : "The local file URL of the thumbnail image for the item.",
          "name" : "thumbnailURL",
          "url" : "https:\/\/developer.apple.com\/documentation\/CoreSpotlight\/CSSearchableItemAttributeSet\/thumbnailURL"
        },
        {
          "description" : "The title of the item.",
          "name" : "title",
          "url" : "https:\/\/developer.apple.com\/documentation\/CoreSpotlight\/CSSearchableItemAttributeSet\/title"
        },
        {
          "description" : "An identifier that represents the domain or owner of the item.",
          "name" : "domainIdentifier",
          "url" : "https:\/\/developer.apple.com\/documentation\/CoreSpotlight\/CSSearchableItemAttributeSet\/domainIdentifier"
        },
        {
          "description" : "The unique identifier for the item to which the activity is related, but not linked.",
          "name" : "weakRelatedUniqueIdentifier",
          "url" : "https:\/\/developer.apple.com\/documentation\/CoreSpotlight\/CSSearchableItemAttributeSet\/weakRelatedUniqueIdentifier"
        }
      ],
      "title" : "Describing general attributes"
    }
  ],
  "source" : "appleJSON",
  "title" : "relatedUniqueIdentifier",
  "url" : "https:\/\/developer.apple.com\/documentation\/CoreSpotlight\/CSSearchableItemAttributeSet\/relatedUniqueIdentifier"
}