{
  "abstract" : "Set flags on vImage operations to specify processing options.",
  "codeExamples" : [
    {
      "code" : "kvImageLeaveAlphaUnchanged + kvImageDoNotTile",
      "language" : "objc"
    }
  ],
  "contentHash" : "d06b7ee292b2cb137db613aec53e3d3a01104e458a5d8ad1b0ffe89433e0376a",
  "crawledAt" : "2025-12-03T21:00:03Z",
  "id" : "561B202A-6B02-4F54-BA61-0C31E5E03C3B",
  "kind" : "collection",
  "language" : "swift",
  "module" : "Accelerate",
  "overview" : "## Overview\n\nYou can pass multiple flags to a function by adding the flag values together. For example, to leave alpha unchanged and turn off tiling, you can pass:\n\nThree of the flags are mutually exclusive: `kvImageCopyInPlace`, `kvImageBackgroundColorFill`, and `kvImageEdgeExtend`. Never pass more than one of these flag values in the same flag parameter.\n\nWhen passing flags to a function, do not set values for flags that are not used by the function. If the function requires you to set certain flag values, do so. For example, for the convolution function, you must set exactly one of `kvImageCopyInPlace`, `kvImageBackgroundColorFill`, and `kvImageEdgeExtend`.  Otherwise the function may return an error. If you don’t want to set flag values, pass `kvImageNoFlags`.",
  "rawMarkdown" : "---\nsource: https:\/\/developer.apple.com\/documentation\/accelerate\/1578976-processing-flags\ncrawled: 2025-12-03T21:00:03Z\n---\n\n# Processing Flags\n\n**API Collection**\n\nSet flags on vImage operations to specify processing options.\n\n## Overview\n\nYou can pass multiple flags to a function by adding the flag values together. For example, to leave alpha unchanged and turn off tiling, you can pass:\n\n```objc\nkvImageLeaveAlphaUnchanged + kvImageDoNotTile\n```\n\nThree of the flags are mutually exclusive: `kvImageCopyInPlace`, `kvImageBackgroundColorFill`, and `kvImageEdgeExtend`. Never pass more than one of these flag values in the same flag parameter.\n\nWhen passing flags to a function, do not set values for flags that are not used by the function. If the function requires you to set certain flag values, do so. For example, for the convolution function, you must set exactly one of `kvImageCopyInPlace`, `kvImageBackgroundColorFill`, and `kvImageEdgeExtend`.  Otherwise the function may return an error. If you don’t want to set flag values, pass `kvImageNoFlags`.\n\n## Constants\n\n- **vImage.Options**: Set flags on vImage operations to specify processing options.\n- **kvImageNoFlags**: A flag that sets the behavior to the default.\n- **kvImageLeaveAlphaUnchanged**: A flag that restricts the operation to red, green, and blue channels only.\n- **kvImageDoNotTile**: A flag that disables vImage internal tiling routines.\n- **kvImageHighQualityResampling**: A flag that uses a higher-quality, slower resampling filter for geometry operations.\n- **kvImageGetTempBufferSize**: A flag that returns the minimum temporary buffer size for the operation, given the parameters provided.\n- **kvImagePrintDiagnosticsToConsole**: A flag that prints a debug message if the operation fails.\n- **kvImageNoAllocate**: A flag that prevents vImage from allocating additional storage.\n- **kvImageHDRContent**: A flag that uses HDR-aware methods.\n- **kvImageDoNotClamp**: A flag that disables clamping in some conversions to floating-point formats.\n- **kvImageUseFP16Accumulator**: A flag that specifies vImage uses faster but lower-precision internal arithmetic for floating-point 16-bit operations.\n\n## Edging Modes\n\n- **kvImageCopyInPlace**: A flag that copies the value of the edge pixel in the source to the destination.\n- **kvImageBackgroundColorFill**: A flag that uses the background color for missing pixels.\n- **kvImageEdgeExtend**: A flag that extends the edges of the image infinitely.\n- **kvImageTruncateKernel**: A flag that uses only the part of the kernel that overlaps the image.\n\n## Constants\n\n- **Error codes**: Error codes that vImage functions return when an operation fails.\n- **Core Video Image Format Errors**\n- **Dithering Methods**: Specify the dithering method some vImage conversion functions use.\n- **Availability Flags**: Obtain the availability of particular vImage features.\n- **Decode Arrays**: Specify the decode array constant to use with 16Q12-formatted data.\n- **Buffer Types**: Look up buffer type codes vImage conversions provide.\n- **vImageMatrixType**: An enumeration of RGB -> Y’CbCr conversion matrix types.\n- **vImage_WarpInterpolation**: Constants for selecting the interpolation mode\n\n",
  "sections" : [
    {
      "content" : "",
      "items" : [
        {
          "description" : "Set flags on vImage operations to specify processing options.",
          "name" : "vImage.Options",
          "url" : "https:\/\/developer.apple.com\/documentation\/Accelerate\/vImage\/Options"
        },
        {
          "description" : "A flag that sets the behavior to the default.",
          "name" : "kvImageNoFlags",
          "url" : "https:\/\/developer.apple.com\/documentation\/Accelerate\/kvImageNoFlags"
        },
        {
          "description" : "A flag that restricts the operation to red, green, and blue channels only.",
          "name" : "kvImageLeaveAlphaUnchanged",
          "url" : "https:\/\/developer.apple.com\/documentation\/Accelerate\/kvImageLeaveAlphaUnchanged"
        },
        {
          "description" : "A flag that disables vImage internal tiling routines.",
          "name" : "kvImageDoNotTile",
          "url" : "https:\/\/developer.apple.com\/documentation\/Accelerate\/kvImageDoNotTile"
        },
        {
          "description" : "A flag that uses a higher-quality, slower resampling filter for geometry operations.",
          "name" : "kvImageHighQualityResampling",
          "url" : "https:\/\/developer.apple.com\/documentation\/Accelerate\/kvImageHighQualityResampling"
        },
        {
          "description" : "A flag that returns the minimum temporary buffer size for the operation, given the parameters provided.",
          "name" : "kvImageGetTempBufferSize",
          "url" : "https:\/\/developer.apple.com\/documentation\/Accelerate\/kvImageGetTempBufferSize"
        },
        {
          "description" : "A flag that prints a debug message if the operation fails.",
          "name" : "kvImagePrintDiagnosticsToConsole",
          "url" : "https:\/\/developer.apple.com\/documentation\/Accelerate\/kvImagePrintDiagnosticsToConsole"
        },
        {
          "description" : "A flag that prevents vImage from allocating additional storage.",
          "name" : "kvImageNoAllocate",
          "url" : "https:\/\/developer.apple.com\/documentation\/Accelerate\/kvImageNoAllocate"
        },
        {
          "description" : "A flag that uses HDR-aware methods.",
          "name" : "kvImageHDRContent",
          "url" : "https:\/\/developer.apple.com\/documentation\/Accelerate\/kvImageHDRContent"
        },
        {
          "description" : "A flag that disables clamping in some conversions to floating-point formats.",
          "name" : "kvImageDoNotClamp",
          "url" : "https:\/\/developer.apple.com\/documentation\/Accelerate\/kvImageDoNotClamp"
        },
        {
          "description" : "A flag that specifies vImage uses faster but lower-precision internal arithmetic for floating-point 16-bit operations.",
          "name" : "kvImageUseFP16Accumulator",
          "url" : "https:\/\/developer.apple.com\/documentation\/Accelerate\/kvImageUseFP16Accumulator"
        }
      ],
      "title" : "Constants"
    },
    {
      "content" : "",
      "items" : [
        {
          "description" : "A flag that copies the value of the edge pixel in the source to the destination.",
          "name" : "kvImageCopyInPlace",
          "url" : "https:\/\/developer.apple.com\/documentation\/Accelerate\/kvImageCopyInPlace"
        },
        {
          "description" : "A flag that uses the background color for missing pixels.",
          "name" : "kvImageBackgroundColorFill",
          "url" : "https:\/\/developer.apple.com\/documentation\/Accelerate\/kvImageBackgroundColorFill"
        },
        {
          "description" : "A flag that extends the edges of the image infinitely.",
          "name" : "kvImageEdgeExtend",
          "url" : "https:\/\/developer.apple.com\/documentation\/Accelerate\/kvImageEdgeExtend"
        },
        {
          "description" : "A flag that uses only the part of the kernel that overlaps the image.",
          "name" : "kvImageTruncateKernel",
          "url" : "https:\/\/developer.apple.com\/documentation\/Accelerate\/kvImageTruncateKernel"
        }
      ],
      "title" : "Edging Modes"
    },
    {
      "content" : "",
      "items" : [
        {
          "description" : "Error codes that vImage functions return when an operation fails.",
          "name" : "Error codes",
          "url" : "https:\/\/developer.apple.com\/documentation\/Accelerate\/1578972-error-codes"
        },
        {
          "description" : "",
          "name" : "Core Video Image Format Errors",
          "url" : "https:\/\/developer.apple.com\/documentation\/Accelerate\/1498271-core-video-image-format-errors"
        },
        {
          "description" : "Specify the dithering method some vImage conversion functions use.",
          "name" : "Dithering Methods",
          "url" : "https:\/\/developer.apple.com\/documentation\/Accelerate\/1533233-dithering-methods"
        },
        {
          "description" : "Obtain the availability of particular vImage features.",
          "name" : "Availability Flags",
          "url" : "https:\/\/developer.apple.com\/documentation\/Accelerate\/availability-flags"
        },
        {
          "description" : "Specify the decode array constant to use with 16Q12-formatted data.",
          "name" : "Decode Arrays",
          "url" : "https:\/\/developer.apple.com\/documentation\/Accelerate\/decode-arrays"
        },
        {
          "description" : "Look up buffer type codes vImage conversions provide.",
          "name" : "Buffer Types",
          "url" : "https:\/\/developer.apple.com\/documentation\/Accelerate\/buffer-types"
        },
        {
          "description" : "An enumeration of RGB -> Y’CbCr conversion matrix types.",
          "name" : "vImageMatrixType",
          "url" : "https:\/\/developer.apple.com\/documentation\/Accelerate\/vImageMatrixType"
        },
        {
          "description" : "Constants for selecting the interpolation mode",
          "name" : "vImage_WarpInterpolation",
          "url" : "https:\/\/developer.apple.com\/documentation\/Accelerate\/vImage_WarpInterpolation"
        }
      ],
      "title" : "Constants"
    }
  ],
  "source" : "appleJSON",
  "title" : "Processing Flags",
  "url" : "https:\/\/developer.apple.com\/documentation\/accelerate\/1578976-processing-flags"
}