{
  "abstract" : "Create displayable representations of vImage buffers.",
  "codeExamples" : [
    {
      "code" : "let result = try? destinationBuffer.createCGImage(format: format)\n\nif let result = result {\n    \/\/ Assumes `imageView` is a `UIImageView`\n    imageView.image = UIImage(cgImage: result)\n}",
      "language" : "swift"
    }
  ],
  "contentHash" : "96133c865270a6a33d7b736251ab850963d7aadc99781081e6551137c0c27b99",
  "crawledAt" : "2025-12-02T15:37:07Z",
  "id" : "E85BC829-5388-4E70-9C65-16B1C15B748A",
  "kind" : "article",
  "language" : "swift",
  "module" : "Accelerate",
  "overview" : "## Overview\n\nvImage provides a function for creating Core Graphics images from vImage buffers. This function allows you to display the results of a vImage operation to your user.\n\n### Create the Image\n\nYou create a Core Graphics image from the buffer, and initialize a [doc:\/\/com.apple.documentation\/documentation\/UIKit\/UIImage] instance from that. The [doc:\/\/com.apple.accelerate\/documentation\/Accelerate\/vImage_Buffer\/createCGImage(format:flags:)] function returns a [doc:\/\/com.apple.documentation\/documentation\/CoreGraphics\/CGImage] instance based on the supplied Core Graphics image format (for more information, see [doc:\/\/com.apple.documentation\/documentation\/Accelerate\/converting-bitmap-data-between-core-graphics-images-and-vimage-buffers]).\n\nThe following example shows how to create a Core Graphics image from a vImage buffer:",
  "rawMarkdown" : "---\nsource: https:\/\/developer.apple.com\/documentation\/Accelerate\/creating-a-core-graphics-image-from-a-vimage-buffer\ncrawled: 2025-12-02T15:37:07Z\n---\n\n# Creating a Core Graphics Image from a vImage Buffer\n\n**Article**\n\nCreate displayable representations of vImage buffers.\n\n## Overview\n\nvImage provides a function for creating Core Graphics images from vImage buffers. This function allows you to display the results of a vImage operation to your user.\n\n### Create the Image\n\nYou create a Core Graphics image from the buffer, and initialize a [doc:\/\/com.apple.documentation\/documentation\/UIKit\/UIImage] instance from that. The [doc:\/\/com.apple.accelerate\/documentation\/Accelerate\/vImage_Buffer\/createCGImage(format:flags:)] function returns a [doc:\/\/com.apple.documentation\/documentation\/CoreGraphics\/CGImage] instance based on the supplied Core Graphics image format (for more information, see [doc:\/\/com.apple.documentation\/documentation\/Accelerate\/converting-bitmap-data-between-core-graphics-images-and-vimage-buffers]).\n\nThe following example shows how to create a Core Graphics image from a vImage buffer:\n\n```swift\nlet result = try? destinationBuffer.createCGImage(format: format)\n\nif let result = result {\n    \/\/ Assumes `imageView` is a `UIImageView`\n    imageView.image = UIImage(cgImage: result)\n}\n```\n\n## Image Processing Essentials\n\n- **Converting bitmap data between Core Graphics images and vImage buffers**: Pass image data between Core Graphics and vImage to create and manipulate images.\n- **Creating and Populating Buffers from Core Graphics Images**: Initialize vImage buffers from Core Graphics images.\n- **Building a Basic Image-Processing Workflow**: Resize an image with vImage.\n- **Applying geometric transforms to images**: Reflect, shear, rotate, and scale image buffers using vImage.\n- **Compositing images with alpha blending**: Combine two images by using alpha blending to create a single output.\n- **Compositing images with vImage blend modes**: Combine two images by using blend modes to create a single output.\n- **Applying vImage operations to regions of interest**: Limit the effect of vImage operations to rectangular regions of interest.\n- **Optimizing image-processing performance**: Improve your app’s performance by converting image buffer formats from interleaved to planar.\n- **vImage**: Manipulate large images using the CPU’s vector processor.\n\n",
  "sections" : [
    {
      "content" : "",
      "items" : [
        {
          "description" : "Pass image data between Core Graphics and vImage to create and manipulate images.",
          "name" : "Converting bitmap data between Core Graphics images and vImage buffers",
          "url" : "https:\/\/developer.apple.com\/documentation\/Accelerate\/converting-bitmap-data-between-core-graphics-images-and-vimage-buffers"
        },
        {
          "description" : "Initialize vImage buffers from Core Graphics images.",
          "name" : "Creating and Populating Buffers from Core Graphics Images",
          "url" : "https:\/\/developer.apple.com\/documentation\/Accelerate\/creating-and-populating-buffers-from-core-graphics-images"
        },
        {
          "description" : "Resize an image with vImage.",
          "name" : "Building a Basic Image-Processing Workflow",
          "url" : "https:\/\/developer.apple.com\/documentation\/Accelerate\/building-a-basic-image-processing-workflow"
        },
        {
          "description" : "Reflect, shear, rotate, and scale image buffers using vImage.",
          "name" : "Applying geometric transforms to images",
          "url" : "https:\/\/developer.apple.com\/documentation\/Accelerate\/applying-geometric-transforms-to-images"
        },
        {
          "description" : "Combine two images by using alpha blending to create a single output.",
          "name" : "Compositing images with alpha blending",
          "url" : "https:\/\/developer.apple.com\/documentation\/Accelerate\/compositing-images-with-alpha-blending"
        },
        {
          "description" : "Combine two images by using blend modes to create a single output.",
          "name" : "Compositing images with vImage blend modes",
          "url" : "https:\/\/developer.apple.com\/documentation\/Accelerate\/compositing-images-with-vimage-blend-modes"
        },
        {
          "description" : "Limit the effect of vImage operations to rectangular regions of interest.",
          "name" : "Applying vImage operations to regions of interest",
          "url" : "https:\/\/developer.apple.com\/documentation\/Accelerate\/applying-vimage-operations-to-regions-of-interest"
        },
        {
          "description" : "Improve your app’s performance by converting image buffer formats from interleaved to planar.",
          "name" : "Optimizing image-processing performance",
          "url" : "https:\/\/developer.apple.com\/documentation\/Accelerate\/optimizing-image-processing-performance"
        },
        {
          "description" : "Manipulate large images using the CPU’s vector processor.",
          "name" : "vImage",
          "url" : "https:\/\/developer.apple.com\/documentation\/Accelerate\/vimage-library"
        }
      ],
      "title" : "Image Processing Essentials"
    }
  ],
  "source" : "appleJSON",
  "title" : "Creating a Core Graphics Image from a vImage Buffer",
  "url" : "https:\/\/developer.apple.com\/documentation\/Accelerate\/creating-a-core-graphics-image-from-a-vimage-buffer"
}