{
  "abstract" : "Clips a tensor’s values to a maximum Euclidean norm.",
  "codeExamples" : [
    {
      "code" : "static func clipToNorm() {\n    \n    let inputData = UnsafeMutableBufferPointer<Float>.allocate(capacity: 9)\n    _ = inputData.initialize(from: [1, 2, 3,\n                                    4, 5, 6,\n                                    7, 8, 9])\n    \n    var inputDescriptor = BNNSNDArrayDescriptor(flags: BNNSNDArrayFlags(0),\n                                                layout: BNNSDataLayoutRowMajorMatrix,\n                                                size: (3, 3, 0, 0, 0, 0, 0, 0),\n                                                stride: (0, 0, 0, 0, 0, 0, 0, 0),\n                                                data: inputData.baseAddress!,\n                                                data_type: BNNSDataType.float,\n                                                table_data: nil,\n                                                table_data_type: BNNSDataType.float,\n                                                data_scale: 1, data_bias: 0)\n    \n    let outputData = UnsafeMutableBufferPointer<Float>.allocate(capacity: 9)\n    var outputDescriptor = BNNSNDArrayDescriptor(flags: BNNSNDArrayFlags(0),\n                                                 layout: BNNSDataLayoutRowMajorMatrix,\n                                                 size: (3, 3, 0, 0, 0, 0, 0, 0),\n                                                 stride: (0, 0, 0, 0, 0, 0, 0, 0),\n                                                 data: outputData.baseAddress!,\n                                                 data_type: BNNSDataType.float,\n                                                 table_data: nil,\n                                                 table_data_type: BNNSDataType.float,\n                                                 data_scale: 1, data_bias: 0)\n    \n    BNNSClipByNorm(&outputDescriptor,\n                    &inputDescriptor,\n                    10,\n                    0b0010)\n    \n    \/\/ Prints `[1.0, 2.0, 3.0,\n    \/\/          4.0, 5.0, 6.0,\n    \/\/          5.0257072, 5.743665, 6.461623]`\n    print(Array(outputData))\n    \n    inputData.deallocate()\n    outputData.deallocate()\n}",
      "language" : "swift"
    }
  ],
  "contentHash" : "4c2c5a67d7c4fc16b8cc65082fcd5bdfc50320a9b43435f4a396b8a6a1c7d9ea",
  "crawledAt" : "2025-12-03T20:17:59Z",
  "declaration" : {
    "code" : "func BNNSClipByNorm(_ dest: UnsafeMutablePointer<BNNSNDArrayDescriptor>, _ src: UnsafePointer<BNNSNDArrayDescriptor>, _ max_norm: Float, _ axis_flags: UInt32) -> Int32",
    "language" : "swift"
  },
  "id" : "8F90EEDE-C8D7-4124-BAC2-28F141489B21",
  "kind" : "function",
  "language" : "swift",
  "module" : "Accelerate",
  "overview" : "## Discussion\n\nUse this function to clip the values in an input tensor to a maximum Euclidean norm. The Euclidean norm is the square root of the sum of squares of the two tensors.\n\nThe function supports clipping across the entire tensor or by the norms of the dimension you specify.\n\nThe following code clips the values on axis `0b0010` to a Euclidean norm of `10`. The Euclidean norms of `[1, 2, 3]` and `[4, 5, 6]` are both less than 10, and function returns them unchanged. However, the Euclidean norm of `[7, 8, 9]` is greater than 10, and the function returns them scaled accordingly.",
  "platforms" : [
    "iOS",
    "iPadOS",
    "Mac Catalyst",
    "macOS",
    "tvOS",
    "visionOS",
    "watchOS"
  ],
  "rawMarkdown" : "---\nsource: https:\/\/developer.apple.com\/documentation\/Accelerate\/BNNSClipByNorm(_:_:_:_:)\ncrawled: 2025-12-03T20:17:59Z\n---\n\n# BNNSClipByNorm(_:_:_:_:)\n\n**Function**\n\nClips a tensor’s values to a maximum Euclidean norm.\n\n## Declaration\n\n```swift\nfunc BNNSClipByNorm(_ dest: UnsafeMutablePointer<BNNSNDArrayDescriptor>, _ src: UnsafePointer<BNNSNDArrayDescriptor>, _ max_norm: Float, _ axis_flags: UInt32) -> Int32\n```\n\n## Parameters\n\n- **dest**: The descriptor of the output.\n- **src**: The descriptor of the input.\n- **max_norm**: The maximum Euclidean norm.\n- **axis_flags**: The dimensions that the function uses to compute the Euclidean norm. Set to `0` for the function to compute the norm over all dimensions.\n\n## Discussion\n\nUse this function to clip the values in an input tensor to a maximum Euclidean norm. The Euclidean norm is the square root of the sum of squares of the two tensors.\n\nThe function supports clipping across the entire tensor or by the norms of the dimension you specify.\n\nThe following code clips the values on axis `0b0010` to a Euclidean norm of `10`. The Euclidean norms of `[1, 2, 3]` and `[4, 5, 6]` are both less than 10, and function returns them unchanged. However, the Euclidean norm of `[7, 8, 9]` is greater than 10, and the function returns them scaled accordingly.\n\n```swift\nstatic func clipToNorm() {\n    \n    let inputData = UnsafeMutableBufferPointer<Float>.allocate(capacity: 9)\n    _ = inputData.initialize(from: [1, 2, 3,\n                                    4, 5, 6,\n                                    7, 8, 9])\n    \n    var inputDescriptor = BNNSNDArrayDescriptor(flags: BNNSNDArrayFlags(0),\n                                                layout: BNNSDataLayoutRowMajorMatrix,\n                                                size: (3, 3, 0, 0, 0, 0, 0, 0),\n                                                stride: (0, 0, 0, 0, 0, 0, 0, 0),\n                                                data: inputData.baseAddress!,\n                                                data_type: BNNSDataType.float,\n                                                table_data: nil,\n                                                table_data_type: BNNSDataType.float,\n                                                data_scale: 1, data_bias: 0)\n    \n    let outputData = UnsafeMutableBufferPointer<Float>.allocate(capacity: 9)\n    var outputDescriptor = BNNSNDArrayDescriptor(flags: BNNSNDArrayFlags(0),\n                                                 layout: BNNSDataLayoutRowMajorMatrix,\n                                                 size: (3, 3, 0, 0, 0, 0, 0, 0),\n                                                 stride: (0, 0, 0, 0, 0, 0, 0, 0),\n                                                 data: outputData.baseAddress!,\n                                                 data_type: BNNSDataType.float,\n                                                 table_data: nil,\n                                                 table_data_type: BNNSDataType.float,\n                                                 data_scale: 1, data_bias: 0)\n    \n    BNNSClipByNorm(&outputDescriptor,\n                    &inputDescriptor,\n                    10,\n                    0b0010)\n    \n    \/\/ Prints `[1.0, 2.0, 3.0,\n    \/\/          4.0, 5.0, 6.0,\n    \/\/          5.0257072, 5.743665, 6.461623]`\n    print(Array(outputData))\n    \n    inputData.deallocate()\n    outputData.deallocate()\n}\n```\n\n## Utility functions\n\n- **copy(_:to:filterParameters:)**: Copies the contents of an n-dimensional array descriptor to another descriptor of the same shape.\n- **transpose(input:output:firstTransposeAxis:secondTransposeAxis:filterParameters:)**: Transposes a tensor by swapping two of its dimensions.\n- **BNNSCopy(_:_:_:)**: Copies the contents of an n-dimensional array descriptor to another of the same shape.\n- **BNNSTranspose(_:_:_:_:_:)**: Transposes a tensor by swapping two of its dimensions.\n- **BNNSGetPointer(_:_:)**: Returns an n-dimensional array descriptor that contains a reference to a filter-data member.\n- **BNNSPointerSpecifier**: Constants that specify which pointer the BNNS get filter function returns.\n- **BNNS.GramLayer**: A layer object that wraps a Gram matrix filter and manages its deinitialization.\n- **BNNSLayerParametersGram**: A set of parameters that define a Gram matrix layer.\n- **BNNSFilterCreateLayerGram(_:_:)**: Returns a new Gram matrix layer.\n- **clip(to:input:output:)**: Clips the input tensor to a closed range and writes the result to the output tensor.\n- **clipByNorm(threshold:input:output:axes:)**: Clips the input tensor to a Euclidean norm and writes the result to the output tensor.\n- **clipByGlobalNorm(threshold:inputs:outputs:globalNorm:)**: Clips the input tensors to a global Euclidean norm and writes the result to the output tensors.\n- **BNNSClipByValue(_:_:_:_:)**: Clips a tensor’s values to the specified minimum and maximum values.\n- **BNNSClipByGlobalNorm(_:_:_:_:_:)**: Clips a tensor’s values to a maximum global Euclidean norm.\n- **copyBandPart(_:to:lowerBandCount:upperBandCount:filterParameters:)**: Copies the specified subdiagonals and superdiagonals of a matrix, and sets other elements to zero.\n\n",
  "sections" : [
    {
      "content" : "",
      "items" : [
        {
          "description" : "Copies the contents of an n-dimensional array descriptor to another descriptor of the same shape.",
          "name" : "copy(_:to:filterParameters:)",
          "url" : "https:\/\/developer.apple.com\/documentation\/Accelerate\/BNNS\/copy(_:to:filterParameters:)"
        },
        {
          "description" : "Transposes a tensor by swapping two of its dimensions.",
          "name" : "transpose(input:output:firstTransposeAxis:secondTransposeAxis:filterParameters:)",
          "url" : "https:\/\/developer.apple.com\/documentation\/Accelerate\/BNNS\/transpose(input:output:firstTransposeAxis:secondTransposeAxis:filterParameters:)"
        },
        {
          "description" : "Copies the contents of an n-dimensional array descriptor to another of the same shape.",
          "name" : "BNNSCopy(_:_:_:)",
          "url" : "https:\/\/developer.apple.com\/documentation\/Accelerate\/BNNSCopy(_:_:_:)"
        },
        {
          "description" : "Transposes a tensor by swapping two of its dimensions.",
          "name" : "BNNSTranspose(_:_:_:_:_:)",
          "url" : "https:\/\/developer.apple.com\/documentation\/Accelerate\/BNNSTranspose(_:_:_:_:_:)"
        },
        {
          "description" : "Returns an n-dimensional array descriptor that contains a reference to a filter-data member.",
          "name" : "BNNSGetPointer(_:_:)",
          "url" : "https:\/\/developer.apple.com\/documentation\/Accelerate\/BNNSGetPointer(_:_:)"
        },
        {
          "description" : "Constants that specify which pointer the BNNS get filter function returns.",
          "name" : "BNNSPointerSpecifier",
          "url" : "https:\/\/developer.apple.com\/documentation\/Accelerate\/BNNSPointerSpecifier"
        },
        {
          "description" : "A layer object that wraps a Gram matrix filter and manages its deinitialization.",
          "name" : "BNNS.GramLayer",
          "url" : "https:\/\/developer.apple.com\/documentation\/Accelerate\/BNNS\/GramLayer"
        },
        {
          "description" : "A set of parameters that define a Gram matrix layer.",
          "name" : "BNNSLayerParametersGram",
          "url" : "https:\/\/developer.apple.com\/documentation\/Accelerate\/BNNSLayerParametersGram"
        },
        {
          "description" : "Returns a new Gram matrix layer.",
          "name" : "BNNSFilterCreateLayerGram(_:_:)",
          "url" : "https:\/\/developer.apple.com\/documentation\/Accelerate\/BNNSFilterCreateLayerGram(_:_:)"
        },
        {
          "description" : "Clips the input tensor to a closed range and writes the result to the output tensor.",
          "name" : "clip(to:input:output:)",
          "url" : "https:\/\/developer.apple.com\/documentation\/Accelerate\/BNNS\/clip(to:input:output:)"
        },
        {
          "description" : "Clips the input tensor to a Euclidean norm and writes the result to the output tensor.",
          "name" : "clipByNorm(threshold:input:output:axes:)",
          "url" : "https:\/\/developer.apple.com\/documentation\/Accelerate\/BNNS\/clipByNorm(threshold:input:output:axes:)"
        },
        {
          "description" : "Clips the input tensors to a global Euclidean norm and writes the result to the output tensors.",
          "name" : "clipByGlobalNorm(threshold:inputs:outputs:globalNorm:)",
          "url" : "https:\/\/developer.apple.com\/documentation\/Accelerate\/BNNS\/clipByGlobalNorm(threshold:inputs:outputs:globalNorm:)"
        },
        {
          "description" : "Clips a tensor’s values to the specified minimum and maximum values.",
          "name" : "BNNSClipByValue(_:_:_:_:)",
          "url" : "https:\/\/developer.apple.com\/documentation\/Accelerate\/BNNSClipByValue(_:_:_:_:)"
        },
        {
          "description" : "Clips a tensor’s values to a maximum global Euclidean norm.",
          "name" : "BNNSClipByGlobalNorm(_:_:_:_:_:)",
          "url" : "https:\/\/developer.apple.com\/documentation\/Accelerate\/BNNSClipByGlobalNorm(_:_:_:_:_:)"
        },
        {
          "description" : "Copies the specified subdiagonals and superdiagonals of a matrix, and sets other elements to zero.",
          "name" : "copyBandPart(_:to:lowerBandCount:upperBandCount:filterParameters:)",
          "url" : "https:\/\/developer.apple.com\/documentation\/Accelerate\/BNNS\/copyBandPart(_:to:lowerBandCount:upperBandCount:filterParameters:)"
        }
      ],
      "title" : "Utility functions"
    }
  ],
  "source" : "appleJSON",
  "title" : "BNNSClipByNorm(_:_:_:_:)",
  "url" : "https:\/\/developer.apple.com\/documentation\/Accelerate\/BNNSClipByNorm(_:_:_:_:)"
}