{
  "abstract" : "Schedule prominent alarms and countdowns to help people manage their time.",
  "codeExamples" : [

  ],
  "contentHash" : "b52dbb4fd8f8da3e895d7bf6d37ce6e92c20f3f7ceeb1b8ba0c5534d33bc8bb6",
  "crawledAt" : "2025-12-02T16:43:17Z",
  "id" : "C0654B21-FA43-4AE2-8B9D-354C8333009F",
  "kind" : "framework",
  "language" : "swift",
  "module" : "AlarmKit",
  "overview" : "## Overview\n\nUse `AlarmKit` to create custom alarms and timers in your app. `AlarmKit` provides a framework for managing alarms with customizable schedules and UI. It supports one-time and repeating alarms, with the option for countdown durations and snooze functionality. `AlarmKit` handles alarm authorization and provides UI for both templated and widget presentations. It supports traditional alarms, timers, or both, and provides methods to schedule, pause, resume, and cancel alarms.",
  "rawMarkdown" : "---\nsource: https:\/\/developer.apple.com\/documentation\/AlarmKit\ncrawled: 2025-12-02T16:43:17Z\n---\n\n# AlarmKit\n\n**Framework**\n\nSchedule prominent alarms and countdowns to help people manage their time.\n\n## Overview\n\nUse `AlarmKit` to create custom alarms and timers in your app. `AlarmKit` provides a framework for managing alarms with customizable schedules and UI. It supports one-time and repeating alarms, with the option for countdown durations and snooze functionality. `AlarmKit` handles alarm authorization and provides UI for both templated and widget presentations. It supports traditional alarms, timers, or both, and provides methods to schedule, pause, resume, and cancel alarms.\n\n## Alarm management\n\n- **Scheduling an alarm with AlarmKit**: Create prominent alerts at specified dates for your iOS app.\n- **AlarmManager**: An object that exposes functions to work with alarms: scheduling, snoozing, cancelling.\n- **Alarm**: An object that describes an alarm that can alert once or on a repeating schedule.\n\n## Buttons\n\n- **AlarmButton**: A structure that defines the appearance of buttons.\n\n## Views\n\n- **AlarmPresentation**: An object that describes the content required for the alarm UI.\n- **AlarmPresentationState**: An object that describes the mutable content of the alarm.\n- **AlarmAttributes**: An object that contains all information necessary for the alarm UI.\n- **AlarmMetadata**: A metadata object that contains information about an alarm.\n\n",
  "sections" : [
    {
      "content" : "",
      "items" : [
        {
          "description" : "Create prominent alerts at specified dates for your iOS app.",
          "name" : "Scheduling an alarm with AlarmKit",
          "url" : "https:\/\/developer.apple.com\/documentation\/AlarmKit\/scheduling-an-alarm-with-alarmkit"
        },
        {
          "description" : "An object that exposes functions to work with alarms: scheduling, snoozing, cancelling.",
          "name" : "AlarmManager",
          "url" : "https:\/\/developer.apple.com\/documentation\/AlarmKit\/AlarmManager"
        },
        {
          "description" : "An object that describes an alarm that can alert once or on a repeating schedule.",
          "name" : "Alarm",
          "url" : "https:\/\/developer.apple.com\/documentation\/AlarmKit\/Alarm"
        }
      ],
      "title" : "Alarm management"
    },
    {
      "content" : "",
      "items" : [
        {
          "description" : "A structure that defines the appearance of buttons.",
          "name" : "AlarmButton",
          "url" : "https:\/\/developer.apple.com\/documentation\/AlarmKit\/AlarmButton"
        }
      ],
      "title" : "Buttons"
    },
    {
      "content" : "",
      "items" : [
        {
          "description" : "An object that describes the content required for the alarm UI.",
          "name" : "AlarmPresentation",
          "url" : "https:\/\/developer.apple.com\/documentation\/AlarmKit\/AlarmPresentation"
        },
        {
          "description" : "An object that describes the mutable content of the alarm.",
          "name" : "AlarmPresentationState",
          "url" : "https:\/\/developer.apple.com\/documentation\/AlarmKit\/AlarmPresentationState"
        },
        {
          "description" : "An object that contains all information necessary for the alarm UI.",
          "name" : "AlarmAttributes",
          "url" : "https:\/\/developer.apple.com\/documentation\/AlarmKit\/AlarmAttributes"
        },
        {
          "description" : "A metadata object that contains information about an alarm.",
          "name" : "AlarmMetadata",
          "url" : "https:\/\/developer.apple.com\/documentation\/AlarmKit\/AlarmMetadata"
        }
      ],
      "title" : "Views"
    }
  ],
  "source" : "appleJSON",
  "title" : "AlarmKit",
  "url" : "https:\/\/developer.apple.com\/documentation\/AlarmKit"
}