{
  "abstract" : "The number of keys that matched for an exposure detection.",
  "codeExamples" : [

  ],
  "contentHash" : "a7b6aea0e48277f9268b2c50d74251464fd444549daeb58caac9a9bb9359f73b",
  "crawledAt" : "2025-12-02T13:33:14Z",
  "declaration" : {
    "code" : "var matchedKeyCount: UInt64 { get }",
    "language" : "swift"
  },
  "id" : "8CF7B216-7298-433C-895C-741882664376",
  "kind" : "property",
  "module" : "Exposure Notification",
  "overview" : "## Discussion\n\nThe framework computes this property’s value across all matching exposures, not just exposures that meet or exceed [doc:\/\/com.apple.exposurenotification\/documentation\/ExposureNotification\/ENExposureConfiguration\/minimumRiskScore] or [doc:\/\/com.apple.exposurenotification\/documentation\/ExposureNotification\/ENExposureConfiguration\/minimumRiskScoreFullRange].\n\nThis value is only available when `ENAPIVersion` is set to `1` in the app’s `Info.plist` file.",
  "platforms" : [
    "iOS",
    "iPadOS"
  ],
  "rawMarkdown" : "---\nsource: https:\/\/developer.apple.com\/documentation\/ExposureNotification\/ENExposureDetectionSummary\/matchedKeyCount\ncrawled: 2025-12-02T13:33:14Z\n---\n\n# matchedKeyCount\n\n**Instance Property**\n\nThe number of keys that matched for an exposure detection.\n\n## Declaration\n\n```swift\nvar matchedKeyCount: UInt64 { get }\n```\n\n## Discussion\n\n\n\nThe framework computes this property’s value across all matching exposures, not just exposures that meet or exceed [doc:\/\/com.apple.exposurenotification\/documentation\/ExposureNotification\/ENExposureConfiguration\/minimumRiskScore] or [doc:\/\/com.apple.exposurenotification\/documentation\/ExposureNotification\/ENExposureConfiguration\/minimumRiskScoreFullRange].\n\nThis value is only available when `ENAPIVersion` is set to `1` in the app’s `Info.plist` file.\n\n## Exposure Criteria\n\n- **attenuationDurations**: An array of durations at specific radio signal attenuations.\n- **daysSinceLastExposure**: Number of days since the most recent exposure.\n- **maximumRiskScore**: The vaue that represents the highest risk score of all exposure incidents.\n- **maximumRiskScoreFullRange**: The value that represents the highest, full-range risk score of all the exposures for the user.\n- **riskScoreSumFullRange**: The sum of the full-range risk scores for all exposures for the user.\n- **metadata**: The metadata associated with the summary.\n- **daySummaries**: The summary of each day that contains an exposure.\n\n",
  "sections" : [
    {
      "content" : "",
      "items" : [
        {
          "description" : "An array of durations at specific radio signal attenuations.",
          "name" : "attenuationDurations",
          "url" : "https:\/\/developer.apple.com\/documentation\/ExposureNotification\/ENExposureDetectionSummary\/attenuationDurations"
        },
        {
          "description" : "Number of days since the most recent exposure.",
          "name" : "daysSinceLastExposure",
          "url" : "https:\/\/developer.apple.com\/documentation\/ExposureNotification\/ENExposureDetectionSummary\/daysSinceLastExposure"
        },
        {
          "description" : "The vaue that represents the highest risk score of all exposure incidents.",
          "name" : "maximumRiskScore",
          "url" : "https:\/\/developer.apple.com\/documentation\/ExposureNotification\/ENExposureDetectionSummary\/maximumRiskScore"
        },
        {
          "description" : "The value that represents the highest, full-range risk score of all the exposures for the user.",
          "name" : "maximumRiskScoreFullRange",
          "url" : "https:\/\/developer.apple.com\/documentation\/ExposureNotification\/ENExposureDetectionSummary\/maximumRiskScoreFullRange"
        },
        {
          "description" : "The sum of the full-range risk scores for all exposures for the user.",
          "name" : "riskScoreSumFullRange",
          "url" : "https:\/\/developer.apple.com\/documentation\/ExposureNotification\/ENExposureDetectionSummary\/riskScoreSumFullRange"
        },
        {
          "description" : "The metadata associated with the summary.",
          "name" : "metadata",
          "url" : "https:\/\/developer.apple.com\/documentation\/ExposureNotification\/ENExposureDetectionSummary\/metadata"
        },
        {
          "description" : "The summary of each day that contains an exposure.",
          "name" : "daySummaries",
          "url" : "https:\/\/developer.apple.com\/documentation\/ExposureNotification\/ENExposureDetectionSummary\/daySummaries"
        }
      ],
      "title" : "Exposure Criteria"
    }
  ],
  "source" : "appleJSON",
  "title" : "matchedKeyCount",
  "url" : "https:\/\/developer.apple.com\/documentation\/ExposureNotification\/ENExposureDetectionSummary\/matchedKeyCount"
}