{
  "abstract" : "The risk of transmission associated with the person a key came from.",
  "codeExamples" : [

  ],
  "contentHash" : "fbfa444794b4480d0554a3660636064bde96b39d3769f65779018f302e2556ff",
  "crawledAt" : "2025-12-03T13:01:16Z",
  "declaration" : {
    "code" : "var transmissionRiskLevel: ENRiskLevel { get set }",
    "language" : "swift"
  },
  "id" : "E743BC8B-840F-4429-90D1-440343777EC7",
  "kind" : "property",
  "language" : "swift",
  "module" : "Exposure Notification",
  "overview" : "## Discussion\n\nEach app defines its own meaning for each of the risk levels (0-7).\n\nConsistent Transmission Risk Levels across regions facilitate roaming, therefore it’s recommended that the Transmission Risk Levels describe the type of report. The supported report types are determined by the public health authority for each region. Your app must verify the report type with a public health authority before submitting it.\n\nRecommended report types for the different risk levels are:",
  "platforms" : [
    "iOS",
    "iPadOS"
  ],
  "rawMarkdown" : "---\nsource: https:\/\/developer.apple.com\/documentation\/ExposureNotification\/ENTemporaryExposureKey\/transmissionRiskLevel\ncrawled: 2025-12-03T13:01:16Z\n---\n\n# transmissionRiskLevel\n\n**Instance Property**\n\nThe risk of transmission associated with the person a key came from.\n\n## Declaration\n\n```swift\nvar transmissionRiskLevel: ENRiskLevel { get set }\n```\n\n## Discussion\n\n\n\nEach app defines its own meaning for each of the risk levels (0-7).\n\nConsistent Transmission Risk Levels across regions facilitate roaming, therefore it’s recommended that the Transmission Risk Levels describe the type of report. The supported report types are determined by the public health authority for each region. Your app must verify the report type with a public health authority before submitting it.\n\nRecommended report types for the different risk levels are:\n\n- `0` = Unused\/Custom\n- `1` = Confirmed test: Low transmission risk level\n- `2` = Confirmed test: Standard transmission risk level\n- `3` = Confirmed test: High transmission risk level\n- `4` = Confirmed clinical diagnosis\n- `5` = Self report\n- `6` = Negative case\n- `7` = Recursive case\n\n## Exposure Criteria\n\n- **rollingPeriod**: The length of time that this key is valid.\n- **keyData**: The temporary exposure key information.\n- **rollingStartNumber**: A number that indicates when a key’s rolling period started.\n- **ENIntervalNumber**: A number assigned to each 10-minute window shared between all devices participating in the protocol.\n\n",
  "sections" : [
    {
      "content" : "",
      "items" : [
        {
          "description" : "The length of time that this key is valid.",
          "name" : "rollingPeriod",
          "url" : "https:\/\/developer.apple.com\/documentation\/ExposureNotification\/ENTemporaryExposureKey\/rollingPeriod"
        },
        {
          "description" : "The temporary exposure key information.",
          "name" : "keyData",
          "url" : "https:\/\/developer.apple.com\/documentation\/ExposureNotification\/ENTemporaryExposureKey\/keyData"
        },
        {
          "description" : "A number that indicates when a key’s rolling period started.",
          "name" : "rollingStartNumber",
          "url" : "https:\/\/developer.apple.com\/documentation\/ExposureNotification\/ENTemporaryExposureKey\/rollingStartNumber"
        },
        {
          "description" : "A number assigned to each 10-minute window shared between all devices participating in the protocol.",
          "name" : "ENIntervalNumber",
          "url" : "https:\/\/developer.apple.com\/documentation\/ExposureNotification\/ENIntervalNumber"
        }
      ],
      "title" : "Exposure Criteria"
    }
  ],
  "source" : "appleJSON",
  "title" : "transmissionRiskLevel",
  "url" : "https:\/\/developer.apple.com\/documentation\/ExposureNotification\/ENTemporaryExposureKey\/transmissionRiskLevel"
}