{
  "abstract" : "An object that initiates the delivery of altitude-related changes.",
  "codeExamples" : [

  ],
  "conformsTo" : [
    "CVarArg",
    "CustomDebugStringConvertible",
    "CustomStringConvertible",
    "Equatable",
    "Hashable",
    "NSObjectProtocol"
  ],
  "contentHash" : "40ecd72d937b94f02395647288a5b2ea4ec0c9e03756e68a2c8ae1be661aafbe",
  "crawledAt" : "2025-12-04T20:11:01Z",
  "declaration" : {
    "code" : "class CMAltimeter",
    "language" : "swift"
  },
  "id" : "5044937B-9BDA-4342-8906-EB171450C504",
  "kind" : "class",
  "language" : "swift",
  "module" : "Core Motion",
  "overview" : "## Overview\n\nAltitude events report changes in both the relative and absolute altitude. For example, a hiking app could use this object to track the user’s elevation change over the course of a hike, or to report their current absolute altitude during the hike.\n\nBecause altitude events may not be available on all devices, always call the [doc:\/\/com.apple.coremotion\/documentation\/CoreMotion\/CMAltimeter\/isRelativeAltitudeAvailable()] method before starting relative altitude updates, and call [doc:\/\/com.apple.coremotion\/documentation\/CoreMotion\/CMAltimeter\/isAbsoluteAltitudeAvailable()] before starting absolute altitude updates.\n\nAfter checking the availability of altitude data, call the [doc:\/\/com.apple.coremotion\/documentation\/CoreMotion\/CMAltimeter\/startRelativeAltitudeUpdates(to:withHandler:)] method to start receiving relative altitude data, or call the [doc:\/\/com.apple.coremotion\/documentation\/CoreMotion\/CMAltimeter\/startAbsoluteAltitudeUpdates(to:withHandler:)] method for absolute altitude data.\n\nCore Motion generates events at regular intervals (regardless of whether the data has changed) and delivers them to the block you specified. When you no longer need the event data, call the [doc:\/\/com.apple.coremotion\/documentation\/CoreMotion\/CMAltimeter\/stopRelativeAltitudeUpdates()] or [doc:\/\/com.apple.coremotion\/documentation\/CoreMotion\/CMAltimeter\/stopAbsoluteAltitudeUpdates()] methods respectively.",
  "platforms" : [
    "iOS",
    "iPadOS",
    "Mac Catalyst",
    "watchOS"
  ],
  "rawMarkdown" : "---\nsource: https:\/\/developer.apple.com\/documentation\/CoreMotion\/CMAltimeter\ncrawled: 2025-12-04T20:11:01Z\n---\n\n# CMAltimeter\n\n**Class**\n\nAn object that initiates the delivery of altitude-related changes.\n\n## Declaration\n\n```swift\nclass CMAltimeter\n```\n\n## Overview\n\nAltitude events report changes in both the relative and absolute altitude. For example, a hiking app could use this object to track the user’s elevation change over the course of a hike, or to report their current absolute altitude during the hike.\n\nBecause altitude events may not be available on all devices, always call the [doc:\/\/com.apple.coremotion\/documentation\/CoreMotion\/CMAltimeter\/isRelativeAltitudeAvailable()] method before starting relative altitude updates, and call [doc:\/\/com.apple.coremotion\/documentation\/CoreMotion\/CMAltimeter\/isAbsoluteAltitudeAvailable()] before starting absolute altitude updates.\n\nAfter checking the availability of altitude data, call the [doc:\/\/com.apple.coremotion\/documentation\/CoreMotion\/CMAltimeter\/startRelativeAltitudeUpdates(to:withHandler:)] method to start receiving relative altitude data, or call the [doc:\/\/com.apple.coremotion\/documentation\/CoreMotion\/CMAltimeter\/startAbsoluteAltitudeUpdates(to:withHandler:)] method for absolute altitude data.\n\nCore Motion generates events at regular intervals (regardless of whether the data has changed) and delivers them to the block you specified. When you no longer need the event data, call the [doc:\/\/com.apple.coremotion\/documentation\/CoreMotion\/CMAltimeter\/stopRelativeAltitudeUpdates()] or [doc:\/\/com.apple.coremotion\/documentation\/CoreMotion\/CMAltimeter\/stopAbsoluteAltitudeUpdates()] methods respectively.\n\n\n\n## Determining Altitude Availability\n\n- **isAbsoluteAltitudeAvailable()**: Returns a Boolean value indicating whether the current device reports changes in the absolute altitude.\n- **isRelativeAltitudeAvailable()**: Returns a Boolean value indicating whether the current device supports generating data for relative altitude changes.\n- **authorizationStatus()**: Returns a value indicating whether the app is authorized to retrieve altimeter data.\n- **CMAuthorizationStatus**: The authorization status for motion-related features.\n\n## Starting and Stopping Altitude Updates\n\n- **startAbsoluteAltitudeUpdates(to:withHandler:)**: Starts the delivery of absolute altitude data to the specified handler.\n- **stopAbsoluteAltitudeUpdates()**: Stops the delivery of absolute altitude data for this altimeter object.\n- **CMAbsoluteAltitudeHandler**: A block for receiving absolute altitude data.\n- **startRelativeAltitudeUpdates(to:withHandler:)**: Starts the delivery of relative altitude data to the specified handler.\n- **stopRelativeAltitudeUpdates()**: Stops the delivery of relative altitude data for the altimeter object.\n- **CMAltitudeHandler**: A block for receiving relative altitude data.\n\n## Altitude data\n\n- **CMAbsoluteAltitudeData**: Data that records a change in absolute altitude.\n- **CMAltitudeData**: Data for a recorded change in altitude.\n\n## Inherits From\n\n- NSObject\n\n## Conforms To\n\n- CVarArg\n- CustomDebugStringConvertible\n- CustomStringConvertible\n- Equatable\n- Hashable\n- NSObjectProtocol\n\n",
  "sections" : [
    {
      "content" : "",
      "items" : [
        {
          "description" : "Returns a Boolean value indicating whether the current device reports changes in the absolute altitude.",
          "name" : "isAbsoluteAltitudeAvailable()",
          "url" : "https:\/\/developer.apple.com\/documentation\/CoreMotion\/CMAltimeter\/isAbsoluteAltitudeAvailable()"
        },
        {
          "description" : "Returns a Boolean value indicating whether the current device supports generating data for relative altitude changes.",
          "name" : "isRelativeAltitudeAvailable()",
          "url" : "https:\/\/developer.apple.com\/documentation\/CoreMotion\/CMAltimeter\/isRelativeAltitudeAvailable()"
        },
        {
          "description" : "Returns a value indicating whether the app is authorized to retrieve altimeter data.",
          "name" : "authorizationStatus()",
          "url" : "https:\/\/developer.apple.com\/documentation\/CoreMotion\/CMAltimeter\/authorizationStatus()"
        },
        {
          "description" : "The authorization status for motion-related features.",
          "name" : "CMAuthorizationStatus",
          "url" : "https:\/\/developer.apple.com\/documentation\/CoreMotion\/CMAuthorizationStatus"
        }
      ],
      "title" : "Determining Altitude Availability"
    },
    {
      "content" : "",
      "items" : [
        {
          "description" : "Starts the delivery of absolute altitude data to the specified handler.",
          "name" : "startAbsoluteAltitudeUpdates(to:withHandler:)",
          "url" : "https:\/\/developer.apple.com\/documentation\/CoreMotion\/CMAltimeter\/startAbsoluteAltitudeUpdates(to:withHandler:)"
        },
        {
          "description" : "Stops the delivery of absolute altitude data for this altimeter object.",
          "name" : "stopAbsoluteAltitudeUpdates()",
          "url" : "https:\/\/developer.apple.com\/documentation\/CoreMotion\/CMAltimeter\/stopAbsoluteAltitudeUpdates()"
        },
        {
          "description" : "A block for receiving absolute altitude data.",
          "name" : "CMAbsoluteAltitudeHandler",
          "url" : "https:\/\/developer.apple.com\/documentation\/CoreMotion\/CMAbsoluteAltitudeHandler"
        },
        {
          "description" : "Starts the delivery of relative altitude data to the specified handler.",
          "name" : "startRelativeAltitudeUpdates(to:withHandler:)",
          "url" : "https:\/\/developer.apple.com\/documentation\/CoreMotion\/CMAltimeter\/startRelativeAltitudeUpdates(to:withHandler:)"
        },
        {
          "description" : "Stops the delivery of relative altitude data for the altimeter object.",
          "name" : "stopRelativeAltitudeUpdates()",
          "url" : "https:\/\/developer.apple.com\/documentation\/CoreMotion\/CMAltimeter\/stopRelativeAltitudeUpdates()"
        },
        {
          "description" : "A block for receiving relative altitude data.",
          "name" : "CMAltitudeHandler",
          "url" : "https:\/\/developer.apple.com\/documentation\/CoreMotion\/CMAltitudeHandler"
        }
      ],
      "title" : "Starting and Stopping Altitude Updates"
    },
    {
      "content" : "",
      "items" : [
        {
          "description" : "Data that records a change in absolute altitude.",
          "name" : "CMAbsoluteAltitudeData",
          "url" : "https:\/\/developer.apple.com\/documentation\/CoreMotion\/CMAbsoluteAltitudeData"
        },
        {
          "description" : "Data for a recorded change in altitude.",
          "name" : "CMAltitudeData",
          "url" : "https:\/\/developer.apple.com\/documentation\/CoreMotion\/CMAltitudeData"
        }
      ],
      "title" : "Altitude data"
    },
    {
      "content" : "",
      "items" : [
        {
          "name" : "NSObject"
        }
      ],
      "title" : "Inherits From"
    }
  ],
  "source" : "appleJSON",
  "title" : "CMAltimeter",
  "url" : "https:\/\/developer.apple.com\/documentation\/CoreMotion\/CMAltimeter"
}