{
  "abstract" : "Returns the date of the most recently calculated results.",
  "codeExamples" : [

  ],
  "contentHash" : "6f76d146ecad3c9b45d24d99c26400795114b41af4a612163a1b0a893bba7e16",
  "crawledAt" : "2025-12-09T16:22:44Z",
  "declaration" : {
    "code" : "func lastProcessedDate() -> Date?",
    "language" : "swift"
  },
  "id" : "66878EC0-28F4-48DC-8FAA-13F73FC2C93E",
  "kind" : "method",
  "language" : "swift",
  "module" : "Core Motion",
  "overview" : "## Return Value\n\nThe date of the most recently calculated results, or `nil` if no results are available.\n\n## Discussion\n\nBecause the manager processes results in batches, data may not be available immediately.  Use this method to determine the end date for the currently processed data. Additional data will continue to become available, until the manager processes everything up to the monitor expiration date.\n\nThis method returns `nil` if you have not yet begun monitoring the user, or if the manager has not yet processed any data.",
  "platforms" : [
    "watchOS"
  ],
  "rawMarkdown" : "---\nsource: https:\/\/developer.apple.com\/documentation\/CoreMotion\/CMMovementDisorderManager\/lastProcessedDate()\ncrawled: 2025-12-09T16:22:44Z\n---\n\n# lastProcessedDate()\n\n**Instance Method**\n\nReturns the date of the most recently calculated results.\n\n## Declaration\n\n```swift\nfunc lastProcessedDate() -> Date?\n```\n\n## Return Value\n\nThe date of the most recently calculated results, or `nil` if no results are available.\n\n## Discussion\n\nBecause the manager processes results in batches, data may not be available immediately.  Use this method to determine the end date for the currently processed data. Additional data will continue to become available, until the manager processes everything up to the monitor expiration date.\n\nThis method returns `nil` if you have not yet begun monitoring the user, or if the manager has not yet processed any data.\n\n## Querying for Movement Disorders\n\n- **queryTremor(from:to:withHandler:)**: Query for tremor results from the provided time interval.\n- **CMTremorResultHandler**: A completion handler for accessing and processing tremor results.\n- **queryDyskineticSymptom(from:to:withHandler:)**: Query for dyskinetic symptoms from the provided time interval.\n- **CMDyskineticSymptomResultHandler**: A completion handler for processing dyskinetic symptom results.\n\n",
  "sections" : [
    {
      "content" : "",
      "items" : [
        {
          "description" : "Query for tremor results from the provided time interval.",
          "name" : "queryTremor(from:to:withHandler:)",
          "url" : "https:\/\/developer.apple.com\/documentation\/CoreMotion\/CMMovementDisorderManager\/queryTremor(from:to:withHandler:)"
        },
        {
          "description" : "A completion handler for accessing and processing tremor results.",
          "name" : "CMTremorResultHandler",
          "url" : "https:\/\/developer.apple.com\/documentation\/CoreMotion\/CMTremorResultHandler"
        },
        {
          "description" : "Query for dyskinetic symptoms from the provided time interval.",
          "name" : "queryDyskineticSymptom(from:to:withHandler:)",
          "url" : "https:\/\/developer.apple.com\/documentation\/CoreMotion\/CMMovementDisorderManager\/queryDyskineticSymptom(from:to:withHandler:)"
        },
        {
          "description" : "A completion handler for processing dyskinetic symptom results.",
          "name" : "CMDyskineticSymptomResultHandler",
          "url" : "https:\/\/developer.apple.com\/documentation\/CoreMotion\/CMDyskineticSymptomResultHandler"
        }
      ],
      "title" : "Querying for Movement Disorders"
    }
  ],
  "source" : "appleJSON",
  "title" : "lastProcessedDate()",
  "url" : "https:\/\/developer.apple.com\/documentation\/CoreMotion\/CMMovementDisorderManager\/lastProcessedDate()"
}