{
  "abstract" : "An object for managing the collection of pressure and temperature data during submersion.",
  "codeExamples" : [
    {
      "code" : "guard CMWaterSubmersionManager.waterSubmersionAvailable else {\n    return false\n}",
      "language" : "swift"
    },
    {
      "code" : "\/\/ Instantiate the submersion manager.\nsubmersionManager = CMWaterSubmersionManager()\n\n\n\/\/ Assign the submersion manager delegate.\nsubmersionManager.delegate = self",
      "language" : "swift"
    }
  ],
  "conformsTo" : [
    "CVarArg",
    "CustomDebugStringConvertible",
    "CustomStringConvertible",
    "Equatable",
    "Hashable",
    "NSObjectProtocol"
  ],
  "contentHash" : "cdf1613a59c7a113cded3bbfaf11b4f9e8b8972b2303e42d7d8c3857139093dc",
  "crawledAt" : "2025-12-06T08:08:00Z",
  "declaration" : {
    "code" : "class CMWaterSubmersionManager",
    "language" : "swift"
  },
  "id" : "0C4B5CEE-9CD9-49B1-A395-8F13C7330052",
  "kind" : "class",
  "language" : "swift",
  "module" : "Core Motion",
  "overview" : "## Overview\n\nUse this class to receive live depth, water pressure, and water temperature data on Apple Watch Ultra.\n\nStart by assigning a usage description using the [doc:\/\/com.apple.documentation\/documentation\/BundleResources\/Information-Property-List\/NSMotionUsageDescription] key in your app target’s information property list. You also need to include an entitlement to access the live submersion data.\n\nTo access data for dives with a maximum depth of 6 m, add the Shallow Depth and Pressure capability to your app. For more information, see [doc:\/\/com.apple.documentation\/documentation\/Xcode\/adding-capabilities-to-your-app].\n\nTo enable a maximum depth of 40 m, you must apply for the full Submerged Depth and Pressure entitlement. For more information, see [https:\/\/developer.apple.com\/contact\/request\/submerged-depth-pressure-api\/].\n\nNext, check whether submersion data is available.\n\nIf the [doc:\/\/com.apple.coremotion\/documentation\/CoreMotion\/CMWaterSubmersionManager\/waterSubmersionAvailable] property is [doc:\/\/com.apple.documentation\/documentation\/Swift\/true], instantiate a [doc:\/\/com.apple.coremotion\/documentation\/CoreMotion\/CMWaterSubmersionManager] object and assign a delegate.\n\nYour delegate then begins receiving updates from the system. For more information, see [doc:\/\/com.apple.coremotion\/documentation\/CoreMotion\/accessing-submersion-data].",
  "platforms" : [
    "iOS",
    "iPadOS",
    "Mac Catalyst",
    "visionOS",
    "watchOS"
  ],
  "rawMarkdown" : "---\nsource: https:\/\/developer.apple.com\/documentation\/CoreMotion\/CMWaterSubmersionManager\ncrawled: 2025-12-06T08:08:00Z\n---\n\n# CMWaterSubmersionManager\n\n**Class**\n\nAn object for managing the collection of pressure and temperature data during submersion.\n\n## Declaration\n\n```swift\nclass CMWaterSubmersionManager\n```\n\n## Overview\n\nUse this class to receive live depth, water pressure, and water temperature data on Apple Watch Ultra.\n\nStart by assigning a usage description using the [doc:\/\/com.apple.documentation\/documentation\/BundleResources\/Information-Property-List\/NSMotionUsageDescription] key in your app target’s information property list. You also need to include an entitlement to access the live submersion data.\n\nTo access data for dives with a maximum depth of 6 m, add the Shallow Depth and Pressure capability to your app. For more information, see [doc:\/\/com.apple.documentation\/documentation\/Xcode\/adding-capabilities-to-your-app].\n\nTo enable a maximum depth of 40 m, you must apply for the full Submerged Depth and Pressure entitlement. For more information, see [https:\/\/developer.apple.com\/contact\/request\/submerged-depth-pressure-api\/].\n\n\n\nNext, check whether submersion data is available.\n\n```swift\nguard CMWaterSubmersionManager.waterSubmersionAvailable else {\n    return false\n}\n```\n\nIf the [doc:\/\/com.apple.coremotion\/documentation\/CoreMotion\/CMWaterSubmersionManager\/waterSubmersionAvailable] property is [doc:\/\/com.apple.documentation\/documentation\/Swift\/true], instantiate a [doc:\/\/com.apple.coremotion\/documentation\/CoreMotion\/CMWaterSubmersionManager] object and assign a delegate.\n\n```swift\n\/\/ Instantiate the submersion manager.\nsubmersionManager = CMWaterSubmersionManager()\n\n\n\/\/ Assign the submersion manager delegate.\nsubmersionManager.delegate = self\n```\n\nYour delegate then begins receiving updates from the system. For more information, see [doc:\/\/com.apple.coremotion\/documentation\/CoreMotion\/accessing-submersion-data].\n\n## Setting the delegate\n\n- **delegate**: The object that receives updates about submersion data and events.\n\n## Checking availability and authorization\n\n- **waterSubmersionAvailable**: A Boolean value indicating whether the current device supports the submersion manager.\n- **authorizationStatus**: A value indicating whether the app has user authorization to receive submersion data.\n\n## Accessing the maximum depth\n\n- **maximumDepth**: The maximum depth supported by the water submersion manager.\n\n## Water submersion\n\n- **Accessing submersion data**: Use a water-submersion manager to receive water pressure, temperature, and depth data on Apple Watch Ultra.\n- **CMWaterSubmersionManagerDelegate**: A delegate that receives updates about ambient pressure, water pressure, water temperature, and submersion events.\n- **CMWaterSubmersionEvent**: An event indicating that the device’s submersion state has changed.\n- **CMWaterSubmersionMeasurement**: An update that contains data about the pressure and depth.\n- **CMWaterTemperature**: An update that contains data about the water temperature.\n\n## Inherits From\n\n- NSObject\n\n## Conforms To\n\n- CVarArg\n- CustomDebugStringConvertible\n- CustomStringConvertible\n- Equatable\n- Hashable\n- NSObjectProtocol\n\n",
  "sections" : [
    {
      "content" : "",
      "items" : [
        {
          "description" : "The object that receives updates about submersion data and events.",
          "name" : "delegate",
          "url" : "https:\/\/developer.apple.com\/documentation\/CoreMotion\/CMWaterSubmersionManager\/delegate"
        }
      ],
      "title" : "Setting the delegate"
    },
    {
      "content" : "",
      "items" : [
        {
          "description" : "A Boolean value indicating whether the current device supports the submersion manager.",
          "name" : "waterSubmersionAvailable",
          "url" : "https:\/\/developer.apple.com\/documentation\/CoreMotion\/CMWaterSubmersionManager\/waterSubmersionAvailable"
        },
        {
          "description" : "A value indicating whether the app has user authorization to receive submersion data.",
          "name" : "authorizationStatus",
          "url" : "https:\/\/developer.apple.com\/documentation\/CoreMotion\/CMWaterSubmersionManager\/authorizationStatus"
        }
      ],
      "title" : "Checking availability and authorization"
    },
    {
      "content" : "",
      "items" : [
        {
          "description" : "The maximum depth supported by the water submersion manager.",
          "name" : "maximumDepth",
          "url" : "https:\/\/developer.apple.com\/documentation\/CoreMotion\/CMWaterSubmersionManager\/maximumDepth"
        }
      ],
      "title" : "Accessing the maximum depth"
    },
    {
      "content" : "",
      "items" : [
        {
          "description" : "Use a water-submersion manager to receive water pressure, temperature, and depth data on Apple Watch Ultra.",
          "name" : "Accessing submersion data",
          "url" : "https:\/\/developer.apple.com\/documentation\/CoreMotion\/accessing-submersion-data"
        },
        {
          "description" : "A delegate that receives updates about ambient pressure, water pressure, water temperature, and submersion events.",
          "name" : "CMWaterSubmersionManagerDelegate",
          "url" : "https:\/\/developer.apple.com\/documentation\/CoreMotion\/CMWaterSubmersionManagerDelegate"
        },
        {
          "description" : "An event indicating that the device’s submersion state has changed.",
          "name" : "CMWaterSubmersionEvent",
          "url" : "https:\/\/developer.apple.com\/documentation\/CoreMotion\/CMWaterSubmersionEvent"
        },
        {
          "description" : "An update that contains data about the pressure and depth.",
          "name" : "CMWaterSubmersionMeasurement",
          "url" : "https:\/\/developer.apple.com\/documentation\/CoreMotion\/CMWaterSubmersionMeasurement"
        },
        {
          "description" : "An update that contains data about the water temperature.",
          "name" : "CMWaterTemperature",
          "url" : "https:\/\/developer.apple.com\/documentation\/CoreMotion\/CMWaterTemperature"
        }
      ],
      "title" : "Water submersion"
    },
    {
      "content" : "",
      "items" : [
        {
          "name" : "NSObject"
        }
      ],
      "title" : "Inherits From"
    }
  ],
  "source" : "appleJSON",
  "title" : "CMWaterSubmersionManager",
  "url" : "https:\/\/developer.apple.com\/documentation\/CoreMotion\/CMWaterSubmersionManager"
}