{
  "abstract" : "Measurements of the Earth’s magnetic field relative to the device.",
  "codeExamples" : [

  ],
  "conformsTo" : [
    "CVarArg",
    "CustomDebugStringConvertible",
    "CustomStringConvertible",
    "Equatable",
    "Hashable",
    "NSCoding",
    "NSCopying",
    "NSObjectProtocol",
    "NSSecureCoding"
  ],
  "contentHash" : "437130b4ee233fcead107f5f4bc2a7ffe60536844c9b102478f18084bfd5ba84",
  "crawledAt" : "2025-12-03T11:52:36Z",
  "declaration" : {
    "code" : "class CMMagnetometerData",
    "language" : "swift"
  },
  "id" : "9080DCBD-80EF-41F3-AA51-05780B1ECBF0",
  "kind" : "class",
  "language" : "swift",
  "module" : "Core Motion",
  "overview" : "## Overview\n\nYour application can obtain samples of magnetometer measurements, as represented by instances of this class, from the block handler of the [doc:\/\/com.apple.coremotion\/documentation\/CoreMotion\/CMMotionManager\/startMagnetometerUpdates(to:withHandler:)] method or from the [doc:\/\/com.apple.coremotion\/documentation\/CoreMotion\/CMMotionManager\/magnetometerData] property of the `CMMotionManager` class.",
  "platforms" : [
    "iOS",
    "iPadOS",
    "Mac Catalyst",
    "macOS",
    "watchOS"
  ],
  "rawMarkdown" : "---\nsource: https:\/\/developer.apple.com\/documentation\/CoreMotion\/CMMagnetometerData\ncrawled: 2025-12-03T11:52:36Z\n---\n\n# CMMagnetometerData\n\n**Class**\n\nMeasurements of the Earth’s magnetic field relative to the device.\n\n## Declaration\n\n```swift\nclass CMMagnetometerData\n```\n\n## Overview\n\nYour application can obtain samples of magnetometer measurements, as represented by instances of this class, from the block handler of the [doc:\/\/com.apple.coremotion\/documentation\/CoreMotion\/CMMotionManager\/startMagnetometerUpdates(to:withHandler:)] method or from the [doc:\/\/com.apple.coremotion\/documentation\/CoreMotion\/CMMotionManager\/magnetometerData] property of the `CMMotionManager` class.\n\n\n\n## Getting the Field Strength\n\n- **magneticField**: Returns the magnetic field measured by the magnetometer.\n- **CMMagneticField**: A structure containing 3-axis magnetometer data\n\n## Inherits From\n\n- CMLogItem\n\n## Conforms To\n\n- CVarArg\n- CustomDebugStringConvertible\n- CustomStringConvertible\n- Equatable\n- Hashable\n- NSCoding\n- NSCopying\n- NSObjectProtocol\n- NSSecureCoding\n\n",
  "sections" : [
    {
      "content" : "",
      "items" : [
        {
          "description" : "Returns the magnetic field measured by the magnetometer.",
          "name" : "magneticField",
          "url" : "https:\/\/developer.apple.com\/documentation\/CoreMotion\/CMMagnetometerData\/magneticField"
        },
        {
          "description" : "A structure containing 3-axis magnetometer data",
          "name" : "CMMagneticField",
          "url" : "https:\/\/developer.apple.com\/documentation\/CoreMotion\/CMMagneticField"
        }
      ],
      "title" : "Getting the Field Strength"
    },
    {
      "content" : "",
      "items" : [
        {
          "name" : "CMLogItem"
        }
      ],
      "title" : "Inherits From"
    }
  ],
  "source" : "appleJSON",
  "title" : "CMMagnetometerData",
  "url" : "https:\/\/developer.apple.com\/documentation\/CoreMotion\/CMMagnetometerData"
}