{
  "abstract" : "Use the Indoor Mapping Data Format (IMDF) to show an indoor map with custom overlays and points of interest.",
  "codeExamples" : [

  ],
  "contentHash" : "c7c829dbbf6bddb2efbb687e0735dead578af7b256185296091f609977574c56",
  "crawledAt" : "2025-12-02T15:48:58Z",
  "id" : "D1B95C67-2CBB-42A1-BE49-7D13AC23E616",
  "kind" : "unknown",
  "language" : "swift",
  "module" : "MapKit",
  "overview" : "## Overview\n\nThe sample app demonstrates decoding, rendering, and styling of a small subset of the IMDF feature types and their properties. Use these examples to create your own indoor map with a style that’s consistent with your app’s design. You’ll need to handle feature categories that are specific to your venue, and configure the map style using your own colors, icons, and level picker.",
  "rawMarkdown" : "---\nsource: https:\/\/developer.apple.com\/documentation\/MapKit\/displaying-an-indoor-map\ncrawled: 2025-12-02T15:48:58Z\n---\n\n# Displaying an Indoor Map\n\n**Sample Code**\n\nUse the Indoor Mapping Data Format (IMDF) to show an indoor map with custom overlays and points of interest.\n\n## Overview\n\nThe sample app demonstrates decoding, rendering, and styling of a small subset of the IMDF feature types and their properties. Use these examples to create your own indoor map with a style that’s consistent with your app’s design. You’ll need to handle feature categories that are specific to your venue, and configure the map style using your own colors, icons, and level picker.\n\n\n\n## Geographical features\n\n- **MKGeoJSONDecoder**: An object that decodes GeoJSON objects into MapKit types.\n- **MKGeoJSONFeature**: The decoded representation of a GeoJSON feature.\n- **MKGeoJSONObject**: Objects that the GeoJSON decoder can return.\n\n",
  "sections" : [
    {
      "content" : "",
      "items" : [
        {
          "description" : "An object that decodes GeoJSON objects into MapKit types.",
          "name" : "MKGeoJSONDecoder",
          "url" : "https:\/\/developer.apple.com\/documentation\/MapKit\/MKGeoJSONDecoder"
        },
        {
          "description" : "The decoded representation of a GeoJSON feature.",
          "name" : "MKGeoJSONFeature",
          "url" : "https:\/\/developer.apple.com\/documentation\/MapKit\/MKGeoJSONFeature"
        },
        {
          "description" : "Objects that the GeoJSON decoder can return.",
          "name" : "MKGeoJSONObject",
          "url" : "https:\/\/developer.apple.com\/documentation\/MapKit\/MKGeoJSONObject"
        }
      ],
      "title" : "Geographical features"
    }
  ],
  "source" : "appleJSON",
  "title" : "Displaying an Indoor Map",
  "url" : "https:\/\/developer.apple.com\/documentation\/MapKit\/displaying-an-indoor-map"
}