{
  "abstract" : "Converts a map region to a rectangle in the specified view.",
  "codeExamples" : [

  ],
  "contentHash" : "640683ab034b19d38076b166e8093c2e55a16f8a91869880b7340f9fcbd57e0c",
  "crawledAt" : "2025-12-03T13:07:00Z",
  "declaration" : {
    "code" : "@MainActor func convert(_ region: MKCoordinateRegion, toRectTo view: NSView?) -> CGRect",
    "language" : "swift"
  },
  "id" : "DB68B1BE-7C1E-4966-B71C-F408451CCD82",
  "kind" : "method",
  "language" : "swift",
  "module" : "MapKit",
  "overview" : "## Return Value\n\nThe rectangle corresponding to the specified map region.",
  "platforms" : [
    "macOS"
  ],
  "rawMarkdown" : "---\nsource: https:\/\/developer.apple.com\/documentation\/MapKit\/MKMapView\/convert(_:toRectTo:)\ncrawled: 2025-12-03T13:07:00Z\n---\n\n# convert(_:toRectTo:)\n\n**Instance Method**\n\nConverts a map region to a rectangle in the specified view.\n\n## Declaration\n\n```swift\n@MainActor func convert(_ region: MKCoordinateRegion, toRectTo view: NSView?) -> CGRect\n```\n\n```swift\n@MainActor func convert(_ region: MKCoordinateRegion, toRectTo view: UIView?) -> CGRect\n```\n\n## Parameters\n\n- **region**: The map region that you want to find the corresponding view rectangle for.\n- **view**: The view where you want to locate the specified map region. If this parameter is `nil`, the method specifies the returned rectangle in the window’s coordinate system. If `view` isn’t `nil`, the rectangle belongs to the same window as the map view.\n\n## Return Value\n\nThe rectangle corresponding to the specified map region.\n\n## Converting map coordinates\n\n- **convert(_:toPointTo:)**: Converts a map coordinate to a point in the specified view.\n- **convert(_:toCoordinateFrom:)**: Converts a point in the specified view’s coordinate system to a map coordinate.\n- **convert(_:toRegionFrom:)**: Converts a rectangle in the specified view’s coordinate system to a map region.\n\n",
  "sections" : [
    {
      "content" : "",
      "items" : [
        {
          "description" : "Converts a map coordinate to a point in the specified view.",
          "name" : "convert(_:toPointTo:)",
          "url" : "https:\/\/developer.apple.com\/documentation\/MapKit\/MKMapView\/convert(_:toPointTo:)"
        },
        {
          "description" : "Converts a point in the specified view’s coordinate system to a map coordinate.",
          "name" : "convert(_:toCoordinateFrom:)",
          "url" : "https:\/\/developer.apple.com\/documentation\/MapKit\/MKMapView\/convert(_:toCoordinateFrom:)"
        },
        {
          "description" : "Converts a rectangle in the specified view’s coordinate system to a map region.",
          "name" : "convert(_:toRegionFrom:)",
          "url" : "https:\/\/developer.apple.com\/documentation\/MapKit\/MKMapView\/convert(_:toRegionFrom:)"
        }
      ],
      "title" : "Converting map coordinates"
    }
  ],
  "source" : "appleJSON",
  "title" : "convert(_:toRectTo:)",
  "url" : "https:\/\/developer.apple.com\/documentation\/MapKit\/MKMapView\/convert(_:toRectTo:)"
}