{
  "abstract" : "A specialized button that allows the user to toggle whether the map tracks to the heading the user is facing.",
  "codeExamples" : [

  ],
  "conformsTo" : [
    "CALayerDelegate",
    "CVarArg",
    "CustomDebugStringConvertible",
    "CustomStringConvertible",
    "Equatable",
    "Hashable",
    "NSCoding",
    "NSObjectProtocol",
    "NSTouchBarProvider",
    "Sendable",
    "SendableMetatype",
    "UIAccessibilityIdentification",
    "UIActivityItemsConfigurationProviding",
    "UIAppearance",
    "UIAppearanceContainer",
    "UICoordinateSpace",
    "UIDynamicItem",
    "UIFocusEnvironment",
    "UIFocusItem",
    "UIFocusItemContainer",
    "UILargeContentViewerItem",
    "UIPasteConfigurationSupporting",
    "UIPopoverPresentationControllerSourceItem",
    "UIResponderStandardEditActions",
    "UITraitChangeObservable",
    "UITraitEnvironment",
    "UIUserActivityRestoring"
  ],
  "contentHash" : "b5bf3cbc254cd8af48d16529a7930a90c0673fb208f6f737f3412ec29001925e",
  "crawledAt" : "2025-12-05T11:16:37Z",
  "declaration" : {
    "code" : "@MainActor class MKUserTrackingButton",
    "language" : "swift"
  },
  "id" : "F08CF425-F3D7-43F2-8189-6C799493BE09",
  "kind" : "class",
  "language" : "swift",
  "module" : "MapKit",
  "overview" : "## Overview\n\nUse this class when you need a standard button that you can incorporate into your view hierarchy. Tapping the button lets the user toggles between modes for displaying the map with and without the current heading applied. The button also reflects the current user tracking mode if set elsewhere.",
  "platforms" : [
    "iOS",
    "iPadOS",
    "Mac Catalyst",
    "visionOS"
  ],
  "rawMarkdown" : "---\nsource: https:\/\/developer.apple.com\/documentation\/MapKit\/MKUserTrackingButton\ncrawled: 2025-12-05T11:16:37Z\n---\n\n# MKUserTrackingButton\n\n**Class**\n\nA specialized button that allows the user to toggle whether the map tracks to the heading the user is facing.\n\n## Declaration\n\n```swift\n@MainActor class MKUserTrackingButton\n```\n\n## Overview\n\nUse this class when you need a standard button that you can incorporate into your view hierarchy. Tapping the button lets the user toggles between modes for displaying the map with and without the current heading applied. The button also reflects the current user tracking mode if set elsewhere.\n\n## Creating a user tracking button\n\n- **init(mapView:)**: Initializes the button with the map view that it should control.\n\n## Getting the parent map\n\n- **mapView**: The map view associated with the button.\n\n## Map customization\n\n- **MKMapCamera**: A virtual camera for defining the appearance of the map.\n- **MKCompassButton**: A specialized view that displays the compass heading for its associated map.\n- **MKScaleView**: A specialized view that displays the scale information for its associated map.\n- **MKZoomControl**: A specialized view that displays and controls the zoom level of the map view.\n- **MKPitchControl**: A specialized view that displays and controls the pitch angle of the map view.\n- **MKUserTrackingBarButtonItem**: A specialized bar button item that allows the user to toggle whether the map tracks to the heading the user is facing.\n\n## Inherits From\n\n- UIView\n\n## Conforms To\n\n- CALayerDelegate\n- CVarArg\n- CustomDebugStringConvertible\n- CustomStringConvertible\n- Equatable\n- Hashable\n- NSCoding\n- NSObjectProtocol\n- NSTouchBarProvider\n- Sendable\n- SendableMetatype\n- UIAccessibilityIdentification\n- UIActivityItemsConfigurationProviding\n- UIAppearance\n- UIAppearanceContainer\n- UICoordinateSpace\n- UIDynamicItem\n- UIFocusEnvironment\n- UIFocusItem\n- UIFocusItemContainer\n- UILargeContentViewerItem\n- UIPasteConfigurationSupporting\n- UIPopoverPresentationControllerSourceItem\n- UIResponderStandardEditActions\n- UITraitChangeObservable\n- UITraitEnvironment\n- UIUserActivityRestoring\n\n",
  "sections" : [
    {
      "content" : "",
      "items" : [
        {
          "description" : "Initializes the button with the map view that it should control.",
          "name" : "init(mapView:)",
          "url" : "https:\/\/developer.apple.com\/documentation\/MapKit\/MKUserTrackingButton\/init(mapView:)"
        }
      ],
      "title" : "Creating a user tracking button"
    },
    {
      "content" : "",
      "items" : [
        {
          "description" : "The map view associated with the button.",
          "name" : "mapView",
          "url" : "https:\/\/developer.apple.com\/documentation\/MapKit\/MKUserTrackingButton\/mapView"
        }
      ],
      "title" : "Getting the parent map"
    },
    {
      "content" : "",
      "items" : [
        {
          "description" : "A virtual camera for defining the appearance of the map.",
          "name" : "MKMapCamera",
          "url" : "https:\/\/developer.apple.com\/documentation\/MapKit\/MKMapCamera"
        },
        {
          "description" : "A specialized view that displays the compass heading for its associated map.",
          "name" : "MKCompassButton",
          "url" : "https:\/\/developer.apple.com\/documentation\/MapKit\/MKCompassButton"
        },
        {
          "description" : "A specialized view that displays the scale information for its associated map.",
          "name" : "MKScaleView",
          "url" : "https:\/\/developer.apple.com\/documentation\/MapKit\/MKScaleView"
        },
        {
          "description" : "A specialized view that displays and controls the zoom level of the map view.",
          "name" : "MKZoomControl",
          "url" : "https:\/\/developer.apple.com\/documentation\/MapKit\/MKZoomControl"
        },
        {
          "description" : "A specialized view that displays and controls the pitch angle of the map view.",
          "name" : "MKPitchControl",
          "url" : "https:\/\/developer.apple.com\/documentation\/MapKit\/MKPitchControl"
        },
        {
          "description" : "A specialized bar button item that allows the user to toggle whether the map tracks to the heading the user is facing.",
          "name" : "MKUserTrackingBarButtonItem",
          "url" : "https:\/\/developer.apple.com\/documentation\/MapKit\/MKUserTrackingBarButtonItem"
        }
      ],
      "title" : "Map customization"
    },
    {
      "content" : "",
      "items" : [
        {
          "name" : "UIView"
        }
      ],
      "title" : "Inherits From"
    }
  ],
  "source" : "appleJSON",
  "title" : "MKUserTrackingButton",
  "url" : "https:\/\/developer.apple.com\/documentation\/MapKit\/MKUserTrackingButton"
}