{
  "abstract" : "An abstract class that defines the basic properties for all shape-based overlay objects.",
  "codeExamples" : [

  ],
  "conformsTo" : [
    "CVarArg",
    "CustomDebugStringConvertible",
    "CustomStringConvertible",
    "Equatable",
    "Hashable",
    "MKAnnotation",
    "NSObjectProtocol"
  ],
  "contentHash" : "b85c85e7c31913494a3676d8d7d2f81875c635da9dec15a986aa177b434042f2",
  "crawledAt" : "2025-12-02T19:50:00Z",
  "declaration" : {
    "code" : "class MKShape",
    "language" : "swift"
  },
  "id" : "B3C89258-1910-4314-BB5F-53E581A849A0",
  "inheritedBy" : [
    "MKCircle",
    "MKMultiPoint",
    "MKMultiPolygon",
    "MKMultiPolyline",
    "MKPointAnnotation"
  ],
  "kind" : "class",
  "language" : "swift",
  "module" : "MapKit",
  "overview" : "## Overview\n\nYou can’t instantiate this class directly; use a subclass instead. Subclasses are responsible for defining the geometry of the shape and providing an appropriate value for the coordinate property they inherit from the [doc:\/\/com.apple.mapkit\/documentation\/MapKit\/MKAnnotation] protocol.",
  "platforms" : [
    "iOS",
    "iPadOS",
    "Mac Catalyst",
    "macOS",
    "tvOS",
    "visionOS",
    "watchOS"
  ],
  "rawMarkdown" : "---\nsource: https:\/\/developer.apple.com\/documentation\/MapKit\/MKShape\ncrawled: 2025-12-02T19:50:00Z\n---\n\n# MKShape\n\n**Class**\n\nAn abstract class that defines the basic properties for all shape-based overlay objects.\n\n## Declaration\n\n```swift\nclass MKShape\n```\n\n## Overview\n\nYou can’t instantiate this class directly; use a subclass instead. Subclasses are responsible for defining the geometry of the shape and providing an appropriate value for the coordinate property they inherit from the [doc:\/\/com.apple.mapkit\/documentation\/MapKit\/MKAnnotation] protocol.\n\n## Accessing the shape attributes\n\n- **title**: The title of the shape annotation.\n- **subtitle**: The subtitle of the shape annotation.\n\n## Shared behavior\n\n- **MKOverlay**: An interface for associating content with a specific map region.\n- **MKOverlayRenderer**: The shared infrastructure for drawing overlays on the map surface.\n- **MKMultiPoint**: An abstract class that defines the common behavior that open and closed polygon overlays share.\n- **MKPlacemark**: A user-friendly description of a location on the map.\n\n## Inherits From\n\n- NSObject\n\n## Inherited By\n\n- MKCircle\n- MKMultiPoint\n- MKMultiPolygon\n- MKMultiPolyline\n- MKPointAnnotation\n\n## Conforms To\n\n- CVarArg\n- CustomDebugStringConvertible\n- CustomStringConvertible\n- Equatable\n- Hashable\n- MKAnnotation\n- NSObjectProtocol\n\n",
  "sections" : [
    {
      "content" : "",
      "items" : [
        {
          "description" : "The title of the shape annotation.",
          "name" : "title",
          "url" : "https:\/\/developer.apple.com\/documentation\/MapKit\/MKShape\/title"
        },
        {
          "description" : "The subtitle of the shape annotation.",
          "name" : "subtitle",
          "url" : "https:\/\/developer.apple.com\/documentation\/MapKit\/MKShape\/subtitle"
        }
      ],
      "title" : "Accessing the shape attributes"
    },
    {
      "content" : "",
      "items" : [
        {
          "description" : "An interface for associating content with a specific map region.",
          "name" : "MKOverlay",
          "url" : "https:\/\/developer.apple.com\/documentation\/MapKit\/MKOverlay"
        },
        {
          "description" : "The shared infrastructure for drawing overlays on the map surface.",
          "name" : "MKOverlayRenderer",
          "url" : "https:\/\/developer.apple.com\/documentation\/MapKit\/MKOverlayRenderer"
        },
        {
          "description" : "An abstract class that defines the common behavior that open and closed polygon overlays share.",
          "name" : "MKMultiPoint",
          "url" : "https:\/\/developer.apple.com\/documentation\/MapKit\/MKMultiPoint"
        },
        {
          "description" : "A user-friendly description of a location on the map.",
          "name" : "MKPlacemark",
          "url" : "https:\/\/developer.apple.com\/documentation\/MapKit\/MKPlacemark"
        }
      ],
      "title" : "Shared behavior"
    },
    {
      "content" : "",
      "items" : [
        {
          "name" : "NSObject"
        }
      ],
      "title" : "Inherits From"
    }
  ],
  "source" : "appleJSON",
  "title" : "MKShape",
  "url" : "https:\/\/developer.apple.com\/documentation\/MapKit\/MKShape"
}