{
  "abstract" : "Opens the Maps app and displays the map item.",
  "codeExamples" : [

  ],
  "contentHash" : "14d2a284313a306a9b600a886806862e3da0c7d1e1281d492190866ff867eeca",
  "crawledAt" : "2025-12-01T17:53:23Z",
  "declaration" : {
    "code" : "func openInMaps(launchOptions: [String : Any]? = nil, completionHandler completion: ((Bool) -> Void)? = nil)",
    "language" : "swift"
  },
  "id" : "0CE0FDE5-6A43-4CE5-83F8-9C37DF3D4F89",
  "kind" : "method",
  "module" : "MapKit",
  "platforms" : [
    "macOS"
  ],
  "rawMarkdown" : "---\nsource: https:\/\/developer.apple.com\/documentation\/MapKit\/MKMapItem\/openInMaps(launchOptions:completionHandler:)\ncrawled: 2025-12-01T17:53:23Z\n---\n\n# openInMaps(launchOptions:completionHandler:)\n\n**Instance Method**\n\nOpens the Maps app and displays the map item.\n\n## Declaration\n\n```swift\nfunc openInMaps(launchOptions: [String : Any]? = nil, completionHandler completion: ((Bool) -> Void)? = nil)\n```\n\n```swift\nfunc openInMaps(launchOptions: [String : Any]? = nil) async -> Bool\n```\n\n## Parameters\n\n- **launchOptions**: A dictionary of launch options to pass to the Maps app.\n- **completion**: A completion block the system calls that indicates whether the request was successful.\n\n## Launching the Maps app\n\n- **openMaps(with:launchOptions:)**: Opens the Maps app and displays the specified map items.\n- **openMaps(with:launchOptions:completionHandler:)**: Opens the Maps app using the specified map items and options.\n- **openMaps(with:launchOptions:from:completionHandler:)**: Opens the Maps app from a particular scene using the specified map items and options.\n- **openInMaps(launchOptions:)**: Opens the Maps app and displays the map item.\n- **openInMaps(launchOptions:from:completionHandler:)**: Opens the Maps app from a particular scene using the specified options.\n\n",
  "sections" : [
    {
      "content" : "",
      "items" : [
        {
          "description" : "Opens the Maps app and displays the specified map items.",
          "name" : "openMaps(with:launchOptions:)",
          "url" : "https:\/\/developer.apple.com\/documentation\/MapKit\/MKMapItem\/openMaps(with:launchOptions:)"
        },
        {
          "description" : "Opens the Maps app using the specified map items and options.",
          "name" : "openMaps(with:launchOptions:completionHandler:)",
          "url" : "https:\/\/developer.apple.com\/documentation\/MapKit\/MKMapItem\/openMaps(with:launchOptions:completionHandler:)"
        },
        {
          "description" : "Opens the Maps app from a particular scene using the specified map items and options.",
          "name" : "openMaps(with:launchOptions:from:completionHandler:)",
          "url" : "https:\/\/developer.apple.com\/documentation\/MapKit\/MKMapItem\/openMaps(with:launchOptions:from:completionHandler:)"
        },
        {
          "description" : "Opens the Maps app and displays the map item.",
          "name" : "openInMaps(launchOptions:)",
          "url" : "https:\/\/developer.apple.com\/documentation\/MapKit\/MKMapItem\/openInMaps(launchOptions:)"
        },
        {
          "description" : "Opens the Maps app from a particular scene using the specified options.",
          "name" : "openInMaps(launchOptions:from:completionHandler:)",
          "url" : "https:\/\/developer.apple.com\/documentation\/MapKit\/MKMapItem\/openInMaps(launchOptions:from:completionHandler:)"
        }
      ],
      "title" : "Launching the Maps app"
    }
  ],
  "source" : "appleJSON",
  "title" : "openInMaps(launchOptions:completionHandler:)",
  "url" : "https:\/\/developer.apple.com\/documentation\/MapKit\/MKMapItem\/openInMaps(launchOptions:completionHandler:)"
}