{
  "abstract" : "The view to display on the right side of the standard callout.",
  "codeExamples" : [

  ],
  "contentHash" : "01ee639692d5ba11023f1479e027ce6b1af3a2f000311ef3409ed5edbd10ed4a",
  "crawledAt" : "2025-12-03T12:45:08Z",
  "declaration" : {
    "code" : "@MainActor var rightCalloutAccessoryView: NSView? { get set }",
    "language" : "swift"
  },
  "id" : "1BBD9F28-9D2B-418D-811C-F4CDD8D24FBC",
  "kind" : "property",
  "language" : "swift",
  "module" : "MapKit",
  "overview" : "## Discussion\n\nThis property is `nil` by default. Typically, you use the right callout view to link to more detailed information about the annotation. In an iOS app, a common view to specify for this property is a button object with a type of [doc:\/\/com.apple.documentation\/documentation\/UIKit\/UIButton\/ButtonType-swift.enum\/detailDisclosure].\n\nIn an iOS app, if the view you specify is also a descendant of the [doc:\/\/com.apple.documentation\/documentation\/UIKit\/UIControl] class, you can use the map view’s delegate to receive notifications when a person taps your control. If it doesn’t descend from [doc:\/\/com.apple.documentation\/documentation\/UIKit\/UIControl], your view is responsible for handling any touch events within its bounds.\n\nIn a macOS app, the callout view’s view controller can implement an action method that responds when a user clicks the control in a callout view.",
  "platforms" : [
    "macOS"
  ],
  "rawMarkdown" : "---\nsource: https:\/\/developer.apple.com\/documentation\/MapKit\/MKAnnotationView\/rightCalloutAccessoryView\ncrawled: 2025-12-03T12:45:08Z\n---\n\n# rightCalloutAccessoryView\n\n**Instance Property**\n\nThe view to display on the right side of the standard callout.\n\n## Declaration\n\n```swift\n@MainActor var rightCalloutAccessoryView: NSView? { get set }\n```\n\n```swift\n@MainActor var rightCalloutAccessoryView: UIView? { get set }\n```\n\n## Discussion\n\nThis property is `nil` by default. Typically, you use the right callout view to link to more detailed information about the annotation. In an iOS app, a common view to specify for this property is a button object with a type of [doc:\/\/com.apple.documentation\/documentation\/UIKit\/UIButton\/ButtonType-swift.enum\/detailDisclosure].\n\nIn an iOS app, if the view you specify is also a descendant of the [doc:\/\/com.apple.documentation\/documentation\/UIKit\/UIControl] class, you can use the map view’s delegate to receive notifications when a person taps your control. If it doesn’t descend from [doc:\/\/com.apple.documentation\/documentation\/UIKit\/UIControl], your view is responsible for handling any touch events within its bounds.\n\nIn a macOS app, the callout view’s view controller can implement an action method that responds when a user clicks the control in a callout view.\n\n## Managing callout views\n\n- **accessoryOffset**: An offset that changes the accessory’s default anchor point.\n- **canShowCallout**: A Boolean value that indicates whether the annotation view is able to display extra information in a callout.\n- **leftCalloutAccessoryView**: The view to display on the left side of the standard callout.\n- **detailCalloutAccessoryView**: The detail accessory view to use in the standard callout.\n- **leftCalloutOffset**: The offset in points from the middle-left of the annotation view.\n- **rightCalloutOffset**: The offset in points from the middle-right of the annotation view.\n\n",
  "sections" : [
    {
      "content" : "",
      "items" : [
        {
          "description" : "An offset that changes the accessory’s default anchor point.",
          "name" : "accessoryOffset",
          "url" : "https:\/\/developer.apple.com\/documentation\/MapKit\/MKAnnotationView\/accessoryOffset"
        },
        {
          "description" : "A Boolean value that indicates whether the annotation view is able to display extra information in a callout.",
          "name" : "canShowCallout",
          "url" : "https:\/\/developer.apple.com\/documentation\/MapKit\/MKAnnotationView\/canShowCallout"
        },
        {
          "description" : "The view to display on the left side of the standard callout.",
          "name" : "leftCalloutAccessoryView",
          "url" : "https:\/\/developer.apple.com\/documentation\/MapKit\/MKAnnotationView\/leftCalloutAccessoryView"
        },
        {
          "description" : "The detail accessory view to use in the standard callout.",
          "name" : "detailCalloutAccessoryView",
          "url" : "https:\/\/developer.apple.com\/documentation\/MapKit\/MKAnnotationView\/detailCalloutAccessoryView"
        },
        {
          "description" : "The offset in points from the middle-left of the annotation view.",
          "name" : "leftCalloutOffset",
          "url" : "https:\/\/developer.apple.com\/documentation\/MapKit\/MKAnnotationView\/leftCalloutOffset"
        },
        {
          "description" : "The offset in points from the middle-right of the annotation view.",
          "name" : "rightCalloutOffset",
          "url" : "https:\/\/developer.apple.com\/documentation\/MapKit\/MKAnnotationView\/rightCalloutOffset"
        }
      ],
      "title" : "Managing callout views"
    }
  ],
  "source" : "appleJSON",
  "title" : "rightCalloutAccessoryView",
  "url" : "https:\/\/developer.apple.com\/documentation\/MapKit\/MKAnnotationView\/rightCalloutAccessoryView"
}