{
  "abstract" : "An open polygon overlay consisting of line segments that follow the contours of the Earth to create the shortest path between the specified points.",
  "codeExamples" : [

  ],
  "conformsTo" : [
    "CVarArg",
    "CustomDebugStringConvertible",
    "CustomStringConvertible",
    "Equatable",
    "Hashable",
    "MKAnnotation",
    "MKGeoJSONObject",
    "MKOverlay",
    "NSObjectProtocol"
  ],
  "contentHash" : "815586e798fcb7fd3eb2b64b7691ca7cb4a4156b87237d68e86cd5eec2563c8a",
  "crawledAt" : "2025-12-02T19:32:00Z",
  "declaration" : {
    "code" : "class MKGeodesicPolyline",
    "language" : "swift"
  },
  "id" : "9A332644-0B69-480E-94AF-BA8EC49105E8",
  "kind" : "class",
  "language" : "swift",
  "module" : "MapKit",
  "overview" : "## Overview\n\nA geodesic polyline contains a set of points that connect end-to-end in the order that you provide them. The first and last points don’t automatically connect to each other. When displaying on a two-dimensional map view, the line segment between any two points may appear curved.",
  "platforms" : [
    "iOS",
    "iPadOS",
    "Mac Catalyst",
    "macOS",
    "tvOS",
    "visionOS",
    "watchOS"
  ],
  "rawMarkdown" : "---\nsource: https:\/\/developer.apple.com\/documentation\/MapKit\/MKGeodesicPolyline\ncrawled: 2025-12-02T19:32:00Z\n---\n\n# MKGeodesicPolyline\n\n**Class**\n\nAn open polygon overlay consisting of line segments that follow the contours of the Earth to create the shortest path between the specified points.\n\n## Declaration\n\n```swift\nclass MKGeodesicPolyline\n```\n\n## Overview\n\nA geodesic polyline contains a set of points that connect end-to-end in the order that you provide them. The first and last points don’t automatically connect to each other. When displaying on a two-dimensional map view, the line segment between any two points may appear curved.\n\n## Creating a geodesic polyline overlay\n\n- **init(points:count:)**: Creates and returns a geodesic polyline using the specified map points.\n- **init(coordinates:count:)**: Creates and returns a geodesic polyline using the specified coordinates.\n\n## Multiple segment lines\n\n- **MKPolyline**: An open polygon overlay consisting of one or more connected line segments.\n- **MKMultiPolyline**: A collection of multipolyline shapes, each consisting of one or more connected line segments.\n- **MKPolylineRenderer**: A visual representation of any polyline overlay object.\n- **MKMultiPolylineRenderer**: A visual representation of multiple polyline overlay objects.\n- **MKGradientPolylineRenderer**: A visual representation of any polyline overlay object with a gradient.\n\n## Inherits From\n\n- MKPolyline\n\n## Conforms To\n\n- CVarArg\n- CustomDebugStringConvertible\n- CustomStringConvertible\n- Equatable\n- Hashable\n- MKAnnotation\n- MKGeoJSONObject\n- MKOverlay\n- NSObjectProtocol\n\n",
  "sections" : [
    {
      "content" : "",
      "items" : [
        {
          "description" : "Creates and returns a geodesic polyline using the specified map points.",
          "name" : "init(points:count:)",
          "url" : "https:\/\/developer.apple.com\/documentation\/MapKit\/MKGeodesicPolyline\/init(points:count:)"
        },
        {
          "description" : "Creates and returns a geodesic polyline using the specified coordinates.",
          "name" : "init(coordinates:count:)",
          "url" : "https:\/\/developer.apple.com\/documentation\/MapKit\/MKGeodesicPolyline\/init(coordinates:count:)"
        }
      ],
      "title" : "Creating a geodesic polyline overlay"
    },
    {
      "content" : "",
      "items" : [
        {
          "description" : "An open polygon overlay consisting of one or more connected line segments.",
          "name" : "MKPolyline",
          "url" : "https:\/\/developer.apple.com\/documentation\/MapKit\/MKPolyline"
        },
        {
          "description" : "A collection of multipolyline shapes, each consisting of one or more connected line segments.",
          "name" : "MKMultiPolyline",
          "url" : "https:\/\/developer.apple.com\/documentation\/MapKit\/MKMultiPolyline"
        },
        {
          "description" : "A visual representation of any polyline overlay object.",
          "name" : "MKPolylineRenderer",
          "url" : "https:\/\/developer.apple.com\/documentation\/MapKit\/MKPolylineRenderer"
        },
        {
          "description" : "A visual representation of multiple polyline overlay objects.",
          "name" : "MKMultiPolylineRenderer",
          "url" : "https:\/\/developer.apple.com\/documentation\/MapKit\/MKMultiPolylineRenderer"
        },
        {
          "description" : "A visual representation of any polyline overlay object with a gradient.",
          "name" : "MKGradientPolylineRenderer",
          "url" : "https:\/\/developer.apple.com\/documentation\/MapKit\/MKGradientPolylineRenderer"
        }
      ],
      "title" : "Multiple segment lines"
    },
    {
      "content" : "",
      "items" : [
        {
          "name" : "MKPolyline"
        }
      ],
      "title" : "Inherits From"
    }
  ],
  "source" : "appleJSON",
  "title" : "MKGeodesicPolyline",
  "url" : "https:\/\/developer.apple.com\/documentation\/MapKit\/MKGeodesicPolyline"
}