{
  "abstract" : "The visual representation of a single polygon overlay.",
  "codeExamples" : [

  ],
  "conformsTo" : [
    "CVarArg",
    "CustomDebugStringConvertible",
    "CustomStringConvertible",
    "Equatable",
    "Hashable",
    "NSObjectProtocol"
  ],
  "contentHash" : "5bf8deda563aacdefba726be45276e24265c10fc572a71eaa1a5e4e6bc49a94b",
  "crawledAt" : "2025-12-03T12:45:58Z",
  "declaration" : {
    "code" : "class MKPolygonRenderer",
    "language" : "swift"
  },
  "id" : "ECD57157-2504-4FCF-92BD-58BA643AAF52",
  "kind" : "class",
  "language" : "swift",
  "module" : "MapKit",
  "overview" : "## Overview\n\nThis renderer creates the polygon overlay by first filling the shape and then representing its outline with strokes. You can change the color and other drawing attributes of the polygon by modifying the properties inherited from the parent class.",
  "platforms" : [
    "iOS",
    "iPadOS",
    "Mac Catalyst",
    "macOS",
    "tvOS",
    "visionOS"
  ],
  "rawMarkdown" : "---\nsource: https:\/\/developer.apple.com\/documentation\/MapKit\/MKPolygonRenderer\ncrawled: 2025-12-03T12:45:58Z\n---\n\n# MKPolygonRenderer\n\n**Class**\n\nThe visual representation of a single polygon overlay.\n\n## Declaration\n\n```swift\nclass MKPolygonRenderer\n```\n\n## Overview\n\nThis renderer creates the polygon overlay by first filling the shape and then representing its outline with strokes. You can change the color and other drawing attributes of the polygon by modifying the properties inherited from the parent class.\n\n## Creating a polygon renderer\n\n- **init(polygon:)**: Creates a new renderer that handles drawing for the specified polygon overlay object.\n\n## Accessing the polygon overlay object\n\n- **polygon**: The polygon object that contains the information used to draw the overlay’s contents.\n\n## Accessing the stroke\n\n- **strokeStart**: The unit distance along the polygon where the stroke starts.\n- **strokeEnd**: The unit distance along the polygon where the stroke ends.\n\n## Custom shape overlays\n\n- **MKPolygon**: A closed polygon overlay.\n- **MKMultiPolygon**: A collection of multiple closed polygon overlays.\n- **MKMultiPolygonRenderer**: The visual representation of multiple polygon overlays.\n- **MKOverlayPathRenderer**: The visual representation of a path-based overlay.\n\n## Inherits From\n\n- MKOverlayPathRenderer\n\n## Conforms To\n\n- CVarArg\n- CustomDebugStringConvertible\n- CustomStringConvertible\n- Equatable\n- Hashable\n- NSObjectProtocol\n\n",
  "sections" : [
    {
      "content" : "",
      "items" : [
        {
          "description" : "Creates a new renderer that handles drawing for the specified polygon overlay object.",
          "name" : "init(polygon:)",
          "url" : "https:\/\/developer.apple.com\/documentation\/MapKit\/MKPolygonRenderer\/init(polygon:)"
        }
      ],
      "title" : "Creating a polygon renderer"
    },
    {
      "content" : "",
      "items" : [
        {
          "description" : "The polygon object that contains the information used to draw the overlay’s contents.",
          "name" : "polygon",
          "url" : "https:\/\/developer.apple.com\/documentation\/MapKit\/MKPolygonRenderer\/polygon"
        }
      ],
      "title" : "Accessing the polygon overlay object"
    },
    {
      "content" : "",
      "items" : [
        {
          "description" : "The unit distance along the polygon where the stroke starts.",
          "name" : "strokeStart",
          "url" : "https:\/\/developer.apple.com\/documentation\/MapKit\/MKPolygonRenderer\/strokeStart"
        },
        {
          "description" : "The unit distance along the polygon where the stroke ends.",
          "name" : "strokeEnd",
          "url" : "https:\/\/developer.apple.com\/documentation\/MapKit\/MKPolygonRenderer\/strokeEnd"
        }
      ],
      "title" : "Accessing the stroke"
    },
    {
      "content" : "",
      "items" : [
        {
          "description" : "A closed polygon overlay.",
          "name" : "MKPolygon",
          "url" : "https:\/\/developer.apple.com\/documentation\/MapKit\/MKPolygon"
        },
        {
          "description" : "A collection of multiple closed polygon overlays.",
          "name" : "MKMultiPolygon",
          "url" : "https:\/\/developer.apple.com\/documentation\/MapKit\/MKMultiPolygon"
        },
        {
          "description" : "The visual representation of multiple polygon overlays.",
          "name" : "MKMultiPolygonRenderer",
          "url" : "https:\/\/developer.apple.com\/documentation\/MapKit\/MKMultiPolygonRenderer"
        },
        {
          "description" : "The visual representation of a path-based overlay.",
          "name" : "MKOverlayPathRenderer",
          "url" : "https:\/\/developer.apple.com\/documentation\/MapKit\/MKOverlayPathRenderer"
        }
      ],
      "title" : "Custom shape overlays"
    },
    {
      "content" : "",
      "items" : [
        {
          "name" : "MKOverlayPathRenderer"
        }
      ],
      "title" : "Inherits From"
    }
  ],
  "source" : "appleJSON",
  "title" : "MKPolygonRenderer",
  "url" : "https:\/\/developer.apple.com\/documentation\/MapKit\/MKPolygonRenderer"
}