{
  "abstract" : "An array of instruction variants for the CarPlay dashboard.",
  "codeExamples" : [

  ],
  "contentHash" : "0dfb9bba53ff7117a05fcc127623d83f1d79fa2f525d1efa1a46ef48e5076adf",
  "crawledAt" : "2025-12-04T21:44:59Z",
  "declaration" : {
    "code" : "var dashboardInstructionVariants: [String] { get set }",
    "language" : "swift"
  },
  "id" : "E902B083-A1A5-4A4E-A8A8-6D6797D92694",
  "kind" : "property",
  "language" : "swift",
  "module" : "CarPlay",
  "overview" : "## Discussion\n\nLocalize each variant for display to the user, and make sure the array contains at least one variant. The system displays the first variant that fits into the available screen space, so arrange the variants in order from most- to least-preferred.",
  "platforms" : [
    "iOS",
    "iPadOS",
    "Mac Catalyst"
  ],
  "rawMarkdown" : "---\nsource: https:\/\/developer.apple.com\/documentation\/CarPlay\/CPManeuver\/dashboardInstructionVariants\ncrawled: 2025-12-04T21:44:59Z\n---\n\n# dashboardInstructionVariants\n\n**Instance Property**\n\nAn array of instruction variants for the CarPlay dashboard.\n\n## Declaration\n\n```swift\nvar dashboardInstructionVariants: [String] { get set }\n```\n\n## Discussion\n\nLocalize each variant for display to the user, and make sure the array contains at least one variant. The system displays the first variant that fits into the available screen space, so arrange the variants in order from most- to least-preferred.\n\n\n\n## Providing instructions\n\n- **notificationInstructionVariants**: An array of instruction variants for notification banners.\n\n",
  "sections" : [
    {
      "content" : "",
      "items" : [
        {
          "description" : "An array of instruction variants for notification banners.",
          "name" : "notificationInstructionVariants",
          "url" : "https:\/\/developer.apple.com\/documentation\/CarPlay\/CPManeuver\/notificationInstructionVariants"
        }
      ],
      "title" : "Providing instructions"
    }
  ],
  "source" : "appleJSON",
  "title" : "dashboardInstructionVariants",
  "url" : "https:\/\/developer.apple.com\/documentation\/CarPlay\/CPManeuver\/dashboardInstructionVariants"
}