{
  "abstract" : "A template that provides information for a point of interest, food order, parking location, or charging location.",
  "codeExamples" : [

  ],
  "conformsTo" : [
    "CPBarButtonProviding",
    "CVarArg",
    "CustomDebugStringConvertible",
    "CustomStringConvertible",
    "Equatable",
    "Hashable",
    "NSCoding",
    "NSObjectProtocol",
    "NSSecureCoding",
    "Sendable",
    "SendableMetatype"
  ],
  "contentHash" : "841104eea58e6ca399cbdbfc53af59a2e45cf6a6f31c530207d960500c73399f",
  "crawledAt" : "2025-12-02T15:50:49Z",
  "declaration" : {
    "code" : "@MainActor class CPInformationTemplate",
    "language" : "swift"
  },
  "id" : "0B104A15-3C2B-4257-911F-3429E7DD34B1",
  "kind" : "class",
  "language" : "swift",
  "module" : "CarPlay",
  "overview" : "## Overview\n\nAn information template displays a list of items, and up to three actions the user can perform.\n\nYou use an information template to display informative, actionable content to the user. For example, you might display a summary of the user’s food order, and provide actions to place or cancel the order.\n\nWhen creating an information template, you populate the list with an array of [doc:\/\/com.apple.carplay\/documentation\/CarPlay\/CPInformationItem] objects, and provide any contextual actions as an array of [doc:\/\/com.apple.carplay\/documentation\/CarPlay\/CPTextButton] objects. The template then arranges the list’s items using your choice of layout — see [doc:\/\/com.apple.carplay\/documentation\/CarPlay\/CPInformationTemplateLayout] for more information.\n\nTo display an information template, call your interface controller’s [doc:\/\/com.apple.carplay\/documentation\/CarPlay\/CPInterfaceController\/pushTemplate(_:animated:completion:)] method to push it onto the navigation hierarchy, or [doc:\/\/com.apple.carplay\/documentation\/CarPlay\/CPInterfaceController\/presentTemplate(_:animated:completion:)] to present it modally.",
  "platforms" : [
    "iOS",
    "Mac Catalyst"
  ],
  "rawMarkdown" : "---\nsource: https:\/\/developer.apple.com\/documentation\/CarPlay\/CPInformationTemplate\ncrawled: 2025-12-02T15:50:49Z\n---\n\n# CPInformationTemplate\n\n**Class**\n\nA template that provides information for a point of interest, food order, parking location, or charging location.\n\n## Declaration\n\n```swift\n@MainActor class CPInformationTemplate\n```\n\n## Overview\n\nAn information template displays a list of items, and up to three actions the user can perform.\n\nYou use an information template to display informative, actionable content to the user. For example, you might display a summary of the user’s food order, and provide actions to place or cancel the order.\n\nWhen creating an information template, you populate the list with an array of [doc:\/\/com.apple.carplay\/documentation\/CarPlay\/CPInformationItem] objects, and provide any contextual actions as an array of [doc:\/\/com.apple.carplay\/documentation\/CarPlay\/CPTextButton] objects. The template then arranges the list’s items using your choice of layout — see [doc:\/\/com.apple.carplay\/documentation\/CarPlay\/CPInformationTemplateLayout] for more information.\n\nTo display an information template, call your interface controller’s [doc:\/\/com.apple.carplay\/documentation\/CarPlay\/CPInterfaceController\/pushTemplate(_:animated:completion:)] method to push it onto the navigation hierarchy, or [doc:\/\/com.apple.carplay\/documentation\/CarPlay\/CPInterfaceController\/presentTemplate(_:animated:completion:)] to present it modally.\n\n\n\n## Creating an Information Template\n\n- **init(title:layout:items:actions:)**: Creates an information template that displays the provided items using the chosen layout.\n\n## Accessing the Layout\n\n- **layout**: The layout that the template uses to arrange its items.\n- **CPInformationTemplateLayout**: The layout that an information template uses to arrange its items.\n\n## Managing the Title\n\n- **title**: The template’s title.\n\n## Managing the Items\n\n- **items**: The items that the template displays.\n- **CPInformationItem**: A data object that provides content for an information template.\n- **CPInformationRatingItem**: A data object that provides rated content for an information template.\n\n## Managing the Actions\n\n- **actions**: The actions that the template displays.\n\n## Location and Information\n\n- **CPPointOfInterestTemplate**: A template that displays a map with selectable points of interest.\n- **CPTextButton**: A button that displays a stylized title.\n- **Integrating CarPlay with your quick-ordering app**: Configure your food-ordering app to work with CarPlay.\n\n## Inherits From\n\n- CPTemplate\n\n## Conforms To\n\n- CPBarButtonProviding\n- CVarArg\n- CustomDebugStringConvertible\n- CustomStringConvertible\n- Equatable\n- Hashable\n- NSCoding\n- NSObjectProtocol\n- NSSecureCoding\n- Sendable\n- SendableMetatype\n\n",
  "sections" : [
    {
      "content" : "",
      "items" : [
        {
          "description" : "Creates an information template that displays the provided items using the chosen layout.",
          "name" : "init(title:layout:items:actions:)",
          "url" : "https:\/\/developer.apple.com\/documentation\/CarPlay\/CPInformationTemplate\/init(title:layout:items:actions:)"
        }
      ],
      "title" : "Creating an Information Template"
    },
    {
      "content" : "",
      "items" : [
        {
          "description" : "The layout that the template uses to arrange its items.",
          "name" : "layout",
          "url" : "https:\/\/developer.apple.com\/documentation\/CarPlay\/CPInformationTemplate\/layout"
        },
        {
          "description" : "The layout that an information template uses to arrange its items.",
          "name" : "CPInformationTemplateLayout",
          "url" : "https:\/\/developer.apple.com\/documentation\/CarPlay\/CPInformationTemplateLayout"
        }
      ],
      "title" : "Accessing the Layout"
    },
    {
      "content" : "",
      "items" : [
        {
          "description" : "The template’s title.",
          "name" : "title",
          "url" : "https:\/\/developer.apple.com\/documentation\/CarPlay\/CPInformationTemplate\/title"
        }
      ],
      "title" : "Managing the Title"
    },
    {
      "content" : "",
      "items" : [
        {
          "description" : "The items that the template displays.",
          "name" : "items",
          "url" : "https:\/\/developer.apple.com\/documentation\/CarPlay\/CPInformationTemplate\/items"
        },
        {
          "description" : "A data object that provides content for an information template.",
          "name" : "CPInformationItem",
          "url" : "https:\/\/developer.apple.com\/documentation\/CarPlay\/CPInformationItem"
        },
        {
          "description" : "A data object that provides rated content for an information template.",
          "name" : "CPInformationRatingItem",
          "url" : "https:\/\/developer.apple.com\/documentation\/CarPlay\/CPInformationRatingItem"
        }
      ],
      "title" : "Managing the Items"
    },
    {
      "content" : "",
      "items" : [
        {
          "description" : "The actions that the template displays.",
          "name" : "actions",
          "url" : "https:\/\/developer.apple.com\/documentation\/CarPlay\/CPInformationTemplate\/actions"
        }
      ],
      "title" : "Managing the Actions"
    },
    {
      "content" : "",
      "items" : [
        {
          "description" : "A template that displays a map with selectable points of interest.",
          "name" : "CPPointOfInterestTemplate",
          "url" : "https:\/\/developer.apple.com\/documentation\/CarPlay\/CPPointOfInterestTemplate"
        },
        {
          "description" : "A button that displays a stylized title.",
          "name" : "CPTextButton",
          "url" : "https:\/\/developer.apple.com\/documentation\/CarPlay\/CPTextButton"
        },
        {
          "description" : "Configure your food-ordering app to work with CarPlay.",
          "name" : "Integrating CarPlay with your quick-ordering app",
          "url" : "https:\/\/developer.apple.com\/documentation\/CarPlay\/integrating-carplay-with-your-quick-ordering-app"
        }
      ],
      "title" : "Location and Information"
    },
    {
      "content" : "",
      "items" : [
        {
          "name" : "CPTemplate"
        }
      ],
      "title" : "Inherits From"
    }
  ],
  "source" : "appleJSON",
  "title" : "CPInformationTemplate",
  "url" : "https:\/\/developer.apple.com\/documentation\/CarPlay\/CPInformationTemplate"
}