{
  "abstract" : "Creates a Point of Interest template with a title, the points of interest to display, and the initial selection’s index.",
  "codeExamples" : [

  ],
  "contentHash" : "29272b309662ac804a984ae7590b833357988811bdc056b0ef3775915817c6ab",
  "crawledAt" : "2025-12-02T19:22:18Z",
  "declaration" : {
    "code" : "@MainActor init(title: String, pointsOfInterest: [CPPointOfInterest], selectedIndex: Int)",
    "language" : "swift"
  },
  "id" : "CC1E4047-9378-4DD8-B904-CED2383DBDC1",
  "kind" : "unknown",
  "language" : "swift",
  "module" : "CarPlay",
  "overview" : "## Discussion\n\n`pointsOfInterest` can contain a maximum of twelve points of interest because that is the most the template displays.",
  "platforms" : [
    "iOS",
    "Mac Catalyst"
  ],
  "rawMarkdown" : "---\nsource: https:\/\/developer.apple.com\/documentation\/CarPlay\/CPPointOfInterestTemplate\/init(title:pointsOfInterest:selectedIndex:)\ncrawled: 2025-12-02T19:22:18Z\n---\n\n# init(title:pointsOfInterest:selectedIndex:)\n\n**Initializer**\n\nCreates a Point of Interest template with a title, the points of interest to display, and the initial selection’s index.\n\n## Declaration\n\n```swift\n@MainActor init(title: String, pointsOfInterest: [CPPointOfInterest], selectedIndex: Int)\n```\n\n## Parameters\n\n- **title**: The scrollable picker’s title.\n- **pointsOfInterest**: An array that contains the points of interest the template displays.\n- **selectedIndex**: The initial selection’s index. This is the array’s index for the specific point of interest you want to select. Use [doc:\/\/com.apple.documentation\/documentation\/Foundation\/NSNotFound-4qp9h] to indicate no initial selection.\n\n## Discussion\n\n`pointsOfInterest` can contain a maximum of twelve points of interest because that is the most the template displays.\n\n## Creating a Point of Interest Template\n\n- **CPPointOfInterest**: An object that describes a point of interest on the template’s map and in its scrollable picker.\n\n",
  "sections" : [
    {
      "content" : "",
      "items" : [
        {
          "description" : "An object that describes a point of interest on the template’s map and in its scrollable picker.",
          "name" : "CPPointOfInterest",
          "url" : "https:\/\/developer.apple.com\/documentation\/CarPlay\/CPPointOfInterest"
        }
      ],
      "title" : "Creating a Point of Interest Template"
    }
  ],
  "source" : "appleJSON",
  "title" : "init(title:pointsOfInterest:selectedIndex:)",
  "url" : "https:\/\/developer.apple.com\/documentation\/CarPlay\/CPPointOfInterestTemplate\/init(title:pointsOfInterest:selectedIndex:)"
}