{
  "abstract" : "The window that belongs to the scene.",
  "codeExamples" : [

  ],
  "contentHash" : "e2d49e0636e0d6f51910d5cbdc4dd69f18bd9cbbe36de7ec45efc1878341efe8",
  "crawledAt" : "2025-12-06T07:04:53Z",
  "declaration" : {
    "code" : "@MainActor var carWindow: CPWindow { get }",
    "language" : "swift"
  },
  "id" : "88132A31-7363-4571-93B7-26FB8881016B",
  "kind" : "property",
  "language" : "swift",
  "module" : "CarPlay",
  "overview" : "## Discussion\n\nUse this property to access the window CarPlay creates for your scene. Only navigation apps have access to that window, and use it to draw their map content. All other categories of apps must use templates exclusively to draw their user interfaces.",
  "platforms" : [
    "iOS",
    "iPadOS",
    "Mac Catalyst"
  ],
  "rawMarkdown" : "---\nsource: https:\/\/developer.apple.com\/documentation\/CarPlay\/CPTemplateApplicationScene\/carWindow\ncrawled: 2025-12-06T07:04:53Z\n---\n\n# carWindow\n\n**Instance Property**\n\nThe window that belongs to the scene.\n\n## Declaration\n\n```swift\n@MainActor var carWindow: CPWindow { get }\n```\n\n## Discussion\n\nUse this property to access the window CarPlay creates for your scene. Only navigation apps have access to that window, and use it to draw their map content. All other categories of apps must use templates exclusively to draw their user interfaces.\n\n## Accessing the Window\n\n- **CPWindow**: A window that displays its content on the CarPlay screen.\n\n",
  "sections" : [
    {
      "content" : "",
      "items" : [
        {
          "description" : "A window that displays its content on the CarPlay screen.",
          "name" : "CPWindow",
          "url" : "https:\/\/developer.apple.com\/documentation\/CarPlay\/CPWindow"
        }
      ],
      "title" : "Accessing the Window"
    }
  ],
  "source" : "appleJSON",
  "title" : "carWindow",
  "url" : "https:\/\/developer.apple.com\/documentation\/CarPlay\/CPTemplateApplicationScene\/carWindow"
}