{
  "abstract" : "A selectable row in a list template.",
  "codeExamples" : [

  ],
  "conformsTo" : [
    "CPListTemplateItem",
    "CPSelectableListItem",
    "CVarArg",
    "CustomDebugStringConvertible",
    "CustomStringConvertible",
    "Equatable",
    "Hashable",
    "NSObjectProtocol",
    "Sendable"
  ],
  "contentHash" : "23b796f2f4f9c8e13082ab6ed19b4e786dadbab774004cce80b54d19446cb31e",
  "crawledAt" : "2025-12-06T07:00:42Z",
  "declaration" : {
    "code" : "@MainActor class CPListItem",
    "language" : "swift"
  },
  "id" : "81B054E8-BD7D-4EBE-9458-D3C26FC52A3F",
  "kind" : "class",
  "language" : "swift",
  "module" : "CarPlay",
  "overview" : "## Overview\n\nA list item manages the content of a single row in a list template. CarPlay manages the layout of a list item and may adjust its layout to allow for the display of auxiliary content, such as an accessory or a Now Playing indicator. A list item can display primary and secondary text and an image. It can also show an accessory or custom accessory image, and one of several indicators that the system provides.\n\nYou assign a [doc:\/\/com.apple.carplay\/documentation\/CarPlay\/CPListItem\/handler] to a list item that CarPlay executes when the user selects the item. The handler receives the item and a closure that you must call after you finish processing the selection.\n\nCarPlay doesn’t support custom list item types. Instead, use the [doc:\/\/com.apple.carplay\/documentation\/CarPlay\/CPListItem\/userInfo] property to attach a value to the list item that provides additional context, such as specifying  a model object that corresponds to the item.",
  "platforms" : [
    "iOS",
    "iPadOS",
    "Mac Catalyst"
  ],
  "rawMarkdown" : "---\nsource: https:\/\/developer.apple.com\/documentation\/CarPlay\/CPListItem\ncrawled: 2025-12-06T07:00:42Z\n---\n\n# CPListItem\n\n**Class**\n\nA selectable row in a list template.\n\n## Declaration\n\n```swift\n@MainActor class CPListItem\n```\n\n## Overview\n\nA list item manages the content of a single row in a list template. CarPlay manages the layout of a list item and may adjust its layout to allow for the display of auxiliary content, such as an accessory or a Now Playing indicator. A list item can display primary and secondary text and an image. It can also show an accessory or custom accessory image, and one of several indicators that the system provides.\n\nYou assign a [doc:\/\/com.apple.carplay\/documentation\/CarPlay\/CPListItem\/handler] to a list item that CarPlay executes when the user selects the item. The handler receives the item and a closure that you must call after you finish processing the selection.\n\nCarPlay doesn’t support custom list item types. Instead, use the [doc:\/\/com.apple.carplay\/documentation\/CarPlay\/CPListItem\/userInfo] property to attach a value to the list item that provides additional context, such as specifying  a model object that corresponds to the item.\n\n## Creating a List Item\n\n- **init(text:detailText:)**: Creates a list item with primary and secondary text.\n- **init(text:detailText:image:)**: Creates a list item with primary text, secondary text, and an image.\n- **init(text:detailText:image:accessoryImage:accessoryType:)**: Creates a list item that displays an accessory beside its content.\n\n## Managing Configuration\n\n- **isEnabled**: A Boolean value that indicates if the item is enabled.\n- **handler**: An optional closure that CarPlay invokes when the user selects the list item.\n- **userInfo**: An opaque value for the list item.\n\n## Managing Accessories\n\n- **accessoryType**: The accessory that the list item displays in its trailing region.\n- **CPListItemAccessoryType**: The accessory types that a list item can display.\n- **accessoryImage**: The image that the list item displays in its trailing region.\n- **setAccessoryImage(_:)**: Updates the list item’s accessory image.\n\n## Managing Content\n\n- **text**: The list item’s primary text.\n- **setText(_:)**: Updates the list item’s primary text.\n- **detailText**: The list item’s secondary text.\n- **setDetailText(_:)**: Updates the list item’s secondary text.\n- **image**: The image that the list item displays in its leading region.\n- **setImage(_:)**: Updates the list item’s image.\n- **maximumImageSize**: The maximum size of a list item’s image and accessory image.\n\n## Managing Playback Information\n\n- **isExplicitContent**: A Boolean value that determines whether the list item displays its explicit content indicator.\n- **isPlaying**: A Boolean value that determines whether the list item displays its Now Playing indicator.\n- **playingIndicatorLocation**: The location where the list item displays its Now Playing indicator.\n- **CPListItemPlayingIndicatorLocation**: The locations where a list item can display the Now Playing indicator.\n- **playbackProgress**: The playback progress status for the content that the list item represents.\n\n## Managing the Assistant Cell\n\n- **CPListItem.AssistantCellPosition**: Constants to specify the position of the assistant cell.\n- **CPListItem.AssistantCellVisibility**: Constants to specify the visibility of the assistant cell.\n\n## Deprecated\n\n- **Deprecated Symbols**: Review unsupported symbols and their replacements.\n\n## Creating a Section\n\n- **init(items:header:headerSubtitle:headerImage:headerButton:sectionIndexTitle:)**: Creates a section with list items, a header, a section index title, and section header details.\n- **CPListTemplateItem**: A description of the common properties of all list item types.\n- **CPSelectableListItem**: A description of a selectable list item.\n- **CPListImageRowItem**: A list template row that displays a series of images.\n- **CPMessageListItem**: A list template row that represents a conversation or contact.\n\n## Inherits From\n\n- NSObject\n\n## Conforms To\n\n- CPListTemplateItem\n- CPSelectableListItem\n- CVarArg\n- CustomDebugStringConvertible\n- CustomStringConvertible\n- Equatable\n- Hashable\n- NSObjectProtocol\n- Sendable\n\n",
  "sections" : [
    {
      "content" : "",
      "items" : [
        {
          "description" : "Creates a list item with primary and secondary text.",
          "name" : "init(text:detailText:)",
          "url" : "https:\/\/developer.apple.com\/documentation\/CarPlay\/CPListItem\/init(text:detailText:)"
        },
        {
          "description" : "Creates a list item with primary text, secondary text, and an image.",
          "name" : "init(text:detailText:image:)",
          "url" : "https:\/\/developer.apple.com\/documentation\/CarPlay\/CPListItem\/init(text:detailText:image:)"
        },
        {
          "description" : "Creates a list item that displays an accessory beside its content.",
          "name" : "init(text:detailText:image:accessoryImage:accessoryType:)",
          "url" : "https:\/\/developer.apple.com\/documentation\/CarPlay\/CPListItem\/init(text:detailText:image:accessoryImage:accessoryType:)"
        }
      ],
      "title" : "Creating a List Item"
    },
    {
      "content" : "",
      "items" : [
        {
          "description" : "A Boolean value that indicates if the item is enabled.",
          "name" : "isEnabled",
          "url" : "https:\/\/developer.apple.com\/documentation\/CarPlay\/CPListItem\/isEnabled"
        },
        {
          "description" : "An optional closure that CarPlay invokes when the user selects the list item.",
          "name" : "handler",
          "url" : "https:\/\/developer.apple.com\/documentation\/CarPlay\/CPListItem\/handler"
        },
        {
          "description" : "An opaque value for the list item.",
          "name" : "userInfo",
          "url" : "https:\/\/developer.apple.com\/documentation\/CarPlay\/CPListItem\/userInfo"
        }
      ],
      "title" : "Managing Configuration"
    },
    {
      "content" : "",
      "items" : [
        {
          "description" : "The accessory that the list item displays in its trailing region.",
          "name" : "accessoryType",
          "url" : "https:\/\/developer.apple.com\/documentation\/CarPlay\/CPListItem\/accessoryType"
        },
        {
          "description" : "The accessory types that a list item can display.",
          "name" : "CPListItemAccessoryType",
          "url" : "https:\/\/developer.apple.com\/documentation\/CarPlay\/CPListItemAccessoryType"
        },
        {
          "description" : "The image that the list item displays in its trailing region.",
          "name" : "accessoryImage",
          "url" : "https:\/\/developer.apple.com\/documentation\/CarPlay\/CPListItem\/accessoryImage"
        },
        {
          "description" : "Updates the list item’s accessory image.",
          "name" : "setAccessoryImage(_:)",
          "url" : "https:\/\/developer.apple.com\/documentation\/CarPlay\/CPListItem\/setAccessoryImage(_:)"
        }
      ],
      "title" : "Managing Accessories"
    },
    {
      "content" : "",
      "items" : [
        {
          "description" : "The list item’s primary text.",
          "name" : "text",
          "url" : "https:\/\/developer.apple.com\/documentation\/CarPlay\/CPListItem\/text"
        },
        {
          "description" : "Updates the list item’s primary text.",
          "name" : "setText(_:)",
          "url" : "https:\/\/developer.apple.com\/documentation\/CarPlay\/CPListItem\/setText(_:)"
        },
        {
          "description" : "The list item’s secondary text.",
          "name" : "detailText",
          "url" : "https:\/\/developer.apple.com\/documentation\/CarPlay\/CPListItem\/detailText"
        },
        {
          "description" : "Updates the list item’s secondary text.",
          "name" : "setDetailText(_:)",
          "url" : "https:\/\/developer.apple.com\/documentation\/CarPlay\/CPListItem\/setDetailText(_:)"
        },
        {
          "description" : "The image that the list item displays in its leading region.",
          "name" : "image",
          "url" : "https:\/\/developer.apple.com\/documentation\/CarPlay\/CPListItem\/image"
        },
        {
          "description" : "Updates the list item’s image.",
          "name" : "setImage(_:)",
          "url" : "https:\/\/developer.apple.com\/documentation\/CarPlay\/CPListItem\/setImage(_:)"
        },
        {
          "description" : "The maximum size of a list item’s image and accessory image.",
          "name" : "maximumImageSize",
          "url" : "https:\/\/developer.apple.com\/documentation\/CarPlay\/CPListItem\/maximumImageSize"
        }
      ],
      "title" : "Managing Content"
    },
    {
      "content" : "",
      "items" : [
        {
          "description" : "A Boolean value that determines whether the list item displays its explicit content indicator.",
          "name" : "isExplicitContent",
          "url" : "https:\/\/developer.apple.com\/documentation\/CarPlay\/CPListItem\/isExplicitContent"
        },
        {
          "description" : "A Boolean value that determines whether the list item displays its Now Playing indicator.",
          "name" : "isPlaying",
          "url" : "https:\/\/developer.apple.com\/documentation\/CarPlay\/CPListItem\/isPlaying"
        },
        {
          "description" : "The location where the list item displays its Now Playing indicator.",
          "name" : "playingIndicatorLocation",
          "url" : "https:\/\/developer.apple.com\/documentation\/CarPlay\/CPListItem\/playingIndicatorLocation"
        },
        {
          "description" : "The locations where a list item can display the Now Playing indicator.",
          "name" : "CPListItemPlayingIndicatorLocation",
          "url" : "https:\/\/developer.apple.com\/documentation\/CarPlay\/CPListItemPlayingIndicatorLocation"
        },
        {
          "description" : "The playback progress status for the content that the list item represents.",
          "name" : "playbackProgress",
          "url" : "https:\/\/developer.apple.com\/documentation\/CarPlay\/CPListItem\/playbackProgress"
        }
      ],
      "title" : "Managing Playback Information"
    },
    {
      "content" : "",
      "items" : [
        {
          "description" : "Constants to specify the position of the assistant cell.",
          "name" : "CPListItem.AssistantCellPosition",
          "url" : "https:\/\/developer.apple.com\/documentation\/CarPlay\/CPListItem\/AssistantCellPosition"
        },
        {
          "description" : "Constants to specify the visibility of the assistant cell.",
          "name" : "CPListItem.AssistantCellVisibility",
          "url" : "https:\/\/developer.apple.com\/documentation\/CarPlay\/CPListItem\/AssistantCellVisibility"
        }
      ],
      "title" : "Managing the Assistant Cell"
    },
    {
      "content" : "",
      "items" : [
        {
          "description" : "Review unsupported symbols and their replacements.",
          "name" : "Deprecated Symbols",
          "url" : "https:\/\/developer.apple.com\/documentation\/CarPlay\/cplistitem-deprecated-symbols"
        }
      ],
      "title" : "Deprecated"
    },
    {
      "content" : "",
      "items" : [
        {
          "description" : "Creates a section with list items, a header, a section index title, and section header details.",
          "name" : "init(items:header:headerSubtitle:headerImage:headerButton:sectionIndexTitle:)",
          "url" : "https:\/\/developer.apple.com\/documentation\/CarPlay\/CPListSection\/init(items:header:headerSubtitle:headerImage:headerButton:sectionIndexTitle:)"
        },
        {
          "description" : "A description of the common properties of all list item types.",
          "name" : "CPListTemplateItem",
          "url" : "https:\/\/developer.apple.com\/documentation\/CarPlay\/CPListTemplateItem"
        },
        {
          "description" : "A description of a selectable list item.",
          "name" : "CPSelectableListItem",
          "url" : "https:\/\/developer.apple.com\/documentation\/CarPlay\/CPSelectableListItem"
        },
        {
          "description" : "A list template row that displays a series of images.",
          "name" : "CPListImageRowItem",
          "url" : "https:\/\/developer.apple.com\/documentation\/CarPlay\/CPListImageRowItem"
        },
        {
          "description" : "A list template row that represents a conversation or contact.",
          "name" : "CPMessageListItem",
          "url" : "https:\/\/developer.apple.com\/documentation\/CarPlay\/CPMessageListItem"
        }
      ],
      "title" : "Creating a Section"
    },
    {
      "content" : "",
      "items" : [
        {
          "name" : "NSObject"
        }
      ],
      "title" : "Inherits From"
    }
  ],
  "source" : "appleJSON",
  "title" : "CPListItem",
  "url" : "https:\/\/developer.apple.com\/documentation\/CarPlay\/CPListItem"
}