{
  "abstract" : "Tells the delegate about the addition of a CarPlay scene to the app.",
  "codeExamples" : [

  ],
  "contentHash" : "279a16a273b7510827394c94b9d1a778d5b62d72b0818b0246ec7c3ec9934ee6",
  "crawledAt" : "2025-12-06T08:28:03Z",
  "declaration" : {
    "code" : "optional func templateApplicationScene(_ templateApplicationScene: CPTemplateApplicationScene, didConnect interfaceController: CPInterfaceController)",
    "language" : "swift"
  },
  "id" : "CF0D3958-3E26-47C3-AA4F-13FFB5DE7575",
  "kind" : "method",
  "language" : "swift",
  "module" : "CarPlay",
  "overview" : "## Discussion\n\nCarPlay calls this method when it launches your app and connects the scene. Use the interface controller to present your user interface templates. You must set the scene’s root template before returning from this method.",
  "platforms" : [
    "iOS",
    "iPadOS",
    "Mac Catalyst"
  ],
  "rawMarkdown" : "---\nsource: https:\/\/developer.apple.com\/documentation\/CarPlay\/CPTemplateApplicationSceneDelegate\/templateApplicationScene(_:didConnect:)\ncrawled: 2025-12-06T08:28:03Z\n---\n\n# templateApplicationScene(_:didConnect:)\n\n**Instance Method**\n\nTells the delegate about the addition of a CarPlay scene to the app.\n\n## Declaration\n\n```swift\noptional func templateApplicationScene(_ templateApplicationScene: CPTemplateApplicationScene, didConnect interfaceController: CPInterfaceController)\n```\n\n## Parameters\n\n- **templateApplicationScene**: The scene connecting to the app.\n- **interfaceController**: The interface controller for managing the user interface of this scene.\n\n## Discussion\n\nCarPlay calls this method when it launches your app and connects the scene. Use the interface controller to present your user interface templates. You must set the scene’s root template before returning from this method.\n\n\n\n## Responding to the Scene Life Cycle\n\n- **templateApplicationScene(_:didConnect:to:)**: Tells the delegate about the addition of a CarPlay scene to your navigation app.\n- **templateApplicationScene(_:didDisconnectInterfaceController:)**: Tells the delegate when CarPlay removes a scene from the app.\n- **templateApplicationScene(_:didDisconnect:from:)**: Tells the delegate when CarPlay removes a scene from your navigation app.\n\n",
  "sections" : [
    {
      "content" : "",
      "items" : [
        {
          "description" : "Tells the delegate about the addition of a CarPlay scene to your navigation app.",
          "name" : "templateApplicationScene(_:didConnect:to:)",
          "url" : "https:\/\/developer.apple.com\/documentation\/CarPlay\/CPTemplateApplicationSceneDelegate\/templateApplicationScene(_:didConnect:to:)"
        },
        {
          "description" : "Tells the delegate when CarPlay removes a scene from the app.",
          "name" : "templateApplicationScene(_:didDisconnectInterfaceController:)",
          "url" : "https:\/\/developer.apple.com\/documentation\/CarPlay\/CPTemplateApplicationSceneDelegate\/templateApplicationScene(_:didDisconnectInterfaceController:)"
        },
        {
          "description" : "Tells the delegate when CarPlay removes a scene from your navigation app.",
          "name" : "templateApplicationScene(_:didDisconnect:from:)",
          "url" : "https:\/\/developer.apple.com\/documentation\/CarPlay\/CPTemplateApplicationSceneDelegate\/templateApplicationScene(_:didDisconnect:from:)"
        }
      ],
      "title" : "Responding to the Scene Life Cycle"
    }
  ],
  "source" : "appleJSON",
  "title" : "templateApplicationScene(_:didConnect:)",
  "url" : "https:\/\/developer.apple.com\/documentation\/CarPlay\/CPTemplateApplicationSceneDelegate\/templateApplicationScene(_:didConnect:)"
}