{
  "abstract" : "Dismisses the panning interface.",
  "codeExamples" : [

  ],
  "contentHash" : "2ecf6a522fed8557eb6828c318e1035fe2aa80923ed5f9d3911ac51c4dd568e0",
  "crawledAt" : "2025-11-30T23:06:21Z",
  "declaration" : {
    "code" : "@MainActor func dismissPanningInterface(animated: Bool)",
    "language" : "swift"
  },
  "id" : "FEF43C3B-B6C8-42C0-BADA-F403A4E4617F",
  "kind" : "method",
  "module" : "CarPlay",
  "overview" : "## Discussion\n\nWhen dismissing the panning interface, the system shows the previously hidden map buttons.",
  "platforms" : [
    "iOS",
    "Mac Catalyst"
  ],
  "rawMarkdown" : "---\nsource: https:\/\/developer.apple.com\/documentation\/CarPlay\/CPMapTemplate\/dismissPanningInterface(animated:)\ncrawled: 2025-11-30T23:06:21Z\n---\n\n# dismissPanningInterface(animated:)\n\n**Instance Method**\n\nDismisses the panning interface.\n\n## Declaration\n\n```swift\n@MainActor func dismissPanningInterface(animated: Bool)\n```\n\n## Parameters\n\n- **animated**: A Boolean value that determines whether to animate the dismissal of the panning interface. Set to [doc:\/\/com.apple.documentation\/documentation\/Swift\/true] to animate the dismissal.\n\n## Discussion\n\nWhen dismissing the panning interface, the system shows the previously hidden map buttons.\n\n## Panning the Map\n\n- **showPanningInterface(animated:)**: Shows the panning interface on the map.\n- **isPanningInterfaceVisible**: A Boolean value that indicates whether the map template is displaying the panning interface.\n\n",
  "sections" : [
    {
      "content" : "",
      "items" : [
        {
          "description" : "Shows the panning interface on the map.",
          "name" : "showPanningInterface(animated:)",
          "url" : "https:\/\/developer.apple.com\/documentation\/CarPlay\/CPMapTemplate\/showPanningInterface(animated:)"
        },
        {
          "description" : "A Boolean value that indicates whether the map template is displaying the panning interface.",
          "name" : "isPanningInterfaceVisible",
          "url" : "https:\/\/developer.apple.com\/documentation\/CarPlay\/CPMapTemplate\/isPanningInterfaceVisible"
        }
      ],
      "title" : "Panning the Map"
    }
  ],
  "source" : "appleJSON",
  "title" : "dismissPanningInterface(animated:)",
  "url" : "https:\/\/developer.apple.com\/documentation\/CarPlay\/CPMapTemplate\/dismissPanningInterface(animated:)"
}