{
  "abstract" : "The maximum number of items, across all sections, that the template can display.",
  "codeExamples" : [

  ],
  "contentHash" : "d2ce36b4a0fe17784829ec438b7c3c0866577e61c1a3a2df55e2abef715371db",
  "crawledAt" : "2025-12-04T21:43:13Z",
  "declaration" : {
    "code" : "@MainActor class var maximumItemCount: Int { get }",
    "language" : "swift"
  },
  "id" : "F9CBE375-30C0-4431-B821-651D6369EEEC",
  "kind" : "property",
  "language" : "swift",
  "module" : "CarPlay",
  "overview" : "## Discussion\n\nThis property’s value is dependent on any user interface limits that the vehicle imposes. See [doc:\/\/com.apple.carplay\/documentation\/CarPlay\/CPSessionConfiguration] for more information. At runtime, use this value to determine the maximum number of items, across all sections, that your list can display.",
  "platforms" : [
    "iOS",
    "iPadOS",
    "Mac Catalyst"
  ],
  "rawMarkdown" : "---\nsource: https:\/\/developer.apple.com\/documentation\/CarPlay\/CPListTemplate\/maximumItemCount\ncrawled: 2025-12-04T21:43:13Z\n---\n\n# maximumItemCount\n\n**Type Property**\n\nThe maximum number of items, across all sections, that the template can display.\n\n## Declaration\n\n```swift\n@MainActor class var maximumItemCount: Int { get }\n```\n\n## Discussion\n\nThis property’s value is dependent on any user interface limits that the vehicle imposes. See [doc:\/\/com.apple.carplay\/documentation\/CarPlay\/CPSessionConfiguration] for more information. At runtime, use this value to determine the maximum number of items, across all sections, that your list can display.\n\n## Getting Supplementary Information\n\n- **itemCount**: The total number of items, across all sections, in the list.\n- **indexPath(for:)**: Returns the index path for the specified item.\n- **title**: The title that the navigation bar displays when the template is visible.\n\n",
  "sections" : [
    {
      "content" : "",
      "items" : [
        {
          "description" : "The total number of items, across all sections, in the list.",
          "name" : "itemCount",
          "url" : "https:\/\/developer.apple.com\/documentation\/CarPlay\/CPListTemplate\/itemCount"
        },
        {
          "description" : "Returns the index path for the specified item.",
          "name" : "indexPath(for:)",
          "url" : "https:\/\/developer.apple.com\/documentation\/CarPlay\/CPListTemplate\/indexPath(for:)"
        },
        {
          "description" : "The title that the navigation bar displays when the template is visible.",
          "name" : "title",
          "url" : "https:\/\/developer.apple.com\/documentation\/CarPlay\/CPListTemplate\/title"
        }
      ],
      "title" : "Getting Supplementary Information"
    }
  ],
  "source" : "appleJSON",
  "title" : "maximumItemCount",
  "url" : "https:\/\/developer.apple.com\/documentation\/CarPlay\/CPListTemplate\/maximumItemCount"
}