{
  "abstract" : "Tells the navigation session to pause the trip for the specified reason.",
  "codeExamples" : [

  ],
  "contentHash" : "f7eaf31feb522ddc89da4a4a0361688092dddef91905adeea63d5029556ef6f2",
  "crawledAt" : "2025-12-04T20:14:32Z",
  "declaration" : {
    "code" : "@MainActor func pauseTrip(for reason: CPNavigationSession.PauseReason, description: String?)",
    "language" : "swift"
  },
  "id" : "5C0DCF8F-5D8F-49EE-9E50-B64CCFD24BD7",
  "kind" : "method",
  "language" : "swift",
  "module" : "CarPlay",
  "platforms" : [
    "iOS",
    "iPadOS",
    "Mac Catalyst"
  ],
  "rawMarkdown" : "---\nsource: https:\/\/developer.apple.com\/documentation\/carplay\/cpnavigationsession\/pausetrip(for:description:)\ncrawled: 2025-12-04T20:14:32Z\n---\n\n# pauseTrip(for:description:)\n\n**Instance Method**\n\nTells the navigation session to pause the trip for the specified reason.\n\n## Declaration\n\n```swift\n@MainActor func pauseTrip(for reason: CPNavigationSession.PauseReason, description: String?)\n```\n\n## Parameters\n\n- **reason**: The reason for pausing the trip.\n- **description**: An optional description of the pause reason. To use a system-provided value, set this parameter to `nil`.\n\n## Managing Trip Navigation\n\n- **cancelTrip()**: Tells the navigation session to cancel the trip.\n- **finishTrip()**: Tells the navigation session to finish the trip.\n- **pauseTrip(for:description:turnCardColor:)**\n- **CPNavigationSession.PauseReason**: A set of reasons for pausing a trip.\n- **resumeTrip(updatedRouteInformation:)**: Resumes the current trip with updated route information.\n\n",
  "sections" : [
    {
      "content" : "",
      "items" : [
        {
          "description" : "Tells the navigation session to cancel the trip.",
          "name" : "cancelTrip()",
          "url" : "https:\/\/developer.apple.com\/documentation\/CarPlay\/CPNavigationSession\/cancelTrip()"
        },
        {
          "description" : "Tells the navigation session to finish the trip.",
          "name" : "finishTrip()",
          "url" : "https:\/\/developer.apple.com\/documentation\/CarPlay\/CPNavigationSession\/finishTrip()"
        },
        {
          "description" : "",
          "name" : "pauseTrip(for:description:turnCardColor:)",
          "url" : "https:\/\/developer.apple.com\/documentation\/CarPlay\/CPNavigationSession\/pauseTrip(for:description:turnCardColor:)"
        },
        {
          "description" : "A set of reasons for pausing a trip.",
          "name" : "CPNavigationSession.PauseReason",
          "url" : "https:\/\/developer.apple.com\/documentation\/CarPlay\/CPNavigationSession\/PauseReason"
        },
        {
          "description" : "Resumes the current trip with updated route information.",
          "name" : "resumeTrip(updatedRouteInformation:)",
          "url" : "https:\/\/developer.apple.com\/documentation\/CarPlay\/CPNavigationSession\/resumeTrip(updatedRouteInformation:)"
        }
      ],
      "title" : "Managing Trip Navigation"
    }
  ],
  "source" : "appleJSON",
  "title" : "pauseTrip(for:description:)",
  "url" : "https:\/\/developer.apple.com\/documentation\/carplay\/cpnavigationsession\/pausetrip(for:description:)"
}