{
  "abstract" : "An array of title variants for the template’s empty view.",
  "codeExamples" : [

  ],
  "contentHash" : "57697b3ee16ef42fb3ef77cf835c7b900c468851000f394ec238b05885c9014d",
  "crawledAt" : "2025-12-04T20:13:01Z",
  "declaration" : {
    "code" : "@MainActor var emptyViewTitleVariants: [String] { get set }",
    "language" : "swift"
  },
  "id" : "74EBC261-669A-46AB-BC5D-25A7CE68595F",
  "kind" : "property",
  "language" : "swift",
  "module" : "CarPlay",
  "overview" : "## Discussion\n\nWhen the list contains zero items, the template displays an empty view with a title and a subtitle. The template removes the empty view if you update the list and provide items.\n\nProvide at least one nonzero length title variant. The view displays the first title variant that fits into the available screen space, so arrange your variants array from most- to least-preferred. Provide the strings as localized displayable content.",
  "platforms" : [
    "iOS",
    "iPadOS",
    "Mac Catalyst"
  ],
  "rawMarkdown" : "---\nsource: https:\/\/developer.apple.com\/documentation\/CarPlay\/CPListTemplate\/emptyViewTitleVariants\ncrawled: 2025-12-04T20:13:01Z\n---\n\n# emptyViewTitleVariants\n\n**Instance Property**\n\nAn array of title variants for the template’s empty view.\n\n## Declaration\n\n```swift\n@MainActor var emptyViewTitleVariants: [String] { get set }\n```\n\n## Discussion\n\nWhen the list contains zero items, the template displays an empty view with a title and a subtitle. The template removes the empty view if you update the list and provide items.\n\nProvide at least one nonzero length title variant. The view displays the first title variant that fits into the available screen space, so arrange your variants array from most- to least-preferred. Provide the strings as localized displayable content.\n\n## Managing an Empty List\n\n- **emptyViewSubtitleVariants**: An array of subtitle variants for the template’s empty view.\n\n",
  "sections" : [
    {
      "content" : "",
      "items" : [
        {
          "description" : "An array of subtitle variants for the template’s empty view.",
          "name" : "emptyViewSubtitleVariants",
          "url" : "https:\/\/developer.apple.com\/documentation\/CarPlay\/CPListTemplate\/emptyViewSubtitleVariants"
        }
      ],
      "title" : "Managing an Empty List"
    }
  ],
  "source" : "appleJSON",
  "title" : "emptyViewTitleVariants",
  "url" : "https:\/\/developer.apple.com\/documentation\/CarPlay\/CPListTemplate\/emptyViewTitleVariants"
}