{
  "abstract" : "Learn about the available third-party network debugging tools.",
  "codeExamples" : [

  ],
  "contentHash" : "8da7b60ddac6342465ec0ba5458563138c072562d424e815d12029228590468b",
  "crawledAt" : "2025-12-06T12:59:24Z",
  "id" : "42F175B8-7112-40C4-BFF9-71E026F90EC3",
  "kind" : "article",
  "language" : "swift",
  "module" : "Network",
  "overview" : "## Overview\n\niOS and macOS have built-in network debugging tools (see [doc:\/\/com.apple.documentation\/documentation\/Foundation\/analyzing-http-traffic-with-instruments] and [doc:\/\/com.apple.network\/documentation\/Network\/choosing-a-network-debugging-tool]), but you may also want to take advantage of the third-party tools discussed here.\n\n### Debugging HTTP Proxies\n\n### macOS Apps\n\n### Command-Line Tools",
  "rawMarkdown" : "---\nsource: https:\/\/developer.apple.com\/documentation\/Network\/taking-advantage-of-third-party-network-debugging-tools\ncrawled: 2025-12-06T12:59:24Z\n---\n\n# Taking Advantage of Third-Party Network Debugging Tools\n\n**Article**\n\nLearn about the available third-party network debugging tools.\n\n## Overview\n\niOS and macOS have built-in network debugging tools (see [doc:\/\/com.apple.documentation\/documentation\/Foundation\/analyzing-http-traffic-with-instruments] and [doc:\/\/com.apple.network\/documentation\/Network\/choosing-a-network-debugging-tool]), but you may also want to take advantage of the third-party tools discussed here.\n\n\n\n### Debugging HTTP Proxies\n\n\n\n### macOS Apps\n\n\n\n### Command-Line Tools\n\n\n\n## Network Debugging\n\n- **Choosing a Network Debugging Tool**: Decide which tool works best for your network debugging problem.\n- **Debugging HTTP Server-Side Errors**: Understand HTTP server-side errors and how to debug them.\n- **Debugging HTTPS Problems with CFNetwork Diagnostic Logging**: Use CFNetwork diagnostic logging to investigate HTTP and HTTPS problems.\n- **Recording a Packet Trace**: Learn how to record a low-level trace of network traffic.\n- **Testing and Debugging L4S in Your App**: Learn how to verify your app on an L4S-capable host and network to improve your app’s responsiveness.\n\n",
  "sections" : [
    {
      "content" : "",
      "items" : [
        {
          "description" : "Decide which tool works best for your network debugging problem.",
          "name" : "Choosing a Network Debugging Tool",
          "url" : "https:\/\/developer.apple.com\/documentation\/Network\/choosing-a-network-debugging-tool"
        },
        {
          "description" : "Understand HTTP server-side errors and how to debug them.",
          "name" : "Debugging HTTP Server-Side Errors",
          "url" : "https:\/\/developer.apple.com\/documentation\/Network\/debugging-http-server-side-errors"
        },
        {
          "description" : "Use CFNetwork diagnostic logging to investigate HTTP and HTTPS problems.",
          "name" : "Debugging HTTPS Problems with CFNetwork Diagnostic Logging",
          "url" : "https:\/\/developer.apple.com\/documentation\/Network\/debugging-https-problems-with-cfnetwork-diagnostic-logging"
        },
        {
          "description" : "Learn how to record a low-level trace of network traffic.",
          "name" : "Recording a Packet Trace",
          "url" : "https:\/\/developer.apple.com\/documentation\/Network\/recording-a-packet-trace"
        },
        {
          "description" : "Learn how to verify your app on an L4S-capable host and network to improve your app’s responsiveness.",
          "name" : "Testing and Debugging L4S in Your App",
          "url" : "https:\/\/developer.apple.com\/documentation\/Network\/testing-and-debugging-l4s-in-your-app"
        }
      ],
      "title" : "Network Debugging"
    }
  ],
  "source" : "appleJSON",
  "title" : "Taking Advantage of Third-Party Network Debugging Tools",
  "url" : "https:\/\/developer.apple.com\/documentation\/Network\/taking-advantage-of-third-party-network-debugging-tools"
}