{
  "abstract" : "Read information about artifacts Xcode Cloud creates when it performs a build.",
  "codeExamples" : [

  ],
  "contentHash" : "6a42ca71802ffdf215018f6f3494a6ce3ceae278825cb836b9c72d1964c09a71",
  "crawledAt" : "2025-12-04T02:29:05Z",
  "id" : "D1FBB971-6278-4F15-B3CA-765813207FC4",
  "kind" : "collection",
  "language" : "data",
  "module" : "App Store Connect API",
  "overview" : "## Overview\n\nThe `ciArtifacts` resource represents an artifact that Xcode Cloud creates when it performs a workflow’s action. Use it to access the artifact’s:\n\nUse the provided information to create statistics for the artifacts Xcode Cloud creates or archive Xcode Cloud build artifacts on your own server.",
  "rawMarkdown" : "---\nsource: https:\/\/developer.apple.com\/documentation\/AppStoreConnectAPI\/artifacts\ncrawled: 2025-12-04T02:29:05Z\n---\n\n# Artifacts\n\n**API Collection**\n\nRead information about artifacts Xcode Cloud creates when it performs a build.\n\n## Overview\n\nThe `ciArtifacts` resource represents an artifact that Xcode Cloud creates when it performs a workflow’s action. Use it to access the artifact’s:\n\n- Download URL\n- Filename\n- File size\n- Type\n\nUse the provided information to create statistics for the artifacts Xcode Cloud creates or archive Xcode Cloud build artifacts on your own server.\n\n\n\n## Getting Build Artifact Information\n\n- **Read Xcode Cloud Artifact Information**: Get information about the artifact Xcode Cloud created for a specific action when it performed a build.\n\n## Objects\n\n- **CiArtifact**: The data structure that represents the output of an Xcode Cloud build action resource.\n- **CiArtifactResponse**: A response that contains a single Artifacts resource.\n\n## Build Information\n\n- **Build Runs**: Read detailed build information and start new builds.\n- **Build Actions**: Read information about actions you configured for an Xcode Cloud workflow and their related data such as artifacts, issues, or test results.\n- **Issues**: Read information about issues that occurred when Xcode Cloud performs a build.\n- **Test Results**: Read test results for test actions Xcode Cloud performs.\n\n",
  "sections" : [
    {
      "content" : "",
      "items" : [
        {
          "description" : "Get information about the artifact Xcode Cloud created for a specific action when it performed a build.",
          "name" : "Read Xcode Cloud Artifact Information",
          "url" : "https:\/\/developer.apple.com\/documentation\/AppStoreConnectAPI\/GET-v1-ciArtifacts-_id_"
        }
      ],
      "title" : "Getting Build Artifact Information"
    },
    {
      "content" : "",
      "items" : [
        {
          "description" : "The data structure that represents the output of an Xcode Cloud build action resource.",
          "name" : "CiArtifact",
          "url" : "https:\/\/developer.apple.com\/documentation\/AppStoreConnectAPI\/CiArtifact"
        },
        {
          "description" : "A response that contains a single Artifacts resource.",
          "name" : "CiArtifactResponse",
          "url" : "https:\/\/developer.apple.com\/documentation\/AppStoreConnectAPI\/CiArtifactResponse"
        }
      ],
      "title" : "Objects"
    },
    {
      "content" : "",
      "items" : [
        {
          "description" : "Read detailed build information and start new builds.",
          "name" : "Build Runs",
          "url" : "https:\/\/developer.apple.com\/documentation\/AppStoreConnectAPI\/build-runs"
        },
        {
          "description" : "Read information about actions you configured for an Xcode Cloud workflow and their related data such as artifacts, issues, or test results.",
          "name" : "Build Actions",
          "url" : "https:\/\/developer.apple.com\/documentation\/AppStoreConnectAPI\/build-actions"
        },
        {
          "description" : "Read information about issues that occurred when Xcode Cloud performs a build.",
          "name" : "Issues",
          "url" : "https:\/\/developer.apple.com\/documentation\/AppStoreConnectAPI\/issues"
        },
        {
          "description" : "Read test results for test actions Xcode Cloud performs.",
          "name" : "Test Results",
          "url" : "https:\/\/developer.apple.com\/documentation\/AppStoreConnectAPI\/test-results"
        }
      ],
      "title" : "Build Information"
    }
  ],
  "source" : "appleJSON",
  "title" : "Artifacts",
  "url" : "https:\/\/developer.apple.com\/documentation\/AppStoreConnectAPI\/artifacts"
}