{
  "abstract" : "Optimize your app’s user experience by adding localized metadata with App Store Connect API.",
  "codeExamples" : [

  ],
  "contentHash" : "e1efb2ab79631adfe4dda39bf5145fcf2ef15b1d4d6fce35391fe56db72015b2",
  "crawledAt" : "2025-12-07T18:36:29Z",
  "id" : "A4031E35-0071-4E23-93CF-03E89A09B0B5",
  "kind" : "article",
  "language" : "data",
  "module" : "App Store Connect API",
  "overview" : "## Overview\n\nThe App Store is available in 175 regions and 39 languages to make it easy for users around the world to discover and download your app. Localizing your app helps make it relevant to a variety of cultures and languages, and provides an opportunity to grow your business. Use these locale short codes to manage localized metadata with App Store Connect API.\n\nThis table describes the localized languages and locale shortcode you use in App Store Connect API when you configure metadata.",
  "rawMarkdown" : "---\nsource: https:\/\/developer.apple.com\/documentation\/AppStoreConnectAPI\/managing-metadata-in-your-app-by-using-locale-shortcodes\ncrawled: 2025-12-07T18:36:29Z\n---\n\n# Managing metadata in your app by using locale shortcodes\n\n**Article**\n\nOptimize your app’s user experience by adding localized metadata with App Store Connect API.\n\n## Overview\n\nThe App Store is available in 175 regions and 39 languages to make it easy for users around the world to discover and download your app. Localizing your app helps make it relevant to a variety of cultures and languages, and provides an opportunity to grow your business. Use these locale short codes to manage localized metadata with App Store Connect API.\n\nThis table describes the localized languages and locale shortcode you use in App Store Connect API when you configure metadata.\n\n\n\n",
  "sections" : [

  ],
  "source" : "appleJSON",
  "title" : "Managing metadata in your app by using locale shortcodes",
  "url" : "https:\/\/developer.apple.com\/documentation\/AppStoreConnectAPI\/managing-metadata-in-your-app-by-using-locale-shortcodes"
}