{
  "abstract" : "Submit versions of your app to App Review.",
  "codeExamples" : [

  ],
  "contentHash" : "bcdc311c2e928ab6996fd973a3749910deca1e59e63130aa764cc0b4eaf7151a",
  "crawledAt" : "2025-12-04T09:21:06Z",
  "id" : "1EA5B881-5B78-49A7-B906-49B8CF40E09E",
  "kind" : "collection",
  "language" : "data",
  "module" : "App Store Connect API",
  "overview" : "## Overview\n\nAn `appStoreVersionSubmissions` resource enables you to submit a version of your app to App Review. This resource is the equivalent of clicking the Submit for Review button in the App Store Connect UI.\n\nIf your version submission is incomplete due to missing required information or other issues, you receive an error when you attempt to submit to App Review.\n\nThe `appStoreVersionSubmissions` resource is available while your submission request is live. For more information, see [https:\/\/developer.apple.com\/help\/app-store-connect\/manage-submissions-to-app-review\/submit-for-review].",
  "rawMarkdown" : "---\nsource: https:\/\/developer.apple.com\/documentation\/AppStoreConnectAPI\/app-store-version-submissions\ncrawled: 2025-12-04T09:21:06Z\n---\n\n# App Store version submissions\n\n**API Collection**\n\nSubmit versions of your app to App Review.\n\n## Overview\n\nAn `appStoreVersionSubmissions` resource enables you to submit a version of your app to App Review. This resource is the equivalent of clicking the Submit for Review button in the App Store Connect UI.\n\nIf your version submission is incomplete due to missing required information or other issues, you receive an error when you attempt to submit to App Review.\n\nThe `appStoreVersionSubmissions` resource is available while your submission request is live. For more information, see [https:\/\/developer.apple.com\/help\/app-store-connect\/manage-submissions-to-app-review\/submit-for-review].\n\n## Managing Review Submissions\n\n- **Delete an App Store Version Submission**: Remove a version from App Store review.\n\n## Objects\n\n- **AppStoreVersionSubmission**: The data structure that represents an App Store Version Submissions resource.\n- **AppStoreVersionSubmissionResponse**: A response that contains a single App Store Version Submissions resource.\n\n## App Store Review Submissions\n\n- **Review submissions**: Create and manage your submissions for review, which can include your App Store version, App Store version experiments, custom product page versions, and in-app events.\n- **Review submission items**: Manage the contents of your review submission, which can include your App Store version, App Store version experiments, custom product page versions, and in-app events.\n- **App Store review details**: Manage the required information you provide for App Review.\n- **App Clip App Store review details**: Manage required App Clip information you provide for App Review.\n- **App Store review attachments**: Manage the attachments you upload to App Store Connect for App Review.\n- **Actors**: Get information about who or which service made a review submission.\n\n",
  "sections" : [
    {
      "content" : "",
      "items" : [
        {
          "description" : "Remove a version from App Store review.",
          "name" : "Delete an App Store Version Submission",
          "url" : "https:\/\/developer.apple.com\/documentation\/AppStoreConnectAPI\/DELETE-v1-appStoreVersionSubmissions-_id_"
        }
      ],
      "title" : "Managing Review Submissions"
    },
    {
      "content" : "",
      "items" : [
        {
          "description" : "The data structure that represents an App Store Version Submissions resource.",
          "name" : "AppStoreVersionSubmission",
          "url" : "https:\/\/developer.apple.com\/documentation\/AppStoreConnectAPI\/AppStoreVersionSubmission"
        },
        {
          "description" : "A response that contains a single App Store Version Submissions resource.",
          "name" : "AppStoreVersionSubmissionResponse",
          "url" : "https:\/\/developer.apple.com\/documentation\/AppStoreConnectAPI\/AppStoreVersionSubmissionResponse"
        }
      ],
      "title" : "Objects"
    },
    {
      "content" : "",
      "items" : [
        {
          "description" : "Create and manage your submissions for review, which can include your App Store version, App Store version experiments, custom product page versions, and in-app events.",
          "name" : "Review submissions",
          "url" : "https:\/\/developer.apple.com\/documentation\/AppStoreConnectAPI\/review-submissions"
        },
        {
          "description" : "Manage the contents of your review submission, which can include your App Store version, App Store version experiments, custom product page versions, and in-app events.",
          "name" : "Review submission items",
          "url" : "https:\/\/developer.apple.com\/documentation\/AppStoreConnectAPI\/review-submission-items"
        },
        {
          "description" : "Manage the required information you provide for App Review.",
          "name" : "App Store review details",
          "url" : "https:\/\/developer.apple.com\/documentation\/AppStoreConnectAPI\/app-store-review-details"
        },
        {
          "description" : "Manage required App Clip information you provide for App Review.",
          "name" : "App Clip App Store review details",
          "url" : "https:\/\/developer.apple.com\/documentation\/AppStoreConnectAPI\/app-clip-app-store-review-details"
        },
        {
          "description" : "Manage the attachments you upload to App Store Connect for App Review.",
          "name" : "App Store review attachments",
          "url" : "https:\/\/developer.apple.com\/documentation\/AppStoreConnectAPI\/app-store-review-attachments"
        },
        {
          "description" : "Get information about who or which service made a review submission.",
          "name" : "Actors",
          "url" : "https:\/\/developer.apple.com\/documentation\/AppStoreConnectAPI\/actors"
        }
      ],
      "title" : "App Store Review Submissions"
    }
  ],
  "source" : "appleJSON",
  "title" : "App Store version submissions",
  "url" : "https:\/\/developer.apple.com\/documentation\/AppStoreConnectAPI\/app-store-version-submissions"
}