{
  "abstract" : "Add a new leaderboard localization.",
  "codeExamples" : [

  ],
  "contentHash" : "4c29950aff7e8b805fdd3e0e76b22db08a8eb4e6d45a352b93ce6fe1e87223bf",
  "crawledAt" : "2025-12-06T10:01:35Z",
  "id" : "6E618410-CF38-43CA-A7E6-219746A33D4C",
  "kind" : "unknown",
  "language" : "data",
  "module" : "App Store Connect API",
  "overview" : "## Discussion\n\nUse leaderboard formatters to specify the unit of measurement for a Game Center leaderboard. There is a new required attribute `defaultFormatter` when you use [doc:\/\/com.apple.appstoreconnectapi\/documentation\/AppStoreConnectAPI\/POST-v1-gameCenterLeaderboards], which gives all your localizations the same formatter. You can also optionally use `formatterOverride` to override a specific leaderboard localization when calling [doc:\/\/com.apple.appstoreconnectapi\/documentation\/AppStoreConnectAPI\/POST-v1-gameCenterLeaderboardLocalizations] or [doc:\/\/com.apple.appstoreconnectapi\/documentation\/AppStoreConnectAPI\/PATCH-v1-gameCenterLeaderboardLocalizations-_id_].\n\nBefore App Store Connect API version 3.0, formatters were based on localizations and were required for each localization. Legacy leaderboards created before the new addition of the Game Center APIs will not have a `defaultFormatter` value, the value would be `null` in this case. Any localizations created before the new addition of the Game Center APIs will always have a `formatterOverride`.\n\n### Example Request and Response",
  "rawMarkdown" : "---\nsource: https:\/\/developer.apple.com\/documentation\/appstoreconnectapi\/post-v1-gamecenterleaderboardlocalizations\ncrawled: 2025-12-06T10:01:35Z\n---\n\n# Create a leaderboard localization\n\n**Web Service Endpoint**\n\nAdd a new leaderboard localization.\n\n## Discussion\n\nUse leaderboard formatters to specify the unit of measurement for a Game Center leaderboard. There is a new required attribute `defaultFormatter` when you use [doc:\/\/com.apple.appstoreconnectapi\/documentation\/AppStoreConnectAPI\/POST-v1-gameCenterLeaderboards], which gives all your localizations the same formatter. You can also optionally use `formatterOverride` to override a specific leaderboard localization when calling [doc:\/\/com.apple.appstoreconnectapi\/documentation\/AppStoreConnectAPI\/POST-v1-gameCenterLeaderboardLocalizations] or [doc:\/\/com.apple.appstoreconnectapi\/documentation\/AppStoreConnectAPI\/PATCH-v1-gameCenterLeaderboardLocalizations-_id_].\n\nBefore App Store Connect API version 3.0, formatters were based on localizations and were required for each localization. Legacy leaderboards created before the new addition of the Game Center APIs will not have a `defaultFormatter` value, the value would be `null` in this case. Any localizations created before the new addition of the Game Center APIs will always have a `formatterOverride`.\n\n### Example Request and Response\n\n\n\n## Managing leaderboard localizations\n\n- **List all localizations for a leaderboard**: Get a list of localized metadata for a leaderboard.\n- **GET \/v1\/gameCenterLeaderboards\/{id}\/relationships\/localizations**\n- **Read leaderboard localization information**: Get information about a leaderboard localization.\n- **Read the image for a leaderboard localization**: Get information about the image associated with a leaderboard localization.\n- **GET \/v1\/gameCenterLeaderboardLocalizations\/{id}\/relationships\/gameCenterLeaderboardImage**\n- **Modify a leaderboard localization**: Edit a leaderboard localization.\n- **Delete a leaderboard localization**: Delete a localization that’s associated with a leaderboard.\n\n",
  "sections" : [
    {
      "content" : "",
      "items" : [
        {
          "description" : "Get a list of localized metadata for a leaderboard.",
          "name" : "List all localizations for a leaderboard",
          "url" : "https:\/\/developer.apple.com\/documentation\/AppStoreConnectAPI\/GET-v1-gameCenterLeaderboards-_id_-localizations"
        },
        {
          "description" : "",
          "name" : "GET \/v1\/gameCenterLeaderboards\/{id}\/relationships\/localizations",
          "url" : "https:\/\/developer.apple.com\/documentation\/AppStoreConnectAPI\/GET-v1-gameCenterLeaderboards-_id_-relationships-localizations"
        },
        {
          "description" : "Get information about a leaderboard localization.",
          "name" : "Read leaderboard localization information",
          "url" : "https:\/\/developer.apple.com\/documentation\/AppStoreConnectAPI\/GET-v1-gameCenterLeaderboardLocalizations-_id_"
        },
        {
          "description" : "Get information about the image associated with a leaderboard localization.",
          "name" : "Read the image for a leaderboard localization",
          "url" : "https:\/\/developer.apple.com\/documentation\/AppStoreConnectAPI\/GET-v1-gameCenterLeaderboardLocalizations-_id_-gameCenterLeaderboardImage"
        },
        {
          "description" : "",
          "name" : "GET \/v1\/gameCenterLeaderboardLocalizations\/{id}\/relationships\/gameCenterLeaderboardImage",
          "url" : "https:\/\/developer.apple.com\/documentation\/AppStoreConnectAPI\/GET-v1-gameCenterLeaderboardLocalizations-_id_-relationships-gameCenterLeaderboardImage"
        },
        {
          "description" : "Edit a leaderboard localization.",
          "name" : "Modify a leaderboard localization",
          "url" : "https:\/\/developer.apple.com\/documentation\/AppStoreConnectAPI\/PATCH-v1-gameCenterLeaderboardLocalizations-_id_"
        },
        {
          "description" : "Delete a localization that’s associated with a leaderboard.",
          "name" : "Delete a leaderboard localization",
          "url" : "https:\/\/developer.apple.com\/documentation\/AppStoreConnectAPI\/DELETE-v1-gameCenterLeaderboardLocalizations-_id_"
        }
      ],
      "title" : "Managing leaderboard localizations"
    }
  ],
  "source" : "appleJSON",
  "title" : "Create a leaderboard localization",
  "url" : "https:\/\/developer.apple.com\/documentation\/appstoreconnectapi\/post-v1-gamecenterleaderboardlocalizations"
}