{
  "abstract" : "Manage Game Center activities for your apps.",
  "codeExamples" : [

  ],
  "contentHash" : "8663052f3ee7b2f145fab7ea2307f3a005014a3750994512fe18ef335ea58b92",
  "crawledAt" : "2025-12-03T12:05:24Z",
  "id" : "3B09548E-C3F8-4CFE-BBFF-FB7ABF87FDC0",
  "kind" : "collection",
  "language" : "data",
  "module" : "App Store Connect API",
  "overview" : "## Overview\n\nUse the activities API to create and configure ways to link players directly to your content in your game. Once you create an activity you can link it to a challenge and a leaderboard. To learn more about challenges, see [doc:\/\/com.apple.appstoreconnectapi\/documentation\/AppStoreConnectAPI\/configuring-game-center-challenges].\n\nActivities provide a way to link players directly to your content. By describing your gameplay with activities, you can link the player to that part of your game when they engage with the activity. For example, when a player wants to complete your daily puzzle, you can send the player directly to that part of your game. To learn more about deep links and integrating activites in your game, see [Creating activities for your game] (https:\/\/developer.apple.com\/documentation\/gamekit\/creating-activities-for-your-game).\n\nTo manage activities, be sure you have one of the following user roles:",
  "rawMarkdown" : "---\nsource: https:\/\/developer.apple.com\/documentation\/AppStoreConnectAPI\/game-center-activities\ncrawled: 2025-12-03T12:05:24Z\n---\n\n# Game Center activities\n\n**API Collection**\n\nManage Game Center activities for your apps.\n\n## Overview\n\nUse the activities API to create and configure ways to link players directly to your content in your game. Once you create an activity you can link it to a challenge and a leaderboard. To learn more about challenges, see [doc:\/\/com.apple.appstoreconnectapi\/documentation\/AppStoreConnectAPI\/configuring-game-center-challenges].\n\nActivities provide a way to link players directly to your content. By describing your gameplay with activities, you can link the player to that part of your game when they engage with the activity. For example, when a player wants to complete your daily puzzle, you can send the player directly to that part of your game. To learn more about deep links and integrating activites in your game, see [Creating activities for your game] (https:\/\/developer.apple.com\/documentation\/gamekit\/creating-activities-for-your-game).\n\nTo manage activities, be sure you have one of the following user roles:\n\n- `ADMIN`\n- `APP MANAGER`\n- `MARKETING`\n\n## Managing Game Center activities\n\n- **Create an activity**: Create an activity for your Game Center detail or Game Center group.\n- **Modify the achievements for a Game Center activity**: Update the relationship between achievements and a specific Game Center activity.\n- **Modify the leaderboards for a Game Center activity**: Update the relationship between a leaderboard and a specific Game Center activity.\n- **Read activity information**: Get information for a specific Game Center activity.\n- **Read the versions for an activity**: Get a list of versions for a specific Game Center activity.\n- **GET \/v1\/gameCenterActivities\/{id}\/relationships\/versions**\n- **List all activities for a Game Center detail**: Get activity release information for a specific Game Center detail.\n- **GET \/v1\/gameCenterDetails\/{id}\/relationships\/gameCenterActivities**\n- **List all activities for a Game Center group**: Get a list of all activities for a Game Center group.\n- **GET \/v1\/gameCenterGroups\/{id}\/relationships\/gameCenterActivities**\n- **Modify an activity**: Update details for a specific Game Center activity.\n- **Delete an activity**: Remove a specific Game Center activity.\n- **Remove an achievement from an activity**: Remove the relationship between an achievement and a Game Center activity.\n- **Remove a leaderboard from an activity**: Remove the relationship between a leaderboard and a Game Center activity.\n\n## Objects\n\n- **GameCenterActivitiesResponse**: A response that contains a list of activities resources.\n- **GameCenterActivity**: The data structure that represents a Game Center activity resource.\n- **GameCenterActivityAchievementsLinkagesRequest**: The request body you use to create a link betweeen an achievement and an activity resource.\n- **GameCenterActivityLeaderboardsLinkagesRequest**: The request body you use to create a link betweeen a leaderboard and an activity resource.\n- **GameCenterActivityCreateRequest**: The request body you use to create an activity resource.\n- **GameCenterActivityResponse**: A response that contains a single activity resource.\n- **GameCenterActivityUpdateRequest**: The request body you use to update an activity.\n- **GameCenterActivityVersion**: The data structure that represents an activity version resource.\n- **GameCenterActivityVersionCreateRequest**: The request body you use to create an activity version resource.\n- **GameCenterActivityLocalizationImageLinkageResponse**\n- **StringToStringMap**\n\n## Activities\n\n- **Configuring Game center activities**: Setup and configure a way for players to compete on a specific task or part of your game.\n- **Game Center activity versions**: Manage versions for your Game Center activities.\n- **Game Center activity version releases**: Manage version releases for your Game Center activities.\n- **Game Center activity localizations**: Manage localizations for your Game Center activities.\n- **Game Center activity images**: Manage images for your Game Center activities.\n\n",
  "sections" : [
    {
      "content" : "",
      "items" : [
        {
          "description" : "Create an activity for your Game Center detail or Game Center group.",
          "name" : "Create an activity",
          "url" : "https:\/\/developer.apple.com\/documentation\/AppStoreConnectAPI\/POST-v1-gameCenterActivities"
        },
        {
          "description" : "Update the relationship between achievements and a specific Game Center activity.",
          "name" : "Modify the achievements for a Game Center activity",
          "url" : "https:\/\/developer.apple.com\/documentation\/AppStoreConnectAPI\/POST-v1-gameCenterActivities-_id_-relationships-achievements"
        },
        {
          "description" : "Update the relationship between a leaderboard and a specific Game Center activity.",
          "name" : "Modify the leaderboards for a Game Center activity",
          "url" : "https:\/\/developer.apple.com\/documentation\/AppStoreConnectAPI\/POST-v1-gameCenterActivities-_id_-relationships-leaderboards"
        },
        {
          "description" : "Get information for a specific Game Center activity.",
          "name" : "Read activity information",
          "url" : "https:\/\/developer.apple.com\/documentation\/AppStoreConnectAPI\/GET-v1-gameCenterActivities-_id_"
        },
        {
          "description" : "Get a list of versions for a specific Game Center activity.",
          "name" : "Read the versions for an activity",
          "url" : "https:\/\/developer.apple.com\/documentation\/AppStoreConnectAPI\/GET-v1-gameCenterActivities-_id_-versions"
        },
        {
          "description" : "",
          "name" : "GET \/v1\/gameCenterActivities\/{id}\/relationships\/versions",
          "url" : "https:\/\/developer.apple.com\/documentation\/AppStoreConnectAPI\/GET-v1-gameCenterActivities-_id_-relationships-versions"
        },
        {
          "description" : "Get activity release information for a specific Game Center detail.",
          "name" : "List all activities for a Game Center detail",
          "url" : "https:\/\/developer.apple.com\/documentation\/AppStoreConnectAPI\/GET-v1-gameCenterDetails-_id_-gameCenterActivities"
        },
        {
          "description" : "",
          "name" : "GET \/v1\/gameCenterDetails\/{id}\/relationships\/gameCenterActivities",
          "url" : "https:\/\/developer.apple.com\/documentation\/AppStoreConnectAPI\/GET-v1-gameCenterDetails-_id_-relationships-gameCenterActivities"
        },
        {
          "description" : "Get a list of all activities for a Game Center group.",
          "name" : "List all activities for a Game Center group",
          "url" : "https:\/\/developer.apple.com\/documentation\/AppStoreConnectAPI\/GET-v1-gameCenterGroups-_id_-gameCenterActivities"
        },
        {
          "description" : "",
          "name" : "GET \/v1\/gameCenterGroups\/{id}\/relationships\/gameCenterActivities",
          "url" : "https:\/\/developer.apple.com\/documentation\/AppStoreConnectAPI\/GET-v1-gameCenterGroups-_id_-relationships-gameCenterActivities"
        },
        {
          "description" : "Update details for a specific Game Center activity.",
          "name" : "Modify an activity",
          "url" : "https:\/\/developer.apple.com\/documentation\/AppStoreConnectAPI\/PATCH-v1-gameCenterActivities-_id_"
        },
        {
          "description" : "Remove a specific Game Center activity.",
          "name" : "Delete an activity",
          "url" : "https:\/\/developer.apple.com\/documentation\/AppStoreConnectAPI\/DELETE-v1-gameCenterActivities-_id_"
        },
        {
          "description" : "Remove the relationship between an achievement and a Game Center activity.",
          "name" : "Remove an achievement from an activity",
          "url" : "https:\/\/developer.apple.com\/documentation\/AppStoreConnectAPI\/DELETE-v1-gameCenterActivities-_id_-relationships-achievements"
        },
        {
          "description" : "Remove the relationship between a leaderboard and a Game Center activity.",
          "name" : "Remove a leaderboard from an activity",
          "url" : "https:\/\/developer.apple.com\/documentation\/AppStoreConnectAPI\/DELETE-v1-gameCenterActivities-_id_-relationships-leaderboards"
        }
      ],
      "title" : "Managing Game Center activities"
    },
    {
      "content" : "",
      "items" : [
        {
          "description" : "A response that contains a list of activities resources.",
          "name" : "GameCenterActivitiesResponse",
          "url" : "https:\/\/developer.apple.com\/documentation\/AppStoreConnectAPI\/GameCenterActivitiesResponse"
        },
        {
          "description" : "The data structure that represents a Game Center activity resource.",
          "name" : "GameCenterActivity",
          "url" : "https:\/\/developer.apple.com\/documentation\/AppStoreConnectAPI\/GameCenterActivity"
        },
        {
          "description" : "The request body you use to create a link betweeen an achievement and an activity resource.",
          "name" : "GameCenterActivityAchievementsLinkagesRequest",
          "url" : "https:\/\/developer.apple.com\/documentation\/AppStoreConnectAPI\/GameCenterActivityAchievementsLinkagesRequest"
        },
        {
          "description" : "The request body you use to create a link betweeen a leaderboard and an activity resource.",
          "name" : "GameCenterActivityLeaderboardsLinkagesRequest",
          "url" : "https:\/\/developer.apple.com\/documentation\/AppStoreConnectAPI\/GameCenterActivityLeaderboardsLinkagesRequest"
        },
        {
          "description" : "The request body you use to create an activity resource.",
          "name" : "GameCenterActivityCreateRequest",
          "url" : "https:\/\/developer.apple.com\/documentation\/AppStoreConnectAPI\/GameCenterActivityCreateRequest"
        },
        {
          "description" : "A response that contains a single activity resource.",
          "name" : "GameCenterActivityResponse",
          "url" : "https:\/\/developer.apple.com\/documentation\/AppStoreConnectAPI\/GameCenterActivityResponse"
        },
        {
          "description" : "The request body you use to update an activity.",
          "name" : "GameCenterActivityUpdateRequest",
          "url" : "https:\/\/developer.apple.com\/documentation\/AppStoreConnectAPI\/GameCenterActivityUpdateRequest"
        },
        {
          "description" : "The data structure that represents an activity version resource.",
          "name" : "GameCenterActivityVersion",
          "url" : "https:\/\/developer.apple.com\/documentation\/AppStoreConnectAPI\/GameCenterActivityVersion"
        },
        {
          "description" : "The request body you use to create an activity version resource.",
          "name" : "GameCenterActivityVersionCreateRequest",
          "url" : "https:\/\/developer.apple.com\/documentation\/AppStoreConnectAPI\/GameCenterActivityVersionCreateRequest"
        },
        {
          "description" : "",
          "name" : "GameCenterActivityLocalizationImageLinkageResponse",
          "url" : "https:\/\/developer.apple.com\/documentation\/AppStoreConnectAPI\/GameCenterActivityLocalizationImageLinkageResponse"
        },
        {
          "description" : "",
          "name" : "StringToStringMap",
          "url" : "https:\/\/developer.apple.com\/documentation\/AppStoreConnectAPI\/StringToStringMap"
        }
      ],
      "title" : "Objects"
    },
    {
      "content" : "",
      "items" : [
        {
          "description" : "Setup and configure a way for players to compete on a specific task or part of your game.",
          "name" : "Configuring Game center activities",
          "url" : "https:\/\/developer.apple.com\/documentation\/AppStoreConnectAPI\/configuring-game-center-activities"
        },
        {
          "description" : "Manage versions for your Game Center activities.",
          "name" : "Game Center activity versions",
          "url" : "https:\/\/developer.apple.com\/documentation\/AppStoreConnectAPI\/game-center-activity-versions"
        },
        {
          "description" : "Manage version releases for your Game Center activities.",
          "name" : "Game Center activity version releases",
          "url" : "https:\/\/developer.apple.com\/documentation\/AppStoreConnectAPI\/game-center-activity-version-releases"
        },
        {
          "description" : "Manage localizations for your Game Center activities.",
          "name" : "Game Center activity localizations",
          "url" : "https:\/\/developer.apple.com\/documentation\/AppStoreConnectAPI\/game-center-activity-localizations"
        },
        {
          "description" : "Manage images for your Game Center activities.",
          "name" : "Game Center activity images",
          "url" : "https:\/\/developer.apple.com\/documentation\/AppStoreConnectAPI\/game-center-activity-images"
        }
      ],
      "title" : "Activities"
    }
  ],
  "source" : "appleJSON",
  "title" : "Game Center activities",
  "url" : "https:\/\/developer.apple.com\/documentation\/AppStoreConnectAPI\/game-center-activities"
}