{
  "abstract" : "Read information about the canonical reference for a Git branch or tag.",
  "codeExamples" : [

  ],
  "contentHash" : "aea28b6cb27048f14d7cbff8a1b9d8cbd5123c8b7426cf4597f8a592850e528c",
  "crawledAt" : "2025-12-02T07:33:57Z",
  "id" : "4DD9C92B-CD90-4FBC-AB23-6FD218ADEDAC",
  "kind" : "collection",
  "module" : "App Store Connect API",
  "overview" : "## Overview\n\nThe `scmGitReferences` resource represents the canonical Git reference for the Git commit that Xcode Cloud used to perform a build. The resource includes the following information:\n\nFor example, if Xcode Cloud uses the `bug-fix` branch for a build, the canonical Git reference is `refs\/heads\/bug-fix` and the name is `bug-fix`. If Xcode Cloud starts a build for the `release-1.0` tag, the canonical name is `refs\/tags\/release-1.0` and the name is `release-1.0`.",
  "rawMarkdown" : "---\nsource: https:\/\/developer.apple.com\/documentation\/AppStoreConnectAPI\/git-references\ncrawled: 2025-12-02T07:33:57Z\n---\n\n# Git References\n\n**API Collection**\n\nRead information about the canonical reference for a Git branch or tag.\n\n## Overview\n\nThe `scmGitReferences` resource represents the canonical Git reference for the Git commit that Xcode Cloud used to perform a build. The resource includes the following information:\n\n- The referenceâ€™s name and canonical name\n- Whether the reference has been deleted\n- The type of the reference\n\nFor example, if Xcode Cloud uses the `bug-fix` branch for a build, the canonical Git reference is `refs\/heads\/bug-fix` and the name is `bug-fix`. If Xcode Cloud starts a build for the `release-1.0` tag, the canonical name is `refs\/tags\/release-1.0` and the name is `release-1.0`.\n\n\n\n## Getting Information About Git References\n\n- **Read Git Reference Information**: Get information about a specific Git reference.\n\n## Objects\n\n- **ScmGitReference**: The data structure that represents a Git References resource.\n- **ScmGitReferenceResponse**: A response that contains a single Git References resource.\n- **ScmGitReferencesResponse**: A response that contains a list of Git References resources.\n\n## Source Code Management\n\n- **Providers**: Read information about source code management providers you connected to Xcode Cloud.\n- **Repositories**: Read detailed information for each repository Xcode Cloud can access, including Git references and pull requests.\n- **Pull Requests**: Read pull request information such as source and destination branches.\n\n",
  "sections" : [
    {
      "content" : "",
      "items" : [
        {
          "description" : "Get information about a specific Git reference.",
          "name" : "Read Git Reference Information",
          "url" : "https:\/\/developer.apple.com\/documentation\/AppStoreConnectAPI\/GET-v1-scmGitReferences-_id_"
        }
      ],
      "title" : "Getting Information About Git References"
    },
    {
      "content" : "",
      "items" : [
        {
          "description" : "The data structure that represents a Git References resource.",
          "name" : "ScmGitReference",
          "url" : "https:\/\/developer.apple.com\/documentation\/AppStoreConnectAPI\/ScmGitReference"
        },
        {
          "description" : "A response that contains a single Git References resource.",
          "name" : "ScmGitReferenceResponse",
          "url" : "https:\/\/developer.apple.com\/documentation\/AppStoreConnectAPI\/ScmGitReferenceResponse"
        },
        {
          "description" : "A response that contains a list of Git References resources.",
          "name" : "ScmGitReferencesResponse",
          "url" : "https:\/\/developer.apple.com\/documentation\/AppStoreConnectAPI\/ScmGitReferencesResponse"
        }
      ],
      "title" : "Objects"
    },
    {
      "content" : "",
      "items" : [
        {
          "description" : "Read information about source code management providers you connected to Xcode Cloud.",
          "name" : "Providers",
          "url" : "https:\/\/developer.apple.com\/documentation\/AppStoreConnectAPI\/providers"
        },
        {
          "description" : "Read detailed information for each repository Xcode Cloud can access, including Git references and pull requests.",
          "name" : "Repositories",
          "url" : "https:\/\/developer.apple.com\/documentation\/AppStoreConnectAPI\/repositories"
        },
        {
          "description" : "Read pull request information such as source and destination branches.",
          "name" : "Pull Requests",
          "url" : "https:\/\/developer.apple.com\/documentation\/AppStoreConnectAPI\/pull-requests"
        }
      ],
      "title" : "Source Code Management"
    }
  ],
  "source" : "appleJSON",
  "title" : "Git References",
  "url" : "https:\/\/developer.apple.com\/documentation\/AppStoreConnectAPI\/git-references"
}