{
  "abstract" : "Manage keys you use to sign JSON web tokens (JWTs).",
  "codeExamples" : [
    {
      "code" : "openssl ecparam -name prime256v1 -genkey -noout -out private_key.pem",
      "language" : "other"
    },
    {
      "code" : "openssl ec -in private_key.pem -pubout > public_key.pem",
      "language" : "other"
    },
    {
      "code" : "POST https:\/\/api.appstoreconnect.apple.com\/v1\/alternativeDistributionKeys\n{\n  \"data\": {\n    \"type\": \"alternativeDistributionKeys\",\n    \"id\": null,\n    \"attributes\": {\n      \"publicKey\": \"-----BEGIN PUBLIC KEY-----\\nMFkwEwYHKoZIzj0CAQYIKoZIzj0DAQcDQgAE7rsxeCw+hrwRgStk0J2vYmnGQZha\\ngSt0fm511aTjpDVsaIy9z7jmUKjJ1jgb8P5UKmQfmw0ovD+fNTSefjrw5A==\\n-----END PUBLIC KEY-----\\n\"\n    },\n    \"relationships\": {\n      \"app\": {\n        \"data\": {\n          \"type\": \"apps\",\n          \"id\": \"6473805491\"\n        }\n      }\n    }\n  }\n}",
      "language" : "other"
    }
  ],
  "contentHash" : "5c0f280fefd588156e0c5185c60f524b05912ff4dbf033090cf1347d35dc2e7f",
  "crawledAt" : "2025-12-07T17:04:33Z",
  "id" : "3E9736F5-CF0A-46AC-B7AC-2786C44CEB97",
  "kind" : "article",
  "language" : "data",
  "module" : "App Store Connect API",
  "overview" : "## Overview\n\nUse alternative distribution keys to configure your app for installation from your website. To create an alternative distribution key, you must have an existing app in App Store Connect. If you don’t have one, create one before continuing.\n\n### Generate your private key\n\nApp Store Connect uses a private cryptographic key to generate a signature for each app that you distribute from your website. During registration, you create a public-private key pair, and send the public key to App Store Connect. The private key you create uses an Elliptic Curve Digital Signature Algorithm (ECDSA) with the P-256 curve and the SHA-256 hash algorithm.\n\nTo create your private key, open Terminal and enter the following command:\n\nThis command creates the file `private_key.pem`, which contains your private key.\n\n### Generate your public key\n\nCreate a public key from the private key you created in the previous section. The public key is a PEM-encoded PKCS#8 EC key that uses the P-256 curve. In Terminal, enter the following command:\n\nThis command creates the file `public_key.pem`, which contains your public key. Run this command any time to generate a copy of your public key file. To request your existing public key from App Store Connect, see [doc:\/\/com.apple.appstoreconnectapi\/documentation\/AppStoreConnectAPI\/GET-v1-apps-_id_-alternativeDistributionKey].\n\n### Create an alternative distribution key\n\nNext, upload your public key to App Store Connect using the endpoint described in [doc:\/\/com.apple.appstoreconnectapi\/documentation\/AppStoreConnectAPI\/POST-v1-alternativeDistributionKeys].\n\nThe `id` in the `relationships` object is the app Apple ID for your app. You can find this app Apple ID by calling [doc:\/\/com.apple.appstoreconnectapi\/documentation\/AppStoreConnectAPI\/GET-v1-apps] and filtering for your app name or by going to App Store Connect.\n\nTo access your web distribution app’s Apple ID, log in to [https:\/\/appstoreconnect.apple.com\/].\n\nThe following request uploads the public key to App Store Connect:",
  "rawMarkdown" : "---\nsource: https:\/\/developer.apple.com\/documentation\/appstoreconnectapi\/creating-and-configuring-keys-for-web-distribution\ncrawled: 2025-12-07T17:04:33Z\n---\n\n# Creating and configuring keys for web distribution\n\n**Article**\n\nManage keys you use to sign JSON web tokens (JWTs).\n\n## Overview\n\nUse alternative distribution keys to configure your app for installation from your website. To create an alternative distribution key, you must have an existing app in App Store Connect. If you don’t have one, create one before continuing.\n\n### Generate your private key\n\nApp Store Connect uses a private cryptographic key to generate a signature for each app that you distribute from your website. During registration, you create a public-private key pair, and send the public key to App Store Connect. The private key you create uses an Elliptic Curve Digital Signature Algorithm (ECDSA) with the P-256 curve and the SHA-256 hash algorithm.\n\nTo create your private key, open Terminal and enter the following command:\n\n```other\nopenssl ecparam -name prime256v1 -genkey -noout -out private_key.pem\n```\n\nThis command creates the file `private_key.pem`, which contains your private key.\n\n\n\n### Generate your public key\n\nCreate a public key from the private key you created in the previous section. The public key is a PEM-encoded PKCS#8 EC key that uses the P-256 curve. In Terminal, enter the following command:\n\n```other\nopenssl ec -in private_key.pem -pubout > public_key.pem\n```\n\nThis command creates the file `public_key.pem`, which contains your public key. Run this command any time to generate a copy of your public key file. To request your existing public key from App Store Connect, see [doc:\/\/com.apple.appstoreconnectapi\/documentation\/AppStoreConnectAPI\/GET-v1-apps-_id_-alternativeDistributionKey].\n\n### Create an alternative distribution key\n\n\n\nNext, upload your public key to App Store Connect using the endpoint described in [doc:\/\/com.apple.appstoreconnectapi\/documentation\/AppStoreConnectAPI\/POST-v1-alternativeDistributionKeys].\n\nThe `id` in the `relationships` object is the app Apple ID for your app. You can find this app Apple ID by calling [doc:\/\/com.apple.appstoreconnectapi\/documentation\/AppStoreConnectAPI\/GET-v1-apps] and filtering for your app name or by going to App Store Connect.\n\nTo access your web distribution app’s Apple ID, log in to [https:\/\/appstoreconnect.apple.com\/].\n\n1. Select Apps.\n2. Select your marketplace app from the list.\n3. Under General, select App Information.\n4. Scroll down to General Information, and locate your app Apple ID below your SKU.\n\nThe following request uploads the public key to App Store Connect:\n\n```other\nPOST https:\/\/api.appstoreconnect.apple.com\/v1\/alternativeDistributionKeys\n{\n  \"data\": {\n    \"type\": \"alternativeDistributionKeys\",\n    \"id\": null,\n    \"attributes\": {\n      \"publicKey\": \"-----BEGIN PUBLIC KEY-----\\nMFkwEwYHKoZIzj0CAQYIKoZIzj0DAQcDQgAE7rsxeCw+hrwRgStk0J2vYmnGQZha\\ngSt0fm511aTjpDVsaIy9z7jmUKjJ1jgb8P5UKmQfmw0ovD+fNTSefjrw5A==\\n-----END PUBLIC KEY-----\\n\"\n    },\n    \"relationships\": {\n      \"app\": {\n        \"data\": {\n          \"type\": \"apps\",\n          \"id\": \"6473805491\"\n        }\n      }\n    }\n  }\n}\n```\n\n## Creating and reading keys\n\n- **Creating keys and establishing alternative marketplace connections**: Manage keys you use to sign JSON web tokens and connect marketplaces with apps.\n- **Add an alternative distribution key**: Add an alternative distribution key for your alternative marketplace app or web distribution.\n- **List alternative distribution keys**: List the alternative distribution key for your account.\n- **Read alternative distribution key information**: Read the public key information for a specific alternative distribution key.\n- **GET \/v1\/apps\/{id}\/relationships\/alternativeDistributionKey**\n- **Read an app’s alternative distribution key**: Get the alternative distribution keys for a specific app.\n- **Remove an alternative distribution key**: Remove an alternative distribution key from your account.\n\n",
  "sections" : [
    {
      "content" : "",
      "items" : [
        {
          "description" : "Manage keys you use to sign JSON web tokens and connect marketplaces with apps.",
          "name" : "Creating keys and establishing alternative marketplace connections",
          "url" : "https:\/\/developer.apple.com\/documentation\/AppStoreConnectAPI\/creating-keys-and-establishing-alternative-marketplace-connections"
        },
        {
          "description" : "Add an alternative distribution key for your alternative marketplace app or web distribution.",
          "name" : "Add an alternative distribution key",
          "url" : "https:\/\/developer.apple.com\/documentation\/AppStoreConnectAPI\/POST-v1-alternativeDistributionKeys"
        },
        {
          "description" : "List the alternative distribution key for your account.",
          "name" : "List alternative distribution keys",
          "url" : "https:\/\/developer.apple.com\/documentation\/AppStoreConnectAPI\/GET-v1-alternativeDistributionKeys"
        },
        {
          "description" : "Read the public key information for a specific alternative distribution key.",
          "name" : "Read alternative distribution key information",
          "url" : "https:\/\/developer.apple.com\/documentation\/AppStoreConnectAPI\/GET-v1-alternativeDistributionKeys-_id_"
        },
        {
          "description" : "",
          "name" : "GET \/v1\/apps\/{id}\/relationships\/alternativeDistributionKey",
          "url" : "https:\/\/developer.apple.com\/documentation\/AppStoreConnectAPI\/GET-v1-apps-_id_-relationships-alternativeDistributionKey"
        },
        {
          "description" : "Get the alternative distribution keys for a specific app.",
          "name" : "Read an app’s alternative distribution key",
          "url" : "https:\/\/developer.apple.com\/documentation\/AppStoreConnectAPI\/GET-v1-apps-_id_-alternativeDistributionKey"
        },
        {
          "description" : "Remove an alternative distribution key from your account.",
          "name" : "Remove an alternative distribution key",
          "url" : "https:\/\/developer.apple.com\/documentation\/AppStoreConnectAPI\/DELETE-v1-alternativeDistributionKeys-_id_"
        }
      ],
      "title" : "Creating and reading keys"
    }
  ],
  "source" : "appleJSON",
  "title" : "Creating and configuring keys for web distribution",
  "url" : "https:\/\/developer.apple.com\/documentation\/appstoreconnectapi\/creating-and-configuring-keys-for-web-distribution"
}