{
  "abstract" : "Return the result of dividing one number into another.",
  "codeExamples" : [
    {
      "code" : "number div(number $dividend, number $divisor)",
      "language" : "other"
    }
  ],
  "contentHash" : "4eaddf657a6dec3ef9be00d2ddf5d91c351d1321120a1f38a5040c4041cba40a",
  "crawledAt" : "2025-12-04T20:58:14Z",
  "id" : "08A93E54-3D90-45D4-AD68-D23EDB1D5845",
  "kind" : "article",
  "language" : "data",
  "module" : "App Store Connect API",
  "overview" : "## Overview\n\nUse the `div()` function in the expression of a matchmaking rule to divide two numbers.\n\n### Declaration\n\n### Parameters\n\n### Return value\n\nThe result or quotient of dividing `divisor` into `dividend`. If `divisor` is `zero`, `null`.",
  "rawMarkdown" : "---\nsource: https:\/\/developer.apple.com\/documentation\/AppStoreConnectAPI\/dividing-numbers\ncrawled: 2025-12-04T20:58:14Z\n---\n\n# Dividing numbers\n\n**Article**\n\nReturn the result of dividing one number into another.\n\n## Overview\n\nUse the `div()` function in the expression of a matchmaking rule to divide two numbers.\n\n### Declaration\n\n```other\nnumber div(number $dividend, number $divisor)\n```\n\n### Parameters\n\n\n\n### Return value\n\nThe result or quotient of dividing `divisor` into `dividend`. If `divisor` is `zero`, `null`.\n\n## Numeric functions\n\n- **Subtracting numbers**: Return the result of subtracting two numbers.\n\n",
  "sections" : [
    {
      "content" : "",
      "items" : [
        {
          "description" : "Return the result of subtracting two numbers.",
          "name" : "Subtracting numbers",
          "url" : "https:\/\/developer.apple.com\/documentation\/AppStoreConnectAPI\/subtracting-numbers"
        }
      ],
      "title" : "Numeric functions"
    }
  ],
  "source" : "appleJSON",
  "title" : "Dividing numbers",
  "url" : "https:\/\/developer.apple.com\/documentation\/AppStoreConnectAPI\/dividing-numbers"
}