{
  "abstract" : "Sends a message asynchronously over the session to the destination service, calling a closure after receiving a reply.",
  "codeExamples" : [

  ],
  "contentHash" : "05023a28f13b5c7732c8b7b592b233cb3076778436eacb96f22fb29bfe033bc3",
  "crawledAt" : "2025-12-03T04:05:48Z",
  "declaration" : {
    "code" : "@preconcurrency func send(message: XPCDictionary, replyHandler: @escaping (Result<XPCDictionary, XPCRichError>) -> Void)",
    "language" : "swift"
  },
  "id" : "8B711FB1-E077-4549-86DF-21DA862DB142",
  "kind" : "method",
  "language" : "swift",
  "module" : "XPC",
  "overview" : "## Discussion\n\nSessions send messages serially in a first-in, first-out (FIFO) order. This method is safe to call from multiple dispatch queues. The session can’t indicate whether the message *delivery* is successful or not. While the session may successfully enqueue the message at the remote end of the connection, there’s no guarantee about when the destination dequeues the message and invokes the receiving session’s handler.\n\nIf the session fails to send the message, this method throws an error that contains details about the failure.\n\nIf the system tears down the session’s connection before receiving a reply, it invokes `replyHandler` with a result containing an [doc:\/\/com.apple.xpc\/documentation\/XPC\/XPCRichError] describing the failure. For example, the remote service exits prematurely before sending a reply.",
  "platforms" : [
    "iOS",
    "iPadOS",
    "Mac Catalyst",
    "macOS"
  ],
  "rawMarkdown" : "---\nsource: https:\/\/developer.apple.com\/documentation\/XPC\/XPCSession\/send(message:replyHandler:)\ncrawled: 2025-12-03T04:05:48Z\n---\n\n# send(message:replyHandler:)\n\n**Instance Method**\n\nSends a message asynchronously over the session to the destination service, calling a closure after receiving a reply.\n\n## Declaration\n\n```swift\n@preconcurrency func send(message: XPCDictionary, replyHandler: @escaping (Result<XPCDictionary, XPCRichError>) -> Void)\n```\n\n## Parameters\n\n- **message**: A dictionary object that contains the message to send.\n- **replyHandler**: A closure the session invokes when it receives a reply. The closure takes a result parameter that contains either the reply that the destination sent back or an error describing a failure.\n\n## Discussion\n\nSessions send messages serially in a first-in, first-out (FIFO) order. This method is safe to call from multiple dispatch queues. The session can’t indicate whether the message *delivery* is successful or not. While the session may successfully enqueue the message at the remote end of the connection, there’s no guarantee about when the destination dequeues the message and invokes the receiving session’s handler.\n\nIf the session fails to send the message, this method throws an error that contains details about the failure.\n\nIf the system tears down the session’s connection before receiving a reply, it invokes `replyHandler` with a result containing an [doc:\/\/com.apple.xpc\/documentation\/XPC\/XPCRichError] describing the failure. For example, the remote service exits prematurely before sending a reply.\n\n\n\n## Sending messages\n\n- **send(_:)**: Sends an encodable message over the session to the destination service.\n- **send(_:replyHandler:)**: Sends an encodable message over the session to the destination service, using the closure you specify to handle a reply and rich error.\n- **send(_:replyHandler:)**: Sends an encodable message over the session to the destination service, using the closure you specify to handle a reply.\n- **send(message:)**: Sends a dictionary message over the session to the destination service.\n- **sendSync(_:)**: Sends an encodable message over the session to the destination service, blocking the caller until receiving a reply message.\n- **sendSync(_:)**: Sends an encodable message over the session to the destination service, blocking the caller until receiving an encodable reply message.\n- **sendSync(message:)**: Sends a dictionary message over the session to the destination service, blocking the caller until receiving a reply.\n\n",
  "sections" : [
    {
      "content" : "",
      "items" : [
        {
          "description" : "Sends an encodable message over the session to the destination service.",
          "name" : "send(_:)",
          "url" : "https:\/\/developer.apple.com\/documentation\/XPC\/XPCSession\/send(_:)"
        },
        {
          "description" : "Sends an encodable message over the session to the destination service, using the closure you specify to handle a reply and rich error.",
          "name" : "send(_:replyHandler:)",
          "url" : "https:\/\/developer.apple.com\/documentation\/XPC\/XPCSession\/send(_:replyHandler:)-3wjln"
        },
        {
          "description" : "Sends an encodable message over the session to the destination service, using the closure you specify to handle a reply.",
          "name" : "send(_:replyHandler:)",
          "url" : "https:\/\/developer.apple.com\/documentation\/XPC\/XPCSession\/send(_:replyHandler:)-9an0u"
        },
        {
          "description" : "Sends a dictionary message over the session to the destination service.",
          "name" : "send(message:)",
          "url" : "https:\/\/developer.apple.com\/documentation\/XPC\/XPCSession\/send(message:)"
        },
        {
          "description" : "Sends an encodable message over the session to the destination service, blocking the caller until receiving a reply message.",
          "name" : "sendSync(_:)",
          "url" : "https:\/\/developer.apple.com\/documentation\/XPC\/XPCSession\/sendSync(_:)-8a284"
        },
        {
          "description" : "Sends an encodable message over the session to the destination service, blocking the caller until receiving an encodable reply message.",
          "name" : "sendSync(_:)",
          "url" : "https:\/\/developer.apple.com\/documentation\/XPC\/XPCSession\/sendSync(_:)-88u0s"
        },
        {
          "description" : "Sends a dictionary message over the session to the destination service, blocking the caller until receiving a reply.",
          "name" : "sendSync(message:)",
          "url" : "https:\/\/developer.apple.com\/documentation\/XPC\/XPCSession\/sendSync(message:)"
        }
      ],
      "title" : "Sending messages"
    }
  ],
  "source" : "appleJSON",
  "title" : "send(message:replyHandler:)",
  "url" : "https:\/\/developer.apple.com\/documentation\/XPC\/XPCSession\/send(message:replyHandler:)"
}