{
  "abstract" : "A container of related log messages.",
  "codeExamples" : [

  ],
  "conformsTo" : [
    "CVarArg",
    "Equatable",
    "Hashable",
    "NSObjectProtocol",
    "Sendable",
    "SendableMetatype"
  ],
  "contentHash" : "cb445805dafdb14c871bc43490490b1e5891aeef7c9d61b3a7e8a3e2254ef08c",
  "crawledAt" : "2025-12-07T16:33:07Z",
  "declaration" : {
    "code" : "class OSLog",
    "language" : "swift"
  },
  "id" : "7DFA0227-4DEA-4F49-8D15-9E5B2935E4D8",
  "kind" : "class",
  "language" : "swift",
  "module" : "os",
  "overview" : "## Overview\n\nA log categorizes the messages you write and makes it easy to sort and filter them. Each log contains a subsystem and a category, which you define. A subsystem identifies a major functional area of your app, which you specify using reverse DNS notation, such as `com.your_company.your_subsystem_name`. A category segregates specific areas within a subsystem.",
  "platforms" : [
    "iOS",
    "iPadOS",
    "Mac Catalyst",
    "macOS",
    "tvOS",
    "visionOS",
    "watchOS"
  ],
  "rawMarkdown" : "---\nsource: https:\/\/developer.apple.com\/documentation\/os\/OSLog\ncrawled: 2025-12-07T16:33:07Z\n---\n\n# OSLog\n\n**Class**\n\nA container of related log messages.\n\n## Declaration\n\n```swift\nclass OSLog\n```\n\n## Overview\n\nA log categorizes the messages you write and makes it easy to sort and filter them. Each log contains a subsystem and a category, which you define. A subsystem identifies a major functional area of your app, which you specify using reverse DNS notation, such as `com.your_company.your_subsystem_name`. A category segregates specific areas within a subsystem.\n\n## Creating a Log\n\n- **init(subsystem:category:)**: Creates a log using the specified subsystem and category.\n- **init(subsystem:category:)**: Creates a log using the specified subsystem and system-defined category.\n- **OSLog.Category**: System-defined categories that identify well-known parts of your app.\n\n## Getting the Shared Logs\n\n- **default**: The shared default log.\n- **disabled**: The shared disabled log.\n\n## Getting Log Configuration\n\n- **isEnabled(type:)**: Returns a Boolean value that indicates whether the log can write messages with the specified log type.\n- **signpostsEnabled**: A Boolean value that indicates whether a log is able to use signpost logging.\n\n## Creating a Logger\n\n- **init()**: Creates a logger that writes to the default subsystem.\n- **init(subsystem:category:)**: Creates a logger using the specified subsystem and category.\n- **init(_:)**: Creates a logger that writes to the specified log.\n\n## Inherits From\n\n- NSObject\n\n## Conforms To\n\n- CVarArg\n- Equatable\n- Hashable\n- NSObjectProtocol\n- Sendable\n- SendableMetatype\n\n",
  "sections" : [
    {
      "content" : "",
      "items" : [
        {
          "description" : "Creates a log using the specified subsystem and category.",
          "name" : "init(subsystem:category:)",
          "url" : "https:\/\/developer.apple.com\/documentation\/os\/OSLog\/init(subsystem:category:)-17gyy"
        },
        {
          "description" : "Creates a log using the specified subsystem and system-defined category.",
          "name" : "init(subsystem:category:)",
          "url" : "https:\/\/developer.apple.com\/documentation\/os\/OSLog\/init(subsystem:category:)-72ghw"
        },
        {
          "description" : "System-defined categories that identify well-known parts of your app.",
          "name" : "OSLog.Category",
          "url" : "https:\/\/developer.apple.com\/documentation\/os\/OSLog\/Category"
        }
      ],
      "title" : "Creating a Log"
    },
    {
      "content" : "",
      "items" : [
        {
          "description" : "The shared default log.",
          "name" : "default",
          "url" : "https:\/\/developer.apple.com\/documentation\/os\/OSLog\/default"
        },
        {
          "description" : "The shared disabled log.",
          "name" : "disabled",
          "url" : "https:\/\/developer.apple.com\/documentation\/os\/OSLog\/disabled"
        }
      ],
      "title" : "Getting the Shared Logs"
    },
    {
      "content" : "",
      "items" : [
        {
          "description" : "Returns a Boolean value that indicates whether the log can write messages with the specified log type.",
          "name" : "isEnabled(type:)",
          "url" : "https:\/\/developer.apple.com\/documentation\/os\/OSLog\/isEnabled(type:)"
        },
        {
          "description" : "A Boolean value that indicates whether a log is able to use signpost logging.",
          "name" : "signpostsEnabled",
          "url" : "https:\/\/developer.apple.com\/documentation\/os\/OSLog\/signpostsEnabled"
        }
      ],
      "title" : "Getting Log Configuration"
    },
    {
      "content" : "",
      "items" : [
        {
          "description" : "Creates a logger that writes to the default subsystem.",
          "name" : "init()",
          "url" : "https:\/\/developer.apple.com\/documentation\/os\/Logger\/init()"
        },
        {
          "description" : "Creates a logger using the specified subsystem and category.",
          "name" : "init(subsystem:category:)",
          "url" : "https:\/\/developer.apple.com\/documentation\/os\/Logger\/init(subsystem:category:)"
        },
        {
          "description" : "Creates a logger that writes to the specified log.",
          "name" : "init(_:)",
          "url" : "https:\/\/developer.apple.com\/documentation\/os\/Logger\/init(_:)"
        }
      ],
      "title" : "Creating a Logger"
    },
    {
      "content" : "",
      "items" : [
        {
          "name" : "NSObject"
        }
      ],
      "title" : "Inherits From"
    }
  ],
  "source" : "appleJSON",
  "title" : "OSLog",
  "url" : "https:\/\/developer.apple.com\/documentation\/os\/OSLog"
}