{
  "abstract" : "A value describing the processing request in a parameters submission object.",
  "codeExamples" : [

  ],
  "conformsTo" : [
    "BitwiseCopyable",
    "Equatable",
    "Hashable",
    "RawRepresentable",
    "Sendable",
    "SendableMetatype"
  ],
  "contentHash" : "6dea36d14d7339966b73011b322d6da15a28b36c86454781b19c53b124cb5847",
  "crawledAt" : "2025-12-03T07:35:51Z",
  "declaration" : {
    "code" : "enum SubmissionMode",
    "language" : "swift"
  },
  "id" : "9DFB0E56-D158-43B9-9DE4-9217DFC3DBBB",
  "kind" : "enum",
  "language" : "swift",
  "module" : "Video Toolbox",
  "overview" : "## Overview\n\nSet to VTMotionBlurParametersSubmissionModeSequential to indicate that the current submission follows the presentation time order without jumping or skipping when compared to the previous submission. Using the submission mode sequential will yield better performance. Set to VTMotionBlurParametersSubmissionModeRandom to indicate a skip or a jump in frame sequence. If the submission mode random is set, the internal cache will be cleared during the processWithParameters call.",
  "platforms" : [
    "iOS",
    "iPadOS",
    "Mac Catalyst",
    "macOS"
  ],
  "rawMarkdown" : "---\nsource: https:\/\/developer.apple.com\/documentation\/VideoToolbox\/VTMotionBlurParameters\/SubmissionMode-swift.enum\ncrawled: 2025-12-03T07:35:51Z\n---\n\n# VTMotionBlurParameters.SubmissionMode\n\n**Enumeration**\n\nA value describing the processing request in a parameters submission object.\n\n## Declaration\n\n```swift\nenum SubmissionMode\n```\n\n## Overview\n\nSet to VTMotionBlurParametersSubmissionModeSequential to indicate that the current submission follows the presentation time order without jumping or skipping when compared to the previous submission. Using the submission mode sequential will yield better performance. Set to VTMotionBlurParametersSubmissionModeRandom to indicate a skip or a jump in frame sequence. If the submission mode random is set, the internal cache will be cleared during the processWithParameters call.\n\n## Submission modes\n\n- **VTMotionBlurParameters.SubmissionMode.random**: A submission follow presentation time order with a jump or skip in a frame sequence.\n- **VTMotionBlurParameters.SubmissionMode.sequential**: A submission follow presentation time order without a jump or skip when compared to a previous submission.\n\n## Initializers\n\n- **init(rawValue:)**\n\n## Inspecting the parameters\n\n- **sourceFrame**: The current source frame.\n- **nextFrame**: The next source frame in presentation time order.\n- **previousFrame**: The previous source frame in presentation time order.\n- **motionBlurStrength**: A value that indicates the strength of blur to apply.\n- **nextOpticalFlow**: Optional optical flow object that contains forward and backward optical flow with the next frame.\n- **previousOpticalFlow**: Optional optical flow object that contains forward and backward optical flow with the previous frame.\n- **submissionMode**: A value describing the processing request in a parameters submission object.\n\n## Conforms To\n\n- BitwiseCopyable\n- Equatable\n- Hashable\n- RawRepresentable\n- Sendable\n- SendableMetatype\n\n",
  "sections" : [
    {
      "content" : "",
      "items" : [
        {
          "description" : "A submission follow presentation time order with a jump or skip in a frame sequence.",
          "name" : "VTMotionBlurParameters.SubmissionMode.random",
          "url" : "https:\/\/developer.apple.com\/documentation\/VideoToolbox\/VTMotionBlurParameters\/SubmissionMode-swift.enum\/random"
        },
        {
          "description" : "A submission follow presentation time order without a jump or skip when compared to a previous submission.",
          "name" : "VTMotionBlurParameters.SubmissionMode.sequential",
          "url" : "https:\/\/developer.apple.com\/documentation\/VideoToolbox\/VTMotionBlurParameters\/SubmissionMode-swift.enum\/sequential"
        }
      ],
      "title" : "Submission modes"
    },
    {
      "content" : "",
      "items" : [
        {
          "description" : "",
          "name" : "init(rawValue:)",
          "url" : "https:\/\/developer.apple.com\/documentation\/VideoToolbox\/VTMotionBlurParameters\/SubmissionMode-swift.enum\/init(rawValue:)"
        }
      ],
      "title" : "Initializers"
    },
    {
      "content" : "",
      "items" : [
        {
          "description" : "The current source frame.",
          "name" : "sourceFrame",
          "url" : "https:\/\/developer.apple.com\/documentation\/VideoToolbox\/VTMotionBlurParameters\/sourceFrame"
        },
        {
          "description" : "The next source frame in presentation time order.",
          "name" : "nextFrame",
          "url" : "https:\/\/developer.apple.com\/documentation\/VideoToolbox\/VTMotionBlurParameters\/nextFrame"
        },
        {
          "description" : "The previous source frame in presentation time order.",
          "name" : "previousFrame",
          "url" : "https:\/\/developer.apple.com\/documentation\/VideoToolbox\/VTMotionBlurParameters\/previousFrame"
        },
        {
          "description" : "A value that indicates the strength of blur to apply.",
          "name" : "motionBlurStrength",
          "url" : "https:\/\/developer.apple.com\/documentation\/VideoToolbox\/VTMotionBlurParameters\/motionBlurStrength"
        },
        {
          "description" : "Optional optical flow object that contains forward and backward optical flow with the next frame.",
          "name" : "nextOpticalFlow",
          "url" : "https:\/\/developer.apple.com\/documentation\/VideoToolbox\/VTMotionBlurParameters\/nextOpticalFlow"
        },
        {
          "description" : "Optional optical flow object that contains forward and backward optical flow with the previous frame.",
          "name" : "previousOpticalFlow",
          "url" : "https:\/\/developer.apple.com\/documentation\/VideoToolbox\/VTMotionBlurParameters\/previousOpticalFlow"
        },
        {
          "description" : "A value describing the processing request in a parameters submission object.",
          "name" : "submissionMode",
          "url" : "https:\/\/developer.apple.com\/documentation\/VideoToolbox\/VTMotionBlurParameters\/submissionMode-swift.property"
        }
      ],
      "title" : "Inspecting the parameters"
    }
  ],
  "source" : "appleJSON",
  "title" : "VTMotionBlurParameters.SubmissionMode",
  "url" : "https:\/\/developer.apple.com\/documentation\/VideoToolbox\/VTMotionBlurParameters\/SubmissionMode-swift.enum"
}