{
  "abstract" : "A dictionary key for the video decoder extension identifier.",
  "codeExamples" : [

  ],
  "contentHash" : "5556ad89d2730350fbb4c434bb305eeb17093f6dbe896e1109f2a94cafc0cbf4",
  "crawledAt" : "2025-12-05T01:18:22Z",
  "declaration" : {
    "code" : "static let extensionIdentifier: VTExtensionPropertiesKey",
    "language" : "swift"
  },
  "id" : "3705EE65-CE4F-4CCB-9E6C-91A830EBF566",
  "kind" : "property",
  "language" : "swift",
  "module" : "Video Toolbox",
  "overview" : "## Discussion\n\nThis key points to a `CFStringRef` value with the extension identifier, corresponding to the ClassImplementationID value from the EXAppExtensionAttributes dictionary in the Info.plist file.",
  "platforms" : [
    "macOS"
  ],
  "rawMarkdown" : "---\nsource: https:\/\/developer.apple.com\/documentation\/VideoToolbox\/VTExtensionPropertiesKey\/extensionIdentifier\ncrawled: 2025-12-05T01:18:22Z\n---\n\n# extensionIdentifier\n\n**Type Property**\n\nA dictionary key for the video decoder extension identifier.\n\n## Declaration\n\n```swift\nstatic let extensionIdentifier: VTExtensionPropertiesKey\n```\n\n## Discussion\n\nThis key points to a `CFStringRef` value with the extension identifier, corresponding to the ClassImplementationID value from the EXAppExtensionAttributes dictionary in the Info.plist file.\n\n## Keys\n\n- **containingBundleName**: A dictionary key for the extension host application localized name.\n- **containingBundleURL**: A dictionary key for the URL of the extension host application.\n- **extensionName**: A dictionary key for the localized extension name.\n- **extensionURL**: A dictionary key for the URL of the extension.\n\n",
  "sections" : [
    {
      "content" : "",
      "items" : [
        {
          "description" : "A dictionary key for the extension host application localized name.",
          "name" : "containingBundleName",
          "url" : "https:\/\/developer.apple.com\/documentation\/VideoToolbox\/VTExtensionPropertiesKey\/containingBundleName"
        },
        {
          "description" : "A dictionary key for the URL of the extension host application.",
          "name" : "containingBundleURL",
          "url" : "https:\/\/developer.apple.com\/documentation\/VideoToolbox\/VTExtensionPropertiesKey\/containingBundleURL"
        },
        {
          "description" : "A dictionary key for the localized extension name.",
          "name" : "extensionName",
          "url" : "https:\/\/developer.apple.com\/documentation\/VideoToolbox\/VTExtensionPropertiesKey\/extensionName"
        },
        {
          "description" : "A dictionary key for the URL of the extension.",
          "name" : "extensionURL",
          "url" : "https:\/\/developer.apple.com\/documentation\/VideoToolbox\/VTExtensionPropertiesKey\/extensionURL"
        }
      ],
      "title" : "Keys"
    }
  ],
  "source" : "appleJSON",
  "title" : "extensionIdentifier",
  "url" : "https:\/\/developer.apple.com\/documentation\/VideoToolbox\/VTExtensionPropertiesKey\/extensionIdentifier"
}