{
  "abstract" : "An object you use to configure frame processor for low-latency super-resolution scaler processing.",
  "codeExamples" : [

  ],
  "conformsTo" : [
    "CVarArg",
    "CustomDebugStringConvertible",
    "CustomStringConvertible",
    "Equatable",
    "Hashable",
    "NSObjectProtocol",
    "Sendable",
    "SendableMetatype",
    "VTFrameProcessorConfiguration"
  ],
  "contentHash" : "d81dd75a239c27c4b0855798eb9c2ad4f5f7b361c8e00f510cdd78142dcafaeb",
  "crawledAt" : "2025-12-02T18:02:09Z",
  "declaration" : {
    "code" : "class VTLowLatencySuperResolutionScalerConfiguration",
    "language" : "swift"
  },
  "id" : "AA926CD3-6864-4D17-85A2-506B0AA956B8",
  "kind" : "class",
  "language" : "swift",
  "module" : "Video Toolbox",
  "overview" : "## Overview\n\nUse this object to configure a [doc:\/\/com.apple.videotoolbox\/documentation\/VideoToolbox\/VTFrameProcessor]. Query this interface also for important operating details, like the pixel buffer attributes required for frames you submit to the processor.",
  "platforms" : [
    "iOS",
    "iPadOS",
    "Mac Catalyst",
    "macOS",
    "tvOS",
    "visionOS"
  ],
  "rawMarkdown" : "---\nsource: https:\/\/developer.apple.com\/documentation\/VideoToolbox\/VTLowLatencySuperResolutionScalerConfiguration\ncrawled: 2025-12-02T18:02:09Z\n---\n\n# VTLowLatencySuperResolutionScalerConfiguration\n\n**Class**\n\nAn object you use to configure frame processor for low-latency super-resolution scaler processing.\n\n## Declaration\n\n```swift\nclass VTLowLatencySuperResolutionScalerConfiguration\n```\n\n## Overview\n\nUse this object to configure a [doc:\/\/com.apple.videotoolbox\/documentation\/VideoToolbox\/VTFrameProcessor]. Query this interface also for important operating details, like the pixel buffer attributes required for frames you submit to the processor.\n\n\n\n## Initializers\n\n- **init(frameWidth:frameHeight:scaleFactor:)**: Creates a new low-latency super-resolution scaler configuration with specified frame width and height.\n\n## Instance Properties\n\n- **destinationPixelBufferAttributes**: Pixel buffer attributes dictionary that describes requirements for pixel buffers which represent destination frames.\n- **frameHeight**: Height of source frame in pixels.\n- **frameWidth**: Width of source frame in pixels.\n- **scaleFactor**: Scale factor with which you initialized the configuration.\n- **sourcePixelBufferAttributes**: Pixel buffer attributes dictionary that describes requirements for pixel buffers which represent source frames and reference frames.\n- **supportedPixelFormats**\n\n## Type Properties\n\n- **isSupported**: Reports whether the system supports this processor on the current configuration.\n\n## Type Methods\n\n- **supportedScaleFactors(frameWidth:frameHeight:)**\n\n## Inherits From\n\n- NSObject\n\n## Conforms To\n\n- CVarArg\n- CustomDebugStringConvertible\n- CustomStringConvertible\n- Equatable\n- Hashable\n- NSObjectProtocol\n- Sendable\n- SendableMetatype\n- VTFrameProcessorConfiguration\n\n",
  "sections" : [
    {
      "content" : "",
      "items" : [
        {
          "description" : "Creates a new low-latency super-resolution scaler configuration with specified frame width and height.",
          "name" : "init(frameWidth:frameHeight:scaleFactor:)",
          "url" : "https:\/\/developer.apple.com\/documentation\/VideoToolbox\/VTLowLatencySuperResolutionScalerConfiguration\/init(frameWidth:frameHeight:scaleFactor:)"
        }
      ],
      "title" : "Initializers"
    },
    {
      "content" : "",
      "items" : [
        {
          "description" : "Pixel buffer attributes dictionary that describes requirements for pixel buffers which represent destination frames.",
          "name" : "destinationPixelBufferAttributes",
          "url" : "https:\/\/developer.apple.com\/documentation\/VideoToolbox\/VTLowLatencySuperResolutionScalerConfiguration\/destinationPixelBufferAttributes"
        },
        {
          "description" : "Height of source frame in pixels.",
          "name" : "frameHeight",
          "url" : "https:\/\/developer.apple.com\/documentation\/VideoToolbox\/VTLowLatencySuperResolutionScalerConfiguration\/frameHeight"
        },
        {
          "description" : "Width of source frame in pixels.",
          "name" : "frameWidth",
          "url" : "https:\/\/developer.apple.com\/documentation\/VideoToolbox\/VTLowLatencySuperResolutionScalerConfiguration\/frameWidth"
        },
        {
          "description" : "Scale factor with which you initialized the configuration.",
          "name" : "scaleFactor",
          "url" : "https:\/\/developer.apple.com\/documentation\/VideoToolbox\/VTLowLatencySuperResolutionScalerConfiguration\/scaleFactor"
        },
        {
          "description" : "Pixel buffer attributes dictionary that describes requirements for pixel buffers which represent source frames and reference frames.",
          "name" : "sourcePixelBufferAttributes",
          "url" : "https:\/\/developer.apple.com\/documentation\/VideoToolbox\/VTLowLatencySuperResolutionScalerConfiguration\/sourcePixelBufferAttributes"
        },
        {
          "description" : "",
          "name" : "supportedPixelFormats",
          "url" : "https:\/\/developer.apple.com\/documentation\/VideoToolbox\/VTLowLatencySuperResolutionScalerConfiguration\/supportedPixelFormats"
        }
      ],
      "title" : "Instance Properties"
    },
    {
      "content" : "",
      "items" : [
        {
          "description" : "Reports whether the system supports this processor on the current configuration.",
          "name" : "isSupported",
          "url" : "https:\/\/developer.apple.com\/documentation\/VideoToolbox\/VTLowLatencySuperResolutionScalerConfiguration\/isSupported"
        }
      ],
      "title" : "Type Properties"
    },
    {
      "content" : "",
      "items" : [
        {
          "description" : "",
          "name" : "supportedScaleFactors(frameWidth:frameHeight:)",
          "url" : "https:\/\/developer.apple.com\/documentation\/VideoToolbox\/VTLowLatencySuperResolutionScalerConfiguration\/supportedScaleFactors(frameWidth:frameHeight:)"
        }
      ],
      "title" : "Type Methods"
    },
    {
      "content" : "",
      "items" : [
        {
          "name" : "NSObject"
        }
      ],
      "title" : "Inherits From"
    }
  ],
  "source" : "appleJSON",
  "title" : "VTLowLatencySuperResolutionScalerConfiguration",
  "url" : "https:\/\/developer.apple.com\/documentation\/VideoToolbox\/VTLowLatencySuperResolutionScalerConfiguration"
}