{
  "abstract" : "Implement `shouldAcceptInteraction(initialValue:handoffValue)` to provide the initial configuration for new interactions, and to decide if a new interaction should be accepted or rejected. If this function is not implemented, the default implementation will be used which will reject all handoff interactions and will accept all other interactions providing the default configuration.",
  "codeExamples" : [

  ],
  "contentHash" : "d4f29df374a7d5674b6765d8106ab3ab03e2385bf152aad766486bb45385b052",
  "crawledAt" : "2025-12-03T12:27:56Z",
  "declaration" : {
    "code" : "func shouldAcceptInteraction(initialValue: TabletopInteraction.Value, handoffValue: TabletopInteraction.Value?) -> TabletopInteraction.NewInteractionIntent",
    "language" : "swift"
  },
  "id" : "BCE2D60A-D2DE-45E5-9591-209A206F0E79",
  "kind" : "method",
  "language" : "swift",
  "module" : "TabletopKit",
  "overview" : "## Return Value\n\nThe intent that describes the action to be taken on this new interaction (reject or accept with configuration)",
  "platforms" : [
    "visionOS"
  ],
  "rawMarkdown" : "---\nsource: https:\/\/developer.apple.com\/documentation\/TabletopKit\/TabletopInteraction\/Delegate\/shouldAcceptInteraction(initialValue:handoffValue:)\ncrawled: 2025-12-03T12:27:56Z\n---\n\n# shouldAcceptInteraction(initialValue:handoffValue:)\n\n**Instance Method**\n\nImplement `shouldAcceptInteraction(initialValue:handoffValue)` to provide the initial configuration for new interactions, and to decide if a new interaction should be accepted or rejected. If this function is not implemented, the default implementation will be used which will reject all handoff interactions and will accept all other interactions providing the default configuration.\n\n## Declaration\n\n```swift\nfunc shouldAcceptInteraction(initialValue: TabletopInteraction.Value, handoffValue: TabletopInteraction.Value?) -> TabletopInteraction.NewInteractionIntent\n```\n\n## Parameters\n\n- **initialValue**: The initial `Value` for this interaction, calculated using the default configuration and constants.\n- **handoffValue**: If not `nil`, this interaction is trying to take control of an equipment already controlled by another interaction, causing a “handoff” of the equipment. The value provides the most recent data of the interaction that is currently controlling the equipment.\n\n## Return Value\n\nThe intent that describes the action to be taken on this new interaction (reject or accept with configuration)\n\n## Accepting interactions\n\n- **shouldAcceptDirectInteraction(initialValue:handoffValue:)**: Implement `shouldAcceptDirectInteraction(initialValue:handoffValue)` to provide the constants and initial configuration for the new direct interaction, and to decide if the new interaction should be accepted or rejected. If the function is not implemented, the default implementation will be used, which will call into the more generic `shouldAcceptInteraction(initialValue:handoffValue)`.\n- **shouldAcceptIndirectInteraction(initialValue:handoffValue:)**: Implement `shouldAcceptIndirectInteraction(initialValue:handoffValue)` to provide the constants and initial configuration for the new indirect interaction, and to decide if the new interaction should be accepted or rejected. If the function is not implemented, the default implementation will be used, which will call into the more generic `shouldAcceptInteraction(initialValue:handoffValue)`.\n\n",
  "sections" : [
    {
      "content" : "",
      "items" : [
        {
          "description" : "Implement `shouldAcceptDirectInteraction(initialValue:handoffValue)` to provide the constants and initial configuration for the new direct interaction, and to decide if the new interaction should be accepted or rejected. If the function is not implemented, the default implementation will be used, which will call into the more generic `shouldAcceptInteraction(initialValue:handoffValue)`.",
          "name" : "shouldAcceptDirectInteraction(initialValue:handoffValue:)",
          "url" : "https:\/\/developer.apple.com\/documentation\/TabletopKit\/TabletopInteraction\/Delegate\/shouldAcceptDirectInteraction(initialValue:handoffValue:)"
        },
        {
          "description" : "Implement `shouldAcceptIndirectInteraction(initialValue:handoffValue)` to provide the constants and initial configuration for the new indirect interaction, and to decide if the new interaction should be accepted or rejected. If the function is not implemented, the default implementation will be used, which will call into the more generic `shouldAcceptInteraction(initialValue:handoffValue)`.",
          "name" : "shouldAcceptIndirectInteraction(initialValue:handoffValue:)",
          "url" : "https:\/\/developer.apple.com\/documentation\/TabletopKit\/TabletopInteraction\/Delegate\/shouldAcceptIndirectInteraction(initialValue:handoffValue:)"
        }
      ],
      "title" : "Accepting interactions"
    }
  ],
  "source" : "appleJSON",
  "title" : "shouldAcceptInteraction(initialValue:handoffValue:)",
  "url" : "https:\/\/developer.apple.com\/documentation\/TabletopKit\/TabletopInteraction\/Delegate\/shouldAcceptInteraction(initialValue:handoffValue:)"
}