{
  "abstract" : "Returns TRUE if the device connection was generated by the remote host.",
  "codeExamples" : [

  ],
  "contentHash" : "876171507c28c9e377cc4e0c7257b2792224da5904ffd0e61770e93d381e149f",
  "crawledAt" : "2025-12-06T09:34:42Z",
  "declaration" : {
    "code" : "func isIncoming() -> Bool",
    "language" : "swift"
  },
  "id" : "63A5B046-38F3-4253-B4AC-532A4D859F26",
  "kind" : "method",
  "language" : "swift",
  "module" : "IOBluetooth",
  "overview" : "## Return Value\n\nReturns TRUE if the device connection was generated by the remote host.\n\n## Discussion\n\nReturns TRUE if the device connection was generated by the remote host. False if the connection was generated by some other device that connected to the local host.\n\nNOTE: This method is only available in macOS 10.2.7 (Bluetooth v1.3) or later.",
  "platforms" : [
    "macOS"
  ],
  "rawMarkdown" : "---\nsource: https:\/\/developer.apple.com\/documentation\/IOBluetooth\/IOBluetoothDevice\/isIncoming()\ncrawled: 2025-12-06T09:34:42Z\n---\n\n# isIncoming()\n\n**Instance Method**\n\nReturns TRUE if the device connection was generated by the remote host.\n\n## Declaration\n\n```swift\nfunc isIncoming() -> Bool\n```\n\n## Return Value\n\nReturns TRUE if the device connection was generated by the remote host.\n\n## Discussion\n\nReturns TRUE if the device connection was generated by the remote host. False if the connection was generated by some other device that connected to the local host.\n\nNOTE: This method is only available in macOS 10.2.7 (Bluetooth v1.3) or later.\n\n",
  "sections" : [

  ],
  "source" : "appleJSON",
  "title" : "isIncoming()",
  "url" : "https:\/\/developer.apple.com\/documentation\/IOBluetooth\/IOBluetoothDevice\/isIncoming()"
}