{
  "abstract" : "Issues a remote name request to the target device.",
  "codeExamples" : [

  ],
  "contentHash" : "b5680b91994b65ffece19f2812e294a9d9ec503112aef22bd3b46ced37b7dfbf",
  "crawledAt" : "2025-12-06T08:11:49Z",
  "declaration" : {
    "code" : "func remoteNameRequest(_ target: Any!) -> IOReturn",
    "language" : "swift"
  },
  "id" : "5ECA7DBC-947D-4560-B799-459B375CEA1B",
  "kind" : "method",
  "language" : "swift",
  "module" : "IOBluetooth",
  "overview" : "## Return Value\n\nReturns kIOReturnSuccess if the remote name request was successfully issued (and if synchronous, if the request completed successfully).\n\n## Discussion\n\nIf a target is specified, the request is asynchronous and on completion of the request, the method\n\nwill be called on the specified target. If no target is specified, the request is made synchronously and won’t return until the request is complete. This call with operate with the default page timeout value. If a different page timeout value is desired, the method -remoteNameRequest:withPageTimeout: should be used instead.",
  "platforms" : [
    "macOS"
  ],
  "rawMarkdown" : "---\nsource: https:\/\/developer.apple.com\/documentation\/IOBluetooth\/IOBluetoothDevice\/remoteNameRequest(_:)\ncrawled: 2025-12-06T08:11:49Z\n---\n\n# remoteNameRequest(_:)\n\n**Instance Method**\n\nIssues a remote name request to the target device.\n\n## Declaration\n\n```swift\nfunc remoteNameRequest(_ target: Any!) -> IOReturn\n```\n\n## Parameters\n\n- **target**: The target to message when the remote name request is complete\n\n## Return Value\n\nReturns kIOReturnSuccess if the remote name request was successfully issued (and if synchronous, if the request completed successfully).\n\n## Discussion\n\nIf a target is specified, the request is asynchronous and on completion of the request, the method\n\n- (void)remoteNameRequestComplete:(IOBluetoothDevice *)device status:(IOReturn)status;\n\nwill be called on the specified target. If no target is specified, the request is made synchronously and won’t return until the request is complete. This call with operate with the default page timeout value. If a different page timeout value is desired, the method -remoteNameRequest:withPageTimeout: should be used instead.\n\n",
  "sections" : [

  ],
  "source" : "appleJSON",
  "title" : "remoteNameRequest(_:)",
  "url" : "https:\/\/developer.apple.com\/documentation\/IOBluetooth\/IOBluetoothDevice\/remoteNameRequest(_:)"
}