{
  "abstract" : "Copy a remote file to a local path",
  "codeExamples" : [

  ],
  "contentHash" : "a488297bef2da303d784d0918641d9ac9fe119a194119502912343e2fd1004d3",
  "crawledAt" : "2025-12-06T09:29:50Z",
  "declaration" : {
    "code" : "func copyRemoteFile(_ inRemoteFileName: String!, toLocalPath inLocalPathAndName: String!) -> OBEXError",
    "language" : "swift"
  },
  "id" : "71A6CB1B-A745-4DC5-A36D-970640CB2582",
  "kind" : "method",
  "language" : "swift",
  "module" : "IOBluetooth",
  "overview" : "## Return Value\n\nkOBEXSuccess, kOBEXSessionBusyError, or kOBEXBadArgumentError. initially. Further results returned through the fileTransferServicesGetComplete: and fileTransferServicesGetProgress: delegate methods if initially successful.\n\n## Discussion\n\nEquivalent to ‘cp remotePath\/remoteFileName localPathAndName’.",
  "platforms" : [
    "macOS"
  ],
  "rawMarkdown" : "---\nsource: https:\/\/developer.apple.com\/documentation\/IOBluetooth\/OBEXFileTransferServices\/copyRemoteFile(_:toLocalPath:)\ncrawled: 2025-12-06T09:29:50Z\n---\n\n# copyRemoteFile(_:toLocalPath:)\n\n**Instance Method**\n\nCopy a remote file to a local path\n\n## Declaration\n\n```swift\nfunc copyRemoteFile(_ inRemoteFileName: String!, toLocalPath inLocalPathAndName: String!) -> OBEXError\n```\n\n## Parameters\n\n- **inRemoteFileName**: The name of the remote file to get\n- **inLocalPathAndName**: The path and name of where the received file will go\n\n## Return Value\n\nkOBEXSuccess, kOBEXSessionBusyError, or kOBEXBadArgumentError. initially. Further results returned through the fileTransferServicesGetComplete: and fileTransferServicesGetProgress: delegate methods if initially successful.\n\n## Discussion\n\nEquivalent to ‘cp remotePath\/remoteFileName localPathAndName’.\n\n",
  "sections" : [

  ],
  "source" : "appleJSON",
  "title" : "copyRemoteFile(_:toLocalPath:)",
  "url" : "https:\/\/developer.apple.com\/documentation\/IOBluetooth\/OBEXFileTransferServices\/copyRemoteFile(_:toLocalPath:)"
}