{
  "abstract" : "Get the value of the page scan period mode for the device.",
  "codeExamples" : [

  ],
  "contentHash" : "7e9801413942c60083ecb54125a48d903d8a0c7d4717bee12605c5f4d332e667",
  "crawledAt" : "2025-12-06T09:34:26Z",
  "declaration" : {
    "code" : "func getPageScanPeriodMode() -> BluetoothPageScanPeriodMode",
    "language" : "swift"
  },
  "id" : "4B7E25F5-3DC3-4C98-8098-B112D6A49E0D",
  "kind" : "method",
  "language" : "swift",
  "module" : "IOBluetooth",
  "overview" : "## Return Value\n\nReturns page scan period mode value for the device.\n\n## Discussion\n\nThis value is only meaningful if the target device has been seen during an inquiry. This can be by checking the result of -getLastInquiryUpdate. If nil is returned, then the device hasn’t been seen.",
  "platforms" : [
    "macOS"
  ],
  "rawMarkdown" : "---\nsource: https:\/\/developer.apple.com\/documentation\/IOBluetooth\/IOBluetoothDevice\/getPageScanPeriodMode()\ncrawled: 2025-12-06T09:34:26Z\n---\n\n# getPageScanPeriodMode()\n\n**Instance Method**\n\nGet the value of the page scan period mode for the device.\n\n## Declaration\n\n```swift\nfunc getPageScanPeriodMode() -> BluetoothPageScanPeriodMode\n```\n\n## Return Value\n\nReturns page scan period mode value for the device.\n\n## Discussion\n\nThis value is only meaningful if the target device has been seen during an inquiry. This can be by checking the result of -getLastInquiryUpdate. If nil is returned, then the device hasn’t been seen.\n\n",
  "sections" : [

  ],
  "source" : "appleJSON",
  "title" : "getPageScanPeriodMode()",
  "url" : "https:\/\/developer.apple.com\/documentation\/IOBluetooth\/IOBluetoothDevice\/getPageScanPeriodMode()"
}