{
  "abstract" : "Gets an array of service records for the device.",
  "codeExamples" : [

  ],
  "contentHash" : "3bc5af427db7db17934a90a679b2cae235523b0bacf7774f77234d9277f000f6",
  "crawledAt" : "2025-12-06T08:11:02Z",
  "declaration" : {
    "code" : "var services: [Any]! { get }",
    "language" : "swift"
  },
  "id" : "B4A87748-A4D7-4F9D-9547-B58BAE7F9701",
  "kind" : "property",
  "language" : "swift",
  "module" : "IOBluetooth",
  "overview" : "## Return Value\n\nReturns an array of service records for the device if an SDP query has been performed. If no SDP query has been performed, nil is returned.\n\n## Discussion\n\nThe resulting array contains IOBluetoothSDPServiceRecord objects. The service records are only present if an SDP query has been done on the target object. This can be determined by calling -getLastServicesUpdate. It will return the last date\/time of the SDP query. To initiate an SDP query on a device, use -performSDPQuery: as defined above.\n\nInstead of allowing individual clients to query for different services and service attributes, the system request all of the device’s services and service attributes.",
  "platforms" : [
    "macOS"
  ],
  "rawMarkdown" : "---\nsource: https:\/\/developer.apple.com\/documentation\/IOBluetooth\/IOBluetoothDevice\/services\ncrawled: 2025-12-06T08:11:02Z\n---\n\n# services\n\n**Instance Property**\n\nGets an array of service records for the device.\n\n## Declaration\n\n```swift\nvar services: [Any]! { get }\n```\n\n## Return Value\n\nReturns an array of service records for the device if an SDP query has been performed. If no SDP query has been performed, nil is returned.\n\n## Discussion\n\nThe resulting array contains IOBluetoothSDPServiceRecord objects. The service records are only present if an SDP query has been done on the target object. This can be determined by calling -getLastServicesUpdate. It will return the last date\/time of the SDP query. To initiate an SDP query on a device, use -performSDPQuery: as defined above.\n\nInstead of allowing individual clients to query for different services and service attributes, the system request all of the device’s services and service attributes.\n\n",
  "sections" : [

  ],
  "source" : "appleJSON",
  "title" : "services",
  "url" : "https:\/\/developer.apple.com\/documentation\/IOBluetooth\/IOBluetoothDevice\/services"
}