{
  "abstract" : "Create a baseband connection to the device.",
  "codeExamples" : [

  ],
  "contentHash" : "d9136616d7c725fe02bb6a183fc50e50edf23f96440ba49c14cb6e4cbb7b36a9",
  "crawledAt" : "2025-12-06T08:11:37Z",
  "declaration" : {
    "code" : "func openConnection() -> IOReturn",
    "language" : "swift"
  },
  "id" : "A03E2472-0263-4BB9-9306-F945D6EA175C",
  "kind" : "method",
  "language" : "swift",
  "module" : "IOBluetooth",
  "overview" : "## Return Value\n\nReturns kIOReturnSuccess if the connection was successfully created.\n\n## Discussion\n\nThis method is synchronous and will not return until either a connection has been established or the create connection has failed (perhaps timed out). This method does the same thing as calling -openConnection: with a nil target. This call with proceed without authentication required, and using the default page timeout value. If authentication or a non-default page timeout is required the method -openConnection:withPageTimeout:authenticationRequired: should be used instead.\n\nAs of OS X 10.7, this method will no longer mask out “Connection Exists” ‘errors’ with a success result code; your code must account for the cases where the baseband connection is already open.",
  "platforms" : [
    "macOS"
  ],
  "rawMarkdown" : "---\nsource: https:\/\/developer.apple.com\/documentation\/IOBluetooth\/IOBluetoothDevice\/openConnection()\ncrawled: 2025-12-06T08:11:37Z\n---\n\n# openConnection()\n\n**Instance Method**\n\nCreate a baseband connection to the device.\n\n## Declaration\n\n```swift\nfunc openConnection() -> IOReturn\n```\n\n## Return Value\n\nReturns kIOReturnSuccess if the connection was successfully created.\n\n## Discussion\n\nThis method is synchronous and will not return until either a connection has been established or the create connection has failed (perhaps timed out). This method does the same thing as calling -openConnection: with a nil target. This call with proceed without authentication required, and using the default page timeout value. If authentication or a non-default page timeout is required the method -openConnection:withPageTimeout:authenticationRequired: should be used instead.\n\nAs of OS X 10.7, this method will no longer mask out “Connection Exists” ‘errors’ with a success result code; your code must account for the cases where the baseband connection is already open.\n\n",
  "sections" : [

  ],
  "source" : "appleJSON",
  "title" : "openConnection()",
  "url" : "https:\/\/developer.apple.com\/documentation\/IOBluetooth\/IOBluetoothDevice\/openConnection()"
}