{
  "abstract" : "Create a folder on the remote target",
  "codeExamples" : [

  ],
  "contentHash" : "b868fe44c7984c110acdbc6140674a305dc6dc8268d4e80662a208f05dcb4c75",
  "crawledAt" : "2025-12-06T08:06:44Z",
  "declaration" : {
    "code" : "func createFolder(_ inDirName: String!) -> OBEXError",
    "language" : "swift"
  },
  "id" : "3E3C5FBB-4919-4C5A-A4D1-2DDB9282D674",
  "kind" : "method",
  "language" : "swift",
  "module" : "IOBluetooth",
  "overview" : "## Return Value\n\nkOBEXSuccess, kOBEXSessionBusyError, or kOBEXBadArgumentError initially. Further results returned through the fileTransferServicesCreateFolderComplete delegate method if initially successful.\n\n## Discussion\n\nEquivalent to ‘mkdir dirName’.",
  "platforms" : [
    "macOS"
  ],
  "rawMarkdown" : "---\nsource: https:\/\/developer.apple.com\/documentation\/IOBluetooth\/OBEXFileTransferServices\/createFolder(_:)\ncrawled: 2025-12-06T08:06:44Z\n---\n\n# createFolder(_:)\n\n**Instance Method**\n\nCreate a folder on the remote target\n\n## Declaration\n\n```swift\nfunc createFolder(_ inDirName: String!) -> OBEXError\n```\n\n## Parameters\n\n- **inDirName**: The name of the folder to be created\n\n## Return Value\n\nkOBEXSuccess, kOBEXSessionBusyError, or kOBEXBadArgumentError initially. Further results returned through the fileTransferServicesCreateFolderComplete delegate method if initially successful.\n\n## Discussion\n\nEquivalent to ‘mkdir dirName’.\n\n",
  "sections" : [

  ],
  "source" : "appleJSON",
  "title" : "createFolder(_:)",
  "url" : "https:\/\/developer.apple.com\/documentation\/IOBluetooth\/OBEXFileTransferServices\/createFolder(_:)"
}