{
  "abstract" : "Positions a music event iterator at the previous event on a music track.",
  "codeExamples" : [
    {
      "code" : "\/\/ Points iterator just beyond the final event on its music track\nMusicEventIteratorSeek (myIterator, kMusicTimeStamp_EndOfTrack);\n \nbool hasPreviousEvent;\nMusicEventIteratorHasPreviousEvent (myIterator, &hasPreviousEvent);\nwhile (hasPreviousEvent) {\n    MusicEventIteratorPreviousEvent (myIterator);\n        \/\/ do work here\n    MusicEventIteratorHasPreviousEvent (myIterator, &hasPreviousEvent);\n}",
      "language" : "objc"
    }
  ],
  "contentHash" : "a39959008402845467b5f5233af8b2af5a930bd1ca3583ce8b31b7070626041d",
  "crawledAt" : "2025-12-04T00:36:37Z",
  "declaration" : {
    "code" : "func MusicEventIteratorPreviousEvent(_ inIterator: MusicEventIterator) -> OSStatus",
    "language" : "swift"
  },
  "id" : "1543760B-86ED-4139-AF38-B40B7AA23F91",
  "kind" : "function",
  "language" : "swift",
  "module" : "Audio Toolbox",
  "overview" : "## Return Value\n\nA result code.\n\n## Discussion\n\nUse this function to decrement a music event iterator, moving it backward through a music track’s events.\n\nIf an iterator is at the first event of a track when you call this function, the iterator position remains unchanged and this function returns an error.\n\nThe following code snippet illustrates how to use a music event iterator to proceed backward along a music track, from the end:",
  "platforms" : [
    "iOS",
    "iPadOS",
    "Mac Catalyst",
    "macOS",
    "tvOS",
    "visionOS"
  ],
  "rawMarkdown" : "---\nsource: https:\/\/developer.apple.com\/documentation\/AudioToolbox\/MusicEventIteratorPreviousEvent(_:)\ncrawled: 2025-12-04T00:36:37Z\n---\n\n# MusicEventIteratorPreviousEvent(_:)\n\n**Function**\n\nPositions a music event iterator at the previous event on a music track.\n\n## Declaration\n\n```swift\nfunc MusicEventIteratorPreviousEvent(_ inIterator: MusicEventIterator) -> OSStatus\n```\n\n## Parameters\n\n- **inIterator**: The music event iterator to reposition.\n\n## Return Value\n\nA result code.\n\n## Discussion\n\nUse this function to decrement a music event iterator, moving it backward through a music track’s events.\n\nIf an iterator is at the first event of a track when you call this function, the iterator position remains unchanged and this function returns an error.\n\nThe following code snippet illustrates how to use a music event iterator to proceed backward along a music track, from the end:\n\n```objc\n\/\/ Points iterator just beyond the final event on its music track\nMusicEventIteratorSeek (myIterator, kMusicTimeStamp_EndOfTrack);\n \nbool hasPreviousEvent;\nMusicEventIteratorHasPreviousEvent (myIterator, &hasPreviousEvent);\nwhile (hasPreviousEvent) {\n    MusicEventIteratorPreviousEvent (myIterator);\n        \/\/ do work here\n    MusicEventIteratorHasPreviousEvent (myIterator, &hasPreviousEvent);\n}\n```\n\n## Iterating Over Music Events\n\n- **NewMusicEventIterator(_:_:)**: Creates a new music event iterator.\n- **DisposeMusicEventIterator(_:)**: Disposes of a music event iterator.\n- **MusicEventIteratorNextEvent(_:)**: Positions a music event iterator at the next event on a music track.\n- **MusicEventIteratorSeek(_:_:)**: Positions a music event iterator at a specified timestamp, in beats.\n- **MusicEventIteratorDeleteEvent(_:)**: Deletes the event at a music event iterator’s current position.\n- **MusicEventIteratorGetEventInfo(_:_:_:_:_:)**: Gets information about the event at a music event iterator’s current position.\n- **MusicEventIteratorHasCurrentEvent(_:_:)**: Indicates whether or not a music track contains an event at the music event iterator’s current position.\n- **MusicEventIteratorHasNextEvent(_:_:)**: Indicates whether or not a music track contains an event beyond the music event iterator’s current position.\n- **MusicEventIteratorHasPreviousEvent(_:_:)**: Indicates whether or not a music track contains an event before the music event iterator’s current position.\n- **MusicEventIteratorSetEventInfo(_:_:_:)**: Sets information for the event at a music event iterator’s current position.\n- **MusicEventIteratorSetEventTime(_:_:)**: Sets the timestamp for the event at a music event iterator’s current position.\n- **MusicEventIterator**: A music event iterator sequentially handles events on a music track.\n- **MusicEventType**: MIDI and other music event types, used by music event iterator functions.\n- **ExtendedNoteOnEvent**: Describes a note-on event with extended parameters.\n- **ExtendedTempoEvent**: Describes a music track tempo in beats-per-minute.\n\n",
  "sections" : [
    {
      "content" : "",
      "items" : [
        {
          "description" : "Creates a new music event iterator.",
          "name" : "NewMusicEventIterator(_:_:)",
          "url" : "https:\/\/developer.apple.com\/documentation\/AudioToolbox\/NewMusicEventIterator(_:_:)"
        },
        {
          "description" : "Disposes of a music event iterator.",
          "name" : "DisposeMusicEventIterator(_:)",
          "url" : "https:\/\/developer.apple.com\/documentation\/AudioToolbox\/DisposeMusicEventIterator(_:)"
        },
        {
          "description" : "Positions a music event iterator at the next event on a music track.",
          "name" : "MusicEventIteratorNextEvent(_:)",
          "url" : "https:\/\/developer.apple.com\/documentation\/AudioToolbox\/MusicEventIteratorNextEvent(_:)"
        },
        {
          "description" : "Positions a music event iterator at a specified timestamp, in beats.",
          "name" : "MusicEventIteratorSeek(_:_:)",
          "url" : "https:\/\/developer.apple.com\/documentation\/AudioToolbox\/MusicEventIteratorSeek(_:_:)"
        },
        {
          "description" : "Deletes the event at a music event iterator’s current position.",
          "name" : "MusicEventIteratorDeleteEvent(_:)",
          "url" : "https:\/\/developer.apple.com\/documentation\/AudioToolbox\/MusicEventIteratorDeleteEvent(_:)"
        },
        {
          "description" : "Gets information about the event at a music event iterator’s current position.",
          "name" : "MusicEventIteratorGetEventInfo(_:_:_:_:_:)",
          "url" : "https:\/\/developer.apple.com\/documentation\/AudioToolbox\/MusicEventIteratorGetEventInfo(_:_:_:_:_:)"
        },
        {
          "description" : "Indicates whether or not a music track contains an event at the music event iterator’s current position.",
          "name" : "MusicEventIteratorHasCurrentEvent(_:_:)",
          "url" : "https:\/\/developer.apple.com\/documentation\/AudioToolbox\/MusicEventIteratorHasCurrentEvent(_:_:)"
        },
        {
          "description" : "Indicates whether or not a music track contains an event beyond the music event iterator’s current position.",
          "name" : "MusicEventIteratorHasNextEvent(_:_:)",
          "url" : "https:\/\/developer.apple.com\/documentation\/AudioToolbox\/MusicEventIteratorHasNextEvent(_:_:)"
        },
        {
          "description" : "Indicates whether or not a music track contains an event before the music event iterator’s current position.",
          "name" : "MusicEventIteratorHasPreviousEvent(_:_:)",
          "url" : "https:\/\/developer.apple.com\/documentation\/AudioToolbox\/MusicEventIteratorHasPreviousEvent(_:_:)"
        },
        {
          "description" : "Sets information for the event at a music event iterator’s current position.",
          "name" : "MusicEventIteratorSetEventInfo(_:_:_:)",
          "url" : "https:\/\/developer.apple.com\/documentation\/AudioToolbox\/MusicEventIteratorSetEventInfo(_:_:_:)"
        },
        {
          "description" : "Sets the timestamp for the event at a music event iterator’s current position.",
          "name" : "MusicEventIteratorSetEventTime(_:_:)",
          "url" : "https:\/\/developer.apple.com\/documentation\/AudioToolbox\/MusicEventIteratorSetEventTime(_:_:)"
        },
        {
          "description" : "A music event iterator sequentially handles events on a music track.",
          "name" : "MusicEventIterator",
          "url" : "https:\/\/developer.apple.com\/documentation\/AudioToolbox\/MusicEventIterator"
        },
        {
          "description" : "MIDI and other music event types, used by music event iterator functions.",
          "name" : "MusicEventType",
          "url" : "https:\/\/developer.apple.com\/documentation\/AudioToolbox\/MusicEventType"
        },
        {
          "description" : "Describes a note-on event with extended parameters.",
          "name" : "ExtendedNoteOnEvent",
          "url" : "https:\/\/developer.apple.com\/documentation\/AudioToolbox\/ExtendedNoteOnEvent"
        },
        {
          "description" : "Describes a music track tempo in beats-per-minute.",
          "name" : "ExtendedTempoEvent",
          "url" : "https:\/\/developer.apple.com\/documentation\/AudioToolbox\/ExtendedTempoEvent"
        }
      ],
      "title" : "Iterating Over Music Events"
    }
  ],
  "source" : "appleJSON",
  "title" : "MusicEventIteratorPreviousEvent(_:)",
  "url" : "https:\/\/developer.apple.com\/documentation\/AudioToolbox\/MusicEventIteratorPreviousEvent(_:)"
}