{
  "abstract" : "Specifies whether or not to route audio to the speaker (instead of to the receiver) when no other audio route, such as a headset, is connected.",
  "codeExamples" : [

  ],
  "contentHash" : "57556f1dfc2cde6f2cee618b339cf7aec08ab149c2339c235971f9a3a96e56dc",
  "crawledAt" : "2025-12-09T15:38:35Z",
  "declaration" : {
    "code" : "var kAudioSessionProperty_OverrideCategoryDefaultToSpeaker: Int { get }",
    "language" : "swift"
  },
  "id" : "F1E241A0-34A5-4D55-B48A-8B0179666D2C",
  "kind" : "unknown",
  "language" : "swift",
  "module" : "Audio Toolbox",
  "overview" : "## Discussion\n\nA read\/write `UInt32` value. By default, the value of this property is `FALSE` (`0`).\n\nThis property retains its value through an audio route change (such as when plugging in or unplugging a headset), and upon interruption; it reverts to its default value only upon an audio session category change.  This property can be used only with the [doc:\/\/com.apple.audiotoolbox\/documentation\/AudioToolbox\/kAudioSessionCategory_PlayAndRecord] (or the equivalent [doc:\/\/com.apple.documentation\/documentation\/AVFAudio\/AVAudioSession\/Category-swift.struct\/playAndRecord]) category.\n\nSee also [doc:\/\/com.apple.audiotoolbox\/documentation\/AudioToolbox\/kAudioSessionProperty_OverrideAudioRoute].",
  "platforms" : [
    "iOS",
    "iPadOS",
    "Mac Catalyst",
    "macOS",
    "visionOS"
  ],
  "rawMarkdown" : "---\nsource: https:\/\/developer.apple.com\/documentation\/AudioToolbox\/kAudioSessionProperty_OverrideCategoryDefaultToSpeaker\ncrawled: 2025-12-09T15:38:35Z\n---\n\n# kAudioSessionProperty_OverrideCategoryDefaultToSpeaker\n\n**Global Variable**\n\nSpecifies whether or not to route audio to the speaker (instead of to the receiver) when no other audio route, such as a headset, is connected.\n\n## Declaration\n\n```swift\nvar kAudioSessionProperty_OverrideCategoryDefaultToSpeaker: Int { get }\n```\n\n## Discussion\n\nA read\/write `UInt32` value. By default, the value of this property is `FALSE` (`0`).\n\nThis property retains its value through an audio route change (such as when plugging in or unplugging a headset), and upon interruption; it reverts to its default value only upon an audio session category change.  This property can be used only with the [doc:\/\/com.apple.audiotoolbox\/documentation\/AudioToolbox\/kAudioSessionCategory_PlayAndRecord] (or the equivalent [doc:\/\/com.apple.documentation\/documentation\/AVFAudio\/AVAudioSession\/Category-swift.struct\/playAndRecord]) category.\n\nSee also [doc:\/\/com.apple.audiotoolbox\/documentation\/AudioToolbox\/kAudioSessionProperty_OverrideAudioRoute].\n\n## Constants\n\n- **kAudioSessionProperty_PreferredHardwareSampleRate**: Your preferred hardware sample rate for the audio session. A read\/write `Float64` value. The actual sample rate may be different and can be obtained using the `kAudioSessionProperty_CurrentHardwareSampleRate` property.\n- **kAudioSessionProperty_PreferredHardwareIOBufferDuration**: Your preferred hardware I\/O buffer duration in seconds. Do not set this property unless you require lower I\/O latency than is provided by default.\n- **kAudioSessionProperty_AudioCategory**: The category for the audio session. A read\/write `UInt32` value.\n- **kAudioSessionProperty_AudioRouteChange**: The reason the audio route changed.\n- **kAudioSessionProperty_CurrentHardwareSampleRate**: Indicates the current hardware sample rate. A read-only `Float64` value.\n- **kAudioSessionProperty_CurrentHardwareInputNumberChannels**: Indicates the current number of audio hardware input channels. A read-only `UInt32` value.\n- **kAudioSessionProperty_CurrentHardwareOutputNumberChannels**: Indicates the current number of audio hardware output channels. A read-only `UInt32` value.\n- **kAudioSessionProperty_CurrentHardwareOutputVolume**: Indicates the current audio output volume as `Float32` value between 0.0 and 1.0. Read-only. This value is available to your app by way of a property listener callback function. See [doc:\/\/com.apple.audiotoolbox\/documentation\/AudioToolbox\/AudioSessionAddPropertyListener(_:_:_:)].\n- **kAudioSessionProperty_CurrentHardwareInputLatency**: Indicates the current hardware input latency, in seconds, as a read-only `Float32` value.\n- **kAudioSessionProperty_CurrentHardwareOutputLatency**: Indicates the current hardware output latency, in seconds, as a read-only `Float32` value.\n- **kAudioSessionProperty_CurrentHardwareIOBufferDuration**: Indicates the current hardware IO buffer duration, in seconds, as a read-only `Float32` value.\n- **kAudioSessionProperty_OtherAudioIsPlaying**: Indicates whether or not another app (typically, the iPod app) is currently playing audio. Read-only. A non-zero `UInt32` value indicates that other audio is playing.\n- **kAudioSessionProperty_OverrideAudioRoute**: Specifies whether or not to override the audio session category’s typical audio route.\n- **kAudioSessionProperty_AudioInputAvailable**: Indicates if audio input is available (a nonzero value) or not (a value of 0).\n- **kAudioSessionProperty_ServerDied**: Indicates if the audio server has died (indicated by a nonzero `UInt32` value) or is still running (a value of 0).\n\n",
  "sections" : [
    {
      "content" : "",
      "items" : [
        {
          "description" : "Your preferred hardware sample rate for the audio session. A read\/write `Float64` value. The actual sample rate may be different and can be obtained using the `kAudioSessionProperty_CurrentHardwareSampleRate` property.",
          "name" : "kAudioSessionProperty_PreferredHardwareSampleRate",
          "url" : "https:\/\/developer.apple.com\/documentation\/AudioToolbox\/kAudioSessionProperty_PreferredHardwareSampleRate"
        },
        {
          "description" : "Your preferred hardware I\/O buffer duration in seconds. Do not set this property unless you require lower I\/O latency than is provided by default.",
          "name" : "kAudioSessionProperty_PreferredHardwareIOBufferDuration",
          "url" : "https:\/\/developer.apple.com\/documentation\/AudioToolbox\/kAudioSessionProperty_PreferredHardwareIOBufferDuration"
        },
        {
          "description" : "The category for the audio session. A read\/write `UInt32` value.",
          "name" : "kAudioSessionProperty_AudioCategory",
          "url" : "https:\/\/developer.apple.com\/documentation\/AudioToolbox\/kAudioSessionProperty_AudioCategory"
        },
        {
          "description" : "The reason the audio route changed.",
          "name" : "kAudioSessionProperty_AudioRouteChange",
          "url" : "https:\/\/developer.apple.com\/documentation\/AudioToolbox\/kAudioSessionProperty_AudioRouteChange"
        },
        {
          "description" : "Indicates the current hardware sample rate. A read-only `Float64` value.",
          "name" : "kAudioSessionProperty_CurrentHardwareSampleRate",
          "url" : "https:\/\/developer.apple.com\/documentation\/AudioToolbox\/kAudioSessionProperty_CurrentHardwareSampleRate"
        },
        {
          "description" : "Indicates the current number of audio hardware input channels. A read-only `UInt32` value.",
          "name" : "kAudioSessionProperty_CurrentHardwareInputNumberChannels",
          "url" : "https:\/\/developer.apple.com\/documentation\/AudioToolbox\/kAudioSessionProperty_CurrentHardwareInputNumberChannels"
        },
        {
          "description" : "Indicates the current number of audio hardware output channels. A read-only `UInt32` value.",
          "name" : "kAudioSessionProperty_CurrentHardwareOutputNumberChannels",
          "url" : "https:\/\/developer.apple.com\/documentation\/AudioToolbox\/kAudioSessionProperty_CurrentHardwareOutputNumberChannels"
        },
        {
          "description" : "Indicates the current audio output volume as `Float32` value between 0.0 and 1.0. Read-only. This value is available to your app by way of a property listener callback function. See [doc:\/\/com.apple.audiotoolbox\/documentation\/AudioToolbox\/AudioSessionAddPropertyListener(_:_:_:)].",
          "name" : "kAudioSessionProperty_CurrentHardwareOutputVolume",
          "url" : "https:\/\/developer.apple.com\/documentation\/AudioToolbox\/kAudioSessionProperty_CurrentHardwareOutputVolume"
        },
        {
          "description" : "Indicates the current hardware input latency, in seconds, as a read-only `Float32` value.",
          "name" : "kAudioSessionProperty_CurrentHardwareInputLatency",
          "url" : "https:\/\/developer.apple.com\/documentation\/AudioToolbox\/kAudioSessionProperty_CurrentHardwareInputLatency"
        },
        {
          "description" : "Indicates the current hardware output latency, in seconds, as a read-only `Float32` value.",
          "name" : "kAudioSessionProperty_CurrentHardwareOutputLatency",
          "url" : "https:\/\/developer.apple.com\/documentation\/AudioToolbox\/kAudioSessionProperty_CurrentHardwareOutputLatency"
        },
        {
          "description" : "Indicates the current hardware IO buffer duration, in seconds, as a read-only `Float32` value.",
          "name" : "kAudioSessionProperty_CurrentHardwareIOBufferDuration",
          "url" : "https:\/\/developer.apple.com\/documentation\/AudioToolbox\/kAudioSessionProperty_CurrentHardwareIOBufferDuration"
        },
        {
          "description" : "Indicates whether or not another app (typically, the iPod app) is currently playing audio. Read-only. A non-zero `UInt32` value indicates that other audio is playing.",
          "name" : "kAudioSessionProperty_OtherAudioIsPlaying",
          "url" : "https:\/\/developer.apple.com\/documentation\/AudioToolbox\/kAudioSessionProperty_OtherAudioIsPlaying"
        },
        {
          "description" : "Specifies whether or not to override the audio session category’s typical audio route.",
          "name" : "kAudioSessionProperty_OverrideAudioRoute",
          "url" : "https:\/\/developer.apple.com\/documentation\/AudioToolbox\/kAudioSessionProperty_OverrideAudioRoute"
        },
        {
          "description" : "Indicates if audio input is available (a nonzero value) or not (a value of 0).",
          "name" : "kAudioSessionProperty_AudioInputAvailable",
          "url" : "https:\/\/developer.apple.com\/documentation\/AudioToolbox\/kAudioSessionProperty_AudioInputAvailable"
        },
        {
          "description" : "Indicates if the audio server has died (indicated by a nonzero `UInt32` value) or is still running (a value of 0).",
          "name" : "kAudioSessionProperty_ServerDied",
          "url" : "https:\/\/developer.apple.com\/documentation\/AudioToolbox\/kAudioSessionProperty_ServerDied"
        }
      ],
      "title" : "Constants"
    }
  ],
  "source" : "appleJSON",
  "title" : "kAudioSessionProperty_OverrideCategoryDefaultToSpeaker",
  "url" : "https:\/\/developer.apple.com\/documentation\/AudioToolbox\/kAudioSessionProperty_OverrideCategoryDefaultToSpeaker"
}