{
  "abstract" : "Details on the available audio input sources.",
  "codeExamples" : [

  ],
  "contentHash" : "d2412e4a5126974904332244521aa7024e1de68d468e7590ec04687802d82a4a",
  "crawledAt" : "2025-12-09T15:38:39Z",
  "declaration" : {
    "code" : "var kAudioSessionProperty_InputSources: Int { get }",
    "language" : "swift"
  },
  "id" : "BAAEBA90-1181-444E-9315-503BD3622271",
  "kind" : "unknown",
  "language" : "swift",
  "module" : "Audio Toolbox",
  "overview" : "## Discussion\n\nA [doc:\/\/com.apple.documentation\/documentation\/CoreFoundation\/CFArray] object containing details on the available audio input sources in a USB audio accessory attached through the iPad camera connection kit.\n\n## Discussion\n\nEach element of the array contains a [doc:\/\/com.apple.documentation\/documentation\/CoreFoundation\/CFDictionary] object with the keys and corresponding values described in [doc:\/\/com.apple.audiotoolbox\/documentation\/AudioToolbox\/usb-accessory-audio-source-dictionary-keys].\n\nIf there is no audio input source available from the attached accessory, this property’s value is an empty array.\n\nThis property is read-only. You can employ an [doc:\/\/com.apple.audiotoolbox\/documentation\/AudioToolbox\/AudioSessionPropertyListener] callback function to listen for changes in this property’s value.",
  "platforms" : [
    "iOS",
    "iPadOS",
    "Mac Catalyst",
    "macOS",
    "visionOS"
  ],
  "rawMarkdown" : "---\nsource: https:\/\/developer.apple.com\/documentation\/AudioToolbox\/kAudioSessionProperty_InputSources\ncrawled: 2025-12-09T15:38:39Z\n---\n\n# kAudioSessionProperty_InputSources\n\n**Global Variable**\n\nDetails on the available audio input sources.\n\n## Declaration\n\n```swift\nvar kAudioSessionProperty_InputSources: Int { get }\n```\n\n## Discussion\n\nA [doc:\/\/com.apple.documentation\/documentation\/CoreFoundation\/CFArray] object containing details on the available audio input sources in a USB audio accessory attached through the iPad camera connection kit.\n\n## Discussion\n\nEach element of the array contains a [doc:\/\/com.apple.documentation\/documentation\/CoreFoundation\/CFDictionary] object with the keys and corresponding values described in [doc:\/\/com.apple.audiotoolbox\/documentation\/AudioToolbox\/usb-accessory-audio-source-dictionary-keys].\n\nIf there is no audio input source available from the attached accessory, this property’s value is an empty array.\n\nThis property is read-only. You can employ an [doc:\/\/com.apple.audiotoolbox\/documentation\/AudioToolbox\/AudioSessionPropertyListener] callback function to listen for changes in this property’s value.\n\n## Constants\n\n- **kAudioSessionProperty_PreferredHardwareSampleRate**: Your preferred hardware sample rate for the audio session. A read\/write `Float64` value. The actual sample rate may be different and can be obtained using the `kAudioSessionProperty_CurrentHardwareSampleRate` property.\n- **kAudioSessionProperty_PreferredHardwareIOBufferDuration**: Your preferred hardware I\/O buffer duration in seconds. Do not set this property unless you require lower I\/O latency than is provided by default.\n- **kAudioSessionProperty_AudioCategory**: The category for the audio session. A read\/write `UInt32` value.\n- **kAudioSessionProperty_AudioRouteChange**: The reason the audio route changed.\n- **kAudioSessionProperty_CurrentHardwareSampleRate**: Indicates the current hardware sample rate. A read-only `Float64` value.\n- **kAudioSessionProperty_CurrentHardwareInputNumberChannels**: Indicates the current number of audio hardware input channels. A read-only `UInt32` value.\n- **kAudioSessionProperty_CurrentHardwareOutputNumberChannels**: Indicates the current number of audio hardware output channels. A read-only `UInt32` value.\n- **kAudioSessionProperty_CurrentHardwareOutputVolume**: Indicates the current audio output volume as `Float32` value between 0.0 and 1.0. Read-only. This value is available to your app by way of a property listener callback function. See [doc:\/\/com.apple.audiotoolbox\/documentation\/AudioToolbox\/AudioSessionAddPropertyListener(_:_:_:)].\n- **kAudioSessionProperty_CurrentHardwareInputLatency**: Indicates the current hardware input latency, in seconds, as a read-only `Float32` value.\n- **kAudioSessionProperty_CurrentHardwareOutputLatency**: Indicates the current hardware output latency, in seconds, as a read-only `Float32` value.\n- **kAudioSessionProperty_CurrentHardwareIOBufferDuration**: Indicates the current hardware IO buffer duration, in seconds, as a read-only `Float32` value.\n- **kAudioSessionProperty_OtherAudioIsPlaying**: Indicates whether or not another app (typically, the iPod app) is currently playing audio. Read-only. A non-zero `UInt32` value indicates that other audio is playing.\n- **kAudioSessionProperty_OverrideAudioRoute**: Specifies whether or not to override the audio session category’s typical audio route.\n- **kAudioSessionProperty_AudioInputAvailable**: Indicates if audio input is available (a nonzero value) or not (a value of 0).\n- **kAudioSessionProperty_ServerDied**: Indicates if the audio server has died (indicated by a nonzero `UInt32` value) or is still running (a value of 0).\n\n",
  "sections" : [
    {
      "content" : "",
      "items" : [
        {
          "description" : "Your preferred hardware sample rate for the audio session. A read\/write `Float64` value. The actual sample rate may be different and can be obtained using the `kAudioSessionProperty_CurrentHardwareSampleRate` property.",
          "name" : "kAudioSessionProperty_PreferredHardwareSampleRate",
          "url" : "https:\/\/developer.apple.com\/documentation\/AudioToolbox\/kAudioSessionProperty_PreferredHardwareSampleRate"
        },
        {
          "description" : "Your preferred hardware I\/O buffer duration in seconds. Do not set this property unless you require lower I\/O latency than is provided by default.",
          "name" : "kAudioSessionProperty_PreferredHardwareIOBufferDuration",
          "url" : "https:\/\/developer.apple.com\/documentation\/AudioToolbox\/kAudioSessionProperty_PreferredHardwareIOBufferDuration"
        },
        {
          "description" : "The category for the audio session. A read\/write `UInt32` value.",
          "name" : "kAudioSessionProperty_AudioCategory",
          "url" : "https:\/\/developer.apple.com\/documentation\/AudioToolbox\/kAudioSessionProperty_AudioCategory"
        },
        {
          "description" : "The reason the audio route changed.",
          "name" : "kAudioSessionProperty_AudioRouteChange",
          "url" : "https:\/\/developer.apple.com\/documentation\/AudioToolbox\/kAudioSessionProperty_AudioRouteChange"
        },
        {
          "description" : "Indicates the current hardware sample rate. A read-only `Float64` value.",
          "name" : "kAudioSessionProperty_CurrentHardwareSampleRate",
          "url" : "https:\/\/developer.apple.com\/documentation\/AudioToolbox\/kAudioSessionProperty_CurrentHardwareSampleRate"
        },
        {
          "description" : "Indicates the current number of audio hardware input channels. A read-only `UInt32` value.",
          "name" : "kAudioSessionProperty_CurrentHardwareInputNumberChannels",
          "url" : "https:\/\/developer.apple.com\/documentation\/AudioToolbox\/kAudioSessionProperty_CurrentHardwareInputNumberChannels"
        },
        {
          "description" : "Indicates the current number of audio hardware output channels. A read-only `UInt32` value.",
          "name" : "kAudioSessionProperty_CurrentHardwareOutputNumberChannels",
          "url" : "https:\/\/developer.apple.com\/documentation\/AudioToolbox\/kAudioSessionProperty_CurrentHardwareOutputNumberChannels"
        },
        {
          "description" : "Indicates the current audio output volume as `Float32` value between 0.0 and 1.0. Read-only. This value is available to your app by way of a property listener callback function. See [doc:\/\/com.apple.audiotoolbox\/documentation\/AudioToolbox\/AudioSessionAddPropertyListener(_:_:_:)].",
          "name" : "kAudioSessionProperty_CurrentHardwareOutputVolume",
          "url" : "https:\/\/developer.apple.com\/documentation\/AudioToolbox\/kAudioSessionProperty_CurrentHardwareOutputVolume"
        },
        {
          "description" : "Indicates the current hardware input latency, in seconds, as a read-only `Float32` value.",
          "name" : "kAudioSessionProperty_CurrentHardwareInputLatency",
          "url" : "https:\/\/developer.apple.com\/documentation\/AudioToolbox\/kAudioSessionProperty_CurrentHardwareInputLatency"
        },
        {
          "description" : "Indicates the current hardware output latency, in seconds, as a read-only `Float32` value.",
          "name" : "kAudioSessionProperty_CurrentHardwareOutputLatency",
          "url" : "https:\/\/developer.apple.com\/documentation\/AudioToolbox\/kAudioSessionProperty_CurrentHardwareOutputLatency"
        },
        {
          "description" : "Indicates the current hardware IO buffer duration, in seconds, as a read-only `Float32` value.",
          "name" : "kAudioSessionProperty_CurrentHardwareIOBufferDuration",
          "url" : "https:\/\/developer.apple.com\/documentation\/AudioToolbox\/kAudioSessionProperty_CurrentHardwareIOBufferDuration"
        },
        {
          "description" : "Indicates whether or not another app (typically, the iPod app) is currently playing audio. Read-only. A non-zero `UInt32` value indicates that other audio is playing.",
          "name" : "kAudioSessionProperty_OtherAudioIsPlaying",
          "url" : "https:\/\/developer.apple.com\/documentation\/AudioToolbox\/kAudioSessionProperty_OtherAudioIsPlaying"
        },
        {
          "description" : "Specifies whether or not to override the audio session category’s typical audio route.",
          "name" : "kAudioSessionProperty_OverrideAudioRoute",
          "url" : "https:\/\/developer.apple.com\/documentation\/AudioToolbox\/kAudioSessionProperty_OverrideAudioRoute"
        },
        {
          "description" : "Indicates if audio input is available (a nonzero value) or not (a value of 0).",
          "name" : "kAudioSessionProperty_AudioInputAvailable",
          "url" : "https:\/\/developer.apple.com\/documentation\/AudioToolbox\/kAudioSessionProperty_AudioInputAvailable"
        },
        {
          "description" : "Indicates if the audio server has died (indicated by a nonzero `UInt32` value) or is still running (a value of 0).",
          "name" : "kAudioSessionProperty_ServerDied",
          "url" : "https:\/\/developer.apple.com\/documentation\/AudioToolbox\/kAudioSessionProperty_ServerDied"
        }
      ],
      "title" : "Constants"
    }
  ],
  "source" : "appleJSON",
  "title" : "kAudioSessionProperty_InputSources",
  "url" : "https:\/\/developer.apple.com\/documentation\/AudioToolbox\/kAudioSessionProperty_InputSources"
}