{
  "abstract" : "Time modes for custom patches.",
  "codeExamples" : [

  ],
  "conformsTo" : [
    "BitwiseCopyable",
    "Equatable",
    "Hashable",
    "RawRepresentable",
    "Sendable"
  ],
  "contentHash" : "36faf9ec0604322180898c68b740d3613a1c7dc3d5f278047073db961fff5b66",
  "crawledAt" : "2025-12-09T18:48:40Z",
  "declaration" : {
    "code" : "struct QCPlugInTimeMode",
    "language" : "swift"
  },
  "id" : "815BAFFF-48F9-4100-A13C-0350394AB05B",
  "kind" : "struct",
  "language" : "swift",
  "module" : "Quartz",
  "platforms" : [
    "macOS"
  ],
  "rawMarkdown" : "---\nsource: https:\/\/developer.apple.com\/documentation\/quartz\/qcplugintimemode\ncrawled: 2025-12-09T18:48:40Z\n---\n\n# QCPlugInTimeMode\n\n**Structure**\n\nTime modes for custom patches.\n\n## Declaration\n\n```swift\nstruct QCPlugInTimeMode\n```\n\n## Constants\n\n- **kQCPlugInTimeModeNone**: No time dependency. The custom patch does not depend on time at all. (It does not use the `time`  parameter of the `execute:atTime:withArguments:` method.)\n- **kQCPlugInTimeModeIdle**: An idle time dependency. The custom patch does not depend on time but needs the system to execute it periodically. For example if the custom patch connects to a piece of hardware, to ensure that it pulls data from the hardware, you would set the custom patch time dependency to idle time mode. This time mode is  typically used with providers.]]\n- **kQCPlugInTimeModeTimeBase**: A time base dependency. The custom patch does depend on time explicitly and has a time base defined by the system. (It uses the `time`  parameter of the `execute:atTime:withArguments:` method.)\n\n## Initializers\n\n- **init(_:)**\n- **init(rawValue:)**\n\n## Instance Properties\n\n- **rawValue**\n\n## Structures\n\n- **QCPlugInExecutionMode**: Execution modes for custom patches.\n\n## Conforms To\n\n- BitwiseCopyable\n- Equatable\n- Hashable\n- RawRepresentable\n- Sendable\n\n",
  "sections" : [
    {
      "content" : "",
      "items" : [
        {
          "description" : "No time dependency. The custom patch does not depend on time at all. (It does not use the `time`  parameter of the `execute:atTime:withArguments:` method.)",
          "name" : "kQCPlugInTimeModeNone",
          "url" : "https:\/\/developer.apple.com\/documentation\/Quartz\/kQCPlugInTimeModeNone"
        },
        {
          "description" : "An idle time dependency. The custom patch does not depend on time but needs the system to execute it periodically. For example if the custom patch connects to a piece of hardware, to ensure that it pulls data from the hardware, you would set the custom patch time dependency to idle time mode. This time mode is  typically used with providers.]]",
          "name" : "kQCPlugInTimeModeIdle",
          "url" : "https:\/\/developer.apple.com\/documentation\/Quartz\/kQCPlugInTimeModeIdle"
        },
        {
          "description" : "A time base dependency. The custom patch does depend on time explicitly and has a time base defined by the system. (It uses the `time`  parameter of the `execute:atTime:withArguments:` method.)",
          "name" : "kQCPlugInTimeModeTimeBase",
          "url" : "https:\/\/developer.apple.com\/documentation\/Quartz\/kQCPlugInTimeModeTimeBase"
        }
      ],
      "title" : "Constants"
    },
    {
      "content" : "",
      "items" : [
        {
          "description" : "",
          "name" : "init(_:)",
          "url" : "https:\/\/developer.apple.com\/documentation\/Quartz\/QCPlugInTimeMode\/init(_:)"
        },
        {
          "description" : "",
          "name" : "init(rawValue:)",
          "url" : "https:\/\/developer.apple.com\/documentation\/Quartz\/QCPlugInTimeMode\/init(rawValue:)"
        }
      ],
      "title" : "Initializers"
    },
    {
      "content" : "",
      "items" : [
        {
          "description" : "",
          "name" : "rawValue",
          "url" : "https:\/\/developer.apple.com\/documentation\/Quartz\/QCPlugInTimeMode\/rawValue"
        }
      ],
      "title" : "Instance Properties"
    },
    {
      "content" : "",
      "items" : [
        {
          "description" : "Execution modes for custom patches.",
          "name" : "QCPlugInExecutionMode",
          "url" : "https:\/\/developer.apple.com\/documentation\/Quartz\/QCPlugInExecutionMode"
        }
      ],
      "title" : "Structures"
    }
  ],
  "source" : "appleJSON",
  "title" : "QCPlugInTimeMode",
  "url" : "https:\/\/developer.apple.com\/documentation\/quartz\/qcplugintimemode"
}