{
  "abstract" : "Adds a quick action to be shown by the system when active.",
  "codeExamples" : [
    {
      "code" : "@State private var isPaused = false\n@State private var isQuickActionActive = false\n\nvar body: some View {\n    WorkoutView(isPaused: $isPaused)\n        .accessibilityQuickAction(style: .prompt, isActive: $isQuickActionActive) {\n            Button(isPaused ? \"Resume\" : \"Pause\") {\n                isPaused.toggle()\n            }\n        }\n}",
      "language" : "swift"
    },
    {
      "code" : "@State private var isPlaying = false\n@State private var isQuickActionActive = false\n\nvar body: some View {\n    PlayButton(isPlaying: $isPlaying)\n        .contentShape(.focusEffect, Circle())\n        .accessibilityQuickAction(style: .outline, isActive: $isQuickActionActive) {\n            Button(isPlaying ? \"Pause\" : \"Play\") {\n                isPlaying.toggle()\n            }\n        }\n}",
      "language" : "swift"
    }
  ],
  "contentHash" : "1bf80074bc1fcbb9788b340c0eea7bc57823c473a3752249f33be1a09445c9d8",
  "crawledAt" : "2025-12-02T17:25:18Z",
  "declaration" : {
    "code" : "nonisolated func accessibilityQuickAction<Style, Content>(style: Style, isActive: Binding<Bool>, @ViewBuilder content: () -> Content) -> some View where Style : AccessibilityQuickActionStyle, Content : View\n",
    "language" : "swift"
  },
  "id" : "4FF5F1F2-7258-43C0-A145-8BEDF7892973",
  "kind" : "method",
  "language" : "swift",
  "module" : "SwiftUI",
  "overview" : "## Discussion\n\nThe following example shows how to add a quick action to pause and resume a workout, with the [doc:\/\/com.apple.SwiftUI\/documentation\/SwiftUI\/AccessibilityQuickActionStyle\/prompt] style.\n\nThe following example shows how to add a quick action to play and pause music, with the [doc:\/\/com.apple.SwiftUI\/documentation\/SwiftUI\/AccessibilityQuickActionStyle\/outline] style.",
  "platforms" : [
    "watchOS"
  ],
  "rawMarkdown" : "---\nsource: https:\/\/developer.apple.com\/documentation\/SwiftUI\/View\/accessibilityQuickAction(style:isActive:content:)\ncrawled: 2025-12-02T17:25:18Z\n---\n\n# accessibilityQuickAction(style:isActive:content:)\n\n**Instance Method**\n\nAdds a quick action to be shown by the system when active.\n\n## Declaration\n\n```swift\nnonisolated func accessibilityQuickAction<Style, Content>(style: Style, isActive: Binding<Bool>, @ViewBuilder content: () -> Content) -> some View where Style : AccessibilityQuickActionStyle, Content : View\n\n```\n\n## Discussion\n\nThe following example shows how to add a quick action to pause and resume a workout, with the [doc:\/\/com.apple.SwiftUI\/documentation\/SwiftUI\/AccessibilityQuickActionStyle\/prompt] style.\n\n```swift\n@State private var isPaused = false\n@State private var isQuickActionActive = false\n\nvar body: some View {\n    WorkoutView(isPaused: $isPaused)\n        .accessibilityQuickAction(style: .prompt, isActive: $isQuickActionActive) {\n            Button(isPaused ? \"Resume\" : \"Pause\") {\n                isPaused.toggle()\n            }\n        }\n}\n```\n\nThe following example shows how to add a quick action to play and pause music, with the [doc:\/\/com.apple.SwiftUI\/documentation\/SwiftUI\/AccessibilityQuickActionStyle\/outline] style.\n\n```swift\n@State private var isPlaying = false\n@State private var isQuickActionActive = false\n\nvar body: some View {\n    PlayButton(isPlaying: $isPlaying)\n        .contentShape(.focusEffect, Circle())\n        .accessibilityQuickAction(style: .outline, isActive: $isQuickActionActive) {\n            Button(isPlaying ? \"Pause\" : \"Play\") {\n                isPlaying.toggle()\n            }\n        }\n}\n```\n\n## Offering Quick Actions to people\n\n- **accessibilityQuickAction(style:content:)**: Adds a quick action to be shown by the system when active.\n- **AccessibilityQuickActionStyle**: A type that describes the presentation style of an accessibility quick action.\n\n",
  "sections" : [
    {
      "content" : "",
      "items" : [
        {
          "description" : "Adds a quick action to be shown by the system when active.",
          "name" : "accessibilityQuickAction(style:content:)",
          "url" : "https:\/\/developer.apple.com\/documentation\/SwiftUI\/View\/accessibilityQuickAction(style:content:)"
        },
        {
          "description" : "A type that describes the presentation style of an accessibility quick action.",
          "name" : "AccessibilityQuickActionStyle",
          "url" : "https:\/\/developer.apple.com\/documentation\/SwiftUI\/AccessibilityQuickActionStyle"
        }
      ],
      "title" : "Offering Quick Actions to people"
    }
  ],
  "source" : "appleJSON",
  "title" : "accessibilityQuickAction(style:isActive:content:)",
  "url" : "https:\/\/developer.apple.com\/documentation\/SwiftUI\/View\/accessibilityQuickAction(style:isActive:content:)"
}