{
  "abstract" : "The plain window style.",
  "codeExamples" : [

  ],
  "contentHash" : "7486599b49195b0aa9820af1b5df39ba609c4204385fc0ad7b542c0401e5da18",
  "crawledAt" : "2025-12-02T16:05:23Z",
  "declaration" : {
    "code" : "static var plain: PlainWindowStyle { get }",
    "language" : "swift"
  },
  "id" : "5C8DDA7B-6A3F-478C-AE74-F6CC5B4BAD00",
  "kind" : "property",
  "language" : "swift",
  "module" : "SwiftUI",
  "overview" : "## Discussion\n\nUnlike [doc:\/\/com.apple.SwiftUI\/documentation\/SwiftUI\/WindowStyle\/automatic], a plain window does not receive a glass background in visionOS or window chrome in macOS. Use this style if you want more control over how these elements are used in your window.",
  "platforms" : [
    "macOS",
    "visionOS"
  ],
  "rawMarkdown" : "---\nsource: https:\/\/developer.apple.com\/documentation\/SwiftUI\/WindowStyle\/plain\ncrawled: 2025-12-02T16:05:23Z\n---\n\n# plain\n\n**Type Property**\n\nThe plain window style.\n\n## Declaration\n\n```swift\nstatic var plain: PlainWindowStyle { get }\n```\n\n## Discussion\n\nUnlike [doc:\/\/com.apple.SwiftUI\/documentation\/SwiftUI\/WindowStyle\/automatic], a plain window does not receive a glass background in visionOS or window chrome in macOS. Use this style if you want more control over how these elements are used in your window.\n\n## Getting built-in window styles\n\n- **automatic**: The default window style.\n- **hiddenTitleBar**: A window style which hides both the window’s title and the backing of the titlebar area, allowing more of the window’s content to show.\n- **titleBar**: A window style which displays the title bar section of the window.\n- **volumetric**: A window style that creates a 3D volumetric window.\n\n",
  "sections" : [
    {
      "content" : "",
      "items" : [
        {
          "description" : "The default window style.",
          "name" : "automatic",
          "url" : "https:\/\/developer.apple.com\/documentation\/SwiftUI\/WindowStyle\/automatic"
        },
        {
          "description" : "A window style which hides both the window’s title and the backing of the titlebar area, allowing more of the window’s content to show.",
          "name" : "hiddenTitleBar",
          "url" : "https:\/\/developer.apple.com\/documentation\/SwiftUI\/WindowStyle\/hiddenTitleBar"
        },
        {
          "description" : "A window style which displays the title bar section of the window.",
          "name" : "titleBar",
          "url" : "https:\/\/developer.apple.com\/documentation\/SwiftUI\/WindowStyle\/titleBar"
        },
        {
          "description" : "A window style that creates a 3D volumetric window.",
          "name" : "volumetric",
          "url" : "https:\/\/developer.apple.com\/documentation\/SwiftUI\/WindowStyle\/volumetric"
        }
      ],
      "title" : "Getting built-in window styles"
    }
  ],
  "source" : "appleJSON",
  "title" : "plain",
  "url" : "https:\/\/developer.apple.com\/documentation\/SwiftUI\/WindowStyle\/plain"
}