{
  "abstract" : "Key equivalents consist of a letter, punctuation, or function key that can be combined with an optional set of modifier keys to specify a keyboard shortcut.",
  "codeExamples" : [

  ],
  "conformsTo" : [
    "Copyable",
    "Equatable",
    "ExpressibleByExtendedGraphemeClusterLiteral",
    "ExpressibleByUnicodeScalarLiteral",
    "Hashable",
    "Sendable",
    "SendableMetatype"
  ],
  "contentHash" : "b61ffa47fa81988078b08230a421e54dd54b3e07ce1bfea5dab3a259777f6b46",
  "crawledAt" : "2025-12-02T17:23:07Z",
  "declaration" : {
    "code" : "struct KeyEquivalent",
    "language" : "swift"
  },
  "id" : "D56A0AEE-A070-4B15-BCA1-F9680277B03C",
  "kind" : "struct",
  "language" : "swift",
  "module" : "SwiftUI",
  "overview" : "## Overview\n\nKey equivalents are used to establish keyboard shortcuts to app functionality. Any key can be used as a key equivalent as long as pressing it produces a single character value. Key equivalents are typically initialized using a single-character string literal, with constants for unprintable or hard-to-type values.\n\nThe modifier keys necessary to type a key equivalent are factored in to the resulting keyboard shortcut. That is, a key equivalent whose raw value is the capitalized string “A” corresponds with the keyboard shortcut Command-Shift-A. The exact mapping may depend on the keyboard layout—for example, a key equivalent with the character value “}” produces a shortcut equivalent to Command-Shift-] on ANSI keyboards, but would produce a different shortcut for keyboard layouts where punctuation characters are in different locations.",
  "platforms" : [
    "iOS",
    "iPadOS",
    "Mac Catalyst",
    "macOS",
    "tvOS",
    "visionOS"
  ],
  "rawMarkdown" : "---\nsource: https:\/\/developer.apple.com\/documentation\/SwiftUI\/KeyEquivalent\ncrawled: 2025-12-02T17:23:07Z\n---\n\n# KeyEquivalent\n\n**Structure**\n\nKey equivalents consist of a letter, punctuation, or function key that can be combined with an optional set of modifier keys to specify a keyboard shortcut.\n\n## Declaration\n\n```swift\nstruct KeyEquivalent\n```\n\n## Overview\n\nKey equivalents are used to establish keyboard shortcuts to app functionality. Any key can be used as a key equivalent as long as pressing it produces a single character value. Key equivalents are typically initialized using a single-character string literal, with constants for unprintable or hard-to-type values.\n\nThe modifier keys necessary to type a key equivalent are factored in to the resulting keyboard shortcut. That is, a key equivalent whose raw value is the capitalized string “A” corresponds with the keyboard shortcut Command-Shift-A. The exact mapping may depend on the keyboard layout—for example, a key equivalent with the character value “}” produces a shortcut equivalent to Command-Shift-] on ANSI keyboards, but would produce a different shortcut for keyboard layouts where punctuation characters are in different locations.\n\n## Getting arrow keys\n\n- **upArrow**: Up Arrow (U+F700)\n- **downArrow**: Down Arrow (U+F701)\n- **leftArrow**: Left Arrow (U+F702)\n- **rightArrow**: Right Arrow (U+F703)\n\n## Getting other special keys\n\n- **clear**: Clear (U+F739)\n- **delete**: Delete (U+0008)\n- **deleteForward**: Delete Forward (U+F728)\n- **end**: End (U+F72B)\n- **escape**: Escape (U+001B)\n- **home**: Home (U+F729)\n- **pageDown**: Page Down (U+F72D)\n- **pageUp**: Page Up (U+F72C)\n- **return**: Return (U+000D)\n- **space**: Space (U+0020)\n- **tab**: Tab (U+0009)\n\n## Creating a key equivalent\n\n- **init(_:)**: Creates a new key equivalent from the given character value.\n- **character**: The character value that the key equivalent represents.\n\n## Creating keyboard shortcuts\n\n- **keyboardShortcut(_:)**: Assigns a keyboard shortcut to the modified control.\n- **keyboardShortcut(_:modifiers:)**: Defines a keyboard shortcut and assigns it to the modified control.\n- **keyboardShortcut(_:modifiers:localization:)**: Defines a keyboard shortcut and assigns it to the modified control.\n- **keyboardShortcut**: The keyboard shortcut that buttons in this environment will be triggered with.\n- **KeyboardShortcut**: Keyboard shortcuts describe combinations of keys on a keyboard that the user can press in order to activate a button or toggle.\n- **EventModifiers**: A set of key modifiers that you can add to a gesture.\n\n## Conforms To\n\n- Copyable\n- Equatable\n- ExpressibleByExtendedGraphemeClusterLiteral\n- ExpressibleByUnicodeScalarLiteral\n- Hashable\n- Sendable\n- SendableMetatype\n\n",
  "sections" : [
    {
      "content" : "",
      "items" : [
        {
          "description" : "Up Arrow (U+F700)",
          "name" : "upArrow",
          "url" : "https:\/\/developer.apple.com\/documentation\/SwiftUI\/KeyEquivalent\/upArrow"
        },
        {
          "description" : "Down Arrow (U+F701)",
          "name" : "downArrow",
          "url" : "https:\/\/developer.apple.com\/documentation\/SwiftUI\/KeyEquivalent\/downArrow"
        },
        {
          "description" : "Left Arrow (U+F702)",
          "name" : "leftArrow",
          "url" : "https:\/\/developer.apple.com\/documentation\/SwiftUI\/KeyEquivalent\/leftArrow"
        },
        {
          "description" : "Right Arrow (U+F703)",
          "name" : "rightArrow",
          "url" : "https:\/\/developer.apple.com\/documentation\/SwiftUI\/KeyEquivalent\/rightArrow"
        }
      ],
      "title" : "Getting arrow keys"
    },
    {
      "content" : "",
      "items" : [
        {
          "description" : "Clear (U+F739)",
          "name" : "clear",
          "url" : "https:\/\/developer.apple.com\/documentation\/SwiftUI\/KeyEquivalent\/clear"
        },
        {
          "description" : "Delete (U+0008)",
          "name" : "delete",
          "url" : "https:\/\/developer.apple.com\/documentation\/SwiftUI\/KeyEquivalent\/delete"
        },
        {
          "description" : "Delete Forward (U+F728)",
          "name" : "deleteForward",
          "url" : "https:\/\/developer.apple.com\/documentation\/SwiftUI\/KeyEquivalent\/deleteForward"
        },
        {
          "description" : "End (U+F72B)",
          "name" : "end",
          "url" : "https:\/\/developer.apple.com\/documentation\/SwiftUI\/KeyEquivalent\/end"
        },
        {
          "description" : "Escape (U+001B)",
          "name" : "escape",
          "url" : "https:\/\/developer.apple.com\/documentation\/SwiftUI\/KeyEquivalent\/escape"
        },
        {
          "description" : "Home (U+F729)",
          "name" : "home",
          "url" : "https:\/\/developer.apple.com\/documentation\/SwiftUI\/KeyEquivalent\/home"
        },
        {
          "description" : "Page Down (U+F72D)",
          "name" : "pageDown",
          "url" : "https:\/\/developer.apple.com\/documentation\/SwiftUI\/KeyEquivalent\/pageDown"
        },
        {
          "description" : "Page Up (U+F72C)",
          "name" : "pageUp",
          "url" : "https:\/\/developer.apple.com\/documentation\/SwiftUI\/KeyEquivalent\/pageUp"
        },
        {
          "description" : "Return (U+000D)",
          "name" : "return",
          "url" : "https:\/\/developer.apple.com\/documentation\/SwiftUI\/KeyEquivalent\/return"
        },
        {
          "description" : "Space (U+0020)",
          "name" : "space",
          "url" : "https:\/\/developer.apple.com\/documentation\/SwiftUI\/KeyEquivalent\/space"
        },
        {
          "description" : "Tab (U+0009)",
          "name" : "tab",
          "url" : "https:\/\/developer.apple.com\/documentation\/SwiftUI\/KeyEquivalent\/tab"
        }
      ],
      "title" : "Getting other special keys"
    },
    {
      "content" : "",
      "items" : [
        {
          "description" : "Creates a new key equivalent from the given character value.",
          "name" : "init(_:)",
          "url" : "https:\/\/developer.apple.com\/documentation\/SwiftUI\/KeyEquivalent\/init(_:)"
        },
        {
          "description" : "The character value that the key equivalent represents.",
          "name" : "character",
          "url" : "https:\/\/developer.apple.com\/documentation\/SwiftUI\/KeyEquivalent\/character"
        }
      ],
      "title" : "Creating a key equivalent"
    },
    {
      "content" : "",
      "items" : [
        {
          "description" : "Assigns a keyboard shortcut to the modified control.",
          "name" : "keyboardShortcut(_:)",
          "url" : "https:\/\/developer.apple.com\/documentation\/SwiftUI\/View\/keyboardShortcut(_:)"
        },
        {
          "description" : "Defines a keyboard shortcut and assigns it to the modified control.",
          "name" : "keyboardShortcut(_:modifiers:)",
          "url" : "https:\/\/developer.apple.com\/documentation\/SwiftUI\/View\/keyboardShortcut(_:modifiers:)"
        },
        {
          "description" : "Defines a keyboard shortcut and assigns it to the modified control.",
          "name" : "keyboardShortcut(_:modifiers:localization:)",
          "url" : "https:\/\/developer.apple.com\/documentation\/SwiftUI\/View\/keyboardShortcut(_:modifiers:localization:)"
        },
        {
          "description" : "The keyboard shortcut that buttons in this environment will be triggered with.",
          "name" : "keyboardShortcut",
          "url" : "https:\/\/developer.apple.com\/documentation\/SwiftUI\/EnvironmentValues\/keyboardShortcut"
        },
        {
          "description" : "Keyboard shortcuts describe combinations of keys on a keyboard that the user can press in order to activate a button or toggle.",
          "name" : "KeyboardShortcut",
          "url" : "https:\/\/developer.apple.com\/documentation\/SwiftUI\/KeyboardShortcut"
        },
        {
          "description" : "A set of key modifiers that you can add to a gesture.",
          "name" : "EventModifiers",
          "url" : "https:\/\/developer.apple.com\/documentation\/SwiftUI\/EventModifiers"
        }
      ],
      "title" : "Creating keyboard shortcuts"
    }
  ],
  "source" : "appleJSON",
  "title" : "KeyEquivalent",
  "url" : "https:\/\/developer.apple.com\/documentation\/SwiftUI\/KeyEquivalent"
}