{
  "abstract" : "Whether the alert or confirmation dialog prevents the app from being quit\/terminated by the system or app termination menu item.",
  "codeExamples" : [
    {
      "code" : "struct ConfirmLogoutView: View {\n  @State private var isConfirming = false\n\n  var body: some View {\n    Button(\"Logout\") { isConfirming = true }\n      .confirmationDialog(\n        Text(\"Logout?\"),\n          isPresented: $isConfirming\n        ) {\n          Button(\"Yes\") {\n            \/\/ Handle logout action.\n          }\n        }\n        .dialogPreventsAppTermination(false)\n    }\n}",
      "language" : "swift"
    }
  ],
  "contentHash" : "21c448d04feabde7f8a7c8539efd6cb1d99bf63ce1e3967c82e74d118e34838b",
  "crawledAt" : "2025-12-02T17:23:33Z",
  "declaration" : {
    "code" : "nonisolated func dialogPreventsAppTermination(_ prevents: Bool?) -> some View\n",
    "language" : "swift"
  },
  "id" : "B0B303D0-532E-4310-BE17-02FC71F8DA95",
  "kind" : "method",
  "language" : "swift",
  "module" : "SwiftUI",
  "overview" : "## Discussion\n\nSwiftUI uses the actions passed to the above dialogs to determine whether the dialog should block app termination by default when presented. If all of the following are satisfied, the dialog will not block app quit:\n\nUse this modifier after a `View\/alert` or `View\/confirmationDialog` to specify whether the dialog should prevent app termination. Pass `nil` to explicitly request the automatic behavior\/for the inert version of this modifier.",
  "platforms" : [
    "macOS"
  ],
  "rawMarkdown" : "---\nsource: https:\/\/developer.apple.com\/documentation\/SwiftUI\/View\/dialogPreventsAppTermination(_:)\ncrawled: 2025-12-02T17:23:33Z\n---\n\n# dialogPreventsAppTermination(_:)\n\n**Instance Method**\n\nWhether the alert or confirmation dialog prevents the app from being quit\/terminated by the system or app termination menu item.\n\n## Declaration\n\n```swift\nnonisolated func dialogPreventsAppTermination(_ prevents: Bool?) -> some View\n\n```\n\n## Discussion\n\nSwiftUI uses the actions passed to the above dialogs to determine whether the dialog should block app termination by default when presented. If all of the following are satisfied, the dialog will not block app quit:\n\n- There is only a single button and its role is not [doc:\/\/com.apple.SwiftUI\/documentation\/SwiftUI\/ButtonRole\/destructive]\n- The [doc:\/\/com.apple.SwiftUI\/documentation\/SwiftUI\/View\/dialogSeverity(_:)] is not `DialogSeverity\/critical``\n- There are no [doc:\/\/com.apple.SwiftUI\/documentation\/SwiftUI\/TextField]s\n\nUse this modifier after a `View\/alert` or `View\/confirmationDialog` to specify whether the dialog should prevent app termination. Pass `nil` to explicitly request the automatic behavior\/for the inert version of this modifier.\n\n```swift\nstruct ConfirmLogoutView: View {\n  @State private var isConfirming = false\n\n  var body: some View {\n    Button(\"Logout\") { isConfirming = true }\n      .confirmationDialog(\n        Text(\"Logout?\"),\n          isPresented: $isConfirming\n        ) {\n          Button(\"Yes\") {\n            \/\/ Handle logout action.\n          }\n        }\n        .dialogPreventsAppTermination(false)\n    }\n}\n```\n\n",
  "sections" : [

  ],
  "source" : "appleJSON",
  "title" : "dialogPreventsAppTermination(_:)",
  "url" : "https:\/\/developer.apple.com\/documentation\/SwiftUI\/View\/dialogPreventsAppTermination(_:)"
}