{
  "abstract" : "Adds a quick action to be shown by the system when active.",
  "codeExamples" : [
    {
      "code" : "@State private var isPaused = false\n\nvar body: some View {\n    WorkoutView(isPaused: $isPaused)\n        .accessibilityQuickAction(style: .prompt) {\n            Button(isPaused ? \"Resume\" : \"Pause\") {\n                isPaused.toggle()\n            }\n        }\n}",
      "language" : "swift"
    },
    {
      "code" : "@State private var isPlaying = false\n\nvar body: some View {\n    PlayButton(isPlaying: $isPlaying)\n        .contentShape(.focusEffect, Circle())\n        .accessibilityQuickAction(style: .outline) {\n            Button(isPlaying ? \"Pause\" : \"Play\") {\n                isPlaying.toggle()\n            }\n        }\n}",
      "language" : "swift"
    }
  ],
  "contentHash" : "2f0ac7594add18d6cc79423e9589ecf0e7c733ccc685f8273add63c1d52e7de3",
  "crawledAt" : "2025-12-02T17:43:56Z",
  "declaration" : {
    "code" : "nonisolated func accessibilityQuickAction<Style, Content>(style: Style, @ViewBuilder content: () -> Content) -> some View where Style : AccessibilityQuickActionStyle, Content : View\n",
    "language" : "swift"
  },
  "id" : "E34D6765-4FEC-4FFA-8440-1FA6F9768B3A",
  "kind" : "method",
  "language" : "swift",
  "module" : "SwiftUI",
  "overview" : "## Discussion\n\nThe quick action will automatically become active when the view appears. If the view is disabled, the action will defer becoming active until the view is no longer disabled.\n\nThe following example shows how to add a quick action to pause and resume a workout, with the [doc:\/\/com.apple.SwiftUI\/documentation\/SwiftUI\/AccessibilityQuickActionStyle\/prompt] style.\n\nThe following example shows how to add a quick action to play and pause music, with the [doc:\/\/com.apple.SwiftUI\/documentation\/SwiftUI\/AccessibilityQuickActionStyle\/outline] style.",
  "platforms" : [
    "watchOS"
  ],
  "rawMarkdown" : "---\nsource: https:\/\/developer.apple.com\/documentation\/SwiftUI\/View\/accessibilityQuickAction(style:content:)\ncrawled: 2025-12-02T17:43:56Z\n---\n\n# accessibilityQuickAction(style:content:)\n\n**Instance Method**\n\nAdds a quick action to be shown by the system when active.\n\n## Declaration\n\n```swift\nnonisolated func accessibilityQuickAction<Style, Content>(style: Style, @ViewBuilder content: () -> Content) -> some View where Style : AccessibilityQuickActionStyle, Content : View\n\n```\n\n## Discussion\n\nThe quick action will automatically become active when the view appears. If the view is disabled, the action will defer becoming active until the view is no longer disabled.\n\nThe following example shows how to add a quick action to pause and resume a workout, with the [doc:\/\/com.apple.SwiftUI\/documentation\/SwiftUI\/AccessibilityQuickActionStyle\/prompt] style.\n\n```swift\n@State private var isPaused = false\n\nvar body: some View {\n    WorkoutView(isPaused: $isPaused)\n        .accessibilityQuickAction(style: .prompt) {\n            Button(isPaused ? \"Resume\" : \"Pause\") {\n                isPaused.toggle()\n            }\n        }\n}\n```\n\nThe following example shows how to add a quick action to play and pause music, with the [doc:\/\/com.apple.SwiftUI\/documentation\/SwiftUI\/AccessibilityQuickActionStyle\/outline] style.\n\n```swift\n@State private var isPlaying = false\n\nvar body: some View {\n    PlayButton(isPlaying: $isPlaying)\n        .contentShape(.focusEffect, Circle())\n        .accessibilityQuickAction(style: .outline) {\n            Button(isPlaying ? \"Pause\" : \"Play\") {\n                isPlaying.toggle()\n            }\n        }\n}\n```\n\n## Offering Quick Actions to people\n\n- **accessibilityQuickAction(style:isActive:content:)**: Adds a quick action to be shown by the system when active.\n- **AccessibilityQuickActionStyle**: A type that describes the presentation style of an accessibility quick action.\n\n",
  "sections" : [
    {
      "content" : "",
      "items" : [
        {
          "description" : "Adds a quick action to be shown by the system when active.",
          "name" : "accessibilityQuickAction(style:isActive:content:)",
          "url" : "https:\/\/developer.apple.com\/documentation\/SwiftUI\/View\/accessibilityQuickAction(style:isActive:content:)"
        },
        {
          "description" : "A type that describes the presentation style of an accessibility quick action.",
          "name" : "AccessibilityQuickActionStyle",
          "url" : "https:\/\/developer.apple.com\/documentation\/SwiftUI\/AccessibilityQuickActionStyle"
        }
      ],
      "title" : "Offering Quick Actions to people"
    }
  ],
  "source" : "appleJSON",
  "title" : "accessibilityQuickAction(style:content:)",
  "url" : "https:\/\/developer.apple.com\/documentation\/SwiftUI\/View\/accessibilityQuickAction(style:content:)"
}