{
  "abstract" : "An immersion style that displays unbounded content that completely replaces passthrough video.",
  "codeExamples" : [

  ],
  "contentHash" : "68be282dcc0bb54794eb4bd8b33153d39840d42d67756640ceeb8beb38be5563",
  "crawledAt" : "2025-12-02T16:05:38Z",
  "declaration" : {
    "code" : "static var full: FullImmersionStyle { get }",
    "language" : "swift"
  },
  "id" : "B12C84FC-A645-4B6B-8263-346CF6CFA3B9",
  "kind" : "property",
  "language" : "swift",
  "module" : "SwiftUI",
  "overview" : "## Discussion\n\nWhen this immersion style is selected, the immersion amount reported by the closure of [doc:\/\/com.apple.SwiftUI\/documentation\/SwiftUI\/View\/onImmersionChange(initial:_:)] is `1.0`.\n\nUse the [doc:\/\/com.apple.SwiftUI\/documentation\/SwiftUI\/Scene\/immersionStyle(selection:in:)] scene modifier to specify this style for an [doc:\/\/com.apple.SwiftUI\/documentation\/SwiftUI\/ImmersiveSpace].\n\nWhen using this style, the space’s content fully obscures passthrough except for the user’s upper limbs. You can manage limb visibility separately by applying the [doc:\/\/com.apple.SwiftUI\/documentation\/SwiftUI\/Scene\/upperLimbVisibility(_:)] scene modifier to the space, or the view modifier equivalent to a view inside the scene.\n\nThe immersion style affects how windows interact with virtual objects in the environment. In `full` immersion, windows always render in front of virtual content, no matter how someone positions the window or the content. This helps people to avoid losing track of windows behind virtual content when passthrough is off.",
  "platforms" : [
    "macOS",
    "visionOS"
  ],
  "rawMarkdown" : "---\nsource: https:\/\/developer.apple.com\/documentation\/SwiftUI\/ImmersionStyle\/full\ncrawled: 2025-12-02T16:05:38Z\n---\n\n# full\n\n**Type Property**\n\nAn immersion style that displays unbounded content that completely replaces passthrough video.\n\n## Declaration\n\n```swift\nstatic var full: FullImmersionStyle { get }\n```\n\n## Discussion\n\nWhen this immersion style is selected, the immersion amount reported by the closure of [doc:\/\/com.apple.SwiftUI\/documentation\/SwiftUI\/View\/onImmersionChange(initial:_:)] is `1.0`.\n\nUse the [doc:\/\/com.apple.SwiftUI\/documentation\/SwiftUI\/Scene\/immersionStyle(selection:in:)] scene modifier to specify this style for an [doc:\/\/com.apple.SwiftUI\/documentation\/SwiftUI\/ImmersiveSpace].\n\nWhen using this style, the space’s content fully obscures passthrough except for the user’s upper limbs. You can manage limb visibility separately by applying the [doc:\/\/com.apple.SwiftUI\/documentation\/SwiftUI\/Scene\/upperLimbVisibility(_:)] scene modifier to the space, or the view modifier equivalent to a view inside the scene.\n\nThe immersion style affects how windows interact with virtual objects in the environment. In `full` immersion, windows always render in front of virtual content, no matter how someone positions the window or the content. This helps people to avoid losing track of windows behind virtual content when passthrough is off.\n\n## Getting built-in styles\n\n- **automatic**: The default immersion style.\n- **mixed**: An immersion style that displays unbounded content intermixed with other app content, along with passthrough video.\n- **progressive**: An immersion style that displays unbounded content that partially replaces passthrough video.\n\n",
  "sections" : [
    {
      "content" : "",
      "items" : [
        {
          "description" : "The default immersion style.",
          "name" : "automatic",
          "url" : "https:\/\/developer.apple.com\/documentation\/SwiftUI\/ImmersionStyle\/automatic"
        },
        {
          "description" : "An immersion style that displays unbounded content intermixed with other app content, along with passthrough video.",
          "name" : "mixed",
          "url" : "https:\/\/developer.apple.com\/documentation\/SwiftUI\/ImmersionStyle\/mixed"
        },
        {
          "description" : "An immersion style that displays unbounded content that partially replaces passthrough video.",
          "name" : "progressive",
          "url" : "https:\/\/developer.apple.com\/documentation\/SwiftUI\/ImmersionStyle\/progressive"
        }
      ],
      "title" : "Getting built-in styles"
    }
  ],
  "source" : "appleJSON",
  "title" : "full",
  "url" : "https:\/\/developer.apple.com\/documentation\/SwiftUI\/ImmersionStyle\/full"
}