{
  "abstract" : "Sets a view’s foreground elements to use a given style.",
  "codeExamples" : [
    {
      "code" : "HStack {\n    Image(systemName: \"triangle.fill\")\n    Text(\"Hello, world!\")\n    RoundedRectangle(cornerRadius: 5)\n        .frame(width: 40, height: 20)\n}\n.foregroundStyle(.teal)",
      "language" : "swift"
    },
    {
      "code" : "Text(\"Gradient Text\")\n    .font(.largeTitle)\n    .foregroundStyle(\n        .linearGradient(\n            colors: [.yellow, .blue],\n            startPoint: .top,\n            endPoint: .bottom\n        )\n    )",
      "language" : "swift"
    },
    {
      "code" : "VStack(alignment: .leading) {\n    Label(\"Primary\", systemImage: \"1.square.fill\")\n    Label(\"Secondary\", systemImage: \"2.square.fill\")\n        .foregroundStyle(.secondary)\n}",
      "language" : "swift"
    },
    {
      "code" : "VStack(alignment: .leading) {\n    Label(\"Primary\", systemImage: \"1.square.fill\")\n    Label(\"Secondary\", systemImage: \"2.square.fill\")\n        .foregroundStyle(.secondary)\n}\n.foregroundStyle(.blue)",
      "language" : "swift"
    }
  ],
  "contentHash" : "16bd8186c651ddfed90319ed2cdf302bf2affddf79d46f49c2f79910e954850a",
  "crawledAt" : "2025-12-02T17:36:50Z",
  "declaration" : {
    "code" : "nonisolated func foregroundStyle<S>(_ style: S) -> some View where S : ShapeStyle\n",
    "language" : "swift"
  },
  "id" : "7D99E7B5-4A8F-4055-B385-BEEF0642F2B1",
  "kind" : "method",
  "language" : "swift",
  "module" : "SwiftUI",
  "overview" : "## Return Value\n\nA view that uses the given foreground style.\n\n## Discussion\n\nUse this method to style foreground content like text, shapes, and template images (including symbols):\n\nThe example above creates a row of [doc:\/\/com.apple.SwiftUI\/documentation\/SwiftUI\/ShapeStyle\/teal] foreground elements:\n\n\n\nYou can use any style that conforms to the [doc:\/\/com.apple.SwiftUI\/documentation\/SwiftUI\/ShapeStyle] protocol, like the [doc:\/\/com.apple.SwiftUI\/documentation\/SwiftUI\/ShapeStyle\/teal] color in the example above, or the [doc:\/\/com.apple.SwiftUI\/documentation\/SwiftUI\/ShapeStyle\/linearGradient(colors:startPoint:endPoint:)] gradient shown below:\n\n\n\nSwiftUI creates a context-dependent render for a given style. For example, a [doc:\/\/com.apple.SwiftUI\/documentation\/SwiftUI\/Color] that you load from an asset catalog can have different light and dark appearances, while some styles also vary by platform.\n\nHierarchical foreground styles like `ShapeStyle\/secondary` don’t impose a style of their own, but instead modify other styles. In particular, they modify the primary level of the current foreground style to the degree given by the hierarchical style’s name. To find the current foreground style to modify, SwiftUI looks for the innermost containing style that you apply with the `foregroundStyle(_:)` or the [doc:\/\/com.apple.SwiftUI\/documentation\/SwiftUI\/View\/foregroundColor(_:)] modifier. If you haven’t specified a style, SwiftUI uses the default foreground style, as in the following example:\n\n\n\nIf you add a foreground style on the enclosing [doc:\/\/com.apple.SwiftUI\/documentation\/SwiftUI\/VStack], the hierarchical styling responds accordingly:\n\n\n\nWhen you apply a custom style to a view, the view disables the vibrancy effect for foreground elements in that view, or in any of its child views, that it would otherwise gain from adding a background material — for example, using the [doc:\/\/com.apple.SwiftUI\/documentation\/SwiftUI\/View\/background(_:ignoresSafeAreaEdges:)] modifier. However, hierarchical styles applied to the default foreground don’t disable vibrancy.",
  "platforms" : [
    "iOS",
    "iPadOS",
    "Mac Catalyst",
    "macOS",
    "tvOS",
    "visionOS",
    "watchOS"
  ],
  "rawMarkdown" : "---\nsource: https:\/\/developer.apple.com\/documentation\/SwiftUI\/View\/foregroundStyle(_:)\ncrawled: 2025-12-02T17:36:50Z\n---\n\n# foregroundStyle(_:)\n\n**Instance Method**\n\nSets a view’s foreground elements to use a given style.\n\n## Declaration\n\n```swift\nnonisolated func foregroundStyle<S>(_ style: S) -> some View where S : ShapeStyle\n\n```\n\n## Parameters\n\n- **style**: The color or pattern to use when filling in the foreground elements. To indicate a specific value, use [doc:\/\/com.apple.SwiftUI\/documentation\/SwiftUI\/Color] or [doc:\/\/com.apple.SwiftUI\/documentation\/SwiftUI\/ShapeStyle\/image(_:sourceRect:scale:)], or one of the gradient types, like [doc:\/\/com.apple.SwiftUI\/documentation\/SwiftUI\/ShapeStyle\/linearGradient(colors:startPoint:endPoint:)]. To set a style that’s relative to the containing view’s style, use one of the semantic styles, like [doc:\/\/com.apple.SwiftUI\/documentation\/SwiftUI\/ShapeStyle\/primary].\n\n## Return Value\n\nA view that uses the given foreground style.\n\n## Discussion\n\nUse this method to style foreground content like text, shapes, and template images (including symbols):\n\n```swift\nHStack {\n    Image(systemName: \"triangle.fill\")\n    Text(\"Hello, world!\")\n    RoundedRectangle(cornerRadius: 5)\n        .frame(width: 40, height: 20)\n}\n.foregroundStyle(.teal)\n```\n\nThe example above creates a row of [doc:\/\/com.apple.SwiftUI\/documentation\/SwiftUI\/ShapeStyle\/teal] foreground elements:\n\n\n\nYou can use any style that conforms to the [doc:\/\/com.apple.SwiftUI\/documentation\/SwiftUI\/ShapeStyle] protocol, like the [doc:\/\/com.apple.SwiftUI\/documentation\/SwiftUI\/ShapeStyle\/teal] color in the example above, or the [doc:\/\/com.apple.SwiftUI\/documentation\/SwiftUI\/ShapeStyle\/linearGradient(colors:startPoint:endPoint:)] gradient shown below:\n\n```swift\nText(\"Gradient Text\")\n    .font(.largeTitle)\n    .foregroundStyle(\n        .linearGradient(\n            colors: [.yellow, .blue],\n            startPoint: .top,\n            endPoint: .bottom\n        )\n    )\n```\n\n\n\n\n\nSwiftUI creates a context-dependent render for a given style. For example, a [doc:\/\/com.apple.SwiftUI\/documentation\/SwiftUI\/Color] that you load from an asset catalog can have different light and dark appearances, while some styles also vary by platform.\n\nHierarchical foreground styles like `ShapeStyle\/secondary` don’t impose a style of their own, but instead modify other styles. In particular, they modify the primary level of the current foreground style to the degree given by the hierarchical style’s name. To find the current foreground style to modify, SwiftUI looks for the innermost containing style that you apply with the `foregroundStyle(_:)` or the [doc:\/\/com.apple.SwiftUI\/documentation\/SwiftUI\/View\/foregroundColor(_:)] modifier. If you haven’t specified a style, SwiftUI uses the default foreground style, as in the following example:\n\n```swift\nVStack(alignment: .leading) {\n    Label(\"Primary\", systemImage: \"1.square.fill\")\n    Label(\"Secondary\", systemImage: \"2.square.fill\")\n        .foregroundStyle(.secondary)\n}\n```\n\n\n\nIf you add a foreground style on the enclosing [doc:\/\/com.apple.SwiftUI\/documentation\/SwiftUI\/VStack], the hierarchical styling responds accordingly:\n\n```swift\nVStack(alignment: .leading) {\n    Label(\"Primary\", systemImage: \"1.square.fill\")\n    Label(\"Secondary\", systemImage: \"2.square.fill\")\n        .foregroundStyle(.secondary)\n}\n.foregroundStyle(.blue)\n```\n\n\n\nWhen you apply a custom style to a view, the view disables the vibrancy effect for foreground elements in that view, or in any of its child views, that it would otherwise gain from adding a background material — for example, using the [doc:\/\/com.apple.SwiftUI\/documentation\/SwiftUI\/View\/background(_:ignoresSafeAreaEdges:)] modifier. However, hierarchical styles applied to the default foreground don’t disable vibrancy.\n\n## Styling content\n\n- **border(_:width:)**: Adds a border to this view with the specified style and width.\n- **foregroundStyle(_:_:)**: Sets the primary and secondary levels of the foreground style in the child view.\n- **foregroundStyle(_:_:_:)**: Sets the primary, secondary, and tertiary levels of the foreground style.\n- **backgroundStyle(_:)**: Sets the specified style to render backgrounds within the view.\n- **backgroundStyle**: An optional style that overrides the default system background style when set.\n- **ShapeStyle**: A color or pattern to use when rendering a shape.\n- **AnyShapeStyle**: A type-erased ShapeStyle value.\n- **Gradient**: A color gradient represented as an array of color stops, each having a parametric location value.\n- **MeshGradient**: A two-dimensional gradient defined by a 2D grid of positioned colors.\n- **AnyGradient**: A color gradient.\n- **ShadowStyle**: A style to use when rendering shadows.\n- **Glass**: A structure that defines the configuration of the Liquid Glass material.\n\n",
  "sections" : [
    {
      "content" : "",
      "items" : [
        {
          "description" : "Adds a border to this view with the specified style and width.",
          "name" : "border(_:width:)",
          "url" : "https:\/\/developer.apple.com\/documentation\/SwiftUI\/View\/border(_:width:)"
        },
        {
          "description" : "Sets the primary and secondary levels of the foreground style in the child view.",
          "name" : "foregroundStyle(_:_:)",
          "url" : "https:\/\/developer.apple.com\/documentation\/SwiftUI\/View\/foregroundStyle(_:_:)"
        },
        {
          "description" : "Sets the primary, secondary, and tertiary levels of the foreground style.",
          "name" : "foregroundStyle(_:_:_:)",
          "url" : "https:\/\/developer.apple.com\/documentation\/SwiftUI\/View\/foregroundStyle(_:_:_:)"
        },
        {
          "description" : "Sets the specified style to render backgrounds within the view.",
          "name" : "backgroundStyle(_:)",
          "url" : "https:\/\/developer.apple.com\/documentation\/SwiftUI\/View\/backgroundStyle(_:)"
        },
        {
          "description" : "An optional style that overrides the default system background style when set.",
          "name" : "backgroundStyle",
          "url" : "https:\/\/developer.apple.com\/documentation\/SwiftUI\/EnvironmentValues\/backgroundStyle"
        },
        {
          "description" : "A color or pattern to use when rendering a shape.",
          "name" : "ShapeStyle",
          "url" : "https:\/\/developer.apple.com\/documentation\/SwiftUI\/ShapeStyle"
        },
        {
          "description" : "A type-erased ShapeStyle value.",
          "name" : "AnyShapeStyle",
          "url" : "https:\/\/developer.apple.com\/documentation\/SwiftUI\/AnyShapeStyle"
        },
        {
          "description" : "A color gradient represented as an array of color stops, each having a parametric location value.",
          "name" : "Gradient",
          "url" : "https:\/\/developer.apple.com\/documentation\/SwiftUI\/Gradient"
        },
        {
          "description" : "A two-dimensional gradient defined by a 2D grid of positioned colors.",
          "name" : "MeshGradient",
          "url" : "https:\/\/developer.apple.com\/documentation\/SwiftUI\/MeshGradient"
        },
        {
          "description" : "A color gradient.",
          "name" : "AnyGradient",
          "url" : "https:\/\/developer.apple.com\/documentation\/SwiftUI\/AnyGradient"
        },
        {
          "description" : "A style to use when rendering shadows.",
          "name" : "ShadowStyle",
          "url" : "https:\/\/developer.apple.com\/documentation\/SwiftUI\/ShadowStyle"
        },
        {
          "description" : "A structure that defines the configuration of the Liquid Glass material.",
          "name" : "Glass",
          "url" : "https:\/\/developer.apple.com\/documentation\/SwiftUI\/Glass"
        }
      ],
      "title" : "Styling content"
    }
  ],
  "source" : "appleJSON",
  "title" : "foregroundStyle(_:)",
  "url" : "https:\/\/developer.apple.com\/documentation\/SwiftUI\/View\/foregroundStyle(_:)"
}