{
  "abstract" : "Sets the disabled customization behavior for a table column.",
  "codeExamples" : [

  ],
  "contentHash" : "36d47b914abd7a009112c492277190f33334b6a6e9269f71c310c54c2f094ab1",
  "crawledAt" : "2025-12-01T11:29:51Z",
  "declaration" : {
    "code" : "@MainActor @preconcurrency func disabledCustomizationBehavior(_ behavior: TableColumnCustomizationBehavior) -> some TableColumnContent<Self.TableRowValue, Self.TableColumnSortComparator>\n",
    "language" : "swift"
  },
  "id" : "31373AF7-0F5B-43CB-963E-1710E3BA80F7",
  "kind" : "method",
  "module" : "SwiftUI",
  "overview" : "## Discussion\n\nWhen the containing `Table` is bound to some `TableColumnCustomization`, all columns will be able to be customized by the user on macOS by default (i.e. `TableColumnCustomizationBehavior.all`). This modifier allows disabling specific behavior.\n\nThis modifier has no effect on iOS since `Table` does not support any built-in user customization features.\n\nThis does not prevent programmatic changes to a table column customization.",
  "platforms" : [
    "iOS",
    "iPadOS",
    "Mac Catalyst",
    "macOS",
    "visionOS"
  ],
  "rawMarkdown" : "---\nsource: https:\/\/developer.apple.com\/documentation\/SwiftUI\/TableColumnContent\/disabledCustomizationBehavior(_:)\ncrawled: 2025-12-01T11:29:51Z\n---\n\n# disabledCustomizationBehavior(_:)\n\n**Instance Method**\n\nSets the disabled customization behavior for a table column.\n\n## Declaration\n\n```swift\n@MainActor @preconcurrency func disabledCustomizationBehavior(_ behavior: TableColumnCustomizationBehavior) -> some TableColumnContent<Self.TableRowValue, Self.TableColumnSortComparator>\n\n```\n\n## Parameters\n\n- **behavior**: The behavior to disable, or `.all` to not allow any customization.\n\n## Discussion\n\nWhen the containing `Table` is bound to some `TableColumnCustomization`, all columns will be able to be customized by the user on macOS by default (i.e. `TableColumnCustomizationBehavior.all`). This modifier allows disabling specific behavior.\n\nThis modifier has no effect on iOS since `Table` does not support any built-in user customization features.\n\nThis does not prevent programmatic changes to a table column customization.\n\n## Configuring the content\n\n- **alignment(_:)**: Sets the alignment of the column, applying to both its column header label and the row view content for that column.\n- **customizationID(_:)**: Sets the identifier to be associated with a column when persisting its state with `TableColumnCustomization`.\n- **defaultVisibility(_:)**: Sets the default visibility of a table column.\n\n",
  "sections" : [
    {
      "content" : "",
      "items" : [
        {
          "description" : "Sets the alignment of the column, applying to both its column header label and the row view content for that column.",
          "name" : "alignment(_:)",
          "url" : "https:\/\/developer.apple.com\/documentation\/SwiftUI\/TableColumnContent\/alignment(_:)"
        },
        {
          "description" : "Sets the identifier to be associated with a column when persisting its state with `TableColumnCustomization`.",
          "name" : "customizationID(_:)",
          "url" : "https:\/\/developer.apple.com\/documentation\/SwiftUI\/TableColumnContent\/customizationID(_:)"
        },
        {
          "description" : "Sets the default visibility of a table column.",
          "name" : "defaultVisibility(_:)",
          "url" : "https:\/\/developer.apple.com\/documentation\/SwiftUI\/TableColumnContent\/defaultVisibility(_:)"
        }
      ],
      "title" : "Configuring the content"
    }
  ],
  "source" : "appleJSON",
  "title" : "disabledCustomizationBehavior(_:)",
  "url" : "https:\/\/developer.apple.com\/documentation\/SwiftUI\/TableColumnContent\/disabledCustomizationBehavior(_:)"
}