{
  "abstract" : "The visibility of the leading columns in a navigation split view.",
  "codeExamples" : [

  ],
  "conformsTo" : [
    "Decodable",
    "Encodable",
    "Equatable",
    "Sendable",
    "SendableMetatype"
  ],
  "contentHash" : "4d7d115e412fc51750c34d49357e988ed9c2bd56d169e22842c51d4bdd222448",
  "crawledAt" : "2025-12-02T15:56:59Z",
  "declaration" : {
    "code" : "struct NavigationSplitViewVisibility",
    "language" : "swift"
  },
  "id" : "1B5D8860-B96B-426D-B7ED-3D9581D757D1",
  "kind" : "struct",
  "language" : "swift",
  "module" : "SwiftUI",
  "overview" : "## Overview\n\nUse a value of this type to control the visibility of the columns of a [doc:\/\/com.apple.SwiftUI\/documentation\/SwiftUI\/NavigationSplitView]. Create a [doc:\/\/com.apple.SwiftUI\/documentation\/SwiftUI\/State] property with a value of this type, and pass a [doc:\/\/com.apple.SwiftUI\/documentation\/SwiftUI\/Binding] to that state to the [doc:\/\/com.apple.SwiftUI\/documentation\/SwiftUI\/NavigationSplitView\/init(columnVisibility:sidebar:detail:)] or [doc:\/\/com.apple.SwiftUI\/documentation\/SwiftUI\/NavigationSplitView\/init(columnVisibility:sidebar:content:detail:)] initializer when you create the navigation split view. You can then modify the value elsewhere in your code to:",
  "platforms" : [
    "iOS",
    "iPadOS",
    "Mac Catalyst",
    "macOS",
    "tvOS",
    "visionOS",
    "watchOS"
  ],
  "rawMarkdown" : "---\nsource: https:\/\/developer.apple.com\/documentation\/SwiftUI\/NavigationSplitViewVisibility\ncrawled: 2025-12-02T15:56:59Z\n---\n\n# NavigationSplitViewVisibility\n\n**Structure**\n\nThe visibility of the leading columns in a navigation split view.\n\n## Declaration\n\n```swift\nstruct NavigationSplitViewVisibility\n```\n\n## Overview\n\nUse a value of this type to control the visibility of the columns of a [doc:\/\/com.apple.SwiftUI\/documentation\/SwiftUI\/NavigationSplitView]. Create a [doc:\/\/com.apple.SwiftUI\/documentation\/SwiftUI\/State] property with a value of this type, and pass a [doc:\/\/com.apple.SwiftUI\/documentation\/SwiftUI\/Binding] to that state to the [doc:\/\/com.apple.SwiftUI\/documentation\/SwiftUI\/NavigationSplitView\/init(columnVisibility:sidebar:detail:)] or [doc:\/\/com.apple.SwiftUI\/documentation\/SwiftUI\/NavigationSplitView\/init(columnVisibility:sidebar:content:detail:)] initializer when you create the navigation split view. You can then modify the value elsewhere in your code to:\n\n- Hide all but the trailing column with [doc:\/\/com.apple.SwiftUI\/documentation\/SwiftUI\/NavigationSplitViewVisibility\/detailOnly].\n- Hide the leading column of a three-column navigation split view with [doc:\/\/com.apple.SwiftUI\/documentation\/SwiftUI\/NavigationSplitViewVisibility\/doubleColumn].\n- Show all the columns with [doc:\/\/com.apple.SwiftUI\/documentation\/SwiftUI\/NavigationSplitViewVisibility\/all].\n- Rely on the automatic behavior for the current context with [doc:\/\/com.apple.SwiftUI\/documentation\/SwiftUI\/NavigationSplitViewVisibility\/automatic].\n\n\n\n## Getting visibilities\n\n- **automatic**: Use the default leading column visibility for the current device.\n- **all**: Show all the columns of a three-column navigation split view.\n- **doubleColumn**: Show the content column and detail area of a three-column navigation split view, or the sidebar column and detail area of a two-column navigation split view.\n- **detailOnly**: Hide the leading two columns of a three-column navigation split view, so that just the detail area shows.\n\n## Presenting views in columns\n\n- **Bringing robust navigation structure to your SwiftUI app**: Use navigation links, stacks, destinations, and paths to provide a streamlined experience for all platforms, as well as behaviors such as deep linking and state restoration.\n- **Migrating to new navigation types**: Improve navigation behavior in your app by replacing navigation views with navigation stacks and navigation split views.\n- **NavigationSplitView**: A view that presents views in two or three columns, where selections in leading columns control presentations in subsequent columns.\n- **navigationSplitViewStyle(_:)**: Sets the style for navigation split views within this view.\n- **navigationSplitViewColumnWidth(_:)**: Sets a fixed, preferred width for the column containing this view.\n- **navigationSplitViewColumnWidth(min:ideal:max:)**: Sets a flexible, preferred width for the column containing this view.\n- **NavigationLink**: A view that controls a navigation presentation.\n\n## Conforms To\n\n- Decodable\n- Encodable\n- Equatable\n- Sendable\n- SendableMetatype\n\n",
  "sections" : [
    {
      "content" : "",
      "items" : [
        {
          "description" : "Use the default leading column visibility for the current device.",
          "name" : "automatic",
          "url" : "https:\/\/developer.apple.com\/documentation\/SwiftUI\/NavigationSplitViewVisibility\/automatic"
        },
        {
          "description" : "Show all the columns of a three-column navigation split view.",
          "name" : "all",
          "url" : "https:\/\/developer.apple.com\/documentation\/SwiftUI\/NavigationSplitViewVisibility\/all"
        },
        {
          "description" : "Show the content column and detail area of a three-column navigation split view, or the sidebar column and detail area of a two-column navigation split view.",
          "name" : "doubleColumn",
          "url" : "https:\/\/developer.apple.com\/documentation\/SwiftUI\/NavigationSplitViewVisibility\/doubleColumn"
        },
        {
          "description" : "Hide the leading two columns of a three-column navigation split view, so that just the detail area shows.",
          "name" : "detailOnly",
          "url" : "https:\/\/developer.apple.com\/documentation\/SwiftUI\/NavigationSplitViewVisibility\/detailOnly"
        }
      ],
      "title" : "Getting visibilities"
    },
    {
      "content" : "",
      "items" : [
        {
          "description" : "Use navigation links, stacks, destinations, and paths to provide a streamlined experience for all platforms, as well as behaviors such as deep linking and state restoration.",
          "name" : "Bringing robust navigation structure to your SwiftUI app",
          "url" : "https:\/\/developer.apple.com\/documentation\/SwiftUI\/Bringing-robust-navigation-structure-to-your-swiftui-app"
        },
        {
          "description" : "Improve navigation behavior in your app by replacing navigation views with navigation stacks and navigation split views.",
          "name" : "Migrating to new navigation types",
          "url" : "https:\/\/developer.apple.com\/documentation\/SwiftUI\/Migrating-to-New-Navigation-Types"
        },
        {
          "description" : "A view that presents views in two or three columns, where selections in leading columns control presentations in subsequent columns.",
          "name" : "NavigationSplitView",
          "url" : "https:\/\/developer.apple.com\/documentation\/SwiftUI\/NavigationSplitView"
        },
        {
          "description" : "Sets the style for navigation split views within this view.",
          "name" : "navigationSplitViewStyle(_:)",
          "url" : "https:\/\/developer.apple.com\/documentation\/SwiftUI\/View\/navigationSplitViewStyle(_:)"
        },
        {
          "description" : "Sets a fixed, preferred width for the column containing this view.",
          "name" : "navigationSplitViewColumnWidth(_:)",
          "url" : "https:\/\/developer.apple.com\/documentation\/SwiftUI\/View\/navigationSplitViewColumnWidth(_:)"
        },
        {
          "description" : "Sets a flexible, preferred width for the column containing this view.",
          "name" : "navigationSplitViewColumnWidth(min:ideal:max:)",
          "url" : "https:\/\/developer.apple.com\/documentation\/SwiftUI\/View\/navigationSplitViewColumnWidth(min:ideal:max:)"
        },
        {
          "description" : "A view that controls a navigation presentation.",
          "name" : "NavigationLink",
          "url" : "https:\/\/developer.apple.com\/documentation\/SwiftUI\/NavigationLink"
        }
      ],
      "title" : "Presenting views in columns"
    }
  ],
  "source" : "appleJSON",
  "title" : "NavigationSplitViewVisibility",
  "url" : "https:\/\/developer.apple.com\/documentation\/SwiftUI\/NavigationSplitViewVisibility"
}