{
  "abstract" : "The status of the control described by the modified label.",
  "codeExamples" : [
    {
      "code" : "\/\/ Status Text: \"Do Not Disturb Until This Evening\" \/ \"Do Not Disturb Disabled\"\nControlWidgetToggle(\"Do Not Disturb\", ...) { isOn in\n    Image(systemName: \"moon\")\n        .controlWidgetStatus(isOn ? \"Do Not Disturb Until This Evening\" : \"Do Not Disturb Disabled\")\n}",
      "language" : "swift"
    }
  ],
  "contentHash" : "0139e657148b61b8ac13bb8a827d80c742c587758877a1f268581d465de1d7dd",
  "crawledAt" : "2025-11-30T21:08:34Z",
  "declaration" : {
    "code" : "@MainActor @preconcurrency func controlWidgetStatus(_ status: LocalizedStringResource) -> some View\n",
    "language" : "swift"
  },
  "id" : "8F8B2547-6C17-411B-B464-F8826B08F218",
  "kind" : "method",
  "module" : "SwiftUI",
  "overview" : "## Discussion\n\nThis text appears in Control Center when your control’s state changes. You can customize the text by applying this modifier to the control’s value label:",
  "platforms" : [
    "iOS",
    "iPadOS",
    "Mac Catalyst",
    "macOS",
    "watchOS"
  ],
  "rawMarkdown" : "---\nsource: https:\/\/developer.apple.com\/documentation\/SwiftUI\/View\/controlWidgetStatus(_:)\ncrawled: 2025-11-30T21:08:34Z\n---\n\n# controlWidgetStatus(_:)\n\n**Instance Method**\n\nThe status of the control described by the modified label.\n\n## Declaration\n\n```swift\n@MainActor @preconcurrency func controlWidgetStatus(_ status: LocalizedStringResource) -> some View\n\n```\n\n## Parameters\n\n- **status**: The localized string resource to display.\n\n## Discussion\n\nThis text appears in Control Center when your control’s state changes. You can customize the text by applying this modifier to the control’s value label:\n\n```swift\n\/\/ Status Text: \"Do Not Disturb Until This Evening\" \/ \"Do Not Disturb Disabled\"\nControlWidgetToggle(\"Do Not Disturb\", ...) { isOn in\n    Image(systemName: \"moon\")\n        .controlWidgetStatus(isOn ? \"Do Not Disturb Until This Evening\" : \"Do Not Disturb Disabled\")\n}\n```\n\n## Composing control widgets\n\n- **ControlWidget**: The configuration and content of a control widget to display in system spaces such as Control Center, the Lock Screen, and the Action Button.\n- **ControlWidgetConfiguration**: A type that describes a control widget’s content.\n- **EmptyControlWidgetConfiguration**: An empty control widget configuration.\n- **ControlWidgetConfigurationBuilder**: A custom attribute that constructs a control widget’s body.\n- **ControlWidgetTemplate**: A type that describes a control widget’s content.\n- **EmptyControlWidgetTemplate**: An empty control widget template.\n- **ControlWidgetTemplateBuilder**: A custom attribute that constructs a control widget template’s body.\n- **controlWidgetActionHint(_:)**: The action hint of the control described by the modified label.\n\n",
  "sections" : [
    {
      "content" : "",
      "items" : [
        {
          "description" : "The configuration and content of a control widget to display in system spaces such as Control Center, the Lock Screen, and the Action Button.",
          "name" : "ControlWidget",
          "url" : "https:\/\/developer.apple.com\/documentation\/SwiftUI\/ControlWidget"
        },
        {
          "description" : "A type that describes a control widget’s content.",
          "name" : "ControlWidgetConfiguration",
          "url" : "https:\/\/developer.apple.com\/documentation\/SwiftUI\/ControlWidgetConfiguration"
        },
        {
          "description" : "An empty control widget configuration.",
          "name" : "EmptyControlWidgetConfiguration",
          "url" : "https:\/\/developer.apple.com\/documentation\/SwiftUI\/EmptyControlWidgetConfiguration"
        },
        {
          "description" : "A custom attribute that constructs a control widget’s body.",
          "name" : "ControlWidgetConfigurationBuilder",
          "url" : "https:\/\/developer.apple.com\/documentation\/SwiftUI\/ControlWidgetConfigurationBuilder"
        },
        {
          "description" : "A type that describes a control widget’s content.",
          "name" : "ControlWidgetTemplate",
          "url" : "https:\/\/developer.apple.com\/documentation\/SwiftUI\/ControlWidgetTemplate"
        },
        {
          "description" : "An empty control widget template.",
          "name" : "EmptyControlWidgetTemplate",
          "url" : "https:\/\/developer.apple.com\/documentation\/SwiftUI\/EmptyControlWidgetTemplate"
        },
        {
          "description" : "A custom attribute that constructs a control widget template’s body.",
          "name" : "ControlWidgetTemplateBuilder",
          "url" : "https:\/\/developer.apple.com\/documentation\/SwiftUI\/ControlWidgetTemplateBuilder"
        },
        {
          "description" : "The action hint of the control described by the modified label.",
          "name" : "controlWidgetActionHint(_:)",
          "url" : "https:\/\/developer.apple.com\/documentation\/SwiftUI\/View\/controlWidgetActionHint(_:)"
        }
      ],
      "title" : "Composing control widgets"
    }
  ],
  "source" : "appleJSON",
  "title" : "controlWidgetStatus(_:)",
  "url" : "https:\/\/developer.apple.com\/documentation\/SwiftUI\/View\/controlWidgetStatus(_:)"
}