{
  "abstract" : "Adds secondary views within the 3D bounds of this view.",
  "codeExamples" : [

  ],
  "contentHash" : "83349e11d09dee3771a125e1ebedf5fde6c3381a5679029876e67efc94bf8f69",
  "crawledAt" : "2025-11-30T21:10:29Z",
  "declaration" : {
    "code" : "nonisolated func spatialOverlay<V>(alignment: Alignment3D = .center, @ViewBuilder content: () -> V) -> some View where V : View\n",
    "language" : "swift"
  },
  "id" : "19326B82-3EA2-455C-8AF5-A7E304912571",
  "kind" : "method",
  "module" : "SwiftUI",
  "overview" : "## Return Value\n\nA view that adds `content` within the view’s 3D bounds.\n\n## Discussion\n\nMultiple views provided by `content` are stacked depthwise.",
  "platforms" : [
    "visionOS"
  ],
  "rawMarkdown" : "---\nsource: https:\/\/developer.apple.com\/documentation\/SwiftUI\/View\/spatialOverlay(alignment:content:)\ncrawled: 2025-11-30T21:10:29Z\n---\n\n# spatialOverlay(alignment:content:)\n\n**Instance Method**\n\nAdds secondary views within the 3D bounds of this view.\n\n## Declaration\n\n```swift\nnonisolated func spatialOverlay<V>(alignment: Alignment3D = .center, @ViewBuilder content: () -> V) -> some View where V : View\n\n```\n\n## Parameters\n\n- **alignment**: The alignment with a default value of [doc:\/\/com.apple.SwiftUI\/documentation\/SwiftUI\/Alignment3D\/center] that you use to position the secondary view.\n- **content**: The view builder which produces views to occupy the same 3D space as this view. Multiple views provided by content are organized into a [doc:\/\/com.apple.SwiftUI\/documentation\/SwiftUI\/SpatialContainer].\n\n## Return Value\n\nA view that adds `content` within the view’s 3D bounds.\n\n## Discussion\n\nMultiple views provided by `content` are stacked depthwise.\n\n",
  "sections" : [

  ],
  "source" : "appleJSON",
  "title" : "spatialOverlay(alignment:content:)",
  "url" : "https:\/\/developer.apple.com\/documentation\/SwiftUI\/View\/spatialOverlay(alignment:content:)"
}