{
  "abstract" : "A type that you use to create custom alignment guides.",
  "codeExamples" : [
    {
      "code" : "private struct FirstThirdAlignment: AlignmentID {\n    static func defaultValue(in context: ViewDimensions) -> CGFloat {\n        context.height \/ 3\n    }\n}",
      "language" : "swift"
    },
    {
      "code" : "extension VerticalAlignment {\n    static let firstThird = VerticalAlignment(FirstThirdAlignment.self)\n}",
      "language" : "swift"
    },
    {
      "code" : "struct StripesGroup: View {\n    var body: some View {\n        HStack(alignment: .firstThird, spacing: 1) {\n            HorizontalStripes().frame(height: 60)\n            HorizontalStripes().frame(height: 120)\n            HorizontalStripes().frame(height: 90)\n        }\n    }\n}\n\nstruct HorizontalStripes: View {\n    var body: some View {\n        VStack(spacing: 1) {\n            ForEach(0..<3) { _ in Color.blue }\n        }\n    }\n}",
      "language" : "swift"
    },
    {
      "code" : "struct StripesGroupModified: View {\n    var body: some View {\n        HStack(alignment: .firstThird, spacing: 1) {\n            HorizontalStripes().frame(height: 60)\n            HorizontalStripes().frame(height: 120)\n            HorizontalStripes().frame(height: 90)\n                .alignmentGuide(.firstThird) { context in\n                    2 * context.height \/ 3\n                }\n        }\n    }\n}",
      "language" : "swift"
    }
  ],
  "contentHash" : "b71108c4ec2e3ede2fa285a41de0818e9dfbfea0284ea8cd09a571706474407a",
  "crawledAt" : "2025-12-02T17:20:15Z",
  "declaration" : {
    "code" : "protocol AlignmentID",
    "language" : "swift"
  },
  "id" : "7E6DBBF1-E60E-425A-8F89-0B08672C37B3",
  "kind" : "protocol",
  "language" : "swift",
  "module" : "SwiftUI",
  "overview" : "## Overview\n\nEvery built-in alignment guide that [doc:\/\/com.apple.SwiftUI\/documentation\/SwiftUI\/VerticalAlignment] or [doc:\/\/com.apple.SwiftUI\/documentation\/SwiftUI\/HorizontalAlignment] defines as a static property, like [doc:\/\/com.apple.SwiftUI\/documentation\/SwiftUI\/VerticalAlignment\/top] or [doc:\/\/com.apple.SwiftUI\/documentation\/SwiftUI\/HorizontalAlignment\/leading], has a unique alignment identifier type that produces the default offset for that guide. To create a custom alignment guide, define your own alignment identifier as a type that conforms to the `AlignmentID` protocol, and implement the required [doc:\/\/com.apple.SwiftUI\/documentation\/SwiftUI\/AlignmentID\/defaultValue(in:)] method:\n\nWhen implementing the method, calculate the guide’s default offset from the view’s origin. If it’s helpful, you can use information from the [doc:\/\/com.apple.SwiftUI\/documentation\/SwiftUI\/ViewDimensions] input in the calculation. This parameter provides context about the specific view that’s using the guide. The above example creates an identifier called `FirstThirdAlignment` and calculates a default value that’s one-third of the height of the aligned view.\n\nUse the identifier’s type to create a static property in an extension of one of the alignment guide types, like [doc:\/\/com.apple.SwiftUI\/documentation\/SwiftUI\/VerticalAlignment]:\n\nYou can apply your custom guide like any of the built-in guides. For example, you can use an [doc:\/\/com.apple.SwiftUI\/documentation\/SwiftUI\/HStack] to align its views at one-third of their height using the guide defined above:\n\nBecause each set of stripes has three equal, vertically stacked rectangles, they align at the bottom edge of the top rectangle. This corresponds in each case to a third of the overall height, as measured from the origin at the top of each set of stripes:\n\n\n\nYou can also use the [doc:\/\/com.apple.SwiftUI\/documentation\/SwiftUI\/View\/alignmentGuide(_:computeValue:)] view modifier to alter the behavior of your custom guide for a view, as you might alter a built-in guide. For example, you can change one of the stacks of stripes from the previous example to align its `firstThird` guide at two thirds of the height instead:\n\nThe modified guide calculation causes the affected view to place the bottom edge of its middle rectangle on the `firstThird` guide, which aligns with the bottom edge of the top rectangle in the other two groups:\n\n",
  "platforms" : [
    "iOS",
    "iPadOS",
    "Mac Catalyst",
    "macOS",
    "tvOS",
    "visionOS",
    "watchOS"
  ],
  "rawMarkdown" : "---\nsource: https:\/\/developer.apple.com\/documentation\/SwiftUI\/AlignmentID\ncrawled: 2025-12-02T17:20:15Z\n---\n\n# AlignmentID\n\n**Protocol**\n\nA type that you use to create custom alignment guides.\n\n## Declaration\n\n```swift\nprotocol AlignmentID\n```\n\n## Overview\n\nEvery built-in alignment guide that [doc:\/\/com.apple.SwiftUI\/documentation\/SwiftUI\/VerticalAlignment] or [doc:\/\/com.apple.SwiftUI\/documentation\/SwiftUI\/HorizontalAlignment] defines as a static property, like [doc:\/\/com.apple.SwiftUI\/documentation\/SwiftUI\/VerticalAlignment\/top] or [doc:\/\/com.apple.SwiftUI\/documentation\/SwiftUI\/HorizontalAlignment\/leading], has a unique alignment identifier type that produces the default offset for that guide. To create a custom alignment guide, define your own alignment identifier as a type that conforms to the `AlignmentID` protocol, and implement the required [doc:\/\/com.apple.SwiftUI\/documentation\/SwiftUI\/AlignmentID\/defaultValue(in:)] method:\n\n```swift\nprivate struct FirstThirdAlignment: AlignmentID {\n    static func defaultValue(in context: ViewDimensions) -> CGFloat {\n        context.height \/ 3\n    }\n}\n```\n\nWhen implementing the method, calculate the guide’s default offset from the view’s origin. If it’s helpful, you can use information from the [doc:\/\/com.apple.SwiftUI\/documentation\/SwiftUI\/ViewDimensions] input in the calculation. This parameter provides context about the specific view that’s using the guide. The above example creates an identifier called `FirstThirdAlignment` and calculates a default value that’s one-third of the height of the aligned view.\n\nUse the identifier’s type to create a static property in an extension of one of the alignment guide types, like [doc:\/\/com.apple.SwiftUI\/documentation\/SwiftUI\/VerticalAlignment]:\n\n```swift\nextension VerticalAlignment {\n    static let firstThird = VerticalAlignment(FirstThirdAlignment.self)\n}\n```\n\nYou can apply your custom guide like any of the built-in guides. For example, you can use an [doc:\/\/com.apple.SwiftUI\/documentation\/SwiftUI\/HStack] to align its views at one-third of their height using the guide defined above:\n\n```swift\nstruct StripesGroup: View {\n    var body: some View {\n        HStack(alignment: .firstThird, spacing: 1) {\n            HorizontalStripes().frame(height: 60)\n            HorizontalStripes().frame(height: 120)\n            HorizontalStripes().frame(height: 90)\n        }\n    }\n}\n\nstruct HorizontalStripes: View {\n    var body: some View {\n        VStack(spacing: 1) {\n            ForEach(0..<3) { _ in Color.blue }\n        }\n    }\n}\n```\n\nBecause each set of stripes has three equal, vertically stacked rectangles, they align at the bottom edge of the top rectangle. This corresponds in each case to a third of the overall height, as measured from the origin at the top of each set of stripes:\n\n\n\nYou can also use the [doc:\/\/com.apple.SwiftUI\/documentation\/SwiftUI\/View\/alignmentGuide(_:computeValue:)] view modifier to alter the behavior of your custom guide for a view, as you might alter a built-in guide. For example, you can change one of the stacks of stripes from the previous example to align its `firstThird` guide at two thirds of the height instead:\n\n```swift\nstruct StripesGroupModified: View {\n    var body: some View {\n        HStack(alignment: .firstThird, spacing: 1) {\n            HorizontalStripes().frame(height: 60)\n            HorizontalStripes().frame(height: 120)\n            HorizontalStripes().frame(height: 90)\n                .alignmentGuide(.firstThird) { context in\n                    2 * context.height \/ 3\n                }\n        }\n    }\n}\n```\n\nThe modified guide calculation causes the affected view to place the bottom edge of its middle rectangle on the `firstThird` guide, which aligns with the bottom edge of the top rectangle in the other two groups:\n\n\n\n## Getting the default value\n\n- **defaultValue(in:)**: Calculates a default value for the corresponding guide in the specified context.\n\n## Aligning views\n\n- **Aligning views within a stack**: Position views inside a stack using alignment guides.\n- **Aligning views across stacks**: Create a custom alignment and use it to align views across multiple stacks.\n- **alignmentGuide(_:computeValue:)**: Sets the view’s horizontal alignment.\n- **Alignment**: An alignment in both axes.\n- **HorizontalAlignment**: An alignment position along the horizontal axis.\n- **VerticalAlignment**: An alignment position along the vertical axis.\n- **DepthAlignment**: An alignment position along the depth axis.\n- **ViewDimensions**: A view’s size and alignment guides in its own coordinate space.\n- **ViewDimensions3D**: A view’s 3D size and alignment guides in its own coordinate space.\n- **SpatialContainer**: A layout container that aligns overlapping content in 3D space.\n\n",
  "sections" : [
    {
      "content" : "",
      "items" : [
        {
          "description" : "Calculates a default value for the corresponding guide in the specified context.",
          "name" : "defaultValue(in:)",
          "url" : "https:\/\/developer.apple.com\/documentation\/SwiftUI\/AlignmentID\/defaultValue(in:)"
        }
      ],
      "title" : "Getting the default value"
    },
    {
      "content" : "",
      "items" : [
        {
          "description" : "Position views inside a stack using alignment guides.",
          "name" : "Aligning views within a stack",
          "url" : "https:\/\/developer.apple.com\/documentation\/SwiftUI\/Aligning-Views-Within-a-Stack"
        },
        {
          "description" : "Create a custom alignment and use it to align views across multiple stacks.",
          "name" : "Aligning views across stacks",
          "url" : "https:\/\/developer.apple.com\/documentation\/SwiftUI\/Aligning-Views-Across-Stacks"
        },
        {
          "description" : "Sets the view’s horizontal alignment.",
          "name" : "alignmentGuide(_:computeValue:)",
          "url" : "https:\/\/developer.apple.com\/documentation\/SwiftUI\/View\/alignmentGuide(_:computeValue:)"
        },
        {
          "description" : "An alignment in both axes.",
          "name" : "Alignment",
          "url" : "https:\/\/developer.apple.com\/documentation\/SwiftUI\/Alignment"
        },
        {
          "description" : "An alignment position along the horizontal axis.",
          "name" : "HorizontalAlignment",
          "url" : "https:\/\/developer.apple.com\/documentation\/SwiftUI\/HorizontalAlignment"
        },
        {
          "description" : "An alignment position along the vertical axis.",
          "name" : "VerticalAlignment",
          "url" : "https:\/\/developer.apple.com\/documentation\/SwiftUI\/VerticalAlignment"
        },
        {
          "description" : "An alignment position along the depth axis.",
          "name" : "DepthAlignment",
          "url" : "https:\/\/developer.apple.com\/documentation\/SwiftUI\/DepthAlignment"
        },
        {
          "description" : "A view’s size and alignment guides in its own coordinate space.",
          "name" : "ViewDimensions",
          "url" : "https:\/\/developer.apple.com\/documentation\/SwiftUI\/ViewDimensions"
        },
        {
          "description" : "A view’s 3D size and alignment guides in its own coordinate space.",
          "name" : "ViewDimensions3D",
          "url" : "https:\/\/developer.apple.com\/documentation\/SwiftUI\/ViewDimensions3D"
        },
        {
          "description" : "A layout container that aligns overlapping content in 3D space.",
          "name" : "SpatialContainer",
          "url" : "https:\/\/developer.apple.com\/documentation\/SwiftUI\/SpatialContainer"
        }
      ],
      "title" : "Aligning views"
    }
  ],
  "source" : "appleJSON",
  "title" : "AlignmentID",
  "url" : "https:\/\/developer.apple.com\/documentation\/SwiftUI\/AlignmentID"
}