{
  "abstract" : "The current amount of immersion.",
  "codeExamples" : [

  ],
  "contentHash" : "d9c24ac0b833efd1a892d39a010ed4408ebe0853c4ceb82b8816ecf39aa4dab8",
  "crawledAt" : "2025-12-03T05:15:01Z",
  "declaration" : {
    "code" : "let amount: Double?",
    "language" : "swift"
  },
  "id" : "2D9F5594-9949-437E-BACF-428BD2E435F9",
  "kind" : "property",
  "language" : "swift",
  "module" : "SwiftUI",
  "overview" : "## Discussion\n\nYour app can display virtual content using [doc:\/\/com.apple.SwiftUI\/documentation\/SwiftUI\/ImmersiveSpace] and the different immersion styles to create immersive experiences. Depending on the immersion style, none of it, parts of it, or a all of video pass-through are occluded by your app while having an Immersive Space opened, and the amount of it is represented by this value.\n\nSome immersion styles allow changing the amount interactively by turning the Digital Crown.\n\nThis value is `nil`, if your app currently does not provide any immersive experience at all.",
  "platforms" : [
    "macOS",
    "visionOS"
  ],
  "rawMarkdown" : "---\nsource: https:\/\/developer.apple.com\/documentation\/SwiftUI\/ImmersionChangeContext\/amount\ncrawled: 2025-12-03T05:15:01Z\n---\n\n# amount\n\n**Instance Property**\n\nThe current amount of immersion.\n\n## Declaration\n\n```swift\nlet amount: Double?\n```\n\n## Discussion\n\nYour app can display virtual content using [doc:\/\/com.apple.SwiftUI\/documentation\/SwiftUI\/ImmersiveSpace] and the different immersion styles to create immersive experiences. Depending on the immersion style, none of it, parts of it, or a all of video pass-through are occluded by your app while having an Immersive Space opened, and the amount of it is represented by this value.\n\nSome immersion styles allow changing the amount interactively by turning the Digital Crown.\n\nThis value is `nil`, if your app currently does not provide any immersive experience at all.\n\n",
  "sections" : [

  ],
  "source" : "appleJSON",
  "title" : "amount",
  "url" : "https:\/\/developer.apple.com\/documentation\/SwiftUI\/ImmersionChangeContext\/amount"
}