{
  "abstract" : "Creates a hosting view object from the contents of the specified archive.",
  "codeExamples" : [

  ],
  "contentHash" : "a246fd97fe4b700a4d95335ae3b99559c877a9892fd3e1a5cf6b04e7380bdc60",
  "crawledAt" : "2025-12-04T12:10:01Z",
  "declaration" : {
    "code" : "@MainActor @preconcurrency required dynamic init?(coder aDecoder: NSCoder)",
    "language" : "swift"
  },
  "id" : "0C7CAD3B-D61D-4FB4-88D7-518DBFFA5AEB",
  "kind" : "unknown",
  "language" : "swift",
  "module" : "SwiftUI",
  "overview" : "## Discussion\n\nThe default implementation of this method throws an exception. To create your view from an archive, override this method and initialize the superclass using the [doc:\/\/com.apple.SwiftUI\/documentation\/SwiftUI\/NSHostingView\/init(coder:rootView:)] method instead.",
  "platforms" : [
    "macOS"
  ],
  "rawMarkdown" : "---\nsource: https:\/\/developer.apple.com\/documentation\/swiftui\/nshostingview\/init(coder:)\ncrawled: 2025-12-04T12:10:01Z\n---\n\n# init(coder:)\n\n**Initializer**\n\nCreates a hosting view object from the contents of the specified archive.\n\n## Declaration\n\n```swift\n@MainActor @preconcurrency required dynamic init?(coder aDecoder: NSCoder)\n```\n\n## Discussion\n\nThe default implementation of this method throws an exception. To create your view from an archive, override this method and initialize the superclass using the [doc:\/\/com.apple.SwiftUI\/documentation\/SwiftUI\/NSHostingView\/init(coder:rootView:)] method instead.\n\n## Creating a hosting view\n\n- **init(rootView:)**: Creates a hosting view object that wraps the specified SwiftUI view.\n- **prepareForReuse()**\n\n",
  "sections" : [
    {
      "content" : "",
      "items" : [
        {
          "description" : "Creates a hosting view object that wraps the specified SwiftUI view.",
          "name" : "init(rootView:)",
          "url" : "https:\/\/developer.apple.com\/documentation\/SwiftUI\/NSHostingView\/init(rootView:)"
        },
        {
          "description" : "",
          "name" : "prepareForReuse()",
          "url" : "https:\/\/developer.apple.com\/documentation\/SwiftUI\/NSHostingView\/prepareForReuse()"
        }
      ],
      "title" : "Creating a hosting view"
    }
  ],
  "source" : "appleJSON",
  "title" : "init(coder:)",
  "url" : "https:\/\/developer.apple.com\/documentation\/swiftui\/nshostingview\/init(coder:)"
}