{
  "abstract" : "Specifies the preferred color scheme of a bar managed by SwiftUI.",
  "codeExamples" : [
    {
      "code" : "TabView {\n    NavigationView {\n        ContentView()\n            .toolbarBackground(.blue)\n            .toolbarColorScheme(.dark)\n    }\n    \/\/ other tabs...\n}",
      "language" : "swift"
    },
    {
      "code" : "TabView {\n    NavigationView {\n        ContentView()\n            .toolbarBackground(\n                .blue, for: .navigationBar, .tabBar)\n            .toolbarColorScheme(\n                .dark, for: .navigationBar, .tabBar)\n    }\n}",
      "language" : "swift"
    },
    {
      "code" : "NavigationView {\n    ContentView()\n        .toolbarBackground(.visible)\n        .toolbarColorScheme(.dark)\n}",
      "language" : "swift"
    }
  ],
  "contentHash" : "48349afa7606b6dab616d550674b50da3413f28bb6e405048a749283b5af4c1c",
  "crawledAt" : "2025-12-02T17:12:48Z",
  "declaration" : {
    "code" : "nonisolated func toolbarColorScheme(_ colorScheme: ColorScheme?, for bars: ToolbarPlacement...) -> some View\n",
    "language" : "swift"
  },
  "id" : "D71B61AC-A978-4824-A2AC-62EF1554157F",
  "kind" : "method",
  "language" : "swift",
  "module" : "SwiftUI",
  "overview" : "## Discussion\n\nThe preferred color scheme flows up to the nearest container that renders a bar. This could be a [doc:\/\/com.apple.SwiftUI\/documentation\/SwiftUI\/NavigationView] or [doc:\/\/com.apple.SwiftUI\/documentation\/SwiftUI\/TabView] in iOS, or the root view of a [doc:\/\/com.apple.SwiftUI\/documentation\/SwiftUI\/WindowGroup] in macOS. Pass in a value of nil to match the current system’s color scheme.\n\nThis examples shows a view that renders the navigation bar with a blue background and dark color scheme:\n\nYou can provide multiple [doc:\/\/com.apple.SwiftUI\/documentation\/SwiftUI\/ToolbarPlacement] instances to customize multiple bars at once.\n\nNote that the provided color scheme is only respected while a background is visible in the requested bar. As the background becomes visible, the bar transitions from the color scheme of the app to the requested color scheme. You can ensure that the color scheme is always respected by specifying that the background of the bar always be visible.\n\nDepending on the specified bars, the requested color scheme may not be able to be fullfilled.",
  "platforms" : [
    "iOS",
    "iPadOS",
    "Mac Catalyst",
    "macOS",
    "tvOS",
    "visionOS",
    "watchOS"
  ],
  "rawMarkdown" : "---\nsource: https:\/\/developer.apple.com\/documentation\/SwiftUI\/View\/toolbarColorScheme(_:for:)\ncrawled: 2025-12-02T17:12:48Z\n---\n\n# toolbarColorScheme(_:for:)\n\n**Instance Method**\n\nSpecifies the preferred color scheme of a bar managed by SwiftUI.\n\n## Declaration\n\n```swift\nnonisolated func toolbarColorScheme(_ colorScheme: ColorScheme?, for bars: ToolbarPlacement...) -> some View\n\n```\n\n## Parameters\n\n- **colorScheme**: The preferred color scheme of the background of the bar.\n- **bars**: The bars to update the color scheme of or [doc:\/\/com.apple.SwiftUI\/documentation\/SwiftUI\/ToolbarPlacement\/automatic] if empty.\n\n## Discussion\n\nThe preferred color scheme flows up to the nearest container that renders a bar. This could be a [doc:\/\/com.apple.SwiftUI\/documentation\/SwiftUI\/NavigationView] or [doc:\/\/com.apple.SwiftUI\/documentation\/SwiftUI\/TabView] in iOS, or the root view of a [doc:\/\/com.apple.SwiftUI\/documentation\/SwiftUI\/WindowGroup] in macOS. Pass in a value of nil to match the current system’s color scheme.\n\nThis examples shows a view that renders the navigation bar with a blue background and dark color scheme:\n\n```swift\nTabView {\n    NavigationView {\n        ContentView()\n            .toolbarBackground(.blue)\n            .toolbarColorScheme(.dark)\n    }\n    \/\/ other tabs...\n}\n```\n\nYou can provide multiple [doc:\/\/com.apple.SwiftUI\/documentation\/SwiftUI\/ToolbarPlacement] instances to customize multiple bars at once.\n\n```swift\nTabView {\n    NavigationView {\n        ContentView()\n            .toolbarBackground(\n                .blue, for: .navigationBar, .tabBar)\n            .toolbarColorScheme(\n                .dark, for: .navigationBar, .tabBar)\n    }\n}\n```\n\nNote that the provided color scheme is only respected while a background is visible in the requested bar. As the background becomes visible, the bar transitions from the color scheme of the app to the requested color scheme. You can ensure that the color scheme is always respected by specifying that the background of the bar always be visible.\n\n```swift\nNavigationView {\n    ContentView()\n        .toolbarBackground(.visible)\n        .toolbarColorScheme(.dark)\n}\n```\n\nDepending on the specified bars, the requested color scheme may not be able to be fullfilled.\n\n## Styling a toolbar\n\n- **toolbarBackground(_:for:)**: Specifies the preferred shape style of the background of a bar managed by SwiftUI.\n- **toolbarForegroundStyle(_:for:)**: Specifies the preferred foreground style of bars managed by SwiftUI.\n- **windowToolbarStyle(_:)**: Sets the style for the toolbar defined within this scene.\n- **WindowToolbarStyle**: A specification for the appearance and behavior of a window’s toolbar.\n- **toolbarLabelStyle**: The label style to apply to controls within a toolbar.\n- **ToolbarLabelStyle**: The label style of a toolbar.\n- **SpacerSizing**: A type which defines how spacers should size themselves.\n\n",
  "sections" : [
    {
      "content" : "",
      "items" : [
        {
          "description" : "Specifies the preferred shape style of the background of a bar managed by SwiftUI.",
          "name" : "toolbarBackground(_:for:)",
          "url" : "https:\/\/developer.apple.com\/documentation\/SwiftUI\/View\/toolbarBackground(_:for:)"
        },
        {
          "description" : "Specifies the preferred foreground style of bars managed by SwiftUI.",
          "name" : "toolbarForegroundStyle(_:for:)",
          "url" : "https:\/\/developer.apple.com\/documentation\/SwiftUI\/View\/toolbarForegroundStyle(_:for:)"
        },
        {
          "description" : "Sets the style for the toolbar defined within this scene.",
          "name" : "windowToolbarStyle(_:)",
          "url" : "https:\/\/developer.apple.com\/documentation\/SwiftUI\/Scene\/windowToolbarStyle(_:)"
        },
        {
          "description" : "A specification for the appearance and behavior of a window’s toolbar.",
          "name" : "WindowToolbarStyle",
          "url" : "https:\/\/developer.apple.com\/documentation\/SwiftUI\/WindowToolbarStyle"
        },
        {
          "description" : "The label style to apply to controls within a toolbar.",
          "name" : "toolbarLabelStyle",
          "url" : "https:\/\/developer.apple.com\/documentation\/SwiftUI\/EnvironmentValues\/toolbarLabelStyle"
        },
        {
          "description" : "The label style of a toolbar.",
          "name" : "ToolbarLabelStyle",
          "url" : "https:\/\/developer.apple.com\/documentation\/SwiftUI\/ToolbarLabelStyle"
        },
        {
          "description" : "A type which defines how spacers should size themselves.",
          "name" : "SpacerSizing",
          "url" : "https:\/\/developer.apple.com\/documentation\/SwiftUI\/SpacerSizing"
        }
      ],
      "title" : "Styling a toolbar"
    }
  ],
  "source" : "appleJSON",
  "title" : "toolbarColorScheme(_:for:)",
  "url" : "https:\/\/developer.apple.com\/documentation\/SwiftUI\/View\/toolbarColorScheme(_:for:)"
}