{
  "abstract" : "The origin of a view.",
  "codeExamples" : [

  ],
  "contentHash" : "88246561bedc75cce4fea68897e20bc3c665e6479638cf3ddf65b4b08e38cace",
  "crawledAt" : "2025-12-03T06:16:20Z",
  "declaration" : {
    "code" : "static let origin: UnitPoint3D",
    "language" : "swift"
  },
  "id" : "0B1ABA5D-ABD9-4F73-AF0E-D7F803AE8C80",
  "kind" : "property",
  "language" : "swift",
  "module" : "SwiftUI",
  "overview" : "## Discussion\n\nA view’s origin appears in the top-left-back corner in a left-to-right language environment, with positive x toward the right. It appears in the top-right-back corner in a right-to-left language, with positive x toward the left. Positive y is always toward the bottom of the view, and positive z points toward the front.",
  "platforms" : [
    "visionOS"
  ],
  "rawMarkdown" : "---\nsource: https:\/\/developer.apple.com\/documentation\/SwiftUI\/UnitPoint3D\/origin\ncrawled: 2025-12-03T06:16:20Z\n---\n\n# origin\n\n**Type Property**\n\nThe origin of a view.\n\n## Declaration\n\n```swift\nstatic let origin: UnitPoint3D\n```\n\n## Discussion\n\nA view’s origin appears in the top-left-back corner in a left-to-right language environment, with positive x toward the right. It appears in the top-right-back corner in a right-to-left language, with positive x toward the left. Positive y is always toward the bottom of the view, and positive z points toward the front.\n\n## Getting the origin\n\n- **zero**: A 3D unit point with all components equal to zero.\n\n",
  "sections" : [
    {
      "content" : "",
      "items" : [
        {
          "description" : "A 3D unit point with all components equal to zero.",
          "name" : "zero",
          "url" : "https:\/\/developer.apple.com\/documentation\/SwiftUI\/UnitPoint3D\/zero"
        }
      ],
      "title" : "Getting the origin"
    }
  ],
  "source" : "appleJSON",
  "title" : "origin",
  "url" : "https:\/\/developer.apple.com\/documentation\/SwiftUI\/UnitPoint3D\/origin"
}