{
  "abstract" : "Layers the views that you specify in front of this view.",
  "codeExamples" : [
    {
      "code" : "RoundedRectangle(cornerRadius: 8)\n    .frame(width: 200, height: 100)\n    .overlay(alignment: .topLeading) { Star(color: .red) }\n    .overlay(alignment: .topTrailing) { Star(color: .yellow) }\n    .overlay(alignment: .bottomLeading) { Star(color: .green) }\n    .overlay(alignment: .bottomTrailing) { Star(color: .blue) }",
      "language" : "swift"
    },
    {
      "code" : "struct Star: View {\n    var color = Color.yellow\n\n    var body: some View {\n        Image(systemName: \"star.fill\")\n            .foregroundStyle(color)\n    }\n}",
      "language" : "swift"
    },
    {
      "code" : "Color.blue\n    .frame(width: 200, height: 200)\n    .overlay {\n        Circle()\n            .frame(width: 100, height: 100)\n        Star()\n    }",
      "language" : "swift"
    },
    {
      "code" : "Color.blue\n    .frame(width: 200, height: 200)\n    .overlay(alignment: .bottom) {\n        Circle()\n            .frame(width: 100, height: 100)\n        Star()\n    }",
      "language" : "swift"
    },
    {
      "code" : "Color.blue\n    .frame(width: 200, height: 200)\n    .overlay(alignment: .bottom) {\n        ZStack(alignment: .bottom) {\n            Circle()\n                .frame(width: 100, height: 100)\n            Star()\n        }\n    }",
      "language" : "swift"
    }
  ],
  "contentHash" : "5e55b8cb7efb168d29bbbf9ae95d9767afaf33d244aa8da868a03a1e4f2a7f80",
  "crawledAt" : "2025-12-02T17:19:40Z",
  "declaration" : {
    "code" : "nonisolated func overlay<V>(alignment: Alignment = .center, @ViewBuilder content: () -> V) -> some View where V : View\n",
    "language" : "swift"
  },
  "id" : "9131F998-131E-4D28-B9E3-61DA017DF264",
  "kind" : "method",
  "language" : "swift",
  "module" : "SwiftUI",
  "overview" : "## Return Value\n\nA view that uses the specified content as a foreground.\n\n## Discussion\n\nUse this modifier to place one or more views in front of another view. For example, you can place a group of stars on a [doc:\/\/com.apple.SwiftUI\/documentation\/SwiftUI\/RoundedRectangle]:\n\nThe example above assumes that you’ve defined a `Star` view with a parameterized color:\n\nBy setting different `alignment` values for each modifier, you make the stars appear in different places on the rectangle:\n\n\n\nIf you specify more than one view in the `content` closure, the modifier collects all of the views in the closure into an implicit [doc:\/\/com.apple.SwiftUI\/documentation\/SwiftUI\/ZStack], taking them in order from back to front. For example, you can place a star and a [doc:\/\/com.apple.SwiftUI\/documentation\/SwiftUI\/Circle] on a field of [doc:\/\/com.apple.SwiftUI\/documentation\/SwiftUI\/ShapeStyle\/blue]:\n\nBoth the overlay modifier and the implicit [doc:\/\/com.apple.SwiftUI\/documentation\/SwiftUI\/ZStack] composed from the overlay content — the circle and the star — use a default [doc:\/\/com.apple.SwiftUI\/documentation\/SwiftUI\/Alignment\/center] alignment. The star appears centered on the circle, and both appear as a composite view centered in front of the square:\n\n\n\nIf you specify an alignment for the overlay, it applies to the implicit stack rather than to the individual views in the closure. You can see this if you add the [doc:\/\/com.apple.SwiftUI\/documentation\/SwiftUI\/Alignment\/bottom] alignment:\n\nThe circle and the star move down as a unit to align the stack’s bottom edge with the bottom edge of the square, while the star remains centered on the circle:\n\n\n\nTo control the placement of individual items inside the `content` closure, either use a different overlay modifier for each item, as the earlier example of stars in the corners of a rectangle demonstrates, or add an explicit [doc:\/\/com.apple.SwiftUI\/documentation\/SwiftUI\/ZStack] inside the content closure with its own alignment:\n\nThe stack alignment ensures that the star’s bottom edge aligns with the circle’s, while the overlay aligns the composite view with the square:\n\n\n\nYou can achieve layering without an overlay modifier by putting both the modified view and the overlay content into a [doc:\/\/com.apple.SwiftUI\/documentation\/SwiftUI\/ZStack]. This can produce a simpler view hierarchy, but changes the layout priority that SwiftUI applies to the views. Use the overlay modifier when you want the modified view to dominate the layout.\n\nIf you want to specify a [doc:\/\/com.apple.SwiftUI\/documentation\/SwiftUI\/ShapeStyle] like a [doc:\/\/com.apple.SwiftUI\/documentation\/SwiftUI\/Color] or a [doc:\/\/com.apple.SwiftUI\/documentation\/SwiftUI\/Material] as the overlay, use [doc:\/\/com.apple.SwiftUI\/documentation\/SwiftUI\/View\/overlay(_:ignoresSafeAreaEdges:)] instead. To specify a [doc:\/\/com.apple.SwiftUI\/documentation\/SwiftUI\/Shape], use [doc:\/\/com.apple.SwiftUI\/documentation\/SwiftUI\/View\/overlay(_:in:fillStyle:)].",
  "platforms" : [
    "iOS",
    "iPadOS",
    "Mac Catalyst",
    "macOS",
    "tvOS",
    "visionOS",
    "watchOS"
  ],
  "rawMarkdown" : "---\nsource: https:\/\/developer.apple.com\/documentation\/SwiftUI\/View\/overlay(alignment:content:)\ncrawled: 2025-12-02T17:19:40Z\n---\n\n# overlay(alignment:content:)\n\n**Instance Method**\n\nLayers the views that you specify in front of this view.\n\n## Declaration\n\n```swift\nnonisolated func overlay<V>(alignment: Alignment = .center, @ViewBuilder content: () -> V) -> some View where V : View\n\n```\n\n## Parameters\n\n- **alignment**: The alignment that the modifier uses to position the implicit [doc:\/\/com.apple.SwiftUI\/documentation\/SwiftUI\/ZStack] that groups the foreground views. The default is [doc:\/\/com.apple.SwiftUI\/documentation\/SwiftUI\/Alignment\/center].\n- **content**: A [doc:\/\/com.apple.SwiftUI\/documentation\/SwiftUI\/ViewBuilder] that you use to declare the views to draw in front of this view, stacked in the order that you list them. The last view that you list appears at the front of the stack.\n\n## Return Value\n\nA view that uses the specified content as a foreground.\n\n## Discussion\n\nUse this modifier to place one or more views in front of another view. For example, you can place a group of stars on a [doc:\/\/com.apple.SwiftUI\/documentation\/SwiftUI\/RoundedRectangle]:\n\n```swift\nRoundedRectangle(cornerRadius: 8)\n    .frame(width: 200, height: 100)\n    .overlay(alignment: .topLeading) { Star(color: .red) }\n    .overlay(alignment: .topTrailing) { Star(color: .yellow) }\n    .overlay(alignment: .bottomLeading) { Star(color: .green) }\n    .overlay(alignment: .bottomTrailing) { Star(color: .blue) }\n```\n\nThe example above assumes that you’ve defined a `Star` view with a parameterized color:\n\n```swift\nstruct Star: View {\n    var color = Color.yellow\n\n    var body: some View {\n        Image(systemName: \"star.fill\")\n            .foregroundStyle(color)\n    }\n}\n```\n\nBy setting different `alignment` values for each modifier, you make the stars appear in different places on the rectangle:\n\n\n\nIf you specify more than one view in the `content` closure, the modifier collects all of the views in the closure into an implicit [doc:\/\/com.apple.SwiftUI\/documentation\/SwiftUI\/ZStack], taking them in order from back to front. For example, you can place a star and a [doc:\/\/com.apple.SwiftUI\/documentation\/SwiftUI\/Circle] on a field of [doc:\/\/com.apple.SwiftUI\/documentation\/SwiftUI\/ShapeStyle\/blue]:\n\n```swift\nColor.blue\n    .frame(width: 200, height: 200)\n    .overlay {\n        Circle()\n            .frame(width: 100, height: 100)\n        Star()\n    }\n```\n\nBoth the overlay modifier and the implicit [doc:\/\/com.apple.SwiftUI\/documentation\/SwiftUI\/ZStack] composed from the overlay content — the circle and the star — use a default [doc:\/\/com.apple.SwiftUI\/documentation\/SwiftUI\/Alignment\/center] alignment. The star appears centered on the circle, and both appear as a composite view centered in front of the square:\n\n\n\nIf you specify an alignment for the overlay, it applies to the implicit stack rather than to the individual views in the closure. You can see this if you add the [doc:\/\/com.apple.SwiftUI\/documentation\/SwiftUI\/Alignment\/bottom] alignment:\n\n```swift\nColor.blue\n    .frame(width: 200, height: 200)\n    .overlay(alignment: .bottom) {\n        Circle()\n            .frame(width: 100, height: 100)\n        Star()\n    }\n```\n\nThe circle and the star move down as a unit to align the stack’s bottom edge with the bottom edge of the square, while the star remains centered on the circle:\n\n\n\nTo control the placement of individual items inside the `content` closure, either use a different overlay modifier for each item, as the earlier example of stars in the corners of a rectangle demonstrates, or add an explicit [doc:\/\/com.apple.SwiftUI\/documentation\/SwiftUI\/ZStack] inside the content closure with its own alignment:\n\n```swift\nColor.blue\n    .frame(width: 200, height: 200)\n    .overlay(alignment: .bottom) {\n        ZStack(alignment: .bottom) {\n            Circle()\n                .frame(width: 100, height: 100)\n            Star()\n        }\n    }\n```\n\nThe stack alignment ensures that the star’s bottom edge aligns with the circle’s, while the overlay aligns the composite view with the square:\n\n\n\nYou can achieve layering without an overlay modifier by putting both the modified view and the overlay content into a [doc:\/\/com.apple.SwiftUI\/documentation\/SwiftUI\/ZStack]. This can produce a simpler view hierarchy, but changes the layout priority that SwiftUI applies to the views. Use the overlay modifier when you want the modified view to dominate the layout.\n\nIf you want to specify a [doc:\/\/com.apple.SwiftUI\/documentation\/SwiftUI\/ShapeStyle] like a [doc:\/\/com.apple.SwiftUI\/documentation\/SwiftUI\/Color] or a [doc:\/\/com.apple.SwiftUI\/documentation\/SwiftUI\/Material] as the overlay, use [doc:\/\/com.apple.SwiftUI\/documentation\/SwiftUI\/View\/overlay(_:ignoresSafeAreaEdges:)] instead. To specify a [doc:\/\/com.apple.SwiftUI\/documentation\/SwiftUI\/Shape], use [doc:\/\/com.apple.SwiftUI\/documentation\/SwiftUI\/View\/overlay(_:in:fillStyle:)].\n\n## Layering views\n\n- **Adding a background to your view**: Compose a background behind your view and extend it beyond the safe area insets.\n- **ZStack**: A view that overlays its subviews, aligning them in both axes.\n- **zIndex(_:)**: Controls the display order of overlapping views.\n- **background(alignment:content:)**: Layers the views that you specify behind this view.\n- **background(_:ignoresSafeAreaEdges:)**: Sets the view’s background to a style.\n- **background(ignoresSafeAreaEdges:)**: Sets the view’s background to the default background style.\n- **background(_:in:fillStyle:)**: Sets the view’s background to an insettable shape filled with a style.\n- **background(in:fillStyle:)**: Sets the view’s background to an insettable shape filled with the default background style.\n- **overlay(_:ignoresSafeAreaEdges:)**: Layers the specified style in front of this view.\n- **overlay(_:in:fillStyle:)**: Layers a shape that you specify in front of this view.\n- **backgroundMaterial**: The material underneath the current view.\n- **containerBackground(_:for:)**: Sets the container background of the enclosing container using a view.\n- **containerBackground(for:alignment:content:)**: Sets the container background of the enclosing container using a view.\n- **ContainerBackgroundPlacement**: The placement of a container background.\n\n",
  "sections" : [
    {
      "content" : "",
      "items" : [
        {
          "description" : "Compose a background behind your view and extend it beyond the safe area insets.",
          "name" : "Adding a background to your view",
          "url" : "https:\/\/developer.apple.com\/documentation\/SwiftUI\/Adding-a-Background-to-Your-View"
        },
        {
          "description" : "A view that overlays its subviews, aligning them in both axes.",
          "name" : "ZStack",
          "url" : "https:\/\/developer.apple.com\/documentation\/SwiftUI\/ZStack"
        },
        {
          "description" : "Controls the display order of overlapping views.",
          "name" : "zIndex(_:)",
          "url" : "https:\/\/developer.apple.com\/documentation\/SwiftUI\/View\/zIndex(_:)"
        },
        {
          "description" : "Layers the views that you specify behind this view.",
          "name" : "background(alignment:content:)",
          "url" : "https:\/\/developer.apple.com\/documentation\/SwiftUI\/View\/background(alignment:content:)"
        },
        {
          "description" : "Sets the view’s background to a style.",
          "name" : "background(_:ignoresSafeAreaEdges:)",
          "url" : "https:\/\/developer.apple.com\/documentation\/SwiftUI\/View\/background(_:ignoresSafeAreaEdges:)"
        },
        {
          "description" : "Sets the view’s background to the default background style.",
          "name" : "background(ignoresSafeAreaEdges:)",
          "url" : "https:\/\/developer.apple.com\/documentation\/SwiftUI\/View\/background(ignoresSafeAreaEdges:)"
        },
        {
          "description" : "Sets the view’s background to an insettable shape filled with a style.",
          "name" : "background(_:in:fillStyle:)",
          "url" : "https:\/\/developer.apple.com\/documentation\/SwiftUI\/View\/background(_:in:fillStyle:)"
        },
        {
          "description" : "Sets the view’s background to an insettable shape filled with the default background style.",
          "name" : "background(in:fillStyle:)",
          "url" : "https:\/\/developer.apple.com\/documentation\/SwiftUI\/View\/background(in:fillStyle:)"
        },
        {
          "description" : "Layers the specified style in front of this view.",
          "name" : "overlay(_:ignoresSafeAreaEdges:)",
          "url" : "https:\/\/developer.apple.com\/documentation\/SwiftUI\/View\/overlay(_:ignoresSafeAreaEdges:)"
        },
        {
          "description" : "Layers a shape that you specify in front of this view.",
          "name" : "overlay(_:in:fillStyle:)",
          "url" : "https:\/\/developer.apple.com\/documentation\/SwiftUI\/View\/overlay(_:in:fillStyle:)"
        },
        {
          "description" : "The material underneath the current view.",
          "name" : "backgroundMaterial",
          "url" : "https:\/\/developer.apple.com\/documentation\/SwiftUI\/EnvironmentValues\/backgroundMaterial"
        },
        {
          "description" : "Sets the container background of the enclosing container using a view.",
          "name" : "containerBackground(_:for:)",
          "url" : "https:\/\/developer.apple.com\/documentation\/SwiftUI\/View\/containerBackground(_:for:)"
        },
        {
          "description" : "Sets the container background of the enclosing container using a view.",
          "name" : "containerBackground(for:alignment:content:)",
          "url" : "https:\/\/developer.apple.com\/documentation\/SwiftUI\/View\/containerBackground(for:alignment:content:)"
        },
        {
          "description" : "The placement of a container background.",
          "name" : "ContainerBackgroundPlacement",
          "url" : "https:\/\/developer.apple.com\/documentation\/SwiftUI\/ContainerBackgroundPlacement"
        }
      ],
      "title" : "Layering views"
    }
  ],
  "source" : "appleJSON",
  "title" : "overlay(alignment:content:)",
  "url" : "https:\/\/developer.apple.com\/documentation\/SwiftUI\/View\/overlay(alignment:content:)"
}