{
  "abstract" : "An effect that applies a custom tint to the passthrough video by multiplying the passthrough with a [doc:\/\/com.apple.SwiftUI\/documentation\/SwiftUI\/Color].",
  "codeExamples" : [

  ],
  "contentHash" : "9b2ec60982528b378caca3523f53d396543ba0b88cae848471461f1984dc32c2",
  "crawledAt" : "2025-12-03T05:49:37Z",
  "declaration" : {
    "code" : "static func colorMultiply(_ color: Color) -> SurroundingsEffect",
    "language" : "swift"
  },
  "id" : "D2691A67-87DE-4CB1-9EEE-BD8E0F1129BB",
  "kind" : "method",
  "language" : "swift",
  "module" : "SwiftUI",
  "overview" : "## Discussion\n\nUse this with the [doc:\/\/com.apple.SwiftUI\/documentation\/SwiftUI\/View\/preferredSurroundingsEffect(_:)] view modifier when you want to tint the passthrough while displaying a particular view. The system may decide to limit how much each color in the passthrough can be brightened or darkened. `Color.black` will cause no passthrough to be visible, and `Color.white` will have no effect. `Color(red: 1.15, green: 1.0, blue: 1.0)` would brighten the red in the passthrough by 15 percent. This effect will only be applied while an immersive space is opened.",
  "platforms" : [
    "macOS",
    "visionOS"
  ],
  "rawMarkdown" : "---\nsource: https:\/\/developer.apple.com\/documentation\/SwiftUI\/SurroundingsEffect\/colorMultiply(_:)\ncrawled: 2025-12-03T05:49:37Z\n---\n\n# colorMultiply(_:)\n\n**Type Method**\n\nAn effect that applies a custom tint to the passthrough video by multiplying the passthrough with a [doc:\/\/com.apple.SwiftUI\/documentation\/SwiftUI\/Color].\n\n## Declaration\n\n```swift\nstatic func colorMultiply(_ color: Color) -> SurroundingsEffect\n```\n\n## Parameters\n\n- **color**: The color to bias the passthrough toward. The opacity of the color is ignored. Use the extended color space to brighten the passthrough.\n\n## Discussion\n\nUse this with the [doc:\/\/com.apple.SwiftUI\/documentation\/SwiftUI\/View\/preferredSurroundingsEffect(_:)] view modifier when you want to tint the passthrough while displaying a particular view. The system may decide to limit how much each color in the passthrough can be brightened or darkened. `Color.black` will cause no passthrough to be visible, and `Color.white` will have no effect. `Color(red: 1.15, green: 1.0, blue: 1.0)` would brighten the red in the passthrough by 15 percent. This effect will only be applied while an immersive space is opened.\n\n",
  "sections" : [

  ],
  "source" : "appleJSON",
  "title" : "colorMultiply(_:)",
  "url" : "https:\/\/developer.apple.com\/documentation\/SwiftUI\/SurroundingsEffect\/colorMultiply(_:)"
}