{
  "abstract" : "A control that toggles between on and off states.",
  "codeExamples" : [
    {
      "code" : "@State private var vibrateOnRing = false\n\nvar body: some View {\n    Toggle(isOn: $vibrateOnRing) {\n        Text(\"Vibrate on Ring\")\n    }\n}",
      "language" : "swift"
    },
    {
      "code" : "@State private var vibrateOnRing = true\n\nvar body: some View {\n    Toggle(\n        \"Vibrate on Ring\",\n        systemImage: \"dot.radiowaves.left.and.right\",\n        isOn: $vibrateOnRing\n    )\n}",
      "language" : "swift"
    },
    {
      "code" : "@State private var vibrateOnRing = true\n\nvar body: some View {\n    Toggle(\"Vibrate on Ring\", isOn: $vibrateOnRing)\n}",
      "language" : "swift"
    },
    {
      "code" : "@State private var vibrateOnRing = false\n\nvar body: some View {\n    Toggle(isOn: $vibrateOnRing) {\n        Text(\"Vibrate on Ring\")\n        Text(\"Enable vibration when the phone rings\")\n    }\n}",
      "language" : "swift"
    },
    {
      "code" : "VStack {\n    Toggle(\"Vibrate on Ring\", isOn: $vibrateOnRing)\n    Toggle(\"Vibrate on Silent\", isOn: $vibrateOnSilent)\n}\n.toggleStyle(.switch)",
      "language" : "swift"
    }
  ],
  "conformsTo" : [
    "View"
  ],
  "contentHash" : "d5bef9a33a6f7cc0e75a12b1feaf07e105aee71fab70d50638d660c8c14fb3b5",
  "crawledAt" : "2025-12-04T11:40:53Z",
  "declaration" : {
    "code" : "struct Toggle<Label> where Label : View",
    "language" : "swift"
  },
  "id" : "6A72CAB5-8789-4D34-8DE6-FC36D0FF1B5A",
  "kind" : "struct",
  "language" : "swift",
  "module" : "SwiftUI",
  "overview" : "## Overview\n\nYou create a toggle by providing an `isOn` binding and a label. Bind `isOn` to a Boolean property that determines whether the toggle is on or off. Set the label to a view that visually describes the purpose of switching between toggle states. For example:\n\nFor the common case of [doc:\/\/com.apple.SwiftUI\/documentation\/SwiftUI\/Label] based labels, you can use the convenience initializer that takes a title string (or localized string key) and the name of a system image:\n\nFor text-only labels, you can use the convenience initializer that takes a title string (or localized string key) as its first parameter, instead of a trailing closure:\n\nFor cases where adding a subtitle to the label is desired, use a view builder that creates multiple `Text` views where the first text represents the title and the second text represents the subtitle:\n\n### Styling toggles\n\nToggles use a default style that varies based on both the platform and the context. For more information, read about the [doc:\/\/com.apple.SwiftUI\/documentation\/SwiftUI\/ToggleStyle\/automatic] toggle style.\n\nYou can customize the appearance and interaction of toggles by applying styles using the [doc:\/\/com.apple.SwiftUI\/documentation\/SwiftUI\/View\/toggleStyle(_:)] modifier. You can apply built-in styles, like [doc:\/\/com.apple.SwiftUI\/documentation\/SwiftUI\/ToggleStyle\/switch], to either a toggle, or to a view hierarchy that contains toggles:\n\nYou can also define custom styles by creating a type that conforms to the [doc:\/\/com.apple.SwiftUI\/documentation\/SwiftUI\/ToggleStyle] protocol.",
  "platforms" : [
    "iOS",
    "iPadOS",
    "Mac Catalyst",
    "macOS",
    "tvOS",
    "visionOS",
    "watchOS"
  ],
  "rawMarkdown" : "---\nsource: https:\/\/developer.apple.com\/documentation\/swiftui\/toggle\ncrawled: 2025-12-04T11:40:53Z\n---\n\n# Toggle\n\n**Structure**\n\nA control that toggles between on and off states.\n\n## Declaration\n\n```swift\nstruct Toggle<Label> where Label : View\n```\n\n## Overview\n\nYou create a toggle by providing an `isOn` binding and a label. Bind `isOn` to a Boolean property that determines whether the toggle is on or off. Set the label to a view that visually describes the purpose of switching between toggle states. For example:\n\n```swift\n@State private var vibrateOnRing = false\n\nvar body: some View {\n    Toggle(isOn: $vibrateOnRing) {\n        Text(\"Vibrate on Ring\")\n    }\n}\n```\n\nFor the common case of [doc:\/\/com.apple.SwiftUI\/documentation\/SwiftUI\/Label] based labels, you can use the convenience initializer that takes a title string (or localized string key) and the name of a system image:\n\n```swift\n@State private var vibrateOnRing = true\n\nvar body: some View {\n    Toggle(\n        \"Vibrate on Ring\",\n        systemImage: \"dot.radiowaves.left.and.right\",\n        isOn: $vibrateOnRing\n    )\n}\n```\n\nFor text-only labels, you can use the convenience initializer that takes a title string (or localized string key) as its first parameter, instead of a trailing closure:\n\n```swift\n@State private var vibrateOnRing = true\n\nvar body: some View {\n    Toggle(\"Vibrate on Ring\", isOn: $vibrateOnRing)\n}\n```\n\nFor cases where adding a subtitle to the label is desired, use a view builder that creates multiple `Text` views where the first text represents the title and the second text represents the subtitle:\n\n```swift\n@State private var vibrateOnRing = false\n\nvar body: some View {\n    Toggle(isOn: $vibrateOnRing) {\n        Text(\"Vibrate on Ring\")\n        Text(\"Enable vibration when the phone rings\")\n    }\n}\n```\n\n\n\n### Styling toggles\n\nToggles use a default style that varies based on both the platform and the context. For more information, read about the [doc:\/\/com.apple.SwiftUI\/documentation\/SwiftUI\/ToggleStyle\/automatic] toggle style.\n\nYou can customize the appearance and interaction of toggles by applying styles using the [doc:\/\/com.apple.SwiftUI\/documentation\/SwiftUI\/View\/toggleStyle(_:)] modifier. You can apply built-in styles, like [doc:\/\/com.apple.SwiftUI\/documentation\/SwiftUI\/ToggleStyle\/switch], to either a toggle, or to a view hierarchy that contains toggles:\n\n```swift\nVStack {\n    Toggle(\"Vibrate on Ring\", isOn: $vibrateOnRing)\n    Toggle(\"Vibrate on Silent\", isOn: $vibrateOnSilent)\n}\n.toggleStyle(.switch)\n```\n\nYou can also define custom styles by creating a type that conforms to the [doc:\/\/com.apple.SwiftUI\/documentation\/SwiftUI\/ToggleStyle] protocol.\n\n## Creating a toggle\n\n- **init(_:isOn:)**: Creates a toggle that generates its label from a localized string key.\n- **init(isOn:label:)**: Creates a toggle that displays a custom label.\n- **init(_:image:isOn:)**: Creates a toggle that generates its label from a localized string key and image resource.\n- **init(_:systemImage:isOn:)**: Creates a toggle that generates its label from a localized string key and system image.\n\n## Creating a toggle for a collection\n\n- **init(_:sources:isOn:)**: Creates a toggle representing a collection of values that generates its label from a localized string key.\n- **init(sources:isOn:label:)**: Creates a toggle representing a collection of values with a custom label.\n- **init(_:image:sources:isOn:)**: Creates a toggle representing a collection of values that generates its label from a localized string key and image resource.\n- **init(_:systemImage:sources:isOn:)**: Creates a toggle representing a collection of values that generates its label from a localized string key and system image.\n\n## Creating a toggle from a configuration\n\n- **init(_:)**: Creates a toggle based on a toggle style configuration.\n\n## Creating a toggle for an App Intent\n\n- **init(isOn:intent:label:)**: Creates a toggle performing an `AppIntent`.\n- **init(_:isOn:intent:)**: Creates a toggle performing an `AppIntent` and generates its label from a localized string key.\n\n## Getting numeric inputs\n\n- **Slider**: A control for selecting a value from a bounded linear range of values.\n- **Stepper**: A control that performs increment and decrement actions.\n- **toggleStyle(_:)**: Sets the style for toggles in a view hierarchy.\n\n## Conforms To\n\n- View\n\n",
  "sections" : [
    {
      "content" : "",
      "items" : [
        {
          "description" : "Creates a toggle that generates its label from a localized string key.",
          "name" : "init(_:isOn:)",
          "url" : "https:\/\/developer.apple.com\/documentation\/SwiftUI\/Toggle\/init(_:isOn:)"
        },
        {
          "description" : "Creates a toggle that displays a custom label.",
          "name" : "init(isOn:label:)",
          "url" : "https:\/\/developer.apple.com\/documentation\/SwiftUI\/Toggle\/init(isOn:label:)"
        },
        {
          "description" : "Creates a toggle that generates its label from a localized string key and image resource.",
          "name" : "init(_:image:isOn:)",
          "url" : "https:\/\/developer.apple.com\/documentation\/SwiftUI\/Toggle\/init(_:image:isOn:)"
        },
        {
          "description" : "Creates a toggle that generates its label from a localized string key and system image.",
          "name" : "init(_:systemImage:isOn:)",
          "url" : "https:\/\/developer.apple.com\/documentation\/SwiftUI\/Toggle\/init(_:systemImage:isOn:)"
        }
      ],
      "title" : "Creating a toggle"
    },
    {
      "content" : "",
      "items" : [
        {
          "description" : "Creates a toggle representing a collection of values that generates its label from a localized string key.",
          "name" : "init(_:sources:isOn:)",
          "url" : "https:\/\/developer.apple.com\/documentation\/SwiftUI\/Toggle\/init(_:sources:isOn:)"
        },
        {
          "description" : "Creates a toggle representing a collection of values with a custom label.",
          "name" : "init(sources:isOn:label:)",
          "url" : "https:\/\/developer.apple.com\/documentation\/SwiftUI\/Toggle\/init(sources:isOn:label:)"
        },
        {
          "description" : "Creates a toggle representing a collection of values that generates its label from a localized string key and image resource.",
          "name" : "init(_:image:sources:isOn:)",
          "url" : "https:\/\/developer.apple.com\/documentation\/SwiftUI\/Toggle\/init(_:image:sources:isOn:)"
        },
        {
          "description" : "Creates a toggle representing a collection of values that generates its label from a localized string key and system image.",
          "name" : "init(_:systemImage:sources:isOn:)",
          "url" : "https:\/\/developer.apple.com\/documentation\/SwiftUI\/Toggle\/init(_:systemImage:sources:isOn:)"
        }
      ],
      "title" : "Creating a toggle for a collection"
    },
    {
      "content" : "",
      "items" : [
        {
          "description" : "Creates a toggle based on a toggle style configuration.",
          "name" : "init(_:)",
          "url" : "https:\/\/developer.apple.com\/documentation\/SwiftUI\/Toggle\/init(_:)"
        }
      ],
      "title" : "Creating a toggle from a configuration"
    },
    {
      "content" : "",
      "items" : [
        {
          "description" : "Creates a toggle performing an `AppIntent`.",
          "name" : "init(isOn:intent:label:)",
          "url" : "https:\/\/developer.apple.com\/documentation\/SwiftUI\/Toggle\/init(isOn:intent:label:)"
        },
        {
          "description" : "Creates a toggle performing an `AppIntent` and generates its label from a localized string key.",
          "name" : "init(_:isOn:intent:)",
          "url" : "https:\/\/developer.apple.com\/documentation\/SwiftUI\/Toggle\/init(_:isOn:intent:)"
        }
      ],
      "title" : "Creating a toggle for an App Intent"
    },
    {
      "content" : "",
      "items" : [
        {
          "description" : "A control for selecting a value from a bounded linear range of values.",
          "name" : "Slider",
          "url" : "https:\/\/developer.apple.com\/documentation\/SwiftUI\/Slider"
        },
        {
          "description" : "A control that performs increment and decrement actions.",
          "name" : "Stepper",
          "url" : "https:\/\/developer.apple.com\/documentation\/SwiftUI\/Stepper"
        },
        {
          "description" : "Sets the style for toggles in a view hierarchy.",
          "name" : "toggleStyle(_:)",
          "url" : "https:\/\/developer.apple.com\/documentation\/SwiftUI\/View\/toggleStyle(_:)"
        }
      ],
      "title" : "Getting numeric inputs"
    }
  ],
  "source" : "appleJSON",
  "title" : "Toggle",
  "url" : "https:\/\/developer.apple.com\/documentation\/swiftui\/toggle"
}