{
  "abstract" : "Presents a confirmation dialog with a message using data to produce the dialog’s content and a text view for the message.",
  "codeExamples" : [
    {
      "code" : "struct FileDetails: Identifiable {\n    var id: String { name }\n    let name: String\n    let fileType: UTType\n}\nstruct ConfirmFileImport: View {\n    @State private var isConfirming = false\n    @State private var dialogDetail: FileDetails?\n    var body: some View {\n        Button(\"Import File\") {\n            dialogDetail = FileDetails(\n                name: \"MyImageFile.png\", fileType: .png)\n            isConfirming = true\n        }\n        .confirmationDialog(\n            Text(\"Import New File?\"),\n            isPresented: $isConfirming, presenting: dialogDetail\n        ) { detail in\n            Button {\n                \/\/ Handle import action.\n            } label: {\n                Text(\"Import \\(detail.name)\")\n            }\n            Button(\"Cancel\", role: .cancel) {\n                dialogDetail = nil\n            }\n        } message: { detail in\n            Text(\n                \"\"\"\n                This will add \\(detail.name).\\(detail.fileType) \\\n                to your library.\n                \"\"\")\n        }\n    }\n}",
      "language" : "swift"
    }
  ],
  "contentHash" : "d48e786a710a5125212f3945cd3932e60178dc3505f1113e65204b2591481050",
  "crawledAt" : "2025-12-02T17:11:49Z",
  "declaration" : {
    "code" : "nonisolated func confirmationDialog<A, M, T>(_ title: Text, isPresented: Binding<Bool>, titleVisibility: Visibility = .automatic, presenting data: T?, @ViewBuilder actions: (T) -> A, @ViewBuilder message: (T) -> M) -> some View where A : View, M : View\n",
    "language" : "swift"
  },
  "id" : "7EDC6928-0AE4-442F-A852-A48B3285D2BE",
  "kind" : "method",
  "language" : "swift",
  "module" : "SwiftUI",
  "overview" : "## Discussion\n\nIn order for the interface to appear, both `isPresented` must be `true` and `data` must not be `nil`. `data` should not change after the presentation occurs. Any changes which occur after the presentation occurs will be ignored.\n\nUse this method when you need to populate the fields of a confirmation dialog with content from a data source. The example below shows a custom data source, `FileDetails`, that provides data to populate the dialog:\n\nAll actions in a confirmation dialog will dismiss the dialog after the action runs. The default button will be shown with greater prominence. You can influence the default button by assigning it the [doc:\/\/com.apple.SwiftUI\/documentation\/SwiftUI\/KeyboardShortcut\/defaultAction] keyboard shortcut.\n\nThe system may reorder the buttons based on their role and prominence.\n\nDialogs include a standard dismiss action by default. If you provide a button with a role of [doc:\/\/com.apple.SwiftUI\/documentation\/SwiftUI\/ButtonRole\/cancel], that button takes the place of the default dismiss action. You don’t have to dismiss the presentation with the cancel button’s action.\n\nOn iOS, tvOS, and watchOS, confirmation dialogs only support controls with labels that are `Text`. Passing any other type of view results in the content being omitted.",
  "platforms" : [
    "iOS",
    "iPadOS",
    "Mac Catalyst",
    "macOS",
    "tvOS",
    "visionOS",
    "watchOS"
  ],
  "rawMarkdown" : "---\nsource: https:\/\/developer.apple.com\/documentation\/SwiftUI\/View\/confirmationDialog(_:isPresented:titleVisibility:presenting:actions:message:)\ncrawled: 2025-12-02T17:11:49Z\n---\n\n# confirmationDialog(_:isPresented:titleVisibility:presenting:actions:message:)\n\n**Instance Method**\n\nPresents a confirmation dialog with a message using data to produce the dialog’s content and a text view for the message.\n\n## Declaration\n\n```swift\nnonisolated func confirmationDialog<A, M, T>(_ title: Text, isPresented: Binding<Bool>, titleVisibility: Visibility = .automatic, presenting data: T?, @ViewBuilder actions: (T) -> A, @ViewBuilder message: (T) -> M) -> some View where A : View, M : View\n\n```\n\n## Parameters\n\n- **title**: The title of the dialog.\n- **isPresented**: A binding to a Boolean value that determines whether to present the dialog. When the user presses or taps the dialog’s default action button, the system sets this value to `false`, dismissing the dialog.\n- **titleVisibility**: The visibility of the dialog’s title. The default value is [doc:\/\/com.apple.SwiftUI\/documentation\/SwiftUI\/Visibility\/automatic].\n- **data**: An optional source of truth for the confirmation dialog. The system passes the contents to the modifier’s closures. You use this data to populate the fields of a confirmation dialog that you create that the system displays to the user.\n- **actions**: A view builder returning the dialog’s actions given the currently available data.\n- **message**: A view builder returning the message for the dialog given the currently available data.\n\n## Discussion\n\nIn order for the interface to appear, both `isPresented` must be `true` and `data` must not be `nil`. `data` should not change after the presentation occurs. Any changes which occur after the presentation occurs will be ignored.\n\nUse this method when you need to populate the fields of a confirmation dialog with content from a data source. The example below shows a custom data source, `FileDetails`, that provides data to populate the dialog:\n\n```swift\nstruct FileDetails: Identifiable {\n    var id: String { name }\n    let name: String\n    let fileType: UTType\n}\nstruct ConfirmFileImport: View {\n    @State private var isConfirming = false\n    @State private var dialogDetail: FileDetails?\n    var body: some View {\n        Button(\"Import File\") {\n            dialogDetail = FileDetails(\n                name: \"MyImageFile.png\", fileType: .png)\n            isConfirming = true\n        }\n        .confirmationDialog(\n            Text(\"Import New File?\"),\n            isPresented: $isConfirming, presenting: dialogDetail\n        ) { detail in\n            Button {\n                \/\/ Handle import action.\n            } label: {\n                Text(\"Import \\(detail.name)\")\n            }\n            Button(\"Cancel\", role: .cancel) {\n                dialogDetail = nil\n            }\n        } message: { detail in\n            Text(\n                \"\"\"\n                This will add \\(detail.name).\\(detail.fileType) \\\n                to your library.\n                \"\"\")\n        }\n    }\n}\n```\n\nAll actions in a confirmation dialog will dismiss the dialog after the action runs. The default button will be shown with greater prominence. You can influence the default button by assigning it the [doc:\/\/com.apple.SwiftUI\/documentation\/SwiftUI\/KeyboardShortcut\/defaultAction] keyboard shortcut.\n\nThe system may reorder the buttons based on their role and prominence.\n\nDialogs include a standard dismiss action by default. If you provide a button with a role of [doc:\/\/com.apple.SwiftUI\/documentation\/SwiftUI\/ButtonRole\/cancel], that button takes the place of the default dismiss action. You don’t have to dismiss the presentation with the cancel button’s action.\n\n\n\nOn iOS, tvOS, and watchOS, confirmation dialogs only support controls with labels that are `Text`. Passing any other type of view results in the content being omitted.\n\n## Showing a confirmation dialog with a message\n\n- **confirmationDialog(_:isPresented:titleVisibility:actions:message:)**: Presents a confirmation dialog with a message when a given condition is true, using a text view for the title.\n- **dismissalConfirmationDialog(_:shouldPresent:actions:message:)**: Presents a confirmation dialog when a dismiss action has been triggered.\n\n",
  "sections" : [
    {
      "content" : "",
      "items" : [
        {
          "description" : "Presents a confirmation dialog with a message when a given condition is true, using a text view for the title.",
          "name" : "confirmationDialog(_:isPresented:titleVisibility:actions:message:)",
          "url" : "https:\/\/developer.apple.com\/documentation\/SwiftUI\/View\/confirmationDialog(_:isPresented:titleVisibility:actions:message:)"
        },
        {
          "description" : "Presents a confirmation dialog when a dismiss action has been triggered.",
          "name" : "dismissalConfirmationDialog(_:shouldPresent:actions:message:)",
          "url" : "https:\/\/developer.apple.com\/documentation\/SwiftUI\/View\/dismissalConfirmationDialog(_:shouldPresent:actions:message:)"
        }
      ],
      "title" : "Showing a confirmation dialog with a message"
    }
  ],
  "source" : "appleJSON",
  "title" : "confirmationDialog(_:isPresented:titleVisibility:presenting:actions:message:)",
  "url" : "https:\/\/developer.apple.com\/documentation\/SwiftUI\/View\/confirmationDialog(_:isPresented:titleVisibility:presenting:actions:message:)"
}