{
  "abstract" : "Constrains this view’s dimensions to the specified aspect ratio.",
  "codeExamples" : [
    {
      "code" : "Ellipse()\n    .fill(Color.purple)\n    .aspectRatio(0.75, contentMode: .fit)\n    .frame(width: 200, height: 200)\n    .border(Color(white: 0.75))",
      "language" : "swift"
    }
  ],
  "contentHash" : "88807d50eee1af9a3366f97ec915f21336a8ab08054af098472c3ca59257da51",
  "crawledAt" : "2025-12-01T11:16:39Z",
  "declaration" : {
    "code" : "nonisolated func aspectRatio(_ aspectRatio: CGFloat? = nil, contentMode: ContentMode) -> some View\n",
    "language" : "swift"
  },
  "id" : "67213BC4-F904-4306-936C-BE0D3B0B4700",
  "kind" : "method",
  "module" : "SwiftUI",
  "overview" : "## Return Value\n\nA view that constrains this view’s dimensions to the aspect ratio of the given size using `contentMode` as its scaling algorithm.\n\n## Discussion\n\nUse `aspectRatio(_:contentMode:)` to constrain a view’s dimensions to an aspect ratio specified by a [doc:\/\/com.apple.documentation\/documentation\/CoreFoundation\/CGFloat-swift.struct] using the specified content mode.\n\nIf this view is resizable, the resulting view will have `aspectRatio` as its aspect ratio. In this example, the purple ellipse has a 3:4 width-to-height ratio, and scales to fit its frame:\n\n",
  "platforms" : [
    "iOS",
    "iPadOS",
    "Mac Catalyst",
    "macOS",
    "tvOS",
    "visionOS",
    "watchOS"
  ],
  "rawMarkdown" : "---\nsource: https:\/\/developer.apple.com\/documentation\/swiftui\/view\/aspectratio(_:contentmode:)\ncrawled: 2025-12-01T11:16:39Z\n---\n\n# aspectRatio(_:contentMode:)\n\n**Instance Method**\n\nConstrains this view’s dimensions to the specified aspect ratio.\n\n## Declaration\n\n```swift\nnonisolated func aspectRatio(_ aspectRatio: CGFloat? = nil, contentMode: ContentMode) -> some View\n\n```\n\n## Parameters\n\n- **aspectRatio**: The ratio of width to height to use for the resulting view. Use `nil` to maintain the current aspect ratio in the resulting view.\n- **contentMode**: A flag that indicates whether this view fits or fills the parent context.\n\n## Return Value\n\nA view that constrains this view’s dimensions to the aspect ratio of the given size using `contentMode` as its scaling algorithm.\n\n## Discussion\n\nUse `aspectRatio(_:contentMode:)` to constrain a view’s dimensions to an aspect ratio specified by a [doc:\/\/com.apple.documentation\/documentation\/CoreFoundation\/CGFloat-swift.struct] using the specified content mode.\n\nIf this view is resizable, the resulting view will have `aspectRatio` as its aspect ratio. In this example, the purple ellipse has a 3:4 width-to-height ratio, and scales to fit its frame:\n\n```swift\nEllipse()\n    .fill(Color.purple)\n    .aspectRatio(0.75, contentMode: .fit)\n    .frame(width: 200, height: 200)\n    .border(Color(white: 0.75))\n```\n\n\n\n## Scaling, rotating, or transforming a view\n\n- **scaledToFill()**: Scales this view to fill its parent.\n- **scaledToFit()**: Scales this view to fit its parent.\n- **scaleEffect(_:anchor:)**: Scales this view’s rendered output by the given amount in both the horizontal and vertical directions, relative to an anchor point.\n- **scaleEffect(_:anchor:)**: Scales this view’s rendered output by the given amount in both the horizontal and vertical directions, relative to an anchor point.\n- **scaleEffect(x:y:anchor:)**: Scales this view’s rendered output by the given horizontal and vertical amounts, relative to an anchor point.\n- **scaleEffect(x:y:z:anchor:)**: Scales this view by the specified horizontal, vertical, and depth factors, relative to an anchor point.\n- **rotationEffect(_:anchor:)**: Rotates a view’s rendered output in two dimensions around the specified point.\n- **rotation3DEffect(_:axis:anchor:anchorZ:perspective:)**: Renders a view’s content as if it’s rotated in three dimensions around the specified axis.\n- **perspectiveRotationEffect(_:axis:anchor:anchorZ:perspective:)**: Renders a view’s content as if it’s rotated in three dimensions around the specified axis.\n- **rotation3DEffect(_:anchor:)**: Rotates the view’s content by the specified 3D rotation value.\n- **rotation3DEffect(_:axis:anchor:)**: Rotates the view’s content by an angle about an axis that you specify as a tuple of elements.\n- **transformEffect(_:)**: Applies an affine transformation to this view’s rendered output.\n- **transform3DEffect(_:)**: Applies a 3D transformation to this view’s rendered output.\n- **projectionEffect(_:)**: Applies a projection transformation to this view’s rendered output.\n- **ProjectionTransform**\n\n",
  "sections" : [
    {
      "content" : "",
      "items" : [
        {
          "description" : "Scales this view to fill its parent.",
          "name" : "scaledToFill()",
          "url" : "https:\/\/developer.apple.com\/documentation\/SwiftUI\/View\/scaledToFill()"
        },
        {
          "description" : "Scales this view to fit its parent.",
          "name" : "scaledToFit()",
          "url" : "https:\/\/developer.apple.com\/documentation\/SwiftUI\/View\/scaledToFit()"
        },
        {
          "description" : "Scales this view’s rendered output by the given amount in both the horizontal and vertical directions, relative to an anchor point.",
          "name" : "scaleEffect(_:anchor:)",
          "url" : "https:\/\/developer.apple.com\/documentation\/SwiftUI\/View\/scaleEffect(_:anchor:)"
        },
        {
          "description" : "Scales this view’s rendered output by the given amount in both the horizontal and vertical directions, relative to an anchor point.",
          "name" : "scaleEffect(_:anchor:)",
          "url" : "https:\/\/developer.apple.com\/documentation\/SwiftUI\/View\/scaleEffect(_:anchor:)"
        },
        {
          "description" : "Scales this view’s rendered output by the given horizontal and vertical amounts, relative to an anchor point.",
          "name" : "scaleEffect(x:y:anchor:)",
          "url" : "https:\/\/developer.apple.com\/documentation\/SwiftUI\/View\/scaleEffect(x:y:anchor:)"
        },
        {
          "description" : "Scales this view by the specified horizontal, vertical, and depth factors, relative to an anchor point.",
          "name" : "scaleEffect(x:y:z:anchor:)",
          "url" : "https:\/\/developer.apple.com\/documentation\/SwiftUI\/View\/scaleEffect(x:y:z:anchor:)"
        },
        {
          "description" : "Rotates a view’s rendered output in two dimensions around the specified point.",
          "name" : "rotationEffect(_:anchor:)",
          "url" : "https:\/\/developer.apple.com\/documentation\/SwiftUI\/View\/rotationEffect(_:anchor:)"
        },
        {
          "description" : "Renders a view’s content as if it’s rotated in three dimensions around the specified axis.",
          "name" : "rotation3DEffect(_:axis:anchor:anchorZ:perspective:)",
          "url" : "https:\/\/developer.apple.com\/documentation\/SwiftUI\/View\/rotation3DEffect(_:axis:anchor:anchorZ:perspective:)"
        },
        {
          "description" : "Renders a view’s content as if it’s rotated in three dimensions around the specified axis.",
          "name" : "perspectiveRotationEffect(_:axis:anchor:anchorZ:perspective:)",
          "url" : "https:\/\/developer.apple.com\/documentation\/SwiftUI\/View\/perspectiveRotationEffect(_:axis:anchor:anchorZ:perspective:)"
        },
        {
          "description" : "Rotates the view’s content by the specified 3D rotation value.",
          "name" : "rotation3DEffect(_:anchor:)",
          "url" : "https:\/\/developer.apple.com\/documentation\/SwiftUI\/View\/rotation3DEffect(_:anchor:)"
        },
        {
          "description" : "Rotates the view’s content by an angle about an axis that you specify as a tuple of elements.",
          "name" : "rotation3DEffect(_:axis:anchor:)",
          "url" : "https:\/\/developer.apple.com\/documentation\/SwiftUI\/View\/rotation3DEffect(_:axis:anchor:)"
        },
        {
          "description" : "Applies an affine transformation to this view’s rendered output.",
          "name" : "transformEffect(_:)",
          "url" : "https:\/\/developer.apple.com\/documentation\/SwiftUI\/View\/transformEffect(_:)"
        },
        {
          "description" : "Applies a 3D transformation to this view’s rendered output.",
          "name" : "transform3DEffect(_:)",
          "url" : "https:\/\/developer.apple.com\/documentation\/SwiftUI\/View\/transform3DEffect(_:)"
        },
        {
          "description" : "Applies a projection transformation to this view’s rendered output.",
          "name" : "projectionEffect(_:)",
          "url" : "https:\/\/developer.apple.com\/documentation\/SwiftUI\/View\/projectionEffect(_:)"
        },
        {
          "description" : "",
          "name" : "ProjectionTransform",
          "url" : "https:\/\/developer.apple.com\/documentation\/SwiftUI\/ProjectionTransform"
        }
      ],
      "title" : "Scaling, rotating, or transforming a view"
    }
  ],
  "source" : "appleJSON",
  "title" : "aspectRatio(_:contentMode:)",
  "url" : "https:\/\/developer.apple.com\/documentation\/swiftui\/view\/aspectratio(_:contentmode:)"
}