{
  "abstract" : "Creates a 3D unit point with the specified offsets.",
  "codeExamples" : [

  ],
  "contentHash" : "70cdf27f0e4cef00726e24df9e64fb6c4a032f8edccd143b63361d1d84cc8330",
  "crawledAt" : "2025-12-01T11:24:46Z",
  "declaration" : {
    "code" : "init(x: CGFloat, y: CGFloat, z: CGFloat)",
    "language" : "swift"
  },
  "id" : "D203F2F5-5732-4B18-87E1-0BDE15FCB8A9",
  "kind" : "unknown",
  "module" : "SwiftUI",
  "overview" : "## Discussion\n\nValues outside the range `[0, 1]` project to points outside of a view.",
  "platforms" : [
    "visionOS"
  ],
  "rawMarkdown" : "---\nsource: https:\/\/developer.apple.com\/documentation\/SwiftUI\/UnitPoint3D\/init(x:y:z:)\ncrawled: 2025-12-01T11:24:46Z\n---\n\n# init(x:y:z:)\n\n**Initializer**\n\nCreates a 3D unit point with the specified offsets.\n\n## Declaration\n\n```swift\ninit(x: CGFloat, y: CGFloat, z: CGFloat)\n```\n\n## Parameters\n\n- **x**: The normalized distance from the origin to the point in the horizontal dimension.\n- **y**: The normalized distance from the origin to the point in the vertical dimension.\n- **z**: The normalized distance from the origin to the point in the depth dimension.\n\n## Discussion\n\nValues outside the range `[0, 1]` project to points outside of a view.\n\n## Creating a point\n\n- **init()**: Creates a 3D unit point at the origin.\n\n",
  "sections" : [
    {
      "content" : "",
      "items" : [
        {
          "description" : "Creates a 3D unit point at the origin.",
          "name" : "init()",
          "url" : "https:\/\/developer.apple.com\/documentation\/SwiftUI\/UnitPoint3D\/init()"
        }
      ],
      "title" : "Creating a point"
    }
  ],
  "source" : "appleJSON",
  "title" : "init(x:y:z:)",
  "url" : "https:\/\/developer.apple.com\/documentation\/SwiftUI\/UnitPoint3D\/init(x:y:z:)"
}