{
  "abstract" : "The pointer style that uses the default platform appearance.",
  "codeExamples" : [

  ],
  "contentHash" : "ab4a54c29130496ffd2a7d2bf045c2f9031d7b536c0b5afbf322b26c9744d9e2",
  "crawledAt" : "2025-12-01T11:34:24Z",
  "declaration" : {
    "code" : "static let `default`: PointerStyle",
    "language" : "swift"
  },
  "id" : "14800044-D86C-4ECA-A6CA-1126C7FCCA83",
  "kind" : "property",
  "module" : "SwiftUI",
  "overview" : "## Discussion\n\nThis is the default pointer style for interacting with content and UI elements if no other pointer style is more appropriate. This pointer style displays an arrow in macOS and a circle in iPadOS and visionOS.\n\nYou might want to set this pointer style explicitly using the [doc:\/\/com.apple.SwiftUI\/documentation\/SwiftUI\/View\/pointerStyle(_:)] modifier to override another style in the environment.",
  "platforms" : [
    "macOS",
    "visionOS"
  ],
  "rawMarkdown" : "---\nsource: https:\/\/developer.apple.com\/documentation\/SwiftUI\/PointerStyle\/default\ncrawled: 2025-12-01T11:34:24Z\n---\n\n# default\n\n**Type Property**\n\nThe pointer style that uses the default platform appearance.\n\n## Declaration\n\n```swift\nstatic let `default`: PointerStyle\n```\n\n## Discussion\n\nThis is the default pointer style for interacting with content and UI elements if no other pointer style is more appropriate. This pointer style displays an arrow in macOS and a circle in iPadOS and visionOS.\n\nYou might want to set this pointer style explicitly using the [doc:\/\/com.apple.SwiftUI\/documentation\/SwiftUI\/View\/pointerStyle(_:)] modifier to override another style in the environment.\n\n## Getting built-in pointer styles\n\n- **horizontalText**: The pointer style appropriate for selecting or inserting text in a horizontal layout.\n- **verticalText**: The pointer style appropriate for selecting or inserting text in a vertical layout.\n- **rectSelection**: The pointer style appropriate for precise rectangular selection, such as selecting a portion of an image or multiple lines of text.\n- **grabIdle**: The pointer style appropriate to indicate that dragging to reposition content within specific bounds, such as panning a large image, is possible.\n- **grabActive**: The pointer style appropriate for actively dragging to reposition content within specific bounds, such as panning a large image.\n- **link**: The pointer style appropriate for content opens a URL link to a webpage, document, or other item when clicked.\n- **zoomIn**: The pointer style appropriate to indicate that the content can be zoomed in.\n- **zoomOut**: The pointer style appropriate to indicate that the content can be zoomed out.\n- **frameResize(position:directions:)**: The pointer style for resizing a rectangular frame from a specific edge or corner.\n- **columnResize(directions:)**: The pointer style for resizing a column, or vertical division.\n- **rowResize(directions:)**: The pointer style for resizing a row, or horizontal division.\n\n",
  "sections" : [
    {
      "content" : "",
      "items" : [
        {
          "description" : "The pointer style appropriate for selecting or inserting text in a horizontal layout.",
          "name" : "horizontalText",
          "url" : "https:\/\/developer.apple.com\/documentation\/SwiftUI\/PointerStyle\/horizontalText"
        },
        {
          "description" : "The pointer style appropriate for selecting or inserting text in a vertical layout.",
          "name" : "verticalText",
          "url" : "https:\/\/developer.apple.com\/documentation\/SwiftUI\/PointerStyle\/verticalText"
        },
        {
          "description" : "The pointer style appropriate for precise rectangular selection, such as selecting a portion of an image or multiple lines of text.",
          "name" : "rectSelection",
          "url" : "https:\/\/developer.apple.com\/documentation\/SwiftUI\/PointerStyle\/rectSelection"
        },
        {
          "description" : "The pointer style appropriate to indicate that dragging to reposition content within specific bounds, such as panning a large image, is possible.",
          "name" : "grabIdle",
          "url" : "https:\/\/developer.apple.com\/documentation\/SwiftUI\/PointerStyle\/grabIdle"
        },
        {
          "description" : "The pointer style appropriate for actively dragging to reposition content within specific bounds, such as panning a large image.",
          "name" : "grabActive",
          "url" : "https:\/\/developer.apple.com\/documentation\/SwiftUI\/PointerStyle\/grabActive"
        },
        {
          "description" : "The pointer style appropriate for content opens a URL link to a webpage, document, or other item when clicked.",
          "name" : "link",
          "url" : "https:\/\/developer.apple.com\/documentation\/SwiftUI\/PointerStyle\/link"
        },
        {
          "description" : "The pointer style appropriate to indicate that the content can be zoomed in.",
          "name" : "zoomIn",
          "url" : "https:\/\/developer.apple.com\/documentation\/SwiftUI\/PointerStyle\/zoomIn"
        },
        {
          "description" : "The pointer style appropriate to indicate that the content can be zoomed out.",
          "name" : "zoomOut",
          "url" : "https:\/\/developer.apple.com\/documentation\/SwiftUI\/PointerStyle\/zoomOut"
        },
        {
          "description" : "The pointer style for resizing a rectangular frame from a specific edge or corner.",
          "name" : "frameResize(position:directions:)",
          "url" : "https:\/\/developer.apple.com\/documentation\/SwiftUI\/PointerStyle\/frameResize(position:directions:)"
        },
        {
          "description" : "The pointer style for resizing a column, or vertical division.",
          "name" : "columnResize(directions:)",
          "url" : "https:\/\/developer.apple.com\/documentation\/SwiftUI\/PointerStyle\/columnResize(directions:)"
        },
        {
          "description" : "The pointer style for resizing a row, or horizontal division.",
          "name" : "rowResize(directions:)",
          "url" : "https:\/\/developer.apple.com\/documentation\/SwiftUI\/PointerStyle\/rowResize(directions:)"
        }
      ],
      "title" : "Getting built-in pointer styles"
    }
  ],
  "source" : "appleJSON",
  "title" : "default",
  "url" : "https:\/\/developer.apple.com\/documentation\/SwiftUI\/PointerStyle\/default"
}