{
  "abstract" : "The action that the user prefers to perform when squeezing their Apple Pencil, as selected in the Settings app.",
  "codeExamples" : [
    {
      "code" : "@Environment(\\.preferredPencilSqueezeAction) private var preferredAction\n\nvar body: some View {\n    MyDrawingCanvas()\n        .onPencilSqueeze { phase in\n            switch (phase, preferredAction) {\n                ...\n            }\n        }\n}",
      "language" : "swift"
    }
  ],
  "contentHash" : "1eda726a2195d6e9b2cf439c74d7e5224800f5c58a050e7bed1c625b297d0ed0",
  "crawledAt" : "2025-12-02T17:22:30Z",
  "declaration" : {
    "code" : "var preferredPencilSqueezeAction: PencilPreferredAction { get }",
    "language" : "swift"
  },
  "id" : "1F751939-AE6F-4E93-B9E4-E3FB5EB72ED9",
  "kind" : "property",
  "language" : "swift",
  "module" : "SwiftUI",
  "overview" : "## Discussion\n\nYou can read this value by creating a property with the [doc:\/\/com.apple.SwiftUI\/documentation\/SwiftUI\/Environment] property wrapper and using it inside the action closure of the [doc:\/\/com.apple.SwiftUI\/documentation\/SwiftUI\/View\/onPencilSqueeze(perform:)] view modifier as an indication of what to do when the user squeezes their Apple Pencil:\n\nIn macOS, this value cannot be changed by users and is always set to [doc:\/\/com.apple.SwiftUI\/documentation\/SwiftUI\/PencilPreferredAction\/showContextualPalette].",
  "platforms" : [
    "iOS",
    "iPadOS",
    "Mac Catalyst",
    "macOS",
    "visionOS"
  ],
  "rawMarkdown" : "---\nsource: https:\/\/developer.apple.com\/documentation\/SwiftUI\/EnvironmentValues\/preferredPencilSqueezeAction\ncrawled: 2025-12-02T17:22:30Z\n---\n\n# preferredPencilSqueezeAction\n\n**Instance Property**\n\nThe action that the user prefers to perform when squeezing their Apple Pencil, as selected in the Settings app.\n\n## Declaration\n\n```swift\nvar preferredPencilSqueezeAction: PencilPreferredAction { get }\n```\n\n## Discussion\n\nYou can read this value by creating a property with the [doc:\/\/com.apple.SwiftUI\/documentation\/SwiftUI\/Environment] property wrapper and using it inside the action closure of the [doc:\/\/com.apple.SwiftUI\/documentation\/SwiftUI\/View\/onPencilSqueeze(perform:)] view modifier as an indication of what to do when the user squeezes their Apple Pencil:\n\n```swift\n@Environment(\\.preferredPencilSqueezeAction) private var preferredAction\n\nvar body: some View {\n    MyDrawingCanvas()\n        .onPencilSqueeze { phase in\n            switch (phase, preferredAction) {\n                ...\n            }\n        }\n}\n```\n\nIn macOS, this value cannot be changed by users and is always set to [doc:\/\/com.apple.SwiftUI\/documentation\/SwiftUI\/PencilPreferredAction\/showContextualPalette].\n\n## Recognizing Apple Pencil gestures\n\n- **onPencilDoubleTap(perform:)**: Adds an action to perform after the user double-taps their Apple Pencil.\n- **onPencilSqueeze(perform:)**: Adds an action to perform when the user squeezes their Apple Pencil.\n- **preferredPencilDoubleTapAction**: The action that the user prefers to perform after double-tapping their Apple Pencil, as selected in the Settings app.\n- **PencilPreferredAction**: An action that the user prefers to perform after double-tapping their Apple Pencil.\n- **PencilDoubleTapGestureValue**: Describes the value of an Apple Pencil double-tap gesture.\n- **PencilSqueezeGestureValue**: Describes the value of an Apple Pencil squeeze gesture.\n- **PencilSqueezeGesturePhase**: Describes the phase and value of an Apple Pencil squeeze gesture.\n- **PencilHoverPose**: A value describing the location and distance of an Apple Pencil hovering in the area above a view’s bounds.\n\n",
  "sections" : [
    {
      "content" : "",
      "items" : [
        {
          "description" : "Adds an action to perform after the user double-taps their Apple Pencil.",
          "name" : "onPencilDoubleTap(perform:)",
          "url" : "https:\/\/developer.apple.com\/documentation\/SwiftUI\/View\/onPencilDoubleTap(perform:)"
        },
        {
          "description" : "Adds an action to perform when the user squeezes their Apple Pencil.",
          "name" : "onPencilSqueeze(perform:)",
          "url" : "https:\/\/developer.apple.com\/documentation\/SwiftUI\/View\/onPencilSqueeze(perform:)"
        },
        {
          "description" : "The action that the user prefers to perform after double-tapping their Apple Pencil, as selected in the Settings app.",
          "name" : "preferredPencilDoubleTapAction",
          "url" : "https:\/\/developer.apple.com\/documentation\/SwiftUI\/EnvironmentValues\/preferredPencilDoubleTapAction"
        },
        {
          "description" : "An action that the user prefers to perform after double-tapping their Apple Pencil.",
          "name" : "PencilPreferredAction",
          "url" : "https:\/\/developer.apple.com\/documentation\/SwiftUI\/PencilPreferredAction"
        },
        {
          "description" : "Describes the value of an Apple Pencil double-tap gesture.",
          "name" : "PencilDoubleTapGestureValue",
          "url" : "https:\/\/developer.apple.com\/documentation\/SwiftUI\/PencilDoubleTapGestureValue"
        },
        {
          "description" : "Describes the value of an Apple Pencil squeeze gesture.",
          "name" : "PencilSqueezeGestureValue",
          "url" : "https:\/\/developer.apple.com\/documentation\/SwiftUI\/PencilSqueezeGestureValue"
        },
        {
          "description" : "Describes the phase and value of an Apple Pencil squeeze gesture.",
          "name" : "PencilSqueezeGesturePhase",
          "url" : "https:\/\/developer.apple.com\/documentation\/SwiftUI\/PencilSqueezeGesturePhase"
        },
        {
          "description" : "A value describing the location and distance of an Apple Pencil hovering in the area above a view’s bounds.",
          "name" : "PencilHoverPose",
          "url" : "https:\/\/developer.apple.com\/documentation\/SwiftUI\/PencilHoverPose"
        }
      ],
      "title" : "Recognizing Apple Pencil gestures"
    }
  ],
  "source" : "appleJSON",
  "title" : "preferredPencilSqueezeAction",
  "url" : "https:\/\/developer.apple.com\/documentation\/SwiftUI\/EnvironmentValues\/preferredPencilSqueezeAction"
}