{
  "abstract" : "Opens a window that’s associated with the specified identifier, using the specified sharing sharingBehavior..",
  "codeExamples" : [
    {
      "code" : "try await openWindow(id: \"message\", sharingBehavior: .requested)",
      "language" : "swift"
    }
  ],
  "contentHash" : "103702c7240c68f3d9a8a51056ae45414878cdf1deae80fc9097122400f8aaa2",
  "crawledAt" : "2025-12-03T05:31:53Z",
  "declaration" : {
    "code" : "@MainActor func callAsFunction(id: String, sharingBehavior: OpenWindowAction.SharingBehavior) async throws",
    "language" : "swift"
  },
  "id" : "70FD0869-EE42-418C-8FC1-2B2919922BF7",
  "kind" : "method",
  "language" : "swift",
  "module" : "SwiftUI",
  "overview" : "## Discussion\n\nIf sharingBehavior is requested or required, the window is shared if there is an available sharingSession and the person using your app confirms the offer to share. If sharingBehavior is requested and the window is not shared, it is opened normally. If sharingBehavior is required and the window is not shared, it is not opened, and an error is thrown. Regardless of sharingBehavior, an error is thrown if the window fails to open.\n\nDon’t call this method directly. SwiftUI calls it when you call the [doc:\/\/com.apple.SwiftUI\/documentation\/SwiftUI\/EnvironmentValues\/openWindow] action with an identifier:\n\nFor information about how Swift uses the `callAsFunction()` method to simplify call site syntax, see [https:\/\/docs.swift.org\/swift-book\/ReferenceManual\/Declarations.html#ID622] in *The Swift Programming Language*.",
  "platforms" : [
    "macOS"
  ],
  "rawMarkdown" : "---\nsource: https:\/\/developer.apple.com\/documentation\/SwiftUI\/OpenWindowAction\/callAsFunction(id:sharingBehavior:)\ncrawled: 2025-12-03T05:31:53Z\n---\n\n# callAsFunction(id:sharingBehavior:)\n\n**Instance Method**\n\nOpens a window that’s associated with the specified identifier, using the specified sharing sharingBehavior..\n\n## Declaration\n\n```swift\n@MainActor func callAsFunction(id: String, sharingBehavior: OpenWindowAction.SharingBehavior) async throws\n```\n\n## Parameters\n\n- **id**: The identifier of the scene to present.\n- **sharingBehavior**: The sharing behavior for the opened window.\n\n## Discussion\n\nIf sharingBehavior is requested or required, the window is shared if there is an available sharingSession and the person using your app confirms the offer to share. If sharingBehavior is requested and the window is not shared, it is opened normally. If sharingBehavior is required and the window is not shared, it is not opened, and an error is thrown. Regardless of sharingBehavior, an error is thrown if the window fails to open.\n\nDon’t call this method directly. SwiftUI calls it when you call the [doc:\/\/com.apple.SwiftUI\/documentation\/SwiftUI\/EnvironmentValues\/openWindow] action with an identifier:\n\n```swift\ntry await openWindow(id: \"message\", sharingBehavior: .requested)\n```\n\nFor information about how Swift uses the `callAsFunction()` method to simplify call site syntax, see [https:\/\/docs.swift.org\/swift-book\/ReferenceManual\/Declarations.html#ID622] in *The Swift Programming Language*.\n\n",
  "sections" : [

  ],
  "source" : "appleJSON",
  "title" : "callAsFunction(id:sharingBehavior:)",
  "url" : "https:\/\/developer.apple.com\/documentation\/SwiftUI\/OpenWindowAction\/callAsFunction(id:sharingBehavior:)"
}