{
  "abstract" : "A control for selecting from a set of mutually exclusive values.",
  "codeExamples" : [
    {
      "code" : "enum Flavor: String, CaseIterable, Identifiable {\n    case chocolate, vanilla, strawberry\n    var id: Self { self }\n}\n\n@State private var selectedFlavor: Flavor = .chocolate",
      "language" : "swift"
    },
    {
      "code" : "List {\n    Picker(\"Flavor\", selection: $selectedFlavor) {\n        Text(\"Chocolate\").tag(Flavor.chocolate)\n        Text(\"Vanilla\").tag(Flavor.vanilla)\n        Text(\"Strawberry\").tag(Flavor.strawberry)\n    }\n}",
      "language" : "swift"
    },
    {
      "code" : "List {\n    Picker(selection: $selectedFlavor) {\n        Text(\"Chocolate\").tag(Flavor.chocolate)\n        Text(\"Vanilla\").tag(Flavor.vanilla)\n        Text(\"Strawberry\").tag(Flavor.strawberry)\n    } label: {\n        Text(\"Flavor\")\n        Text(\"Choose your favorite flavor\")\n    }\n}",
      "language" : "swift"
    },
    {
      "code" : "Picker(\"Flavor\", selection: $selectedFlavor) {\n    ForEach(Flavor.allCases) { flavor in\n        Text(flavor.rawValue.capitalized)\n    }\n}",
      "language" : "swift"
    },
    {
      "code" : "enum Topping: String, CaseIterable, Identifiable {\n    case nuts, cookies, blueberries\n    var id: Self { self }\n}\n\nextension Flavor {\n    var suggestedTopping: Topping {\n        switch self {\n        case .chocolate: return .nuts\n        case .vanilla: return .cookies\n        case .strawberry: return .blueberries\n        }\n    }\n}\n\n@State private var suggestedTopping: Topping = .nuts",
      "language" : "swift"
    },
    {
      "code" : "List {\n    Picker(\"Flavor\", selection: $suggestedTopping) {\n        ForEach(Flavor.allCases) { flavor in\n            Text(flavor.rawValue.capitalized)\n                .tag(flavor.suggestedTopping)\n        }\n    }\n    HStack {\n        Text(\"Suggested Topping\")\n        Spacer()\n        Text(suggestedTopping.rawValue.capitalized)\n            .foregroundStyle(.secondary)\n    }\n}",
      "language" : "swift"
    },
    {
      "code" : "VStack {\n    Picker(\"Flavor\", selection: $selectedFlavor) {\n        ForEach(Flavor.allCases) { flavor in\n            Text(flavor.rawValue.capitalized)\n        }\n    }\n    Picker(\"Topping\", selection: $selectedTopping) {\n        ForEach(Topping.allCases) { topping in\n            Text(topping.rawValue.capitalized)\n        }\n    }\n}\n.pickerStyle(.segmented)",
      "language" : "swift"
    }
  ],
  "conformsTo" : [
    "View"
  ],
  "contentHash" : "5dfa718454914144be6fcdd970400c91d98ab342301d100e2a7c54d4df956cde",
  "crawledAt" : "2025-12-02T16:24:20Z",
  "declaration" : {
    "code" : "struct Picker<Label, SelectionValue, Content> where Label : View, SelectionValue : Hashable, Content : View",
    "language" : "swift"
  },
  "id" : "77E87570-1C4C-421F-A98E-8AED05C4744A",
  "kind" : "struct",
  "language" : "swift",
  "module" : "SwiftUI",
  "overview" : "## Overview\n\nYou create a picker by providing a selection binding, a label, and the content for the picker to display. Set the `selection` parameter to a bound property that provides the value to display as the current selection. Set the label to a view that visually describes the purpose of selecting content in the picker, and then provide the content for the picker to display.\n\nFor example, consider an enumeration of ice cream flavors and a [doc:\/\/com.apple.SwiftUI\/documentation\/SwiftUI\/State] variable to hold the selected flavor:\n\nYou can create a picker to select among the values by providing a label, a binding to the current selection, and a collection of views for the picker’s content. Append a tag to each of these content views using the `View\/tag(_:)` view modifier so that the type of each selection matches the type of the bound state variable:\n\nIf you provide a string label for the picker, as the example above does, the picker uses it to initialize a [doc:\/\/com.apple.SwiftUI\/documentation\/SwiftUI\/Text] view as a label. Alternatively, you can use the [doc:\/\/com.apple.SwiftUI\/documentation\/SwiftUI\/Picker\/init(selection:content:label:)] initializer to compose the label from other views. The exact appearance of the picker depends on the context. If you use a picker in a [doc:\/\/com.apple.SwiftUI\/documentation\/SwiftUI\/List] in iOS, it appears in a row with the label and selected value, and a chevron to indicate that you can tap the row to select a new value:\n\n\n\nFor cases where adding a subtitle to the label is desired, use a view builder that creates multiple `Text` views where the first text represents the title and the second text represents the subtitle:\n\n### Iterating over a picker’s options\n\nTo provide selection values for the `Picker` without explicitly listing each option, you can create the picker with a [doc:\/\/com.apple.SwiftUI\/documentation\/SwiftUI\/ForEach]:\n\n[doc:\/\/com.apple.SwiftUI\/documentation\/SwiftUI\/ForEach] automatically assigns a tag to the selection views using each option’s `id`. This is possible because `Flavor` conforms to the [doc:\/\/com.apple.documentation\/documentation\/Swift\/Identifiable] protocol.\n\nThe example above relies on the fact that `Flavor` defines the type of its `id` parameter to exactly match the selection type. If that’s not the case, you need to override the tag. For example, consider a `Topping` type and a suggested topping for each flavor:\n\nThe following example shows a picker that’s bound to a `Topping` type, while the options are all `Flavor` instances. Each option uses the tag modifier to associate the suggested topping with the flavor it displays:\n\nWhen the user selects chocolate, the picker sets `suggestedTopping` to the value in the associated tag:\n\n\n\nAnother example of when the views in a picker’s [doc:\/\/com.apple.SwiftUI\/documentation\/SwiftUI\/ForEach] need an explicit tag modifier is when you select over the cases of an enumeration that conforms to the [doc:\/\/com.apple.documentation\/documentation\/Swift\/Identifiable] protocol by using anything besides `Self` as the `id` parameter type. For example, a string enumeration might use the case’s `rawValue` string as the `id`. That identifier type doesn’t match the selection type, which is the type of the enumeration itself.\n\n### Styling pickers\n\nYou can customize the appearance and interaction of pickers using styles that conform to the [doc:\/\/com.apple.SwiftUI\/documentation\/SwiftUI\/PickerStyle] protocol, like [doc:\/\/com.apple.SwiftUI\/documentation\/SwiftUI\/PickerStyle\/segmented] or [doc:\/\/com.apple.SwiftUI\/documentation\/SwiftUI\/PickerStyle\/menu]. To set a specific style for all picker instances within a view, use the [doc:\/\/com.apple.SwiftUI\/documentation\/SwiftUI\/View\/pickerStyle(_:)] modifier. The following example applies the [doc:\/\/com.apple.SwiftUI\/documentation\/SwiftUI\/PickerStyle\/segmented] style to two pickers that independently select a flavor and a topping:\n\n",
  "platforms" : [
    "iOS",
    "iPadOS",
    "Mac Catalyst",
    "macOS",
    "tvOS",
    "visionOS",
    "watchOS"
  ],
  "rawMarkdown" : "---\nsource: https:\/\/developer.apple.com\/documentation\/SwiftUI\/Picker\ncrawled: 2025-12-02T16:24:20Z\n---\n\n# Picker\n\n**Structure**\n\nA control for selecting from a set of mutually exclusive values.\n\n## Declaration\n\n```swift\nstruct Picker<Label, SelectionValue, Content> where Label : View, SelectionValue : Hashable, Content : View\n```\n\n## Overview\n\nYou create a picker by providing a selection binding, a label, and the content for the picker to display. Set the `selection` parameter to a bound property that provides the value to display as the current selection. Set the label to a view that visually describes the purpose of selecting content in the picker, and then provide the content for the picker to display.\n\nFor example, consider an enumeration of ice cream flavors and a [doc:\/\/com.apple.SwiftUI\/documentation\/SwiftUI\/State] variable to hold the selected flavor:\n\n```swift\nenum Flavor: String, CaseIterable, Identifiable {\n    case chocolate, vanilla, strawberry\n    var id: Self { self }\n}\n\n@State private var selectedFlavor: Flavor = .chocolate\n```\n\nYou can create a picker to select among the values by providing a label, a binding to the current selection, and a collection of views for the picker’s content. Append a tag to each of these content views using the `View\/tag(_:)` view modifier so that the type of each selection matches the type of the bound state variable:\n\n```swift\nList {\n    Picker(\"Flavor\", selection: $selectedFlavor) {\n        Text(\"Chocolate\").tag(Flavor.chocolate)\n        Text(\"Vanilla\").tag(Flavor.vanilla)\n        Text(\"Strawberry\").tag(Flavor.strawberry)\n    }\n}\n```\n\nIf you provide a string label for the picker, as the example above does, the picker uses it to initialize a [doc:\/\/com.apple.SwiftUI\/documentation\/SwiftUI\/Text] view as a label. Alternatively, you can use the [doc:\/\/com.apple.SwiftUI\/documentation\/SwiftUI\/Picker\/init(selection:content:label:)] initializer to compose the label from other views. The exact appearance of the picker depends on the context. If you use a picker in a [doc:\/\/com.apple.SwiftUI\/documentation\/SwiftUI\/List] in iOS, it appears in a row with the label and selected value, and a chevron to indicate that you can tap the row to select a new value:\n\n\n\nFor cases where adding a subtitle to the label is desired, use a view builder that creates multiple `Text` views where the first text represents the title and the second text represents the subtitle:\n\n```swift\nList {\n    Picker(selection: $selectedFlavor) {\n        Text(\"Chocolate\").tag(Flavor.chocolate)\n        Text(\"Vanilla\").tag(Flavor.vanilla)\n        Text(\"Strawberry\").tag(Flavor.strawberry)\n    } label: {\n        Text(\"Flavor\")\n        Text(\"Choose your favorite flavor\")\n    }\n}\n```\n\n### Iterating over a picker’s options\n\nTo provide selection values for the `Picker` without explicitly listing each option, you can create the picker with a [doc:\/\/com.apple.SwiftUI\/documentation\/SwiftUI\/ForEach]:\n\n```swift\nPicker(\"Flavor\", selection: $selectedFlavor) {\n    ForEach(Flavor.allCases) { flavor in\n        Text(flavor.rawValue.capitalized)\n    }\n}\n```\n\n[doc:\/\/com.apple.SwiftUI\/documentation\/SwiftUI\/ForEach] automatically assigns a tag to the selection views using each option’s `id`. This is possible because `Flavor` conforms to the [doc:\/\/com.apple.documentation\/documentation\/Swift\/Identifiable] protocol.\n\nThe example above relies on the fact that `Flavor` defines the type of its `id` parameter to exactly match the selection type. If that’s not the case, you need to override the tag. For example, consider a `Topping` type and a suggested topping for each flavor:\n\n```swift\nenum Topping: String, CaseIterable, Identifiable {\n    case nuts, cookies, blueberries\n    var id: Self { self }\n}\n\nextension Flavor {\n    var suggestedTopping: Topping {\n        switch self {\n        case .chocolate: return .nuts\n        case .vanilla: return .cookies\n        case .strawberry: return .blueberries\n        }\n    }\n}\n\n@State private var suggestedTopping: Topping = .nuts\n```\n\nThe following example shows a picker that’s bound to a `Topping` type, while the options are all `Flavor` instances. Each option uses the tag modifier to associate the suggested topping with the flavor it displays:\n\n```swift\nList {\n    Picker(\"Flavor\", selection: $suggestedTopping) {\n        ForEach(Flavor.allCases) { flavor in\n            Text(flavor.rawValue.capitalized)\n                .tag(flavor.suggestedTopping)\n        }\n    }\n    HStack {\n        Text(\"Suggested Topping\")\n        Spacer()\n        Text(suggestedTopping.rawValue.capitalized)\n            .foregroundStyle(.secondary)\n    }\n}\n```\n\nWhen the user selects chocolate, the picker sets `suggestedTopping` to the value in the associated tag:\n\n\n\nAnother example of when the views in a picker’s [doc:\/\/com.apple.SwiftUI\/documentation\/SwiftUI\/ForEach] need an explicit tag modifier is when you select over the cases of an enumeration that conforms to the [doc:\/\/com.apple.documentation\/documentation\/Swift\/Identifiable] protocol by using anything besides `Self` as the `id` parameter type. For example, a string enumeration might use the case’s `rawValue` string as the `id`. That identifier type doesn’t match the selection type, which is the type of the enumeration itself.\n\n### Styling pickers\n\nYou can customize the appearance and interaction of pickers using styles that conform to the [doc:\/\/com.apple.SwiftUI\/documentation\/SwiftUI\/PickerStyle] protocol, like [doc:\/\/com.apple.SwiftUI\/documentation\/SwiftUI\/PickerStyle\/segmented] or [doc:\/\/com.apple.SwiftUI\/documentation\/SwiftUI\/PickerStyle\/menu]. To set a specific style for all picker instances within a view, use the [doc:\/\/com.apple.SwiftUI\/documentation\/SwiftUI\/View\/pickerStyle(_:)] modifier. The following example applies the [doc:\/\/com.apple.SwiftUI\/documentation\/SwiftUI\/PickerStyle\/segmented] style to two pickers that independently select a flavor and a topping:\n\n```swift\nVStack {\n    Picker(\"Flavor\", selection: $selectedFlavor) {\n        ForEach(Flavor.allCases) { flavor in\n            Text(flavor.rawValue.capitalized)\n        }\n    }\n    Picker(\"Topping\", selection: $selectedTopping) {\n        ForEach(Topping.allCases) { topping in\n            Text(topping.rawValue.capitalized)\n        }\n    }\n}\n.pickerStyle(.segmented)\n```\n\n\n\n## Creating a picker\n\n- **init(_:selection:content:)**: Creates a picker that generates its label from a localized string key.\n- **init(selection:content:label:)**: Creates a picker that displays a custom label.\n\n## Creating a picker for a collection\n\n- **init(_:sources:selection:content:)**: Creates a picker bound to a collection of bindings that generates its label from a string.\n- **init(sources:selection:content:label:)**: Creates a picker that displays a custom label.\n\n## Creating a picker with an image label\n\n- **init(_:image:selection:content:)**: Creates a picker that generates its label from a localized string key and image resource\n- **init(_:image:sources:selection:content:)**: Creates a picker bound to a collection of bindings that generates its label from a string and image resource.\n- **init(_:systemImage:selection:content:)**: Creates a picker that generates its label from a localized string key and system image.\n- **init(_:systemImage:sources:selection:content:)**: Creates a picker bound to a collection of bindings that generates its label from a string.\n\n## Deprecated initializers\n\n- **init(selection:label:content:)**: Creates a picker that displays a custom label.\n\n## Initializers\n\n- **init(_:image:selection:content:currentValueLabel:)**: Creates a picker that accepts a custom current value label and generates its label from a localized string key and image resource\n- **init(_:image:sources:selection:content:currentValueLabel:)**: Creates a picker bound to a collection of bindings that accepts a custom current value label and generates its label from a string and image resource.\n- **init(_:selection:content:currentValueLabel:)**: Creates a picker that generates its label from a localized string key and accepts a custom current value label.\n- **init(_:sources:selection:content:currentValueLabel:)**: Creates a picker bound to a collection of bindings that generates its label from a string and accepts a custom current value label.\n- **init(_:systemImage:selection:content:currentValueLabel:)**: Creates a picker that accepts a custom current value label and generates its label from a localized string key and system image.\n- **init(_:systemImage:sources:selection:content:currentValueLabel:)**: Creates a picker bound to a collection of bindings that accepts a custom current value label and generates its label from a string.\n- **init(selection:content:label:currentValueLabel:)**: Creates a picker that displays a custom label and a custom value label where applicable.\n- **init(sources:selection:content:label:currentValueLabel:)**: Creates a picker that displays a custom label and current value label where applicable.\n\n## Choosing from a set of options\n\n- **pickerStyle(_:)**: Sets the style for pickers within this view.\n- **horizontalRadioGroupLayout()**: Sets the style for radio group style pickers within this view to be horizontally positioned with the radio buttons inside the layout.\n- **defaultWheelPickerItemHeight(_:)**: Sets the default wheel-style picker item height.\n- **defaultWheelPickerItemHeight**: The default height of an item in a wheel-style picker, such as a date picker.\n- **paletteSelectionEffect(_:)**: Specifies the selection effect to apply to a palette item.\n- **PaletteSelectionEffect**: The selection effect to apply to a palette item.\n\n## Conforms To\n\n- View\n\n",
  "sections" : [
    {
      "content" : "",
      "items" : [
        {
          "description" : "Creates a picker that generates its label from a localized string key.",
          "name" : "init(_:selection:content:)",
          "url" : "https:\/\/developer.apple.com\/documentation\/SwiftUI\/Picker\/init(_:selection:content:)"
        },
        {
          "description" : "Creates a picker that displays a custom label.",
          "name" : "init(selection:content:label:)",
          "url" : "https:\/\/developer.apple.com\/documentation\/SwiftUI\/Picker\/init(selection:content:label:)"
        }
      ],
      "title" : "Creating a picker"
    },
    {
      "content" : "",
      "items" : [
        {
          "description" : "Creates a picker bound to a collection of bindings that generates its label from a string.",
          "name" : "init(_:sources:selection:content:)",
          "url" : "https:\/\/developer.apple.com\/documentation\/SwiftUI\/Picker\/init(_:sources:selection:content:)"
        },
        {
          "description" : "Creates a picker that displays a custom label.",
          "name" : "init(sources:selection:content:label:)",
          "url" : "https:\/\/developer.apple.com\/documentation\/SwiftUI\/Picker\/init(sources:selection:content:label:)"
        }
      ],
      "title" : "Creating a picker for a collection"
    },
    {
      "content" : "",
      "items" : [
        {
          "description" : "Creates a picker that generates its label from a localized string key and image resource",
          "name" : "init(_:image:selection:content:)",
          "url" : "https:\/\/developer.apple.com\/documentation\/SwiftUI\/Picker\/init(_:image:selection:content:)"
        },
        {
          "description" : "Creates a picker bound to a collection of bindings that generates its label from a string and image resource.",
          "name" : "init(_:image:sources:selection:content:)",
          "url" : "https:\/\/developer.apple.com\/documentation\/SwiftUI\/Picker\/init(_:image:sources:selection:content:)"
        },
        {
          "description" : "Creates a picker that generates its label from a localized string key and system image.",
          "name" : "init(_:systemImage:selection:content:)",
          "url" : "https:\/\/developer.apple.com\/documentation\/SwiftUI\/Picker\/init(_:systemImage:selection:content:)"
        },
        {
          "description" : "Creates a picker bound to a collection of bindings that generates its label from a string.",
          "name" : "init(_:systemImage:sources:selection:content:)",
          "url" : "https:\/\/developer.apple.com\/documentation\/SwiftUI\/Picker\/init(_:systemImage:sources:selection:content:)"
        }
      ],
      "title" : "Creating a picker with an image label"
    },
    {
      "content" : "",
      "items" : [
        {
          "description" : "Creates a picker that displays a custom label.",
          "name" : "init(selection:label:content:)",
          "url" : "https:\/\/developer.apple.com\/documentation\/SwiftUI\/Picker\/init(selection:label:content:)"
        }
      ],
      "title" : "Deprecated initializers"
    },
    {
      "content" : "",
      "items" : [
        {
          "description" : "Creates a picker that accepts a custom current value label and generates its label from a localized string key and image resource",
          "name" : "init(_:image:selection:content:currentValueLabel:)",
          "url" : "https:\/\/developer.apple.com\/documentation\/SwiftUI\/Picker\/init(_:image:selection:content:currentValueLabel:)"
        },
        {
          "description" : "Creates a picker bound to a collection of bindings that accepts a custom current value label and generates its label from a string and image resource.",
          "name" : "init(_:image:sources:selection:content:currentValueLabel:)",
          "url" : "https:\/\/developer.apple.com\/documentation\/SwiftUI\/Picker\/init(_:image:sources:selection:content:currentValueLabel:)"
        },
        {
          "description" : "Creates a picker that generates its label from a localized string key and accepts a custom current value label.",
          "name" : "init(_:selection:content:currentValueLabel:)",
          "url" : "https:\/\/developer.apple.com\/documentation\/SwiftUI\/Picker\/init(_:selection:content:currentValueLabel:)"
        },
        {
          "description" : "Creates a picker bound to a collection of bindings that generates its label from a string and accepts a custom current value label.",
          "name" : "init(_:sources:selection:content:currentValueLabel:)",
          "url" : "https:\/\/developer.apple.com\/documentation\/SwiftUI\/Picker\/init(_:sources:selection:content:currentValueLabel:)"
        },
        {
          "description" : "Creates a picker that accepts a custom current value label and generates its label from a localized string key and system image.",
          "name" : "init(_:systemImage:selection:content:currentValueLabel:)",
          "url" : "https:\/\/developer.apple.com\/documentation\/SwiftUI\/Picker\/init(_:systemImage:selection:content:currentValueLabel:)"
        },
        {
          "description" : "Creates a picker bound to a collection of bindings that accepts a custom current value label and generates its label from a string.",
          "name" : "init(_:systemImage:sources:selection:content:currentValueLabel:)",
          "url" : "https:\/\/developer.apple.com\/documentation\/SwiftUI\/Picker\/init(_:systemImage:sources:selection:content:currentValueLabel:)"
        },
        {
          "description" : "Creates a picker that displays a custom label and a custom value label where applicable.",
          "name" : "init(selection:content:label:currentValueLabel:)",
          "url" : "https:\/\/developer.apple.com\/documentation\/SwiftUI\/Picker\/init(selection:content:label:currentValueLabel:)"
        },
        {
          "description" : "Creates a picker that displays a custom label and current value label where applicable.",
          "name" : "init(sources:selection:content:label:currentValueLabel:)",
          "url" : "https:\/\/developer.apple.com\/documentation\/SwiftUI\/Picker\/init(sources:selection:content:label:currentValueLabel:)"
        }
      ],
      "title" : "Initializers"
    },
    {
      "content" : "",
      "items" : [
        {
          "description" : "Sets the style for pickers within this view.",
          "name" : "pickerStyle(_:)",
          "url" : "https:\/\/developer.apple.com\/documentation\/SwiftUI\/View\/pickerStyle(_:)"
        },
        {
          "description" : "Sets the style for radio group style pickers within this view to be horizontally positioned with the radio buttons inside the layout.",
          "name" : "horizontalRadioGroupLayout()",
          "url" : "https:\/\/developer.apple.com\/documentation\/SwiftUI\/View\/horizontalRadioGroupLayout()"
        },
        {
          "description" : "Sets the default wheel-style picker item height.",
          "name" : "defaultWheelPickerItemHeight(_:)",
          "url" : "https:\/\/developer.apple.com\/documentation\/SwiftUI\/View\/defaultWheelPickerItemHeight(_:)"
        },
        {
          "description" : "The default height of an item in a wheel-style picker, such as a date picker.",
          "name" : "defaultWheelPickerItemHeight",
          "url" : "https:\/\/developer.apple.com\/documentation\/SwiftUI\/EnvironmentValues\/defaultWheelPickerItemHeight"
        },
        {
          "description" : "Specifies the selection effect to apply to a palette item.",
          "name" : "paletteSelectionEffect(_:)",
          "url" : "https:\/\/developer.apple.com\/documentation\/SwiftUI\/View\/paletteSelectionEffect(_:)"
        },
        {
          "description" : "The selection effect to apply to a palette item.",
          "name" : "PaletteSelectionEffect",
          "url" : "https:\/\/developer.apple.com\/documentation\/SwiftUI\/PaletteSelectionEffect"
        }
      ],
      "title" : "Choosing from a set of options"
    }
  ],
  "source" : "appleJSON",
  "title" : "Picker",
  "url" : "https:\/\/developer.apple.com\/documentation\/SwiftUI\/Picker"
}