{
  "abstract" : "Changes the visibility of the list section index.",
  "codeExamples" : [
    {
      "code" : "List(sections) { section in\n    Section(section.title) {\n        ForEach(section.rows) { row in\n            \/\/ ...\n        }\n    }\n    .sectionIndexLabel(section.indexTitle)\n}\n.listSectionIndexVisibility(.visible)",
      "language" : "swift"
    }
  ],
  "contentHash" : "e5794b1ab2ca5ee831ffaece5e6140901f49e6febdceaf3a6df92a4416e4bc9d",
  "crawledAt" : "2025-11-30T21:09:15Z",
  "declaration" : {
    "code" : "nonisolated func listSectionIndexVisibility(_ visibility: Visibility) -> some View\n",
    "language" : "swift"
  },
  "id" : "4D63D963-1C29-4656-8F40-87E5843BF772",
  "kind" : "method",
  "module" : "SwiftUI",
  "overview" : "## Discussion\n\nThe section index shows the section index labels of sections, which are set using the `sectionIndexLabel` modifier. These are typically the letters of the alphabet, used for sorted sections.\n\nOn iOS, the section index is displayed as a number of vertically stacked letters on the trailing side of the list. Users can jump to a specific section in the list by tapping on the corresponding index label.\n\n\n\nOn watchOS, the index of the section currently visible is displayed next to the scroll indicator when the user is scrolling through the list using the crown.\n\n\n\nBy default, the list section index is visible if the list contains any sections with an index label.\n\nThe index only shows labels for sections with a `sectionIndexLabel` modifier. This can be used to hide certain sections from the index.\n\nBy hiding section headers of empty sections with an index label, a list section index can be made to show index labels without a corresponding section.",
  "platforms" : [
    "iOS",
    "iPadOS",
    "Mac Catalyst",
    "visionOS",
    "watchOS"
  ],
  "rawMarkdown" : "---\nsource: https:\/\/developer.apple.com\/documentation\/SwiftUI\/View\/listSectionIndexVisibility(_:)\ncrawled: 2025-11-30T21:09:15Z\n---\n\n# listSectionIndexVisibility(_:)\n\n**Instance Method**\n\nChanges the visibility of the list section index.\n\n## Declaration\n\n```swift\nnonisolated func listSectionIndexVisibility(_ visibility: Visibility) -> some View\n\n```\n\n## Parameters\n\n- **visibility**: The visibility of the list section index.\n\n## Discussion\n\nThe section index shows the section index labels of sections, which are set using the `sectionIndexLabel` modifier. These are typically the letters of the alphabet, used for sorted sections.\n\n```swift\nList(sections) { section in\n    Section(section.title) {\n        ForEach(section.rows) { row in\n            \/\/ ...\n        }\n    }\n    .sectionIndexLabel(section.indexTitle)\n}\n.listSectionIndexVisibility(.visible)\n```\n\nOn iOS, the section index is displayed as a number of vertically stacked letters on the trailing side of the list. Users can jump to a specific section in the list by tapping on the corresponding index label.\n\n\n\nOn watchOS, the index of the section currently visible is displayed next to the scroll indicator when the user is scrolling through the list using the crown.\n\n\n\nBy default, the list section index is visible if the list contains any sections with an index label.\n\nThe index only shows labels for sections with a `sectionIndexLabel` modifier. This can be used to hide certain sections from the index.\n\nBy hiding section headers of empty sections with an index label, a list section index can be made to show index labels without a corresponding section.\n\n## Configuring a section index\n\n- **sectionIndexLabel(_:)**: Sets the label that is used in a section index to point to this section, typically only a single character long.\n\n",
  "sections" : [
    {
      "content" : "",
      "items" : [
        {
          "description" : "Sets the label that is used in a section index to point to this section, typically only a single character long.",
          "name" : "sectionIndexLabel(_:)",
          "url" : "https:\/\/developer.apple.com\/documentation\/SwiftUI\/View\/sectionIndexLabel(_:)"
        }
      ],
      "title" : "Configuring a section index"
    }
  ],
  "source" : "appleJSON",
  "title" : "listSectionIndexVisibility(_:)",
  "url" : "https:\/\/developer.apple.com\/documentation\/SwiftUI\/View\/listSectionIndexVisibility(_:)"
}