{
  "abstract" : "Creates the remote immersive space associated with the specified identifier.",
  "codeExamples" : [

  ],
  "contentHash" : "c37cebb2258827730813ff5cdd94e51c80bc9106023e2a4d1087f95e8a0b7cd7",
  "crawledAt" : "2025-12-01T10:22:51Z",
  "declaration" : {
    "code" : "nonisolated init<C>(id: String, @CompositorContentBuilder content: @escaping () -> C) where Content == CompositorContentBuilder.Content<C>, Data == Never, C : CompositorContent",
    "language" : "swift"
  },
  "id" : "B7CE073B-4CD6-470F-AAC3-FE964912FBF9",
  "kind" : "unknown",
  "module" : "SwiftUI",
  "overview" : "## Discussion\n\nThe space uses the specified content builder to form the content.",
  "platforms" : [
    "macOS"
  ],
  "rawMarkdown" : "---\nsource: https:\/\/developer.apple.com\/documentation\/SwiftUI\/RemoteImmersiveSpace\/init(id:content:)\ncrawled: 2025-12-01T10:22:51Z\n---\n\n# init(id:content:)\n\n**Initializer**\n\nCreates the remote immersive space associated with the specified identifier.\n\n## Declaration\n\n```swift\nnonisolated init<C>(id: String, @CompositorContentBuilder content: @escaping () -> C) where Content == CompositorContentBuilder.Content<C>, Data == Never, C : CompositorContent\n```\n\n## Parameters\n\n- **id**: A string that uniquely identifies the immersive space. Ensure that identifiers are unique among the immersive spaces in your app.\n- **content**: An compositor content builder that defines the content of the space.\n\n## Discussion\n\nThe space uses the specified content builder to form the content.\n\n",
  "sections" : [

  ],
  "source" : "appleJSON",
  "title" : "init(id:content:)",
  "url" : "https:\/\/developer.apple.com\/documentation\/SwiftUI\/RemoteImmersiveSpace\/init(id:content:)"
}