{
  "abstract" : "Column alignment appropriate for numeric content.",
  "codeExamples" : [

  ],
  "contentHash" : "6ea8498392d8fcaf1621228705a31f531c26e3d27a667c1f92755f104e083c3a",
  "crawledAt" : "2025-12-01T11:29:56Z",
  "declaration" : {
    "code" : "static func numeric(_ numberingSystem: Locale.NumberingSystem) -> TableColumnAlignment",
    "language" : "swift"
  },
  "id" : "11DB3533-A31C-40BB-A25D-AF14522842CD",
  "kind" : "method",
  "module" : "SwiftUI",
  "overview" : "## Discussion\n\nUse this alignment when a table column is primarily displaying numeric content, so that the values are easy to visually scan and compare.\n\nThis uses the provided numbering system to determine the alignment:",
  "platforms" : [
    "iOS",
    "iPadOS",
    "Mac Catalyst",
    "macOS",
    "visionOS"
  ],
  "rawMarkdown" : "---\nsource: https:\/\/developer.apple.com\/documentation\/SwiftUI\/TableColumnAlignment\/numeric(_:)\ncrawled: 2025-12-01T11:29:56Z\n---\n\n# numeric(_:)\n\n**Type Method**\n\nColumn alignment appropriate for numeric content.\n\n## Declaration\n\n```swift\nstatic func numeric(_ numberingSystem: Locale.NumberingSystem) -> TableColumnAlignment\n```\n\n## Discussion\n\nUse this alignment when a table column is primarily displaying numeric content, so that the values are easy to visually scan and compare.\n\nThis uses the provided numbering system to determine the alignment:\n\n- For left to right numbering systems, this is equivalent to right.\n- For right to left numbering systems, this is equivalent to left.\n\n## Getting the alignment\n\n- **automatic**: The default column alignment.\n- **leading**: Leading column alignment.\n- **center**: Center column alignment.\n- **trailing**: Trailing column alignment.\n- **numeric**: Column alignment appropriate for numeric content.\n\n",
  "sections" : [
    {
      "content" : "",
      "items" : [
        {
          "description" : "The default column alignment.",
          "name" : "automatic",
          "url" : "https:\/\/developer.apple.com\/documentation\/SwiftUI\/TableColumnAlignment\/automatic"
        },
        {
          "description" : "Leading column alignment.",
          "name" : "leading",
          "url" : "https:\/\/developer.apple.com\/documentation\/SwiftUI\/TableColumnAlignment\/leading"
        },
        {
          "description" : "Center column alignment.",
          "name" : "center",
          "url" : "https:\/\/developer.apple.com\/documentation\/SwiftUI\/TableColumnAlignment\/center"
        },
        {
          "description" : "Trailing column alignment.",
          "name" : "trailing",
          "url" : "https:\/\/developer.apple.com\/documentation\/SwiftUI\/TableColumnAlignment\/trailing"
        },
        {
          "description" : "Column alignment appropriate for numeric content.",
          "name" : "numeric",
          "url" : "https:\/\/developer.apple.com\/documentation\/SwiftUI\/TableColumnAlignment\/numeric"
        }
      ],
      "title" : "Getting the alignment"
    }
  ],
  "source" : "appleJSON",
  "title" : "numeric(_:)",
  "url" : "https:\/\/developer.apple.com\/documentation\/SwiftUI\/TableColumnAlignment\/numeric(_:)"
}