{
  "abstract" : "Configures a drop session.",
  "codeExamples" : [
    {
      "code" : "       ExampleView()\n           .dropDestination(for: Image.self) { images, _ in\n               process(images)\n           }\n           .dropConfiguration { dropSession in\n               if dropSession.suggestedOperations.contains(.move) {\n                   return DropConfiguration(operation: .move)\n               }\n               return DropConfiguration(operation: .copy)\n           }",
      "language" : "swift"
    }
  ],
  "contentHash" : "ecfecc25f452b27d110be3d210a7f8224e8fb38379f9c7f84b51fe50578b6399",
  "crawledAt" : "2025-11-30T21:08:46Z",
  "declaration" : {
    "code" : "nonisolated func dropConfiguration(_ configuration: @escaping (DropSession) -> DropConfiguration) -> some View\n",
    "language" : "swift"
  },
  "id" : "22439468-9C35-449D-B7A4-01EE5E06E3CC",
  "kind" : "method",
  "module" : "SwiftUI",
  "overview" : "## Return Value\n\nA view that configures a drop session in a way, described by the return value of the `configuration` parameter.\n\n## Discussion\n\nBelow is an example of a view that accepts drop of `Image` type. The view prefers drop operation `move` in a case when the source supports it (the source will remove the images from its storage after the drop operation). If the source does not support moving images, the destination will make copies.",
  "platforms" : [
    "macOS"
  ],
  "rawMarkdown" : "---\nsource: https:\/\/developer.apple.com\/documentation\/SwiftUI\/View\/dropConfiguration(_:)\ncrawled: 2025-11-30T21:08:46Z\n---\n\n# dropConfiguration(_:)\n\n**Instance Method**\n\nConfigures a drop session.\n\n## Declaration\n\n```swift\nnonisolated func dropConfiguration(_ configuration: @escaping (DropSession) -> DropConfiguration) -> some View\n\n```\n\n## Parameters\n\n- **configuration**: A value that describes the configuration of a drop session.\n\n## Return Value\n\nA view that configures a drop session in a way, described by the return value of the `configuration` parameter.\n\n## Discussion\n\nBelow is an example of a view that accepts drop of `Image` type. The view prefers drop operation `move` in a case when the source supports it (the source will remove the images from its storage after the drop operation). If the source does not support moving images, the destination will make copies.\n\n```swift\n       ExampleView()\n           .dropDestination(for: Image.self) { images, _ in\n               process(images)\n           }\n           .dropConfiguration { dropSession in\n               if dropSession.suggestedOperations.contains(.move) {\n                   return DropConfiguration(operation: .move)\n               }\n               return DropConfiguration(operation: .copy)\n           }\n```\n\n\n\n",
  "sections" : [

  ],
  "source" : "appleJSON",
  "title" : "dropConfiguration(_:)",
  "url" : "https:\/\/developer.apple.com\/documentation\/SwiftUI\/View\/dropConfiguration(_:)"
}