{
  "abstract" : "Applies the Liquid Glass effect to a view.",
  "codeExamples" : [
    {
      "code" : "Text(\"Hello, World!\")\n    .font(.title)\n    .padding()\n    .glassEffect()",
      "language" : "swift"
    }
  ],
  "contentHash" : "cd4fb71205db5bc51c4bc43313de3a0929bfa4f05059dc03e5f5b87a8d631171",
  "crawledAt" : "2025-12-02T17:23:50Z",
  "declaration" : {
    "code" : "nonisolated func glassEffect(_ glass: Glass = .regular, in shape: some Shape = DefaultGlassEffectShape()) -> some View\n",
    "language" : "swift"
  },
  "id" : "A8507278-A5E4-4446-A9D6-18738D834829",
  "kind" : "method",
  "language" : "swift",
  "module" : "SwiftUI",
  "overview" : "## Discussion\n\nWhen you use this effect, the system:\n\nFor example, to add this effect to a [doc:\/\/com.apple.SwiftUI\/documentation\/SwiftUI\/Text]:\n\nSwiftUI uses the [doc:\/\/com.apple.SwiftUI\/documentation\/SwiftUI\/Glass\/regular] variant by default along with a [doc:\/\/com.apple.SwiftUI\/documentation\/SwiftUI\/Capsule] shape.\n\nSwiftUI anchors the Liquid Glass to a view’s bounds. For the example above, the material fills the entirety of the `Text` frame, which includes the padding.\n\nYou typically use this modifier with a [doc:\/\/com.apple.SwiftUI\/documentation\/SwiftUI\/GlassEffectContainer] to combine multiple Liquid Glass shapes into a single shape that can morph into one another.",
  "platforms" : [
    "iOS",
    "iPadOS",
    "Mac Catalyst",
    "macOS",
    "tvOS",
    "watchOS"
  ],
  "rawMarkdown" : "---\nsource: https:\/\/developer.apple.com\/documentation\/SwiftUI\/View\/glassEffect(_:in:)\ncrawled: 2025-12-02T17:23:50Z\n---\n\n# glassEffect(_:in:)\n\n**Instance Method**\n\nApplies the Liquid Glass effect to a view.\n\n## Declaration\n\n```swift\nnonisolated func glassEffect(_ glass: Glass = .regular, in shape: some Shape = DefaultGlassEffectShape()) -> some View\n\n```\n\n## Discussion\n\nWhen you use this effect, the system:\n\n- Renders a shape anchored behind a view with the Liquid Glass material.\n- Applies the foreground effects of Liquid Glass over a view.\n\nFor example, to add this effect to a [doc:\/\/com.apple.SwiftUI\/documentation\/SwiftUI\/Text]:\n\n```swift\nText(\"Hello, World!\")\n    .font(.title)\n    .padding()\n    .glassEffect()\n```\n\nSwiftUI uses the [doc:\/\/com.apple.SwiftUI\/documentation\/SwiftUI\/Glass\/regular] variant by default along with a [doc:\/\/com.apple.SwiftUI\/documentation\/SwiftUI\/Capsule] shape.\n\nSwiftUI anchors the Liquid Glass to a view’s bounds. For the example above, the material fills the entirety of the `Text` frame, which includes the padding.\n\nYou typically use this modifier with a [doc:\/\/com.apple.SwiftUI\/documentation\/SwiftUI\/GlassEffectContainer] to combine multiple Liquid Glass shapes into a single shape that can morph into one another.\n\n## Styling views with Liquid Glass\n\n- **Applying Liquid Glass to custom views**: Configure, combine, and morph views using Liquid Glass effects.\n- **Landmarks: Building an app with Liquid Glass**: Enhance your app experience with system-provided and custom Liquid Glass.\n- **interactive(_:)**: Returns a copy of the structure configured to be interactive.\n- **GlassEffectContainer**: A view that combines multiple Liquid Glass shapes into a single shape that can morph individual shapes into one another.\n- **GlassEffectTransition**: A structure that describes changes to apply when a glass effect is added or removed from the view hierarchy.\n- **GlassButtonStyle**: A button style that applies glass border artwork based on the button’s context.\n- **GlassProminentButtonStyle**: A button style that applies prominent glass border artwork based on the button’s context.\n- **DefaultGlassEffectShape**: The default shape applied by glass effects, a capsule.\n\n",
  "sections" : [
    {
      "content" : "",
      "items" : [
        {
          "description" : "Configure, combine, and morph views using Liquid Glass effects.",
          "name" : "Applying Liquid Glass to custom views",
          "url" : "https:\/\/developer.apple.com\/documentation\/SwiftUI\/Applying-Liquid-Glass-to-custom-views"
        },
        {
          "description" : "Enhance your app experience with system-provided and custom Liquid Glass.",
          "name" : "Landmarks: Building an app with Liquid Glass",
          "url" : "https:\/\/developer.apple.com\/documentation\/SwiftUI\/Landmarks-Building-an-app-with-Liquid-Glass"
        },
        {
          "description" : "Returns a copy of the structure configured to be interactive.",
          "name" : "interactive(_:)",
          "url" : "https:\/\/developer.apple.com\/documentation\/SwiftUI\/Glass\/interactive(_:)"
        },
        {
          "description" : "A view that combines multiple Liquid Glass shapes into a single shape that can morph individual shapes into one another.",
          "name" : "GlassEffectContainer",
          "url" : "https:\/\/developer.apple.com\/documentation\/SwiftUI\/GlassEffectContainer"
        },
        {
          "description" : "A structure that describes changes to apply when a glass effect is added or removed from the view hierarchy.",
          "name" : "GlassEffectTransition",
          "url" : "https:\/\/developer.apple.com\/documentation\/SwiftUI\/GlassEffectTransition"
        },
        {
          "description" : "A button style that applies glass border artwork based on the button’s context.",
          "name" : "GlassButtonStyle",
          "url" : "https:\/\/developer.apple.com\/documentation\/SwiftUI\/GlassButtonStyle"
        },
        {
          "description" : "A button style that applies prominent glass border artwork based on the button’s context.",
          "name" : "GlassProminentButtonStyle",
          "url" : "https:\/\/developer.apple.com\/documentation\/SwiftUI\/GlassProminentButtonStyle"
        },
        {
          "description" : "The default shape applied by glass effects, a capsule.",
          "name" : "DefaultGlassEffectShape",
          "url" : "https:\/\/developer.apple.com\/documentation\/SwiftUI\/DefaultGlassEffectShape"
        }
      ],
      "title" : "Styling views with Liquid Glass"
    }
  ],
  "source" : "appleJSON",
  "title" : "glassEffect(_:in:)",
  "url" : "https:\/\/developer.apple.com\/documentation\/SwiftUI\/View\/glassEffect(_:in:)"
}