{
  "abstract" : "Compose rich views by reacting to state changes and customize your app’s scene presentation and behavior on iPadOS and macOS.",
  "codeExamples" : [

  ],
  "contentHash" : "1f83b0a58c53c1be1d701ffa0ad9cec63b81e225b9baf5413a22969b41599b6c",
  "crawledAt" : "2025-12-02T15:57:22Z",
  "id" : "913F5402-A36E-4B35-B1DA-A351FAC8A1FF",
  "kind" : "unknown",
  "language" : "swift",
  "module" : "SwiftUI",
  "overview" : "## Overview\n\n### Configure the sample code project\n\nBefore you run the sample code project in Xcode:",
  "rawMarkdown" : "---\nsource: https:\/\/developer.apple.com\/documentation\/swiftui\/bringing-multiple-windows-to-your-swiftui-app\ncrawled: 2025-12-02T15:57:22Z\n---\n\n# Bringing multiple windows to your SwiftUI app\n\n**Sample Code**\n\nCompose rich views by reacting to state changes and customize your app’s scene presentation and behavior on iPadOS and macOS.\n\n## Overview\n\n\n\n### Configure the sample code project\n\nBefore you run the sample code project in Xcode:\n\n- To run the sample on an iOS device or Mac, make sure you select your team in the Signing & Capabilities tab in each target’s settings.\n\n## Essentials\n\n- **Customizing window styles and state-restoration behavior in macOS**: Configure how your app’s windows look and function in macOS to provide an engaging and more coherent experience.\n\n",
  "sections" : [
    {
      "content" : "",
      "items" : [
        {
          "description" : "Configure how your app’s windows look and function in macOS to provide an engaging and more coherent experience.",
          "name" : "Customizing window styles and state-restoration behavior in macOS",
          "url" : "https:\/\/developer.apple.com\/documentation\/SwiftUI\/Customizing-window-styles-and-state-restoration-behavior-in-macOS"
        }
      ],
      "title" : "Essentials"
    }
  ],
  "source" : "appleJSON",
  "title" : "Bringing multiple windows to your SwiftUI app",
  "url" : "https:\/\/developer.apple.com\/documentation\/swiftui\/bringing-multiple-windows-to-your-swiftui-app"
}