{
  "abstract" : "A type defining the role of a scroll anchor.",
  "codeExamples" : [

  ],
  "conformsTo" : [
    "Equatable",
    "Hashable",
    "Sendable",
    "SendableMetatype"
  ],
  "contentHash" : "c8b3e2a741be5812b12b38ed50ef7508825c91ce6e901fe5c2f2be39491c0845",
  "crawledAt" : "2025-12-02T17:21:40Z",
  "declaration" : {
    "code" : "struct ScrollAnchorRole",
    "language" : "swift"
  },
  "id" : "9D9D39B4-9FAA-488D-8A6A-7A8BEBB4AE8A",
  "kind" : "struct",
  "language" : "swift",
  "module" : "SwiftUI",
  "overview" : "## Overview\n\nYou can associate a [doc:\/\/com.apple.SwiftUI\/documentation\/SwiftUI\/UnitPoint] to a [doc:\/\/com.apple.SwiftUI\/documentation\/SwiftUI\/ScrollView] using the [doc:\/\/com.apple.SwiftUI\/documentation\/SwiftUI\/View\/defaultScrollAnchor(_:)] modifier. By default, the system uses this point for different kinds of behaviors including:\n\nYou can further customize this behavior by assigning different unit points for these different roles.",
  "platforms" : [
    "iOS",
    "iPadOS",
    "Mac Catalyst",
    "macOS",
    "tvOS",
    "visionOS",
    "watchOS"
  ],
  "rawMarkdown" : "---\nsource: https:\/\/developer.apple.com\/documentation\/SwiftUI\/ScrollAnchorRole\ncrawled: 2025-12-02T17:21:40Z\n---\n\n# ScrollAnchorRole\n\n**Structure**\n\nA type defining the role of a scroll anchor.\n\n## Declaration\n\n```swift\nstruct ScrollAnchorRole\n```\n\n## Overview\n\nYou can associate a [doc:\/\/com.apple.SwiftUI\/documentation\/SwiftUI\/UnitPoint] to a [doc:\/\/com.apple.SwiftUI\/documentation\/SwiftUI\/ScrollView] using the [doc:\/\/com.apple.SwiftUI\/documentation\/SwiftUI\/View\/defaultScrollAnchor(_:)] modifier. By default, the system uses this point for different kinds of behaviors including:\n\n- Where the scroll view should initially be scrolled\n- How the scroll view should handle content size or container size changes\n- How the scroll view should align content smaller than its container size\n\nYou can further customize this behavior by assigning different unit points for these different roles.\n\n## Type Properties\n\n- **alignment**: The role that influences how a scroll view should align its content when the size of its content is smaller than the container size of the scroll view.\n- **initialOffset**: The role that influences where a scroll view should be initially scrolled.\n- **sizeChanges**: The role that influences how a scroll view should adjust its content offset when the scroll view’s content or container size changes.\n\n## Managing scroll position\n\n- **scrollPosition(_:anchor:)**: Associates a binding to a scroll position with a scroll view within this view.\n- **scrollPosition(id:anchor:)**: Associates a binding to be updated when a scroll view within this view scrolls.\n- **defaultScrollAnchor(_:)**: Associates an anchor to control which part of the scroll view’s content should be rendered by default.\n- **defaultScrollAnchor(_:for:)**: Associates an anchor to control the position of a scroll view in a particular circumstance.\n- **ScrollPosition**: A type that defines the semantic position of where a scroll view is scrolled within its content.\n\n## Conforms To\n\n- Equatable\n- Hashable\n- Sendable\n- SendableMetatype\n\n",
  "sections" : [
    {
      "content" : "",
      "items" : [
        {
          "description" : "The role that influences how a scroll view should align its content when the size of its content is smaller than the container size of the scroll view.",
          "name" : "alignment",
          "url" : "https:\/\/developer.apple.com\/documentation\/SwiftUI\/ScrollAnchorRole\/alignment"
        },
        {
          "description" : "The role that influences where a scroll view should be initially scrolled.",
          "name" : "initialOffset",
          "url" : "https:\/\/developer.apple.com\/documentation\/SwiftUI\/ScrollAnchorRole\/initialOffset"
        },
        {
          "description" : "The role that influences how a scroll view should adjust its content offset when the scroll view’s content or container size changes.",
          "name" : "sizeChanges",
          "url" : "https:\/\/developer.apple.com\/documentation\/SwiftUI\/ScrollAnchorRole\/sizeChanges"
        }
      ],
      "title" : "Type Properties"
    },
    {
      "content" : "",
      "items" : [
        {
          "description" : "Associates a binding to a scroll position with a scroll view within this view.",
          "name" : "scrollPosition(_:anchor:)",
          "url" : "https:\/\/developer.apple.com\/documentation\/SwiftUI\/View\/scrollPosition(_:anchor:)"
        },
        {
          "description" : "Associates a binding to be updated when a scroll view within this view scrolls.",
          "name" : "scrollPosition(id:anchor:)",
          "url" : "https:\/\/developer.apple.com\/documentation\/SwiftUI\/View\/scrollPosition(id:anchor:)"
        },
        {
          "description" : "Associates an anchor to control which part of the scroll view’s content should be rendered by default.",
          "name" : "defaultScrollAnchor(_:)",
          "url" : "https:\/\/developer.apple.com\/documentation\/SwiftUI\/View\/defaultScrollAnchor(_:)"
        },
        {
          "description" : "Associates an anchor to control the position of a scroll view in a particular circumstance.",
          "name" : "defaultScrollAnchor(_:for:)",
          "url" : "https:\/\/developer.apple.com\/documentation\/SwiftUI\/View\/defaultScrollAnchor(_:for:)"
        },
        {
          "description" : "A type that defines the semantic position of where a scroll view is scrolled within its content.",
          "name" : "ScrollPosition",
          "url" : "https:\/\/developer.apple.com\/documentation\/SwiftUI\/ScrollPosition"
        }
      ],
      "title" : "Managing scroll position"
    }
  ],
  "source" : "appleJSON",
  "title" : "ScrollAnchorRole",
  "url" : "https:\/\/developer.apple.com\/documentation\/SwiftUI\/ScrollAnchorRole"
}