{
  "abstract" : "If the notification should accept user input.",
  "codeExamples" : [

  ],
  "contentHash" : "c1f83481668c4282a3adc843f914c27072cbbe476388594ed721a39816676bb4",
  "crawledAt" : "2025-12-01T11:50:33Z",
  "declaration" : {
    "code" : "@MainActor @preconcurrency class var isInteractive: Bool { get }",
    "language" : "swift"
  },
  "id" : "EC9706DC-7D6E-4DB3-833A-D0A4F496B8AF",
  "kind" : "property",
  "module" : "SwiftUI",
  "overview" : "## Discussion\n\nDefault value is `false`",
  "platforms" : [
    "watchOS"
  ],
  "rawMarkdown" : "---\nsource: https:\/\/developer.apple.com\/documentation\/SwiftUI\/WKUserNotificationHostingController\/isInteractive\ncrawled: 2025-12-01T11:50:33Z\n---\n\n# isInteractive\n\n**Type Property**\n\nIf the notification should accept user input.\n\n## Declaration\n\n```swift\n@MainActor @preconcurrency class var isInteractive: Bool { get }\n```\n\n## Discussion\n\nDefault value is `false`\n\n## Configuring the notification\n\n- **coalescedDescriptionFormat**: The format string to display when multiple notifications of the same type arrive simultaneously. If you specify a custom string, you can use the %d variable to reflect the number of notifications. If `nil` format will be the system default.\n- **sashColor**: Color to use within the sash of the long look interface. If `nil` the sash will be the default system color.\n- **subtitleColor**: The color to apply to the subtitle text displayed in the short look interface. If `nil` the text will be the default system color.\n- **titleColor**: The color to apply to the text displayed in the sash. If `nil` the text will be the default system color.\n- **wantsSashBlur**: If the sash should include a blur over the background.\n\n",
  "sections" : [
    {
      "content" : "",
      "items" : [
        {
          "description" : "The format string to display when multiple notifications of the same type arrive simultaneously. If you specify a custom string, you can use the %d variable to reflect the number of notifications. If `nil` format will be the system default.",
          "name" : "coalescedDescriptionFormat",
          "url" : "https:\/\/developer.apple.com\/documentation\/SwiftUI\/WKUserNotificationHostingController\/coalescedDescriptionFormat"
        },
        {
          "description" : "Color to use within the sash of the long look interface. If `nil` the sash will be the default system color.",
          "name" : "sashColor",
          "url" : "https:\/\/developer.apple.com\/documentation\/SwiftUI\/WKUserNotificationHostingController\/sashColor"
        },
        {
          "description" : "The color to apply to the subtitle text displayed in the short look interface. If `nil` the text will be the default system color.",
          "name" : "subtitleColor",
          "url" : "https:\/\/developer.apple.com\/documentation\/SwiftUI\/WKUserNotificationHostingController\/subtitleColor"
        },
        {
          "description" : "The color to apply to the text displayed in the sash. If `nil` the text will be the default system color.",
          "name" : "titleColor",
          "url" : "https:\/\/developer.apple.com\/documentation\/SwiftUI\/WKUserNotificationHostingController\/titleColor"
        },
        {
          "description" : "If the sash should include a blur over the background.",
          "name" : "wantsSashBlur",
          "url" : "https:\/\/developer.apple.com\/documentation\/SwiftUI\/WKUserNotificationHostingController\/wantsSashBlur"
        }
      ],
      "title" : "Configuring the notification"
    }
  ],
  "source" : "appleJSON",
  "title" : "isInteractive",
  "url" : "https:\/\/developer.apple.com\/documentation\/SwiftUI\/WKUserNotificationHostingController\/isInteractive"
}