{
  "abstract" : "A gesture that recognizes one or more taps and reports their location.",
  "codeExamples" : [
    {
      "code" : "struct TapGestureView: View {\n    @State private var location: CGPoint = .zero\n\n    var tap: some Gesture {\n        SpatialTapGesture()\n            .onEnded { event in\n                self.location = event.location\n             }\n    }\n\n    var body: some View {\n        Circle()\n            .fill(self.location.y > 50 ? Color.blue : Color.red)\n            .frame(width: 100, height: 100, alignment: .center)\n            .gesture(tap)\n    }\n}",
      "language" : "swift"
    }
  ],
  "conformsTo" : [
    "Gesture"
  ],
  "contentHash" : "b7b4c3a0bb81daa0adde4f1674bc8c196b782dc9e0ecb3e4b8d9f3be619daab0",
  "crawledAt" : "2025-12-02T17:22:14Z",
  "declaration" : {
    "code" : "struct SpatialTapGesture",
    "language" : "swift"
  },
  "id" : "05E321F3-0E90-4542-A0C8-08B6B5F9D23A",
  "kind" : "struct",
  "language" : "swift",
  "module" : "SwiftUI",
  "overview" : "## Overview\n\nTo recognize a tap gesture on a view, create and configure the gesture, and then add it to the view using the [doc:\/\/com.apple.SwiftUI\/documentation\/SwiftUI\/View\/gesture(_:including:)] modifier. The following code adds a tap gesture to a [doc:\/\/com.apple.SwiftUI\/documentation\/SwiftUI\/Circle] that toggles the color of the circle based on the tap location:",
  "platforms" : [
    "iOS",
    "iPadOS",
    "Mac Catalyst",
    "macOS",
    "visionOS",
    "watchOS"
  ],
  "rawMarkdown" : "---\nsource: https:\/\/developer.apple.com\/documentation\/SwiftUI\/SpatialTapGesture\ncrawled: 2025-12-02T17:22:14Z\n---\n\n# SpatialTapGesture\n\n**Structure**\n\nA gesture that recognizes one or more taps and reports their location.\n\n## Declaration\n\n```swift\nstruct SpatialTapGesture\n```\n\n## Overview\n\nTo recognize a tap gesture on a view, create and configure the gesture, and then add it to the view using the [doc:\/\/com.apple.SwiftUI\/documentation\/SwiftUI\/View\/gesture(_:including:)] modifier. The following code adds a tap gesture to a [doc:\/\/com.apple.SwiftUI\/documentation\/SwiftUI\/Circle] that toggles the color of the circle based on the tap location:\n\n```swift\nstruct TapGestureView: View {\n    @State private var location: CGPoint = .zero\n\n    var tap: some Gesture {\n        SpatialTapGesture()\n            .onEnded { event in\n                self.location = event.location\n             }\n    }\n\n    var body: some View {\n        Circle()\n            .fill(self.location.y > 50 ? Color.blue : Color.red)\n            .frame(width: 100, height: 100, alignment: .center)\n            .gesture(tap)\n    }\n}\n```\n\n## Creating a spatial tap gesture\n\n- **init(count:coordinateSpace:)**: Creates a tap gesture with the number of required taps and the coordinate space of the gesture’s location.\n- **coordinateSpace**: The coordinate space in which to receive location values.\n- **count**: The required number of tap events.\n\n## Getting the gesture’s value\n\n- **SpatialTapGesture.Value**: The attributes of a tap gesture.\n\n## Deprecated initializers\n\n- **init(count:coordinateSpace:)**: Creates a tap gesture with the number of required taps and the coordinate space of the gesture’s location.\n\n## Initializers\n\n- **init(count:coordinateSpace3D:)**: Creates a tap gesture with the number of required taps and the coordinate space of the gesture’s location.\n- **init(count:coordinateSpace:)**: Creates a tap gesture with the number of required taps and the coordinate space of the gesture’s location.\n\n## Recognizing tap gestures\n\n- **onTapGesture(count:perform:)**: Adds an action to perform when this view recognizes a tap gesture.\n- **onTapGesture(count:coordinateSpace:perform:)**: Adds an action to perform when this view recognizes a tap gesture, and provides the action with the location of the interaction.\n- **TapGesture**: A gesture that recognizes one or more taps.\n\n## Conforms To\n\n- Gesture\n\n",
  "sections" : [
    {
      "content" : "",
      "items" : [
        {
          "description" : "Creates a tap gesture with the number of required taps and the coordinate space of the gesture’s location.",
          "name" : "init(count:coordinateSpace:)",
          "url" : "https:\/\/developer.apple.com\/documentation\/SwiftUI\/SpatialTapGesture\/init(count:coordinateSpace:)-75s7q"
        },
        {
          "description" : "The coordinate space in which to receive location values.",
          "name" : "coordinateSpace",
          "url" : "https:\/\/developer.apple.com\/documentation\/SwiftUI\/SpatialTapGesture\/coordinateSpace"
        },
        {
          "description" : "The required number of tap events.",
          "name" : "count",
          "url" : "https:\/\/developer.apple.com\/documentation\/SwiftUI\/SpatialTapGesture\/count"
        }
      ],
      "title" : "Creating a spatial tap gesture"
    },
    {
      "content" : "",
      "items" : [
        {
          "description" : "The attributes of a tap gesture.",
          "name" : "SpatialTapGesture.Value",
          "url" : "https:\/\/developer.apple.com\/documentation\/SwiftUI\/SpatialTapGesture\/Value"
        }
      ],
      "title" : "Getting the gesture’s value"
    },
    {
      "content" : "",
      "items" : [
        {
          "description" : "Creates a tap gesture with the number of required taps and the coordinate space of the gesture’s location.",
          "name" : "init(count:coordinateSpace:)",
          "url" : "https:\/\/developer.apple.com\/documentation\/SwiftUI\/SpatialTapGesture\/init(count:coordinateSpace:)-1b85g"
        }
      ],
      "title" : "Deprecated initializers"
    },
    {
      "content" : "",
      "items" : [
        {
          "description" : "Creates a tap gesture with the number of required taps and the coordinate space of the gesture’s location.",
          "name" : "init(count:coordinateSpace3D:)",
          "url" : "https:\/\/developer.apple.com\/documentation\/SwiftUI\/SpatialTapGesture\/init(count:coordinateSpace3D:)"
        },
        {
          "description" : "Creates a tap gesture with the number of required taps and the coordinate space of the gesture’s location.",
          "name" : "init(count:coordinateSpace:)",
          "url" : "https:\/\/developer.apple.com\/documentation\/SwiftUI\/SpatialTapGesture\/init(count:coordinateSpace:)"
        }
      ],
      "title" : "Initializers"
    },
    {
      "content" : "",
      "items" : [
        {
          "description" : "Adds an action to perform when this view recognizes a tap gesture.",
          "name" : "onTapGesture(count:perform:)",
          "url" : "https:\/\/developer.apple.com\/documentation\/SwiftUI\/View\/onTapGesture(count:perform:)"
        },
        {
          "description" : "Adds an action to perform when this view recognizes a tap gesture, and provides the action with the location of the interaction.",
          "name" : "onTapGesture(count:coordinateSpace:perform:)",
          "url" : "https:\/\/developer.apple.com\/documentation\/SwiftUI\/View\/onTapGesture(count:coordinateSpace:perform:)"
        },
        {
          "description" : "A gesture that recognizes one or more taps.",
          "name" : "TapGesture",
          "url" : "https:\/\/developer.apple.com\/documentation\/SwiftUI\/TapGesture"
        }
      ],
      "title" : "Recognizing tap gestures"
    }
  ],
  "source" : "appleJSON",
  "title" : "SpatialTapGesture",
  "url" : "https:\/\/developer.apple.com\/documentation\/SwiftUI\/SpatialTapGesture"
}