{
  "abstract" : "Updates the state of the specified view controller with new information from SwiftUI.",
  "codeExamples" : [

  ],
  "contentHash" : "7169367f7fa863d7484790a3a667f18ccdd19d21f89ba1e9e30417bc54a7ca2f",
  "crawledAt" : "2025-12-04T10:03:42Z",
  "declaration" : {
    "code" : "@MainActor @preconcurrency func updateNSViewController(_ nsViewController: Self.NSViewControllerType, context: Self.Context)",
    "language" : "swift"
  },
  "id" : "4B5A8F4D-DCC7-4232-A98E-5D9D3EDC3558",
  "kind" : "method",
  "language" : "swift",
  "module" : "SwiftUI",
  "overview" : "## Discussion\n\nWhen the state of your app changes, SwiftUI updates the portions of your interface affected by those changes. SwiftUI calls this method for any changes affecting the corresponding AppKit view controller. Use this method to update the configuration of your view controller to match the new state information provided in the `context` parameter.",
  "platforms" : [
    "macOS"
  ],
  "rawMarkdown" : "---\nsource: https:\/\/developer.apple.com\/documentation\/swiftui\/nsviewcontrollerrepresentable\/updatensviewcontroller(_:context:)\ncrawled: 2025-12-04T10:03:42Z\n---\n\n# updateNSViewController(_:context:)\n\n**Instance Method**\n\nUpdates the state of the specified view controller with new information from SwiftUI.\n\n## Declaration\n\n```swift\n@MainActor @preconcurrency func updateNSViewController(_ nsViewController: Self.NSViewControllerType, context: Self.Context)\n```\n\n## Parameters\n\n- **nsViewController**: Your custom view controller object.\n- **context**: A context structure containing information about the current state of the system.\n\n## Discussion\n\nWhen the state of your app changes, SwiftUI updates the portions of your interface affected by those changes. SwiftUI calls this method for any changes affecting the corresponding AppKit view controller. Use this method to update the configuration of your view controller to match the new state information provided in the `context` parameter.\n\n## Creating and updating the view controller\n\n- **makeNSViewController(context:)**: Creates the view controller object and configures its initial state.\n- **NSViewControllerRepresentable.Context**\n- **NSViewControllerType**: The type of view controller to present.\n\n",
  "sections" : [
    {
      "content" : "",
      "items" : [
        {
          "description" : "Creates the view controller object and configures its initial state.",
          "name" : "makeNSViewController(context:)",
          "url" : "https:\/\/developer.apple.com\/documentation\/SwiftUI\/NSViewControllerRepresentable\/makeNSViewController(context:)"
        },
        {
          "description" : "",
          "name" : "NSViewControllerRepresentable.Context",
          "url" : "https:\/\/developer.apple.com\/documentation\/SwiftUI\/NSViewControllerRepresentable\/Context"
        },
        {
          "description" : "The type of view controller to present.",
          "name" : "NSViewControllerType",
          "url" : "https:\/\/developer.apple.com\/documentation\/SwiftUI\/NSViewControllerRepresentable\/NSViewControllerType"
        }
      ],
      "title" : "Creating and updating the view controller"
    }
  ],
  "source" : "appleJSON",
  "title" : "updateNSViewController(_:context:)",
  "url" : "https:\/\/developer.apple.com\/documentation\/swiftui\/nsviewcontrollerrepresentable\/updatensviewcontroller(_:context:)"
}