{
  "abstract" : "A picker style that presents the options as a group of radio buttons.",
  "codeExamples" : [

  ],
  "contentHash" : "c7444e3c372120cf6b7cad22dfe580dc39eaa9a27ae670fd9b27bab2996b6eaa",
  "crawledAt" : "2025-12-01T10:58:16Z",
  "declaration" : {
    "code" : "static var radioGroup: RadioGroupPickerStyle { get }",
    "language" : "swift"
  },
  "id" : "AA1D955B-3EC9-447E-9B6F-34132C6CDB7C",
  "kind" : "property",
  "module" : "SwiftUI",
  "overview" : "## Discussion\n\nUse this style when there are two to five options. Consider using [doc:\/\/com.apple.SwiftUI\/documentation\/SwiftUI\/PickerStyle\/menu] when there are more than five options.\n\nFor each option’s label, use sentence-style capitalization without ending punctuation, like a period or colon.\n\nTo apply this style to a picker, or to a view that contains pickers, use the [doc:\/\/com.apple.SwiftUI\/documentation\/SwiftUI\/View\/pickerStyle(_:)] modifier.",
  "platforms" : [
    "macOS"
  ],
  "rawMarkdown" : "---\nsource: https:\/\/developer.apple.com\/documentation\/SwiftUI\/PickerStyle\/radioGroup\ncrawled: 2025-12-01T10:58:16Z\n---\n\n# radioGroup\n\n**Type Property**\n\nA picker style that presents the options as a group of radio buttons.\n\n## Declaration\n\n```swift\nstatic var radioGroup: RadioGroupPickerStyle { get }\n```\n\n## Discussion\n\nUse this style when there are two to five options. Consider using [doc:\/\/com.apple.SwiftUI\/documentation\/SwiftUI\/PickerStyle\/menu] when there are more than five options.\n\nFor each option’s label, use sentence-style capitalization without ending punctuation, like a period or colon.\n\nTo apply this style to a picker, or to a view that contains pickers, use the [doc:\/\/com.apple.SwiftUI\/documentation\/SwiftUI\/View\/pickerStyle(_:)] modifier.\n\n## Getting built-in picker styles\n\n- **automatic**: The default picker style, based on the picker’s context.\n- **inline**: A `PickerStyle` where each option is displayed inline with other views in the current container.\n- **menu**: A picker style that presents the options as a menu when the user presses a button, or as a submenu when nested within a larger menu.\n- **navigationLink**: A picker style represented by a navigation link that presents the options by pushing a List-style picker view.\n- **palette**: A picker style that presents the options as a row of compact elements.\n- **segmented**: A picker style that presents the options in a segmented control.\n- **wheel**: A picker style that presents the options in a scrollable wheel that shows the selected option and a few neighboring options.\n\n",
  "sections" : [
    {
      "content" : "",
      "items" : [
        {
          "description" : "The default picker style, based on the picker’s context.",
          "name" : "automatic",
          "url" : "https:\/\/developer.apple.com\/documentation\/SwiftUI\/PickerStyle\/automatic"
        },
        {
          "description" : "A `PickerStyle` where each option is displayed inline with other views in the current container.",
          "name" : "inline",
          "url" : "https:\/\/developer.apple.com\/documentation\/SwiftUI\/PickerStyle\/inline"
        },
        {
          "description" : "A picker style that presents the options as a menu when the user presses a button, or as a submenu when nested within a larger menu.",
          "name" : "menu",
          "url" : "https:\/\/developer.apple.com\/documentation\/SwiftUI\/PickerStyle\/menu"
        },
        {
          "description" : "A picker style represented by a navigation link that presents the options by pushing a List-style picker view.",
          "name" : "navigationLink",
          "url" : "https:\/\/developer.apple.com\/documentation\/SwiftUI\/PickerStyle\/navigationLink"
        },
        {
          "description" : "A picker style that presents the options as a row of compact elements.",
          "name" : "palette",
          "url" : "https:\/\/developer.apple.com\/documentation\/SwiftUI\/PickerStyle\/palette"
        },
        {
          "description" : "A picker style that presents the options in a segmented control.",
          "name" : "segmented",
          "url" : "https:\/\/developer.apple.com\/documentation\/SwiftUI\/PickerStyle\/segmented"
        },
        {
          "description" : "A picker style that presents the options in a scrollable wheel that shows the selected option and a few neighboring options.",
          "name" : "wheel",
          "url" : "https:\/\/developer.apple.com\/documentation\/SwiftUI\/PickerStyle\/wheel"
        }
      ],
      "title" : "Getting built-in picker styles"
    }
  ],
  "source" : "appleJSON",
  "title" : "radioGroup",
  "url" : "https:\/\/developer.apple.com\/documentation\/SwiftUI\/PickerStyle\/radioGroup"
}