{
  "abstract" : "Controls the visibility of the glass background effect on items in the toolbar. In certain contexts, such as the navigation bar on iOS and the window toolbar on macOS, toolbar items will be given a glass background effect that is shared with other items in the same logical grouping.",
  "codeExamples" : [
    {
      "code" : "ContentView()\n    .toolbar {\n        ToolbarItem(placement: principal) {\n            BuildStatus()\n        }\n        .sharedBackgroundVisibility(.hidden)\n    }",
      "language" : "swift"
    }
  ],
  "contentHash" : "6cf7c0d838f2333d9c41c85923ae139229b3fbbc2bd2542f26e408c174db906b",
  "crawledAt" : "2025-12-03T05:44:19Z",
  "declaration" : {
    "code" : "nonisolated func sharedBackgroundVisibility(_ visibility: Visibility) -> some ToolbarContent\n",
    "language" : "swift"
  },
  "id" : "FCC22961-25A1-486C-A39D-D9D17C358ACF",
  "kind" : "method",
  "language" : "swift",
  "module" : "SwiftUI",
  "overview" : "## Discussion\n\nThis modifier adjusts the visibility of that effect. Hiding the effect will cause the item to be placed in its own grouping.",
  "platforms" : [
    "iOS",
    "iPadOS",
    "Mac Catalyst",
    "macOS"
  ],
  "rawMarkdown" : "---\nsource: https:\/\/developer.apple.com\/documentation\/SwiftUI\/ToolbarContent\/sharedBackgroundVisibility(_:)\ncrawled: 2025-12-03T05:44:19Z\n---\n\n# sharedBackgroundVisibility(_:)\n\n**Instance Method**\n\nControls the visibility of the glass background effect on items in the toolbar. In certain contexts, such as the navigation bar on iOS and the window toolbar on macOS, toolbar items will be given a glass background effect that is shared with other items in the same logical grouping.\n\n## Declaration\n\n```swift\nnonisolated func sharedBackgroundVisibility(_ visibility: Visibility) -> some ToolbarContent\n\n```\n\n## Parameters\n\n- **visibility**: The visibility of the background effect.\n\n## Discussion\n\nThis modifier adjusts the visibility of that effect. Hiding the effect will cause the item to be placed in its own grouping.\n\n```swift\nContentView()\n    .toolbar {\n        ToolbarItem(placement: principal) {\n            BuildStatus()\n        }\n        .sharedBackgroundVisibility(.hidden)\n    }\n```\n\n",
  "sections" : [

  ],
  "source" : "appleJSON",
  "title" : "sharedBackgroundVisibility(_:)",
  "url" : "https:\/\/developer.apple.com\/documentation\/SwiftUI\/ToolbarContent\/sharedBackgroundVisibility(_:)"
}