{
  "abstract" : "Configure an image to blur and extend under a sidebar or inspector panel.",
  "codeExamples" : [
    {
      "code" : "ScrollView(showsIndicators: false) {\n    LazyVStack(alignment: .leading, spacing: Constants.standardPadding) {\n        LandmarkFeaturedItemView(landmark: modelData.featuredLandmark!)\n            .flexibleHeaderContent()\n        \/\/...\n    }\n}",
      "language" : "swift"
    },
    {
      "code" : "Image(landmark.backgroundImageName)\n    \/\/...\n    .backgroundExtensionEffect()",
      "language" : "swift"
    },
    {
      "code" : "Image(decorative: landmark.backgroundImageName)\n    \/\/...\n    .backgroundExtensionEffect()\n    .overlay(alignment: .bottom) {\n        VStack {\n            Text(\"Featured Landmark\", comment: \"Big headline in the main image of featured landmarks.\")\n                \/\/...\n            Text(landmark.name)\n                \/\/...\n            Button(\"Learn More\") {\n                modelData.path.append(landmark)\n            }\n            \/\/...\n        }\n        .padding([.bottom], Constants.learnMoreBottomPadding)\n    }\n",
      "language" : "swift"
    }
  ],
  "contentHash" : "fdbd678621f6feef2fc68b09051b1550d6823139d3b2555f986cae458de3f221",
  "crawledAt" : "2025-12-02T15:45:36Z",
  "id" : "765EA06C-8DCF-44D8-9642-E271CEDC02E2",
  "kind" : "unknown",
  "language" : "swift",
  "module" : "SwiftUI",
  "overview" : "## Overview\n\nThe Landmarks app lets people explore interesting sites around the world. Whether it’s a national park near their home or a far-flung location on a different continent, the app provides a way for people to organize and mark their adventures and receive custom activity badges along the way.\n\nThis sample demonstrates how to apply a background extension effect. In the top Landmarks view, the sample applies a background extension effect to the featured image in `LandmarksView`, and to the main image in `LandmarkDetailView`. The background extension effect blurs and extends the image under the sidebar or inspector panel when open. The following images show the main image in `LandmarkDetailView` both with and without the background extension effect.\n\nTo apply the background extension effect, the sample:\n\n### Align the view to the leading and trailing edges\n\nTo apply the [doc:\/\/com.apple.SwiftUI\/documentation\/SwiftUI\/View\/backgroundExtensionEffect()] to a view, align the leading edge of the view next to the sidebar, and align the trailing edge of the view to the trailing edge of the containing view.\n\nIn `LandmarksView`, the `LandmarkFeaturedItemView` and the containing [doc:\/\/com.apple.SwiftUI\/documentation\/SwiftUI\/LazyVStack] and [doc:\/\/com.apple.SwiftUI\/documentation\/SwiftUI\/ScrollView] don’t have padding. This allows the `LandmarkFeaturedItemView` to align with the leading edge of the view next to the sidebar.\n\nIn `LandmarkDetailView`, the [doc:\/\/com.apple.SwiftUI\/documentation\/SwiftUI\/ScrollView] and [doc:\/\/com.apple.SwiftUI\/documentation\/SwiftUI\/VStack] that contain the main image also don’t have any padding. This allows the main image to align against the leading edge of the containing view.\n\n### Apply the background extension effect to the image\n\nIn `LandmarkDetailView`, the sample applies the background extension effect to the main image by adding the [doc:\/\/com.apple.SwiftUI\/documentation\/SwiftUI\/View\/backgroundExtensionEffect()] modifier:\n\nWhen the sidebar is open, the system extends the image in the leading direction as follows:\n\nWhen the inspector is open, the system extends the image in the trailing direction as follows:\n\n### Configure only the image\n\nIn `LandmarksView`, the `LandmarkFeaturedItemView` has an image from the featured landmark, and includes a title for the landmark and a button you can click or tap to learn more about that location.\n\nTo avoid having the landmark’s title and button appear under the sidebar in macOS, the sample applies the [doc:\/\/com.apple.SwiftUI\/documentation\/SwiftUI\/View\/backgroundExtensionEffect()] modifier to the image before adding the overlay that includes the title and button:",
  "rawMarkdown" : "---\nsource: https:\/\/developer.apple.com\/documentation\/SwiftUI\/Landmarks-Applying-a-background-extension-effect\ncrawled: 2025-12-02T15:45:37Z\n---\n\n# Landmarks: Applying a background extension effect\n\n**Sample Code**\n\nConfigure an image to blur and extend under a sidebar or inspector panel.\n\n## Overview\n\nThe Landmarks app lets people explore interesting sites around the world. Whether it’s a national park near their home or a far-flung location on a different continent, the app provides a way for people to organize and mark their adventures and receive custom activity badges along the way.\n\nThis sample demonstrates how to apply a background extension effect. In the top Landmarks view, the sample applies a background extension effect to the featured image in `LandmarksView`, and to the main image in `LandmarkDetailView`. The background extension effect blurs and extends the image under the sidebar or inspector panel when open. The following images show the main image in `LandmarkDetailView` both with and without the background extension effect.\n\n\n\nTo apply the background extension effect, the sample:\n\n1. Aligns the view to the leading and trailing edges of the containing view.\n2. Applies the [doc:\/\/com.apple.SwiftUI\/documentation\/SwiftUI\/View\/backgroundExtensionEffect()] modifier to the view.\n3. Configures only the image in the background extension, and avoids applying the effect to the title and button in the overlay.\n\n### Align the view to the leading and trailing edges\n\nTo apply the [doc:\/\/com.apple.SwiftUI\/documentation\/SwiftUI\/View\/backgroundExtensionEffect()] to a view, align the leading edge of the view next to the sidebar, and align the trailing edge of the view to the trailing edge of the containing view.\n\nIn `LandmarksView`, the `LandmarkFeaturedItemView` and the containing [doc:\/\/com.apple.SwiftUI\/documentation\/SwiftUI\/LazyVStack] and [doc:\/\/com.apple.SwiftUI\/documentation\/SwiftUI\/ScrollView] don’t have padding. This allows the `LandmarkFeaturedItemView` to align with the leading edge of the view next to the sidebar.\n\n```swift\nScrollView(showsIndicators: false) {\n    LazyVStack(alignment: .leading, spacing: Constants.standardPadding) {\n        LandmarkFeaturedItemView(landmark: modelData.featuredLandmark!)\n            .flexibleHeaderContent()\n        \/\/...\n    }\n}\n```\n\nIn `LandmarkDetailView`, the [doc:\/\/com.apple.SwiftUI\/documentation\/SwiftUI\/ScrollView] and [doc:\/\/com.apple.SwiftUI\/documentation\/SwiftUI\/VStack] that contain the main image also don’t have any padding. This allows the main image to align against the leading edge of the containing view.\n\n### Apply the background extension effect to the image\n\nIn `LandmarkDetailView`, the sample applies the background extension effect to the main image by adding the [doc:\/\/com.apple.SwiftUI\/documentation\/SwiftUI\/View\/backgroundExtensionEffect()] modifier:\n\n```swift\nImage(landmark.backgroundImageName)\n    \/\/...\n    .backgroundExtensionEffect()\n```\n\nWhen the sidebar is open, the system extends the image in the leading direction as follows:\n\n- The system takes a section of the leading end of the image that matches the width of the sidebar.\n- The system flips that portion of the image horizontally toward the leading edge and applies a blur to the flipped section.\n- The system places the modified section of the image under the sidebar, immediately before the leading edge of the image.\n\nWhen the inspector is open, the system extends the image in the trailing direction as follows:\n\n- The system takes a section of the trailing end of the image that matches the width of the sidebar.\n- The system flips that portion of the image horizontally toward the trailing edge and applies a blur to the flipped section.\n- The system places the modified section of the image under the inspector, immediately after the trailing edge of the image.\n\n### Configure only the image\n\nIn `LandmarksView`, the `LandmarkFeaturedItemView` has an image from the featured landmark, and includes a title for the landmark and a button you can click or tap to learn more about that location.\n\nTo avoid having the landmark’s title and button appear under the sidebar in macOS, the sample applies the [doc:\/\/com.apple.SwiftUI\/documentation\/SwiftUI\/View\/backgroundExtensionEffect()] modifier to the image before adding the overlay that includes the title and button:\n\n```swift\nImage(decorative: landmark.backgroundImageName)\n    \/\/...\n    .backgroundExtensionEffect()\n    .overlay(alignment: .bottom) {\n        VStack {\n            Text(\"Featured Landmark\", comment: \"Big headline in the main image of featured landmarks.\")\n                \/\/...\n            Text(landmark.name)\n                \/\/...\n            Button(\"Learn More\") {\n                modelData.path.append(landmark)\n            }\n            \/\/...\n        }\n        .padding([.bottom], Constants.learnMoreBottomPadding)\n    }\n\n```\n\n## App features\n\n- **Landmarks: Extending horizontal scrolling under a sidebar or inspector**: Improve your horizontal scrollbar’s appearance by extending it under a sidebar or inspector.\n- **Landmarks: Refining the system provided Liquid Glass effect in toolbars**: Organize toolbars into related groupings to improve their appearance and utility.\n- **Landmarks: Displaying custom activity badges**: Provide people with a way to mark their adventures by displaying animated custom activity badges.\n\n",
  "sections" : [
    {
      "content" : "",
      "items" : [
        {
          "description" : "Improve your horizontal scrollbar’s appearance by extending it under a sidebar or inspector.",
          "name" : "Landmarks: Extending horizontal scrolling under a sidebar or inspector",
          "url" : "https:\/\/developer.apple.com\/documentation\/SwiftUI\/Landmarks-Extending-horizontal-scrolling-under-a-sidebar-or-inspector"
        },
        {
          "description" : "Organize toolbars into related groupings to improve their appearance and utility.",
          "name" : "Landmarks: Refining the system provided Liquid Glass effect in toolbars",
          "url" : "https:\/\/developer.apple.com\/documentation\/SwiftUI\/Landmarks-Refining-the-system-provided-glass-effect-in-toolbars"
        },
        {
          "description" : "Provide people with a way to mark their adventures by displaying animated custom activity badges.",
          "name" : "Landmarks: Displaying custom activity badges",
          "url" : "https:\/\/developer.apple.com\/documentation\/SwiftUI\/Landmarks-Displaying-custom-activity-badges"
        }
      ],
      "title" : "App features"
    }
  ],
  "source" : "appleJSON",
  "title" : "Landmarks: Applying a background extension effect",
  "url" : "https:\/\/developer.apple.com\/documentation\/SwiftUI\/Landmarks-Applying-a-background-extension-effect"
}