{
  "abstract" : "A 3D unit point with all components equal to zero.",
  "codeExamples" : [

  ],
  "contentHash" : "28878ae827f14fd353dcb344cb7b343bb87435f7e9abfe91f3d7f22169cdfe07",
  "crawledAt" : "2025-12-03T06:16:21Z",
  "declaration" : {
    "code" : "static let zero: UnitPoint3D",
    "language" : "swift"
  },
  "id" : "CFA2BCB8-2C19-446C-B321-380A39017634",
  "kind" : "property",
  "language" : "swift",
  "module" : "SwiftUI",
  "overview" : "## Discussion\n\nThis point is equivalent to the [doc:\/\/com.apple.SwiftUI\/documentation\/SwiftUI\/UnitPoint3D\/origin]. A view’s origin appears in the top-left-back corner in a left-to-right language environment, with positive x toward the right. It appears in the top-right-back corner in a right-to-left language, with positive x toward the left. Positive y is always toward the bottom of the view, and positive z points toward the front.",
  "platforms" : [
    "visionOS"
  ],
  "rawMarkdown" : "---\nsource: https:\/\/developer.apple.com\/documentation\/SwiftUI\/UnitPoint3D\/zero\ncrawled: 2025-12-03T06:16:21Z\n---\n\n# zero\n\n**Type Property**\n\nA 3D unit point with all components equal to zero.\n\n## Declaration\n\n```swift\nstatic let zero: UnitPoint3D\n```\n\n## Discussion\n\nThis point is equivalent to the [doc:\/\/com.apple.SwiftUI\/documentation\/SwiftUI\/UnitPoint3D\/origin]. A view’s origin appears in the top-left-back corner in a left-to-right language environment, with positive x toward the right. It appears in the top-right-back corner in a right-to-left language, with positive x toward the left. Positive y is always toward the bottom of the view, and positive z points toward the front.\n\n## Getting the origin\n\n- **origin**: The origin of a view.\n\n",
  "sections" : [
    {
      "content" : "",
      "items" : [
        {
          "description" : "The origin of a view.",
          "name" : "origin",
          "url" : "https:\/\/developer.apple.com\/documentation\/SwiftUI\/UnitPoint3D\/origin"
        }
      ],
      "title" : "Getting the origin"
    }
  ],
  "source" : "appleJSON",
  "title" : "zero",
  "url" : "https:\/\/developer.apple.com\/documentation\/SwiftUI\/UnitPoint3D\/zero"
}