{
  "abstract" : "Presents a new document window.",
  "codeExamples" : [
    {
      "code" : "newDocument(contentType: .todoList)\n\n extension UTType {\n     static let todoList = UTType(exportedAs: \"com.myApp.todoList\")\n }",
      "language" : "swift"
    }
  ],
  "contentHash" : "94a835cc607f39e268b1a91959d3b9b206b2ee508216486cd5b152d236fa8c61",
  "crawledAt" : "2025-12-01T10:48:02Z",
  "declaration" : {
    "code" : "@MainActor @preconcurrency func callAsFunction(contentType: UTType)",
    "language" : "swift"
  },
  "id" : "B24B174F-9685-43C6-B176-64F4F4BF38B2",
  "kind" : "method",
  "module" : "SwiftUI",
  "overview" : "## Discussion\n\nDon’t call this method directly. SwiftUI calls it when you call the [doc:\/\/com.apple.SwiftUI\/documentation\/SwiftUI\/EnvironmentValues\/newDocument] action:\n\nFor information about how Swift uses the `callAsFunction()` method to simplify call site syntax, see [https:\/\/docs.swift.org\/swift-book\/ReferenceManual\/Declarations.html#ID622] in *The Swift Programming Language*.",
  "platforms" : [
    "macOS"
  ],
  "rawMarkdown" : "---\nsource: https:\/\/developer.apple.com\/documentation\/SwiftUI\/NewDocumentAction\/callAsFunction(contentType:)\ncrawled: 2025-12-01T10:48:02Z\n---\n\n# callAsFunction(contentType:)\n\n**Instance Method**\n\nPresents a new document window.\n\n## Declaration\n\n```swift\n@MainActor @preconcurrency func callAsFunction(contentType: UTType)\n```\n\n## Parameters\n\n- **contentType**: The content type of the document.\n\n## Discussion\n\nDon’t call this method directly. SwiftUI calls it when you call the [doc:\/\/com.apple.SwiftUI\/documentation\/SwiftUI\/EnvironmentValues\/newDocument] action:\n\n```swift\nnewDocument(contentType: .todoList)\n\n extension UTType {\n     static let todoList = UTType(exportedAs: \"com.myApp.todoList\")\n }\n```\n\n\n\nFor information about how Swift uses the `callAsFunction()` method to simplify call site syntax, see [https:\/\/docs.swift.org\/swift-book\/ReferenceManual\/Declarations.html#ID622] in *The Swift Programming Language*.\n\n## Calling the action\n\n- **callAsFunction(_:)**: Presents a new document window.\n- **callAsFunction(contentType:prepareDocument:)**: Presents a new document window with preset contents.\n\n",
  "sections" : [
    {
      "content" : "",
      "items" : [
        {
          "description" : "Presents a new document window.",
          "name" : "callAsFunction(_:)",
          "url" : "https:\/\/developer.apple.com\/documentation\/SwiftUI\/NewDocumentAction\/callAsFunction(_:)"
        },
        {
          "description" : "Presents a new document window with preset contents.",
          "name" : "callAsFunction(contentType:prepareDocument:)",
          "url" : "https:\/\/developer.apple.com\/documentation\/SwiftUI\/NewDocumentAction\/callAsFunction(contentType:prepareDocument:)"
        }
      ],
      "title" : "Calling the action"
    }
  ],
  "source" : "appleJSON",
  "title" : "callAsFunction(contentType:)",
  "url" : "https:\/\/developer.apple.com\/documentation\/SwiftUI\/NewDocumentAction\/callAsFunction(contentType:)"
}