{
  "abstract" : "Produces content for a conditional statement in a multi-statement closure when the condition is false.",
  "codeExamples" : [
    {
      "code" : "var body: some CompositorContent {\n    if #available(visionOS 100, *) {\n        MyNewContent()\n    } else {\n        MyOldContent()\n    }\n}",
      "language" : "swift"
    }
  ],
  "contentHash" : "51e06face40366d8ea47d4a7580aa0e79e2a2ff1b3653002d9a7604c24406c00",
  "crawledAt" : "2025-12-03T06:33:03Z",
  "declaration" : {
    "code" : "static func buildEither<F>(second: F) -> _ConditionalContent<_LimitedAvailabilityCompositorContent, F> where F : CompositorContent",
    "language" : "swift"
  },
  "id" : "F4116398-1818-4859-9A62-FE0A1F33CADC",
  "kind" : "method",
  "language" : "swift",
  "module" : "SwiftUI",
  "overview" : "## Discussion\n\nConditional statements in a [doc:\/\/com.apple.SwiftUI\/documentation\/SwiftUI\/CompositorContentBuilder] must contain both an `if` statement and an `else` statement, and the condition can only perform a compiler check for availability, like in the following code:",
  "platforms" : [
    "macOS",
    "visionOS"
  ],
  "rawMarkdown" : "---\nsource: https:\/\/developer.apple.com\/documentation\/SwiftUI\/CompositorContentBuilder\/buildEither(second:)\ncrawled: 2025-12-03T06:33:03Z\n---\n\n# buildEither(second:)\n\n**Type Method**\n\nProduces content for a conditional statement in a multi-statement closure when the condition is false.\n\n## Declaration\n\n```swift\nstatic func buildEither<F>(second: F) -> _ConditionalContent<_LimitedAvailabilityCompositorContent, F> where F : CompositorContent\n```\n\n## Discussion\n\nConditional statements in a [doc:\/\/com.apple.SwiftUI\/documentation\/SwiftUI\/CompositorContentBuilder] must contain both an `if` statement and an `else` statement, and the condition can only perform a compiler check for availability, like in the following code:\n\n```swift\nvar body: some CompositorContent {\n    if #available(visionOS 100, *) {\n        MyNewContent()\n    } else {\n        MyOldContent()\n    }\n}\n```\n\n",
  "sections" : [

  ],
  "source" : "appleJSON",
  "title" : "buildEither(second:)",
  "url" : "https:\/\/developer.apple.com\/documentation\/SwiftUI\/CompositorContentBuilder\/buildEither(second:)"
}