{
  "abstract" : "The view modifier that can be applied to `AccessoryWidgetGroup` to specify the shape the three content views will be masked with. The value of `style` is set to `.automatic`, which is `.circular` by default.",
  "codeExamples" : [

  ],
  "contentHash" : "9b4a5741cbf2431ce05ce4e6502a63b48aa5bd10c610fec4b6a9ec0fef817b03",
  "crawledAt" : "2025-11-30T21:17:12Z",
  "declaration" : {
    "code" : "@MainActor @preconcurrency func accessoryWidgetGroupStyle(_ style: AccessoryWidgetGroupStyle = .automatic) -> some View\n",
    "language" : "swift"
  },
  "id" : "00384C49-568B-43BF-AC4F-F2D128A0C9CC",
  "kind" : "method",
  "module" : "SwiftUI",
  "platforms" : [
    "watchOS"
  ],
  "rawMarkdown" : "---\nsource: https:\/\/developer.apple.com\/documentation\/SwiftUI\/View\/accessoryWidgetGroupStyle(_:)\ncrawled: 2025-11-30T21:17:12Z\n---\n\n# accessoryWidgetGroupStyle(_:)\n\n**Instance Method**\n\nThe view modifier that can be applied to `AccessoryWidgetGroup` to specify the shape the three content views will be masked with. The value of `style` is set to `.automatic`, which is `.circular` by default.\n\n## Declaration\n\n```swift\n@MainActor @preconcurrency func accessoryWidgetGroupStyle(_ style: AccessoryWidgetGroupStyle = .automatic) -> some View\n\n```\n\n## Parameters\n\n- **style**: The shape with which the content views are masked. The available shapes are circle and rounded square.\n\n",
  "sections" : [

  ],
  "source" : "appleJSON",
  "title" : "accessoryWidgetGroupStyle(_:)",
  "url" : "https:\/\/developer.apple.com\/documentation\/SwiftUI\/View\/accessoryWidgetGroupStyle(_:)"
}