{
  "abstract" : "Defines a keyboard shortcut and assigns it to the modified control.",
  "codeExamples" : [

  ],
  "contentHash" : "0cbc1f8a07b551640641da1ed413df999c3c85e97fba6d02b5dc2c8c1de969dd",
  "crawledAt" : "2025-11-30T21:26:43Z",
  "declaration" : {
    "code" : "nonisolated func keyboardShortcut(_ key: KeyEquivalent, modifiers: EventModifiers = .command) -> some View\n",
    "language" : "swift"
  },
  "id" : "AD375C5E-8B38-4397-8B04-012D6238459A",
  "kind" : "method",
  "module" : "SwiftUI",
  "overview" : "## Discussion\n\nPressing the control’s shortcut while the control is anywhere in the frontmost window or scene, or anywhere in the macOS main menu, is equivalent to direct interaction with the control to perform its primary action.\n\nThe target of a keyboard shortcut is resolved in a leading-to-trailing, depth-first traversal of one or more view hierarchies. On macOS, the system looks in the key window first, then the main window, and then the command groups; on other platforms, the system looks in the active scene, and then the command groups.\n\nIf multiple controls are associated with the same shortcut, the first one found is used.\n\nThe default localization configuration is set to [doc:\/\/com.apple.SwiftUI\/documentation\/SwiftUI\/KeyboardShortcut\/Localization-swift.struct\/automatic].",
  "platforms" : [
    "iOS",
    "iPadOS",
    "Mac Catalyst",
    "macOS",
    "visionOS"
  ],
  "rawMarkdown" : "---\nsource: https:\/\/developer.apple.com\/documentation\/SwiftUI\/View\/keyboardShortcut(_:modifiers:)\ncrawled: 2025-11-30T21:26:43Z\n---\n\n# keyboardShortcut(_:modifiers:)\n\n**Instance Method**\n\nDefines a keyboard shortcut and assigns it to the modified control.\n\n## Declaration\n\n```swift\nnonisolated func keyboardShortcut(_ key: KeyEquivalent, modifiers: EventModifiers = .command) -> some View\n\n```\n\n## Discussion\n\nPressing the control’s shortcut while the control is anywhere in the frontmost window or scene, or anywhere in the macOS main menu, is equivalent to direct interaction with the control to perform its primary action.\n\nThe target of a keyboard shortcut is resolved in a leading-to-trailing, depth-first traversal of one or more view hierarchies. On macOS, the system looks in the key window first, then the main window, and then the command groups; on other platforms, the system looks in the active scene, and then the command groups.\n\nIf multiple controls are associated with the same shortcut, the first one found is used.\n\nThe default localization configuration is set to [doc:\/\/com.apple.SwiftUI\/documentation\/SwiftUI\/KeyboardShortcut\/Localization-swift.struct\/automatic].\n\n## Creating keyboard shortcuts\n\n- **keyboardShortcut(_:)**: Assigns a keyboard shortcut to the modified control.\n- **keyboardShortcut(_:modifiers:localization:)**: Defines a keyboard shortcut and assigns it to the modified control.\n- **keyboardShortcut**: The keyboard shortcut that buttons in this environment will be triggered with.\n- **KeyboardShortcut**: Keyboard shortcuts describe combinations of keys on a keyboard that the user can press in order to activate a button or toggle.\n- **KeyEquivalent**: Key equivalents consist of a letter, punctuation, or function key that can be combined with an optional set of modifier keys to specify a keyboard shortcut.\n- **EventModifiers**: A set of key modifiers that you can add to a gesture.\n\n",
  "sections" : [
    {
      "content" : "",
      "items" : [
        {
          "description" : "Assigns a keyboard shortcut to the modified control.",
          "name" : "keyboardShortcut(_:)",
          "url" : "https:\/\/developer.apple.com\/documentation\/SwiftUI\/View\/keyboardShortcut(_:)"
        },
        {
          "description" : "Defines a keyboard shortcut and assigns it to the modified control.",
          "name" : "keyboardShortcut(_:modifiers:localization:)",
          "url" : "https:\/\/developer.apple.com\/documentation\/SwiftUI\/View\/keyboardShortcut(_:modifiers:localization:)"
        },
        {
          "description" : "The keyboard shortcut that buttons in this environment will be triggered with.",
          "name" : "keyboardShortcut",
          "url" : "https:\/\/developer.apple.com\/documentation\/SwiftUI\/EnvironmentValues\/keyboardShortcut"
        },
        {
          "description" : "Keyboard shortcuts describe combinations of keys on a keyboard that the user can press in order to activate a button or toggle.",
          "name" : "KeyboardShortcut",
          "url" : "https:\/\/developer.apple.com\/documentation\/SwiftUI\/KeyboardShortcut"
        },
        {
          "description" : "Key equivalents consist of a letter, punctuation, or function key that can be combined with an optional set of modifier keys to specify a keyboard shortcut.",
          "name" : "KeyEquivalent",
          "url" : "https:\/\/developer.apple.com\/documentation\/SwiftUI\/KeyEquivalent"
        },
        {
          "description" : "A set of key modifiers that you can add to a gesture.",
          "name" : "EventModifiers",
          "url" : "https:\/\/developer.apple.com\/documentation\/SwiftUI\/EventModifiers"
        }
      ],
      "title" : "Creating keyboard shortcuts"
    }
  ],
  "source" : "appleJSON",
  "title" : "keyboardShortcut(_:modifiers:)",
  "url" : "https:\/\/developer.apple.com\/documentation\/SwiftUI\/View\/keyboardShortcut(_:modifiers:)"
}