{
  "abstract" : "Cleans up the presented WatchKit interface object (and its coordinator) in anticipation of their removal.",
  "codeExamples" : [

  ],
  "contentHash" : "1211e272535139cc0cdebfd72005b9c3dd82e0e3f298a6c58c191d3fd4addb83",
  "crawledAt" : "2025-12-03T05:39:10Z",
  "declaration" : {
    "code" : "@MainActor @preconcurrency static func dismantleWKInterfaceObject(_ wkInterfaceObject: Self.WKInterfaceObjectType, coordinator: Self.Coordinator)",
    "language" : "swift"
  },
  "id" : "EC4F3C20-7486-43B5-8E3F-6E98025A569A",
  "kind" : "method",
  "language" : "swift",
  "module" : "SwiftUI",
  "overview" : "## Discussion\n\nUse this method to perform additional clean-up work related to your custom interface object. For example, you might use this method to remove observers or update other parts of your SwiftUI interface.",
  "platforms" : [
    "watchOS"
  ],
  "rawMarkdown" : "---\nsource: https:\/\/developer.apple.com\/documentation\/SwiftUI\/WKInterfaceObjectRepresentable\/dismantleWKInterfaceObject(_:coordinator:)\ncrawled: 2025-12-03T05:39:10Z\n---\n\n# dismantleWKInterfaceObject(_:coordinator:)\n\n**Type Method**\n\nCleans up the presented WatchKit interface object (and its coordinator) in anticipation of their removal.\n\n## Declaration\n\n```swift\n@MainActor @preconcurrency static func dismantleWKInterfaceObject(_ wkInterfaceObject: Self.WKInterfaceObjectType, coordinator: Self.Coordinator)\n```\n\n## Parameters\n\n- **wkInterfaceObject**: Your custom interface object.\n- **coordinator**: The custom coordinator instance you use to communicate changes back to SwiftUI. If you do not use a custom coordinator, the system provides a default instance.\n\n## Discussion\n\nUse this method to perform additional clean-up work related to your custom interface object. For example, you might use this method to remove observers or update other parts of your SwiftUI interface.\n\n",
  "sections" : [

  ],
  "source" : "appleJSON",
  "title" : "dismantleWKInterfaceObject(_:coordinator:)",
  "url" : "https:\/\/developer.apple.com\/documentation\/SwiftUI\/WKInterfaceObjectRepresentable\/dismantleWKInterfaceObject(_:coordinator:)"
}