{
  "abstract" : "A control for navigating to a URL.",
  "codeExamples" : [
    {
      "code" : "Link(\"View Our Terms of Service\",\n      destination: URL(string: \"https:\/\/www.example.com\/TOS.html\")!)",
      "language" : "swift"
    },
    {
      "code" : "Link(\"Visit Our Site\", destination: URL(string: \"https:\/\/www.example.com\")!)\n    .environment(\\.openURL, OpenURLAction { url in\n        print(\"Open \\(url)\")\n        return .handled\n    })",
      "language" : "swift"
    }
  ],
  "conformsTo" : [
    "View"
  ],
  "contentHash" : "0e93853dea2752dc717329de2993a4edcf09245c2a502289e01f9fa4c623072d",
  "crawledAt" : "2025-12-02T17:08:41Z",
  "declaration" : {
    "code" : "@MainActor @preconcurrency struct Link<Label> where Label : View",
    "language" : "swift"
  },
  "id" : "1FF0FDA4-A462-4307-90C2-AC0E7CA19F10",
  "kind" : "struct",
  "language" : "swift",
  "module" : "SwiftUI",
  "overview" : "## Overview\n\nCreate a link by providing a destination URL and a title. The title tells the user the purpose of the link, and can be a string, a title key that produces a localized string, or a view that acts as a label. The example below creates a link to `example.com` and displays the title string as a link-styled view:\n\nWhen a user taps or clicks a `Link`, the default behavior depends on the contents of the URL. For example, SwiftUI opens a Universal Link in the associated app if possible, or in the user’s default web browser if not. Alternatively, you can override the default behavior by setting the [doc:\/\/com.apple.SwiftUI\/documentation\/SwiftUI\/EnvironmentValues\/openURL] environment value with a custom [doc:\/\/com.apple.SwiftUI\/documentation\/SwiftUI\/OpenURLAction]:\n\nAs with other views, you can style links using standard view modifiers depending on the view type of the link’s label. For example, a [doc:\/\/com.apple.SwiftUI\/documentation\/SwiftUI\/Text] label could be modified with a custom [doc:\/\/com.apple.SwiftUI\/documentation\/SwiftUI\/View\/font(_:)] or [doc:\/\/com.apple.SwiftUI\/documentation\/SwiftUI\/View\/foregroundColor(_:)] to customize the appearance of the link in your app’s UI.",
  "platforms" : [
    "iOS",
    "iPadOS",
    "Mac Catalyst",
    "macOS",
    "tvOS",
    "visionOS",
    "watchOS"
  ],
  "rawMarkdown" : "---\nsource: https:\/\/developer.apple.com\/documentation\/SwiftUI\/Link\ncrawled: 2025-12-02T17:08:41Z\n---\n\n# Link\n\n**Structure**\n\nA control for navigating to a URL.\n\n## Declaration\n\n```swift\n@MainActor @preconcurrency struct Link<Label> where Label : View\n```\n\n## Overview\n\nCreate a link by providing a destination URL and a title. The title tells the user the purpose of the link, and can be a string, a title key that produces a localized string, or a view that acts as a label. The example below creates a link to `example.com` and displays the title string as a link-styled view:\n\n```swift\nLink(\"View Our Terms of Service\",\n      destination: URL(string: \"https:\/\/www.example.com\/TOS.html\")!)\n```\n\nWhen a user taps or clicks a `Link`, the default behavior depends on the contents of the URL. For example, SwiftUI opens a Universal Link in the associated app if possible, or in the user’s default web browser if not. Alternatively, you can override the default behavior by setting the [doc:\/\/com.apple.SwiftUI\/documentation\/SwiftUI\/EnvironmentValues\/openURL] environment value with a custom [doc:\/\/com.apple.SwiftUI\/documentation\/SwiftUI\/OpenURLAction]:\n\n```swift\nLink(\"Visit Our Site\", destination: URL(string: \"https:\/\/www.example.com\")!)\n    .environment(\\.openURL, OpenURLAction { url in\n        print(\"Open \\(url)\")\n        return .handled\n    })\n```\n\nAs with other views, you can style links using standard view modifiers depending on the view type of the link’s label. For example, a [doc:\/\/com.apple.SwiftUI\/documentation\/SwiftUI\/Text] label could be modified with a custom [doc:\/\/com.apple.SwiftUI\/documentation\/SwiftUI\/View\/font(_:)] or [doc:\/\/com.apple.SwiftUI\/documentation\/SwiftUI\/View\/foregroundColor(_:)] to customize the appearance of the link in your app’s UI.\n\n## Creating a link\n\n- **init(_:destination:)**: Creates a control, consisting of a URL and a title key, used to navigate to a URL.\n- **init(destination:label:)**: Creates a control, consisting of a URL and a label, used to navigate to the given URL.\n\n## Linking to other content\n\n- **ShareLink**: A view that controls a sharing presentation.\n- **SharePreview**: A representation of a type to display in a share preview.\n- **TextFieldLink**: A control that requests text input from the user when pressed.\n- **HelpLink**: A button with a standard appearance that opens app-specific help documentation.\n\n## Conforms To\n\n- View\n\n",
  "sections" : [
    {
      "content" : "",
      "items" : [
        {
          "description" : "Creates a control, consisting of a URL and a title key, used to navigate to a URL.",
          "name" : "init(_:destination:)",
          "url" : "https:\/\/developer.apple.com\/documentation\/SwiftUI\/Link\/init(_:destination:)"
        },
        {
          "description" : "Creates a control, consisting of a URL and a label, used to navigate to the given URL.",
          "name" : "init(destination:label:)",
          "url" : "https:\/\/developer.apple.com\/documentation\/SwiftUI\/Link\/init(destination:label:)"
        }
      ],
      "title" : "Creating a link"
    },
    {
      "content" : "",
      "items" : [
        {
          "description" : "A view that controls a sharing presentation.",
          "name" : "ShareLink",
          "url" : "https:\/\/developer.apple.com\/documentation\/SwiftUI\/ShareLink"
        },
        {
          "description" : "A representation of a type to display in a share preview.",
          "name" : "SharePreview",
          "url" : "https:\/\/developer.apple.com\/documentation\/SwiftUI\/SharePreview"
        },
        {
          "description" : "A control that requests text input from the user when pressed.",
          "name" : "TextFieldLink",
          "url" : "https:\/\/developer.apple.com\/documentation\/SwiftUI\/TextFieldLink"
        },
        {
          "description" : "A button with a standard appearance that opens app-specific help documentation.",
          "name" : "HelpLink",
          "url" : "https:\/\/developer.apple.com\/documentation\/SwiftUI\/HelpLink"
        }
      ],
      "title" : "Linking to other content"
    }
  ],
  "source" : "appleJSON",
  "title" : "Link",
  "url" : "https:\/\/developer.apple.com\/documentation\/SwiftUI\/Link"
}