{
  "abstract" : "Hides an individual view within a control group toolbar item.",
  "codeExamples" : [
    {
      "code" : "struct ContentView {\n    @State private var inCollaboration = false\n\n    var body: some View {\n        BrowserView()\n            .toolbar(id: \"browserToolbar\") {\n                ToolbarItem(id: \"share\") {\n                    ControlGroup {\n                        ShareButton()\n                        CollaborationButton()\n                            .toolbarItemHidden(!inCollaboration)\n                    }\n                }\n            }\n    }\n}",
      "language" : "swift"
    }
  ],
  "contentHash" : "1467ea16b2d03d024b515b634ca8ee2117b03f0bfc5949aa671eb2ec9c62083c",
  "crawledAt" : "2025-12-02T17:26:14Z",
  "declaration" : {
    "code" : "nonisolated func toolbarItemHidden(_ hidden: Bool = true) -> some View\n",
    "language" : "swift"
  },
  "id" : "17BA6C0B-6E58-471C-B29E-A888C128A42E",
  "kind" : "method",
  "language" : "swift",
  "module" : "SwiftUI",
  "overview" : "## Discussion\n\nUse this modifier to hide individual views of a `ControlGroup` without hiding the entire group. On macOS and iOS, hidden items will be displayed during user customization.\n\nThe following example displays a collaboration button in a group when there is an active collaboration session.",
  "platforms" : [
    "macOS"
  ],
  "rawMarkdown" : "---\nsource: https:\/\/developer.apple.com\/documentation\/SwiftUI\/View\/toolbarItemHidden(_:)\ncrawled: 2025-12-02T17:26:14Z\n---\n\n# toolbarItemHidden(_:)\n\n**Instance Method**\n\nHides an individual view within a control group toolbar item.\n\n## Declaration\n\n```swift\nnonisolated func toolbarItemHidden(_ hidden: Bool = true) -> some View\n\n```\n\n## Parameters\n\n- **hidden**: Whether the view in a control group toolbar item is hidden.\n\n## Discussion\n\nUse this modifier to hide individual views of a `ControlGroup` without hiding the entire group. On macOS and iOS, hidden items will be displayed during user customization.\n\nThe following example displays a collaboration button in a group when there is an active collaboration session.\n\n```swift\nstruct ContentView {\n    @State private var inCollaboration = false\n\n    var body: some View {\n        BrowserView()\n            .toolbar(id: \"browserToolbar\") {\n                ToolbarItem(id: \"share\") {\n                    ControlGroup {\n                        ShareButton()\n                        CollaborationButton()\n                            .toolbarItemHidden(!inCollaboration)\n                    }\n                }\n            }\n    }\n}\n```\n\n",
  "sections" : [

  ],
  "source" : "appleJSON",
  "title" : "toolbarItemHidden(_:)",
  "url" : "https:\/\/developer.apple.com\/documentation\/SwiftUI\/View\/toolbarItemHidden(_:)"
}