{
  "abstract" : "The configuration and content of a widget to display on the Home screen or in Notification Center.",
  "codeExamples" : [
    {
      "code" : "struct MyCustomType: Transition {\n    \/\/ `@preconcurrency @MainActor` isolation by default\n}",
      "language" : "swift"
    },
    {
      "code" : "extension MyCustomType: Transition {\n    \/\/ `nonisolated` by default\n}",
      "language" : "swift"
    }
  ],
  "contentHash" : "8488755d43f4cd588aa8dafb826d7c646c0c7e7df803bcb9b2118f628dce1bd9",
  "crawledAt" : "2025-12-02T17:31:57Z",
  "declaration" : {
    "code" : "@MainActor @preconcurrency protocol Widget",
    "language" : "swift"
  },
  "id" : "150D0F91-79A2-471A-AADD-2DC7A5C2E89C",
  "kind" : "protocol",
  "language" : "swift",
  "module" : "SwiftUI",
  "overview" : "## Overview\n\nWidgets show glanceable and relevant content from your app right on the iOS Home screen or in Notification Center on macOS. Users can add, configure, and arrange widgets to suit their individual needs. You can provide multiple types of widgets, each presenting a specific kind of information. When users want more information, like to read the full article for a headline or to see the details of a package delivery, the widget lets them get to the information in your app quickly.\n\nThere are three key components to a widget:\n\nFor information about adding a widget extension to your app, and keeping your widget up to date, see [doc:\/\/com.apple.documentation\/documentation\/WidgetKit\/Creating-a-Widget-Extension] and [doc:\/\/com.apple.documentation\/documentation\/WidgetKit\/Keeping-a-Widget-Up-To-Date], respectively.\n\nBy adding a custom SiriKit intent definition, you can let users customize their widgets to show the information that’s most relevant to them. If you’ve already added support for Siri or Shortcuts, you’re well on your way to supporting customizable widgets. For more information, see [doc:\/\/com.apple.documentation\/documentation\/WidgetKit\/Making-a-Configurable-Widget].\n\nA type conforming to this protocol inherits `@preconcurrency @MainActor` isolation from the protocol if the conformance is included in the type’s base declaration:\n\nIsolation to the main actor is the default, but it’s not required. Declare the conformance in an extension to opt out of main actor isolation:",
  "platforms" : [
    "iOS",
    "iPadOS",
    "Mac Catalyst",
    "macOS",
    "visionOS",
    "watchOS"
  ],
  "rawMarkdown" : "---\nsource: https:\/\/developer.apple.com\/documentation\/SwiftUI\/Widget\ncrawled: 2025-12-02T17:31:57Z\n---\n\n# Widget\n\n**Protocol**\n\nThe configuration and content of a widget to display on the Home screen or in Notification Center.\n\n## Declaration\n\n```swift\n@MainActor @preconcurrency protocol Widget\n```\n\n## Overview\n\nWidgets show glanceable and relevant content from your app right on the iOS Home screen or in Notification Center on macOS. Users can add, configure, and arrange widgets to suit their individual needs. You can provide multiple types of widgets, each presenting a specific kind of information. When users want more information, like to read the full article for a headline or to see the details of a package delivery, the widget lets them get to the information in your app quickly.\n\nThere are three key components to a widget:\n\n- A configuration that determines whether the widget is configurable, identifies the widget, and defines the SwiftUI views that show the widget’s content.\n- A timeline provider that drives the process of updating the widget’s view over time.\n- SwiftUI views used by WidgetKit to display the widget.\n\nFor information about adding a widget extension to your app, and keeping your widget up to date, see [doc:\/\/com.apple.documentation\/documentation\/WidgetKit\/Creating-a-Widget-Extension] and [doc:\/\/com.apple.documentation\/documentation\/WidgetKit\/Keeping-a-Widget-Up-To-Date], respectively.\n\nBy adding a custom SiriKit intent definition, you can let users customize their widgets to show the information that’s most relevant to them. If you’ve already added support for Siri or Shortcuts, you’re well on your way to supporting customizable widgets. For more information, see [doc:\/\/com.apple.documentation\/documentation\/WidgetKit\/Making-a-Configurable-Widget].\n\nA type conforming to this protocol inherits `@preconcurrency @MainActor` isolation from the protocol if the conformance is included in the type’s base declaration:\n\n```swift\nstruct MyCustomType: Transition {\n    \/\/ `@preconcurrency @MainActor` isolation by default\n}\n```\n\nIsolation to the main actor is the default, but it’s not required. Declare the conformance in an extension to opt out of main actor isolation:\n\n```swift\nextension MyCustomType: Transition {\n    \/\/ `nonisolated` by default\n}\n```\n\n## Implementing a widget\n\n- **body**: The content and behavior of the widget.\n- **Body**: The type of configuration representing the content of the widget.\n\n## Running a widget\n\n- **init()**: Creates a widget using `body` as its content.\n- **main()**: Initializes and runs the widget.\n\n## Creating widgets\n\n- **Building Widgets Using WidgetKit and SwiftUI**: Create widgets to show your app’s content on the Home screen, with custom intents for user-customizable settings.\n- **Creating a widget extension**: Display your app’s content in a convenient, informative widget on various devices.\n- **Keeping a widget up to date**: Plan your widget’s timeline to show timely, relevant information using dynamic views, and update the timeline when things change.\n- **Making a configurable widget**: Give people the option to customize their widgets by adding a custom app intent to your project.\n- **WidgetBundle**: A container used to expose multiple widgets from a single widget extension.\n- **LimitedAvailabilityConfiguration**: A type-erased widget configuration.\n- **WidgetConfiguration**: A type that describes a widget’s content.\n- **EmptyWidgetConfiguration**: An empty widget configuration.\n\n",
  "sections" : [
    {
      "content" : "",
      "items" : [
        {
          "description" : "The content and behavior of the widget.",
          "name" : "body",
          "url" : "https:\/\/developer.apple.com\/documentation\/SwiftUI\/Widget\/body-swift.property"
        },
        {
          "description" : "The type of configuration representing the content of the widget.",
          "name" : "Body",
          "url" : "https:\/\/developer.apple.com\/documentation\/SwiftUI\/Widget\/Body-swift.associatedtype"
        }
      ],
      "title" : "Implementing a widget"
    },
    {
      "content" : "",
      "items" : [
        {
          "description" : "Creates a widget using `body` as its content.",
          "name" : "init()",
          "url" : "https:\/\/developer.apple.com\/documentation\/SwiftUI\/Widget\/init()"
        },
        {
          "description" : "Initializes and runs the widget.",
          "name" : "main()",
          "url" : "https:\/\/developer.apple.com\/documentation\/SwiftUI\/Widget\/main()"
        }
      ],
      "title" : "Running a widget"
    },
    {
      "content" : "",
      "items" : [
        {
          "description" : "Create widgets to show your app’s content on the Home screen, with custom intents for user-customizable settings.",
          "name" : "Building Widgets Using WidgetKit and SwiftUI",
          "url" : "https:\/\/developer.apple.com\/documentation\/widgetkit\/building_widgets_using_widgetkit_and_swiftui"
        },
        {
          "description" : "Display your app’s content in a convenient, informative widget on various devices.",
          "name" : "Creating a widget extension",
          "url" : "https:\/\/developer.apple.com\/documentation\/WidgetKit\/Creating-a-Widget-Extension"
        },
        {
          "description" : "Plan your widget’s timeline to show timely, relevant information using dynamic views, and update the timeline when things change.",
          "name" : "Keeping a widget up to date",
          "url" : "https:\/\/developer.apple.com\/documentation\/WidgetKit\/Keeping-a-Widget-Up-To-Date"
        },
        {
          "description" : "Give people the option to customize their widgets by adding a custom app intent to your project.",
          "name" : "Making a configurable widget",
          "url" : "https:\/\/developer.apple.com\/documentation\/WidgetKit\/Making-a-Configurable-Widget"
        },
        {
          "description" : "A container used to expose multiple widgets from a single widget extension.",
          "name" : "WidgetBundle",
          "url" : "https:\/\/developer.apple.com\/documentation\/SwiftUI\/WidgetBundle"
        },
        {
          "description" : "A type-erased widget configuration.",
          "name" : "LimitedAvailabilityConfiguration",
          "url" : "https:\/\/developer.apple.com\/documentation\/SwiftUI\/LimitedAvailabilityConfiguration"
        },
        {
          "description" : "A type that describes a widget’s content.",
          "name" : "WidgetConfiguration",
          "url" : "https:\/\/developer.apple.com\/documentation\/SwiftUI\/WidgetConfiguration"
        },
        {
          "description" : "An empty widget configuration.",
          "name" : "EmptyWidgetConfiguration",
          "url" : "https:\/\/developer.apple.com\/documentation\/SwiftUI\/EmptyWidgetConfiguration"
        }
      ],
      "title" : "Creating widgets"
    }
  ],
  "source" : "appleJSON",
  "title" : "Widget",
  "url" : "https:\/\/developer.apple.com\/documentation\/SwiftUI\/Widget"
}