{
  "abstract" : "Creates a TextFieldLink which when pressed will request text input from the user.",
  "codeExamples" : [

  ],
  "contentHash" : "f32566626e6809edc0984a1f0de27cc720833c68719928aa78e621eaa0f9346e",
  "crawledAt" : "2025-12-03T05:45:28Z",
  "declaration" : {
    "code" : "nonisolated init(prompt: Text? = nil, @ViewBuilder label: () -> Label, onSubmit: @escaping (String) -> Void)",
    "language" : "swift"
  },
  "id" : "D6CB32B2-6129-4BA1-B1C0-5CB7D2EF773E",
  "kind" : "unknown",
  "language" : "swift",
  "module" : "SwiftUI",
  "platforms" : [
    "watchOS"
  ],
  "rawMarkdown" : "---\nsource: https:\/\/developer.apple.com\/documentation\/SwiftUI\/TextFieldLink\/init(prompt:label:onSubmit:)\ncrawled: 2025-12-03T05:45:28Z\n---\n\n# init(prompt:label:onSubmit:)\n\n**Initializer**\n\nCreates a TextFieldLink which when pressed will request text input from the user.\n\n## Declaration\n\n```swift\nnonisolated init(prompt: Text? = nil, @ViewBuilder label: () -> Label, onSubmit: @escaping (String) -> Void)\n```\n\n## Parameters\n\n- **prompt**: Text which describes the reason for requesting text input.\n- **label**: A view that describes the action of requesting text input.\n- **onSubmit**: An action to perform when text input has been accepted and dismissed\n\n## Creating a text field link\n\n- **init(_:prompt:onSubmit:)**: Creates a TextFieldLink which when pressed will request text input from the user.\n\n",
  "sections" : [
    {
      "content" : "",
      "items" : [
        {
          "description" : "Creates a TextFieldLink which when pressed will request text input from the user.",
          "name" : "init(_:prompt:onSubmit:)",
          "url" : "https:\/\/developer.apple.com\/documentation\/SwiftUI\/TextFieldLink\/init(_:prompt:onSubmit:)"
        }
      ],
      "title" : "Creating a text field link"
    }
  ],
  "source" : "appleJSON",
  "title" : "init(prompt:label:onSubmit:)",
  "url" : "https:\/\/developer.apple.com\/documentation\/SwiftUI\/TextFieldLink\/init(prompt:label:onSubmit:)"
}