{
  "abstract" : "Tracks Digital Crown rotations by updating the specified binding.",
  "codeExamples" : [
    {
      "code" : "struct DigitalCrown: View {\n    @State private var crownValue = 0.0\n\n    var body: some View {\n        Text(\"Received Value:\\(crownValue, specifier: \"%.1f\")\")\n            .focusable()\n            .digitalCrownRotation($crownValue)\n    }\n}",
      "language" : "swift"
    }
  ],
  "contentHash" : "3286121ea3a5d6587428cd6fe420cf6ee990b08fa121e3ac058c06b62314e41f",
  "crawledAt" : "2025-12-02T17:23:46Z",
  "declaration" : {
    "code" : "nonisolated func digitalCrownRotation<V>(_ binding: Binding<V>) -> some View where V : BinaryFloatingPoint\n",
    "language" : "swift"
  },
  "id" : "272DDCFD-65BB-49F7-84E7-CD3C89893734",
  "kind" : "method",
  "language" : "swift",
  "module" : "SwiftUI",
  "overview" : "## Discussion\n\nUse this method to receive values on a binding you provide as the user turns the Digital Crown on Apple Watch. The example below receives changes to the binding value, starting at `0.0` and incrementing or decrementing depending on the direction that the user turns the Digital Crown:\n\n",
  "platforms" : [
    "watchOS"
  ],
  "rawMarkdown" : "---\nsource: https:\/\/developer.apple.com\/documentation\/SwiftUI\/View\/digitalCrownRotation(_:)\ncrawled: 2025-12-02T17:23:46Z\n---\n\n# digitalCrownRotation(_:)\n\n**Instance Method**\n\nTracks Digital Crown rotations by updating the specified binding.\n\n## Declaration\n\n```swift\nnonisolated func digitalCrownRotation<V>(_ binding: Binding<V>) -> some View where V : BinaryFloatingPoint\n\n```\n\n## Parameters\n\n- **binding**: A binding to a value that updates as the user rotates the Digital Crown. The implicit range is `(-infinity, +infinity)`.\n\n## Discussion\n\nUse this method to receive values on a binding you provide as the user turns the Digital Crown on Apple Watch. The example below receives changes to the binding value, starting at `0.0` and incrementing or decrementing depending on the direction that the user turns the Digital Crown:\n\n```swift\nstruct DigitalCrown: View {\n    @State private var crownValue = 0.0\n\n    var body: some View {\n        Text(\"Received Value:\\(crownValue, specifier: \"%.1f\")\")\n            .focusable()\n            .digitalCrownRotation($crownValue)\n    }\n}\n```\n\n\n\n## Interacting with the Digital Crown\n\n- **digitalCrownAccessory(_:)**: Specifies the visibility of Digital Crown accessory Views on Apple Watch.\n- **digitalCrownAccessory(content:)**: Places an accessory View next to the Digital Crown on Apple Watch.\n- **digitalCrownRotation(_:from:through:sensitivity:isContinuous:isHapticFeedbackEnabled:onChange:onIdle:)**: Tracks Digital Crown rotations by updating the specified binding.\n- **digitalCrownRotation(_:onChange:onIdle:)**: Tracks Digital Crown rotations by updating the specified binding.\n- **digitalCrownRotation(detent:from:through:by:sensitivity:isContinuous:isHapticFeedbackEnabled:onChange:onIdle:)**: Tracks Digital Crown rotations by updating the specified binding.\n- **digitalCrownRotation(_:from:through:by:sensitivity:isContinuous:isHapticFeedbackEnabled:)**: Tracks Digital Crown rotations by updating the specified binding.\n- **DigitalCrownEvent**: An event emitted when the user rotates the Digital Crown.\n- **DigitalCrownRotationalSensitivity**: The amount of Digital Crown rotation needed to move between two integer numbers.\n\n",
  "sections" : [
    {
      "content" : "",
      "items" : [
        {
          "description" : "Specifies the visibility of Digital Crown accessory Views on Apple Watch.",
          "name" : "digitalCrownAccessory(_:)",
          "url" : "https:\/\/developer.apple.com\/documentation\/SwiftUI\/View\/digitalCrownAccessory(_:)"
        },
        {
          "description" : "Places an accessory View next to the Digital Crown on Apple Watch.",
          "name" : "digitalCrownAccessory(content:)",
          "url" : "https:\/\/developer.apple.com\/documentation\/SwiftUI\/View\/digitalCrownAccessory(content:)"
        },
        {
          "description" : "Tracks Digital Crown rotations by updating the specified binding.",
          "name" : "digitalCrownRotation(_:from:through:sensitivity:isContinuous:isHapticFeedbackEnabled:onChange:onIdle:)",
          "url" : "https:\/\/developer.apple.com\/documentation\/SwiftUI\/View\/digitalCrownRotation(_:from:through:sensitivity:isContinuous:isHapticFeedbackEnabled:onChange:onIdle:)"
        },
        {
          "description" : "Tracks Digital Crown rotations by updating the specified binding.",
          "name" : "digitalCrownRotation(_:onChange:onIdle:)",
          "url" : "https:\/\/developer.apple.com\/documentation\/SwiftUI\/View\/digitalCrownRotation(_:onChange:onIdle:)"
        },
        {
          "description" : "Tracks Digital Crown rotations by updating the specified binding.",
          "name" : "digitalCrownRotation(detent:from:through:by:sensitivity:isContinuous:isHapticFeedbackEnabled:onChange:onIdle:)",
          "url" : "https:\/\/developer.apple.com\/documentation\/SwiftUI\/View\/digitalCrownRotation(detent:from:through:by:sensitivity:isContinuous:isHapticFeedbackEnabled:onChange:onIdle:)"
        },
        {
          "description" : "Tracks Digital Crown rotations by updating the specified binding.",
          "name" : "digitalCrownRotation(_:from:through:by:sensitivity:isContinuous:isHapticFeedbackEnabled:)",
          "url" : "https:\/\/developer.apple.com\/documentation\/SwiftUI\/View\/digitalCrownRotation(_:from:through:by:sensitivity:isContinuous:isHapticFeedbackEnabled:)"
        },
        {
          "description" : "An event emitted when the user rotates the Digital Crown.",
          "name" : "DigitalCrownEvent",
          "url" : "https:\/\/developer.apple.com\/documentation\/SwiftUI\/DigitalCrownEvent"
        },
        {
          "description" : "The amount of Digital Crown rotation needed to move between two integer numbers.",
          "name" : "DigitalCrownRotationalSensitivity",
          "url" : "https:\/\/developer.apple.com\/documentation\/SwiftUI\/DigitalCrownRotationalSensitivity"
        }
      ],
      "title" : "Interacting with the Digital Crown"
    }
  ],
  "source" : "appleJSON",
  "title" : "digitalCrownRotation(_:)",
  "url" : "https:\/\/developer.apple.com\/documentation\/SwiftUI\/View\/digitalCrownRotation(_:)"
}