{
  "abstract" : "A toggle style that displays a checkbox followed by its label.",
  "codeExamples" : [
    {
      "code" : "Toggle(\"Close windows when quitting an app\", isOn: $doesClose)\n    .toggleStyle(.checkbox)",
      "language" : "swift"
    }
  ],
  "contentHash" : "b3f57eee2a5511c2e4c530a96cbb7542dd812c1b099b0e2e6095c4182730f83a",
  "crawledAt" : "2025-12-03T05:50:48Z",
  "declaration" : {
    "code" : "@MainActor @preconcurrency static var checkbox: CheckboxToggleStyle { get }",
    "language" : "swift"
  },
  "id" : "4E4ED6CC-F4E2-44F8-BA0B-1141239DEAEE",
  "kind" : "property",
  "language" : "swift",
  "module" : "SwiftUI",
  "overview" : "## Discussion\n\nApply this style to a [doc:\/\/com.apple.SwiftUI\/documentation\/SwiftUI\/Toggle] or to a view hierarchy that contains toggles using the [doc:\/\/com.apple.SwiftUI\/documentation\/SwiftUI\/View\/toggleStyle(_:)] modifier:\n\nThe style produces a label that describes the purpose of the toggle and a checkbox that shows the toggle’s state. To change the toggle’s state, the user clicks the checkbox or its label:\n\n\n\nThe style aligns the trailing edge of the checkbox with the leading edge of the label, and takes as much horizontal space as it needs to fit the label, up to the amount offered by the toggle’s parent view.\n\nThis is the default style in macOS in most contexts when you don’t set a style, or when you apply the [doc:\/\/com.apple.SwiftUI\/documentation\/SwiftUI\/ToggleStyle\/automatic] style. A [doc:\/\/com.apple.SwiftUI\/documentation\/SwiftUI\/Form] is a convenient way to present a collection of checkboxes with proper spacing and alignment. For guidance on using checkboxes in your user interface, see [doc:\/\/com.apple.documentation\/design\/Human-Interface-Guidelines\/toggles#Checkboxes] in the Human Interface Guidelines.",
  "platforms" : [
    "macOS"
  ],
  "rawMarkdown" : "---\nsource: https:\/\/developer.apple.com\/documentation\/SwiftUI\/ToggleStyle\/checkbox\ncrawled: 2025-12-03T05:50:48Z\n---\n\n# checkbox\n\n**Type Property**\n\nA toggle style that displays a checkbox followed by its label.\n\n## Declaration\n\n```swift\n@MainActor @preconcurrency static var checkbox: CheckboxToggleStyle { get }\n```\n\n## Discussion\n\nApply this style to a [doc:\/\/com.apple.SwiftUI\/documentation\/SwiftUI\/Toggle] or to a view hierarchy that contains toggles using the [doc:\/\/com.apple.SwiftUI\/documentation\/SwiftUI\/View\/toggleStyle(_:)] modifier:\n\n```swift\nToggle(\"Close windows when quitting an app\", isOn: $doesClose)\n    .toggleStyle(.checkbox)\n```\n\nThe style produces a label that describes the purpose of the toggle and a checkbox that shows the toggle’s state. To change the toggle’s state, the user clicks the checkbox or its label:\n\n\n\nThe style aligns the trailing edge of the checkbox with the leading edge of the label, and takes as much horizontal space as it needs to fit the label, up to the amount offered by the toggle’s parent view.\n\nThis is the default style in macOS in most contexts when you don’t set a style, or when you apply the [doc:\/\/com.apple.SwiftUI\/documentation\/SwiftUI\/ToggleStyle\/automatic] style. A [doc:\/\/com.apple.SwiftUI\/documentation\/SwiftUI\/Form] is a convenient way to present a collection of checkboxes with proper spacing and alignment. For guidance on using checkboxes in your user interface, see [doc:\/\/com.apple.documentation\/design\/Human-Interface-Guidelines\/toggles#Checkboxes] in the Human Interface Guidelines.\n\n## Getting built-in toggle styles\n\n- **automatic**: The default toggle style.\n- **button**: A toggle style that displays as a button with its label as the title.\n- **switch**: A toggle style that displays a leading label and a trailing switch.\n\n",
  "sections" : [
    {
      "content" : "",
      "items" : [
        {
          "description" : "The default toggle style.",
          "name" : "automatic",
          "url" : "https:\/\/developer.apple.com\/documentation\/SwiftUI\/ToggleStyle\/automatic"
        },
        {
          "description" : "A toggle style that displays as a button with its label as the title.",
          "name" : "button",
          "url" : "https:\/\/developer.apple.com\/documentation\/SwiftUI\/ToggleStyle\/button"
        },
        {
          "description" : "A toggle style that displays a leading label and a trailing switch.",
          "name" : "switch",
          "url" : "https:\/\/developer.apple.com\/documentation\/SwiftUI\/ToggleStyle\/switch"
        }
      ],
      "title" : "Getting built-in toggle styles"
    }
  ],
  "source" : "appleJSON",
  "title" : "checkbox",
  "url" : "https:\/\/developer.apple.com\/documentation\/SwiftUI\/ToggleStyle\/checkbox"
}