{
  "abstract" : "Sets a fixed tint color for content in a list.",
  "codeExamples" : [

  ],
  "contentHash" : "3b4677a142f61ef85adb3bb7b3d7fb040584bac8703ba9dccd70c07b19e7f612",
  "crawledAt" : "2025-12-02T17:20:56Z",
  "declaration" : {
    "code" : "nonisolated func listItemTint(_ tint: Color?) -> some View\n",
    "language" : "swift"
  },
  "id" : "DDE88487-53D0-4587-B246-D2FAD56288C5",
  "kind" : "method",
  "language" : "swift",
  "module" : "SwiftUI",
  "overview" : "## Discussion\n\nThe containing list’s style applies the tint as appropriate. For example, watchOS uses the tint color for its background platter appearance. Sidebars on iOS and macOS apply the tint color to their [doc:\/\/com.apple.SwiftUI\/documentation\/SwiftUI\/Label] icons, which otherwise use the accent color by default.",
  "platforms" : [
    "iOS",
    "iPadOS",
    "Mac Catalyst",
    "macOS",
    "tvOS",
    "visionOS",
    "watchOS"
  ],
  "rawMarkdown" : "---\nsource: https:\/\/developer.apple.com\/documentation\/SwiftUI\/View\/listItemTint(_:)\ncrawled: 2025-12-02T17:20:56Z\n---\n\n# listItemTint(_:)\n\n**Instance Method**\n\nSets a fixed tint color for content in a list.\n\n## Declaration\n\n```swift\nnonisolated func listItemTint(_ tint: Color?) -> some View\n\n```\n\n## Parameters\n\n- **tint**: The color to use to tint the content. Use `nil` to avoid overriding the inherited tint.\n\n## Discussion\n\nThe containing list’s style applies the tint as appropriate. For example, watchOS uses the tint color for its background platter appearance. Sidebars on iOS and macOS apply the tint color to their [doc:\/\/com.apple.SwiftUI\/documentation\/SwiftUI\/Label] icons, which otherwise use the accent color by default.\n\n\n\n## Configuring rows\n\n- **ListItemTint**: A tint effect configuration that you can apply to content in a list.\n\n",
  "sections" : [
    {
      "content" : "",
      "items" : [
        {
          "description" : "A tint effect configuration that you can apply to content in a list.",
          "name" : "ListItemTint",
          "url" : "https:\/\/developer.apple.com\/documentation\/SwiftUI\/ListItemTint"
        }
      ],
      "title" : "Configuring rows"
    }
  ],
  "source" : "appleJSON",
  "title" : "listItemTint(_:)",
  "url" : "https:\/\/developer.apple.com\/documentation\/SwiftUI\/View\/listItemTint(_:)"
}