{
  "abstract" : "Sets a user-visible string that identifies the view’s functionality.",
  "codeExamples" : [
    {
      "code" : "TextField(\"TouchBar Demo\", text: $placeholder)\n    .frame(maxWidth: .infinity, maxHeight: .infinity)\n    .focusable()\n    .touchBar {\n        Button(\"♥️\", action: selectHearts)\n            .touchBarCustomizationLabel(Text(\"Hearts\"))\n        Button(\"♣️\", action: selectClubs)\n            .touchBarCustomizationLabel(Text(\"Clubs\"))\n        Button(\"♠️\", action: selectSpades)\n            .touchBarCustomizationLabel(Text(\"Spades\"))\n        Button(\"♦️\", action: selectDiamonds)\n            .touchBarCustomizationLabel(Text(\"Diamonds\"))\n    }",
      "language" : "swift"
    }
  ],
  "contentHash" : "74c7ed16d17e9e509bdb81eb8389e808029b520bc62e965a4efc6d1dd74cda0a",
  "crawledAt" : "2025-11-30T21:27:33Z",
  "declaration" : {
    "code" : "nonisolated func touchBarCustomizationLabel(_ label: Text) -> some View\n",
    "language" : "swift"
  },
  "id" : "B28CA988-591C-443D-B76F-56692775C6E2",
  "kind" : "method",
  "module" : "SwiftUI",
  "overview" : "## Return Value\n\nA Touch Bar element with a set customization label.\n\n## Discussion\n\nThis string is visible during user customization.\n\n",
  "platforms" : [
    "macOS"
  ],
  "rawMarkdown" : "---\nsource: https:\/\/developer.apple.com\/documentation\/SwiftUI\/View\/touchBarCustomizationLabel(_:)\ncrawled: 2025-11-30T21:27:33Z\n---\n\n# touchBarCustomizationLabel(_:)\n\n**Instance Method**\n\nSets a user-visible string that identifies the view’s functionality.\n\n## Declaration\n\n```swift\nnonisolated func touchBarCustomizationLabel(_ label: Text) -> some View\n\n```\n\n## Parameters\n\n- **label**: A `Text` view containing the customization label.\n\n## Return Value\n\nA Touch Bar element with a set customization label.\n\n## Discussion\n\nThis string is visible during user customization.\n\n```swift\nTextField(\"TouchBar Demo\", text: $placeholder)\n    .frame(maxWidth: .infinity, maxHeight: .infinity)\n    .focusable()\n    .touchBar {\n        Button(\"♥️\", action: selectHearts)\n            .touchBarCustomizationLabel(Text(\"Hearts\"))\n        Button(\"♣️\", action: selectClubs)\n            .touchBarCustomizationLabel(Text(\"Clubs\"))\n        Button(\"♠️\", action: selectSpades)\n            .touchBarCustomizationLabel(Text(\"Spades\"))\n        Button(\"♦️\", action: selectDiamonds)\n            .touchBarCustomizationLabel(Text(\"Diamonds\"))\n    }\n```\n\n\n\n## Managing Touch Bar input\n\n- **touchBar(content:)**: Sets the content that the Touch Bar displays.\n- **touchBar(_:)**: Sets the Touch Bar content to be shown in the Touch Bar when applicable.\n- **touchBarItemPrincipal(_:)**: Sets principal views that have special significance to this Touch Bar.\n- **touchBarItemPresence(_:)**: Sets the behavior of the user-customized view.\n- **TouchBar**: A container for a view that you can show in the Touch Bar.\n- **TouchBarItemPresence**: Options that affect user customization of the Touch Bar.\n\n",
  "sections" : [
    {
      "content" : "",
      "items" : [
        {
          "description" : "Sets the content that the Touch Bar displays.",
          "name" : "touchBar(content:)",
          "url" : "https:\/\/developer.apple.com\/documentation\/SwiftUI\/View\/touchBar(content:)"
        },
        {
          "description" : "Sets the Touch Bar content to be shown in the Touch Bar when applicable.",
          "name" : "touchBar(_:)",
          "url" : "https:\/\/developer.apple.com\/documentation\/SwiftUI\/View\/touchBar(_:)"
        },
        {
          "description" : "Sets principal views that have special significance to this Touch Bar.",
          "name" : "touchBarItemPrincipal(_:)",
          "url" : "https:\/\/developer.apple.com\/documentation\/SwiftUI\/View\/touchBarItemPrincipal(_:)"
        },
        {
          "description" : "Sets the behavior of the user-customized view.",
          "name" : "touchBarItemPresence(_:)",
          "url" : "https:\/\/developer.apple.com\/documentation\/SwiftUI\/View\/touchBarItemPresence(_:)"
        },
        {
          "description" : "A container for a view that you can show in the Touch Bar.",
          "name" : "TouchBar",
          "url" : "https:\/\/developer.apple.com\/documentation\/SwiftUI\/TouchBar"
        },
        {
          "description" : "Options that affect user customization of the Touch Bar.",
          "name" : "TouchBarItemPresence",
          "url" : "https:\/\/developer.apple.com\/documentation\/SwiftUI\/TouchBarItemPresence"
        }
      ],
      "title" : "Managing Touch Bar input"
    }
  ],
  "source" : "appleJSON",
  "title" : "touchBarCustomizationLabel(_:)",
  "url" : "https:\/\/developer.apple.com\/documentation\/SwiftUI\/View\/touchBarCustomizationLabel(_:)"
}