{
  "abstract" : "A control into which people securely enter private text.",
  "codeExamples" : [
    {
      "code" : "@State private var username: String = \"\"\n@State private var password: String = \"\"\n\nvar body: some View {\n    VStack {\n        TextField(\"Username\", text: $username)\n            .autocorrectionDisabled(true)\n            #if !os(macOS)\n            .textInputAutocapitalization(.never)\n            #endif\n\n        SecureField(\"Password\", text: $password)\n            .onSubmit {\n                handleLogin(username: username, password: password)\n            }\n    }\n    .textFieldStyle(.roundedBorder)\n}",
      "language" : "swift"
    },
    {
      "code" : "Form {\n    TextField(text: $username, prompt: Text(\"Required\")) {\n        Text(\"Username\")\n    }\n    .autocorrectionDisabled(true)\n    #if !os(macOS)\n    .textInputAutocapitalization(.never)\n    #endif\n\n    SecureField(text: $password, prompt: Text(\"Required\")) {\n        Text(\"Password\")\n    }\n}",
      "language" : "swift"
    }
  ],
  "conformsTo" : [
    "View"
  ],
  "contentHash" : "bf14f6eee75e88c78c3f25aac9a931dac1875560d2bf6df1c7d7f503ae601352",
  "crawledAt" : "2025-12-02T15:44:56Z",
  "declaration" : {
    "code" : "struct SecureField<Label> where Label : View",
    "language" : "swift"
  },
  "id" : "0E15C4C3-7399-417C-9493-26587E4330BD",
  "kind" : "struct",
  "language" : "swift",
  "module" : "SwiftUI",
  "overview" : "## Overview\n\nUse a secure field when you want the behavior of a [doc:\/\/com.apple.SwiftUI\/documentation\/SwiftUI\/TextField], but you want to hide the field’s text. Typically, you use this for entering passwords and other sensitive information, as the second field in the following screenshot demonstrates:\n\nThe field:\n\n### Bind to a string\n\nA secure field binds to a string value and updates the string on every keystroke or other edit, so you can read its value at any time from elsewhere in your code. The following code shows how to create the above interface, with the secure field bound to a `password` string:\n\nThe field in the above example has an [doc:\/\/com.apple.SwiftUI\/documentation\/SwiftUI\/View\/onSubmit(of:_:)] modifier that sends the `username` and `password` strings to a custom `handleLogin(username:password:)` method if someone presses the Return key while the secure field has focus. You can alternatively provide another mechanism — like a button — to do the same thing.\n\n### Guide people with a prompt\n\nIn addition to the string or view that you provide as a label, you can also provide a [doc:\/\/com.apple.SwiftUI\/documentation\/SwiftUI\/Text] view prompt to help guide someone who uses the field, as the following [doc:\/\/com.apple.SwiftUI\/documentation\/SwiftUI\/Form] does:\n\nThe system uses the label and prompt in different ways depending on the context. For example, a form in macOS places the label against the leading edge of the field and uses the prompt as placeholder text inside the field. The same form in iOS also uses the prompt as placeholder text, but doesn’t display the label:\n\nIf you remove the prompt from the previous example, the field keeps the label on the leading edge and omits the placeholder text in macOS, but displays the label as a placeholder in iOS:",
  "platforms" : [
    "iOS",
    "iPadOS",
    "Mac Catalyst",
    "macOS",
    "tvOS",
    "visionOS",
    "watchOS"
  ],
  "rawMarkdown" : "---\nsource: https:\/\/developer.apple.com\/documentation\/SwiftUI\/SecureField\ncrawled: 2025-12-02T15:44:56Z\n---\n\n# SecureField\n\n**Structure**\n\nA control into which people securely enter private text.\n\n## Declaration\n\n```swift\nstruct SecureField<Label> where Label : View\n```\n\n## Overview\n\nUse a secure field when you want the behavior of a [doc:\/\/com.apple.SwiftUI\/documentation\/SwiftUI\/TextField], but you want to hide the field’s text. Typically, you use this for entering passwords and other sensitive information, as the second field in the following screenshot demonstrates:\n\n\n\nThe field:\n\n- Displays one dot for each character someone types.\n- Hides the dots when someone takes a screenshot in iOS.\n- Prevents anyone from cutting or copying the field’s contents.\n- Displays an indicator when Caps Lock is enabled.\n\n### Bind to a string\n\nA secure field binds to a string value and updates the string on every keystroke or other edit, so you can read its value at any time from elsewhere in your code. The following code shows how to create the above interface, with the secure field bound to a `password` string:\n\n```swift\n@State private var username: String = \"\"\n@State private var password: String = \"\"\n\nvar body: some View {\n    VStack {\n        TextField(\"Username\", text: $username)\n            .autocorrectionDisabled(true)\n            #if !os(macOS)\n            .textInputAutocapitalization(.never)\n            #endif\n\n        SecureField(\"Password\", text: $password)\n            .onSubmit {\n                handleLogin(username: username, password: password)\n            }\n    }\n    .textFieldStyle(.roundedBorder)\n}\n```\n\nThe field in the above example has an [doc:\/\/com.apple.SwiftUI\/documentation\/SwiftUI\/View\/onSubmit(of:_:)] modifier that sends the `username` and `password` strings to a custom `handleLogin(username:password:)` method if someone presses the Return key while the secure field has focus. You can alternatively provide another mechanism — like a button — to do the same thing.\n\n### Guide people with a prompt\n\nIn addition to the string or view that you provide as a label, you can also provide a [doc:\/\/com.apple.SwiftUI\/documentation\/SwiftUI\/Text] view prompt to help guide someone who uses the field, as the following [doc:\/\/com.apple.SwiftUI\/documentation\/SwiftUI\/Form] does:\n\n```swift\nForm {\n    TextField(text: $username, prompt: Text(\"Required\")) {\n        Text(\"Username\")\n    }\n    .autocorrectionDisabled(true)\n    #if !os(macOS)\n    .textInputAutocapitalization(.never)\n    #endif\n\n    SecureField(text: $password, prompt: Text(\"Required\")) {\n        Text(\"Password\")\n    }\n}\n```\n\nThe system uses the label and prompt in different ways depending on the context. For example, a form in macOS places the label against the leading edge of the field and uses the prompt as placeholder text inside the field. The same form in iOS also uses the prompt as placeholder text, but doesn’t display the label:\n\n\n\nIf you remove the prompt from the previous example, the field keeps the label on the leading edge and omits the placeholder text in macOS, but displays the label as a placeholder in iOS:\n\n\n\n## Creating a secure text field\n\n- **init(_:text:)**: Creates a secure field with a prompt generated from a `Text`.\n- **init(_:text:prompt:)**: Creates a secure field with a prompt generated from a `Text`.\n- **init(text:prompt:label:)**: Creates a secure field with a prompt generated from a `Text`.\n\n## Deprecated initializers\n\n- **init(_:text:onCommit:)**: Creates an instance.\n\n## Getting text input\n\n- **Building rich SwiftUI text experiences**: Build an editor for formatted text using SwiftUI text editor views and attributed strings.\n- **TextField**: A control that displays an editable text interface.\n- **textFieldStyle(_:)**: Sets the style for text fields within this view.\n- **TextEditor**: A view that can display and edit long-form text.\n\n## Conforms To\n\n- View\n\n",
  "sections" : [
    {
      "content" : "",
      "items" : [
        {
          "description" : "Creates a secure field with a prompt generated from a `Text`.",
          "name" : "init(_:text:)",
          "url" : "https:\/\/developer.apple.com\/documentation\/SwiftUI\/SecureField\/init(_:text:)"
        },
        {
          "description" : "Creates a secure field with a prompt generated from a `Text`.",
          "name" : "init(_:text:prompt:)",
          "url" : "https:\/\/developer.apple.com\/documentation\/SwiftUI\/SecureField\/init(_:text:prompt:)"
        },
        {
          "description" : "Creates a secure field with a prompt generated from a `Text`.",
          "name" : "init(text:prompt:label:)",
          "url" : "https:\/\/developer.apple.com\/documentation\/SwiftUI\/SecureField\/init(text:prompt:label:)"
        }
      ],
      "title" : "Creating a secure text field"
    },
    {
      "content" : "",
      "items" : [
        {
          "description" : "Creates an instance.",
          "name" : "init(_:text:onCommit:)",
          "url" : "https:\/\/developer.apple.com\/documentation\/SwiftUI\/SecureField\/init(_:text:onCommit:)"
        }
      ],
      "title" : "Deprecated initializers"
    },
    {
      "content" : "",
      "items" : [
        {
          "description" : "Build an editor for formatted text using SwiftUI text editor views and attributed strings.",
          "name" : "Building rich SwiftUI text experiences",
          "url" : "https:\/\/developer.apple.com\/documentation\/SwiftUI\/building-rich-swiftui-text-experiences"
        },
        {
          "description" : "A control that displays an editable text interface.",
          "name" : "TextField",
          "url" : "https:\/\/developer.apple.com\/documentation\/SwiftUI\/TextField"
        },
        {
          "description" : "Sets the style for text fields within this view.",
          "name" : "textFieldStyle(_:)",
          "url" : "https:\/\/developer.apple.com\/documentation\/SwiftUI\/View\/textFieldStyle(_:)"
        },
        {
          "description" : "A view that can display and edit long-form text.",
          "name" : "TextEditor",
          "url" : "https:\/\/developer.apple.com\/documentation\/SwiftUI\/TextEditor"
        }
      ],
      "title" : "Getting text input"
    }
  ],
  "source" : "appleJSON",
  "title" : "SecureField",
  "url" : "https:\/\/developer.apple.com\/documentation\/SwiftUI\/SecureField"
}