{
  "abstract" : "A property wrapper type for an observable object that a parent or ancestor view supplies.",
  "codeExamples" : [

  ],
  "conformsTo" : [
    "DynamicProperty",
    "Sendable",
    "SendableMetatype"
  ],
  "contentHash" : "3be886135d20d637c64b85cb91bbf0a3ba9ccf3b542c55b64513e35a643a2ec7",
  "crawledAt" : "2025-12-02T17:13:38Z",
  "declaration" : {
    "code" : "@MainActor @frozen @propertyWrapper @preconcurrency struct EnvironmentObject<ObjectType> where ObjectType : ObservableObject",
    "language" : "swift"
  },
  "id" : "A2910B2A-BD37-4673-B13D-CCF4FD069CDE",
  "kind" : "struct",
  "language" : "swift",
  "module" : "SwiftUI",
  "overview" : "## Overview\n\nAn environment object invalidates the current view whenever the observable object that conforms to [doc:\/\/com.apple.documentation\/documentation\/Combine\/ObservableObject] changes. If you declare a property as an environment object, be sure to set a corresponding model object on an ancestor view by calling its [doc:\/\/com.apple.SwiftUI\/documentation\/SwiftUI\/View\/environmentObject(_:)] modifier.",
  "platforms" : [
    "iOS",
    "iPadOS",
    "Mac Catalyst",
    "macOS",
    "tvOS",
    "visionOS",
    "watchOS"
  ],
  "rawMarkdown" : "---\nsource: https:\/\/developer.apple.com\/documentation\/SwiftUI\/EnvironmentObject\ncrawled: 2025-12-02T17:13:38Z\n---\n\n# EnvironmentObject\n\n**Structure**\n\nA property wrapper type for an observable object that a parent or ancestor view supplies.\n\n## Declaration\n\n```swift\n@MainActor @frozen @propertyWrapper @preconcurrency struct EnvironmentObject<ObjectType> where ObjectType : ObservableObject\n```\n\n## Overview\n\nAn environment object invalidates the current view whenever the observable object that conforms to [doc:\/\/com.apple.documentation\/documentation\/Combine\/ObservableObject] changes. If you declare a property as an environment object, be sure to set a corresponding model object on an ancestor view by calling its [doc:\/\/com.apple.SwiftUI\/documentation\/SwiftUI\/View\/environmentObject(_:)] modifier.\n\n\n\n## Creating an environment object\n\n- **init()**: Creates an environment object.\n\n## Getting the value\n\n- **wrappedValue**: The underlying value referenced by the environment object.\n- **projectedValue**: A projection of the environment object that creates bindings to its properties using dynamic member lookup.\n- **EnvironmentObject.Wrapper**: A wrapper of the underlying environment object that can create bindings to its properties using dynamic member lookup.\n\n## Distributing model data throughout your app\n\n- **environmentObject(_:)**: Supplies an observable object to a view’s hierarchy.\n- **environmentObject(_:)**: Supplies an `ObservableObject` to a view subhierarchy.\n\n## Conforms To\n\n- DynamicProperty\n- Sendable\n- SendableMetatype\n\n",
  "sections" : [
    {
      "content" : "",
      "items" : [
        {
          "description" : "Creates an environment object.",
          "name" : "init()",
          "url" : "https:\/\/developer.apple.com\/documentation\/SwiftUI\/EnvironmentObject\/init()"
        }
      ],
      "title" : "Creating an environment object"
    },
    {
      "content" : "",
      "items" : [
        {
          "description" : "The underlying value referenced by the environment object.",
          "name" : "wrappedValue",
          "url" : "https:\/\/developer.apple.com\/documentation\/SwiftUI\/EnvironmentObject\/wrappedValue"
        },
        {
          "description" : "A projection of the environment object that creates bindings to its properties using dynamic member lookup.",
          "name" : "projectedValue",
          "url" : "https:\/\/developer.apple.com\/documentation\/SwiftUI\/EnvironmentObject\/projectedValue"
        },
        {
          "description" : "A wrapper of the underlying environment object that can create bindings to its properties using dynamic member lookup.",
          "name" : "EnvironmentObject.Wrapper",
          "url" : "https:\/\/developer.apple.com\/documentation\/SwiftUI\/EnvironmentObject\/Wrapper"
        }
      ],
      "title" : "Getting the value"
    },
    {
      "content" : "",
      "items" : [
        {
          "description" : "Supplies an observable object to a view’s hierarchy.",
          "name" : "environmentObject(_:)",
          "url" : "https:\/\/developer.apple.com\/documentation\/SwiftUI\/View\/environmentObject(_:)"
        },
        {
          "description" : "Supplies an `ObservableObject` to a view subhierarchy.",
          "name" : "environmentObject(_:)",
          "url" : "https:\/\/developer.apple.com\/documentation\/SwiftUI\/Scene\/environmentObject(_:)"
        }
      ],
      "title" : "Distributing model data throughout your app"
    }
  ],
  "source" : "appleJSON",
  "title" : "EnvironmentObject",
  "url" : "https:\/\/developer.apple.com\/documentation\/SwiftUI\/EnvironmentObject"
}