{
  "abstract" : "The unauthenticated information provided by the device before a person pairs it for the first time.",
  "codeExamples" : [

  ],
  "contentHash" : "f302f998b4c8b8af75c34aecc703813d9486fd1ee257a4db69e0cd84973caa38",
  "crawledAt" : "2025-12-02T05:52:08Z",
  "declaration" : {
    "code" : "let pairingInfo: WAPairedDevice.PairingInfo?",
    "language" : "swift"
  },
  "id" : "44944180-6741-4540-BF59-D32841E4FA78",
  "kind" : "property",
  "module" : "Wi-Fi Aware",
  "overview" : "## Discussion\n\nThe value is `nil` if the information is unavailable. The values provide a capture of what the system receives prior to the first pairing the device, and don’t reflect any information received post-pairing. If your app needs more up-to-date info, query the device via the secure Wi-Fi Aware data path.",
  "platforms" : [
    "iOS",
    "iPadOS"
  ],
  "rawMarkdown" : "---\nsource: https:\/\/developer.apple.com\/documentation\/WiFiAware\/WAPairedDevice\/pairingInfo-swift.property\ncrawled: 2025-12-02T05:52:08Z\n---\n\n# pairingInfo\n\n**Instance Property**\n\nThe unauthenticated information provided by the device before a person pairs it for the first time.\n\n## Declaration\n\n```swift\nlet pairingInfo: WAPairedDevice.PairingInfo?\n```\n\n## Discussion\n\nThe value is `nil` if the information is unavailable. The values provide a capture of what the system receives prior to the first pairing the device, and don’t reflect any information received post-pairing. If your app needs more up-to-date info, query the device via the secure Wi-Fi Aware data path.\n\n\n\n## Getting pairing-related device data\n\n- **WAPairedDevice.PairingInfo**: A collection of unauthenticated information the system receives from a device before it’s paired for the first time.\n\n",
  "sections" : [
    {
      "content" : "",
      "items" : [
        {
          "description" : "A collection of unauthenticated information the system receives from a device before it’s paired for the first time.",
          "name" : "WAPairedDevice.PairingInfo",
          "url" : "https:\/\/developer.apple.com\/documentation\/WiFiAware\/WAPairedDevice\/PairingInfo-swift.struct"
        }
      ],
      "title" : "Getting pairing-related device data"
    }
  ],
  "source" : "appleJSON",
  "title" : "pairingInfo",
  "url" : "https:\/\/developer.apple.com\/documentation\/WiFiAware\/WAPairedDevice\/pairingInfo-swift.property"
}