{
  "abstract" : "The structure that configures the Wi-Fi Aware subscriber operation the network browser performs.",
  "codeExamples" : [
    {
      "code" : "NetworkBrowser(for: .wifiAware( .connecting(to:.selected(devices),  from:service) ) )",
      "language" : "swift"
    }
  ],
  "conformsTo" : [
    "Sendable",
    "SendableMetatype"
  ],
  "contentHash" : "e8d2ca347099226174e0a11a899f1e190dc5963fdeddd303e66dba4a9f4e1d67",
  "crawledAt" : "2025-12-03T03:55:10Z",
  "declaration" : {
    "code" : "struct Action",
    "language" : "swift"
  },
  "id" : "4B61E273-F6BE-4B1D-96E0-26042049D088",
  "kind" : "struct",
  "language" : "swift",
  "module" : "Wi-Fi Aware",
  "overview" : "## Overview\n\nThe configuration includes the service and devices it operates on.\n\nThe [doc:\/\/com.apple.wifiaware\/documentation\/WiFiAware\/WASubscriberBrowser\/Action] is the first component of the `.wifiAware()` instruction to a `NetworkBrowser`.\n\nThe code below is an example of creating a `NetworkBrowser`:",
  "platforms" : [
    "iOS",
    "iPadOS"
  ],
  "rawMarkdown" : "---\nsource: https:\/\/developer.apple.com\/documentation\/WiFiAware\/WASubscriberBrowser\/Action\ncrawled: 2025-12-03T03:55:10Z\n---\n\n# WASubscriberBrowser.Action\n\n**Structure**\n\nThe structure that configures the Wi-Fi Aware subscriber operation the network browser performs.\n\n## Declaration\n\n```swift\nstruct Action\n```\n\n## Overview\n\nThe configuration includes the service and devices it operates on.\n\nThe [doc:\/\/com.apple.wifiaware\/documentation\/WiFiAware\/WASubscriberBrowser\/Action] is the first component of the `.wifiAware()` instruction to a `NetworkBrowser`.\n\nThe code below is an example of creating a `NetworkBrowser`:\n\n```swift\nNetworkBrowser(for: .wifiAware( .connecting(to:.selected(devices),  from:service) ) )\n```\n\n## Creating a browser\n\n- **connecting(to:from:)**: Subscribes to the provided service over Wi-Fi, providing browse results for connecting to the specified paired devices if available.\n\n## Subscriber\n\n- **WASubscriberBrowser**: The structure that configures a network browser to subscribe to a Wi-Fi Aware service and make outgoing connections to paired devices.\n- **WASubscriberBrowser.Devices**: The structure that determines the devices to connect to.\n\n## Conforms To\n\n- Sendable\n- SendableMetatype\n\n",
  "sections" : [
    {
      "content" : "",
      "items" : [
        {
          "description" : "Subscribes to the provided service over Wi-Fi, providing browse results for connecting to the specified paired devices if available.",
          "name" : "connecting(to:from:)",
          "url" : "https:\/\/developer.apple.com\/documentation\/WiFiAware\/WASubscriberBrowser\/Action\/connecting(to:from:)"
        }
      ],
      "title" : "Creating a browser"
    },
    {
      "content" : "",
      "items" : [
        {
          "description" : "The structure that configures a network browser to subscribe to a Wi-Fi Aware service and make outgoing connections to paired devices.",
          "name" : "WASubscriberBrowser",
          "url" : "https:\/\/developer.apple.com\/documentation\/WiFiAware\/WASubscriberBrowser"
        },
        {
          "description" : "The structure that determines the devices to connect to.",
          "name" : "WASubscriberBrowser.Devices",
          "url" : "https:\/\/developer.apple.com\/documentation\/WiFiAware\/WASubscriberBrowser\/Devices"
        }
      ],
      "title" : "Subscriber"
    }
  ],
  "source" : "appleJSON",
  "title" : "WASubscriberBrowser.Action",
  "url" : "https:\/\/developer.apple.com\/documentation\/WiFiAware\/WASubscriberBrowser\/Action"
}