{
  "abstract" : "Provides a snapshot of all the paired devices known to your app.",
  "codeExamples" : [
    {
      "code" : "let filter = #Predicate<WAPairedDevice> { $0.pairingInfo?.vendorName.starts(with: \"Example Inc\") ?? false }\n\n\/\/ Get a snapshot of all paired devices at the current moment.\nguard let devices = try await WAPairedDevice.allDevices(matching:filter).current() { return }\n\n\/\/ Get a snapshot of all paired devices at the current moment, and get a new snapshot each time a device is added, changed, or removed.\nfor try await devices in WAPairedDevice.allDevices(matching:filter) {\n\t\/\/ Process update.\n}",
      "language" : "swift"
    }
  ],
  "contentHash" : "5a755ec1a160b4219f4241ae9358ece8e3290d29a28b2bddb290e536eca0bbbc",
  "crawledAt" : "2025-12-04T00:49:44Z",
  "declaration" : {
    "code" : "static func allDevices(matching: Predicate<WAPairedDevice>) -> WAPairedDevice.DevicesSequence",
    "language" : "swift"
  },
  "id" : "1B341C68-0EB3-4696-A5EB-2059099B4425",
  "kind" : "method",
  "language" : "swift",
  "module" : "Wi-Fi Aware",
  "overview" : "## Return Value\n\nA new [doc:\/\/com.apple.wifiaware\/documentation\/WiFiAware\/WAPairedDevice\/DevicesSequence] that returns [doc:\/\/com.apple.wifiaware\/documentation\/WiFiAware\/WAPairedDevice\/Devices] elements holding a snapshot of the currently paired devices known to your app.\n\n## Discussion\n\nThis method gets an `AsyncSequence` that provides snapshots of all [doc:\/\/com.apple.wifiaware\/documentation\/WiFiAware\/WAPairedDevice\/Devices] currently paired and known to your app that match the provided predicate, and provides updates when the snapshot of [doc:\/\/com.apple.wifiaware\/documentation\/WiFiAware\/WAPairedDevice\/Devices] matching that predicate changes. The sequence outputs an empty dictionary if there are no paired devices matching the predicate that are known to your app, or if a person removes all of your app’s matching paired devices.\n\nYou can select the set of `Devices` matching a filter from this property using the code below:",
  "platforms" : [
    "iOS",
    "iPadOS",
    "Mac Catalyst"
  ],
  "rawMarkdown" : "---\nsource: https:\/\/developer.apple.com\/documentation\/WiFiAware\/WAPairedDevice\/allDevices(matching:)\ncrawled: 2025-12-04T00:49:44Z\n---\n\n# allDevices(matching:)\n\n**Type Method**\n\nProvides a snapshot of all the paired devices known to your app.\n\n## Declaration\n\n```swift\nstatic func allDevices(matching: Predicate<WAPairedDevice>) -> WAPairedDevice.DevicesSequence\n```\n\n## Parameters\n\n- **matching**: The predicate that filters the devices. The system only provides updates for devices matching this predicate.\n\n## Return Value\n\nA new [doc:\/\/com.apple.wifiaware\/documentation\/WiFiAware\/WAPairedDevice\/DevicesSequence] that returns [doc:\/\/com.apple.wifiaware\/documentation\/WiFiAware\/WAPairedDevice\/Devices] elements holding a snapshot of the currently paired devices known to your app.\n\n## Discussion\n\nThis method gets an `AsyncSequence` that provides snapshots of all [doc:\/\/com.apple.wifiaware\/documentation\/WiFiAware\/WAPairedDevice\/Devices] currently paired and known to your app that match the provided predicate, and provides updates when the snapshot of [doc:\/\/com.apple.wifiaware\/documentation\/WiFiAware\/WAPairedDevice\/Devices] matching that predicate changes. The sequence outputs an empty dictionary if there are no paired devices matching the predicate that are known to your app, or if a person removes all of your app’s matching paired devices.\n\nYou can select the set of `Devices` matching a filter from this property using the code below:\n\n```swift\nlet filter = #Predicate<WAPairedDevice> { $0.pairingInfo?.vendorName.starts(with: \"Example Inc\") ?? false }\n\n\/\/ Get a snapshot of all paired devices at the current moment.\nguard let devices = try await WAPairedDevice.allDevices(matching:filter).current() { return }\n\n\/\/ Get a snapshot of all paired devices at the current moment, and get a new snapshot each time a device is added, changed, or removed.\nfor try await devices in WAPairedDevice.allDevices(matching:filter) {\n\t\/\/ Process update.\n}\n```\n\n## Selecting from your app’s paired devices\n\n- **WAPairedDevice.Devices**: A dictionary holding a snapshot of currently paired devices accessible and known to your app.\n- **allDevices**: Provides a snapshot of all the paired devices known to your app.\n- **WAPairedDevice.DevicesSequence**: A sequence that vends updates to a paired device list, as the list changes.\n\n",
  "sections" : [
    {
      "content" : "",
      "items" : [
        {
          "description" : "A dictionary holding a snapshot of currently paired devices accessible and known to your app.",
          "name" : "WAPairedDevice.Devices",
          "url" : "https:\/\/developer.apple.com\/documentation\/WiFiAware\/WAPairedDevice\/Devices"
        },
        {
          "description" : "Provides a snapshot of all the paired devices known to your app.",
          "name" : "allDevices",
          "url" : "https:\/\/developer.apple.com\/documentation\/WiFiAware\/WAPairedDevice\/allDevices"
        },
        {
          "description" : "A sequence that vends updates to a paired device list, as the list changes.",
          "name" : "WAPairedDevice.DevicesSequence",
          "url" : "https:\/\/developer.apple.com\/documentation\/WiFiAware\/WAPairedDevice\/DevicesSequence"
        }
      ],
      "title" : "Selecting from your app’s paired devices"
    }
  ],
  "source" : "appleJSON",
  "title" : "allDevices(matching:)",
  "url" : "https:\/\/developer.apple.com\/documentation\/WiFiAware\/WAPairedDevice\/allDevices(matching:)"
}