{
  "abstract" : "The latitude, longitude, and course information reported by the system.",
  "codeExamples" : [

  ],
  "conformsTo" : [
    "CKRecordValue",
    "CKRecordValueProtocol",
    "CVarArg",
    "Copyable",
    "CustomDebugStringConvertible",
    "CustomStringConvertible",
    "Equatable",
    "Hashable",
    "NSCoding",
    "NSCopying",
    "NSObjectProtocol",
    "NSSecureCoding",
    "Sendable",
    "SendableMetatype"
  ],
  "contentHash" : "d9d5af6204ea87beaa6dcec131c983c9d8f8d3aa2b15f4046968e32c71967213",
  "crawledAt" : "2025-12-01T17:48:42Z",
  "declaration" : {
    "code" : "class CLLocation",
    "language" : "swift"
  },
  "id" : "A13A2A38-ADB9-4048-89F3-59C04C4D334D",
  "kind" : "class",
  "module" : "Core Location",
  "overview" : "## Overview\n\nA [doc:\/\/com.apple.corelocation\/documentation\/CoreLocation\/CLLocation] object contains the geographical location and altitude of a device, along with values indicating the accuracy of those measurements and when they were collected. In iOS, a location object also contains course information — that is, the speed and heading in which the device was moving.\n\nTypically, you don’t create location objects yourself. After you request location updates from your [doc:\/\/com.apple.corelocation\/documentation\/CoreLocation\/CLLocationManager] object, the system uses onboard sensors to gather location data and report that data to your app. Some services also return previously collected location data, which you can use as context to improve your services. You can always retrieve the most recently collected location from the [doc:\/\/com.apple.documentation\/documentation\/CoreLocation\/CLLocationManager\/location] property of your [doc:\/\/com.apple.corelocation\/documentation\/CoreLocation\/CLLocationManager] object. You may create location objects yourself when you want to cache custom location data or calculate the distance between two geographical coordinates.\n\nUse [doc:\/\/com.apple.corelocation\/documentation\/CoreLocation\/CLLocation] objects as-is, and don’t subclass them.",
  "platforms" : [
    "iOS",
    "iPadOS",
    "Mac Catalyst",
    "macOS",
    "tvOS",
    "visionOS",
    "watchOS"
  ],
  "rawMarkdown" : "---\nsource: https:\/\/developer.apple.com\/documentation\/corelocation\/cllocation\ncrawled: 2025-12-01T17:48:42Z\n---\n\n# CLLocation\n\n**Class**\n\nThe latitude, longitude, and course information reported by the system.\n\n## Declaration\n\n```swift\nclass CLLocation\n```\n\n## Overview\n\nA [doc:\/\/com.apple.corelocation\/documentation\/CoreLocation\/CLLocation] object contains the geographical location and altitude of a device, along with values indicating the accuracy of those measurements and when they were collected. In iOS, a location object also contains course information — that is, the speed and heading in which the device was moving.\n\nTypically, you don’t create location objects yourself. After you request location updates from your [doc:\/\/com.apple.corelocation\/documentation\/CoreLocation\/CLLocationManager] object, the system uses onboard sensors to gather location data and report that data to your app. Some services also return previously collected location data, which you can use as context to improve your services. You can always retrieve the most recently collected location from the [doc:\/\/com.apple.documentation\/documentation\/CoreLocation\/CLLocationManager\/location] property of your [doc:\/\/com.apple.corelocation\/documentation\/CoreLocation\/CLLocationManager] object. You may create location objects yourself when you want to cache custom location data or calculate the distance between two geographical coordinates.\n\nUse [doc:\/\/com.apple.corelocation\/documentation\/CoreLocation\/CLLocation] objects as-is, and don’t subclass them.\n\n## Creating a location object\n\n- **init(latitude:longitude:)**: Creates a location object with the specified latitude and longitude.\n- **init(coordinate:altitude:horizontalAccuracy:verticalAccuracy:timestamp:)**: Creates a location object with the specified coordinate and altitude information.\n- **init(coordinate:altitude:horizontalAccuracy:verticalAccuracy:course:speed:timestamp:)**: Creates a location object with the specified coordinate, altitude, and course information.\n- **init(coordinate:altitude:horizontalAccuracy:verticalAccuracy:course:courseAccuracy:speed:speedAccuracy:timestamp:)**: Creates a location object with the specified coordinate, altitude, course, and accuracy information.\n- **init(coordinate:altitude:horizontalAccuracy:verticalAccuracy:course:courseAccuracy:speed:speedAccuracy:timestamp:sourceInfo:)**\n\n## Getting the location attributes\n\n- **coordinate**: The geographical coordinate information.\n- **altitude**: The altitude above mean sea level associated with a location, measured in meters.\n- **ellipsoidalAltitude**: The altitude as a height above the World Geodetic System 1984 (WGS84) ellipsoid, measured in meters.\n- **CLLocationDistance**: A distance in meters from an existing location.\n- **floor**: The logical floor of the building in which the user is located.\n- **timestamp**: The time at which this location was determined.\n- **sourceInformation**: Information about the source that provides the location.\n\n## Getting the location accuracy\n\n- **horizontalAccuracy**: The radius of uncertainty for the location, measured in meters.\n- **verticalAccuracy**: The validity of the altitude values, and their estimated uncertainty, measured in meters.\n- **CLLocationAccuracy**: The accuracy of a geographical coordinate.\n\n## Measuring the distance between coordinates\n\n- **distance(from:)**: Returns the distance (measured in meters) from the current object’s location to the specified location.\n- **getDistanceFrom(_:)**: Returns the distance (measured in meters) from the current object’s location to the specified location.\n\n## Getting speed and course information\n\n- **speed**: The instantaneous speed of the device, measured in meters per second.\n- **speedAccuracy**: The accuracy of the speed value, measured in meters per second.\n- **course**: The direction in which the device is traveling, measured in degrees and relative to due north.\n- **courseAccuracy**: The accuracy of the course value, measured in degrees.\n- **CLLocationSpeed**: The velocity (measured in meters per second) at which the device is moving.\n- **CLLocationDirection**: An azimuth that is measured in degrees relative to true north.\n- **CLLocationSpeedAccuracy**: The accuracy of a speed.\n- **CLLocationDirectionAccuracy**: The accuracy of a compass heading.\n\n## Location updates\n\n- **Getting the current location of a device**: Start location services and provide information the system needs to optimize power usage for those services.\n- **Handling location updates in the background**: Configure your app to receive location updates when it isn’t running in the foreground.\n- **Creating a location push service extension**: Add and configure an extension to enable your location-sharing app to access a user’s location in response to a request from another user.\n- **CLLocationCoordinate2D**: The latitude and longitude associated with a location, specified using the WGS 84 reference frame.\n- **CLFloor**: The floor of a building on which the user’s device is located.\n- **CLVisit**: Information about the user’s location during a specific period of time.\n- **CLLocationSourceInformation**: Information about the source that provides a location.\n- **Monitoring location changes with Core Location**: Define boundaries and act on user location updates.\n- **CLServiceSession**\n\n## Inherits From\n\n- NSObject\n\n## Conforms To\n\n- CKRecordValue\n- CKRecordValueProtocol\n- CVarArg\n- Copyable\n- CustomDebugStringConvertible\n- CustomStringConvertible\n- Equatable\n- Hashable\n- NSCoding\n- NSCopying\n- NSObjectProtocol\n- NSSecureCoding\n- Sendable\n- SendableMetatype\n\n",
  "sections" : [
    {
      "content" : "",
      "items" : [
        {
          "description" : "Creates a location object with the specified latitude and longitude.",
          "name" : "init(latitude:longitude:)",
          "url" : "https:\/\/developer.apple.com\/documentation\/CoreLocation\/CLLocation\/init(latitude:longitude:)"
        },
        {
          "description" : "Creates a location object with the specified coordinate and altitude information.",
          "name" : "init(coordinate:altitude:horizontalAccuracy:verticalAccuracy:timestamp:)",
          "url" : "https:\/\/developer.apple.com\/documentation\/CoreLocation\/CLLocation\/init(coordinate:altitude:horizontalAccuracy:verticalAccuracy:timestamp:)"
        },
        {
          "description" : "Creates a location object with the specified coordinate, altitude, and course information.",
          "name" : "init(coordinate:altitude:horizontalAccuracy:verticalAccuracy:course:speed:timestamp:)",
          "url" : "https:\/\/developer.apple.com\/documentation\/CoreLocation\/CLLocation\/init(coordinate:altitude:horizontalAccuracy:verticalAccuracy:course:speed:timestamp:)"
        },
        {
          "description" : "Creates a location object with the specified coordinate, altitude, course, and accuracy information.",
          "name" : "init(coordinate:altitude:horizontalAccuracy:verticalAccuracy:course:courseAccuracy:speed:speedAccuracy:timestamp:)",
          "url" : "https:\/\/developer.apple.com\/documentation\/CoreLocation\/CLLocation\/init(coordinate:altitude:horizontalAccuracy:verticalAccuracy:course:courseAccuracy:speed:speedAccuracy:timestamp:)"
        },
        {
          "description" : "",
          "name" : "init(coordinate:altitude:horizontalAccuracy:verticalAccuracy:course:courseAccuracy:speed:speedAccuracy:timestamp:sourceInfo:)",
          "url" : "https:\/\/developer.apple.com\/documentation\/CoreLocation\/CLLocation\/init(coordinate:altitude:horizontalAccuracy:verticalAccuracy:course:courseAccuracy:speed:speedAccuracy:timestamp:sourceInfo:)"
        }
      ],
      "title" : "Creating a location object"
    },
    {
      "content" : "",
      "items" : [
        {
          "description" : "The geographical coordinate information.",
          "name" : "coordinate",
          "url" : "https:\/\/developer.apple.com\/documentation\/CoreLocation\/CLLocation\/coordinate"
        },
        {
          "description" : "The altitude above mean sea level associated with a location, measured in meters.",
          "name" : "altitude",
          "url" : "https:\/\/developer.apple.com\/documentation\/CoreLocation\/CLLocation\/altitude"
        },
        {
          "description" : "The altitude as a height above the World Geodetic System 1984 (WGS84) ellipsoid, measured in meters.",
          "name" : "ellipsoidalAltitude",
          "url" : "https:\/\/developer.apple.com\/documentation\/CoreLocation\/CLLocation\/ellipsoidalAltitude"
        },
        {
          "description" : "A distance in meters from an existing location.",
          "name" : "CLLocationDistance",
          "url" : "https:\/\/developer.apple.com\/documentation\/CoreLocation\/CLLocationDistance"
        },
        {
          "description" : "The logical floor of the building in which the user is located.",
          "name" : "floor",
          "url" : "https:\/\/developer.apple.com\/documentation\/CoreLocation\/CLLocation\/floor"
        },
        {
          "description" : "The time at which this location was determined.",
          "name" : "timestamp",
          "url" : "https:\/\/developer.apple.com\/documentation\/CoreLocation\/CLLocation\/timestamp"
        },
        {
          "description" : "Information about the source that provides the location.",
          "name" : "sourceInformation",
          "url" : "https:\/\/developer.apple.com\/documentation\/CoreLocation\/CLLocation\/sourceInformation"
        }
      ],
      "title" : "Getting the location attributes"
    },
    {
      "content" : "",
      "items" : [
        {
          "description" : "The radius of uncertainty for the location, measured in meters.",
          "name" : "horizontalAccuracy",
          "url" : "https:\/\/developer.apple.com\/documentation\/CoreLocation\/CLLocation\/horizontalAccuracy"
        },
        {
          "description" : "The validity of the altitude values, and their estimated uncertainty, measured in meters.",
          "name" : "verticalAccuracy",
          "url" : "https:\/\/developer.apple.com\/documentation\/CoreLocation\/CLLocation\/verticalAccuracy"
        },
        {
          "description" : "The accuracy of a geographical coordinate.",
          "name" : "CLLocationAccuracy",
          "url" : "https:\/\/developer.apple.com\/documentation\/CoreLocation\/CLLocationAccuracy"
        }
      ],
      "title" : "Getting the location accuracy"
    },
    {
      "content" : "",
      "items" : [
        {
          "description" : "Returns the distance (measured in meters) from the current object’s location to the specified location.",
          "name" : "distance(from:)",
          "url" : "https:\/\/developer.apple.com\/documentation\/CoreLocation\/CLLocation\/distance(from:)"
        },
        {
          "description" : "Returns the distance (measured in meters) from the current object’s location to the specified location.",
          "name" : "getDistanceFrom(_:)",
          "url" : "https:\/\/developer.apple.com\/documentation\/CoreLocation\/CLLocation\/getDistanceFrom(_:)"
        }
      ],
      "title" : "Measuring the distance between coordinates"
    },
    {
      "content" : "",
      "items" : [
        {
          "description" : "The instantaneous speed of the device, measured in meters per second.",
          "name" : "speed",
          "url" : "https:\/\/developer.apple.com\/documentation\/CoreLocation\/CLLocation\/speed"
        },
        {
          "description" : "The accuracy of the speed value, measured in meters per second.",
          "name" : "speedAccuracy",
          "url" : "https:\/\/developer.apple.com\/documentation\/CoreLocation\/CLLocation\/speedAccuracy"
        },
        {
          "description" : "The direction in which the device is traveling, measured in degrees and relative to due north.",
          "name" : "course",
          "url" : "https:\/\/developer.apple.com\/documentation\/CoreLocation\/CLLocation\/course"
        },
        {
          "description" : "The accuracy of the course value, measured in degrees.",
          "name" : "courseAccuracy",
          "url" : "https:\/\/developer.apple.com\/documentation\/CoreLocation\/CLLocation\/courseAccuracy"
        },
        {
          "description" : "The velocity (measured in meters per second) at which the device is moving.",
          "name" : "CLLocationSpeed",
          "url" : "https:\/\/developer.apple.com\/documentation\/CoreLocation\/CLLocationSpeed"
        },
        {
          "description" : "An azimuth that is measured in degrees relative to true north.",
          "name" : "CLLocationDirection",
          "url" : "https:\/\/developer.apple.com\/documentation\/CoreLocation\/CLLocationDirection"
        },
        {
          "description" : "The accuracy of a speed.",
          "name" : "CLLocationSpeedAccuracy",
          "url" : "https:\/\/developer.apple.com\/documentation\/CoreLocation\/CLLocationSpeedAccuracy"
        },
        {
          "description" : "The accuracy of a compass heading.",
          "name" : "CLLocationDirectionAccuracy",
          "url" : "https:\/\/developer.apple.com\/documentation\/CoreLocation\/CLLocationDirectionAccuracy"
        }
      ],
      "title" : "Getting speed and course information"
    },
    {
      "content" : "",
      "items" : [
        {
          "description" : "Start location services and provide information the system needs to optimize power usage for those services.",
          "name" : "Getting the current location of a device",
          "url" : "https:\/\/developer.apple.com\/documentation\/CoreLocation\/getting-the-current-location-of-a-device"
        },
        {
          "description" : "Configure your app to receive location updates when it isn’t running in the foreground.",
          "name" : "Handling location updates in the background",
          "url" : "https:\/\/developer.apple.com\/documentation\/CoreLocation\/handling-location-updates-in-the-background"
        },
        {
          "description" : "Add and configure an extension to enable your location-sharing app to access a user’s location in response to a request from another user.",
          "name" : "Creating a location push service extension",
          "url" : "https:\/\/developer.apple.com\/documentation\/CoreLocation\/creating-a-location-push-service-extension"
        },
        {
          "description" : "The latitude and longitude associated with a location, specified using the WGS 84 reference frame.",
          "name" : "CLLocationCoordinate2D",
          "url" : "https:\/\/developer.apple.com\/documentation\/CoreLocation\/CLLocationCoordinate2D"
        },
        {
          "description" : "The floor of a building on which the user’s device is located.",
          "name" : "CLFloor",
          "url" : "https:\/\/developer.apple.com\/documentation\/CoreLocation\/CLFloor"
        },
        {
          "description" : "Information about the user’s location during a specific period of time.",
          "name" : "CLVisit",
          "url" : "https:\/\/developer.apple.com\/documentation\/CoreLocation\/CLVisit"
        },
        {
          "description" : "Information about the source that provides a location.",
          "name" : "CLLocationSourceInformation",
          "url" : "https:\/\/developer.apple.com\/documentation\/CoreLocation\/CLLocationSourceInformation"
        },
        {
          "description" : "Define boundaries and act on user location updates.",
          "name" : "Monitoring location changes with Core Location",
          "url" : "https:\/\/developer.apple.com\/documentation\/CoreLocation\/monitoring-location-changes-with-core-location"
        },
        {
          "description" : "",
          "name" : "CLServiceSession",
          "url" : "https:\/\/developer.apple.com\/documentation\/CoreLocation\/CLServiceSession-pt7n"
        }
      ],
      "title" : "Location updates"
    },
    {
      "content" : "",
      "items" : [
        {
          "name" : "NSObject"
        }
      ],
      "title" : "Inherits From"
    }
  ],
  "source" : "appleJSON",
  "title" : "CLLocation",
  "url" : "https:\/\/developer.apple.com\/documentation\/corelocation\/cllocation"
}