{
  "abstract" : "A view that displays the sender who shares a highlight and provides related actions.",
  "codeExamples" : [

  ],
  "conformsTo" : [
    "CALayerDelegate",
    "CVarArg",
    "CustomDebugStringConvertible",
    "CustomStringConvertible",
    "Equatable",
    "Hashable",
    "NSAccessibilityElementProtocol",
    "NSAccessibilityProtocol",
    "NSAnimatablePropertyContainer",
    "NSAppearanceCustomization",
    "NSCoding",
    "NSDraggingDestination",
    "NSObjectProtocol",
    "NSStandardKeyBindingResponding",
    "NSTouchBarProvider",
    "NSUserActivityRestoring",
    "NSUserInterfaceItemIdentification",
    "Sendable",
    "SendableMetatype",
    "UIAccessibilityIdentification",
    "UIActivityItemsConfigurationProviding",
    "UIAppearance",
    "UIAppearanceContainer",
    "UICoordinateSpace",
    "UIDynamicItem",
    "UIFocusEnvironment",
    "UIFocusItem",
    "UIFocusItemContainer",
    "UILargeContentViewerItem",
    "UIPasteConfigurationSupporting",
    "UIPopoverPresentationControllerSourceItem",
    "UIResponderStandardEditActions",
    "UITraitChangeObservable",
    "UITraitEnvironment",
    "UIUserActivityRestoring"
  ],
  "contentHash" : "72abe4e055891a9b158db310ef6dc3220effb15eff0a724baca13af68280678c",
  "crawledAt" : "2025-12-05T15:17:32Z",
  "declaration" : {
    "code" : "@MainActor class SWAttributionView",
    "language" : "swift"
  },
  "id" : "0CE42201-BDC1-450E-BBDD-47B7733E8854",
  "kind" : "class",
  "language" : "swift",
  "module" : "Shared with You",
  "overview" : "## Overview\n\nThe `SWAttributionView` also allows users to get back to the conversation about the [doc:\/\/com.apple.sharedwithyou\/documentation\/SharedWithYou\/SWHighlight] content, and other related actions using a [doc:\/\/com.apple.sharedwithyou\/documentation\/SharedWithYou\/SWAttributionView\/highlightMenu].\n\nPlace an `SWAttributionView` next to the content represented by its `SWHighlight`. The `SWAttributionView` displays the names and avatars within the provided horizontal space.\n\nYou can constrain this view’s width anchor or set its frame width to control the maximum width of its contents after which truncation may occur. Don’t constrain the view’s height, as the height is dependent on the [doc:\/\/com.apple.documentation\/documentation\/UIKit\/UIApplication\/preferredContentSizeCategory], and the resulting font size. To provide enough vertical space around this view, reference its [doc:\/\/com.apple.documentation\/documentation\/UIKit\/UIView\/heightAnchor] when using Auto Layout, or its [doc:\/\/com.apple.documentation\/documentation\/UIKit\/UIView\/intrinsicContentSize] when using manual layout.",
  "platforms" : [
    "iOS",
    "iPadOS",
    "Mac Catalyst",
    "macOS",
    "tvOS",
    "visionOS"
  ],
  "rawMarkdown" : "---\nsource: https:\/\/developer.apple.com\/documentation\/sharedwithyou\/swattributionview\ncrawled: 2025-12-05T15:17:32Z\n---\n\n# SWAttributionView\n\n**Class**\n\nA view that displays the sender who shares a highlight and provides related actions.\n\n## Declaration\n\n```swift\n@MainActor class SWAttributionView\n```\n\n## Overview\n\nThe `SWAttributionView` also allows users to get back to the conversation about the [doc:\/\/com.apple.sharedwithyou\/documentation\/SharedWithYou\/SWHighlight] content, and other related actions using a [doc:\/\/com.apple.sharedwithyou\/documentation\/SharedWithYou\/SWAttributionView\/highlightMenu].\n\nPlace an `SWAttributionView` next to the content represented by its `SWHighlight`. The `SWAttributionView` displays the names and avatars within the provided horizontal space.\n\nYou can constrain this view’s width anchor or set its frame width to control the maximum width of its contents after which truncation may occur. Don’t constrain the view’s height, as the height is dependent on the [doc:\/\/com.apple.documentation\/documentation\/UIKit\/UIApplication\/preferredContentSizeCategory], and the resulting font size. To provide enough vertical space around this view, reference its [doc:\/\/com.apple.documentation\/documentation\/UIKit\/UIView\/heightAnchor] when using Auto Layout, or its [doc:\/\/com.apple.documentation\/documentation\/UIKit\/UIView\/intrinsicContentSize] when using manual layout.\n\n## Customizing highlights\n\n- **backgroundStyle**: The background style of the child view that contains names and avatars.\n- **displayContext**: The context for the content the system displays with this view.\n- **highlight**: The highlight you use to display this attribution.\n- **highlightMenu**: A menu with a list of system actions specific to this hightlight.\n- **horizontalAlignment**: The horizontal alignment of the view.\n- **menuTitleForHideAction**: A localized string the system uses as a custom title for the hide menu item.\n- **preferredMaxLayoutWidth**: A width the system uses to constrain the view contents.\n- **supplementalMenu**: A supplemental menu to augment the attribution view’s existing menu.\n\n## Customizing the view\n\n- **SWAttributionView.BackgroundStyle**: The background styling of the attribution view’s contents.\n- **SWAttributionView.DisplayContext**: The context for the content that influences the ranking of this view’s highlight.\n- **SWAttributionView.HorizontalAlignment**: The horizontal alignment of attribution view’s contents.\n\n## Inherits From\n\n- NSView\n- UIView\n\n## Conforms To\n\n- CALayerDelegate\n- CVarArg\n- CustomDebugStringConvertible\n- CustomStringConvertible\n- Equatable\n- Hashable\n- NSAccessibilityElementProtocol\n- NSAccessibilityProtocol\n- NSAnimatablePropertyContainer\n- NSAppearanceCustomization\n- NSCoding\n- NSDraggingDestination\n- NSObjectProtocol\n- NSStandardKeyBindingResponding\n- NSTouchBarProvider\n- NSUserActivityRestoring\n- NSUserInterfaceItemIdentification\n- Sendable\n- SendableMetatype\n- UIAccessibilityIdentification\n- UIActivityItemsConfigurationProviding\n- UIAppearance\n- UIAppearanceContainer\n- UICoordinateSpace\n- UIDynamicItem\n- UIFocusEnvironment\n- UIFocusItem\n- UIFocusItemContainer\n- UILargeContentViewerItem\n- UIPasteConfigurationSupporting\n- UIPopoverPresentationControllerSourceItem\n- UIResponderStandardEditActions\n- UITraitChangeObservable\n- UITraitEnvironment\n- UIUserActivityRestoring\n\n",
  "sections" : [
    {
      "content" : "",
      "items" : [
        {
          "description" : "The background style of the child view that contains names and avatars.",
          "name" : "backgroundStyle",
          "url" : "https:\/\/developer.apple.com\/documentation\/SharedWithYou\/SWAttributionView\/backgroundStyle-swift.property"
        },
        {
          "description" : "The context for the content the system displays with this view.",
          "name" : "displayContext",
          "url" : "https:\/\/developer.apple.com\/documentation\/SharedWithYou\/SWAttributionView\/displayContext-swift.property"
        },
        {
          "description" : "The highlight you use to display this attribution.",
          "name" : "highlight",
          "url" : "https:\/\/developer.apple.com\/documentation\/SharedWithYou\/SWAttributionView\/highlight"
        },
        {
          "description" : "A menu with a list of system actions specific to this hightlight.",
          "name" : "highlightMenu",
          "url" : "https:\/\/developer.apple.com\/documentation\/SharedWithYou\/SWAttributionView\/highlightMenu"
        },
        {
          "description" : "The horizontal alignment of the view.",
          "name" : "horizontalAlignment",
          "url" : "https:\/\/developer.apple.com\/documentation\/SharedWithYou\/SWAttributionView\/horizontalAlignment-swift.property"
        },
        {
          "description" : "A localized string the system uses as a custom title for the hide menu item.",
          "name" : "menuTitleForHideAction",
          "url" : "https:\/\/developer.apple.com\/documentation\/SharedWithYou\/SWAttributionView\/menuTitleForHideAction"
        },
        {
          "description" : "A width the system uses to constrain the view contents.",
          "name" : "preferredMaxLayoutWidth",
          "url" : "https:\/\/developer.apple.com\/documentation\/SharedWithYou\/SWAttributionView\/preferredMaxLayoutWidth"
        },
        {
          "description" : "A supplemental menu to augment the attribution view’s existing menu.",
          "name" : "supplementalMenu",
          "url" : "https:\/\/developer.apple.com\/documentation\/SharedWithYou\/SWAttributionView\/supplementalMenu"
        }
      ],
      "title" : "Customizing highlights"
    },
    {
      "content" : "",
      "items" : [
        {
          "description" : "The background styling of the attribution view’s contents.",
          "name" : "SWAttributionView.BackgroundStyle",
          "url" : "https:\/\/developer.apple.com\/documentation\/SharedWithYou\/SWAttributionView\/BackgroundStyle-swift.enum"
        },
        {
          "description" : "The context for the content that influences the ranking of this view’s highlight.",
          "name" : "SWAttributionView.DisplayContext",
          "url" : "https:\/\/developer.apple.com\/documentation\/SharedWithYou\/SWAttributionView\/DisplayContext-swift.enum"
        },
        {
          "description" : "The horizontal alignment of attribution view’s contents.",
          "name" : "SWAttributionView.HorizontalAlignment",
          "url" : "https:\/\/developer.apple.com\/documentation\/SharedWithYou\/SWAttributionView\/HorizontalAlignment-swift.enum"
        }
      ],
      "title" : "Customizing the view"
    },
    {
      "content" : "",
      "items" : [
        {
          "name" : "NSView"
        },
        {
          "name" : "UIView"
        }
      ],
      "title" : "Inherits From"
    }
  ],
  "source" : "appleJSON",
  "title" : "SWAttributionView",
  "url" : "https:\/\/developer.apple.com\/documentation\/sharedwithyou\/swattributionview"
}