{
  "abstract" : "A Boolean value that indicates whether the system runs the app using a compatibility mode for UI.",
  "codeExamples" : [

  ],
  "contentHash" : "71028dd673ffa107c1fbf5ce7936f77fbea9397f2d0fe697cc41f030519654b2",
  "crawledAt" : "2025-12-01T08:16:48Z",
  "id" : "5658A0A0-6A80-4D55-9E5C-084B47CB0F31",
  "kind" : "unknown",
  "module" : "Bundle Resources",
  "overview" : "## Discussion\n\nIf `YES`, the system runs the app using a compatibility mode for UI elements. The compatibility mode displays the app as it looks when built against previous versions of the SDKs.\n\nIf `NO`, the system uses the UI design of the running OS, with no compatibility mode. Absence of the key, or `NO`, is the default value for apps linking against the latest SDKs.",
  "rawMarkdown" : "---\nsource: https:\/\/developer.apple.com\/documentation\/BundleResources\/Information-Property-List\/UIDesignRequiresCompatibility\ncrawled: 2025-12-01T08:16:48Z\n---\n\n# UIDesignRequiresCompatibility\n\n**Property List Key**\n\nA Boolean value that indicates whether the system runs the app using a compatibility mode for UI.\n\n## Discussion\n\n\n\nIf `YES`, the system runs the app using a compatibility mode for UI elements. The compatibility mode displays the app as it looks when built against previous versions of the SDKs.\n\nIf `NO`, the system uses the UI design of the running OS, with no compatibility mode. Absence of the key, or `NO`, is the default value for apps linking against the latest SDKs.\n\n## Styling\n\n- **UIUserInterfaceStyle**: The user interface style for the app.\n- **UIViewEdgeAntialiasing**: A Boolean value that indicates whether Core Animation layers use antialiasing when drawing a layer that isn’t aligned to pixel boundaries.\n- **UIWhitePointAdaptivityStyle**: The app’s white-point adaptivity style, enabled on devices with True Tone displays.\n- **UIViewGroupOpacity**: A Boolean value that indicates whether Core Animation sublayers inherit the opacity of their superlayer.\n- **UIRequiresFullScreenIgnoredStartingWithVersion**: A string value that specifies a system version after which the system ignores the requires full screen key.\n- **UISupportsAssistiveAccess**: A Boolean value that indicates if an iOS or iPadOS app supports Assistive Access.\n- **UISupportsFullScreenInAssistiveAccess**: A Boolean value that indicates if an iOS or iPadOS app appears as full screen in Assistive Access.\n- **NSPrefersDisplaySafeAreaCompatibilityMode**: A Boolean value that indicates whether the app prefers to run in compatibility mode when necessary.\n- **NSAccentColorName**: The name of a color in an asset catalog to use for a target’s global accent color.\n- **NSWidgetBackgroundColorName**: The name of a color in an asset catalog to use for a widget’s configuration interface.\n\n",
  "sections" : [
    {
      "content" : "",
      "items" : [
        {
          "description" : "The user interface style for the app.",
          "name" : "UIUserInterfaceStyle",
          "url" : "https:\/\/developer.apple.com\/documentation\/BundleResources\/Information-Property-List\/UIUserInterfaceStyle"
        },
        {
          "description" : "A Boolean value that indicates whether Core Animation layers use antialiasing when drawing a layer that isn’t aligned to pixel boundaries.",
          "name" : "UIViewEdgeAntialiasing",
          "url" : "https:\/\/developer.apple.com\/documentation\/BundleResources\/Information-Property-List\/UIViewEdgeAntialiasing"
        },
        {
          "description" : "The app’s white-point adaptivity style, enabled on devices with True Tone displays.",
          "name" : "UIWhitePointAdaptivityStyle",
          "url" : "https:\/\/developer.apple.com\/documentation\/BundleResources\/Information-Property-List\/UIWhitePointAdaptivityStyle"
        },
        {
          "description" : "A Boolean value that indicates whether Core Animation sublayers inherit the opacity of their superlayer.",
          "name" : "UIViewGroupOpacity",
          "url" : "https:\/\/developer.apple.com\/documentation\/BundleResources\/Information-Property-List\/UIViewGroupOpacity"
        },
        {
          "description" : "A string value that specifies a system version after which the system ignores the requires full screen key.",
          "name" : "UIRequiresFullScreenIgnoredStartingWithVersion",
          "url" : "https:\/\/developer.apple.com\/documentation\/BundleResources\/Information-Property-List\/UIRequiresFullScreenIgnoredStartingWithVersion"
        },
        {
          "description" : "A Boolean value that indicates if an iOS or iPadOS app supports Assistive Access.",
          "name" : "UISupportsAssistiveAccess",
          "url" : "https:\/\/developer.apple.com\/documentation\/BundleResources\/Information-Property-List\/UISupportsAssistiveAccess"
        },
        {
          "description" : "A Boolean value that indicates if an iOS or iPadOS app appears as full screen in Assistive Access.",
          "name" : "UISupportsFullScreenInAssistiveAccess",
          "url" : "https:\/\/developer.apple.com\/documentation\/BundleResources\/Information-Property-List\/UISupportsFullScreenInAssistiveAccess"
        },
        {
          "description" : "A Boolean value that indicates whether the app prefers to run in compatibility mode when necessary.",
          "name" : "NSPrefersDisplaySafeAreaCompatibilityMode",
          "url" : "https:\/\/developer.apple.com\/documentation\/BundleResources\/Information-Property-List\/NSPrefersDisplaySafeAreaCompatibilityMode"
        },
        {
          "description" : "The name of a color in an asset catalog to use for a target’s global accent color.",
          "name" : "NSAccentColorName",
          "url" : "https:\/\/developer.apple.com\/documentation\/BundleResources\/Information-Property-List\/NSAccentColorName"
        },
        {
          "description" : "The name of a color in an asset catalog to use for a widget’s configuration interface.",
          "name" : "NSWidgetBackgroundColorName",
          "url" : "https:\/\/developer.apple.com\/documentation\/BundleResources\/Information-Property-List\/NSWidgetBackgroundColorName"
        }
      ],
      "title" : "Styling"
    }
  ],
  "source" : "appleJSON",
  "title" : "UIDesignRequiresCompatibility",
  "url" : "https:\/\/developer.apple.com\/documentation\/BundleResources\/Information-Property-List\/UIDesignRequiresCompatibility"
}