{
  "abstract" : "An entitlement for the merchant identifier associated with the in-app identity presentment entitlement.",
  "codeExamples" : [

  ],
  "contentHash" : "ae1d997417d6e281fb4c4e77afb9cda8007a691bace1859e660f0d3f90656653",
  "crawledAt" : "2025-12-02T01:04:51Z",
  "id" : "26F00492-F9B2-46DD-AAB6-89F39B4EBA1B",
  "kind" : "unknown",
  "module" : "Bundle Resources",
  "overview" : "## Discussion\n\nFor identity verification, you must add this entitlement even if you’re using the same merchant ID for Apple Pay. Apple Pay’s [doc:\/\/com.apple.bundleresources\/documentation\/BundleResources\/Entitlements\/com.apple.developer.in-app-payments] entitlement isn’t recognized for identity verification.",
  "rawMarkdown" : "---\nsource: https:\/\/developer.apple.com\/documentation\/BundleResources\/Entitlements\/com.apple.developer.in-app-identity-presentment.merchant-identifiers\ncrawled: 2025-12-02T01:04:51Z\n---\n\n# com.apple.developer.in-app-identity-presentment.merchant-identifiers\n\n**Property List Key**\n\nAn entitlement for the merchant identifier associated with the in-app identity presentment entitlement.\n\n## Discussion\n\nFor identity verification, you must add this entitlement even if you’re using the same merchant ID for Apple Pay. Apple Pay’s [doc:\/\/com.apple.bundleresources\/documentation\/BundleResources\/Entitlements\/com.apple.developer.in-app-payments] entitlement isn’t recognized for identity verification.\n\n## Wallet\n\n- **Pass Type IDs Entitlement**: A list of identifiers that specify pass types that your app can access in Wallet.\n- **Merchant IDs Entitlement**: A list of merchant IDs your app uses for Apple Pay support.\n- **com.apple.developer.in-app-identity-presentment**: An entitlement that verifies age or identity.\n- **ID Verifier - Display Only**\n- **ID Verifier - Data Transfer**\n\n",
  "sections" : [
    {
      "content" : "",
      "items" : [
        {
          "description" : "A list of identifiers that specify pass types that your app can access in Wallet.",
          "name" : "Pass Type IDs Entitlement",
          "url" : "https:\/\/developer.apple.com\/documentation\/BundleResources\/Entitlements\/com.apple.developer.pass-type-identifiers"
        },
        {
          "description" : "A list of merchant IDs your app uses for Apple Pay support.",
          "name" : "Merchant IDs Entitlement",
          "url" : "https:\/\/developer.apple.com\/documentation\/BundleResources\/Entitlements\/com.apple.developer.in-app-payments"
        },
        {
          "description" : "An entitlement that verifies age or identity.",
          "name" : "com.apple.developer.in-app-identity-presentment",
          "url" : "https:\/\/developer.apple.com\/documentation\/BundleResources\/Entitlements\/com.apple.developer.in-app-identity-presentment"
        },
        {
          "description" : "",
          "name" : "ID Verifier - Display Only",
          "url" : "https:\/\/developer.apple.com\/documentation\/BundleResources\/Entitlements\/com.apple.developer.proximity-reader.identity.display"
        },
        {
          "description" : "",
          "name" : "ID Verifier - Data Transfer",
          "url" : "https:\/\/developer.apple.com\/documentation\/BundleResources\/Entitlements\/com.apple.developer.proximity-reader.identity.read"
        }
      ],
      "title" : "Wallet"
    }
  ],
  "source" : "appleJSON",
  "title" : "com.apple.developer.in-app-identity-presentment.merchant-identifiers",
  "url" : "https:\/\/developer.apple.com\/documentation\/BundleResources\/Entitlements\/com.apple.developer.in-app-identity-presentment.merchant-identifiers"
}