{
  "abstract" : "The app’s primary icon for display on the Home Screen, in the Settings app, and many other places throughout the system.",
  "codeExamples" : [

  ],
  "contentHash" : "c7ae9fdff792b45c7256bbc727ad6ff1d243b45b6f74594a17661d75db84185d",
  "crawledAt" : "2025-12-05T08:50:47Z",
  "id" : "39CECDD2-4CB8-4189-A4B8-316B98AF6B21",
  "kind" : "unknown",
  "language" : "swift",
  "module" : "Bundle Resources",
  "overview" : "## Discussion\n\nIn your app for iOS, iPadOS, or watchOS, the value is a dictionary that contains the keys and values listed below. In your app for tvOS or visionOS, the value is a string that names an icon in your app’s asset catalog.",
  "rawMarkdown" : "---\nsource: https:\/\/developer.apple.com\/documentation\/BundleResources\/Information-Property-List\/CFBundleIcons\/CFBundlePrimaryIcon\ncrawled: 2025-12-05T08:50:47Z\n---\n\n# CFBundlePrimaryIcon\n\n**Property List Key**\n\nThe app’s primary icon for display on the Home Screen, in the Settings app, and many other places throughout the system.\n\n## Discussion\n\nIn your app for iOS, iPadOS, or watchOS, the value is a dictionary that contains the keys and values listed below. In your app for tvOS or visionOS, the value is a string that names an icon in your app’s asset catalog.\n\n## Specifying app icon files\n\n- **CFBundleIconFiles**: The names of the icon files in the app’s asset catalog or bundle.\n- **UIPrerenderedIcon**: A Boolean value indicating whether the app’s icon files already incorporate a shine effect.\n\n## Customizing the App Shortcuts platter\n\n- **NSAppIconActionTintColorName**: The tint color to apply to text and symbols in the App Shortcuts platter.\n- **NSAppIconComplementingColorNames**: The names of the colors to use for the background of the App Shortcuts platter.\n\n## Associating an SF Symbol\n\n- **CFBundleSymbolName**: The name of the symbol to show in the action sheet, and in Finder’s sidebar on macOS.\n\n## Property List Keys\n\n- **CFBundleAlternateIcons**: A list of alternate icons for the Home screen and Settings app.\n\n",
  "sections" : [
    {
      "content" : "",
      "items" : [
        {
          "description" : "The names of the icon files in the app’s asset catalog or bundle.",
          "name" : "CFBundleIconFiles",
          "url" : "https:\/\/developer.apple.com\/documentation\/BundleResources\/Information-Property-List\/CFBundleIcons\/CFBundlePrimaryIcon\/CFBundleIconFiles"
        },
        {
          "description" : "A Boolean value indicating whether the app’s icon files already incorporate a shine effect.",
          "name" : "UIPrerenderedIcon",
          "url" : "https:\/\/developer.apple.com\/documentation\/BundleResources\/Information-Property-List\/CFBundleIcons\/CFBundlePrimaryIcon\/UIPrerenderedIcon"
        }
      ],
      "title" : "Specifying app icon files"
    },
    {
      "content" : "",
      "items" : [
        {
          "description" : "The tint color to apply to text and symbols in the App Shortcuts platter.",
          "name" : "NSAppIconActionTintColorName",
          "url" : "https:\/\/developer.apple.com\/documentation\/BundleResources\/Information-Property-List\/CFBundleIcons\/CFBundlePrimaryIcon\/NSAppIconActionTintColorName"
        },
        {
          "description" : "The names of the colors to use for the background of the App Shortcuts platter.",
          "name" : "NSAppIconComplementingColorNames",
          "url" : "https:\/\/developer.apple.com\/documentation\/BundleResources\/Information-Property-List\/CFBundleIcons\/CFBundlePrimaryIcon\/NSAppIconComplementingColorNames"
        }
      ],
      "title" : "Customizing the App Shortcuts platter"
    },
    {
      "content" : "",
      "items" : [
        {
          "description" : "The name of the symbol to show in the action sheet, and in Finder’s sidebar on macOS.",
          "name" : "CFBundleSymbolName",
          "url" : "https:\/\/developer.apple.com\/documentation\/BundleResources\/Information-Property-List\/CFBundleIcons\/CFBundlePrimaryIcon\/CFBundleSymbolName"
        }
      ],
      "title" : "Associating an SF Symbol"
    },
    {
      "content" : "",
      "items" : [
        {
          "description" : "A list of alternate icons for the Home screen and Settings app.",
          "name" : "CFBundleAlternateIcons",
          "url" : "https:\/\/developer.apple.com\/documentation\/BundleResources\/Information-Property-List\/CFBundleIcons\/CFBundleAlternateIcons"
        }
      ],
      "title" : "Property List Keys"
    }
  ],
  "source" : "appleJSON",
  "title" : "CFBundlePrimaryIcon",
  "url" : "https:\/\/developer.apple.com\/documentation\/BundleResources\/Information-Property-List\/CFBundleIcons\/CFBundlePrimaryIcon"
}