{
  "abstract" : "The filename of the storyboard from which to generate the app’s launch image.",
  "codeExamples" : [

  ],
  "contentHash" : "5b307e71a4a88034ca9372a6250dfa3a0e70a46c73bb46bac2645ff3a0b95ba1",
  "crawledAt" : "2025-12-01T10:19:50Z",
  "id" : "45F2242C-6968-413E-9180-A21E38F81022",
  "kind" : "unknown",
  "module" : "Bundle Resources",
  "overview" : "## Discussion\n\nSpecify the name of the storyboard file without the filename extension. For example, if the filename of your storyboard is `LaunchScreen.storyboard`, specify “LaunchScreen” as the value for this key.\n\nIf you prefer to configure your app’s launch screen without storyboards, use [doc:\/\/com.apple.bundleresources\/documentation\/BundleResources\/Information-Property-List\/UILaunchScreen] instead.",
  "rawMarkdown" : "---\nsource: https:\/\/developer.apple.com\/documentation\/BundleResources\/Information-Property-List\/UILaunchStoryboardName\ncrawled: 2025-12-01T10:19:50Z\n---\n\n# UILaunchStoryboardName\n\n**Property List Key**\n\nThe filename of the storyboard from which to generate the app’s launch image.\n\n## Discussion\n\nSpecify the name of the storyboard file without the filename extension. For example, if the filename of your storyboard is `LaunchScreen.storyboard`, specify “LaunchScreen” as the value for this key.\n\nIf you prefer to configure your app’s launch screen without storyboards, use [doc:\/\/com.apple.bundleresources\/documentation\/BundleResources\/Information-Property-List\/UILaunchScreen] instead.\n\n## Launch interface\n\n- **UILaunchScreen**: The user interface to show while an app launches.\n- **UILaunchScreens**: The user interfaces to show while an app launches in response to different URL schemes.\n- **UILaunchStoryboards**: The launch storyboard to use to generate a launch image when your app opens from a supported scheme.\n- **LSUIPresentationMode**: The initial user-interface mode for the app.\n- **UILaunchToFullScreenByDefaultOnMac**: A Boolean value that indicates whether to launch your iPad app in full-screen mode when running on a Mac.\n\n",
  "sections" : [
    {
      "content" : "",
      "items" : [
        {
          "description" : "The user interface to show while an app launches.",
          "name" : "UILaunchScreen",
          "url" : "https:\/\/developer.apple.com\/documentation\/BundleResources\/Information-Property-List\/UILaunchScreen"
        },
        {
          "description" : "The user interfaces to show while an app launches in response to different URL schemes.",
          "name" : "UILaunchScreens",
          "url" : "https:\/\/developer.apple.com\/documentation\/BundleResources\/Information-Property-List\/UILaunchScreens"
        },
        {
          "description" : "The launch storyboard to use to generate a launch image when your app opens from a supported scheme.",
          "name" : "UILaunchStoryboards",
          "url" : "https:\/\/developer.apple.com\/documentation\/BundleResources\/Information-Property-List\/UILaunchStoryboards"
        },
        {
          "description" : "The initial user-interface mode for the app.",
          "name" : "LSUIPresentationMode",
          "url" : "https:\/\/developer.apple.com\/documentation\/BundleResources\/Information-Property-List\/LSUIPresentationMode"
        },
        {
          "description" : "A Boolean value that indicates whether to launch your iPad app in full-screen mode when running on a Mac.",
          "name" : "UILaunchToFullScreenByDefaultOnMac",
          "url" : "https:\/\/developer.apple.com\/documentation\/BundleResources\/Information-Property-List\/UILaunchToFullScreenByDefaultOnMac"
        }
      ],
      "title" : "Launch interface"
    }
  ],
  "source" : "appleJSON",
  "title" : "UILaunchStoryboardName",
  "url" : "https:\/\/developer.apple.com\/documentation\/BundleResources\/Information-Property-List\/UILaunchStoryboardName"
}