{
  "abstract" : "A Boolean value that indicates if an iOS or iPadOS app appears as full screen in Assistive Access.",
  "codeExamples" : [

  ],
  "contentHash" : "920787e4db827eaa619518f7d2b62be073cacbeafa70ff3276a9b05ad12017b4",
  "crawledAt" : "2025-12-02T16:44:45Z",
  "id" : "73D7BAF2-02B0-4566-AAFF-6184EEA0D52D",
  "kind" : "unknown",
  "language" : "swift",
  "module" : "Bundle Resources",
  "overview" : "## Discussion\n\nAdding this key to your app’s `Info.plist` file with a value of `YES` allows your app’s UI to expand into all the available space above the Back button in Assistive Access. It also lists your app as Optimized for Assistive Access in Settings, so that a trusted supporter configuring Assistive Access on someone’s behalf knows that your app’s UI is optimized for this feature.\n\n\n\nFor more information, read [doc:\/\/com.apple.documentation\/documentation\/Accessibility\/optimizing-your-app-for-assistive-access].",
  "rawMarkdown" : "---\nsource: https:\/\/developer.apple.com\/documentation\/BundleResources\/Information-Property-List\/UISupportsFullScreenInAssistiveAccess\ncrawled: 2025-12-02T16:44:45Z\n---\n\n# UISupportsFullScreenInAssistiveAccess\n\n**Property List Key**\n\nA Boolean value that indicates if an iOS or iPadOS app appears as full screen in Assistive Access.\n\n## Discussion\n\nAdding this key to your app’s `Info.plist` file with a value of `YES` allows your app’s UI to expand into all the available space above the Back button in Assistive Access. It also lists your app as Optimized for Assistive Access in Settings, so that a trusted supporter configuring Assistive Access on someone’s behalf knows that your app’s UI is optimized for this feature.\n\n\n\nFor more information, read [doc:\/\/com.apple.documentation\/documentation\/Accessibility\/optimizing-your-app-for-assistive-access].\n\n## Related Documentation\n\n- **Assistive Access**: A mode that tailors the iOS and iPadOS experience for people with cognitive disabilities.\n- **Optimizing your app for Assistive Access**: Adjust your app’s UI to make sure it works well for people who use Assistive Access.\n\n## Styling\n\n- **UIDesignRequiresCompatibility**: A Boolean value that indicates whether the system runs the app using a compatibility mode for UI.\n- **UIUserInterfaceStyle**: The user interface style for the app.\n- **UIViewEdgeAntialiasing**: A Boolean value that indicates whether Core Animation layers use antialiasing when drawing a layer that isn’t aligned to pixel boundaries.\n- **UIWhitePointAdaptivityStyle**: The app’s white-point adaptivity style, enabled on devices with True Tone displays.\n- **UIViewGroupOpacity**: A Boolean value that indicates whether Core Animation sublayers inherit the opacity of their superlayer.\n- **UIRequiresFullScreenIgnoredStartingWithVersion**: A string value that specifies a system version after which the system ignores the requires full screen key.\n- **UISupportsAssistiveAccess**: A Boolean value that indicates if an iOS or iPadOS app supports Assistive Access.\n- **NSPrefersDisplaySafeAreaCompatibilityMode**: A Boolean value that indicates whether the app prefers to run in compatibility mode when necessary.\n- **NSAccentColorName**: The name of a color in an asset catalog to use for a target’s global accent color.\n- **NSWidgetBackgroundColorName**: The name of a color in an asset catalog to use for a widget’s configuration interface.\n\n",
  "sections" : [
    {
      "content" : "",
      "items" : [
        {
          "description" : "A mode that tailors the iOS and iPadOS experience for people with cognitive disabilities.",
          "name" : "Assistive Access",
          "url" : "https:\/\/developer.apple.com\/documentation\/Accessibility\/assistive-access"
        },
        {
          "description" : "Adjust your app’s UI to make sure it works well for people who use Assistive Access.",
          "name" : "Optimizing your app for Assistive Access",
          "url" : "https:\/\/developer.apple.com\/documentation\/Accessibility\/optimizing-your-app-for-assistive-access"
        }
      ],
      "title" : "Related Documentation"
    },
    {
      "content" : "",
      "items" : [
        {
          "description" : "A Boolean value that indicates whether the system runs the app using a compatibility mode for UI.",
          "name" : "UIDesignRequiresCompatibility",
          "url" : "https:\/\/developer.apple.com\/documentation\/BundleResources\/Information-Property-List\/UIDesignRequiresCompatibility"
        },
        {
          "description" : "The user interface style for the app.",
          "name" : "UIUserInterfaceStyle",
          "url" : "https:\/\/developer.apple.com\/documentation\/BundleResources\/Information-Property-List\/UIUserInterfaceStyle"
        },
        {
          "description" : "A Boolean value that indicates whether Core Animation layers use antialiasing when drawing a layer that isn’t aligned to pixel boundaries.",
          "name" : "UIViewEdgeAntialiasing",
          "url" : "https:\/\/developer.apple.com\/documentation\/BundleResources\/Information-Property-List\/UIViewEdgeAntialiasing"
        },
        {
          "description" : "The app’s white-point adaptivity style, enabled on devices with True Tone displays.",
          "name" : "UIWhitePointAdaptivityStyle",
          "url" : "https:\/\/developer.apple.com\/documentation\/BundleResources\/Information-Property-List\/UIWhitePointAdaptivityStyle"
        },
        {
          "description" : "A Boolean value that indicates whether Core Animation sublayers inherit the opacity of their superlayer.",
          "name" : "UIViewGroupOpacity",
          "url" : "https:\/\/developer.apple.com\/documentation\/BundleResources\/Information-Property-List\/UIViewGroupOpacity"
        },
        {
          "description" : "A string value that specifies a system version after which the system ignores the requires full screen key.",
          "name" : "UIRequiresFullScreenIgnoredStartingWithVersion",
          "url" : "https:\/\/developer.apple.com\/documentation\/BundleResources\/Information-Property-List\/UIRequiresFullScreenIgnoredStartingWithVersion"
        },
        {
          "description" : "A Boolean value that indicates if an iOS or iPadOS app supports Assistive Access.",
          "name" : "UISupportsAssistiveAccess",
          "url" : "https:\/\/developer.apple.com\/documentation\/BundleResources\/Information-Property-List\/UISupportsAssistiveAccess"
        },
        {
          "description" : "A Boolean value that indicates whether the app prefers to run in compatibility mode when necessary.",
          "name" : "NSPrefersDisplaySafeAreaCompatibilityMode",
          "url" : "https:\/\/developer.apple.com\/documentation\/BundleResources\/Information-Property-List\/NSPrefersDisplaySafeAreaCompatibilityMode"
        },
        {
          "description" : "The name of a color in an asset catalog to use for a target’s global accent color.",
          "name" : "NSAccentColorName",
          "url" : "https:\/\/developer.apple.com\/documentation\/BundleResources\/Information-Property-List\/NSAccentColorName"
        },
        {
          "description" : "The name of a color in an asset catalog to use for a widget’s configuration interface.",
          "name" : "NSWidgetBackgroundColorName",
          "url" : "https:\/\/developer.apple.com\/documentation\/BundleResources\/Information-Property-List\/NSWidgetBackgroundColorName"
        }
      ],
      "title" : "Styling"
    }
  ],
  "source" : "appleJSON",
  "title" : "UISupportsFullScreenInAssistiveAccess",
  "url" : "https:\/\/developer.apple.com\/documentation\/BundleResources\/Information-Property-List\/UISupportsFullScreenInAssistiveAccess"
}