{
  "abstract" : "A Boolean value that indicates whether to launch your iPad app in full-screen mode when running on a Mac.",
  "codeExamples" : [

  ],
  "contentHash" : "6d3156b57ee4ad52127d48a256e62b332ebabc708131e06d0092e8eacd50ec78",
  "crawledAt" : "2025-12-03T05:30:46Z",
  "id" : "DF3FDDE7-A79F-4C4F-AE6B-07D62C01F0EA",
  "kind" : "unknown",
  "language" : "swift",
  "module" : "Bundle Resources",
  "overview" : "## Discussion\n\nTo launch your iPad app in full-screen mode when running in macOS, add this key to your app’s `Info.plist` file and set its value to [doc:\/\/com.apple.documentation\/documentation\/Swift\/true]. State restoration can override this behavior if the person using your app exits full-screen mode before quitting the app.\n\nYou can also provide a pixel-perfect, edge-to-edge, full-screen experience by including the [doc:\/\/com.apple.bundleresources\/documentation\/BundleResources\/Information-Property-List\/UISupportsTrueScreenSizeOnMac] key with a value of [doc:\/\/com.apple.documentation\/documentation\/Swift\/true] in your app’s `Info.plist` file.\n\n[doc:\/\/com.apple.bundleresources\/documentation\/BundleResources\/Information-Property-List\/UILaunchToFullScreenByDefaultOnMac] has no effect on your iPad app when:",
  "rawMarkdown" : "---\nsource: https:\/\/developer.apple.com\/documentation\/BundleResources\/Information-Property-List\/UILaunchToFullScreenByDefaultOnMac\ncrawled: 2025-12-03T05:30:46Z\n---\n\n# UILaunchToFullScreenByDefaultOnMac\n\n**Property List Key**\n\nA Boolean value that indicates whether to launch your iPad app in full-screen mode when running on a Mac.\n\n## Discussion\n\nTo launch your iPad app in full-screen mode when running in macOS, add this key to your app’s `Info.plist` file and set its value to [doc:\/\/com.apple.documentation\/documentation\/Swift\/true]. State restoration can override this behavior if the person using your app exits full-screen mode before quitting the app.\n\nYou can also provide a pixel-perfect, edge-to-edge, full-screen experience by including the [doc:\/\/com.apple.bundleresources\/documentation\/BundleResources\/Information-Property-List\/UISupportsTrueScreenSizeOnMac] key with a value of [doc:\/\/com.apple.documentation\/documentation\/Swift\/true] in your app’s `Info.plist` file.\n\n[doc:\/\/com.apple.bundleresources\/documentation\/BundleResources\/Information-Property-List\/UILaunchToFullScreenByDefaultOnMac] has no effect on your iPad app when:\n\n- The app supports iPad multitasking and resizable windows. For more information, see [doc:\/\/com.apple.bundleresources\/documentation\/BundleResources\/Information-Property-List\/UIRequiresFullScreen].\n- The app is running on other Apple platforms.\n- The app is built with [doc:\/\/com.apple.documentation\/documentation\/UIKit\/mac-catalyst].\n\n## Launch interface\n\n- **UILaunchScreen**: The user interface to show while an app launches.\n- **UILaunchScreens**: The user interfaces to show while an app launches in response to different URL schemes.\n- **UILaunchStoryboardName**: The filename of the storyboard from which to generate the app’s launch image.\n- **UILaunchStoryboards**: The launch storyboard to use to generate a launch image when your app opens from a supported scheme.\n- **LSUIPresentationMode**: The initial user-interface mode for the app.\n\n",
  "sections" : [
    {
      "content" : "",
      "items" : [
        {
          "description" : "The user interface to show while an app launches.",
          "name" : "UILaunchScreen",
          "url" : "https:\/\/developer.apple.com\/documentation\/BundleResources\/Information-Property-List\/UILaunchScreen"
        },
        {
          "description" : "The user interfaces to show while an app launches in response to different URL schemes.",
          "name" : "UILaunchScreens",
          "url" : "https:\/\/developer.apple.com\/documentation\/BundleResources\/Information-Property-List\/UILaunchScreens"
        },
        {
          "description" : "The filename of the storyboard from which to generate the app’s launch image.",
          "name" : "UILaunchStoryboardName",
          "url" : "https:\/\/developer.apple.com\/documentation\/BundleResources\/Information-Property-List\/UILaunchStoryboardName"
        },
        {
          "description" : "The launch storyboard to use to generate a launch image when your app opens from a supported scheme.",
          "name" : "UILaunchStoryboards",
          "url" : "https:\/\/developer.apple.com\/documentation\/BundleResources\/Information-Property-List\/UILaunchStoryboards"
        },
        {
          "description" : "The initial user-interface mode for the app.",
          "name" : "LSUIPresentationMode",
          "url" : "https:\/\/developer.apple.com\/documentation\/BundleResources\/Information-Property-List\/LSUIPresentationMode"
        }
      ],
      "title" : "Launch interface"
    }
  ],
  "source" : "appleJSON",
  "title" : "UILaunchToFullScreenByDefaultOnMac",
  "url" : "https:\/\/developer.apple.com\/documentation\/BundleResources\/Information-Property-List\/UILaunchToFullScreenByDefaultOnMac"
}