{
  "abstract" : "Generalize declarations to abstract away concrete types.",
  "codeExamples" : [

  ],
  "contentHash" : "4d94b698d00492175e3e46c110e7924aed9d19a8c4aa8afa9e3ed4bbac8d210d",
  "crawledAt" : "2025-12-02T19:39:54Z",
  "declaration" : {
    "code" : "func simpleMax<T: Comparable>(_ x: T, _ y: T) -> T {\n    if x < y {\n        return y\n    }\n    return x\n}",
    "language" : "swift"
  },
  "id" : "4F5372B5-209A-4DB0-88FD-8E798E76E5FF",
  "kind" : "protocol",
  "overview" : "The Swift Programming Language (6.2.1)  Generic Parameters and Arguments  Generic Parameters and Arguments Generic Parameters and ArgumentsGeneralize declarations to abstract away concrete types.This chapter describes parameters and arguments for generic types, functions, and initializers. When you declare a generic type, function, subscript, or initializer, you specify the type parameters that the generic type, function, or initializer can work with. These type parameters act as placeholders that are replaced by actual concrete type arguments when an instance of a generic type is created or a generic function or initializer is called.\n\nFor an overview of generics in Swift, see Generics.\n\nA generic parameter clause specifies the type parameters of a generic type or function, along with any associated constraints and requirements on those parameters. A generic parameter clause is enclosed in angle brackets (<>) and has the following form:",
  "rawMarkdown" : "---\nsource: https:\/\/docs.swift.org\/swift-book\/documentation\/the-swift-programming-language\/genericparametersandarguments\/\ncrawled: 2025-12-02T19:39:54Z\n---\n\n# Generic Parameters and Arguments | Documentation\n\n- [ The Swift Programming Language (6.2.1) ](\/swift-book\/documentation\/the-swift-programming-language)\n\n- [ Generic Parameters and Arguments ](\/swift-book\/documentation\/the-swift-programming-language\/genericparametersandarguments\/)\n\n- [ Generic Parameters and Arguments ](\/swift-book\/documentation\/the-swift-programming-language\/genericparametersandarguments\/)\n\n# Generic Parameters and Arguments\n\nGeneralize declarations to abstract away concrete types.This chapter describes parameters and arguments for generic types, functions, and initializers. When you declare a generic type, function, subscript, or initializer, you specify the type parameters that the generic type, function, or initializer can work with. These type parameters act as placeholders that are replaced by actual concrete type arguments when an instance of a generic type is created or a generic function or initializer is called.\n\nFor an overview of generics in Swift, see [Generics](\/swift-book\/documentation\/the-swift-programming-language\/generics).\n\n## [Generic Parameter Clause](\/swift-book\/documentation\/the-swift-programming-language\/genericparametersandarguments\/#Generic-Parameter-Clause)\n\nA *generic parameter clause* specifies the type parameters of a generic type or function, along with any associated constraints and requirements on those parameters. A generic parameter clause is enclosed in angle brackets (<>) and has the following form:\n\n\n\n```\n<<#generic parameter list#>>\n\n```\n\nThe *generic parameter list* is a comma-separated list of generic parameters, each of which has the following form:\n\n\n\n```\n<#type parameter#>: <#constraint#>\n\n```\n\nA generic parameter consists of a *type parameter* followed by an optional *constraint*. A *type parameter* is simply the name of a placeholder type (for example, `T`, `U`, `V`, `Key`, `Value`, and so on). You have access to the type parameters (and any of their associated types) in the rest of the type, function, or initializer declaration, including in the signature of the function or initializer.\n\nThe *constraint* specifies that a type parameter inherits from a specific class or conforms to a protocol or protocol composition. For example, in the generic function below, the generic parameter `T: Comparable` indicates that any type argument substituted for the type parameter `T` must conform to the `Comparable` protocol.\n\n\n\n```\nfunc simpleMax<T: Comparable>(_ x: T, _ y: T) -> T {\n    if x < y {\n        return y\n    }\n    return x\n}\n\n```\n\nBecause `Int` and `Double`, for example, both conform to the `Comparable` protocol, this function accepts arguments of either type. In contrast with generic types, you don’t specify a generic argument clause when you use a generic function or initializer. The type arguments are instead inferred from the type of the arguments passed to the function or initializer.\n\n\n\n```\nsimpleMax(17, 42) \/\/ T is inferred to be Int\nsimpleMax(3.14159, 2.71828) \/\/ T is inferred to be Double\n\n```\n\n### [Integer Generic Parameters](\/swift-book\/documentation\/the-swift-programming-language\/genericparametersandarguments\/#Integer-Generic-Parameters)\n\nAn *integer generic parameter* acts as a placeholder for an integer value rather than a type. It has the following form:\n\n\n\n```\nlet <#type parameter#>: <#type>\n\n```\n\nThe *type* must be the `Int` type from the Swift standard library, or a type alias or generic type that resolves to `Int`.\n\nThe value you provide for an integer generic parameter must be either an integer literal or another integer generic parameter from the enclosing generic context. For example:\n\n\n\n```\nstruct SomeStruct<let x: Int> { }\nlet a: SomeStruct<2>  \/\/ OK: integer literal\n\n\nstruct AnotherStruct<let x: Int, T, each U> {\n    let b: SomeStruct<x>  \/\/ OK: another integer generic parameter\n\n\n    static let c = 42\n    let d: SomeStruct<c>  \/\/ Error: Can't use a constant.\n\n\n    let e: SomeStruct<T>  \/\/ Error: Can't use a generic type parameter.\n    let f: SomeStruct<U>  \/\/ Error: Can't use a parameter pack.\n}\n\n```\n\nThe value of an integer generic parameter on a type is accessible as a static constant member of that type, with the same visibility as the type itself. The value of an integer generic parameter on a function is accessible as a constant from within the function. When used in an expression, these constants have type `Int`.\n\n\n\n```\nprint(a.x)  \/\/ Prints \"4\"\n\n```\n\nThe value of an integer generic parameter can be inferred from the types of the arguments you use when initializing the type or calling the function.\n\n\n\n```\nstruct AnotherStruct<let y: Int> {\n    var s: SomeStruct<y>\n}\nfunc someFunction<let z: Int>(s: SomeStruct<z>) {\n    print(z)\n}\n\n\nlet s1 = SomeStruct<12>()\nlet s2 = AnotherStruct(s: s1)  \/\/ AnotherStruct.y is inferred to be 12.\nsomeFunction(s: s1)  \/\/ Prints \"12\"\n\n```\n\n### [Generic Where Clauses](\/swift-book\/documentation\/the-swift-programming-language\/genericparametersandarguments\/#Generic-Where-Clauses)\n\nYou can specify additional requirements on type parameters and their associated types by including a generic `where` clause right before the opening curly brace of a type or function’s body. A generic `where` clause consists of the `where` keyword, followed by a comma-separated list of one or more *requirements*.\n\n\n\n```\nwhere <#requirements#>\n\n```\n\nThe *requirements* in a generic `where` clause specify that a type parameter inherits from a class or conforms to a protocol or protocol composition. Although the generic `where` clause provides syntactic sugar for expressing simple constraints on type parameters (for example, `<T: Comparable>` is equivalent to `<T> where T: Comparable` and so on), you can use it to provide more complex constraints on type parameters and their associated types. For example, you can constrain the associated types of type parameters to conform to protocols. For example, `<S: Sequence> where S.Iterator.Element: Equatable` specifies that `S` conforms to the `Sequence` protocol and that the associated type `S.Iterator.Element` conforms to the `Equatable` protocol. This constraint ensures that each element of the sequence is equatable. Integer generic parameters can’t have protocol or superclass requirements.\n\nYou can also specify the requirement that two types be identical, using the `==` operator. For example, `<S1: Sequence, S2: Sequence> where S1.Iterator.Element == S2.Iterator.Element` expresses the constraints that `S1` and `S2` conform to the `Sequence` protocol and that the elements of both sequences must be of the same type. For integer generic parameters, the `==` operator specifies a requirement for their values. You can require two integer generic parameters to have the same value, or you can require a specific integer value for the integer generic parameter.\n\nAny type argument substituted for a type parameter must meet all the constraints and requirements placed on the type parameter.\n\nA generic `where` clause can appear as part of a declaration that includes type parameters, or as part of a declaration that’s nested inside of a declaration that includes type parameters. The generic `where` clause for a nested declaration can still refer to the type parameters of the enclosing declaration; however, the requirements from that `where` clause apply only to the declaration where it’s written.\n\nIf the enclosing declaration also has a `where` clause, the requirements from both clauses are combined. In the example below, `startsWithZero()` is available only if `Element` conforms to both `SomeProtocol` and `Numeric`.\n\n\n\n```\nextension Collection where Element: SomeProtocol {\n    func startsWithZero() -> Bool where Element: Numeric {\n        return first == .zero\n    }\n}\n\n```\n\nYou can overload a generic function or initializer by providing different constraints, requirements, or both on the type parameters. When you call an overloaded generic function or initializer, the compiler uses these constraints to resolve which overloaded function or initializer to invoke.\n\nFor more information about generic `where` clauses and to see an example of one in a generic function declaration, see [Generic Where Clauses](\/swift-book\/documentation\/the-swift-programming-language\/generics#Generic-Where-Clauses).\n\nGrammar of a generic parameter clause\n\n*generic-parameter-clause* → **`<`** *generic-parameter-list* **`>`** \n*generic-parameter-list* → *generic-parameter* | *generic-parameter* **`,`** *generic-parameter-list* \n*generic-parameter* → *type-name* \n*generic-parameter* → *type-name* **`:`** *type-identifier* \n*generic-parameter* → *type-name* **`:`** *protocol-composition-type* \n*generic-parameter* → **`let`** *type-name* **`:`** *type* \\\n\n*generic-where-clause* → **`where`** *requirement-list* \n*requirement-list* → *requirement* | *requirement* **`,`** *requirement-list* \n*requirement* → *conformance-requirement* | *same-type-requirement*\n\n*conformance-requirement* → *type-identifier* **`:`** *type-identifier* \n*conformance-requirement* → *type-identifier* **`:`** *protocol-composition-type* \n*same-type-requirement* → *type-identifier* **`==`** *type* \n*same-type-requirement* → *type-identifier* **`==`** *signed-integer-literal*\n\n## [Generic Argument Clause](\/swift-book\/documentation\/the-swift-programming-language\/genericparametersandarguments\/#Generic-Argument-Clause)\n\nA *generic argument clause* specifies the type arguments of a generic type. A generic argument clause is enclosed in angle brackets (<>) and has the following form:\n\n\n\n```\n<<#generic argument list#>>\n\n```\n\nThe *generic argument list* is a comma-separated list of type arguments. A *type argument* is the name of an actual concrete type that replaces a corresponding type parameter in the generic parameter clause of a generic type — or, for an integer generic parameter, an integer value that replaces that integer generic parameter. The result is a specialized version of that generic type. The example below shows a simplified version of the Swift standard library’s generic dictionary type.\n\n\n\n```\nstruct Dictionary<Key: Hashable, Value>: Collection, ExpressibleByDictionaryLiteral {\n    \/* ... *\/\n}\n\n```\n\nThe specialized version of the generic `Dictionary` type, `Dictionary<String, Int>` is formed by replacing the generic parameters `Key: Hashable` and `Value` with the concrete type arguments `String` and `Int`. Each type argument must satisfy all the constraints of the generic parameter it replaces, including any additional requirements specified in a generic `where` clause. In the example above, the `Key` type parameter is constrained to conform to the `Hashable` protocol and therefore `String` must also conform to the `Hashable` protocol.\n\nYou can also replace a type parameter with a type argument that’s itself a specialized version of a generic type (provided it satisfies the appropriate constraints and requirements). For example, you can replace the type parameter `Element` in `Array<Element>` with a specialized version of an array, `Array<Int>`, to form an array whose elements are themselves arrays of integers.\n\n\n\n```\nlet arrayOfArrays: Array<Array<Int>> = [[1, 2, 3], [4, 5, 6], [7, 8, 9]]\n\n```\n\nAs mentioned in [Generic Parameter Clause](\/swift-book\/documentation\/the-swift-programming-language\/genericparametersandarguments#Generic-Parameter-Clause), you don’t use a generic argument clause to specify the type arguments of a generic function or initializer.\n\nGrammar of a generic argument clause\n\n*generic-argument-clause* → **`<`** *generic-argument-list* **`>`** \n*generic-argument-list* → *generic-argument* | *generic-argument* **`,`** *generic-argument-list* \n*generic-argument* → *type* | *signed-integer-literal*\n\n- [ Generic Parameters and Arguments ](\/swift-book\/documentation\/the-swift-programming-language\/genericparametersandarguments\/#app-top)\n\n- [ Generic Parameter Clause ](\/swift-book\/documentation\/the-swift-programming-language\/genericparametersandarguments\/#Generic-Parameter-Clause)\n\n- [ Integer Generic Parameters ](\/swift-book\/documentation\/the-swift-programming-language\/genericparametersandarguments\/#Integer-Generic-Parameters)\n\n- [ Generic Where Clauses ](\/swift-book\/documentation\/the-swift-programming-language\/genericparametersandarguments\/#Generic-Where-Clauses)\n\n- [ Generic Argument Clause ](\/swift-book\/documentation\/the-swift-programming-language\/genericparametersandarguments\/#Generic-Argument-Clause)",
  "sections" : [
    {
      "content" : "",
      "title" : "Generic Parameter Clause"
    },
    {
      "content" : "",
      "title" : "Generic Argument Clause"
    }
  ],
  "source" : "swiftOrg",
  "title" : "Generic Parameters and Arguments | Documentation",
  "url" : "https:\/\/docs.swift.org\/swift-book\/documentation\/the-swift-programming-language\/genericparametersandarguments\/"
}