{
  "abstract" : "Indicates whether the menu automatically enables and disables its menu items.",
  "codeExamples" : [

  ],
  "contentHash" : "3637d17e0ac76af0e50cce5841a6d94405e5530c53c87d7594bad41452956f88",
  "crawledAt" : "2025-12-02T05:01:40Z",
  "declaration" : {
    "code" : "var autoenablesItems: Bool { get set }",
    "language" : "swift"
  },
  "id" : "31E40D48-B4E3-46B0-8967-259E21328E25",
  "kind" : "property",
  "module" : "AppKit",
  "overview" : "## Discussion\n\nThis property contains a Boolean value, indicating whether the menu automatically enables and disables its menu items. If set to [doc:\/\/com.apple.documentation\/documentation\/Swift\/true], menu items of the menu are automatically enabled and disabled according to rules computed by the NSMenuValidation informal protocol. By default, `NSMenu` objects autoenable their menu items.",
  "platforms" : [
    "macOS"
  ],
  "rawMarkdown" : "---\nsource: https:\/\/developer.apple.com\/documentation\/AppKit\/NSMenu\/autoenablesItems\ncrawled: 2025-12-02T05:01:40Z\n---\n\n# autoenablesItems\n\n**Instance Property**\n\nIndicates whether the menu automatically enables and disables its menu items.\n\n## Declaration\n\n```swift\nvar autoenablesItems: Bool { get set }\n```\n\n## Discussion\n\nThis property contains a Boolean value, indicating whether the menu automatically enables and disables its menu items. If set to [doc:\/\/com.apple.documentation\/documentation\/Swift\/true], menu items of the menu are automatically enabled and disabled according to rules computed by the NSMenuValidation informal protocol. By default, `NSMenu` objects autoenable their menu items.\n\n## Enabling and Disabling Menu Items\n\n- **update()**: Enables or disables the menu items of the menu based on the NSMenuValidation informal protocol and sizes the menu to fit its current menu items if necessary.\n\n",
  "sections" : [
    {
      "content" : "",
      "items" : [
        {
          "description" : "Enables or disables the menu items of the menu based on the NSMenuValidation informal protocol and sizes the menu to fit its current menu items if necessary.",
          "name" : "update()",
          "url" : "https:\/\/developer.apple.com\/documentation\/AppKit\/NSMenu\/update()"
        }
      ],
      "title" : "Enabling and Disabling Menu Items"
    }
  ],
  "source" : "appleJSON",
  "title" : "autoenablesItems",
  "url" : "https:\/\/developer.apple.com\/documentation\/AppKit\/NSMenu\/autoenablesItems"
}