{
  "abstract" : "Inserts an item at the specified position in the menu.",
  "codeExamples" : [

  ],
  "contentHash" : "cea88d8f76ea727a898396b15137c4407b13927d8a778abdc4f45ab174bfe086",
  "crawledAt" : "2025-12-02T05:04:15Z",
  "declaration" : {
    "code" : "@MainActor func insertItem(withTitle title: String, at index: Int)",
    "language" : "swift"
  },
  "id" : "DB61BE6B-6B56-4594-AAC2-3D4AAFB3131F",
  "kind" : "method",
  "module" : "AppKit",
  "overview" : "## Discussion\n\nThe value in `index` must represent a valid position in the array. The menu item at `index` and all those that follow it are shifted down one slot to make room for the new menu item.\n\nThis method assigns the pop-up button’s default action and target to the new menu item. Use the menu item’s setAction: and setTarget: methods to assign a new action and target.\n\nBecause this method searches for duplicate items, it should not be used if you are adding an item to an already populated menu with more than a few hundred items. In a situation like this, add items directly to the button’s menu instead.",
  "platforms" : [
    "macOS"
  ],
  "rawMarkdown" : "---\nsource: https:\/\/developer.apple.com\/documentation\/AppKit\/NSPopUpButtonCell\/insertItem(withTitle:at:)\ncrawled: 2025-12-02T05:04:15Z\n---\n\n# insertItem(withTitle:at:)\n\n**Instance Method**\n\nInserts an item at the specified position in the menu.\n\n## Declaration\n\n```swift\n@MainActor func insertItem(withTitle title: String, at index: Int)\n```\n\n## Parameters\n\n- **title**: The title of the new item. If an item with the same title already exists in the menu, the existing item is removed and the new one is added\n- **index**: The zero-based index at which to insert the item. Specifying `0` inserts the item at the top of the menu.\n\n## Discussion\n\nThe value in `index` must represent a valid position in the array. The menu item at `index` and all those that follow it are shifted down one slot to make room for the new menu item.\n\nThis method assigns the pop-up button’s default action and target to the new menu item. Use the menu item’s setAction: and setTarget: methods to assign a new action and target.\n\nBecause this method searches for duplicate items, it should not be used if you are adding an item to an already populated menu with more than a few hundred items. In a situation like this, add items directly to the button’s menu instead.\n\n## Related Documentation\n\n- **insert(_:at:)**: Inserts a given object into the array’s contents at a given index.\n\n## Adding and removing items\n\n- **addItem(withTitle:)**: Adds an item with the specified title to the end of the menu.\n- **addItems(withTitles:)**: Adds multiple items to the end of the menu.\n- **removeItem(withTitle:)**: Removes the item with the specified title from the menu.\n- **removeItem(at:)**: Removes the item at the specified index.\n- **removeAllItems()**: Removes all items in the receiver’s item menu.\n\n",
  "sections" : [
    {
      "content" : "",
      "items" : [
        {
          "description" : "Inserts a given object into the array’s contents at a given index.",
          "name" : "insert(_:at:)",
          "url" : "https:\/\/developer.apple.com\/documentation\/Foundation\/NSMutableArray\/insert(_:at:)-5dbx5"
        }
      ],
      "title" : "Related Documentation"
    },
    {
      "content" : "",
      "items" : [
        {
          "description" : "Adds an item with the specified title to the end of the menu.",
          "name" : "addItem(withTitle:)",
          "url" : "https:\/\/developer.apple.com\/documentation\/AppKit\/NSPopUpButtonCell\/addItem(withTitle:)"
        },
        {
          "description" : "Adds multiple items to the end of the menu.",
          "name" : "addItems(withTitles:)",
          "url" : "https:\/\/developer.apple.com\/documentation\/AppKit\/NSPopUpButtonCell\/addItems(withTitles:)"
        },
        {
          "description" : "Removes the item with the specified title from the menu.",
          "name" : "removeItem(withTitle:)",
          "url" : "https:\/\/developer.apple.com\/documentation\/AppKit\/NSPopUpButtonCell\/removeItem(withTitle:)"
        },
        {
          "description" : "Removes the item at the specified index.",
          "name" : "removeItem(at:)",
          "url" : "https:\/\/developer.apple.com\/documentation\/AppKit\/NSPopUpButtonCell\/removeItem(at:)"
        },
        {
          "description" : "Removes all items in the receiver’s item menu.",
          "name" : "removeAllItems()",
          "url" : "https:\/\/developer.apple.com\/documentation\/AppKit\/NSPopUpButtonCell\/removeAllItems()"
        }
      ],
      "title" : "Adding and removing items"
    }
  ],
  "source" : "appleJSON",
  "title" : "insertItem(withTitle:at:)",
  "url" : "https:\/\/developer.apple.com\/documentation\/AppKit\/NSPopUpButtonCell\/insertItem(withTitle:at:)"
}