{
  "abstract" : "A constant that indicates the enumeration clears the image components provider for all dragging items that don’t meet the classes and search options criteria.",
  "codeExamples" : [

  ],
  "contentHash" : "78d6115fd9d7c7dcbe5dde1f9c6eeac01228d718070473c4db632950e9a1fa0d",
  "crawledAt" : "2025-12-05T09:31:05Z",
  "declaration" : {
    "code" : "static var clearNonenumeratedImages: NSDraggingItemEnumerationOptions { get }",
    "language" : "swift"
  },
  "id" : "29226FE8-073A-4D4F-BD8D-25E003C0DF22",
  "kind" : "property",
  "language" : "swift",
  "module" : "AppKit",
  "overview" : "## Discussion\n\nSpecify this option when you enumerate dragging items to hide the drag image for nonvalid items for this destination. The enumeration sets the [doc:\/\/com.apple.appkit\/documentation\/AppKit\/NSDraggingItem\/imageComponentsProvider] to `nil` for all dragging items that don’t meet the classes and search options criteria.",
  "platforms" : [
    "macOS"
  ],
  "rawMarkdown" : "---\nsource: https:\/\/developer.apple.com\/documentation\/AppKit\/NSDraggingItemEnumerationOptions\/clearNonenumeratedImages\ncrawled: 2025-12-05T09:31:05Z\n---\n\n# clearNonenumeratedImages\n\n**Type Property**\n\nA constant that indicates the enumeration clears the image components provider for all dragging items that don’t meet the classes and search options criteria.\n\n## Declaration\n\n```swift\nstatic var clearNonenumeratedImages: NSDraggingItemEnumerationOptions { get }\n```\n\n## Discussion\n\nSpecify this option when you enumerate dragging items to hide the drag image for nonvalid items for this destination. The enumeration sets the [doc:\/\/com.apple.appkit\/documentation\/AppKit\/NSDraggingItem\/imageComponentsProvider] to `nil` for all dragging items that don’t meet the classes and search options criteria.\n\n## Constants\n\n- **concurrent**: A constant that indicates the enumeration processes dragging items concurrently.\n\n",
  "sections" : [
    {
      "content" : "",
      "items" : [
        {
          "description" : "A constant that indicates the enumeration processes dragging items concurrently.",
          "name" : "concurrent",
          "url" : "https:\/\/developer.apple.com\/documentation\/AppKit\/NSDraggingItemEnumerationOptions\/concurrent"
        }
      ],
      "title" : "Constants"
    }
  ],
  "source" : "appleJSON",
  "title" : "clearNonenumeratedImages",
  "url" : "https:\/\/developer.apple.com\/documentation\/AppKit\/NSDraggingItemEnumerationOptions\/clearNonenumeratedImages"
}