{
  "abstract" : "Returns the priority of the subview’s width or height when resizing.",
  "codeExamples" : [

  ],
  "contentHash" : "a5b444fa54a63e8b19b47df729c9c1323230ee1ef5dd83a1fa6a72e3a068dbc2",
  "crawledAt" : "2025-12-02T18:29:45Z",
  "declaration" : {
    "code" : "@MainActor func holdingPriorityForSubview(at subviewIndex: Int) -> NSLayoutConstraint.Priority",
    "language" : "swift"
  },
  "id" : "61B74163-77B0-4D6D-97D8-9F854E03115E",
  "kind" : "method",
  "language" : "swift",
  "module" : "AppKit",
  "overview" : "## Return Value\n\nThe layout priority of the subview at the index.\n\n## Discussion\n\nThe priority is the manner that the split view subviews use to maintain their width (for a vertical split view) or height (for a horizontal split view). During a split view resize, subviews with higher priorities maintain their sizes before subviews with lower priorities. The subview with the lowest priority is the first to gain additional thickness if the split view grows or shrinks.",
  "platforms" : [
    "macOS"
  ],
  "rawMarkdown" : "---\nsource: https:\/\/developer.apple.com\/documentation\/AppKit\/NSSplitView\/holdingPriorityForSubview(at:)\ncrawled: 2025-12-02T18:29:45Z\n---\n\n# holdingPriorityForSubview(at:)\n\n**Instance Method**\n\nReturns the priority of the subview’s width or height when resizing.\n\n## Declaration\n\n```swift\n@MainActor func holdingPriorityForSubview(at subviewIndex: Int) -> NSLayoutConstraint.Priority\n```\n\n## Parameters\n\n- **subviewIndex**: The index of the subview.\n\n## Return Value\n\nThe layout priority of the subview at the index.\n\n## Discussion\n\nThe priority is the manner that the split view subviews use to maintain their width (for a vertical split view) or height (for a horizontal split view). During a split view resize, subviews with higher priorities maintain their sizes before subviews with lower priorities. The subview with the lowest priority is the first to gain additional thickness if the split view grows or shrinks.\n\n## Managing Subviews\n\n- **adjustSubviews()**: Adjusts the sizes of the split view’s subviews so they (plus the dividers) fill the split view.\n- **isSubviewCollapsed(_:)**: Returns whether the specified view is in a collapsed state.\n- **setHoldingPriority(_:forSubviewAt:)**: Sets the priority for split view subviews to maintain their width or height.\n\n",
  "sections" : [
    {
      "content" : "",
      "items" : [
        {
          "description" : "Adjusts the sizes of the split view’s subviews so they (plus the dividers) fill the split view.",
          "name" : "adjustSubviews()",
          "url" : "https:\/\/developer.apple.com\/documentation\/AppKit\/NSSplitView\/adjustSubviews()"
        },
        {
          "description" : "Returns whether the specified view is in a collapsed state.",
          "name" : "isSubviewCollapsed(_:)",
          "url" : "https:\/\/developer.apple.com\/documentation\/AppKit\/NSSplitView\/isSubviewCollapsed(_:)"
        },
        {
          "description" : "Sets the priority for split view subviews to maintain their width or height.",
          "name" : "setHoldingPriority(_:forSubviewAt:)",
          "url" : "https:\/\/developer.apple.com\/documentation\/AppKit\/NSSplitView\/setHoldingPriority(_:forSubviewAt:)"
        }
      ],
      "title" : "Managing Subviews"
    }
  ],
  "source" : "appleJSON",
  "title" : "holdingPriorityForSubview(at:)",
  "url" : "https:\/\/developer.apple.com\/documentation\/AppKit\/NSSplitView\/holdingPriorityForSubview(at:)"
}