{
  "abstract" : "Synchronizes the displayed window title and the represented filename with the information in the associated document.",
  "codeExamples" : [

  ],
  "contentHash" : "db22d5eca7fdc353b0cd4053d2148f8ef0a3d19d9fb4ab5567598dd4e9a713d6",
  "crawledAt" : "2025-12-01T14:04:42Z",
  "declaration" : {
    "code" : "@MainActor func synchronizeWindowTitleWithDocumentName()",
    "language" : "swift"
  },
  "id" : "272182E7-3ECD-4C81-8010-915CF1FF35E3",
  "kind" : "method",
  "module" : "AppKit",
  "overview" : "## Discussion\n\nDoes nothing if the window controller has no associated document or loaded window. This method queries the window controller’s document to get the document’s display name and full filename path, then calls [doc:\/\/com.apple.appkit\/documentation\/AppKit\/NSWindowController\/windowTitle(forDocumentDisplayName:)] to get the display name to show in the window title.",
  "platforms" : [
    "macOS"
  ],
  "rawMarkdown" : "---\nsource: https:\/\/developer.apple.com\/documentation\/AppKit\/NSWindowController\/synchronizeWindowTitleWithDocumentName()\ncrawled: 2025-12-01T14:04:42Z\n---\n\n# synchronizeWindowTitleWithDocumentName()\n\n**Instance Method**\n\nSynchronizes the displayed window title and the represented filename with the information in the associated document.\n\n## Declaration\n\n```swift\n@MainActor func synchronizeWindowTitleWithDocumentName()\n```\n\n## Discussion\n\nDoes nothing if the window controller has no associated document or loaded window. This method queries the window controller’s document to get the document’s display name and full filename path, then calls [doc:\/\/com.apple.appkit\/documentation\/AppKit\/NSWindowController\/windowTitle(forDocumentDisplayName:)] to get the display name to show in the window title.\n\n## Accessing Window Attributes and Content\n\n- **shouldCascadeWindows**: A Boolean value that indicates whether the window will cascade in relation to other document windows when it is displayed.\n- **windowFrameAutosaveName**: The name under which the frame rectangle of the window owned by the receiver is stored in the defaults database.\n- **windowTitle(forDocumentDisplayName:)**: Returns the window title to be used for a given document display name.\n- **contentViewController**: The view controller for the window’s content view.\n- **dismissController(_:)**: Dismisses the window controller.\n\n",
  "sections" : [
    {
      "content" : "",
      "items" : [
        {
          "description" : "A Boolean value that indicates whether the window will cascade in relation to other document windows when it is displayed.",
          "name" : "shouldCascadeWindows",
          "url" : "https:\/\/developer.apple.com\/documentation\/AppKit\/NSWindowController\/shouldCascadeWindows"
        },
        {
          "description" : "The name under which the frame rectangle of the window owned by the receiver is stored in the defaults database.",
          "name" : "windowFrameAutosaveName",
          "url" : "https:\/\/developer.apple.com\/documentation\/AppKit\/NSWindowController\/windowFrameAutosaveName"
        },
        {
          "description" : "Returns the window title to be used for a given document display name.",
          "name" : "windowTitle(forDocumentDisplayName:)",
          "url" : "https:\/\/developer.apple.com\/documentation\/AppKit\/NSWindowController\/windowTitle(forDocumentDisplayName:)"
        },
        {
          "description" : "The view controller for the window’s content view.",
          "name" : "contentViewController",
          "url" : "https:\/\/developer.apple.com\/documentation\/AppKit\/NSWindowController\/contentViewController"
        },
        {
          "description" : "Dismisses the window controller.",
          "name" : "dismissController(_:)",
          "url" : "https:\/\/developer.apple.com\/documentation\/AppKit\/NSWindowController\/dismissController(_:)"
        }
      ],
      "title" : "Accessing Window Attributes and Content"
    }
  ],
  "source" : "appleJSON",
  "title" : "synchronizeWindowTitleWithDocumentName()",
  "url" : "https:\/\/developer.apple.com\/documentation\/AppKit\/NSWindowController\/synchronizeWindowTitleWithDocumentName()"
}