{
  "abstract" : "The threshold controlling when hyphenation is done.",
  "codeExamples" : [

  ],
  "contentHash" : "7f773cac4479d5a0fc250254b4c8250e11dd520d866f4b31cf10cf5e07194e10",
  "crawledAt" : "2025-12-05T13:57:46Z",
  "declaration" : {
    "code" : "var hyphenationFactor: Float { get set }",
    "language" : "swift"
  },
  "id" : "5BC9FA18-544B-4CB0-A2AB-548595D657F8",
  "kind" : "property",
  "language" : "swift",
  "module" : "AppKit",
  "overview" : "## Discussion\n\nWhenever (width of the real contents of the line) \/ (the line fragment width) is below `factor`, hyphenation is attempted when laying out the line. Hyphenation slows down text layout and increases memory usage, so it should be used sparingly.",
  "platforms" : [
    "macOS"
  ],
  "rawMarkdown" : "---\nsource: https:\/\/developer.apple.com\/documentation\/AppKit\/NSLayoutManager\/hyphenationFactor\ncrawled: 2025-12-05T13:57:46Z\n---\n\n# hyphenationFactor\n\n**Instance Property**\n\nThe threshold controlling when hyphenation is done.\n\n## Declaration\n\n```swift\nvar hyphenationFactor: Float { get set }\n```\n\n## Discussion\n\nWhenever (width of the real contents of the line) \/ (the line fragment width) is below `factor`, hyphenation is attempted when laying out the line. Hyphenation slows down text layout and increases memory usage, so it should be used sparingly.\n\n## Properties\n\n- **usesScreenFonts**: A Boolean that controls using screen fonts to calculate layout and display text.\n\n",
  "sections" : [
    {
      "content" : "",
      "items" : [
        {
          "description" : "A Boolean that controls using screen fonts to calculate layout and display text.",
          "name" : "usesScreenFonts",
          "url" : "https:\/\/developer.apple.com\/documentation\/AppKit\/NSLayoutManager\/usesScreenFonts"
        }
      ],
      "title" : "Properties"
    }
  ],
  "source" : "appleJSON",
  "title" : "hyphenationFactor",
  "url" : "https:\/\/developer.apple.com\/documentation\/AppKit\/NSLayoutManager\/hyphenationFactor"
}