{
  "abstract" : "The index of the pointing device currently in proximity with the tablet.",
  "codeExamples" : [

  ],
  "contentHash" : "53b091741a4635fd3cf5b2f051ba5928d6467f0ad4b7c23edf5eac339225c810",
  "crawledAt" : "2025-12-04T00:09:15Z",
  "declaration" : {
    "code" : "var pointingDeviceID: Int { get }",
    "language" : "swift"
  },
  "id" : "F61778B4-7376-4000-A9D8-37EA34BAA8A6",
  "kind" : "property",
  "language" : "swift",
  "module" : "AppKit",
  "overview" : "## Discussion\n\nThis index is significant for multimode (or Dual Tracking) tablets that support multiple concurrent pointing devices; the index is incremented for each pointing device that comes into proximity. Otherwise, zero is always returned. This property is valid for mouse events with subtype `NSTabletProximityEventSubtype` or an event of type `NSTabletProximity`.",
  "platforms" : [
    "macOS"
  ],
  "rawMarkdown" : "---\nsource: https:\/\/developer.apple.com\/documentation\/AppKit\/NSEvent\/pointingDeviceID\ncrawled: 2025-12-04T00:09:15Z\n---\n\n# pointingDeviceID\n\n**Instance Property**\n\nThe index of the pointing device currently in proximity with the tablet.\n\n## Declaration\n\n```swift\nvar pointingDeviceID: Int { get }\n```\n\n## Discussion\n\nThis index is significant for multimode (or Dual Tracking) tablets that support multiple concurrent pointing devices; the index is incremented for each pointing device that comes into proximity. Otherwise, zero is always returned. This property is valid for mouse events with subtype `NSTabletProximityEventSubtype` or an event of type `NSTabletProximity`.\n\n## Getting tablet proximity information\n\n- **capabilityMask**: A mask that indicates the capabilities of the tablet device that generated this event.\n- **deviceID**: A special identifier the system matches against tablet-pointer and tablet-proximity events.\n- **isEnteringProximity**: A Boolean value that indicates whether a pointing device is entering or leaving the proximity of its tablet.\n- **pointingDeviceSerialNumber**: The vendor-assigned serial number of a pointing device.\n- **pointingDeviceType**: The kind of pointing device associated with this event.\n- **NSEvent.PointingDeviceType**: The pointing-device types for tablet-proximity events or mouse events with a proximity event subtype.\n- **systemTabletID**: The index of the tablet device connected to the system.\n- **tabletID**: The USB model identifier of the tablet device associated with this event.\n- **uniqueID**: The unique identifier of the pointing device that generated this event.\n- **vendorID**: The vendor identifier of the tablet associated with the event.\n- **vendorPointingDeviceType**: A coded bit field whose set bits indicate the type of pointing device (within a vendor selection) associated with the event.\n\n",
  "sections" : [
    {
      "content" : "",
      "items" : [
        {
          "description" : "A mask that indicates the capabilities of the tablet device that generated this event.",
          "name" : "capabilityMask",
          "url" : "https:\/\/developer.apple.com\/documentation\/AppKit\/NSEvent\/capabilityMask"
        },
        {
          "description" : "A special identifier the system matches against tablet-pointer and tablet-proximity events.",
          "name" : "deviceID",
          "url" : "https:\/\/developer.apple.com\/documentation\/AppKit\/NSEvent\/deviceID"
        },
        {
          "description" : "A Boolean value that indicates whether a pointing device is entering or leaving the proximity of its tablet.",
          "name" : "isEnteringProximity",
          "url" : "https:\/\/developer.apple.com\/documentation\/AppKit\/NSEvent\/isEnteringProximity"
        },
        {
          "description" : "The vendor-assigned serial number of a pointing device.",
          "name" : "pointingDeviceSerialNumber",
          "url" : "https:\/\/developer.apple.com\/documentation\/AppKit\/NSEvent\/pointingDeviceSerialNumber"
        },
        {
          "description" : "The kind of pointing device associated with this event.",
          "name" : "pointingDeviceType",
          "url" : "https:\/\/developer.apple.com\/documentation\/AppKit\/NSEvent\/pointingDeviceType-swift.property"
        },
        {
          "description" : "The pointing-device types for tablet-proximity events or mouse events with a proximity event subtype.",
          "name" : "NSEvent.PointingDeviceType",
          "url" : "https:\/\/developer.apple.com\/documentation\/AppKit\/NSEvent\/PointingDeviceType-swift.enum"
        },
        {
          "description" : "The index of the tablet device connected to the system.",
          "name" : "systemTabletID",
          "url" : "https:\/\/developer.apple.com\/documentation\/AppKit\/NSEvent\/systemTabletID"
        },
        {
          "description" : "The USB model identifier of the tablet device associated with this event.",
          "name" : "tabletID",
          "url" : "https:\/\/developer.apple.com\/documentation\/AppKit\/NSEvent\/tabletID"
        },
        {
          "description" : "The unique identifier of the pointing device that generated this event.",
          "name" : "uniqueID",
          "url" : "https:\/\/developer.apple.com\/documentation\/AppKit\/NSEvent\/uniqueID"
        },
        {
          "description" : "The vendor identifier of the tablet associated with the event.",
          "name" : "vendorID",
          "url" : "https:\/\/developer.apple.com\/documentation\/AppKit\/NSEvent\/vendorID"
        },
        {
          "description" : "A coded bit field whose set bits indicate the type of pointing device (within a vendor selection) associated with the event.",
          "name" : "vendorPointingDeviceType",
          "url" : "https:\/\/developer.apple.com\/documentation\/AppKit\/NSEvent\/vendorPointingDeviceType"
        }
      ],
      "title" : "Getting tablet proximity information"
    }
  ],
  "source" : "appleJSON",
  "title" : "pointingDeviceID",
  "url" : "https:\/\/developer.apple.com\/documentation\/AppKit\/NSEvent\/pointingDeviceID"
}