{
  "abstract" : "Draws an outline on drop target rows, and an insertion marker between rows. This style will automatically be set for source lists when the table’s [doc:\/\/com.apple.appkit\/documentation\/AppKit\/NSTableView\/unhideRows(at:withAnimation:)] is set to [doc:\/\/com.apple.appkit\/documentation\/AppKit\/NSTableView\/DraggingDestinationFeedbackStyle-swift.enum\/sourceList]. This is the standard look for Source Lists, but may be used in other areas as needed.",
  "codeExamples" : [

  ],
  "contentHash" : "1e0316bf463fe461e45aa4ea6be775acbd3a31793dc2a026e83355a9a744c69e",
  "crawledAt" : "2025-12-04T19:58:13Z",
  "declaration" : {
    "code" : "case sourceList",
    "language" : "swift"
  },
  "id" : "E51B7FF8-60D7-4D7A-BDE0-256504722A51",
  "kind" : "unknown",
  "language" : "swift",
  "module" : "AppKit",
  "platforms" : [
    "macOS"
  ],
  "rawMarkdown" : "---\nsource: https:\/\/developer.apple.com\/documentation\/AppKit\/NSTableView\/DraggingDestinationFeedbackStyle-swift.enum\/sourceList\ncrawled: 2025-12-04T19:58:13Z\n---\n\n# NSTableView.DraggingDestinationFeedbackStyle.sourceList\n\n**Case**\n\nDraws an outline on drop target rows, and an insertion marker between rows. This style will automatically be set for source lists when the table’s [doc:\/\/com.apple.appkit\/documentation\/AppKit\/NSTableView\/unhideRows(at:withAnimation:)] is set to [doc:\/\/com.apple.appkit\/documentation\/AppKit\/NSTableView\/DraggingDestinationFeedbackStyle-swift.enum\/sourceList]. This is the standard look for Source Lists, but may be used in other areas as needed.\n\n## Declaration\n\n```swift\ncase sourceList\n```\n\n## Constants\n\n- **NSTableView.DraggingDestinationFeedbackStyle.none**: Provides no feedback when the user drags over the table view. This option exists to allow subclasses to implement their dragging destination highlighting, or to make it not show anything all.\n- **NSTableView.DraggingDestinationFeedbackStyle.regular**: Draws a solid round-rect background on drop target rows, and an insertion marker between rows. This style should be used in most cases.\n- **NSTableView.DraggingDestinationFeedbackStyle.gap**: Provides a gap insertion when dragging over the table. Note that this style is only officially supported for [doc:\/\/com.apple.appkit\/documentation\/AppKit\/NSView]-based table views, but may partially work in Cell Based TableViews. The decision to use the gap style (compared to another style) can be made in [doc:\/\/com.apple.appkit\/documentation\/AppKit\/NSTableViewDataSource\/tableView(_:draggingSession:willBeginAt:forRowIndexes:)], or it can dynamically be changed.\n\n",
  "sections" : [
    {
      "content" : "",
      "items" : [
        {
          "description" : "Provides no feedback when the user drags over the table view. This option exists to allow subclasses to implement their dragging destination highlighting, or to make it not show anything all.",
          "name" : "NSTableView.DraggingDestinationFeedbackStyle.none",
          "url" : "https:\/\/developer.apple.com\/documentation\/AppKit\/NSTableView\/DraggingDestinationFeedbackStyle-swift.enum\/none"
        },
        {
          "description" : "Draws a solid round-rect background on drop target rows, and an insertion marker between rows. This style should be used in most cases.",
          "name" : "NSTableView.DraggingDestinationFeedbackStyle.regular",
          "url" : "https:\/\/developer.apple.com\/documentation\/AppKit\/NSTableView\/DraggingDestinationFeedbackStyle-swift.enum\/regular"
        },
        {
          "description" : "Provides a gap insertion when dragging over the table. Note that this style is only officially supported for [doc:\/\/com.apple.appkit\/documentation\/AppKit\/NSView]-based table views, but may partially work in Cell Based TableViews. The decision to use the gap style (compared to another style) can be made in [doc:\/\/com.apple.appkit\/documentation\/AppKit\/NSTableViewDataSource\/tableView(_:draggingSession:willBeginAt:forRowIndexes:)], or it can dynamically be changed.",
          "name" : "NSTableView.DraggingDestinationFeedbackStyle.gap",
          "url" : "https:\/\/developer.apple.com\/documentation\/AppKit\/NSTableView\/DraggingDestinationFeedbackStyle-swift.enum\/gap"
        }
      ],
      "title" : "Constants"
    }
  ],
  "source" : "appleJSON",
  "title" : "NSTableView.DraggingDestinationFeedbackStyle.sourceList",
  "url" : "https:\/\/developer.apple.com\/documentation\/AppKit\/NSTableView\/DraggingDestinationFeedbackStyle-swift.enum\/sourceList"
}