{
  "abstract" : "A required list of identifiers for items that you want to appear in the Touch Bar after instantiating it.",
  "codeExamples" : [

  ],
  "contentHash" : "b66f6319f450fae5b41c3f6a5f03df0a9ea851480846a27df74d0537dd35cff4",
  "crawledAt" : "2025-12-02T18:05:07Z",
  "declaration" : {
    "code" : "@MainActor var defaultItemIdentifiers: [NSTouchBarItem.Identifier] { get set }",
    "language" : "swift"
  },
  "id" : "621036FE-1793-4D1F-B4F0-EA82CEA79FE7",
  "kind" : "property",
  "language" : "swift",
  "module" : "AppKit",
  "overview" : "## Discussion\n\nAlways specify this property for an [doc:\/\/com.apple.appkit\/documentation\/AppKit\/NSTouchBar] object, even if you elect to make the bar noncustomizable. The system:\n\nThe system archives this property.",
  "platforms" : [
    "Mac Catalyst",
    "macOS"
  ],
  "rawMarkdown" : "---\nsource: https:\/\/developer.apple.com\/documentation\/AppKit\/NSTouchBar\/defaultItemIdentifiers\ncrawled: 2025-12-02T18:05:07Z\n---\n\n# defaultItemIdentifiers\n\n**Instance Property**\n\nA required list of identifiers for items that you want to appear in the Touch Bar after instantiating it.\n\n## Declaration\n\n```swift\n@MainActor var defaultItemIdentifiers: [NSTouchBarItem.Identifier] { get set }\n```\n\n## Discussion\n\nAlways specify this property for an [doc:\/\/com.apple.appkit\/documentation\/AppKit\/NSTouchBar] object, even if you elect to make the bar noncustomizable. The system:\n\n- Shows this list’s items by default when the system displays the bar.\n- Includes a preconfigured bar, containing these items, in the associated customization UI (when you have assigned the bar a [doc:\/\/com.apple.appkit\/documentation\/AppKit\/NSTouchBar\/customizationIdentifier-swift.property] property value); the user can drag the default bar into the Touch Bar, should they want to return to the default configuration.\n\nThe system archives this property.\n\n## Related Documentation\n\n- **customizationIdentifier**: A globally unique string that makes the Touch Bar eligible for user customization.\n- **customizationRequiredItemIdentifiers**: An optional list of identifiers for items you want to always appear in the Touch Bar and which the user can’t remove during customization.\n- **customizationAllowedItemIdentifiers**: A list of identifiers for items to show in the Touch Bar’s customization UI.\n- **itemIdentifiers**: The list of identifiers for the current items in the Touch Bar.\n\n## Providing bar items\n\n- **delegate**: The delegate that provides items to the Touch Bar.\n- **templateItems**: The primary source of items that the Touch Bar uses to fill its private items array, unless you provide items using a delegate.\n- **principalItemIdentifier**: The identifier of an item you want the system to center in the Touch Bar.\n- **escapeKeyReplacementItemIdentifier**: The identifier of an item that replaces the system-provided button in the Touch Bar.\n\n",
  "sections" : [
    {
      "content" : "",
      "items" : [
        {
          "description" : "A globally unique string that makes the Touch Bar eligible for user customization.",
          "name" : "customizationIdentifier",
          "url" : "https:\/\/developer.apple.com\/documentation\/AppKit\/NSTouchBar\/customizationIdentifier-swift.property"
        },
        {
          "description" : "An optional list of identifiers for items you want to always appear in the Touch Bar and which the user can’t remove during customization.",
          "name" : "customizationRequiredItemIdentifiers",
          "url" : "https:\/\/developer.apple.com\/documentation\/AppKit\/NSTouchBar\/customizationRequiredItemIdentifiers"
        },
        {
          "description" : "A list of identifiers for items to show in the Touch Bar’s customization UI.",
          "name" : "customizationAllowedItemIdentifiers",
          "url" : "https:\/\/developer.apple.com\/documentation\/AppKit\/NSTouchBar\/customizationAllowedItemIdentifiers"
        },
        {
          "description" : "The list of identifiers for the current items in the Touch Bar.",
          "name" : "itemIdentifiers",
          "url" : "https:\/\/developer.apple.com\/documentation\/AppKit\/NSTouchBar\/itemIdentifiers"
        }
      ],
      "title" : "Related Documentation"
    },
    {
      "content" : "",
      "items" : [
        {
          "description" : "The delegate that provides items to the Touch Bar.",
          "name" : "delegate",
          "url" : "https:\/\/developer.apple.com\/documentation\/AppKit\/NSTouchBar\/delegate"
        },
        {
          "description" : "The primary source of items that the Touch Bar uses to fill its private items array, unless you provide items using a delegate.",
          "name" : "templateItems",
          "url" : "https:\/\/developer.apple.com\/documentation\/AppKit\/NSTouchBar\/templateItems"
        },
        {
          "description" : "The identifier of an item you want the system to center in the Touch Bar.",
          "name" : "principalItemIdentifier",
          "url" : "https:\/\/developer.apple.com\/documentation\/AppKit\/NSTouchBar\/principalItemIdentifier"
        },
        {
          "description" : "The identifier of an item that replaces the system-provided button in the Touch Bar.",
          "name" : "escapeKeyReplacementItemIdentifier",
          "url" : "https:\/\/developer.apple.com\/documentation\/AppKit\/NSTouchBar\/escapeKeyReplacementItemIdentifier"
        }
      ],
      "title" : "Providing bar items"
    }
  ],
  "source" : "appleJSON",
  "title" : "defaultItemIdentifiers",
  "url" : "https:\/\/developer.apple.com\/documentation\/AppKit\/NSTouchBar\/defaultItemIdentifiers"
}