{
  "abstract" : "Modifies and returns a frame rectangle so that its top edge lies on a specific screen.",
  "codeExamples" : [

  ],
  "contentHash" : "5d6b715b5d6403c99bc0de3ef837b8d0c0d5efde9dece55286a12b42c7d9d022",
  "crawledAt" : "2025-12-01T14:00:43Z",
  "declaration" : {
    "code" : "@MainActor func constrainFrameRect(_ frameRect: NSRect, to screen: NSScreen?) -> NSRect",
    "language" : "swift"
  },
  "id" : "521BF669-D72F-44D1-AACA-5386D8A71818",
  "kind" : "method",
  "module" : "AppKit",
  "overview" : "## Return Value\n\nThe adjusted frame rectangle.\n\n## Discussion\n\nIf the window is resizable and the window’s height is greater than the screen height, the rectangle’s height is adjusted to fit within the screen as well. The rectangle’s width and horizontal location are unaffected. You shouldn’t need to invoke this method yourself; it’s invoked automatically (and the modified frame is used to locate and set the size of the window) whenever a titled `NSWindow` object is placed onscreen and whenever its size is changed.\n\nSubclasses can override this method to prevent their instances from being constrained or to constrain them differently.",
  "platforms" : [
    "macOS"
  ],
  "rawMarkdown" : "---\nsource: https:\/\/developer.apple.com\/documentation\/AppKit\/NSWindow\/constrainFrameRect(_:to:)\ncrawled: 2025-12-01T14:00:43Z\n---\n\n# constrainFrameRect(_:to:)\n\n**Instance Method**\n\nModifies and returns a frame rectangle so that its top edge lies on a specific screen.\n\n## Declaration\n\n```swift\n@MainActor func constrainFrameRect(_ frameRect: NSRect, to screen: NSScreen?) -> NSRect\n```\n\n## Parameters\n\n- **frameRect**: The proposed frame rectangle to adjust.\n- **screen**: The screen on which the top edge of the window’s frame is to lie.\n\n## Return Value\n\nThe adjusted frame rectangle.\n\n## Discussion\n\nIf the window is resizable and the window’s height is greater than the screen height, the rectangle’s height is adjusted to fit within the screen as well. The rectangle’s width and horizontal location are unaffected. You shouldn’t need to invoke this method yourself; it’s invoked automatically (and the modified frame is used to locate and set the size of the window) whenever a titled `NSWindow` object is placed onscreen and whenever its size is changed.\n\nSubclasses can override this method to prevent their instances from being constrained or to constrain them differently.\n\n## Sizing Windows\n\n- **frame**: The window’s frame rectangle in screen coordinates, including the title bar.\n- **setFrameOrigin(_:)**: Positions the bottom-left corner of the window’s frame rectangle at a given point in screen coordinates.\n- **setFrameTopLeftPoint(_:)**: Positions the top-left corner of the window’s frame rectangle at a given point in screen coordinates.\n- **cascadeTopLeft(from:)**: Positions the window’s top-left to a given point.\n- **setFrame(_:display:)**: Sets the origin and size of the window’s frame rectangle according to a given frame rectangle, thereby setting its position and size onscreen.\n- **setFrame(_:display:animate:)**: Sets the origin and size of the window’s frame rectangle, with optional animation, according to a given frame rectangle, thereby setting its position and size onscreen.\n- **animationResizeTime(_:)**: Specifies the duration of a smooth frame-size change.\n- **aspectRatio**: The window’s aspect ratio, which constrains the size of its frame rectangle to integral multiples of this ratio when the user resizes it.\n- **minSize**: The minimum size to which the window’s frame (including its title bar) can be sized.\n- **maxSize**: The maximum size to which the window’s frame (including its title bar) can be sized.\n- **isZoomed**: A Boolean value that indicates whether the window is in a zoomed state.\n- **performZoom(_:)**: This action method simulates the user clicking the zoom box by momentarily highlighting the button and then zooming the window.\n- **zoom(_:)**: Toggles the size and location of the window between its standard state (which the application provides as the best size to display the window’s data) and its user state (a new size and location the user may have set by moving or resizing the window).\n- **resizeFlags**: The flags field of the event record for the mouse-down event that initiated the resizing session.\n- **resizeIncrements**: The window’s resizing increments.\n\n",
  "sections" : [
    {
      "content" : "",
      "items" : [
        {
          "description" : "The window’s frame rectangle in screen coordinates, including the title bar.",
          "name" : "frame",
          "url" : "https:\/\/developer.apple.com\/documentation\/AppKit\/NSWindow\/frame"
        },
        {
          "description" : "Positions the bottom-left corner of the window’s frame rectangle at a given point in screen coordinates.",
          "name" : "setFrameOrigin(_:)",
          "url" : "https:\/\/developer.apple.com\/documentation\/AppKit\/NSWindow\/setFrameOrigin(_:)"
        },
        {
          "description" : "Positions the top-left corner of the window’s frame rectangle at a given point in screen coordinates.",
          "name" : "setFrameTopLeftPoint(_:)",
          "url" : "https:\/\/developer.apple.com\/documentation\/AppKit\/NSWindow\/setFrameTopLeftPoint(_:)"
        },
        {
          "description" : "Positions the window’s top-left to a given point.",
          "name" : "cascadeTopLeft(from:)",
          "url" : "https:\/\/developer.apple.com\/documentation\/AppKit\/NSWindow\/cascadeTopLeft(from:)"
        },
        {
          "description" : "Sets the origin and size of the window’s frame rectangle according to a given frame rectangle, thereby setting its position and size onscreen.",
          "name" : "setFrame(_:display:)",
          "url" : "https:\/\/developer.apple.com\/documentation\/AppKit\/NSWindow\/setFrame(_:display:)"
        },
        {
          "description" : "Sets the origin and size of the window’s frame rectangle, with optional animation, according to a given frame rectangle, thereby setting its position and size onscreen.",
          "name" : "setFrame(_:display:animate:)",
          "url" : "https:\/\/developer.apple.com\/documentation\/AppKit\/NSWindow\/setFrame(_:display:animate:)"
        },
        {
          "description" : "Specifies the duration of a smooth frame-size change.",
          "name" : "animationResizeTime(_:)",
          "url" : "https:\/\/developer.apple.com\/documentation\/AppKit\/NSWindow\/animationResizeTime(_:)"
        },
        {
          "description" : "The window’s aspect ratio, which constrains the size of its frame rectangle to integral multiples of this ratio when the user resizes it.",
          "name" : "aspectRatio",
          "url" : "https:\/\/developer.apple.com\/documentation\/AppKit\/NSWindow\/aspectRatio"
        },
        {
          "description" : "The minimum size to which the window’s frame (including its title bar) can be sized.",
          "name" : "minSize",
          "url" : "https:\/\/developer.apple.com\/documentation\/AppKit\/NSWindow\/minSize"
        },
        {
          "description" : "The maximum size to which the window’s frame (including its title bar) can be sized.",
          "name" : "maxSize",
          "url" : "https:\/\/developer.apple.com\/documentation\/AppKit\/NSWindow\/maxSize"
        },
        {
          "description" : "A Boolean value that indicates whether the window is in a zoomed state.",
          "name" : "isZoomed",
          "url" : "https:\/\/developer.apple.com\/documentation\/AppKit\/NSWindow\/isZoomed"
        },
        {
          "description" : "This action method simulates the user clicking the zoom box by momentarily highlighting the button and then zooming the window.",
          "name" : "performZoom(_:)",
          "url" : "https:\/\/developer.apple.com\/documentation\/AppKit\/NSWindow\/performZoom(_:)"
        },
        {
          "description" : "Toggles the size and location of the window between its standard state (which the application provides as the best size to display the window’s data) and its user state (a new size and location the user may have set by moving or resizing the window).",
          "name" : "zoom(_:)",
          "url" : "https:\/\/developer.apple.com\/documentation\/AppKit\/NSWindow\/zoom(_:)"
        },
        {
          "description" : "The flags field of the event record for the mouse-down event that initiated the resizing session.",
          "name" : "resizeFlags",
          "url" : "https:\/\/developer.apple.com\/documentation\/AppKit\/NSWindow\/resizeFlags"
        },
        {
          "description" : "The window’s resizing increments.",
          "name" : "resizeIncrements",
          "url" : "https:\/\/developer.apple.com\/documentation\/AppKit\/NSWindow\/resizeIncrements"
        }
      ],
      "title" : "Sizing Windows"
    }
  ],
  "source" : "appleJSON",
  "title" : "constrainFrameRect(_:to:)",
  "url" : "https:\/\/developer.apple.com\/documentation\/AppKit\/NSWindow\/constrainFrameRect(_:to:)"
}