{
  "abstract" : "Returns the type of drag operation that should be performed if the image were released now.",
  "codeExamples" : [

  ],
  "contentHash" : "209ef37f5975af73e80c1a6d0bcd7f7ede63b9f90fdba0ddad310010c6ddb2a4",
  "crawledAt" : "2025-12-01T13:27:26Z",
  "declaration" : {
    "code" : "@MainActor func dragOperation(for dragInfo: any NSDraggingInfo, type: NSPasteboard.PasteboardType) -> NSDragOperation",
    "language" : "swift"
  },
  "id" : "19DE8C87-B49F-42C1-A5F8-D1986EB1327A",
  "kind" : "method",
  "module" : "AppKit",
  "overview" : "## Return Value\n\nThe drag operation that should be performed if the image were released now.\n\n## Discussion\n\nThe returned value should be one of the following:\n\nIf none of the operations is appropriate, this method should return `NSDragOperationNone`.\n\nThis method is called repeatedly from [doc:\/\/com.apple.appkit\/documentation\/AppKit\/NSDraggingDestination\/draggingEntered(_:)] and [doc:\/\/com.apple.appkit\/documentation\/AppKit\/NSDraggingDestination\/draggingUpdated(_:)] as the user drags the image.",
  "platforms" : [
    "macOS"
  ],
  "rawMarkdown" : "---\nsource: https:\/\/developer.apple.com\/documentation\/AppKit\/NSTextView\/dragOperation(for:type:)\ncrawled: 2025-12-01T13:27:26Z\n---\n\n# dragOperation(for:type:)\n\n**Instance Method**\n\nReturns the type of drag operation that should be performed if the image were released now.\n\n## Declaration\n\n```swift\n@MainActor func dragOperation(for dragInfo: any NSDraggingInfo, type: NSPasteboard.PasteboardType) -> NSDragOperation\n```\n\n## Parameters\n\n- **dragInfo**: The drag information.\n- **type**: The pasteboard type that will be read from the dragging pasteboard.\n\n## Return Value\n\nThe drag operation that should be performed if the image were released now.\n\n## Discussion\n\nThe returned value should be one of the following:\n\n\n\nIf none of the operations is appropriate, this method should return `NSDragOperationNone`.\n\nThis method is called repeatedly from [doc:\/\/com.apple.appkit\/documentation\/AppKit\/NSDraggingDestination\/draggingEntered(_:)] and [doc:\/\/com.apple.appkit\/documentation\/AppKit\/NSDraggingDestination\/draggingUpdated(_:)] as the user drags the image.\n\n## Related Documentation\n\n- **draggingUpdated(_:)**: Invoked periodically as the image is held within the destination area, allowing modification of the dragging operation or mouse-pointer position.\n- **draggingEntered(_:)**: Invoked when the dragged image enters destination bounds or frame; delegate returns dragging operation to perform.\n\n## Dragging\n\n- **dragImageForSelection(with:origin:)**: Returns an appropriate drag image for the drag initiated by the specified event.\n- **dragSelection(with:offset:slideBack:)**: Begins dragging the current selected text range.\n- **acceptsGlyphInfo**: A Boolean value that indicates whether the receiver accepts the glyph info attribute.\n\n",
  "sections" : [
    {
      "content" : "",
      "items" : [
        {
          "description" : "Invoked periodically as the image is held within the destination area, allowing modification of the dragging operation or mouse-pointer position.",
          "name" : "draggingUpdated(_:)",
          "url" : "https:\/\/developer.apple.com\/documentation\/AppKit\/NSDraggingDestination\/draggingUpdated(_:)"
        },
        {
          "description" : "Invoked when the dragged image enters destination bounds or frame; delegate returns dragging operation to perform.",
          "name" : "draggingEntered(_:)",
          "url" : "https:\/\/developer.apple.com\/documentation\/AppKit\/NSDraggingDestination\/draggingEntered(_:)"
        }
      ],
      "title" : "Related Documentation"
    },
    {
      "content" : "",
      "items" : [
        {
          "description" : "Returns an appropriate drag image for the drag initiated by the specified event.",
          "name" : "dragImageForSelection(with:origin:)",
          "url" : "https:\/\/developer.apple.com\/documentation\/AppKit\/NSTextView\/dragImageForSelection(with:origin:)"
        },
        {
          "description" : "Begins dragging the current selected text range.",
          "name" : "dragSelection(with:offset:slideBack:)",
          "url" : "https:\/\/developer.apple.com\/documentation\/AppKit\/NSTextView\/dragSelection(with:offset:slideBack:)"
        },
        {
          "description" : "A Boolean value that indicates whether the receiver accepts the glyph info attribute.",
          "name" : "acceptsGlyphInfo",
          "url" : "https:\/\/developer.apple.com\/documentation\/AppKit\/NSTextView\/acceptsGlyphInfo"
        }
      ],
      "title" : "Dragging"
    }
  ],
  "source" : "appleJSON",
  "title" : "dragOperation(for:type:)",
  "url" : "https:\/\/developer.apple.com\/documentation\/AppKit\/NSTextView\/dragOperation(for:type:)"
}