{
  "abstract" : "The maximum number of rows to display in the collection view’s visible area.",
  "codeExamples" : [

  ],
  "contentHash" : "8d2087669419c6cb7d49b107f85ff917cf371a268f70e458deec8ead9bb70df3",
  "crawledAt" : "2025-12-05T20:17:59Z",
  "declaration" : {
    "code" : "@MainActor var maximumNumberOfRows: Int { get set }",
    "language" : "swift"
  },
  "id" : "A2781AA8-BBE0-49CA-B4FC-18408F66F95F",
  "kind" : "property",
  "language" : "swift",
  "module" : "AppKit",
  "overview" : "## Discussion\n\nUse this value to specify the maximum number of rows to display in the collection view at any given time. The grid layout object uses this value during layout to configure the position and spacing of items. The default value of this property is `0`, which means that there is no maximum number of rows.",
  "platforms" : [
    "macOS"
  ],
  "rawMarkdown" : "---\nsource: https:\/\/developer.apple.com\/documentation\/AppKit\/NSCollectionViewGridLayout\/maximumNumberOfRows\ncrawled: 2025-12-05T20:17:59Z\n---\n\n# maximumNumberOfRows\n\n**Instance Property**\n\nThe maximum number of rows to display in the collection view’s visible area.\n\n## Declaration\n\n```swift\n@MainActor var maximumNumberOfRows: Int { get set }\n```\n\n## Discussion\n\nUse this value to specify the maximum number of rows to display in the collection view at any given time. The grid layout object uses this value during layout to configure the position and spacing of items. The default value of this property is `0`, which means that there is no maximum number of rows.\n\n## Specifying the Grid Parameters\n\n- **maximumNumberOfColumns**: The maximum number of columns to display in the collection view’s visible area.\n- **minimumItemSize**: The smallest allowable size for an item’s view.\n- **maximumItemSize**: The largest allowable size for an item’s view.\n\n",
  "sections" : [
    {
      "content" : "",
      "items" : [
        {
          "description" : "The maximum number of columns to display in the collection view’s visible area.",
          "name" : "maximumNumberOfColumns",
          "url" : "https:\/\/developer.apple.com\/documentation\/AppKit\/NSCollectionViewGridLayout\/maximumNumberOfColumns"
        },
        {
          "description" : "The smallest allowable size for an item’s view.",
          "name" : "minimumItemSize",
          "url" : "https:\/\/developer.apple.com\/documentation\/AppKit\/NSCollectionViewGridLayout\/minimumItemSize"
        },
        {
          "description" : "The largest allowable size for an item’s view.",
          "name" : "maximumItemSize",
          "url" : "https:\/\/developer.apple.com\/documentation\/AppKit\/NSCollectionViewGridLayout\/maximumItemSize"
        }
      ],
      "title" : "Specifying the Grid Parameters"
    }
  ],
  "source" : "appleJSON",
  "title" : "maximumNumberOfRows",
  "url" : "https:\/\/developer.apple.com\/documentation\/AppKit\/NSCollectionViewGridLayout\/maximumNumberOfRows"
}