{
  "abstract" : "Creates a new image using the contents of the provided image.",
  "codeExamples" : [

  ],
  "contentHash" : "157d5aef10f17500c66947a59ee5810a4280c88b7b009bb2f9824648ca7d1a67",
  "crawledAt" : "2025-12-03T04:14:11Z",
  "declaration" : {
    "code" : "convenience init(cgImage: CGImage, size: NSSize)",
    "language" : "swift"
  },
  "id" : "EE1FB167-77BD-41A6-A77C-B3E108156402",
  "kind" : "unknown",
  "language" : "swift",
  "module" : "AppKit",
  "overview" : "## Discussion\n\nDon’t assume anything about the image, other than drawing it is equivalent to drawing the source image.\n\nThis is not a designated initializer.",
  "platforms" : [
    "macOS"
  ],
  "rawMarkdown" : "---\nsource: https:\/\/developer.apple.com\/documentation\/AppKit\/NSImage\/init(cgImage:size:)\ncrawled: 2025-12-03T04:14:11Z\n---\n\n# init(cgImage:size:)\n\n**Initializer**\n\nCreates a new image using the contents of the provided image.\n\n## Declaration\n\n```swift\nconvenience init(cgImage: CGImage, size: NSSize)\n```\n\n## Parameters\n\n- **cgImage**: The source image.\n- **size**: The size of the new image. Use [doc:\/\/com.apple.documentation\/documentation\/CoreFoundation\/CGSize\/zero], or [doc:\/\/com.apple.documentation\/documentation\/Foundation\/NSZeroSize] in Objective-C, to have the new image adopt the pixel dimensions of the source image.\n\n## Discussion\n\nDon’t assume anything about the image, other than drawing it is equivalent to drawing the source image.\n\nThis is not a designated initializer.\n\n## Creating Images from Existing Data\n\n- **init(data:)**: Initializes and returns an image object using the provided image data.\n- **init(dataIgnoringOrientation:)**: Initializes and returns an image object using the provided image data and ignoring the EXIF orientation tags.\n- **init(pasteboard:)**: Initializes and returns an image object with data from the specified pasteboard.\n- **init(coder:)**: Initializes and returns an image object from data in an unarchiver.\n\n",
  "sections" : [
    {
      "content" : "",
      "items" : [
        {
          "description" : "Initializes and returns an image object using the provided image data.",
          "name" : "init(data:)",
          "url" : "https:\/\/developer.apple.com\/documentation\/AppKit\/NSImage\/init(data:)"
        },
        {
          "description" : "Initializes and returns an image object using the provided image data and ignoring the EXIF orientation tags.",
          "name" : "init(dataIgnoringOrientation:)",
          "url" : "https:\/\/developer.apple.com\/documentation\/AppKit\/NSImage\/init(dataIgnoringOrientation:)"
        },
        {
          "description" : "Initializes and returns an image object with data from the specified pasteboard.",
          "name" : "init(pasteboard:)",
          "url" : "https:\/\/developer.apple.com\/documentation\/AppKit\/NSImage\/init(pasteboard:)"
        },
        {
          "description" : "Initializes and returns an image object from data in an unarchiver.",
          "name" : "init(coder:)",
          "url" : "https:\/\/developer.apple.com\/documentation\/AppKit\/NSImage\/init(coder:)"
        }
      ],
      "title" : "Creating Images from Existing Data"
    }
  ],
  "source" : "appleJSON",
  "title" : "init(cgImage:size:)",
  "url" : "https:\/\/developer.apple.com\/documentation\/AppKit\/NSImage\/init(cgImage:size:)"
}