{
  "abstract" : "Presents an error alert to the user as a modal panel.",
  "codeExamples" : [
    {
      "code" : "- (void)didPresentErrorWithRecovery:(BOOL)didRecover contextInfo:(void  *)contextInfo;",
      "language" : "objc"
    }
  ],
  "contentHash" : "f195fe81be499fc05d722e23b886c4f78cb50514203f3881151111e9d9b05e4f",
  "crawledAt" : "2025-12-02T18:10:04Z",
  "declaration" : {
    "code" : "@MainActor func presentError(_ error: any Error, modalFor window: NSWindow, delegate: Any?, didPresent didPresentSelector: Selector?, contextInfo: UnsafeMutableRawPointer?)",
    "language" : "swift"
  },
  "id" : "62F3F1E6-552E-4909-A8B6-383B2C15F072",
  "kind" : "method",
  "language" : "swift",
  "module" : "AppKit",
  "overview" : "## Discussion\n\nWhen the user dismisses the alert and any recovery possible for the error and chosen by the user has been attempted, sends the message `didPresentSelector` to the specified `delegate`. The method selected by `didPresentSelector` must have the same signature as:\n\nThe default `NSDocumentController` implementation of this method is equivalent to that of `NSResponder` while treating the application object as the next responder and forwarding error presentation messages to it. (The default `NSDocument` implementation of this method treats the shared `NSDocumentController` instance as the next responder and forwards these messages to it.)\n\nThe default implementation of this method calls [doc:\/\/com.apple.appkit\/documentation\/AppKit\/NSDocumentController\/willPresentError(_:)] to give subclasses an opportunity to customize error presentation. You should not override this method but should instead override [doc:\/\/com.apple.appkit\/documentation\/AppKit\/NSDocumentController\/willPresentError(_:)].",
  "platforms" : [
    "macOS"
  ],
  "rawMarkdown" : "---\nsource: https:\/\/developer.apple.com\/documentation\/AppKit\/NSDocumentController\/presentError(_:modalFor:delegate:didPresent:contextInfo:)\ncrawled: 2025-12-02T18:10:04Z\n---\n\n# presentError(_:modalFor:delegate:didPresent:contextInfo:)\n\n**Instance Method**\n\nPresents an error alert to the user as a modal panel.\n\n## Declaration\n\n```swift\n@MainActor func presentError(_ error: any Error, modalFor window: NSWindow, delegate: Any?, didPresent didPresentSelector: Selector?, contextInfo: UnsafeMutableRawPointer?)\n```\n\n## Parameters\n\n- **error**: The error to present.\n- **window**: The window to present the error.\n- **delegate**: The object to receive the selector.\n- **didPresentSelector**: The selector to send to the delegate.\n- **contextInfo**: A pointer to user-supplied data.\n\n## Discussion\n\nWhen the user dismisses the alert and any recovery possible for the error and chosen by the user has been attempted, sends the message `didPresentSelector` to the specified `delegate`. The method selected by `didPresentSelector` must have the same signature as:\n\n```objc\n- (void)didPresentErrorWithRecovery:(BOOL)didRecover contextInfo:(void  *)contextInfo;\n```\n\nThe default `NSDocumentController` implementation of this method is equivalent to that of `NSResponder` while treating the application object as the next responder and forwarding error presentation messages to it. (The default `NSDocument` implementation of this method treats the shared `NSDocumentController` instance as the next responder and forwards these messages to it.)\n\nThe default implementation of this method calls [doc:\/\/com.apple.appkit\/documentation\/AppKit\/NSDocumentController\/willPresentError(_:)] to give subclasses an opportunity to customize error presentation. You should not override this method but should instead override [doc:\/\/com.apple.appkit\/documentation\/AppKit\/NSDocumentController\/willPresentError(_:)].\n\n## Handling Errors\n\n- **presentError(_:)**: Presents an error alert to the user as a modal panel.\n- **willPresentError(_:)**: Indicates an error condition and provides the opportunity to return the same or a different error.\n\n",
  "sections" : [
    {
      "content" : "",
      "items" : [
        {
          "description" : "Presents an error alert to the user as a modal panel.",
          "name" : "presentError(_:)",
          "url" : "https:\/\/developer.apple.com\/documentation\/AppKit\/NSDocumentController\/presentError(_:)"
        },
        {
          "description" : "Indicates an error condition and provides the opportunity to return the same or a different error.",
          "name" : "willPresentError(_:)",
          "url" : "https:\/\/developer.apple.com\/documentation\/AppKit\/NSDocumentController\/willPresentError(_:)"
        }
      ],
      "title" : "Handling Errors"
    }
  ],
  "source" : "appleJSON",
  "title" : "presentError(_:modalFor:delegate:didPresent:contextInfo:)",
  "url" : "https:\/\/developer.apple.com\/documentation\/AppKit\/NSDocumentController\/presentError(_:modalFor:delegate:didPresent:contextInfo:)"
}