{
  "abstract" : "The preferred width of the form’s cells when using Auto Layout.",
  "codeExamples" : [

  ],
  "contentHash" : "ee7bf451cc2613acb012f83910ceb38c3dd69ebb72850f6bfd58fe13222ecde7",
  "crawledAt" : "2025-12-03T08:49:06Z",
  "declaration" : {
    "code" : "@MainActor func preferredTextFieldWidth() -> CGFloat",
    "language" : "swift"
  },
  "id" : "0C1E652C-B53C-40AB-9F43-D86F180BC0F4",
  "kind" : "method",
  "language" : "swift",
  "module" : "AppKit",
  "overview" : "## Return Value\n\nThe field’s width.\n\n## Discussion\n\nIf the width is negative, the [doc:\/\/com.apple.appkit\/documentation\/AppKit\/NSCell\/cellSize] matches the historic behavior, which is that it is large enough to accommodate the title, bezel, and the current text.\n\nThe default is -1.",
  "platforms" : [
    "macOS"
  ],
  "rawMarkdown" : "---\nsource: https:\/\/developer.apple.com\/documentation\/AppKit\/NSForm\/preferredTextFieldWidth()\ncrawled: 2025-12-03T08:49:06Z\n---\n\n# preferredTextFieldWidth()\n\n**Instance Method**\n\nThe preferred width of the form’s cells when using Auto Layout.\n\n## Declaration\n\n```swift\n@MainActor func preferredTextFieldWidth() -> CGFloat\n```\n\n## Return Value\n\nThe field’s width.\n\n## Discussion\n\nIf the width is negative, the [doc:\/\/com.apple.appkit\/documentation\/AppKit\/NSCell\/cellSize] matches the historic behavior, which is that it is large enough to accommodate the title, bezel, and the current text.\n\nThe default is -1.\n\n## Auto Layout Sizing\n\n- **setPreferredTextFieldWidth(_:)**: Sets the preferred text field width used by Auto Layout.\n\n",
  "sections" : [
    {
      "content" : "",
      "items" : [
        {
          "description" : "Sets the preferred text field width used by Auto Layout.",
          "name" : "setPreferredTextFieldWidth(_:)",
          "url" : "https:\/\/developer.apple.com\/documentation\/AppKit\/NSForm\/setPreferredTextFieldWidth(_:)"
        }
      ],
      "title" : "Auto Layout Sizing"
    }
  ],
  "source" : "appleJSON",
  "title" : "preferredTextFieldWidth()",
  "url" : "https:\/\/developer.apple.com\/documentation\/AppKit\/NSForm\/preferredTextFieldWidth()"
}