{
  "abstract" : "Tells the delegate that the app’s initialization is complete but it hasn’t received its first event.",
  "codeExamples" : [

  ],
  "contentHash" : "833cb4ef20d1257a74f51efd1b6989368ecc6e06813435c7e95c522fbe64f050",
  "crawledAt" : "2025-12-04T12:06:45Z",
  "declaration" : {
    "code" : "@MainActor optional func applicationDidFinishLaunching(_ notification: Notification)",
    "language" : "swift"
  },
  "id" : "44C3E7D6-10B2-4D6D-8E2E-A02A30E63307",
  "kind" : "method",
  "language" : "swift",
  "module" : "AppKit",
  "overview" : "## Discussion\n\nDelegates can implement this method to perform further initialization. This method is called after the application’s main run loop has been started but before it has processed any events. If the application was launched by the user opening a file, the delegate’s  [doc:\/\/com.apple.appkit\/documentation\/AppKit\/NSApplicationDelegate\/application(_:openFile:)] method is called before this method. If you want to perform initialization before any files are opened, implement the [doc:\/\/com.apple.appkit\/documentation\/AppKit\/NSApplicationDelegate\/applicationWillFinishLaunching(_:)] method in your delegate, which is called before [doc:\/\/com.apple.appkit\/documentation\/AppKit\/NSApplicationDelegate\/application(_:openFile:)].)",
  "platforms" : [
    "macOS"
  ],
  "rawMarkdown" : "---\nsource: https:\/\/developer.apple.com\/documentation\/AppKit\/NSApplicationDelegate\/applicationDidFinishLaunching(_:)\ncrawled: 2025-12-04T12:06:45Z\n---\n\n# applicationDidFinishLaunching(_:)\n\n**Instance Method**\n\nTells the delegate that the app’s initialization is complete but it hasn’t received its first event.\n\n## Declaration\n\n```swift\n@MainActor optional func applicationDidFinishLaunching(_ notification: Notification)\n```\n\n## Parameters\n\n- **notification**: A notification named [doc:\/\/com.apple.appkit\/documentation\/AppKit\/NSApplication\/didFinishLaunchingNotification]. Calling the [doc:\/\/com.apple.documentation\/documentation\/Foundation\/NSNotification\/object] method of this notification returns the `NSApplication` object itself.\n\n## Discussion\n\nDelegates can implement this method to perform further initialization. This method is called after the application’s main run loop has been started but before it has processed any events. If the application was launched by the user opening a file, the delegate’s  [doc:\/\/com.apple.appkit\/documentation\/AppKit\/NSApplicationDelegate\/application(_:openFile:)] method is called before this method. If you want to perform initialization before any files are opened, implement the [doc:\/\/com.apple.appkit\/documentation\/AppKit\/NSApplicationDelegate\/applicationWillFinishLaunching(_:)] method in your delegate, which is called before [doc:\/\/com.apple.appkit\/documentation\/AppKit\/NSApplicationDelegate\/application(_:openFile:)].)\n\n## Related Documentation\n\n- **finishLaunching()**: Activates the app, opens any files specified by the `NSOpen` user default, and unhighlights the app’s icon.\n- **application(_:openFile:)**: Returns a Boolean value that indicates if the app opens the specified file.\n- **applicationDidBecomeActive(_:)**: Tells the delegate that the app is now active.\n\n## Launching Applications\n\n- **applicationWillFinishLaunching(_:)**: Tells the delegate that the app’s initialization is about to complete.\n- **NSApplicationDidFinishLaunching User Info Keys**: The keys you use to access values in the launch options dictionary that the system passes to your app at initialization.\n\n",
  "sections" : [
    {
      "content" : "",
      "items" : [
        {
          "description" : "Activates the app, opens any files specified by the `NSOpen` user default, and unhighlights the app’s icon.",
          "name" : "finishLaunching()",
          "url" : "https:\/\/developer.apple.com\/documentation\/AppKit\/NSApplication\/finishLaunching()"
        },
        {
          "description" : "Returns a Boolean value that indicates if the app opens the specified file.",
          "name" : "application(_:openFile:)",
          "url" : "https:\/\/developer.apple.com\/documentation\/AppKit\/NSApplicationDelegate\/application(_:openFile:)"
        },
        {
          "description" : "Tells the delegate that the app is now active.",
          "name" : "applicationDidBecomeActive(_:)",
          "url" : "https:\/\/developer.apple.com\/documentation\/AppKit\/NSApplicationDelegate\/applicationDidBecomeActive(_:)"
        }
      ],
      "title" : "Related Documentation"
    },
    {
      "content" : "",
      "items" : [
        {
          "description" : "Tells the delegate that the app’s initialization is about to complete.",
          "name" : "applicationWillFinishLaunching(_:)",
          "url" : "https:\/\/developer.apple.com\/documentation\/AppKit\/NSApplicationDelegate\/applicationWillFinishLaunching(_:)"
        },
        {
          "description" : "The keys you use to access values in the launch options dictionary that the system passes to your app at initialization.",
          "name" : "NSApplicationDidFinishLaunching User Info Keys",
          "url" : "https:\/\/developer.apple.com\/documentation\/AppKit\/nsapplicationdidfinishlaunching-user-info-keys"
        }
      ],
      "title" : "Launching Applications"
    }
  ],
  "source" : "appleJSON",
  "title" : "applicationDidFinishLaunching(_:)",
  "url" : "https:\/\/developer.apple.com\/documentation\/AppKit\/NSApplicationDelegate\/applicationDidFinishLaunching(_:)"
}