{
  "abstract" : "The button image used by the color picker.",
  "codeExamples" : [

  ],
  "contentHash" : "76f8877f90b9d9c638ef9521502475a0bc0bdc916828a23dc918655f64ab9f8f",
  "crawledAt" : "2025-12-04T11:01:29Z",
  "declaration" : {
    "code" : "var provideNewButtonImage: NSImage { get }",
    "language" : "swift"
  },
  "id" : "0FA633AF-69FC-47F2-82BE-737C626864C7",
  "kind" : "property",
  "language" : "swift",
  "module" : "AppKit",
  "overview" : "## Discussion\n\nThe image placed on the mode button the user uses to select this color picker. This is the same image the color panel uses as an argument when sending the [doc:\/\/com.apple.appkit\/documentation\/AppKit\/NSColorPicker\/insertNewButtonImage(_:in:)] message. Override this property’s getter method to provide a custom button image. The default implementation looks in the color picker’s bundle for a TIFF file named after the color picker’s class, with the extension “`.tiff`”.",
  "platforms" : [
    "macOS"
  ],
  "rawMarkdown" : "---\nsource: https:\/\/developer.apple.com\/documentation\/AppKit\/NSColorPicker\/provideNewButtonImage\ncrawled: 2025-12-04T11:01:29Z\n---\n\n# provideNewButtonImage\n\n**Instance Property**\n\nThe button image used by the color picker.\n\n## Declaration\n\n```swift\nvar provideNewButtonImage: NSImage { get }\n```\n\n## Discussion\n\nThe image placed on the mode button the user uses to select this color picker. This is the same image the color panel uses as an argument when sending the [doc:\/\/com.apple.appkit\/documentation\/AppKit\/NSColorPicker\/insertNewButtonImage(_:in:)] message. Override this property’s getter method to provide a custom button image. The default implementation looks in the color picker’s bundle for a TIFF file named after the color picker’s class, with the extension “`.tiff`”.\n\n## Adding Button Images\n\n- **insertNewButtonImage(_:in:)**: Sets the image used for the specified button cell.\n\n",
  "sections" : [
    {
      "content" : "",
      "items" : [
        {
          "description" : "Sets the image used for the specified button cell.",
          "name" : "insertNewButtonImage(_:in:)",
          "url" : "https:\/\/developer.apple.com\/documentation\/AppKit\/NSColorPicker\/insertNewButtonImage(_:in:)"
        }
      ],
      "title" : "Adding Button Images"
    }
  ],
  "source" : "appleJSON",
  "title" : "provideNewButtonImage",
  "url" : "https:\/\/developer.apple.com\/documentation\/AppKit\/NSColorPicker\/provideNewButtonImage"
}