{
  "abstract" : "Specifies whether the row is drawn using the floating style.",
  "codeExamples" : [

  ],
  "contentHash" : "7556e6b58f2bb56e026ccae66ee5a8fd6402922535d1fc0a569f19dbdba43b55",
  "crawledAt" : "2025-12-01T13:52:49Z",
  "declaration" : {
    "code" : "@MainActor var isFloating: Bool { get set }",
    "language" : "swift"
  },
  "id" : "F255B0A7-2A34-46BC-BCD6-73C92E0EEC78",
  "kind" : "property",
  "module" : "AppKit",
  "overview" : "## Discussion\n\nFloating is a temporary attribute that is set when a particular group row is actually floating above other rows. The state may change dynamically based on the position of the group row. Drawing may be different for rows that are currently ‘floating’.",
  "platforms" : [
    "macOS"
  ],
  "rawMarkdown" : "---\nsource: https:\/\/developer.apple.com\/documentation\/AppKit\/NSTableRowView\/isFloating\ncrawled: 2025-12-01T13:52:49Z\n---\n\n# isFloating\n\n**Instance Property**\n\nSpecifies whether the row is drawn using the floating style.\n\n## Declaration\n\n```swift\n@MainActor var isFloating: Bool { get set }\n```\n\n## Discussion\n\nFloating is a temporary attribute that is set when a particular group row is actually floating above other rows. The state may change dynamically based on the position of the group row. Drawing may be different for rows that are currently ‘floating’.\n\n## Display Style\n\n- **isEmphasized**: Determines whether the row will draw with the alternate or secondary color (unless overridden).\n- **interiorBackgroundStyle**: Specifies how the subviews should draw.\n\n",
  "sections" : [
    {
      "content" : "",
      "items" : [
        {
          "description" : "Determines whether the row will draw with the alternate or secondary color (unless overridden).",
          "name" : "isEmphasized",
          "url" : "https:\/\/developer.apple.com\/documentation\/AppKit\/NSTableRowView\/isEmphasized"
        },
        {
          "description" : "Specifies how the subviews should draw.",
          "name" : "interiorBackgroundStyle",
          "url" : "https:\/\/developer.apple.com\/documentation\/AppKit\/NSTableRowView\/interiorBackgroundStyle"
        }
      ],
      "title" : "Display Style"
    }
  ],
  "source" : "appleJSON",
  "title" : "isFloating",
  "url" : "https:\/\/developer.apple.com\/documentation\/AppKit\/NSTableRowView\/isFloating"
}