{
  "abstract" : "Allows the table column to resize automatically in response to resizing the table view. The resizing behavior for the table view is set using the `NSTableView` method [doc:\/\/com.apple.appkit\/documentation\/AppKit\/NSTableView\/columnAutoresizingStyle-swift.property].",
  "codeExamples" : [

  ],
  "contentHash" : "e6b027e92f66b5e53de23d2e7b9313debc82f3beb48df5c18d84862c27c9bd31",
  "crawledAt" : "2025-12-06T02:54:59Z",
  "declaration" : {
    "code" : "static var autoresizingMask: NSTableColumn.ResizingOptions { get }",
    "language" : "swift"
  },
  "id" : "7DBDC059-3D68-4DFF-A92B-81D060479DA2",
  "kind" : "property",
  "language" : "swift",
  "module" : "AppKit",
  "platforms" : [
    "macOS"
  ],
  "rawMarkdown" : "---\nsource: https:\/\/developer.apple.com\/documentation\/AppKit\/NSTableColumn\/ResizingOptions\/autoresizingMask\ncrawled: 2025-12-06T02:54:59Z\n---\n\n# autoresizingMask\n\n**Type Property**\n\nAllows the table column to resize automatically in response to resizing the table view. The resizing behavior for the table view is set using the `NSTableView` method [doc:\/\/com.apple.appkit\/documentation\/AppKit\/NSTableView\/columnAutoresizingStyle-swift.property].\n\n## Declaration\n\n```swift\nstatic var autoresizingMask: NSTableColumn.ResizingOptions { get }\n```\n\n## Constants\n\n- **userResizingMask**: Allows the table column to be resized by the user.\n\n",
  "sections" : [
    {
      "content" : "",
      "items" : [
        {
          "description" : "Allows the table column to be resized by the user.",
          "name" : "userResizingMask",
          "url" : "https:\/\/developer.apple.com\/documentation\/AppKit\/NSTableColumn\/ResizingOptions\/userResizingMask"
        }
      ],
      "title" : "Constants"
    }
  ],
  "source" : "appleJSON",
  "title" : "autoresizingMask",
  "url" : "https:\/\/developer.apple.com\/documentation\/AppKit\/NSTableColumn\/ResizingOptions\/autoresizingMask"
}