{
  "abstract" : "An effect to apply to the animation.",
  "codeExamples" : [

  ],
  "contentHash" : "a773bc68edfd78e205d6db95e1401951d5715d5bb938ed6f06998e43e8cc2a3d",
  "crawledAt" : "2025-12-05T21:54:03Z",
  "declaration" : {
    "code" : "static let effect: NSViewAnimation.Key",
    "language" : "swift"
  },
  "id" : "D5E000AD-1E1E-4846-A9E3-B1FD5C017964",
  "kind" : "property",
  "language" : "swift",
  "module" : "AppKit",
  "overview" : "## Discussion\n\nTakes a string constant specifying fade-in or fade-out effects for the target: `NSViewAnimationFadeInEffect` and `NSViewAnimationFadeOutEffect`. If the target is a view and the effect is to fade out, the view is hidden at the end. If the effect is to fade in an initially hidden view and the end frame is non-empty, the view is unhidden at the end. If the target is a window, the window is ordered in or out as appropriate to the effect. This property is optional.",
  "platforms" : [
    "macOS"
  ],
  "rawMarkdown" : "---\nsource: https:\/\/developer.apple.com\/documentation\/AppKit\/NSViewAnimation\/Key\/effect\ncrawled: 2025-12-05T21:54:03Z\n---\n\n# effect\n\n**Type Property**\n\nAn effect to apply to the animation.\n\n## Declaration\n\n```swift\nstatic let effect: NSViewAnimation.Key\n```\n\n## Discussion\n\nTakes a string constant specifying fade-in or fade-out effects for the target: `NSViewAnimationFadeInEffect` and `NSViewAnimationFadeOutEffect`. If the target is a view and the effect is to fade out, the view is hidden at the end. If the effect is to fade in an initially hidden view and the end frame is non-empty, the view is unhidden at the end. If the target is a window, the window is ordered in or out as appropriate to the effect. This property is optional.\n\n## Keys\n\n- **endFrame**: The size and location of the window or view at the end of the animation.\n- **startFrame**: The size and location of the window or view at the start of the animation.\n- **target**: The target of the animation.\n\n",
  "sections" : [
    {
      "content" : "",
      "items" : [
        {
          "description" : "The size and location of the window or view at the end of the animation.",
          "name" : "endFrame",
          "url" : "https:\/\/developer.apple.com\/documentation\/AppKit\/NSViewAnimation\/Key\/endFrame"
        },
        {
          "description" : "The size and location of the window or view at the start of the animation.",
          "name" : "startFrame",
          "url" : "https:\/\/developer.apple.com\/documentation\/AppKit\/NSViewAnimation\/Key\/startFrame"
        },
        {
          "description" : "The target of the animation.",
          "name" : "target",
          "url" : "https:\/\/developer.apple.com\/documentation\/AppKit\/NSViewAnimation\/Key\/target"
        }
      ],
      "title" : "Keys"
    }
  ],
  "source" : "appleJSON",
  "title" : "effect",
  "url" : "https:\/\/developer.apple.com\/documentation\/AppKit\/NSViewAnimation\/Key\/effect"
}