{
  "abstract" : "Invoked by an `NSComboBoxCell` object to synchronize the pop-up list’s selected item with the text field’s contents.",
  "codeExamples" : [

  ],
  "contentHash" : "8c1ed4fc6c69042cc1feb5d45c02b3168fe771329244a95034aa94287f03b634",
  "crawledAt" : "2025-12-07T15:54:46Z",
  "declaration" : {
    "code" : "optional func comboBoxCell(_ comboBoxCell: NSComboBoxCell, indexOfItemWithStringValue string: String) -> Int",
    "language" : "swift"
  },
  "id" : "55A8B6E3-4CDE-4887-A647-A83AC407734A",
  "kind" : "method",
  "language" : "swift",
  "module" : "AppKit",
  "overview" : "## Return Value\n\nThe index for the pop-up list item matching `aString`, or `NSNotFound` if no item matches.\n\n## Discussion\n\nIf you don’t implement this method, the receiver does not synchronize the pop-up list’s selected item with the text field’s contents.",
  "platforms" : [
    "macOS"
  ],
  "rawMarkdown" : "---\nsource: https:\/\/developer.apple.com\/documentation\/AppKit\/NSComboBoxCellDataSource\/comboBoxCell(_:indexOfItemWithStringValue:)\ncrawled: 2025-12-07T15:54:46Z\n---\n\n# comboBoxCell(_:indexOfItemWithStringValue:)\n\n**Instance Method**\n\nInvoked by an `NSComboBoxCell` object to synchronize the pop-up list’s selected item with the text field’s contents.\n\n## Declaration\n\n```swift\noptional func comboBoxCell(_ comboBoxCell: NSComboBoxCell, indexOfItemWithStringValue string: String) -> Int\n```\n\n## Parameters\n\n- **comboBoxCell**: The combo box cell.\n- **string**: The string to match. If [doc:\/\/com.apple.appkit\/documentation\/AppKit\/NSComboBoxCellDataSource\/comboBoxCell(_:completedString:)] is implemented, `aString` is the string returned by that method. Otherwise, `aString` is the text that the user has typed.\n\n## Return Value\n\nThe index for the pop-up list item matching `aString`, or `NSNotFound` if no item matches.\n\n## Discussion\n\nIf you don’t implement this method, the receiver does not synchronize the pop-up list’s selected item with the text field’s contents.\n\n## Instance Methods\n\n- **comboBoxCell(_:completedString:)**: Returns the item from the combo box’s pop-up list that matches the text entered by the user.\n- **comboBoxCell(_:objectValueForItemAt:)**: Returns the object that corresponds to the item at the given index in the combo box cell.\n- **numberOfItems(in:)**: Returns the number of items managed for the combo box cell by your data source object.\n\n",
  "sections" : [
    {
      "content" : "",
      "items" : [
        {
          "description" : "Returns the item from the combo box’s pop-up list that matches the text entered by the user.",
          "name" : "comboBoxCell(_:completedString:)",
          "url" : "https:\/\/developer.apple.com\/documentation\/AppKit\/NSComboBoxCellDataSource\/comboBoxCell(_:completedString:)"
        },
        {
          "description" : "Returns the object that corresponds to the item at the given index in the combo box cell.",
          "name" : "comboBoxCell(_:objectValueForItemAt:)",
          "url" : "https:\/\/developer.apple.com\/documentation\/AppKit\/NSComboBoxCellDataSource\/comboBoxCell(_:objectValueForItemAt:)"
        },
        {
          "description" : "Returns the number of items managed for the combo box cell by your data source object.",
          "name" : "numberOfItems(in:)",
          "url" : "https:\/\/developer.apple.com\/documentation\/AppKit\/NSComboBoxCellDataSource\/numberOfItems(in:)"
        }
      ],
      "title" : "Instance Methods"
    }
  ],
  "source" : "appleJSON",
  "title" : "comboBoxCell(_:indexOfItemWithStringValue:)",
  "url" : "https:\/\/developer.apple.com\/documentation\/AppKit\/NSComboBoxCellDataSource\/comboBoxCell(_:indexOfItemWithStringValue:)"
}