{
  "abstract" : "The maximum value the slider can send to its target.",
  "codeExamples" : [

  ],
  "contentHash" : "177b926afb568d28517b11322cc5bb4862cb21278d1137359aee52532a67ca65",
  "crawledAt" : "2025-12-01T13:50:28Z",
  "declaration" : {
    "code" : "@MainActor var maxValue: Double { get set }",
    "language" : "swift"
  },
  "id" : "8D473E75-D700-4D67-B415-5C04F1EC40E2",
  "kind" : "property",
  "module" : "AppKit",
  "overview" : "## Discussion\n\nThe slider’s maximum value. A horizontal slider sends the maximum value when the knob is all the way to the trailing end of the bar. A vertical slider sends the maximum value when the knob is at the top.",
  "platforms" : [
    "macOS"
  ],
  "rawMarkdown" : "---\nsource: https:\/\/developer.apple.com\/documentation\/AppKit\/NSSlider\/maxValue\ncrawled: 2025-12-01T13:50:28Z\n---\n\n# maxValue\n\n**Instance Property**\n\nThe maximum value the slider can send to its target.\n\n## Declaration\n\n```swift\n@MainActor var maxValue: Double { get set }\n```\n\n## Discussion\n\nThe slider’s maximum value. A horizontal slider sends the maximum value when the knob is all the way to the trailing end of the bar. A vertical slider sends the maximum value when the knob is at the top.\n\n## Asking about the value limits\n\n- **minValue**: The minimum value the slider can send to its target.\n\n",
  "sections" : [
    {
      "content" : "",
      "items" : [
        {
          "description" : "The minimum value the slider can send to its target.",
          "name" : "minValue",
          "url" : "https:\/\/developer.apple.com\/documentation\/AppKit\/NSSlider\/minValue"
        }
      ],
      "title" : "Asking about the value limits"
    }
  ],
  "source" : "appleJSON",
  "title" : "maxValue",
  "url" : "https:\/\/developer.apple.com\/documentation\/AppKit\/NSSlider\/maxValue"
}