{
  "abstract" : "Creates and returns a layout attributes object for an inter-item gap view at the specified index path.",
  "codeExamples" : [

  ],
  "contentHash" : "35d2caa3e5980229bce75b13275589c32ec5a381e75baa2cd526cfb9fbdca858",
  "crawledAt" : "2025-12-05T21:49:11Z",
  "declaration" : {
    "code" : "@MainActor convenience init(forInterItemGapBefore indexPath: IndexPath)",
    "language" : "swift"
  },
  "id" : "075E6C9B-5B1B-4205-953D-ACB5B236967D",
  "kind" : "unknown",
  "language" : "swift",
  "module" : "AppKit",
  "overview" : "## Return Value\n\nA new layout attributes object configured with the initial attributes for the inter-item gap view.\n\n## Discussion\n\nCall this method when you need to create a layout attributes object for an inter-item gap view in a collection view. Gap views are used during drag and drop to indicate the area where content will drop. This method uses the parameters to set the initial values of the [doc:\/\/com.apple.appkit\/documentation\/AppKit\/NSCollectionViewLayoutAttributes\/indexPath] property of the returned object. The [doc:\/\/com.apple.appkit\/documentation\/AppKit\/NSCollectionViewLayoutAttributes\/representedElementKind] property is set to [doc:\/\/com.apple.appkit\/documentation\/AppKit\/NSCollectionView\/elementKindInterItemGapIndicator].",
  "platforms" : [
    "macOS"
  ],
  "rawMarkdown" : "---\nsource: https:\/\/developer.apple.com\/documentation\/AppKit\/NSCollectionViewLayoutAttributes\/init(forInterItemGapBefore:)\ncrawled: 2025-12-05T21:49:11Z\n---\n\n# init(forInterItemGapBefore:)\n\n**Initializer**\n\nCreates and returns a layout attributes object for an inter-item gap view at the specified index path.\n\n## Declaration\n\n```swift\n@MainActor convenience init(forInterItemGapBefore indexPath: IndexPath)\n```\n\n## Parameters\n\n- **indexPath**: The index path at which to insert the gap view. The gap is placed after the item specified by the index path. This parameter must contain a valid value.\n\n## Return Value\n\nA new layout attributes object configured with the initial attributes for the inter-item gap view.\n\n## Discussion\n\nCall this method when you need to create a layout attributes object for an inter-item gap view in a collection view. Gap views are used during drag and drop to indicate the area where content will drop. This method uses the parameters to set the initial values of the [doc:\/\/com.apple.appkit\/documentation\/AppKit\/NSCollectionViewLayoutAttributes\/indexPath] property of the returned object. The [doc:\/\/com.apple.appkit\/documentation\/AppKit\/NSCollectionViewLayoutAttributes\/representedElementKind] property is set to [doc:\/\/com.apple.appkit\/documentation\/AppKit\/NSCollectionView\/elementKindInterItemGapIndicator].\n\n## Creating Layout Attributes\n\n- **init(forItemWith:)**: Creates and returns a layout attributes object for the item at the specified index path.\n- **init(forSupplementaryViewOfKind:with:)**: Creates and returns a layout attributes object for a supplementary view based on the specified information.\n- **init(forDecorationViewOfKind:with:)**: Creates and returns a layout attributes object for a decoration view based on the specified information.\n- **NSCollectionView.DecorationElementKind**\n\n",
  "sections" : [
    {
      "content" : "",
      "items" : [
        {
          "description" : "Creates and returns a layout attributes object for the item at the specified index path.",
          "name" : "init(forItemWith:)",
          "url" : "https:\/\/developer.apple.com\/documentation\/AppKit\/NSCollectionViewLayoutAttributes\/init(forItemWith:)"
        },
        {
          "description" : "Creates and returns a layout attributes object for a supplementary view based on the specified information.",
          "name" : "init(forSupplementaryViewOfKind:with:)",
          "url" : "https:\/\/developer.apple.com\/documentation\/AppKit\/NSCollectionViewLayoutAttributes\/init(forSupplementaryViewOfKind:with:)"
        },
        {
          "description" : "Creates and returns a layout attributes object for a decoration view based on the specified information.",
          "name" : "init(forDecorationViewOfKind:with:)",
          "url" : "https:\/\/developer.apple.com\/documentation\/AppKit\/NSCollectionViewLayoutAttributes\/init(forDecorationViewOfKind:with:)"
        },
        {
          "description" : "",
          "name" : "NSCollectionView.DecorationElementKind",
          "url" : "https:\/\/developer.apple.com\/documentation\/AppKit\/NSCollectionView\/DecorationElementKind"
        }
      ],
      "title" : "Creating Layout Attributes"
    }
  ],
  "source" : "appleJSON",
  "title" : "init(forInterItemGapBefore:)",
  "url" : "https:\/\/developer.apple.com\/documentation\/AppKit\/NSCollectionViewLayoutAttributes\/init(forInterItemGapBefore:)"
}