{
  "abstract" : "The amount of space added around the boundaries of the item between other items and this item’s container.",
  "codeExamples" : [

  ],
  "contentHash" : "ac5161ad770735b1628a9bb19f577df8a5f81ab43f044456bb50472d09a1b238",
  "crawledAt" : "2025-12-05T21:46:58Z",
  "declaration" : {
    "code" : "@NSCopying @MainActor var edgeSpacing: NSCollectionLayoutEdgeSpacing? { get set }",
    "language" : "swift"
  },
  "id" : "4DD8D07B-50EA-48B0-8C7A-E50FA6E38A6E",
  "kind" : "property",
  "language" : "swift",
  "module" : "AppKit",
  "overview" : "## Discussion\n\nUse this property to adjust the position of the item in relation to its container and other items. For example, you can use this property to apply extra space to the trailing edge of each item. Edge spacing is applied before applying [doc:\/\/com.apple.appkit\/documentation\/AppKit\/NSCollectionLayoutItem\/contentInsets].\n\nThe following diagram shows the result of applying 2 points of trailing edge spacing to the items in a group:\n\n",
  "platforms" : [
    "macOS"
  ],
  "rawMarkdown" : "---\nsource: https:\/\/developer.apple.com\/documentation\/AppKit\/NSCollectionLayoutItem\/edgeSpacing\ncrawled: 2025-12-05T21:46:58Z\n---\n\n# edgeSpacing\n\n**Instance Property**\n\nThe amount of space added around the boundaries of the item between other items and this item’s container.\n\n## Declaration\n\n```swift\n@NSCopying @MainActor var edgeSpacing: NSCollectionLayoutEdgeSpacing? { get set }\n```\n\n## Discussion\n\nUse this property to adjust the position of the item in relation to its container and other items. For example, you can use this property to apply extra space to the trailing edge of each item. Edge spacing is applied before applying [doc:\/\/com.apple.appkit\/documentation\/AppKit\/NSCollectionLayoutItem\/contentInsets].\n\nThe following diagram shows the result of applying 2 points of trailing edge spacing to the items in a group:\n\n\n\n## Configuring spacing and insets\n\n- **contentInsets**: The amount of space added around the content of the item to adjust its final size after its position is computed.\n\n",
  "sections" : [
    {
      "content" : "",
      "items" : [
        {
          "description" : "The amount of space added around the content of the item to adjust its final size after its position is computed.",
          "name" : "contentInsets",
          "url" : "https:\/\/developer.apple.com\/documentation\/AppKit\/NSCollectionLayoutItem\/contentInsets"
        }
      ],
      "title" : "Configuring spacing and insets"
    }
  ],
  "source" : "appleJSON",
  "title" : "edgeSpacing",
  "url" : "https:\/\/developer.apple.com\/documentation\/AppKit\/NSCollectionLayoutItem\/edgeSpacing"
}