{
  "abstract" : "A style that supports a color picker popover for fast interactions, and adds a dedicated button to display the color panel.",
  "codeExamples" : [

  ],
  "contentHash" : "f38880683d2d1721c465d558df735cd724b425da02c89947f07b81e1f4c8f27e",
  "crawledAt" : "2025-12-04T19:42:56Z",
  "declaration" : {
    "code" : "case expanded",
    "language" : "swift"
  },
  "id" : "7D7E5A31-2E8E-4DDE-AFAE-45681B9CD129",
  "kind" : "unknown",
  "language" : "swift",
  "module" : "AppKit",
  "overview" : "## Discussion\n\nThis style displays a dedicated button and a rectangular area with the selected color. Clicks in the dedicated button always display the system color panel. Clicks in the color area display a popover with a color picker. If you specified a custom action using the [doc:\/\/com.apple.appkit\/documentation\/AppKit\/NSColorWell\/pulldownAction] and [doc:\/\/com.apple.appkit\/documentation\/AppKit\/NSColorWell\/pulldownTarget] properties, clicks in the color area execute your action method instead.",
  "platforms" : [
    "macOS"
  ],
  "rawMarkdown" : "---\nsource: https:\/\/developer.apple.com\/documentation\/AppKit\/NSColorWell\/Style\/expanded\ncrawled: 2025-12-04T19:42:56Z\n---\n\n# NSColorWell.Style.expanded\n\n**Case**\n\nA style that supports a color picker popover for fast interactions, and adds a dedicated button to display the color panel.\n\n## Declaration\n\n```swift\ncase expanded\n```\n\n## Discussion\n\nThis style displays a dedicated button and a rectangular area with the selected color. Clicks in the dedicated button always display the system color panel. Clicks in the color area display a popover with a color picker. If you specified a custom action using the [doc:\/\/com.apple.appkit\/documentation\/AppKit\/NSColorWell\/pulldownAction] and [doc:\/\/com.apple.appkit\/documentation\/AppKit\/NSColorWell\/pulldownTarget] properties, clicks in the color area execute your action method instead.\n\n## Getting the Style Option\n\n- **NSColorWell.Style.default**: The default style for color wells.\n- **NSColorWell.Style.minimal**: A style that adds minimal adornments to the color well.\n\n",
  "sections" : [
    {
      "content" : "",
      "items" : [
        {
          "description" : "The default style for color wells.",
          "name" : "NSColorWell.Style.default",
          "url" : "https:\/\/developer.apple.com\/documentation\/AppKit\/NSColorWell\/Style\/default"
        },
        {
          "description" : "A style that adds minimal adornments to the color well.",
          "name" : "NSColorWell.Style.minimal",
          "url" : "https:\/\/developer.apple.com\/documentation\/AppKit\/NSColorWell\/Style\/minimal"
        }
      ],
      "title" : "Getting the Style Option"
    }
  ],
  "source" : "appleJSON",
  "title" : "NSColorWell.Style.expanded",
  "url" : "https:\/\/developer.apple.com\/documentation\/AppKit\/NSColorWell\/Style\/expanded"
}