{
  "abstract" : "The distance (in points) between the top of the view’s alignment rectangle and its topmost baseline.",
  "codeExamples" : [

  ],
  "contentHash" : "f29482d2c1f827b8d35e069c31b14cd46cf43b6572355c78ead9c5148e964f96",
  "crawledAt" : "2025-12-04T20:06:05Z",
  "declaration" : {
    "code" : "@MainActor var firstBaselineOffsetFromTop: CGFloat { get }",
    "language" : "swift"
  },
  "id" : "93D442AC-B1AB-46AD-A850-1963BC071D17",
  "kind" : "property",
  "language" : "swift",
  "module" : "AppKit",
  "overview" : "## Discussion\n\nThe default value of this property is `0`. For views that contain text or other content whose layout benefits from having a custom baseline, you can override this property and provide the correct distance between the top of the view’s alignment rectangle and the baseline of the top row of text.",
  "platforms" : [
    "macOS"
  ],
  "rawMarkdown" : "---\nsource: https:\/\/developer.apple.com\/documentation\/AppKit\/NSView\/firstBaselineOffsetFromTop\ncrawled: 2025-12-04T20:06:05Z\n---\n\n# firstBaselineOffsetFromTop\n\n**Instance Property**\n\nThe distance (in points) between the top of the view’s alignment rectangle and its topmost baseline.\n\n## Declaration\n\n```swift\n@MainActor var firstBaselineOffsetFromTop: CGFloat { get }\n```\n\n## Discussion\n\nThe default value of this property is `0`. For views that contain text or other content whose layout benefits from having a custom baseline, you can override this property and provide the correct distance between the top of the view’s alignment rectangle and the baseline of the top row of text.\n\n## Aligning Views with Auto Layout\n\n- **alignmentRect(forFrame:)**: Returns the view’s alignment rectangle for a given frame.\n- **frame(forAlignmentRect:)**: Returns the view’s frame for a given alignment rectangle.\n- **alignmentRectInsets**: The insets (in points) from the view’s frame that define its content rectangle.\n- **baselineOffsetFromBottom**: The distance (in points) between the bottom of the view’s alignment rectangle and its baseline.\n- **lastBaselineOffsetFromBottom**: The distance (in points) between the bottom of the view’s alignment rectangle and its bottommost baseline.\n\n",
  "sections" : [
    {
      "content" : "",
      "items" : [
        {
          "description" : "Returns the view’s alignment rectangle for a given frame.",
          "name" : "alignmentRect(forFrame:)",
          "url" : "https:\/\/developer.apple.com\/documentation\/AppKit\/NSView\/alignmentRect(forFrame:)"
        },
        {
          "description" : "Returns the view’s frame for a given alignment rectangle.",
          "name" : "frame(forAlignmentRect:)",
          "url" : "https:\/\/developer.apple.com\/documentation\/AppKit\/NSView\/frame(forAlignmentRect:)"
        },
        {
          "description" : "The insets (in points) from the view’s frame that define its content rectangle.",
          "name" : "alignmentRectInsets",
          "url" : "https:\/\/developer.apple.com\/documentation\/AppKit\/NSView\/alignmentRectInsets"
        },
        {
          "description" : "The distance (in points) between the bottom of the view’s alignment rectangle and its baseline.",
          "name" : "baselineOffsetFromBottom",
          "url" : "https:\/\/developer.apple.com\/documentation\/AppKit\/NSView\/baselineOffsetFromBottom"
        },
        {
          "description" : "The distance (in points) between the bottom of the view’s alignment rectangle and its bottommost baseline.",
          "name" : "lastBaselineOffsetFromBottom",
          "url" : "https:\/\/developer.apple.com\/documentation\/AppKit\/NSView\/lastBaselineOffsetFromBottom"
        }
      ],
      "title" : "Aligning Views with Auto Layout"
    }
  ],
  "source" : "appleJSON",
  "title" : "firstBaselineOffsetFromTop",
  "url" : "https:\/\/developer.apple.com\/documentation\/AppKit\/NSView\/firstBaselineOffsetFromTop"
}