{
  "abstract" : "A closure called before each layout cycle to allow modification of items in a section immediately before they’re displayed.",
  "codeExamples" : [

  ],
  "contentHash" : "c01278e9e0aa1b6f8ee2e32749b66485f4f5367d1c4c5b49e69521c05755953f",
  "crawledAt" : "2025-12-04T10:55:32Z",
  "declaration" : {
    "code" : "typealias NSCollectionLayoutSectionVisibleItemsInvalidationHandler = ([any NSCollectionLayoutVisibleItem], NSPoint, any NSCollectionLayoutEnvironment) -> Void",
    "language" : "swift"
  },
  "id" : "2DE20DE0-789C-48B9-9608-5D0BACCE92D9",
  "kind" : "typealias",
  "language" : "swift",
  "module" : "AppKit",
  "overview" : "## Discussion\n\nEach section of a collection view layout can have a visible items invalidation handler. You use this handler to perform custom animations on the items currently visible within the bounds of that section. The handler is called before each layout cycle, any time an animation occurs in that section due to changes such as adding or removing items, scrolling the section, or rotating the device.",
  "platforms" : [
    "macOS"
  ],
  "rawMarkdown" : "---\nsource: https:\/\/developer.apple.com\/documentation\/AppKit\/NSCollectionLayoutSectionVisibleItemsInvalidationHandler\ncrawled: 2025-12-04T10:55:32Z\n---\n\n# NSCollectionLayoutSectionVisibleItemsInvalidationHandler\n\n**Type Alias**\n\nA closure called before each layout cycle to allow modification of items in a section immediately before they’re displayed.\n\n## Declaration\n\n```swift\ntypealias NSCollectionLayoutSectionVisibleItemsInvalidationHandler = ([any NSCollectionLayoutVisibleItem], NSPoint, any NSCollectionLayoutEnvironment) -> Void\n```\n\n## Discussion\n\nEach section of a collection view layout can have a visible items invalidation handler. You use this handler to perform custom animations on the items currently visible within the bounds of that section. The handler is called before each layout cycle, any time an animation occurs in that section due to changes such as adding or removing items, scrolling the section, or rotating the device.\n\n\n\n## Layout updates\n\n- **NSCollectionLayoutVisibleItem**: An item that’s currently visible within the bounds of a section.\n\n",
  "sections" : [
    {
      "content" : "",
      "items" : [
        {
          "description" : "An item that’s currently visible within the bounds of a section.",
          "name" : "NSCollectionLayoutVisibleItem",
          "url" : "https:\/\/developer.apple.com\/documentation\/AppKit\/NSCollectionLayoutVisibleItem"
        }
      ],
      "title" : "Layout updates"
    }
  ],
  "source" : "appleJSON",
  "title" : "NSCollectionLayoutSectionVisibleItemsInvalidationHandler",
  "url" : "https:\/\/developer.apple.com\/documentation\/AppKit\/NSCollectionLayoutSectionVisibleItemsInvalidationHandler"
}