{
  "abstract" : "Returns the number of words in the specified string.",
  "codeExamples" : [

  ],
  "contentHash" : "4a6803be569ad43a66fc3b71fb7b1ccfab5de6d2c23ba626d5dd389dafa218bb",
  "crawledAt" : "2025-12-04T11:18:02Z",
  "declaration" : {
    "code" : "func countWords(in stringToCount: String, language: String?) -> Int",
    "language" : "swift"
  },
  "id" : "6047152D-719A-4B1A-886F-3EEC78510F72",
  "kind" : "method",
  "language" : "swift",
  "module" : "AppKit",
  "overview" : "## Return Value\n\nThe number of words in the string or `-1` if word counting is unavailable or has not occurred for some reason.\n\n## Discussion\n\nIf `language` is `nil`, the current selection in the Spelling panel’s pop-up menu is used.",
  "platforms" : [
    "macOS"
  ],
  "rawMarkdown" : "---\nsource: https:\/\/developer.apple.com\/documentation\/AppKit\/NSSpellChecker\/countWords(in:language:)\ncrawled: 2025-12-04T11:18:02Z\n---\n\n# countWords(in:language:)\n\n**Instance Method**\n\nReturns the number of words in the specified string.\n\n## Declaration\n\n```swift\nfunc countWords(in stringToCount: String, language: String?) -> Int\n```\n\n## Parameters\n\n- **stringToCount**: The string to count the words in.\n- **language**: The language of the string.\n\n## Return Value\n\nThe number of words in the string or `-1` if word counting is unavailable or has not occurred for some reason.\n\n## Discussion\n\nIf `language` is `nil`, the current selection in the Spelling panel’s pop-up menu is used.\n\n## Checking Strings for Spelling and Grammar\n\n- **checkSpelling(of:startingAt:)**: Starts the search for a misspelled word in `stringToCheck` starting at `startingOffset` within the string object.\n- **checkSpelling(of:startingAt:language:wrap:inSpellDocumentWithTag:wordCount:)**: Starts the search for a misspelled word in a string starting at specified offset within the string.\n- **checkGrammar(of:startingAt:language:wrap:inSpellDocumentWithTag:details:)**: Initiates a grammatical analysis of a given string.\n- **check(_:range:types:options:inSpellDocumentWithTag:orthography:wordCount:)**: Requests unified text checking for the given range of the given string.\n- **requestChecking(of:range:types:options:inSpellDocumentWithTag:completionHandler:)**: Requests that the string be checked in the background.\n- **guesses(forWordRange:in:language:inSpellDocumentWithTag:)**: Returns an array of possible substitutions for the specified string.\n\n",
  "sections" : [
    {
      "content" : "",
      "items" : [
        {
          "description" : "Starts the search for a misspelled word in `stringToCheck` starting at `startingOffset` within the string object.",
          "name" : "checkSpelling(of:startingAt:)",
          "url" : "https:\/\/developer.apple.com\/documentation\/AppKit\/NSSpellChecker\/checkSpelling(of:startingAt:)"
        },
        {
          "description" : "Starts the search for a misspelled word in a string starting at specified offset within the string.",
          "name" : "checkSpelling(of:startingAt:language:wrap:inSpellDocumentWithTag:wordCount:)",
          "url" : "https:\/\/developer.apple.com\/documentation\/AppKit\/NSSpellChecker\/checkSpelling(of:startingAt:language:wrap:inSpellDocumentWithTag:wordCount:)"
        },
        {
          "description" : "Initiates a grammatical analysis of a given string.",
          "name" : "checkGrammar(of:startingAt:language:wrap:inSpellDocumentWithTag:details:)",
          "url" : "https:\/\/developer.apple.com\/documentation\/AppKit\/NSSpellChecker\/checkGrammar(of:startingAt:language:wrap:inSpellDocumentWithTag:details:)"
        },
        {
          "description" : "Requests unified text checking for the given range of the given string.",
          "name" : "check(_:range:types:options:inSpellDocumentWithTag:orthography:wordCount:)",
          "url" : "https:\/\/developer.apple.com\/documentation\/AppKit\/NSSpellChecker\/check(_:range:types:options:inSpellDocumentWithTag:orthography:wordCount:)"
        },
        {
          "description" : "Requests that the string be checked in the background.",
          "name" : "requestChecking(of:range:types:options:inSpellDocumentWithTag:completionHandler:)",
          "url" : "https:\/\/developer.apple.com\/documentation\/AppKit\/NSSpellChecker\/requestChecking(of:range:types:options:inSpellDocumentWithTag:completionHandler:)"
        },
        {
          "description" : "Returns an array of possible substitutions for the specified string.",
          "name" : "guesses(forWordRange:in:language:inSpellDocumentWithTag:)",
          "url" : "https:\/\/developer.apple.com\/documentation\/AppKit\/NSSpellChecker\/guesses(forWordRange:in:language:inSpellDocumentWithTag:)"
        }
      ],
      "title" : "Checking Strings for Spelling and Grammar"
    }
  ],
  "source" : "appleJSON",
  "title" : "countWords(in:language:)",
  "url" : "https:\/\/developer.apple.com\/documentation\/AppKit\/NSSpellChecker\/countWords(in:language:)"
}