{
  "abstract" : "Places the receiver in context-sensitive help mode.",
  "codeExamples" : [

  ],
  "contentHash" : "73fba8c656ca710817b9cb9cd9f628f096ff6c8b8cc7e5873b0cac8fc6efa38f",
  "crawledAt" : "2025-12-01T13:29:57Z",
  "declaration" : {
    "code" : "@MainActor func activateContextHelpMode(_ sender: Any?)",
    "language" : "swift"
  },
  "id" : "DE3F5CA1-4534-45E9-9D99-C1D412705BD5",
  "kind" : "method",
  "module" : "AppKit",
  "overview" : "## Discussion\n\nIn this mode, the cursor becomes a question mark, and help appears for any user interface item the user clicks.\n\nMost apps don’t use this method. Instead, apps enter context-sensitive mode when the user presses the Help key. Apps exit context-sensitive help mode upon the first event after a help window is displayed.",
  "platforms" : [
    "macOS"
  ],
  "rawMarkdown" : "---\nsource: https:\/\/developer.apple.com\/documentation\/AppKit\/NSApplication\/activateContextHelpMode(_:)\ncrawled: 2025-12-01T13:29:57Z\n---\n\n# activateContextHelpMode(_:)\n\n**Instance Method**\n\nPlaces the receiver in context-sensitive help mode.\n\n## Declaration\n\n```swift\n@MainActor func activateContextHelpMode(_ sender: Any?)\n```\n\n## Parameters\n\n- **sender**: The object that sent the command.\n\n## Discussion\n\nIn this mode, the cursor becomes a question mark, and help appears for any user interface item the user clicks.\n\nMost apps don’t use this method. Instead, apps enter context-sensitive mode when the user presses the Help key. Apps exit context-sensitive help mode upon the first event after a help window is displayed.\n\n## Providing help information\n\n- **registerUserInterfaceItemSearchHandler(_:)**: Register an object that provides help data to your app.\n- **searchString(_:inUserInterfaceItemString:range:found:)**: Searches for the string in the user interface.\n- **unregisterUserInterfaceItemSearchHandler(_:)**: Unregister an object that provides help data to your app.\n- **showHelp(_:)**: If your project is properly registered, and the necessary keys have been set in the property list, this method launches Help Viewer and displays the first page of your app’s help book.\n- **helpMenu**: The help menu used by the app.\n\n",
  "sections" : [
    {
      "content" : "",
      "items" : [
        {
          "description" : "Register an object that provides help data to your app.",
          "name" : "registerUserInterfaceItemSearchHandler(_:)",
          "url" : "https:\/\/developer.apple.com\/documentation\/AppKit\/NSApplication\/registerUserInterfaceItemSearchHandler(_:)"
        },
        {
          "description" : "Searches for the string in the user interface.",
          "name" : "searchString(_:inUserInterfaceItemString:range:found:)",
          "url" : "https:\/\/developer.apple.com\/documentation\/AppKit\/NSApplication\/searchString(_:inUserInterfaceItemString:range:found:)"
        },
        {
          "description" : "Unregister an object that provides help data to your app.",
          "name" : "unregisterUserInterfaceItemSearchHandler(_:)",
          "url" : "https:\/\/developer.apple.com\/documentation\/AppKit\/NSApplication\/unregisterUserInterfaceItemSearchHandler(_:)"
        },
        {
          "description" : "If your project is properly registered, and the necessary keys have been set in the property list, this method launches Help Viewer and displays the first page of your app’s help book.",
          "name" : "showHelp(_:)",
          "url" : "https:\/\/developer.apple.com\/documentation\/AppKit\/NSApplication\/showHelp(_:)"
        },
        {
          "description" : "The help menu used by the app.",
          "name" : "helpMenu",
          "url" : "https:\/\/developer.apple.com\/documentation\/AppKit\/NSApplication\/helpMenu"
        }
      ],
      "title" : "Providing help information"
    }
  ],
  "source" : "appleJSON",
  "title" : "activateContextHelpMode(_:)",
  "url" : "https:\/\/developer.apple.com\/documentation\/AppKit\/NSApplication\/activateContextHelpMode(_:)"
}