{
  "abstract" : "A menu presentation style where items to display align horizontally.",
  "codeExamples" : [

  ],
  "contentHash" : "0442ec63456f67c5e9230da1aeda96a7458c19559e4ddf4c81c88a875a69fab6",
  "crawledAt" : "2025-12-05T09:22:42Z",
  "declaration" : {
    "code" : "case palette",
    "language" : "swift"
  },
  "id" : "00491D46-0471-4AF7-952C-2127EC7C2C0F",
  "kind" : "unknown",
  "language" : "swift",
  "module" : "AppKit",
  "overview" : "## Discussion\n\nYou can turn any menu into a palette menu by setting the menu’s presentation style to `.palette`. For each menu item, set its image. For template images, AppKit automatically adds the appropriate selection tint. Alternatively you can set the [doc:\/\/com.apple.appkit\/documentation\/AppKit\/NSMenuItem\/offStateImage] and the [doc:\/\/com.apple.appkit\/documentation\/AppKit\/NSMenuItem\/onStateImage]. Use the `onStateImage` to indicate selection.\n\nThe following example creates a presentation style menu that displays a list of sport images. When a menu item selects, the system automatically tints the image.\n\n",
  "platforms" : [
    "macOS"
  ],
  "rawMarkdown" : "---\nsource: https:\/\/developer.apple.com\/documentation\/AppKit\/NSMenu\/PresentationStyle-swift.enum\/palette\ncrawled: 2025-12-05T09:22:42Z\n---\n\n# NSMenu.PresentationStyle.palette\n\n**Case**\n\nA menu presentation style where items to display align horizontally.\n\n## Declaration\n\n```swift\ncase palette\n```\n\n## Discussion\n\nYou can turn any menu into a palette menu by setting the menu’s presentation style to `.palette`. For each menu item, set its image. For template images, AppKit automatically adds the appropriate selection tint. Alternatively you can set the [doc:\/\/com.apple.appkit\/documentation\/AppKit\/NSMenuItem\/offStateImage] and the [doc:\/\/com.apple.appkit\/documentation\/AppKit\/NSMenuItem\/onStateImage]. Use the `onStateImage` to indicate selection.\n\nThe following example creates a presentation style menu that displays a list of sport images. When a menu item selects, the system automatically tints the image.\n\n\n\n\n\n## Defining the menu style\n\n- **NSMenu.PresentationStyle.regular**: The default presentation style for a menu.\n\n",
  "sections" : [
    {
      "content" : "",
      "items" : [
        {
          "description" : "The default presentation style for a menu.",
          "name" : "NSMenu.PresentationStyle.regular",
          "url" : "https:\/\/developer.apple.com\/documentation\/AppKit\/NSMenu\/PresentationStyle-swift.enum\/regular"
        }
      ],
      "title" : "Defining the menu style"
    }
  ],
  "source" : "appleJSON",
  "title" : "NSMenu.PresentationStyle.palette",
  "url" : "https:\/\/developer.apple.com\/documentation\/AppKit\/NSMenu\/PresentationStyle-swift.enum\/palette"
}