{
  "abstract" : "A rounded rectangle button, designed for text.",
  "codeExamples" : [

  ],
  "contentHash" : "4b0df964840a5cc539ecc51f533fa820e76e7ec950dcde0df3bcc9ac737df859",
  "crawledAt" : "2025-12-07T15:54:10Z",
  "declaration" : {
    "code" : "static var rounded: NSButton.BezelStyle { get }",
    "language" : "swift"
  },
  "id" : "DD90D9EE-AA2E-4FC6-B3D4-46D95970C885",
  "kind" : "property",
  "language" : "swift",
  "module" : "AppKit",
  "overview" : "## Discussion\n\nRounded buttons are common within the body of a window or alert. To configure a button as the default button, set the [doc:\/\/com.apple.appkit\/documentation\/AppKit\/NSButton\/keyEquivalent] property to the carriage return character (`\\r`, ASCII `0xd`). The system draws the default button prominently using the accent color to indicate that the user can press the return key to invoke the button’s action.",
  "platforms" : [
    "macOS"
  ],
  "rawMarkdown" : "---\nsource: https:\/\/developer.apple.com\/documentation\/appkit\/nsbutton\/bezelstyle-swift.enum\/rounded\ncrawled: 2025-12-07T15:54:10Z\n---\n\n# rounded\n\n**Type Property**\n\nA rounded rectangle button, designed for text.\n\n## Declaration\n\n```swift\nstatic var rounded: NSButton.BezelStyle { get }\n```\n\n## Discussion\n\nRounded buttons are common within the body of a window or alert. To configure a button as the default button, set the [doc:\/\/com.apple.appkit\/documentation\/AppKit\/NSButton\/keyEquivalent] property to the carriage return character (`\\r`, ASCII `0xd`). The system draws the default button prominently using the accent color to indicate that the user can press the return key to invoke the button’s action.\n\n## Properties\n\n- **inline**: A button that has a solid round-rectangle border background.\n- **recessed**: A bezel style appropriate for use in scope bars and title bar accessories, similar to the bookmarks bar in Safari.\n- **regularSquare**: A rectangular button with a two-point border, designed for icons.\n- **roundedDisclosure**: A bezel style for use with a vertically expanding and collapsing disclosure button.\n- **roundRect**: A bezel style appropriate for use as an action or auxiliary button in scope bars and title bar accessories.\n- **texturedRounded**: A bezel style appropriate for use in the toolbar or title bar regions of a window.\n\n",
  "sections" : [
    {
      "content" : "",
      "items" : [
        {
          "description" : "A button that has a solid round-rectangle border background.",
          "name" : "inline",
          "url" : "https:\/\/developer.apple.com\/documentation\/AppKit\/NSButton\/BezelStyle-swift.enum\/inline"
        },
        {
          "description" : "A bezel style appropriate for use in scope bars and title bar accessories, similar to the bookmarks bar in Safari.",
          "name" : "recessed",
          "url" : "https:\/\/developer.apple.com\/documentation\/AppKit\/NSButton\/BezelStyle-swift.enum\/recessed"
        },
        {
          "description" : "A rectangular button with a two-point border, designed for icons.",
          "name" : "regularSquare",
          "url" : "https:\/\/developer.apple.com\/documentation\/AppKit\/NSButton\/BezelStyle-swift.enum\/regularSquare"
        },
        {
          "description" : "A bezel style for use with a vertically expanding and collapsing disclosure button.",
          "name" : "roundedDisclosure",
          "url" : "https:\/\/developer.apple.com\/documentation\/AppKit\/NSButton\/BezelStyle-swift.enum\/roundedDisclosure"
        },
        {
          "description" : "A bezel style appropriate for use as an action or auxiliary button in scope bars and title bar accessories.",
          "name" : "roundRect",
          "url" : "https:\/\/developer.apple.com\/documentation\/AppKit\/NSButton\/BezelStyle-swift.enum\/roundRect"
        },
        {
          "description" : "A bezel style appropriate for use in the toolbar or title bar regions of a window.",
          "name" : "texturedRounded",
          "url" : "https:\/\/developer.apple.com\/documentation\/AppKit\/NSButton\/BezelStyle-swift.enum\/texturedRounded"
        }
      ],
      "title" : "Properties"
    }
  ],
  "source" : "appleJSON",
  "title" : "rounded",
  "url" : "https:\/\/developer.apple.com\/documentation\/appkit\/nsbutton\/bezelstyle-swift.enum\/rounded"
}