{
  "abstract" : "Initializes a newly allocated gradient object with the specified colors, color locations, and color space.",
  "codeExamples" : [

  ],
  "contentHash" : "59da68fd33dba48f95d75b8dce265941ce339ed1a59efbecc4d67d90d88cdb38",
  "crawledAt" : "2025-12-04T11:07:15Z",
  "declaration" : {
    "code" : "init?(colors colorArray: [NSColor], atLocations locations: UnsafePointer<CGFloat>?, colorSpace: NSColorSpace)",
    "language" : "swift"
  },
  "id" : "3ADDD633-0D8D-47D5-84C8-6B8D2CD59A6D",
  "kind" : "unknown",
  "language" : "swift",
  "module" : "AppKit",
  "overview" : "## Return Value\n\nThe initialized `NSGradient` object.\n\n## Discussion\n\nThis method is the designated initializer of `NSGradient`. The colors in the `colorArray` parameter are converted to the specified color space if they are not already in that color space.\n\nTypically, at least one color should have a location of 0.0 and one should have a location of 1.0. If these locations are not specified, the color at the closest color stop is used to fill the gap.",
  "platforms" : [
    "macOS"
  ],
  "rawMarkdown" : "---\nsource: https:\/\/developer.apple.com\/documentation\/AppKit\/NSGradient\/init(colors:atLocations:colorSpace:)\ncrawled: 2025-12-04T11:07:15Z\n---\n\n# init(colors:atLocations:colorSpace:)\n\n**Initializer**\n\nInitializes a newly allocated gradient object with the specified colors, color locations, and color space.\n\n## Declaration\n\n```swift\ninit?(colors colorArray: [NSColor], atLocations locations: UnsafePointer<CGFloat>?, colorSpace: NSColorSpace)\n```\n\n## Parameters\n\n- **colorArray**: An array of `NSColor` objects representing the colors in the gradient.\n- **locations**: An array of `CGFloat` values containing the location for each color in the gradient. Each value must be in the range 0.0 to 1.0. There must be the same number of locations as are colors in the `colorArray` parameter.\n- **colorSpace**: The color space to use for the gradient.\n\n## Return Value\n\nThe initialized `NSGradient` object.\n\n## Discussion\n\nThis method is the designated initializer of `NSGradient`. The colors in the `colorArray` parameter are converted to the specified color space if they are not already in that color space.\n\nTypically, at least one color should have a location of 0.0 and one should have a location of 1.0. If these locations are not specified, the color at the closest color stop is used to fill the gap.\n\n## Creating a Gradient\n\n- **init(starting:ending:)**: Initializes a newly allocated gradient object with two colors.\n- **init(colors:)**: Initializes a newly allocated gradient object with an array of colors.\n- **init(colorsAndLocations:)**: Initializes a newly allocated gradient object with a comma-separated list of arguments.\n- **init(coder:)**: Creates a gradient from data in an unarchiver.\n\n",
  "sections" : [
    {
      "content" : "",
      "items" : [
        {
          "description" : "Initializes a newly allocated gradient object with two colors.",
          "name" : "init(starting:ending:)",
          "url" : "https:\/\/developer.apple.com\/documentation\/AppKit\/NSGradient\/init(starting:ending:)"
        },
        {
          "description" : "Initializes a newly allocated gradient object with an array of colors.",
          "name" : "init(colors:)",
          "url" : "https:\/\/developer.apple.com\/documentation\/AppKit\/NSGradient\/init(colors:)"
        },
        {
          "description" : "Initializes a newly allocated gradient object with a comma-separated list of arguments.",
          "name" : "init(colorsAndLocations:)",
          "url" : "https:\/\/developer.apple.com\/documentation\/AppKit\/NSGradient\/init(colorsAndLocations:)"
        },
        {
          "description" : "Creates a gradient from data in an unarchiver.",
          "name" : "init(coder:)",
          "url" : "https:\/\/developer.apple.com\/documentation\/AppKit\/NSGradient\/init(coder:)"
        }
      ],
      "title" : "Creating a Gradient"
    }
  ],
  "source" : "appleJSON",
  "title" : "init(colors:atLocations:colorSpace:)",
  "url" : "https:\/\/developer.apple.com\/documentation\/AppKit\/NSGradient\/init(colors:atLocations:colorSpace:)"
}