{
  "abstract" : "Creates and returns a new event object that describes a custom event.",
  "codeExamples" : [

  ],
  "contentHash" : "bfa7e134ff28bb964a38185fffecb615569aa4475e4edae083bfe3c2469242ca",
  "crawledAt" : "2025-12-04T00:08:28Z",
  "declaration" : {
    "code" : "class func otherEvent(with type: NSEvent.EventType, location: NSPoint, modifierFlags flags: NSEvent.ModifierFlags, timestamp time: TimeInterval, windowNumber wNum: Int, context unusedPassNil: NSGraphicsContext?, subtype: Int16, data1 d1: Int, data2 d2: Int) -> NSEvent?",
    "language" : "swift"
  },
  "id" : "162748C0-B554-4846-AFAC-21282923315D",
  "kind" : "method",
  "language" : "swift",
  "module" : "AppKit",
  "overview" : "## Return Value\n\nThe created `NSEvent` object or `nil` if the object couldn’t be created.",
  "platforms" : [
    "macOS"
  ],
  "rawMarkdown" : "---\nsource: https:\/\/developer.apple.com\/documentation\/AppKit\/NSEvent\/otherEvent(with:location:modifierFlags:timestamp:windowNumber:context:subtype:data1:data2:)\ncrawled: 2025-12-04T00:08:28Z\n---\n\n# otherEvent(with:location:modifierFlags:timestamp:windowNumber:context:subtype:data1:data2:)\n\n**Type Method**\n\nCreates and returns a new event object that describes a custom event.\n\n## Declaration\n\n```swift\nclass func otherEvent(with type: NSEvent.EventType, location: NSPoint, modifierFlags flags: NSEvent.ModifierFlags, timestamp time: TimeInterval, windowNumber wNum: Int, context unusedPassNil: NSGraphicsContext?, subtype: Int16, data1 d1: Int, data2 d2: Int) -> NSEvent?\n```\n\n## Parameters\n\n- **type**: One of the following event-type constants:\n\n- `NSAppKitDefined`\n- `NSSystemDefined`\n- `NSApplicationDefined`\n- `NSPeriodic`\n\nIf `type` is anything else, an `NSInternalInconsistencyException` is raised. Your code should only create events of type `NSApplicationDefined`.\n- **location**: The cursor location in the base coordinate system of the window specified by `windowNum`.\n- **flags**: An integer bit field containing any of the modifier key masks described in `Getting Unicode Values`, combined using the C bitwise OR operator.\n- **time**: The time the event occurred in seconds since system startup.\n- **wNum**: An integer that identifies the window device associated with the event, which is associated with the `NSWindow` that will receive the event.\n- **unusedPassNil**: The display graphics context of the event. Pass `nil` for this parameter.\n- **subtype**: A numeric identifier that further differentiates custom events of types `NSAppKitDefined`, `NSSystemDefined`, and `NSApplicationDefined`. `NSPeriodic` events don’t use this attribute.\n- **d1**: Additional data associated with the event. `NSPeriodic` events don’t use these attributes.\n- **d2**: Additional data associated with the event. `NSPeriodic` events don’t use these attributes.\n\n## Return Value\n\nThe created `NSEvent` object or `nil` if the object couldn’t be created.\n\n## Related Documentation\n\n- **subtype**: The event’s subtype.\n- **data1**: Additional data associated with this event.\n- **systemUptime**: The amount of time the system has been awake since the last time it was restarted.\n- **data2**: Additional data associated with this event.\n\n## Creating an event object\n\n- **keyEvent(with:location:modifierFlags:timestamp:windowNumber:context:characters:charactersIgnoringModifiers:isARepeat:keyCode:)**: Creates and returns a new event object that describes a key event.\n- **mouseEvent(with:location:modifierFlags:timestamp:windowNumber:context:eventNumber:clickCount:pressure:)**: Creates and returns a new event object that describes a mouse-down, -up, -moved, or -dragged event.\n- **enterExitEvent(with:location:modifierFlags:timestamp:windowNumber:context:eventNumber:trackingNumber:userData:)**: Creates and returns a new event object that describes a tracking-rectangle or cursor-update event.\n- **init(eventRef:)**: Creates and returns a new event object for a Carbon event.\n- **init(cgEvent:)**: Creates and returns an event object for a Core Graphics event.\n\n",
  "sections" : [
    {
      "content" : "",
      "items" : [
        {
          "description" : "The event’s subtype.",
          "name" : "subtype",
          "url" : "https:\/\/developer.apple.com\/documentation\/AppKit\/NSEvent\/subtype"
        },
        {
          "description" : "Additional data associated with this event.",
          "name" : "data1",
          "url" : "https:\/\/developer.apple.com\/documentation\/AppKit\/NSEvent\/data1"
        },
        {
          "description" : "The amount of time the system has been awake since the last time it was restarted.",
          "name" : "systemUptime",
          "url" : "https:\/\/developer.apple.com\/documentation\/Foundation\/ProcessInfo\/systemUptime"
        },
        {
          "description" : "Additional data associated with this event.",
          "name" : "data2",
          "url" : "https:\/\/developer.apple.com\/documentation\/AppKit\/NSEvent\/data2"
        }
      ],
      "title" : "Related Documentation"
    },
    {
      "content" : "",
      "items" : [
        {
          "description" : "Creates and returns a new event object that describes a key event.",
          "name" : "keyEvent(with:location:modifierFlags:timestamp:windowNumber:context:characters:charactersIgnoringModifiers:isARepeat:keyCode:)",
          "url" : "https:\/\/developer.apple.com\/documentation\/AppKit\/NSEvent\/keyEvent(with:location:modifierFlags:timestamp:windowNumber:context:characters:charactersIgnoringModifiers:isARepeat:keyCode:)"
        },
        {
          "description" : "Creates and returns a new event object that describes a mouse-down, -up, -moved, or -dragged event.",
          "name" : "mouseEvent(with:location:modifierFlags:timestamp:windowNumber:context:eventNumber:clickCount:pressure:)",
          "url" : "https:\/\/developer.apple.com\/documentation\/AppKit\/NSEvent\/mouseEvent(with:location:modifierFlags:timestamp:windowNumber:context:eventNumber:clickCount:pressure:)"
        },
        {
          "description" : "Creates and returns a new event object that describes a tracking-rectangle or cursor-update event.",
          "name" : "enterExitEvent(with:location:modifierFlags:timestamp:windowNumber:context:eventNumber:trackingNumber:userData:)",
          "url" : "https:\/\/developer.apple.com\/documentation\/AppKit\/NSEvent\/enterExitEvent(with:location:modifierFlags:timestamp:windowNumber:context:eventNumber:trackingNumber:userData:)"
        },
        {
          "description" : "Creates and returns a new event object for a Carbon event.",
          "name" : "init(eventRef:)",
          "url" : "https:\/\/developer.apple.com\/documentation\/AppKit\/NSEvent\/init(eventRef:)"
        },
        {
          "description" : "Creates and returns an event object for a Core Graphics event.",
          "name" : "init(cgEvent:)",
          "url" : "https:\/\/developer.apple.com\/documentation\/AppKit\/NSEvent\/init(cgEvent:)"
        }
      ],
      "title" : "Creating an event object"
    }
  ],
  "source" : "appleJSON",
  "title" : "otherEvent(with:location:modifierFlags:timestamp:windowNumber:context:subtype:data1:data2:)",
  "url" : "https:\/\/developer.apple.com\/documentation\/AppKit\/NSEvent\/otherEvent(with:location:modifierFlags:timestamp:windowNumber:context:subtype:data1:data2:)"
}