{
  "abstract" : "Returns the index in the text storage for the first character of the specified glyph.",
  "codeExamples" : [

  ],
  "contentHash" : "a8e8b565517d6f1e82f6f099fc35fbb23c2a39ebcc2643ef5d1f5cfbea8062cd",
  "crawledAt" : "2025-12-04T02:27:09Z",
  "declaration" : {
    "code" : "func characterIndexForGlyph(at glyphIndex: Int) -> Int",
    "language" : "swift"
  },
  "id" : "B4C7B4C3-ECD3-4813-B09D-FA22D3BDD351",
  "kind" : "method",
  "language" : "swift",
  "module" : "AppKit",
  "overview" : "## Return Value\n\nThe index of the first character associated with the glyph at the specified index.\n\n## Discussion\n\nIf noncontiguous layout is not enabled, this method causes generation of all glyphs up to and including `glyphIndex`. This method accepts an index beyond the last glyph, returning an index extrapolated from the last actual glyph index.\n\nIn many cases it’s better to use the range-mapping methods, [doc:\/\/com.apple.appkit\/documentation\/AppKit\/NSLayoutManager\/characterRange(forGlyphRange:actualGlyphRange:)] and [doc:\/\/com.apple.appkit\/documentation\/AppKit\/NSLayoutManager\/glyphRange(forCharacterRange:actualCharacterRange:)], which provide more comprehensive information.",
  "platforms" : [
    "macOS"
  ],
  "rawMarkdown" : "---\nsource: https:\/\/developer.apple.com\/documentation\/AppKit\/NSLayoutManager\/characterIndexForGlyph(at:)\ncrawled: 2025-12-04T02:27:09Z\n---\n\n# characterIndexForGlyph(at:)\n\n**Instance Method**\n\nReturns the index in the text storage for the first character of the specified glyph.\n\n## Declaration\n\n```swift\nfunc characterIndexForGlyph(at glyphIndex: Int) -> Int\n```\n\n## Parameters\n\n- **glyphIndex**: The index of the glyph for which to return the associated character.\n\n## Return Value\n\nThe index of the first character associated with the glyph at the specified index.\n\n## Discussion\n\nIf noncontiguous layout is not enabled, this method causes generation of all glyphs up to and including `glyphIndex`. This method accepts an index beyond the last glyph, returning an index extrapolated from the last actual glyph index.\n\nIn many cases it’s better to use the range-mapping methods, [doc:\/\/com.apple.appkit\/documentation\/AppKit\/NSLayoutManager\/characterRange(forGlyphRange:actualGlyphRange:)] and [doc:\/\/com.apple.appkit\/documentation\/AppKit\/NSLayoutManager\/glyphRange(forCharacterRange:actualCharacterRange:)], which provide more comprehensive information.\n\n## Accessing glyphs\n\n- **getGlyphs(in:glyphs:properties:characterIndexes:bidiLevels:)**: Fills a passed-in buffer with a sequence of glyphs.\n- **cgGlyph(at:)**: Returns the glyph at the specified index.\n- **cgGlyph(at:isValidIndex:)**: Returns the glyph at the specified index along with information about whether the glyph index is valid.\n- **setGlyphs(_:properties:characterIndexes:font:forGlyphRange:)**: Stores the initial glyphs and glyph properties for a character range.\n- **glyphIndexForCharacter(at:)**: Returns the index of the first glyph of the character at the specified index.\n- **isValidGlyphIndex(_:)**: Indicates whether the specified index refers to a valid glyph.\n- **numberOfGlyphs**: The number of glyphs in the layout manager.\n- **propertyForGlyph(at:)**: Returns the glyph property of the glyph at the specified index.\n- **NSLayoutManager.GlyphProperty**: Glyph properties.\n\n",
  "sections" : [
    {
      "content" : "",
      "items" : [
        {
          "description" : "Fills a passed-in buffer with a sequence of glyphs.",
          "name" : "getGlyphs(in:glyphs:properties:characterIndexes:bidiLevels:)",
          "url" : "https:\/\/developer.apple.com\/documentation\/AppKit\/NSLayoutManager\/getGlyphs(in:glyphs:properties:characterIndexes:bidiLevels:)"
        },
        {
          "description" : "Returns the glyph at the specified index.",
          "name" : "cgGlyph(at:)",
          "url" : "https:\/\/developer.apple.com\/documentation\/AppKit\/NSLayoutManager\/cgGlyph(at:)"
        },
        {
          "description" : "Returns the glyph at the specified index along with information about whether the glyph index is valid.",
          "name" : "cgGlyph(at:isValidIndex:)",
          "url" : "https:\/\/developer.apple.com\/documentation\/AppKit\/NSLayoutManager\/cgGlyph(at:isValidIndex:)"
        },
        {
          "description" : "Stores the initial glyphs and glyph properties for a character range.",
          "name" : "setGlyphs(_:properties:characterIndexes:font:forGlyphRange:)",
          "url" : "https:\/\/developer.apple.com\/documentation\/AppKit\/NSLayoutManager\/setGlyphs(_:properties:characterIndexes:font:forGlyphRange:)"
        },
        {
          "description" : "Returns the index of the first glyph of the character at the specified index.",
          "name" : "glyphIndexForCharacter(at:)",
          "url" : "https:\/\/developer.apple.com\/documentation\/AppKit\/NSLayoutManager\/glyphIndexForCharacter(at:)"
        },
        {
          "description" : "Indicates whether the specified index refers to a valid glyph.",
          "name" : "isValidGlyphIndex(_:)",
          "url" : "https:\/\/developer.apple.com\/documentation\/AppKit\/NSLayoutManager\/isValidGlyphIndex(_:)"
        },
        {
          "description" : "The number of glyphs in the layout manager.",
          "name" : "numberOfGlyphs",
          "url" : "https:\/\/developer.apple.com\/documentation\/AppKit\/NSLayoutManager\/numberOfGlyphs"
        },
        {
          "description" : "Returns the glyph property of the glyph at the specified index.",
          "name" : "propertyForGlyph(at:)",
          "url" : "https:\/\/developer.apple.com\/documentation\/AppKit\/NSLayoutManager\/propertyForGlyph(at:)"
        },
        {
          "description" : "Glyph properties.",
          "name" : "NSLayoutManager.GlyphProperty",
          "url" : "https:\/\/developer.apple.com\/documentation\/AppKit\/NSLayoutManager\/GlyphProperty"
        }
      ],
      "title" : "Accessing glyphs"
    }
  ],
  "source" : "appleJSON",
  "title" : "characterIndexForGlyph(at:)",
  "url" : "https:\/\/developer.apple.com\/documentation\/AppKit\/NSLayoutManager\/characterIndexForGlyph(at:)"
}