{
  "abstract" : "Creates a configuration that specifies that the symbol should prefer its multicolor variant if one exists.",
  "codeExamples" : [

  ],
  "contentHash" : "2bf28d44226a01aa9ae06a4becf7315db153cd98a2ecb48243eaeb64e5b40461",
  "crawledAt" : "2025-12-02T07:23:53Z",
  "declaration" : {
    "code" : "class func preferringMulticolor() -> Self",
    "language" : "swift"
  },
  "id" : "E31A2596-0155-4727-B2A4-69CD74FF2537",
  "kind" : "method",
  "module" : "AppKit",
  "overview" : "## Return Value\n\nA new configuration object that prefers its multicolor variant.\n\n## Discussion\n\nYou can combine this configuration with one of the palette-based configurations. In that case, the symbol uses the multicolor variant if one exists; otherwise the symbol uses the palette version.\n\nIf the symbol supports neither, the symbol uses the monochrome (templated) symbol.",
  "platforms" : [
    "macOS"
  ],
  "rawMarkdown" : "---\nsource: https:\/\/developer.apple.com\/documentation\/AppKit\/NSImage\/SymbolConfiguration-swift.class\/preferringMulticolor()\ncrawled: 2025-12-02T07:23:53Z\n---\n\n# preferringMulticolor()\n\n**Type Method**\n\nCreates a configuration that specifies that the symbol should prefer its multicolor variant if one exists.\n\n## Declaration\n\n```swift\nclass func preferringMulticolor() -> Self\n```\n\n## Return Value\n\nA new configuration object that prefers its multicolor variant.\n\n## Discussion\n\nYou can combine this configuration with one of the palette-based configurations. In that case, the symbol uses the multicolor variant if one exists; otherwise the symbol uses the palette version.\n\nIf the symbol supports neither, the symbol uses the monochrome (templated) symbol.\n\n## Creating a Color Configuration\n\n- **init(paletteColors:)**: Creates a color configuration by specifying a palette of colors.\n- **init(hierarchicalColor:)**: Creates a hierarchical color configuration using the color you specify.\n\n",
  "sections" : [
    {
      "content" : "",
      "items" : [
        {
          "description" : "Creates a color configuration by specifying a palette of colors.",
          "name" : "init(paletteColors:)",
          "url" : "https:\/\/developer.apple.com\/documentation\/AppKit\/NSImage\/SymbolConfiguration-swift.class\/init(paletteColors:)"
        },
        {
          "description" : "Creates a hierarchical color configuration using the color you specify.",
          "name" : "init(hierarchicalColor:)",
          "url" : "https:\/\/developer.apple.com\/documentation\/AppKit\/NSImage\/SymbolConfiguration-swift.class\/init(hierarchicalColor:)"
        }
      ],
      "title" : "Creating a Color Configuration"
    }
  ],
  "source" : "appleJSON",
  "title" : "preferringMulticolor()",
  "url" : "https:\/\/developer.apple.com\/documentation\/AppKit\/NSImage\/SymbolConfiguration-swift.class\/preferringMulticolor()"
}