{
  "abstract" : "Posted when the application enters context-sensitive help mode. This typically happens when the user holds down the Help key.",
  "codeExamples" : [

  ],
  "contentHash" : "5ec985988e5aa159c4d759cd3ee5250cd91f572e005efd9d9dc8faa29b79d61d",
  "crawledAt" : "2025-12-04T02:39:33Z",
  "declaration" : {
    "code" : "class let contextHelpModeDidActivateNotification: NSNotification.Name",
    "language" : "swift"
  },
  "id" : "E73B4FAE-E114-4BA0-B344-783D17E68C34",
  "kind" : "property",
  "language" : "swift",
  "module" : "AppKit",
  "overview" : "## Discussion\n\nThe notification object is the help manager. This notification does not contain a `userInfo` dictionary.",
  "platforms" : [
    "macOS"
  ],
  "rawMarkdown" : "---\nsource: https:\/\/developer.apple.com\/documentation\/AppKit\/NSHelpManager\/contextHelpModeDidActivateNotification\ncrawled: 2025-12-04T02:39:33Z\n---\n\n# contextHelpModeDidActivateNotification\n\n**Type Property**\n\nPosted when the application enters context-sensitive help mode. This typically happens when the user holds down the Help key.\n\n## Declaration\n\n```swift\nclass let contextHelpModeDidActivateNotification: NSNotification.Name\n```\n\n## Discussion\n\nThe notification object is the help manager. This notification does not contain a `userInfo` dictionary.\n\n## Notifications\n\n- **contextHelpModeDidDeactivateNotification**: Posted when the application exits context-sensitive help mode. This happens when the user clicks the mouse button while the cursor is anywhere on the screen after displaying a context-sensitive help topic.\n\n",
  "sections" : [
    {
      "content" : "",
      "items" : [
        {
          "description" : "Posted when the application exits context-sensitive help mode. This happens when the user clicks the mouse button while the cursor is anywhere on the screen after displaying a context-sensitive help topic.",
          "name" : "contextHelpModeDidDeactivateNotification",
          "url" : "https:\/\/developer.apple.com\/documentation\/AppKit\/NSHelpManager\/contextHelpModeDidDeactivateNotification"
        }
      ],
      "title" : "Notifications"
    }
  ],
  "source" : "appleJSON",
  "title" : "contextHelpModeDidActivateNotification",
  "url" : "https:\/\/developer.apple.com\/documentation\/AppKit\/NSHelpManager\/contextHelpModeDidActivateNotification"
}