{
  "abstract" : "The identifier of the special “other items proxy”, which is used to nest bars up the responder chain.",
  "codeExamples" : [

  ],
  "contentHash" : "b23c51d9bb85e05674b62f7d9fb25fd26306f622bb51a61c4ae2ec1dd4f2ddc4",
  "crawledAt" : "2025-12-05T03:55:12Z",
  "declaration" : {
    "code" : "static let otherItemsProxy: NSTouchBarItem.Identifier",
    "language" : "swift"
  },
  "id" : "3A195E16-7AA6-4585-A14B-D7692AB28604",
  "kind" : "property",
  "language" : "swift",
  "module" : "AppKit",
  "overview" : "## Discussion\n\nUse this identifier in the [doc:\/\/com.apple.appkit\/documentation\/AppKit\/NSTouchBar\/itemIdentifiers] array of an [doc:\/\/com.apple.appkit\/documentation\/AppKit\/NSTouchBar] object, and a special proxy item will be instantiated for you.\n\nWhen the [doc:\/\/com.apple.appkit\/documentation\/AppKit\/NSTouchBar] containing this item is visible, bars provided by objects closer to the first responder will be nested inside the space denoted for this item.Note that a touch bar lacking this item identifier will be replaced in its entirety by touch bars closer to the first responder in the responder chain.",
  "platforms" : [
    "Mac Catalyst",
    "macOS"
  ],
  "rawMarkdown" : "---\nsource: https:\/\/developer.apple.com\/documentation\/AppKit\/NSTouchBarItem\/Identifier-swift.struct\/otherItemsProxy\ncrawled: 2025-12-05T03:55:12Z\n---\n\n# otherItemsProxy\n\n**Type Property**\n\nThe identifier of the special “other items proxy”, which is used to nest bars up the responder chain.\n\n## Declaration\n\n```swift\nstatic let otherItemsProxy: NSTouchBarItem.Identifier\n```\n\n## Discussion\n\nUse this identifier in the [doc:\/\/com.apple.appkit\/documentation\/AppKit\/NSTouchBar\/itemIdentifiers] array of an [doc:\/\/com.apple.appkit\/documentation\/AppKit\/NSTouchBar] object, and a special proxy item will be instantiated for you.\n\nWhen the [doc:\/\/com.apple.appkit\/documentation\/AppKit\/NSTouchBar] containing this item is visible, bars provided by objects closer to the first responder will be nested inside the space denoted for this item.Note that a touch bar lacking this item identifier will be replaced in its entirety by touch bars closer to the first responder in the responder chain.\n\n",
  "sections" : [

  ],
  "source" : "appleJSON",
  "title" : "otherItemsProxy",
  "url" : "https:\/\/developer.apple.com\/documentation\/AppKit\/NSTouchBarItem\/Identifier-swift.struct\/otherItemsProxy"
}