{
  "abstract" : "Adds the specified window controller to the current document.",
  "codeExamples" : [

  ],
  "contentHash" : "1efbfa2249abad2660eb9b772d12e1707c1c6f3daeda69d1154216e3c4e4f3b3",
  "crawledAt" : "2025-11-30T22:09:39Z",
  "declaration" : {
    "code" : "@MainActor func addWindowController(_ windowController: NSWindowController)",
    "language" : "swift"
  },
  "id" : "32D648D1-A36C-4112-B663-86C1A5F015F9",
  "kind" : "method",
  "module" : "AppKit",
  "overview" : "## Discussion\n\nAn [doc:\/\/com.apple.appkit\/documentation\/AppKit\/NSDocument] object uses its list of window controllers when it displays all document windows, sets window edited status upon an undo or redo operation, and modifies window titles. If you create window controllers by overriding [doc:\/\/com.apple.appkit\/documentation\/AppKit\/NSDocument\/windowNibName], this method is invoked automatically. If you create window controllers in [doc:\/\/com.apple.appkit\/documentation\/AppKit\/NSDocument\/makeWindowControllers()] or in any other context, such as in apps that present multiple windows per document, you should invoke this method for each window controller created.\n\nYou cannot attach a window controller to more than one document at a time. The default implementation of this method removes the passed-in window controller from the document to which it is attached, if it is already attached to one, then sends it a [doc:\/\/com.apple.appkit\/documentation\/AppKit\/NSWindowController\/document] message with `self` as the argument. It also ignores redundant invocations.\n\nYou would not typically override this method.",
  "platforms" : [
    "macOS"
  ],
  "rawMarkdown" : "---\nsource: https:\/\/developer.apple.com\/documentation\/AppKit\/NSDocument\/addWindowController(_:)\ncrawled: 2025-11-30T22:09:39Z\n---\n\n# addWindowController(_:)\n\n**Instance Method**\n\nAdds the specified window controller to the current document.\n\n## Declaration\n\n```swift\n@MainActor func addWindowController(_ windowController: NSWindowController)\n```\n\n## Parameters\n\n- **windowController**: The window controller that is added.\n\n## Discussion\n\nAn [doc:\/\/com.apple.appkit\/documentation\/AppKit\/NSDocument] object uses its list of window controllers when it displays all document windows, sets window edited status upon an undo or redo operation, and modifies window titles. If you create window controllers by overriding [doc:\/\/com.apple.appkit\/documentation\/AppKit\/NSDocument\/windowNibName], this method is invoked automatically. If you create window controllers in [doc:\/\/com.apple.appkit\/documentation\/AppKit\/NSDocument\/makeWindowControllers()] or in any other context, such as in apps that present multiple windows per document, you should invoke this method for each window controller created.\n\nYou cannot attach a window controller to more than one document at a time. The default implementation of this method removes the passed-in window controller from the document to which it is attached, if it is already attached to one, then sends it a [doc:\/\/com.apple.appkit\/documentation\/AppKit\/NSWindowController\/document] message with `self` as the argument. It also ignores redundant invocations.\n\nYou would not typically override this method.\n\n## Related Documentation\n\n- **document**: The document associated with the window controller.\n\n## Creating and Managing Window Controllers\n\n- **makeWindowControllers()**: Creates the window controller objects that the document uses to display its content.\n- **removeWindowController(_:)**: Removes the specified window controller from the receiver’s array of window controllers.\n- **windowControllers**: The document’s current window controllers.\n- **windowNibName**: The name of the document’s sole nib file.\n- **windowControllerDidLoadNib(_:)**: Called after one of the document’s window controllers loads its nib file.\n- **windowControllerWillLoadNib(_:)**: Called before one of the document’s window controllers loads its nib file.\n- **shouldCloseWindowController(_:delegate:shouldClose:contextInfo:)**: Determines whether the system should close the document and its associated window.\n\n",
  "sections" : [
    {
      "content" : "",
      "items" : [
        {
          "description" : "The document associated with the window controller.",
          "name" : "document",
          "url" : "https:\/\/developer.apple.com\/documentation\/AppKit\/NSWindowController\/document"
        }
      ],
      "title" : "Related Documentation"
    },
    {
      "content" : "",
      "items" : [
        {
          "description" : "Creates the window controller objects that the document uses to display its content.",
          "name" : "makeWindowControllers()",
          "url" : "https:\/\/developer.apple.com\/documentation\/AppKit\/NSDocument\/makeWindowControllers()"
        },
        {
          "description" : "Removes the specified window controller from the receiver’s array of window controllers.",
          "name" : "removeWindowController(_:)",
          "url" : "https:\/\/developer.apple.com\/documentation\/AppKit\/NSDocument\/removeWindowController(_:)"
        },
        {
          "description" : "The document’s current window controllers.",
          "name" : "windowControllers",
          "url" : "https:\/\/developer.apple.com\/documentation\/AppKit\/NSDocument\/windowControllers"
        },
        {
          "description" : "The name of the document’s sole nib file.",
          "name" : "windowNibName",
          "url" : "https:\/\/developer.apple.com\/documentation\/AppKit\/NSDocument\/windowNibName"
        },
        {
          "description" : "Called after one of the document’s window controllers loads its nib file.",
          "name" : "windowControllerDidLoadNib(_:)",
          "url" : "https:\/\/developer.apple.com\/documentation\/AppKit\/NSDocument\/windowControllerDidLoadNib(_:)"
        },
        {
          "description" : "Called before one of the document’s window controllers loads its nib file.",
          "name" : "windowControllerWillLoadNib(_:)",
          "url" : "https:\/\/developer.apple.com\/documentation\/AppKit\/NSDocument\/windowControllerWillLoadNib(_:)"
        },
        {
          "description" : "Determines whether the system should close the document and its associated window.",
          "name" : "shouldCloseWindowController(_:delegate:shouldClose:contextInfo:)",
          "url" : "https:\/\/developer.apple.com\/documentation\/AppKit\/NSDocument\/shouldCloseWindowController(_:delegate:shouldClose:contextInfo:)"
        }
      ],
      "title" : "Creating and Managing Window Controllers"
    }
  ],
  "source" : "appleJSON",
  "title" : "addWindowController(_:)",
  "url" : "https:\/\/developer.apple.com\/documentation\/AppKit\/NSDocument\/addWindowController(_:)"
}