{
  "abstract" : "Returns an array of attribute names recognized by the receiver.",
  "codeExamples" : [

  ],
  "contentHash" : "f3afbb35e2a9a571496810945eb1a59ba43c34e6a60a51aa56ae904f0fa96601",
  "crawledAt" : "2025-12-04T12:42:13Z",
  "declaration" : {
    "code" : "func validAttributesForMarkedText() -> [NSAttributedString.Key]",
    "language" : "swift"
  },
  "id" : "3034D620-EB03-45E9-9A4B-92CA80304CDE",
  "kind" : "method",
  "language" : "swift",
  "module" : "AppKit",
  "overview" : "## Return Value\n\nAn array of `NSString` objects representing names for the supported attributes.\n\n## Discussion\n\nReturns an empty array if no attributes are supported. See NSAttributedString Application Kit Additions Reference for the set of string constants representing standard attributes.",
  "platforms" : [
    "macOS"
  ],
  "rawMarkdown" : "---\nsource: https:\/\/developer.apple.com\/documentation\/AppKit\/NSTextInputClient\/validAttributesForMarkedText()\ncrawled: 2025-12-04T12:42:13Z\n---\n\n# validAttributesForMarkedText()\n\n**Instance Method**\n\nReturns an array of attribute names recognized by the receiver.\n\n## Declaration\n\n```swift\nfunc validAttributesForMarkedText() -> [NSAttributedString.Key]\n```\n\n## Return Value\n\nAn array of `NSString` objects representing names for the supported attributes.\n\n## Discussion\n\nReturns an empty array if no attributes are supported. See NSAttributedString Application Kit Additions Reference for the set of string constants representing standard attributes.\n\n## Handling marked text\n\n- **hasMarkedText()**: Returns a Boolean value indicating whether the receiver has marked text.\n- **markedRange()**: Returns the range of the marked text.\n- **selectedRange()**: Returns the range of selected text.\n- **setMarkedText(_:selectedRange:replacementRange:)**: Replaces a specified range in the receiver’s text storage with the given string and sets the selection.\n- **unmarkText()**: Unmarks the marked text.\n\n",
  "sections" : [
    {
      "content" : "",
      "items" : [
        {
          "description" : "Returns a Boolean value indicating whether the receiver has marked text.",
          "name" : "hasMarkedText()",
          "url" : "https:\/\/developer.apple.com\/documentation\/AppKit\/NSTextInputClient\/hasMarkedText()"
        },
        {
          "description" : "Returns the range of the marked text.",
          "name" : "markedRange()",
          "url" : "https:\/\/developer.apple.com\/documentation\/AppKit\/NSTextInputClient\/markedRange()"
        },
        {
          "description" : "Returns the range of selected text.",
          "name" : "selectedRange()",
          "url" : "https:\/\/developer.apple.com\/documentation\/AppKit\/NSTextInputClient\/selectedRange()"
        },
        {
          "description" : "Replaces a specified range in the receiver’s text storage with the given string and sets the selection.",
          "name" : "setMarkedText(_:selectedRange:replacementRange:)",
          "url" : "https:\/\/developer.apple.com\/documentation\/AppKit\/NSTextInputClient\/setMarkedText(_:selectedRange:replacementRange:)"
        },
        {
          "description" : "Unmarks the marked text.",
          "name" : "unmarkText()",
          "url" : "https:\/\/developer.apple.com\/documentation\/AppKit\/NSTextInputClient\/unmarkText()"
        }
      ],
      "title" : "Handling marked text"
    }
  ],
  "source" : "appleJSON",
  "title" : "validAttributesForMarkedText()",
  "url" : "https:\/\/developer.apple.com\/documentation\/AppKit\/NSTextInputClient\/validAttributesForMarkedText()"
}