{
  "abstract" : "Determines whether the scrubber should refresh its layout when an item is highlighted.",
  "codeExamples" : [

  ],
  "contentHash" : "7a598f65fc218b363e58c2c354a0be5811884a33478af2940cd0a5d0864adf49",
  "crawledAt" : "2025-12-01T23:05:28Z",
  "declaration" : {
    "code" : "@MainActor var shouldInvalidateLayoutForHighlightChange: Bool { get }",
    "language" : "swift"
  },
  "id" : "269EE3D9-9B30-499C-9716-2E7790447CC7",
  "kind" : "property",
  "module" : "AppKit",
  "overview" : "## Discussion\n\nIf [doc:\/\/com.apple.documentation\/documentation\/Swift\/true], the scrubber invalidates its layout when an item is highlighted. Subclasses should return [doc:\/\/com.apple.documentation\/documentation\/Swift\/true] if the highlight state affects the item layout.\n\nThe base implementation of this method returns [doc:\/\/com.apple.documentation\/documentation\/Swift\/false].",
  "platforms" : [
    "macOS"
  ],
  "rawMarkdown" : "---\nsource: https:\/\/developer.apple.com\/documentation\/AppKit\/NSScrubberLayout\/shouldInvalidateLayoutForHighlightChange\ncrawled: 2025-12-01T23:05:28Z\n---\n\n# shouldInvalidateLayoutForHighlightChange\n\n**Instance Property**\n\nDetermines whether the scrubber should refresh its layout when an item is highlighted.\n\n## Declaration\n\n```swift\n@MainActor var shouldInvalidateLayoutForHighlightChange: Bool { get }\n```\n\n## Discussion\n\nIf [doc:\/\/com.apple.documentation\/documentation\/Swift\/true], the scrubber invalidates its layout when an item is highlighted. Subclasses should return [doc:\/\/com.apple.documentation\/documentation\/Swift\/true] if the highlight state affects the item layout.\n\nThe base implementation of this method returns [doc:\/\/com.apple.documentation\/documentation\/Swift\/false].\n\n## Subclassing a scrubber layout\n\n- **prepare()**: Gives you an opportunity to perform layout calculations when the scrubber’s layout is invalidated.\n- **scrubberContentSize**: The size required to contain all elements within the scrubber.\n- **layoutAttributesForItem(at:)**: The layout attributes for the item with the specified index.\n- **layoutAttributesForItems(in:)**: The set of layout attributes for all items within the provided rectangle.\n- **shouldInvalidateLayoutForSelectionChange**: Determines whether the scrubber should refresh its layout when the selection changes.\n- **shouldInvalidateLayoutForChange(fromVisibleRect:toVisibleRect:)**: Determines whether the scrubber should refresh its layout in response to a change of its visible region.\n- **automaticallyMirrorsInRightToLeftLayout**: Determines whether the scrubber mirrors its layout for right-to-left layouts.\n\n",
  "sections" : [
    {
      "content" : "",
      "items" : [
        {
          "description" : "Gives you an opportunity to perform layout calculations when the scrubber’s layout is invalidated.",
          "name" : "prepare()",
          "url" : "https:\/\/developer.apple.com\/documentation\/AppKit\/NSScrubberLayout\/prepare()"
        },
        {
          "description" : "The size required to contain all elements within the scrubber.",
          "name" : "scrubberContentSize",
          "url" : "https:\/\/developer.apple.com\/documentation\/AppKit\/NSScrubberLayout\/scrubberContentSize"
        },
        {
          "description" : "The layout attributes for the item with the specified index.",
          "name" : "layoutAttributesForItem(at:)",
          "url" : "https:\/\/developer.apple.com\/documentation\/AppKit\/NSScrubberLayout\/layoutAttributesForItem(at:)"
        },
        {
          "description" : "The set of layout attributes for all items within the provided rectangle.",
          "name" : "layoutAttributesForItems(in:)",
          "url" : "https:\/\/developer.apple.com\/documentation\/AppKit\/NSScrubberLayout\/layoutAttributesForItems(in:)"
        },
        {
          "description" : "Determines whether the scrubber should refresh its layout when the selection changes.",
          "name" : "shouldInvalidateLayoutForSelectionChange",
          "url" : "https:\/\/developer.apple.com\/documentation\/AppKit\/NSScrubberLayout\/shouldInvalidateLayoutForSelectionChange"
        },
        {
          "description" : "Determines whether the scrubber should refresh its layout in response to a change of its visible region.",
          "name" : "shouldInvalidateLayoutForChange(fromVisibleRect:toVisibleRect:)",
          "url" : "https:\/\/developer.apple.com\/documentation\/AppKit\/NSScrubberLayout\/shouldInvalidateLayoutForChange(fromVisibleRect:toVisibleRect:)"
        },
        {
          "description" : "Determines whether the scrubber mirrors its layout for right-to-left layouts.",
          "name" : "automaticallyMirrorsInRightToLeftLayout",
          "url" : "https:\/\/developer.apple.com\/documentation\/AppKit\/NSScrubberLayout\/automaticallyMirrorsInRightToLeftLayout"
        }
      ],
      "title" : "Subclassing a scrubber layout"
    }
  ],
  "source" : "appleJSON",
  "title" : "shouldInvalidateLayoutForHighlightChange",
  "url" : "https:\/\/developer.apple.com\/documentation\/AppKit\/NSScrubberLayout\/shouldInvalidateLayoutForHighlightChange"
}