{
  "abstract" : "Delivers the results of the print operation to the intended destination.",
  "codeExamples" : [

  ],
  "contentHash" : "6d04e7018bc910b8e17bb8d7477187a23f04994ff1ddff2a101e92750c6af5c6",
  "crawledAt" : "2025-12-04T11:09:35Z",
  "declaration" : {
    "code" : "@MainActor func deliverResult() -> Bool",
    "language" : "swift"
  },
  "id" : "FB0A04B4-5E52-4515-82CE-F60C9EB9740C",
  "kind" : "method",
  "language" : "swift",
  "module" : "AppKit",
  "overview" : "## Return Value\n\n[doc:\/\/com.apple.documentation\/documentation\/Swift\/true] if the results were successfully delivered; otherwise, [doc:\/\/com.apple.documentation\/documentation\/Swift\/false].\n\n## Discussion\n\nThis method may be called to deliver the results to the printer spool or preview application.  Do not invoke this method directly—it is invoked automatically when the print operation is done.",
  "platforms" : [
    "macOS"
  ],
  "rawMarkdown" : "---\nsource: https:\/\/developer.apple.com\/documentation\/AppKit\/NSPrintOperation\/deliverResult()\ncrawled: 2025-12-04T11:09:35Z\n---\n\n# deliverResult()\n\n**Instance Method**\n\nDelivers the results of the print operation to the intended destination.\n\n## Declaration\n\n```swift\n@MainActor func deliverResult() -> Bool\n```\n\n## Return Value\n\n[doc:\/\/com.apple.documentation\/documentation\/Swift\/true] if the results were successfully delivered; otherwise, [doc:\/\/com.apple.documentation\/documentation\/Swift\/false].\n\n## Discussion\n\nThis method may be called to deliver the results to the printer spool or preview application.  Do not invoke this method directly—it is invoked automatically when the print operation is done.\n\n## Running the Print Operation\n\n- **run()**: Runs the print operation on the current thread.\n- **runModal(for:delegate:didRun:contextInfo:)**: Runs the print operation, calling your custom delegate method upon completion.\n- **cleanUp()**: Called at the end of a print operation to remove the print operation as the current operation.\n\n",
  "sections" : [
    {
      "content" : "",
      "items" : [
        {
          "description" : "Runs the print operation on the current thread.",
          "name" : "run()",
          "url" : "https:\/\/developer.apple.com\/documentation\/AppKit\/NSPrintOperation\/run()"
        },
        {
          "description" : "Runs the print operation, calling your custom delegate method upon completion.",
          "name" : "runModal(for:delegate:didRun:contextInfo:)",
          "url" : "https:\/\/developer.apple.com\/documentation\/AppKit\/NSPrintOperation\/runModal(for:delegate:didRun:contextInfo:)"
        },
        {
          "description" : "Called at the end of a print operation to remove the print operation as the current operation.",
          "name" : "cleanUp()",
          "url" : "https:\/\/developer.apple.com\/documentation\/AppKit\/NSPrintOperation\/cleanUp()"
        }
      ],
      "title" : "Running the Print Operation"
    }
  ],
  "source" : "appleJSON",
  "title" : "deliverResult()",
  "url" : "https:\/\/developer.apple.com\/documentation\/AppKit\/NSPrintOperation\/deliverResult()"
}