{
  "abstract" : "Sets by name and size of the font used to draw the key equivalent.",
  "codeExamples" : [

  ],
  "contentHash" : "a1791039f42920b232c5b63dc972d5d0630692ec87038d880e7b8072f0f8f3a9",
  "crawledAt" : "2025-12-02T04:58:00Z",
  "declaration" : {
    "code" : "@MainActor func setKeyEquivalentFont(_ fontName: String, size fontSize: CGFloat)",
    "language" : "swift"
  },
  "id" : "F38E098C-7555-42DA-9315-B6564AD979F8",
  "kind" : "method",
  "module" : "AppKit",
  "overview" : "## Discussion\n\nThis method redisplays the button if necessary. It does nothing if the button doesn’t have a key equivalent associated with it. The default font is the same as that used to draw the title.",
  "platforms" : [
    "macOS"
  ],
  "rawMarkdown" : "---\nsource: https:\/\/developer.apple.com\/documentation\/AppKit\/NSButtonCell\/setKeyEquivalentFont(_:size:)\ncrawled: 2025-12-02T04:58:00Z\n---\n\n# setKeyEquivalentFont(_:size:)\n\n**Instance Method**\n\nSets by name and size of the font used to draw the key equivalent.\n\n## Declaration\n\n```swift\n@MainActor func setKeyEquivalentFont(_ fontName: String, size fontSize: CGFloat)\n```\n\n## Parameters\n\n- **fontName**: The name of the font to use to draw the key equivalent.\n- **fontSize**: The font size to use to draw the key equivalent.\n\n## Discussion\n\nThis method redisplays the button if necessary. It does nothing if the button doesn’t have a key equivalent associated with it. The default font is the same as that used to draw the title.\n\n## Related Documentation\n\n- **font**: The font that the cell uses to display text.\n\n## Managing the Key Equivalent\n\n- **keyEquivalent**: The button’s key-equivalent character.\n- **keyEquivalentFont**: The font used to draw the button’s key equivalent.\n- **keyEquivalentModifierMask**: The mask that identifies the modifier keys for the button’s key equivalent.\n\n",
  "sections" : [
    {
      "content" : "",
      "items" : [
        {
          "description" : "The font that the cell uses to display text.",
          "name" : "font",
          "url" : "https:\/\/developer.apple.com\/documentation\/AppKit\/NSCell\/font"
        }
      ],
      "title" : "Related Documentation"
    },
    {
      "content" : "",
      "items" : [
        {
          "description" : "The button’s key-equivalent character.",
          "name" : "keyEquivalent",
          "url" : "https:\/\/developer.apple.com\/documentation\/AppKit\/NSButtonCell\/keyEquivalent"
        },
        {
          "description" : "The font used to draw the button’s key equivalent.",
          "name" : "keyEquivalentFont",
          "url" : "https:\/\/developer.apple.com\/documentation\/AppKit\/NSButtonCell\/keyEquivalentFont"
        },
        {
          "description" : "The mask that identifies the modifier keys for the button’s key equivalent.",
          "name" : "keyEquivalentModifierMask",
          "url" : "https:\/\/developer.apple.com\/documentation\/AppKit\/NSButtonCell\/keyEquivalentModifierMask"
        }
      ],
      "title" : "Managing the Key Equivalent"
    }
  ],
  "source" : "appleJSON",
  "title" : "setKeyEquivalentFont(_:size:)",
  "url" : "https:\/\/developer.apple.com\/documentation\/AppKit\/NSButtonCell\/setKeyEquivalentFont(_:size:)"
}