{
  "abstract" : "Invoked to allow the delegate to provide custom sizing behavior when a column’s resize divider is double clicked.",
  "codeExamples" : [

  ],
  "contentHash" : "a93794af54d3bb135c3bf2eb1adf3e2fe15b1bd7f22649167b40692350c1f102",
  "crawledAt" : "2025-12-05T20:20:33Z",
  "declaration" : {
    "code" : "@MainActor optional func outlineView(_ outlineView: NSOutlineView, sizeToFitWidthOfColumn column: Int) -> CGFloat",
    "language" : "swift"
  },
  "id" : "5B206752-7A63-4000-832C-28F8DADAA71B",
  "kind" : "method",
  "language" : "swift",
  "module" : "AppKit",
  "overview" : "## Return Value\n\nThe width of the specified column.\n\n## Discussion\n\nBy default, `NSOutlineView` iterates every row in the table, accesses a cell via [doc:\/\/com.apple.appkit\/documentation\/AppKit\/NSTableView\/preparedCell(atColumn:row:)], and requests the [doc:\/\/com.apple.appkit\/documentation\/AppKit\/NSCell\/cellSize] to find the appropriate largest width to use.\n\nFor accurate results and performance, it is recommended that this method is implemented when using large tables. By default, large tables use a monte carlo simulation instead of iterating every row.",
  "platforms" : [
    "macOS"
  ],
  "rawMarkdown" : "---\nsource: https:\/\/developer.apple.com\/documentation\/AppKit\/NSOutlineViewDelegate\/outlineView(_:sizeToFitWidthOfColumn:)\ncrawled: 2025-12-05T20:20:33Z\n---\n\n# outlineView(_:sizeToFitWidthOfColumn:)\n\n**Instance Method**\n\nInvoked to allow the delegate to provide custom sizing behavior when a column’s resize divider is double clicked.\n\n## Declaration\n\n```swift\n@MainActor optional func outlineView(_ outlineView: NSOutlineView, sizeToFitWidthOfColumn column: Int) -> CGFloat\n```\n\n## Parameters\n\n- **outlineView**: The outline view that sent the message.\n- **column**: The index of the column.\n\n## Return Value\n\nThe width of the specified column.\n\n## Discussion\n\nBy default, `NSOutlineView` iterates every row in the table, accesses a cell via [doc:\/\/com.apple.appkit\/documentation\/AppKit\/NSTableView\/preparedCell(atColumn:row:)], and requests the [doc:\/\/com.apple.appkit\/documentation\/AppKit\/NSCell\/cellSize] to find the appropriate largest width to use.\n\nFor accurate results and performance, it is recommended that this method is implemented when using large tables. By default, large tables use a monte carlo simulation instead of iterating every row.\n\n## Customizing Column and Row Sizes\n\n- **outlineView(_:heightOfRowByItem:)**: Returns the height in points of the row containing `item`.\n\n",
  "sections" : [
    {
      "content" : "",
      "items" : [
        {
          "description" : "Returns the height in points of the row containing `item`.",
          "name" : "outlineView(_:heightOfRowByItem:)",
          "url" : "https:\/\/developer.apple.com\/documentation\/AppKit\/NSOutlineViewDelegate\/outlineView(_:heightOfRowByItem:)"
        }
      ],
      "title" : "Customizing Column and Row Sizes"
    }
  ],
  "source" : "appleJSON",
  "title" : "outlineView(_:sizeToFitWidthOfColumn:)",
  "url" : "https:\/\/developer.apple.com\/documentation\/AppKit\/NSOutlineViewDelegate\/outlineView(_:sizeToFitWidthOfColumn:)"
}