{
  "abstract" : "Options for reading pasteboard data.",
  "codeExamples" : [

  ],
  "conformsTo" : [
    "Equatable",
    "Hashable",
    "RawRepresentable",
    "Sendable",
    "SendableMetatype"
  ],
  "contentHash" : "d12eee94980b6ec2d04008036916665c1f01c39b6c77500ef13a5f85e9ab3175",
  "crawledAt" : "2025-12-04T12:19:24Z",
  "declaration" : {
    "code" : "struct ReadingOptionKey",
    "language" : "swift"
  },
  "id" : "65F59399-1B52-4705-A6A4-4E53AF4F3D3E",
  "kind" : "struct",
  "language" : "swift",
  "module" : "AppKit",
  "overview" : "## Discussion\n\nThese options can be used for both the [doc:\/\/com.apple.appkit\/documentation\/AppKit\/NSPasteboard\/readObjects(forClasses:options:)] and [doc:\/\/com.apple.appkit\/documentation\/AppKit\/NSPasteboard\/canReadObject(forClasses:options:)] methods, unless otherwise specified.  The currently available options allow for customization of how URLS are read from the pasteboard.",
  "platforms" : [
    "macOS"
  ],
  "rawMarkdown" : "---\nsource: https:\/\/developer.apple.com\/documentation\/AppKit\/NSPasteboard\/ReadingOptionKey\ncrawled: 2025-12-04T12:19:24Z\n---\n\n# NSPasteboard.ReadingOptionKey\n\n**Structure**\n\nOptions for reading pasteboard data.\n\n## Declaration\n\n```swift\nstruct ReadingOptionKey\n```\n\n## Discussion\n\nThese options can be used for both the [doc:\/\/com.apple.appkit\/documentation\/AppKit\/NSPasteboard\/readObjects(forClasses:options:)] and [doc:\/\/com.apple.appkit\/documentation\/AppKit\/NSPasteboard\/canReadObject(forClasses:options:)] methods, unless otherwise specified.  The currently available options allow for customization of how URLS are read from the pasteboard.\n\n## Type Properties\n\n- **urlReadingContentsConformToTypes**: Option for reading URLs to restrict the results to URLs with contents that conform to any of the provided UTI types.\n- **urlReadingFileURLsOnly**: Option for reading URLs to restrict the results to file URLs only.\n\n## Initializers\n\n- **init(rawValue:)**\n\n## Reading data\n\n- **readObjects(forClasses:options:)**: Reads from the receiver objects that best match the specified array of classes.\n- **NSPasteboard.ReadingOptions**: Options that specify how to interpret data on the pasteboard when initializing pasteboard data.\n- **pasteboardItems**: An array that contains all the items held by the pasteboard.\n- **index(of:)**: Returns the index of the specified pasteboard item.\n- **data(forType:)**: Returns the data for the specified type from the first item in the receiver that contains the type.\n- **propertyList(forType:)**: Returns the property list for the specified type from the first item in the receiver that contains the type.\n- **string(forType:)**: Returns a concatenation of the strings for the specified type from all the items in the receiver that contain the type.\n\n## Conforms To\n\n- Equatable\n- Hashable\n- RawRepresentable\n- Sendable\n- SendableMetatype\n\n",
  "sections" : [
    {
      "content" : "",
      "items" : [
        {
          "description" : "Option for reading URLs to restrict the results to URLs with contents that conform to any of the provided UTI types.",
          "name" : "urlReadingContentsConformToTypes",
          "url" : "https:\/\/developer.apple.com\/documentation\/AppKit\/NSPasteboard\/ReadingOptionKey\/urlReadingContentsConformToTypes"
        },
        {
          "description" : "Option for reading URLs to restrict the results to file URLs only.",
          "name" : "urlReadingFileURLsOnly",
          "url" : "https:\/\/developer.apple.com\/documentation\/AppKit\/NSPasteboard\/ReadingOptionKey\/urlReadingFileURLsOnly"
        }
      ],
      "title" : "Type Properties"
    },
    {
      "content" : "",
      "items" : [
        {
          "description" : "",
          "name" : "init(rawValue:)",
          "url" : "https:\/\/developer.apple.com\/documentation\/AppKit\/NSPasteboard\/ReadingOptionKey\/init(rawValue:)"
        }
      ],
      "title" : "Initializers"
    },
    {
      "content" : "",
      "items" : [
        {
          "description" : "Reads from the receiver objects that best match the specified array of classes.",
          "name" : "readObjects(forClasses:options:)",
          "url" : "https:\/\/developer.apple.com\/documentation\/AppKit\/NSPasteboard\/readObjects(forClasses:options:)"
        },
        {
          "description" : "Options that specify how to interpret data on the pasteboard when initializing pasteboard data.",
          "name" : "NSPasteboard.ReadingOptions",
          "url" : "https:\/\/developer.apple.com\/documentation\/AppKit\/NSPasteboard\/ReadingOptions"
        },
        {
          "description" : "An array that contains all the items held by the pasteboard.",
          "name" : "pasteboardItems",
          "url" : "https:\/\/developer.apple.com\/documentation\/AppKit\/NSPasteboard\/pasteboardItems"
        },
        {
          "description" : "Returns the index of the specified pasteboard item.",
          "name" : "index(of:)",
          "url" : "https:\/\/developer.apple.com\/documentation\/AppKit\/NSPasteboard\/index(of:)"
        },
        {
          "description" : "Returns the data for the specified type from the first item in the receiver that contains the type.",
          "name" : "data(forType:)",
          "url" : "https:\/\/developer.apple.com\/documentation\/AppKit\/NSPasteboard\/data(forType:)"
        },
        {
          "description" : "Returns the property list for the specified type from the first item in the receiver that contains the type.",
          "name" : "propertyList(forType:)",
          "url" : "https:\/\/developer.apple.com\/documentation\/AppKit\/NSPasteboard\/propertyList(forType:)"
        },
        {
          "description" : "Returns a concatenation of the strings for the specified type from all the items in the receiver that contain the type.",
          "name" : "string(forType:)",
          "url" : "https:\/\/developer.apple.com\/documentation\/AppKit\/NSPasteboard\/string(forType:)"
        }
      ],
      "title" : "Reading data"
    }
  ],
  "source" : "appleJSON",
  "title" : "NSPasteboard.ReadingOptionKey",
  "url" : "https:\/\/developer.apple.com\/documentation\/AppKit\/NSPasteboard\/ReadingOptionKey"
}