{
  "abstract" : "Draws the borders and background associated with the receiver’s menu item (if any).",
  "codeExamples" : [

  ],
  "contentHash" : "71e61dcb31f0ae0b80b2790ebab1e9aa01e8723b913e50f4f6007da100ea5941",
  "crawledAt" : "2025-12-04T01:33:37Z",
  "declaration" : {
    "code" : "@MainActor func drawBorderAndBackground(withFrame cellFrame: NSRect, in controlView: NSView)",
    "language" : "swift"
  },
  "id" : "104953D9-FFA5-40D1-9BA1-BC9B3249461D",
  "kind" : "method",
  "language" : "swift",
  "module" : "AppKit",
  "overview" : "## Discussion\n\nThis method invokes the `NSCell` method [doc:\/\/com.apple.appkit\/documentation\/AppKit\/NSCell\/imageRect(forBounds:)], passing it `cellFrame`, to calculate the rectangle in which to draw the image. The cell invokes this method before invoking the methods to draw the other menu item components.",
  "platforms" : [
    "macOS"
  ],
  "rawMarkdown" : "---\nsource: https:\/\/developer.apple.com\/documentation\/AppKit\/NSMenuItemCell\/drawBorderAndBackground(withFrame:in:)\ncrawled: 2025-12-04T01:33:37Z\n---\n\n# drawBorderAndBackground(withFrame:in:)\n\n**Instance Method**\n\nDraws the borders and background associated with the receiver’s menu item (if any).\n\n## Declaration\n\n```swift\n@MainActor func drawBorderAndBackground(withFrame cellFrame: NSRect, in controlView: NSView)\n```\n\n## Parameters\n\n- **cellFrame**: A rectangle defining the receiver’s frame area.\n- **controlView**: The view object that contains this cell (usually an [doc:\/\/com.apple.appkit\/documentation\/AppKit\/NSControl] object).\n\n## Discussion\n\nThis method invokes the `NSCell` method [doc:\/\/com.apple.appkit\/documentation\/AppKit\/NSCell\/imageRect(forBounds:)], passing it `cellFrame`, to calculate the rectangle in which to draw the image. The cell invokes this method before invoking the methods to draw the other menu item components.\n\n## Related Documentation\n\n- **draw(withFrame:in:)**: Draws the receiver’s border and then draws the interior of the cell.\n\n## Drawing the Menu Item\n\n- **drawImage(withFrame:in:)**: Draws the image associated with the menu item.\n- **drawKeyEquivalent(withFrame:in:)**: Draws the key equivalent associated with the menu item.\n- **drawSeparatorItem(withFrame:in:)**: Draws a menu item separator.\n- **drawStateImage(withFrame:in:)**: Draws the state image associated with the menu item.\n- **drawTitle(withFrame:in:)**: Draws the title associated with the menu item.\n- **needsDisplay**: A Boolean value indicating whether the menu item needs to be displayed.\n\n",
  "sections" : [
    {
      "content" : "",
      "items" : [
        {
          "description" : "Draws the receiver’s border and then draws the interior of the cell.",
          "name" : "draw(withFrame:in:)",
          "url" : "https:\/\/developer.apple.com\/documentation\/AppKit\/NSCell\/draw(withFrame:in:)"
        }
      ],
      "title" : "Related Documentation"
    },
    {
      "content" : "",
      "items" : [
        {
          "description" : "Draws the image associated with the menu item.",
          "name" : "drawImage(withFrame:in:)",
          "url" : "https:\/\/developer.apple.com\/documentation\/AppKit\/NSMenuItemCell\/drawImage(withFrame:in:)"
        },
        {
          "description" : "Draws the key equivalent associated with the menu item.",
          "name" : "drawKeyEquivalent(withFrame:in:)",
          "url" : "https:\/\/developer.apple.com\/documentation\/AppKit\/NSMenuItemCell\/drawKeyEquivalent(withFrame:in:)"
        },
        {
          "description" : "Draws a menu item separator.",
          "name" : "drawSeparatorItem(withFrame:in:)",
          "url" : "https:\/\/developer.apple.com\/documentation\/AppKit\/NSMenuItemCell\/drawSeparatorItem(withFrame:in:)"
        },
        {
          "description" : "Draws the state image associated with the menu item.",
          "name" : "drawStateImage(withFrame:in:)",
          "url" : "https:\/\/developer.apple.com\/documentation\/AppKit\/NSMenuItemCell\/drawStateImage(withFrame:in:)"
        },
        {
          "description" : "Draws the title associated with the menu item.",
          "name" : "drawTitle(withFrame:in:)",
          "url" : "https:\/\/developer.apple.com\/documentation\/AppKit\/NSMenuItemCell\/drawTitle(withFrame:in:)"
        },
        {
          "description" : "A Boolean value indicating whether the menu item needs to be displayed.",
          "name" : "needsDisplay",
          "url" : "https:\/\/developer.apple.com\/documentation\/AppKit\/NSMenuItemCell\/needsDisplay"
        }
      ],
      "title" : "Drawing the Menu Item"
    }
  ],
  "source" : "appleJSON",
  "title" : "drawBorderAndBackground(withFrame:in:)",
  "url" : "https:\/\/developer.apple.com\/documentation\/AppKit\/NSMenuItemCell\/drawBorderAndBackground(withFrame:in:)"
}