{
  "abstract" : "Forces the layout manager to perform layout for the specified character range if it hasn’t already.",
  "codeExamples" : [

  ],
  "contentHash" : "4e3ae93a9beadd97b56c8c979e860d5ad34bc7d1215c307b3f998a341ce912ce",
  "crawledAt" : "2025-12-02T07:32:03Z",
  "declaration" : {
    "code" : "func ensureLayout(forCharacterRange charRange: NSRange)",
    "language" : "swift"
  },
  "id" : "3FC30A45-FB4E-4789-9CA8-FA313C265230",
  "kind" : "method",
  "module" : "AppKit",
  "overview" : "## Discussion\n\nThe layout manager reserves the right to perform layout for larger ranges.  If noncontiguous layout is disabled, then the affected range is always effectively extended to start at the beginning of the text.",
  "platforms" : [
    "macOS"
  ],
  "rawMarkdown" : "---\nsource: https:\/\/developer.apple.com\/documentation\/AppKit\/NSLayoutManager\/ensureLayout(forCharacterRange:)\ncrawled: 2025-12-02T07:32:03Z\n---\n\n# ensureLayout(forCharacterRange:)\n\n**Instance Method**\n\nForces the layout manager to perform layout for the specified character range if it hasn’t already.\n\n## Declaration\n\n```swift\nfunc ensureLayout(forCharacterRange charRange: NSRange)\n```\n\n## Parameters\n\n- **charRange**: The character range for which layout is performed.\n\n## Discussion\n\nThe layout manager reserves the right to perform layout for larger ranges.  If noncontiguous layout is disabled, then the affected range is always effectively extended to start at the beginning of the text.\n\n## Causing glyph generation and layout\n\n- **ensureGlyphs(forCharacterRange:)**: Forces the layout manager to generate glyphs for the specified character range if it hasn’t already.\n- **ensureGlyphs(forGlyphRange:)**: Forces the layout manager to generate glyphs for the specified glyph range if it hasn’t already.\n- **ensureLayout(forBoundingRect:in:)**: Forces the layout manager to perform layout for the specified area in the specified text container if it hasn’t already.\n- **ensureLayout(forGlyphRange:)**: Forces the layout manager to perform layout for the specified glyph range if it hasn’t already.\n- **ensureLayout(for:)**: Forces the layout manager to perform layout for the specified text container if it hasn’t already.\n- **glyphGenerator**: The glyph generator that the layout manager uses.\n\n",
  "sections" : [
    {
      "content" : "",
      "items" : [
        {
          "description" : "Forces the layout manager to generate glyphs for the specified character range if it hasn’t already.",
          "name" : "ensureGlyphs(forCharacterRange:)",
          "url" : "https:\/\/developer.apple.com\/documentation\/AppKit\/NSLayoutManager\/ensureGlyphs(forCharacterRange:)"
        },
        {
          "description" : "Forces the layout manager to generate glyphs for the specified glyph range if it hasn’t already.",
          "name" : "ensureGlyphs(forGlyphRange:)",
          "url" : "https:\/\/developer.apple.com\/documentation\/AppKit\/NSLayoutManager\/ensureGlyphs(forGlyphRange:)"
        },
        {
          "description" : "Forces the layout manager to perform layout for the specified area in the specified text container if it hasn’t already.",
          "name" : "ensureLayout(forBoundingRect:in:)",
          "url" : "https:\/\/developer.apple.com\/documentation\/AppKit\/NSLayoutManager\/ensureLayout(forBoundingRect:in:)"
        },
        {
          "description" : "Forces the layout manager to perform layout for the specified glyph range if it hasn’t already.",
          "name" : "ensureLayout(forGlyphRange:)",
          "url" : "https:\/\/developer.apple.com\/documentation\/AppKit\/NSLayoutManager\/ensureLayout(forGlyphRange:)"
        },
        {
          "description" : "Forces the layout manager to perform layout for the specified text container if it hasn’t already.",
          "name" : "ensureLayout(for:)",
          "url" : "https:\/\/developer.apple.com\/documentation\/AppKit\/NSLayoutManager\/ensureLayout(for:)"
        },
        {
          "description" : "The glyph generator that the layout manager uses.",
          "name" : "glyphGenerator",
          "url" : "https:\/\/developer.apple.com\/documentation\/AppKit\/NSLayoutManager\/glyphGenerator"
        }
      ],
      "title" : "Causing glyph generation and layout"
    }
  ],
  "source" : "appleJSON",
  "title" : "ensureLayout(forCharacterRange:)",
  "url" : "https:\/\/developer.apple.com\/documentation\/AppKit\/NSLayoutManager\/ensureLayout(forCharacterRange:)"
}