{
  "abstract" : "Informs the current object that a pressure change occurred on a system that supports pressure sensitivity.",
  "codeExamples" : [

  ],
  "contentHash" : "8521d549989337fa8ab79b64511b19fd18c537904e9d3237a968b28c6ef5895b",
  "crawledAt" : "2025-12-04T00:13:22Z",
  "declaration" : {
    "code" : "@MainActor func pressureChange(with event: NSEvent)",
    "language" : "swift"
  },
  "id" : "E9211926-FB92-4F22-9B4D-6C4D0E5A8DFC",
  "kind" : "method",
  "language" : "swift",
  "module" : "AppKit",
  "overview" : "## Discussion\n\nThis method is invoked automatically in response to user actions. `event` is the event that initiated the change in pressure.\n\nThe default implementation of this method does nothing. Use this method to update the state of your gesture recognizer in whatever way is appropriate.\n\nA gesture recognizer monitors events that occur in its view (and any subviews) but does not take part in the responder chain itself. The gesture recognizer receives events before any views do.",
  "platforms" : [
    "macOS"
  ],
  "rawMarkdown" : "---\nsource: https:\/\/developer.apple.com\/documentation\/AppKit\/NSGestureRecognizer\/pressureChange(with:)\ncrawled: 2025-12-04T00:13:22Z\n---\n\n# pressureChange(with:)\n\n**Instance Method**\n\nInforms the current object that a pressure change occurred on a system that supports pressure sensitivity.\n\n## Declaration\n\n```swift\n@MainActor func pressureChange(with event: NSEvent)\n```\n\n## Parameters\n\n- **event**: An `NSEvent` object encapsulating information about the event that invoked the change in pressure.\n\n## Discussion\n\nThis method is invoked automatically in response to user actions. `event` is the event that initiated the change in pressure.\n\nThe default implementation of this method does nothing. Use this method to update the state of your gesture recognizer in whatever way is appropriate.\n\nA gesture recognizer monitors events that occur in its view (and any subviews) but does not take part in the responder chain itself. The gesture recognizer receives events before any views do.\n\n## Related Documentation\n\n- **NSEvent**: An object that contains information about an input action, such as a mouse click or a key press.\n\n## Methods for Subclasses\n\n- **reset()**: Overridden to reset the internal state of the gesture recognizer when an attempt completes.\n- **mouseDown(with:)**: Informs the gesture recognizer that the user pressed the left mouse button.\n- **mouseDragged(with:)**: Informs the gesture recognizer that the user moved the mouse with the left button pressed.\n- **mouseUp(with:)**: Informs the gesture recognizer that the user released the left mouse button.\n- **otherMouseDown(with:)**: Informs the gesture recognizer that the user pressed a mouse button other than the left or right one.\n- **otherMouseDragged(with:)**: Informs the gesture recognizer that the user moved the mouse with a button other than the left or right one pressed.\n- **otherMouseUp(with:)**: Informs the gesture recognizer that the user released a mouse button other than the left or right one.\n- **rightMouseDown(with:)**: Informs the gesture recognizer that the user pressed the right mouse button.\n- **rightMouseDragged(with:)**: Informs the gesture recognizer that the user moved the mouse with the right button pressed.\n- **rightMouseUp(with:)**: Informs the gesture recognizer that the user released the right mouse button.\n- **magnify(with:)**: Informs the gesture recognizer that the user is performing a pinch gesture.\n- **rotate(with:)**: Informs the gesture recognizer that the user is performing a rotation gesture.\n- **canBePrevented(by:)**: Overridden to indicate that the specified gesture recognizer can prevent the current object from recognizing a gesture.\n- **canPrevent(_:)**: Overridden to indicate that the current object can prevent the specified gesture recognizer from recognizing its gesture.\n- **shouldBeRequiredToFail(by:)**: Overridden to indicate that the current object must fail before the specified gesture recognizer begins recognizing its gesture.\n\n",
  "sections" : [
    {
      "content" : "",
      "items" : [
        {
          "description" : "An object that contains information about an input action, such as a mouse click or a key press.",
          "name" : "NSEvent",
          "url" : "https:\/\/developer.apple.com\/documentation\/AppKit\/NSEvent"
        }
      ],
      "title" : "Related Documentation"
    },
    {
      "content" : "",
      "items" : [
        {
          "description" : "Overridden to reset the internal state of the gesture recognizer when an attempt completes.",
          "name" : "reset()",
          "url" : "https:\/\/developer.apple.com\/documentation\/AppKit\/NSGestureRecognizer\/reset()"
        },
        {
          "description" : "Informs the gesture recognizer that the user pressed the left mouse button.",
          "name" : "mouseDown(with:)",
          "url" : "https:\/\/developer.apple.com\/documentation\/AppKit\/NSGestureRecognizer\/mouseDown(with:)"
        },
        {
          "description" : "Informs the gesture recognizer that the user moved the mouse with the left button pressed.",
          "name" : "mouseDragged(with:)",
          "url" : "https:\/\/developer.apple.com\/documentation\/AppKit\/NSGestureRecognizer\/mouseDragged(with:)"
        },
        {
          "description" : "Informs the gesture recognizer that the user released the left mouse button.",
          "name" : "mouseUp(with:)",
          "url" : "https:\/\/developer.apple.com\/documentation\/AppKit\/NSGestureRecognizer\/mouseUp(with:)"
        },
        {
          "description" : "Informs the gesture recognizer that the user pressed a mouse button other than the left or right one.",
          "name" : "otherMouseDown(with:)",
          "url" : "https:\/\/developer.apple.com\/documentation\/AppKit\/NSGestureRecognizer\/otherMouseDown(with:)"
        },
        {
          "description" : "Informs the gesture recognizer that the user moved the mouse with a button other than the left or right one pressed.",
          "name" : "otherMouseDragged(with:)",
          "url" : "https:\/\/developer.apple.com\/documentation\/AppKit\/NSGestureRecognizer\/otherMouseDragged(with:)"
        },
        {
          "description" : "Informs the gesture recognizer that the user released a mouse button other than the left or right one.",
          "name" : "otherMouseUp(with:)",
          "url" : "https:\/\/developer.apple.com\/documentation\/AppKit\/NSGestureRecognizer\/otherMouseUp(with:)"
        },
        {
          "description" : "Informs the gesture recognizer that the user pressed the right mouse button.",
          "name" : "rightMouseDown(with:)",
          "url" : "https:\/\/developer.apple.com\/documentation\/AppKit\/NSGestureRecognizer\/rightMouseDown(with:)"
        },
        {
          "description" : "Informs the gesture recognizer that the user moved the mouse with the right button pressed.",
          "name" : "rightMouseDragged(with:)",
          "url" : "https:\/\/developer.apple.com\/documentation\/AppKit\/NSGestureRecognizer\/rightMouseDragged(with:)"
        },
        {
          "description" : "Informs the gesture recognizer that the user released the right mouse button.",
          "name" : "rightMouseUp(with:)",
          "url" : "https:\/\/developer.apple.com\/documentation\/AppKit\/NSGestureRecognizer\/rightMouseUp(with:)"
        },
        {
          "description" : "Informs the gesture recognizer that the user is performing a pinch gesture.",
          "name" : "magnify(with:)",
          "url" : "https:\/\/developer.apple.com\/documentation\/AppKit\/NSGestureRecognizer\/magnify(with:)"
        },
        {
          "description" : "Informs the gesture recognizer that the user is performing a rotation gesture.",
          "name" : "rotate(with:)",
          "url" : "https:\/\/developer.apple.com\/documentation\/AppKit\/NSGestureRecognizer\/rotate(with:)"
        },
        {
          "description" : "Overridden to indicate that the specified gesture recognizer can prevent the current object from recognizing a gesture.",
          "name" : "canBePrevented(by:)",
          "url" : "https:\/\/developer.apple.com\/documentation\/AppKit\/NSGestureRecognizer\/canBePrevented(by:)"
        },
        {
          "description" : "Overridden to indicate that the current object can prevent the specified gesture recognizer from recognizing its gesture.",
          "name" : "canPrevent(_:)",
          "url" : "https:\/\/developer.apple.com\/documentation\/AppKit\/NSGestureRecognizer\/canPrevent(_:)"
        },
        {
          "description" : "Overridden to indicate that the current object must fail before the specified gesture recognizer begins recognizing its gesture.",
          "name" : "shouldBeRequiredToFail(by:)",
          "url" : "https:\/\/developer.apple.com\/documentation\/AppKit\/NSGestureRecognizer\/shouldBeRequiredToFail(by:)"
        }
      ],
      "title" : "Methods for Subclasses"
    }
  ],
  "source" : "appleJSON",
  "title" : "pressureChange(with:)",
  "url" : "https:\/\/developer.apple.com\/documentation\/AppKit\/NSGestureRecognizer\/pressureChange(with:)"
}