{
  "abstract" : "Confirms that the error object is not to be presented to the user and the error cannot be recovered from, so cleanup can be done.",
  "codeExamples" : [

  ],
  "contentHash" : "4ec19d6aa0f327d51b809984e9018f5a2d2f692e3c6015b24a6ab8a96e01fd3c",
  "crawledAt" : "2025-12-02T18:08:00Z",
  "declaration" : {
    "code" : "@MainActor func willNotPresentError(_ error: any Error)",
    "language" : "swift"
  },
  "id" : "E5B32E09-7741-4402-BAE9-F6F5BCBE19D2",
  "kind" : "method",
  "language" : "swift",
  "module" : "AppKit",
  "overview" : "## Discussion\n\nSome `NSDocument` methods, like those involved in writing, may not immediately delete temporary files if there is a chance that the error can be recovered from and the operation can continue. To make sure that cleanup is always done, you should invoke this method with `NSDocument` errors that are not going to be passed to one of the `presentError:...` methods. For example, the `NSDocument` implementation of the `NSFilePresenter` method [doc:\/\/com.apple.documentation\/documentation\/Foundation\/NSFilePresenter\/savePresentedItemChanges(completionHandler:)] invokes this method when it invokes [doc:\/\/com.apple.appkit\/documentation\/AppKit\/NSDocument\/autosave(withImplicitCancellability:completionHandler:)] and the completion handler is passed an `NSError` object, because it does not present the error to the user.",
  "platforms" : [
    "macOS"
  ],
  "rawMarkdown" : "---\nsource: https:\/\/developer.apple.com\/documentation\/AppKit\/NSDocument\/willNotPresentError(_:)\ncrawled: 2025-12-02T18:08:00Z\n---\n\n# willNotPresentError(_:)\n\n**Instance Method**\n\nConfirms that the error object is not to be presented to the user and the error cannot be recovered from, so cleanup can be done.\n\n## Declaration\n\n```swift\n@MainActor func willNotPresentError(_ error: any Error)\n```\n\n## Parameters\n\n- **error**: An [doc:\/\/com.apple.documentation\/documentation\/Foundation\/NSError] object returned by another `NSDocument` method.\n\n## Discussion\n\nSome `NSDocument` methods, like those involved in writing, may not immediately delete temporary files if there is a chance that the error can be recovered from and the operation can continue. To make sure that cleanup is always done, you should invoke this method with `NSDocument` errors that are not going to be passed to one of the `presentError:...` methods. For example, the `NSDocument` implementation of the `NSFilePresenter` method [doc:\/\/com.apple.documentation\/documentation\/Foundation\/NSFilePresenter\/savePresentedItemChanges(completionHandler:)] invokes this method when it invokes [doc:\/\/com.apple.appkit\/documentation\/AppKit\/NSDocument\/autosave(withImplicitCancellability:completionHandler:)] and the completion handler is passed an `NSError` object, because it does not present the error to the user.\n\n## Displaying Errors to the User\n\n- **presentError(_:modalFor:delegate:didPresent:contextInfo:)**: Presents an error alert to the user as a modal panel.\n- **presentError(_:)**: Presents an error alert to the user as a modal panel.\n- **willPresentError(_:)**: Called when the receiver is about to present an error.\n\n",
  "sections" : [
    {
      "content" : "",
      "items" : [
        {
          "description" : "Presents an error alert to the user as a modal panel.",
          "name" : "presentError(_:modalFor:delegate:didPresent:contextInfo:)",
          "url" : "https:\/\/developer.apple.com\/documentation\/AppKit\/NSDocument\/presentError(_:modalFor:delegate:didPresent:contextInfo:)"
        },
        {
          "description" : "Presents an error alert to the user as a modal panel.",
          "name" : "presentError(_:)",
          "url" : "https:\/\/developer.apple.com\/documentation\/AppKit\/NSDocument\/presentError(_:)"
        },
        {
          "description" : "Called when the receiver is about to present an error.",
          "name" : "willPresentError(_:)",
          "url" : "https:\/\/developer.apple.com\/documentation\/AppKit\/NSDocument\/willPresentError(_:)"
        }
      ],
      "title" : "Displaying Errors to the User"
    }
  ],
  "source" : "appleJSON",
  "title" : "willNotPresentError(_:)",
  "url" : "https:\/\/developer.apple.com\/documentation\/AppKit\/NSDocument\/willNotPresentError(_:)"
}