{
  "abstract" : "Informs the delegate when the layout manager invalidates layout due to a change in the geometry of the specified text container.",
  "codeExamples" : [

  ],
  "contentHash" : "a0e08fbd37bb1bf46442ff31cd301c1c711b66429d71ddf717d0fabb1a8766a9",
  "crawledAt" : "2025-12-05T12:27:31Z",
  "declaration" : {
    "code" : "optional func layoutManager(_ layoutManager: NSLayoutManager, textContainer: NSTextContainer, didChangeGeometryFrom oldSize: NSSize)",
    "language" : "swift"
  },
  "id" : "396D5AD7-8C56-4F66-B79A-387669C9EA54",
  "kind" : "method",
  "language" : "swift",
  "module" : "AppKit",
  "overview" : "## Discussion\n\nThe delegate can react to the geometry change and perform adjustments such as recreating an exclusion path.",
  "platforms" : [
    "macOS"
  ],
  "rawMarkdown" : "---\nsource: https:\/\/developer.apple.com\/documentation\/AppKit\/NSLayoutManagerDelegate\/layoutManager(_:textContainer:didChangeGeometryFrom:)\ncrawled: 2025-12-05T12:27:31Z\n---\n\n# layoutManager(_:textContainer:didChangeGeometryFrom:)\n\n**Instance Method**\n\nInforms the delegate when the layout manager invalidates layout due to a change in the geometry of the specified text container.\n\n## Declaration\n\n```swift\noptional func layoutManager(_ layoutManager: NSLayoutManager, textContainer: NSTextContainer, didChangeGeometryFrom oldSize: NSSize)\n```\n\n## Parameters\n\n- **layoutManager**: The layout manager invalidating layout.\n- **textContainer**: The text container that changed geometry.\n- **oldSize**: The size of the text container before it changed geometry.\n\n## Discussion\n\nThe delegate can react to the geometry change and perform adjustments such as recreating an exclusion path.\n\n## Responding to text container layout\n\n- **layoutManager(_:didCompleteLayoutFor:atEnd:)**: Informs the delegate when the layout manager finishes laying out text in the specified text container.\n\n",
  "sections" : [
    {
      "content" : "",
      "items" : [
        {
          "description" : "Informs the delegate when the layout manager finishes laying out text in the specified text container.",
          "name" : "layoutManager(_:didCompleteLayoutFor:atEnd:)",
          "url" : "https:\/\/developer.apple.com\/documentation\/AppKit\/NSLayoutManagerDelegate\/layoutManager(_:didCompleteLayoutFor:atEnd:)"
        }
      ],
      "title" : "Responding to text container layout"
    }
  ],
  "source" : "appleJSON",
  "title" : "layoutManager(_:textContainer:didChangeGeometryFrom:)",
  "url" : "https:\/\/developer.apple.com\/documentation\/AppKit\/NSLayoutManagerDelegate\/layoutManager(_:textContainer:didChangeGeometryFrom:)"
}