{
  "abstract" : "Registers a nib file to use when creating the layout’s decoration views.",
  "codeExamples" : [

  ],
  "contentHash" : "8694d2561444620fcdb34f28793b4d434fbaaac9888993459a97807bb9ae2175",
  "crawledAt" : "2025-12-05T21:49:51Z",
  "declaration" : {
    "code" : "@MainActor func register(_ nib: NSNib?, forDecorationViewOfKind elementKind: NSCollectionView.DecorationElementKind)",
    "language" : "swift"
  },
  "id" : "7E9A7464-B204-40FD-9018-B8A2944CFB2D",
  "kind" : "method",
  "language" : "swift",
  "module" : "AppKit",
  "overview" : "## Discussion\n\nCall this method as part of your layout object’s initialization and use it to register any decoration views needed for your layout. Decoration views are visual adornments that you include in your layouts and use to present the collection view’s content. For example, you might use decoration views to implement a dynamic background that can expand or shrink to match the current number of items. The layout object defines and owns the decoration views it uses. Decoration views do not have any ties to the collection view’s data source object.\n\nAfter registering your decoration views, you create decoration views by returning an appropriate set of layout attributes from the [doc:\/\/com.apple.appkit\/documentation\/AppKit\/NSCollectionViewLayout\/layoutAttributesForElements(in:)] method. When you return a [doc:\/\/com.apple.appkit\/documentation\/AppKit\/NSCollectionViewLayoutAttributes] object configured for a decoration view, the collection view uses your registered nib or class information to create the corresponding views.",
  "platforms" : [
    "macOS"
  ],
  "rawMarkdown" : "---\nsource: https:\/\/developer.apple.com\/documentation\/AppKit\/NSCollectionViewLayout\/register(_:forDecorationViewOfKind:)-7z7uf\ncrawled: 2025-12-05T21:49:51Z\n---\n\n# register(_:forDecorationViewOfKind:)\n\n**Instance Method**\n\nRegisters a nib file to use when creating the layout’s decoration views.\n\n## Declaration\n\n```swift\n@MainActor func register(_ nib: NSNib?, forDecorationViewOfKind elementKind: NSCollectionView.DecorationElementKind)\n```\n\n## Parameters\n\n- **nib**: The nib object containing the decoration view’s definition. The nib file must contain exactly one [doc:\/\/com.apple.appkit\/documentation\/AppKit\/NSView] object at the top level and that view must conform to the [doc:\/\/com.apple.appkit\/documentation\/AppKit\/NSCollectionViewElement] protocol. Specify `nil` to unregister a previously registered class or nib file.\n- **elementKind**: The string your layout uses to identify the decoration view’s type. This parameter must not be `nil` and must not be an empty string.\n\n## Discussion\n\nCall this method as part of your layout object’s initialization and use it to register any decoration views needed for your layout. Decoration views are visual adornments that you include in your layouts and use to present the collection view’s content. For example, you might use decoration views to implement a dynamic background that can expand or shrink to match the current number of items. The layout object defines and owns the decoration views it uses. Decoration views do not have any ties to the collection view’s data source object.\n\nAfter registering your decoration views, you create decoration views by returning an appropriate set of layout attributes from the [doc:\/\/com.apple.appkit\/documentation\/AppKit\/NSCollectionViewLayout\/layoutAttributesForElements(in:)] method. When you return a [doc:\/\/com.apple.appkit\/documentation\/AppKit\/NSCollectionViewLayoutAttributes] object configured for a decoration view, the collection view uses your registered nib or class information to create the corresponding views.\n\n## Registering Decoration Views\n\n- **register(_:forDecorationViewOfKind:)**: Registers a class to use when creating the layout’s decoration views.\n\n",
  "sections" : [
    {
      "content" : "",
      "items" : [
        {
          "description" : "Registers a class to use when creating the layout’s decoration views.",
          "name" : "register(_:forDecorationViewOfKind:)",
          "url" : "https:\/\/developer.apple.com\/documentation\/AppKit\/NSCollectionViewLayout\/register(_:forDecorationViewOfKind:)-44qmc"
        }
      ],
      "title" : "Registering Decoration Views"
    }
  ],
  "source" : "appleJSON",
  "title" : "register(_:forDecorationViewOfKind:)",
  "url" : "https:\/\/developer.apple.com\/documentation\/AppKit\/NSCollectionViewLayout\/register(_:forDecorationViewOfKind:)-7z7uf"
}