{
  "abstract" : "Specifies the custom spacing, in points, between a specified view and the view that follows it in the stack view.",
  "codeExamples" : [

  ],
  "contentHash" : "900f33ea85c53b67f4816f2f3ac7fd03b4baedbad1e6648f1828d29ee0c35c93",
  "crawledAt" : "2025-12-02T18:11:50Z",
  "declaration" : {
    "code" : "@MainActor func setCustomSpacing(_ spacing: CGFloat, after view: NSView)",
    "language" : "swift"
  },
  "id" : "F4889714-ED50-4138-83EA-2CBE3E7F5ABE",
  "kind" : "method",
  "language" : "swift",
  "module" : "AppKit",
  "overview" : "## Discussion\n\nFor a horizontal stack view, this method sets custom spacing between a specified view and the view to its right when the user interface direction is left to right. (See the inherited [doc:\/\/com.apple.appkit\/documentation\/AppKit\/NSView\/userInterfaceLayoutDirection] property for information on layout direction.) For a vertical stack view, this method sets custom spacing below a specified view.\n\nIf you set custom spacing for a view, it overrides the stack view’s default spacing for that view, as set in the [doc:\/\/com.apple.appkit\/documentation\/AppKit\/NSStackView\/spacing] property.\n\nA stack view retains custom spacing across layout updates. Custom spacing for a view is lost if you remove the view from the stack view or specify a new value.",
  "platforms" : [
    "macOS"
  ],
  "rawMarkdown" : "---\nsource: https:\/\/developer.apple.com\/documentation\/AppKit\/NSStackView\/setCustomSpacing(_:after:)\ncrawled: 2025-12-02T18:11:50Z\n---\n\n# setCustomSpacing(_:after:)\n\n**Instance Method**\n\nSpecifies the custom spacing, in points, between a specified view and the view that follows it in the stack view.\n\n## Declaration\n\n```swift\n@MainActor func setCustomSpacing(_ spacing: CGFloat, after view: NSView)\n```\n\n## Parameters\n\n- **spacing**: The custom trailing space to use between the `aView` view and the one that follows it, in points.\n\nDefault value is [doc:\/\/com.apple.appkit\/documentation\/AppKit\/NSStackView\/useDefaultSpacing], which indicates that the view does not use custom spacing.\n- **view**: The view whose trailing spacing you are setting.\n\n\n\n## Discussion\n\nFor a horizontal stack view, this method sets custom spacing between a specified view and the view to its right when the user interface direction is left to right. (See the inherited [doc:\/\/com.apple.appkit\/documentation\/AppKit\/NSView\/userInterfaceLayoutDirection] property for information on layout direction.) For a vertical stack view, this method sets custom spacing below a specified view.\n\nIf you set custom spacing for a view, it overrides the stack view’s default spacing for that view, as set in the [doc:\/\/com.apple.appkit\/documentation\/AppKit\/NSStackView\/spacing] property.\n\nA stack view retains custom spacing across layout updates. Custom spacing for a view is lost if you remove the view from the stack view or specify a new value.\n\n## Related Documentation\n\n- **spacing**: The minimum spacing, in points, between adjacent views in the stack view.\n\n## Configuring Views in a Stack View\n\n- **customSpacing(after:)**: Returns the custom spacing, in points, between a specified view in the stack view and the view that follows it.\n- **visibilityPriority(for:)**: Returns the visibility priority for a specified view in the stack view.\n- **setVisibilityPriority(_:for:)**: Sets the Auto Layout priority for a view to remain attached to the stack view when Auto Layout reduces the stack view’s size.\n- **NSStackView.VisibilityPriority**: The various Auto Layout priorities for a view in the stack view to remain attached.\n- **useDefaultSpacing**\n\n",
  "sections" : [
    {
      "content" : "",
      "items" : [
        {
          "description" : "The minimum spacing, in points, between adjacent views in the stack view.",
          "name" : "spacing",
          "url" : "https:\/\/developer.apple.com\/documentation\/AppKit\/NSStackView\/spacing"
        }
      ],
      "title" : "Related Documentation"
    },
    {
      "content" : "",
      "items" : [
        {
          "description" : "Returns the custom spacing, in points, between a specified view in the stack view and the view that follows it.",
          "name" : "customSpacing(after:)",
          "url" : "https:\/\/developer.apple.com\/documentation\/AppKit\/NSStackView\/customSpacing(after:)"
        },
        {
          "description" : "Returns the visibility priority for a specified view in the stack view.",
          "name" : "visibilityPriority(for:)",
          "url" : "https:\/\/developer.apple.com\/documentation\/AppKit\/NSStackView\/visibilityPriority(for:)"
        },
        {
          "description" : "Sets the Auto Layout priority for a view to remain attached to the stack view when Auto Layout reduces the stack view’s size.",
          "name" : "setVisibilityPriority(_:for:)",
          "url" : "https:\/\/developer.apple.com\/documentation\/AppKit\/NSStackView\/setVisibilityPriority(_:for:)"
        },
        {
          "description" : "The various Auto Layout priorities for a view in the stack view to remain attached.",
          "name" : "NSStackView.VisibilityPriority",
          "url" : "https:\/\/developer.apple.com\/documentation\/AppKit\/NSStackView\/VisibilityPriority"
        },
        {
          "description" : "",
          "name" : "useDefaultSpacing",
          "url" : "https:\/\/developer.apple.com\/documentation\/AppKit\/NSStackView\/useDefaultSpacing"
        }
      ],
      "title" : "Configuring Views in a Stack View"
    }
  ],
  "source" : "appleJSON",
  "title" : "setCustomSpacing(_:after:)",
  "url" : "https:\/\/developer.apple.com\/documentation\/AppKit\/NSStackView\/setCustomSpacing(_:after:)"
}