{
  "abstract" : "Overridden to indicate that the current object can prevent the specified gesture recognizer from recognizing its gesture.",
  "codeExamples" : [

  ],
  "contentHash" : "49af8d15f976dafd26c4c5692f8d8b0265a384ddbcffa4a3c3cee02f45259d11",
  "crawledAt" : "2025-12-02T05:15:35Z",
  "declaration" : {
    "code" : "@MainActor func canPrevent(_ preventedGestureRecognizer: NSGestureRecognizer) -> Bool",
    "language" : "swift"
  },
  "id" : "53408D96-7848-4701-96B4-562E5390C749",
  "kind" : "method",
  "module" : "AppKit",
  "overview" : "## Return Value\n\n[doc:\/\/com.apple.documentation\/documentation\/Swift\/true] to indicate that `preventedGestureRecognizer` should be blocked from recognizing its gesture, or [doc:\/\/com.apple.documentation\/documentation\/Swift\/false] if both gesture recognizers can operate simultaneously.\n\n## Discussion\n\nThis method enables similar behavior as the [doc:\/\/com.apple.appkit\/documentation\/AppKit\/NSGestureRecognizerDelegate\/gestureRecognizerShouldBegin(_:)] and [doc:\/\/com.apple.appkit\/documentation\/AppKit\/NSGestureRecognizerDelegate\/gestureRecognizer(_:shouldRequireFailureOf:)] methods of the gesture recognizer’s delegate. Using this method lets you define rules that apply to all instances of your custom gesture recognizer class. For example, an [doc:\/\/com.apple.appkit\/documentation\/AppKit\/NSClickGestureRecognizer] object does not prevent another [doc:\/\/com.apple.appkit\/documentation\/AppKit\/NSClickGestureRecognizer] object with a higher click count from recognizing its gesture.",
  "platforms" : [
    "macOS"
  ],
  "rawMarkdown" : "---\nsource: https:\/\/developer.apple.com\/documentation\/AppKit\/NSGestureRecognizer\/canPrevent(_:)\ncrawled: 2025-12-02T05:15:35Z\n---\n\n# canPrevent(_:)\n\n**Instance Method**\n\nOverridden to indicate that the current object can prevent the specified gesture recognizer from recognizing its gesture.\n\n## Declaration\n\n```swift\n@MainActor func canPrevent(_ preventedGestureRecognizer: NSGestureRecognizer) -> Bool\n```\n\n## Parameters\n\n- **preventedGestureRecognizer**: The gesture recognizer to be prevented from recognizing its gesture.\n\n## Return Value\n\n[doc:\/\/com.apple.documentation\/documentation\/Swift\/true] to indicate that `preventedGestureRecognizer` should be blocked from recognizing its gesture, or [doc:\/\/com.apple.documentation\/documentation\/Swift\/false] if both gesture recognizers can operate simultaneously.\n\n## Discussion\n\nThis method enables similar behavior as the [doc:\/\/com.apple.appkit\/documentation\/AppKit\/NSGestureRecognizerDelegate\/gestureRecognizerShouldBegin(_:)] and [doc:\/\/com.apple.appkit\/documentation\/AppKit\/NSGestureRecognizerDelegate\/gestureRecognizer(_:shouldRequireFailureOf:)] methods of the gesture recognizer’s delegate. Using this method lets you define rules that apply to all instances of your custom gesture recognizer class. For example, an [doc:\/\/com.apple.appkit\/documentation\/AppKit\/NSClickGestureRecognizer] object does not prevent another [doc:\/\/com.apple.appkit\/documentation\/AppKit\/NSClickGestureRecognizer] object with a higher click count from recognizing its gesture.\n\n## Methods for Subclasses\n\n- **reset()**: Overridden to reset the internal state of the gesture recognizer when an attempt completes.\n- **mouseDown(with:)**: Informs the gesture recognizer that the user pressed the left mouse button.\n- **mouseDragged(with:)**: Informs the gesture recognizer that the user moved the mouse with the left button pressed.\n- **mouseUp(with:)**: Informs the gesture recognizer that the user released the left mouse button.\n- **otherMouseDown(with:)**: Informs the gesture recognizer that the user pressed a mouse button other than the left or right one.\n- **otherMouseDragged(with:)**: Informs the gesture recognizer that the user moved the mouse with a button other than the left or right one pressed.\n- **otherMouseUp(with:)**: Informs the gesture recognizer that the user released a mouse button other than the left or right one.\n- **rightMouseDown(with:)**: Informs the gesture recognizer that the user pressed the right mouse button.\n- **rightMouseDragged(with:)**: Informs the gesture recognizer that the user moved the mouse with the right button pressed.\n- **rightMouseUp(with:)**: Informs the gesture recognizer that the user released the right mouse button.\n- **magnify(with:)**: Informs the gesture recognizer that the user is performing a pinch gesture.\n- **rotate(with:)**: Informs the gesture recognizer that the user is performing a rotation gesture.\n- **canBePrevented(by:)**: Overridden to indicate that the specified gesture recognizer can prevent the current object from recognizing a gesture.\n- **shouldBeRequiredToFail(by:)**: Overridden to indicate that the current object must fail before the specified gesture recognizer begins recognizing its gesture.\n- **shouldRequireFailure(of:)**: Overridden to indicate that the specified gesture recognizer must fail before the current object begins recognizing its gesture.\n\n",
  "sections" : [
    {
      "content" : "",
      "items" : [
        {
          "description" : "Overridden to reset the internal state of the gesture recognizer when an attempt completes.",
          "name" : "reset()",
          "url" : "https:\/\/developer.apple.com\/documentation\/AppKit\/NSGestureRecognizer\/reset()"
        },
        {
          "description" : "Informs the gesture recognizer that the user pressed the left mouse button.",
          "name" : "mouseDown(with:)",
          "url" : "https:\/\/developer.apple.com\/documentation\/AppKit\/NSGestureRecognizer\/mouseDown(with:)"
        },
        {
          "description" : "Informs the gesture recognizer that the user moved the mouse with the left button pressed.",
          "name" : "mouseDragged(with:)",
          "url" : "https:\/\/developer.apple.com\/documentation\/AppKit\/NSGestureRecognizer\/mouseDragged(with:)"
        },
        {
          "description" : "Informs the gesture recognizer that the user released the left mouse button.",
          "name" : "mouseUp(with:)",
          "url" : "https:\/\/developer.apple.com\/documentation\/AppKit\/NSGestureRecognizer\/mouseUp(with:)"
        },
        {
          "description" : "Informs the gesture recognizer that the user pressed a mouse button other than the left or right one.",
          "name" : "otherMouseDown(with:)",
          "url" : "https:\/\/developer.apple.com\/documentation\/AppKit\/NSGestureRecognizer\/otherMouseDown(with:)"
        },
        {
          "description" : "Informs the gesture recognizer that the user moved the mouse with a button other than the left or right one pressed.",
          "name" : "otherMouseDragged(with:)",
          "url" : "https:\/\/developer.apple.com\/documentation\/AppKit\/NSGestureRecognizer\/otherMouseDragged(with:)"
        },
        {
          "description" : "Informs the gesture recognizer that the user released a mouse button other than the left or right one.",
          "name" : "otherMouseUp(with:)",
          "url" : "https:\/\/developer.apple.com\/documentation\/AppKit\/NSGestureRecognizer\/otherMouseUp(with:)"
        },
        {
          "description" : "Informs the gesture recognizer that the user pressed the right mouse button.",
          "name" : "rightMouseDown(with:)",
          "url" : "https:\/\/developer.apple.com\/documentation\/AppKit\/NSGestureRecognizer\/rightMouseDown(with:)"
        },
        {
          "description" : "Informs the gesture recognizer that the user moved the mouse with the right button pressed.",
          "name" : "rightMouseDragged(with:)",
          "url" : "https:\/\/developer.apple.com\/documentation\/AppKit\/NSGestureRecognizer\/rightMouseDragged(with:)"
        },
        {
          "description" : "Informs the gesture recognizer that the user released the right mouse button.",
          "name" : "rightMouseUp(with:)",
          "url" : "https:\/\/developer.apple.com\/documentation\/AppKit\/NSGestureRecognizer\/rightMouseUp(with:)"
        },
        {
          "description" : "Informs the gesture recognizer that the user is performing a pinch gesture.",
          "name" : "magnify(with:)",
          "url" : "https:\/\/developer.apple.com\/documentation\/AppKit\/NSGestureRecognizer\/magnify(with:)"
        },
        {
          "description" : "Informs the gesture recognizer that the user is performing a rotation gesture.",
          "name" : "rotate(with:)",
          "url" : "https:\/\/developer.apple.com\/documentation\/AppKit\/NSGestureRecognizer\/rotate(with:)"
        },
        {
          "description" : "Overridden to indicate that the specified gesture recognizer can prevent the current object from recognizing a gesture.",
          "name" : "canBePrevented(by:)",
          "url" : "https:\/\/developer.apple.com\/documentation\/AppKit\/NSGestureRecognizer\/canBePrevented(by:)"
        },
        {
          "description" : "Overridden to indicate that the current object must fail before the specified gesture recognizer begins recognizing its gesture.",
          "name" : "shouldBeRequiredToFail(by:)",
          "url" : "https:\/\/developer.apple.com\/documentation\/AppKit\/NSGestureRecognizer\/shouldBeRequiredToFail(by:)"
        },
        {
          "description" : "Overridden to indicate that the specified gesture recognizer must fail before the current object begins recognizing its gesture.",
          "name" : "shouldRequireFailure(of:)",
          "url" : "https:\/\/developer.apple.com\/documentation\/AppKit\/NSGestureRecognizer\/shouldRequireFailure(of:)"
        }
      ],
      "title" : "Methods for Subclasses"
    }
  ],
  "source" : "appleJSON",
  "title" : "canPrevent(_:)",
  "url" : "https:\/\/developer.apple.com\/documentation\/AppKit\/NSGestureRecognizer\/canPrevent(_:)"
}