{
  "abstract" : "Presents a modal Save panel to the user, then tries to save the document if the user approves the operation.",
  "codeExamples" : [
    {
      "code" : "- (void)document:(NSDocument *)doc didSave:(BOOL)didSave contextInfo:(void  *)contextInfo",
      "language" : "objc"
    }
  ],
  "contentHash" : "14db47537f3009edd0dbe47b13c9c783f8aaf1df4ddb309ea16ed571dfd70692",
  "crawledAt" : "2025-12-02T18:25:53Z",
  "declaration" : {
    "code" : "@MainActor func runModalSavePanel(for saveOperation: NSDocument.SaveOperationType, delegate: Any?, didSave didSaveSelector: Selector?, contextInfo: UnsafeMutableRawPointer?)",
    "language" : "swift"
  },
  "id" : "EF5061BD-37F1-4A08-A875-652DCBEB7165",
  "kind" : "method",
  "language" : "swift",
  "module" : "AppKit",
  "overview" : "## Discussion\n\nWhen saving is completed, regardless of success or failure, or has been canceled, sends the message selected by `didSaveSelector` to the `delegate`, with `contextInfo` as the last argument. The method selected by `didSaveSelector` must have the same signature as:\n\nInvoked from [doc:\/\/com.apple.appkit\/documentation\/AppKit\/NSDocument\/save(withDelegate:didSave:contextInfo:)], and from the [doc:\/\/com.apple.appkit\/documentation\/AppKit\/NSDocument\/saveAs(_:)] and [doc:\/\/com.apple.appkit\/documentation\/AppKit\/NSDocument\/saveTo(_:)] action methods. The default implementation of this method first makes sure that any editor registered using the Cocoa Bindings [doc:\/\/com.apple.appkit\/documentation\/AppKit\/NSEditorRegistration] informal protocol has committed its changes, then creates a Save panel, adds a standard file format accessory view (if there is more than one file type for the user to choose from and [doc:\/\/com.apple.appkit\/documentation\/AppKit\/NSDocument\/shouldRunSavePanelWithAccessoryView] returns [doc:\/\/com.apple.documentation\/documentation\/Swift\/true]), sets various attributes of the panel, invokes [doc:\/\/com.apple.appkit\/documentation\/AppKit\/NSDocument\/prepareSavePanel(_:)] to provide an opportunity for customization, then presents the panel. If the user approves the panel, the default implementation sends the message [doc:\/\/com.apple.appkit\/documentation\/AppKit\/NSDocument\/save(to:ofType:for:delegate:didSave:contextInfo:)].\n\nFor backward binary compatibility with Mac OS v10.3 and earlier, the default implementation of this method instead invokes the deprecated [doc:\/\/com.apple.appkit\/documentation\/AppKit\/NSDocument\/saveToFile:saveOperation:delegate:didSaveSelector:contextInfo:] if it is overridden, even if the user cancels the panel.",
  "platforms" : [
    "macOS"
  ],
  "rawMarkdown" : "---\nsource: https:\/\/developer.apple.com\/documentation\/AppKit\/NSDocument\/runModalSavePanel(for:delegate:didSave:contextInfo:)\ncrawled: 2025-12-02T18:25:53Z\n---\n\n# runModalSavePanel(for:delegate:didSave:contextInfo:)\n\n**Instance Method**\n\nPresents a modal Save panel to the user, then tries to save the document if the user approves the operation.\n\n## Declaration\n\n```swift\n@MainActor func runModalSavePanel(for saveOperation: NSDocument.SaveOperationType, delegate: Any?, didSave didSaveSelector: Selector?, contextInfo: UnsafeMutableRawPointer?)\n```\n\n## Parameters\n\n- **saveOperation**: The type of save operation.\n- **delegate**: The delegate to which the selector message is sent.\n- **didSaveSelector**: The selector of the message sent to the delegate.\n- **contextInfo**: Object passed with the callback to provide any additional context information.\n\n## Discussion\n\nWhen saving is completed, regardless of success or failure, or has been canceled, sends the message selected by `didSaveSelector` to the `delegate`, with `contextInfo` as the last argument. The method selected by `didSaveSelector` must have the same signature as:\n\n```objc\n- (void)document:(NSDocument *)doc didSave:(BOOL)didSave contextInfo:(void  *)contextInfo\n```\n\nInvoked from [doc:\/\/com.apple.appkit\/documentation\/AppKit\/NSDocument\/save(withDelegate:didSave:contextInfo:)], and from the [doc:\/\/com.apple.appkit\/documentation\/AppKit\/NSDocument\/saveAs(_:)] and [doc:\/\/com.apple.appkit\/documentation\/AppKit\/NSDocument\/saveTo(_:)] action methods. The default implementation of this method first makes sure that any editor registered using the Cocoa Bindings [doc:\/\/com.apple.appkit\/documentation\/AppKit\/NSEditorRegistration] informal protocol has committed its changes, then creates a Save panel, adds a standard file format accessory view (if there is more than one file type for the user to choose from and [doc:\/\/com.apple.appkit\/documentation\/AppKit\/NSDocument\/shouldRunSavePanelWithAccessoryView] returns [doc:\/\/com.apple.documentation\/documentation\/Swift\/true]), sets various attributes of the panel, invokes [doc:\/\/com.apple.appkit\/documentation\/AppKit\/NSDocument\/prepareSavePanel(_:)] to provide an opportunity for customization, then presents the panel. If the user approves the panel, the default implementation sends the message [doc:\/\/com.apple.appkit\/documentation\/AppKit\/NSDocument\/save(to:ofType:for:delegate:didSave:contextInfo:)].\n\nFor backward binary compatibility with Mac OS v10.3 and earlier, the default implementation of this method instead invokes the deprecated [doc:\/\/com.apple.appkit\/documentation\/AppKit\/NSDocument\/saveToFile:saveOperation:delegate:didSaveSelector:contextInfo:] if it is overridden, even if the user cancels the panel.\n\n## Presenting a Save Panel\n\n- **prepareSavePanel(_:)**: Tells the document to customize the specified Save panel.\n- **shouldRunSavePanelWithAccessoryView**: A Boolean value that indicates whether the document’s Save panel displays a list of supported writable document types.\n- **fileTypeFromLastRunSavePanel**: The file type that was last selected in the Save panel.\n- **fileNameExtensionWasHiddenInLastRunSavePanel**: A Boolean value that indicates whether the user chose to hide the document’s filename extension.\n\n",
  "sections" : [
    {
      "content" : "",
      "items" : [
        {
          "description" : "Tells the document to customize the specified Save panel.",
          "name" : "prepareSavePanel(_:)",
          "url" : "https:\/\/developer.apple.com\/documentation\/AppKit\/NSDocument\/prepareSavePanel(_:)"
        },
        {
          "description" : "A Boolean value that indicates whether the document’s Save panel displays a list of supported writable document types.",
          "name" : "shouldRunSavePanelWithAccessoryView",
          "url" : "https:\/\/developer.apple.com\/documentation\/AppKit\/NSDocument\/shouldRunSavePanelWithAccessoryView"
        },
        {
          "description" : "The file type that was last selected in the Save panel.",
          "name" : "fileTypeFromLastRunSavePanel",
          "url" : "https:\/\/developer.apple.com\/documentation\/AppKit\/NSDocument\/fileTypeFromLastRunSavePanel"
        },
        {
          "description" : "A Boolean value that indicates whether the user chose to hide the document’s filename extension.",
          "name" : "fileNameExtensionWasHiddenInLastRunSavePanel",
          "url" : "https:\/\/developer.apple.com\/documentation\/AppKit\/NSDocument\/fileNameExtensionWasHiddenInLastRunSavePanel"
        }
      ],
      "title" : "Presenting a Save Panel"
    }
  ],
  "source" : "appleJSON",
  "title" : "runModalSavePanel(for:delegate:didSave:contextInfo:)",
  "url" : "https:\/\/developer.apple.com\/documentation\/AppKit\/NSDocument\/runModalSavePanel(for:delegate:didSave:contextInfo:)"
}