{
  "abstract" : "Adds promises for the specified types to the first pasteboard item.",
  "codeExamples" : [

  ],
  "contentHash" : "3994d6eca2bc4890c88f408543849972723c71cd49fdea80306b16a95d08a91b",
  "crawledAt" : "2025-12-04T12:19:41Z",
  "declaration" : {
    "code" : "func addTypes(_ newTypes: [NSPasteboard.PasteboardType], owner newOwner: Any?) -> Int",
    "language" : "swift"
  },
  "id" : "95501DF8-F28B-4760-B4D2-39746648DF04",
  "kind" : "method",
  "language" : "swift",
  "module" : "AppKit",
  "overview" : "## Return Value\n\nThe new change count, or `0` if there was an error adding the types.\n\n## Discussion\n\nThis method adds promises for the specified types to the first pasteboard item.\n\nYou use this methods to declare additional types of data for the first pasteboard item in the receiver. You can also use it to replace existing types added by a previous [doc:\/\/com.apple.appkit\/documentation\/AppKit\/NSPasteboard\/declareTypes(_:owner:)] or [doc:\/\/com.apple.appkit\/documentation\/AppKit\/NSPasteboard\/addTypes(_:owner:)] message.\n\nThe `newTypes` parameter specifies the types of data you are promising to the pasteboard. The types should be ordered according to the preference of the source application, with the most preferred type coming first (typically, the richest representation). New types are added to the end of the list containing any existing types, if any.\n\nIf you specify a type that has already been declared, this method replaces the owner of that type with the value in `newOwner`. In addition, any data already written to the pasteboard for that type is removed.",
  "platforms" : [
    "macOS"
  ],
  "rawMarkdown" : "---\nsource: https:\/\/developer.apple.com\/documentation\/AppKit\/NSPasteboard\/addTypes(_:owner:)\ncrawled: 2025-12-04T12:19:41Z\n---\n\n# addTypes(_:owner:)\n\n**Instance Method**\n\nAdds promises for the specified types to the first pasteboard item.\n\n## Declaration\n\n```swift\nfunc addTypes(_ newTypes: [NSPasteboard.PasteboardType], owner newOwner: Any?) -> Int\n```\n\n## Parameters\n\n- **newTypes**: An array of `NSString` objects, each of which specifies a type of data that can be provided to the pasteboard.\n- **newOwner**: The object that provides the data for the specified types.\n\nIf the data for those types is provided immediately, the owner can be `nil`. If the data for the added types will be provided lazily when requested from the pasteboard, an owner object must be provided that implements the -[doc:\/\/com.apple.documentation\/documentation\/ObjectiveC\/NSObject-swift.class\/pasteboard:provideDataForType:] method of the `NSPasteboardOwner` informal protocol.\n\n## Return Value\n\nThe new change count, or `0` if there was an error adding the types.\n\n## Discussion\n\nThis method adds promises for the specified types to the first pasteboard item.\n\nYou use this methods to declare additional types of data for the first pasteboard item in the receiver. You can also use it to replace existing types added by a previous [doc:\/\/com.apple.appkit\/documentation\/AppKit\/NSPasteboard\/declareTypes(_:owner:)] or [doc:\/\/com.apple.appkit\/documentation\/AppKit\/NSPasteboard\/addTypes(_:owner:)] message.\n\nThe `newTypes` parameter specifies the types of data you are promising to the pasteboard. The types should be ordered according to the preference of the source application, with the most preferred type coming first (typically, the richest representation). New types are added to the end of the list containing any existing types, if any.\n\nIf you specify a type that has already been declared, this method replaces the owner of that type with the value in `newOwner`. In addition, any data already written to the pasteboard for that type is removed.\n\n## Related Documentation\n\n- **changeCount**: The receiver’s change count.\n\n## Writing data (macOS 10.5 and earlier)\n\n- **declareTypes(_:owner:)**: Prepares the receiver for a change in its contents by declaring the new types of data it will contain and a new owner.\n- **writeFileContents(_:)**: Writes the contents of the specified file to the pasteboard.\n- **write(_:)**: Writes the serialized contents of the specified file wrapper to the pasteboard.\n\n",
  "sections" : [
    {
      "content" : "",
      "items" : [
        {
          "description" : "The receiver’s change count.",
          "name" : "changeCount",
          "url" : "https:\/\/developer.apple.com\/documentation\/AppKit\/NSPasteboard\/changeCount"
        }
      ],
      "title" : "Related Documentation"
    },
    {
      "content" : "",
      "items" : [
        {
          "description" : "Prepares the receiver for a change in its contents by declaring the new types of data it will contain and a new owner.",
          "name" : "declareTypes(_:owner:)",
          "url" : "https:\/\/developer.apple.com\/documentation\/AppKit\/NSPasteboard\/declareTypes(_:owner:)"
        },
        {
          "description" : "Writes the contents of the specified file to the pasteboard.",
          "name" : "writeFileContents(_:)",
          "url" : "https:\/\/developer.apple.com\/documentation\/AppKit\/NSPasteboard\/writeFileContents(_:)"
        },
        {
          "description" : "Writes the serialized contents of the specified file wrapper to the pasteboard.",
          "name" : "write(_:)",
          "url" : "https:\/\/developer.apple.com\/documentation\/AppKit\/NSPasteboard\/write(_:)"
        }
      ],
      "title" : "Writing data (macOS 10.5 and earlier)"
    }
  ],
  "source" : "appleJSON",
  "title" : "addTypes(_:owner:)",
  "url" : "https:\/\/developer.apple.com\/documentation\/AppKit\/NSPasteboard\/addTypes(_:owner:)"
}