{
  "abstract" : "An image whose alpha channel masks the visual effect view’s material.",
  "codeExamples" : [

  ],
  "contentHash" : "9265980082962836ed54a8bb8047ba11413a62e856f44263722700418dcd8196",
  "crawledAt" : "2025-12-03T09:12:00Z",
  "declaration" : {
    "code" : "@MainActor var maskImage: NSImage? { get set }",
    "language" : "swift"
  },
  "id" : "0D157228-2EC6-4B25-8EC5-B01DAC81C77E",
  "kind" : "property",
  "language" : "swift",
  "module" : "AppKit",
  "overview" : "## Discussion\n\nThe default value of this property is `nil`, which is the equivalent of allowing all of the visual effect view’s content to show through. Assigning an image to this property masks the portions of the visual effect view using the image’s alpha channel.\n\nIf the visual effect view is the content view of a window, the mask is applied in an appropriate way to the window’s shadow.",
  "platforms" : [
    "macOS"
  ],
  "rawMarkdown" : "---\nsource: https:\/\/developer.apple.com\/documentation\/AppKit\/NSVisualEffectView\/maskImage\ncrawled: 2025-12-03T09:12:00Z\n---\n\n# maskImage\n\n**Instance Property**\n\nAn image whose alpha channel masks the visual effect view’s material.\n\n## Declaration\n\n```swift\n@MainActor var maskImage: NSImage? { get set }\n```\n\n## Discussion\n\nThe default value of this property is `nil`, which is the equivalent of allowing all of the visual effect view’s content to show through. Assigning an image to this property masks the portions of the visual effect view using the image’s alpha channel.\n\nIf the visual effect view is the content view of a window, the mask is applied in an appropriate way to the window’s shadow.\n\n",
  "sections" : [

  ],
  "source" : "appleJSON",
  "title" : "maskImage",
  "url" : "https:\/\/developer.apple.com\/documentation\/AppKit\/NSVisualEffectView\/maskImage"
}