{
  "abstract" : "Records information about an edit action to the transaction.",
  "codeExamples" : [

  ],
  "contentHash" : "2b4629911090d6c0c371cc896084861a8207f10dc2eeec82af7d64dbed428b93",
  "crawledAt" : "2025-12-04T02:21:22Z",
  "declaration" : {
    "code" : "func recordEditAction(in originalTextRange: NSTextRange, newTextRange: NSTextRange)",
    "language" : "swift"
  },
  "id" : "16467DE0-704F-4C60-BC21-E769B49325DE",
  "kind" : "method",
  "language" : "swift",
  "module" : "AppKit",
  "overview" : "## Discussion\n\nThe concrete subclass invokes this method for each edit action.",
  "platforms" : [
    "macOS"
  ],
  "rawMarkdown" : "---\nsource: https:\/\/developer.apple.com\/documentation\/AppKit\/NSTextContentManager\/recordEditAction(in:newTextRange:)\ncrawled: 2025-12-04T02:21:22Z\n---\n\n# recordEditAction(in:newTextRange:)\n\n**Instance Method**\n\nRecords information about an edit action to the transaction.\n\n## Declaration\n\n```swift\nfunc recordEditAction(in originalTextRange: NSTextRange, newTextRange: NSTextRange)\n```\n\n## Parameters\n\n- **originalTextRange**: The range before the action.\n- **newTextRange**: The corresponding range after the action.\n\n## Discussion\n\nThe concrete subclass invokes this method for each edit action.\n\n## Performing transactions\n\n- **hasEditingTransaction**: Indicates there’s an active editing transaction from the primary text layout manager.\n- **performEditingTransaction(_:)**: Performs an editing transaction and invokes a block upon completion.\n\n",
  "sections" : [
    {
      "content" : "",
      "items" : [
        {
          "description" : "Indicates there’s an active editing transaction from the primary text layout manager.",
          "name" : "hasEditingTransaction",
          "url" : "https:\/\/developer.apple.com\/documentation\/AppKit\/NSTextContentManager\/hasEditingTransaction"
        },
        {
          "description" : "Performs an editing transaction and invokes a block upon completion.",
          "name" : "performEditingTransaction(_:)",
          "url" : "https:\/\/developer.apple.com\/documentation\/AppKit\/NSTextContentManager\/performEditingTransaction(_:)"
        }
      ],
      "title" : "Performing transactions"
    }
  ],
  "source" : "appleJSON",
  "title" : "recordEditAction(in:newTextRange:)",
  "url" : "https:\/\/developer.apple.com\/documentation\/AppKit\/NSTextContentManager\/recordEditAction(in:newTextRange:)"
}