{
  "abstract" : "Appends a series of line segments to the path.",
  "codeExamples" : [

  ],
  "contentHash" : "6605fa4ba6c6a84baeff361f27acc8358f1471362ad91b5c2e6e9da02cb754d5",
  "crawledAt" : "2025-12-04T12:36:56Z",
  "declaration" : {
    "code" : "func appendPoints(_ points: NSPointArray, count: Int)",
    "language" : "swift"
  },
  "id" : "3BCEA940-C33E-4D5D-A8E5-EBF33182ED9F",
  "kind" : "method",
  "language" : "swift",
  "module" : "AppKit",
  "overview" : "## Discussion\n\nThis method interprets the points as a set of connected line segments.  If the current path contains an open subpath, a line is created from the last point in that subpath to the first point in the points array. If the current path is empty, the first point in the points array is used to set the starting point of the line segments. Subsequent line segments are added using the remaining points in the array.\n\nThis method does not close the path that is created. If you wish to create a closed path, you must do so by explicitly invoking the receiver’s [doc:\/\/com.apple.appkit\/documentation\/AppKit\/NSBezierPath\/close()] method.",
  "platforms" : [
    "macOS"
  ],
  "rawMarkdown" : "---\nsource: https:\/\/developer.apple.com\/documentation\/AppKit\/NSBezierPath\/appendPoints(_:count:)\ncrawled: 2025-12-04T12:36:56Z\n---\n\n# appendPoints(_:count:)\n\n**Instance Method**\n\nAppends a series of line segments to the path.\n\n## Declaration\n\n```swift\nfunc appendPoints(_ points: NSPointArray, count: Int)\n```\n\n## Parameters\n\n- **points**: A C-style array of `NSPoint` data types, each of which contains the end point of the next line segment.\n- **count**: The number of points in the `points` parameter.\n\n## Discussion\n\nThis method interprets the points as a set of connected line segments.  If the current path contains an open subpath, a line is created from the last point in that subpath to the first point in the points array. If the current path is empty, the first point in the points array is used to set the starting point of the line segments. Subsequent line segments are added using the remaining points in the array.\n\nThis method does not close the path that is created. If you wish to create a closed path, you must do so by explicitly invoking the receiver’s [doc:\/\/com.apple.appkit\/documentation\/AppKit\/NSBezierPath\/close()] method.\n\n## Appending Common Shapes to a Path\n\n- **append(_:)**: Appends the contents of the specified path object to the path.\n- **appendOval(in:)**: Appends an oval path to the path, inscribing the oval in the specified rectangle.\n- **appendArc(from:to:radius:)**: Appends an arc to the path.\n- **appendArc(withCenter:radius:startAngle:endAngle:)**: Appends an arc of a circle to the path.\n- **appendArc(withCenter:radius:startAngle:endAngle:clockwise:)**: Appends an arc of a circle to the path.\n- **appendRect(_:)**: Appends a rectangular path to the path.\n- **appendRoundedRect(_:xRadius:yRadius:)**: Appends a rounded rectangular path to the path.\n- **append(withCGGlyph:in:)**: Appends an outline of the specified glyph to the path.\n- **append(withCGGlyphs:count:in:)**: Appends the outlines of the specified glyphs to the path.\n- **appendGlyph(_:in:)**: Appends an outline of the specified glyph to the path.\n- **appendGlyphs(_:count:in:)**: Appends the outlines of the specified glyphs to the path.\n- **appendPackedGlyphs(_:)**: Appends an array of packed glyphs to the path.\n\n",
  "sections" : [
    {
      "content" : "",
      "items" : [
        {
          "description" : "Appends the contents of the specified path object to the path.",
          "name" : "append(_:)",
          "url" : "https:\/\/developer.apple.com\/documentation\/AppKit\/NSBezierPath\/append(_:)"
        },
        {
          "description" : "Appends an oval path to the path, inscribing the oval in the specified rectangle.",
          "name" : "appendOval(in:)",
          "url" : "https:\/\/developer.apple.com\/documentation\/AppKit\/NSBezierPath\/appendOval(in:)"
        },
        {
          "description" : "Appends an arc to the path.",
          "name" : "appendArc(from:to:radius:)",
          "url" : "https:\/\/developer.apple.com\/documentation\/AppKit\/NSBezierPath\/appendArc(from:to:radius:)"
        },
        {
          "description" : "Appends an arc of a circle to the path.",
          "name" : "appendArc(withCenter:radius:startAngle:endAngle:)",
          "url" : "https:\/\/developer.apple.com\/documentation\/AppKit\/NSBezierPath\/appendArc(withCenter:radius:startAngle:endAngle:)"
        },
        {
          "description" : "Appends an arc of a circle to the path.",
          "name" : "appendArc(withCenter:radius:startAngle:endAngle:clockwise:)",
          "url" : "https:\/\/developer.apple.com\/documentation\/AppKit\/NSBezierPath\/appendArc(withCenter:radius:startAngle:endAngle:clockwise:)"
        },
        {
          "description" : "Appends a rectangular path to the path.",
          "name" : "appendRect(_:)",
          "url" : "https:\/\/developer.apple.com\/documentation\/AppKit\/NSBezierPath\/appendRect(_:)"
        },
        {
          "description" : "Appends a rounded rectangular path to the path.",
          "name" : "appendRoundedRect(_:xRadius:yRadius:)",
          "url" : "https:\/\/developer.apple.com\/documentation\/AppKit\/NSBezierPath\/appendRoundedRect(_:xRadius:yRadius:)"
        },
        {
          "description" : "Appends an outline of the specified glyph to the path.",
          "name" : "append(withCGGlyph:in:)",
          "url" : "https:\/\/developer.apple.com\/documentation\/AppKit\/NSBezierPath\/append(withCGGlyph:in:)"
        },
        {
          "description" : "Appends the outlines of the specified glyphs to the path.",
          "name" : "append(withCGGlyphs:count:in:)",
          "url" : "https:\/\/developer.apple.com\/documentation\/AppKit\/NSBezierPath\/append(withCGGlyphs:count:in:)"
        },
        {
          "description" : "Appends an outline of the specified glyph to the path.",
          "name" : "appendGlyph(_:in:)",
          "url" : "https:\/\/developer.apple.com\/documentation\/AppKit\/NSBezierPath\/appendGlyph(_:in:)"
        },
        {
          "description" : "Appends the outlines of the specified glyphs to the path.",
          "name" : "appendGlyphs(_:count:in:)",
          "url" : "https:\/\/developer.apple.com\/documentation\/AppKit\/NSBezierPath\/appendGlyphs(_:count:in:)"
        },
        {
          "description" : "Appends an array of packed glyphs to the path.",
          "name" : "appendPackedGlyphs(_:)",
          "url" : "https:\/\/developer.apple.com\/documentation\/AppKit\/NSBezierPath\/appendPackedGlyphs(_:)"
        }
      ],
      "title" : "Appending Common Shapes to a Path"
    }
  ],
  "source" : "appleJSON",
  "title" : "appendPoints(_:count:)",
  "url" : "https:\/\/developer.apple.com\/documentation\/AppKit\/NSBezierPath\/appendPoints(_:count:)"
}