{
  "abstract" : "Provides the pasteboard writer for the item at the specified index",
  "codeExamples" : [

  ],
  "contentHash" : "57ec855f45ed0fb36c6d52015a3983497e9c030f49b3fb5ab99d04e77eca11f3",
  "crawledAt" : "2025-12-04T18:09:29Z",
  "declaration" : {
    "code" : "@MainActor optional func collectionView(_ collectionView: NSCollectionView, pasteboardWriterForItemAt index: Int) -> (any NSPasteboardWriting)?",
    "language" : "swift"
  },
  "id" : "0C344E59-E242-4055-9D1F-5C3F4E2DED06",
  "kind" : "method",
  "language" : "swift",
  "module" : "AppKit",
  "overview" : "## Return Value\n\nThe pasteboard writer object to use for managing the item data. Return `nil` to prevent the collection view from dragging the item.\n\n## Discussion\n\nThe collection view calls this method for each item involved in the drag operation after it has determined that a drag should begin but before the drag operation has started.  Your implementation of this method should create and return the pasteboard writer—an object conforming to the [doc:\/\/com.apple.appkit\/documentation\/AppKit\/NSPasteboardWriting] protocol—to use for providing the item’s data. Using the object you provide, the collection view creates an [doc:\/\/com.apple.appkit\/documentation\/AppKit\/NSDraggingItem] object for you and configures its [doc:\/\/com.apple.appkit\/documentation\/AppKit\/NSDraggingItem\/draggingFrame] and [doc:\/\/com.apple.appkit\/documentation\/AppKit\/NSDraggingItem\/imageComponents] properties for you using information from the item at the specified index path.\n\nIf you implement this method, the collection view does not call the [doc:\/\/com.apple.appkit\/documentation\/AppKit\/NSCollectionViewDelegate\/collectionView(_:draggingImageForItemsAt:with:offset:)-4yvk5] of your delegate or the [doc:\/\/com.apple.appkit\/documentation\/AppKit\/NSCollectionView\/draggingImageForItems(at:with:offset:)-951w7] method of [doc:\/\/com.apple.appkit\/documentation\/AppKit\/NSCollectionView].",
  "platforms" : [
    "macOS"
  ],
  "rawMarkdown" : "---\nsource: https:\/\/developer.apple.com\/documentation\/AppKit\/NSCollectionViewDelegate\/collectionView(_:pasteboardWriterForItemAt:)-7ldvs\ncrawled: 2025-12-04T18:09:29Z\n---\n\n# collectionView(_:pasteboardWriterForItemAt:)\n\n**Instance Method**\n\nProvides the pasteboard writer for the item at the specified index\n\n## Declaration\n\n```swift\n@MainActor optional func collectionView(_ collectionView: NSCollectionView, pasteboardWriterForItemAt index: Int) -> (any NSPasteboardWriting)?\n```\n\n## Parameters\n\n- **collectionView**: The collection view making the request.\n- **index**: The index of the item requiring a pasteboard writer.\n\n## Return Value\n\nThe pasteboard writer object to use for managing the item data. Return `nil` to prevent the collection view from dragging the item.\n\n## Discussion\n\nThe collection view calls this method for each item involved in the drag operation after it has determined that a drag should begin but before the drag operation has started.  Your implementation of this method should create and return the pasteboard writer—an object conforming to the [doc:\/\/com.apple.appkit\/documentation\/AppKit\/NSPasteboardWriting] protocol—to use for providing the item’s data. Using the object you provide, the collection view creates an [doc:\/\/com.apple.appkit\/documentation\/AppKit\/NSDraggingItem] object for you and configures its [doc:\/\/com.apple.appkit\/documentation\/AppKit\/NSDraggingItem\/draggingFrame] and [doc:\/\/com.apple.appkit\/documentation\/AppKit\/NSDraggingItem\/imageComponents] properties for you using information from the item at the specified index path.\n\nIf you implement this method, the collection view does not call the [doc:\/\/com.apple.appkit\/documentation\/AppKit\/NSCollectionViewDelegate\/collectionView(_:draggingImageForItemsAt:with:offset:)-4yvk5] of your delegate or the [doc:\/\/com.apple.appkit\/documentation\/AppKit\/NSCollectionView\/draggingImageForItems(at:with:offset:)-951w7] method of [doc:\/\/com.apple.appkit\/documentation\/AppKit\/NSCollectionView].\n\n## Legacy Collection View Support\n\n- **collectionView(_:canDragItemsAt:with:)**: Returns a Boolean indicating whether the collection view can begin dragging the specified items.\n- **collectionView(_:writeItemsAt:to:)**: Invoked after it has been determined that a drag should begin, but before the drag has been started.\n- **collectionView(_:namesOfPromisedFilesDroppedAtDestination:forDraggedItemsAt:)**: Invoked to return an array of filenames that the receiver promises to create.\n- **collectionView(_:draggingImageForItemsAt:with:offset:)**: Creates and returns a drag image to represent the specified items during a drag.\n- **collectionView(_:draggingSession:willBeginAt:forItemsAt:)**: Notifies your delegate that a drag session is about to begin.\n- **collectionView(_:validateDrop:proposedIndex:dropOperation:)**: Validates the specified location to see if it is a valid drop target.\n- **collectionView(_:acceptDrop:index:dropOperation:)**: Invoked when the mouse is released over a collection view that previously allowed a drop.\n\n",
  "sections" : [
    {
      "content" : "",
      "items" : [
        {
          "description" : "Returns a Boolean indicating whether the collection view can begin dragging the specified items.",
          "name" : "collectionView(_:canDragItemsAt:with:)",
          "url" : "https:\/\/developer.apple.com\/documentation\/AppKit\/NSCollectionViewDelegate\/collectionView(_:canDragItemsAt:with:)-39rjh"
        },
        {
          "description" : "Invoked after it has been determined that a drag should begin, but before the drag has been started.",
          "name" : "collectionView(_:writeItemsAt:to:)",
          "url" : "https:\/\/developer.apple.com\/documentation\/AppKit\/NSCollectionViewDelegate\/collectionView(_:writeItemsAt:to:)-a1lk"
        },
        {
          "description" : "Invoked to return an array of filenames that the receiver promises to create.",
          "name" : "collectionView(_:namesOfPromisedFilesDroppedAtDestination:forDraggedItemsAt:)",
          "url" : "https:\/\/developer.apple.com\/documentation\/AppKit\/NSCollectionViewDelegate\/collectionView(_:namesOfPromisedFilesDroppedAtDestination:forDraggedItemsAt:)-wwec"
        },
        {
          "description" : "Creates and returns a drag image to represent the specified items during a drag.",
          "name" : "collectionView(_:draggingImageForItemsAt:with:offset:)",
          "url" : "https:\/\/developer.apple.com\/documentation\/AppKit\/NSCollectionViewDelegate\/collectionView(_:draggingImageForItemsAt:with:offset:)-4yvk5"
        },
        {
          "description" : "Notifies your delegate that a drag session is about to begin.",
          "name" : "collectionView(_:draggingSession:willBeginAt:forItemsAt:)",
          "url" : "https:\/\/developer.apple.com\/documentation\/AppKit\/NSCollectionViewDelegate\/collectionView(_:draggingSession:willBeginAt:forItemsAt:)-cpuq"
        },
        {
          "description" : "Validates the specified location to see if it is a valid drop target.",
          "name" : "collectionView(_:validateDrop:proposedIndex:dropOperation:)",
          "url" : "https:\/\/developer.apple.com\/documentation\/AppKit\/NSCollectionViewDelegate\/collectionView(_:validateDrop:proposedIndex:dropOperation:)"
        },
        {
          "description" : "Invoked when the mouse is released over a collection view that previously allowed a drop.",
          "name" : "collectionView(_:acceptDrop:index:dropOperation:)",
          "url" : "https:\/\/developer.apple.com\/documentation\/AppKit\/NSCollectionViewDelegate\/collectionView(_:acceptDrop:index:dropOperation:)"
        }
      ],
      "title" : "Legacy Collection View Support"
    }
  ],
  "source" : "appleJSON",
  "title" : "collectionView(_:pasteboardWriterForItemAt:)",
  "url" : "https:\/\/developer.apple.com\/documentation\/AppKit\/NSCollectionViewDelegate\/collectionView(_:pasteboardWriterForItemAt:)-7ldvs"
}