{
  "abstract" : "This property is automatically set by the enclosing row view to let this view know what its background looks like.",
  "codeExamples" : [

  ],
  "contentHash" : "ff4f54af6a7639e539726204296f8395cbe3dd0f90ebe92e97e501e9b869d9d3",
  "crawledAt" : "2025-12-03T09:04:53Z",
  "declaration" : {
    "code" : "@MainActor var backgroundStyle: NSView.BackgroundStyle { get set }",
    "language" : "swift"
  },
  "id" : "E71060B8-659D-4F42-9962-08D0B4F1923D",
  "kind" : "property",
  "language" : "swift",
  "module" : "AppKit",
  "overview" : "## Discussion\n\nThe property is automatically set by the enclosing [doc:\/\/com.apple.appkit\/documentation\/AppKit\/NSTableRowView] to let this view know what its background looks like. For instance, when the `backgroundStyle` is NSBackgroundStyleDark, the view should use a light text color.\n\nThe default implementation automatically forwards calls to all subviews that implement `setBackgroundStyle:` or are an NSControl, which have `NSCell` classes that respond to [doc:\/\/com.apple.appkit\/documentation\/AppKit\/NSCell\/backgroundStyle].",
  "platforms" : [
    "macOS"
  ],
  "rawMarkdown" : "---\nsource: https:\/\/developer.apple.com\/documentation\/AppKit\/NSTableCellView\/backgroundStyle\ncrawled: 2025-12-03T09:04:53Z\n---\n\n# backgroundStyle\n\n**Instance Property**\n\nThis property is automatically set by the enclosing row view to let this view know what its background looks like.\n\n## Declaration\n\n```swift\n@MainActor var backgroundStyle: NSView.BackgroundStyle { get set }\n```\n\n## Discussion\n\nThe property is automatically set by the enclosing [doc:\/\/com.apple.appkit\/documentation\/AppKit\/NSTableRowView] to let this view know what its background looks like. For instance, when the `backgroundStyle` is NSBackgroundStyleDark, the view should use a light text color.\n\nThe default implementation automatically forwards calls to all subviews that implement `setBackgroundStyle:` or are an NSControl, which have `NSCell` classes that respond to [doc:\/\/com.apple.appkit\/documentation\/AppKit\/NSCell\/backgroundStyle].\n\n",
  "sections" : [

  ],
  "source" : "appleJSON",
  "title" : "backgroundStyle",
  "url" : "https:\/\/developer.apple.com\/documentation\/AppKit\/NSTableCellView\/backgroundStyle"
}