{
  "abstract" : "The document associated with the window controller.",
  "codeExamples" : [

  ],
  "contentHash" : "461db7fed8529660d06c154f36ebbabb07bb2a8ace7b120cefb5f8df3a69c114",
  "crawledAt" : "2025-12-03T08:58:10Z",
  "declaration" : {
    "code" : "@MainActor unowned(unsafe) var document: AnyObject? { get set }",
    "language" : "swift"
  },
  "id" : "F2755701-B412-46D7-98CE-50CE8D0982A5",
  "kind" : "property",
  "language" : "swift",
  "module" : "AppKit",
  "overview" : "## Discussion\n\nThe value of this property is `nil` if no document is associated with the window. When a window controller is added to a document’s list of window controllers, the document uses this property to set the window controller’s document; you should not set this property. AppKit uses this property to access the document for relevant next-responder messages.",
  "platforms" : [
    "macOS"
  ],
  "rawMarkdown" : "---\nsource: https:\/\/developer.apple.com\/documentation\/AppKit\/NSWindowController\/document\ncrawled: 2025-12-03T08:58:10Z\n---\n\n# document\n\n**Instance Property**\n\nThe document associated with the window controller.\n\n## Declaration\n\n```swift\n@MainActor unowned(unsafe) var document: AnyObject? { get set }\n```\n\n## Discussion\n\nThe value of this property is `nil` if no document is associated with the window. When a window controller is added to a document’s list of window controllers, the document uses this property to set the window controller’s document; you should not set this property. AppKit uses this property to access the document for relevant next-responder messages.\n\n## Accessing the Document\n\n- **setDocumentEdited(_:)**: Sets the document edited flag for the window controller.\n\n",
  "sections" : [
    {
      "content" : "",
      "items" : [
        {
          "description" : "Sets the document edited flag for the window controller.",
          "name" : "setDocumentEdited(_:)",
          "url" : "https:\/\/developer.apple.com\/documentation\/AppKit\/NSWindowController\/setDocumentEdited(_:)"
        }
      ],
      "title" : "Accessing the Document"
    }
  ],
  "source" : "appleJSON",
  "title" : "document",
  "url" : "https:\/\/developer.apple.com\/documentation\/AppKit\/NSWindowController\/document"
}