{
  "abstract" : "A Boolean value indicating whether the view is hidden from sight because it, or one of its ancestors, is marked as hidden.",
  "codeExamples" : [

  ],
  "contentHash" : "e75c912f915e9064ccb68452c419108dcbfca0472145be856c0fc27c9a7c3dd8",
  "crawledAt" : "2025-12-04T18:34:30Z",
  "declaration" : {
    "code" : "@MainActor var isHiddenOrHasHiddenAncestor: Bool { get }",
    "language" : "swift"
  },
  "id" : "C6AC98A1-1EC3-4B13-A456-64B3E79CAAD2",
  "kind" : "property",
  "language" : "swift",
  "module" : "AppKit",
  "overview" : "## Discussion\n\nThe value of this property is [doc:\/\/com.apple.documentation\/documentation\/Swift\/true] if the value of the [doc:\/\/com.apple.appkit\/documentation\/AppKit\/NSView\/isHidden] property is [doc:\/\/com.apple.documentation\/documentation\/Swift\/true] for the current view or any of its ancestors in the view hierarchy. This property does not account for other reasons why a view might be considered hidden, such as being positioned outside its superview’s bounds, not having a window, or residing in a window that is offscreen or overlapped by another window.",
  "platforms" : [
    "macOS"
  ],
  "rawMarkdown" : "---\nsource: https:\/\/developer.apple.com\/documentation\/AppKit\/NSView\/isHiddenOrHasHiddenAncestor\ncrawled: 2025-12-04T18:34:30Z\n---\n\n# isHiddenOrHasHiddenAncestor\n\n**Instance Property**\n\nA Boolean value indicating whether the view is hidden from sight because it, or one of its ancestors, is marked as hidden.\n\n## Declaration\n\n```swift\n@MainActor var isHiddenOrHasHiddenAncestor: Bool { get }\n```\n\n## Discussion\n\nThe value of this property is [doc:\/\/com.apple.documentation\/documentation\/Swift\/true] if the value of the [doc:\/\/com.apple.appkit\/documentation\/AppKit\/NSView\/isHidden] property is [doc:\/\/com.apple.documentation\/documentation\/Swift\/true] for the current view or any of its ancestors in the view hierarchy. This property does not account for other reasons why a view might be considered hidden, such as being positioned outside its superview’s bounds, not having a window, or residing in a window that is offscreen or overlapped by another window.\n\n## Showing and Hiding the View\n\n- **isHidden**: A Boolean value indicating whether the view is hidden.\n- **viewDidHide()**: Invoked when the view is hidden, either directly, or in response to an ancestor being hidden.\n- **viewDidUnhide()**: Invoked when the view is unhidden, either directly, or in response to an ancestor being unhidden\n\n",
  "sections" : [
    {
      "content" : "",
      "items" : [
        {
          "description" : "A Boolean value indicating whether the view is hidden.",
          "name" : "isHidden",
          "url" : "https:\/\/developer.apple.com\/documentation\/AppKit\/NSView\/isHidden"
        },
        {
          "description" : "Invoked when the view is hidden, either directly, or in response to an ancestor being hidden.",
          "name" : "viewDidHide()",
          "url" : "https:\/\/developer.apple.com\/documentation\/AppKit\/NSView\/viewDidHide()"
        },
        {
          "description" : "Invoked when the view is unhidden, either directly, or in response to an ancestor being unhidden",
          "name" : "viewDidUnhide()",
          "url" : "https:\/\/developer.apple.com\/documentation\/AppKit\/NSView\/viewDidUnhide()"
        }
      ],
      "title" : "Showing and Hiding the View"
    }
  ],
  "source" : "appleJSON",
  "title" : "isHiddenOrHasHiddenAncestor",
  "url" : "https:\/\/developer.apple.com\/documentation\/AppKit\/NSView\/isHiddenOrHasHiddenAncestor"
}