{
  "abstract" : "The size of the text container’s bounding rectangle.",
  "codeExamples" : [

  ],
  "contentHash" : "184a9d341545d4b9739f24a78a7a1e13ac663a5212eb68573d3c93cb69018d4d",
  "crawledAt" : "2025-12-02T07:29:34Z",
  "declaration" : {
    "code" : "var size: CGSize { get set }",
    "language" : "swift"
  },
  "id" : "CE1FCD1B-5851-4806-A7EA-06DA22E9D5D1",
  "kind" : "property",
  "module" : "AppKit",
  "overview" : "## Discussion\n\nThis property defines the maximum size for the layout area returned from [doc:\/\/com.apple.appkit\/documentation\/AppKit\/NSTextContainer\/lineFragmentRect(forProposedRect:at:writingDirection:remaining:)]. A value of `0.0` or less means no limitation.\n\nIf you don’t specify an explicit size when you initialize a text container, the system uses a default large size of (`10000000.0`, `10000000.0`).",
  "platforms" : [
    "macOS"
  ],
  "rawMarkdown" : "---\nsource: https:\/\/developer.apple.com\/documentation\/AppKit\/NSTextContainer\/size\ncrawled: 2025-12-02T07:29:34Z\n---\n\n# size\n\n**Instance Property**\n\nThe size of the text container’s bounding rectangle.\n\n## Declaration\n\n```swift\nvar size: CGSize { get set }\n```\n\n## Discussion\n\nThis property defines the maximum size for the layout area returned from [doc:\/\/com.apple.appkit\/documentation\/AppKit\/NSTextContainer\/lineFragmentRect(forProposedRect:at:writingDirection:remaining:)]. A value of `0.0` or less means no limitation.\n\nIf you don’t specify an explicit size when you initialize a text container, the system uses a default large size of (`10000000.0`, `10000000.0`).\n\n## Defining the container shape\n\n- **exclusionPaths**: An array of path objects that represents the regions where text doesn’t display in the text container.\n- **lineBreakMode**: The behavior of the last line inside the text container.\n- **widthTracksTextView**: A Boolean that controls whether the text container adjusts the width of its bounding rectangle when its text view resizes.\n- **heightTracksTextView**: A Boolean that controls whether the text container adjusts the height of its bounding rectangle when its text view resizes.\n\n",
  "sections" : [
    {
      "content" : "",
      "items" : [
        {
          "description" : "An array of path objects that represents the regions where text doesn’t display in the text container.",
          "name" : "exclusionPaths",
          "url" : "https:\/\/developer.apple.com\/documentation\/AppKit\/NSTextContainer\/exclusionPaths"
        },
        {
          "description" : "The behavior of the last line inside the text container.",
          "name" : "lineBreakMode",
          "url" : "https:\/\/developer.apple.com\/documentation\/AppKit\/NSTextContainer\/lineBreakMode"
        },
        {
          "description" : "A Boolean that controls whether the text container adjusts the width of its bounding rectangle when its text view resizes.",
          "name" : "widthTracksTextView",
          "url" : "https:\/\/developer.apple.com\/documentation\/AppKit\/NSTextContainer\/widthTracksTextView"
        },
        {
          "description" : "A Boolean that controls whether the text container adjusts the height of its bounding rectangle when its text view resizes.",
          "name" : "heightTracksTextView",
          "url" : "https:\/\/developer.apple.com\/documentation\/AppKit\/NSTextContainer\/heightTracksTextView"
        }
      ],
      "title" : "Defining the container shape"
    }
  ],
  "source" : "appleJSON",
  "title" : "size",
  "url" : "https:\/\/developer.apple.com\/documentation\/AppKit\/NSTextContainer\/size"
}