{
  "abstract" : "Shows the popover anchored to the specified toolbar item.",
  "codeExamples" : [

  ],
  "contentHash" : "59c65726b788d111310f6645bd991d7f74df1ed161007a4d02403bc6cc1786a1",
  "crawledAt" : "2025-12-01T13:43:19Z",
  "declaration" : {
    "code" : "@MainActor func show(relativeTo toolbarItem: NSToolbarItem)",
    "language" : "swift"
  },
  "id" : "4908378A-7A94-488D-B38B-8D8DED6FFA05",
  "kind" : "method",
  "module" : "AppKit",
  "overview" : "## Discussion\n\nUse this method to display a popover relative to a toolbar item. When the item is in the overflow menu, the popover presents itself from another appropriate affordance in the window. See [doc:\/\/com.apple.appkit\/documentation\/AppKit\/NSPopover\/show(relativeTo:of:preferredEdge:)] for popover behavior.\n\nThis method raises an [doc:\/\/com.apple.documentation\/documentation\/Foundation\/NSExceptionName\/invalidArgumentException] if it can’t locate the toolbar item. This could occur if the item isn’t in a toolbar, or because the toolbar isn’t in the window.",
  "platforms" : [
    "macOS"
  ],
  "rawMarkdown" : "---\nsource: https:\/\/developer.apple.com\/documentation\/AppKit\/NSPopover\/show(relativeTo:)\ncrawled: 2025-12-01T13:43:19Z\n---\n\n# show(relativeTo:)\n\n**Instance Method**\n\nShows the popover anchored to the specified toolbar item.\n\n## Declaration\n\n```swift\n@MainActor func show(relativeTo toolbarItem: NSToolbarItem)\n```\n\n## Parameters\n\n- **toolbarItem**: The toolbar item anchoring the popover.\n\n## Discussion\n\nUse this method to display a popover relative to a toolbar item. When the item is in the overflow menu, the popover presents itself from another appropriate affordance in the window. See [doc:\/\/com.apple.appkit\/documentation\/AppKit\/NSPopover\/show(relativeTo:of:preferredEdge:)] for popover behavior.\n\nThis method raises an [doc:\/\/com.apple.documentation\/documentation\/Foundation\/NSExceptionName\/invalidArgumentException] if it can’t locate the toolbar item. This could occur if the item isn’t in a toolbar, or because the toolbar isn’t in the window.\n\n",
  "sections" : [

  ],
  "source" : "appleJSON",
  "title" : "show(relativeTo:)",
  "url" : "https:\/\/developer.apple.com\/documentation\/AppKit\/NSPopover\/show(relativeTo:)"
}