{
  "abstract" : "The rectangle for the cancel button within the bounds of the search field.",
  "codeExamples" : [

  ],
  "contentHash" : "4782fd8ce762c9066d43cbcc66939a9515e1a069d1a5242a0056340d6b8b6d37",
  "crawledAt" : "2025-12-03T09:00:29Z",
  "declaration" : {
    "code" : "@MainActor func rectForCancelButton(whenCentered isCentered: Bool) -> NSRect",
    "language" : "swift"
  },
  "id" : "8A245DAC-DC79-44BF-AC9D-4D7E9FD8F754",
  "kind" : "method",
  "language" : "swift",
  "module" : "AppKit",
  "platforms" : [
    "macOS"
  ],
  "rawMarkdown" : "---\nsource: https:\/\/developer.apple.com\/documentation\/AppKit\/NSSearchField\/rectForCancelButton(whenCentered:)\ncrawled: 2025-12-03T09:00:29Z\n---\n\n# rectForCancelButton(whenCentered:)\n\n**Instance Method**\n\nThe rectangle for the cancel button within the bounds of the search field.\n\n## Declaration\n\n```swift\n@MainActor func rectForCancelButton(whenCentered isCentered: Bool) -> NSRect\n```\n\n## Parameters\n\n- **isCentered**: A Boolean value that indicates whether the search field’s components are centered within the control. For more information, see [doc:\/\/com.apple.appkit\/documentation\/AppKit\/NSSearchField\/centersPlaceholder].\n\n## Deprecated Symbols\n\n- **centersPlaceholder**: A Boolean value that determines whether the search field’s components are centered within the control.\n- **rectForSearchButton(whenCentered:)**: The rectangle for the search button within the bounds of the search field.\n- **rectForSearchText(whenCentered:)**: The rectangle for the search text within the bounds of the field.\n\n",
  "sections" : [
    {
      "content" : "",
      "items" : [
        {
          "description" : "A Boolean value that determines whether the search field’s components are centered within the control.",
          "name" : "centersPlaceholder",
          "url" : "https:\/\/developer.apple.com\/documentation\/AppKit\/NSSearchField\/centersPlaceholder"
        },
        {
          "description" : "The rectangle for the search button within the bounds of the search field.",
          "name" : "rectForSearchButton(whenCentered:)",
          "url" : "https:\/\/developer.apple.com\/documentation\/AppKit\/NSSearchField\/rectForSearchButton(whenCentered:)"
        },
        {
          "description" : "The rectangle for the search text within the bounds of the field.",
          "name" : "rectForSearchText(whenCentered:)",
          "url" : "https:\/\/developer.apple.com\/documentation\/AppKit\/NSSearchField\/rectForSearchText(whenCentered:)"
        }
      ],
      "title" : "Deprecated Symbols"
    }
  ],
  "source" : "appleJSON",
  "title" : "rectForCancelButton(whenCentered:)",
  "url" : "https:\/\/developer.apple.com\/documentation\/AppKit\/NSSearchField\/rectForCancelButton(whenCentered:)"
}