{
  "abstract" : "The button number for a mouse event.",
  "codeExamples" : [

  ],
  "contentHash" : "72cd710a4fcf29b7068bc44be18fca75beaca94e79b7529c91ada92b9223af6b",
  "crawledAt" : "2025-12-02T05:11:01Z",
  "declaration" : {
    "code" : "var buttonNumber: Int { get }",
    "language" : "swift"
  },
  "id" : "3B7D890D-C8DD-4390-98AE-CDEE1E9483D7",
  "kind" : "property",
  "module" : "AppKit",
  "overview" : "## Discussion\n\nThis property is intended for use with the `NSOtherMouseDown`, `NSOtherMouseUp`, and `NSOtherMouseDragged` events, but will return values for `NSLeftMouse...` and `NSRightMouse...` events also. If this event is not a mouse event, the property is set to `0`.",
  "platforms" : [
    "macOS"
  ],
  "rawMarkdown" : "---\nsource: https:\/\/developer.apple.com\/documentation\/AppKit\/NSEvent\/buttonNumber\ncrawled: 2025-12-02T05:11:01Z\n---\n\n# buttonNumber\n\n**Instance Property**\n\nThe button number for a mouse event.\n\n## Declaration\n\n```swift\nvar buttonNumber: Int { get }\n```\n\n## Discussion\n\nThis property is intended for use with the `NSOtherMouseDown`, `NSOtherMouseUp`, and `NSOtherMouseDragged` events, but will return values for `NSLeftMouse...` and `NSRightMouse...` events also. If this event is not a mouse event, the property is set to `0`.\n\n## Getting mouse event information\n\n- **pressedMouseButtons**: The indices of the currently pressed mouse buttons.\n- **doubleClickInterval**: The maximum number of seconds in which a second mouse click must occur for an event to be a double-click event.\n- **mouseLocation**: Reports the current mouse position in screen coordinates.\n- **clickCount**: The number of mouse clicks associated with a mouse-down or mouse-up event.\n- **associatedEventsMask**: The associated events mask of a mouse event.\n\n",
  "sections" : [
    {
      "content" : "",
      "items" : [
        {
          "description" : "The indices of the currently pressed mouse buttons.",
          "name" : "pressedMouseButtons",
          "url" : "https:\/\/developer.apple.com\/documentation\/AppKit\/NSEvent\/pressedMouseButtons"
        },
        {
          "description" : "The maximum number of seconds in which a second mouse click must occur for an event to be a double-click event.",
          "name" : "doubleClickInterval",
          "url" : "https:\/\/developer.apple.com\/documentation\/AppKit\/NSEvent\/doubleClickInterval"
        },
        {
          "description" : "Reports the current mouse position in screen coordinates.",
          "name" : "mouseLocation",
          "url" : "https:\/\/developer.apple.com\/documentation\/AppKit\/NSEvent\/mouseLocation"
        },
        {
          "description" : "The number of mouse clicks associated with a mouse-down or mouse-up event.",
          "name" : "clickCount",
          "url" : "https:\/\/developer.apple.com\/documentation\/AppKit\/NSEvent\/clickCount"
        },
        {
          "description" : "The associated events mask of a mouse event.",
          "name" : "associatedEventsMask",
          "url" : "https:\/\/developer.apple.com\/documentation\/AppKit\/NSEvent\/associatedEventsMask"
        }
      ],
      "title" : "Getting mouse event information"
    }
  ],
  "source" : "appleJSON",
  "title" : "buttonNumber",
  "url" : "https:\/\/developer.apple.com\/documentation\/AppKit\/NSEvent\/buttonNumber"
}