{
  "abstract" : "Constants that specify the functionality provided by the renderer.",
  "codeExamples" : [

  ],
  "contentHash" : "a81cea14b80f169c91c1d8fb405bbb584b5190151610c6b7e1a597786cc6137d",
  "crawledAt" : "2025-12-04T11:25:08Z",
  "id" : "89A44A81-9CCE-4CCF-AD5A-8BB72CCC0064",
  "kind" : "collection",
  "language" : "swift",
  "module" : "AppKit",
  "overview" : "## Overview\n\nAn OpenGL Profile is requested as part of the pixel format attributes string. When a context is created for a profile, the context must at least implement the requested version of the OpenGL specification. The context may implement a different version of the OpenGL specification as long as the version it implements is compatible with the requested version.",
  "rawMarkdown" : "---\nsource: https:\/\/developer.apple.com\/documentation\/AppKit\/opengl-profiles\ncrawled: 2025-12-04T11:25:08Z\n---\n\n# OpenGL Profiles\n\n**API Collection**\n\nConstants that specify the functionality provided by the renderer.\n\n## Overview\n\nAn OpenGL Profile is requested as part of the pixel format attributes string. When a context is created for a profile, the context must at least implement the requested version of the OpenGL specification. The context may implement a different version of the OpenGL specification as long as the version it implements is compatible with the requested version.\n\n## Constants\n\n- **NSOpenGLProfileVersionLegacy**: The requested profile is a legacy (pre-OpenGL 3.0) profile.\n- **NSOpenGLProfileVersion3_2Core**: The requested profile must implement the OpenGL 3.2 core functionality.\n- **NSOpenGLProfileVersion4_1Core**\n\n## Constants\n\n- **NSOpenGLPixelFormatAttribute**: Pixel format attributes for OpenGL.\n- **OpenGL Pixel Format Attributes**: Pixel format attributes for OpenGL.\n\n",
  "sections" : [
    {
      "content" : "",
      "items" : [
        {
          "description" : "The requested profile is a legacy (pre-OpenGL 3.0) profile.",
          "name" : "NSOpenGLProfileVersionLegacy",
          "url" : "https:\/\/developer.apple.com\/documentation\/AppKit\/NSOpenGLProfileVersionLegacy"
        },
        {
          "description" : "The requested profile must implement the OpenGL 3.2 core functionality.",
          "name" : "NSOpenGLProfileVersion3_2Core",
          "url" : "https:\/\/developer.apple.com\/documentation\/AppKit\/NSOpenGLProfileVersion3_2Core"
        },
        {
          "description" : "",
          "name" : "NSOpenGLProfileVersion4_1Core",
          "url" : "https:\/\/developer.apple.com\/documentation\/AppKit\/NSOpenGLProfileVersion4_1Core"
        }
      ],
      "title" : "Constants"
    },
    {
      "content" : "",
      "items" : [
        {
          "description" : "Pixel format attributes for OpenGL.",
          "name" : "NSOpenGLPixelFormatAttribute",
          "url" : "https:\/\/developer.apple.com\/documentation\/AppKit\/NSOpenGLPixelFormatAttribute"
        },
        {
          "description" : "Pixel format attributes for OpenGL.",
          "name" : "OpenGL Pixel Format Attributes",
          "url" : "https:\/\/developer.apple.com\/documentation\/AppKit\/opengl-pixel-format-attributes"
        }
      ],
      "title" : "Constants"
    }
  ],
  "source" : "appleJSON",
  "title" : "OpenGL Profiles",
  "url" : "https:\/\/developer.apple.com\/documentation\/AppKit\/opengl-profiles"
}