{
  "abstract" : "A round button with a question mark, providing the standard help button look.",
  "codeExamples" : [

  ],
  "contentHash" : "56e6719bb09b78ed4867ca6ae80819c6cd4bedac456301f637b71fd40df6b7e2",
  "crawledAt" : "2025-12-05T09:18:35Z",
  "declaration" : {
    "code" : "case helpButton",
    "language" : "swift"
  },
  "id" : "4CE2FDC4-6ECD-41B4-B68B-BD5F52670C49",
  "kind" : "unknown",
  "language" : "swift",
  "module" : "AppKit",
  "overview" : "## Discussion\n\nA help button appears within a view and opens app-specific help documentation.\n\n\n\nThese are circular, consistently sized buttons that contain a question mark.\n\nUse the system-provided help button to display your help documentation. People are familiar with the appearance of the standard help button and know that choosing it opens help content.\n\nInclude no more than one help button per window. Multiple help buttons in the same context make it hard for people to predict the result of clicking one.\n\nAvoid displaying text that introduces a help button. People know what a help button does, so they don’t need additional descriptive text.\n\nFor design guidance, see [https:\/\/developer.apple.com\/design\/human-interface-guidelines\/buttons].",
  "platforms" : [
    "macOS"
  ],
  "rawMarkdown" : "---\nsource: https:\/\/developer.apple.com\/documentation\/AppKit\/NSButton\/BezelStyle-swift.enum\/helpButton\ncrawled: 2025-12-05T09:18:35Z\n---\n\n# NSButton.BezelStyle.helpButton\n\n**Case**\n\nA round button with a question mark, providing the standard help button look.\n\n## Declaration\n\n```swift\ncase helpButton\n```\n\n## Discussion\n\nA help button appears within a view and opens app-specific help documentation.\n\n\n\nThese are circular, consistently sized buttons that contain a question mark.\n\n\n\nUse the system-provided help button to display your help documentation. People are familiar with the appearance of the standard help button and know that choosing it opens help content.\n\nInclude no more than one help button per window. Multiple help buttons in the same context make it hard for people to predict the result of clicking one.\n\nAvoid displaying text that introduces a help button. People know what a help button does, so they don’t need additional descriptive text.\n\nFor design guidance, see [https:\/\/developer.apple.com\/design\/human-interface-guidelines\/buttons].\n\n## Informational\n\n- **NSButton.BezelStyle.badge**: A button style suitable for displaying additional information.\n- **NSButton.BezelStyle.circular**: A round button that can contain either a single character or an icon.\n\n",
  "sections" : [
    {
      "content" : "",
      "items" : [
        {
          "description" : "A button style suitable for displaying additional information.",
          "name" : "NSButton.BezelStyle.badge",
          "url" : "https:\/\/developer.apple.com\/documentation\/AppKit\/NSButton\/BezelStyle-swift.enum\/badge"
        },
        {
          "description" : "A round button that can contain either a single character or an icon.",
          "name" : "NSButton.BezelStyle.circular",
          "url" : "https:\/\/developer.apple.com\/documentation\/AppKit\/NSButton\/BezelStyle-swift.enum\/circular"
        }
      ],
      "title" : "Informational"
    }
  ],
  "source" : "appleJSON",
  "title" : "NSButton.BezelStyle.helpButton",
  "url" : "https:\/\/developer.apple.com\/documentation\/AppKit\/NSButton\/BezelStyle-swift.enum\/helpButton"
}