{
  "abstract" : "A collection of the windows that are currently grouped together by this window tab group.",
  "codeExamples" : [

  ],
  "contentHash" : "2b3f0e607d7d94ed5b4318e05d04f722dceb75340401126c7117256f2a5f1ed6",
  "crawledAt" : "2025-12-04T12:30:26Z",
  "declaration" : {
    "code" : "var windows: [NSWindow] { get }",
    "language" : "swift"
  },
  "id" : "4C00103C-BEE4-4BAC-A6D3-6D27E5A604AB",
  "kind" : "property",
  "language" : "swift",
  "module" : "AppKit",
  "overview" : "## Discussion\n\nThe order of this array corresponds to the visual order of the tabs in this tab group, arranged from the leading edge of the tab bar to the trailing edge. You can monitor this property for changes using key-value observing.",
  "platforms" : [
    "macOS"
  ],
  "rawMarkdown" : "---\nsource: https:\/\/developer.apple.com\/documentation\/AppKit\/NSWindowTabGroup\/windows\ncrawled: 2025-12-04T12:30:26Z\n---\n\n# windows\n\n**Instance Property**\n\nA collection of the windows that are currently grouped together by this window tab group.\n\n## Declaration\n\n```swift\nvar windows: [NSWindow] { get }\n```\n\n## Discussion\n\nThe order of this array corresponds to the visual order of the tabs in this tab group, arranged from the leading edge of the tab bar to the trailing edge. You can monitor this property for changes using key-value observing.\n\n## Managing Tabbed Windows\n\n- **selectedWindow**: The selected, or frontmost, window in the tab group.\n- **addWindow(_:)**: Adds a window to the tab group.\n- **insertWindow(_:at:)**: Inserts a window at a specific location within the tab group.\n- **removeWindow(_:)**: Removes a window from the tab group.\n\n",
  "sections" : [
    {
      "content" : "",
      "items" : [
        {
          "description" : "The selected, or frontmost, window in the tab group.",
          "name" : "selectedWindow",
          "url" : "https:\/\/developer.apple.com\/documentation\/AppKit\/NSWindowTabGroup\/selectedWindow"
        },
        {
          "description" : "Adds a window to the tab group.",
          "name" : "addWindow(_:)",
          "url" : "https:\/\/developer.apple.com\/documentation\/AppKit\/NSWindowTabGroup\/addWindow(_:)"
        },
        {
          "description" : "Inserts a window at a specific location within the tab group.",
          "name" : "insertWindow(_:at:)",
          "url" : "https:\/\/developer.apple.com\/documentation\/AppKit\/NSWindowTabGroup\/insertWindow(_:at:)"
        },
        {
          "description" : "Removes a window from the tab group.",
          "name" : "removeWindow(_:)",
          "url" : "https:\/\/developer.apple.com\/documentation\/AppKit\/NSWindowTabGroup\/removeWindow(_:)"
        }
      ],
      "title" : "Managing Tabbed Windows"
    }
  ],
  "source" : "appleJSON",
  "title" : "windows",
  "url" : "https:\/\/developer.apple.com\/documentation\/AppKit\/NSWindowTabGroup\/windows"
}