{
  "abstract" : "Informs the coordinator that a change occurred to the view or its text that requires a layout update.",
  "codeExamples" : [

  ],
  "contentHash" : "4fb0a1d89714f262f545c1239dbb7e730312a271383d043ecc64fd8733d80e19",
  "crawledAt" : "2025-12-02T18:02:27Z",
  "declaration" : {
    "code" : "@MainActor func updateForReflowedTextInContextWithIdentifier(_ contextID: UUID)",
    "language" : "swift"
  },
  "id" : "3EA2C9F6-AA2C-473F-9E77-B5F321B7389F",
  "kind" : "method",
  "language" : "swift",
  "module" : "AppKit",
  "overview" : "## Discussion\n\nUse this method to inform Writing Tools when the geometry of your view changes, or when the text that precedes one of your context objects changes. Changes to the view’s geometry or text can affect the flow of any remaining text, and require a layout update. Writing Tools uses this method to refresh any layout-dependent information it’s currently tracking. For example, it uses it to refresh the location of proofreading marks it’s displaying in your view.\n\nIf a text change affects the text inside a context object, call the [doc:\/\/com.apple.appkit\/documentation\/AppKit\/NSWritingToolsCoordinator\/updateRange(_:with:reason:forContextWithIdentifier:)] method to report that change instead.",
  "platforms" : [
    "macOS"
  ],
  "rawMarkdown" : "---\nsource: https:\/\/developer.apple.com\/documentation\/AppKit\/NSWritingToolsCoordinator\/updateForReflowedTextInContextWithIdentifier(_:)\ncrawled: 2025-12-02T18:02:27Z\n---\n\n# updateForReflowedTextInContextWithIdentifier(_:)\n\n**Instance Method**\n\nInforms the coordinator that a change occurred to the view or its text that requires a layout update.\n\n## Declaration\n\n```swift\n@MainActor func updateForReflowedTextInContextWithIdentifier(_ contextID: UUID)\n```\n\n## Parameters\n\n- **contextID**: The unique identifier of the context object affected by the change. Pass the identifier for the context object that comes after the changes.\n\n## Discussion\n\nUse this method to inform Writing Tools when the geometry of your view changes, or when the text that precedes one of your context objects changes. Changes to the view’s geometry or text can affect the flow of any remaining text, and require a layout update. Writing Tools uses this method to refresh any layout-dependent information it’s currently tracking. For example, it uses it to refresh the location of proofreading marks it’s displaying in your view.\n\nIf a text change affects the text inside a context object, call the [doc:\/\/com.apple.appkit\/documentation\/AppKit\/NSWritingToolsCoordinator\/updateRange(_:with:reason:forContextWithIdentifier:)] method to report that change instead.\n\n## Reporting changes to Writing Tools\n\n- **updateRange(_:with:reason:forContextWithIdentifier:)**: Informs the coordinator about changes your app made to the text in the specified context object.\n- **NSWritingToolsCoordinator.TextUpdateReason**: Constants that specify the reason you updated your view’s content outside of the Writing Tools workflow.\n\n",
  "sections" : [
    {
      "content" : "",
      "items" : [
        {
          "description" : "Informs the coordinator about changes your app made to the text in the specified context object.",
          "name" : "updateRange(_:with:reason:forContextWithIdentifier:)",
          "url" : "https:\/\/developer.apple.com\/documentation\/AppKit\/NSWritingToolsCoordinator\/updateRange(_:with:reason:forContextWithIdentifier:)"
        },
        {
          "description" : "Constants that specify the reason you updated your view’s content outside of the Writing Tools workflow.",
          "name" : "NSWritingToolsCoordinator.TextUpdateReason",
          "url" : "https:\/\/developer.apple.com\/documentation\/AppKit\/NSWritingToolsCoordinator\/TextUpdateReason"
        }
      ],
      "title" : "Reporting changes to Writing Tools"
    }
  ],
  "source" : "appleJSON",
  "title" : "updateForReflowedTextInContextWithIdentifier(_:)",
  "url" : "https:\/\/developer.apple.com\/documentation\/AppKit\/NSWritingToolsCoordinator\/updateForReflowedTextInContextWithIdentifier(_:)"
}