{
  "abstract" : "Requests a haptic feedback performer object that is based on the current input device, accessibility settings, and user preferences.",
  "codeExamples" : [

  ],
  "contentHash" : "3abc68e7abc414efb674eb5b64fc85f0396584ee19af6cc4d6a90c4261e50cc5",
  "crawledAt" : "2025-12-04T00:09:48Z",
  "declaration" : {
    "code" : "class var defaultPerformer: any NSHapticFeedbackPerformer { get }",
    "language" : "swift"
  },
  "id" : "91B6DECE-6050-4E4B-B6C8-6EA48B3DFE9B",
  "kind" : "property",
  "language" : "swift",
  "module" : "AppKit",
  "overview" : "## Discussion\n\nThis method returns a haptic feedback performer object of type `NSHapticFeedbackPerformer` that is based on the current input device, accessibility settings, and user preferences. Because the current input device may change at any time, you should request the default performer whenever you need to provide haptic feedback to the user.",
  "platforms" : [
    "macOS"
  ],
  "rawMarkdown" : "---\nsource: https:\/\/developer.apple.com\/documentation\/AppKit\/NSHapticFeedbackManager\/defaultPerformer\ncrawled: 2025-12-04T00:09:48Z\n---\n\n# defaultPerformer\n\n**Type Property**\n\nRequests a haptic feedback performer object that is based on the current input device, accessibility settings, and user preferences.\n\n## Declaration\n\n```swift\nclass var defaultPerformer: any NSHapticFeedbackPerformer { get }\n```\n\n## Discussion\n\nThis method returns a haptic feedback performer object of type `NSHapticFeedbackPerformer` that is based on the current input device, accessibility settings, and user preferences. Because the current input device may change at any time, you should request the default performer whenever you need to provide haptic feedback to the user.\n\n## Related Documentation\n\n- **NSHapticFeedbackPerformer**: A set of methods and constants that a haptic feedback performer implements.\n\n",
  "sections" : [
    {
      "content" : "",
      "items" : [
        {
          "description" : "A set of methods and constants that a haptic feedback performer implements.",
          "name" : "NSHapticFeedbackPerformer",
          "url" : "https:\/\/developer.apple.com\/documentation\/AppKit\/NSHapticFeedbackPerformer"
        }
      ],
      "title" : "Related Documentation"
    }
  ],
  "source" : "appleJSON",
  "title" : "defaultPerformer",
  "url" : "https:\/\/developer.apple.com\/documentation\/AppKit\/NSHapticFeedbackManager\/defaultPerformer"
}