{
  "abstract" : "Inserts the given glyphs into the glyph cache and maps them to the specified characters.",
  "codeExamples" : [

  ],
  "contentHash" : "64aa806b8ed9ea76bea866ef1c8f05a101f1afeeaae874e9f9fb6369cfe01825",
  "crawledAt" : "2025-12-04T02:26:06Z",
  "declaration" : {
    "code" : "func insertGlyphs(_ glyphs: UnsafePointer<NSGlyph>, length: Int, forStartingGlyphAt glyphIndex: Int, characterIndex charIndex: Int)",
    "language" : "swift"
  },
  "id" : "A81DBE7E-DC28-4212-868F-CF8294AC838E",
  "kind" : "method",
  "language" : "swift",
  "module" : "AppKit",
  "overview" : "## Discussion\n\nThis is a bulk insert method for the glyph cache.",
  "platforms" : [
    "macOS"
  ],
  "rawMarkdown" : "---\nsource: https:\/\/developer.apple.com\/documentation\/AppKit\/NSGlyphStorage\/insertGlyphs(_:length:forStartingGlyphAt:characterIndex:)\ncrawled: 2025-12-04T02:26:06Z\n---\n\n# insertGlyphs(_:length:forStartingGlyphAt:characterIndex:)\n\n**Instance Method**\n\nInserts the given glyphs into the glyph cache and maps them to the specified characters.\n\n## Declaration\n\n```swift\nfunc insertGlyphs(_ glyphs: UnsafePointer<NSGlyph>, length: Int, forStartingGlyphAt glyphIndex: Int, characterIndex charIndex: Int)\n```\n\n## Parameters\n\n- **glyphs**: The glyphs to insert.\n- **length**: Number of glyphs to insert.\n- **glyphIndex**: Location in the glyph cache to begin inserting glyphs.\n- **charIndex**: Index of first character to be mapped.\n\n## Discussion\n\nThis is a bulk insert method for the glyph cache.\n\n## Modifying the glyph cache\n\n- **setIntAttribute(_:value:forGlyphAt:)**: Sets a custom attribute value for a given glyph.\n\n",
  "sections" : [
    {
      "content" : "",
      "items" : [
        {
          "description" : "Sets a custom attribute value for a given glyph.",
          "name" : "setIntAttribute(_:value:forGlyphAt:)",
          "url" : "https:\/\/developer.apple.com\/documentation\/AppKit\/NSGlyphStorage\/setIntAttribute(_:value:forGlyphAt:)"
        }
      ],
      "title" : "Modifying the glyph cache"
    }
  ],
  "source" : "appleJSON",
  "title" : "insertGlyphs(_:length:forStartingGlyphAt:characterIndex:)",
  "url" : "https:\/\/developer.apple.com\/documentation\/AppKit\/NSGlyphStorage\/insertGlyphs(_:length:forStartingGlyphAt:characterIndex:)"
}