{
  "abstract" : "Sent to the delegate to customize a browser’s keyboard-based selection (type select) behavior.",
  "codeExamples" : [

  ],
  "contentHash" : "8bd7e4e0589578c7f46423af271a29a835eecf2a765a928939c1b3ff3cf6b1f0",
  "crawledAt" : "2025-12-05T20:15:46Z",
  "declaration" : {
    "code" : "@MainActor optional func browser(_ browser: NSBrowser, nextTypeSelectMatchFromRow startRow: Int, toRow endRow: Int, inColumn column: Int, for searchString: String?) -> Int",
    "language" : "swift"
  },
  "id" : "9CD8E269-D899-469A-A4EB-1E2270B1C2B6",
  "kind" : "method",
  "language" : "swift",
  "module" : "AppKit",
  "overview" : "## Return Value\n\nThe index of the first row that matches `searchString` between `startRowIndex` and `endRowIndex` - 1, or `-1` if there is no match.",
  "platforms" : [
    "macOS"
  ],
  "rawMarkdown" : "---\nsource: https:\/\/developer.apple.com\/documentation\/AppKit\/NSBrowserDelegate\/browser(_:nextTypeSelectMatchFromRow:toRow:inColumn:for:)\ncrawled: 2025-12-05T20:15:46Z\n---\n\n# browser(_:nextTypeSelectMatchFromRow:toRow:inColumn:for:)\n\n**Instance Method**\n\nSent to the delegate to customize a browser’s keyboard-based selection (type select) behavior.\n\n## Declaration\n\n```swift\n@MainActor optional func browser(_ browser: NSBrowser, nextTypeSelectMatchFromRow startRow: Int, toRow endRow: Int, inColumn column: Int, for searchString: String?) -> Int\n```\n\n## Parameters\n\n- **browser**: The browser.\n- **startRow**: The beginning of the row set to search.\n- **endRow**: The end of the row set to search. This value can be less than `startRowIndex` when the search wraps around to the beginning.\n- **column**: The column containing the rows being searched.\n- **searchString**: The keyboard-based selection string. It is `nil` when no keyboard-based selection has begun.\n\n## Return Value\n\nThe index of the first row that matches `searchString` between `startRowIndex` and `endRowIndex` - 1, or `-1` if there is no match.\n\n## Managing Selection Behavior\n\n- **browser(_:shouldTypeSelectFor:withCurrentSearch:)**: Sent to the delegate to determine whether keyboard-based selection (type select) for a given event and search string should proceed.\n- **browser(_:typeSelectStringForRow:inColumn:)**: Sent to the delegate to get the keyboard-based selection (type select) string for the specified row and column.\n\n",
  "sections" : [
    {
      "content" : "",
      "items" : [
        {
          "description" : "Sent to the delegate to determine whether keyboard-based selection (type select) for a given event and search string should proceed.",
          "name" : "browser(_:shouldTypeSelectFor:withCurrentSearch:)",
          "url" : "https:\/\/developer.apple.com\/documentation\/AppKit\/NSBrowserDelegate\/browser(_:shouldTypeSelectFor:withCurrentSearch:)"
        },
        {
          "description" : "Sent to the delegate to get the keyboard-based selection (type select) string for the specified row and column.",
          "name" : "browser(_:typeSelectStringForRow:inColumn:)",
          "url" : "https:\/\/developer.apple.com\/documentation\/AppKit\/NSBrowserDelegate\/browser(_:typeSelectStringForRow:inColumn:)"
        }
      ],
      "title" : "Managing Selection Behavior"
    }
  ],
  "source" : "appleJSON",
  "title" : "browser(_:nextTypeSelectMatchFromRow:toRow:inColumn:for:)",
  "url" : "https:\/\/developer.apple.com\/documentation\/AppKit\/NSBrowserDelegate\/browser(_:nextTypeSelectMatchFromRow:toRow:inColumn:for:)"
}