{
  "abstract" : "Creates a color object that uses the specified image pattern to paint the target area.",
  "codeExamples" : [

  ],
  "contentHash" : "151b8406b02851a35020d343b0d4b3dec1559d3c6a47d5d154903dc3965b4cfd",
  "crawledAt" : "2025-12-01T13:24:32Z",
  "declaration" : {
    "code" : "init(patternImage image: NSImage)",
    "language" : "swift"
  },
  "id" : "A482A514-17A7-451B-A7DC-03AC432B98B3",
  "kind" : "unknown",
  "module" : "AppKit",
  "overview" : "## Return Value\n\nThe `NSColor` object. This color object is autoreleased.",
  "platforms" : [
    "macOS"
  ],
  "rawMarkdown" : "---\nsource: https:\/\/developer.apple.com\/documentation\/AppKit\/NSColor\/init(patternImage:)\ncrawled: 2025-12-01T13:24:32Z\n---\n\n# init(patternImage:)\n\n**Initializer**\n\nCreates a color object that uses the specified image pattern to paint the target area.\n\n## Declaration\n\n```swift\ninit(patternImage image: NSImage)\n```\n\n## Parameters\n\n- **image**: The image to use as the pattern for the color object. The image is tiled starting at the bottom of the window. The image is not scaled.\n\n## Return Value\n\nThe `NSColor` object. This color object is autoreleased.\n\n## Creating a pattern-based color\n\n- **patternImage**: The pattern image used to paint the target area.\n\n",
  "sections" : [
    {
      "content" : "",
      "items" : [
        {
          "description" : "The pattern image used to paint the target area.",
          "name" : "patternImage",
          "url" : "https:\/\/developer.apple.com\/documentation\/AppKit\/NSColor\/patternImage"
        }
      ],
      "title" : "Creating a pattern-based color"
    }
  ],
  "source" : "appleJSON",
  "title" : "init(patternImage:)",
  "url" : "https:\/\/developer.apple.com\/documentation\/AppKit\/NSColor\/init(patternImage:)"
}