{
  "abstract" : "Resets the search button cell to its default attributes.",
  "codeExamples" : [

  ],
  "contentHash" : "c0a5b1ee9509f560996730150da5aa0c7a37502bc442d5e69a1613857c647625",
  "crawledAt" : "2025-12-04T00:02:40Z",
  "declaration" : {
    "code" : "@MainActor func resetSearchButtonCell()",
    "language" : "swift"
  },
  "id" : "13EF6047-E951-43BA-BD2D-AFE8E2003D27",
  "kind" : "method",
  "language" : "swift",
  "module" : "AppKit",
  "overview" : "## Discussion\n\nThis method resets the target, action, regular image, and pressed image for the search button cell. By default, when users click the search button or press the Return key, the action defined for the receiver is sent to its designated target. This method gives you a way to customize the search button for specific situations and then reset the button defaults without having to undo changes individually.",
  "platforms" : [
    "macOS"
  ],
  "rawMarkdown" : "---\nsource: https:\/\/developer.apple.com\/documentation\/AppKit\/NSSearchFieldCell\/resetSearchButtonCell()\ncrawled: 2025-12-04T00:02:40Z\n---\n\n# resetSearchButtonCell()\n\n**Instance Method**\n\nResets the search button cell to its default attributes.\n\n## Declaration\n\n```swift\n@MainActor func resetSearchButtonCell()\n```\n\n## Discussion\n\nThis method resets the target, action, regular image, and pressed image for the search button cell. By default, when users click the search button or press the Return key, the action defined for the receiver is sent to its designated target. This method gives you a way to customize the search button for specific situations and then reset the button defaults without having to undo changes individually.\n\n## Managing buttons\n\n- **searchButtonCell**: The button cell used to display the search-button image.\n- **cancelButtonCell**: The button cell used to display the cancel-button image.\n- **resetCancelButtonCell()**: Resets the cancel button cell to its default attributes.\n\n",
  "sections" : [
    {
      "content" : "",
      "items" : [
        {
          "description" : "The button cell used to display the search-button image.",
          "name" : "searchButtonCell",
          "url" : "https:\/\/developer.apple.com\/documentation\/AppKit\/NSSearchFieldCell\/searchButtonCell"
        },
        {
          "description" : "The button cell used to display the cancel-button image.",
          "name" : "cancelButtonCell",
          "url" : "https:\/\/developer.apple.com\/documentation\/AppKit\/NSSearchFieldCell\/cancelButtonCell"
        },
        {
          "description" : "Resets the cancel button cell to its default attributes.",
          "name" : "resetCancelButtonCell()",
          "url" : "https:\/\/developer.apple.com\/documentation\/AppKit\/NSSearchFieldCell\/resetCancelButtonCell()"
        }
      ],
      "title" : "Managing buttons"
    }
  ],
  "source" : "appleJSON",
  "title" : "resetSearchButtonCell()",
  "url" : "https:\/\/developer.apple.com\/documentation\/AppKit\/NSSearchFieldCell\/resetSearchButtonCell()"
}