{
  "abstract" : "A role-based protocol that declares the minimum interface necessary for an accessibility element to act as a layout item.",
  "codeExamples" : [

  ],
  "contentHash" : "7a22e31a934abe89129d873d4d84a42aebe20208219191b6f73f52d1d3bb60b6",
  "crawledAt" : "2025-12-01T08:42:46Z",
  "declaration" : {
    "code" : "protocol NSAccessibilityLayoutItem : NSAccessibilityGroup",
    "language" : "swift"
  },
  "id" : "D4D83969-7EC2-4C95-9423-D92AF2E305FA",
  "kind" : "protocol",
  "module" : "AppKit",
  "overview" : "## Overview\n\nUse this protocol when you want to create a layout item, a repositionable and resizeable item inside a layout area.\n\nYou can further enhance the adopting element by implementing any of the information properties or action methods that the [doc:\/\/com.apple.appkit\/documentation\/AppKit\/NSAccessibilityProtocol] protocol declares.",
  "platforms" : [
    "macOS"
  ],
  "rawMarkdown" : "---\nsource: https:\/\/developer.apple.com\/documentation\/AppKit\/NSAccessibilityLayoutItem\ncrawled: 2025-12-01T08:42:46Z\n---\n\n# NSAccessibilityLayoutItem\n\n**Protocol**\n\nA role-based protocol that declares the minimum interface necessary for an accessibility element to act as a layout item.\n\n## Declaration\n\n```swift\nprotocol NSAccessibilityLayoutItem : NSAccessibilityGroup\n```\n\n## Overview\n\nUse this protocol when you want to create a layout item, a repositionable and resizeable item inside a layout area.\n\nYou can further enhance the adopting element by implementing any of the information properties or action methods that the [doc:\/\/com.apple.appkit\/documentation\/AppKit\/NSAccessibilityProtocol] protocol declares.\n\n\n\n## Supporting Accessibility\n\n- **setAccessibilityFrame(_:)**: Sets the accessibility element’s frame.\n\n## Layout Elements\n\n- **NSAccessibilityLayoutArea**: A role-based protocol that declares the minimum interface necessary for an accessibility element to act as a layout area.\n\n## Inherits From\n\n- NSAccessibilityElementProtocol\n- NSAccessibilityGroup\n- NSObjectProtocol\n\n",
  "sections" : [
    {
      "content" : "",
      "items" : [
        {
          "description" : "Sets the accessibility element’s frame.",
          "name" : "setAccessibilityFrame(_:)",
          "url" : "https:\/\/developer.apple.com\/documentation\/AppKit\/NSAccessibilityLayoutItem\/setAccessibilityFrame(_:)"
        }
      ],
      "title" : "Supporting Accessibility"
    },
    {
      "content" : "",
      "items" : [
        {
          "description" : "A role-based protocol that declares the minimum interface necessary for an accessibility element to act as a layout area.",
          "name" : "NSAccessibilityLayoutArea",
          "url" : "https:\/\/developer.apple.com\/documentation\/AppKit\/NSAccessibilityLayoutArea"
        }
      ],
      "title" : "Layout Elements"
    },
    {
      "content" : "",
      "items" : [
        {
          "name" : "NSAccessibilityElementProtocol"
        },
        {
          "name" : "NSAccessibilityGroup"
        },
        {
          "name" : "NSObjectProtocol"
        }
      ],
      "title" : "Inherits From"
    }
  ],
  "source" : "appleJSON",
  "title" : "NSAccessibilityLayoutItem",
  "url" : "https:\/\/developer.apple.com\/documentation\/AppKit\/NSAccessibilityLayoutItem"
}