{
  "abstract" : "Returns a sharing service instance representing the specified service name.",
  "codeExamples" : [

  ],
  "contentHash" : "504b70829270ef0bc680c9d9d02c9007f06aae551bd90d0383162e43f7f85433",
  "crawledAt" : "2025-12-04T02:16:33Z",
  "declaration" : {
    "code" : "init?(named serviceName: NSSharingService.Name)",
    "language" : "swift"
  },
  "id" : "B45B5B43-5D36-407B-BDB5-6E7965EDED1D",
  "kind" : "unknown",
  "language" : "swift",
  "module" : "AppKit",
  "overview" : "## Return Value\n\nAn instance of `NSSharingService` for the specified service name.",
  "platforms" : [
    "macOS"
  ],
  "rawMarkdown" : "---\nsource: https:\/\/developer.apple.com\/documentation\/AppKit\/NSSharingService\/init(named:)\ncrawled: 2025-12-04T02:16:33Z\n---\n\n# init(named:)\n\n**Initializer**\n\nReturns a sharing service instance representing the specified service name.\n\n## Declaration\n\n```swift\ninit?(named serviceName: NSSharingService.Name)\n```\n\n## Parameters\n\n- **serviceName**: The service name. The possible system provided values are listed in `Available Sharing Services`.\n\n## Return Value\n\nAn instance of `NSSharingService` for the specified service name.\n\n## Related Documentation\n\n- **sharingServices(forItems:)**: Returns a list of sharing services which could share all the provided items together.\n- **canPerform(withItems:)**: Returns whether the service can share all the specified items.\n\n## Creating a Sharing Service\n\n- **init(title:image:alternateImage:handler:)**: Creates a custom sharing service object.\n- **NSSharingService.Name**: Constants that describe the sharing services that macOS supports.\n\n",
  "sections" : [
    {
      "content" : "",
      "items" : [
        {
          "description" : "Returns a list of sharing services which could share all the provided items together.",
          "name" : "sharingServices(forItems:)",
          "url" : "https:\/\/developer.apple.com\/documentation\/AppKit\/NSSharingService\/sharingServices(forItems:)"
        },
        {
          "description" : "Returns whether the service can share all the specified items.",
          "name" : "canPerform(withItems:)",
          "url" : "https:\/\/developer.apple.com\/documentation\/AppKit\/NSSharingService\/canPerform(withItems:)"
        }
      ],
      "title" : "Related Documentation"
    },
    {
      "content" : "",
      "items" : [
        {
          "description" : "Creates a custom sharing service object.",
          "name" : "init(title:image:alternateImage:handler:)",
          "url" : "https:\/\/developer.apple.com\/documentation\/AppKit\/NSSharingService\/init(title:image:alternateImage:handler:)"
        },
        {
          "description" : "Constants that describe the sharing services that macOS supports.",
          "name" : "NSSharingService.Name",
          "url" : "https:\/\/developer.apple.com\/documentation\/AppKit\/NSSharingService\/Name"
        }
      ],
      "title" : "Creating a Sharing Service"
    }
  ],
  "source" : "appleJSON",
  "title" : "init(named:)",
  "url" : "https:\/\/developer.apple.com\/documentation\/AppKit\/NSSharingService\/init(named:)"
}