{
  "abstract" : "This notification is posted just before a pop-up menu is attached to its window frame.",
  "codeExamples" : [

  ],
  "contentHash" : "a842bcb2e841ce83ea479519ebc09b54b4df309a84506fc03614117096eb6a15",
  "crawledAt" : "2025-12-02T05:04:38Z",
  "declaration" : {
    "code" : "class let willPopUpNotification: NSNotification.Name",
    "language" : "swift"
  },
  "id" : "82299487-52AB-4D80-9831-EAFF6E249482",
  "kind" : "property",
  "module" : "AppKit",
  "overview" : "## Discussion\n\nYou can use this notification to lazily construct your part’s menus, thus preventing unnecessary calculations until they are needed. The notification object can be either a pop-up button or its enclosed pop-up button cell. This notification does not contain a `userInfo` dictionary.",
  "platforms" : [
    "macOS"
  ],
  "rawMarkdown" : "---\nsource: https:\/\/developer.apple.com\/documentation\/AppKit\/NSPopUpButtonCell\/willPopUpNotification\ncrawled: 2025-12-02T05:04:38Z\n---\n\n# willPopUpNotification\n\n**Type Property**\n\nThis notification is posted just before a pop-up menu is attached to its window frame.\n\n## Declaration\n\n```swift\nclass let willPopUpNotification: NSNotification.Name\n```\n\n## Discussion\n\nYou can use this notification to lazily construct your part’s menus, thus preventing unnecessary calculations until they are needed. The notification object can be either a pop-up button or its enclosed pop-up button cell. This notification does not contain a `userInfo` dictionary.\n\n",
  "sections" : [

  ],
  "source" : "appleJSON",
  "title" : "willPopUpNotification",
  "url" : "https:\/\/developer.apple.com\/documentation\/AppKit\/NSPopUpButtonCell\/willPopUpNotification"
}