{
  "abstract" : "Returns whether the receiver can concurrently write to a file or file package located by a URL, that is formatted for a specific type, for a specific kind of save operation.",
  "codeExamples" : [

  ],
  "contentHash" : "e37772752536ebd6c026e674bd348c974a628b39f08d2fc8493c8fbd66db0a1c",
  "crawledAt" : "2025-12-02T18:06:24Z",
  "declaration" : {
    "code" : "@MainActor func canAsynchronouslyWrite(to url: URL, ofType typeName: String, for saveOperation: NSDocument.SaveOperationType) -> Bool",
    "language" : "swift"
  },
  "id" : "D3EDB97A-ABE1-4386-BD41-E0FF1102B571",
  "kind" : "method",
  "language" : "swift",
  "module" : "AppKit",
  "overview" : "## Return Value\n\n[doc:\/\/com.apple.documentation\/documentation\/Swift\/false] by default; subclasses can override to return [doc:\/\/com.apple.documentation\/documentation\/Swift\/true], thereby enabling asynchronous writing.\n\n## Discussion\n\nThe default implementation of this method returns [doc:\/\/com.apple.documentation\/documentation\/Swift\/false]. You are strongly encouraged to override it and make it return [doc:\/\/com.apple.documentation\/documentation\/Swift\/true], after making sure your overrides of document writing methods can be safely invoked on a non-main thread, and making sure that the [doc:\/\/com.apple.appkit\/documentation\/AppKit\/NSDocument\/unblockUserInteraction()] method is invoked at some appropriate time during writing.",
  "platforms" : [
    "macOS"
  ],
  "rawMarkdown" : "---\nsource: https:\/\/developer.apple.com\/documentation\/AppKit\/NSDocument\/canAsynchronouslyWrite(to:ofType:for:)\ncrawled: 2025-12-02T18:06:24Z\n---\n\n# canAsynchronouslyWrite(to:ofType:for:)\n\n**Instance Method**\n\nReturns whether the receiver can concurrently write to a file or file package located by a URL, that is formatted for a specific type, for a specific kind of save operation.\n\n## Declaration\n\n```swift\n@MainActor func canAsynchronouslyWrite(to url: URL, ofType typeName: String, for saveOperation: NSDocument.SaveOperationType) -> Bool\n```\n\n## Parameters\n\n- **url**: The location of the file or package to which the document is written.\n- **typeName**: The string that identifies the document type.\n- **saveOperation**: The type of save operation.\n\n## Return Value\n\n[doc:\/\/com.apple.documentation\/documentation\/Swift\/false] by default; subclasses can override to return [doc:\/\/com.apple.documentation\/documentation\/Swift\/true], thereby enabling asynchronous writing.\n\n## Discussion\n\nThe default implementation of this method returns [doc:\/\/com.apple.documentation\/documentation\/Swift\/false]. You are strongly encouraged to override it and make it return [doc:\/\/com.apple.documentation\/documentation\/Swift\/true], after making sure your overrides of document writing methods can be safely invoked on a non-main thread, and making sure that the [doc:\/\/com.apple.appkit\/documentation\/AppKit\/NSDocument\/unblockUserInteraction()] method is invoked at some appropriate time during writing.\n\n## Writing the Document’s Content\n\n- **unblockUserInteraction()**: Unblocks the main thread during asynchronous saving.\n- **write(to:ofType:)**: Writes the contents of the document to a file or file package located by a URL, that is formatted to a specified type.\n- **writeSafely(to:ofType:for:)**: Writes the contents of the document to a file or file package located by a URL.\n- **fileWrapper(ofType:)**: Creates and returns a file wrapper that contains the contents of the document, formatted to the specified type.\n- **data(ofType:)**: Creates and returns a data object that contains the contents of the document, formatted to a specified type.\n- **write(to:ofType:for:originalContentsURL:)**: Writes the contents of the document to a file or file package located by a URL.\n- **save(to:ofType:for:delegate:didSave:contextInfo:)**: Saves the contents of the document to a file or file package located by a URL, that is formatted to a specified type, for a particular kind of save operation.\n- **save(to:ofType:for:completionHandler:)**: Saves the contents of the document to a file or file package located by a URL, that is formatted to a specified type, for a particular kind of save operation, and invokes the passed-in completion handler.\n- **fileAttributesToWrite(to:ofType:for:originalContentsURL:)**: Returns the attributes to write to the file or file package at the specified URL, and targeting the specified type of save operation.\n- **NSDocument.SaveOperationType**: Constants for specifying the type of document-save operation to perform.\n\n",
  "sections" : [
    {
      "content" : "",
      "items" : [
        {
          "description" : "Unblocks the main thread during asynchronous saving.",
          "name" : "unblockUserInteraction()",
          "url" : "https:\/\/developer.apple.com\/documentation\/AppKit\/NSDocument\/unblockUserInteraction()"
        },
        {
          "description" : "Writes the contents of the document to a file or file package located by a URL, that is formatted to a specified type.",
          "name" : "write(to:ofType:)",
          "url" : "https:\/\/developer.apple.com\/documentation\/AppKit\/NSDocument\/write(to:ofType:)"
        },
        {
          "description" : "Writes the contents of the document to a file or file package located by a URL.",
          "name" : "writeSafely(to:ofType:for:)",
          "url" : "https:\/\/developer.apple.com\/documentation\/AppKit\/NSDocument\/writeSafely(to:ofType:for:)"
        },
        {
          "description" : "Creates and returns a file wrapper that contains the contents of the document, formatted to the specified type.",
          "name" : "fileWrapper(ofType:)",
          "url" : "https:\/\/developer.apple.com\/documentation\/AppKit\/NSDocument\/fileWrapper(ofType:)"
        },
        {
          "description" : "Creates and returns a data object that contains the contents of the document, formatted to a specified type.",
          "name" : "data(ofType:)",
          "url" : "https:\/\/developer.apple.com\/documentation\/AppKit\/NSDocument\/data(ofType:)"
        },
        {
          "description" : "Writes the contents of the document to a file or file package located by a URL.",
          "name" : "write(to:ofType:for:originalContentsURL:)",
          "url" : "https:\/\/developer.apple.com\/documentation\/AppKit\/NSDocument\/write(to:ofType:for:originalContentsURL:)"
        },
        {
          "description" : "Saves the contents of the document to a file or file package located by a URL, that is formatted to a specified type, for a particular kind of save operation.",
          "name" : "save(to:ofType:for:delegate:didSave:contextInfo:)",
          "url" : "https:\/\/developer.apple.com\/documentation\/AppKit\/NSDocument\/save(to:ofType:for:delegate:didSave:contextInfo:)"
        },
        {
          "description" : "Saves the contents of the document to a file or file package located by a URL, that is formatted to a specified type, for a particular kind of save operation, and invokes the passed-in completion handler.",
          "name" : "save(to:ofType:for:completionHandler:)",
          "url" : "https:\/\/developer.apple.com\/documentation\/AppKit\/NSDocument\/save(to:ofType:for:completionHandler:)"
        },
        {
          "description" : "Returns the attributes to write to the file or file package at the specified URL, and targeting the specified type of save operation.",
          "name" : "fileAttributesToWrite(to:ofType:for:originalContentsURL:)",
          "url" : "https:\/\/developer.apple.com\/documentation\/AppKit\/NSDocument\/fileAttributesToWrite(to:ofType:for:originalContentsURL:)"
        },
        {
          "description" : "Constants for specifying the type of document-save operation to perform.",
          "name" : "NSDocument.SaveOperationType",
          "url" : "https:\/\/developer.apple.com\/documentation\/AppKit\/NSDocument\/SaveOperationType"
        }
      ],
      "title" : "Writing the Document’s Content"
    }
  ],
  "source" : "appleJSON",
  "title" : "canAsynchronouslyWrite(to:ofType:for:)",
  "url" : "https:\/\/developer.apple.com\/documentation\/AppKit\/NSDocument\/canAsynchronouslyWrite(to:ofType:for:)"
}