{
  "abstract" : "The maximum number of items that may be presented in the standard Open Recent menu.",
  "codeExamples" : [

  ],
  "contentHash" : "c12cf751512e38fbd29f060c253cca45ca5dfc64946b1266981fac58946c50c0",
  "crawledAt" : "2025-12-02T18:28:41Z",
  "declaration" : {
    "code" : "@MainActor var maximumRecentDocumentCount: Int { get }",
    "language" : "swift"
  },
  "id" : "C9CA80E6-676F-4A46-8AC6-28F447A06733",
  "kind" : "property",
  "language" : "swift",
  "module" : "AppKit",
  "overview" : "## Discussion\n\nA value of 0 indicates that `NSDocumentController` will not attempt to add an Open Recent menu to your application’s File menu, although `NSDocumentController` will not attempt to remove any preexisting Open Recent menu item. The default implementation returns a value that is subject to change and may or may not be derived from a setting made by the user in System Preferences.",
  "platforms" : [
    "macOS"
  ],
  "rawMarkdown" : "---\nsource: https:\/\/developer.apple.com\/documentation\/AppKit\/NSDocumentController\/maximumRecentDocumentCount\ncrawled: 2025-12-02T18:28:41Z\n---\n\n# maximumRecentDocumentCount\n\n**Instance Property**\n\nThe maximum number of items that may be presented in the standard Open Recent menu.\n\n## Declaration\n\n```swift\n@MainActor var maximumRecentDocumentCount: Int { get }\n```\n\n## Discussion\n\nA value of 0 indicates that `NSDocumentController` will not attempt to add an Open Recent menu to your application’s File menu, although `NSDocumentController` will not attempt to remove any preexisting Open Recent menu item. The default implementation returns a value that is subject to change and may or may not be derived from a setting made by the user in System Preferences.\n\n## Managing the Open Recent Menu\n\n- **clearRecentDocuments(_:)**: Empties the recent documents list for the application.\n- **noteNewRecentDocumentURL(_:)**: Adds or replaces an Open Recent menu item corresponding to the data located by the URL.\n- **noteNewRecentDocument(_:)**: Adds or replaces an Open Recent menu item corresponding to the document.\n- **recentDocumentURLs**: The list of recent-document URLs.\n\n",
  "sections" : [
    {
      "content" : "",
      "items" : [
        {
          "description" : "Empties the recent documents list for the application.",
          "name" : "clearRecentDocuments(_:)",
          "url" : "https:\/\/developer.apple.com\/documentation\/AppKit\/NSDocumentController\/clearRecentDocuments(_:)"
        },
        {
          "description" : "Adds or replaces an Open Recent menu item corresponding to the data located by the URL.",
          "name" : "noteNewRecentDocumentURL(_:)",
          "url" : "https:\/\/developer.apple.com\/documentation\/AppKit\/NSDocumentController\/noteNewRecentDocumentURL(_:)"
        },
        {
          "description" : "Adds or replaces an Open Recent menu item corresponding to the document.",
          "name" : "noteNewRecentDocument(_:)",
          "url" : "https:\/\/developer.apple.com\/documentation\/AppKit\/NSDocumentController\/noteNewRecentDocument(_:)"
        },
        {
          "description" : "The list of recent-document URLs.",
          "name" : "recentDocumentURLs",
          "url" : "https:\/\/developer.apple.com\/documentation\/AppKit\/NSDocumentController\/recentDocumentURLs"
        }
      ],
      "title" : "Managing the Open Recent Menu"
    }
  ],
  "source" : "appleJSON",
  "title" : "maximumRecentDocumentCount",
  "url" : "https:\/\/developer.apple.com\/documentation\/AppKit\/NSDocumentController\/maximumRecentDocumentCount"
}