{
  "abstract" : "Returns the line spacing in effect following the specified glyph.",
  "codeExamples" : [

  ],
  "contentHash" : "1cf8fca141bcc014f2eb7be69f862c65426a1d05207cb703a1f252f97d852582",
  "crawledAt" : "2025-12-02T07:33:21Z",
  "declaration" : {
    "code" : "func lineSpacing(afterGlyphAt glyphIndex: Int, withProposedLineFragmentRect rect: NSRect) -> CGFloat",
    "language" : "swift"
  },
  "id" : "ADD602E5-82D1-4C26-B115-53B76ED98E1E",
  "kind" : "method",
  "module" : "AppKit",
  "overview" : "## Return Value\n\nThe line spacing in effect following the glyph at `glyphIndex`.\n\n## Discussion\n\nThe [doc:\/\/com.apple.appkit\/documentation\/AppKit\/NSATSTypesetter] calls this method to determine the number of points of space to include below the descenders in the used rectangle for the proposed line fragment rectangle `rect`.\n\nLine spacing, also called leading, is an attribute of [doc:\/\/com.apple.appkit\/documentation\/AppKit\/NSParagraphStyle], which you can set on an [doc:\/\/com.apple.appkit\/documentation\/AppKit\/NSMutableParagraphStyle] object. A font typically includes a default minimum line spacing metric used if none is set in the paragraph style.\n\nIf the typesetter behavior specified in the layout manager is `NSTypesetterOriginalBehavior`, the text system uses the original, private typesetter `NSSimpleHorizontalTypesetter`, which adds the line spacing above the ascender. Similarly, [doc:\/\/com.apple.appkit\/documentation\/AppKit\/NSATSTypesetter] adds the line spacing above the ascender if the value is negative.",
  "platforms" : [
    "macOS"
  ],
  "rawMarkdown" : "---\nsource: https:\/\/developer.apple.com\/documentation\/AppKit\/NSTypesetter\/lineSpacing(afterGlyphAt:withProposedLineFragmentRect:)\ncrawled: 2025-12-02T07:33:21Z\n---\n\n# lineSpacing(afterGlyphAt:withProposedLineFragmentRect:)\n\n**Instance Method**\n\nReturns the line spacing in effect following the specified glyph.\n\n## Declaration\n\n```swift\nfunc lineSpacing(afterGlyphAt glyphIndex: Int, withProposedLineFragmentRect rect: NSRect) -> CGFloat\n```\n\n## Parameters\n\n- **glyphIndex**: The index of the glyph in question.\n- **rect**: The proposed line fragment rectangle.\n\n## Return Value\n\nThe line spacing in effect following the glyph at `glyphIndex`.\n\n## Discussion\n\nThe [doc:\/\/com.apple.appkit\/documentation\/AppKit\/NSATSTypesetter] calls this method to determine the number of points of space to include below the descenders in the used rectangle for the proposed line fragment rectangle `rect`.\n\nLine spacing, also called leading, is an attribute of [doc:\/\/com.apple.appkit\/documentation\/AppKit\/NSParagraphStyle], which you can set on an [doc:\/\/com.apple.appkit\/documentation\/AppKit\/NSMutableParagraphStyle] object. A font typically includes a default minimum line spacing metric used if none is set in the paragraph style.\n\nIf the typesetter behavior specified in the layout manager is `NSTypesetterOriginalBehavior`, the text system uses the original, private typesetter `NSSimpleHorizontalTypesetter`, which adds the line spacing above the ascender. Similarly, [doc:\/\/com.apple.appkit\/documentation\/AppKit\/NSATSTypesetter] adds the line spacing above the ascender if the value is negative.\n\n## Getting spacing information\n\n- **paragraphSpacing(afterGlyphAt:withProposedLineFragmentRect:)**: Returns the paragraph spacing that is in effect after the specified glyph.\n- **paragraphSpacing(beforeGlyphAt:withProposedLineFragmentRect:)**: Returns the number of points of space—added before a paragraph—that is in effect before the specified glyph.\n\n",
  "sections" : [
    {
      "content" : "",
      "items" : [
        {
          "description" : "Returns the paragraph spacing that is in effect after the specified glyph.",
          "name" : "paragraphSpacing(afterGlyphAt:withProposedLineFragmentRect:)",
          "url" : "https:\/\/developer.apple.com\/documentation\/AppKit\/NSTypesetter\/paragraphSpacing(afterGlyphAt:withProposedLineFragmentRect:)"
        },
        {
          "description" : "Returns the number of points of space—added before a paragraph—that is in effect before the specified glyph.",
          "name" : "paragraphSpacing(beforeGlyphAt:withProposedLineFragmentRect:)",
          "url" : "https:\/\/developer.apple.com\/documentation\/AppKit\/NSTypesetter\/paragraphSpacing(beforeGlyphAt:withProposedLineFragmentRect:)"
        }
      ],
      "title" : "Getting spacing information"
    }
  ],
  "source" : "appleJSON",
  "title" : "lineSpacing(afterGlyphAt:withProposedLineFragmentRect:)",
  "url" : "https:\/\/developer.apple.com\/documentation\/AppKit\/NSTypesetter\/lineSpacing(afterGlyphAt:withProposedLineFragmentRect:)"
}