{
  "abstract" : "Responds to a mouse-down event.",
  "codeExamples" : [

  ],
  "contentHash" : "f050f89dcec4ead2a3336262a4a387fd5604b8df58f3b12674b90b4188d4500f",
  "crawledAt" : "2025-12-03T08:33:19Z",
  "declaration" : {
    "code" : "@MainActor func mouseDown(with event: NSEvent)",
    "language" : "swift"
  },
  "id" : "2B1F41CB-02BD-402E-90AF-A8BBFB40224F",
  "kind" : "method",
  "language" : "swift",
  "module" : "AppKit",
  "overview" : "## Discussion\n\nA mouse-down event in a text cell initiates editing mode. A double click in any cell type except a text cell sends the double-click action of the receiver (if there is one) in addition to the single-click action.\n\nYour code should never invoke this method, but you may override it to implement different mouse tracking than [doc:\/\/com.apple.appkit\/documentation\/AppKit\/NSMatrix] does. The response of the receiver depends on its selection mode, as explained in the class description.",
  "platforms" : [
    "macOS"
  ],
  "rawMarkdown" : "---\nsource: https:\/\/developer.apple.com\/documentation\/AppKit\/NSMatrix\/mouseDown(with:)\ncrawled: 2025-12-03T08:33:19Z\n---\n\n# mouseDown(with:)\n\n**Instance Method**\n\nResponds to a mouse-down event.\n\n## Declaration\n\n```swift\n@MainActor func mouseDown(with event: NSEvent)\n```\n\n## Parameters\n\n- **event**: The mouse-down event.\n\n## Discussion\n\nA mouse-down event in a text cell initiates editing mode. A double click in any cell type except a text cell sends the double-click action of the receiver (if there is one) in addition to the single-click action.\n\nYour code should never invoke this method, but you may override it to implement different mouse tracking than [doc:\/\/com.apple.appkit\/documentation\/AppKit\/NSMatrix] does. The response of the receiver depends on its selection mode, as explained in the class description.\n\n## Related Documentation\n\n- **sendAction()**: If the selected cell has both an action and a target, sends its action to its target.\n- **sendDoubleAction()**: Sends the double-click action message to the target of the receiver.\n\n## Handling Event and Action Messages\n\n- **acceptsFirstMouse(for:)**: Returns a Boolean value indicating whether the receiver accepts the first mouse.\n- **mouseDownFlags**: The flags in effect at the mouse-down event that started the current tracking session.\n- **performKeyEquivalent(with:)**: Looks for a cell that has the given key equivalent and, if found, makes that cell respond as if clicked.\n\n",
  "sections" : [
    {
      "content" : "",
      "items" : [
        {
          "description" : "If the selected cell has both an action and a target, sends its action to its target.",
          "name" : "sendAction()",
          "url" : "https:\/\/developer.apple.com\/documentation\/AppKit\/NSMatrix\/sendAction()"
        },
        {
          "description" : "Sends the double-click action message to the target of the receiver.",
          "name" : "sendDoubleAction()",
          "url" : "https:\/\/developer.apple.com\/documentation\/AppKit\/NSMatrix\/sendDoubleAction()"
        }
      ],
      "title" : "Related Documentation"
    },
    {
      "content" : "",
      "items" : [
        {
          "description" : "Returns a Boolean value indicating whether the receiver accepts the first mouse.",
          "name" : "acceptsFirstMouse(for:)",
          "url" : "https:\/\/developer.apple.com\/documentation\/AppKit\/NSMatrix\/acceptsFirstMouse(for:)"
        },
        {
          "description" : "The flags in effect at the mouse-down event that started the current tracking session.",
          "name" : "mouseDownFlags",
          "url" : "https:\/\/developer.apple.com\/documentation\/AppKit\/NSMatrix\/mouseDownFlags"
        },
        {
          "description" : "Looks for a cell that has the given key equivalent and, if found, makes that cell respond as if clicked.",
          "name" : "performKeyEquivalent(with:)",
          "url" : "https:\/\/developer.apple.com\/documentation\/AppKit\/NSMatrix\/performKeyEquivalent(with:)"
        }
      ],
      "title" : "Handling Event and Action Messages"
    }
  ],
  "source" : "appleJSON",
  "title" : "mouseDown(with:)",
  "url" : "https:\/\/developer.apple.com\/documentation\/AppKit\/NSMatrix\/mouseDown(with:)"
}