{
  "abstract" : "Creates a newly allocated grid view object with the specified number of columns and rows.",
  "codeExamples" : [

  ],
  "contentHash" : "97f0d7515e960bb99a97de7d2cdb0c10cda285dcd12774618e50501c56252ab0",
  "crawledAt" : "2025-12-03T08:30:26Z",
  "declaration" : {
    "code" : "@MainActor convenience init(numberOfColumns columnCount: Int, rows rowCount: Int)",
    "language" : "swift"
  },
  "id" : "814641C5-1192-4669-989F-5716CF7B382D",
  "kind" : "unknown",
  "language" : "swift",
  "module" : "AppKit",
  "platforms" : [
    "macOS"
  ],
  "rawMarkdown" : "---\nsource: https:\/\/developer.apple.com\/documentation\/AppKit\/NSGridView\/init(numberOfColumns:rows:)\ncrawled: 2025-12-03T08:30:26Z\n---\n\n# init(numberOfColumns:rows:)\n\n**Initializer**\n\nCreates a newly allocated grid view object with the specified number of columns and rows.\n\n## Declaration\n\n```swift\n@MainActor convenience init(numberOfColumns columnCount: Int, rows rowCount: Int)\n```\n\n## Parameters\n\n- **columnCount**: The number of columns for this grid view.\n- **rowCount**: The number of rows for this grid view.\n\n## Creating a Grid View\n\n- **init(views:)**: Creates a newly allocated grid view object with the specified array of arrays of views.\n- **init(frame:)**: Creates a newly allocated grid view object with the specified frame rectangle.\n- **init(coder:)**: Creates a newly allocated grid view object from the coder.\n\n",
  "sections" : [
    {
      "content" : "",
      "items" : [
        {
          "description" : "Creates a newly allocated grid view object with the specified array of arrays of views.",
          "name" : "init(views:)",
          "url" : "https:\/\/developer.apple.com\/documentation\/AppKit\/NSGridView\/init(views:)"
        },
        {
          "description" : "Creates a newly allocated grid view object with the specified frame rectangle.",
          "name" : "init(frame:)",
          "url" : "https:\/\/developer.apple.com\/documentation\/AppKit\/NSGridView\/init(frame:)"
        },
        {
          "description" : "Creates a newly allocated grid view object from the coder.",
          "name" : "init(coder:)",
          "url" : "https:\/\/developer.apple.com\/documentation\/AppKit\/NSGridView\/init(coder:)"
        }
      ],
      "title" : "Creating a Grid View"
    }
  ],
  "source" : "appleJSON",
  "title" : "init(numberOfColumns:rows:)",
  "url" : "https:\/\/developer.apple.com\/documentation\/AppKit\/NSGridView\/init(numberOfColumns:rows:)"
}