{
  "abstract" : "A component of a path.",
  "codeExamples" : [

  ],
  "conformsTo" : [
    "CVarArg",
    "CustomDebugStringConvertible",
    "CustomStringConvertible",
    "Equatable",
    "Hashable",
    "NSAccessibilityElementProtocol",
    "NSAccessibilityProtocol",
    "NSCoding",
    "NSCopying",
    "NSObjectProtocol",
    "NSUserInterfaceItemIdentification",
    "Sendable",
    "SendableMetatype"
  ],
  "contentHash" : "fb4fe76e5d021bd84165e5ea414ea58a8e46363f6adf93c93c592767bcc53e31",
  "crawledAt" : "2025-12-01T08:42:12Z",
  "declaration" : {
    "code" : "@MainActor class NSPathComponentCell",
    "language" : "swift"
  },
  "id" : "6C50808A-53D1-4503-A2C3-528839BE637B",
  "kind" : "class",
  "module" : "AppKit",
  "overview" : "## Overview\n\nAn `NSPathCell` object manages a collection of `NSPathComponentCell` objects, in conjunction with an `NSPathControl` object, to represent a path.",
  "platforms" : [
    "macOS"
  ],
  "rawMarkdown" : "---\nsource: https:\/\/developer.apple.com\/documentation\/AppKit\/NSPathComponentCell\ncrawled: 2025-12-01T08:42:12Z\n---\n\n# NSPathComponentCell\n\n**Class**\n\nA component of a path.\n\n## Declaration\n\n```swift\n@MainActor class NSPathComponentCell\n```\n\n## Overview\n\nAn `NSPathCell` object manages a collection of `NSPathComponentCell` objects, in conjunction with an `NSPathControl` object, to represent a path.\n\n## Setting the Image\n\n- **image**: The image displayed for this component cell.\n\n## Setting the Path\n\n- **url**: The portion of the path from the root through the component represented by the receiver.\n\n## Cells\n\n- **NSPathCell**: The user interface of a path control object.\n- **NSPathCellDelegate**: A set of methods that enable the delegate of a path cell object to customize the Open panel or pop-up menu of a path whose style is set to [doc:\/\/com.apple.appkit\/documentation\/AppKit\/NSPathControl\/Style\/popUp].\n- **NSPathControlItem**\n\n## Inherits From\n\n- NSTextFieldCell\n\n## Conforms To\n\n- CVarArg\n- CustomDebugStringConvertible\n- CustomStringConvertible\n- Equatable\n- Hashable\n- NSAccessibilityElementProtocol\n- NSAccessibilityProtocol\n- NSCoding\n- NSCopying\n- NSObjectProtocol\n- NSUserInterfaceItemIdentification\n- Sendable\n- SendableMetatype\n\n",
  "sections" : [
    {
      "content" : "",
      "items" : [
        {
          "description" : "The image displayed for this component cell.",
          "name" : "image",
          "url" : "https:\/\/developer.apple.com\/documentation\/AppKit\/NSPathComponentCell\/image"
        }
      ],
      "title" : "Setting the Image"
    },
    {
      "content" : "",
      "items" : [
        {
          "description" : "The portion of the path from the root through the component represented by the receiver.",
          "name" : "url",
          "url" : "https:\/\/developer.apple.com\/documentation\/AppKit\/NSPathComponentCell\/url"
        }
      ],
      "title" : "Setting the Path"
    },
    {
      "content" : "",
      "items" : [
        {
          "description" : "The user interface of a path control object.",
          "name" : "NSPathCell",
          "url" : "https:\/\/developer.apple.com\/documentation\/AppKit\/NSPathCell"
        },
        {
          "description" : "A set of methods that enable the delegate of a path cell object to customize the Open panel or pop-up menu of a path whose style is set to [doc:\/\/com.apple.appkit\/documentation\/AppKit\/NSPathControl\/Style\/popUp].",
          "name" : "NSPathCellDelegate",
          "url" : "https:\/\/developer.apple.com\/documentation\/AppKit\/NSPathCellDelegate"
        },
        {
          "description" : "",
          "name" : "NSPathControlItem",
          "url" : "https:\/\/developer.apple.com\/documentation\/AppKit\/NSPathControlItem"
        }
      ],
      "title" : "Cells"
    },
    {
      "content" : "",
      "items" : [
        {
          "name" : "NSTextFieldCell"
        }
      ],
      "title" : "Inherits From"
    }
  ],
  "source" : "appleJSON",
  "title" : "NSPathComponentCell",
  "url" : "https:\/\/developer.apple.com\/documentation\/AppKit\/NSPathComponentCell"
}