{
  "abstract" : "The menu item to use when the toolbar item is in the overflow menu.",
  "codeExamples" : [

  ],
  "contentHash" : "4f1209c8afe7f3f8340f780793e25fd6c0bccb2018cefad8d2dafa795f182053",
  "crawledAt" : "2025-12-03T18:12:11Z",
  "declaration" : {
    "code" : "@MainActor var menuFormRepresentation: NSMenuItem? { get set }",
    "language" : "swift"
  },
  "id" : "5C94BE63-2C31-4B6D-8EF7-7E78B54BB8F9",
  "kind" : "property",
  "language" : "swift",
  "module" : "AppKit",
  "overview" : "## Discussion\n\nThe toolbar provides an initial default menu form representation that uses the toolbar item’s label as the menu item’s title. You can customize this menu item by changing the title or adding a submenu. When the toolbar is in text only mode, this menu item provides the text for the toolbar item. If the menu item in this property has a submenu and is visible, clicking the toolbar item displays that submenu. If the toolbar item isn’t visible because it’s in the overflow menu, the menu item and submenu appear there.\n\nFor a discussion on menu forms, see [https:\/\/developer.apple.com\/library\/archive\/documentation\/Cocoa\/Conceptual\/Toolbars\/Tasks\/SettingTBItemRep.html#\/\/apple_ref\/doc\/uid\/20000722].",
  "platforms" : [
    "macOS"
  ],
  "rawMarkdown" : "---\nsource: https:\/\/developer.apple.com\/documentation\/AppKit\/NSToolbarItem\/menuFormRepresentation\ncrawled: 2025-12-03T18:12:11Z\n---\n\n# menuFormRepresentation\n\n**Instance Property**\n\nThe menu item to use when the toolbar item is in the overflow menu.\n\n## Declaration\n\n```swift\n@MainActor var menuFormRepresentation: NSMenuItem? { get set }\n```\n\n## Discussion\n\nThe toolbar provides an initial default menu form representation that uses the toolbar item’s label as the menu item’s title. You can customize this menu item by changing the title or adding a submenu. When the toolbar is in text only mode, this menu item provides the text for the toolbar item. If the menu item in this property has a submenu and is visible, clicking the toolbar item displays that submenu. If the toolbar item isn’t visible because it’s in the overflow menu, the menu item and submenu appear there.\n\nFor a discussion on menu forms, see [https:\/\/developer.apple.com\/library\/archive\/documentation\/Cocoa\/Conceptual\/Toolbars\/Tasks\/SettingTBItemRep.html#\/\/apple_ref\/doc\/uid\/20000722].\n\n## Configuring the item’s menu\n\n- **itemMenuFormRepresentation**: The menu item to use for the toolbar item is in the overflow menu in a Mac app built with Mac Catalyst.\n\n",
  "sections" : [
    {
      "content" : "",
      "items" : [
        {
          "description" : "The menu item to use for the toolbar item is in the overflow menu in a Mac app built with Mac Catalyst.",
          "name" : "itemMenuFormRepresentation",
          "url" : "https:\/\/developer.apple.com\/documentation\/AppKit\/NSToolbarItem\/itemMenuFormRepresentation"
        }
      ],
      "title" : "Configuring the item’s menu"
    }
  ],
  "source" : "appleJSON",
  "title" : "menuFormRepresentation",
  "url" : "https:\/\/developer.apple.com\/documentation\/AppKit\/NSToolbarItem\/menuFormRepresentation"
}