{
  "abstract" : "Selects the file at the specified path.",
  "codeExamples" : [

  ],
  "contentHash" : "b4c22aa7cb19023341b20d8db9a0b6b9c2c8a3c9f6e6b9d4d6c66d8d652ba0d8",
  "crawledAt" : "2025-12-04T10:37:19Z",
  "declaration" : {
    "code" : "func selectFile(_ fullPath: String?, inFileViewerRootedAtPath rootFullPath: String) -> Bool",
    "language" : "swift"
  },
  "id" : "841D5CA6-571E-41A0-A6F8-6FA125B52337",
  "kind" : "method",
  "language" : "swift",
  "module" : "AppKit",
  "overview" : "## Return Value\n\n[doc:\/\/com.apple.documentation\/documentation\/Swift\/true] if the file was successfully selected; otherwise, [doc:\/\/com.apple.documentation\/documentation\/Swift\/false].\n\n## Discussion\n\nIn macOS 10.5 and later, this method does not follow symlinks when selecting the file. If the `fullPath` parameter contains any symlinks, this method selects the symlink instead of the file it targets. If you want to select the target file, use the [doc:\/\/com.apple.documentation\/documentation\/Foundation\/NSString\/resolvingSymlinksInPath] method to resolve any symlinks before calling this method.\n\nYou can safely call this method from any thread of your app.",
  "platforms" : [
    "macOS"
  ],
  "rawMarkdown" : "---\nsource: https:\/\/developer.apple.com\/documentation\/AppKit\/NSWorkspace\/selectFile(_:inFileViewerRootedAtPath:)\ncrawled: 2025-12-04T10:37:19Z\n---\n\n# selectFile(_:inFileViewerRootedAtPath:)\n\n**Instance Method**\n\nSelects the file at the specified path.\n\n## Declaration\n\n```swift\nfunc selectFile(_ fullPath: String?, inFileViewerRootedAtPath rootFullPath: String) -> Bool\n```\n\n## Parameters\n\n- **fullPath**: The full path of the file to select.\n- **rootFullPath**: The path to use for the file viewer. If you specify a nonempty path string, this method opens a new file viewer. If you specify an empty string (`@\"\"`), this method selects the file in the main viewer.\n\n## Return Value\n\n[doc:\/\/com.apple.documentation\/documentation\/Swift\/true] if the file was successfully selected; otherwise, [doc:\/\/com.apple.documentation\/documentation\/Swift\/false].\n\n## Discussion\n\nIn macOS 10.5 and later, this method does not follow symlinks when selecting the file. If the `fullPath` parameter contains any symlinks, this method selects the symlink instead of the file it targets. If you want to select the target file, use the [doc:\/\/com.apple.documentation\/documentation\/Foundation\/NSString\/resolvingSymlinksInPath] method to resolve any symlinks before calling this method.\n\nYou can safely call this method from any thread of your app.\n\n## Manipulating Files\n\n- **duplicate(_:completionHandler:)**: Duplicates the specified URLS asynchronously in the same manner as the Finder.\n- **recycle(_:completionHandler:)**: Moves the specified URLs to the trash in the same manner as the Finder.\n- **activateFileViewerSelecting(_:)**: Activates the Finder, and opens one or more windows selecting the specified files.\n\n",
  "sections" : [
    {
      "content" : "",
      "items" : [
        {
          "description" : "Duplicates the specified URLS asynchronously in the same manner as the Finder.",
          "name" : "duplicate(_:completionHandler:)",
          "url" : "https:\/\/developer.apple.com\/documentation\/AppKit\/NSWorkspace\/duplicate(_:completionHandler:)"
        },
        {
          "description" : "Moves the specified URLs to the trash in the same manner as the Finder.",
          "name" : "recycle(_:completionHandler:)",
          "url" : "https:\/\/developer.apple.com\/documentation\/AppKit\/NSWorkspace\/recycle(_:completionHandler:)"
        },
        {
          "description" : "Activates the Finder, and opens one or more windows selecting the specified files.",
          "name" : "activateFileViewerSelecting(_:)",
          "url" : "https:\/\/developer.apple.com\/documentation\/AppKit\/NSWorkspace\/activateFileViewerSelecting(_:)"
        }
      ],
      "title" : "Manipulating Files"
    }
  ],
  "source" : "appleJSON",
  "title" : "selectFile(_:inFileViewerRootedAtPath:)",
  "url" : "https:\/\/developer.apple.com\/documentation\/AppKit\/NSWorkspace\/selectFile(_:inFileViewerRootedAtPath:)"
}