{
  "abstract" : "Calculates the line fragment rectangle and the portion of the rectangle that contains marks.",
  "codeExamples" : [

  ],
  "contentHash" : "44ddf446462c74965612bae7d483f032227a6c22258063a73aab530f9f411847",
  "crawledAt" : "2025-12-02T07:32:59Z",
  "declaration" : {
    "code" : "func getLineFragmentRect(_ lineFragmentRect: UnsafeMutablePointer<NSRect>, usedRect lineFragmentUsedRect: UnsafeMutablePointer<NSRect>, forParagraphSeparatorGlyphRange paragraphSeparatorGlyphRange: NSRange, atProposedOrigin lineOrigin: NSPoint)",
    "language" : "swift"
  },
  "id" : "D83F3BED-374A-45AE-B78A-D117D26CEC56",
  "kind" : "method",
  "module" : "AppKit",
  "overview" : "## Discussion\n\nThe method returns the calculated line fragment rectangle in `lineFragmentRect`, and it returns the used rectangle (the portion of the line fragment rectangle that actually contains marks) in `lineFragmentUsedRect`. The `paragraphSeparatorGlyphRange` is the range of glyphs under consideration, and `lineOrigin` is the origin point of the line fragment rectangle. A `paragraphSeparatorGlyphRange` with length 0 indicates an extra line fragment (which occurs if the last character in the paragraph is a line separator.)",
  "platforms" : [
    "macOS"
  ],
  "rawMarkdown" : "---\nsource: https:\/\/developer.apple.com\/documentation\/AppKit\/NSATSTypesetter\/getLineFragmentRect(_:usedRect:forParagraphSeparatorGlyphRange:atProposedOrigin:)\ncrawled: 2025-12-02T07:32:59Z\n---\n\n# getLineFragmentRect(_:usedRect:forParagraphSeparatorGlyphRange:atProposedOrigin:)\n\n**Instance Method**\n\nCalculates the line fragment rectangle and the portion of the rectangle that contains marks.\n\n## Declaration\n\n```swift\nfunc getLineFragmentRect(_ lineFragmentRect: UnsafeMutablePointer<NSRect>, usedRect lineFragmentUsedRect: UnsafeMutablePointer<NSRect>, forParagraphSeparatorGlyphRange paragraphSeparatorGlyphRange: NSRange, atProposedOrigin lineOrigin: NSPoint)\n```\n\n## Discussion\n\nThe method returns the calculated line fragment rectangle in `lineFragmentRect`, and it returns the used rectangle (the portion of the line fragment rectangle that actually contains marks) in `lineFragmentUsedRect`. The `paragraphSeparatorGlyphRange` is the range of glyphs under consideration, and `lineOrigin` is the origin point of the line fragment rectangle. A `paragraphSeparatorGlyphRange` with length 0 indicates an extra line fragment (which occurs if the last character in the paragraph is a line separator.)\n\n## Laying Out Glyphs\n\n- **boundingBox(forControlGlyphAt:for:proposedLineFragment:glyphPosition:characterIndex:)**: Returns the bounding rectangle for a control glyph, at the specified glyph position and character index in the text container.\n- **hyphenCharacter(forGlyphAt:)**: Returns the hyphen character to be inserted after the specified glyph when hyphenation is enabled in the layout manager.\n- **hyphenationFactor(forGlyphAt:)**: Returns the hyphenation factor in effect at the specified glyph index.\n- **shouldBreakLine(byHyphenatingBeforeCharacterAt:)**: Breaks a line by hyphenating before the character at the specified index.\n- **shouldBreakLine(byWordBeforeCharacterAt:)**: Breaks a line by word-wrapping before the character at the specified index.\n- **willSetLineFragmentRect(_:forGlyphRange:usedRect:baselineOffset:)**: Notifies subclasses that the typesetter is about to set a new line fragment.\n- **setHardInvalidation(_:forGlyphRange:)**: Sets a Boolean value that determines whether the layout manager invalidates the specified portion of the glyph cache.\n\n",
  "sections" : [
    {
      "content" : "",
      "items" : [
        {
          "description" : "Returns the bounding rectangle for a control glyph, at the specified glyph position and character index in the text container.",
          "name" : "boundingBox(forControlGlyphAt:for:proposedLineFragment:glyphPosition:characterIndex:)",
          "url" : "https:\/\/developer.apple.com\/documentation\/AppKit\/NSATSTypesetter\/boundingBox(forControlGlyphAt:for:proposedLineFragment:glyphPosition:characterIndex:)"
        },
        {
          "description" : "Returns the hyphen character to be inserted after the specified glyph when hyphenation is enabled in the layout manager.",
          "name" : "hyphenCharacter(forGlyphAt:)",
          "url" : "https:\/\/developer.apple.com\/documentation\/AppKit\/NSATSTypesetter\/hyphenCharacter(forGlyphAt:)"
        },
        {
          "description" : "Returns the hyphenation factor in effect at the specified glyph index.",
          "name" : "hyphenationFactor(forGlyphAt:)",
          "url" : "https:\/\/developer.apple.com\/documentation\/AppKit\/NSATSTypesetter\/hyphenationFactor(forGlyphAt:)"
        },
        {
          "description" : "Breaks a line by hyphenating before the character at the specified index.",
          "name" : "shouldBreakLine(byHyphenatingBeforeCharacterAt:)",
          "url" : "https:\/\/developer.apple.com\/documentation\/AppKit\/NSATSTypesetter\/shouldBreakLine(byHyphenatingBeforeCharacterAt:)"
        },
        {
          "description" : "Breaks a line by word-wrapping before the character at the specified index.",
          "name" : "shouldBreakLine(byWordBeforeCharacterAt:)",
          "url" : "https:\/\/developer.apple.com\/documentation\/AppKit\/NSATSTypesetter\/shouldBreakLine(byWordBeforeCharacterAt:)"
        },
        {
          "description" : "Notifies subclasses that the typesetter is about to set a new line fragment.",
          "name" : "willSetLineFragmentRect(_:forGlyphRange:usedRect:baselineOffset:)",
          "url" : "https:\/\/developer.apple.com\/documentation\/AppKit\/NSATSTypesetter\/willSetLineFragmentRect(_:forGlyphRange:usedRect:baselineOffset:)"
        },
        {
          "description" : "Sets a Boolean value that determines whether the layout manager invalidates the specified portion of the glyph cache.",
          "name" : "setHardInvalidation(_:forGlyphRange:)",
          "url" : "https:\/\/developer.apple.com\/documentation\/AppKit\/NSATSTypesetter\/setHardInvalidation(_:forGlyphRange:)"
        }
      ],
      "title" : "Laying Out Glyphs"
    }
  ],
  "source" : "appleJSON",
  "title" : "getLineFragmentRect(_:usedRect:forParagraphSeparatorGlyphRange:atProposedOrigin:)",
  "url" : "https:\/\/developer.apple.com\/documentation\/AppKit\/NSATSTypesetter\/getLineFragmentRect(_:usedRect:forParagraphSeparatorGlyphRange:atProposedOrigin:)"
}