{
  "abstract" : "Sets this font as the font for the specified graphics context.",
  "codeExamples" : [

  ],
  "contentHash" : "5c1cce4ccd42f1be4e9f38bc14a0823e1ff3b5f6ac4f26d383cdb68cdb346966",
  "crawledAt" : "2025-12-04T12:51:31Z",
  "declaration" : {
    "code" : "func set(in graphicsContext: NSGraphicsContext)",
    "language" : "swift"
  },
  "id" : "F730A749-5E3C-4D1E-A8D8-B3F4A8DB2BFC",
  "kind" : "method",
  "language" : "swift",
  "module" : "AppKit",
  "overview" : "## Discussion\n\nThis method sets the font for the graphics system but does not affect the higher-level settings of the Cocoa text system, which are controlled by text attributes.",
  "platforms" : [
    "macOS"
  ],
  "rawMarkdown" : "---\nsource: https:\/\/developer.apple.com\/documentation\/AppKit\/NSFont\/set(in:)\ncrawled: 2025-12-04T12:51:31Z\n---\n\n# set(in:)\n\n**Instance Method**\n\nSets this font as the font for the specified graphics context.\n\n## Declaration\n\n```swift\nfunc set(in graphicsContext: NSGraphicsContext)\n```\n\n## Parameters\n\n- **graphicsContext**: The graphics context for which the font is set.\n\n## Discussion\n\nThis method sets the font for the graphics system but does not affect the higher-level settings of the Cocoa text system, which are controlled by text attributes.\n\n## Using a Font to Draw\n\n- **set()**: Sets this font as the font for the current graphics context.\n\n",
  "sections" : [
    {
      "content" : "",
      "items" : [
        {
          "description" : "Sets this font as the font for the current graphics context.",
          "name" : "set()",
          "url" : "https:\/\/developer.apple.com\/documentation\/AppKit\/NSFont\/set()"
        }
      ],
      "title" : "Using a Font to Draw"
    }
  ],
  "source" : "appleJSON",
  "title" : "set(in:)",
  "url" : "https:\/\/developer.apple.com\/documentation\/AppKit\/NSFont\/set(in:)"
}