{
  "abstract" : "Replaces the layout manager for the group of text system objects that contains the text container.",
  "codeExamples" : [

  ],
  "contentHash" : "0ed59df5a34535602c78bcc1516e554739087c4f991f64ef37b302b1c3a9ab3d",
  "crawledAt" : "2025-12-05T06:08:30Z",
  "declaration" : {
    "code" : "func replaceLayoutManager(_ newLayoutManager: NSLayoutManager)",
    "language" : "swift"
  },
  "id" : "831D0FA4-F4C5-4C9C-B97F-26977D2AA902",
  "kind" : "method",
  "language" : "swift",
  "module" : "AppKit",
  "overview" : "## Discussion\n\nThe framework reassigns all text containers and text views attached to the old layout manager to the new layout manager. Unlike setting the [doc:\/\/com.apple.appkit\/documentation\/AppKit\/NSTextContainer\/layoutManager] property directly, this method makes all the adjustments necessary to keep the text object relationships intact.",
  "platforms" : [
    "macOS"
  ],
  "rawMarkdown" : "---\nsource: https:\/\/developer.apple.com\/documentation\/appkit\/nstextcontainer\/replacelayoutmanager(_:)\ncrawled: 2025-12-05T06:08:30Z\n---\n\n# replaceLayoutManager(_:)\n\n**Instance Method**\n\nReplaces the layout manager for the group of text system objects that contains the text container.\n\n## Declaration\n\n```swift\nfunc replaceLayoutManager(_ newLayoutManager: NSLayoutManager)\n```\n\n## Parameters\n\n- **newLayoutManager**: The new layout manager.\n\n## Discussion\n\nThe framework reassigns all text containers and text views attached to the old layout manager to the new layout manager. Unlike setting the [doc:\/\/com.apple.appkit\/documentation\/AppKit\/NSTextContainer\/layoutManager] property directly, this method makes all the adjustments necessary to keep the text object relationships intact.\n\n## Managing text components\n\n- **layoutManager**: The text container’s layout manager.\n- **textLayoutManager**\n- **textView**: The text container’s text view.\n\n",
  "sections" : [
    {
      "content" : "",
      "items" : [
        {
          "description" : "The text container’s layout manager.",
          "name" : "layoutManager",
          "url" : "https:\/\/developer.apple.com\/documentation\/AppKit\/NSTextContainer\/layoutManager"
        },
        {
          "description" : "",
          "name" : "textLayoutManager",
          "url" : "https:\/\/developer.apple.com\/documentation\/AppKit\/NSTextContainer\/textLayoutManager"
        },
        {
          "description" : "The text container’s text view.",
          "name" : "textView",
          "url" : "https:\/\/developer.apple.com\/documentation\/AppKit\/NSTextContainer\/textView"
        }
      ],
      "title" : "Managing text components"
    }
  ],
  "source" : "appleJSON",
  "title" : "replaceLayoutManager(_:)",
  "url" : "https:\/\/developer.apple.com\/documentation\/appkit\/nstextcontainer\/replacelayoutmanager(_:)"
}