{
  "abstract" : "Indicates there’s an active editing transaction from the primary text layout manager.",
  "codeExamples" : [

  ],
  "contentHash" : "05fa6e9b15e551566eecdb9946f82822a376fea16e22b7e9d80dda0ba5b438fe",
  "crawledAt" : "2025-12-02T07:26:26Z",
  "declaration" : {
    "code" : "var hasEditingTransaction: Bool { get }",
    "language" : "swift"
  },
  "id" : "1D53EDFB-00D7-49C0-821A-1A43B508C946",
  "kind" : "property",
  "module" : "AppKit",
  "overview" : "## Discussion\n\nWhen this property is `true`, there’s an active editing transaction from the `primaryTextLayoutManager`. The synchronization operations to nonprimary text layout managers and the backing store block (or fail when synchronous) while this property is `true`. Avoid accessing the elements from a nonprimary text layout manager while this values is `true`.\n\nThis property is KVO-compliant.",
  "platforms" : [
    "macOS"
  ],
  "rawMarkdown" : "---\nsource: https:\/\/developer.apple.com\/documentation\/AppKit\/NSTextContentManager\/hasEditingTransaction\ncrawled: 2025-12-02T07:26:26Z\n---\n\n# hasEditingTransaction\n\n**Instance Property**\n\nIndicates there’s an active editing transaction from the primary text layout manager.\n\n## Declaration\n\n```swift\nvar hasEditingTransaction: Bool { get }\n```\n\n## Discussion\n\nWhen this property is `true`, there’s an active editing transaction from the `primaryTextLayoutManager`. The synchronization operations to nonprimary text layout managers and the backing store block (or fail when synchronous) while this property is `true`. Avoid accessing the elements from a nonprimary text layout manager while this values is `true`.\n\nThis property is KVO-compliant.\n\n## Performing transactions\n\n- **performEditingTransaction(_:)**: Performs an editing transaction and invokes a block upon completion.\n- **recordEditAction(in:newTextRange:)**: Records information about an edit action to the transaction.\n\n",
  "sections" : [
    {
      "content" : "",
      "items" : [
        {
          "description" : "Performs an editing transaction and invokes a block upon completion.",
          "name" : "performEditingTransaction(_:)",
          "url" : "https:\/\/developer.apple.com\/documentation\/AppKit\/NSTextContentManager\/performEditingTransaction(_:)"
        },
        {
          "description" : "Records information about an edit action to the transaction.",
          "name" : "recordEditAction(in:newTextRange:)",
          "url" : "https:\/\/developer.apple.com\/documentation\/AppKit\/NSTextContentManager\/recordEditAction(in:newTextRange:)"
        }
      ],
      "title" : "Performing transactions"
    }
  ],
  "source" : "appleJSON",
  "title" : "hasEditingTransaction",
  "url" : "https:\/\/developer.apple.com\/documentation\/AppKit\/NSTextContentManager\/hasEditingTransaction"
}