{
  "abstract" : "The placement of tick marks on the level indicator control.",
  "codeExamples" : [

  ],
  "contentHash" : "538b4af39b7dbf66a1716114fcee2348ddf6ae3b14d64345c62d86bc50d9c14e",
  "crawledAt" : "2025-12-02T05:01:08Z",
  "declaration" : {
    "code" : "@MainActor var tickMarkPosition: NSSlider.TickMarkPosition { get set }",
    "language" : "swift"
  },
  "id" : "AFE3972A-0001-4D1D-AB50-A963F726E319",
  "kind" : "property",
  "module" : "AppKit",
  "overview" : "## Discussion\n\nUse this property to set the position where the control draws tick marks. Regardless of the value in this property, tick marks are not drawn if the value in the [doc:\/\/com.apple.appkit\/documentation\/AppKit\/NSLevelIndicatorCell\/numberOfTickMarks] property is `0`.\n\nThe default value of this property is [doc:\/\/com.apple.appkit\/documentation\/AppKit\/NSTickMarkBelow], which also corresponds to the value [doc:\/\/com.apple.appkit\/documentation\/AppKit\/NSTickMarkLeft] for vertically oriented level indicators.",
  "platforms" : [
    "macOS"
  ],
  "rawMarkdown" : "---\nsource: https:\/\/developer.apple.com\/documentation\/AppKit\/NSLevelIndicatorCell\/tickMarkPosition\ncrawled: 2025-12-02T05:01:08Z\n---\n\n# tickMarkPosition\n\n**Instance Property**\n\nThe placement of tick marks on the level indicator control.\n\n## Declaration\n\n```swift\n@MainActor var tickMarkPosition: NSSlider.TickMarkPosition { get set }\n```\n\n## Discussion\n\nUse this property to set the position where the control draws tick marks. Regardless of the value in this property, tick marks are not drawn if the value in the [doc:\/\/com.apple.appkit\/documentation\/AppKit\/NSLevelIndicatorCell\/numberOfTickMarks] property is `0`.\n\nThe default value of this property is [doc:\/\/com.apple.appkit\/documentation\/AppKit\/NSTickMarkBelow], which also corresponds to the value [doc:\/\/com.apple.appkit\/documentation\/AppKit\/NSTickMarkLeft] for vertically oriented level indicators.\n\n## Managing Tick Marks\n\n- **numberOfTickMarks**: The number of tick marks displayed by the control.\n- **numberOfMajorTickMarks**: The number of major tick marks displayed by the control.\n- **tickMarkValue(at:)**: Returns the receiver’s value represented by the tick mark at index (the minimum-value tick mark has an index of 0).\n- **rectOfTickMark(at:)**: Returns the bounding rectangle of the tick mark identified by `index` (the minimum-value tick mark is at index 0).\n\n",
  "sections" : [
    {
      "content" : "",
      "items" : [
        {
          "description" : "The number of tick marks displayed by the control.",
          "name" : "numberOfTickMarks",
          "url" : "https:\/\/developer.apple.com\/documentation\/AppKit\/NSLevelIndicatorCell\/numberOfTickMarks"
        },
        {
          "description" : "The number of major tick marks displayed by the control.",
          "name" : "numberOfMajorTickMarks",
          "url" : "https:\/\/developer.apple.com\/documentation\/AppKit\/NSLevelIndicatorCell\/numberOfMajorTickMarks"
        },
        {
          "description" : "Returns the receiver’s value represented by the tick mark at index (the minimum-value tick mark has an index of 0).",
          "name" : "tickMarkValue(at:)",
          "url" : "https:\/\/developer.apple.com\/documentation\/AppKit\/NSLevelIndicatorCell\/tickMarkValue(at:)"
        },
        {
          "description" : "Returns the bounding rectangle of the tick mark identified by `index` (the minimum-value tick mark is at index 0).",
          "name" : "rectOfTickMark(at:)",
          "url" : "https:\/\/developer.apple.com\/documentation\/AppKit\/NSLevelIndicatorCell\/rectOfTickMark(at:)"
        }
      ],
      "title" : "Managing Tick Marks"
    }
  ],
  "source" : "appleJSON",
  "title" : "tickMarkPosition",
  "url" : "https:\/\/developer.apple.com\/documentation\/AppKit\/NSLevelIndicatorCell\/tickMarkPosition"
}