{
  "abstract" : "The unique identifier of the pointing device that generated this event.",
  "codeExamples" : [

  ],
  "contentHash" : "cec88bf1c4497e0aa1a7304b2c76bea31ce162019ddfa6cab27f2a94d23a6570",
  "crawledAt" : "2025-12-02T05:11:27Z",
  "declaration" : {
    "code" : "var uniqueID: UInt64 { get }",
    "language" : "swift"
  },
  "id" : "655937A9-0F27-45C6-9699-791BB8349E89",
  "kind" : "property",
  "module" : "AppKit",
  "overview" : "## Discussion\n\nAlso known as tool ID, this is a unique number recorded in the chip inside every pointing device. The unique ID makes it possible to assign a specific pointing device to a specific tablet. You can also use it to “sign” documents or to restrict access to document layers to a specific pointing device. This method is valid for mouse events with subtype `NSTabletProximityEventSubtype` and for `NSTabletProximity` events.",
  "platforms" : [
    "macOS"
  ],
  "rawMarkdown" : "---\nsource: https:\/\/developer.apple.com\/documentation\/AppKit\/NSEvent\/uniqueID\ncrawled: 2025-12-02T05:11:27Z\n---\n\n# uniqueID\n\n**Instance Property**\n\nThe unique identifier of the pointing device that generated this event.\n\n## Declaration\n\n```swift\nvar uniqueID: UInt64 { get }\n```\n\n## Discussion\n\nAlso known as tool ID, this is a unique number recorded in the chip inside every pointing device. The unique ID makes it possible to assign a specific pointing device to a specific tablet. You can also use it to “sign” documents or to restrict access to document layers to a specific pointing device. This method is valid for mouse events with subtype `NSTabletProximityEventSubtype` and for `NSTabletProximity` events.\n\n## Related Documentation\n\n- **vendorDefined**: An array of three vendor-defined number objects associated with a pointing-type event.\n\n## Getting tablet proximity information\n\n- **capabilityMask**: A mask that indicates the capabilities of the tablet device that generated this event.\n- **deviceID**: A special identifier the system matches against tablet-pointer and tablet-proximity events.\n- **isEnteringProximity**: A Boolean value that indicates whether a pointing device is entering or leaving the proximity of its tablet.\n- **pointingDeviceID**: The index of the pointing device currently in proximity with the tablet.\n- **pointingDeviceSerialNumber**: The vendor-assigned serial number of a pointing device.\n- **pointingDeviceType**: The kind of pointing device associated with this event.\n- **NSEvent.PointingDeviceType**: The pointing-device types for tablet-proximity events or mouse events with a proximity event subtype.\n- **systemTabletID**: The index of the tablet device connected to the system.\n- **tabletID**: The USB model identifier of the tablet device associated with this event.\n- **vendorID**: The vendor identifier of the tablet associated with the event.\n- **vendorPointingDeviceType**: A coded bit field whose set bits indicate the type of pointing device (within a vendor selection) associated with the event.\n\n",
  "sections" : [
    {
      "content" : "",
      "items" : [
        {
          "description" : "An array of three vendor-defined number objects associated with a pointing-type event.",
          "name" : "vendorDefined",
          "url" : "https:\/\/developer.apple.com\/documentation\/AppKit\/NSEvent\/vendorDefined"
        }
      ],
      "title" : "Related Documentation"
    },
    {
      "content" : "",
      "items" : [
        {
          "description" : "A mask that indicates the capabilities of the tablet device that generated this event.",
          "name" : "capabilityMask",
          "url" : "https:\/\/developer.apple.com\/documentation\/AppKit\/NSEvent\/capabilityMask"
        },
        {
          "description" : "A special identifier the system matches against tablet-pointer and tablet-proximity events.",
          "name" : "deviceID",
          "url" : "https:\/\/developer.apple.com\/documentation\/AppKit\/NSEvent\/deviceID"
        },
        {
          "description" : "A Boolean value that indicates whether a pointing device is entering or leaving the proximity of its tablet.",
          "name" : "isEnteringProximity",
          "url" : "https:\/\/developer.apple.com\/documentation\/AppKit\/NSEvent\/isEnteringProximity"
        },
        {
          "description" : "The index of the pointing device currently in proximity with the tablet.",
          "name" : "pointingDeviceID",
          "url" : "https:\/\/developer.apple.com\/documentation\/AppKit\/NSEvent\/pointingDeviceID"
        },
        {
          "description" : "The vendor-assigned serial number of a pointing device.",
          "name" : "pointingDeviceSerialNumber",
          "url" : "https:\/\/developer.apple.com\/documentation\/AppKit\/NSEvent\/pointingDeviceSerialNumber"
        },
        {
          "description" : "The kind of pointing device associated with this event.",
          "name" : "pointingDeviceType",
          "url" : "https:\/\/developer.apple.com\/documentation\/AppKit\/NSEvent\/pointingDeviceType-swift.property"
        },
        {
          "description" : "The pointing-device types for tablet-proximity events or mouse events with a proximity event subtype.",
          "name" : "NSEvent.PointingDeviceType",
          "url" : "https:\/\/developer.apple.com\/documentation\/AppKit\/NSEvent\/PointingDeviceType-swift.enum"
        },
        {
          "description" : "The index of the tablet device connected to the system.",
          "name" : "systemTabletID",
          "url" : "https:\/\/developer.apple.com\/documentation\/AppKit\/NSEvent\/systemTabletID"
        },
        {
          "description" : "The USB model identifier of the tablet device associated with this event.",
          "name" : "tabletID",
          "url" : "https:\/\/developer.apple.com\/documentation\/AppKit\/NSEvent\/tabletID"
        },
        {
          "description" : "The vendor identifier of the tablet associated with the event.",
          "name" : "vendorID",
          "url" : "https:\/\/developer.apple.com\/documentation\/AppKit\/NSEvent\/vendorID"
        },
        {
          "description" : "A coded bit field whose set bits indicate the type of pointing device (within a vendor selection) associated with the event.",
          "name" : "vendorPointingDeviceType",
          "url" : "https:\/\/developer.apple.com\/documentation\/AppKit\/NSEvent\/vendorPointingDeviceType"
        }
      ],
      "title" : "Getting tablet proximity information"
    }
  ],
  "source" : "appleJSON",
  "title" : "uniqueID",
  "url" : "https:\/\/developer.apple.com\/documentation\/AppKit\/NSEvent\/uniqueID"
}