{
  "abstract" : "Displays a Print panel sheet and runs it modally for the specified window.",
  "codeExamples" : [
    {
      "code" : "- (void)printPanelDidEnd:(NSPrintPanel *)printPanel returnCode:(NSInteger)returnCode  contextInfo: (void *)contextInfo;",
      "language" : "objc"
    }
  ],
  "contentHash" : "72bb5b895f6a94409a195fb1eb928b8057f9fb6c66d8e242917b5b62c290a7d9",
  "crawledAt" : "2025-12-04T11:08:15Z",
  "declaration" : {
    "code" : "@MainActor func beginSheet(with printInfo: NSPrintInfo, modalFor docWindow: NSWindow, delegate: Any?, didEnd didEndSelector: Selector?, contextInfo: UnsafeMutableRawPointer?)",
    "language" : "swift"
  },
  "id" : "D9EE4D8E-2581-42C5-96E1-5F7208311AC8",
  "kind" : "method",
  "language" : "swift",
  "module" : "AppKit",
  "overview" : "## Discussion\n\nWhen the modal session ends, if `modalDelegate` and `didEndSelector` contain non-`nil` values, the method specified by `didEndSelector` is invoked on the object in `modalDelegate`. The data you specify in `contextInfo` is passed as a parameter to the `didEndSelector` method. The object in `modalDelegate` is not the same as a delegate assigned to the panel. Modal delegates for sheets are temporary and the relationship lasts only until the sheet is dismissed.\n\nThe `didEndSelector` argument must have the following signature:\n\nThe value passed as `returnCode` is either `NSCancelButton` or `NSOKButton`. The value `NSOKButton` is returned even if the user clicked the Preview button.",
  "platforms" : [
    "macOS"
  ],
  "rawMarkdown" : "---\nsource: https:\/\/developer.apple.com\/documentation\/AppKit\/NSPrintPanel\/beginSheet(with:modalFor:delegate:didEnd:contextInfo:)\ncrawled: 2025-12-04T11:08:15Z\n---\n\n# beginSheet(with:modalFor:delegate:didEnd:contextInfo:)\n\n**Instance Method**\n\nDisplays a Print panel sheet and runs it modally for the specified window.\n\n## Declaration\n\n```swift\n@MainActor func beginSheet(with printInfo: NSPrintInfo, modalFor docWindow: NSWindow, delegate: Any?, didEnd didEndSelector: Selector?, contextInfo: UnsafeMutableRawPointer?)\n```\n\n## Parameters\n\n- **printInfo**: The printing information for the current job.\n- **docWindow**: The window on which to display the sheet.\n- **delegate**: A modal delegate object assigned to handle the closing of the Print panel sheet.\n- **didEndSelector**: The selector to call on the modal delegate object when the sheet is dismissed. The signature of this method is listed in the Discussion section.\n- **contextInfo**: A pointer to context data the `didEndSelector` method needs to process the sheet. This data is user-defined and may be `NULL`.\n\n## Discussion\n\nWhen the modal session ends, if `modalDelegate` and `didEndSelector` contain non-`nil` values, the method specified by `didEndSelector` is invoked on the object in `modalDelegate`. The data you specify in `contextInfo` is passed as a parameter to the `didEndSelector` method. The object in `modalDelegate` is not the same as a delegate assigned to the panel. Modal delegates for sheets are temporary and the relationship lasts only until the sheet is dismissed.\n\nThe `didEndSelector` argument must have the following signature:\n\n```objc\n- (void)printPanelDidEnd:(NSPrintPanel *)printPanel returnCode:(NSInteger)returnCode  contextInfo: (void *)contextInfo;\n```\n\nThe value passed as `returnCode` is either `NSCancelButton` or `NSOKButton`. The value `NSOKButton` is returned even if the user clicked the Preview button.\n\n## Running the Panel\n\n- **beginSheet(using:on:completionHandler:)**\n- **runModal()**: Displays the Print panel and begins the modal loop.\n- **runModal(with:)**: Displays the Print panel and runs the modal loop using the specified printing information.\n\n",
  "sections" : [
    {
      "content" : "",
      "items" : [
        {
          "description" : "",
          "name" : "beginSheet(using:on:completionHandler:)",
          "url" : "https:\/\/developer.apple.com\/documentation\/AppKit\/NSPrintPanel\/beginSheet(using:on:completionHandler:)"
        },
        {
          "description" : "Displays the Print panel and begins the modal loop.",
          "name" : "runModal()",
          "url" : "https:\/\/developer.apple.com\/documentation\/AppKit\/NSPrintPanel\/runModal()"
        },
        {
          "description" : "Displays the Print panel and runs the modal loop using the specified printing information.",
          "name" : "runModal(with:)",
          "url" : "https:\/\/developer.apple.com\/documentation\/AppKit\/NSPrintPanel\/runModal(with:)"
        }
      ],
      "title" : "Running the Panel"
    }
  ],
  "source" : "appleJSON",
  "title" : "beginSheet(with:modalFor:delegate:didEnd:contextInfo:)",
  "url" : "https:\/\/developer.apple.com\/documentation\/AppKit\/NSPrintPanel\/beginSheet(with:modalFor:delegate:didEnd:contextInfo:)"
}