{
  "abstract" : "The view controller that manages the content of the popover.",
  "codeExamples" : [

  ],
  "contentHash" : "55ee2f9c242e59da6872b98919294d77eecc6bf7bc9cb3ac9fa6451bd4f3bdcb",
  "crawledAt" : "2025-12-01T13:42:52Z",
  "declaration" : {
    "code" : "@IBOutlet @MainActor var contentViewController: NSViewController? { get set }",
    "language" : "swift"
  },
  "id" : "5DF6D11C-DC30-4134-9F61-B920A523DA92",
  "kind" : "property",
  "module" : "AppKit",
  "overview" : "## Discussion\n\nYou must set the content view controller of the popover before the popover is shown. Changes to the popover’s content view controller while the popover is shown will cause the popover to animate if the [doc:\/\/com.apple.appkit\/documentation\/AppKit\/NSPopover\/animates] property is [doc:\/\/com.apple.documentation\/documentation\/Swift\/true].\n\nThe default value is `nil`.",
  "platforms" : [
    "macOS"
  ],
  "rawMarkdown" : "---\nsource: https:\/\/developer.apple.com\/documentation\/AppKit\/NSPopover\/contentViewController\ncrawled: 2025-12-01T13:42:52Z\n---\n\n# contentViewController\n\n**Instance Property**\n\nThe view controller that manages the content of the popover.\n\n## Declaration\n\n```swift\n@IBOutlet @MainActor var contentViewController: NSViewController? { get set }\n```\n\n## Discussion\n\nYou must set the content view controller of the popover before the popover is shown. Changes to the popover’s content view controller while the popover is shown will cause the popover to animate if the [doc:\/\/com.apple.appkit\/documentation\/AppKit\/NSPopover\/animates] property is [doc:\/\/com.apple.documentation\/documentation\/Swift\/true].\n\nThe default value is `nil`.\n\n",
  "sections" : [

  ],
  "source" : "appleJSON",
  "title" : "contentViewController",
  "url" : "https:\/\/developer.apple.com\/documentation\/AppKit\/NSPopover\/contentViewController"
}