{
  "abstract" : "Attempts to load a font with the specified characteristics.",
  "codeExamples" : [

  ],
  "contentHash" : "ed1ddef757851d80637c942f9c61bc0e0e698cf775125a660a23ee2cee3ce582",
  "crawledAt" : "2025-12-04T12:54:12Z",
  "declaration" : {
    "code" : "func font(withFamily family: String, traits: NSFontTraitMask, weight: Int, size: CGFloat) -> NSFont?",
    "language" : "swift"
  },
  "id" : "EACF2657-EC3C-469D-AD72-95694CF7AF38",
  "kind" : "method",
  "language" : "swift",
  "module" : "AppKit",
  "overview" : "## Return Value\n\nA font with the specified characteristics if successful, or `nil` if not.",
  "platforms" : [
    "macOS"
  ],
  "rawMarkdown" : "---\nsource: https:\/\/developer.apple.com\/documentation\/AppKit\/NSFontManager\/font(withFamily:traits:weight:size:)\ncrawled: 2025-12-04T12:54:12Z\n---\n\n# font(withFamily:traits:weight:size:)\n\n**Instance Method**\n\nAttempts to load a font with the specified characteristics.\n\n## Declaration\n\n```swift\nfunc font(withFamily family: String, traits: NSFontTraitMask, weight: Int, size: CGFloat) -> NSFont?\n```\n\n## Parameters\n\n- **family**: The generic name of the desired font, such as Times or Helvetica.\n- **traits**: The font traits, specified by combining the font trait mask values described in `Constants` using the C bitwise OR operator. Using `NSUnboldFontMask` or `NSUnitalicFontMask` loads a font that doesnâ€™t have either the bold or italic trait, respectively.\n- **weight**: A hint for the weight desired, on a scale of 0 to 15: a value of 5 indicates a normal or book weight, and 9 or more a bold or heavier weight. The weight is ignored if `fontTraitMask` includes `NSBoldFontMask`.\n- **size**: The point size of the desired font.\n\n## Return Value\n\nA font with the specified characteristics if successful, or `nil` if not.\n\n",
  "sections" : [

  ],
  "source" : "appleJSON",
  "title" : "font(withFamily:traits:weight:size:)",
  "url" : "https:\/\/developer.apple.com\/documentation\/AppKit\/NSFontManager\/font(withFamily:traits:weight:size:)"
}