{
  "abstract" : "Informs the window that it has become the key window.",
  "codeExamples" : [

  ],
  "contentHash" : "e0ab2181406a03acec0de472ca807b7009b99200247927e383bda4cfcf16e4fc",
  "crawledAt" : "2025-12-01T14:01:16Z",
  "declaration" : {
    "code" : "@MainActor func becomeKey()",
    "language" : "swift"
  },
  "id" : "FE151240-D39F-4C84-B522-947E61190F24",
  "kind" : "method",
  "module" : "AppKit",
  "overview" : "## Discussion\n\nThis method reestablishes the window’s first responder, sends the `becomeKeyWindow` message to that object if it responds, and posts [doc:\/\/com.apple.appkit\/documentation\/AppKit\/NSWindow\/didBecomeKeyNotification] to the default notification center.\n\nNever invoke this method directly.",
  "platforms" : [
    "macOS"
  ],
  "rawMarkdown" : "---\nsource: https:\/\/developer.apple.com\/documentation\/AppKit\/NSWindow\/becomeKey()\ncrawled: 2025-12-01T14:01:16Z\n---\n\n# becomeKey()\n\n**Instance Method**\n\nInforms the window that it has become the key window.\n\n## Declaration\n\n```swift\n@MainActor func becomeKey()\n```\n\n## Discussion\n\nThis method reestablishes the window’s first responder, sends the `becomeKeyWindow` message to that object if it responds, and posts [doc:\/\/com.apple.appkit\/documentation\/AppKit\/NSWindow\/didBecomeKeyNotification] to the default notification center.\n\nNever invoke this method directly.\n\n## Managing Key Status\n\n- **isKeyWindow**: A Boolean value that indicates whether the window is the key window for the application.\n- **canBecomeKey**: A Boolean value that indicates whether the window can become the key window.\n- **makeKey()**: Makes the window the key window.\n- **makeKeyAndOrderFront(_:)**: Moves the window to the front of the screen list, within its level, and makes it the key window; that is, it shows the window.\n- **resignKey()**: Resigns the window’s key window status.\n\n",
  "sections" : [
    {
      "content" : "",
      "items" : [
        {
          "description" : "A Boolean value that indicates whether the window is the key window for the application.",
          "name" : "isKeyWindow",
          "url" : "https:\/\/developer.apple.com\/documentation\/AppKit\/NSWindow\/isKeyWindow"
        },
        {
          "description" : "A Boolean value that indicates whether the window can become the key window.",
          "name" : "canBecomeKey",
          "url" : "https:\/\/developer.apple.com\/documentation\/AppKit\/NSWindow\/canBecomeKey"
        },
        {
          "description" : "Makes the window the key window.",
          "name" : "makeKey()",
          "url" : "https:\/\/developer.apple.com\/documentation\/AppKit\/NSWindow\/makeKey()"
        },
        {
          "description" : "Moves the window to the front of the screen list, within its level, and makes it the key window; that is, it shows the window.",
          "name" : "makeKeyAndOrderFront(_:)",
          "url" : "https:\/\/developer.apple.com\/documentation\/AppKit\/NSWindow\/makeKeyAndOrderFront(_:)"
        },
        {
          "description" : "Resigns the window’s key window status.",
          "name" : "resignKey()",
          "url" : "https:\/\/developer.apple.com\/documentation\/AppKit\/NSWindow\/resignKey()"
        }
      ],
      "title" : "Managing Key Status"
    }
  ],
  "source" : "appleJSON",
  "title" : "becomeKey()",
  "url" : "https:\/\/developer.apple.com\/documentation\/AppKit\/NSWindow\/becomeKey()"
}