{
  "abstract" : "The paragraph’s threshold for hyphenation.",
  "codeExamples" : [

  ],
  "contentHash" : "7fc5850fb7fb4b3f97db071ef5bef32d8a9fdb3637c4eb59f9670087f2ca38d0",
  "crawledAt" : "2025-12-02T07:26:48Z",
  "declaration" : {
    "code" : "var hyphenationFactor: Float { get }",
    "language" : "swift"
  },
  "id" : "088E0303-B50C-4645-AF55-AE10AC2B1E0E",
  "kind" : "property",
  "module" : "AppKit",
  "overview" : "## Discussion\n\nThe system attempts hyphenation when the ratio of the text width (as broken without hyphenation) to the width of the line fragment is less than the hyphenation factor. When the paragraph’s hyphenation factor is `0.0`, the system uses the layout manager’s hyphenation factor instead. The system disables hyphenation when both are `0.0`. This property detects the user-selected language by examining the first item in [doc:\/\/com.apple.documentation\/documentation\/Foundation\/NSLocale\/preferredLanguages].",
  "platforms" : [
    "macOS"
  ],
  "rawMarkdown" : "---\nsource: https:\/\/developer.apple.com\/documentation\/AppKit\/NSParagraphStyle\/hyphenationFactor\ncrawled: 2025-12-02T07:26:48Z\n---\n\n# hyphenationFactor\n\n**Instance Property**\n\nThe paragraph’s threshold for hyphenation.\n\n## Declaration\n\n```swift\nvar hyphenationFactor: Float { get }\n```\n\n## Discussion\n\nThe system attempts hyphenation when the ratio of the text width (as broken without hyphenation) to the width of the line fragment is less than the hyphenation factor. When the paragraph’s hyphenation factor is `0.0`, the system uses the layout manager’s hyphenation factor instead. The system disables hyphenation when both are `0.0`. This property detects the user-selected language by examining the first item in [doc:\/\/com.apple.documentation\/documentation\/Foundation\/NSLocale\/preferredLanguages].\n\n## Getting line-break information\n\n- **lineBreakMode**: The mode for breaking lines in the paragraph that don’t fit within a container.\n- **NSLineBreakMode**: Constants that specify what happens when a line is too long for a container.\n- **lineBreakStrategy**: The strategy for breaking lines while laying out paragraphs.\n- **NSParagraphStyle.LineBreakStrategy**: Constants that specify how the text system breaks lines while laying out paragraphs.\n- **usesDefaultHyphenation**: A Boolean value that indicates whether the paragraph style uses the system hyphenation settings.\n- **tighteningFactorForTruncation**: The threshold for using tightening as an alternative to truncation.\n- **allowsDefaultTighteningForTruncation**: A Boolean value that indicates whether the system tightens character spacing before truncating text.\n\n",
  "sections" : [
    {
      "content" : "",
      "items" : [
        {
          "description" : "The mode for breaking lines in the paragraph that don’t fit within a container.",
          "name" : "lineBreakMode",
          "url" : "https:\/\/developer.apple.com\/documentation\/AppKit\/NSParagraphStyle\/lineBreakMode"
        },
        {
          "description" : "Constants that specify what happens when a line is too long for a container.",
          "name" : "NSLineBreakMode",
          "url" : "https:\/\/developer.apple.com\/documentation\/AppKit\/NSLineBreakMode"
        },
        {
          "description" : "The strategy for breaking lines while laying out paragraphs.",
          "name" : "lineBreakStrategy",
          "url" : "https:\/\/developer.apple.com\/documentation\/AppKit\/NSParagraphStyle\/lineBreakStrategy-swift.property"
        },
        {
          "description" : "Constants that specify how the text system breaks lines while laying out paragraphs.",
          "name" : "NSParagraphStyle.LineBreakStrategy",
          "url" : "https:\/\/developer.apple.com\/documentation\/AppKit\/NSParagraphStyle\/LineBreakStrategy-swift.struct"
        },
        {
          "description" : "A Boolean value that indicates whether the paragraph style uses the system hyphenation settings.",
          "name" : "usesDefaultHyphenation",
          "url" : "https:\/\/developer.apple.com\/documentation\/AppKit\/NSParagraphStyle\/usesDefaultHyphenation"
        },
        {
          "description" : "The threshold for using tightening as an alternative to truncation.",
          "name" : "tighteningFactorForTruncation",
          "url" : "https:\/\/developer.apple.com\/documentation\/AppKit\/NSParagraphStyle\/tighteningFactorForTruncation"
        },
        {
          "description" : "A Boolean value that indicates whether the system tightens character spacing before truncating text.",
          "name" : "allowsDefaultTighteningForTruncation",
          "url" : "https:\/\/developer.apple.com\/documentation\/AppKit\/NSParagraphStyle\/allowsDefaultTighteningForTruncation"
        }
      ],
      "title" : "Getting line-break information"
    }
  ],
  "source" : "appleJSON",
  "title" : "hyphenationFactor",
  "url" : "https:\/\/developer.apple.com\/documentation\/AppKit\/NSParagraphStyle\/hyphenationFactor"
}