{
  "abstract" : "An operation that writes a copy of the document’s contents to the specified location, without changing the original document’s location.",
  "codeExamples" : [

  ],
  "contentHash" : "e9cd91ebd4c17497fc6443ce98f44cb5c73b710c1f2993e0cedac7684f5d3b6e",
  "crawledAt" : "2025-12-03T08:58:37Z",
  "declaration" : {
    "code" : "case saveToOperation",
    "language" : "swift"
  },
  "id" : "7859A83C-CBA5-4421-B633-F7BFD8C89E43",
  "kind" : "unknown",
  "language" : "swift",
  "module" : "AppKit",
  "platforms" : [
    "macOS"
  ],
  "rawMarkdown" : "---\nsource: https:\/\/developer.apple.com\/documentation\/AppKit\/NSDocument\/SaveOperationType\/saveToOperation\ncrawled: 2025-12-03T08:58:37Z\n---\n\n# NSDocument.SaveOperationType.saveToOperation\n\n**Case**\n\nAn operation that writes a copy of the document’s contents to the specified location, without changing the original document’s location.\n\n## Declaration\n\n```swift\ncase saveToOperation\n```\n\n## Constants\n\n- **NSDocument.SaveOperationType.saveOperation**: An operation that overwrites a document’s file or file package with the document’s contents.\n- **NSDocument.SaveOperationType.saveAsOperation**: An operation that writes the document’s contents to a new location and updates the document to point to that location\n- **NSDocument.SaveOperationType.autosaveElsewhereOperation**: An operation that writes an autosave version of the file to a different location.\n- **NSDocument.SaveOperationType.autosaveInPlaceOperation**: An operation that overwrites the document’s current contents with autosave data.\n- **NSDocument.SaveOperationType.autosaveAsOperation**: An operation that writes a document’s contents to a new file or file package even though the user has not explicitly requested it, then changes the document’s current location to point to the just-written file or file package.\n\n",
  "sections" : [
    {
      "content" : "",
      "items" : [
        {
          "description" : "An operation that overwrites a document’s file or file package with the document’s contents.",
          "name" : "NSDocument.SaveOperationType.saveOperation",
          "url" : "https:\/\/developer.apple.com\/documentation\/AppKit\/NSDocument\/SaveOperationType\/saveOperation"
        },
        {
          "description" : "An operation that writes the document’s contents to a new location and updates the document to point to that location",
          "name" : "NSDocument.SaveOperationType.saveAsOperation",
          "url" : "https:\/\/developer.apple.com\/documentation\/AppKit\/NSDocument\/SaveOperationType\/saveAsOperation"
        },
        {
          "description" : "An operation that writes an autosave version of the file to a different location.",
          "name" : "NSDocument.SaveOperationType.autosaveElsewhereOperation",
          "url" : "https:\/\/developer.apple.com\/documentation\/AppKit\/NSDocument\/SaveOperationType\/autosaveElsewhereOperation"
        },
        {
          "description" : "An operation that overwrites the document’s current contents with autosave data.",
          "name" : "NSDocument.SaveOperationType.autosaveInPlaceOperation",
          "url" : "https:\/\/developer.apple.com\/documentation\/AppKit\/NSDocument\/SaveOperationType\/autosaveInPlaceOperation"
        },
        {
          "description" : "An operation that writes a document’s contents to a new file or file package even though the user has not explicitly requested it, then changes the document’s current location to point to the just-written file or file package.",
          "name" : "NSDocument.SaveOperationType.autosaveAsOperation",
          "url" : "https:\/\/developer.apple.com\/documentation\/AppKit\/NSDocument\/SaveOperationType\/autosaveAsOperation"
        }
      ],
      "title" : "Constants"
    }
  ],
  "source" : "appleJSON",
  "title" : "NSDocument.SaveOperationType.saveToOperation",
  "url" : "https:\/\/developer.apple.com\/documentation\/AppKit\/NSDocument\/SaveOperationType\/saveToOperation"
}