{
  "abstract" : "Tells the delegate that the person selected a sharing service for the current item.",
  "codeExamples" : [

  ],
  "contentHash" : "4decef5cd27cde306dc2618e2816a003715cdb6fedd792dd25e4cc8c78adbc42",
  "crawledAt" : "2025-12-05T12:20:20Z",
  "declaration" : {
    "code" : "optional func sharingServicePicker(_ sharingServicePicker: NSSharingServicePicker, didChoose service: NSSharingService?)",
    "language" : "swift"
  },
  "id" : "22D9C85E-24B9-48D2-A55A-1189E6B6C62D",
  "kind" : "method",
  "language" : "swift",
  "module" : "AppKit",
  "overview" : "## Discussion\n\nAfter someone chooses a service, the sharing service picker calls this method to let you know which service they picked. The sharing service receives the item sometime after this method returns.",
  "platforms" : [
    "macOS"
  ],
  "rawMarkdown" : "---\nsource: https:\/\/developer.apple.com\/documentation\/AppKit\/NSSharingServicePickerDelegate\/sharingServicePicker(_:didChoose:)\ncrawled: 2025-12-05T12:20:20Z\n---\n\n# sharingServicePicker(_:didChoose:)\n\n**Instance Method**\n\nTells the delegate that the person selected a sharing service for the current item.\n\n## Declaration\n\n```swift\noptional func sharingServicePicker(_ sharingServicePicker: NSSharingServicePicker, didChoose service: NSSharingService?)\n```\n\n## Parameters\n\n- **sharingServicePicker**: The sharing service picker.\n- **service**: The selected sharing service. Invoked to give the delegate to the sharing service that is about to be executed.\n\n## Discussion\n\nAfter someone chooses a service, the sharing service picker calls this method to let you know which service they picked. The sharing service receives the item sometime after this method returns.\n\n## Customizing Behavior\n\n- **sharingServicePicker(_:delegateFor:)**: Asks your delegate to provide an object that the selected sharing service can use as its delegate.\n\n",
  "sections" : [
    {
      "content" : "",
      "items" : [
        {
          "description" : "Asks your delegate to provide an object that the selected sharing service can use as its delegate.",
          "name" : "sharingServicePicker(_:delegateFor:)",
          "url" : "https:\/\/developer.apple.com\/documentation\/AppKit\/NSSharingServicePickerDelegate\/sharingServicePicker(_:delegateFor:)"
        }
      ],
      "title" : "Customizing Behavior"
    }
  ],
  "source" : "appleJSON",
  "title" : "sharingServicePicker(_:didChoose:)",
  "url" : "https:\/\/developer.apple.com\/documentation\/AppKit\/NSSharingServicePickerDelegate\/sharingServicePicker(_:didChoose:)"
}