{
  "abstract" : "Returns the fully prepared cell that the table view will use for drawing or processing of the specified row and column.",
  "codeExamples" : [

  ],
  "contentHash" : "a93ce102d3fef9c9832a6438dca9d182ed4c94b8ed092b7889f65d9c8c1d77f1",
  "crawledAt" : "2025-12-01T13:54:59Z",
  "declaration" : {
    "code" : "@MainActor func preparedCell(atColumn column: Int, row: Int) -> NSCell?",
    "language" : "swift"
  },
  "id" : "94DE36A2-6E71-432E-B199-CD1E1B882450",
  "kind" : "method",
  "module" : "AppKit",
  "overview" : "## Return Value\n\nNew [doc:\/\/com.apple.appkit\/documentation\/AppKit\/NSCell] subclass instance to use for the specified `row` and `column`. The value for the cell is correctly set, and the delegate method [doc:\/\/com.apple.appkit\/documentation\/AppKit\/NSTableViewDelegate\/tableView(_:willDisplayCell:for:row:)] will have been called.\n\n## Discussion\n\nYou can override this method to do any additional cell set up that is required, or invoke it to retrieve a cell that has its contents configured for the specified `column` and `row`.",
  "platforms" : [
    "macOS"
  ],
  "rawMarkdown" : "---\nsource: https:\/\/developer.apple.com\/documentation\/AppKit\/NSTableView\/preparedCell(atColumn:row:)\ncrawled: 2025-12-01T13:54:59Z\n---\n\n# preparedCell(atColumn:row:)\n\n**Instance Method**\n\nReturns the fully prepared cell that the table view will use for drawing or processing of the specified row and column.\n\n## Declaration\n\n```swift\n@MainActor func preparedCell(atColumn column: Int, row: Int) -> NSCell?\n```\n\n## Parameters\n\n- **column**: The index in the [doc:\/\/com.apple.appkit\/documentation\/AppKit\/NSTableView\/tableColumns] array for which to return the appropriate cell.\n- **row**: The row index for which to return the appropriate cell.\n\n## Return Value\n\nNew [doc:\/\/com.apple.appkit\/documentation\/AppKit\/NSCell] subclass instance to use for the specified `row` and `column`. The value for the cell is correctly set, and the delegate method [doc:\/\/com.apple.appkit\/documentation\/AppKit\/NSTableViewDelegate\/tableView(_:willDisplayCell:for:row:)] will have been called.\n\n## Discussion\n\nYou can override this method to do any additional cell set up that is required, or invoke it to retrieve a cell that has its contents configured for the specified `column` and `row`.\n\n\n\n## Deprecated Methods\n\n- **focusedColumn()**: Returns the currently focused column.\n- **setFocusedColumn(_:)**: Sets the currently focused column to the specified index.\n- **shouldFocusCell(_:atColumn:row:)**: Returns whether the fully prepared cell at the specified row and column can be made the focused cell.\n- **performClickOnCell(atColumn:row:)**: Performs a click action on the cell at the specified row and column.\n\n",
  "sections" : [
    {
      "content" : "",
      "items" : [
        {
          "description" : "Returns the currently focused column.",
          "name" : "focusedColumn()",
          "url" : "https:\/\/developer.apple.com\/documentation\/AppKit\/NSTableView\/focusedColumn()"
        },
        {
          "description" : "Sets the currently focused column to the specified index.",
          "name" : "setFocusedColumn(_:)",
          "url" : "https:\/\/developer.apple.com\/documentation\/AppKit\/NSTableView\/setFocusedColumn(_:)"
        },
        {
          "description" : "Returns whether the fully prepared cell at the specified row and column can be made the focused cell.",
          "name" : "shouldFocusCell(_:atColumn:row:)",
          "url" : "https:\/\/developer.apple.com\/documentation\/AppKit\/NSTableView\/shouldFocusCell(_:atColumn:row:)"
        },
        {
          "description" : "Performs a click action on the cell at the specified row and column.",
          "name" : "performClickOnCell(atColumn:row:)",
          "url" : "https:\/\/developer.apple.com\/documentation\/AppKit\/NSTableView\/performClickOnCell(atColumn:row:)"
        }
      ],
      "title" : "Deprecated Methods"
    }
  ],
  "source" : "appleJSON",
  "title" : "preparedCell(atColumn:row:)",
  "url" : "https:\/\/developer.apple.com\/documentation\/AppKit\/NSTableView\/preparedCell(atColumn:row:)"
}