{
  "abstract" : "Sets the glyph range being processed and the paragraph separator glyph range (the range of the paragraph separator character or characters).",
  "codeExamples" : [

  ],
  "contentHash" : "c2a565d70f1fa5f605ab991f7f30ae666c5f35c835686106fbded9adea0c3e8c",
  "crawledAt" : "2025-12-04T02:27:58Z",
  "declaration" : {
    "code" : "func setParagraphGlyphRange(_ paragraphRange: NSRange, separatorGlyphRange paragraphSeparatorRange: NSRange)",
    "language" : "swift"
  },
  "id" : "44286833-D1B3-4AB3-95DD-6B743330124E",
  "kind" : "method",
  "language" : "swift",
  "module" : "AppKit",
  "platforms" : [
    "macOS"
  ],
  "rawMarkdown" : "---\nsource: https:\/\/developer.apple.com\/documentation\/AppKit\/NSATSTypesetter\/setParagraphGlyphRange(_:separatorGlyphRange:)\ncrawled: 2025-12-04T02:27:58Z\n---\n\n# setParagraphGlyphRange(_:separatorGlyphRange:)\n\n**Instance Method**\n\nSets the glyph range being processed and the paragraph separator glyph range (the range of the paragraph separator character or characters).\n\n## Declaration\n\n```swift\nfunc setParagraphGlyphRange(_ paragraphRange: NSRange, separatorGlyphRange paragraphSeparatorRange: NSRange)\n```\n\n## Parameters\n\n- **paragraphRange**: The glyph range that becomes current.\n- **paragraphSeparatorRange**: The paragraph separator glyph range that becomes current.\n\n## Accessing paragraph information\n\n- **attributedString**: The backing store that contains the text on which this typesetter operates.\n- **paragraphGlyphRange**: The current glyph range being processed.\n- **paragraphSeparatorGlyphRange**: The current paragraph separator range that contains the current glyph range and extends from one paragraph separator character to the next.\n\n",
  "sections" : [
    {
      "content" : "",
      "items" : [
        {
          "description" : "The backing store that contains the text on which this typesetter operates.",
          "name" : "attributedString",
          "url" : "https:\/\/developer.apple.com\/documentation\/AppKit\/NSATSTypesetter\/attributedString"
        },
        {
          "description" : "The current glyph range being processed.",
          "name" : "paragraphGlyphRange",
          "url" : "https:\/\/developer.apple.com\/documentation\/AppKit\/NSATSTypesetter\/paragraphGlyphRange"
        },
        {
          "description" : "The current paragraph separator range that contains the current glyph range and extends from one paragraph separator character to the next.",
          "name" : "paragraphSeparatorGlyphRange",
          "url" : "https:\/\/developer.apple.com\/documentation\/AppKit\/NSATSTypesetter\/paragraphSeparatorGlyphRange"
        }
      ],
      "title" : "Accessing paragraph information"
    }
  ],
  "source" : "appleJSON",
  "title" : "setParagraphGlyphRange(_:separatorGlyphRange:)",
  "url" : "https:\/\/developer.apple.com\/documentation\/AppKit\/NSATSTypesetter\/setParagraphGlyphRange(_:separatorGlyphRange:)"
}