{
  "abstract" : "A property containing a class that describes layout attributes.",
  "codeExamples" : [

  ],
  "contentHash" : "75e78586f791c2167a319ee65c03950e6101c38517958505661c3cfa5824cb39",
  "crawledAt" : "2025-12-03T18:20:25Z",
  "declaration" : {
    "code" : "@MainActor class var layoutAttributesClass: AnyClass { get }",
    "language" : "swift"
  },
  "id" : "CC7D9341-CC5A-4E9F-972E-2C91EE19EC79",
  "kind" : "property",
  "language" : "swift",
  "module" : "AppKit",
  "overview" : "## Return Value\n\nThe default return value is [doc:\/\/com.apple.appkit\/documentation\/AppKit\/NSScrubberLayoutAttributes].\n\n## Discussion\n\nCreate a custom subclass of [doc:\/\/com.apple.appkit\/documentation\/AppKit\/NSScrubberLayout] and override this method if you wish to use a custom layout attributes subclass.",
  "platforms" : [
    "macOS"
  ],
  "rawMarkdown" : "---\nsource: https:\/\/developer.apple.com\/documentation\/AppKit\/NSScrubberLayout\/layoutAttributesClass\ncrawled: 2025-12-03T18:20:25Z\n---\n\n# layoutAttributesClass\n\n**Type Property**\n\nA property containing a class that describes layout attributes.\n\n## Declaration\n\n```swift\n@MainActor class var layoutAttributesClass: AnyClass { get }\n```\n\n## Return Value\n\nThe default return value is [doc:\/\/com.apple.appkit\/documentation\/AppKit\/NSScrubberLayoutAttributes].\n\n## Discussion\n\nCreate a custom subclass of [doc:\/\/com.apple.appkit\/documentation\/AppKit\/NSScrubberLayout] and override this method if you wish to use a custom layout attributes subclass.\n\n## Related Documentation\n\n- **NSScrubberLayoutAttributes**: The layout of a scrubber item.\n\n## Configuring a scrubber layout\n\n- **scrubber**: The scrubber control that this layout is assigned to.\n- **visibleRect**: The currently visible rectangle, in the coordinate space of the scrubber content.\n- **invalidateLayout()**: Signals that the layout has been invalidated, and that the scrubber control should perform a new layout pass.\n\n",
  "sections" : [
    {
      "content" : "",
      "items" : [
        {
          "description" : "The layout of a scrubber item.",
          "name" : "NSScrubberLayoutAttributes",
          "url" : "https:\/\/developer.apple.com\/documentation\/AppKit\/NSScrubberLayoutAttributes"
        }
      ],
      "title" : "Related Documentation"
    },
    {
      "content" : "",
      "items" : [
        {
          "description" : "The scrubber control that this layout is assigned to.",
          "name" : "scrubber",
          "url" : "https:\/\/developer.apple.com\/documentation\/AppKit\/NSScrubberLayout\/scrubber"
        },
        {
          "description" : "The currently visible rectangle, in the coordinate space of the scrubber content.",
          "name" : "visibleRect",
          "url" : "https:\/\/developer.apple.com\/documentation\/AppKit\/NSScrubberLayout\/visibleRect"
        },
        {
          "description" : "Signals that the layout has been invalidated, and that the scrubber control should perform a new layout pass.",
          "name" : "invalidateLayout()",
          "url" : "https:\/\/developer.apple.com\/documentation\/AppKit\/NSScrubberLayout\/invalidateLayout()"
        }
      ],
      "title" : "Configuring a scrubber layout"
    }
  ],
  "source" : "appleJSON",
  "title" : "layoutAttributesClass",
  "url" : "https:\/\/developer.apple.com\/documentation\/AppKit\/NSScrubberLayout\/layoutAttributesClass"
}