{
  "abstract" : "A Boolean that controls whether the receiver interprets Tab, Shift-Tab, and Return (Enter) as cues to end editing and possibly to change the first responder.",
  "codeExamples" : [

  ],
  "contentHash" : "6260408646d2abefbd1c660d04d6036d5cb63e1725420869dec3e29534556bfc",
  "crawledAt" : "2025-12-03T09:07:40Z",
  "declaration" : {
    "code" : "@MainActor var isFieldEditor: Bool { get set }",
    "language" : "swift"
  },
  "id" : "6B015E59-DEC4-43AB-85A5-721EADF8CA3C",
  "kind" : "property",
  "language" : "swift",
  "module" : "AppKit",
  "overview" : "## Discussion\n\nIf `flag` is [doc:\/\/com.apple.documentation\/documentation\/Swift\/true], the receiver interprets Tab, Shift-Tab, and Return (Enter) as cues to end editing and possibly to change the first responder; if `flag` is [doc:\/\/com.apple.documentation\/documentation\/Swift\/false], it doesn’t, instead accepting these characters as text input.\n\nSee the [doc:\/\/com.apple.appkit\/documentation\/AppKit\/NSWindow] class specification for more information on field editors. By default, `NSText` objects don’t behave as field editors.",
  "platforms" : [
    "macOS"
  ],
  "rawMarkdown" : "---\nsource: https:\/\/developer.apple.com\/documentation\/AppKit\/NSText\/isFieldEditor\ncrawled: 2025-12-03T09:07:40Z\n---\n\n# isFieldEditor\n\n**Instance Property**\n\nA Boolean that controls whether the receiver interprets Tab, Shift-Tab, and Return (Enter) as cues to end editing and possibly to change the first responder.\n\n## Declaration\n\n```swift\n@MainActor var isFieldEditor: Bool { get set }\n```\n\n## Discussion\n\nIf `flag` is [doc:\/\/com.apple.documentation\/documentation\/Swift\/true], the receiver interprets Tab, Shift-Tab, and Return (Enter) as cues to end editing and possibly to change the first responder; if `flag` is [doc:\/\/com.apple.documentation\/documentation\/Swift\/false], it doesn’t, instead accepting these characters as text input.\n\nSee the [doc:\/\/com.apple.appkit\/documentation\/AppKit\/NSWindow] class specification for more information on field editors. By default, `NSText` objects don’t behave as field editors.\n\n## Setting behavioral attributes\n\n- **isEditable**: A Boolean that controls whether the receiver allows the user to edit its text.\n- **isSelectable**: A Boolean that controls whether the receiver allows the user to select its text.\n- **isRichText**: A Boolean that controls whether the receiver allows the user to apply attributes to specific ranges of the text.\n- **importsGraphics**: A Boolean that controls whether the receiver allows the user to import files by dragging.\n\n",
  "sections" : [
    {
      "content" : "",
      "items" : [
        {
          "description" : "A Boolean that controls whether the receiver allows the user to edit its text.",
          "name" : "isEditable",
          "url" : "https:\/\/developer.apple.com\/documentation\/AppKit\/NSText\/isEditable"
        },
        {
          "description" : "A Boolean that controls whether the receiver allows the user to select its text.",
          "name" : "isSelectable",
          "url" : "https:\/\/developer.apple.com\/documentation\/AppKit\/NSText\/isSelectable"
        },
        {
          "description" : "A Boolean that controls whether the receiver allows the user to apply attributes to specific ranges of the text.",
          "name" : "isRichText",
          "url" : "https:\/\/developer.apple.com\/documentation\/AppKit\/NSText\/isRichText"
        },
        {
          "description" : "A Boolean that controls whether the receiver allows the user to import files by dragging.",
          "name" : "importsGraphics",
          "url" : "https:\/\/developer.apple.com\/documentation\/AppKit\/NSText\/importsGraphics"
        }
      ],
      "title" : "Setting behavioral attributes"
    }
  ],
  "source" : "appleJSON",
  "title" : "isFieldEditor",
  "url" : "https:\/\/developer.apple.com\/documentation\/AppKit\/NSText\/isFieldEditor"
}