{
  "abstract" : "Returns a localized string with the name of the specified font family and face, if one exists.",
  "codeExamples" : [

  ],
  "contentHash" : "8d1c242a8e8de1721128911de7fdac22c9981081be7d82fccfe4f415bad5ad2a",
  "crawledAt" : "2025-12-04T11:23:20Z",
  "declaration" : {
    "code" : "func localizedName(forFamily family: String, face faceKey: String?) -> String",
    "language" : "swift"
  },
  "id" : "9C0E3D93-464A-431B-8B1B-2077599427B5",
  "kind" : "method",
  "language" : "swift",
  "module" : "AppKit",
  "overview" : "## Return Value\n\nA localized string with the name of the specified font family and face, or, if `face` is `nil`, the font family only.\n\n## Discussion\n\nThe user’s locale is determined from the user’s `NSLanguages` default setting. The method also loads the localized strings for the font, if they aren’t already loaded.",
  "platforms" : [
    "macOS"
  ],
  "rawMarkdown" : "---\nsource: https:\/\/developer.apple.com\/documentation\/AppKit\/NSFontManager\/localizedName(forFamily:face:)\ncrawled: 2025-12-04T11:23:20Z\n---\n\n# localizedName(forFamily:face:)\n\n**Instance Method**\n\nReturns a localized string with the name of the specified font family and face, if one exists.\n\n## Declaration\n\n```swift\nfunc localizedName(forFamily family: String, face faceKey: String?) -> String\n```\n\n## Parameters\n\n- **family**: The font family, for example, `@\"Times\"`.\n- **faceKey**: The font face, for example, `@\"Roman\"`.\n\n## Return Value\n\nA localized string with the name of the specified font family and face, or, if `face` is `nil`, the font family only.\n\n## Discussion\n\nThe user’s locale is determined from the user’s `NSLanguages` default setting. The method also loads the localized strings for the font, if they aren’t already loaded.\n\n## Setting and Examining the Selected Font\n\n- **setSelectedFont(_:isMultiple:)**: Records the specified font as the currently selected font and updates the Font panel.\n- **selectedFont**: The currently selected font object.\n- **isMultiple**: A Boolean value that indicates whether the currently selected font has multiple fonts.\n- **sendAction()**: A Boolean value that indicates whether a responder handled the font manager’s action message.\n\n",
  "sections" : [
    {
      "content" : "",
      "items" : [
        {
          "description" : "Records the specified font as the currently selected font and updates the Font panel.",
          "name" : "setSelectedFont(_:isMultiple:)",
          "url" : "https:\/\/developer.apple.com\/documentation\/AppKit\/NSFontManager\/setSelectedFont(_:isMultiple:)"
        },
        {
          "description" : "The currently selected font object.",
          "name" : "selectedFont",
          "url" : "https:\/\/developer.apple.com\/documentation\/AppKit\/NSFontManager\/selectedFont"
        },
        {
          "description" : "A Boolean value that indicates whether the currently selected font has multiple fonts.",
          "name" : "isMultiple",
          "url" : "https:\/\/developer.apple.com\/documentation\/AppKit\/NSFontManager\/isMultiple"
        },
        {
          "description" : "A Boolean value that indicates whether a responder handled the font manager’s action message.",
          "name" : "sendAction()",
          "url" : "https:\/\/developer.apple.com\/documentation\/AppKit\/NSFontManager\/sendAction()"
        }
      ],
      "title" : "Setting and Examining the Selected Font"
    }
  ],
  "source" : "appleJSON",
  "title" : "localizedName(forFamily:face:)",
  "url" : "https:\/\/developer.apple.com\/documentation\/AppKit\/NSFontManager\/localizedName(forFamily:face:)"
}