{
  "abstract" : "Initiates a grammatical analysis of a given string.",
  "codeExamples" : [

  ],
  "contentHash" : "f51c80483a606525dfa0d3cbd1cc2ef42d714042dd66a28c008334bfafc9c7d2",
  "crawledAt" : "2025-12-04T12:48:49Z",
  "declaration" : {
    "code" : "func checkGrammar(of stringToCheck: String, startingAt startingOffset: Int, language: String?, wrap wrapFlag: Bool, inSpellDocumentWithTag tag: Int, details: AutoreleasingUnsafeMutablePointer<NSArray?>?) -> NSRange",
    "language" : "swift"
  },
  "id" : "49893D62-CC6D-4A5E-A972-8A7F0FF75F9B",
  "kind" : "method",
  "language" : "swift",
  "module" : "AppKit",
  "overview" : "## Return Value\n\nLocation of the first flagged grammatical unit.",
  "platforms" : [
    "macOS"
  ],
  "rawMarkdown" : "---\nsource: https:\/\/developer.apple.com\/documentation\/AppKit\/NSSpellChecker\/checkGrammar(of:startingAt:language:wrap:inSpellDocumentWithTag:details:)\ncrawled: 2025-12-04T12:48:49Z\n---\n\n# checkGrammar(of:startingAt:language:wrap:inSpellDocumentWithTag:details:)\n\n**Instance Method**\n\nInitiates a grammatical analysis of a given string.\n\n## Declaration\n\n```swift\nfunc checkGrammar(of stringToCheck: String, startingAt startingOffset: Int, language: String?, wrap wrapFlag: Bool, inSpellDocumentWithTag tag: Int, details: AutoreleasingUnsafeMutablePointer<NSArray?>?) -> NSRange\n```\n\n## Parameters\n\n- **stringToCheck**: String to analyze.\n- **startingOffset**: Location within `string` at which to start the analysis.\n- **language**: Language use in `string`. When `nil`, the language selected in the Spelling panel is used.\n- **wrapFlag**: [doc:\/\/com.apple.documentation\/documentation\/Swift\/true] to specify that the analysis continue to the beginning of string when the end is reached.\n\n[doc:\/\/com.apple.documentation\/documentation\/Swift\/false] to have the analysis stop at the end of string.\n- **tag**: An identifier unique within the application used to inform the spell checker which document that text is associated, potentially for many purposes, not necessarily just for ignored words. A value of 0 can be passed in for text not associated with a particular document.\n- **details**: On output, dictionaries describing grammar-analysis details within the flagged grammatical unit. See the [doc:\/\/com.apple.documentation\/documentation\/Foundation\/NSSpellServer] class for information about these dictionaries.\n\n## Return Value\n\nLocation of the first flagged grammatical unit.\n\n## Checking Strings for Spelling and Grammar\n\n- **countWords(in:language:)**: Returns the number of words in the specified string.\n- **checkSpelling(of:startingAt:)**: Starts the search for a misspelled word in `stringToCheck` starting at `startingOffset` within the string object.\n- **checkSpelling(of:startingAt:language:wrap:inSpellDocumentWithTag:wordCount:)**: Starts the search for a misspelled word in a string starting at specified offset within the string.\n- **check(_:range:types:options:inSpellDocumentWithTag:orthography:wordCount:)**: Requests unified text checking for the given range of the given string.\n- **requestChecking(of:range:types:options:inSpellDocumentWithTag:completionHandler:)**: Requests that the string be checked in the background.\n- **guesses(forWordRange:in:language:inSpellDocumentWithTag:)**: Returns an array of possible substitutions for the specified string.\n\n",
  "sections" : [
    {
      "content" : "",
      "items" : [
        {
          "description" : "Returns the number of words in the specified string.",
          "name" : "countWords(in:language:)",
          "url" : "https:\/\/developer.apple.com\/documentation\/AppKit\/NSSpellChecker\/countWords(in:language:)"
        },
        {
          "description" : "Starts the search for a misspelled word in `stringToCheck` starting at `startingOffset` within the string object.",
          "name" : "checkSpelling(of:startingAt:)",
          "url" : "https:\/\/developer.apple.com\/documentation\/AppKit\/NSSpellChecker\/checkSpelling(of:startingAt:)"
        },
        {
          "description" : "Starts the search for a misspelled word in a string starting at specified offset within the string.",
          "name" : "checkSpelling(of:startingAt:language:wrap:inSpellDocumentWithTag:wordCount:)",
          "url" : "https:\/\/developer.apple.com\/documentation\/AppKit\/NSSpellChecker\/checkSpelling(of:startingAt:language:wrap:inSpellDocumentWithTag:wordCount:)"
        },
        {
          "description" : "Requests unified text checking for the given range of the given string.",
          "name" : "check(_:range:types:options:inSpellDocumentWithTag:orthography:wordCount:)",
          "url" : "https:\/\/developer.apple.com\/documentation\/AppKit\/NSSpellChecker\/check(_:range:types:options:inSpellDocumentWithTag:orthography:wordCount:)"
        },
        {
          "description" : "Requests that the string be checked in the background.",
          "name" : "requestChecking(of:range:types:options:inSpellDocumentWithTag:completionHandler:)",
          "url" : "https:\/\/developer.apple.com\/documentation\/AppKit\/NSSpellChecker\/requestChecking(of:range:types:options:inSpellDocumentWithTag:completionHandler:)"
        },
        {
          "description" : "Returns an array of possible substitutions for the specified string.",
          "name" : "guesses(forWordRange:in:language:inSpellDocumentWithTag:)",
          "url" : "https:\/\/developer.apple.com\/documentation\/AppKit\/NSSpellChecker\/guesses(forWordRange:in:language:inSpellDocumentWithTag:)"
        }
      ],
      "title" : "Checking Strings for Spelling and Grammar"
    }
  ],
  "source" : "appleJSON",
  "title" : "checkGrammar(of:startingAt:language:wrap:inSpellDocumentWithTag:details:)",
  "url" : "https:\/\/developer.apple.com\/documentation\/AppKit\/NSSpellChecker\/checkGrammar(of:startingAt:language:wrap:inSpellDocumentWithTag:details:)"
}