{
  "abstract" : "Returns the Auto Layout priority for the stack view to minimize its size to fit its contained views as closely as possible, for a specified user interface axis.",
  "codeExamples" : [

  ],
  "contentHash" : "0b87c12e03c051b9dd62ea4b37ff81872ea650e2361165fa5e369783a3203651",
  "crawledAt" : "2025-12-02T18:30:12Z",
  "declaration" : {
    "code" : "@MainActor func huggingPriority(for orientation: NSLayoutConstraint.Orientation) -> NSLayoutConstraint.Priority",
    "language" : "swift"
  },
  "id" : "90612FBB-4328-4139-8F2D-3D068BA592D2",
  "kind" : "method",
  "language" : "swift",
  "module" : "AppKit",
  "overview" : "## Return Value\n\nThe Auto Layout priority for the stack view to minimize its size.",
  "platforms" : [
    "macOS"
  ],
  "rawMarkdown" : "---\nsource: https:\/\/developer.apple.com\/documentation\/AppKit\/NSStackView\/huggingPriority(for:)\ncrawled: 2025-12-02T18:30:12Z\n---\n\n# huggingPriority(for:)\n\n**Instance Method**\n\nReturns the Auto Layout priority for the stack view to minimize its size to fit its contained views as closely as possible, for a specified user interface axis.\n\n## Declaration\n\n```swift\n@MainActor func huggingPriority(for orientation: NSLayoutConstraint.Orientation) -> NSLayoutConstraint.Priority\n```\n\n## Parameters\n\n- **orientation**: The user interface axis (horizontal or vertical) whose hugging priority you want to get from the stack view. Valid values are those in the [doc:\/\/com.apple.appkit\/documentation\/AppKit\/NSUserInterfaceLayoutOrientation] enumeration.\n\n## Return Value\n\nThe Auto Layout priority for the stack view to minimize its size.\n\n## Related Documentation\n\n- **setHuggingPriority(_:for:)**: Sets the Auto Layout priority for the stack view to minimize its size, for a specified user interface axis.\n\n## Inspecting a Stack View\n\n- **views**: The array of views owned by the stack view.\n- **views(in:)**: Returns the array of views in the specified gravity area in the stack view.\n- **detachedViews**: An array that contains the detached views from all the stack view’s gravity areas.\n- **clippingResistancePriority(for:)**: Returns the Auto Layout priority for resisting clipping of views in the stack view when Auto Layout attempts to reduce the stack view’s size.\n\n",
  "sections" : [
    {
      "content" : "",
      "items" : [
        {
          "description" : "Sets the Auto Layout priority for the stack view to minimize its size, for a specified user interface axis.",
          "name" : "setHuggingPriority(_:for:)",
          "url" : "https:\/\/developer.apple.com\/documentation\/AppKit\/NSStackView\/setHuggingPriority(_:for:)"
        }
      ],
      "title" : "Related Documentation"
    },
    {
      "content" : "",
      "items" : [
        {
          "description" : "The array of views owned by the stack view.",
          "name" : "views",
          "url" : "https:\/\/developer.apple.com\/documentation\/AppKit\/NSStackView\/views"
        },
        {
          "description" : "Returns the array of views in the specified gravity area in the stack view.",
          "name" : "views(in:)",
          "url" : "https:\/\/developer.apple.com\/documentation\/AppKit\/NSStackView\/views(in:)"
        },
        {
          "description" : "An array that contains the detached views from all the stack view’s gravity areas.",
          "name" : "detachedViews",
          "url" : "https:\/\/developer.apple.com\/documentation\/AppKit\/NSStackView\/detachedViews"
        },
        {
          "description" : "Returns the Auto Layout priority for resisting clipping of views in the stack view when Auto Layout attempts to reduce the stack view’s size.",
          "name" : "clippingResistancePriority(for:)",
          "url" : "https:\/\/developer.apple.com\/documentation\/AppKit\/NSStackView\/clippingResistancePriority(for:)"
        }
      ],
      "title" : "Inspecting a Stack View"
    }
  ],
  "source" : "appleJSON",
  "title" : "huggingPriority(for:)",
  "url" : "https:\/\/developer.apple.com\/documentation\/AppKit\/NSStackView\/huggingPriority(for:)"
}