{
  "abstract" : "Finds and displays the text at the given anchor location in the given book.",
  "codeExamples" : [
    {
      "code" : "NSString *locBookName = [[NSBundle mainBundle] objectForInfoDictionaryKey: @\"CFBundleHelpBookName\"];\n[[NSHelpManager sharedHelpManager] openHelpAnchor:@\"anchor1\"  inBook:locBookName];",
      "language" : "objc"
    }
  ],
  "contentHash" : "3ccf7b58d8e5ea47293b946e624fa0cb9f5857be5be3292e744a59718b5e01f0",
  "crawledAt" : "2025-12-02T06:09:36Z",
  "declaration" : {
    "code" : "@MainActor func openHelpAnchor(_ anchor: NSHelpManager.AnchorName, inBook book: NSHelpManager.BookName?)",
    "language" : "swift"
  },
  "id" : "BEAD018E-9762-418B-A062-C766003C9245",
  "kind" : "method",
  "module" : "AppKit",
  "overview" : "## Discussion\n\nTo open an anchor in your bundle’s localized help book, you could use code similar to the following:\n\nThis method is a wrapper for `AHRegisterHelpBook` (which is called only once to register the help book specified in the application’s main bundle) and `AHLookupAnchor`.",
  "platforms" : [
    "macOS"
  ],
  "rawMarkdown" : "---\nsource: https:\/\/developer.apple.com\/documentation\/AppKit\/NSHelpManager\/openHelpAnchor(_:inBook:)\ncrawled: 2025-12-02T06:09:36Z\n---\n\n# openHelpAnchor(_:inBook:)\n\n**Instance Method**\n\nFinds and displays the text at the given anchor location in the given book.\n\n## Declaration\n\n```swift\n@MainActor func openHelpAnchor(_ anchor: NSHelpManager.AnchorName, inBook book: NSHelpManager.BookName?)\n```\n\n## Parameters\n\n- **anchor**: Location of the desired text.\n- **book**: Help book containing the anchor. When `nil`, all installed help books are searched.\n\n## Discussion\n\nTo open an anchor in your bundle’s localized help book, you could use code similar to the following:\n\n```objc\nNSString *locBookName = [[NSBundle mainBundle] objectForInfoDictionaryKey: @\"CFBundleHelpBookName\"];\n[[NSHelpManager sharedHelpManager] openHelpAnchor:@\"anchor1\"  inBook:locBookName];\n```\n\nThis method is a wrapper for `AHRegisterHelpBook` (which is called only once to register the help book specified in the application’s main bundle) and `AHLookupAnchor`.\n\n## Displaying Help\n\n- **find(_:inBook:)**: Performs a search for the specified string in the specified book.\n- **NSHelpManager.AnchorName**\n- **NSHelpManager.BookName**\n\n",
  "sections" : [
    {
      "content" : "",
      "items" : [
        {
          "description" : "Performs a search for the specified string in the specified book.",
          "name" : "find(_:inBook:)",
          "url" : "https:\/\/developer.apple.com\/documentation\/AppKit\/NSHelpManager\/find(_:inBook:)"
        },
        {
          "description" : "",
          "name" : "NSHelpManager.AnchorName",
          "url" : "https:\/\/developer.apple.com\/documentation\/AppKit\/NSHelpManager\/AnchorName"
        },
        {
          "description" : "",
          "name" : "NSHelpManager.BookName",
          "url" : "https:\/\/developer.apple.com\/documentation\/AppKit\/NSHelpManager\/BookName"
        }
      ],
      "title" : "Displaying Help"
    }
  ],
  "source" : "appleJSON",
  "title" : "openHelpAnchor(_:inBook:)",
  "url" : "https:\/\/developer.apple.com\/documentation\/AppKit\/NSHelpManager\/openHelpAnchor(_:inBook:)"
}