{
  "abstract" : "Returns the priority with which a view resists being made larger than its intrinsic size.",
  "codeExamples" : [

  ],
  "contentHash" : "d217a56e0c3f87a036c1c3c2cff157f0fdc77d7d7141faa1e7f6a03080f23aa7",
  "crawledAt" : "2025-12-04T20:05:58Z",
  "declaration" : {
    "code" : "@MainActor func contentHuggingPriority(for orientation: NSLayoutConstraint.Orientation) -> NSLayoutConstraint.Priority",
    "language" : "swift"
  },
  "id" : "2D33E299-A3B2-4992-A69C-3A746C158995",
  "kind" : "method",
  "language" : "swift",
  "module" : "AppKit",
  "overview" : "## Return Value\n\nThe priority with which the view should resist being enlarged from its intrinsic size in the specified orientation.\n\n## Discussion\n\nThe constraint-based layout system uses these priorities when determining the best layout for views that are encountering constraints that would require them to be larger than their intrinsic size.\n\nSubclasses should not override this method. Instead, custom views should set default values for their content on creation, typically to [doc:\/\/com.apple.appkit\/documentation\/AppKit\/NSLayoutConstraint\/Priority-swift.struct\/defaultLow] or [doc:\/\/com.apple.appkit\/documentation\/AppKit\/NSLayoutConstraint\/Priority-swift.struct\/defaultHigh].",
  "platforms" : [
    "macOS"
  ],
  "rawMarkdown" : "---\nsource: https:\/\/developer.apple.com\/documentation\/AppKit\/NSView\/contentHuggingPriority(for:)\ncrawled: 2025-12-04T20:05:58Z\n---\n\n# contentHuggingPriority(for:)\n\n**Instance Method**\n\nReturns the priority with which a view resists being made larger than its intrinsic size.\n\n## Declaration\n\n```swift\n@MainActor func contentHuggingPriority(for orientation: NSLayoutConstraint.Orientation) -> NSLayoutConstraint.Priority\n```\n\n## Parameters\n\n- **orientation**: The orientation of the dimension of the view that might be enlarged.\n\n## Return Value\n\nThe priority with which the view should resist being enlarged from its intrinsic size in the specified orientation.\n\n## Discussion\n\nThe constraint-based layout system uses these priorities when determining the best layout for views that are encountering constraints that would require them to be larger than their intrinsic size.\n\nSubclasses should not override this method. Instead, custom views should set default values for their content on creation, typically to [doc:\/\/com.apple.appkit\/documentation\/AppKit\/NSLayoutConstraint\/Priority-swift.struct\/defaultLow] or [doc:\/\/com.apple.appkit\/documentation\/AppKit\/NSLayoutConstraint\/Priority-swift.struct\/defaultHigh].\n\n## Measuring in Auto Layout\n\n- **fittingSize**: The minimum size of the view that satisfies the constraints it holds.\n- **intrinsicContentSize**: The natural size for the receiving view, considering only properties of the view itself.\n- **invalidateIntrinsicContentSize()**: Invalidates the view’s intrinsic content size.\n- **contentCompressionResistancePriority(for:)**: Returns the priority with which a view resists being made smaller than its intrinsic size.\n- **setContentCompressionResistancePriority(_:for:)**: Sets the priority with which a view resists being made smaller than its intrinsic size.\n- **setContentHuggingPriority(_:for:)**: Sets the priority with which a view resists being made larger than its intrinsic size.\n- **noIntrinsicMetric**: A value that tells the layout system to ignore the intrinsic size value for a given dimension.\n\n",
  "sections" : [
    {
      "content" : "",
      "items" : [
        {
          "description" : "The minimum size of the view that satisfies the constraints it holds.",
          "name" : "fittingSize",
          "url" : "https:\/\/developer.apple.com\/documentation\/AppKit\/NSView\/fittingSize"
        },
        {
          "description" : "The natural size for the receiving view, considering only properties of the view itself.",
          "name" : "intrinsicContentSize",
          "url" : "https:\/\/developer.apple.com\/documentation\/AppKit\/NSView\/intrinsicContentSize"
        },
        {
          "description" : "Invalidates the view’s intrinsic content size.",
          "name" : "invalidateIntrinsicContentSize()",
          "url" : "https:\/\/developer.apple.com\/documentation\/AppKit\/NSView\/invalidateIntrinsicContentSize()"
        },
        {
          "description" : "Returns the priority with which a view resists being made smaller than its intrinsic size.",
          "name" : "contentCompressionResistancePriority(for:)",
          "url" : "https:\/\/developer.apple.com\/documentation\/AppKit\/NSView\/contentCompressionResistancePriority(for:)"
        },
        {
          "description" : "Sets the priority with which a view resists being made smaller than its intrinsic size.",
          "name" : "setContentCompressionResistancePriority(_:for:)",
          "url" : "https:\/\/developer.apple.com\/documentation\/AppKit\/NSView\/setContentCompressionResistancePriority(_:for:)"
        },
        {
          "description" : "Sets the priority with which a view resists being made larger than its intrinsic size.",
          "name" : "setContentHuggingPriority(_:for:)",
          "url" : "https:\/\/developer.apple.com\/documentation\/AppKit\/NSView\/setContentHuggingPriority(_:for:)"
        },
        {
          "description" : "A value that tells the layout system to ignore the intrinsic size value for a given dimension.",
          "name" : "noIntrinsicMetric",
          "url" : "https:\/\/developer.apple.com\/documentation\/AppKit\/NSView\/noIntrinsicMetric"
        }
      ],
      "title" : "Measuring in Auto Layout"
    }
  ],
  "source" : "appleJSON",
  "title" : "contentHuggingPriority(for:)",
  "url" : "https:\/\/developer.apple.com\/documentation\/AppKit\/NSView\/contentHuggingPriority(for:)"
}