{
  "abstract" : "Asks the delegate if a gesture recognizer should attempt to recognize gestures for a particular event.",
  "codeExamples" : [

  ],
  "contentHash" : "72075be635767ccdce1aa794e4c7bc2b83daf25c45543d9473db5f32fc112232",
  "crawledAt" : "2025-12-02T05:16:15Z",
  "declaration" : {
    "code" : "@MainActor optional func gestureRecognizer(_ gestureRecognizer: NSGestureRecognizer, shouldAttemptToRecognizeWith event: NSEvent) -> Bool",
    "language" : "swift"
  },
  "id" : "5A194C4B-ABFA-4F69-8D1A-B420434FD7A6",
  "kind" : "method",
  "module" : "AppKit",
  "overview" : "## Return Value\n\n[doc:\/\/com.apple.documentation\/documentation\/Swift\/true] to allow the gesture recognizer to begin recognizing gestures for the specified event, or [doc:\/\/com.apple.documentation\/documentation\/Swift\/false] to prevent it from recognizing gestures for the specified event. If you do not implement this method, the default return value is [doc:\/\/com.apple.documentation\/documentation\/Swift\/true].\n\n## Discussion\n\nThis method is called when a target view recognizes a new gesture event stream. The target view calls this method to determine whether the gesture recognizer should process events for the stream, or opt out of them. Returning [doc:\/\/com.apple.documentation\/documentation\/Swift\/false] from this method causes the gesture recognizer to opt out, and prevents the other delegate methods from being called for the event stream.",
  "platforms" : [
    "macOS"
  ],
  "rawMarkdown" : "---\nsource: https:\/\/developer.apple.com\/documentation\/AppKit\/NSGestureRecognizerDelegate\/gestureRecognizer(_:shouldAttemptToRecognizeWith:)\ncrawled: 2025-12-02T05:16:15Z\n---\n\n# gestureRecognizer(_:shouldAttemptToRecognizeWith:)\n\n**Instance Method**\n\nAsks the delegate if a gesture recognizer should attempt to recognize gestures for a particular event.\n\n## Declaration\n\n```swift\n@MainActor optional func gestureRecognizer(_ gestureRecognizer: NSGestureRecognizer, shouldAttemptToRecognizeWith event: NSEvent) -> Bool\n```\n\n## Parameters\n\n- **gestureRecognizer**: The gesture recognizer object that is interpreting events. This is the object with which the delegate is associated.\n- **event**: An event object associated with the request.\n\n## Return Value\n\n[doc:\/\/com.apple.documentation\/documentation\/Swift\/true] to allow the gesture recognizer to begin recognizing gestures for the specified event, or [doc:\/\/com.apple.documentation\/documentation\/Swift\/false] to prevent it from recognizing gestures for the specified event. If you do not implement this method, the default return value is [doc:\/\/com.apple.documentation\/documentation\/Swift\/true].\n\n## Discussion\n\nThis method is called when a target view recognizes a new gesture event stream. The target view calls this method to determine whether the gesture recognizer should process events for the stream, or opt out of them. Returning [doc:\/\/com.apple.documentation\/documentation\/Swift\/false] from this method causes the gesture recognizer to opt out, and prevents the other delegate methods from being called for the event stream.\n\n## Regulating Gesture Recognition\n\n- **gestureRecognizerShouldBegin(_:)**: Asks the delegate if a gesture recognizer should transition out of the Possible (`NSGestureRecognizerStatePossible`) state.\n\n",
  "sections" : [
    {
      "content" : "",
      "items" : [
        {
          "description" : "Asks the delegate if a gesture recognizer should transition out of the Possible (`NSGestureRecognizerStatePossible`) state.",
          "name" : "gestureRecognizerShouldBegin(_:)",
          "url" : "https:\/\/developer.apple.com\/documentation\/AppKit\/NSGestureRecognizerDelegate\/gestureRecognizerShouldBegin(_:)"
        }
      ],
      "title" : "Regulating Gesture Recognition"
    }
  ],
  "source" : "appleJSON",
  "title" : "gestureRecognizer(_:shouldAttemptToRecognizeWith:)",
  "url" : "https:\/\/developer.apple.com\/documentation\/AppKit\/NSGestureRecognizerDelegate\/gestureRecognizer(_:shouldAttemptToRecognizeWith:)"
}