{
  "abstract" : "Priority level for the window’s current size.",
  "codeExamples" : [

  ],
  "contentHash" : "2f95e11bc07b2142caece5a7a62cf4efbdb0d8ce0720e3ce48f9b3a19fe3828a",
  "crawledAt" : "2025-12-05T19:48:16Z",
  "declaration" : {
    "code" : "static let windowSizeStayPut: NSLayoutConstraint.Priority",
    "language" : "swift"
  },
  "id" : "44E4DAF7-32C1-4B93-8EEC-E36FAD79978D",
  "kind" : "property",
  "language" : "swift",
  "module" : "AppKit",
  "overview" : "## Discussion\n\nIt’s generally not appropriate to make a constraint at exactly this priority. You want to be higher or lower. Constraints with higher priorities can adjust the window’s size. Constraints with lower priorities must be fulfilled using the current window size.",
  "platforms" : [
    "macOS"
  ],
  "rawMarkdown" : "---\nsource: https:\/\/developer.apple.com\/documentation\/AppKit\/NSLayoutConstraint\/Priority-swift.struct\/windowSizeStayPut\ncrawled: 2025-12-05T19:48:16Z\n---\n\n# windowSizeStayPut\n\n**Type Property**\n\nPriority level for the window’s current size.\n\n## Declaration\n\n```swift\nstatic let windowSizeStayPut: NSLayoutConstraint.Priority\n```\n\n## Discussion\n\nIt’s generally not appropriate to make a constraint at exactly this priority. You want to be higher or lower. Constraints with higher priorities can adjust the window’s size. Constraints with lower priorities must be fulfilled using the current window size.\n\n## Constants\n\n- **required**: A required constraint.\n- **defaultHigh**: Priority level with which a button resists compressing its content.\n- **dragThatCanResizeWindow**: Appropriate priority level for a drag that may end up resizing the window.\n- **dragThatCannotResizeWindow**: Priority level at which a split view divider, say, is dragged.\n- **defaultLow**: Priority level at which a button hugs its contents horizontally.\n- **fittingSizeCompression**: When you send a [doc:\/\/com.apple.appkit\/documentation\/AppKit\/NSView\/fittingSize] message to a view, the smallest size that is large enough for the view’s contents is computed.\n\n",
  "sections" : [
    {
      "content" : "",
      "items" : [
        {
          "description" : "A required constraint.",
          "name" : "required",
          "url" : "https:\/\/developer.apple.com\/documentation\/AppKit\/NSLayoutConstraint\/Priority-swift.struct\/required"
        },
        {
          "description" : "Priority level with which a button resists compressing its content.",
          "name" : "defaultHigh",
          "url" : "https:\/\/developer.apple.com\/documentation\/AppKit\/NSLayoutConstraint\/Priority-swift.struct\/defaultHigh"
        },
        {
          "description" : "Appropriate priority level for a drag that may end up resizing the window.",
          "name" : "dragThatCanResizeWindow",
          "url" : "https:\/\/developer.apple.com\/documentation\/AppKit\/NSLayoutConstraint\/Priority-swift.struct\/dragThatCanResizeWindow"
        },
        {
          "description" : "Priority level at which a split view divider, say, is dragged.",
          "name" : "dragThatCannotResizeWindow",
          "url" : "https:\/\/developer.apple.com\/documentation\/AppKit\/NSLayoutConstraint\/Priority-swift.struct\/dragThatCannotResizeWindow"
        },
        {
          "description" : "Priority level at which a button hugs its contents horizontally.",
          "name" : "defaultLow",
          "url" : "https:\/\/developer.apple.com\/documentation\/AppKit\/NSLayoutConstraint\/Priority-swift.struct\/defaultLow"
        },
        {
          "description" : "When you send a [doc:\/\/com.apple.appkit\/documentation\/AppKit\/NSView\/fittingSize] message to a view, the smallest size that is large enough for the view’s contents is computed.",
          "name" : "fittingSizeCompression",
          "url" : "https:\/\/developer.apple.com\/documentation\/AppKit\/NSLayoutConstraint\/Priority-swift.struct\/fittingSizeCompression"
        }
      ],
      "title" : "Constants"
    }
  ],
  "source" : "appleJSON",
  "title" : "windowSizeStayPut",
  "url" : "https:\/\/developer.apple.com\/documentation\/AppKit\/NSLayoutConstraint\/Priority-swift.struct\/windowSizeStayPut"
}