{
  "abstract" : "Invoked to allow the delegate to control cell expansion for a specific row and column.",
  "codeExamples" : [

  ],
  "contentHash" : "31064e94c6949328114b2657a5764de7e312edf3d6dc437914ac67898a3093c6",
  "crawledAt" : "2025-12-05T21:46:54Z",
  "declaration" : {
    "code" : "@MainActor optional func browser(_ browser: NSBrowser, shouldShowCellExpansionForRow row: Int, column: Int) -> Bool",
    "language" : "swift"
  },
  "id" : "0504ACA9-7E93-4F81-8B54-8872F6B87550",
  "kind" : "method",
  "language" : "swift",
  "module" : "AppKit",
  "overview" : "## Return Value\n\n[doc:\/\/com.apple.documentation\/documentation\/Swift\/true] to allow the cell expansion tooltip; [doc:\/\/com.apple.documentation\/documentation\/Swift\/false] to disallow it.\n\n## Discussion\n\nCell expansion can occur when the mouse hovers over the specified cell and the cell contents are unable to be fully displayed within the cell. If this method returns YES, the full cell contents will be shown in a special floating tool tip view, otherwise the content is truncated.",
  "platforms" : [
    "macOS"
  ],
  "rawMarkdown" : "---\nsource: https:\/\/developer.apple.com\/documentation\/AppKit\/NSBrowserDelegate\/browser(_:shouldShowCellExpansionForRow:column:)\ncrawled: 2025-12-05T21:46:54Z\n---\n\n# browser(_:shouldShowCellExpansionForRow:column:)\n\n**Instance Method**\n\nInvoked to allow the delegate to control cell expansion for a specific row and column.\n\n## Declaration\n\n```swift\n@MainActor optional func browser(_ browser: NSBrowser, shouldShowCellExpansionForRow row: Int, column: Int) -> Bool\n```\n\n## Parameters\n\n- **browser**: The browser.\n- **row**: The index of the row requesting an expansion tooltip.\n- **column**: The index of the column containing the requesting row.\n\n## Return Value\n\n[doc:\/\/com.apple.documentation\/documentation\/Swift\/true] to allow the cell expansion tooltip; [doc:\/\/com.apple.documentation\/documentation\/Swift\/false] to disallow it.\n\n## Discussion\n\nCell expansion can occur when the mouse hovers over the specified cell and the cell contents are unable to be fully displayed within the cell. If this method returns YES, the full cell contents will be shown in a special floating tool tip view, otherwise the content is truncated.\n\n",
  "sections" : [

  ],
  "source" : "appleJSON",
  "title" : "browser(_:shouldShowCellExpansionForRow:column:)",
  "url" : "https:\/\/developer.apple.com\/documentation\/AppKit\/NSBrowserDelegate\/browser(_:shouldShowCellExpansionForRow:column:)"
}