{
  "abstract" : "A Boolean value indicating if the menu bar currently displays the status item.",
  "codeExamples" : [

  ],
  "contentHash" : "cecd5582096a986a61fa43bb1c42352b4fcb2a5cca0e04782d66a8fda818ed50",
  "crawledAt" : "2025-12-02T05:13:44Z",
  "declaration" : {
    "code" : "var isVisible: Bool { get set }",
    "language" : "swift"
  },
  "id" : "54B818F9-D30F-403D-91B7-86CF62ED9A73",
  "kind" : "property",
  "module" : "AppKit",
  "overview" : "## Discussion\n\nSetting this property either shows or hides the status item within the menu bar. The item’s visiblity may also change if the user removes the item manually, and you can watch for changes in visibility using key-value observation. The status item’s visiblity persists and restores automatically based on the value of [doc:\/\/com.apple.appkit\/documentation\/AppKit\/NSStatusItem\/autosaveName-swift.property].\n\nThis property returns [doc:\/\/com.apple.documentation\/documentation\/Swift\/true] even if the status item is temporarily hidden due to insufficient space in the menu bar. The default value is [doc:\/\/com.apple.documentation\/documentation\/Swift\/true].",
  "platforms" : [
    "macOS"
  ],
  "rawMarkdown" : "---\nsource: https:\/\/developer.apple.com\/documentation\/AppKit\/NSStatusItem\/isVisible\ncrawled: 2025-12-02T05:13:44Z\n---\n\n# isVisible\n\n**Instance Property**\n\nA Boolean value indicating if the menu bar currently displays the status item.\n\n## Declaration\n\n```swift\nvar isVisible: Bool { get set }\n```\n\n## Discussion\n\nSetting this property either shows or hides the status item within the menu bar. The item’s visiblity may also change if the user removes the item manually, and you can watch for changes in visibility using key-value observation. The status item’s visiblity persists and restores automatically based on the value of [doc:\/\/com.apple.appkit\/documentation\/AppKit\/NSStatusItem\/autosaveName-swift.property].\n\nThis property returns [doc:\/\/com.apple.documentation\/documentation\/Swift\/true] even if the status item is temporarily hidden due to insufficient space in the menu bar. The default value is [doc:\/\/com.apple.documentation\/documentation\/Swift\/true].\n\n## Configuring the Status Item’s Appearance\n\n- **length**: The amount of space in the status bar that should be allocated to the status item.\n- **squareLength**: A status item length that is equal to the status bar’s thickness.\n- **variableLength**: A status item length that dynamically adjusts to the width of its contents.\n\n",
  "sections" : [
    {
      "content" : "",
      "items" : [
        {
          "description" : "The amount of space in the status bar that should be allocated to the status item.",
          "name" : "length",
          "url" : "https:\/\/developer.apple.com\/documentation\/AppKit\/NSStatusItem\/length"
        },
        {
          "description" : "A status item length that is equal to the status bar’s thickness.",
          "name" : "squareLength",
          "url" : "https:\/\/developer.apple.com\/documentation\/AppKit\/NSStatusItem\/squareLength"
        },
        {
          "description" : "A status item length that dynamically adjusts to the width of its contents.",
          "name" : "variableLength",
          "url" : "https:\/\/developer.apple.com\/documentation\/AppKit\/NSStatusItem\/variableLength"
        }
      ],
      "title" : "Configuring the Status Item’s Appearance"
    }
  ],
  "source" : "appleJSON",
  "title" : "isVisible",
  "url" : "https:\/\/developer.apple.com\/documentation\/AppKit\/NSStatusItem\/isVisible"
}