{
  "abstract" : "Returns a proxy object for the receiver that can be used to initiate implied animation for property changes.",
  "codeExamples" : [

  ],
  "contentHash" : "15b8769146c1ff91fa55862c21fa57d25fab87baac470fdeca7008dbf5427f9b",
  "crawledAt" : "2025-12-03T09:25:07Z",
  "declaration" : {
    "code" : "func animator() -> Self",
    "language" : "swift"
  },
  "id" : "A725E4D5-A2DD-4E25-ABB3-DB3D5BA97605",
  "kind" : "method",
  "language" : "swift",
  "module" : "AppKit",
  "overview" : "## Return Value\n\nReturns a proxy object for the receiver that can initiate implied animations in response to property changes.\n\n## Discussion\n\nThe animator proxy object  should be treated as if it was the receiver itself, and may be passed to any code that accepts the receiver as a parameter.\n\nSending key-value coding compliant “set” messages to the proxy will trigger animation for automatically animated properties of its target object, if the active [doc:\/\/com.apple.appkit\/documentation\/AppKit\/NSAnimationContext] in the current thread has a duration value greater than zero, and an animation for the property key is found by the [doc:\/\/com.apple.appkit\/documentation\/AppKit\/NSAnimatablePropertyContainer] search mechanism.",
  "platforms" : [
    "macOS"
  ],
  "rawMarkdown" : "---\nsource: https:\/\/developer.apple.com\/documentation\/AppKit\/NSAnimatablePropertyContainer\/animator()\ncrawled: 2025-12-03T09:25:07Z\n---\n\n# animator()\n\n**Instance Method**\n\nReturns a proxy object for the receiver that can be used to initiate implied animation for property changes.\n\n## Declaration\n\n```swift\nfunc animator() -> Self\n```\n\n## Return Value\n\nReturns a proxy object for the receiver that can initiate implied animations in response to property changes.\n\n## Discussion\n\nThe animator proxy object  should be treated as if it was the receiver itself, and may be passed to any code that accepts the receiver as a parameter.\n\nSending key-value coding compliant “set” messages to the proxy will trigger animation for automatically animated properties of its target object, if the active [doc:\/\/com.apple.appkit\/documentation\/AppKit\/NSAnimationContext] in the current thread has a duration value greater than zero, and an animation for the property key is found by the [doc:\/\/com.apple.appkit\/documentation\/AppKit\/NSAnimatablePropertyContainer] search mechanism.\n\n",
  "sections" : [

  ],
  "source" : "appleJSON",
  "title" : "animator()",
  "url" : "https:\/\/developer.apple.com\/documentation\/AppKit\/NSAnimatablePropertyContainer\/animator()"
}