{
  "abstract" : "The table view style resolves to a full-width style.",
  "codeExamples" : [

  ],
  "contentHash" : "ada97c1d20ff5144670e83a2c576a7f35c7027a5d682539941896ec03034d11a",
  "crawledAt" : "2025-12-04T19:57:55Z",
  "declaration" : {
    "code" : "case fullWidth",
    "language" : "swift"
  },
  "id" : "D7347DF1-1790-4F03-A106-9EAF8BC83FC9",
  "kind" : "unknown",
  "language" : "swift",
  "module" : "AppKit",
  "overview" : "## Discussion\n\nIn a full-width style table, each row spans the entire width of the table. The full-width style also applies a standard horizontal inset between the edges of the table and its first and last columns.",
  "platforms" : [
    "macOS"
  ],
  "rawMarkdown" : "---\nsource: https:\/\/developer.apple.com\/documentation\/AppKit\/NSTableView\/Style-swift.enum\/fullWidth\ncrawled: 2025-12-04T19:57:55Z\n---\n\n# NSTableView.Style.fullWidth\n\n**Case**\n\nThe table view style resolves to a full-width style.\n\n## Declaration\n\n```swift\ncase fullWidth\n```\n\n## Discussion\n\nIn a full-width style table, each row spans the entire width of the table. The full-width style also applies a standard horizontal inset between the edges of the table and its first and last columns.\n\n## Table Styles\n\n- **NSTableView.Style.automatic**: The system resolves the table view style based on the table view hierarchy.\n- **NSTableView.Style.inset**: The table view style resolves to an inset style.\n- **NSTableView.Style.sourceList**: The table view style resolves to a source-list style.\n- **NSTableView.Style.plain**: The table view style resolves to a plain style.\n\n",
  "sections" : [
    {
      "content" : "",
      "items" : [
        {
          "description" : "The system resolves the table view style based on the table view hierarchy.",
          "name" : "NSTableView.Style.automatic",
          "url" : "https:\/\/developer.apple.com\/documentation\/AppKit\/NSTableView\/Style-swift.enum\/automatic"
        },
        {
          "description" : "The table view style resolves to an inset style.",
          "name" : "NSTableView.Style.inset",
          "url" : "https:\/\/developer.apple.com\/documentation\/AppKit\/NSTableView\/Style-swift.enum\/inset"
        },
        {
          "description" : "The table view style resolves to a source-list style.",
          "name" : "NSTableView.Style.sourceList",
          "url" : "https:\/\/developer.apple.com\/documentation\/AppKit\/NSTableView\/Style-swift.enum\/sourceList"
        },
        {
          "description" : "The table view style resolves to a plain style.",
          "name" : "NSTableView.Style.plain",
          "url" : "https:\/\/developer.apple.com\/documentation\/AppKit\/NSTableView\/Style-swift.enum\/plain"
        }
      ],
      "title" : "Table Styles"
    }
  ],
  "source" : "appleJSON",
  "title" : "NSTableView.Style.fullWidth",
  "url" : "https:\/\/developer.apple.com\/documentation\/AppKit\/NSTableView\/Style-swift.enum\/fullWidth"
}