{
  "abstract" : "Tells the delegate that the user changed the selected directory to the directory located at the specified URL.",
  "codeExamples" : [

  ],
  "contentHash" : "1d7b3149bfc79bc378ee916d003130d92d841826869904f8fea61d0995cbad4e",
  "crawledAt" : "2025-12-04T11:01:03Z",
  "declaration" : {
    "code" : "@MainActor optional func panel(_ sender: Any, didChangeToDirectoryURL url: URL?)",
    "language" : "swift"
  },
  "id" : "AB3276B6-FEBB-49E3-9640-A65F2EFDD062",
  "kind" : "method",
  "language" : "swift",
  "module" : "AppKit",
  "platforms" : [
    "macOS"
  ],
  "rawMarkdown" : "---\nsource: https:\/\/developer.apple.com\/documentation\/AppKit\/NSOpenSavePanelDelegate\/panel(_:didChangeToDirectoryURL:)\ncrawled: 2025-12-04T11:01:03Z\n---\n\n# panel(_:didChangeToDirectoryURL:)\n\n**Instance Method**\n\nTells the delegate that the user changed the selected directory to the directory located at the specified URL.\n\n## Declaration\n\n```swift\n@MainActor optional func panel(_ sender: Any, didChangeToDirectoryURL url: URL?)\n```\n\n## Parameters\n\n- **sender**: The panel whose directory changed.\n- **url**: The URL of the new directory, or `nil` if it canâ€™t be represented by an [doc:\/\/com.apple.documentation\/documentation\/Foundation\/NSURL] object.\n\n## Responding to Panel Changes\n\n- **panelSelectionDidChange(_:)**: Tells the delegate that the user changed the selection in the specified Save panel.\n- **panel(_:willExpand:)**: Tells the delegate that the Save panel is about to expand or collapse because the user clicked the disclosure triangle that displays or hides the file browser.\n\n",
  "sections" : [
    {
      "content" : "",
      "items" : [
        {
          "description" : "Tells the delegate that the user changed the selection in the specified Save panel.",
          "name" : "panelSelectionDidChange(_:)",
          "url" : "https:\/\/developer.apple.com\/documentation\/AppKit\/NSOpenSavePanelDelegate\/panelSelectionDidChange(_:)"
        },
        {
          "description" : "Tells the delegate that the Save panel is about to expand or collapse because the user clicked the disclosure triangle that displays or hides the file browser.",
          "name" : "panel(_:willExpand:)",
          "url" : "https:\/\/developer.apple.com\/documentation\/AppKit\/NSOpenSavePanelDelegate\/panel(_:willExpand:)"
        }
      ],
      "title" : "Responding to Panel Changes"
    }
  ],
  "source" : "appleJSON",
  "title" : "panel(_:didChangeToDirectoryURL:)",
  "url" : "https:\/\/developer.apple.com\/documentation\/AppKit\/NSOpenSavePanelDelegate\/panel(_:didChangeToDirectoryURL:)"
}