{
  "abstract" : "The behavior and progression for a pressure event.",
  "codeExamples" : [

  ],
  "contentHash" : "f34a2f576949269c1c9f60d8dc033ac5e5bd673e2dbcc585a92489891eb720e7",
  "crawledAt" : "2025-12-04T00:09:11Z",
  "declaration" : {
    "code" : "var pressureBehavior: NSEvent.PressureBehavior { get }",
    "language" : "swift"
  },
  "id" : "E683CDF9-590A-4B88-AEA1-DDA1396602C9",
  "kind" : "property",
  "language" : "swift",
  "module" : "AppKit",
  "overview" : "## Discussion\n\nThis property describes the behavior and progression of an event of type [doc:\/\/com.apple.appkit\/documentation\/AppKit\/NSEvent\/EventType\/pressure]. The value of this property indicates how the pressure event behaves, including actuations, pressure-level reporting, and stage transitions.",
  "platforms" : [
    "macOS"
  ],
  "rawMarkdown" : "---\nsource: https:\/\/developer.apple.com\/documentation\/AppKit\/NSEvent\/pressureBehavior-swift.property\ncrawled: 2025-12-04T00:09:11Z\n---\n\n# pressureBehavior\n\n**Instance Property**\n\nThe behavior and progression for a pressure event.\n\n## Declaration\n\n```swift\nvar pressureBehavior: NSEvent.PressureBehavior { get }\n```\n\n## Discussion\n\nThis property describes the behavior and progression of an event of type [doc:\/\/com.apple.appkit\/documentation\/AppKit\/NSEvent\/EventType\/pressure]. The value of this property indicates how the pressure event behaves, including actuations, pressure-level reporting, and stage transitions.\n\n## Related Documentation\n\n- **NSPressureConfiguration**: An encapsulation of the behavior and progression of a Force Touch trackpad as it responds to specific events.\n- **NSEvent.EventType**: Constants for the types of events that responder objects can handle.\n- **NSEvent.EventType.pressure**: An event that reports a change in pressure on a pressure-sensitive device.\n- **init(pressureBehavior:)**: Initializes a pressure configuration object with a specified pressure behavior.\n\n## Getting pressure information\n\n- **pressure**: A normalized value that indicates the degree of pressure applied to an appropriate input device.\n- **stage**: A value that indicates the stage of a pressure gesture event.\n- **stageTransition**: The transition value for the stage of a pressure gesture event.\n- **NSEvent.PressureBehavior**: These constants describe the behavior and progression of a pressure gesture.\n\n",
  "sections" : [
    {
      "content" : "",
      "items" : [
        {
          "description" : "An encapsulation of the behavior and progression of a Force Touch trackpad as it responds to specific events.",
          "name" : "NSPressureConfiguration",
          "url" : "https:\/\/developer.apple.com\/documentation\/AppKit\/NSPressureConfiguration"
        },
        {
          "description" : "Constants for the types of events that responder objects can handle.",
          "name" : "NSEvent.EventType",
          "url" : "https:\/\/developer.apple.com\/documentation\/AppKit\/NSEvent\/EventType"
        },
        {
          "description" : "An event that reports a change in pressure on a pressure-sensitive device.",
          "name" : "NSEvent.EventType.pressure",
          "url" : "https:\/\/developer.apple.com\/documentation\/AppKit\/NSEvent\/EventType\/pressure"
        },
        {
          "description" : "Initializes a pressure configuration object with a specified pressure behavior.",
          "name" : "init(pressureBehavior:)",
          "url" : "https:\/\/developer.apple.com\/documentation\/AppKit\/NSPressureConfiguration\/init(pressureBehavior:)"
        }
      ],
      "title" : "Related Documentation"
    },
    {
      "content" : "",
      "items" : [
        {
          "description" : "A normalized value that indicates the degree of pressure applied to an appropriate input device.",
          "name" : "pressure",
          "url" : "https:\/\/developer.apple.com\/documentation\/AppKit\/NSEvent\/pressure"
        },
        {
          "description" : "A value that indicates the stage of a pressure gesture event.",
          "name" : "stage",
          "url" : "https:\/\/developer.apple.com\/documentation\/AppKit\/NSEvent\/stage"
        },
        {
          "description" : "The transition value for the stage of a pressure gesture event.",
          "name" : "stageTransition",
          "url" : "https:\/\/developer.apple.com\/documentation\/AppKit\/NSEvent\/stageTransition"
        },
        {
          "description" : "These constants describe the behavior and progression of a pressure gesture.",
          "name" : "NSEvent.PressureBehavior",
          "url" : "https:\/\/developer.apple.com\/documentation\/AppKit\/NSEvent\/PressureBehavior-swift.enum"
        }
      ],
      "title" : "Getting pressure information"
    }
  ],
  "source" : "appleJSON",
  "title" : "pressureBehavior",
  "url" : "https:\/\/developer.apple.com\/documentation\/AppKit\/NSEvent\/pressureBehavior-swift.property"
}