{
  "abstract" : "Creates and returns an array of image representation objects initialized using the contents of the specified URL.",
  "codeExamples" : [

  ],
  "contentHash" : "0e2a97c5e39104020b63ceb156924b987237352e9055213141398bc708b5d5dc",
  "crawledAt" : "2025-12-04T03:52:09Z",
  "declaration" : {
    "code" : "class func imageReps(withContentsOf url: URL) -> [NSImageRep]?",
    "language" : "swift"
  },
  "id" : "64797CBD-45DD-4CE7-B5DB-08F36433B446",
  "kind" : "method",
  "language" : "swift",
  "module" : "AppKit",
  "overview" : "## Return Value\n\nAn array of image representation objects. The array contains one object for each image in the data at the specified URL.\n\n## Discussion\n\nIf sent to the `NSImageRep` class object, this method returns an array of objects (all newly allocated instances of a subclass of `NSImageRep`) that have been initialized with the contents of the specified URL. If sent to a subclass of `NSImageRep` that recognizes the data at the specified URL, it returns an array of objects (all instances of that subclass) that have been initialized with the contents of that URL.\n\nThis method returns `nil` in any of the following cases:\n\nThe `NSImageRep` subclass is initialized by creating an `NSData` object based on the contents of the specified URL and passing it to the `imageRepsWithData:` method.",
  "platforms" : [
    "macOS"
  ],
  "rawMarkdown" : "---\nsource: https:\/\/developer.apple.com\/documentation\/AppKit\/NSImageRep\/imageReps(withContentsOf:)\ncrawled: 2025-12-04T03:52:09Z\n---\n\n# imageReps(withContentsOf:)\n\n**Type Method**\n\nCreates and returns an array of image representation objects initialized using the contents of the specified URL.\n\n## Declaration\n\n```swift\nclass func imageReps(withContentsOf url: URL) -> [NSImageRep]?\n```\n\n## Parameters\n\n- **url**: The URL pointing to the image data.\n\n## Return Value\n\nAn array of image representation objects. The array contains one object for each image in the data at the specified URL.\n\n## Discussion\n\nIf sent to the `NSImageRep` class object, this method returns an array of objects (all newly allocated instances of a subclass of `NSImageRep`) that have been initialized with the contents of the specified URL. If sent to a subclass of `NSImageRep` that recognizes the data at the specified URL, it returns an array of objects (all instances of that subclass) that have been initialized with the contents of that URL.\n\nThis method returns `nil` in any of the following cases:\n\n- The message is sent to the `NSImageRep` class object and there are no subclasses in the `NSImageRep` class registry that handle data in the specified URL.\n- The message is sent to a subclass of `NSImageRep` and that subclass cannot handle data in the specified URL.\n- The `NSImageRep` subclass is unable to initialize itself with the contents of the specified URL.\n\nThe `NSImageRep` subclass is initialized by creating an `NSData` object based on the contents of the specified URL and passing it to the `imageRepsWithData:` method.\n\n## Creating Representations of Images\n\n- **imageReps(withContentsOfFile:)**: Creates and returns an array of image representation objects initialized using the contents of the specified file.\n- **imageReps(with:)**: Creates and returns an array of image representation objects initialized using the contents of the pasteboard.\n- **init(contentsOfFile:)**: Creates and returns an image representation object using the contents of the specified file.\n- **init(pasteboard:)**: Creates and returns an image representation object using the contents of the specified pasteboard.\n- **init(contentsOf:)**: Creates and returns an image representation object using the data at the specified URL.\n- **init()**: Creates and returns an image representation object.\n- **init(coder:)**: Creates and returns an image representation object from data in an unarchiver.\n\n",
  "sections" : [
    {
      "content" : "",
      "items" : [
        {
          "description" : "Creates and returns an array of image representation objects initialized using the contents of the specified file.",
          "name" : "imageReps(withContentsOfFile:)",
          "url" : "https:\/\/developer.apple.com\/documentation\/AppKit\/NSImageRep\/imageReps(withContentsOfFile:)"
        },
        {
          "description" : "Creates and returns an array of image representation objects initialized using the contents of the pasteboard.",
          "name" : "imageReps(with:)",
          "url" : "https:\/\/developer.apple.com\/documentation\/AppKit\/NSImageRep\/imageReps(with:)"
        },
        {
          "description" : "Creates and returns an image representation object using the contents of the specified file.",
          "name" : "init(contentsOfFile:)",
          "url" : "https:\/\/developer.apple.com\/documentation\/AppKit\/NSImageRep\/init(contentsOfFile:)"
        },
        {
          "description" : "Creates and returns an image representation object using the contents of the specified pasteboard.",
          "name" : "init(pasteboard:)",
          "url" : "https:\/\/developer.apple.com\/documentation\/AppKit\/NSImageRep\/init(pasteboard:)"
        },
        {
          "description" : "Creates and returns an image representation object using the data at the specified URL.",
          "name" : "init(contentsOf:)",
          "url" : "https:\/\/developer.apple.com\/documentation\/AppKit\/NSImageRep\/init(contentsOf:)"
        },
        {
          "description" : "Creates and returns an image representation object.",
          "name" : "init()",
          "url" : "https:\/\/developer.apple.com\/documentation\/AppKit\/NSImageRep\/init()"
        },
        {
          "description" : "Creates and returns an image representation object from data in an unarchiver.",
          "name" : "init(coder:)",
          "url" : "https:\/\/developer.apple.com\/documentation\/AppKit\/NSImageRep\/init(coder:)"
        }
      ],
      "title" : "Creating Representations of Images"
    }
  ],
  "source" : "appleJSON",
  "title" : "imageReps(withContentsOf:)",
  "url" : "https:\/\/developer.apple.com\/documentation\/AppKit\/NSImageRep\/imageReps(withContentsOf:)"
}