{
  "abstract" : "A number used as the document’s default tab spacing.",
  "codeExamples" : [

  ],
  "contentHash" : "32579f3866c03fb8707fb694a30283274212bf21d0dde711d64c9bdf21790edf",
  "crawledAt" : "2025-12-02T07:27:05Z",
  "declaration" : {
    "code" : "var defaultTabInterval: CGFloat { get set }",
    "language" : "swift"
  },
  "id" : "8AEF016A-E59A-4260-B66C-48E10DEC9989",
  "kind" : "property",
  "module" : "AppKit",
  "overview" : "## Discussion\n\nThis property represents the default tab interval in points. The system places tabs after the last specified in [https:\/\/developer.apple.com\/library\/archive\/#id(tabStops)] at integer multiples of this distance (if positive). Default value is `0.0`.",
  "platforms" : [
    "macOS"
  ],
  "rawMarkdown" : "---\nsource: https:\/\/developer.apple.com\/documentation\/AppKit\/NSMutableParagraphStyle\/defaultTabInterval\ncrawled: 2025-12-02T07:27:05Z\n---\n\n# defaultTabInterval\n\n**Instance Property**\n\nA number used as the document’s default tab spacing.\n\n## Declaration\n\n```swift\nvar defaultTabInterval: CGFloat { get set }\n```\n\n## Discussion\n\nThis property represents the default tab interval in points. The system places tabs after the last specified in [https:\/\/developer.apple.com\/library\/archive\/#id(tabStops)] at integer multiples of this distance (if positive). Default value is `0.0`.\n\n## Specifying tab information\n\n- **addTabStop(_:)**: Adds the specified tab stop to the paragraph.\n- **removeTabStop(_:)**: Removes the first text tab with a location and type equal to the specified tab stop.\n- **tabStops**: The text tab objects that represent the paragraph’s tab stops.\n\n",
  "sections" : [
    {
      "content" : "",
      "items" : [
        {
          "description" : "Adds the specified tab stop to the paragraph.",
          "name" : "addTabStop(_:)",
          "url" : "https:\/\/developer.apple.com\/documentation\/AppKit\/NSMutableParagraphStyle\/addTabStop(_:)"
        },
        {
          "description" : "Removes the first text tab with a location and type equal to the specified tab stop.",
          "name" : "removeTabStop(_:)",
          "url" : "https:\/\/developer.apple.com\/documentation\/AppKit\/NSMutableParagraphStyle\/removeTabStop(_:)"
        },
        {
          "description" : "The text tab objects that represent the paragraph’s tab stops.",
          "name" : "tabStops",
          "url" : "https:\/\/developer.apple.com\/documentation\/AppKit\/NSMutableParagraphStyle\/tabStops"
        }
      ],
      "title" : "Specifying tab information"
    }
  ],
  "source" : "appleJSON",
  "title" : "defaultTabInterval",
  "url" : "https:\/\/developer.apple.com\/documentation\/AppKit\/NSMutableParagraphStyle\/defaultTabInterval"
}