{
  "abstract" : "Sets the string displayed in the receiver when the user isn’t pressing the mouse button.",
  "codeExamples" : [

  ],
  "contentHash" : "47f8e4439e23d80cbb206cdba0bdc248339f1d242d3a73d9dfe2482f8f6b5a7b",
  "crawledAt" : "2025-12-03T08:35:38Z",
  "declaration" : {
    "code" : "@MainActor func setTitle(_ string: String)",
    "language" : "swift"
  },
  "id" : "F65CCD33-5857-4348-9DDC-81E1F3A96DC3",
  "kind" : "method",
  "language" : "swift",
  "module" : "AppKit",
  "overview" : "## Discussion\n\nIf the receiver displays a pop-up menu, this method changes the current item to be the item with the specified title, adding a new item by that name if one does not already exist. If the receiver displays a pull-down list, this method sets its title to the specified string.",
  "platforms" : [
    "macOS"
  ],
  "rawMarkdown" : "---\nsource: https:\/\/developer.apple.com\/documentation\/AppKit\/NSPopUpButton\/setTitle(_:)\ncrawled: 2025-12-03T08:35:38Z\n---\n\n# setTitle(_:)\n\n**Instance Method**\n\nSets the string displayed in the receiver when the user isn’t pressing the mouse button.\n\n## Declaration\n\n```swift\n@MainActor func setTitle(_ string: String)\n```\n\n## Parameters\n\n- **string**: The string to display.\n\n## Discussion\n\nIf the receiver displays a pop-up menu, this method changes the current item to be the item with the specified title, adding a new item by that name if one does not already exist. If the receiver displays a pull-down list, this method sets its title to the specified string.\n\n",
  "sections" : [

  ],
  "source" : "appleJSON",
  "title" : "setTitle(_:)",
  "url" : "https:\/\/developer.apple.com\/documentation\/AppKit\/NSPopUpButton\/setTitle(_:)"
}