{
  "abstract" : "Returns the classes that support secure coding.",
  "codeExamples" : [

  ],
  "contentHash" : "c4b24f44b32284765be9aa3f621a43c3c5cfca0c73d3d196caa4f5cdb6deb51b",
  "crawledAt" : "2025-12-03T08:56:06Z",
  "declaration" : {
    "code" : "@MainActor class func allowedClasses(forRestorableStateKeyPath keyPath: String) -> [AnyClass]",
    "language" : "swift"
  },
  "id" : "95013A9D-11F1-4A2C-B3C1-00FF76A3299C",
  "kind" : "method",
  "language" : "swift",
  "module" : "AppKit",
  "overview" : "## Return Value\n\nAn array of classes that support secure coding.\n\n## Discussion\n\nThe system calls the function during a secure state restoration and restores values only for the allowed classes your app returns in the array.",
  "platforms" : [
    "macOS"
  ],
  "rawMarkdown" : "---\nsource: https:\/\/developer.apple.com\/documentation\/AppKit\/NSResponder\/allowedClasses(forRestorableStateKeyPath:)\ncrawled: 2025-12-03T08:56:06Z\n---\n\n# allowedClasses(forRestorableStateKeyPath:)\n\n**Type Method**\n\nReturns the classes that support secure coding.\n\n## Declaration\n\n```swift\n@MainActor class func allowedClasses(forRestorableStateKeyPath keyPath: String) -> [AnyClass]\n```\n\n## Parameters\n\n- **keyPath**: The key path of the restorable object.\n\n## Return Value\n\nAn array of classes that support secure coding.\n\n## Discussion\n\nThe system calls the function during a secure state restoration and restores values only for the allowed classes your app returns in the array.\n\n## Handling Window Restoration\n\n- **encodeRestorableState(with:)**: Saves the interface-related state of the responder.\n- **encodeRestorableState(with:backgroundQueue:)**: Saves the interface-related state of the responder to a keyed archiver either synchronously or asynchronously on the given operation queue.\n- **restoreState(with:)**: Restores the interface-related state of the responder.\n- **restorableStateKeyPaths**: Returns an array of key paths representing the restorable attributes of the responder.\n- **invalidateRestorableState()**: Marks the responder’s interface-related state as dirty.\n\n",
  "sections" : [
    {
      "content" : "",
      "items" : [
        {
          "description" : "Saves the interface-related state of the responder.",
          "name" : "encodeRestorableState(with:)",
          "url" : "https:\/\/developer.apple.com\/documentation\/AppKit\/NSResponder\/encodeRestorableState(with:)"
        },
        {
          "description" : "Saves the interface-related state of the responder to a keyed archiver either synchronously or asynchronously on the given operation queue.",
          "name" : "encodeRestorableState(with:backgroundQueue:)",
          "url" : "https:\/\/developer.apple.com\/documentation\/AppKit\/NSResponder\/encodeRestorableState(with:backgroundQueue:)"
        },
        {
          "description" : "Restores the interface-related state of the responder.",
          "name" : "restoreState(with:)",
          "url" : "https:\/\/developer.apple.com\/documentation\/AppKit\/NSResponder\/restoreState(with:)"
        },
        {
          "description" : "Returns an array of key paths representing the restorable attributes of the responder.",
          "name" : "restorableStateKeyPaths",
          "url" : "https:\/\/developer.apple.com\/documentation\/AppKit\/NSResponder\/restorableStateKeyPaths"
        },
        {
          "description" : "Marks the responder’s interface-related state as dirty.",
          "name" : "invalidateRestorableState()",
          "url" : "https:\/\/developer.apple.com\/documentation\/AppKit\/NSResponder\/invalidateRestorableState()"
        }
      ],
      "title" : "Handling Window Restoration"
    }
  ],
  "source" : "appleJSON",
  "title" : "allowedClasses(forRestorableStateKeyPath:)",
  "url" : "https:\/\/developer.apple.com\/documentation\/AppKit\/NSResponder\/allowedClasses(forRestorableStateKeyPath:)"
}