{
  "abstract" : "Presents an Open dialog and delivers the results to a completion handler as an array of URLs for the chosen files, or nil.",
  "codeExamples" : [

  ],
  "contentHash" : "878df3dceebb391d8dbb7d67e96ad091af575cbe5a4e1f5883aec3247e9c1d2a",
  "crawledAt" : "2025-12-02T18:09:54Z",
  "declaration" : {
    "code" : "@MainActor func beginOpenPanel(completionHandler: @escaping ([URL]?) -> Void)",
    "language" : "swift"
  },
  "id" : "287217C7-BFAF-42D2-B44B-C2F11E3C0580",
  "kind" : "method",
  "language" : "swift",
  "module" : "AppKit",
  "overview" : "## Discussion\n\nThis method presents either a modal or nonmodal open panel, depending on which methods are overridden. Although you can call this method in other circumstances, this method is most commonly called by [doc:\/\/com.apple.appkit\/documentation\/AppKit\/NSDocumentController\/openDocument(_:)] in response to the user choosing Open… from the File menu.\n\nIf you override [doc:\/\/com.apple.appkit\/documentation\/AppKit\/NSDocumentController\/openDocument(_:)], you should typically call this method instead of calling [doc:\/\/com.apple.appkit\/documentation\/AppKit\/NSDocumentController\/beginOpenPanel(_:forTypes:completionHandler:)] or [doc:\/\/com.apple.appkit\/documentation\/AppKit\/NSDocumentController\/urlsFromRunningOpenPanel()] directly, because this method runs the modal panel in a way that is backwards compatible with subclasses that override [doc:\/\/com.apple.appkit\/documentation\/AppKit\/NSDocumentController\/runModalOpenPanel(_:forTypes:)] without overriding [doc:\/\/com.apple.appkit\/documentation\/AppKit\/NSDocumentController\/beginOpenPanel(_:forTypes:completionHandler:)]. Also, its completion handler determines which button the user pressed (to determine whether to return the array or `nil`) and orders out the open panel.\n\nYou can override this method to change the open panel presentation (adding an accessory view, for example) or change the UTI array that limits which files are selectable.\n\nThe default implementation of this method calls either [doc:\/\/com.apple.appkit\/documentation\/AppKit\/NSDocumentController\/urlsFromRunningOpenPanel()] to run a modal open panel or [doc:\/\/com.apple.appkit\/documentation\/AppKit\/NSDocumentController\/beginOpenPanel(_:forTypes:completionHandler:)] to begin a nonmodal open panel. If the user chooses to open files, the default implementation calls the completion handler with a `nil` array parameter. If the user cancels the Open dialog, the default implementation calls the completion handler with a `nil` array parameter.\n\nIf you override this method, your method should typically call the underlying method on `super` because of the additional code that it provides for free. Specifically, this method runs the modal panel in a way that is backwards compatible with subclasses that override [doc:\/\/com.apple.appkit\/documentation\/AppKit\/NSDocumentController\/runModalOpenPanel(_:forTypes:)] without overriding [doc:\/\/com.apple.appkit\/documentation\/AppKit\/NSDocumentController\/beginOpenPanel(_:forTypes:completionHandler:)]. Also, its completion handler determines which button the user pressed (to determine whether to return the array or `nil`) and orders out the open panel.",
  "platforms" : [
    "macOS"
  ],
  "rawMarkdown" : "---\nsource: https:\/\/developer.apple.com\/documentation\/AppKit\/NSDocumentController\/beginOpenPanel(completionHandler:)\ncrawled: 2025-12-02T18:09:54Z\n---\n\n# beginOpenPanel(completionHandler:)\n\n**Instance Method**\n\nPresents an Open dialog and delivers the results to a completion handler as an array of URLs for the chosen files, or nil.\n\n## Declaration\n\n```swift\n@MainActor func beginOpenPanel(completionHandler: @escaping ([URL]?) -> Void)\n```\n\n```swift\n@MainActor func beginOpenPanel() async -> [URL]?\n```\n\n## Parameters\n\n- **completionHandler**: The completion handler that is called when the user clicks the OK or Cancel button in the open panel.\n\n## Discussion\n\nThis method presents either a modal or nonmodal open panel, depending on which methods are overridden. Although you can call this method in other circumstances, this method is most commonly called by [doc:\/\/com.apple.appkit\/documentation\/AppKit\/NSDocumentController\/openDocument(_:)] in response to the user choosing Open… from the File menu.\n\nIf you override [doc:\/\/com.apple.appkit\/documentation\/AppKit\/NSDocumentController\/openDocument(_:)], you should typically call this method instead of calling [doc:\/\/com.apple.appkit\/documentation\/AppKit\/NSDocumentController\/beginOpenPanel(_:forTypes:completionHandler:)] or [doc:\/\/com.apple.appkit\/documentation\/AppKit\/NSDocumentController\/urlsFromRunningOpenPanel()] directly, because this method runs the modal panel in a way that is backwards compatible with subclasses that override [doc:\/\/com.apple.appkit\/documentation\/AppKit\/NSDocumentController\/runModalOpenPanel(_:forTypes:)] without overriding [doc:\/\/com.apple.appkit\/documentation\/AppKit\/NSDocumentController\/beginOpenPanel(_:forTypes:completionHandler:)]. Also, its completion handler determines which button the user pressed (to determine whether to return the array or `nil`) and orders out the open panel.\n\nYou can override this method to change the open panel presentation (adding an accessory view, for example) or change the UTI array that limits which files are selectable.\n\nThe default implementation of this method calls either [doc:\/\/com.apple.appkit\/documentation\/AppKit\/NSDocumentController\/urlsFromRunningOpenPanel()] to run a modal open panel or [doc:\/\/com.apple.appkit\/documentation\/AppKit\/NSDocumentController\/beginOpenPanel(_:forTypes:completionHandler:)] to begin a nonmodal open panel. If the user chooses to open files, the default implementation calls the completion handler with a `nil` array parameter. If the user cancels the Open dialog, the default implementation calls the completion handler with a `nil` array parameter.\n\nIf you override this method, your method should typically call the underlying method on `super` because of the additional code that it provides for free. Specifically, this method runs the modal panel in a way that is backwards compatible with subclasses that override [doc:\/\/com.apple.appkit\/documentation\/AppKit\/NSDocumentController\/runModalOpenPanel(_:forTypes:)] without overriding [doc:\/\/com.apple.appkit\/documentation\/AppKit\/NSDocumentController\/beginOpenPanel(_:forTypes:completionHandler:)]. Also, its completion handler determines which button the user pressed (to determine whether to return the array or `nil`) and orders out the open panel.\n\n## Managing the Open Dialog\n\n- **beginOpenPanel(_:forTypes:completionHandler:)**: Presents a nonmodal Open dialog that displays files you can open from a list of UTIs.\n- **runModalOpenPanel(_:forTypes:)**: Presents a modal Open dialog and limits selection to specific file types.\n- **currentDirectory**: The directory path to use as the starting point in the Open dialog.\n- **urlsFromRunningOpenPanel()**: An array of URLs that correspond to the selected files in a running Open dialog.\n\n",
  "sections" : [
    {
      "content" : "",
      "items" : [
        {
          "description" : "Presents a nonmodal Open dialog that displays files you can open from a list of UTIs.",
          "name" : "beginOpenPanel(_:forTypes:completionHandler:)",
          "url" : "https:\/\/developer.apple.com\/documentation\/AppKit\/NSDocumentController\/beginOpenPanel(_:forTypes:completionHandler:)"
        },
        {
          "description" : "Presents a modal Open dialog and limits selection to specific file types.",
          "name" : "runModalOpenPanel(_:forTypes:)",
          "url" : "https:\/\/developer.apple.com\/documentation\/AppKit\/NSDocumentController\/runModalOpenPanel(_:forTypes:)"
        },
        {
          "description" : "The directory path to use as the starting point in the Open dialog.",
          "name" : "currentDirectory",
          "url" : "https:\/\/developer.apple.com\/documentation\/AppKit\/NSDocumentController\/currentDirectory"
        },
        {
          "description" : "An array of URLs that correspond to the selected files in a running Open dialog.",
          "name" : "urlsFromRunningOpenPanel()",
          "url" : "https:\/\/developer.apple.com\/documentation\/AppKit\/NSDocumentController\/urlsFromRunningOpenPanel()"
        }
      ],
      "title" : "Managing the Open Dialog"
    }
  ],
  "source" : "appleJSON",
  "title" : "beginOpenPanel(completionHandler:)",
  "url" : "https:\/\/developer.apple.com\/documentation\/AppKit\/NSDocumentController\/beginOpenPanel(completionHandler:)"
}