{
  "abstract" : "Invoked when the user resizes the drawer or parent.",
  "codeExamples" : [

  ],
  "contentHash" : "39a0f97616120318fcc4328d62b4258b9e4f21989f6ce023a3c8b7a58eaa0f8d",
  "crawledAt" : "2025-12-04T12:56:39Z",
  "declaration" : {
    "code" : "optional func drawerWillResizeContents(_ sender: NSDrawer, to contentSize: NSSize) -> NSSize",
    "language" : "swift"
  },
  "id" : "5BFF679B-0963-4757-B983-BF9510DD5708",
  "kind" : "method",
  "language" : "swift",
  "module" : "AppKit",
  "overview" : "## Return Value\n\nThe size that the drawer should be resized to. To resize to a different size, simply return the desired size from this method; to avoid resizing, return the current size.\n\n## Discussion\n\nThe receiver’s minimum and maximum size constraints have already been applied when this method is invoked. While the user is resizing an `NSDrawer` or its parent, the delegate is sent a series of `windowWillResize` messages as the `NSDrawer` or parent window is dragged.",
  "platforms" : [
    "macOS"
  ],
  "rawMarkdown" : "---\nsource: https:\/\/developer.apple.com\/documentation\/AppKit\/NSDrawerDelegate\/drawerWillResizeContents(_:to:)\ncrawled: 2025-12-04T12:56:39Z\n---\n\n# drawerWillResizeContents(_:to:)\n\n**Instance Method**\n\nInvoked when the user resizes the drawer or parent.\n\n## Declaration\n\n```swift\noptional func drawerWillResizeContents(_ sender: NSDrawer, to contentSize: NSSize) -> NSSize\n```\n\n## Parameters\n\n- **sender**: The drawer being resized.\n- **contentSize**: The proposed new size of the drawer.\n\n## Return Value\n\nThe size that the drawer should be resized to. To resize to a different size, simply return the desired size from this method; to avoid resizing, return the current size.\n\n## Discussion\n\nThe receiver’s minimum and maximum size constraints have already been applied when this method is invoked. While the user is resizing an `NSDrawer` or its parent, the delegate is sent a series of `windowWillResize` messages as the `NSDrawer` or parent window is dragged.\n\n",
  "sections" : [

  ],
  "source" : "appleJSON",
  "title" : "drawerWillResizeContents(_:to:)",
  "url" : "https:\/\/developer.apple.com\/documentation\/AppKit\/NSDrawerDelegate\/drawerWillResizeContents(_:to:)"
}