{
  "abstract" : "The string displayed by the button when it’s in its alternate state.",
  "codeExamples" : [

  ],
  "contentHash" : "137bcc079e8db197a2654e6fdc94f1ffe59d9eaff9ee948fc494edf62d791728",
  "crawledAt" : "2025-12-03T23:55:38Z",
  "declaration" : {
    "code" : "@MainActor var alternateTitle: String { get set }",
    "language" : "swift"
  },
  "id" : "6230D6EC-94B1-4EE3-8683-687B1256401C",
  "kind" : "property",
  "language" : "swift",
  "module" : "AppKit",
  "overview" : "## Discussion\n\nThe value of this property is the string that appears on the button when it’s in its alternate state, or the empty string if the button doesn’t display an alternate title. Note that some button types don’t display an alternate title. By default, a button’s alternate title is “Button.”",
  "platforms" : [
    "macOS"
  ],
  "rawMarkdown" : "---\nsource: https:\/\/developer.apple.com\/documentation\/AppKit\/NSButtonCell\/alternateTitle\ncrawled: 2025-12-03T23:55:38Z\n---\n\n# alternateTitle\n\n**Instance Property**\n\nThe string displayed by the button when it’s in its alternate state.\n\n## Declaration\n\n```swift\n@MainActor var alternateTitle: String { get set }\n```\n\n## Discussion\n\nThe value of this property is the string that appears on the button when it’s in its alternate state, or the empty string if the button doesn’t display an alternate title. Note that some button types don’t display an alternate title. By default, a button’s alternate title is “Button.”\n\n## Related Documentation\n\n- **font**: The font that the cell uses to display text.\n- **setButtonType(_:)**: Sets how the button highlights while pressed and how it shows its state.\n\n## Setting Titles\n\n- **attributedAlternateTitle**: The title displayed by the button when it’s in its alternate state, as an attributed string.\n- **attributedTitle**: The title displayed by the button when it’s in its normal state as an attributed string.\n- **title**: The title displayed on the button when it’s in its normal state.\n\n",
  "sections" : [
    {
      "content" : "",
      "items" : [
        {
          "description" : "The font that the cell uses to display text.",
          "name" : "font",
          "url" : "https:\/\/developer.apple.com\/documentation\/AppKit\/NSCell\/font"
        },
        {
          "description" : "Sets how the button highlights while pressed and how it shows its state.",
          "name" : "setButtonType(_:)",
          "url" : "https:\/\/developer.apple.com\/documentation\/AppKit\/NSButtonCell\/setButtonType(_:)"
        }
      ],
      "title" : "Related Documentation"
    },
    {
      "content" : "",
      "items" : [
        {
          "description" : "The title displayed by the button when it’s in its alternate state, as an attributed string.",
          "name" : "attributedAlternateTitle",
          "url" : "https:\/\/developer.apple.com\/documentation\/AppKit\/NSButtonCell\/attributedAlternateTitle"
        },
        {
          "description" : "The title displayed by the button when it’s in its normal state as an attributed string.",
          "name" : "attributedTitle",
          "url" : "https:\/\/developer.apple.com\/documentation\/AppKit\/NSButtonCell\/attributedTitle"
        },
        {
          "description" : "The title displayed on the button when it’s in its normal state.",
          "name" : "title",
          "url" : "https:\/\/developer.apple.com\/documentation\/AppKit\/NSButtonCell\/title"
        }
      ],
      "title" : "Setting Titles"
    }
  ],
  "source" : "appleJSON",
  "title" : "alternateTitle",
  "url" : "https:\/\/developer.apple.com\/documentation\/AppKit\/NSButtonCell\/alternateTitle"
}