{
  "abstract" : "Return the identifier of the view controller that owns a view to display the object.",
  "codeExamples" : [

  ],
  "contentHash" : "0f7db936593118c10503713ae7aec35e46ac95c4afa3b63feeb0d563f7f765b8",
  "crawledAt" : "2025-12-04T19:47:30Z",
  "declaration" : {
    "code" : "@MainActor optional func pageController(_ pageController: NSPageController, identifierFor object: Any) -> NSPageController.ObjectIdentifier",
    "language" : "swift"
  },
  "id" : "FD419845-8FB1-490C-ABD1-782E455E04D7",
  "kind" : "method",
  "language" : "swift",
  "module" : "AppKit",
  "overview" : "## Return Value\n\nReturns a string identifier for the view controller for the specified object.\n\n## Discussion\n\nIf `pageController` does not have an unused view controller for this identifier, the you will be asked to create one via [doc:\/\/com.apple.appkit\/documentation\/AppKit\/NSPageControllerDelegate\/pageController(_:viewControllerForIdentifier:)].",
  "platforms" : [
    "macOS"
  ],
  "rawMarkdown" : "---\nsource: https:\/\/developer.apple.com\/documentation\/AppKit\/NSPageControllerDelegate\/pageController(_:identifierFor:)\ncrawled: 2025-12-04T19:47:30Z\n---\n\n# pageController(_:identifierFor:)\n\n**Instance Method**\n\nReturn the identifier of the view controller that owns a view to display the object.\n\n## Declaration\n\n```swift\n@MainActor optional func pageController(_ pageController: NSPageController, identifierFor object: Any) -> NSPageController.ObjectIdentifier\n```\n\n## Parameters\n\n- **pageController**: The page controller.\n- **object**: The object to display.\n\n## Return Value\n\nReturns a string identifier for the view controller for the specified object.\n\n## Discussion\n\nIf `pageController` does not have an unused view controller for this identifier, the you will be asked to create one via [doc:\/\/com.apple.appkit\/documentation\/AppKit\/NSPageControllerDelegate\/pageController(_:viewControllerForIdentifier:)].\n\n## Managing View Controllers\n\n- **pageController(_:viewControllerForIdentifier:)**: Returns a view controller the page controller uses for managing the specified identifier.\n- **pageController(_:prepare:with:)**: Prepare the view controller and it’s view for drawing.\n- **pageController(_:frameFor:)**: Returns the frame appropriate for displaying the specified object.\n- **NSPageController.ObjectIdentifier**\n\n",
  "sections" : [
    {
      "content" : "",
      "items" : [
        {
          "description" : "Returns a view controller the page controller uses for managing the specified identifier.",
          "name" : "pageController(_:viewControllerForIdentifier:)",
          "url" : "https:\/\/developer.apple.com\/documentation\/AppKit\/NSPageControllerDelegate\/pageController(_:viewControllerForIdentifier:)"
        },
        {
          "description" : "Prepare the view controller and it’s view for drawing.",
          "name" : "pageController(_:prepare:with:)",
          "url" : "https:\/\/developer.apple.com\/documentation\/AppKit\/NSPageControllerDelegate\/pageController(_:prepare:with:)"
        },
        {
          "description" : "Returns the frame appropriate for displaying the specified object.",
          "name" : "pageController(_:frameFor:)",
          "url" : "https:\/\/developer.apple.com\/documentation\/AppKit\/NSPageControllerDelegate\/pageController(_:frameFor:)"
        },
        {
          "description" : "",
          "name" : "NSPageController.ObjectIdentifier",
          "url" : "https:\/\/developer.apple.com\/documentation\/AppKit\/NSPageController\/ObjectIdentifier"
        }
      ],
      "title" : "Managing View Controllers"
    }
  ],
  "source" : "appleJSON",
  "title" : "pageController(_:identifierFor:)",
  "url" : "https:\/\/developer.apple.com\/documentation\/AppKit\/NSPageControllerDelegate\/pageController(_:identifierFor:)"
}