{
  "abstract" : "The color of the shadow.",
  "codeExamples" : [

  ],
  "contentHash" : "dc2743e2d8d8cbe38fde294e9e25885d846fee98263256308ec30239e3813bea",
  "crawledAt" : "2025-12-04T11:07:26Z",
  "declaration" : {
    "code" : "@NSCopying var shadowColor: NSColor? { get set }",
    "language" : "swift"
  },
  "id" : "A63FCF78-B470-401D-8B0A-6E1F8370D6E7",
  "kind" : "property",
  "language" : "swift",
  "module" : "AppKit",
  "overview" : "## Discussion\n\nThe default shadow color is black with an alpha of 1\/3. If you set this property to `nil`, the shadow is not drawn. The color you specify must be convertible to an RGBA color and may contain alpha information.",
  "platforms" : [
    "macOS"
  ],
  "rawMarkdown" : "---\nsource: https:\/\/developer.apple.com\/documentation\/AppKit\/NSShadow\/shadowColor\ncrawled: 2025-12-04T11:07:26Z\n---\n\n# shadowColor\n\n**Instance Property**\n\nThe color of the shadow.\n\n## Declaration\n\n```swift\n@NSCopying var shadowColor: NSColor? { get set }\n```\n\n## Discussion\n\nThe default shadow color is black with an alpha of 1\/3. If you set this property to `nil`, the shadow is not drawn. The color you specify must be convertible to an RGBA color and may contain alpha information.\n\n## Managing a shadow\n\n- **shadowOffset**: The shadow’s relative position, which you specify with horizontal and vertical offset values.\n- **shadowBlurRadius**: The blur radius of the shadow.\n\n",
  "sections" : [
    {
      "content" : "",
      "items" : [
        {
          "description" : "The shadow’s relative position, which you specify with horizontal and vertical offset values.",
          "name" : "shadowOffset",
          "url" : "https:\/\/developer.apple.com\/documentation\/AppKit\/NSShadow\/shadowOffset"
        },
        {
          "description" : "The blur radius of the shadow.",
          "name" : "shadowBlurRadius",
          "url" : "https:\/\/developer.apple.com\/documentation\/AppKit\/NSShadow\/shadowBlurRadius"
        }
      ],
      "title" : "Managing a shadow"
    }
  ],
  "source" : "appleJSON",
  "title" : "shadowColor",
  "url" : "https:\/\/developer.apple.com\/documentation\/AppKit\/NSShadow\/shadowColor"
}