{
  "abstract" : "The Print panel that queries the user for information about a print job.",
  "codeExamples" : [

  ],
  "conformsTo" : [
    "CVarArg",
    "CustomDebugStringConvertible",
    "CustomStringConvertible",
    "Equatable",
    "Hashable",
    "NSObjectProtocol",
    "Sendable"
  ],
  "contentHash" : "e7035ea1e7ab8a77cf26d7d58ccf8d1a950426a55528eacecf7c6fa6926721fc",
  "crawledAt" : "2025-12-03T05:53:44Z",
  "declaration" : {
    "code" : "@MainActor class NSPrintPanel",
    "language" : "swift"
  },
  "id" : "3809B33E-B340-4343-A2CE-72D0E907788C",
  "kind" : "class",
  "language" : "swift",
  "module" : "AppKit",
  "overview" : "## Overview\n\nA Print panel may let the user select the range of pages to print and the number of copies before executing the Print command. Print panels can display a simplified interface when printing certain types of data. For example, the panel can display a list of print-setting presets, which lets the user enable print settings in groups as opposed to individually. Assigning an appropriate string to the [doc:\/\/com.apple.appkit\/documentation\/AppKit\/NSPrintPanel\/jobStyleHint-swift.property] property activates the simplified interface and identifies which presets to display.\n\nFor design guidance, see [https:\/\/developer.apple.com\/design\/human-interface-guidelines\/macos\/system-capabilities\/printing\/].",
  "platforms" : [
    "macOS"
  ],
  "rawMarkdown" : "---\nsource: https:\/\/developer.apple.com\/documentation\/AppKit\/NSPrintPanel\ncrawled: 2025-12-03T05:53:44Z\n---\n\n# NSPrintPanel\n\n**Class**\n\nThe Print panel that queries the user for information about a print job.\n\n## Declaration\n\n```swift\n@MainActor class NSPrintPanel\n```\n\n## Overview\n\nA Print panel may let the user select the range of pages to print and the number of copies before executing the Print command. Print panels can display a simplified interface when printing certain types of data. For example, the panel can display a list of print-setting presets, which lets the user enable print settings in groups as opposed to individually. Assigning an appropriate string to the [doc:\/\/com.apple.appkit\/documentation\/AppKit\/NSPrintPanel\/jobStyleHint-swift.property] property activates the simplified interface and identifies which presets to display.\n\nFor design guidance, see [https:\/\/developer.apple.com\/design\/human-interface-guidelines\/macos\/system-capabilities\/printing\/].\n\n## Customizing the Panel\n\n- **jobStyleHint**: The type of settings that the print panel displays.\n- **NSPrintPanel.JobStyleHint**: Constants that specify job style hints for activating the simplified Print panel interface and setting the options to display.\n- **options**: The current configuration options for the Print panel.\n- **NSPrintPanel.Options**: Constants that specify options for configuring the contents of the main Print panel.\n- **defaultButtonTitle()**: Returns the title of the Print panel’s default button.\n- **setDefaultButtonTitle(_:)**: Sets the title of the Print panel’s default button.\n- **helpAnchor**: The HTML help anchor associated with the Print panel.\n\n## Managing Accessory Views\n\n- **addAccessoryController(_:)**: Adds a custom controller to the Print panel to manage an accessory view.\n- **removeAccessoryController(_:)**: Removes the specified controller and accessory view from the Print panel.\n- **NSPrintPanelAccessorizing**: A set of methods that a Print panel object can use to get information from a printing accessory controller.\n- **accessoryControllers**: The array of controller objects that manage the Print panel’s accessory views.\n\n## Running the Panel\n\n- **beginSheet(using:on:completionHandler:)**\n- **beginSheet(with:modalFor:delegate:didEnd:contextInfo:)**: Displays a Print panel sheet and runs it modally for the specified window.\n- **runModal()**: Displays the Print panel and begins the modal loop.\n- **runModal(with:)**: Displays the Print panel and runs the modal loop using the specified printing information.\n\n## Accessing the Printing Information\n\n- **printInfo**: The information associated with the running Print panel.\n- **NSPrintInfo**: An object that stores information that’s used to generate printed output.\n- **NSPrintPanel.Result**\n\n## Print Panels\n\n- **NSPageLayout**: A panel that queries the user for information such as paper type and orientation.\n\n## Inherits From\n\n- NSObject\n\n## Conforms To\n\n- CVarArg\n- CustomDebugStringConvertible\n- CustomStringConvertible\n- Equatable\n- Hashable\n- NSObjectProtocol\n- Sendable\n\n",
  "sections" : [
    {
      "content" : "",
      "items" : [
        {
          "description" : "The type of settings that the print panel displays.",
          "name" : "jobStyleHint",
          "url" : "https:\/\/developer.apple.com\/documentation\/AppKit\/NSPrintPanel\/jobStyleHint-swift.property"
        },
        {
          "description" : "Constants that specify job style hints for activating the simplified Print panel interface and setting the options to display.",
          "name" : "NSPrintPanel.JobStyleHint",
          "url" : "https:\/\/developer.apple.com\/documentation\/AppKit\/NSPrintPanel\/JobStyleHint-swift.struct"
        },
        {
          "description" : "The current configuration options for the Print panel.",
          "name" : "options",
          "url" : "https:\/\/developer.apple.com\/documentation\/AppKit\/NSPrintPanel\/options-swift.property"
        },
        {
          "description" : "Constants that specify options for configuring the contents of the main Print panel.",
          "name" : "NSPrintPanel.Options",
          "url" : "https:\/\/developer.apple.com\/documentation\/AppKit\/NSPrintPanel\/Options-swift.struct"
        },
        {
          "description" : "Returns the title of the Print panel’s default button.",
          "name" : "defaultButtonTitle()",
          "url" : "https:\/\/developer.apple.com\/documentation\/AppKit\/NSPrintPanel\/defaultButtonTitle()"
        },
        {
          "description" : "Sets the title of the Print panel’s default button.",
          "name" : "setDefaultButtonTitle(_:)",
          "url" : "https:\/\/developer.apple.com\/documentation\/AppKit\/NSPrintPanel\/setDefaultButtonTitle(_:)"
        },
        {
          "description" : "The HTML help anchor associated with the Print panel.",
          "name" : "helpAnchor",
          "url" : "https:\/\/developer.apple.com\/documentation\/AppKit\/NSPrintPanel\/helpAnchor"
        }
      ],
      "title" : "Customizing the Panel"
    },
    {
      "content" : "",
      "items" : [
        {
          "description" : "Adds a custom controller to the Print panel to manage an accessory view.",
          "name" : "addAccessoryController(_:)",
          "url" : "https:\/\/developer.apple.com\/documentation\/AppKit\/NSPrintPanel\/addAccessoryController(_:)"
        },
        {
          "description" : "Removes the specified controller and accessory view from the Print panel.",
          "name" : "removeAccessoryController(_:)",
          "url" : "https:\/\/developer.apple.com\/documentation\/AppKit\/NSPrintPanel\/removeAccessoryController(_:)"
        },
        {
          "description" : "A set of methods that a Print panel object can use to get information from a printing accessory controller.",
          "name" : "NSPrintPanelAccessorizing",
          "url" : "https:\/\/developer.apple.com\/documentation\/AppKit\/NSPrintPanelAccessorizing"
        },
        {
          "description" : "The array of controller objects that manage the Print panel’s accessory views.",
          "name" : "accessoryControllers",
          "url" : "https:\/\/developer.apple.com\/documentation\/AppKit\/NSPrintPanel\/accessoryControllers"
        }
      ],
      "title" : "Managing Accessory Views"
    },
    {
      "content" : "",
      "items" : [
        {
          "description" : "",
          "name" : "beginSheet(using:on:completionHandler:)",
          "url" : "https:\/\/developer.apple.com\/documentation\/AppKit\/NSPrintPanel\/beginSheet(using:on:completionHandler:)"
        },
        {
          "description" : "Displays a Print panel sheet and runs it modally for the specified window.",
          "name" : "beginSheet(with:modalFor:delegate:didEnd:contextInfo:)",
          "url" : "https:\/\/developer.apple.com\/documentation\/AppKit\/NSPrintPanel\/beginSheet(with:modalFor:delegate:didEnd:contextInfo:)"
        },
        {
          "description" : "Displays the Print panel and begins the modal loop.",
          "name" : "runModal()",
          "url" : "https:\/\/developer.apple.com\/documentation\/AppKit\/NSPrintPanel\/runModal()"
        },
        {
          "description" : "Displays the Print panel and runs the modal loop using the specified printing information.",
          "name" : "runModal(with:)",
          "url" : "https:\/\/developer.apple.com\/documentation\/AppKit\/NSPrintPanel\/runModal(with:)"
        }
      ],
      "title" : "Running the Panel"
    },
    {
      "content" : "",
      "items" : [
        {
          "description" : "The information associated with the running Print panel.",
          "name" : "printInfo",
          "url" : "https:\/\/developer.apple.com\/documentation\/AppKit\/NSPrintPanel\/printInfo"
        },
        {
          "description" : "An object that stores information that’s used to generate printed output.",
          "name" : "NSPrintInfo",
          "url" : "https:\/\/developer.apple.com\/documentation\/AppKit\/NSPrintInfo"
        },
        {
          "description" : "",
          "name" : "NSPrintPanel.Result",
          "url" : "https:\/\/developer.apple.com\/documentation\/AppKit\/NSPrintPanel\/Result"
        }
      ],
      "title" : "Accessing the Printing Information"
    },
    {
      "content" : "",
      "items" : [
        {
          "description" : "A panel that queries the user for information such as paper type and orientation.",
          "name" : "NSPageLayout",
          "url" : "https:\/\/developer.apple.com\/documentation\/AppKit\/NSPageLayout"
        }
      ],
      "title" : "Print Panels"
    },
    {
      "content" : "",
      "items" : [
        {
          "name" : "NSObject"
        }
      ],
      "title" : "Inherits From"
    }
  ],
  "source" : "appleJSON",
  "title" : "NSPrintPanel",
  "url" : "https:\/\/developer.apple.com\/documentation\/AppKit\/NSPrintPanel"
}