{
  "abstract" : "Marks the key view loop as “dirty” and in need of recalculation.",
  "codeExamples" : [

  ],
  "contentHash" : "7838d750aff849e2dcd1f14a78c65445f495d1e65319ed9fcb00e2c0f9484e20",
  "crawledAt" : "2025-12-03T08:55:36Z",
  "declaration" : {
    "code" : "@MainActor func recalculateKeyViewLoop()",
    "language" : "swift"
  },
  "id" : "50276B6B-E6DB-45F2-9CBC-A2244E8B3225",
  "kind" : "method",
  "language" : "swift",
  "module" : "AppKit",
  "overview" : "## Discussion\n\nThe key view loop is recalculated the next time someone requests the next or previous key view of the window. The recalculated loop is based on the geometric order of the views in the window.\n\nIf you don’t want to maintain the key view loop of your window manually, you can use this method to do it for you. When it’s first loaded, `NSWindow` calls this method automatically if your window doesn’t have a key view loop already established. If you add or remove views later, you can call this method manually to update the window’s key view loop. You can also set the [doc:\/\/com.apple.appkit\/documentation\/AppKit\/NSWindow\/autorecalculatesKeyViewLoop] property to have the window recalculate the loop automatically.",
  "platforms" : [
    "macOS"
  ],
  "rawMarkdown" : "---\nsource: https:\/\/developer.apple.com\/documentation\/AppKit\/NSWindow\/recalculateKeyViewLoop()\ncrawled: 2025-12-03T08:55:36Z\n---\n\n# recalculateKeyViewLoop()\n\n**Instance Method**\n\nMarks the key view loop as “dirty” and in need of recalculation.\n\n## Declaration\n\n```swift\n@MainActor func recalculateKeyViewLoop()\n```\n\n## Discussion\n\nThe key view loop is recalculated the next time someone requests the next or previous key view of the window. The recalculated loop is based on the geometric order of the views in the window.\n\nIf you don’t want to maintain the key view loop of your window manually, you can use this method to do it for you. When it’s first loaded, `NSWindow` calls this method automatically if your window doesn’t have a key view loop already established. If you add or remove views later, you can call this method manually to update the window’s key view loop. You can also set the [doc:\/\/com.apple.appkit\/documentation\/AppKit\/NSWindow\/autorecalculatesKeyViewLoop] property to have the window recalculate the loop automatically.\n\n## Managing the Key View Loop\n\n- **selectKeyView(preceding:)**: Gives key view status to the view that precedes the given view.\n- **selectKeyView(following:)**: Gives key view status to the view that follows the given view.\n- **selectPreviousKeyView(_:)**: Searches for a candidate previous key view and, if it finds one, tries to make it the first responder.\n- **selectNextKeyView(_:)**: Searches for a candidate next key view and, if it finds one, tries to make it the first responder.\n- **keyViewSelectionDirection**: The direction the window is currently using to change the key view.\n- **autorecalculatesKeyViewLoop**: A Boolean value that indicates whether the window automatically recalculates the key view loop when views are added.\n\n",
  "sections" : [
    {
      "content" : "",
      "items" : [
        {
          "description" : "Gives key view status to the view that precedes the given view.",
          "name" : "selectKeyView(preceding:)",
          "url" : "https:\/\/developer.apple.com\/documentation\/AppKit\/NSWindow\/selectKeyView(preceding:)"
        },
        {
          "description" : "Gives key view status to the view that follows the given view.",
          "name" : "selectKeyView(following:)",
          "url" : "https:\/\/developer.apple.com\/documentation\/AppKit\/NSWindow\/selectKeyView(following:)"
        },
        {
          "description" : "Searches for a candidate previous key view and, if it finds one, tries to make it the first responder.",
          "name" : "selectPreviousKeyView(_:)",
          "url" : "https:\/\/developer.apple.com\/documentation\/AppKit\/NSWindow\/selectPreviousKeyView(_:)"
        },
        {
          "description" : "Searches for a candidate next key view and, if it finds one, tries to make it the first responder.",
          "name" : "selectNextKeyView(_:)",
          "url" : "https:\/\/developer.apple.com\/documentation\/AppKit\/NSWindow\/selectNextKeyView(_:)"
        },
        {
          "description" : "The direction the window is currently using to change the key view.",
          "name" : "keyViewSelectionDirection",
          "url" : "https:\/\/developer.apple.com\/documentation\/AppKit\/NSWindow\/keyViewSelectionDirection"
        },
        {
          "description" : "A Boolean value that indicates whether the window automatically recalculates the key view loop when views are added.",
          "name" : "autorecalculatesKeyViewLoop",
          "url" : "https:\/\/developer.apple.com\/documentation\/AppKit\/NSWindow\/autorecalculatesKeyViewLoop"
        }
      ],
      "title" : "Managing the Key View Loop"
    }
  ],
  "source" : "appleJSON",
  "title" : "recalculateKeyViewLoop()",
  "url" : "https:\/\/developer.apple.com\/documentation\/AppKit\/NSWindow\/recalculateKeyViewLoop()"
}