{
  "abstract" : "The minimum width of the menu in screen coordinates.",
  "codeExamples" : [

  ],
  "contentHash" : "2c3de9857e79b784348be9957ee1712286464d81be2c6f5f35039459b6c66135",
  "crawledAt" : "2025-12-04T01:31:39Z",
  "declaration" : {
    "code" : "var minimumWidth: CGFloat { get set }",
    "language" : "swift"
  },
  "id" : "925A39B7-4810-46ED-B731-EF30ABD069CA",
  "kind" : "property",
  "language" : "swift",
  "module" : "AppKit",
  "overview" : "## Discussion\n\nThis property contains a value of type `CGFloat`, indicating the minimum width of the menu in screen coordinates.\n\nThe menu will not draw smaller than its minimum width, but may draw larger if it needs more space. The default value for this property is `0`.",
  "platforms" : [
    "macOS"
  ],
  "rawMarkdown" : "---\nsource: https:\/\/developer.apple.com\/documentation\/AppKit\/NSMenu\/minimumWidth\ncrawled: 2025-12-04T01:31:39Z\n---\n\n# minimumWidth\n\n**Instance Property**\n\nThe minimum width of the menu in screen coordinates.\n\n## Declaration\n\n```swift\nvar minimumWidth: CGFloat { get set }\n```\n\n## Discussion\n\nThis property contains a value of type `CGFloat`, indicating the minimum width of the menu in screen coordinates.\n\nThe menu will not draw smaller than its minimum width, but may draw larger if it needs more space. The default value for this property is `0`.\n\n## Configuring Menu Size\n\n- **size**: The size of the menu in screen coordinates\n\n",
  "sections" : [
    {
      "content" : "",
      "items" : [
        {
          "description" : "The size of the menu in screen coordinates",
          "name" : "size",
          "url" : "https:\/\/developer.apple.com\/documentation\/AppKit\/NSMenu\/size"
        }
      ],
      "title" : "Configuring Menu Size"
    }
  ],
  "source" : "appleJSON",
  "title" : "minimumWidth",
  "url" : "https:\/\/developer.apple.com\/documentation\/AppKit\/NSMenu\/minimumWidth"
}