{
  "abstract" : "The mode for breaking lines in the paragraph.",
  "codeExamples" : [

  ],
  "contentHash" : "107b3a4c3a6917159764fc8742f66cab7bf089b9416fffd92e5b45b590352753",
  "crawledAt" : "2025-12-05T12:24:10Z",
  "declaration" : {
    "code" : "var lineBreakMode: NSLineBreakMode { get set }",
    "language" : "swift"
  },
  "id" : "0E134C2A-125B-45A4-9260-B5E0119615A3",
  "kind" : "property",
  "language" : "swift",
  "module" : "AppKit",
  "overview" : "## Discussion\n\nThis property controls how the text system lays out lines that don’t fit in its container, such as by truncating with an ellipsis (…) or clipping the text. This is different from [doc:\/\/com.apple.appkit\/documentation\/AppKit\/NSParagraphStyle\/LineBreakStrategy-swift.struct] , which controls where the system places line breaks in a paragraph.",
  "platforms" : [
    "macOS"
  ],
  "rawMarkdown" : "---\nsource: https:\/\/developer.apple.com\/documentation\/appkit\/nsmutableparagraphstyle\/linebreakmode\ncrawled: 2025-12-05T12:24:10Z\n---\n\n# lineBreakMode\n\n**Instance Property**\n\nThe mode for breaking lines in the paragraph.\n\n## Declaration\n\n```swift\nvar lineBreakMode: NSLineBreakMode { get set }\n```\n\n## Discussion\n\nThis property controls how the text system lays out lines that don’t fit in its container, such as by truncating with an ellipsis (…) or clipping the text. This is different from [doc:\/\/com.apple.appkit\/documentation\/AppKit\/NSParagraphStyle\/LineBreakStrategy-swift.struct] , which controls where the system places line breaks in a paragraph.\n\n## Setting line-break information\n\n- **lineBreakStrategy**: The strategies that the text system may use to break lines while laying out the paragraph.\n- **hyphenationFactor**: The paragraph’s threshold for hyphenation.\n- **usesDefaultHyphenation**\n- **tighteningFactorForTruncation**: The threshold for using tightening as an alternative to truncation.\n- **allowsDefaultTighteningForTruncation**: A Boolean value that indicates whether the system tightens intercharacter spacing before truncating text.\n\n",
  "sections" : [
    {
      "content" : "",
      "items" : [
        {
          "description" : "The strategies that the text system may use to break lines while laying out the paragraph.",
          "name" : "lineBreakStrategy",
          "url" : "https:\/\/developer.apple.com\/documentation\/AppKit\/NSMutableParagraphStyle\/lineBreakStrategy"
        },
        {
          "description" : "The paragraph’s threshold for hyphenation.",
          "name" : "hyphenationFactor",
          "url" : "https:\/\/developer.apple.com\/documentation\/AppKit\/NSMutableParagraphStyle\/hyphenationFactor"
        },
        {
          "description" : "",
          "name" : "usesDefaultHyphenation",
          "url" : "https:\/\/developer.apple.com\/documentation\/AppKit\/NSMutableParagraphStyle\/usesDefaultHyphenation"
        },
        {
          "description" : "The threshold for using tightening as an alternative to truncation.",
          "name" : "tighteningFactorForTruncation",
          "url" : "https:\/\/developer.apple.com\/documentation\/AppKit\/NSMutableParagraphStyle\/tighteningFactorForTruncation"
        },
        {
          "description" : "A Boolean value that indicates whether the system tightens intercharacter spacing before truncating text.",
          "name" : "allowsDefaultTighteningForTruncation",
          "url" : "https:\/\/developer.apple.com\/documentation\/AppKit\/NSMutableParagraphStyle\/allowsDefaultTighteningForTruncation"
        }
      ],
      "title" : "Setting line-break information"
    }
  ],
  "source" : "appleJSON",
  "title" : "lineBreakMode",
  "url" : "https:\/\/developer.apple.com\/documentation\/appkit\/nsmutableparagraphstyle\/linebreakmode"
}