{
  "abstract" : "Returns a Boolean value that indicates if the app successfully recreates the specified activity.",
  "codeExamples" : [

  ],
  "contentHash" : "d5f8e792c8465a5a535e13ba1631dd7d5665225d989a5467b46549636d2f4381",
  "crawledAt" : "2025-12-04T12:07:02Z",
  "declaration" : {
    "code" : "@MainActor optional func application(_ application: NSApplication, continue userActivity: NSUserActivity, restorationHandler: @escaping ([any NSUserActivityRestoring]) -> Void) -> Bool",
    "language" : "swift"
  },
  "id" : "A60314E0-C8E0-4EEF-ADC5-DC15DD9A8511",
  "kind" : "method",
  "language" : "swift",
  "module" : "AppKit",
  "overview" : "## Return Value\n\n[doc:\/\/com.apple.documentation\/documentation\/Swift\/true] if this method handled continuing the activity; [doc:\/\/com.apple.documentation\/documentation\/Swift\/false] to have AppKit attempt to continue the activity.\n\n## Discussion\n\nThe app calls this method when it receives the data associated with the user activity. Use the data stored in the `NSUserActivity` object to re-create the user’s activity. This method is your opportunity to update your app so that it can perform the associated task.\n\nIf this user activity object was created automatically by having `NSUbiquitousDocumentUserActivityType` in a `CFBundleDocumentTypes` entry, AppKit can automatically restore the [doc:\/\/com.apple.documentation\/documentation\/Foundation\/NSUserActivity] in macOS if this method returns [doc:\/\/com.apple.documentation\/documentation\/Swift\/false], or if it is unimplemented. It does this by creating a document of the appropriate type using the URL stored in the [doc:\/\/com.apple.documentation\/documentation\/Foundation\/NSUserActivity\/userInfo] dictionary under the `NSUserActivityDocumentURLKey`. The system calls the [doc:\/\/com.apple.appkit\/documentation\/AppKit\/NSDocument] method [doc:\/\/com.apple.appkit\/documentation\/AppKit\/NSUserActivityRestoring\/restoreUserActivityState(_:)] on the document.",
  "platforms" : [
    "macOS"
  ],
  "rawMarkdown" : "---\nsource: https:\/\/developer.apple.com\/documentation\/AppKit\/NSApplicationDelegate\/application(_:continue:restorationHandler:)\ncrawled: 2025-12-04T12:07:02Z\n---\n\n# application(_:continue:restorationHandler:)\n\n**Instance Method**\n\nReturns a Boolean value that indicates if the app successfully recreates the specified activity.\n\n## Declaration\n\n```swift\n@MainActor optional func application(_ application: NSApplication, continue userActivity: NSUserActivity, restorationHandler: @escaping ([any NSUserActivityRestoring]) -> Void) -> Bool\n```\n\n## Parameters\n\n- **application**: The app continuing the user activity.\n- **userActivity**: The activity object containing the data associated with the task the user was performing. Use the data in this object to recreate what the user was doing.\n- **restorationHandler**: A block to execute if your app creates or fetches objects to perform the task. Calling this block is optional and is only needed when specific objects are capable of continuing the activity. You can copy this block and call it at a later time. When calling a saved copy of the block, you must call it from the app’s main thread. This block has no return value and takes the following parameter:\n\n\n\n## Return Value\n\n[doc:\/\/com.apple.documentation\/documentation\/Swift\/true] if this method handled continuing the activity; [doc:\/\/com.apple.documentation\/documentation\/Swift\/false] to have AppKit attempt to continue the activity.\n\n## Discussion\n\nThe app calls this method when it receives the data associated with the user activity. Use the data stored in the `NSUserActivity` object to re-create the user’s activity. This method is your opportunity to update your app so that it can perform the associated task.\n\nIf this user activity object was created automatically by having `NSUbiquitousDocumentUserActivityType` in a `CFBundleDocumentTypes` entry, AppKit can automatically restore the [doc:\/\/com.apple.documentation\/documentation\/Foundation\/NSUserActivity] in macOS if this method returns [doc:\/\/com.apple.documentation\/documentation\/Swift\/false], or if it is unimplemented. It does this by creating a document of the appropriate type using the URL stored in the [doc:\/\/com.apple.documentation\/documentation\/Foundation\/NSUserActivity\/userInfo] dictionary under the `NSUserActivityDocumentURLKey`. The system calls the [doc:\/\/com.apple.appkit\/documentation\/AppKit\/NSDocument] method [doc:\/\/com.apple.appkit\/documentation\/AppKit\/NSUserActivityRestoring\/restoreUserActivityState(_:)] on the document.\n\n## Continuing User Activities\n\n- **application(_:willContinueUserActivityWithType:)**: Returns a Boolean value that indicates if the app can continue the specified activity.\n- **application(_:didFailToContinueUserActivityWithType:error:)**: Tells the delegate that the app couldn’t continue the specified activity.\n- **application(_:didUpdate:)**: Tells the delegate that there are changes to the specified activity.\n\n",
  "sections" : [
    {
      "content" : "",
      "items" : [
        {
          "description" : "Returns a Boolean value that indicates if the app can continue the specified activity.",
          "name" : "application(_:willContinueUserActivityWithType:)",
          "url" : "https:\/\/developer.apple.com\/documentation\/AppKit\/NSApplicationDelegate\/application(_:willContinueUserActivityWithType:)"
        },
        {
          "description" : "Tells the delegate that the app couldn’t continue the specified activity.",
          "name" : "application(_:didFailToContinueUserActivityWithType:error:)",
          "url" : "https:\/\/developer.apple.com\/documentation\/AppKit\/NSApplicationDelegate\/application(_:didFailToContinueUserActivityWithType:error:)"
        },
        {
          "description" : "Tells the delegate that there are changes to the specified activity.",
          "name" : "application(_:didUpdate:)",
          "url" : "https:\/\/developer.apple.com\/documentation\/AppKit\/NSApplicationDelegate\/application(_:didUpdate:)"
        }
      ],
      "title" : "Continuing User Activities"
    }
  ],
  "source" : "appleJSON",
  "title" : "application(_:continue:restorationHandler:)",
  "url" : "https:\/\/developer.apple.com\/documentation\/AppKit\/NSApplicationDelegate\/application(_:continue:restorationHandler:)"
}