{
  "abstract" : "Returns the list of file types supported directly by the image representation.",
  "codeExamples" : [
    {
      "code" : "+ (NSArray *)imageUnfilteredFileTypes {\n    static NSArray *types = nil;\n \n    if (!types) types = [[NSArray alloc]\n        initWithObjects:@\"tiff\", @\"gif\", @\"jpg\",  @\"bmp\", nil];\n    return types;\n}",
      "language" : "objc"
    }
  ],
  "contentHash" : "5dbef2cdc6e81aeb20931e7bc5c9ed8117d550bb06c660c4ce68a002a2a7de74",
  "crawledAt" : "2025-12-04T03:52:19Z",
  "declaration" : {
    "code" : "class func imageUnfilteredFileTypes() -> [String]",
    "language" : "swift"
  },
  "id" : "63C8DEF6-E1D0-4044-BEBA-16EBB647CE79",
  "kind" : "method",
  "language" : "swift",
  "module" : "AppKit",
  "overview" : "## Return Value\n\nAn array of `NSString` objects. This array is empty by default. Subclasses must override to return the list of file formats they support.\n\n## Discussion\n\nThe returned file types can include encoded HFS file types as well as filename extensions. When creating a subclass of `NSImageRep`, override this method to return a list of strings representing the supported file types. For example, the `NSBitmapImageRep` class implements code similar to the following for this method:\n\nIf your subclass supports the types supported by its superclass, you must explicitly get the array of types from the superclass and put them in the array returned by this method.",
  "platforms" : [
    "macOS"
  ],
  "rawMarkdown" : "---\nsource: https:\/\/developer.apple.com\/documentation\/AppKit\/NSImageRep\/imageUnfilteredFileTypes()\ncrawled: 2025-12-04T03:52:19Z\n---\n\n# imageUnfilteredFileTypes()\n\n**Type Method**\n\nReturns the list of file types supported directly by the image representation.\n\n## Declaration\n\n```swift\nclass func imageUnfilteredFileTypes() -> [String]\n```\n\n## Return Value\n\nAn array of `NSString` objects. This array is empty by default. Subclasses must override to return the list of file formats they support.\n\n## Discussion\n\nThe returned file types can include encoded HFS file types as well as filename extensions. When creating a subclass of `NSImageRep`, override this method to return a list of strings representing the supported file types. For example, the `NSBitmapImageRep` class implements code similar to the following for this method:\n\n```objc\n+ (NSArray *)imageUnfilteredFileTypes {\n    static NSArray *types = nil;\n \n    if (!types) types = [[NSArray alloc]\n        initWithObjects:@\"tiff\", @\"gif\", @\"jpg\",  @\"bmp\", nil];\n    return types;\n}\n```\n\nIf your subclass supports the types supported by its superclass, you must explicitly get the array of types from the superclass and put them in the array returned by this method.\n\n## Related Documentation\n\n- **imageUnfilteredFileTypes()**: Returns an array of strings identifying the file types supported directly by the registered image representation objects.\n\n## Determining Types for Images\n\n- **canInit(with:)**: Returns a Boolean value that indicates whether the image representation can initialize itself from the specified data.\n- **canInit(with:)**: Returns a Boolean value that indicates whether the receiver can initialize itself from the data on the specified pasteboard.\n- **imageTypes**: Returns an array of UTI strings identifying the image types supported by the image representation, either directly or through a user-installed filter service.\n- **imageUnfilteredTypes**: Returns an array of UTI strings identifying the image types supported directly by the ime representation.\n- **imageFileTypes()**: Returns the file types supported by the image representation class or one of its subclasses.\n- **imagePasteboardTypes()**: Returns the pasteboard types supported by the image representation class or one of its subclasses.\n- **imageUnfilteredPasteboardTypes()**: Returns the list of pasteboard types supported directly by the image representation.\n\n",
  "sections" : [
    {
      "content" : "",
      "items" : [
        {
          "description" : "Returns an array of strings identifying the file types supported directly by the registered image representation objects.",
          "name" : "imageUnfilteredFileTypes()",
          "url" : "https:\/\/developer.apple.com\/documentation\/AppKit\/NSImage\/imageUnfilteredFileTypes()"
        }
      ],
      "title" : "Related Documentation"
    },
    {
      "content" : "",
      "items" : [
        {
          "description" : "Returns a Boolean value that indicates whether the image representation can initialize itself from the specified data.",
          "name" : "canInit(with:)",
          "url" : "https:\/\/developer.apple.com\/documentation\/AppKit\/NSImageRep\/canInit(with:)-6zv56"
        },
        {
          "description" : "Returns a Boolean value that indicates whether the receiver can initialize itself from the data on the specified pasteboard.",
          "name" : "canInit(with:)",
          "url" : "https:\/\/developer.apple.com\/documentation\/AppKit\/NSImageRep\/canInit(with:)-56pum"
        },
        {
          "description" : "Returns an array of UTI strings identifying the image types supported by the image representation, either directly or through a user-installed filter service.",
          "name" : "imageTypes",
          "url" : "https:\/\/developer.apple.com\/documentation\/AppKit\/NSImageRep\/imageTypes"
        },
        {
          "description" : "Returns an array of UTI strings identifying the image types supported directly by the ime representation.",
          "name" : "imageUnfilteredTypes",
          "url" : "https:\/\/developer.apple.com\/documentation\/AppKit\/NSImageRep\/imageUnfilteredTypes"
        },
        {
          "description" : "Returns the file types supported by the image representation class or one of its subclasses.",
          "name" : "imageFileTypes()",
          "url" : "https:\/\/developer.apple.com\/documentation\/AppKit\/NSImageRep\/imageFileTypes()"
        },
        {
          "description" : "Returns the pasteboard types supported by the image representation class or one of its subclasses.",
          "name" : "imagePasteboardTypes()",
          "url" : "https:\/\/developer.apple.com\/documentation\/AppKit\/NSImageRep\/imagePasteboardTypes()"
        },
        {
          "description" : "Returns the list of pasteboard types supported directly by the image representation.",
          "name" : "imageUnfilteredPasteboardTypes()",
          "url" : "https:\/\/developer.apple.com\/documentation\/AppKit\/NSImageRep\/imageUnfilteredPasteboardTypes()"
        }
      ],
      "title" : "Determining Types for Images"
    }
  ],
  "source" : "appleJSON",
  "title" : "imageUnfilteredFileTypes()",
  "url" : "https:\/\/developer.apple.com\/documentation\/AppKit\/NSImageRep\/imageUnfilteredFileTypes()"
}