{
  "abstract" : "A layout object that lets you combine items in highly adaptive and flexible visual arrangements.",
  "codeExamples" : [
    {
      "code" : "func createBasicListLayout() -> NSCollectionViewLayout {\n    let itemSize = NSCollectionLayoutSize(widthDimension: .fractionalWidth(1.0),\n                                         heightDimension: .fractionalHeight(1.0))\n    let item = NSCollectionLayoutItem(layoutSize: itemSize)\n  \n    let groupSize = NSCollectionLayoutSize(widthDimension: .fractionalWidth(1.0),\n                                          heightDimension: .absolute(44))\n    let group = NSCollectionLayoutGroup.horizontal(layoutSize: groupSize,\n                                                     subitems: [item])\n  \n    let section = NSCollectionLayoutSection(group: group)\n\n    let layout = NSCollectionViewCompositionalLayout(section: section)\n    return layout\n}",
      "language" : "swift"
    }
  ],
  "conformsTo" : [
    "CVarArg",
    "CustomDebugStringConvertible",
    "CustomStringConvertible",
    "Equatable",
    "Hashable",
    "NSCoding",
    "NSObjectProtocol",
    "Sendable",
    "SendableMetatype"
  ],
  "contentHash" : "2ba51d31e6f58df59b567af46717bcfedbf8a24d0a182160b57add0981923fdb",
  "crawledAt" : "2025-12-04T10:55:23Z",
  "declaration" : {
    "code" : "@MainActor class NSCollectionViewCompositionalLayout",
    "language" : "swift"
  },
  "id" : "3BE14DD1-FEAF-4301-8E14-D4062A2E8A26",
  "kind" : "class",
  "language" : "swift",
  "module" : "AppKit",
  "overview" : "## Overview\n\nA compositional layout is a type of collection view layout. It’s designed to be composable, flexible, and fast, letting you build any kind of visual arrangement for your content by combining—or compositing—each smaller component into a full layout.\n\nA compositional layout is composed of one or more sections that break up the layout into distinct visual groupings. Each section is composed of groups of individual items, the smallest unit of data you want to present. A group might lay out its items in a horizontal row, a vertical column, or a custom arrangement.\n\nYou combine the components by building up from items into a group, from groups into a section, and finally into a full layout, like in this example of a basic list layout:",
  "platforms" : [
    "macOS"
  ],
  "rawMarkdown" : "---\nsource: https:\/\/developer.apple.com\/documentation\/AppKit\/NSCollectionViewCompositionalLayout\ncrawled: 2025-12-04T10:55:23Z\n---\n\n# NSCollectionViewCompositionalLayout\n\n**Class**\n\nA layout object that lets you combine items in highly adaptive and flexible visual arrangements.\n\n## Declaration\n\n```swift\n@MainActor class NSCollectionViewCompositionalLayout\n```\n\n## Overview\n\nA compositional layout is a type of collection view layout. It’s designed to be composable, flexible, and fast, letting you build any kind of visual arrangement for your content by combining—or compositing—each smaller component into a full layout.\n\nA compositional layout is composed of one or more sections that break up the layout into distinct visual groupings. Each section is composed of groups of individual items, the smallest unit of data you want to present. A group might lay out its items in a horizontal row, a vertical column, or a custom arrangement.\n\nYou combine the components by building up from items into a group, from groups into a section, and finally into a full layout, like in this example of a basic list layout:\n\n```swift\nfunc createBasicListLayout() -> NSCollectionViewLayout {\n    let itemSize = NSCollectionLayoutSize(widthDimension: .fractionalWidth(1.0),\n                                         heightDimension: .fractionalHeight(1.0))\n    let item = NSCollectionLayoutItem(layoutSize: itemSize)\n  \n    let groupSize = NSCollectionLayoutSize(widthDimension: .fractionalWidth(1.0),\n                                          heightDimension: .absolute(44))\n    let group = NSCollectionLayoutGroup.horizontal(layoutSize: groupSize,\n                                                     subitems: [item])\n  \n    let section = NSCollectionLayoutSection(group: group)\n\n    let layout = NSCollectionViewCompositionalLayout(section: section)\n    return layout\n}\n```\n\n## Creating a Layout\n\n- **init(section:)**: Creates a compositional layout object with a single section.\n- **init(section:configuration:)**: Creates a compositional layout object with a single section and an additional configuration.\n- **init(sectionProvider:)**: Creates a compositional layout object with a section provider to supply the layout’s sections.\n- **init(sectionProvider:configuration:)**: Creates a compositional layout object with a section provider and an additional configuration.\n\n## Configuring the Layout\n\n- **configuration**: The layout’s configuration, such as its scroll direction and section spacing.\n\n## Layouts\n\n- **Implementing modern collection views**: Bring compositional layouts to your app and simplify updating your user interface with diffable data sources.\n- **NSCollectionViewFlowLayout**: A layout that organizes items into a flexible and configurable arrangement.\n- **NSCollectionViewDelegateFlowLayout**: A set of methods that a delegate implements to provide layout information to a flow layout object in a collection view.\n- **NSCollectionViewGridLayout**: A layout that displays a single section of items in a row and column grid.\n- **NSCollectionViewTransitionLayout**: An object that implements custom behaviors when changing from one layout to another in a collection view.\n- **NSCollectionViewLayoutAttributes**: An object that contains layout-related attributes for an element in a collection view.\n- **NSCollectionViewLayout**: An abstract base class that you subclass and use to generate layout information for a collection view.\n- **NSCollectionViewCompositionalLayoutConfiguration**: An object that defines scroll direction, section spacing, and headers or footers for the layout.\n- **NSCollectionViewCompositionalLayoutSectionProvider**: A closure that creates and returns each of the layout’s sections.\n- **NSCollectionLayoutSectionOrthogonalScrollingBehavior**: The scrolling behavior of the layout’s sections in relation to the main layout axis.\n\n## Inherits From\n\n- NSCollectionViewLayout\n\n## Conforms To\n\n- CVarArg\n- CustomDebugStringConvertible\n- CustomStringConvertible\n- Equatable\n- Hashable\n- NSCoding\n- NSObjectProtocol\n- Sendable\n- SendableMetatype\n\n",
  "sections" : [
    {
      "content" : "",
      "items" : [
        {
          "description" : "Creates a compositional layout object with a single section.",
          "name" : "init(section:)",
          "url" : "https:\/\/developer.apple.com\/documentation\/AppKit\/NSCollectionViewCompositionalLayout\/init(section:)"
        },
        {
          "description" : "Creates a compositional layout object with a single section and an additional configuration.",
          "name" : "init(section:configuration:)",
          "url" : "https:\/\/developer.apple.com\/documentation\/AppKit\/NSCollectionViewCompositionalLayout\/init(section:configuration:)"
        },
        {
          "description" : "Creates a compositional layout object with a section provider to supply the layout’s sections.",
          "name" : "init(sectionProvider:)",
          "url" : "https:\/\/developer.apple.com\/documentation\/AppKit\/NSCollectionViewCompositionalLayout\/init(sectionProvider:)"
        },
        {
          "description" : "Creates a compositional layout object with a section provider and an additional configuration.",
          "name" : "init(sectionProvider:configuration:)",
          "url" : "https:\/\/developer.apple.com\/documentation\/AppKit\/NSCollectionViewCompositionalLayout\/init(sectionProvider:configuration:)"
        }
      ],
      "title" : "Creating a Layout"
    },
    {
      "content" : "",
      "items" : [
        {
          "description" : "The layout’s configuration, such as its scroll direction and section spacing.",
          "name" : "configuration",
          "url" : "https:\/\/developer.apple.com\/documentation\/AppKit\/NSCollectionViewCompositionalLayout\/configuration"
        }
      ],
      "title" : "Configuring the Layout"
    },
    {
      "content" : "",
      "items" : [
        {
          "description" : "Bring compositional layouts to your app and simplify updating your user interface with diffable data sources.",
          "name" : "Implementing modern collection views",
          "url" : "https:\/\/developer.apple.com\/documentation\/UIKit\/implementing-modern-collection-views"
        },
        {
          "description" : "A layout that organizes items into a flexible and configurable arrangement.",
          "name" : "NSCollectionViewFlowLayout",
          "url" : "https:\/\/developer.apple.com\/documentation\/AppKit\/NSCollectionViewFlowLayout"
        },
        {
          "description" : "A set of methods that a delegate implements to provide layout information to a flow layout object in a collection view.",
          "name" : "NSCollectionViewDelegateFlowLayout",
          "url" : "https:\/\/developer.apple.com\/documentation\/AppKit\/NSCollectionViewDelegateFlowLayout"
        },
        {
          "description" : "A layout that displays a single section of items in a row and column grid.",
          "name" : "NSCollectionViewGridLayout",
          "url" : "https:\/\/developer.apple.com\/documentation\/AppKit\/NSCollectionViewGridLayout"
        },
        {
          "description" : "An object that implements custom behaviors when changing from one layout to another in a collection view.",
          "name" : "NSCollectionViewTransitionLayout",
          "url" : "https:\/\/developer.apple.com\/documentation\/AppKit\/NSCollectionViewTransitionLayout"
        },
        {
          "description" : "An object that contains layout-related attributes for an element in a collection view.",
          "name" : "NSCollectionViewLayoutAttributes",
          "url" : "https:\/\/developer.apple.com\/documentation\/AppKit\/NSCollectionViewLayoutAttributes"
        },
        {
          "description" : "An abstract base class that you subclass and use to generate layout information for a collection view.",
          "name" : "NSCollectionViewLayout",
          "url" : "https:\/\/developer.apple.com\/documentation\/AppKit\/NSCollectionViewLayout"
        },
        {
          "description" : "An object that defines scroll direction, section spacing, and headers or footers for the layout.",
          "name" : "NSCollectionViewCompositionalLayoutConfiguration",
          "url" : "https:\/\/developer.apple.com\/documentation\/AppKit\/NSCollectionViewCompositionalLayoutConfiguration"
        },
        {
          "description" : "A closure that creates and returns each of the layout’s sections.",
          "name" : "NSCollectionViewCompositionalLayoutSectionProvider",
          "url" : "https:\/\/developer.apple.com\/documentation\/AppKit\/NSCollectionViewCompositionalLayoutSectionProvider"
        },
        {
          "description" : "The scrolling behavior of the layout’s sections in relation to the main layout axis.",
          "name" : "NSCollectionLayoutSectionOrthogonalScrollingBehavior",
          "url" : "https:\/\/developer.apple.com\/documentation\/AppKit\/NSCollectionLayoutSectionOrthogonalScrollingBehavior"
        }
      ],
      "title" : "Layouts"
    },
    {
      "content" : "",
      "items" : [
        {
          "name" : "NSCollectionViewLayout"
        }
      ],
      "title" : "Inherits From"
    }
  ],
  "source" : "appleJSON",
  "title" : "NSCollectionViewCompositionalLayout",
  "url" : "https:\/\/developer.apple.com\/documentation\/AppKit\/NSCollectionViewCompositionalLayout"
}