{
  "abstract" : "Notifies the delegate that the highlight state of the specified items changed.",
  "codeExamples" : [

  ],
  "contentHash" : "25551a7c53eef97a16442f5f6a214ed822971eeb36b3e3959229030cbadc845f",
  "crawledAt" : "2025-12-04T18:09:16Z",
  "declaration" : {
    "code" : "@MainActor optional func collectionView(_ collectionView: NSCollectionView, didChangeItemsAt indexPaths: Set<IndexPath>, to highlightState: NSCollectionViewItem.HighlightState)",
    "language" : "swift"
  },
  "id" : "0A809B19-CA11-4B41-9F0D-201C1067D11A",
  "kind" : "method",
  "language" : "swift",
  "module" : "AppKit",
  "overview" : "## Discussion\n\nAfter the highlight state of one or more items changes successfully, the collection view calls this method to report the change. Use this method to respond to the change and to make any necessary adjustments to your content or the collection view.",
  "platforms" : [
    "macOS"
  ],
  "rawMarkdown" : "---\nsource: https:\/\/developer.apple.com\/documentation\/AppKit\/NSCollectionViewDelegate\/collectionView(_:didChangeItemsAt:to:)\ncrawled: 2025-12-04T18:09:16Z\n---\n\n# collectionView(_:didChangeItemsAt:to:)\n\n**Instance Method**\n\nNotifies the delegate that the highlight state of the specified items changed.\n\n## Declaration\n\n```swift\n@MainActor optional func collectionView(_ collectionView: NSCollectionView, didChangeItemsAt indexPaths: Set<IndexPath>, to highlightState: NSCollectionViewItem.HighlightState)\n```\n\n## Parameters\n\n- **collectionView**: The collection view notifying you of the highlight change.\n- **indexPaths**: The set of [doc:\/\/com.apple.documentation\/documentation\/Foundation\/NSIndexPath] objects corresponding to the items whose highlight state changed.\n- **highlightState**: The new highlight state of the items.\n\n## Discussion\n\nAfter the highlight state of one or more items changes successfully, the collection view calls this method to report the change. Use this method to respond to the change and to make any necessary adjustments to your content or the collection view.\n\n## Managing Item Highlighting\n\n- **collectionView(_:shouldChangeItemsAt:to:)**: Asks the delegate to approve the pending highlighting of the specified items.\n\n",
  "sections" : [
    {
      "content" : "",
      "items" : [
        {
          "description" : "Asks the delegate to approve the pending highlighting of the specified items.",
          "name" : "collectionView(_:shouldChangeItemsAt:to:)",
          "url" : "https:\/\/developer.apple.com\/documentation\/AppKit\/NSCollectionViewDelegate\/collectionView(_:shouldChangeItemsAt:to:)"
        }
      ],
      "title" : "Managing Item Highlighting"
    }
  ],
  "source" : "appleJSON",
  "title" : "collectionView(_:didChangeItemsAt:to:)",
  "url" : "https:\/\/developer.apple.com\/documentation\/AppKit\/NSCollectionViewDelegate\/collectionView(_:didChangeItemsAt:to:)"
}