{
  "abstract" : "Returns an array of UTI strings of data types the receiver can write to a given pasteboard.",
  "codeExamples" : [

  ],
  "contentHash" : "3c3c1ba0e3b0b8bb3c5974ebc86fa47fb6f8b8e2d13783fd2cbcd83ebdac19ca",
  "crawledAt" : "2025-12-03T09:16:52Z",
  "declaration" : {
    "code" : "func writableTypes(for pasteboard: NSPasteboard) -> [NSPasteboard.PasteboardType]",
    "language" : "swift"
  },
  "id" : "E71212CD-15F3-4DCE-94CE-1B404675603F",
  "kind" : "method",
  "language" : "swift",
  "module" : "AppKit",
  "overview" : "## Return Value\n\nAn array of UTI strings of data types the receiver can write to `pasteboard`.\n\n## Discussion\n\nBy default, data for the first returned type is put onto the pasteboard immediately, with the remaining types being promised.\n\nTo change the default behavior, implement -writingOptionsForType:pasteboard: and return [doc:\/\/com.apple.appkit\/documentation\/AppKit\/NSPasteboard\/WritingOptions\/promised] to lazily provide data for types, return no option to provide the data for that type immediately.  Use the pasteboard argument to provide different types based on the pasteboard name, if desired.  Do not perform other pasteboard operations in the method implementation.",
  "platforms" : [
    "macOS"
  ],
  "rawMarkdown" : "---\nsource: https:\/\/developer.apple.com\/documentation\/AppKit\/NSPasteboardWriting\/writableTypes(for:)\ncrawled: 2025-12-03T09:16:52Z\n---\n\n# writableTypes(for:)\n\n**Instance Method**\n\nReturns an array of UTI strings of data types the receiver can write to a given pasteboard.\n\n## Declaration\n\n```swift\nfunc writableTypes(for pasteboard: NSPasteboard) -> [NSPasteboard.PasteboardType]\n```\n\n## Parameters\n\n- **pasteboard**: A pasteboard.\n\nYou can use this argument to provide different options based on the pasteboard name, if you need to.\n\n## Return Value\n\nAn array of UTI strings of data types the receiver can write to `pasteboard`.\n\n## Discussion\n\nBy default, data for the first returned type is put onto the pasteboard immediately, with the remaining types being promised.\n\nTo change the default behavior, implement -writingOptionsForType:pasteboard: and return [doc:\/\/com.apple.appkit\/documentation\/AppKit\/NSPasteboard\/WritingOptions\/promised] to lazily provide data for types, return no option to provide the data for that type immediately.  Use the pasteboard argument to provide different types based on the pasteboard name, if desired.  Do not perform other pasteboard operations in the method implementation.\n\n## Related Documentation\n\n- **Drag and Drop Programming Topics**\n- **Pasteboard Programming Guide**\n- **Services Implementation Guide**\n\n## Required Methods\n\n- **writingOptions(forType:pasteboard:)**: Returns options for writing data of a specified type to a given pasteboard.\n- **NSPasteboard.WritingOptions**: Type to specify options for writing to a pasteboard.\n\n",
  "sections" : [
    {
      "content" : "",
      "items" : [
        {
          "name" : "Drag and Drop Programming Topics"
        },
        {
          "name" : "Pasteboard Programming Guide"
        },
        {
          "name" : "Services Implementation Guide"
        }
      ],
      "title" : "Related Documentation"
    },
    {
      "content" : "",
      "items" : [
        {
          "description" : "Returns options for writing data of a specified type to a given pasteboard.",
          "name" : "writingOptions(forType:pasteboard:)",
          "url" : "https:\/\/developer.apple.com\/documentation\/AppKit\/NSPasteboardWriting\/writingOptions(forType:pasteboard:)"
        },
        {
          "description" : "Type to specify options for writing to a pasteboard.",
          "name" : "NSPasteboard.WritingOptions",
          "url" : "https:\/\/developer.apple.com\/documentation\/AppKit\/NSPasteboard\/WritingOptions"
        }
      ],
      "title" : "Required Methods"
    }
  ],
  "source" : "appleJSON",
  "title" : "writableTypes(for:)",
  "url" : "https:\/\/developer.apple.com\/documentation\/AppKit\/NSPasteboardWriting\/writableTypes(for:)"
}