{
  "abstract" : "The distance (in points) between the bottom of the view’s alignment rectangle and its baseline.",
  "codeExamples" : [

  ],
  "contentHash" : "6ccb4b0c696a5d26c343267f7e24c94967457e9a372090f3bdc652f64d9ca49e",
  "crawledAt" : "2025-12-04T20:06:05Z",
  "declaration" : {
    "code" : "@MainActor var baselineOffsetFromBottom: CGFloat { get }",
    "language" : "swift"
  },
  "id" : "A004DA0F-18CE-446E-A388-26403E11D349",
  "kind" : "property",
  "language" : "swift",
  "module" : "AppKit",
  "overview" : "## Discussion\n\nThe default value of this property is `0`. For views that contain text or other content whose layout benefits from having a custom baseline, you can override this property and provide the correct distance between the bottom of the view’s alignment rectangle and that baseline.",
  "platforms" : [
    "macOS"
  ],
  "rawMarkdown" : "---\nsource: https:\/\/developer.apple.com\/documentation\/AppKit\/NSView\/baselineOffsetFromBottom\ncrawled: 2025-12-04T20:06:05Z\n---\n\n# baselineOffsetFromBottom\n\n**Instance Property**\n\nThe distance (in points) between the bottom of the view’s alignment rectangle and its baseline.\n\n## Declaration\n\n```swift\n@MainActor var baselineOffsetFromBottom: CGFloat { get }\n```\n\n## Discussion\n\nThe default value of this property is `0`. For views that contain text or other content whose layout benefits from having a custom baseline, you can override this property and provide the correct distance between the bottom of the view’s alignment rectangle and that baseline.\n\n## Aligning Views with Auto Layout\n\n- **alignmentRect(forFrame:)**: Returns the view’s alignment rectangle for a given frame.\n- **frame(forAlignmentRect:)**: Returns the view’s frame for a given alignment rectangle.\n- **alignmentRectInsets**: The insets (in points) from the view’s frame that define its content rectangle.\n- **firstBaselineOffsetFromTop**: The distance (in points) between the top of the view’s alignment rectangle and its topmost baseline.\n- **lastBaselineOffsetFromBottom**: The distance (in points) between the bottom of the view’s alignment rectangle and its bottommost baseline.\n\n",
  "sections" : [
    {
      "content" : "",
      "items" : [
        {
          "description" : "Returns the view’s alignment rectangle for a given frame.",
          "name" : "alignmentRect(forFrame:)",
          "url" : "https:\/\/developer.apple.com\/documentation\/AppKit\/NSView\/alignmentRect(forFrame:)"
        },
        {
          "description" : "Returns the view’s frame for a given alignment rectangle.",
          "name" : "frame(forAlignmentRect:)",
          "url" : "https:\/\/developer.apple.com\/documentation\/AppKit\/NSView\/frame(forAlignmentRect:)"
        },
        {
          "description" : "The insets (in points) from the view’s frame that define its content rectangle.",
          "name" : "alignmentRectInsets",
          "url" : "https:\/\/developer.apple.com\/documentation\/AppKit\/NSView\/alignmentRectInsets"
        },
        {
          "description" : "The distance (in points) between the top of the view’s alignment rectangle and its topmost baseline.",
          "name" : "firstBaselineOffsetFromTop",
          "url" : "https:\/\/developer.apple.com\/documentation\/AppKit\/NSView\/firstBaselineOffsetFromTop"
        },
        {
          "description" : "The distance (in points) between the bottom of the view’s alignment rectangle and its bottommost baseline.",
          "name" : "lastBaselineOffsetFromBottom",
          "url" : "https:\/\/developer.apple.com\/documentation\/AppKit\/NSView\/lastBaselineOffsetFromBottom"
        }
      ],
      "title" : "Aligning Views with Auto Layout"
    }
  ],
  "source" : "appleJSON",
  "title" : "baselineOffsetFromBottom",
  "url" : "https:\/\/developer.apple.com\/documentation\/AppKit\/NSView\/baselineOffsetFromBottom"
}