{
  "abstract" : "Selects the specified text range in the receiver’s field editor.",
  "codeExamples" : [

  ],
  "contentHash" : "dc933445fb98ceb0ff575de2121f385440aaf381d5c9e0c32f130076d9638e76",
  "crawledAt" : "2025-12-03T08:48:00Z",
  "declaration" : {
    "code" : "@MainActor func select(withFrame rect: NSRect, editor textObj: NSText, delegate: Any?, start selStart: Int, length selLength: Int)",
    "language" : "swift"
  },
  "id" : "2989E3D0-8B4E-4141-A64F-7E3DD74E723F",
  "kind" : "method",
  "language" : "swift",
  "module" : "AppKit",
  "overview" : "## Discussion\n\nThis method is similar to [doc:\/\/com.apple.appkit\/documentation\/AppKit\/NSControl\/edit(withFrame:editor:delegate:event:)], except that it can be invoked in any situation, not only on a mouse-down event. This method returns without doing anything if `textObj` or the receiver is `nil`, or if the receiver has no font set for it.",
  "platforms" : [
    "macOS"
  ],
  "rawMarkdown" : "---\nsource: https:\/\/developer.apple.com\/documentation\/AppKit\/NSControl\/select(withFrame:editor:delegate:start:length:)\ncrawled: 2025-12-03T08:48:00Z\n---\n\n# select(withFrame:editor:delegate:start:length:)\n\n**Instance Method**\n\nSelects the specified text range in the receiver’s field editor.\n\n## Declaration\n\n```swift\n@MainActor func select(withFrame rect: NSRect, editor textObj: NSText, delegate: Any?, start selStart: Int, length selLength: Int)\n```\n\n## Parameters\n\n- **rect**: The bounding rectangle of the control’s cell.\n- **textObj**: The field editor to use.\n- **delegate**: The object to use as a delegate for the field editor. This delegate object receives various [doc:\/\/com.apple.appkit\/documentation\/AppKit\/NSText] delegation and notification methods during the course of editing the cell’s contents.\n- **selStart**: The start of the text selection.\n- **selLength**: The length of the text range.\n\n## Discussion\n\nThis method is similar to [doc:\/\/com.apple.appkit\/documentation\/AppKit\/NSControl\/edit(withFrame:editor:delegate:event:)], except that it can be invoked in any situation, not only on a mouse-down event. This method returns without doing anything if `textObj` or the receiver is `nil`, or if the receiver has no font set for it.\n\n## Managing the Field Editor\n\n- **abortEditing()**: Terminates the current editing operation and discards any edited text.\n- **currentEditor()**: Returns the current field editor for the control.\n- **validateEditing()**: Validates changes to any user-typed text.\n- **edit(withFrame:editor:delegate:event:)**: Begins editing of the receiver’s text using the specified field editor.\n- **endEditing(_:)**: Ends the editing of text in the receiver using the specified field editor.\n\n",
  "sections" : [
    {
      "content" : "",
      "items" : [
        {
          "description" : "Terminates the current editing operation and discards any edited text.",
          "name" : "abortEditing()",
          "url" : "https:\/\/developer.apple.com\/documentation\/AppKit\/NSControl\/abortEditing()"
        },
        {
          "description" : "Returns the current field editor for the control.",
          "name" : "currentEditor()",
          "url" : "https:\/\/developer.apple.com\/documentation\/AppKit\/NSControl\/currentEditor()"
        },
        {
          "description" : "Validates changes to any user-typed text.",
          "name" : "validateEditing()",
          "url" : "https:\/\/developer.apple.com\/documentation\/AppKit\/NSControl\/validateEditing()"
        },
        {
          "description" : "Begins editing of the receiver’s text using the specified field editor.",
          "name" : "edit(withFrame:editor:delegate:event:)",
          "url" : "https:\/\/developer.apple.com\/documentation\/AppKit\/NSControl\/edit(withFrame:editor:delegate:event:)"
        },
        {
          "description" : "Ends the editing of text in the receiver using the specified field editor.",
          "name" : "endEditing(_:)",
          "url" : "https:\/\/developer.apple.com\/documentation\/AppKit\/NSControl\/endEditing(_:)"
        }
      ],
      "title" : "Managing the Field Editor"
    }
  ],
  "source" : "appleJSON",
  "title" : "select(withFrame:editor:delegate:start:length:)",
  "url" : "https:\/\/developer.apple.com\/documentation\/AppKit\/NSControl\/select(withFrame:editor:delegate:start:length:)"
}