{
  "abstract" : "The color to use for the window background.",
  "codeExamples" : [

  ],
  "contentHash" : "bf6b2ea18e9f6e672252c0ddf695780fe32866823a20b762a58fe7177c887e77",
  "crawledAt" : "2025-12-04T17:58:49Z",
  "declaration" : {
    "code" : "class var windowBackgroundColor: NSColor { get }",
    "language" : "swift"
  },
  "id" : "5027255D-A326-4C76-8FCE-B6AA4EA3A1B8",
  "kind" : "property",
  "language" : "swift",
  "module" : "AppKit",
  "overview" : "## Return Value\n\nThe window background color.\n\n## Discussion\n\nWhen applied to an [doc:\/\/com.apple.appkit\/documentation\/AppKit\/NSBox] object, this color supports Desktop Tinting in Dark Mode. With Desktop Tinting, the system modifies this color dynamically by incorporating some of the color from the underlying desktop image. The system does not apply this dynamic tinting effect to other types of views.",
  "platforms" : [
    "macOS"
  ],
  "rawMarkdown" : "---\nsource: https:\/\/developer.apple.com\/documentation\/AppKit\/NSColor\/windowBackgroundColor\ncrawled: 2025-12-04T17:58:49Z\n---\n\n# windowBackgroundColor\n\n**Type Property**\n\nThe color to use for the window background.\n\n## Declaration\n\n```swift\nclass var windowBackgroundColor: NSColor { get }\n```\n\n## Return Value\n\nThe window background color.\n\n## Discussion\n\nWhen applied to an [doc:\/\/com.apple.appkit\/documentation\/AppKit\/NSBox] object, this color supports Desktop Tinting in Dark Mode. With Desktop Tinting, the system modifies this color dynamically by incorporating some of the color from the underlying desktop image. The system does not apply this dynamic tinting effect to other types of views.\n\n## Window colors\n\n- **windowFrameTextColor**: The color to use for text in a window’s frame.\n- **underPageBackgroundColor**: The color to use in the area beneath your window’s views.\n\n",
  "sections" : [
    {
      "content" : "",
      "items" : [
        {
          "description" : "The color to use for text in a window’s frame.",
          "name" : "windowFrameTextColor",
          "url" : "https:\/\/developer.apple.com\/documentation\/AppKit\/NSColor\/windowFrameTextColor"
        },
        {
          "description" : "The color to use in the area beneath your window’s views.",
          "name" : "underPageBackgroundColor",
          "url" : "https:\/\/developer.apple.com\/documentation\/AppKit\/NSColor\/underPageBackgroundColor"
        }
      ],
      "title" : "Window colors"
    }
  ],
  "source" : "appleJSON",
  "title" : "windowBackgroundColor",
  "url" : "https:\/\/developer.apple.com\/documentation\/AppKit\/NSColor\/windowBackgroundColor"
}