{
  "abstract" : "Causes the view to maintain a private graphics state object, which encapsulates all parameters of the graphics environment.",
  "codeExamples" : [

  ],
  "contentHash" : "fd99fcabf92759d68fe091e4057434648157621509deb26f234776ada576d565",
  "crawledAt" : "2025-12-04T18:37:50Z",
  "declaration" : {
    "code" : "@MainActor func allocateGState()",
    "language" : "swift"
  },
  "id" : "E509B45B-094D-4CF3-9C42-A1917234852D",
  "kind" : "method",
  "language" : "swift",
  "module" : "AppKit",
  "overview" : "## Discussion\n\nIf you do not invoke [doc:\/\/com.apple.appkit\/documentation\/AppKit\/NSView\/allocateGState()], a graphics state object is constructed from scratch each time the NSView is focused.\n\nThe view builds the graphics state parameters using [doc:\/\/com.apple.appkit\/documentation\/AppKit\/NSView\/setUpGState()], then automatically establishes this graphics state each time the focus is locked on it. A graphics state may improve performance for view objects that are focused often and need to set many parameters, but use of standard rendering operators is normally efficient enough.\n\nBecause graphics states occupy a fair amount of memory, they can actually degrade performance. Be sure to test application performance with and without the private graphics state before committing to its use.",
  "platforms" : [
    "macOS"
  ],
  "rawMarkdown" : "---\nsource: https:\/\/developer.apple.com\/documentation\/AppKit\/NSView\/allocateGState()\ncrawled: 2025-12-04T18:37:50Z\n---\n\n# allocateGState()\n\n**Instance Method**\n\nCauses the view to maintain a private graphics state object, which encapsulates all parameters of the graphics environment.\n\n## Declaration\n\n```swift\n@MainActor func allocateGState()\n```\n\n## Discussion\n\nIf you do not invoke [doc:\/\/com.apple.appkit\/documentation\/AppKit\/NSView\/allocateGState()], a graphics state object is constructed from scratch each time the NSView is focused.\n\nThe view builds the graphics state parameters using [doc:\/\/com.apple.appkit\/documentation\/AppKit\/NSView\/setUpGState()], then automatically establishes this graphics state each time the focus is locked on it. A graphics state may improve performance for view objects that are focused often and need to set many parameters, but use of standard rendering operators is normally efficient enough.\n\nBecause graphics states occupy a fair amount of memory, they can actually degrade performance. Be sure to test application performance with and without the private graphics state before committing to its use.\n\n## Methods\n\n- **lockFocus()**: Locks the focus on the view, so subsequent commands take effect in the view’s window and coordinate system.\n- **lockFocusIfCanDraw()**: Locks the focus to the view atomically if the `canDraw` method returns `true` and returns the value of `canDraw`.\n- **lockFocusIfCanDraw(in:)**: Locks the focus to the view atomically if drawing can occur in the specified graphics context.\n- **unlockFocus()**: Unlocks focus from the current view.\n- **scroll(_:by:)**: Copies the visible portion of the view’s rendered image within a region and lays that portion down again at a specified offset .\n- **shouldDrawColor()**: Returns a Boolean value indicating whether the view is being drawn to an environment that supports color.\n- **gState()**: Returns the identifier for the view’s graphics state object, or 0 if the view doesn’t have a graphics state object.\n- **setUpGState()**: Overridden by subclasses to (re)initialize the view’s graphics state object.\n- **renewGState()**: Invalidates the view’s graphics state object, if it has one.\n- **releaseGState()**: Frees the view’s graphics state object, if it has one.\n- **dragFile(_:from:slideBack:event:)**: Initiates a dragging operation from the view, allowing the user to drag a file icon to any application that has window or view objects that accept files.\n- **dragPromisedFiles(ofTypes:from:source:slideBack:event:)**: Initiates a dragging operation from the view, allowing the user to drag one or more promised files (or directories) into any application that has window or view objects that accept promised file data.\n\n",
  "sections" : [
    {
      "content" : "",
      "items" : [
        {
          "description" : "Locks the focus on the view, so subsequent commands take effect in the view’s window and coordinate system.",
          "name" : "lockFocus()",
          "url" : "https:\/\/developer.apple.com\/documentation\/AppKit\/NSView\/lockFocus()"
        },
        {
          "description" : "Locks the focus to the view atomically if the `canDraw` method returns `true` and returns the value of `canDraw`.",
          "name" : "lockFocusIfCanDraw()",
          "url" : "https:\/\/developer.apple.com\/documentation\/AppKit\/NSView\/lockFocusIfCanDraw()"
        },
        {
          "description" : "Locks the focus to the view atomically if drawing can occur in the specified graphics context.",
          "name" : "lockFocusIfCanDraw(in:)",
          "url" : "https:\/\/developer.apple.com\/documentation\/AppKit\/NSView\/lockFocusIfCanDraw(in:)"
        },
        {
          "description" : "Unlocks focus from the current view.",
          "name" : "unlockFocus()",
          "url" : "https:\/\/developer.apple.com\/documentation\/AppKit\/NSView\/unlockFocus()"
        },
        {
          "description" : "Copies the visible portion of the view’s rendered image within a region and lays that portion down again at a specified offset .",
          "name" : "scroll(_:by:)",
          "url" : "https:\/\/developer.apple.com\/documentation\/AppKit\/NSView\/scroll(_:by:)"
        },
        {
          "description" : "Returns a Boolean value indicating whether the view is being drawn to an environment that supports color.",
          "name" : "shouldDrawColor()",
          "url" : "https:\/\/developer.apple.com\/documentation\/AppKit\/NSView\/shouldDrawColor()"
        },
        {
          "description" : "Returns the identifier for the view’s graphics state object, or 0 if the view doesn’t have a graphics state object.",
          "name" : "gState()",
          "url" : "https:\/\/developer.apple.com\/documentation\/AppKit\/NSView\/gState()"
        },
        {
          "description" : "Overridden by subclasses to (re)initialize the view’s graphics state object.",
          "name" : "setUpGState()",
          "url" : "https:\/\/developer.apple.com\/documentation\/AppKit\/NSView\/setUpGState()"
        },
        {
          "description" : "Invalidates the view’s graphics state object, if it has one.",
          "name" : "renewGState()",
          "url" : "https:\/\/developer.apple.com\/documentation\/AppKit\/NSView\/renewGState()"
        },
        {
          "description" : "Frees the view’s graphics state object, if it has one.",
          "name" : "releaseGState()",
          "url" : "https:\/\/developer.apple.com\/documentation\/AppKit\/NSView\/releaseGState()"
        },
        {
          "description" : "Initiates a dragging operation from the view, allowing the user to drag a file icon to any application that has window or view objects that accept files.",
          "name" : "dragFile(_:from:slideBack:event:)",
          "url" : "https:\/\/developer.apple.com\/documentation\/AppKit\/NSView\/dragFile(_:from:slideBack:event:)"
        },
        {
          "description" : "Initiates a dragging operation from the view, allowing the user to drag one or more promised files (or directories) into any application that has window or view objects that accept promised file data.",
          "name" : "dragPromisedFiles(ofTypes:from:source:slideBack:event:)",
          "url" : "https:\/\/developer.apple.com\/documentation\/AppKit\/NSView\/dragPromisedFiles(ofTypes:from:source:slideBack:event:)"
        }
      ],
      "title" : "Methods"
    }
  ],
  "source" : "appleJSON",
  "title" : "allocateGState()",
  "url" : "https:\/\/developer.apple.com\/documentation\/AppKit\/NSView\/allocateGState()"
}