{
  "abstract" : "Returns a custom version of the supplied error object that’s more suitable for presentation in alert sheets and dialogs.",
  "codeExamples" : [

  ],
  "contentHash" : "7f2183179e14885173454967d5ff178234fa0c45f65c141cea84cfc01cab066a",
  "crawledAt" : "2025-12-03T08:37:08Z",
  "declaration" : {
    "code" : "@MainActor func willPresentError(_ error: any Error) -> any Error",
    "language" : "swift"
  },
  "id" : "2407183D-9B7B-488D-836E-2B45241F6D4C",
  "kind" : "method",
  "language" : "swift",
  "module" : "AppKit",
  "overview" : "## Return Value\n\nThe customized error object; if you decide not to customize the error presentation, return by sending this message to `super` (that is, `return [super willPresentError:error]`).\n\n## Discussion\n\nWhen overriding this method, you can examine `error` and, if its localized description or recovery information is unhelpfully generic, return an error object with more specific localized text. If you do this, always use the domain and error code of the [doc:\/\/com.apple.documentation\/documentation\/Foundation\/NSError] object to distinguish between errors whose presentation you want to customize and those you don’t. Don’t make decisions based on the localized description, recovery suggestion, or recovery options because parsing localized text is problematic.\n\nThe default implementation of this method returns `error` unchanged.",
  "platforms" : [
    "macOS"
  ],
  "rawMarkdown" : "---\nsource: https:\/\/developer.apple.com\/documentation\/AppKit\/NSResponder\/willPresentError(_:)\ncrawled: 2025-12-03T08:37:08Z\n---\n\n# willPresentError(_:)\n\n**Instance Method**\n\nReturns a custom version of the supplied error object that’s more suitable for presentation in alert sheets and dialogs.\n\n## Declaration\n\n```swift\n@MainActor func willPresentError(_ error: any Error) -> any Error\n```\n\n## Parameters\n\n- **error**: The error object to customize.\n\n## Return Value\n\nThe customized error object; if you decide not to customize the error presentation, return by sending this message to `super` (that is, `return [super willPresentError:error]`).\n\n## Discussion\n\nWhen overriding this method, you can examine `error` and, if its localized description or recovery information is unhelpfully generic, return an error object with more specific localized text. If you do this, always use the domain and error code of the [doc:\/\/com.apple.documentation\/documentation\/Foundation\/NSError] object to distinguish between errors whose presentation you want to customize and those you don’t. Don’t make decisions based on the localized description, recovery suggestion, or recovery options because parsing localized text is problematic.\n\nThe default implementation of this method returns `error` unchanged.\n\n## Presenting and Customizing Error Information\n\n- **presentError(_:)**: Presents an error alert to the user as an application-modal dialog.\n- **presentError(_:modalFor:delegate:didPresent:contextInfo:)**: Presents an error alert to the user as a document-modal sheet attached to document window.\n\n",
  "sections" : [
    {
      "content" : "",
      "items" : [
        {
          "description" : "Presents an error alert to the user as an application-modal dialog.",
          "name" : "presentError(_:)",
          "url" : "https:\/\/developer.apple.com\/documentation\/AppKit\/NSResponder\/presentError(_:)"
        },
        {
          "description" : "Presents an error alert to the user as a document-modal sheet attached to document window.",
          "name" : "presentError(_:modalFor:delegate:didPresent:contextInfo:)",
          "url" : "https:\/\/developer.apple.com\/documentation\/AppKit\/NSResponder\/presentError(_:modalFor:delegate:didPresent:contextInfo:)"
        }
      ],
      "title" : "Presenting and Customizing Error Information"
    }
  ],
  "source" : "appleJSON",
  "title" : "willPresentError(_:)",
  "url" : "https:\/\/developer.apple.com\/documentation\/AppKit\/NSResponder\/willPresentError(_:)"
}