{
  "abstract" : "Returns the type of path element at the specified index.",
  "codeExamples" : [

  ],
  "contentHash" : "331eaa522a6ee721eb368d1a3eafcf754ac5b143df85abc19e08a87d4ab23ee1",
  "crawledAt" : "2025-12-04T12:37:33Z",
  "declaration" : {
    "code" : "func element(at index: Int) -> NSBezierPath.ElementType",
    "language" : "swift"
  },
  "id" : "F04F49B6-851F-40ED-A70D-30FF6F0633D1",
  "kind" : "method",
  "language" : "swift",
  "module" : "AppKit",
  "overview" : "## Return Value\n\nThe type of the path element. For a list of constants, see [doc:\/\/com.apple.appkit\/documentation\/AppKit\/NSBezierPath\/ElementType].\n\n## Discussion\n\nPath elements describe the commands used to define a path and include basic commands such as moving to a specific point, creating a line segment, creating a curve, or closing the path. The elements are stored in the order of their execution.",
  "platforms" : [
    "macOS"
  ],
  "rawMarkdown" : "---\nsource: https:\/\/developer.apple.com\/documentation\/AppKit\/NSBezierPath\/element(at:)\ncrawled: 2025-12-04T12:37:33Z\n---\n\n# element(at:)\n\n**Instance Method**\n\nReturns the type of path element at the specified index.\n\n## Declaration\n\n```swift\nfunc element(at index: Int) -> NSBezierPath.ElementType\n```\n\n## Parameters\n\n- **index**: The index of the desired path element.\n\n## Return Value\n\nThe type of the path element. For a list of constants, see [doc:\/\/com.apple.appkit\/documentation\/AppKit\/NSBezierPath\/ElementType].\n\n## Discussion\n\nPath elements describe the commands used to define a path and include basic commands such as moving to a specific point, creating a line segment, creating a curve, or closing the path. The elements are stored in the order of their execution.\n\n## Related Documentation\n\n- **reversed**: A path containing the reversed contents of the current path object.\n\n## Accessing Elements of a Path\n\n- **cgPath**\n- **elementCount**: The total number of path elements in the path.\n- **element(at:associatedPoints:)**: Gets the element type and (and optionally) the associated points for the path element at the specified index.\n- **removeAllPoints()**: Removes all path elements from the path, effectively clearing the path.\n- **setAssociatedPoints(_:at:)**: Changes the points associated with the specified path element.\n\n",
  "sections" : [
    {
      "content" : "",
      "items" : [
        {
          "description" : "A path containing the reversed contents of the current path object.",
          "name" : "reversed",
          "url" : "https:\/\/developer.apple.com\/documentation\/AppKit\/NSBezierPath\/reversed"
        }
      ],
      "title" : "Related Documentation"
    },
    {
      "content" : "",
      "items" : [
        {
          "description" : "",
          "name" : "cgPath",
          "url" : "https:\/\/developer.apple.com\/documentation\/AppKit\/NSBezierPath\/cgPath"
        },
        {
          "description" : "The total number of path elements in the path.",
          "name" : "elementCount",
          "url" : "https:\/\/developer.apple.com\/documentation\/AppKit\/NSBezierPath\/elementCount"
        },
        {
          "description" : "Gets the element type and (and optionally) the associated points for the path element at the specified index.",
          "name" : "element(at:associatedPoints:)",
          "url" : "https:\/\/developer.apple.com\/documentation\/AppKit\/NSBezierPath\/element(at:associatedPoints:)"
        },
        {
          "description" : "Removes all path elements from the path, effectively clearing the path.",
          "name" : "removeAllPoints()",
          "url" : "https:\/\/developer.apple.com\/documentation\/AppKit\/NSBezierPath\/removeAllPoints()"
        },
        {
          "description" : "Changes the points associated with the specified path element.",
          "name" : "setAssociatedPoints(_:at:)",
          "url" : "https:\/\/developer.apple.com\/documentation\/AppKit\/NSBezierPath\/setAssociatedPoints(_:at:)"
        }
      ],
      "title" : "Accessing Elements of a Path"
    }
  ],
  "source" : "appleJSON",
  "title" : "element(at:)",
  "url" : "https:\/\/developer.apple.com\/documentation\/AppKit\/NSBezierPath\/element(at:)"
}