{
  "abstract" : "Returns the default writing direction for the specified language.",
  "codeExamples" : [

  ],
  "contentHash" : "5caf438eded0c288334fd62cf4a935d055668c1b5d5347f6fb8b37c282c89ada",
  "crawledAt" : "2025-12-02T07:26:51Z",
  "declaration" : {
    "code" : "class func defaultWritingDirection(forLanguage languageName: String?) -> NSWritingDirection",
    "language" : "swift"
  },
  "id" : "C73D9C89-3AE7-41BA-92AF-8D088628975E",
  "kind" : "method",
  "module" : "AppKit",
  "overview" : "## Return Value\n\nThe default writing direction.",
  "platforms" : [
    "macOS"
  ],
  "rawMarkdown" : "---\nsource: https:\/\/developer.apple.com\/documentation\/AppKit\/NSParagraphStyle\/defaultWritingDirection(forLanguage:)\ncrawled: 2025-12-02T07:26:51Z\n---\n\n# defaultWritingDirection(forLanguage:)\n\n**Type Method**\n\nReturns the default writing direction for the specified language.\n\n## Declaration\n\n```swift\nclass func defaultWritingDirection(forLanguage languageName: String?) -> NSWritingDirection\n```\n\n## Parameters\n\n- **languageName**: The language specified in ISO language region format. Can be `nil` to return a default writing direction derived from the userâ€™s defaults database.\n\n## Return Value\n\nThe default writing direction.\n\n## Determining writing direction\n\n- **baseWritingDirection**: The base writing direction for the paragraph.\n- **NSWritingDirection**: Constants that specify the writing direction.\n\n",
  "sections" : [
    {
      "content" : "",
      "items" : [
        {
          "description" : "The base writing direction for the paragraph.",
          "name" : "baseWritingDirection",
          "url" : "https:\/\/developer.apple.com\/documentation\/AppKit\/NSParagraphStyle\/baseWritingDirection"
        },
        {
          "description" : "Constants that specify the writing direction.",
          "name" : "NSWritingDirection",
          "url" : "https:\/\/developer.apple.com\/documentation\/AppKit\/NSWritingDirection"
        }
      ],
      "title" : "Determining writing direction"
    }
  ],
  "source" : "appleJSON",
  "title" : "defaultWritingDirection(forLanguage:)",
  "url" : "https:\/\/developer.apple.com\/documentation\/AppKit\/NSParagraphStyle\/defaultWritingDirection(forLanguage:)"
}