{
  "abstract" : "Logs a given exception by calling `NSLog()`.",
  "codeExamples" : [

  ],
  "contentHash" : "26ffba3850d1c3617ecbd8873e6409c80025dc5bf30fa30ababa23c0b480b157",
  "crawledAt" : "2025-12-01T13:30:03Z",
  "declaration" : {
    "code" : "@MainActor func reportException(_ exception: NSException)",
    "language" : "swift"
  },
  "id" : "15C6BAF2-3C4E-4636-8018-EE81B8ADF2E4",
  "kind" : "method",
  "module" : "AppKit",
  "overview" : "## Discussion\n\nThis method doesn’t raise `anException`. Use it inside of an exception handler to record that the exception occurred.",
  "platforms" : [
    "macOS"
  ],
  "rawMarkdown" : "---\nsource: https:\/\/developer.apple.com\/documentation\/AppKit\/NSApplication\/reportException(_:)\ncrawled: 2025-12-01T13:30:03Z\n---\n\n# reportException(_:)\n\n**Instance Method**\n\nLogs a given exception by calling `NSLog()`.\n\n## Declaration\n\n```swift\n@MainActor func reportException(_ exception: NSException)\n```\n\n## Parameters\n\n- **exception**: The exception whose contents you want to write to the log file.\n\n## Discussion\n\nThis method doesn’t raise `anException`. Use it inside of an exception handler to record that the exception occurred.\n\n## Related Documentation\n\n- **NSSetUncaughtExceptionHandler(_:)**: Changes the top-level error handler.\n\n",
  "sections" : [
    {
      "content" : "",
      "items" : [
        {
          "description" : "Changes the top-level error handler.",
          "name" : "NSSetUncaughtExceptionHandler(_:)",
          "url" : "https:\/\/developer.apple.com\/documentation\/Foundation\/NSSetUncaughtExceptionHandler(_:)"
        }
      ],
      "title" : "Related Documentation"
    }
  ],
  "source" : "appleJSON",
  "title" : "reportException(_:)",
  "url" : "https:\/\/developer.apple.com\/documentation\/AppKit\/NSApplication\/reportException(_:)"
}