{
  "abstract" : "Called by the main function to create and run the application.",
  "codeExamples" : [

  ],
  "contentHash" : "910c794f8ef9aa09d41ff481215f492401d4dc2d1105ff74b07499582c48e0eb",
  "crawledAt" : "2025-12-03T05:32:33Z",
  "declaration" : {
    "code" : "func NSApplicationMain(_ argc: Int32, _ argv: UnsafeMutablePointer<UnsafeMutablePointer<CChar>?>) -> Int32",
    "language" : "swift"
  },
  "id" : "2318C12C-690B-4DF5-B223-80D28C961A02",
  "kind" : "function",
  "language" : "swift",
  "module" : "AppKit",
  "overview" : "## Return Value\n\nThis method never returns a result code. Instead, it calls the `exit` function to exit the application and terminate the process. If you want to determine why the application exited, you should look at the result code from the `exit` function instead.\n\n## Discussion\n\nCreates the application, loads the main nib file from the application’s main bundle, and runs the application. You must call this function from the main thread of your application, and you typically call it only once from your application’s `main` function. Your `main` function is usually generated automatically by Xcode.\n\n### Special Considerations\n\n`NSApplicationMain` itself ignores the `argc` and `argv` arguments. Instead, Cocoa gets its arguments indirectly through `_NSGetArgv`, `_NSGetArgc`, and `_NSGetEnviron` (see <crt_externs.h>).",
  "platforms" : [
    "macOS"
  ],
  "rawMarkdown" : "---\nsource: https:\/\/developer.apple.com\/documentation\/AppKit\/NSApplicationMain(_:_:)\ncrawled: 2025-12-03T05:32:33Z\n---\n\n# NSApplicationMain(_:_:)\n\n**Function**\n\nCalled by the main function to create and run the application.\n\n## Declaration\n\n```swift\nfunc NSApplicationMain(_ argc: Int32, _ argv: UnsafeMutablePointer<UnsafeMutablePointer<CChar>?>) -> Int32\n```\n\n## Parameters\n\n- **argc**: The number of arguments in the `argv` parameter.\n- **argv**: An array of pointers containing the arguments passed to the application at startup.\n\n## Return Value\n\nThis method never returns a result code. Instead, it calls the `exit` function to exit the application and terminate the process. If you want to determine why the application exited, you should look at the result code from the `exit` function instead.\n\n## Discussion\n\nCreates the application, loads the main nib file from the application’s main bundle, and runs the application. You must call this function from the main thread of your application, and you typically call it only once from your application’s `main` function. Your `main` function is usually generated automatically by Xcode.\n\n### Special Considerations\n\n`NSApplicationMain` itself ignores the `argc` and `argv` arguments. Instead, Cocoa gets its arguments indirectly through `_NSGetArgv`, `_NSGetArgc`, and `_NSGetEnviron` (see <crt_externs.h>).\n\n## Life Cycle\n\n- **NSApplication**: An object that manages an app’s main event loop and resources used by all of that app’s objects.\n- **NSRunningApplication**: An object that can manipulate and provide information for a single instance of an app.\n- **NSApplicationDelegate**: A set of methods that manage your app’s life cycle and its interaction with common system services.\n\n",
  "sections" : [
    {
      "content" : "",
      "items" : [
        {
          "description" : "An object that manages an app’s main event loop and resources used by all of that app’s objects.",
          "name" : "NSApplication",
          "url" : "https:\/\/developer.apple.com\/documentation\/AppKit\/NSApplication"
        },
        {
          "description" : "An object that can manipulate and provide information for a single instance of an app.",
          "name" : "NSRunningApplication",
          "url" : "https:\/\/developer.apple.com\/documentation\/AppKit\/NSRunningApplication"
        },
        {
          "description" : "A set of methods that manage your app’s life cycle and its interaction with common system services.",
          "name" : "NSApplicationDelegate",
          "url" : "https:\/\/developer.apple.com\/documentation\/AppKit\/NSApplicationDelegate"
        }
      ],
      "title" : "Life Cycle"
    }
  ],
  "source" : "appleJSON",
  "title" : "NSApplicationMain(_:_:)",
  "url" : "https:\/\/developer.apple.com\/documentation\/AppKit\/NSApplicationMain(_:_:)"
}