{
  "abstract" : "Draws the receiver’s markers in `aRect`, which is expressed in the receiver’s coordinate system.",
  "codeExamples" : [

  ],
  "contentHash" : "e58c7d722b4c71f3853cfbd4242c93fcebba73ad6be76dd4b60b055936b310e3",
  "crawledAt" : "2025-12-03T08:38:38Z",
  "declaration" : {
    "code" : "@MainActor func drawMarkers(in rect: NSRect)",
    "language" : "swift"
  },
  "id" : "7F32D698-B96A-44D6-A7E8-2073E32D93A6",
  "kind" : "method",
  "language" : "swift",
  "module" : "AppKit",
  "overview" : "## Discussion\n\nThis method is invoked by [doc:\/\/com.apple.appkit\/documentation\/AppKit\/NSRulerMarker\/draw(_:)]; you should never need to invoke it directly, but you might want to override it if you want to do something different when drawing markers.",
  "platforms" : [
    "macOS"
  ],
  "rawMarkdown" : "---\nsource: https:\/\/developer.apple.com\/documentation\/AppKit\/NSRulerView\/drawMarkers(in:)\ncrawled: 2025-12-03T08:38:38Z\n---\n\n# drawMarkers(in:)\n\n**Instance Method**\n\nDraws the receiver’s markers in `aRect`, which is expressed in the receiver’s coordinate system.\n\n## Declaration\n\n```swift\n@MainActor func drawMarkers(in rect: NSRect)\n```\n\n## Discussion\n\nThis method is invoked by [doc:\/\/com.apple.appkit\/documentation\/AppKit\/NSRulerMarker\/draw(_:)]; you should never need to invoke it directly, but you might want to override it if you want to do something different when drawing markers.\n\n## Related Documentation\n\n- **reservedThicknessForMarkers**: The room available for ruler markers to `thickness`.\n\n## Drawing\n\n- **drawHashMarksAndLabels(in:)**: Draws the receiver’s hash marks and labels in `aRect`, which is expressed in the receiver’s coordinate system.\n- **invalidateHashMarks()**: Forces recalculation of the hash mark spacing for the next time the receiver is displayed.\n\n",
  "sections" : [
    {
      "content" : "",
      "items" : [
        {
          "description" : "The room available for ruler markers to `thickness`.",
          "name" : "reservedThicknessForMarkers",
          "url" : "https:\/\/developer.apple.com\/documentation\/AppKit\/NSRulerView\/reservedThicknessForMarkers"
        }
      ],
      "title" : "Related Documentation"
    },
    {
      "content" : "",
      "items" : [
        {
          "description" : "Draws the receiver’s hash marks and labels in `aRect`, which is expressed in the receiver’s coordinate system.",
          "name" : "drawHashMarksAndLabels(in:)",
          "url" : "https:\/\/developer.apple.com\/documentation\/AppKit\/NSRulerView\/drawHashMarksAndLabels(in:)"
        },
        {
          "description" : "Forces recalculation of the hash mark spacing for the next time the receiver is displayed.",
          "name" : "invalidateHashMarks()",
          "url" : "https:\/\/developer.apple.com\/documentation\/AppKit\/NSRulerView\/invalidateHashMarks()"
        }
      ],
      "title" : "Drawing"
    }
  ],
  "source" : "appleJSON",
  "title" : "drawMarkers(in:)",
  "url" : "https:\/\/developer.apple.com\/documentation\/AppKit\/NSRulerView\/drawMarkers(in:)"
}