{
  "abstract" : "Cancels the find indicator immediately.",
  "codeExamples" : [

  ],
  "contentHash" : "97fb47436fdd88297c19a04d38a7c42c19cbc77177b4e89e09033b6e6d3a2fff",
  "crawledAt" : "2025-12-05T12:19:28Z",
  "declaration" : {
    "code" : "func cancelFindIndicator()",
    "language" : "swift"
  },
  "id" : "B4FC1094-23A8-4E0C-9081-A40C4B2D990C",
  "kind" : "method",
  "language" : "swift",
  "module" : "AppKit",
  "overview" : "## Discussion\n\nThere may be some circumstances where the find indicator should be immediately cancelled or hidden, such as when the view’s content or selection is changed without the knowledge of the text finder. This method will immediately cancel the current find indicator.\n\nThe `NSTextFinder` and `NSView` classes will handle the find indicator correctly when a content view is resized, moved, or removed from the view hierarchy. If your content view’s scrolling is done by an `NSScrollView`, the find indicator will also be handled for you during scrolling.",
  "platforms" : [
    "macOS"
  ],
  "rawMarkdown" : "---\nsource: https:\/\/developer.apple.com\/documentation\/AppKit\/NSTextFinder\/cancelFindIndicator()\ncrawled: 2025-12-05T12:19:28Z\n---\n\n# cancelFindIndicator()\n\n**Instance Method**\n\nCancels the find indicator immediately.\n\n## Declaration\n\n```swift\nfunc cancelFindIndicator()\n```\n\n## Discussion\n\nThere may be some circumstances where the find indicator should be immediately cancelled or hidden, such as when the view’s content or selection is changed without the knowledge of the text finder. This method will immediately cancel the current find indicator.\n\nThe `NSTextFinder` and `NSView` classes will handle the find indicator correctly when a content view is resized, moved, or removed from the view hierarchy. If your content view’s scrolling is done by an `NSScrollView`, the find indicator will also be handled for you during scrolling.\n\n## Related Documentation\n\n- **findIndicatorNeedsUpdate**: Invoke to specify that the find indicator needs updating when not contained within a scroll view.\n\n## Validating and Performing Text Finding\n\n- **performAction(_:)**: Performs the specified text finding action.\n- **validateAction(_:)**: Allows validation of the find action before performing.\n\n",
  "sections" : [
    {
      "content" : "",
      "items" : [
        {
          "description" : "Invoke to specify that the find indicator needs updating when not contained within a scroll view.",
          "name" : "findIndicatorNeedsUpdate",
          "url" : "https:\/\/developer.apple.com\/documentation\/AppKit\/NSTextFinder\/findIndicatorNeedsUpdate"
        }
      ],
      "title" : "Related Documentation"
    },
    {
      "content" : "",
      "items" : [
        {
          "description" : "Performs the specified text finding action.",
          "name" : "performAction(_:)",
          "url" : "https:\/\/developer.apple.com\/documentation\/AppKit\/NSTextFinder\/performAction(_:)"
        },
        {
          "description" : "Allows validation of the find action before performing.",
          "name" : "validateAction(_:)",
          "url" : "https:\/\/developer.apple.com\/documentation\/AppKit\/NSTextFinder\/validateAction(_:)"
        }
      ],
      "title" : "Validating and Performing Text Finding"
    }
  ],
  "source" : "appleJSON",
  "title" : "cancelFindIndicator()",
  "url" : "https:\/\/developer.apple.com\/documentation\/AppKit\/NSTextFinder\/cancelFindIndicator()"
}