{
  "abstract" : "Asks the delegate for a controller that provides a preview column for the specified leaf item.",
  "codeExamples" : [

  ],
  "contentHash" : "75dba4edcb8d8e71cbd40b7593c68ee0de2f6115fb300de4238627ccb2c34368",
  "crawledAt" : "2025-12-05T20:15:55Z",
  "declaration" : {
    "code" : "@MainActor optional func browser(_ browser: NSBrowser, previewViewControllerForLeafItem item: Any) -> NSViewController?",
    "language" : "swift"
  },
  "id" : "7590A1BB-CBF9-45EA-874C-1B7127B297DC",
  "kind" : "method",
  "language" : "swift",
  "module" : "AppKit",
  "overview" : "## Return Value\n\nA view controller that provides a preview column, or `nil` to suppress the preview column.\n\n## Discussion\n\nThe returned controller’s represented object is set to the specified leaf item. This method is called only if the delegate implements the item data source methods.",
  "platforms" : [
    "macOS"
  ],
  "rawMarkdown" : "---\nsource: https:\/\/developer.apple.com\/documentation\/AppKit\/NSBrowserDelegate\/browser(_:previewViewControllerForLeafItem:)\ncrawled: 2025-12-05T20:15:55Z\n---\n\n# browser(_:previewViewControllerForLeafItem:)\n\n**Instance Method**\n\nAsks the delegate for a controller that provides a preview column for the specified leaf item.\n\n## Declaration\n\n```swift\n@MainActor optional func browser(_ browser: NSBrowser, previewViewControllerForLeafItem item: Any) -> NSViewController?\n```\n\n## Parameters\n\n- **browser**: The browser.\n- **item**: The leaf item.\n\n## Return Value\n\nA view controller that provides a preview column, or `nil` to suppress the preview column.\n\n## Discussion\n\nThe returned controller’s represented object is set to the specified leaf item. This method is called only if the delegate implements the item data source methods.\n\n## Accessing Components\n\n- **browser(_:child:ofItem:)**: Asks the delegate to return the child of the specified item at the specified index.\n- **browser(_:isLeafItem:)**: Asks the delegate whether the specified item is a leaf item (an item that cannot be expanded).\n- **browser(_:shouldEditItem:)**: Asks the delegate whether the browser may start an editing session for the specified item.\n- **browser(_:objectValueForItem:)**: Returns the object that the specified item uses to draw its contents.\n- **browser(_:setObjectValue:forItem:)**: Sets the object that the specified item uses to draw its contents to the specified object.\n- **rootItem(for:)**: Asks the delegate to return the root item of the browser.\n- **browser(_:headerViewControllerForItem:)**: Asks the delegate for a controller that provides a header view for the specified column item.\n\n",
  "sections" : [
    {
      "content" : "",
      "items" : [
        {
          "description" : "Asks the delegate to return the child of the specified item at the specified index.",
          "name" : "browser(_:child:ofItem:)",
          "url" : "https:\/\/developer.apple.com\/documentation\/AppKit\/NSBrowserDelegate\/browser(_:child:ofItem:)"
        },
        {
          "description" : "Asks the delegate whether the specified item is a leaf item (an item that cannot be expanded).",
          "name" : "browser(_:isLeafItem:)",
          "url" : "https:\/\/developer.apple.com\/documentation\/AppKit\/NSBrowserDelegate\/browser(_:isLeafItem:)"
        },
        {
          "description" : "Asks the delegate whether the browser may start an editing session for the specified item.",
          "name" : "browser(_:shouldEditItem:)",
          "url" : "https:\/\/developer.apple.com\/documentation\/AppKit\/NSBrowserDelegate\/browser(_:shouldEditItem:)"
        },
        {
          "description" : "Returns the object that the specified item uses to draw its contents.",
          "name" : "browser(_:objectValueForItem:)",
          "url" : "https:\/\/developer.apple.com\/documentation\/AppKit\/NSBrowserDelegate\/browser(_:objectValueForItem:)"
        },
        {
          "description" : "Sets the object that the specified item uses to draw its contents to the specified object.",
          "name" : "browser(_:setObjectValue:forItem:)",
          "url" : "https:\/\/developer.apple.com\/documentation\/AppKit\/NSBrowserDelegate\/browser(_:setObjectValue:forItem:)"
        },
        {
          "description" : "Asks the delegate to return the root item of the browser.",
          "name" : "rootItem(for:)",
          "url" : "https:\/\/developer.apple.com\/documentation\/AppKit\/NSBrowserDelegate\/rootItem(for:)"
        },
        {
          "description" : "Asks the delegate for a controller that provides a header view for the specified column item.",
          "name" : "browser(_:headerViewControllerForItem:)",
          "url" : "https:\/\/developer.apple.com\/documentation\/AppKit\/NSBrowserDelegate\/browser(_:headerViewControllerForItem:)"
        }
      ],
      "title" : "Accessing Components"
    }
  ],
  "source" : "appleJSON",
  "title" : "browser(_:previewViewControllerForLeafItem:)",
  "url" : "https:\/\/developer.apple.com\/documentation\/AppKit\/NSBrowserDelegate\/browser(_:previewViewControllerForLeafItem:)"
}