{
  "abstract" : "The title of the commands section in the Speech Commands window or `nil` if there is no title.",
  "codeExamples" : [

  ],
  "contentHash" : "4d8f106ad09af86ba3c4f336b82689a25699b0d083a5dffd9af08f977c31d98c",
  "crawledAt" : "2025-12-04T11:03:55Z",
  "declaration" : {
    "code" : "var displayedCommandsTitle: String? { get set }",
    "language" : "swift"
  },
  "id" : "C1DD73E2-FBAA-40AE-AB3B-3DE9F82A2211",
  "kind" : "property",
  "language" : "swift",
  "module" : "AppKit",
  "overview" : "## Discussion\n\nWhen this property is a non-empty string, commands are displayed in the Speech Commands window indented under a section with this title. If `title` is `nil` or an empty string, the commands are displayed at the top level of the Speech Commands window. This default is not to display the commands under a section title.",
  "platforms" : [
    "macOS"
  ],
  "rawMarkdown" : "---\nsource: https:\/\/developer.apple.com\/documentation\/AppKit\/NSSpeechRecognizer\/displayedCommandsTitle\ncrawled: 2025-12-04T11:03:55Z\n---\n\n# displayedCommandsTitle\n\n**Instance Property**\n\nThe title of the commands section in the Speech Commands window or `nil` if there is no title.\n\n## Declaration\n\n```swift\nvar displayedCommandsTitle: String? { get set }\n```\n\n## Discussion\n\nWhen this property is a non-empty string, commands are displayed in the Speech Commands window indented under a section with this title. If `title` is `nil` or an empty string, the commands are displayed at the top level of the Speech Commands window. This default is not to display the commands under a section title.\n\n## Configuring Speech Recognizers\n\n- **commands**: An array of strings defining the commands for which the speech recognizer object should listen.\n- **listensInForegroundOnly**: A Boolean value that indicates whether the speech recognizer object should only enable its commands when its application is the frontmost one.\n- **blocksOtherRecognizers**: A Boolean value that indicates whether the speech recognizer object should block all other recognizers (that is, other applications attempting to understand spoken commands) when listening.\n\n",
  "sections" : [
    {
      "content" : "",
      "items" : [
        {
          "description" : "An array of strings defining the commands for which the speech recognizer object should listen.",
          "name" : "commands",
          "url" : "https:\/\/developer.apple.com\/documentation\/AppKit\/NSSpeechRecognizer\/commands"
        },
        {
          "description" : "A Boolean value that indicates whether the speech recognizer object should only enable its commands when its application is the frontmost one.",
          "name" : "listensInForegroundOnly",
          "url" : "https:\/\/developer.apple.com\/documentation\/AppKit\/NSSpeechRecognizer\/listensInForegroundOnly"
        },
        {
          "description" : "A Boolean value that indicates whether the speech recognizer object should block all other recognizers (that is, other applications attempting to understand spoken commands) when listening.",
          "name" : "blocksOtherRecognizers",
          "url" : "https:\/\/developer.apple.com\/documentation\/AppKit\/NSSpeechRecognizer\/blocksOtherRecognizers"
        }
      ],
      "title" : "Configuring Speech Recognizers"
    }
  ],
  "source" : "appleJSON",
  "title" : "displayedCommandsTitle",
  "url" : "https:\/\/developer.apple.com\/documentation\/AppKit\/NSSpeechRecognizer\/displayedCommandsTitle"
}