{
  "abstract" : "A specialized view, such as a button or text field, that notifies your app of relevant events using the target-action design pattern.",
  "codeExamples" : [

  ],
  "conformsTo" : [
    "CVarArg",
    "CustomDebugStringConvertible",
    "CustomStringConvertible",
    "Equatable",
    "Hashable",
    "NSAccessibilityElementProtocol",
    "NSAccessibilityProtocol",
    "NSAnimatablePropertyContainer",
    "NSAppearanceCustomization",
    "NSCoding",
    "NSDraggingDestination",
    "NSObjectProtocol",
    "NSStandardKeyBindingResponding",
    "NSTouchBarProvider",
    "NSUserActivityRestoring",
    "NSUserInterfaceItemIdentification",
    "Sendable",
    "SendableMetatype"
  ],
  "contentHash" : "0affb6d19bca3d0ebcaefa5d1c38eefd31798d819bfb577a9fd06a58e873979e",
  "crawledAt" : "2025-12-04T18:08:24Z",
  "declaration" : {
    "code" : "@MainActor class NSControl",
    "language" : "swift"
  },
  "id" : "81AC0925-2B9E-4532-B144-95F12F133A46",
  "inheritedBy" : [
    "NSBrowser",
    "NSButton",
    "NSColorWell",
    "NSComboButton",
    "NSDatePicker",
    "NSImageView",
    "NSLevelIndicator",
    "NSMatrix",
    "NSPathControl",
    "NSRuleEditor",
    "NSScroller",
    "NSSegmentedControl",
    "NSSlider",
    "NSStepper",
    "NSSwitch",
    "NSTableView",
    "NSTextField"
  ],
  "kind" : "class",
  "language" : "swift",
  "module" : "AppKit",
  "overview" : "## Overview\n\nThe [doc:\/\/com.apple.appkit\/documentation\/AppKit\/NSControl] class is abstract and must be subclassed to be used. Although you can subclass it yourself, more often you use one of the subclasses already defined by AppKit. A control draws content on the screen, automatically handles user interactions with that content, and calls the action method of its target object for any significant user interactions.\n\n### About delegate methods\n\nThe `NSControl` class provides several delegate methods for its subclasses that allow text editing, such as `NSTextField` and `NSMatrix`. These include: [doc:\/\/com.apple.documentation\/documentation\/ObjectiveC\/NSObject-swift.class\/controlTextDidBeginEditing:], [doc:\/\/com.apple.documentation\/documentation\/ObjectiveC\/NSObject-swift.class\/controlTextDidChange:], and [doc:\/\/com.apple.documentation\/documentation\/ObjectiveC\/NSObject-swift.class\/controlTextDidEndEditing:].\n\nNote that although `NSControl` defines delegate methods, it doesn’t itself have a delegate. Any subclass that uses these methods must have a delegate and the methods to get and set it. In addition, a formal delegate protocol [doc:\/\/com.apple.appkit\/documentation\/AppKit\/NSControlTextEditingDelegate] also defines delegate methods used by control delegates.\n\n### Responding to mouse events\n\nWhen the mouse button is pressed while the cursor is within the bounds of the receiver, the system calls [doc:\/\/com.apple.appkit\/documentation\/AppKit\/NSResponder\/mouseDown(with:)]. This method highlights the receiver’s cell and sends it a [doc:\/\/com.apple.appkit\/documentation\/AppKit\/NSCell\/trackMouse(with:in:of:untilMouseUp:)] message. Whenever the cell finishes tracking the mouse (for example, because the cursor has left the cell’s bounds), the cell is unhighlighted. If the mouse button is still down and the cursor reenters the bounds, the cell is again highlighted and a new [doc:\/\/com.apple.appkit\/documentation\/AppKit\/NSCell\/trackMouse(with:in:of:untilMouseUp:)] message is sent. This behavior repeats until the mouse button goes up. If it goes up with the cursor in the control, the state of the control is changed, and the action message is sent to the target. If the mouse button goes up when the cursor is outside the control, no action message is sent.",
  "platforms" : [
    "macOS"
  ],
  "rawMarkdown" : "---\nsource: https:\/\/developer.apple.com\/documentation\/appkit\/nscontrol\ncrawled: 2025-12-04T18:08:24Z\n---\n\n# NSControl\n\n**Class**\n\nA specialized view, such as a button or text field, that notifies your app of relevant events using the target-action design pattern.\n\n## Declaration\n\n```swift\n@MainActor class NSControl\n```\n\n## Overview\n\nThe [doc:\/\/com.apple.appkit\/documentation\/AppKit\/NSControl] class is abstract and must be subclassed to be used. Although you can subclass it yourself, more often you use one of the subclasses already defined by AppKit. A control draws content on the screen, automatically handles user interactions with that content, and calls the action method of its target object for any significant user interactions.\n\n### About delegate methods\n\nThe `NSControl` class provides several delegate methods for its subclasses that allow text editing, such as `NSTextField` and `NSMatrix`. These include: [doc:\/\/com.apple.documentation\/documentation\/ObjectiveC\/NSObject-swift.class\/controlTextDidBeginEditing:], [doc:\/\/com.apple.documentation\/documentation\/ObjectiveC\/NSObject-swift.class\/controlTextDidChange:], and [doc:\/\/com.apple.documentation\/documentation\/ObjectiveC\/NSObject-swift.class\/controlTextDidEndEditing:].\n\nNote that although `NSControl` defines delegate methods, it doesn’t itself have a delegate. Any subclass that uses these methods must have a delegate and the methods to get and set it. In addition, a formal delegate protocol [doc:\/\/com.apple.appkit\/documentation\/AppKit\/NSControlTextEditingDelegate] also defines delegate methods used by control delegates.\n\n### Responding to mouse events\n\nWhen the mouse button is pressed while the cursor is within the bounds of the receiver, the system calls [doc:\/\/com.apple.appkit\/documentation\/AppKit\/NSResponder\/mouseDown(with:)]. This method highlights the receiver’s cell and sends it a [doc:\/\/com.apple.appkit\/documentation\/AppKit\/NSCell\/trackMouse(with:in:of:untilMouseUp:)] message. Whenever the cell finishes tracking the mouse (for example, because the cursor has left the cell’s bounds), the cell is unhighlighted. If the mouse button is still down and the cursor reenters the bounds, the cell is again highlighted and a new [doc:\/\/com.apple.appkit\/documentation\/AppKit\/NSCell\/trackMouse(with:in:of:untilMouseUp:)] message is sent. This behavior repeats until the mouse button goes up. If it goes up with the cursor in the control, the state of the control is changed, and the action message is sent to the target. If the mouse button goes up when the cursor is outside the control, no action message is sent.\n\n## Creating a Control\n\n- **init(frame:)**: Initializes a control with the specified frame rectangle.\n- **init(coder:)**: Initializes a control with data in an unarchiver.\n\n## Enabling and Disabling the Control\n\n- **isEnabled**: A Boolean value that indicates whether the receiver reacts to mouse events.\n\n## Accessing the Control’s Value\n\n- **doubleValue**: The value of the receiver’s cell as a double-precision floating-point number.\n- **floatValue**: The value of the receiver’s cell as a single-precision floating-point number.\n- **intValue**: The value of the receiver’s cell as an integer.\n- **integerValue**: The value of the receiver’s cell as an integer value.\n- **objectValue**: The value of the receiver’s cell as an Objective-C object.\n- **stringValue**: The value of the receiver’s cell as an `NSString` object.\n- **attributedStringValue**: The value of the receiver’s cell as an attributed string.\n\n## Interacting with Other Controls\n\n- **takeDoubleValueFrom(_:)**: Sets the value of the receiver’s cell to a double-precision floating-point value obtained from the specified object.\n- **takeFloatValueFrom(_:)**: Sets the value of the receiver’s cell to a single-precision floating-point value obtained from the specified object.\n- **takeIntValueFrom(_:)**: Sets the value of the receiver’s cell to an integer value obtained from the specified object.\n- **takeIntegerValueFrom(_:)**: Sets the value of the receiver’s cell to an `NSInteger` value obtained from the specified object.\n- **takeObjectValueFrom(_:)**: Sets the value of the receiver’s cell to the object value obtained from the specified object.\n- **takeStringValueFrom(_:)**: Sets the value of the receiver’s cell to the string value obtained from the specified object.\n\n## Formatting Text\n\n- **alignment**: The alignment mode of the text in the receiver’s cell.\n- **font**: The font used to draw text in the receiver’s cell.\n- **lineBreakMode**: The line break mode to use for text in the control’s cell.\n- **usesSingleLineMode**: A Boolean value that indicates whether the text in the control’s cell uses single line mode.\n- **formatter**: The receiver’s formatter.\n- **baseWritingDirection**: The initial writing direction used to determine the actual writing direction for text.\n\n## Managing Expansion Tool Tips\n\n- **draw(withExpansionFrame:in:)**: Performs custom expansion tool tip drawing.\n- **allowsExpansionToolTips**: A Boolean value that indicates whether expansion tool tips are shown when the control is hovered over.\n- **expansionFrame(withFrame:)**: The frame in which a tool tip can be displayed, if needed.\n\n## Managing the Field Editor\n\n- **abortEditing()**: Terminates the current editing operation and discards any edited text.\n- **currentEditor()**: Returns the current field editor for the control.\n- **validateEditing()**: Validates changes to any user-typed text.\n- **edit(withFrame:editor:delegate:event:)**: Begins editing of the receiver’s text using the specified field editor.\n- **endEditing(_:)**: Ends the editing of text in the receiver using the specified field editor.\n- **select(withFrame:editor:delegate:start:length:)**: Selects the specified text range in the receiver’s field editor.\n\n## Control-Editing Notifications\n\n- **textDidBeginEditingNotification**: Sent when a control with editable cells begins an edit session.\n- **textDidChangeNotification**: Sent when the text in the receiving control changes.\n- **textDidEndEditingNotification**: Sent when a control with editable cells ends an editing session.\n\n## Resizing the Control\n\n- **controlSize**: The size of the control.\n- **NSControl.ControlSize**: A constant for specifying a cell’s size.\n- **sizeThatFits(_:)**: Asks the control to calculate and return the size that best fits the specified size.\n- **sizeToFit()**: Resizes the receiver’s frame so that it’s the minimum size needed to contain its cell.\n\n## Displaying a Cell\n\n- **isHighlighted**: A Boolean value that indicates whether the cell is highlighted.\n- **NSControl.ImagePosition**: A constant for specifying the position of a button’s image relative to its title.\n- **NSControl.StateValue**: A constant that indicates whether a control is on, off, or in a mixed state.\n\n## Implementing the Target-Action Mechanism\n\n- **action**: The default action-message selector associated with the control.\n- **target**: The target object that receives action messages from the cell.\n- **isContinuous**: A Boolean value indicating whether the receiver’s cell sends its action message continuously to its target during mouse tracking.\n- **sendAction(_:to:)**: Causes the specified action to be sent to the target.\n- **sendAction(on:)**: Sets the conditions on which the receiver sends action messages to its target.\n\n## Accessing Tags\n\n- **tag**: The tag identifying the receiver (not the tag of the receiver’s cell).\n\n## Activating from the Keyboard\n\n- **performClick(_:)**: Simulates a single mouse click on the receiver.\n- **refusesFirstResponder**: A Boolean value indicating whether the receiver refuses the first responder role.\n\n## Tracking the Mouse\n\n- **mouseDown(with:)**: Informs the receiver that the user has pressed the left mouse button.\n- **ignoresMultiClick**: A Boolean value indicating whether the receiver ignores multiple clicks made in rapid succession.\n\n## Supporting Constraint-Based Layout\n\n- **invalidateIntrinsicContentSize(for:)**: Notifies the control that the intrinsic content size for its cell is no longer valid.\n\n## Deprecated\n\n- **Deprecated Symbols**: Review unsupported symbols and their replacements.\n\n## View fundamentals\n\n- **NSView**: The infrastructure for drawing, printing, and handling events in an app.\n- **NSCell**: A mechanism for displaying text or images in a view object without the overhead of a full [doc:\/\/com.apple.appkit\/documentation\/AppKit\/NSView] subclass.\n- **NSActionCell**: An active area inside a control.\n\n## Inherits From\n\n- NSView\n\n## Inherited By\n\n- NSBrowser\n- NSButton\n- NSColorWell\n- NSComboButton\n- NSDatePicker\n- NSImageView\n- NSLevelIndicator\n- NSMatrix\n- NSPathControl\n- NSRuleEditor\n- NSScroller\n- NSSegmentedControl\n- NSSlider\n- NSStepper\n- NSSwitch\n- NSTableView\n- NSTextField\n\n## Conforms To\n\n- CVarArg\n- CustomDebugStringConvertible\n- CustomStringConvertible\n- Equatable\n- Hashable\n- NSAccessibilityElementProtocol\n- NSAccessibilityProtocol\n- NSAnimatablePropertyContainer\n- NSAppearanceCustomization\n- NSCoding\n- NSDraggingDestination\n- NSObjectProtocol\n- NSStandardKeyBindingResponding\n- NSTouchBarProvider\n- NSUserActivityRestoring\n- NSUserInterfaceItemIdentification\n- Sendable\n- SendableMetatype\n\n",
  "sections" : [
    {
      "content" : "",
      "items" : [
        {
          "description" : "Initializes a control with the specified frame rectangle.",
          "name" : "init(frame:)",
          "url" : "https:\/\/developer.apple.com\/documentation\/AppKit\/NSControl\/init(frame:)"
        },
        {
          "description" : "Initializes a control with data in an unarchiver.",
          "name" : "init(coder:)",
          "url" : "https:\/\/developer.apple.com\/documentation\/AppKit\/NSControl\/init(coder:)"
        }
      ],
      "title" : "Creating a Control"
    },
    {
      "content" : "",
      "items" : [
        {
          "description" : "A Boolean value that indicates whether the receiver reacts to mouse events.",
          "name" : "isEnabled",
          "url" : "https:\/\/developer.apple.com\/documentation\/AppKit\/NSControl\/isEnabled"
        }
      ],
      "title" : "Enabling and Disabling the Control"
    },
    {
      "content" : "",
      "items" : [
        {
          "description" : "The value of the receiver’s cell as a double-precision floating-point number.",
          "name" : "doubleValue",
          "url" : "https:\/\/developer.apple.com\/documentation\/AppKit\/NSControl\/doubleValue"
        },
        {
          "description" : "The value of the receiver’s cell as a single-precision floating-point number.",
          "name" : "floatValue",
          "url" : "https:\/\/developer.apple.com\/documentation\/AppKit\/NSControl\/floatValue"
        },
        {
          "description" : "The value of the receiver’s cell as an integer.",
          "name" : "intValue",
          "url" : "https:\/\/developer.apple.com\/documentation\/AppKit\/NSControl\/intValue"
        },
        {
          "description" : "The value of the receiver’s cell as an integer value.",
          "name" : "integerValue",
          "url" : "https:\/\/developer.apple.com\/documentation\/AppKit\/NSControl\/integerValue"
        },
        {
          "description" : "The value of the receiver’s cell as an Objective-C object.",
          "name" : "objectValue",
          "url" : "https:\/\/developer.apple.com\/documentation\/AppKit\/NSControl\/objectValue"
        },
        {
          "description" : "The value of the receiver’s cell as an `NSString` object.",
          "name" : "stringValue",
          "url" : "https:\/\/developer.apple.com\/documentation\/AppKit\/NSControl\/stringValue"
        },
        {
          "description" : "The value of the receiver’s cell as an attributed string.",
          "name" : "attributedStringValue",
          "url" : "https:\/\/developer.apple.com\/documentation\/AppKit\/NSControl\/attributedStringValue"
        }
      ],
      "title" : "Accessing the Control’s Value"
    },
    {
      "content" : "",
      "items" : [
        {
          "description" : "Sets the value of the receiver’s cell to a double-precision floating-point value obtained from the specified object.",
          "name" : "takeDoubleValueFrom(_:)",
          "url" : "https:\/\/developer.apple.com\/documentation\/AppKit\/NSControl\/takeDoubleValueFrom(_:)"
        },
        {
          "description" : "Sets the value of the receiver’s cell to a single-precision floating-point value obtained from the specified object.",
          "name" : "takeFloatValueFrom(_:)",
          "url" : "https:\/\/developer.apple.com\/documentation\/AppKit\/NSControl\/takeFloatValueFrom(_:)"
        },
        {
          "description" : "Sets the value of the receiver’s cell to an integer value obtained from the specified object.",
          "name" : "takeIntValueFrom(_:)",
          "url" : "https:\/\/developer.apple.com\/documentation\/AppKit\/NSControl\/takeIntValueFrom(_:)"
        },
        {
          "description" : "Sets the value of the receiver’s cell to an `NSInteger` value obtained from the specified object.",
          "name" : "takeIntegerValueFrom(_:)",
          "url" : "https:\/\/developer.apple.com\/documentation\/AppKit\/NSControl\/takeIntegerValueFrom(_:)"
        },
        {
          "description" : "Sets the value of the receiver’s cell to the object value obtained from the specified object.",
          "name" : "takeObjectValueFrom(_:)",
          "url" : "https:\/\/developer.apple.com\/documentation\/AppKit\/NSControl\/takeObjectValueFrom(_:)"
        },
        {
          "description" : "Sets the value of the receiver’s cell to the string value obtained from the specified object.",
          "name" : "takeStringValueFrom(_:)",
          "url" : "https:\/\/developer.apple.com\/documentation\/AppKit\/NSControl\/takeStringValueFrom(_:)"
        }
      ],
      "title" : "Interacting with Other Controls"
    },
    {
      "content" : "",
      "items" : [
        {
          "description" : "The alignment mode of the text in the receiver’s cell.",
          "name" : "alignment",
          "url" : "https:\/\/developer.apple.com\/documentation\/AppKit\/NSControl\/alignment"
        },
        {
          "description" : "The font used to draw text in the receiver’s cell.",
          "name" : "font",
          "url" : "https:\/\/developer.apple.com\/documentation\/AppKit\/NSControl\/font"
        },
        {
          "description" : "The line break mode to use for text in the control’s cell.",
          "name" : "lineBreakMode",
          "url" : "https:\/\/developer.apple.com\/documentation\/AppKit\/NSControl\/lineBreakMode"
        },
        {
          "description" : "A Boolean value that indicates whether the text in the control’s cell uses single line mode.",
          "name" : "usesSingleLineMode",
          "url" : "https:\/\/developer.apple.com\/documentation\/AppKit\/NSControl\/usesSingleLineMode"
        },
        {
          "description" : "The receiver’s formatter.",
          "name" : "formatter",
          "url" : "https:\/\/developer.apple.com\/documentation\/AppKit\/NSControl\/formatter"
        },
        {
          "description" : "The initial writing direction used to determine the actual writing direction for text.",
          "name" : "baseWritingDirection",
          "url" : "https:\/\/developer.apple.com\/documentation\/AppKit\/NSControl\/baseWritingDirection"
        }
      ],
      "title" : "Formatting Text"
    },
    {
      "content" : "",
      "items" : [
        {
          "description" : "Performs custom expansion tool tip drawing.",
          "name" : "draw(withExpansionFrame:in:)",
          "url" : "https:\/\/developer.apple.com\/documentation\/AppKit\/NSControl\/draw(withExpansionFrame:in:)"
        },
        {
          "description" : "A Boolean value that indicates whether expansion tool tips are shown when the control is hovered over.",
          "name" : "allowsExpansionToolTips",
          "url" : "https:\/\/developer.apple.com\/documentation\/AppKit\/NSControl\/allowsExpansionToolTips"
        },
        {
          "description" : "The frame in which a tool tip can be displayed, if needed.",
          "name" : "expansionFrame(withFrame:)",
          "url" : "https:\/\/developer.apple.com\/documentation\/AppKit\/NSControl\/expansionFrame(withFrame:)"
        }
      ],
      "title" : "Managing Expansion Tool Tips"
    },
    {
      "content" : "",
      "items" : [
        {
          "description" : "Terminates the current editing operation and discards any edited text.",
          "name" : "abortEditing()",
          "url" : "https:\/\/developer.apple.com\/documentation\/AppKit\/NSControl\/abortEditing()"
        },
        {
          "description" : "Returns the current field editor for the control.",
          "name" : "currentEditor()",
          "url" : "https:\/\/developer.apple.com\/documentation\/AppKit\/NSControl\/currentEditor()"
        },
        {
          "description" : "Validates changes to any user-typed text.",
          "name" : "validateEditing()",
          "url" : "https:\/\/developer.apple.com\/documentation\/AppKit\/NSControl\/validateEditing()"
        },
        {
          "description" : "Begins editing of the receiver’s text using the specified field editor.",
          "name" : "edit(withFrame:editor:delegate:event:)",
          "url" : "https:\/\/developer.apple.com\/documentation\/AppKit\/NSControl\/edit(withFrame:editor:delegate:event:)"
        },
        {
          "description" : "Ends the editing of text in the receiver using the specified field editor.",
          "name" : "endEditing(_:)",
          "url" : "https:\/\/developer.apple.com\/documentation\/AppKit\/NSControl\/endEditing(_:)"
        },
        {
          "description" : "Selects the specified text range in the receiver’s field editor.",
          "name" : "select(withFrame:editor:delegate:start:length:)",
          "url" : "https:\/\/developer.apple.com\/documentation\/AppKit\/NSControl\/select(withFrame:editor:delegate:start:length:)"
        }
      ],
      "title" : "Managing the Field Editor"
    },
    {
      "content" : "",
      "items" : [
        {
          "description" : "Sent when a control with editable cells begins an edit session.",
          "name" : "textDidBeginEditingNotification",
          "url" : "https:\/\/developer.apple.com\/documentation\/AppKit\/NSControl\/textDidBeginEditingNotification"
        },
        {
          "description" : "Sent when the text in the receiving control changes.",
          "name" : "textDidChangeNotification",
          "url" : "https:\/\/developer.apple.com\/documentation\/AppKit\/NSControl\/textDidChangeNotification"
        },
        {
          "description" : "Sent when a control with editable cells ends an editing session.",
          "name" : "textDidEndEditingNotification",
          "url" : "https:\/\/developer.apple.com\/documentation\/AppKit\/NSControl\/textDidEndEditingNotification"
        }
      ],
      "title" : "Control-Editing Notifications"
    },
    {
      "content" : "",
      "items" : [
        {
          "description" : "The size of the control.",
          "name" : "controlSize",
          "url" : "https:\/\/developer.apple.com\/documentation\/AppKit\/NSControl\/controlSize-swift.property"
        },
        {
          "description" : "A constant for specifying a cell’s size.",
          "name" : "NSControl.ControlSize",
          "url" : "https:\/\/developer.apple.com\/documentation\/AppKit\/NSControl\/ControlSize-swift.enum"
        },
        {
          "description" : "Asks the control to calculate and return the size that best fits the specified size.",
          "name" : "sizeThatFits(_:)",
          "url" : "https:\/\/developer.apple.com\/documentation\/AppKit\/NSControl\/sizeThatFits(_:)"
        },
        {
          "description" : "Resizes the receiver’s frame so that it’s the minimum size needed to contain its cell.",
          "name" : "sizeToFit()",
          "url" : "https:\/\/developer.apple.com\/documentation\/AppKit\/NSControl\/sizeToFit()"
        }
      ],
      "title" : "Resizing the Control"
    },
    {
      "content" : "",
      "items" : [
        {
          "description" : "A Boolean value that indicates whether the cell is highlighted.",
          "name" : "isHighlighted",
          "url" : "https:\/\/developer.apple.com\/documentation\/AppKit\/NSControl\/isHighlighted"
        },
        {
          "description" : "A constant for specifying the position of a button’s image relative to its title.",
          "name" : "NSControl.ImagePosition",
          "url" : "https:\/\/developer.apple.com\/documentation\/AppKit\/NSControl\/ImagePosition"
        },
        {
          "description" : "A constant that indicates whether a control is on, off, or in a mixed state.",
          "name" : "NSControl.StateValue",
          "url" : "https:\/\/developer.apple.com\/documentation\/AppKit\/NSControl\/StateValue"
        }
      ],
      "title" : "Displaying a Cell"
    },
    {
      "content" : "",
      "items" : [
        {
          "description" : "The default action-message selector associated with the control.",
          "name" : "action",
          "url" : "https:\/\/developer.apple.com\/documentation\/AppKit\/NSControl\/action"
        },
        {
          "description" : "The target object that receives action messages from the cell.",
          "name" : "target",
          "url" : "https:\/\/developer.apple.com\/documentation\/AppKit\/NSControl\/target"
        },
        {
          "description" : "A Boolean value indicating whether the receiver’s cell sends its action message continuously to its target during mouse tracking.",
          "name" : "isContinuous",
          "url" : "https:\/\/developer.apple.com\/documentation\/AppKit\/NSControl\/isContinuous"
        },
        {
          "description" : "Causes the specified action to be sent to the target.",
          "name" : "sendAction(_:to:)",
          "url" : "https:\/\/developer.apple.com\/documentation\/AppKit\/NSControl\/sendAction(_:to:)"
        },
        {
          "description" : "Sets the conditions on which the receiver sends action messages to its target.",
          "name" : "sendAction(on:)",
          "url" : "https:\/\/developer.apple.com\/documentation\/AppKit\/NSControl\/sendAction(on:)"
        }
      ],
      "title" : "Implementing the Target-Action Mechanism"
    },
    {
      "content" : "",
      "items" : [
        {
          "description" : "The tag identifying the receiver (not the tag of the receiver’s cell).",
          "name" : "tag",
          "url" : "https:\/\/developer.apple.com\/documentation\/AppKit\/NSControl\/tag"
        }
      ],
      "title" : "Accessing Tags"
    },
    {
      "content" : "",
      "items" : [
        {
          "description" : "Simulates a single mouse click on the receiver.",
          "name" : "performClick(_:)",
          "url" : "https:\/\/developer.apple.com\/documentation\/AppKit\/NSControl\/performClick(_:)"
        },
        {
          "description" : "A Boolean value indicating whether the receiver refuses the first responder role.",
          "name" : "refusesFirstResponder",
          "url" : "https:\/\/developer.apple.com\/documentation\/AppKit\/NSControl\/refusesFirstResponder"
        }
      ],
      "title" : "Activating from the Keyboard"
    },
    {
      "content" : "",
      "items" : [
        {
          "description" : "Informs the receiver that the user has pressed the left mouse button.",
          "name" : "mouseDown(with:)",
          "url" : "https:\/\/developer.apple.com\/documentation\/AppKit\/NSResponder\/mouseDown(with:)"
        },
        {
          "description" : "A Boolean value indicating whether the receiver ignores multiple clicks made in rapid succession.",
          "name" : "ignoresMultiClick",
          "url" : "https:\/\/developer.apple.com\/documentation\/AppKit\/NSControl\/ignoresMultiClick"
        }
      ],
      "title" : "Tracking the Mouse"
    },
    {
      "content" : "",
      "items" : [
        {
          "description" : "Notifies the control that the intrinsic content size for its cell is no longer valid.",
          "name" : "invalidateIntrinsicContentSize(for:)",
          "url" : "https:\/\/developer.apple.com\/documentation\/AppKit\/NSControl\/invalidateIntrinsicContentSize(for:)"
        }
      ],
      "title" : "Supporting Constraint-Based Layout"
    },
    {
      "content" : "",
      "items" : [
        {
          "description" : "Review unsupported symbols and their replacements.",
          "name" : "Deprecated Symbols",
          "url" : "https:\/\/developer.apple.com\/documentation\/AppKit\/nscontrol-deprecated-symbols"
        }
      ],
      "title" : "Deprecated"
    },
    {
      "content" : "",
      "items" : [
        {
          "description" : "The infrastructure for drawing, printing, and handling events in an app.",
          "name" : "NSView",
          "url" : "https:\/\/developer.apple.com\/documentation\/AppKit\/NSView"
        },
        {
          "description" : "A mechanism for displaying text or images in a view object without the overhead of a full [doc:\/\/com.apple.appkit\/documentation\/AppKit\/NSView] subclass.",
          "name" : "NSCell",
          "url" : "https:\/\/developer.apple.com\/documentation\/AppKit\/NSCell"
        },
        {
          "description" : "An active area inside a control.",
          "name" : "NSActionCell",
          "url" : "https:\/\/developer.apple.com\/documentation\/AppKit\/NSActionCell"
        }
      ],
      "title" : "View fundamentals"
    },
    {
      "content" : "",
      "items" : [
        {
          "name" : "NSView"
        }
      ],
      "title" : "Inherits From"
    }
  ],
  "source" : "appleJSON",
  "title" : "NSControl",
  "url" : "https:\/\/developer.apple.com\/documentation\/appkit\/nscontrol"
}