{
  "abstract" : "Renders the printing at the best possible quality, regardless of speed.",
  "codeExamples" : [

  ],
  "contentHash" : "65a704a1eea8bbc1649ef606ccde7aebf3aa6b9cb4a7c9cae8ee9d3714126f1d",
  "crawledAt" : "2025-12-05T22:04:58Z",
  "declaration" : {
    "code" : "case best",
    "language" : "swift"
  },
  "id" : "A019E7EC-22AF-4329-8560-31357C4004C6",
  "kind" : "unknown",
  "language" : "swift",
  "module" : "AppKit",
  "platforms" : [
    "macOS"
  ],
  "rawMarkdown" : "---\nsource: https:\/\/developer.apple.com\/documentation\/AppKit\/NSPrintOperation\/RenderingQuality\/best\ncrawled: 2025-12-05T22:04:58Z\n---\n\n# NSPrintOperation.RenderingQuality.best\n\n**Case**\n\nRenders the printing at the best possible quality, regardless of speed.\n\n## Declaration\n\n```swift\ncase best\n```\n\n## Constants\n\n- **NSPrintOperation.RenderingQuality.responsive**: Sacrifices the least possible amount of rendering quality for speed to maintain a responsive user interface. This option should be used only after establishing that best quality rendering does indeed make the user interface unresponsive.\n\n",
  "sections" : [
    {
      "content" : "",
      "items" : [
        {
          "description" : "Sacrifices the least possible amount of rendering quality for speed to maintain a responsive user interface. This option should be used only after establishing that best quality rendering does indeed make the user interface unresponsive.",
          "name" : "NSPrintOperation.RenderingQuality.responsive",
          "url" : "https:\/\/developer.apple.com\/documentation\/AppKit\/NSPrintOperation\/RenderingQuality\/responsive"
        }
      ],
      "title" : "Constants"
    }
  ],
  "source" : "appleJSON",
  "title" : "NSPrintOperation.RenderingQuality.best",
  "url" : "https:\/\/developer.apple.com\/documentation\/AppKit\/NSPrintOperation\/RenderingQuality\/best"
}