{
  "abstract" : "An operation that overwrites a document’s file or file package with the document’s contents.",
  "codeExamples" : [

  ],
  "contentHash" : "7ee6f448391620fac80750bfccb3e8e3db554fff9f16408d028d0561b11a0b63",
  "crawledAt" : "2025-12-03T09:17:20Z",
  "declaration" : {
    "code" : "case saveOperation",
    "language" : "swift"
  },
  "id" : "18520E09-0E6D-4012-9BFC-F4E4E9658407",
  "kind" : "unknown",
  "language" : "swift",
  "module" : "AppKit",
  "platforms" : [
    "macOS"
  ],
  "rawMarkdown" : "---\nsource: https:\/\/developer.apple.com\/documentation\/AppKit\/NSDocument\/SaveOperationType\/saveOperation\ncrawled: 2025-12-03T09:17:20Z\n---\n\n# NSDocument.SaveOperationType.saveOperation\n\n**Case**\n\nAn operation that overwrites a document’s file or file package with the document’s contents.\n\n## Declaration\n\n```swift\ncase saveOperation\n```\n\n## Constants\n\n- **NSDocument.SaveOperationType.saveAsOperation**: An operation that writes the document’s contents to a new location and updates the document to point to that location\n- **NSDocument.SaveOperationType.saveToOperation**: An operation that writes a copy of the document’s contents to the specified location, without changing the original document’s location.\n- **NSDocument.SaveOperationType.autosaveElsewhereOperation**: An operation that writes an autosave version of the file to a different location.\n- **NSDocument.SaveOperationType.autosaveInPlaceOperation**: An operation that overwrites the document’s current contents with autosave data.\n- **NSDocument.SaveOperationType.autosaveAsOperation**: An operation that writes a document’s contents to a new file or file package even though the user has not explicitly requested it, then changes the document’s current location to point to the just-written file or file package.\n\n",
  "sections" : [
    {
      "content" : "",
      "items" : [
        {
          "description" : "An operation that writes the document’s contents to a new location and updates the document to point to that location",
          "name" : "NSDocument.SaveOperationType.saveAsOperation",
          "url" : "https:\/\/developer.apple.com\/documentation\/AppKit\/NSDocument\/SaveOperationType\/saveAsOperation"
        },
        {
          "description" : "An operation that writes a copy of the document’s contents to the specified location, without changing the original document’s location.",
          "name" : "NSDocument.SaveOperationType.saveToOperation",
          "url" : "https:\/\/developer.apple.com\/documentation\/AppKit\/NSDocument\/SaveOperationType\/saveToOperation"
        },
        {
          "description" : "An operation that writes an autosave version of the file to a different location.",
          "name" : "NSDocument.SaveOperationType.autosaveElsewhereOperation",
          "url" : "https:\/\/developer.apple.com\/documentation\/AppKit\/NSDocument\/SaveOperationType\/autosaveElsewhereOperation"
        },
        {
          "description" : "An operation that overwrites the document’s current contents with autosave data.",
          "name" : "NSDocument.SaveOperationType.autosaveInPlaceOperation",
          "url" : "https:\/\/developer.apple.com\/documentation\/AppKit\/NSDocument\/SaveOperationType\/autosaveInPlaceOperation"
        },
        {
          "description" : "An operation that writes a document’s contents to a new file or file package even though the user has not explicitly requested it, then changes the document’s current location to point to the just-written file or file package.",
          "name" : "NSDocument.SaveOperationType.autosaveAsOperation",
          "url" : "https:\/\/developer.apple.com\/documentation\/AppKit\/NSDocument\/SaveOperationType\/autosaveAsOperation"
        }
      ],
      "title" : "Constants"
    }
  ],
  "source" : "appleJSON",
  "title" : "NSDocument.SaveOperationType.saveOperation",
  "url" : "https:\/\/developer.apple.com\/documentation\/AppKit\/NSDocument\/SaveOperationType\/saveOperation"
}