{
  "abstract" : "Returns the index path of the item at the specified point.",
  "codeExamples" : [

  ],
  "contentHash" : "a9cbc1f43c63220c7d0c263f09b827b416f3ea7d2af1118030dc91eb5b1dfc00",
  "crawledAt" : "2025-12-03T08:46:10Z",
  "declaration" : {
    "code" : "@MainActor func indexPathForItem(at point: NSPoint) -> IndexPath?",
    "language" : "swift"
  },
  "id" : "499365D2-67B9-4C9A-A95B-A95D81159758",
  "kind" : "method",
  "language" : "swift",
  "module" : "AppKit",
  "overview" : "## Return Value\n\nThe item at the specified point or `nil` if no item was found at that point.\n\n## Discussion\n\nThis method uses the available layout attributes to determine which item is at the specified point. If more than one item is at the point, this method returns only the top-most item. This method ignores the opacity of the item, so items that are fully transparent are still returned by this method. Hidden items are never returned.",
  "platforms" : [
    "macOS"
  ],
  "rawMarkdown" : "---\nsource: https:\/\/developer.apple.com\/documentation\/AppKit\/NSCollectionView\/indexPathForItem(at:)\ncrawled: 2025-12-03T08:46:10Z\n---\n\n# indexPathForItem(at:)\n\n**Instance Method**\n\nReturns the index path of the item at the specified point.\n\n## Declaration\n\n```swift\n@MainActor func indexPathForItem(at point: NSPoint) -> IndexPath?\n```\n\n## Parameters\n\n- **point**: The point in the collection viewâ€™s bounds that you want to test.\n\n## Return Value\n\nThe item at the specified point or `nil` if no item was found at that point.\n\n## Discussion\n\nThis method uses the available layout attributes to determine which item is at the specified point. If more than one item is at the point, this method returns only the top-most item. This method ignores the opacity of the item, so items that are fully transparent are still returned by this method. Hidden items are never returned.\n\n## Locating Items and Views\n\n- **visibleItems()**: Returns an array of the actively managed items in the collection view.\n- **indexPathsForVisibleItems()**: Returns the index paths of the currently active items.\n- **visibleSupplementaryViews(ofKind:)**: Returns an array of the actively managed supplementary views in the collection view.\n- **indexPathsForVisibleSupplementaryElements(ofKind:)**: Returns the index paths of the currently active supplementary views.\n- **indexPath(for:)**: Returns the index path of the specified item.\n- **item(at:)**: Returns the item associated with the specified index path.\n- **supplementaryView(forElementKind:at:)**: Returns the supplementary view associated with the specified index path.\n- **scrollToItems(at:scrollPosition:)**: Scrolls the collection view contents until the specified items are visible.\n\n",
  "sections" : [
    {
      "content" : "",
      "items" : [
        {
          "description" : "Returns an array of the actively managed items in the collection view.",
          "name" : "visibleItems()",
          "url" : "https:\/\/developer.apple.com\/documentation\/AppKit\/NSCollectionView\/visibleItems()"
        },
        {
          "description" : "Returns the index paths of the currently active items.",
          "name" : "indexPathsForVisibleItems()",
          "url" : "https:\/\/developer.apple.com\/documentation\/AppKit\/NSCollectionView\/indexPathsForVisibleItems()"
        },
        {
          "description" : "Returns an array of the actively managed supplementary views in the collection view.",
          "name" : "visibleSupplementaryViews(ofKind:)",
          "url" : "https:\/\/developer.apple.com\/documentation\/AppKit\/NSCollectionView\/visibleSupplementaryViews(ofKind:)"
        },
        {
          "description" : "Returns the index paths of the currently active supplementary views.",
          "name" : "indexPathsForVisibleSupplementaryElements(ofKind:)",
          "url" : "https:\/\/developer.apple.com\/documentation\/AppKit\/NSCollectionView\/indexPathsForVisibleSupplementaryElements(ofKind:)"
        },
        {
          "description" : "Returns the index path of the specified item.",
          "name" : "indexPath(for:)",
          "url" : "https:\/\/developer.apple.com\/documentation\/AppKit\/NSCollectionView\/indexPath(for:)"
        },
        {
          "description" : "Returns the item associated with the specified index path.",
          "name" : "item(at:)",
          "url" : "https:\/\/developer.apple.com\/documentation\/AppKit\/NSCollectionView\/item(at:)-2vx2h"
        },
        {
          "description" : "Returns the supplementary view associated with the specified index path.",
          "name" : "supplementaryView(forElementKind:at:)",
          "url" : "https:\/\/developer.apple.com\/documentation\/AppKit\/NSCollectionView\/supplementaryView(forElementKind:at:)"
        },
        {
          "description" : "Scrolls the collection view contents until the specified items are visible.",
          "name" : "scrollToItems(at:scrollPosition:)",
          "url" : "https:\/\/developer.apple.com\/documentation\/AppKit\/NSCollectionView\/scrollToItems(at:scrollPosition:)"
        }
      ],
      "title" : "Locating Items and Views"
    }
  ],
  "source" : "appleJSON",
  "title" : "indexPathForItem(at:)",
  "url" : "https:\/\/developer.apple.com\/documentation\/AppKit\/NSCollectionView\/indexPathForItem(at:)"
}