{
  "abstract" : "A Boolean value that indicates whether the speech recognizer object should block all other recognizers (that is, other applications attempting to understand spoken commands) when listening.",
  "codeExamples" : [

  ],
  "contentHash" : "3bd27b2652378a558e8295a6b50fa9d34b7b999fb7227963f565457405c80af8",
  "crawledAt" : "2025-12-04T11:03:57Z",
  "declaration" : {
    "code" : "var blocksOtherRecognizers: Bool { get set }",
    "language" : "swift"
  },
  "id" : "8592B378-AFAD-40FF-8E0E-9BEF498DA2D0",
  "kind" : "property",
  "language" : "swift",
  "module" : "AppKit",
  "overview" : "## Discussion\n\nWhen the value of this property is [doc:\/\/com.apple.documentation\/documentation\/Swift\/true], all other speech recognition commands on the system are disabled until the speech recognizer is released, listening is stopped, or the property is set to [doc:\/\/com.apple.documentation\/documentation\/Swift\/false]. Setting this property to [doc:\/\/com.apple.documentation\/documentation\/Swift\/true] effectively takes over the computer at the expense of other applications using speech recognition, so you should use it only in circumstances that warrant it, such as when listening for a response important to overall system operation or when an application is running in full-screen mode (such as games and presentation software). The default is value of this property is [doc:\/\/com.apple.documentation\/documentation\/Swift\/false].",
  "platforms" : [
    "macOS"
  ],
  "rawMarkdown" : "---\nsource: https:\/\/developer.apple.com\/documentation\/AppKit\/NSSpeechRecognizer\/blocksOtherRecognizers\ncrawled: 2025-12-04T11:03:57Z\n---\n\n# blocksOtherRecognizers\n\n**Instance Property**\n\nA Boolean value that indicates whether the speech recognizer object should block all other recognizers (that is, other applications attempting to understand spoken commands) when listening.\n\n## Declaration\n\n```swift\nvar blocksOtherRecognizers: Bool { get set }\n```\n\n## Discussion\n\nWhen the value of this property is [doc:\/\/com.apple.documentation\/documentation\/Swift\/true], all other speech recognition commands on the system are disabled until the speech recognizer is released, listening is stopped, or the property is set to [doc:\/\/com.apple.documentation\/documentation\/Swift\/false]. Setting this property to [doc:\/\/com.apple.documentation\/documentation\/Swift\/true] effectively takes over the computer at the expense of other applications using speech recognition, so you should use it only in circumstances that warrant it, such as when listening for a response important to overall system operation or when an application is running in full-screen mode (such as games and presentation software). The default is value of this property is [doc:\/\/com.apple.documentation\/documentation\/Swift\/false].\n\n## Configuring Speech Recognizers\n\n- **commands**: An array of strings defining the commands for which the speech recognizer object should listen.\n- **displayedCommandsTitle**: The title of the commands section in the Speech Commands window or `nil` if there is no title.\n- **listensInForegroundOnly**: A Boolean value that indicates whether the speech recognizer object should only enable its commands when its application is the frontmost one.\n\n",
  "sections" : [
    {
      "content" : "",
      "items" : [
        {
          "description" : "An array of strings defining the commands for which the speech recognizer object should listen.",
          "name" : "commands",
          "url" : "https:\/\/developer.apple.com\/documentation\/AppKit\/NSSpeechRecognizer\/commands"
        },
        {
          "description" : "The title of the commands section in the Speech Commands window or `nil` if there is no title.",
          "name" : "displayedCommandsTitle",
          "url" : "https:\/\/developer.apple.com\/documentation\/AppKit\/NSSpeechRecognizer\/displayedCommandsTitle"
        },
        {
          "description" : "A Boolean value that indicates whether the speech recognizer object should only enable its commands when its application is the frontmost one.",
          "name" : "listensInForegroundOnly",
          "url" : "https:\/\/developer.apple.com\/documentation\/AppKit\/NSSpeechRecognizer\/listensInForegroundOnly"
        }
      ],
      "title" : "Configuring Speech Recognizers"
    }
  ],
  "source" : "appleJSON",
  "title" : "blocksOtherRecognizers",
  "url" : "https:\/\/developer.apple.com\/documentation\/AppKit\/NSSpeechRecognizer\/blocksOtherRecognizers"
}