{
  "abstract" : "Returns the text tab closest to the specified glyph location and not beyond a maximum position.",
  "codeExamples" : [

  ],
  "contentHash" : "0ae8d84d96a304b94c757fde04b815c966c74c7c2acad0c68b31db31d8340983",
  "crawledAt" : "2025-12-02T07:32:52Z",
  "declaration" : {
    "code" : "func textTab(forGlyphLocation glyphLocation: CGFloat, writingDirection direction: NSWritingDirection, maxLocation: CGFloat) -> NSTextTab?",
    "language" : "swift"
  },
  "id" : "116B6285-16E8-440F-ABCE-9821061F6B63",
  "kind" : "method",
  "module" : "AppKit",
  "overview" : "## Discussion\n\nThe typesetter calls this method whenever it finds a tab character. To determine the width to advance the next glyph, the typesetter examines the [doc:\/\/com.apple.appkit\/documentation\/AppKit\/NSParagraphStyle] tab array and the default tab interval.",
  "platforms" : [
    "macOS"
  ],
  "rawMarkdown" : "---\nsource: https:\/\/developer.apple.com\/documentation\/AppKit\/NSATSTypesetter\/textTab(forGlyphLocation:writingDirection:maxLocation:)\ncrawled: 2025-12-02T07:32:52Z\n---\n\n# textTab(forGlyphLocation:writingDirection:maxLocation:)\n\n**Instance Method**\n\nReturns the text tab closest to the specified glyph location and not beyond a maximum position.\n\n## Declaration\n\n```swift\nfunc textTab(forGlyphLocation glyphLocation: CGFloat, writingDirection direction: NSWritingDirection, maxLocation: CGFloat) -> NSTextTab?\n```\n\n## Discussion\n\nThe typesetter calls this method whenever it finds a tab character. To determine the width to advance the next glyph, the typesetter examines the [doc:\/\/com.apple.appkit\/documentation\/AppKit\/NSParagraphStyle] tab array and the default tab interval.\n\n",
  "sections" : [

  ],
  "source" : "appleJSON",
  "title" : "textTab(forGlyphLocation:writingDirection:maxLocation:)",
  "url" : "https:\/\/developer.apple.com\/documentation\/AppKit\/NSATSTypesetter\/textTab(forGlyphLocation:writingDirection:maxLocation:)"
}