{
  "abstract" : "Registers the pasteboard types the receiver can send and receive in response to service requests.",
  "codeExamples" : [

  ],
  "contentHash" : "9283808be91b6974cea3606de30e26a88f198760548802f34f6dbf1b8c445ea3",
  "crawledAt" : "2025-12-04T18:04:30Z",
  "declaration" : {
    "code" : "@MainActor func registerServicesMenuSendTypes(_ sendTypes: [NSPasteboard.PasteboardType], returnTypes: [NSPasteboard.PasteboardType])",
    "language" : "swift"
  },
  "id" : "0AB38C05-F30A-4939-B363-B3D329986671",
  "kind" : "method",
  "language" : "swift",
  "module" : "AppKit",
  "overview" : "## Discussion\n\nIf the receiver has a Services menu, a menu item is added for each service provider that can accept one of the specified `sendTypes` or return one of the specified `returnTypes`. You should typically invoke this method at app startup time or when an object that can use services is created. You can invoke it more than once—its purpose is to ensure there is a menu item for every service the app can use. The event-handling mechanism will dynamically enable the individual items to indicate which services are currently appropriate. All the `NSResponder` objects in your app (typically `NSView` objects) should register every possible type they can send and receive by sending this message to `NSApp`.",
  "platforms" : [
    "macOS"
  ],
  "rawMarkdown" : "---\nsource: https:\/\/developer.apple.com\/documentation\/AppKit\/NSApplication\/registerServicesMenuSendTypes(_:returnTypes:)\ncrawled: 2025-12-04T18:04:30Z\n---\n\n# registerServicesMenuSendTypes(_:returnTypes:)\n\n**Instance Method**\n\nRegisters the pasteboard types the receiver can send and receive in response to service requests.\n\n## Declaration\n\n```swift\n@MainActor func registerServicesMenuSendTypes(_ sendTypes: [NSPasteboard.PasteboardType], returnTypes: [NSPasteboard.PasteboardType])\n```\n\n## Parameters\n\n- **sendTypes**: An array of `NSString` objects, each of which corresponds to a particular pasteboard type that the app can send.\n- **returnTypes**: An array of `NSString` objects, each of which corresponds to a particular pasteboard type that the app can receive.\n\n## Discussion\n\nIf the receiver has a Services menu, a menu item is added for each service provider that can accept one of the specified `sendTypes` or return one of the specified `returnTypes`. You should typically invoke this method at app startup time or when an object that can use services is created. You can invoke it more than once—its purpose is to ensure there is a menu item for every service the app can use. The event-handling mechanism will dynamically enable the individual items to indicate which services are currently appropriate. All the `NSResponder` objects in your app (typically `NSView` objects) should register every possible type they can send and receive by sending this message to `NSApp`.\n\n## Related Documentation\n\n- **validRequestor(forSendType:returnType:)**: Indicates whether the receiver can send and receive the specified pasteboard types.\n\n## Managing the Services Menu\n\n- **servicesMenu**: The app’s Services menu.\n\n",
  "sections" : [
    {
      "content" : "",
      "items" : [
        {
          "description" : "Indicates whether the receiver can send and receive the specified pasteboard types.",
          "name" : "validRequestor(forSendType:returnType:)",
          "url" : "https:\/\/developer.apple.com\/documentation\/AppKit\/NSApplication\/validRequestor(forSendType:returnType:)"
        }
      ],
      "title" : "Related Documentation"
    },
    {
      "content" : "",
      "items" : [
        {
          "description" : "The app’s Services menu.",
          "name" : "servicesMenu",
          "url" : "https:\/\/developer.apple.com\/documentation\/AppKit\/NSApplication\/servicesMenu"
        }
      ],
      "title" : "Managing the Services Menu"
    }
  ],
  "source" : "appleJSON",
  "title" : "registerServicesMenuSendTypes(_:returnTypes:)",
  "url" : "https:\/\/developer.apple.com\/documentation\/AppKit\/NSApplication\/registerServicesMenuSendTypes(_:returnTypes:)"
}