{
  "abstract" : "An object used to add an extra visual decoration to an item in a collection view.",
  "codeExamples" : [

  ],
  "conformsTo" : [
    "CVarArg",
    "CustomDebugStringConvertible",
    "CustomStringConvertible",
    "Equatable",
    "Hashable",
    "NSCopying",
    "NSObjectProtocol"
  ],
  "contentHash" : "9c47896ebf17b52f064f4c812a1ce328fbe5fe7961dce3d98d0cab0b223ef103",
  "crawledAt" : "2025-12-04T12:25:48Z",
  "declaration" : {
    "code" : "@MainActor class NSCollectionLayoutSupplementaryItem",
    "language" : "swift"
  },
  "id" : "DFA8C206-7255-49AD-B7B9-952B940F772D",
  "inheritedBy" : [
    "NSCollectionLayoutBoundarySupplementaryItem"
  ],
  "kind" : "class",
  "language" : "swift",
  "module" : "AppKit",
  "overview" : "## Overview\n\nYou use supplementary items to attach additional views to your content. For example, you might attach a badge to an item or a frame around a group. A supplementary item follows the index path of the item it’s attached to.\n\nIf you want to create a header or footer for your layout or its sections, use a boundary supplementary item (<````NSCollectionLayoutBoundarySupplementaryItem``>) instead.\n\nEach type of supplementary item must have a unique element kind. Consider tracking these strings together in a way that makes it straightforward to identify each element, for example:\n\nAdd supplementary items to an item by passing in an array of supplementary items when you construct the item:",
  "platforms" : [
    "macOS"
  ],
  "rawMarkdown" : "---\nsource: https:\/\/developer.apple.com\/documentation\/AppKit\/NSCollectionLayoutSupplementaryItem\ncrawled: 2025-12-04T12:25:48Z\n---\n\n# NSCollectionLayoutSupplementaryItem\n\n**Class**\n\nAn object used to add an extra visual decoration to an item in a collection view.\n\n## Declaration\n\n```swift\n@MainActor class NSCollectionLayoutSupplementaryItem\n```\n\n## Overview\n\nYou use supplementary items to attach additional views to your content. For example, you might attach a badge to an item or a frame around a group. A supplementary item follows the index path of the item it’s attached to.\n\nIf you want to create a header or footer for your layout or its sections, use a boundary supplementary item (<````NSCollectionLayoutBoundarySupplementaryItem``>) instead.\n\nEach type of supplementary item must have a unique element kind. Consider tracking these strings together in a way that makes it straightforward to identify each element, for example:\n\n\n\nAdd supplementary items to an item by passing in an array of supplementary items when you construct the item:\n\n\n\n## Creating a supplementary item\n\n- **init(layoutSize:elementKind:containerAnchor:)**: Creates a supplementary item of the specified size and element kind, with an anchor relative to a container.\n- **init(layoutSize:elementKind:containerAnchor:itemAnchor:)**: Creates a supplementary item of the specified size and element kind, an anchor relative to a container, and an anchor relative to an item.\n\n## Getting the anchors\n\n- **itemAnchor**: The anchor between the supplementary item and the item it’s attached to.\n- **containerAnchor**: The anchor between the supplementary item and the container it’s attached to.\n\n## Getting the element kind\n\n- **elementKind**: A string that identifies the type of supplementary item.\n\n## Specifying stacking order\n\n- **zIndex**: The vertical stacking order of the supplementary item in relation to other items in the section.\n\n## Appearance\n\n- **NSCollectionLayoutBoundarySupplementaryItem**: An object used to add headers or footers to a collection view.\n- **NSCollectionLayoutDecorationItem**: An object used to add a background to a section of a collection view.\n- **NSCollectionLayoutAnchor**: An object that defines how to attach a supplementary item to an item in a collection view.\n\n## Inherits From\n\n- NSCollectionLayoutItem\n\n## Inherited By\n\n- NSCollectionLayoutBoundarySupplementaryItem\n\n## Conforms To\n\n- CVarArg\n- CustomDebugStringConvertible\n- CustomStringConvertible\n- Equatable\n- Hashable\n- NSCopying\n- NSObjectProtocol\n\n",
  "sections" : [
    {
      "content" : "",
      "items" : [
        {
          "description" : "Creates a supplementary item of the specified size and element kind, with an anchor relative to a container.",
          "name" : "init(layoutSize:elementKind:containerAnchor:)",
          "url" : "https:\/\/developer.apple.com\/documentation\/AppKit\/NSCollectionLayoutSupplementaryItem\/init(layoutSize:elementKind:containerAnchor:)"
        },
        {
          "description" : "Creates a supplementary item of the specified size and element kind, an anchor relative to a container, and an anchor relative to an item.",
          "name" : "init(layoutSize:elementKind:containerAnchor:itemAnchor:)",
          "url" : "https:\/\/developer.apple.com\/documentation\/AppKit\/NSCollectionLayoutSupplementaryItem\/init(layoutSize:elementKind:containerAnchor:itemAnchor:)"
        }
      ],
      "title" : "Creating a supplementary item"
    },
    {
      "content" : "",
      "items" : [
        {
          "description" : "The anchor between the supplementary item and the item it’s attached to.",
          "name" : "itemAnchor",
          "url" : "https:\/\/developer.apple.com\/documentation\/AppKit\/NSCollectionLayoutSupplementaryItem\/itemAnchor"
        },
        {
          "description" : "The anchor between the supplementary item and the container it’s attached to.",
          "name" : "containerAnchor",
          "url" : "https:\/\/developer.apple.com\/documentation\/AppKit\/NSCollectionLayoutSupplementaryItem\/containerAnchor"
        }
      ],
      "title" : "Getting the anchors"
    },
    {
      "content" : "",
      "items" : [
        {
          "description" : "A string that identifies the type of supplementary item.",
          "name" : "elementKind",
          "url" : "https:\/\/developer.apple.com\/documentation\/AppKit\/NSCollectionLayoutSupplementaryItem\/elementKind"
        }
      ],
      "title" : "Getting the element kind"
    },
    {
      "content" : "",
      "items" : [
        {
          "description" : "The vertical stacking order of the supplementary item in relation to other items in the section.",
          "name" : "zIndex",
          "url" : "https:\/\/developer.apple.com\/documentation\/AppKit\/NSCollectionLayoutSupplementaryItem\/zIndex"
        }
      ],
      "title" : "Specifying stacking order"
    },
    {
      "content" : "",
      "items" : [
        {
          "description" : "An object used to add headers or footers to a collection view.",
          "name" : "NSCollectionLayoutBoundarySupplementaryItem",
          "url" : "https:\/\/developer.apple.com\/documentation\/AppKit\/NSCollectionLayoutBoundarySupplementaryItem"
        },
        {
          "description" : "An object used to add a background to a section of a collection view.",
          "name" : "NSCollectionLayoutDecorationItem",
          "url" : "https:\/\/developer.apple.com\/documentation\/AppKit\/NSCollectionLayoutDecorationItem"
        },
        {
          "description" : "An object that defines how to attach a supplementary item to an item in a collection view.",
          "name" : "NSCollectionLayoutAnchor",
          "url" : "https:\/\/developer.apple.com\/documentation\/AppKit\/NSCollectionLayoutAnchor"
        }
      ],
      "title" : "Appearance"
    },
    {
      "content" : "",
      "items" : [
        {
          "name" : "NSCollectionLayoutItem"
        }
      ],
      "title" : "Inherits From"
    }
  ],
  "source" : "appleJSON",
  "title" : "NSCollectionLayoutSupplementaryItem",
  "url" : "https:\/\/developer.apple.com\/documentation\/AppKit\/NSCollectionLayoutSupplementaryItem"
}