{
  "abstract" : "Informs the client that `aRulerView` will move `aMarker`, an NSRulerMarker already on the ruler view.",
  "codeExamples" : [

  ],
  "contentHash" : "6bed8d139374d4d8310aa9625e5d27ee660cc11c1732b8e60aabf8f534f0f155",
  "crawledAt" : "2025-12-04T20:05:28Z",
  "declaration" : {
    "code" : "@MainActor func rulerView(_ ruler: NSRulerView, willMove marker: NSRulerMarker, toLocation location: CGFloat) -> CGFloat",
    "language" : "swift"
  },
  "id" : "2BD519B4-A291-4BAE-A723-8372A973A66C",
  "kind" : "method",
  "language" : "swift",
  "module" : "AppKit",
  "overview" : "## Discussion\n\n`location` is the marker’s tentative new location, expressed in the client view’s coordinate system. The value returned by the client view is actually used; the client can simply return `location` unchanged or adjust it as needed. For example, it may snap the location to a grid. This message is sent repeatedly to the client as the user drags the marker.",
  "platforms" : [
    "macOS"
  ],
  "rawMarkdown" : "---\nsource: https:\/\/developer.apple.com\/documentation\/AppKit\/NSView\/rulerView(_:willMove:toLocation:)\ncrawled: 2025-12-04T20:05:28Z\n---\n\n# rulerView(_:willMove:toLocation:)\n\n**Instance Method**\n\nInforms the client that `aRulerView` will move `aMarker`, an NSRulerMarker already on the ruler view.\n\n## Declaration\n\n```swift\n@MainActor func rulerView(_ ruler: NSRulerView, willMove marker: NSRulerMarker, toLocation location: CGFloat) -> CGFloat\n```\n\n## Discussion\n\n`location` is the marker’s tentative new location, expressed in the client view’s coordinate system. The value returned by the client view is actually used; the client can simply return `location` unchanged or adjust it as needed. For example, it may snap the location to a grid. This message is sent repeatedly to the client as the user drags the marker.\n\n## Synchronizing with Ruler Views\n\n- **rulerView(_:didAdd:)**: Informs the client that `aRulerView` allowed the user to add `aMarker`.\n- **rulerView(_:didMove:)**: Informs the client that `aRulerView` allowed the user to move `aMarker`.\n- **rulerView(_:didRemove:)**: Informs the client that `aRulerView` allowed the user to remove `aMarker`.\n- **rulerView(_:handleMouseDownWith:)**: Informs the client that the user has pressed the mouse button while the cursor is in the ruler area of `aRulerView`.\n- **rulerView(_:locationFor:)**\n- **rulerView(_:pointForLocation:)**\n- **rulerView(_:shouldAdd:)**: Requests permission for `aRulerView` to add `aMarker`, an NSRulerMarker being dragged onto the ruler by the user.\n- **rulerView(_:shouldMove:)**: Requests permission for `aRulerView` to move `aMarker`.\n- **rulerView(_:shouldRemove:)**: Requests permission for `aRulerView` to remove `aMarker`.\n- **rulerView(_:willAdd:atLocation:)**: Informs the client that `aRulerView` will add the new NSRulerMarker, `aMarker`.\n- **rulerView(_:willSetClientView:)**: Informs the client view that `aRulerView` is about to be appropriated by `newClient`.\n\n",
  "sections" : [
    {
      "content" : "",
      "items" : [
        {
          "description" : "Informs the client that `aRulerView` allowed the user to add `aMarker`.",
          "name" : "rulerView(_:didAdd:)",
          "url" : "https:\/\/developer.apple.com\/documentation\/AppKit\/NSView\/rulerView(_:didAdd:)"
        },
        {
          "description" : "Informs the client that `aRulerView` allowed the user to move `aMarker`.",
          "name" : "rulerView(_:didMove:)",
          "url" : "https:\/\/developer.apple.com\/documentation\/AppKit\/NSView\/rulerView(_:didMove:)"
        },
        {
          "description" : "Informs the client that `aRulerView` allowed the user to remove `aMarker`.",
          "name" : "rulerView(_:didRemove:)",
          "url" : "https:\/\/developer.apple.com\/documentation\/AppKit\/NSView\/rulerView(_:didRemove:)"
        },
        {
          "description" : "Informs the client that the user has pressed the mouse button while the cursor is in the ruler area of `aRulerView`.",
          "name" : "rulerView(_:handleMouseDownWith:)",
          "url" : "https:\/\/developer.apple.com\/documentation\/AppKit\/NSView\/rulerView(_:handleMouseDownWith:)"
        },
        {
          "description" : "",
          "name" : "rulerView(_:locationFor:)",
          "url" : "https:\/\/developer.apple.com\/documentation\/AppKit\/NSView\/rulerView(_:locationFor:)"
        },
        {
          "description" : "",
          "name" : "rulerView(_:pointForLocation:)",
          "url" : "https:\/\/developer.apple.com\/documentation\/AppKit\/NSView\/rulerView(_:pointForLocation:)"
        },
        {
          "description" : "Requests permission for `aRulerView` to add `aMarker`, an NSRulerMarker being dragged onto the ruler by the user.",
          "name" : "rulerView(_:shouldAdd:)",
          "url" : "https:\/\/developer.apple.com\/documentation\/AppKit\/NSView\/rulerView(_:shouldAdd:)"
        },
        {
          "description" : "Requests permission for `aRulerView` to move `aMarker`.",
          "name" : "rulerView(_:shouldMove:)",
          "url" : "https:\/\/developer.apple.com\/documentation\/AppKit\/NSView\/rulerView(_:shouldMove:)"
        },
        {
          "description" : "Requests permission for `aRulerView` to remove `aMarker`.",
          "name" : "rulerView(_:shouldRemove:)",
          "url" : "https:\/\/developer.apple.com\/documentation\/AppKit\/NSView\/rulerView(_:shouldRemove:)"
        },
        {
          "description" : "Informs the client that `aRulerView` will add the new NSRulerMarker, `aMarker`.",
          "name" : "rulerView(_:willAdd:atLocation:)",
          "url" : "https:\/\/developer.apple.com\/documentation\/AppKit\/NSView\/rulerView(_:willAdd:atLocation:)"
        },
        {
          "description" : "Informs the client view that `aRulerView` is about to be appropriated by `newClient`.",
          "name" : "rulerView(_:willSetClientView:)",
          "url" : "https:\/\/developer.apple.com\/documentation\/AppKit\/NSView\/rulerView(_:willSetClientView:)"
        }
      ],
      "title" : "Synchronizing with Ruler Views"
    }
  ],
  "source" : "appleJSON",
  "title" : "rulerView(_:willMove:toLocation:)",
  "url" : "https:\/\/developer.apple.com\/documentation\/AppKit\/NSView\/rulerView(_:willMove:toLocation:)"
}