{
  "abstract" : "The height of the browser’s rows.",
  "codeExamples" : [

  ],
  "contentHash" : "d33842e541ff0868e90b81530753b375787ad1c40e190c495ad96f6571d81f51",
  "crawledAt" : "2025-12-04T18:07:03Z",
  "declaration" : {
    "code" : "@MainActor var rowHeight: CGFloat { get set }",
    "language" : "swift"
  },
  "id" : "DDDFCB8A-ABE7-4E77-AB2B-21625B971F6B",
  "kind" : "property",
  "language" : "swift",
  "module" : "AppKit",
  "overview" : "## Discussion\n\nThe value of this property must be greater than `0`. The default value of this property is `17.0`. Any fractional value will be forced to an integral value for drawing. For variable row height browsers (ones whose delegates implement [doc:\/\/com.apple.appkit\/documentation\/AppKit\/NSBrowserDelegate\/browser(_:heightOfRow:inColumn:)]), the row height will be used to draw alternating rows past the last row in each browser column.\n\nThis property is only available when using the item delegate methods. An exception is thrown if you are using the matrix delegate methods.",
  "platforms" : [
    "macOS"
  ],
  "rawMarkdown" : "---\nsource: https:\/\/developer.apple.com\/documentation\/appkit\/nsbrowser\/rowheight\ncrawled: 2025-12-04T18:07:03Z\n---\n\n# rowHeight\n\n**Instance Property**\n\nThe height of the browser’s rows.\n\n## Declaration\n\n```swift\n@MainActor var rowHeight: CGFloat { get set }\n```\n\n## Discussion\n\nThe value of this property must be greater than `0`. The default value of this property is `17.0`. Any fractional value will be forced to an integral value for drawing. For variable row height browsers (ones whose delegates implement [doc:\/\/com.apple.appkit\/documentation\/AppKit\/NSBrowserDelegate\/browser(_:heightOfRow:inColumn:)]), the row height will be used to draw alternating rows past the last row in each browser column.\n\nThis property is only available when using the item delegate methods. An exception is thrown if you are using the matrix delegate methods.\n\n## Sizing\n\n- **removeSavedColumns(withAutosaveName:)**: Removes the column configuration data stored under the given name from the application’s user defaults.\n- **columnsAutosaveName**: The name used to automatically save the browser’s column configuration.\n- **NSBrowser.ColumnsAutosaveName**\n- **columnContentWidth(forColumnWidth:)**: Returns the content width for a given column width.\n- **columnWidth(forColumnContentWidth:)**: Returns the column width for the width of the given column’s content.\n- **columnResizingType**: A constant indicating the browser’s column resizing type.\n- **prefersAllColumnUserResizing**: A Boolean that indicates whether the browser is set to resize all columns simultaneously rather than resizing a single column at a time.\n- **width(ofColumn:)**: Returns the width of the specified column.\n- **setWidth(_:ofColumn:)**: Sets the width of the specified column.\n- **defaultColumnWidth()**: Returns the default column width of the browser’s columns.\n- **setDefaultColumnWidth(_:)**: Sets the default column width for new browser columns that do not otherwise have an initial width from defaults or the browser’s delegate.\n\n",
  "sections" : [
    {
      "content" : "",
      "items" : [
        {
          "description" : "Removes the column configuration data stored under the given name from the application’s user defaults.",
          "name" : "removeSavedColumns(withAutosaveName:)",
          "url" : "https:\/\/developer.apple.com\/documentation\/AppKit\/NSBrowser\/removeSavedColumns(withAutosaveName:)"
        },
        {
          "description" : "The name used to automatically save the browser’s column configuration.",
          "name" : "columnsAutosaveName",
          "url" : "https:\/\/developer.apple.com\/documentation\/AppKit\/NSBrowser\/columnsAutosaveName-swift.property"
        },
        {
          "description" : "",
          "name" : "NSBrowser.ColumnsAutosaveName",
          "url" : "https:\/\/developer.apple.com\/documentation\/AppKit\/NSBrowser\/ColumnsAutosaveName-swift.typealias"
        },
        {
          "description" : "Returns the content width for a given column width.",
          "name" : "columnContentWidth(forColumnWidth:)",
          "url" : "https:\/\/developer.apple.com\/documentation\/AppKit\/NSBrowser\/columnContentWidth(forColumnWidth:)"
        },
        {
          "description" : "Returns the column width for the width of the given column’s content.",
          "name" : "columnWidth(forColumnContentWidth:)",
          "url" : "https:\/\/developer.apple.com\/documentation\/AppKit\/NSBrowser\/columnWidth(forColumnContentWidth:)"
        },
        {
          "description" : "A constant indicating the browser’s column resizing type.",
          "name" : "columnResizingType",
          "url" : "https:\/\/developer.apple.com\/documentation\/AppKit\/NSBrowser\/columnResizingType-swift.property"
        },
        {
          "description" : "A Boolean that indicates whether the browser is set to resize all columns simultaneously rather than resizing a single column at a time.",
          "name" : "prefersAllColumnUserResizing",
          "url" : "https:\/\/developer.apple.com\/documentation\/AppKit\/NSBrowser\/prefersAllColumnUserResizing"
        },
        {
          "description" : "Returns the width of the specified column.",
          "name" : "width(ofColumn:)",
          "url" : "https:\/\/developer.apple.com\/documentation\/AppKit\/NSBrowser\/width(ofColumn:)"
        },
        {
          "description" : "Sets the width of the specified column.",
          "name" : "setWidth(_:ofColumn:)",
          "url" : "https:\/\/developer.apple.com\/documentation\/AppKit\/NSBrowser\/setWidth(_:ofColumn:)"
        },
        {
          "description" : "Returns the default column width of the browser’s columns.",
          "name" : "defaultColumnWidth()",
          "url" : "https:\/\/developer.apple.com\/documentation\/AppKit\/NSBrowser\/defaultColumnWidth()"
        },
        {
          "description" : "Sets the default column width for new browser columns that do not otherwise have an initial width from defaults or the browser’s delegate.",
          "name" : "setDefaultColumnWidth(_:)",
          "url" : "https:\/\/developer.apple.com\/documentation\/AppKit\/NSBrowser\/setDefaultColumnWidth(_:)"
        }
      ],
      "title" : "Sizing"
    }
  ],
  "source" : "appleJSON",
  "title" : "rowHeight",
  "url" : "https:\/\/developer.apple.com\/documentation\/appkit\/nsbrowser\/rowheight"
}