{
  "abstract" : "The unobscured portion of the top-left corner of the screen.",
  "codeExamples" : [

  ],
  "contentHash" : "e4c9ca3dda8d2e5d18064ec3cb527f1fdcc7a4c96db5cb6db3820b8bd3e894ae",
  "crawledAt" : "2025-12-04T12:31:01Z",
  "declaration" : {
    "code" : "var auxiliaryTopLeftArea: NSRect? { get }",
    "language" : "swift"
  },
  "id" : "684261E1-22F2-48D6-ADFA-6D12BD07D6EF",
  "kind" : "property",
  "language" : "swift",
  "module" : "AppKit",
  "overview" : "## Discussion\n\nIf the top inset of the screen’s [doc:\/\/com.apple.appkit\/documentation\/AppKit\/NSScreen\/safeAreaInsets] property contains a non-zero value, the rectangle in this property is the visible top-left portion of the screen. The rectangle is specified in global screen coordinates and lies outside the safe area. If the top portion of the screen isn’t obscured, the value of this property is `nil` in Swift; in Objective-C, the value is [doc:\/\/com.apple.documentation\/documentation\/Foundation\/NSZeroRect].\n\nIf your app offers a custom full-screen experience, use this property to determine what additional space is available for your custom content. The specified rectangle is safe to use to display your content.",
  "platforms" : [
    "macOS"
  ],
  "rawMarkdown" : "---\nsource: https:\/\/developer.apple.com\/documentation\/AppKit\/NSScreen\/auxiliaryTopLeftArea-uglc\ncrawled: 2025-12-04T12:31:01Z\n---\n\n# auxiliaryTopLeftArea\n\n**Instance Property**\n\nThe unobscured portion of the top-left corner of the screen.\n\n## Declaration\n\n```swift\nvar auxiliaryTopLeftArea: NSRect? { get }\n```\n\n## Discussion\n\nIf the top inset of the screen’s [doc:\/\/com.apple.appkit\/documentation\/AppKit\/NSScreen\/safeAreaInsets] property contains a non-zero value, the rectangle in this property is the visible top-left portion of the screen. The rectangle is specified in global screen coordinates and lies outside the safe area. If the top portion of the screen isn’t obscured, the value of this property is `nil` in Swift; in Objective-C, the value is [doc:\/\/com.apple.documentation\/documentation\/Foundation\/NSZeroRect].\n\nIf your app offers a custom full-screen experience, use this property to determine what additional space is available for your custom content. The specified rectangle is safe to use to display your content.\n\n## Getting the Visible Portion of the Screen\n\n- **visibleFrame**: The current location and dimensions of the visible screen.\n- **safeAreaInsets**: The distances from the screen’s edges at which content isn’t obscured.\n- **auxiliaryTopRightArea**: The unobscured portion of the top-right corner of the screen.\n\n",
  "sections" : [
    {
      "content" : "",
      "items" : [
        {
          "description" : "The current location and dimensions of the visible screen.",
          "name" : "visibleFrame",
          "url" : "https:\/\/developer.apple.com\/documentation\/AppKit\/NSScreen\/visibleFrame"
        },
        {
          "description" : "The distances from the screen’s edges at which content isn’t obscured.",
          "name" : "safeAreaInsets",
          "url" : "https:\/\/developer.apple.com\/documentation\/AppKit\/NSScreen\/safeAreaInsets"
        },
        {
          "description" : "The unobscured portion of the top-right corner of the screen.",
          "name" : "auxiliaryTopRightArea",
          "url" : "https:\/\/developer.apple.com\/documentation\/AppKit\/NSScreen\/auxiliaryTopRightArea-gr2n"
        }
      ],
      "title" : "Getting the Visible Portion of the Screen"
    }
  ],
  "source" : "appleJSON",
  "title" : "auxiliaryTopLeftArea",
  "url" : "https:\/\/developer.apple.com\/documentation\/AppKit\/NSScreen\/auxiliaryTopLeftArea-uglc"
}