{
  "abstract" : "Adds the sections with the specified identifiers to the snapshot.",
  "codeExamples" : [

  ],
  "contentHash" : "bfda39542fae20db64ac3116e9c36f18b3bf7666f72e42f54dc4e782420cf48f",
  "crawledAt" : "2025-12-08T00:54:32Z",
  "declaration" : {
    "code" : "func appendSections(withIdentifiers sectionIdentifiers: [Any])",
    "language" : "swift"
  },
  "id" : "AC9ECECD-91A9-461A-BD03-647922DF2D27",
  "kind" : "method",
  "language" : "swift",
  "module" : "AppKit",
  "platforms" : [
    "macOS"
  ],
  "rawMarkdown" : "---\nsource: https:\/\/developer.apple.com\/documentation\/AppKit\/NSDiffableDataSourceSnapshotReference\/appendSections(withIdentifiers:)\ncrawled: 2025-12-08T00:54:32Z\n---\n\n# appendSections(withIdentifiers:)\n\n**Instance Method**\n\nAdds the sections with the specified identifiers to the snapshot.\n\n## Declaration\n\n```swift\nfunc appendSections(withIdentifiers sectionIdentifiers: [Any])\n```\n\n## Parameters\n\n- **sectionIdentifiers**: An array of identifiers specifying the sections to add to the snapshot.\n\n## Creating a snapshot\n\n- **appendItems(withIdentifiers:intoSectionWithIdentifier:)**: Adds the items with the specified identifiers to the specified section of the snapshot.\n- **appendItems(withIdentifiers:)**: Adds the items with the specified identifiers to the last section of the snapshot.\n\n",
  "sections" : [
    {
      "content" : "",
      "items" : [
        {
          "description" : "Adds the items with the specified identifiers to the specified section of the snapshot.",
          "name" : "appendItems(withIdentifiers:intoSectionWithIdentifier:)",
          "url" : "https:\/\/developer.apple.com\/documentation\/AppKit\/NSDiffableDataSourceSnapshotReference\/appendItems(withIdentifiers:intoSectionWithIdentifier:)"
        },
        {
          "description" : "Adds the items with the specified identifiers to the last section of the snapshot.",
          "name" : "appendItems(withIdentifiers:)",
          "url" : "https:\/\/developer.apple.com\/documentation\/AppKit\/NSDiffableDataSourceSnapshotReference\/appendItems(withIdentifiers:)"
        }
      ],
      "title" : "Creating a snapshot"
    }
  ],
  "source" : "appleJSON",
  "title" : "appendSections(withIdentifiers:)",
  "url" : "https:\/\/developer.apple.com\/documentation\/AppKit\/NSDiffableDataSourceSnapshotReference\/appendSections(withIdentifiers:)"
}