{
  "abstract" : "The scroll view’s horizontal scroller.",
  "codeExamples" : [

  ],
  "contentHash" : "987b9ae8ae563736af4f054f02d0ed2ff35204bc98ec79aa3120dea849297b17",
  "crawledAt" : "2025-12-03T08:58:29Z",
  "declaration" : {
    "code" : "@MainActor var horizontalScroller: NSScroller? { get set }",
    "language" : "swift"
  },
  "id" : "98271B45-DB89-4313-9F1C-35BD5C8C8EE8",
  "kind" : "property",
  "language" : "swift",
  "module" : "AppKit",
  "overview" : "## Discussion\n\nThe value of this property is `nil` if the scroll view has no horizontal scroller.\n\nYou can access the horizontal scroller using this property even if the scroll view isn’t currently displaying it. To make sure the scroller is visible, set [doc:\/\/com.apple.appkit\/documentation\/AppKit\/NSScrollView\/hasHorizontalScroller] to [doc:\/\/com.apple.documentation\/documentation\/Swift\/true].",
  "platforms" : [
    "macOS"
  ],
  "rawMarkdown" : "---\nsource: https:\/\/developer.apple.com\/documentation\/AppKit\/NSScrollView\/horizontalScroller\ncrawled: 2025-12-03T08:58:29Z\n---\n\n# horizontalScroller\n\n**Instance Property**\n\nThe scroll view’s horizontal scroller.\n\n## Declaration\n\n```swift\n@MainActor var horizontalScroller: NSScroller? { get set }\n```\n\n## Discussion\n\nThe value of this property is `nil` if the scroll view has no horizontal scroller.\n\nYou can access the horizontal scroller using this property even if the scroll view isn’t currently displaying it. To make sure the scroller is visible, set [doc:\/\/com.apple.appkit\/documentation\/AppKit\/NSScrollView\/hasHorizontalScroller] to [doc:\/\/com.apple.documentation\/documentation\/Swift\/true].\n\n## Managing Scrollers\n\n- **hasHorizontalScroller**: A Boolean that indicates whether the scroll view has a horizontal scroller.\n- **verticalScroller**: The scroll view’s vertical scroller.\n- **hasVerticalScroller**: A Boolean that indicates whether the scroll view has a vertical scroller.\n- **autohidesScrollers**: A Boolean that indicates whether the scroll view automatically hides its scroll bars when they are not needed.\n\n",
  "sections" : [
    {
      "content" : "",
      "items" : [
        {
          "description" : "A Boolean that indicates whether the scroll view has a horizontal scroller.",
          "name" : "hasHorizontalScroller",
          "url" : "https:\/\/developer.apple.com\/documentation\/AppKit\/NSScrollView\/hasHorizontalScroller"
        },
        {
          "description" : "The scroll view’s vertical scroller.",
          "name" : "verticalScroller",
          "url" : "https:\/\/developer.apple.com\/documentation\/AppKit\/NSScrollView\/verticalScroller"
        },
        {
          "description" : "A Boolean that indicates whether the scroll view has a vertical scroller.",
          "name" : "hasVerticalScroller",
          "url" : "https:\/\/developer.apple.com\/documentation\/AppKit\/NSScrollView\/hasVerticalScroller"
        },
        {
          "description" : "A Boolean that indicates whether the scroll view automatically hides its scroll bars when they are not needed.",
          "name" : "autohidesScrollers",
          "url" : "https:\/\/developer.apple.com\/documentation\/AppKit\/NSScrollView\/autohidesScrollers"
        }
      ],
      "title" : "Managing Scrollers"
    }
  ],
  "source" : "appleJSON",
  "title" : "horizontalScroller",
  "url" : "https:\/\/developer.apple.com\/documentation\/AppKit\/NSScrollView\/horizontalScroller"
}