{
  "abstract" : "A flattened version of the path object.",
  "codeExamples" : [

  ],
  "contentHash" : "2ee2fa3f5b872ad871a934cde1a7c6ee773386ad6271b1e23147900d0f6dbce4",
  "crawledAt" : "2025-12-04T12:36:36Z",
  "declaration" : {
    "code" : "@NSCopying var flattened: NSBezierPath { get }",
    "language" : "swift"
  },
  "id" : "FCA3CAD9-9C0E-4F87-AC3D-588D309A468B",
  "kind" : "property",
  "language" : "swift",
  "module" : "AppKit",
  "overview" : "## Discussion\n\nFlattening a path converts all curved line segments into straight line approximations. The granularity of the approximations is controlled by the path’s current flatness value, which is set using [doc:\/\/com.apple.appkit\/documentation\/AppKit\/NSBezierPath\/defaultFlatness].",
  "platforms" : [
    "macOS"
  ],
  "rawMarkdown" : "---\nsource: https:\/\/developer.apple.com\/documentation\/AppKit\/NSBezierPath\/flattened\ncrawled: 2025-12-04T12:36:36Z\n---\n\n# flattened\n\n**Instance Property**\n\nA flattened version of the path object.\n\n## Declaration\n\n```swift\n@NSCopying var flattened: NSBezierPath { get }\n```\n\n## Discussion\n\nFlattening a path converts all curved line segments into straight line approximations. The granularity of the approximations is controlled by the path’s current flatness value, which is set using [doc:\/\/com.apple.appkit\/documentation\/AppKit\/NSBezierPath\/defaultFlatness].\n\n## Creating a Bézier Path\n\n- **init(ovalIn:)**: Creates and returns a new Bézier path object initialized with an oval path inscribed in the specified rectangle.\n- **init(rect:)**: Creates and returns a new Bézier path object initialized with a rectangular path.\n- **init(roundedRect:xRadius:yRadius:)**: Creates and returns a new Bézier path object initialized with a rounded rectangular path.\n- **init(cgPath:)**\n- **reversed**: A path containing the reversed contents of the current path object.\n\n",
  "sections" : [
    {
      "content" : "",
      "items" : [
        {
          "description" : "Creates and returns a new Bézier path object initialized with an oval path inscribed in the specified rectangle.",
          "name" : "init(ovalIn:)",
          "url" : "https:\/\/developer.apple.com\/documentation\/AppKit\/NSBezierPath\/init(ovalIn:)"
        },
        {
          "description" : "Creates and returns a new Bézier path object initialized with a rectangular path.",
          "name" : "init(rect:)",
          "url" : "https:\/\/developer.apple.com\/documentation\/AppKit\/NSBezierPath\/init(rect:)"
        },
        {
          "description" : "Creates and returns a new Bézier path object initialized with a rounded rectangular path.",
          "name" : "init(roundedRect:xRadius:yRadius:)",
          "url" : "https:\/\/developer.apple.com\/documentation\/AppKit\/NSBezierPath\/init(roundedRect:xRadius:yRadius:)"
        },
        {
          "description" : "",
          "name" : "init(cgPath:)",
          "url" : "https:\/\/developer.apple.com\/documentation\/AppKit\/NSBezierPath\/init(cgPath:)"
        },
        {
          "description" : "A path containing the reversed contents of the current path object.",
          "name" : "reversed",
          "url" : "https:\/\/developer.apple.com\/documentation\/AppKit\/NSBezierPath\/reversed"
        }
      ],
      "title" : "Creating a Bézier Path"
    }
  ],
  "source" : "appleJSON",
  "title" : "flattened",
  "url" : "https:\/\/developer.apple.com\/documentation\/AppKit\/NSBezierPath\/flattened"
}