{
  "abstract" : "Runs the specified print operation modally.",
  "codeExamples" : [
    {
      "code" : "- (void)documentDidRunModalPrintOperation:(NSDocument *)document  success:(BOOL)success  contextInfo:(void *)contextInfo",
      "language" : "objc"
    }
  ],
  "contentHash" : "822d789c9d8c89acbb157f1f564f62b9e7fe5705b761484fce5e6db294624431",
  "crawledAt" : "2025-12-02T18:07:47Z",
  "declaration" : {
    "code" : "@MainActor func runModalPrintOperation(_ printOperation: NSPrintOperation, delegate: Any?, didRun didRunSelector: Selector?, contextInfo: UnsafeMutableRawPointer?)",
    "language" : "swift"
  },
  "id" : "28714834-74AF-4C94-A6B4-EDBC63CE1CBF",
  "kind" : "method",
  "language" : "swift",
  "module" : "AppKit",
  "overview" : "## Discussion\n\nOverrides of [doc:\/\/com.apple.appkit\/documentation\/AppKit\/NSDocument\/printShowingPrintPanel:] can invoke this method.\n\nWhen the panel is dismissed, `delegate` is sent a `didRunSelector` message. Pass the `contextInfo` object with the callback. The `didRunSelector` callback method should have the following signature:",
  "platforms" : [
    "macOS"
  ],
  "rawMarkdown" : "---\nsource: https:\/\/developer.apple.com\/documentation\/AppKit\/NSDocument\/runModalPrintOperation(_:delegate:didRun:contextInfo:)\ncrawled: 2025-12-02T18:07:47Z\n---\n\n# runModalPrintOperation(_:delegate:didRun:contextInfo:)\n\n**Instance Method**\n\nRuns the specified print operation modally.\n\n## Declaration\n\n```swift\n@MainActor func runModalPrintOperation(_ printOperation: NSPrintOperation, delegate: Any?, didRun didRunSelector: Selector?, contextInfo: UnsafeMutableRawPointer?)\n```\n\n## Parameters\n\n- **printOperation**: The print operation to run.\n- **delegate**: The delegate to which the selector message is sent.\n- **didRunSelector**: The selector of the message sent to the delegate.\n- **contextInfo**: Object passed with the callback to provide any additional context information.\n\n## Discussion\n\nOverrides of [doc:\/\/com.apple.appkit\/documentation\/AppKit\/NSDocument\/printShowingPrintPanel:] can invoke this method.\n\nWhen the panel is dismissed, `delegate` is sent a `didRunSelector` message. Pass the `contextInfo` object with the callback. The `didRunSelector` callback method should have the following signature:\n\n```objc\n- (void)documentDidRunModalPrintOperation:(NSDocument *)document  success:(BOOL)success  contextInfo:(void *)contextInfo\n```\n\n## Printing the Document\n\n- **printInfo**: The printing information associated with the document.\n- **preparePageLayout(_:)**: Adds document-specific content to the Page Layout panel.\n- **runModalPageLayout(with:delegate:didRun:contextInfo:)**: Runs the modal page layout panel with the receiver’s printing information object.\n- **shouldChangePrintInfo(_:)**: Returns a Boolean value that indicates whether the document allows changes to the default printing information.\n- **print(withSettings:showPrintPanel:delegate:didPrint:contextInfo:)**: Prints the document’s contents, optionally displaying a print panel to the user.\n- **printOperation(withSettings:)**: Creates and returns a print operation for the document’s contents.\n- **pdfPrintOperation**: A print operation you can use to create a PDF representation of the document’s current contents.\n- **saveToPDF(_:)**: Exports a PDF representation of the document’s current contents.\n\n",
  "sections" : [
    {
      "content" : "",
      "items" : [
        {
          "description" : "The printing information associated with the document.",
          "name" : "printInfo",
          "url" : "https:\/\/developer.apple.com\/documentation\/AppKit\/NSDocument\/printInfo"
        },
        {
          "description" : "Adds document-specific content to the Page Layout panel.",
          "name" : "preparePageLayout(_:)",
          "url" : "https:\/\/developer.apple.com\/documentation\/AppKit\/NSDocument\/preparePageLayout(_:)"
        },
        {
          "description" : "Runs the modal page layout panel with the receiver’s printing information object.",
          "name" : "runModalPageLayout(with:delegate:didRun:contextInfo:)",
          "url" : "https:\/\/developer.apple.com\/documentation\/AppKit\/NSDocument\/runModalPageLayout(with:delegate:didRun:contextInfo:)"
        },
        {
          "description" : "Returns a Boolean value that indicates whether the document allows changes to the default printing information.",
          "name" : "shouldChangePrintInfo(_:)",
          "url" : "https:\/\/developer.apple.com\/documentation\/AppKit\/NSDocument\/shouldChangePrintInfo(_:)"
        },
        {
          "description" : "Prints the document’s contents, optionally displaying a print panel to the user.",
          "name" : "print(withSettings:showPrintPanel:delegate:didPrint:contextInfo:)",
          "url" : "https:\/\/developer.apple.com\/documentation\/AppKit\/NSDocument\/print(withSettings:showPrintPanel:delegate:didPrint:contextInfo:)"
        },
        {
          "description" : "Creates and returns a print operation for the document’s contents.",
          "name" : "printOperation(withSettings:)",
          "url" : "https:\/\/developer.apple.com\/documentation\/AppKit\/NSDocument\/printOperation(withSettings:)"
        },
        {
          "description" : "A print operation you can use to create a PDF representation of the document’s current contents.",
          "name" : "pdfPrintOperation",
          "url" : "https:\/\/developer.apple.com\/documentation\/AppKit\/NSDocument\/pdfPrintOperation"
        },
        {
          "description" : "Exports a PDF representation of the document’s current contents.",
          "name" : "saveToPDF(_:)",
          "url" : "https:\/\/developer.apple.com\/documentation\/AppKit\/NSDocument\/saveToPDF(_:)"
        }
      ],
      "title" : "Printing the Document"
    }
  ],
  "source" : "appleJSON",
  "title" : "runModalPrintOperation(_:delegate:didRun:contextInfo:)",
  "url" : "https:\/\/developer.apple.com\/documentation\/AppKit\/NSDocument\/runModalPrintOperation(_:delegate:didRun:contextInfo:)"
}