{
  "abstract" : "Modifies the bounding rectangle for the cancel button cell.",
  "codeExamples" : [

  ],
  "contentHash" : "1ddaebc2365bd641059521bfe049566ceab63042d8f565ead9f2ea614a525f2f",
  "crawledAt" : "2025-12-02T05:04:50Z",
  "declaration" : {
    "code" : "@MainActor func cancelButtonRect(forBounds rect: NSRect) -> NSRect",
    "language" : "swift"
  },
  "id" : "80682CA2-347F-4FB0-A45C-AB975573C572",
  "kind" : "method",
  "module" : "AppKit",
  "overview" : "## Return Value\n\nThe updated bounding rectangle to use for the cancel button. The default value is the value passed into the `rect` parameter.\n\n## Discussion\n\nSubclasses can override this method to return a new bounding rectangle for the cancel button cell. You might use this method to provide a custom layout for the search field control.",
  "platforms" : [
    "macOS"
  ],
  "rawMarkdown" : "---\nsource: https:\/\/developer.apple.com\/documentation\/AppKit\/NSSearchFieldCell\/cancelButtonRect(forBounds:)\ncrawled: 2025-12-02T05:04:50Z\n---\n\n# cancelButtonRect(forBounds:)\n\n**Instance Method**\n\nModifies the bounding rectangle for the cancel button cell.\n\n## Declaration\n\n```swift\n@MainActor func cancelButtonRect(forBounds rect: NSRect) -> NSRect\n```\n\n## Parameters\n\n- **rect**: The current bounding rectangle for the cancel button.\n\n## Return Value\n\nThe updated bounding rectangle to use for the cancel button. The default value is the value passed into the `rect` parameter.\n\n## Discussion\n\nSubclasses can override this method to return a new bounding rectangle for the cancel button cell. You might use this method to provide a custom layout for the search field control.\n\n## Custom layout\n\n- **searchTextRect(forBounds:)**: Modifies the bounding rectangle for the search-text field cell.\n- **searchButtonRect(forBounds:)**: Modifies the bounding rectangle for the search button cell.\n\n",
  "sections" : [
    {
      "content" : "",
      "items" : [
        {
          "description" : "Modifies the bounding rectangle for the search-text field cell.",
          "name" : "searchTextRect(forBounds:)",
          "url" : "https:\/\/developer.apple.com\/documentation\/AppKit\/NSSearchFieldCell\/searchTextRect(forBounds:)"
        },
        {
          "description" : "Modifies the bounding rectangle for the search button cell.",
          "name" : "searchButtonRect(forBounds:)",
          "url" : "https:\/\/developer.apple.com\/documentation\/AppKit\/NSSearchFieldCell\/searchButtonRect(forBounds:)"
        }
      ],
      "title" : "Custom layout"
    }
  ],
  "source" : "appleJSON",
  "title" : "cancelButtonRect(forBounds:)",
  "url" : "https:\/\/developer.apple.com\/documentation\/AppKit\/NSSearchFieldCell\/cancelButtonRect(forBounds:)"
}