{
  "abstract" : "An item on a pasteboard.",
  "codeExamples" : [

  ],
  "conformsTo" : [
    "CVarArg",
    "CustomDebugStringConvertible",
    "CustomStringConvertible",
    "Equatable",
    "Hashable",
    "NSObjectProtocol",
    "NSPasteboardReading",
    "NSPasteboardWriting"
  ],
  "contentHash" : "0fdba8a59f7ffc9fe20cead92acc065e9267ae2b7a0ca8fd691cf1bbd7320017",
  "crawledAt" : "2025-12-03T05:51:30Z",
  "declaration" : {
    "code" : "class NSPasteboardItem",
    "language" : "swift"
  },
  "id" : "AF2ABDED-A16A-447D-950E-17921174AE71",
  "kind" : "class",
  "language" : "swift",
  "module" : "AppKit",
  "overview" : "## Overview\n\nThere are three main uses for an [doc:\/\/com.apple.appkit\/documentation\/AppKit\/NSPasteboardItem] object:\n\nYou can create one or more pasteboard items, set data or data providers for types, and write them to the pasteboard.\n\nAs a delegate or subclass, you can retrieve the pasteboard items currently on the pasteboard, read the existing types and data, and set new data and data providers for types as necessary.\n\nYou can retrieve pasteboard items from the pasteboard and then read the data for types you’re interested in.\n\nA pasteboard item can be associated with a single pasteboard. When you create an item, you can write it to any pasteboard. When you pass an item to a pasteboard in [doc:\/\/com.apple.appkit\/documentation\/AppKit\/NSPasteboard\/writeObjects(_:)], that item becomes bound to the pasteboard it writes to. When you retrieve items from a pasteboard using [doc:\/\/com.apple.appkit\/documentation\/AppKit\/NSPasteboard\/pasteboardItems] or [doc:\/\/com.apple.appkit\/documentation\/AppKit\/NSPasteboard\/readObjects(forClasses:options:)], the returned items are associated with the messaged pasteboard. Passing an item that is already associated with a pasteboard into [doc:\/\/com.apple.appkit\/documentation\/AppKit\/NSPasteboard\/writeObjects(_:)] causes an exception.\n\nUse pasteboard items during a single pasteboard interaction, rather than retaining and reusing them. A pasteboard item is only valid until the owner of the pasteboard changes.",
  "platforms" : [
    "macOS"
  ],
  "rawMarkdown" : "---\nsource: https:\/\/developer.apple.com\/documentation\/AppKit\/NSPasteboardItem\ncrawled: 2025-12-03T05:51:30Z\n---\n\n# NSPasteboardItem\n\n**Class**\n\nAn item on a pasteboard.\n\n## Declaration\n\n```swift\nclass NSPasteboardItem\n```\n\n## Overview\n\nThere are three main uses for an [doc:\/\/com.apple.appkit\/documentation\/AppKit\/NSPasteboardItem] object:\n\n- Providing data on the pasteboard.\n\nYou can create one or more pasteboard items, set data or data providers for types, and write them to the pasteboard.\n\n- Customizing data already on the pasteboard.\n\nAs a delegate or subclass, you can retrieve the pasteboard items currently on the pasteboard, read the existing types and data, and set new data and data providers for types as necessary.\n\n- Retrieving data from the pasteboard.\n\nYou can retrieve pasteboard items from the pasteboard and then read the data for types you’re interested in.\n\nA pasteboard item can be associated with a single pasteboard. When you create an item, you can write it to any pasteboard. When you pass an item to a pasteboard in [doc:\/\/com.apple.appkit\/documentation\/AppKit\/NSPasteboard\/writeObjects(_:)], that item becomes bound to the pasteboard it writes to. When you retrieve items from a pasteboard using [doc:\/\/com.apple.appkit\/documentation\/AppKit\/NSPasteboard\/pasteboardItems] or [doc:\/\/com.apple.appkit\/documentation\/AppKit\/NSPasteboard\/readObjects(forClasses:options:)], the returned items are associated with the messaged pasteboard. Passing an item that is already associated with a pasteboard into [doc:\/\/com.apple.appkit\/documentation\/AppKit\/NSPasteboard\/writeObjects(_:)] causes an exception.\n\nUse pasteboard items during a single pasteboard interaction, rather than retaining and reusing them. A pasteboard item is only valid until the owner of the pasteboard changes.\n\n\n\n## Getting types\n\n- **types**: An array of uniform type identifier strings of the data types that the receiver supports.\n- **availableType(from:)**: Returns from a given array of types the first type within the pasteboard item, according to the ordering of types.\n\n## Setting the data provider\n\n- **setDataProvider(_:forTypes:)**: Sets the data provider for the specified types.\n\n## Setting values\n\n- **setData(_:forType:)**: Sets the value for a specified type as a data object.\n- **setString(_:forType:)**: Sets the value for a specified type as a string.\n- **setPropertyList(_:forType:)**: Sets the value for a specified type as a property list.\n\n## Getting values\n\n- **data(forType:)**: Returns the value for the specified type as a data object.\n- **string(forType:)**: Returns the value for the specified type as a string.\n- **propertyList(forType:)**: Returns the value for the specified type as a property list.\n\n## Detecting patterns and metadata in pasteboard items\n\n- **detectedPatterns(for:)**: Determines whether the pasteboard item matches the specified patterns, without notifying the person using the app.\n- **detectedValues(for:)**: Determines whether this pasteboard item matches the specified patterns, reading the contents if it finds a match.\n- **NSPasteboardItem.DetectedValues**\n- **detectedMetadata(for:)**: Determines available metadata from the specified metadata types for this pasteboard item, without notifying the person using the app.\n- **NSPasteboardItem.DetectedMetadata**\n\n## Instance Properties\n\n- **collaborationMetadata**: A model object you use for conveying data during a collaboration.\n\n## Pasteboard\n\n- **NSPasteboard**: An object that transfers data to and from the pasteboard server.\n- **NSPasteboardReading**: A set of methods that defines the interface for initializing an object from a pasteboard.\n- **NSPasteboardWriting**: A set of methods that defines the interface for retrieving a representation of an object that can be written to a pasteboard.\n- **NSPasteboardItemDataProvider**: A set of methods implemented by the data provider of a pasteboard item to provide the data for a particular UTI type.\n- **NSPasteboard.ContentsOptions**: Options for preparing the pasteboard.\n- **NSPasteboardTypeOwner**: An object that serves as a data provider for data types that use lazy data fulfillment from a pasteboard request.\n\n## Inherits From\n\n- NSObject\n\n## Conforms To\n\n- CVarArg\n- CustomDebugStringConvertible\n- CustomStringConvertible\n- Equatable\n- Hashable\n- NSObjectProtocol\n- NSPasteboardReading\n- NSPasteboardWriting\n\n",
  "sections" : [
    {
      "content" : "",
      "items" : [
        {
          "description" : "An array of uniform type identifier strings of the data types that the receiver supports.",
          "name" : "types",
          "url" : "https:\/\/developer.apple.com\/documentation\/AppKit\/NSPasteboardItem\/types"
        },
        {
          "description" : "Returns from a given array of types the first type within the pasteboard item, according to the ordering of types.",
          "name" : "availableType(from:)",
          "url" : "https:\/\/developer.apple.com\/documentation\/AppKit\/NSPasteboardItem\/availableType(from:)"
        }
      ],
      "title" : "Getting types"
    },
    {
      "content" : "",
      "items" : [
        {
          "description" : "Sets the data provider for the specified types.",
          "name" : "setDataProvider(_:forTypes:)",
          "url" : "https:\/\/developer.apple.com\/documentation\/AppKit\/NSPasteboardItem\/setDataProvider(_:forTypes:)"
        }
      ],
      "title" : "Setting the data provider"
    },
    {
      "content" : "",
      "items" : [
        {
          "description" : "Sets the value for a specified type as a data object.",
          "name" : "setData(_:forType:)",
          "url" : "https:\/\/developer.apple.com\/documentation\/AppKit\/NSPasteboardItem\/setData(_:forType:)"
        },
        {
          "description" : "Sets the value for a specified type as a string.",
          "name" : "setString(_:forType:)",
          "url" : "https:\/\/developer.apple.com\/documentation\/AppKit\/NSPasteboardItem\/setString(_:forType:)"
        },
        {
          "description" : "Sets the value for a specified type as a property list.",
          "name" : "setPropertyList(_:forType:)",
          "url" : "https:\/\/developer.apple.com\/documentation\/AppKit\/NSPasteboardItem\/setPropertyList(_:forType:)"
        }
      ],
      "title" : "Setting values"
    },
    {
      "content" : "",
      "items" : [
        {
          "description" : "Returns the value for the specified type as a data object.",
          "name" : "data(forType:)",
          "url" : "https:\/\/developer.apple.com\/documentation\/AppKit\/NSPasteboardItem\/data(forType:)"
        },
        {
          "description" : "Returns the value for the specified type as a string.",
          "name" : "string(forType:)",
          "url" : "https:\/\/developer.apple.com\/documentation\/AppKit\/NSPasteboardItem\/string(forType:)"
        },
        {
          "description" : "Returns the value for the specified type as a property list.",
          "name" : "propertyList(forType:)",
          "url" : "https:\/\/developer.apple.com\/documentation\/AppKit\/NSPasteboardItem\/propertyList(forType:)"
        }
      ],
      "title" : "Getting values"
    },
    {
      "content" : "",
      "items" : [
        {
          "description" : "Determines whether the pasteboard item matches the specified patterns, without notifying the person using the app.",
          "name" : "detectedPatterns(for:)",
          "url" : "https:\/\/developer.apple.com\/documentation\/AppKit\/NSPasteboardItem\/detectedPatterns(for:)"
        },
        {
          "description" : "Determines whether this pasteboard item matches the specified patterns, reading the contents if it finds a match.",
          "name" : "detectedValues(for:)",
          "url" : "https:\/\/developer.apple.com\/documentation\/AppKit\/NSPasteboardItem\/detectedValues(for:)"
        },
        {
          "description" : "",
          "name" : "NSPasteboardItem.DetectedValues",
          "url" : "https:\/\/developer.apple.com\/documentation\/AppKit\/NSPasteboardItem\/DetectedValues"
        },
        {
          "description" : "Determines available metadata from the specified metadata types for this pasteboard item, without notifying the person using the app.",
          "name" : "detectedMetadata(for:)",
          "url" : "https:\/\/developer.apple.com\/documentation\/AppKit\/NSPasteboardItem\/detectedMetadata(for:)"
        },
        {
          "description" : "",
          "name" : "NSPasteboardItem.DetectedMetadata",
          "url" : "https:\/\/developer.apple.com\/documentation\/AppKit\/NSPasteboardItem\/DetectedMetadata"
        }
      ],
      "title" : "Detecting patterns and metadata in pasteboard items"
    },
    {
      "content" : "",
      "items" : [
        {
          "description" : "A model object you use for conveying data during a collaboration.",
          "name" : "collaborationMetadata",
          "url" : "https:\/\/developer.apple.com\/documentation\/AppKit\/NSPasteboardItem\/collaborationMetadata"
        }
      ],
      "title" : "Instance Properties"
    },
    {
      "content" : "",
      "items" : [
        {
          "description" : "An object that transfers data to and from the pasteboard server.",
          "name" : "NSPasteboard",
          "url" : "https:\/\/developer.apple.com\/documentation\/AppKit\/NSPasteboard"
        },
        {
          "description" : "A set of methods that defines the interface for initializing an object from a pasteboard.",
          "name" : "NSPasteboardReading",
          "url" : "https:\/\/developer.apple.com\/documentation\/AppKit\/NSPasteboardReading"
        },
        {
          "description" : "A set of methods that defines the interface for retrieving a representation of an object that can be written to a pasteboard.",
          "name" : "NSPasteboardWriting",
          "url" : "https:\/\/developer.apple.com\/documentation\/AppKit\/NSPasteboardWriting"
        },
        {
          "description" : "A set of methods implemented by the data provider of a pasteboard item to provide the data for a particular UTI type.",
          "name" : "NSPasteboardItemDataProvider",
          "url" : "https:\/\/developer.apple.com\/documentation\/AppKit\/NSPasteboardItemDataProvider"
        },
        {
          "description" : "Options for preparing the pasteboard.",
          "name" : "NSPasteboard.ContentsOptions",
          "url" : "https:\/\/developer.apple.com\/documentation\/AppKit\/NSPasteboard\/ContentsOptions"
        },
        {
          "description" : "An object that serves as a data provider for data types that use lazy data fulfillment from a pasteboard request.",
          "name" : "NSPasteboardTypeOwner",
          "url" : "https:\/\/developer.apple.com\/documentation\/AppKit\/NSPasteboardTypeOwner"
        }
      ],
      "title" : "Pasteboard"
    },
    {
      "content" : "",
      "items" : [
        {
          "name" : "NSObject"
        }
      ],
      "title" : "Inherits From"
    }
  ],
  "source" : "appleJSON",
  "title" : "NSPasteboardItem",
  "url" : "https:\/\/developer.apple.com\/documentation\/AppKit\/NSPasteboardItem"
}