{
  "abstract" : "Returns an OpenGL context object initialized with the specified pixel format information.",
  "codeExamples" : [

  ],
  "contentHash" : "c055463aa48e0f8b56c0b66b9520abc3c1430c0e5c302a8ead31b079682204e4",
  "crawledAt" : "2025-12-04T11:24:44Z",
  "declaration" : {
    "code" : "init?(format: NSOpenGLPixelFormat, share: NSOpenGLContext?)",
    "language" : "swift"
  },
  "id" : "64AABD03-2BBE-402C-85D3-9FF0392B26E3",
  "kind" : "unknown",
  "language" : "swift",
  "module" : "AppKit",
  "overview" : "## Return Value\n\nAn `NSOpenGLContext` object initialized with the specified parameters, or `nil` if the object could not be created.\n\n## Discussion\n\nIf the parameters contain invalid information, this method returns `nil`. This may happen if one of the following situations occurs:\n\nPixel formats are incompatible if they use different renderers; this can happen if, for example, one format required an accumulation buffer that could only be provided by the software renderer, and the other format did not.",
  "platforms" : [
    "macOS"
  ],
  "rawMarkdown" : "---\nsource: https:\/\/developer.apple.com\/documentation\/AppKit\/NSOpenGLContext\/init(format:share:)\ncrawled: 2025-12-04T11:24:44Z\n---\n\n# init(format:share:)\n\n**Initializer**\n\nReturns an OpenGL context object initialized with the specified pixel format information.\n\n## Declaration\n\n```swift\ninit?(format: NSOpenGLPixelFormat, share: NSOpenGLContext?)\n```\n\n## Parameters\n\n- **format**: The pixel format to request for the OpenGL graphics context.\n- **share**: Another OpenGL graphics context whose texture namespace and display lists you want to share with the receiver. If you do not want to share those features with another graphics context, you may pass `nil` for this parameter.\n\n## Return Value\n\nAn `NSOpenGLContext` object initialized with the specified parameters, or `nil` if the object could not be created.\n\n## Discussion\n\nIf the parameters contain invalid information, this method returns `nil`. This may happen if one of the following situations occurs:\n\n- The `format` parameter is `nil` or contains an invalid pixel format.\n- The `share` parameter is not `nil` and contains an invalid context.\n- The `share` parameter contains a context with a pixel format that is incompatible with the one in `format`.\n\nPixel formats are incompatible if they use different renderers; this can happen if, for example, one format required an accumulation buffer that could only be provided by the software renderer, and the other format did not.\n\n## Related Documentation\n\n- **Cocoa Drawing Guide**\n\n## Creating Contexts\n\n- **init(cglContextObj:)**: Initializes and returns an OpenGL context object using an existing CGL context.\n\n",
  "sections" : [
    {
      "content" : "",
      "items" : [
        {
          "name" : "Cocoa Drawing Guide"
        }
      ],
      "title" : "Related Documentation"
    },
    {
      "content" : "",
      "items" : [
        {
          "description" : "Initializes and returns an OpenGL context object using an existing CGL context.",
          "name" : "init(cglContextObj:)",
          "url" : "https:\/\/developer.apple.com\/documentation\/AppKit\/NSOpenGLContext\/init(cglContextObj:)"
        }
      ],
      "title" : "Creating Contexts"
    }
  ],
  "source" : "appleJSON",
  "title" : "init(format:share:)",
  "url" : "https:\/\/developer.apple.com\/documentation\/AppKit\/NSOpenGLContext\/init(format:share:)"
}