{
  "abstract" : "The graphics context’s global compositing operation setting.",
  "codeExamples" : [

  ],
  "contentHash" : "292e850e13fae38ed11e29a4febafdce49df2517b46f9efd3c43fc7a9b429e9c",
  "crawledAt" : "2025-12-02T07:24:54Z",
  "declaration" : {
    "code" : "var compositingOperation: NSCompositingOperation { get set }",
    "language" : "swift"
  },
  "id" : "C6BEDC39-CCDB-4A8B-A756-C5A4EEFD0C42",
  "kind" : "property",
  "module" : "AppKit",
  "overview" : "## Discussion\n\nThe compositing operation is a global attribute of the graphics context and affects drawing operations that do not take an explicit compositing operation parameter. For methods that do take an explicit compositing operation parameter, the value of that parameter supersedes the global value. The compositing operations are related to (but different from) the blend mode settings used in Quartz. Only the default compositing operation ([doc:\/\/com.apple.appkit\/documentation\/AppKit\/NSCompositeCopy]) is supported when rendering PDF or PostScript content. See [doc:\/\/com.apple.appkit\/documentation\/AppKit\/NSCompositingOperation] for valid constants.",
  "platforms" : [
    "macOS"
  ],
  "rawMarkdown" : "---\nsource: https:\/\/developer.apple.com\/documentation\/AppKit\/NSGraphicsContext\/compositingOperation\ncrawled: 2025-12-02T07:24:54Z\n---\n\n# compositingOperation\n\n**Instance Property**\n\nThe graphics context’s global compositing operation setting.\n\n## Declaration\n\n```swift\nvar compositingOperation: NSCompositingOperation { get set }\n```\n\n## Discussion\n\nThe compositing operation is a global attribute of the graphics context and affects drawing operations that do not take an explicit compositing operation parameter. For methods that do take an explicit compositing operation parameter, the value of that parameter supersedes the global value. The compositing operations are related to (but different from) the blend mode settings used in Quartz. Only the default compositing operation ([doc:\/\/com.apple.appkit\/documentation\/AppKit\/NSCompositeCopy]) is supported when rendering PDF or PostScript content. See [doc:\/\/com.apple.appkit\/documentation\/AppKit\/NSCompositingOperation] for valid constants.\n\n## Configuring Rendering Options\n\n- **NSCompositingOperation**: Constants that describe compositing operators in terms of source and destination images, each having an opaque and transparent region.\n- **imageInterpolation**: A constant that specifies the graphics context’s interpolation, or image smoothing, behavior.\n- **NSImageInterpolation**: Constants that specify the interpolation, or image smoothing, behavior used by the image interpolation property.\n- **shouldAntialias**: A Boolean value that indicates whether the graphics context uses antialiasing.\n- **patternPhase**: The amount to offset the pattern color when filling the graphics context.\n\n",
  "sections" : [
    {
      "content" : "",
      "items" : [
        {
          "description" : "Constants that describe compositing operators in terms of source and destination images, each having an opaque and transparent region.",
          "name" : "NSCompositingOperation",
          "url" : "https:\/\/developer.apple.com\/documentation\/AppKit\/NSCompositingOperation"
        },
        {
          "description" : "A constant that specifies the graphics context’s interpolation, or image smoothing, behavior.",
          "name" : "imageInterpolation",
          "url" : "https:\/\/developer.apple.com\/documentation\/AppKit\/NSGraphicsContext\/imageInterpolation"
        },
        {
          "description" : "Constants that specify the interpolation, or image smoothing, behavior used by the image interpolation property.",
          "name" : "NSImageInterpolation",
          "url" : "https:\/\/developer.apple.com\/documentation\/AppKit\/NSImageInterpolation"
        },
        {
          "description" : "A Boolean value that indicates whether the graphics context uses antialiasing.",
          "name" : "shouldAntialias",
          "url" : "https:\/\/developer.apple.com\/documentation\/AppKit\/NSGraphicsContext\/shouldAntialias"
        },
        {
          "description" : "The amount to offset the pattern color when filling the graphics context.",
          "name" : "patternPhase",
          "url" : "https:\/\/developer.apple.com\/documentation\/AppKit\/NSGraphicsContext\/patternPhase"
        }
      ],
      "title" : "Configuring Rendering Options"
    }
  ],
  "source" : "appleJSON",
  "title" : "compositingOperation",
  "url" : "https:\/\/developer.apple.com\/documentation\/AppKit\/NSGraphicsContext\/compositingOperation"
}