{
  "abstract" : "A Boolean value that indicates whether the layout manager uses the default hyphenation rules to wrap lines.",
  "codeExamples" : [

  ],
  "contentHash" : "c17d32057d034be6b2bfda74b4598ed8dd47dea0f6b77cd50b2dab570e83fa98",
  "crawledAt" : "2025-12-04T02:26:47Z",
  "declaration" : {
    "code" : "var usesDefaultHyphenation: Bool { get set }",
    "language" : "swift"
  },
  "id" : "63457831-9C41-4EA5-82DC-0179540988F9",
  "kind" : "property",
  "language" : "swift",
  "module" : "AppKit",
  "overview" : "## Discussion\n\nWhen the value of this property is [doc:\/\/com.apple.documentation\/documentation\/Swift\/true], the layout manager makes a best-effort attempt to hyphenate text when wrapping lines. You may override this hyphenation behavior on a per-paragraph basis using the [doc:\/\/com.apple.appkit\/documentation\/AppKit\/NSLayoutManager\/hyphenationFactor] property of [doc:\/\/com.apple.appkit\/documentation\/AppKit\/NSParagraphStyle] The default value of this property is [doc:\/\/com.apple.documentation\/documentation\/Swift\/false], which prevents the layout manager from hyphenating text.",
  "platforms" : [
    "macOS"
  ],
  "rawMarkdown" : "---\nsource: https:\/\/developer.apple.com\/documentation\/AppKit\/NSLayoutManager\/usesDefaultHyphenation\ncrawled: 2025-12-04T02:26:47Z\n---\n\n# usesDefaultHyphenation\n\n**Instance Property**\n\nA Boolean value that indicates whether the layout manager uses the default hyphenation rules to wrap lines.\n\n## Declaration\n\n```swift\nvar usesDefaultHyphenation: Bool { get set }\n```\n\n## Discussion\n\nWhen the value of this property is [doc:\/\/com.apple.documentation\/documentation\/Swift\/true], the layout manager makes a best-effort attempt to hyphenate text when wrapping lines. You may override this hyphenation behavior on a per-paragraph basis using the [doc:\/\/com.apple.appkit\/documentation\/AppKit\/NSLayoutManager\/hyphenationFactor] property of [doc:\/\/com.apple.appkit\/documentation\/AppKit\/NSParagraphStyle] The default value of this property is [doc:\/\/com.apple.documentation\/documentation\/Swift\/false], which prevents the layout manager from hyphenating text.\n\n## Configuring the global layout manager options\n\n- **allowsNonContiguousLayout**: A Boolean value that indicates whether the layout manager allows noncontiguous layout.\n- **hasNonContiguousLayout**: A Boolean value that indicates whether the layout manager currently has any areas of noncontiguous layout.\n- **showsInvisibleCharacters**: A Boolean value that indicates whether to substitute visible glyphs for whitespace and other typically invisible characters.\n- **showsControlCharacters**: A Boolean value that indicates whether the layout manager substitutes visible glyphs for control characters in the layout.\n- **usesFontLeading**: A Boolean value that indicates whether the layout manager uses the leading of the font.\n- **backgroundLayoutEnabled**: A Boolean value that indicates whether the layout manager generates glyphs and lays them out when the app’s run loop is idle.\n- **limitsLayoutForSuspiciousContents**: A Boolean value that indicates whether the layout manager avoids laying out unusually long or suspicious input.\n\n",
  "sections" : [
    {
      "content" : "",
      "items" : [
        {
          "description" : "A Boolean value that indicates whether the layout manager allows noncontiguous layout.",
          "name" : "allowsNonContiguousLayout",
          "url" : "https:\/\/developer.apple.com\/documentation\/AppKit\/NSLayoutManager\/allowsNonContiguousLayout"
        },
        {
          "description" : "A Boolean value that indicates whether the layout manager currently has any areas of noncontiguous layout.",
          "name" : "hasNonContiguousLayout",
          "url" : "https:\/\/developer.apple.com\/documentation\/AppKit\/NSLayoutManager\/hasNonContiguousLayout"
        },
        {
          "description" : "A Boolean value that indicates whether to substitute visible glyphs for whitespace and other typically invisible characters.",
          "name" : "showsInvisibleCharacters",
          "url" : "https:\/\/developer.apple.com\/documentation\/AppKit\/NSLayoutManager\/showsInvisibleCharacters"
        },
        {
          "description" : "A Boolean value that indicates whether the layout manager substitutes visible glyphs for control characters in the layout.",
          "name" : "showsControlCharacters",
          "url" : "https:\/\/developer.apple.com\/documentation\/AppKit\/NSLayoutManager\/showsControlCharacters"
        },
        {
          "description" : "A Boolean value that indicates whether the layout manager uses the leading of the font.",
          "name" : "usesFontLeading",
          "url" : "https:\/\/developer.apple.com\/documentation\/AppKit\/NSLayoutManager\/usesFontLeading"
        },
        {
          "description" : "A Boolean value that indicates whether the layout manager generates glyphs and lays them out when the app’s run loop is idle.",
          "name" : "backgroundLayoutEnabled",
          "url" : "https:\/\/developer.apple.com\/documentation\/AppKit\/NSLayoutManager\/backgroundLayoutEnabled"
        },
        {
          "description" : "A Boolean value that indicates whether the layout manager avoids laying out unusually long or suspicious input.",
          "name" : "limitsLayoutForSuspiciousContents",
          "url" : "https:\/\/developer.apple.com\/documentation\/AppKit\/NSLayoutManager\/limitsLayoutForSuspiciousContents"
        }
      ],
      "title" : "Configuring the global layout manager options"
    }
  ],
  "source" : "appleJSON",
  "title" : "usesDefaultHyphenation",
  "url" : "https:\/\/developer.apple.com\/documentation\/AppKit\/NSLayoutManager\/usesDefaultHyphenation"
}