{
  "abstract" : "Called by the layout manager to draw any colors and other decorations before the text is drawn.",
  "codeExamples" : [

  ],
  "contentHash" : "2ef9094c43043de72ac321b3e887687c7f9d01d97e8214ab8fbb55e1f5f85cff",
  "crawledAt" : "2025-12-04T02:23:09Z",
  "declaration" : {
    "code" : "func drawBackground(withFrame frameRect: NSRect, in controlView: NSView, characterRange charRange: NSRange, layoutManager: NSLayoutManager)",
    "language" : "swift"
  },
  "id" : "CA9C9796-083F-4E0F-8B60-77C5B878B073",
  "kind" : "method",
  "language" : "swift",
  "module" : "AppKit",
  "platforms" : [
    "macOS"
  ],
  "rawMarkdown" : "---\nsource: https:\/\/developer.apple.com\/documentation\/AppKit\/NSTextBlock\/drawBackground(withFrame:in:characterRange:layoutManager:)\ncrawled: 2025-12-04T02:23:09Z\n---\n\n# drawBackground(withFrame:in:characterRange:layoutManager:)\n\n**Instance Method**\n\nCalled by the layout manager to draw any colors and other decorations before the text is drawn.\n\n## Declaration\n\n```swift\nfunc drawBackground(withFrame frameRect: NSRect, in controlView: NSView, characterRange charRange: NSRange, layoutManager: NSLayoutManager)\n```\n\n## Parameters\n\n- **frameRect**: The bounds rectangle in view coordinates.\n- **controlView**: The view in which drawing occurs.\n- **charRange**: The range of the characters in the [doc:\/\/com.apple.appkit\/documentation\/AppKit\/NSTextStorage] object whose glyphs are to be drawn.\n- **layoutManager**: The layout manager controlling the typesetting.\n\n",
  "sections" : [

  ],
  "source" : "appleJSON",
  "title" : "drawBackground(withFrame:in:characterRange:layoutManager:)",
  "url" : "https:\/\/developer.apple.com\/documentation\/AppKit\/NSTextBlock\/drawBackground(withFrame:in:characterRange:layoutManager:)"
}