{
  "abstract" : "A Boolean value that indicates whether the window prevents application termination when modal.",
  "codeExamples" : [

  ],
  "contentHash" : "da8b4bfe5766ab78d0e66e9555e6c488f27b7b157c76247179e45ab052d81252",
  "crawledAt" : "2025-12-03T08:53:33Z",
  "declaration" : {
    "code" : "@MainActor var preventsApplicationTerminationWhenModal: Bool { get set }",
    "language" : "swift"
  },
  "id" : "66D221DF-BD13-4525-AED8-F1F45422DA27",
  "kind" : "property",
  "language" : "swift",
  "module" : "AppKit",
  "overview" : "## Discussion\n\nThe value of this property is [doc:\/\/com.apple.documentation\/documentation\/Swift\/true] if the window prevents application termination when modal; otherwise, [doc:\/\/com.apple.documentation\/documentation\/Swift\/false]. The default value is [doc:\/\/com.apple.documentation\/documentation\/Swift\/true].\n\nUsually, application termination is prevented when a modal window or sheet is open, without consulting the application delegate. Some windows may wish not to prevent termination, however. Setting this property to [doc:\/\/com.apple.documentation\/documentation\/Swift\/false] overrides the default behavior and allows termination to proceed even if the window is open, either through the sudden termination path if enabled, or after consulting the application delegate.",
  "platforms" : [
    "macOS"
  ],
  "rawMarkdown" : "---\nsource: https:\/\/developer.apple.com\/documentation\/AppKit\/NSWindow\/preventsApplicationTerminationWhenModal\ncrawled: 2025-12-03T08:53:33Z\n---\n\n# preventsApplicationTerminationWhenModal\n\n**Instance Property**\n\nA Boolean value that indicates whether the window prevents application termination when modal.\n\n## Declaration\n\n```swift\n@MainActor var preventsApplicationTerminationWhenModal: Bool { get set }\n```\n\n## Discussion\n\nThe value of this property is [doc:\/\/com.apple.documentation\/documentation\/Swift\/true] if the window prevents application termination when modal; otherwise, [doc:\/\/com.apple.documentation\/documentation\/Swift\/false]. The default value is [doc:\/\/com.apple.documentation\/documentation\/Swift\/true].\n\nUsually, application termination is prevented when a modal window or sheet is open, without consulting the application delegate. Some windows may wish not to prevent termination, however. Setting this property to [doc:\/\/com.apple.documentation\/documentation\/Swift\/false] overrides the default behavior and allows termination to proceed even if the window is open, either through the sudden termination path if enabled, or after consulting the application delegate.\n\n## Configuring the Window’s Appearance\n\n- **styleMask**: Flags that describe the window’s current style, such as if it’s resizable or in full-screen mode.\n- **NSWindow.StyleMask**: Constants that specify the style of a window, and that you can combine with the C bitwise OR operator.\n- **toggleFullScreen(_:)**: Takes the window into or out of fullscreen mode,\n- **worksWhenModal**: A Boolean value that indicates whether the window is able to receive keyboard and mouse events even when some other window is being run modally.\n- **alphaValue**: The window’s alpha value.\n- **backgroundColor**: The color of the window’s background.\n- **colorSpace**: The window’s color space.\n- **setDynamicDepthLimit(_:)**: Sets a Boolean value that indicates whether the window’s depth limit can change to match the depth of the screen it’s on.\n- **canHide**: A Boolean value that indicates whether the window can hide when its application becomes hidden.\n- **isOnActiveSpace**: A Boolean value that indicates whether the window is on the currently active space.\n- **hidesOnDeactivate**: A Boolean value that indicates whether the window is removed from the screen when its application becomes inactive.\n- **collectionBehavior**: A value that identifies the window’s behavior in window collections.\n- **isOpaque**: A Boolean value that indicates whether the window is opaque.\n- **hasShadow**: A Boolean value that indicates whether the window has a shadow.\n- **invalidateShadow()**: Invalidates the window shadow so that it is recomputed based on the current window shape.\n\n",
  "sections" : [
    {
      "content" : "",
      "items" : [
        {
          "description" : "Flags that describe the window’s current style, such as if it’s resizable or in full-screen mode.",
          "name" : "styleMask",
          "url" : "https:\/\/developer.apple.com\/documentation\/AppKit\/NSWindow\/styleMask-swift.property"
        },
        {
          "description" : "Constants that specify the style of a window, and that you can combine with the C bitwise OR operator.",
          "name" : "NSWindow.StyleMask",
          "url" : "https:\/\/developer.apple.com\/documentation\/AppKit\/NSWindow\/StyleMask-swift.struct"
        },
        {
          "description" : "Takes the window into or out of fullscreen mode,",
          "name" : "toggleFullScreen(_:)",
          "url" : "https:\/\/developer.apple.com\/documentation\/AppKit\/NSWindow\/toggleFullScreen(_:)"
        },
        {
          "description" : "A Boolean value that indicates whether the window is able to receive keyboard and mouse events even when some other window is being run modally.",
          "name" : "worksWhenModal",
          "url" : "https:\/\/developer.apple.com\/documentation\/AppKit\/NSWindow\/worksWhenModal"
        },
        {
          "description" : "The window’s alpha value.",
          "name" : "alphaValue",
          "url" : "https:\/\/developer.apple.com\/documentation\/AppKit\/NSWindow\/alphaValue"
        },
        {
          "description" : "The color of the window’s background.",
          "name" : "backgroundColor",
          "url" : "https:\/\/developer.apple.com\/documentation\/AppKit\/NSWindow\/backgroundColor"
        },
        {
          "description" : "The window’s color space.",
          "name" : "colorSpace",
          "url" : "https:\/\/developer.apple.com\/documentation\/AppKit\/NSWindow\/colorSpace"
        },
        {
          "description" : "Sets a Boolean value that indicates whether the window’s depth limit can change to match the depth of the screen it’s on.",
          "name" : "setDynamicDepthLimit(_:)",
          "url" : "https:\/\/developer.apple.com\/documentation\/AppKit\/NSWindow\/setDynamicDepthLimit(_:)"
        },
        {
          "description" : "A Boolean value that indicates whether the window can hide when its application becomes hidden.",
          "name" : "canHide",
          "url" : "https:\/\/developer.apple.com\/documentation\/AppKit\/NSWindow\/canHide"
        },
        {
          "description" : "A Boolean value that indicates whether the window is on the currently active space.",
          "name" : "isOnActiveSpace",
          "url" : "https:\/\/developer.apple.com\/documentation\/AppKit\/NSWindow\/isOnActiveSpace"
        },
        {
          "description" : "A Boolean value that indicates whether the window is removed from the screen when its application becomes inactive.",
          "name" : "hidesOnDeactivate",
          "url" : "https:\/\/developer.apple.com\/documentation\/AppKit\/NSWindow\/hidesOnDeactivate"
        },
        {
          "description" : "A value that identifies the window’s behavior in window collections.",
          "name" : "collectionBehavior",
          "url" : "https:\/\/developer.apple.com\/documentation\/AppKit\/NSWindow\/collectionBehavior-swift.property"
        },
        {
          "description" : "A Boolean value that indicates whether the window is opaque.",
          "name" : "isOpaque",
          "url" : "https:\/\/developer.apple.com\/documentation\/AppKit\/NSWindow\/isOpaque"
        },
        {
          "description" : "A Boolean value that indicates whether the window has a shadow.",
          "name" : "hasShadow",
          "url" : "https:\/\/developer.apple.com\/documentation\/AppKit\/NSWindow\/hasShadow"
        },
        {
          "description" : "Invalidates the window shadow so that it is recomputed based on the current window shape.",
          "name" : "invalidateShadow()",
          "url" : "https:\/\/developer.apple.com\/documentation\/AppKit\/NSWindow\/invalidateShadow()"
        }
      ],
      "title" : "Configuring the Window’s Appearance"
    }
  ],
  "source" : "appleJSON",
  "title" : "preventsApplicationTerminationWhenModal",
  "url" : "https:\/\/developer.apple.com\/documentation\/AppKit\/NSWindow\/preventsApplicationTerminationWhenModal"
}