{
  "abstract" : "The configuration details for a symbol image.",
  "codeExamples" : [

  ],
  "contentHash" : "2a30c92592c6be7b18875d8cc91da2e2acb4dc44d9106ae6d4d877fae2e48e6f",
  "crawledAt" : "2025-12-03T04:14:17Z",
  "declaration" : {
    "code" : "@NSCopying var symbolConfiguration: NSImage.SymbolConfiguration { get }",
    "language" : "swift"
  },
  "id" : "07547744-15F5-4BCB-AD24-04F356974926",
  "kind" : "property",
  "language" : "swift",
  "module" : "AppKit",
  "overview" : "## Discussion\n\nUse this property to access the traits and rendering attributes the system uses with the symbol image. These details determine which variant of the image to load and draw and how to render it, falling back on the current environment for values that you don’t specify. For symbol images, the default value of this property is a symbol image configuration object with unspecified values.\n\nYou can’t modify this property directly, but you can use [doc:\/\/com.apple.appkit\/documentation\/AppKit\/NSImage\/withSymbolConfiguration(_:)] when you want to create a new image object with a specific set of traits.",
  "platforms" : [
    "macOS"
  ],
  "rawMarkdown" : "---\nsource: https:\/\/developer.apple.com\/documentation\/AppKit\/NSImage\/symbolConfiguration-swift.property\ncrawled: 2025-12-03T04:14:17Z\n---\n\n# symbolConfiguration\n\n**Instance Property**\n\nThe configuration details for a symbol image.\n\n## Declaration\n\n```swift\n@NSCopying var symbolConfiguration: NSImage.SymbolConfiguration { get }\n```\n\n## Discussion\n\nUse this property to access the traits and rendering attributes the system uses with the symbol image. These details determine which variant of the image to load and draw and how to render it, falling back on the current environment for values that you don’t specify. For symbol images, the default value of this property is a symbol image configuration object with unspecified values.\n\nYou can’t modify this property directly, but you can use [doc:\/\/com.apple.appkit\/documentation\/AppKit\/NSImage\/withSymbolConfiguration(_:)] when you want to create a new image object with a specific set of traits.\n\n",
  "sections" : [

  ],
  "source" : "appleJSON",
  "title" : "symbolConfiguration",
  "url" : "https:\/\/developer.apple.com\/documentation\/AppKit\/NSImage\/symbolConfiguration-swift.property"
}