{
  "abstract" : "Creates a group of the specified size, containing an array of equally sized items arranged in a horizontal line up to the number specified by count.",
  "codeExamples" : [

  ],
  "contentHash" : "52136cbf23de2636fb0fa4a13f04c2c48a795c5e1c92a3bab127fd3c678f914f",
  "crawledAt" : "2025-12-05T21:47:00Z",
  "declaration" : {
    "code" : "@MainActor class func horizontal(layoutSize: NSCollectionLayoutSize, subitem: NSCollectionLayoutItem, count: Int) -> Self",
    "language" : "swift"
  },
  "id" : "A43342EA-B8ED-470A-A045-4308ADC9FA50",
  "kind" : "method",
  "language" : "swift",
  "module" : "AppKit",
  "overview" : "## Discussion\n\nWhen you set a value for the [doc:\/\/com.apple.appkit\/documentation\/AppKit\/NSCollectionLayoutGroup\/interItemSpacing] property after using this initializer, the group keeps the same number of items and automatically resizes them to add the extra specified spacing between them.",
  "platforms" : [
    "macOS"
  ],
  "rawMarkdown" : "---\nsource: https:\/\/developer.apple.com\/documentation\/AppKit\/NSCollectionLayoutGroup\/horizontal(layoutSize:subitem:count:)\ncrawled: 2025-12-05T21:47:00Z\n---\n\n# horizontal(layoutSize:subitem:count:)\n\n**Type Method**\n\nCreates a group of the specified size, containing an array of equally sized items arranged in a horizontal line up to the number specified by count.\n\n## Declaration\n\n```swift\n@MainActor class func horizontal(layoutSize: NSCollectionLayoutSize, subitem: NSCollectionLayoutItem, count: Int) -> Self\n```\n\n## Discussion\n\nWhen you set a value for the [doc:\/\/com.apple.appkit\/documentation\/AppKit\/NSCollectionLayoutGroup\/interItemSpacing] property after using this initializer, the group keeps the same number of items and automatically resizes them to add the extra specified spacing between them.\n\n## Creating a horizontal group\n\n- **horizontal(layoutSize:subitems:)**: Creates a group of the specified size, containing an array of items arranged in a horizontal line.\n\n",
  "sections" : [
    {
      "content" : "",
      "items" : [
        {
          "description" : "Creates a group of the specified size, containing an array of items arranged in a horizontal line.",
          "name" : "horizontal(layoutSize:subitems:)",
          "url" : "https:\/\/developer.apple.com\/documentation\/AppKit\/NSCollectionLayoutGroup\/horizontal(layoutSize:subitems:)"
        }
      ],
      "title" : "Creating a horizontal group"
    }
  ],
  "source" : "appleJSON",
  "title" : "horizontal(layoutSize:subitem:count:)",
  "url" : "https:\/\/developer.apple.com\/documentation\/AppKit\/NSCollectionLayoutGroup\/horizontal(layoutSize:subitem:count:)"
}