{
  "abstract" : "A Boolean that indicates whether the receiver uses lazy fetching.",
  "codeExamples" : [

  ],
  "contentHash" : "1a454899960667eb1c731b8025c33a5fd636067bace1a137ea772c79ec340820",
  "crawledAt" : "2025-12-03T09:01:10Z",
  "declaration" : {
    "code" : "var usesLazyFetching: Bool { get set }",
    "language" : "swift"
  },
  "id" : "E3831607-58B7-48B0-9F78-6B90E3D27E74",
  "kind" : "property",
  "language" : "swift",
  "module" : "AppKit",
  "overview" : "## Discussion\n\nWhen enabled the controller uses a number of techniques that typically make managing large data sets more efficient. As with all optimizations, you should use suitable performance analysis tools (such as Instruments) to determine the best solution.",
  "platforms" : [
    "macOS"
  ],
  "rawMarkdown" : "---\nsource: https:\/\/developer.apple.com\/documentation\/AppKit\/NSObjectController\/usesLazyFetching\ncrawled: 2025-12-03T09:01:10Z\n---\n\n# usesLazyFetching\n\n**Instance Property**\n\nA Boolean that indicates whether the receiver uses lazy fetching.\n\n## Declaration\n\n```swift\nvar usesLazyFetching: Bool { get set }\n```\n\n## Discussion\n\nWhen enabled the controller uses a number of techniques that typically make managing large data sets more efficient. As with all optimizations, you should use suitable performance analysis tools (such as Instruments) to determine the best solution.\n\n## Core Data support\n\n- **entityName**: The entity name used by the receiver to create new objects.\n- **fetch(_:)**: Causes the receiver to fetch the data objects specified by the entity name and fetch predicate.\n- **defaultFetchRequest()**: Returns the default fetch request used by the receiver.\n- **fetchPredicate**: The receiver’s fetch predicate.\n- **managedObjectContext**: The receiver’s managed object context.\n- **fetch(with:merge:)**: Subclasses should override this method to customize a fetch request, for example to specify fetch limits.\n\n",
  "sections" : [
    {
      "content" : "",
      "items" : [
        {
          "description" : "The entity name used by the receiver to create new objects.",
          "name" : "entityName",
          "url" : "https:\/\/developer.apple.com\/documentation\/AppKit\/NSObjectController\/entityName"
        },
        {
          "description" : "Causes the receiver to fetch the data objects specified by the entity name and fetch predicate.",
          "name" : "fetch(_:)",
          "url" : "https:\/\/developer.apple.com\/documentation\/AppKit\/NSObjectController\/fetch(_:)"
        },
        {
          "description" : "Returns the default fetch request used by the receiver.",
          "name" : "defaultFetchRequest()",
          "url" : "https:\/\/developer.apple.com\/documentation\/AppKit\/NSObjectController\/defaultFetchRequest()"
        },
        {
          "description" : "The receiver’s fetch predicate.",
          "name" : "fetchPredicate",
          "url" : "https:\/\/developer.apple.com\/documentation\/AppKit\/NSObjectController\/fetchPredicate"
        },
        {
          "description" : "The receiver’s managed object context.",
          "name" : "managedObjectContext",
          "url" : "https:\/\/developer.apple.com\/documentation\/AppKit\/NSObjectController\/managedObjectContext"
        },
        {
          "description" : "Subclasses should override this method to customize a fetch request, for example to specify fetch limits.",
          "name" : "fetch(with:merge:)",
          "url" : "https:\/\/developer.apple.com\/documentation\/AppKit\/NSObjectController\/fetch(with:merge:)"
        }
      ],
      "title" : "Core Data support"
    }
  ],
  "source" : "appleJSON",
  "title" : "usesLazyFetching",
  "url" : "https:\/\/developer.apple.com\/documentation\/AppKit\/NSObjectController\/usesLazyFetching"
}