{
  "abstract" : "Called during Auto Layout constraint updating to enable the view controller to mediate the process.",
  "codeExamples" : [

  ],
  "contentHash" : "e27de5e8ed37302f9170a454e2d5ba2b924fe4bfd6b72f5d562dd3b3918f1515",
  "crawledAt" : "2025-12-01T13:59:00Z",
  "declaration" : {
    "code" : "@MainActor func updateViewConstraints()",
    "language" : "swift"
  },
  "id" : "32CDB077-A48E-44DA-9CE5-CED92C24EFA6",
  "kind" : "method",
  "module" : "AppKit",
  "overview" : "## Discussion\n\nThis method gets called, for example, when the user interacts with a view in a way that causes the layout to change. When called, the default implementation of this method in turn calls the [doc:\/\/com.apple.appkit\/documentation\/AppKit\/NSView\/updateConstraints()] method on the view controller’s view.\n\nYou can override this method to update custom view constraints, as an alternative to subclassing the view controller’s view and overriding its [doc:\/\/com.apple.appkit\/documentation\/AppKit\/NSView\/updateConstraints()] method.\n\nIf you override this method, you must call this method on `super` at some point in your implementation or call the [doc:\/\/com.apple.appkit\/documentation\/AppKit\/NSView\/updateConstraints()] method on the view controller’s view.\n\nThis method is called only for apps that link against macOS 10.10 or later.",
  "platforms" : [
    "macOS"
  ],
  "rawMarkdown" : "---\nsource: https:\/\/developer.apple.com\/documentation\/AppKit\/NSViewController\/updateViewConstraints()\ncrawled: 2025-12-01T13:59:00Z\n---\n\n# updateViewConstraints()\n\n**Instance Method**\n\nCalled during Auto Layout constraint updating to enable the view controller to mediate the process.\n\n## Declaration\n\n```swift\n@MainActor func updateViewConstraints()\n```\n\n## Discussion\n\nThis method gets called, for example, when the user interacts with a view in a way that causes the layout to change. When called, the default implementation of this method in turn calls the [doc:\/\/com.apple.appkit\/documentation\/AppKit\/NSView\/updateConstraints()] method on the view controller’s view.\n\nYou can override this method to update custom view constraints, as an alternative to subclassing the view controller’s view and overriding its [doc:\/\/com.apple.appkit\/documentation\/AppKit\/NSView\/updateConstraints()] method.\n\nIf you override this method, you must call this method on `super` at some point in your implementation or call the [doc:\/\/com.apple.appkit\/documentation\/AppKit\/NSView\/updateConstraints()] method on the view controller’s view.\n\nThis method is called only for apps that link against macOS 10.10 or later.\n\n## Managing View Layout\n\n- **preferredContentSize**: The desired size of the view controller’s view, in screen units.\n- **viewWillLayout()**: Called just before the [doc:\/\/com.apple.appkit\/documentation\/AppKit\/NSView\/layout()] method of the view controller’s view is called.\n- **viewDidLayout()**: Called immediately after the [doc:\/\/com.apple.appkit\/documentation\/AppKit\/NSView\/layout()] method of the view controller’s view is called.\n\n",
  "sections" : [
    {
      "content" : "",
      "items" : [
        {
          "description" : "The desired size of the view controller’s view, in screen units.",
          "name" : "preferredContentSize",
          "url" : "https:\/\/developer.apple.com\/documentation\/AppKit\/NSViewController\/preferredContentSize"
        },
        {
          "description" : "Called just before the [doc:\/\/com.apple.appkit\/documentation\/AppKit\/NSView\/layout()] method of the view controller’s view is called.",
          "name" : "viewWillLayout()",
          "url" : "https:\/\/developer.apple.com\/documentation\/AppKit\/NSViewController\/viewWillLayout()"
        },
        {
          "description" : "Called immediately after the [doc:\/\/com.apple.appkit\/documentation\/AppKit\/NSView\/layout()] method of the view controller’s view is called.",
          "name" : "viewDidLayout()",
          "url" : "https:\/\/developer.apple.com\/documentation\/AppKit\/NSViewController\/viewDidLayout()"
        }
      ],
      "title" : "Managing View Layout"
    }
  ],
  "source" : "appleJSON",
  "title" : "updateViewConstraints()",
  "url" : "https:\/\/developer.apple.com\/documentation\/AppKit\/NSViewController\/updateViewConstraints()"
}