{
  "abstract" : "Tells the element that the layout object of the collection view is about to change.",
  "codeExamples" : [

  ],
  "contentHash" : "d24b3ac93dc4ffbdd46ad03a8759b3b995ab478d20f61214853154d3f74a7e93",
  "crawledAt" : "2025-12-04T18:11:15Z",
  "declaration" : {
    "code" : "@MainActor optional func willTransition(from oldLayout: NSCollectionViewLayout, to newLayout: NSCollectionViewLayout)",
    "language" : "swift"
  },
  "id" : "1E89FCF5-9B5D-4A38-9D4C-B9270F3EDBC1",
  "kind" : "method",
  "language" : "swift",
  "module" : "AppKit",
  "overview" : "## Discussion\n\nThe default implementation of this method does nothing. Subclasses can override it and use it to prepare for the change in layouts.\n\n### Special Considerations\n\nIn OS X 10.11, this method is never called.",
  "platforms" : [
    "macOS"
  ],
  "rawMarkdown" : "---\nsource: https:\/\/developer.apple.com\/documentation\/AppKit\/NSCollectionViewElement\/willTransition(from:to:)\ncrawled: 2025-12-04T18:11:15Z\n---\n\n# willTransition(from:to:)\n\n**Instance Method**\n\nTells the element that the layout object of the collection view is about to change.\n\n## Declaration\n\n```swift\n@MainActor optional func willTransition(from oldLayout: NSCollectionViewLayout, to newLayout: NSCollectionViewLayout)\n```\n\n## Parameters\n\n- **oldLayout**: The current layout object used by the collection view.\n- **newLayout**: The new layout object that is about to be used by the collection view.\n\n## Discussion\n\nThe default implementation of this method does nothing. Subclasses can override it and use it to prepare for the change in layouts.\n\n### Special Considerations\n\nIn OS X 10.11, this method is never called.\n\n## Managing Layout Changes\n\n- **preferredLayoutAttributesFitting(_:)**: Asks your element if it wants to modify any layout attributes before they are applied.\n- **apply(_:)**: Applies the specified layout attributes to the element.\n- **didTransition(from:to:)**: Tells the element that the layout object of the collection view changed.\n\n",
  "sections" : [
    {
      "content" : "",
      "items" : [
        {
          "description" : "Asks your element if it wants to modify any layout attributes before they are applied.",
          "name" : "preferredLayoutAttributesFitting(_:)",
          "url" : "https:\/\/developer.apple.com\/documentation\/AppKit\/NSCollectionViewElement\/preferredLayoutAttributesFitting(_:)"
        },
        {
          "description" : "Applies the specified layout attributes to the element.",
          "name" : "apply(_:)",
          "url" : "https:\/\/developer.apple.com\/documentation\/AppKit\/NSCollectionViewElement\/apply(_:)"
        },
        {
          "description" : "Tells the element that the layout object of the collection view changed.",
          "name" : "didTransition(from:to:)",
          "url" : "https:\/\/developer.apple.com\/documentation\/AppKit\/NSCollectionViewElement\/didTransition(from:to:)"
        }
      ],
      "title" : "Managing Layout Changes"
    }
  ],
  "source" : "appleJSON",
  "title" : "willTransition(from:to:)",
  "url" : "https:\/\/developer.apple.com\/documentation\/AppKit\/NSCollectionViewElement\/willTransition(from:to:)"
}