{
  "abstract" : "The preferred thickness of the split view item relative to the split view.",
  "codeExamples" : [

  ],
  "contentHash" : "1a3cf2c25ebcb8c9429e16b0a626236f001931887d192e15ba5e08b2caac1994",
  "crawledAt" : "2025-12-03T09:24:11Z",
  "declaration" : {
    "code" : "var preferredThicknessFraction: CGFloat { get set }",
    "language" : "swift"
  },
  "id" : "46C6E784-6116-4E4E-926B-8ED15E2B7A29",
  "kind" : "property",
  "language" : "swift",
  "module" : "AppKit",
  "overview" : "## Discussion\n\nThis value represents the proportion of the split view that you want the split view item to occupy on a scale of `0.0` to `1.0`. The system uses this value to adjust the thickness of the item in relation to other items when a user double-clicks a neighboring divider, and when the app enters full-screen mode.\n\nThe default value of this property is [doc:\/\/com.apple.appkit\/documentation\/AppKit\/NSSplitViewItem\/unspecifiedDimension], which means the item doesn’t resize when a user double-clicks the divider, and the system preserves the absolute size when the app enters full-screen mode.",
  "platforms" : [
    "macOS"
  ],
  "rawMarkdown" : "---\nsource: https:\/\/developer.apple.com\/documentation\/AppKit\/NSSplitViewItem\/preferredThicknessFraction\ncrawled: 2025-12-03T09:24:11Z\n---\n\n# preferredThicknessFraction\n\n**Instance Property**\n\nThe preferred thickness of the split view item relative to the split view.\n\n## Declaration\n\n```swift\nvar preferredThicknessFraction: CGFloat { get set }\n```\n\n## Discussion\n\nThis value represents the proportion of the split view that you want the split view item to occupy on a scale of `0.0` to `1.0`. The system uses this value to adjust the thickness of the item in relation to other items when a user double-clicks a neighboring divider, and when the app enters full-screen mode.\n\nThe default value of this property is [doc:\/\/com.apple.appkit\/documentation\/AppKit\/NSSplitViewItem\/unspecifiedDimension], which means the item doesn’t resize when a user double-clicks the divider, and the system preserves the absolute size when the app enters full-screen mode.\n\n## Managing the item thickness\n\n- **automaticMaximumThickness**: The maximum thickness of the split view item when it resizes due to automatic sizing.\n- **minimumThickness**: The minimum thickness of the split view item.\n- **maximumThickness**: The maximum thickness of the split view item.\n- **unspecifiedDimension**: A constant that resets a dimension’s value.\n\n",
  "sections" : [
    {
      "content" : "",
      "items" : [
        {
          "description" : "The maximum thickness of the split view item when it resizes due to automatic sizing.",
          "name" : "automaticMaximumThickness",
          "url" : "https:\/\/developer.apple.com\/documentation\/AppKit\/NSSplitViewItem\/automaticMaximumThickness"
        },
        {
          "description" : "The minimum thickness of the split view item.",
          "name" : "minimumThickness",
          "url" : "https:\/\/developer.apple.com\/documentation\/AppKit\/NSSplitViewItem\/minimumThickness"
        },
        {
          "description" : "The maximum thickness of the split view item.",
          "name" : "maximumThickness",
          "url" : "https:\/\/developer.apple.com\/documentation\/AppKit\/NSSplitViewItem\/maximumThickness"
        },
        {
          "description" : "A constant that resets a dimension’s value.",
          "name" : "unspecifiedDimension",
          "url" : "https:\/\/developer.apple.com\/documentation\/AppKit\/NSSplitViewItem\/unspecifiedDimension"
        }
      ],
      "title" : "Managing the item thickness"
    }
  ],
  "source" : "appleJSON",
  "title" : "preferredThicknessFraction",
  "url" : "https:\/\/developer.apple.com\/documentation\/AppKit\/NSSplitViewItem\/preferredThicknessFraction"
}