{
  "abstract" : "The animation that Writing Tools performs when inserting text into your view.",
  "codeExamples" : [

  ],
  "contentHash" : "382c3fe5b7d866b6db048b15f6ec5de1bb893829a198d849f4156ec7f075c511",
  "crawledAt" : "2025-12-03T07:36:47Z",
  "declaration" : {
    "code" : "case insert",
    "language" : "swift"
  },
  "id" : "A2EC806B-9C01-4ED1-9A9F-D711F0F680D2",
  "kind" : "unknown",
  "language" : "swift",
  "module" : "AppKit",
  "overview" : "## Discussion\n\nThis type of animation shows the insertion of text to your view. When preparing for this animation, hide the text in the provided range if you haven’t already. If you support animating the reflow of your view’s text, you can also prepare any other animations you need. Writing Tools uses a preview object you provide to animate the insertion of the text.",
  "platforms" : [
    "macOS"
  ],
  "rawMarkdown" : "---\nsource: https:\/\/developer.apple.com\/documentation\/AppKit\/NSWritingToolsCoordinator\/TextAnimation\/insert\ncrawled: 2025-12-03T07:36:47Z\n---\n\n# NSWritingToolsCoordinator.TextAnimation.insert\n\n**Case**\n\nThe animation that Writing Tools performs when inserting text into your view.\n\n## Declaration\n\n```swift\ncase insert\n```\n\n## Discussion\n\nThis type of animation shows the insertion of text to your view. When preparing for this animation, hide the text in the provided range if you haven’t already. If you support animating the reflow of your view’s text, you can also prepare any other animations you need. Writing Tools uses a preview object you provide to animate the insertion of the text.\n\n## Getting the animation types\n\n- **NSWritingToolsCoordinator.TextAnimation.anticipate**: The animation that Writing Tools performs when waiting to receive results from the large language model.\n- **NSWritingToolsCoordinator.TextAnimation.remove**: The animation that Writing Tools performs when removing text from your view.\n- **NSWritingToolsCoordinator.TextAnimation.anticipateInactive**: The animation effect that Writing Tools performs when the view is waiting for results, but the system isn’t actively evaluating the text.\n- **NSWritingToolsCoordinator.TextAnimation.translate**: The animation effect that Writing Tools performs on text situated after the insertion point.\n\n",
  "sections" : [
    {
      "content" : "",
      "items" : [
        {
          "description" : "The animation that Writing Tools performs when waiting to receive results from the large language model.",
          "name" : "NSWritingToolsCoordinator.TextAnimation.anticipate",
          "url" : "https:\/\/developer.apple.com\/documentation\/AppKit\/NSWritingToolsCoordinator\/TextAnimation\/anticipate"
        },
        {
          "description" : "The animation that Writing Tools performs when removing text from your view.",
          "name" : "NSWritingToolsCoordinator.TextAnimation.remove",
          "url" : "https:\/\/developer.apple.com\/documentation\/AppKit\/NSWritingToolsCoordinator\/TextAnimation\/remove"
        },
        {
          "description" : "The animation effect that Writing Tools performs when the view is waiting for results, but the system isn’t actively evaluating the text.",
          "name" : "NSWritingToolsCoordinator.TextAnimation.anticipateInactive",
          "url" : "https:\/\/developer.apple.com\/documentation\/AppKit\/NSWritingToolsCoordinator\/TextAnimation\/anticipateInactive"
        },
        {
          "description" : "The animation effect that Writing Tools performs on text situated after the insertion point.",
          "name" : "NSWritingToolsCoordinator.TextAnimation.translate",
          "url" : "https:\/\/developer.apple.com\/documentation\/AppKit\/NSWritingToolsCoordinator\/TextAnimation\/translate"
        }
      ],
      "title" : "Getting the animation types"
    }
  ],
  "source" : "appleJSON",
  "title" : "NSWritingToolsCoordinator.TextAnimation.insert",
  "url" : "https:\/\/developer.apple.com\/documentation\/AppKit\/NSWritingToolsCoordinator\/TextAnimation\/insert"
}