{
  "abstract" : "A set of methods that support interaction with items users can share through a sharing service.",
  "codeExamples" : [

  ],
  "contentHash" : "56952c38bd78ae942963687a88d8273d1b6d7960c8c39ee762db18cf7c1616fc",
  "crawledAt" : "2025-12-01T09:21:47Z",
  "declaration" : {
    "code" : "protocol NSServicesMenuRequestor : NSObjectProtocol",
    "language" : "swift"
  },
  "id" : "7DECE9EA-8691-408B-8577-E212FB6A0AF2",
  "kind" : "protocol",
  "module" : "AppKit",
  "overview" : "## Overview\n\nThis informal protocol consists of two methods, [doc:\/\/com.apple.appkit\/documentation\/AppKit\/NSServicesMenuRequestor\/writeSelection(to:types:)] and [doc:\/\/com.apple.appkit\/documentation\/AppKit\/NSServicesMenuRequestor\/readSelection(from:)]. The first method provides data to a remote service, and the second receives any data the remote service might send back. Both respond to messages that are generated when the user chooses a command from the Services menu.",
  "platforms" : [
    "macOS"
  ],
  "rawMarkdown" : "---\nsource: https:\/\/developer.apple.com\/documentation\/AppKit\/NSServicesMenuRequestor\ncrawled: 2025-12-01T09:21:47Z\n---\n\n# NSServicesMenuRequestor\n\n**Protocol**\n\nA set of methods that support interaction with items users can share through a sharing service.\n\n## Declaration\n\n```swift\nprotocol NSServicesMenuRequestor : NSObjectProtocol\n```\n\n## Overview\n\nThis informal protocol consists of two methods, [doc:\/\/com.apple.appkit\/documentation\/AppKit\/NSServicesMenuRequestor\/writeSelection(to:types:)] and [doc:\/\/com.apple.appkit\/documentation\/AppKit\/NSServicesMenuRequestor\/readSelection(from:)]. The first method provides data to a remote service, and the second receives any data the remote service might send back. Both respond to messages that are generated when the user chooses a command from the Services menu.\n\n## Working with Pasteboards\n\n- **readSelection(from:)**: Reads data from the pasteboard and uses it to replace the current selection.\n- **writeSelection(to:types:)**: Writes the current selection to the pasteboard.\n\n## App Services\n\n- **NSSharingService**: An object that facilitates the sharing of content with social media services, or with apps like Mail or Safari.\n- **NSSharingServicePicker**: A list of sharing services that the user can choose from.\n- **NSPreviewRepresentableActivityItem**: An interface you adopt in custom objects that you want to share using the macOS share sheet.\n- **NSSharingServicePickerToolbarItem**: A toolbar item that displays the macOS share sheet.\n- **NSCloudSharingServiceDelegate**: A set of methods for responding to the life cycle events of the cloud-sharing service.\n- **Services Functions**: Configure the contents of your app’s Services menu.\n\n## Inherits From\n\n- NSObjectProtocol\n\n",
  "sections" : [
    {
      "content" : "",
      "items" : [
        {
          "description" : "Reads data from the pasteboard and uses it to replace the current selection.",
          "name" : "readSelection(from:)",
          "url" : "https:\/\/developer.apple.com\/documentation\/AppKit\/NSServicesMenuRequestor\/readSelection(from:)"
        },
        {
          "description" : "Writes the current selection to the pasteboard.",
          "name" : "writeSelection(to:types:)",
          "url" : "https:\/\/developer.apple.com\/documentation\/AppKit\/NSServicesMenuRequestor\/writeSelection(to:types:)"
        }
      ],
      "title" : "Working with Pasteboards"
    },
    {
      "content" : "",
      "items" : [
        {
          "description" : "An object that facilitates the sharing of content with social media services, or with apps like Mail or Safari.",
          "name" : "NSSharingService",
          "url" : "https:\/\/developer.apple.com\/documentation\/AppKit\/NSSharingService"
        },
        {
          "description" : "A list of sharing services that the user can choose from.",
          "name" : "NSSharingServicePicker",
          "url" : "https:\/\/developer.apple.com\/documentation\/AppKit\/NSSharingServicePicker"
        },
        {
          "description" : "An interface you adopt in custom objects that you want to share using the macOS share sheet.",
          "name" : "NSPreviewRepresentableActivityItem",
          "url" : "https:\/\/developer.apple.com\/documentation\/AppKit\/NSPreviewRepresentableActivityItem"
        },
        {
          "description" : "A toolbar item that displays the macOS share sheet.",
          "name" : "NSSharingServicePickerToolbarItem",
          "url" : "https:\/\/developer.apple.com\/documentation\/AppKit\/NSSharingServicePickerToolbarItem"
        },
        {
          "description" : "A set of methods for responding to the life cycle events of the cloud-sharing service.",
          "name" : "NSCloudSharingServiceDelegate",
          "url" : "https:\/\/developer.apple.com\/documentation\/AppKit\/NSCloudSharingServiceDelegate"
        },
        {
          "description" : "Configure the contents of your app’s Services menu.",
          "name" : "Services Functions",
          "url" : "https:\/\/developer.apple.com\/documentation\/AppKit\/services-functions"
        }
      ],
      "title" : "App Services"
    },
    {
      "content" : "",
      "items" : [
        {
          "name" : "NSObjectProtocol"
        }
      ],
      "title" : "Inherits From"
    }
  ],
  "source" : "appleJSON",
  "title" : "NSServicesMenuRequestor",
  "url" : "https:\/\/developer.apple.com\/documentation\/AppKit\/NSServicesMenuRequestor"
}