{
  "abstract" : "Returns a short description of the stepper.",
  "codeExamples" : [

  ],
  "contentHash" : "be7c942d747dec7fb7fbca0351c2e37ee285119aa5313a1feba9123009f57213",
  "crawledAt" : "2025-12-02T05:06:47Z",
  "declaration" : {
    "code" : "func accessibilityLabel() -> String?",
    "language" : "swift"
  },
  "id" : "CDD340E2-61FA-4C4C-BC37-DFB946932E4C",
  "kind" : "method",
  "module" : "AppKit",
  "overview" : "## Return Value\n\nThe description of the stepper.\n\n## Discussion\n\nThis method is the getter for the [doc:\/\/com.apple.appkit\/documentation\/AppKit\/NSAccessibilityProtocol] protocol’s [doc:\/\/com.apple.appkit\/documentation\/AppKit\/NSAccessibility-c.protocol\/accessibilityLabel] property.\n\nDo not include the control’s type in the label (for example, use `Volume`, not `Volume stepper`). If possible use a single word. To help ensure that accessibility clients such as VoiceOver read the label with the correct intonation, start this label with a capital letter. Do not put a period at the end. Always localize the label.",
  "platforms" : [
    "macOS"
  ],
  "rawMarkdown" : "---\nsource: https:\/\/developer.apple.com\/documentation\/AppKit\/NSAccessibilityStepper\/accessibilityLabel()\ncrawled: 2025-12-02T05:06:47Z\n---\n\n# accessibilityLabel()\n\n**Instance Method**\n\nReturns a short description of the stepper.\n\n## Declaration\n\n```swift\nfunc accessibilityLabel() -> String?\n```\n\n## Return Value\n\nThe description of the stepper.\n\n## Discussion\n\nThis method is the getter for the [doc:\/\/com.apple.appkit\/documentation\/AppKit\/NSAccessibilityProtocol] protocol’s [doc:\/\/com.apple.appkit\/documentation\/AppKit\/NSAccessibility-c.protocol\/accessibilityLabel] property.\n\nDo not include the control’s type in the label (for example, use `Volume`, not `Volume stepper`). If possible use a single word. To help ensure that accessibility clients such as VoiceOver read the label with the correct intonation, start this label with a capital letter. Do not put a period at the end. Always localize the label.\n\n## Supporting Accessibility\n\n- **accessibilityPerformDecrement()**: Decrements the stepper’s value.\n- **accessibilityPerformIncrement()**: Increments the stepper’s value.\n- **accessibilityValue()**: Returns the stepper’s value.\n\n",
  "sections" : [
    {
      "content" : "",
      "items" : [
        {
          "description" : "Decrements the stepper’s value.",
          "name" : "accessibilityPerformDecrement()",
          "url" : "https:\/\/developer.apple.com\/documentation\/AppKit\/NSAccessibilityStepper\/accessibilityPerformDecrement()"
        },
        {
          "description" : "Increments the stepper’s value.",
          "name" : "accessibilityPerformIncrement()",
          "url" : "https:\/\/developer.apple.com\/documentation\/AppKit\/NSAccessibilityStepper\/accessibilityPerformIncrement()"
        },
        {
          "description" : "Returns the stepper’s value.",
          "name" : "accessibilityValue()",
          "url" : "https:\/\/developer.apple.com\/documentation\/AppKit\/NSAccessibilityStepper\/accessibilityValue()"
        }
      ],
      "title" : "Supporting Accessibility"
    }
  ],
  "source" : "appleJSON",
  "title" : "accessibilityLabel()",
  "url" : "https:\/\/developer.apple.com\/documentation\/AppKit\/NSAccessibilityStepper\/accessibilityLabel()"
}