{
  "abstract" : "Sets the visibility of the glyph at the specified index.",
  "codeExamples" : [

  ],
  "contentHash" : "926024033c0b8075b7246555558729daddf1bd1c46d896b15062a54df97e1092",
  "crawledAt" : "2025-12-02T07:32:16Z",
  "declaration" : {
    "code" : "func setNotShownAttribute(_ flag: Bool, forGlyphAt glyphIndex: Int)",
    "language" : "swift"
  },
  "id" : "277656D0-CB88-405A-AEA8-B260C9BAF558",
  "kind" : "method",
  "module" : "AppKit",
  "overview" : "## Discussion\n\nThe typesetter decides which glyphs are not shown and sets this attribute in the layout manager to ensure that those glyphs are not displayed. For example, a tab or newline character doesn’t leave any marks; it just indicates where following glyphs are laid out.\n\nRaises an `NSRangeException` if `glyphIndex` is out of bounds.\n\nThis method is used by the layout mechanism and should be invoked only during typesetting, in almost all cases only by the typesetter. For example, a custom typesetter might invoke it.",
  "platforms" : [
    "macOS"
  ],
  "rawMarkdown" : "---\nsource: https:\/\/developer.apple.com\/documentation\/AppKit\/NSLayoutManager\/setNotShownAttribute(_:forGlyphAt:)\ncrawled: 2025-12-02T07:32:16Z\n---\n\n# setNotShownAttribute(_:forGlyphAt:)\n\n**Instance Method**\n\nSets the visibility of the glyph at the specified index.\n\n## Declaration\n\n```swift\nfunc setNotShownAttribute(_ flag: Bool, forGlyphAt glyphIndex: Int)\n```\n\n## Parameters\n\n- **flag**: If [doc:\/\/com.apple.documentation\/documentation\/Swift\/true], the glyph is not shown; if [doc:\/\/com.apple.documentation\/documentation\/Swift\/false], it is shown.\n- **glyphIndex**: Index of the glyph whose attribute is set.\n\n## Discussion\n\nThe typesetter decides which glyphs are not shown and sets this attribute in the layout manager to ensure that those glyphs are not displayed. For example, a tab or newline character doesn’t leave any marks; it just indicates where following glyphs are laid out.\n\nRaises an `NSRangeException` if `glyphIndex` is out of bounds.\n\nThis method is used by the layout mechanism and should be invoked only during typesetting, in almost all cases only by the typesetter. For example, a custom typesetter might invoke it.\n\n## Setting layout information\n\n- **setAttachmentSize(_:forGlyphRange:)**: Sets the size to use when drawing a glyph that represents an attachment.\n- **setDrawsOutsideLineFragment(_:forGlyphAt:)**: Indicates whether the specified glyph exceeds the bounds of the line fragment for its layout.\n- **setExtraLineFragmentRect(_:usedRect:textContainer:)**: Sets the bounds and container for the extra line fragment.\n- **setLineFragmentRect(_:forGlyphRange:usedRect:)**: Associates the line fragment bounds for the specified range of glyphs.\n- **setLocation(_:forStartOfGlyphRange:)**: Sets the location for the first glyph in the specified range.\n\n",
  "sections" : [
    {
      "content" : "",
      "items" : [
        {
          "description" : "Sets the size to use when drawing a glyph that represents an attachment.",
          "name" : "setAttachmentSize(_:forGlyphRange:)",
          "url" : "https:\/\/developer.apple.com\/documentation\/AppKit\/NSLayoutManager\/setAttachmentSize(_:forGlyphRange:)"
        },
        {
          "description" : "Indicates whether the specified glyph exceeds the bounds of the line fragment for its layout.",
          "name" : "setDrawsOutsideLineFragment(_:forGlyphAt:)",
          "url" : "https:\/\/developer.apple.com\/documentation\/AppKit\/NSLayoutManager\/setDrawsOutsideLineFragment(_:forGlyphAt:)"
        },
        {
          "description" : "Sets the bounds and container for the extra line fragment.",
          "name" : "setExtraLineFragmentRect(_:usedRect:textContainer:)",
          "url" : "https:\/\/developer.apple.com\/documentation\/AppKit\/NSLayoutManager\/setExtraLineFragmentRect(_:usedRect:textContainer:)"
        },
        {
          "description" : "Associates the line fragment bounds for the specified range of glyphs.",
          "name" : "setLineFragmentRect(_:forGlyphRange:usedRect:)",
          "url" : "https:\/\/developer.apple.com\/documentation\/AppKit\/NSLayoutManager\/setLineFragmentRect(_:forGlyphRange:usedRect:)"
        },
        {
          "description" : "Sets the location for the first glyph in the specified range.",
          "name" : "setLocation(_:forStartOfGlyphRange:)",
          "url" : "https:\/\/developer.apple.com\/documentation\/AppKit\/NSLayoutManager\/setLocation(_:forStartOfGlyphRange:)"
        }
      ],
      "title" : "Setting layout information"
    }
  ],
  "source" : "appleJSON",
  "title" : "setNotShownAttribute(_:forGlyphAt:)",
  "url" : "https:\/\/developer.apple.com\/documentation\/AppKit\/NSLayoutManager\/setNotShownAttribute(_:forGlyphAt:)"
}