{
  "abstract" : "Returns a positive number if the receiver can represent a given predicate, and `0` if it cannot.",
  "codeExamples" : [

  ],
  "contentHash" : "19e06a8ce3d176cdd61593713705d79ac95f1448dba2c3c9f06c5058fdbbca56",
  "crawledAt" : "2025-12-04T19:49:42Z",
  "declaration" : {
    "code" : "func match(for predicate: NSPredicate) -> Double",
    "language" : "swift"
  },
  "id" : "F2C06111-3A0D-4279-9C91-B2311400438C",
  "kind" : "method",
  "language" : "swift",
  "module" : "AppKit",
  "overview" : "## Return Value\n\nA positive number if the template can represent `predicate`, and `0` if it cannot.\n\n## Discussion\n\nBy default, returns values in the range `0` to `1`.\n\nThe highest match among all the templates determines which template is responsible for displaying the predicate. You can override this to determine which predicates your custom template handles.",
  "platforms" : [
    "macOS"
  ],
  "rawMarkdown" : "---\nsource: https:\/\/developer.apple.com\/documentation\/AppKit\/NSPredicateEditorRowTemplate\/match(for:)\ncrawled: 2025-12-04T19:49:42Z\n---\n\n# match(for:)\n\n**Instance Method**\n\nReturns a positive number if the receiver can represent a given predicate, and `0` if it cannot.\n\n## Declaration\n\n```swift\nfunc match(for predicate: NSPredicate) -> Double\n```\n\n## Return Value\n\nA positive number if the template can represent `predicate`, and `0` if it cannot.\n\n## Discussion\n\nBy default, returns values in the range `0` to `1`.\n\nThe highest match among all the templates determines which template is responsible for displaying the predicate. You can override this to determine which predicates your custom template handles.\n\n## Primitive Methods\n\n- **templateViews**: Returns the views that display this template’s predicate.\n- **setPredicate(_:)**: Sets the value of the views according to the given predicate.\n- **displayableSubpredicates(of:)**: Returns the subpredicates that should be made sub-rows of a given predicate.\n- **predicate(withSubpredicates:)**: Returns the predicate represented by the receiver’s views’ values and the given sub-predicates.\n\n",
  "sections" : [
    {
      "content" : "",
      "items" : [
        {
          "description" : "Returns the views that display this template’s predicate.",
          "name" : "templateViews",
          "url" : "https:\/\/developer.apple.com\/documentation\/AppKit\/NSPredicateEditorRowTemplate\/templateViews"
        },
        {
          "description" : "Sets the value of the views according to the given predicate.",
          "name" : "setPredicate(_:)",
          "url" : "https:\/\/developer.apple.com\/documentation\/AppKit\/NSPredicateEditorRowTemplate\/setPredicate(_:)"
        },
        {
          "description" : "Returns the subpredicates that should be made sub-rows of a given predicate.",
          "name" : "displayableSubpredicates(of:)",
          "url" : "https:\/\/developer.apple.com\/documentation\/AppKit\/NSPredicateEditorRowTemplate\/displayableSubpredicates(of:)"
        },
        {
          "description" : "Returns the predicate represented by the receiver’s views’ values and the given sub-predicates.",
          "name" : "predicate(withSubpredicates:)",
          "url" : "https:\/\/developer.apple.com\/documentation\/AppKit\/NSPredicateEditorRowTemplate\/predicate(withSubpredicates:)"
        }
      ],
      "title" : "Primitive Methods"
    }
  ],
  "source" : "appleJSON",
  "title" : "match(for:)",
  "url" : "https:\/\/developer.apple.com\/documentation\/AppKit\/NSPredicateEditorRowTemplate\/match(for:)"
}