{
  "abstract" : "An array of URLs that correspond to the selected files in a running Open dialog.",
  "codeExamples" : [

  ],
  "contentHash" : "791734a598af8da54a4b517689286fc36aa1cbb97f01668d67e7315eac397100",
  "crawledAt" : "2025-12-02T18:09:57Z",
  "declaration" : {
    "code" : "@MainActor func urlsFromRunningOpenPanel() -> [URL]?",
    "language" : "swift"
  },
  "id" : "892D3612-70CB-4091-B4DF-DE850E6B35A3",
  "kind" : "method",
  "language" : "swift",
  "module" : "AppKit",
  "overview" : "## Discussion\n\nAccessing this property creates an [doc:\/\/com.apple.appkit\/documentation\/AppKit\/NSOpenPanel] object and runs it using the [doc:\/\/com.apple.appkit\/documentation\/AppKit\/NSDocumentController\/runModalOpenPanel(_:forTypes:)] method. When the user dismisses the panel, the returned value is an array of URLs corresponding to the files chosen by the user. The value is `nil` if the user cancels the Open panel or makes no selection.",
  "platforms" : [
    "macOS"
  ],
  "rawMarkdown" : "---\nsource: https:\/\/developer.apple.com\/documentation\/AppKit\/NSDocumentController\/urlsFromRunningOpenPanel()\ncrawled: 2025-12-02T18:09:57Z\n---\n\n# urlsFromRunningOpenPanel()\n\n**Instance Method**\n\nAn array of URLs that correspond to the selected files in a running Open dialog.\n\n## Declaration\n\n```swift\n@MainActor func urlsFromRunningOpenPanel() -> [URL]?\n```\n\n## Discussion\n\nAccessing this property creates an [doc:\/\/com.apple.appkit\/documentation\/AppKit\/NSOpenPanel] object and runs it using the [doc:\/\/com.apple.appkit\/documentation\/AppKit\/NSDocumentController\/runModalOpenPanel(_:forTypes:)] method. When the user dismisses the panel, the returned value is an array of URLs corresponding to the files chosen by the user. The value is `nil` if the user cancels the Open panel or makes no selection.\n\n## Managing the Open Dialog\n\n- **beginOpenPanel(completionHandler:)**: Presents an Open dialog and delivers the results to a completion handler as an array of URLs for the chosen files, or nil.\n- **beginOpenPanel(_:forTypes:completionHandler:)**: Presents a nonmodal Open dialog that displays files you can open from a list of UTIs.\n- **runModalOpenPanel(_:forTypes:)**: Presents a modal Open dialog and limits selection to specific file types.\n- **currentDirectory**: The directory path to use as the starting point in the Open dialog.\n\n",
  "sections" : [
    {
      "content" : "",
      "items" : [
        {
          "description" : "Presents an Open dialog and delivers the results to a completion handler as an array of URLs for the chosen files, or nil.",
          "name" : "beginOpenPanel(completionHandler:)",
          "url" : "https:\/\/developer.apple.com\/documentation\/AppKit\/NSDocumentController\/beginOpenPanel(completionHandler:)"
        },
        {
          "description" : "Presents a nonmodal Open dialog that displays files you can open from a list of UTIs.",
          "name" : "beginOpenPanel(_:forTypes:completionHandler:)",
          "url" : "https:\/\/developer.apple.com\/documentation\/AppKit\/NSDocumentController\/beginOpenPanel(_:forTypes:completionHandler:)"
        },
        {
          "description" : "Presents a modal Open dialog and limits selection to specific file types.",
          "name" : "runModalOpenPanel(_:forTypes:)",
          "url" : "https:\/\/developer.apple.com\/documentation\/AppKit\/NSDocumentController\/runModalOpenPanel(_:forTypes:)"
        },
        {
          "description" : "The directory path to use as the starting point in the Open dialog.",
          "name" : "currentDirectory",
          "url" : "https:\/\/developer.apple.com\/documentation\/AppKit\/NSDocumentController\/currentDirectory"
        }
      ],
      "title" : "Managing the Open Dialog"
    }
  ],
  "source" : "appleJSON",
  "title" : "urlsFromRunningOpenPanel()",
  "url" : "https:\/\/developer.apple.com\/documentation\/AppKit\/NSDocumentController\/urlsFromRunningOpenPanel()"
}