{
  "abstract" : "Returns the index of the first menu item in the menu that has a specified action and target.",
  "codeExamples" : [

  ],
  "contentHash" : "4b0471fa919d41b3ce67ef79f39fae84296d457828bdab4710eee526d2023aee",
  "crawledAt" : "2025-12-03T23:59:25Z",
  "declaration" : {
    "code" : "func indexOfItem(withTarget target: Any?, andAction actionSelector: Selector?) -> Int",
    "language" : "swift"
  },
  "id" : "AAD02AEF-92C5-4F37-9337-0C345133A211",
  "kind" : "method",
  "language" : "swift",
  "module" : "AppKit",
  "overview" : "## Return Value\n\nThe integer index of the menu item or, if no such menu item is in the menu, –1.",
  "platforms" : [
    "macOS"
  ],
  "rawMarkdown" : "---\nsource: https:\/\/developer.apple.com\/documentation\/AppKit\/NSMenu\/indexOfItem(withTarget:andAction:)\ncrawled: 2025-12-03T23:59:25Z\n---\n\n# indexOfItem(withTarget:andAction:)\n\n**Instance Method**\n\nReturns the index of the first menu item in the menu that has a specified action and target.\n\n## Declaration\n\n```swift\nfunc indexOfItem(withTarget target: Any?, andAction actionSelector: Selector?) -> Int\n```\n\n## Parameters\n\n- **target**: An object that is set as the target of a menu item of the menu.\n- **actionSelector**: A selector identifying an action method. If `actionSelector` is `NULL`, the first menu item in the menu that has target `anObject` is returned.\n\n## Return Value\n\nThe integer index of the menu item or, if no such menu item is in the menu, –1.\n\n## Related Documentation\n\n- **item(at:)**: Returns the menu item at a specific location of the menu.\n- **insertItem(_:at:)**: Inserts a menu item into the menu at a specific location.\n\n## Finding Indices of Menu Items\n\n- **index(of:)**: Returns the index identifying the location of a specified menu item in the menu.\n- **indexOfItem(withTitle:)**: Returns the index of the first menu item in the menu that has a specified title.\n- **indexOfItem(withTag:)**: Returns the index of the first menu item in the menu identified by a tag.\n- **indexOfItem(withRepresentedObject:)**: Returns the index of the first menu item in the menu that has a given represented object.\n- **indexOfItem(withSubmenu:)**: Returns the index of the menu item in the menu with the given submenu.\n\n",
  "sections" : [
    {
      "content" : "",
      "items" : [
        {
          "description" : "Returns the menu item at a specific location of the menu.",
          "name" : "item(at:)",
          "url" : "https:\/\/developer.apple.com\/documentation\/AppKit\/NSMenu\/item(at:)"
        },
        {
          "description" : "Inserts a menu item into the menu at a specific location.",
          "name" : "insertItem(_:at:)",
          "url" : "https:\/\/developer.apple.com\/documentation\/AppKit\/NSMenu\/insertItem(_:at:)"
        }
      ],
      "title" : "Related Documentation"
    },
    {
      "content" : "",
      "items" : [
        {
          "description" : "Returns the index identifying the location of a specified menu item in the menu.",
          "name" : "index(of:)",
          "url" : "https:\/\/developer.apple.com\/documentation\/AppKit\/NSMenu\/index(of:)"
        },
        {
          "description" : "Returns the index of the first menu item in the menu that has a specified title.",
          "name" : "indexOfItem(withTitle:)",
          "url" : "https:\/\/developer.apple.com\/documentation\/AppKit\/NSMenu\/indexOfItem(withTitle:)"
        },
        {
          "description" : "Returns the index of the first menu item in the menu identified by a tag.",
          "name" : "indexOfItem(withTag:)",
          "url" : "https:\/\/developer.apple.com\/documentation\/AppKit\/NSMenu\/indexOfItem(withTag:)"
        },
        {
          "description" : "Returns the index of the first menu item in the menu that has a given represented object.",
          "name" : "indexOfItem(withRepresentedObject:)",
          "url" : "https:\/\/developer.apple.com\/documentation\/AppKit\/NSMenu\/indexOfItem(withRepresentedObject:)"
        },
        {
          "description" : "Returns the index of the menu item in the menu with the given submenu.",
          "name" : "indexOfItem(withSubmenu:)",
          "url" : "https:\/\/developer.apple.com\/documentation\/AppKit\/NSMenu\/indexOfItem(withSubmenu:)"
        }
      ],
      "title" : "Finding Indices of Menu Items"
    }
  ],
  "source" : "appleJSON",
  "title" : "indexOfItem(withTarget:andAction:)",
  "url" : "https:\/\/developer.apple.com\/documentation\/AppKit\/NSMenu\/indexOfItem(withTarget:andAction:)"
}