{
  "abstract" : "The style used to display the tabs.",
  "codeExamples" : [

  ],
  "contentHash" : "71b05b79c092b784e4d73bd80adb4ec832cf6c636899a1d9b99b5a9cc2eddb89",
  "crawledAt" : "2025-12-03T09:04:35Z",
  "declaration" : {
    "code" : "@MainActor var tabStyle: NSTabViewController.TabStyle { get set }",
    "language" : "swift"
  },
  "id" : "4C76C060-1B0D-4EB3-A6E4-14036AEF0B82",
  "kind" : "property",
  "language" : "swift",
  "module" : "AppKit",
  "overview" : "## Discussion\n\nThe default value of this property is [doc:\/\/com.apple.appkit\/documentation\/AppKit\/NSTabViewController\/TabStyle-swift.enum\/segmentedControlOnTop]. Changing the style at runtime updates the appearance of the tab view controller interface.",
  "platforms" : [
    "macOS"
  ],
  "rawMarkdown" : "---\nsource: https:\/\/developer.apple.com\/documentation\/AppKit\/NSTabViewController\/tabStyle-swift.property\ncrawled: 2025-12-03T09:04:35Z\n---\n\n# tabStyle\n\n**Instance Property**\n\nThe style used to display the tabs.\n\n## Declaration\n\n```swift\n@MainActor var tabStyle: NSTabViewController.TabStyle { get set }\n```\n\n## Discussion\n\nThe default value of this property is [doc:\/\/com.apple.appkit\/documentation\/AppKit\/NSTabViewController\/TabStyle-swift.enum\/segmentedControlOnTop]. Changing the style at runtime updates the appearance of the tab view controller interface.\n\n## Configuring the Tab View\n\n- **tabView**: The tab view that manages the views of the interface.\n- **transitionOptions**: The animation options to use when switching between tabs.\n- **canPropagateSelectedChildViewControllerTitle**: A Boolean value indicating whether the tab view controller gets its title from the selected child view controller.\n\n",
  "sections" : [
    {
      "content" : "",
      "items" : [
        {
          "description" : "The tab view that manages the views of the interface.",
          "name" : "tabView",
          "url" : "https:\/\/developer.apple.com\/documentation\/AppKit\/NSTabViewController\/tabView"
        },
        {
          "description" : "The animation options to use when switching between tabs.",
          "name" : "transitionOptions",
          "url" : "https:\/\/developer.apple.com\/documentation\/AppKit\/NSTabViewController\/transitionOptions"
        },
        {
          "description" : "A Boolean value indicating whether the tab view controller gets its title from the selected child view controller.",
          "name" : "canPropagateSelectedChildViewControllerTitle",
          "url" : "https:\/\/developer.apple.com\/documentation\/AppKit\/NSTabViewController\/canPropagateSelectedChildViewControllerTitle"
        }
      ],
      "title" : "Configuring the Tab View"
    }
  ],
  "source" : "appleJSON",
  "title" : "tabStyle",
  "url" : "https:\/\/developer.apple.com\/documentation\/AppKit\/NSTabViewController\/tabStyle-swift.property"
}