{
  "abstract" : "Gives the delegate the opportunity to modify the specified cell at the given row and column location before the browser displays it.",
  "codeExamples" : [

  ],
  "contentHash" : "35eb5ae8d918230d6bc733d73fdd2836ebc026fb7275c85861fdf0dfde1f1845",
  "crawledAt" : "2025-12-05T20:15:58Z",
  "declaration" : {
    "code" : "@MainActor optional func browser(_ sender: NSBrowser, willDisplayCell cell: Any, atRow row: Int, column: Int)",
    "language" : "swift"
  },
  "id" : "D4ACE35B-2BB7-414D-AD2A-4A7651AF8156",
  "kind" : "method",
  "language" : "swift",
  "module" : "AppKit",
  "overview" : "## Discussion\n\nThe delegate should set any state necessary for the correct display of the cell.",
  "platforms" : [
    "macOS"
  ],
  "rawMarkdown" : "---\nsource: https:\/\/developer.apple.com\/documentation\/AppKit\/NSBrowserDelegate\/browser(_:willDisplayCell:atRow:column:)\ncrawled: 2025-12-05T20:15:58Z\n---\n\n# browser(_:willDisplayCell:atRow:column:)\n\n**Instance Method**\n\nGives the delegate the opportunity to modify the specified cell at the given row and column location before the browser displays it.\n\n## Declaration\n\n```swift\n@MainActor optional func browser(_ sender: NSBrowser, willDisplayCell cell: Any, atRow row: Int, column: Int)\n```\n\n## Parameters\n\n- **sender**: The browser.\n- **cell**: The cell to be displayed.\n- **row**: The row index of the cell to be displayed.\n- **column**: The column index of the cell to be displayed.\n\n## Discussion\n\nThe delegate should set any state necessary for the correct display of the cell.\n\n## Related Documentation\n\n- **browser(_:numberOfRowsInColumn:)**: Returns the number of rows of data in the specified column.\n\n## Managing Columns\n\n- **browser(_:createRowsForColumn:in:)**: Creates a row in the given matrix for each row of data in the specified column of the browser.\n- **browser(_:didChangeLastColumn:toColumn:)**: Tells the delegate that the browser’s last column changed.\n\n",
  "sections" : [
    {
      "content" : "",
      "items" : [
        {
          "description" : "Returns the number of rows of data in the specified column.",
          "name" : "browser(_:numberOfRowsInColumn:)",
          "url" : "https:\/\/developer.apple.com\/documentation\/AppKit\/NSBrowserDelegate\/browser(_:numberOfRowsInColumn:)"
        }
      ],
      "title" : "Related Documentation"
    },
    {
      "content" : "",
      "items" : [
        {
          "description" : "Creates a row in the given matrix for each row of data in the specified column of the browser.",
          "name" : "browser(_:createRowsForColumn:in:)",
          "url" : "https:\/\/developer.apple.com\/documentation\/AppKit\/NSBrowserDelegate\/browser(_:createRowsForColumn:in:)"
        },
        {
          "description" : "Tells the delegate that the browser’s last column changed.",
          "name" : "browser(_:didChangeLastColumn:toColumn:)",
          "url" : "https:\/\/developer.apple.com\/documentation\/AppKit\/NSBrowserDelegate\/browser(_:didChangeLastColumn:toColumn:)"
        }
      ],
      "title" : "Managing Columns"
    }
  ],
  "source" : "appleJSON",
  "title" : "browser(_:willDisplayCell:atRow:column:)",
  "url" : "https:\/\/developer.apple.com\/documentation\/AppKit\/NSBrowserDelegate\/browser(_:willDisplayCell:atRow:column:)"
}