{
  "abstract" : "Called after the view controller’s view has been loaded into memory.",
  "codeExamples" : [

  ],
  "contentHash" : "4973ca380fa405d0fb27d6fdd81dbd6123630874a93a3ce6247f8fe11840bb35",
  "crawledAt" : "2025-12-03T09:04:43Z",
  "declaration" : {
    "code" : "@MainActor func viewDidLoad()",
    "language" : "swift"
  },
  "id" : "32BEA42D-5E38-49A8-A6A5-3E2596A6689B",
  "kind" : "method",
  "language" : "swift",
  "module" : "AppKit",
  "overview" : "## Discussion\n\nThe tab view controller overrides this method and uses it to configure and layout the tab view and its contents. You can override it in your own subclasses to perform any custom initialization. For example, to replace the default tab view, override this method and set the value of the [doc:\/\/com.apple.appkit\/documentation\/AppKit\/NSTabViewController\/tabView] property before calling `super`.\n\nIf you override this method, you must call `super` in your implementation.",
  "platforms" : [
    "macOS"
  ],
  "rawMarkdown" : "---\nsource: https:\/\/developer.apple.com\/documentation\/AppKit\/NSTabViewController\/viewDidLoad()\ncrawled: 2025-12-03T09:04:43Z\n---\n\n# viewDidLoad()\n\n**Instance Method**\n\nCalled after the view controller’s view has been loaded into memory.\n\n## Declaration\n\n```swift\n@MainActor func viewDidLoad()\n```\n\n## Discussion\n\nThe tab view controller overrides this method and uses it to configure and layout the tab view and its contents. You can override it in your own subclasses to perform any custom initialization. For example, to replace the default tab view, override this method and set the value of the [doc:\/\/com.apple.appkit\/documentation\/AppKit\/NSTabViewController\/tabView] property before calling `super`.\n\nIf you override this method, you must call `super` in your implementation.\n\n## Responding to Tab View Events\n\n- **tabView(_:shouldSelect:)**: Asks the tab view controller if the specified tab should be selected.\n- **tabView(_:willSelect:)**: Informs the tab view controller that the specified tab is about to be selected.\n- **tabView(_:didSelect:)**: Informs the tab view controller that the specified tab was selected.\n\n",
  "sections" : [
    {
      "content" : "",
      "items" : [
        {
          "description" : "Asks the tab view controller if the specified tab should be selected.",
          "name" : "tabView(_:shouldSelect:)",
          "url" : "https:\/\/developer.apple.com\/documentation\/AppKit\/NSTabViewController\/tabView(_:shouldSelect:)"
        },
        {
          "description" : "Informs the tab view controller that the specified tab is about to be selected.",
          "name" : "tabView(_:willSelect:)",
          "url" : "https:\/\/developer.apple.com\/documentation\/AppKit\/NSTabViewController\/tabView(_:willSelect:)"
        },
        {
          "description" : "Informs the tab view controller that the specified tab was selected.",
          "name" : "tabView(_:didSelect:)",
          "url" : "https:\/\/developer.apple.com\/documentation\/AppKit\/NSTabViewController\/tabView(_:didSelect:)"
        }
      ],
      "title" : "Responding to Tab View Events"
    }
  ],
  "source" : "appleJSON",
  "title" : "viewDidLoad()",
  "url" : "https:\/\/developer.apple.com\/documentation\/AppKit\/NSTabViewController\/viewDidLoad()"
}