{
  "abstract" : "The preferred width for items in the group.",
  "codeExamples" : [

  ],
  "contentHash" : "1a6eec6e78215bbc05791f9b1223f43522f99726d90156c911a25c2b2dac00d0",
  "crawledAt" : "2025-12-03T17:56:13Z",
  "declaration" : {
    "code" : "@MainActor var preferredItemWidth: CGFloat { get set }",
    "language" : "swift"
  },
  "id" : "9090BA92-1C0A-401A-B0E3-A7D442F28EE4",
  "kind" : "property",
  "language" : "swift",
  "module" : "AppKit",
  "overview" : "## Discussion\n\nThis width applies when [doc:\/\/com.apple.appkit\/documentation\/AppKit\/NSGroupTouchBarItem\/prefersEqualWidths] is [doc:\/\/com.apple.documentation\/documentation\/Swift\/true].\n\nThis is the width that items are set to if there is enough room, and if the items don’t clip.\n\nThis value is ignored if it is negative. The default value is `-1`.",
  "platforms" : [
    "Mac Catalyst",
    "macOS"
  ],
  "rawMarkdown" : "---\nsource: https:\/\/developer.apple.com\/documentation\/AppKit\/NSGroupTouchBarItem\/preferredItemWidth\ncrawled: 2025-12-03T17:56:13Z\n---\n\n# preferredItemWidth\n\n**Instance Property**\n\nThe preferred width for items in the group.\n\n## Declaration\n\n```swift\n@MainActor var preferredItemWidth: CGFloat { get set }\n```\n\n## Discussion\n\nThis width applies when [doc:\/\/com.apple.appkit\/documentation\/AppKit\/NSGroupTouchBarItem\/prefersEqualWidths] is [doc:\/\/com.apple.documentation\/documentation\/Swift\/true].\n\nThis is the width that items are set to if there is enough room, and if the items don’t clip.\n\nThis value is ignored if it is negative. The default value is `-1`.\n\n## Configuring item width\n\n- **prefersEqualWidths**: A Boolean value that specifies that items should have equal widths when possible.\n\n",
  "sections" : [
    {
      "content" : "",
      "items" : [
        {
          "description" : "A Boolean value that specifies that items should have equal widths when possible.",
          "name" : "prefersEqualWidths",
          "url" : "https:\/\/developer.apple.com\/documentation\/AppKit\/NSGroupTouchBarItem\/prefersEqualWidths"
        }
      ],
      "title" : "Configuring item width"
    }
  ],
  "source" : "appleJSON",
  "title" : "preferredItemWidth",
  "url" : "https:\/\/developer.apple.com\/documentation\/AppKit\/NSGroupTouchBarItem\/preferredItemWidth"
}