{
  "abstract" : "Determines whether the first pasteboard item matches the specified patterns, reading the contents if it finds a match.",
  "codeExamples" : [
    {
      "code" : "do {\n    let valueResults = try await NSPasteboard.general.detectedValues(for: [\\.links])\n    let links = valueResults.links\n    guard !links.isEmpty else {\n        print (\"No links found in item.\")\n        return\n    }\n    for link in links {\n        print(\"Link retrieved: \\(link.url).\")\n    }\n} catch {\n    print(\"Error: \\(error).\")\n}",
      "language" : "swift"
    }
  ],
  "contentHash" : "c591c1c79df451ea8a087a4f1eb4779093f76f2407c15e0214cb9d69ebe19a6b",
  "crawledAt" : "2025-12-04T12:19:34Z",
  "declaration" : {
    "code" : "func detectedValues(for keyPaths: Set<PartialKeyPath<NSPasteboard.DetectedValues>>) async throws -> NSPasteboard.DetectedValues",
    "language" : "swift"
  },
  "id" : "F824C7C6-564E-452F-837D-914DB2A5BFD9",
  "kind" : "method",
  "language" : "swift",
  "module" : "AppKit",
  "overview" : "## Return Value\n\nAn [doc:\/\/com.apple.appkit\/documentation\/AppKit\/NSPasteboard\/DetectedValues] instance containing the values for the patterns found on the pasteboard.\n\n## Discussion\n\nFor details about the types returned for each pattern, see [doc:\/\/com.apple.appkit\/documentation\/AppKit\/NSPasteboard\/DetectedValues].\n\nThe following example shows how to use this method to find links in the first pasteboard item:",
  "platforms" : [
    "macOS"
  ],
  "rawMarkdown" : "---\nsource: https:\/\/developer.apple.com\/documentation\/AppKit\/NSPasteboard\/detectedValues(for:)\ncrawled: 2025-12-04T12:19:34Z\n---\n\n# detectedValues(for:)\n\n**Instance Method**\n\nDetermines whether the first pasteboard item matches the specified patterns, reading the contents if it finds a match.\n\n## Declaration\n\n```swift\nfunc detectedValues(for keyPaths: Set<PartialKeyPath<NSPasteboard.DetectedValues>>) async throws -> NSPasteboard.DetectedValues\n```\n\n## Parameters\n\n- **keyPaths**: The patterns to detect on the pasteboard.\n\n## Return Value\n\nAn [doc:\/\/com.apple.appkit\/documentation\/AppKit\/NSPasteboard\/DetectedValues] instance containing the values for the patterns found on the pasteboard.\n\n## Discussion\n\nFor details about the types returned for each pattern, see [doc:\/\/com.apple.appkit\/documentation\/AppKit\/NSPasteboard\/DetectedValues].\n\nThe following example shows how to use this method to find links in the first pasteboard item:\n\n```swift\ndo {\n    let valueResults = try await NSPasteboard.general.detectedValues(for: [\\.links])\n    let links = valueResults.links\n    guard !links.isEmpty else {\n        print (\"No links found in item.\")\n        return\n    }\n    for link in links {\n        print(\"Link retrieved: \\(link.url).\")\n    }\n} catch {\n    print(\"Error: \\(error).\")\n}\n```\n\n\n\n## Detecting patterns and metadata in pasteboard items\n\n- **detectedPatterns(for:)**: Determines whether the first pasteboard item matches the specified patterns, without notifying the person using the app.\n- **NSPasteboard.DetectedValues**: A type that contains common types of data that the data detection system matches for a pasteboard.\n- **Pasteboard detection patterns**: Common types of data that the data detection system matches for a pasteboard.\n- **detectedMetadata(for:)**: Determines available metadata from the specified metadata types for the first pasteboard item, without notifying the person using the app.\n- **NSPasteboard.DetectedMetadata**: An object that contains common types of metadata that the data detection system matches for a pasteboard.\n- **Pasteboard detection metadata types**: Common types of metadata that the data detection system matches for a pasteboard.\n\n",
  "sections" : [
    {
      "content" : "",
      "items" : [
        {
          "description" : "Determines whether the first pasteboard item matches the specified patterns, without notifying the person using the app.",
          "name" : "detectedPatterns(for:)",
          "url" : "https:\/\/developer.apple.com\/documentation\/AppKit\/NSPasteboard\/detectedPatterns(for:)"
        },
        {
          "description" : "A type that contains common types of data that the data detection system matches for a pasteboard.",
          "name" : "NSPasteboard.DetectedValues",
          "url" : "https:\/\/developer.apple.com\/documentation\/AppKit\/NSPasteboard\/DetectedValues"
        },
        {
          "description" : "Common types of data that the data detection system matches for a pasteboard.",
          "name" : "Pasteboard detection patterns",
          "url" : "https:\/\/developer.apple.com\/documentation\/AppKit\/nspasteboard-detection-patterns"
        },
        {
          "description" : "Determines available metadata from the specified metadata types for the first pasteboard item, without notifying the person using the app.",
          "name" : "detectedMetadata(for:)",
          "url" : "https:\/\/developer.apple.com\/documentation\/AppKit\/NSPasteboard\/detectedMetadata(for:)"
        },
        {
          "description" : "An object that contains common types of metadata that the data detection system matches for a pasteboard.",
          "name" : "NSPasteboard.DetectedMetadata",
          "url" : "https:\/\/developer.apple.com\/documentation\/AppKit\/NSPasteboard\/DetectedMetadata"
        },
        {
          "description" : "Common types of metadata that the data detection system matches for a pasteboard.",
          "name" : "Pasteboard detection metadata types",
          "url" : "https:\/\/developer.apple.com\/documentation\/AppKit\/nspasteboard-detection-metadata-types"
        }
      ],
      "title" : "Detecting patterns and metadata in pasteboard items"
    }
  ],
  "source" : "appleJSON",
  "title" : "detectedValues(for:)",
  "url" : "https:\/\/developer.apple.com\/documentation\/AppKit\/NSPasteboard\/detectedValues(for:)"
}