{
  "abstract" : "Detaches a gesture recognizer from the view.",
  "codeExamples" : [

  ],
  "contentHash" : "ad306eb3d7cc125887580b2631fb2f5ae5272133c8c0a4b8de5d3ad75b07d62a",
  "crawledAt" : "2025-12-04T20:07:28Z",
  "declaration" : {
    "code" : "@MainActor func removeGestureRecognizer(_ gestureRecognizer: NSGestureRecognizer)",
    "language" : "swift"
  },
  "id" : "E0EB6C44-90EF-499F-9F09-BED124F7A84D",
  "kind" : "method",
  "language" : "swift",
  "module" : "AppKit",
  "overview" : "## Discussion\n\nRemoving a gesture recognizer also removes the strong reference to it held by the view.",
  "platforms" : [
    "macOS"
  ],
  "rawMarkdown" : "---\nsource: https:\/\/developer.apple.com\/documentation\/AppKit\/NSView\/removeGestureRecognizer(_:)\ncrawled: 2025-12-04T20:07:28Z\n---\n\n# removeGestureRecognizer(_:)\n\n**Instance Method**\n\nDetaches a gesture recognizer from the view.\n\n## Declaration\n\n```swift\n@MainActor func removeGestureRecognizer(_ gestureRecognizer: NSGestureRecognizer)\n```\n\n## Parameters\n\n- **gestureRecognizer**: The gesture recognizer to remove. This parameter must not be `nil`.\n\n## Discussion\n\nRemoving a gesture recognizer also removes the strong reference to it held by the view.\n\n## Managing Gesture Recognizers\n\n- **gestureRecognizers**: The gesture recognize objects currently attached to the view.\n- **addGestureRecognizer(_:)**: Attaches a gesture recognizer to the view.\n\n",
  "sections" : [
    {
      "content" : "",
      "items" : [
        {
          "description" : "The gesture recognize objects currently attached to the view.",
          "name" : "gestureRecognizers",
          "url" : "https:\/\/developer.apple.com\/documentation\/AppKit\/NSView\/gestureRecognizers"
        },
        {
          "description" : "Attaches a gesture recognizer to the view.",
          "name" : "addGestureRecognizer(_:)",
          "url" : "https:\/\/developer.apple.com\/documentation\/AppKit\/NSView\/addGestureRecognizer(_:)"
        }
      ],
      "title" : "Managing Gesture Recognizers"
    }
  ],
  "source" : "appleJSON",
  "title" : "removeGestureRecognizer(_:)",
  "url" : "https:\/\/developer.apple.com\/documentation\/AppKit\/NSView\/removeGestureRecognizer(_:)"
}