{
  "abstract" : "The system will close the popover when the user interacts with a user interface element outside the popover.",
  "codeExamples" : [

  ],
  "contentHash" : "e06572af010c622fa2634d32752e66974082bdf42d34169438affd3f76a6e372",
  "crawledAt" : "2025-12-04T18:17:53Z",
  "declaration" : {
    "code" : "case transient",
    "language" : "swift"
  },
  "id" : "543B4996-5662-44BA-9966-5F0636EFD03D",
  "kind" : "unknown",
  "language" : "swift",
  "module" : "AppKit",
  "overview" : "## Discussion\n\nNote that interacting with menus or panels that become key only when needed will not cause a transient popover to close. The exact interactions that will cause transient popovers to close are not specified.",
  "platforms" : [
    "macOS"
  ],
  "rawMarkdown" : "---\nsource: https:\/\/developer.apple.com\/documentation\/AppKit\/NSPopover\/Behavior-swift.enum\/transient\ncrawled: 2025-12-04T18:17:53Z\n---\n\n# NSPopover.Behavior.transient\n\n**Case**\n\nThe system will close the popover when the user interacts with a user interface element outside the popover.\n\n## Declaration\n\n```swift\ncase transient\n```\n\n## Discussion\n\nNote that interacting with menus or panels that become key only when needed will not cause a transient popover to close. The exact interactions that will cause transient popovers to close are not specified.\n\n## Constants\n\n- **NSPopover.Behavior.applicationDefined**: Your application assumes responsibility for closing the popover.\n- **NSPopover.Behavior.semitransient**: The system will close the popover when the user interacts with user interface elements in the window containing the popover’s positioning view.\n\n",
  "sections" : [
    {
      "content" : "",
      "items" : [
        {
          "description" : "Your application assumes responsibility for closing the popover.",
          "name" : "NSPopover.Behavior.applicationDefined",
          "url" : "https:\/\/developer.apple.com\/documentation\/AppKit\/NSPopover\/Behavior-swift.enum\/applicationDefined"
        },
        {
          "description" : "The system will close the popover when the user interacts with user interface elements in the window containing the popover’s positioning view.",
          "name" : "NSPopover.Behavior.semitransient",
          "url" : "https:\/\/developer.apple.com\/documentation\/AppKit\/NSPopover\/Behavior-swift.enum\/semitransient"
        }
      ],
      "title" : "Constants"
    }
  ],
  "source" : "appleJSON",
  "title" : "NSPopover.Behavior.transient",
  "url" : "https:\/\/developer.apple.com\/documentation\/AppKit\/NSPopover\/Behavior-swift.enum\/transient"
}