{
  "abstract" : "Returns the components of the color as an array.",
  "codeExamples" : [

  ],
  "contentHash" : "f076b3a7e44187e66b5ca87be6706c4f15004abe7d4369c76fd372850736410c",
  "crawledAt" : "2025-12-01T13:23:28Z",
  "declaration" : {
    "code" : "func getComponents(_ components: UnsafeMutablePointer<CGFloat>)",
    "language" : "swift"
  },
  "id" : "82377338-A475-430B-AF24-2383DAE3CCDA",
  "kind" : "method",
  "module" : "AppKit",
  "overview" : "## Discussion\n\nYou can invoke this method on `NSColor` objects created from custom color spaces to get the individual floating-point components, including alpha. Raises an exception if the receiver doesn’t have floating-point components. To find out how many components are in the `components` array, use the [doc:\/\/com.apple.appkit\/documentation\/AppKit\/NSColor\/numberOfComponents] property.",
  "platforms" : [
    "macOS"
  ],
  "rawMarkdown" : "---\nsource: https:\/\/developer.apple.com\/documentation\/AppKit\/NSColor\/getComponents(_:)\ncrawled: 2025-12-01T13:23:28Z\n---\n\n# getComponents(_:)\n\n**Instance Method**\n\nReturns the components of the color as an array.\n\n## Declaration\n\n```swift\nfunc getComponents(_ components: UnsafeMutablePointer<CGFloat>)\n```\n\n## Parameters\n\n- **components**: An array containing the components of the color object as `float` values.\n\n## Discussion\n\nYou can invoke this method on `NSColor` objects created from custom color spaces to get the individual floating-point components, including alpha. Raises an exception if the receiver doesn’t have floating-point components. To find out how many components are in the `components` array, use the [doc:\/\/com.apple.appkit\/documentation\/AppKit\/NSColor\/numberOfComponents] property.\n\n## Related Documentation\n\n- **colorSpace**: The color space associated with the color.\n\n## Retrieving component values from color objects\n\n- **getCyan(_:magenta:yellow:black:alpha:)**: Returns the color object’s CMYK and opacity values.\n- **getHue(_:saturation:brightness:alpha:)**: Returns the color object’s HSB component and opacity values in the respective arguments.\n- **getRed(_:green:blue:alpha:)**: Returns the color object’s RGB component and opacity values in the respective arguments.\n- **getWhite(_:alpha:)**: Returns the grayscale and alpha values of the color.\n- **numberOfComponents**: The number of components in the color.\n\n",
  "sections" : [
    {
      "content" : "",
      "items" : [
        {
          "description" : "The color space associated with the color.",
          "name" : "colorSpace",
          "url" : "https:\/\/developer.apple.com\/documentation\/AppKit\/NSColor\/colorSpace"
        }
      ],
      "title" : "Related Documentation"
    },
    {
      "content" : "",
      "items" : [
        {
          "description" : "Returns the color object’s CMYK and opacity values.",
          "name" : "getCyan(_:magenta:yellow:black:alpha:)",
          "url" : "https:\/\/developer.apple.com\/documentation\/AppKit\/NSColor\/getCyan(_:magenta:yellow:black:alpha:)"
        },
        {
          "description" : "Returns the color object’s HSB component and opacity values in the respective arguments.",
          "name" : "getHue(_:saturation:brightness:alpha:)",
          "url" : "https:\/\/developer.apple.com\/documentation\/AppKit\/NSColor\/getHue(_:saturation:brightness:alpha:)"
        },
        {
          "description" : "Returns the color object’s RGB component and opacity values in the respective arguments.",
          "name" : "getRed(_:green:blue:alpha:)",
          "url" : "https:\/\/developer.apple.com\/documentation\/AppKit\/NSColor\/getRed(_:green:blue:alpha:)"
        },
        {
          "description" : "Returns the grayscale and alpha values of the color.",
          "name" : "getWhite(_:alpha:)",
          "url" : "https:\/\/developer.apple.com\/documentation\/AppKit\/NSColor\/getWhite(_:alpha:)"
        },
        {
          "description" : "The number of components in the color.",
          "name" : "numberOfComponents",
          "url" : "https:\/\/developer.apple.com\/documentation\/AppKit\/NSColor\/numberOfComponents"
        }
      ],
      "title" : "Retrieving component values from color objects"
    }
  ],
  "source" : "appleJSON",
  "title" : "getComponents(_:)",
  "url" : "https:\/\/developer.apple.com\/documentation\/AppKit\/NSColor\/getComponents(_:)"
}