{
  "abstract" : "A Boolean value that indicates whether the view’s vertical size constraints are active.",
  "codeExamples" : [

  ],
  "contentHash" : "62470ea676a5b8a4782f0045fc4c680f9ae59312b51e84724d26fa324c1663ed",
  "crawledAt" : "2025-12-04T18:36:09Z",
  "declaration" : {
    "code" : "@MainActor var isVerticalContentSizeConstraintActive: Bool { get set }",
    "language" : "swift"
  },
  "id" : "CE0CD95B-1ABE-4C39-8F8C-28540A3E9D2C",
  "kind" : "property",
  "language" : "swift",
  "module" : "AppKit",
  "overview" : "## Discussion\n\nSetting this property to [doc:\/\/com.apple.documentation\/documentation\/Swift\/false] lets Auto Layout optimize layout operations by ignoring the view’s intrinsic content size. The default value of this property is [doc:\/\/com.apple.documentation\/documentation\/Swift\/true], which causes the system to take the view’s content size into account.",
  "platforms" : [
    "macOS"
  ],
  "rawMarkdown" : "---\nsource: https:\/\/developer.apple.com\/documentation\/AppKit\/NSView\/isVerticalContentSizeConstraintActive\ncrawled: 2025-12-04T18:36:09Z\n---\n\n# isVerticalContentSizeConstraintActive\n\n**Instance Property**\n\nA Boolean value that indicates whether the view’s vertical size constraints are active.\n\n## Declaration\n\n```swift\n@MainActor var isVerticalContentSizeConstraintActive: Bool { get set }\n```\n\n## Discussion\n\nSetting this property to [doc:\/\/com.apple.documentation\/documentation\/Swift\/false] lets Auto Layout optimize layout operations by ignoring the view’s intrinsic content size. The default value of this property is [doc:\/\/com.apple.documentation\/documentation\/Swift\/true], which causes the system to take the view’s content size into account.\n\n## Enabling and Disabling Constraints\n\n- **isHorizontalContentSizeConstraintActive**: A Boolean value that indicates whether the view’s horizontal size constraints are active.\n\n",
  "sections" : [
    {
      "content" : "",
      "items" : [
        {
          "description" : "A Boolean value that indicates whether the view’s horizontal size constraints are active.",
          "name" : "isHorizontalContentSizeConstraintActive",
          "url" : "https:\/\/developer.apple.com\/documentation\/AppKit\/NSView\/isHorizontalContentSizeConstraintActive"
        }
      ],
      "title" : "Enabling and Disabling Constraints"
    }
  ],
  "source" : "appleJSON",
  "title" : "isVerticalContentSizeConstraintActive",
  "url" : "https:\/\/developer.apple.com\/documentation\/AppKit\/NSView\/isVerticalContentSizeConstraintActive"
}