{
  "abstract" : "Translates the view’s coordinate system so that its origin moves to a new location.",
  "codeExamples" : [

  ],
  "contentHash" : "89e023dd863d0f512b71428d15a585afc92f1a653d176b2b263ded711c012df8",
  "crawledAt" : "2025-12-04T18:34:12Z",
  "declaration" : {
    "code" : "@MainActor func translateOrigin(to translation: NSPoint)",
    "language" : "swift"
  },
  "id" : "251BD901-CF5A-4133-A5AB-4733D0B6C990",
  "kind" : "method",
  "language" : "swift",
  "module" : "AppKit",
  "overview" : "## Discussion\n\nIn the process, the origin of the view’s bounds rectangle is shifted by (`–translation.x`, `–translation.y`). This method neither redisplays the view nor marks it as needing display. You must do this yourself by calling the  [doc:\/\/com.apple.appkit\/documentation\/AppKit\/NSView\/display()] method or setting the [doc:\/\/com.apple.appkit\/documentation\/AppKit\/NSView\/needsDisplay] property.\n\nNote the difference between this method and setting the bounds origin. Translation effectively moves the image inside the bounds rectangle, while setting the bounds origin effectively moves the rectangle over the image. The two are in a sense inverse, although translation is cumulative, and setting the bounds origin is absolute.\n\nThis method posts an [doc:\/\/com.apple.appkit\/documentation\/AppKit\/NSView\/boundsDidChangeNotification] to the default notification center if the view is configured to do so.",
  "platforms" : [
    "macOS"
  ],
  "rawMarkdown" : "---\nsource: https:\/\/developer.apple.com\/documentation\/AppKit\/NSView\/translateOrigin(to:)\ncrawled: 2025-12-04T18:34:12Z\n---\n\n# translateOrigin(to:)\n\n**Instance Method**\n\nTranslates the view’s coordinate system so that its origin moves to a new location.\n\n## Declaration\n\n```swift\n@MainActor func translateOrigin(to translation: NSPoint)\n```\n\n## Parameters\n\n- **translation**: A point that specifies the new origin.\n\n## Discussion\n\nIn the process, the origin of the view’s bounds rectangle is shifted by (`–translation.x`, `–translation.y`). This method neither redisplays the view nor marks it as needing display. You must do this yourself by calling the  [doc:\/\/com.apple.appkit\/documentation\/AppKit\/NSView\/display()] method or setting the [doc:\/\/com.apple.appkit\/documentation\/AppKit\/NSView\/needsDisplay] property.\n\nNote the difference between this method and setting the bounds origin. Translation effectively moves the image inside the bounds rectangle, while setting the bounds origin effectively moves the rectangle over the image. The two are in a sense inverse, although translation is cumulative, and setting the bounds origin is absolute.\n\nThis method posts an [doc:\/\/com.apple.appkit\/documentation\/AppKit\/NSView\/boundsDidChangeNotification] to the default notification center if the view is configured to do so.\n\n## Related Documentation\n\n- **setBoundsOrigin(_:)**: Sets the origin of the view’s bounds rectangle to a specified point.\n- **bounds**: The view’s bounds rectangle, which expresses its location and size in its own coordinate system.\n\n## Modifying the Coordinate System\n\n- **scaleUnitSquare(to:)**: Scales the view’s coordinate system so that the unit square scales to the specified dimensions.\n- **rotate(byDegrees:)**: Rotates the view’s bounds rectangle by a specified degree value around the origin of the coordinate system, (0.0, 0.0).\n\n",
  "sections" : [
    {
      "content" : "",
      "items" : [
        {
          "description" : "Sets the origin of the view’s bounds rectangle to a specified point.",
          "name" : "setBoundsOrigin(_:)",
          "url" : "https:\/\/developer.apple.com\/documentation\/AppKit\/NSView\/setBoundsOrigin(_:)"
        },
        {
          "description" : "The view’s bounds rectangle, which expresses its location and size in its own coordinate system.",
          "name" : "bounds",
          "url" : "https:\/\/developer.apple.com\/documentation\/AppKit\/NSView\/bounds"
        }
      ],
      "title" : "Related Documentation"
    },
    {
      "content" : "",
      "items" : [
        {
          "description" : "Scales the view’s coordinate system so that the unit square scales to the specified dimensions.",
          "name" : "scaleUnitSquare(to:)",
          "url" : "https:\/\/developer.apple.com\/documentation\/AppKit\/NSView\/scaleUnitSquare(to:)"
        },
        {
          "description" : "Rotates the view’s bounds rectangle by a specified degree value around the origin of the coordinate system, (0.0, 0.0).",
          "name" : "rotate(byDegrees:)",
          "url" : "https:\/\/developer.apple.com\/documentation\/AppKit\/NSView\/rotate(byDegrees:)"
        }
      ],
      "title" : "Modifying the Coordinate System"
    }
  ],
  "source" : "appleJSON",
  "title" : "translateOrigin(to:)",
  "url" : "https:\/\/developer.apple.com\/documentation\/AppKit\/NSView\/translateOrigin(to:)"
}