{
  "abstract" : "Returns a short description of the table.",
  "codeExamples" : [

  ],
  "contentHash" : "5002418e8deb22bb380bb805a74eab4ef2ecd58c0ecda832bff15a2c079417df",
  "crawledAt" : "2025-12-04T01:36:50Z",
  "declaration" : {
    "code" : "func accessibilityLabel() -> String?",
    "language" : "swift"
  },
  "id" : "52F2A1E9-91A2-4BD7-B3ED-BBB320B57197",
  "kind" : "method",
  "language" : "swift",
  "module" : "AppKit",
  "overview" : "## Return Value\n\nThe description of the table.\n\n## Discussion\n\nThis method is the getter for the [doc:\/\/com.apple.appkit\/documentation\/AppKit\/NSAccessibilityProtocol] protocol’s [doc:\/\/com.apple.appkit\/documentation\/AppKit\/NSAccessibility-c.protocol\/accessibilityLabel] property.\n\nDo not include the control’s type in the label (for example, use `Employees`, not `Employees Table`). If possible use a single word. To help ensure that accessibility clients such as VoiceOver read the label with the correct intonation, start this label with a capital letter. Do not put a period at the end. Always localize the label.",
  "platforms" : [
    "macOS"
  ],
  "rawMarkdown" : "---\nsource: https:\/\/developer.apple.com\/documentation\/AppKit\/NSAccessibilityTable\/accessibilityLabel()\ncrawled: 2025-12-04T01:36:50Z\n---\n\n# accessibilityLabel()\n\n**Instance Method**\n\nReturns a short description of the table.\n\n## Declaration\n\n```swift\nfunc accessibilityLabel() -> String?\n```\n\n## Return Value\n\nThe description of the table.\n\n## Discussion\n\nThis method is the getter for the [doc:\/\/com.apple.appkit\/documentation\/AppKit\/NSAccessibilityProtocol] protocol’s [doc:\/\/com.apple.appkit\/documentation\/AppKit\/NSAccessibility-c.protocol\/accessibilityLabel] property.\n\nDo not include the control’s type in the label (for example, use `Employees`, not `Employees Table`). If possible use a single word. To help ensure that accessibility clients such as VoiceOver read the label with the correct intonation, start this label with a capital letter. Do not put a period at the end. Always localize the label.\n\n## Supporting Accessibility\n\n- **accessibilityColumnHeaderUIElements()**: Returns the column header accessibility elements for the table.\n- **accessibilityColumns()**: Returns the column accessibility elements for the table.\n- **accessibilityRowHeaderUIElements()**: Returns the row header accessibility elements for the table.\n- **accessibilityRows()**: Returns the row accessibility elements for the table.\n- **accessibilitySelectedCells()**: The currently selected cells for the table.\n- **accessibilitySelectedColumns()**: Returns the currently selected columns for the table.\n- **accessibilitySelectedRows()**: Returns the currently selected rows for the table.\n- **accessibilityVisibleCells()**: Returns the visible cells for the table.\n- **accessibilityVisibleColumns()**: Returns the visible columns for the table.\n- **accessibilityVisibleRows()**: Returns the visible rows for the table.\n- **setAccessibilitySelectedRows(_:)**: Sets the table’s currently selected rows.\n- **accessibilityHeaderGroup()**: Returns the header group for the table.\n\n",
  "sections" : [
    {
      "content" : "",
      "items" : [
        {
          "description" : "Returns the column header accessibility elements for the table.",
          "name" : "accessibilityColumnHeaderUIElements()",
          "url" : "https:\/\/developer.apple.com\/documentation\/AppKit\/NSAccessibilityTable\/accessibilityColumnHeaderUIElements()"
        },
        {
          "description" : "Returns the column accessibility elements for the table.",
          "name" : "accessibilityColumns()",
          "url" : "https:\/\/developer.apple.com\/documentation\/AppKit\/NSAccessibilityTable\/accessibilityColumns()"
        },
        {
          "description" : "Returns the row header accessibility elements for the table.",
          "name" : "accessibilityRowHeaderUIElements()",
          "url" : "https:\/\/developer.apple.com\/documentation\/AppKit\/NSAccessibilityTable\/accessibilityRowHeaderUIElements()"
        },
        {
          "description" : "Returns the row accessibility elements for the table.",
          "name" : "accessibilityRows()",
          "url" : "https:\/\/developer.apple.com\/documentation\/AppKit\/NSAccessibilityTable\/accessibilityRows()"
        },
        {
          "description" : "The currently selected cells for the table.",
          "name" : "accessibilitySelectedCells()",
          "url" : "https:\/\/developer.apple.com\/documentation\/AppKit\/NSAccessibilityTable\/accessibilitySelectedCells()"
        },
        {
          "description" : "Returns the currently selected columns for the table.",
          "name" : "accessibilitySelectedColumns()",
          "url" : "https:\/\/developer.apple.com\/documentation\/AppKit\/NSAccessibilityTable\/accessibilitySelectedColumns()"
        },
        {
          "description" : "Returns the currently selected rows for the table.",
          "name" : "accessibilitySelectedRows()",
          "url" : "https:\/\/developer.apple.com\/documentation\/AppKit\/NSAccessibilityTable\/accessibilitySelectedRows()"
        },
        {
          "description" : "Returns the visible cells for the table.",
          "name" : "accessibilityVisibleCells()",
          "url" : "https:\/\/developer.apple.com\/documentation\/AppKit\/NSAccessibilityTable\/accessibilityVisibleCells()"
        },
        {
          "description" : "Returns the visible columns for the table.",
          "name" : "accessibilityVisibleColumns()",
          "url" : "https:\/\/developer.apple.com\/documentation\/AppKit\/NSAccessibilityTable\/accessibilityVisibleColumns()"
        },
        {
          "description" : "Returns the visible rows for the table.",
          "name" : "accessibilityVisibleRows()",
          "url" : "https:\/\/developer.apple.com\/documentation\/AppKit\/NSAccessibilityTable\/accessibilityVisibleRows()"
        },
        {
          "description" : "Sets the table’s currently selected rows.",
          "name" : "setAccessibilitySelectedRows(_:)",
          "url" : "https:\/\/developer.apple.com\/documentation\/AppKit\/NSAccessibilityTable\/setAccessibilitySelectedRows(_:)"
        },
        {
          "description" : "Returns the header group for the table.",
          "name" : "accessibilityHeaderGroup()",
          "url" : "https:\/\/developer.apple.com\/documentation\/AppKit\/NSAccessibilityTable\/accessibilityHeaderGroup()"
        }
      ],
      "title" : "Supporting Accessibility"
    }
  ],
  "source" : "appleJSON",
  "title" : "accessibilityLabel()",
  "url" : "https:\/\/developer.apple.com\/documentation\/AppKit\/NSAccessibilityTable\/accessibilityLabel()"
}