{
  "abstract" : "An array of types that specify the files types to which you can save.",
  "codeExamples" : [

  ],
  "contentHash" : "c3e5c70a751f5f87fe788b4e3977f6c4e0f7a3e09c99a8f098578894be856e86",
  "crawledAt" : "2025-12-01T13:46:01Z",
  "declaration" : {
    "code" : "@MainActor var allowedContentTypes: [UTType] { get set }",
    "language" : "swift"
  },
  "id" : "A4C1C47A-2978-4918-8EBD-D32063CB375C",
  "kind" : "property",
  "module" : "AppKit",
  "overview" : "## Discussion\n\nDefaults to an empty array that indicates that you can use any file type. If you don’t provide an extension, the system uses the first preferred extension in the array for the save panel. If you specify a type that isn’t in the array and [doc:\/\/com.apple.appkit\/documentation\/AppKit\/NSSavePanel\/allowsOtherFileTypes] is `YES`, the system presents another dialog when prompting you to save.",
  "platforms" : [
    "macOS"
  ],
  "rawMarkdown" : "---\nsource: https:\/\/developer.apple.com\/documentation\/AppKit\/NSSavePanel\/allowedContentTypes\ncrawled: 2025-12-01T13:46:01Z\n---\n\n# allowedContentTypes\n\n**Instance Property**\n\nAn array of types that specify the files types to which you can save.\n\n## Declaration\n\n```swift\n@MainActor var allowedContentTypes: [UTType] { get set }\n```\n\n## Discussion\n\nDefaults to an empty array that indicates that you can use any file type. If you don’t provide an extension, the system uses the first preferred extension in the array for the save panel. If you specify a type that isn’t in the array and [doc:\/\/com.apple.appkit\/documentation\/AppKit\/NSSavePanel\/allowsOtherFileTypes] is `YES`, the system presents another dialog when prompting you to save.\n\n## Configuring the File Types\n\n- **allowsOtherFileTypes**: A Boolean value that indicates whether the panel allows the user to save files with a filename extension that’s not in the list of allowed types.\n- **treatsFilePackagesAsDirectories**: A Boolean value that indicates whether the panel displays file packages as directories.\n\n",
  "sections" : [
    {
      "content" : "",
      "items" : [
        {
          "description" : "A Boolean value that indicates whether the panel allows the user to save files with a filename extension that’s not in the list of allowed types.",
          "name" : "allowsOtherFileTypes",
          "url" : "https:\/\/developer.apple.com\/documentation\/AppKit\/NSSavePanel\/allowsOtherFileTypes"
        },
        {
          "description" : "A Boolean value that indicates whether the panel displays file packages as directories.",
          "name" : "treatsFilePackagesAsDirectories",
          "url" : "https:\/\/developer.apple.com\/documentation\/AppKit\/NSSavePanel\/treatsFilePackagesAsDirectories"
        }
      ],
      "title" : "Configuring the File Types"
    }
  ],
  "source" : "appleJSON",
  "title" : "allowedContentTypes",
  "url" : "https:\/\/developer.apple.com\/documentation\/AppKit\/NSSavePanel\/allowedContentTypes"
}