{
  "abstract" : "A Boolean value that indicates whether the accessibility option to invert colors is in an enabled state.",
  "codeExamples" : [

  ],
  "contentHash" : "631680163ea7cf80507ea950108d538c90fbab510f6f1c6883962757170c7bdf",
  "crawledAt" : "2025-12-04T12:07:59Z",
  "declaration" : {
    "code" : "var accessibilityDisplayShouldInvertColors: Bool { get }",
    "language" : "swift"
  },
  "id" : "7A340BAD-2524-4E06-8323-4D5F83FDD0B7",
  "kind" : "property",
  "language" : "swift",
  "module" : "AppKit",
  "overview" : "## Discussion\n\nIf this property’s value is [doc:\/\/com.apple.documentation\/documentation\/Swift\/true], the system inverts the display. In this case, you may need to adjust your app’s drawing for optimal display.  To receive updates when this setting changes, register for the [doc:\/\/com.apple.appkit\/documentation\/AppKit\/NSWorkspace\/accessibilityDisplayOptionsDidChangeNotification] notification using [doc:\/\/com.apple.appkit\/documentation\/AppKit\/NSWorkspace\/notificationCenter].",
  "platforms" : [
    "macOS"
  ],
  "rawMarkdown" : "---\nsource: https:\/\/developer.apple.com\/documentation\/AppKit\/NSWorkspace\/accessibilityDisplayShouldInvertColors\ncrawled: 2025-12-04T12:07:59Z\n---\n\n# accessibilityDisplayShouldInvertColors\n\n**Instance Property**\n\nA Boolean value that indicates whether the accessibility option to invert colors is in an enabled state.\n\n## Declaration\n\n```swift\nvar accessibilityDisplayShouldInvertColors: Bool { get }\n```\n\n## Discussion\n\nIf this property’s value is [doc:\/\/com.apple.documentation\/documentation\/Swift\/true], the system inverts the display. In this case, you may need to adjust your app’s drawing for optimal display.  To receive updates when this setting changes, register for the [doc:\/\/com.apple.appkit\/documentation\/AppKit\/NSWorkspace\/accessibilityDisplayOptionsDidChangeNotification] notification using [doc:\/\/com.apple.appkit\/documentation\/AppKit\/NSWorkspace\/notificationCenter].\n\n## Supporting Accessibility\n\n- **accessibilityDisplayShouldDifferentiateWithoutColor**: A Boolean value that indicates whether the app avoids conveying information through color alone.\n- **accessibilityDisplayShouldIncreaseContrast**: A Boolean value that indicates whether the app presents a high-contrast user interface.\n- **accessibilityDisplayShouldReduceTransparency**: A Boolean value that indicates whether the app avoids using semitransparent backgrounds.\n- **accessibilityDisplayShouldReduceMotion**: A Boolean value that indicates whether the accessibility option to reduce motion is in an enabled state.\n- **isSwitchControlEnabled**: A Boolean value that indicates whether Switch Control is currently running.\n- **isVoiceOverEnabled**: A Boolean value that indicates whether VoiceOver is currently running.\n\n",
  "sections" : [
    {
      "content" : "",
      "items" : [
        {
          "description" : "A Boolean value that indicates whether the app avoids conveying information through color alone.",
          "name" : "accessibilityDisplayShouldDifferentiateWithoutColor",
          "url" : "https:\/\/developer.apple.com\/documentation\/AppKit\/NSWorkspace\/accessibilityDisplayShouldDifferentiateWithoutColor"
        },
        {
          "description" : "A Boolean value that indicates whether the app presents a high-contrast user interface.",
          "name" : "accessibilityDisplayShouldIncreaseContrast",
          "url" : "https:\/\/developer.apple.com\/documentation\/AppKit\/NSWorkspace\/accessibilityDisplayShouldIncreaseContrast"
        },
        {
          "description" : "A Boolean value that indicates whether the app avoids using semitransparent backgrounds.",
          "name" : "accessibilityDisplayShouldReduceTransparency",
          "url" : "https:\/\/developer.apple.com\/documentation\/AppKit\/NSWorkspace\/accessibilityDisplayShouldReduceTransparency"
        },
        {
          "description" : "A Boolean value that indicates whether the accessibility option to reduce motion is in an enabled state.",
          "name" : "accessibilityDisplayShouldReduceMotion",
          "url" : "https:\/\/developer.apple.com\/documentation\/AppKit\/NSWorkspace\/accessibilityDisplayShouldReduceMotion"
        },
        {
          "description" : "A Boolean value that indicates whether Switch Control is currently running.",
          "name" : "isSwitchControlEnabled",
          "url" : "https:\/\/developer.apple.com\/documentation\/AppKit\/NSWorkspace\/isSwitchControlEnabled"
        },
        {
          "description" : "A Boolean value that indicates whether VoiceOver is currently running.",
          "name" : "isVoiceOverEnabled",
          "url" : "https:\/\/developer.apple.com\/documentation\/AppKit\/NSWorkspace\/isVoiceOverEnabled"
        }
      ],
      "title" : "Supporting Accessibility"
    }
  ],
  "source" : "appleJSON",
  "title" : "accessibilityDisplayShouldInvertColors",
  "url" : "https:\/\/developer.apple.com\/documentation\/AppKit\/NSWorkspace\/accessibilityDisplayShouldInvertColors"
}