{
  "abstract" : "Returns an initialized text list.",
  "codeExamples" : [

  ],
  "contentHash" : "a74c51c1e7ceb217f30d8e08e1dcc7a32d6795bae43b7584494d090ebd0940c2",
  "crawledAt" : "2025-12-04T02:22:21Z",
  "declaration" : {
    "code" : "convenience init(markerFormat: NSTextList.MarkerFormat, options: Int)",
    "language" : "swift"
  },
  "id" : "5044A011-ADA8-42C5-8A2B-5DECB6C8194F",
  "kind" : "unknown",
  "language" : "swift",
  "module" : "AppKit",
  "overview" : "## Return Value\n\nAn initialized text list.\n\n## Discussion\n\nThe marker format is specified as a constant string, except for a numbering specifier, which takes the form `{`keyword`}`. The currently supported values for keyword include:\n\nThus, for example, `@\"({decimal})\"` would specify the format for a list numbered (1), (2), (3), and so on, and `@\"{upper-roman}\"` would specify the format for a list numbered I, II, III, IV, and so on. (All of these keywords are included in the Cascading Style Sheets level 3 specification.)",
  "platforms" : [
    "macOS"
  ],
  "rawMarkdown" : "---\nsource: https:\/\/developer.apple.com\/documentation\/AppKit\/NSTextList\/init(markerFormat:options:)\ncrawled: 2025-12-04T02:22:21Z\n---\n\n# init(markerFormat:options:)\n\n**Initializer**\n\nReturns an initialized text list.\n\n## Declaration\n\n```swift\nconvenience init(markerFormat: NSTextList.MarkerFormat, options: Int)\n```\n\n## Parameters\n\n- **markerFormat**: The marker format for the text list.\n- **options**: The marker options for the text list. Values for `mask` are listed in Constants.\n\n## Return Value\n\nAn initialized text list.\n\n## Discussion\n\nThe marker format is specified as a constant string, except for a numbering specifier, which takes the form `{`keyword`}`. The currently supported values for keyword include:\n\n- `box`\n- `check`\n- `circle`\n- `diamond`\n- `disc`\n- `hyphen`\n- `square`\n- `lower-hexadecimal`\n- `upper-hexadecimal`\n- `octal`\n- `lower-alpha` or  `lower-latin`\n- `upper-alpha` or  `upper-latin`\n- `lower-roman`\n- `upper-roman`\n- `decimal`\n\nThus, for example, `@\"({decimal})\"` would specify the format for a list numbered (1), (2), (3), and so on, and `@\"{upper-roman}\"` would specify the format for a list numbered I, II, III, IV, and so on. (All of these keywords are included in the Cascading Style Sheets level 3 specification.)\n\n## Creating a text list\n\n- **init(coder:)**: Initializes and returns a newly allocated text list item.\n- **init(markerFormat:options:startingItemNumber:)**: Returns a new text list with the format, options, and starting item number you provide.\n\n",
  "sections" : [
    {
      "content" : "",
      "items" : [
        {
          "description" : "Initializes and returns a newly allocated text list item.",
          "name" : "init(coder:)",
          "url" : "https:\/\/developer.apple.com\/documentation\/AppKit\/NSTextList\/init(coder:)"
        },
        {
          "description" : "Returns a new text list with the format, options, and starting item number you provide.",
          "name" : "init(markerFormat:options:startingItemNumber:)",
          "url" : "https:\/\/developer.apple.com\/documentation\/AppKit\/NSTextList\/init(markerFormat:options:startingItemNumber:)"
        }
      ],
      "title" : "Creating a text list"
    }
  ],
  "source" : "appleJSON",
  "title" : "init(markerFormat:options:)",
  "url" : "https:\/\/developer.apple.com\/documentation\/AppKit\/NSTextList\/init(markerFormat:options:)"
}