{
  "abstract" : "Creates a layout dimension object from two anchors.",
  "codeExamples" : [

  ],
  "contentHash" : "ca07bba877508606708c7fd7cdf669b93ff72a54e54937e157282bb6f85893b8",
  "crawledAt" : "2025-12-04T10:57:40Z",
  "declaration" : {
    "code" : "func anchorWithOffset(to otherAnchor: NSLayoutXAxisAnchor) -> NSLayoutDimension",
    "language" : "swift"
  },
  "id" : "6F01698C-8CAB-4C90-B2C5-7E175BD5B7B1",
  "kind" : "method",
  "language" : "swift",
  "module" : "AppKit",
  "overview" : "## Return Value\n\nThe [doc:\/\/com.apple.appkit\/documentation\/AppKit\/NSLayoutDimension] object represented by the two anchors.\n\n## Discussion\n\nUse the returned object to define constraints relative to the space between the current anchor and the object in the `otherAnchor` parameter.",
  "platforms" : [
    "macOS"
  ],
  "rawMarkdown" : "---\nsource: https:\/\/developer.apple.com\/documentation\/AppKit\/NSLayoutXAxisAnchor\/anchorWithOffset(to:)\ncrawled: 2025-12-04T10:57:40Z\n---\n\n# anchorWithOffset(to:)\n\n**Instance Method**\n\nCreates a layout dimension object from two anchors.\n\n## Declaration\n\n```swift\nfunc anchorWithOffset(to otherAnchor: NSLayoutXAxisAnchor) -> NSLayoutDimension\n```\n\n## Parameters\n\n- **otherAnchor**: The second anchor to use when creating the layout dimension.\n\n## Return Value\n\nThe [doc:\/\/com.apple.appkit\/documentation\/AppKit\/NSLayoutDimension] object represented by the two anchors.\n\n## Discussion\n\nUse the returned object to define constraints relative to the space between the current anchor and the object in the `otherAnchor` parameter.\n\n",
  "sections" : [

  ],
  "source" : "appleJSON",
  "title" : "anchorWithOffset(to:)",
  "url" : "https:\/\/developer.apple.com\/documentation\/AppKit\/NSLayoutXAxisAnchor\/anchorWithOffset(to:)"
}