{
  "abstract" : "Returns the rectangle containing the specified column, not including borders.",
  "codeExamples" : [

  ],
  "contentHash" : "fbbdfec00e51c4a3a2c9a28428a49fee40553f6d50c126cbe1fc4c0ef471ea93",
  "crawledAt" : "2025-12-01T13:31:46Z",
  "declaration" : {
    "code" : "@MainActor func frame(ofInsideOfColumn column: Int) -> NSRect",
    "language" : "swift"
  },
  "id" : "488050A4-8381-47BD-A431-0620469745E0",
  "kind" : "method",
  "module" : "AppKit",
  "overview" : "## Return Value\n\nThe rectangle containing the column, not including the column borders.",
  "platforms" : [
    "macOS"
  ],
  "rawMarkdown" : "---\nsource: https:\/\/developer.apple.com\/documentation\/AppKit\/NSBrowser\/frame(ofInsideOfColumn:)\ncrawled: 2025-12-01T13:31:46Z\n---\n\n# frame(ofInsideOfColumn:)\n\n**Instance Method**\n\nReturns the rectangle containing the specified column, not including borders.\n\n## Declaration\n\n```swift\n@MainActor func frame(ofInsideOfColumn column: Int) -> NSRect\n```\n\n## Parameters\n\n- **column**: The index of the column for which to retrieve the inside frame.\n\n## Return Value\n\nThe rectangle containing the column, not including the column borders.\n\n## Getting Column Frames\n\n- **frame(ofColumn:)**: Returns the rectangle containing the given column.\n\n",
  "sections" : [
    {
      "content" : "",
      "items" : [
        {
          "description" : "Returns the rectangle containing the given column.",
          "name" : "frame(ofColumn:)",
          "url" : "https:\/\/developer.apple.com\/documentation\/AppKit\/NSBrowser\/frame(ofColumn:)"
        }
      ],
      "title" : "Getting Column Frames"
    }
  ],
  "source" : "appleJSON",
  "title" : "frame(ofInsideOfColumn:)",
  "url" : "https:\/\/developer.apple.com\/documentation\/AppKit\/NSBrowser\/frame(ofInsideOfColumn:)"
}