{
  "abstract" : "Inserts a window at a specific location within the tab group.",
  "codeExamples" : [

  ],
  "contentHash" : "cb9635a1748d793d9c681254adf4a00ab134a3753c0e0fe043cec226d4dd0196",
  "crawledAt" : "2025-12-04T11:00:00Z",
  "declaration" : {
    "code" : "func insertWindow(_ window: NSWindow, at index: Int)",
    "language" : "swift"
  },
  "id" : "5DD08EA5-866D-471A-853E-C376C3F36B1E",
  "kind" : "method",
  "language" : "swift",
  "module" : "AppKit",
  "overview" : "## Discussion\n\nInserts the window at the specified location within the tab group. If the window is already a member of another tab group, it is first removed from that group.",
  "platforms" : [
    "macOS"
  ],
  "rawMarkdown" : "---\nsource: https:\/\/developer.apple.com\/documentation\/AppKit\/NSWindowTabGroup\/insertWindow(_:at:)\ncrawled: 2025-12-04T11:00:00Z\n---\n\n# insertWindow(_:at:)\n\n**Instance Method**\n\nInserts a window at a specific location within the tab group.\n\n## Declaration\n\n```swift\nfunc insertWindow(_ window: NSWindow, at index: Int)\n```\n\n## Parameters\n\n- **window**: The window to insert into the tab group.\n- **index**: The location in the tab group at which to insert window. This value must not be negative, and must not be greater than the number of windows in the tab group.\n\nRaises an `NSInternalInconsistencyException` if the index is negative or larger than the number of tabs in the group.\n\n## Discussion\n\nInserts the window at the specified location within the tab group. If the window is already a member of another tab group, it is first removed from that group.\n\n## Managing Tabbed Windows\n\n- **windows**: A collection of the windows that are currently grouped together by this window tab group.\n- **selectedWindow**: The selected, or frontmost, window in the tab group.\n- **addWindow(_:)**: Adds a window to the tab group.\n- **removeWindow(_:)**: Removes a window from the tab group.\n\n",
  "sections" : [
    {
      "content" : "",
      "items" : [
        {
          "description" : "A collection of the windows that are currently grouped together by this window tab group.",
          "name" : "windows",
          "url" : "https:\/\/developer.apple.com\/documentation\/AppKit\/NSWindowTabGroup\/windows"
        },
        {
          "description" : "The selected, or frontmost, window in the tab group.",
          "name" : "selectedWindow",
          "url" : "https:\/\/developer.apple.com\/documentation\/AppKit\/NSWindowTabGroup\/selectedWindow"
        },
        {
          "description" : "Adds a window to the tab group.",
          "name" : "addWindow(_:)",
          "url" : "https:\/\/developer.apple.com\/documentation\/AppKit\/NSWindowTabGroup\/addWindow(_:)"
        },
        {
          "description" : "Removes a window from the tab group.",
          "name" : "removeWindow(_:)",
          "url" : "https:\/\/developer.apple.com\/documentation\/AppKit\/NSWindowTabGroup\/removeWindow(_:)"
        }
      ],
      "title" : "Managing Tabbed Windows"
    }
  ],
  "source" : "appleJSON",
  "title" : "insertWindow(_:at:)",
  "url" : "https:\/\/developer.apple.com\/documentation\/AppKit\/NSWindowTabGroup\/insertWindow(_:at:)"
}