{
  "abstract" : "The image data format to use for this image type.",
  "codeExamples" : [

  ],
  "contentHash" : "b3cc82aca91151d6b3fed00883537ef22e9887a23cca7b634f4ac54dd17fbaab",
  "crawledAt" : "2025-12-02T07:30:40Z",
  "declaration" : {
    "code" : "class var contentType: UTType { get }",
    "language" : "swift"
  },
  "id" : "4240765E-E00C-4B7C-B67F-A04D014A43EB",
  "kind" : "property",
  "module" : "AppKit",
  "overview" : "## Discussion\n\nUse this type when you need to specify the type of the image data. Adaptive images are compatible with the HEIC format, but include extra metadata about the supported resolutions and sizes.",
  "platforms" : [
    "macOS"
  ],
  "rawMarkdown" : "---\nsource: https:\/\/developer.apple.com\/documentation\/AppKit\/NSAdaptiveImageGlyph\/contentType\ncrawled: 2025-12-02T07:30:40Z\n---\n\n# contentType\n\n**Type Property**\n\nThe image data format to use for this image type.\n\n## Declaration\n\n```swift\nclass var contentType: UTType { get }\n```\n\n## Discussion\n\nUse this type when you need to specify the type of the image data. Adaptive images are compatible with the HEIC format, but include extra metadata about the supported resolutions and sizes.\n\n## Getting the content metadata\n\n- **contentIdentifier**: A unique identifier for this image.\n- **contentDescription**: An alternate textual description of the image contents.\n\n",
  "sections" : [
    {
      "content" : "",
      "items" : [
        {
          "description" : "A unique identifier for this image.",
          "name" : "contentIdentifier",
          "url" : "https:\/\/developer.apple.com\/documentation\/AppKit\/NSAdaptiveImageGlyph\/contentIdentifier"
        },
        {
          "description" : "An alternate textual description of the image contents.",
          "name" : "contentDescription",
          "url" : "https:\/\/developer.apple.com\/documentation\/AppKit\/NSAdaptiveImageGlyph\/contentDescription"
        }
      ],
      "title" : "Getting the content metadata"
    }
  ],
  "source" : "appleJSON",
  "title" : "contentType",
  "url" : "https:\/\/developer.apple.com\/documentation\/AppKit\/NSAdaptiveImageGlyph\/contentType"
}