{
  "abstract" : "The table will use the system default layout size: small, medium or large.",
  "codeExamples" : [

  ],
  "contentHash" : "9319a4696fd21ffb59f192edb5042bc8ae7677d93685eef2a6b52fff1c73f70e",
  "crawledAt" : "2025-12-04T18:29:26Z",
  "declaration" : {
    "code" : "case `default`",
    "language" : "swift"
  },
  "id" : "3D3CE6DE-40F9-4D7C-B36A-541C87659E26",
  "kind" : "unknown",
  "language" : "swift",
  "module" : "AppKit",
  "platforms" : [
    "macOS"
  ],
  "rawMarkdown" : "---\nsource: https:\/\/developer.apple.com\/documentation\/AppKit\/NSTableView\/RowSizeStyle-swift.enum\/default\ncrawled: 2025-12-04T18:29:26Z\n---\n\n# NSTableView.RowSizeStyle.default\n\n**Case**\n\nThe table will use the system default layout size: small, medium or large.\n\n## Declaration\n\n```swift\ncase `default`\n```\n\n## Constants\n\n- **NSTableView.RowSizeStyle.custom**: The table will use the [doc:\/\/com.apple.appkit\/documentation\/AppKit\/NSTableView\/rowHeight] or invoke the delegate method [doc:\/\/com.apple.appkit\/documentation\/AppKit\/NSTableViewDelegate\/tableView(_:heightOfRow:)], if implemented. The cell layout is not changed.\n- **NSTableView.RowSizeStyle.small**: The table will use a row height specified for a small table. It is required that the size be fully tested and supported if `NSTableViewRowSizeStyleCustom` is not used.\n- **NSTableView.RowSizeStyle.medium**: The table will use a row height specified for a medium table. It is required that the size be fully tested and supported if `NSTableViewRowSizeStyleCustom` is not used.\n- **NSTableView.RowSizeStyle.large**: The table will use a row height specified for a large table. It is required that the size be fully tested and supported if `NSTableViewRowSizeStyleCustom` is not used.\n\n",
  "sections" : [
    {
      "content" : "",
      "items" : [
        {
          "description" : "The table will use the [doc:\/\/com.apple.appkit\/documentation\/AppKit\/NSTableView\/rowHeight] or invoke the delegate method [doc:\/\/com.apple.appkit\/documentation\/AppKit\/NSTableViewDelegate\/tableView(_:heightOfRow:)], if implemented. The cell layout is not changed.",
          "name" : "NSTableView.RowSizeStyle.custom",
          "url" : "https:\/\/developer.apple.com\/documentation\/AppKit\/NSTableView\/RowSizeStyle-swift.enum\/custom"
        },
        {
          "description" : "The table will use a row height specified for a small table. It is required that the size be fully tested and supported if `NSTableViewRowSizeStyleCustom` is not used.",
          "name" : "NSTableView.RowSizeStyle.small",
          "url" : "https:\/\/developer.apple.com\/documentation\/AppKit\/NSTableView\/RowSizeStyle-swift.enum\/small"
        },
        {
          "description" : "The table will use a row height specified for a medium table. It is required that the size be fully tested and supported if `NSTableViewRowSizeStyleCustom` is not used.",
          "name" : "NSTableView.RowSizeStyle.medium",
          "url" : "https:\/\/developer.apple.com\/documentation\/AppKit\/NSTableView\/RowSizeStyle-swift.enum\/medium"
        },
        {
          "description" : "The table will use a row height specified for a large table. It is required that the size be fully tested and supported if `NSTableViewRowSizeStyleCustom` is not used.",
          "name" : "NSTableView.RowSizeStyle.large",
          "url" : "https:\/\/developer.apple.com\/documentation\/AppKit\/NSTableView\/RowSizeStyle-swift.enum\/large"
        }
      ],
      "title" : "Constants"
    }
  ],
  "source" : "appleJSON",
  "title" : "NSTableView.RowSizeStyle.default",
  "url" : "https:\/\/developer.apple.com\/documentation\/AppKit\/NSTableView\/RowSizeStyle-swift.enum\/default"
}