{
  "abstract" : "The following constants indicate the type of search anchor an action should perform.",
  "codeExamples" : [

  ],
  "conformsTo" : [
    "BitwiseCopyable",
    "Equatable",
    "Hashable",
    "RawRepresentable",
    "Sendable",
    "SendableMetatype"
  ],
  "contentHash" : "1cfc39112929ce945bc62dcbb0326a27a4b34805831982164a042a0cbf627f75",
  "crawledAt" : "2025-12-05T13:49:33Z",
  "declaration" : {
    "code" : "enum MatchingType",
    "language" : "swift"
  },
  "id" : "ADD6E461-BB88-4BEE-80B6-8F7E57C994C4",
  "kind" : "enum",
  "language" : "swift",
  "module" : "AppKit",
  "platforms" : [
    "macOS"
  ],
  "rawMarkdown" : "---\nsource: https:\/\/developer.apple.com\/documentation\/AppKit\/NSTextFinder\/MatchingType\ncrawled: 2025-12-05T13:49:33Z\n---\n\n# NSTextFinder.MatchingType\n\n**Enumeration**\n\nThe following constants indicate the type of search anchor an action should perform.\n\n## Declaration\n\n```swift\nenum MatchingType\n```\n\n## Constants\n\n- **NSTextFinder.MatchingType.contains**: The match contains the string.\n- **NSTextFinder.MatchingType.startsWith**: The match begins with the string.\n- **NSTextFinder.MatchingType.fullWord**: The match exactly matches the string.\n- **NSTextFinder.MatchingType.endsWith**: The match ends with the string.\n\n## Initializers\n\n- **init(rawValue:)**\n\n## Constants\n\n- **NSTextFinder.Action**: These constants specify the user interface item tags that correspond find action. These constants are passed to the [doc:\/\/com.apple.appkit\/documentation\/AppKit\/NSResponder\/performTextFinderAction(_:)] method, the responder will call the appropriate method for the tag. That method will, in turn, determine the desired action and invoke the appropriate method in the `NSTextFinder` object’s `NSTextFinderClient` protocol.\n- **Text Finder Options For The Pasteboard**: The following keys are used for communicating `NSTextFinder` search options via pasteboard. Use the [doc:\/\/com.apple.appkit\/documentation\/AppKit\/NSPasteboard\/PasteboardType\/textFinderOptions] type\n\n## Conforms To\n\n- BitwiseCopyable\n- Equatable\n- Hashable\n- RawRepresentable\n- Sendable\n- SendableMetatype\n\n",
  "sections" : [
    {
      "content" : "",
      "items" : [
        {
          "description" : "The match contains the string.",
          "name" : "NSTextFinder.MatchingType.contains",
          "url" : "https:\/\/developer.apple.com\/documentation\/AppKit\/NSTextFinder\/MatchingType\/contains"
        },
        {
          "description" : "The match begins with the string.",
          "name" : "NSTextFinder.MatchingType.startsWith",
          "url" : "https:\/\/developer.apple.com\/documentation\/AppKit\/NSTextFinder\/MatchingType\/startsWith"
        },
        {
          "description" : "The match exactly matches the string.",
          "name" : "NSTextFinder.MatchingType.fullWord",
          "url" : "https:\/\/developer.apple.com\/documentation\/AppKit\/NSTextFinder\/MatchingType\/fullWord"
        },
        {
          "description" : "The match ends with the string.",
          "name" : "NSTextFinder.MatchingType.endsWith",
          "url" : "https:\/\/developer.apple.com\/documentation\/AppKit\/NSTextFinder\/MatchingType\/endsWith"
        }
      ],
      "title" : "Constants"
    },
    {
      "content" : "",
      "items" : [
        {
          "description" : "",
          "name" : "init(rawValue:)",
          "url" : "https:\/\/developer.apple.com\/documentation\/AppKit\/NSTextFinder\/MatchingType\/init(rawValue:)"
        }
      ],
      "title" : "Initializers"
    },
    {
      "content" : "",
      "items" : [
        {
          "description" : "These constants specify the user interface item tags that correspond find action. These constants are passed to the [doc:\/\/com.apple.appkit\/documentation\/AppKit\/NSResponder\/performTextFinderAction(_:)] method, the responder will call the appropriate method for the tag. That method will, in turn, determine the desired action and invoke the appropriate method in the `NSTextFinder` object’s `NSTextFinderClient` protocol.",
          "name" : "NSTextFinder.Action",
          "url" : "https:\/\/developer.apple.com\/documentation\/AppKit\/NSTextFinder\/Action"
        },
        {
          "description" : "The following keys are used for communicating `NSTextFinder` search options via pasteboard. Use the [doc:\/\/com.apple.appkit\/documentation\/AppKit\/NSPasteboard\/PasteboardType\/textFinderOptions] type",
          "name" : "Text Finder Options For The Pasteboard",
          "url" : "https:\/\/developer.apple.com\/documentation\/AppKit\/text-finder-options-for-the-pasteboard"
        }
      ],
      "title" : "Constants"
    }
  ],
  "source" : "appleJSON",
  "title" : "NSTextFinder.MatchingType",
  "url" : "https:\/\/developer.apple.com\/documentation\/AppKit\/NSTextFinder\/MatchingType"
}