{
  "abstract" : "The custom accessory view for the current app.",
  "codeExamples" : [

  ],
  "contentHash" : "5c596dca9272091c170e7f5520c52c04d039a7bdc38bdeb84c85875056b3ded0",
  "crawledAt" : "2025-12-03T08:38:56Z",
  "declaration" : {
    "code" : "@MainActor var accessoryView: NSView? { get set }",
    "language" : "swift"
  },
  "id" : "424F3ECE-2C52-4E95-BE70-9C67BFCE0EA6",
  "kind" : "property",
  "language" : "swift",
  "module" : "AppKit",
  "overview" : "## Discussion\n\nYou can customize the panel by adding a custom view. The custom object you add appears just above the OK and Cancel buttons at the bottom of the panel. The `NSSavePanel` object automatically resizes itself to accommodate `accessoryView`. Use this property to change the accessory view as needed. If `accessoryView` is `nil`, the Save panel removes the current accessory view.\n\nThe panel relinquishes ownership of the accessory view after the panel is closed. If you want to reuse the accessory view, don’t rely on the panel to hold onto the accessory view until the next time you use it; instead, maintain your own strong reference to the view.",
  "platforms" : [
    "macOS"
  ],
  "rawMarkdown" : "---\nsource: https:\/\/developer.apple.com\/documentation\/AppKit\/NSSavePanel\/accessoryView\ncrawled: 2025-12-03T08:38:56Z\n---\n\n# accessoryView\n\n**Instance Property**\n\nThe custom accessory view for the current app.\n\n## Declaration\n\n```swift\n@MainActor var accessoryView: NSView? { get set }\n```\n\n## Discussion\n\nYou can customize the panel by adding a custom view. The custom object you add appears just above the OK and Cancel buttons at the bottom of the panel. The `NSSavePanel` object automatically resizes itself to accommodate `accessoryView`. Use this property to change the accessory view as needed. If `accessoryView` is `nil`, the Save panel removes the current accessory view.\n\nThe panel relinquishes ownership of the accessory view after the panel is closed. If you want to reuse the accessory view, don’t rely on the panel to hold onto the accessory view until the next time you use it; instead, maintain your own strong reference to the view.\n\n## Configuring the Panel’s Appearance\n\n- **title**: The title of the panel.\n- **prompt**: The text to display in the default button.\n- **message**: The message text displayed in the panel.\n- **nameFieldLabel**: The label text displayed in front of the filename text field.\n- **nameFieldStringValue**: The user-editable filename currently shown in the name field.\n- **directoryURL**: The current directory shown in the panel.\n- **showsTagField**: A Boolean value that indicates whether the panel displays the Tags field.\n- **tagNames**: The tag names that you want to include on a saved file.\n\n",
  "sections" : [
    {
      "content" : "",
      "items" : [
        {
          "description" : "The title of the panel.",
          "name" : "title",
          "url" : "https:\/\/developer.apple.com\/documentation\/AppKit\/NSSavePanel\/title"
        },
        {
          "description" : "The text to display in the default button.",
          "name" : "prompt",
          "url" : "https:\/\/developer.apple.com\/documentation\/AppKit\/NSSavePanel\/prompt"
        },
        {
          "description" : "The message text displayed in the panel.",
          "name" : "message",
          "url" : "https:\/\/developer.apple.com\/documentation\/AppKit\/NSSavePanel\/message"
        },
        {
          "description" : "The label text displayed in front of the filename text field.",
          "name" : "nameFieldLabel",
          "url" : "https:\/\/developer.apple.com\/documentation\/AppKit\/NSSavePanel\/nameFieldLabel"
        },
        {
          "description" : "The user-editable filename currently shown in the name field.",
          "name" : "nameFieldStringValue",
          "url" : "https:\/\/developer.apple.com\/documentation\/AppKit\/NSSavePanel\/nameFieldStringValue"
        },
        {
          "description" : "The current directory shown in the panel.",
          "name" : "directoryURL",
          "url" : "https:\/\/developer.apple.com\/documentation\/AppKit\/NSSavePanel\/directoryURL"
        },
        {
          "description" : "A Boolean value that indicates whether the panel displays the Tags field.",
          "name" : "showsTagField",
          "url" : "https:\/\/developer.apple.com\/documentation\/AppKit\/NSSavePanel\/showsTagField"
        },
        {
          "description" : "The tag names that you want to include on a saved file.",
          "name" : "tagNames",
          "url" : "https:\/\/developer.apple.com\/documentation\/AppKit\/NSSavePanel\/tagNames"
        }
      ],
      "title" : "Configuring the Panel’s Appearance"
    }
  ],
  "source" : "appleJSON",
  "title" : "accessoryView",
  "url" : "https:\/\/developer.apple.com\/documentation\/AppKit\/NSSavePanel\/accessoryView"
}