{
  "abstract" : "The document has been initialized with the contents of a file or file package other than the one whose location is in the `fileURL` property, and therefore can’t possibly be synchronized with its persistent representation.",
  "codeExamples" : [

  ],
  "contentHash" : "b1d07c89e6e80560b6288bf8e6117aa73634999eb7ae850e0be3330a40b0afea",
  "crawledAt" : "2025-12-01T14:05:11Z",
  "declaration" : {
    "code" : "case changeReadOtherContents",
    "language" : "swift"
  },
  "id" : "961D53CC-CF67-4604-B26A-C70D65A6525F",
  "kind" : "unknown",
  "module" : "AppKit",
  "overview" : "## Discussion\n\nFor example, [doc:\/\/com.apple.appkit\/documentation\/AppKit\/NSDocument\/init(for:withContentsOf:ofType:)] passes this value when the two passed-in URLs are not equal to indicate that an autosaved document is being reopened.",
  "platforms" : [
    "macOS"
  ],
  "rawMarkdown" : "---\nsource: https:\/\/developer.apple.com\/documentation\/AppKit\/NSDocument\/ChangeType\/changeReadOtherContents\ncrawled: 2025-12-01T14:05:11Z\n---\n\n# NSDocument.ChangeType.changeReadOtherContents\n\n**Case**\n\nThe document has been initialized with the contents of a file or file package other than the one whose location is in the `fileURL` property, and therefore can’t possibly be synchronized with its persistent representation.\n\n## Declaration\n\n```swift\ncase changeReadOtherContents\n```\n\n## Discussion\n\nFor example, [doc:\/\/com.apple.appkit\/documentation\/AppKit\/NSDocument\/init(for:withContentsOf:ofType:)] passes this value when the two passed-in URLs are not equal to indicate that an autosaved document is being reopened.\n\n## Constants\n\n- **NSDocument.ChangeType.changeDone**: Increment change count.\n- **NSDocument.ChangeType.changeUndone**: Decrement change count.\n- **NSDocument.ChangeType.changeCleared**: Set change count to 0.\n- **NSDocument.ChangeType.changeAutosaved**: The document’s contents have been autosaved.\n- **NSDocument.ChangeType.changeRedone**: A single change has been redone.\n- **NSDocument.ChangeType.changeDiscardable**: A discardable change has been done.\n\n",
  "sections" : [
    {
      "content" : "",
      "items" : [
        {
          "description" : "Increment change count.",
          "name" : "NSDocument.ChangeType.changeDone",
          "url" : "https:\/\/developer.apple.com\/documentation\/AppKit\/NSDocument\/ChangeType\/changeDone"
        },
        {
          "description" : "Decrement change count.",
          "name" : "NSDocument.ChangeType.changeUndone",
          "url" : "https:\/\/developer.apple.com\/documentation\/AppKit\/NSDocument\/ChangeType\/changeUndone"
        },
        {
          "description" : "Set change count to 0.",
          "name" : "NSDocument.ChangeType.changeCleared",
          "url" : "https:\/\/developer.apple.com\/documentation\/AppKit\/NSDocument\/ChangeType\/changeCleared"
        },
        {
          "description" : "The document’s contents have been autosaved.",
          "name" : "NSDocument.ChangeType.changeAutosaved",
          "url" : "https:\/\/developer.apple.com\/documentation\/AppKit\/NSDocument\/ChangeType\/changeAutosaved"
        },
        {
          "description" : "A single change has been redone.",
          "name" : "NSDocument.ChangeType.changeRedone",
          "url" : "https:\/\/developer.apple.com\/documentation\/AppKit\/NSDocument\/ChangeType\/changeRedone"
        },
        {
          "description" : "A discardable change has been done.",
          "name" : "NSDocument.ChangeType.changeDiscardable",
          "url" : "https:\/\/developer.apple.com\/documentation\/AppKit\/NSDocument\/ChangeType\/changeDiscardable"
        }
      ],
      "title" : "Constants"
    }
  ],
  "source" : "appleJSON",
  "title" : "NSDocument.ChangeType.changeReadOtherContents",
  "url" : "https:\/\/developer.apple.com\/documentation\/AppKit\/NSDocument\/ChangeType\/changeReadOtherContents"
}