{
  "abstract" : "A color space object that represents an sRGB color space.",
  "codeExamples" : [

  ],
  "contentHash" : "d6eb2664f8a57f7aaa507e1c052eca6083e55c3ea02a893cf2aea18fcf2c4844",
  "crawledAt" : "2025-12-04T11:07:47Z",
  "declaration" : {
    "code" : "class var sRGB: NSColorSpace { get }",
    "language" : "swift"
  },
  "id" : "478F2C45-309C-451C-8F40-8ED6BB9D7F9F",
  "kind" : "property",
  "language" : "swift",
  "module" : "AppKit",
  "overview" : "## Return Value\n\nThe `NSColorSpace` object. This color-additive color space has red, green, blue, and alpha components.\n\n## Discussion\n\nThe sRGB color space is a standard color space for use on monitors, printers, and the Internet. For further information on sRGB, see [http:\/\/www.color.org\/srgb.html].",
  "platforms" : [
    "macOS"
  ],
  "rawMarkdown" : "---\nsource: https:\/\/developer.apple.com\/documentation\/AppKit\/NSColorSpace\/sRGB\ncrawled: 2025-12-04T11:07:47Z\n---\n\n# sRGB\n\n**Type Property**\n\nA color space object that represents an sRGB color space.\n\n## Declaration\n\n```swift\nclass var sRGB: NSColorSpace { get }\n```\n\n## Return Value\n\nThe `NSColorSpace` object. This color-additive color space has red, green, blue, and alpha components.\n\n## Discussion\n\nThe sRGB color space is a standard color space for use on monitors, printers, and the Internet. For further information on sRGB, see [http:\/\/www.color.org\/srgb.html].\n\n## Getting a Named Color Space\n\n- **deviceRGB**: A color space object that represents a calibrated or device-dependent RGB color space.\n- **genericRGB**: A color space object that represents a device-independent RGB color space.\n- **deviceCMYK**: A color space object that represents a calibrated or device-dependent CMYK color space.\n- **genericCMYK**: A color space object that represents a device-independent CMYK color space.\n- **deviceGray**: A color space object that represents a calibrated or device-dependent gray color space.\n- **genericGray**: A color space object that represents a device-independent gray color space.\n- **extendedSRGB**: A color space object that represents an extended sRGB color space.\n- **displayP3**: A color space object that represents a P3 Display color space.\n- **genericGamma22Gray**: A color space object that represents a gray color space with a gamma value of 2.2.\n- **extendedGenericGamma22Gray**: A color space object that represents an extended gray color space with a gamma value of 2.2.\n- **adobeRGB1998**: A color space object that represents an Adobe RGB (1998) color space.\n\n",
  "sections" : [
    {
      "content" : "",
      "items" : [
        {
          "description" : "A color space object that represents a calibrated or device-dependent RGB color space.",
          "name" : "deviceRGB",
          "url" : "https:\/\/developer.apple.com\/documentation\/AppKit\/NSColorSpace\/deviceRGB"
        },
        {
          "description" : "A color space object that represents a device-independent RGB color space.",
          "name" : "genericRGB",
          "url" : "https:\/\/developer.apple.com\/documentation\/AppKit\/NSColorSpace\/genericRGB"
        },
        {
          "description" : "A color space object that represents a calibrated or device-dependent CMYK color space.",
          "name" : "deviceCMYK",
          "url" : "https:\/\/developer.apple.com\/documentation\/AppKit\/NSColorSpace\/deviceCMYK"
        },
        {
          "description" : "A color space object that represents a device-independent CMYK color space.",
          "name" : "genericCMYK",
          "url" : "https:\/\/developer.apple.com\/documentation\/AppKit\/NSColorSpace\/genericCMYK"
        },
        {
          "description" : "A color space object that represents a calibrated or device-dependent gray color space.",
          "name" : "deviceGray",
          "url" : "https:\/\/developer.apple.com\/documentation\/AppKit\/NSColorSpace\/deviceGray"
        },
        {
          "description" : "A color space object that represents a device-independent gray color space.",
          "name" : "genericGray",
          "url" : "https:\/\/developer.apple.com\/documentation\/AppKit\/NSColorSpace\/genericGray"
        },
        {
          "description" : "A color space object that represents an extended sRGB color space.",
          "name" : "extendedSRGB",
          "url" : "https:\/\/developer.apple.com\/documentation\/AppKit\/NSColorSpace\/extendedSRGB"
        },
        {
          "description" : "A color space object that represents a P3 Display color space.",
          "name" : "displayP3",
          "url" : "https:\/\/developer.apple.com\/documentation\/AppKit\/NSColorSpace\/displayP3"
        },
        {
          "description" : "A color space object that represents a gray color space with a gamma value of 2.2.",
          "name" : "genericGamma22Gray",
          "url" : "https:\/\/developer.apple.com\/documentation\/AppKit\/NSColorSpace\/genericGamma22Gray"
        },
        {
          "description" : "A color space object that represents an extended gray color space with a gamma value of 2.2.",
          "name" : "extendedGenericGamma22Gray",
          "url" : "https:\/\/developer.apple.com\/documentation\/AppKit\/NSColorSpace\/extendedGenericGamma22Gray"
        },
        {
          "description" : "A color space object that represents an Adobe RGB (1998) color space.",
          "name" : "adobeRGB1998",
          "url" : "https:\/\/developer.apple.com\/documentation\/AppKit\/NSColorSpace\/adobeRGB1998"
        }
      ],
      "title" : "Getting a Named Color Space"
    }
  ],
  "source" : "appleJSON",
  "title" : "sRGB",
  "url" : "https:\/\/developer.apple.com\/documentation\/AppKit\/NSColorSpace\/sRGB"
}