{
  "abstract" : "A Boolean value indicating whether the view wants resting touches.",
  "codeExamples" : [

  ],
  "contentHash" : "d545ad57a3e704d6d46ed7a6df88bd1c5b97f8147d79fc7b3dd9f4f22bc623d4",
  "crawledAt" : "2025-12-06T02:58:24Z",
  "declaration" : {
    "code" : "@MainActor var wantsRestingTouches: Bool { get set }",
    "language" : "swift"
  },
  "id" : "F893C1E7-6618-426A-8EBA-49C238B86F02",
  "kind" : "property",
  "language" : "swift",
  "module" : "AppKit",
  "overview" : "## Discussion\n\nA resting touch occurs when a user rests their thumb on a device (for example, the glass trackpad of a MacBook). By default, these touches are not delivered and are not included in the event’s set of touches. Touches may transition in and out of resting at any time. Unless the view wants resting touches, began \/ ended events are simulated as touches transition from resting to active and vice versa.\n\nThe default value of this property is [doc:\/\/com.apple.documentation\/documentation\/Swift\/false], which indicates that the view does not want resting touches.",
  "platforms" : [
    "macOS"
  ],
  "rawMarkdown" : "---\nsource: https:\/\/developer.apple.com\/documentation\/appkit\/nsview\/wantsrestingtouches\ncrawled: 2025-12-06T02:58:24Z\n---\n\n# wantsRestingTouches\n\n**Instance Property**\n\nA Boolean value indicating whether the view wants resting touches.\n\n## Declaration\n\n```swift\n@MainActor var wantsRestingTouches: Bool { get set }\n```\n\n## Discussion\n\nA resting touch occurs when a user rests their thumb on a device (for example, the glass trackpad of a MacBook). By default, these touches are not delivered and are not included in the event’s set of touches. Touches may transition in and out of resting at any time. Unless the view wants resting touches, began \/ ended events are simulated as touches transition from resting to active and vice versa.\n\nThe default value of this property is [doc:\/\/com.apple.documentation\/documentation\/Swift\/false], which indicates that the view does not want resting touches.\n\n## Handling Touch Events\n\n- **allowedTouchTypes**: The types of touch interactions the view allows.\n- **candidateListTouchBarItem**\n\n",
  "sections" : [
    {
      "content" : "",
      "items" : [
        {
          "description" : "The types of touch interactions the view allows.",
          "name" : "allowedTouchTypes",
          "url" : "https:\/\/developer.apple.com\/documentation\/AppKit\/NSView\/allowedTouchTypes"
        },
        {
          "description" : "",
          "name" : "candidateListTouchBarItem",
          "url" : "https:\/\/developer.apple.com\/documentation\/AppKit\/NSView\/candidateListTouchBarItem"
        }
      ],
      "title" : "Handling Touch Events"
    }
  ],
  "source" : "appleJSON",
  "title" : "wantsRestingTouches",
  "url" : "https:\/\/developer.apple.com\/documentation\/appkit\/nsview\/wantsrestingtouches"
}