{
  "abstract" : "Creates a new switch control with the provided descriptor, and adds it to the touch controller.",
  "codeExamples" : [

  ],
  "contentHash" : "bd59667266e631ecc328151ff89d4a35bdf6415ddafb3c1d24341b3430a0b317",
  "crawledAt" : "2025-12-04T02:13:28Z",
  "declaration" : {
    "code" : "func addSwitch(descriptor: TCSwitchDescriptor) -> TCSwitch",
    "language" : "swift"
  },
  "id" : "3875CA92-8775-41E1-8C53-93493F29771D",
  "kind" : "method",
  "language" : "swift",
  "module" : "Touch Controller",
  "overview" : "## Return Value\n\nA new `TCSwitch` instance.",
  "platforms" : [
    "iOS",
    "iPadOS",
    "Mac Catalyst"
  ],
  "rawMarkdown" : "---\nsource: https:\/\/developer.apple.com\/documentation\/TouchController\/TCTouchController\/addSwitch(descriptor:)\ncrawled: 2025-12-04T02:13:28Z\n---\n\n# addSwitch(descriptor:)\n\n**Instance Method**\n\nCreates a new switch control with the provided descriptor, and adds it to the touch controller.\n\n## Declaration\n\n```swift\nfunc addSwitch(descriptor: TCSwitchDescriptor) -> TCSwitch\n```\n\n## Parameters\n\n- **descriptor**: The `TCSwitchDescriptor` containing the configuration for the switch.\n\n## Return Value\n\nA new `TCSwitch` instance.\n\n## Adding a switch control\n\n- **TCSwitchDescriptor**: A descriptor for configuring a switch.\n\n",
  "sections" : [
    {
      "content" : "",
      "items" : [
        {
          "description" : "A descriptor for configuring a switch.",
          "name" : "TCSwitchDescriptor",
          "url" : "https:\/\/developer.apple.com\/documentation\/TouchController\/TCSwitchDescriptor"
        }
      ],
      "title" : "Adding a switch control"
    }
  ],
  "source" : "appleJSON",
  "title" : "addSwitch(descriptor:)",
  "url" : "https:\/\/developer.apple.com\/documentation\/TouchController\/TCTouchController\/addSwitch(descriptor:)"
}