{
  "abstract" : "The direction pad contents for the specified label, size, style, and direction.",
  "codeExamples" : [

  ],
  "contentHash" : "2ba58952b3b8b8cb5909d14884155ae3b153f7c497679a7f506b85e5a9b43554",
  "crawledAt" : "2025-12-02T05:44:41Z",
  "declaration" : {
    "code" : "class func directionPadContents(label: TCControlLabel, size: CGSize, style: TCControlContents.DpadElementStyle, direction: TCControlContents.DpadDirection, controller: TCTouchController) -> TCControlContents",
    "language" : "swift"
  },
  "id" : "F798C10B-6D26-4440-8C51-6F1BAE742A0F",
  "kind" : "method",
  "module" : "Touch Controller",
  "overview" : "## Return Value\n\nThe `TCControlContents` for the direction pad.",
  "platforms" : [
    "iOS",
    "iPadOS"
  ],
  "rawMarkdown" : "---\nsource: https:\/\/developer.apple.com\/documentation\/TouchController\/TCControlContents\/directionPadContents(label:size:style:direction:controller:)\ncrawled: 2025-12-02T05:44:41Z\n---\n\n# directionPadContents(label:size:style:direction:controller:)\n\n**Type Method**\n\nThe direction pad contents for the specified label, size, style, and direction.\n\n## Declaration\n\n```swift\nclass func directionPadContents(label: TCControlLabel, size: CGSize, style: TCControlContents.DpadElementStyle, direction: TCControlContents.DpadDirection, controller: TCTouchController) -> TCControlContents\n```\n\n## Parameters\n\n- **label**: The label for the direction pad.\n- **size**: The size of the direction pad in points.\n- **style**: The style of the direction pad.\n- **direction**: The direction of the direction pad visual.\n- **controller**: The touch controller to create control contents for.\n\n## Return Value\n\nThe `TCControlContents` for the direction pad.\n\n## Accessing directional pad contents\n\n- **TCControlContents.DpadDirection**: Defines the direction of a direction pad visual.\n- **TCControlContents.DpadElementStyle**: Defines the visual style of the individual up\/down\/left\/right elements of a direction pad.\n\n",
  "sections" : [
    {
      "content" : "",
      "items" : [
        {
          "description" : "Defines the direction of a direction pad visual.",
          "name" : "TCControlContents.DpadDirection",
          "url" : "https:\/\/developer.apple.com\/documentation\/TouchController\/TCControlContents\/DpadDirection"
        },
        {
          "description" : "Defines the visual style of the individual up\/down\/left\/right elements of a direction pad.",
          "name" : "TCControlContents.DpadElementStyle",
          "url" : "https:\/\/developer.apple.com\/documentation\/TouchController\/TCControlContents\/DpadElementStyle"
        }
      ],
      "title" : "Accessing directional pad contents"
    }
  ],
  "source" : "appleJSON",
  "title" : "directionPadContents(label:size:style:direction:controller:)",
  "url" : "https:\/\/developer.apple.com\/documentation\/TouchController\/TCControlContents\/directionPadContents(label:size:style:direction:controller:)"
}