{
  "abstract" : "The button contents for the specified system image name, size, and shape.",
  "codeExamples" : [

  ],
  "contentHash" : "0de3985998bb2e2eab97bb558ff9392c031d265a91b00643d08ccb5a25785059",
  "crawledAt" : "2025-12-02T05:44:41Z",
  "declaration" : {
    "code" : "class func buttonContents(forSystemImageNamed imageName: String, size: CGSize, shape: TCControlContents.ButtonShape, controller: TCTouchController) -> TCControlContents",
    "language" : "swift"
  },
  "id" : "F62A297B-5AB0-4548-9038-88D295814220",
  "kind" : "method",
  "module" : "Touch Controller",
  "overview" : "## Return Value\n\nThe `TCControlContents` for the button.",
  "platforms" : [
    "iOS",
    "iPadOS"
  ],
  "rawMarkdown" : "---\nsource: https:\/\/developer.apple.com\/documentation\/TouchController\/TCControlContents\/buttonContents(forSystemImageNamed:size:shape:controller:)\ncrawled: 2025-12-02T05:44:41Z\n---\n\n# buttonContents(forSystemImageNamed:size:shape:controller:)\n\n**Type Method**\n\nThe button contents for the specified system image name, size, and shape.\n\n## Declaration\n\n```swift\nclass func buttonContents(forSystemImageNamed imageName: String, size: CGSize, shape: TCControlContents.ButtonShape, controller: TCTouchController) -> TCControlContents\n```\n\n## Parameters\n\n- **imageName**: The name of the system image to use for the button.\n- **size**: The size of the button in points.\n- **shape**: The shape of the button.\n- **controller**: The touch controller to create control contents for.\n\n## Return Value\n\nThe `TCControlContents` for the button.\n\n## Accessing button contents\n\n- **TCControlContents.ButtonShape**: Defines the visual shape of a button.\n\n",
  "sections" : [
    {
      "content" : "",
      "items" : [
        {
          "description" : "Defines the visual shape of a button.",
          "name" : "TCControlContents.ButtonShape",
          "url" : "https:\/\/developer.apple.com\/documentation\/TouchController\/TCControlContents\/ButtonShape"
        }
      ],
      "title" : "Accessing button contents"
    }
  ],
  "source" : "appleJSON",
  "title" : "buttonContents(forSystemImageNamed:size:shape:controller:)",
  "url" : "https:\/\/developer.apple.com\/documentation\/TouchController\/TCControlContents\/buttonContents(forSystemImageNamed:size:shape:controller:)"
}