{
  "abstract" : "The throttle indicator contents for the specified size.",
  "codeExamples" : [

  ],
  "contentHash" : "4449cac497fc85e4cf7ca565ab5cfd4b575c74add6ca25bb0b9c777aba323b71",
  "crawledAt" : "2025-12-04T00:42:41Z",
  "declaration" : {
    "code" : "class func throttleIndicatorContents(size: CGSize, controller: TCTouchController) -> TCControlContents",
    "language" : "swift"
  },
  "id" : "95B2CD4B-52D5-4D88-8D94-D3D7B9AD5398",
  "kind" : "method",
  "language" : "swift",
  "module" : "Touch Controller",
  "overview" : "## Return Value\n\nThe `TCControlContents` for the throttle indicator.",
  "platforms" : [
    "iOS",
    "iPadOS",
    "Mac Catalyst"
  ],
  "rawMarkdown" : "---\nsource: https:\/\/developer.apple.com\/documentation\/TouchController\/TCControlContents\/throttleIndicatorContents(size:controller:)\ncrawled: 2025-12-04T00:42:41Z\n---\n\n# throttleIndicatorContents(size:controller:)\n\n**Type Method**\n\nThe throttle indicator contents for the specified size.\n\n## Declaration\n\n```swift\nclass func throttleIndicatorContents(size: CGSize, controller: TCTouchController) -> TCControlContents\n```\n\n## Parameters\n\n- **size**: The size of the throttle indicator in points.\n- **controller**: The touch controller to create control contents for.\n\n## Return Value\n\nThe `TCControlContents` for the throttle indicator.\n\n## Accessing throttle contents\n\n- **throttleBackgroundContents(size:controller:)**: The throttle background contents for the specified size.\n\n",
  "sections" : [
    {
      "content" : "",
      "items" : [
        {
          "description" : "The throttle background contents for the specified size.",
          "name" : "throttleBackgroundContents(size:controller:)",
          "url" : "https:\/\/developer.apple.com\/documentation\/TouchController\/TCControlContents\/throttleBackgroundContents(size:controller:)"
        }
      ],
      "title" : "Accessing throttle contents"
    }
  ],
  "source" : "appleJSON",
  "title" : "throttleIndicatorContents(size:controller:)",
  "url" : "https:\/\/developer.apple.com\/documentation\/TouchController\/TCControlContents\/throttleIndicatorContents(size:controller:)"
}