{
  "abstract" : "A secure token that you use to delete a Store and Forward batch.",
  "codeExamples" : [

  ],
  "conformsTo" : [
    "Equatable",
    "Hashable",
    "RawRepresentable",
    "Sendable",
    "SendableMetatype"
  ],
  "contentHash" : "9057b717fc9e161013f87d2e35b3c682c0575739d9fa0d146cca90692bdecd3c",
  "crawledAt" : "2025-12-01T09:15:27Z",
  "declaration" : {
    "code" : "struct StoreAndForwardBatchDeletionToken",
    "language" : "swift"
  },
  "id" : "387C768D-2DE6-433F-B5BF-678C727C7C2F",
  "kind" : "struct",
  "module" : "ProximityReader",
  "overview" : "## Overview\n\nA `StoreAndForwardBatchDeletionToken` holds the token  your payment service provider supplies when they successfully send a batch of Store and Forward payments for processing.\n\nAfter receiving the raw token data from your provider, create an instance of this structure and pass it to the [doc:\/\/com.apple.ProximityReader\/documentation\/ProximityReader\/PaymentCardReaderStore\/resolveBatch(batchDeletionToken:)] method. When resolving a Store and Forward batch, the [doc:\/\/com.apple.ProximityReader\/documentation\/ProximityReader\/PaymentCardReaderStore] uses this token to verify that the payments were delivered to the payment service provider and can now be deleted.",
  "platforms" : [
    "iOS",
    "Mac Catalyst"
  ],
  "rawMarkdown" : "---\nsource: https:\/\/developer.apple.com\/documentation\/ProximityReader\/StoreAndForwardBatchDeletionToken\ncrawled: 2025-12-01T09:15:27Z\n---\n\n# StoreAndForwardBatchDeletionToken\n\n**Structure**\n\nA secure token that you use to delete a Store and Forward batch.\n\n## Declaration\n\n```swift\nstruct StoreAndForwardBatchDeletionToken\n```\n\n## Overview\n\nA `StoreAndForwardBatchDeletionToken` holds the token  your payment service provider supplies when they successfully send a batch of Store and Forward payments for processing.\n\nAfter receiving the raw token data from your provider, create an instance of this structure and pass it to the [doc:\/\/com.apple.ProximityReader\/documentation\/ProximityReader\/PaymentCardReaderStore\/resolveBatch(batchDeletionToken:)] method. When resolving a Store and Forward batch, the [doc:\/\/com.apple.ProximityReader\/documentation\/ProximityReader\/PaymentCardReaderStore] uses this token to verify that the payments were delivered to the payment service provider and can now be deleted.\n\n## Creating a token\n\n- **init(rawValue:)**: Creates a token with the string your payment service provider provides.\n\n## Getting the token value\n\n- **rawValue**: The raw token string your payment service provider supplies.\n\n## Store and Forward mode\n\n- **StoreAndForwardBatch**: A structure that stores the data to send to the payment service provider to process.\n- **StoreAndForwardPaymentCardReaderSession**: The object you use to start reading a contactless payment or loyalty card in Store and Forward mode.\n- **StoreAndForwardStatus**: A structure that describes the Store and Forward session status.\n- **PaymentCardReaderStore**: A structure that manages the store that contains all the Store and Forward reads.\n\n## Conforms To\n\n- Equatable\n- Hashable\n- RawRepresentable\n- Sendable\n- SendableMetatype\n\n",
  "sections" : [
    {
      "content" : "",
      "items" : [
        {
          "description" : "Creates a token with the string your payment service provider provides.",
          "name" : "init(rawValue:)",
          "url" : "https:\/\/developer.apple.com\/documentation\/ProximityReader\/StoreAndForwardBatchDeletionToken\/init(rawValue:)"
        }
      ],
      "title" : "Creating a token"
    },
    {
      "content" : "",
      "items" : [
        {
          "description" : "The raw token string your payment service provider supplies.",
          "name" : "rawValue",
          "url" : "https:\/\/developer.apple.com\/documentation\/ProximityReader\/StoreAndForwardBatchDeletionToken\/rawValue"
        }
      ],
      "title" : "Getting the token value"
    },
    {
      "content" : "",
      "items" : [
        {
          "description" : "A structure that stores the data to send to the payment service provider to process.",
          "name" : "StoreAndForwardBatch",
          "url" : "https:\/\/developer.apple.com\/documentation\/ProximityReader\/StoreAndForwardBatch"
        },
        {
          "description" : "The object you use to start reading a contactless payment or loyalty card in Store and Forward mode.",
          "name" : "StoreAndForwardPaymentCardReaderSession",
          "url" : "https:\/\/developer.apple.com\/documentation\/ProximityReader\/StoreAndForwardPaymentCardReaderSession"
        },
        {
          "description" : "A structure that describes the Store and Forward session status.",
          "name" : "StoreAndForwardStatus",
          "url" : "https:\/\/developer.apple.com\/documentation\/ProximityReader\/StoreAndForwardStatus"
        },
        {
          "description" : "A structure that manages the store that contains all the Store and Forward reads.",
          "name" : "PaymentCardReaderStore",
          "url" : "https:\/\/developer.apple.com\/documentation\/ProximityReader\/PaymentCardReaderStore"
        }
      ],
      "title" : "Store and Forward mode"
    }
  ],
  "source" : "appleJSON",
  "title" : "StoreAndForwardBatchDeletionToken",
  "url" : "https:\/\/developer.apple.com\/documentation\/ProximityReader\/StoreAndForwardBatchDeletionToken"
}