{
  "abstract" : "An object for configuring mobile document reading on the current device.",
  "codeExamples" : [

  ],
  "conformsTo" : [
    "Sendable",
    "SendableMetatype"
  ],
  "contentHash" : "ad58b011c2669f0e42f7e4d5712177c65097c1fb84d50838e01dcc98bf1d764f",
  "crawledAt" : "2025-12-02T15:48:03Z",
  "declaration" : {
    "code" : "final class MobileDocumentReader",
    "language" : "swift"
  },
  "id" : "466DAEE6-3B2A-43B0-9129-651A7F9A0785",
  "kind" : "class",
  "language" : "swift",
  "module" : "ProximityReader",
  "overview" : "## Overview\n\nAfter creating the `MobileDocumentReader` object, call [doc:\/\/com.apple.ProximityReader\/documentation\/ProximityReader\/MobileDocumentReader\/prepare(using:)] to prepare the device for mobile document reading. Use the returned [doc:\/\/com.apple.ProximityReader\/documentation\/ProximityReader\/MobileDocumentReaderSession] object to read mobile documents.\n\nYou can optionally display your brand’s name and logo during a mobile document read. To do this, your server needs to generate a reader token, then pass the token as an argument to the [doc:\/\/com.apple.ProximityReader\/documentation\/ProximityReader\/MobileDocumentReader\/prepare(using:)] method.",
  "platforms" : [
    "iOS",
    "Mac Catalyst"
  ],
  "rawMarkdown" : "---\nsource: https:\/\/developer.apple.com\/documentation\/ProximityReader\/MobileDocumentReader\ncrawled: 2025-12-02T15:48:03Z\n---\n\n# MobileDocumentReader\n\n**Class**\n\nAn object for configuring mobile document reading on the current device.\n\n## Declaration\n\n```swift\nfinal class MobileDocumentReader\n```\n\n## Overview\n\nAfter creating the `MobileDocumentReader` object, call [doc:\/\/com.apple.ProximityReader\/documentation\/ProximityReader\/MobileDocumentReader\/prepare(using:)] to prepare the device for mobile document reading. Use the returned [doc:\/\/com.apple.ProximityReader\/documentation\/ProximityReader\/MobileDocumentReaderSession] object to read mobile documents.\n\nYou can optionally display your brand’s name and logo during a mobile document read. To do this, your server needs to generate a reader token, then pass the token as an argument to the [doc:\/\/com.apple.ProximityReader\/documentation\/ProximityReader\/MobileDocumentReader\/prepare(using:)] method.\n\n## Creating a mobile document reader\n\n- **init()**: Creates a mobile document reader.\n\n## Getting the feature availability\n\n- **isSupported**: A Boolean value that indicates whether the device supports mobile document reading.\n\n## Preparing the device for reading mobile documents\n\n- **prepare(using:)**: Configures the device to read mobile documents.\n- **MobileDocumentReader.Token**: A reader token generated by your server.\n\n## Retrieving the reader configuration\n\n- **configuration**: The configuration of the mobile document reader.\n- **MobileDocumentReader.Configuration**: A type that represents the configuration of the mobile document reader.\n\n## Mobile document reader\n\n- **Adopting the Verifier API in your iPhone app**: Configure and test ID Verifier support in your app for reading mobile documents.\n- **Generating reader tokens for the Verifier API**: Configure your server to generate reader tokens to prepare a device for mobile document reading.\n- **Checking IDs with the Verifier API**: Read and verify mobile driver’s license information without any additional hardware.\n- **MobileDocumentReaderSession**: The object you use to start reading a mobile document.\n\n## Conforms To\n\n- Sendable\n- SendableMetatype\n\n",
  "sections" : [
    {
      "content" : "",
      "items" : [
        {
          "description" : "Creates a mobile document reader.",
          "name" : "init()",
          "url" : "https:\/\/developer.apple.com\/documentation\/ProximityReader\/MobileDocumentReader\/init()"
        }
      ],
      "title" : "Creating a mobile document reader"
    },
    {
      "content" : "",
      "items" : [
        {
          "description" : "A Boolean value that indicates whether the device supports mobile document reading.",
          "name" : "isSupported",
          "url" : "https:\/\/developer.apple.com\/documentation\/ProximityReader\/MobileDocumentReader\/isSupported"
        }
      ],
      "title" : "Getting the feature availability"
    },
    {
      "content" : "",
      "items" : [
        {
          "description" : "Configures the device to read mobile documents.",
          "name" : "prepare(using:)",
          "url" : "https:\/\/developer.apple.com\/documentation\/ProximityReader\/MobileDocumentReader\/prepare(using:)"
        },
        {
          "description" : "A reader token generated by your server.",
          "name" : "MobileDocumentReader.Token",
          "url" : "https:\/\/developer.apple.com\/documentation\/ProximityReader\/MobileDocumentReader\/Token"
        }
      ],
      "title" : "Preparing the device for reading mobile documents"
    },
    {
      "content" : "",
      "items" : [
        {
          "description" : "The configuration of the mobile document reader.",
          "name" : "configuration",
          "url" : "https:\/\/developer.apple.com\/documentation\/ProximityReader\/MobileDocumentReader\/configuration-swift.property"
        },
        {
          "description" : "A type that represents the configuration of the mobile document reader.",
          "name" : "MobileDocumentReader.Configuration",
          "url" : "https:\/\/developer.apple.com\/documentation\/ProximityReader\/MobileDocumentReader\/Configuration-swift.struct"
        }
      ],
      "title" : "Retrieving the reader configuration"
    },
    {
      "content" : "",
      "items" : [
        {
          "description" : "Configure and test ID Verifier support in your app for reading mobile documents.",
          "name" : "Adopting the Verifier API in your iPhone app",
          "url" : "https:\/\/developer.apple.com\/documentation\/ProximityReader\/adopting-the-verifier-api-in-your-iphone-app"
        },
        {
          "description" : "Configure your server to generate reader tokens to prepare a device for mobile document reading.",
          "name" : "Generating reader tokens for the Verifier API",
          "url" : "https:\/\/developer.apple.com\/documentation\/ProximityReader\/generating-reader-tokens-for-the-verifier-api"
        },
        {
          "description" : "Read and verify mobile driver’s license information without any additional hardware.",
          "name" : "Checking IDs with the Verifier API",
          "url" : "https:\/\/developer.apple.com\/documentation\/ProximityReader\/checking-ids-with-the-verifier-api"
        },
        {
          "description" : "The object you use to start reading a mobile document.",
          "name" : "MobileDocumentReaderSession",
          "url" : "https:\/\/developer.apple.com\/documentation\/ProximityReader\/MobileDocumentReaderSession"
        }
      ],
      "title" : "Mobile document reader"
    }
  ],
  "source" : "appleJSON",
  "title" : "MobileDocumentReader",
  "url" : "https:\/\/developer.apple.com\/documentation\/ProximityReader\/MobileDocumentReader"
}