{
  "abstract" : "Presents a sheet to read a loyalty card for Value Added Services (VAS), and returns the loyalty card data.",
  "codeExamples" : [

  ],
  "contentHash" : "b3e77265c15bccc22dd5865eb96b03b0a6ea7e90f9d56e5751f3a9a638fa1964",
  "crawledAt" : "2025-12-07T14:40:26Z",
  "declaration" : {
    "code" : "func readVAS(_ request: VASRequest) async throws -> VASReadResult",
    "language" : "swift"
  },
  "id" : "83FB5543-AB7C-46EC-AE4A-2FB044D278E1",
  "kind" : "method",
  "language" : "swift",
  "module" : "ProximityReader",
  "overview" : "## Return Value\n\nA [doc:\/\/com.apple.ProximityReader\/documentation\/ProximityReader\/VASReadResult] if the read operation was successful.\n\n## Discussion\n\nCall this method to read the data from a loyalty card. When you call this method, the system displays UI with instructions on what the person needs to do. This UI remains onscreen until the system reads the person’s card, you cancel the operation, or an error occurs.",
  "platforms" : [
    "iOS",
    "iPadOS",
    "Mac Catalyst"
  ],
  "rawMarkdown" : "---\nsource: https:\/\/developer.apple.com\/documentation\/proximityreader\/paymentcardreadersession\/readvas(_:)\ncrawled: 2025-12-07T14:40:26Z\n---\n\n# readVAS(_:)\n\n**Instance Method**\n\nPresents a sheet to read a loyalty card for Value Added Services (VAS), and returns the loyalty card data.\n\n## Declaration\n\n```swift\nfunc readVAS(_ request: VASRequest) async throws -> VASReadResult\n```\n\n## Parameters\n\n- **request**: The object that you use to specify the request details, such as the list of supported merchants.\n\n## Return Value\n\nA [doc:\/\/com.apple.ProximityReader\/documentation\/ProximityReader\/VASReadResult] if the read operation was successful.\n\n## Discussion\n\nCall this method to read the data from a loyalty card. When you call this method, the system displays UI with instructions on what the person needs to do. This UI remains onscreen until the system reads the person’s card, you cancel the operation, or an error occurs.\n\n\n\n## Reading a loyalty card\n\n- **readPaymentCard(_:vasRequest:stopOnVASResult:)**: Presents a sheet to read both contactless payments and loyalty cards for a purchase or refund, and returns the relevant card data.\n\n",
  "sections" : [
    {
      "content" : "",
      "items" : [
        {
          "description" : "Presents a sheet to read both contactless payments and loyalty cards for a purchase or refund, and returns the relevant card data.",
          "name" : "readPaymentCard(_:vasRequest:stopOnVASResult:)",
          "url" : "https:\/\/developer.apple.com\/documentation\/ProximityReader\/PaymentCardReaderSession\/readPaymentCard(_:vasRequest:stopOnVASResult:)"
        }
      ],
      "title" : "Reading a loyalty card"
    }
  ],
  "source" : "appleJSON",
  "title" : "readVAS(_:)",
  "url" : "https:\/\/developer.apple.com\/documentation\/proximityreader\/paymentcardreadersession\/readvas(_:)"
}