{
  "abstract" : "Returns the result of multiplying this matrix by a given matrix that is on the right.",
  "codeExamples" : [

  ],
  "contentHash" : "35c88064f82eb1498f699080cbafffcd669312669a0b934c17b2a0760636a447",
  "crawledAt" : "2025-12-07T10:43:20Z",
  "declaration" : {
    "code" : "WebKitCSSMatrix multiply(\n    optional WebKitCSSMatrix? secondMatrix\n);",
    "language" : "swift"
  },
  "id" : "B17C2DE7-1E48-4D06-89B3-B84CD988747B",
  "kind" : "method",
  "language" : "data",
  "module" : "WebKit JS",
  "overview" : "## Return Value\n\nA new matrix that is the result of multiplying this matrix by the given matrix.\n\n## Discussion\n\nThe given matrix is on the right of the multiplication. This matrix is not modified by this method.",
  "platforms" : [
    "Safari Desktop",
    "Safari Mobile"
  ],
  "rawMarkdown" : "---\nsource: https:\/\/developer.apple.com\/documentation\/webkitjs\/webkitcssmatrix\/1631528-multiply\ncrawled: 2025-12-07T10:43:20Z\n---\n\n# multiply\n\n**Instance Method**\n\nReturns the result of multiplying this matrix by a given matrix that is on the right.\n\n## Declaration\n\n```swift\nWebKitCSSMatrix multiply(\n    optional WebKitCSSMatrix? secondMatrix\n);\n```\n\n## Parameters\n\n- **secondMatrix**: The matrix to multiply.\n\n## Return Value\n\nA new matrix that is the result of multiplying this matrix by the given matrix.\n\n## Discussion\n\nThe given matrix is on the right of the multiplication. This matrix is not modified by this method.\n\n## Applying Operations\n\n- **inverse**: Returns the inverse of this matrix.\n- **translate**: Returns the result of translating this matrix by a given vector.\n- **scale**: Returns the result of scaling this matrix by a given vector.\n- **rotate**: Returns the result of rotating this matrix by a given vector.\n- **rotateAxisAngle**: Returns the result of rotating this matrix by a given vector and angle.\n- **skewX**: Specifies a skew transformation along the x-axis by the given angle.\n- **skewY**: Specifies a skew transformation along the y-axis by the given angle.\n\n",
  "sections" : [
    {
      "content" : "",
      "items" : [
        {
          "description" : "Returns the inverse of this matrix.",
          "name" : "inverse",
          "url" : "https:\/\/developer.apple.com\/documentation\/webkitjs\/webkitcssmatrix\/1633805-inverse"
        },
        {
          "description" : "Returns the result of translating this matrix by a given vector.",
          "name" : "translate",
          "url" : "https:\/\/developer.apple.com\/documentation\/webkitjs\/webkitcssmatrix\/1630758-translate"
        },
        {
          "description" : "Returns the result of scaling this matrix by a given vector.",
          "name" : "scale",
          "url" : "https:\/\/developer.apple.com\/documentation\/webkitjs\/webkitcssmatrix\/1632184-scale"
        },
        {
          "description" : "Returns the result of rotating this matrix by a given vector.",
          "name" : "rotate",
          "url" : "https:\/\/developer.apple.com\/documentation\/webkitjs\/webkitcssmatrix\/1629773-rotate"
        },
        {
          "description" : "Returns the result of rotating this matrix by a given vector and angle.",
          "name" : "rotateAxisAngle",
          "url" : "https:\/\/developer.apple.com\/documentation\/webkitjs\/webkitcssmatrix\/1632317-rotateaxisangle"
        },
        {
          "description" : "Specifies a skew transformation along the x-axis by the given angle.",
          "name" : "skewX",
          "url" : "https:\/\/developer.apple.com\/documentation\/webkitjs\/webkitcssmatrix\/1633353-skewx"
        },
        {
          "description" : "Specifies a skew transformation along the y-axis by the given angle.",
          "name" : "skewY",
          "url" : "https:\/\/developer.apple.com\/documentation\/webkitjs\/webkitcssmatrix\/1631022-skewy"
        }
      ],
      "title" : "Applying Operations"
    }
  ],
  "source" : "appleJSON",
  "title" : "multiply",
  "url" : "https:\/\/developer.apple.com\/documentation\/webkitjs\/webkitcssmatrix\/1631528-multiply"
}