{
  "abstract" : "A string containing font settings, such as the font family, size, and weight.",
  "codeExamples" : [

  ],
  "contentHash" : "b282667e80e618504ccd1d442253236a2290a6d47df131f65bd161c07443f17e",
  "crawledAt" : "2025-12-07T05:28:36Z",
  "declaration" : {
    "code" : "attribute DOMString font;",
    "language" : "swift"
  },
  "id" : "AC6885F5-7C96-4B14-BA0D-24B7AA8FDFD2",
  "kind" : "property",
  "language" : "data",
  "module" : "WebKit JS",
  "overview" : "## Discussion\n\nSet this property to a string specifying all the font properties you wish to set, just as you would the CSS `font` property. Note that you must use the combined (all-in-one) font settings string. Setting individual font properties such as `font-size` is not supported.",
  "platforms" : [
    "Safari Desktop",
    "Safari Mobile"
  ],
  "rawMarkdown" : "---\nsource: https:\/\/developer.apple.com\/documentation\/webkitjs\/canvasrenderingcontext2d\/1632249-font\ncrawled: 2025-12-07T05:28:36Z\n---\n\n# font\n\n**Instance Property**\n\nA string containing font settings, such as the font family, size, and weight.\n\n## Declaration\n\n```swift\nattribute DOMString font;\n```\n\n## Discussion\n\nSet this property to a string specifying all the font properties you wish to set, just as you would the CSS `font` property. Note that you must use the combined (all-in-one) font settings string. Setting individual font properties such as `font-size` is not supported.\n\n## Drawing Text\n\n- **fillText**: Draws a line of text at the specified x,y coordinates, optionally scaled to a specified maximum width.\n- **measureText**: Determines the width of the bounding box required to render the specified text with the current font settings.\n- **strokeText**: Draws a line of text in outline at the specified x,y coordinates, optionally limited to a specified maximum width.\n- **textAlign**: A string that specifies whether text is left-justified, right-justified, or centered.\n- **textBaseline**: A string that specifies how the bounding box aligns vertically relative to the y-coordinate.\n\n",
  "sections" : [
    {
      "content" : "",
      "items" : [
        {
          "description" : "Draws a line of text at the specified x,y coordinates, optionally scaled to a specified maximum width.",
          "name" : "fillText",
          "url" : "https:\/\/developer.apple.com\/documentation\/webkitjs\/canvasrenderingcontext2d\/1634243-filltext"
        },
        {
          "description" : "Determines the width of the bounding box required to render the specified text with the current font settings.",
          "name" : "measureText",
          "url" : "https:\/\/developer.apple.com\/documentation\/webkitjs\/canvasrenderingcontext2d\/1631690-measuretext"
        },
        {
          "description" : "Draws a line of text in outline at the specified x,y coordinates, optionally limited to a specified maximum width.",
          "name" : "strokeText",
          "url" : "https:\/\/developer.apple.com\/documentation\/webkitjs\/canvasrenderingcontext2d\/1630188-stroketext"
        },
        {
          "description" : "A string that specifies whether text is left-justified, right-justified, or centered.",
          "name" : "textAlign",
          "url" : "https:\/\/developer.apple.com\/documentation\/webkitjs\/canvasrenderingcontext2d\/1631811-textalign"
        },
        {
          "description" : "A string that specifies how the bounding box aligns vertically relative to the y-coordinate.",
          "name" : "textBaseline",
          "url" : "https:\/\/developer.apple.com\/documentation\/webkitjs\/canvasrenderingcontext2d\/1629692-textbaseline"
        }
      ],
      "title" : "Drawing Text"
    }
  ],
  "source" : "appleJSON",
  "title" : "font",
  "url" : "https:\/\/developer.apple.com\/documentation\/webkitjs\/canvasrenderingcontext2d\/1632249-font"
}