{
  "abstract" : "A DOMString value that gives a hint to the browser how much of the media should be fetched when the webpage is loaded.",
  "codeExamples" : [

  ],
  "contentHash" : "5dba1ee9c67ad5e7092ae7ab2f70c95629ff536ef8f1674e5343f58c47160a79",
  "crawledAt" : "2025-12-07T07:11:43Z",
  "declaration" : {
    "code" : "attribute DOMString preload;",
    "language" : "swift"
  },
  "id" : "CC808170-85F8-451B-9A33-DF7BAED73B23",
  "kind" : "property",
  "language" : "data",
  "module" : "WebKit JS",
  "overview" : "## Discussion\n\nPossible values are `auto`, `metadata`, and `none`. The attribute defaults to `auto`, suggesting to the browser the server is able to provide the media for immediate and agressive downloading. The `metadata` value suggests minimal server interaction to retrieve only metadata and the first frames of the media resource, while `none` suggests no server interaction is needed. These `preload` values can be changed dynamically. There is no guarantee that you get the behavior that you request.",
  "platforms" : [
    "Safari Desktop",
    "Safari Mobile"
  ],
  "rawMarkdown" : "---\nsource: https:\/\/developer.apple.com\/documentation\/webkitjs\/htmlmediaelement\/1633059-preload\ncrawled: 2025-12-07T07:11:43Z\n---\n\n# preload\n\n**Instance Property**\n\nA DOMString value that gives a hint to the browser how much of the media should be fetched when the webpage is loaded.\n\n## Declaration\n\n```swift\nattribute DOMString preload;\n```\n\n## Discussion\n\nPossible values are `auto`, `metadata`, and `none`. The attribute defaults to `auto`, suggesting to the browser the server is able to provide the media for immediate and agressive downloading. The `metadata` value suggests minimal server interaction to retrieve only metadata and the first frames of the media resource, while `none` suggests no server interaction is needed. These `preload` values can be changed dynamically. There is no guarantee that you get the behavior that you request.\n\n## Getting and Setting Properties\n\n- **autoplay**: A Boolean value that determines whether the media resource plays automatically when available.\n- **controls**: A Boolean value that determines whether the playback controls appear.\n- **currentTime**: The current playback position in seconds.\n- **defaultPlaybackRate**: The default rate used to play the media resource.\n- **loop**: A Boolean value that determines whether the playback should loop.\n- **muted**: A Boolean value that determines whether the audio content should be muted.\n- **playbackRate**: The speed that the media resource is playing.\n- **src**: The URI address of the media resource to play.\n- **volume**: The volume of the audio portion of the media element.\n\n",
  "sections" : [
    {
      "content" : "",
      "items" : [
        {
          "description" : "A Boolean value that determines whether the media resource plays automatically when available.",
          "name" : "autoplay",
          "url" : "https:\/\/developer.apple.com\/documentation\/webkitjs\/htmlmediaelement\/1629662-autoplay"
        },
        {
          "description" : "A Boolean value that determines whether the playback controls appear.",
          "name" : "controls",
          "url" : "https:\/\/developer.apple.com\/documentation\/webkitjs\/htmlmediaelement\/1631980-controls"
        },
        {
          "description" : "The current playback position in seconds.",
          "name" : "currentTime",
          "url" : "https:\/\/developer.apple.com\/documentation\/webkitjs\/htmlmediaelement\/1631307-currenttime"
        },
        {
          "description" : "The default rate used to play the media resource.",
          "name" : "defaultPlaybackRate",
          "url" : "https:\/\/developer.apple.com\/documentation\/webkitjs\/htmlmediaelement\/1631650-defaultplaybackrate"
        },
        {
          "description" : "A Boolean value that determines whether the playback should loop.",
          "name" : "loop",
          "url" : "https:\/\/developer.apple.com\/documentation\/webkitjs\/htmlmediaelement\/1633760-loop"
        },
        {
          "description" : "A Boolean value that determines whether the audio content should be muted.",
          "name" : "muted",
          "url" : "https:\/\/developer.apple.com\/documentation\/webkitjs\/htmlmediaelement\/1630580-muted"
        },
        {
          "description" : "The speed that the media resource is playing.",
          "name" : "playbackRate",
          "url" : "https:\/\/developer.apple.com\/documentation\/webkitjs\/htmlmediaelement\/1629746-playbackrate"
        },
        {
          "description" : "The URI address of the media resource to play.",
          "name" : "src",
          "url" : "https:\/\/developer.apple.com\/documentation\/webkitjs\/htmlmediaelement\/1629312-src"
        },
        {
          "description" : "The volume of the audio portion of the media element.",
          "name" : "volume",
          "url" : "https:\/\/developer.apple.com\/documentation\/webkitjs\/htmlmediaelement\/1631549-volume"
        }
      ],
      "title" : "Getting and Setting Properties"
    }
  ],
  "source" : "appleJSON",
  "title" : "preload",
  "url" : "https:\/\/developer.apple.com\/documentation\/webkitjs\/htmlmediaelement\/1633059-preload"
}