{
  "abstract" : "Draws a line of text in outline at the specified x,y coordinates, optionally limited to a specified maximum width.",
  "codeExamples" : [

  ],
  "contentHash" : "1ea2fb9d6ca91cb08216254710e2c090f56e849ace89c9c661e02ee5e0731e64",
  "crawledAt" : "2025-12-07T05:28:37Z",
  "declaration" : {
    "code" : "void strokeText(\n    DOMString text, \n    unrestricted float x, \n    unrestricted float y, \n    optional unrestricted float maxWidth\n);",
    "language" : "swift"
  },
  "id" : "2BD39B4F-48EB-4118-BA82-FD9DA85892D9",
  "kind" : "method",
  "language" : "data",
  "module" : "WebKit JS",
  "overview" : "## Discussion\n\nThe `x`, `y`, and `maxWidth` parameter values are in the canvas’s current coordinate system, subject to the current transformation matrix (rotation, scale, and so on).",
  "platforms" : [
    "Safari Desktop",
    "Safari Mobile"
  ],
  "rawMarkdown" : "---\nsource: https:\/\/developer.apple.com\/documentation\/webkitjs\/canvasrenderingcontext2d\/1630188-stroketext\ncrawled: 2025-12-07T05:28:37Z\n---\n\n# strokeText\n\n**Instance Method**\n\nDraws a line of text in outline at the specified x,y coordinates, optionally limited to a specified maximum width.\n\n## Declaration\n\n```swift\nvoid strokeText(\n    DOMString text, \n    unrestricted float x, \n    unrestricted float y, \n    optional unrestricted float maxWidth\n);\n```\n\n## Parameters\n\n- **text**: A string containing the text to draw.\n- **x**: The x-coordinate of the `textAlign` point (the left edge, right edge, or center of the text).\n- **y**: The y-coordinate of the `textBaseline` point.\n- **maxWidth**: The maximum width of the string, in pixels. This parameter is optional. If omitted, the string is drawn in the current font style; any text falling outside the canvas clipping region is clipped. If this parameter is provided, and the text would exceed the specified width, the text is scaled down until it fits within the specified width.\n\n## Discussion\n\nThe `x`, `y`, and `maxWidth` parameter values are in the canvas’s current coordinate system, subject to the current transformation matrix (rotation, scale, and so on).\n\n## Drawing Text\n\n- **fillText**: Draws a line of text at the specified x,y coordinates, optionally scaled to a specified maximum width.\n- **font**: A string containing font settings, such as the font family, size, and weight.\n- **measureText**: Determines the width of the bounding box required to render the specified text with the current font settings.\n- **textAlign**: A string that specifies whether text is left-justified, right-justified, or centered.\n- **textBaseline**: A string that specifies how the bounding box aligns vertically relative to the y-coordinate.\n\n",
  "sections" : [
    {
      "content" : "",
      "items" : [
        {
          "description" : "Draws a line of text at the specified x,y coordinates, optionally scaled to a specified maximum width.",
          "name" : "fillText",
          "url" : "https:\/\/developer.apple.com\/documentation\/webkitjs\/canvasrenderingcontext2d\/1634243-filltext"
        },
        {
          "description" : "A string containing font settings, such as the font family, size, and weight.",
          "name" : "font",
          "url" : "https:\/\/developer.apple.com\/documentation\/webkitjs\/canvasrenderingcontext2d\/1632249-font"
        },
        {
          "description" : "Determines the width of the bounding box required to render the specified text with the current font settings.",
          "name" : "measureText",
          "url" : "https:\/\/developer.apple.com\/documentation\/webkitjs\/canvasrenderingcontext2d\/1631690-measuretext"
        },
        {
          "description" : "A string that specifies whether text is left-justified, right-justified, or centered.",
          "name" : "textAlign",
          "url" : "https:\/\/developer.apple.com\/documentation\/webkitjs\/canvasrenderingcontext2d\/1631811-textalign"
        },
        {
          "description" : "A string that specifies how the bounding box aligns vertically relative to the y-coordinate.",
          "name" : "textBaseline",
          "url" : "https:\/\/developer.apple.com\/documentation\/webkitjs\/canvasrenderingcontext2d\/1629692-textbaseline"
        }
      ],
      "title" : "Drawing Text"
    }
  ],
  "source" : "appleJSON",
  "title" : "strokeText",
  "url" : "https:\/\/developer.apple.com\/documentation\/webkitjs\/canvasrenderingcontext2d\/1630188-stroketext"
}