{
  "abstract" : "Creates a format description for a video media stream.",
  "codeExamples" : [

  ],
  "contentHash" : "5b641d4188b9b658204014499e18f820ad1a138d3e0d1f94df58f624b8cafd61",
  "crawledAt" : "2025-12-08T00:34:03Z",
  "declaration" : {
    "code" : "func CMVideoFormatDescriptionCreate(allocator: CFAllocator?, codecType: CMVideoCodecType, width: Int32, height: Int32, extensions: CFDictionary?, formatDescriptionOut: UnsafeMutablePointer<CMVideoFormatDescription?>) -> OSStatus",
    "language" : "swift"
  },
  "id" : "2C142B32-CA61-4795-80BF-CA0E36DE6BAD",
  "kind" : "function",
  "language" : "swift",
  "module" : "Core Media",
  "overview" : "## Return Value\n\nA result code. Returns `noErr` if successful.\n\n## Discussion\n\nThe caller owns the returned `CMFormatDescription`, and must release it when done with it. All input parameters are copied (the extensions are deep-copied).  The caller can deallocate them or re-use them after making this call.",
  "platforms" : [
    "iOS",
    "iPadOS",
    "Mac Catalyst",
    "macOS",
    "tvOS",
    "visionOS",
    "watchOS"
  ],
  "rawMarkdown" : "---\nsource: https:\/\/developer.apple.com\/documentation\/CoreMedia\/CMVideoFormatDescriptionCreate(allocator:codecType:width:height:extensions:formatDescriptionOut:)\ncrawled: 2025-12-08T00:34:03Z\n---\n\n# CMVideoFormatDescriptionCreate(allocator:codecType:width:height:extensions:formatDescriptionOut:)\n\n**Function**\n\nCreates a format description for a video media stream.\n\n## Declaration\n\n```swift\nfunc CMVideoFormatDescriptionCreate(allocator: CFAllocator?, codecType: CMVideoCodecType, width: Int32, height: Int32, extensions: CFDictionary?, formatDescriptionOut: UnsafeMutablePointer<CMVideoFormatDescription?>) -> OSStatus\n```\n\n## Parameters\n\n- **allocator**: CFAllocator to be used. Pass `kCFAllocatorDefault` or NULL to use the default allocator.\n- **codecType**: The type of video compression.\n- **width**: The width of encoded video.\n- **height**: The height of encoded video.\n- **extensions**: Dictionary of extension key\/value pairs. Keys are always `CFString`.                                                                    Values are always property list objects (ie. `CFData`, `CFString`, `CFArray`,                                                                    `CFDictionary`, `CFDate`, `CFBoolean`, or `CFNumber`). Can be `NULL`.\n- **formatDescriptionOut**: On output, returns newly created video `CMFormatDescription`\n\n## Return Value\n\nA result code. Returns `noErr` if successful.\n\n## Discussion\n\nThe caller owns the returned `CMFormatDescription`, and must release it when done with it. All input parameters are copied (the extensions are deep-copied).  The caller can deallocate them or re-use them after making this call.\n\n## Working with Video Descriptions\n\n- **CMImageDescriptionFlavor**: Types that represent image format descriptions.\n- **CMVideoFormatDescriptionCreateForImageBuffer(allocator:imageBuffer:formatDescriptionOut:)**: Creates a format description for a video media stream by using an image buffer.\n- **CMVideoFormatDescriptionGetCleanAperture(_:originIsAtTopLeft:)**: Returns a rectangle that defines the portion of the encoded pixel dimensions that represent the image data that’s valid for displaying.\n- **CMVideoFormatDescriptionGetDimensions(_:)**: Returns the video dimensions, in encoded pixels.\n- **CMVideoFormatDescriptionGetExtensionKeysCommonWithImageBuffers()**: Returns an array of keys that you use for video format description extensions, image buffer attachments, and attributes.\n- **CMVideoFormatDescriptionGetPresentationDimensions(_:usePixelAspectRatio:useCleanAperture:)**: Returns the dimensions after taking the pixel aspect ratio and clean aperture into account.\n- **CMVideoFormatDescriptionMatchesImageBuffer(_:imageBuffer:)**: Returns a Boolean value that indicates whether a format description matches an image buffer.\n- **CMVideoFormatDescriptionCreateFromH264ParameterSets(allocator:parameterSetCount:parameterSetPointers:parameterSetSizes:nalUnitHeaderLength:formatDescriptionOut:)**: Creates a format description for a video media stream that the parameter set describes.\n- **CMVideoFormatDescriptionCreateFromHEVCParameterSets(allocator:parameterSetCount:parameterSetPointers:parameterSetSizes:nalUnitHeaderLength:extensions:formatDescriptionOut:)**: Creates a format description for a video media stream using HEVC (H.265) parameter set NAL units.\n- **CMVideoFormatDescriptionGetH264ParameterSetAtIndex(_:parameterSetIndex:parameterSetPointerOut:parameterSetSizeOut:parameterSetCountOut:nalUnitHeaderLengthOut:)**: Returns a parameter set that an H.264 format description contains.\n- **CMVideoFormatDescriptionCopyAsBigEndianImageDescriptionBlockBuffer(allocator:videoFormatDescription:stringEncoding:flavor:blockBufferOut:)**: Copies the contents of a video format description to a buffer in big-endian byte ordering.\n- **CMVideoFormatDescriptionCreateFromBigEndianImageDescriptionBlockBuffer(allocator:bigEndianImageDescriptionBlockBuffer:stringEncoding:flavor:formatDescriptionOut:)**: Creates a video format description from a big-endian image description inside a buffer.\n- **CMVideoFormatDescriptionCreateFromBigEndianImageDescriptionData(allocator:bigEndianImageDescriptionData:size:stringEncoding:flavor:formatDescriptionOut:)**: Creates a video format description from a big-endian image description structure.\n- **CMSwapBigEndianImageDescriptionToHost(_:_:)**: Converts an image description data structure from big-endian to host-endian, in place.\n- **CMSwapHostEndianImageDescriptionToBig(_:_:)**: Converts an image description data structure from host-endian to big-endian, in place.\n\n",
  "sections" : [
    {
      "content" : "",
      "items" : [
        {
          "description" : "Types that represent image format descriptions.",
          "name" : "CMImageDescriptionFlavor",
          "url" : "https:\/\/developer.apple.com\/documentation\/CoreMedia\/CMImageDescriptionFlavor"
        },
        {
          "description" : "Creates a format description for a video media stream by using an image buffer.",
          "name" : "CMVideoFormatDescriptionCreateForImageBuffer(allocator:imageBuffer:formatDescriptionOut:)",
          "url" : "https:\/\/developer.apple.com\/documentation\/CoreMedia\/CMVideoFormatDescriptionCreateForImageBuffer(allocator:imageBuffer:formatDescriptionOut:)"
        },
        {
          "description" : "Returns a rectangle that defines the portion of the encoded pixel dimensions that represent the image data that’s valid for displaying.",
          "name" : "CMVideoFormatDescriptionGetCleanAperture(_:originIsAtTopLeft:)",
          "url" : "https:\/\/developer.apple.com\/documentation\/CoreMedia\/CMVideoFormatDescriptionGetCleanAperture(_:originIsAtTopLeft:)"
        },
        {
          "description" : "Returns the video dimensions, in encoded pixels.",
          "name" : "CMVideoFormatDescriptionGetDimensions(_:)",
          "url" : "https:\/\/developer.apple.com\/documentation\/CoreMedia\/CMVideoFormatDescriptionGetDimensions(_:)"
        },
        {
          "description" : "Returns an array of keys that you use for video format description extensions, image buffer attachments, and attributes.",
          "name" : "CMVideoFormatDescriptionGetExtensionKeysCommonWithImageBuffers()",
          "url" : "https:\/\/developer.apple.com\/documentation\/CoreMedia\/CMVideoFormatDescriptionGetExtensionKeysCommonWithImageBuffers()"
        },
        {
          "description" : "Returns the dimensions after taking the pixel aspect ratio and clean aperture into account.",
          "name" : "CMVideoFormatDescriptionGetPresentationDimensions(_:usePixelAspectRatio:useCleanAperture:)",
          "url" : "https:\/\/developer.apple.com\/documentation\/CoreMedia\/CMVideoFormatDescriptionGetPresentationDimensions(_:usePixelAspectRatio:useCleanAperture:)"
        },
        {
          "description" : "Returns a Boolean value that indicates whether a format description matches an image buffer.",
          "name" : "CMVideoFormatDescriptionMatchesImageBuffer(_:imageBuffer:)",
          "url" : "https:\/\/developer.apple.com\/documentation\/CoreMedia\/CMVideoFormatDescriptionMatchesImageBuffer(_:imageBuffer:)"
        },
        {
          "description" : "Creates a format description for a video media stream that the parameter set describes.",
          "name" : "CMVideoFormatDescriptionCreateFromH264ParameterSets(allocator:parameterSetCount:parameterSetPointers:parameterSetSizes:nalUnitHeaderLength:formatDescriptionOut:)",
          "url" : "https:\/\/developer.apple.com\/documentation\/CoreMedia\/CMVideoFormatDescriptionCreateFromH264ParameterSets(allocator:parameterSetCount:parameterSetPointers:parameterSetSizes:nalUnitHeaderLength:formatDescriptionOut:)"
        },
        {
          "description" : "Creates a format description for a video media stream using HEVC (H.265) parameter set NAL units.",
          "name" : "CMVideoFormatDescriptionCreateFromHEVCParameterSets(allocator:parameterSetCount:parameterSetPointers:parameterSetSizes:nalUnitHeaderLength:extensions:formatDescriptionOut:)",
          "url" : "https:\/\/developer.apple.com\/documentation\/CoreMedia\/CMVideoFormatDescriptionCreateFromHEVCParameterSets(allocator:parameterSetCount:parameterSetPointers:parameterSetSizes:nalUnitHeaderLength:extensions:formatDescriptionOut:)"
        },
        {
          "description" : "Returns a parameter set that an H.264 format description contains.",
          "name" : "CMVideoFormatDescriptionGetH264ParameterSetAtIndex(_:parameterSetIndex:parameterSetPointerOut:parameterSetSizeOut:parameterSetCountOut:nalUnitHeaderLengthOut:)",
          "url" : "https:\/\/developer.apple.com\/documentation\/CoreMedia\/CMVideoFormatDescriptionGetH264ParameterSetAtIndex(_:parameterSetIndex:parameterSetPointerOut:parameterSetSizeOut:parameterSetCountOut:nalUnitHeaderLengthOut:)"
        },
        {
          "description" : "Copies the contents of a video format description to a buffer in big-endian byte ordering.",
          "name" : "CMVideoFormatDescriptionCopyAsBigEndianImageDescriptionBlockBuffer(allocator:videoFormatDescription:stringEncoding:flavor:blockBufferOut:)",
          "url" : "https:\/\/developer.apple.com\/documentation\/CoreMedia\/CMVideoFormatDescriptionCopyAsBigEndianImageDescriptionBlockBuffer(allocator:videoFormatDescription:stringEncoding:flavor:blockBufferOut:)"
        },
        {
          "description" : "Creates a video format description from a big-endian image description inside a buffer.",
          "name" : "CMVideoFormatDescriptionCreateFromBigEndianImageDescriptionBlockBuffer(allocator:bigEndianImageDescriptionBlockBuffer:stringEncoding:flavor:formatDescriptionOut:)",
          "url" : "https:\/\/developer.apple.com\/documentation\/CoreMedia\/CMVideoFormatDescriptionCreateFromBigEndianImageDescriptionBlockBuffer(allocator:bigEndianImageDescriptionBlockBuffer:stringEncoding:flavor:formatDescriptionOut:)"
        },
        {
          "description" : "Creates a video format description from a big-endian image description structure.",
          "name" : "CMVideoFormatDescriptionCreateFromBigEndianImageDescriptionData(allocator:bigEndianImageDescriptionData:size:stringEncoding:flavor:formatDescriptionOut:)",
          "url" : "https:\/\/developer.apple.com\/documentation\/CoreMedia\/CMVideoFormatDescriptionCreateFromBigEndianImageDescriptionData(allocator:bigEndianImageDescriptionData:size:stringEncoding:flavor:formatDescriptionOut:)"
        },
        {
          "description" : "Converts an image description data structure from big-endian to host-endian, in place.",
          "name" : "CMSwapBigEndianImageDescriptionToHost(_:_:)",
          "url" : "https:\/\/developer.apple.com\/documentation\/CoreMedia\/CMSwapBigEndianImageDescriptionToHost(_:_:)"
        },
        {
          "description" : "Converts an image description data structure from host-endian to big-endian, in place.",
          "name" : "CMSwapHostEndianImageDescriptionToBig(_:_:)",
          "url" : "https:\/\/developer.apple.com\/documentation\/CoreMedia\/CMSwapHostEndianImageDescriptionToBig(_:_:)"
        }
      ],
      "title" : "Working with Video Descriptions"
    }
  ],
  "source" : "appleJSON",
  "title" : "CMVideoFormatDescriptionCreate(allocator:codecType:width:height:extensions:formatDescriptionOut:)",
  "url" : "https:\/\/developer.apple.com\/documentation\/CoreMedia\/CMVideoFormatDescriptionCreate(allocator:codecType:width:height:extensions:formatDescriptionOut:)"
}