{
  "abstract" : "Access restricted areas of the operating system, and control access to particular features of your macOS app.",
  "codeExamples" : [

  ],
  "contentHash" : "738783603ef6ea051c8f2c8cba83f0c5c84b4a6c287ebb31fa4d8857a6c9b7ba",
  "crawledAt" : "2025-12-09T22:36:50Z",
  "id" : "9D196732-F3F6-49B0-BA38-66427D95CCE6",
  "kind" : "collection",
  "language" : "swift",
  "module" : "Security",
  "overview" : "## Overview\n\nThe `Security.Authorization` API is a programming interface to the Security Server and its policy database. This API facilitates access control to restricted areas of the operating system and allows you to restrict a user’s access to particular features in your macOS app. Use authorization services in:\n\nAs shown in the image below, the Security Server is a daemon running in the operating system that provides a trusted implementation of various security protocols, including authorization computation. In turn, the Security Server relies on the Security Agent to interface with users when authentication is needed. Thus an app can verify credentials (usernames and passwords) without ever accessing them directly. This authorization process also allows the means of authentication to change in the future (such as adding Touch ID) without your having to modify your app.\n\n",
  "rawMarkdown" : "---\nsource: https:\/\/developer.apple.com\/documentation\/security\/authorization-services\ncrawled: 2025-12-09T22:36:50Z\n---\n\n# Authorization Services\n\n**API Collection**\n\nAccess restricted areas of the operating system, and control access to particular features of your macOS app.\n\n## Overview\n\nThe `Security.Authorization` API is a programming interface to the Security Server and its policy database. This API facilitates access control to restricted areas of the operating system and allows you to restrict a user’s access to particular features in your macOS app. Use authorization services in:\n\n- Software that restricts access to its own tools\n- Applications that call system tools\n- Software installers that install privileged tools or require access to restricted areas of the operating system\n\nAs shown in the image below, the Security Server is a daemon running in the operating system that provides a trusted implementation of various security protocols, including authorization computation. In turn, the Security Server relies on the Security Agent to interface with users when authentication is needed. Thus an app can verify credentials (usernames and passwords) without ever accessing them directly. This authorization process also allows the means of authentication to change in the future (such as adding Touch ID) without your having to modify your app.\n\n\n\n\n\n\n\n## Authorization References\n\n- **AuthorizationCreate(_:_:_:_:)**: Creates a new authorization reference and provides an option to authorize or preauthorize rights.\n- **AuthorizationFree(_:_:)**: Frees the memory associated with an authorization reference.\n- **AuthorizationFlags**: The flags used to specify authorization options.\n- **AuthorizationRef**: A pointer to an opaque authorization reference structure.\n\n## Authorization Items\n\n- **AuthorizationItem**: A structure containing information about an authorization right or the authorization environment.\n- **AuthorizationItemSet**: A structure containing a set of authorization items.\n- **AuthorizationRights**: An authorization item set designated to represent a set of rights.\n- **AuthorizationEnvironment**: An authorization item set designated to hold environment information relevant to authorization decisions.\n- **Authorization Name Tags**: Use name tags to define authorization security items.\n- **AuthorizationFreeItemSet(_:)**: Frees the memory associated with a set of authorization items.\n\n## Rights and Credentials\n\n- **AuthorizationCopyInfo(_:_:_:)**: Retrieves supporting data such as the user name and other information gathered during evaluation of authorization.\n- **AuthorizationCopyRights(_:_:_:_:_:)**: Authorizes and preauthorizes rights synchronously.\n- **AuthorizationCopyRightsAsync(_:_:_:_:_:)**: Authorizes and preauthorizes rights asynchronously.\n- **AuthorizationAsyncCallback**: A block used as a callback for the asynchronous version of copying authorization rights.\n- **AuthorizationString**: A zero-terminated string in UTF-8 encoding.\n- **Authorization Rights Flags**: Recognize the values the Security Server sets in an authorization item’s flag field.\n\n## Import and Export\n\n- **AuthorizationMakeExternalForm(_:_:)**: Creates an external representation of an authorization reference.\n- **AuthorizationCreateFromExternalForm(_:_:)**: Internalizes the external representation of an authorization reference.\n- **AuthorizationExternalForm**: The external representation of an authorization reference.\n- **kAuthorizationExternalFormLength**: The number of bytes in an external form structure’s array.\n\n## The Policy Database\n\n- **AuthorizationRightGet(_:_:)**: Retrieves a right definition as a dictionary.\n- **AuthorizationRightSet(_:_:_:_:_:_:)**: Creates or updates a right entry in the policy database.\n- **AuthorizationRightRemove(_:_:)**: Removes a right from the policy database.\n- **Policy Database Constants**: Use these constants to set rights and rules in the policy database.\n\n## Result Codes\n\n- **Authorization Services Result Codes**: Recognize result codes specific to the authorization services API.\n\n## Related Documentation\n\n- **Authentication, Authorization, and Permissions Guide**\n- **Authorization Services Programming Guide**\n\n",
  "sections" : [
    {
      "content" : "",
      "items" : [
        {
          "description" : "Creates a new authorization reference and provides an option to authorize or preauthorize rights.",
          "name" : "AuthorizationCreate(_:_:_:_:)",
          "url" : "https:\/\/developer.apple.com\/documentation\/Security\/AuthorizationCreate(_:_:_:_:)"
        },
        {
          "description" : "Frees the memory associated with an authorization reference.",
          "name" : "AuthorizationFree(_:_:)",
          "url" : "https:\/\/developer.apple.com\/documentation\/Security\/AuthorizationFree(_:_:)"
        },
        {
          "description" : "The flags used to specify authorization options.",
          "name" : "AuthorizationFlags",
          "url" : "https:\/\/developer.apple.com\/documentation\/Security\/AuthorizationFlags"
        },
        {
          "description" : "A pointer to an opaque authorization reference structure.",
          "name" : "AuthorizationRef",
          "url" : "https:\/\/developer.apple.com\/documentation\/Security\/AuthorizationRef"
        }
      ],
      "title" : "Authorization References"
    },
    {
      "content" : "",
      "items" : [
        {
          "description" : "A structure containing information about an authorization right or the authorization environment.",
          "name" : "AuthorizationItem",
          "url" : "https:\/\/developer.apple.com\/documentation\/Security\/AuthorizationItem"
        },
        {
          "description" : "A structure containing a set of authorization items.",
          "name" : "AuthorizationItemSet",
          "url" : "https:\/\/developer.apple.com\/documentation\/Security\/AuthorizationItemSet"
        },
        {
          "description" : "An authorization item set designated to represent a set of rights.",
          "name" : "AuthorizationRights",
          "url" : "https:\/\/developer.apple.com\/documentation\/Security\/AuthorizationRights"
        },
        {
          "description" : "An authorization item set designated to hold environment information relevant to authorization decisions.",
          "name" : "AuthorizationEnvironment",
          "url" : "https:\/\/developer.apple.com\/documentation\/Security\/AuthorizationEnvironment"
        },
        {
          "description" : "Use name tags to define authorization security items.",
          "name" : "Authorization Name Tags",
          "url" : "https:\/\/developer.apple.com\/documentation\/Security\/authorization-name-tags"
        },
        {
          "description" : "Frees the memory associated with a set of authorization items.",
          "name" : "AuthorizationFreeItemSet(_:)",
          "url" : "https:\/\/developer.apple.com\/documentation\/Security\/AuthorizationFreeItemSet(_:)"
        }
      ],
      "title" : "Authorization Items"
    },
    {
      "content" : "",
      "items" : [
        {
          "description" : "Retrieves supporting data such as the user name and other information gathered during evaluation of authorization.",
          "name" : "AuthorizationCopyInfo(_:_:_:)",
          "url" : "https:\/\/developer.apple.com\/documentation\/Security\/AuthorizationCopyInfo(_:_:_:)"
        },
        {
          "description" : "Authorizes and preauthorizes rights synchronously.",
          "name" : "AuthorizationCopyRights(_:_:_:_:_:)",
          "url" : "https:\/\/developer.apple.com\/documentation\/Security\/AuthorizationCopyRights(_:_:_:_:_:)"
        },
        {
          "description" : "Authorizes and preauthorizes rights asynchronously.",
          "name" : "AuthorizationCopyRightsAsync(_:_:_:_:_:)",
          "url" : "https:\/\/developer.apple.com\/documentation\/Security\/AuthorizationCopyRightsAsync(_:_:_:_:_:)"
        },
        {
          "description" : "A block used as a callback for the asynchronous version of copying authorization rights.",
          "name" : "AuthorizationAsyncCallback",
          "url" : "https:\/\/developer.apple.com\/documentation\/Security\/AuthorizationAsyncCallback"
        },
        {
          "description" : "A zero-terminated string in UTF-8 encoding.",
          "name" : "AuthorizationString",
          "url" : "https:\/\/developer.apple.com\/documentation\/Security\/AuthorizationString"
        },
        {
          "description" : "Recognize the values the Security Server sets in an authorization item’s flag field.",
          "name" : "Authorization Rights Flags",
          "url" : "https:\/\/developer.apple.com\/documentation\/Security\/authorization-rights-flags"
        }
      ],
      "title" : "Rights and Credentials"
    },
    {
      "content" : "",
      "items" : [
        {
          "description" : "Creates an external representation of an authorization reference.",
          "name" : "AuthorizationMakeExternalForm(_:_:)",
          "url" : "https:\/\/developer.apple.com\/documentation\/Security\/AuthorizationMakeExternalForm(_:_:)"
        },
        {
          "description" : "Internalizes the external representation of an authorization reference.",
          "name" : "AuthorizationCreateFromExternalForm(_:_:)",
          "url" : "https:\/\/developer.apple.com\/documentation\/Security\/AuthorizationCreateFromExternalForm(_:_:)"
        },
        {
          "description" : "The external representation of an authorization reference.",
          "name" : "AuthorizationExternalForm",
          "url" : "https:\/\/developer.apple.com\/documentation\/Security\/AuthorizationExternalForm"
        },
        {
          "description" : "The number of bytes in an external form structure’s array.",
          "name" : "kAuthorizationExternalFormLength",
          "url" : "https:\/\/developer.apple.com\/documentation\/Security\/kAuthorizationExternalFormLength"
        }
      ],
      "title" : "Import and Export"
    },
    {
      "content" : "",
      "items" : [
        {
          "description" : "Retrieves a right definition as a dictionary.",
          "name" : "AuthorizationRightGet(_:_:)",
          "url" : "https:\/\/developer.apple.com\/documentation\/Security\/AuthorizationRightGet(_:_:)"
        },
        {
          "description" : "Creates or updates a right entry in the policy database.",
          "name" : "AuthorizationRightSet(_:_:_:_:_:_:)",
          "url" : "https:\/\/developer.apple.com\/documentation\/Security\/AuthorizationRightSet(_:_:_:_:_:_:)"
        },
        {
          "description" : "Removes a right from the policy database.",
          "name" : "AuthorizationRightRemove(_:_:)",
          "url" : "https:\/\/developer.apple.com\/documentation\/Security\/AuthorizationRightRemove(_:_:)"
        },
        {
          "description" : "Use these constants to set rights and rules in the policy database.",
          "name" : "Policy Database Constants",
          "url" : "https:\/\/developer.apple.com\/documentation\/Security\/policy-database-constants"
        }
      ],
      "title" : "The Policy Database"
    },
    {
      "content" : "",
      "items" : [
        {
          "description" : "Recognize result codes specific to the authorization services API.",
          "name" : "Authorization Services Result Codes",
          "url" : "https:\/\/developer.apple.com\/documentation\/Security\/authorization-services-result-codes"
        }
      ],
      "title" : "Result Codes"
    },
    {
      "content" : "",
      "items" : [
        {
          "name" : "Authentication, Authorization, and Permissions Guide"
        },
        {
          "name" : "Authorization Services Programming Guide"
        }
      ],
      "title" : "Related Documentation"
    }
  ],
  "source" : "appleJSON",
  "title" : "Authorization Services",
  "url" : "https:\/\/developer.apple.com\/documentation\/security\/authorization-services"
}