{
  "abstract" : "Extend the authorization services API by creating plug-ins that can participate in authorization decisions.",
  "codeExamples" : [

  ],
  "contentHash" : "76fdf2a4a4b8eedf31400d004b6896a0e4330d1ffadcdfbcef26407262bbd70e",
  "crawledAt" : "2025-12-09T22:36:50Z",
  "id" : "17DE35EE-EFF7-45E1-B638-1985F6F04F87",
  "kind" : "collection",
  "language" : "swift",
  "module" : "Security",
  "overview" : "## Overview\n\nUse plug-ins to extend macOS authorization services to perform authorizations in a new way or to implement a new policy that is too complex to be implemented entirely with the authorization policy database.\n\nYou must import this API explicitly:",
  "rawMarkdown" : "---\nsource: https:\/\/developer.apple.com\/documentation\/security\/authorization-plug-ins\ncrawled: 2025-12-09T22:36:50Z\n---\n\n# Authorization Plug-ins\n\n**API Collection**\n\nExtend the authorization services API by creating plug-ins that can participate in authorization decisions.\n\n## Overview\n\nUse plug-ins to extend macOS authorization services to perform authorizations in a new way or to implement a new policy that is too complex to be implemented entirely with the authorization policy database.\n\nYou must import this API explicitly:\n\n\n\n\n\n## First Steps\n\n- **Extending authorization services with plug-ins**: Modify the system’s authorization policy with custom code.\n\n## Creating a Plug-in\n\n- **AuthorizationCallbacks Version**: The version of the interface implemented by the authorization engine.\n- **AuthorizationPluginInterface Version**: The version of the interface implemented by the plug-in.\n\n",
  "sections" : [
    {
      "content" : "",
      "items" : [
        {
          "description" : "Modify the system’s authorization policy with custom code.",
          "name" : "Extending authorization services with plug-ins",
          "url" : "https:\/\/developer.apple.com\/documentation\/Security\/extending-authorization-services-with-plug-ins"
        }
      ],
      "title" : "First Steps"
    },
    {
      "content" : "",
      "items" : [
        {
          "description" : "The version of the interface implemented by the authorization engine.",
          "name" : "AuthorizationCallbacks Version",
          "url" : "https:\/\/developer.apple.com\/documentation\/Security\/AuthorizationCallbacks-version"
        },
        {
          "description" : "The version of the interface implemented by the plug-in.",
          "name" : "AuthorizationPluginInterface Version",
          "url" : "https:\/\/developer.apple.com\/documentation\/Security\/AuthorizationPluginInterface-version"
        }
      ],
      "title" : "Creating a Plug-in"
    }
  ],
  "source" : "appleJSON",
  "title" : "Authorization Plug-ins",
  "url" : "https:\/\/developer.apple.com\/documentation\/security\/authorization-plug-ins"
}