{
  "abstract" : "A representation of a two-dimensional braille display.",
  "codeExamples" : [

  ],
  "conformsTo" : [
    "CVarArg",
    "CustomDebugStringConvertible",
    "CustomStringConvertible",
    "Equatable",
    "Hashable",
    "NSCoding",
    "NSCopying",
    "NSObjectProtocol",
    "NSSecureCoding"
  ],
  "contentHash" : "f8e912968e11f3c9d793df9487d07f082dae66382d4d80f147abac85202c4521",
  "crawledAt" : "2025-12-05T08:20:25Z",
  "declaration" : {
    "code" : "class AXBrailleMap",
    "language" : "swift"
  },
  "id" : "EE002FC8-A3FF-4A37-B3D0-D87821D97091",
  "kind" : "class",
  "language" : "swift",
  "module" : "Accessibility",
  "overview" : "## Overview\n\nA braille map object represents a two-dimensional braille display that’s connected to the current Apple device. By specifying the dot patterns in the braille map, you can change the content the user experiences. To render the data from the braille map to the display, implement [doc:\/\/com.apple.Accessibility\/documentation\/Accessibility\/AXBrailleMapRenderer].",
  "platforms" : [
    "iOS",
    "iPadOS",
    "Mac Catalyst",
    "macOS",
    "tvOS",
    "visionOS",
    "watchOS"
  ],
  "rawMarkdown" : "---\nsource: https:\/\/developer.apple.com\/documentation\/accessibility\/axbraillemap\ncrawled: 2025-12-05T08:20:25Z\n---\n\n# AXBrailleMap\n\n**Class**\n\nA representation of a two-dimensional braille display.\n\n## Declaration\n\n```swift\nclass AXBrailleMap\n```\n\n## Overview\n\nA braille map object represents a two-dimensional braille display that’s connected to the current Apple device. By specifying the dot patterns in the braille map, you can change the content the user experiences. To render the data from the braille map to the display, implement [doc:\/\/com.apple.Accessibility\/documentation\/Accessibility\/AXBrailleMapRenderer].\n\n## Creating a braille map\n\n- **init(coder:)**\n\n## Getting display dimensions\n\n- **dimensions**: The number of pins in each dimension of the braille display.\n\n## Accessing dots\n\n- **setHeight(_:at:)**: Sets the height of an individual pin on the braille display.\n- **height(at:)**: Retrieves the height of an individual pin on the braille display.\n- **subscript(_:)**: Accesses the height of an individual pin on the braille display.\n\n## Displaying images\n\n- **present(_:)**: Converts the data from the image you specify into the braille map.\n\n## Braille maps\n\n- **AXBrailleMapRenderer**: The interface for providing data for a braille map.\n\n## Inherits From\n\n- NSObject\n\n## Conforms To\n\n- CVarArg\n- CustomDebugStringConvertible\n- CustomStringConvertible\n- Equatable\n- Hashable\n- NSCoding\n- NSCopying\n- NSObjectProtocol\n- NSSecureCoding\n\n",
  "sections" : [
    {
      "content" : "",
      "items" : [
        {
          "description" : "",
          "name" : "init(coder:)",
          "url" : "https:\/\/developer.apple.com\/documentation\/Accessibility\/AXBrailleMap\/init(coder:)"
        }
      ],
      "title" : "Creating a braille map"
    },
    {
      "content" : "",
      "items" : [
        {
          "description" : "The number of pins in each dimension of the braille display.",
          "name" : "dimensions",
          "url" : "https:\/\/developer.apple.com\/documentation\/Accessibility\/AXBrailleMap\/dimensions"
        }
      ],
      "title" : "Getting display dimensions"
    },
    {
      "content" : "",
      "items" : [
        {
          "description" : "Sets the height of an individual pin on the braille display.",
          "name" : "setHeight(_:at:)",
          "url" : "https:\/\/developer.apple.com\/documentation\/Accessibility\/AXBrailleMap\/setHeight(_:at:)"
        },
        {
          "description" : "Retrieves the height of an individual pin on the braille display.",
          "name" : "height(at:)",
          "url" : "https:\/\/developer.apple.com\/documentation\/Accessibility\/AXBrailleMap\/height(at:)"
        },
        {
          "description" : "Accesses the height of an individual pin on the braille display.",
          "name" : "subscript(_:)",
          "url" : "https:\/\/developer.apple.com\/documentation\/Accessibility\/AXBrailleMap\/subscript(_:)"
        }
      ],
      "title" : "Accessing dots"
    },
    {
      "content" : "",
      "items" : [
        {
          "description" : "Converts the data from the image you specify into the braille map.",
          "name" : "present(_:)",
          "url" : "https:\/\/developer.apple.com\/documentation\/Accessibility\/AXBrailleMap\/present(_:)"
        }
      ],
      "title" : "Displaying images"
    },
    {
      "content" : "",
      "items" : [
        {
          "description" : "The interface for providing data for a braille map.",
          "name" : "AXBrailleMapRenderer",
          "url" : "https:\/\/developer.apple.com\/documentation\/Accessibility\/AXBrailleMapRenderer"
        }
      ],
      "title" : "Braille maps"
    },
    {
      "content" : "",
      "items" : [
        {
          "name" : "NSObject"
        }
      ],
      "title" : "Inherits From"
    }
  ],
  "source" : "appleJSON",
  "title" : "AXBrailleMap",
  "url" : "https:\/\/developer.apple.com\/documentation\/accessibility\/axbraillemap"
}