{
  "abstract" : "Creates a new room with the specified name.",
  "codeExamples" : [

  ],
  "contentHash" : "96e7db4eed2588cdf492d185b8a25a9613c40b03cec39aba7ded121d585d7331",
  "crawledAt" : "2025-12-01T14:24:32Z",
  "declaration" : {
    "code" : "func addRoom(withName roomName: String, completionHandler completion: @escaping (HMRoom?, (any Error)?) -> Void)",
    "language" : "swift"
  },
  "id" : "4DB959B4-A8FC-4600-A63B-5721DE5A2DDB",
  "kind" : "method",
  "module" : "HomeKit",
  "platforms" : [
    "iOS",
    "iPadOS",
    "Mac Catalyst",
    "visionOS"
  ],
  "rawMarkdown" : "---\nsource: https:\/\/developer.apple.com\/documentation\/HomeKit\/HMHome\/addRoom(withName:completionHandler:)\ncrawled: 2025-12-01T14:24:32Z\n---\n\n# addRoom(withName:completionHandler:)\n\n**Instance Method**\n\nCreates a new room with the specified name.\n\n## Declaration\n\n```swift\nfunc addRoom(withName roomName: String, completionHandler completion: @escaping (HMRoom?, (any Error)?) -> Void)\n```\n\n```swift\nfunc addRoom(named roomName: String) async throws -> HMRoom\n```\n\n## Parameters\n\n- **roomName**: The name of the new room. Must not be `nil`, and must not be the name of a room already in the home.\n- **completion**: The block executed after the request is processed.\n\n\n\n## Dividing a house into rooms\n\n- **rooms**: An array of the rooms created and managed by the user.\n- **roomForEntireHome()**: A room that represents all parts of the home that don’t have a more specific room to represent them.\n- **removeRoom(_:completionHandler:)**: Removes a room from the home.\n- **HMRoom**: The smallest subdivision of a home’s space.\n\n",
  "sections" : [
    {
      "content" : "",
      "items" : [
        {
          "description" : "An array of the rooms created and managed by the user.",
          "name" : "rooms",
          "url" : "https:\/\/developer.apple.com\/documentation\/HomeKit\/HMHome\/rooms"
        },
        {
          "description" : "A room that represents all parts of the home that don’t have a more specific room to represent them.",
          "name" : "roomForEntireHome()",
          "url" : "https:\/\/developer.apple.com\/documentation\/HomeKit\/HMHome\/roomForEntireHome()"
        },
        {
          "description" : "Removes a room from the home.",
          "name" : "removeRoom(_:completionHandler:)",
          "url" : "https:\/\/developer.apple.com\/documentation\/HomeKit\/HMHome\/removeRoom(_:completionHandler:)"
        },
        {
          "description" : "The smallest subdivision of a home’s space.",
          "name" : "HMRoom",
          "url" : "https:\/\/developer.apple.com\/documentation\/HomeKit\/HMRoom"
        }
      ],
      "title" : "Dividing a house into rooms"
    }
  ],
  "source" : "appleJSON",
  "title" : "addRoom(withName:completionHandler:)",
  "url" : "https:\/\/developer.apple.com\/documentation\/HomeKit\/HMHome\/addRoom(withName:completionHandler:)"
}