{
  "abstract" : "The smallest subdivision of a home’s space.",
  "codeExamples" : [

  ],
  "conformsTo" : [
    "CVarArg",
    "CustomDebugStringConvertible",
    "CustomStringConvertible",
    "Equatable",
    "Hashable",
    "NSObjectProtocol",
    "Sendable",
    "SendableMetatype"
  ],
  "contentHash" : "f1454993fe5a5a991674705b40cff3af2f9763ae618243efe84553127066bd7a",
  "crawledAt" : "2025-12-02T18:46:26Z",
  "declaration" : {
    "code" : "class HMRoom",
    "language" : "swift"
  },
  "id" : "24B1324B-7122-4C87-8E4D-8CAAB4AB2082",
  "kind" : "class",
  "language" : "swift",
  "module" : "HomeKit",
  "overview" : "## Overview\n\nAn [doc:\/\/com.apple.homekit\/documentation\/HomeKit\/HMRoom] instance is a part of a home representing an individual room in the home. Rooms don’t have any physical characteristics like size or location. Instead, they’re names that are meaningful to the user, like “living room” or “kitchen”. Meaningful room names enable voice commands like “Siri, turn on the kitchen lights.”\n\nYou create new rooms using the [doc:\/\/com.apple.homekit\/documentation\/HomeKit\/HMHome\/addRoom(withName:completionHandler:)] method of [doc:\/\/com.apple.homekit\/documentation\/HomeKit\/HMHome]. You can also group rooms into zones using instances of [doc:\/\/com.apple.homekit\/documentation\/HomeKit\/HMZone]. You can assign accessories to rooms, indicating the presence of that accessory in that room.",
  "platforms" : [
    "iOS",
    "iPadOS",
    "Mac Catalyst",
    "tvOS",
    "visionOS",
    "watchOS"
  ],
  "rawMarkdown" : "---\nsource: https:\/\/developer.apple.com\/documentation\/HomeKit\/HMRoom\ncrawled: 2025-12-02T18:46:26Z\n---\n\n# HMRoom\n\n**Class**\n\nThe smallest subdivision of a home’s space.\n\n## Declaration\n\n```swift\nclass HMRoom\n```\n\n## Overview\n\nAn [doc:\/\/com.apple.homekit\/documentation\/HomeKit\/HMRoom] instance is a part of a home representing an individual room in the home. Rooms don’t have any physical characteristics like size or location. Instead, they’re names that are meaningful to the user, like “living room” or “kitchen”. Meaningful room names enable voice commands like “Siri, turn on the kitchen lights.”\n\nYou create new rooms using the [doc:\/\/com.apple.homekit\/documentation\/HomeKit\/HMHome\/addRoom(withName:completionHandler:)] method of [doc:\/\/com.apple.homekit\/documentation\/HomeKit\/HMHome]. You can also group rooms into zones using instances of [doc:\/\/com.apple.homekit\/documentation\/HomeKit\/HMZone]. You can assign accessories to rooms, indicating the presence of that accessory in that room.\n\n## Identifying a room\n\n- **name**: The name of the room.\n- **updateName(_:completionHandler:)**: Updates the name of the room.\n- **uniqueIdentifier**: The unique identifier for a room.\n\n## Finding accessories\n\n- **accessories**: The collection of accessories in the room.\n\n## Locating an accessory\n\n- **room**: The room containing the accessory.\n\n## Inherits From\n\n- NSObject\n\n## Conforms To\n\n- CVarArg\n- CustomDebugStringConvertible\n- CustomStringConvertible\n- Equatable\n- Hashable\n- NSObjectProtocol\n- Sendable\n- SendableMetatype\n\n",
  "sections" : [
    {
      "content" : "",
      "items" : [
        {
          "description" : "The name of the room.",
          "name" : "name",
          "url" : "https:\/\/developer.apple.com\/documentation\/HomeKit\/HMRoom\/name"
        },
        {
          "description" : "Updates the name of the room.",
          "name" : "updateName(_:completionHandler:)",
          "url" : "https:\/\/developer.apple.com\/documentation\/HomeKit\/HMRoom\/updateName(_:completionHandler:)"
        },
        {
          "description" : "The unique identifier for a room.",
          "name" : "uniqueIdentifier",
          "url" : "https:\/\/developer.apple.com\/documentation\/HomeKit\/HMRoom\/uniqueIdentifier"
        }
      ],
      "title" : "Identifying a room"
    },
    {
      "content" : "",
      "items" : [
        {
          "description" : "The collection of accessories in the room.",
          "name" : "accessories",
          "url" : "https:\/\/developer.apple.com\/documentation\/HomeKit\/HMRoom\/accessories"
        }
      ],
      "title" : "Finding accessories"
    },
    {
      "content" : "",
      "items" : [
        {
          "description" : "The room containing the accessory.",
          "name" : "room",
          "url" : "https:\/\/developer.apple.com\/documentation\/HomeKit\/HMAccessory\/room"
        }
      ],
      "title" : "Locating an accessory"
    },
    {
      "content" : "",
      "items" : [
        {
          "name" : "NSObject"
        }
      ],
      "title" : "Inherits From"
    }
  ],
  "source" : "appleJSON",
  "title" : "HMRoom",
  "url" : "https:\/\/developer.apple.com\/documentation\/HomeKit\/HMRoom"
}