{
  "abstract" : "A collection of accessory services.",
  "codeExamples" : [

  ],
  "conformsTo" : [
    "CVarArg",
    "CustomDebugStringConvertible",
    "CustomStringConvertible",
    "Equatable",
    "Hashable",
    "NSObjectProtocol",
    "Sendable",
    "SendableMetatype"
  ],
  "contentHash" : "749ad691c3a2f1bb4dc7e02affeeff89949dcce0390c1a367a7c9e636c6ed412",
  "crawledAt" : "2025-12-03T09:37:13Z",
  "declaration" : {
    "code" : "class HMServiceGroup",
    "language" : "swift"
  },
  "id" : "03DC70CF-4906-455B-A7DC-B4BD1983DC3F",
  "kind" : "class",
  "language" : "swift",
  "module" : "HomeKit",
  "overview" : "## Overview\n\nA service group makes it easier to address the services as a single entity. For example, a user might choose to group a set of lights together as “Desk Lamps,” and have another set of lights grouped as “Ceiling Lights”. You create service groups using the [doc:\/\/com.apple.homekit\/documentation\/HomeKit\/HMHome\/addServiceGroup(withName:completionHandler:)] method of [doc:\/\/com.apple.homekit\/documentation\/HomeKit\/HMHome]. Service groups are visible to Siri and allow users to control a group of services through Siri.",
  "platforms" : [
    "iOS",
    "iPadOS",
    "Mac Catalyst",
    "tvOS",
    "visionOS",
    "watchOS"
  ],
  "rawMarkdown" : "---\nsource: https:\/\/developer.apple.com\/documentation\/HomeKit\/HMServiceGroup\ncrawled: 2025-12-03T09:37:13Z\n---\n\n# HMServiceGroup\n\n**Class**\n\nA collection of accessory services.\n\n## Declaration\n\n```swift\nclass HMServiceGroup\n```\n\n## Overview\n\nA service group makes it easier to address the services as a single entity. For example, a user might choose to group a set of lights together as “Desk Lamps,” and have another set of lights grouped as “Ceiling Lights”. You create service groups using the [doc:\/\/com.apple.homekit\/documentation\/HomeKit\/HMHome\/addServiceGroup(withName:completionHandler:)] method of [doc:\/\/com.apple.homekit\/documentation\/HomeKit\/HMHome]. Service groups are visible to Siri and allow users to control a group of services through Siri.\n\n## Managing Service Groups\n\n- **name**: The name of the service group.\n- **uniqueIdentifier**: The unique identifier for the service group.\n- **updateName(_:completionHandler:)**: Updates the name of the service group.\n- **services**: Array of the services in the service group.\n- **addService(_:completionHandler:)**: Adds a new service to the service group.\n- **removeService(_:completionHandler:)**: Removes a service from the service group.\n\n## Grouping services\n\n- **servicesWithTypes(_:)**: Returns an array of all services provided by accessories in the home that match the specified types.\n- **serviceGroups**: An array of all service groups in the home.\n- **addServiceGroup(withName:completionHandler:)**: Adds a service group to the home.\n- **removeServiceGroup(_:completionHandler:)**: Removes a service group from the home.\n\n## Inherits From\n\n- NSObject\n\n## Conforms To\n\n- CVarArg\n- CustomDebugStringConvertible\n- CustomStringConvertible\n- Equatable\n- Hashable\n- NSObjectProtocol\n- Sendable\n- SendableMetatype\n\n",
  "sections" : [
    {
      "content" : "",
      "items" : [
        {
          "description" : "The name of the service group.",
          "name" : "name",
          "url" : "https:\/\/developer.apple.com\/documentation\/HomeKit\/HMServiceGroup\/name"
        },
        {
          "description" : "The unique identifier for the service group.",
          "name" : "uniqueIdentifier",
          "url" : "https:\/\/developer.apple.com\/documentation\/HomeKit\/HMServiceGroup\/uniqueIdentifier"
        },
        {
          "description" : "Updates the name of the service group.",
          "name" : "updateName(_:completionHandler:)",
          "url" : "https:\/\/developer.apple.com\/documentation\/HomeKit\/HMServiceGroup\/updateName(_:completionHandler:)"
        },
        {
          "description" : "Array of the services in the service group.",
          "name" : "services",
          "url" : "https:\/\/developer.apple.com\/documentation\/HomeKit\/HMServiceGroup\/services"
        },
        {
          "description" : "Adds a new service to the service group.",
          "name" : "addService(_:completionHandler:)",
          "url" : "https:\/\/developer.apple.com\/documentation\/HomeKit\/HMServiceGroup\/addService(_:completionHandler:)"
        },
        {
          "description" : "Removes a service from the service group.",
          "name" : "removeService(_:completionHandler:)",
          "url" : "https:\/\/developer.apple.com\/documentation\/HomeKit\/HMServiceGroup\/removeService(_:completionHandler:)"
        }
      ],
      "title" : "Managing Service Groups"
    },
    {
      "content" : "",
      "items" : [
        {
          "description" : "Returns an array of all services provided by accessories in the home that match the specified types.",
          "name" : "servicesWithTypes(_:)",
          "url" : "https:\/\/developer.apple.com\/documentation\/HomeKit\/HMHome\/servicesWithTypes(_:)"
        },
        {
          "description" : "An array of all service groups in the home.",
          "name" : "serviceGroups",
          "url" : "https:\/\/developer.apple.com\/documentation\/HomeKit\/HMHome\/serviceGroups"
        },
        {
          "description" : "Adds a service group to the home.",
          "name" : "addServiceGroup(withName:completionHandler:)",
          "url" : "https:\/\/developer.apple.com\/documentation\/HomeKit\/HMHome\/addServiceGroup(withName:completionHandler:)"
        },
        {
          "description" : "Removes a service group from the home.",
          "name" : "removeServiceGroup(_:completionHandler:)",
          "url" : "https:\/\/developer.apple.com\/documentation\/HomeKit\/HMHome\/removeServiceGroup(_:completionHandler:)"
        }
      ],
      "title" : "Grouping services"
    },
    {
      "content" : "",
      "items" : [
        {
          "name" : "NSObject"
        }
      ],
      "title" : "Inherits From"
    }
  ],
  "source" : "appleJSON",
  "title" : "HMServiceGroup",
  "url" : "https:\/\/developer.apple.com\/documentation\/HomeKit\/HMServiceGroup"
}