{
  "abstract" : "A category for a HomeKit accessory.",
  "codeExamples" : [

  ],
  "conformsTo" : [
    "CVarArg",
    "CustomDebugStringConvertible",
    "CustomStringConvertible",
    "Equatable",
    "Hashable",
    "NSObjectProtocol",
    "Sendable",
    "SendableMetatype"
  ],
  "contentHash" : "62f808e3820a4ebfaccaffbc20cf835b93b02c070a16db7a8b6ee5db73fb9f82",
  "crawledAt" : "2025-12-02T18:27:51Z",
  "declaration" : {
    "code" : "class HMAccessoryCategory",
    "language" : "swift"
  },
  "id" : "CB53B481-8BE5-480F-BDE0-1460EEEDF460",
  "kind" : "class",
  "language" : "swift",
  "module" : "HomeKit",
  "overview" : "## Overview\n\nA category represents a class of devices, like light bulbs or outlets. You can use a category to help users identify the types of accessories they’re browsing. For example, when adding a lamp and a fan to a home, users might not be able to distinguish these accessories if you display only the manufacturer name and model number for each accessory. To improve the user experience, you can use the category information associated with each accessory to help the user understand which accessory is the lamp and which is the fan.",
  "platforms" : [
    "iOS",
    "iPadOS",
    "Mac Catalyst",
    "tvOS",
    "visionOS",
    "watchOS"
  ],
  "rawMarkdown" : "---\nsource: https:\/\/developer.apple.com\/documentation\/HomeKit\/HMAccessoryCategory\ncrawled: 2025-12-02T18:27:51Z\n---\n\n# HMAccessoryCategory\n\n**Class**\n\nA category for a HomeKit accessory.\n\n## Declaration\n\n```swift\nclass HMAccessoryCategory\n```\n\n## Overview\n\nA category represents a class of devices, like light bulbs or outlets. You can use a category to help users identify the types of accessories they’re browsing. For example, when adding a lamp and a fan to a home, users might not be able to distinguish these accessories if you display only the manufacturer name and model number for each accessory. To improve the user experience, you can use the category information associated with each accessory to help the user understand which accessory is the lamp and which is the fan.\n\n## Reading the category type\n\n- **categoryType**: The category to which this accessory belongs.\n- **Accessory Category Types**: The accessory category types supported by HomeKit.\n\n## Describing the category\n\n- **localizedDescription**: A localized description of the category.\n\n## Categorizing an accessory\n\n- **category**: The category to which the accessory belongs.\n\n## Inherits From\n\n- NSObject\n\n## Conforms To\n\n- CVarArg\n- CustomDebugStringConvertible\n- CustomStringConvertible\n- Equatable\n- Hashable\n- NSObjectProtocol\n- Sendable\n- SendableMetatype\n\n",
  "sections" : [
    {
      "content" : "",
      "items" : [
        {
          "description" : "The category to which this accessory belongs.",
          "name" : "categoryType",
          "url" : "https:\/\/developer.apple.com\/documentation\/HomeKit\/HMAccessoryCategory\/categoryType"
        },
        {
          "description" : "The accessory category types supported by HomeKit.",
          "name" : "Accessory Category Types",
          "url" : "https:\/\/developer.apple.com\/documentation\/HomeKit\/accessory-category-types"
        }
      ],
      "title" : "Reading the category type"
    },
    {
      "content" : "",
      "items" : [
        {
          "description" : "A localized description of the category.",
          "name" : "localizedDescription",
          "url" : "https:\/\/developer.apple.com\/documentation\/HomeKit\/HMAccessoryCategory\/localizedDescription"
        }
      ],
      "title" : "Describing the category"
    },
    {
      "content" : "",
      "items" : [
        {
          "description" : "The category to which the accessory belongs.",
          "name" : "category",
          "url" : "https:\/\/developer.apple.com\/documentation\/HomeKit\/HMAccessory\/category"
        }
      ],
      "title" : "Categorizing an accessory"
    },
    {
      "content" : "",
      "items" : [
        {
          "name" : "NSObject"
        }
      ],
      "title" : "Inherits From"
    }
  ],
  "source" : "appleJSON",
  "title" : "HMAccessoryCategory",
  "url" : "https:\/\/developer.apple.com\/documentation\/HomeKit\/HMAccessoryCategory"
}