{
  "abstract" : "Responds to a Siri intent.",
  "codeExamples" : [

  ],
  "contentHash" : "cae6b9652032cc3ca904fd57aed7acaf404aa977cef5749e8aeb1021af17c5a8",
  "crawledAt" : "2025-12-03T05:56:25Z",
  "declaration" : {
    "code" : "@MainActor optional func handle(_ intent: INIntent, completionHandler: @escaping (INIntentResponse) -> Void)",
    "language" : "swift"
  },
  "id" : "8FBA2813-D0A0-4992-9AFF-67BBB2E22D7B",
  "kind" : "method",
  "language" : "swift",
  "module" : "WatchKit",
  "overview" : "## Discussion\n\nThe system calls this method when it receives a Siri intent. Implement a method that handles the incoming intent, and then call the completion handler as quickly as possible.",
  "platforms" : [
    "watchOS"
  ],
  "rawMarkdown" : "---\nsource: https:\/\/developer.apple.com\/documentation\/WatchKit\/WKApplicationDelegate\/handle(_:completionHandler:)\ncrawled: 2025-12-03T05:56:25Z\n---\n\n# handle(_:completionHandler:)\n\n**Instance Method**\n\nResponds to a Siri intent.\n\n## Declaration\n\n```swift\n@MainActor optional func handle(_ intent: INIntent, completionHandler: @escaping (INIntentResponse) -> Void)\n```\n\n```swift\n@MainActor optional func handle(_ intent: INIntent) async -> INIntentResponse\n```\n\n## Parameters\n\n- **intent**: An intent containing information about the userâ€™s request.\n- **completionHandler**: A closure that you call as soon as you finish handling the intent.\n\n## Discussion\n\nThe system calls this method when it receives a Siri intent. Implement a method that handles the incoming intent, and then call the completion handler as quickly as possible.\n\n## Related Documentation\n\n- **WKIntentDidRunRefreshBackgroundTask**: A background task used to update your app after a SiriKit intent runs.\n\n",
  "sections" : [
    {
      "content" : "",
      "items" : [
        {
          "description" : "A background task used to update your app after a SiriKit intent runs.",
          "name" : "WKIntentDidRunRefreshBackgroundTask",
          "url" : "https:\/\/developer.apple.com\/documentation\/WatchKit\/WKIntentDidRunRefreshBackgroundTask"
        }
      ],
      "title" : "Related Documentation"
    }
  ],
  "source" : "appleJSON",
  "title" : "handle(_:completionHandler:)",
  "url" : "https:\/\/developer.apple.com\/documentation\/WatchKit\/WKApplicationDelegate\/handle(_:completionHandler:)"
}