{
  "abstract" : "An interface element that lets you play video and audio content in your watchOS app.",
  "codeExamples" : [

  ],
  "conformsTo" : [
    "CVarArg",
    "CustomDebugStringConvertible",
    "CustomStringConvertible",
    "Equatable",
    "Hashable",
    "NSObjectProtocol"
  ],
  "contentHash" : "2966be5b4aba92d495e784eed7f12c2c9837384b40e8969d253c00a0df5b5e7f",
  "crawledAt" : "2025-12-01T10:46:58Z",
  "declaration" : {
    "code" : "class WKInterfaceMovie",
    "language" : "swift"
  },
  "id" : "A51D1D5A-9C2D-4DC9-871C-81F206A1DFCE",
  "kind" : "class",
  "module" : "WatchKit",
  "overview" : "## Overview\n\nA movie object displays a poster image with a play button on top of it. When the user taps the play button, WatchKit plays the movie in a modal interface.\n\nDo not subclass or create instances of this class yourself. Instead, define outlets in your interface controller class and connect them to the corresponding objects in your storyboard file. For example, to refer to a movie object in your interface, define a property with the following syntax in your interface controller class:\n\nDuring the initialization of your interface controller, WatchKit creates any needed movie objects and assigns them to their associated outlets. At that point, you can use those objects to make changes to the onscreen content.\n\nDo not attempt to play audio or video content while gathering heart rate data using Health Kit. If you use this class to play media, WatchKit automatically disables the gathering of heart rate data.\n\n### Supported Media Formats\n\nThe following table lists the encoding information to use when creating media files to play on a user’s Apple Watch. For audio and video assets played directly from your app, keep your clips relatively short. Short clips consume less space on disk, use less power, and take less time to download.\n\n### Interface Builder Configuration Options\n\nXcode lets you configure information about your movie interface object in your storyboard file. The following table lists the attributes you can configure and their meaning.",
  "platforms" : [
    "watchOS"
  ],
  "rawMarkdown" : "---\nsource: https:\/\/developer.apple.com\/documentation\/WatchKit\/WKInterfaceMovie\ncrawled: 2025-12-01T10:46:58Z\n---\n\n# WKInterfaceMovie\n\n**Class**\n\nAn interface element that lets you play video and audio content in your watchOS app.\n\n## Declaration\n\n```swift\nclass WKInterfaceMovie\n```\n\n## Overview\n\nA movie object displays a poster image with a play button on top of it. When the user taps the play button, WatchKit plays the movie in a modal interface.\n\nDo not subclass or create instances of this class yourself. Instead, define outlets in your interface controller class and connect them to the corresponding objects in your storyboard file. For example, to refer to a movie object in your interface, define a property with the following syntax in your interface controller class:\n\n\n\nDuring the initialization of your interface controller, WatchKit creates any needed movie objects and assigns them to their associated outlets. At that point, you can use those objects to make changes to the onscreen content.\n\nDo not attempt to play audio or video content while gathering heart rate data using Health Kit. If you use this class to play media, WatchKit automatically disables the gathering of heart rate data.\n\n### Supported Media Formats\n\nThe following table lists the encoding information to use when creating media files to play on a user’s Apple Watch. For audio and video assets played directly from your app, keep your clips relatively short. Short clips consume less space on disk, use less power, and take less time to download.\n\n\n\n### Interface Builder Configuration Options\n\nXcode lets you configure information about your movie interface object in your storyboard file. The following table lists the attributes you can configure and their meaning.\n\n\n\n## Setting the Movie Attributes\n\n- **setMovieURL(_:)**: Sets the URL of the movie to play.\n- **setVideoGravity(_:)**: Sets the resizing behavior for the movie content.\n- **setPosterImage(_:)**: Sets the poster image to display for the movie.\n- **setLoops(_:)**: Sets a Boolean value indicating whether the movie plays in a continuous loop.\n\n## Initializing for SwiftUI\n\n- **init()**: Creates a movie object for use in SwiftUI.\n\n## Images and movies\n\n- **WKInterfaceImage**: An image that can be displayed in the interface of your watchOS app.\n- **WKImage**: A wrapper for images you use with a picker interface.\n- **WKImageAnimatable**: A collection of methods you can use to control the playback of animated images.\n- **WKInterfaceInlineMovie**: An interface element that displays a video’s poster image and supports inline playing of the video.\n- **WKInterfaceHMCamera**: An interface element that displays either a video stream or a single snapshot from an IP camera connected to HomeKit.\n- **WKVideoGravity**: Constants indicating the appearance of video content.\n\n## Inherits From\n\n- WKInterfaceObject\n\n## Conforms To\n\n- CVarArg\n- CustomDebugStringConvertible\n- CustomStringConvertible\n- Equatable\n- Hashable\n- NSObjectProtocol\n\n",
  "sections" : [
    {
      "content" : "",
      "items" : [
        {
          "description" : "Sets the URL of the movie to play.",
          "name" : "setMovieURL(_:)",
          "url" : "https:\/\/developer.apple.com\/documentation\/WatchKit\/WKInterfaceMovie\/setMovieURL(_:)"
        },
        {
          "description" : "Sets the resizing behavior for the movie content.",
          "name" : "setVideoGravity(_:)",
          "url" : "https:\/\/developer.apple.com\/documentation\/WatchKit\/WKInterfaceMovie\/setVideoGravity(_:)"
        },
        {
          "description" : "Sets the poster image to display for the movie.",
          "name" : "setPosterImage(_:)",
          "url" : "https:\/\/developer.apple.com\/documentation\/WatchKit\/WKInterfaceMovie\/setPosterImage(_:)"
        },
        {
          "description" : "Sets a Boolean value indicating whether the movie plays in a continuous loop.",
          "name" : "setLoops(_:)",
          "url" : "https:\/\/developer.apple.com\/documentation\/WatchKit\/WKInterfaceMovie\/setLoops(_:)"
        }
      ],
      "title" : "Setting the Movie Attributes"
    },
    {
      "content" : "",
      "items" : [
        {
          "description" : "Creates a movie object for use in SwiftUI.",
          "name" : "init()",
          "url" : "https:\/\/developer.apple.com\/documentation\/WatchKit\/WKInterfaceMovie\/init()"
        }
      ],
      "title" : "Initializing for SwiftUI"
    },
    {
      "content" : "",
      "items" : [
        {
          "description" : "An image that can be displayed in the interface of your watchOS app.",
          "name" : "WKInterfaceImage",
          "url" : "https:\/\/developer.apple.com\/documentation\/WatchKit\/WKInterfaceImage"
        },
        {
          "description" : "A wrapper for images you use with a picker interface.",
          "name" : "WKImage",
          "url" : "https:\/\/developer.apple.com\/documentation\/WatchKit\/WKImage"
        },
        {
          "description" : "A collection of methods you can use to control the playback of animated images.",
          "name" : "WKImageAnimatable",
          "url" : "https:\/\/developer.apple.com\/documentation\/WatchKit\/WKImageAnimatable"
        },
        {
          "description" : "An interface element that displays a video’s poster image and supports inline playing of the video.",
          "name" : "WKInterfaceInlineMovie",
          "url" : "https:\/\/developer.apple.com\/documentation\/WatchKit\/WKInterfaceInlineMovie"
        },
        {
          "description" : "An interface element that displays either a video stream or a single snapshot from an IP camera connected to HomeKit.",
          "name" : "WKInterfaceHMCamera",
          "url" : "https:\/\/developer.apple.com\/documentation\/WatchKit\/WKInterfaceHMCamera"
        },
        {
          "description" : "Constants indicating the appearance of video content.",
          "name" : "WKVideoGravity",
          "url" : "https:\/\/developer.apple.com\/documentation\/WatchKit\/WKVideoGravity"
        }
      ],
      "title" : "Images and movies"
    },
    {
      "content" : "",
      "items" : [
        {
          "name" : "WKInterfaceObject"
        }
      ],
      "title" : "Inherits From"
    }
  ],
  "source" : "appleJSON",
  "title" : "WKInterfaceMovie",
  "url" : "https:\/\/developer.apple.com\/documentation\/WatchKit\/WKInterfaceMovie"
}