{
  "abstract" : "Determines whether the text field hides the text entered by the user.",
  "codeExamples" : [

  ],
  "contentHash" : "622a20af4503babf4eb348af595a02e72c124c733d3069c9f32a43cb8134046f",
  "crawledAt" : "2025-12-04T11:32:58Z",
  "declaration" : {
    "code" : "func setSecureTextEntry(_ secureTextEntry: Bool)",
    "language" : "swift"
  },
  "id" : "3D27A266-0E0F-4CFD-A7EC-99A3B84BE9C8",
  "kind" : "method",
  "language" : "swift",
  "module" : "WatchKit",
  "overview" : "## Discussion\n\nPass [doc:\/\/com.apple.documentation\/documentation\/Swift\/true] to help keep passwords and other secure data private. When you enable secure text entry, the system displays a series of dots instead of the text entered by the user.",
  "platforms" : [
    "watchOS"
  ],
  "rawMarkdown" : "---\nsource: https:\/\/developer.apple.com\/documentation\/WatchKit\/WKInterfaceTextField\/setSecureTextEntry(_:)\ncrawled: 2025-12-04T11:32:58Z\n---\n\n# setSecureTextEntry(_:)\n\n**Instance Method**\n\nDetermines whether the text field hides the text entered by the user.\n\n## Declaration\n\n```swift\nfunc setSecureTextEntry(_ secureTextEntry: Bool)\n```\n\n## Discussion\n\nPass [doc:\/\/com.apple.documentation\/documentation\/Swift\/true] to help keep passwords and other secure data private. When you enable secure text entry, the system displays a series of dots instead of the text entered by the user.\n\n## Configuring the Control\n\n- **setEnabled(_:)**: Enables or disables the text field.\n\n",
  "sections" : [
    {
      "content" : "",
      "items" : [
        {
          "description" : "Enables or disables the text field.",
          "name" : "setEnabled(_:)",
          "url" : "https:\/\/developer.apple.com\/documentation\/WatchKit\/WKInterfaceTextField\/setEnabled(_:)"
        }
      ],
      "title" : "Configuring the Control"
    }
  ],
  "source" : "appleJSON",
  "title" : "setSecureTextEntry(_:)",
  "url" : "https:\/\/developer.apple.com\/documentation\/WatchKit\/WKInterfaceTextField\/setSecureTextEntry(_:)"
}