{
  "abstract" : "Tells the delegate that the system is about to deactivate the watchOS app.",
  "codeExamples" : [

  ],
  "contentHash" : "3069658db82ffc569904831843076fcf5e012d64cf33b519f2337027a3019b14",
  "crawledAt" : "2025-12-01T10:45:22Z",
  "declaration" : {
    "code" : "@MainActor optional func applicationWillResignActive()",
    "language" : "swift"
  },
  "id" : "94682C5E-8A8B-4C92-B980-92BAC4E57590",
  "kind" : "method",
  "module" : "WatchKit",
  "overview" : "## Discussion\n\nWatchKit calls this method after your app launches and before it exits. Use this method to pause any active tasks. For example, you could use it to stop any active timers. An app in the inactive state should do minimal work while it waits to transition to the active or not running state.\n\nIf your app has unsaved user data, you can save it here to ensure that it isn’t lost. However, it’s a good idea to save user data at appropriate points throughout the execution of your app, usually in response to user actions. Don’t rely on specific app state transitions to save all of your app’s critical data.",
  "platforms" : [
    "watchOS"
  ],
  "rawMarkdown" : "---\nsource: https:\/\/developer.apple.com\/documentation\/WatchKit\/WKApplicationDelegate\/applicationWillResignActive()\ncrawled: 2025-12-01T10:45:22Z\n---\n\n# applicationWillResignActive()\n\n**Instance Method**\n\nTells the delegate that the system is about to deactivate the watchOS app.\n\n## Declaration\n\n```swift\n@MainActor optional func applicationWillResignActive()\n```\n\n## Discussion\n\nWatchKit calls this method after your app launches and before it exits. Use this method to pause any active tasks. For example, you could use it to stop any active timers. An app in the inactive state should do minimal work while it waits to transition to the active or not running state.\n\nIf your app has unsaved user data, you can save it here to ensure that it isn’t lost. However, it’s a good idea to save user data at appropriate points throughout the execution of your app, usually in response to user actions. Don’t rely on specific app state transitions to save all of your app’s critical data.\n\n\n\n## Monitoring state changes\n\n- **Working with the watchOS app life cycle**: Learn how the watchOS app life cycle operates and responds to life cycle notification methods.\n- **main()**: Provides the top-level entry point for an app.\n- **applicationDidFinishLaunching()**: Tells the delegate that the launch process is almost done and the app is almost ready to run.\n- **applicationDidBecomeActive()**: Tells the delegate that the watchOS app is visible and processing events.\n- **applicationWillEnterForeground()**: Tells the delegate that the app is about to transition from the background to the foreground.\n- **applicationDidEnterBackground()**: Tells the delegate that the app has transitioned from the foreground to the background.\n- **deviceOrientationDidChange()**: Tells the delegate that the device’s orientation has changed.\n\n",
  "sections" : [
    {
      "content" : "",
      "items" : [
        {
          "description" : "Learn how the watchOS app life cycle operates and responds to life cycle notification methods.",
          "name" : "Working with the watchOS app life cycle",
          "url" : "https:\/\/developer.apple.com\/documentation\/WatchKit\/working-with-the-watchos-app-life-cycle"
        },
        {
          "description" : "Provides the top-level entry point for an app.",
          "name" : "main()",
          "url" : "https:\/\/developer.apple.com\/documentation\/WatchKit\/WKApplicationDelegate\/main()"
        },
        {
          "description" : "Tells the delegate that the launch process is almost done and the app is almost ready to run.",
          "name" : "applicationDidFinishLaunching()",
          "url" : "https:\/\/developer.apple.com\/documentation\/WatchKit\/WKApplicationDelegate\/applicationDidFinishLaunching()"
        },
        {
          "description" : "Tells the delegate that the watchOS app is visible and processing events.",
          "name" : "applicationDidBecomeActive()",
          "url" : "https:\/\/developer.apple.com\/documentation\/WatchKit\/WKApplicationDelegate\/applicationDidBecomeActive()"
        },
        {
          "description" : "Tells the delegate that the app is about to transition from the background to the foreground.",
          "name" : "applicationWillEnterForeground()",
          "url" : "https:\/\/developer.apple.com\/documentation\/WatchKit\/WKApplicationDelegate\/applicationWillEnterForeground()"
        },
        {
          "description" : "Tells the delegate that the app has transitioned from the foreground to the background.",
          "name" : "applicationDidEnterBackground()",
          "url" : "https:\/\/developer.apple.com\/documentation\/WatchKit\/WKApplicationDelegate\/applicationDidEnterBackground()"
        },
        {
          "description" : "Tells the delegate that the device’s orientation has changed.",
          "name" : "deviceOrientationDidChange()",
          "url" : "https:\/\/developer.apple.com\/documentation\/WatchKit\/WKApplicationDelegate\/deviceOrientationDidChange()"
        }
      ],
      "title" : "Monitoring state changes"
    }
  ],
  "source" : "appleJSON",
  "title" : "applicationWillResignActive()",
  "url" : "https:\/\/developer.apple.com\/documentation\/WatchKit\/WKApplicationDelegate\/applicationWillResignActive()"
}