{
  "abstract" : "Returns the context objects to pass to a page-based set of interface controllers when a button is tapped.",
  "codeExamples" : [

  ],
  "contentHash" : "4faa1341e8ac9cc7dc994a7a69acac3a851ec1853d089f2d98f71ed3608b3e05",
  "crawledAt" : "2025-12-04T13:02:45Z",
  "declaration" : {
    "code" : "@MainActor func contextsForSegue(withIdentifier segueIdentifier: String) -> [Any]?",
    "language" : "swift"
  },
  "id" : "C0D225CC-A417-495D-87C9-ADB01D3B1E71",
  "kind" : "method",
  "language" : "swift",
  "module" : "WatchKit",
  "overview" : "## Return Value\n\nAn array of objects to pass to the new interface controllers. The number of objects in the array must match the number of interface controllers that are present in the page-based interface that is the target of the segue. Use this object to communicate important information to the new interface controller, such as the data to display or any relevant state information. You may return `nil` if you want, but doing so is not recommended.\n\n## Discussion\n\nWhen you create a modal segue from a button to a set of interface controllers in a page-based arrangement, the system calls this method when that segue is triggered. Use this method to provide the new interface controllers with any contextual data they need to display their content. The objects in the array are passed directly to the [doc:\/\/com.apple.watchkit\/documentation\/WatchKit\/WKInterfaceController\/awake(withContext:)] method of the corresponding interface controllers.\n\nWatchKit calls this method on your WatchKit extension’s main thread. Implementation of this method is optional but is recommended if you use segues in your storyboard file. You do not need to call `super` in your implementation. For segues originating from a table row, use the [doc:\/\/com.apple.watchkit\/documentation\/WatchKit\/WKInterfaceController\/contextsForSegue(withIdentifier:in:rowIndex:)] method instead.",
  "platforms" : [
    "watchOS"
  ],
  "rawMarkdown" : "---\nsource: https:\/\/developer.apple.com\/documentation\/WatchKit\/WKInterfaceController\/contextsForSegue(withIdentifier:)\ncrawled: 2025-12-04T13:02:45Z\n---\n\n# contextsForSegue(withIdentifier:)\n\n**Instance Method**\n\nReturns the context objects to pass to a page-based set of interface controllers when a button is tapped.\n\n## Declaration\n\n```swift\n@MainActor func contextsForSegue(withIdentifier segueIdentifier: String) -> [Any]?\n```\n\n## Parameters\n\n- **segueIdentifier**: The identifier of the segue that was triggered. Specify the identifier for a segue in the Attributes inspector when configuring your interface.\n\n## Return Value\n\nAn array of objects to pass to the new interface controllers. The number of objects in the array must match the number of interface controllers that are present in the page-based interface that is the target of the segue. Use this object to communicate important information to the new interface controller, such as the data to display or any relevant state information. You may return `nil` if you want, but doing so is not recommended.\n\n## Discussion\n\nWhen you create a modal segue from a button to a set of interface controllers in a page-based arrangement, the system calls this method when that segue is triggered. Use this method to provide the new interface controllers with any contextual data they need to display their content. The objects in the array are passed directly to the [doc:\/\/com.apple.watchkit\/documentation\/WatchKit\/WKInterfaceController\/awake(withContext:)] method of the corresponding interface controllers.\n\nWatchKit calls this method on your WatchKit extension’s main thread. Implementation of this method is optional but is recommended if you use segues in your storyboard file. You do not need to call `super` in your implementation. For segues originating from a table row, use the [doc:\/\/com.apple.watchkit\/documentation\/WatchKit\/WKInterfaceController\/contextsForSegue(withIdentifier:in:rowIndex:)] method instead.\n\n## Managing segue-based transitions\n\n- **contextForSegue(withIdentifier:)**: Returns the context object to pass to the specified interface controller when a button is tapped.\n- **contextForSegue(withIdentifier:in:rowIndex:)**: Returns the context object to pass to the specified interface controller when a row in a table is tapped.\n- **contextsForSegue(withIdentifier:in:rowIndex:)**: Returns the context objects to pass to a page-based set of interface controllers when a row in a table is tapped.\n\n",
  "sections" : [
    {
      "content" : "",
      "items" : [
        {
          "description" : "Returns the context object to pass to the specified interface controller when a button is tapped.",
          "name" : "contextForSegue(withIdentifier:)",
          "url" : "https:\/\/developer.apple.com\/documentation\/WatchKit\/WKInterfaceController\/contextForSegue(withIdentifier:)"
        },
        {
          "description" : "Returns the context object to pass to the specified interface controller when a row in a table is tapped.",
          "name" : "contextForSegue(withIdentifier:in:rowIndex:)",
          "url" : "https:\/\/developer.apple.com\/documentation\/WatchKit\/WKInterfaceController\/contextForSegue(withIdentifier:in:rowIndex:)"
        },
        {
          "description" : "Returns the context objects to pass to a page-based set of interface controllers when a row in a table is tapped.",
          "name" : "contextsForSegue(withIdentifier:in:rowIndex:)",
          "url" : "https:\/\/developer.apple.com\/documentation\/WatchKit\/WKInterfaceController\/contextsForSegue(withIdentifier:in:rowIndex:)"
        }
      ],
      "title" : "Managing segue-based transitions"
    }
  ],
  "source" : "appleJSON",
  "title" : "contextsForSegue(withIdentifier:)",
  "url" : "https:\/\/developer.apple.com\/documentation\/WatchKit\/WKInterfaceController\/contextsForSegue(withIdentifier:)"
}