{
  "abstract" : "Tells the delegate that the user started a workout session on the paired iPhone.",
  "codeExamples" : [

  ],
  "contentHash" : "ca4c0fb8ca00fd60149589969a5081ce8fc69559759eef79b511d0d50d54faac",
  "crawledAt" : "2025-12-01T10:45:55Z",
  "declaration" : {
    "code" : "@MainActor optional func handle(_ workoutConfiguration: HKWorkoutConfiguration)",
    "language" : "swift"
  },
  "id" : "C5D04420-1BC8-4F11-86F4-28EDE167B3BF",
  "kind" : "method",
  "module" : "WatchKit",
  "overview" : "## Discussion\n\nWhen your iPhone app starts a workout session using the HealthKit store’s `startWatchAppWithWorkoutConfiguration:completion:` method, the system launches or wakes the corresponding Watch app in the background and calls this method. Use this method to configure an [doc:\/\/com.apple.documentation\/documentation\/HealthKit\/HKWorkoutSession] object in your Watch app, and then call [doc:\/\/com.apple.documentation\/documentation\/HealthKit\/HKHealthStore\/start(_:)] to start the session.",
  "platforms" : [
    "watchOS"
  ],
  "rawMarkdown" : "---\nsource: https:\/\/developer.apple.com\/documentation\/WatchKit\/WKExtensionDelegate\/handle(_:)-f27i\ncrawled: 2025-12-01T10:45:55Z\n---\n\n# handle(_:)\n\n**Instance Method**\n\nTells the delegate that the user started a workout session on the paired iPhone.\n\n## Declaration\n\n```swift\n@MainActor optional func handle(_ workoutConfiguration: HKWorkoutConfiguration)\n```\n\n## Parameters\n\n- **workoutConfiguration**: The workout configuration data. You can use this information to start a workout session on the user’s Apple Watch.\n\n## Discussion\n\nWhen your iPhone app starts a workout session using the HealthKit store’s `startWatchAppWithWorkoutConfiguration:completion:` method, the system launches or wakes the corresponding Watch app in the background and calls this method. Use this method to configure an [doc:\/\/com.apple.documentation\/documentation\/HealthKit\/HKWorkoutSession] object in your Watch app, and then call [doc:\/\/com.apple.documentation\/documentation\/HealthKit\/HKHealthStore\/start(_:)] to start the session.\n\n## Handling a workout session\n\n- **handleActiveWorkoutRecovery()**: Tells the delegate when the app relaunches after crashing during an active workout session.\n\n",
  "sections" : [
    {
      "content" : "",
      "items" : [
        {
          "description" : "Tells the delegate when the app relaunches after crashing during an active workout session.",
          "name" : "handleActiveWorkoutRecovery()",
          "url" : "https:\/\/developer.apple.com\/documentation\/WatchKit\/WKExtensionDelegate\/handleActiveWorkoutRecovery()"
        }
      ],
      "title" : "Handling a workout session"
    }
  ],
  "source" : "appleJSON",
  "title" : "handle(_:)",
  "url" : "https:\/\/developer.apple.com\/documentation\/WatchKit\/WKExtensionDelegate\/handle(_:)-f27i"
}