{
  "abstract" : "Returns the last visible interface controller.",
  "codeExamples" : [

  ],
  "contentHash" : "61fdd3299ad280fbf18dd03fb5e00083710cad5d052804bb50205eab01dcf3ad",
  "crawledAt" : "2025-12-03T05:37:35Z",
  "declaration" : {
    "code" : "@MainActor var visibleInterfaceController: WKInterfaceController? { get }",
    "language" : "swift"
  },
  "id" : "5D5FE92B-30C4-40F8-AA98-BAF13198B59E",
  "kind" : "property",
  "language" : "swift",
  "module" : "WatchKit",
  "overview" : "## Discussion\n\nUse this property to determine which interface controller is currently displayed by the app. For example, in the extension delegate’s [doc:\/\/com.apple.watchkit\/documentation\/WatchKit\/WKExtensionDelegate\/handle(_:)-92ulv]  method for a snapshot request,  use this property to determine the user interface’s current contents, and make any changes before the snapshot is taken.\n\nOr, when the app is launched due to a Handoff activity, use the [doc:\/\/com.apple.watchkit\/documentation\/WatchKit\/WKExtensionDelegate\/handleUserActivity(_:)] method’s `userInfo` dictionary to determine what to display. Then use the [doc:\/\/com.apple.watchkit\/documentation\/WatchKit\/WKExtension\/visibleInterfaceController] property to determine whether to push or pop to a different interface controller.\n\nThis property contains the following values based on the app’s current state:",
  "platforms" : [
    "watchOS"
  ],
  "rawMarkdown" : "---\nsource: https:\/\/developer.apple.com\/documentation\/WatchKit\/WKExtension\/visibleInterfaceController\ncrawled: 2025-12-03T05:37:35Z\n---\n\n# visibleInterfaceController\n\n**Instance Property**\n\nReturns the last visible interface controller.\n\n## Declaration\n\n```swift\n@MainActor var visibleInterfaceController: WKInterfaceController? { get }\n```\n\n## Discussion\n\nUse this property to determine which interface controller is currently displayed by the app. For example, in the extension delegate’s [doc:\/\/com.apple.watchkit\/documentation\/WatchKit\/WKExtensionDelegate\/handle(_:)-92ulv]  method for a snapshot request,  use this property to determine the user interface’s current contents, and make any changes before the snapshot is taken.\n\nOr, when the app is launched due to a Handoff activity, use the [doc:\/\/com.apple.watchkit\/documentation\/WatchKit\/WKExtensionDelegate\/handleUserActivity(_:)] method’s `userInfo` dictionary to determine what to display. Then use the [doc:\/\/com.apple.watchkit\/documentation\/WatchKit\/WKExtension\/visibleInterfaceController] property to determine whether to push or pop to a different interface controller.\n\nThis property contains the following values based on the app’s current state:\n\n\n\n## Getting the interface controllers\n\n- **rootInterfaceController**: The app’s root interface controller.\n\n",
  "sections" : [
    {
      "content" : "",
      "items" : [
        {
          "description" : "The app’s root interface controller.",
          "name" : "rootInterfaceController",
          "url" : "https:\/\/developer.apple.com\/documentation\/WatchKit\/WKExtension\/rootInterfaceController"
        }
      ],
      "title" : "Getting the interface controllers"
    }
  ],
  "source" : "appleJSON",
  "title" : "visibleInterfaceController",
  "url" : "https:\/\/developer.apple.com\/documentation\/WatchKit\/WKExtension\/visibleInterfaceController"
}