{
  "abstract" : "A label that displays a countdown or count-up timer.",
  "codeExamples" : [

  ],
  "conformsTo" : [
    "CVarArg",
    "CustomDebugStringConvertible",
    "CustomStringConvertible",
    "Equatable",
    "Hashable",
    "NSObjectProtocol"
  ],
  "contentHash" : "585107f34ad526e9cbe3ba26ec143852d021a128d64fbab948cba9a5dd06e174",
  "crawledAt" : "2025-12-03T05:38:44Z",
  "declaration" : {
    "code" : "class WKInterfaceTimer",
    "language" : "swift"
  },
  "id" : "14730E5D-48FF-4D15-88F4-AF320C5C284F",
  "kind" : "class",
  "language" : "swift",
  "module" : "WatchKit",
  "overview" : "## Overview\n\nUse a timer object to configure the amount of time and the appearance of the timer text. When you start the timer, WatchKit updates the displayed text automatically on the user’s Apple Watch without further interactions from your extension. To know when the timer reaches 0, configure a [doc:\/\/com.apple.documentation\/documentation\/Foundation\/Timer] object with the same target date you used to set up the timer.\n\nDo not subclass or create instances of this class yourself. Instead, define outlets in your interface controller class and connect them to the corresponding objects in your storyboard file. For example, to refer to a timer object in your interface, define a property with the following syntax in your interface controller class:\n\nDuring the initialization of your interface controller, WatchKit creates any needed timer objects and assigns them to their connected outlets. At that point, you can use those objects to reconfigure the corresponding timers.\n\n### Interface Builder Configuration Options\n\nXcode lets you configure information about your timer interface object in your storyboard file. The following table lists the attributes you can configure and their meaning.\n\nA date object is a custom label whose text you cannot set directly. However, you can customize the appearance of the date object as you would for a label using the Attributes inspector in Xcode. For information about the label attributes you can configure, see [doc:\/\/com.apple.watchkit\/documentation\/WatchKit\/WKInterfaceLabel].",
  "platforms" : [
    "watchOS"
  ],
  "rawMarkdown" : "---\nsource: https:\/\/developer.apple.com\/documentation\/WatchKit\/WKInterfaceTimer\ncrawled: 2025-12-03T05:38:44Z\n---\n\n# WKInterfaceTimer\n\n**Class**\n\nA label that displays a countdown or count-up timer.\n\n## Declaration\n\n```swift\nclass WKInterfaceTimer\n```\n\n## Overview\n\nUse a timer object to configure the amount of time and the appearance of the timer text. When you start the timer, WatchKit updates the displayed text automatically on the user’s Apple Watch without further interactions from your extension. To know when the timer reaches 0, configure a [doc:\/\/com.apple.documentation\/documentation\/Foundation\/Timer] object with the same target date you used to set up the timer.\n\nDo not subclass or create instances of this class yourself. Instead, define outlets in your interface controller class and connect them to the corresponding objects in your storyboard file. For example, to refer to a timer object in your interface, define a property with the following syntax in your interface controller class:\n\n\n\nDuring the initialization of your interface controller, WatchKit creates any needed timer objects and assigns them to their connected outlets. At that point, you can use those objects to reconfigure the corresponding timers.\n\n\n\n### Interface Builder Configuration Options\n\nXcode lets you configure information about your timer interface object in your storyboard file. The following table lists the attributes you can configure and their meaning.\n\n\n\nA date object is a custom label whose text you cannot set directly. However, you can customize the appearance of the date object as you would for a label using the Attributes inspector in Xcode. For information about the label attributes you can configure, see [doc:\/\/com.apple.watchkit\/documentation\/WatchKit\/WKInterfaceLabel].\n\n## Configuring the Timer Attributes\n\n- **setDate(_:)**: Changes the start time for the timer.\n- **setTextColor(_:)**: Sets the color of the timer’s text.\n\n## Starting and Stopping the Timer\n\n- **start()**: Begins updates to the timer’s display.\n- **stop()**: Stops updates to the timer’s display.\n\n## Controls\n\n- **WKInterfaceLabel**: An interface element that displays static text.\n- **WKInterfaceDate**: A label that displays the current date or time.\n- **WKInterfaceButton**: A button in the user interface of your watchOS app.\n- **WKInterfaceAuthorizationAppleIDButton**: A button that you can use to trigger a Sign in with Apple request.\n- **WKInterfacePaymentButton**: A button that you can use to trigger payments through Apple Pay.\n- **WKInterfaceTextField**: An interface element that displays an editable text area.\n- **WKInterfaceSwitch**: An interface element that toggles between an On and Off state.\n- **WKInterfaceSlider**: An interface element that lets users select a single floating-point value from a range of values.\n- **WKInterfaceActivityRing**: A view that displays data from a HealthKit activity summary object.\n- **WKInterfaceMap**: An interface element that displays a noninteractive map for the location you specify.\n\n## Inherits From\n\n- WKInterfaceObject\n\n## Conforms To\n\n- CVarArg\n- CustomDebugStringConvertible\n- CustomStringConvertible\n- Equatable\n- Hashable\n- NSObjectProtocol\n\n",
  "sections" : [
    {
      "content" : "",
      "items" : [
        {
          "description" : "Changes the start time for the timer.",
          "name" : "setDate(_:)",
          "url" : "https:\/\/developer.apple.com\/documentation\/WatchKit\/WKInterfaceTimer\/setDate(_:)"
        },
        {
          "description" : "Sets the color of the timer’s text.",
          "name" : "setTextColor(_:)",
          "url" : "https:\/\/developer.apple.com\/documentation\/WatchKit\/WKInterfaceTimer\/setTextColor(_:)"
        }
      ],
      "title" : "Configuring the Timer Attributes"
    },
    {
      "content" : "",
      "items" : [
        {
          "description" : "Begins updates to the timer’s display.",
          "name" : "start()",
          "url" : "https:\/\/developer.apple.com\/documentation\/WatchKit\/WKInterfaceTimer\/start()"
        },
        {
          "description" : "Stops updates to the timer’s display.",
          "name" : "stop()",
          "url" : "https:\/\/developer.apple.com\/documentation\/WatchKit\/WKInterfaceTimer\/stop()"
        }
      ],
      "title" : "Starting and Stopping the Timer"
    },
    {
      "content" : "",
      "items" : [
        {
          "description" : "An interface element that displays static text.",
          "name" : "WKInterfaceLabel",
          "url" : "https:\/\/developer.apple.com\/documentation\/WatchKit\/WKInterfaceLabel"
        },
        {
          "description" : "A label that displays the current date or time.",
          "name" : "WKInterfaceDate",
          "url" : "https:\/\/developer.apple.com\/documentation\/WatchKit\/WKInterfaceDate"
        },
        {
          "description" : "A button in the user interface of your watchOS app.",
          "name" : "WKInterfaceButton",
          "url" : "https:\/\/developer.apple.com\/documentation\/WatchKit\/WKInterfaceButton"
        },
        {
          "description" : "A button that you can use to trigger a Sign in with Apple request.",
          "name" : "WKInterfaceAuthorizationAppleIDButton",
          "url" : "https:\/\/developer.apple.com\/documentation\/WatchKit\/WKInterfaceAuthorizationAppleIDButton"
        },
        {
          "description" : "A button that you can use to trigger payments through Apple Pay.",
          "name" : "WKInterfacePaymentButton",
          "url" : "https:\/\/developer.apple.com\/documentation\/WatchKit\/WKInterfacePaymentButton"
        },
        {
          "description" : "An interface element that displays an editable text area.",
          "name" : "WKInterfaceTextField",
          "url" : "https:\/\/developer.apple.com\/documentation\/WatchKit\/WKInterfaceTextField"
        },
        {
          "description" : "An interface element that toggles between an On and Off state.",
          "name" : "WKInterfaceSwitch",
          "url" : "https:\/\/developer.apple.com\/documentation\/WatchKit\/WKInterfaceSwitch"
        },
        {
          "description" : "An interface element that lets users select a single floating-point value from a range of values.",
          "name" : "WKInterfaceSlider",
          "url" : "https:\/\/developer.apple.com\/documentation\/WatchKit\/WKInterfaceSlider"
        },
        {
          "description" : "A view that displays data from a HealthKit activity summary object.",
          "name" : "WKInterfaceActivityRing",
          "url" : "https:\/\/developer.apple.com\/documentation\/WatchKit\/WKInterfaceActivityRing"
        },
        {
          "description" : "An interface element that displays a noninteractive map for the location you specify.",
          "name" : "WKInterfaceMap",
          "url" : "https:\/\/developer.apple.com\/documentation\/WatchKit\/WKInterfaceMap"
        }
      ],
      "title" : "Controls"
    },
    {
      "content" : "",
      "items" : [
        {
          "name" : "WKInterfaceObject"
        }
      ],
      "title" : "Inherits From"
    }
  ],
  "source" : "appleJSON",
  "title" : "WKInterfaceTimer",
  "url" : "https:\/\/developer.apple.com\/documentation\/WatchKit\/WKInterfaceTimer"
}