{
  "abstract" : "Presents a page-based interface modally.",
  "codeExamples" : [

  ],
  "contentHash" : "4c2945513e658ef016684edede99c8b61900214cc66eae8f2fe94e5ab12b584c",
  "crawledAt" : "2025-12-04T13:02:38Z",
  "declaration" : {
    "code" : "@MainActor func presentController(withNames names: [String], contexts: [Any]?)",
    "language" : "swift"
  },
  "id" : "8C6D3FDE-03C8-4616-9C53-BAC8FE4AB76C",
  "kind" : "method",
  "language" : "swift",
  "module" : "WatchKit",
  "overview" : "## Discussion\n\nAfter calling this method, WatchKit loads and initializes the new interface controllers and animates them into position on top of the current interface controller. A modal interface slides up from the bottom of the screen and completely cover the previous interface. WatchKit displays the first interface controller in the `names` array initially. The user can navigate to the other interfaces by swiping horizontally.\n\nThe title of the modal interface is set to the string `Cancel` by default. Change the title using the [doc:\/\/com.apple.watchkit\/documentation\/WatchKit\/WKInterfaceController\/setTitle(_:)] method. Tapping the title dismisses the interface automatically. To dismiss the interface programmatically, call the [doc:\/\/com.apple.watchkit\/documentation\/WatchKit\/WKInterfaceController\/dismiss()] method.\n\nAlways call this method from your WatchKit extension’s main thread.",
  "platforms" : [
    "watchOS"
  ],
  "rawMarkdown" : "---\nsource: https:\/\/developer.apple.com\/documentation\/WatchKit\/WKInterfaceController\/presentController(withNames:contexts:)\ncrawled: 2025-12-04T13:02:38Z\n---\n\n# presentController(withNames:contexts:)\n\n**Instance Method**\n\nPresents a page-based interface modally.\n\n## Declaration\n\n```swift\n@MainActor func presentController(withNames names: [String], contexts: [Any]?)\n```\n\n## Parameters\n\n- **names**: An array of strings, each of which contains the name of an interface controller you want to display in the page-based interface. In your storyboard, the name of an interface controller is stored in the object’s Identifier property, which is located in the attributes inspector. The order of the strings in the array is used to set the order of the corresponding interface controllers. This parameter must not be `nil` or an empty array.\n- **contexts**: An array of context objects to pass to the new interface controllers. Use the objects in this array to communicate important information to the new interface controllers, such as the data to display or any relevant state information. You may specify `nil` for this parameter, but doing so is not recommended.\n\nEach object in the array is passed to the interface controller at the same index in the `names` parameter.\n\n## Discussion\n\nAfter calling this method, WatchKit loads and initializes the new interface controllers and animates them into position on top of the current interface controller. A modal interface slides up from the bottom of the screen and completely cover the previous interface. WatchKit displays the first interface controller in the `names` array initially. The user can navigate to the other interfaces by swiping horizontally.\n\nThe title of the modal interface is set to the string `Cancel` by default. Change the title using the [doc:\/\/com.apple.watchkit\/documentation\/WatchKit\/WKInterfaceController\/setTitle(_:)] method. Tapping the title dismisses the interface automatically. To dismiss the interface programmatically, call the [doc:\/\/com.apple.watchkit\/documentation\/WatchKit\/WKInterfaceController\/dismiss()] method.\n\nAlways call this method from your WatchKit extension’s main thread.\n\n## Presenting interface controllers modally\n\n- **presentController(withName:context:)**: Presents a single interface controller modally.\n- **presentController(withNamesAndContexts:)**: Presents a page-based interface modally.\n- **presentAlert(withTitle:message:preferredStyle:actions:)**: Presents an alert or action sheet over the current interface controller.\n- **WKAlertControllerStyle**: Constants indicating the styles for standard system alerts.\n- **dismiss()**: Dismisses the current interface controller from the screen.\n\n",
  "sections" : [
    {
      "content" : "",
      "items" : [
        {
          "description" : "Presents a single interface controller modally.",
          "name" : "presentController(withName:context:)",
          "url" : "https:\/\/developer.apple.com\/documentation\/WatchKit\/WKInterfaceController\/presentController(withName:context:)"
        },
        {
          "description" : "Presents a page-based interface modally.",
          "name" : "presentController(withNamesAndContexts:)",
          "url" : "https:\/\/developer.apple.com\/documentation\/WatchKit\/WKInterfaceController\/presentController(withNamesAndContexts:)"
        },
        {
          "description" : "Presents an alert or action sheet over the current interface controller.",
          "name" : "presentAlert(withTitle:message:preferredStyle:actions:)",
          "url" : "https:\/\/developer.apple.com\/documentation\/WatchKit\/WKInterfaceController\/presentAlert(withTitle:message:preferredStyle:actions:)"
        },
        {
          "description" : "Constants indicating the styles for standard system alerts.",
          "name" : "WKAlertControllerStyle",
          "url" : "https:\/\/developer.apple.com\/documentation\/WatchKit\/WKAlertControllerStyle"
        },
        {
          "description" : "Dismisses the current interface controller from the screen.",
          "name" : "dismiss()",
          "url" : "https:\/\/developer.apple.com\/documentation\/WatchKit\/WKInterfaceController\/dismiss()"
        }
      ],
      "title" : "Presenting interface controllers modally"
    }
  ],
  "source" : "appleJSON",
  "title" : "presentController(withNames:contexts:)",
  "url" : "https:\/\/developer.apple.com\/documentation\/WatchKit\/WKInterfaceController\/presentController(withNames:contexts:)"
}