{
  "abstract" : "Animates the specified images with the given duration and repeat information.",
  "codeExamples" : [

  ],
  "contentHash" : "1e8a85c5b034c3ec628e7905cf71318ab80b9581c15c5c1ad030c4fc11edd46f",
  "crawledAt" : "2025-12-04T11:34:08Z",
  "declaration" : {
    "code" : "func startAnimatingWithImages(in imageRange: NSRange, duration: TimeInterval, repeatCount: Int)",
    "language" : "swift"
  },
  "id" : "E49BFE6D-4A9C-4EFD-9EB8-BC6F63B55D1E",
  "kind" : "method",
  "language" : "swift",
  "module" : "WatchKit",
  "overview" : "## Discussion\n\nThis method animates a subset of the images associated with the current image interface object. This method starts the animation from the first image in the specified range.",
  "platforms" : [
    "watchOS"
  ],
  "rawMarkdown" : "---\nsource: https:\/\/developer.apple.com\/documentation\/WatchKit\/WKImageAnimatable\/startAnimatingWithImages(in:duration:repeatCount:)\ncrawled: 2025-12-04T11:34:08Z\n---\n\n# startAnimatingWithImages(in:duration:repeatCount:)\n\n**Instance Method**\n\nAnimates the specified images with the given duration and repeat information.\n\n## Declaration\n\n```swift\nfunc startAnimatingWithImages(in imageRange: NSRange, duration: TimeInterval, repeatCount: Int)\n```\n\n## Parameters\n\n- **imageRange**: The range of images to be animated. The value `0` indicates the first image in the sequence, the value `1` the second image, and so on.\n- **duration**: The time (in seconds) over which to animate a single loop of the images. Positive values cause the animation to start at the first frame in the sequence and end on the last frame. Negative values causes the animation to play in reverse order and end on the first frame in the sequence.\n- **repeatCount**: The number of times to repeat the animation loop. Specify `0` to animate the images indefinitely.\n\n## Discussion\n\nThis method animates a subset of the images associated with the current image interface object. This method starts the animation from the first image in the specified range.\n\n## Animating an Image Sequence\n\n- **startAnimating()**: Begins animating the current sequence of images.\n- **stopAnimating()**: Stops any in-progress animations.\n\n",
  "sections" : [
    {
      "content" : "",
      "items" : [
        {
          "description" : "Begins animating the current sequence of images.",
          "name" : "startAnimating()",
          "url" : "https:\/\/developer.apple.com\/documentation\/WatchKit\/WKImageAnimatable\/startAnimating()"
        },
        {
          "description" : "Stops any in-progress animations.",
          "name" : "stopAnimating()",
          "url" : "https:\/\/developer.apple.com\/documentation\/WatchKit\/WKImageAnimatable\/stopAnimating()"
        }
      ],
      "title" : "Animating an Image Sequence"
    }
  ],
  "source" : "appleJSON",
  "title" : "startAnimatingWithImages(in:duration:repeatCount:)",
  "url" : "https:\/\/developer.apple.com\/documentation\/WatchKit\/WKImageAnimatable\/startAnimatingWithImages(in:duration:repeatCount:)"
}