{
  "abstract" : "Tells the delegate when the user plays audio in the corresponding iOS app.",
  "codeExamples" : [

  ],
  "contentHash" : "0acba6bca133f457690d794746904263a61320c07944400d9a9698e4cc76f692",
  "crawledAt" : "2025-12-03T05:37:24Z",
  "declaration" : {
    "code" : "@MainActor optional func handleRemoteNowPlayingActivity()",
    "language" : "swift"
  },
  "id" : "BAE29B62-66A4-4037-A654-D2CF2EF1DDEE",
  "kind" : "method",
  "language" : "swift",
  "module" : "WatchKit",
  "overview" : "## Discussion\n\nUse this method to update your user interface and display information about the iOS app’s content.\n\nWhen the user begins playing audio content on the corresponding iOS app, your watch app automatically launches and becomes the frontmost app, similar to the behavior of the Now Playing app. It remains the frontmost app until the user pauses the audio or exits your watch app.\n\nTo opt out of this autolaunch behavior, set the Opt out of Auto-launch Audio App (`PUICAutoLaunchAudioOptOut`) key in your watchOS app’s `info.plist` file.\n\n",
  "platforms" : [
    "watchOS"
  ],
  "rawMarkdown" : "---\nsource: https:\/\/developer.apple.com\/documentation\/WatchKit\/WKApplicationDelegate\/handleRemoteNowPlayingActivity()\ncrawled: 2025-12-03T05:37:24Z\n---\n\n# handleRemoteNowPlayingActivity()\n\n**Instance Method**\n\nTells the delegate when the user plays audio in the corresponding iOS app.\n\n## Declaration\n\n```swift\n@MainActor optional func handleRemoteNowPlayingActivity()\n```\n\n## Discussion\n\nUse this method to update your user interface and display information about the iOS app’s content.\n\nWhen the user begins playing audio content on the corresponding iOS app, your watch app automatically launches and becomes the frontmost app, similar to the behavior of the Now Playing app. It remains the frontmost app until the user pauses the audio or exits your watch app.\n\nTo opt out of this autolaunch behavior, set the Opt out of Auto-launch Audio App (`PUICAutoLaunchAudioOptOut`) key in your watchOS app’s `info.plist` file.\n\n\n\n",
  "sections" : [

  ],
  "source" : "appleJSON",
  "title" : "handleRemoteNowPlayingActivity()",
  "url" : "https:\/\/developer.apple.com\/documentation\/WatchKit\/WKApplicationDelegate\/handleRemoteNowPlayingActivity()"
}