{
  "abstract" : "Removes the specified rows from the table.",
  "codeExamples" : [

  ],
  "contentHash" : "427a00f8377f2831c2d1339d00f68a1af602d7ca79bc56bdd1d151d78422e3db",
  "crawledAt" : "2025-12-04T13:04:13Z",
  "declaration" : {
    "code" : "func removeRows(at rows: IndexSet)",
    "language" : "swift"
  },
  "id" : "E9E1270A-C68A-4E03-A1C5-31F7F7D0F8BD",
  "kind" : "method",
  "language" : "swift",
  "module" : "WatchKit",
  "overview" : "## Discussion\n\nThis method removes row controllers from the table using the same semantics defined by the [doc:\/\/com.apple.documentation\/documentation\/Foundation\/NSMutableArray\/removeObjects(at:)] method of [doc:\/\/com.apple.documentation\/documentation\/Foundation\/NSMutableArray].",
  "platforms" : [
    "watchOS"
  ],
  "rawMarkdown" : "---\nsource: https:\/\/developer.apple.com\/documentation\/WatchKit\/WKInterfaceTable\/removeRows(at:)\ncrawled: 2025-12-04T13:04:13Z\n---\n\n# removeRows(at:)\n\n**Instance Method**\n\nRemoves the specified rows from the table.\n\n## Declaration\n\n```swift\nfunc removeRows(at rows: IndexSet)\n```\n\n## Parameters\n\n- **rows**: An index set corresponding to the rows you want to remove. If any of the indexes are invalid, this method raises an exception.\n\n## Discussion\n\nThis method removes row controllers from the table using the same semantics defined by the [doc:\/\/com.apple.documentation\/documentation\/Foundation\/NSMutableArray\/removeObjects(at:)] method of [doc:\/\/com.apple.documentation\/documentation\/Foundation\/NSMutableArray].\n\n## Inserting and Removing Rows\n\n- **insertRows(at:withRowType:)**: Inserts rows into the table at the specified indexes.\n\n",
  "sections" : [
    {
      "content" : "",
      "items" : [
        {
          "description" : "Inserts rows into the table at the specified indexes.",
          "name" : "insertRows(at:withRowType:)",
          "url" : "https:\/\/developer.apple.com\/documentation\/WatchKit\/WKInterfaceTable\/insertRows(at:withRowType:)"
        }
      ],
      "title" : "Inserting and Removing Rows"
    }
  ],
  "source" : "appleJSON",
  "title" : "removeRows(at:)",
  "url" : "https:\/\/developer.apple.com\/documentation\/WatchKit\/WKInterfaceTable\/removeRows(at:)"
}