{
  "abstract" : "Ends the delivery of crown events to the current crown sequencer.",
  "codeExamples" : [

  ],
  "contentHash" : "c22374c5c9eda607405255a047fdff89261833f77c5a949664698c28707ebed0",
  "crawledAt" : "2025-12-04T11:34:45Z",
  "declaration" : {
    "code" : "func resignFocus()",
    "language" : "swift"
  },
  "id" : "5D70C499-CE5D-4475-AF42-32578CFD7516",
  "kind" : "method",
  "language" : "swift",
  "module" : "WatchKit",
  "overview" : "## Discussion\n\nCall this method when you no longer want to receive crown events in the current crown sequencer. If the user taps a picker object or a scrollable scene in your interface, the system automatically removes the focus from any active crown sequencer.",
  "platforms" : [
    "watchOS"
  ],
  "rawMarkdown" : "---\nsource: https:\/\/developer.apple.com\/documentation\/WatchKit\/WKCrownSequencer\/resignFocus()\ncrawled: 2025-12-04T11:34:45Z\n---\n\n# resignFocus()\n\n**Instance Method**\n\nEnds the delivery of crown events to the current crown sequencer.\n\n## Declaration\n\n```swift\nfunc resignFocus()\n```\n\n## Discussion\n\nCall this method when you no longer want to receive crown events in the current crown sequencer. If the user taps a picker object or a scrollable scene in your interface, the system automatically removes the focus from any active crown sequencer.\n\n## Managing the Focus\n\n- **focus()**: Begins the delivery of crown events to the current crown sequencer.\n\n",
  "sections" : [
    {
      "content" : "",
      "items" : [
        {
          "description" : "Begins the delivery of crown events to the current crown sequencer.",
          "name" : "focus()",
          "url" : "https:\/\/developer.apple.com\/documentation\/WatchKit\/WKCrownSequencer\/focus()"
        }
      ],
      "title" : "Managing the Focus"
    }
  ],
  "source" : "appleJSON",
  "title" : "resignFocus()",
  "url" : "https:\/\/developer.apple.com\/documentation\/WatchKit\/WKCrownSequencer\/resignFocus()"
}