{
  "abstract" : "An optional dictionary containing additional style values that are not explicitly defined by the receiver.",
  "codeExamples" : [

  ],
  "contentHash" : "5735dcaae61bb9cd617cf32ac9b8be063376cb3e460ea974f59ee1d8dc0af88e",
  "crawledAt" : "2025-12-08T01:26:03Z",
  "declaration" : {
    "code" : "var style: [AnyHashable : Any]? { get set }",
    "language" : "swift"
  },
  "id" : "608FDA5D-9BA1-440F-B202-0C61EC94176C",
  "kind" : "property",
  "language" : "swift",
  "module" : "Core Animation",
  "overview" : "## Discussion\n\nThis dictionary may in turn have a `style` key, forming a hierarchy of default values. In the case of hierarchical style dictionaries the shallowest value for a property is used. For example, the value for “style.someValue” takes precedence over “style.style.someValue”.\n\nIf the style dictionary doesn’t define a value for an attribute, the cell’s [doc:\/\/com.apple.quartzcore\/documentation\/QuartzCore\/CAEmitterCell\/defaultValue(forKey:)] class method is called.\n\nThe style dictionary is not consulted for the following keys: `bounds`, `frame`.\n\nThe default value of this property is `nil`.",
  "platforms" : [
    "iOS",
    "iPadOS",
    "Mac Catalyst",
    "macOS",
    "tvOS",
    "visionOS"
  ],
  "rawMarkdown" : "---\nsource: https:\/\/developer.apple.com\/documentation\/QuartzCore\/CAEmitterCell\/style\ncrawled: 2025-12-08T01:26:03Z\n---\n\n# style\n\n**Instance Property**\n\nAn optional dictionary containing additional style values that are not explicitly defined by the receiver.\n\n## Declaration\n\n```swift\nvar style: [AnyHashable : Any]? { get set }\n```\n\n## Discussion\n\nThis dictionary may in turn have a `style` key, forming a hierarchy of default values. In the case of hierarchical style dictionaries the shallowest value for a property is used. For example, the value for “style.someValue” takes precedence over “style.style.someValue”.\n\nIf the style dictionary doesn’t define a value for an attribute, the cell’s [doc:\/\/com.apple.quartzcore\/documentation\/QuartzCore\/CAEmitterCell\/defaultValue(forKey:)] class method is called.\n\nThe style dictionary is not consulted for the following keys: `bounds`, `frame`.\n\nThe default value of this property is `nil`.\n\n\n\n## Setting Emitter Cell Visual Attributes\n\n- **isEnabled**: A Boolean value indicating whether or not cells from this emitter are rendered.\n- **color**: The color of each emitted object. Animatable.\n- **redRange**: The amount by which the red color component of the cell can vary. Animatable.\n- **greenRange**: The amount by which the green color component of the cell can vary. Animatable.\n- **blueRange**: The amount by which the blue color component of the cell can vary. Animatable.\n- **alphaRange**: The amount by which the alpha component of the cell can vary. Animatable.\n- **redSpeed**: The speed, in seconds, at which the red color component changes over the lifetime of the cell. Animatable.\n- **greenSpeed**: The speed, in seconds, at which the green color component changes over the lifetime of the cell. Animatable.\n- **blueSpeed**: The speed, in seconds, at which the blue color component changes over the lifetime of the cell. Animatable.\n- **alphaSpeed**: The speed, in seconds, at which the alpha component changes over the lifetime of the cell. Animatable.\n- **magnificationFilter**: The filter used when increasing the size of the content.\n- **minificationFilter**: The filter used when reducing the size of the content.\n- **minificationFilterBias**: The bias factor used by the minification filter to determine the levels of detail.\n- **scale**: Specifies the scale factor applied to the cell. Animatable.\n- **scaleRange**: Specifies the range over which the scale value can vary. Animatable.\n\n",
  "sections" : [
    {
      "content" : "",
      "items" : [
        {
          "description" : "A Boolean value indicating whether or not cells from this emitter are rendered.",
          "name" : "isEnabled",
          "url" : "https:\/\/developer.apple.com\/documentation\/QuartzCore\/CAEmitterCell\/isEnabled"
        },
        {
          "description" : "The color of each emitted object. Animatable.",
          "name" : "color",
          "url" : "https:\/\/developer.apple.com\/documentation\/QuartzCore\/CAEmitterCell\/color"
        },
        {
          "description" : "The amount by which the red color component of the cell can vary. Animatable.",
          "name" : "redRange",
          "url" : "https:\/\/developer.apple.com\/documentation\/QuartzCore\/CAEmitterCell\/redRange"
        },
        {
          "description" : "The amount by which the green color component of the cell can vary. Animatable.",
          "name" : "greenRange",
          "url" : "https:\/\/developer.apple.com\/documentation\/QuartzCore\/CAEmitterCell\/greenRange"
        },
        {
          "description" : "The amount by which the blue color component of the cell can vary. Animatable.",
          "name" : "blueRange",
          "url" : "https:\/\/developer.apple.com\/documentation\/QuartzCore\/CAEmitterCell\/blueRange"
        },
        {
          "description" : "The amount by which the alpha component of the cell can vary. Animatable.",
          "name" : "alphaRange",
          "url" : "https:\/\/developer.apple.com\/documentation\/QuartzCore\/CAEmitterCell\/alphaRange"
        },
        {
          "description" : "The speed, in seconds, at which the red color component changes over the lifetime of the cell. Animatable.",
          "name" : "redSpeed",
          "url" : "https:\/\/developer.apple.com\/documentation\/QuartzCore\/CAEmitterCell\/redSpeed"
        },
        {
          "description" : "The speed, in seconds, at which the green color component changes over the lifetime of the cell. Animatable.",
          "name" : "greenSpeed",
          "url" : "https:\/\/developer.apple.com\/documentation\/QuartzCore\/CAEmitterCell\/greenSpeed"
        },
        {
          "description" : "The speed, in seconds, at which the blue color component changes over the lifetime of the cell. Animatable.",
          "name" : "blueSpeed",
          "url" : "https:\/\/developer.apple.com\/documentation\/QuartzCore\/CAEmitterCell\/blueSpeed"
        },
        {
          "description" : "The speed, in seconds, at which the alpha component changes over the lifetime of the cell. Animatable.",
          "name" : "alphaSpeed",
          "url" : "https:\/\/developer.apple.com\/documentation\/QuartzCore\/CAEmitterCell\/alphaSpeed"
        },
        {
          "description" : "The filter used when increasing the size of the content.",
          "name" : "magnificationFilter",
          "url" : "https:\/\/developer.apple.com\/documentation\/QuartzCore\/CAEmitterCell\/magnificationFilter"
        },
        {
          "description" : "The filter used when reducing the size of the content.",
          "name" : "minificationFilter",
          "url" : "https:\/\/developer.apple.com\/documentation\/QuartzCore\/CAEmitterCell\/minificationFilter"
        },
        {
          "description" : "The bias factor used by the minification filter to determine the levels of detail.",
          "name" : "minificationFilterBias",
          "url" : "https:\/\/developer.apple.com\/documentation\/QuartzCore\/CAEmitterCell\/minificationFilterBias"
        },
        {
          "description" : "Specifies the scale factor applied to the cell. Animatable.",
          "name" : "scale",
          "url" : "https:\/\/developer.apple.com\/documentation\/QuartzCore\/CAEmitterCell\/scale"
        },
        {
          "description" : "Specifies the range over which the scale value can vary. Animatable.",
          "name" : "scaleRange",
          "url" : "https:\/\/developer.apple.com\/documentation\/QuartzCore\/CAEmitterCell\/scaleRange"
        }
      ],
      "title" : "Setting Emitter Cell Visual Attributes"
    }
  ],
  "source" : "appleJSON",
  "title" : "style",
  "url" : "https:\/\/developer.apple.com\/documentation\/QuartzCore\/CAEmitterCell\/style"
}