{
  "abstract" : "Learn which extensions to the RFC 3501 IMAP protocol are supported by Mail for iOS, iPadOS, and visionOS.",
  "codeExamples" : [

  ],
  "contentHash" : "37cf0d87522cd7402e6d1266b0b85f036e32b6972999be7dd31d6c1f7cdb92b5",
  "crawledAt" : "2025-12-05T10:31:40Z",
  "id" : "59807B4A-0B54-4EEE-A3A9-3A3E65C75A3D",
  "kind" : "article",
  "language" : "swift",
  "overview" : "## Overview\n\nThe IMAP protocol defined in [https:\/\/www.rfc-editor.org\/rfc\/rfc3501.html] (IMAP4rev1) is one of the protocols used by Mail for iOS, iPadOS, and visionOS to connect to email servers.\n\nTo improve efficiency and performance for both the Mail app and email servers, the Mail app supports various extensions to the IMAP protocol. This document is intended for IMAP email server implementers to guide decisions on which extensions to support. For example, the `CONDSTORE`, `IDLE`, and `ESEARCH` extensions are especially important for efficient synchronization.\n\n## Details\n\nBelow are the IMAP extensions that Mail for iOS, iPadOS, and visionOS uses, with descriptions of their implementation.\n\n## Revision History",
  "rawMarkdown" : "---\nsource: https:\/\/developer.apple.com\/documentation\/Technotes\/tn3191-imap-extensions-supported-by-mail\ncrawled: 2025-12-05T10:31:40Z\n---\n\n# TN3191: IMAP extensions supported by Mail for iOS, iPadOS, and visionOS\n\n**Article**\n\nLearn which extensions to the RFC 3501 IMAP protocol are supported by Mail for iOS, iPadOS, and visionOS.\n\n## Overview\n\nThe IMAP protocol defined in [https:\/\/www.rfc-editor.org\/rfc\/rfc3501.html] (IMAP4rev1) is one of the protocols used by Mail for iOS, iPadOS, and visionOS to connect to email servers.\n\nTo improve efficiency and performance for both the Mail app and email servers, the Mail app supports various extensions to the IMAP protocol. This document is intended for IMAP email server implementers to guide decisions on which extensions to support. For example, the `CONDSTORE`, `IDLE`, and `ESEARCH` extensions are especially important for efficient synchronization.\n\n## Details\n\nBelow are the IMAP extensions that Mail for iOS, iPadOS, and visionOS uses, with descriptions of their implementation.\n\n\n\n## Revision History\n\n- **2025-08-27** First published.\n\n## Latest\n\n- **TN3190: USB audio device design considerations**: Learn the best techniques for designing devices that conform to the USB Audio Device Class specifications.\n- **TN3194: Handling account deletions and revoking tokens for Sign in with Apple**: Learn the best techniques for managing Sign in with Apple user sessions and responding to account deletion requests.\n- **TN3193: Managing the on-device foundation model’s context window**: Learn how to budget for the context window limit of Apple’s on-device foundation model and handle the error when reaching the limit.\n- **TN3115: Bluetooth State Restoration app relaunch rules**: Learn about the conditions under which an iOS app will be relaunched by Bluetooth State Restoration.\n- **TN3192: Migrating your iPad app from the deprecated UIRequiresFullScreen key**: Support iPad multitasking and dynamic resizing while updating your app to remove the deprecated full-screen compatibility mode.\n- **TN3151: Choosing the right networking API**: Learn which networking API is best for you.\n- **TN3111: iOS Wi-Fi API overview**: Explore the various Wi-Fi APIs available on iOS and their expected use cases.\n- **TN3134: Network Extension provider deployment**: Explore the platforms, packaging, OS versions, and device configurations for Network Extension provider deployment.\n- **TN3179: Understanding local network privacy**: Learn how local network privacy affects your software.\n- **TN3189: Managing Mail background traffic load**: Identify iOS Mail background traffic and manage its impact on your IMAP server.\n- **TN3187: Migrating to the UIKit scene-based life cycle**: Update your app to receive scene-based life-cycle events and manage your user interface using scene objects and methods.\n- **TN3188: Troubleshooting In-App Purchases availability in the App Store**: Verify your In-App Purchases are approved and available for sale in the App Store.\n- **TN3186: Troubleshooting In-App Purchases availability in the sandbox**: Identify common configurations that make your In-App Purchases unavailable in the sandbox environment.\n- **TN3185: Troubleshooting In-App Purchases availability in Xcode**: Inspect your active StoreKit configuration file for unexpected configurations.\n- **TN3182: Adding privacy tracking keys to your privacy manifest**: Declare the tracking domains you use in your app or third-party SDK in a privacy manifest.\n\n",
  "sections" : [
    {
      "content" : "",
      "items" : [
        {
          "description" : "Learn the best techniques for designing devices that conform to the USB Audio Device Class specifications.",
          "name" : "TN3190: USB audio device design considerations",
          "url" : "https:\/\/developer.apple.com\/documentation\/Technotes\/tn3190-USB-audio-device-design-considerations"
        },
        {
          "description" : "Learn the best techniques for managing Sign in with Apple user sessions and responding to account deletion requests.",
          "name" : "TN3194: Handling account deletions and revoking tokens for Sign in with Apple",
          "url" : "https:\/\/developer.apple.com\/documentation\/Technotes\/tn3194-handling-account-deletions-and-revoking-tokens-for-sign-in-with-apple"
        },
        {
          "description" : "Learn how to budget for the context window limit of Apple’s on-device foundation model and handle the error when reaching the limit.",
          "name" : "TN3193: Managing the on-device foundation model’s context window",
          "url" : "https:\/\/developer.apple.com\/documentation\/Technotes\/tn3193-managing-the-on-device-foundation-model-s-context-window"
        },
        {
          "description" : "Learn about the conditions under which an iOS app will be relaunched by Bluetooth State Restoration.",
          "name" : "TN3115: Bluetooth State Restoration app relaunch rules",
          "url" : "https:\/\/developer.apple.com\/documentation\/Technotes\/tn3115-bluetooth-state-restoration-app-relaunch-rules"
        },
        {
          "description" : "Support iPad multitasking and dynamic resizing while updating your app to remove the deprecated full-screen compatibility mode.",
          "name" : "TN3192: Migrating your iPad app from the deprecated UIRequiresFullScreen key",
          "url" : "https:\/\/developer.apple.com\/documentation\/Technotes\/tn3192-Migrating-your-app-from-the-deprecated-UIRequiresFullScreen-key"
        },
        {
          "description" : "Learn which networking API is best for you.",
          "name" : "TN3151: Choosing the right networking API",
          "url" : "https:\/\/developer.apple.com\/documentation\/Technotes\/tn3151-choosing-the-right-networking-api"
        },
        {
          "description" : "Explore the various Wi-Fi APIs available on iOS and their expected use cases.",
          "name" : "TN3111: iOS Wi-Fi API overview",
          "url" : "https:\/\/developer.apple.com\/documentation\/Technotes\/tn3111-ios-wifi-api-overview"
        },
        {
          "description" : "Explore the platforms, packaging, OS versions, and device configurations for Network Extension provider deployment.",
          "name" : "TN3134: Network Extension provider deployment",
          "url" : "https:\/\/developer.apple.com\/documentation\/Technotes\/tn3134-network-extension-provider-deployment"
        },
        {
          "description" : "Learn how local network privacy affects your software.",
          "name" : "TN3179: Understanding local network privacy",
          "url" : "https:\/\/developer.apple.com\/documentation\/Technotes\/tn3179-understanding-local-network-privacy"
        },
        {
          "description" : "Identify iOS Mail background traffic and manage its impact on your IMAP server.",
          "name" : "TN3189: Managing Mail background traffic load",
          "url" : "https:\/\/developer.apple.com\/documentation\/Technotes\/tn3189-managing-mail-background-traffic-load"
        },
        {
          "description" : "Update your app to receive scene-based life-cycle events and manage your user interface using scene objects and methods.",
          "name" : "TN3187: Migrating to the UIKit scene-based life cycle",
          "url" : "https:\/\/developer.apple.com\/documentation\/Technotes\/tn3187-Migrating-to-the-UIKit-scene-based-life-cycle"
        },
        {
          "description" : "Verify your In-App Purchases are approved and available for sale in the App Store.",
          "name" : "TN3188: Troubleshooting In-App Purchases availability in the App Store",
          "url" : "https:\/\/developer.apple.com\/documentation\/Technotes\/tn3188-troubleshooting-in-app-purchases-availability-in-the-app-store"
        },
        {
          "description" : "Identify common configurations that make your In-App Purchases unavailable in the sandbox environment.",
          "name" : "TN3186: Troubleshooting In-App Purchases availability in the sandbox",
          "url" : "https:\/\/developer.apple.com\/documentation\/Technotes\/tn3186-troubleshooting-in-app-purchases-availability-in-the-sandbox"
        },
        {
          "description" : "Inspect your active StoreKit configuration file for unexpected configurations.",
          "name" : "TN3185: Troubleshooting In-App Purchases availability in Xcode",
          "url" : "https:\/\/developer.apple.com\/documentation\/Technotes\/tn3185-troubleshooting-in-app-purchases-availability-in-xcode"
        },
        {
          "description" : "Declare the tracking domains you use in your app or third-party SDK in a privacy manifest.",
          "name" : "TN3182: Adding privacy tracking keys to your privacy manifest",
          "url" : "https:\/\/developer.apple.com\/documentation\/Technotes\/tn3182-adding-privacy-tracking-keys-to-your-privacy-manifest"
        }
      ],
      "title" : "Latest"
    }
  ],
  "source" : "appleJSON",
  "title" : "TN3191: IMAP extensions supported by Mail for iOS, iPadOS, and visionOS",
  "url" : "https:\/\/developer.apple.com\/documentation\/Technotes\/tn3191-imap-extensions-supported-by-mail"
}