{
  "abstract" : "Option to specify the log path to use for ubiquitous content logs.",
  "codeExamples" : [

  ],
  "contentHash" : "4b32d1a183222c22a7457ae62142f9bf09825f1d4b6d01d7ff3cde225ec87c10",
  "crawledAt" : "2025-12-04T20:36:50Z",
  "declaration" : {
    "code" : "let NSPersistentStoreUbiquitousContentURLKey: String",
    "language" : "swift"
  },
  "id" : "EF616BC5-AB9D-4542-BBCD-1FDDFA720022",
  "kind" : "unknown",
  "language" : "swift",
  "module" : "Core Data",
  "overview" : "## Discussion\n\nIn iOS 6 and OS X 10.8 and below, this option is required for ubiquitous content to function. In iOS 7 and macOS 10.9 and later, it is optional.",
  "platforms" : [
    "iOS",
    "iPadOS",
    "Mac Catalyst",
    "macOS",
    "visionOS"
  ],
  "rawMarkdown" : "---\nsource: https:\/\/developer.apple.com\/documentation\/CoreData\/NSPersistentStoreUbiquitousContentURLKey\ncrawled: 2025-12-04T20:36:50Z\n---\n\n# NSPersistentStoreUbiquitousContentURLKey\n\n**Global Variable**\n\nOption to specify the log path to use for ubiquitous content logs.\n\n## Declaration\n\n```swift\nlet NSPersistentStoreUbiquitousContentURLKey: String\n```\n\n## Discussion\n\nIn iOS 6 and OS X 10.8 and below, this option is required for ubiquitous content to function. In iOS 7 and macOS 10.9 and later, it is optional.\n\n## Deprecated\n\n- **NSExternalRecordsDirectoryOption**: Option indicating the directory where Spotlight external record files should be written to.\n- **NSExternalRecordExtensionOption**: Option indicating the file extension to use for Spotlight external record files.\n- **NSExternalRecordsFileFormatOption**: Option to specify the file format of a Spotlight external records.\n- **NSPersistentStoreUbiquitousContentNameKey**: Option to specify that a persistent store has a given name in ubiquity.\n- **NSPersistentStoreUbiquitousPeerTokenOption**: The corresponding value is an optionally specified string which will be mixed in to Core Data’s identifier for each iCloud peer. The value must be an alphanumeric string without any special characters, whitespace or punctuation. The primary use for this option is to allow multiple applications on the same peer (device) to share a Core Data store integrated with iCloud. Each application will require its own store file.\n- **NSPersistentStoreRemoveUbiquitousMetadataOption**: The corresponding value is an `NSNumber` object representing a boolean that indicates whether the receiver should remove all associated ubiquity metadata from a persistent store. You typically use this option during migration or copying to disassociate a persistent store file from an iCloud account.\n- **NSPersistentStoreUbiquitousContainerIdentifierKey**: The a string specifying the iCloud container identifier.\n- **NSPersistentStoreRebuildFromUbiquitousContentOption**: The corresponding value is an `NSNumber` object representing a boolean that indicates whether the receiver should erase the local store file and rebuild it from the iCloud data in Mobile Documents.\n\n",
  "sections" : [
    {
      "content" : "",
      "items" : [
        {
          "description" : "Option indicating the directory where Spotlight external record files should be written to.",
          "name" : "NSExternalRecordsDirectoryOption",
          "url" : "https:\/\/developer.apple.com\/documentation\/CoreData\/NSExternalRecordsDirectoryOption"
        },
        {
          "description" : "Option indicating the file extension to use for Spotlight external record files.",
          "name" : "NSExternalRecordExtensionOption",
          "url" : "https:\/\/developer.apple.com\/documentation\/CoreData\/NSExternalRecordExtensionOption"
        },
        {
          "description" : "Option to specify the file format of a Spotlight external records.",
          "name" : "NSExternalRecordsFileFormatOption",
          "url" : "https:\/\/developer.apple.com\/documentation\/CoreData\/NSExternalRecordsFileFormatOption"
        },
        {
          "description" : "Option to specify that a persistent store has a given name in ubiquity.",
          "name" : "NSPersistentStoreUbiquitousContentNameKey",
          "url" : "https:\/\/developer.apple.com\/documentation\/CoreData\/NSPersistentStoreUbiquitousContentNameKey"
        },
        {
          "description" : "The corresponding value is an optionally specified string which will be mixed in to Core Data’s identifier for each iCloud peer. The value must be an alphanumeric string without any special characters, whitespace or punctuation. The primary use for this option is to allow multiple applications on the same peer (device) to share a Core Data store integrated with iCloud. Each application will require its own store file.",
          "name" : "NSPersistentStoreUbiquitousPeerTokenOption",
          "url" : "https:\/\/developer.apple.com\/documentation\/CoreData\/NSPersistentStoreUbiquitousPeerTokenOption"
        },
        {
          "description" : "The corresponding value is an `NSNumber` object representing a boolean that indicates whether the receiver should remove all associated ubiquity metadata from a persistent store. You typically use this option during migration or copying to disassociate a persistent store file from an iCloud account.",
          "name" : "NSPersistentStoreRemoveUbiquitousMetadataOption",
          "url" : "https:\/\/developer.apple.com\/documentation\/CoreData\/NSPersistentStoreRemoveUbiquitousMetadataOption"
        },
        {
          "description" : "The a string specifying the iCloud container identifier.",
          "name" : "NSPersistentStoreUbiquitousContainerIdentifierKey",
          "url" : "https:\/\/developer.apple.com\/documentation\/CoreData\/NSPersistentStoreUbiquitousContainerIdentifierKey"
        },
        {
          "description" : "The corresponding value is an `NSNumber` object representing a boolean that indicates whether the receiver should erase the local store file and rebuild it from the iCloud data in Mobile Documents.",
          "name" : "NSPersistentStoreRebuildFromUbiquitousContentOption",
          "url" : "https:\/\/developer.apple.com\/documentation\/CoreData\/NSPersistentStoreRebuildFromUbiquitousContentOption"
        }
      ],
      "title" : "Deprecated"
    }
  ],
  "source" : "appleJSON",
  "title" : "NSPersistentStoreUbiquitousContentURLKey",
  "url" : "https:\/\/developer.apple.com\/documentation\/CoreData\/NSPersistentStoreUbiquitousContentURLKey"
}