{
  "abstract" : "Option to specify the file format of a Spotlight external records.",
  "codeExamples" : [

  ],
  "contentHash" : "dcef8bc12b9833232a44690e02d2a3f20cb3a7cb4972c7462f3dd1c9655dceef",
  "crawledAt" : "2025-12-04T19:06:33Z",
  "declaration" : {
    "code" : "let NSExternalRecordsFileFormatOption: String",
    "language" : "swift"
  },
  "id" : "D76AF4CA-FF09-4F77-87FE-40741D0B0F4D",
  "kind" : "unknown",
  "language" : "swift",
  "module" : "Core Data",
  "overview" : "## Discussion\n\nFor possible values, see `Format Options for Spotlight External Record Files`.",
  "platforms" : [
    "macOS"
  ],
  "rawMarkdown" : "---\nsource: https:\/\/developer.apple.com\/documentation\/CoreData\/NSExternalRecordsFileFormatOption\ncrawled: 2025-12-04T19:06:33Z\n---\n\n# NSExternalRecordsFileFormatOption\n\n**Global Variable**\n\nOption to specify the file format of a Spotlight external records.\n\n## Declaration\n\n```swift\nlet NSExternalRecordsFileFormatOption: String\n```\n\n## Discussion\n\nFor possible values, see `Format Options for Spotlight External Record Files`.\n\n## Deprecated\n\n- **NSExternalRecordsDirectoryOption**: Option indicating the directory where Spotlight external record files should be written to.\n- **NSExternalRecordExtensionOption**: Option indicating the file extension to use for Spotlight external record files.\n- **NSPersistentStoreUbiquitousContentNameKey**: Option to specify that a persistent store has a given name in ubiquity.\n- **NSPersistentStoreUbiquitousContentURLKey**: Option to specify the log path to use for ubiquitous content logs.\n- **NSPersistentStoreUbiquitousPeerTokenOption**: The corresponding value is an optionally specified string which will be mixed in to Core Data’s identifier for each iCloud peer. The value must be an alphanumeric string without any special characters, whitespace or punctuation. The primary use for this option is to allow multiple applications on the same peer (device) to share a Core Data store integrated with iCloud. Each application will require its own store file.\n- **NSPersistentStoreRemoveUbiquitousMetadataOption**: The corresponding value is an `NSNumber` object representing a boolean that indicates whether the receiver should remove all associated ubiquity metadata from a persistent store. You typically use this option during migration or copying to disassociate a persistent store file from an iCloud account.\n- **NSPersistentStoreUbiquitousContainerIdentifierKey**: The a string specifying the iCloud container identifier.\n- **NSPersistentStoreRebuildFromUbiquitousContentOption**: The corresponding value is an `NSNumber` object representing a boolean that indicates whether the receiver should erase the local store file and rebuild it from the iCloud data in Mobile Documents.\n\n",
  "sections" : [
    {
      "content" : "",
      "items" : [
        {
          "description" : "Option indicating the directory where Spotlight external record files should be written to.",
          "name" : "NSExternalRecordsDirectoryOption",
          "url" : "https:\/\/developer.apple.com\/documentation\/CoreData\/NSExternalRecordsDirectoryOption"
        },
        {
          "description" : "Option indicating the file extension to use for Spotlight external record files.",
          "name" : "NSExternalRecordExtensionOption",
          "url" : "https:\/\/developer.apple.com\/documentation\/CoreData\/NSExternalRecordExtensionOption"
        },
        {
          "description" : "Option to specify that a persistent store has a given name in ubiquity.",
          "name" : "NSPersistentStoreUbiquitousContentNameKey",
          "url" : "https:\/\/developer.apple.com\/documentation\/CoreData\/NSPersistentStoreUbiquitousContentNameKey"
        },
        {
          "description" : "Option to specify the log path to use for ubiquitous content logs.",
          "name" : "NSPersistentStoreUbiquitousContentURLKey",
          "url" : "https:\/\/developer.apple.com\/documentation\/CoreData\/NSPersistentStoreUbiquitousContentURLKey"
        },
        {
          "description" : "The corresponding value is an optionally specified string which will be mixed in to Core Data’s identifier for each iCloud peer. The value must be an alphanumeric string without any special characters, whitespace or punctuation. The primary use for this option is to allow multiple applications on the same peer (device) to share a Core Data store integrated with iCloud. Each application will require its own store file.",
          "name" : "NSPersistentStoreUbiquitousPeerTokenOption",
          "url" : "https:\/\/developer.apple.com\/documentation\/CoreData\/NSPersistentStoreUbiquitousPeerTokenOption"
        },
        {
          "description" : "The corresponding value is an `NSNumber` object representing a boolean that indicates whether the receiver should remove all associated ubiquity metadata from a persistent store. You typically use this option during migration or copying to disassociate a persistent store file from an iCloud account.",
          "name" : "NSPersistentStoreRemoveUbiquitousMetadataOption",
          "url" : "https:\/\/developer.apple.com\/documentation\/CoreData\/NSPersistentStoreRemoveUbiquitousMetadataOption"
        },
        {
          "description" : "The a string specifying the iCloud container identifier.",
          "name" : "NSPersistentStoreUbiquitousContainerIdentifierKey",
          "url" : "https:\/\/developer.apple.com\/documentation\/CoreData\/NSPersistentStoreUbiquitousContainerIdentifierKey"
        },
        {
          "description" : "The corresponding value is an `NSNumber` object representing a boolean that indicates whether the receiver should erase the local store file and rebuild it from the iCloud data in Mobile Documents.",
          "name" : "NSPersistentStoreRebuildFromUbiquitousContentOption",
          "url" : "https:\/\/developer.apple.com\/documentation\/CoreData\/NSPersistentStoreRebuildFromUbiquitousContentOption"
        }
      ],
      "title" : "Deprecated"
    }
  ],
  "source" : "appleJSON",
  "title" : "NSExternalRecordsFileFormatOption",
  "url" : "https:\/\/developer.apple.com\/documentation\/CoreData\/NSExternalRecordsFileFormatOption"
}