{
  "abstract" : "These constants are used as the value corresponding to the [doc:\/\/com.apple.coredata\/documentation\/CoreData\/NSPersistentStoreUbiquitousTransitionTypeKey] in the user info dictionary of [doc:\/\/com.apple.coredata\/documentation\/CoreData\/NSPersistentStoreCoordinatorStoresWillChangeNotification] and [doc:\/\/com.apple.coredata\/documentation\/CoreData\/NSPersistentStoreCoordinatorStoresDidChangeNotification] notifications to identify the type of event leading to a change.",
  "codeExamples" : [

  ],
  "conformsTo" : [
    "BitwiseCopyable",
    "Equatable",
    "Hashable",
    "RawRepresentable",
    "Sendable",
    "SendableMetatype"
  ],
  "contentHash" : "72fb15be9ca715390ab96e320b2f251d627d9033bc52b1c18c0798bc2b5cf877",
  "crawledAt" : "2025-12-06T04:35:24Z",
  "declaration" : {
    "code" : "enum NSPersistentStoreUbiquitousTransitionType",
    "language" : "swift"
  },
  "id" : "F1846CE1-7F43-44BC-80FF-F9DF734CD0FC",
  "kind" : "enum",
  "language" : "swift",
  "module" : "Core Data",
  "platforms" : [
    "iOS",
    "iPadOS",
    "Mac Catalyst",
    "macOS",
    "visionOS"
  ],
  "rawMarkdown" : "---\nsource: https:\/\/developer.apple.com\/documentation\/coredata\/nspersistentstoreubiquitoustransitiontype\ncrawled: 2025-12-06T04:35:24Z\n---\n\n# NSPersistentStoreUbiquitousTransitionType\n\n**Enumeration**\n\nThese constants are used as the value corresponding to the [doc:\/\/com.apple.coredata\/documentation\/CoreData\/NSPersistentStoreUbiquitousTransitionTypeKey] in the user info dictionary of [doc:\/\/com.apple.coredata\/documentation\/CoreData\/NSPersistentStoreCoordinatorStoresWillChangeNotification] and [doc:\/\/com.apple.coredata\/documentation\/CoreData\/NSPersistentStoreCoordinatorStoresDidChangeNotification] notifications to identify the type of event leading to a change.\n\n## Declaration\n\n```swift\nenum NSPersistentStoreUbiquitousTransitionType\n```\n\n## Constants\n\n- **NSPersistentStoreUbiquitousTransitionType.accountAdded**: This value indicates that a new iCloud account is available, and the persistent store in use will or did transition to the new account.\n- **NSPersistentStoreUbiquitousTransitionType.accountRemoved**: This value indicates that no iCloud account is available, and the persistent store in use will or did transition to the “local” store.\n- **NSPersistentStoreUbiquitousTransitionType.contentRemoved**: This value indicates that the user has wiped the contents of the iCloud account, usually using Delete All from Documents & Data in Settings.\n- **NSPersistentStoreUbiquitousTransitionType.initialImportCompleted**: This value indicates that the Core Data integration has finished building a store file that is consistent with the contents of the iCloud account, and is ready to replace the fallback store with that file.\n\n## Initializers\n\n- **init(rawValue:)**\n\n## Conforms To\n\n- BitwiseCopyable\n- Equatable\n- Hashable\n- RawRepresentable\n- Sendable\n- SendableMetatype\n\n",
  "sections" : [
    {
      "content" : "",
      "items" : [
        {
          "description" : "This value indicates that a new iCloud account is available, and the persistent store in use will or did transition to the new account.",
          "name" : "NSPersistentStoreUbiquitousTransitionType.accountAdded",
          "url" : "https:\/\/developer.apple.com\/documentation\/CoreData\/NSPersistentStoreUbiquitousTransitionType\/accountAdded"
        },
        {
          "description" : "This value indicates that no iCloud account is available, and the persistent store in use will or did transition to the “local” store.",
          "name" : "NSPersistentStoreUbiquitousTransitionType.accountRemoved",
          "url" : "https:\/\/developer.apple.com\/documentation\/CoreData\/NSPersistentStoreUbiquitousTransitionType\/accountRemoved"
        },
        {
          "description" : "This value indicates that the user has wiped the contents of the iCloud account, usually using Delete All from Documents & Data in Settings.",
          "name" : "NSPersistentStoreUbiquitousTransitionType.contentRemoved",
          "url" : "https:\/\/developer.apple.com\/documentation\/CoreData\/NSPersistentStoreUbiquitousTransitionType\/contentRemoved"
        },
        {
          "description" : "This value indicates that the Core Data integration has finished building a store file that is consistent with the contents of the iCloud account, and is ready to replace the fallback store with that file.",
          "name" : "NSPersistentStoreUbiquitousTransitionType.initialImportCompleted",
          "url" : "https:\/\/developer.apple.com\/documentation\/CoreData\/NSPersistentStoreUbiquitousTransitionType\/initialImportCompleted"
        }
      ],
      "title" : "Constants"
    },
    {
      "content" : "",
      "items" : [
        {
          "description" : "",
          "name" : "init(rawValue:)",
          "url" : "https:\/\/developer.apple.com\/documentation\/CoreData\/NSPersistentStoreUbiquitousTransitionType\/init(rawValue:)"
        }
      ],
      "title" : "Initializers"
    }
  ],
  "source" : "appleJSON",
  "title" : "NSPersistentStoreUbiquitousTransitionType",
  "url" : "https:\/\/developer.apple.com\/documentation\/coredata\/nspersistentstoreubiquitoustransitiontype"
}