{
  "abstract" : "Provides an opportunity to add code into the life cycle of the managed object when initially creating it.",
  "codeExamples" : [

  ],
  "contentHash" : "f45ca936318395eef63267ed4e237478be6c50e03df1a55b944cdf6e6ecada96",
  "crawledAt" : "2025-12-01T14:41:58Z",
  "declaration" : {
    "code" : "func awakeFromInsert()",
    "language" : "swift"
  },
  "id" : "2036DF7E-0946-4E0B-B9E0-2D71F897DD39",
  "kind" : "method",
  "module" : "Core Data",
  "overview" : "## Discussion\n\nYou typically use this method to initialize special default property values. This method is invoked only once in the object’s lifetime.\n\nIf you want to set attribute values in an implementation of this method, you should typically use primitive accessor methods (either [doc:\/\/com.apple.coredata\/documentation\/CoreData\/NSManagedObject\/setPrimitiveValue(_:forKey:)] or—better—the appropriate custom primitive accessors). This ensures that the new values are treated as baseline values rather than being recorded as undoable changes for the properties in question.\n\n### Special Considerations\n\nIf you create a managed object then perform undo operations to bring the managed object context to a state prior to the object’s creation, then perform redo operations to bring the managed object context back to a state after the object’s creation, [doc:\/\/com.apple.coredata\/documentation\/CoreData\/NSManagedObject\/awakeFromInsert()] is *not* invoked a second time.\n\nYou are typically discouraged from performing fetches within an implementation of [doc:\/\/com.apple.coredata\/documentation\/CoreData\/NSManagedObject\/awakeFromInsert()]. Although it is allowed, execution of the fetch request can trigger the sending of internal Core Data notifications which may have unwanted side-effects. For example, in macOS, an instance of [doc:\/\/com.apple.documentation\/documentation\/AppKit\/NSArrayController] may end up inserting a new object into its content array twice.",
  "platforms" : [
    "iOS",
    "iPadOS",
    "Mac Catalyst",
    "macOS",
    "tvOS",
    "visionOS",
    "watchOS"
  ],
  "rawMarkdown" : "---\nsource: https:\/\/developer.apple.com\/documentation\/CoreData\/NSManagedObject\/awakeFromInsert()\ncrawled: 2025-12-01T14:41:58Z\n---\n\n# awakeFromInsert()\n\n**Instance Method**\n\nProvides an opportunity to add code into the life cycle of the managed object when initially creating it.\n\n## Declaration\n\n```swift\nfunc awakeFromInsert()\n```\n\n## Discussion\n\nYou typically use this method to initialize special default property values. This method is invoked only once in the object’s lifetime.\n\nIf you want to set attribute values in an implementation of this method, you should typically use primitive accessor methods (either [doc:\/\/com.apple.coredata\/documentation\/CoreData\/NSManagedObject\/setPrimitiveValue(_:forKey:)] or—better—the appropriate custom primitive accessors). This ensures that the new values are treated as baseline values rather than being recorded as undoable changes for the properties in question.\n\n\n\n### Special Considerations\n\nIf you create a managed object then perform undo operations to bring the managed object context to a state prior to the object’s creation, then perform redo operations to bring the managed object context back to a state after the object’s creation, [doc:\/\/com.apple.coredata\/documentation\/CoreData\/NSManagedObject\/awakeFromInsert()] is *not* invoked a second time.\n\nYou are typically discouraged from performing fetches within an implementation of [doc:\/\/com.apple.coredata\/documentation\/CoreData\/NSManagedObject\/awakeFromInsert()]. Although it is allowed, execution of the fetch request can trigger the sending of internal Core Data notifications which may have unwanted side-effects. For example, in macOS, an instance of [doc:\/\/com.apple.documentation\/documentation\/AppKit\/NSArrayController] may end up inserting a new object into its content array twice.\n\n## Managing Change Events\n\n- **contextShouldIgnoreUnmodeledPropertyChanges**: A Boolean value that indicates whether to mark instances of the class as having changes when an unmodeled property changes.\n- **awakeFromFetch()**: Provides an opportunity to add code into the life cycle of the managed object when fufilling it from a fault.\n- **awake(fromSnapshotEvents:)**: Provides an opportunity to add code into the life cycle of the managed object when fulfilling it from a snapshot.\n- **changedValues()**: Returns a dictionary containing the keys and new values of persistent properties with changes since the last fetching or saving of the managed object.\n- **changedValuesForCurrentEvent()**: Returns a dictionary containing the keys and new values of persistent properties with changes since the last fetching or saving of the managed object.\n- **committedValues(forKeys:)**: Returns a dictionary of the most recent fetched or saved values of the managed object for the properties of the specified keys.\n- **prepareForDeletion()**: Provides an opportunity to add code into the life cycle of the managed object before deleting it.\n- **willSave()**: Provides an opportunity to add code into the life cycle of the managed object before saving it.\n- **didSave()**: Provides an opportunity to add code into the life cycle of the managed object after the managed object’s context completes a save operation.\n- **willTurnIntoFault()**: Provides an opportunity to add code into the life cycle of the managed object before converting it to a fault.\n- **didTurnIntoFault()**: Provides an opportunity to add code into the life cycle of the managed object after converting it to a fault.\n- **fetchRequest()**: Returns an initialized fetch request with the entity this subclass represents.\n\n",
  "sections" : [
    {
      "content" : "",
      "items" : [
        {
          "description" : "A Boolean value that indicates whether to mark instances of the class as having changes when an unmodeled property changes.",
          "name" : "contextShouldIgnoreUnmodeledPropertyChanges",
          "url" : "https:\/\/developer.apple.com\/documentation\/CoreData\/NSManagedObject\/contextShouldIgnoreUnmodeledPropertyChanges"
        },
        {
          "description" : "Provides an opportunity to add code into the life cycle of the managed object when fufilling it from a fault.",
          "name" : "awakeFromFetch()",
          "url" : "https:\/\/developer.apple.com\/documentation\/CoreData\/NSManagedObject\/awakeFromFetch()"
        },
        {
          "description" : "Provides an opportunity to add code into the life cycle of the managed object when fulfilling it from a snapshot.",
          "name" : "awake(fromSnapshotEvents:)",
          "url" : "https:\/\/developer.apple.com\/documentation\/CoreData\/NSManagedObject\/awake(fromSnapshotEvents:)"
        },
        {
          "description" : "Returns a dictionary containing the keys and new values of persistent properties with changes since the last fetching or saving of the managed object.",
          "name" : "changedValues()",
          "url" : "https:\/\/developer.apple.com\/documentation\/CoreData\/NSManagedObject\/changedValues()"
        },
        {
          "description" : "Returns a dictionary containing the keys and new values of persistent properties with changes since the last fetching or saving of the managed object.",
          "name" : "changedValuesForCurrentEvent()",
          "url" : "https:\/\/developer.apple.com\/documentation\/CoreData\/NSManagedObject\/changedValuesForCurrentEvent()"
        },
        {
          "description" : "Returns a dictionary of the most recent fetched or saved values of the managed object for the properties of the specified keys.",
          "name" : "committedValues(forKeys:)",
          "url" : "https:\/\/developer.apple.com\/documentation\/CoreData\/NSManagedObject\/committedValues(forKeys:)"
        },
        {
          "description" : "Provides an opportunity to add code into the life cycle of the managed object before deleting it.",
          "name" : "prepareForDeletion()",
          "url" : "https:\/\/developer.apple.com\/documentation\/CoreData\/NSManagedObject\/prepareForDeletion()"
        },
        {
          "description" : "Provides an opportunity to add code into the life cycle of the managed object before saving it.",
          "name" : "willSave()",
          "url" : "https:\/\/developer.apple.com\/documentation\/CoreData\/NSManagedObject\/willSave()"
        },
        {
          "description" : "Provides an opportunity to add code into the life cycle of the managed object after the managed object’s context completes a save operation.",
          "name" : "didSave()",
          "url" : "https:\/\/developer.apple.com\/documentation\/CoreData\/NSManagedObject\/didSave()"
        },
        {
          "description" : "Provides an opportunity to add code into the life cycle of the managed object before converting it to a fault.",
          "name" : "willTurnIntoFault()",
          "url" : "https:\/\/developer.apple.com\/documentation\/CoreData\/NSManagedObject\/willTurnIntoFault()"
        },
        {
          "description" : "Provides an opportunity to add code into the life cycle of the managed object after converting it to a fault.",
          "name" : "didTurnIntoFault()",
          "url" : "https:\/\/developer.apple.com\/documentation\/CoreData\/NSManagedObject\/didTurnIntoFault()"
        },
        {
          "description" : "Returns an initialized fetch request with the entity this subclass represents.",
          "name" : "fetchRequest()",
          "url" : "https:\/\/developer.apple.com\/documentation\/CoreData\/NSManagedObject\/fetchRequest()"
        }
      ],
      "title" : "Managing Change Events"
    }
  ],
  "source" : "appleJSON",
  "title" : "awakeFromInsert()",
  "url" : "https:\/\/developer.apple.com\/documentation\/CoreData\/NSManagedObject\/awakeFromInsert()"
}