{
  "abstract" : "Model your app’s objects.",
  "codeExamples" : [

  ],
  "contentHash" : "15d68c5e50b6d6f74396e7e8f77a78f23b5ed303f3bb620111859841bba1c43f",
  "crawledAt" : "2025-12-03T09:32:58Z",
  "id" : "F41B5E1C-8591-41A0-BC5E-7820AB80C008",
  "kind" : "article",
  "language" : "swift",
  "module" : "Core Data",
  "overview" : "## Overview\n\nAn entity describes an object, including its name, attributes, and relationships. Create an entity for each of your app’s objects.\n\n### Add Entities\n\nAfter you create a Core Data model as described in [doc:\/\/com.apple.coredata\/documentation\/CoreData\/creating-a-core-data-model], add an entity to your project’s `.xcdatamodeld` file:\n\n\n\nIn addition to the required name and class name fields, entities have a default setting for the required code generation field. If you need to add inheritance, unique constraints, versioning, or other optional information, configure your entity as described below. Otherwise, add the properties that compose your entity as described in [doc:\/\/com.apple.coredata\/documentation\/CoreData\/configuring-attributes].\n\n### Configure Entities\n\nUse the data model inspector (choose View > Inspectors > Show Data Model Inspector) to configure your entity.\n\nFor information about the options for code generation, see [doc:\/\/com.apple.coredata\/documentation\/CoreData\/generating-code].\n\nUnique constraints prevent duplicate records in the store. When saving a new record, the store checks whether any record already exists with the same value for the constrained attribute. In the case of a conflict, [doc:\/\/com.apple.coredata\/documentation\/CoreData\/NSMergePolicyType\/mergeByPropertyObjectTrumpMergePolicyType] causes the new record to overwrite all fields in the existing record.\n\nFor more information, see [doc:\/\/com.apple.documentation\/documentation\/CoreSpotlight].\n\nFor more information, see [doc:\/\/com.apple.coredata\/documentation\/CoreData\/migrating-your-data-model-automatically].",
  "rawMarkdown" : "---\nsource: https:\/\/developer.apple.com\/documentation\/CoreData\/configuring-entities\ncrawled: 2025-12-03T09:32:58Z\n---\n\n# Configuring Entities\n\n**Article**\n\nModel your app’s objects.\n\n## Overview\n\nAn entity describes an object, including its name, attributes, and relationships. Create an entity for each of your app’s objects.\n\n### Add Entities\n\nAfter you create a Core Data model as described in [doc:\/\/com.apple.coredata\/documentation\/CoreData\/creating-a-core-data-model], add an entity to your project’s `.xcdatamodeld` file:\n\n1. Click Add Entity at the bottom of the editor area. A new entity with placeholder name `Entity` appears in the Entities list.\n2. In the Entities list, double-click the newly added entity and rename it. This step updates both the entity name and class name visible in the Data Model inspector.\n\n\n\nIn addition to the required name and class name fields, entities have a default setting for the required code generation field. If you need to add inheritance, unique constraints, versioning, or other optional information, configure your entity as described below. Otherwise, add the properties that compose your entity as described in [doc:\/\/com.apple.coredata\/documentation\/CoreData\/configuring-attributes].\n\n### Configure Entities\n\nUse the data model inspector (choose View > Inspectors > Show Data Model Inspector) to configure your entity.\n\n\n\nFor information about the options for code generation, see [doc:\/\/com.apple.coredata\/documentation\/CoreData\/generating-code].\n\n\n\nUnique constraints prevent duplicate records in the store. When saving a new record, the store checks whether any record already exists with the same value for the constrained attribute. In the case of a conflict, [doc:\/\/com.apple.coredata\/documentation\/CoreData\/NSMergePolicyType\/mergeByPropertyObjectTrumpMergePolicyType] causes the new record to overwrite all fields in the existing record.\n\n\n\nFor more information, see [doc:\/\/com.apple.documentation\/documentation\/CoreSpotlight].\n\n\n\nFor more information, see [doc:\/\/com.apple.coredata\/documentation\/CoreData\/migrating-your-data-model-automatically].\n\n## Configuring a Core Data Model\n\n- **Configuring Attributes**: Describe the properties that compose an entity.\n- **Configuring Relationships**: Specify how entities relate and how change propagates between them.\n- **Generating code**: Automatically or manually generate managed object subclasses from entities.\n\n",
  "sections" : [
    {
      "content" : "",
      "items" : [
        {
          "description" : "Describe the properties that compose an entity.",
          "name" : "Configuring Attributes",
          "url" : "https:\/\/developer.apple.com\/documentation\/CoreData\/configuring-attributes"
        },
        {
          "description" : "Specify how entities relate and how change propagates between them.",
          "name" : "Configuring Relationships",
          "url" : "https:\/\/developer.apple.com\/documentation\/CoreData\/configuring-relationships"
        },
        {
          "description" : "Automatically or manually generate managed object subclasses from entities.",
          "name" : "Generating code",
          "url" : "https:\/\/developer.apple.com\/documentation\/CoreData\/generating-code"
        }
      ],
      "title" : "Configuring a Core Data Model"
    }
  ],
  "source" : "appleJSON",
  "title" : "Configuring Entities",
  "url" : "https:\/\/developer.apple.com\/documentation\/CoreData\/configuring-entities"
}