{
  "abstract" : "Compares the string with an OSObject",
  "codeExamples" : [

  ],
  "contentHash" : "4429086079ba038dd53bd26e223add2f237bbff855e4e3a453775794fcd2451e",
  "crawledAt" : "2025-12-02T09:04:07Z",
  "declaration" : {
    "code" : "bool isEqualTo(const OSMetaClassBase * anObject) const;",
    "language" : "swift"
  },
  "id" : "A436BF27-224D-43EC-B0A9-CD8DF0376E56",
  "kind" : "method",
  "module" : "DriverKit",
  "overview" : "## Return Value\n\nTrue iff the object is of class OSData or OSString and isEqualTo() returns true.\n\n## Discussion\n\nIf the object is of class OSString, the result of isEqualTo(const OSString * aDataObj) is returned. If the object is of class OSData, the result of isEqualTo(const OSData * aDataObj) is returned. Otherwise false is returned.",
  "platforms" : [
    "Unsupported OS: driverkit"
  ],
  "rawMarkdown" : "---\nsource: https:\/\/developer.apple.com\/documentation\/DriverKit\/OSString\/isEqualTo-712xj\ncrawled: 2025-12-02T09:04:07Z\n---\n\n# isEqualTo\n\n**Instance Method**\n\nCompares the string with an OSObject\n\n## Declaration\n\n```swift\nbool isEqualTo(const OSMetaClassBase * anObject) const;\n```\n\n## Parameters\n\n- **anObject**: The object to compare with.\n\n## Return Value\n\nTrue iff the object is of class OSData or OSString and isEqualTo() returns true.\n\n## Discussion\n\nIf the object is of class OSString, the result of isEqualTo(const OSString * aDataObj) is returned. If the object is of class OSData, the result of isEqualTo(const OSData * aDataObj) is returned. Otherwise false is returned.\n\n## Comparing Strings\n\n- **isEqualTo**: Compares the string with an OSData.\n- **isEqualTo**: Compares the string with an OSString.\n- **isEqualTo**: Compares the string with a c-string.\n\n",
  "sections" : [
    {
      "content" : "",
      "items" : [
        {
          "description" : "Compares the string with an OSData.",
          "name" : "isEqualTo",
          "url" : "https:\/\/developer.apple.com\/documentation\/DriverKit\/OSString\/isEqualTo-1uq1f"
        },
        {
          "description" : "Compares the string with an OSString.",
          "name" : "isEqualTo",
          "url" : "https:\/\/developer.apple.com\/documentation\/DriverKit\/OSString\/isEqualTo-5paj5"
        },
        {
          "description" : "Compares the string with a c-string.",
          "name" : "isEqualTo",
          "url" : "https:\/\/developer.apple.com\/documentation\/DriverKit\/OSString\/isEqualTo-2rg80"
        }
      ],
      "title" : "Comparing Strings"
    }
  ],
  "source" : "appleJSON",
  "title" : "isEqualTo",
  "url" : "https:\/\/developer.apple.com\/documentation\/DriverKit\/OSString\/isEqualTo-712xj"
}