{
  "abstract" : "Compares the string with an OSObject",
  "codeExamples" : [

  ],
  "contentHash" : "ac29c0b284f866d799613ee4693c1c605683700b13a70e8dd55eb2d939513219",
  "crawledAt" : "2025-12-02T09:03:28Z",
  "declaration" : {
    "code" : "bool isEqualTo(const OSMetaClassBase * anObject) const;",
    "language" : "swift"
  },
  "id" : "DA074918-44F5-4F2E-AA43-07360143939D",
  "kind" : "method",
  "module" : "DriverKit",
  "overview" : "## Return Value\n\nTrue iff the object is of class OSNumber isEqualTo() returns true.\n\n## Discussion\n\nIf the object is of class OSNumber, the result of isEqualTo(const OSNumber * aDataObj) is returned. Otherwise false is returned.",
  "platforms" : [
    "Unsupported OS: driverkit"
  ],
  "rawMarkdown" : "---\nsource: https:\/\/developer.apple.com\/documentation\/DriverKit\/OSNumber\/isEqualTo-333kh\ncrawled: 2025-12-02T09:03:28Z\n---\n\n# isEqualTo\n\n**Instance Method**\n\nCompares the string with an OSObject\n\n## Declaration\n\n```swift\nbool isEqualTo(const OSMetaClassBase * anObject) const;\n```\n\n## Parameters\n\n- **anObject**: The object to compare with.\n\n## Return Value\n\nTrue iff the object is of class OSNumber isEqualTo() returns true.\n\n## Discussion\n\nIf the object is of class OSNumber, the result of isEqualTo(const OSNumber * aDataObj) is returned. Otherwise false is returned.\n\n## Comparing Numbers\n\n- **isEqualTo**: Compares the number with an OSNumber.\n\n",
  "sections" : [
    {
      "content" : "",
      "items" : [
        {
          "description" : "Compares the number with an OSNumber.",
          "name" : "isEqualTo",
          "url" : "https:\/\/developer.apple.com\/documentation\/DriverKit\/OSNumber\/isEqualTo-58rb9"
        }
      ],
      "title" : "Comparing Numbers"
    }
  ],
  "source" : "appleJSON",
  "title" : "isEqualTo",
  "url" : "https:\/\/developer.apple.com\/documentation\/DriverKit\/OSNumber\/isEqualTo-333kh"
}