{
  "abstract" : "Tells the system that the method runs locally in the driver extension’s process space.",
  "codeExamples" : [

  ],
  "contentHash" : "bf04471ddfb98460469bae906b622d5068248699a10da226401f5cdaeb45807b",
  "crawledAt" : "2025-12-03T04:29:52Z",
  "declaration" : {
    "code" : "#define LOCAL",
    "language" : "swift"
  },
  "id" : "41B346FA-A8B6-4DB2-9C71-6EC46BB141E5",
  "kind" : "macro",
  "language" : "occ",
  "module" : "DriverKit",
  "overview" : "## Discussion\n\nDriverKit adds this macro to methods that must run locally in your driver extension. A method tagged with this macro may still be called by a remote process such as the kernel. Don’t add this macro to your own methods.\n\nThis macro applies only to methods.",
  "platforms" : [
    "Unsupported OS: driverkit"
  ],
  "rawMarkdown" : "---\nsource: https:\/\/developer.apple.com\/documentation\/DriverKit\/LOCAL\ncrawled: 2025-12-03T04:29:52Z\n---\n\n# LOCAL\n\n**Macro**\n\nTells the system that the method runs locally in the driver extension’s process space.\n\n## Declaration\n\n```swift\n#define LOCAL\n```\n\n## Discussion\n\nDriverKit adds this macro to methods that must run locally in your driver extension. A method tagged with this macro may still be called by a remote process such as the kernel. Don’t add this macro to your own methods.\n\nThis macro applies only to methods.\n\n## Runtime support\n\n- **OSDynamicCast**: Casts an object safely to the specified type, if possible.\n- **OSRequiredCast**: Casts the object to the specified type, stopping the process if the object isn’t of the correct type.\n- **IMPL**: Tells the system that the superclass implementation of this method runs in the kernel.\n- **TYPE**: Annotates a method declaration to indicate that it conforms to an existing method signature.\n- **QUEUENAME**: Tells the system to execute a method on the dispatch queue with the specified name.\n- **SUPERDISPATCH**: Tells the system to execute the superclass’ implementation of the current method in the kernel.\n- **IIG_KERNEL**: Tells the system that the class or method runs inside the kernel.\n- **LOCALONLY**: Tells the system that the class or method runs locally in the driver extension’s process space.\n- **Error Codes**: Determine the reason an operation fails.\n- **C++ Runtime Support**: Examine low-level types that DriverKit uses to support kernel-level operations.\n\n",
  "sections" : [
    {
      "content" : "",
      "items" : [
        {
          "description" : "Casts an object safely to the specified type, if possible.",
          "name" : "OSDynamicCast",
          "url" : "https:\/\/developer.apple.com\/documentation\/DriverKit\/OSDynamicCast"
        },
        {
          "description" : "Casts the object to the specified type, stopping the process if the object isn’t of the correct type.",
          "name" : "OSRequiredCast",
          "url" : "https:\/\/developer.apple.com\/documentation\/DriverKit\/OSRequiredCast"
        },
        {
          "description" : "Tells the system that the superclass implementation of this method runs in the kernel.",
          "name" : "IMPL",
          "url" : "https:\/\/developer.apple.com\/documentation\/DriverKit\/IMPL"
        },
        {
          "description" : "Annotates a method declaration to indicate that it conforms to an existing method signature.",
          "name" : "TYPE",
          "url" : "https:\/\/developer.apple.com\/documentation\/DriverKit\/TYPE"
        },
        {
          "description" : "Tells the system to execute a method on the dispatch queue with the specified name.",
          "name" : "QUEUENAME",
          "url" : "https:\/\/developer.apple.com\/documentation\/DriverKit\/QUEUENAME"
        },
        {
          "description" : "Tells the system to execute the superclass’ implementation of the current method in the kernel.",
          "name" : "SUPERDISPATCH",
          "url" : "https:\/\/developer.apple.com\/documentation\/DriverKit\/SUPERDISPATCH"
        },
        {
          "description" : "Tells the system that the class or method runs inside the kernel.",
          "name" : "IIG_KERNEL",
          "url" : "https:\/\/developer.apple.com\/documentation\/DriverKit\/IIG_KERNEL"
        },
        {
          "description" : "Tells the system that the class or method runs locally in the driver extension’s process space.",
          "name" : "LOCALONLY",
          "url" : "https:\/\/developer.apple.com\/documentation\/DriverKit\/LOCALONLY"
        },
        {
          "description" : "Determine the reason an operation fails.",
          "name" : "Error Codes",
          "url" : "https:\/\/developer.apple.com\/documentation\/DriverKit\/error-codes"
        },
        {
          "description" : "Examine low-level types that DriverKit uses to support kernel-level operations.",
          "name" : "C++ Runtime Support",
          "url" : "https:\/\/developer.apple.com\/documentation\/DriverKit\/c-runtime-support"
        }
      ],
      "title" : "Runtime support"
    }
  ],
  "source" : "appleJSON",
  "title" : "LOCAL",
  "url" : "https:\/\/developer.apple.com\/documentation\/DriverKit\/LOCAL"
}