{
  "abstract" : "Enables or disables the delivery of interrupts.",
  "codeExamples" : [

  ],
  "contentHash" : "14aa3a40240bc6549ee55b5f17904e519703ff792ed602d8282f2f6da4923401",
  "crawledAt" : "2025-12-04T05:22:21Z",
  "declaration" : {
    "code" : "kern_return_t SetEnableWithCompletion(bool enable, IODispatchSourceCancelHandlerhandler);",
    "language" : "swift"
  },
  "id" : "6EE986DD-7E6B-4A3F-8792-3A0F51569DD0",
  "kind" : "method",
  "language" : "occ",
  "module" : "DriverKit",
  "overview" : "## Return Value\n\n[doc:\/\/com.apple.driverkit\/documentation\/DriverKit\/kIOReturnSuccess] on success, or another value if an error occurs. See [doc:\/\/com.apple.driverkit\/documentation\/DriverKit\/error-codes].",
  "platforms" : [
    "Unsupported OS: driverkit"
  ],
  "rawMarkdown" : "---\nsource: https:\/\/developer.apple.com\/documentation\/DriverKit\/IOInterruptDispatchSource\/SetEnableWithCompletion\ncrawled: 2025-12-04T05:22:21Z\n---\n\n# SetEnableWithCompletion\n\n**Instance Method**\n\nEnables or disables the delivery of interrupts.\n\n## Declaration\n\n```swift\nkern_return_t SetEnableWithCompletion(bool enable, IODispatchSourceCancelHandlerhandler);\n```\n\n## Parameters\n\n- **enable**: A Boolean value that indicates whether to enable the dispatch source. Specify `true` to enable the dispatch source, or `false` to disable it.\n- **handler**: An optional block to execute when disabling the dispatch source. The dispatch source executes it after all pending interrupts finish executing.\n\n## Return Value\n\n[doc:\/\/com.apple.driverkit\/documentation\/DriverKit\/kIOReturnSuccess] on success, or another value if an error occurs. See [doc:\/\/com.apple.driverkit\/documentation\/DriverKit\/error-codes].\n\n## Starting and Stopping the Interrupt Source\n\n- **Cancel**: Cancels all callbacks from the event source.\n- **IODispatchSourceCancelHandler**: A block to execute when a canceled dispatch source stops executing tasks.\n\n",
  "sections" : [
    {
      "content" : "",
      "items" : [
        {
          "description" : "Cancels all callbacks from the event source.",
          "name" : "Cancel",
          "url" : "https:\/\/developer.apple.com\/documentation\/DriverKit\/IOInterruptDispatchSource\/Cancel"
        },
        {
          "description" : "A block to execute when a canceled dispatch source stops executing tasks.",
          "name" : "IODispatchSourceCancelHandler",
          "url" : "https:\/\/developer.apple.com\/documentation\/DriverKit\/IODispatchSourceCancelHandler"
        }
      ],
      "title" : "Starting and Stopping the Interrupt Source"
    }
  ],
  "source" : "appleJSON",
  "title" : "SetEnableWithCompletion",
  "url" : "https:\/\/developer.apple.com\/documentation\/DriverKit\/IOInterruptDispatchSource\/SetEnableWithCompletion"
}