{
  "abstract" : "Set the state of provider properties.",
  "codeExamples" : [

  ],
  "contentHash" : "1fa4742ef21efcee1c39fcd3c173538d6928ce3500c829acb076e99c4435e0c2",
  "crawledAt" : "2025-12-02T07:57:51Z",
  "declaration" : {
    "code" : "func setProviderProperties(_ providerProperties: CMIOExtensionProviderProperties) throws",
    "language" : "swift"
  },
  "id" : "4F636126-0F26-42C2-B77E-3E5A5A61DCE5",
  "kind" : "method",
  "module" : "Core Media I\/O",
  "overview" : "## Discussion\n\nIf you implement this method in Swift and an error occurs, throw an error and pass more detailed information regarding the property or properties that failed in the error that you throw. If you implement this method in Objective-C and an error occurs, pass more detailed information regarding the property or properties that failed in the [doc:\/\/com.apple.documentation\/documentation\/Foundation\/NSError\/localizedDescription] property of [doc:\/\/com.apple.documentation\/documentation\/Foundation\/NSError].",
  "platforms" : [
    "Mac Catalyst",
    "macOS"
  ],
  "rawMarkdown" : "---\nsource: https:\/\/developer.apple.com\/documentation\/CoreMediaIO\/CMIOExtensionProviderSource\/setProviderProperties(_:)\ncrawled: 2025-12-02T07:57:51Z\n---\n\n# setProviderProperties(_:)\n\n**Instance Method**\n\nSet the state of provider properties.\n\n## Declaration\n\n```swift\nfunc setProviderProperties(_ providerProperties: CMIOExtensionProviderProperties) throws\n```\n\n## Parameters\n\n- **providerProperties**: A provider properties object that contains the updated property states.\n\n## Discussion\n\nIf you implement this method in Swift and an error occurs, throw an error and pass more detailed information regarding the property or properties that failed in the error that you throw. If you implement this method in Objective-C and an error occurs, pass more detailed information regarding the property or properties that failed in the [doc:\/\/com.apple.documentation\/documentation\/Foundation\/NSError\/localizedDescription] property of [doc:\/\/com.apple.documentation\/documentation\/Foundation\/NSError].\n\n## Configuring Properties\n\n- **availableProperties**: A set of available properties for a provider.\n- **providerProperties(forProperties:)**: Gets the state of provider properties.\n\n",
  "sections" : [
    {
      "content" : "",
      "items" : [
        {
          "description" : "A set of available properties for a provider.",
          "name" : "availableProperties",
          "url" : "https:\/\/developer.apple.com\/documentation\/CoreMediaIO\/CMIOExtensionProviderSource\/availableProperties"
        },
        {
          "description" : "Gets the state of provider properties.",
          "name" : "providerProperties(forProperties:)",
          "url" : "https:\/\/developer.apple.com\/documentation\/CoreMediaIO\/CMIOExtensionProviderSource\/providerProperties(forProperties:)"
        }
      ],
      "title" : "Configuring Properties"
    }
  ],
  "source" : "appleJSON",
  "title" : "setProviderProperties(_:)",
  "url" : "https:\/\/developer.apple.com\/documentation\/CoreMediaIO\/CMIOExtensionProviderSource\/setProviderProperties(_:)"
}