{
  "abstract" : "A reader session for detecting ISO7816, ISO15693, FeliCa, and MIFARE tags.",
  "codeExamples" : [

  ],
  "conformsTo" : [
    "CVarArg",
    "CustomDebugStringConvertible",
    "CustomStringConvertible",
    "Equatable",
    "Hashable",
    "NFCReaderSessionProtocol",
    "NSObjectProtocol"
  ],
  "contentHash" : "e8900c05efddeecba1eec802b75d8c78dcf0b7e682f19a8659ddfb4c30669513",
  "crawledAt" : "2025-12-05T03:27:48Z",
  "declaration" : {
    "code" : "class NFCTagReaderSession",
    "language" : "swift"
  },
  "id" : "46062747-D694-4234-9437-AD199ECC3398",
  "inheritedBy" : [
    "NFCPaymentTagReaderSession"
  ],
  "kind" : "class",
  "language" : "swift",
  "module" : "Core NFC",
  "overview" : "## Overview\n\nUse NFCTagReaderSession to interact with one of the tag types listed in [doc:\/\/com.apple.corenfc\/documentation\/CoreNFC\/NFCTagType]. To use this reader session, you must:\n\nTo interact with ISO 7816 tags, add the list of the application identifiers supported in your app to the [doc:\/\/com.apple.documentation\/documentation\/BundleResources\/Entitlements\/com.apple.developer.nfc.readersession.iso7816.select-identifiers] information property list key. If you include the application identifier `D2760000850101`—the identifier for the NDEF application on MIFARE DESFire tags (NFC Forum T4T tag platform)—and the reader session finds a tag matching this identifier, it sends the delegate an [doc:\/\/com.apple.corenfc\/documentation\/CoreNFC\/NFCISO7816Tag] tag object. To get the MIFARE DESFire tag as an [doc:\/\/com.apple.corenfc\/documentation\/CoreNFC\/NFCMiFareTag] object, don’t include `D2760000850101` in the application identifier list.\n\nOnly one reader session of any type can be active in the system at a time. The system puts additional sessions in a queue and processes them in first-in, first-out (FIFO) order.",
  "platforms" : [
    "iOS",
    "iPadOS",
    "Mac Catalyst"
  ],
  "rawMarkdown" : "---\nsource: https:\/\/developer.apple.com\/documentation\/CoreNFC\/NFCTagReaderSession\ncrawled: 2025-12-05T03:27:48Z\n---\n\n# NFCTagReaderSession\n\n**Class**\n\nA reader session for detecting ISO7816, ISO15693, FeliCa, and MIFARE tags.\n\n## Declaration\n\n```swift\nclass NFCTagReaderSession\n```\n\n## Overview\n\nUse NFCTagReaderSession to interact with one of the tag types listed in [doc:\/\/com.apple.corenfc\/documentation\/CoreNFC\/NFCTagType]. To use this reader session, you must:\n\n- Include the [doc:\/\/com.apple.documentation\/documentation\/BundleResources\/Entitlements\/com.apple.developer.nfc.readersession.formats] in your app.\n- Provide a non-empty string for the [doc:\/\/com.apple.documentation\/documentation\/BundleResources\/Information-Property-List\/NFCReaderUsageDescription] key in your app’s information property list file.\n\nTo interact with ISO 7816 tags, add the list of the application identifiers supported in your app to the [doc:\/\/com.apple.documentation\/documentation\/BundleResources\/Entitlements\/com.apple.developer.nfc.readersession.iso7816.select-identifiers] information property list key. If you include the application identifier `D2760000850101`—the identifier for the NDEF application on MIFARE DESFire tags (NFC Forum T4T tag platform)—and the reader session finds a tag matching this identifier, it sends the delegate an [doc:\/\/com.apple.corenfc\/documentation\/CoreNFC\/NFCISO7816Tag] tag object. To get the MIFARE DESFire tag as an [doc:\/\/com.apple.corenfc\/documentation\/CoreNFC\/NFCMiFareTag] object, don’t include `D2760000850101` in the application identifier list.\n\nOnly one reader session of any type can be active in the system at a time. The system puts additional sessions in a queue and processes them in first-in, first-out (FIFO) order.\n\n\n\n## Creating a Tag Reader Session\n\n- **init(pollingOption:delegate:queue:)**: Creates an NFC tag reader session.\n- **NFCTagReaderSession.PollingOption**: Options that determine the type of tags that a reader session should detect during a polling sequence.\n- **NFCTagReaderSessionDelegate**: A protocol that an object implements to receive callbacks sent from an NFC tag reader session.\n\n## Connecting to a Tag\n\n- **connect(to:completionHandler:)**: Connects the reader session to a tag and activates that tag.\n- **connectedTag**: The tag connected to the reader session.\n\n## Restarting the Polling Sequence\n\n- **restartPolling()**: Restarts the polling sequence so the reader session can discover new tags.\n\n## Instance Methods\n\n- **connect(to:)**\n\n## Reader sessions\n\n- **NFCNDEFReaderSession**: A reader session for detecting NFC Data Exchange Format (NDEF) tags.\n- **NFCPaymentTagReaderSession**: A reader session that supports the use of payment tags.\n- **NFCVASReaderSession**: A reader session for processing Value Added Service (VAS) tags.\n- **NFCReaderSession**: The abstract base class that represents a reader session for detecting NFC tags.\n- **NFCReaderSessionProtocol**: A general interface for interacting with a reader session.\n- **Near Field Communication Tag Reader Session Formats Entitlement**: The Near Field Communication data formats an app can read.\n\n## Inherits From\n\n- NFCReaderSession\n\n## Inherited By\n\n- NFCPaymentTagReaderSession\n\n## Conforms To\n\n- CVarArg\n- CustomDebugStringConvertible\n- CustomStringConvertible\n- Equatable\n- Hashable\n- NFCReaderSessionProtocol\n- NSObjectProtocol\n\n",
  "sections" : [
    {
      "content" : "",
      "items" : [
        {
          "description" : "Creates an NFC tag reader session.",
          "name" : "init(pollingOption:delegate:queue:)",
          "url" : "https:\/\/developer.apple.com\/documentation\/CoreNFC\/NFCTagReaderSession\/init(pollingOption:delegate:queue:)"
        },
        {
          "description" : "Options that determine the type of tags that a reader session should detect during a polling sequence.",
          "name" : "NFCTagReaderSession.PollingOption",
          "url" : "https:\/\/developer.apple.com\/documentation\/CoreNFC\/NFCTagReaderSession\/PollingOption"
        },
        {
          "description" : "A protocol that an object implements to receive callbacks sent from an NFC tag reader session.",
          "name" : "NFCTagReaderSessionDelegate",
          "url" : "https:\/\/developer.apple.com\/documentation\/CoreNFC\/NFCTagReaderSessionDelegate-2joku"
        }
      ],
      "title" : "Creating a Tag Reader Session"
    },
    {
      "content" : "",
      "items" : [
        {
          "description" : "Connects the reader session to a tag and activates that tag.",
          "name" : "connect(to:completionHandler:)",
          "url" : "https:\/\/developer.apple.com\/documentation\/CoreNFC\/NFCTagReaderSession\/connect(to:completionHandler:)"
        },
        {
          "description" : "The tag connected to the reader session.",
          "name" : "connectedTag",
          "url" : "https:\/\/developer.apple.com\/documentation\/CoreNFC\/NFCTagReaderSession\/connectedTag-3mlqu"
        }
      ],
      "title" : "Connecting to a Tag"
    },
    {
      "content" : "",
      "items" : [
        {
          "description" : "Restarts the polling sequence so the reader session can discover new tags.",
          "name" : "restartPolling()",
          "url" : "https:\/\/developer.apple.com\/documentation\/CoreNFC\/NFCTagReaderSession\/restartPolling()"
        }
      ],
      "title" : "Restarting the Polling Sequence"
    },
    {
      "content" : "",
      "items" : [
        {
          "description" : "",
          "name" : "connect(to:)",
          "url" : "https:\/\/developer.apple.com\/documentation\/CoreNFC\/NFCTagReaderSession\/connect(to:)"
        }
      ],
      "title" : "Instance Methods"
    },
    {
      "content" : "",
      "items" : [
        {
          "description" : "A reader session for detecting NFC Data Exchange Format (NDEF) tags.",
          "name" : "NFCNDEFReaderSession",
          "url" : "https:\/\/developer.apple.com\/documentation\/CoreNFC\/NFCNDEFReaderSession"
        },
        {
          "description" : "A reader session that supports the use of payment tags.",
          "name" : "NFCPaymentTagReaderSession",
          "url" : "https:\/\/developer.apple.com\/documentation\/CoreNFC\/NFCPaymentTagReaderSession"
        },
        {
          "description" : "A reader session for processing Value Added Service (VAS) tags.",
          "name" : "NFCVASReaderSession",
          "url" : "https:\/\/developer.apple.com\/documentation\/CoreNFC\/NFCVASReaderSession"
        },
        {
          "description" : "The abstract base class that represents a reader session for detecting NFC tags.",
          "name" : "NFCReaderSession",
          "url" : "https:\/\/developer.apple.com\/documentation\/CoreNFC\/NFCReaderSession-swift.class"
        },
        {
          "description" : "A general interface for interacting with a reader session.",
          "name" : "NFCReaderSessionProtocol",
          "url" : "https:\/\/developer.apple.com\/documentation\/CoreNFC\/NFCReaderSessionProtocol"
        },
        {
          "description" : "The Near Field Communication data formats an app can read.",
          "name" : "Near Field Communication Tag Reader Session Formats Entitlement",
          "url" : "https:\/\/developer.apple.com\/documentation\/BundleResources\/Entitlements\/com.apple.developer.nfc.readersession.formats"
        }
      ],
      "title" : "Reader sessions"
    },
    {
      "content" : "",
      "items" : [
        {
          "name" : "NFCReaderSession"
        }
      ],
      "title" : "Inherits From"
    }
  ],
  "source" : "appleJSON",
  "title" : "NFCTagReaderSession",
  "url" : "https:\/\/developer.apple.com\/documentation\/CoreNFC\/NFCTagReaderSession"
}