{
  "abstract" : "A container for the node hierarchy and global properties that together form a displayable 3D scene.",
  "codeExamples" : [
    {
      "code" : "guard let myScene = SCNScene(named: \"MyScene\") \n    else { fatalError(\"Unable to load scene file.\") }\nscnView.scene = myScene \/\/ Your app's SCNView",
      "language" : "swift"
    }
  ],
  "conformsTo" : [
    "CVarArg",
    "Copyable",
    "CustomDebugStringConvertible",
    "CustomStringConvertible",
    "Equatable",
    "GKSceneRootNodeType",
    "Hashable",
    "NSCoding",
    "NSObjectProtocol",
    "NSSecureCoding"
  ],
  "contentHash" : "d42cfc832bafe35feec1e12a0278eaadbed7da29e7f17032e292cf61516b60c5",
  "crawledAt" : "2025-12-03T12:50:07Z",
  "declaration" : {
    "code" : "class SCNScene",
    "language" : "swift"
  },
  "id" : "7BEAE6B7-1201-4437-8BBD-9344972D629A",
  "kind" : "class",
  "language" : "swift",
  "module" : "SceneKit",
  "overview" : "## Overview\n\nTo display 3D content with SceneKit, you create a scene containing a hierarchy of the nodes and attributes that together represent your visual elements. Typically, you build your assets in a 3D visual editor, then assemble them into a scene using Xcode’s SceneKit Scene Editor, ready for SceneKit to render.\n\n\n\nTo display your scene, you need to load it at runtime, then set it as the scene property of an [doc:\/\/com.apple.scenekit\/documentation\/SceneKit\/SCNView]:\n\n### Creating a Scene\n\nThe simplest way to create a scene is through Xcode’s SceneKit Scene Editor. Start by importing one or more assets from a 3D editor, such as Blender. Then you adjust the positions and attributes of the assets, and set global scene properties, such as lighting environment, to compose your scene. The scene editor creates a `.scn` file, which you save to a `.scnassets` folder in the app bundle. When you build your project, Xcode optimizes the scene file for your target platform.",
  "platforms" : [
    "iOS",
    "iPadOS",
    "Mac Catalyst",
    "macOS",
    "tvOS",
    "visionOS",
    "watchOS"
  ],
  "rawMarkdown" : "---\nsource: https:\/\/developer.apple.com\/documentation\/scenekit\/scnscene\ncrawled: 2025-12-03T12:50:07Z\n---\n\n# SCNScene\n\n**Class**\n\nA container for the node hierarchy and global properties that together form a displayable 3D scene.\n\n## Declaration\n\n```swift\nclass SCNScene\n```\n\n## Overview\n\nTo display 3D content with SceneKit, you create a scene containing a hierarchy of the nodes and attributes that together represent your visual elements. Typically, you build your assets in a 3D visual editor, then assemble them into a scene using Xcode’s SceneKit Scene Editor, ready for SceneKit to render.\n\n\n\nTo display your scene, you need to load it at runtime, then set it as the scene property of an [doc:\/\/com.apple.scenekit\/documentation\/SceneKit\/SCNView]:\n\n```swift\nguard let myScene = SCNScene(named: \"MyScene\") \n    else { fatalError(\"Unable to load scene file.\") }\nscnView.scene = myScene \/\/ Your app's SCNView\n```\n\n### Creating a Scene\n\nThe simplest way to create a scene is through Xcode’s SceneKit Scene Editor. Start by importing one or more assets from a 3D editor, such as Blender. Then you adjust the positions and attributes of the assets, and set global scene properties, such as lighting environment, to compose your scene. The scene editor creates a `.scn` file, which you save to a `.scnassets` folder in the app bundle. When you build your project, Xcode optimizes the scene file for your target platform.\n\n## Creating a Scene from a File\n\n- **init(named:)**: Loads a scene from a file with the specified name in the app’s main bundle.\n- **init(named:inDirectory:options:)**: Loads a scene from a file with the specified name in a specific subdirectory of the app’s main bundle.\n- **init(url:options:)**: Loads a scene from the specified URL.\n\n## Managing Animated Effects in a Scene\n\n- **isPaused**: A Boolean value that determines whether to run actions, animations, particle systems, and physics simulations in the scene graph.\n\n## Accessing Scene Contents\n\n- **rootNode**: The root node of the scene graph.\n- **background**: A background to be rendered before the rest of the scene.\n- **lightingEnvironment**: A cube map texture that depicts the environment surrounding the scene’s contents, used for advanced lighting effects.\n\n## Managing Scene Attributes\n\n- **attribute(forKey:)**: Returns the scene attribute for the specified key.\n- **setAttribute(_:forKey:)**: Sets a scene attribute for the specified key.\n- **SCNScene.Attribute**\n\n## Exporting a Scene File\n\n- **write(to:options:delegate:progressHandler:)**: Exports the scene and its contents to a file at the specified URL.\n- **SCNSceneExportDelegate**: Methods you can implement to participate in the process of exporting a scene to a file.\n\n## Adding Fog to a Scene\n\n- **fogStartDistance**: The distance from a point of view at which the scene’s contents begin to be obscured by fog. Animatable.\n- **fogEndDistance**: The distance from a point of view at which the scene’s contents are completely obscured by fog. Animatable.\n- **fogDensityExponent**: The transition curve for the fog’s intensity between its start and end distances. Animatable.\n- **fogColor**: The color of the fog effect to be rendered with the scene. Animatable.\n\n## Working With Physics in the Scene\n\n- **physicsWorld**: The physics simulation associated with the scene.\n\n## Working with Particle Systems in the Scene\n\n- **addParticleSystem(_:transform:)**: Attaches a particle system to the scene, using the specified transform.\n- **particleSystems**: The particle systems attached to the scene.\n- **removeParticleSystem(_:)**: Removes a particle system attached to the scene.\n- **removeAllParticleSystems()**: Removes any particle systems directly attached to the scene.\n\n## Constants\n\n- **Scene Attributes**: Attribute keys available in the options dictionary for the methods  [doc:\/\/com.apple.scenekit\/documentation\/SceneKit\/SCNScene\/attribute(forKey:)] and [doc:\/\/com.apple.scenekit\/documentation\/SceneKit\/SCNScene\/setAttribute(_:forKey:)]\n- **Scene Export Options**: Options for the [doc:\/\/com.apple.scenekit\/documentation\/SceneKit\/SCNScene\/write(to:options:delegate:progressHandler:)] method.\n- **SCNSceneExportProgressHandler**: The signature for the block that SceneKit calls during scene export.\n\n## Instance Properties\n\n- **screenSpaceReflectionMaximumDistance**\n- **screenSpaceReflectionSampleCount**\n- **screenSpaceReflectionStride**\n- **wantsScreenSpaceReflection**\n\n## Essentials\n\n- **SCNView**: A view for displaying 3D SceneKit content.\n- **SceneView**: A SwiftUI view for displaying 3D SceneKit content.\n\n## Inherits From\n\n- NSObject\n\n## Conforms To\n\n- CVarArg\n- Copyable\n- CustomDebugStringConvertible\n- CustomStringConvertible\n- Equatable\n- GKSceneRootNodeType\n- Hashable\n- NSCoding\n- NSObjectProtocol\n- NSSecureCoding\n\n",
  "sections" : [
    {
      "content" : "",
      "items" : [
        {
          "description" : "Loads a scene from a file with the specified name in the app’s main bundle.",
          "name" : "init(named:)",
          "url" : "https:\/\/developer.apple.com\/documentation\/SceneKit\/SCNScene\/init(named:)"
        },
        {
          "description" : "Loads a scene from a file with the specified name in a specific subdirectory of the app’s main bundle.",
          "name" : "init(named:inDirectory:options:)",
          "url" : "https:\/\/developer.apple.com\/documentation\/SceneKit\/SCNScene\/init(named:inDirectory:options:)"
        },
        {
          "description" : "Loads a scene from the specified URL.",
          "name" : "init(url:options:)",
          "url" : "https:\/\/developer.apple.com\/documentation\/SceneKit\/SCNScene\/init(url:options:)"
        }
      ],
      "title" : "Creating a Scene from a File"
    },
    {
      "content" : "",
      "items" : [
        {
          "description" : "A Boolean value that determines whether to run actions, animations, particle systems, and physics simulations in the scene graph.",
          "name" : "isPaused",
          "url" : "https:\/\/developer.apple.com\/documentation\/SceneKit\/SCNScene\/isPaused"
        }
      ],
      "title" : "Managing Animated Effects in a Scene"
    },
    {
      "content" : "",
      "items" : [
        {
          "description" : "The root node of the scene graph.",
          "name" : "rootNode",
          "url" : "https:\/\/developer.apple.com\/documentation\/SceneKit\/SCNScene\/rootNode"
        },
        {
          "description" : "A background to be rendered before the rest of the scene.",
          "name" : "background",
          "url" : "https:\/\/developer.apple.com\/documentation\/SceneKit\/SCNScene\/background"
        },
        {
          "description" : "A cube map texture that depicts the environment surrounding the scene’s contents, used for advanced lighting effects.",
          "name" : "lightingEnvironment",
          "url" : "https:\/\/developer.apple.com\/documentation\/SceneKit\/SCNScene\/lightingEnvironment"
        }
      ],
      "title" : "Accessing Scene Contents"
    },
    {
      "content" : "",
      "items" : [
        {
          "description" : "Returns the scene attribute for the specified key.",
          "name" : "attribute(forKey:)",
          "url" : "https:\/\/developer.apple.com\/documentation\/SceneKit\/SCNScene\/attribute(forKey:)"
        },
        {
          "description" : "Sets a scene attribute for the specified key.",
          "name" : "setAttribute(_:forKey:)",
          "url" : "https:\/\/developer.apple.com\/documentation\/SceneKit\/SCNScene\/setAttribute(_:forKey:)"
        },
        {
          "description" : "",
          "name" : "SCNScene.Attribute",
          "url" : "https:\/\/developer.apple.com\/documentation\/SceneKit\/SCNScene\/Attribute"
        }
      ],
      "title" : "Managing Scene Attributes"
    },
    {
      "content" : "",
      "items" : [
        {
          "description" : "Exports the scene and its contents to a file at the specified URL.",
          "name" : "write(to:options:delegate:progressHandler:)",
          "url" : "https:\/\/developer.apple.com\/documentation\/SceneKit\/SCNScene\/write(to:options:delegate:progressHandler:)"
        },
        {
          "description" : "Methods you can implement to participate in the process of exporting a scene to a file.",
          "name" : "SCNSceneExportDelegate",
          "url" : "https:\/\/developer.apple.com\/documentation\/SceneKit\/SCNSceneExportDelegate"
        }
      ],
      "title" : "Exporting a Scene File"
    },
    {
      "content" : "",
      "items" : [
        {
          "description" : "The distance from a point of view at which the scene’s contents begin to be obscured by fog. Animatable.",
          "name" : "fogStartDistance",
          "url" : "https:\/\/developer.apple.com\/documentation\/SceneKit\/SCNScene\/fogStartDistance"
        },
        {
          "description" : "The distance from a point of view at which the scene’s contents are completely obscured by fog. Animatable.",
          "name" : "fogEndDistance",
          "url" : "https:\/\/developer.apple.com\/documentation\/SceneKit\/SCNScene\/fogEndDistance"
        },
        {
          "description" : "The transition curve for the fog’s intensity between its start and end distances. Animatable.",
          "name" : "fogDensityExponent",
          "url" : "https:\/\/developer.apple.com\/documentation\/SceneKit\/SCNScene\/fogDensityExponent"
        },
        {
          "description" : "The color of the fog effect to be rendered with the scene. Animatable.",
          "name" : "fogColor",
          "url" : "https:\/\/developer.apple.com\/documentation\/SceneKit\/SCNScene\/fogColor"
        }
      ],
      "title" : "Adding Fog to a Scene"
    },
    {
      "content" : "",
      "items" : [
        {
          "description" : "The physics simulation associated with the scene.",
          "name" : "physicsWorld",
          "url" : "https:\/\/developer.apple.com\/documentation\/SceneKit\/SCNScene\/physicsWorld"
        }
      ],
      "title" : "Working With Physics in the Scene"
    },
    {
      "content" : "",
      "items" : [
        {
          "description" : "Attaches a particle system to the scene, using the specified transform.",
          "name" : "addParticleSystem(_:transform:)",
          "url" : "https:\/\/developer.apple.com\/documentation\/SceneKit\/SCNScene\/addParticleSystem(_:transform:)"
        },
        {
          "description" : "The particle systems attached to the scene.",
          "name" : "particleSystems",
          "url" : "https:\/\/developer.apple.com\/documentation\/SceneKit\/SCNScene\/particleSystems"
        },
        {
          "description" : "Removes a particle system attached to the scene.",
          "name" : "removeParticleSystem(_:)",
          "url" : "https:\/\/developer.apple.com\/documentation\/SceneKit\/SCNScene\/removeParticleSystem(_:)"
        },
        {
          "description" : "Removes any particle systems directly attached to the scene.",
          "name" : "removeAllParticleSystems()",
          "url" : "https:\/\/developer.apple.com\/documentation\/SceneKit\/SCNScene\/removeAllParticleSystems()"
        }
      ],
      "title" : "Working with Particle Systems in the Scene"
    },
    {
      "content" : "",
      "items" : [
        {
          "description" : "Attribute keys available in the options dictionary for the methods  [doc:\/\/com.apple.scenekit\/documentation\/SceneKit\/SCNScene\/attribute(forKey:)] and [doc:\/\/com.apple.scenekit\/documentation\/SceneKit\/SCNScene\/setAttribute(_:forKey:)]",
          "name" : "Scene Attributes",
          "url" : "https:\/\/developer.apple.com\/documentation\/SceneKit\/scene-attributes"
        },
        {
          "description" : "Options for the [doc:\/\/com.apple.scenekit\/documentation\/SceneKit\/SCNScene\/write(to:options:delegate:progressHandler:)] method.",
          "name" : "Scene Export Options",
          "url" : "https:\/\/developer.apple.com\/documentation\/SceneKit\/scene-export-options"
        },
        {
          "description" : "The signature for the block that SceneKit calls during scene export.",
          "name" : "SCNSceneExportProgressHandler",
          "url" : "https:\/\/developer.apple.com\/documentation\/SceneKit\/SCNSceneExportProgressHandler"
        }
      ],
      "title" : "Constants"
    },
    {
      "content" : "",
      "items" : [
        {
          "description" : "",
          "name" : "screenSpaceReflectionMaximumDistance",
          "url" : "https:\/\/developer.apple.com\/documentation\/SceneKit\/SCNScene\/screenSpaceReflectionMaximumDistance"
        },
        {
          "description" : "",
          "name" : "screenSpaceReflectionSampleCount",
          "url" : "https:\/\/developer.apple.com\/documentation\/SceneKit\/SCNScene\/screenSpaceReflectionSampleCount"
        },
        {
          "description" : "",
          "name" : "screenSpaceReflectionStride",
          "url" : "https:\/\/developer.apple.com\/documentation\/SceneKit\/SCNScene\/screenSpaceReflectionStride"
        },
        {
          "description" : "",
          "name" : "wantsScreenSpaceReflection",
          "url" : "https:\/\/developer.apple.com\/documentation\/SceneKit\/SCNScene\/wantsScreenSpaceReflection"
        }
      ],
      "title" : "Instance Properties"
    },
    {
      "content" : "",
      "items" : [
        {
          "description" : "A view for displaying 3D SceneKit content.",
          "name" : "SCNView",
          "url" : "https:\/\/developer.apple.com\/documentation\/SceneKit\/SCNView"
        },
        {
          "description" : "A SwiftUI view for displaying 3D SceneKit content.",
          "name" : "SceneView",
          "url" : "https:\/\/developer.apple.com\/documentation\/SceneKit\/SceneView"
        }
      ],
      "title" : "Essentials"
    },
    {
      "content" : "",
      "items" : [
        {
          "name" : "NSObject"
        }
      ],
      "title" : "Inherits From"
    }
  ],
  "source" : "appleJSON",
  "title" : "SCNScene",
  "url" : "https:\/\/developer.apple.com\/documentation\/scenekit\/scnscene"
}