{
  "abstract" : "Renders the scene’s contents in the renderer’s OpenGL context.",
  "codeExamples" : [

  ],
  "contentHash" : "4919fa41967d3a8447586a57ce12d1eebac6dcdf48b1fef33163c50f88010aa8",
  "crawledAt" : "2025-12-03T12:59:16Z",
  "declaration" : {
    "code" : "func render()",
    "language" : "swift"
  },
  "id" : "FAD85C5F-ED0B-4F0B-A633-8D95AFB7CAD4",
  "kind" : "method",
  "language" : "swift",
  "module" : "SceneKit",
  "overview" : "## Discussion\n\nThis method can be used only with an [doc:\/\/com.apple.scenekit\/documentation\/SceneKit\/SCNRenderer] object created with the [doc:\/\/com.apple.scenekit\/documentation\/SceneKit\/SCNRenderer] initializer. Call this method to tell SceneKit to draw the renderer’s scene into the OpenGL context you created the renderer with.\n\nWhen you call this method, SceneKit updates its hierarchy of presentation nodes based on the current system time, and then draws the scene.",
  "platforms" : [
    "iOS",
    "iPadOS",
    "macOS"
  ],
  "rawMarkdown" : "---\nsource: https:\/\/developer.apple.com\/documentation\/SceneKit\/SCNRenderer\/render()\ncrawled: 2025-12-03T12:59:16Z\n---\n\n# render()\n\n**Instance Method**\n\nRenders the scene’s contents in the renderer’s OpenGL context.\n\n## Declaration\n\n```swift\nfunc render()\n```\n\n## Discussion\n\nThis method can be used only with an [doc:\/\/com.apple.scenekit\/documentation\/SceneKit\/SCNRenderer] object created with the [doc:\/\/com.apple.scenekit\/documentation\/SceneKit\/SCNRenderer] initializer. Call this method to tell SceneKit to draw the renderer’s scene into the OpenGL context you created the renderer with.\n\nWhen you call this method, SceneKit updates its hierarchy of presentation nodes based on the current system time, and then draws the scene.\n\n## Rendering a Scene Using OpenGL\n\n- **render(atTime:)**: Renders the scene’s contents at the specified system time in the renderer’s OpenGL context.\n\n",
  "sections" : [
    {
      "content" : "",
      "items" : [
        {
          "description" : "Renders the scene’s contents at the specified system time in the renderer’s OpenGL context.",
          "name" : "render(atTime:)",
          "url" : "https:\/\/developer.apple.com\/documentation\/SceneKit\/SCNRenderer\/render(atTime:)"
        }
      ],
      "title" : "Rendering a Scene Using OpenGL"
    }
  ],
  "source" : "appleJSON",
  "title" : "render()",
  "url" : "https:\/\/developer.apple.com\/documentation\/SceneKit\/SCNRenderer\/render()"
}