{
  "abstract" : "The date when the system considers the Live Activity to be out of date.",
  "codeExamples" : [

  ],
  "contentHash" : "c754b7366253d32ae28a7fc7ed6067ba9c943ff705aebb457112387eb950a08e",
  "crawledAt" : "2025-12-03T04:05:09Z",
  "declaration" : {
    "code" : "let staleDate: Date?",
    "language" : "swift"
  },
  "id" : "A0217615-5490-42CB-89DA-21BFB6E4CCB9",
  "kind" : "property",
  "language" : "swift",
  "module" : "ActivityKit",
  "overview" : "## Discussion\n\nWhen time reaches the configured stale date, the system considers the Live Activity out of date, and the [doc:\/\/com.apple.activitykit\/documentation\/ActivityKit\/ActivityState] of the Live Activity changes to [doc:\/\/com.apple.activitykit\/documentation\/ActivityKit\/ActivityState\/stale].",
  "platforms" : [
    "iOS",
    "iPadOS"
  ],
  "rawMarkdown" : "---\nsource: https:\/\/developer.apple.com\/documentation\/ActivityKit\/ActivityContent\/staleDate\ncrawled: 2025-12-03T04:05:09Z\n---\n\n# staleDate\n\n**Instance Property**\n\nThe date when the system considers the Live Activity to be out of date.\n\n## Declaration\n\n```swift\nlet staleDate: Date?\n```\n\n## Discussion\n\nWhen time reaches the configured stale date, the system considers the Live Activity out of date, and the [doc:\/\/com.apple.activitykit\/documentation\/ActivityKit\/ActivityState] of the Live Activity changes to [doc:\/\/com.apple.activitykit\/documentation\/ActivityKit\/ActivityState\/stale].\n\n## Describing a Live Activity\n\n- **init(state:staleDate:relevanceScore:)**: Creates the object that describes the state and configuration of a Live Activity.\n- **state**: The current state of a Live Activity in its life cycle.\n- **relevanceScore**: A score you assign that determines the order in which your Live Activities appear when you start several Live Activities for your app.\n\n",
  "sections" : [
    {
      "content" : "",
      "items" : [
        {
          "description" : "Creates the object that describes the state and configuration of a Live Activity.",
          "name" : "init(state:staleDate:relevanceScore:)",
          "url" : "https:\/\/developer.apple.com\/documentation\/ActivityKit\/ActivityContent\/init(state:staleDate:relevanceScore:)"
        },
        {
          "description" : "The current state of a Live Activity in its life cycle.",
          "name" : "state",
          "url" : "https:\/\/developer.apple.com\/documentation\/ActivityKit\/ActivityContent\/state"
        },
        {
          "description" : "A score you assign that determines the order in which your Live Activities appear when you start several Live Activities for your app.",
          "name" : "relevanceScore",
          "url" : "https:\/\/developer.apple.com\/documentation\/ActivityKit\/ActivityContent\/relevanceScore"
        }
      ],
      "title" : "Describing a Live Activity"
    }
  ],
  "source" : "appleJSON",
  "title" : "staleDate",
  "url" : "https:\/\/developer.apple.com\/documentation\/ActivityKit\/ActivityContent\/staleDate"
}