{
  "abstract" : "The token you use to send ActivityKit push notifications to a Live Activity.",
  "codeExamples" : [

  ],
  "contentHash" : "e132970f53a3a312aec0bda583928b54401f45e48cc66cc543034c7f94b575cb",
  "crawledAt" : "2025-12-02T16:35:53Z",
  "declaration" : {
    "code" : "var pushToken: Data? { get }",
    "language" : "swift"
  },
  "id" : "8B7B80A8-3405-45F6-9F81-941C6303EB0A",
  "kind" : "property",
  "language" : "swift",
  "module" : "ActivityKit",
  "overview" : "## Discussion\n\nThe push token for a Live Activity may change over time. Use the [doc:\/\/com.apple.activitykit\/documentation\/ActivityKit\/Activity\/pushTokenUpdates-swift.property] asynchronous sequence to receive the updated push token. When you receive an updated push token, make sure to send it to your server and invalidate the outdated token.",
  "platforms" : [
    "iOS",
    "iPadOS"
  ],
  "rawMarkdown" : "---\nsource: https:\/\/developer.apple.com\/documentation\/ActivityKit\/Activity\/pushToken\ncrawled: 2025-12-02T16:35:53Z\n---\n\n# pushToken\n\n**Instance Property**\n\nThe token you use to send ActivityKit push notifications to a Live Activity.\n\n## Declaration\n\n```swift\nvar pushToken: Data? { get }\n```\n\n## Discussion\n\nThe push token for a Live Activity may change over time. Use the [doc:\/\/com.apple.activitykit\/documentation\/ActivityKit\/Activity\/pushTokenUpdates-swift.property] asynchronous sequence to receive the updated push token. When you receive an updated push token, make sure to send it to your server and invalidate the outdated token.\n\n## Using ActivityKit push notifications\n\n- **pushTokenUpdates**: An asynchronous sequence you use to observe changes to the push token of a Live Activity.\n- **Activity.PushTokenUpdates**: A structure that offers functionality to observe changes to the push token of a Live Activity.\n- **pushToStartToken**: The token you use to start a Live Activity with an ActivityKit push notification.\n- **pushToStartTokenUpdates**: An asynchronous sequence you use to observe changes to the token for starting a Live Activity with an ActivityKit push notification.\n\n",
  "sections" : [
    {
      "content" : "",
      "items" : [
        {
          "description" : "An asynchronous sequence you use to observe changes to the push token of a Live Activity.",
          "name" : "pushTokenUpdates",
          "url" : "https:\/\/developer.apple.com\/documentation\/ActivityKit\/Activity\/pushTokenUpdates-swift.property"
        },
        {
          "description" : "A structure that offers functionality to observe changes to the push token of a Live Activity.",
          "name" : "Activity.PushTokenUpdates",
          "url" : "https:\/\/developer.apple.com\/documentation\/ActivityKit\/Activity\/PushTokenUpdates-swift.struct"
        },
        {
          "description" : "The token you use to start a Live Activity with an ActivityKit push notification.",
          "name" : "pushToStartToken",
          "url" : "https:\/\/developer.apple.com\/documentation\/ActivityKit\/Activity\/pushToStartToken"
        },
        {
          "description" : "An asynchronous sequence you use to observe changes to the token for starting a Live Activity with an ActivityKit push notification.",
          "name" : "pushToStartTokenUpdates",
          "url" : "https:\/\/developer.apple.com\/documentation\/ActivityKit\/Activity\/pushToStartTokenUpdates"
        }
      ],
      "title" : "Using ActivityKit push notifications"
    }
  ],
  "source" : "appleJSON",
  "title" : "pushToken",
  "url" : "https:\/\/developer.apple.com\/documentation\/ActivityKit\/Activity\/pushToken"
}