{
  "abstract" : "Use deep links to enable people to open your app’s scene that matches the data of you Live Activity.",
  "codeExamples" : [

  ],
  "contentHash" : "5df0e20ea978c39a32ab67383a8ee0e10515b5edce50a2ed101a919629a9e970",
  "crawledAt" : "2025-12-02T15:25:48Z",
  "id" : "F298ECAE-6CCC-4EB0-AE69-C17EBA4E4110",
  "kind" : "article",
  "language" : "swift",
  "module" : "ActivityKit",
  "overview" : "## Overview\n\nPeople can tap a Live Activity to launch your app. To let them view more content or make changes to an ongoing task, open your app to the scene that matches the content of the Live Activity.\n\n### Respond to the system’s default launch behavior\n\nIf you don’t explicitly provide a deep link into your app, the system opens your app and passes an [doc:\/\/com.apple.documentation\/documentation\/Foundation\/NSUserActivity] to [doc:\/\/com.apple.documentation\/documentation\/SwiftUI\/View\/onContinueUserActivity(_:perform:)], [doc:\/\/com.apple.documentation\/documentation\/UIKit\/UIApplicationDelegate\/application(_:continue:restorationHandler:)], or [doc:\/\/com.apple.documentation\/documentation\/AppKit\/NSApplicationDelegate\/application(_:continue:restorationHandler:)]. Implement the appropriate callback and check whether the `NSUserActivity` object’s [doc:\/\/com.apple.documentation\/documentation\/Foundation\/NSUserActivity\/activityType] is [doc:\/\/com.apple.documentation\/documentation\/WidgetKit\/NSUserActivityTypeLiveActivity]. Then, add code to open a screen in your app that fits the context of the active Live Activity.\n\n### Add deep links to your app\n\nWith deep links, you specify an URL that directly launches a specific scene in your app, and choose different scenes for each Live Activity presentation:\n\n### Configure how your Live Activity launches your app in watchOS\n\nLive Activities automatically appear in the Smart Stack on Apple Watch, and the system shows the Live Activity more prominently on Apple Watch when it receives updates with an alert. When a Live Activity receives an update:\n\nTapping the alert displays the Live Activity on Apple Watch and the option to launch the app on iPhone. You can opt-in to give people the ability to open your Watch app from your Live Activity. In the Build Settings for your watchOS app target, add the `Supports Launch for Live Activity Attribute Types` key in the `Info.plist` section. To launch your Watch app for all your Live Activities, leave its value empty. To launch for specific Live Activities, add an item for each [doc:\/\/com.apple.activitykit\/documentation\/ActivityKit\/ActivityAttributes] conforming type that launches your watchOS app.",
  "rawMarkdown" : "---\nsource: https:\/\/developer.apple.com\/documentation\/ActivityKit\/launching-your-app-from-a-live-activity\ncrawled: 2025-12-02T15:25:48Z\n---\n\n# Launching your app from a Live Activity\n\n**Article**\n\nUse deep links to enable people to open your app’s scene that matches the data of you Live Activity.\n\n## Overview\n\nPeople can tap a Live Activity to launch your app. To let them view more content or make changes to an ongoing task, open your app to the scene that matches the content of the Live Activity.\n\n### Respond to the system’s default launch behavior\n\nIf you don’t explicitly provide a deep link into your app, the system opens your app and passes an [doc:\/\/com.apple.documentation\/documentation\/Foundation\/NSUserActivity] to [doc:\/\/com.apple.documentation\/documentation\/SwiftUI\/View\/onContinueUserActivity(_:perform:)], [doc:\/\/com.apple.documentation\/documentation\/UIKit\/UIApplicationDelegate\/application(_:continue:restorationHandler:)], or [doc:\/\/com.apple.documentation\/documentation\/AppKit\/NSApplicationDelegate\/application(_:continue:restorationHandler:)]. Implement the appropriate callback and check whether the `NSUserActivity` object’s [doc:\/\/com.apple.documentation\/documentation\/Foundation\/NSUserActivity\/activityType] is [doc:\/\/com.apple.documentation\/documentation\/WidgetKit\/NSUserActivityTypeLiveActivity]. Then, add code to open a screen in your app that fits the context of the active Live Activity.\n\n\n\n### Add deep links to your app\n\nWith deep links, you specify an URL that directly launches a specific scene in your app, and choose different scenes for each Live Activity presentation:\n\n- To create a deep link into your app from the Lock Screen, compact leading, compact trailing, and minimal presentations, use [doc:\/\/com.apple.documentation\/documentation\/WidgetKit\/DynamicIsland\/widgetURL(_:)]. When the compact leading and trailing presentations are visible, make sure both link to the same screen in your app.\n- To create a deep link into your app from the extended presentation, use `widgetURL(_:)`  or SwiftUI’s [doc:\/\/com.apple.documentation\/documentation\/SwiftUI\/Link].\n\n### Configure how your Live Activity launches your app in watchOS\n\nLive Activities automatically appear in the Smart Stack on Apple Watch, and the system shows the Live Activity more prominently on Apple Watch when it receives updates with an alert. When a Live Activity receives an update:\n\n- If a person doesn’t actively use an app on Apple Watch, the system displays an alert that uses the compact presentation’s leading and trailing views, and then launches the Smart Stack, displaying the Live Activity at the top of the stack.\n- If a person actively uses any app on Apple Watch, the system shows an alert to let them know about the updated Live Activity.\n\nTapping the alert displays the Live Activity on Apple Watch and the option to launch the app on iPhone. You can opt-in to give people the ability to open your Watch app from your Live Activity. In the Build Settings for your watchOS app target, add the `Supports Launch for Live Activity Attribute Types` key in the `Info.plist` section. To launch your Watch app for all your Live Activities, leave its value empty. To launch for specific Live Activities, add an item for each [doc:\/\/com.apple.activitykit\/documentation\/ActivityKit\/ActivityAttributes] conforming type that launches your watchOS app.\n\n## User interface\n\n- **Creating custom views for Live Activities**: Create reusable custom views and layouts that support each Live Activity presentation.\n- **Adding accessible descriptions to widgets and Live Activities**: Describe the interface elements of your widgets and Live Activities to help people understand what they represent.\n\n",
  "sections" : [
    {
      "content" : "",
      "items" : [
        {
          "description" : "Create reusable custom views and layouts that support each Live Activity presentation.",
          "name" : "Creating custom views for Live Activities",
          "url" : "https:\/\/developer.apple.com\/documentation\/ActivityKit\/creating-custom-views-for-live-activities"
        },
        {
          "description" : "Describe the interface elements of your widgets and Live Activities to help people understand what they represent.",
          "name" : "Adding accessible descriptions to widgets and Live Activities",
          "url" : "https:\/\/developer.apple.com\/documentation\/ActivityKit\/adding-accessible-descriptions-to-widgets-and-live-activities"
        }
      ],
      "title" : "User interface"
    }
  ],
  "source" : "appleJSON",
  "title" : "Launching your app from a Live Activity",
  "url" : "https:\/\/developer.apple.com\/documentation\/ActivityKit\/launching-your-app-from-a-live-activity"
}