{
  "abstract" : "Selects a subject to track at the supplied coordinates.",
  "codeExamples" : [

  ],
  "contentHash" : "3c85c7f3e978395215109d60654c2023d06b9caf6f3d34ba25ff2b8d7d2ea40b",
  "crawledAt" : "2025-12-02T19:46:57Z",
  "declaration" : {
    "code" : "final func selectSubject(at unitPoint: CGPoint) async throws",
    "language" : "swift"
  },
  "id" : "B13F139A-93C1-435D-8E18-78285774EE0D",
  "kind" : "method",
  "language" : "swift",
  "module" : "DockKit",
  "overview" : "## Discussion\n\nThere may be times when more than one subject is in a video frame. Use this method to track a specific subject within that frame by passing a  location within the frame. The coordinates are relative to the top left of the video frame, and are values between `0` and `1`. If the framework doesn’t detect a subject at the passed coordinates, the method throws an error.\n\nIf you disable system tracking, this configuration change applies to any custom tracking for this dock accessory. The configuration applies to any camera stream the app has open if system tracking is enabled.\n\nCall this method when implementing your own custom tracking behavior.",
  "platforms" : [
    "iOS",
    "Mac Catalyst",
    "macOS"
  ],
  "rawMarkdown" : "---\nsource: https:\/\/developer.apple.com\/documentation\/DockKit\/DockAccessory\/selectSubject(at:)\ncrawled: 2025-12-02T19:46:57Z\n---\n\n# selectSubject(at:)\n\n**Instance Method**\n\nSelects a subject to track at the supplied coordinates.\n\n## Declaration\n\n```swift\nfinal func selectSubject(at unitPoint: CGPoint) async throws\n```\n\n## Discussion\n\nThere may be times when more than one subject is in a video frame. Use this method to track a specific subject within that frame by passing a  location within the frame. The coordinates are relative to the top left of the video frame, and are values between `0` and `1`. If the framework doesn’t detect a subject at the passed coordinates, the method throws an error.\n\nIf you disable system tracking, this configuration change applies to any custom tracking for this dock accessory. The configuration applies to any camera stream the app has open if system tracking is enabled.\n\nCall this method when implementing your own custom tracking behavior.\n\n\n\n## Selecting and tracking\n\n- **track(_:cameraInformation:)**: Automatically generate and send tracking vectors to the device.\n- **track(_:cameraInformation:)**: Automatically generate and send tracking vectors to the device.\n- **DockAccessory.Observation**: An observation of the contents of a single video frame.\n- **DockAccessory.CameraInformation**: A collection of tracking information about the camera currently in use.\n- **DockAccessory.CameraOrientation**: The set of camera orientations used to extract coordinates.\n\n",
  "sections" : [
    {
      "content" : "",
      "items" : [
        {
          "description" : "Automatically generate and send tracking vectors to the device.",
          "name" : "track(_:cameraInformation:)",
          "url" : "https:\/\/developer.apple.com\/documentation\/DockKit\/DockAccessory\/track(_:cameraInformation:)-4yl9b"
        },
        {
          "description" : "Automatically generate and send tracking vectors to the device.",
          "name" : "track(_:cameraInformation:)",
          "url" : "https:\/\/developer.apple.com\/documentation\/DockKit\/DockAccessory\/track(_:cameraInformation:)-44mwn"
        },
        {
          "description" : "An observation of the contents of a single video frame.",
          "name" : "DockAccessory.Observation",
          "url" : "https:\/\/developer.apple.com\/documentation\/DockKit\/DockAccessory\/Observation"
        },
        {
          "description" : "A collection of tracking information about the camera currently in use.",
          "name" : "DockAccessory.CameraInformation",
          "url" : "https:\/\/developer.apple.com\/documentation\/DockKit\/DockAccessory\/CameraInformation"
        },
        {
          "description" : "The set of camera orientations used to extract coordinates.",
          "name" : "DockAccessory.CameraOrientation",
          "url" : "https:\/\/developer.apple.com\/documentation\/DockKit\/DockAccessory\/CameraOrientation"
        }
      ],
      "title" : "Selecting and tracking"
    }
  ],
  "source" : "appleJSON",
  "title" : "selectSubject(at:)",
  "url" : "https:\/\/developer.apple.com\/documentation\/DockKit\/DockAccessory\/selectSubject(at:)"
}