{
  "abstract" : "Sets the position of each axis of orientation to radians for pitch, yaw, and roll.",
  "codeExamples" : [

  ],
  "contentHash" : "21eed8acb97be73e468f45abcee97f6bd1b95119ddfe9a8900d2a361eecc4198",
  "crawledAt" : "2025-12-02T20:06:18Z",
  "declaration" : {
    "code" : "final func setOrientation(_ rotation: Rotation3D, duration: Duration = .seconds(0), relative: Bool = false) async throws -> Progress",
    "language" : "swift"
  },
  "id" : "34156762-B623-4963-BEA0-0F868BA3D2A4",
  "kind" : "method",
  "language" : "swift",
  "module" : "DockKit",
  "overview" : "## Return Value\n\nA progress object that reports the progress towards the target orientation.\n\n## Discussion\n\nThis method works only when you disable system tracking.",
  "platforms" : [
    "iOS",
    "Mac Catalyst",
    "macOS"
  ],
  "rawMarkdown" : "---\nsource: https:\/\/developer.apple.com\/documentation\/DockKit\/DockAccessory\/setOrientation(_:duration:relative:)-6h2ah\ncrawled: 2025-12-02T20:06:18Z\n---\n\n# setOrientation(_:duration:relative:)\n\n**Instance Method**\n\nSets the position of each axis of orientation to radians for pitch, yaw, and roll.\n\n## Declaration\n\n```swift\nfinal func setOrientation(_ rotation: Rotation3D, duration: Duration = .seconds(0), relative: Bool = false) async throws -> Progress\n```\n\n## Parameters\n\n- **rotation**: The spatial frameworkâ€™s Rotation3D with X, Y, and Z corresponding to radians of pitch, yaw, and roll axes.\n- **duration**: The duration, in seconds, to reach the target orientation.\n- **relative**: Calculate the relative-to-current positions, if set to  `true`; otherwise, move to an absolute position.\n\n## Return Value\n\nA progress object that reports the progress towards the target orientation.\n\n## Discussion\n\nThis method works only when you disable system tracking.\n\n\n\n",
  "sections" : [

  ],
  "source" : "appleJSON",
  "title" : "setOrientation(_:duration:relative:)",
  "url" : "https:\/\/developer.apple.com\/documentation\/DockKit\/DockAccessory\/setOrientation(_:duration:relative:)-6h2ah"
}