{
  "abstract" : "A query that specifies a set of media items from the device’s media library using a filter and a grouping type.",
  "codeExamples" : [

  ],
  "conformsTo" : [
    "CVarArg",
    "CustomDebugStringConvertible",
    "CustomStringConvertible",
    "Equatable",
    "Hashable",
    "NSCoding",
    "NSCopying",
    "NSObjectProtocol",
    "NSSecureCoding"
  ],
  "contentHash" : "956821f79cf3fce951575fd75ee412af12e1ebe151cf06b9d5b0578e95f3d1c5",
  "crawledAt" : "2025-12-03T04:59:08Z",
  "declaration" : {
    "code" : "class MPMediaQuery",
    "language" : "swift"
  },
  "id" : "D6E0B8DB-2DE5-4EEE-B6A5-74D83F2C9474",
  "kind" : "class",
  "language" : "swift",
  "module" : "Media Player",
  "overview" : "## Overview\n\nFilter and grouping types are both optional; an unqualified query matches the entire library.\n\nA query has at most one grouping type. A query’s filter can consist of any number of media property predicates. You build filters using [doc:\/\/com.apple.mediaplayer\/documentation\/MediaPlayer\/MPMediaPropertyPredicate] objects, based on property keys described in [doc:\/\/com.apple.mediaplayer\/documentation\/MediaPlayer\/MPMediaItem].\n\nAfter creating and configuring a query, you use it to retrieve media items or media item collections. You can also use a query to retrieve an array of [doc:\/\/com.apple.mediaplayer\/documentation\/MediaPlayer\/MPMediaQuerySection] instances, useful for displaying the results of a query in the user interface of your app. See the [doc:\/\/com.apple.mediaplayer\/documentation\/MediaPlayer\/MPMediaQuery\/itemSections] and [doc:\/\/com.apple.mediaplayer\/documentation\/MediaPlayer\/MPMediaQuery\/collectionSections] properties.\n\nThis class includes several convenience constructors that each apply a grouping type and, in most cases, match a subset of the library. The following table summarizes the features of these constructors. See [doc:\/\/com.apple.mediaplayer\/documentation\/MediaPlayer\/MPMediaItem] for descriptions of the entries in the Filter column. See [doc:\/\/com.apple.mediaplayer\/documentation\/MediaPlayer\/MPMediaGrouping] for descriptions of the entries in the Grouping type column.",
  "platforms" : [
    "iOS",
    "iPadOS",
    "Mac Catalyst",
    "visionOS"
  ],
  "rawMarkdown" : "---\nsource: https:\/\/developer.apple.com\/documentation\/MediaPlayer\/MPMediaQuery\ncrawled: 2025-12-03T04:59:08Z\n---\n\n# MPMediaQuery\n\n**Class**\n\nA query that specifies a set of media items from the device’s media library using a filter and a grouping type.\n\n## Declaration\n\n```swift\nclass MPMediaQuery\n```\n\n## Overview\n\nFilter and grouping types are both optional; an unqualified query matches the entire library.\n\nA query has at most one grouping type. A query’s filter can consist of any number of media property predicates. You build filters using [doc:\/\/com.apple.mediaplayer\/documentation\/MediaPlayer\/MPMediaPropertyPredicate] objects, based on property keys described in [doc:\/\/com.apple.mediaplayer\/documentation\/MediaPlayer\/MPMediaItem].\n\nAfter creating and configuring a query, you use it to retrieve media items or media item collections. You can also use a query to retrieve an array of [doc:\/\/com.apple.mediaplayer\/documentation\/MediaPlayer\/MPMediaQuerySection] instances, useful for displaying the results of a query in the user interface of your app. See the [doc:\/\/com.apple.mediaplayer\/documentation\/MediaPlayer\/MPMediaQuery\/itemSections] and [doc:\/\/com.apple.mediaplayer\/documentation\/MediaPlayer\/MPMediaQuery\/collectionSections] properties.\n\nThis class includes several convenience constructors that each apply a grouping type and, in most cases, match a subset of the library. The following table summarizes the features of these constructors. See [doc:\/\/com.apple.mediaplayer\/documentation\/MediaPlayer\/MPMediaItem] for descriptions of the entries in the Filter column. See [doc:\/\/com.apple.mediaplayer\/documentation\/MediaPlayer\/MPMediaGrouping] for descriptions of the entries in the Grouping type column.\n\n\n\n## Creating media queries\n\n- **albums()**: Creates a media query that matches music items and that groups and sorts collections by album name.\n- **artists()**: Creates a media query that matches music items and that groups and sorts collections by artist name.\n- **songs()**: Creates a media query that matches music items and that groups and sorts collections by song name.\n- **playlists()**: Creates a media query that matches the entire library and that groups and sorts collections by playlist name.\n- **podcasts()**: Creates a media query that matches podcast items and that groups and sorts collections by podcast name.\n- **audiobooks()**: Creates a media query that matches audio book items and that groups and sorts collections by audio book name.\n- **compilations()**: Creates a media query that matches compilation items and that groups and sorts collections by album name.\n- **composers()**: Creates a media query that matches all media items and that groups and sorts collections by composer name.\n- **genres()**: Creates a media query that matches all media items and that groups and sorts collections by genre name.\n- **init(filterPredicates:)**: Initializes a media query with a set of media property predicates.\n\n## Configuring media queries\n\n- **filterPredicates**: The media property predicates of the media query.\n- **addFilterPredicate(_:)**: Adds a media property predicate to a query.\n- **removeFilterPredicate(_:)**: Removes a filter predicate from a query.\n- **groupingType**: The grouping for collections retrieved with the media query.\n- **itemSections**: An array representing the section grouping of the query’s specified media items.\n- **collectionSections**: An array representing the section grouping of the query’s specified media item collections.\n- **MPMediaGrouping**: Keys used to configure a media query.\n\n## Performing media queries\n\n- **items**: An array of media items that match the media query’s predicate.\n- **collections**: An array of media item collections whose contained items match the query’s media property predicate.\n\n## Media item queries\n\n- **Using filters to create specialized queries**: Add a filter set to a query before populating a music player queue.\n- **MPMediaQuerySection**: A range of media items or media item collections from within a media query.\n- **MPMediaPropertyPredicate**: A set of predicates for defining a filter in a media query.\n- **MPMediaPredicate**: An abstract class that defines classes for filtering media in a media query.\n\n## Inherits From\n\n- NSObject\n\n## Conforms To\n\n- CVarArg\n- CustomDebugStringConvertible\n- CustomStringConvertible\n- Equatable\n- Hashable\n- NSCoding\n- NSCopying\n- NSObjectProtocol\n- NSSecureCoding\n\n",
  "sections" : [
    {
      "content" : "",
      "items" : [
        {
          "description" : "Creates a media query that matches music items and that groups and sorts collections by album name.",
          "name" : "albums()",
          "url" : "https:\/\/developer.apple.com\/documentation\/MediaPlayer\/MPMediaQuery\/albums()"
        },
        {
          "description" : "Creates a media query that matches music items and that groups and sorts collections by artist name.",
          "name" : "artists()",
          "url" : "https:\/\/developer.apple.com\/documentation\/MediaPlayer\/MPMediaQuery\/artists()"
        },
        {
          "description" : "Creates a media query that matches music items and that groups and sorts collections by song name.",
          "name" : "songs()",
          "url" : "https:\/\/developer.apple.com\/documentation\/MediaPlayer\/MPMediaQuery\/songs()"
        },
        {
          "description" : "Creates a media query that matches the entire library and that groups and sorts collections by playlist name.",
          "name" : "playlists()",
          "url" : "https:\/\/developer.apple.com\/documentation\/MediaPlayer\/MPMediaQuery\/playlists()"
        },
        {
          "description" : "Creates a media query that matches podcast items and that groups and sorts collections by podcast name.",
          "name" : "podcasts()",
          "url" : "https:\/\/developer.apple.com\/documentation\/MediaPlayer\/MPMediaQuery\/podcasts()"
        },
        {
          "description" : "Creates a media query that matches audio book items and that groups and sorts collections by audio book name.",
          "name" : "audiobooks()",
          "url" : "https:\/\/developer.apple.com\/documentation\/MediaPlayer\/MPMediaQuery\/audiobooks()"
        },
        {
          "description" : "Creates a media query that matches compilation items and that groups and sorts collections by album name.",
          "name" : "compilations()",
          "url" : "https:\/\/developer.apple.com\/documentation\/MediaPlayer\/MPMediaQuery\/compilations()"
        },
        {
          "description" : "Creates a media query that matches all media items and that groups and sorts collections by composer name.",
          "name" : "composers()",
          "url" : "https:\/\/developer.apple.com\/documentation\/MediaPlayer\/MPMediaQuery\/composers()"
        },
        {
          "description" : "Creates a media query that matches all media items and that groups and sorts collections by genre name.",
          "name" : "genres()",
          "url" : "https:\/\/developer.apple.com\/documentation\/MediaPlayer\/MPMediaQuery\/genres()"
        },
        {
          "description" : "Initializes a media query with a set of media property predicates.",
          "name" : "init(filterPredicates:)",
          "url" : "https:\/\/developer.apple.com\/documentation\/MediaPlayer\/MPMediaQuery\/init(filterPredicates:)"
        }
      ],
      "title" : "Creating media queries"
    },
    {
      "content" : "",
      "items" : [
        {
          "description" : "The media property predicates of the media query.",
          "name" : "filterPredicates",
          "url" : "https:\/\/developer.apple.com\/documentation\/MediaPlayer\/MPMediaQuery\/filterPredicates"
        },
        {
          "description" : "Adds a media property predicate to a query.",
          "name" : "addFilterPredicate(_:)",
          "url" : "https:\/\/developer.apple.com\/documentation\/MediaPlayer\/MPMediaQuery\/addFilterPredicate(_:)"
        },
        {
          "description" : "Removes a filter predicate from a query.",
          "name" : "removeFilterPredicate(_:)",
          "url" : "https:\/\/developer.apple.com\/documentation\/MediaPlayer\/MPMediaQuery\/removeFilterPredicate(_:)"
        },
        {
          "description" : "The grouping for collections retrieved with the media query.",
          "name" : "groupingType",
          "url" : "https:\/\/developer.apple.com\/documentation\/MediaPlayer\/MPMediaQuery\/groupingType"
        },
        {
          "description" : "An array representing the section grouping of the query’s specified media items.",
          "name" : "itemSections",
          "url" : "https:\/\/developer.apple.com\/documentation\/MediaPlayer\/MPMediaQuery\/itemSections"
        },
        {
          "description" : "An array representing the section grouping of the query’s specified media item collections.",
          "name" : "collectionSections",
          "url" : "https:\/\/developer.apple.com\/documentation\/MediaPlayer\/MPMediaQuery\/collectionSections"
        },
        {
          "description" : "Keys used to configure a media query.",
          "name" : "MPMediaGrouping",
          "url" : "https:\/\/developer.apple.com\/documentation\/MediaPlayer\/MPMediaGrouping"
        }
      ],
      "title" : "Configuring media queries"
    },
    {
      "content" : "",
      "items" : [
        {
          "description" : "An array of media items that match the media query’s predicate.",
          "name" : "items",
          "url" : "https:\/\/developer.apple.com\/documentation\/MediaPlayer\/MPMediaQuery\/items"
        },
        {
          "description" : "An array of media item collections whose contained items match the query’s media property predicate.",
          "name" : "collections",
          "url" : "https:\/\/developer.apple.com\/documentation\/MediaPlayer\/MPMediaQuery\/collections"
        }
      ],
      "title" : "Performing media queries"
    },
    {
      "content" : "",
      "items" : [
        {
          "description" : "Add a filter set to a query before populating a music player queue.",
          "name" : "Using filters to create specialized queries",
          "url" : "https:\/\/developer.apple.com\/documentation\/MediaPlayer\/using-filters-to-create-specialized-queries"
        },
        {
          "description" : "A range of media items or media item collections from within a media query.",
          "name" : "MPMediaQuerySection",
          "url" : "https:\/\/developer.apple.com\/documentation\/MediaPlayer\/MPMediaQuerySection"
        },
        {
          "description" : "A set of predicates for defining a filter in a media query.",
          "name" : "MPMediaPropertyPredicate",
          "url" : "https:\/\/developer.apple.com\/documentation\/MediaPlayer\/MPMediaPropertyPredicate"
        },
        {
          "description" : "An abstract class that defines classes for filtering media in a media query.",
          "name" : "MPMediaPredicate",
          "url" : "https:\/\/developer.apple.com\/documentation\/MediaPlayer\/MPMediaPredicate"
        }
      ],
      "title" : "Media item queries"
    },
    {
      "content" : "",
      "items" : [
        {
          "name" : "NSObject"
        }
      ],
      "title" : "Inherits From"
    }
  ],
  "source" : "appleJSON",
  "title" : "MPMediaQuery",
  "url" : "https:\/\/developer.apple.com\/documentation\/MediaPlayer\/MPMediaQuery"
}