{
  "abstract" : "The playback type of the movie.",
  "codeExamples" : [

  ],
  "contentHash" : "df482478e9751cdd4d22faa5c49071098e5f3d8f4c2c2c709d9fa4f6d0d753e3",
  "crawledAt" : "2025-12-05T17:04:22Z",
  "declaration" : {
    "code" : "var movieSourceType: MPMovieSourceType { get set }",
    "language" : "swift"
  },
  "id" : "CB3E7B02-2D3B-4333-857A-239E4F78940B",
  "kind" : "property",
  "language" : "swift",
  "module" : "Media Player",
  "overview" : "## Discussion\n\nThe default value of this property is [doc:\/\/com.apple.mediaplayer\/documentation\/MediaPlayer\/MPMovieSourceType\/unknown]. This property provides a clue to the playback system as to how it should download and buffer the movie content. If you know the source type of the movie, setting the value of this property before playback begins can improve the load times for the movie content. If you do not set the source type explicitly before playback, the movie player controller must gather this information, which might delay playback.",
  "platforms" : [
    "iOS",
    "iPadOS",
    "Mac Catalyst"
  ],
  "rawMarkdown" : "---\nsource: https:\/\/developer.apple.com\/documentation\/MediaPlayer\/MPMoviePlayerController\/movieSourceType\ncrawled: 2025-12-05T17:04:22Z\n---\n\n# movieSourceType\n\n**Instance Property**\n\nThe playback type of the movie.\n\n## Declaration\n\n```swift\nvar movieSourceType: MPMovieSourceType { get set }\n```\n\n## Discussion\n\nThe default value of this property is [doc:\/\/com.apple.mediaplayer\/documentation\/MediaPlayer\/MPMovieSourceType\/unknown]. This property provides a clue to the playback system as to how it should download and buffer the movie content. If you know the source type of the movie, setting the value of this property before playback begins can improve the load times for the movie content. If you do not set the source type explicitly before playback, the movie player controller must gather this information, which might delay playback.\n\n## Accessing movie properties\n\n- **contentURL**: The URL that points to the movie file.\n- **movieMediaTypes**: The types of media available in the movie.\n- **allowsAirPlay**: Specifies whether the movie player allows AirPlay movie playback.\n- **isAirPlayVideoActive**: Indicates whether the movie player is currently playing video via AirPlay.\n- **naturalSize**: The width and height of the movie frame.\n- **isFullscreen**: A Boolean that indicates whether the movie player is in full-screen mode.\n- **setFullscreen(_:animated:)**: Causes the movie player to enter or exit full-screen mode.\n- **scalingMode**: The scaling mode to use when displaying the movie.\n- **controlStyle**: The style of the playback controls.\n- **useApplicationAudioSession**: A Boolean value that indicates whether the movie player should use the app’s audio session.\n\n",
  "sections" : [
    {
      "content" : "",
      "items" : [
        {
          "description" : "The URL that points to the movie file.",
          "name" : "contentURL",
          "url" : "https:\/\/developer.apple.com\/documentation\/MediaPlayer\/MPMoviePlayerController\/contentURL"
        },
        {
          "description" : "The types of media available in the movie.",
          "name" : "movieMediaTypes",
          "url" : "https:\/\/developer.apple.com\/documentation\/MediaPlayer\/MPMoviePlayerController\/movieMediaTypes"
        },
        {
          "description" : "Specifies whether the movie player allows AirPlay movie playback.",
          "name" : "allowsAirPlay",
          "url" : "https:\/\/developer.apple.com\/documentation\/MediaPlayer\/MPMoviePlayerController\/allowsAirPlay"
        },
        {
          "description" : "Indicates whether the movie player is currently playing video via AirPlay.",
          "name" : "isAirPlayVideoActive",
          "url" : "https:\/\/developer.apple.com\/documentation\/MediaPlayer\/MPMoviePlayerController\/isAirPlayVideoActive"
        },
        {
          "description" : "The width and height of the movie frame.",
          "name" : "naturalSize",
          "url" : "https:\/\/developer.apple.com\/documentation\/MediaPlayer\/MPMoviePlayerController\/naturalSize"
        },
        {
          "description" : "A Boolean that indicates whether the movie player is in full-screen mode.",
          "name" : "isFullscreen",
          "url" : "https:\/\/developer.apple.com\/documentation\/MediaPlayer\/MPMoviePlayerController\/isFullscreen"
        },
        {
          "description" : "Causes the movie player to enter or exit full-screen mode.",
          "name" : "setFullscreen(_:animated:)",
          "url" : "https:\/\/developer.apple.com\/documentation\/MediaPlayer\/MPMoviePlayerController\/setFullscreen(_:animated:)"
        },
        {
          "description" : "The scaling mode to use when displaying the movie.",
          "name" : "scalingMode",
          "url" : "https:\/\/developer.apple.com\/documentation\/MediaPlayer\/MPMoviePlayerController\/scalingMode"
        },
        {
          "description" : "The style of the playback controls.",
          "name" : "controlStyle",
          "url" : "https:\/\/developer.apple.com\/documentation\/MediaPlayer\/MPMoviePlayerController\/controlStyle"
        },
        {
          "description" : "A Boolean value that indicates whether the movie player should use the app’s audio session.",
          "name" : "useApplicationAudioSession",
          "url" : "https:\/\/developer.apple.com\/documentation\/MediaPlayer\/MPMoviePlayerController\/useApplicationAudioSession"
        }
      ],
      "title" : "Accessing movie properties"
    }
  ],
  "source" : "appleJSON",
  "title" : "movieSourceType",
  "url" : "https:\/\/developer.apple.com\/documentation\/MediaPlayer\/MPMoviePlayerController\/movieSourceType"
}