{
  "abstract" : "Creates a media query that matches music items and that groups and sorts collections by artist name.",
  "codeExamples" : [

  ],
  "contentHash" : "7a88dbaaf9de6f551cc5cd796e1cd19a7874837eeb27eb0a08572a70e24073d6",
  "crawledAt" : "2025-12-02T13:04:26Z",
  "declaration" : {
    "code" : "class func artists() -> MPMediaQuery",
    "language" : "swift"
  },
  "id" : "B2945A46-34BB-4C35-82C5-09CD1C8FBC94",
  "kind" : "method",
  "module" : "Media Player",
  "overview" : "## Return Value\n\nA media query that matches media items of type [doc:\/\/com.apple.mediaplayer\/documentation\/MediaPlayer\/MPMediaType\/music] and has a grouping type of [doc:\/\/com.apple.mediaplayer\/documentation\/MediaPlayer\/MPMediaGrouping\/artist].\n\n## Discussion\n\nA media item can have more than one media type; for example, an item could be of types “music” and “podcast.” An [doc:\/\/com.apple.mediaplayer\/documentation\/MediaPlayer\/MPMediaQuery\/artists()] query matches all [doc:\/\/com.apple.mediaplayer\/documentation\/MediaPlayer\/MPMediaType\/music] items, whether or not they’re also of other media types.",
  "platforms" : [
    "iOS",
    "iPadOS",
    "Mac Catalyst",
    "visionOS"
  ],
  "rawMarkdown" : "---\nsource: https:\/\/developer.apple.com\/documentation\/MediaPlayer\/MPMediaQuery\/artists()\ncrawled: 2025-12-02T13:04:26Z\n---\n\n# artists()\n\n**Type Method**\n\nCreates a media query that matches music items and that groups and sorts collections by artist name.\n\n## Declaration\n\n```swift\nclass func artists() -> MPMediaQuery\n```\n\n## Return Value\n\nA media query that matches media items of type [doc:\/\/com.apple.mediaplayer\/documentation\/MediaPlayer\/MPMediaType\/music] and has a grouping type of [doc:\/\/com.apple.mediaplayer\/documentation\/MediaPlayer\/MPMediaGrouping\/artist].\n\n## Discussion\n\nA media item can have more than one media type; for example, an item could be of types “music” and “podcast.” An [doc:\/\/com.apple.mediaplayer\/documentation\/MediaPlayer\/MPMediaQuery\/artists()] query matches all [doc:\/\/com.apple.mediaplayer\/documentation\/MediaPlayer\/MPMediaType\/music] items, whether or not they’re also of other media types.\n\n## Creating media queries\n\n- **albums()**: Creates a media query that matches music items and that groups and sorts collections by album name.\n- **songs()**: Creates a media query that matches music items and that groups and sorts collections by song name.\n- **playlists()**: Creates a media query that matches the entire library and that groups and sorts collections by playlist name.\n- **podcasts()**: Creates a media query that matches podcast items and that groups and sorts collections by podcast name.\n- **audiobooks()**: Creates a media query that matches audio book items and that groups and sorts collections by audio book name.\n- **compilations()**: Creates a media query that matches compilation items and that groups and sorts collections by album name.\n- **composers()**: Creates a media query that matches all media items and that groups and sorts collections by composer name.\n- **genres()**: Creates a media query that matches all media items and that groups and sorts collections by genre name.\n- **init(filterPredicates:)**: Initializes a media query with a set of media property predicates.\n\n",
  "sections" : [
    {
      "content" : "",
      "items" : [
        {
          "description" : "Creates a media query that matches music items and that groups and sorts collections by album name.",
          "name" : "albums()",
          "url" : "https:\/\/developer.apple.com\/documentation\/MediaPlayer\/MPMediaQuery\/albums()"
        },
        {
          "description" : "Creates a media query that matches music items and that groups and sorts collections by song name.",
          "name" : "songs()",
          "url" : "https:\/\/developer.apple.com\/documentation\/MediaPlayer\/MPMediaQuery\/songs()"
        },
        {
          "description" : "Creates a media query that matches the entire library and that groups and sorts collections by playlist name.",
          "name" : "playlists()",
          "url" : "https:\/\/developer.apple.com\/documentation\/MediaPlayer\/MPMediaQuery\/playlists()"
        },
        {
          "description" : "Creates a media query that matches podcast items and that groups and sorts collections by podcast name.",
          "name" : "podcasts()",
          "url" : "https:\/\/developer.apple.com\/documentation\/MediaPlayer\/MPMediaQuery\/podcasts()"
        },
        {
          "description" : "Creates a media query that matches audio book items and that groups and sorts collections by audio book name.",
          "name" : "audiobooks()",
          "url" : "https:\/\/developer.apple.com\/documentation\/MediaPlayer\/MPMediaQuery\/audiobooks()"
        },
        {
          "description" : "Creates a media query that matches compilation items and that groups and sorts collections by album name.",
          "name" : "compilations()",
          "url" : "https:\/\/developer.apple.com\/documentation\/MediaPlayer\/MPMediaQuery\/compilations()"
        },
        {
          "description" : "Creates a media query that matches all media items and that groups and sorts collections by composer name.",
          "name" : "composers()",
          "url" : "https:\/\/developer.apple.com\/documentation\/MediaPlayer\/MPMediaQuery\/composers()"
        },
        {
          "description" : "Creates a media query that matches all media items and that groups and sorts collections by genre name.",
          "name" : "genres()",
          "url" : "https:\/\/developer.apple.com\/documentation\/MediaPlayer\/MPMediaQuery\/genres()"
        },
        {
          "description" : "Initializes a media query with a set of media property predicates.",
          "name" : "init(filterPredicates:)",
          "url" : "https:\/\/developer.apple.com\/documentation\/MediaPlayer\/MPMediaQuery\/init(filterPredicates:)"
        }
      ],
      "title" : "Creating media queries"
    }
  ],
  "source" : "appleJSON",
  "title" : "artists()",
  "url" : "https:\/\/developer.apple.com\/documentation\/MediaPlayer\/MPMediaQuery\/artists()"
}