{
  "abstract" : "The current playback position, in seconds.",
  "codeExamples" : [

  ],
  "contentHash" : "a52fbe0541219f182bc0e79c124f2dbe99cca460baac4b214c496d75cfd284fd",
  "crawledAt" : "2025-12-01T09:28:51Z",
  "declaration" : {
    "code" : "var currentPositionInSeconds: TimeInterval { get set }",
    "language" : "swift"
  },
  "id" : "7CD029D0-017D-4D05-8A83-4B097936AA56",
  "kind" : "property",
  "module" : "AVFAudio",
  "overview" : "## Discussion\n\nThis property positions the sequencer’s player to the specified time. You can update this property while the player is in a playing state, in which case, playback resumes at the new position.",
  "platforms" : [
    "iOS",
    "iPadOS",
    "Mac Catalyst",
    "macOS",
    "tvOS",
    "visionOS"
  ],
  "rawMarkdown" : "---\nsource: https:\/\/developer.apple.com\/documentation\/AVFAudio\/AVAudioSequencer\/currentPositionInSeconds\ncrawled: 2025-12-01T09:28:51Z\n---\n\n# currentPositionInSeconds\n\n**Instance Property**\n\nThe current playback position, in seconds.\n\n## Declaration\n\n```swift\nvar currentPositionInSeconds: TimeInterval { get set }\n```\n\n## Discussion\n\nThis property positions the sequencer’s player to the specified time. You can update this property while the player is in a playing state, in which case, playback resumes at the new position.\n\n## Getting Sequence Properties\n\n- **isPlaying**: A Boolean value that indicates whether the sequencer’s player is in a playing state.\n- **rate**: The playback rate of the sequencer’s player.\n- **tracks**: An array that contains all the tracks in the sequence.\n- **currentPositionInBeats**: The current playback position, in beats.\n- **tempoTrack**: The track that contains tempo information about the sequence.\n- **userInfo**: A dictionary that contains metadata from a sequence.\n- **AVAudioSequencer.InfoDictionaryKey**: Constants that defines metadata keys for a sequencer.\n- **data(withSMPTEResolution:error:)**: Gets a data object that contains the events from the sequence.\n- **AVMusicTimeStampEndOfTrack**: A timestamp you use to access all events in a music track through a beat range.\n\n",
  "sections" : [
    {
      "content" : "",
      "items" : [
        {
          "description" : "A Boolean value that indicates whether the sequencer’s player is in a playing state.",
          "name" : "isPlaying",
          "url" : "https:\/\/developer.apple.com\/documentation\/AVFAudio\/AVAudioSequencer\/isPlaying"
        },
        {
          "description" : "The playback rate of the sequencer’s player.",
          "name" : "rate",
          "url" : "https:\/\/developer.apple.com\/documentation\/AVFAudio\/AVAudioSequencer\/rate"
        },
        {
          "description" : "An array that contains all the tracks in the sequence.",
          "name" : "tracks",
          "url" : "https:\/\/developer.apple.com\/documentation\/AVFAudio\/AVAudioSequencer\/tracks"
        },
        {
          "description" : "The current playback position, in beats.",
          "name" : "currentPositionInBeats",
          "url" : "https:\/\/developer.apple.com\/documentation\/AVFAudio\/AVAudioSequencer\/currentPositionInBeats"
        },
        {
          "description" : "The track that contains tempo information about the sequence.",
          "name" : "tempoTrack",
          "url" : "https:\/\/developer.apple.com\/documentation\/AVFAudio\/AVAudioSequencer\/tempoTrack"
        },
        {
          "description" : "A dictionary that contains metadata from a sequence.",
          "name" : "userInfo",
          "url" : "https:\/\/developer.apple.com\/documentation\/AVFAudio\/AVAudioSequencer\/userInfo"
        },
        {
          "description" : "Constants that defines metadata keys for a sequencer.",
          "name" : "AVAudioSequencer.InfoDictionaryKey",
          "url" : "https:\/\/developer.apple.com\/documentation\/AVFAudio\/AVAudioSequencer\/InfoDictionaryKey"
        },
        {
          "description" : "Gets a data object that contains the events from the sequence.",
          "name" : "data(withSMPTEResolution:error:)",
          "url" : "https:\/\/developer.apple.com\/documentation\/AVFAudio\/AVAudioSequencer\/data(withSMPTEResolution:error:)"
        },
        {
          "description" : "A timestamp you use to access all events in a music track through a beat range.",
          "name" : "AVMusicTimeStampEndOfTrack",
          "url" : "https:\/\/developer.apple.com\/documentation\/AVFAudio\/AVMusicTimeStampEndOfTrack"
        }
      ],
      "title" : "Getting Sequence Properties"
    }
  ],
  "source" : "appleJSON",
  "title" : "currentPositionInSeconds",
  "url" : "https:\/\/developer.apple.com\/documentation\/AVFAudio\/AVAudioSequencer\/currentPositionInSeconds"
}