{
  "abstract" : "An object that implements a reverb effect.",
  "codeExamples" : [

  ],
  "conformsTo" : [
    "CVarArg",
    "CustomDebugStringConvertible",
    "CustomStringConvertible",
    "Equatable",
    "Hashable",
    "NSObjectProtocol"
  ],
  "contentHash" : "75e701d2fab01fae735ad9100a02a2c3888371870d4bce610dd856cd6965e8dc",
  "crawledAt" : "2025-12-02T18:39:32Z",
  "declaration" : {
    "code" : "class AVAudioUnitReverb",
    "language" : "swift"
  },
  "id" : "433A5501-BE66-4691-8F4C-963C02809C6F",
  "kind" : "class",
  "language" : "swift",
  "module" : "AVFAudio",
  "overview" : "## Overview\n\nA reverb simulates the acoustic characteristics of a particular environment. Use the different presets to simulate a particular space and blend it in with the original signal using the [doc:\/\/com.apple.avfaudio\/documentation\/AVFAudio\/AVAudioUnitReverb\/wetDryMix] property.",
  "platforms" : [
    "iOS",
    "iPadOS",
    "Mac Catalyst",
    "macOS",
    "tvOS",
    "visionOS"
  ],
  "rawMarkdown" : "---\nsource: https:\/\/developer.apple.com\/documentation\/AVFAudio\/AVAudioUnitReverb\ncrawled: 2025-12-02T18:39:32Z\n---\n\n# AVAudioUnitReverb\n\n**Class**\n\nAn object that implements a reverb effect.\n\n## Declaration\n\n```swift\nclass AVAudioUnitReverb\n```\n\n## Overview\n\nA reverb simulates the acoustic characteristics of a particular environment. Use the different presets to simulate a particular space and blend it in with the original signal using the [doc:\/\/com.apple.avfaudio\/documentation\/AVFAudio\/AVAudioUnitReverb\/wetDryMix] property.\n\n## Configure the reverb\n\n- **loadFactoryPreset(_:)**: Configures the audio unit as a reverb preset.\n- **AVAudioUnitReverbPreset**: Constants that represent preset reverbs.\n\n## Getting and setting the reverb values\n\n- **wetDryMix**: The blend of the wet and dry signals.\n\n## Audio effects\n\n- **AVAudioUnitEffect**: An object that processes audio in real time.\n- **AVAudioUnitEQ**: An object that implements a multiband equalizer.\n- **AVAudioUnitDistortion**: An object that implements a multistage distortion effect.\n- **AVAudioUnitDelay**: An object that implements a delay effect.\n\n## Inherits From\n\n- AVAudioUnitEffect\n\n## Conforms To\n\n- CVarArg\n- CustomDebugStringConvertible\n- CustomStringConvertible\n- Equatable\n- Hashable\n- NSObjectProtocol\n\n",
  "sections" : [
    {
      "content" : "",
      "items" : [
        {
          "description" : "Configures the audio unit as a reverb preset.",
          "name" : "loadFactoryPreset(_:)",
          "url" : "https:\/\/developer.apple.com\/documentation\/AVFAudio\/AVAudioUnitReverb\/loadFactoryPreset(_:)"
        },
        {
          "description" : "Constants that represent preset reverbs.",
          "name" : "AVAudioUnitReverbPreset",
          "url" : "https:\/\/developer.apple.com\/documentation\/AVFAudio\/AVAudioUnitReverbPreset"
        }
      ],
      "title" : "Configure the reverb"
    },
    {
      "content" : "",
      "items" : [
        {
          "description" : "The blend of the wet and dry signals.",
          "name" : "wetDryMix",
          "url" : "https:\/\/developer.apple.com\/documentation\/AVFAudio\/AVAudioUnitReverb\/wetDryMix"
        }
      ],
      "title" : "Getting and setting the reverb values"
    },
    {
      "content" : "",
      "items" : [
        {
          "description" : "An object that processes audio in real time.",
          "name" : "AVAudioUnitEffect",
          "url" : "https:\/\/developer.apple.com\/documentation\/AVFAudio\/AVAudioUnitEffect"
        },
        {
          "description" : "An object that implements a multiband equalizer.",
          "name" : "AVAudioUnitEQ",
          "url" : "https:\/\/developer.apple.com\/documentation\/AVFAudio\/AVAudioUnitEQ"
        },
        {
          "description" : "An object that implements a multistage distortion effect.",
          "name" : "AVAudioUnitDistortion",
          "url" : "https:\/\/developer.apple.com\/documentation\/AVFAudio\/AVAudioUnitDistortion"
        },
        {
          "description" : "An object that implements a delay effect.",
          "name" : "AVAudioUnitDelay",
          "url" : "https:\/\/developer.apple.com\/documentation\/AVFAudio\/AVAudioUnitDelay"
        }
      ],
      "title" : "Audio effects"
    },
    {
      "content" : "",
      "items" : [
        {
          "name" : "AVAudioUnitEffect"
        }
      ],
      "title" : "Inherits From"
    }
  ],
  "source" : "appleJSON",
  "title" : "AVAudioUnitReverb",
  "url" : "https:\/\/developer.apple.com\/documentation\/AVFAudio\/AVAudioUnitReverb"
}