{
  "abstract" : "An object that generates audio output.",
  "codeExamples" : [

  ],
  "conformsTo" : [
    "AVAudio3DMixing",
    "AVAudioMixing",
    "AVAudioStereoMixing",
    "CVarArg",
    "CustomDebugStringConvertible",
    "CustomStringConvertible",
    "Equatable",
    "Hashable",
    "NSObjectProtocol"
  ],
  "contentHash" : "449b55b968aca17621fc13c4e9be7c11b3ab0f702d1859bab208815035443c28",
  "crawledAt" : "2025-12-02T18:58:14Z",
  "declaration" : {
    "code" : "class AVAudioUnitGenerator",
    "language" : "swift"
  },
  "id" : "3C9BE8EC-8421-4470-82A7-A2F65CC2AD49",
  "kind" : "class",
  "language" : "swift",
  "module" : "AVFAudio",
  "overview" : "## Overview\n\nA generator represents an [doc:\/\/com.apple.documentation\/documentation\/AudioToolbox\/AudioUnit] of type `kAudioUnitType_Generator` or `kAudioUnitType_RemoteGenerator`. A generator has no audio input, but produces audio output. An example is a tone generator.",
  "platforms" : [
    "iOS",
    "iPadOS",
    "Mac Catalyst",
    "macOS",
    "tvOS",
    "visionOS"
  ],
  "rawMarkdown" : "---\nsource: https:\/\/developer.apple.com\/documentation\/AVFAudio\/AVAudioUnitGenerator\ncrawled: 2025-12-02T18:58:14Z\n---\n\n# AVAudioUnitGenerator\n\n**Class**\n\nAn object that generates audio output.\n\n## Declaration\n\n```swift\nclass AVAudioUnitGenerator\n```\n\n## Overview\n\nA generator represents an [doc:\/\/com.apple.documentation\/documentation\/AudioToolbox\/AudioUnit] of type `kAudioUnitType_Generator` or `kAudioUnitType_RemoteGenerator`. A generator has no audio input, but produces audio output. An example is a tone generator.\n\n## Creating an audio unit generator\n\n- **init(audioComponentDescription:)**: Creates a generator audio unit with the specified description.\n\n## Getting and setting the bypass status\n\n- **bypass**: The bypass state of the audio unit.\n\n## Inherits From\n\n- AVAudioUnit\n\n## Conforms To\n\n- AVAudio3DMixing\n- AVAudioMixing\n- AVAudioStereoMixing\n- CVarArg\n- CustomDebugStringConvertible\n- CustomStringConvertible\n- Equatable\n- Hashable\n- NSObjectProtocol\n\n",
  "sections" : [
    {
      "content" : "",
      "items" : [
        {
          "description" : "Creates a generator audio unit with the specified description.",
          "name" : "init(audioComponentDescription:)",
          "url" : "https:\/\/developer.apple.com\/documentation\/AVFAudio\/AVAudioUnitGenerator\/init(audioComponentDescription:)"
        }
      ],
      "title" : "Creating an audio unit generator"
    },
    {
      "content" : "",
      "items" : [
        {
          "description" : "The bypass state of the audio unit.",
          "name" : "bypass",
          "url" : "https:\/\/developer.apple.com\/documentation\/AVFAudio\/AVAudioUnitGenerator\/bypass"
        }
      ],
      "title" : "Getting and setting the bypass status"
    },
    {
      "content" : "",
      "items" : [
        {
          "name" : "AVAudioUnit"
        }
      ],
      "title" : "Inherits From"
    }
  ],
  "source" : "appleJSON",
  "title" : "AVAudioUnitGenerator",
  "url" : "https:\/\/developer.apple.com\/documentation\/AVFAudio\/AVAudioUnitGenerator"
}