{
  "abstract" : "An option that determines whether you can stream audio from this session to AirPlay devices.",
  "codeExamples" : [

  ],
  "contentHash" : "6290aa55e12f581ccd6957038259f9d1c1705a75d75bc5a2371db98424b13c5c",
  "crawledAt" : "2025-12-01T15:01:55Z",
  "declaration" : {
    "code" : "static var allowAirPlay: AVAudioSession.CategoryOptions { get }",
    "language" : "swift"
  },
  "id" : "0E63FE52-16E2-47ED-8A03-543C23167A20",
  "kind" : "property",
  "module" : "AVFAudio",
  "overview" : "## Discussion\n\nSetting this option enables the audio session to route audio output to AirPlay devices. You can only explicitly set this option if the audio session’s category is set to [doc:\/\/com.apple.avfaudio\/documentation\/AVFAudio\/AVAudioSession\/Category-swift.struct\/playAndRecord]. For most other audio session categories, the system sets this option implicitly.\n\nAudio sessions using the [doc:\/\/com.apple.avfaudio\/documentation\/AVFAudio\/AVAudioSession\/Category-swift.struct\/multiRoute] or [doc:\/\/com.apple.avfaudio\/documentation\/AVFAudio\/AVAudioSession\/Category-swift.struct\/record] categories implicitly clear this option.",
  "platforms" : [
    "iOS",
    "iPadOS",
    "Mac Catalyst",
    "tvOS",
    "visionOS"
  ],
  "rawMarkdown" : "---\nsource: https:\/\/developer.apple.com\/documentation\/AVFAudio\/AVAudioSession\/CategoryOptions-swift.struct\/allowAirPlay\ncrawled: 2025-12-01T15:01:55Z\n---\n\n# allowAirPlay\n\n**Type Property**\n\nAn option that determines whether you can stream audio from this session to AirPlay devices.\n\n## Declaration\n\n```swift\nstatic var allowAirPlay: AVAudioSession.CategoryOptions { get }\n```\n\n## Discussion\n\nSetting this option enables the audio session to route audio output to AirPlay devices. You can only explicitly set this option if the audio session’s category is set to [doc:\/\/com.apple.avfaudio\/documentation\/AVFAudio\/AVAudioSession\/Category-swift.struct\/playAndRecord]. For most other audio session categories, the system sets this option implicitly.\n\nAudio sessions using the [doc:\/\/com.apple.avfaudio\/documentation\/AVFAudio\/AVAudioSession\/Category-swift.struct\/multiRoute] or [doc:\/\/com.apple.avfaudio\/documentation\/AVFAudio\/AVAudioSession\/Category-swift.struct\/record] categories implicitly clear this option.\n\n## Category options\n\n- **allowBluetooth**: An option that determines whether Bluetooth hands-free devices appear as available input routes.\n- **allowBluetoothA2DP**: An option that determines whether you can stream audio from this session to Bluetooth devices that support the Advanced Audio Distribution Profile (A2DP).\n- **allowBluetoothHFP**: An option that makes Bluetooth Hands-Free Profile (HFP) devices available for audio input.\n- **bluetoothHighQualityRecording**: An option that indicates to enable high-quality audio for input and output routes.\n- **defaultToSpeaker**: An option that determines whether audio from the session defaults to the built-in speaker instead of the receiver.\n- **duckOthers**: An option that reduces the volume of other audio sessions while audio from this session plays.\n- **farFieldInput**: This option should be used if a session prefers to use FarFieldInput when available. This option is only valid with categories that support input - [doc:\/\/com.apple.avfaudio\/documentation\/AVFAudio\/AVAudioSession\/Category-swift.struct\/playAndRecord] and [doc:\/\/com.apple.avfaudio\/documentation\/AVFAudio\/AVAudioSession\/Category-swift.struct\/record].\n- **interruptSpokenAudioAndMixWithOthers**: An option that determines whether to pause spoken audio content from other sessions when your app plays its audio.\n- **mixWithOthers**: An option that indicates whether audio from this session mixes with audio from active sessions in other audio apps.\n- **overrideMutedMicrophoneInterruption**: An option that indicates whether the system interrupts the audio session when it mutes the built-in microphone.\n\n",
  "sections" : [
    {
      "content" : "",
      "items" : [
        {
          "description" : "An option that determines whether Bluetooth hands-free devices appear as available input routes.",
          "name" : "allowBluetooth",
          "url" : "https:\/\/developer.apple.com\/documentation\/AVFAudio\/AVAudioSession\/CategoryOptions-swift.struct\/allowBluetooth"
        },
        {
          "description" : "An option that determines whether you can stream audio from this session to Bluetooth devices that support the Advanced Audio Distribution Profile (A2DP).",
          "name" : "allowBluetoothA2DP",
          "url" : "https:\/\/developer.apple.com\/documentation\/AVFAudio\/AVAudioSession\/CategoryOptions-swift.struct\/allowBluetoothA2DP"
        },
        {
          "description" : "An option that makes Bluetooth Hands-Free Profile (HFP) devices available for audio input.",
          "name" : "allowBluetoothHFP",
          "url" : "https:\/\/developer.apple.com\/documentation\/AVFAudio\/AVAudioSession\/CategoryOptions-swift.struct\/allowBluetoothHFP"
        },
        {
          "description" : "An option that indicates to enable high-quality audio for input and output routes.",
          "name" : "bluetoothHighQualityRecording",
          "url" : "https:\/\/developer.apple.com\/documentation\/AVFAudio\/AVAudioSession\/CategoryOptions-swift.struct\/bluetoothHighQualityRecording"
        },
        {
          "description" : "An option that determines whether audio from the session defaults to the built-in speaker instead of the receiver.",
          "name" : "defaultToSpeaker",
          "url" : "https:\/\/developer.apple.com\/documentation\/AVFAudio\/AVAudioSession\/CategoryOptions-swift.struct\/defaultToSpeaker"
        },
        {
          "description" : "An option that reduces the volume of other audio sessions while audio from this session plays.",
          "name" : "duckOthers",
          "url" : "https:\/\/developer.apple.com\/documentation\/AVFAudio\/AVAudioSession\/CategoryOptions-swift.struct\/duckOthers"
        },
        {
          "description" : "This option should be used if a session prefers to use FarFieldInput when available. This option is only valid with categories that support input - [doc:\/\/com.apple.avfaudio\/documentation\/AVFAudio\/AVAudioSession\/Category-swift.struct\/playAndRecord] and [doc:\/\/com.apple.avfaudio\/documentation\/AVFAudio\/AVAudioSession\/Category-swift.struct\/record].",
          "name" : "farFieldInput",
          "url" : "https:\/\/developer.apple.com\/documentation\/AVFAudio\/AVAudioSession\/CategoryOptions-swift.struct\/farFieldInput"
        },
        {
          "description" : "An option that determines whether to pause spoken audio content from other sessions when your app plays its audio.",
          "name" : "interruptSpokenAudioAndMixWithOthers",
          "url" : "https:\/\/developer.apple.com\/documentation\/AVFAudio\/AVAudioSession\/CategoryOptions-swift.struct\/interruptSpokenAudioAndMixWithOthers"
        },
        {
          "description" : "An option that indicates whether audio from this session mixes with audio from active sessions in other audio apps.",
          "name" : "mixWithOthers",
          "url" : "https:\/\/developer.apple.com\/documentation\/AVFAudio\/AVAudioSession\/CategoryOptions-swift.struct\/mixWithOthers"
        },
        {
          "description" : "An option that indicates whether the system interrupts the audio session when it mutes the built-in microphone.",
          "name" : "overrideMutedMicrophoneInterruption",
          "url" : "https:\/\/developer.apple.com\/documentation\/AVFAudio\/AVAudioSession\/CategoryOptions-swift.struct\/overrideMutedMicrophoneInterruption"
        }
      ],
      "title" : "Category options"
    }
  ],
  "source" : "appleJSON",
  "title" : "allowAirPlay",
  "url" : "https:\/\/developer.apple.com\/documentation\/AVFAudio\/AVAudioSession\/CategoryOptions-swift.struct\/allowAirPlay"
}