{
  "abstract" : "A Boolean value that indicates whether the audio session is a candidate to be the Now Playing session.",
  "codeExamples" : [

  ],
  "contentHash" : "9226f73d8c88eec831ef4c064bc4e54f71f6feb1cfd83146ffcb1a270564e0a3",
  "crawledAt" : "2025-12-02T18:54:22Z",
  "declaration" : {
    "code" : "var isNowPlayingCandidate: Bool { get }",
    "language" : "swift"
  },
  "id" : "C0AD0C52-E467-4557-AE11-F32C08A339D6",
  "kind" : "property",
  "language" : "swift",
  "module" : "AVFAudio",
  "overview" : "## Discussion\n\nOnly a single audio session for an app can be a Now Playing candidate. Designating multiple audio sessions for the same app as Now Playing candidates results in none of them being eligible.",
  "platforms" : [
    "visionOS"
  ],
  "rawMarkdown" : "---\nsource: https:\/\/developer.apple.com\/documentation\/AVFAudio\/AVAudioSession\/isNowPlayingCandidate\ncrawled: 2025-12-02T18:54:22Z\n---\n\n# isNowPlayingCandidate\n\n**Instance Property**\n\nA Boolean value that indicates whether the audio session is a candidate to be the Now Playing session.\n\n## Declaration\n\n```swift\nvar isNowPlayingCandidate: Bool { get }\n```\n\n## Discussion\n\nOnly a single audio session for an app can be a Now Playing candidate. Designating multiple audio sessions for the same app as Now Playing candidates results in none of them being eligible.\n\n## Configuring the spatial experience in visionOS\n\n- **intendedSpatialExperience**: The spatial audio experience your app intends to provide the user.\n- **setIntendedSpatialExperience(_:)**: Sets the spatial audio experience your app intends to provide the user.\n- **AVAudioSessionSpatialExperience**\n- **setIsNowPlayingCandidate(_:)**: Sets a Boolean value that indicates whether the audio session is a candidate to be the Now Playing session.\n\n",
  "sections" : [
    {
      "content" : "",
      "items" : [
        {
          "description" : "The spatial audio experience your app intends to provide the user.",
          "name" : "intendedSpatialExperience",
          "url" : "https:\/\/developer.apple.com\/documentation\/AVFAudio\/AVAudioSession\/intendedSpatialExperience-1bpnq"
        },
        {
          "description" : "Sets the spatial audio experience your app intends to provide the user.",
          "name" : "setIntendedSpatialExperience(_:)",
          "url" : "https:\/\/developer.apple.com\/documentation\/AVFAudio\/AVAudioSession\/setIntendedSpatialExperience(_:)"
        },
        {
          "description" : "",
          "name" : "AVAudioSessionSpatialExperience",
          "url" : "https:\/\/developer.apple.com\/documentation\/AVFAudio\/AVAudioSessionSpatialExperience-swift.protocol"
        },
        {
          "description" : "Sets a Boolean value that indicates whether the audio session is a candidate to be the Now Playing session.",
          "name" : "setIsNowPlayingCandidate(_:)",
          "url" : "https:\/\/developer.apple.com\/documentation\/AVFAudio\/AVAudioSession\/setIsNowPlayingCandidate(_:)"
        }
      ],
      "title" : "Configuring the spatial experience in visionOS"
    }
  ],
  "source" : "appleJSON",
  "title" : "isNowPlayingCandidate",
  "url" : "https:\/\/developer.apple.com\/documentation\/AVFAudio\/AVAudioSession\/isNowPlayingCandidate"
}