{
  "abstract" : "An object that generates speech from text.",
  "codeExamples" : [

  ],
  "conformsTo" : [
    "CVarArg",
    "CustomDebugStringConvertible",
    "CustomStringConvertible",
    "Equatable",
    "Hashable",
    "NSObjectProtocol"
  ],
  "contentHash" : "9b59e58d3068d3f6807738334247e2e165ba732ddf524d14304619f5517fb569",
  "crawledAt" : "2025-12-02T16:09:05Z",
  "declaration" : {
    "code" : "class AVSpeechSynthesisProviderAudioUnit",
    "language" : "swift"
  },
  "id" : "1E35D498-22F2-4B53-A55A-17BB1733EE1D",
  "kind" : "class",
  "language" : "swift",
  "module" : "AVFAudio",
  "overview" : "## Overview\n\nUse a speech synthesizer audio unit to generate audio buffers that contain speech for a given voice and speech markup. The audio unit receives an [doc:\/\/com.apple.avfaudio\/documentation\/AVFAudio\/AVSpeechSynthesisProviderRequest] as input, and extracts audio buffers through the render block.\n\nUse [doc:\/\/com.apple.avfaudio\/documentation\/AVFAudio\/AVSpeechSynthesisProviderAudioUnit\/speechSynthesisOutputMetadataBlock] to provide metadata as an array of [doc:\/\/com.apple.avfaudio\/documentation\/AVFAudio\/AVSpeechSynthesisMarker].\n\nThe system scans and loads voices for audio unit extensions of this type, and the voices it provides are available for use in [doc:\/\/com.apple.avfaudio\/documentation\/AVFAudio\/AVSpeechSynthesizer] and accessibility technologies like VoiceOver and Speak Screen.",
  "platforms" : [
    "iOS",
    "iPadOS",
    "Mac Catalyst",
    "macOS",
    "tvOS",
    "visionOS"
  ],
  "rawMarkdown" : "---\nsource: https:\/\/developer.apple.com\/documentation\/AVFAudio\/AVSpeechSynthesisProviderAudioUnit\ncrawled: 2025-12-02T16:09:05Z\n---\n\n# AVSpeechSynthesisProviderAudioUnit\n\n**Class**\n\nAn object that generates speech from text.\n\n## Declaration\n\n```swift\nclass AVSpeechSynthesisProviderAudioUnit\n```\n\n## Overview\n\nUse a speech synthesizer audio unit to generate audio buffers that contain speech for a given voice and speech markup. The audio unit receives an [doc:\/\/com.apple.avfaudio\/documentation\/AVFAudio\/AVSpeechSynthesisProviderRequest] as input, and extracts audio buffers through the render block.\n\nUse [doc:\/\/com.apple.avfaudio\/documentation\/AVFAudio\/AVSpeechSynthesisProviderAudioUnit\/speechSynthesisOutputMetadataBlock] to provide metadata as an array of [doc:\/\/com.apple.avfaudio\/documentation\/AVFAudio\/AVSpeechSynthesisMarker].\n\nThe system scans and loads voices for audio unit extensions of this type, and the voices it provides are available for use in [doc:\/\/com.apple.avfaudio\/documentation\/AVFAudio\/AVSpeechSynthesizer] and accessibility technologies like VoiceOver and Speak Screen.\n\n\n\n## Rendering speech\n\n- **synthesizeSpeechRequest(_:)**: Sets the text to synthesize and the voice to use.\n- **AVSpeechSynthesisProviderRequest**: An object that represents the text to synthesize and the voice to use.\n\n## Supplying metadata\n\n- **AVSpeechSynthesisProviderOutputBlock**: A type that represents the method for sending marker information to the host.\n- **speechSynthesisOutputMetadataBlock**: A block that subclasses use to send marker information to the host.\n- **AVSpeechSynthesisMarker**: An object that contains information about the synthesized audio.\n\n## Getting and setting voices\n\n- **speechVoices**: A list of voices the audio unit provides to the system.\n- **AVSpeechSynthesisProviderVoice**: An object that represents a voice that an audio unit provides to its host.\n\n## Cancelling a request\n\n- **cancelSpeechRequest()**: Informs the audio unit to discard the speech request.\n\n## Inherits From\n\n- AUAudioUnit\n\n## Conforms To\n\n- CVarArg\n- CustomDebugStringConvertible\n- CustomStringConvertible\n- Equatable\n- Hashable\n- NSObjectProtocol\n\n",
  "sections" : [
    {
      "content" : "",
      "items" : [
        {
          "description" : "Sets the text to synthesize and the voice to use.",
          "name" : "synthesizeSpeechRequest(_:)",
          "url" : "https:\/\/developer.apple.com\/documentation\/AVFAudio\/AVSpeechSynthesisProviderAudioUnit\/synthesizeSpeechRequest(_:)"
        },
        {
          "description" : "An object that represents the text to synthesize and the voice to use.",
          "name" : "AVSpeechSynthesisProviderRequest",
          "url" : "https:\/\/developer.apple.com\/documentation\/AVFAudio\/AVSpeechSynthesisProviderRequest"
        }
      ],
      "title" : "Rendering speech"
    },
    {
      "content" : "",
      "items" : [
        {
          "description" : "A type that represents the method for sending marker information to the host.",
          "name" : "AVSpeechSynthesisProviderOutputBlock",
          "url" : "https:\/\/developer.apple.com\/documentation\/AVFAudio\/AVSpeechSynthesisProviderOutputBlock"
        },
        {
          "description" : "A block that subclasses use to send marker information to the host.",
          "name" : "speechSynthesisOutputMetadataBlock",
          "url" : "https:\/\/developer.apple.com\/documentation\/AVFAudio\/AVSpeechSynthesisProviderAudioUnit\/speechSynthesisOutputMetadataBlock"
        },
        {
          "description" : "An object that contains information about the synthesized audio.",
          "name" : "AVSpeechSynthesisMarker",
          "url" : "https:\/\/developer.apple.com\/documentation\/AVFAudio\/AVSpeechSynthesisMarker"
        }
      ],
      "title" : "Supplying metadata"
    },
    {
      "content" : "",
      "items" : [
        {
          "description" : "A list of voices the audio unit provides to the system.",
          "name" : "speechVoices",
          "url" : "https:\/\/developer.apple.com\/documentation\/AVFAudio\/AVSpeechSynthesisProviderAudioUnit\/speechVoices"
        },
        {
          "description" : "An object that represents a voice that an audio unit provides to its host.",
          "name" : "AVSpeechSynthesisProviderVoice",
          "url" : "https:\/\/developer.apple.com\/documentation\/AVFAudio\/AVSpeechSynthesisProviderVoice"
        }
      ],
      "title" : "Getting and setting voices"
    },
    {
      "content" : "",
      "items" : [
        {
          "description" : "Informs the audio unit to discard the speech request.",
          "name" : "cancelSpeechRequest()",
          "url" : "https:\/\/developer.apple.com\/documentation\/AVFAudio\/AVSpeechSynthesisProviderAudioUnit\/cancelSpeechRequest()"
        }
      ],
      "title" : "Cancelling a request"
    },
    {
      "content" : "",
      "items" : [
        {
          "name" : "AUAudioUnit"
        }
      ],
      "title" : "Inherits From"
    }
  ],
  "source" : "appleJSON",
  "title" : "AVSpeechSynthesisProviderAudioUnit",
  "url" : "https:\/\/developer.apple.com\/documentation\/AVFAudio\/AVSpeechSynthesisProviderAudioUnit"
}