{
  "abstract" : "Sets the preference for not interrupting the audio session with system alerts.",
  "codeExamples" : [

  ],
  "contentHash" : "ffff9e5d1db8497992c20392671878068c29680afe3b4b3c874939c014945a20",
  "crawledAt" : "2025-12-02T18:54:43Z",
  "declaration" : {
    "code" : "func setPrefersNoInterruptionsFromSystemAlerts(_ inValue: Bool) throws",
    "language" : "swift"
  },
  "id" : "309555AC-4321-491F-8187-5CE881483DC1",
  "kind" : "method",
  "language" : "swift",
  "module" : "AVFAudio",
  "overview" : "## Discussion\n\nBeginning in iOS 14, users can set a global preference that indicates whether the system displays incoming calls using a banner or a full-screen display style. If using the banner style, setting this value to [doc:\/\/com.apple.documentation\/documentation\/Swift\/true] prevents the system from interrupting the audio session with incoming call notifications, and gives the user an opportunity to accept or decline the call. The system only interrupts the audio session if the user accepts the call.\n\nEnabling this preference can improve the user experience of apps with audio sessions that you don’t want to interrupt, such as those that record audiovisual media or that you use for music performance.",
  "platforms" : [
    "iOS",
    "iPadOS",
    "Mac Catalyst",
    "tvOS",
    "visionOS",
    "watchOS"
  ],
  "rawMarkdown" : "---\nsource: https:\/\/developer.apple.com\/documentation\/AVFAudio\/AVAudioSession\/setPrefersNoInterruptionsFromSystemAlerts(_:)\ncrawled: 2025-12-02T18:54:43Z\n---\n\n# setPrefersNoInterruptionsFromSystemAlerts(_:)\n\n**Instance Method**\n\nSets the preference for not interrupting the audio session with system alerts.\n\n## Declaration\n\n```swift\nfunc setPrefersNoInterruptionsFromSystemAlerts(_ inValue: Bool) throws\n```\n\n## Parameters\n\n- **inValue**: The interruption preference value.\n\n## Discussion\n\nBeginning in iOS 14, users can set a global preference that indicates whether the system displays incoming calls using a banner or a full-screen display style. If using the banner style, setting this value to [doc:\/\/com.apple.documentation\/documentation\/Swift\/true] prevents the system from interrupting the audio session with incoming call notifications, and gives the user an opportunity to accept or decline the call. The system only interrupts the audio session if the user accepts the call.\n\nEnabling this preference can improve the user experience of apps with audio sessions that you don’t want to interrupt, such as those that record audiovisual media or that you use for music performance.\n\n\n\n## Handling interruptions\n\n- **prefersNoInterruptionsFromSystemAlerts**: A Boolean value that indicates a preference for not interrupting the session with system alerts.\n- **prefersInterruptionOnRouteDisconnect**: A Boolean value that indicates whether the system interrupts the audio session when the active route disconnects.\n- **setPrefersInterruptionOnRouteDisconnect(_:)**: Sets a preference to interrupt the audio session when the active route disconnects.\n- **interruptionNotification**: A notification the system posts when an audio interruption occurs.\n\n",
  "sections" : [
    {
      "content" : "",
      "items" : [
        {
          "description" : "A Boolean value that indicates a preference for not interrupting the session with system alerts.",
          "name" : "prefersNoInterruptionsFromSystemAlerts",
          "url" : "https:\/\/developer.apple.com\/documentation\/AVFAudio\/AVAudioSession\/prefersNoInterruptionsFromSystemAlerts"
        },
        {
          "description" : "A Boolean value that indicates whether the system interrupts the audio session when the active route disconnects.",
          "name" : "prefersInterruptionOnRouteDisconnect",
          "url" : "https:\/\/developer.apple.com\/documentation\/AVFAudio\/AVAudioSession\/prefersInterruptionOnRouteDisconnect"
        },
        {
          "description" : "Sets a preference to interrupt the audio session when the active route disconnects.",
          "name" : "setPrefersInterruptionOnRouteDisconnect(_:)",
          "url" : "https:\/\/developer.apple.com\/documentation\/AVFAudio\/AVAudioSession\/setPrefersInterruptionOnRouteDisconnect(_:)"
        },
        {
          "description" : "A notification the system posts when an audio interruption occurs.",
          "name" : "interruptionNotification",
          "url" : "https:\/\/developer.apple.com\/documentation\/AVFAudio\/AVAudioSession\/interruptionNotification"
        }
      ],
      "title" : "Handling interruptions"
    }
  ],
  "source" : "appleJSON",
  "title" : "setPrefersNoInterruptionsFromSystemAlerts(_:)",
  "url" : "https:\/\/developer.apple.com\/documentation\/AVFAudio\/AVAudioSession\/setPrefersNoInterruptionsFromSystemAlerts(_:)"
}