{
  "abstract" : "Selects the preferred directivity configuration for the data source.",
  "codeExamples" : [

  ],
  "contentHash" : "20861620716ab28e202342e3f71760132bb82172f8ab0a3480db5d95312d1b8c",
  "crawledAt" : "2025-12-04T20:53:52Z",
  "declaration" : {
    "code" : "func setPreferredPolarPattern(_ pattern: AVAudioSession.PolarPattern?) throws",
    "language" : "swift"
  },
  "id" : "F2F68593-FAB2-4AA7-BF94-4360656C9A16",
  "kind" : "method",
  "language" : "swift",
  "module" : "AVFAudio",
  "overview" : "## Discussion\n\nCalling this method requests a change to the selected polar pattern. To determine whether the change has taken effect, inspect the [doc:\/\/com.apple.avfaudio\/documentation\/AVFAudio\/AVAudioSessionDataSourceDescription\/selectedPolarPattern] property.\n\nIf the data source and its owning port are in use, using this method to change the directivity configuration is likely to result in a route reconfiguration.\n\nSet a preferred polar pattern only after setting the audio session’s category and mode, and activating the session.",
  "platforms" : [
    "iOS",
    "iPadOS",
    "Mac Catalyst",
    "tvOS",
    "visionOS"
  ],
  "rawMarkdown" : "---\nsource: https:\/\/developer.apple.com\/documentation\/AVFAudio\/AVAudioSessionDataSourceDescription\/setPreferredPolarPattern(_:)\ncrawled: 2025-12-04T20:53:52Z\n---\n\n# setPreferredPolarPattern(_:)\n\n**Instance Method**\n\nSelects the preferred directivity configuration for the data source.\n\n## Declaration\n\n```swift\nfunc setPreferredPolarPattern(_ pattern: AVAudioSession.PolarPattern?) throws\n```\n\n## Parameters\n\n- **pattern**: The directivity configuration to use.\n\n## Discussion\n\nCalling this method requests a change to the selected polar pattern. To determine whether the change has taken effect, inspect the [doc:\/\/com.apple.avfaudio\/documentation\/AVFAudio\/AVAudioSessionDataSourceDescription\/selectedPolarPattern] property.\n\nIf the data source and its owning port are in use, using this method to change the directivity configuration is likely to result in a route reconfiguration.\n\nSet a preferred polar pattern only after setting the audio session’s category and mode, and activating the session.\n\n## Configuring Microphone Directivity\n\n- **selectedPolarPattern**: The data source’s active polar pattern.\n- **supportedPolarPatterns**: The set of directivity configurations supported by the data source.\n- **preferredPolarPattern**: The preferred directivity configuration for the data source.\n- **AVAudioSession.PolarPattern**: Constants that describe the possible polar patterns of the data source on an iOS device.\n\n",
  "sections" : [
    {
      "content" : "",
      "items" : [
        {
          "description" : "The data source’s active polar pattern.",
          "name" : "selectedPolarPattern",
          "url" : "https:\/\/developer.apple.com\/documentation\/AVFAudio\/AVAudioSessionDataSourceDescription\/selectedPolarPattern"
        },
        {
          "description" : "The set of directivity configurations supported by the data source.",
          "name" : "supportedPolarPatterns",
          "url" : "https:\/\/developer.apple.com\/documentation\/AVFAudio\/AVAudioSessionDataSourceDescription\/supportedPolarPatterns"
        },
        {
          "description" : "The preferred directivity configuration for the data source.",
          "name" : "preferredPolarPattern",
          "url" : "https:\/\/developer.apple.com\/documentation\/AVFAudio\/AVAudioSessionDataSourceDescription\/preferredPolarPattern"
        },
        {
          "description" : "Constants that describe the possible polar patterns of the data source on an iOS device.",
          "name" : "AVAudioSession.PolarPattern",
          "url" : "https:\/\/developer.apple.com\/documentation\/AVFAudio\/AVAudioSession\/PolarPattern"
        }
      ],
      "title" : "Configuring Microphone Directivity"
    }
  ],
  "source" : "appleJSON",
  "title" : "setPreferredPolarPattern(_:)",
  "url" : "https:\/\/developer.apple.com\/documentation\/AVFAudio\/AVAudioSessionDataSourceDescription\/setPreferredPolarPattern(_:)"
}