{
  "abstract" : "The current playback position, in beats.",
  "codeExamples" : [

  ],
  "contentHash" : "2760d992a14e28de9ec112da56f0dad272687cfdb453488fe58714210dc2592d",
  "crawledAt" : "2025-12-03T04:20:58Z",
  "declaration" : {
    "code" : "var currentPositionInBeats: TimeInterval { get set }",
    "language" : "swift"
  },
  "id" : "026042E0-8171-490D-AD4A-819D5ED74C45",
  "kind" : "property",
  "language" : "swift",
  "module" : "AVFAudio",
  "overview" : "## Discussion\n\nSetting this property positions the sequencer’s player to the specified beat. You can update this property while the player is in a playing state, in which case, playback resumes at the new position.",
  "platforms" : [
    "iOS",
    "iPadOS",
    "Mac Catalyst",
    "macOS",
    "tvOS",
    "visionOS"
  ],
  "rawMarkdown" : "---\nsource: https:\/\/developer.apple.com\/documentation\/AVFAudio\/AVAudioSequencer\/currentPositionInBeats\ncrawled: 2025-12-03T04:20:58Z\n---\n\n# currentPositionInBeats\n\n**Instance Property**\n\nThe current playback position, in beats.\n\n## Declaration\n\n```swift\nvar currentPositionInBeats: TimeInterval { get set }\n```\n\n## Discussion\n\nSetting this property positions the sequencer’s player to the specified beat. You can update this property while the player is in a playing state, in which case, playback resumes at the new position.\n\n## Getting Sequence Properties\n\n- **isPlaying**: A Boolean value that indicates whether the sequencer’s player is in a playing state.\n- **rate**: The playback rate of the sequencer’s player.\n- **tracks**: An array that contains all the tracks in the sequence.\n- **currentPositionInSeconds**: The current playback position, in seconds.\n- **tempoTrack**: The track that contains tempo information about the sequence.\n- **userInfo**: A dictionary that contains metadata from a sequence.\n- **AVAudioSequencer.InfoDictionaryKey**: Constants that defines metadata keys for a sequencer.\n- **data(withSMPTEResolution:error:)**: Gets a data object that contains the events from the sequence.\n- **AVMusicTimeStampEndOfTrack**: A timestamp you use to access all events in a music track through a beat range.\n\n",
  "sections" : [
    {
      "content" : "",
      "items" : [
        {
          "description" : "A Boolean value that indicates whether the sequencer’s player is in a playing state.",
          "name" : "isPlaying",
          "url" : "https:\/\/developer.apple.com\/documentation\/AVFAudio\/AVAudioSequencer\/isPlaying"
        },
        {
          "description" : "The playback rate of the sequencer’s player.",
          "name" : "rate",
          "url" : "https:\/\/developer.apple.com\/documentation\/AVFAudio\/AVAudioSequencer\/rate"
        },
        {
          "description" : "An array that contains all the tracks in the sequence.",
          "name" : "tracks",
          "url" : "https:\/\/developer.apple.com\/documentation\/AVFAudio\/AVAudioSequencer\/tracks"
        },
        {
          "description" : "The current playback position, in seconds.",
          "name" : "currentPositionInSeconds",
          "url" : "https:\/\/developer.apple.com\/documentation\/AVFAudio\/AVAudioSequencer\/currentPositionInSeconds"
        },
        {
          "description" : "The track that contains tempo information about the sequence.",
          "name" : "tempoTrack",
          "url" : "https:\/\/developer.apple.com\/documentation\/AVFAudio\/AVAudioSequencer\/tempoTrack"
        },
        {
          "description" : "A dictionary that contains metadata from a sequence.",
          "name" : "userInfo",
          "url" : "https:\/\/developer.apple.com\/documentation\/AVFAudio\/AVAudioSequencer\/userInfo"
        },
        {
          "description" : "Constants that defines metadata keys for a sequencer.",
          "name" : "AVAudioSequencer.InfoDictionaryKey",
          "url" : "https:\/\/developer.apple.com\/documentation\/AVFAudio\/AVAudioSequencer\/InfoDictionaryKey"
        },
        {
          "description" : "Gets a data object that contains the events from the sequence.",
          "name" : "data(withSMPTEResolution:error:)",
          "url" : "https:\/\/developer.apple.com\/documentation\/AVFAudio\/AVAudioSequencer\/data(withSMPTEResolution:error:)"
        },
        {
          "description" : "A timestamp you use to access all events in a music track through a beat range.",
          "name" : "AVMusicTimeStampEndOfTrack",
          "url" : "https:\/\/developer.apple.com\/documentation\/AVFAudio\/AVMusicTimeStampEndOfTrack"
        }
      ],
      "title" : "Getting Sequence Properties"
    }
  ],
  "source" : "appleJSON",
  "title" : "currentPositionInBeats",
  "url" : "https:\/\/developer.apple.com\/documentation\/AVFAudio\/AVAudioSequencer\/currentPositionInBeats"
}