{
  "abstract" : "An object that encapsulates the text for speech synthesis and parameters that affect the speech.",
  "codeExamples" : [

  ],
  "conformsTo" : [
    "CVarArg",
    "CustomDebugStringConvertible",
    "CustomStringConvertible",
    "Equatable",
    "Hashable",
    "NSCoding",
    "NSCopying",
    "NSObjectProtocol",
    "NSSecureCoding"
  ],
  "contentHash" : "9abb65429f4ddfd79fee41fca2939f319119d593fdd43f2ef16365bd157a85f1",
  "crawledAt" : "2025-12-03T03:08:31Z",
  "declaration" : {
    "code" : "class AVSpeechUtterance",
    "language" : "swift"
  },
  "id" : "D1C7977B-EC73-41EE-8543-397F424A92A1",
  "kind" : "class",
  "language" : "swift",
  "module" : "AVFAudio",
  "overview" : "## Overview\n\nAn `AVSpeechUtterance` is the basic unit of speech synthesis.\n\nTo synthesize speech, create an `AVSpeechUtterance` instance with text you want a speech synthesizer to speak. Optionally, change the [doc:\/\/com.apple.avfaudio\/documentation\/AVFAudio\/AVSpeechUtterance\/voice], [doc:\/\/com.apple.avfaudio\/documentation\/AVFAudio\/AVSpeechUtterance\/pitchMultiplier], [doc:\/\/com.apple.avfaudio\/documentation\/AVFAudio\/AVSpeechUtterance\/volume], [doc:\/\/com.apple.avfaudio\/documentation\/AVFAudio\/AVSpeechUtterance\/rate], [doc:\/\/com.apple.avfaudio\/documentation\/AVFAudio\/AVSpeechUtterance\/preUtteranceDelay], or [doc:\/\/com.apple.avfaudio\/documentation\/AVFAudio\/AVSpeechUtterance\/postUtteranceDelay] parameters for the utterance. Pass the utterance to an instance of [doc:\/\/com.apple.avfaudio\/documentation\/AVFAudio\/AVSpeechSynthesizer] to begin speech, or enqueue the utterance to speak later if the synthesizer is already speaking.\n\nSplit a body of text into multiple utterances if you want to apply different speech parameters. For example, you can emphasize a sentence by increasing the pitch and decreasing the rate of that utterance relative to others, or you can introduce pauses between sentences by putting each into an utterance with a leading or trailing delay.\n\nSet and use the [doc:\/\/com.apple.avfaudio\/documentation\/AVFAudio\/AVSpeechSynthesizerDelegate] to receive notifications when the synthesizer starts or finishes speaking an utterance. Create an utterance for each meaningful unit in a body of text if you want to receive notifications as its speech progresses.",
  "platforms" : [
    "iOS",
    "iPadOS",
    "Mac Catalyst",
    "macOS",
    "tvOS",
    "visionOS",
    "watchOS"
  ],
  "rawMarkdown" : "---\nsource: https:\/\/developer.apple.com\/documentation\/AVFAudio\/AVSpeechUtterance\ncrawled: 2025-12-03T03:08:31Z\n---\n\n# AVSpeechUtterance\n\n**Class**\n\nAn object that encapsulates the text for speech synthesis and parameters that affect the speech.\n\n## Declaration\n\n```swift\nclass AVSpeechUtterance\n```\n\n## Overview\n\nAn `AVSpeechUtterance` is the basic unit of speech synthesis.\n\nTo synthesize speech, create an `AVSpeechUtterance` instance with text you want a speech synthesizer to speak. Optionally, change the [doc:\/\/com.apple.avfaudio\/documentation\/AVFAudio\/AVSpeechUtterance\/voice], [doc:\/\/com.apple.avfaudio\/documentation\/AVFAudio\/AVSpeechUtterance\/pitchMultiplier], [doc:\/\/com.apple.avfaudio\/documentation\/AVFAudio\/AVSpeechUtterance\/volume], [doc:\/\/com.apple.avfaudio\/documentation\/AVFAudio\/AVSpeechUtterance\/rate], [doc:\/\/com.apple.avfaudio\/documentation\/AVFAudio\/AVSpeechUtterance\/preUtteranceDelay], or [doc:\/\/com.apple.avfaudio\/documentation\/AVFAudio\/AVSpeechUtterance\/postUtteranceDelay] parameters for the utterance. Pass the utterance to an instance of [doc:\/\/com.apple.avfaudio\/documentation\/AVFAudio\/AVSpeechSynthesizer] to begin speech, or enqueue the utterance to speak later if the synthesizer is already speaking.\n\nSplit a body of text into multiple utterances if you want to apply different speech parameters. For example, you can emphasize a sentence by increasing the pitch and decreasing the rate of that utterance relative to others, or you can introduce pauses between sentences by putting each into an utterance with a leading or trailing delay.\n\nSet and use the [doc:\/\/com.apple.avfaudio\/documentation\/AVFAudio\/AVSpeechSynthesizerDelegate] to receive notifications when the synthesizer starts or finishes speaking an utterance. Create an utterance for each meaningful unit in a body of text if you want to receive notifications as its speech progresses.\n\n## Creating an utterance\n\n- **init(string:)**: Creates an utterance with the text string that you specify for the speech synthesizer to speak.\n- **init(attributedString:)**: Creates an utterance with the attributed text string that you specify for the speech synthesizer to speak.\n- **AVSpeechSynthesisIPANotationAttribute**: A string that contains International Phonetic Alphabet (IPA) symbols the speech synthesizer uses to control pronunciation of certain words or phrases.\n- **init(ssmlRepresentation:)**: Creates a speech utterance with an Speech Synthesis Markup Language (SSML) string.\n\n## Configuring an utterance\n\n- **voice**: The voice the speech synthesizer uses when speaking the utterance.\n- **pitchMultiplier**: The baseline pitch the speech synthesizer uses when speaking the utterance.\n- **volume**: The volume the speech synthesizer uses when speaking the utterance.\n- **prefersAssistiveTechnologySettings**: A Boolean that specifies whether assistive technology settings take precedence over the property values of this utterance.\n\n## Configuring utterance timing\n\n- **rate**: The rate the speech synthesizer uses when speaking the utterance.\n- **AVSpeechUtteranceMinimumSpeechRate**: The minimum rate the speech synthesizer uses when speaking an utterance.\n- **AVSpeechUtteranceMaximumSpeechRate**: The maximum rate the speech synthesizer uses when speaking an utterance.\n- **AVSpeechUtteranceDefaultSpeechRate**: The default rate the speech synthesizer uses when speaking an utterance.\n- **preUtteranceDelay**: The amount of time the speech synthesizer pauses before speaking the utterance.\n- **postUtteranceDelay**: The amount of time the speech synthesizer pauses after speaking an utterance before handling the next utterance in the queue.\n\n## Inspecting utterance text\n\n- **speechString**: A string that contains the text for speech synthesis.\n- **attributedSpeechString**: An attributed string that contains the text for speech synthesis.\n\n## Spoken text attributes\n\n- **AVSpeechSynthesisVoice**: A distinct voice for use in speech synthesis.\n\n## Inherits From\n\n- NSObject\n\n## Conforms To\n\n- CVarArg\n- CustomDebugStringConvertible\n- CustomStringConvertible\n- Equatable\n- Hashable\n- NSCoding\n- NSCopying\n- NSObjectProtocol\n- NSSecureCoding\n\n",
  "sections" : [
    {
      "content" : "",
      "items" : [
        {
          "description" : "Creates an utterance with the text string that you specify for the speech synthesizer to speak.",
          "name" : "init(string:)",
          "url" : "https:\/\/developer.apple.com\/documentation\/AVFAudio\/AVSpeechUtterance\/init(string:)"
        },
        {
          "description" : "Creates an utterance with the attributed text string that you specify for the speech synthesizer to speak.",
          "name" : "init(attributedString:)",
          "url" : "https:\/\/developer.apple.com\/documentation\/AVFAudio\/AVSpeechUtterance\/init(attributedString:)"
        },
        {
          "description" : "A string that contains International Phonetic Alphabet (IPA) symbols the speech synthesizer uses to control pronunciation of certain words or phrases.",
          "name" : "AVSpeechSynthesisIPANotationAttribute",
          "url" : "https:\/\/developer.apple.com\/documentation\/AVFAudio\/AVSpeechSynthesisIPANotationAttribute"
        },
        {
          "description" : "Creates a speech utterance with an Speech Synthesis Markup Language (SSML) string.",
          "name" : "init(ssmlRepresentation:)",
          "url" : "https:\/\/developer.apple.com\/documentation\/AVFAudio\/AVSpeechUtterance\/init(ssmlRepresentation:)"
        }
      ],
      "title" : "Creating an utterance"
    },
    {
      "content" : "",
      "items" : [
        {
          "description" : "The voice the speech synthesizer uses when speaking the utterance.",
          "name" : "voice",
          "url" : "https:\/\/developer.apple.com\/documentation\/AVFAudio\/AVSpeechUtterance\/voice"
        },
        {
          "description" : "The baseline pitch the speech synthesizer uses when speaking the utterance.",
          "name" : "pitchMultiplier",
          "url" : "https:\/\/developer.apple.com\/documentation\/AVFAudio\/AVSpeechUtterance\/pitchMultiplier"
        },
        {
          "description" : "The volume the speech synthesizer uses when speaking the utterance.",
          "name" : "volume",
          "url" : "https:\/\/developer.apple.com\/documentation\/AVFAudio\/AVSpeechUtterance\/volume"
        },
        {
          "description" : "A Boolean that specifies whether assistive technology settings take precedence over the property values of this utterance.",
          "name" : "prefersAssistiveTechnologySettings",
          "url" : "https:\/\/developer.apple.com\/documentation\/AVFAudio\/AVSpeechUtterance\/prefersAssistiveTechnologySettings"
        }
      ],
      "title" : "Configuring an utterance"
    },
    {
      "content" : "",
      "items" : [
        {
          "description" : "The rate the speech synthesizer uses when speaking the utterance.",
          "name" : "rate",
          "url" : "https:\/\/developer.apple.com\/documentation\/AVFAudio\/AVSpeechUtterance\/rate"
        },
        {
          "description" : "The minimum rate the speech synthesizer uses when speaking an utterance.",
          "name" : "AVSpeechUtteranceMinimumSpeechRate",
          "url" : "https:\/\/developer.apple.com\/documentation\/AVFAudio\/AVSpeechUtteranceMinimumSpeechRate"
        },
        {
          "description" : "The maximum rate the speech synthesizer uses when speaking an utterance.",
          "name" : "AVSpeechUtteranceMaximumSpeechRate",
          "url" : "https:\/\/developer.apple.com\/documentation\/AVFAudio\/AVSpeechUtteranceMaximumSpeechRate"
        },
        {
          "description" : "The default rate the speech synthesizer uses when speaking an utterance.",
          "name" : "AVSpeechUtteranceDefaultSpeechRate",
          "url" : "https:\/\/developer.apple.com\/documentation\/AVFAudio\/AVSpeechUtteranceDefaultSpeechRate"
        },
        {
          "description" : "The amount of time the speech synthesizer pauses before speaking the utterance.",
          "name" : "preUtteranceDelay",
          "url" : "https:\/\/developer.apple.com\/documentation\/AVFAudio\/AVSpeechUtterance\/preUtteranceDelay"
        },
        {
          "description" : "The amount of time the speech synthesizer pauses after speaking an utterance before handling the next utterance in the queue.",
          "name" : "postUtteranceDelay",
          "url" : "https:\/\/developer.apple.com\/documentation\/AVFAudio\/AVSpeechUtterance\/postUtteranceDelay"
        }
      ],
      "title" : "Configuring utterance timing"
    },
    {
      "content" : "",
      "items" : [
        {
          "description" : "A string that contains the text for speech synthesis.",
          "name" : "speechString",
          "url" : "https:\/\/developer.apple.com\/documentation\/AVFAudio\/AVSpeechUtterance\/speechString"
        },
        {
          "description" : "An attributed string that contains the text for speech synthesis.",
          "name" : "attributedSpeechString",
          "url" : "https:\/\/developer.apple.com\/documentation\/AVFAudio\/AVSpeechUtterance\/attributedSpeechString"
        }
      ],
      "title" : "Inspecting utterance text"
    },
    {
      "content" : "",
      "items" : [
        {
          "description" : "A distinct voice for use in speech synthesis.",
          "name" : "AVSpeechSynthesisVoice",
          "url" : "https:\/\/developer.apple.com\/documentation\/AVFAudio\/AVSpeechSynthesisVoice"
        }
      ],
      "title" : "Spoken text attributes"
    },
    {
      "content" : "",
      "items" : [
        {
          "name" : "NSObject"
        }
      ],
      "title" : "Inherits From"
    }
  ],
  "source" : "appleJSON",
  "title" : "AVSpeechUtterance",
  "url" : "https:\/\/developer.apple.com\/documentation\/AVFAudio\/AVSpeechUtterance"
}