{
  "abstract" : "An object that represents a custom extension of a MIDI note on event.",
  "codeExamples" : [

  ],
  "conformsTo" : [
    "CVarArg",
    "CustomDebugStringConvertible",
    "CustomStringConvertible",
    "Equatable",
    "Hashable",
    "NSObjectProtocol"
  ],
  "contentHash" : "c802efaba6e8ad263a94787a893193b3e3876d0774ed229827494265c5178fd2",
  "crawledAt" : "2025-12-01T09:28:22Z",
  "declaration" : {
    "code" : "class AVExtendedNoteOnEvent",
    "language" : "swift"
  },
  "id" : "20C0B461-5DAB-4373-99F6-20230D4A396F",
  "kind" : "class",
  "module" : "AVFAudio",
  "overview" : "## Overview\n\nUse this to allow an app to trigger a custom note on event on one of several Apple audio units that support it. The floating point note and velocity numbers allow for optional fractional control of the note’s runtime properties that the system modulates by those inputs. This event supports the possibility of an audio unit with more than the standard 16 MIDI channels.",
  "platforms" : [
    "iOS",
    "iPadOS",
    "Mac Catalyst",
    "macOS",
    "tvOS",
    "visionOS"
  ],
  "rawMarkdown" : "---\nsource: https:\/\/developer.apple.com\/documentation\/AVFAudio\/AVExtendedNoteOnEvent\ncrawled: 2025-12-01T09:28:22Z\n---\n\n# AVExtendedNoteOnEvent\n\n**Class**\n\nAn object that represents a custom extension of a MIDI note on event.\n\n## Declaration\n\n```swift\nclass AVExtendedNoteOnEvent\n```\n\n## Overview\n\nUse this to allow an app to trigger a custom note on event on one of several Apple audio units that support it. The floating point note and velocity numbers allow for optional fractional control of the note’s runtime properties that the system modulates by those inputs. This event supports the possibility of an audio unit with more than the standard 16 MIDI channels.\n\n## Creating a Note On Event\n\n- **init(midiNote:velocity:groupID:duration:)**: Creates an event with a MIDI note, velocity, group identifier, and duration.\n- **init(midiNote:velocity:instrumentID:groupID:duration:)**: Creates a note on event with the default instrument.\n\n## Configuring a Note On Event\n\n- **midiNote**: The MIDI note number.\n- **velocity**: The MDI velocity.\n- **instrumentID**: The instrument identifier.\n- **groupID**: The audio unit channel that handles the event.\n- **duration**: The duration of the event, in beats.\n\n## Getting the Default Instrument\n\n- **defaultInstrument**: A constant that represents the default instrument identifier.\n\n## Handling Music Events\n\n- **AVMusicEvent**: A base class for the events you associate with a music track.\n- **AVMusicUserEvent**: An object that represents a custom user message.\n- **AVParameterEvent**: An object that represents a parameter event on a music track’s destination.\n- **AVAUPresetEvent**: An object that represents a preset load and change on the music track’s destination audio unit.\n- **AVExtendedTempoEvent**: An object that represents a tempo change to a specific beats-per-minute value.\n\n## Inherits From\n\n- AVMusicEvent\n\n## Conforms To\n\n- CVarArg\n- CustomDebugStringConvertible\n- CustomStringConvertible\n- Equatable\n- Hashable\n- NSObjectProtocol\n\n",
  "sections" : [
    {
      "content" : "",
      "items" : [
        {
          "description" : "Creates an event with a MIDI note, velocity, group identifier, and duration.",
          "name" : "init(midiNote:velocity:groupID:duration:)",
          "url" : "https:\/\/developer.apple.com\/documentation\/AVFAudio\/AVExtendedNoteOnEvent\/init(midiNote:velocity:groupID:duration:)"
        },
        {
          "description" : "Creates a note on event with the default instrument.",
          "name" : "init(midiNote:velocity:instrumentID:groupID:duration:)",
          "url" : "https:\/\/developer.apple.com\/documentation\/AVFAudio\/AVExtendedNoteOnEvent\/init(midiNote:velocity:instrumentID:groupID:duration:)"
        }
      ],
      "title" : "Creating a Note On Event"
    },
    {
      "content" : "",
      "items" : [
        {
          "description" : "The MIDI note number.",
          "name" : "midiNote",
          "url" : "https:\/\/developer.apple.com\/documentation\/AVFAudio\/AVExtendedNoteOnEvent\/midiNote"
        },
        {
          "description" : "The MDI velocity.",
          "name" : "velocity",
          "url" : "https:\/\/developer.apple.com\/documentation\/AVFAudio\/AVExtendedNoteOnEvent\/velocity"
        },
        {
          "description" : "The instrument identifier.",
          "name" : "instrumentID",
          "url" : "https:\/\/developer.apple.com\/documentation\/AVFAudio\/AVExtendedNoteOnEvent\/instrumentID"
        },
        {
          "description" : "The audio unit channel that handles the event.",
          "name" : "groupID",
          "url" : "https:\/\/developer.apple.com\/documentation\/AVFAudio\/AVExtendedNoteOnEvent\/groupID"
        },
        {
          "description" : "The duration of the event, in beats.",
          "name" : "duration",
          "url" : "https:\/\/developer.apple.com\/documentation\/AVFAudio\/AVExtendedNoteOnEvent\/duration"
        }
      ],
      "title" : "Configuring a Note On Event"
    },
    {
      "content" : "",
      "items" : [
        {
          "description" : "A constant that represents the default instrument identifier.",
          "name" : "defaultInstrument",
          "url" : "https:\/\/developer.apple.com\/documentation\/AVFAudio\/AVExtendedNoteOnEvent\/defaultInstrument"
        }
      ],
      "title" : "Getting the Default Instrument"
    },
    {
      "content" : "",
      "items" : [
        {
          "description" : "A base class for the events you associate with a music track.",
          "name" : "AVMusicEvent",
          "url" : "https:\/\/developer.apple.com\/documentation\/AVFAudio\/AVMusicEvent"
        },
        {
          "description" : "An object that represents a custom user message.",
          "name" : "AVMusicUserEvent",
          "url" : "https:\/\/developer.apple.com\/documentation\/AVFAudio\/AVMusicUserEvent"
        },
        {
          "description" : "An object that represents a parameter event on a music track’s destination.",
          "name" : "AVParameterEvent",
          "url" : "https:\/\/developer.apple.com\/documentation\/AVFAudio\/AVParameterEvent"
        },
        {
          "description" : "An object that represents a preset load and change on the music track’s destination audio unit.",
          "name" : "AVAUPresetEvent",
          "url" : "https:\/\/developer.apple.com\/documentation\/AVFAudio\/AVAUPresetEvent"
        },
        {
          "description" : "An object that represents a tempo change to a specific beats-per-minute value.",
          "name" : "AVExtendedTempoEvent",
          "url" : "https:\/\/developer.apple.com\/documentation\/AVFAudio\/AVExtendedTempoEvent"
        }
      ],
      "title" : "Handling Music Events"
    },
    {
      "content" : "",
      "items" : [
        {
          "name" : "AVMusicEvent"
        }
      ],
      "title" : "Inherits From"
    }
  ],
  "source" : "appleJSON",
  "title" : "AVExtendedNoteOnEvent",
  "url" : "https:\/\/developer.apple.com\/documentation\/AVFAudio\/AVExtendedNoteOnEvent"
}