{
  "abstract" : "Fetch a user’s rating for a library song by using the song’s library identifier.",
  "codeExamples" : [

  ],
  "contentHash" : "119b25447a56c9fa40514541d3f4e440df6a85cca5d0d793af01378642499365",
  "crawledAt" : "2025-12-05T17:17:35Z",
  "id" : "4190CD33-0A03-4011-9B21-5A1858964CED",
  "kind" : "unknown",
  "language" : "data",
  "module" : "Apple Music API",
  "overview" : "## Discussion\n\nThis endpoint requires a music user token. For more information, see [doc:\/\/com.apple.applemusicapi\/documentation\/AppleMusicAPI\/user-authentication-for-musickit].\n\nA rating indicates whether a user likes `(1)` or dislikes `(-1)` the song. These are the only two ratings supported.\n\nFor a particular song, the personal ratings for that song’s catalog ID and library ID (if the song is in the library) stay synced.\n\n### Example",
  "rawMarkdown" : "---\nsource: https:\/\/developer.apple.com\/documentation\/AppleMusicAPI\/Get-a-Personal-Content-Rating-7olcw\ncrawled: 2025-12-05T17:17:35Z\n---\n\n# Get a Personal Library Song Rating\n\n**Web Service Endpoint**\n\nFetch a user’s rating for a library song by using the song’s library identifier.\n\n## Discussion\n\nThis endpoint requires a music user token. For more information, see [doc:\/\/com.apple.applemusicapi\/documentation\/AppleMusicAPI\/user-authentication-for-musickit].\n\nA rating indicates whether a user likes `(1)` or dislikes `(-1)` the song. These are the only two ratings supported.\n\nFor a particular song, the personal ratings for that song’s catalog ID and library ID (if the song is in the library) stay synced.\n\n### Example\n\n\n\n## Related Documentation\n\n- **Ratings**: An object that represents a rating for a resource.\n- **RatingRequest**: A request containing the data for a rating.\n- **RatingsResponse**: The response to a request for a rating.\n\n## Requesting Library Ratings\n\n- **Get a Personal Library Album Rating**: Fetch a user’s rating for specific content by using the content’s identifier.\n- **Get a Personal Library Music Video Rating**: Fetch a user’s rating for a library music video by using the music video’s library identifier.\n- **Get a Personal Library Playlist Rating**: Fetch a user’s rating for a library playlist by using the playlist’s library identifier.\n- **Get Multiple Personal Library Album Ratings**: Fetch the user’s ratings for one or more pieces of content by using the contents’ identifiers.\n- **Get Multiple Personal Library Music Video Ratings**: Fetch the user’s ratings for one or more library music videos by using the library music videos’ identifiers.\n- **Get Multiple Personal Library Playlist Ratings**: Fetch the user’s ratings for one or more library playlists by using the library playlists’ identifiers.\n- **Get Multiple Personal Library Songs Ratings**: Fetch the user’s ratings for one or more library songs by using the library songs’ identifiers.\n\n",
  "sections" : [
    {
      "content" : "",
      "items" : [
        {
          "description" : "An object that represents a rating for a resource.",
          "name" : "Ratings",
          "url" : "https:\/\/developer.apple.com\/documentation\/AppleMusicAPI\/Ratings"
        },
        {
          "description" : "A request containing the data for a rating.",
          "name" : "RatingRequest",
          "url" : "https:\/\/developer.apple.com\/documentation\/AppleMusicAPI\/RatingRequest"
        },
        {
          "description" : "The response to a request for a rating.",
          "name" : "RatingsResponse",
          "url" : "https:\/\/developer.apple.com\/documentation\/AppleMusicAPI\/RatingsResponse"
        }
      ],
      "title" : "Related Documentation"
    },
    {
      "content" : "",
      "items" : [
        {
          "description" : "Fetch a user’s rating for specific content by using the content’s identifier.",
          "name" : "Get a Personal Library Album Rating",
          "url" : "https:\/\/developer.apple.com\/documentation\/AppleMusicAPI\/Get-a-Personal-Content-Rating-6c3b8"
        },
        {
          "description" : "Fetch a user’s rating for a library music video by using the music video’s library identifier.",
          "name" : "Get a Personal Library Music Video Rating",
          "url" : "https:\/\/developer.apple.com\/documentation\/AppleMusicAPI\/Get-a-Personal-Content-Rating-4bir7"
        },
        {
          "description" : "Fetch a user’s rating for a library playlist by using the playlist’s library identifier.",
          "name" : "Get a Personal Library Playlist Rating",
          "url" : "https:\/\/developer.apple.com\/documentation\/AppleMusicAPI\/Get-a-Personal-Content-Rating-htyl"
        },
        {
          "description" : "Fetch the user’s ratings for one or more pieces of content by using the contents’ identifiers.",
          "name" : "Get Multiple Personal Library Album Ratings",
          "url" : "https:\/\/developer.apple.com\/documentation\/AppleMusicAPI\/Get-Multiple-Personal-Content-Ratings-5px7a"
        },
        {
          "description" : "Fetch the user’s ratings for one or more library music videos by using the library music videos’ identifiers.",
          "name" : "Get Multiple Personal Library Music Video Ratings",
          "url" : "https:\/\/developer.apple.com\/documentation\/AppleMusicAPI\/Get-Multiple-Personal-Content-Ratings-63ybs"
        },
        {
          "description" : "Fetch the user’s ratings for one or more library playlists by using the library playlists’ identifiers.",
          "name" : "Get Multiple Personal Library Playlist Ratings",
          "url" : "https:\/\/developer.apple.com\/documentation\/AppleMusicAPI\/Get-Multiple-Personal-Content-Ratings-25kr7"
        },
        {
          "description" : "Fetch the user’s ratings for one or more library songs by using the library songs’ identifiers.",
          "name" : "Get Multiple Personal Library Songs Ratings",
          "url" : "https:\/\/developer.apple.com\/documentation\/AppleMusicAPI\/Get-Multiple-Personal-Content-Ratings-1bod7"
        }
      ],
      "title" : "Requesting Library Ratings"
    }
  ],
  "source" : "appleJSON",
  "title" : "Get a Personal Library Song Rating",
  "url" : "https:\/\/developer.apple.com\/documentation\/AppleMusicAPI\/Get-a-Personal-Content-Rating-7olcw"
}