{
  "abstract" : "Fetch one or more songs by using their identifiers.",
  "codeExamples" : [

  ],
  "contentHash" : "9dac04c0c240787287f256a47406265affb5d7f006debe0cdf6431cd3beb2dce",
  "crawledAt" : "2025-12-05T17:16:19Z",
  "id" : "644482E5-568B-47A9-A979-414CE89A7F0A",
  "kind" : "unknown",
  "language" : "data",
  "module" : "Apple Music API",
  "overview" : "## Discussion\n\nIf successful, the HTTP status code is 200 (OK) and the `data` array contains the requested resource object. If unsuccessful, the HTTP status code indicates the error and the details are in the `errors` array. For more information, see [doc:\/\/com.apple.applemusicapi\/documentation\/AppleMusicAPI\/handling-requests-and-responses].\n\n### Example",
  "rawMarkdown" : "---\nsource: https:\/\/developer.apple.com\/documentation\/AppleMusicAPI\/Get-Multiple-Catalog-Songs-by-ID\ncrawled: 2025-12-05T17:16:19Z\n---\n\n# Get Multiple Catalog Songs by ID\n\n**Web Service Endpoint**\n\nFetch one or more songs by using their identifiers.\n\n## Discussion\n\nIf successful, the HTTP status code is 200 (OK) and the `data` array contains the requested resource object. If unsuccessful, the HTTP status code indicates the error and the details are in the `errors` array. For more information, see [doc:\/\/com.apple.applemusicapi\/documentation\/AppleMusicAPI\/handling-requests-and-responses].\n\n### Example\n\n\n\n## Related Documentation\n\n- **Songs**: A resource object that represents a song.\n- **SongsResponse**: The response to a songs request.\n\n## Requesting a Catalog Song\n\n- **Get a Catalog Song**: Fetch a song by using its identifier.\n- **Get a Catalog Song's Relationship Directly by Name**: Fetch a song’s relationship by using its identifier.\n- **Get Multiple Catalog Songs by ISRC**: Fetch one or more songs by using their International Standard Recording Code (ISRC) values.\n- **Get Equivalent Catalog Songs by ID**: Fetch the equivalent, available content in the storefront for the provided songs’ identifiers.\n\n",
  "sections" : [
    {
      "content" : "",
      "items" : [
        {
          "description" : "A resource object that represents a song.",
          "name" : "Songs",
          "url" : "https:\/\/developer.apple.com\/documentation\/AppleMusicAPI\/Songs"
        },
        {
          "description" : "The response to a songs request.",
          "name" : "SongsResponse",
          "url" : "https:\/\/developer.apple.com\/documentation\/AppleMusicAPI\/SongsResponse"
        }
      ],
      "title" : "Related Documentation"
    },
    {
      "content" : "",
      "items" : [
        {
          "description" : "Fetch a song by using its identifier.",
          "name" : "Get a Catalog Song",
          "url" : "https:\/\/developer.apple.com\/documentation\/AppleMusicAPI\/Get-a-Catalog-Song"
        },
        {
          "description" : "Fetch a song’s relationship by using its identifier.",
          "name" : "Get a Catalog Song's Relationship Directly by Name",
          "url" : "https:\/\/developer.apple.com\/documentation\/AppleMusicAPI\/Fetch-a-relationship-on-this-resource-by-name-56rq7"
        },
        {
          "description" : "Fetch one or more songs by using their International Standard Recording Code (ISRC) values.",
          "name" : "Get Multiple Catalog Songs by ISRC",
          "url" : "https:\/\/developer.apple.com\/documentation\/AppleMusicAPI\/Get-Multiple-Catalog-Songs-by-ISRC"
        },
        {
          "description" : "Fetch the equivalent, available content in the storefront for the provided songs’ identifiers.",
          "name" : "Get Equivalent Catalog Songs by ID",
          "url" : "https:\/\/developer.apple.com\/documentation\/AppleMusicAPI\/Get-Equivalent-Ids-for-the-Albums-3ce20"
        }
      ],
      "title" : "Requesting a Catalog Song"
    }
  ],
  "source" : "appleJSON",
  "title" : "Get Multiple Catalog Songs by ID",
  "url" : "https:\/\/developer.apple.com\/documentation\/AppleMusicAPI\/Get-Multiple-Catalog-Songs-by-ID"
}