{
  "abstract" : "Fetch a single storefront by using its identifier.",
  "codeExamples" : [

  ],
  "contentHash" : "483d8f2648cb9575715fe9a5b09e1ab70488c1e03a2ce457c7320544f018f02a",
  "crawledAt" : "2025-12-05T18:47:02Z",
  "id" : "04059DE5-17B2-4064-9273-2FAE68A63E36",
  "kind" : "unknown",
  "language" : "data",
  "module" : "Apple Music API",
  "overview" : "## Discussion\n\nIf successful, the HTTP status code is 200 (OK) and the `data` array contains a single [doc:\/\/com.apple.applemusicapi\/documentation\/AppleMusicAPI\/Storefronts] object. If unsuccessful, the HTTP status code indicates the error and the details are in the `errors` array.\n\n### Example",
  "rawMarkdown" : "---\nsource: https:\/\/developer.apple.com\/documentation\/AppleMusicAPI\/Get-a-Storefront\ncrawled: 2025-12-05T18:47:02Z\n---\n\n# Get a Storefront\n\n**Web Service Endpoint**\n\nFetch a single storefront by using its identifier.\n\n## Discussion\n\nIf successful, the HTTP status code is 200 (OK) and the `data` array contains a single [doc:\/\/com.apple.applemusicapi\/documentation\/AppleMusicAPI\/Storefronts] object. If unsuccessful, the HTTP status code indicates the error and the details are in the `errors` array.\n\n### Example\n\n\n\n## Related Documentation\n\n- **Storefronts**: A resource object that represents a storefront, an Apple Music and iTunes Store territory that the content is available in.\n- **StorefrontsResponse**: The response to a storefront request.\n\n## Requesting a Catalog Storefront\n\n- **Get Multiple Storefronts**: Fetch one or more storefronts by using their identifiers.\n- **Get All Storefronts**: Fetch all the storefronts in alphabetical order.\n\n",
  "sections" : [
    {
      "content" : "",
      "items" : [
        {
          "description" : "A resource object that represents a storefront, an Apple Music and iTunes Store territory that the content is available in.",
          "name" : "Storefronts",
          "url" : "https:\/\/developer.apple.com\/documentation\/AppleMusicAPI\/Storefronts"
        },
        {
          "description" : "The response to a storefront request.",
          "name" : "StorefrontsResponse",
          "url" : "https:\/\/developer.apple.com\/documentation\/AppleMusicAPI\/StorefrontsResponse"
        }
      ],
      "title" : "Related Documentation"
    },
    {
      "content" : "",
      "items" : [
        {
          "description" : "Fetch one or more storefronts by using their identifiers.",
          "name" : "Get Multiple Storefronts",
          "url" : "https:\/\/developer.apple.com\/documentation\/AppleMusicAPI\/Get-Multiple-Storefronts"
        },
        {
          "description" : "Fetch all the storefronts in alphabetical order.",
          "name" : "Get All Storefronts",
          "url" : "https:\/\/developer.apple.com\/documentation\/AppleMusicAPI\/Get-All-Storefronts"
        }
      ],
      "title" : "Requesting a Catalog Storefront"
    }
  ],
  "source" : "appleJSON",
  "title" : "Get a Storefront",
  "url" : "https:\/\/developer.apple.com\/documentation\/AppleMusicAPI\/Get-a-Storefront"
}