{
  "abstract" : "Fetch one or more record labels by using their identifiers.",
  "codeExamples" : [

  ],
  "contentHash" : "30d0a5485043dbafb197bd0d74e3741f61b477fad426b5a94fa53fb46bf8b776",
  "crawledAt" : "2025-12-05T17:18:09Z",
  "id" : "ACF359A8-450C-4D30-B342-8A7599007DCC",
  "kind" : "unknown",
  "language" : "data",
  "module" : "Apple Music API",
  "overview" : "## Discussion\n\nIf successful, the HTTP status code is 200 (OK) and the `data` array contains the requested resource object. If unsuccessful, the HTTP status code indicates the error and the details are in the `errors` array. For more information, see [doc:\/\/com.apple.applemusicapi\/documentation\/AppleMusicAPI\/handling-requests-and-responses].\n\n### Example",
  "rawMarkdown" : "---\nsource: https:\/\/developer.apple.com\/documentation\/AppleMusicAPI\/Get-Multiple-Record-Labels\ncrawled: 2025-12-05T17:18:09Z\n---\n\n# Get Multiple Record Labels\n\n**Web Service Endpoint**\n\nFetch one or more record labels by using their identifiers.\n\n## Discussion\n\nIf successful, the HTTP status code is 200 (OK) and the `data` array contains the requested resource object. If unsuccessful, the HTTP status code indicates the error and the details are in the `errors` array. For more information, see [doc:\/\/com.apple.applemusicapi\/documentation\/AppleMusicAPI\/handling-requests-and-responses].\n\n### Example\n\n\n\n## Related Documentation\n\n- **RecordLabels**: A resource object that represents a record label.\n- **RecordLabelsResponse**: The response to a request for record labels.\n\n## Requesting Catalog Record Labels\n\n- **Get a Catalog Record Label**: Fetch a record label by using its identifier.\n- **Get a Catalog Record Label’s Relationship View Directly by Name**: Fetch related resources for a single record label’s relationship view.\n\n",
  "sections" : [
    {
      "content" : "",
      "items" : [
        {
          "description" : "A resource object that represents a record label.",
          "name" : "RecordLabels",
          "url" : "https:\/\/developer.apple.com\/documentation\/AppleMusicAPI\/RecordLabels"
        },
        {
          "description" : "The response to a request for record labels.",
          "name" : "RecordLabelsResponse",
          "url" : "https:\/\/developer.apple.com\/documentation\/AppleMusicAPI\/RecordLabelsResponse"
        }
      ],
      "title" : "Related Documentation"
    },
    {
      "content" : "",
      "items" : [
        {
          "description" : "Fetch a record label by using its identifier.",
          "name" : "Get a Catalog Record Label",
          "url" : "https:\/\/developer.apple.com\/documentation\/AppleMusicAPI\/Get-a-Record-Label"
        },
        {
          "description" : "Fetch related resources for a single record label’s relationship view.",
          "name" : "Get a Catalog Record Label’s Relationship View Directly by Name",
          "url" : "https:\/\/developer.apple.com\/documentation\/AppleMusicAPI\/Fetch-a-view-on-this-resource-by-name-5uhxd"
        }
      ],
      "title" : "Requesting Catalog Record Labels"
    }
  ],
  "source" : "appleJSON",
  "title" : "Get Multiple Record Labels",
  "url" : "https:\/\/developer.apple.com\/documentation\/AppleMusicAPI\/Get-Multiple-Record-Labels"
}