{
  "abstract" : "Fetch a curator by using the curator’s identifier.",
  "codeExamples" : [

  ],
  "contentHash" : "690aa636f0e8187b80e331f1f9c1c13612d27ec59da7097eb98919a8fce4fca1",
  "crawledAt" : "2025-12-05T18:49:13Z",
  "id" : "7B029CFC-8980-4B0D-A16E-D058CB587E8A",
  "kind" : "unknown",
  "language" : "data",
  "module" : "Apple Music API",
  "overview" : "## Discussion\n\nIf successful, the HTTP status code is 200 (OK) and the `data` array contains a single `Curator` object. If unsuccessful, the HTTP status code indicates the error and the details are in the `errors` array. For more information, see [doc:\/\/com.apple.applemusicapi\/documentation\/AppleMusicAPI\/handling-requests-and-responses].\n\n### Example",
  "rawMarkdown" : "---\nsource: https:\/\/developer.apple.com\/documentation\/AppleMusicAPI\/Get-a-Catalog-Curator\ncrawled: 2025-12-05T18:49:13Z\n---\n\n# Get a Catalog Curator\n\n**Web Service Endpoint**\n\nFetch a curator by using the curator’s identifier.\n\n## Discussion\n\nIf successful, the HTTP status code is 200 (OK) and the `data` array contains a single `Curator` object. If unsuccessful, the HTTP status code indicates the error and the details are in the `errors` array. For more information, see [doc:\/\/com.apple.applemusicapi\/documentation\/AppleMusicAPI\/handling-requests-and-responses].\n\n### Example\n\n\n\n## Related Documentation\n\n- **Curators**: A resource object that represents a curator.\n- **CuratorsResponse**: The response to a request for curators.\n\n## Requesting Catalog Curators\n\n- **Get a Catalog Curator's Relationship Directly by Name**: Fetch a curator’s relationship by using its identifier.\n- **Get Multiple Catalog Curators**: Fetch one or more curators by using their identifiers.\n\n",
  "sections" : [
    {
      "content" : "",
      "items" : [
        {
          "description" : "A resource object that represents a curator.",
          "name" : "Curators",
          "url" : "https:\/\/developer.apple.com\/documentation\/AppleMusicAPI\/Curators"
        },
        {
          "description" : "The response to a request for curators.",
          "name" : "CuratorsResponse",
          "url" : "https:\/\/developer.apple.com\/documentation\/AppleMusicAPI\/CuratorsResponse"
        }
      ],
      "title" : "Related Documentation"
    },
    {
      "content" : "",
      "items" : [
        {
          "description" : "Fetch a curator’s relationship by using its identifier.",
          "name" : "Get a Catalog Curator's Relationship Directly by Name",
          "url" : "https:\/\/developer.apple.com\/documentation\/AppleMusicAPI\/Fetch-a-relationship-on-this-resource-by-name-1091z"
        },
        {
          "description" : "Fetch one or more curators by using their identifiers.",
          "name" : "Get Multiple Catalog Curators",
          "url" : "https:\/\/developer.apple.com\/documentation\/AppleMusicAPI\/Get-Multiple-Catalog-Curators"
        }
      ],
      "title" : "Requesting Catalog Curators"
    }
  ],
  "source" : "appleJSON",
  "title" : "Get a Catalog Curator",
  "url" : "https:\/\/developer.apple.com\/documentation\/AppleMusicAPI\/Get-a-Catalog-Curator"
}