{
  "abstract" : "Fetch related resources for a single record label’s relationship view.",
  "codeExamples" : [

  ],
  "contentHash" : "01040f516b527bf4d3065a9ef42b4f2139e90d06893c61820c0a4f8cbda1e753",
  "crawledAt" : "2025-12-05T17:18:09Z",
  "id" : "8DF4FCEC-7B70-45AA-B91C-E26B4E55AA31",
  "kind" : "unknown",
  "language" : "data",
  "module" : "Apple Music API",
  "overview" : "## Discussion\n\nIf successful, the HTTP status code is 200 (OK) and the `data` array contains a single [doc:\/\/com.apple.applemusicapi\/documentation\/AppleMusicAPI\/RecordLabels\/Views-data.dictionary] object. If unsuccessful, the HTTP status code indicates the error and the details are in the `errors` array. For more information, see [doc:\/\/com.apple.applemusicapi\/documentation\/AppleMusicAPI\/handling-requests-and-responses].\n\n### Example",
  "rawMarkdown" : "---\nsource: https:\/\/developer.apple.com\/documentation\/AppleMusicAPI\/Fetch-a-view-on-this-resource-by-name-5uhxd\ncrawled: 2025-12-05T17:18:09Z\n---\n\n# Get a Catalog Record Label’s Relationship View Directly by Name\n\n**Web Service Endpoint**\n\nFetch related resources for a single record label’s relationship view.\n\n## Discussion\n\nIf successful, the HTTP status code is 200 (OK) and the `data` array contains a single [doc:\/\/com.apple.applemusicapi\/documentation\/AppleMusicAPI\/RecordLabels\/Views-data.dictionary] object. If unsuccessful, the HTTP status code indicates the error and the details are in the `errors` array. For more information, see [doc:\/\/com.apple.applemusicapi\/documentation\/AppleMusicAPI\/handling-requests-and-responses].\n\n### Example\n\n\n\n## Related Documentation\n\n- **RecordLabels**: A resource object that represents a record label.\n- **RecordLabelsResponse**: The response to a request for record labels.\n\n## Requesting Catalog Record Labels\n\n- **Get a Catalog Record Label**: Fetch a record label by using its identifier.\n- **Get Multiple Record Labels**: Fetch one or more record labels by using their identifiers.\n\n",
  "sections" : [
    {
      "content" : "",
      "items" : [
        {
          "description" : "A resource object that represents a record label.",
          "name" : "RecordLabels",
          "url" : "https:\/\/developer.apple.com\/documentation\/AppleMusicAPI\/RecordLabels"
        },
        {
          "description" : "The response to a request for record labels.",
          "name" : "RecordLabelsResponse",
          "url" : "https:\/\/developer.apple.com\/documentation\/AppleMusicAPI\/RecordLabelsResponse"
        }
      ],
      "title" : "Related Documentation"
    },
    {
      "content" : "",
      "items" : [
        {
          "description" : "Fetch a record label by using its identifier.",
          "name" : "Get a Catalog Record Label",
          "url" : "https:\/\/developer.apple.com\/documentation\/AppleMusicAPI\/Get-a-Record-Label"
        },
        {
          "description" : "Fetch one or more record labels by using their identifiers.",
          "name" : "Get Multiple Record Labels",
          "url" : "https:\/\/developer.apple.com\/documentation\/AppleMusicAPI\/Get-Multiple-Record-Labels"
        }
      ],
      "title" : "Requesting Catalog Record Labels"
    }
  ],
  "source" : "appleJSON",
  "title" : "Get a Catalog Record Label’s Relationship View Directly by Name",
  "url" : "https:\/\/developer.apple.com\/documentation\/AppleMusicAPI\/Fetch-a-view-on-this-resource-by-name-5uhxd"
}