{
  "abstract" : "Fetch an Apple curator’s relationship by using its identifier.",
  "codeExamples" : [

  ],
  "contentHash" : "3f94ba6d670e06c56889233dda93342647a8a945ef69e214995b90e3b208bef0",
  "crawledAt" : "2025-12-05T17:18:03Z",
  "id" : "7726CBBA-CD86-46CC-B19F-CDE905CBC2B4",
  "kind" : "unknown",
  "language" : "data",
  "module" : "Apple Music API",
  "overview" : "## Discussion\n\nIf successful, the HTTP status code is 200 (OK) and the `data` array contains a single `AppleCurator.Relationships` object. If unsuccessful, the HTTP status code indicates the error and the details are in the `errors` array. For more information, see [doc:\/\/com.apple.applemusicapi\/documentation\/AppleMusicAPI\/handling-requests-and-responses].\n\n### Example",
  "rawMarkdown" : "---\nsource: https:\/\/developer.apple.com\/documentation\/AppleMusicAPI\/Fetch-a-relationship-on-this-resource-by-name-9aupk\ncrawled: 2025-12-05T17:18:03Z\n---\n\n# Get a Catalog Apple Curator's Relationship Directly by Name\n\n**Web Service Endpoint**\n\nFetch an Apple curator’s relationship by using its identifier.\n\n## Discussion\n\nIf successful, the HTTP status code is 200 (OK) and the `data` array contains a single `AppleCurator.Relationships` object. If unsuccessful, the HTTP status code indicates the error and the details are in the `errors` array. For more information, see [doc:\/\/com.apple.applemusicapi\/documentation\/AppleMusicAPI\/handling-requests-and-responses].\n\n### Example\n\n\n\n## Related Documentation\n\n- **AppleCurators**: A resource object that represents an Apple curator.\n- **AppleCuratorsResponse**: The response to a request for Apple curators.\n\n## Requesting Apple Curators\n\n- **Get a Catalog Apple Curator**: Fetch an Apple curator by using the curator’s identifier.\n- **Get Multiple Catalog Apple Curators**: Fetch one or more Apple curators by using their identifiers.\n\n",
  "sections" : [
    {
      "content" : "",
      "items" : [
        {
          "description" : "A resource object that represents an Apple curator.",
          "name" : "AppleCurators",
          "url" : "https:\/\/developer.apple.com\/documentation\/AppleMusicAPI\/AppleCurators"
        },
        {
          "description" : "The response to a request for Apple curators.",
          "name" : "AppleCuratorsResponse",
          "url" : "https:\/\/developer.apple.com\/documentation\/AppleMusicAPI\/AppleCuratorsResponse"
        }
      ],
      "title" : "Related Documentation"
    },
    {
      "content" : "",
      "items" : [
        {
          "description" : "Fetch an Apple curator by using the curator’s identifier.",
          "name" : "Get a Catalog Apple Curator",
          "url" : "https:\/\/developer.apple.com\/documentation\/AppleMusicAPI\/Get-a-Catalog-Apple-Curator"
        },
        {
          "description" : "Fetch one or more Apple curators by using their identifiers.",
          "name" : "Get Multiple Catalog Apple Curators",
          "url" : "https:\/\/developer.apple.com\/documentation\/AppleMusicAPI\/Get-Multiple-Catalog-Apple-Curators"
        }
      ],
      "title" : "Requesting Apple Curators"
    }
  ],
  "source" : "appleJSON",
  "title" : "Get a Catalog Apple Curator's Relationship Directly by Name",
  "url" : "https:\/\/developer.apple.com\/documentation\/AppleMusicAPI\/Fetch-a-relationship-on-this-resource-by-name-9aupk"
}