{
  "abstract" : "A notification that triggers when the contents of a database change.",
  "codeExamples" : [

  ],
  "conformsTo" : [
    "CVarArg",
    "CustomDebugStringConvertible",
    "CustomStringConvertible",
    "Equatable",
    "Hashable",
    "NSObjectProtocol",
    "Sendable",
    "SendableMetatype"
  ],
  "contentHash" : "df95c5ccb91e7b5e86bbd228e0ebf9ebf834d1fa603cde33bd2fd0dac6342adf",
  "crawledAt" : "2025-12-04T08:32:50Z",
  "declaration" : {
    "code" : "class CKDatabaseNotification",
    "language" : "swift"
  },
  "id" : "E3D68F4D-8E15-45F9-91CC-D0086C0B69F6",
  "kind" : "class",
  "language" : "swift",
  "module" : "CloudKit",
  "overview" : "## Overview\n\nDatabase subscriptions execute when changes happen in any of a database’s record zones, for example, when CloudKit saves a new record. When the subscription registers a change, it sends push notifications to the user’s devices to inform your app about the change. You can then fetch the changes and cache them on-device. When appropriate, CloudKit excludes the device where the change originates.\n\nYou configure a subscription’s notifications by setting it’s [doc:\/\/com.apple.cloudkit\/documentation\/CloudKit\/CKSubscription\/notificationInfo-swift.property] property. Do this before you save it to the server. A subscription generates either high-priority or medium-priority push notifications. CloudKit delivers medium-priority notifications to your app in the background. High-priority notifications are visual and the system displays them to the user. Visual notifications need the user’s permission. For more information, see [doc:\/\/com.apple.documentation\/documentation\/UserNotifications\/asking-permission-to-use-notifications].\n\nA subscription uses [doc:\/\/com.apple.cloudkit\/documentation\/CloudKit\/CKSubscription\/NotificationInfo-swift.class] to configure its notifications. For background delivery, set only its [doc:\/\/com.apple.cloudkit\/documentation\/CloudKit\/CKSubscription\/NotificationInfo-swift.class\/shouldSendContentAvailable] property to [doc:\/\/com.apple.documentation\/documentation\/Swift\/true]. If you set any other property, CloudKit treats the notification as high-priority.\n\nDon’t rely on push notifications for specific changes because the system can coalesce them. CloudKit can omit data to keep the notification’s payload size under the APNs size limit. Consider notifications an indication of remote changes. Use [doc:\/\/com.apple.cloudkit\/documentation\/CloudKit\/CKDatabaseNotification\/databaseScope] to determine which database has changes, and then [doc:\/\/com.apple.cloudkit\/documentation\/CloudKit\/CKFetchDatabaseChangesOperation] to fetch those changes. A notification’s [doc:\/\/com.apple.cloudkit\/documentation\/CloudKit\/CKNotification\/isPruned] property is [doc:\/\/com.apple.documentation\/documentation\/Swift\/true] if CloudKit omits data.\n\nYou don’t instantiate this class. Instead, implement [doc:\/\/com.apple.documentation\/documentation\/UIKit\/UIApplicationDelegate\/application(_:didReceiveRemoteNotification:fetchCompletionHandler:)] in your app delegate. Initialize [doc:\/\/com.apple.cloudkit\/documentation\/CloudKit\/CKNotification] with the `userInfo` dictionary that CloudKit passes to the method. This returns an instance of the appropriate subclass. Use the [doc:\/\/com.apple.cloudkit\/documentation\/CloudKit\/CKNotification\/notificationType-swift.property] property to determine the type. Then cast to that type to access type-specific properties and methods.",
  "platforms" : [
    "iOS",
    "iPadOS",
    "Mac Catalyst",
    "macOS",
    "tvOS",
    "visionOS",
    "watchOS"
  ],
  "rawMarkdown" : "---\nsource: https:\/\/developer.apple.com\/documentation\/CloudKit\/CKDatabaseNotification\ncrawled: 2025-12-04T08:32:50Z\n---\n\n# CKDatabaseNotification\n\n**Class**\n\nA notification that triggers when the contents of a database change.\n\n## Declaration\n\n```swift\nclass CKDatabaseNotification\n```\n\n## Overview\n\nDatabase subscriptions execute when changes happen in any of a database’s record zones, for example, when CloudKit saves a new record. When the subscription registers a change, it sends push notifications to the user’s devices to inform your app about the change. You can then fetch the changes and cache them on-device. When appropriate, CloudKit excludes the device where the change originates.\n\nYou configure a subscription’s notifications by setting it’s [doc:\/\/com.apple.cloudkit\/documentation\/CloudKit\/CKSubscription\/notificationInfo-swift.property] property. Do this before you save it to the server. A subscription generates either high-priority or medium-priority push notifications. CloudKit delivers medium-priority notifications to your app in the background. High-priority notifications are visual and the system displays them to the user. Visual notifications need the user’s permission. For more information, see [doc:\/\/com.apple.documentation\/documentation\/UserNotifications\/asking-permission-to-use-notifications].\n\nA subscription uses [doc:\/\/com.apple.cloudkit\/documentation\/CloudKit\/CKSubscription\/NotificationInfo-swift.class] to configure its notifications. For background delivery, set only its [doc:\/\/com.apple.cloudkit\/documentation\/CloudKit\/CKSubscription\/NotificationInfo-swift.class\/shouldSendContentAvailable] property to [doc:\/\/com.apple.documentation\/documentation\/Swift\/true]. If you set any other property, CloudKit treats the notification as high-priority.\n\n\n\nDon’t rely on push notifications for specific changes because the system can coalesce them. CloudKit can omit data to keep the notification’s payload size under the APNs size limit. Consider notifications an indication of remote changes. Use [doc:\/\/com.apple.cloudkit\/documentation\/CloudKit\/CKDatabaseNotification\/databaseScope] to determine which database has changes, and then [doc:\/\/com.apple.cloudkit\/documentation\/CloudKit\/CKFetchDatabaseChangesOperation] to fetch those changes. A notification’s [doc:\/\/com.apple.cloudkit\/documentation\/CloudKit\/CKNotification\/isPruned] property is [doc:\/\/com.apple.documentation\/documentation\/Swift\/true] if CloudKit omits data.\n\nYou don’t instantiate this class. Instead, implement [doc:\/\/com.apple.documentation\/documentation\/UIKit\/UIApplicationDelegate\/application(_:didReceiveRemoteNotification:fetchCompletionHandler:)] in your app delegate. Initialize [doc:\/\/com.apple.cloudkit\/documentation\/CloudKit\/CKNotification] with the `userInfo` dictionary that CloudKit passes to the method. This returns an instance of the appropriate subclass. Use the [doc:\/\/com.apple.cloudkit\/documentation\/CloudKit\/CKNotification\/notificationType-swift.property] property to determine the type. Then cast to that type to access type-specific properties and methods.\n\n## Getting the Database Scope\n\n- **databaseScope**: The type of database.\n\n## Database Changes\n\n- **CKDatabaseSubscription**: A subscription that generates push notifications when CloudKit modifies records in a database.\n- **CKFetchDatabaseChangesOperation**: An operation that fetches database changes.\n\n## Inherits From\n\n- CKNotification\n\n## Conforms To\n\n- CVarArg\n- CustomDebugStringConvertible\n- CustomStringConvertible\n- Equatable\n- Hashable\n- NSObjectProtocol\n- Sendable\n- SendableMetatype\n\n",
  "sections" : [
    {
      "content" : "",
      "items" : [
        {
          "description" : "The type of database.",
          "name" : "databaseScope",
          "url" : "https:\/\/developer.apple.com\/documentation\/CloudKit\/CKDatabaseNotification\/databaseScope"
        }
      ],
      "title" : "Getting the Database Scope"
    },
    {
      "content" : "",
      "items" : [
        {
          "description" : "A subscription that generates push notifications when CloudKit modifies records in a database.",
          "name" : "CKDatabaseSubscription",
          "url" : "https:\/\/developer.apple.com\/documentation\/CloudKit\/CKDatabaseSubscription"
        },
        {
          "description" : "An operation that fetches database changes.",
          "name" : "CKFetchDatabaseChangesOperation",
          "url" : "https:\/\/developer.apple.com\/documentation\/CloudKit\/CKFetchDatabaseChangesOperation"
        }
      ],
      "title" : "Database Changes"
    },
    {
      "content" : "",
      "items" : [
        {
          "name" : "CKNotification"
        }
      ],
      "title" : "Inherits From"
    }
  ],
  "source" : "appleJSON",
  "title" : "CKDatabaseNotification",
  "url" : "https:\/\/developer.apple.com\/documentation\/CloudKit\/CKDatabaseNotification"
}