{
  "abstract" : "The abstract base class for CloudKit notifications.",
  "codeExamples" : [

  ],
  "conformsTo" : [
    "CVarArg",
    "CustomDebugStringConvertible",
    "CustomStringConvertible",
    "Equatable",
    "Hashable",
    "NSObjectProtocol",
    "Sendable",
    "SendableMetatype"
  ],
  "contentHash" : "1811f6d1468945caaa5d00dc634a7ca99b4e2c2ed03add3844596c690683dd92",
  "crawledAt" : "2025-12-04T10:03:29Z",
  "declaration" : {
    "code" : "class CKNotification",
    "language" : "swift"
  },
  "id" : "D2EC72C6-7242-43ED-A9FC-3B332B7F4995",
  "inheritedBy" : [
    "CKDatabaseNotification",
    "CKQueryNotification",
    "CKRecordZoneNotification"
  ],
  "kind" : "class",
  "language" : "swift",
  "module" : "CloudKit",
  "overview" : "## Overview\n\nUse subclasses of `CKNotification` to extract data from push notifications that the system receives, or to fetch a container’s previous push notifications. In both cases, the object indicates the changed data.\n\n`CKNotification` is an abstract class. When you create a notification from a payload dictionary, the [doc:\/\/com.apple.cloudkit\/documentation\/CloudKit\/CKNotification\/init(fromRemoteNotificationDictionary:)] method returns an instance of the appropriate subclass. Similarly, when you fetch notifications from a container, you receive instances of a concrete subclass. `CKNotification` provides information about the push notification and its method of delivery. Subclasses contain specific data that provides the changes.",
  "platforms" : [
    "iOS",
    "iPadOS",
    "Mac Catalyst",
    "macOS",
    "tvOS",
    "visionOS",
    "watchOS"
  ],
  "rawMarkdown" : "---\nsource: https:\/\/developer.apple.com\/documentation\/CloudKit\/CKNotification\ncrawled: 2025-12-04T10:03:29Z\n---\n\n# CKNotification\n\n**Class**\n\nThe abstract base class for CloudKit notifications.\n\n## Declaration\n\n```swift\nclass CKNotification\n```\n\n## Overview\n\nUse subclasses of `CKNotification` to extract data from push notifications that the system receives, or to fetch a container’s previous push notifications. In both cases, the object indicates the changed data.\n\n`CKNotification` is an abstract class. When you create a notification from a payload dictionary, the [doc:\/\/com.apple.cloudkit\/documentation\/CloudKit\/CKNotification\/init(fromRemoteNotificationDictionary:)] method returns an instance of the appropriate subclass. Similarly, when you fetch notifications from a container, you receive instances of a concrete subclass. `CKNotification` provides information about the push notification and its method of delivery. Subclasses contain specific data that provides the changes.\n\n## Creating a Notification\n\n- **init(fromRemoteNotificationDictionary:)**: Creates a new notification using the specified payload data.\n\n## Identifying the Notification\n\n- **notificationID**: The notification’s ID.\n- **CKNotification.ID**: An object that uniquely identifies a push notification that a container sends.\n- **notificationType**: The type of event that generates the notification.\n- **CKNotification.NotificationType**: Constants that indicate the type of event that generates the push notification.\n- **containerIdentifier**: The ID of the container with the content that triggers the notification.\n\n## Getting the Notification’s Status\n\n- **isPruned**: A Boolean value that indicates whether the system removes some push notification content before delivery.\n\n## Accessing the Notification Info\n\n- **alertBody**: The notification’s alert body.\n- **alertLocalizationKey**: The key that identifies the localized text for the alert body.\n- **alertLocalizationArgs**: The fields for building a notification’s alert.\n- **alertActionLocalizationKey**: The key that identifies the localized string for the notification’s action.\n- **alertLaunchImage**: The filename of an image to use as a launch image.\n- **soundName**: The name of the sound file to play when a notification arrives.\n- **badge**: The value that the app icon’s badge displays.\n- **category**: The name of the action group that corresponds to this notification.\n- **subscriptionID**: The ID of the subscription that triggers the notification.\n- **subscriptionOwnerUserRecordID**: The ID of the user record that creates the subscription that generates the push notification.\n- **title**: The notification’s title.\n- **titleLocalizationKey**: The key that identifies the localized string for the notification’s title.\n- **titleLocalizationArgs**: The fields for building a notification’s title.\n- **subtitle**: The notification’s subtitle.\n- **subtitleLocalizationKey**: The key that identifies the localized string for the notification’s subtitle.\n- **subtitleLocalizationArgs**: The fields for building a notification’s subtitle.\n\n## Base Objects\n\n- **CKSubscription**: An abstract base class for subscriptions.\n- **CKDatabaseOperation**: The abstract base class for operations that act upon databases in CloudKit.\n\n## Inherits From\n\n- NSObject\n\n## Inherited By\n\n- CKDatabaseNotification\n- CKQueryNotification\n- CKRecordZoneNotification\n\n## Conforms To\n\n- CVarArg\n- CustomDebugStringConvertible\n- CustomStringConvertible\n- Equatable\n- Hashable\n- NSObjectProtocol\n- Sendable\n- SendableMetatype\n\n",
  "sections" : [
    {
      "content" : "",
      "items" : [
        {
          "description" : "Creates a new notification using the specified payload data.",
          "name" : "init(fromRemoteNotificationDictionary:)",
          "url" : "https:\/\/developer.apple.com\/documentation\/CloudKit\/CKNotification\/init(fromRemoteNotificationDictionary:)"
        }
      ],
      "title" : "Creating a Notification"
    },
    {
      "content" : "",
      "items" : [
        {
          "description" : "The notification’s ID.",
          "name" : "notificationID",
          "url" : "https:\/\/developer.apple.com\/documentation\/CloudKit\/CKNotification\/notificationID"
        },
        {
          "description" : "An object that uniquely identifies a push notification that a container sends.",
          "name" : "CKNotification.ID",
          "url" : "https:\/\/developer.apple.com\/documentation\/CloudKit\/CKNotification\/ID"
        },
        {
          "description" : "The type of event that generates the notification.",
          "name" : "notificationType",
          "url" : "https:\/\/developer.apple.com\/documentation\/CloudKit\/CKNotification\/notificationType-swift.property"
        },
        {
          "description" : "Constants that indicate the type of event that generates the push notification.",
          "name" : "CKNotification.NotificationType",
          "url" : "https:\/\/developer.apple.com\/documentation\/CloudKit\/CKNotification\/NotificationType-swift.enum"
        },
        {
          "description" : "The ID of the container with the content that triggers the notification.",
          "name" : "containerIdentifier",
          "url" : "https:\/\/developer.apple.com\/documentation\/CloudKit\/CKNotification\/containerIdentifier"
        }
      ],
      "title" : "Identifying the Notification"
    },
    {
      "content" : "",
      "items" : [
        {
          "description" : "A Boolean value that indicates whether the system removes some push notification content before delivery.",
          "name" : "isPruned",
          "url" : "https:\/\/developer.apple.com\/documentation\/CloudKit\/CKNotification\/isPruned"
        }
      ],
      "title" : "Getting the Notification’s Status"
    },
    {
      "content" : "",
      "items" : [
        {
          "description" : "The notification’s alert body.",
          "name" : "alertBody",
          "url" : "https:\/\/developer.apple.com\/documentation\/CloudKit\/CKNotification\/alertBody"
        },
        {
          "description" : "The key that identifies the localized text for the alert body.",
          "name" : "alertLocalizationKey",
          "url" : "https:\/\/developer.apple.com\/documentation\/CloudKit\/CKNotification\/alertLocalizationKey"
        },
        {
          "description" : "The fields for building a notification’s alert.",
          "name" : "alertLocalizationArgs",
          "url" : "https:\/\/developer.apple.com\/documentation\/CloudKit\/CKNotification\/alertLocalizationArgs"
        },
        {
          "description" : "The key that identifies the localized string for the notification’s action.",
          "name" : "alertActionLocalizationKey",
          "url" : "https:\/\/developer.apple.com\/documentation\/CloudKit\/CKNotification\/alertActionLocalizationKey"
        },
        {
          "description" : "The filename of an image to use as a launch image.",
          "name" : "alertLaunchImage",
          "url" : "https:\/\/developer.apple.com\/documentation\/CloudKit\/CKNotification\/alertLaunchImage"
        },
        {
          "description" : "The name of the sound file to play when a notification arrives.",
          "name" : "soundName",
          "url" : "https:\/\/developer.apple.com\/documentation\/CloudKit\/CKNotification\/soundName"
        },
        {
          "description" : "The value that the app icon’s badge displays.",
          "name" : "badge",
          "url" : "https:\/\/developer.apple.com\/documentation\/CloudKit\/CKNotification\/badge"
        },
        {
          "description" : "The name of the action group that corresponds to this notification.",
          "name" : "category",
          "url" : "https:\/\/developer.apple.com\/documentation\/CloudKit\/CKNotification\/category"
        },
        {
          "description" : "The ID of the subscription that triggers the notification.",
          "name" : "subscriptionID",
          "url" : "https:\/\/developer.apple.com\/documentation\/CloudKit\/CKNotification\/subscriptionID-16ygj"
        },
        {
          "description" : "The ID of the user record that creates the subscription that generates the push notification.",
          "name" : "subscriptionOwnerUserRecordID",
          "url" : "https:\/\/developer.apple.com\/documentation\/CloudKit\/CKNotification\/subscriptionOwnerUserRecordID"
        },
        {
          "description" : "The notification’s title.",
          "name" : "title",
          "url" : "https:\/\/developer.apple.com\/documentation\/CloudKit\/CKNotification\/title"
        },
        {
          "description" : "The key that identifies the localized string for the notification’s title.",
          "name" : "titleLocalizationKey",
          "url" : "https:\/\/developer.apple.com\/documentation\/CloudKit\/CKNotification\/titleLocalizationKey"
        },
        {
          "description" : "The fields for building a notification’s title.",
          "name" : "titleLocalizationArgs",
          "url" : "https:\/\/developer.apple.com\/documentation\/CloudKit\/CKNotification\/titleLocalizationArgs"
        },
        {
          "description" : "The notification’s subtitle.",
          "name" : "subtitle",
          "url" : "https:\/\/developer.apple.com\/documentation\/CloudKit\/CKNotification\/subtitle"
        },
        {
          "description" : "The key that identifies the localized string for the notification’s subtitle.",
          "name" : "subtitleLocalizationKey",
          "url" : "https:\/\/developer.apple.com\/documentation\/CloudKit\/CKNotification\/subtitleLocalizationKey"
        },
        {
          "description" : "The fields for building a notification’s subtitle.",
          "name" : "subtitleLocalizationArgs",
          "url" : "https:\/\/developer.apple.com\/documentation\/CloudKit\/CKNotification\/subtitleLocalizationArgs"
        }
      ],
      "title" : "Accessing the Notification Info"
    },
    {
      "content" : "",
      "items" : [
        {
          "description" : "An abstract base class for subscriptions.",
          "name" : "CKSubscription",
          "url" : "https:\/\/developer.apple.com\/documentation\/CloudKit\/CKSubscription"
        },
        {
          "description" : "The abstract base class for operations that act upon databases in CloudKit.",
          "name" : "CKDatabaseOperation",
          "url" : "https:\/\/developer.apple.com\/documentation\/CloudKit\/CKDatabaseOperation"
        }
      ],
      "title" : "Base Objects"
    },
    {
      "content" : "",
      "items" : [
        {
          "name" : "NSObject"
        }
      ],
      "title" : "Inherits From"
    }
  ],
  "source" : "appleJSON",
  "title" : "CKNotification",
  "url" : "https:\/\/developer.apple.com\/documentation\/CloudKit\/CKNotification"
}