{
  "abstract" : "An explicit association between two or more operations.",
  "codeExamples" : [

  ],
  "conformsTo" : [
    "CVarArg",
    "CustomDebugStringConvertible",
    "CustomStringConvertible",
    "Equatable",
    "Hashable",
    "NSCoding",
    "NSCopying",
    "NSObjectProtocol",
    "NSSecureCoding",
    "Sendable",
    "SendableMetatype"
  ],
  "contentHash" : "177630c4b507c4bc206575b907373f40446d4fa1aeb566c35ca60e8497606b46",
  "crawledAt" : "2025-12-04T20:44:34Z",
  "declaration" : {
    "code" : "class CKOperationGroup",
    "language" : "swift"
  },
  "id" : "217B2FBA-F6E7-4D0B-A19A-0CF24611A5CA",
  "kind" : "class",
  "language" : "swift",
  "module" : "CloudKit",
  "overview" : "## Overview\n\nIn certain situations, you might want to perform several CloudKit operations together. Grouping operations in CloudKit doesn’t ensure atomicity.\n\nFor example, when building a Calendar app, you group the following actions:\n\nAssociate operation groups with operations by setting their [doc:\/\/com.apple.cloudkit\/documentation\/CloudKit\/CKOperation\/group] property. Create a new operation group for each distinct user interaction.",
  "platforms" : [
    "iOS",
    "iPadOS",
    "Mac Catalyst",
    "macOS",
    "tvOS",
    "visionOS",
    "watchOS"
  ],
  "rawMarkdown" : "---\nsource: https:\/\/developer.apple.com\/documentation\/CloudKit\/CKOperationGroup\ncrawled: 2025-12-04T20:44:34Z\n---\n\n# CKOperationGroup\n\n**Class**\n\nAn explicit association between two or more operations.\n\n## Declaration\n\n```swift\nclass CKOperationGroup\n```\n\n## Overview\n\nIn certain situations, you might want to perform several CloudKit operations together. Grouping operations in CloudKit doesn’t ensure atomicity.\n\nFor example, when building a Calendar app, you group the following actions:\n\n- Fetch records from CloudKit, which consists of numerous queries that fetch both new records and records with changes.\n- Perform incremental fetches of records in response to a push notification.\n- Update several records when the user saves a calendar event.\n\nAssociate operation groups with operations by setting their [doc:\/\/com.apple.cloudkit\/documentation\/CloudKit\/CKOperation\/group] property. Create a new operation group for each distinct user interaction.\n\n## Creating an Operation Group\n\n- **init()**: Creates an operation group.\n- **init(coder:)**: Creates an operation group from a serialized instance.\n\n## Configuring an Operation Group\n\n- **defaultConfiguration**: The default configuration for operations in the group.\n- **expectedReceiveSize**: The estimated size of traffic to download from CloudKit.\n- **expectedSendSize**: The estimated size of traffic to upload to CloudKit.\n- **name**: The operation group’s name.\n- **operationGroupID**: The operation group’s unique identifier.\n- **quantity**: The number of operations in the operation group.\n- **CKOperationGroup.TransferSize**: Constants that represent possible data transfer sizes.\n\n## Core objects\n\n- **CKContainer**: A conduit to your app’s databases.\n- **CKDatabase**: An object that represents a collection of record zones and subscriptions.\n\n## Inherits From\n\n- NSObject\n\n## Conforms To\n\n- CVarArg\n- CustomDebugStringConvertible\n- CustomStringConvertible\n- Equatable\n- Hashable\n- NSCoding\n- NSCopying\n- NSObjectProtocol\n- NSSecureCoding\n- Sendable\n- SendableMetatype\n\n",
  "sections" : [
    {
      "content" : "",
      "items" : [
        {
          "description" : "Creates an operation group.",
          "name" : "init()",
          "url" : "https:\/\/developer.apple.com\/documentation\/CloudKit\/CKOperationGroup\/init()"
        },
        {
          "description" : "Creates an operation group from a serialized instance.",
          "name" : "init(coder:)",
          "url" : "https:\/\/developer.apple.com\/documentation\/CloudKit\/CKOperationGroup\/init(coder:)"
        }
      ],
      "title" : "Creating an Operation Group"
    },
    {
      "content" : "",
      "items" : [
        {
          "description" : "The default configuration for operations in the group.",
          "name" : "defaultConfiguration",
          "url" : "https:\/\/developer.apple.com\/documentation\/CloudKit\/CKOperationGroup\/defaultConfiguration"
        },
        {
          "description" : "The estimated size of traffic to download from CloudKit.",
          "name" : "expectedReceiveSize",
          "url" : "https:\/\/developer.apple.com\/documentation\/CloudKit\/CKOperationGroup\/expectedReceiveSize"
        },
        {
          "description" : "The estimated size of traffic to upload to CloudKit.",
          "name" : "expectedSendSize",
          "url" : "https:\/\/developer.apple.com\/documentation\/CloudKit\/CKOperationGroup\/expectedSendSize"
        },
        {
          "description" : "The operation group’s name.",
          "name" : "name",
          "url" : "https:\/\/developer.apple.com\/documentation\/CloudKit\/CKOperationGroup\/name"
        },
        {
          "description" : "The operation group’s unique identifier.",
          "name" : "operationGroupID",
          "url" : "https:\/\/developer.apple.com\/documentation\/CloudKit\/CKOperationGroup\/operationGroupID"
        },
        {
          "description" : "The number of operations in the operation group.",
          "name" : "quantity",
          "url" : "https:\/\/developer.apple.com\/documentation\/CloudKit\/CKOperationGroup\/quantity"
        },
        {
          "description" : "Constants that represent possible data transfer sizes.",
          "name" : "CKOperationGroup.TransferSize",
          "url" : "https:\/\/developer.apple.com\/documentation\/CloudKit\/CKOperationGroup\/TransferSize"
        }
      ],
      "title" : "Configuring an Operation Group"
    },
    {
      "content" : "",
      "items" : [
        {
          "description" : "A conduit to your app’s databases.",
          "name" : "CKContainer",
          "url" : "https:\/\/developer.apple.com\/documentation\/CloudKit\/CKContainer"
        },
        {
          "description" : "An object that represents a collection of record zones and subscriptions.",
          "name" : "CKDatabase",
          "url" : "https:\/\/developer.apple.com\/documentation\/CloudKit\/CKDatabase"
        }
      ],
      "title" : "Core objects"
    },
    {
      "content" : "",
      "items" : [
        {
          "name" : "NSObject"
        }
      ],
      "title" : "Inherits From"
    }
  ],
  "source" : "appleJSON",
  "title" : "CKOperationGroup",
  "url" : "https:\/\/developer.apple.com\/documentation\/CloudKit\/CKOperationGroup"
}