{
  "abstract" : "An error that occurs when the user’s iCloud account is temporarily unavailable.",
  "codeExamples" : [

  ],
  "contentHash" : "da40cc76ed73a174d128650fa60902c4b398ebb93c20c30148f76eab22cfe1fd",
  "crawledAt" : "2025-12-06T05:40:27Z",
  "declaration" : {
    "code" : "case accountTemporarilyUnavailable",
    "language" : "swift"
  },
  "id" : "F74B4E69-16A5-41E6-ACF8-0956E189D3A9",
  "kind" : "unknown",
  "language" : "swift",
  "module" : "CloudKit",
  "overview" : "## Discussion\n\nYou receive this error when the user’s iCloud account is available, but isn’t ready to support CloudKit operations. Don’t delete any cached data and don’t enqueue any additional CloudKit operations.\n\nChecking the account status after the operation fails, assuming there are no other changes to the account’s status, returns [doc:\/\/com.apple.cloudkit\/documentation\/CloudKit\/CKAccountStatus\/temporarilyUnavailable]. Use the [doc:\/\/com.apple.documentation\/documentation\/Foundation\/NSNotification\/Name-swift.struct\/CKAccountChanged] notification to listen for future account status changes, and retry the operation after the status becomes [doc:\/\/com.apple.cloudkit\/documentation\/CloudKit\/CKAccountStatus\/available].",
  "platforms" : [
    "iOS",
    "iPadOS",
    "Mac Catalyst",
    "macOS",
    "tvOS",
    "visionOS",
    "watchOS"
  ],
  "rawMarkdown" : "---\nsource: https:\/\/developer.apple.com\/documentation\/CloudKit\/CKError\/Code\/accountTemporarilyUnavailable\ncrawled: 2025-12-06T05:40:27Z\n---\n\n# CKError.Code.accountTemporarilyUnavailable\n\n**Case**\n\nAn error that occurs when the user’s iCloud account is temporarily unavailable.\n\n## Declaration\n\n```swift\ncase accountTemporarilyUnavailable\n```\n\n## Discussion\n\nYou receive this error when the user’s iCloud account is available, but isn’t ready to support CloudKit operations. Don’t delete any cached data and don’t enqueue any additional CloudKit operations.\n\nChecking the account status after the operation fails, assuming there are no other changes to the account’s status, returns [doc:\/\/com.apple.cloudkit\/documentation\/CloudKit\/CKAccountStatus\/temporarilyUnavailable]. Use the [doc:\/\/com.apple.documentation\/documentation\/Foundation\/NSNotification\/Name-swift.struct\/CKAccountChanged] notification to listen for future account status changes, and retry the operation after the status becomes [doc:\/\/com.apple.cloudkit\/documentation\/CloudKit\/CKAccountStatus\/available].\n\n## Error Codes\n\n- **CKError.Code.alreadyShared**: An error that occurs when CloudKit attempts to share a record with an existing share.\n- **CKError.Code.assetFileModified**: An error that occurs when the system modifies an asset while saving it.\n- **CKError.Code.assetFileNotFound**: An error that occurs when the system can’t find the specified asset.\n- **CKError.Code.assetNotAvailable**: An error that occurs when the system can’t access the specified asset.\n- **CKError.Code.badContainer**: An error that occurs when you use an unknown or unauthorized container.\n- **CKError.Code.badDatabase**: An error that occurs when the operation can’t complete for the specified database.\n- **CKError.Code.batchRequestFailed**: An error that occurs when the system rejects the entire batch of changes.\n- **CKError.Code.changeTokenExpired**: An error that occurs when the change token expires.\n- **CKError.Code.constraintViolation**: An error that occurs when the server rejects the request because of a unique constraint violation.\n- **CKError.Code.incompatibleVersion**: An error that occurs when the current app version is older than the oldest allowed version.\n- **CKError.Code.internalError**: A nonrecoverable error that CloudKit encounters.\n- **CKError.Code.invalidArguments**: An error that occurs when the request contains invalid information.\n- **CKError.Code.limitExceeded**: An error that occurs when a request’s size exceeds the limit.\n- **CKError.Code.managedAccountRestricted**: An error that occurs when CloudKit rejects a request due to a managed-account restriction.\n- **CKError.Code.missingEntitlement**: An error that occurs when the app is missing a required entitlement.\n\n",
  "sections" : [
    {
      "content" : "",
      "items" : [
        {
          "description" : "An error that occurs when CloudKit attempts to share a record with an existing share.",
          "name" : "CKError.Code.alreadyShared",
          "url" : "https:\/\/developer.apple.com\/documentation\/CloudKit\/CKError\/Code\/alreadyShared"
        },
        {
          "description" : "An error that occurs when the system modifies an asset while saving it.",
          "name" : "CKError.Code.assetFileModified",
          "url" : "https:\/\/developer.apple.com\/documentation\/CloudKit\/CKError\/Code\/assetFileModified"
        },
        {
          "description" : "An error that occurs when the system can’t find the specified asset.",
          "name" : "CKError.Code.assetFileNotFound",
          "url" : "https:\/\/developer.apple.com\/documentation\/CloudKit\/CKError\/Code\/assetFileNotFound"
        },
        {
          "description" : "An error that occurs when the system can’t access the specified asset.",
          "name" : "CKError.Code.assetNotAvailable",
          "url" : "https:\/\/developer.apple.com\/documentation\/CloudKit\/CKError\/Code\/assetNotAvailable"
        },
        {
          "description" : "An error that occurs when you use an unknown or unauthorized container.",
          "name" : "CKError.Code.badContainer",
          "url" : "https:\/\/developer.apple.com\/documentation\/CloudKit\/CKError\/Code\/badContainer"
        },
        {
          "description" : "An error that occurs when the operation can’t complete for the specified database.",
          "name" : "CKError.Code.badDatabase",
          "url" : "https:\/\/developer.apple.com\/documentation\/CloudKit\/CKError\/Code\/badDatabase"
        },
        {
          "description" : "An error that occurs when the system rejects the entire batch of changes.",
          "name" : "CKError.Code.batchRequestFailed",
          "url" : "https:\/\/developer.apple.com\/documentation\/CloudKit\/CKError\/Code\/batchRequestFailed"
        },
        {
          "description" : "An error that occurs when the change token expires.",
          "name" : "CKError.Code.changeTokenExpired",
          "url" : "https:\/\/developer.apple.com\/documentation\/CloudKit\/CKError\/Code\/changeTokenExpired"
        },
        {
          "description" : "An error that occurs when the server rejects the request because of a unique constraint violation.",
          "name" : "CKError.Code.constraintViolation",
          "url" : "https:\/\/developer.apple.com\/documentation\/CloudKit\/CKError\/Code\/constraintViolation"
        },
        {
          "description" : "An error that occurs when the current app version is older than the oldest allowed version.",
          "name" : "CKError.Code.incompatibleVersion",
          "url" : "https:\/\/developer.apple.com\/documentation\/CloudKit\/CKError\/Code\/incompatibleVersion"
        },
        {
          "description" : "A nonrecoverable error that CloudKit encounters.",
          "name" : "CKError.Code.internalError",
          "url" : "https:\/\/developer.apple.com\/documentation\/CloudKit\/CKError\/Code\/internalError"
        },
        {
          "description" : "An error that occurs when the request contains invalid information.",
          "name" : "CKError.Code.invalidArguments",
          "url" : "https:\/\/developer.apple.com\/documentation\/CloudKit\/CKError\/Code\/invalidArguments"
        },
        {
          "description" : "An error that occurs when a request’s size exceeds the limit.",
          "name" : "CKError.Code.limitExceeded",
          "url" : "https:\/\/developer.apple.com\/documentation\/CloudKit\/CKError\/Code\/limitExceeded"
        },
        {
          "description" : "An error that occurs when CloudKit rejects a request due to a managed-account restriction.",
          "name" : "CKError.Code.managedAccountRestricted",
          "url" : "https:\/\/developer.apple.com\/documentation\/CloudKit\/CKError\/Code\/managedAccountRestricted"
        },
        {
          "description" : "An error that occurs when the app is missing a required entitlement.",
          "name" : "CKError.Code.missingEntitlement",
          "url" : "https:\/\/developer.apple.com\/documentation\/CloudKit\/CKError\/Code\/missingEntitlement"
        }
      ],
      "title" : "Error Codes"
    }
  ],
  "source" : "appleJSON",
  "title" : "CKError.Code.accountTemporarilyUnavailable",
  "url" : "https:\/\/developer.apple.com\/documentation\/CloudKit\/CKError\/Code\/accountTemporarilyUnavailable"
}