{
  "abstract" : "Detects when a program reaches an unreachable point.",
  "codeExamples" : [
    {
      "code" : "switch (value_returning_function()) {\ncase ...:                  \/\/ Warning: if the cases are not exhaustive\ndefault:                   \/\/ __builtin_unreachable may be reached\n    __builtin_unreachable();\n}",
      "language" : "occ"
    }
  ],
  "contentHash" : "021fa334431cc68546490c5bc3e6c9ea09184a0d96d19a42eadc5d4ea98d6f4e",
  "crawledAt" : "2025-12-04T02:40:33Z",
  "id" : "5983030A-3955-4B45-9D5B-227B366DF3BC",
  "kind" : "article",
  "language" : "swift",
  "overview" : "## Overview\n\nUse this check to detect when control flow reaches an unreachable point in a program you create using  `__builtin_unreachable`, which may cause abrupt program termination. Available in Xcode 9 and later.\n\n### Executing unreachable code in C\n\nIf the `switch` statement fails to handle a value that a function returns, the program reaches  `__builtin_unreachable()`.\n\n#### Solution\n\nEnsure that `switch` statements and other control flow statements are exhaustive.",
  "rawMarkdown" : "---\nsource: https:\/\/developer.apple.com\/documentation\/Xcode\/reaching-of-unreachable-point\ncrawled: 2025-12-04T02:40:33Z\n---\n\n# Reaching of unreachable point\n\n**Article**\n\nDetects when a program reaches an unreachable point.\n\n## Overview\n\nUse this check to detect when control flow reaches an unreachable point in a program you create using  `__builtin_unreachable`, which may cause abrupt program termination. Available in Xcode 9 and later.\n\n### Executing unreachable code in C\n\nIf the `switch` statement fails to handle a value that a function returns, the program reaches  `__builtin_unreachable()`.\n\n```occ\nswitch (value_returning_function()) {\ncase ...:                  \/\/ Warning: if the cases are not exhaustive\ndefault:                   \/\/ __builtin_unreachable may be reached\n    __builtin_unreachable();\n}\n```\n\n#### Solution\n\nEnsure that `switch` statements and other control flow statements are exhaustive.\n\n## Undefined Behavior Sanitizer\n\n- **Misaligned pointer**: Detects when code accesses a misaligned pointer or creates a misaligned reference.\n- **Invalid Boolean value**: Detects when a program accesses a Boolean variable and its value isn’t true or false.\n- **Out-of-bounds array access**: Detects out-of-bounds access of arrays.\n- **Invalid enumeration value**: Detects when an enumeration variable has an invalid value.\n- **Dynamic type violation**: Detects when an object has the wrong dynamic type.\n- **Invalid float cast**: Detects out-of-range casts to, from, or between floating-point types.\n- **Division by zero**: Detects division where the divisor is zero.\n- **Nonnull argument violation**: Detects when an argument incorrectly receives a null value.\n- **Nonnull return value violation**: Detects when a function incorrectly returns null.\n- **Nonnull variable assignment violation**: Detects when you incorrectly assign null to a variable.\n- **Null reference creation and null pointer dereference**: Detects the creation of null references and null pointer dereferences.\n- **Invalid object size**: Detects invalid pointer casts due to differences in the sizes of types.\n- **Invalid shift**: Detects invalid and overflowing shifts.\n- **Integer overflow**: Detects overflow in arithmetic.\n- **Invalid variable-length array**: Detects negative array bounds.\n\n",
  "sections" : [
    {
      "content" : "",
      "items" : [
        {
          "description" : "Detects when code accesses a misaligned pointer or creates a misaligned reference.",
          "name" : "Misaligned pointer",
          "url" : "https:\/\/developer.apple.com\/documentation\/Xcode\/misaligned-pointer"
        },
        {
          "description" : "Detects when a program accesses a Boolean variable and its value isn’t true or false.",
          "name" : "Invalid Boolean value",
          "url" : "https:\/\/developer.apple.com\/documentation\/Xcode\/invalid-boolean"
        },
        {
          "description" : "Detects out-of-bounds access of arrays.",
          "name" : "Out-of-bounds array access",
          "url" : "https:\/\/developer.apple.com\/documentation\/Xcode\/out-of-bounds-array-access"
        },
        {
          "description" : "Detects when an enumeration variable has an invalid value.",
          "name" : "Invalid enumeration value",
          "url" : "https:\/\/developer.apple.com\/documentation\/Xcode\/invalid-enumeration-value"
        },
        {
          "description" : "Detects when an object has the wrong dynamic type.",
          "name" : "Dynamic type violation",
          "url" : "https:\/\/developer.apple.com\/documentation\/Xcode\/dynamic-type-violation"
        },
        {
          "description" : "Detects out-of-range casts to, from, or between floating-point types.",
          "name" : "Invalid float cast",
          "url" : "https:\/\/developer.apple.com\/documentation\/Xcode\/invalid-float-cast"
        },
        {
          "description" : "Detects division where the divisor is zero.",
          "name" : "Division by zero",
          "url" : "https:\/\/developer.apple.com\/documentation\/Xcode\/division-by-zero"
        },
        {
          "description" : "Detects when an argument incorrectly receives a null value.",
          "name" : "Nonnull argument violation",
          "url" : "https:\/\/developer.apple.com\/documentation\/Xcode\/nonnull-argument-violation"
        },
        {
          "description" : "Detects when a function incorrectly returns null.",
          "name" : "Nonnull return value violation",
          "url" : "https:\/\/developer.apple.com\/documentation\/Xcode\/nonnull-return-value-violation"
        },
        {
          "description" : "Detects when you incorrectly assign null to a variable.",
          "name" : "Nonnull variable assignment violation",
          "url" : "https:\/\/developer.apple.com\/documentation\/Xcode\/nonnull-variable-assignment-violation"
        },
        {
          "description" : "Detects the creation of null references and null pointer dereferences.",
          "name" : "Null reference creation and null pointer dereference",
          "url" : "https:\/\/developer.apple.com\/documentation\/Xcode\/null-reference-creation-and-null-pointer-dereference"
        },
        {
          "description" : "Detects invalid pointer casts due to differences in the sizes of types.",
          "name" : "Invalid object size",
          "url" : "https:\/\/developer.apple.com\/documentation\/Xcode\/invalid-object-size"
        },
        {
          "description" : "Detects invalid and overflowing shifts.",
          "name" : "Invalid shift",
          "url" : "https:\/\/developer.apple.com\/documentation\/Xcode\/invalid-shift"
        },
        {
          "description" : "Detects overflow in arithmetic.",
          "name" : "Integer overflow",
          "url" : "https:\/\/developer.apple.com\/documentation\/Xcode\/integer-overflow"
        },
        {
          "description" : "Detects negative array bounds.",
          "name" : "Invalid variable-length array",
          "url" : "https:\/\/developer.apple.com\/documentation\/Xcode\/invalid-variable-length-array"
        }
      ],
      "title" : "Undefined Behavior Sanitizer"
    }
  ],
  "source" : "appleJSON",
  "title" : "Reaching of unreachable point",
  "url" : "https:\/\/developer.apple.com\/documentation\/Xcode\/reaching-of-unreachable-point"
}