{
  "abstract" : "Adopt more power-efficient strategies to prolong the device’s battery life.",
  "codeExamples" : [

  ],
  "contentHash" : "b5ec1ff6b0700564e917ebdad8dbff29894028b8d778162db756dd4748ec0de6",
  "crawledAt" : "2025-12-02T05:43:00Z",
  "id" : "107DEF09-B63E-4947-A030-FFC232EE9D44",
  "kind" : "article",
  "overview" : "## Overview\n\nCertain situations cause a device to reduce the amount of work it does and the amount of power it uses. People who want to increase the time before their device needs charging can turn on Low Power Mode. When a device is in Low Power Mode, the system enacts energy-saving measures, including reducing animations, and increasing the time between certain power-consuming actions like fetching data over the network.\n\nAdditionally, if the system detects that the temperature is too high, it reduces the amount of power it uses until the temperature decreases.\n\nRegister for system notifications about power- and thermal-state changes so you can take steps to help the system conserve energy and reduce its temperature.\n\n### Detect and react to power-state notifications\n\nIn your app, register for [doc:\/\/com.apple.documentation\/documentation\/Foundation\/NSNotification\/Name-swift.struct\/NSProcessInfoPowerStateDidChange] to discover when the device’s power state changes. When you receive the notification, query the value of [doc:\/\/com.apple.documentation\/documentation\/Foundation\/ProcessInfo\/isLowPowerModeEnabled] to determine if the system’s in Low Power Mode.\n\nIf Low Power Mode is active, take additional steps to help the system conserve energy, including:\n\n### Detect and react to thermal-state notifications\n\nIn your app, register for [doc:\/\/com.apple.documentation\/documentation\/Foundation\/ProcessInfo\/thermalStateDidChangeNotification] to discover when the device’s thermal state changes. When you receive the notification, adjust your app’s behavior according to the value of [doc:\/\/com.apple.documentation\/documentation\/Foundation\/ProcessInfo\/thermalState-swift.property]:",
  "rawMarkdown" : "---\nsource: https:\/\/developer.apple.com\/documentation\/Xcode\/responding-to-power-notifications\ncrawled: 2025-12-02T05:43:00Z\n---\n\n# Responding to power notifications\n\n**Article**\n\nAdopt more power-efficient strategies to prolong the device’s battery life.\n\n## Overview\n\nCertain situations cause a device to reduce the amount of work it does and the amount of power it uses. People who want to increase the time before their device needs charging can turn on Low Power Mode. When a device is in Low Power Mode, the system enacts energy-saving measures, including reducing animations, and increasing the time between certain power-consuming actions like fetching data over the network.\n\nAdditionally, if the system detects that the temperature is too high, it reduces the amount of power it uses until the temperature decreases.\n\nRegister for system notifications about power- and thermal-state changes so you can take steps to help the system conserve energy and reduce its temperature.\n\n### Detect and react to power-state notifications\n\nIn your app, register for [doc:\/\/com.apple.documentation\/documentation\/Foundation\/NSNotification\/Name-swift.struct\/NSProcessInfoPowerStateDidChange] to discover when the device’s power state changes. When you receive the notification, query the value of [doc:\/\/com.apple.documentation\/documentation\/Foundation\/ProcessInfo\/isLowPowerModeEnabled] to determine if the system’s in Low Power Mode.\n\nIf Low Power Mode is active, take additional steps to help the system conserve energy, including:\n\n- Pausing any optional activities\n- Reducing display updates\n- Minimizing animations\n- Reducing the frequency of network connections\n- Stopping location updates\n\n### Detect and react to thermal-state notifications\n\nIn your app, register for [doc:\/\/com.apple.documentation\/documentation\/Foundation\/ProcessInfo\/thermalStateDidChangeNotification] to discover when the device’s thermal state changes. When you receive the notification, adjust your app’s behavior according to the value of [doc:\/\/com.apple.documentation\/documentation\/Foundation\/ProcessInfo\/thermalState-swift.property]:\n\n\n\n## Essentials\n\n- **Scheduling CPU work efficiently**: Use concurrent programming and adjust the prioritization of background activities to improve the performance of your app.\n\n",
  "sections" : [
    {
      "content" : "",
      "items" : [
        {
          "description" : "Use concurrent programming and adjust the prioritization of background activities to improve the performance of your app.",
          "name" : "Scheduling CPU work efficiently",
          "url" : "https:\/\/developer.apple.com\/documentation\/Xcode\/scheduling-cpu-work-efficiently"
        }
      ],
      "title" : "Essentials"
    }
  ],
  "source" : "appleJSON",
  "title" : "Responding to power notifications",
  "url" : "https:\/\/developer.apple.com\/documentation\/Xcode\/responding-to-power-notifications"
}