{
  "abstract" : "Detects attempts to free nonallocated memory.",
  "codeExamples" : [
    {
      "code" : "int value = 42;\nfree(&value); \/\/ Error: free called on stack allocated variable",
      "language" : "occ"
    }
  ],
  "contentHash" : "cd00538bdef9bb2a7274afca9b4bfc2d15ce90214245f939323ea0153d1a89b4",
  "crawledAt" : "2025-12-02T06:10:55Z",
  "id" : "96A36F80-4B67-4F4B-893B-8CBCECB9EC16",
  "kind" : "article",
  "overview" : "## Overview\n\nUse this check to detect when you call `free` on memory that you don’t allocate using `malloc`. Attempting to deallocate nonallocated memory can result in a crash. Available in Xcode 7 and later.\n\n### Deallocation of a stack variable in C\n\nIn the following example, the `value` variable allocates on the stack, and deallocates when the function exits, so calling `free` on it is incorrect:\n\n#### Solution\n\nDon’t call the `free` function on variables that you allocate on the stack.",
  "rawMarkdown" : "---\nsource: https:\/\/developer.apple.com\/documentation\/Xcode\/deallocation-of-nonallocated-memory\ncrawled: 2025-12-02T06:10:55Z\n---\n\n# Deallocation of nonallocated memory\n\n**Article**\n\nDetects attempts to free nonallocated memory.\n\n## Overview\n\nUse this check to detect when you call `free` on memory that you don’t allocate using `malloc`. Attempting to deallocate nonallocated memory can result in a crash. Available in Xcode 7 and later.\n\n### Deallocation of a stack variable in C\n\nIn the following example, the `value` variable allocates on the stack, and deallocates when the function exits, so calling `free` on it is incorrect:\n\n```occ\nint value = 42;\nfree(&value); \/\/ Error: free called on stack allocated variable\n```\n\n#### Solution\n\nDon’t call the `free` function on variables that you allocate on the stack.\n\n## Address Sanitizer\n\n- **Use of deallocated memory**: Detects the use of deallocated memory.\n- **Deallocation of deallocated memory**: Detects attempts to free deallocated memory.\n- **Use of stack memory after function return**: Detects when you access stack variable memory after its declaring function returns.\n- **Use of out-of-scope stack memory**: Detects access to variables outside of their declared scope.\n- **Overflow and underflow of buffers**: Detects when you access memory outside of a buffer’s boundaries.\n- **Overflow of C++ containers**: Detects when you access a C++ container outside its bounds.\n\n",
  "sections" : [
    {
      "content" : "",
      "items" : [
        {
          "description" : "Detects the use of deallocated memory.",
          "name" : "Use of deallocated memory",
          "url" : "https:\/\/developer.apple.com\/documentation\/Xcode\/use-of-deallocated-memory"
        },
        {
          "description" : "Detects attempts to free deallocated memory.",
          "name" : "Deallocation of deallocated memory",
          "url" : "https:\/\/developer.apple.com\/documentation\/Xcode\/deallocation-of-deallocated-memory"
        },
        {
          "description" : "Detects when you access stack variable memory after its declaring function returns.",
          "name" : "Use of stack memory after function return",
          "url" : "https:\/\/developer.apple.com\/documentation\/Xcode\/use-of-stack-memory-after-function-return"
        },
        {
          "description" : "Detects access to variables outside of their declared scope.",
          "name" : "Use of out-of-scope stack memory",
          "url" : "https:\/\/developer.apple.com\/documentation\/Xcode\/use-of-out-of-scope-stack-memory"
        },
        {
          "description" : "Detects when you access memory outside of a buffer’s boundaries.",
          "name" : "Overflow and underflow of buffers",
          "url" : "https:\/\/developer.apple.com\/documentation\/Xcode\/overflow-and-underflow-of-buffers"
        },
        {
          "description" : "Detects when you access a C++ container outside its bounds.",
          "name" : "Overflow of C++ containers",
          "url" : "https:\/\/developer.apple.com\/documentation\/Xcode\/overflow-of-c-containers"
        }
      ],
      "title" : "Address Sanitizer"
    }
  ],
  "source" : "appleJSON",
  "title" : "Deallocation of nonallocated memory",
  "url" : "https:\/\/developer.apple.com\/documentation\/Xcode\/deallocation-of-nonallocated-memory"
}