{
  "abstract" : "Use command-line tools that require you to install Xcode and set the app as the active developer directory.",
  "codeExamples" : [

  ],
  "contentHash" : "716883376a9ad58a306884f6e48f5df4b0845379118dd6f5678f84405c2d3bb2",
  "crawledAt" : "2025-12-04T02:40:15Z",
  "id" : "DC07F1E2-2E5D-4C60-A73A-02BE8C0C2A25",
  "kind" : "article",
  "language" : "swift",
  "overview" : "## Overview\n\nXcode includes a set of command-line tools that only ship with the app, such as `devicectl`, `simctl`, and `xcodebuild`. You must install and set Xcode as the active developer directory before you can invoke these commands in Terminal.\n\n### Automate build and version numbers\n\n### Build a project\n\n### Debug a project\n\n### Edit files\n\n### Identify and merge changes\n\n### Inspect result bundles\n\n### Manage Instruments files\n\n### Manage scripting definition\n\n### Manage the interface\n\n### Manage the Simulator",
  "rawMarkdown" : "---\nsource: https:\/\/developer.apple.com\/documentation\/Xcode\/xcode-command-line-tool-reference\ncrawled: 2025-12-04T02:40:15Z\n---\n\n# Xcode command-line tool reference\n\n**Article**\n\nUse command-line tools that require you to install Xcode and set the app as the active developer directory.\n\n## Overview\n\nXcode includes a set of command-line tools that only ship with the app, such as `devicectl`, `simctl`, and `xcodebuild`. You must install and set Xcode as the active developer directory before you can invoke these commands in Terminal.\n\n\n\n### Automate build and version numbers\n\n\n\n### Build a project\n\n\n\n### Debug a project\n\n\n\n### Edit files\n\n\n\n### Identify and merge changes\n\n\n\n### Inspect result bundles\n\n\n\n### Manage Instruments files\n\n\n\n### Manage scripting definition\n\n\n\n### Manage the interface\n\n\n\n### Manage the Simulator\n\n\n\n## Essentials\n\n- **Installing the command-line tools**: Install command-line tools for Xcode using an installer package or the Terminal app.\n- **Configuring command-line tools settings**: Select the version of Xcode you want to use for command-line tools, in either Xcode settings or Terminal.\n\n",
  "sections" : [
    {
      "content" : "",
      "items" : [
        {
          "description" : "Install command-line tools for Xcode using an installer package or the Terminal app.",
          "name" : "Installing the command-line tools",
          "url" : "https:\/\/developer.apple.com\/documentation\/Xcode\/installing-the-command-line-tools"
        },
        {
          "description" : "Select the version of Xcode you want to use for command-line tools, in either Xcode settings or Terminal.",
          "name" : "Configuring command-line tools settings",
          "url" : "https:\/\/developer.apple.com\/documentation\/Xcode\/configuring-command-line-tools-settings"
        }
      ],
      "title" : "Essentials"
    }
  ],
  "source" : "appleJSON",
  "title" : "Xcode command-line tool reference",
  "url" : "https:\/\/developer.apple.com\/documentation\/Xcode\/xcode-command-line-tool-reference"
}