{
  "abstract" : "Detects when an argument incorrectly receives a null value.",
  "codeExamples" : [
    {
      "code" : "void has_nonnull_argument(__attribute__((nonnull)) int *p) { \n     \/\/ ... \n}\nhas_nonnull_argument(NULL); \/\/ Error: nonnull parameter attribute violation",
      "language" : "occ"
    },
    {
      "code" : "void has_nonnull_argument(int * _Nonnull p) { \n     \/\/ ... \n}\nhas_nonnull_argument(NULL); \/\/ Error: _Nonnull annotation violation",
      "language" : "occ"
    }
  ],
  "contentHash" : "c9fbbc0c9936ff3c3a3df6818a2d07cece762bed73e385b1d4890cb7141ae982",
  "crawledAt" : "2025-12-04T01:08:58Z",
  "id" : "4A1BAFD3-418A-4B6B-A1FB-10609DB478FA",
  "kind" : "article",
  "language" : "swift",
  "overview" : "## Overview\n\nUse this check to detect when a function that has an argument with the `nonnull` attribute or the `_Nonnull` annotation receives a null value. Available in Xcode 9 and later.\n\n### Violation of the nonnull parameter attribute in C\n\nIn the following example, the call to the `has_nonnull_argument` function breaks the `nonnull` attribute of the parameter `p`:\n\n#### Solution\n\nCorrect logic errors, or remove the `nonnull` attribute and rework the called function’s logic accordingly.\n\n### Violation of the nonnull annotation for an argument in C\n\nIn the following example, the call to the `has_nonnull_argument` function breaks the `_Nonnull` annotation of the parameter `p`:\n\n#### Solution\n\nCorrect logic errors, or remove the `_Nonnull` attribute and rework the called function’s logic accordingly.",
  "rawMarkdown" : "---\nsource: https:\/\/developer.apple.com\/documentation\/Xcode\/nonnull-argument-violation\ncrawled: 2025-12-04T01:08:58Z\n---\n\n# Nonnull argument violation\n\n**Article**\n\nDetects when an argument incorrectly receives a null value.\n\n## Overview\n\nUse this check to detect when a function that has an argument with the `nonnull` attribute or the `_Nonnull` annotation receives a null value. Available in Xcode 9 and later.\n\n\n\n### Violation of the nonnull parameter attribute in C\n\nIn the following example, the call to the `has_nonnull_argument` function breaks the `nonnull` attribute of the parameter `p`:\n\n```occ\nvoid has_nonnull_argument(__attribute__((nonnull)) int *p) { \n     \/\/ ... \n}\nhas_nonnull_argument(NULL); \/\/ Error: nonnull parameter attribute violation\n```\n\n#### Solution\n\nCorrect logic errors, or remove the `nonnull` attribute and rework the called function’s logic accordingly.\n\n### Violation of the nonnull annotation for an argument in C\n\nIn the following example, the call to the `has_nonnull_argument` function breaks the `_Nonnull` annotation of the parameter `p`:\n\n```occ\nvoid has_nonnull_argument(int * _Nonnull p) { \n     \/\/ ... \n}\nhas_nonnull_argument(NULL); \/\/ Error: _Nonnull annotation violation\n```\n\n#### Solution\n\nCorrect logic errors, or remove the `_Nonnull` attribute and rework the called function’s logic accordingly.\n\n## Undefined Behavior Sanitizer\n\n- **Misaligned pointer**: Detects when code accesses a misaligned pointer or creates a misaligned reference.\n- **Invalid Boolean value**: Detects when a program accesses a Boolean variable and its value isn’t true or false.\n- **Out-of-bounds array access**: Detects out-of-bounds access of arrays.\n- **Invalid enumeration value**: Detects when an enumeration variable has an invalid value.\n- **Reaching of unreachable point**: Detects when a program reaches an unreachable point.\n- **Dynamic type violation**: Detects when an object has the wrong dynamic type.\n- **Invalid float cast**: Detects out-of-range casts to, from, or between floating-point types.\n- **Division by zero**: Detects division where the divisor is zero.\n- **Nonnull return value violation**: Detects when a function incorrectly returns null.\n- **Nonnull variable assignment violation**: Detects when you incorrectly assign null to a variable.\n- **Null reference creation and null pointer dereference**: Detects the creation of null references and null pointer dereferences.\n- **Invalid object size**: Detects invalid pointer casts due to differences in the sizes of types.\n- **Invalid shift**: Detects invalid and overflowing shifts.\n- **Integer overflow**: Detects overflow in arithmetic.\n- **Invalid variable-length array**: Detects negative array bounds.\n\n",
  "sections" : [
    {
      "content" : "",
      "items" : [
        {
          "description" : "Detects when code accesses a misaligned pointer or creates a misaligned reference.",
          "name" : "Misaligned pointer",
          "url" : "https:\/\/developer.apple.com\/documentation\/Xcode\/misaligned-pointer"
        },
        {
          "description" : "Detects when a program accesses a Boolean variable and its value isn’t true or false.",
          "name" : "Invalid Boolean value",
          "url" : "https:\/\/developer.apple.com\/documentation\/Xcode\/invalid-boolean"
        },
        {
          "description" : "Detects out-of-bounds access of arrays.",
          "name" : "Out-of-bounds array access",
          "url" : "https:\/\/developer.apple.com\/documentation\/Xcode\/out-of-bounds-array-access"
        },
        {
          "description" : "Detects when an enumeration variable has an invalid value.",
          "name" : "Invalid enumeration value",
          "url" : "https:\/\/developer.apple.com\/documentation\/Xcode\/invalid-enumeration-value"
        },
        {
          "description" : "Detects when a program reaches an unreachable point.",
          "name" : "Reaching of unreachable point",
          "url" : "https:\/\/developer.apple.com\/documentation\/Xcode\/reaching-of-unreachable-point"
        },
        {
          "description" : "Detects when an object has the wrong dynamic type.",
          "name" : "Dynamic type violation",
          "url" : "https:\/\/developer.apple.com\/documentation\/Xcode\/dynamic-type-violation"
        },
        {
          "description" : "Detects out-of-range casts to, from, or between floating-point types.",
          "name" : "Invalid float cast",
          "url" : "https:\/\/developer.apple.com\/documentation\/Xcode\/invalid-float-cast"
        },
        {
          "description" : "Detects division where the divisor is zero.",
          "name" : "Division by zero",
          "url" : "https:\/\/developer.apple.com\/documentation\/Xcode\/division-by-zero"
        },
        {
          "description" : "Detects when a function incorrectly returns null.",
          "name" : "Nonnull return value violation",
          "url" : "https:\/\/developer.apple.com\/documentation\/Xcode\/nonnull-return-value-violation"
        },
        {
          "description" : "Detects when you incorrectly assign null to a variable.",
          "name" : "Nonnull variable assignment violation",
          "url" : "https:\/\/developer.apple.com\/documentation\/Xcode\/nonnull-variable-assignment-violation"
        },
        {
          "description" : "Detects the creation of null references and null pointer dereferences.",
          "name" : "Null reference creation and null pointer dereference",
          "url" : "https:\/\/developer.apple.com\/documentation\/Xcode\/null-reference-creation-and-null-pointer-dereference"
        },
        {
          "description" : "Detects invalid pointer casts due to differences in the sizes of types.",
          "name" : "Invalid object size",
          "url" : "https:\/\/developer.apple.com\/documentation\/Xcode\/invalid-object-size"
        },
        {
          "description" : "Detects invalid and overflowing shifts.",
          "name" : "Invalid shift",
          "url" : "https:\/\/developer.apple.com\/documentation\/Xcode\/invalid-shift"
        },
        {
          "description" : "Detects overflow in arithmetic.",
          "name" : "Integer overflow",
          "url" : "https:\/\/developer.apple.com\/documentation\/Xcode\/integer-overflow"
        },
        {
          "description" : "Detects negative array bounds.",
          "name" : "Invalid variable-length array",
          "url" : "https:\/\/developer.apple.com\/documentation\/Xcode\/invalid-variable-length-array"
        }
      ],
      "title" : "Undefined Behavior Sanitizer"
    }
  ],
  "source" : "appleJSON",
  "title" : "Nonnull argument violation",
  "url" : "https:\/\/developer.apple.com\/documentation\/Xcode\/nonnull-argument-violation"
}