{
  "abstract" : "Detects the creation of null references and null pointer dereferences.",
  "codeExamples" : [
    {
      "code" : "int &x = *(int *)nullptr; \/\/ Error: null reference",
      "language" : "occ"
    },
    {
      "code" : "int *x = nullptr; \/\/ Correct",
      "language" : "occ"
    },
    {
      "code" : "struct A {\n    int x;\n    int getX() {\n        if (!this) { \/\/ Warning: redundant null check may be removed\n            return 0;\n        }\n        return x; \/\/ Warning: 'this' pointer is null, but is dereferenced here\n    }\n};\nA *a = nullptr;\nint x = a->getX(); \/\/ Error: member access through null pointer",
      "language" : "occ"
    }
  ],
  "contentHash" : "2279903735a27e6d1e0d50fd0c40a79f95347d664af6d82c525ba2688d965f9d",
  "crawledAt" : "2025-12-02T06:11:10Z",
  "id" : "9BB27072-91D0-415A-BB7F-70FC842421AE",
  "kind" : "article",
  "overview" : "## Overview\n\nIn Xcode 9 and later, you can use this check to detect the creation of null references and null pointer dereferences. Dereferencing a null pointer always results in undefined behavior and can cause crashes. If the compiler finds a pointer dereference, it treats that pointer as nonnull. As a result, the optimizer may remove null equality checks for dereferenced pointers.\n\n### Creating a null reference in C++\n\nThe following example demonstrates how to create a null reference. References in C++ must be nonnull:\n\n#### Solution\n\nUse a pointer instead.\n\n### Member access through a null pointer in C++\n\nThe following code makes a member call on an object with a null address. The compiler may remove the null check on the `this` pointer because it requires the pointer to be `nonnull`.\n\n#### Solution\n\nAvoid calling methods on null objects.",
  "rawMarkdown" : "---\nsource: https:\/\/developer.apple.com\/documentation\/Xcode\/null-reference-creation-and-null-pointer-dereference\ncrawled: 2025-12-02T06:11:10Z\n---\n\n# Null reference creation and null pointer dereference\n\n**Article**\n\nDetects the creation of null references and null pointer dereferences.\n\n## Overview\n\nIn Xcode 9 and later, you can use this check to detect the creation of null references and null pointer dereferences. Dereferencing a null pointer always results in undefined behavior and can cause crashes. If the compiler finds a pointer dereference, it treats that pointer as nonnull. As a result, the optimizer may remove null equality checks for dereferenced pointers.\n\n### Creating a null reference in C++\n\nThe following example demonstrates how to create a null reference. References in C++ must be nonnull:\n\n```occ\nint &x = *(int *)nullptr; \/\/ Error: null reference\n```\n\n#### Solution\n\nUse a pointer instead.\n\n```occ\nint *x = nullptr; \/\/ Correct\n```\n\n### Member access through a null pointer in C++\n\nThe following code makes a member call on an object with a null address. The compiler may remove the null check on the `this` pointer because it requires the pointer to be `nonnull`.\n\n```occ\nstruct A {\n    int x;\n    int getX() {\n        if (!this) { \/\/ Warning: redundant null check may be removed\n            return 0;\n        }\n        return x; \/\/ Warning: 'this' pointer is null, but is dereferenced here\n    }\n};\nA *a = nullptr;\nint x = a->getX(); \/\/ Error: member access through null pointer\n```\n\n\n\n#### Solution\n\nAvoid calling methods on null objects.\n\n## Undefined Behavior Sanitizer\n\n- **Misaligned pointer**: Detects when code accesses a misaligned pointer or creates a misaligned reference.\n- **Invalid Boolean value**: Detects when a program accesses a Boolean variable and its value isn’t true or false.\n- **Out-of-bounds array access**: Detects out-of-bounds access of arrays.\n- **Invalid enumeration value**: Detects when an enumeration variable has an invalid value.\n- **Reaching of unreachable point**: Detects when a program reaches an unreachable point.\n- **Dynamic type violation**: Detects when an object has the wrong dynamic type.\n- **Invalid float cast**: Detects out-of-range casts to, from, or between floating-point types.\n- **Division by zero**: Detects division where the divisor is zero.\n- **Nonnull argument violation**: Detects when an argument incorrectly receives a null value.\n- **Nonnull return value violation**: Detects when a function incorrectly returns null.\n- **Nonnull variable assignment violation**: Detects when you incorrectly assign null to a variable.\n- **Invalid object size**: Detects invalid pointer casts due to differences in the sizes of types.\n- **Invalid shift**: Detects invalid and overflowing shifts.\n- **Integer overflow**: Detects overflow in arithmetic.\n- **Invalid variable-length array**: Detects negative array bounds.\n\n",
  "sections" : [
    {
      "content" : "",
      "items" : [
        {
          "description" : "Detects when code accesses a misaligned pointer or creates a misaligned reference.",
          "name" : "Misaligned pointer",
          "url" : "https:\/\/developer.apple.com\/documentation\/Xcode\/misaligned-pointer"
        },
        {
          "description" : "Detects when a program accesses a Boolean variable and its value isn’t true or false.",
          "name" : "Invalid Boolean value",
          "url" : "https:\/\/developer.apple.com\/documentation\/Xcode\/invalid-boolean"
        },
        {
          "description" : "Detects out-of-bounds access of arrays.",
          "name" : "Out-of-bounds array access",
          "url" : "https:\/\/developer.apple.com\/documentation\/Xcode\/out-of-bounds-array-access"
        },
        {
          "description" : "Detects when an enumeration variable has an invalid value.",
          "name" : "Invalid enumeration value",
          "url" : "https:\/\/developer.apple.com\/documentation\/Xcode\/invalid-enumeration-value"
        },
        {
          "description" : "Detects when a program reaches an unreachable point.",
          "name" : "Reaching of unreachable point",
          "url" : "https:\/\/developer.apple.com\/documentation\/Xcode\/reaching-of-unreachable-point"
        },
        {
          "description" : "Detects when an object has the wrong dynamic type.",
          "name" : "Dynamic type violation",
          "url" : "https:\/\/developer.apple.com\/documentation\/Xcode\/dynamic-type-violation"
        },
        {
          "description" : "Detects out-of-range casts to, from, or between floating-point types.",
          "name" : "Invalid float cast",
          "url" : "https:\/\/developer.apple.com\/documentation\/Xcode\/invalid-float-cast"
        },
        {
          "description" : "Detects division where the divisor is zero.",
          "name" : "Division by zero",
          "url" : "https:\/\/developer.apple.com\/documentation\/Xcode\/division-by-zero"
        },
        {
          "description" : "Detects when an argument incorrectly receives a null value.",
          "name" : "Nonnull argument violation",
          "url" : "https:\/\/developer.apple.com\/documentation\/Xcode\/nonnull-argument-violation"
        },
        {
          "description" : "Detects when a function incorrectly returns null.",
          "name" : "Nonnull return value violation",
          "url" : "https:\/\/developer.apple.com\/documentation\/Xcode\/nonnull-return-value-violation"
        },
        {
          "description" : "Detects when you incorrectly assign null to a variable.",
          "name" : "Nonnull variable assignment violation",
          "url" : "https:\/\/developer.apple.com\/documentation\/Xcode\/nonnull-variable-assignment-violation"
        },
        {
          "description" : "Detects invalid pointer casts due to differences in the sizes of types.",
          "name" : "Invalid object size",
          "url" : "https:\/\/developer.apple.com\/documentation\/Xcode\/invalid-object-size"
        },
        {
          "description" : "Detects invalid and overflowing shifts.",
          "name" : "Invalid shift",
          "url" : "https:\/\/developer.apple.com\/documentation\/Xcode\/invalid-shift"
        },
        {
          "description" : "Detects overflow in arithmetic.",
          "name" : "Integer overflow",
          "url" : "https:\/\/developer.apple.com\/documentation\/Xcode\/integer-overflow"
        },
        {
          "description" : "Detects negative array bounds.",
          "name" : "Invalid variable-length array",
          "url" : "https:\/\/developer.apple.com\/documentation\/Xcode\/invalid-variable-length-array"
        }
      ],
      "title" : "Undefined Behavior Sanitizer"
    }
  ],
  "source" : "appleJSON",
  "title" : "Null reference creation and null pointer dereference",
  "url" : "https:\/\/developer.apple.com\/documentation\/Xcode\/null-reference-creation-and-null-pointer-dereference"
}