{
  "abstract" : "Creates a field node that applies an electrical force proportional to the electrical charge of physics bodies.",
  "codeExamples" : [

  ],
  "contentHash" : "ef448f9b26b92b5967a9a161a18cb989bd4ef9723a0aaf9eb5a37db7ae9dc56d",
  "crawledAt" : "2025-12-08T01:06:06Z",
  "declaration" : {
    "code" : "@MainActor class func electricField() -> SKFieldNode",
    "language" : "swift"
  },
  "id" : "0B0DA855-D462-4BFE-BA1B-802EE27A3079",
  "kind" : "method",
  "language" : "swift",
  "module" : "SpriteKit",
  "overview" : "## Return Value\n\nA new electric field node.\n\n## Discussion\n\nThe force points toward the field node’s position and has a magnitude proportional to the field’s [doc:\/\/com.apple.spritekit\/documentation\/SpriteKit\/SKFieldNode\/strength] property and the physics body’s [doc:\/\/com.apple.spritekit\/documentation\/SpriteKit\/SKPhysicsBody\/charge] property. This field models the first part of the Lorentz equation:\n\n*F = qE*\n\nWhere *F* equals force, *q* equals charge, and *E* equals electric field.\n\nThe [doc:\/\/com.apple.spritekit\/documentation\/SpriteKit\/SKFieldNode\/falloff] property of an electrical field node is set by default to `2`.",
  "platforms" : [
    "iOS",
    "iPadOS",
    "Mac Catalyst",
    "macOS",
    "tvOS",
    "visionOS"
  ],
  "rawMarkdown" : "---\nsource: https:\/\/developer.apple.com\/documentation\/SpriteKit\/SKFieldNode\/electricField()\ncrawled: 2025-12-08T01:06:06Z\n---\n\n# electricField()\n\n**Type Method**\n\nCreates a field node that applies an electrical force proportional to the electrical charge of physics bodies.\n\n## Declaration\n\n```swift\n@MainActor class func electricField() -> SKFieldNode\n```\n\n```swift\nclass func electricField() -> SKFieldNode\n```\n\n## Return Value\n\nA new electric field node.\n\n## Discussion\n\nThe force points toward the field node’s position and has a magnitude proportional to the field’s [doc:\/\/com.apple.spritekit\/documentation\/SpriteKit\/SKFieldNode\/strength] property and the physics body’s [doc:\/\/com.apple.spritekit\/documentation\/SpriteKit\/SKPhysicsBody\/charge] property. This field models the first part of the Lorentz equation:\n\n*F = qE*\n\nWhere *F* equals force, *q* equals charge, and *E* equals electric field.\n\nThe [doc:\/\/com.apple.spritekit\/documentation\/SpriteKit\/SKFieldNode\/falloff] property of an electrical field node is set by default to `2`.\n\n## Creating Field Nodes\n\n- **dragField()**: Creates a field node that applies a force that resists the motion of physics bodies.\n- **linearGravityField(withVector:)**: Creates a field node that accelerates physics bodies in a specific direction.\n- **magneticField()**: Creates a field node that applies a magnetic force based on the velocity and electrical charge of the physics bodies.\n- **noiseField(withSmoothness:animationSpeed:)**: Creates a field node that applies a randomized acceleration to physics bodies.\n- **radialGravityField()**: Creates a field node that accelerates physics bodies toward the field node.\n- **springField()**: Creates a field node that applies a spring-like force that pulls physics bodies toward the field node.\n- **turbulenceField(withSmoothness:animationSpeed:)**: Creates a field node that applies a randomized acceleration to physics bodies.\n- **velocityField(with:)**: Creates a field node that sets the velocity of physics bodies that enter the node’s area based on the pixel values of a texture.\n- **velocityField(withVector:)**: Creates a field node that gives physics bodies a constant velocity.\n- **vortexField()**: Creates a field node that applies a perpendicular force to physics bodies.\n- **customField(evaluationBlock:)**: Creates a field node that calculates and applies a custom force to the physics body.\n- **SKFieldForceEvaluator**: The definition for a custom block that processes a single physics body’s interaction with the field.\n\n",
  "sections" : [
    {
      "content" : "",
      "items" : [
        {
          "description" : "Creates a field node that applies a force that resists the motion of physics bodies.",
          "name" : "dragField()",
          "url" : "https:\/\/developer.apple.com\/documentation\/SpriteKit\/SKFieldNode\/dragField()"
        },
        {
          "description" : "Creates a field node that accelerates physics bodies in a specific direction.",
          "name" : "linearGravityField(withVector:)",
          "url" : "https:\/\/developer.apple.com\/documentation\/SpriteKit\/SKFieldNode\/linearGravityField(withVector:)"
        },
        {
          "description" : "Creates a field node that applies a magnetic force based on the velocity and electrical charge of the physics bodies.",
          "name" : "magneticField()",
          "url" : "https:\/\/developer.apple.com\/documentation\/SpriteKit\/SKFieldNode\/magneticField()"
        },
        {
          "description" : "Creates a field node that applies a randomized acceleration to physics bodies.",
          "name" : "noiseField(withSmoothness:animationSpeed:)",
          "url" : "https:\/\/developer.apple.com\/documentation\/SpriteKit\/SKFieldNode\/noiseField(withSmoothness:animationSpeed:)"
        },
        {
          "description" : "Creates a field node that accelerates physics bodies toward the field node.",
          "name" : "radialGravityField()",
          "url" : "https:\/\/developer.apple.com\/documentation\/SpriteKit\/SKFieldNode\/radialGravityField()"
        },
        {
          "description" : "Creates a field node that applies a spring-like force that pulls physics bodies toward the field node.",
          "name" : "springField()",
          "url" : "https:\/\/developer.apple.com\/documentation\/SpriteKit\/SKFieldNode\/springField()"
        },
        {
          "description" : "Creates a field node that applies a randomized acceleration to physics bodies.",
          "name" : "turbulenceField(withSmoothness:animationSpeed:)",
          "url" : "https:\/\/developer.apple.com\/documentation\/SpriteKit\/SKFieldNode\/turbulenceField(withSmoothness:animationSpeed:)"
        },
        {
          "description" : "Creates a field node that sets the velocity of physics bodies that enter the node’s area based on the pixel values of a texture.",
          "name" : "velocityField(with:)",
          "url" : "https:\/\/developer.apple.com\/documentation\/SpriteKit\/SKFieldNode\/velocityField(with:)"
        },
        {
          "description" : "Creates a field node that gives physics bodies a constant velocity.",
          "name" : "velocityField(withVector:)",
          "url" : "https:\/\/developer.apple.com\/documentation\/SpriteKit\/SKFieldNode\/velocityField(withVector:)"
        },
        {
          "description" : "Creates a field node that applies a perpendicular force to physics bodies.",
          "name" : "vortexField()",
          "url" : "https:\/\/developer.apple.com\/documentation\/SpriteKit\/SKFieldNode\/vortexField()"
        },
        {
          "description" : "Creates a field node that calculates and applies a custom force to the physics body.",
          "name" : "customField(evaluationBlock:)",
          "url" : "https:\/\/developer.apple.com\/documentation\/SpriteKit\/SKFieldNode\/customField(evaluationBlock:)"
        },
        {
          "description" : "The definition for a custom block that processes a single physics body’s interaction with the field.",
          "name" : "SKFieldForceEvaluator",
          "url" : "https:\/\/developer.apple.com\/documentation\/SpriteKit\/SKFieldForceEvaluator"
        }
      ],
      "title" : "Creating Field Nodes"
    }
  ],
  "source" : "appleJSON",
  "title" : "electricField()",
  "url" : "https:\/\/developer.apple.com\/documentation\/SpriteKit\/SKFieldNode\/electricField()"
}