{
  "abstract" : "A node that allows its children to rotate in 3D.",
  "codeExamples" : [

  ],
  "conformsTo" : [
    "CVarArg",
    "CustomDebugStringConvertible",
    "CustomStringConvertible",
    "Equatable",
    "Hashable",
    "NSCoding",
    "NSCopying",
    "NSObjectProtocol",
    "NSSecureCoding",
    "NSStandardKeyBindingResponding",
    "NSTouchBarProvider",
    "NSUserActivityRestoring",
    "Sendable",
    "SendableMetatype",
    "UIActivityItemsConfigurationProviding",
    "UICoordinateSpace",
    "UIFocusEnvironment",
    "UIFocusItem",
    "UIFocusItemContainer",
    "UIPasteConfigurationSupporting",
    "UIResponderStandardEditActions",
    "UIUserActivityRestoring"
  ],
  "contentHash" : "ac959b3ca0a86c944bb89801075e373c3a723f3cf400d9ef55dd5eac3e8a5c30",
  "crawledAt" : "2025-12-05T22:34:19Z",
  "declaration" : {
    "code" : "@MainActor class SKTransformNode",
    "language" : "swift"
  },
  "id" : "CAF61BBD-246F-41CE-81B6-3D8EFCFFC2EE",
  "kind" : "class",
  "language" : "swift",
  "module" : "SpriteKit",
  "overview" : "## Overview\n\n`SKTranformNode` adds the ability to rotate nodes across the x and y axes. When combined with `SKNode`’s [doc:\/\/com.apple.spritekit\/documentation\/SpriteKit\/SKNode\/zRotation] property, nodes added as children to a transform node have the ability to rotate in 3D.",
  "platforms" : [
    "iOS",
    "iPadOS",
    "Mac Catalyst",
    "macOS",
    "tvOS",
    "visionOS"
  ],
  "rawMarkdown" : "---\nsource: https:\/\/developer.apple.com\/documentation\/SpriteKit\/SKTransformNode\ncrawled: 2025-12-05T22:34:19Z\n---\n\n# SKTransformNode\n\n**Class**\n\nA node that allows its children to rotate in 3D.\n\n## Declaration\n\n```swift\n@MainActor class SKTransformNode\n```\n\n```swift\nclass SKTransformNode\n```\n\n## Overview\n\n`SKTranformNode` adds the ability to rotate nodes across the x and y axes. When combined with `SKNode`’s [doc:\/\/com.apple.spritekit\/documentation\/SpriteKit\/SKNode\/zRotation] property, nodes added as children to a transform node have the ability to rotate in 3D.\n\n## Rotating Child Nodes\n\n- **xRotation**\n- **yRotation**\n- **setEulerAngles(_:)**\n- **setQuaternion(_:)**\n- **setRotationMatrix(_:)**\n\n## Reading the Current Rotation\n\n- **eulerAngles()**\n- **quaternion()**\n- **rotationMatrix()**\n\n## Nodes that Modify Drawing\n\n- **SKEffectNode**: A node that renders its children into a separate buffer, optionally applying an effect, before drawing the final result.\n- **SKCropNode**: A node that masks pixels drawn by its children so that only some pixels are seen.\n\n## Inherits From\n\n- SKNode\n\n## Conforms To\n\n- CVarArg\n- CustomDebugStringConvertible\n- CustomStringConvertible\n- Equatable\n- Hashable\n- NSCoding\n- NSCopying\n- NSObjectProtocol\n- NSSecureCoding\n- NSStandardKeyBindingResponding\n- NSTouchBarProvider\n- NSUserActivityRestoring\n- Sendable\n- SendableMetatype\n- UIActivityItemsConfigurationProviding\n- UICoordinateSpace\n- UIFocusEnvironment\n- UIFocusItem\n- UIFocusItemContainer\n- UIPasteConfigurationSupporting\n- UIResponderStandardEditActions\n- UIUserActivityRestoring\n\n",
  "sections" : [
    {
      "content" : "",
      "items" : [
        {
          "description" : "",
          "name" : "xRotation",
          "url" : "https:\/\/developer.apple.com\/documentation\/SpriteKit\/SKTransformNode\/xRotation"
        },
        {
          "description" : "",
          "name" : "yRotation",
          "url" : "https:\/\/developer.apple.com\/documentation\/SpriteKit\/SKTransformNode\/yRotation"
        },
        {
          "description" : "",
          "name" : "setEulerAngles(_:)",
          "url" : "https:\/\/developer.apple.com\/documentation\/SpriteKit\/SKTransformNode\/setEulerAngles(_:)"
        },
        {
          "description" : "",
          "name" : "setQuaternion(_:)",
          "url" : "https:\/\/developer.apple.com\/documentation\/SpriteKit\/SKTransformNode\/setQuaternion(_:)"
        },
        {
          "description" : "",
          "name" : "setRotationMatrix(_:)",
          "url" : "https:\/\/developer.apple.com\/documentation\/SpriteKit\/SKTransformNode\/setRotationMatrix(_:)"
        }
      ],
      "title" : "Rotating Child Nodes"
    },
    {
      "content" : "",
      "items" : [
        {
          "description" : "",
          "name" : "eulerAngles()",
          "url" : "https:\/\/developer.apple.com\/documentation\/SpriteKit\/SKTransformNode\/eulerAngles()"
        },
        {
          "description" : "",
          "name" : "quaternion()",
          "url" : "https:\/\/developer.apple.com\/documentation\/SpriteKit\/SKTransformNode\/quaternion()"
        },
        {
          "description" : "",
          "name" : "rotationMatrix()",
          "url" : "https:\/\/developer.apple.com\/documentation\/SpriteKit\/SKTransformNode\/rotationMatrix()"
        }
      ],
      "title" : "Reading the Current Rotation"
    },
    {
      "content" : "",
      "items" : [
        {
          "description" : "A node that renders its children into a separate buffer, optionally applying an effect, before drawing the final result.",
          "name" : "SKEffectNode",
          "url" : "https:\/\/developer.apple.com\/documentation\/SpriteKit\/SKEffectNode"
        },
        {
          "description" : "A node that masks pixels drawn by its children so that only some pixels are seen.",
          "name" : "SKCropNode",
          "url" : "https:\/\/developer.apple.com\/documentation\/SpriteKit\/SKCropNode"
        }
      ],
      "title" : "Nodes that Modify Drawing"
    },
    {
      "content" : "",
      "items" : [
        {
          "name" : "SKNode"
        }
      ],
      "title" : "Inherits From"
    }
  ],
  "source" : "appleJSON",
  "title" : "SKTransformNode",
  "url" : "https:\/\/developer.apple.com\/documentation\/SpriteKit\/SKTransformNode"
}