{
  "abstract" : "Display visual content using SpriteKit.",
  "codeExamples" : [
    {
      "code" : "let scene = SKScene(size: skView.bounds.size)\n\n\/\/ Set the scene coordinates (0, 0) to the center of the screen.\nscene.anchorPoint = CGPoint(x: 0.5, y: 0.5)",
      "language" : "swift"
    },
    {
      "code" : "let image = SKSpriteNode(imageNamed: \"myImage.png\")\n\n\/\/ Add the image to the scene.\nscene.addChild(image)\n",
      "language" : "swift"
    },
    {
      "code" : "if let skView = self.view as? SKView { \n    skView.presentScene(scene)\n}\n",
      "language" : "swift"
    }
  ],
  "contentHash" : "05ba804e9b74afe680221e13fad9fa7d6098967e937b72f7d8cbdf46cad2806c",
  "crawledAt" : "2025-12-05T22:33:00Z",
  "id" : "23CF5108-28B0-410F-9A1B-51B1BC412659",
  "kind" : "article",
  "language" : "swift",
  "module" : "SpriteKit",
  "overview" : "## Overview\n\nDisplay SpriteKit content on the screen by configuring a SpriteKit renderer, its scene, and the visual objects you lay out on top of the scene. SpriteKit provides objects that are designed specifically for various types of content (see [doc:\/\/com.apple.spritekit\/documentation\/SpriteKit\/nodes-for-scene-building]), but for simplicity, this article displays an image in a view.\n\n\n\nBecause the code in this article sets up a view, you put the lines from each of the following code listings into a view controller’s [doc:\/\/com.apple.documentation\/documentation\/UIKit\/UIViewController\/viewDidLoad()] function.\n\n### Create the Scene\n\nEverything displayed with SpriteKit is done through a scene object, which is an instance of [doc:\/\/com.apple.spritekit\/documentation\/SpriteKit\/SKScene]. Use the following code to set up a basic scene:\n\nWhen you pass the `size` of the view’s `bounds` to the scene initializer, you size the scene to the view’s size. When you set the scene’s [doc:\/\/com.apple.spritekit\/documentation\/SpriteKit\/SKScene\/anchorPoint] to `(0.5, 0.5)`, you determine that the coordinates (0, 0) map to the center of the view.\n\nFor further discussion about how setting the `anchorPoint` changes an object’s position in the view, see [https:\/\/developer.apple.com\/library\/archive\/documentation\/GraphicsAnimation\/Conceptual\/SpriteKit_PG\/Sprites\/Sprites.html#\/\/apple_ref\/doc\/uid\/TP40013043-CH9-SW36].\n\n### Lay Out Visual Content on Top of the Scene\n\nYou use node objects to display graphics in a SpriteKit view. SpriteKit provides different nodes depending on the content (see Nodes that Draw in  [doc:\/\/com.apple.spritekit\/documentation\/SpriteKit\/nodes-for-scene-building]). In this case, use an [doc:\/\/com.apple.spritekit\/documentation\/SpriteKit\/SKSpriteNode] to display an image in the view:\n\nThe functions to lay out content in a scene are covered in more detail in [doc:\/\/com.apple.spritekit\/documentation\/SpriteKit\/accessing-and-modifying-the-node-tree].\n\n### Present the Scene Inside a View\n\nAfter you set up the scene, you display it in the view by calling [doc:\/\/com.apple.spritekit\/documentation\/SpriteKit\/SKView\/presentScene(_:)]:\n\nBecause the code in this article sets up a view, you add it to your view controller’s [doc:\/\/com.apple.documentation\/documentation\/UIKit\/UIViewController\/viewDidLoad()] function.",
  "rawMarkdown" : "---\nsource: https:\/\/developer.apple.com\/documentation\/SpriteKit\/drawing-spritekit-content-in-a-view\ncrawled: 2025-12-05T22:33:00Z\n---\n\n# Drawing SpriteKit Content in a View\n\n**Article**\n\nDisplay visual content using SpriteKit.\n\n## Overview\n\nDisplay SpriteKit content on the screen by configuring a SpriteKit renderer, its scene, and the visual objects you lay out on top of the scene. SpriteKit provides objects that are designed specifically for various types of content (see [doc:\/\/com.apple.spritekit\/documentation\/SpriteKit\/nodes-for-scene-building]), but for simplicity, this article displays an image in a view.\n\n\n\n\n\nBecause the code in this article sets up a view, you put the lines from each of the following code listings into a view controller’s [doc:\/\/com.apple.documentation\/documentation\/UIKit\/UIViewController\/viewDidLoad()] function.\n\n### Create the Scene\n\nEverything displayed with SpriteKit is done through a scene object, which is an instance of [doc:\/\/com.apple.spritekit\/documentation\/SpriteKit\/SKScene]. Use the following code to set up a basic scene:\n\n```swift\nlet scene = SKScene(size: skView.bounds.size)\n\n\/\/ Set the scene coordinates (0, 0) to the center of the screen.\nscene.anchorPoint = CGPoint(x: 0.5, y: 0.5)\n```\n\nWhen you pass the `size` of the view’s `bounds` to the scene initializer, you size the scene to the view’s size. When you set the scene’s [doc:\/\/com.apple.spritekit\/documentation\/SpriteKit\/SKScene\/anchorPoint] to `(0.5, 0.5)`, you determine that the coordinates (0, 0) map to the center of the view.\n\nFor further discussion about how setting the `anchorPoint` changes an object’s position in the view, see [https:\/\/developer.apple.com\/library\/archive\/documentation\/GraphicsAnimation\/Conceptual\/SpriteKit_PG\/Sprites\/Sprites.html#\/\/apple_ref\/doc\/uid\/TP40013043-CH9-SW36].\n\n### Lay Out Visual Content on Top of the Scene\n\nYou use node objects to display graphics in a SpriteKit view. SpriteKit provides different nodes depending on the content (see Nodes that Draw in  [doc:\/\/com.apple.spritekit\/documentation\/SpriteKit\/nodes-for-scene-building]). In this case, use an [doc:\/\/com.apple.spritekit\/documentation\/SpriteKit\/SKSpriteNode] to display an image in the view:\n\n```swift\nlet image = SKSpriteNode(imageNamed: \"myImage.png\")\n\n\/\/ Add the image to the scene.\nscene.addChild(image)\n\n```\n\nThe functions to lay out content in a scene are covered in more detail in [doc:\/\/com.apple.spritekit\/documentation\/SpriteKit\/accessing-and-modifying-the-node-tree].\n\n### Present the Scene Inside a View\n\nAfter you set up the scene, you display it in the view by calling [doc:\/\/com.apple.spritekit\/documentation\/SpriteKit\/SKView\/presentScene(_:)]:\n\n```swift\nif let skView = self.view as? SKView { \n    skView.presentScene(scene)\n}\n\n```\n\nBecause the code in this article sets up a view, you add it to your view controller’s [doc:\/\/com.apple.documentation\/documentation\/UIKit\/UIViewController\/viewDidLoad()] function.\n\n## Essentials\n\n- **SKScene**: An object that organizes all of the active SpriteKit content.\n- **Nodes for Scene Building**: Define the appearance or layout of scene content.\n\n",
  "sections" : [
    {
      "content" : "",
      "items" : [
        {
          "description" : "An object that organizes all of the active SpriteKit content.",
          "name" : "SKScene",
          "url" : "https:\/\/developer.apple.com\/documentation\/SpriteKit\/SKScene"
        },
        {
          "description" : "Define the appearance or layout of scene content.",
          "name" : "Nodes for Scene Building",
          "url" : "https:\/\/developer.apple.com\/documentation\/SpriteKit\/nodes-for-scene-building"
        }
      ],
      "title" : "Essentials"
    }
  ],
  "source" : "appleJSON",
  "title" : "Drawing SpriteKit Content in a View",
  "url" : "https:\/\/developer.apple.com\/documentation\/SpriteKit\/drawing-spritekit-content-in-a-view"
}