{
  "abstract" : "An object that is run by a node to change its structure or content.",
  "codeExamples" : [

  ],
  "conformsTo" : [
    "CVarArg",
    "CustomDebugStringConvertible",
    "CustomStringConvertible",
    "Equatable",
    "Hashable",
    "NSCoding",
    "NSCopying",
    "NSObjectProtocol",
    "NSSecureCoding"
  ],
  "contentHash" : "1d753761f7851147c43af8a00c09b9873529cd8366c232fc94fe22b248c6669c",
  "crawledAt" : "2025-12-05T21:01:56Z",
  "declaration" : {
    "code" : "class SKAction",
    "language" : "swift"
  },
  "id" : "B900C53A-575F-4DA2-ABFB-32BF3E9F3ABA",
  "kind" : "class",
  "language" : "swift",
  "module" : "SpriteKit",
  "overview" : "## Overview\n\n[doc:\/\/com.apple.spritekit\/documentation\/SpriteKit\/SKAction] is an animation that is executed by a node in the scene. Actions are used to change a node in some way (like move its position over time), but you can also use actions to change the scene, like doing a fadeout. When the scene processes its nodes, the actions associated with those nodes are processed.",
  "platforms" : [
    "iOS",
    "iPadOS",
    "Mac Catalyst",
    "macOS",
    "tvOS",
    "visionOS",
    "watchOS"
  ],
  "rawMarkdown" : "---\nsource: https:\/\/developer.apple.com\/documentation\/SpriteKit\/SKAction\ncrawled: 2025-12-05T21:01:56Z\n---\n\n# SKAction\n\n**Class**\n\nAn object that is run by a node to change its structure or content.\n\n## Declaration\n\n```swift\nclass SKAction\n```\n\n## Overview\n\n[doc:\/\/com.apple.spritekit\/documentation\/SpriteKit\/SKAction] is an animation that is executed by a node in the scene. Actions are used to change a node in some way (like move its position over time), but you can also use actions to change the scene, like doing a fadeout. When the scene processes its nodes, the actions associated with those nodes are processed.\n\n## First Steps\n\n- **Getting Started with Actions**: Create, configure, and run actions in SpriteKit.\n- **Action Initializers**: Use these functions to create actions.\n\n## Controlling Action Timing\n\n- **Configuring Action Timing**: Time an action in a scene, by adding or modifying timing properties, or cancel an action.\n- **duration**: The duration required to complete an action.\n- **timingMode**: A setting that controls the speed curve of an animation.\n- **SKActionTimingMode**: The modes that an action can use to adjust the apparent timing of the action.\n- **timingFunction**: A block used to customize the timing function.\n- **SKActionTimingFunction**: The signature for the custom timing block.\n- **speed**: A speed factor that modifies how fast an action runs.\n\n## Using Action Names\n\n- **Controlling Actions Precisely by Using Names**: Set an action’s name property so you can access it later without needing an instance variable.\n\n## Observing Live Changes\n\n- **Detecting Changes at Each Step of an Animation**: Get notified of a property change on your node subclass and retrieve the amount of change.\n\n## Animation\n\n- **Getting Started with Actions**: Create, configure, and run actions in SpriteKit.\n\n## Inherits From\n\n- NSObject\n\n## Conforms To\n\n- CVarArg\n- CustomDebugStringConvertible\n- CustomStringConvertible\n- Equatable\n- Hashable\n- NSCoding\n- NSCopying\n- NSObjectProtocol\n- NSSecureCoding\n\n",
  "sections" : [
    {
      "content" : "",
      "items" : [
        {
          "description" : "Create, configure, and run actions in SpriteKit.",
          "name" : "Getting Started with Actions",
          "url" : "https:\/\/developer.apple.com\/documentation\/SpriteKit\/getting-started-with-actions"
        },
        {
          "description" : "Use these functions to create actions.",
          "name" : "Action Initializers",
          "url" : "https:\/\/developer.apple.com\/documentation\/SpriteKit\/action-initializers"
        }
      ],
      "title" : "First Steps"
    },
    {
      "content" : "",
      "items" : [
        {
          "description" : "Time an action in a scene, by adding or modifying timing properties, or cancel an action.",
          "name" : "Configuring Action Timing",
          "url" : "https:\/\/developer.apple.com\/documentation\/SpriteKit\/configuring-action-timing"
        },
        {
          "description" : "The duration required to complete an action.",
          "name" : "duration",
          "url" : "https:\/\/developer.apple.com\/documentation\/SpriteKit\/SKAction\/duration"
        },
        {
          "description" : "A setting that controls the speed curve of an animation.",
          "name" : "timingMode",
          "url" : "https:\/\/developer.apple.com\/documentation\/SpriteKit\/SKAction\/timingMode"
        },
        {
          "description" : "The modes that an action can use to adjust the apparent timing of the action.",
          "name" : "SKActionTimingMode",
          "url" : "https:\/\/developer.apple.com\/documentation\/SpriteKit\/SKActionTimingMode"
        },
        {
          "description" : "A block used to customize the timing function.",
          "name" : "timingFunction",
          "url" : "https:\/\/developer.apple.com\/documentation\/SpriteKit\/SKAction\/timingFunction"
        },
        {
          "description" : "The signature for the custom timing block.",
          "name" : "SKActionTimingFunction",
          "url" : "https:\/\/developer.apple.com\/documentation\/SpriteKit\/SKActionTimingFunction"
        },
        {
          "description" : "A speed factor that modifies how fast an action runs.",
          "name" : "speed",
          "url" : "https:\/\/developer.apple.com\/documentation\/SpriteKit\/SKAction\/speed"
        }
      ],
      "title" : "Controlling Action Timing"
    },
    {
      "content" : "",
      "items" : [
        {
          "description" : "Set an action’s name property so you can access it later without needing an instance variable.",
          "name" : "Controlling Actions Precisely by Using Names",
          "url" : "https:\/\/developer.apple.com\/documentation\/SpriteKit\/controlling-actions-precisely-by-using-names"
        }
      ],
      "title" : "Using Action Names"
    },
    {
      "content" : "",
      "items" : [
        {
          "description" : "Get notified of a property change on your node subclass and retrieve the amount of change.",
          "name" : "Detecting Changes at Each Step of an Animation",
          "url" : "https:\/\/developer.apple.com\/documentation\/SpriteKit\/detecting-changes-at-each-step-of-an-animation"
        }
      ],
      "title" : "Observing Live Changes"
    },
    {
      "content" : "",
      "items" : [
        {
          "description" : "Create, configure, and run actions in SpriteKit.",
          "name" : "Getting Started with Actions",
          "url" : "https:\/\/developer.apple.com\/documentation\/SpriteKit\/getting-started-with-actions"
        }
      ],
      "title" : "Animation"
    },
    {
      "content" : "",
      "items" : [
        {
          "name" : "NSObject"
        }
      ],
      "title" : "Inherits From"
    }
  ],
  "source" : "appleJSON",
  "title" : "SKAction",
  "url" : "https:\/\/developer.apple.com\/documentation\/SpriteKit\/SKAction"
}