{
  "abstract" : "Determines whether the callout appears for an annotation.",
  "codeExamples" : [

  ],
  "contentHash" : "92d7ed6e4ce270a1db1324f79f87123e2556493ee448cd2231a1b5f4bbd86eeb",
  "crawledAt" : "2025-12-07T16:25:18Z",
  "declaration" : {
    "code" : "calloutShouldAppearForAnnotation?(annotation: Annotation): boolean;",
    "language" : "swift"
  },
  "id" : "24613493-D88D-46C9-8A9A-F55E86C9CDE8",
  "kind" : "unknown",
  "language" : "data",
  "module" : "MapKit JS",
  "overview" : "## Return Value\n\nThe method returns a Boolean value, where a value of `false` prevents the callout from appearing.\n\n## Discussion\n\nWhen the user selects an annotation, MapKit JS calls this method on the annotation’s callout delegate (if the delegate is an object and its [doc:\/\/com.apple.mapkitjs\/documentation\/MapKitJS\/AnnotationCalloutDelegate\/calloutShouldAppearForAnnotation] property is a function) with the annotation as a parameter.",
  "platforms" : [
    "Unsupported OS: MapKit JS"
  ],
  "rawMarkdown" : "---\nsource: https:\/\/developer.apple.com\/documentation\/MapKitJS\/AnnotationCalloutDelegate\/calloutShouldAppearForAnnotation\ncrawled: 2025-12-07T16:25:18Z\n---\n\n# calloutShouldAppearForAnnotation(annotation)\n\n**Interface Method**\n\nDetermines whether the callout appears for an annotation.\n\n## Declaration\n\n```swift\ncalloutShouldAppearForAnnotation?(annotation: Annotation): boolean;\n```\n\n## Parameters\n\n- **annotation**: The annotation for the callout.\n\n## Return Value\n\nThe method returns a Boolean value, where a value of `false` prevents the callout from appearing.\n\n## Discussion\n\nWhen the user selects an annotation, MapKit JS calls this method on the annotation’s callout delegate (if the delegate is an object and its [doc:\/\/com.apple.mapkitjs\/documentation\/MapKitJS\/AnnotationCalloutDelegate\/calloutShouldAppearForAnnotation] property is a function) with the annotation as a parameter.\n\n## Customizing callout appearance\n\n- **calloutAnchorOffsetForAnnotation(annotation, size)**: Returns a point determining the callout’s anchor offset.\n- **calloutShouldAnimateForAnnotation(annotation)**: Determines whether the callout animates.\n- **calloutAppearanceAnimationForAnnotation(annotation)**: Returns a CSS animation to use when the callout appears.\n\n",
  "sections" : [
    {
      "content" : "",
      "items" : [
        {
          "description" : "Returns a point determining the callout’s anchor offset.",
          "name" : "calloutAnchorOffsetForAnnotation(annotation, size)",
          "url" : "https:\/\/developer.apple.com\/documentation\/MapKitJS\/AnnotationCalloutDelegate\/calloutAnchorOffsetForAnnotation"
        },
        {
          "description" : "Determines whether the callout animates.",
          "name" : "calloutShouldAnimateForAnnotation(annotation)",
          "url" : "https:\/\/developer.apple.com\/documentation\/MapKitJS\/AnnotationCalloutDelegate\/calloutShouldAnimateForAnnotation"
        },
        {
          "description" : "Returns a CSS animation to use when the callout appears.",
          "name" : "calloutAppearanceAnimationForAnnotation(annotation)",
          "url" : "https:\/\/developer.apple.com\/documentation\/MapKitJS\/AnnotationCalloutDelegate\/calloutAppearanceAnimationForAnnotation"
        }
      ],
      "title" : "Customizing callout appearance"
    }
  ],
  "source" : "appleJSON",
  "title" : "calloutShouldAppearForAnnotation(annotation)",
  "url" : "https:\/\/developer.apple.com\/documentation\/MapKitJS\/AnnotationCalloutDelegate\/calloutShouldAppearForAnnotation"
}