{
  "abstract" : "A language ID indicating the selected language.",
  "codeExamples" : [

  ],
  "contentHash" : "34043ce567ca732f6f15b8c511bf37da5a3c5d0b9fd5db93ed5ede23dc127bde",
  "crawledAt" : "2025-12-02T05:57:05Z",
  "declaration" : {
    "code" : "get language(): string;\nset language(language: string);",
    "language" : "swift"
  },
  "id" : "F5416AB6-BB91-4B10-9EDE-0AAF3A8B7BE9",
  "kind" : "property",
  "module" : "MapKit JS",
  "overview" : "## Discussion\n\nThe ID of the language you pass as an initialization option, or according to the user’s browser preference. You can change the language property dynamically, which no longer requires that you reload the containing page. If the language choice isn’t available, MapKit JS picks the best match.\n\nFor more information about language IDs, see [https:\/\/developer.apple.com\/library\/ios\/documentation\/MacOSX\/Conceptual\/BPInternational\/LanguageandLocaleIDs\/LanguageandLocaleIDs.html].",
  "platforms" : [
    "Unsupported OS: MapKit JS"
  ],
  "rawMarkdown" : "---\nsource: https:\/\/developer.apple.com\/documentation\/MapKitJS\/mapkit\/language\ncrawled: 2025-12-02T05:57:05Z\n---\n\n# language\n\n**Instance Property**\n\nA language ID indicating the selected language.\n\n## Declaration\n\n```swift\nget language(): string;\nset language(language: string);\n```\n\n## Discussion\n\nThe ID of the language you pass as an initialization option, or according to the user’s browser preference. You can change the language property dynamically, which no longer requires that you reload the containing page. If the language choice isn’t available, MapKit JS picks the best match.\n\nFor more information about language IDs, see [https:\/\/developer.apple.com\/library\/ios\/documentation\/MacOSX\/Conceptual\/BPInternational\/LanguageandLocaleIDs\/LanguageandLocaleIDs.html].\n\n## Version and language\n\n- **build**: The build string.\n- **version**: The version of MapKit JS.\n\n",
  "sections" : [
    {
      "content" : "",
      "items" : [
        {
          "description" : "The build string.",
          "name" : "build",
          "url" : "https:\/\/developer.apple.com\/documentation\/MapKitJS\/mapkit\/build"
        },
        {
          "description" : "The version of MapKit JS.",
          "name" : "version",
          "url" : "https:\/\/developer.apple.com\/documentation\/MapKitJS\/mapkit\/version"
        }
      ],
      "title" : "Version and language"
    }
  ],
  "source" : "appleJSON",
  "title" : "language",
  "url" : "https:\/\/developer.apple.com\/documentation\/MapKitJS\/mapkit\/language"
}