{
  "abstract" : "An event object that the map view dispatches when someone selects or deselects an overlay.",
  "codeExamples" : [

  ],
  "contentHash" : "acbf6dbe70bad716e6ba1bc68464da08c2391ec7c685c5149db6f9bd0c31e223",
  "crawledAt" : "2025-12-05T10:55:49Z",
  "declaration" : {
    "code" : "class MapOverlaySelectionEvent extends MapKitEvent",
    "language" : "swift"
  },
  "id" : "CBD9C711-80F0-4113-BEFD-4C3D1EE833AF",
  "kind" : "class",
  "language" : "data",
  "module" : "MapKit JS",
  "overview" : "## Discussion\n\n[doc:\/\/com.apple.mapkitjs\/documentation\/MapKitJS\/Map] dispatches a [doc:\/\/com.apple.mapkitjs\/documentation\/MapKitJS\/MapOverlaySelectionEvent] when someone selects or deselects an overlay. The event type can be `select` or `deselect`.",
  "platforms" : [
    "Unsupported OS: MapKit JS"
  ],
  "rawMarkdown" : "---\nsource: https:\/\/developer.apple.com\/documentation\/MapKitJS\/MapOverlaySelectionEvent\ncrawled: 2025-12-05T10:55:49Z\n---\n\n# MapOverlaySelectionEvent\n\n**Class**\n\nAn event object that the map view dispatches when someone selects or deselects an overlay.\n\n## Declaration\n\n```swift\nclass MapOverlaySelectionEvent extends MapKitEvent\n```\n\n## Discussion\n\n[doc:\/\/com.apple.mapkitjs\/documentation\/MapKitJS\/Map] dispatches a [doc:\/\/com.apple.mapkitjs\/documentation\/MapKitJS\/MapOverlaySelectionEvent] when someone selects or deselects an overlay. The event type can be `select` or `deselect`.\n\n## Instance Properties\n\n- **overlay**: The overlay that the framework selected or deselected.\n\n## Map events\n\n- **MapEvent**: An object that represents a gesture the framework recognized on the map.\n- **MapAnnotationDragEvent**: An event object that the map object dispatches when someone drags an annotation.\n- **MapAnnotationSelectionEvent**: An event object that the map object dispatches when someone selects or deselects an annotation.\n- **MapUserLocationChangeEvent**: An event that represents a change in a person’s location.\n- **MapUserLocationErrorEvent**: An event that indicates that MapKit JS is unable to acquire a person’s location.\n\n## Inherits From\n\n- MapKitEvent\n\n",
  "sections" : [
    {
      "content" : "",
      "items" : [
        {
          "description" : "The overlay that the framework selected or deselected.",
          "name" : "overlay",
          "url" : "https:\/\/developer.apple.com\/documentation\/MapKitJS\/MapOverlaySelectionEvent\/overlay"
        }
      ],
      "title" : "Instance Properties"
    },
    {
      "content" : "",
      "items" : [
        {
          "description" : "An object that represents a gesture the framework recognized on the map.",
          "name" : "MapEvent",
          "url" : "https:\/\/developer.apple.com\/documentation\/MapKitJS\/MapEvent"
        },
        {
          "description" : "An event object that the map object dispatches when someone drags an annotation.",
          "name" : "MapAnnotationDragEvent",
          "url" : "https:\/\/developer.apple.com\/documentation\/MapKitJS\/MapAnnotationDragEvent"
        },
        {
          "description" : "An event object that the map object dispatches when someone selects or deselects an annotation.",
          "name" : "MapAnnotationSelectionEvent",
          "url" : "https:\/\/developer.apple.com\/documentation\/MapKitJS\/MapAnnotationSelectionEvent"
        },
        {
          "description" : "An event that represents a change in a person’s location.",
          "name" : "MapUserLocationChangeEvent",
          "url" : "https:\/\/developer.apple.com\/documentation\/MapKitJS\/MapUserLocationChangeEvent"
        },
        {
          "description" : "An event that indicates that MapKit JS is unable to acquire a person’s location.",
          "name" : "MapUserLocationErrorEvent",
          "url" : "https:\/\/developer.apple.com\/documentation\/MapKitJS\/MapUserLocationErrorEvent"
        }
      ],
      "title" : "Map events"
    },
    {
      "content" : "",
      "items" : [
        {
          "name" : "MapKitEvent"
        }
      ],
      "title" : "Inherits From"
    }
  ],
  "source" : "appleJSON",
  "title" : "MapOverlaySelectionEvent",
  "url" : "https:\/\/developer.apple.com\/documentation\/MapKitJS\/MapOverlaySelectionEvent"
}