{
  "abstract" : "A feature visibility setting that determines when the compass is visible.",
  "codeExamples" : [

  ],
  "contentHash" : "6b121b8aafc4fd1cf504a6b6a602f9f9dac855290cd251b15c29fc3145b92b15",
  "crawledAt" : "2025-12-05T10:50:24Z",
  "declaration" : {
    "code" : "get showsCompass(): FeatureVisibility;\nset showsCompass(value: FeatureVisibility);",
    "language" : "swift"
  },
  "id" : "FA586DF4-ABDF-4497-B5B1-3B089638CB42",
  "kind" : "property",
  "language" : "data",
  "module" : "MapKit JS",
  "overview" : "## Discussion\n\nBy default, the compass is adaptive ([doc:\/\/com.apple.mapkitjs\/documentation\/MapKitJS\/FeatureVisibility\/Adaptive]), meaning that it isn’t visible when [doc:\/\/com.apple.mapkitjs\/documentation\/MapKitJS\/Map\/rotation] is `0` on touch devices. Otherwise, the compass is visible.",
  "platforms" : [
    "Unsupported OS: MapKit JS"
  ],
  "rawMarkdown" : "---\nsource: https:\/\/developer.apple.com\/documentation\/MapKitJS\/Map\/showsCompass\ncrawled: 2025-12-05T10:50:24Z\n---\n\n# showsCompass\n\n**Instance Property**\n\nA feature visibility setting that determines when the compass is visible.\n\n## Declaration\n\n```swift\nget showsCompass(): FeatureVisibility;\nset showsCompass(value: FeatureVisibility);\n```\n\n## Discussion\n\nBy default, the compass is adaptive ([doc:\/\/com.apple.mapkitjs\/documentation\/MapKitJS\/FeatureVisibility\/Adaptive]), meaning that it isn’t visible when [doc:\/\/com.apple.mapkitjs\/documentation\/MapKitJS\/Map\/rotation] is `0` on touch devices. Otherwise, the compass is visible.\n\n## Showing the map’s controls\n\n- **showsMapTypeControl**: A Boolean value that determines whether to display a control that lets users choose the map type.\n- **showsScale**: A feature visibility setting that determines when the map displays the map’s scale indicator.\n- **showsUserLocationControl**: A Boolean value that determines whether the user location control is visible.\n- **showsZoomControl**: A Boolean value that determines whether to display a control for zooming in and zooming out on a map.\n\n",
  "sections" : [
    {
      "content" : "",
      "items" : [
        {
          "description" : "A Boolean value that determines whether to display a control that lets users choose the map type.",
          "name" : "showsMapTypeControl",
          "url" : "https:\/\/developer.apple.com\/documentation\/MapKitJS\/Map\/showsMapTypeControl"
        },
        {
          "description" : "A feature visibility setting that determines when the map displays the map’s scale indicator.",
          "name" : "showsScale",
          "url" : "https:\/\/developer.apple.com\/documentation\/MapKitJS\/Map\/showsScale"
        },
        {
          "description" : "A Boolean value that determines whether the user location control is visible.",
          "name" : "showsUserLocationControl",
          "url" : "https:\/\/developer.apple.com\/documentation\/MapKitJS\/Map\/showsUserLocationControl"
        },
        {
          "description" : "A Boolean value that determines whether to display a control for zooming in and zooming out on a map.",
          "name" : "showsZoomControl",
          "url" : "https:\/\/developer.apple.com\/documentation\/MapKitJS\/Map\/showsZoomControl"
        }
      ],
      "title" : "Showing the map’s controls"
    }
  ],
  "source" : "appleJSON",
  "title" : "showsCompass",
  "url" : "https:\/\/developer.apple.com\/documentation\/MapKitJS\/Map\/showsCompass"
}