{
  "abstract" : "The map’s rotation, in degrees.",
  "codeExamples" : [

  ],
  "contentHash" : "123eae5a2f6f9e53a9ee6f4d64fa5b67d75414d788a79e822a8d85c7d005399f",
  "crawledAt" : "2025-12-05T10:50:15Z",
  "declaration" : {
    "code" : "get rotation(): number;\nset rotation(rotation: number);",
    "language" : "swift"
  },
  "id" : "AED778DB-88DF-40DD-B578-B5681661B8D5",
  "kind" : "property",
  "language" : "data",
  "module" : "MapKit JS",
  "overview" : "## Discussion\n\nThis value represents the map’s [doc:\/\/com.apple.mapkitjs\/documentation\/MapKitJS\/Map\/rotation] in degrees, where the value 0 means that the top edge of the map view corresponds to true north. The value 90 means the top of the map is pointing due east. The value 180 means the top of the map points due south, and so on.\n\nSetting the rotation property always rotates the map around its [doc:\/\/com.apple.mapkitjs\/documentation\/MapKitJS\/Map\/center].",
  "platforms" : [
    "Unsupported OS: MapKit JS"
  ],
  "rawMarkdown" : "---\nsource: https:\/\/developer.apple.com\/documentation\/MapKitJS\/Map\/rotation\ncrawled: 2025-12-05T10:50:15Z\n---\n\n# rotation\n\n**Instance Property**\n\nThe map’s rotation, in degrees.\n\n## Declaration\n\n```swift\nget rotation(): number;\nset rotation(rotation: number);\n```\n\n## Discussion\n\nThis value represents the map’s [doc:\/\/com.apple.mapkitjs\/documentation\/MapKitJS\/Map\/rotation] in degrees, where the value 0 means that the top edge of the map view corresponds to true north. The value 90 means the top of the map is pointing due east. The value 180 means the top of the map points due south, and so on.\n\nSetting the rotation property always rotates the map around its [doc:\/\/com.apple.mapkitjs\/documentation\/MapKitJS\/Map\/center].\n\n## Manipulating the visible portion of the map\n\n- **center**: The map coordinate at the center of the map view.\n- **setCenterAnimated(coordinate, animated)**: Centers the map to the provided coordinate, with optional animation.\n- **region**: The area the map is displaying.\n- **setRegionAnimated(region, animated)**: Changes the map’s region to the provided region, with optional animation.\n- **setRotationAnimated(degrees, animated)**: Changes the map’s rotation setting to the number of specified degrees.\n- **visibleMapRect**: The visible area of the map, in map units.\n- **setVisibleMapRectAnimated(mapRect, animated)**: Changes the map’s visible map rectangle to the specified map rectangle.\n- **cameraBoundary**: A constraint of the location of the center of the map.\n- **setCameraBoundaryAnimated(mapRect, animated)**: Changes the map’s camera boundary with an animated transition.\n- **CameraBoundaryDescription**: An object literal that contains information defining an area on the map.\n- **cameraDistance**: The altitude of the camera relative to the elevation of the center of the map.\n- **setCameraDistanceAnimated(distance, animated)**: Changes the map’s camera distance with an animated transition.\n- **cameraZoomRange**: The minimum and maximum distances of the camera from the map center.\n- **setCameraZoomRangeAnimated(cameraZoomRange, animated)**: Changes the map’s camera zoom range with an animated transition.\n\n",
  "sections" : [
    {
      "content" : "",
      "items" : [
        {
          "description" : "The map coordinate at the center of the map view.",
          "name" : "center",
          "url" : "https:\/\/developer.apple.com\/documentation\/MapKitJS\/Map\/center"
        },
        {
          "description" : "Centers the map to the provided coordinate, with optional animation.",
          "name" : "setCenterAnimated(coordinate, animated)",
          "url" : "https:\/\/developer.apple.com\/documentation\/MapKitJS\/Map\/setCenterAnimated"
        },
        {
          "description" : "The area the map is displaying.",
          "name" : "region",
          "url" : "https:\/\/developer.apple.com\/documentation\/MapKitJS\/Map\/region"
        },
        {
          "description" : "Changes the map’s region to the provided region, with optional animation.",
          "name" : "setRegionAnimated(region, animated)",
          "url" : "https:\/\/developer.apple.com\/documentation\/MapKitJS\/Map\/setRegionAnimated"
        },
        {
          "description" : "Changes the map’s rotation setting to the number of specified degrees.",
          "name" : "setRotationAnimated(degrees, animated)",
          "url" : "https:\/\/developer.apple.com\/documentation\/MapKitJS\/Map\/setRotationAnimated"
        },
        {
          "description" : "The visible area of the map, in map units.",
          "name" : "visibleMapRect",
          "url" : "https:\/\/developer.apple.com\/documentation\/MapKitJS\/Map\/visibleMapRect"
        },
        {
          "description" : "Changes the map’s visible map rectangle to the specified map rectangle.",
          "name" : "setVisibleMapRectAnimated(mapRect, animated)",
          "url" : "https:\/\/developer.apple.com\/documentation\/MapKitJS\/Map\/setVisibleMapRectAnimated"
        },
        {
          "description" : "A constraint of the location of the center of the map.",
          "name" : "cameraBoundary",
          "url" : "https:\/\/developer.apple.com\/documentation\/MapKitJS\/Map\/cameraBoundary"
        },
        {
          "description" : "Changes the map’s camera boundary with an animated transition.",
          "name" : "setCameraBoundaryAnimated(mapRect, animated)",
          "url" : "https:\/\/developer.apple.com\/documentation\/MapKitJS\/Map\/setCameraBoundaryAnimated"
        },
        {
          "description" : "An object literal that contains information defining an area on the map.",
          "name" : "CameraBoundaryDescription",
          "url" : "https:\/\/developer.apple.com\/documentation\/MapKitJS\/CameraBoundaryDescription"
        },
        {
          "description" : "The altitude of the camera relative to the elevation of the center of the map.",
          "name" : "cameraDistance",
          "url" : "https:\/\/developer.apple.com\/documentation\/MapKitJS\/Map\/cameraDistance"
        },
        {
          "description" : "Changes the map’s camera distance with an animated transition.",
          "name" : "setCameraDistanceAnimated(distance, animated)",
          "url" : "https:\/\/developer.apple.com\/documentation\/MapKitJS\/Map\/setCameraDistanceAnimated"
        },
        {
          "description" : "The minimum and maximum distances of the camera from the map center.",
          "name" : "cameraZoomRange",
          "url" : "https:\/\/developer.apple.com\/documentation\/MapKitJS\/Map\/cameraZoomRange"
        },
        {
          "description" : "Changes the map’s camera zoom range with an animated transition.",
          "name" : "setCameraZoomRangeAnimated(cameraZoomRange, animated)",
          "url" : "https:\/\/developer.apple.com\/documentation\/MapKitJS\/Map\/setCameraZoomRangeAnimated"
        }
      ],
      "title" : "Manipulating the visible portion of the map"
    }
  ],
  "source" : "appleJSON",
  "title" : "rotation",
  "url" : "https:\/\/developer.apple.com\/documentation\/MapKitJS\/Map\/rotation"
}