{
  "abstract" : "A feature visibility setting that allows you to determine when to display the map’s scale.",
  "codeExamples" : [

  ],
  "contentHash" : "26be2da13432e91eaf2da75c6317b1e9a7b416896b50df5b3989861516706e5d",
  "crawledAt" : "2025-12-07T14:59:02Z",
  "declaration" : {
    "code" : "showsScale?: FeatureVisibility;",
    "language" : "swift"
  },
  "id" : "6C48FD66-EF49-42DA-A3A6-1504DE3B1345",
  "kind" : "unknown",
  "language" : "data",
  "module" : "MapKit JS",
  "overview" : "## Discussion\n\nThe default value is `mapkit.FeatureVisibility.Hidden`. See [doc:\/\/com.apple.mapkitjs\/documentation\/MapKitJS\/FeatureVisibility] for other values that determine when the map shows the scale. See MapKit’s [doc:\/\/com.apple.mapkitjs\/documentation\/MapKitJS\/Map\/showsScale] for more information about how the values determine when to show the scale.",
  "platforms" : [
    "Unsupported OS: MapKit JS"
  ],
  "rawMarkdown" : "---\nsource: https:\/\/developer.apple.com\/documentation\/MapKitJS\/MapConstructorOptions\/showsScale\ncrawled: 2025-12-07T14:59:02Z\n---\n\n# showsScale\n\n**Interface Property**\n\nA feature visibility setting that allows you to determine when to display the map’s scale.\n\n## Declaration\n\n```swift\nshowsScale?: FeatureVisibility;\n```\n\n## Discussion\n\nThe default value is `mapkit.FeatureVisibility.Hidden`. See [doc:\/\/com.apple.mapkitjs\/documentation\/MapKitJS\/FeatureVisibility] for other values that determine when the map shows the scale. See MapKit’s [doc:\/\/com.apple.mapkitjs\/documentation\/MapKitJS\/Map\/showsScale] for more information about how the values determine when to show the scale.\n\n## Setting the map’s appearance and controls\n\n- **colorScheme**: The map’s color scheme when displaying standard or muted standard map types.\n- **mapType**: The type of data that the map view displays.\n- **padding**: The map’s inset margins.\n- **showsMapTypeControl**: A Boolean value that determines whether to display a control that lets users choose the map type.\n- **isRotationEnabled**: A Boolean value that determines whether the user may rotate the map using the compass control or a rotate gesture.\n- **showsCompass**: A feature visibility setting that determines when the compass is visible.\n- **isZoomEnabled**: A Boolean value that determines whether the user may zoom in and out on the map using pinch gestures or the zoom control.\n- **showsZoomControl**: A Boolean value that determines whether to display a control for zooming in and zooming out on a map.\n- **isScrollEnabled**: A Boolean value that determines whether the user may scroll the map with a pointing device or gestures on a touchscreen.\n\n",
  "sections" : [
    {
      "content" : "",
      "items" : [
        {
          "description" : "The map’s color scheme when displaying standard or muted standard map types.",
          "name" : "colorScheme",
          "url" : "https:\/\/developer.apple.com\/documentation\/MapKitJS\/MapConstructorOptions\/colorScheme"
        },
        {
          "description" : "The type of data that the map view displays.",
          "name" : "mapType",
          "url" : "https:\/\/developer.apple.com\/documentation\/MapKitJS\/MapConstructorOptions\/mapType"
        },
        {
          "description" : "The map’s inset margins.",
          "name" : "padding",
          "url" : "https:\/\/developer.apple.com\/documentation\/MapKitJS\/MapConstructorOptions\/padding"
        },
        {
          "description" : "A Boolean value that determines whether to display a control that lets users choose the map type.",
          "name" : "showsMapTypeControl",
          "url" : "https:\/\/developer.apple.com\/documentation\/MapKitJS\/MapConstructorOptions\/showsMapTypeControl"
        },
        {
          "description" : "A Boolean value that determines whether the user may rotate the map using the compass control or a rotate gesture.",
          "name" : "isRotationEnabled",
          "url" : "https:\/\/developer.apple.com\/documentation\/MapKitJS\/MapConstructorOptions\/isRotationEnabled"
        },
        {
          "description" : "A feature visibility setting that determines when the compass is visible.",
          "name" : "showsCompass",
          "url" : "https:\/\/developer.apple.com\/documentation\/MapKitJS\/MapConstructorOptions\/showsCompass"
        },
        {
          "description" : "A Boolean value that determines whether the user may zoom in and out on the map using pinch gestures or the zoom control.",
          "name" : "isZoomEnabled",
          "url" : "https:\/\/developer.apple.com\/documentation\/MapKitJS\/MapConstructorOptions\/isZoomEnabled"
        },
        {
          "description" : "A Boolean value that determines whether to display a control for zooming in and zooming out on a map.",
          "name" : "showsZoomControl",
          "url" : "https:\/\/developer.apple.com\/documentation\/MapKitJS\/MapConstructorOptions\/showsZoomControl"
        },
        {
          "description" : "A Boolean value that determines whether the user may scroll the map with a pointing device or gestures on a touchscreen.",
          "name" : "isScrollEnabled",
          "url" : "https:\/\/developer.apple.com\/documentation\/MapKitJS\/MapConstructorOptions\/isScrollEnabled"
        }
      ],
      "title" : "Setting the map’s appearance and controls"
    }
  ],
  "source" : "appleJSON",
  "title" : "showsScale",
  "url" : "https:\/\/developer.apple.com\/documentation\/MapKitJS\/MapConstructorOptions\/showsScale"
}