{
  "abstract" : "Register an event lister for events that a map object dispatches.",
  "codeExamples" : [

  ],
  "contentHash" : "f8e63507e24ff2df569f32f1a6207a56d5c76c3c8f380a82b169d22da607629a",
  "crawledAt" : "2025-12-05T12:20:44Z",
  "id" : "BA885CAB-17DB-4969-ADD2-DEDC07BAF39F",
  "kind" : "collection",
  "language" : "data",
  "module" : "MapKit JS",
  "overview" : "## Overview\n\nMapKit JS uses events that developers can implement to hook into points in the life cycle of the map, as well as user interactions. Your code can respond to events by registering an event listener.\n\nEvents have a `target` property. The `target` of an event is the object dispatching that event. When you add an event listener to a map, the target is the map itself. The `select` and `deselect` events have an annotation or overlay property that reports the selected or deselected item. The `single-tap`, `double-tap`, and `long-press` events have `pointOnPage` and `domEvents` properties that provide more data about the user interactions.\n\nEvent listeners receive a single argument that is an event object. The event objects are similar to native event objects, though calls to `event.preventDefault()` or `event.stopPropagation()` don’t halt some actions that trigger these events. Scrolling, zooming, and panning, as well as zooming or rotating after a long press, provide methods to halt or prevent interaction.\n\n### Respond to map display events\n\nMapKit JS sends the following [doc:\/\/com.apple.mapkitjs\/documentation\/MapKitJS\/MapKitEvent] events that allow you to respond to changes in the map display and a person’s interactions with the map and its controls.\n\n### Respond to annotation and overlay events\n\nMapKit JS sends [doc:\/\/com.apple.mapkitjs\/documentation\/MapKitJS\/MapAnnotationSelectionEvent],[doc:\/\/com.apple.mapkitjs\/documentation\/MapKitJS\/MapOverlaySelectionEvent], and [doc:\/\/com.apple.mapkitjs\/documentation\/MapKitJS\/MapAnnotationDragEvent] events when a person interacts with the annotations and overlays you place on the map. Respond to these interactions by updating the map or providing more information about the overlay or annotation the person interacts with.\n\n### Respond to user location events\n\nMapKit JS sends [doc:\/\/com.apple.mapkitjs\/documentation\/MapKitJS\/MapUserLocationChangeEvent] or [doc:\/\/com.apple.mapkitjs\/documentation\/MapKitJS\/MapUserLocationErrorEvent] events to indicate changes in a person’s location. Use these events to adjust what the map displays or to trigger other responses in your app.\n\n### Respond to map interaction events\n\nMapKit JS sends [doc:\/\/com.apple.mapkitjs\/documentation\/MapKitJS\/MapEvent] events when someone taps or presses on the map view. Use these events to adjust the map view, respond to the deselecting of overlays, or drag or deselect annotations.",
  "rawMarkdown" : "---\nsource: https:\/\/developer.apple.com\/documentation\/MapKitJS\/handling-map-events\ncrawled: 2025-12-05T12:20:44Z\n---\n\n# Handling map events\n\n**API Collection**\n\nRegister an event lister for events that a map object dispatches.\n\n## Overview\n\nMapKit JS uses events that developers can implement to hook into points in the life cycle of the map, as well as user interactions. Your code can respond to events by registering an event listener.\n\nEvents have a `target` property. The `target` of an event is the object dispatching that event. When you add an event listener to a map, the target is the map itself. The `select` and `deselect` events have an annotation or overlay property that reports the selected or deselected item. The `single-tap`, `double-tap`, and `long-press` events have `pointOnPage` and `domEvents` properties that provide more data about the user interactions.\n\nEvent listeners receive a single argument that is an event object. The event objects are similar to native event objects, though calls to `event.preventDefault()` or `event.stopPropagation()` don’t halt some actions that trigger these events. Scrolling, zooming, and panning, as well as zooming or rotating after a long press, provide methods to halt or prevent interaction.\n\n### Respond to map display events\n\nMapKit JS sends the following [doc:\/\/com.apple.mapkitjs\/documentation\/MapKitJS\/MapKitEvent] events that allow you to respond to changes in the map display and a person’s interactions with the map and its controls.\n\n\n\n### Respond to annotation and overlay events\n\nMapKit JS sends [doc:\/\/com.apple.mapkitjs\/documentation\/MapKitJS\/MapAnnotationSelectionEvent],[doc:\/\/com.apple.mapkitjs\/documentation\/MapKitJS\/MapOverlaySelectionEvent], and [doc:\/\/com.apple.mapkitjs\/documentation\/MapKitJS\/MapAnnotationDragEvent] events when a person interacts with the annotations and overlays you place on the map. Respond to these interactions by updating the map or providing more information about the overlay or annotation the person interacts with.\n\n\n\n### Respond to user location events\n\nMapKit JS sends [doc:\/\/com.apple.mapkitjs\/documentation\/MapKitJS\/MapUserLocationChangeEvent] or [doc:\/\/com.apple.mapkitjs\/documentation\/MapKitJS\/MapUserLocationErrorEvent] events to indicate changes in a person’s location. Use these events to adjust what the map displays or to trigger other responses in your app.\n\n\n\n### Respond to map interaction events\n\nMapKit JS sends [doc:\/\/com.apple.mapkitjs\/documentation\/MapKitJS\/MapEvent] events when someone taps or presses on the map view. Use these events to adjust the map view, respond to the deselecting of overlays, or drag or deselect annotations.\n\n\n\n## Map events\n\n- **MapEvent**: An object that represents a gesture the framework recognized on the map.\n- **MapAnnotationDragEvent**: An event object that the map object dispatches when someone drags an annotation.\n- **MapAnnotationSelectionEvent**: An event object that the map object dispatches when someone selects or deselects an annotation.\n- **MapOverlaySelectionEvent**: An event object that the map view dispatches when someone selects or deselects an overlay.\n- **MapUserLocationChangeEvent**: An event that represents a change in a person’s location.\n- **MapUserLocationErrorEvent**: An event that indicates that MapKit JS is unable to acquire a person’s location.\n\n",
  "sections" : [
    {
      "content" : "",
      "items" : [
        {
          "description" : "An object that represents a gesture the framework recognized on the map.",
          "name" : "MapEvent",
          "url" : "https:\/\/developer.apple.com\/documentation\/MapKitJS\/MapEvent"
        },
        {
          "description" : "An event object that the map object dispatches when someone drags an annotation.",
          "name" : "MapAnnotationDragEvent",
          "url" : "https:\/\/developer.apple.com\/documentation\/MapKitJS\/MapAnnotationDragEvent"
        },
        {
          "description" : "An event object that the map object dispatches when someone selects or deselects an annotation.",
          "name" : "MapAnnotationSelectionEvent",
          "url" : "https:\/\/developer.apple.com\/documentation\/MapKitJS\/MapAnnotationSelectionEvent"
        },
        {
          "description" : "An event object that the map view dispatches when someone selects or deselects an overlay.",
          "name" : "MapOverlaySelectionEvent",
          "url" : "https:\/\/developer.apple.com\/documentation\/MapKitJS\/MapOverlaySelectionEvent"
        },
        {
          "description" : "An event that represents a change in a person’s location.",
          "name" : "MapUserLocationChangeEvent",
          "url" : "https:\/\/developer.apple.com\/documentation\/MapKitJS\/MapUserLocationChangeEvent"
        },
        {
          "description" : "An event that indicates that MapKit JS is unable to acquire a person’s location.",
          "name" : "MapUserLocationErrorEvent",
          "url" : "https:\/\/developer.apple.com\/documentation\/MapKitJS\/MapUserLocationErrorEvent"
        }
      ],
      "title" : "Map events"
    }
  ],
  "source" : "appleJSON",
  "title" : "Handling map events",
  "url" : "https:\/\/developer.apple.com\/documentation\/MapKitJS\/handling-map-events"
}