{
  "abstract" : "Learn about important changes in Journaling Suggestions.",
  "codeExamples" : [

  ],
  "contentHash" : "6669f5231d32b08906413c73484f2304304bc468e182028360cb78213fafb871",
  "crawledAt" : "2025-12-02T15:59:14Z",
  "id" : "A320B98E-0BB6-4D07-9551-E05F9BC85779",
  "kind" : "article",
  "language" : "swift",
  "module" : "Updates",
  "overview" : "## Overview\n\nBrowse notable changes in [doc:\/\/com.apple.documentation\/documentation\/JournalingSuggestions].\n\n## June 2025\n\n### iPadOS support\n\n### System notifications\n\n### Event posters\n\n### Location and workouts\n\n## June 2024\n\n### General\n\n### Motion activity\n\n### Media playback\n\n### State of Mind\n\n### Reflection",
  "rawMarkdown" : "---\nsource: https:\/\/developer.apple.com\/documentation\/Updates\/JournalingSuggestions\ncrawled: 2025-12-02T15:59:14Z\n---\n\n# Journaling Suggestions updates\n\n**Article**\n\nLearn about important changes in Journaling Suggestions.\n\n## Overview\n\nBrowse notable changes in [doc:\/\/com.apple.documentation\/documentation\/JournalingSuggestions].\n\n## June 2025\n\n### iPadOS support\n\n- [doc:\/\/com.apple.documentation\/documentation\/JournalingSuggestions] supports iPadOS. Suggestions that the system generates on a person’s iPhone sync over iCloud to their iPad.\n\n### System notifications\n\n- Register for system Journaling Suggestion notifications, which prompt users to reflect on recent moments. Refer to the notification schedule a person picks in Settings using [doc:\/\/com.apple.documentation\/documentation\/JournalingSuggestions\/JournalingSuggestionsConfiguration]. When a person taps a notification, the system launches [doc:\/\/com.apple.documentation\/documentation\/JournalingSuggestions\/JournalingSuggestionsPicker] for your app when you implement [doc:\/\/com.apple.documentation\/documentation\/JournalingSuggestions\/JournalingSuggestionPresentationToken].\n\n### Event posters\n\n- Receive suggestions of the [doc:\/\/com.apple.documentation\/documentation\/JournalingSuggestions\/JournalingSuggestion\/EventPoster] type for planned or attended events in Apple Invites.\n\n### Location and workouts\n\n- Distinguish work-related location suggestions using the [doc:\/\/com.apple.documentation\/documentation\/JournalingSuggestions\/JournalingSuggestion\/Location\/isWorkLocation] property, and receive information about the location from MapKit with [doc:\/\/com.apple.documentation\/documentation\/JournalingSuggestions\/JournalingSuggestion\/Location\/mapKitItemIdentifier].\n- Refer to the name of a particular workout suggestion with  [doc:\/\/com.apple.documentation\/documentation\/JournalingSuggestions\/JournalingSuggestion\/Workout\/Details-swift.struct\/localizedName].\n\n## June 2024\n\n### General\n\n- Support for landscape mode in your app.\n\n### Motion activity\n\n- Capture someone’s run session as well as their mixed running and walking activity sessions with `MovementType`.\n\n### Media playback\n\n- Describe media content a person listened to. The system provides an instance of this structure to your app when a person chooses a media suggestion in the `JournalingSuggestionsPicker`.\n- Collect asset content that includes other media playback sessions from other music or podcast Apps.\n\n### State of Mind\n\n- Suggest content to people that ask them to describe their state of mind. The system provides an instance of this structure to your app when a person chooses a state of mind suggestion in the `JournalingSuggestionsPicker`.\n\n### Reflection\n\n- Use reflection prompts in your app with `Reflection`.\n\n## Technology updates\n\n- **Accelerate updates**: Learn about important changes to Accelerate.\n- **Accessibility updates**: Learn about important changes to Accessibility.\n- **ActivityKit updates**: Learn about important changes in ActivityKit.\n- **AdAttributionKit Updates**: Learn about important changes to AdAttributionKit.\n- **App Clips updates**: Learn about important changes in App Clips.\n- **App Intents updates**: Learn about important changes in App Intents.\n- **AppKit updates**: Learn about important changes to AppKit.\n- **Apple Intelligence updates**: Learn about important changes to Apple Intelligence.\n- **AppleMapsServerAPI Updates**: Learn about important changes to AppleMapsServerAPI.\n- **Apple Pencil updates**: Learn about important changes to Apple Pencil.\n- **ARKit updates**: Learn about important changes to ARKit.\n- **Audio Toolbox updates**: Learn about important changes to Audio Toolbox.\n- **AuthenticationServices updates**: Learn about important changes to AuthenticationServices.\n- **AVFAudio updates**: Learn about important changes to AVFAudio.\n- **AVFoundation updates**: Learn about important changes to AVFoundation.\n\n",
  "sections" : [
    {
      "content" : "",
      "items" : [
        {
          "description" : "Learn about important changes to Accelerate.",
          "name" : "Accelerate updates",
          "url" : "https:\/\/developer.apple.com\/documentation\/Updates\/Accelerate"
        },
        {
          "description" : "Learn about important changes to Accessibility.",
          "name" : "Accessibility updates",
          "url" : "https:\/\/developer.apple.com\/documentation\/Updates\/Accessibility"
        },
        {
          "description" : "Learn about important changes in ActivityKit.",
          "name" : "ActivityKit updates",
          "url" : "https:\/\/developer.apple.com\/documentation\/Updates\/ActivityKit"
        },
        {
          "description" : "Learn about important changes to AdAttributionKit.",
          "name" : "AdAttributionKit Updates",
          "url" : "https:\/\/developer.apple.com\/documentation\/Updates\/AdAttributionKit"
        },
        {
          "description" : "Learn about important changes in App Clips.",
          "name" : "App Clips updates",
          "url" : "https:\/\/developer.apple.com\/documentation\/Updates\/AppClips"
        },
        {
          "description" : "Learn about important changes in App Intents.",
          "name" : "App Intents updates",
          "url" : "https:\/\/developer.apple.com\/documentation\/Updates\/AppIntents"
        },
        {
          "description" : "Learn about important changes to AppKit.",
          "name" : "AppKit updates",
          "url" : "https:\/\/developer.apple.com\/documentation\/Updates\/AppKit"
        },
        {
          "description" : "Learn about important changes to Apple Intelligence.",
          "name" : "Apple Intelligence updates",
          "url" : "https:\/\/developer.apple.com\/documentation\/Updates\/Apple-Intelligence"
        },
        {
          "description" : "Learn about important changes to AppleMapsServerAPI.",
          "name" : "AppleMapsServerAPI Updates",
          "url" : "https:\/\/developer.apple.com\/documentation\/Updates\/AppleMapsServerAPI"
        },
        {
          "description" : "Learn about important changes to Apple Pencil.",
          "name" : "Apple Pencil updates",
          "url" : "https:\/\/developer.apple.com\/documentation\/Updates\/ApplePencil"
        },
        {
          "description" : "Learn about important changes to ARKit.",
          "name" : "ARKit updates",
          "url" : "https:\/\/developer.apple.com\/documentation\/Updates\/ARKit"
        },
        {
          "description" : "Learn about important changes to Audio Toolbox.",
          "name" : "Audio Toolbox updates",
          "url" : "https:\/\/developer.apple.com\/documentation\/Updates\/AudioToolbox"
        },
        {
          "description" : "Learn about important changes to AuthenticationServices.",
          "name" : "AuthenticationServices updates",
          "url" : "https:\/\/developer.apple.com\/documentation\/Updates\/AuthenticationServices"
        },
        {
          "description" : "Learn about important changes to AVFAudio.",
          "name" : "AVFAudio updates",
          "url" : "https:\/\/developer.apple.com\/documentation\/Updates\/AVFAudio"
        },
        {
          "description" : "Learn about important changes to AVFoundation.",
          "name" : "AVFoundation updates",
          "url" : "https:\/\/developer.apple.com\/documentation\/Updates\/AVFoundation"
        }
      ],
      "title" : "Technology updates"
    }
  ],
  "source" : "appleJSON",
  "title" : "Journaling Suggestions updates",
  "url" : "https:\/\/developer.apple.com\/documentation\/Updates\/JournalingSuggestions"
}