{
  "abstract" : "An average pooling filter.",
  "codeExamples" : [

  ],
  "conformsTo" : [
    "CVarArg",
    "CustomDebugStringConvertible",
    "CustomStringConvertible",
    "Equatable",
    "Hashable",
    "NSCoding",
    "NSCopying",
    "NSObjectProtocol",
    "NSSecureCoding"
  ],
  "contentHash" : "a15a85696cfafdcd48f8febedab4bc42faad4adaba574e4232e86309e2c40c59",
  "crawledAt" : "2025-12-05T00:36:14Z",
  "declaration" : {
    "code" : "class MPSCNNPoolingAverage",
    "language" : "swift"
  },
  "id" : "4A359D52-73C5-4000-8143-7D286C7B58B2",
  "kind" : "class",
  "language" : "swift",
  "module" : "Metal Performance Shaders",
  "overview" : "## Overview\n\nFor each pixel in an image, the filter returns the average value of the pixels in the filter region defined by `kernelWidth` `x` `kernelHeight`.\n\nWhen the value of the [doc:\/\/com.apple.metalperformanceshaders\/documentation\/MetalPerformanceShaders\/MPSCNNKernel\/edgeMode] property is set to [doc:\/\/com.apple.metalperformanceshaders\/documentation\/MetalPerformanceShaders\/MPSImageEdgeMode\/clamp], the filtering window is shrunk to remain within the source image borders. For pixels close to the image borders, the filtering window will be smaller in order to fit inside the source image and less values will be used to compute the average value. In case the filtering window is entirely outside the source image border, the output value will be `0`.",
  "platforms" : [
    "iOS",
    "iPadOS",
    "Mac Catalyst",
    "macOS",
    "tvOS",
    "visionOS"
  ],
  "rawMarkdown" : "---\nsource: https:\/\/developer.apple.com\/documentation\/metalperformanceshaders\/mpscnnpoolingaverage\ncrawled: 2025-12-05T00:36:14Z\n---\n\n# MPSCNNPoolingAverage\n\n**Class**\n\nAn average pooling filter.\n\n## Declaration\n\n```swift\nclass MPSCNNPoolingAverage\n```\n\n## Overview\n\nFor each pixel in an image, the filter returns the average value of the pixels in the filter region defined by `kernelWidth` `x` `kernelHeight`.\n\nWhen the value of the [doc:\/\/com.apple.metalperformanceshaders\/documentation\/MetalPerformanceShaders\/MPSCNNKernel\/edgeMode] property is set to [doc:\/\/com.apple.metalperformanceshaders\/documentation\/MetalPerformanceShaders\/MPSImageEdgeMode\/clamp], the filtering window is shrunk to remain within the source image borders. For pixels close to the image borders, the filtering window will be smaller in order to fit inside the source image and less values will be used to compute the average value. In case the filtering window is entirely outside the source image border, the output value will be `0`.\n\n## Initializers\n\n- **init(coder:device:)**: Initializes an average pooling filter.\n- **init(device:kernelWidth:kernelHeight:strideInPixelsX:strideInPixelsY:)**: Initializes an average pooling filter.\n\n## Instance Properties\n\n- **zeroPadSizeX**\n- **zeroPadSizeY**\n\n## Pooling Layers\n\n- **MPSCNNPoolingAverageGradient**: A gradient average pooling filter.\n- **MPSCNNPoolingL2Norm**: An L2-norm pooling filter.\n- **MPSCNNPoolingMax**: A max pooling filter.\n- **MPSCNNDilatedPoolingMax**: A dilated max pooling filter.\n- **MPSCNNPooling**: A pooling kernel.\n- **MPSCNNPoolingGradient**: A gradient pooling kernel.\n- **MPSCNNDilatedPoolingMaxGradient**: A gradient dilated max pooling filter.\n- **MPSCNNPoolingL2NormGradient**: A gradient L2-norm pooling filter.\n- **MPSCNNPoolingMaxGradient**: A gradient max pooling filter.\n\n## Inherits From\n\n- MPSCNNPooling\n\n## Conforms To\n\n- CVarArg\n- CustomDebugStringConvertible\n- CustomStringConvertible\n- Equatable\n- Hashable\n- NSCoding\n- NSCopying\n- NSObjectProtocol\n- NSSecureCoding\n\n",
  "sections" : [
    {
      "content" : "",
      "items" : [
        {
          "description" : "Initializes an average pooling filter.",
          "name" : "init(coder:device:)",
          "url" : "https:\/\/developer.apple.com\/documentation\/MetalPerformanceShaders\/MPSCNNPoolingAverage\/init(coder:device:)"
        },
        {
          "description" : "Initializes an average pooling filter.",
          "name" : "init(device:kernelWidth:kernelHeight:strideInPixelsX:strideInPixelsY:)",
          "url" : "https:\/\/developer.apple.com\/documentation\/MetalPerformanceShaders\/MPSCNNPoolingAverage\/init(device:kernelWidth:kernelHeight:strideInPixelsX:strideInPixelsY:)"
        }
      ],
      "title" : "Initializers"
    },
    {
      "content" : "",
      "items" : [
        {
          "description" : "",
          "name" : "zeroPadSizeX",
          "url" : "https:\/\/developer.apple.com\/documentation\/MetalPerformanceShaders\/MPSCNNPoolingAverage\/zeroPadSizeX"
        },
        {
          "description" : "",
          "name" : "zeroPadSizeY",
          "url" : "https:\/\/developer.apple.com\/documentation\/MetalPerformanceShaders\/MPSCNNPoolingAverage\/zeroPadSizeY"
        }
      ],
      "title" : "Instance Properties"
    },
    {
      "content" : "",
      "items" : [
        {
          "description" : "A gradient average pooling filter.",
          "name" : "MPSCNNPoolingAverageGradient",
          "url" : "https:\/\/developer.apple.com\/documentation\/MetalPerformanceShaders\/MPSCNNPoolingAverageGradient"
        },
        {
          "description" : "An L2-norm pooling filter.",
          "name" : "MPSCNNPoolingL2Norm",
          "url" : "https:\/\/developer.apple.com\/documentation\/MetalPerformanceShaders\/MPSCNNPoolingL2Norm"
        },
        {
          "description" : "A max pooling filter.",
          "name" : "MPSCNNPoolingMax",
          "url" : "https:\/\/developer.apple.com\/documentation\/MetalPerformanceShaders\/MPSCNNPoolingMax"
        },
        {
          "description" : "A dilated max pooling filter.",
          "name" : "MPSCNNDilatedPoolingMax",
          "url" : "https:\/\/developer.apple.com\/documentation\/MetalPerformanceShaders\/MPSCNNDilatedPoolingMax"
        },
        {
          "description" : "A pooling kernel.",
          "name" : "MPSCNNPooling",
          "url" : "https:\/\/developer.apple.com\/documentation\/MetalPerformanceShaders\/MPSCNNPooling"
        },
        {
          "description" : "A gradient pooling kernel.",
          "name" : "MPSCNNPoolingGradient",
          "url" : "https:\/\/developer.apple.com\/documentation\/MetalPerformanceShaders\/MPSCNNPoolingGradient"
        },
        {
          "description" : "A gradient dilated max pooling filter.",
          "name" : "MPSCNNDilatedPoolingMaxGradient",
          "url" : "https:\/\/developer.apple.com\/documentation\/MetalPerformanceShaders\/MPSCNNDilatedPoolingMaxGradient"
        },
        {
          "description" : "A gradient L2-norm pooling filter.",
          "name" : "MPSCNNPoolingL2NormGradient",
          "url" : "https:\/\/developer.apple.com\/documentation\/MetalPerformanceShaders\/MPSCNNPoolingL2NormGradient"
        },
        {
          "description" : "A gradient max pooling filter.",
          "name" : "MPSCNNPoolingMaxGradient",
          "url" : "https:\/\/developer.apple.com\/documentation\/MetalPerformanceShaders\/MPSCNNPoolingMaxGradient"
        }
      ],
      "title" : "Pooling Layers"
    },
    {
      "content" : "",
      "items" : [
        {
          "name" : "MPSCNNPooling"
        }
      ],
      "title" : "Inherits From"
    }
  ],
  "source" : "appleJSON",
  "title" : "MPSCNNPoolingAverage",
  "url" : "https:\/\/developer.apple.com\/documentation\/metalperformanceshaders\/mpscnnpoolingaverage"
}