{
  "abstract" : "The purgeable state of an image’s underlying texture.",
  "codeExamples" : [

  ],
  "conformsTo" : [
    "BitwiseCopyable",
    "Equatable",
    "Hashable",
    "RawRepresentable",
    "Sendable",
    "SendableMetatype"
  ],
  "contentHash" : "51a00d9b32fe7d95b9d08b32fe2d3af7a3c9cc3081feb0134e1e00482321eb4f",
  "crawledAt" : "2025-12-05T00:05:33Z",
  "declaration" : {
    "code" : "enum MPSPurgeableState",
    "language" : "swift"
  },
  "id" : "FDCF128C-A224-415F-8BD2-D98B03E11504",
  "kind" : "enum",
  "language" : "swift",
  "module" : "Metal Performance Shaders",
  "platforms" : [
    "iOS",
    "iPadOS",
    "Mac Catalyst",
    "macOS",
    "tvOS",
    "visionOS"
  ],
  "rawMarkdown" : "---\nsource: https:\/\/developer.apple.com\/documentation\/metalperformanceshaders\/mpspurgeablestate\ncrawled: 2025-12-05T00:05:33Z\n---\n\n# MPSPurgeableState\n\n**Enumeration**\n\nThe purgeable state of an image’s underlying texture.\n\n## Declaration\n\n```swift\nenum MPSPurgeableState\n```\n\n## Constants\n\n- **MPSPurgeableState.allocationDeferred**: The image’s underlying texture hasn’t been allocated yet. Attempts to set another purgeable state using the [doc:\/\/com.apple.metalperformanceshaders\/documentation\/MetalPerformanceShaders\/MPSImage\/setPurgeableState(_:)] method will be ignored.\n- **MPSPurgeableState.keepCurrent**: The current state is queried but doesn’t change.\n- **MPSPurgeableState.nonVolatile**: The contents of the resource aren’t allowed to be discarded.\n- **MPSPurgeableState.volatile**: The system is allowed to discard the resource to free up memory.\n- **MPSPurgeableState.empty**: The contents of the resource are or will be discarded.\n\n## Initializers\n\n- **init(rawValue:)**\n\n## Methods\n\n- **setPurgeableState(_:)**: Set (or query) the purgeable state of the image’s underlying texture.\n\n## Conforms To\n\n- BitwiseCopyable\n- Equatable\n- Hashable\n- RawRepresentable\n- Sendable\n- SendableMetatype\n\n",
  "sections" : [
    {
      "content" : "",
      "items" : [
        {
          "description" : "The image’s underlying texture hasn’t been allocated yet. Attempts to set another purgeable state using the [doc:\/\/com.apple.metalperformanceshaders\/documentation\/MetalPerformanceShaders\/MPSImage\/setPurgeableState(_:)] method will be ignored.",
          "name" : "MPSPurgeableState.allocationDeferred",
          "url" : "https:\/\/developer.apple.com\/documentation\/MetalPerformanceShaders\/MPSPurgeableState\/allocationDeferred"
        },
        {
          "description" : "The current state is queried but doesn’t change.",
          "name" : "MPSPurgeableState.keepCurrent",
          "url" : "https:\/\/developer.apple.com\/documentation\/MetalPerformanceShaders\/MPSPurgeableState\/keepCurrent"
        },
        {
          "description" : "The contents of the resource aren’t allowed to be discarded.",
          "name" : "MPSPurgeableState.nonVolatile",
          "url" : "https:\/\/developer.apple.com\/documentation\/MetalPerformanceShaders\/MPSPurgeableState\/nonVolatile"
        },
        {
          "description" : "The system is allowed to discard the resource to free up memory.",
          "name" : "MPSPurgeableState.volatile",
          "url" : "https:\/\/developer.apple.com\/documentation\/MetalPerformanceShaders\/MPSPurgeableState\/volatile"
        },
        {
          "description" : "The contents of the resource are or will be discarded.",
          "name" : "MPSPurgeableState.empty",
          "url" : "https:\/\/developer.apple.com\/documentation\/MetalPerformanceShaders\/MPSPurgeableState\/empty"
        }
      ],
      "title" : "Constants"
    },
    {
      "content" : "",
      "items" : [
        {
          "description" : "",
          "name" : "init(rawValue:)",
          "url" : "https:\/\/developer.apple.com\/documentation\/MetalPerformanceShaders\/MPSPurgeableState\/init(rawValue:)"
        }
      ],
      "title" : "Initializers"
    },
    {
      "content" : "",
      "items" : [
        {
          "description" : "Set (or query) the purgeable state of the image’s underlying texture.",
          "name" : "setPurgeableState(_:)",
          "url" : "https:\/\/developer.apple.com\/documentation\/MetalPerformanceShaders\/MPSImage\/setPurgeableState(_:)"
        }
      ],
      "title" : "Methods"
    }
  ],
  "source" : "appleJSON",
  "title" : "MPSPurgeableState",
  "url" : "https:\/\/developer.apple.com\/documentation\/metalperformanceshaders\/mpspurgeablestate"
}