{
  "abstract" : "A filter that calculates the sum of squared pixels over a specified region in an image.",
  "codeExamples" : [
    {
      "code" : "sumRect.origin = filter.offset\nsumRect.size = dest_position - filter.clipRect.origin",
      "language" : "other"
    }
  ],
  "conformsTo" : [
    "CVarArg",
    "CustomDebugStringConvertible",
    "CustomStringConvertible",
    "Equatable",
    "Hashable",
    "NSCoding",
    "NSCopying",
    "NSObjectProtocol",
    "NSSecureCoding"
  ],
  "contentHash" : "7111a18b2417b8770d80d7b9431efd23a102d23c7d8dd04cb297664b32987575",
  "crawledAt" : "2025-12-04T22:34:39Z",
  "declaration" : {
    "code" : "class MPSImageIntegralOfSquares",
    "language" : "swift"
  },
  "id" : "82E907A7-AFA6-4C9D-8F42-5D165200B432",
  "kind" : "class",
  "language" : "swift",
  "module" : "Metal Performance Shaders",
  "overview" : "## Overview\n\nThe value at each position is the sum of all squared pixels in a source image rectangle, `sumRect.` The following listing shows the pseudocode used to calculate `sumRect`.\n\nListing 1. Pseudocode for sumRect\n\nIf the channels in the source image are normalized, half-float or floating values, the destination image is recommended to be a 32-bit floating-point image. If the channels in the source image are integer values, it is recommended that an appropriate 32-bit integer image destination format is used.",
  "platforms" : [
    "iOS",
    "iPadOS",
    "Mac Catalyst",
    "macOS",
    "tvOS",
    "visionOS"
  ],
  "rawMarkdown" : "---\nsource: https:\/\/developer.apple.com\/documentation\/MetalPerformanceShaders\/MPSImageIntegralOfSquares\ncrawled: 2025-12-04T22:34:39Z\n---\n\n# MPSImageIntegralOfSquares\n\n**Class**\n\nA filter that calculates the sum of squared pixels over a specified region in an image.\n\n## Declaration\n\n```swift\nclass MPSImageIntegralOfSquares\n```\n\n## Overview\n\nThe value at each position is the sum of all squared pixels in a source image rectangle, `sumRect.` The following listing shows the pseudocode used to calculate `sumRect`.\n\nListing 1. Pseudocode for sumRect\n\n```other\nsumRect.origin = filter.offset\nsumRect.size = dest_position - filter.clipRect.origin\n```\n\nIf the channels in the source image are normalized, half-float or floating values, the destination image is recommended to be a 32-bit floating-point image. If the channels in the source image are integer values, it is recommended that an appropriate 32-bit integer image destination format is used.\n\n## Image Integral Filters\n\n- **MPSImageIntegral**: A filter that calculates the sum of pixels over a specified region in an image.\n\n## Inherits From\n\n- MPSUnaryImageKernel\n\n## Conforms To\n\n- CVarArg\n- CustomDebugStringConvertible\n- CustomStringConvertible\n- Equatable\n- Hashable\n- NSCoding\n- NSCopying\n- NSObjectProtocol\n- NSSecureCoding\n\n",
  "sections" : [
    {
      "content" : "",
      "items" : [
        {
          "description" : "A filter that calculates the sum of pixels over a specified region in an image.",
          "name" : "MPSImageIntegral",
          "url" : "https:\/\/developer.apple.com\/documentation\/MetalPerformanceShaders\/MPSImageIntegral"
        }
      ],
      "title" : "Image Integral Filters"
    },
    {
      "content" : "",
      "items" : [
        {
          "name" : "MPSUnaryImageKernel"
        }
      ],
      "title" : "Inherits From"
    }
  ],
  "source" : "appleJSON",
  "title" : "MPSImageIntegralOfSquares",
  "url" : "https:\/\/developer.apple.com\/documentation\/MetalPerformanceShaders\/MPSImageIntegralOfSquares"
}