{
  "abstract" : "A Boolean value that indicates whether deferred start runs automatically.",
  "codeExamples" : [

  ],
  "contentHash" : "31a4ebd444f0e555bdf066ac48d294bc3273f0be5c1608627df7ef5c732a1524",
  "crawledAt" : "2025-12-02T17:30:40Z",
  "declaration" : {
    "code" : "var automaticallyRunsDeferredStart: Bool { get set }",
    "language" : "swift"
  },
  "id" : "68789301-22E2-4997-94A9-7A13E3E5DA98",
  "kind" : "property",
  "language" : "swift",
  "module" : "AVFoundation",
  "overview" : "## Discussion\n\nDeferred Start is a feature that allows you to control, on a per-output basis, whether output objects start when or after the session is started. The session defers starting an output when its [doc:\/\/com.apple.avfoundation\/documentation\/AVFoundation\/AVCaptureOutput\/isDeferredStartEnabled] property is set to `true`, and starts it after the session is started.\n\nWhen this value is `true`, [doc:\/\/com.apple.avfoundation\/documentation\/AVFoundation\/AVCaptureSession] automatically runs deferred start. If only [doc:\/\/com.apple.avfoundation\/documentation\/AVFoundation\/AVCaptureVideoPreviewLayer] objects have [doc:\/\/com.apple.avfoundation\/documentation\/AVFoundation\/AVCaptureVideoPreviewLayer\/isDeferredStartEnabled] set to `false`, the session runs deferred start a short time after displaying the first frame. If there are [doc:\/\/com.apple.avfoundation\/documentation\/AVFoundation\/AVCaptureOutput] objects that have [doc:\/\/com.apple.avfoundation\/documentation\/AVFoundation\/AVCaptureOutput\/isDeferredStartEnabled] set to `false`, then the session waits until each output that provides streaming data to your app sends its first frame.\n\nIf you set this value to `false`, call [doc:\/\/com.apple.avfoundation\/documentation\/AVFoundation\/AVCaptureSession\/runDeferredStartWhenNeeded()] to indicate when to run deferred start.\n\nBy default, for apps that are linked on or after iOS 26, this value is `true`.\n\nIf [doc:\/\/com.apple.avfoundation\/documentation\/AVFoundation\/AVCaptureSession\/isManualDeferredStartSupported] is `false`, setting this property value to false results in the session throwing an invalid argument exception.",
  "platforms" : [
    "iOS",
    "iPadOS",
    "Mac Catalyst",
    "macOS",
    "tvOS"
  ],
  "rawMarkdown" : "---\nsource: https:\/\/developer.apple.com\/documentation\/AVFoundation\/AVCaptureSession\/automaticallyRunsDeferredStart\ncrawled: 2025-12-02T17:30:40Z\n---\n\n# automaticallyRunsDeferredStart\n\n**Instance Property**\n\nA Boolean value that indicates whether deferred start runs automatically.\n\n## Declaration\n\n```swift\nvar automaticallyRunsDeferredStart: Bool { get set }\n```\n\n## Discussion\n\nDeferred Start is a feature that allows you to control, on a per-output basis, whether output objects start when or after the session is started. The session defers starting an output when its [doc:\/\/com.apple.avfoundation\/documentation\/AVFoundation\/AVCaptureOutput\/isDeferredStartEnabled] property is set to `true`, and starts it after the session is started.\n\nWhen this value is `true`, [doc:\/\/com.apple.avfoundation\/documentation\/AVFoundation\/AVCaptureSession] automatically runs deferred start. If only [doc:\/\/com.apple.avfoundation\/documentation\/AVFoundation\/AVCaptureVideoPreviewLayer] objects have [doc:\/\/com.apple.avfoundation\/documentation\/AVFoundation\/AVCaptureVideoPreviewLayer\/isDeferredStartEnabled] set to `false`, the session runs deferred start a short time after displaying the first frame. If there are [doc:\/\/com.apple.avfoundation\/documentation\/AVFoundation\/AVCaptureOutput] objects that have [doc:\/\/com.apple.avfoundation\/documentation\/AVFoundation\/AVCaptureOutput\/isDeferredStartEnabled] set to `false`, then the session waits until each output that provides streaming data to your app sends its first frame.\n\nIf you set this value to `false`, call [doc:\/\/com.apple.avfoundation\/documentation\/AVFoundation\/AVCaptureSession\/runDeferredStartWhenNeeded()] to indicate when to run deferred start.\n\nBy default, for apps that are linked on or after iOS 26, this value is `true`.\n\nIf [doc:\/\/com.apple.avfoundation\/documentation\/AVFoundation\/AVCaptureSession\/isManualDeferredStartSupported] is `false`, setting this property value to false results in the session throwing an invalid argument exception.\n\n## Configuring deferred start\n\n- **isManualDeferredStartSupported**: A `BOOL` value that indicates whether the session supports manually running deferred start.\n- **runDeferredStartWhenNeeded()**: Tells the session to run deferred start when appropriate.\n- **deferredStartDelegate**: A delegate object that observes events about deferred start.\n- **deferredStartDelegateCallbackQueue**: The dispatch queue on which the session calls deferred start delegate methods.\n- **setDeferredStartDelegate(_:deferredStartDelegateCallbackQueue:)**: Sets a delegate object for the session to call when performing deferred start.\n- **AVCaptureSessionDeferredStartDelegate**: A protocol that defines the interface to respond to events about a capture session’s deferred start.\n\n",
  "sections" : [
    {
      "content" : "",
      "items" : [
        {
          "description" : "A `BOOL` value that indicates whether the session supports manually running deferred start.",
          "name" : "isManualDeferredStartSupported",
          "url" : "https:\/\/developer.apple.com\/documentation\/AVFoundation\/AVCaptureSession\/isManualDeferredStartSupported"
        },
        {
          "description" : "Tells the session to run deferred start when appropriate.",
          "name" : "runDeferredStartWhenNeeded()",
          "url" : "https:\/\/developer.apple.com\/documentation\/AVFoundation\/AVCaptureSession\/runDeferredStartWhenNeeded()"
        },
        {
          "description" : "A delegate object that observes events about deferred start.",
          "name" : "deferredStartDelegate",
          "url" : "https:\/\/developer.apple.com\/documentation\/AVFoundation\/AVCaptureSession\/deferredStartDelegate"
        },
        {
          "description" : "The dispatch queue on which the session calls deferred start delegate methods.",
          "name" : "deferredStartDelegateCallbackQueue",
          "url" : "https:\/\/developer.apple.com\/documentation\/AVFoundation\/AVCaptureSession\/deferredStartDelegateCallbackQueue"
        },
        {
          "description" : "Sets a delegate object for the session to call when performing deferred start.",
          "name" : "setDeferredStartDelegate(_:deferredStartDelegateCallbackQueue:)",
          "url" : "https:\/\/developer.apple.com\/documentation\/AVFoundation\/AVCaptureSession\/setDeferredStartDelegate(_:deferredStartDelegateCallbackQueue:)"
        },
        {
          "description" : "A protocol that defines the interface to respond to events about a capture session’s deferred start.",
          "name" : "AVCaptureSessionDeferredStartDelegate",
          "url" : "https:\/\/developer.apple.com\/documentation\/AVFoundation\/AVCaptureSessionDeferredStartDelegate"
        }
      ],
      "title" : "Configuring deferred start"
    }
  ],
  "source" : "appleJSON",
  "title" : "automaticallyRunsDeferredStart",
  "url" : "https:\/\/developer.apple.com\/documentation\/AVFoundation\/AVCaptureSession\/automaticallyRunsDeferredStart"
}