{
  "abstract" : "A delegate object that receives depth data.",
  "codeExamples" : [

  ],
  "contentHash" : "c9533d33c011d63e60232be2aa772039c8d31ef1e2c50e26db65674f5f9fc25d",
  "crawledAt" : "2025-12-02T19:04:41Z",
  "declaration" : {
    "code" : "var delegate: (any AVCaptureDepthDataOutputDelegate)? { get }",
    "language" : "swift"
  },
  "id" : "43CA91DA-545F-4D24-B4EB-B23AAA160C5B",
  "kind" : "property",
  "language" : "swift",
  "module" : "AVFoundation",
  "overview" : "## Discussion\n\nThis property is read-only. You set the delegate object and the dispatch queue for calling delegate methods together using the [doc:\/\/com.apple.avfoundation\/documentation\/AVFoundation\/AVCaptureDepthDataOutput\/setDelegate(_:callbackQueue:)] method.",
  "platforms" : [
    "iOS",
    "iPadOS",
    "Mac Catalyst",
    "tvOS"
  ],
  "rawMarkdown" : "---\nsource: https:\/\/developer.apple.com\/documentation\/AVFoundation\/AVCaptureDepthDataOutput\/delegate\ncrawled: 2025-12-02T19:04:41Z\n---\n\n# delegate\n\n**Instance Property**\n\nA delegate object that receives depth data.\n\n## Declaration\n\n```swift\nvar delegate: (any AVCaptureDepthDataOutputDelegate)? { get }\n```\n\n## Discussion\n\nThis property is read-only. You set the delegate object and the dispatch queue for calling delegate methods together using the [doc:\/\/com.apple.avfoundation\/documentation\/AVFoundation\/AVCaptureDepthDataOutput\/setDelegate(_:callbackQueue:)] method.\n\n## Receiving captured depth data\n\n- **setDelegate(_:callbackQueue:)**: Designates a delegate object to receive depth data and a dispatch queue for delivering that data.\n- **delegateCallbackQueue**: A dispatch queue for delivering depth data.\n- **AVCaptureDepthDataOutputDelegate**: Methods for receiving depth data produced by a depth capture output.\n\n",
  "sections" : [
    {
      "content" : "",
      "items" : [
        {
          "description" : "Designates a delegate object to receive depth data and a dispatch queue for delivering that data.",
          "name" : "setDelegate(_:callbackQueue:)",
          "url" : "https:\/\/developer.apple.com\/documentation\/AVFoundation\/AVCaptureDepthDataOutput\/setDelegate(_:callbackQueue:)"
        },
        {
          "description" : "A dispatch queue for delivering depth data.",
          "name" : "delegateCallbackQueue",
          "url" : "https:\/\/developer.apple.com\/documentation\/AVFoundation\/AVCaptureDepthDataOutput\/delegateCallbackQueue"
        },
        {
          "description" : "Methods for receiving depth data produced by a depth capture output.",
          "name" : "AVCaptureDepthDataOutputDelegate",
          "url" : "https:\/\/developer.apple.com\/documentation\/AVFoundation\/AVCaptureDepthDataOutputDelegate"
        }
      ],
      "title" : "Receiving captured depth data"
    }
  ],
  "source" : "appleJSON",
  "title" : "delegate",
  "url" : "https:\/\/developer.apple.com\/documentation\/AVFoundation\/AVCaptureDepthDataOutput\/delegate"
}