{
  "abstract" : "A Boolean value that indicates whether to automatically trim Live Photo movie captures to avoid excessive movement.",
  "codeExamples" : [

  ],
  "contentHash" : "7ab3497b4736e5522fda2304e0a2a890f4f2daffa7cfced1626ad57a44341d5e",
  "crawledAt" : "2025-12-02T19:24:48Z",
  "declaration" : {
    "code" : "var isLivePhotoAutoTrimmingEnabled: Bool { get set }",
    "language" : "swift"
  },
  "id" : "68FA325B-B703-4880-AF75-F630AA748B34",
  "kind" : "property",
  "language" : "swift",
  "module" : "AVFoundation",
  "overview" : "## Discussion\n\nThis value defaults to [doc:\/\/com.apple.documentation\/documentation\/Swift\/true] when [doc:\/\/com.apple.avfoundation\/documentation\/AVFoundation\/AVCapturePhotoOutput\/isLivePhotoCaptureSupported] is [doc:\/\/com.apple.documentation\/documentation\/Swift\/true].\n\nUse this option to enable the same automatic trimming behavior found in the Camera app. By default, a Live Photo capture is about three seconds in duration, centered on the time of the capture request. If the user moves the camera during capture, iOS analyzes the capture and automatically trims the duration of the Live Photo to avoid capturing excess movement.\n\nChanging this value while your session is running requires a lengthy reconfiguration of the session. If you intend to take any Live Photo captures, set this value to [doc:\/\/com.apple.documentation\/documentation\/Swift\/true] before calling [doc:\/\/com.apple.avfoundation\/documentation\/AVFoundation\/AVCaptureSession] [doc:\/\/com.apple.avfoundation\/documentation\/AVFoundation\/AVCaptureSession\/startRunning()]. If you change this property while the session is running, in-progress Live Photo captures end immediately, unfulfilled photo requests cancel, and the video preview temporarily freezes.",
  "platforms" : [
    "iOS",
    "iPadOS",
    "Mac Catalyst",
    "tvOS"
  ],
  "rawMarkdown" : "---\nsource: https:\/\/developer.apple.com\/documentation\/AVFoundation\/AVCapturePhotoOutput\/isLivePhotoAutoTrimmingEnabled\ncrawled: 2025-12-02T19:24:48Z\n---\n\n# isLivePhotoAutoTrimmingEnabled\n\n**Instance Property**\n\nA Boolean value that indicates whether to automatically trim Live Photo movie captures to avoid excessive movement.\n\n## Declaration\n\n```swift\nvar isLivePhotoAutoTrimmingEnabled: Bool { get set }\n```\n\n## Discussion\n\nThis value defaults to [doc:\/\/com.apple.documentation\/documentation\/Swift\/true] when [doc:\/\/com.apple.avfoundation\/documentation\/AVFoundation\/AVCapturePhotoOutput\/isLivePhotoCaptureSupported] is [doc:\/\/com.apple.documentation\/documentation\/Swift\/true].\n\nUse this option to enable the same automatic trimming behavior found in the Camera app. By default, a Live Photo capture is about three seconds in duration, centered on the time of the capture request. If the user moves the camera during capture, iOS analyzes the capture and automatically trims the duration of the Live Photo to avoid capturing excess movement.\n\nChanging this value while your session is running requires a lengthy reconfiguration of the session. If you intend to take any Live Photo captures, set this value to [doc:\/\/com.apple.documentation\/documentation\/Swift\/true] before calling [doc:\/\/com.apple.avfoundation\/documentation\/AVFoundation\/AVCaptureSession] [doc:\/\/com.apple.avfoundation\/documentation\/AVFoundation\/AVCaptureSession\/startRunning()]. If you change this property while the session is running, in-progress Live Photo captures end immediately, unfulfilled photo requests cancel, and the video preview temporarily freezes.\n\n## Configuring Live Photo capture\n\n- **isLivePhotoCaptureSupported**: A Boolean value that indicates whether the capture output currently supports Live Photo capture.\n- **isLivePhotoCaptureEnabled**: A Boolean value that indicates whether to configure the capture pipeline for Live Photo capture.\n- **isLivePhotoCaptureSuspended**: A Boolean value that indicates whether Live Photo capture is currently in a suspended state.\n- **preservesLivePhotoCaptureSuspendedOnSessionStop**: A Boolean value that indicates whether to preserve the suspended state of Live Photo capture when the session stops.\n- **availableLivePhotoVideoCodecTypes**: An array of video codecs currently available for Live Photo movie captures.\n\n",
  "sections" : [
    {
      "content" : "",
      "items" : [
        {
          "description" : "A Boolean value that indicates whether the capture output currently supports Live Photo capture.",
          "name" : "isLivePhotoCaptureSupported",
          "url" : "https:\/\/developer.apple.com\/documentation\/AVFoundation\/AVCapturePhotoOutput\/isLivePhotoCaptureSupported"
        },
        {
          "description" : "A Boolean value that indicates whether to configure the capture pipeline for Live Photo capture.",
          "name" : "isLivePhotoCaptureEnabled",
          "url" : "https:\/\/developer.apple.com\/documentation\/AVFoundation\/AVCapturePhotoOutput\/isLivePhotoCaptureEnabled"
        },
        {
          "description" : "A Boolean value that indicates whether Live Photo capture is currently in a suspended state.",
          "name" : "isLivePhotoCaptureSuspended",
          "url" : "https:\/\/developer.apple.com\/documentation\/AVFoundation\/AVCapturePhotoOutput\/isLivePhotoCaptureSuspended"
        },
        {
          "description" : "A Boolean value that indicates whether to preserve the suspended state of Live Photo capture when the session stops.",
          "name" : "preservesLivePhotoCaptureSuspendedOnSessionStop",
          "url" : "https:\/\/developer.apple.com\/documentation\/AVFoundation\/AVCapturePhotoOutput\/preservesLivePhotoCaptureSuspendedOnSessionStop"
        },
        {
          "description" : "An array of video codecs currently available for Live Photo movie captures.",
          "name" : "availableLivePhotoVideoCodecTypes",
          "url" : "https:\/\/developer.apple.com\/documentation\/AVFoundation\/AVCapturePhotoOutput\/availableLivePhotoVideoCodecTypes"
        }
      ],
      "title" : "Configuring Live Photo capture"
    }
  ],
  "source" : "appleJSON",
  "title" : "isLivePhotoAutoTrimmingEnabled",
  "url" : "https:\/\/developer.apple.com\/documentation\/AVFoundation\/AVCapturePhotoOutput\/isLivePhotoAutoTrimmingEnabled"
}