{
  "abstract" : "Retrieves a track in the movie that contains the specified identifier.",
  "codeExamples" : [

  ],
  "contentHash" : "8891005a1fcac50501cb4a3145ece19385019b6225fa7328868ae3aef0693391",
  "crawledAt" : "2025-12-05T08:45:59Z",
  "declaration" : {
    "code" : "func track(withTrackID trackID: CMPersistentTrackID) -> AVFragmentedMovieTrack?",
    "language" : "swift"
  },
  "id" : "7A909FA5-C963-4FBD-9553-5AF3FE62D285",
  "kind" : "method",
  "language" : "swift",
  "module" : "AVFoundation",
  "overview" : "## Return Value\n\nA movie track, or `nil` if there is no track with the identifier.\n\n## Discussion\n\nApple discourages using this method in iOS 15, tvOS 15, macOS 12, and watchOS 8 or later. Load a track asynchronously using [doc:\/\/com.apple.avfoundation\/documentation\/AVFoundation\/AVFragmentedMovie\/loadTrack(withTrackID:completionHandler:)] instead.",
  "platforms" : [
    "iOS",
    "iPadOS",
    "Mac Catalyst",
    "macOS",
    "watchOS"
  ],
  "rawMarkdown" : "---\nsource: https:\/\/developer.apple.com\/documentation\/AVFoundation\/AVFragmentedMovie\/track(withTrackID:)\ncrawled: 2025-12-05T08:45:59Z\n---\n\n# track(withTrackID:)\n\n**Instance Method**\n\nRetrieves a track in the movie that contains the specified identifier.\n\n## Declaration\n\n```swift\nfunc track(withTrackID trackID: CMPersistentTrackID) -> AVFragmentedMovieTrack?\n```\n\n## Parameters\n\n- **trackID**: The persistent track identifier.\n\n## Return Value\n\nA movie track, or `nil` if there is no track with the identifier.\n\n## Discussion\n\nApple discourages using this method in iOS 15, tvOS 15, macOS 12, and watchOS 8 or later. Load a track asynchronously using [doc:\/\/com.apple.avfoundation\/documentation\/AVFoundation\/AVFragmentedMovie\/loadTrack(withTrackID:completionHandler:)] instead.\n\n## Accessing tracks\n\n- **tracks**: The tracks that a movie contains.\n- **tracks(withMediaType:)**: Retrieves tracks in the movie that present media of the specified type.\n- **tracks(withMediaCharacteristic:)**: Retrieves tracks in the movie that present media of the specified characteristic.\n\n",
  "sections" : [
    {
      "content" : "",
      "items" : [
        {
          "description" : "The tracks that a movie contains.",
          "name" : "tracks",
          "url" : "https:\/\/developer.apple.com\/documentation\/AVFoundation\/AVFragmentedMovie\/tracks"
        },
        {
          "description" : "Retrieves tracks in the movie that present media of the specified type.",
          "name" : "tracks(withMediaType:)",
          "url" : "https:\/\/developer.apple.com\/documentation\/AVFoundation\/AVFragmentedMovie\/tracks(withMediaType:)"
        },
        {
          "description" : "Retrieves tracks in the movie that present media of the specified characteristic.",
          "name" : "tracks(withMediaCharacteristic:)",
          "url" : "https:\/\/developer.apple.com\/documentation\/AVFoundation\/AVFragmentedMovie\/tracks(withMediaCharacteristic:)"
        }
      ],
      "title" : "Accessing tracks"
    }
  ],
  "source" : "appleJSON",
  "title" : "track(withTrackID:)",
  "url" : "https:\/\/developer.apple.com\/documentation\/AVFoundation\/AVFragmentedMovie\/track(withTrackID:)"
}