{
  "abstract" : "A Boolean value that indicates whether the channel is in an enabled state.",
  "codeExamples" : [

  ],
  "contentHash" : "9cf9854ab64f901d4bb2bd9e5a8be1a1ae37f54ecef9c5f7f50957f97a12be5a",
  "crawledAt" : "2025-12-01T12:02:30Z",
  "declaration" : {
    "code" : "var isEnabled: Bool { get set }",
    "language" : "swift"
  },
  "id" : "B76720EC-4DA4-4136-A2F2-33DBAD7BBF28",
  "kind" : "property",
  "module" : "AVFoundation",
  "overview" : "## Discussion\n\nBy default, a connection enables all audio channels that it exposes. You can set this value to [doc:\/\/com.apple.documentation\/documentation\/Swift\/false] to stop the flow of data for a particular channel.",
  "platforms" : [
    "macOS"
  ],
  "rawMarkdown" : "---\nsource: https:\/\/developer.apple.com\/documentation\/AVFoundation\/AVCaptureAudioChannel\/isEnabled\ncrawled: 2025-12-01T12:02:30Z\n---\n\n# isEnabled\n\n**Instance Property**\n\nA Boolean value that indicates whether the channel is in an enabled state.\n\n## Declaration\n\n```swift\nvar isEnabled: Bool { get set }\n```\n\n## Discussion\n\nBy default, a connection enables all audio channels that it exposes. You can set this value to [doc:\/\/com.apple.documentation\/documentation\/Swift\/false] to stop the flow of data for a particular channel.\n\n## Configuring a channel\n\n- **volume**: The current volume (gain) of the channel.\n\n",
  "sections" : [
    {
      "content" : "",
      "items" : [
        {
          "description" : "The current volume (gain) of the channel.",
          "name" : "volume",
          "url" : "https:\/\/developer.apple.com\/documentation\/AVFoundation\/AVCaptureAudioChannel\/volume"
        }
      ],
      "title" : "Configuring a channel"
    }
  ],
  "source" : "appleJSON",
  "title" : "isEnabled",
  "url" : "https:\/\/developer.apple.com\/documentation\/AVFoundation\/AVCaptureAudioChannel\/isEnabled"
}