{
  "abstract" : "Returns the background color at the index position.",
  "codeExamples" : [

  ],
  "contentHash" : "3c3bb6995db519682994b683a6b82d02a3f09d5f237300275eb55f546c317c07",
  "crawledAt" : "2025-12-01T09:48:56Z",
  "declaration" : {
    "code" : "@nonobjc func backgroundColor(at index: String.Index) -> (CGColor?, Range<String.Index>)",
    "language" : "swift"
  },
  "id" : "8388BACD-13DC-4CF2-A747-224D55A1FFDC",
  "kind" : "method",
  "module" : "AVFoundation",
  "overview" : "## Return Value\n\nA tuple that contains the background color and range to which it applies.",
  "platforms" : [
    "iOS",
    "iPadOS",
    "Mac Catalyst",
    "macOS"
  ],
  "rawMarkdown" : "---\nsource: https:\/\/developer.apple.com\/documentation\/AVFoundation\/AVCaption\/backgroundColor(at:)\ncrawled: 2025-12-01T09:48:56Z\n---\n\n# backgroundColor(at:)\n\n**Instance Method**\n\nReturns the background color at the index position.\n\n## Declaration\n\n```swift\n@nonobjc func backgroundColor(at index: String.Index) -> (CGColor?, Range<String.Index>)\n```\n\n## Parameters\n\n- **index**: A character position in the caption text.\n\n## Return Value\n\nA tuple that contains the background color and range to which it applies.\n\n## Accessing colors\n\n- **textColor(at:)**: Returns the text color at the index position.\n\n",
  "sections" : [
    {
      "content" : "",
      "items" : [
        {
          "description" : "Returns the text color at the index position.",
          "name" : "textColor(at:)",
          "url" : "https:\/\/developer.apple.com\/documentation\/AVFoundation\/AVCaption\/textColor(at:)"
        }
      ],
      "title" : "Accessing colors"
    }
  ],
  "source" : "appleJSON",
  "title" : "backgroundColor(at:)",
  "url" : "https:\/\/developer.apple.com\/documentation\/AVFoundation\/AVCaption\/backgroundColor(at:)"
}