{
  "abstract" : "Informs the delegate when the output will stop writing new samples to a file.",
  "codeExamples" : [

  ],
  "contentHash" : "d77ea1ac13a8757bb2c8d7989444640c85b84a811c5bbc009aa2bf68f7049899",
  "crawledAt" : "2025-12-06T00:25:45Z",
  "declaration" : {
    "code" : "optional func fileOutput(_ output: AVCaptureFileOutput, willFinishRecordingTo fileURL: URL, from connections: [AVCaptureConnection], error: (any Error)?)",
    "language" : "swift"
  },
  "id" : "31A25CFA-AD10-4ACE-B199-64DA19878395",
  "kind" : "method",
  "language" : "swift",
  "module" : "AVFoundation",
  "overview" : "## Discussion\n\nThis method is called when the file output will stop recording new samples to the file at [doc:\/\/com.apple.avfoundation\/documentation\/AVFoundation\/AVCaptureFileOutput\/outputFileURL], either because [doc:\/\/com.apple.avfoundation\/documentation\/AVFoundation\/AVCaptureFileOutput\/startRecording(to:recordingDelegate:)] or [doc:\/\/com.apple.avfoundation\/documentation\/AVFoundation\/AVCaptureFileOutput\/stopRecording()] was called, or because an error (described by the error parameter) occurred (if no error occurred, the error parameter is `nil`).\n\nThis method is always called for each recording request, even if no data is successfully written to the file.\n\nYou should not assume that this method will be called on a specific thread, and should make this method as efficient as possible.",
  "platforms" : [
    "macOS"
  ],
  "rawMarkdown" : "---\nsource: https:\/\/developer.apple.com\/documentation\/avfoundation\/avcapturefileoutputrecordingdelegate\/fileoutput(_:willfinishrecordingto:from:error:)\ncrawled: 2025-12-06T00:25:45Z\n---\n\n# fileOutput(_:willFinishRecordingTo:from:error:)\n\n**Instance Method**\n\nInforms the delegate when the output will stop writing new samples to a file.\n\n## Declaration\n\n```swift\noptional func fileOutput(_ output: AVCaptureFileOutput, willFinishRecordingTo fileURL: URL, from connections: [AVCaptureConnection], error: (any Error)?)\n```\n\n## Parameters\n\n- **output**: The capture file output that will finish writing the file.\n- **fileURL**: The file URL of the file that is being written.\n- **connections**: An array of [doc:\/\/com.apple.avfoundation\/documentation\/AVFoundation\/AVCaptureConnection] objects attached to the file output that provided the data that is being written to the file.\n- **error**: An error describing what caused the file to stop recording, or `nil` if there was no error.\n\n## Discussion\n\nThis method is called when the file output will stop recording new samples to the file at [doc:\/\/com.apple.avfoundation\/documentation\/AVFoundation\/AVCaptureFileOutput\/outputFileURL], either because [doc:\/\/com.apple.avfoundation\/documentation\/AVFoundation\/AVCaptureFileOutput\/startRecording(to:recordingDelegate:)] or [doc:\/\/com.apple.avfoundation\/documentation\/AVFoundation\/AVCaptureFileOutput\/stopRecording()] was called, or because an error (described by the error parameter) occurred (if no error occurred, the error parameter is `nil`).\n\nThis method is always called for each recording request, even if no data is successfully written to the file.\n\nYou should not assume that this method will be called on a specific thread, and should make this method as efficient as possible.\n\n## Delegate methods\n\n- **fileOutput(_:didStartRecordingTo:from:)**: Informs the delegate when the output has started writing to a file.\n- **fileOutput(_:didStartRecordingTo:startPTS:from:)**\n- **fileOutput(_:didFinishRecordingTo:from:error:)**: Informs the delegate when all pending data has been written to an output file.\n- **fileOutput(_:didPauseRecordingTo:from:)**: Called whenever the output is recording to a file and successfully pauses the recording at the request of a client.\n- **fileOutput(_:didResumeRecordingTo:from:)**: Called whenever the output, at the request of the client, successfully resumes a file recording that was paused.\n\n",
  "sections" : [
    {
      "content" : "",
      "items" : [
        {
          "description" : "Informs the delegate when the output has started writing to a file.",
          "name" : "fileOutput(_:didStartRecordingTo:from:)",
          "url" : "https:\/\/developer.apple.com\/documentation\/AVFoundation\/AVCaptureFileOutputRecordingDelegate\/fileOutput(_:didStartRecordingTo:from:)"
        },
        {
          "description" : "",
          "name" : "fileOutput(_:didStartRecordingTo:startPTS:from:)",
          "url" : "https:\/\/developer.apple.com\/documentation\/AVFoundation\/AVCaptureFileOutputRecordingDelegate\/fileOutput(_:didStartRecordingTo:startPTS:from:)"
        },
        {
          "description" : "Informs the delegate when all pending data has been written to an output file.",
          "name" : "fileOutput(_:didFinishRecordingTo:from:error:)",
          "url" : "https:\/\/developer.apple.com\/documentation\/AVFoundation\/AVCaptureFileOutputRecordingDelegate\/fileOutput(_:didFinishRecordingTo:from:error:)"
        },
        {
          "description" : "Called whenever the output is recording to a file and successfully pauses the recording at the request of a client.",
          "name" : "fileOutput(_:didPauseRecordingTo:from:)",
          "url" : "https:\/\/developer.apple.com\/documentation\/AVFoundation\/AVCaptureFileOutputRecordingDelegate\/fileOutput(_:didPauseRecordingTo:from:)"
        },
        {
          "description" : "Called whenever the output, at the request of the client, successfully resumes a file recording that was paused.",
          "name" : "fileOutput(_:didResumeRecordingTo:from:)",
          "url" : "https:\/\/developer.apple.com\/documentation\/AVFoundation\/AVCaptureFileOutputRecordingDelegate\/fileOutput(_:didResumeRecordingTo:from:)"
        }
      ],
      "title" : "Delegate methods"
    }
  ],
  "source" : "appleJSON",
  "title" : "fileOutput(_:willFinishRecordingTo:from:error:)",
  "url" : "https:\/\/developer.apple.com\/documentation\/avfoundation\/avcapturefileoutputrecordingdelegate\/fileoutput(_:willfinishrecordingto:from:error:)"
}