{
  "abstract" : "Presents the user the opportunity to authorize the content for playback.",
  "codeExamples" : [

  ],
  "contentHash" : "8984ea64c4f7582c9a014cbee3966f757ba5586f23d5f1b509b6240e3279cc96",
  "crawledAt" : "2025-12-02T17:12:06Z",
  "declaration" : {
    "code" : "@MainActor func requestContentAuthorizationAsynchronously(withTimeoutInterval timeoutInterval: TimeInterval, completionHandler handler: @escaping () -> Void)",
    "language" : "swift"
  },
  "id" : "4872EC9F-EEAC-4363-93DB-1BF0EF0C4B60",
  "kind" : "method",
  "language" : "swift",
  "module" : "AVFoundation",
  "overview" : "## Discussion\n\nCalling this method will present the user with the opportunity to authorize the content (for example, by launching iTunes and prompting the user to enter their Apple ID and password).\n\nWhen the user has taken action (or the timeout has elapsed), the completion handler is invoked. You determine the status of the authorization attempt by checking the value of the [doc:\/\/com.apple.avfoundation\/documentation\/AVFoundation\/AVPlayerItem\/contentAuthorizationRequestStatus] property.\n\nEven if the status indicates a completed authorization, the content may still not be authorized (for example, if the user authorizes an Apple ID other than that associated with the content).  You should re-check the value of [doc:\/\/com.apple.avfoundation\/documentation\/AVFoundation\/AVPlayerItem\/contentAuthorizationRequestStatus] to verify whether the content has actually been authorized before continuing.  It is not necessary to call this method if the value of [doc:\/\/com.apple.avfoundation\/documentation\/AVFoundation\/AVPlayerItem\/contentAuthorizationRequestStatus] is already true.",
  "platforms" : [
    "macOS"
  ],
  "rawMarkdown" : "---\nsource: https:\/\/developer.apple.com\/documentation\/AVFoundation\/AVPlayerItem\/requestContentAuthorizationAsynchronously(withTimeoutInterval:completionHandler:)\ncrawled: 2025-12-02T17:12:06Z\n---\n\n# requestContentAuthorizationAsynchronously(withTimeoutInterval:completionHandler:)\n\n**Instance Method**\n\nPresents the user the opportunity to authorize the content for playback.\n\n## Declaration\n\n```swift\n@MainActor func requestContentAuthorizationAsynchronously(withTimeoutInterval timeoutInterval: TimeInterval, completionHandler handler: @escaping () -> Void)\n```\n\n```swift\n@MainActor func requestContentAuthorization(withTimeoutInterval timeoutInterval: TimeInterval) async\n```\n\n## Parameters\n\n- **timeoutInterval**: The maximum amount of time in seconds to wait for the user to authorize the content before calling the handler block with a timeout result.\n- **handler**: The block to be called upon completion.\n\n## Discussion\n\nCalling this method will present the user with the opportunity to authorize the content (for example, by launching iTunes and prompting the user to enter their Apple ID and password).\n\nWhen the user has taken action (or the timeout has elapsed), the completion handler is invoked. You determine the status of the authorization attempt by checking the value of the [doc:\/\/com.apple.avfoundation\/documentation\/AVFoundation\/AVPlayerItem\/contentAuthorizationRequestStatus] property.\n\nEven if the status indicates a completed authorization, the content may still not be authorized (for example, if the user authorizes an Apple ID other than that associated with the content).  You should re-check the value of [doc:\/\/com.apple.avfoundation\/documentation\/AVFoundation\/AVPlayerItem\/contentAuthorizationRequestStatus] to verify whether the content has actually been authorized before continuing.  It is not necessary to call this method if the value of [doc:\/\/com.apple.avfoundation\/documentation\/AVFoundation\/AVPlayerItem\/contentAuthorizationRequestStatus] is already true.\n\n## Managing playback authorization in macOS\n\n- **isContentAuthorizedForPlayback**: A Boolean value that indicates whether the content has been authorized by the user.\n- **isAuthorizationRequiredForPlayback**: A Boolean value that indicates whether authorization is required to play the content.\n- **isApplicationAuthorizedForPlayback**: A Boolean value that indicates whether the application can be used to play the content.\n- **contentAuthorizationRequestStatus**: The status of the most recent content authorization request.\n- **AVContentAuthorizationStatus**: A value representing the status of a content authorization request.\n- **cancelContentAuthorizationRequest()**: Cancels the currently outstanding content authorization request.\n\n",
  "sections" : [
    {
      "content" : "",
      "items" : [
        {
          "description" : "A Boolean value that indicates whether the content has been authorized by the user.",
          "name" : "isContentAuthorizedForPlayback",
          "url" : "https:\/\/developer.apple.com\/documentation\/AVFoundation\/AVPlayerItem\/isContentAuthorizedForPlayback"
        },
        {
          "description" : "A Boolean value that indicates whether authorization is required to play the content.",
          "name" : "isAuthorizationRequiredForPlayback",
          "url" : "https:\/\/developer.apple.com\/documentation\/AVFoundation\/AVPlayerItem\/isAuthorizationRequiredForPlayback"
        },
        {
          "description" : "A Boolean value that indicates whether the application can be used to play the content.",
          "name" : "isApplicationAuthorizedForPlayback",
          "url" : "https:\/\/developer.apple.com\/documentation\/AVFoundation\/AVPlayerItem\/isApplicationAuthorizedForPlayback"
        },
        {
          "description" : "The status of the most recent content authorization request.",
          "name" : "contentAuthorizationRequestStatus",
          "url" : "https:\/\/developer.apple.com\/documentation\/AVFoundation\/AVPlayerItem\/contentAuthorizationRequestStatus"
        },
        {
          "description" : "A value representing the status of a content authorization request.",
          "name" : "AVContentAuthorizationStatus",
          "url" : "https:\/\/developer.apple.com\/documentation\/AVFoundation\/AVContentAuthorizationStatus"
        },
        {
          "description" : "Cancels the currently outstanding content authorization request.",
          "name" : "cancelContentAuthorizationRequest()",
          "url" : "https:\/\/developer.apple.com\/documentation\/AVFoundation\/AVPlayerItem\/cancelContentAuthorizationRequest()"
        }
      ],
      "title" : "Managing playback authorization in macOS"
    }
  ],
  "source" : "appleJSON",
  "title" : "requestContentAuthorizationAsynchronously(withTimeoutInterval:completionHandler:)",
  "url" : "https:\/\/developer.apple.com\/documentation\/AVFoundation\/AVPlayerItem\/requestContentAuthorizationAsynchronously(withTimeoutInterval:completionHandler:)"
}