{
  "abstract" : "An object that reports the state of a reaction effect performed on a capture device.",
  "codeExamples" : [

  ],
  "conformsTo" : [
    "CVarArg",
    "CustomDebugStringConvertible",
    "CustomStringConvertible",
    "Equatable",
    "Hashable",
    "NSObjectProtocol"
  ],
  "contentHash" : "f326187d31beb6f02089f15631bd30e940363911dbea9142f479eefc698b92c5",
  "crawledAt" : "2025-12-04T08:07:25Z",
  "declaration" : {
    "code" : "class AVCaptureReactionEffectState",
    "language" : "swift"
  },
  "id" : "679D97DB-2CB2-4D86-ADD5-E5D8259FF189",
  "kind" : "class",
  "language" : "swift",
  "module" : "AVFoundation",
  "overview" : "## Overview\n\nObtain an instance of this class by querying a capture device’s [doc:\/\/com.apple.avfoundation\/documentation\/AVFoundation\/AVCaptureDevice\/reactionEffectsInProgress] property. The system adds new entries to this array when you call [doc:\/\/com.apple.avfoundation\/documentation\/AVFoundation\/AVCaptureDevice\/performEffect(for:)] or by gesture detection in the capture stream when the value of [doc:\/\/com.apple.avfoundation\/documentation\/AVFoundation\/AVCaptureDevice\/reactionEffectGesturesEnabled] is [doc:\/\/com.apple.documentation\/documentation\/Swift\/true].\n\nThe system renders the effect before providing frames to your app, and these status objects let you know when it performs the effect.",
  "platforms" : [
    "iOS",
    "iPadOS",
    "Mac Catalyst",
    "macOS",
    "tvOS"
  ],
  "rawMarkdown" : "---\nsource: https:\/\/developer.apple.com\/documentation\/AVFoundation\/AVCaptureReactionEffectState\ncrawled: 2025-12-04T08:07:25Z\n---\n\n# AVCaptureReactionEffectState\n\n**Class**\n\nAn object that reports the state of a reaction effect performed on a capture device.\n\n## Declaration\n\n```swift\nclass AVCaptureReactionEffectState\n```\n\n## Overview\n\nObtain an instance of this class by querying a capture device’s [doc:\/\/com.apple.avfoundation\/documentation\/AVFoundation\/AVCaptureDevice\/reactionEffectsInProgress] property. The system adds new entries to this array when you call [doc:\/\/com.apple.avfoundation\/documentation\/AVFoundation\/AVCaptureDevice\/performEffect(for:)] or by gesture detection in the capture stream when the value of [doc:\/\/com.apple.avfoundation\/documentation\/AVFoundation\/AVCaptureDevice\/reactionEffectGesturesEnabled] is [doc:\/\/com.apple.documentation\/documentation\/Swift\/true].\n\nThe system renders the effect before providing frames to your app, and these status objects let you know when it performs the effect.\n\n## Configuring the effect state\n\n- **reactionType**: The type of reaction.\n- **AVCaptureReactionType**: Constants that indicate the type of reaction that an effect can perform.\n- **startTime**: The presentation time of the first frame where the system renders the effect.\n- **endTime**: The presentation time of the first frame following the end of a reaction effect.\n\n## Performing reaction effects\n\n- **reactionEffectsEnabled**: A Boolean value that indicates whether the app supports performing reaction effects.\n- **canPerformReactionEffects**: A Boolean value that indicates whether you can perform reaction effects on a capture device.\n- **availableReactionTypes**: A set of reactions types that a device supports performing.\n- **reactionEffectGesturesEnabled**: A Boolean value that indicates whether gesture detection triggers reaction effects on the video stream.\n- **performEffect(for:)**: Performs the specified reaction type on the video stream.\n- **reactionEffectsInProgress**: An array of reaction effects that the device is currently performing, sorted by timestamp.\n\n## Inherits From\n\n- NSObject\n\n## Conforms To\n\n- CVarArg\n- CustomDebugStringConvertible\n- CustomStringConvertible\n- Equatable\n- Hashable\n- NSObjectProtocol\n\n",
  "sections" : [
    {
      "content" : "",
      "items" : [
        {
          "description" : "The type of reaction.",
          "name" : "reactionType",
          "url" : "https:\/\/developer.apple.com\/documentation\/AVFoundation\/AVCaptureReactionEffectState\/reactionType"
        },
        {
          "description" : "Constants that indicate the type of reaction that an effect can perform.",
          "name" : "AVCaptureReactionType",
          "url" : "https:\/\/developer.apple.com\/documentation\/AVFoundation\/AVCaptureReactionType"
        },
        {
          "description" : "The presentation time of the first frame where the system renders the effect.",
          "name" : "startTime",
          "url" : "https:\/\/developer.apple.com\/documentation\/AVFoundation\/AVCaptureReactionEffectState\/startTime"
        },
        {
          "description" : "The presentation time of the first frame following the end of a reaction effect.",
          "name" : "endTime",
          "url" : "https:\/\/developer.apple.com\/documentation\/AVFoundation\/AVCaptureReactionEffectState\/endTime"
        }
      ],
      "title" : "Configuring the effect state"
    },
    {
      "content" : "",
      "items" : [
        {
          "description" : "A Boolean value that indicates whether the app supports performing reaction effects.",
          "name" : "reactionEffectsEnabled",
          "url" : "https:\/\/developer.apple.com\/documentation\/AVFoundation\/AVCaptureDevice\/reactionEffectsEnabled"
        },
        {
          "description" : "A Boolean value that indicates whether you can perform reaction effects on a capture device.",
          "name" : "canPerformReactionEffects",
          "url" : "https:\/\/developer.apple.com\/documentation\/AVFoundation\/AVCaptureDevice\/canPerformReactionEffects"
        },
        {
          "description" : "A set of reactions types that a device supports performing.",
          "name" : "availableReactionTypes",
          "url" : "https:\/\/developer.apple.com\/documentation\/AVFoundation\/AVCaptureDevice\/availableReactionTypes"
        },
        {
          "description" : "A Boolean value that indicates whether gesture detection triggers reaction effects on the video stream.",
          "name" : "reactionEffectGesturesEnabled",
          "url" : "https:\/\/developer.apple.com\/documentation\/AVFoundation\/AVCaptureDevice\/reactionEffectGesturesEnabled"
        },
        {
          "description" : "Performs the specified reaction type on the video stream.",
          "name" : "performEffect(for:)",
          "url" : "https:\/\/developer.apple.com\/documentation\/AVFoundation\/AVCaptureDevice\/performEffect(for:)"
        },
        {
          "description" : "An array of reaction effects that the device is currently performing, sorted by timestamp.",
          "name" : "reactionEffectsInProgress",
          "url" : "https:\/\/developer.apple.com\/documentation\/AVFoundation\/AVCaptureDevice\/reactionEffectsInProgress"
        }
      ],
      "title" : "Performing reaction effects"
    },
    {
      "content" : "",
      "items" : [
        {
          "name" : "NSObject"
        }
      ],
      "title" : "Inherits From"
    }
  ],
  "source" : "appleJSON",
  "title" : "AVCaptureReactionEffectState",
  "url" : "https:\/\/developer.apple.com\/documentation\/AVFoundation\/AVCaptureReactionEffectState"
}