{
  "abstract" : "The bounding rectangle associated with the metadata.",
  "codeExamples" : [

  ],
  "contentHash" : "a40af162acf371f6085a0e8898442567430407c82e9ae9d15e6d82ee38ceaf22",
  "crawledAt" : "2025-12-04T15:24:37Z",
  "declaration" : {
    "code" : "var bounds: CGRect { get }",
    "language" : "swift"
  },
  "id" : "752C4C17-CA08-49F4-A81A-3381F7902651",
  "kind" : "property",
  "language" : "swift",
  "module" : "AVFoundation",
  "overview" : "## Discussion\n\nThe bounding rectangle is specified relative to the picture or video of the corresponding media. The rectangle’s origin is always specified in the top-left corner, and the x and y axis extend down and to the right.\n\nIf the metadata has no bounding rectangle, the value of this property should be [doc:\/\/com.apple.documentation\/documentation\/CoreGraphics\/CGRectZero].\n\nFor video content, the bounding rectangle may be expressed using scalar values in the range 0.0 to 1.0. Scalar values remain meaningful even when the original video has been scaled down.",
  "platforms" : [
    "iOS",
    "iPadOS",
    "Mac Catalyst",
    "macOS",
    "tvOS"
  ],
  "rawMarkdown" : "---\nsource: https:\/\/developer.apple.com\/documentation\/AVFoundation\/AVMetadataObject\/bounds\ncrawled: 2025-12-04T15:24:37Z\n---\n\n# bounds\n\n**Instance Property**\n\nThe bounding rectangle associated with the metadata.\n\n## Declaration\n\n```swift\nvar bounds: CGRect { get }\n```\n\n## Discussion\n\nThe bounding rectangle is specified relative to the picture or video of the corresponding media. The rectangle’s origin is always specified in the top-left corner, and the x and y axis extend down and to the right.\n\nIf the metadata has no bounding rectangle, the value of this property should be [doc:\/\/com.apple.documentation\/documentation\/CoreGraphics\/CGRectZero].\n\nFor video content, the bounding rectangle may be expressed using scalar values in the range 0.0 to 1.0. Scalar values remain meaningful even when the original video has been scaled down.\n\n## Inspecting the metadata\n\n- **duration**: The duration of the media associated with this metadata object.\n- **time**: The media time value associated with the metadata object.\n- **type**: The type of metadata that this object provides.\n- **AVMetadataObject.ObjectType**: Constants that identify metadata object types.\n- **isFixedFocus**: A BOOL indicating whether this metadata object represents a fixed focus.\n- **cinematicVideoFocusMode**: The current focus mode when an object is detected during a Cinematic Video recording.\n- **groupID**: An identifier associated with a metadata object used to group it with other metadata objects belonging to a common parent.\n- **objectID**: A unique identifier for each detected object type (face, body, hands, heads and salient objects) in a collection.\n\n",
  "sections" : [
    {
      "content" : "",
      "items" : [
        {
          "description" : "The duration of the media associated with this metadata object.",
          "name" : "duration",
          "url" : "https:\/\/developer.apple.com\/documentation\/AVFoundation\/AVMetadataObject\/duration"
        },
        {
          "description" : "The media time value associated with the metadata object.",
          "name" : "time",
          "url" : "https:\/\/developer.apple.com\/documentation\/AVFoundation\/AVMetadataObject\/time"
        },
        {
          "description" : "The type of metadata that this object provides.",
          "name" : "type",
          "url" : "https:\/\/developer.apple.com\/documentation\/AVFoundation\/AVMetadataObject\/type"
        },
        {
          "description" : "Constants that identify metadata object types.",
          "name" : "AVMetadataObject.ObjectType",
          "url" : "https:\/\/developer.apple.com\/documentation\/AVFoundation\/AVMetadataObject\/ObjectType"
        },
        {
          "description" : "A BOOL indicating whether this metadata object represents a fixed focus.",
          "name" : "isFixedFocus",
          "url" : "https:\/\/developer.apple.com\/documentation\/AVFoundation\/AVMetadataObject\/isFixedFocus"
        },
        {
          "description" : "The current focus mode when an object is detected during a Cinematic Video recording.",
          "name" : "cinematicVideoFocusMode",
          "url" : "https:\/\/developer.apple.com\/documentation\/AVFoundation\/AVMetadataObject\/cinematicVideoFocusMode"
        },
        {
          "description" : "An identifier associated with a metadata object used to group it with other metadata objects belonging to a common parent.",
          "name" : "groupID",
          "url" : "https:\/\/developer.apple.com\/documentation\/AVFoundation\/AVMetadataObject\/groupID"
        },
        {
          "description" : "A unique identifier for each detected object type (face, body, hands, heads and salient objects) in a collection.",
          "name" : "objectID",
          "url" : "https:\/\/developer.apple.com\/documentation\/AVFoundation\/AVMetadataObject\/objectID"
        }
      ],
      "title" : "Inspecting the metadata"
    }
  ],
  "source" : "appleJSON",
  "title" : "bounds",
  "url" : "https:\/\/developer.apple.com\/documentation\/AVFoundation\/AVMetadataObject\/bounds"
}