{
  "abstract" : "An object that detects available media playback routes.",
  "codeExamples" : [

  ],
  "conformsTo" : [
    "CVarArg",
    "CustomDebugStringConvertible",
    "CustomStringConvertible",
    "Equatable",
    "Hashable",
    "NSObjectProtocol",
    "Sendable",
    "SendableMetatype"
  ],
  "contentHash" : "a671729c77a5a5a2102aad60bd50c9713de99dd875c8088e6308ef56bfa67b31",
  "crawledAt" : "2025-12-02T00:53:13Z",
  "declaration" : {
    "code" : "class AVRouteDetector",
    "language" : "swift"
  },
  "id" : "A599C8D4-2CF7-4887-B3E3-ACE0DB0132CF",
  "kind" : "class",
  "module" : "AVFoundation",
  "overview" : "## Overview\n\nIf you enable route detection, the object reports whether it detects multiple playback routes. If it does, use [doc:\/\/com.apple.documentation\/documentation\/AVKit\/AVRoutePickerView] to present the UI for the user to select an appropriate route.",
  "platforms" : [
    "iOS",
    "iPadOS",
    "Mac Catalyst",
    "macOS",
    "tvOS",
    "visionOS"
  ],
  "rawMarkdown" : "---\nsource: https:\/\/developer.apple.com\/documentation\/AVFoundation\/AVRouteDetector\ncrawled: 2025-12-02T00:53:13Z\n---\n\n# AVRouteDetector\n\n**Class**\n\nAn object that detects available media playback routes.\n\n## Declaration\n\n```swift\nclass AVRouteDetector\n```\n\n## Overview\n\nIf you enable route detection, the object reports whether it detects multiple playback routes. If it does, use [doc:\/\/com.apple.documentation\/documentation\/AVKit\/AVRoutePickerView] to present the UI for the user to select an appropriate route.\n\n## Detecting routes\n\n- **detectsCustomRoutes**: A Boolean value that indicates whether route detection includes custom routes.\n- **isRouteDetectionEnabled**: A Boolean value that indicates whether route detection is in an enabled state.\n- **multipleRoutesDetected**: A Boolean value that indicates whether the object detects more than one playback route.\n- **AVRouteDetectorMultipleRoutesDetectedDidChange**: A notification the system posts when changes occur to its detected routes.\n\n## Inherits From\n\n- NSObject\n\n## Conforms To\n\n- CVarArg\n- CustomDebugStringConvertible\n- CustomStringConvertible\n- Equatable\n- Hashable\n- NSObjectProtocol\n- Sendable\n- SendableMetatype\n\n",
  "sections" : [
    {
      "content" : "",
      "items" : [
        {
          "description" : "A Boolean value that indicates whether route detection includes custom routes.",
          "name" : "detectsCustomRoutes",
          "url" : "https:\/\/developer.apple.com\/documentation\/AVFoundation\/AVRouteDetector\/detectsCustomRoutes"
        },
        {
          "description" : "A Boolean value that indicates whether route detection is in an enabled state.",
          "name" : "isRouteDetectionEnabled",
          "url" : "https:\/\/developer.apple.com\/documentation\/AVFoundation\/AVRouteDetector\/isRouteDetectionEnabled"
        },
        {
          "description" : "A Boolean value that indicates whether the object detects more than one playback route.",
          "name" : "multipleRoutesDetected",
          "url" : "https:\/\/developer.apple.com\/documentation\/AVFoundation\/AVRouteDetector\/multipleRoutesDetected"
        },
        {
          "description" : "A notification the system posts when changes occur to its detected routes.",
          "name" : "AVRouteDetectorMultipleRoutesDetectedDidChange",
          "url" : "https:\/\/developer.apple.com\/documentation\/Foundation\/NSNotification\/Name-swift.struct\/AVRouteDetectorMultipleRoutesDetectedDidChange"
        }
      ],
      "title" : "Detecting routes"
    },
    {
      "content" : "",
      "items" : [
        {
          "name" : "NSObject"
        }
      ],
      "title" : "Inherits From"
    }
  ],
  "source" : "appleJSON",
  "title" : "AVRouteDetector",
  "url" : "https:\/\/developer.apple.com\/documentation\/AVFoundation\/AVRouteDetector"
}