{
  "abstract" : "Methods for receiving metadata produced by a metadata capture output.",
  "codeExamples" : [

  ],
  "contentHash" : "43bca02b9901b7b0ecd661e7107a66feac2867a61f1516a46c30e76f68bdd462",
  "crawledAt" : "2025-12-03T07:14:51Z",
  "declaration" : {
    "code" : "protocol AVCaptureMetadataOutputObjectsDelegate : NSObjectProtocol",
    "language" : "swift"
  },
  "id" : "BAF7FC18-447A-4B41-B4BA-5DE1DF38317B",
  "kind" : "protocol",
  "language" : "swift",
  "module" : "AVFoundation",
  "overview" : "## Overview\n\nThe `AVCaptureMetadataOutputObjectsDelegate` protocol must be adopted by the delegate of an [doc:\/\/com.apple.avfoundation\/documentation\/AVFoundation\/AVCaptureMetadataOutput] object. The single method in this protocol is optional. The method allows a delegate to respond when a capture metadata output object receives relevant metadata objects through its connection.\n\nThe [doc:\/\/com.apple.avfoundation\/documentation\/AVFoundation\/AVCaptureMetadataOutput] object calls the methods of the delegate object on the dispatch queue associated with its [doc:\/\/com.apple.avfoundation\/documentation\/AVFoundation\/AVCaptureMetadataOutput\/metadataObjectsCallbackQueue] property.",
  "platforms" : [
    "iOS",
    "iPadOS",
    "Mac Catalyst",
    "macOS",
    "tvOS"
  ],
  "rawMarkdown" : "---\nsource: https:\/\/developer.apple.com\/documentation\/AVFoundation\/AVCaptureMetadataOutputObjectsDelegate\ncrawled: 2025-12-03T07:14:51Z\n---\n\n# AVCaptureMetadataOutputObjectsDelegate\n\n**Protocol**\n\nMethods for receiving metadata produced by a metadata capture output.\n\n## Declaration\n\n```swift\nprotocol AVCaptureMetadataOutputObjectsDelegate : NSObjectProtocol\n```\n\n## Overview\n\nThe `AVCaptureMetadataOutputObjectsDelegate` protocol must be adopted by the delegate of an [doc:\/\/com.apple.avfoundation\/documentation\/AVFoundation\/AVCaptureMetadataOutput] object. The single method in this protocol is optional. The method allows a delegate to respond when a capture metadata output object receives relevant metadata objects through its connection.\n\nThe [doc:\/\/com.apple.avfoundation\/documentation\/AVFoundation\/AVCaptureMetadataOutput] object calls the methods of the delegate object on the dispatch queue associated with its [doc:\/\/com.apple.avfoundation\/documentation\/AVFoundation\/AVCaptureMetadataOutput\/metadataObjectsCallbackQueue] property.\n\n## Processing emitted metadata objects\n\n- **metadataOutput(_:didOutput:from:)**: Informs the delegate that the capture output object emitted new metadata objects.\n\n## Receiving captured metadata objects\n\n- **setMetadataObjectsDelegate(_:queue:)**: Sets the delegate and dispatch queue to use handle callbacks.\n- **metadataObjectsDelegate**: The delegate of the capture metadata output object.\n- **metadataObjectsCallbackQueue**: The dispatch queue on which to execute the delegate’s methods.\n\n## Inherits From\n\n- NSObjectProtocol\n\n",
  "sections" : [
    {
      "content" : "",
      "items" : [
        {
          "description" : "Informs the delegate that the capture output object emitted new metadata objects.",
          "name" : "metadataOutput(_:didOutput:from:)",
          "url" : "https:\/\/developer.apple.com\/documentation\/AVFoundation\/AVCaptureMetadataOutputObjectsDelegate\/metadataOutput(_:didOutput:from:)"
        }
      ],
      "title" : "Processing emitted metadata objects"
    },
    {
      "content" : "",
      "items" : [
        {
          "description" : "Sets the delegate and dispatch queue to use handle callbacks.",
          "name" : "setMetadataObjectsDelegate(_:queue:)",
          "url" : "https:\/\/developer.apple.com\/documentation\/AVFoundation\/AVCaptureMetadataOutput\/setMetadataObjectsDelegate(_:queue:)"
        },
        {
          "description" : "The delegate of the capture metadata output object.",
          "name" : "metadataObjectsDelegate",
          "url" : "https:\/\/developer.apple.com\/documentation\/AVFoundation\/AVCaptureMetadataOutput\/metadataObjectsDelegate"
        },
        {
          "description" : "The dispatch queue on which to execute the delegate’s methods.",
          "name" : "metadataObjectsCallbackQueue",
          "url" : "https:\/\/developer.apple.com\/documentation\/AVFoundation\/AVCaptureMetadataOutput\/metadataObjectsCallbackQueue"
        }
      ],
      "title" : "Receiving captured metadata objects"
    },
    {
      "content" : "",
      "items" : [
        {
          "name" : "NSObjectProtocol"
        }
      ],
      "title" : "Inherits From"
    }
  ],
  "source" : "appleJSON",
  "title" : "AVCaptureMetadataOutputObjectsDelegate",
  "url" : "https:\/\/developer.apple.com\/documentation\/AVFoundation\/AVCaptureMetadataOutputObjectsDelegate"
}