{
  "abstract" : "The abstract superclass for objects provided by a metadata capture output.",
  "codeExamples" : [

  ],
  "conformsTo" : [
    "CVarArg",
    "CustomDebugStringConvertible",
    "CustomStringConvertible",
    "Equatable",
    "Hashable",
    "NSObjectProtocol"
  ],
  "contentHash" : "89e1c442783e5b38d22774ecf61f64029b54af67f21c9ef2a323e22ca36737ce",
  "crawledAt" : "2025-12-03T06:55:10Z",
  "declaration" : {
    "code" : "class AVMetadataObject",
    "language" : "swift"
  },
  "id" : "A63FD390-1C74-42D7-BE84-6AE026D75AD0",
  "inheritedBy" : [
    "AVMetadataBodyObject",
    "AVMetadataCatHeadObject",
    "AVMetadataDogHeadObject",
    "AVMetadataFaceObject",
    "AVMetadataMachineReadableCodeObject",
    "AVMetadataSalientObject"
  ],
  "kind" : "class",
  "language" : "swift",
  "module" : "AVFoundation",
  "overview" : "## Overview\n\nThe `AVMetadataObject` class is an abstract class that defines the basic properties associated with a piece of metadata. These attributes reflect information either about the metadata itself or the media from which the metadata originated. Subclasses are responsible for providing appropriate values for each of the relevant properties.\n\nYou shouldn’t subclass `AVMetadataObject` directly. Instead, you use one of the defined subclasses provided by the AVFoundation framework. Similarly, you don’t create instances of this class yourself but use an [doc:\/\/com.apple.avfoundation\/documentation\/AVFoundation\/AVCaptureMetadataOutput] object to retrieve them from the captured data.",
  "platforms" : [
    "iOS",
    "iPadOS",
    "Mac Catalyst",
    "macOS",
    "tvOS"
  ],
  "rawMarkdown" : "---\nsource: https:\/\/developer.apple.com\/documentation\/AVFoundation\/AVMetadataObject\ncrawled: 2025-12-03T06:55:10Z\n---\n\n# AVMetadataObject\n\n**Class**\n\nThe abstract superclass for objects provided by a metadata capture output.\n\n## Declaration\n\n```swift\nclass AVMetadataObject\n```\n\n## Overview\n\nThe `AVMetadataObject` class is an abstract class that defines the basic properties associated with a piece of metadata. These attributes reflect information either about the metadata itself or the media from which the metadata originated. Subclasses are responsible for providing appropriate values for each of the relevant properties.\n\nYou shouldn’t subclass `AVMetadataObject` directly. Instead, you use one of the defined subclasses provided by the AVFoundation framework. Similarly, you don’t create instances of this class yourself but use an [doc:\/\/com.apple.avfoundation\/documentation\/AVFoundation\/AVCaptureMetadataOutput] object to retrieve them from the captured data.\n\n## Inspecting the metadata\n\n- **bounds**: The bounding rectangle associated with the metadata.\n- **duration**: The duration of the media associated with this metadata object.\n- **time**: The media time value associated with the metadata object.\n- **type**: The type of metadata that this object provides.\n- **AVMetadataObject.ObjectType**: Constants that identify metadata object types.\n- **isFixedFocus**: A BOOL indicating whether this metadata object represents a fixed focus.\n- **cinematicVideoFocusMode**: The current focus mode when an object is detected during a Cinematic Video recording.\n- **groupID**: An identifier associated with a metadata object used to group it with other metadata objects belonging to a common parent.\n- **objectID**: A unique identifier for each detected object type (face, body, hands, heads and salient objects) in a collection.\n\n## Metadata capture\n\n- **AVCaptureMetadataInput**: A capture input for providing timed metadata to a capture session.\n- **AVCaptureMetadataOutput**: A capture output for processing timed metadata produced by a capture session.\n- **Metadata types**: Inspect the supported metadata object types that the framework supports.\n\n## Inherits From\n\n- NSObject\n\n## Inherited By\n\n- AVMetadataBodyObject\n- AVMetadataCatHeadObject\n- AVMetadataDogHeadObject\n- AVMetadataFaceObject\n- AVMetadataMachineReadableCodeObject\n- AVMetadataSalientObject\n\n## Conforms To\n\n- CVarArg\n- CustomDebugStringConvertible\n- CustomStringConvertible\n- Equatable\n- Hashable\n- NSObjectProtocol\n\n",
  "sections" : [
    {
      "content" : "",
      "items" : [
        {
          "description" : "The bounding rectangle associated with the metadata.",
          "name" : "bounds",
          "url" : "https:\/\/developer.apple.com\/documentation\/AVFoundation\/AVMetadataObject\/bounds"
        },
        {
          "description" : "The duration of the media associated with this metadata object.",
          "name" : "duration",
          "url" : "https:\/\/developer.apple.com\/documentation\/AVFoundation\/AVMetadataObject\/duration"
        },
        {
          "description" : "The media time value associated with the metadata object.",
          "name" : "time",
          "url" : "https:\/\/developer.apple.com\/documentation\/AVFoundation\/AVMetadataObject\/time"
        },
        {
          "description" : "The type of metadata that this object provides.",
          "name" : "type",
          "url" : "https:\/\/developer.apple.com\/documentation\/AVFoundation\/AVMetadataObject\/type"
        },
        {
          "description" : "Constants that identify metadata object types.",
          "name" : "AVMetadataObject.ObjectType",
          "url" : "https:\/\/developer.apple.com\/documentation\/AVFoundation\/AVMetadataObject\/ObjectType"
        },
        {
          "description" : "A BOOL indicating whether this metadata object represents a fixed focus.",
          "name" : "isFixedFocus",
          "url" : "https:\/\/developer.apple.com\/documentation\/AVFoundation\/AVMetadataObject\/isFixedFocus"
        },
        {
          "description" : "The current focus mode when an object is detected during a Cinematic Video recording.",
          "name" : "cinematicVideoFocusMode",
          "url" : "https:\/\/developer.apple.com\/documentation\/AVFoundation\/AVMetadataObject\/cinematicVideoFocusMode"
        },
        {
          "description" : "An identifier associated with a metadata object used to group it with other metadata objects belonging to a common parent.",
          "name" : "groupID",
          "url" : "https:\/\/developer.apple.com\/documentation\/AVFoundation\/AVMetadataObject\/groupID"
        },
        {
          "description" : "A unique identifier for each detected object type (face, body, hands, heads and salient objects) in a collection.",
          "name" : "objectID",
          "url" : "https:\/\/developer.apple.com\/documentation\/AVFoundation\/AVMetadataObject\/objectID"
        }
      ],
      "title" : "Inspecting the metadata"
    },
    {
      "content" : "",
      "items" : [
        {
          "description" : "A capture input for providing timed metadata to a capture session.",
          "name" : "AVCaptureMetadataInput",
          "url" : "https:\/\/developer.apple.com\/documentation\/AVFoundation\/AVCaptureMetadataInput"
        },
        {
          "description" : "A capture output for processing timed metadata produced by a capture session.",
          "name" : "AVCaptureMetadataOutput",
          "url" : "https:\/\/developer.apple.com\/documentation\/AVFoundation\/AVCaptureMetadataOutput"
        },
        {
          "description" : "Inspect the supported metadata object types that the framework supports.",
          "name" : "Metadata types",
          "url" : "https:\/\/developer.apple.com\/documentation\/AVFoundation\/metadata-types"
        }
      ],
      "title" : "Metadata capture"
    },
    {
      "content" : "",
      "items" : [
        {
          "name" : "NSObject"
        }
      ],
      "title" : "Inherits From"
    }
  ],
  "source" : "appleJSON",
  "title" : "AVMetadataObject",
  "url" : "https:\/\/developer.apple.com\/documentation\/AVFoundation\/AVMetadataObject"
}