{
  "abstract" : "The maximum size, in bytes, of the data that should be recorded by the receiver.",
  "codeExamples" : [

  ],
  "contentHash" : "422b5a274e250748d64043240d631f8ae892b1524f269d049cf2af95c5b4d34b",
  "crawledAt" : "2025-12-01T12:03:39Z",
  "declaration" : {
    "code" : "var maxRecordedFileSize: Int64 { get set }",
    "language" : "swift"
  },
  "id" : "3A0DA1BA-E052-4531-8F03-CF7AD8FF9589",
  "kind" : "property",
  "module" : "AVFoundation",
  "overview" : "## Discussion\n\nThis property specifies a hard limit on the data size of recorded files. Recording is stopped when the limit is reached and the [doc:\/\/com.apple.avfoundation\/documentation\/AVFoundation\/AVCaptureFileOutputRecordingDelegate\/fileOutput(_:didFinishRecordingTo:from:error:)] delegate method is invoked with an appropriate error. The default value of this property is `0`, which indicates no limit.",
  "platforms" : [
    "iOS",
    "iPadOS",
    "Mac Catalyst",
    "macOS",
    "tvOS"
  ],
  "rawMarkdown" : "---\nsource: https:\/\/developer.apple.com\/documentation\/AVFoundation\/AVCaptureFileOutput\/maxRecordedFileSize\ncrawled: 2025-12-01T12:03:39Z\n---\n\n# maxRecordedFileSize\n\n**Instance Property**\n\nThe maximum size, in bytes, of the data that should be recorded by the receiver.\n\n## Declaration\n\n```swift\nvar maxRecordedFileSize: Int64 { get set }\n```\n\n## Discussion\n\nThis property specifies a hard limit on the data size of recorded files. Recording is stopped when the limit is reached and the [doc:\/\/com.apple.avfoundation\/documentation\/AVFoundation\/AVCaptureFileOutputRecordingDelegate\/fileOutput(_:didFinishRecordingTo:from:error:)] delegate method is invoked with an appropriate error. The default value of this property is `0`, which indicates no limit.\n\n## Setting file output properties\n\n- **delegate**: The delegate object for the capture file output.\n- **maxRecordedDuration**: The longest duration allowed for the recording.\n- **minFreeDiskSpaceLimit**: The minimum amount of free space, in bytes, required for recording to continue on a given volume.\n- **outputFileURL**: The URL to which output is directed.\n- **recordedDuration**: Indicates the duration of the media recorded to the current output file.\n- **recordedFileSize**: Indicates the size, in bytes, of the data recorded to the current output file.\n- **isRecording**: Indicates whether recording is in progress.\n- **isRecordingPaused**: Indicates whether recording to the current output file is paused.\n\n",
  "sections" : [
    {
      "content" : "",
      "items" : [
        {
          "description" : "The delegate object for the capture file output.",
          "name" : "delegate",
          "url" : "https:\/\/developer.apple.com\/documentation\/AVFoundation\/AVCaptureFileOutput\/delegate"
        },
        {
          "description" : "The longest duration allowed for the recording.",
          "name" : "maxRecordedDuration",
          "url" : "https:\/\/developer.apple.com\/documentation\/AVFoundation\/AVCaptureFileOutput\/maxRecordedDuration"
        },
        {
          "description" : "The minimum amount of free space, in bytes, required for recording to continue on a given volume.",
          "name" : "minFreeDiskSpaceLimit",
          "url" : "https:\/\/developer.apple.com\/documentation\/AVFoundation\/AVCaptureFileOutput\/minFreeDiskSpaceLimit"
        },
        {
          "description" : "The URL to which output is directed.",
          "name" : "outputFileURL",
          "url" : "https:\/\/developer.apple.com\/documentation\/AVFoundation\/AVCaptureFileOutput\/outputFileURL"
        },
        {
          "description" : "Indicates the duration of the media recorded to the current output file.",
          "name" : "recordedDuration",
          "url" : "https:\/\/developer.apple.com\/documentation\/AVFoundation\/AVCaptureFileOutput\/recordedDuration"
        },
        {
          "description" : "Indicates the size, in bytes, of the data recorded to the current output file.",
          "name" : "recordedFileSize",
          "url" : "https:\/\/developer.apple.com\/documentation\/AVFoundation\/AVCaptureFileOutput\/recordedFileSize"
        },
        {
          "description" : "Indicates whether recording is in progress.",
          "name" : "isRecording",
          "url" : "https:\/\/developer.apple.com\/documentation\/AVFoundation\/AVCaptureFileOutput\/isRecording"
        },
        {
          "description" : "Indicates whether recording to the current output file is paused.",
          "name" : "isRecordingPaused",
          "url" : "https:\/\/developer.apple.com\/documentation\/AVFoundation\/AVCaptureFileOutput\/isRecordingPaused"
        }
      ],
      "title" : "Setting file output properties"
    }
  ],
  "source" : "appleJSON",
  "title" : "maxRecordedFileSize",
  "url" : "https:\/\/developer.apple.com\/documentation\/AVFoundation\/AVCaptureFileOutput\/maxRecordedFileSize"
}