{
  "abstract" : "An object that wraps a matting image for a particular semantic segmentation.",
  "codeExamples" : [

  ],
  "conformsTo" : [
    "CVarArg",
    "CustomDebugStringConvertible",
    "CustomStringConvertible",
    "Equatable",
    "Hashable",
    "NSObjectProtocol"
  ],
  "contentHash" : "e563e16f84b00edc085304b1a8940fdb69c7bd05e60abeb87e7769d7c44377d5",
  "crawledAt" : "2025-12-03T19:49:53Z",
  "declaration" : {
    "code" : "class AVSemanticSegmentationMatte",
    "language" : "swift"
  },
  "id" : "2BFE987A-F035-4A94-85D0-85B28E443A95",
  "kind" : "class",
  "language" : "swift",
  "module" : "AVFoundation",
  "overview" : "## Overview\n\nThe matting image stores its pixel data as [doc:\/\/com.apple.documentation\/documentation\/CoreVideo\/cvpixelbuffer-q2e] objects in [doc:\/\/com.apple.documentation\/documentation\/CoreVideo\/kCVPixelFormatType_OneComponent8] format. The image file contains the semantic segmentation matte as an auxiliary image, accessible using the ImageIO framework’s [doc:\/\/com.apple.documentation\/documentation\/ImageIO\/CGImageSourceCopyAuxiliaryDataInfoAtIndex(_:_:_:)] function.",
  "platforms" : [
    "iOS",
    "iPadOS",
    "Mac Catalyst",
    "macOS",
    "tvOS",
    "visionOS",
    "watchOS"
  ],
  "rawMarkdown" : "---\nsource: https:\/\/developer.apple.com\/documentation\/AVFoundation\/AVSemanticSegmentationMatte\ncrawled: 2025-12-03T19:49:53Z\n---\n\n# AVSemanticSegmentationMatte\n\n**Class**\n\nAn object that wraps a matting image for a particular semantic segmentation.\n\n## Declaration\n\n```swift\nclass AVSemanticSegmentationMatte\n```\n\n## Overview\n\nThe matting image stores its pixel data as [doc:\/\/com.apple.documentation\/documentation\/CoreVideo\/cvpixelbuffer-q2e] objects in [doc:\/\/com.apple.documentation\/documentation\/CoreVideo\/kCVPixelFormatType_OneComponent8] format. The image file contains the semantic segmentation matte as an auxiliary image, accessible using the ImageIO framework’s [doc:\/\/com.apple.documentation\/documentation\/ImageIO\/CGImageSourceCopyAuxiliaryDataInfoAtIndex(_:_:_:)] function.\n\n## Creating a segmentation matte\n\n- **init(fromImageSourceAuxiliaryDataType:dictionaryRepresentation:)**: Returns a new semantic segmentation matte instance from auxiliary image information in an image file.\n- **replacingSemanticSegmentationMatte(with:)**: Returns a semantic segmentation matte instance that wraps the replacement pixel buffer.\n- **applyingExifOrientation(_:)**: Returns a new semantic segmentation matte instance with the specified Exif orientation applied.\n- **dictionaryRepresentation(forAuxiliaryDataType:)**: Returns a dictionary of primitive map information to use when writing an image file with a semantic segmentation matte.\n\n## Inspecting a segmentation matte\n\n- **matteType**: The semantic segmentation matte image type.\n- **AVSemanticSegmentationMatte.MatteType**: A structure that defines the types of segmentation matte images that you can capture along with the primary image.\n- **mattingImage**: The semantic segmentation matte’s internal image.\n- **pixelFormatType**: The pixel format type for this object’s internal matting image.\n\n## Matte data\n\n- **AVPortraitEffectsMatte**: An auxiliary image used to separate foreground from background with high resolution.\n\n## Inherits From\n\n- NSObject\n\n## Conforms To\n\n- CVarArg\n- CustomDebugStringConvertible\n- CustomStringConvertible\n- Equatable\n- Hashable\n- NSObjectProtocol\n\n",
  "sections" : [
    {
      "content" : "",
      "items" : [
        {
          "description" : "Returns a new semantic segmentation matte instance from auxiliary image information in an image file.",
          "name" : "init(fromImageSourceAuxiliaryDataType:dictionaryRepresentation:)",
          "url" : "https:\/\/developer.apple.com\/documentation\/AVFoundation\/AVSemanticSegmentationMatte\/init(fromImageSourceAuxiliaryDataType:dictionaryRepresentation:)"
        },
        {
          "description" : "Returns a semantic segmentation matte instance that wraps the replacement pixel buffer.",
          "name" : "replacingSemanticSegmentationMatte(with:)",
          "url" : "https:\/\/developer.apple.com\/documentation\/AVFoundation\/AVSemanticSegmentationMatte\/replacingSemanticSegmentationMatte(with:)"
        },
        {
          "description" : "Returns a new semantic segmentation matte instance with the specified Exif orientation applied.",
          "name" : "applyingExifOrientation(_:)",
          "url" : "https:\/\/developer.apple.com\/documentation\/AVFoundation\/AVSemanticSegmentationMatte\/applyingExifOrientation(_:)"
        },
        {
          "description" : "Returns a dictionary of primitive map information to use when writing an image file with a semantic segmentation matte.",
          "name" : "dictionaryRepresentation(forAuxiliaryDataType:)",
          "url" : "https:\/\/developer.apple.com\/documentation\/AVFoundation\/AVSemanticSegmentationMatte\/dictionaryRepresentation(forAuxiliaryDataType:)"
        }
      ],
      "title" : "Creating a segmentation matte"
    },
    {
      "content" : "",
      "items" : [
        {
          "description" : "The semantic segmentation matte image type.",
          "name" : "matteType",
          "url" : "https:\/\/developer.apple.com\/documentation\/AVFoundation\/AVSemanticSegmentationMatte\/matteType-swift.property"
        },
        {
          "description" : "A structure that defines the types of segmentation matte images that you can capture along with the primary image.",
          "name" : "AVSemanticSegmentationMatte.MatteType",
          "url" : "https:\/\/developer.apple.com\/documentation\/AVFoundation\/AVSemanticSegmentationMatte\/MatteType-swift.struct"
        },
        {
          "description" : "The semantic segmentation matte’s internal image.",
          "name" : "mattingImage",
          "url" : "https:\/\/developer.apple.com\/documentation\/AVFoundation\/AVSemanticSegmentationMatte\/mattingImage"
        },
        {
          "description" : "The pixel format type for this object’s internal matting image.",
          "name" : "pixelFormatType",
          "url" : "https:\/\/developer.apple.com\/documentation\/AVFoundation\/AVSemanticSegmentationMatte\/pixelFormatType"
        }
      ],
      "title" : "Inspecting a segmentation matte"
    },
    {
      "content" : "",
      "items" : [
        {
          "description" : "An auxiliary image used to separate foreground from background with high resolution.",
          "name" : "AVPortraitEffectsMatte",
          "url" : "https:\/\/developer.apple.com\/documentation\/AVFoundation\/AVPortraitEffectsMatte"
        }
      ],
      "title" : "Matte data"
    },
    {
      "content" : "",
      "items" : [
        {
          "name" : "NSObject"
        }
      ],
      "title" : "Inherits From"
    }
  ],
  "source" : "appleJSON",
  "title" : "AVSemanticSegmentationMatte",
  "url" : "https:\/\/developer.apple.com\/documentation\/AVFoundation\/AVSemanticSegmentationMatte"
}