{
  "abstract" : "An array of framings supported by the monitor in its current configuration.",
  "codeExamples" : [

  ],
  "contentHash" : "d6d0b70d1b37de70465b533324c343cca78dd1b0621bbe9bab86c790b707d140",
  "crawledAt" : "2025-12-04T09:37:35Z",
  "declaration" : {
    "code" : "var supportedFramings: [AVCaptureFraming] { get }",
    "language" : "swift"
  },
  "id" : "BF8CEAC2-CF28-4E98-80D5-6FE7B9E8823C",
  "kind" : "property",
  "language" : "swift",
  "module" : "AVFoundation",
  "overview" : "## Discussion\n\nThe monitor is capable of recommending any of the framings in this array. This property is key-value observable and may change as the target capture device’s [doc:\/\/com.apple.avfoundation\/documentation\/AVFoundation\/AVCaptureDevice\/activeFormat] property changes. This array contains the full set of framings supported by the monitor in the device’s current configuration. You must tell the monitor which smart framings you are interested in having recommended to you by setting the [doc:\/\/com.apple.avfoundation\/documentation\/AVFoundation\/AVCaptureSmartFramingMonitor\/enabledFramings] property.",
  "platforms" : [
    "iOS",
    "iPadOS",
    "Mac Catalyst"
  ],
  "rawMarkdown" : "---\nsource: https:\/\/developer.apple.com\/documentation\/AVFoundation\/AVCaptureSmartFramingMonitor\/supportedFramings\ncrawled: 2025-12-04T09:37:35Z\n---\n\n# supportedFramings\n\n**Instance Property**\n\nAn array of framings supported by the monitor in its current configuration.\n\n## Declaration\n\n```swift\nvar supportedFramings: [AVCaptureFraming] { get }\n```\n\n## Discussion\n\nThe monitor is capable of recommending any of the framings in this array. This property is key-value observable and may change as the target capture device’s [doc:\/\/com.apple.avfoundation\/documentation\/AVFoundation\/AVCaptureDevice\/activeFormat] property changes. This array contains the full set of framings supported by the monitor in the device’s current configuration. You must tell the monitor which smart framings you are interested in having recommended to you by setting the [doc:\/\/com.apple.avfoundation\/documentation\/AVFoundation\/AVCaptureSmartFramingMonitor\/enabledFramings] property.\n\n## Configuring framings\n\n- **enabledFramings**: An array of framings that the monitor is allowed to suggest.\n- **recommendedFraming**: The latest recommended framing from the monitor.\n\n",
  "sections" : [
    {
      "content" : "",
      "items" : [
        {
          "description" : "An array of framings that the monitor is allowed to suggest.",
          "name" : "enabledFramings",
          "url" : "https:\/\/developer.apple.com\/documentation\/AVFoundation\/AVCaptureSmartFramingMonitor\/enabledFramings"
        },
        {
          "description" : "The latest recommended framing from the monitor.",
          "name" : "recommendedFraming",
          "url" : "https:\/\/developer.apple.com\/documentation\/AVFoundation\/AVCaptureSmartFramingMonitor\/recommendedFraming"
        }
      ],
      "title" : "Configuring framings"
    }
  ],
  "source" : "appleJSON",
  "title" : "supportedFramings",
  "url" : "https:\/\/developer.apple.com\/documentation\/AVFoundation\/AVCaptureSmartFramingMonitor\/supportedFramings"
}