{
  "abstract" : "An abstract class that defines the interface for a metadata body object.",
  "codeExamples" : [

  ],
  "conformsTo" : [
    "CVarArg",
    "CustomDebugStringConvertible",
    "CustomStringConvertible",
    "Equatable",
    "Hashable",
    "NSCopying",
    "NSObjectProtocol"
  ],
  "contentHash" : "4d707efe761f6c5e87e293d163a107507c8357dc655046f61f9a92b6b32012e9",
  "crawledAt" : "2025-12-04T15:24:45Z",
  "declaration" : {
    "code" : "class AVMetadataBodyObject",
    "language" : "swift"
  },
  "id" : "006D8A9B-0F7C-4169-B468-A6363212C372",
  "inheritedBy" : [
    "AVMetadataCatBodyObject",
    "AVMetadataDogBodyObject",
    "AVMetadataHumanBodyObject",
    "AVMetadataHumanFullBodyObject"
  ],
  "kind" : "class",
  "language" : "swift",
  "module" : "AVFoundation",
  "overview" : "## Overview\n\nA metadata body object represents a single detected body in a picture. It’s the base object used to represent bodies, for example [doc:\/\/com.apple.avfoundation\/documentation\/AVFoundation\/AVMetadataHumanBodyObject], [doc:\/\/com.apple.avfoundation\/documentation\/AVFoundation\/AVMetadataDogBodyObject], and [doc:\/\/com.apple.avfoundation\/documentation\/AVFoundation\/AVMetadataCatBodyObject].",
  "platforms" : [
    "iOS",
    "iPadOS",
    "Mac Catalyst",
    "macOS",
    "tvOS"
  ],
  "rawMarkdown" : "---\nsource: https:\/\/developer.apple.com\/documentation\/AVFoundation\/AVMetadataBodyObject\ncrawled: 2025-12-04T15:24:45Z\n---\n\n# AVMetadataBodyObject\n\n**Class**\n\nAn abstract class that defines the interface for a metadata body object.\n\n## Declaration\n\n```swift\nclass AVMetadataBodyObject\n```\n\n## Overview\n\nA metadata body object represents a single detected body in a picture. It’s the base object used to represent bodies, for example [doc:\/\/com.apple.avfoundation\/documentation\/AVFoundation\/AVMetadataHumanBodyObject], [doc:\/\/com.apple.avfoundation\/documentation\/AVFoundation\/AVMetadataDogBodyObject], and [doc:\/\/com.apple.avfoundation\/documentation\/AVFoundation\/AVMetadataCatBodyObject].\n\n## Inspecting metadata\n\n- **bodyID**: An integer value that defines the unique identifier of an object in a picture.\n\n## Bodies\n\n- **AVMetadataCatBodyObject**: An object representing a single detected cat body in a picture.\n- **AVMetadataDogBodyObject**: An object representing a single detected dog body in a picture.\n- **AVMetadataHumanBodyObject**: An object representing a single detected human body in a picture.\n- **AVMetadataHumanFullBodyObject**: An object that represents a detected human full body in a picture.\n\n## Inherits From\n\n- AVMetadataObject\n\n## Inherited By\n\n- AVMetadataCatBodyObject\n- AVMetadataDogBodyObject\n- AVMetadataHumanBodyObject\n- AVMetadataHumanFullBodyObject\n\n## Conforms To\n\n- CVarArg\n- CustomDebugStringConvertible\n- CustomStringConvertible\n- Equatable\n- Hashable\n- NSCopying\n- NSObjectProtocol\n\n",
  "sections" : [
    {
      "content" : "",
      "items" : [
        {
          "description" : "An integer value that defines the unique identifier of an object in a picture.",
          "name" : "bodyID",
          "url" : "https:\/\/developer.apple.com\/documentation\/AVFoundation\/AVMetadataBodyObject\/bodyID"
        }
      ],
      "title" : "Inspecting metadata"
    },
    {
      "content" : "",
      "items" : [
        {
          "description" : "An object representing a single detected cat body in a picture.",
          "name" : "AVMetadataCatBodyObject",
          "url" : "https:\/\/developer.apple.com\/documentation\/AVFoundation\/AVMetadataCatBodyObject"
        },
        {
          "description" : "An object representing a single detected dog body in a picture.",
          "name" : "AVMetadataDogBodyObject",
          "url" : "https:\/\/developer.apple.com\/documentation\/AVFoundation\/AVMetadataDogBodyObject"
        },
        {
          "description" : "An object representing a single detected human body in a picture.",
          "name" : "AVMetadataHumanBodyObject",
          "url" : "https:\/\/developer.apple.com\/documentation\/AVFoundation\/AVMetadataHumanBodyObject"
        },
        {
          "description" : "An object that represents a detected human full body in a picture.",
          "name" : "AVMetadataHumanFullBodyObject",
          "url" : "https:\/\/developer.apple.com\/documentation\/AVFoundation\/AVMetadataHumanFullBodyObject"
        }
      ],
      "title" : "Bodies"
    },
    {
      "content" : "",
      "items" : [
        {
          "name" : "AVMetadataObject"
        }
      ],
      "title" : "Inherits From"
    }
  ],
  "source" : "appleJSON",
  "title" : "AVMetadataBodyObject",
  "url" : "https:\/\/developer.apple.com\/documentation\/AVFoundation\/AVMetadataBodyObject"
}