{
  "abstract" : "A Boolean value that indicates whether the app supports performing reaction effects.",
  "codeExamples" : [
    {
      "code" : "<key>NSCameraReactionEffectsEnabled<\/key>\n<true\/>",
      "language" : "swift"
    }
  ],
  "contentHash" : "565daffe12985db7582604da420ecb0c6f09a17c6b4b7b94502d243eefd823cb",
  "crawledAt" : "2025-12-02T13:10:43Z",
  "declaration" : {
    "code" : "class var reactionEffectsEnabled: Bool { get }",
    "language" : "swift"
  },
  "id" : "D1034740-4431-4A6C-B2CE-479E8DD22660",
  "kind" : "property",
  "module" : "AVFoundation",
  "overview" : "## Discussion\n\nThe system only renders reaction effects when the device’s active format supports the feature, which you determine by querying the value of its [doc:\/\/com.apple.avfoundation\/documentation\/AVFoundation\/AVCaptureDevice\/Format\/reactionEffectsSupported] property.\n\nIn macOS, the system enables reaction effects for all apps by default. In iOS, it enables them by default only for video conferencing apps (apps that enable the Voice over IP option in their [doc:\/\/com.apple.documentation\/documentation\/BundleResources\/Information-Property-List\/UIBackgroundModes] configuration). Apps that don’t use this background mode may opt in to this feature by adding the following key to the `Info.plist` file.",
  "platforms" : [
    "iOS",
    "iPadOS",
    "Mac Catalyst",
    "macOS",
    "tvOS"
  ],
  "rawMarkdown" : "---\nsource: https:\/\/developer.apple.com\/documentation\/AVFoundation\/AVCaptureDevice\/reactionEffectsEnabled\ncrawled: 2025-12-02T13:10:43Z\n---\n\n# reactionEffectsEnabled\n\n**Type Property**\n\nA Boolean value that indicates whether the app supports performing reaction effects.\n\n## Declaration\n\n```swift\nclass var reactionEffectsEnabled: Bool { get }\n```\n\n## Discussion\n\nThe system only renders reaction effects when the device’s active format supports the feature, which you determine by querying the value of its [doc:\/\/com.apple.avfoundation\/documentation\/AVFoundation\/AVCaptureDevice\/Format\/reactionEffectsSupported] property.\n\nIn macOS, the system enables reaction effects for all apps by default. In iOS, it enables them by default only for video conferencing apps (apps that enable the Voice over IP option in their [doc:\/\/com.apple.documentation\/documentation\/BundleResources\/Information-Property-List\/UIBackgroundModes] configuration). Apps that don’t use this background mode may opt in to this feature by adding the following key to the `Info.plist` file.\n\n```swift\n<key>NSCameraReactionEffectsEnabled<\/key>\n<true\/>\n```\n\n## Performing reaction effects\n\n- **canPerformReactionEffects**: A Boolean value that indicates whether you can perform reaction effects on a capture device.\n- **availableReactionTypes**: A set of reactions types that a device supports performing.\n- **reactionEffectGesturesEnabled**: A Boolean value that indicates whether gesture detection triggers reaction effects on the video stream.\n- **performEffect(for:)**: Performs the specified reaction type on the video stream.\n- **reactionEffectsInProgress**: An array of reaction effects that the device is currently performing, sorted by timestamp.\n- **AVCaptureReactionEffectState**: An object that reports the state of a reaction effect performed on a capture device.\n\n",
  "sections" : [
    {
      "content" : "",
      "items" : [
        {
          "description" : "A Boolean value that indicates whether you can perform reaction effects on a capture device.",
          "name" : "canPerformReactionEffects",
          "url" : "https:\/\/developer.apple.com\/documentation\/AVFoundation\/AVCaptureDevice\/canPerformReactionEffects"
        },
        {
          "description" : "A set of reactions types that a device supports performing.",
          "name" : "availableReactionTypes",
          "url" : "https:\/\/developer.apple.com\/documentation\/AVFoundation\/AVCaptureDevice\/availableReactionTypes"
        },
        {
          "description" : "A Boolean value that indicates whether gesture detection triggers reaction effects on the video stream.",
          "name" : "reactionEffectGesturesEnabled",
          "url" : "https:\/\/developer.apple.com\/documentation\/AVFoundation\/AVCaptureDevice\/reactionEffectGesturesEnabled"
        },
        {
          "description" : "Performs the specified reaction type on the video stream.",
          "name" : "performEffect(for:)",
          "url" : "https:\/\/developer.apple.com\/documentation\/AVFoundation\/AVCaptureDevice\/performEffect(for:)"
        },
        {
          "description" : "An array of reaction effects that the device is currently performing, sorted by timestamp.",
          "name" : "reactionEffectsInProgress",
          "url" : "https:\/\/developer.apple.com\/documentation\/AVFoundation\/AVCaptureDevice\/reactionEffectsInProgress"
        },
        {
          "description" : "An object that reports the state of a reaction effect performed on a capture device.",
          "name" : "AVCaptureReactionEffectState",
          "url" : "https:\/\/developer.apple.com\/documentation\/AVFoundation\/AVCaptureReactionEffectState"
        }
      ],
      "title" : "Performing reaction effects"
    }
  ],
  "source" : "appleJSON",
  "title" : "reactionEffectsEnabled",
  "url" : "https:\/\/developer.apple.com\/documentation\/AVFoundation\/AVCaptureDevice\/reactionEffectsEnabled"
}