{
  "abstract" : "A delegate object that receives synchronized capture data.",
  "codeExamples" : [

  ],
  "contentHash" : "5442487b7a821781b4322c92573920449ef06c7d4ffdccf34f010e4a18d39197",
  "crawledAt" : "2025-12-05T08:42:17Z",
  "declaration" : {
    "code" : "var delegate: (any AVCaptureDataOutputSynchronizerDelegate)? { get }",
    "language" : "swift"
  },
  "id" : "28FD8CB5-DCC1-4BEB-B6B2-76C50DBE87FF",
  "kind" : "property",
  "language" : "swift",
  "module" : "AVFoundation",
  "overview" : "## Discussion\n\nThis property is read-only. You set the delegate object and the dispatch queue for delegate methods together using the [doc:\/\/com.apple.avfoundation\/documentation\/AVFoundation\/AVCaptureDataOutputSynchronizer\/setDelegate(_:queue:)] method.",
  "platforms" : [
    "iOS",
    "iPadOS",
    "Mac Catalyst",
    "tvOS"
  ],
  "rawMarkdown" : "---\nsource: https:\/\/developer.apple.com\/documentation\/AVFoundation\/AVCaptureDataOutputSynchronizer\/delegate\ncrawled: 2025-12-05T08:42:17Z\n---\n\n# delegate\n\n**Instance Property**\n\nA delegate object that receives synchronized capture data.\n\n## Declaration\n\n```swift\nvar delegate: (any AVCaptureDataOutputSynchronizerDelegate)? { get }\n```\n\n## Discussion\n\nThis property is read-only. You set the delegate object and the dispatch queue for delegate methods together using the [doc:\/\/com.apple.avfoundation\/documentation\/AVFoundation\/AVCaptureDataOutputSynchronizer\/setDelegate(_:queue:)] method.\n\n## Receiving synchronized capture data\n\n- **setDelegate(_:queue:)**: Designates a delegate object to receive synchronized data and a dispatch queue for delivering that data.\n- **delegateCallbackQueue**: A dispatch queue for delivering synchronized capture data.\n- **AVCaptureDataOutputSynchronizerDelegate**: Methods for receiving captured data from multiple capture outputs synchronized to the same timestamp.\n\n",
  "sections" : [
    {
      "content" : "",
      "items" : [
        {
          "description" : "Designates a delegate object to receive synchronized data and a dispatch queue for delivering that data.",
          "name" : "setDelegate(_:queue:)",
          "url" : "https:\/\/developer.apple.com\/documentation\/AVFoundation\/AVCaptureDataOutputSynchronizer\/setDelegate(_:queue:)"
        },
        {
          "description" : "A dispatch queue for delivering synchronized capture data.",
          "name" : "delegateCallbackQueue",
          "url" : "https:\/\/developer.apple.com\/documentation\/AVFoundation\/AVCaptureDataOutputSynchronizer\/delegateCallbackQueue"
        },
        {
          "description" : "Methods for receiving captured data from multiple capture outputs synchronized to the same timestamp.",
          "name" : "AVCaptureDataOutputSynchronizerDelegate",
          "url" : "https:\/\/developer.apple.com\/documentation\/AVFoundation\/AVCaptureDataOutputSynchronizerDelegate"
        }
      ],
      "title" : "Receiving synchronized capture data"
    }
  ],
  "source" : "appleJSON",
  "title" : "delegate",
  "url" : "https:\/\/developer.apple.com\/documentation\/AVFoundation\/AVCaptureDataOutputSynchronizer\/delegate"
}