{
  "abstract" : "A callback in which you can provide a replacement embedded thumbnail image with compression settings, or strip the existing embedded thumbnail image from the flattened file.",
  "codeExamples" : [

  ],
  "contentHash" : "129bebaa272e6d5627e742d46a48e7a9e87876ae74223fab1d8949326da8a7f2",
  "crawledAt" : "2025-12-03T12:01:45Z",
  "declaration" : {
    "code" : "optional func replacementEmbeddedThumbnailPixelBuffer(withPhotoFormat replacementEmbeddedThumbnailPhotoFormatOut: AutoreleasingUnsafeMutablePointer<NSDictionary?>, for photo: AVCapturePhoto) -> Unmanaged<CVPixelBuffer>?",
    "language" : "swift"
  },
  "id" : "0953D9CD-E497-4693-A9A0-BD0E4DEC6752",
  "kind" : "method",
  "language" : "swift",
  "module" : "AVFoundation",
  "overview" : "## Return Value\n\nA pixel buffer containing a source image to be encoded to the file as the replacement thumbnail image. To preserve the existing embedded thumbnail photo to the flattened data, set `replacementEmbeddedThumbnailPhotoFormatOut` to `photo.embeddedThumbnailPhotoFormat` and return `nil`. To replace the existing embedded thumbnail, pass a replacement photo format dictionary and return a non-`nil` replacement pixel buffer.  To remove the existing embedded thumbnail, set `replacementEmbeddedThumbnailPhotoFormatOut` to `nil` and return `nil`.\n\n## Discussion\n\nThis callback is optional. If your delegate doesn’t implement this callback, the existing metadata in the in-memory [doc:\/\/com.apple.avfoundation\/documentation\/AVFoundation\/AVCapturePhoto] container is written directly to the file data representation.",
  "platforms" : [
    "iOS",
    "iPadOS",
    "Mac Catalyst",
    "tvOS"
  ],
  "rawMarkdown" : "---\nsource: https:\/\/developer.apple.com\/documentation\/AVFoundation\/AVCapturePhotoFileDataRepresentationCustomizer\/replacementEmbeddedThumbnailPixelBuffer(withPhotoFormat:for:)\ncrawled: 2025-12-03T12:01:45Z\n---\n\n# replacementEmbeddedThumbnailPixelBuffer(withPhotoFormat:for:)\n\n**Instance Method**\n\nA callback in which you can provide a replacement embedded thumbnail image with compression settings, or strip the existing embedded thumbnail image from the flattened file.\n\n## Declaration\n\n```swift\noptional func replacementEmbeddedThumbnailPixelBuffer(withPhotoFormat replacementEmbeddedThumbnailPhotoFormatOut: AutoreleasingUnsafeMutablePointer<NSDictionary?>, for photo: AVCapturePhoto) -> Unmanaged<CVPixelBuffer>?\n```\n\n## Parameters\n\n- **replacementEmbeddedThumbnailPhotoFormatOut**: A pointer to a dictionary of keys and values from `AVFoundation\/AVVideoSettings.h`.  If you pass a non-nil dictionary, [doc:\/\/com.apple.avfoundation\/documentation\/AVFoundation\/AVVideoCodecKey] is required, with `width` and `height` keys optional.\n- **photo**: The calling instance of [doc:\/\/com.apple.avfoundation\/documentation\/AVFoundation\/AVCapturePhoto] whose file metadata you’re modifying.\n\n## Return Value\n\nA pixel buffer containing a source image to be encoded to the file as the replacement thumbnail image. To preserve the existing embedded thumbnail photo to the flattened data, set `replacementEmbeddedThumbnailPhotoFormatOut` to `photo.embeddedThumbnailPhotoFormat` and return `nil`. To replace the existing embedded thumbnail, pass a replacement photo format dictionary and return a non-`nil` replacement pixel buffer.  To remove the existing embedded thumbnail, set `replacementEmbeddedThumbnailPhotoFormatOut` to `nil` and return `nil`.\n\n## Discussion\n\nThis callback is optional. If your delegate doesn’t implement this callback, the existing metadata in the in-memory [doc:\/\/com.apple.avfoundation\/documentation\/AVFoundation\/AVCapturePhoto] container is written directly to the file data representation.\n\n## Replacing or removing metadata\n\n- **replacementMetadata(for:)**: A callback in which you can provide replacement metadata or direct [doc:\/\/com.apple.avfoundation\/documentation\/AVFoundation\/AVCapturePhoto] to strip existing metadata from the flattened file.\n- **replacementDepthData(for:)**: A callback in which you can provide replacement depth data or strip existing depth data from the file.\n- **replacementPortraitEffectsMatte(for:)**: A callback in which you can provide a replacement portrait effects matte, or strip the existing portrait effects matte from the file.\n- **replacementSemanticSegmentationMatte(ofType:for:)**: Replaces or removes the semantic segmentation matte of the specified type from the flattened file data representation.\n- **replacementAppleProRAWCompressionSettings(for:defaultSettings:maximumBitDepth:)**: Replaces the compression settings the system uses when writing Apple ProRAW data to a Linear DNG file.\n\n",
  "sections" : [
    {
      "content" : "",
      "items" : [
        {
          "description" : "A callback in which you can provide replacement metadata or direct [doc:\/\/com.apple.avfoundation\/documentation\/AVFoundation\/AVCapturePhoto] to strip existing metadata from the flattened file.",
          "name" : "replacementMetadata(for:)",
          "url" : "https:\/\/developer.apple.com\/documentation\/AVFoundation\/AVCapturePhotoFileDataRepresentationCustomizer\/replacementMetadata(for:)"
        },
        {
          "description" : "A callback in which you can provide replacement depth data or strip existing depth data from the file.",
          "name" : "replacementDepthData(for:)",
          "url" : "https:\/\/developer.apple.com\/documentation\/AVFoundation\/AVCapturePhotoFileDataRepresentationCustomizer\/replacementDepthData(for:)"
        },
        {
          "description" : "A callback in which you can provide a replacement portrait effects matte, or strip the existing portrait effects matte from the file.",
          "name" : "replacementPortraitEffectsMatte(for:)",
          "url" : "https:\/\/developer.apple.com\/documentation\/AVFoundation\/AVCapturePhotoFileDataRepresentationCustomizer\/replacementPortraitEffectsMatte(for:)"
        },
        {
          "description" : "Replaces or removes the semantic segmentation matte of the specified type from the flattened file data representation.",
          "name" : "replacementSemanticSegmentationMatte(ofType:for:)",
          "url" : "https:\/\/developer.apple.com\/documentation\/AVFoundation\/AVCapturePhotoFileDataRepresentationCustomizer\/replacementSemanticSegmentationMatte(ofType:for:)"
        },
        {
          "description" : "Replaces the compression settings the system uses when writing Apple ProRAW data to a Linear DNG file.",
          "name" : "replacementAppleProRAWCompressionSettings(for:defaultSettings:maximumBitDepth:)",
          "url" : "https:\/\/developer.apple.com\/documentation\/AVFoundation\/AVCapturePhotoFileDataRepresentationCustomizer\/replacementAppleProRAWCompressionSettings(for:defaultSettings:maximumBitDepth:)"
        }
      ],
      "title" : "Replacing or removing metadata"
    }
  ],
  "source" : "appleJSON",
  "title" : "replacementEmbeddedThumbnailPixelBuffer(withPhotoFormat:for:)",
  "url" : "https:\/\/developer.apple.com\/documentation\/AVFoundation\/AVCapturePhotoFileDataRepresentationCustomizer\/replacementEmbeddedThumbnailPixelBuffer(withPhotoFormat:for:)"
}