{
  "abstract" : "The delegate object for the capture file output.",
  "codeExamples" : [

  ],
  "contentHash" : "642c2c7f85d255ad5d9eb3d496f995655ed3226892773622ea00ef8a2366ed86",
  "crawledAt" : "2025-12-03T07:14:32Z",
  "declaration" : {
    "code" : "unowned(unsafe) var delegate: (any AVCaptureFileOutputDelegate)? { get set }",
    "language" : "swift"
  },
  "id" : "3E2B55A8-B5DB-4E48-B4C7-31013F95D669",
  "kind" : "property",
  "language" : "swift",
  "module" : "AVFoundation",
  "overview" : "## Discussion\n\nThe delegate is an object conforming to the [doc:\/\/com.apple.avfoundation\/documentation\/AVFoundation\/AVCaptureFileOutputDelegate] protocol that will be able to monitor and control recording along exact sample boundaries.",
  "platforms" : [
    "macOS"
  ],
  "rawMarkdown" : "---\nsource: https:\/\/developer.apple.com\/documentation\/AVFoundation\/AVCaptureFileOutput\/delegate\ncrawled: 2025-12-03T07:14:32Z\n---\n\n# delegate\n\n**Instance Property**\n\nThe delegate object for the capture file output.\n\n## Declaration\n\n```swift\nunowned(unsafe) var delegate: (any AVCaptureFileOutputDelegate)? { get set }\n```\n\n## Discussion\n\nThe delegate is an object conforming to the [doc:\/\/com.apple.avfoundation\/documentation\/AVFoundation\/AVCaptureFileOutputDelegate] protocol that will be able to monitor and control recording along exact sample boundaries.\n\n## Setting file output properties\n\n- **maxRecordedDuration**: The longest duration allowed for the recording.\n- **maxRecordedFileSize**: The maximum size, in bytes, of the data that should be recorded by the receiver.\n- **minFreeDiskSpaceLimit**: The minimum amount of free space, in bytes, required for recording to continue on a given volume.\n- **outputFileURL**: The URL to which output is directed.\n- **recordedDuration**: Indicates the duration of the media recorded to the current output file.\n- **recordedFileSize**: Indicates the size, in bytes, of the data recorded to the current output file.\n- **isRecording**: Indicates whether recording is in progress.\n- **isRecordingPaused**: Indicates whether recording to the current output file is paused.\n\n",
  "sections" : [
    {
      "content" : "",
      "items" : [
        {
          "description" : "The longest duration allowed for the recording.",
          "name" : "maxRecordedDuration",
          "url" : "https:\/\/developer.apple.com\/documentation\/AVFoundation\/AVCaptureFileOutput\/maxRecordedDuration"
        },
        {
          "description" : "The maximum size, in bytes, of the data that should be recorded by the receiver.",
          "name" : "maxRecordedFileSize",
          "url" : "https:\/\/developer.apple.com\/documentation\/AVFoundation\/AVCaptureFileOutput\/maxRecordedFileSize"
        },
        {
          "description" : "The minimum amount of free space, in bytes, required for recording to continue on a given volume.",
          "name" : "minFreeDiskSpaceLimit",
          "url" : "https:\/\/developer.apple.com\/documentation\/AVFoundation\/AVCaptureFileOutput\/minFreeDiskSpaceLimit"
        },
        {
          "description" : "The URL to which output is directed.",
          "name" : "outputFileURL",
          "url" : "https:\/\/developer.apple.com\/documentation\/AVFoundation\/AVCaptureFileOutput\/outputFileURL"
        },
        {
          "description" : "Indicates the duration of the media recorded to the current output file.",
          "name" : "recordedDuration",
          "url" : "https:\/\/developer.apple.com\/documentation\/AVFoundation\/AVCaptureFileOutput\/recordedDuration"
        },
        {
          "description" : "Indicates the size, in bytes, of the data recorded to the current output file.",
          "name" : "recordedFileSize",
          "url" : "https:\/\/developer.apple.com\/documentation\/AVFoundation\/AVCaptureFileOutput\/recordedFileSize"
        },
        {
          "description" : "Indicates whether recording is in progress.",
          "name" : "isRecording",
          "url" : "https:\/\/developer.apple.com\/documentation\/AVFoundation\/AVCaptureFileOutput\/isRecording"
        },
        {
          "description" : "Indicates whether recording to the current output file is paused.",
          "name" : "isRecordingPaused",
          "url" : "https:\/\/developer.apple.com\/documentation\/AVFoundation\/AVCaptureFileOutput\/isRecordingPaused"
        }
      ],
      "title" : "Setting file output properties"
    }
  ],
  "source" : "appleJSON",
  "title" : "delegate",
  "url" : "https:\/\/developer.apple.com\/documentation\/AVFoundation\/AVCaptureFileOutput\/delegate"
}