{
  "abstract" : "A control that adjusts the exposure bias of a capture device within the system-recommended range.",
  "codeExamples" : [

  ],
  "conformsTo" : [
    "CVarArg",
    "CustomDebugStringConvertible",
    "CustomStringConvertible",
    "Equatable",
    "Hashable",
    "NSObjectProtocol"
  ],
  "contentHash" : "875bd2ccc9fe5c01010decce6ac959fad828bde6bc984bdda2ec0120e60d029a",
  "crawledAt" : "2025-12-03T20:08:35Z",
  "declaration" : {
    "code" : "class AVCaptureSystemExposureBiasSlider",
    "language" : "swift"
  },
  "id" : "83F73D86-901D-4279-845F-4E1F6431941F",
  "kind" : "class",
  "language" : "swift",
  "module" : "AVFoundation",
  "overview" : "## Overview\n\nThis control defines its range by querying the [doc:\/\/com.apple.avfoundation\/documentation\/AVFoundation\/AVCaptureDevice\/Format\/systemRecommendedExposureBiasRange] property of the device’s active format. If a device’s [doc:\/\/com.apple.avfoundation\/documentation\/AVFoundation\/AVCaptureDevice\/activeFormat] value changes, the slider updates its range with the new format’s system-recommended value.\n\nTo use this control, add it to the capture session by calling the session’s [doc:\/\/com.apple.avfoundation\/documentation\/AVFoundation\/AVCaptureSession\/addControl(_:)] method.",
  "platforms" : [
    "iOS",
    "iPadOS",
    "Mac Catalyst",
    "macOS",
    "tvOS"
  ],
  "rawMarkdown" : "---\nsource: https:\/\/developer.apple.com\/documentation\/AVFoundation\/AVCaptureSystemExposureBiasSlider\ncrawled: 2025-12-03T20:08:35Z\n---\n\n# AVCaptureSystemExposureBiasSlider\n\n**Class**\n\nA control that adjusts the exposure bias of a capture device within the system-recommended range.\n\n## Declaration\n\n```swift\nclass AVCaptureSystemExposureBiasSlider\n```\n\n## Overview\n\nThis control defines its range by querying the [doc:\/\/com.apple.avfoundation\/documentation\/AVFoundation\/AVCaptureDevice\/Format\/systemRecommendedExposureBiasRange] property of the device’s active format. If a device’s [doc:\/\/com.apple.avfoundation\/documentation\/AVFoundation\/AVCaptureDevice\/activeFormat] value changes, the slider updates its range with the new format’s system-recommended value.\n\nTo use this control, add it to the capture session by calling the session’s [doc:\/\/com.apple.avfoundation\/documentation\/AVFoundation\/AVCaptureSession\/addControl(_:)] method.\n\n## Creating an exposure bias slider\n\n- **init(device:)**: Creates a slider to control the exposure bias of the specified capture device.\n- **init(device:action:)**: Creates a slider to control the exposure bias of the specified capture device with an action to respond to exposure bias changes.\n\n## Capture controls\n\n- **Enhancing your app experience with the Camera Control**: Provide direct access to your camera app’s features to help people quickly capture the perfect shot.\n- **AVCaptureControl**: An abstract base class for controls that interact with the camera system.\n- **AVCaptureSystemZoomSlider**: A control that adjusts the video zoom factor of a capture device within the system-recommended range.\n- **AVCaptureSlider**: A slider control that selects a value from a bounded range.\n- **AVCaptureIndexPicker**: A control for selecting from a set of mutually exclusive values by index.\n\n## Inherits From\n\n- AVCaptureControl\n\n## Conforms To\n\n- CVarArg\n- CustomDebugStringConvertible\n- CustomStringConvertible\n- Equatable\n- Hashable\n- NSObjectProtocol\n\n",
  "sections" : [
    {
      "content" : "",
      "items" : [
        {
          "description" : "Creates a slider to control the exposure bias of the specified capture device.",
          "name" : "init(device:)",
          "url" : "https:\/\/developer.apple.com\/documentation\/AVFoundation\/AVCaptureSystemExposureBiasSlider\/init(device:)"
        },
        {
          "description" : "Creates a slider to control the exposure bias of the specified capture device with an action to respond to exposure bias changes.",
          "name" : "init(device:action:)",
          "url" : "https:\/\/developer.apple.com\/documentation\/AVFoundation\/AVCaptureSystemExposureBiasSlider\/init(device:action:)"
        }
      ],
      "title" : "Creating an exposure bias slider"
    },
    {
      "content" : "",
      "items" : [
        {
          "description" : "Provide direct access to your camera app’s features to help people quickly capture the perfect shot.",
          "name" : "Enhancing your app experience with the Camera Control",
          "url" : "https:\/\/developer.apple.com\/documentation\/AVFoundation\/enhancing-your-app-experience-with-the-camera-control"
        },
        {
          "description" : "An abstract base class for controls that interact with the camera system.",
          "name" : "AVCaptureControl",
          "url" : "https:\/\/developer.apple.com\/documentation\/AVFoundation\/AVCaptureControl"
        },
        {
          "description" : "A control that adjusts the video zoom factor of a capture device within the system-recommended range.",
          "name" : "AVCaptureSystemZoomSlider",
          "url" : "https:\/\/developer.apple.com\/documentation\/AVFoundation\/AVCaptureSystemZoomSlider"
        },
        {
          "description" : "A slider control that selects a value from a bounded range.",
          "name" : "AVCaptureSlider",
          "url" : "https:\/\/developer.apple.com\/documentation\/AVFoundation\/AVCaptureSlider"
        },
        {
          "description" : "A control for selecting from a set of mutually exclusive values by index.",
          "name" : "AVCaptureIndexPicker",
          "url" : "https:\/\/developer.apple.com\/documentation\/AVFoundation\/AVCaptureIndexPicker"
        }
      ],
      "title" : "Capture controls"
    },
    {
      "content" : "",
      "items" : [
        {
          "name" : "AVCaptureControl"
        }
      ],
      "title" : "Inherits From"
    }
  ],
  "source" : "appleJSON",
  "title" : "AVCaptureSystemExposureBiasSlider",
  "url" : "https:\/\/developer.apple.com\/documentation\/AVFoundation\/AVCaptureSystemExposureBiasSlider"
}