{
  "abstract" : "The container file format for eventual output of the RAW image.",
  "codeExamples" : [

  ],
  "contentHash" : "d930302ebe69382debd00ea9ac3c15e2d2079c6b31edcf215a0968a98aae670c",
  "crawledAt" : "2025-12-05T07:09:27Z",
  "declaration" : {
    "code" : "var rawFileType: AVFileType? { get }",
    "language" : "swift"
  },
  "id" : "8A960F64-031C-4BED-BBB8-A9070481217F",
  "kind" : "property",
  "language" : "swift",
  "module" : "AVFoundation",
  "overview" : "## Discussion\n\nYou specify a file format when creating capture settings with the [doc:\/\/com.apple.avfoundation\/documentation\/AVFoundation\/AVCapturePhotoSettings\/init(rawPixelFormatType:rawFileType:processedFormat:processedFileType:)] initializer. If you didn’t specify a file format, this value is `nil`, and the photo output automatically choosea a default file format appropriate to the [doc:\/\/com.apple.avfoundation\/documentation\/AVFoundation\/AVCapturePhotoSettings\/rawPhotoPixelFormatType] property.",
  "platforms" : [
    "iOS",
    "iPadOS",
    "Mac Catalyst",
    "tvOS"
  ],
  "rawMarkdown" : "---\nsource: https:\/\/developer.apple.com\/documentation\/AVFoundation\/AVCapturePhotoSettings\/rawFileType\ncrawled: 2025-12-05T07:09:27Z\n---\n\n# rawFileType\n\n**Instance Property**\n\nThe container file format for eventual output of the RAW image.\n\n## Declaration\n\n```swift\nvar rawFileType: AVFileType? { get }\n```\n\n## Discussion\n\nYou specify a file format when creating capture settings with the [doc:\/\/com.apple.avfoundation\/documentation\/AVFoundation\/AVCapturePhotoSettings\/init(rawPixelFormatType:rawFileType:processedFormat:processedFileType:)] initializer. If you didn’t specify a file format, this value is `nil`, and the photo output automatically choosea a default file format appropriate to the [doc:\/\/com.apple.avfoundation\/documentation\/AVFoundation\/AVCapturePhotoSettings\/rawPhotoPixelFormatType] property.\n\n## Inspecting settings\n\n- **uniqueID**: A unique identifier for this photo settings instance.\n- **format**: A dictionary describing the processed format (for example, JPEG) to deliver captured photos in.\n- **processedFileType**: The container file format for eventual output of the processed image.\n- **rawPhotoPixelFormatType**: An identifier for the Bayer RAW pixel format to deliver captured RAW photos in.\n\n",
  "sections" : [
    {
      "content" : "",
      "items" : [
        {
          "description" : "A unique identifier for this photo settings instance.",
          "name" : "uniqueID",
          "url" : "https:\/\/developer.apple.com\/documentation\/AVFoundation\/AVCapturePhotoSettings\/uniqueID"
        },
        {
          "description" : "A dictionary describing the processed format (for example, JPEG) to deliver captured photos in.",
          "name" : "format",
          "url" : "https:\/\/developer.apple.com\/documentation\/AVFoundation\/AVCapturePhotoSettings\/format"
        },
        {
          "description" : "The container file format for eventual output of the processed image.",
          "name" : "processedFileType",
          "url" : "https:\/\/developer.apple.com\/documentation\/AVFoundation\/AVCapturePhotoSettings\/processedFileType"
        },
        {
          "description" : "An identifier for the Bayer RAW pixel format to deliver captured RAW photos in.",
          "name" : "rawPhotoPixelFormatType",
          "url" : "https:\/\/developer.apple.com\/documentation\/AVFoundation\/AVCapturePhotoSettings\/rawPhotoPixelFormatType"
        }
      ],
      "title" : "Inspecting settings"
    }
  ],
  "source" : "appleJSON",
  "title" : "rawFileType",
  "url" : "https:\/\/developer.apple.com\/documentation\/AVFoundation\/AVCapturePhotoSettings\/rawFileType"
}