{
  "abstract" : "An object that represents a stream of data that a capture input provides.",
  "codeExamples" : [

  ],
  "conformsTo" : [
    "CVarArg",
    "CustomDebugStringConvertible",
    "CustomStringConvertible",
    "Equatable",
    "Hashable",
    "NSObjectProtocol"
  ],
  "contentHash" : "371ee96715f4b77f4086ed061dc7652c5de2e461f0e78d2ae5dade64c657a10f",
  "crawledAt" : "2025-12-02T17:49:53Z",
  "declaration" : {
    "code" : "class Port",
    "language" : "swift"
  },
  "id" : "0647893E-D5FD-4FA3-9842-6B6F81E9BCB2",
  "kind" : "class",
  "language" : "swift",
  "module" : "AVFoundation",
  "overview" : "## Overview\n\nInstances of [doc:\/\/com.apple.avfoundation\/documentation\/AVFoundation\/AVCaptureInput] have one or more input ports, one for each data stream they can produce. For example, an [doc:\/\/com.apple.avfoundation\/documentation\/AVFoundation\/AVCaptureDeviceInput] object presenting one video data stream has one port.",
  "platforms" : [
    "iOS",
    "iPadOS",
    "Mac Catalyst",
    "macOS",
    "tvOS"
  ],
  "rawMarkdown" : "---\nsource: https:\/\/developer.apple.com\/documentation\/AVFoundation\/AVCaptureInput\/Port\ncrawled: 2025-12-02T17:49:53Z\n---\n\n# AVCaptureInput.Port\n\n**Class**\n\nAn object that represents a stream of data that a capture input provides.\n\n## Declaration\n\n```swift\nclass Port\n```\n\n## Overview\n\nInstances of [doc:\/\/com.apple.avfoundation\/documentation\/AVFoundation\/AVCaptureInput] have one or more input ports, one for each data stream they can produce. For example, an [doc:\/\/com.apple.avfoundation\/documentation\/AVFoundation\/AVCaptureDeviceInput] object presenting one video data stream has one port.\n\n## Inspecting an input port\n\n- **isEnabled**: A Boolean value that indicates whether the port is in an enabled state.\n- **mediaType**: The media type of the port.\n- **formatDescription**: A description of the port format.\n- **sourceDeviceType**: The device type of the source camera that provides data to the port.\n- **sourceDevicePosition**: The position of the source device providing input through this port.\n- **clock**: An object that represents the capture device’s clock.\n\n## Observing format changes\n\n- **formatDescriptionDidChangeNotification**: A notification the system posts when the capture input port’s format description changes.\n\n## Accessing the input\n\n- **input**: The input object that owns the port.\n\n## Accessing ports\n\n- **ports**: The ports available on a capture input.\n\n## Inherits From\n\n- NSObject\n\n## Conforms To\n\n- CVarArg\n- CustomDebugStringConvertible\n- CustomStringConvertible\n- Equatable\n- Hashable\n- NSObjectProtocol\n\n",
  "sections" : [
    {
      "content" : "",
      "items" : [
        {
          "description" : "A Boolean value that indicates whether the port is in an enabled state.",
          "name" : "isEnabled",
          "url" : "https:\/\/developer.apple.com\/documentation\/AVFoundation\/AVCaptureInput\/Port\/isEnabled"
        },
        {
          "description" : "The media type of the port.",
          "name" : "mediaType",
          "url" : "https:\/\/developer.apple.com\/documentation\/AVFoundation\/AVCaptureInput\/Port\/mediaType"
        },
        {
          "description" : "A description of the port format.",
          "name" : "formatDescription",
          "url" : "https:\/\/developer.apple.com\/documentation\/AVFoundation\/AVCaptureInput\/Port\/formatDescription"
        },
        {
          "description" : "The device type of the source camera that provides data to the port.",
          "name" : "sourceDeviceType",
          "url" : "https:\/\/developer.apple.com\/documentation\/AVFoundation\/AVCaptureInput\/Port\/sourceDeviceType"
        },
        {
          "description" : "The position of the source device providing input through this port.",
          "name" : "sourceDevicePosition",
          "url" : "https:\/\/developer.apple.com\/documentation\/AVFoundation\/AVCaptureInput\/Port\/sourceDevicePosition"
        },
        {
          "description" : "An object that represents the capture device’s clock.",
          "name" : "clock",
          "url" : "https:\/\/developer.apple.com\/documentation\/AVFoundation\/AVCaptureInput\/Port\/clock"
        }
      ],
      "title" : "Inspecting an input port"
    },
    {
      "content" : "",
      "items" : [
        {
          "description" : "A notification the system posts when the capture input port’s format description changes.",
          "name" : "formatDescriptionDidChangeNotification",
          "url" : "https:\/\/developer.apple.com\/documentation\/AVFoundation\/AVCaptureInput\/Port\/formatDescriptionDidChangeNotification"
        }
      ],
      "title" : "Observing format changes"
    },
    {
      "content" : "",
      "items" : [
        {
          "description" : "The input object that owns the port.",
          "name" : "input",
          "url" : "https:\/\/developer.apple.com\/documentation\/AVFoundation\/AVCaptureInput\/Port\/input"
        }
      ],
      "title" : "Accessing the input"
    },
    {
      "content" : "",
      "items" : [
        {
          "description" : "The ports available on a capture input.",
          "name" : "ports",
          "url" : "https:\/\/developer.apple.com\/documentation\/AVFoundation\/AVCaptureInput\/ports"
        }
      ],
      "title" : "Accessing ports"
    },
    {
      "content" : "",
      "items" : [
        {
          "name" : "NSObject"
        }
      ],
      "title" : "Inherits From"
    }
  ],
  "source" : "appleJSON",
  "title" : "AVCaptureInput.Port",
  "url" : "https:\/\/developer.apple.com\/documentation\/AVFoundation\/AVCaptureInput\/Port"
}