{
  "abstract" : "A Boolean value that indicates whether the capture output currently supports Live Photo capture.",
  "codeExamples" : [

  ],
  "contentHash" : "69eda0621ccdc3dacfa2d7731a5ee3626cebc28cbf206a6433e6d8cc20e3cfc8",
  "crawledAt" : "2025-12-02T19:24:45Z",
  "declaration" : {
    "code" : "var isLivePhotoCaptureSupported: Bool { get }",
    "language" : "swift"
  },
  "id" : "D41005BA-2947-46BA-8018-83902CF50CA3",
  "kind" : "property",
  "language" : "swift",
  "module" : "AVFoundation",
  "overview" : "## Discussion\n\nLive Photo captures both a still image and a short movie centered on the moment of capture, and the system presents them together in user interfaces such as the Photos app.\n\nNot all devices and capture formats support Live Photo capture. This property’s value can change if the [doc:\/\/com.apple.avfoundation\/documentation\/AVFoundation\/AVCaptureSession\/sessionPreset] property of the current capture session or the [doc:\/\/com.apple.avfoundation\/documentation\/AVFoundation\/AVCaptureDevice\/activeFormat] property of the underlying capture device changes.\n\nWhen this value changes to [doc:\/\/com.apple.documentation\/documentation\/Swift\/false], the [doc:\/\/com.apple.avfoundation\/documentation\/AVFoundation\/AVCapturePhotoOutput\/isLivePhotoCaptureEnabled] property’s value also changes to [doc:\/\/com.apple.documentation\/documentation\/Swift\/false]. If you previously opted in for Live Photo capture and then change configurations, you may need to set [doc:\/\/com.apple.avfoundation\/documentation\/AVFoundation\/AVCapturePhotoOutput\/isLivePhotoCaptureEnabled] to [doc:\/\/com.apple.documentation\/documentation\/Swift\/true] again.",
  "platforms" : [
    "iOS",
    "iPadOS",
    "Mac Catalyst",
    "tvOS"
  ],
  "rawMarkdown" : "---\nsource: https:\/\/developer.apple.com\/documentation\/AVFoundation\/AVCapturePhotoOutput\/isLivePhotoCaptureSupported\ncrawled: 2025-12-02T19:24:45Z\n---\n\n# isLivePhotoCaptureSupported\n\n**Instance Property**\n\nA Boolean value that indicates whether the capture output currently supports Live Photo capture.\n\n## Declaration\n\n```swift\nvar isLivePhotoCaptureSupported: Bool { get }\n```\n\n## Discussion\n\nLive Photo captures both a still image and a short movie centered on the moment of capture, and the system presents them together in user interfaces such as the Photos app.\n\nNot all devices and capture formats support Live Photo capture. This property’s value can change if the [doc:\/\/com.apple.avfoundation\/documentation\/AVFoundation\/AVCaptureSession\/sessionPreset] property of the current capture session or the [doc:\/\/com.apple.avfoundation\/documentation\/AVFoundation\/AVCaptureDevice\/activeFormat] property of the underlying capture device changes.\n\nWhen this value changes to [doc:\/\/com.apple.documentation\/documentation\/Swift\/false], the [doc:\/\/com.apple.avfoundation\/documentation\/AVFoundation\/AVCapturePhotoOutput\/isLivePhotoCaptureEnabled] property’s value also changes to [doc:\/\/com.apple.documentation\/documentation\/Swift\/false]. If you previously opted in for Live Photo capture and then change configurations, you may need to set [doc:\/\/com.apple.avfoundation\/documentation\/AVFoundation\/AVCapturePhotoOutput\/isLivePhotoCaptureEnabled] to [doc:\/\/com.apple.documentation\/documentation\/Swift\/true] again.\n\n## Configuring Live Photo capture\n\n- **isLivePhotoCaptureEnabled**: A Boolean value that indicates whether to configure the capture pipeline for Live Photo capture.\n- **isLivePhotoCaptureSuspended**: A Boolean value that indicates whether Live Photo capture is currently in a suspended state.\n- **preservesLivePhotoCaptureSuspendedOnSessionStop**: A Boolean value that indicates whether to preserve the suspended state of Live Photo capture when the session stops.\n- **isLivePhotoAutoTrimmingEnabled**: A Boolean value that indicates whether to automatically trim Live Photo movie captures to avoid excessive movement.\n- **availableLivePhotoVideoCodecTypes**: An array of video codecs currently available for Live Photo movie captures.\n\n",
  "sections" : [
    {
      "content" : "",
      "items" : [
        {
          "description" : "A Boolean value that indicates whether to configure the capture pipeline for Live Photo capture.",
          "name" : "isLivePhotoCaptureEnabled",
          "url" : "https:\/\/developer.apple.com\/documentation\/AVFoundation\/AVCapturePhotoOutput\/isLivePhotoCaptureEnabled"
        },
        {
          "description" : "A Boolean value that indicates whether Live Photo capture is currently in a suspended state.",
          "name" : "isLivePhotoCaptureSuspended",
          "url" : "https:\/\/developer.apple.com\/documentation\/AVFoundation\/AVCapturePhotoOutput\/isLivePhotoCaptureSuspended"
        },
        {
          "description" : "A Boolean value that indicates whether to preserve the suspended state of Live Photo capture when the session stops.",
          "name" : "preservesLivePhotoCaptureSuspendedOnSessionStop",
          "url" : "https:\/\/developer.apple.com\/documentation\/AVFoundation\/AVCapturePhotoOutput\/preservesLivePhotoCaptureSuspendedOnSessionStop"
        },
        {
          "description" : "A Boolean value that indicates whether to automatically trim Live Photo movie captures to avoid excessive movement.",
          "name" : "isLivePhotoAutoTrimmingEnabled",
          "url" : "https:\/\/developer.apple.com\/documentation\/AVFoundation\/AVCapturePhotoOutput\/isLivePhotoAutoTrimmingEnabled"
        },
        {
          "description" : "An array of video codecs currently available for Live Photo movie captures.",
          "name" : "availableLivePhotoVideoCodecTypes",
          "url" : "https:\/\/developer.apple.com\/documentation\/AVFoundation\/AVCapturePhotoOutput\/availableLivePhotoVideoCodecTypes"
        }
      ],
      "title" : "Configuring Live Photo capture"
    }
  ],
  "source" : "appleJSON",
  "title" : "isLivePhotoCaptureSupported",
  "url" : "https:\/\/developer.apple.com\/documentation\/AVFoundation\/AVCapturePhotoOutput\/isLivePhotoCaptureSupported"
}