{
  "abstract" : "Allows the action to synchronize its information with settings in another app.",
  "codeExamples" : [

  ],
  "contentHash" : "ab0cf7565bf2750d145b78306eaee21f9c6676d8c6cf76d5e4acf6514607d084",
  "crawledAt" : "2025-12-06T09:38:06Z",
  "declaration" : {
    "code" : "func activated()",
    "language" : "swift"
  },
  "id" : "6B2F99BF-40ED-40CB-BA86-6B313F7D70CA",
  "kind" : "method",
  "language" : "swift",
  "module" : "Automator",
  "overview" : "## Discussion\n\nThe system invokes this method when the window of the Automator workflow to which the action belongs becomes the main window.\n\nBe sure to invoke the superclass implementation of this method as the last thing in your implementation.",
  "platforms" : [
    "macOS"
  ],
  "rawMarkdown" : "---\nsource: https:\/\/developer.apple.com\/documentation\/Automator\/AMAction\/activated()\ncrawled: 2025-12-06T09:38:06Z\n---\n\n# activated()\n\n**Instance Method**\n\nAllows the action to synchronize its information with settings in another app.\n\n## Declaration\n\n```swift\nfunc activated()\n```\n\n## Discussion\n\nThe system invokes this method when the window of the Automator workflow to which the action belongs becomes the main window.\n\nBe sure to invoke the superclass implementation of this method as the last thing in your implementation.\n\n## Initializing and Synchronizing the Action User Interface\n\n- **opened()**: Allows the action to initialize its user interface.\n\n",
  "sections" : [
    {
      "content" : "",
      "items" : [
        {
          "description" : "Allows the action to initialize its user interface.",
          "name" : "opened()",
          "url" : "https:\/\/developer.apple.com\/documentation\/Automator\/AMAction\/opened()"
        }
      ],
      "title" : "Initializing and Synchronizing the Action User Interface"
    }
  ],
  "source" : "appleJSON",
  "title" : "activated()",
  "url" : "https:\/\/developer.apple.com\/documentation\/Automator\/AMAction\/activated()"
}