{
  "abstract" : "An object that lets you manage an Automator workflow in your app.",
  "codeExamples" : [

  ],
  "conformsTo" : [
    "CVarArg",
    "CustomDebugStringConvertible",
    "CustomStringConvertible",
    "Equatable",
    "Hashable",
    "NSCoding",
    "NSEditor",
    "NSEditorRegistration",
    "NSObjectProtocol",
    "Sendable",
    "SendableMetatype"
  ],
  "contentHash" : "4c9b602600d9ee6588275c4d5ba552be6421cf998de084948e7adabfd00bf8ff",
  "crawledAt" : "2025-12-04T20:40:52Z",
  "declaration" : {
    "code" : "class AMWorkflowController",
    "language" : "swift"
  },
  "id" : "C2C43D5B-ECB0-4E8A-A2DA-54BCC8378517",
  "kind" : "class",
  "language" : "swift",
  "module" : "Automator",
  "overview" : "## Overview\n\nA controller can run and stop a workflow and obtain information about its state. The controller’s delegate ([doc:\/\/com.apple.automator\/documentation\/Automator\/AMWorkflowControllerDelegate]) receives messages as the workflow is executed and its actions are run.\n\nYou can load and run a workflow with minimal overhead by using the [doc:\/\/com.apple.automator\/documentation\/Automator\/AMWorkflow] class method [doc:\/\/com.apple.automator\/documentation\/Automator\/AMWorkflow\/run(at:withInput:)]. Use [doc:\/\/com.apple.automator\/documentation\/Automator\/AMWorkflowController] where you need greater control, such as the ability to start and stop the workflow. In that case, you must create and initialize both the workflow and the workflow controller objects.",
  "platforms" : [
    "macOS"
  ],
  "rawMarkdown" : "---\nsource: https:\/\/developer.apple.com\/documentation\/Automator\/AMWorkflowController\ncrawled: 2025-12-04T20:40:52Z\n---\n\n# AMWorkflowController\n\n**Class**\n\nAn object that lets you manage an Automator workflow in your app.\n\n## Declaration\n\n```swift\nclass AMWorkflowController\n```\n\n## Overview\n\nA controller can run and stop a workflow and obtain information about its state. The controller’s delegate ([doc:\/\/com.apple.automator\/documentation\/Automator\/AMWorkflowControllerDelegate]) receives messages as the workflow is executed and its actions are run.\n\nYou can load and run a workflow with minimal overhead by using the [doc:\/\/com.apple.automator\/documentation\/Automator\/AMWorkflow] class method [doc:\/\/com.apple.automator\/documentation\/Automator\/AMWorkflow\/run(at:withInput:)]. Use [doc:\/\/com.apple.automator\/documentation\/Automator\/AMWorkflowController] where you need greater control, such as the ability to start and stop the workflow. In that case, you must create and initialize both the workflow and the workflow controller objects.\n\n## Accessing the Workflow\n\n- **workflow**: The controller’s workflow.\n\n## Accessing the Workflow View\n\n- **workflowView**: The controller’s workflow view.\n\n## Accessing the Delegate\n\n- **delegate**: The controller’s delegate.\n- **AMWorkflowControllerDelegate**: A set of optional methods that a delegate of a workflow controller implements.\n\n## Controlling the Workflow\n\n- **pause(_:)**: Pauses a workflow that’s running.\n- **reset(_:)**: Stops a workflow, clears any action results, and resets the workflow back to an un-run state.\n- **run(_:)**: Runs the associated workflow, after first clearing any results stored by its actions during any previous run.\n- **step(_:)**: In a paused workflow, runs the next action in the workflow and then pauses again.\n- **stop(_:)**: Stops the associated workflow.\n\n## Getting Workflow Information\n\n- **canRun**: A Boolean value that indicates whether the controller’s workflow is able to run.\n- **isPaused**: A Boolean value that indicates whether the controller’s workflow is currently paused.\n- **isRunning**: A Boolean value that indicates whether the controller’s workflow is currently running.\n\n## Workflows\n\n- **AMWorkflow**: An object that lets you use an Automator workflow in your app.\n- **AMWorkflowView**: An object that lets you view and edit Automator workflows in your app.\n- **AMWorkspace**: A workspace for running an Automator workflow.\n\n## Inherits From\n\n- NSController\n\n## Conforms To\n\n- CVarArg\n- CustomDebugStringConvertible\n- CustomStringConvertible\n- Equatable\n- Hashable\n- NSCoding\n- NSEditor\n- NSEditorRegistration\n- NSObjectProtocol\n- Sendable\n- SendableMetatype\n\n",
  "sections" : [
    {
      "content" : "",
      "items" : [
        {
          "description" : "The controller’s workflow.",
          "name" : "workflow",
          "url" : "https:\/\/developer.apple.com\/documentation\/Automator\/AMWorkflowController\/workflow"
        }
      ],
      "title" : "Accessing the Workflow"
    },
    {
      "content" : "",
      "items" : [
        {
          "description" : "The controller’s workflow view.",
          "name" : "workflowView",
          "url" : "https:\/\/developer.apple.com\/documentation\/Automator\/AMWorkflowController\/workflowView-swift.property"
        }
      ],
      "title" : "Accessing the Workflow View"
    },
    {
      "content" : "",
      "items" : [
        {
          "description" : "The controller’s delegate.",
          "name" : "delegate",
          "url" : "https:\/\/developer.apple.com\/documentation\/Automator\/AMWorkflowController\/delegate"
        },
        {
          "description" : "A set of optional methods that a delegate of a workflow controller implements.",
          "name" : "AMWorkflowControllerDelegate",
          "url" : "https:\/\/developer.apple.com\/documentation\/Automator\/AMWorkflowControllerDelegate"
        }
      ],
      "title" : "Accessing the Delegate"
    },
    {
      "content" : "",
      "items" : [
        {
          "description" : "Pauses a workflow that’s running.",
          "name" : "pause(_:)",
          "url" : "https:\/\/developer.apple.com\/documentation\/Automator\/AMWorkflowController\/pause(_:)"
        },
        {
          "description" : "Stops a workflow, clears any action results, and resets the workflow back to an un-run state.",
          "name" : "reset(_:)",
          "url" : "https:\/\/developer.apple.com\/documentation\/Automator\/AMWorkflowController\/reset(_:)"
        },
        {
          "description" : "Runs the associated workflow, after first clearing any results stored by its actions during any previous run.",
          "name" : "run(_:)",
          "url" : "https:\/\/developer.apple.com\/documentation\/Automator\/AMWorkflowController\/run(_:)"
        },
        {
          "description" : "In a paused workflow, runs the next action in the workflow and then pauses again.",
          "name" : "step(_:)",
          "url" : "https:\/\/developer.apple.com\/documentation\/Automator\/AMWorkflowController\/step(_:)"
        },
        {
          "description" : "Stops the associated workflow.",
          "name" : "stop(_:)",
          "url" : "https:\/\/developer.apple.com\/documentation\/Automator\/AMWorkflowController\/stop(_:)"
        }
      ],
      "title" : "Controlling the Workflow"
    },
    {
      "content" : "",
      "items" : [
        {
          "description" : "A Boolean value that indicates whether the controller’s workflow is able to run.",
          "name" : "canRun",
          "url" : "https:\/\/developer.apple.com\/documentation\/Automator\/AMWorkflowController\/canRun"
        },
        {
          "description" : "A Boolean value that indicates whether the controller’s workflow is currently paused.",
          "name" : "isPaused",
          "url" : "https:\/\/developer.apple.com\/documentation\/Automator\/AMWorkflowController\/isPaused"
        },
        {
          "description" : "A Boolean value that indicates whether the controller’s workflow is currently running.",
          "name" : "isRunning",
          "url" : "https:\/\/developer.apple.com\/documentation\/Automator\/AMWorkflowController\/isRunning"
        }
      ],
      "title" : "Getting Workflow Information"
    },
    {
      "content" : "",
      "items" : [
        {
          "description" : "An object that lets you use an Automator workflow in your app.",
          "name" : "AMWorkflow",
          "url" : "https:\/\/developer.apple.com\/documentation\/Automator\/AMWorkflow"
        },
        {
          "description" : "An object that lets you view and edit Automator workflows in your app.",
          "name" : "AMWorkflowView",
          "url" : "https:\/\/developer.apple.com\/documentation\/Automator\/AMWorkflowView"
        },
        {
          "description" : "A workspace for running an Automator workflow.",
          "name" : "AMWorkspace",
          "url" : "https:\/\/developer.apple.com\/documentation\/Automator\/AMWorkspace"
        }
      ],
      "title" : "Workflows"
    },
    {
      "content" : "",
      "items" : [
        {
          "name" : "NSController"
        }
      ],
      "title" : "Inherits From"
    }
  ],
  "source" : "appleJSON",
  "title" : "AMWorkflowController",
  "url" : "https:\/\/developer.apple.com\/documentation\/Automator\/AMWorkflowController"
}