{
  "abstract" : "An object that identifies a unique connection between two peer devices.",
  "codeExamples" : [

  ],
  "conformsTo" : [
    "CVarArg",
    "CustomDebugStringConvertible",
    "CustomStringConvertible",
    "Equatable",
    "Hashable",
    "NSObjectProtocol"
  ],
  "contentHash" : "31641590387bdfcce3b04bec69b5b471d37015f289db6b9e8ef6831bb8f1a1b0",
  "crawledAt" : "2025-12-03T05:13:08Z",
  "declaration" : {
    "code" : "class NISession",
    "language" : "swift"
  },
  "id" : "5A1BA827-8303-4E67-8A29-617A2A96CB4C",
  "kind" : "class",
  "language" : "swift",
  "module" : "Nearby Interaction",
  "overview" : "## Overview\n\nThis class represents the central mechanism to interact with nearby objects, for example, a peer Apple device or third-party accessory. After creating an [doc:\/\/com.apple.nearbyinteraction\/documentation\/NearbyInteraction\/NISession] for a nearby object, the app interacts with the object by receiving [doc:\/\/com.apple.nearbyinteraction\/documentation\/NearbyInteraction\/NISessionDelegate] callbacks.\n\nOne session represents an interaction between the user and a single nearby object. To interact with multiple nearby objects, create a separate session for each.\n\nFor more information, see [doc:\/\/com.apple.nearbyinteraction\/documentation\/NearbyInteraction\/initiating-and-maintaining-a-session].",
  "platforms" : [
    "iOS",
    "iPadOS",
    "Mac Catalyst",
    "watchOS"
  ],
  "rawMarkdown" : "---\nsource: https:\/\/developer.apple.com\/documentation\/NearbyInteraction\/NISession\ncrawled: 2025-12-03T05:13:08Z\n---\n\n# NISession\n\n**Class**\n\nAn object that identifies a unique connection between two peer devices.\n\n## Declaration\n\n```swift\nclass NISession\n```\n\n## Overview\n\nThis class represents the central mechanism to interact with nearby objects, for example, a peer Apple device or third-party accessory. After creating an [doc:\/\/com.apple.nearbyinteraction\/documentation\/NearbyInteraction\/NISession] for a nearby object, the app interacts with the object by receiving [doc:\/\/com.apple.nearbyinteraction\/documentation\/NearbyInteraction\/NISessionDelegate] callbacks.\n\nOne session represents an interaction between the user and a single nearby object. To interact with multiple nearby objects, create a separate session for each.\n\nFor more information, see [doc:\/\/com.apple.nearbyinteraction\/documentation\/NearbyInteraction\/initiating-and-maintaining-a-session].\n\n## Ensuring feature support\n\n- **deviceCapabilities**: An object that communicates the device’s supported framework features.\n- **NIDeviceCapability**: An interface that adds Boolean values that indicate an interaction session feature support.\n\n## Connecting to A Peer Device\n\n- **discoveryToken**: A temporary, random identifier for a device.\n- **NIDiscoveryToken**: An object that uniquely identifies a peer that participates in an interaction session.\n- **run(_:)**: Starts a session with a nearby peer.\n- **configuration**: The configuration run by the session.\n- **delegateQueue**: The dispatch queue on which the session invokes delegate callbacks.\n\n## Managing life cycle\n\n- **delegate**: An object that the framework notifies of session events.\n- **pause()**: Stops sending distance and direction updates to the peer.\n- **invalidate()**: Stops a running session.\n\n## Utilizing Camera Assistance\n\n- **setARSession(_:)**: Provides the framework with an existing AR session to use for Camera Assistance.\n- **worldTransform(for:)**: Returns a world transform to integrate a nearby object in an AR experience.\n\n## Deprecated\n\n- **isSupported**: A Boolean value that indicates whether the device supports basic interaction-session functionality.\n\n## Setup\n\n- **Initiating and maintaining a session**: Measure the relative position of a nearby device and coach the user to sustain interaction.\n\n## Inherits From\n\n- NSObject\n\n## Conforms To\n\n- CVarArg\n- CustomDebugStringConvertible\n- CustomStringConvertible\n- Equatable\n- Hashable\n- NSObjectProtocol\n\n",
  "sections" : [
    {
      "content" : "",
      "items" : [
        {
          "description" : "An object that communicates the device’s supported framework features.",
          "name" : "deviceCapabilities",
          "url" : "https:\/\/developer.apple.com\/documentation\/NearbyInteraction\/NISession\/deviceCapabilities"
        },
        {
          "description" : "An interface that adds Boolean values that indicate an interaction session feature support.",
          "name" : "NIDeviceCapability",
          "url" : "https:\/\/developer.apple.com\/documentation\/NearbyInteraction\/NIDeviceCapability"
        }
      ],
      "title" : "Ensuring feature support"
    },
    {
      "content" : "",
      "items" : [
        {
          "description" : "A temporary, random identifier for a device.",
          "name" : "discoveryToken",
          "url" : "https:\/\/developer.apple.com\/documentation\/NearbyInteraction\/NISession\/discoveryToken"
        },
        {
          "description" : "An object that uniquely identifies a peer that participates in an interaction session.",
          "name" : "NIDiscoveryToken",
          "url" : "https:\/\/developer.apple.com\/documentation\/NearbyInteraction\/NIDiscoveryToken"
        },
        {
          "description" : "Starts a session with a nearby peer.",
          "name" : "run(_:)",
          "url" : "https:\/\/developer.apple.com\/documentation\/NearbyInteraction\/NISession\/run(_:)"
        },
        {
          "description" : "The configuration run by the session.",
          "name" : "configuration",
          "url" : "https:\/\/developer.apple.com\/documentation\/NearbyInteraction\/NISession\/configuration"
        },
        {
          "description" : "The dispatch queue on which the session invokes delegate callbacks.",
          "name" : "delegateQueue",
          "url" : "https:\/\/developer.apple.com\/documentation\/NearbyInteraction\/NISession\/delegateQueue"
        }
      ],
      "title" : "Connecting to A Peer Device"
    },
    {
      "content" : "",
      "items" : [
        {
          "description" : "An object that the framework notifies of session events.",
          "name" : "delegate",
          "url" : "https:\/\/developer.apple.com\/documentation\/NearbyInteraction\/NISession\/delegate"
        },
        {
          "description" : "Stops sending distance and direction updates to the peer.",
          "name" : "pause()",
          "url" : "https:\/\/developer.apple.com\/documentation\/NearbyInteraction\/NISession\/pause()"
        },
        {
          "description" : "Stops a running session.",
          "name" : "invalidate()",
          "url" : "https:\/\/developer.apple.com\/documentation\/NearbyInteraction\/NISession\/invalidate()"
        }
      ],
      "title" : "Managing life cycle"
    },
    {
      "content" : "",
      "items" : [
        {
          "description" : "Provides the framework with an existing AR session to use for Camera Assistance.",
          "name" : "setARSession(_:)",
          "url" : "https:\/\/developer.apple.com\/documentation\/NearbyInteraction\/NISession\/setARSession(_:)"
        },
        {
          "description" : "Returns a world transform to integrate a nearby object in an AR experience.",
          "name" : "worldTransform(for:)",
          "url" : "https:\/\/developer.apple.com\/documentation\/NearbyInteraction\/NISession\/worldTransform(for:)"
        }
      ],
      "title" : "Utilizing Camera Assistance"
    },
    {
      "content" : "",
      "items" : [
        {
          "description" : "A Boolean value that indicates whether the device supports basic interaction-session functionality.",
          "name" : "isSupported",
          "url" : "https:\/\/developer.apple.com\/documentation\/NearbyInteraction\/NISession\/isSupported"
        }
      ],
      "title" : "Deprecated"
    },
    {
      "content" : "",
      "items" : [
        {
          "description" : "Measure the relative position of a nearby device and coach the user to sustain interaction.",
          "name" : "Initiating and maintaining a session",
          "url" : "https:\/\/developer.apple.com\/documentation\/NearbyInteraction\/initiating-and-maintaining-a-session"
        }
      ],
      "title" : "Setup"
    },
    {
      "content" : "",
      "items" : [
        {
          "name" : "NSObject"
        }
      ],
      "title" : "Inherits From"
    }
  ],
  "source" : "appleJSON",
  "title" : "NISession",
  "url" : "https:\/\/developer.apple.com\/documentation\/NearbyInteraction\/NISession"
}