{
  "abstract" : "Creates an integer from the given floating-point value, rounding toward zero.",
  "codeExamples" : [
    {
      "code" : "let x = Int(21.5)\n\/\/ x == 21\nlet y = Int(-21.5)\n\/\/ y == -21",
      "language" : "swift"
    },
    {
      "code" : "let z = UInt(-21.5)\n\/\/ Error: ...the result would be less than UInt.min",
      "language" : "swift"
    }
  ],
  "contentHash" : "06ac2e1deee2f7ff3c48b3e097e7feaa6b9e47957f7e050c0caaf594b4afcb4b",
  "crawledAt" : "2025-12-04T14:36:18Z",
  "declaration" : {
    "code" : "init(_ source: Float80)",
    "language" : "swift"
  },
  "id" : "72F7FE43-87F2-46C6-8797-9F13E6BDB86B",
  "kind" : "unknown",
  "language" : "swift",
  "module" : "Swift",
  "overview" : "## Discussion\n\nAny fractional part of the value passed as `source` is removed, rounding the value toward zero.\n\nIf `source` is outside the bounds of this type after rounding toward zero, a runtime error may occur.",
  "platforms" : [
    "macOS"
  ],
  "rawMarkdown" : "---\nsource: https:\/\/developer.apple.com\/documentation\/Swift\/Int16\/init(_:)-8tp32\ncrawled: 2025-12-04T14:36:18Z\n---\n\n# init(_:)\n\n**Initializer**\n\nCreates an integer from the given floating-point value, rounding toward zero.\n\n## Declaration\n\n```swift\ninit(_ source: Float80)\n```\n\n## Parameters\n\n- **source**: A floating-point value to convert to an integer. `source` must be representable in this type after rounding toward zero.\n\n## Discussion\n\nAny fractional part of the value passed as `source` is removed, rounding the value toward zero.\n\n```swift\nlet x = Int(21.5)\n\/\/ x == 21\nlet y = Int(-21.5)\n\/\/ y == -21\n```\n\nIf `source` is outside the bounds of this type after rounding toward zero, a runtime error may occur.\n\n```swift\nlet z = UInt(-21.5)\n\/\/ Error: ...the result would be less than UInt.min\n```\n\n",
  "sections" : [

  ],
  "source" : "appleJSON",
  "title" : "init(_:)",
  "url" : "https:\/\/developer.apple.com\/documentation\/Swift\/Int16\/init(_:)-8tp32"
}