{
  "abstract" : "A type with values that support multiplication.",
  "codeExamples" : [
    {
      "code" : "extension Sequence where Element: Numeric {\n    func doublingAll() -> [Element] {\n        return map { $0 * 2 }\n    }\n}",
      "language" : "swift"
    },
    {
      "code" : "let observations = [1.5, 2.0, 3.25, 4.875, 5.5]\nlet doubledObservations = observations.doublingAll()\n\/\/ doubledObservations == [3.0, 4.0, 6.5, 9.75, 11.0]\n\nlet integers = 0..<8\nlet doubledIntegers = integers.doublingAll()\n\/\/ doubledIntegers == [0, 2, 4, 6, 8, 10, 12, 14]",
      "language" : "swift"
    }
  ],
  "conformingTypes" : [
    "Double",
    "Float",
    "Float16",
    "Float80",
    "Int",
    "Int128",
    "Int16",
    "Int32",
    "Int64",
    "Int8",
    "UInt",
    "UInt128",
    "UInt16",
    "UInt32",
    "UInt64",
    "UInt8"
  ],
  "contentHash" : "ba91018e4236f696c559022ac001f0ba8110bad9cce496ef817f5c7e6c4cb2cf",
  "crawledAt" : "2025-12-02T20:34:23Z",
  "declaration" : {
    "code" : "protocol Numeric : AdditiveArithmetic, ExpressibleByIntegerLiteral",
    "language" : "swift"
  },
  "id" : "55C4760A-2FE7-496D-93C4-AB915D55AD91",
  "inheritedBy" : [
    "BinaryFloatingPoint",
    "BinaryInteger",
    "FixedWidthInteger",
    "FloatingPoint",
    "SignedInteger",
    "SignedNumeric",
    "UnsignedInteger"
  ],
  "kind" : "protocol",
  "language" : "swift",
  "module" : "Swift",
  "overview" : "## Overview\n\nThe `Numeric` protocol provides a suitable basis for arithmetic on scalar values, such as integers and floating-point numbers. You can write generic methods that operate on any numeric type in the standard library by using the `Numeric` protocol as a generic constraint.\n\nThe following example extends `Sequence` with a method that returns an array with the sequence’s values multiplied by two.\n\nWith this extension, any sequence with elements that conform to `Numeric` has the `doublingAll()` method. For example, you can double the elements of an array of doubles or a range of integers:\n\n# Conforming to the Numeric Protocol\n\nTo add `Numeric` protocol conformance to your own custom type, implement the required initializer and operators, and provide a `magnitude` property using a type that can represent the magnitude of any value of your custom type.",
  "platforms" : [
    "iOS",
    "iPadOS",
    "Mac Catalyst",
    "macOS",
    "tvOS",
    "visionOS",
    "watchOS"
  ],
  "rawMarkdown" : "---\nsource: https:\/\/developer.apple.com\/documentation\/Swift\/Numeric\ncrawled: 2025-12-02T20:34:23Z\n---\n\n# Numeric\n\n**Protocol**\n\nA type with values that support multiplication.\n\n## Declaration\n\n```swift\nprotocol Numeric : AdditiveArithmetic, ExpressibleByIntegerLiteral\n```\n\n## Overview\n\nThe `Numeric` protocol provides a suitable basis for arithmetic on scalar values, such as integers and floating-point numbers. You can write generic methods that operate on any numeric type in the standard library by using the `Numeric` protocol as a generic constraint.\n\nThe following example extends `Sequence` with a method that returns an array with the sequence’s values multiplied by two.\n\n```swift\nextension Sequence where Element: Numeric {\n    func doublingAll() -> [Element] {\n        return map { $0 * 2 }\n    }\n}\n```\n\nWith this extension, any sequence with elements that conform to `Numeric` has the `doublingAll()` method. For example, you can double the elements of an array of doubles or a range of integers:\n\n```swift\nlet observations = [1.5, 2.0, 3.25, 4.875, 5.5]\nlet doubledObservations = observations.doublingAll()\n\/\/ doubledObservations == [3.0, 4.0, 6.5, 9.75, 11.0]\n\nlet integers = 0..<8\nlet doubledIntegers = integers.doublingAll()\n\/\/ doubledIntegers == [0, 2, 4, 6, 8, 10, 12, 14]\n```\n\n# Conforming to the Numeric Protocol\n\nTo add `Numeric` protocol conformance to your own custom type, implement the required initializer and operators, and provide a `magnitude` property using a type that can represent the magnitude of any value of your custom type.\n\n## Operators\n\n- ***(_:_:)**: Multiplies two values and produces their product.\n- ***=(_:_:)**: Multiplies two values and stores the result in the left-hand-side variable.\n\n## Associated Types\n\n- **Magnitude**: A type that can represent the absolute value of any possible value of the conforming type.\n\n## Initializers\n\n- **init(exactly:)**: Creates a new instance from the given integer, if it can be represented exactly.\n\n## Instance Properties\n\n- **magnitude**: The magnitude of this value.\n\n## Basic Arithmetic\n\n- **AdditiveArithmetic**: A type with values that support addition and subtraction.\n- **SignedNumeric**: A numeric type with a negation operation.\n- **Strideable**: A type representing continuous, one-dimensional values that can be offset and measured.\n\n## Inherits From\n\n- AdditiveArithmetic\n- Equatable\n- ExpressibleByIntegerLiteral\n\n## Inherited By\n\n- BinaryFloatingPoint\n- BinaryInteger\n- FixedWidthInteger\n- FloatingPoint\n- SignedInteger\n- SignedNumeric\n- UnsignedInteger\n\n## Conforming Types\n\n- Double\n- Float\n- Float16\n- Float80\n- Int\n- Int128\n- Int16\n- Int32\n- Int64\n- Int8\n- UInt\n- UInt128\n- UInt16\n- UInt32\n- UInt64\n- UInt8\n\n",
  "sections" : [
    {
      "content" : "",
      "items" : [
        {
          "description" : "Multiplies two values and produces their product.",
          "name" : "*(_:_:)",
          "url" : "https:\/\/developer.apple.com\/documentation\/Swift\/Numeric\/*(_:_:)"
        },
        {
          "description" : "Multiplies two values and stores the result in the left-hand-side variable.",
          "name" : "*=(_:_:)",
          "url" : "https:\/\/developer.apple.com\/documentation\/Swift\/Numeric\/*=(_:_:)"
        }
      ],
      "title" : "Operators"
    },
    {
      "content" : "",
      "items" : [
        {
          "description" : "A type that can represent the absolute value of any possible value of the conforming type.",
          "name" : "Magnitude",
          "url" : "https:\/\/developer.apple.com\/documentation\/Swift\/Numeric\/Magnitude-swift.associatedtype"
        }
      ],
      "title" : "Associated Types"
    },
    {
      "content" : "",
      "items" : [
        {
          "description" : "Creates a new instance from the given integer, if it can be represented exactly.",
          "name" : "init(exactly:)",
          "url" : "https:\/\/developer.apple.com\/documentation\/Swift\/Numeric\/init(exactly:)"
        }
      ],
      "title" : "Initializers"
    },
    {
      "content" : "",
      "items" : [
        {
          "description" : "The magnitude of this value.",
          "name" : "magnitude",
          "url" : "https:\/\/developer.apple.com\/documentation\/Swift\/Numeric\/magnitude-1v49u"
        }
      ],
      "title" : "Instance Properties"
    },
    {
      "content" : "",
      "items" : [
        {
          "description" : "A type with values that support addition and subtraction.",
          "name" : "AdditiveArithmetic",
          "url" : "https:\/\/developer.apple.com\/documentation\/Swift\/AdditiveArithmetic"
        },
        {
          "description" : "A numeric type with a negation operation.",
          "name" : "SignedNumeric",
          "url" : "https:\/\/developer.apple.com\/documentation\/Swift\/SignedNumeric"
        },
        {
          "description" : "A type representing continuous, one-dimensional values that can be offset and measured.",
          "name" : "Strideable",
          "url" : "https:\/\/developer.apple.com\/documentation\/Swift\/Strideable"
        }
      ],
      "title" : "Basic Arithmetic"
    },
    {
      "content" : "",
      "items" : [
        {
          "name" : "AdditiveArithmetic"
        },
        {
          "name" : "Equatable"
        },
        {
          "name" : "ExpressibleByIntegerLiteral"
        }
      ],
      "title" : "Inherits From"
    }
  ],
  "source" : "appleJSON",
  "title" : "Numeric",
  "url" : "https:\/\/developer.apple.com\/documentation\/Swift\/Numeric"
}