{
  "abstract" : "A type-erased hashable value.",
  "codeExamples" : [
    {
      "code" : "let descriptions: [AnyHashable: Any] = [\n    42: \"an Int\",\n    43 as Int8: \"an Int8\",\n    [\"a\", \"b\"] as Set: \"a set of strings\"\n]\nprint(descriptions[42]!)                \/\/ prints \"an Int\"\nprint(descriptions[42 as Int8]!)        \/\/ prints \"an Int\"\nprint(descriptions[43 as Int8]!)        \/\/ prints \"an Int8\"\nprint(descriptions[44])                 \/\/ prints \"nil\"\nprint(descriptions[[\"a\", \"b\"] as Set]!) \/\/ prints \"a set of strings\"",
      "language" : "swift"
    }
  ],
  "conformsTo" : [
    "Copyable",
    "CustomDebugStringConvertible",
    "CustomReflectable",
    "CustomStringConvertible",
    "Equatable",
    "Hashable"
  ],
  "contentHash" : "2d9b553c9ee20eb39eb49b48520890d921fdd9ea918a5e40d49e990682e2cae8",
  "crawledAt" : "2025-12-03T07:07:43Z",
  "declaration" : {
    "code" : "@frozen struct AnyHashable",
    "language" : "swift"
  },
  "id" : "FC929BA7-1F19-449C-AC08-6B165B01B7DE",
  "kind" : "struct",
  "language" : "swift",
  "module" : "Swift",
  "overview" : "## Overview\n\nThe `AnyHashable` type forwards equality comparisons and hashing operations to an underlying hashable value, hiding the type of the wrapped value.\n\nWhere conversion using `as` or `as?` is possible between two types (such as `Int` and `NSNumber`), `AnyHashable` uses a canonical representation of the type-erased value so that instances wrapping the same value of either type compare as equal. For example, `AnyHashable(42)` compares as equal to `AnyHashable(42 as NSNumber)`.\n\nYou can store mixed-type keys in dictionaries and other collections that require `Hashable` conformance by wrapping mixed-type keys in `AnyHashable` instances:\n\nNote that `AnyHashable` does not guarantee that it preserves the hash encoding of wrapped values. Do not rely on `AnyHashable` generating such compatible hashes, as the hash encoding that it uses may change between any two releases of the standard library.",
  "platforms" : [
    "iOS",
    "iPadOS",
    "Mac Catalyst",
    "macOS",
    "tvOS",
    "visionOS",
    "watchOS"
  ],
  "rawMarkdown" : "---\nsource: https:\/\/developer.apple.com\/documentation\/Swift\/AnyHashable\ncrawled: 2025-12-03T07:07:43Z\n---\n\n# AnyHashable\n\n**Structure**\n\nA type-erased hashable value.\n\n## Declaration\n\n```swift\n@frozen struct AnyHashable\n```\n\n## Overview\n\nThe `AnyHashable` type forwards equality comparisons and hashing operations to an underlying hashable value, hiding the type of the wrapped value.\n\nWhere conversion using `as` or `as?` is possible between two types (such as `Int` and `NSNumber`), `AnyHashable` uses a canonical representation of the type-erased value so that instances wrapping the same value of either type compare as equal. For example, `AnyHashable(42)` compares as equal to `AnyHashable(42 as NSNumber)`.\n\nYou can store mixed-type keys in dictionaries and other collections that require `Hashable` conformance by wrapping mixed-type keys in `AnyHashable` instances:\n\n```swift\nlet descriptions: [AnyHashable: Any] = [\n    42: \"an Int\",\n    43 as Int8: \"an Int8\",\n    [\"a\", \"b\"] as Set: \"a set of strings\"\n]\nprint(descriptions[42]!)                \/\/ prints \"an Int\"\nprint(descriptions[42 as Int8]!)        \/\/ prints \"an Int\"\nprint(descriptions[43 as Int8]!)        \/\/ prints \"an Int8\"\nprint(descriptions[44])                 \/\/ prints \"nil\"\nprint(descriptions[[\"a\", \"b\"] as Set]!) \/\/ prints \"a set of strings\"\n```\n\nNote that `AnyHashable` does not guarantee that it preserves the hash encoding of wrapped values. Do not rely on `AnyHashable` generating such compatible hashes, as the hash encoding that it uses may change between any two releases of the standard library.\n\n## Initializers\n\n- **init(_:)**: Creates a type-erased hashable value that wraps the given instance.\n\n## Instance Properties\n\n- **base**: The value wrapped by this instance.\n\n## Default Implementations\n\n- **CustomDebugStringConvertible Implementations**\n- **CustomReflectable Implementations**\n- **CustomStringConvertible Implementations**\n- **Equatable Implementations**\n- **Hashable Implementations**\n\n## Type-Erasing Wrappers\n\n- **AnySequence**: A type-erased sequence.\n- **AnyCollection**: A type-erased wrapper over any collection with indices that support forward traversal.\n- **AnyBidirectionalCollection**: A type-erased wrapper over any collection with indices that support bidirectional traversal.\n- **AnyRandomAccessCollection**: A type-erased wrapper over any collection with indices that support random access traversal.\n- **AnyIterator**: A type-erased iterator of `Element`.\n- **AnyIndex**: A wrapper over an underlying index that hides the specific underlying type.\n\n## Conforms To\n\n- Copyable\n- CustomDebugStringConvertible\n- CustomReflectable\n- CustomStringConvertible\n- Equatable\n- Hashable\n\n",
  "sections" : [
    {
      "content" : "",
      "items" : [
        {
          "description" : "Creates a type-erased hashable value that wraps the given instance.",
          "name" : "init(_:)",
          "url" : "https:\/\/developer.apple.com\/documentation\/Swift\/AnyHashable\/init(_:)"
        }
      ],
      "title" : "Initializers"
    },
    {
      "content" : "",
      "items" : [
        {
          "description" : "The value wrapped by this instance.",
          "name" : "base",
          "url" : "https:\/\/developer.apple.com\/documentation\/Swift\/AnyHashable\/base"
        }
      ],
      "title" : "Instance Properties"
    },
    {
      "content" : "",
      "items" : [
        {
          "description" : "",
          "name" : "CustomDebugStringConvertible Implementations",
          "url" : "https:\/\/developer.apple.com\/documentation\/Swift\/AnyHashable\/CustomDebugStringConvertible-Implementations"
        },
        {
          "description" : "",
          "name" : "CustomReflectable Implementations",
          "url" : "https:\/\/developer.apple.com\/documentation\/Swift\/AnyHashable\/CustomReflectable-Implementations"
        },
        {
          "description" : "",
          "name" : "CustomStringConvertible Implementations",
          "url" : "https:\/\/developer.apple.com\/documentation\/Swift\/AnyHashable\/CustomStringConvertible-Implementations"
        },
        {
          "description" : "",
          "name" : "Equatable Implementations",
          "url" : "https:\/\/developer.apple.com\/documentation\/Swift\/AnyHashable\/Equatable-Implementations"
        },
        {
          "description" : "",
          "name" : "Hashable Implementations",
          "url" : "https:\/\/developer.apple.com\/documentation\/Swift\/AnyHashable\/Hashable-Implementations"
        }
      ],
      "title" : "Default Implementations"
    },
    {
      "content" : "",
      "items" : [
        {
          "description" : "A type-erased sequence.",
          "name" : "AnySequence",
          "url" : "https:\/\/developer.apple.com\/documentation\/Swift\/AnySequence"
        },
        {
          "description" : "A type-erased wrapper over any collection with indices that support forward traversal.",
          "name" : "AnyCollection",
          "url" : "https:\/\/developer.apple.com\/documentation\/Swift\/AnyCollection"
        },
        {
          "description" : "A type-erased wrapper over any collection with indices that support bidirectional traversal.",
          "name" : "AnyBidirectionalCollection",
          "url" : "https:\/\/developer.apple.com\/documentation\/Swift\/AnyBidirectionalCollection"
        },
        {
          "description" : "A type-erased wrapper over any collection with indices that support random access traversal.",
          "name" : "AnyRandomAccessCollection",
          "url" : "https:\/\/developer.apple.com\/documentation\/Swift\/AnyRandomAccessCollection"
        },
        {
          "description" : "A type-erased iterator of `Element`.",
          "name" : "AnyIterator",
          "url" : "https:\/\/developer.apple.com\/documentation\/Swift\/AnyIterator"
        },
        {
          "description" : "A wrapper over an underlying index that hides the specific underlying type.",
          "name" : "AnyIndex",
          "url" : "https:\/\/developer.apple.com\/documentation\/Swift\/AnyIndex"
        }
      ],
      "title" : "Type-Erasing Wrappers"
    }
  ],
  "source" : "appleJSON",
  "title" : "AnyHashable",
  "url" : "https:\/\/developer.apple.com\/documentation\/Swift\/AnyHashable"
}