{
  "abstract" : "Use the `CF_SWIFT_NAME` macro to group functions that have related behavior.",
  "codeExamples" : [
    {
      "code" : "Color ColorCreateWithCMYK(float c, float m, float y, float k) CF_SWIFT_NAME(Color.init(c:m:y:k:));\n\nfloat ColorGetHue(Color color) CF_SWIFT_NAME(getter:Color.hue(self:));\nvoid ColorSetHue(Color color, float hue) CF_SWIFT_NAME(setter:Color.hue(self:newValue:));\n\nColor ColorDarkenColor(Color color, float amount) CF_SWIFT_NAME(Color.darken(self:amount:));\n\nextern const Color ColorBondiBlue CF_SWIFT_NAME(Color.bondiBlue);\n\nColor ColorGetCalibrationColor(void) CF_SWIFT_NAME(getter:Color.calibration());\nColor ColorSetCalibrationColor(Color color) CF_SWIFT_NAME(setter:Color.calibration(newValue:));",
      "language" : "occ"
    },
    {
      "code" : "extension Color {\n    init(c: Float, m: Float, y: Float, k: Float)\n\n    var hue: Float { get set }\n\n    func darken(amount: Float) -> Color\n\n    static var bondiBlue: Color\n\n    static var calibration: Color\n}",
      "language" : "swift"
    }
  ],
  "contentHash" : "d35a60a2560f957f9a1b7d575bd62599762e4dcc84f61832bc145ac376c4883f",
  "crawledAt" : "2025-12-04T02:30:03Z",
  "id" : "B72AEFF5-0E88-4067-8829-009D1E9CE286",
  "kind" : "article",
  "language" : "swift",
  "module" : "Swift",
  "overview" : "## Overview\n\nBecause structures in C can’t have methods, property accessors, or custom initializers, you often need to write such functionality using global functions. Structures in Swift can declare methods, property accessors, and initializers. You use the `CF_SWIFT_NAME` macro to group together related global functions into a single structure type that’s imported into Swift.\n\n### Apply CF_SWIFT_NAME to Related Functions\n\nThe example below shows several functions that are all related to a `Color` type. The `CF_SWIFT_NAME` macro is applied to each function, giving each one a new name for Swift that’s nested together under the `Color` type:\n\nThe argument you pass to the `CF_SWIFT_NAME` macro uses the same syntax as the `#selector` expression. You use `self` in a `CF_SWIFT_NAME` argument to refer to the instance that the method belongs to.\n\n### Import Related Functions into Swift\n\nHere’s how Swift imports the related functions above into a single type:",
  "rawMarkdown" : "---\nsource: https:\/\/developer.apple.com\/documentation\/Swift\/customizing-your-c-code-for-swift\ncrawled: 2025-12-04T02:30:03Z\n---\n\n# Customizing Your C Code for Swift\n\n**Article**\n\nUse the `CF_SWIFT_NAME` macro to group functions that have related behavior.\n\n## Overview\n\nBecause structures in C can’t have methods, property accessors, or custom initializers, you often need to write such functionality using global functions. Structures in Swift can declare methods, property accessors, and initializers. You use the `CF_SWIFT_NAME` macro to group together related global functions into a single structure type that’s imported into Swift.\n\n### Apply CF_SWIFT_NAME to Related Functions\n\nThe example below shows several functions that are all related to a `Color` type. The `CF_SWIFT_NAME` macro is applied to each function, giving each one a new name for Swift that’s nested together under the `Color` type:\n\n```occ\nColor ColorCreateWithCMYK(float c, float m, float y, float k) CF_SWIFT_NAME(Color.init(c:m:y:k:));\n\nfloat ColorGetHue(Color color) CF_SWIFT_NAME(getter:Color.hue(self:));\nvoid ColorSetHue(Color color, float hue) CF_SWIFT_NAME(setter:Color.hue(self:newValue:));\n\nColor ColorDarkenColor(Color color, float amount) CF_SWIFT_NAME(Color.darken(self:amount:));\n\nextern const Color ColorBondiBlue CF_SWIFT_NAME(Color.bondiBlue);\n\nColor ColorGetCalibrationColor(void) CF_SWIFT_NAME(getter:Color.calibration());\nColor ColorSetCalibrationColor(Color color) CF_SWIFT_NAME(setter:Color.calibration(newValue:));\n```\n\nThe argument you pass to the `CF_SWIFT_NAME` macro uses the same syntax as the `#selector` expression. You use `self` in a `CF_SWIFT_NAME` argument to refer to the instance that the method belongs to.\n\n### Import Related Functions into Swift\n\nHere’s how Swift imports the related functions above into a single type:\n\n```swift\nextension Color {\n    init(c: Float, m: Float, y: Float, k: Float)\n\n    var hue: Float { get set }\n\n    func darken(amount: Float) -> Color\n\n    static var bondiBlue: Color\n\n    static var calibration: Color\n}\n```\n\n\n\n",
  "sections" : [

  ],
  "source" : "appleJSON",
  "title" : "Customizing Your C Code for Swift",
  "url" : "https:\/\/developer.apple.com\/documentation\/Swift\/customizing-your-c-code-for-swift"
}