{
  "abstract" : "Creates an integer from the given floating-point value, rounding toward zero.",
  "codeExamples" : [
    {
      "code" : "let x = Int(21.5)\n\/\/ x == 21\nlet y = Int(-21.5)\n\/\/ y == -21",
      "language" : "swift"
    },
    {
      "code" : "let z = UInt(-21.5)\n\/\/ Error: ...the result would be less than UInt.min",
      "language" : "swift"
    }
  ],
  "contentHash" : "a1edc0a3ce20ca2c4b676a56ea5c392e9a34ea0aef1e33125b0f3a3c438a5061",
  "crawledAt" : "2025-12-04T14:49:51Z",
  "declaration" : {
    "code" : "init(_ source: Float80)",
    "language" : "swift"
  },
  "id" : "EF2FB693-80F4-4565-864C-A562A742A40D",
  "kind" : "unknown",
  "language" : "swift",
  "module" : "Swift",
  "overview" : "## Discussion\n\nAny fractional part of the value passed as `source` is removed, rounding the value toward zero.\n\nIf `source` is outside the bounds of this type after rounding toward zero, a runtime error may occur.",
  "platforms" : [
    "macOS"
  ],
  "rawMarkdown" : "---\nsource: https:\/\/developer.apple.com\/documentation\/Swift\/UInt\/init(_:)-7mzx8\ncrawled: 2025-12-04T14:49:51Z\n---\n\n# init(_:)\n\n**Initializer**\n\nCreates an integer from the given floating-point value, rounding toward zero.\n\n## Declaration\n\n```swift\ninit(_ source: Float80)\n```\n\n## Parameters\n\n- **source**: A floating-point value to convert to an integer. `source` must be representable in this type after rounding toward zero.\n\n## Discussion\n\nAny fractional part of the value passed as `source` is removed, rounding the value toward zero.\n\n```swift\nlet x = Int(21.5)\n\/\/ x == 21\nlet y = Int(-21.5)\n\/\/ y == -21\n```\n\nIf `source` is outside the bounds of this type after rounding toward zero, a runtime error may occur.\n\n```swift\nlet z = UInt(-21.5)\n\/\/ Error: ...the result would be less than UInt.min\n```\n\n",
  "sections" : [

  ],
  "source" : "appleJSON",
  "title" : "init(_:)",
  "url" : "https:\/\/developer.apple.com\/documentation\/Swift\/UInt\/init(_:)-7mzx8"
}