{
  "abstract" : "Work with prefix, postfix, and infix operators.",
  "codeExamples" : [

  ],
  "contentHash" : "8db69954d75a3c282ccb602e190dea8b820ff6e066390cda73e881e0d1e72f18",
  "crawledAt" : "2025-12-02T20:39:01Z",
  "id" : "61E67C38-F0C4-44BD-8486-991C6A6A7286",
  "kind" : "article",
  "language" : "swift",
  "module" : "Swift",
  "overview" : "## Overview\n\nThe tables below list the operators declared by the Swift standard library. For more information about operation declarations, see [https:\/\/docs.swift.org\/swift-book\/documentation\/the-swift-programming-language\/declarations\/#Operator-Declaration] in [https:\/\/docs.swift.org\/swift-book\/].\n\nThe prefix operators are as follows:\n\nThe postfix operators are as follows:\n\nThe infix operators are grouped below by precedence group in decreasing order of precedence. If you declare a new operator without specifying a precedence group, it is a member of the `DefaultPrecedence` precedence group. `DefaultPrecedence` has no associativity and a precedence immediately higher than `TernaryPrecedence`.\n\nThe `BitwiseShiftPrecedence` group, which isn’t associative, contains the following infix operators:\n\nThe `MultiplicationPrecedence` group, which is left associative, contains the following infix operators:\n\nThe `AdditionPrecedence` group, which is left associative, contains the following infix operators:\n\nThe `RangeFormationPrecedence` group, which isn’t associative, contains the following infix operators:\n\nThe `CastingPrecedence` group, which is left associative, contains the following infix operators:\n\nThe `NilCoalescingPrecedence` group, which is right associative, contains the following infix operators:\n\nThe `ComparisonPrecedence` group, which isn’t associative, contains the following infix operators:\n\nThe `LogicalConjunctionPrecedence` group, which is left associative, contains the following infix operators:\n\nThe `LogicalDisjunctionPrecedence` group, which is left associative, contains the following infix operators:\n\nThe `TernaryPrecedence` group, which is right associative, contains the following infix operators:\n\nThe `AssignmentPrecedence` group, which is right associative, contain the following infix operators:",
  "rawMarkdown" : "---\nsource: https:\/\/developer.apple.com\/documentation\/Swift\/operator-declarations\ncrawled: 2025-12-02T20:39:01Z\n---\n\n# Operator Declarations\n\n**Article**\n\nWork with prefix, postfix, and infix operators.\n\n## Overview\n\nThe tables below list the operators declared by the Swift standard library. For more information about operation declarations, see [https:\/\/docs.swift.org\/swift-book\/documentation\/the-swift-programming-language\/declarations\/#Operator-Declaration] in [https:\/\/docs.swift.org\/swift-book\/].\n\nThe prefix operators are as follows:\n\n\n\nThe postfix operators are as follows:\n\n\n\nThe infix operators are grouped below by precedence group in decreasing order of precedence. If you declare a new operator without specifying a precedence group, it is a member of the `DefaultPrecedence` precedence group. `DefaultPrecedence` has no associativity and a precedence immediately higher than `TernaryPrecedence`.\n\nThe `BitwiseShiftPrecedence` group, which isn’t associative, contains the following infix operators:\n\n\n\nThe `MultiplicationPrecedence` group, which is left associative, contains the following infix operators:\n\n\n\nThe `AdditionPrecedence` group, which is left associative, contains the following infix operators:\n\n\n\nThe `RangeFormationPrecedence` group, which isn’t associative, contains the following infix operators:\n\n\n\nThe `CastingPrecedence` group, which is left associative, contains the following infix operators:\n\n\n\nThe `NilCoalescingPrecedence` group, which is right associative, contains the following infix operators:\n\n\n\nThe `ComparisonPrecedence` group, which isn’t associative, contains the following infix operators:\n\n\n\nThe `LogicalConjunctionPrecedence` group, which is left associative, contains the following infix operators:\n\n\n\nThe `LogicalDisjunctionPrecedence` group, which is left associative, contains the following infix operators:\n\n\n\nThe `TernaryPrecedence` group, which is right associative, contains the following infix operators:\n\n\n\nThe `AssignmentPrecedence` group, which is right associative, contain the following infix operators:\n\n\n\n## Programming Tasks\n\n- **Input and Output**: Print values to the console, read from and write to text streams, and use command line arguments.\n- **Debugging and Reflection**: Fortify your code with runtime checks, and examine your values’ runtime representation.\n- **Macros**: Generate boilerplate code and perform other compile-time operations.\n- **Concurrency**: Perform asynchronous and parallel operations.\n- **Key-Path Expressions**: Use key-path expressions to access properties dynamically.\n- **Manual Memory Management**: Allocate and manage memory manually.\n- **Type Casting and Existential Types**: Perform casts between types or represent values of any type.\n- **C Interoperability**: Use imported C types or call C variadic functions.\n\n",
  "sections" : [
    {
      "content" : "",
      "items" : [
        {
          "description" : "Print values to the console, read from and write to text streams, and use command line arguments.",
          "name" : "Input and Output",
          "url" : "https:\/\/developer.apple.com\/documentation\/Swift\/input-and-output"
        },
        {
          "description" : "Fortify your code with runtime checks, and examine your values’ runtime representation.",
          "name" : "Debugging and Reflection",
          "url" : "https:\/\/developer.apple.com\/documentation\/Swift\/debugging-and-reflection"
        },
        {
          "description" : "Generate boilerplate code and perform other compile-time operations.",
          "name" : "Macros",
          "url" : "https:\/\/developer.apple.com\/documentation\/Swift\/macros"
        },
        {
          "description" : "Perform asynchronous and parallel operations.",
          "name" : "Concurrency",
          "url" : "https:\/\/developer.apple.com\/documentation\/Swift\/concurrency"
        },
        {
          "description" : "Use key-path expressions to access properties dynamically.",
          "name" : "Key-Path Expressions",
          "url" : "https:\/\/developer.apple.com\/documentation\/Swift\/key-path-expressions"
        },
        {
          "description" : "Allocate and manage memory manually.",
          "name" : "Manual Memory Management",
          "url" : "https:\/\/developer.apple.com\/documentation\/Swift\/manual-memory-management"
        },
        {
          "description" : "Perform casts between types or represent values of any type.",
          "name" : "Type Casting and Existential Types",
          "url" : "https:\/\/developer.apple.com\/documentation\/Swift\/type-casting-and-existential-types"
        },
        {
          "description" : "Use imported C types or call C variadic functions.",
          "name" : "C Interoperability",
          "url" : "https:\/\/developer.apple.com\/documentation\/Swift\/c-interoperability"
        }
      ],
      "title" : "Programming Tasks"
    }
  ],
  "source" : "appleJSON",
  "title" : "Operator Declarations",
  "url" : "https:\/\/developer.apple.com\/documentation\/Swift\/operator-declarations"
}