{
  "abstract" : "A nonowning collection interface to a buffer of elements stored contiguously in memory.",
  "codeExamples" : [

  ],
  "conformsTo" : [
    "AccelerateBuffer",
    "AtomicRepresentable",
    "BNNSGraph.Builder.OperationParameter",
    "BidirectionalCollection",
    "BitwiseCopyable",
    "Collection",
    "ContiguousBytes",
    "Copyable",
    "CustomDebugStringConvertible",
    "DataProtocol",
    "RandomAccessCollection",
    "Sequence"
  ],
  "contentHash" : "d1de4c8a55b74a640df228c3bd214dfb10e19599e1c9c3ee97b480c1380fb75f",
  "crawledAt" : "2025-12-03T16:19:01Z",
  "declaration" : {
    "code" : "@frozen struct UnsafeBufferPointer<Element> where Element : ~Copyable",
    "language" : "swift"
  },
  "id" : "E366D4E0-3B32-4749-A41F-5B2087D39605",
  "kind" : "struct",
  "language" : "swift",
  "module" : "Swift",
  "overview" : "## Overview\n\nYou can use an `UnsafeBufferPointer` instance in low level operations to eliminate uniqueness checks and, in release mode, bounds checks. Bounds checks are always performed in debug mode.\n\n# UnsafeBufferPointer Semantics\n\nAn `UnsafeBufferPointer` instance is a view into memory and does not own the memory that it references. Copying a value of type `UnsafeBufferPointer` does not copy the instances stored in the underlying memory. However, initializing another collection with an `UnsafeBufferPointer` instance copies the instances out of the referenced memory and into the new collection.",
  "platforms" : [
    "iOS",
    "iPadOS",
    "Mac Catalyst",
    "macOS",
    "tvOS",
    "visionOS",
    "watchOS"
  ],
  "rawMarkdown" : "---\nsource: https:\/\/developer.apple.com\/documentation\/swift\/unsafebufferpointer\ncrawled: 2025-12-03T16:19:01Z\n---\n\n# UnsafeBufferPointer\n\n**Structure**\n\nA nonowning collection interface to a buffer of elements stored contiguously in memory.\n\n## Declaration\n\n```swift\n@frozen struct UnsafeBufferPointer<Element> where Element : ~Copyable\n```\n\n## Overview\n\nYou can use an `UnsafeBufferPointer` instance in low level operations to eliminate uniqueness checks and, in release mode, bounds checks. Bounds checks are always performed in debug mode.\n\n# UnsafeBufferPointer Semantics\n\nAn `UnsafeBufferPointer` instance is a view into memory and does not own the memory that it references. Copying a value of type `UnsafeBufferPointer` does not copy the instances stored in the underlying memory. However, initializing another collection with an `UnsafeBufferPointer` instance copies the instances out of the referenced memory and into the new collection.\n\n## Initializers\n\n- **init(_:)**\n- **init(_:)**: Creates an immutable typed buffer pointer referencing the same memory as the given mutable buffer pointer.\n- **init(_:)**: Initialize an `UnsafeBufferPointer<Element>` from an `AudioBuffer`. Binds the buffer’s memory type to `Element`.\n- **init(rebasing:)**: Creates a buffer over the same memory as the given buffer slice.\n- **init(rebasing:)**: Creates a buffer over the same memory as the given buffer slice.\n- **init(start:count:)**: Creates a new buffer pointer over the specified number of contiguous instances beginning at the given pointer.\n\n## Instance Properties\n\n- **baseAddress**: A pointer to the first element of the buffer.\n- **count**: The number of elements in the buffer.\n- **span**\n\n## Instance Methods\n\n- **deallocate()**: Deallocates the memory block previously allocated at this buffer pointer’s base address.\n- **extracting(_:)**: Constructs a standalone buffer pointer over the items within the supplied range of positions in the memory region addressed by this buffer pointer.\n- **extracting(_:)**: Extracts and returns a copy of the entire buffer.\n- **extracting(_:)**: Constructs a standalone buffer pointer over the items within the supplied range of positions in the memory region addressed by this buffer pointer.\n- **withMemoryRebound(to:_:)**: Executes the given closure while temporarily binding the memory referenced by this buffer to the given type.\n\n## Subscripts\n\n- **subscript(_:)**: Accesses the element at the specified position.\n\n## Default Implementations\n\n- **AtomicRepresentable Implementations**\n- **BidirectionalCollection Implementations**\n- **Collection Implementations**\n- **CustomDebugStringConvertible Implementations**\n- **OperationParameter Implementations**\n- **Sequence Implementations**\n\n## Typed Pointers\n\n- **UnsafePointer**: A pointer for accessing data of a specific type.\n- **UnsafeMutablePointer**: A pointer for accessing and manipulating data of a specific type.\n- **UnsafeMutableBufferPointer**: A nonowning collection interface to a buffer of mutable elements stored contiguously in memory.\n\n## Conforms To\n\n- AccelerateBuffer\n- AtomicRepresentable\n- BNNSGraph.Builder.OperationParameter\n- BidirectionalCollection\n- BitwiseCopyable\n- Collection\n- ContiguousBytes\n- Copyable\n- CustomDebugStringConvertible\n- DataProtocol\n- RandomAccessCollection\n- Sequence\n\n",
  "sections" : [
    {
      "content" : "",
      "items" : [
        {
          "description" : "",
          "name" : "init(_:)",
          "url" : "https:\/\/developer.apple.com\/documentation\/Swift\/UnsafeBufferPointer\/init(_:)-2fjdq"
        },
        {
          "description" : "Creates an immutable typed buffer pointer referencing the same memory as the given mutable buffer pointer.",
          "name" : "init(_:)",
          "url" : "https:\/\/developer.apple.com\/documentation\/Swift\/UnsafeBufferPointer\/init(_:)-36fvm"
        },
        {
          "description" : "Initialize an `UnsafeBufferPointer<Element>` from an `AudioBuffer`. Binds the buffer’s memory type to `Element`.",
          "name" : "init(_:)",
          "url" : "https:\/\/developer.apple.com\/documentation\/Swift\/UnsafeBufferPointer\/init(_:)-5ei4s"
        },
        {
          "description" : "Creates a buffer over the same memory as the given buffer slice.",
          "name" : "init(rebasing:)",
          "url" : "https:\/\/developer.apple.com\/documentation\/Swift\/UnsafeBufferPointer\/init(rebasing:)-53eec"
        },
        {
          "description" : "Creates a buffer over the same memory as the given buffer slice.",
          "name" : "init(rebasing:)",
          "url" : "https:\/\/developer.apple.com\/documentation\/Swift\/UnsafeBufferPointer\/init(rebasing:)-56rdb"
        },
        {
          "description" : "Creates a new buffer pointer over the specified number of contiguous instances beginning at the given pointer.",
          "name" : "init(start:count:)",
          "url" : "https:\/\/developer.apple.com\/documentation\/Swift\/UnsafeBufferPointer\/init(start:count:)"
        }
      ],
      "title" : "Initializers"
    },
    {
      "content" : "",
      "items" : [
        {
          "description" : "A pointer to the first element of the buffer.",
          "name" : "baseAddress",
          "url" : "https:\/\/developer.apple.com\/documentation\/Swift\/UnsafeBufferPointer\/baseAddress"
        },
        {
          "description" : "The number of elements in the buffer.",
          "name" : "count",
          "url" : "https:\/\/developer.apple.com\/documentation\/Swift\/UnsafeBufferPointer\/count"
        },
        {
          "description" : "",
          "name" : "span",
          "url" : "https:\/\/developer.apple.com\/documentation\/Swift\/UnsafeBufferPointer\/span"
        }
      ],
      "title" : "Instance Properties"
    },
    {
      "content" : "",
      "items" : [
        {
          "description" : "Deallocates the memory block previously allocated at this buffer pointer’s base address.",
          "name" : "deallocate()",
          "url" : "https:\/\/developer.apple.com\/documentation\/Swift\/UnsafeBufferPointer\/deallocate()"
        },
        {
          "description" : "Constructs a standalone buffer pointer over the items within the supplied range of positions in the memory region addressed by this buffer pointer.",
          "name" : "extracting(_:)",
          "url" : "https:\/\/developer.apple.com\/documentation\/Swift\/UnsafeBufferPointer\/extracting(_:)-47z4z"
        },
        {
          "description" : "Extracts and returns a copy of the entire buffer.",
          "name" : "extracting(_:)",
          "url" : "https:\/\/developer.apple.com\/documentation\/Swift\/UnsafeBufferPointer\/extracting(_:)-4bn8q"
        },
        {
          "description" : "Constructs a standalone buffer pointer over the items within the supplied range of positions in the memory region addressed by this buffer pointer.",
          "name" : "extracting(_:)",
          "url" : "https:\/\/developer.apple.com\/documentation\/Swift\/UnsafeBufferPointer\/extracting(_:)-nivx"
        },
        {
          "description" : "Executes the given closure while temporarily binding the memory referenced by this buffer to the given type.",
          "name" : "withMemoryRebound(to:_:)",
          "url" : "https:\/\/developer.apple.com\/documentation\/Swift\/UnsafeBufferPointer\/withMemoryRebound(to:_:)"
        }
      ],
      "title" : "Instance Methods"
    },
    {
      "content" : "",
      "items" : [
        {
          "description" : "Accesses the element at the specified position.",
          "name" : "subscript(_:)",
          "url" : "https:\/\/developer.apple.com\/documentation\/Swift\/UnsafeBufferPointer\/subscript(_:)-3sy16"
        }
      ],
      "title" : "Subscripts"
    },
    {
      "content" : "",
      "items" : [
        {
          "description" : "",
          "name" : "AtomicRepresentable Implementations",
          "url" : "https:\/\/developer.apple.com\/documentation\/Swift\/UnsafeBufferPointer\/AtomicRepresentable-Implementations"
        },
        {
          "description" : "",
          "name" : "BidirectionalCollection Implementations",
          "url" : "https:\/\/developer.apple.com\/documentation\/Swift\/UnsafeBufferPointer\/BidirectionalCollection-Implementations"
        },
        {
          "description" : "",
          "name" : "Collection Implementations",
          "url" : "https:\/\/developer.apple.com\/documentation\/Swift\/UnsafeBufferPointer\/Collection-Implementations"
        },
        {
          "description" : "",
          "name" : "CustomDebugStringConvertible Implementations",
          "url" : "https:\/\/developer.apple.com\/documentation\/Swift\/UnsafeBufferPointer\/CustomDebugStringConvertible-Implementations"
        },
        {
          "description" : "",
          "name" : "OperationParameter Implementations",
          "url" : "https:\/\/developer.apple.com\/documentation\/Swift\/UnsafeBufferPointer\/OperationParameter-Implementations"
        },
        {
          "description" : "",
          "name" : "Sequence Implementations",
          "url" : "https:\/\/developer.apple.com\/documentation\/Swift\/UnsafeBufferPointer\/Sequence-Implementations"
        }
      ],
      "title" : "Default Implementations"
    },
    {
      "content" : "",
      "items" : [
        {
          "description" : "A pointer for accessing data of a specific type.",
          "name" : "UnsafePointer",
          "url" : "https:\/\/developer.apple.com\/documentation\/Swift\/UnsafePointer"
        },
        {
          "description" : "A pointer for accessing and manipulating data of a specific type.",
          "name" : "UnsafeMutablePointer",
          "url" : "https:\/\/developer.apple.com\/documentation\/Swift\/UnsafeMutablePointer"
        },
        {
          "description" : "A nonowning collection interface to a buffer of mutable elements stored contiguously in memory.",
          "name" : "UnsafeMutableBufferPointer",
          "url" : "https:\/\/developer.apple.com\/documentation\/Swift\/UnsafeMutableBufferPointer"
        }
      ],
      "title" : "Typed Pointers"
    }
  ],
  "source" : "appleJSON",
  "title" : "UnsafeBufferPointer",
  "url" : "https:\/\/developer.apple.com\/documentation\/swift\/unsafebufferpointer"
}