{
  "abstract" : "A record of the data that a particular website stores persistently.",
  "codeExamples" : [

  ],
  "conformsTo" : [
    "CVarArg",
    "CustomDebugStringConvertible",
    "CustomStringConvertible",
    "Equatable",
    "Hashable",
    "NSObjectProtocol",
    "Sendable"
  ],
  "contentHash" : "40b90e39e1f4792e5f96c18a66397b624daaf1b9a13398fc31a4fa96d2115904",
  "crawledAt" : "2025-12-05T09:00:32Z",
  "declaration" : {
    "code" : "@MainActor class WKWebsiteDataRecord",
    "language" : "swift"
  },
  "id" : "D82AEA15-D37C-4573-9095-D9B8317E2F1B",
  "kind" : "class",
  "language" : "swift",
  "module" : "WebKit",
  "overview" : "## Overview\n\nUse [doc:\/\/com.apple.webkit\/documentation\/WebKit\/WKWebsiteDataRecord] objects to discover the types of information that a website stores. Records identify the data types a website stores, but don’t identify the actual data. You might use this information to help the user manage website data. For example, Safari provides a way for users to view and remove website data. The domain name of each record contains the website’s domain name and suffix.\n\nYou don’t create [doc:\/\/com.apple.webkit\/documentation\/WebKit\/WKWebsiteDataRecord] objects directly. WebKit creates these records and stores them in the web view’s data store. Use the [doc:\/\/com.apple.webkit\/documentation\/WebKit\/WKWebsiteDataStore\/fetchDataRecords(ofTypes:completionHandler:)] of that data store to retrieve the current record objects. You also use that object to remove unwanted records.",
  "platforms" : [
    "iOS",
    "iPadOS",
    "Mac Catalyst",
    "macOS",
    "visionOS"
  ],
  "rawMarkdown" : "---\nsource: https:\/\/developer.apple.com\/documentation\/WebKit\/WKWebsiteDataRecord\ncrawled: 2025-12-05T09:00:32Z\n---\n\n# WKWebsiteDataRecord\n\n**Class**\n\nA record of the data that a particular website stores persistently.\n\n## Declaration\n\n```swift\n@MainActor class WKWebsiteDataRecord\n```\n\n## Overview\n\nUse [doc:\/\/com.apple.webkit\/documentation\/WebKit\/WKWebsiteDataRecord] objects to discover the types of information that a website stores. Records identify the data types a website stores, but don’t identify the actual data. You might use this information to help the user manage website data. For example, Safari provides a way for users to view and remove website data. The domain name of each record contains the website’s domain name and suffix.\n\nYou don’t create [doc:\/\/com.apple.webkit\/documentation\/WebKit\/WKWebsiteDataRecord] objects directly. WebKit creates these records and stores them in the web view’s data store. Use the [doc:\/\/com.apple.webkit\/documentation\/WebKit\/WKWebsiteDataStore\/fetchDataRecords(ofTypes:completionHandler:)] of that data store to retrieve the current record objects. You also use that object to remove unwanted records.\n\n## Getting the Record Information\n\n- **displayName**: The display name for the data record.\n\n## Getting the Data Type\n\n- **dataTypes**: The types of data associated with the record.\n- **Data Store Record Types**: Explore the constants that identify the types of data that websites store.\n\n## Web data management\n\n- **WKWebsiteDataStore**: An object that manages cookies, disk and memory caches, and other types of data for a web view.\n- **WKHTTPCookieStore**: An object that manages the HTTP cookies associated with a particular web view.\n- **WKURLSchemeHandler**: A protocol for loading resources with URL schemes that WebKit doesn’t handle.\n- **WKURLSchemeTask**: An interface that WebKit uses to request custom resources from your app.\n- **readAccessURL**: The local files WebKit can access when loading content.\n\n## Inherits From\n\n- NSObject\n\n## Conforms To\n\n- CVarArg\n- CustomDebugStringConvertible\n- CustomStringConvertible\n- Equatable\n- Hashable\n- NSObjectProtocol\n- Sendable\n\n",
  "sections" : [
    {
      "content" : "",
      "items" : [
        {
          "description" : "The display name for the data record.",
          "name" : "displayName",
          "url" : "https:\/\/developer.apple.com\/documentation\/WebKit\/WKWebsiteDataRecord\/displayName"
        }
      ],
      "title" : "Getting the Record Information"
    },
    {
      "content" : "",
      "items" : [
        {
          "description" : "The types of data associated with the record.",
          "name" : "dataTypes",
          "url" : "https:\/\/developer.apple.com\/documentation\/WebKit\/WKWebsiteDataRecord\/dataTypes"
        },
        {
          "description" : "Explore the constants that identify the types of data that websites store.",
          "name" : "Data Store Record Types",
          "url" : "https:\/\/developer.apple.com\/documentation\/WebKit\/data-store-record-types"
        }
      ],
      "title" : "Getting the Data Type"
    },
    {
      "content" : "",
      "items" : [
        {
          "description" : "An object that manages cookies, disk and memory caches, and other types of data for a web view.",
          "name" : "WKWebsiteDataStore",
          "url" : "https:\/\/developer.apple.com\/documentation\/WebKit\/WKWebsiteDataStore"
        },
        {
          "description" : "An object that manages the HTTP cookies associated with a particular web view.",
          "name" : "WKHTTPCookieStore",
          "url" : "https:\/\/developer.apple.com\/documentation\/WebKit\/WKHTTPCookieStore"
        },
        {
          "description" : "A protocol for loading resources with URL schemes that WebKit doesn’t handle.",
          "name" : "WKURLSchemeHandler",
          "url" : "https:\/\/developer.apple.com\/documentation\/WebKit\/WKURLSchemeHandler"
        },
        {
          "description" : "An interface that WebKit uses to request custom resources from your app.",
          "name" : "WKURLSchemeTask",
          "url" : "https:\/\/developer.apple.com\/documentation\/WebKit\/WKURLSchemeTask"
        },
        {
          "description" : "The local files WebKit can access when loading content.",
          "name" : "readAccessURL",
          "url" : "https:\/\/developer.apple.com\/documentation\/Foundation\/NSAttributedString\/DocumentReadingOptionKey\/readAccessURL"
        }
      ],
      "title" : "Web data management"
    },
    {
      "content" : "",
      "items" : [
        {
          "name" : "NSObject"
        }
      ],
      "title" : "Inherits From"
    }
  ],
  "source" : "appleJSON",
  "title" : "WKWebsiteDataRecord",
  "url" : "https:\/\/developer.apple.com\/documentation\/WebKit\/WKWebsiteDataRecord"
}