{
  "abstract" : "The media types that require a user gesture to begin playing.",
  "codeExamples" : [

  ],
  "conformsTo" : [
    "BitwiseCopyable",
    "Equatable",
    "ExpressibleByArrayLiteral",
    "OptionSet",
    "RawRepresentable",
    "Sendable",
    "SendableMetatype",
    "SetAlgebra"
  ],
  "contentHash" : "1069682d85c2c66b26b9f1e3f892378103e05b72b85f08ba196b3270ceedbc1d",
  "crawledAt" : "2025-12-05T07:27:30Z",
  "declaration" : {
    "code" : "struct WKAudiovisualMediaTypes",
    "language" : "swift"
  },
  "id" : "7EB4C671-D509-4BB0-B5D1-9F05C16D2E07",
  "kind" : "struct",
  "language" : "swift",
  "module" : "WebKit",
  "overview" : "## Overview\n\nTo indicate that no user gestures are required to play media, use an empty set of audio\/visual media types, indicated by the empty array literal, `[]`. For example, `let myAudiovisualMediaType: WKAudiovisualMediaTypes = []`.",
  "platforms" : [
    "iOS",
    "iPadOS",
    "Mac Catalyst",
    "macOS",
    "visionOS"
  ],
  "rawMarkdown" : "---\nsource: https:\/\/developer.apple.com\/documentation\/WebKit\/WKAudiovisualMediaTypes\ncrawled: 2025-12-05T07:27:30Z\n---\n\n# WKAudiovisualMediaTypes\n\n**Structure**\n\nThe media types that require a user gesture to begin playing.\n\n## Declaration\n\n```swift\nstruct WKAudiovisualMediaTypes\n```\n\n## Overview\n\nTo indicate that no user gestures are required to play media, use an empty set of audio\/visual media types, indicated by the empty array literal, `[]`. For example, `let myAudiovisualMediaType: WKAudiovisualMediaTypes = []`.\n\n## Media Types\n\n- **audio**: Media types that contain audio require a user gesture to begin playing.\n- **video**: Media types that contain video require a user gesture to begin playing.\n- **all**: All media types require a user gesture to begin playing.\n\n## Initializers\n\n- **init(rawValue:)**\n\n## Setting media playback preferences\n\n- **allowsInlineMediaPlayback**: A Boolean value that indicates whether HTML5 videos play inline or use the native full-screen controller.\n- **allowsAirPlayForMediaPlayback**: A Boolean value that indicates whether the web view allows media playback over AirPlay.\n- **allowsPictureInPictureMediaPlayback**: A Boolean value that indicates whether HTML5 videos can play Picture in Picture.\n- **mediaTypesRequiringUserActionForPlayback**: The media types that require a user gesture to begin playing.\n\n## Conforms To\n\n- BitwiseCopyable\n- Equatable\n- ExpressibleByArrayLiteral\n- OptionSet\n- RawRepresentable\n- Sendable\n- SendableMetatype\n- SetAlgebra\n\n",
  "sections" : [
    {
      "content" : "",
      "items" : [
        {
          "description" : "Media types that contain audio require a user gesture to begin playing.",
          "name" : "audio",
          "url" : "https:\/\/developer.apple.com\/documentation\/WebKit\/WKAudiovisualMediaTypes\/audio"
        },
        {
          "description" : "Media types that contain video require a user gesture to begin playing.",
          "name" : "video",
          "url" : "https:\/\/developer.apple.com\/documentation\/WebKit\/WKAudiovisualMediaTypes\/video"
        },
        {
          "description" : "All media types require a user gesture to begin playing.",
          "name" : "all",
          "url" : "https:\/\/developer.apple.com\/documentation\/WebKit\/WKAudiovisualMediaTypes\/all"
        }
      ],
      "title" : "Media Types"
    },
    {
      "content" : "",
      "items" : [
        {
          "description" : "",
          "name" : "init(rawValue:)",
          "url" : "https:\/\/developer.apple.com\/documentation\/WebKit\/WKAudiovisualMediaTypes\/init(rawValue:)"
        }
      ],
      "title" : "Initializers"
    },
    {
      "content" : "",
      "items" : [
        {
          "description" : "A Boolean value that indicates whether HTML5 videos play inline or use the native full-screen controller.",
          "name" : "allowsInlineMediaPlayback",
          "url" : "https:\/\/developer.apple.com\/documentation\/WebKit\/WKWebViewConfiguration\/allowsInlineMediaPlayback"
        },
        {
          "description" : "A Boolean value that indicates whether the web view allows media playback over AirPlay.",
          "name" : "allowsAirPlayForMediaPlayback",
          "url" : "https:\/\/developer.apple.com\/documentation\/WebKit\/WKWebViewConfiguration\/allowsAirPlayForMediaPlayback"
        },
        {
          "description" : "A Boolean value that indicates whether HTML5 videos can play Picture in Picture.",
          "name" : "allowsPictureInPictureMediaPlayback",
          "url" : "https:\/\/developer.apple.com\/documentation\/WebKit\/WKWebViewConfiguration\/allowsPictureInPictureMediaPlayback"
        },
        {
          "description" : "The media types that require a user gesture to begin playing.",
          "name" : "mediaTypesRequiringUserActionForPlayback",
          "url" : "https:\/\/developer.apple.com\/documentation\/WebKit\/WKWebViewConfiguration\/mediaTypesRequiringUserActionForPlayback"
        }
      ],
      "title" : "Setting media playback preferences"
    }
  ],
  "source" : "appleJSON",
  "title" : "WKAudiovisualMediaTypes",
  "url" : "https:\/\/developer.apple.com\/documentation\/WebKit\/WKAudiovisualMediaTypes"
}