{
  "abstract" : "Test your web content using the WebDriver commands supported by Safari 12 and later.",
  "codeExamples" : [

  ],
  "contentHash" : "620e50954f1df467b2835335de47bd0118c9dfc8254d78f7fb769fde6dde0eae",
  "crawledAt" : "2025-12-05T09:00:29Z",
  "id" : "1BDF4437-3FC7-445E-8D67-A5D7221AEE7F",
  "kind" : "article",
  "language" : "swift",
  "module" : "WebKit",
  "overview" : "## Overview\n\nThis table lists the method and the URI template (the *endpoint*) that executes each command. The [doc:\/\/com.apple.webkit\/documentation\/WebKit\/macos-webdriver-commands-for-safari-11-1-and-earlier] support the Selenium JSON Wire Protocol. The [doc:\/\/com.apple.webkit\/documentation\/WebKit\/macos-webdriver-commands-for-safari-12-and-later] support the the [https:\/\/www.w3.org\/TR\/webdriver\/#list-of-endpoints].\n\nAll URI templates listed here are supported by the `safaridriver` tool included with Safari 12 and later. For more information on the tool, see [doc:\/\/com.apple.webkit\/documentation\/WebKit\/about-webdriver-for-safari].",
  "rawMarkdown" : "---\nsource: https:\/\/developer.apple.com\/documentation\/WebKit\/macos-webdriver-commands-for-safari-12-and-later\ncrawled: 2025-12-05T09:00:29Z\n---\n\n# macOS WebDriver Commands for Safari 12 and later\n\n**Article**\n\nTest your web content using the WebDriver commands supported by Safari 12 and later.\n\n## Overview\n\nThis table lists the method and the URI template (the *endpoint*) that executes each command. The [doc:\/\/com.apple.webkit\/documentation\/WebKit\/macos-webdriver-commands-for-safari-11-1-and-earlier] support the Selenium JSON Wire Protocol. The [doc:\/\/com.apple.webkit\/documentation\/WebKit\/macos-webdriver-commands-for-safari-12-and-later] support the the [https:\/\/www.w3.org\/TR\/webdriver\/#list-of-endpoints].\n\nAll URI templates listed here are supported by the `safaridriver` tool included with Safari 12 and later. For more information on the tool, see [doc:\/\/com.apple.webkit\/documentation\/WebKit\/about-webdriver-for-safari].\n\n\n\n## WebDriver\n\n- **macOS WebDriver Commands for Safari 11.1 and earlier**: Test your web content using the WebDriver commands supported by Safari 11.1 and earlier.\n- **About WebDriver for Safari**: Enhance testing of your web content using Safari’s enhancements to WebDriver.\n- **Testing with WebDriver in Safari**: Enable WebDriver and run a test.\n\n",
  "sections" : [
    {
      "content" : "",
      "items" : [
        {
          "description" : "Test your web content using the WebDriver commands supported by Safari 11.1 and earlier.",
          "name" : "macOS WebDriver Commands for Safari 11.1 and earlier",
          "url" : "https:\/\/developer.apple.com\/documentation\/WebKit\/macos-webdriver-commands-for-safari-11-1-and-earlier"
        },
        {
          "description" : "Enhance testing of your web content using Safari’s enhancements to WebDriver.",
          "name" : "About WebDriver for Safari",
          "url" : "https:\/\/developer.apple.com\/documentation\/WebKit\/about-webdriver-for-safari"
        },
        {
          "description" : "Enable WebDriver and run a test.",
          "name" : "Testing with WebDriver in Safari",
          "url" : "https:\/\/developer.apple.com\/documentation\/WebKit\/testing-with-webdriver-in-safari"
        }
      ],
      "title" : "WebDriver"
    }
  ],
  "source" : "appleJSON",
  "title" : "macOS WebDriver Commands for Safari 12 and later",
  "url" : "https:\/\/developer.apple.com\/documentation\/WebKit\/macos-webdriver-commands-for-safari-12-and-later"
}