{
  "abstract" : "Generates a platform-native image from the web view’s contents asynchronously.",
  "codeExamples" : [

  ],
  "contentHash" : "6cd53fbcfba2c9a5769f65b0b9fb371c1680fdcc9d17336a4224e34608801edf",
  "crawledAt" : "2025-12-01T02:51:37Z",
  "declaration" : {
    "code" : "@MainActor func takeSnapshot(with snapshotConfiguration: WKSnapshotConfiguration?, completionHandler: @escaping @MainActor (NSImage?, (any Error)?) -> Void)",
    "language" : "swift"
  },
  "id" : "6A5F1F9B-09EC-47A5-BA31-79EBDD58D8EF",
  "kind" : "method",
  "module" : "WebKit",
  "platforms" : [
    "macOS"
  ],
  "rawMarkdown" : "---\nsource: https:\/\/developer.apple.com\/documentation\/WebKit\/WKWebView\/takeSnapshot(with:completionHandler:)\ncrawled: 2025-12-01T02:51:37Z\n---\n\n# takeSnapshot(with:completionHandler:)\n\n**Instance Method**\n\nGenerates a platform-native image from the web view’s contents asynchronously.\n\n## Declaration\n\n```swift\n@MainActor func takeSnapshot(with snapshotConfiguration: WKSnapshotConfiguration?, completionHandler: @escaping @MainActor (NSImage?, (any Error)?) -> Void)\n```\n\n```swift\n@MainActor func takeSnapshot(with snapshotConfiguration: WKSnapshotConfiguration?, completionHandler: @escaping @MainActor (UIImage?, (any Error)?) -> Void)\n```\n\n```swift\n@MainActor func takeSnapshot(configuration snapshotConfiguration: WKSnapshotConfiguration?) async throws -> UIImage\n```\n\n```swift\n@MainActor func takeSnapshot(configuration snapshotConfiguration: WKSnapshotConfiguration?) async throws -> NSImage\n```\n\n## Parameters\n\n- **snapshotConfiguration**: The object that specifies the portion of the web view to capture, and other capture-related behaviors.\n- **completionHandler**: The completion handler to call when the image is ready. This block has no return value and takes the following parameters:\n\n\n\n## Capturing the web view’s content\n\n- **createPDF(configuration:completionHandler:)**: Generates PDF data from the web view’s contents asynchronously.\n- **pdf(configuration:)**: Generates PDF data from the web view’s contents asynchronously.\n- **createWebArchiveData(completionHandler:)**: Creates a web archive of the web view’s current contents asynchronously.\n- **printOperation(with:)**: Returns the print operation object to use when printing the contents of the web view.\n- **WKSnapshotConfiguration**: The configuration data to use when generating an image from a web view’s contents.\n- **WKPDFConfiguration**: The configuration data to use when generating a PDF representation of a web view’s contents.\n\n",
  "sections" : [
    {
      "content" : "",
      "items" : [
        {
          "description" : "Generates PDF data from the web view’s contents asynchronously.",
          "name" : "createPDF(configuration:completionHandler:)",
          "url" : "https:\/\/developer.apple.com\/documentation\/WebKit\/WKWebView\/createPDF(configuration:completionHandler:)"
        },
        {
          "description" : "Generates PDF data from the web view’s contents asynchronously.",
          "name" : "pdf(configuration:)",
          "url" : "https:\/\/developer.apple.com\/documentation\/WebKit\/WKWebView\/pdf(configuration:)"
        },
        {
          "description" : "Creates a web archive of the web view’s current contents asynchronously.",
          "name" : "createWebArchiveData(completionHandler:)",
          "url" : "https:\/\/developer.apple.com\/documentation\/WebKit\/WKWebView\/createWebArchiveData(completionHandler:)"
        },
        {
          "description" : "Returns the print operation object to use when printing the contents of the web view.",
          "name" : "printOperation(with:)",
          "url" : "https:\/\/developer.apple.com\/documentation\/WebKit\/WKWebView\/printOperation(with:)"
        },
        {
          "description" : "The configuration data to use when generating an image from a web view’s contents.",
          "name" : "WKSnapshotConfiguration",
          "url" : "https:\/\/developer.apple.com\/documentation\/WebKit\/WKSnapshotConfiguration"
        },
        {
          "description" : "The configuration data to use when generating a PDF representation of a web view’s contents.",
          "name" : "WKPDFConfiguration",
          "url" : "https:\/\/developer.apple.com\/documentation\/WebKit\/WKPDFConfiguration"
        }
      ],
      "title" : "Capturing the web view’s content"
    }
  ],
  "source" : "appleJSON",
  "title" : "takeSnapshot(with:completionHandler:)",
  "url" : "https:\/\/developer.apple.com\/documentation\/WebKit\/WKWebView\/takeSnapshot(with:completionHandler:)"
}