{
  "abstract" : "Indicates whether you can inspect the page with Safari Web Inspector.",
  "codeExamples" : [

  ],
  "contentHash" : "8c4b2403365d6273ed1b8322b7d76f802c31294cfeb8c4ad9d2abfafcff3805b",
  "crawledAt" : "2025-12-01T11:51:17Z",
  "declaration" : {
    "code" : "@MainActor final var isInspectable: Bool { get set }",
    "language" : "swift"
  },
  "id" : "B003A289-8D1D-4C53-9CE7-19CD87D7B270",
  "kind" : "property",
  "module" : "WebKit",
  "overview" : "## Discussion\n\nSet to `true` at any point in the page’s lifetime to allow Safari Web Inspector access to inspect the view’s content. Then, select your view in Safari’s Develop menu for either your computer or an attached device to inspect it.\n\nIf you set this value to false during inspection, the system immediately closes Safari Web Inspector and does not provide any further information about the web content.\n\nThe default value of this property is `false`.",
  "platforms" : [
    "iOS",
    "iPadOS",
    "Mac Catalyst",
    "macOS",
    "visionOS"
  ],
  "rawMarkdown" : "---\nsource: https:\/\/developer.apple.com\/documentation\/WebKit\/WebPage\/isInspectable\ncrawled: 2025-12-01T11:51:17Z\n---\n\n# isInspectable\n\n**Instance Property**\n\nIndicates whether you can inspect the page with Safari Web Inspector.\n\n## Declaration\n\n```swift\n@MainActor final var isInspectable: Bool { get set }\n```\n\n## Discussion\n\nSet to `true` at any point in the page’s lifetime to allow Safari Web Inspector access to inspect the view’s content. Then, select your view in Safari’s Develop menu for either your computer or an attached device to inspect it.\n\nIf you set this value to false during inspection, the system immediately closes Safari Web Inspector and does not provide any further information about the web content.\n\nThe default value of this property is `false`.\n\n## Inspecting page information\n\n- **WebPage.CSSMediaType**: A CSS media type as defined by the [https:\/\/www.w3.org\/TR\/mediaqueries-4\/#media-types], or an arbitrary media type value.\n- **title**: The page title.\n- **url**: The URL for the current webpage.\n- **mediaType**: The media type for the contents of the webpage.\n- **customUserAgent**: The custom user agent string.\n- **serverTrust**: The trust management object you use to evaluate trust for the current webpage.\n- **hasOnlySecureContent**: Indicates whether the webpage loaded all resources on the page through securely encrypted connections.\n- **themeColor**: The theme color that the system gets from the first valid meta tag in the webpage.\n- **isBlockedByScreenTime**: Indicates whether Screen Time blocking has occurred.\n- **isWritingToolsActive**: Indicates whether Writing Tools is active for the page.\n\n",
  "sections" : [
    {
      "content" : "",
      "items" : [
        {
          "description" : "A CSS media type as defined by the [https:\/\/www.w3.org\/TR\/mediaqueries-4\/#media-types], or an arbitrary media type value.",
          "name" : "WebPage.CSSMediaType",
          "url" : "https:\/\/developer.apple.com\/documentation\/WebKit\/WebPage\/CSSMediaType"
        },
        {
          "description" : "The page title.",
          "name" : "title",
          "url" : "https:\/\/developer.apple.com\/documentation\/WebKit\/WebPage\/title"
        },
        {
          "description" : "The URL for the current webpage.",
          "name" : "url",
          "url" : "https:\/\/developer.apple.com\/documentation\/WebKit\/WebPage\/url"
        },
        {
          "description" : "The media type for the contents of the webpage.",
          "name" : "mediaType",
          "url" : "https:\/\/developer.apple.com\/documentation\/WebKit\/WebPage\/mediaType"
        },
        {
          "description" : "The custom user agent string.",
          "name" : "customUserAgent",
          "url" : "https:\/\/developer.apple.com\/documentation\/WebKit\/WebPage\/customUserAgent"
        },
        {
          "description" : "The trust management object you use to evaluate trust for the current webpage.",
          "name" : "serverTrust",
          "url" : "https:\/\/developer.apple.com\/documentation\/WebKit\/WebPage\/serverTrust"
        },
        {
          "description" : "Indicates whether the webpage loaded all resources on the page through securely encrypted connections.",
          "name" : "hasOnlySecureContent",
          "url" : "https:\/\/developer.apple.com\/documentation\/WebKit\/WebPage\/hasOnlySecureContent"
        },
        {
          "description" : "The theme color that the system gets from the first valid meta tag in the webpage.",
          "name" : "themeColor",
          "url" : "https:\/\/developer.apple.com\/documentation\/WebKit\/WebPage\/themeColor"
        },
        {
          "description" : "Indicates whether Screen Time blocking has occurred.",
          "name" : "isBlockedByScreenTime",
          "url" : "https:\/\/developer.apple.com\/documentation\/WebKit\/WebPage\/isBlockedByScreenTime"
        },
        {
          "description" : "Indicates whether Writing Tools is active for the page.",
          "name" : "isWritingToolsActive",
          "url" : "https:\/\/developer.apple.com\/documentation\/WebKit\/WebPage\/isWritingToolsActive"
        }
      ],
      "title" : "Inspecting page information"
    }
  ],
  "source" : "appleJSON",
  "title" : "isInspectable",
  "url" : "https:\/\/developer.apple.com\/documentation\/WebKit\/WebPage\/isInspectable"
}