{
  "abstract" : "An object describing the content of a widget that has no user-configurable options.",
  "codeExamples" : [
    {
      "code" : "struct LeaderboardWidget: Widget {\n\n    public var body: some WidgetConfiguration {\n        StaticConfiguration(kind: EmojiRanger.LeaderboardWidgetKind, provider: LeaderboardProvider()) { entry in\n            LeaderboardWidgetEntryView(entry: entry)\n        }\n        .configurationDisplayName(\"Ranger Leaderboard\")\n        .description(\"See all the rangers.\")\n        .supportedFamilies(LeaderboardWidget.supportedFamilies)\n    }\n}",
      "language" : "swift"
    }
  ],
  "conformsTo" : [
    "Sendable",
    "SendableMetatype",
    "WidgetConfiguration"
  ],
  "contentHash" : "28f1602af3feace9a1692411c67a2340cb6ff6de488b0f9c3dbf72773363546a",
  "crawledAt" : "2025-12-02T19:24:44Z",
  "declaration" : {
    "code" : "@MainActor @preconcurrency struct StaticConfiguration<Content> where Content : View",
    "language" : "swift"
  },
  "id" : "0D38015C-E12C-4F0E-9A80-FCB6A60746E3",
  "kind" : "struct",
  "language" : "swift",
  "module" : "WidgetKit",
  "overview" : "## Overview\n\nThe following example shows the configuration for the leaderboard widget of the [doc:\/\/com.apple.documentation\/documentation\/WidgetKit\/emoji-rangers-supporting-live-activities-interactivity-and-animations] sample code project.\n\nEvery widget has a unique `kind`, a string that you choose. You use this string to identify your widget when reloading its timeline with [doc:\/\/com.apple.WidgetKit\/documentation\/WidgetKit\/WidgetCenter].\n\nThe timeline provider is an object that determines the timeline for refreshing your widget. Providing future dates for updating your widget allows the system to optimize the refresh process.\n\nThe content closure contains the SwiftUI views that WidgetKit needs to render the widget. When WidgetKit invokes the content closure, it passes a timeline entry created by the widget provider’s [doc:\/\/com.apple.WidgetKit\/documentation\/WidgetKit\/TimelineProvider\/getSnapshot(in:completion:)] or [doc:\/\/com.apple.WidgetKit\/documentation\/WidgetKit\/TimelineProvider\/getTimeline(in:completion:)] method.\n\nModifiers let you specify the families your widget supports, and the details shown when users add or edit their widgets.",
  "platforms" : [
    "iOS",
    "iPadOS",
    "Mac Catalyst",
    "macOS",
    "visionOS",
    "watchOS"
  ],
  "rawMarkdown" : "---\nsource: https:\/\/developer.apple.com\/documentation\/WidgetKit\/StaticConfiguration\ncrawled: 2025-12-02T19:24:44Z\n---\n\n# StaticConfiguration\n\n**Structure**\n\nAn object describing the content of a widget that has no user-configurable options.\n\n## Declaration\n\n```swift\n@MainActor @preconcurrency struct StaticConfiguration<Content> where Content : View\n```\n\n## Overview\n\nThe following example shows the configuration for the leaderboard widget of the [doc:\/\/com.apple.documentation\/documentation\/WidgetKit\/emoji-rangers-supporting-live-activities-interactivity-and-animations] sample code project.\n\n```swift\nstruct LeaderboardWidget: Widget {\n\n    public var body: some WidgetConfiguration {\n        StaticConfiguration(kind: EmojiRanger.LeaderboardWidgetKind, provider: LeaderboardProvider()) { entry in\n            LeaderboardWidgetEntryView(entry: entry)\n        }\n        .configurationDisplayName(\"Ranger Leaderboard\")\n        .description(\"See all the rangers.\")\n        .supportedFamilies(LeaderboardWidget.supportedFamilies)\n    }\n}\n```\n\nEvery widget has a unique `kind`, a string that you choose. You use this string to identify your widget when reloading its timeline with [doc:\/\/com.apple.WidgetKit\/documentation\/WidgetKit\/WidgetCenter].\n\nThe timeline provider is an object that determines the timeline for refreshing your widget. Providing future dates for updating your widget allows the system to optimize the refresh process.\n\nThe content closure contains the SwiftUI views that WidgetKit needs to render the widget. When WidgetKit invokes the content closure, it passes a timeline entry created by the widget provider’s [doc:\/\/com.apple.WidgetKit\/documentation\/WidgetKit\/TimelineProvider\/getSnapshot(in:completion:)] or [doc:\/\/com.apple.WidgetKit\/documentation\/WidgetKit\/TimelineProvider\/getTimeline(in:completion:)] method.\n\nModifiers let you specify the families your widget supports, and the details shown when users add or edit their widgets.\n\n## Creating a widget configuration\n\n- **init(kind:provider:content:)**: Creates a configuration for a widget, with no user-configurable options.\n- **body**: The content and behavior of this widget.\n\n## Setting the display name\n\n- **configurationDisplayName(_:)**: Sets the name shown for a widget when a user adds or edits it using the specified string.\n- **configurationDisplayName(_:)**: Sets the name shown for a widget when a user adds or edits it using the contents of a text view.\n- **configurationDisplayName(_:)**: Sets the localized name shown for a widget when a user adds or edits the widget.\n\n## Setting the description\n\n- **description(_:)**: Sets the description shown for a widget when a user adds or edits it using the contents of a text view.\n- **description(_:)**: Sets the description shown for a widget when a user adds or edits it using the specified string.\n- **description(_:)**: Sets the localized description shown for a widget when a user adds or edits the widget.\n\n## Setting the supported families\n\n- **supportedFamilies(_:)**: Sets the sizes that a widget supports.\n- **supplementalActivityFamilies(_:)**: Sets the sizes that a Live Activity supports.\n\n## Handling background network requests\n\n- **backgroundTask(_:action:)**: Runs the given action when the system provides a background task.\n- **onBackgroundURLSessionEvents(matching:_:)**: Adds an action to perform when events related to a URL session identified by a closure are waiting to be processed.\n- **onBackgroundURLSessionEvents(matching:_:)**: Adds an action to perform when events related to a URL session with a matching identifier are waiting to be processed.\n\n## Widget creation\n\n- **Creating a widget extension**: Display your app’s content in a convenient, informative widget on various devices.\n- **Developing a WidgetKit strategy**: Explore features, tasks, related frameworks, and constraints as you make a plan to implement widgets, controls, watch complications, and Live Activities.\n- **Emoji Rangers: Supporting Live Activities, interactivity, and animations**: Offer Live Activities, controls, animate data updates, and add interactivity to widgets.\n- **Preparing widgets for additional platforms, contexts, and appearances**: Create widgets that support additional platforms and adapt to their context.\n- **Widget**: The configuration and content of a widget to display on the Home screen or in Notification Center.\n- **WidgetFamily**: Values that define the widget’s size and shape.\n\n## Conforms To\n\n- Sendable\n- SendableMetatype\n- WidgetConfiguration\n\n",
  "sections" : [
    {
      "content" : "",
      "items" : [
        {
          "description" : "Creates a configuration for a widget, with no user-configurable options.",
          "name" : "init(kind:provider:content:)",
          "url" : "https:\/\/developer.apple.com\/documentation\/WidgetKit\/StaticConfiguration\/init(kind:provider:content:)"
        },
        {
          "description" : "The content and behavior of this widget.",
          "name" : "body",
          "url" : "https:\/\/developer.apple.com\/documentation\/SwiftUI\/WidgetConfiguration\/body-swift.property"
        }
      ],
      "title" : "Creating a widget configuration"
    },
    {
      "content" : "",
      "items" : [
        {
          "description" : "Sets the name shown for a widget when a user adds or edits it using the specified string.",
          "name" : "configurationDisplayName(_:)",
          "url" : "https:\/\/developer.apple.com\/documentation\/SwiftUI\/WidgetConfiguration\/configurationDisplayName(_:)-2c3zv"
        },
        {
          "description" : "Sets the name shown for a widget when a user adds or edits it using the contents of a text view.",
          "name" : "configurationDisplayName(_:)",
          "url" : "https:\/\/developer.apple.com\/documentation\/SwiftUI\/WidgetConfiguration\/configurationDisplayName(_:)-3sbn4"
        },
        {
          "description" : "Sets the localized name shown for a widget when a user adds or edits the widget.",
          "name" : "configurationDisplayName(_:)",
          "url" : "https:\/\/developer.apple.com\/documentation\/SwiftUI\/WidgetConfiguration\/configurationDisplayName(_:)-4v9q"
        }
      ],
      "title" : "Setting the display name"
    },
    {
      "content" : "",
      "items" : [
        {
          "description" : "Sets the description shown for a widget when a user adds or edits it using the contents of a text view.",
          "name" : "description(_:)",
          "url" : "https:\/\/developer.apple.com\/documentation\/SwiftUI\/WidgetConfiguration\/description(_:)-1bvuj"
        },
        {
          "description" : "Sets the description shown for a widget when a user adds or edits it using the specified string.",
          "name" : "description(_:)",
          "url" : "https:\/\/developer.apple.com\/documentation\/SwiftUI\/WidgetConfiguration\/description(_:)-2bfr"
        },
        {
          "description" : "Sets the localized description shown for a widget when a user adds or edits the widget.",
          "name" : "description(_:)",
          "url" : "https:\/\/developer.apple.com\/documentation\/SwiftUI\/WidgetConfiguration\/description(_:)-4q9pa"
        }
      ],
      "title" : "Setting the description"
    },
    {
      "content" : "",
      "items" : [
        {
          "description" : "Sets the sizes that a widget supports.",
          "name" : "supportedFamilies(_:)",
          "url" : "https:\/\/developer.apple.com\/documentation\/SwiftUI\/WidgetConfiguration\/supportedFamilies(_:)"
        },
        {
          "description" : "Sets the sizes that a Live Activity supports.",
          "name" : "supplementalActivityFamilies(_:)",
          "url" : "https:\/\/developer.apple.com\/documentation\/SwiftUI\/WidgetConfiguration\/supplementalActivityFamilies(_:)"
        }
      ],
      "title" : "Setting the supported families"
    },
    {
      "content" : "",
      "items" : [
        {
          "description" : "Runs the given action when the system provides a background task.",
          "name" : "backgroundTask(_:action:)",
          "url" : "https:\/\/developer.apple.com\/documentation\/SwiftUI\/WidgetConfiguration\/backgroundTask(_:action:)"
        },
        {
          "description" : "Adds an action to perform when events related to a URL session identified by a closure are waiting to be processed.",
          "name" : "onBackgroundURLSessionEvents(matching:_:)",
          "url" : "https:\/\/developer.apple.com\/documentation\/SwiftUI\/WidgetConfiguration\/onBackgroundURLSessionEvents(matching:_:)-2e152"
        },
        {
          "description" : "Adds an action to perform when events related to a URL session with a matching identifier are waiting to be processed.",
          "name" : "onBackgroundURLSessionEvents(matching:_:)",
          "url" : "https:\/\/developer.apple.com\/documentation\/SwiftUI\/WidgetConfiguration\/onBackgroundURLSessionEvents(matching:_:)-fw6x"
        }
      ],
      "title" : "Handling background network requests"
    },
    {
      "content" : "",
      "items" : [
        {
          "description" : "Display your app’s content in a convenient, informative widget on various devices.",
          "name" : "Creating a widget extension",
          "url" : "https:\/\/developer.apple.com\/documentation\/WidgetKit\/Creating-a-Widget-Extension"
        },
        {
          "description" : "Explore features, tasks, related frameworks, and constraints as you make a plan to implement widgets, controls, watch complications, and Live Activities.",
          "name" : "Developing a WidgetKit strategy",
          "url" : "https:\/\/developer.apple.com\/documentation\/WidgetKit\/Developing-a-WidgetKit-strategy"
        },
        {
          "description" : "Offer Live Activities, controls, animate data updates, and add interactivity to widgets.",
          "name" : "Emoji Rangers: Supporting Live Activities, interactivity, and animations",
          "url" : "https:\/\/developer.apple.com\/documentation\/WidgetKit\/emoji-rangers-supporting-live-activities-interactivity-and-animations"
        },
        {
          "description" : "Create widgets that support additional platforms and adapt to their context.",
          "name" : "Preparing widgets for additional platforms, contexts, and appearances",
          "url" : "https:\/\/developer.apple.com\/documentation\/WidgetKit\/Preparing-widgets-for-additional-contexts-and-appearances"
        },
        {
          "description" : "The configuration and content of a widget to display on the Home screen or in Notification Center.",
          "name" : "Widget",
          "url" : "https:\/\/developer.apple.com\/documentation\/SwiftUI\/Widget"
        },
        {
          "description" : "Values that define the widget’s size and shape.",
          "name" : "WidgetFamily",
          "url" : "https:\/\/developer.apple.com\/documentation\/WidgetKit\/WidgetFamily"
        }
      ],
      "title" : "Widget creation"
    }
  ],
  "source" : "appleJSON",
  "title" : "StaticConfiguration",
  "url" : "https:\/\/developer.apple.com\/documentation\/WidgetKit\/StaticConfiguration"
}