{
  "abstract" : "Creates the object that defines and positions the content of an expanded Live Activity in the Dynamic Island.",
  "codeExamples" : [

  ],
  "contentHash" : "c6299fbeeae7286a76bb9587ac41d83248a1ca3bece2718544c2c31c64d43fd5",
  "crawledAt" : "2025-12-05T11:04:46Z",
  "declaration" : {
    "code" : "init(_ position: DynamicIslandExpandedRegionPosition, priority: Double = 0, @ViewBuilder content: () -> Content)",
    "language" : "swift"
  },
  "id" : "3B4384A5-4D02-4FA6-A0A1-7D9ED10DA9D8",
  "kind" : "unknown",
  "language" : "swift",
  "module" : "WidgetKit",
  "platforms" : [
    "iOS",
    "iPadOS",
    "Mac Catalyst"
  ],
  "rawMarkdown" : "---\nsource: https:\/\/developer.apple.com\/documentation\/WidgetKit\/DynamicIslandExpandedRegion\/init(_:priority:content:)\ncrawled: 2025-12-05T11:04:46Z\n---\n\n# init(_:priority:content:)\n\n**Initializer**\n\nCreates the object that defines and positions the content of an expanded Live Activity in the Dynamic Island.\n\n## Declaration\n\n```swift\ninit(_ position: DynamicIslandExpandedRegionPosition, priority: Double = 0, @ViewBuilder content: () -> Content)\n```\n\n## Parameters\n\n- **position**: The position for Live Activity content.\n- **priority**: The priority that tells the system which content to prioritize when it sizes the content of an expanded Live Activity in the Dynamic Island.\n- **content**: The content of an expanded Live Activity.\n\n## Creating the expanded presentation\n\n- **DynamicIslandExpandedRegionPosition**: View positions of an expanded Live Activity that appears in the Dynamic Island.\n- **dynamicIsland(verticalPlacement:)**: Specifies the vertical placement for a view of an expanded Live Activity that appears in the Dynamic Island.\n- **DynamicIslandExpandedRegionVerticalPlacement**: Vertical view positions of an expanded Live Activity that appears in the Dynamic Island.\n- **DynamicIslandExpandedContent**: A view that describes the expanded presentation of a Live Activity that appears in the Dynamic Island.\n- **DynamicIslandExpandedContentBuilder**: A result builder that constructs the content of an expanded Live Activity in the Dynamic Island.\n\n",
  "sections" : [
    {
      "content" : "",
      "items" : [
        {
          "description" : "View positions of an expanded Live Activity that appears in the Dynamic Island.",
          "name" : "DynamicIslandExpandedRegionPosition",
          "url" : "https:\/\/developer.apple.com\/documentation\/WidgetKit\/DynamicIslandExpandedRegionPosition"
        },
        {
          "description" : "Specifies the vertical placement for a view of an expanded Live Activity that appears in the Dynamic Island.",
          "name" : "dynamicIsland(verticalPlacement:)",
          "url" : "https:\/\/developer.apple.com\/documentation\/SwiftUI\/View\/dynamicIsland(verticalPlacement:)"
        },
        {
          "description" : "Vertical view positions of an expanded Live Activity that appears in the Dynamic Island.",
          "name" : "DynamicIslandExpandedRegionVerticalPlacement",
          "url" : "https:\/\/developer.apple.com\/documentation\/WidgetKit\/DynamicIslandExpandedRegionVerticalPlacement"
        },
        {
          "description" : "A view that describes the expanded presentation of a Live Activity that appears in the Dynamic Island.",
          "name" : "DynamicIslandExpandedContent",
          "url" : "https:\/\/developer.apple.com\/documentation\/WidgetKit\/DynamicIslandExpandedContent"
        },
        {
          "description" : "A result builder that constructs the content of an expanded Live Activity in the Dynamic Island.",
          "name" : "DynamicIslandExpandedContentBuilder",
          "url" : "https:\/\/developer.apple.com\/documentation\/WidgetKit\/DynamicIslandExpandedContentBuilder"
        }
      ],
      "title" : "Creating the expanded presentation"
    }
  ],
  "source" : "appleJSON",
  "title" : "init(_:priority:content:)",
  "url" : "https:\/\/developer.apple.com\/documentation\/WidgetKit\/DynamicIslandExpandedRegion\/init(_:priority:content:)"
}