{
  "abstract" : "Creates an `AccessoryWidgetGroup` that generates its label from a string.",
  "codeExamples" : [

  ],
  "contentHash" : "f312a576ae8964b64f8077d4760bd65941a4b4c3a9a9d659f2cc6b11be1624f4",
  "crawledAt" : "2025-12-03T12:24:03Z",
  "declaration" : {
    "code" : "@MainActor @preconcurrency init(_ title: some StringProtocol, @ViewBuilder content: () -> Content)",
    "language" : "swift"
  },
  "id" : "C72FB60A-042F-45E5-8D7F-A4EAD99DFD7F",
  "kind" : "unknown",
  "language" : "swift",
  "module" : "WidgetKit",
  "overview" : "## Discussion\n\nThis initializer creates a `Text` view on your behalf, and treats the label similar to `Text\/init(_:)-9d1g4`. See `Text` for more information about localizing strings.",
  "platforms" : [
    "watchOS"
  ],
  "rawMarkdown" : "---\nsource: https:\/\/developer.apple.com\/documentation\/WidgetKit\/AccessoryWidgetGroup\/init(_:content:)-3ij0e\ncrawled: 2025-12-03T12:24:03Z\n---\n\n# init(_:content:)\n\n**Initializer**\n\nCreates an `AccessoryWidgetGroup` that generates its label from a string.\n\n## Declaration\n\n```swift\n@MainActor @preconcurrency init(_ title: some StringProtocol, @ViewBuilder content: () -> Content)\n```\n\n## Parameters\n\n- **title**: A string for the label of `AccessoryWidgetGroup`.\n- **content**: A view builder for the content of the accessory group.\n\n## Discussion\n\nThis initializer creates a `Text` view on your behalf, and treats the label similar to `Text\/init(_:)-9d1g4`. See `Text` for more information about localizing strings.\n\n",
  "sections" : [

  ],
  "source" : "appleJSON",
  "title" : "init(_:content:)",
  "url" : "https:\/\/developer.apple.com\/documentation\/WidgetKit\/AccessoryWidgetGroup\/init(_:content:)-3ij0e"
}