{
  "abstract" : "A type that can receive push information about user-configured controls.",
  "codeExamples" : [

  ],
  "contentHash" : "95b7fa704b8f0f3dea79bc7b76113f7564477db2f25c2b03f6179f223d2f532c",
  "crawledAt" : "2025-12-03T04:06:30Z",
  "declaration" : {
    "code" : "protocol ControlPushHandler",
    "language" : "swift"
  },
  "id" : "D5C3BE1B-B116-484F-8659-0250D5037877",
  "kind" : "protocol",
  "language" : "swift",
  "module" : "WidgetKit",
  "overview" : "## Overview\n\nRegister a type conforming to this protocol to receive push information using the [doc:\/\/com.apple.documentation\/documentation\/SwiftUI\/ControlWidgetConfiguration\/pushHandler(_:)] modifier on your controls’ configurations.",
  "platforms" : [
    "iOS",
    "iPadOS",
    "Mac Catalyst",
    "macOS",
    "watchOS"
  ],
  "rawMarkdown" : "---\nsource: https:\/\/developer.apple.com\/documentation\/WidgetKit\/ControlPushHandler\ncrawled: 2025-12-03T04:06:30Z\n---\n\n# ControlPushHandler\n\n**Protocol**\n\nA type that can receive push information about user-configured controls.\n\n## Declaration\n\n```swift\nprotocol ControlPushHandler\n```\n\n## Overview\n\nRegister a type conforming to this protocol to receive push information using the [doc:\/\/com.apple.documentation\/documentation\/SwiftUI\/ControlWidgetConfiguration\/pushHandler(_:)] modifier on your controls’ configurations.\n\n## Initializers\n\n- **init()**: Creates a push handler.\n\n## Instance Methods\n\n- **pushTokensDidChange(controls:)**: Handle push tokens changing for configured controls.\n\n## Updates\n\n- **Updating controls locally and remotely**: Update and reload controls from your app or using push notifications.\n- **ControlPushInfo**: A structure that contains information about the push token of a user-configured control.\n\n",
  "sections" : [
    {
      "content" : "",
      "items" : [
        {
          "description" : "Creates a push handler.",
          "name" : "init()",
          "url" : "https:\/\/developer.apple.com\/documentation\/WidgetKit\/ControlPushHandler\/init()"
        }
      ],
      "title" : "Initializers"
    },
    {
      "content" : "",
      "items" : [
        {
          "description" : "Handle push tokens changing for configured controls.",
          "name" : "pushTokensDidChange(controls:)",
          "url" : "https:\/\/developer.apple.com\/documentation\/WidgetKit\/ControlPushHandler\/pushTokensDidChange(controls:)"
        }
      ],
      "title" : "Instance Methods"
    },
    {
      "content" : "",
      "items" : [
        {
          "description" : "Update and reload controls from your app or using push notifications.",
          "name" : "Updating controls locally and remotely",
          "url" : "https:\/\/developer.apple.com\/documentation\/WidgetKit\/Updating-controls-locally-and-remotely"
        },
        {
          "description" : "A structure that contains information about the push token of a user-configured control.",
          "name" : "ControlPushInfo",
          "url" : "https:\/\/developer.apple.com\/documentation\/WidgetKit\/ControlPushInfo"
        }
      ],
      "title" : "Updates"
    }
  ],
  "source" : "appleJSON",
  "title" : "ControlPushHandler",
  "url" : "https:\/\/developer.apple.com\/documentation\/WidgetKit\/ControlPushHandler"
}