{
  "abstract" : "Use SwiftUI animations to indicate data updates in your widgets and Live Activities.",
  "codeExamples" : [
    {
      "code" : "Text(totalCaffeine.formatCaffeine())\n    .font(.title)\n    .minimumScaleFactor (0.8)\n    .contentTransition(.numericText())",
      "language" : "swift"
    },
    {
      "code" : "Text (totalCaffeine.formatCaffeine())\n    .font(.title)\n    .minimumScaleFactor (0.8)\n    .contentTransition(.numericText())\n    .animation(.spring(duration: 0.2), value: totalCaffeine)",
      "language" : "swift"
    },
    {
      "code" : "Text(\"Some text with \\(entry.value) that changes.\")\n    .animation(.default.speed(0.25).delay(0.5), value: entry.value)",
      "language" : "swift"
    },
    {
      "code" : "struct LastDrinkView: View {\n    let log: CaffeineLog\n    var dateFormatStyle: Date.FormatStyle {\n        Date.FormatStyle(date: .omitted, time: .shortened)\n    }\n\n    var body: some View {\n        VStack(alignment: .leading) {\n            Text(log.drink.name)\n                .bold()\n            Text (\"\\(log.date, format: .dateformatStyle) • \\(log.drink.caffeine.formatCaffeine())\")\n        }\n        .font (.caption)\n        .id(log) \/\/ Associate the view with the data model.\n        .transition(.push(from: .bottom))\n    }\n}",
      "language" : "swift"
    }
  ],
  "contentHash" : "22f899b7023ac063c281ef6985bb6fe3c9495150ea905ecefb5cd1283f32b9cd",
  "crawledAt" : "2025-12-02T15:39:37Z",
  "id" : "246CEF17-3CE5-4015-B8A2-D43256E40C19",
  "kind" : "article",
  "language" : "swift",
  "module" : "WidgetKit",
  "overview" : "## Overview\n\nAnimations bring your widgets and Live Activities to life and alert a person when new information is available. Widgets and Live Activities animate data updates with default animations or SwiftUI animations you choose, bringing a person’s attention to updated data. In earlier OS versions, widgets don’t animate, and Live Activities only use a subset of SwiftUI transitions and animations.\n\nFor example, text views animate content changes with blurred content transitions by default, and changes to images and SF Symbols animate with default content transitions. If you add or remove views from the interface based on timeline updates or other state changes, views fade in and out.\n\nTo replace default animations and transitions:\n\nFor Live Activities that appear on devices that run iOS 16 or earlier, the system ignores any animation modifiers — for example, [doc:\/\/com.apple.documentation\/documentation\/SwiftUI\/withAnimation(_:_:)] and [doc:\/\/com.apple.documentation\/documentation\/SwiftUI\/View\/animation(_:value:)] — and uses the system’s animation timing instead. However, you can use built-in transitions like [doc:\/\/com.apple.documentation\/documentation\/SwiftUI\/AnyTransition\/opacity], [doc:\/\/com.apple.documentation\/documentation\/SwiftUI\/AnyTransition\/move(edge:)], [doc:\/\/com.apple.documentation\/documentation\/SwiftUI\/AnyTransition\/slide], [doc:\/\/com.apple.documentation\/documentation\/SwiftUI\/AnyTransition\/push(from:)], or combinations of them.\n\nFor more information about SwiftUI animations, refer to [doc:\/\/com.apple.documentation\/documentation\/SwiftUI\/Animations].\n\n### Add transitions and animations to views that update their data\n\nIn addition to the default transitions and animations that the system performs when views update their data, you can choose other built-in SwiftUI transitions and animations. Widgets and Live Activities support all built-in SwiftUI transitions and animations. For example, you could configure a content transition for numeric text as shown in this example:\n\nAdditionally, you could add a spring animation to the transition:\n\nTo use custom text animations, use [doc:\/\/com.apple.documentation\/documentation\/SwiftUI\/View\/contentTransition(_:)] as shown in the example above. To use the default text animation, use [doc:\/\/com.apple.documentation\/documentation\/SwiftUI\/View\/transition(_:)-2vjb8], and customize its speed and delay as shown in the following example:\n\n### Add transitions and animations to additional views\n\nIn addition to adding transitions or animations to a view that changes its data, you can animate a view when other widget information changes. To animate a view when a certain value changes, first associate the view you want to animate with that value’s data model object. This is easiest when your data model conforms to the [doc:\/\/com.apple.documentation\/documentation\/Swift\/Hashable] protocol. If your data model doesn’t conform to `Hashable`, change its code accordingly. Then, associate the view with the data model using the [doc:\/\/com.apple.documentation\/documentation\/SwiftUI\/View\/id(_:)] view modifier. Finally, add a transition or animation.\n\nThe following example shows how the `LastDrinkView` adds a push transition when the associated `log` changes.\n\n### Disable animations\n\nIf a content update changes many views in your widget or Live Activity, consider disabling transitions and animations for some views to direct a person’s attention to the most important updates. To disable animations for a view, including default animations, pass [doc:\/\/com.apple.documentation\/documentation\/SwiftUI\/ContentTransition\/identity] to [doc:\/\/com.apple.documentation\/documentation\/SwiftUI\/View\/transition(_:)-5h5h0] or `nil` to the `animation` parameter of [doc:\/\/com.apple.documentation\/documentation\/SwiftUI\/withAnimation(_:_:)] and [doc:\/\/com.apple.documentation\/documentation\/SwiftUI\/View\/animation(_:value:)].",
  "rawMarkdown" : "---\nsource: https:\/\/developer.apple.com\/documentation\/WidgetKit\/Animating-data-updates-in-widgets-and-live-activities\ncrawled: 2025-12-02T15:39:37Z\n---\n\n# Animating data updates in widgets and Live Activities\n\n**Article**\n\nUse SwiftUI animations to indicate data updates in your widgets and Live Activities.\n\n## Overview\n\nAnimations bring your widgets and Live Activities to life and alert a person when new information is available. Widgets and Live Activities animate data updates with default animations or SwiftUI animations you choose, bringing a person’s attention to updated data. In earlier OS versions, widgets don’t animate, and Live Activities only use a subset of SwiftUI transitions and animations.\n\n\n\nFor example, text views animate content changes with blurred content transitions by default, and changes to images and SF Symbols animate with default content transitions. If you add or remove views from the interface based on timeline updates or other state changes, views fade in and out.\n\n\n\nTo replace default animations and transitions:\n\n- Configure built-in transitions like [doc:\/\/com.apple.documentation\/documentation\/SwiftUI\/AnyTransition\/opacity], [doc:\/\/com.apple.documentation\/documentation\/SwiftUI\/AnyTransition\/move(edge:)], [doc:\/\/com.apple.documentation\/documentation\/SwiftUI\/AnyTransition\/slide], [doc:\/\/com.apple.documentation\/documentation\/SwiftUI\/AnyTransition\/push(from:)], or combinations of them.\n- Add [doc:\/\/com.apple.documentation\/documentation\/SwiftUI\/View\/transition(_:)-2vjb8], [doc:\/\/com.apple.documentation\/documentation\/SwiftUI\/View\/contentTransition(_:)], or [doc:\/\/com.apple.documentation\/documentation\/SwiftUI\/View\/animation(_:value:)] to views.\n- Request animations for timer text with [doc:\/\/com.apple.documentation\/documentation\/SwiftUI\/ContentTransition\/numericText(countsDown:)].\n\n\n\nFor Live Activities that appear on devices that run iOS 16 or earlier, the system ignores any animation modifiers — for example, [doc:\/\/com.apple.documentation\/documentation\/SwiftUI\/withAnimation(_:_:)] and [doc:\/\/com.apple.documentation\/documentation\/SwiftUI\/View\/animation(_:value:)] — and uses the system’s animation timing instead. However, you can use built-in transitions like [doc:\/\/com.apple.documentation\/documentation\/SwiftUI\/AnyTransition\/opacity], [doc:\/\/com.apple.documentation\/documentation\/SwiftUI\/AnyTransition\/move(edge:)], [doc:\/\/com.apple.documentation\/documentation\/SwiftUI\/AnyTransition\/slide], [doc:\/\/com.apple.documentation\/documentation\/SwiftUI\/AnyTransition\/push(from:)], or combinations of them.\n\nFor more information about SwiftUI animations, refer to [doc:\/\/com.apple.documentation\/documentation\/SwiftUI\/Animations].\n\n### Add transitions and animations to views that update their data\n\nIn addition to the default transitions and animations that the system performs when views update their data, you can choose other built-in SwiftUI transitions and animations. Widgets and Live Activities support all built-in SwiftUI transitions and animations. For example, you could configure a content transition for numeric text as shown in this example:\n\n```swift\nText(totalCaffeine.formatCaffeine())\n    .font(.title)\n    .minimumScaleFactor (0.8)\n    .contentTransition(.numericText())\n```\n\nAdditionally, you could add a spring animation to the transition:\n\n```swift\nText (totalCaffeine.formatCaffeine())\n    .font(.title)\n    .minimumScaleFactor (0.8)\n    .contentTransition(.numericText())\n    .animation(.spring(duration: 0.2), value: totalCaffeine)\n```\n\nTo use custom text animations, use [doc:\/\/com.apple.documentation\/documentation\/SwiftUI\/View\/contentTransition(_:)] as shown in the example above. To use the default text animation, use [doc:\/\/com.apple.documentation\/documentation\/SwiftUI\/View\/transition(_:)-2vjb8], and customize its speed and delay as shown in the following example:\n\n```swift\nText(\"Some text with \\(entry.value) that changes.\")\n    .animation(.default.speed(0.25).delay(0.5), value: entry.value)\n```\n\n### Add transitions and animations to additional views\n\nIn addition to adding transitions or animations to a view that changes its data, you can animate a view when other widget information changes. To animate a view when a certain value changes, first associate the view you want to animate with that value’s data model object. This is easiest when your data model conforms to the [doc:\/\/com.apple.documentation\/documentation\/Swift\/Hashable] protocol. If your data model doesn’t conform to `Hashable`, change its code accordingly. Then, associate the view with the data model using the [doc:\/\/com.apple.documentation\/documentation\/SwiftUI\/View\/id(_:)] view modifier. Finally, add a transition or animation.\n\nThe following example shows how the `LastDrinkView` adds a push transition when the associated `log` changes.\n\n```swift\nstruct LastDrinkView: View {\n    let log: CaffeineLog\n    var dateFormatStyle: Date.FormatStyle {\n        Date.FormatStyle(date: .omitted, time: .shortened)\n    }\n\n    var body: some View {\n        VStack(alignment: .leading) {\n            Text(log.drink.name)\n                .bold()\n            Text (\"\\(log.date, format: .dateformatStyle) • \\(log.drink.caffeine.formatCaffeine())\")\n        }\n        .font (.caption)\n        .id(log) \/\/ Associate the view with the data model.\n        .transition(.push(from: .bottom))\n    }\n}\n```\n\n### Disable animations\n\nIf a content update changes many views in your widget or Live Activity, consider disabling transitions and animations for some views to direct a person’s attention to the most important updates. To disable animations for a view, including default animations, pass [doc:\/\/com.apple.documentation\/documentation\/SwiftUI\/ContentTransition\/identity] to [doc:\/\/com.apple.documentation\/documentation\/SwiftUI\/View\/transition(_:)-5h5h0] or `nil` to the `animation` parameter of [doc:\/\/com.apple.documentation\/documentation\/SwiftUI\/withAnimation(_:_:)] and [doc:\/\/com.apple.documentation\/documentation\/SwiftUI\/View\/animation(_:value:)].\n\n\n\n## Interactivity\n\n- **Adding interactivity to widgets and Live Activities**: Include buttons or toggles in a widget or Live Activity to offer app functionality without launching the app.\n- **Linking to specific app scenes from your widget or Live Activity**: Add deep links to your widgets and Live Activities that enable people to open a specific scene in your app.\n\n",
  "sections" : [
    {
      "content" : "",
      "items" : [
        {
          "description" : "Include buttons or toggles in a widget or Live Activity to offer app functionality without launching the app.",
          "name" : "Adding interactivity to widgets and Live Activities",
          "url" : "https:\/\/developer.apple.com\/documentation\/WidgetKit\/Adding-interactivity-to-widgets-and-Live-Activities"
        },
        {
          "description" : "Add deep links to your widgets and Live Activities that enable people to open a specific scene in your app.",
          "name" : "Linking to specific app scenes from your widget or Live Activity",
          "url" : "https:\/\/developer.apple.com\/documentation\/WidgetKit\/Linking-to-specific-app-scenes-from-your-widget-or-Live-Activity"
        }
      ],
      "title" : "Interactivity"
    }
  ],
  "source" : "appleJSON",
  "title" : "Animating data updates in widgets and Live Activities",
  "url" : "https:\/\/developer.apple.com\/documentation\/WidgetKit\/Animating-data-updates-in-widgets-and-live-activities"
}