{
  "abstract" : "An object that contains a list of user-configured widgets and is used for reloading widget timelines.",
  "codeExamples" : [
    {
      "code" : "struct WidgetInfo {\n    public let configuration: INIntent?\n    public let family: WidgetFamily\n    public let kind: String\n}",
      "language" : "swift"
    },
    {
      "code" : "WidgetCenter.shared.reloadTimelines(ofKind: \"com.mygame.gamestatus\")",
      "language" : "swift"
    },
    {
      "code" : "WidgetCenter.shared.reloadAllTimelines()",
      "language" : "swift"
    }
  ],
  "contentHash" : "4ce2b3887989649c833c3d0ec990733a082b921e64103e4ef96b69d103d4374d",
  "crawledAt" : "2025-12-03T03:47:35Z",
  "declaration" : {
    "code" : "class WidgetCenter",
    "language" : "swift"
  },
  "id" : "F879A687-1ADE-483E-902C-634BB2806E34",
  "kind" : "class",
  "language" : "swift",
  "module" : "WidgetKit",
  "overview" : "## Overview\n\nWidgetCenter provides information about user-configured widgets, such as their family. For widgets that use [doc:\/\/com.apple.WidgetKit\/documentation\/WidgetKit\/IntentConfiguration], you can retrieve the user-edited values.\n\n### Getting Configured Widget Information\n\nTo get a list of user-configured widgets, use [doc:\/\/com.apple.WidgetKit\/documentation\/WidgetKit\/WidgetCenter\/getCurrentConfigurations(_:)]. This property provides an array of [doc:\/\/com.apple.WidgetKit\/documentation\/WidgetKit\/WidgetInfo] objects containing the following information:\n\nThe `kind` string matches the parameter you use when creating the widget’s [doc:\/\/com.apple.WidgetKit\/documentation\/WidgetKit\/StaticConfiguration] or [doc:\/\/com.apple.WidgetKit\/documentation\/WidgetKit\/IntentConfiguration]. The `family` property matches one of the options specified in the [doc:\/\/com.apple.documentation\/documentation\/SwiftUI\/WidgetConfiguration\/supportedFamilies(_:)] property of the widget’s configuration. If your widget is based on [doc:\/\/com.apple.WidgetKit\/documentation\/WidgetKit\/IntentConfiguration], the `configuration` property provides the custom intent containing the user-customized values for each individual widget.\n\n### Requesting a Reload of Your Widget’s Timeline\n\nChanges in your app’s state may affect a widget’s timeline. When this happens, you can tell WidgetKit to reload the timeline for either a specific kind of widget or all widgets. For example, your app might register for push notifications based on the widgets the user has configured. When your app receives a push notification that changes the state for one or more of your widgets, requesting a reload of their timelines updates their display.\n\nIf you only need to reload a certain kind of widget, you can request a reload for only that kind. For example, in response to a push notification about a change in a game’s status, you could request a reload for only the game status widgets:\n\nTo request a reload for all of your widgets:",
  "platforms" : [
    "iOS",
    "iPadOS",
    "Mac Catalyst",
    "macOS",
    "visionOS",
    "watchOS"
  ],
  "rawMarkdown" : "---\nsource: https:\/\/developer.apple.com\/documentation\/WidgetKit\/WidgetCenter\ncrawled: 2025-12-03T03:47:35Z\n---\n\n# WidgetCenter\n\n**Class**\n\nAn object that contains a list of user-configured widgets and is used for reloading widget timelines.\n\n## Declaration\n\n```swift\nclass WidgetCenter\n```\n\n## Overview\n\nWidgetCenter provides information about user-configured widgets, such as their family. For widgets that use [doc:\/\/com.apple.WidgetKit\/documentation\/WidgetKit\/IntentConfiguration], you can retrieve the user-edited values.\n\n### Getting Configured Widget Information\n\nTo get a list of user-configured widgets, use [doc:\/\/com.apple.WidgetKit\/documentation\/WidgetKit\/WidgetCenter\/getCurrentConfigurations(_:)]. This property provides an array of [doc:\/\/com.apple.WidgetKit\/documentation\/WidgetKit\/WidgetInfo] objects containing the following information:\n\n```swift\nstruct WidgetInfo {\n    public let configuration: INIntent?\n    public let family: WidgetFamily\n    public let kind: String\n}\n```\n\nThe `kind` string matches the parameter you use when creating the widget’s [doc:\/\/com.apple.WidgetKit\/documentation\/WidgetKit\/StaticConfiguration] or [doc:\/\/com.apple.WidgetKit\/documentation\/WidgetKit\/IntentConfiguration]. The `family` property matches one of the options specified in the [doc:\/\/com.apple.documentation\/documentation\/SwiftUI\/WidgetConfiguration\/supportedFamilies(_:)] property of the widget’s configuration. If your widget is based on [doc:\/\/com.apple.WidgetKit\/documentation\/WidgetKit\/IntentConfiguration], the `configuration` property provides the custom intent containing the user-customized values for each individual widget.\n\n### Requesting a Reload of Your Widget’s Timeline\n\nChanges in your app’s state may affect a widget’s timeline. When this happens, you can tell WidgetKit to reload the timeline for either a specific kind of widget or all widgets. For example, your app might register for push notifications based on the widgets the user has configured. When your app receives a push notification that changes the state for one or more of your widgets, requesting a reload of their timelines updates their display.\n\nIf you only need to reload a certain kind of widget, you can request a reload for only that kind. For example, in response to a push notification about a change in a game’s status, you could request a reload for only the game status widgets:\n\n```swift\nWidgetCenter.shared.reloadTimelines(ofKind: \"com.mygame.gamestatus\")\n```\n\nTo request a reload for all of your widgets:\n\n```swift\nWidgetCenter.shared.reloadAllTimelines()\n```\n\n## Getting Widget Information\n\n- **shared**: The shared widget center.\n- **getCurrentConfigurations(_:)**: Retrieves information about user-configured widgets.\n- **WidgetCenter.UserInfoKey**: An object that defines keys for accessing information in a user info dictionary.\n\n## Reloading Widget Timelines\n\n- **reloadTimelines(ofKind:)**: Reloads the timelines for all widgets of a particular kind.\n- **reloadAllTimelines()**: Reloads the timelines for all configured widgets belonging to the containing app.\n\n## Reloading Recommended Preconfigured Widgets\n\n- **invalidateConfigurationRecommendations()**: Invalidates and refreshes the preconfigured intent configurations for user-customizable widgets.\n\n## Instance Properties\n\n- **currentPushInfo**: Provides the current push information for widget reloads and relevance refreshes.\n\n## Instance Methods\n\n- **currentConfigurations()**: Retrieves information about user-configured widgets.\n- **invalidateRelevance(ofKind:)**: Mark the relevance for a kind as invalid.\n\n## Timeline updates\n\n- **Keeping a widget up to date**: Plan your widget’s timeline to show timely, relevant information using dynamic views, and update the timeline when things change.\n- **TimelineProvider**: A type that advises WidgetKit when to update a widget’s display.\n- **AppIntentTimelineProvider**: A type that advises WidgetKit when to update a user-configurable widget’s display.\n- **IntentTimelineProvider**: A type that advises WidgetKit when to update a user-configurable widget’s display.\n- **TimelineProviderContext**: An object that contains details about how a widget is rendered, including its size and whether it appears in the widget gallery.\n- **TimelineEntry**: A type that specifies the date to display a widget, and, optionally, indicates the current relevance of the widget’s content.\n- **Timeline**: An object that specifies a date for WidgetKit to update a widget’s view.\n\n",
  "sections" : [
    {
      "content" : "",
      "items" : [
        {
          "description" : "The shared widget center.",
          "name" : "shared",
          "url" : "https:\/\/developer.apple.com\/documentation\/WidgetKit\/WidgetCenter\/shared"
        },
        {
          "description" : "Retrieves information about user-configured widgets.",
          "name" : "getCurrentConfigurations(_:)",
          "url" : "https:\/\/developer.apple.com\/documentation\/WidgetKit\/WidgetCenter\/getCurrentConfigurations(_:)"
        },
        {
          "description" : "An object that defines keys for accessing information in a user info dictionary.",
          "name" : "WidgetCenter.UserInfoKey",
          "url" : "https:\/\/developer.apple.com\/documentation\/WidgetKit\/WidgetCenter\/UserInfoKey"
        }
      ],
      "title" : "Getting Widget Information"
    },
    {
      "content" : "",
      "items" : [
        {
          "description" : "Reloads the timelines for all widgets of a particular kind.",
          "name" : "reloadTimelines(ofKind:)",
          "url" : "https:\/\/developer.apple.com\/documentation\/WidgetKit\/WidgetCenter\/reloadTimelines(ofKind:)"
        },
        {
          "description" : "Reloads the timelines for all configured widgets belonging to the containing app.",
          "name" : "reloadAllTimelines()",
          "url" : "https:\/\/developer.apple.com\/documentation\/WidgetKit\/WidgetCenter\/reloadAllTimelines()"
        }
      ],
      "title" : "Reloading Widget Timelines"
    },
    {
      "content" : "",
      "items" : [
        {
          "description" : "Invalidates and refreshes the preconfigured intent configurations for user-customizable widgets.",
          "name" : "invalidateConfigurationRecommendations()",
          "url" : "https:\/\/developer.apple.com\/documentation\/WidgetKit\/WidgetCenter\/invalidateConfigurationRecommendations()"
        }
      ],
      "title" : "Reloading Recommended Preconfigured Widgets"
    },
    {
      "content" : "",
      "items" : [
        {
          "description" : "Provides the current push information for widget reloads and relevance refreshes.",
          "name" : "currentPushInfo",
          "url" : "https:\/\/developer.apple.com\/documentation\/WidgetKit\/WidgetCenter\/currentPushInfo"
        }
      ],
      "title" : "Instance Properties"
    },
    {
      "content" : "",
      "items" : [
        {
          "description" : "Retrieves information about user-configured widgets.",
          "name" : "currentConfigurations()",
          "url" : "https:\/\/developer.apple.com\/documentation\/WidgetKit\/WidgetCenter\/currentConfigurations()"
        },
        {
          "description" : "Mark the relevance for a kind as invalid.",
          "name" : "invalidateRelevance(ofKind:)",
          "url" : "https:\/\/developer.apple.com\/documentation\/WidgetKit\/WidgetCenter\/invalidateRelevance(ofKind:)"
        }
      ],
      "title" : "Instance Methods"
    },
    {
      "content" : "",
      "items" : [
        {
          "description" : "Plan your widget’s timeline to show timely, relevant information using dynamic views, and update the timeline when things change.",
          "name" : "Keeping a widget up to date",
          "url" : "https:\/\/developer.apple.com\/documentation\/WidgetKit\/Keeping-a-Widget-Up-To-Date"
        },
        {
          "description" : "A type that advises WidgetKit when to update a widget’s display.",
          "name" : "TimelineProvider",
          "url" : "https:\/\/developer.apple.com\/documentation\/WidgetKit\/TimelineProvider"
        },
        {
          "description" : "A type that advises WidgetKit when to update a user-configurable widget’s display.",
          "name" : "AppIntentTimelineProvider",
          "url" : "https:\/\/developer.apple.com\/documentation\/WidgetKit\/AppIntentTimelineProvider"
        },
        {
          "description" : "A type that advises WidgetKit when to update a user-configurable widget’s display.",
          "name" : "IntentTimelineProvider",
          "url" : "https:\/\/developer.apple.com\/documentation\/WidgetKit\/IntentTimelineProvider"
        },
        {
          "description" : "An object that contains details about how a widget is rendered, including its size and whether it appears in the widget gallery.",
          "name" : "TimelineProviderContext",
          "url" : "https:\/\/developer.apple.com\/documentation\/WidgetKit\/TimelineProviderContext"
        },
        {
          "description" : "A type that specifies the date to display a widget, and, optionally, indicates the current relevance of the widget’s content.",
          "name" : "TimelineEntry",
          "url" : "https:\/\/developer.apple.com\/documentation\/WidgetKit\/TimelineEntry"
        },
        {
          "description" : "An object that specifies a date for WidgetKit to update a widget’s view.",
          "name" : "Timeline",
          "url" : "https:\/\/developer.apple.com\/documentation\/WidgetKit\/Timeline"
        }
      ],
      "title" : "Timeline updates"
    }
  ],
  "source" : "appleJSON",
  "title" : "WidgetCenter",
  "url" : "https:\/\/developer.apple.com\/documentation\/WidgetKit\/WidgetCenter"
}