{
  "abstract" : "An object describing the content of a widget that uses a custom intent to provide user-configurable options.",
  "codeExamples" : [
    {
      "code" : "struct CharacterDetailWidget: Widget {\n    var body: some WidgetConfiguration {\n        AppIntentConfiguration(\n            kind: \"com.mygame.character-detail\",\n            intent: SelectCharacterIntent.self,\n            provider: CharacterDetailProvider(),\n        ) { entry in\n            CharacterDetailView(entry: entry)\n        }\n        .supportedFamilies([.systemSmall, .systemMedium, .systemLarge])\n    }\n}",
      "language" : "swift"
    }
  ],
  "conformsTo" : [
    "Sendable",
    "SendableMetatype",
    "WidgetConfiguration"
  ],
  "contentHash" : "096de7ad4277eb593d3da7d8a55c935c21ce564d304ca35d5442acc7670c451d",
  "crawledAt" : "2025-12-03T03:47:29Z",
  "declaration" : {
    "code" : "@MainActor @preconcurrency struct AppIntentConfiguration<Intent, Content> where Intent : WidgetConfigurationIntent, Content : View",
    "language" : "swift"
  },
  "id" : "DAEC06F4-AEE3-4965-9F3F-6C125BAFD5FB",
  "kind" : "struct",
  "language" : "swift",
  "module" : "WidgetKit",
  "overview" : "## Overview\n\nThe following example shows the configuration for a game widget that displays details about a chosen character.\n\nEvery widget has a unique `kind`, a string that you choose. You use this string to identify your widget when reloading its timeline with [doc:\/\/com.apple.WidgetKit\/documentation\/WidgetKit\/WidgetCenter].\n\nThe `intent` is a custom App Intent containing user-editable parameters.\n\nThe timeline provider is an object that determines the timeline for refreshing your widget. Providing future dates for updating your widget allows the system to optimize the refresh process.\n\nThe content closure contains the SwiftUI views that WidgetKit needs to render the widget. When WidgetKit invokes the content closure, it passes a timeline entry created by the widget provider’s [doc:\/\/com.apple.WidgetKit\/documentation\/WidgetKit\/AppIntentTimelineProvider\/snapshot(for:in:)] or [doc:\/\/com.apple.WidgetKit\/documentation\/WidgetKit\/AppIntentTimelineProvider\/timeline(for:in:)] method.\n\nModifiers let you specify the families your widget supports, and the details shown when users add or edit their widgets.",
  "platforms" : [
    "iOS",
    "iPadOS",
    "Mac Catalyst",
    "macOS",
    "visionOS",
    "watchOS"
  ],
  "rawMarkdown" : "---\nsource: https:\/\/developer.apple.com\/documentation\/WidgetKit\/AppIntentConfiguration\ncrawled: 2025-12-03T03:47:29Z\n---\n\n# AppIntentConfiguration\n\n**Structure**\n\nAn object describing the content of a widget that uses a custom intent to provide user-configurable options.\n\n## Declaration\n\n```swift\n@MainActor @preconcurrency struct AppIntentConfiguration<Intent, Content> where Intent : WidgetConfigurationIntent, Content : View\n```\n\n## Overview\n\nThe following example shows the configuration for a game widget that displays details about a chosen character.\n\n```swift\nstruct CharacterDetailWidget: Widget {\n    var body: some WidgetConfiguration {\n        AppIntentConfiguration(\n            kind: \"com.mygame.character-detail\",\n            intent: SelectCharacterIntent.self,\n            provider: CharacterDetailProvider(),\n        ) { entry in\n            CharacterDetailView(entry: entry)\n        }\n        .supportedFamilies([.systemSmall, .systemMedium, .systemLarge])\n    }\n}\n```\n\nEvery widget has a unique `kind`, a string that you choose. You use this string to identify your widget when reloading its timeline with [doc:\/\/com.apple.WidgetKit\/documentation\/WidgetKit\/WidgetCenter].\n\nThe `intent` is a custom App Intent containing user-editable parameters.\n\nThe timeline provider is an object that determines the timeline for refreshing your widget. Providing future dates for updating your widget allows the system to optimize the refresh process.\n\nThe content closure contains the SwiftUI views that WidgetKit needs to render the widget. When WidgetKit invokes the content closure, it passes a timeline entry created by the widget provider’s [doc:\/\/com.apple.WidgetKit\/documentation\/WidgetKit\/AppIntentTimelineProvider\/snapshot(for:in:)] or [doc:\/\/com.apple.WidgetKit\/documentation\/WidgetKit\/AppIntentTimelineProvider\/timeline(for:in:)] method.\n\nModifiers let you specify the families your widget supports, and the details shown when users add or edit their widgets.\n\n## Creating a widget configuration\n\n- **init(kind:intent:provider:content:)**: Creates a configuration for a widget by using a custom intent to provide user-configurable options.\n- **body**: The content and behavior of this widget.\n\n## Setting the display name\n\n- **configurationDisplayName(_:)**: Sets the name shown for a widget when a user adds or edits it using the specified string.\n- **configurationDisplayName(_:)**: Sets the name shown for a widget when a user adds or edits it using the contents of a text view.\n- **configurationDisplayName(_:)**: Sets the localized name shown for a widget when a user adds or edits the widget.\n\n## Setting the description\n\n- **description(_:)**: Sets the description shown for a widget when a user adds or edits it using the contents of a text view.\n- **description(_:)**: Sets the description shown for a widget when a user adds or edits it using the specified string.\n- **description(_:)**: Sets the localized description shown for a widget when a user adds or edits the widget.\n\n## Setting the supported families\n\n- **supportedFamilies(_:)**: Sets the sizes that a widget supports.\n\n## Handling background network requests\n\n- **backgroundTask(_:action:)**: Runs the given action when the system provides a background task.\n- **onBackgroundURLSessionEvents(matching:_:)**: Adds an action to perform when events related to a URL session identified by a closure are waiting to be processed.\n- **onBackgroundURLSessionEvents(matching:_:)**: Adds an action to perform when events related to a URL session with a matching identifier are waiting to be processed.\n\n## Configurable widgets\n\n- **Making a configurable widget**: Give people the option to customize their widgets by adding a custom app intent to your project.\n- **Migrating widgets from SiriKit Intents to App Intents**: Configure your widgets for backward compatibility.\n- **WidgetInfo**: A structure that contains information about user-configured widgets.\n\n## Conforms To\n\n- Sendable\n- SendableMetatype\n- WidgetConfiguration\n\n",
  "sections" : [
    {
      "content" : "",
      "items" : [
        {
          "description" : "Creates a configuration for a widget by using a custom intent to provide user-configurable options.",
          "name" : "init(kind:intent:provider:content:)",
          "url" : "https:\/\/developer.apple.com\/documentation\/WidgetKit\/AppIntentConfiguration\/init(kind:intent:provider:content:)"
        },
        {
          "description" : "The content and behavior of this widget.",
          "name" : "body",
          "url" : "https:\/\/developer.apple.com\/documentation\/SwiftUI\/WidgetConfiguration\/body-swift.property"
        }
      ],
      "title" : "Creating a widget configuration"
    },
    {
      "content" : "",
      "items" : [
        {
          "description" : "Sets the name shown for a widget when a user adds or edits it using the specified string.",
          "name" : "configurationDisplayName(_:)",
          "url" : "https:\/\/developer.apple.com\/documentation\/SwiftUI\/WidgetConfiguration\/configurationDisplayName(_:)-2c3zv"
        },
        {
          "description" : "Sets the name shown for a widget when a user adds or edits it using the contents of a text view.",
          "name" : "configurationDisplayName(_:)",
          "url" : "https:\/\/developer.apple.com\/documentation\/SwiftUI\/WidgetConfiguration\/configurationDisplayName(_:)-3sbn4"
        },
        {
          "description" : "Sets the localized name shown for a widget when a user adds or edits the widget.",
          "name" : "configurationDisplayName(_:)",
          "url" : "https:\/\/developer.apple.com\/documentation\/SwiftUI\/WidgetConfiguration\/configurationDisplayName(_:)-4v9q"
        }
      ],
      "title" : "Setting the display name"
    },
    {
      "content" : "",
      "items" : [
        {
          "description" : "Sets the description shown for a widget when a user adds or edits it using the contents of a text view.",
          "name" : "description(_:)",
          "url" : "https:\/\/developer.apple.com\/documentation\/SwiftUI\/WidgetConfiguration\/description(_:)-1bvuj"
        },
        {
          "description" : "Sets the description shown for a widget when a user adds or edits it using the specified string.",
          "name" : "description(_:)",
          "url" : "https:\/\/developer.apple.com\/documentation\/SwiftUI\/WidgetConfiguration\/description(_:)-2bfr"
        },
        {
          "description" : "Sets the localized description shown for a widget when a user adds or edits the widget.",
          "name" : "description(_:)",
          "url" : "https:\/\/developer.apple.com\/documentation\/SwiftUI\/WidgetConfiguration\/description(_:)-4q9pa"
        }
      ],
      "title" : "Setting the description"
    },
    {
      "content" : "",
      "items" : [
        {
          "description" : "Sets the sizes that a widget supports.",
          "name" : "supportedFamilies(_:)",
          "url" : "https:\/\/developer.apple.com\/documentation\/SwiftUI\/WidgetConfiguration\/supportedFamilies(_:)"
        }
      ],
      "title" : "Setting the supported families"
    },
    {
      "content" : "",
      "items" : [
        {
          "description" : "Runs the given action when the system provides a background task.",
          "name" : "backgroundTask(_:action:)",
          "url" : "https:\/\/developer.apple.com\/documentation\/SwiftUI\/WidgetConfiguration\/backgroundTask(_:action:)"
        },
        {
          "description" : "Adds an action to perform when events related to a URL session identified by a closure are waiting to be processed.",
          "name" : "onBackgroundURLSessionEvents(matching:_:)",
          "url" : "https:\/\/developer.apple.com\/documentation\/SwiftUI\/WidgetConfiguration\/onBackgroundURLSessionEvents(matching:_:)-2e152"
        },
        {
          "description" : "Adds an action to perform when events related to a URL session with a matching identifier are waiting to be processed.",
          "name" : "onBackgroundURLSessionEvents(matching:_:)",
          "url" : "https:\/\/developer.apple.com\/documentation\/SwiftUI\/WidgetConfiguration\/onBackgroundURLSessionEvents(matching:_:)-fw6x"
        }
      ],
      "title" : "Handling background network requests"
    },
    {
      "content" : "",
      "items" : [
        {
          "description" : "Give people the option to customize their widgets by adding a custom app intent to your project.",
          "name" : "Making a configurable widget",
          "url" : "https:\/\/developer.apple.com\/documentation\/WidgetKit\/Making-a-Configurable-Widget"
        },
        {
          "description" : "Configure your widgets for backward compatibility.",
          "name" : "Migrating widgets from SiriKit Intents to App Intents",
          "url" : "https:\/\/developer.apple.com\/documentation\/WidgetKit\/Migrating-from-SiriKit-Intents-to-App-Intents"
        },
        {
          "description" : "A structure that contains information about user-configured widgets.",
          "name" : "WidgetInfo",
          "url" : "https:\/\/developer.apple.com\/documentation\/WidgetKit\/WidgetInfo"
        }
      ],
      "title" : "Configurable widgets"
    }
  ],
  "source" : "appleJSON",
  "title" : "AppIntentConfiguration",
  "url" : "https:\/\/developer.apple.com\/documentation\/WidgetKit\/AppIntentConfiguration"
}