{
  "abstract" : "Checks whether a renewal date extension request completed, and provides the final count of successful or failed extensions.",
  "codeExamples" : [

  ],
  "contentHash" : "68df986ef995a818930cc45fb241443950532f19b5202d6fd813e5f113fd4411",
  "crawledAt" : "2025-12-01T09:12:12Z",
  "id" : "93D24689-58F7-4934-B7F8-1397964FA661",
  "kind" : "unknown",
  "module" : "App Store Server API",
  "overview" : "## Discussion\n\nThis endpoint provides basic status information about a request you initiate when you call the [doc:\/\/com.apple.appstoreserverapi\/documentation\/AppStoreServerAPI\/Extend-Subscription-Renewal-Dates-for-All-Active-Subscribers] endpoint. Such requests may take hours, or even days, depending on the number of subscribers. This status tells whether the request is complete. If so, it has the total count of successful and failed subscription-renewal-date extensions.",
  "rawMarkdown" : "---\nsource: https:\/\/developer.apple.com\/documentation\/AppStoreServerAPI\/Get-Status-of-Subscription-Renewal-Date-Extensions\ncrawled: 2025-12-01T09:12:12Z\n---\n\n# Get Status of Subscription Renewal Date Extensions\n\n**Web Service Endpoint**\n\nChecks whether a renewal date extension request completed, and provides the final count of successful or failed extensions.\n\n## Discussion\n\nThis endpoint provides basic status information about a request you initiate when you call the [doc:\/\/com.apple.appstoreserverapi\/documentation\/AppStoreServerAPI\/Extend-Subscription-Renewal-Dates-for-All-Active-Subscribers] endpoint. Such requests may take hours, or even days, depending on the number of subscribers. This status tells whether the request is complete. If so, it has the total count of successful and failed subscription-renewal-date extensions.\n\n\n\n## Subscription-renewal-date extension\n\n- **Extending the renewal date for auto-renewable subscriptions**: Compensate eligible active subscribers for service interruptions by extending a subscription’s renewal date.\n- **Extend a Subscription Renewal Date**: Extends the renewal date of a customer’s active subscription using the original transaction identifier.\n- **Extend Subscription Renewal Dates for All Active Subscribers**: Uses a subscription’s product identifier to extend the renewal date for all of its eligible active subscribers.\n- **ExtendRenewalDateRequest**: The request body that contains subscription-renewal-extension data for an individual subscription.\n- **ExtendRenewalDateResponse**: A response that indicates whether an individual renewal-date extension succeeded, and related details.\n- **MassExtendRenewalDateRequest**: The request body that contains subscription-renewal-extension data to apply for all eligible active subscribers.\n- **MassExtendRenewalDateResponse**: A response that indicates the server successfully received the subscription-renewal-date extension request.\n- **MassExtendRenewalDateStatusResponse**: A response that indicates the current status of a request to extend the subscription renewal date to all eligible subscribers.\n\n",
  "sections" : [
    {
      "content" : "",
      "items" : [
        {
          "description" : "Compensate eligible active subscribers for service interruptions by extending a subscription’s renewal date.",
          "name" : "Extending the renewal date for auto-renewable subscriptions",
          "url" : "https:\/\/developer.apple.com\/documentation\/AppStoreServerAPI\/extending-the-renewal-date-for-auto-renewable-subscriptions"
        },
        {
          "description" : "Extends the renewal date of a customer’s active subscription using the original transaction identifier.",
          "name" : "Extend a Subscription Renewal Date",
          "url" : "https:\/\/developer.apple.com\/documentation\/AppStoreServerAPI\/Extend-a-Subscription-Renewal-Date"
        },
        {
          "description" : "Uses a subscription’s product identifier to extend the renewal date for all of its eligible active subscribers.",
          "name" : "Extend Subscription Renewal Dates for All Active Subscribers",
          "url" : "https:\/\/developer.apple.com\/documentation\/AppStoreServerAPI\/Extend-Subscription-Renewal-Dates-for-All-Active-Subscribers"
        },
        {
          "description" : "The request body that contains subscription-renewal-extension data for an individual subscription.",
          "name" : "ExtendRenewalDateRequest",
          "url" : "https:\/\/developer.apple.com\/documentation\/AppStoreServerAPI\/ExtendRenewalDateRequest"
        },
        {
          "description" : "A response that indicates whether an individual renewal-date extension succeeded, and related details.",
          "name" : "ExtendRenewalDateResponse",
          "url" : "https:\/\/developer.apple.com\/documentation\/AppStoreServerAPI\/ExtendRenewalDateResponse"
        },
        {
          "description" : "The request body that contains subscription-renewal-extension data to apply for all eligible active subscribers.",
          "name" : "MassExtendRenewalDateRequest",
          "url" : "https:\/\/developer.apple.com\/documentation\/AppStoreServerAPI\/MassExtendRenewalDateRequest"
        },
        {
          "description" : "A response that indicates the server successfully received the subscription-renewal-date extension request.",
          "name" : "MassExtendRenewalDateResponse",
          "url" : "https:\/\/developer.apple.com\/documentation\/AppStoreServerAPI\/MassExtendRenewalDateResponse"
        },
        {
          "description" : "A response that indicates the current status of a request to extend the subscription renewal date to all eligible subscribers.",
          "name" : "MassExtendRenewalDateStatusResponse",
          "url" : "https:\/\/developer.apple.com\/documentation\/AppStoreServerAPI\/MassExtendRenewalDateStatusResponse"
        }
      ],
      "title" : "Subscription-renewal-date extension"
    }
  ],
  "source" : "appleJSON",
  "title" : "Get Status of Subscription Renewal Date Extensions",
  "url" : "https:\/\/developer.apple.com\/documentation\/AppStoreServerAPI\/Get-Status-of-Subscription-Renewal-Date-Extensions"
}