{
  "abstract" : "The app version that the customer originally purchased from the App Store.",
  "codeExamples" : [

  ],
  "contentHash" : "aa42907e5b60dc2ae5593ca1783f6a49c411df18b94844b56b49ba85128580a8",
  "crawledAt" : "2025-12-02T06:34:05Z",
  "declaration" : {
    "code" : "string originalApplicationVersion",
    "language" : "swift"
  },
  "id" : "CDCCA87E-FCEB-4A75-A9FA-61F329C621F7",
  "kind" : "unknown",
  "module" : "App Store Server API",
  "overview" : "## Discussion\n\nUse this value to determine which app version the customer first purchased or downloaded. This value remains constant and doesn’t change when the customer upgrades the app.\n\nThe string value contains the original value of the [doc:\/\/com.apple.documentation\/documentation\/BundleResources\/Information-Property-List\/CFBundleShortVersionString] for apps running in macOS, and the original value of the [doc:\/\/com.apple.documentation\/documentation\/BundleResources\/Information-Property-List\/CFBundleVersion] for apps running on all other platforms.\n\nIn the sandbox testing environment, the `originalApplicationVersion` value is always 1.0.",
  "platforms" : [
    "Unsupported OS: App Store Server API"
  ],
  "rawMarkdown" : "---\nsource: https:\/\/developer.apple.com\/documentation\/AppStoreServerAPI\/originalApplicationVersion\ncrawled: 2025-12-02T06:34:05Z\n---\n\n# originalApplicationVersion\n\n**Type**\n\nThe app version that the customer originally purchased from the App Store.\n\n## Declaration\n\n```swift\nstring originalApplicationVersion\n```\n\n## Discussion\n\nUse this value to determine which app version the customer first purchased or downloaded. This value remains constant and doesn’t change when the customer upgrades the app.\n\nThe string value contains the original value of the [doc:\/\/com.apple.documentation\/documentation\/BundleResources\/Information-Property-List\/CFBundleShortVersionString] for apps running in macOS, and the original value of the [doc:\/\/com.apple.documentation\/documentation\/BundleResources\/Information-Property-List\/CFBundleVersion] for apps running on all other platforms.\n\nIn the sandbox testing environment, the `originalApplicationVersion` value is always 1.0.\n\n## App information\n\n- **appAppleId**: The unique identifier of an app in the App Store.\n- **bundleId**: The bundle identifier of an app.\n- **originalPlatform**: The platform on which a customer originally purchases an app.\n- **preorderDate**: The date a customer places an order for the app before it’s available in the App Store, expressed in UNIX time, in milliseconds.\n\n",
  "sections" : [
    {
      "content" : "",
      "items" : [
        {
          "description" : "The unique identifier of an app in the App Store.",
          "name" : "appAppleId",
          "url" : "https:\/\/developer.apple.com\/documentation\/AppStoreServerAPI\/appAppleId"
        },
        {
          "description" : "The bundle identifier of an app.",
          "name" : "bundleId",
          "url" : "https:\/\/developer.apple.com\/documentation\/AppStoreServerAPI\/bundleId"
        },
        {
          "description" : "The platform on which a customer originally purchases an app.",
          "name" : "originalPlatform",
          "url" : "https:\/\/developer.apple.com\/documentation\/AppStoreServerAPI\/originalPlatform"
        },
        {
          "description" : "The date a customer places an order for the app before it’s available in the App Store, expressed in UNIX time, in milliseconds.",
          "name" : "preorderDate",
          "url" : "https:\/\/developer.apple.com\/documentation\/AppStoreServerAPI\/preorderDate"
        }
      ],
      "title" : "App information"
    }
  ],
  "source" : "appleJSON",
  "title" : "originalApplicationVersion",
  "url" : "https:\/\/developer.apple.com\/documentation\/AppStoreServerAPI\/originalApplicationVersion"
}