{
  "abstract" : "An error that indicates the transaction identifier represents an unsupported In-App Purchase type.",
  "codeExamples" : [

  ],
  "contentHash" : "48cc0bbd265531cb8fafaff386e6f911867843f5dc83580b266a0569e2bc304a",
  "crawledAt" : "2025-12-04T01:33:02Z",
  "declaration" : {
    "code" : "object InvalidTransactionTypeNotSupportedError",
    "language" : "swift"
  },
  "id" : "4E4E7DE8-848E-45CC-B79F-A34B88B8F740",
  "kind" : "unknown",
  "language" : "data",
  "module" : "App Store Server API",
  "overview" : "## Discussion\n\nThe [doc:\/\/com.apple.appstoreserverapi\/documentation\/AppStoreServerAPI\/Send-Consumption-Information] endpoint returns this error if the `transactionId` doesn’t represent a supported in-app purchase. Be sure to provide the same `transactionId` that you receive to your [doc:\/\/com.apple.documentation\/documentation\/AppStoreServerNotifications\/App-Store-Server-Notifications-V2] endpoint in a notification with a `CONSUMPTION_REQUEST` [doc:\/\/com.apple.documentation\/documentation\/AppStoreServerNotifications\/notificationType].",
  "platforms" : [
    "Unsupported OS: App Store Server API"
  ],
  "rawMarkdown" : "---\nsource: https:\/\/developer.apple.com\/documentation\/AppStoreServerAPI\/InvalidTransactionTypeNotSupportedError\ncrawled: 2025-12-04T01:33:02Z\n---\n\n# InvalidTransactionTypeNotSupportedError\n\n**Object**\n\nAn error that indicates the transaction identifier represents an unsupported In-App Purchase type.\n\n## Declaration\n\n```swift\nobject InvalidTransactionTypeNotSupportedError\n```\n\n## Discussion\n\nThe [doc:\/\/com.apple.appstoreserverapi\/documentation\/AppStoreServerAPI\/Send-Consumption-Information] endpoint returns this error if the `transactionId` doesn’t represent a supported in-app purchase. Be sure to provide the same `transactionId` that you receive to your [doc:\/\/com.apple.documentation\/documentation\/AppStoreServerNotifications\/App-Store-Server-Notifications-V2] endpoint in a notification with a `CONSUMPTION_REQUEST` [doc:\/\/com.apple.documentation\/documentation\/AppStoreServerNotifications\/notificationType].\n\n## Consumption request errors\n\n- **InvalidAccountTenureError**: An error that indicates the value of the account tenure field is invalid.\n- **InvalidAppAccountTokenError**: An error that indicates the value of the app account token field is invalid.\n- **InvalidConsumptionStatusError**: An error that indicates the value of the consumption status field is invalid.\n- **InvalidCustomerConsentedError**: An error that indicates the customer consented field is invalid or doesn’t indicate that the customer consented.\n- **InvalidDeliveryStatusError**: An error that indicates the value in the delivery status field is invalid.\n- **InvalidLifetimeDollarsPurchasedError**: An error that indicates the value in the lifetime dollars purchased field is invalid.\n- **InvalidLifetimeDollarsRefundedError**: An error that indicates the value in the lifetime dollars refunded field is invalid.\n- **InvalidPlatformError**: An error that indicates the value in the platform field is invalid.\n- **InvalidPlayTimeError**: An error that indicates the value in the playtime field is invalid.\n- **InvalidSampleContentProvidedError**: An error that indicates the value in the sample content provided field is invalid.\n- **InvalidUserStatusError**: An error that indicates the value in the user status field is invalid.\n- **InvalidTransactionNotConsumableError**: An error that indicates the transaction identifier doesn’t represent a consumable In-App Purchase.\n\n",
  "sections" : [
    {
      "content" : "",
      "items" : [
        {
          "description" : "An error that indicates the value of the account tenure field is invalid.",
          "name" : "InvalidAccountTenureError",
          "url" : "https:\/\/developer.apple.com\/documentation\/AppStoreServerAPI\/InvalidAccountTenureError"
        },
        {
          "description" : "An error that indicates the value of the app account token field is invalid.",
          "name" : "InvalidAppAccountTokenError",
          "url" : "https:\/\/developer.apple.com\/documentation\/AppStoreServerAPI\/InvalidAppAccountTokenError"
        },
        {
          "description" : "An error that indicates the value of the consumption status field is invalid.",
          "name" : "InvalidConsumptionStatusError",
          "url" : "https:\/\/developer.apple.com\/documentation\/AppStoreServerAPI\/InvalidConsumptionStatusError"
        },
        {
          "description" : "An error that indicates the customer consented field is invalid or doesn’t indicate that the customer consented.",
          "name" : "InvalidCustomerConsentedError",
          "url" : "https:\/\/developer.apple.com\/documentation\/AppStoreServerAPI\/InvalidCustomerConsentedError"
        },
        {
          "description" : "An error that indicates the value in the delivery status field is invalid.",
          "name" : "InvalidDeliveryStatusError",
          "url" : "https:\/\/developer.apple.com\/documentation\/AppStoreServerAPI\/InvalidDeliveryStatusError"
        },
        {
          "description" : "An error that indicates the value in the lifetime dollars purchased field is invalid.",
          "name" : "InvalidLifetimeDollarsPurchasedError",
          "url" : "https:\/\/developer.apple.com\/documentation\/AppStoreServerAPI\/InvalidLifetimeDollarsPurchasedError"
        },
        {
          "description" : "An error that indicates the value in the lifetime dollars refunded field is invalid.",
          "name" : "InvalidLifetimeDollarsRefundedError",
          "url" : "https:\/\/developer.apple.com\/documentation\/AppStoreServerAPI\/InvalidLifetimeDollarsRefundedError"
        },
        {
          "description" : "An error that indicates the value in the platform field is invalid.",
          "name" : "InvalidPlatformError",
          "url" : "https:\/\/developer.apple.com\/documentation\/AppStoreServerAPI\/InvalidPlatformError"
        },
        {
          "description" : "An error that indicates the value in the playtime field is invalid.",
          "name" : "InvalidPlayTimeError",
          "url" : "https:\/\/developer.apple.com\/documentation\/AppStoreServerAPI\/InvalidPlayTimeError"
        },
        {
          "description" : "An error that indicates the value in the sample content provided field is invalid.",
          "name" : "InvalidSampleContentProvidedError",
          "url" : "https:\/\/developer.apple.com\/documentation\/AppStoreServerAPI\/InvalidSampleContentProvidedError"
        },
        {
          "description" : "An error that indicates the value in the user status field is invalid.",
          "name" : "InvalidUserStatusError",
          "url" : "https:\/\/developer.apple.com\/documentation\/AppStoreServerAPI\/InvalidUserStatusError"
        },
        {
          "description" : "An error that indicates the transaction identifier doesn’t represent a consumable In-App Purchase.",
          "name" : "InvalidTransactionNotConsumableError",
          "url" : "https:\/\/developer.apple.com\/documentation\/AppStoreServerAPI\/InvalidTransactionNotConsumableError"
        }
      ],
      "title" : "Consumption request errors"
    }
  ],
  "source" : "appleJSON",
  "title" : "InvalidTransactionTypeNotSupportedError",
  "url" : "https:\/\/developer.apple.com\/documentation\/AppStoreServerAPI\/InvalidTransactionTypeNotSupportedError"
}