{
  "abstract" : "The payment mode for a discount offer on an In-App Purchase.",
  "codeExamples" : [

  ],
  "contentHash" : "f74ab488a3f9eb93962a56ae7116fdcbb0c39c91e0d65324e983645b7e4e9d58",
  "crawledAt" : "2025-12-02T06:34:17Z",
  "declaration" : {
    "code" : "string offerDiscountType",
    "language" : "swift"
  },
  "id" : "1F1A92C9-DA95-46F5-BED6-17BC399D4897",
  "kind" : "unknown",
  "module" : "App Store Server API",
  "overview" : "## Discussion\n\nYou set up subscription offers and determine the payment mode when you configure subscriptions in App Store Connect. For more information about the free trial, pay as you go, and pay up front payment modes, see [https:\/\/developer.apple.com\/help\/app-store-connect\/reference\/pricing-and-availability].\n\nFor more information on subscription offers, see [https:\/\/developer.apple.com\/app-store\/subscriptions\/#providing-subscription-offers].",
  "platforms" : [
    "Unsupported OS: App Store Server API"
  ],
  "rawMarkdown" : "---\nsource: https:\/\/developer.apple.com\/documentation\/AppStoreServerAPI\/offerDiscountType\ncrawled: 2025-12-02T06:34:17Z\n---\n\n# offerDiscountType\n\n**Type**\n\nThe payment mode for a discount offer on an In-App Purchase.\n\n## Declaration\n\n```swift\nstring offerDiscountType\n```\n\n## Discussion\n\nYou set up subscription offers and determine the payment mode when you configure subscriptions in App Store Connect. For more information about the free trial, pay as you go, and pay up front payment modes, see [https:\/\/developer.apple.com\/help\/app-store-connect\/reference\/pricing-and-availability].\n\nFor more information on subscription offers, see [https:\/\/developer.apple.com\/app-store\/subscriptions\/#providing-subscription-offers].\n\n## Offers\n\n- **eligibleWinBackOfferIds**: An array of win-back offer identifiers that a customer is eligible to redeem, which sorts the identifiers with the best offers first.\n- **offerIdentifier**: The string identifier of a subscription offer that you create in App Store Connect.\n- **offerPeriod**: The duration of the offer.\n- **offerType**: The type of offer.\n\n",
  "sections" : [
    {
      "content" : "",
      "items" : [
        {
          "description" : "An array of win-back offer identifiers that a customer is eligible to redeem, which sorts the identifiers with the best offers first.",
          "name" : "eligibleWinBackOfferIds",
          "url" : "https:\/\/developer.apple.com\/documentation\/AppStoreServerAPI\/eligibleWinBackOfferIds"
        },
        {
          "description" : "The string identifier of a subscription offer that you create in App Store Connect.",
          "name" : "offerIdentifier",
          "url" : "https:\/\/developer.apple.com\/documentation\/AppStoreServerAPI\/offerIdentifier"
        },
        {
          "description" : "The duration of the offer.",
          "name" : "offerPeriod",
          "url" : "https:\/\/developer.apple.com\/documentation\/AppStoreServerAPI\/offerPeriod"
        },
        {
          "description" : "The type of offer.",
          "name" : "offerType",
          "url" : "https:\/\/developer.apple.com\/documentation\/AppStoreServerAPI\/offerType"
        }
      ],
      "title" : "Offers"
    }
  ],
  "source" : "appleJSON",
  "title" : "offerDiscountType",
  "url" : "https:\/\/developer.apple.com\/documentation\/AppStoreServerAPI\/offerDiscountType"
}