{
  "abstract" : "Called by the provider during a match",
  "codeExamples" : [

  ],
  "contentHash" : "06a07d7d017e1f4f396be28d97e233d9398e04a34156288b2d22ef7f00fa1aa2",
  "crawledAt" : "2025-12-10T04:40:43Z",
  "declaration" : {
    "code" : "virtual bool matchPropertyTable( \n OSDictionary *table, \n SInt32 *score); ",
    "language" : "swift"
  },
  "id" : "D09CBA52-3681-4AC6-8EEF-53C9900E4448",
  "kind" : "unknown",
  "language" : "occ",
  "module" : "Kernel",
  "overview" : "## Overview\n\nCompare the properties in the supplied table to this object's properties.",
  "rawMarkdown" : "---\nsource: https:\/\/developer.apple.com\/documentation\/kernel\/iohidinterface\/1812756-matchpropertytable\ncrawled: 2025-12-10T04:40:43Z\n---\n\n# matchPropertyTable\n\nCalled by the provider during a match\n\n## Declaration\n\n```swift\nvirtual bool matchPropertyTable( \n OSDictionary *table, \n SInt32 *score); \n```\n\n## Parameters\n\n- **table**: The property table that this device will match against\n\n## Overview\n\nCompare the properties in the supplied table to this object's properties.\n\n## Miscellaneous\n\n- **free**: Free the IOHIDInterface object.\n- **init**: Initialize an IOHIDInterface object.\n- **start**: Start up the driver using the given provider.\n\n",
  "sections" : [
    {
      "content" : "",
      "items" : [
        {
          "description" : "Free the IOHIDInterface object.",
          "name" : "free",
          "url" : "https:\/\/developer.apple.com\/documentation\/kernel\/iohidinterface\/1812725-free"
        },
        {
          "description" : "Initialize an IOHIDInterface object.",
          "name" : "init",
          "url" : "https:\/\/developer.apple.com\/documentation\/kernel\/iohidinterface\/1812739-init"
        },
        {
          "description" : "Start up the driver using the given provider.",
          "name" : "start",
          "url" : "https:\/\/developer.apple.com\/documentation\/kernel\/iohidinterface\/1812781-start"
        }
      ],
      "title" : "Miscellaneous"
    }
  ],
  "source" : "appleJSON",
  "title" : "matchPropertyTable",
  "url" : "https:\/\/developer.apple.com\/documentation\/kernel\/iohidinterface\/1812756-matchpropertytable"
}