{
  "abstract" : "Advances to and returns the next object in the iteration.",
  "codeExamples" : [

  ],
  "contentHash" : "17f1657ef2dd6b1872bab02dcf1ae1bd20437e6641b45459a02c533df5a34f52",
  "crawledAt" : "2025-12-09T17:45:57Z",
  "declaration" : {
    "code" : "virtual OSObject * getNextObject(); ",
    "language" : "swift"
  },
  "id" : "44B631C6-8AB1-4873-872B-BB27ECEBE8C1",
  "kind" : "unknown",
  "language" : "occ",
  "module" : "Kernel",
  "overview" : "## Return Value\n\nThe next object in the iteration context, `NULL` if there is no next object or if the iterator is no longer valid.\n\n## Overview\n\nThis function first calls isValid and returns `NULL` if that function returns `false`.\n\nSubclasses must implement this pure virtual function to check for validity with isValid, and then to advance the iteration context to the next object (if any) and return that next object, or `NULL` if there is none.",
  "rawMarkdown" : "---\nsource: https:\/\/developer.apple.com\/documentation\/kernel\/oscollectioniterator\/1808125-getnextobject\ncrawled: 2025-12-09T17:45:57Z\n---\n\n# getNextObject\n\nAdvances to and returns the next object in the iteration.\n\n## Declaration\n\n```swift\nvirtual OSObject * getNextObject(); \n```\n\n## Return Value\n\nThe next object in the iteration context, `NULL` if there is no next object or if the iterator is no longer valid.\n\n## Overview\n\nThis function first calls isValid and returns `NULL` if that function returns `false`.\n\nSubclasses must implement this pure virtual function to check for validity with isValid, and then to advance the iteration context to the next object (if any) and return that next object, or `NULL` if there is none.\n\n## Miscellaneous\n\n- **free**: Releases or deallocates any resources used by the OSCollectionIterator object.\n- **initWithCollection**: Initializes an OSCollectionIterator for the provided collection object.\n- **isValid**: Checks that the collection hasn't been modified during iteration.\n- **reset**: Resets the iterator to the beginning of the collection, as if it had just been created.\n- **withCollection**: Creates and initializes an OSCollectionIterator for the provided collection object.\n\n",
  "sections" : [
    {
      "content" : "",
      "items" : [
        {
          "description" : "Releases or deallocates any resources used by the OSCollectionIterator object.",
          "name" : "free",
          "url" : "https:\/\/developer.apple.com\/documentation\/kernel\/oscollectioniterator\/1808113-free"
        },
        {
          "description" : "Initializes an OSCollectionIterator for the provided collection object.",
          "name" : "initWithCollection",
          "url" : "https:\/\/developer.apple.com\/documentation\/kernel\/oscollectioniterator\/1808147-initwithcollection"
        },
        {
          "description" : "Checks that the collection hasn't been modified during iteration.",
          "name" : "isValid",
          "url" : "https:\/\/developer.apple.com\/documentation\/kernel\/oscollectioniterator\/1808157-isvalid"
        },
        {
          "description" : "Resets the iterator to the beginning of the collection, as if it had just been created.",
          "name" : "reset",
          "url" : "https:\/\/developer.apple.com\/documentation\/kernel\/oscollectioniterator\/1808170-reset"
        },
        {
          "description" : "Creates and initializes an OSCollectionIterator for the provided collection object.",
          "name" : "withCollection",
          "url" : "https:\/\/developer.apple.com\/documentation\/kernel\/oscollectioniterator\/1808183-withcollection"
        }
      ],
      "title" : "Miscellaneous"
    }
  ],
  "source" : "appleJSON",
  "title" : "getNextObject",
  "url" : "https:\/\/developer.apple.com\/documentation\/kernel\/oscollectioniterator\/1808125-getnextobject"
}