{
  "abstract" : "An IOMemoryCursor subclass that outputs a vector of PhysicalSegments in the natural byte orientation for the CPU.",
  "codeExamples" : [

  ],
  "contentHash" : "6d571d87ac4f48741d1f7334820bae34742bc69d1b02911df180ef462a455537",
  "crawledAt" : "2025-12-06T23:16:56Z",
  "declaration" : {
    "code" : "class IONaturalMemoryCursor : IOMemoryCursor",
    "language" : "swift"
  },
  "id" : "E30E62CC-CF7D-487B-9E8E-AB69F179A53A",
  "kind" : "class",
  "language" : "occ",
  "module" : "Kernel",
  "overview" : "## Overview\n\nThe IONaturalMemoryCursor would be used when it is too difficult to safely describe a SegmentFunction that is more appropriate for your hardware. This cursor just outputs an array of PhysicalSegments.",
  "platforms" : [
    "macOS"
  ],
  "rawMarkdown" : "---\nsource: https:\/\/developer.apple.com\/documentation\/kernel\/ionaturalmemorycursor\ncrawled: 2025-12-06T23:16:56Z\n---\n\n# IONaturalMemoryCursor\n\n**Class**\n\nAn IOMemoryCursor subclass that outputs a vector of PhysicalSegments in the natural byte orientation for the CPU.\n\n## Declaration\n\n```swift\nclass IONaturalMemoryCursor : IOMemoryCursor\n```\n\n## Overview\n\nThe IONaturalMemoryCursor would be used when it is too difficult to safely describe a SegmentFunction that is more appropriate for your hardware. This cursor just outputs an array of PhysicalSegments.\n\n## Miscellaneous\n\n- **getPhysicalSegments**: Generates a CPU natural physical scatter\/gather list given a memory descriptor.\n- **initWithSpecification**: Primary initializer for the IONaturalMemoryCursor class.\n- **outputSegment**: Outputs the given segment into the output segments array in natural byte order.\n- **withSpecification**: Creates and initializes an IONaturalMemoryCursor in one operation.\n\n## Constants\n\n- **Miscellaneous Defines**\n\n## Instance Methods\n\n- **getMetaClass**\n- **getPhysicalSegments**\n- **initWithSpecification**\n\n## Type Methods\n\n- **outputSegment**\n- **withSpecification**\n\n## Cursors\n\n- **IOBigMemoryCursor**: An IOMemoryCursor subclass that outputs a vector of PhysicalSegments in the big endian byte order.\n- **IOLittleMemoryCursor**: An IOMemoryCursor subclass that outputs a vector of PhysicalSegments in the little endian byte order.\n- **IOMemoryCursor**: A mechanism to convert memory references to physical addresses.\n\n## Inherits From\n\n- IOMemoryCursor\n\n",
  "sections" : [
    {
      "content" : "",
      "items" : [
        {
          "description" : "Generates a CPU natural physical scatter\/gather list given a memory descriptor.",
          "name" : "getPhysicalSegments",
          "url" : "https:\/\/developer.apple.com\/documentation\/kernel\/ionaturalmemorycursor\/1813076-getphysicalsegments"
        },
        {
          "description" : "Primary initializer for the IONaturalMemoryCursor class.",
          "name" : "initWithSpecification",
          "url" : "https:\/\/developer.apple.com\/documentation\/kernel\/ionaturalmemorycursor\/1813089-initwithspecification"
        },
        {
          "description" : "Outputs the given segment into the output segments array in natural byte order.",
          "name" : "outputSegment",
          "url" : "https:\/\/developer.apple.com\/documentation\/kernel\/ionaturalmemorycursor\/1813100-outputsegment"
        },
        {
          "description" : "Creates and initializes an IONaturalMemoryCursor in one operation.",
          "name" : "withSpecification",
          "url" : "https:\/\/developer.apple.com\/documentation\/kernel\/ionaturalmemorycursor\/1813112-withspecification"
        }
      ],
      "title" : "Miscellaneous"
    },
    {
      "content" : "",
      "items" : [
        {
          "description" : "",
          "name" : "Miscellaneous Defines",
          "url" : "https:\/\/developer.apple.com\/documentation\/kernel\/ionaturalmemorycursor\/miscellaneous_defines"
        }
      ],
      "title" : "Constants"
    },
    {
      "content" : "",
      "items" : [
        {
          "name" : "getMetaClass",
          "url" : "https:\/\/developer.apple.com\/documentation\/kernel\/ionaturalmemorycursor\/1401014-getmetaclass"
        },
        {
          "name" : "getPhysicalSegments",
          "url" : "https:\/\/developer.apple.com\/documentation\/kernel\/ionaturalmemorycursor\/1400988-getphysicalsegments"
        },
        {
          "name" : "initWithSpecification",
          "url" : "https:\/\/developer.apple.com\/documentation\/kernel\/ionaturalmemorycursor\/1401018-initwithspecification"
        }
      ],
      "title" : "Instance Methods"
    },
    {
      "content" : "",
      "items" : [
        {
          "name" : "outputSegment",
          "url" : "https:\/\/developer.apple.com\/documentation\/kernel\/ionaturalmemorycursor\/1400992-outputsegment"
        },
        {
          "name" : "withSpecification",
          "url" : "https:\/\/developer.apple.com\/documentation\/kernel\/ionaturalmemorycursor\/1400990-withspecification"
        }
      ],
      "title" : "Type Methods"
    },
    {
      "content" : "",
      "items" : [
        {
          "description" : "An IOMemoryCursor subclass that outputs a vector of PhysicalSegments in the big endian byte order.",
          "name" : "IOBigMemoryCursor",
          "url" : "https:\/\/developer.apple.com\/documentation\/kernel\/iobigmemorycursor"
        },
        {
          "description" : "An IOMemoryCursor subclass that outputs a vector of PhysicalSegments in the little endian byte order.",
          "name" : "IOLittleMemoryCursor",
          "url" : "https:\/\/developer.apple.com\/documentation\/kernel\/iolittlememorycursor"
        },
        {
          "description" : "A mechanism to convert memory references to physical addresses.",
          "name" : "IOMemoryCursor",
          "url" : "https:\/\/developer.apple.com\/documentation\/kernel\/iomemorycursor"
        }
      ],
      "title" : "Cursors"
    },
    {
      "content" : "",
      "items" : [
        {
          "name" : "IOMemoryCursor"
        }
      ],
      "title" : "Inherits From"
    }
  ],
  "source" : "appleJSON",
  "title" : "IONaturalMemoryCursor",
  "url" : "https:\/\/developer.apple.com\/documentation\/kernel\/ionaturalmemorycursor"
}