{
  "abstract" : "Checks whether the object has already been serialized into the XML stream, emitting a reference if it has.",
  "codeExamples" : [

  ],
  "contentHash" : "b9f3e0abc459a985058014a7f2deabdcec37a27947c0ff32cd42c252f9f42dae",
  "crawledAt" : "2025-12-09T17:54:51Z",
  "declaration" : {
    "code" : "virtual bool previouslySerialized(\n const OSMetaClassBase *object); ",
    "language" : "swift"
  },
  "id" : "E2828E89-420D-4F5E-BB7C-C5A33E4CA92A",
  "kind" : "unknown",
  "language" : "occ",
  "module" : "Kernel",
  "overview" : "## Return Value\n\n`true` if `object` has already been serialized by this OSSerialize object and a reference to it is successfully added to the XML stream, `false` otherwise.\n\n## Overview\n\nThis function both reduces the size of generated XML by emitting shorter references to existing objects with the same value (particularly for OSString, OSSymbol, and OSData), and also preserves instance references so that the user-space I\/O Kit library can reconstruct an identical graph of object relationships.\n\nAll classes that override OSObject::serialize. should call this function before doing any actual serialization; if it returns `true`, the `serialize` implementation can immediately return `true`.",
  "rawMarkdown" : "---\nsource: https:\/\/developer.apple.com\/documentation\/kernel\/osserialize\/1808096-previouslyserialized\ncrawled: 2025-12-09T17:54:51Z\n---\n\n# previouslySerialized\n\nChecks whether the object has already been serialized into the XML stream, emitting a reference if it has.\n\n## Declaration\n\n```swift\nvirtual bool previouslySerialized(\n const OSMetaClassBase *object); \n```\n\n## Parameters\n\n- **object**: The object to check.\n\n## Return Value\n\n`true` if `object` has already been serialized by this OSSerialize object and a reference to it is successfully added to the XML stream, `false` otherwise.\n\n## Overview\n\nThis function both reduces the size of generated XML by emitting shorter references to existing objects with the same value (particularly for OSString, OSSymbol, and OSData), and also preserves instance references so that the user-space I\/O Kit library can reconstruct an identical graph of object relationships.\n\nAll classes that override OSObject::serialize. should call this function before doing any actual serialization; if it returns `true`, the `serialize` implementation can immediately return `true`.\n\n## Miscellaneous\n\n- **addChar**: Appends a single character to the XML stream.\n- **addString**: Appends a C string to the XML stream.\n- **addXMLEndTag**: Appends an XML end tag to the XML stream.\n- **addXMLStartTag**: Appends an XML start tag to the XML stream.\n- **clearText**: Resets the OSSerialize object.\n- **text**: Returns the XML text serialized so far.\n- **withCapacity**: Creates and initializes an empty OSSerialize object.\n\n",
  "sections" : [
    {
      "content" : "",
      "items" : [
        {
          "description" : "Appends a single character to the XML stream.",
          "name" : "addChar",
          "url" : "https:\/\/developer.apple.com\/documentation\/kernel\/osserialize\/1808034-addchar"
        },
        {
          "description" : "Appends a C string to the XML stream.",
          "name" : "addString",
          "url" : "https:\/\/developer.apple.com\/documentation\/kernel\/osserialize\/1808045-addstring"
        },
        {
          "description" : "Appends an XML end tag to the XML stream.",
          "name" : "addXMLEndTag",
          "url" : "https:\/\/developer.apple.com\/documentation\/kernel\/osserialize\/1808061-addxmlendtag"
        },
        {
          "description" : "Appends an XML start tag to the XML stream.",
          "name" : "addXMLStartTag",
          "url" : "https:\/\/developer.apple.com\/documentation\/kernel\/osserialize\/1808073-addxmlstarttag"
        },
        {
          "description" : "Resets the OSSerialize object.",
          "name" : "clearText",
          "url" : "https:\/\/developer.apple.com\/documentation\/kernel\/osserialize\/1808086-cleartext"
        },
        {
          "description" : "Returns the XML text serialized so far.",
          "name" : "text",
          "url" : "https:\/\/developer.apple.com\/documentation\/kernel\/osserialize\/1808110-text"
        },
        {
          "description" : "Creates and initializes an empty OSSerialize object.",
          "name" : "withCapacity",
          "url" : "https:\/\/developer.apple.com\/documentation\/kernel\/osserialize\/1808120-withcapacity"
        }
      ],
      "title" : "Miscellaneous"
    }
  ],
  "source" : "appleJSON",
  "title" : "previouslySerialized",
  "url" : "https:\/\/developer.apple.com\/documentation\/kernel\/osserialize\/1808096-previouslyserialized"
}