{
  "codeExamples" : [

  ],
  "contentHash" : "c279d3c182c8503569ecdc1ddb177fa3bb8ae6316fc34725ac01b95aa259c1fe",
  "crawledAt" : "2025-12-09T23:25:41Z",
  "declaration" : {
    "code" : "void setPSProperty(\n const OSSymbol *,\n OSObject *); ",
    "language" : "swift"
  },
  "id" : "8FEB4FC8-CC61-4204-8796-C1089A979D0C",
  "kind" : "unknown",
  "language" : "occ",
  "module" : "Kernel",
  "overview" : "## Overview\n\nAll of these methods funnel through the generic accessor method setPSProperty. Caller can pass in any arbitrary OSSymbol key, and that value will be stored in the PM settings dictionary, and relayed onto the IORegistry at update time.",
  "rawMarkdown" : "---\nsource: https:\/\/developer.apple.com\/documentation\/kernel\/iopmpowersource\/1809917-setpsproperty\ncrawled: 2025-12-09T23:25:41Z\n---\n\n# setPSProperty\n\n## Declaration\n\n```swift\nvoid setPSProperty(\n const OSSymbol *,\n OSObject *); \n```\n\n## Overview\n\nAll of these methods funnel through the generic accessor method setPSProperty. Caller can pass in any arbitrary OSSymbol key, and that value will be stored in the PM settings dictionary, and relayed onto the IORegistry at update time.\n\n## Miscellaneous\n\n- **powerSource**: Creates a new IOPMPowerSource nub. Must be attached to IORegistry, and registered by provider.\n- **updateStatus**: Must be called by physical battery controller when battery state has changed significantly.\n\n",
  "sections" : [
    {
      "content" : "",
      "items" : [
        {
          "description" : "Creates a new IOPMPowerSource nub. Must be attached to IORegistry, and registered by provider.",
          "name" : "powerSource",
          "url" : "https:\/\/developer.apple.com\/documentation\/kernel\/iopmpowersource\/1809904-powersource"
        },
        {
          "description" : "Must be called by physical battery controller when battery state has changed significantly.",
          "name" : "updateStatus",
          "url" : "https:\/\/developer.apple.com\/documentation\/kernel\/iopmpowersource\/1809926-updatestatus"
        }
      ],
      "title" : "Miscellaneous"
    }
  ],
  "source" : "appleJSON",
  "title" : "setPSProperty",
  "url" : "https:\/\/developer.apple.com\/documentation\/kernel\/iopmpowersource\/1809917-setpsproperty"
}