{
  "abstract" : "Size of the data for this CPU.",
  "codeExamples" : [

  ],
  "contentHash" : "c94672d9d96e0f4baa5a859a12bfcdd9d02401ef0d5fedc5228d04a0b4bd20c6",
  "crawledAt" : "2025-12-10T10:38:41Z",
  "declaration" : {
    "code" : "uint32_t size;",
    "language" : "swift"
  },
  "id" : "F30F84B0-EF0C-4087-90E1-6DF90D246D3B",
  "kind" : "property",
  "language" : "occ",
  "module" : "Kernel",
  "platforms" : [
    "macOS"
  ],
  "rawMarkdown" : "---\nsource: https:\/\/developer.apple.com\/documentation\/kernel\/fat_arch\/1558631-size\ncrawled: 2025-12-10T10:38:41Z\n---\n\n# size\n\n**Instance Property**\n\nSize of the data for this CPU.\n\n## Declaration\n\n```swift\nuint32_t size;\n```\n\n## Fields\n\n- **cpusubtype**: An enumeration value of type `cpu_subtype_t`. Specifies the specific member of the CPU family on which this entry may be used or a constant specifying all members.\n- **offset**: Offset to the beginning of the data for this CPU.\n- **align**: The power of 2 alignment for the offset of the object file for the architecture specified in `cputype` within the binary. This is required to ensure that, if this binary is changed, the contents it retains are correctly aligned for virtual memory paging and other uses.\n\n",
  "sections" : [
    {
      "content" : "",
      "items" : [
        {
          "description" : "An enumeration value of type `cpu_subtype_t`. Specifies the specific member of the CPU family on which this entry may be used or a constant specifying all members.",
          "name" : "cpusubtype",
          "url" : "https:\/\/developer.apple.com\/documentation\/kernel\/fat_arch\/1558623-cpusubtype"
        },
        {
          "description" : "Offset to the beginning of the data for this CPU.",
          "name" : "offset",
          "url" : "https:\/\/developer.apple.com\/documentation\/kernel\/fat_arch\/1558628-offset"
        },
        {
          "description" : "The power of 2 alignment for the offset of the object file for the architecture specified in `cputype` within the binary. This is required to ensure that, if this binary is changed, the contents it retains are correctly aligned for virtual memory paging and other uses.",
          "name" : "align",
          "url" : "https:\/\/developer.apple.com\/documentation\/kernel\/fat_arch\/1558625-align"
        }
      ],
      "title" : "Fields"
    }
  ],
  "source" : "appleJSON",
  "title" : "size",
  "url" : "https:\/\/developer.apple.com\/documentation\/kernel\/fat_arch\/1558631-size"
}