{
  "abstract" : "Ensures the collection has enough space to store the requested number of objects.",
  "codeExamples" : [

  ],
  "contentHash" : "7cfd83ddc96a540e70c68c8fb89e20a154d7b104a0ecc7fe559a58d6bf544f48",
  "crawledAt" : "2025-12-09T17:44:34Z",
  "declaration" : {
    "code" : "virtual unsigned int ensureCapacity(\n unsigned intnewCapacity) = 0; ",
    "language" : "swift"
  },
  "id" : "976F964A-2226-47FC-8DFB-842F6CBAF96E",
  "kind" : "unknown",
  "language" : "occ",
  "module" : "Kernel",
  "overview" : "## Return Value\n\nThe new capacity of the collection, which may be different from the number requested (if smaller, reallocation of storage failed).\n\n## Overview\n\nSubclasses implement this pure virtual member function to adjust their storage so that they can hold at least `newCapacity` objects. Libkern collections generally allocate storage in multiples of their capacity increment.\n\nSubclass methods that add objects to the collection should call this function before adding any object, and should check the return value for success.\n\nCollection subclasses may reduce their storage when the number of contained objects falls below some threshold, but no Libkern collections currently do.",
  "rawMarkdown" : "---\nsource: https:\/\/developer.apple.com\/documentation\/kernel\/oscollection\/1808212-ensurecapacity\ncrawled: 2025-12-09T17:44:34Z\n---\n\n# ensureCapacity\n\nEnsures the collection has enough space to store the requested number of objects.\n\n## Declaration\n\n```swift\nvirtual unsigned int ensureCapacity(\n unsigned intnewCapacity) = 0; \n```\n\n## Parameters\n\n- **newCapacity**: The total number of objects the collection should be able to store.\n\n## Return Value\n\nThe new capacity of the collection, which may be different from the number requested (if smaller, reallocation of storage failed).\n\n## Overview\n\nSubclasses implement this pure virtual member function to adjust their storage so that they can hold at least `newCapacity` objects. Libkern collections generally allocate storage in multiples of their capacity increment.\n\nSubclass methods that add objects to the collection should call this function before adding any object, and should check the return value for success.\n\nCollection subclasses may reduce their storage when the number of contained objects falls below some threshold, but no Libkern collections currently do.\n\n## Miscellaneous\n\n- **copyCollection**: Creates a deep copy of a collection.\n- **flushCollection**: Empties the collection, releasing any objects retained.\n- **getCapacity**: Returns the number of objects the collection can store without reallocating.\n- **getCapacityIncrement**: Returns the storage increment of the collection.\n- **getCount**: Returns the number of objects in the collection.\n- **getNextObjectForIterator**: Returns the next member of a collection.\n- **haveUpdated**: Tracks updates to the collection.\n- **init**: Initializes the OSCollection object.\n- **initIterator**: Initializes the iteration context for a collection subclass.\n- **iteratorSize**: Returns the size in bytes of a subclass's iteration context.\n- **setCapacityIncrement**: Sets the storage increment of the collection.\n\n",
  "sections" : [
    {
      "content" : "",
      "items" : [
        {
          "description" : "Creates a deep copy of a collection.",
          "name" : "copyCollection",
          "url" : "https:\/\/developer.apple.com\/documentation\/kernel\/oscollection\/1808206-copycollection"
        },
        {
          "description" : "Empties the collection, releasing any objects retained.",
          "name" : "flushCollection",
          "url" : "https:\/\/developer.apple.com\/documentation\/kernel\/oscollection\/1808219-flushcollection"
        },
        {
          "description" : "Returns the number of objects the collection can store without reallocating.",
          "name" : "getCapacity",
          "url" : "https:\/\/developer.apple.com\/documentation\/kernel\/oscollection\/1808225-getcapacity"
        },
        {
          "description" : "Returns the storage increment of the collection.",
          "name" : "getCapacityIncrement",
          "url" : "https:\/\/developer.apple.com\/documentation\/kernel\/oscollection\/1808233-getcapacityincrement"
        },
        {
          "description" : "Returns the number of objects in the collection.",
          "name" : "getCount",
          "url" : "https:\/\/developer.apple.com\/documentation\/kernel\/oscollection\/1808238-getcount"
        },
        {
          "description" : "Returns the next member of a collection.",
          "name" : "getNextObjectForIterator",
          "url" : "https:\/\/developer.apple.com\/documentation\/kernel\/oscollection\/1808244-getnextobjectforiterator"
        },
        {
          "description" : "Tracks updates to the collection.",
          "name" : "haveUpdated",
          "url" : "https:\/\/developer.apple.com\/documentation\/kernel\/oscollection\/1808248-haveupdated"
        },
        {
          "description" : "Initializes the OSCollection object.",
          "name" : "init",
          "url" : "https:\/\/developer.apple.com\/documentation\/kernel\/oscollection\/1808252-init"
        },
        {
          "description" : "Initializes the iteration context for a collection subclass.",
          "name" : "initIterator",
          "url" : "https:\/\/developer.apple.com\/documentation\/kernel\/oscollection\/1808258-inititerator"
        },
        {
          "description" : "Returns the size in bytes of a subclass's iteration context.",
          "name" : "iteratorSize",
          "url" : "https:\/\/developer.apple.com\/documentation\/kernel\/oscollection\/1808262-iteratorsize"
        },
        {
          "description" : "Sets the storage increment of the collection.",
          "name" : "setCapacityIncrement",
          "url" : "https:\/\/developer.apple.com\/documentation\/kernel\/oscollection\/1808267-setcapacityincrement"
        }
      ],
      "title" : "Miscellaneous"
    }
  ],
  "source" : "appleJSON",
  "title" : "ensureCapacity",
  "url" : "https:\/\/developer.apple.com\/documentation\/kernel\/oscollection\/1808212-ensurecapacity"
}