{
  "abstract" : "Creates and initializes an instance of OSNumber with an integer value.",
  "codeExamples" : [

  ],
  "contentHash" : "10821d5446a22ee647c47a6234e6a4946c28e4a6cf49b0727843a70536e4c24c",
  "crawledAt" : "2025-12-09T17:28:22Z",
  "declaration" : {
    "code" : "static OSNumber * withNumber( \n unsigned long longvalue, \n unsigned intnumberOfBits); ",
    "language" : "swift"
  },
  "id" : "6F189898-EB03-4A40-9F7C-86A92E5ADD88",
  "kind" : "unknown",
  "language" : "occ",
  "module" : "Kernel",
  "overview" : "## Return Value\n\nAn instance of OSNumber with a reference count of 1; `NULL` on failure.\n\n## Overview\n\n`value` is masked to the provided `numberOfBits` when the OSNumber object is initialized.\n\nYou can change the value of an OSNumber later using setValue and addValue, but you can't change the bit size.",
  "rawMarkdown" : "---\nsource: https:\/\/developer.apple.com\/documentation\/kernel\/osnumber\/1808143-withnumber\ncrawled: 2025-12-09T17:28:22Z\n---\n\n# withNumber(unsigned long long, unsigned int)\n\nCreates and initializes an instance of OSNumber with an integer value.\n\n## Declaration\n\n```swift\nstatic OSNumber * withNumber( \n unsigned long longvalue, \n unsigned intnumberOfBits); \n```\n\n## Parameters\n\n- **value**: The numeric integer value for the OSNumber to store.\n- **numberOfBits**: The number of bits to limit storage to.\n\n## Return Value\n\nAn instance of OSNumber with a reference count of 1; `NULL` on failure.\n\n## Overview\n\n`value` is masked to the provided `numberOfBits` when the OSNumber object is initialized.\n\nYou can change the value of an OSNumber later using setValue and addValue, but you can't change the bit size.\n\n## Miscellaneous\n\n- **addValue**: Adds a signed integer value to the internal integer value of the OSNumber object.\n- **free**: Deallocates or releases any resources used by the OSNumber instance.\n- **init(const char *, unsigned int)**: Initializes an instance of OSNumber with an unsigned integer value represented as a C string.\n- **init(unsigned long long, unsigned int)**: Initializes an instance of OSNumber with an integer value.\n- **isEqualTo(const OSMetaClassBase *)**: Tests the equality an OSNumber to an arbitrary object.\n- **isEqualTo(const OSNumber *)**: Tests the equality of two OSNumber objects.\n- **numberOfBits**: Returns the number of bits used to represent the OSNumber object's integer value.\n- **numberOfBytes**: Returns the number of bytes used to represent the OSNumber object's integer value.\n- **serialize**: Archives the receiver into the provided OSSerialize object.\n- **setValue**: Replaces the current internal integer value of the OSNumber object by the value given.\n- **unsigned16BitValue**: Returns the OSNumber object's integer value cast as an unsigned 16-bit integer.\n- **unsigned32BitValue**: Returns the OSNumber object's integer value cast as an unsigned 32-bit integer.\n- **unsigned64BitValue**: Returns the OSNumber object's integer value cast as an unsigned 64-bit integer.\n- **unsigned8BitValue**: Returns the OSNumber object's integer value cast as an unsigned 8-bit integer.\n- **withNumber(const char *, unsigned int)**: Creates and initializes an instance of OSNumber with an unsigned integer value represented as a C string.\n\n",
  "sections" : [
    {
      "content" : "",
      "items" : [
        {
          "description" : "Adds a signed integer value to the internal integer value of the OSNumber object.",
          "name" : "addValue",
          "url" : "https:\/\/developer.apple.com\/documentation\/kernel\/osnumber\/1808041-addvalue"
        },
        {
          "description" : "Deallocates or releases any resources used by the OSNumber instance.",
          "name" : "free",
          "url" : "https:\/\/developer.apple.com\/documentation\/kernel\/osnumber\/1808049-free"
        },
        {
          "description" : "Initializes an instance of OSNumber with an unsigned integer value represented as a C string.",
          "name" : "init(const char *, unsigned int)",
          "url" : "https:\/\/developer.apple.com\/documentation\/kernel\/osnumber\/1808057-init"
        },
        {
          "description" : "Initializes an instance of OSNumber with an integer value.",
          "name" : "init(unsigned long long, unsigned int)",
          "url" : "https:\/\/developer.apple.com\/documentation\/kernel\/osnumber\/1808065-init"
        },
        {
          "description" : "Tests the equality an OSNumber to an arbitrary object.",
          "name" : "isEqualTo(const OSMetaClassBase *)",
          "url" : "https:\/\/developer.apple.com\/documentation\/kernel\/osnumber\/1808071-isequalto"
        },
        {
          "description" : "Tests the equality of two OSNumber objects.",
          "name" : "isEqualTo(const OSNumber *)",
          "url" : "https:\/\/developer.apple.com\/documentation\/kernel\/osnumber\/1808076-isequalto"
        },
        {
          "description" : "Returns the number of bits used to represent the OSNumber object's integer value.",
          "name" : "numberOfBits",
          "url" : "https:\/\/developer.apple.com\/documentation\/kernel\/osnumber\/1808083-numberofbits"
        },
        {
          "description" : "Returns the number of bytes used to represent the OSNumber object's integer value.",
          "name" : "numberOfBytes",
          "url" : "https:\/\/developer.apple.com\/documentation\/kernel\/osnumber\/1808091-numberofbytes"
        },
        {
          "description" : "Archives the receiver into the provided OSSerialize object.",
          "name" : "serialize",
          "url" : "https:\/\/developer.apple.com\/documentation\/kernel\/osnumber\/1808097-serialize"
        },
        {
          "description" : "Replaces the current internal integer value of the OSNumber object by the value given.",
          "name" : "setValue",
          "url" : "https:\/\/developer.apple.com\/documentation\/kernel\/osnumber\/1808102-setvalue"
        },
        {
          "description" : "Returns the OSNumber object's integer value cast as an unsigned 16-bit integer.",
          "name" : "unsigned16BitValue",
          "url" : "https:\/\/developer.apple.com\/documentation\/kernel\/osnumber\/1808108-unsigned16bitvalue"
        },
        {
          "description" : "Returns the OSNumber object's integer value cast as an unsigned 32-bit integer.",
          "name" : "unsigned32BitValue",
          "url" : "https:\/\/developer.apple.com\/documentation\/kernel\/osnumber\/1808115-unsigned32bitvalue"
        },
        {
          "description" : "Returns the OSNumber object's integer value cast as an unsigned 64-bit integer.",
          "name" : "unsigned64BitValue",
          "url" : "https:\/\/developer.apple.com\/documentation\/kernel\/osnumber\/1808123-unsigned64bitvalue"
        },
        {
          "description" : "Returns the OSNumber object's integer value cast as an unsigned 8-bit integer.",
          "name" : "unsigned8BitValue",
          "url" : "https:\/\/developer.apple.com\/documentation\/kernel\/osnumber\/1808129-unsigned8bitvalue"
        },
        {
          "description" : "Creates and initializes an instance of OSNumber with an unsigned integer value represented as a C string.",
          "name" : "withNumber(const char *, unsigned int)",
          "url" : "https:\/\/developer.apple.com\/documentation\/kernel\/osnumber\/1808136-withnumber"
        }
      ],
      "title" : "Miscellaneous"
    }
  ],
  "source" : "appleJSON",
  "title" : "withNumber(unsigned long long, unsigned int)",
  "url" : "https:\/\/developer.apple.com\/documentation\/kernel\/osnumber\/1808143-withnumber"
}