{
  "abstract" : "Any special requests made by the user with the reservation.",
  "codeExamples" : [

  ],
  "contentHash" : "c4cbfc34a831a709a70ebaec59a06b1a494fdc8be20c8c7eeb23568dc2d74ebd",
  "crawledAt" : "2025-12-07T19:03:50Z",
  "declaration" : {
    "code" : "var guestProvidedSpecialRequestText: String? { get set }",
    "language" : "swift"
  },
  "id" : "CCD2131A-F239-4A54-BF55-A58FFEDE57D5",
  "kind" : "property",
  "language" : "swift",
  "module" : "Intents",
  "overview" : "## Discussion\n\nUsers can include special requests when booking a reservation. For example, the user might use request a non-smoking table or enumerate any dietary restrictions. If the user provides additional requests, this field contains that information.",
  "platforms" : [
    "iOS",
    "iPadOS",
    "Mac Catalyst",
    "visionOS"
  ],
  "rawMarkdown" : "---\nsource: https:\/\/developer.apple.com\/documentation\/Intents\/INRestaurantReservationUserBooking\/guestProvidedSpecialRequestText\ncrawled: 2025-12-07T19:03:50Z\n---\n\n# guestProvidedSpecialRequestText\n\n**Instance Property**\n\nAny special requests made by the user with the reservation.\n\n## Declaration\n\n```swift\nvar guestProvidedSpecialRequestText: String? { get set }\n```\n\n## Discussion\n\nUsers can include special requests when booking a reservation. For example, the user might use request a non-smoking table or enumerate any dietary restrictions. If the user provides additional requests, this field contains that information.\n\n## Accessing the Reservation Information\n\n- **guest**: The guest associated with the reservation.\n- **status**: The current status of the reservation.\n- **dateStatusModified**: The date on which the status of the reservation changed.\n\n",
  "sections" : [
    {
      "content" : "",
      "items" : [
        {
          "description" : "The guest associated with the reservation.",
          "name" : "guest",
          "url" : "https:\/\/developer.apple.com\/documentation\/Intents\/INRestaurantReservationUserBooking\/guest"
        },
        {
          "description" : "The current status of the reservation.",
          "name" : "status",
          "url" : "https:\/\/developer.apple.com\/documentation\/Intents\/INRestaurantReservationUserBooking\/status"
        },
        {
          "description" : "The date on which the status of the reservation changed.",
          "name" : "dateStatusModified",
          "url" : "https:\/\/developer.apple.com\/documentation\/Intents\/INRestaurantReservationUserBooking\/dateStatusModified"
        }
      ],
      "title" : "Accessing the Reservation Information"
    }
  ],
  "source" : "appleJSON",
  "title" : "guestProvidedSpecialRequestText",
  "url" : "https:\/\/developer.apple.com\/documentation\/Intents\/INRestaurantReservationUserBooking\/guestProvidedSpecialRequestText"
}