{
  "abstract" : "The handler interface for initiating an audio call from your app.",
  "codeExamples" : [

  ],
  "contentHash" : "6e0cdd012db2fce5741697921692a8b43262030ceedabab2b466f8a9896f3192",
  "crawledAt" : "2025-12-05T19:39:32Z",
  "declaration" : {
    "code" : "protocol INStartAudioCallIntentHandling : NSObjectProtocol",
    "language" : "swift"
  },
  "id" : "0A751F2B-33B3-454F-988F-19A15B537817",
  "inheritedBy" : [
    "INCallsDomainHandling"
  ],
  "kind" : "protocol",
  "language" : "swift",
  "module" : "Intents",
  "overview" : "## Overview\n\nUse the methods of the [doc:\/\/com.apple.sirikit\/documentation\/Intents\/INStartAudioCallIntentHandling] protocol to resolve, confirm, and handle requests to start an audio-only call with the designated users. Adopt this protocol in an object of your Intents extension that’s capable of validating the call information. Don’t try to initiate the call directly in your Intents app extension. Instead, a successful response involves asking Siri to launch your app to begin the call.\n\nSiri delivers an [doc:\/\/com.apple.sirikit\/documentation\/Intents\/INStartAudioCallIntent] object to your handler when the user asks to initiate a call using your app. The provided intent object contains information about who the user wants to call. Use the methods of this protocol to resolve the list of contacts to call and to validate that your app can place the call successfully.",
  "platforms" : [
    "iOS",
    "iPadOS",
    "Mac Catalyst",
    "visionOS",
    "watchOS"
  ],
  "rawMarkdown" : "---\nsource: https:\/\/developer.apple.com\/documentation\/Intents\/INStartAudioCallIntentHandling\ncrawled: 2025-12-05T19:39:32Z\n---\n\n# INStartAudioCallIntentHandling\n\n**Protocol**\n\nThe handler interface for initiating an audio call from your app.\n\n## Declaration\n\n```swift\nprotocol INStartAudioCallIntentHandling : NSObjectProtocol\n```\n\n## Overview\n\nUse the methods of the [doc:\/\/com.apple.sirikit\/documentation\/Intents\/INStartAudioCallIntentHandling] protocol to resolve, confirm, and handle requests to start an audio-only call with the designated users. Adopt this protocol in an object of your Intents extension that’s capable of validating the call information. Don’t try to initiate the call directly in your Intents app extension. Instead, a successful response involves asking Siri to launch your app to begin the call.\n\nSiri delivers an [doc:\/\/com.apple.sirikit\/documentation\/Intents\/INStartAudioCallIntent] object to your handler when the user asks to initiate a call using your app. The provided intent object contains information about who the user wants to call. Use the methods of this protocol to resolve the list of contacts to call and to validate that your app can place the call successfully.\n\n## Resolving the Intent Parameters\n\n- **resolveContacts(for:with:)**: Resolves the recipients of the call.\n- **resolveDestinationType(for:with:)**: Resolves the destination of the call.\n\n## Confirming the Response\n\n- **confirm(intent:completion:)**: Validates whether your app is able to initiate the call.\n\n## Handling the Intent\n\n- **handle(intent:completion:)**: Provides information to hand off the call to your app.\n\n## Audio Call Initiation\n\n- **INStartAudioCallIntent**: A request to start an audio-only call with one or more users.\n- **INStartAudioCallIntentResponse**: An app’s response to an intent to start an audio call.\n\n## Inherits From\n\n- NSObjectProtocol\n\n## Inherited By\n\n- INCallsDomainHandling\n\n",
  "sections" : [
    {
      "content" : "",
      "items" : [
        {
          "description" : "Resolves the recipients of the call.",
          "name" : "resolveContacts(for:with:)",
          "url" : "https:\/\/developer.apple.com\/documentation\/Intents\/INStartAudioCallIntentHandling\/resolveContacts(for:with:)"
        },
        {
          "description" : "Resolves the destination of the call.",
          "name" : "resolveDestinationType(for:with:)",
          "url" : "https:\/\/developer.apple.com\/documentation\/Intents\/INStartAudioCallIntentHandling\/resolveDestinationType(for:with:)"
        }
      ],
      "title" : "Resolving the Intent Parameters"
    },
    {
      "content" : "",
      "items" : [
        {
          "description" : "Validates whether your app is able to initiate the call.",
          "name" : "confirm(intent:completion:)",
          "url" : "https:\/\/developer.apple.com\/documentation\/Intents\/INStartAudioCallIntentHandling\/confirm(intent:completion:)"
        }
      ],
      "title" : "Confirming the Response"
    },
    {
      "content" : "",
      "items" : [
        {
          "description" : "Provides information to hand off the call to your app.",
          "name" : "handle(intent:completion:)",
          "url" : "https:\/\/developer.apple.com\/documentation\/Intents\/INStartAudioCallIntentHandling\/handle(intent:completion:)"
        }
      ],
      "title" : "Handling the Intent"
    },
    {
      "content" : "",
      "items" : [
        {
          "description" : "A request to start an audio-only call with one or more users.",
          "name" : "INStartAudioCallIntent",
          "url" : "https:\/\/developer.apple.com\/documentation\/Intents\/INStartAudioCallIntent"
        },
        {
          "description" : "An app’s response to an intent to start an audio call.",
          "name" : "INStartAudioCallIntentResponse",
          "url" : "https:\/\/developer.apple.com\/documentation\/Intents\/INStartAudioCallIntentResponse"
        }
      ],
      "title" : "Audio Call Initiation"
    },
    {
      "content" : "",
      "items" : [
        {
          "name" : "NSObjectProtocol"
        }
      ],
      "title" : "Inherits From"
    }
  ],
  "source" : "appleJSON",
  "title" : "INStartAudioCallIntentHandling",
  "url" : "https:\/\/developer.apple.com\/documentation\/Intents\/INStartAudioCallIntentHandling"
}