{
  "abstract" : "An amount of money to transfer during a financial transaction.",
  "codeExamples" : [

  ],
  "conformsTo" : [
    "CVarArg",
    "CustomDebugStringConvertible",
    "CustomStringConvertible",
    "Equatable",
    "Hashable",
    "NSCoding",
    "NSCopying",
    "NSObjectProtocol",
    "NSSecureCoding"
  ],
  "contentHash" : "689e1618dd2fa0b8f908b1804242fe3830113259866a0d8ee092e8b013955b67",
  "crawledAt" : "2025-12-05T19:34:05Z",
  "declaration" : {
    "code" : "class INCurrencyAmount",
    "language" : "swift"
  },
  "id" : "09602A9F-3637-45BC-8565-E64F452783D9",
  "kind" : "class",
  "language" : "swift",
  "module" : "Intents",
  "overview" : "## Overview\n\nAn [doc:\/\/com.apple.sirikit\/documentation\/Intents\/INCurrencyAmount] object encapsulates a monetary value and the currency used to express that value. You use these objects to specify payment amounts when handling intents that involve the transfer of money.",
  "platforms" : [
    "iOS",
    "iPadOS",
    "Mac Catalyst",
    "macOS",
    "visionOS",
    "watchOS"
  ],
  "rawMarkdown" : "---\nsource: https:\/\/developer.apple.com\/documentation\/Intents\/INCurrencyAmount\ncrawled: 2025-12-05T19:34:05Z\n---\n\n# INCurrencyAmount\n\n**Class**\n\nAn amount of money to transfer during a financial transaction.\n\n## Declaration\n\n```swift\nclass INCurrencyAmount\n```\n\n## Overview\n\nAn [doc:\/\/com.apple.sirikit\/documentation\/Intents\/INCurrencyAmount] object encapsulates a monetary value and the currency used to express that value. You use these objects to specify payment amounts when handling intents that involve the transfer of money.\n\n## Initializing a Currency Amount Object\n\n- **init(amount:currencyCode:)**: Initializes a currency amount object with the specified values.\n\n## Getting the Currency Information\n\n- **amount**: The monetary amount associated with the currency.\n- **currencyCode**: The ISO 4217 currency code that applies to the monetary amount.\n\n## Monetary\n\n- **INPriceRange**: Price information, as a range of possible values.\n\n## Inherits From\n\n- NSObject\n\n## Conforms To\n\n- CVarArg\n- CustomDebugStringConvertible\n- CustomStringConvertible\n- Equatable\n- Hashable\n- NSCoding\n- NSCopying\n- NSObjectProtocol\n- NSSecureCoding\n\n",
  "sections" : [
    {
      "content" : "",
      "items" : [
        {
          "description" : "Initializes a currency amount object with the specified values.",
          "name" : "init(amount:currencyCode:)",
          "url" : "https:\/\/developer.apple.com\/documentation\/Intents\/INCurrencyAmount\/init(amount:currencyCode:)"
        }
      ],
      "title" : "Initializing a Currency Amount Object"
    },
    {
      "content" : "",
      "items" : [
        {
          "description" : "The monetary amount associated with the currency.",
          "name" : "amount",
          "url" : "https:\/\/developer.apple.com\/documentation\/Intents\/INCurrencyAmount\/amount"
        },
        {
          "description" : "The ISO 4217 currency code that applies to the monetary amount.",
          "name" : "currencyCode",
          "url" : "https:\/\/developer.apple.com\/documentation\/Intents\/INCurrencyAmount\/currencyCode"
        }
      ],
      "title" : "Getting the Currency Information"
    },
    {
      "content" : "",
      "items" : [
        {
          "description" : "Price information, as a range of possible values.",
          "name" : "INPriceRange",
          "url" : "https:\/\/developer.apple.com\/documentation\/Intents\/INPriceRange"
        }
      ],
      "title" : "Monetary"
    },
    {
      "content" : "",
      "items" : [
        {
          "name" : "NSObject"
        }
      ],
      "title" : "Inherits From"
    }
  ],
  "source" : "appleJSON",
  "title" : "INCurrencyAmount",
  "url" : "https:\/\/developer.apple.com\/documentation\/Intents\/INCurrencyAmount"
}