{
  "abstract" : "Your app’s response to a set radio station intent.",
  "codeExamples" : [

  ],
  "conformsTo" : [
    "CVarArg",
    "CustomDebugStringConvertible",
    "CustomStringConvertible",
    "Equatable",
    "Hashable",
    "NSCoding",
    "NSCopying",
    "NSObjectProtocol",
    "NSSecureCoding"
  ],
  "contentHash" : "c0623f74fffc59d488a66df45967c6fe6c5f7d5adc1c7b0b894bb9559df51bcb",
  "crawledAt" : "2025-12-05T18:02:14Z",
  "declaration" : {
    "code" : "class INSetRadioStationIntentResponse",
    "language" : "swift"
  },
  "id" : "84CDDFBF-F53C-43D2-AD43-A989C416E64B",
  "kind" : "class",
  "language" : "swift",
  "module" : "Intents",
  "overview" : "## Overview\n\nAn [doc:\/\/com.apple.sirikit\/documentation\/Intents\/INSetRadioStationIntentResponse] object contains the status of changing the currently playing radio station. You create instances of this class when confirming or handling a set radio station intent.\n\nYou create an [doc:\/\/com.apple.sirikit\/documentation\/Intents\/INSetRadioStationIntentResponse] object in the [doc:\/\/com.apple.sirikit\/documentation\/Intents\/INSetRadioStationIntentHandling\/confirm(intent:completion:)] and [doc:\/\/com.apple.sirikit\/documentation\/Intents\/INSetRadioStationIntentHandling\/handle(intent:completion:)] methods of your set seat settings in car handler object. For more information about implementing your handler object, see [doc:\/\/com.apple.sirikit\/documentation\/Intents\/INSetRadioStationIntentHandling].",
  "platforms" : [
    "iOS",
    "iPadOS",
    "Mac Catalyst",
    "visionOS"
  ],
  "rawMarkdown" : "---\nsource: https:\/\/developer.apple.com\/documentation\/Intents\/INSetRadioStationIntentResponse\ncrawled: 2025-12-05T18:02:14Z\n---\n\n# INSetRadioStationIntentResponse\n\n**Class**\n\nYour app’s response to a set radio station intent.\n\n## Declaration\n\n```swift\nclass INSetRadioStationIntentResponse\n```\n\n## Overview\n\nAn [doc:\/\/com.apple.sirikit\/documentation\/Intents\/INSetRadioStationIntentResponse] object contains the status of changing the currently playing radio station. You create instances of this class when confirming or handling a set radio station intent.\n\nYou create an [doc:\/\/com.apple.sirikit\/documentation\/Intents\/INSetRadioStationIntentResponse] object in the [doc:\/\/com.apple.sirikit\/documentation\/Intents\/INSetRadioStationIntentHandling\/confirm(intent:completion:)] and [doc:\/\/com.apple.sirikit\/documentation\/Intents\/INSetRadioStationIntentHandling\/handle(intent:completion:)] methods of your set seat settings in car handler object. For more information about implementing your handler object, see [doc:\/\/com.apple.sirikit\/documentation\/Intents\/INSetRadioStationIntentHandling].\n\n## Initializing the Response Object\n\n- **init(code:userActivity:)**: Initializes the response object with the specified code and user activity object.\n\n## Getting the Response Code\n\n- **code**: The code indicating whether you successfully handled the intent.\n- **INSetRadioStationIntentResponseCode**: Constants indicating the state of the response.\n\n## CarPlay Radio Station Settings\n\n- **INSetRadioStationIntentHandling**: The handler interface for changing a radio station.\n- **INSetRadioStationIntent**: A request to change the current radio station.\n\n## Inherits From\n\n- INIntentResponse\n\n## Conforms To\n\n- CVarArg\n- CustomDebugStringConvertible\n- CustomStringConvertible\n- Equatable\n- Hashable\n- NSCoding\n- NSCopying\n- NSObjectProtocol\n- NSSecureCoding\n\n",
  "sections" : [
    {
      "content" : "",
      "items" : [
        {
          "description" : "Initializes the response object with the specified code and user activity object.",
          "name" : "init(code:userActivity:)",
          "url" : "https:\/\/developer.apple.com\/documentation\/Intents\/INSetRadioStationIntentResponse\/init(code:userActivity:)"
        }
      ],
      "title" : "Initializing the Response Object"
    },
    {
      "content" : "",
      "items" : [
        {
          "description" : "The code indicating whether you successfully handled the intent.",
          "name" : "code",
          "url" : "https:\/\/developer.apple.com\/documentation\/Intents\/INSetRadioStationIntentResponse\/code"
        },
        {
          "description" : "Constants indicating the state of the response.",
          "name" : "INSetRadioStationIntentResponseCode",
          "url" : "https:\/\/developer.apple.com\/documentation\/Intents\/INSetRadioStationIntentResponseCode"
        }
      ],
      "title" : "Getting the Response Code"
    },
    {
      "content" : "",
      "items" : [
        {
          "description" : "The handler interface for changing a radio station.",
          "name" : "INSetRadioStationIntentHandling",
          "url" : "https:\/\/developer.apple.com\/documentation\/Intents\/INSetRadioStationIntentHandling"
        },
        {
          "description" : "A request to change the current radio station.",
          "name" : "INSetRadioStationIntent",
          "url" : "https:\/\/developer.apple.com\/documentation\/Intents\/INSetRadioStationIntent"
        }
      ],
      "title" : "CarPlay Radio Station Settings"
    },
    {
      "content" : "",
      "items" : [
        {
          "name" : "INIntentResponse"
        }
      ],
      "title" : "Inherits From"
    }
  ],
  "source" : "appleJSON",
  "title" : "INSetRadioStationIntentResponse",
  "url" : "https:\/\/developer.apple.com\/documentation\/Intents\/INSetRadioStationIntentResponse"
}