{
  "abstract" : "The identifying information for a user of your app.",
  "codeExamples" : [

  ],
  "conformsTo" : [
    "CVarArg",
    "CustomDebugStringConvertible",
    "CustomStringConvertible",
    "Equatable",
    "Hashable",
    "NSCoding",
    "NSCopying",
    "NSObjectProtocol",
    "NSSecureCoding"
  ],
  "contentHash" : "f66a6b5781a8bc74a9b08eb6e397cdd57267b604106d69e41dd839db2be41c65",
  "crawledAt" : "2025-12-05T19:34:01Z",
  "declaration" : {
    "code" : "class INPersonHandle",
    "language" : "swift"
  },
  "id" : "DC4CDB00-1061-4703-8C23-CD215610DB0E",
  "kind" : "class",
  "language" : "swift",
  "module" : "Intents",
  "overview" : "## Overview\n\nAn [doc:\/\/com.apple.sirikit\/documentation\/Intents\/INPersonHandle] object contains information that you use to uniquely identify a user of your app. When resolving a person associated with an intent, you might create instances of this class and add them to an [doc:\/\/com.apple.sirikit\/documentation\/Intents\/INPerson] object when resolving an intent involving that person. Handles contain unique information such as an email address or phone number.",
  "platforms" : [
    "iOS",
    "iPadOS",
    "Mac Catalyst",
    "macOS",
    "visionOS",
    "watchOS"
  ],
  "rawMarkdown" : "---\nsource: https:\/\/developer.apple.com\/documentation\/Intents\/INPersonHandle\ncrawled: 2025-12-05T19:34:01Z\n---\n\n# INPersonHandle\n\n**Class**\n\nThe identifying information for a user of your app.\n\n## Declaration\n\n```swift\nclass INPersonHandle\n```\n\n## Overview\n\nAn [doc:\/\/com.apple.sirikit\/documentation\/Intents\/INPersonHandle] object contains information that you use to uniquely identify a user of your app. When resolving a person associated with an intent, you might create instances of this class and add them to an [doc:\/\/com.apple.sirikit\/documentation\/Intents\/INPerson] object when resolving an intent involving that person. Handles contain unique information such as an email address or phone number.\n\n## Initializing a Person Handle\n\n- **init(value:type:label:)**: Initializes and returns a person handle with the specified data.\n- **init(value:type:)**: Initializes and returns a person handle with the specified data.\n\n## Getting the Handle Information\n\n- **type**: The type of information contained in the handle.\n- **value**: The data for the handle.\n- **label**: A standard label that describes the meaning of the information.\n\n## Constants\n\n- **INPersonHandleType**: Constants indicating the types of data that can be associated with a person handle.\n\n## Contacts\n\n- **INPerson**: Information about a person participating in a SiriKit interaction.\n- **INPersonHandleLabel**: Constants describing how the person handle relates to the user.\n\n## Inherits From\n\n- NSObject\n\n## Conforms To\n\n- CVarArg\n- CustomDebugStringConvertible\n- CustomStringConvertible\n- Equatable\n- Hashable\n- NSCoding\n- NSCopying\n- NSObjectProtocol\n- NSSecureCoding\n\n",
  "sections" : [
    {
      "content" : "",
      "items" : [
        {
          "description" : "Initializes and returns a person handle with the specified data.",
          "name" : "init(value:type:label:)",
          "url" : "https:\/\/developer.apple.com\/documentation\/Intents\/INPersonHandle\/init(value:type:label:)"
        },
        {
          "description" : "Initializes and returns a person handle with the specified data.",
          "name" : "init(value:type:)",
          "url" : "https:\/\/developer.apple.com\/documentation\/Intents\/INPersonHandle\/init(value:type:)"
        }
      ],
      "title" : "Initializing a Person Handle"
    },
    {
      "content" : "",
      "items" : [
        {
          "description" : "The type of information contained in the handle.",
          "name" : "type",
          "url" : "https:\/\/developer.apple.com\/documentation\/Intents\/INPersonHandle\/type"
        },
        {
          "description" : "The data for the handle.",
          "name" : "value",
          "url" : "https:\/\/developer.apple.com\/documentation\/Intents\/INPersonHandle\/value"
        },
        {
          "description" : "A standard label that describes the meaning of the information.",
          "name" : "label",
          "url" : "https:\/\/developer.apple.com\/documentation\/Intents\/INPersonHandle\/label"
        }
      ],
      "title" : "Getting the Handle Information"
    },
    {
      "content" : "",
      "items" : [
        {
          "description" : "Constants indicating the types of data that can be associated with a person handle.",
          "name" : "INPersonHandleType",
          "url" : "https:\/\/developer.apple.com\/documentation\/Intents\/INPersonHandleType"
        }
      ],
      "title" : "Constants"
    },
    {
      "content" : "",
      "items" : [
        {
          "description" : "Information about a person participating in a SiriKit interaction.",
          "name" : "INPerson",
          "url" : "https:\/\/developer.apple.com\/documentation\/Intents\/INPerson"
        },
        {
          "description" : "Constants describing how the person handle relates to the user.",
          "name" : "INPersonHandleLabel",
          "url" : "https:\/\/developer.apple.com\/documentation\/Intents\/INPersonHandleLabel"
        }
      ],
      "title" : "Contacts"
    },
    {
      "content" : "",
      "items" : [
        {
          "name" : "NSObject"
        }
      ],
      "title" : "Inherits From"
    }
  ],
  "source" : "appleJSON",
  "title" : "INPersonHandle",
  "url" : "https:\/\/developer.apple.com\/documentation\/Intents\/INPersonHandle"
}