{
  "abstract" : "An interface for adopting all of the protocols in the payments domain.",
  "codeExamples" : [

  ],
  "contentHash" : "4ba764c97641321553ecf76d21bca23a90cb6b686be87b012dab2f94adc18ec5",
  "crawledAt" : "2025-12-05T18:08:51Z",
  "declaration" : {
    "code" : "protocol INPaymentsDomainHandling : INPayBillIntentHandling, INRequestPaymentIntentHandling, INSearchForAccountsIntentHandling, INSearchForBillsIntentHandling, INSendPaymentIntentHandling, INTransferMoneyIntentHandling",
    "language" : "swift"
  },
  "id" : "7C02EB49-45F5-47CF-90D7-C3F5B5D60C3B",
  "kind" : "protocol",
  "language" : "swift",
  "module" : "Intents",
  "overview" : "## Overview\n\nThe [doc:\/\/com.apple.sirikit\/documentation\/Intents\/INPaymentsDomainHandling] protocol is a convenience protocol that adopts all of the protocols used to handle payment-related intents. When your app adopts all of the protocols associated with payments, you can adopt this one protocol instead of adopting the [doc:\/\/com.apple.sirikit\/documentation\/Intents\/INSendPaymentIntentHandling], [doc:\/\/com.apple.sirikit\/documentation\/Intents\/INRequestPaymentIntentHandling], [doc:\/\/com.apple.sirikit\/documentation\/Intents\/INPayBillIntentHandling], [doc:\/\/com.apple.sirikit\/documentation\/Intents\/INSearchForBillsIntentHandling], [doc:\/\/com.apple.sirikit\/documentation\/Intents\/INSearchForAccountsIntentHandling], and [doc:\/\/com.apple.sirikit\/documentation\/Intents\/INTransferMoneyIntentHandling] protocols separately.\n\nAn object that adopts this protocol must be able to respond to the following intents:\n\nYour handler object must be prepared to resolve any parameters associated with these intents and to confirm and handle the requests. When confirming and handling a request, you provide the response object that matches the specified intent.",
  "platforms" : [
    "iOS",
    "iPadOS",
    "Mac Catalyst",
    "visionOS"
  ],
  "rawMarkdown" : "---\nsource: https:\/\/developer.apple.com\/documentation\/Intents\/INPaymentsDomainHandling\ncrawled: 2025-12-05T18:08:51Z\n---\n\n# INPaymentsDomainHandling\n\n**Protocol**\n\nAn interface for adopting all of the protocols in the payments domain.\n\n## Declaration\n\n```swift\nprotocol INPaymentsDomainHandling : INPayBillIntentHandling, INRequestPaymentIntentHandling, INSearchForAccountsIntentHandling, INSearchForBillsIntentHandling, INSendPaymentIntentHandling, INTransferMoneyIntentHandling\n```\n\n```swift\nprotocol INPaymentsDomainHandling : INRequestPaymentIntentHandling, INSendPaymentIntentHandling\n```\n\n## Overview\n\nThe [doc:\/\/com.apple.sirikit\/documentation\/Intents\/INPaymentsDomainHandling] protocol is a convenience protocol that adopts all of the protocols used to handle payment-related intents. When your app adopts all of the protocols associated with payments, you can adopt this one protocol instead of adopting the [doc:\/\/com.apple.sirikit\/documentation\/Intents\/INSendPaymentIntentHandling], [doc:\/\/com.apple.sirikit\/documentation\/Intents\/INRequestPaymentIntentHandling], [doc:\/\/com.apple.sirikit\/documentation\/Intents\/INPayBillIntentHandling], [doc:\/\/com.apple.sirikit\/documentation\/Intents\/INSearchForBillsIntentHandling], [doc:\/\/com.apple.sirikit\/documentation\/Intents\/INSearchForAccountsIntentHandling], and [doc:\/\/com.apple.sirikit\/documentation\/Intents\/INTransferMoneyIntentHandling] protocols separately.\n\nAn object that adopts this protocol must be able to respond to the following intents:\n\n- [doc:\/\/com.apple.sirikit\/documentation\/Intents\/INRequestPaymentIntent], a request for a payment from another user.\n- [doc:\/\/com.apple.sirikit\/documentation\/Intents\/INSendPaymentIntent], a request to send a payment to another user.\n- [doc:\/\/com.apple.sirikit\/documentation\/Intents\/INPayBillIntent], a request to pay a bill.\n- [doc:\/\/com.apple.sirikit\/documentation\/Intents\/INSearchForBillsIntent], a request to search for bills to pay.\n- [doc:\/\/com.apple.sirikit\/documentation\/Intents\/INSearchForAccountsIntent], a request to provide a list of the userâ€™s accounts.\n- [doc:\/\/com.apple.sirikit\/documentation\/Intents\/INTransferMoneyIntent], a request to transfer money between the designated accounts.\n\nYour handler object must be prepared to resolve any parameters associated with these intents and to confirm and handle the requests. When confirming and handling a request, you provide the response object that matches the specified intent.\n\n## Domain-Handling Protocols\n\n- **INMessagesDomainHandling**: An interface for adopting all of the protocols in the messages domain.\n- **INNotebookDomainHandling**: An interface for adopting all of the protocols in the lists and notes domain.\n- **INWorkoutsDomainHandling**: An interface for adopting all of the protocols in the workouts domain.\n- **INCallsDomainHandling**: Provides a convenient way to adopt all of the protocols in the VoIP calling domain.\n- **INVisualCodeDomainHandling**: An interface for adopting all of the protocols in the visual codes domain.\n- **INPhotosDomainHandling**: An interface for adopting all of the protocols in the photos domain.\n- **INRidesharingDomainHandling**: An interface for adopting all of the protocols in the ride-booking domain.\n- **INCarCommandsDomainHandling**: An interface for adopting all the handling protocols in the car commands domain.\n- **INCarPlayDomainHandling**: An interface for adopting all of the protocols in the CarPlay domain.\n- **INRadioDomainHandling**: An interface for adopting all of the protocols in the radio domain.\n\n## Inherits From\n\n- INPayBillIntentHandling\n- INRequestPaymentIntentHandling\n- INSearchForAccountsIntentHandling\n- INSearchForBillsIntentHandling\n- INSendPaymentIntentHandling\n- INTransferMoneyIntentHandling\n- NSObjectProtocol\n\n",
  "sections" : [
    {
      "content" : "",
      "items" : [
        {
          "description" : "An interface for adopting all of the protocols in the messages domain.",
          "name" : "INMessagesDomainHandling",
          "url" : "https:\/\/developer.apple.com\/documentation\/Intents\/INMessagesDomainHandling"
        },
        {
          "description" : "An interface for adopting all of the protocols in the lists and notes domain.",
          "name" : "INNotebookDomainHandling",
          "url" : "https:\/\/developer.apple.com\/documentation\/Intents\/INNotebookDomainHandling"
        },
        {
          "description" : "An interface for adopting all of the protocols in the workouts domain.",
          "name" : "INWorkoutsDomainHandling",
          "url" : "https:\/\/developer.apple.com\/documentation\/Intents\/INWorkoutsDomainHandling"
        },
        {
          "description" : "Provides a convenient way to adopt all of the protocols in the VoIP calling domain.",
          "name" : "INCallsDomainHandling",
          "url" : "https:\/\/developer.apple.com\/documentation\/Intents\/INCallsDomainHandling"
        },
        {
          "description" : "An interface for adopting all of the protocols in the visual codes domain.",
          "name" : "INVisualCodeDomainHandling",
          "url" : "https:\/\/developer.apple.com\/documentation\/Intents\/INVisualCodeDomainHandling"
        },
        {
          "description" : "An interface for adopting all of the protocols in the photos domain.",
          "name" : "INPhotosDomainHandling",
          "url" : "https:\/\/developer.apple.com\/documentation\/Intents\/INPhotosDomainHandling"
        },
        {
          "description" : "An interface for adopting all of the protocols in the ride-booking domain.",
          "name" : "INRidesharingDomainHandling",
          "url" : "https:\/\/developer.apple.com\/documentation\/Intents\/INRidesharingDomainHandling"
        },
        {
          "description" : "An interface for adopting all the handling protocols in the car commands domain.",
          "name" : "INCarCommandsDomainHandling",
          "url" : "https:\/\/developer.apple.com\/documentation\/Intents\/INCarCommandsDomainHandling"
        },
        {
          "description" : "An interface for adopting all of the protocols in the CarPlay domain.",
          "name" : "INCarPlayDomainHandling",
          "url" : "https:\/\/developer.apple.com\/documentation\/Intents\/INCarPlayDomainHandling"
        },
        {
          "description" : "An interface for adopting all of the protocols in the radio domain.",
          "name" : "INRadioDomainHandling",
          "url" : "https:\/\/developer.apple.com\/documentation\/Intents\/INRadioDomainHandling"
        }
      ],
      "title" : "Domain-Handling Protocols"
    },
    {
      "content" : "",
      "items" : [
        {
          "name" : "INPayBillIntentHandling"
        },
        {
          "name" : "INRequestPaymentIntentHandling"
        },
        {
          "name" : "INSearchForAccountsIntentHandling"
        },
        {
          "name" : "INSearchForBillsIntentHandling"
        },
        {
          "name" : "INSendPaymentIntentHandling"
        },
        {
          "name" : "INTransferMoneyIntentHandling"
        },
        {
          "name" : "NSObjectProtocol"
        }
      ],
      "title" : "Inherits From"
    }
  ],
  "source" : "appleJSON",
  "title" : "INPaymentsDomainHandling",
  "url" : "https:\/\/developer.apple.com\/documentation\/Intents\/INPaymentsDomainHandling"
}