{
  "abstract" : "The handler interface booking a reservation that the user selected.",
  "codeExamples" : [

  ],
  "contentHash" : "edbcbf4c22c62c6dc75d02df882959aaae06640377f88c2cade4014447727ac7",
  "crawledAt" : "2025-12-05T18:05:31Z",
  "declaration" : {
    "code" : "protocol INBookRestaurantReservationIntentHandling : NSObjectProtocol",
    "language" : "swift"
  },
  "id" : "451AFF67-6D60-4C20-9C25-ADC2193E26C6",
  "kind" : "protocol",
  "language" : "swift",
  "module" : "Intents",
  "overview" : "## Overview\n\nUse the methods of the [doc:\/\/com.apple.sirikit\/documentation\/Intents\/INBookRestaurantReservationIntentHandling] protocol to resolve, confirm, and handle requests to book a reservation based on the provided information. The system delivers an [doc:\/\/com.apple.sirikit\/documentation\/Intents\/INBookRestaurantReservationIntent] object to your handler with the reservation details, including the restaurant, date, party size, and any special offers selected by the user. Use that intent object to complete the reservation in your system and to communicate the reservation details to the restaurant itself.\n\nMaps does not require you to resolve or confirm the contents of a get available restaurant reservation bookings intent before handling it. User interactions drive the selection of data in Maps, ensuring that the data Maps places into an intent object is already valid.",
  "platforms" : [
    "iOS",
    "iPadOS",
    "Mac Catalyst",
    "visionOS"
  ],
  "rawMarkdown" : "---\nsource: https:\/\/developer.apple.com\/documentation\/Intents\/INBookRestaurantReservationIntentHandling\ncrawled: 2025-12-05T18:05:31Z\n---\n\n# INBookRestaurantReservationIntentHandling\n\n**Protocol**\n\nThe handler interface booking a reservation that the user selected.\n\n## Declaration\n\n```swift\nprotocol INBookRestaurantReservationIntentHandling : NSObjectProtocol\n```\n\n## Overview\n\nUse the methods of the [doc:\/\/com.apple.sirikit\/documentation\/Intents\/INBookRestaurantReservationIntentHandling] protocol to resolve, confirm, and handle requests to book a reservation based on the provided information. The system delivers an [doc:\/\/com.apple.sirikit\/documentation\/Intents\/INBookRestaurantReservationIntent] object to your handler with the reservation details, including the restaurant, date, party size, and any special offers selected by the user. Use that intent object to complete the reservation in your system and to communicate the reservation details to the restaurant itself.\n\nMaps does not require you to resolve or confirm the contents of a get available restaurant reservation bookings intent before handling it. User interactions drive the selection of data in Maps, ensuring that the data Maps places into an intent object is already valid.\n\n## Resolving the Intent Parameters\n\n- **resolveRestaurant(for:completion:)**: Resolves the restaurant associated with the reservation.\n- **resolveBookingDateComponents(for:completion:)**: Resolves the date of the reservation.\n- **resolvePartySize(for:completion:)**: Resolves the number of people in the user’s party.\n- **resolveGuest(for:completion:)**: Resolves the identity of the guest associated with the reservation.\n- **resolveGuestProvidedSpecialRequestText(for:completion:)**: Resolves any special requests made in connection with the reservation.\n\n## Confirming the Response\n\n- **confirm(bookRestaurantReservation:completion:)**: Confirms whether you can complete the reservation.\n\n## Handling the Intent\n\n- **handle(bookRestaurantReservation:completion:)**: Handles completing the user’s reservation.\n\n## Book Restaurant Reservation\n\n- **INBookRestaurantReservationIntent**: A request to create a reservation at the specified restaurant.\n- **INBookRestaurantReservationIntentResponse**: Your app’s response to a book restaurant reservation intent.\n\n## Inherits From\n\n- NSObjectProtocol\n\n",
  "sections" : [
    {
      "content" : "",
      "items" : [
        {
          "description" : "Resolves the restaurant associated with the reservation.",
          "name" : "resolveRestaurant(for:completion:)",
          "url" : "https:\/\/developer.apple.com\/documentation\/Intents\/INBookRestaurantReservationIntentHandling\/resolveRestaurant(for:completion:)"
        },
        {
          "description" : "Resolves the date of the reservation.",
          "name" : "resolveBookingDateComponents(for:completion:)",
          "url" : "https:\/\/developer.apple.com\/documentation\/Intents\/INBookRestaurantReservationIntentHandling\/resolveBookingDateComponents(for:completion:)"
        },
        {
          "description" : "Resolves the number of people in the user’s party.",
          "name" : "resolvePartySize(for:completion:)",
          "url" : "https:\/\/developer.apple.com\/documentation\/Intents\/INBookRestaurantReservationIntentHandling\/resolvePartySize(for:completion:)"
        },
        {
          "description" : "Resolves the identity of the guest associated with the reservation.",
          "name" : "resolveGuest(for:completion:)",
          "url" : "https:\/\/developer.apple.com\/documentation\/Intents\/INBookRestaurantReservationIntentHandling\/resolveGuest(for:completion:)"
        },
        {
          "description" : "Resolves any special requests made in connection with the reservation.",
          "name" : "resolveGuestProvidedSpecialRequestText(for:completion:)",
          "url" : "https:\/\/developer.apple.com\/documentation\/Intents\/INBookRestaurantReservationIntentHandling\/resolveGuestProvidedSpecialRequestText(for:completion:)"
        }
      ],
      "title" : "Resolving the Intent Parameters"
    },
    {
      "content" : "",
      "items" : [
        {
          "description" : "Confirms whether you can complete the reservation.",
          "name" : "confirm(bookRestaurantReservation:completion:)",
          "url" : "https:\/\/developer.apple.com\/documentation\/Intents\/INBookRestaurantReservationIntentHandling\/confirm(bookRestaurantReservation:completion:)"
        }
      ],
      "title" : "Confirming the Response"
    },
    {
      "content" : "",
      "items" : [
        {
          "description" : "Handles completing the user’s reservation.",
          "name" : "handle(bookRestaurantReservation:completion:)",
          "url" : "https:\/\/developer.apple.com\/documentation\/Intents\/INBookRestaurantReservationIntentHandling\/handle(bookRestaurantReservation:completion:)"
        }
      ],
      "title" : "Handling the Intent"
    },
    {
      "content" : "",
      "items" : [
        {
          "description" : "A request to create a reservation at the specified restaurant.",
          "name" : "INBookRestaurantReservationIntent",
          "url" : "https:\/\/developer.apple.com\/documentation\/Intents\/INBookRestaurantReservationIntent"
        },
        {
          "description" : "Your app’s response to a book restaurant reservation intent.",
          "name" : "INBookRestaurantReservationIntentResponse",
          "url" : "https:\/\/developer.apple.com\/documentation\/Intents\/INBookRestaurantReservationIntentResponse"
        }
      ],
      "title" : "Book Restaurant Reservation"
    },
    {
      "content" : "",
      "items" : [
        {
          "name" : "NSObjectProtocol"
        }
      ],
      "title" : "Inherits From"
    }
  ],
  "source" : "appleJSON",
  "title" : "INBookRestaurantReservationIntentHandling",
  "url" : "https:\/\/developer.apple.com\/documentation\/Intents\/INBookRestaurantReservationIntentHandling"
}