{
  "abstract" : "Resolves the requested climate zone.",
  "codeExamples" : [

  ],
  "contentHash" : "02a1c2cb3d9eaa530f06a4f133ca6bd8978733bbb52e22314f1cd00e8e5b2b48",
  "crawledAt" : "2025-12-07T20:38:36Z",
  "declaration" : {
    "code" : "optional func resolveClimateZone(for intent: INSetClimateSettingsInCarIntent, with completion: @escaping (INCarSeatResolutionResult) -> Void)",
    "language" : "swift"
  },
  "id" : "F1E13BB7-CEB3-474D-85B2-C66A8C864DCE",
  "kind" : "method",
  "language" : "swift",
  "module" : "Intents",
  "overview" : "## Discussion\n\nImplement this method to resolve the climate zone. Use the intent object to identify the climate zone specified by the user. If the car has more than one climate zone, use the intent’s [doc:\/\/com.apple.sirikit\/documentation\/Intents\/INSetClimateSettingsInCarIntent\/climateZone] property to identify the correct zone.",
  "platforms" : [
    "iOS",
    "iPadOS",
    "Mac Catalyst",
    "visionOS"
  ],
  "rawMarkdown" : "---\nsource: https:\/\/developer.apple.com\/documentation\/Intents\/INSetClimateSettingsInCarIntentHandling\/resolveClimateZone(for:with:)\ncrawled: 2025-12-07T20:38:36Z\n---\n\n# resolveClimateZone(for:with:)\n\n**Instance Method**\n\nResolves the requested climate zone.\n\n## Declaration\n\n```swift\noptional func resolveClimateZone(for intent: INSetClimateSettingsInCarIntent, with completion: @escaping (INCarSeatResolutionResult) -> Void)\n```\n\n```swift\noptional func resolveClimateZone(for intent: INSetClimateSettingsInCarIntent) async -> INCarSeatResolutionResult\n```\n\n## Parameters\n\n- **intent**: The intent object containing details about the user’s request. Use this object to get the initial information, if any, provided by the user.\n- **completion**: The block to execute with the resolution. You must execute this block at some point during your implementation of this method. This block has no return value and takes the following parameter:\n\n\n\n## Discussion\n\nImplement this method to resolve the climate zone. Use the intent object to identify the climate zone specified by the user. If the car has more than one climate zone, use the intent’s [doc:\/\/com.apple.sirikit\/documentation\/Intents\/INSetClimateSettingsInCarIntent\/climateZone] property to identify the correct zone.\n\n## Resolving the Intent Parameters\n\n- **resolveEnableFan(for:with:)**: Resolves whether you can enable the car’s fan.\n- **resolveEnableAirConditioner(for:with:)**: Resolves whether you can enable the air conditioner.\n- **resolveEnableClimateControl(for:with:)**: Resolves whether you can enable the climate control system.\n- **resolveEnableAutoMode(for:with:)**: Resolves whether you can enable automatic mode for the car’s climate control.\n- **resolveAirCirculationMode(for:with:)**: Resolves the requested air circulation mode.\n- **resolveFanSpeedIndex(for:with:)**: Resolves the requested fan speed index.\n- **resolveFanSpeedPercentage(for:with:)**: Resolves the requested fan speed percentage.\n- **resolveRelativeFanSpeedSetting(for:with:)**: Resolves the requested relative qualifier for the fan speed.\n- **resolveTemperature(for:with:)**: Resolves the requested temperature value.\n- **resolveRelativeTemperatureSetting(for:with:)**: Resolves the requested relative qualifier for the temperature change.\n- **resolveCarName(for:with:)**: Resolves the car name.\n\n",
  "sections" : [
    {
      "content" : "",
      "items" : [
        {
          "description" : "Resolves whether you can enable the car’s fan.",
          "name" : "resolveEnableFan(for:with:)",
          "url" : "https:\/\/developer.apple.com\/documentation\/Intents\/INSetClimateSettingsInCarIntentHandling\/resolveEnableFan(for:with:)"
        },
        {
          "description" : "Resolves whether you can enable the air conditioner.",
          "name" : "resolveEnableAirConditioner(for:with:)",
          "url" : "https:\/\/developer.apple.com\/documentation\/Intents\/INSetClimateSettingsInCarIntentHandling\/resolveEnableAirConditioner(for:with:)"
        },
        {
          "description" : "Resolves whether you can enable the climate control system.",
          "name" : "resolveEnableClimateControl(for:with:)",
          "url" : "https:\/\/developer.apple.com\/documentation\/Intents\/INSetClimateSettingsInCarIntentHandling\/resolveEnableClimateControl(for:with:)"
        },
        {
          "description" : "Resolves whether you can enable automatic mode for the car’s climate control.",
          "name" : "resolveEnableAutoMode(for:with:)",
          "url" : "https:\/\/developer.apple.com\/documentation\/Intents\/INSetClimateSettingsInCarIntentHandling\/resolveEnableAutoMode(for:with:)"
        },
        {
          "description" : "Resolves the requested air circulation mode.",
          "name" : "resolveAirCirculationMode(for:with:)",
          "url" : "https:\/\/developer.apple.com\/documentation\/Intents\/INSetClimateSettingsInCarIntentHandling\/resolveAirCirculationMode(for:with:)"
        },
        {
          "description" : "Resolves the requested fan speed index.",
          "name" : "resolveFanSpeedIndex(for:with:)",
          "url" : "https:\/\/developer.apple.com\/documentation\/Intents\/INSetClimateSettingsInCarIntentHandling\/resolveFanSpeedIndex(for:with:)"
        },
        {
          "description" : "Resolves the requested fan speed percentage.",
          "name" : "resolveFanSpeedPercentage(for:with:)",
          "url" : "https:\/\/developer.apple.com\/documentation\/Intents\/INSetClimateSettingsInCarIntentHandling\/resolveFanSpeedPercentage(for:with:)"
        },
        {
          "description" : "Resolves the requested relative qualifier for the fan speed.",
          "name" : "resolveRelativeFanSpeedSetting(for:with:)",
          "url" : "https:\/\/developer.apple.com\/documentation\/Intents\/INSetClimateSettingsInCarIntentHandling\/resolveRelativeFanSpeedSetting(for:with:)"
        },
        {
          "description" : "Resolves the requested temperature value.",
          "name" : "resolveTemperature(for:with:)",
          "url" : "https:\/\/developer.apple.com\/documentation\/Intents\/INSetClimateSettingsInCarIntentHandling\/resolveTemperature(for:with:)"
        },
        {
          "description" : "Resolves the requested relative qualifier for the temperature change.",
          "name" : "resolveRelativeTemperatureSetting(for:with:)",
          "url" : "https:\/\/developer.apple.com\/documentation\/Intents\/INSetClimateSettingsInCarIntentHandling\/resolveRelativeTemperatureSetting(for:with:)"
        },
        {
          "description" : "Resolves the car name.",
          "name" : "resolveCarName(for:with:)",
          "url" : "https:\/\/developer.apple.com\/documentation\/Intents\/INSetClimateSettingsInCarIntentHandling\/resolveCarName(for:with:)"
        }
      ],
      "title" : "Resolving the Intent Parameters"
    }
  ],
  "source" : "appleJSON",
  "title" : "resolveClimateZone(for:with:)",
  "url" : "https:\/\/developer.apple.com\/documentation\/Intents\/INSetClimateSettingsInCarIntentHandling\/resolveClimateZone(for:with:)"
}