{
  "abstract" : "A request to create a reservation at the specified restaurant.",
  "codeExamples" : [

  ],
  "conformsTo" : [
    "CVarArg",
    "CustomDebugStringConvertible",
    "CustomStringConvertible",
    "Equatable",
    "Hashable",
    "INIntentSetImageKeyPath",
    "NSCoding",
    "NSCopying",
    "NSObjectProtocol",
    "NSSecureCoding"
  ],
  "contentHash" : "92861d2705ada5fd3e40070c9d1d89be28d552acb1080e0466ceae07891a5d3a",
  "crawledAt" : "2025-12-05T18:09:51Z",
  "declaration" : {
    "code" : "class INBookRestaurantReservationIntent",
    "language" : "swift"
  },
  "id" : "27BBBA4D-7614-4667-9F5B-7AC4A9E8BE66",
  "kind" : "class",
  "language" : "swift",
  "module" : "Intents",
  "overview" : "## Overview\n\nAn [doc:\/\/com.apple.sirikit\/documentation\/Intents\/INBookRestaurantReservationIntent] object asks you to book the reservation time selected by the user. Maps sends this intent to your Intents extension when the user selects a reservation time from the available options. Use this intent object to obtain the details of the reservation, including the time slot and any selected special offers. Use those details to confirm the reservation with the restaurant and store the results in your system.\n\nBooking a reservation is the last step in the reservation creation process. By the time the system delivers this intent to your Intents extension, the user has already had an opportunity to view a list of potential reservation times and configure the details of the reservation request. This intent object contains all of the final choices made by the user.\n\nTo handle this intent, the handler object in your Intents extension must adopt the [doc:\/\/com.apple.sirikit\/documentation\/Intents\/INBookRestaurantReservationIntentHandling] protocol. Your handler should resolve and confirm any parameters and create an [doc:\/\/com.apple.sirikit\/documentation\/Intents\/INBookRestaurantReservationIntentResponse] object with the status of the reservation.\n\n### Additional Intent Attributes\n\nThe following table lists additional attributes of this intent object:",
  "platforms" : [
    "iOS",
    "iPadOS",
    "Mac Catalyst",
    "visionOS"
  ],
  "rawMarkdown" : "---\nsource: https:\/\/developer.apple.com\/documentation\/intents\/inbookrestaurantreservationintent\ncrawled: 2025-12-05T18:09:51Z\n---\n\n# INBookRestaurantReservationIntent\n\n**Class**\n\nA request to create a reservation at the specified restaurant.\n\n## Declaration\n\n```swift\nclass INBookRestaurantReservationIntent\n```\n\n## Overview\n\nAn [doc:\/\/com.apple.sirikit\/documentation\/Intents\/INBookRestaurantReservationIntent] object asks you to book the reservation time selected by the user. Maps sends this intent to your Intents extension when the user selects a reservation time from the available options. Use this intent object to obtain the details of the reservation, including the time slot and any selected special offers. Use those details to confirm the reservation with the restaurant and store the results in your system.\n\nBooking a reservation is the last step in the reservation creation process. By the time the system delivers this intent to your Intents extension, the user has already had an opportunity to view a list of potential reservation times and configure the details of the reservation request. This intent object contains all of the final choices made by the user.\n\nTo handle this intent, the handler object in your Intents extension must adopt the [doc:\/\/com.apple.sirikit\/documentation\/Intents\/INBookRestaurantReservationIntentHandling] protocol. Your handler should resolve and confirm any parameters and create an [doc:\/\/com.apple.sirikit\/documentation\/Intents\/INBookRestaurantReservationIntentResponse] object with the status of the reservation.\n\n### Additional Intent Attributes\n\nThe following table lists additional attributes of this intent object:\n\n\n\n## Initializing the Intent Object\n\n- **init(restaurant:booking:partySize:bookingIdentifier:guest:selectedOffer:guestProvidedSpecialRequestText:)**: Initializes the intent object with the specified booking information.\n\n## Getting the Restaurant Information\n\n- **restaurant**: The restaurant to contact regarding the booking.\n\n## Getting the Booking Details\n\n- **bookingDateComponents**: The date and time of the reservation.\n- **bookingIdentifier**: The unique identifier associated with the initial reservation data.\n- **partySize**: The total number of people in the user’s party.\n- **guest**: The identity of the guest associated with the reservation.\n\n## Getting Special Requests and Offers\n\n- **guestProvidedSpecialRequestText**: Information about any special requests made by the user.\n- **selectedOffer**: The special offer, if any, selected by the user.\n\n## Book Restaurant Reservation\n\n- **INBookRestaurantReservationIntentHandling**: The handler interface booking a reservation that the user selected.\n- **INBookRestaurantReservationIntentResponse**: Your app’s response to a book restaurant reservation intent.\n\n## Inherits From\n\n- INIntent\n\n## Conforms To\n\n- CVarArg\n- CustomDebugStringConvertible\n- CustomStringConvertible\n- Equatable\n- Hashable\n- INIntentSetImageKeyPath\n- NSCoding\n- NSCopying\n- NSObjectProtocol\n- NSSecureCoding\n\n",
  "sections" : [
    {
      "content" : "",
      "items" : [
        {
          "description" : "Initializes the intent object with the specified booking information.",
          "name" : "init(restaurant:booking:partySize:bookingIdentifier:guest:selectedOffer:guestProvidedSpecialRequestText:)",
          "url" : "https:\/\/developer.apple.com\/documentation\/Intents\/INBookRestaurantReservationIntent\/init(restaurant:booking:partySize:bookingIdentifier:guest:selectedOffer:guestProvidedSpecialRequestText:)"
        }
      ],
      "title" : "Initializing the Intent Object"
    },
    {
      "content" : "",
      "items" : [
        {
          "description" : "The restaurant to contact regarding the booking.",
          "name" : "restaurant",
          "url" : "https:\/\/developer.apple.com\/documentation\/Intents\/INBookRestaurantReservationIntent\/restaurant"
        }
      ],
      "title" : "Getting the Restaurant Information"
    },
    {
      "content" : "",
      "items" : [
        {
          "description" : "The date and time of the reservation.",
          "name" : "bookingDateComponents",
          "url" : "https:\/\/developer.apple.com\/documentation\/Intents\/INBookRestaurantReservationIntent\/bookingDateComponents"
        },
        {
          "description" : "The unique identifier associated with the initial reservation data.",
          "name" : "bookingIdentifier",
          "url" : "https:\/\/developer.apple.com\/documentation\/Intents\/INBookRestaurantReservationIntent\/bookingIdentifier"
        },
        {
          "description" : "The total number of people in the user’s party.",
          "name" : "partySize",
          "url" : "https:\/\/developer.apple.com\/documentation\/Intents\/INBookRestaurantReservationIntent\/partySize"
        },
        {
          "description" : "The identity of the guest associated with the reservation.",
          "name" : "guest",
          "url" : "https:\/\/developer.apple.com\/documentation\/Intents\/INBookRestaurantReservationIntent\/guest"
        }
      ],
      "title" : "Getting the Booking Details"
    },
    {
      "content" : "",
      "items" : [
        {
          "description" : "Information about any special requests made by the user.",
          "name" : "guestProvidedSpecialRequestText",
          "url" : "https:\/\/developer.apple.com\/documentation\/Intents\/INBookRestaurantReservationIntent\/guestProvidedSpecialRequestText"
        },
        {
          "description" : "The special offer, if any, selected by the user.",
          "name" : "selectedOffer",
          "url" : "https:\/\/developer.apple.com\/documentation\/Intents\/INBookRestaurantReservationIntent\/selectedOffer"
        }
      ],
      "title" : "Getting Special Requests and Offers"
    },
    {
      "content" : "",
      "items" : [
        {
          "description" : "The handler interface booking a reservation that the user selected.",
          "name" : "INBookRestaurantReservationIntentHandling",
          "url" : "https:\/\/developer.apple.com\/documentation\/Intents\/INBookRestaurantReservationIntentHandling"
        },
        {
          "description" : "Your app’s response to a book restaurant reservation intent.",
          "name" : "INBookRestaurantReservationIntentResponse",
          "url" : "https:\/\/developer.apple.com\/documentation\/Intents\/INBookRestaurantReservationIntentResponse"
        }
      ],
      "title" : "Book Restaurant Reservation"
    },
    {
      "content" : "",
      "items" : [
        {
          "name" : "INIntent"
        }
      ],
      "title" : "Inherits From"
    }
  ],
  "source" : "appleJSON",
  "title" : "INBookRestaurantReservationIntent",
  "url" : "https:\/\/developer.apple.com\/documentation\/intents\/inbookrestaurantreservationintent"
}