{
  "abstract" : "An intents handler’s response to an update media affinity intent.",
  "codeExamples" : [

  ],
  "conformsTo" : [
    "CVarArg",
    "CustomDebugStringConvertible",
    "CustomStringConvertible",
    "Equatable",
    "Hashable",
    "NSCoding",
    "NSCopying",
    "NSObjectProtocol",
    "NSSecureCoding"
  ],
  "contentHash" : "c4ca372e0ebb36f78a84f8bb9305f25c40d27d54b173b5055d3c2bc23b4b45d4",
  "crawledAt" : "2025-12-05T19:33:39Z",
  "declaration" : {
    "code" : "class INUpdateMediaAffinityIntentResponse",
    "language" : "swift"
  },
  "id" : "D79B311A-0835-4588-A42D-DB51476DE4E8",
  "kind" : "class",
  "language" : "swift",
  "module" : "Intents",
  "overview" : "## Overview\n\nUse an [doc:\/\/com.apple.sirikit\/documentation\/Intents\/INUpdateMediaAffinityIntentResponse] object to specify the results from trying to update the user’s affinity for a media item. After performing the add action using the criteria specified in the [doc:\/\/com.apple.sirikit\/documentation\/Intents\/INUpdateMediaAffinityIntent] object, create an instance of this class with the results of the action. Siri communicates the response status to the user at appropriate times.\n\nYou create an [doc:\/\/com.apple.sirikit\/documentation\/Intents\/INUpdateMediaAffinityIntentResponse] object in the [doc:\/\/com.apple.sirikit\/documentation\/Intents\/INUpdateMediaAffinityIntentHandling\/confirm(intent:completion:)] and [doc:\/\/com.apple.sirikit\/documentation\/Intents\/INUpdateMediaAffinityIntentHandling\/handle(intent:completion:)] methods of your add media handler object. For more information about implementing your handler object, see [doc:\/\/com.apple.sirikit\/documentation\/Intents\/INUpdateMediaAffinityIntentHandling].",
  "platforms" : [
    "iOS",
    "iPadOS",
    "Mac Catalyst",
    "tvOS",
    "visionOS",
    "watchOS"
  ],
  "rawMarkdown" : "---\nsource: https:\/\/developer.apple.com\/documentation\/Intents\/INUpdateMediaAffinityIntentResponse\ncrawled: 2025-12-05T19:33:39Z\n---\n\n# INUpdateMediaAffinityIntentResponse\n\n**Class**\n\nAn intents handler’s response to an update media affinity intent.\n\n## Declaration\n\n```swift\nclass INUpdateMediaAffinityIntentResponse\n```\n\n## Overview\n\nUse an [doc:\/\/com.apple.sirikit\/documentation\/Intents\/INUpdateMediaAffinityIntentResponse] object to specify the results from trying to update the user’s affinity for a media item. After performing the add action using the criteria specified in the [doc:\/\/com.apple.sirikit\/documentation\/Intents\/INUpdateMediaAffinityIntent] object, create an instance of this class with the results of the action. Siri communicates the response status to the user at appropriate times.\n\nYou create an [doc:\/\/com.apple.sirikit\/documentation\/Intents\/INUpdateMediaAffinityIntentResponse] object in the [doc:\/\/com.apple.sirikit\/documentation\/Intents\/INUpdateMediaAffinityIntentHandling\/confirm(intent:completion:)] and [doc:\/\/com.apple.sirikit\/documentation\/Intents\/INUpdateMediaAffinityIntentHandling\/handle(intent:completion:)] methods of your add media handler object. For more information about implementing your handler object, see [doc:\/\/com.apple.sirikit\/documentation\/Intents\/INUpdateMediaAffinityIntentHandling].\n\n## Initializing the Response Object\n\n- **init(code:userActivity:)**: Initializes the response object with the specified code and user activity object.\n\n## Providing the Response Code\n\n- **code**: The code that indicates whether the app successfully updated the user’s affinity for the media.\n- **INUpdateMediaAffinityIntentResponseCode**: Codes returned by an intents handler in response to an update media affinity request.\n\n## Update Media Affinity\n\n- **INUpdateMediaAffinityIntentHandling**: The interface that handles requests to update the user’s preference for a media item.\n- **INUpdateMediaAffinityIntent**: A request to update the user’s affinity for a media item.\n\n## Inherits From\n\n- INIntentResponse\n\n## Conforms To\n\n- CVarArg\n- CustomDebugStringConvertible\n- CustomStringConvertible\n- Equatable\n- Hashable\n- NSCoding\n- NSCopying\n- NSObjectProtocol\n- NSSecureCoding\n\n",
  "sections" : [
    {
      "content" : "",
      "items" : [
        {
          "description" : "Initializes the response object with the specified code and user activity object.",
          "name" : "init(code:userActivity:)",
          "url" : "https:\/\/developer.apple.com\/documentation\/Intents\/INUpdateMediaAffinityIntentResponse\/init(code:userActivity:)"
        }
      ],
      "title" : "Initializing the Response Object"
    },
    {
      "content" : "",
      "items" : [
        {
          "description" : "The code that indicates whether the app successfully updated the user’s affinity for the media.",
          "name" : "code",
          "url" : "https:\/\/developer.apple.com\/documentation\/Intents\/INUpdateMediaAffinityIntentResponse\/code"
        },
        {
          "description" : "Codes returned by an intents handler in response to an update media affinity request.",
          "name" : "INUpdateMediaAffinityIntentResponseCode",
          "url" : "https:\/\/developer.apple.com\/documentation\/Intents\/INUpdateMediaAffinityIntentResponseCode"
        }
      ],
      "title" : "Providing the Response Code"
    },
    {
      "content" : "",
      "items" : [
        {
          "description" : "The interface that handles requests to update the user’s preference for a media item.",
          "name" : "INUpdateMediaAffinityIntentHandling",
          "url" : "https:\/\/developer.apple.com\/documentation\/Intents\/INUpdateMediaAffinityIntentHandling"
        },
        {
          "description" : "A request to update the user’s affinity for a media item.",
          "name" : "INUpdateMediaAffinityIntent",
          "url" : "https:\/\/developer.apple.com\/documentation\/Intents\/INUpdateMediaAffinityIntent"
        }
      ],
      "title" : "Update Media Affinity"
    },
    {
      "content" : "",
      "items" : [
        {
          "name" : "INIntentResponse"
        }
      ],
      "title" : "Inherits From"
    }
  ],
  "source" : "appleJSON",
  "title" : "INUpdateMediaAffinityIntentResponse",
  "url" : "https:\/\/developer.apple.com\/documentation\/Intents\/INUpdateMediaAffinityIntentResponse"
}