{
  "abstract" : "A resolution result for the recipient of a bill payment.",
  "codeExamples" : [

  ],
  "conformsTo" : [
    "CVarArg",
    "CustomDebugStringConvertible",
    "CustomStringConvertible",
    "Equatable",
    "Hashable",
    "NSObjectProtocol"
  ],
  "contentHash" : "4d2d6ee2dda9a3725deb77a981195b24533f79d7770ff7f94acf767180ac3641",
  "crawledAt" : "2025-12-05T18:09:01Z",
  "declaration" : {
    "code" : "class INBillPayeeResolutionResult",
    "language" : "swift"
  },
  "id" : "0CC3E3FC-B533-4B5D-8352-BB9FF25573F8",
  "kind" : "class",
  "language" : "swift",
  "module" : "Intents",
  "overview" : "## Overview\n\nAn [doc:\/\/com.apple.sirikit\/documentation\/Intents\/INBillPayeeResolutionResult] object is what you return when resolving parameters containing an [doc:\/\/com.apple.sirikit\/documentation\/Intents\/INBillPayee] object. Use the creation method that best reflects your ability to resolve the parameter successfully. For additional resolution options, see [doc:\/\/com.apple.sirikit\/documentation\/Intents\/INIntentResolutionResult].",
  "platforms" : [
    "iOS",
    "iPadOS",
    "Mac Catalyst",
    "visionOS",
    "watchOS"
  ],
  "rawMarkdown" : "---\nsource: https:\/\/developer.apple.com\/documentation\/Intents\/INBillPayeeResolutionResult\ncrawled: 2025-12-05T18:09:01Z\n---\n\n# INBillPayeeResolutionResult\n\n**Class**\n\nA resolution result for the recipient of a bill payment.\n\n## Declaration\n\n```swift\nclass INBillPayeeResolutionResult\n```\n\n## Overview\n\nAn [doc:\/\/com.apple.sirikit\/documentation\/Intents\/INBillPayeeResolutionResult] object is what you return when resolving parameters containing an [doc:\/\/com.apple.sirikit\/documentation\/Intents\/INBillPayee] object. Use the creation method that best reflects your ability to resolve the parameter successfully. For additional resolution options, see [doc:\/\/com.apple.sirikit\/documentation\/Intents\/INIntentResolutionResult].\n\n## Creating a Resolution Result Object\n\n- **success(with:)**: Creates an object whose resolution involves the successful matching of the specified value.\n- **confirmationRequired(with:)**: Creates an object whose resolution requires that the user must confirm the value before proceeding.\n- **disambiguation(with:)**: Creates an object whose resolution requires the user to select from among the specified objects.\n\n## Bill Data Objects\n\n- **INBillDetails**: The detailed information associated with a bill.\n- **INBillPayee**: The entity that receives the proceeds from a bill payment.\n- **INBillTypeResolutionResult**: A resolution result for the types of bills a user might pay.\n- **INVisualCodeTypeResolutionResult**: A resolution result for the type of visual code used to exchange information.\n\n## Inherits From\n\n- INIntentResolutionResult\n\n## Conforms To\n\n- CVarArg\n- CustomDebugStringConvertible\n- CustomStringConvertible\n- Equatable\n- Hashable\n- NSObjectProtocol\n\n",
  "sections" : [
    {
      "content" : "",
      "items" : [
        {
          "description" : "Creates an object whose resolution involves the successful matching of the specified value.",
          "name" : "success(with:)",
          "url" : "https:\/\/developer.apple.com\/documentation\/Intents\/INBillPayeeResolutionResult\/success(with:)"
        },
        {
          "description" : "Creates an object whose resolution requires that the user must confirm the value before proceeding.",
          "name" : "confirmationRequired(with:)",
          "url" : "https:\/\/developer.apple.com\/documentation\/Intents\/INBillPayeeResolutionResult\/confirmationRequired(with:)"
        },
        {
          "description" : "Creates an object whose resolution requires the user to select from among the specified objects.",
          "name" : "disambiguation(with:)",
          "url" : "https:\/\/developer.apple.com\/documentation\/Intents\/INBillPayeeResolutionResult\/disambiguation(with:)"
        }
      ],
      "title" : "Creating a Resolution Result Object"
    },
    {
      "content" : "",
      "items" : [
        {
          "description" : "The detailed information associated with a bill.",
          "name" : "INBillDetails",
          "url" : "https:\/\/developer.apple.com\/documentation\/Intents\/INBillDetails"
        },
        {
          "description" : "The entity that receives the proceeds from a bill payment.",
          "name" : "INBillPayee",
          "url" : "https:\/\/developer.apple.com\/documentation\/Intents\/INBillPayee"
        },
        {
          "description" : "A resolution result for the types of bills a user might pay.",
          "name" : "INBillTypeResolutionResult",
          "url" : "https:\/\/developer.apple.com\/documentation\/Intents\/INBillTypeResolutionResult"
        },
        {
          "description" : "A resolution result for the type of visual code used to exchange information.",
          "name" : "INVisualCodeTypeResolutionResult",
          "url" : "https:\/\/developer.apple.com\/documentation\/Intents\/INVisualCodeTypeResolutionResult"
        }
      ],
      "title" : "Bill Data Objects"
    },
    {
      "content" : "",
      "items" : [
        {
          "name" : "INIntentResolutionResult"
        }
      ],
      "title" : "Inherits From"
    }
  ],
  "source" : "appleJSON",
  "title" : "INBillPayeeResolutionResult",
  "url" : "https:\/\/developer.apple.com\/documentation\/Intents\/INBillPayeeResolutionResult"
}