{
  "abstract" : "A resolution result for the user’s affinity for a media item.",
  "codeExamples" : [

  ],
  "conformsTo" : [
    "CVarArg",
    "CustomDebugStringConvertible",
    "CustomStringConvertible",
    "Equatable",
    "Hashable",
    "NSObjectProtocol"
  ],
  "contentHash" : "49bfd6e18ed989bf8cc4f818f53106b01d06ef5a64f9578a79e5e55cbc00fa51",
  "crawledAt" : "2025-12-05T18:03:58Z",
  "declaration" : {
    "code" : "class INMediaAffinityTypeResolutionResult",
    "language" : "swift"
  },
  "id" : "A4F36784-A0D5-435D-B8A9-0385EC13CD76",
  "kind" : "class",
  "language" : "swift",
  "module" : "Intents",
  "overview" : "## Overview\n\nYou return an [doc:\/\/com.apple.sirikit\/documentation\/Intents\/INMediaAffinityTypeResolutionResult] object when resolving parameters containing an [doc:\/\/com.apple.sirikit\/documentation\/Intents\/INMediaAffinityType] value. Use the creation method that best reflects your ability to resolve the parameter successfully.\n\nFor additional resolution operators, see [doc:\/\/com.apple.sirikit\/documentation\/Intents\/INIntentResolutionResult].",
  "platforms" : [
    "iOS",
    "iPadOS",
    "Mac Catalyst",
    "tvOS",
    "visionOS",
    "watchOS"
  ],
  "rawMarkdown" : "---\nsource: https:\/\/developer.apple.com\/documentation\/Intents\/INMediaAffinityTypeResolutionResult\ncrawled: 2025-12-05T18:03:58Z\n---\n\n# INMediaAffinityTypeResolutionResult\n\n**Class**\n\nA resolution result for the user’s affinity for a media item.\n\n## Declaration\n\n```swift\nclass INMediaAffinityTypeResolutionResult\n```\n\n## Overview\n\nYou return an [doc:\/\/com.apple.sirikit\/documentation\/Intents\/INMediaAffinityTypeResolutionResult] object when resolving parameters containing an [doc:\/\/com.apple.sirikit\/documentation\/Intents\/INMediaAffinityType] value. Use the creation method that best reflects your ability to resolve the parameter successfully.\n\nFor additional resolution operators, see [doc:\/\/com.apple.sirikit\/documentation\/Intents\/INIntentResolutionResult].\n\n## Creating a Resolution Result\n\n- **success(with:)**: Creates an object whose resolution involves successfully matching the specified parameter.\n- **confirmationRequired(with:)**: Creates an object whose resolution requires that the user must confirm the value before proceeding.\n\n## Resolution Results\n\n- **INAddMediaMediaDestinationResolutionResult**: A resolution result for the types of destinations when adding media.\n- **INAddMediaMediaItemResolutionResult**: A resolution result for the media item to add.\n- **INMediaDestinationResolutionResult**: A resolution result for the media destination types.\n- **INMediaItemResolutionResult**: A resolution result for media item types.\n- **INPlayMediaMediaItemResolutionResult**: A resolution result for the media item to play.\n- **INPlayMediaPlaybackSpeedResolutionResult**: A resolution result that determines the playback speed of a media item.\n- **INPlaybackRepeatModeResolutionResult**: A resolution result for the playback repeat modes of a media item.\n- **INPlaybackQueueLocationResolutionResult**: A resolution result for the requested playback queue location.\n- **INSearchForMediaMediaItemResolutionResult**: A resolution result for the media item for which to search.\n- **INUpdateMediaAffinityMediaItemResolutionResult**: A resolution result for updating the user’s affinity for a media item.\n\n## Inherits From\n\n- INIntentResolutionResult\n\n## Conforms To\n\n- CVarArg\n- CustomDebugStringConvertible\n- CustomStringConvertible\n- Equatable\n- Hashable\n- NSObjectProtocol\n\n",
  "sections" : [
    {
      "content" : "",
      "items" : [
        {
          "description" : "Creates an object whose resolution involves successfully matching the specified parameter.",
          "name" : "success(with:)",
          "url" : "https:\/\/developer.apple.com\/documentation\/Intents\/INMediaAffinityTypeResolutionResult\/success(with:)"
        },
        {
          "description" : "Creates an object whose resolution requires that the user must confirm the value before proceeding.",
          "name" : "confirmationRequired(with:)",
          "url" : "https:\/\/developer.apple.com\/documentation\/Intents\/INMediaAffinityTypeResolutionResult\/confirmationRequired(with:)"
        }
      ],
      "title" : "Creating a Resolution Result"
    },
    {
      "content" : "",
      "items" : [
        {
          "description" : "A resolution result for the types of destinations when adding media.",
          "name" : "INAddMediaMediaDestinationResolutionResult",
          "url" : "https:\/\/developer.apple.com\/documentation\/Intents\/INAddMediaMediaDestinationResolutionResult"
        },
        {
          "description" : "A resolution result for the media item to add.",
          "name" : "INAddMediaMediaItemResolutionResult",
          "url" : "https:\/\/developer.apple.com\/documentation\/Intents\/INAddMediaMediaItemResolutionResult"
        },
        {
          "description" : "A resolution result for the media destination types.",
          "name" : "INMediaDestinationResolutionResult",
          "url" : "https:\/\/developer.apple.com\/documentation\/Intents\/INMediaDestinationResolutionResult"
        },
        {
          "description" : "A resolution result for media item types.",
          "name" : "INMediaItemResolutionResult",
          "url" : "https:\/\/developer.apple.com\/documentation\/Intents\/INMediaItemResolutionResult"
        },
        {
          "description" : "A resolution result for the media item to play.",
          "name" : "INPlayMediaMediaItemResolutionResult",
          "url" : "https:\/\/developer.apple.com\/documentation\/Intents\/INPlayMediaMediaItemResolutionResult"
        },
        {
          "description" : "A resolution result that determines the playback speed of a media item.",
          "name" : "INPlayMediaPlaybackSpeedResolutionResult",
          "url" : "https:\/\/developer.apple.com\/documentation\/Intents\/INPlayMediaPlaybackSpeedResolutionResult"
        },
        {
          "description" : "A resolution result for the playback repeat modes of a media item.",
          "name" : "INPlaybackRepeatModeResolutionResult",
          "url" : "https:\/\/developer.apple.com\/documentation\/Intents\/INPlaybackRepeatModeResolutionResult"
        },
        {
          "description" : "A resolution result for the requested playback queue location.",
          "name" : "INPlaybackQueueLocationResolutionResult",
          "url" : "https:\/\/developer.apple.com\/documentation\/Intents\/INPlaybackQueueLocationResolutionResult"
        },
        {
          "description" : "A resolution result for the media item for which to search.",
          "name" : "INSearchForMediaMediaItemResolutionResult",
          "url" : "https:\/\/developer.apple.com\/documentation\/Intents\/INSearchForMediaMediaItemResolutionResult"
        },
        {
          "description" : "A resolution result for updating the user’s affinity for a media item.",
          "name" : "INUpdateMediaAffinityMediaItemResolutionResult",
          "url" : "https:\/\/developer.apple.com\/documentation\/Intents\/INUpdateMediaAffinityMediaItemResolutionResult"
        }
      ],
      "title" : "Resolution Results"
    },
    {
      "content" : "",
      "items" : [
        {
          "name" : "INIntentResolutionResult"
        }
      ],
      "title" : "Inherits From"
    }
  ],
  "source" : "appleJSON",
  "title" : "INMediaAffinityTypeResolutionResult",
  "url" : "https:\/\/developer.apple.com\/documentation\/Intents\/INMediaAffinityTypeResolutionResult"
}