{
  "abstract" : "Handles changing the radio station.",
  "codeExamples" : [

  ],
  "contentHash" : "9f63af6fe70fafd8b5dbf3472129c18296e83f212c6f333a63a257a16313972b",
  "crawledAt" : "2025-12-07T19:14:10Z",
  "declaration" : {
    "code" : "func handle(intent: INSetRadioStationIntent, completion: @escaping (INSetRadioStationIntentResponse) -> Void)",
    "language" : "swift"
  },
  "id" : "43EF22E1-C133-4CB8-8E05-49D88785D39D",
  "kind" : "method",
  "language" : "swift",
  "module" : "Intents",
  "overview" : "## Discussion\n\nYour implementation of this method should change the radio station, which means communicating with the vehicle’s built-in entertainment system. When done, execute the provided block with a response object indicating whether or not the operation was successful.",
  "platforms" : [
    "iOS",
    "iPadOS",
    "Mac Catalyst",
    "visionOS"
  ],
  "rawMarkdown" : "---\nsource: https:\/\/developer.apple.com\/documentation\/Intents\/INSetRadioStationIntentHandling\/handle(intent:completion:)\ncrawled: 2025-12-07T19:14:10Z\n---\n\n# handle(intent:completion:)\n\n**Instance Method**\n\nHandles changing the radio station.\n\n## Declaration\n\n```swift\nfunc handle(intent: INSetRadioStationIntent, completion: @escaping (INSetRadioStationIntentResponse) -> Void)\n```\n\n```swift\nfunc handle(intent: INSetRadioStationIntent) async -> INSetRadioStationIntentResponse\n```\n\n## Parameters\n\n- **intent**: The intent object containing details about the user’s request. Your handler object has already resolved and confirmed the information in this object.\n- **completion**: The handler block to execute with your response. You must execute this handler at some point during your implementation of this method. This handler has no return value and takes the following parameter:\n\n\n\n## Discussion\n\nYour implementation of this method should change the radio station, which means communicating with the vehicle’s built-in entertainment system. When done, execute the provided block with a response object indicating whether or not the operation was successful.\n\n",
  "sections" : [

  ],
  "source" : "appleJSON",
  "title" : "handle(intent:completion:)",
  "url" : "https:\/\/developer.apple.com\/documentation\/Intents\/INSetRadioStationIntentHandling\/handle(intent:completion:)"
}