{
  "abstract" : "Resolves the party size to use when generating the reservation times.",
  "codeExamples" : [

  ],
  "contentHash" : "6a1bd3137940e3f60248d4bc35b649af96664cd7553eb86fd31dac1c1bd64339",
  "crawledAt" : "2025-12-07T20:28:03Z",
  "declaration" : {
    "code" : "optional func resolvePartySize(for intent: INGetAvailableRestaurantReservationBookingsIntent, completion: @escaping (INIntegerResolutionResult) -> Void)",
    "language" : "swift"
  },
  "id" : "9E093738-9A56-457C-93DB-C21A53F42927",
  "kind" : "method",
  "language" : "swift",
  "module" : "Intents",
  "overview" : "## Discussion\n\nImplement this method to resolve the party size for the reservation.",
  "platforms" : [
    "iOS",
    "iPadOS",
    "Mac Catalyst",
    "visionOS"
  ],
  "rawMarkdown" : "---\nsource: https:\/\/developer.apple.com\/documentation\/Intents\/INGetAvailableRestaurantReservationBookingsIntentHandling\/resolvePartySize(for:completion:)\ncrawled: 2025-12-07T20:28:03Z\n---\n\n# resolvePartySize(for:completion:)\n\n**Instance Method**\n\nResolves the party size to use when generating the reservation times.\n\n## Declaration\n\n```swift\noptional func resolvePartySize(for intent: INGetAvailableRestaurantReservationBookingsIntent, completion: @escaping (INIntegerResolutionResult) -> Void)\n```\n\n```swift\noptional func resolvePartySize(for intent: INGetAvailableRestaurantReservationBookingsIntent) async -> INIntegerResolutionResult\n```\n\n## Parameters\n\n- **intent**: The intent object containing details about the userâ€™s request. Use this object to get the initial information, if any, provided by the user.\n- **completion**: The block to execute with the resolution. You must execute this block at some point during your implementation of this method. This block has no return value and takes the following parameter:\n\n\n\n## Discussion\n\nImplement this method to resolve the party size for the reservation.\n\n## Resolving the Intent Parameters\n\n- **resolveRestaurant(for:completion:)**: Resolves the restaurant to use when gathering reservation times.\n- **resolvePreferredBookingDateComponents(for:completion:)**: Resolves the date to use when generating the reservation times.\n\n",
  "sections" : [
    {
      "content" : "",
      "items" : [
        {
          "description" : "Resolves the restaurant to use when gathering reservation times.",
          "name" : "resolveRestaurant(for:completion:)",
          "url" : "https:\/\/developer.apple.com\/documentation\/Intents\/INGetAvailableRestaurantReservationBookingsIntentHandling\/resolveRestaurant(for:completion:)"
        },
        {
          "description" : "Resolves the date to use when generating the reservation times.",
          "name" : "resolvePreferredBookingDateComponents(for:completion:)",
          "url" : "https:\/\/developer.apple.com\/documentation\/Intents\/INGetAvailableRestaurantReservationBookingsIntentHandling\/resolvePreferredBookingDateComponents(for:completion:)"
        }
      ],
      "title" : "Resolving the Intent Parameters"
    }
  ],
  "source" : "appleJSON",
  "title" : "resolvePartySize(for:completion:)",
  "url" : "https:\/\/developer.apple.com\/documentation\/Intents\/INGetAvailableRestaurantReservationBookingsIntentHandling\/resolvePartySize(for:completion:)"
}