{
  "abstract" : "A request to add tasks to an existing task list.",
  "codeExamples" : [

  ],
  "conformsTo" : [
    "CVarArg",
    "CustomDebugStringConvertible",
    "CustomStringConvertible",
    "Equatable",
    "Hashable",
    "INIntentSetImageKeyPath",
    "NSCoding",
    "NSCopying",
    "NSObjectProtocol",
    "NSSecureCoding"
  ],
  "contentHash" : "e050838caf356245bcb08f5b0985d461e16f6226e7c07372a6ddba031d1a795d",
  "crawledAt" : "2025-12-05T19:40:28Z",
  "declaration" : {
    "code" : "class INAddTasksIntent",
    "language" : "swift"
  },
  "id" : "9C74CA92-35DC-499B-BAE0-57940DC26774",
  "kind" : "class",
  "language" : "swift",
  "module" : "Intents",
  "overview" : "## Overview\n\nSiri creates an instance of [doc:\/\/com.apple.sirikit\/documentation\/Intents\/INAddTasksIntent] when the user asks to add one or more tasks to a task list. Alternatively, if the user asks to create a note, and your app or Intents extension doesn’t support [doc:\/\/com.apple.sirikit\/documentation\/Intents\/INCreateNoteIntent], SiriKit uses this intent instead. The intent contains the tasks to add and the target task list, and can also include location or time triggers that you assign to each of the new tasks. To process the request, your handler must adopt the [doc:\/\/com.apple.sirikit\/documentation\/Intents\/INAddTasksIntentHandling] protocol.\n\n[doc:\/\/com.apple.sirikit\/documentation\/Intents\/INAddTasksIntent] is available to both Siri Intents and Siri Suggestions and doesn’t require an unlocked device before processing.\n\n### Example Phrases\n\nUsers can ask Siri to add tasks to a task list in a variety of ways. Although not exhaustive, the following table provides a few sample phrases, in different languages, that you can use when testing your intents.",
  "platforms" : [
    "iOS",
    "iPadOS",
    "Mac Catalyst",
    "visionOS",
    "watchOS"
  ],
  "rawMarkdown" : "---\nsource: https:\/\/developer.apple.com\/documentation\/intents\/inaddtasksintent\ncrawled: 2025-12-05T19:40:28Z\n---\n\n# INAddTasksIntent\n\n**Class**\n\nA request to add tasks to an existing task list.\n\n## Declaration\n\n```swift\nclass INAddTasksIntent\n```\n\n## Overview\n\nSiri creates an instance of [doc:\/\/com.apple.sirikit\/documentation\/Intents\/INAddTasksIntent] when the user asks to add one or more tasks to a task list. Alternatively, if the user asks to create a note, and your app or Intents extension doesn’t support [doc:\/\/com.apple.sirikit\/documentation\/Intents\/INCreateNoteIntent], SiriKit uses this intent instead. The intent contains the tasks to add and the target task list, and can also include location or time triggers that you assign to each of the new tasks. To process the request, your handler must adopt the [doc:\/\/com.apple.sirikit\/documentation\/Intents\/INAddTasksIntentHandling] protocol.\n\n[doc:\/\/com.apple.sirikit\/documentation\/Intents\/INAddTasksIntent] is available to both Siri Intents and Siri Suggestions and doesn’t require an unlocked device before processing.\n\n### Example Phrases\n\nUsers can ask Siri to add tasks to a task list in a variety of ways. Although not exhaustive, the following table provides a few sample phrases, in different languages, that you can use when testing your intents.\n\n\n\n## Initializing the Intent Object\n\n- **init(targetTaskList:taskTitles:spatialEventTrigger:temporalEventTrigger:priority:)**: Initializes the intent object with the specified task details.\n- **init(targetTaskList:taskTitles:spatialEventTrigger:temporalEventTrigger:)**: Initializes the intent object with the specified task details.\n\n## Getting the Task Details\n\n- **targetTaskList**: The task list to receive the new tasks.\n- **taskTitles**: An array of strings containing the titles of the new tasks.\n- **priority**: The priority for the new task.\n\n## Getting the Trigger Information\n\n- **spatialEventTrigger**: The location-based trigger to associate with each of the new tasks.\n- **temporalEventTrigger**: The time-based trigger to associate with each of the new tasks.\n\n## Task Addition\n\n- **INAddTasksIntentHandling**: The handler interface for adding tasks to a task list.\n- **INAddTasksIntentResponse**: Your response to a request to add tasks to a task list.\n\n## Inherits From\n\n- INIntent\n\n## Conforms To\n\n- CVarArg\n- CustomDebugStringConvertible\n- CustomStringConvertible\n- Equatable\n- Hashable\n- INIntentSetImageKeyPath\n- NSCoding\n- NSCopying\n- NSObjectProtocol\n- NSSecureCoding\n\n",
  "sections" : [
    {
      "content" : "",
      "items" : [
        {
          "description" : "Initializes the intent object with the specified task details.",
          "name" : "init(targetTaskList:taskTitles:spatialEventTrigger:temporalEventTrigger:priority:)",
          "url" : "https:\/\/developer.apple.com\/documentation\/Intents\/INAddTasksIntent\/init(targetTaskList:taskTitles:spatialEventTrigger:temporalEventTrigger:priority:)"
        },
        {
          "description" : "Initializes the intent object with the specified task details.",
          "name" : "init(targetTaskList:taskTitles:spatialEventTrigger:temporalEventTrigger:)",
          "url" : "https:\/\/developer.apple.com\/documentation\/Intents\/INAddTasksIntent\/init(targetTaskList:taskTitles:spatialEventTrigger:temporalEventTrigger:)"
        }
      ],
      "title" : "Initializing the Intent Object"
    },
    {
      "content" : "",
      "items" : [
        {
          "description" : "The task list to receive the new tasks.",
          "name" : "targetTaskList",
          "url" : "https:\/\/developer.apple.com\/documentation\/Intents\/INAddTasksIntent\/targetTaskList"
        },
        {
          "description" : "An array of strings containing the titles of the new tasks.",
          "name" : "taskTitles",
          "url" : "https:\/\/developer.apple.com\/documentation\/Intents\/INAddTasksIntent\/taskTitles"
        },
        {
          "description" : "The priority for the new task.",
          "name" : "priority",
          "url" : "https:\/\/developer.apple.com\/documentation\/Intents\/INAddTasksIntent\/priority"
        }
      ],
      "title" : "Getting the Task Details"
    },
    {
      "content" : "",
      "items" : [
        {
          "description" : "The location-based trigger to associate with each of the new tasks.",
          "name" : "spatialEventTrigger",
          "url" : "https:\/\/developer.apple.com\/documentation\/Intents\/INAddTasksIntent\/spatialEventTrigger"
        },
        {
          "description" : "The time-based trigger to associate with each of the new tasks.",
          "name" : "temporalEventTrigger",
          "url" : "https:\/\/developer.apple.com\/documentation\/Intents\/INAddTasksIntent\/temporalEventTrigger"
        }
      ],
      "title" : "Getting the Trigger Information"
    },
    {
      "content" : "",
      "items" : [
        {
          "description" : "The handler interface for adding tasks to a task list.",
          "name" : "INAddTasksIntentHandling",
          "url" : "https:\/\/developer.apple.com\/documentation\/Intents\/INAddTasksIntentHandling"
        },
        {
          "description" : "Your response to a request to add tasks to a task list.",
          "name" : "INAddTasksIntentResponse",
          "url" : "https:\/\/developer.apple.com\/documentation\/Intents\/INAddTasksIntentResponse"
        }
      ],
      "title" : "Task Addition"
    },
    {
      "content" : "",
      "items" : [
        {
          "name" : "INIntent"
        }
      ],
      "title" : "Inherits From"
    }
  ],
  "source" : "appleJSON",
  "title" : "INAddTasksIntent",
  "url" : "https:\/\/developer.apple.com\/documentation\/intents\/inaddtasksintent"
}