{
  "abstract" : "A request to search for photos and initiate a slideshow with the results.",
  "codeExamples" : [

  ],
  "conformsTo" : [
    "CVarArg",
    "CustomDebugStringConvertible",
    "CustomStringConvertible",
    "Equatable",
    "Hashable",
    "INIntentSetImageKeyPath",
    "NSCoding",
    "NSCopying",
    "NSObjectProtocol",
    "NSSecureCoding"
  ],
  "contentHash" : "7dd55ebe5a4cf8f892576630994be9071b801128019fceefc46a80ce5d05ab4b",
  "crawledAt" : "2025-12-05T19:41:29Z",
  "declaration" : {
    "code" : "class INStartPhotoPlaybackIntent",
    "language" : "swift"
  },
  "id" : "066997EB-0A04-402E-B4C8-0192CB2B5D28",
  "kind" : "class",
  "language" : "swift",
  "module" : "Intents",
  "overview" : "## Overview\n\nThe system creates an [doc:\/\/com.apple.sirikit\/documentation\/Intents\/INStartPhotoPlaybackIntent] object when the user asks to start a slideshow of a set of photos. This intent object contains the parameters to use when searching for the photos, including the possible name of a photo album, the people in the photos, or the location of the photos. Use this intent object to perform the search and initiate the slideshow in your app. When performing the search, use only the parameters provided and ignore any that have no values.\n\nTo handle this intent, the handler object in your Intents extension must adopt the [doc:\/\/com.apple.sirikit\/documentation\/Intents\/INStartPhotoPlaybackIntentHandling] protocol. Your handler should confirm the request and create an [doc:\/\/com.apple.sirikit\/documentation\/Intents\/INStartPhotoPlaybackIntentResponse] object with the results of the search. After a successful search, Siri launches your app so that it can begin the slideshow.\n\nFor a list of other intents in the photos domain, see [doc:\/\/com.apple.sirikit\/documentation\/Intents\/INPhotosDomainHandling].\n\n### Additional Intent Attributes\n\nThe following table lists additional attributes of this intent object:",
  "platforms" : [
    "iOS",
    "iPadOS",
    "Mac Catalyst",
    "visionOS",
    "watchOS"
  ],
  "rawMarkdown" : "---\nsource: https:\/\/developer.apple.com\/documentation\/intents\/instartphotoplaybackintent\ncrawled: 2025-12-05T19:41:29Z\n---\n\n# INStartPhotoPlaybackIntent\n\n**Class**\n\nA request to search for photos and initiate a slideshow with the results.\n\n## Declaration\n\n```swift\nclass INStartPhotoPlaybackIntent\n```\n\n## Overview\n\nThe system creates an [doc:\/\/com.apple.sirikit\/documentation\/Intents\/INStartPhotoPlaybackIntent] object when the user asks to start a slideshow of a set of photos. This intent object contains the parameters to use when searching for the photos, including the possible name of a photo album, the people in the photos, or the location of the photos. Use this intent object to perform the search and initiate the slideshow in your app. When performing the search, use only the parameters provided and ignore any that have no values.\n\nTo handle this intent, the handler object in your Intents extension must adopt the [doc:\/\/com.apple.sirikit\/documentation\/Intents\/INStartPhotoPlaybackIntentHandling] protocol. Your handler should confirm the request and create an [doc:\/\/com.apple.sirikit\/documentation\/Intents\/INStartPhotoPlaybackIntentResponse] object with the results of the search. After a successful search, Siri launches your app so that it can begin the slideshow.\n\nFor a list of other intents in the photos domain, see [doc:\/\/com.apple.sirikit\/documentation\/Intents\/INPhotosDomainHandling].\n\n### Additional Intent Attributes\n\nThe following table lists additional attributes of this intent object:\n\n\n\n## Creating the Intent Object\n\n- **init(dateCreated:locationCreated:albumName:searchTerms:includedAttributes:excludedAttributes:peopleInPhoto:)**: Initializes an intent object with the specified search parameters.\n\n## Getting the People in the Photos\n\n- **peopleInPhoto**: The people in the photos.\n- **peopleInPhotoOperator**: The operator that defines how to search for people in the photos.\n\n## Getting the Search Terms\n\n- **searchTerms**: An array of terms to look for in the photos.\n- **searchTermsOperator**: The operator that defines how to incorporate the search terms when performing the search.\n\n## Getting the Search Attributes\n\n- **dateCreated**: The range of dates during which someone took the pictures.\n- **locationCreated**: The location where someone took the photos.\n- **albumName**: The name of the album that contains the photos.\n- **includedAttributes**: The attributes that must be present in the photos.\n- **excludedAttributes**: The attributes that must not be present in the photos.\n\n## Photo Playback\n\n- **INStartPhotoPlaybackIntentHandling**: The handler interface for searching the user’s photos and the playback of the results.\n- **INStartPhotoPlaybackIntentResponse**: Your app’s response to a start photo playback intent.\n\n## Inherits From\n\n- INIntent\n\n## Conforms To\n\n- CVarArg\n- CustomDebugStringConvertible\n- CustomStringConvertible\n- Equatable\n- Hashable\n- INIntentSetImageKeyPath\n- NSCoding\n- NSCopying\n- NSObjectProtocol\n- NSSecureCoding\n\n",
  "sections" : [
    {
      "content" : "",
      "items" : [
        {
          "description" : "Initializes an intent object with the specified search parameters.",
          "name" : "init(dateCreated:locationCreated:albumName:searchTerms:includedAttributes:excludedAttributes:peopleInPhoto:)",
          "url" : "https:\/\/developer.apple.com\/documentation\/Intents\/INStartPhotoPlaybackIntent\/init(dateCreated:locationCreated:albumName:searchTerms:includedAttributes:excludedAttributes:peopleInPhoto:)"
        }
      ],
      "title" : "Creating the Intent Object"
    },
    {
      "content" : "",
      "items" : [
        {
          "description" : "The people in the photos.",
          "name" : "peopleInPhoto",
          "url" : "https:\/\/developer.apple.com\/documentation\/Intents\/INStartPhotoPlaybackIntent\/peopleInPhoto"
        },
        {
          "description" : "The operator that defines how to search for people in the photos.",
          "name" : "peopleInPhotoOperator",
          "url" : "https:\/\/developer.apple.com\/documentation\/Intents\/INStartPhotoPlaybackIntent\/peopleInPhotoOperator"
        }
      ],
      "title" : "Getting the People in the Photos"
    },
    {
      "content" : "",
      "items" : [
        {
          "description" : "An array of terms to look for in the photos.",
          "name" : "searchTerms",
          "url" : "https:\/\/developer.apple.com\/documentation\/Intents\/INStartPhotoPlaybackIntent\/searchTerms"
        },
        {
          "description" : "The operator that defines how to incorporate the search terms when performing the search.",
          "name" : "searchTermsOperator",
          "url" : "https:\/\/developer.apple.com\/documentation\/Intents\/INStartPhotoPlaybackIntent\/searchTermsOperator"
        }
      ],
      "title" : "Getting the Search Terms"
    },
    {
      "content" : "",
      "items" : [
        {
          "description" : "The range of dates during which someone took the pictures.",
          "name" : "dateCreated",
          "url" : "https:\/\/developer.apple.com\/documentation\/Intents\/INStartPhotoPlaybackIntent\/dateCreated"
        },
        {
          "description" : "The location where someone took the photos.",
          "name" : "locationCreated",
          "url" : "https:\/\/developer.apple.com\/documentation\/Intents\/INStartPhotoPlaybackIntent\/locationCreated"
        },
        {
          "description" : "The name of the album that contains the photos.",
          "name" : "albumName",
          "url" : "https:\/\/developer.apple.com\/documentation\/Intents\/INStartPhotoPlaybackIntent\/albumName"
        },
        {
          "description" : "The attributes that must be present in the photos.",
          "name" : "includedAttributes",
          "url" : "https:\/\/developer.apple.com\/documentation\/Intents\/INStartPhotoPlaybackIntent\/includedAttributes"
        },
        {
          "description" : "The attributes that must not be present in the photos.",
          "name" : "excludedAttributes",
          "url" : "https:\/\/developer.apple.com\/documentation\/Intents\/INStartPhotoPlaybackIntent\/excludedAttributes"
        }
      ],
      "title" : "Getting the Search Attributes"
    },
    {
      "content" : "",
      "items" : [
        {
          "description" : "The handler interface for searching the user’s photos and the playback of the results.",
          "name" : "INStartPhotoPlaybackIntentHandling",
          "url" : "https:\/\/developer.apple.com\/documentation\/Intents\/INStartPhotoPlaybackIntentHandling"
        },
        {
          "description" : "Your app’s response to a start photo playback intent.",
          "name" : "INStartPhotoPlaybackIntentResponse",
          "url" : "https:\/\/developer.apple.com\/documentation\/Intents\/INStartPhotoPlaybackIntentResponse"
        }
      ],
      "title" : "Photo Playback"
    },
    {
      "content" : "",
      "items" : [
        {
          "name" : "INIntent"
        }
      ],
      "title" : "Inherits From"
    }
  ],
  "source" : "appleJSON",
  "title" : "INStartPhotoPlaybackIntent",
  "url" : "https:\/\/developer.apple.com\/documentation\/intents\/instartphotoplaybackintent"
}