{
  "abstract" : "The price of a ride involving the specified number of people.",
  "codeExamples" : [

  ],
  "conformsTo" : [
    "CVarArg",
    "CustomDebugStringConvertible",
    "CustomStringConvertible",
    "Equatable",
    "Hashable",
    "NSCoding",
    "NSCopying",
    "NSObjectProtocol",
    "NSSecureCoding"
  ],
  "contentHash" : "405982964728e5f59fa77ef2c44cc50e8dc9a77a7dfdc153b05e695a2b4a9a8e",
  "crawledAt" : "2025-12-05T19:36:49Z",
  "declaration" : {
    "code" : "class INRidePartySizeOption",
    "language" : "swift"
  },
  "id" : "5BF79DEA-C23D-4638-8BE2-0028A6B9AB5A",
  "kind" : "class",
  "language" : "swift",
  "module" : "Intents",
  "overview" : "## Overview\n\nAn [doc:\/\/com.apple.sirikit\/documentation\/Intents\/INRidePartySizeOption] object describes many passengers and the special pricing that applies to a party of that size. When configuring a [doc:\/\/com.apple.sirikit\/documentation\/Intents\/INRideOption] object, you create one or more instances of this class to specify pricing for the user’s party. Present this information to the user along with the other ride option information.",
  "platforms" : [
    "iOS",
    "iPadOS",
    "Mac Catalyst",
    "visionOS",
    "watchOS"
  ],
  "rawMarkdown" : "---\nsource: https:\/\/developer.apple.com\/documentation\/Intents\/INRidePartySizeOption\ncrawled: 2025-12-05T19:36:49Z\n---\n\n# INRidePartySizeOption\n\n**Class**\n\nThe price of a ride involving the specified number of people.\n\n## Declaration\n\n```swift\nclass INRidePartySizeOption\n```\n\n## Overview\n\nAn [doc:\/\/com.apple.sirikit\/documentation\/Intents\/INRidePartySizeOption] object describes many passengers and the special pricing that applies to a party of that size. When configuring a [doc:\/\/com.apple.sirikit\/documentation\/Intents\/INRideOption] object, you create one or more instances of this class to specify pricing for the user’s party. Present this information to the user along with the other ride option information.\n\n## Initializing a Party Size Object\n\n- **init(partySizeRange:sizeDescription:priceRange:)**: Initializes the object with the specified party size and price ranges.\n\n## Getting the Party Size Information\n\n- **partySizeRange**: The number of people in the party, specified as a minimum and maximum value.\n- **sizeDescription**: The user-visible description of the party size.\n- **priceRange**: The pricing information for parties of the specified size.\n\n## Data Objects\n\n- **INRideOption**: Details about a type of ride offered by your ride-booking service.\n- **INRideStatus**: The status of a ride booked through a ride-booking service.\n- **INRideDriver**: Identifying information about a driver of a ride service.\n- **INRideVehicle**: A specific vehicle used by a ride-booking service.\n- **INRideFareLineItem**: A specific type of ride-related charge.\n- **INRideCompletionStatus**: Additional details about whether a ride completed successfully or someone canceled the ride.\n\n## Inherits From\n\n- NSObject\n\n## Conforms To\n\n- CVarArg\n- CustomDebugStringConvertible\n- CustomStringConvertible\n- Equatable\n- Hashable\n- NSCoding\n- NSCopying\n- NSObjectProtocol\n- NSSecureCoding\n\n",
  "sections" : [
    {
      "content" : "",
      "items" : [
        {
          "description" : "Initializes the object with the specified party size and price ranges.",
          "name" : "init(partySizeRange:sizeDescription:priceRange:)",
          "url" : "https:\/\/developer.apple.com\/documentation\/Intents\/INRidePartySizeOption\/init(partySizeRange:sizeDescription:priceRange:)"
        }
      ],
      "title" : "Initializing a Party Size Object"
    },
    {
      "content" : "",
      "items" : [
        {
          "description" : "The number of people in the party, specified as a minimum and maximum value.",
          "name" : "partySizeRange",
          "url" : "https:\/\/developer.apple.com\/documentation\/Intents\/INRidePartySizeOption\/partySizeRange"
        },
        {
          "description" : "The user-visible description of the party size.",
          "name" : "sizeDescription",
          "url" : "https:\/\/developer.apple.com\/documentation\/Intents\/INRidePartySizeOption\/sizeDescription"
        },
        {
          "description" : "The pricing information for parties of the specified size.",
          "name" : "priceRange",
          "url" : "https:\/\/developer.apple.com\/documentation\/Intents\/INRidePartySizeOption\/priceRange"
        }
      ],
      "title" : "Getting the Party Size Information"
    },
    {
      "content" : "",
      "items" : [
        {
          "description" : "Details about a type of ride offered by your ride-booking service.",
          "name" : "INRideOption",
          "url" : "https:\/\/developer.apple.com\/documentation\/Intents\/INRideOption"
        },
        {
          "description" : "The status of a ride booked through a ride-booking service.",
          "name" : "INRideStatus",
          "url" : "https:\/\/developer.apple.com\/documentation\/Intents\/INRideStatus"
        },
        {
          "description" : "Identifying information about a driver of a ride service.",
          "name" : "INRideDriver",
          "url" : "https:\/\/developer.apple.com\/documentation\/Intents\/INRideDriver"
        },
        {
          "description" : "A specific vehicle used by a ride-booking service.",
          "name" : "INRideVehicle",
          "url" : "https:\/\/developer.apple.com\/documentation\/Intents\/INRideVehicle"
        },
        {
          "description" : "A specific type of ride-related charge.",
          "name" : "INRideFareLineItem",
          "url" : "https:\/\/developer.apple.com\/documentation\/Intents\/INRideFareLineItem"
        },
        {
          "description" : "Additional details about whether a ride completed successfully or someone canceled the ride.",
          "name" : "INRideCompletionStatus",
          "url" : "https:\/\/developer.apple.com\/documentation\/Intents\/INRideCompletionStatus"
        }
      ],
      "title" : "Data Objects"
    },
    {
      "content" : "",
      "items" : [
        {
          "name" : "NSObject"
        }
      ],
      "title" : "Inherits From"
    }
  ],
  "source" : "appleJSON",
  "title" : "INRidePartySizeOption",
  "url" : "https:\/\/developer.apple.com\/documentation\/Intents\/INRidePartySizeOption"
}