{
  "abstract" : "The name associated with the radio station.",
  "codeExamples" : [

  ],
  "contentHash" : "9e79c933e864c6b977b0cfced87496a42755f199199f66752852449f70ab0d74",
  "crawledAt" : "2025-12-07T16:02:44Z",
  "declaration" : {
    "code" : "var stationName: String? { get }",
    "language" : "swift"
  },
  "id" : "14CE0802-2C36-4767-BEB0-EF69C2AAFF4D",
  "kind" : "property",
  "language" : "swift",
  "module" : "Intents",
  "overview" : "## Discussion\n\nFor stations that are identifiable by name, this property contains that name. If the user doesn’t provide other identifying information, use the station name to look up the appropriate channel or frequency information.",
  "platforms" : [
    "iOS",
    "iPadOS",
    "Mac Catalyst",
    "visionOS"
  ],
  "rawMarkdown" : "---\nsource: https:\/\/developer.apple.com\/documentation\/Intents\/INSetRadioStationIntent\/stationName\ncrawled: 2025-12-07T16:02:44Z\n---\n\n# stationName\n\n**Instance Property**\n\nThe name associated with the radio station.\n\n## Declaration\n\n```swift\nvar stationName: String? { get }\n```\n\n## Discussion\n\nFor stations that are identifiable by name, this property contains that name. If the user doesn’t provide other identifying information, use the station name to look up the appropriate channel or frequency information.\n\n## Getting Details About the Radio Station to Set\n\n- **radioType**: The type of radio tuner to use.\n- **frequency**: The broadcast frequency of the radio station.\n- **channel**: The channel number of the station.\n- **presetNumber**: The programmable preset assigned to the station.\n\n",
  "sections" : [
    {
      "content" : "",
      "items" : [
        {
          "description" : "The type of radio tuner to use.",
          "name" : "radioType",
          "url" : "https:\/\/developer.apple.com\/documentation\/Intents\/INSetRadioStationIntent\/radioType"
        },
        {
          "description" : "The broadcast frequency of the radio station.",
          "name" : "frequency",
          "url" : "https:\/\/developer.apple.com\/documentation\/Intents\/INSetRadioStationIntent\/frequency-2ctw6"
        },
        {
          "description" : "The channel number of the station.",
          "name" : "channel",
          "url" : "https:\/\/developer.apple.com\/documentation\/Intents\/INSetRadioStationIntent\/channel"
        },
        {
          "description" : "The programmable preset assigned to the station.",
          "name" : "presetNumber",
          "url" : "https:\/\/developer.apple.com\/documentation\/Intents\/INSetRadioStationIntent\/presetNumber-2dub4"
        }
      ],
      "title" : "Getting Details About the Radio Station to Set"
    }
  ],
  "source" : "appleJSON",
  "title" : "stationName",
  "url" : "https:\/\/developer.apple.com\/documentation\/Intents\/INSetRadioStationIntent\/stationName"
}