{
  "abstract" : "An abstract class that defines the types of content contained in notes.",
  "codeExamples" : [

  ],
  "conformsTo" : [
    "CVarArg",
    "CustomDebugStringConvertible",
    "CustomStringConvertible",
    "Equatable",
    "Hashable",
    "NSCoding",
    "NSCopying",
    "NSObjectProtocol",
    "NSSecureCoding"
  ],
  "contentHash" : "9125694a0400fe9e173e36c51eb373eee1e6d071fea621d3c8c894bcf0f0978e",
  "crawledAt" : "2025-12-05T18:03:27Z",
  "declaration" : {
    "code" : "class INNoteContent",
    "language" : "swift"
  },
  "id" : "2BEFDE29-D4C9-4588-86DD-49EB55F1A367",
  "inheritedBy" : [
    "INImageNoteContent",
    "INTextNoteContent"
  ],
  "kind" : "class",
  "language" : "swift",
  "module" : "Intents",
  "overview" : "## Overview\n\nYou don’t create instances of this class directly. Instead, you create instances of the [doc:\/\/com.apple.sirikit\/documentation\/Intents\/INTextNoteContent] or [doc:\/\/com.apple.sirikit\/documentation\/Intents\/INImageNoteContent] subclasses.",
  "platforms" : [
    "iOS",
    "iPadOS",
    "Mac Catalyst",
    "visionOS",
    "watchOS"
  ],
  "rawMarkdown" : "---\nsource: https:\/\/developer.apple.com\/documentation\/Intents\/INNoteContent\ncrawled: 2025-12-05T18:03:27Z\n---\n\n# INNoteContent\n\n**Class**\n\nAn abstract class that defines the types of content contained in notes.\n\n## Declaration\n\n```swift\nclass INNoteContent\n```\n\n## Overview\n\nYou don’t create instances of this class directly. Instead, you create instances of the [doc:\/\/com.apple.sirikit\/documentation\/Intents\/INTextNoteContent] or [doc:\/\/com.apple.sirikit\/documentation\/Intents\/INImageNoteContent] subclasses.\n\n## Note Objects\n\n- **INNote**: The content and metadata associated with a single note entry in your app.\n- **INTextNoteContent**: The textual content of a note.\n- **INImageNoteContent**: An image contained in a note.\n\n## Inherits From\n\n- NSObject\n\n## Inherited By\n\n- INImageNoteContent\n- INTextNoteContent\n\n## Conforms To\n\n- CVarArg\n- CustomDebugStringConvertible\n- CustomStringConvertible\n- Equatable\n- Hashable\n- NSCoding\n- NSCopying\n- NSObjectProtocol\n- NSSecureCoding\n\n",
  "sections" : [
    {
      "content" : "",
      "items" : [
        {
          "description" : "The content and metadata associated with a single note entry in your app.",
          "name" : "INNote",
          "url" : "https:\/\/developer.apple.com\/documentation\/Intents\/INNote"
        },
        {
          "description" : "The textual content of a note.",
          "name" : "INTextNoteContent",
          "url" : "https:\/\/developer.apple.com\/documentation\/Intents\/INTextNoteContent"
        },
        {
          "description" : "An image contained in a note.",
          "name" : "INImageNoteContent",
          "url" : "https:\/\/developer.apple.com\/documentation\/Intents\/INImageNoteContent"
        }
      ],
      "title" : "Note Objects"
    },
    {
      "content" : "",
      "items" : [
        {
          "name" : "NSObject"
        }
      ],
      "title" : "Inherits From"
    }
  ],
  "source" : "appleJSON",
  "title" : "INNoteContent",
  "url" : "https:\/\/developer.apple.com\/documentation\/Intents\/INNoteContent"
}