{
  "abstract" : "Your app’s response to a request to create a note.",
  "codeExamples" : [

  ],
  "conformsTo" : [
    "CVarArg",
    "CustomDebugStringConvertible",
    "CustomStringConvertible",
    "Equatable",
    "Hashable",
    "NSCoding",
    "NSCopying",
    "NSObjectProtocol",
    "NSSecureCoding"
  ],
  "contentHash" : "274f361b49fdeb1ac6abc88332bda80abfbd2eb677479925055d44e98fa285a5",
  "crawledAt" : "2025-12-05T19:32:40Z",
  "declaration" : {
    "code" : "class INCreateNoteIntentResponse",
    "language" : "swift"
  },
  "id" : "ECECBE62-A981-4BFC-8E6F-CC63ED648711",
  "kind" : "class",
  "language" : "swift",
  "module" : "Intents",
  "overview" : "## Overview\n\nUse an [doc:\/\/com.apple.sirikit\/documentation\/Intents\/INCreateNoteIntentResponse] object to return information about the note that your app created. Siri communicates the information from your app’s response to the user at appropriate times.\n\nYou create an [doc:\/\/com.apple.sirikit\/documentation\/Intents\/INCreateNoteIntentResponse] object in the [doc:\/\/com.apple.sirikit\/documentation\/Intents\/INCreateNoteIntentHandling\/confirm(intent:completion:)] and [doc:\/\/com.apple.sirikit\/documentation\/Intents\/INCreateNoteIntentHandling\/handle(intent:completion:)] methods of your handler object. For more information about implementing your handler object, see [doc:\/\/com.apple.sirikit\/documentation\/Intents\/INCreateNoteIntentHandling].",
  "platforms" : [
    "iOS",
    "iPadOS",
    "Mac Catalyst",
    "visionOS",
    "watchOS"
  ],
  "rawMarkdown" : "---\nsource: https:\/\/developer.apple.com\/documentation\/Intents\/INCreateNoteIntentResponse\ncrawled: 2025-12-05T19:32:40Z\n---\n\n# INCreateNoteIntentResponse\n\n**Class**\n\nYour app’s response to a request to create a note.\n\n## Declaration\n\n```swift\nclass INCreateNoteIntentResponse\n```\n\n## Overview\n\nUse an [doc:\/\/com.apple.sirikit\/documentation\/Intents\/INCreateNoteIntentResponse] object to return information about the note that your app created. Siri communicates the information from your app’s response to the user at appropriate times.\n\nYou create an [doc:\/\/com.apple.sirikit\/documentation\/Intents\/INCreateNoteIntentResponse] object in the [doc:\/\/com.apple.sirikit\/documentation\/Intents\/INCreateNoteIntentHandling\/confirm(intent:completion:)] and [doc:\/\/com.apple.sirikit\/documentation\/Intents\/INCreateNoteIntentHandling\/handle(intent:completion:)] methods of your handler object. For more information about implementing your handler object, see [doc:\/\/com.apple.sirikit\/documentation\/Intents\/INCreateNoteIntentHandling].\n\n## Initializing the Response Object\n\n- **init(code:userActivity:)**: Initializes the response object with the specified code and user activity object.\n\n## Getting the Response Code\n\n- **code**: The code indicating whether you successfully handled the intent.\n- **INCreateNoteIntentResponseCode**: Constants indicating the state of the response.\n\n## Accessing the Note Content\n\n- **createdNote**: The details of the note that you created.\n\n## Note Creation\n\n- **INCreateNoteIntentHandling**: The handler interface for creating notes.\n- **INCreateNoteIntent**: A request to create a new note.\n\n## Inherits From\n\n- INIntentResponse\n\n## Conforms To\n\n- CVarArg\n- CustomDebugStringConvertible\n- CustomStringConvertible\n- Equatable\n- Hashable\n- NSCoding\n- NSCopying\n- NSObjectProtocol\n- NSSecureCoding\n\n",
  "sections" : [
    {
      "content" : "",
      "items" : [
        {
          "description" : "Initializes the response object with the specified code and user activity object.",
          "name" : "init(code:userActivity:)",
          "url" : "https:\/\/developer.apple.com\/documentation\/Intents\/INCreateNoteIntentResponse\/init(code:userActivity:)"
        }
      ],
      "title" : "Initializing the Response Object"
    },
    {
      "content" : "",
      "items" : [
        {
          "description" : "The code indicating whether you successfully handled the intent.",
          "name" : "code",
          "url" : "https:\/\/developer.apple.com\/documentation\/Intents\/INCreateNoteIntentResponse\/code"
        },
        {
          "description" : "Constants indicating the state of the response.",
          "name" : "INCreateNoteIntentResponseCode",
          "url" : "https:\/\/developer.apple.com\/documentation\/Intents\/INCreateNoteIntentResponseCode"
        }
      ],
      "title" : "Getting the Response Code"
    },
    {
      "content" : "",
      "items" : [
        {
          "description" : "The details of the note that you created.",
          "name" : "createdNote",
          "url" : "https:\/\/developer.apple.com\/documentation\/Intents\/INCreateNoteIntentResponse\/createdNote"
        }
      ],
      "title" : "Accessing the Note Content"
    },
    {
      "content" : "",
      "items" : [
        {
          "description" : "The handler interface for creating notes.",
          "name" : "INCreateNoteIntentHandling",
          "url" : "https:\/\/developer.apple.com\/documentation\/Intents\/INCreateNoteIntentHandling"
        },
        {
          "description" : "A request to create a new note.",
          "name" : "INCreateNoteIntent",
          "url" : "https:\/\/developer.apple.com\/documentation\/Intents\/INCreateNoteIntent"
        }
      ],
      "title" : "Note Creation"
    },
    {
      "content" : "",
      "items" : [
        {
          "name" : "INIntentResponse"
        }
      ],
      "title" : "Inherits From"
    }
  ],
  "source" : "appleJSON",
  "title" : "INCreateNoteIntentResponse",
  "url" : "https:\/\/developer.apple.com\/documentation\/Intents\/INCreateNoteIntentResponse"
}