{
  "abstract" : "A request for a visual code to use for exchanging payment and contact information.",
  "codeExamples" : [

  ],
  "conformsTo" : [
    "CVarArg",
    "CustomDebugStringConvertible",
    "CustomStringConvertible",
    "Equatable",
    "Hashable",
    "INIntentSetImageKeyPath",
    "NSCoding",
    "NSCopying",
    "NSObjectProtocol",
    "NSSecureCoding"
  ],
  "contentHash" : "ae646beef0676cd5c13611d77fd98b70d67742e4a0f54bc695add6f85135bfd9",
  "crawledAt" : "2025-12-05T18:10:10Z",
  "declaration" : {
    "code" : "class INGetVisualCodeIntent",
    "language" : "swift"
  },
  "id" : "4FE2A591-B1C3-470C-A117-5FC0474D21A8",
  "kind" : "class",
  "language" : "swift",
  "module" : "Intents",
  "overview" : "## Overview\n\nSiri creates an [doc:\/\/com.apple.sirikit\/documentation\/Intents\/INGetVisualCodeIntent] object when the user asks for a visual code to use with a scanner. A visual code is a bar code or QR code that embeds information about a transaction. For example, an app might provide a visual code to facilitate payment for services. Apps can also use visual codes to communicate a user’s contact information.\n\nTo handle this intent, the handler object in your Intents extension must adopt the [doc:\/\/com.apple.sirikit\/documentation\/Intents\/INGetVisualCodeIntentHandling] protocol. Your handler should confirm the request and create an [doc:\/\/com.apple.sirikit\/documentation\/Intents\/INGetVisualCodeIntentResponse] object with an image containing the visual code. Siri handles the display of the provided visual code in order to scan it.\n\n### Additional Intent Attributes\n\nThe following table lists additional attributes of this intent object:\n\nWhen performing a search, Siri automatically asks the user to unlock a currently locked device. You don’t need to explicitly ask to unlock the device. In addition, Siri always prompts the user to confirm the request before asking your Intents extension to handle it.\n\n### Example Phrases\n\nUsers can ask Siri to display visual codes in a variety of ways. The table below provides a few sample phrases in different languages. You can use these phrases during testing to trigger your intents. This list isn’t exhaustive and Siri may recognize many other phrases.",
  "platforms" : [
    "iOS",
    "iPadOS",
    "Mac Catalyst",
    "visionOS",
    "watchOS"
  ],
  "rawMarkdown" : "---\nsource: https:\/\/developer.apple.com\/documentation\/intents\/ingetvisualcodeintent\ncrawled: 2025-12-05T18:10:10Z\n---\n\n# INGetVisualCodeIntent\n\n**Class**\n\nA request for a visual code to use for exchanging payment and contact information.\n\n## Declaration\n\n```swift\nclass INGetVisualCodeIntent\n```\n\n## Overview\n\nSiri creates an [doc:\/\/com.apple.sirikit\/documentation\/Intents\/INGetVisualCodeIntent] object when the user asks for a visual code to use with a scanner. A visual code is a bar code or QR code that embeds information about a transaction. For example, an app might provide a visual code to facilitate payment for services. Apps can also use visual codes to communicate a user’s contact information.\n\nTo handle this intent, the handler object in your Intents extension must adopt the [doc:\/\/com.apple.sirikit\/documentation\/Intents\/INGetVisualCodeIntentHandling] protocol. Your handler should confirm the request and create an [doc:\/\/com.apple.sirikit\/documentation\/Intents\/INGetVisualCodeIntentResponse] object with an image containing the visual code. Siri handles the display of the provided visual code in order to scan it.\n\n### Additional Intent Attributes\n\nThe following table lists additional attributes of this intent object:\n\n\n\nWhen performing a search, Siri automatically asks the user to unlock a currently locked device. You don’t need to explicitly ask to unlock the device. In addition, Siri always prompts the user to confirm the request before asking your Intents extension to handle it.\n\n### Example Phrases\n\nUsers can ask Siri to display visual codes in a variety of ways. The table below provides a few sample phrases in different languages. You can use these phrases during testing to trigger your intents. This list isn’t exhaustive and Siri may recognize many other phrases.\n\n\n\n## Initializing the Intent Object\n\n- **init(visualCodeType:)**: Initializes the intent object with information about the requested type of code.\n\n## Getting the Visual Code Type\n\n- **visualCodeType**: The type of visual code requested by the user.\n- **INVisualCodeType**: Constants indicating the purpose of the visual code.\n\n## Visual Codes\n\n- **INGetVisualCodeIntentHandling**: The handler interface for displaying your app’s visual codes.\n- **INGetVisualCodeIntentResponse**: Your app’s response to a request for a visual code.\n\n## Inherits From\n\n- INIntent\n\n## Conforms To\n\n- CVarArg\n- CustomDebugStringConvertible\n- CustomStringConvertible\n- Equatable\n- Hashable\n- INIntentSetImageKeyPath\n- NSCoding\n- NSCopying\n- NSObjectProtocol\n- NSSecureCoding\n\n",
  "sections" : [
    {
      "content" : "",
      "items" : [
        {
          "description" : "Initializes the intent object with information about the requested type of code.",
          "name" : "init(visualCodeType:)",
          "url" : "https:\/\/developer.apple.com\/documentation\/Intents\/INGetVisualCodeIntent\/init(visualCodeType:)"
        }
      ],
      "title" : "Initializing the Intent Object"
    },
    {
      "content" : "",
      "items" : [
        {
          "description" : "The type of visual code requested by the user.",
          "name" : "visualCodeType",
          "url" : "https:\/\/developer.apple.com\/documentation\/Intents\/INGetVisualCodeIntent\/visualCodeType"
        },
        {
          "description" : "Constants indicating the purpose of the visual code.",
          "name" : "INVisualCodeType",
          "url" : "https:\/\/developer.apple.com\/documentation\/Intents\/INVisualCodeType"
        }
      ],
      "title" : "Getting the Visual Code Type"
    },
    {
      "content" : "",
      "items" : [
        {
          "description" : "The handler interface for displaying your app’s visual codes.",
          "name" : "INGetVisualCodeIntentHandling",
          "url" : "https:\/\/developer.apple.com\/documentation\/Intents\/INGetVisualCodeIntentHandling"
        },
        {
          "description" : "Your app’s response to a request for a visual code.",
          "name" : "INGetVisualCodeIntentResponse",
          "url" : "https:\/\/developer.apple.com\/documentation\/Intents\/INGetVisualCodeIntentResponse"
        }
      ],
      "title" : "Visual Codes"
    },
    {
      "content" : "",
      "items" : [
        {
          "name" : "INIntent"
        }
      ],
      "title" : "Inherits From"
    }
  ],
  "source" : "appleJSON",
  "title" : "INGetVisualCodeIntent",
  "url" : "https:\/\/developer.apple.com\/documentation\/intents\/ingetvisualcodeintent"
}