{
  "abstract" : "Asynchronously pauses sync of an item at the given URL.",
  "codeExamples" : [

  ],
  "contentHash" : "7203d7669d90b6c087b60d0b37122b3415023eef455619b8768f82a129c436b6",
  "crawledAt" : "2025-12-06T01:20:58Z",
  "declaration" : {
    "code" : "func pauseSyncForUbiquitousItem(at url: URL, completionHandler: @escaping ((any Error)?) -> Void)",
    "language" : "swift"
  },
  "id" : "03BB3749-F38C-44F5-A574-1642F86BA77A",
  "kind" : "method",
  "language" : "swift",
  "module" : "Foundation",
  "overview" : "## Discussion\n\nCall this when opening an item to prevent sync from altering the contents of the URL. Once paused, the file provider will not upload local changes nor download remote changes.\n\nWhile paused, call [doc:\/\/com.apple.foundation\/documentation\/Foundation\/FileManager\/uploadLocalVersionOfUbiquitousItem(at:withConflictResolutionPolicy:completionHandler:)] when the document is in a stable state. This action keeps the server version as up-to-date as possible.\n\nIf the item is already paused, a second call to this method reports success. If the file provider is already applying changes to the item, the pause fails with an [doc:\/\/com.apple.foundation\/documentation\/Foundation\/NSFileWriteUnknownError-c.enum.case], with an underlying error that has domain [doc:\/\/com.apple.foundation\/documentation\/Foundation\/NSPOSIXErrorDomain] and code [doc:\/\/com.apple.foundation\/documentation\/Foundation\/POSIXError\/EBUSY]. If the pause fails, wait for the state to stabilize before retrying. Pausing also fails with [doc:\/\/com.apple.foundation\/documentation\/Foundation\/CocoaError\/featureUnsupported] if `url` refers to a regular (non-package) directory.\n\nPausing sync is independent of the calling app’s lifecycle; sync doesn’t automatically resume if the app closes or crashes and relaunches later. To resume syncing, explicitly call [doc:\/\/com.apple.foundation\/documentation\/Foundation\/FileManager\/resumeSyncForUbiquitousItem(at:with:completionHandler:)]. Always be sure to resume syncing before you close the item.",
  "platforms" : [
    "iOS",
    "iPadOS",
    "Mac Catalyst",
    "macOS",
    "visionOS"
  ],
  "rawMarkdown" : "---\nsource: https:\/\/developer.apple.com\/documentation\/Foundation\/FileManager\/pauseSyncForUbiquitousItem(at:completionHandler:)\ncrawled: 2025-12-06T01:20:58Z\n---\n\n# pauseSyncForUbiquitousItem(at:completionHandler:)\n\n**Instance Method**\n\nAsynchronously pauses sync of an item at the given URL.\n\n## Declaration\n\n```swift\nfunc pauseSyncForUbiquitousItem(at url: URL, completionHandler: @escaping ((any Error)?) -> Void)\n```\n\n```swift\nfunc pauseSyncForUbiquitousItem(at url: URL) async throws\n```\n\n## Parameters\n\n- **url**: The URL of the item for which to pause sync.\n- **completionHandler**: A closure or block that the framework calls when the pause action completes. It receives a single [doc:\/\/com.apple.foundation\/documentation\/Foundation\/NSError] parameter to indicate an error that prevented pausing; this value is `nil` if the pause succeeded. In Swift, you can omit the completion handler and catch the thrown error instead.\n\n## Discussion\n\nCall this when opening an item to prevent sync from altering the contents of the URL. Once paused, the file provider will not upload local changes nor download remote changes.\n\nWhile paused, call [doc:\/\/com.apple.foundation\/documentation\/Foundation\/FileManager\/uploadLocalVersionOfUbiquitousItem(at:withConflictResolutionPolicy:completionHandler:)] when the document is in a stable state. This action keeps the server version as up-to-date as possible.\n\nIf the item is already paused, a second call to this method reports success. If the file provider is already applying changes to the item, the pause fails with an [doc:\/\/com.apple.foundation\/documentation\/Foundation\/NSFileWriteUnknownError-c.enum.case], with an underlying error that has domain [doc:\/\/com.apple.foundation\/documentation\/Foundation\/NSPOSIXErrorDomain] and code [doc:\/\/com.apple.foundation\/documentation\/Foundation\/POSIXError\/EBUSY]. If the pause fails, wait for the state to stabilize before retrying. Pausing also fails with [doc:\/\/com.apple.foundation\/documentation\/Foundation\/CocoaError\/featureUnsupported] if `url` refers to a regular (non-package) directory.\n\nPausing sync is independent of the calling app’s lifecycle; sync doesn’t automatically resume if the app closes or crashes and relaunches later. To resume syncing, explicitly call [doc:\/\/com.apple.foundation\/documentation\/Foundation\/FileManager\/resumeSyncForUbiquitousItem(at:with:completionHandler:)]. Always be sure to resume syncing before you close the item.\n\n## Controlling file provider synchronization\n\n- **NSFileManagerSupportedSyncControls**: An option set of the sync controls available for an item.\n- **resumeSyncForUbiquitousItem(at:with:completionHandler:)**: Asynchronously resumes the sync on a paused item using the given resume behavior.\n- **NSFileManagerResumeSyncBehavior**: The behaviors the file manager can apply to resolve conflicts when resuming a sync.\n- **fetchLatestRemoteVersionOfItem(at:completionHandler:)**: Asynchronously fetches the latest remote version of a given item from the server.\n- **NSFileVersion**: A snapshot of a file at a specific point in time.\n- **uploadLocalVersionOfUbiquitousItem(at:withConflictResolutionPolicy:completionHandler:)**: Asynchronously uploads the local version of the item using the provided conflict resolution policy.\n- **NSFileManagerUploadLocalVersionConflictPolicy**: The policies the file manager can apply to resolve conflicts when uploading a local version of a file.\n\n",
  "sections" : [
    {
      "content" : "",
      "items" : [
        {
          "description" : "An option set of the sync controls available for an item.",
          "name" : "NSFileManagerSupportedSyncControls",
          "url" : "https:\/\/developer.apple.com\/documentation\/Foundation\/NSFileManagerSupportedSyncControls"
        },
        {
          "description" : "Asynchronously resumes the sync on a paused item using the given resume behavior.",
          "name" : "resumeSyncForUbiquitousItem(at:with:completionHandler:)",
          "url" : "https:\/\/developer.apple.com\/documentation\/Foundation\/FileManager\/resumeSyncForUbiquitousItem(at:with:completionHandler:)"
        },
        {
          "description" : "The behaviors the file manager can apply to resolve conflicts when resuming a sync.",
          "name" : "NSFileManagerResumeSyncBehavior",
          "url" : "https:\/\/developer.apple.com\/documentation\/Foundation\/NSFileManagerResumeSyncBehavior"
        },
        {
          "description" : "Asynchronously fetches the latest remote version of a given item from the server.",
          "name" : "fetchLatestRemoteVersionOfItem(at:completionHandler:)",
          "url" : "https:\/\/developer.apple.com\/documentation\/Foundation\/FileManager\/fetchLatestRemoteVersionOfItem(at:completionHandler:)"
        },
        {
          "description" : "A snapshot of a file at a specific point in time.",
          "name" : "NSFileVersion",
          "url" : "https:\/\/developer.apple.com\/documentation\/Foundation\/NSFileVersion"
        },
        {
          "description" : "Asynchronously uploads the local version of the item using the provided conflict resolution policy.",
          "name" : "uploadLocalVersionOfUbiquitousItem(at:withConflictResolutionPolicy:completionHandler:)",
          "url" : "https:\/\/developer.apple.com\/documentation\/Foundation\/FileManager\/uploadLocalVersionOfUbiquitousItem(at:withConflictResolutionPolicy:completionHandler:)"
        },
        {
          "description" : "The policies the file manager can apply to resolve conflicts when uploading a local version of a file.",
          "name" : "NSFileManagerUploadLocalVersionConflictPolicy",
          "url" : "https:\/\/developer.apple.com\/documentation\/Foundation\/NSFileManagerUploadLocalVersionConflictPolicy"
        }
      ],
      "title" : "Controlling file provider synchronization"
    }
  ],
  "source" : "appleJSON",
  "title" : "pauseSyncForUbiquitousItem(at:completionHandler:)",
  "url" : "https:\/\/developer.apple.com\/documentation\/Foundation\/FileManager\/pauseSyncForUbiquitousItem(at:completionHandler:)"
}