{
  "abstract" : "Returns an array of strings made by separately appending to the receiver each string in a given array.",
  "codeExamples" : [

  ],
  "contentHash" : "a444b0ad7ac1facde12884e045f90751a990129d620d4a3660015672e7c9152e",
  "crawledAt" : "2025-12-01T21:18:41Z",
  "declaration" : {
    "code" : "func strings(byAppendingPaths paths: [String]) -> [String]",
    "language" : "swift"
  },
  "id" : "932C63C3-A99B-49D9-A376-E1F406927828",
  "kind" : "method",
  "module" : "Foundation",
  "overview" : "## Return Value\n\nAn array of string objects made by separately appending each string in `paths` to the receiver, preceded if necessary by a path separator.\n\n## Discussion\n\nNote that this method only works with file paths (not, for example, string representations of URLs). See [doc:\/\/com.apple.foundation\/documentation\/Foundation\/NSString\/appendingPathComponent(_:)] for an individual example.",
  "platforms" : [
    "iOS",
    "iPadOS",
    "Mac Catalyst",
    "macOS",
    "tvOS",
    "visionOS",
    "watchOS"
  ],
  "rawMarkdown" : "---\nsource: https:\/\/developer.apple.com\/documentation\/Foundation\/NSString\/strings(byAppendingPaths:)\ncrawled: 2025-12-01T21:18:41Z\n---\n\n# strings(byAppendingPaths:)\n\n**Instance Method**\n\nReturns an array of strings made by separately appending to the receiver each string in a given array.\n\n## Declaration\n\n```swift\nfunc strings(byAppendingPaths paths: [String]) -> [String]\n```\n\n## Parameters\n\n- **paths**: An array of `NSString` objects specifying paths to add to the receiver.\n\n## Return Value\n\nAn array of string objects made by separately appending each string in `paths` to the receiver, preceded if necessary by a path separator.\n\n## Discussion\n\nNote that this method only works with file paths (not, for example, string representations of URLs). See [doc:\/\/com.apple.foundation\/documentation\/Foundation\/NSString\/appendingPathComponent(_:)] for an individual example.\n\n## Working with Paths\n\n- **path(withComponents:)**: Returns a string built from the strings in a given array by concatenating them with a path separator between each pair.\n- **pathComponents**: The file-system path components of the receiver.\n- **completePath(into:caseSensitive:matchesInto:filterTypes:)**: Interprets the receiver as a path in the file system and attempts to perform filename completion, returning a numeric value that indicates whether a match was possible, and by reference the longest path that matches the receiver.\n- **fileSystemRepresentation**: A file system-specific representation of the receiver.\n- **getFileSystemRepresentation(_:maxLength:)**: Interprets the receiver as a system-independent path and fills a buffer with a C-string in a format and encoding suitable for use with file-system calls.\n- **isAbsolutePath**: A Boolean value that indicates whether the receiver represents an absolute path.\n- **lastPathComponent**: The last path component of the receiver.\n- **pathExtension**: The path extension, if any, of the string as interpreted as a path.\n- **abbreviatingWithTildeInPath**: A new string that replaces the current home directory portion of the current path with a tilde (`~`) character.\n- **appendingPathComponent(_:)**: Returns a new string made by appending to the receiver a given string.\n- **appendingPathExtension(_:)**: Returns a new string made by appending to the receiver an extension separator followed by a given extension.\n- **deletingLastPathComponent**: A new string made by deleting the last path component from the receiver, along with any final path separator.\n- **deletingPathExtension**: A new string made by deleting the extension (if any, and only the last) from the receiver.\n- **expandingTildeInPath**: A new string made by expanding the initial component of the receiver to its full path value.\n- **resolvingSymlinksInPath**: A new string made from the receiver by resolving all symbolic links and standardizing path.\n\n",
  "sections" : [
    {
      "content" : "",
      "items" : [
        {
          "description" : "Returns a string built from the strings in a given array by concatenating them with a path separator between each pair.",
          "name" : "path(withComponents:)",
          "url" : "https:\/\/developer.apple.com\/documentation\/Foundation\/NSString\/path(withComponents:)"
        },
        {
          "description" : "The file-system path components of the receiver.",
          "name" : "pathComponents",
          "url" : "https:\/\/developer.apple.com\/documentation\/Foundation\/NSString\/pathComponents"
        },
        {
          "description" : "Interprets the receiver as a path in the file system and attempts to perform filename completion, returning a numeric value that indicates whether a match was possible, and by reference the longest path that matches the receiver.",
          "name" : "completePath(into:caseSensitive:matchesInto:filterTypes:)",
          "url" : "https:\/\/developer.apple.com\/documentation\/Foundation\/NSString\/completePath(into:caseSensitive:matchesInto:filterTypes:)"
        },
        {
          "description" : "A file system-specific representation of the receiver.",
          "name" : "fileSystemRepresentation",
          "url" : "https:\/\/developer.apple.com\/documentation\/Foundation\/NSString\/fileSystemRepresentation"
        },
        {
          "description" : "Interprets the receiver as a system-independent path and fills a buffer with a C-string in a format and encoding suitable for use with file-system calls.",
          "name" : "getFileSystemRepresentation(_:maxLength:)",
          "url" : "https:\/\/developer.apple.com\/documentation\/Foundation\/NSString\/getFileSystemRepresentation(_:maxLength:)"
        },
        {
          "description" : "A Boolean value that indicates whether the receiver represents an absolute path.",
          "name" : "isAbsolutePath",
          "url" : "https:\/\/developer.apple.com\/documentation\/Foundation\/NSString\/isAbsolutePath"
        },
        {
          "description" : "The last path component of the receiver.",
          "name" : "lastPathComponent",
          "url" : "https:\/\/developer.apple.com\/documentation\/Foundation\/NSString\/lastPathComponent"
        },
        {
          "description" : "The path extension, if any, of the string as interpreted as a path.",
          "name" : "pathExtension",
          "url" : "https:\/\/developer.apple.com\/documentation\/Foundation\/NSString\/pathExtension"
        },
        {
          "description" : "A new string that replaces the current home directory portion of the current path with a tilde (`~`) character.",
          "name" : "abbreviatingWithTildeInPath",
          "url" : "https:\/\/developer.apple.com\/documentation\/Foundation\/NSString\/abbreviatingWithTildeInPath"
        },
        {
          "description" : "Returns a new string made by appending to the receiver a given string.",
          "name" : "appendingPathComponent(_:)",
          "url" : "https:\/\/developer.apple.com\/documentation\/Foundation\/NSString\/appendingPathComponent(_:)"
        },
        {
          "description" : "Returns a new string made by appending to the receiver an extension separator followed by a given extension.",
          "name" : "appendingPathExtension(_:)",
          "url" : "https:\/\/developer.apple.com\/documentation\/Foundation\/NSString\/appendingPathExtension(_:)"
        },
        {
          "description" : "A new string made by deleting the last path component from the receiver, along with any final path separator.",
          "name" : "deletingLastPathComponent",
          "url" : "https:\/\/developer.apple.com\/documentation\/Foundation\/NSString\/deletingLastPathComponent"
        },
        {
          "description" : "A new string made by deleting the extension (if any, and only the last) from the receiver.",
          "name" : "deletingPathExtension",
          "url" : "https:\/\/developer.apple.com\/documentation\/Foundation\/NSString\/deletingPathExtension"
        },
        {
          "description" : "A new string made by expanding the initial component of the receiver to its full path value.",
          "name" : "expandingTildeInPath",
          "url" : "https:\/\/developer.apple.com\/documentation\/Foundation\/NSString\/expandingTildeInPath"
        },
        {
          "description" : "A new string made from the receiver by resolving all symbolic links and standardizing path.",
          "name" : "resolvingSymlinksInPath",
          "url" : "https:\/\/developer.apple.com\/documentation\/Foundation\/NSString\/resolvingSymlinksInPath"
        }
      ],
      "title" : "Working with Paths"
    }
  ],
  "source" : "appleJSON",
  "title" : "strings(byAppendingPaths:)",
  "url" : "https:\/\/developer.apple.com\/documentation\/Foundation\/NSString\/strings(byAppendingPaths:)"
}