{
  "abstract" : "Creates a directory (without contents) at a given path with given attributes.",
  "codeExamples" : [

  ],
  "contentHash" : "456fd1c4a022af3977bc6ae58cc4ec039e0f278ba6c72f6c3237a3c7b9179a18",
  "crawledAt" : "2025-12-06T02:51:48Z",
  "declaration" : {
    "code" : "func createDirectory(atPath path: String, attributes: [AnyHashable : Any] = [:]) -> Bool",
    "language" : "swift"
  },
  "id" : "41320AB5-2648-4147-9164-E5A9CB5F7F38",
  "kind" : "method",
  "language" : "swift",
  "module" : "Foundation",
  "overview" : "## Return Value\n\n[doc:\/\/com.apple.documentation\/documentation\/Swift\/true] if the operation was successful, otherwise [doc:\/\/com.apple.documentation\/documentation\/Swift\/false].\n\n## Discussion\n\nBecause this method does not return error information, it has been deprecated as of OS X v10.5. Use [doc:\/\/com.apple.foundation\/documentation\/Foundation\/FileManager\/createDirectory(atPath:withIntermediateDirectories:attributes:)] instead.",
  "platforms" : [
    "tvOS",
    "visionOS",
    "watchOS"
  ],
  "rawMarkdown" : "---\nsource: https:\/\/developer.apple.com\/documentation\/Foundation\/FileManager\/createDirectory(atPath:attributes:)\ncrawled: 2025-12-06T02:51:48Z\n---\n\n# createDirectory(atPath:attributes:)\n\n**Instance Method**\n\nCreates a directory (without contents) at a given path with given attributes.\n\n## Declaration\n\n```swift\nfunc createDirectory(atPath path: String, attributes: [AnyHashable : Any] = [:]) -> Bool\n```\n\n## Parameters\n\n- **path**: The path at which to create the new directory. The directory to be created must not yet exist, but its parent directory must exist.\n- **attributes**: The file attributes for the new directory. The attributes you can set are owner and group numbers, file permissions, and modification date. If you specify `nil` for `attributes`, default values for these attributes are set (particularly write access for the creator and read access for others). For a list of keys you can include in this dictionary, Supporting Types. Some of the keys, such as `NSFileHFSCreatorCode` and `NSFileHFSTypeCode`, do not apply to directories.\n\n## Return Value\n\n[doc:\/\/com.apple.documentation\/documentation\/Swift\/true] if the operation was successful, otherwise [doc:\/\/com.apple.documentation\/documentation\/Swift\/false].\n\n## Discussion\n\nBecause this method does not return error information, it has been deprecated as of OS X v10.5. Use [doc:\/\/com.apple.foundation\/documentation\/Foundation\/FileManager\/createDirectory(atPath:withIntermediateDirectories:attributes:)] instead.\n\n## Related Documentation\n\n- **changeCurrentDirectoryPath(_:)**: Changes the path of the current working directory to the specified path.\n- **createDirectory(atPath:withIntermediateDirectories:attributes:)**: Creates a directory with given attributes at the specified path.\n- **createFile(atPath:contents:attributes:)**: Creates a file with the specified content and attributes at the given location.\n- **setAttributes(_:ofItemAtPath:)**: Sets the attributes of the specified file or directory.\n- **currentDirectoryPath**: The path to the program’s current directory.\n\n## Deprecated Methods\n\n- **changeFileAttributes(_:atPath:)**: Changes the attributes of a given file or directory.\n- **fileAttributes(atPath:traverseLink:)**: Returns a dictionary that describes the POSIX attributes of the file specified at a given.\n- **fileSystemAttributes(atPath:)**: Returns a dictionary that describes the attributes of the mounted file system on which a given path resides.\n- **directoryContents(atPath:)**: Returns the directories and files (including symbolic links) contained in a given directory.\n- **createSymbolicLink(atPath:pathContent:)**: Creates a symbolic link identified by a given path that refers to a given location.\n- **pathContentOfSymbolicLink(atPath:)**: Returns the path of the directory or file that a symbolic link at a given path refers to.\n- **fileManager(_:shouldProceedAfterError:)**: An `NSFileManager` object sends this message to its handler for each error it encounters when copying, moving, removing, or linking files or directories.\n- **fileManager(_:willProcessPath:)**: An `NSFileManager` object sends this message to a handler immediately before attempting to move, copy, rename, or delete, or before attempting to link to a given path.\n- **replaceItemAtURL(originalItemURL:withItemAtURL:backupItemName:options:)**: Replaces the contents of the item at the specified URL in a manner that ensures no data loss occurs.\n\n",
  "sections" : [
    {
      "content" : "",
      "items" : [
        {
          "description" : "Changes the path of the current working directory to the specified path.",
          "name" : "changeCurrentDirectoryPath(_:)",
          "url" : "https:\/\/developer.apple.com\/documentation\/Foundation\/FileManager\/changeCurrentDirectoryPath(_:)"
        },
        {
          "description" : "Creates a directory with given attributes at the specified path.",
          "name" : "createDirectory(atPath:withIntermediateDirectories:attributes:)",
          "url" : "https:\/\/developer.apple.com\/documentation\/Foundation\/FileManager\/createDirectory(atPath:withIntermediateDirectories:attributes:)"
        },
        {
          "description" : "Creates a file with the specified content and attributes at the given location.",
          "name" : "createFile(atPath:contents:attributes:)",
          "url" : "https:\/\/developer.apple.com\/documentation\/Foundation\/FileManager\/createFile(atPath:contents:attributes:)"
        },
        {
          "description" : "Sets the attributes of the specified file or directory.",
          "name" : "setAttributes(_:ofItemAtPath:)",
          "url" : "https:\/\/developer.apple.com\/documentation\/Foundation\/FileManager\/setAttributes(_:ofItemAtPath:)"
        },
        {
          "description" : "The path to the program’s current directory.",
          "name" : "currentDirectoryPath",
          "url" : "https:\/\/developer.apple.com\/documentation\/Foundation\/FileManager\/currentDirectoryPath"
        }
      ],
      "title" : "Related Documentation"
    },
    {
      "content" : "",
      "items" : [
        {
          "description" : "Changes the attributes of a given file or directory.",
          "name" : "changeFileAttributes(_:atPath:)",
          "url" : "https:\/\/developer.apple.com\/documentation\/Foundation\/FileManager\/changeFileAttributes(_:atPath:)"
        },
        {
          "description" : "Returns a dictionary that describes the POSIX attributes of the file specified at a given.",
          "name" : "fileAttributes(atPath:traverseLink:)",
          "url" : "https:\/\/developer.apple.com\/documentation\/Foundation\/FileManager\/fileAttributes(atPath:traverseLink:)"
        },
        {
          "description" : "Returns a dictionary that describes the attributes of the mounted file system on which a given path resides.",
          "name" : "fileSystemAttributes(atPath:)",
          "url" : "https:\/\/developer.apple.com\/documentation\/Foundation\/FileManager\/fileSystemAttributes(atPath:)"
        },
        {
          "description" : "Returns the directories and files (including symbolic links) contained in a given directory.",
          "name" : "directoryContents(atPath:)",
          "url" : "https:\/\/developer.apple.com\/documentation\/Foundation\/FileManager\/directoryContents(atPath:)"
        },
        {
          "description" : "Creates a symbolic link identified by a given path that refers to a given location.",
          "name" : "createSymbolicLink(atPath:pathContent:)",
          "url" : "https:\/\/developer.apple.com\/documentation\/Foundation\/FileManager\/createSymbolicLink(atPath:pathContent:)"
        },
        {
          "description" : "Returns the path of the directory or file that a symbolic link at a given path refers to.",
          "name" : "pathContentOfSymbolicLink(atPath:)",
          "url" : "https:\/\/developer.apple.com\/documentation\/Foundation\/FileManager\/pathContentOfSymbolicLink(atPath:)"
        },
        {
          "description" : "An `NSFileManager` object sends this message to its handler for each error it encounters when copying, moving, removing, or linking files or directories.",
          "name" : "fileManager(_:shouldProceedAfterError:)",
          "url" : "https:\/\/developer.apple.com\/documentation\/ObjectiveC\/NSObject-swift.class\/fileManager(_:shouldProceedAfterError:)"
        },
        {
          "description" : "An `NSFileManager` object sends this message to a handler immediately before attempting to move, copy, rename, or delete, or before attempting to link to a given path.",
          "name" : "fileManager(_:willProcessPath:)",
          "url" : "https:\/\/developer.apple.com\/documentation\/ObjectiveC\/NSObject-swift.class\/fileManager(_:willProcessPath:)"
        },
        {
          "description" : "Replaces the contents of the item at the specified URL in a manner that ensures no data loss occurs.",
          "name" : "replaceItemAtURL(originalItemURL:withItemAtURL:backupItemName:options:)",
          "url" : "https:\/\/developer.apple.com\/documentation\/Foundation\/FileManager\/replaceItemAtURL(originalItemURL:withItemAtURL:backupItemName:options:)"
        }
      ],
      "title" : "Deprecated Methods"
    }
  ],
  "source" : "appleJSON",
  "title" : "createDirectory(atPath:attributes:)",
  "url" : "https:\/\/developer.apple.com\/documentation\/Foundation\/FileManager\/createDirectory(atPath:attributes:)"
}