{
  "abstract" : "An object that represents a subprocess of the current process.",
  "codeExamples" : [

  ],
  "conformsTo" : [
    "CVarArg",
    "CustomDebugStringConvertible",
    "CustomStringConvertible",
    "Equatable",
    "Hashable",
    "NSObjectProtocol",
    "Sendable",
    "SendableMetatype"
  ],
  "contentHash" : "3dfd85f8ac6ba9cdadb650fc263bd3e93dd5cb9b23af59d3dfd690573c965988",
  "crawledAt" : "2025-12-07T13:45:11Z",
  "declaration" : {
    "code" : "class Process",
    "language" : "swift"
  },
  "id" : "75375CD5-0CDE-4A56-8812-FEF979CD44E0",
  "kind" : "class",
  "language" : "swift",
  "module" : "Foundation",
  "overview" : "## Overview\n\nUsing this class, your program can run another program as a subprocess and monitor that program’s execution. Unlike [doc:\/\/com.apple.foundation\/documentation\/Foundation\/Thread], it doesn’t share memory space with the process that creates it.\n\nA process operates within an environment defined by the current values for several items: the current directory, standard input, standard output, standard error, and the values of any environment variables, inheriting its environment from the process that launches it. If there are any environment variables that should be different for the subprocess (for example, if the current directory needs to change), change it in the instance after initialization, before your app launches it. Your app can’t change a process’s environment while it’s running.\n\nYou can only run the subprocess once per instance. Subsequent attempts raise an error.",
  "platforms" : [
    "Mac Catalyst",
    "macOS"
  ],
  "rawMarkdown" : "---\nsource: https:\/\/developer.apple.com\/documentation\/foundation\/process\ncrawled: 2025-12-07T13:45:11Z\n---\n\n# Process\n\n**Class**\n\nAn object that represents a subprocess of the current process.\n\n## Declaration\n\n```swift\nclass Process\n```\n\n## Overview\n\nUsing this class, your program can run another program as a subprocess and monitor that program’s execution. Unlike [doc:\/\/com.apple.foundation\/documentation\/Foundation\/Thread], it doesn’t share memory space with the process that creates it.\n\nA process operates within an environment defined by the current values for several items: the current directory, standard input, standard output, standard error, and the values of any environment variables, inheriting its environment from the process that launches it. If there are any environment variables that should be different for the subprocess (for example, if the current directory needs to change), change it in the instance after initialization, before your app launches it. Your app can’t change a process’s environment while it’s running.\n\nYou can only run the subprocess once per instance. Subsequent attempts raise an error.\n\n\n\n## Creating and Initializing\n\n- **run(_:arguments:terminationHandler:)**: Creates and runs a task with a specified executable and arguments.\n- **init()**: Returns an initialized process object with the environment of the current process.\n\n## Returning Information\n\n- **processIdentifier**: The receiver’s process identifier.\n\n## Running and Stopping\n\n- **run()**: Runs the process with the current environment.\n- **interrupt()**: Sends an interrupt signal to the receiver and all of its subtasks.\n- **resume()**: Resumes execution of a suspended task.\n- **suspend()**: Suspends execution of the receiver task.\n- **terminate()**: Sends a terminate signal to the receiver and all of its subtasks.\n- **waitUntilExit()**: Blocks the process until the receiver is finished.\n\n## Querying the State\n\n- **isRunning**: A status that indicates whether the receiver is still running.\n- **terminationStatus**: The exit status the receiver’s executable returns.\n- **terminationReason**: The reason the system terminated the task.\n\n## Configuring\n\n- **arguments**: The command arguments that the system uses to launch the executable.\n- **currentDirectoryURL**: The current directory for the receiver.\n- **environment**: The environment for the receiver.\n- **executableURL**: The receiver’s executable.\n- **qualityOfService**: The default quality of service level the system applies to operations the task executes.\n- **standardError**: The standard error for the receiver.\n- **standardInput**: The standard input for the receiver.\n- **standardOutput**: The standard output for the receiver.\n\n## Termination Handler\n\n- **terminationHandler**: A completion block the system invokes when the task completes.\n\n## Constants\n\n- **Process.TerminationReason**: Constants that specify the termination reason values that the system returns.\n- **QualityOfService**: Constants that indicate the nature and importance of work to the system.\n\n## Notifications\n\n- **didTerminateNotification**: Posted when the task has stopped execution.\n\n## Deprecated\n\n- **launchedProcess(launchPath:arguments:)**: Creates and launches a task with a specified executable and arguments.\n- **currentDirectoryPath**: Sets the current directory for the receiver.\n- **launchPath**: Sets the receiver’s executable.\n- **launch()**: Launches the task represented by the receiver.\n\n## Structures\n\n- **Process.DidTerminateMessage**\n\n## Instance Properties\n\n- **launchRequirement**\n- **launchRequirementData**\n\n## Scripts and External Tasks\n\n- **NSUserScriptTask**: An object that executes scripts.\n- **NSUserAppleScriptTask**: An object that executes AppleScript scripts.\n- **NSUserAutomatorTask**: An object that executes Automator workflows.\n- **NSUserUnixTask**: An object that executes unix applications.\n\n## Inherits From\n\n- NSObject\n\n## Conforms To\n\n- CVarArg\n- CustomDebugStringConvertible\n- CustomStringConvertible\n- Equatable\n- Hashable\n- NSObjectProtocol\n- Sendable\n- SendableMetatype\n\n",
  "sections" : [
    {
      "content" : "",
      "items" : [
        {
          "description" : "Creates and runs a task with a specified executable and arguments.",
          "name" : "run(_:arguments:terminationHandler:)",
          "url" : "https:\/\/developer.apple.com\/documentation\/Foundation\/Process\/run(_:arguments:terminationHandler:)"
        },
        {
          "description" : "Returns an initialized process object with the environment of the current process.",
          "name" : "init()",
          "url" : "https:\/\/developer.apple.com\/documentation\/Foundation\/Process\/init()"
        }
      ],
      "title" : "Creating and Initializing"
    },
    {
      "content" : "",
      "items" : [
        {
          "description" : "The receiver’s process identifier.",
          "name" : "processIdentifier",
          "url" : "https:\/\/developer.apple.com\/documentation\/Foundation\/Process\/processIdentifier"
        }
      ],
      "title" : "Returning Information"
    },
    {
      "content" : "",
      "items" : [
        {
          "description" : "Runs the process with the current environment.",
          "name" : "run()",
          "url" : "https:\/\/developer.apple.com\/documentation\/Foundation\/Process\/run()"
        },
        {
          "description" : "Sends an interrupt signal to the receiver and all of its subtasks.",
          "name" : "interrupt()",
          "url" : "https:\/\/developer.apple.com\/documentation\/Foundation\/Process\/interrupt()"
        },
        {
          "description" : "Resumes execution of a suspended task.",
          "name" : "resume()",
          "url" : "https:\/\/developer.apple.com\/documentation\/Foundation\/Process\/resume()"
        },
        {
          "description" : "Suspends execution of the receiver task.",
          "name" : "suspend()",
          "url" : "https:\/\/developer.apple.com\/documentation\/Foundation\/Process\/suspend()"
        },
        {
          "description" : "Sends a terminate signal to the receiver and all of its subtasks.",
          "name" : "terminate()",
          "url" : "https:\/\/developer.apple.com\/documentation\/Foundation\/Process\/terminate()"
        },
        {
          "description" : "Blocks the process until the receiver is finished.",
          "name" : "waitUntilExit()",
          "url" : "https:\/\/developer.apple.com\/documentation\/Foundation\/Process\/waitUntilExit()"
        }
      ],
      "title" : "Running and Stopping"
    },
    {
      "content" : "",
      "items" : [
        {
          "description" : "A status that indicates whether the receiver is still running.",
          "name" : "isRunning",
          "url" : "https:\/\/developer.apple.com\/documentation\/Foundation\/Process\/isRunning"
        },
        {
          "description" : "The exit status the receiver’s executable returns.",
          "name" : "terminationStatus",
          "url" : "https:\/\/developer.apple.com\/documentation\/Foundation\/Process\/terminationStatus"
        },
        {
          "description" : "The reason the system terminated the task.",
          "name" : "terminationReason",
          "url" : "https:\/\/developer.apple.com\/documentation\/Foundation\/Process\/terminationReason-swift.property"
        }
      ],
      "title" : "Querying the State"
    },
    {
      "content" : "",
      "items" : [
        {
          "description" : "The command arguments that the system uses to launch the executable.",
          "name" : "arguments",
          "url" : "https:\/\/developer.apple.com\/documentation\/Foundation\/Process\/arguments"
        },
        {
          "description" : "The current directory for the receiver.",
          "name" : "currentDirectoryURL",
          "url" : "https:\/\/developer.apple.com\/documentation\/Foundation\/Process\/currentDirectoryURL"
        },
        {
          "description" : "The environment for the receiver.",
          "name" : "environment",
          "url" : "https:\/\/developer.apple.com\/documentation\/Foundation\/Process\/environment"
        },
        {
          "description" : "The receiver’s executable.",
          "name" : "executableURL",
          "url" : "https:\/\/developer.apple.com\/documentation\/Foundation\/Process\/executableURL"
        },
        {
          "description" : "The default quality of service level the system applies to operations the task executes.",
          "name" : "qualityOfService",
          "url" : "https:\/\/developer.apple.com\/documentation\/Foundation\/Process\/qualityOfService"
        },
        {
          "description" : "The standard error for the receiver.",
          "name" : "standardError",
          "url" : "https:\/\/developer.apple.com\/documentation\/Foundation\/Process\/standardError"
        },
        {
          "description" : "The standard input for the receiver.",
          "name" : "standardInput",
          "url" : "https:\/\/developer.apple.com\/documentation\/Foundation\/Process\/standardInput"
        },
        {
          "description" : "The standard output for the receiver.",
          "name" : "standardOutput",
          "url" : "https:\/\/developer.apple.com\/documentation\/Foundation\/Process\/standardOutput"
        }
      ],
      "title" : "Configuring"
    },
    {
      "content" : "",
      "items" : [
        {
          "description" : "A completion block the system invokes when the task completes.",
          "name" : "terminationHandler",
          "url" : "https:\/\/developer.apple.com\/documentation\/Foundation\/Process\/terminationHandler"
        }
      ],
      "title" : "Termination Handler"
    },
    {
      "content" : "",
      "items" : [
        {
          "description" : "Constants that specify the termination reason values that the system returns.",
          "name" : "Process.TerminationReason",
          "url" : "https:\/\/developer.apple.com\/documentation\/Foundation\/Process\/TerminationReason-swift.enum"
        },
        {
          "description" : "Constants that indicate the nature and importance of work to the system.",
          "name" : "QualityOfService",
          "url" : "https:\/\/developer.apple.com\/documentation\/Foundation\/QualityOfService"
        }
      ],
      "title" : "Constants"
    },
    {
      "content" : "",
      "items" : [
        {
          "description" : "Posted when the task has stopped execution.",
          "name" : "didTerminateNotification",
          "url" : "https:\/\/developer.apple.com\/documentation\/Foundation\/Process\/didTerminateNotification"
        }
      ],
      "title" : "Notifications"
    },
    {
      "content" : "",
      "items" : [
        {
          "description" : "Creates and launches a task with a specified executable and arguments.",
          "name" : "launchedProcess(launchPath:arguments:)",
          "url" : "https:\/\/developer.apple.com\/documentation\/Foundation\/Process\/launchedProcess(launchPath:arguments:)"
        },
        {
          "description" : "Sets the current directory for the receiver.",
          "name" : "currentDirectoryPath",
          "url" : "https:\/\/developer.apple.com\/documentation\/Foundation\/Process\/currentDirectoryPath"
        },
        {
          "description" : "Sets the receiver’s executable.",
          "name" : "launchPath",
          "url" : "https:\/\/developer.apple.com\/documentation\/Foundation\/Process\/launchPath"
        },
        {
          "description" : "Launches the task represented by the receiver.",
          "name" : "launch()",
          "url" : "https:\/\/developer.apple.com\/documentation\/Foundation\/Process\/launch()"
        }
      ],
      "title" : "Deprecated"
    },
    {
      "content" : "",
      "items" : [
        {
          "description" : "",
          "name" : "Process.DidTerminateMessage",
          "url" : "https:\/\/developer.apple.com\/documentation\/Foundation\/Process\/DidTerminateMessage"
        }
      ],
      "title" : "Structures"
    },
    {
      "content" : "",
      "items" : [
        {
          "description" : "",
          "name" : "launchRequirement",
          "url" : "https:\/\/developer.apple.com\/documentation\/Foundation\/Process\/launchRequirement"
        },
        {
          "description" : "",
          "name" : "launchRequirementData",
          "url" : "https:\/\/developer.apple.com\/documentation\/Foundation\/Process\/launchRequirementData"
        }
      ],
      "title" : "Instance Properties"
    },
    {
      "content" : "",
      "items" : [
        {
          "description" : "An object that executes scripts.",
          "name" : "NSUserScriptTask",
          "url" : "https:\/\/developer.apple.com\/documentation\/Foundation\/NSUserScriptTask"
        },
        {
          "description" : "An object that executes AppleScript scripts.",
          "name" : "NSUserAppleScriptTask",
          "url" : "https:\/\/developer.apple.com\/documentation\/Foundation\/NSUserAppleScriptTask"
        },
        {
          "description" : "An object that executes Automator workflows.",
          "name" : "NSUserAutomatorTask",
          "url" : "https:\/\/developer.apple.com\/documentation\/Foundation\/NSUserAutomatorTask"
        },
        {
          "description" : "An object that executes unix applications.",
          "name" : "NSUserUnixTask",
          "url" : "https:\/\/developer.apple.com\/documentation\/Foundation\/NSUserUnixTask"
        }
      ],
      "title" : "Scripts and External Tasks"
    },
    {
      "content" : "",
      "items" : [
        {
          "name" : "NSObject"
        }
      ],
      "title" : "Inherits From"
    }
  ],
  "source" : "appleJSON",
  "title" : "Process",
  "url" : "https:\/\/developer.apple.com\/documentation\/foundation\/process"
}