{
  "abstract" : "A format style that provides string representations of byte counts, expressed as measurements of information storage.",
  "codeExamples" : [
    {
      "code" : "let count = Measurement(value: 1024, unit: UnitInformationStorage.bytes)\nlet formatted = count.formatted(.byteCount(style: .memory)) \/\/ \"1 kB\"",
      "language" : "swift"
    },
    {
      "code" : "let count = Measurement(value: 1024, unit: UnitInformationStorage.bytes)\nlet style = Measurement.FormatStyle.ByteCount(style: .memory,\n                                              allowedUnits: .kb,\n                                              spellsOutZero: true,\n                                              includesActualByteCount: true,\n                                              locale: Locale(identifier: \"en_US\"))\nlet customFormatted = style.format(count) \/\/ \"1 kB (1,024 bytes)\"",
      "language" : "swift"
    }
  ],
  "conformsTo" : [
    "Decodable",
    "Encodable",
    "Equatable",
    "FormatStyle",
    "Hashable",
    "Sendable",
    "SendableMetatype"
  ],
  "contentHash" : "d959f22493a19cbed93ff093190d866bfeb568d28184cd6893e673a6bf441975",
  "crawledAt" : "2025-12-02T17:46:18Z",
  "declaration" : {
    "code" : "struct ByteCount",
    "language" : "swift"
  },
  "id" : "F64BF52A-EDDA-48E6-9B22-A4AE32315C12",
  "kind" : "struct",
  "language" : "swift",
  "module" : "Foundation",
  "overview" : "## Overview\n\nUse this style with a [doc:\/\/com.apple.foundation\/documentation\/Foundation\/Measurement] whose unit type is [doc:\/\/com.apple.foundation\/documentation\/Foundation\/UnitInformationStorage] to format byte counts according to locale conventions.\n\nThe following example creates a measurement of 1,024 bytes, and then formats it as an expression of memory storage, with the default byte count format style:\n\nYou can also customize a byte count format style, and use this to format one or more [doc:\/\/com.apple.foundation\/documentation\/Foundation\/Measurement] instances. The following example creates a format style to only use kilobyte units, and to spell out the exact byte count of the measurement.",
  "platforms" : [
    "iOS",
    "iPadOS",
    "Mac Catalyst",
    "macOS",
    "tvOS",
    "visionOS",
    "watchOS"
  ],
  "rawMarkdown" : "---\nsource: https:\/\/developer.apple.com\/documentation\/Foundation\/Measurement\/FormatStyle\/ByteCount\ncrawled: 2025-12-02T17:46:18Z\n---\n\n# Measurement.FormatStyle.ByteCount\n\n**Structure**\n\nA format style that provides string representations of byte counts, expressed as measurements of information storage.\n\n## Declaration\n\n```swift\nstruct ByteCount\n```\n\n## Overview\n\nUse this style with a [doc:\/\/com.apple.foundation\/documentation\/Foundation\/Measurement] whose unit type is [doc:\/\/com.apple.foundation\/documentation\/Foundation\/UnitInformationStorage] to format byte counts according to locale conventions.\n\nThe following example creates a measurement of 1,024 bytes, and then formats it as an expression of memory storage, with the default byte count format style:\n\n```swift\nlet count = Measurement(value: 1024, unit: UnitInformationStorage.bytes)\nlet formatted = count.formatted(.byteCount(style: .memory)) \/\/ \"1 kB\"\n```\n\nYou can also customize a byte count format style, and use this to format one or more [doc:\/\/com.apple.foundation\/documentation\/Foundation\/Measurement] instances. The following example creates a format style to only use kilobyte units, and to spell out the exact byte count of the measurement.\n\n```swift\nlet count = Measurement(value: 1024, unit: UnitInformationStorage.bytes)\nlet style = Measurement.FormatStyle.ByteCount(style: .memory,\n                                              allowedUnits: .kb,\n                                              spellsOutZero: true,\n                                              includesActualByteCount: true,\n                                              locale: Locale(identifier: \"en_US\"))\nlet customFormatted = style.format(count) \/\/ \"1 kB (1,024 bytes)\"\n```\n\n## Creating a byte count style\n\n- **init(style:allowedUnits:spellsOutZero:includesActualByteCount:locale:)**: Initializes a byte count format style.\n\n## Accessing style properties\n\n- **allowedUnits**: The units the format style can use to express the byte count.\n- **Measurement.FormatStyle.ByteCount.Units**: The type the measurement format style uses to represent byte-counting units.\n- **spellsOutZero**: A Boolean value that indicates whether the format style should spell out zero-byte values as text.\n- **includesActualByteCount**: A Boolean value that indicates whether the format style should include the exact byte count, in addition to expressing it in terms of units.\n- **style**: The style of byte count to express, such as memory or file system storage.\n- **Measurement.FormatStyle.ByteCount.Style**: The type used to represent the style of the formatted byte count.\n- **locale**: The locale to use to format the numeric part of the byte count.\n\n## Creating attributed strings\n\n- **attributed**: An attributed format style based on the byte count format style.\n- **Measurement.AttributedStyle.ByteCount**: A format style that converts byte counts into attributed strings.\n\n## Applying byte-count styles\n\n- **byteCount(style:allowedUnits:spellsOutZero:includesActualByteCount:)**: Returns a format style to format a data storage value.\n- **ByteCountFormatStyle**: A format style that provides string representations of byte counts.\n- **byteCount(style:allowedUnits:spellsOutZero:includesActualByteCount:)**: Returns a format style to format a data storage value represented with Foundation’s measurement type.\n\n## Conforms To\n\n- Decodable\n- Encodable\n- Equatable\n- FormatStyle\n- Hashable\n- Sendable\n- SendableMetatype\n\n",
  "sections" : [
    {
      "content" : "",
      "items" : [
        {
          "description" : "Initializes a byte count format style.",
          "name" : "init(style:allowedUnits:spellsOutZero:includesActualByteCount:locale:)",
          "url" : "https:\/\/developer.apple.com\/documentation\/Foundation\/Measurement\/FormatStyle\/ByteCount\/init(style:allowedUnits:spellsOutZero:includesActualByteCount:locale:)"
        }
      ],
      "title" : "Creating a byte count style"
    },
    {
      "content" : "",
      "items" : [
        {
          "description" : "The units the format style can use to express the byte count.",
          "name" : "allowedUnits",
          "url" : "https:\/\/developer.apple.com\/documentation\/Foundation\/Measurement\/FormatStyle\/ByteCount\/allowedUnits"
        },
        {
          "description" : "The type the measurement format style uses to represent byte-counting units.",
          "name" : "Measurement.FormatStyle.ByteCount.Units",
          "url" : "https:\/\/developer.apple.com\/documentation\/Foundation\/Measurement\/FormatStyle\/ByteCount\/Units"
        },
        {
          "description" : "A Boolean value that indicates whether the format style should spell out zero-byte values as text.",
          "name" : "spellsOutZero",
          "url" : "https:\/\/developer.apple.com\/documentation\/Foundation\/Measurement\/FormatStyle\/ByteCount\/spellsOutZero"
        },
        {
          "description" : "A Boolean value that indicates whether the format style should include the exact byte count, in addition to expressing it in terms of units.",
          "name" : "includesActualByteCount",
          "url" : "https:\/\/developer.apple.com\/documentation\/Foundation\/Measurement\/FormatStyle\/ByteCount\/includesActualByteCount"
        },
        {
          "description" : "The style of byte count to express, such as memory or file system storage.",
          "name" : "style",
          "url" : "https:\/\/developer.apple.com\/documentation\/Foundation\/Measurement\/FormatStyle\/ByteCount\/style-swift.property"
        },
        {
          "description" : "The type used to represent the style of the formatted byte count.",
          "name" : "Measurement.FormatStyle.ByteCount.Style",
          "url" : "https:\/\/developer.apple.com\/documentation\/Foundation\/Measurement\/FormatStyle\/ByteCount\/Style-swift.typealias"
        },
        {
          "description" : "The locale to use to format the numeric part of the byte count.",
          "name" : "locale",
          "url" : "https:\/\/developer.apple.com\/documentation\/Foundation\/Measurement\/FormatStyle\/ByteCount\/locale"
        }
      ],
      "title" : "Accessing style properties"
    },
    {
      "content" : "",
      "items" : [
        {
          "description" : "An attributed format style based on the byte count format style.",
          "name" : "attributed",
          "url" : "https:\/\/developer.apple.com\/documentation\/Foundation\/Measurement\/FormatStyle\/ByteCount\/attributed"
        },
        {
          "description" : "A format style that converts byte counts into attributed strings.",
          "name" : "Measurement.AttributedStyle.ByteCount",
          "url" : "https:\/\/developer.apple.com\/documentation\/Foundation\/Measurement\/AttributedStyle\/ByteCount"
        }
      ],
      "title" : "Creating attributed strings"
    },
    {
      "content" : "",
      "items" : [
        {
          "description" : "Returns a format style to format a data storage value.",
          "name" : "byteCount(style:allowedUnits:spellsOutZero:includesActualByteCount:)",
          "url" : "https:\/\/developer.apple.com\/documentation\/Foundation\/FormatStyle\/byteCount(style:allowedUnits:spellsOutZero:includesActualByteCount:)-59ep0"
        },
        {
          "description" : "A format style that provides string representations of byte counts.",
          "name" : "ByteCountFormatStyle",
          "url" : "https:\/\/developer.apple.com\/documentation\/Foundation\/ByteCountFormatStyle"
        },
        {
          "description" : "Returns a format style to format a data storage value represented with Foundation’s measurement type.",
          "name" : "byteCount(style:allowedUnits:spellsOutZero:includesActualByteCount:)",
          "url" : "https:\/\/developer.apple.com\/documentation\/Foundation\/FormatStyle\/byteCount(style:allowedUnits:spellsOutZero:includesActualByteCount:)-ev0u"
        }
      ],
      "title" : "Applying byte-count styles"
    }
  ],
  "source" : "appleJSON",
  "title" : "Measurement.FormatStyle.ByteCount",
  "url" : "https:\/\/developer.apple.com\/documentation\/Foundation\/Measurement\/FormatStyle\/ByteCount"
}