{
  "abstract" : "An extensible namespace for undo and redo user info keys.",
  "codeExamples" : [
    {
      "code" : "extension UndoManager.UserInfoKey {\n    static let icon: UndoManager.UserInfoKey = \"icon\"\n}",
      "language" : "swift"
    },
    {
      "code" : "self.undoManager.setActionUserInfoValue(Image(named: \"new_layer\"), forKey: .icon)\n",
      "language" : "swift"
    }
  ],
  "conformsTo" : [
    "Equatable",
    "Hashable",
    "RawRepresentable",
    "Sendable",
    "SendableMetatype"
  ],
  "contentHash" : "327ef29253e5f3b09276fad36c40d485d8b621158a6d526e35ffdd02bd741059",
  "crawledAt" : "2025-12-05T22:30:25Z",
  "declaration" : {
    "code" : "struct UserInfoKey",
    "language" : "swift"
  },
  "id" : "29072A63-C1A9-46A3-974A-CE232468C8F3",
  "kind" : "struct",
  "language" : "swift",
  "module" : "Foundation",
  "overview" : "## Discussion\n\nExtend this type with the names of user info keys you want to associate with undo actions, like this:\n\nYou then use this key when you set and get undo user info values.",
  "platforms" : [
    "iOS",
    "iPadOS",
    "Mac Catalyst",
    "macOS",
    "tvOS",
    "visionOS",
    "watchOS"
  ],
  "rawMarkdown" : "---\nsource: https:\/\/developer.apple.com\/documentation\/Foundation\/UndoManager\/UserInfoKey\ncrawled: 2025-12-05T22:30:25Z\n---\n\n# UndoManager.UserInfoKey\n\n**Structure**\n\nAn extensible namespace for undo and redo user info keys.\n\n## Declaration\n\n```swift\nstruct UserInfoKey\n```\n\n## Discussion\n\nExtend this type with the names of user info keys you want to associate with undo actions, like this:\n\n```swift\nextension UndoManager.UserInfoKey {\n    static let icon: UndoManager.UserInfoKey = \"icon\"\n}\n```\n\nYou then use this key when you set and get undo user info values.\n\n```swift\nself.undoManager.setActionUserInfoValue(Image(named: \"new_layer\"), forKey: .icon)\n\n```\n\n## Creating a user info key from a raw value\n\n- **init(_:)**: Creates a user info key from the given string.\n- **init(rawValue:)**\n\n## Working with user info\n\n- **setActionUserInfoValue(_:forKey:)**: Sets a user info value for an undo or redo action.\n- **undoActionUserInfoValue(forKey:)**: Retrieves the undo action’s user info value for the given key.\n- **redoActionUserInfoValue(forKey:)**: Retrieves the redo action’s user info value for the given key.\n\n## Conforms To\n\n- Equatable\n- Hashable\n- RawRepresentable\n- Sendable\n- SendableMetatype\n\n",
  "sections" : [
    {
      "content" : "",
      "items" : [
        {
          "description" : "Creates a user info key from the given string.",
          "name" : "init(_:)",
          "url" : "https:\/\/developer.apple.com\/documentation\/Foundation\/UndoManager\/UserInfoKey\/init(_:)"
        },
        {
          "description" : "",
          "name" : "init(rawValue:)",
          "url" : "https:\/\/developer.apple.com\/documentation\/Foundation\/UndoManager\/UserInfoKey\/init(rawValue:)"
        }
      ],
      "title" : "Creating a user info key from a raw value"
    },
    {
      "content" : "",
      "items" : [
        {
          "description" : "Sets a user info value for an undo or redo action.",
          "name" : "setActionUserInfoValue(_:forKey:)",
          "url" : "https:\/\/developer.apple.com\/documentation\/Foundation\/UndoManager\/setActionUserInfoValue(_:forKey:)"
        },
        {
          "description" : "Retrieves the undo action’s user info value for the given key.",
          "name" : "undoActionUserInfoValue(forKey:)",
          "url" : "https:\/\/developer.apple.com\/documentation\/Foundation\/UndoManager\/undoActionUserInfoValue(forKey:)"
        },
        {
          "description" : "Retrieves the redo action’s user info value for the given key.",
          "name" : "redoActionUserInfoValue(forKey:)",
          "url" : "https:\/\/developer.apple.com\/documentation\/Foundation\/UndoManager\/redoActionUserInfoValue(forKey:)"
        }
      ],
      "title" : "Working with user info"
    }
  ],
  "source" : "appleJSON",
  "title" : "UndoManager.UserInfoKey",
  "url" : "https:\/\/developer.apple.com\/documentation\/Foundation\/UndoManager\/UserInfoKey"
}