{
  "abstract" : "Given an Apple event code that identifies a property or element class, returns the key for the corresponding attribute, one-to-one relationship, or one-to-many relationship.",
  "codeExamples" : [

  ],
  "contentHash" : "39198a991fd54dd4e71c33c03c28954a407256ae66979dbfee5eb5646b9b4643",
  "crawledAt" : "2025-12-06T02:50:20Z",
  "declaration" : {
    "code" : "func key(withAppleEventCode appleEventCode: FourCharCode) -> String?",
    "language" : "swift"
  },
  "id" : "837CA941-3BD0-4B6C-8CBC-2064877C513F",
  "kind" : "method",
  "language" : "swift",
  "module" : "Foundation",
  "overview" : "## Return Value\n\nThe key that corresponds to the property or element class identified by `appleEventCode` in the receiver or, if none exists, in a class description in the receiver’s superclasses. The four-character Apple event code associated with the attribute or relationship identified by `key` Returns `0` if no such attribute or relationship is found. Returns `nil` if it cannot find any such attribute or relationship.",
  "platforms" : [
    "Mac Catalyst",
    "macOS"
  ],
  "rawMarkdown" : "---\nsource: https:\/\/developer.apple.com\/documentation\/Foundation\/NSScriptClassDescription\/key(withAppleEventCode:)\ncrawled: 2025-12-06T02:50:20Z\n---\n\n# key(withAppleEventCode:)\n\n**Instance Method**\n\nGiven an Apple event code that identifies a property or element class, returns the key for the corresponding attribute, one-to-one relationship, or one-to-many relationship.\n\n## Declaration\n\n```swift\nfunc key(withAppleEventCode appleEventCode: FourCharCode) -> String?\n```\n\n## Parameters\n\n- **appleEventCode**: An Apple event code that identifies a property or element class.\n\n## Return Value\n\nThe key that corresponds to the property or element class identified by `appleEventCode` in the receiver or, if none exists, in a class description in the receiver’s superclasses. The four-character Apple event code associated with the attribute or relationship identified by `key` Returns `0` if no such attribute or relationship is found. Returns `nil` if it cannot find any such attribute or relationship.\n\n## Getting attribute and relationship information\n\n- **hasOrderedToManyRelationship(forKey:)**: Returns a Boolean value indicating whether the described class has an ordered to-many relationship identified by the specified key.\n- **hasProperty(forKey:)**: Returns a Boolean value indicating whether the described class has a property identified by the specified key.\n- **hasReadableProperty(forKey:)**: Returns a Boolean value indicating whether the described class has a readable property identified by the specified key.\n- **hasWritableProperty(forKey:)**: Returns a Boolean value indicating whether the described class has a writable property identified by the specified key.\n- **type(forKey:)**: Returns the name of the declared type of the attribute or relationship identified by the passed key.\n\n",
  "sections" : [
    {
      "content" : "",
      "items" : [
        {
          "description" : "Returns a Boolean value indicating whether the described class has an ordered to-many relationship identified by the specified key.",
          "name" : "hasOrderedToManyRelationship(forKey:)",
          "url" : "https:\/\/developer.apple.com\/documentation\/Foundation\/NSScriptClassDescription\/hasOrderedToManyRelationship(forKey:)"
        },
        {
          "description" : "Returns a Boolean value indicating whether the described class has a property identified by the specified key.",
          "name" : "hasProperty(forKey:)",
          "url" : "https:\/\/developer.apple.com\/documentation\/Foundation\/NSScriptClassDescription\/hasProperty(forKey:)"
        },
        {
          "description" : "Returns a Boolean value indicating whether the described class has a readable property identified by the specified key.",
          "name" : "hasReadableProperty(forKey:)",
          "url" : "https:\/\/developer.apple.com\/documentation\/Foundation\/NSScriptClassDescription\/hasReadableProperty(forKey:)"
        },
        {
          "description" : "Returns a Boolean value indicating whether the described class has a writable property identified by the specified key.",
          "name" : "hasWritableProperty(forKey:)",
          "url" : "https:\/\/developer.apple.com\/documentation\/Foundation\/NSScriptClassDescription\/hasWritableProperty(forKey:)"
        },
        {
          "description" : "Returns the name of the declared type of the attribute or relationship identified by the passed key.",
          "name" : "type(forKey:)",
          "url" : "https:\/\/developer.apple.com\/documentation\/Foundation\/NSScriptClassDescription\/type(forKey:)"
        }
      ],
      "title" : "Getting attribute and relationship information"
    }
  ],
  "source" : "appleJSON",
  "title" : "key(withAppleEventCode:)",
  "url" : "https:\/\/developer.apple.com\/documentation\/Foundation\/NSScriptClassDescription\/key(withAppleEventCode:)"
}