{
  "abstract" : "Returns a file wrapper object that contains an RTFD document corresponding to the characters and attributes within the specified range.",
  "codeExamples" : [

  ],
  "contentHash" : "63faa63be39ccd711604ab7f8ccf7dc31c7f9d055a9a74fa58d01252f06e4367",
  "crawledAt" : "2025-12-03T18:05:21Z",
  "declaration" : {
    "code" : "func rtfdFileWrapper(from range: NSRange, documentAttributes dict: [NSAttributedString.DocumentAttributeKey : Any] = [:]) -> FileWrapper?",
    "language" : "swift"
  },
  "id" : "2E8F4A7F-1BD9-4BD1-A07D-A47FFC5F4694",
  "kind" : "method",
  "language" : "swift",
  "module" : "Foundation",
  "overview" : "## Return Value\n\nA file wrapper containing the RTFD data.\n\n## Discussion\n\nThe file wrapper also includes the document-level attributes in `docAttributes`, as explained in [https:\/\/developer.apple.com\/library\/archive\/documentation\/Cocoa\/Conceptual\/TextAttributes\/RTFAndAttrStrings.html#\/\/apple_ref\/doc\/uid\/20000164].\n\nRaises an [doc:\/\/com.apple.foundation\/documentation\/Foundation\/NSExceptionName\/rangeException] if any part of `aRange` lies beyond the end of the receiver’s characters.\n\nYou can save the file wrapper using the [doc:\/\/com.apple.foundation\/documentation\/Foundation\/FileWrapper\/write(toFile:atomically:updateFilenames:)] method of [doc:\/\/com.apple.foundation\/documentation\/Foundation\/FileWrapper].",
  "platforms" : [
    "macOS"
  ],
  "rawMarkdown" : "---\nsource: https:\/\/developer.apple.com\/documentation\/Foundation\/NSAttributedString\/rtfdFileWrapper(from:documentAttributes:)\ncrawled: 2025-12-03T18:05:21Z\n---\n\n# rtfdFileWrapper(from:documentAttributes:)\n\n**Instance Method**\n\nReturns a file wrapper object that contains an RTFD document corresponding to the characters and attributes within the specified range.\n\n## Declaration\n\n```swift\nfunc rtfdFileWrapper(from range: NSRange, documentAttributes dict: [NSAttributedString.DocumentAttributeKey : Any] = [:]) -> FileWrapper?\n```\n\n## Parameters\n\n- **range**: The range.\n- **dict**: A required dictionary specifying the document attributes. The dictionary contains values from `Document Types` and must at least contain `NSDocumentTypeDocumentAttribute`.\n\n## Return Value\n\nA file wrapper containing the RTFD data.\n\n## Discussion\n\nThe file wrapper also includes the document-level attributes in `docAttributes`, as explained in [https:\/\/developer.apple.com\/library\/archive\/documentation\/Cocoa\/Conceptual\/TextAttributes\/RTFAndAttrStrings.html#\/\/apple_ref\/doc\/uid\/20000164].\n\nRaises an [doc:\/\/com.apple.foundation\/documentation\/Foundation\/NSExceptionName\/rangeException] if any part of `aRange` lies beyond the end of the receiver’s characters.\n\nYou can save the file wrapper using the [doc:\/\/com.apple.foundation\/documentation\/Foundation\/FileWrapper\/write(toFile:atomically:updateFilenames:)] method of [doc:\/\/com.apple.foundation\/documentation\/Foundation\/FileWrapper].\n\n## Exporting the string as data\n\n- **data(from:documentAttributes:)**: Returns a data object that contains a text stream corresponding to the characters and attributes within the specified range.\n- **fileWrapper(from:documentAttributes:)**: Returns a file wrapper object that contains a text stream corresponding to the characters and attributes within the specified range.\n- **docFormat(from:documentAttributes:)**: Returns a data object that contains a Microsoft Word–format stream corresponding to the characters and attributes within the specified range.\n- **rtf(from:documentAttributes:)**: Returns a data object that contains an RTF stream corresponding to the characters and attributes within the specified range, omitting all attachment attributes.\n- **rtfd(from:documentAttributes:)**: Returns a data object that contains an RTFD stream corresponding to the characters and attributes within the specified range.\n\n",
  "sections" : [
    {
      "content" : "",
      "items" : [
        {
          "description" : "Returns a data object that contains a text stream corresponding to the characters and attributes within the specified range.",
          "name" : "data(from:documentAttributes:)",
          "url" : "https:\/\/developer.apple.com\/documentation\/Foundation\/NSAttributedString\/data(from:documentAttributes:)"
        },
        {
          "description" : "Returns a file wrapper object that contains a text stream corresponding to the characters and attributes within the specified range.",
          "name" : "fileWrapper(from:documentAttributes:)",
          "url" : "https:\/\/developer.apple.com\/documentation\/Foundation\/NSAttributedString\/fileWrapper(from:documentAttributes:)"
        },
        {
          "description" : "Returns a data object that contains a Microsoft Word–format stream corresponding to the characters and attributes within the specified range.",
          "name" : "docFormat(from:documentAttributes:)",
          "url" : "https:\/\/developer.apple.com\/documentation\/Foundation\/NSAttributedString\/docFormat(from:documentAttributes:)"
        },
        {
          "description" : "Returns a data object that contains an RTF stream corresponding to the characters and attributes within the specified range, omitting all attachment attributes.",
          "name" : "rtf(from:documentAttributes:)",
          "url" : "https:\/\/developer.apple.com\/documentation\/Foundation\/NSAttributedString\/rtf(from:documentAttributes:)"
        },
        {
          "description" : "Returns a data object that contains an RTFD stream corresponding to the characters and attributes within the specified range.",
          "name" : "rtfd(from:documentAttributes:)",
          "url" : "https:\/\/developer.apple.com\/documentation\/Foundation\/NSAttributedString\/rtfd(from:documentAttributes:)"
        }
      ],
      "title" : "Exporting the string as data"
    }
  ],
  "source" : "appleJSON",
  "title" : "rtfdFileWrapper(from:documentAttributes:)",
  "url" : "https:\/\/developer.apple.com\/documentation\/Foundation\/NSAttributedString\/rtfdFileWrapper(from:documentAttributes:)"
}