{
  "abstract" : "Constants that specify how a request uses network resources.",
  "codeExamples" : [

  ],
  "conformsTo" : [
    "BitwiseCopyable",
    "Equatable",
    "Hashable",
    "RawRepresentable",
    "Sendable",
    "SendableMetatype"
  ],
  "contentHash" : "d72b5ba61a18434949cf6f0706a713a93841f59f56cd0a68c692503dcf535648",
  "crawledAt" : "2025-12-08T02:24:25Z",
  "declaration" : {
    "code" : "enum NetworkServiceType",
    "language" : "swift"
  },
  "id" : "923D4729-90A6-48CC-A197-51B3F7CEB6B6",
  "kind" : "enum",
  "language" : "swift",
  "module" : "Foundation",
  "overview" : "## Overview\n\nThe network service type provides a hint to the operating system about the nature and use of the underlying traffic. This hint enhances the system’s ability to prioritize traffic, determine how quickly it needs to wake up the cellular or Wi-Fi radio, and so on. By providing accurate information, you improve the system’s ability to optimally balance battery life, performance, and other considerations.\n\nMake connections using the [doc:\/\/com.apple.foundation\/documentation\/Foundation\/NSURLRequest\/NetworkServiceType-swift.enum\/default] service type.",
  "platforms" : [
    "iOS",
    "iPadOS",
    "Mac Catalyst",
    "macOS",
    "tvOS",
    "visionOS",
    "watchOS"
  ],
  "rawMarkdown" : "---\nsource: https:\/\/developer.apple.com\/documentation\/foundation\/nsurlrequest\/networkservicetype-swift.enum\ncrawled: 2025-12-08T02:24:25Z\n---\n\n# NSURLRequest.NetworkServiceType\n\n**Enumeration**\n\nConstants that specify how a request uses network resources.\n\n## Declaration\n\n```swift\nenum NetworkServiceType\n```\n\n## Overview\n\nThe network service type provides a hint to the operating system about the nature and use of the underlying traffic. This hint enhances the system’s ability to prioritize traffic, determine how quickly it needs to wake up the cellular or Wi-Fi radio, and so on. By providing accurate information, you improve the system’s ability to optimally balance battery life, performance, and other considerations.\n\nMake connections using the [doc:\/\/com.apple.foundation\/documentation\/Foundation\/NSURLRequest\/NetworkServiceType-swift.enum\/default] service type.\n\n## Network service types\n\n- **NSURLRequest.NetworkServiceType.default**: A service type for standard network traffic.\n- **NSURLRequest.NetworkServiceType.video**: A service type for low-delay tolerant, very low-loss tolerant, inelastic flow, and constant packet rate connections.\n- **NSURLRequest.NetworkServiceType.background**: A service type for high-delay tolerant, high-loss tolerant, elastic flow, and variable size connections.\n- **NSURLRequest.NetworkServiceType.voice**: A service type for low-delay tolerant, very low-loss tolerant, inelastic flow, and constant packet rate connections.\n- **NSURLRequest.NetworkServiceType.callSignaling**: A service for low-loss tolerant, inelastic flow, jitter tolerant, short but bursty rate, and variable size connections.\n- **NSURLRequest.NetworkServiceType.responsiveData**: A service type for medium-delay tolerant, elastic and inelastic flow, bursty, and long-lived connections.\n- **NSURLRequest.NetworkServiceType.avStreaming**: A service type for medium-delay tolerant, low-medium-loss tolerant, elastic flow, constant packet interval, and variable rate and size connections.\n- **NSURLRequest.NetworkServiceType.responsiveAV**: A service type for low-delay tolerant, low-to-medium-loss tolerant, elastic flow, variable packet interval, rate, size responsive and time-sensitive connections.\n- **NSURLRequest.NetworkServiceType.voip**: A service type for VoIP traffic.\n\n## Initializers\n\n- **init(rawValue:)**\n\n## Accessing the service type\n\n- **networkServiceType**: The network service type of the connection.\n\n## Conforms To\n\n- BitwiseCopyable\n- Equatable\n- Hashable\n- RawRepresentable\n- Sendable\n- SendableMetatype\n\n",
  "sections" : [
    {
      "content" : "",
      "items" : [
        {
          "description" : "A service type for standard network traffic.",
          "name" : "NSURLRequest.NetworkServiceType.default",
          "url" : "https:\/\/developer.apple.com\/documentation\/Foundation\/NSURLRequest\/NetworkServiceType-swift.enum\/default"
        },
        {
          "description" : "A service type for low-delay tolerant, very low-loss tolerant, inelastic flow, and constant packet rate connections.",
          "name" : "NSURLRequest.NetworkServiceType.video",
          "url" : "https:\/\/developer.apple.com\/documentation\/Foundation\/NSURLRequest\/NetworkServiceType-swift.enum\/video"
        },
        {
          "description" : "A service type for high-delay tolerant, high-loss tolerant, elastic flow, and variable size connections.",
          "name" : "NSURLRequest.NetworkServiceType.background",
          "url" : "https:\/\/developer.apple.com\/documentation\/Foundation\/NSURLRequest\/NetworkServiceType-swift.enum\/background"
        },
        {
          "description" : "A service type for low-delay tolerant, very low-loss tolerant, inelastic flow, and constant packet rate connections.",
          "name" : "NSURLRequest.NetworkServiceType.voice",
          "url" : "https:\/\/developer.apple.com\/documentation\/Foundation\/NSURLRequest\/NetworkServiceType-swift.enum\/voice"
        },
        {
          "description" : "A service for low-loss tolerant, inelastic flow, jitter tolerant, short but bursty rate, and variable size connections.",
          "name" : "NSURLRequest.NetworkServiceType.callSignaling",
          "url" : "https:\/\/developer.apple.com\/documentation\/Foundation\/NSURLRequest\/NetworkServiceType-swift.enum\/callSignaling"
        },
        {
          "description" : "A service type for medium-delay tolerant, elastic and inelastic flow, bursty, and long-lived connections.",
          "name" : "NSURLRequest.NetworkServiceType.responsiveData",
          "url" : "https:\/\/developer.apple.com\/documentation\/Foundation\/NSURLRequest\/NetworkServiceType-swift.enum\/responsiveData"
        },
        {
          "description" : "A service type for medium-delay tolerant, low-medium-loss tolerant, elastic flow, constant packet interval, and variable rate and size connections.",
          "name" : "NSURLRequest.NetworkServiceType.avStreaming",
          "url" : "https:\/\/developer.apple.com\/documentation\/Foundation\/NSURLRequest\/NetworkServiceType-swift.enum\/avStreaming"
        },
        {
          "description" : "A service type for low-delay tolerant, low-to-medium-loss tolerant, elastic flow, variable packet interval, rate, size responsive and time-sensitive connections.",
          "name" : "NSURLRequest.NetworkServiceType.responsiveAV",
          "url" : "https:\/\/developer.apple.com\/documentation\/Foundation\/NSURLRequest\/NetworkServiceType-swift.enum\/responsiveAV"
        },
        {
          "description" : "A service type for VoIP traffic.",
          "name" : "NSURLRequest.NetworkServiceType.voip",
          "url" : "https:\/\/developer.apple.com\/documentation\/Foundation\/NSURLRequest\/NetworkServiceType-swift.enum\/voip"
        }
      ],
      "title" : "Network service types"
    },
    {
      "content" : "",
      "items" : [
        {
          "description" : "",
          "name" : "init(rawValue:)",
          "url" : "https:\/\/developer.apple.com\/documentation\/Foundation\/NSURLRequest\/NetworkServiceType-swift.enum\/init(rawValue:)"
        }
      ],
      "title" : "Initializers"
    },
    {
      "content" : "",
      "items" : [
        {
          "description" : "The network service type of the connection.",
          "name" : "networkServiceType",
          "url" : "https:\/\/developer.apple.com\/documentation\/Foundation\/NSMutableURLRequest\/networkServiceType"
        }
      ],
      "title" : "Accessing the service type"
    }
  ],
  "source" : "appleJSON",
  "title" : "NSURLRequest.NetworkServiceType",
  "url" : "https:\/\/developer.apple.com\/documentation\/foundation\/nsurlrequest\/networkservicetype-swift.enum"
}