{
  "abstract" : "A universally unique value that can be used to identify types, interfaces, and other items.",
  "codeExamples" : [

  ],
  "conformsTo" : [
    "CVarArg",
    "Copyable",
    "CustomDebugStringConvertible",
    "CustomStringConvertible",
    "Equatable",
    "Hashable",
    "NSCoding",
    "NSCopying",
    "NSObjectProtocol",
    "NSSecureCoding",
    "Sendable",
    "SendableMetatype"
  ],
  "contentHash" : "663aa2a00e14e923241321d00d2917d7e89dd947db836054daf4751e0f6fb397",
  "crawledAt" : "2025-12-01T23:08:48Z",
  "declaration" : {
    "code" : "class NSUUID",
    "language" : "swift"
  },
  "id" : "004F447D-3FE7-4F01-9BB8-7A80FE69F8BA",
  "kind" : "class",
  "module" : "Foundation",
  "overview" : "## Overview\n\nIn Swift, this object bridges to [doc:\/\/com.apple.foundation\/documentation\/Foundation\/NSUUID\/UUID]; use [doc:\/\/com.apple.foundation\/documentation\/Foundation\/NSUUID] when you need reference semantics or other Foundation-specific behavior.\n\nUUIDs (Universally Unique Identifiers), also known as GUIDs (Globally Unique Identifiers) or IIDs (Interface Identifiers), are 128-bit values. UUIDs created by `NSUUID` conform to RFC 4122 version 4 and are created with random bytes.\n\nThe standard format for UUIDs represented in ASCII is a string punctuated by hyphens, for example `68753A44-4D6F-1226-9C60-0050E4C00067`. The hex representation looks, as you might expect, like a list of numerical values preceded by 0x. For example, `0xD7`, `0x36`, `0x95`, `0x0A`, `0x4D`, `0x6E`, `0x12`, `0x26`, `0x80`, `0x3A`, `0x00`, `0x50`, `0xE4`, `0xC0`, `0x00`, `0x67`. Because a UUID is expressed simply as an array of bytes, there are no endianness considerations for different platforms.\n\nThe `NSUUID` class is *not* toll-free bridged with CoreFoundation’s [doc:\/\/com.apple.documentation\/documentation\/CoreFoundation\/CFUUID]. Use UUID strings to convert between `CFUUIDRef` and `NSUUID`, if needed. Two `NSUUID` objects are not guaranteed to be comparable by pointer value (as [doc:\/\/com.apple.documentation\/documentation\/CoreFoundation\/CFUUID] is); use [doc:\/\/com.apple.documentation\/documentation\/ObjectiveC\/NSObjectProtocol\/isEqual(_:)] to compare two `NSUUID` instances.",
  "platforms" : [
    "iOS",
    "iPadOS",
    "Mac Catalyst",
    "macOS",
    "tvOS",
    "visionOS",
    "watchOS"
  ],
  "rawMarkdown" : "---\nsource: https:\/\/developer.apple.com\/documentation\/Foundation\/NSUUID\ncrawled: 2025-12-01T23:08:48Z\n---\n\n# NSUUID\n\n**Class**\n\nA universally unique value that can be used to identify types, interfaces, and other items.\n\n## Declaration\n\n```swift\nclass NSUUID\n```\n\n## Overview\n\nIn Swift, this object bridges to [doc:\/\/com.apple.foundation\/documentation\/Foundation\/NSUUID\/UUID]; use [doc:\/\/com.apple.foundation\/documentation\/Foundation\/NSUUID] when you need reference semantics or other Foundation-specific behavior.\n\nUUIDs (Universally Unique Identifiers), also known as GUIDs (Globally Unique Identifiers) or IIDs (Interface Identifiers), are 128-bit values. UUIDs created by `NSUUID` conform to RFC 4122 version 4 and are created with random bytes.\n\nThe standard format for UUIDs represented in ASCII is a string punctuated by hyphens, for example `68753A44-4D6F-1226-9C60-0050E4C00067`. The hex representation looks, as you might expect, like a list of numerical values preceded by 0x. For example, `0xD7`, `0x36`, `0x95`, `0x0A`, `0x4D`, `0x6E`, `0x12`, `0x26`, `0x80`, `0x3A`, `0x00`, `0x50`, `0xE4`, `0xC0`, `0x00`, `0x67`. Because a UUID is expressed simply as an array of bytes, there are no endianness considerations for different platforms.\n\nThe `NSUUID` class is *not* toll-free bridged with CoreFoundation’s [doc:\/\/com.apple.documentation\/documentation\/CoreFoundation\/CFUUID]. Use UUID strings to convert between `CFUUIDRef` and `NSUUID`, if needed. Two `NSUUID` objects are not guaranteed to be comparable by pointer value (as [doc:\/\/com.apple.documentation\/documentation\/CoreFoundation\/CFUUID] is); use [doc:\/\/com.apple.documentation\/documentation\/ObjectiveC\/NSObjectProtocol\/isEqual(_:)] to compare two `NSUUID` instances.\n\n\n\n## Creating UUIDs\n\n- **init()**: Initializes a new UUID with RFC 4122 version 4 random bytes.\n- **init(uuidString:)**: Initializes a new UUID with the formatted string.\n- **init(uuidBytes:)**: Initializes a new UUID with the given bytes.\n\n## Get UUID Values\n\n- **getBytes(_:)**: Returns the UUID as bytes.\n- **uuidString**: The UUID as a string.\n\n## Instance Methods\n\n- **compare(_:)**\n\n## Inherits From\n\n- NSObject\n\n## Conforms To\n\n- CVarArg\n- Copyable\n- CustomDebugStringConvertible\n- CustomStringConvertible\n- Equatable\n- Hashable\n- NSCoding\n- NSCopying\n- NSObjectProtocol\n- NSSecureCoding\n- Sendable\n- SendableMetatype\n\n",
  "sections" : [
    {
      "content" : "",
      "items" : [
        {
          "description" : "Initializes a new UUID with RFC 4122 version 4 random bytes.",
          "name" : "init()",
          "url" : "https:\/\/developer.apple.com\/documentation\/Foundation\/NSUUID\/init()"
        },
        {
          "description" : "Initializes a new UUID with the formatted string.",
          "name" : "init(uuidString:)",
          "url" : "https:\/\/developer.apple.com\/documentation\/Foundation\/NSUUID\/init(uuidString:)"
        },
        {
          "description" : "Initializes a new UUID with the given bytes.",
          "name" : "init(uuidBytes:)",
          "url" : "https:\/\/developer.apple.com\/documentation\/Foundation\/NSUUID\/init(uuidBytes:)"
        }
      ],
      "title" : "Creating UUIDs"
    },
    {
      "content" : "",
      "items" : [
        {
          "description" : "Returns the UUID as bytes.",
          "name" : "getBytes(_:)",
          "url" : "https:\/\/developer.apple.com\/documentation\/Foundation\/NSUUID\/getBytes(_:)"
        },
        {
          "description" : "The UUID as a string.",
          "name" : "uuidString",
          "url" : "https:\/\/developer.apple.com\/documentation\/Foundation\/NSUUID\/uuidString"
        }
      ],
      "title" : "Get UUID Values"
    },
    {
      "content" : "",
      "items" : [
        {
          "description" : "",
          "name" : "compare(_:)",
          "url" : "https:\/\/developer.apple.com\/documentation\/Foundation\/NSUUID\/compare(_:)"
        }
      ],
      "title" : "Instance Methods"
    },
    {
      "content" : "",
      "items" : [
        {
          "name" : "NSObject"
        }
      ],
      "title" : "Inherits From"
    }
  ],
  "source" : "appleJSON",
  "title" : "NSUUID",
  "url" : "https:\/\/developer.apple.com\/documentation\/Foundation\/NSUUID"
}