{
  "abstract" : "Returns an instance of the `NSMachPort` class.",
  "codeExamples" : [

  ],
  "contentHash" : "e28b4fbb2b77589bd4f717fcb8a9d0c55d3e1af5c19452b06fb1092213dfc723",
  "crawledAt" : "2025-12-03T07:53:53Z",
  "id" : "44FCBFFF-EAAD-488B-8153-EA59B609C046",
  "kind" : "article",
  "language" : "swift",
  "module" : "Foundation",
  "overview" : "## Overview\n\nFor backward compatibility on Mach, doc:nsport\/1807189-allocwithzone returns an instance of the `NSMachPort` class when sent to the `NSPort` class. Otherwise, it returns an instance of a concrete subclass that can be used for messaging between threads or processes on the local machine, or, in the case of `NSSocketPort`, between processes on separate machines.",
  "rawMarkdown" : "---\nsource: https:\/\/developer.apple.com\/documentation\/Foundation\/1807189-allocwithzone\ncrawled: 2025-12-03T07:53:53Z\n---\n\n# allocWithZone:\n\n**Article**\n\nReturns an instance of the `NSMachPort` class.\n\n## Overview\n\nFor backward compatibility on Mach, doc:nsport\/1807189-allocwithzone returns an instance of the `NSMachPort` class when sent to the `NSPort` class. Otherwise, it returns an instance of a concrete subclass that can be used for messaging between threads or processes on the local machine, or, in the case of `NSSocketPort`, between processes on separate machines.\n\n## Related Documentation\n\n- **Threading Programming Guide**\n- **Distributed Objects Programming Topics**\n\n",
  "sections" : [
    {
      "content" : "",
      "items" : [
        {
          "name" : "Threading Programming Guide"
        },
        {
          "name" : "Distributed Objects Programming Topics"
        }
      ],
      "title" : "Related Documentation"
    }
  ],
  "source" : "appleJSON",
  "title" : "allocWithZone:",
  "url" : "https:\/\/developer.apple.com\/documentation\/Foundation\/1807189-allocwithzone"
}