{
  "abstract" : "A string that uniquely identifies a notification.",
  "codeExamples" : [

  ],
  "contentHash" : "448bf28ad86d5058ee66ecb37380e3cc7e22486766adef0a3ccc2c6a4969f33a",
  "crawledAt" : "2025-12-05T05:45:54Z",
  "declaration" : {
    "code" : "var identifier: String? { get set }",
    "language" : "swift"
  },
  "id" : "1509E013-C983-4D46-9F2A-56E30892492B",
  "kind" : "property",
  "language" : "swift",
  "module" : "Foundation",
  "overview" : "## Discussion\n\nThe identifier is unique to a notification. A notification delivered with the same identifier as an existing notification replaces the existing notification rather than causing the display of a new notification.",
  "platforms" : [
    "macOS"
  ],
  "rawMarkdown" : "---\nsource: https:\/\/developer.apple.com\/documentation\/Foundation\/NSUserNotification\/identifier\ncrawled: 2025-12-05T05:45:54Z\n---\n\n# identifier\n\n**Instance Property**\n\nA string that uniquely identifies a notification.\n\n## Declaration\n\n```swift\nvar identifier: String? { get set }\n```\n\n## Discussion\n\nThe identifier is unique to a notification. A notification delivered with the same identifier as an existing notification replaces the existing notification rather than causing the display of a new notification.\n\n## Display Information\n\n- **title**: Specifies the title of the notification.\n- **subtitle**: Specifies the subtitle of the notification.\n- **informativeText**: The body text of the notification.\n- **contentImage**: Image shown in the content of the notification.\n- **response**: The response with which the user responded to a notification.\n- **responsePlaceholder**: Optional placeholder string for inline reply field.\n\n",
  "sections" : [
    {
      "content" : "",
      "items" : [
        {
          "description" : "Specifies the title of the notification.",
          "name" : "title",
          "url" : "https:\/\/developer.apple.com\/documentation\/Foundation\/NSUserNotification\/title"
        },
        {
          "description" : "Specifies the subtitle of the notification.",
          "name" : "subtitle",
          "url" : "https:\/\/developer.apple.com\/documentation\/Foundation\/NSUserNotification\/subtitle"
        },
        {
          "description" : "The body text of the notification.",
          "name" : "informativeText",
          "url" : "https:\/\/developer.apple.com\/documentation\/Foundation\/NSUserNotification\/informativeText"
        },
        {
          "description" : "Image shown in the content of the notification.",
          "name" : "contentImage",
          "url" : "https:\/\/developer.apple.com\/documentation\/Foundation\/NSUserNotification\/contentImage"
        },
        {
          "description" : "The response with which the user responded to a notification.",
          "name" : "response",
          "url" : "https:\/\/developer.apple.com\/documentation\/Foundation\/NSUserNotification\/response"
        },
        {
          "description" : "Optional placeholder string for inline reply field.",
          "name" : "responsePlaceholder",
          "url" : "https:\/\/developer.apple.com\/documentation\/Foundation\/NSUserNotification\/responsePlaceholder"
        }
      ],
      "title" : "Display Information"
    }
  ],
  "source" : "appleJSON",
  "title" : "identifier",
  "url" : "https:\/\/developer.apple.com\/documentation\/Foundation\/NSUserNotification\/identifier"
}