{
  "abstract" : "Decodes and returns the object archived in a given `NSData` object.",
  "codeExamples" : [

  ],
  "contentHash" : "2589e731d1ab2ceb549d4e7489204103a439021b7c8578eebac210a30edbc674",
  "crawledAt" : "2025-12-06T02:57:46Z",
  "declaration" : {
    "code" : "class func unarchiveObject(with data: Data) -> Any?",
    "language" : "swift"
  },
  "id" : "D00F27A8-6E7B-4892-9D82-7910ABFDBF5E",
  "kind" : "method",
  "language" : "swift",
  "module" : "Foundation",
  "overview" : "## Return Value\n\nThe object, or object graph, that was archived in `data`. Returns `nil` if `data` cannot be unarchived.\n\n## Discussion\n\nThis method invokes [doc:\/\/com.apple.foundation\/documentation\/Foundation\/NSUnarchiver\/init(forReadingWith:)] and [doc:\/\/com.apple.foundation\/documentation\/Foundation\/NSCoder\/decodeObject()] to create a temporary `NSUnarchiver` object that decodes the object. If the archived object is the root of a graph of objects, the entire graph is unarchived.",
  "platforms" : [
    "Mac Catalyst",
    "macOS"
  ],
  "rawMarkdown" : "---\nsource: https:\/\/developer.apple.com\/documentation\/Foundation\/NSUnarchiver\/unarchiveObject(with:)\ncrawled: 2025-12-06T02:57:46Z\n---\n\n# unarchiveObject(with:)\n\n**Type Method**\n\nDecodes and returns the object archived in a given `NSData` object.\n\n## Declaration\n\n```swift\nclass func unarchiveObject(with data: Data) -> Any?\n```\n\n## Parameters\n\n- **data**: An `NSData` object that contains an archive created using `NSArchiver`.\n\n## Return Value\n\nThe object, or object graph, that was archived in `data`. Returns `nil` if `data` cannot be unarchived.\n\n## Discussion\n\nThis method invokes [doc:\/\/com.apple.foundation\/documentation\/Foundation\/NSUnarchiver\/init(forReadingWith:)] and [doc:\/\/com.apple.foundation\/documentation\/Foundation\/NSCoder\/decodeObject()] to create a temporary `NSUnarchiver` object that decodes the object. If the archived object is the root of a graph of objects, the entire graph is unarchived.\n\n## Related Documentation\n\n- **encodeRootObject(_:)**: Archives a given object along with all the objects to which it is connected.\n\n## Decoding objects\n\n- **unarchiveObject(withFile:)**: Decodes and returns the object archived in the file `path`.\n\n",
  "sections" : [
    {
      "content" : "",
      "items" : [
        {
          "description" : "Archives a given object along with all the objects to which it is connected.",
          "name" : "encodeRootObject(_:)",
          "url" : "https:\/\/developer.apple.com\/documentation\/Foundation\/NSArchiver\/encodeRootObject(_:)"
        }
      ],
      "title" : "Related Documentation"
    },
    {
      "content" : "",
      "items" : [
        {
          "description" : "Decodes and returns the object archived in the file `path`.",
          "name" : "unarchiveObject(withFile:)",
          "url" : "https:\/\/developer.apple.com\/documentation\/Foundation\/NSUnarchiver\/unarchiveObject(withFile:)"
        }
      ],
      "title" : "Decoding objects"
    }
  ],
  "source" : "appleJSON",
  "title" : "unarchiveObject(with:)",
  "url" : "https:\/\/developer.apple.com\/documentation\/Foundation\/NSUnarchiver\/unarchiveObject(with:)"
}