{
  "abstract" : "A notification dispatch mechanism that enables the broadcast of information to registered observers.",
  "codeExamples" : [

  ],
  "conformsTo" : [
    "CVarArg",
    "CustomDebugStringConvertible",
    "CustomStringConvertible",
    "Equatable",
    "Hashable",
    "NSObjectProtocol",
    "Sendable",
    "SendableMetatype"
  ],
  "contentHash" : "5e1aea811c67535e335f1dd4b67772b077532fe8726cbbf5be63dbac740f3bcc",
  "crawledAt" : "2025-12-04T17:55:15Z",
  "declaration" : {
    "code" : "class NotificationCenter",
    "language" : "swift"
  },
  "id" : "9837A6D6-BFC6-4964-9CAA-AA64A47453D9",
  "inheritedBy" : [
    "DistributedNotificationCenter"
  ],
  "kind" : "class",
  "language" : "swift",
  "module" : "Foundation",
  "overview" : "## Overview\n\nCallers register with a notification center to receive one or both of the following:\n\nCallers may add observers for many different notifications, or even the same notification name or message type as produced by different source objects.\n\nEach running app has a [doc:\/\/com.apple.foundation\/documentation\/Foundation\/NotificationCenter\/default] notification center, and you can create new notification centers to organize communications in particular contexts.\n\nA notification center can deliver notifications only within a single program. On macOS, if you want to post a notification to other processes or receive notifications from other processes, use [doc:\/\/com.apple.foundation\/documentation\/Foundation\/DistributedNotificationCenter] instead.",
  "platforms" : [
    "iOS",
    "iPadOS",
    "Mac Catalyst",
    "macOS",
    "tvOS",
    "visionOS",
    "watchOS"
  ],
  "rawMarkdown" : "---\nsource: https:\/\/developer.apple.com\/documentation\/Foundation\/NotificationCenter\ncrawled: 2025-12-04T17:55:15Z\n---\n\n# NotificationCenter\n\n**Class**\n\nA notification dispatch mechanism that enables the broadcast of information to registered observers.\n\n## Declaration\n\n```swift\nclass NotificationCenter\n```\n\n## Overview\n\nCallers register with a notification center to receive one or both of the following:\n\n- [doc:\/\/com.apple.foundation\/documentation\/Foundation\/NSNotification] objects, when working in Objective-C or with frameworks that only support [doc:\/\/com.apple.foundation\/documentation\/Foundation\/NSNotification]. Objects register with a notification center to receive notifications ([doc:\/\/com.apple.foundation\/documentation\/Foundation\/NSNotification] objects) using the [doc:\/\/com.apple.foundation\/documentation\/Foundation\/NotificationCenter\/addObserver(_:selector:name:object:)] or [doc:\/\/com.apple.foundation\/documentation\/Foundation\/NotificationCenter\/addObserver(forName:object:queue:using:)] methods, specifying a notification name and optionally a source object. When a caller adds itself as an observer, it specifies which notifications it should receive.\n- [doc:\/\/com.apple.foundation\/documentation\/Foundation\/NotificationCenter\/MainActorMessage] and [doc:\/\/com.apple.foundation\/documentation\/Foundation\/NotificationCenter\/AsyncMessage] instances for use with Swift code, providing strong typing, appropriate actor isolation, and a more idiomatic Swift experience. Callers register with the notification center using the various flavors of the `addObserver(of:for:using:)` method, specifying either a message type or a convenience [doc:\/\/com.apple.foundation\/documentation\/Foundation\/NotificationCenter\/MessageIdentifier] to identify the notification messages to receive. See [doc:\/\/com.apple.foundation\/documentation\/Foundation\/notification-center-messages] for more information about this API.\n\nCallers may add observers for many different notifications, or even the same notification name or message type as produced by different source objects.\n\nEach running app has a [doc:\/\/com.apple.foundation\/documentation\/Foundation\/NotificationCenter\/default] notification center, and you can create new notification centers to organize communications in particular contexts.\n\nA notification center can deliver notifications only within a single program. On macOS, if you want to post a notification to other processes or receive notifications from other processes, use [doc:\/\/com.apple.foundation\/documentation\/Foundation\/DistributedNotificationCenter] instead.\n\n## Getting the default notification center\n\n- **default**: The app’s default notification center.\n\n## Adding and removing notification observers\n\n- **addObserver(forName:object:queue:using:)**: Adds an entry to the notification center to receive notifications that passed to the provided block.\n- **addObserver(_:selector:name:object:)**: Adds an entry to the notification center to call the provided selector with the notification.\n- **removeObserver(_:name:object:)**: Removes matching entries from the notification center’s dispatch table.\n- **removeObserver(_:)**: Removes all entries specifying an observer from the notification center’s dispatch table.\n\n## Posting notifications\n\n- **post(_:)**: Posts a given notification to the notification center.\n- **post(name:object:userInfo:)**: Creates a notification with a given name, sender, and information and posts it to the notification center.\n- **post(name:object:)**: Creates a notification with a given name and sender and posts it to the notification center.\n\n## Receiving notifications as an asynchronous sequence\n\n- **notifications(named:object:)**: Returns an asynchronous sequence of notifications produced by this center for a given notification name and optional source object.\n- **NotificationCenter.Notifications**: An asynchronous sequence of notifications generated by a notification center.\n\n## Receiving notifications as a Combine publisher\n\n- **publisher(for:object:)**: Returns a publisher that emits events when broadcasting notifications.\n- **NotificationCenter.Publisher**: A publisher that emits elements when broadcasting notifications.\n\n## Using notification center with Swift actor isolation\n\n- **Notification center messages**: Use Foundation’s notification center with Swift concurrency.\n\n## Notifications\n\n- **Notification**: A container for information broadcast through a notification center to all registered observers.\n- **NotificationQueue**: A notification center buffer.\n\n## Inherits From\n\n- NSObject\n\n## Inherited By\n\n- DistributedNotificationCenter\n\n## Conforms To\n\n- CVarArg\n- CustomDebugStringConvertible\n- CustomStringConvertible\n- Equatable\n- Hashable\n- NSObjectProtocol\n- Sendable\n- SendableMetatype\n\n",
  "sections" : [
    {
      "content" : "",
      "items" : [
        {
          "description" : "The app’s default notification center.",
          "name" : "default",
          "url" : "https:\/\/developer.apple.com\/documentation\/Foundation\/NotificationCenter\/default"
        }
      ],
      "title" : "Getting the default notification center"
    },
    {
      "content" : "",
      "items" : [
        {
          "description" : "Adds an entry to the notification center to receive notifications that passed to the provided block.",
          "name" : "addObserver(forName:object:queue:using:)",
          "url" : "https:\/\/developer.apple.com\/documentation\/Foundation\/NotificationCenter\/addObserver(forName:object:queue:using:)"
        },
        {
          "description" : "Adds an entry to the notification center to call the provided selector with the notification.",
          "name" : "addObserver(_:selector:name:object:)",
          "url" : "https:\/\/developer.apple.com\/documentation\/Foundation\/NotificationCenter\/addObserver(_:selector:name:object:)"
        },
        {
          "description" : "Removes matching entries from the notification center’s dispatch table.",
          "name" : "removeObserver(_:name:object:)",
          "url" : "https:\/\/developer.apple.com\/documentation\/Foundation\/NotificationCenter\/removeObserver(_:name:object:)"
        },
        {
          "description" : "Removes all entries specifying an observer from the notification center’s dispatch table.",
          "name" : "removeObserver(_:)",
          "url" : "https:\/\/developer.apple.com\/documentation\/Foundation\/NotificationCenter\/removeObserver(_:)-2yciv"
        }
      ],
      "title" : "Adding and removing notification observers"
    },
    {
      "content" : "",
      "items" : [
        {
          "description" : "Posts a given notification to the notification center.",
          "name" : "post(_:)",
          "url" : "https:\/\/developer.apple.com\/documentation\/Foundation\/NotificationCenter\/post(_:)-3x2st"
        },
        {
          "description" : "Creates a notification with a given name, sender, and information and posts it to the notification center.",
          "name" : "post(name:object:userInfo:)",
          "url" : "https:\/\/developer.apple.com\/documentation\/Foundation\/NotificationCenter\/post(name:object:userInfo:)"
        },
        {
          "description" : "Creates a notification with a given name and sender and posts it to the notification center.",
          "name" : "post(name:object:)",
          "url" : "https:\/\/developer.apple.com\/documentation\/Foundation\/NotificationCenter\/post(name:object:)"
        }
      ],
      "title" : "Posting notifications"
    },
    {
      "content" : "",
      "items" : [
        {
          "description" : "Returns an asynchronous sequence of notifications produced by this center for a given notification name and optional source object.",
          "name" : "notifications(named:object:)",
          "url" : "https:\/\/developer.apple.com\/documentation\/Foundation\/NotificationCenter\/notifications(named:object:)"
        },
        {
          "description" : "An asynchronous sequence of notifications generated by a notification center.",
          "name" : "NotificationCenter.Notifications",
          "url" : "https:\/\/developer.apple.com\/documentation\/Foundation\/NotificationCenter\/Notifications"
        }
      ],
      "title" : "Receiving notifications as an asynchronous sequence"
    },
    {
      "content" : "",
      "items" : [
        {
          "description" : "Returns a publisher that emits events when broadcasting notifications.",
          "name" : "publisher(for:object:)",
          "url" : "https:\/\/developer.apple.com\/documentation\/Foundation\/NotificationCenter\/publisher(for:object:)"
        },
        {
          "description" : "A publisher that emits elements when broadcasting notifications.",
          "name" : "NotificationCenter.Publisher",
          "url" : "https:\/\/developer.apple.com\/documentation\/Foundation\/NotificationCenter\/Publisher"
        }
      ],
      "title" : "Receiving notifications as a Combine publisher"
    },
    {
      "content" : "",
      "items" : [
        {
          "description" : "Use Foundation’s notification center with Swift concurrency.",
          "name" : "Notification center messages",
          "url" : "https:\/\/developer.apple.com\/documentation\/Foundation\/notification-center-messages"
        }
      ],
      "title" : "Using notification center with Swift actor isolation"
    },
    {
      "content" : "",
      "items" : [
        {
          "description" : "A container for information broadcast through a notification center to all registered observers.",
          "name" : "Notification",
          "url" : "https:\/\/developer.apple.com\/documentation\/Foundation\/Notification"
        },
        {
          "description" : "A notification center buffer.",
          "name" : "NotificationQueue",
          "url" : "https:\/\/developer.apple.com\/documentation\/Foundation\/NotificationQueue"
        }
      ],
      "title" : "Notifications"
    },
    {
      "content" : "",
      "items" : [
        {
          "name" : "NSObject"
        }
      ],
      "title" : "Inherits From"
    }
  ],
  "source" : "appleJSON",
  "title" : "NotificationCenter",
  "url" : "https:\/\/developer.apple.com\/documentation\/Foundation\/NotificationCenter"
}