{
  "abstract" : "Removes the local copy of the specified item that’s stored in iCloud.",
  "codeExamples" : [

  ],
  "contentHash" : "b85f8a243999c64aa24c8595b3ea90a80bfa6e2928ef7ac81a8f4d40f9309535",
  "crawledAt" : "2025-12-06T02:51:08Z",
  "declaration" : {
    "code" : "func evictUbiquitousItem(at url: URL) throws",
    "language" : "swift"
  },
  "id" : "D51BDEC8-1313-4AAB-AD58-8187D249BCC5",
  "kind" : "method",
  "language" : "swift",
  "module" : "Foundation",
  "overview" : "## Discussion\n\nDon’t use a coordinated write to perform this operation. In macOS 10.7 or earlier, the framework takes a coordinated write in its implementation of this method, so taking one in your app causes a deadlock. In macOS 10.8 and later, the framework detects coordination done by your app on the same thread as the call to this method, to avoid deadlocking.\n\nThis method doesn’t remove the item from iCloud. It removes only the local version. You can then use [doc:\/\/com.apple.foundation\/documentation\/Foundation\/FileManager\/startDownloadingUbiquitousItem(at:)] to force iCloud to download a new version of the file or directory from the server.\n\nTo delete a file permanently from the user’s iCloud storage, use the regular [doc:\/\/com.apple.foundation\/documentation\/Foundation\/FileManager] routines for deleting files and directories. Remember that deleting items from iCloud can’t be undone. Once deleted, the item is gone forever.",
  "platforms" : [
    "iOS",
    "iPadOS",
    "Mac Catalyst",
    "macOS",
    "tvOS",
    "visionOS",
    "watchOS"
  ],
  "rawMarkdown" : "---\nsource: https:\/\/developer.apple.com\/documentation\/Foundation\/FileManager\/evictUbiquitousItem(at:)\ncrawled: 2025-12-06T02:51:08Z\n---\n\n# evictUbiquitousItem(at:)\n\n**Instance Method**\n\nRemoves the local copy of the specified item that’s stored in iCloud.\n\n## Declaration\n\n```swift\nfunc evictUbiquitousItem(at url: URL) throws\n```\n\n## Parameters\n\n- **url**: The URL to a file or directory in iCloud storage.\n\n## Discussion\n\nDon’t use a coordinated write to perform this operation. In macOS 10.7 or earlier, the framework takes a coordinated write in its implementation of this method, so taking one in your app causes a deadlock. In macOS 10.8 and later, the framework detects coordination done by your app on the same thread as the call to this method, to avoid deadlocking.\n\nThis method doesn’t remove the item from iCloud. It removes only the local version. You can then use [doc:\/\/com.apple.foundation\/documentation\/Foundation\/FileManager\/startDownloadingUbiquitousItem(at:)] to force iCloud to download a new version of the file or directory from the server.\n\nTo delete a file permanently from the user’s iCloud storage, use the regular [doc:\/\/com.apple.foundation\/documentation\/Foundation\/FileManager] routines for deleting files and directories. Remember that deleting items from iCloud can’t be undone. Once deleted, the item is gone forever.\n\n\n\n## Related Documentation\n\n- **removeItem(at:)**: Removes the file or directory at the specified URL.\n\n## Managing iCloud-based items\n\n- **ubiquityIdentityToken**: An opaque token that represents the current user’s iCloud Drive Documents identity.\n- **url(forUbiquityContainerIdentifier:)**: Returns the URL for the iCloud container associated with the specified identifier and establishes access to that container.\n- **isUbiquitousItem(at:)**: Returns a Boolean indicating whether the item is targeted for storage in iCloud.\n- **setUbiquitous(_:itemAt:destinationURL:)**: Indicates whether the item at the specified URL should be stored in iCloud.\n- **startDownloadingUbiquitousItem(at:)**: Starts downloading (if necessary) the specified item to the local system.\n- **url(forPublishingUbiquitousItemAt:expiration:)**: Returns a URL that can be emailed to users to allow them to download a copy of a flat file item from iCloud.\n\n",
  "sections" : [
    {
      "content" : "",
      "items" : [
        {
          "description" : "Removes the file or directory at the specified URL.",
          "name" : "removeItem(at:)",
          "url" : "https:\/\/developer.apple.com\/documentation\/Foundation\/FileManager\/removeItem(at:)"
        }
      ],
      "title" : "Related Documentation"
    },
    {
      "content" : "",
      "items" : [
        {
          "description" : "An opaque token that represents the current user’s iCloud Drive Documents identity.",
          "name" : "ubiquityIdentityToken",
          "url" : "https:\/\/developer.apple.com\/documentation\/Foundation\/FileManager\/ubiquityIdentityToken"
        },
        {
          "description" : "Returns the URL for the iCloud container associated with the specified identifier and establishes access to that container.",
          "name" : "url(forUbiquityContainerIdentifier:)",
          "url" : "https:\/\/developer.apple.com\/documentation\/Foundation\/FileManager\/url(forUbiquityContainerIdentifier:)"
        },
        {
          "description" : "Returns a Boolean indicating whether the item is targeted for storage in iCloud.",
          "name" : "isUbiquitousItem(at:)",
          "url" : "https:\/\/developer.apple.com\/documentation\/Foundation\/FileManager\/isUbiquitousItem(at:)"
        },
        {
          "description" : "Indicates whether the item at the specified URL should be stored in iCloud.",
          "name" : "setUbiquitous(_:itemAt:destinationURL:)",
          "url" : "https:\/\/developer.apple.com\/documentation\/Foundation\/FileManager\/setUbiquitous(_:itemAt:destinationURL:)"
        },
        {
          "description" : "Starts downloading (if necessary) the specified item to the local system.",
          "name" : "startDownloadingUbiquitousItem(at:)",
          "url" : "https:\/\/developer.apple.com\/documentation\/Foundation\/FileManager\/startDownloadingUbiquitousItem(at:)"
        },
        {
          "description" : "Returns a URL that can be emailed to users to allow them to download a copy of a flat file item from iCloud.",
          "name" : "url(forPublishingUbiquitousItemAt:expiration:)",
          "url" : "https:\/\/developer.apple.com\/documentation\/Foundation\/FileManager\/url(forPublishingUbiquitousItemAt:expiration:)"
        }
      ],
      "title" : "Managing iCloud-based items"
    }
  ],
  "source" : "appleJSON",
  "title" : "evictUbiquitousItem(at:)",
  "url" : "https:\/\/developer.apple.com\/documentation\/Foundation\/FileManager\/evictUbiquitousItem(at:)"
}