{
  "abstract" : "The top-level repository of scriptability information for an app at runtime.",
  "codeExamples" : [

  ],
  "conformsTo" : [
    "CVarArg",
    "CustomDebugStringConvertible",
    "CustomStringConvertible",
    "Equatable",
    "Hashable",
    "NSObjectProtocol"
  ],
  "contentHash" : "28520a00d8ea65393428ab943be30fbb5ddf643f8b49d7eb5d95d3b7112c89e8",
  "crawledAt" : "2025-12-04T16:24:06Z",
  "declaration" : {
    "code" : "class NSScriptSuiteRegistry",
    "language" : "swift"
  },
  "id" : "21DF2F05-6B92-4A2A-AB78-61DD732A3AFB",
  "kind" : "class",
  "language" : "swift",
  "module" : "Foundation",
  "overview" : "## Overview\n\nScriptability information specifies the terminology available for use in scripts that target an application. It also provides information, used by AppleScript and by Cocoa, about how support for that terminology is implemented in the application. This information includes descriptions of the scriptable object classes in an application and of the commands the application supports.\n\nThere are two standard formats for supplying scriptability information: the older script suite format, consisting of a script suite file and one or more script terminology files, and the newer scripting definition (or sdef) format, consisting of a single sdef file.\n\nThere is one instance of `NSScriptSuiteRegistry` per scriptable application. This registry object collects scriptability information when the application first needs to respond to an Apple event for which Cocoa hasn’t installed a default event handler. It then creates one instance of  [doc:\/\/com.apple.foundation\/documentation\/Foundation\/NSScriptClassDescription] for each object class and one instance of [doc:\/\/com.apple.foundation\/documentation\/Foundation\/NSScriptCommandDescription] for each command class, and installs a command handler for each command.\n\nWhen a user executes an AppleScript script, Apple events are sent to the targeted application. Using the information stored in the registry object, Cocoa automatically converts incoming Apple events into script commands (based on [doc:\/\/com.apple.foundation\/documentation\/Foundation\/NSScriptCommand] or a subclass) that manipulate objects in the application.\n\nThe public methods of `NSScriptSuiteRegistry` are used primarily by Cocoa’s built-in scripting support. You should not need to create a subclass of `NSScriptSuiteRegistry`.\n\nFor information on scriptability information formats, loading of scriptability information, and related topics, see “Scriptability Information” in [https:\/\/developer.apple.com\/library\/archive\/documentation\/Cocoa\/Conceptual\/ScriptableCocoaApplications\/SApps_about_apps\/SAppsAboutApps.html#\/\/apple_ref\/doc\/uid\/TP40001976] in [https:\/\/developer.apple.com\/library\/archive\/documentation\/Cocoa\/Conceptual\/ScriptableCocoaApplications\/SApps_intro\/SAppsIntro.html#\/\/apple_ref\/doc\/uid\/TP40002164].",
  "platforms" : [
    "Mac Catalyst",
    "macOS"
  ],
  "rawMarkdown" : "---\nsource: https:\/\/developer.apple.com\/documentation\/Foundation\/NSScriptSuiteRegistry\ncrawled: 2025-12-04T16:24:06Z\n---\n\n# NSScriptSuiteRegistry\n\n**Class**\n\nThe top-level repository of scriptability information for an app at runtime.\n\n## Declaration\n\n```swift\nclass NSScriptSuiteRegistry\n```\n\n## Overview\n\nScriptability information specifies the terminology available for use in scripts that target an application. It also provides information, used by AppleScript and by Cocoa, about how support for that terminology is implemented in the application. This information includes descriptions of the scriptable object classes in an application and of the commands the application supports.\n\nThere are two standard formats for supplying scriptability information: the older script suite format, consisting of a script suite file and one or more script terminology files, and the newer scripting definition (or sdef) format, consisting of a single sdef file.\n\nThere is one instance of `NSScriptSuiteRegistry` per scriptable application. This registry object collects scriptability information when the application first needs to respond to an Apple event for which Cocoa hasn’t installed a default event handler. It then creates one instance of  [doc:\/\/com.apple.foundation\/documentation\/Foundation\/NSScriptClassDescription] for each object class and one instance of [doc:\/\/com.apple.foundation\/documentation\/Foundation\/NSScriptCommandDescription] for each command class, and installs a command handler for each command.\n\nWhen a user executes an AppleScript script, Apple events are sent to the targeted application. Using the information stored in the registry object, Cocoa automatically converts incoming Apple events into script commands (based on [doc:\/\/com.apple.foundation\/documentation\/Foundation\/NSScriptCommand] or a subclass) that manipulate objects in the application.\n\nThe public methods of `NSScriptSuiteRegistry` are used primarily by Cocoa’s built-in scripting support. You should not need to create a subclass of `NSScriptSuiteRegistry`.\n\nFor information on scriptability information formats, loading of scriptability information, and related topics, see “Scriptability Information” in [https:\/\/developer.apple.com\/library\/archive\/documentation\/Cocoa\/Conceptual\/ScriptableCocoaApplications\/SApps_about_apps\/SAppsAboutApps.html#\/\/apple_ref\/doc\/uid\/TP40001976] in [https:\/\/developer.apple.com\/library\/archive\/documentation\/Cocoa\/Conceptual\/ScriptableCocoaApplications\/SApps_intro\/SAppsIntro.html#\/\/apple_ref\/doc\/uid\/TP40002164].\n\n## Getting and Setting the Shared Instance\n\n- **setShared(_:)**: Sets the single, shared instance of `NSScriptSuiteRegistry` to `registry`.\n- **shared()**: Returns the single, shared instance of `NSScriptSuiteRegistry`, creating it first if it doesn’t exist.\n\n## Getting Suite Information\n\n- **suite(forAppleEventCode:)**: Returns the name of the suite definition associated with the given four-character Apple event code, `code`.\n- **suiteNames**: Returns the names of the suite definitions currently loaded by the application.\n\n## Getting and Registering Class Descriptions\n\n- **classDescriptions(inSuite:)**: Returns the class descriptions contained in the suite identified by `suiteName`.\n- **classDescription(withAppleEventCode:)**: Returns the class description associated with the given four-character Apple event code, `code`.\n- **register(_:)**: Registers class description `classDescription` for use by Cocoa’s built-in scripting support by storing it in a per-suite internal dictionary under the class name.\n\n## Getting and Registering Command Descriptions\n\n- **commandDescriptions(inSuite:)**: Returns the command descriptions contained in the suite identified by `suiteName`.\n- **commandDescription(withAppleEventClass:andAppleEventCode:)**: Returns the command description identified by a suite’s four-character Apple event code of the class (`eventClass`) and the four-character Apple event code of the command (`commandCode`).\n- **register(_:)**: Registers command description `commandDesc` for use by Cocoa’s built-in scripting support by storing it in a per-suite internal dictionary under the command name.\n\n## Getting Other Suite Information\n\n- **aeteResource(_:)**: Returns an `NSData` object that contains data in `'aete'` resource format describing the scriptability information currently known to the application.\n- **appleEventCode(forSuite:)**: Returns the Apple event code associated with the suite named `suiteName`, such as `‘core’` for the Core suite.\n- **bundle(forSuite:)**: Returns the bundle containing the suite-definition property list (extension `.scriptSuite`) identified by `suiteName`.\n\n## Loading Suites\n\n- **loadSuite(with:from:)**: Loads the suite definition encapsulated in `dictionary`; previously, this suite definition was parsed from a `.scriptSuite` property list contained in a framework or in `bundle`.\n- **loadSuites(from:)**: Loads the suite definitions in bundle `aBundle`, invoking [doc:\/\/com.apple.foundation\/documentation\/Foundation\/NSScriptSuiteRegistry\/loadSuite(with:from:)] for each suite found.\n\n## Script Dictionary Description\n\n- **NSScriptClassDescription**: A scriptable class that a macOS app supports.\n- **NSClassDescription**: An abstract class that provides the interface for querying the relationships and properties of a class.\n- **NSScriptCommandDescription**: A script command that a macOS app supports.\n\n## Inherits From\n\n- NSObject\n\n## Conforms To\n\n- CVarArg\n- CustomDebugStringConvertible\n- CustomStringConvertible\n- Equatable\n- Hashable\n- NSObjectProtocol\n\n",
  "sections" : [
    {
      "content" : "",
      "items" : [
        {
          "description" : "Sets the single, shared instance of `NSScriptSuiteRegistry` to `registry`.",
          "name" : "setShared(_:)",
          "url" : "https:\/\/developer.apple.com\/documentation\/Foundation\/NSScriptSuiteRegistry\/setShared(_:)"
        },
        {
          "description" : "Returns the single, shared instance of `NSScriptSuiteRegistry`, creating it first if it doesn’t exist.",
          "name" : "shared()",
          "url" : "https:\/\/developer.apple.com\/documentation\/Foundation\/NSScriptSuiteRegistry\/shared()"
        }
      ],
      "title" : "Getting and Setting the Shared Instance"
    },
    {
      "content" : "",
      "items" : [
        {
          "description" : "Returns the name of the suite definition associated with the given four-character Apple event code, `code`.",
          "name" : "suite(forAppleEventCode:)",
          "url" : "https:\/\/developer.apple.com\/documentation\/Foundation\/NSScriptSuiteRegistry\/suite(forAppleEventCode:)"
        },
        {
          "description" : "Returns the names of the suite definitions currently loaded by the application.",
          "name" : "suiteNames",
          "url" : "https:\/\/developer.apple.com\/documentation\/Foundation\/NSScriptSuiteRegistry\/suiteNames"
        }
      ],
      "title" : "Getting Suite Information"
    },
    {
      "content" : "",
      "items" : [
        {
          "description" : "Returns the class descriptions contained in the suite identified by `suiteName`.",
          "name" : "classDescriptions(inSuite:)",
          "url" : "https:\/\/developer.apple.com\/documentation\/Foundation\/NSScriptSuiteRegistry\/classDescriptions(inSuite:)"
        },
        {
          "description" : "Returns the class description associated with the given four-character Apple event code, `code`.",
          "name" : "classDescription(withAppleEventCode:)",
          "url" : "https:\/\/developer.apple.com\/documentation\/Foundation\/NSScriptSuiteRegistry\/classDescription(withAppleEventCode:)"
        },
        {
          "description" : "Registers class description `classDescription` for use by Cocoa’s built-in scripting support by storing it in a per-suite internal dictionary under the class name.",
          "name" : "register(_:)",
          "url" : "https:\/\/developer.apple.com\/documentation\/Foundation\/NSScriptSuiteRegistry\/register(_:)-9aplw"
        }
      ],
      "title" : "Getting and Registering Class Descriptions"
    },
    {
      "content" : "",
      "items" : [
        {
          "description" : "Returns the command descriptions contained in the suite identified by `suiteName`.",
          "name" : "commandDescriptions(inSuite:)",
          "url" : "https:\/\/developer.apple.com\/documentation\/Foundation\/NSScriptSuiteRegistry\/commandDescriptions(inSuite:)"
        },
        {
          "description" : "Returns the command description identified by a suite’s four-character Apple event code of the class (`eventClass`) and the four-character Apple event code of the command (`commandCode`).",
          "name" : "commandDescription(withAppleEventClass:andAppleEventCode:)",
          "url" : "https:\/\/developer.apple.com\/documentation\/Foundation\/NSScriptSuiteRegistry\/commandDescription(withAppleEventClass:andAppleEventCode:)"
        },
        {
          "description" : "Registers command description `commandDesc` for use by Cocoa’s built-in scripting support by storing it in a per-suite internal dictionary under the command name.",
          "name" : "register(_:)",
          "url" : "https:\/\/developer.apple.com\/documentation\/Foundation\/NSScriptSuiteRegistry\/register(_:)-5mq91"
        }
      ],
      "title" : "Getting and Registering Command Descriptions"
    },
    {
      "content" : "",
      "items" : [
        {
          "description" : "Returns an `NSData` object that contains data in `'aete'` resource format describing the scriptability information currently known to the application.",
          "name" : "aeteResource(_:)",
          "url" : "https:\/\/developer.apple.com\/documentation\/Foundation\/NSScriptSuiteRegistry\/aeteResource(_:)"
        },
        {
          "description" : "Returns the Apple event code associated with the suite named `suiteName`, such as `‘core’` for the Core suite.",
          "name" : "appleEventCode(forSuite:)",
          "url" : "https:\/\/developer.apple.com\/documentation\/Foundation\/NSScriptSuiteRegistry\/appleEventCode(forSuite:)"
        },
        {
          "description" : "Returns the bundle containing the suite-definition property list (extension `.scriptSuite`) identified by `suiteName`.",
          "name" : "bundle(forSuite:)",
          "url" : "https:\/\/developer.apple.com\/documentation\/Foundation\/NSScriptSuiteRegistry\/bundle(forSuite:)"
        }
      ],
      "title" : "Getting Other Suite Information"
    },
    {
      "content" : "",
      "items" : [
        {
          "description" : "Loads the suite definition encapsulated in `dictionary`; previously, this suite definition was parsed from a `.scriptSuite` property list contained in a framework or in `bundle`.",
          "name" : "loadSuite(with:from:)",
          "url" : "https:\/\/developer.apple.com\/documentation\/Foundation\/NSScriptSuiteRegistry\/loadSuite(with:from:)"
        },
        {
          "description" : "Loads the suite definitions in bundle `aBundle`, invoking [doc:\/\/com.apple.foundation\/documentation\/Foundation\/NSScriptSuiteRegistry\/loadSuite(with:from:)] for each suite found.",
          "name" : "loadSuites(from:)",
          "url" : "https:\/\/developer.apple.com\/documentation\/Foundation\/NSScriptSuiteRegistry\/loadSuites(from:)"
        }
      ],
      "title" : "Loading Suites"
    },
    {
      "content" : "",
      "items" : [
        {
          "description" : "A scriptable class that a macOS app supports.",
          "name" : "NSScriptClassDescription",
          "url" : "https:\/\/developer.apple.com\/documentation\/Foundation\/NSScriptClassDescription"
        },
        {
          "description" : "An abstract class that provides the interface for querying the relationships and properties of a class.",
          "name" : "NSClassDescription",
          "url" : "https:\/\/developer.apple.com\/documentation\/Foundation\/NSClassDescription"
        },
        {
          "description" : "A script command that a macOS app supports.",
          "name" : "NSScriptCommandDescription",
          "url" : "https:\/\/developer.apple.com\/documentation\/Foundation\/NSScriptCommandDescription"
        }
      ],
      "title" : "Script Dictionary Description"
    },
    {
      "content" : "",
      "items" : [
        {
          "name" : "NSObject"
        }
      ],
      "title" : "Inherits From"
    }
  ],
  "source" : "appleJSON",
  "title" : "NSScriptSuiteRegistry",
  "url" : "https:\/\/developer.apple.com\/documentation\/Foundation\/NSScriptSuiteRegistry"
}