{
  "abstract" : "A rule that affects how an attributed string performs automatic grammatical agreement.",
  "codeExamples" : [
    {
      "code" : "var string = AttributedString(localized: \"They liked your post.\")\n\/\/ The user who liked the post uses feminine pronouns.\nvar morphology = Morphology()\nmorphology.grammaticalGender = .feminine\nstring.inflect = InflectionRule(morphology: morphology)\nlet result = string.inflected()\n\/\/ result == \"She liked your post.\"",
      "language" : "swift"
    }
  ],
  "conformsTo" : [
    "Copyable",
    "Decodable",
    "Encodable",
    "Equatable",
    "Hashable",
    "Sendable",
    "SendableMetatype"
  ],
  "contentHash" : "9240a9de975f9d35e8a181006682a4d974c2ffa020ce20688812ead55278c5a3",
  "crawledAt" : "2025-12-03T05:09:40Z",
  "declaration" : {
    "code" : "enum InflectionRule",
    "language" : "swift"
  },
  "id" : "556EEA95-8EB4-407F-B5E1-0946D4A291E5",
  "kind" : "enum",
  "language" : "swift",
  "module" : "Foundation",
  "overview" : "## Overview\n\nMost apps can rely on loading localized strings to perform automatic grammar agreement. Typically, strings in your app’s strings files use the Markdown extension syntax to indicate portions of the string that may require inflection to agree grammatically. This transformation occurs when you load the attributed string with methods like `init(localized:options:table:bundle:locale:comment:)`.\n\nHowever, if the system lacks information about the words in the string, you may need to apply an inflection rule programmatically. For example, a social networking app may have gender information about other users that you want to apply at runtime. When performing manual inflection at runtime, you use an inflection rule to indicate to the system what portions of a string should be automatically edited, and what to match. Apply the [doc:\/\/com.apple.foundation\/documentation\/Foundation\/AttributeScopes\/FoundationAttributes\/inflect] attribute to set an [doc:\/\/com.apple.foundation\/documentation\/Foundation\/InflectionRule] on an [doc:\/\/com.apple.foundation\/documentation\/Foundation\/AttributedString], then call [doc:\/\/com.apple.foundation\/documentation\/Foundation\/AttributedString\/inflected()] to perform the grammar agreement and produce an edited string.",
  "platforms" : [
    "iOS",
    "iPadOS",
    "Mac Catalyst",
    "macOS",
    "tvOS",
    "visionOS",
    "watchOS"
  ],
  "rawMarkdown" : "---\nsource: https:\/\/developer.apple.com\/documentation\/Foundation\/InflectionRule\ncrawled: 2025-12-03T05:09:40Z\n---\n\n# InflectionRule\n\n**Enumeration**\n\nA rule that affects how an attributed string performs automatic grammatical agreement.\n\n## Declaration\n\n```swift\nenum InflectionRule\n```\n\n## Overview\n\nMost apps can rely on loading localized strings to perform automatic grammar agreement. Typically, strings in your app’s strings files use the Markdown extension syntax to indicate portions of the string that may require inflection to agree grammatically. This transformation occurs when you load the attributed string with methods like `init(localized:options:table:bundle:locale:comment:)`.\n\nHowever, if the system lacks information about the words in the string, you may need to apply an inflection rule programmatically. For example, a social networking app may have gender information about other users that you want to apply at runtime. When performing manual inflection at runtime, you use an inflection rule to indicate to the system what portions of a string should be automatically edited, and what to match. Apply the [doc:\/\/com.apple.foundation\/documentation\/Foundation\/AttributeScopes\/FoundationAttributes\/inflect] attribute to set an [doc:\/\/com.apple.foundation\/documentation\/Foundation\/InflectionRule] on an [doc:\/\/com.apple.foundation\/documentation\/Foundation\/AttributedString], then call [doc:\/\/com.apple.foundation\/documentation\/Foundation\/AttributedString\/inflected()] to perform the grammar agreement and produce an edited string.\n\n```swift\nvar string = AttributedString(localized: \"They liked your post.\")\n\/\/ The user who liked the post uses feminine pronouns.\nvar morphology = Morphology()\nmorphology.grammaticalGender = .feminine\nstring.inflect = InflectionRule(morphology: morphology)\nlet result = string.inflected()\n\/\/ result == \"She liked your post.\"\n```\n\n## Creating an Inflection Rule from a Morphology\n\n- **init(morphology:)**: Creates an inflection rule with the given morphology.\n- **Morphology**: A description of the grammatical properties of a string.\n\n## Inflection Rule Behaviors\n\n- **InflectionRule.automatic**: An inflection rule that performs automatic grammar agreement with default transformations.\n- **InflectionRule.explicit(_:)**: An inflection rule that uses a morphology instance to determine how to inflect attribued strings.\n\n## Determining Availability\n\n- **canInflect(language:)**: Returns a Boolean value that indicates whether the rule can inflect a given language.\n- **canInflectPreferredLocalization**: A Boolean value that indicates whether the rule can inflect the user’s current preferred localization.\n\n## Automatic grammar agreement\n\n- **Morphology**: A description of the grammatical properties of a string.\n- **TermOfAddress**: The type for representing grammatical gender in localized text.\n- **InflectionConcept**: An inflection method to use when localizing text.\n- **Morphology.Pronoun**: A custom pronoun for referring to a third person.\n\n## Conforms To\n\n- Copyable\n- Decodable\n- Encodable\n- Equatable\n- Hashable\n- Sendable\n- SendableMetatype\n\n",
  "sections" : [
    {
      "content" : "",
      "items" : [
        {
          "description" : "Creates an inflection rule with the given morphology.",
          "name" : "init(morphology:)",
          "url" : "https:\/\/developer.apple.com\/documentation\/Foundation\/InflectionRule\/init(morphology:)"
        },
        {
          "description" : "A description of the grammatical properties of a string.",
          "name" : "Morphology",
          "url" : "https:\/\/developer.apple.com\/documentation\/Foundation\/Morphology"
        }
      ],
      "title" : "Creating an Inflection Rule from a Morphology"
    },
    {
      "content" : "",
      "items" : [
        {
          "description" : "An inflection rule that performs automatic grammar agreement with default transformations.",
          "name" : "InflectionRule.automatic",
          "url" : "https:\/\/developer.apple.com\/documentation\/Foundation\/InflectionRule\/automatic"
        },
        {
          "description" : "An inflection rule that uses a morphology instance to determine how to inflect attribued strings.",
          "name" : "InflectionRule.explicit(_:)",
          "url" : "https:\/\/developer.apple.com\/documentation\/Foundation\/InflectionRule\/explicit(_:)"
        }
      ],
      "title" : "Inflection Rule Behaviors"
    },
    {
      "content" : "",
      "items" : [
        {
          "description" : "Returns a Boolean value that indicates whether the rule can inflect a given language.",
          "name" : "canInflect(language:)",
          "url" : "https:\/\/developer.apple.com\/documentation\/Foundation\/InflectionRule\/canInflect(language:)"
        },
        {
          "description" : "A Boolean value that indicates whether the rule can inflect the user’s current preferred localization.",
          "name" : "canInflectPreferredLocalization",
          "url" : "https:\/\/developer.apple.com\/documentation\/Foundation\/InflectionRule\/canInflectPreferredLocalization"
        }
      ],
      "title" : "Determining Availability"
    },
    {
      "content" : "",
      "items" : [
        {
          "description" : "A description of the grammatical properties of a string.",
          "name" : "Morphology",
          "url" : "https:\/\/developer.apple.com\/documentation\/Foundation\/Morphology"
        },
        {
          "description" : "The type for representing grammatical gender in localized text.",
          "name" : "TermOfAddress",
          "url" : "https:\/\/developer.apple.com\/documentation\/Foundation\/TermOfAddress"
        },
        {
          "description" : "An inflection method to use when localizing text.",
          "name" : "InflectionConcept",
          "url" : "https:\/\/developer.apple.com\/documentation\/Foundation\/InflectionConcept"
        },
        {
          "description" : "A custom pronoun for referring to a third person.",
          "name" : "Morphology.Pronoun",
          "url" : "https:\/\/developer.apple.com\/documentation\/Foundation\/Morphology\/Pronoun"
        }
      ],
      "title" : "Automatic grammar agreement"
    }
  ],
  "source" : "appleJSON",
  "title" : "InflectionRule",
  "url" : "https:\/\/developer.apple.com\/documentation\/Foundation\/InflectionRule"
}