{
  "abstract" : "Use a Markdown-syntax string to iniitalize an attributed string with standard or custom attributes.",
  "codeExamples" : [
    {
      "code" : "if let attString = try? AttributedString(\n    markdown: \"See the *latest* news at [our website](https:\/\/example.com).\"),\n    let websiteRange = attString.range(of: \"our website\"),\n    let link = attString[websiteRange].link {\n    print(\"\\(link)\") \/\/ Prints \"https:\/\/example.com\".\n}",
      "language" : "swift"
    }
  ],
  "contentHash" : "24780ad352c17132fa232055f828198133740f48489c9479db4fc8daae72f23f",
  "crawledAt" : "2025-12-03T04:48:05Z",
  "id" : "EC2606F4-19D4-44A2-9747-4E4F954D29E9",
  "kind" : "collection",
  "language" : "swift",
  "module" : "Foundation",
  "overview" : "## Overview\n\nYou can use familiar Markdown syntax to initialize an attributed string with both its initial text and attributes for things like inline styles and links. In many cases, this produces easier-to-read code than manually setting attributes on ranges of an existing attributed string.\n\nIn this example, `attString` contains five runs, with attributes parsed from the syntax in the `markdown` parameter:\n\nYou can also use custom attributes defined with the [doc:\/\/com.apple.foundation\/documentation\/Foundation\/MarkdownDecodableAttributedStringKey] protocol in the Markdown string. To do this, use Apple’s Markdown extension syntax: `^[text](attribute1: value1, attribute2: value2, …)`.\n\nWhen using attributes beyond those provided by the system, be sure to use initializers that take a `scope` parameter, and provide the scope that defines the custom attributes.",
  "rawMarkdown" : "---\nsource: https:\/\/developer.apple.com\/documentation\/Foundation\/instantiating-attributed-strings-with-markdown-syntax\ncrawled: 2025-12-03T04:48:05Z\n---\n\n# Instantiating Attributed Strings with Markdown Syntax\n\n**API Collection**\n\nUse a Markdown-syntax string to iniitalize an attributed string with standard or custom attributes.\n\n## Overview\n\nYou can use familiar Markdown syntax to initialize an attributed string with both its initial text and attributes for things like inline styles and links. In many cases, this produces easier-to-read code than manually setting attributes on ranges of an existing attributed string.\n\n```swift\nif let attString = try? AttributedString(\n    markdown: \"See the *latest* news at [our website](https:\/\/example.com).\"),\n    let websiteRange = attString.range(of: \"our website\"),\n    let link = attString[websiteRange].link {\n    print(\"\\(link)\") \/\/ Prints \"https:\/\/example.com\".\n}\n```\n\nIn this example, `attString` contains five runs, with attributes parsed from the syntax in the `markdown` parameter:\n\n- `“See the “`, with no attributes.\n- `“latest”`, with an [doc:\/\/com.apple.foundation\/documentation\/Foundation\/AttributeScopes\/FoundationAttributes\/InlinePresentationIntentAttribute] whose value is [doc:\/\/com.apple.foundation\/documentation\/Foundation\/InlinePresentationIntent\/emphasized].\n- `“ news at “`, with no attributes.\n- `“our website”`, with an [doc:\/\/com.apple.foundation\/documentation\/Foundation\/AttributeScopes\/FoundationAttributes\/LinkAttribute] whose value is a [doc:\/\/com.apple.foundation\/documentation\/Foundation\/URL].\n- `“.”`, with no attributes.\n\nYou can also use custom attributes defined with the [doc:\/\/com.apple.foundation\/documentation\/Foundation\/MarkdownDecodableAttributedStringKey] protocol in the Markdown string. To do this, use Apple’s Markdown extension syntax: `^[text](attribute1: value1, attribute2: value2, …)`.\n\nWhen using attributes beyond those provided by the system, be sure to use initializers that take a `scope` parameter, and provide the scope that defines the custom attributes.\n\n\n\n## Initializing from Markdown Strings\n\n- **init(markdown:options:baseURL:)**: Creates an attributed string from a Markdown-formatted string using the provided options.\n- **init(markdown:including:options:baseURL:)**: Creates an attributed string from a Markdown-formatted string using the provided options and attribute scope.\n- **init(markdown:including:options:baseURL:)**: Creates an attributed string from a Markdown-formatted string using the provided options and attribute scope that a key path identifies.\n\n## Initializing from Markdown Data\n\n- **init(markdown:options:baseURL:)**: Creates an attributed string from Markdown-formatted data using the provided options.\n- **init(markdown:including:options:baseURL:)**: Creates an attributed string from Markdown-formatted data using the provided options and attribute scope.\n- **init(markdown:including:options:baseURL:)**: Creates an attributed string from Markdown-formatted data using the provided options and attribute scope that a key path identifies.\n\n## Initializing with Markdown from URL Contents\n\n- **init(contentsOf:options:baseURL:)**: Creates an attributed string from the contents of a specified URL that contains Markdown-formatted data, using the provided options.\n- **init(contentsOf:including:options:baseURL:)**: Creates an attributed string from the contents of a specified URL that contains Markdown-formatted data, using the provided options and attribute scope.\n- **init(contentsOf:including:options:baseURL:)**: Creates an attributed string from the contents of a specified Markdown URL, using the provided options and attribute scope that a key path identifies.\n\n## Specifying Markdown Parsing Options\n\n- **AttributedString.MarkdownParsingOptions**: Options that affect the parsing of Markdown content into an attributed string.\n\n",
  "sections" : [
    {
      "content" : "",
      "items" : [
        {
          "description" : "Creates an attributed string from a Markdown-formatted string using the provided options.",
          "name" : "init(markdown:options:baseURL:)",
          "url" : "https:\/\/developer.apple.com\/documentation\/Foundation\/AttributedString\/init(markdown:options:baseURL:)-52n3u"
        },
        {
          "description" : "Creates an attributed string from a Markdown-formatted string using the provided options and attribute scope.",
          "name" : "init(markdown:including:options:baseURL:)",
          "url" : "https:\/\/developer.apple.com\/documentation\/Foundation\/AttributedString\/init(markdown:including:options:baseURL:)-4m51b"
        },
        {
          "description" : "Creates an attributed string from a Markdown-formatted string using the provided options and attribute scope that a key path identifies.",
          "name" : "init(markdown:including:options:baseURL:)",
          "url" : "https:\/\/developer.apple.com\/documentation\/Foundation\/AttributedString\/init(markdown:including:options:baseURL:)-89e48"
        }
      ],
      "title" : "Initializing from Markdown Strings"
    },
    {
      "content" : "",
      "items" : [
        {
          "description" : "Creates an attributed string from Markdown-formatted data using the provided options.",
          "name" : "init(markdown:options:baseURL:)",
          "url" : "https:\/\/developer.apple.com\/documentation\/Foundation\/AttributedString\/init(markdown:options:baseURL:)-2sg1o"
        },
        {
          "description" : "Creates an attributed string from Markdown-formatted data using the provided options and attribute scope.",
          "name" : "init(markdown:including:options:baseURL:)",
          "url" : "https:\/\/developer.apple.com\/documentation\/Foundation\/AttributedString\/init(markdown:including:options:baseURL:)-4co46"
        },
        {
          "description" : "Creates an attributed string from Markdown-formatted data using the provided options and attribute scope that a key path identifies.",
          "name" : "init(markdown:including:options:baseURL:)",
          "url" : "https:\/\/developer.apple.com\/documentation\/Foundation\/AttributedString\/init(markdown:including:options:baseURL:)-5nap7"
        }
      ],
      "title" : "Initializing from Markdown Data"
    },
    {
      "content" : "",
      "items" : [
        {
          "description" : "Creates an attributed string from the contents of a specified URL that contains Markdown-formatted data, using the provided options.",
          "name" : "init(contentsOf:options:baseURL:)",
          "url" : "https:\/\/developer.apple.com\/documentation\/Foundation\/AttributedString\/init(contentsOf:options:baseURL:)"
        },
        {
          "description" : "Creates an attributed string from the contents of a specified URL that contains Markdown-formatted data, using the provided options and attribute scope.",
          "name" : "init(contentsOf:including:options:baseURL:)",
          "url" : "https:\/\/developer.apple.com\/documentation\/Foundation\/AttributedString\/init(contentsOf:including:options:baseURL:)-1x6fz"
        },
        {
          "description" : "Creates an attributed string from the contents of a specified Markdown URL, using the provided options and attribute scope that a key path identifies.",
          "name" : "init(contentsOf:including:options:baseURL:)",
          "url" : "https:\/\/developer.apple.com\/documentation\/Foundation\/AttributedString\/init(contentsOf:including:options:baseURL:)-1fcpy"
        }
      ],
      "title" : "Initializing with Markdown from URL Contents"
    },
    {
      "content" : "",
      "items" : [
        {
          "description" : "Options that affect the parsing of Markdown content into an attributed string.",
          "name" : "AttributedString.MarkdownParsingOptions",
          "url" : "https:\/\/developer.apple.com\/documentation\/Foundation\/AttributedString\/MarkdownParsingOptions"
        }
      ],
      "title" : "Specifying Markdown Parsing Options"
    }
  ],
  "source" : "appleJSON",
  "title" : "Instantiating Attributed Strings with Markdown Syntax",
  "url" : "https:\/\/developer.apple.com\/documentation\/Foundation\/instantiating-attributed-strings-with-markdown-syntax"
}