{
  "abstract" : "Encodes a substitute name for the class with a given true name.",
  "codeExamples" : [

  ],
  "contentHash" : "1998f75270c8709bdb0bfaaa870fc48c3bd7c4b1b51111f11c3d079258a27a88",
  "crawledAt" : "2025-12-06T01:27:24Z",
  "declaration" : {
    "code" : "func encodeClassName(_ trueName: String, intoClassName inArchiveName: String)",
    "language" : "swift"
  },
  "id" : "67CDC784-0215-4D17-9FF5-59E033AB4DDB",
  "kind" : "method",
  "language" : "swift",
  "module" : "Foundation",
  "overview" : "## Discussion\n\nAny subsequently encountered objects of class `trueName` are archived as instances of class `inArchiveName`. It is safest not to invoke this method during the archiving process (that is, within an [doc:\/\/com.apple.foundation\/documentation\/Foundation\/NSCoding\/encode(with:)] method). Instead, invoke it before [doc:\/\/com.apple.foundation\/documentation\/Foundation\/NSArchiver\/encodeRootObject(_:)].",
  "platforms" : [
    "Mac Catalyst",
    "macOS"
  ],
  "rawMarkdown" : "---\nsource: https:\/\/developer.apple.com\/documentation\/Foundation\/NSArchiver\/encodeClassName(_:intoClassName:)\ncrawled: 2025-12-06T01:27:24Z\n---\n\n# encodeClassName(_:intoClassName:)\n\n**Instance Method**\n\nEncodes a substitute name for the class with a given true name.\n\n## Declaration\n\n```swift\nfunc encodeClassName(_ trueName: String, intoClassName inArchiveName: String)\n```\n\n## Parameters\n\n- **trueName**: The real name of a class in the object graph being archived.\n- **inArchiveName**: The name of the class to use in the archive in place of `trueName`.\n\n## Discussion\n\nAny subsequently encountered objects of class `trueName` are archived as instances of class `inArchiveName`. It is safest not to invoke this method during the archiving process (that is, within an [doc:\/\/com.apple.foundation\/documentation\/Foundation\/NSCoding\/encode(with:)] method). Instead, invoke it before [doc:\/\/com.apple.foundation\/documentation\/Foundation\/NSArchiver\/encodeRootObject(_:)].\n\n## Substituting classes or objects\n\n- **classNameEncoded(forTrueClassName:)**: Returns the name of the class used to archive instances of the class with a given true name.\n- **replace(_:with:)**: Causes the receiver to treat subsequent requests to encode a given object as though they were requests to encode another given object.\n\n",
  "sections" : [
    {
      "content" : "",
      "items" : [
        {
          "description" : "Returns the name of the class used to archive instances of the class with a given true name.",
          "name" : "classNameEncoded(forTrueClassName:)",
          "url" : "https:\/\/developer.apple.com\/documentation\/Foundation\/NSArchiver\/classNameEncoded(forTrueClassName:)"
        },
        {
          "description" : "Causes the receiver to treat subsequent requests to encode a given object as though they were requests to encode another given object.",
          "name" : "replace(_:with:)",
          "url" : "https:\/\/developer.apple.com\/documentation\/Foundation\/NSArchiver\/replace(_:with:)"
        }
      ],
      "title" : "Substituting classes or objects"
    }
  ],
  "source" : "appleJSON",
  "title" : "encodeClassName(_:intoClassName:)",
  "url" : "https:\/\/developer.apple.com\/documentation\/Foundation\/NSArchiver\/encodeClassName(_:intoClassName:)"
}