{
  "abstract" : "Changes the attributes of a given file or directory.",
  "codeExamples" : [

  ],
  "contentHash" : "a52b2bf5939499ab925afdc6faa2883ea4f7d3deefc170fa96f32286db1cde7f",
  "crawledAt" : "2025-12-06T02:51:45Z",
  "declaration" : {
    "code" : "func changeFileAttributes(_ attributes: [AnyHashable : Any] = [:], atPath path: String) -> Bool",
    "language" : "swift"
  },
  "id" : "A25E097C-7CAE-4E1C-9E34-85076F7F06E9",
  "kind" : "method",
  "language" : "swift",
  "module" : "Foundation",
  "overview" : "## Return Value\n\n[doc:\/\/com.apple.documentation\/documentation\/Swift\/true] if *all* changes succeed. If any change fails, returns [doc:\/\/com.apple.documentation\/documentation\/Swift\/false], but it is undefined whether any changes actually occurred.\n\n## Discussion\n\nAs in the POSIX standard, the app either must own the file or directory or must be running as superuser for attribute changes to take effect. The method attempts to make all changes specified in attributes and ignores any rejection of an attempted modification.\n\nThe `NSFilePosixPermissions` value must be initialized with the code representing the POSIX file-permissions bit pattern. `NSFileHFSCreatorCode` and `NSFileHFSTypeCode` will only be heeded when `path` specifies a file.\n\n### Special Considerations\n\nBecause this method does not return error information, it has been deprecated as of OS X v10.5. Use [doc:\/\/com.apple.foundation\/documentation\/Foundation\/FileManager\/setAttributes(_:ofItemAtPath:)] instead.",
  "platforms" : [
    "tvOS",
    "visionOS",
    "watchOS"
  ],
  "rawMarkdown" : "---\nsource: https:\/\/developer.apple.com\/documentation\/Foundation\/FileManager\/changeFileAttributes(_:atPath:)\ncrawled: 2025-12-06T02:51:45Z\n---\n\n# changeFileAttributes(_:atPath:)\n\n**Instance Method**\n\nChanges the attributes of a given file or directory.\n\n## Declaration\n\n```swift\nfunc changeFileAttributes(_ attributes: [AnyHashable : Any] = [:], atPath path: String) -> Bool\n```\n\n## Parameters\n\n- **attributes**: A dictionary containing as keys the attributes to set for `path` and as values the corresponding value for the attribute. You can set following: `NSFileBusy`, `NSFileCreationDate`, `NSFileExtensionHidden`, `NSFileGroupOwnerAccountID`, `NSFileGroupOwnerAccountName`, `NSFileHFSCreatorCode`, `NSFileHFSTypeCode`, `NSFileImmutable`, `NSFileModificationDate`, `NSFileOwnerAccountID`, `NSFileOwnerAccountName`, `NSFilePosixPermissions`. You can change single attributes or any combination of attributes; you need not specify keys for all attributes.\n\nFor the `NSFilePosixPermissions` value, specify a file mode from the OR’d permission bit masks defined in `sys\/stat.h`. See the man page for the `chmod` function (`man 2 chmod`) for an explanation.\n- **path**: A path to a file or directory.\n\n## Return Value\n\n[doc:\/\/com.apple.documentation\/documentation\/Swift\/true] if *all* changes succeed. If any change fails, returns [doc:\/\/com.apple.documentation\/documentation\/Swift\/false], but it is undefined whether any changes actually occurred.\n\n## Discussion\n\nAs in the POSIX standard, the app either must own the file or directory or must be running as superuser for attribute changes to take effect. The method attempts to make all changes specified in attributes and ignores any rejection of an attempted modification.\n\nThe `NSFilePosixPermissions` value must be initialized with the code representing the POSIX file-permissions bit pattern. `NSFileHFSCreatorCode` and `NSFileHFSTypeCode` will only be heeded when `path` specifies a file.\n\n### Special Considerations\n\nBecause this method does not return error information, it has been deprecated as of OS X v10.5. Use [doc:\/\/com.apple.foundation\/documentation\/Foundation\/FileManager\/setAttributes(_:ofItemAtPath:)] instead.\n\n## Related Documentation\n\n- **attributesOfItem(atPath:)**: Returns the attributes of the item at a given path.\n- **setAttributes(_:ofItemAtPath:)**: Sets the attributes of the specified file or directory.\n\n## Deprecated Methods\n\n- **fileAttributes(atPath:traverseLink:)**: Returns a dictionary that describes the POSIX attributes of the file specified at a given.\n- **fileSystemAttributes(atPath:)**: Returns a dictionary that describes the attributes of the mounted file system on which a given path resides.\n- **directoryContents(atPath:)**: Returns the directories and files (including symbolic links) contained in a given directory.\n- **createDirectory(atPath:attributes:)**: Creates a directory (without contents) at a given path with given attributes.\n- **createSymbolicLink(atPath:pathContent:)**: Creates a symbolic link identified by a given path that refers to a given location.\n- **pathContentOfSymbolicLink(atPath:)**: Returns the path of the directory or file that a symbolic link at a given path refers to.\n- **fileManager(_:shouldProceedAfterError:)**: An `NSFileManager` object sends this message to its handler for each error it encounters when copying, moving, removing, or linking files or directories.\n- **fileManager(_:willProcessPath:)**: An `NSFileManager` object sends this message to a handler immediately before attempting to move, copy, rename, or delete, or before attempting to link to a given path.\n- **replaceItemAtURL(originalItemURL:withItemAtURL:backupItemName:options:)**: Replaces the contents of the item at the specified URL in a manner that ensures no data loss occurs.\n\n",
  "sections" : [
    {
      "content" : "",
      "items" : [
        {
          "description" : "Returns the attributes of the item at a given path.",
          "name" : "attributesOfItem(atPath:)",
          "url" : "https:\/\/developer.apple.com\/documentation\/Foundation\/FileManager\/attributesOfItem(atPath:)"
        },
        {
          "description" : "Sets the attributes of the specified file or directory.",
          "name" : "setAttributes(_:ofItemAtPath:)",
          "url" : "https:\/\/developer.apple.com\/documentation\/Foundation\/FileManager\/setAttributes(_:ofItemAtPath:)"
        }
      ],
      "title" : "Related Documentation"
    },
    {
      "content" : "",
      "items" : [
        {
          "description" : "Returns a dictionary that describes the POSIX attributes of the file specified at a given.",
          "name" : "fileAttributes(atPath:traverseLink:)",
          "url" : "https:\/\/developer.apple.com\/documentation\/Foundation\/FileManager\/fileAttributes(atPath:traverseLink:)"
        },
        {
          "description" : "Returns a dictionary that describes the attributes of the mounted file system on which a given path resides.",
          "name" : "fileSystemAttributes(atPath:)",
          "url" : "https:\/\/developer.apple.com\/documentation\/Foundation\/FileManager\/fileSystemAttributes(atPath:)"
        },
        {
          "description" : "Returns the directories and files (including symbolic links) contained in a given directory.",
          "name" : "directoryContents(atPath:)",
          "url" : "https:\/\/developer.apple.com\/documentation\/Foundation\/FileManager\/directoryContents(atPath:)"
        },
        {
          "description" : "Creates a directory (without contents) at a given path with given attributes.",
          "name" : "createDirectory(atPath:attributes:)",
          "url" : "https:\/\/developer.apple.com\/documentation\/Foundation\/FileManager\/createDirectory(atPath:attributes:)"
        },
        {
          "description" : "Creates a symbolic link identified by a given path that refers to a given location.",
          "name" : "createSymbolicLink(atPath:pathContent:)",
          "url" : "https:\/\/developer.apple.com\/documentation\/Foundation\/FileManager\/createSymbolicLink(atPath:pathContent:)"
        },
        {
          "description" : "Returns the path of the directory or file that a symbolic link at a given path refers to.",
          "name" : "pathContentOfSymbolicLink(atPath:)",
          "url" : "https:\/\/developer.apple.com\/documentation\/Foundation\/FileManager\/pathContentOfSymbolicLink(atPath:)"
        },
        {
          "description" : "An `NSFileManager` object sends this message to its handler for each error it encounters when copying, moving, removing, or linking files or directories.",
          "name" : "fileManager(_:shouldProceedAfterError:)",
          "url" : "https:\/\/developer.apple.com\/documentation\/ObjectiveC\/NSObject-swift.class\/fileManager(_:shouldProceedAfterError:)"
        },
        {
          "description" : "An `NSFileManager` object sends this message to a handler immediately before attempting to move, copy, rename, or delete, or before attempting to link to a given path.",
          "name" : "fileManager(_:willProcessPath:)",
          "url" : "https:\/\/developer.apple.com\/documentation\/ObjectiveC\/NSObject-swift.class\/fileManager(_:willProcessPath:)"
        },
        {
          "description" : "Replaces the contents of the item at the specified URL in a manner that ensures no data loss occurs.",
          "name" : "replaceItemAtURL(originalItemURL:withItemAtURL:backupItemName:options:)",
          "url" : "https:\/\/developer.apple.com\/documentation\/Foundation\/FileManager\/replaceItemAtURL(originalItemURL:withItemAtURL:backupItemName:options:)"
        }
      ],
      "title" : "Deprecated Methods"
    }
  ],
  "source" : "appleJSON",
  "title" : "changeFileAttributes(_:atPath:)",
  "url" : "https:\/\/developer.apple.com\/documentation\/Foundation\/FileManager\/changeFileAttributes(_:atPath:)"
}