{
  "abstract" : "A formatter that creates string representations of quantities of time.",
  "codeExamples" : [

  ],
  "conformsTo" : [
    "CVarArg",
    "CustomDebugStringConvertible",
    "CustomStringConvertible",
    "Equatable",
    "Hashable",
    "NSCoding",
    "NSCopying",
    "NSObjectProtocol",
    "Sendable",
    "SendableMetatype"
  ],
  "contentHash" : "914741c5c07292bc4d8866324d8f64c2c8963d5528d80ebf7c8c6c2392ada512",
  "crawledAt" : "2025-12-01T09:58:49Z",
  "declaration" : {
    "code" : "class DateComponentsFormatter",
    "language" : "swift"
  },
  "id" : "32E9324A-B28B-47BE-B582-2FBCA18D884E",
  "kind" : "class",
  "module" : "Foundation",
  "overview" : "## Overview\n\nAn [doc:\/\/com.apple.foundation\/documentation\/Foundation\/DateComponentsFormatter] object takes quantities of time and formats them as a user-readable string. Use a date components formatter to create strings for your app’s interface. The formatter object has many options for creating both abbreviated and expanded strings. The formatter takes the current user’s locale and language into account when generating strings.\n\nTo use this class, create an instance, configure its properties, and call one of its methods to generate an appropriate string. The properties of this class let you configure the calendar and specify the date and time units you want displayed in the resulting string. The listing below shows how to configure a formatter to create the string “About 5 minutes remaining”.\n\nThe methods of this class may be called safely from any thread of your app. It is also safe to share a single instance of this class from multiple threads, with the caveat that you should not change the configuration of the object while another thread is using it to generate a string.",
  "platforms" : [
    "iOS",
    "iPadOS",
    "Mac Catalyst",
    "macOS",
    "tvOS",
    "visionOS",
    "watchOS"
  ],
  "rawMarkdown" : "---\nsource: https:\/\/developer.apple.com\/documentation\/Foundation\/DateComponentsFormatter\ncrawled: 2025-12-01T09:58:49Z\n---\n\n# DateComponentsFormatter\n\n**Class**\n\nA formatter that creates string representations of quantities of time.\n\n## Declaration\n\n```swift\nclass DateComponentsFormatter\n```\n\n## Overview\n\nAn [doc:\/\/com.apple.foundation\/documentation\/Foundation\/DateComponentsFormatter] object takes quantities of time and formats them as a user-readable string. Use a date components formatter to create strings for your app’s interface. The formatter object has many options for creating both abbreviated and expanded strings. The formatter takes the current user’s locale and language into account when generating strings.\n\nTo use this class, create an instance, configure its properties, and call one of its methods to generate an appropriate string. The properties of this class let you configure the calendar and specify the date and time units you want displayed in the resulting string. The listing below shows how to configure a formatter to create the string “About 5 minutes remaining”.\n\n\n\nThe methods of this class may be called safely from any thread of your app. It is also safe to share a single instance of this class from multiple threads, with the caveat that you should not change the configuration of the object while another thread is using it to generate a string.\n\n\n\n## Formatting Values\n\n- **string(from:)**: Returns a formatted string based on the specified date component information.\n- **string(for:)**: Returns a formatted string based on the date information in the specified object.\n- **string(from:to:)**: Returns a formatted string based on the time difference between two dates.\n- **string(from:)**: Returns a formatted string based on the specified number of seconds.\n- **localizedString(from:unitsStyle:)**: Returns a localized string based on the specified date components and style option.\n\n## Configuring the Formatter Options\n\n- **allowedUnits**: The bitmask of calendrical units such as day and month to include in the output string.\n- **allowsFractionalUnits**: A Boolean indicating whether non-integer units may be used for values.\n- **calendar**: The default calendar to use when formatting date components.\n- **collapsesLargestUnit**: A Boolean value indicating whether to collapse the largest unit into smaller units when a certain threshold is met.\n- **includesApproximationPhrase**: A Boolean value indicating whether the resulting phrase reflects an inexact time value.\n- **includesTimeRemainingPhrase**: A Boolean value indicating whether output strings reflect the amount of time remaining.\n- **maximumUnitCount**: The maximum number of time units to include in the output string.\n- **unitsStyle**: The formatting style for unit names.\n- **zeroFormattingBehavior**: The formatting style for units whose value is 0.\n\n## Constants\n\n- **DateComponentsFormatter.UnitsStyle**: Constants for specifying how to represent quantities of time.\n- **DateComponentsFormatter.ZeroFormattingBehavior**: Formatting constants for when values contain zeroes.\n\n## Instance Properties\n\n- **formattingContext**\n- **referenceDate**\n\n## Instance Methods\n\n- **getObjectValue(_:for:errorDescription:)**\n\n## Dates and times\n\n- **DateFormatter**: A formatter that converts between dates and their textual representations.\n- **RelativeDateTimeFormatter**: A formatter that creates locale-aware string representations of a relative date or time.\n- **DateIntervalFormatter**: A formatter that creates string representations of time intervals.\n- **ISO8601DateFormatter**: A formatter that converts between dates and their ISO 8601 string representations.\n\n## Inherits From\n\n- Formatter\n\n## Conforms To\n\n- CVarArg\n- CustomDebugStringConvertible\n- CustomStringConvertible\n- Equatable\n- Hashable\n- NSCoding\n- NSCopying\n- NSObjectProtocol\n- Sendable\n- SendableMetatype\n\n",
  "sections" : [
    {
      "content" : "",
      "items" : [
        {
          "description" : "Returns a formatted string based on the specified date component information.",
          "name" : "string(from:)",
          "url" : "https:\/\/developer.apple.com\/documentation\/Foundation\/DateComponentsFormatter\/string(from:)-9exxn"
        },
        {
          "description" : "Returns a formatted string based on the date information in the specified object.",
          "name" : "string(for:)",
          "url" : "https:\/\/developer.apple.com\/documentation\/Foundation\/DateComponentsFormatter\/string(for:)"
        },
        {
          "description" : "Returns a formatted string based on the time difference between two dates.",
          "name" : "string(from:to:)",
          "url" : "https:\/\/developer.apple.com\/documentation\/Foundation\/DateComponentsFormatter\/string(from:to:)"
        },
        {
          "description" : "Returns a formatted string based on the specified number of seconds.",
          "name" : "string(from:)",
          "url" : "https:\/\/developer.apple.com\/documentation\/Foundation\/DateComponentsFormatter\/string(from:)-7sj4j"
        },
        {
          "description" : "Returns a localized string based on the specified date components and style option.",
          "name" : "localizedString(from:unitsStyle:)",
          "url" : "https:\/\/developer.apple.com\/documentation\/Foundation\/DateComponentsFormatter\/localizedString(from:unitsStyle:)"
        }
      ],
      "title" : "Formatting Values"
    },
    {
      "content" : "",
      "items" : [
        {
          "description" : "The bitmask of calendrical units such as day and month to include in the output string.",
          "name" : "allowedUnits",
          "url" : "https:\/\/developer.apple.com\/documentation\/Foundation\/DateComponentsFormatter\/allowedUnits"
        },
        {
          "description" : "A Boolean indicating whether non-integer units may be used for values.",
          "name" : "allowsFractionalUnits",
          "url" : "https:\/\/developer.apple.com\/documentation\/Foundation\/DateComponentsFormatter\/allowsFractionalUnits"
        },
        {
          "description" : "The default calendar to use when formatting date components.",
          "name" : "calendar",
          "url" : "https:\/\/developer.apple.com\/documentation\/Foundation\/DateComponentsFormatter\/calendar"
        },
        {
          "description" : "A Boolean value indicating whether to collapse the largest unit into smaller units when a certain threshold is met.",
          "name" : "collapsesLargestUnit",
          "url" : "https:\/\/developer.apple.com\/documentation\/Foundation\/DateComponentsFormatter\/collapsesLargestUnit"
        },
        {
          "description" : "A Boolean value indicating whether the resulting phrase reflects an inexact time value.",
          "name" : "includesApproximationPhrase",
          "url" : "https:\/\/developer.apple.com\/documentation\/Foundation\/DateComponentsFormatter\/includesApproximationPhrase"
        },
        {
          "description" : "A Boolean value indicating whether output strings reflect the amount of time remaining.",
          "name" : "includesTimeRemainingPhrase",
          "url" : "https:\/\/developer.apple.com\/documentation\/Foundation\/DateComponentsFormatter\/includesTimeRemainingPhrase"
        },
        {
          "description" : "The maximum number of time units to include in the output string.",
          "name" : "maximumUnitCount",
          "url" : "https:\/\/developer.apple.com\/documentation\/Foundation\/DateComponentsFormatter\/maximumUnitCount"
        },
        {
          "description" : "The formatting style for unit names.",
          "name" : "unitsStyle",
          "url" : "https:\/\/developer.apple.com\/documentation\/Foundation\/DateComponentsFormatter\/unitsStyle-swift.property"
        },
        {
          "description" : "The formatting style for units whose value is 0.",
          "name" : "zeroFormattingBehavior",
          "url" : "https:\/\/developer.apple.com\/documentation\/Foundation\/DateComponentsFormatter\/zeroFormattingBehavior-swift.property"
        }
      ],
      "title" : "Configuring the Formatter Options"
    },
    {
      "content" : "",
      "items" : [
        {
          "description" : "Constants for specifying how to represent quantities of time.",
          "name" : "DateComponentsFormatter.UnitsStyle",
          "url" : "https:\/\/developer.apple.com\/documentation\/Foundation\/DateComponentsFormatter\/UnitsStyle-swift.enum"
        },
        {
          "description" : "Formatting constants for when values contain zeroes.",
          "name" : "DateComponentsFormatter.ZeroFormattingBehavior",
          "url" : "https:\/\/developer.apple.com\/documentation\/Foundation\/DateComponentsFormatter\/ZeroFormattingBehavior-swift.struct"
        }
      ],
      "title" : "Constants"
    },
    {
      "content" : "",
      "items" : [
        {
          "description" : "",
          "name" : "formattingContext",
          "url" : "https:\/\/developer.apple.com\/documentation\/Foundation\/DateComponentsFormatter\/formattingContext"
        },
        {
          "description" : "",
          "name" : "referenceDate",
          "url" : "https:\/\/developer.apple.com\/documentation\/Foundation\/DateComponentsFormatter\/referenceDate"
        }
      ],
      "title" : "Instance Properties"
    },
    {
      "content" : "",
      "items" : [
        {
          "description" : "",
          "name" : "getObjectValue(_:for:errorDescription:)",
          "url" : "https:\/\/developer.apple.com\/documentation\/Foundation\/DateComponentsFormatter\/getObjectValue(_:for:errorDescription:)"
        }
      ],
      "title" : "Instance Methods"
    },
    {
      "content" : "",
      "items" : [
        {
          "description" : "A formatter that converts between dates and their textual representations.",
          "name" : "DateFormatter",
          "url" : "https:\/\/developer.apple.com\/documentation\/Foundation\/DateFormatter"
        },
        {
          "description" : "A formatter that creates locale-aware string representations of a relative date or time.",
          "name" : "RelativeDateTimeFormatter",
          "url" : "https:\/\/developer.apple.com\/documentation\/Foundation\/RelativeDateTimeFormatter"
        },
        {
          "description" : "A formatter that creates string representations of time intervals.",
          "name" : "DateIntervalFormatter",
          "url" : "https:\/\/developer.apple.com\/documentation\/Foundation\/DateIntervalFormatter"
        },
        {
          "description" : "A formatter that converts between dates and their ISO 8601 string representations.",
          "name" : "ISO8601DateFormatter",
          "url" : "https:\/\/developer.apple.com\/documentation\/Foundation\/ISO8601DateFormatter"
        }
      ],
      "title" : "Dates and times"
    },
    {
      "content" : "",
      "items" : [
        {
          "name" : "Formatter"
        }
      ],
      "title" : "Inherits From"
    }
  ],
  "source" : "appleJSON",
  "title" : "DateComponentsFormatter",
  "url" : "https:\/\/developer.apple.com\/documentation\/Foundation\/DateComponentsFormatter"
}