{
  "abstract" : "A graphics coordinate transformation.",
  "codeExamples" : [

  ],
  "conformsTo" : [
    "CVarArg",
    "Copyable",
    "CustomDebugStringConvertible",
    "CustomStringConvertible",
    "Equatable",
    "Hashable",
    "NSCoding",
    "NSCopying",
    "NSObjectProtocol",
    "NSSecureCoding"
  ],
  "contentHash" : "51c38cfc3ea7c8a9bffeec0d06837616858e46e0521407ea123830be00c29ac9",
  "crawledAt" : "2025-12-03T18:23:32Z",
  "declaration" : {
    "code" : "class NSAffineTransform",
    "language" : "swift"
  },
  "id" : "6CF1634B-8B29-4E89-97EB-EACFA27E5B2D",
  "kind" : "class",
  "language" : "swift",
  "module" : "Foundation",
  "overview" : "## Overview\n\nIn Swift, this object bridges to [doc:\/\/com.apple.foundation\/documentation\/Foundation\/AffineTransform]; use [doc:\/\/com.apple.foundation\/documentation\/Foundation\/NSAffineTransform] when you need reference semantics or other Foundation-specific behavior.\n\nA transformation specifies how points in one coordinate system are transformed to points in another coordinate system. An affine transformation is a special type of transformation that preserves parallel lines in a path but does not necessarily preserve lengths or angles. Scaling, rotation, and translation are the most commonly used manipulations supported by affine transforms, but shearing is also possible.\n\nMethods for applying affine transformations to the current graphics context and a method for applying an affine transformation to an [doc:\/\/com.apple.documentation\/documentation\/AppKit\/NSBezierPath] object are described in NSAffineTransform Additions Reference in the Application Kit.",
  "platforms" : [
    "Mac Catalyst",
    "macOS"
  ],
  "rawMarkdown" : "---\nsource: https:\/\/developer.apple.com\/documentation\/Foundation\/NSAffineTransform\ncrawled: 2025-12-03T18:23:32Z\n---\n\n# NSAffineTransform\n\n**Class**\n\nA graphics coordinate transformation.\n\n## Declaration\n\n```swift\nclass NSAffineTransform\n```\n\n## Overview\n\nIn Swift, this object bridges to [doc:\/\/com.apple.foundation\/documentation\/Foundation\/AffineTransform]; use [doc:\/\/com.apple.foundation\/documentation\/Foundation\/NSAffineTransform] when you need reference semantics or other Foundation-specific behavior.\n\nA transformation specifies how points in one coordinate system are transformed to points in another coordinate system. An affine transformation is a special type of transformation that preserves parallel lines in a path but does not necessarily preserve lengths or angles. Scaling, rotation, and translation are the most commonly used manipulations supported by affine transforms, but shearing is also possible.\n\n\n\nMethods for applying affine transformations to the current graphics context and a method for applying an affine transformation to an [doc:\/\/com.apple.documentation\/documentation\/AppKit\/NSBezierPath] object are described in NSAffineTransform Additions Reference in the Application Kit.\n\n\n\n## Creating an Affine Transform\n\n- **init()**: Initializes an affine transform matrix to the identity matrix.\n- **init(transform:)**: Initializes the receiver’s matrix using another transform object.\n\n## Accumulating Transformations\n\n- **rotate(byDegrees:)**: Applies a rotation factor (measured in degrees) to the receiver’s transformation matrix.\n- **rotate(byRadians:)**: Applies a rotation factor (measured in radians) to the receiver’s transformation matrix.\n- **scale(by:)**: Applies the specified scaling factor along both x and y axes to the receiver’s transformation matrix.\n- **scaleX(by:yBy:)**: Applies scaling factors to each axis of the receiver’s transformation matrix.\n- **translateX(by:yBy:)**: Applies the specified translation factors to the receiver’s transformation matrix.\n- **append(_:)**: Appends the specified matrix to the receiver’s matrix.\n- **prepend(_:)**: Prepends the specified matrix to the receiver’s matrix.\n- **invert()**: Replaces the receiver’s matrix with its inverse matrix.\n\n## Transforming Data and Objects\n\n- **transform(_:)**: Applies the receiver’s transform to the specified point and returns the result.\n- **transform(_:)**: Applies the receiver’s transform to the specified size and returns the results.\n- **transform(_:)**: Creates and returns a new Bézier path object with each point in the given path transformed by the receiver.\n\n## Accessing the Transformation Matrix\n\n- **transformStruct**: The matrix coefficients stored as the transformation matrix.\n- **NSAffineTransformStruct**: A structure that defines the three-by-three matrix that performs an affine transform between two coordinate systems.\n\n## Setting and Building the Current Transformation Matrix\n\n- **set()**: Sets the current transformation matrix to the receiver’s transformation matrix.\n- **concat()**: Appends the receiver’s matrix to the current transformation matrix stored in the current graphics context, replacing the current transformation matrix with the result.\n\n## Inherits From\n\n- NSObject\n\n## Conforms To\n\n- CVarArg\n- Copyable\n- CustomDebugStringConvertible\n- CustomStringConvertible\n- Equatable\n- Hashable\n- NSCoding\n- NSCopying\n- NSObjectProtocol\n- NSSecureCoding\n\n",
  "sections" : [
    {
      "content" : "",
      "items" : [
        {
          "description" : "Initializes an affine transform matrix to the identity matrix.",
          "name" : "init()",
          "url" : "https:\/\/developer.apple.com\/documentation\/Foundation\/NSAffineTransform\/init()"
        },
        {
          "description" : "Initializes the receiver’s matrix using another transform object.",
          "name" : "init(transform:)",
          "url" : "https:\/\/developer.apple.com\/documentation\/Foundation\/NSAffineTransform\/init(transform:)"
        }
      ],
      "title" : "Creating an Affine Transform"
    },
    {
      "content" : "",
      "items" : [
        {
          "description" : "Applies a rotation factor (measured in degrees) to the receiver’s transformation matrix.",
          "name" : "rotate(byDegrees:)",
          "url" : "https:\/\/developer.apple.com\/documentation\/Foundation\/NSAffineTransform\/rotate(byDegrees:)"
        },
        {
          "description" : "Applies a rotation factor (measured in radians) to the receiver’s transformation matrix.",
          "name" : "rotate(byRadians:)",
          "url" : "https:\/\/developer.apple.com\/documentation\/Foundation\/NSAffineTransform\/rotate(byRadians:)"
        },
        {
          "description" : "Applies the specified scaling factor along both x and y axes to the receiver’s transformation matrix.",
          "name" : "scale(by:)",
          "url" : "https:\/\/developer.apple.com\/documentation\/Foundation\/NSAffineTransform\/scale(by:)"
        },
        {
          "description" : "Applies scaling factors to each axis of the receiver’s transformation matrix.",
          "name" : "scaleX(by:yBy:)",
          "url" : "https:\/\/developer.apple.com\/documentation\/Foundation\/NSAffineTransform\/scaleX(by:yBy:)"
        },
        {
          "description" : "Applies the specified translation factors to the receiver’s transformation matrix.",
          "name" : "translateX(by:yBy:)",
          "url" : "https:\/\/developer.apple.com\/documentation\/Foundation\/NSAffineTransform\/translateX(by:yBy:)"
        },
        {
          "description" : "Appends the specified matrix to the receiver’s matrix.",
          "name" : "append(_:)",
          "url" : "https:\/\/developer.apple.com\/documentation\/Foundation\/NSAffineTransform\/append(_:)"
        },
        {
          "description" : "Prepends the specified matrix to the receiver’s matrix.",
          "name" : "prepend(_:)",
          "url" : "https:\/\/developer.apple.com\/documentation\/Foundation\/NSAffineTransform\/prepend(_:)"
        },
        {
          "description" : "Replaces the receiver’s matrix with its inverse matrix.",
          "name" : "invert()",
          "url" : "https:\/\/developer.apple.com\/documentation\/Foundation\/NSAffineTransform\/invert()"
        }
      ],
      "title" : "Accumulating Transformations"
    },
    {
      "content" : "",
      "items" : [
        {
          "description" : "Applies the receiver’s transform to the specified point and returns the result.",
          "name" : "transform(_:)",
          "url" : "https:\/\/developer.apple.com\/documentation\/Foundation\/NSAffineTransform\/transform(_:)-41p16"
        },
        {
          "description" : "Applies the receiver’s transform to the specified size and returns the results.",
          "name" : "transform(_:)",
          "url" : "https:\/\/developer.apple.com\/documentation\/Foundation\/NSAffineTransform\/transform(_:)-5r6ol"
        },
        {
          "description" : "Creates and returns a new Bézier path object with each point in the given path transformed by the receiver.",
          "name" : "transform(_:)",
          "url" : "https:\/\/developer.apple.com\/documentation\/Foundation\/NSAffineTransform\/transform(_:)-6z1xo"
        }
      ],
      "title" : "Transforming Data and Objects"
    },
    {
      "content" : "",
      "items" : [
        {
          "description" : "The matrix coefficients stored as the transformation matrix.",
          "name" : "transformStruct",
          "url" : "https:\/\/developer.apple.com\/documentation\/Foundation\/NSAffineTransform\/transformStruct"
        },
        {
          "description" : "A structure that defines the three-by-three matrix that performs an affine transform between two coordinate systems.",
          "name" : "NSAffineTransformStruct",
          "url" : "https:\/\/developer.apple.com\/documentation\/Foundation\/NSAffineTransformStruct"
        }
      ],
      "title" : "Accessing the Transformation Matrix"
    },
    {
      "content" : "",
      "items" : [
        {
          "description" : "Sets the current transformation matrix to the receiver’s transformation matrix.",
          "name" : "set()",
          "url" : "https:\/\/developer.apple.com\/documentation\/Foundation\/NSAffineTransform\/set()"
        },
        {
          "description" : "Appends the receiver’s matrix to the current transformation matrix stored in the current graphics context, replacing the current transformation matrix with the result.",
          "name" : "concat()",
          "url" : "https:\/\/developer.apple.com\/documentation\/Foundation\/NSAffineTransform\/concat()"
        }
      ],
      "title" : "Setting and Building the Current Transformation Matrix"
    },
    {
      "content" : "",
      "items" : [
        {
          "name" : "NSObject"
        }
      ],
      "title" : "Inherits From"
    }
  ],
  "source" : "appleJSON",
  "title" : "NSAffineTransform",
  "url" : "https:\/\/developer.apple.com\/documentation\/Foundation\/NSAffineTransform"
}