{
  "abstract" : "A unit of measure for concentration of mass.",
  "codeExamples" : [

  ],
  "conformsTo" : [
    "CVarArg",
    "CustomDebugStringConvertible",
    "CustomStringConvertible",
    "Equatable",
    "Hashable",
    "NSCoding",
    "NSCopying",
    "NSObjectProtocol",
    "NSSecureCoding",
    "Sendable",
    "SendableMetatype"
  ],
  "contentHash" : "877f0be23075e2d03b5e06ac20f5ca48aea48e2222383cd7264189a7b35f72ee",
  "crawledAt" : "2025-12-03T07:36:38Z",
  "declaration" : {
    "code" : "class UnitConcentrationMass",
    "language" : "swift"
  },
  "id" : "2C32CDB3-C77A-40DD-938A-FE5E913E160A",
  "kind" : "class",
  "language" : "swift",
  "module" : "Foundation",
  "overview" : "## Overview\n\nYou typically use instances of [doc:\/\/com.apple.foundation\/documentation\/Foundation\/UnitConcentrationMass] to represent specific quantities of concentration using the [doc:\/\/com.apple.foundation\/documentation\/Foundation\/NSMeasurement] class.\n\n### Concentration of Mass\n\nConcentration is the abundance of a constituent within a volume. Concentration can be expressed by SI derived units in terms of kilograms per cubic meter (kg\/m3).\n\nThe [doc:\/\/com.apple.foundation\/documentation\/Foundation\/UnitConcentrationMass] class defines its [doc:\/\/com.apple.foundation\/documentation\/Foundation\/Dimension\/baseUnit()] as [doc:\/\/com.apple.foundation\/documentation\/Foundation\/UnitConcentrationMass\/gramsPerLiter], and provides the following units, which are initialized using [doc:\/\/com.apple.foundation\/documentation\/Foundation\/UnitConverterLinear] converters with the specified coefficients:",
  "platforms" : [
    "iOS",
    "iPadOS",
    "Mac Catalyst",
    "macOS",
    "tvOS",
    "visionOS",
    "watchOS"
  ],
  "rawMarkdown" : "---\nsource: https:\/\/developer.apple.com\/documentation\/Foundation\/UnitConcentrationMass\ncrawled: 2025-12-03T07:36:38Z\n---\n\n# UnitConcentrationMass\n\n**Class**\n\nA unit of measure for concentration of mass.\n\n## Declaration\n\n```swift\nclass UnitConcentrationMass\n```\n\n## Overview\n\nYou typically use instances of [doc:\/\/com.apple.foundation\/documentation\/Foundation\/UnitConcentrationMass] to represent specific quantities of concentration using the [doc:\/\/com.apple.foundation\/documentation\/Foundation\/NSMeasurement] class.\n\n### Concentration of Mass\n\nConcentration is the abundance of a constituent within a volume. Concentration can be expressed by SI derived units in terms of kilograms per cubic meter (kg\/m3).\n\nThe [doc:\/\/com.apple.foundation\/documentation\/Foundation\/UnitConcentrationMass] class defines its [doc:\/\/com.apple.foundation\/documentation\/Foundation\/Dimension\/baseUnit()] as [doc:\/\/com.apple.foundation\/documentation\/Foundation\/UnitConcentrationMass\/gramsPerLiter], and provides the following units, which are initialized using [doc:\/\/com.apple.foundation\/documentation\/Foundation\/UnitConverterLinear] converters with the specified coefficients:\n\n\n\n## Accessing the Base Unit\n\n- **baseUnit()**: Returns the base unit.\n\n## Accessing Predefined Units\n\n- **gramsPerLiter**: The grams per liter unit of concentration.\n- **milligramsPerDeciliter**: The milligrams per deciliter unit of concentration.\n- **millimolesPerLiter(withGramsPerMole:)**: Returns the millimoles per liter unit with the specified number of grams per mole.\n\n## Concentration and Dispersion\n\n- **UnitDispersion**: A unit of measure for specific quantities of dispersion.\n\n## Inherits From\n\n- Dimension\n\n## Conforms To\n\n- CVarArg\n- CustomDebugStringConvertible\n- CustomStringConvertible\n- Equatable\n- Hashable\n- NSCoding\n- NSCopying\n- NSObjectProtocol\n- NSSecureCoding\n- Sendable\n- SendableMetatype\n\n",
  "sections" : [
    {
      "content" : "",
      "items" : [
        {
          "description" : "Returns the base unit.",
          "name" : "baseUnit()",
          "url" : "https:\/\/developer.apple.com\/documentation\/Foundation\/Dimension\/baseUnit()"
        }
      ],
      "title" : "Accessing the Base Unit"
    },
    {
      "content" : "",
      "items" : [
        {
          "description" : "The grams per liter unit of concentration.",
          "name" : "gramsPerLiter",
          "url" : "https:\/\/developer.apple.com\/documentation\/Foundation\/UnitConcentrationMass\/gramsPerLiter"
        },
        {
          "description" : "The milligrams per deciliter unit of concentration.",
          "name" : "milligramsPerDeciliter",
          "url" : "https:\/\/developer.apple.com\/documentation\/Foundation\/UnitConcentrationMass\/milligramsPerDeciliter"
        },
        {
          "description" : "Returns the millimoles per liter unit with the specified number of grams per mole.",
          "name" : "millimolesPerLiter(withGramsPerMole:)",
          "url" : "https:\/\/developer.apple.com\/documentation\/Foundation\/UnitConcentrationMass\/millimolesPerLiter(withGramsPerMole:)"
        }
      ],
      "title" : "Accessing Predefined Units"
    },
    {
      "content" : "",
      "items" : [
        {
          "description" : "A unit of measure for specific quantities of dispersion.",
          "name" : "UnitDispersion",
          "url" : "https:\/\/developer.apple.com\/documentation\/Foundation\/UnitDispersion"
        }
      ],
      "title" : "Concentration and Dispersion"
    },
    {
      "content" : "",
      "items" : [
        {
          "name" : "Dimension"
        }
      ],
      "title" : "Inherits From"
    }
  ],
  "source" : "appleJSON",
  "title" : "UnitConcentrationMass",
  "url" : "https:\/\/developer.apple.com\/documentation\/Foundation\/UnitConcentrationMass"
}