{
  "abstract" : "Inserts an array of child nodes at a specified location in the receiver’s list of children.",
  "codeExamples" : [

  ],
  "contentHash" : "b2d5d558941faefda318b89ff048934935eed70ce7d6251094f282054dc76fa0",
  "crawledAt" : "2025-12-05T05:52:51Z",
  "declaration" : {
    "code" : "func insertChildren(_ children: [XMLNode], at index: Int)",
    "language" : "swift"
  },
  "id" : "0DA9D566-D33C-4943-93F1-5B5714973A72",
  "kind" : "method",
  "language" : "swift",
  "module" : "Foundation",
  "overview" : "## Discussion\n\nInsertion of the node increases the indexes of sibling nodes after it by the count of `children`.",
  "platforms" : [
    "Mac Catalyst",
    "macOS"
  ],
  "rawMarkdown" : "---\nsource: https:\/\/developer.apple.com\/documentation\/Foundation\/XMLElement\/insertChildren(_:at:)\ncrawled: 2025-12-05T05:52:51Z\n---\n\n# insertChildren(_:at:)\n\n**Instance Method**\n\nInserts an array of child nodes at a specified location in the receiver’s list of children.\n\n## Declaration\n\n```swift\nfunc insertChildren(_ children: [XMLNode], at index: Int)\n```\n\n## Parameters\n\n- **children**: An array of XML node objects to add as children of the receiver.\n- **index**: An integer identifying a position in the receiver’s list of children. An exception is raised if `index` is out of bounds.\n\n## Discussion\n\nInsertion of the node increases the indexes of sibling nodes after it by the count of `children`.\n\n## Manipulating Child Elements\n\n- **addChild(_:)**: Adds a child node at the end of the receiver’s current list of children.\n- **insertChild(_:at:)**: Inserts a new child node at a specified location in the receiver’s list of child nodes.\n- **removeChild(at:)**: Removes the child node of the receiver identified by a given index.\n- **replaceChild(at:with:)**: Replaces a child node at a specified location with another child node.\n- **setChildren(_:)**: Sets all child nodes of the receiver at once, replacing any existing children.\n- **normalizeAdjacentTextNodesPreservingCDATA(_:)**: Coalesces adjacent text nodes of the receiver that you have explicitly added, optionally including CDATA sections.\n\n",
  "sections" : [
    {
      "content" : "",
      "items" : [
        {
          "description" : "Adds a child node at the end of the receiver’s current list of children.",
          "name" : "addChild(_:)",
          "url" : "https:\/\/developer.apple.com\/documentation\/Foundation\/XMLElement\/addChild(_:)"
        },
        {
          "description" : "Inserts a new child node at a specified location in the receiver’s list of child nodes.",
          "name" : "insertChild(_:at:)",
          "url" : "https:\/\/developer.apple.com\/documentation\/Foundation\/XMLElement\/insertChild(_:at:)"
        },
        {
          "description" : "Removes the child node of the receiver identified by a given index.",
          "name" : "removeChild(at:)",
          "url" : "https:\/\/developer.apple.com\/documentation\/Foundation\/XMLElement\/removeChild(at:)"
        },
        {
          "description" : "Replaces a child node at a specified location with another child node.",
          "name" : "replaceChild(at:with:)",
          "url" : "https:\/\/developer.apple.com\/documentation\/Foundation\/XMLElement\/replaceChild(at:with:)"
        },
        {
          "description" : "Sets all child nodes of the receiver at once, replacing any existing children.",
          "name" : "setChildren(_:)",
          "url" : "https:\/\/developer.apple.com\/documentation\/Foundation\/XMLElement\/setChildren(_:)"
        },
        {
          "description" : "Coalesces adjacent text nodes of the receiver that you have explicitly added, optionally including CDATA sections.",
          "name" : "normalizeAdjacentTextNodesPreservingCDATA(_:)",
          "url" : "https:\/\/developer.apple.com\/documentation\/Foundation\/XMLElement\/normalizeAdjacentTextNodesPreservingCDATA(_:)"
        }
      ],
      "title" : "Manipulating Child Elements"
    }
  ],
  "source" : "appleJSON",
  "title" : "insertChildren(_:at:)",
  "url" : "https:\/\/developer.apple.com\/documentation\/Foundation\/XMLElement\/insertChildren(_:at:)"
}