{
  "abstract" : "Returns a dictionary representing a TXT record given as an `NSData` object.",
  "codeExamples" : [

  ],
  "contentHash" : "f0f43fd7daacc08321ffdd3cc888ab70bb758e47467ed36111680685dd7fd987",
  "crawledAt" : "2025-12-06T03:19:22Z",
  "declaration" : {
    "code" : "class func dictionary(fromTXTRecord txtData: Data) -> [String : Data]",
    "language" : "swift"
  },
  "id" : "23A6D639-E17A-499D-93B4-D48BD12574E4",
  "kind" : "method",
  "language" : "swift",
  "module" : "Foundation",
  "overview" : "## Return Value\n\nA dictionary representing `txtData`. The dictionary’s keys are `NSString` objects using UTF8 encoding. The values associated with all the dictionary’s keys are `NSData` objects that encapsulate strings or data. Fails an assertion if `txtData` cannot be represented as an `NSDictionary` object.",
  "platforms" : [
    "iOS",
    "iPadOS",
    "Mac Catalyst",
    "macOS",
    "tvOS",
    "visionOS"
  ],
  "rawMarkdown" : "---\nsource: https:\/\/developer.apple.com\/documentation\/Foundation\/NetService\/dictionary(fromTXTRecord:)\ncrawled: 2025-12-06T03:19:22Z\n---\n\n# dictionary(fromTXTRecord:)\n\n**Type Method**\n\nReturns a dictionary representing a TXT record given as an `NSData` object.\n\n## Declaration\n\n```swift\nclass func dictionary(fromTXTRecord txtData: Data) -> [String : Data]\n```\n\n## Parameters\n\n- **txtData**: A data object encoding a TXT record.\n\n## Return Value\n\nA dictionary representing `txtData`. The dictionary’s keys are `NSString` objects using UTF8 encoding. The values associated with all the dictionary’s keys are `NSData` objects that encapsulate strings or data. Fails an assertion if `txtData` cannot be represented as an `NSDictionary` object.\n\n## Configuring Network Services\n\n- **data(fromTXTRecord:)**: Returns an `NSData` object representing a TXT record formed from a given dictionary.\n- **addresses**: A read-only array containing `NSData` objects, each of which contains a socket address for the service.\n- **domain**: A string containing the domain for this service.\n- **includesPeerToPeer**: Specifies whether to also publish, resolve, or monitor this service over peer-to-peer Bluetooth and Wi-Fi, if available.\n- **getInputStream(_:outputStream:)**: Creates a pair of input and output streams for the receiver and returns a Boolean value that indicates whether they were retrieved successfully.\n- **name**: A string containing the name of this service.\n- **type**: The type of the published service.\n- **txtRecordData()**: Returns the TXT record for the receiver.\n- **setTXTRecord(_:)**: Sets the TXT record for the receiver, and returns a Boolean value that indicates whether the operation was successful.\n- **delegate**: The delegate for the receiver.\n\n",
  "sections" : [
    {
      "content" : "",
      "items" : [
        {
          "description" : "Returns an `NSData` object representing a TXT record formed from a given dictionary.",
          "name" : "data(fromTXTRecord:)",
          "url" : "https:\/\/developer.apple.com\/documentation\/Foundation\/NetService\/data(fromTXTRecord:)"
        },
        {
          "description" : "A read-only array containing `NSData` objects, each of which contains a socket address for the service.",
          "name" : "addresses",
          "url" : "https:\/\/developer.apple.com\/documentation\/Foundation\/NetService\/addresses"
        },
        {
          "description" : "A string containing the domain for this service.",
          "name" : "domain",
          "url" : "https:\/\/developer.apple.com\/documentation\/Foundation\/NetService\/domain"
        },
        {
          "description" : "Specifies whether to also publish, resolve, or monitor this service over peer-to-peer Bluetooth and Wi-Fi, if available.",
          "name" : "includesPeerToPeer",
          "url" : "https:\/\/developer.apple.com\/documentation\/Foundation\/NetService\/includesPeerToPeer"
        },
        {
          "description" : "Creates a pair of input and output streams for the receiver and returns a Boolean value that indicates whether they were retrieved successfully.",
          "name" : "getInputStream(_:outputStream:)",
          "url" : "https:\/\/developer.apple.com\/documentation\/Foundation\/NetService\/getInputStream(_:outputStream:)"
        },
        {
          "description" : "A string containing the name of this service.",
          "name" : "name",
          "url" : "https:\/\/developer.apple.com\/documentation\/Foundation\/NetService\/name"
        },
        {
          "description" : "The type of the published service.",
          "name" : "type",
          "url" : "https:\/\/developer.apple.com\/documentation\/Foundation\/NetService\/type"
        },
        {
          "description" : "Returns the TXT record for the receiver.",
          "name" : "txtRecordData()",
          "url" : "https:\/\/developer.apple.com\/documentation\/Foundation\/NetService\/txtRecordData()"
        },
        {
          "description" : "Sets the TXT record for the receiver, and returns a Boolean value that indicates whether the operation was successful.",
          "name" : "setTXTRecord(_:)",
          "url" : "https:\/\/developer.apple.com\/documentation\/Foundation\/NetService\/setTXTRecord(_:)"
        },
        {
          "description" : "The delegate for the receiver.",
          "name" : "delegate",
          "url" : "https:\/\/developer.apple.com\/documentation\/Foundation\/NetService\/delegate"
        }
      ],
      "title" : "Configuring Network Services"
    }
  ],
  "source" : "appleJSON",
  "title" : "dictionary(fromTXTRecord:)",
  "url" : "https:\/\/developer.apple.com\/documentation\/Foundation\/NetService\/dictionary(fromTXTRecord:)"
}