{
  "abstract" : "Sent to determine whether the URL loader should consult the credential storage to authenticate the download.",
  "codeExamples" : [

  ],
  "contentHash" : "fbe85d409cc452cc36679e9346fb469d81d3706381011904c0544b3c1abc22da",
  "crawledAt" : "2025-12-08T00:32:01Z",
  "declaration" : {
    "code" : "optional func downloadShouldUseCredentialStorage(_ download: NSURLDownload) -> Bool",
    "language" : "swift"
  },
  "id" : "F03F5550-26A0-4C4A-9888-81C0724879AB",
  "kind" : "method",
  "language" : "swift",
  "module" : "Foundation",
  "overview" : "## Discussion\n\nThis method is called before any attempt to authenticate is made.  By returning [doc:\/\/com.apple.documentation\/documentation\/Swift\/false], the delegate tells the download not to consult the credential storage and makes itself responsible for providing credentials for any authentication challenges.  Not implementing this method is the same as returing [doc:\/\/com.apple.documentation\/documentation\/Swift\/true]. The delegate is free to consult the credential storage itself when it receives a [doc:\/\/com.apple.foundation\/documentation\/Foundation\/NSURLDownloadDelegate\/download(_:didReceive:)-1pc0v] message.",
  "platforms" : [
    "macOS"
  ],
  "rawMarkdown" : "---\nsource: https:\/\/developer.apple.com\/documentation\/Foundation\/NSURLDownloadDelegate\/downloadShouldUseCredentialStorage(_:)\ncrawled: 2025-12-08T00:32:01Z\n---\n\n# downloadShouldUseCredentialStorage(_:)\n\n**Instance Method**\n\nSent to determine whether the URL loader should consult the credential storage to authenticate the download.\n\n## Declaration\n\n```swift\noptional func downloadShouldUseCredentialStorage(_ download: NSURLDownload) -> Bool\n```\n\n## Parameters\n\n- **download**: The connection sending the message.\n\n## Discussion\n\nThis method is called before any attempt to authenticate is made.  By returning [doc:\/\/com.apple.documentation\/documentation\/Swift\/false], the delegate tells the download not to consult the credential storage and makes itself responsible for providing credentials for any authentication challenges.  Not implementing this method is the same as returing [doc:\/\/com.apple.documentation\/documentation\/Swift\/true]. The delegate is free to consult the credential storage itself when it receives a [doc:\/\/com.apple.foundation\/documentation\/Foundation\/NSURLDownloadDelegate\/download(_:didReceive:)-1pc0v] message.\n\n## Download Authentication\n\n- **download(_:canAuthenticateAgainstProtectionSpace:)**: Sent to determine whether the delegate is able to respond to a protection space’s form of authentication.\n- **download(_:didCancel:)**: Sent if an authentication challenge is canceled due to the protocol implementation encountering an error.\n- **download(_:didReceive:)**: Sent when the URL download must authenticate a challenge in order to download the request.\n\n",
  "sections" : [
    {
      "content" : "",
      "items" : [
        {
          "description" : "Sent to determine whether the delegate is able to respond to a protection space’s form of authentication.",
          "name" : "download(_:canAuthenticateAgainstProtectionSpace:)",
          "url" : "https:\/\/developer.apple.com\/documentation\/Foundation\/NSURLDownloadDelegate\/download(_:canAuthenticateAgainstProtectionSpace:)"
        },
        {
          "description" : "Sent if an authentication challenge is canceled due to the protocol implementation encountering an error.",
          "name" : "download(_:didCancel:)",
          "url" : "https:\/\/developer.apple.com\/documentation\/Foundation\/NSURLDownloadDelegate\/download(_:didCancel:)"
        },
        {
          "description" : "Sent when the URL download must authenticate a challenge in order to download the request.",
          "name" : "download(_:didReceive:)",
          "url" : "https:\/\/developer.apple.com\/documentation\/Foundation\/NSURLDownloadDelegate\/download(_:didReceive:)-1pc0v"
        }
      ],
      "title" : "Download Authentication"
    }
  ],
  "source" : "appleJSON",
  "title" : "downloadShouldUseCredentialStorage(_:)",
  "url" : "https:\/\/developer.apple.com\/documentation\/Foundation\/NSURLDownloadDelegate\/downloadShouldUseCredentialStorage(_:)"
}