{
  "abstract" : "Returns the name of the class used when instantiating objects whose ostensible class, according to the archived data, is a given name.",
  "codeExamples" : [

  ],
  "contentHash" : "53606612740f2025bdc9a58831789604a5e0fc9232a447b01faf103e6a0c97b8",
  "crawledAt" : "2025-12-06T01:27:32Z",
  "declaration" : {
    "code" : "class func classNameDecoded(forArchiveClassName inArchiveName: String) -> String",
    "language" : "swift"
  },
  "id" : "2B4F6E48-4FE7-4BD9-A6DF-578558482F2A",
  "kind" : "method",
  "language" : "swift",
  "module" : "Foundation",
  "overview" : "## Return Value\n\nThe name of the class used when instantiating objects whose ostensible class, according to the archived data, is `nameInArchive`. Returns `nameInArchive` if no substitute name has been specified using the class method (not the instance method) [doc:\/\/com.apple.foundation\/documentation\/Foundation\/NSUnarchiver\/decodeClassName(_:asClassName:)-swift.type.method].\n\n## Discussion\n\nNote that each individual instance of `NSUnarchiver` can be given its own class name mappings by invoking the instance method [doc:\/\/com.apple.foundation\/documentation\/Foundation\/NSUnarchiver\/decodeClassName(_:asClassName:)-swift.method]. The `NSUnarchiver` class has no information about these instance-specific mappings, however, so they don’t affect the return value of [doc:\/\/com.apple.foundation\/documentation\/Foundation\/NSUnarchiver\/classNameDecoded(forArchiveClassName:)-swift.type.method].",
  "platforms" : [
    "Mac Catalyst",
    "macOS"
  ],
  "rawMarkdown" : "---\nsource: https:\/\/developer.apple.com\/documentation\/Foundation\/NSUnarchiver\/classNameDecoded(forArchiveClassName:)-swift.type.method\ncrawled: 2025-12-06T01:27:32Z\n---\n\n# classNameDecoded(forArchiveClassName:)\n\n**Type Method**\n\nReturns the name of the class used when instantiating objects whose ostensible class, according to the archived data, is a given name.\n\n## Declaration\n\n```swift\nclass func classNameDecoded(forArchiveClassName inArchiveName: String) -> String\n```\n\n## Parameters\n\n- **inArchiveName**: The name of a class.\n\n## Return Value\n\nThe name of the class used when instantiating objects whose ostensible class, according to the archived data, is `nameInArchive`. Returns `nameInArchive` if no substitute name has been specified using the class method (not the instance method) [doc:\/\/com.apple.foundation\/documentation\/Foundation\/NSUnarchiver\/decodeClassName(_:asClassName:)-swift.type.method].\n\n## Discussion\n\nNote that each individual instance of `NSUnarchiver` can be given its own class name mappings by invoking the instance method [doc:\/\/com.apple.foundation\/documentation\/Foundation\/NSUnarchiver\/decodeClassName(_:asClassName:)-swift.method]. The `NSUnarchiver` class has no information about these instance-specific mappings, however, so they don’t affect the return value of [doc:\/\/com.apple.foundation\/documentation\/Foundation\/NSUnarchiver\/classNameDecoded(forArchiveClassName:)-swift.type.method].\n\n## Substituting classes or objects\n\n- **decodeClassName(_:asClassName:)**: Instructs instances of `NSUnarchiver` to use the class with a given name when instantiating objects whose ostensible class, according to the archived data, is another given name.\n- **classNameDecoded(forArchiveClassName:)**: Returns the name of the class that will be used when instantiating objects whose ostensible class, according to the archived data, is a given name.\n- **decodeClassName(_:asClassName:)**: Instructs the receiver to use the class with a given name when instantiating objects whose ostensible class, according to the archived data, is another given name.\n- **replace(_:with:)**: Causes the receiver to substitute one given object for another whenever the latter is extracted from the archive.\n\n",
  "sections" : [
    {
      "content" : "",
      "items" : [
        {
          "description" : "Instructs instances of `NSUnarchiver` to use the class with a given name when instantiating objects whose ostensible class, according to the archived data, is another given name.",
          "name" : "decodeClassName(_:asClassName:)",
          "url" : "https:\/\/developer.apple.com\/documentation\/Foundation\/NSUnarchiver\/decodeClassName(_:asClassName:)-swift.type.method"
        },
        {
          "description" : "Returns the name of the class that will be used when instantiating objects whose ostensible class, according to the archived data, is a given name.",
          "name" : "classNameDecoded(forArchiveClassName:)",
          "url" : "https:\/\/developer.apple.com\/documentation\/Foundation\/NSUnarchiver\/classNameDecoded(forArchiveClassName:)-swift.method"
        },
        {
          "description" : "Instructs the receiver to use the class with a given name when instantiating objects whose ostensible class, according to the archived data, is another given name.",
          "name" : "decodeClassName(_:asClassName:)",
          "url" : "https:\/\/developer.apple.com\/documentation\/Foundation\/NSUnarchiver\/decodeClassName(_:asClassName:)-swift.method"
        },
        {
          "description" : "Causes the receiver to substitute one given object for another whenever the latter is extracted from the archive.",
          "name" : "replace(_:with:)",
          "url" : "https:\/\/developer.apple.com\/documentation\/Foundation\/NSUnarchiver\/replace(_:with:)"
        }
      ],
      "title" : "Substituting classes or objects"
    }
  ],
  "source" : "appleJSON",
  "title" : "classNameDecoded(forArchiveClassName:)",
  "url" : "https:\/\/developer.apple.com\/documentation\/Foundation\/NSUnarchiver\/classNameDecoded(forArchiveClassName:)-swift.type.method"
}