{
  "abstract" : "The manager of a shared credentials cache.",
  "codeExamples" : [

  ],
  "conformsTo" : [
    "CVarArg",
    "CustomDebugStringConvertible",
    "CustomStringConvertible",
    "Equatable",
    "Hashable",
    "NSObjectProtocol",
    "Sendable",
    "SendableMetatype"
  ],
  "contentHash" : "b210f0cc60108caf969e1cca4b4a93756fc85afc5f5c785d489d7589112ab0be",
  "crawledAt" : "2025-12-04T17:55:56Z",
  "declaration" : {
    "code" : "class URLCredentialStorage",
    "language" : "swift"
  },
  "id" : "11A49A16-C727-4821-ADC9-60BB740E300E",
  "kind" : "class",
  "language" : "swift",
  "module" : "Foundation",
  "overview" : "## Overview\n\nThe shared cache stores and retrieves instances of [doc:\/\/com.apple.foundation\/documentation\/Foundation\/URLCredential]. You can store password-based credentials permanently, based on the [doc:\/\/com.apple.foundation\/documentation\/Foundation\/URLCredential\/Persistence-swift.enum] they were created with. Certificate-based credentials are never stored permanently.\n\n### Subclassing notes\n\nThe [doc:\/\/com.apple.foundation\/documentation\/Foundation\/URLCredentialStorage] class is meant to be used as-is, but you can subclass it if you have specific needs, such as screening which credentials are stored.\n\nWhen overriding methods of this class, be aware that methods that take a `task` parameter are preferred to equivalent methods that do not. Therefore, you should override the task-based methods when subclassing, as follows:",
  "platforms" : [
    "iOS",
    "iPadOS",
    "Mac Catalyst",
    "macOS",
    "tvOS",
    "visionOS",
    "watchOS"
  ],
  "rawMarkdown" : "---\nsource: https:\/\/developer.apple.com\/documentation\/Foundation\/URLCredentialStorage\ncrawled: 2025-12-04T17:55:56Z\n---\n\n# URLCredentialStorage\n\n**Class**\n\nThe manager of a shared credentials cache.\n\n## Declaration\n\n```swift\nclass URLCredentialStorage\n```\n\n## Overview\n\nThe shared cache stores and retrieves instances of [doc:\/\/com.apple.foundation\/documentation\/Foundation\/URLCredential]. You can store password-based credentials permanently, based on the [doc:\/\/com.apple.foundation\/documentation\/Foundation\/URLCredential\/Persistence-swift.enum] they were created with. Certificate-based credentials are never stored permanently.\n\n### Subclassing notes\n\nThe [doc:\/\/com.apple.foundation\/documentation\/Foundation\/URLCredentialStorage] class is meant to be used as-is, but you can subclass it if you have specific needs, such as screening which credentials are stored.\n\nWhen overriding methods of this class, be aware that methods that take a `task` parameter are preferred to equivalent methods that do not. Therefore, you should override the task-based methods when subclassing, as follows:\n\n- Setting credentials — Override [doc:\/\/com.apple.foundation\/documentation\/Foundation\/URLCredentialStorage\/set(_:for:task:)] instead of or in addition to [doc:\/\/com.apple.foundation\/documentation\/Foundation\/URLCredentialStorage\/set(_:for:)].\n- Getting credentials — Override [doc:\/\/com.apple.foundation\/documentation\/Foundation\/URLCredentialStorage\/getCredentials(for:task:completionHandler:)] instead of or in addition to [doc:\/\/com.apple.foundation\/documentation\/Foundation\/URLCredentialStorage\/credentials(for:)].\n- Removing credentials — Override [doc:\/\/com.apple.foundation\/documentation\/Foundation\/URLCredentialStorage\/remove(_:for:options:task:)] instead of or in addition to [doc:\/\/com.apple.foundation\/documentation\/Foundation\/URLCredentialStorage\/remove(_:for:options:)] and [doc:\/\/com.apple.foundation\/documentation\/Foundation\/URLCredentialStorage\/remove(_:for:)].\n- Setting default credentials — Override [doc:\/\/com.apple.foundation\/documentation\/Foundation\/URLCredentialStorage\/setDefaultCredential(_:for:task:)] instead of or in addition to [doc:\/\/com.apple.foundation\/documentation\/Foundation\/URLCredentialStorage\/setDefaultCredential(_:for:)].\n- Getting default credentials — Override [doc:\/\/com.apple.foundation\/documentation\/Foundation\/URLCredentialStorage\/getDefaultCredential(for:task:completionHandler:)] instead of or in addition to [doc:\/\/com.apple.foundation\/documentation\/Foundation\/URLCredentialStorage\/defaultCredential(for:)].\n\n## Getting the credential storage\n\n- **shared**: The shared URL credential storage instance.\n\n## Getting and setting default credentials\n\n- **defaultCredential(for:)**: Returns the default credential for the specified protection space.\n- **getDefaultCredential(for:task:completionHandler:)**: Gets the default credential for the specified protection space, which is being accessed by the given task, and passes it to the provided completion handler.\n- **setDefaultCredential(_:for:)**: Sets the default credential for a specified protection space.\n- **setDefaultCredential(_:for:task:)**: Sets the default credential for a given protection space, which is being accessed by the given task.\n\n## Adding and removing credentials\n\n- **remove(_:for:)**: Removes the specified credential from the credential storage for the specified protection space.\n- **remove(_:for:options:)**: Removes the specified credential from the credential storage for the specified protection space using the given options.\n- **remove(_:for:options:task:)**: Removes the specified credential from the credential storage for the specified protection space, on behalf of the given task and using the given options.\n- **Dictionary key for credential removal options**: Key used by the options dictionary passed in [doc:\/\/com.apple.foundation\/documentation\/Foundation\/URLCredentialStorage\/remove(_:for:options:)].\n- **set(_:for:)**: Adds a credential to the credential storage for the specified protection space.\n- **set(_:for:task:)**: Adds a credential to the credential storage for the specified protection space, on behalf of the specified task.\n\n## Retrieving credentials\n\n- **allCredentials**: The credentials for all available protection spaces.\n- **credentials(for:)**: Returns a dictionary containing the credentials for the specified protection space.\n- **getCredentials(for:task:completionHandler:)**: Gets a dictionary containing the credentials for the specified protection space, on behalf of the given task, and passes the dictionary to the provided completion handler.\n\n## Tracking credential storage changes\n\n- **NSURLCredentialStorageChanged**: A notification posted when the set of stored credentials changes.\n\n## Authentication and credentials\n\n- **Handling an authentication challenge**: Respond appropriately when a server demands authentication for a URL request.\n- **URLAuthenticationChallenge**: A challenge from a server requiring authentication from the client.\n- **URLCredential**: `A`n authentication credential consisting of information specific to the type of credential and the type of persistent storage to use, if any.\n- **URLProtectionSpace**: A server or an area on a server, commonly referred to as a realm, that requires authentication.\n\n## Inherits From\n\n- NSObject\n\n## Conforms To\n\n- CVarArg\n- CustomDebugStringConvertible\n- CustomStringConvertible\n- Equatable\n- Hashable\n- NSObjectProtocol\n- Sendable\n- SendableMetatype\n\n",
  "sections" : [
    {
      "content" : "",
      "items" : [
        {
          "description" : "The shared URL credential storage instance.",
          "name" : "shared",
          "url" : "https:\/\/developer.apple.com\/documentation\/Foundation\/URLCredentialStorage\/shared"
        }
      ],
      "title" : "Getting the credential storage"
    },
    {
      "content" : "",
      "items" : [
        {
          "description" : "Returns the default credential for the specified protection space.",
          "name" : "defaultCredential(for:)",
          "url" : "https:\/\/developer.apple.com\/documentation\/Foundation\/URLCredentialStorage\/defaultCredential(for:)"
        },
        {
          "description" : "Gets the default credential for the specified protection space, which is being accessed by the given task, and passes it to the provided completion handler.",
          "name" : "getDefaultCredential(for:task:completionHandler:)",
          "url" : "https:\/\/developer.apple.com\/documentation\/Foundation\/URLCredentialStorage\/getDefaultCredential(for:task:completionHandler:)"
        },
        {
          "description" : "Sets the default credential for a specified protection space.",
          "name" : "setDefaultCredential(_:for:)",
          "url" : "https:\/\/developer.apple.com\/documentation\/Foundation\/URLCredentialStorage\/setDefaultCredential(_:for:)"
        },
        {
          "description" : "Sets the default credential for a given protection space, which is being accessed by the given task.",
          "name" : "setDefaultCredential(_:for:task:)",
          "url" : "https:\/\/developer.apple.com\/documentation\/Foundation\/URLCredentialStorage\/setDefaultCredential(_:for:task:)"
        }
      ],
      "title" : "Getting and setting default credentials"
    },
    {
      "content" : "",
      "items" : [
        {
          "description" : "Removes the specified credential from the credential storage for the specified protection space.",
          "name" : "remove(_:for:)",
          "url" : "https:\/\/developer.apple.com\/documentation\/Foundation\/URLCredentialStorage\/remove(_:for:)"
        },
        {
          "description" : "Removes the specified credential from the credential storage for the specified protection space using the given options.",
          "name" : "remove(_:for:options:)",
          "url" : "https:\/\/developer.apple.com\/documentation\/Foundation\/URLCredentialStorage\/remove(_:for:options:)"
        },
        {
          "description" : "Removes the specified credential from the credential storage for the specified protection space, on behalf of the given task and using the given options.",
          "name" : "remove(_:for:options:task:)",
          "url" : "https:\/\/developer.apple.com\/documentation\/Foundation\/URLCredentialStorage\/remove(_:for:options:task:)"
        },
        {
          "description" : "Key used by the options dictionary passed in [doc:\/\/com.apple.foundation\/documentation\/Foundation\/URLCredentialStorage\/remove(_:for:options:)].",
          "name" : "Dictionary key for credential removal options",
          "url" : "https:\/\/developer.apple.com\/documentation\/Foundation\/dictionary-key-for-credential-removal-options"
        },
        {
          "description" : "Adds a credential to the credential storage for the specified protection space.",
          "name" : "set(_:for:)",
          "url" : "https:\/\/developer.apple.com\/documentation\/Foundation\/URLCredentialStorage\/set(_:for:)"
        },
        {
          "description" : "Adds a credential to the credential storage for the specified protection space, on behalf of the specified task.",
          "name" : "set(_:for:task:)",
          "url" : "https:\/\/developer.apple.com\/documentation\/Foundation\/URLCredentialStorage\/set(_:for:task:)"
        }
      ],
      "title" : "Adding and removing credentials"
    },
    {
      "content" : "",
      "items" : [
        {
          "description" : "The credentials for all available protection spaces.",
          "name" : "allCredentials",
          "url" : "https:\/\/developer.apple.com\/documentation\/Foundation\/URLCredentialStorage\/allCredentials"
        },
        {
          "description" : "Returns a dictionary containing the credentials for the specified protection space.",
          "name" : "credentials(for:)",
          "url" : "https:\/\/developer.apple.com\/documentation\/Foundation\/URLCredentialStorage\/credentials(for:)"
        },
        {
          "description" : "Gets a dictionary containing the credentials for the specified protection space, on behalf of the given task, and passes the dictionary to the provided completion handler.",
          "name" : "getCredentials(for:task:completionHandler:)",
          "url" : "https:\/\/developer.apple.com\/documentation\/Foundation\/URLCredentialStorage\/getCredentials(for:task:completionHandler:)"
        }
      ],
      "title" : "Retrieving credentials"
    },
    {
      "content" : "",
      "items" : [
        {
          "description" : "A notification posted when the set of stored credentials changes.",
          "name" : "NSURLCredentialStorageChanged",
          "url" : "https:\/\/developer.apple.com\/documentation\/Foundation\/NSNotification\/Name-swift.struct\/NSURLCredentialStorageChanged"
        }
      ],
      "title" : "Tracking credential storage changes"
    },
    {
      "content" : "",
      "items" : [
        {
          "description" : "Respond appropriately when a server demands authentication for a URL request.",
          "name" : "Handling an authentication challenge",
          "url" : "https:\/\/developer.apple.com\/documentation\/Foundation\/handling-an-authentication-challenge"
        },
        {
          "description" : "A challenge from a server requiring authentication from the client.",
          "name" : "URLAuthenticationChallenge",
          "url" : "https:\/\/developer.apple.com\/documentation\/Foundation\/URLAuthenticationChallenge"
        },
        {
          "description" : "`A`n authentication credential consisting of information specific to the type of credential and the type of persistent storage to use, if any.",
          "name" : "URLCredential",
          "url" : "https:\/\/developer.apple.com\/documentation\/Foundation\/URLCredential"
        },
        {
          "description" : "A server or an area on a server, commonly referred to as a realm, that requires authentication.",
          "name" : "URLProtectionSpace",
          "url" : "https:\/\/developer.apple.com\/documentation\/Foundation\/URLProtectionSpace"
        }
      ],
      "title" : "Authentication and credentials"
    },
    {
      "content" : "",
      "items" : [
        {
          "name" : "NSObject"
        }
      ],
      "title" : "Inherits From"
    }
  ],
  "source" : "appleJSON",
  "title" : "URLCredentialStorage",
  "url" : "https:\/\/developer.apple.com\/documentation\/Foundation\/URLCredentialStorage"
}