{
  "abstract" : "Returns the kind of node the receiver is as a constant of type [doc:\/\/com.apple.foundation\/documentation\/Foundation\/XMLNode\/Kind-swift.enum].",
  "codeExamples" : [

  ],
  "contentHash" : "c3d9129d9787e10860499ce21d5c76fae5c72e45599773eefd1a3ea57277fad6",
  "crawledAt" : "2025-12-05T04:22:03Z",
  "declaration" : {
    "code" : "var kind: XMLNode.Kind { get }",
    "language" : "swift"
  },
  "id" : "85815AA3-A1D0-4915-B24B-3A1088B6CEDE",
  "kind" : "property",
  "language" : "swift",
  "module" : "Foundation",
  "overview" : "## Discussion\n\n`NSXMLNode` objects can represent documents, elements, attributes, namespaces, text, processing instructions, comments, document type declarations, and specific declarations within DTDs. See Constants for a list of valid NSXMLNodeKind constants",
  "platforms" : [
    "Mac Catalyst",
    "macOS"
  ],
  "rawMarkdown" : "---\nsource: https:\/\/developer.apple.com\/documentation\/Foundation\/XMLNode\/kind-swift.property\ncrawled: 2025-12-05T04:22:03Z\n---\n\n# kind\n\n**Instance Property**\n\nReturns the kind of node the receiver is as a constant of type [doc:\/\/com.apple.foundation\/documentation\/Foundation\/XMLNode\/Kind-swift.enum].\n\n## Declaration\n\n```swift\nvar kind: XMLNode.Kind { get }\n```\n\n## Discussion\n\n`NSXMLNode` objects can represent documents, elements, attributes, namespaces, text, processing instructions, comments, document type declarations, and specific declarations within DTDs. See Constants for a list of valid NSXMLNodeKind constants\n\n## Related Documentation\n\n- **init(kind:)**: Returns an `NSXMLNode` instance initialized with the constant indicating node kind.\n\n## Managing XML Node Objects\n\n- **index**: Returns the index of the receiver identifying its position relative to its sibling nodes.\n- **level**: Returns the nesting level of the receiver within the tree hierarchy.\n- **name**: Returns the name of the receiver.\n- **objectValue**: Returns the object value of the receiver.\n- **stringValue**: Returns the content of the receiver as a string value.\n- **setStringValue(_:resolvingEntities:)**: Sets the content of the receiver as a string value and, optionally, resolves character references, predefined entities, and user-defined entities as declared in the associated DTD.\n- **uri**: Returns the URI associated with the receiver.\n\n",
  "sections" : [
    {
      "content" : "",
      "items" : [
        {
          "description" : "Returns an `NSXMLNode` instance initialized with the constant indicating node kind.",
          "name" : "init(kind:)",
          "url" : "https:\/\/developer.apple.com\/documentation\/Foundation\/XMLNode\/init(kind:)"
        }
      ],
      "title" : "Related Documentation"
    },
    {
      "content" : "",
      "items" : [
        {
          "description" : "Returns the index of the receiver identifying its position relative to its sibling nodes.",
          "name" : "index",
          "url" : "https:\/\/developer.apple.com\/documentation\/Foundation\/XMLNode\/index"
        },
        {
          "description" : "Returns the nesting level of the receiver within the tree hierarchy.",
          "name" : "level",
          "url" : "https:\/\/developer.apple.com\/documentation\/Foundation\/XMLNode\/level"
        },
        {
          "description" : "Returns the name of the receiver.",
          "name" : "name",
          "url" : "https:\/\/developer.apple.com\/documentation\/Foundation\/XMLNode\/name"
        },
        {
          "description" : "Returns the object value of the receiver.",
          "name" : "objectValue",
          "url" : "https:\/\/developer.apple.com\/documentation\/Foundation\/XMLNode\/objectValue"
        },
        {
          "description" : "Returns the content of the receiver as a string value.",
          "name" : "stringValue",
          "url" : "https:\/\/developer.apple.com\/documentation\/Foundation\/XMLNode\/stringValue"
        },
        {
          "description" : "Sets the content of the receiver as a string value and, optionally, resolves character references, predefined entities, and user-defined entities as declared in the associated DTD.",
          "name" : "setStringValue(_:resolvingEntities:)",
          "url" : "https:\/\/developer.apple.com\/documentation\/Foundation\/XMLNode\/setStringValue(_:resolvingEntities:)"
        },
        {
          "description" : "Returns the URI associated with the receiver.",
          "name" : "uri",
          "url" : "https:\/\/developer.apple.com\/documentation\/Foundation\/XMLNode\/uri"
        }
      ],
      "title" : "Managing XML Node Objects"
    }
  ],
  "source" : "appleJSON",
  "title" : "kind",
  "url" : "https:\/\/developer.apple.com\/documentation\/Foundation\/XMLNode\/kind-swift.property"
}