{
  "abstract" : "The standard input for the receiver.",
  "codeExamples" : [

  ],
  "contentHash" : "34cef9e1c1b23678d51eeb5fcd8e2eba8ae104d3584ef90b3ef541844082ea72",
  "crawledAt" : "2025-12-06T01:54:53Z",
  "declaration" : {
    "code" : "var standardInput: Any? { get set }",
    "language" : "swift"
  },
  "id" : "34D92E65-64C0-4A9E-818A-4E13EEE9E750",
  "kind" : "property",
  "language" : "swift",
  "module" : "Foundation",
  "overview" : "## Discussion\n\nIf `file` is an `NSPipe` object, launching the receiver automatically closes the read end of the pipe in the current task. Don’t create a handle for the pipe and pass that as the argument, or the read end of the pipe won’t be closed automatically.\n\nIf this method isn’t used, the standard input is inherited from the process that created the receiver. This method raises an `NSInvalidArgumentException` if the system has lauched the receiver.",
  "platforms" : [
    "Mac Catalyst",
    "macOS"
  ],
  "rawMarkdown" : "---\nsource: https:\/\/developer.apple.com\/documentation\/Foundation\/Process\/standardInput\ncrawled: 2025-12-06T01:54:53Z\n---\n\n# standardInput\n\n**Instance Property**\n\nThe standard input for the receiver.\n\n## Declaration\n\n```swift\nvar standardInput: Any? { get set }\n```\n\n## Parameters\n\n- **file**: The standard input for the receiver, which can be either an [doc:\/\/com.apple.foundation\/documentation\/Foundation\/FileHandle] or an [doc:\/\/com.apple.foundation\/documentation\/Foundation\/Pipe] object.\n\n## Discussion\n\nIf `file` is an `NSPipe` object, launching the receiver automatically closes the read end of the pipe in the current task. Don’t create a handle for the pipe and pass that as the argument, or the read end of the pipe won’t be closed automatically.\n\nIf this method isn’t used, the standard input is inherited from the process that created the receiver. This method raises an `NSInvalidArgumentException` if the system has lauched the receiver.\n\n## Configuring\n\n- **arguments**: The command arguments that the system uses to launch the executable.\n- **currentDirectoryURL**: The current directory for the receiver.\n- **environment**: The environment for the receiver.\n- **executableURL**: The receiver’s executable.\n- **qualityOfService**: The default quality of service level the system applies to operations the task executes.\n- **standardError**: The standard error for the receiver.\n- **standardOutput**: The standard output for the receiver.\n\n",
  "sections" : [
    {
      "content" : "",
      "items" : [
        {
          "description" : "The command arguments that the system uses to launch the executable.",
          "name" : "arguments",
          "url" : "https:\/\/developer.apple.com\/documentation\/Foundation\/Process\/arguments"
        },
        {
          "description" : "The current directory for the receiver.",
          "name" : "currentDirectoryURL",
          "url" : "https:\/\/developer.apple.com\/documentation\/Foundation\/Process\/currentDirectoryURL"
        },
        {
          "description" : "The environment for the receiver.",
          "name" : "environment",
          "url" : "https:\/\/developer.apple.com\/documentation\/Foundation\/Process\/environment"
        },
        {
          "description" : "The receiver’s executable.",
          "name" : "executableURL",
          "url" : "https:\/\/developer.apple.com\/documentation\/Foundation\/Process\/executableURL"
        },
        {
          "description" : "The default quality of service level the system applies to operations the task executes.",
          "name" : "qualityOfService",
          "url" : "https:\/\/developer.apple.com\/documentation\/Foundation\/Process\/qualityOfService"
        },
        {
          "description" : "The standard error for the receiver.",
          "name" : "standardError",
          "url" : "https:\/\/developer.apple.com\/documentation\/Foundation\/Process\/standardError"
        },
        {
          "description" : "The standard output for the receiver.",
          "name" : "standardOutput",
          "url" : "https:\/\/developer.apple.com\/documentation\/Foundation\/Process\/standardOutput"
        }
      ],
      "title" : "Configuring"
    }
  ],
  "source" : "appleJSON",
  "title" : "standardInput",
  "url" : "https:\/\/developer.apple.com\/documentation\/Foundation\/Process\/standardInput"
}