{
  "abstract" : "An attribute to adjust the pitch the spoken speech.",
  "codeExamples" : [

  ],
  "conformsTo" : [
    "AttributedStringKey",
    "BitwiseCopyable",
    "Copyable",
    "DecodableAttributedStringKey",
    "EncodableAttributedStringKey",
    "MarkdownDecodableAttributedStringKey",
    "ObjectiveCConvertibleAttributedStringKey",
    "Sendable",
    "SendableMetatype"
  ],
  "contentHash" : "e71333453ef4d4310f156de78117ac13e566e4bb5d5ee6bffecf7024d9f5b629",
  "crawledAt" : "2025-12-05T19:19:54Z",
  "declaration" : {
    "code" : "@frozen enum AdjustedPitchAttribute",
    "language" : "swift"
  },
  "id" : "2222C602-31C5-485D-8557-7D866C239EBE",
  "kind" : "enum",
  "language" : "swift",
  "module" : "Foundation",
  "overview" : "## Overview\n\nValues between `-1` and `0` result in a lower pitch while values between `0` and `1` result in a higher pitch.\n\nFor example, you may want to lower the pitch when an object is deleted, or raise the pitch if an object is inserted.",
  "platforms" : [
    "iOS",
    "iPadOS",
    "Mac Catalyst",
    "macOS",
    "tvOS",
    "visionOS",
    "watchOS"
  ],
  "rawMarkdown" : "---\nsource: https:\/\/developer.apple.com\/documentation\/foundation\/attributescopes\/accessibilityattributes\/adjustedpitchattribute\ncrawled: 2025-12-05T19:19:54Z\n---\n\n# AttributeScopes.AccessibilityAttributes.AdjustedPitchAttribute\n\n**Enumeration**\n\nAn attribute to adjust the pitch the spoken speech.\n\n## Declaration\n\n```swift\n@frozen enum AdjustedPitchAttribute\n```\n\n## Overview\n\nValues between `-1` and `0` result in a lower pitch while values between `0` and `1` result in a higher pitch.\n\nFor example, you may want to lower the pitch when an object is deleted, or raise the pitch if an object is inserted.\n\n## Conforms To\n\n- AttributedStringKey\n- BitwiseCopyable\n- Copyable\n- DecodableAttributedStringKey\n- EncodableAttributedStringKey\n- MarkdownDecodableAttributedStringKey\n- ObjectiveCConvertibleAttributedStringKey\n- Sendable\n- SendableMetatype\n\n",
  "sections" : [

  ],
  "source" : "appleJSON",
  "title" : "AttributeScopes.AccessibilityAttributes.AdjustedPitchAttribute",
  "url" : "https:\/\/developer.apple.com\/documentation\/foundation\/attributescopes\/accessibilityattributes\/adjustedpitchattribute"
}