{
  "abstract" : "A completion block the system invokes when the task completes.",
  "codeExamples" : [

  ],
  "contentHash" : "6bd0067d287372ae78ed01796e8a3db2c1e8aff02592f0e1f5e14c5de8efc973",
  "crawledAt" : "2025-12-06T03:24:59Z",
  "declaration" : {
    "code" : "var terminationHandler: ((Process) -> Void)? { get set }",
    "language" : "swift"
  },
  "id" : "DBAC0541-1D7A-44A8-96CA-369DD41C7E23",
  "kind" : "property",
  "language" : "swift",
  "module" : "Foundation",
  "overview" : "## Discussion\n\nThe system passes the task object to the block to allow access to the task parameters, for example to determine if the task completed successfully.\n\nThis block isn’t guaranteed to be fully executed prior to [doc:\/\/com.apple.foundation\/documentation\/Foundation\/Process\/waitUntilExit()] returning.",
  "platforms" : [
    "macOS"
  ],
  "rawMarkdown" : "---\nsource: https:\/\/developer.apple.com\/documentation\/Foundation\/Process\/terminationHandler\ncrawled: 2025-12-06T03:24:59Z\n---\n\n# terminationHandler\n\n**Instance Property**\n\nA completion block the system invokes when the task completes.\n\n## Declaration\n\n```swift\nvar terminationHandler: ((Process) -> Void)? { get set }\n```\n\n## Discussion\n\nThe system passes the task object to the block to allow access to the task parameters, for example to determine if the task completed successfully.\n\nThis block isn’t guaranteed to be fully executed prior to [doc:\/\/com.apple.foundation\/documentation\/Foundation\/Process\/waitUntilExit()] returning.\n\n",
  "sections" : [

  ],
  "source" : "appleJSON",
  "title" : "terminationHandler",
  "url" : "https:\/\/developer.apple.com\/documentation\/Foundation\/Process\/terminationHandler"
}