{
  "abstract" : "A mechanism for registering handler routines for specific types of Apple events and dispatching events to those handlers.",
  "codeExamples" : [

  ],
  "conformsTo" : [
    "CVarArg",
    "CustomDebugStringConvertible",
    "CustomStringConvertible",
    "Equatable",
    "Hashable",
    "NSObjectProtocol"
  ],
  "contentHash" : "31734ea5416096380f716763a4b0a9929caba29f2fc1b43dd9c7d0bb9ff465b8",
  "crawledAt" : "2025-12-04T17:55:21Z",
  "declaration" : {
    "code" : "class NSAppleEventManager",
    "language" : "swift"
  },
  "id" : "25DD42BF-26C5-408D-A0CE-126BCEB67C90",
  "kind" : "class",
  "language" : "swift",
  "module" : "Foundation",
  "overview" : "## Overview\n\nCocoa provides built-in scriptability support that uses scriptability information supplied by an application to automatically convert Apple events into script command objects that perform the desired operation. However, some applications may want to perform more basic Apple event handling, in which an application registers handlers for the Apple events it can process, then calls on the Apple Event Manager to dispatch received Apple events to the appropriate handler. `NSAppleEventManager` supports these mechanisms by providing methods to register and remove handlers and to dispatch Apple events to the appropriate handler, if one exists. For related information, see [https:\/\/developer.apple.com\/library\/archive\/documentation\/Cocoa\/Conceptual\/ScriptableCocoaApplications\/SApps_handle_AEs\/SAppsHandleAEs.html#\/\/apple_ref\/doc\/uid\/20001239]\n\nEach application has at most one instance of `NSAppleEventManager`. To obtain a reference to it, you call the class method [doc:\/\/com.apple.foundation\/documentation\/Foundation\/NSAppleEventManager\/shared()], which creates the instance if it doesn’t already exist.\n\nFor information about the Apple Event Manager, see [doc:\/\/com.apple.documentation\/documentation\/applicationservices\/apple_event_manager] and Apple Events Programming Guide.",
  "platforms" : [
    "Mac Catalyst",
    "macOS"
  ],
  "rawMarkdown" : "---\nsource: https:\/\/developer.apple.com\/documentation\/Foundation\/NSAppleEventManager\ncrawled: 2025-12-04T17:55:21Z\n---\n\n# NSAppleEventManager\n\n**Class**\n\nA mechanism for registering handler routines for specific types of Apple events and dispatching events to those handlers.\n\n## Declaration\n\n```swift\nclass NSAppleEventManager\n```\n\n## Overview\n\nCocoa provides built-in scriptability support that uses scriptability information supplied by an application to automatically convert Apple events into script command objects that perform the desired operation. However, some applications may want to perform more basic Apple event handling, in which an application registers handlers for the Apple events it can process, then calls on the Apple Event Manager to dispatch received Apple events to the appropriate handler. `NSAppleEventManager` supports these mechanisms by providing methods to register and remove handlers and to dispatch Apple events to the appropriate handler, if one exists. For related information, see [https:\/\/developer.apple.com\/library\/archive\/documentation\/Cocoa\/Conceptual\/ScriptableCocoaApplications\/SApps_handle_AEs\/SAppsHandleAEs.html#\/\/apple_ref\/doc\/uid\/20001239]\n\nEach application has at most one instance of `NSAppleEventManager`. To obtain a reference to it, you call the class method [doc:\/\/com.apple.foundation\/documentation\/Foundation\/NSAppleEventManager\/shared()], which creates the instance if it doesn’t already exist.\n\nFor information about the Apple Event Manager, see [doc:\/\/com.apple.documentation\/documentation\/applicationservices\/apple_event_manager] and Apple Events Programming Guide.\n\n## Getting an event manager\n\n- **shared()**: Returns the single instance of `NSAppleEventManager`, creating it first if it doesn’t exist.\n\n## Working with event handlers\n\n- **removeEventHandler(forEventClass:andEventID:)**: If an Apple event handler has been registered for the event specified by `eventClass` and `eventID`, removes it.\n- **setEventHandler(_:andSelector:forEventClass:andEventID:)**: Registers the Apple event handler specified by `handler` for the event specified by `eventClass` and `eventID`.\n\n## Working with events\n\n- **dispatchRawAppleEvent(_:withRawReply:handlerRefCon:)**: Causes the Apple event specified by `theAppleEvent` to be dispatched to the appropriate Apple event handler, if one has been registered by calling [doc:\/\/com.apple.foundation\/documentation\/Foundation\/NSAppleEventManager\/setEventHandler(_:andSelector:forEventClass:andEventID:)].\n\n## Suspending and resuming Apple events\n\n- **appleEvent(forSuspensionID:)**: Given a nonzero `suspensionID` returned by an invocation of [doc:\/\/com.apple.foundation\/documentation\/Foundation\/NSAppleEventManager\/suspendCurrentAppleEvent()], returns the descriptor for the event whose handling was suspended.\n- **currentAppleEvent**: Returns the descriptor for `currentAppleEvent` if an Apple event is being handled on the current thread.\n- **currentReplyAppleEvent**: Returns the corresponding reply event descriptor if an Apple event is being handled on the current thread.\n- **replyAppleEvent(forSuspensionID:)**: Given a nonzero `suspensionID` returned by an invocation of [doc:\/\/com.apple.foundation\/documentation\/Foundation\/NSAppleEventManager\/suspendCurrentAppleEvent()], returns the corresponding reply event descriptor.\n- **resume(withSuspensionID:)**: Given a nonzero `suspensionID` returned by an invocation of [doc:\/\/com.apple.foundation\/documentation\/Foundation\/NSAppleEventManager\/suspendCurrentAppleEvent()], signal that handling of the suspended event may now continue.\n- **setCurrentAppleEventAndReplyEventWithSuspensionID(_:)**: Given a nonzero `suspensionID` returned by an invocation of [doc:\/\/com.apple.foundation\/documentation\/Foundation\/NSAppleEventManager\/suspendCurrentAppleEvent()], sets the values that will be returned by subsequent invocations of [doc:\/\/com.apple.foundation\/documentation\/Foundation\/NSAppleEventManager\/currentAppleEvent] and [doc:\/\/com.apple.foundation\/documentation\/Foundation\/NSAppleEventManager\/currentReplyAppleEvent] to be the event whose handling was suspended and its corresponding reply event, respectively.\n- **suspendCurrentAppleEvent()**: Suspends the handling of the current event and returns an ID that must be used to resume the handling of the event if an Apple event is being handled on the current thread.\n- **NSAppleEventManager.SuspensionID**: Identifies an Apple event whose handling has been suspended. Can be used to resume handling of the Apple event.\n\n## Constants\n\n- **NSAppleEvent Timeouts**: The following constants should not be used and may eventually be removed.\n\n## Apple Event Handling\n\n- **NSAppleEventDescriptor**: A wrapper for the Apple event descriptor data type.\n\n## Inherits From\n\n- NSObject\n\n## Conforms To\n\n- CVarArg\n- CustomDebugStringConvertible\n- CustomStringConvertible\n- Equatable\n- Hashable\n- NSObjectProtocol\n\n",
  "sections" : [
    {
      "content" : "",
      "items" : [
        {
          "description" : "Returns the single instance of `NSAppleEventManager`, creating it first if it doesn’t exist.",
          "name" : "shared()",
          "url" : "https:\/\/developer.apple.com\/documentation\/Foundation\/NSAppleEventManager\/shared()"
        }
      ],
      "title" : "Getting an event manager"
    },
    {
      "content" : "",
      "items" : [
        {
          "description" : "If an Apple event handler has been registered for the event specified by `eventClass` and `eventID`, removes it.",
          "name" : "removeEventHandler(forEventClass:andEventID:)",
          "url" : "https:\/\/developer.apple.com\/documentation\/Foundation\/NSAppleEventManager\/removeEventHandler(forEventClass:andEventID:)"
        },
        {
          "description" : "Registers the Apple event handler specified by `handler` for the event specified by `eventClass` and `eventID`.",
          "name" : "setEventHandler(_:andSelector:forEventClass:andEventID:)",
          "url" : "https:\/\/developer.apple.com\/documentation\/Foundation\/NSAppleEventManager\/setEventHandler(_:andSelector:forEventClass:andEventID:)"
        }
      ],
      "title" : "Working with event handlers"
    },
    {
      "content" : "",
      "items" : [
        {
          "description" : "Causes the Apple event specified by `theAppleEvent` to be dispatched to the appropriate Apple event handler, if one has been registered by calling [doc:\/\/com.apple.foundation\/documentation\/Foundation\/NSAppleEventManager\/setEventHandler(_:andSelector:forEventClass:andEventID:)].",
          "name" : "dispatchRawAppleEvent(_:withRawReply:handlerRefCon:)",
          "url" : "https:\/\/developer.apple.com\/documentation\/Foundation\/NSAppleEventManager\/dispatchRawAppleEvent(_:withRawReply:handlerRefCon:)"
        }
      ],
      "title" : "Working with events"
    },
    {
      "content" : "",
      "items" : [
        {
          "description" : "Given a nonzero `suspensionID` returned by an invocation of [doc:\/\/com.apple.foundation\/documentation\/Foundation\/NSAppleEventManager\/suspendCurrentAppleEvent()], returns the descriptor for the event whose handling was suspended.",
          "name" : "appleEvent(forSuspensionID:)",
          "url" : "https:\/\/developer.apple.com\/documentation\/Foundation\/NSAppleEventManager\/appleEvent(forSuspensionID:)"
        },
        {
          "description" : "Returns the descriptor for `currentAppleEvent` if an Apple event is being handled on the current thread.",
          "name" : "currentAppleEvent",
          "url" : "https:\/\/developer.apple.com\/documentation\/Foundation\/NSAppleEventManager\/currentAppleEvent"
        },
        {
          "description" : "Returns the corresponding reply event descriptor if an Apple event is being handled on the current thread.",
          "name" : "currentReplyAppleEvent",
          "url" : "https:\/\/developer.apple.com\/documentation\/Foundation\/NSAppleEventManager\/currentReplyAppleEvent"
        },
        {
          "description" : "Given a nonzero `suspensionID` returned by an invocation of [doc:\/\/com.apple.foundation\/documentation\/Foundation\/NSAppleEventManager\/suspendCurrentAppleEvent()], returns the corresponding reply event descriptor.",
          "name" : "replyAppleEvent(forSuspensionID:)",
          "url" : "https:\/\/developer.apple.com\/documentation\/Foundation\/NSAppleEventManager\/replyAppleEvent(forSuspensionID:)"
        },
        {
          "description" : "Given a nonzero `suspensionID` returned by an invocation of [doc:\/\/com.apple.foundation\/documentation\/Foundation\/NSAppleEventManager\/suspendCurrentAppleEvent()], signal that handling of the suspended event may now continue.",
          "name" : "resume(withSuspensionID:)",
          "url" : "https:\/\/developer.apple.com\/documentation\/Foundation\/NSAppleEventManager\/resume(withSuspensionID:)"
        },
        {
          "description" : "Given a nonzero `suspensionID` returned by an invocation of [doc:\/\/com.apple.foundation\/documentation\/Foundation\/NSAppleEventManager\/suspendCurrentAppleEvent()], sets the values that will be returned by subsequent invocations of [doc:\/\/com.apple.foundation\/documentation\/Foundation\/NSAppleEventManager\/currentAppleEvent] and [doc:\/\/com.apple.foundation\/documentation\/Foundation\/NSAppleEventManager\/currentReplyAppleEvent] to be the event whose handling was suspended and its corresponding reply event, respectively.",
          "name" : "setCurrentAppleEventAndReplyEventWithSuspensionID(_:)",
          "url" : "https:\/\/developer.apple.com\/documentation\/Foundation\/NSAppleEventManager\/setCurrentAppleEventAndReplyEventWithSuspensionID(_:)"
        },
        {
          "description" : "Suspends the handling of the current event and returns an ID that must be used to resume the handling of the event if an Apple event is being handled on the current thread.",
          "name" : "suspendCurrentAppleEvent()",
          "url" : "https:\/\/developer.apple.com\/documentation\/Foundation\/NSAppleEventManager\/suspendCurrentAppleEvent()"
        },
        {
          "description" : "Identifies an Apple event whose handling has been suspended. Can be used to resume handling of the Apple event.",
          "name" : "NSAppleEventManager.SuspensionID",
          "url" : "https:\/\/developer.apple.com\/documentation\/Foundation\/NSAppleEventManager\/SuspensionID"
        }
      ],
      "title" : "Suspending and resuming Apple events"
    },
    {
      "content" : "",
      "items" : [
        {
          "description" : "The following constants should not be used and may eventually be removed.",
          "name" : "NSAppleEvent Timeouts",
          "url" : "https:\/\/developer.apple.com\/documentation\/Foundation\/nsappleevent-timeouts"
        }
      ],
      "title" : "Constants"
    },
    {
      "content" : "",
      "items" : [
        {
          "description" : "A wrapper for the Apple event descriptor data type.",
          "name" : "NSAppleEventDescriptor",
          "url" : "https:\/\/developer.apple.com\/documentation\/Foundation\/NSAppleEventDescriptor"
        }
      ],
      "title" : "Apple Event Handling"
    },
    {
      "content" : "",
      "items" : [
        {
          "name" : "NSObject"
        }
      ],
      "title" : "Inherits From"
    }
  ],
  "source" : "appleJSON",
  "title" : "NSAppleEventManager",
  "url" : "https:\/\/developer.apple.com\/documentation\/Foundation\/NSAppleEventManager"
}