{
  "abstract" : "A representation of a specific point in time, independent of any calendar or time zone.",
  "codeExamples" : [

  ],
  "conformsTo" : [
    "CKRecordValue",
    "CKRecordValueProtocol",
    "CVarArg",
    "Copyable",
    "CustomDebugStringConvertible",
    "CustomStringConvertible",
    "Equatable",
    "Hashable",
    "NSCoding",
    "NSCopying",
    "NSObjectProtocol",
    "NSSecureCoding",
    "Sendable",
    "SendableMetatype"
  ],
  "contentHash" : "49a9e0f9ebcad9d12b7cbc8e8bdb87d65ed5f124fb78f36e03bed08ca10c6639",
  "crawledAt" : "2025-12-01T23:08:30Z",
  "declaration" : {
    "code" : "class NSDate",
    "language" : "swift"
  },
  "id" : "4F7EED8E-6175-4A83-99DD-F9E65EDEA727",
  "kind" : "class",
  "module" : "Foundation",
  "overview" : "## Overview\n\nIn Swift, use this type when you need reference semantics or other Foundation-specific behavior.\n\n[doc:\/\/com.apple.foundation\/documentation\/Foundation\/NSDate] objects encapsulate a single point in time, independent of any particular calendrical system or time zone. Date objects are immutable, representing an invariant time interval relative to an absolute reference date (00:00:00 UTC on 1 January 2001).\n\nThe [doc:\/\/com.apple.foundation\/documentation\/Foundation\/NSDate] class provides methods for comparing dates, calculating the time interval between two dates, and creating a new date from a time interval relative to another date. [doc:\/\/com.apple.foundation\/documentation\/Foundation\/NSDate] objects can be used in conjunction with [doc:\/\/com.apple.foundation\/documentation\/Foundation\/DateFormatter] objects to create localized representations of dates and times, as well as with [doc:\/\/com.apple.foundation\/documentation\/Foundation\/NSCalendar] objects to perform calendar arithmetic.\n\n[doc:\/\/com.apple.foundation\/documentation\/Foundation\/NSDate] is *toll-free bridged* with its Core Foundation counterpart, [doc:\/\/com.apple.documentation\/documentation\/CoreFoundation\/CFDate]. See [https:\/\/developer.apple.com\/library\/archive\/documentation\/General\/Conceptual\/CocoaEncyclopedia\/Toll-FreeBridgin\/Toll-FreeBridgin.html#\/\/apple_ref\/doc\/uid\/TP40010810-CH2] for more information on toll-free bridging.\n\n### Subclassing Notes\n\nYou might subclass [doc:\/\/com.apple.foundation\/documentation\/Foundation\/NSDate] in order to make it easier to work with a particular calendrical system, or to work with date and time values with a finer temporal granularity.\n\n#### Methods to Override and Other Requirements\n\nIf you want to subclass [doc:\/\/com.apple.foundation\/documentation\/Foundation\/NSDate] to obtain behavior different than that provided by the private or public subclasses, you must:\n\n#### Special Considerations\n\nYour subclass may use a different reference date than the absolute reference date used by [doc:\/\/com.apple.foundation\/documentation\/Foundation\/NSDate] (00:00:00 UTC on 1 January 2001). If it does, it must still use the absolute reference date in its implementations of the methods [doc:\/\/com.apple.foundation\/documentation\/Foundation\/NSDate\/timeIntervalSinceReferenceDate-swift.property] and [doc:\/\/com.apple.foundation\/documentation\/Foundation\/NSDate\/init(timeIntervalSinceReferenceDate:)]. That is, the reference date referred to in the titles of these methods is the absolute reference date. If you do not use the absolute reference date in these methods, comparisons between [doc:\/\/com.apple.foundation\/documentation\/Foundation\/NSDate] objects of your subclass and `NSDate` objects of a private subclass will not work.",
  "platforms" : [
    "iOS",
    "iPadOS",
    "Mac Catalyst",
    "macOS",
    "tvOS",
    "visionOS",
    "watchOS"
  ],
  "rawMarkdown" : "---\nsource: https:\/\/developer.apple.com\/documentation\/Foundation\/NSDate\ncrawled: 2025-12-01T23:08:30Z\n---\n\n# NSDate\n\n**Class**\n\nA representation of a specific point in time, independent of any calendar or time zone.\n\n## Declaration\n\n```swift\nclass NSDate\n```\n\n## Overview\n\nIn Swift, use this type when you need reference semantics or other Foundation-specific behavior.\n\n[doc:\/\/com.apple.foundation\/documentation\/Foundation\/NSDate] objects encapsulate a single point in time, independent of any particular calendrical system or time zone. Date objects are immutable, representing an invariant time interval relative to an absolute reference date (00:00:00 UTC on 1 January 2001).\n\nThe [doc:\/\/com.apple.foundation\/documentation\/Foundation\/NSDate] class provides methods for comparing dates, calculating the time interval between two dates, and creating a new date from a time interval relative to another date. [doc:\/\/com.apple.foundation\/documentation\/Foundation\/NSDate] objects can be used in conjunction with [doc:\/\/com.apple.foundation\/documentation\/Foundation\/DateFormatter] objects to create localized representations of dates and times, as well as with [doc:\/\/com.apple.foundation\/documentation\/Foundation\/NSCalendar] objects to perform calendar arithmetic.\n\n[doc:\/\/com.apple.foundation\/documentation\/Foundation\/NSDate] is *toll-free bridged* with its Core Foundation counterpart, [doc:\/\/com.apple.documentation\/documentation\/CoreFoundation\/CFDate]. See [https:\/\/developer.apple.com\/library\/archive\/documentation\/General\/Conceptual\/CocoaEncyclopedia\/Toll-FreeBridgin\/Toll-FreeBridgin.html#\/\/apple_ref\/doc\/uid\/TP40010810-CH2] for more information on toll-free bridging.\n\n\n\n### Subclassing Notes\n\nYou might subclass [doc:\/\/com.apple.foundation\/documentation\/Foundation\/NSDate] in order to make it easier to work with a particular calendrical system, or to work with date and time values with a finer temporal granularity.\n\n#### Methods to Override and Other Requirements\n\nIf you want to subclass [doc:\/\/com.apple.foundation\/documentation\/Foundation\/NSDate] to obtain behavior different than that provided by the private or public subclasses, you must:\n\n- Declare a suitable instance variable to hold the date and time value (relative to an absolute reference date)\n- Override the [doc:\/\/com.apple.foundation\/documentation\/Foundation\/NSDate\/timeIntervalSinceReferenceDate-swift.property] instance method to provide the correct date and time value based on your instance variable\n- Override [doc:\/\/com.apple.foundation\/documentation\/Foundation\/NSDate\/init(timeIntervalSinceReferenceDate:)], one of the designated initializer methods\n- If creating a subclass that represents a calendrical system, define methods that partition past and future periods into the units of this calendar\n- Implement the methods required by the [doc:\/\/com.apple.foundation\/documentation\/Foundation\/NSCopying] and [https:\/\/developer.apple.com\/library\/archive\/documentation\/Swift\/Conceptual\/BuildingCocoaApps\/WritingSwiftClassesWithObjective-CBehavior.html#\/\/apple_ref\/doc\/uid\/TP40014216-CH5-ID152] protocols, because [doc:\/\/com.apple.foundation\/documentation\/Foundation\/NSDate] adopts these protocols\n\n#### Special Considerations\n\nYour subclass may use a different reference date than the absolute reference date used by [doc:\/\/com.apple.foundation\/documentation\/Foundation\/NSDate] (00:00:00 UTC on 1 January 2001). If it does, it must still use the absolute reference date in its implementations of the methods [doc:\/\/com.apple.foundation\/documentation\/Foundation\/NSDate\/timeIntervalSinceReferenceDate-swift.property] and [doc:\/\/com.apple.foundation\/documentation\/Foundation\/NSDate\/init(timeIntervalSinceReferenceDate:)]. That is, the reference date referred to in the titles of these methods is the absolute reference date. If you do not use the absolute reference date in these methods, comparisons between [doc:\/\/com.apple.foundation\/documentation\/Foundation\/NSDate] objects of your subclass and `NSDate` objects of a private subclass will not work.\n\n## Creating a Date\n\n- **init(timeInterval:sinceDate:)**: Creates and returns a date object set to a given number of seconds from the specified date.\n\n## Initializing a Date\n\n- **init()**: Returns a date object initialized to the current date and time.\n- **init(timeIntervalSinceNow:)**: Returns a date object initialized relative to the current date and time by a given number of seconds.\n- **init(timeInterval:sinceDate:)**: Returns a date object initialized relative to another given date by a given number of seconds.\n- **init(timeIntervalSinceReferenceDate:)**: Returns a date object initialized relative to 00:00:00 UTC on 1 January 2001 by a given number of seconds.\n- **init(timeIntervalSince1970:)**: Returns a date object initialized relative to 00:00:00 UTC on 1 January 1970 by a given number of seconds.\n- **init(coder:)**: Returns a date object initialized from data in the given unarchiver.\n\n## Getting Temporal Boundaries\n\n- **distantFuture**: A date object representing a date in the distant future.\n- **distantPast**: A date object representing a date in the distant past.\n\n## Retrieving the Current Date\n\n- **now**: The current date and time, as of the time of access.\n\n## Comparing Dates\n\n- **isEqual(to:)**: Returns a Boolean value that indicates whether a given object is a date that is exactly equal the receiver.\n- **earlierDate(_:)**: Returns the earlier of the receiver and another given date.\n- **laterDate(_:)**: Returns the later of the receiver and another given date.\n- **compare(_:)**: Indicates the temporal ordering of the receiver and another given date.\n\n## Getting Time Intervals\n\n- **timeIntervalSince(_:)**: Returns the interval between the receiver and another given date.\n- **timeIntervalSinceNow**: The interval between the date object and the current date and time.\n- **timeIntervalSinceReferenceDate**: The interval between the date object and 00:00:00 UTC on 1 January 2001.\n- **timeIntervalSince1970**: The interval between the date object and 00:00:00 UTC on 1 January 1970.\n- **timeIntervalSinceReferenceDate**: The interval between 00:00:00 UTC on 1 January 2001 and the current date and time.\n- **NSTimeIntervalSince1970**: The number of seconds from 1 January 1970 to the reference date, 1 January 2001.\n\n## Adding Time Intervals\n\n- **addingTimeInterval(_:)**: Returns a new date object that is set to a given number of seconds relative to the receiver.\n\n## Describing Dates\n\n- **description**: A string representation of the date object.\n- **description(with:)**: Returns a string representation of the date using the given locale.\n- **customPlaygroundQuickLook**: A custom playground Quick Look for this object.\n\n## Recognizing Notifications\n\n- **NSSystemClockDidChange**: A notification posted whenever the system clock is changed.\n\n## Legacy Operations\n\n- **date(withNaturalLanguageString:)**: Creates and returns a date object set to the date and time specified by a given string.\n- **date(withNaturalLanguageString:locale:)**: Creates and returns a date object set to the date and time specified by a given string.\n- **date(with:)**: Creates and returns a date object with a date and time value specified by a given string in the international string representation format (`YYYY-MM-DD HH:MM:SS ±HHMM`).\n- **init(string:)**: Returns a date object initialized with a date and time value specified by a given string in the international string representation format.\n- **addTimeInterval(_:)**: Returns a new date object that is set to a given number of seconds relative to the receiver.\n- **date(withCalendarFormat:timeZone:)**: Converts the receiver to a calendar date with a given format string and time zone.\n- **description(withCalendarFormat:timeZone:locale:)**: Returns a string representation of the date formatted as specified by given conversion specifiers.\n\n## Initializers\n\n- **init(SRAbsoluteTime:)**\n- **init(SRAbsoluteTime:)**\n\n## Instance Properties\n\n- **srAbsoluteTime**\n\n## Inherits From\n\n- NSObject\n\n## Conforms To\n\n- CKRecordValue\n- CKRecordValueProtocol\n- CVarArg\n- Copyable\n- CustomDebugStringConvertible\n- CustomStringConvertible\n- Equatable\n- Hashable\n- NSCoding\n- NSCopying\n- NSObjectProtocol\n- NSSecureCoding\n- Sendable\n- SendableMetatype\n\n",
  "sections" : [
    {
      "content" : "",
      "items" : [
        {
          "description" : "Creates and returns a date object set to a given number of seconds from the specified date.",
          "name" : "init(timeInterval:sinceDate:)",
          "url" : "https:\/\/developer.apple.com\/documentation\/Foundation\/NSDate\/init(timeInterval:sinceDate:)-49cea"
        }
      ],
      "title" : "Creating a Date"
    },
    {
      "content" : "",
      "items" : [
        {
          "description" : "Returns a date object initialized to the current date and time.",
          "name" : "init()",
          "url" : "https:\/\/developer.apple.com\/documentation\/Foundation\/NSDate\/init()"
        },
        {
          "description" : "Returns a date object initialized relative to the current date and time by a given number of seconds.",
          "name" : "init(timeIntervalSinceNow:)",
          "url" : "https:\/\/developer.apple.com\/documentation\/Foundation\/NSDate\/init(timeIntervalSinceNow:)"
        },
        {
          "description" : "Returns a date object initialized relative to another given date by a given number of seconds.",
          "name" : "init(timeInterval:sinceDate:)",
          "url" : "https:\/\/developer.apple.com\/documentation\/Foundation\/NSDate\/init(timeInterval:sinceDate:)-71m1f"
        },
        {
          "description" : "Returns a date object initialized relative to 00:00:00 UTC on 1 January 2001 by a given number of seconds.",
          "name" : "init(timeIntervalSinceReferenceDate:)",
          "url" : "https:\/\/developer.apple.com\/documentation\/Foundation\/NSDate\/init(timeIntervalSinceReferenceDate:)"
        },
        {
          "description" : "Returns a date object initialized relative to 00:00:00 UTC on 1 January 1970 by a given number of seconds.",
          "name" : "init(timeIntervalSince1970:)",
          "url" : "https:\/\/developer.apple.com\/documentation\/Foundation\/NSDate\/init(timeIntervalSince1970:)"
        },
        {
          "description" : "Returns a date object initialized from data in the given unarchiver.",
          "name" : "init(coder:)",
          "url" : "https:\/\/developer.apple.com\/documentation\/Foundation\/NSDate\/init(coder:)"
        }
      ],
      "title" : "Initializing a Date"
    },
    {
      "content" : "",
      "items" : [
        {
          "description" : "A date object representing a date in the distant future.",
          "name" : "distantFuture",
          "url" : "https:\/\/developer.apple.com\/documentation\/Foundation\/NSDate\/distantFuture"
        },
        {
          "description" : "A date object representing a date in the distant past.",
          "name" : "distantPast",
          "url" : "https:\/\/developer.apple.com\/documentation\/Foundation\/NSDate\/distantPast"
        }
      ],
      "title" : "Getting Temporal Boundaries"
    },
    {
      "content" : "",
      "items" : [
        {
          "description" : "The current date and time, as of the time of access.",
          "name" : "now",
          "url" : "https:\/\/developer.apple.com\/documentation\/Foundation\/NSDate\/now"
        }
      ],
      "title" : "Retrieving the Current Date"
    },
    {
      "content" : "",
      "items" : [
        {
          "description" : "Returns a Boolean value that indicates whether a given object is a date that is exactly equal the receiver.",
          "name" : "isEqual(to:)",
          "url" : "https:\/\/developer.apple.com\/documentation\/Foundation\/NSDate\/isEqual(to:)"
        },
        {
          "description" : "Returns the earlier of the receiver and another given date.",
          "name" : "earlierDate(_:)",
          "url" : "https:\/\/developer.apple.com\/documentation\/Foundation\/NSDate\/earlierDate(_:)"
        },
        {
          "description" : "Returns the later of the receiver and another given date.",
          "name" : "laterDate(_:)",
          "url" : "https:\/\/developer.apple.com\/documentation\/Foundation\/NSDate\/laterDate(_:)"
        },
        {
          "description" : "Indicates the temporal ordering of the receiver and another given date.",
          "name" : "compare(_:)",
          "url" : "https:\/\/developer.apple.com\/documentation\/Foundation\/NSDate\/compare(_:)"
        }
      ],
      "title" : "Comparing Dates"
    },
    {
      "content" : "",
      "items" : [
        {
          "description" : "Returns the interval between the receiver and another given date.",
          "name" : "timeIntervalSince(_:)",
          "url" : "https:\/\/developer.apple.com\/documentation\/Foundation\/NSDate\/timeIntervalSince(_:)"
        },
        {
          "description" : "The interval between the date object and the current date and time.",
          "name" : "timeIntervalSinceNow",
          "url" : "https:\/\/developer.apple.com\/documentation\/Foundation\/NSDate\/timeIntervalSinceNow"
        },
        {
          "description" : "The interval between the date object and 00:00:00 UTC on 1 January 2001.",
          "name" : "timeIntervalSinceReferenceDate",
          "url" : "https:\/\/developer.apple.com\/documentation\/Foundation\/NSDate\/timeIntervalSinceReferenceDate-swift.property"
        },
        {
          "description" : "The interval between the date object and 00:00:00 UTC on 1 January 1970.",
          "name" : "timeIntervalSince1970",
          "url" : "https:\/\/developer.apple.com\/documentation\/Foundation\/NSDate\/timeIntervalSince1970"
        },
        {
          "description" : "The interval between 00:00:00 UTC on 1 January 2001 and the current date and time.",
          "name" : "timeIntervalSinceReferenceDate",
          "url" : "https:\/\/developer.apple.com\/documentation\/Foundation\/NSDate\/timeIntervalSinceReferenceDate-swift.type.property"
        },
        {
          "description" : "The number of seconds from 1 January 1970 to the reference date, 1 January 2001.",
          "name" : "NSTimeIntervalSince1970",
          "url" : "https:\/\/developer.apple.com\/documentation\/Foundation\/NSTimeIntervalSince1970"
        }
      ],
      "title" : "Getting Time Intervals"
    },
    {
      "content" : "",
      "items" : [
        {
          "description" : "Returns a new date object that is set to a given number of seconds relative to the receiver.",
          "name" : "addingTimeInterval(_:)",
          "url" : "https:\/\/developer.apple.com\/documentation\/Foundation\/NSDate\/addingTimeInterval(_:)"
        }
      ],
      "title" : "Adding Time Intervals"
    },
    {
      "content" : "",
      "items" : [
        {
          "description" : "A string representation of the date object.",
          "name" : "description",
          "url" : "https:\/\/developer.apple.com\/documentation\/Foundation\/NSDate\/description"
        },
        {
          "description" : "Returns a string representation of the date using the given locale.",
          "name" : "description(with:)",
          "url" : "https:\/\/developer.apple.com\/documentation\/Foundation\/NSDate\/description(with:)"
        },
        {
          "description" : "A custom playground Quick Look for this object.",
          "name" : "customPlaygroundQuickLook",
          "url" : "https:\/\/developer.apple.com\/documentation\/Foundation\/NSDate\/customPlaygroundQuickLook"
        }
      ],
      "title" : "Describing Dates"
    },
    {
      "content" : "",
      "items" : [
        {
          "description" : "A notification posted whenever the system clock is changed.",
          "name" : "NSSystemClockDidChange",
          "url" : "https:\/\/developer.apple.com\/documentation\/Foundation\/NSNotification\/Name-swift.struct\/NSSystemClockDidChange"
        }
      ],
      "title" : "Recognizing Notifications"
    },
    {
      "content" : "",
      "items" : [
        {
          "description" : "Creates and returns a date object set to the date and time specified by a given string.",
          "name" : "date(withNaturalLanguageString:)",
          "url" : "https:\/\/developer.apple.com\/documentation\/Foundation\/NSDate\/date(withNaturalLanguageString:)"
        },
        {
          "description" : "Creates and returns a date object set to the date and time specified by a given string.",
          "name" : "date(withNaturalLanguageString:locale:)",
          "url" : "https:\/\/developer.apple.com\/documentation\/Foundation\/NSDate\/date(withNaturalLanguageString:locale:)"
        },
        {
          "description" : "Creates and returns a date object with a date and time value specified by a given string in the international string representation format (`YYYY-MM-DD HH:MM:SS ±HHMM`).",
          "name" : "date(with:)",
          "url" : "https:\/\/developer.apple.com\/documentation\/Foundation\/NSDate\/date(with:)"
        },
        {
          "description" : "Returns a date object initialized with a date and time value specified by a given string in the international string representation format.",
          "name" : "init(string:)",
          "url" : "https:\/\/developer.apple.com\/documentation\/Foundation\/NSDate\/init(string:)"
        },
        {
          "description" : "Returns a new date object that is set to a given number of seconds relative to the receiver.",
          "name" : "addTimeInterval(_:)",
          "url" : "https:\/\/developer.apple.com\/documentation\/Foundation\/NSDate\/addTimeInterval(_:)"
        },
        {
          "description" : "Converts the receiver to a calendar date with a given format string and time zone.",
          "name" : "date(withCalendarFormat:timeZone:)",
          "url" : "https:\/\/developer.apple.com\/documentation\/Foundation\/NSDate\/date(withCalendarFormat:timeZone:)"
        },
        {
          "description" : "Returns a string representation of the date formatted as specified by given conversion specifiers.",
          "name" : "description(withCalendarFormat:timeZone:locale:)",
          "url" : "https:\/\/developer.apple.com\/documentation\/Foundation\/NSDate\/description(withCalendarFormat:timeZone:locale:)"
        }
      ],
      "title" : "Legacy Operations"
    },
    {
      "content" : "",
      "items" : [
        {
          "description" : "",
          "name" : "init(SRAbsoluteTime:)",
          "url" : "https:\/\/developer.apple.com\/documentation\/Foundation\/NSDate\/init(SRAbsoluteTime:)-886t8"
        },
        {
          "description" : "",
          "name" : "init(SRAbsoluteTime:)",
          "url" : "https:\/\/developer.apple.com\/documentation\/Foundation\/NSDate\/init(SRAbsoluteTime:)-9wpl1"
        }
      ],
      "title" : "Initializers"
    },
    {
      "content" : "",
      "items" : [
        {
          "description" : "",
          "name" : "srAbsoluteTime",
          "url" : "https:\/\/developer.apple.com\/documentation\/Foundation\/NSDate\/srAbsoluteTime"
        }
      ],
      "title" : "Instance Properties"
    },
    {
      "content" : "",
      "items" : [
        {
          "name" : "NSObject"
        }
      ],
      "title" : "Inherits From"
    }
  ],
  "source" : "appleJSON",
  "title" : "NSDate",
  "url" : "https:\/\/developer.apple.com\/documentation\/Foundation\/NSDate"
}