{
  "abstract" : "Identifies an Apple event whose handling has been suspended. Can be used to resume handling of the Apple event.",
  "codeExamples" : [

  ],
  "contentHash" : "f3b76b7da905e972fe701b872bee444ebee878285eed498087d8f4b2ad8c7535",
  "crawledAt" : "2025-12-06T02:49:48Z",
  "declaration" : {
    "code" : "typealias SuspensionID = OpaquePointer",
    "language" : "swift"
  },
  "id" : "12723478-E579-4A1F-B5D0-0E260DB46C9C",
  "kind" : "typealias",
  "language" : "swift",
  "module" : "Foundation",
  "platforms" : [
    "Mac Catalyst",
    "macOS"
  ],
  "rawMarkdown" : "---\nsource: https:\/\/developer.apple.com\/documentation\/Foundation\/NSAppleEventManager\/SuspensionID\ncrawled: 2025-12-06T02:49:48Z\n---\n\n# NSAppleEventManager.SuspensionID\n\n**Type Alias**\n\nIdentifies an Apple event whose handling has been suspended. Can be used to resume handling of the Apple event.\n\n## Declaration\n\n```swift\ntypealias SuspensionID = OpaquePointer\n```\n\n## Suspending and resuming Apple events\n\n- **appleEvent(forSuspensionID:)**: Given a nonzero `suspensionID` returned by an invocation of [doc:\/\/com.apple.foundation\/documentation\/Foundation\/NSAppleEventManager\/suspendCurrentAppleEvent()], returns the descriptor for the event whose handling was suspended.\n- **currentAppleEvent**: Returns the descriptor for `currentAppleEvent` if an Apple event is being handled on the current thread.\n- **currentReplyAppleEvent**: Returns the corresponding reply event descriptor if an Apple event is being handled on the current thread.\n- **replyAppleEvent(forSuspensionID:)**: Given a nonzero `suspensionID` returned by an invocation of [doc:\/\/com.apple.foundation\/documentation\/Foundation\/NSAppleEventManager\/suspendCurrentAppleEvent()], returns the corresponding reply event descriptor.\n- **resume(withSuspensionID:)**: Given a nonzero `suspensionID` returned by an invocation of [doc:\/\/com.apple.foundation\/documentation\/Foundation\/NSAppleEventManager\/suspendCurrentAppleEvent()], signal that handling of the suspended event may now continue.\n- **setCurrentAppleEventAndReplyEventWithSuspensionID(_:)**: Given a nonzero `suspensionID` returned by an invocation of [doc:\/\/com.apple.foundation\/documentation\/Foundation\/NSAppleEventManager\/suspendCurrentAppleEvent()], sets the values that will be returned by subsequent invocations of [doc:\/\/com.apple.foundation\/documentation\/Foundation\/NSAppleEventManager\/currentAppleEvent] and [doc:\/\/com.apple.foundation\/documentation\/Foundation\/NSAppleEventManager\/currentReplyAppleEvent] to be the event whose handling was suspended and its corresponding reply event, respectively.\n- **suspendCurrentAppleEvent()**: Suspends the handling of the current event and returns an ID that must be used to resume the handling of the event if an Apple event is being handled on the current thread.\n\n",
  "sections" : [
    {
      "content" : "",
      "items" : [
        {
          "description" : "Given a nonzero `suspensionID` returned by an invocation of [doc:\/\/com.apple.foundation\/documentation\/Foundation\/NSAppleEventManager\/suspendCurrentAppleEvent()], returns the descriptor for the event whose handling was suspended.",
          "name" : "appleEvent(forSuspensionID:)",
          "url" : "https:\/\/developer.apple.com\/documentation\/Foundation\/NSAppleEventManager\/appleEvent(forSuspensionID:)"
        },
        {
          "description" : "Returns the descriptor for `currentAppleEvent` if an Apple event is being handled on the current thread.",
          "name" : "currentAppleEvent",
          "url" : "https:\/\/developer.apple.com\/documentation\/Foundation\/NSAppleEventManager\/currentAppleEvent"
        },
        {
          "description" : "Returns the corresponding reply event descriptor if an Apple event is being handled on the current thread.",
          "name" : "currentReplyAppleEvent",
          "url" : "https:\/\/developer.apple.com\/documentation\/Foundation\/NSAppleEventManager\/currentReplyAppleEvent"
        },
        {
          "description" : "Given a nonzero `suspensionID` returned by an invocation of [doc:\/\/com.apple.foundation\/documentation\/Foundation\/NSAppleEventManager\/suspendCurrentAppleEvent()], returns the corresponding reply event descriptor.",
          "name" : "replyAppleEvent(forSuspensionID:)",
          "url" : "https:\/\/developer.apple.com\/documentation\/Foundation\/NSAppleEventManager\/replyAppleEvent(forSuspensionID:)"
        },
        {
          "description" : "Given a nonzero `suspensionID` returned by an invocation of [doc:\/\/com.apple.foundation\/documentation\/Foundation\/NSAppleEventManager\/suspendCurrentAppleEvent()], signal that handling of the suspended event may now continue.",
          "name" : "resume(withSuspensionID:)",
          "url" : "https:\/\/developer.apple.com\/documentation\/Foundation\/NSAppleEventManager\/resume(withSuspensionID:)"
        },
        {
          "description" : "Given a nonzero `suspensionID` returned by an invocation of [doc:\/\/com.apple.foundation\/documentation\/Foundation\/NSAppleEventManager\/suspendCurrentAppleEvent()], sets the values that will be returned by subsequent invocations of [doc:\/\/com.apple.foundation\/documentation\/Foundation\/NSAppleEventManager\/currentAppleEvent] and [doc:\/\/com.apple.foundation\/documentation\/Foundation\/NSAppleEventManager\/currentReplyAppleEvent] to be the event whose handling was suspended and its corresponding reply event, respectively.",
          "name" : "setCurrentAppleEventAndReplyEventWithSuspensionID(_:)",
          "url" : "https:\/\/developer.apple.com\/documentation\/Foundation\/NSAppleEventManager\/setCurrentAppleEventAndReplyEventWithSuspensionID(_:)"
        },
        {
          "description" : "Suspends the handling of the current event and returns an ID that must be used to resume the handling of the event if an Apple event is being handled on the current thread.",
          "name" : "suspendCurrentAppleEvent()",
          "url" : "https:\/\/developer.apple.com\/documentation\/Foundation\/NSAppleEventManager\/suspendCurrentAppleEvent()"
        }
      ],
      "title" : "Suspending and resuming Apple events"
    }
  ],
  "source" : "appleJSON",
  "title" : "NSAppleEventManager.SuspensionID",
  "url" : "https:\/\/developer.apple.com\/documentation\/Foundation\/NSAppleEventManager\/SuspensionID"
}