{
  "abstract" : "The details of a coordinated-read or coordinated-write operation.",
  "codeExamples" : [

  ],
  "conformsTo" : [
    "CVarArg",
    "CustomDebugStringConvertible",
    "CustomStringConvertible",
    "Equatable",
    "Hashable",
    "NSObjectProtocol",
    "Sendable",
    "SendableMetatype"
  ],
  "contentHash" : "9a11764ec38ef9fe15a5273063c213376a2b2883e5936ff89ca46ced80d56d4c",
  "crawledAt" : "2025-12-04T17:55:32Z",
  "declaration" : {
    "code" : "class NSFileAccessIntent",
    "language" : "swift"
  },
  "id" : "E882A058-BF9A-4C35-BE8A-7A5C2A768037",
  "kind" : "class",
  "language" : "swift",
  "module" : "Foundation",
  "overview" : "## Overview\n\nUse this class when performing asynchronous operations with a file coordinator using the coordinator’s [doc:\/\/com.apple.foundation\/documentation\/Foundation\/NSFileCoordinator\/coordinate(with:queue:byAccessor:)] method.",
  "platforms" : [
    "iOS",
    "iPadOS",
    "Mac Catalyst",
    "macOS",
    "tvOS",
    "visionOS",
    "watchOS"
  ],
  "rawMarkdown" : "---\nsource: https:\/\/developer.apple.com\/documentation\/Foundation\/NSFileAccessIntent\ncrawled: 2025-12-04T17:55:32Z\n---\n\n# NSFileAccessIntent\n\n**Class**\n\nThe details of a coordinated-read or coordinated-write operation.\n\n## Declaration\n\n```swift\nclass NSFileAccessIntent\n```\n\n## Overview\n\nUse this class when performing asynchronous operations with a file coordinator using the coordinator’s [doc:\/\/com.apple.foundation\/documentation\/Foundation\/NSFileCoordinator\/coordinate(with:queue:byAccessor:)] method.\n\n## Creating a File Access Intent\n\n- **readingIntent(with:options:)**: Returns a file access intent object for reading the given URL with the provided options.\n- **writingIntent(with:options:)**: Returns a file access intent object for writing to the given URL with the provided options.\n\n## Accessing the Current URL\n\n- **url**: The current URL for the item managed by the file access intent instance. (read-only)\n\n## Coordinated file access\n\n- **NSFilePresenter**: The interface a file coordinator uses to inform an object presenting a file about changes to that file made elsewhere in the system.\n- **NSFileCoordinator**: An object that coordinates the reading and writing of files and directories among file presenters.\n\n## Inherits From\n\n- NSObject\n\n## Conforms To\n\n- CVarArg\n- CustomDebugStringConvertible\n- CustomStringConvertible\n- Equatable\n- Hashable\n- NSObjectProtocol\n- Sendable\n- SendableMetatype\n\n",
  "sections" : [
    {
      "content" : "",
      "items" : [
        {
          "description" : "Returns a file access intent object for reading the given URL with the provided options.",
          "name" : "readingIntent(with:options:)",
          "url" : "https:\/\/developer.apple.com\/documentation\/Foundation\/NSFileAccessIntent\/readingIntent(with:options:)"
        },
        {
          "description" : "Returns a file access intent object for writing to the given URL with the provided options.",
          "name" : "writingIntent(with:options:)",
          "url" : "https:\/\/developer.apple.com\/documentation\/Foundation\/NSFileAccessIntent\/writingIntent(with:options:)"
        }
      ],
      "title" : "Creating a File Access Intent"
    },
    {
      "content" : "",
      "items" : [
        {
          "description" : "The current URL for the item managed by the file access intent instance. (read-only)",
          "name" : "url",
          "url" : "https:\/\/developer.apple.com\/documentation\/Foundation\/NSFileAccessIntent\/url"
        }
      ],
      "title" : "Accessing the Current URL"
    },
    {
      "content" : "",
      "items" : [
        {
          "description" : "The interface a file coordinator uses to inform an object presenting a file about changes to that file made elsewhere in the system.",
          "name" : "NSFilePresenter",
          "url" : "https:\/\/developer.apple.com\/documentation\/Foundation\/NSFilePresenter"
        },
        {
          "description" : "An object that coordinates the reading and writing of files and directories among file presenters.",
          "name" : "NSFileCoordinator",
          "url" : "https:\/\/developer.apple.com\/documentation\/Foundation\/NSFileCoordinator"
        }
      ],
      "title" : "Coordinated file access"
    },
    {
      "content" : "",
      "items" : [
        {
          "name" : "NSObject"
        }
      ],
      "title" : "Inherits From"
    }
  ],
  "source" : "appleJSON",
  "title" : "NSFileAccessIntent",
  "url" : "https:\/\/developer.apple.com\/documentation\/Foundation\/NSFileAccessIntent"
}