{
  "abstract" : "Incorporate a custom PencilKit tool picker with a variety of system and custom tools into a drawing app.",
  "codeExamples" : [
    {
      "code" : "let penWidth = PKInkingTool.InkType.pen.defaultWidth\nlet secondPen = PKToolPickerInkingItem(type: .pen,\n                                       color: toolPickerRed,\n                                       width: penWidth,\n                                       identifier: \"com.example.apple-samplecode.second-pen\")",
      "language" : "swift"
    },
    {
      "code" : "let identifier = \"com.example.apple-samplecode.animal-stamp\"\nlet name = NSLocalizedString(\"Animal Stamp\", comment: \"Name of the animal stamp tool\")\nvar config = PKToolPickerCustomItem.Configuration(identifier: identifier, name: name)",
      "language" : "swift"
    },
    {
      "code" : "config.imageProvider = { item in\n    return ImageProvider.shared.drawImage(color: item.color,\n                                          width: item.width,\n                                          attributeImage: attributeVC.attributeModel.selectedAttribute.image)\n}",
      "language" : "swift"
    },
    {
      "code" : "config.viewControllerProvider = { item in\n    attributeVC.attributeModel.color = item.color\n    attributeVC.reload()\n    return attributeVC\n}",
      "language" : "swift"
    },
    {
      "code" : "let toolItems = [self.animalStampWrapper.toolItem, secondPen] + PKToolPicker().toolItems\n\nself.toolPicker = PKToolPicker(toolItems: toolItems)",
      "language" : "swift"
    },
    {
      "code" : "toolPicker.accessoryItem = UIBarButtonItem(image: UIImage(systemName: \"signature\"), primaryAction: UIAction(handler: { [self] _ in\n    self.signDrawing(sender: nil)\n}))",
      "language" : "swift"
    },
    {
      "code" : "let point = sender.location(in: stampView)\n\/\/ Subtract the `rollAngle` instead of adding it, because it's defined to go in the opposite\n\/\/ direction from `azimuthAngle`.\nlet angleInRadians = sender.azimuthAngle(in: sender.view) - sender.rollAngle\n\nswitch sender.state {\ncase .changed:\n    hoverPreviewView?.removeFromSuperview()\n    hoverPreviewView = nil\n    if let imageView = animalStampWrapper.stampImageView(for: point, angleInRadians: angleInRadians) {\n        imageView.alpha = 0.5\n        stampView.addSubview(imageView)\n        hoverPreviewView = imageView\n    } else {\n        hoverPreviewView = nil\n    }\ndefault:\n    hoverPreviewView?.removeFromSuperview()\n    hoverPreviewView = nil\n}",
      "language" : "swift"
    }
  ],
  "contentHash" : "8b2a68bff3e22b04b80f6ee6bb70265c4e5fc99fa0c703aa799aacf56679c891",
  "crawledAt" : "2025-12-02T15:46:50Z",
  "id" : "5187F930-C784-4E66-8919-45427CB689ED",
  "kind" : "unknown",
  "language" : "swift",
  "module" : "PencilKit",
  "overview" : "## Overview\n\nThis sample app shows how to configure a [doc:\/\/com.apple.pencilkit\/documentation\/PencilKit\/PKToolPicker]. The app is a simple drawing tool that allows a person to draw on a canvas using tools from the tool picker. In addition to showing system tools, the tool picker provides a custom tool that a person can use to place stamps on the canvas. The tool picker also contains an accessory item for adding a signature to the canvas.\n\n### Configure the sample code project\n\nAlthough this sample app’s basic functionality is available in Simulator, running the project with physical devices is recommended to demonstrate the full capabilities of the hardware. Run this project with Apple Pencil Pro and a compatible iPad.\n\n### Create a system tool\n\nThis sample app creates and configures a system tool to show in the tool picker: a pen, which is a [doc:\/\/com.apple.pencilkit\/documentation\/PencilKit\/PKToolPickerInkingItem] with the [doc:\/\/com.apple.pencilkit\/documentation\/PencilKit\/PKInkingTool-swift.struct\/InkType-swift.enum\/pen] ink type.\n\nThis sample app uses an `identifier` to differentiate between this pen and the default system pen so they can both show up in the picker. If you don’t specify an identifier to differentiate between multiple system tools of the same type, the picker treats those tool items as duplicates and only shows the first item in the list.\n\n### Create a custom tool\n\nThe PencilKit tool picker can contain a combination of system tools and custom tools. To add a custom tool to the picker, this sample app creates a [doc:\/\/com.apple.pencilkit\/documentation\/PencilKit\/PKToolPickerCustomItem\/Configuration-swift.struct] to define details about the custom tool. This sample app creates a custom tool to place stamps in the shape of animals on the canvas.\n\nThe [doc:\/\/com.apple.pencilkit\/documentation\/PencilKit\/PKToolPickerCustomItem\/Configuration-swift.struct\/imageProvider] is a closure that generates an image for the custom tool. The system automatically calls this closure to fetch a new image for the custom tool when PencilKit attributes like color or width change. If a custom tool has additional custom properties that affect the appearance of the tool, fetch a new image manually by calling [doc:\/\/com.apple.pencilkit\/documentation\/PencilKit\/PKToolPickerCustomItem\/reloadImage()] when those properties change.\n\nThe [doc:\/\/com.apple.pencilkit\/documentation\/PencilKit\/PKToolPickerCustomItem\/Configuration-swift.struct\/viewControllerProvider] is a closure that provides an additional view controller to display above the system controls in the tool attributes popover. In this sample app, this view controller shows additional customization options for the stamp tool, like being able to choose which animal to use for the custom stamp tool.\n\n### Specify the order of the tools in the picker\n\nTools in the tool picker can appear in any order you specify when you create the picker using [doc:\/\/com.apple.pencilkit\/documentation\/PencilKit\/PKToolPicker\/init(toolItems:)]. This sample app places the custom tool item first, but it can appear in any order in the `toolItems` array. After the custom tool item, this sample app adds the second pen and the default set of `PKToolPicker` tools.\n\n### Add an accessory item\n\nAn [doc:\/\/com.apple.pencilkit\/documentation\/PencilKit\/PKToolPicker\/accessoryItem] adds an optional button to the tool picker to provide quick access to additional behavior. This sample app adds an accessory item that allows placing a signature on the canvas.\n\n### Draw a hover preview for tools\n\nA hover preview can provide useful feedback about where a tool might touch down on the canvas. This sample app checks the value of [https:\/\/developer.apple.com\/documentation\/uikit\/uipencilinteraction\/4375593-prefershovertoolpreview] to see the user preference for displaying a hover tool preview, and uses that to determine whether to draw the preview. Then, it draws the preview view in response to the state of a [https:\/\/developer.apple.com\/documentation\/uikit\/uihovergesturerecognizer] gesture. This sample app uses [https:\/\/developer.apple.com\/documentation\/uikit\/uihovergesturerecognizer\/4391655-rollangle] to rotate the preview view in response to the barrel-roll angle of Apple Pencil Pro.",
  "rawMarkdown" : "---\nsource: https:\/\/developer.apple.com\/documentation\/PencilKit\/configuring-the-pencilkit-tool-picker\ncrawled: 2025-12-02T15:46:50Z\n---\n\n# Configuring the PencilKit tool picker\n\n**Sample Code**\n\nIncorporate a custom PencilKit tool picker with a variety of system and custom tools into a drawing app.\n\n## Overview\n\nThis sample app shows how to configure a [doc:\/\/com.apple.pencilkit\/documentation\/PencilKit\/PKToolPicker]. The app is a simple drawing tool that allows a person to draw on a canvas using tools from the tool picker. In addition to showing system tools, the tool picker provides a custom tool that a person can use to place stamps on the canvas. The tool picker also contains an accessory item for adding a signature to the canvas.\n\n\n\n### Configure the sample code project\n\nAlthough this sample app’s basic functionality is available in Simulator, running the project with physical devices is recommended to demonstrate the full capabilities of the hardware. Run this project with Apple Pencil Pro and a compatible iPad.\n\n### Create a system tool\n\nThis sample app creates and configures a system tool to show in the tool picker: a pen, which is a [doc:\/\/com.apple.pencilkit\/documentation\/PencilKit\/PKToolPickerInkingItem] with the [doc:\/\/com.apple.pencilkit\/documentation\/PencilKit\/PKInkingTool-swift.struct\/InkType-swift.enum\/pen] ink type.\n\n```swift\nlet penWidth = PKInkingTool.InkType.pen.defaultWidth\nlet secondPen = PKToolPickerInkingItem(type: .pen,\n                                       color: toolPickerRed,\n                                       width: penWidth,\n                                       identifier: \"com.example.apple-samplecode.second-pen\")\n```\n\nThis sample app uses an `identifier` to differentiate between this pen and the default system pen so they can both show up in the picker. If you don’t specify an identifier to differentiate between multiple system tools of the same type, the picker treats those tool items as duplicates and only shows the first item in the list.\n\n### Create a custom tool\n\nThe PencilKit tool picker can contain a combination of system tools and custom tools. To add a custom tool to the picker, this sample app creates a [doc:\/\/com.apple.pencilkit\/documentation\/PencilKit\/PKToolPickerCustomItem\/Configuration-swift.struct] to define details about the custom tool. This sample app creates a custom tool to place stamps in the shape of animals on the canvas.\n\n```swift\nlet identifier = \"com.example.apple-samplecode.animal-stamp\"\nlet name = NSLocalizedString(\"Animal Stamp\", comment: \"Name of the animal stamp tool\")\nvar config = PKToolPickerCustomItem.Configuration(identifier: identifier, name: name)\n```\n\nThe [doc:\/\/com.apple.pencilkit\/documentation\/PencilKit\/PKToolPickerCustomItem\/Configuration-swift.struct\/imageProvider] is a closure that generates an image for the custom tool. The system automatically calls this closure to fetch a new image for the custom tool when PencilKit attributes like color or width change. If a custom tool has additional custom properties that affect the appearance of the tool, fetch a new image manually by calling [doc:\/\/com.apple.pencilkit\/documentation\/PencilKit\/PKToolPickerCustomItem\/reloadImage()] when those properties change.\n\n```swift\nconfig.imageProvider = { item in\n    return ImageProvider.shared.drawImage(color: item.color,\n                                          width: item.width,\n                                          attributeImage: attributeVC.attributeModel.selectedAttribute.image)\n}\n```\n\nThe [doc:\/\/com.apple.pencilkit\/documentation\/PencilKit\/PKToolPickerCustomItem\/Configuration-swift.struct\/viewControllerProvider] is a closure that provides an additional view controller to display above the system controls in the tool attributes popover. In this sample app, this view controller shows additional customization options for the stamp tool, like being able to choose which animal to use for the custom stamp tool.\n\n```swift\nconfig.viewControllerProvider = { item in\n    attributeVC.attributeModel.color = item.color\n    attributeVC.reload()\n    return attributeVC\n}\n```\n\n### Specify the order of the tools in the picker\n\nTools in the tool picker can appear in any order you specify when you create the picker using [doc:\/\/com.apple.pencilkit\/documentation\/PencilKit\/PKToolPicker\/init(toolItems:)]. This sample app places the custom tool item first, but it can appear in any order in the `toolItems` array. After the custom tool item, this sample app adds the second pen and the default set of `PKToolPicker` tools.\n\n```swift\nlet toolItems = [self.animalStampWrapper.toolItem, secondPen] + PKToolPicker().toolItems\n\nself.toolPicker = PKToolPicker(toolItems: toolItems)\n```\n\n### Add an accessory item\n\nAn [doc:\/\/com.apple.pencilkit\/documentation\/PencilKit\/PKToolPicker\/accessoryItem] adds an optional button to the tool picker to provide quick access to additional behavior. This sample app adds an accessory item that allows placing a signature on the canvas.\n\n```swift\ntoolPicker.accessoryItem = UIBarButtonItem(image: UIImage(systemName: \"signature\"), primaryAction: UIAction(handler: { [self] _ in\n    self.signDrawing(sender: nil)\n}))\n```\n\n### Draw a hover preview for tools\n\nA hover preview can provide useful feedback about where a tool might touch down on the canvas. This sample app checks the value of [https:\/\/developer.apple.com\/documentation\/uikit\/uipencilinteraction\/4375593-prefershovertoolpreview] to see the user preference for displaying a hover tool preview, and uses that to determine whether to draw the preview. Then, it draws the preview view in response to the state of a [https:\/\/developer.apple.com\/documentation\/uikit\/uihovergesturerecognizer] gesture. This sample app uses [https:\/\/developer.apple.com\/documentation\/uikit\/uihovergesturerecognizer\/4391655-rollangle] to rotate the preview view in response to the barrel-roll angle of Apple Pencil Pro.\n\n```swift\nlet point = sender.location(in: stampView)\n\/\/ Subtract the `rollAngle` instead of adding it, because it's defined to go in the opposite\n\/\/ direction from `azimuthAngle`.\nlet angleInRadians = sender.azimuthAngle(in: sender.view) - sender.rollAngle\n\nswitch sender.state {\ncase .changed:\n    hoverPreviewView?.removeFromSuperview()\n    hoverPreviewView = nil\n    if let imageView = animalStampWrapper.stampImageView(for: point, angleInRadians: angleInRadians) {\n        imageView.alpha = 0.5\n        stampView.addSubview(imageView)\n        hoverPreviewView = imageView\n    } else {\n        hoverPreviewView = nil\n    }\ndefault:\n    hoverPreviewView?.removeFromSuperview()\n    hoverPreviewView = nil\n}\n```\n\n## Tools\n\n- **PKToolPicker**: A tool palette that displays a selection of drawing tools and colors for tools that a person can choose from.\n- **PKInkingTool**: A structure that defines the drawing characteristics (width, color, pen style) to use when drawing lines on a canvas view.\n- **PKEraserTool**: A tool for erasing previously drawn content in a canvas view.\n- **PKLassoTool**: A tool for selecting stroked lines and shapes in a canvas view.\n- **PKTool**: An interface adopted by drawing and writing tools used by a canvas view.\n\n",
  "sections" : [
    {
      "content" : "",
      "items" : [
        {
          "description" : "A tool palette that displays a selection of drawing tools and colors for tools that a person can choose from.",
          "name" : "PKToolPicker",
          "url" : "https:\/\/developer.apple.com\/documentation\/PencilKit\/PKToolPicker"
        },
        {
          "description" : "A structure that defines the drawing characteristics (width, color, pen style) to use when drawing lines on a canvas view.",
          "name" : "PKInkingTool",
          "url" : "https:\/\/developer.apple.com\/documentation\/PencilKit\/PKInkingTool-swift.struct"
        },
        {
          "description" : "A tool for erasing previously drawn content in a canvas view.",
          "name" : "PKEraserTool",
          "url" : "https:\/\/developer.apple.com\/documentation\/PencilKit\/PKEraserTool-swift.struct"
        },
        {
          "description" : "A tool for selecting stroked lines and shapes in a canvas view.",
          "name" : "PKLassoTool",
          "url" : "https:\/\/developer.apple.com\/documentation\/PencilKit\/PKLassoTool-swift.struct"
        },
        {
          "description" : "An interface adopted by drawing and writing tools used by a canvas view.",
          "name" : "PKTool",
          "url" : "https:\/\/developer.apple.com\/documentation\/PencilKit\/PKTool-swift.protocol"
        }
      ],
      "title" : "Tools"
    }
  ],
  "source" : "appleJSON",
  "title" : "Configuring the PencilKit tool picker",
  "url" : "https:\/\/developer.apple.com\/documentation\/PencilKit\/configuring-the-pencilkit-tool-picker"
}