{
  "abstract" : "A tool palette that displays a selection of drawing tools and colors for tools that a person can choose from.",
  "codeExamples" : [

  ],
  "conformsTo" : [
    "CVarArg",
    "CustomDebugStringConvertible",
    "CustomStringConvertible",
    "Equatable",
    "Hashable",
    "NSObjectProtocol"
  ],
  "contentHash" : "da783c35bc2ed6385686d0343fb581e3e04137d107a0e98dcef36a8a23880e80",
  "crawledAt" : "2025-12-02T16:06:38Z",
  "declaration" : {
    "code" : "class PKToolPicker",
    "language" : "swift"
  },
  "id" : "29872DC3-F498-49B5-938A-769FF91703AE",
  "kind" : "class",
  "language" : "swift",
  "module" : "PencilKit",
  "overview" : "## Overview\n\nA [doc:\/\/com.apple.pencilkit\/documentation\/PencilKit\/PKToolPicker] manages a draggable palette that displays drawing tools, colors, and additional options. You add a tool picker to your interface and configure it to display its palette at appropriate times. While the palette is onscreen, a person may reposition it anywhere within the current window. When a person interacts with the palette, the tool picker notifies registered observers of the changes so that they can respond.\n\nWhen configuring your interface, call the [doc:\/\/com.apple.pencilkit\/documentation\/PencilKit\/PKToolPicker\/setVisible(_:forFirstResponder:)] method to associate the tool picker with one or more views in your interface. Each window manages its own tool picker, and the window’s first responder determines the visibility of that tool picker. When one of the registered objects becomes first responder, the tool picker automatically adds its palette view to the current window. When there isn’t a registered object as first responder, the tool picker hides its palette view.\n\n[doc:\/\/com.apple.pencilkit\/documentation\/PencilKit\/PKCanvasView] implements the observer protocol for detecting tool picker changes. Adding your canvas view as an observer to a tool picker automatically updates the current drawing tools. For more information about implementing custom observer objects, see [doc:\/\/com.apple.pencilkit\/documentation\/PencilKit\/PKToolPickerObserver].",
  "platforms" : [
    "iOS",
    "iPadOS",
    "Mac Catalyst",
    "visionOS"
  ],
  "rawMarkdown" : "---\nsource: https:\/\/developer.apple.com\/documentation\/PencilKit\/PKToolPicker\ncrawled: 2025-12-02T16:06:38Z\n---\n\n# PKToolPicker\n\n**Class**\n\nA tool palette that displays a selection of drawing tools and colors for tools that a person can choose from.\n\n## Declaration\n\n```swift\nclass PKToolPicker\n```\n\n## Overview\n\nA [doc:\/\/com.apple.pencilkit\/documentation\/PencilKit\/PKToolPicker] manages a draggable palette that displays drawing tools, colors, and additional options. You add a tool picker to your interface and configure it to display its palette at appropriate times. While the palette is onscreen, a person may reposition it anywhere within the current window. When a person interacts with the palette, the tool picker notifies registered observers of the changes so that they can respond.\n\n\n\nWhen configuring your interface, call the [doc:\/\/com.apple.pencilkit\/documentation\/PencilKit\/PKToolPicker\/setVisible(_:forFirstResponder:)] method to associate the tool picker with one or more views in your interface. Each window manages its own tool picker, and the window’s first responder determines the visibility of that tool picker. When one of the registered objects becomes first responder, the tool picker automatically adds its palette view to the current window. When there isn’t a registered object as first responder, the tool picker hides its palette view.\n\n[doc:\/\/com.apple.pencilkit\/documentation\/PencilKit\/PKCanvasView] implements the observer protocol for detecting tool picker changes. Adding your canvas view as an observer to a tool picker automatically updates the current drawing tools. For more information about implementing custom observer objects, see [doc:\/\/com.apple.pencilkit\/documentation\/PencilKit\/PKToolPickerObserver].\n\n## Creating a tool picker\n\n- **init()**: Creates a new tool picker with a default set of tools.\n- **init(toolItems:)**: Creates a new tool picker with the tools you specify.\n- **PKToolPickerInkingItem**: An item that represents an inking tool in the tool picker.\n- **PKToolPickerEraserItem**: An item that represents an eraser tool in the tool picker.\n- **PKToolPickerLassoItem**: An item that represents a lasso tool in the tool picker.\n- **PKToolPickerRulerItem**: An item that represents a ruler tool in the tool picker.\n- **PKToolPickerScribbleItem**: An item that represents a Scribble tool in the tool picker.\n- **PKToolPickerCustomItem**: An item that represents a custom tool in the tool picker.\n- **PKToolPickerItem**: The base class for an item in the tool picker.\n\n## Accessing the picker’s tools\n\n- **toolItems**: All tool items in the tool picker.\n\n## Detecting changes to the picker\n\n- **addObserver(_:)**: Adds the specified object to the list of objects to notify when the picker configuration changes.\n- **removeObserver(_:)**: Removes the specified object from the list of objects to notify when the picker configuration changes.\n- **PKToolPickerObserver**: An interface you use to detect when the user changes the selected tools and drawing characteristics of a tool picker object.\n\n## Coordinating the visibility of the picker\n\n- **setVisible(_:forFirstResponder:)**: Sets the visibility for the tool picker, based on when the specified responder object becomes active.\n- **isVisible**: A Boolean value that indicates whether the tool picker is currently visible.\n- **frameObscured(in:)**: Returns the portion of the specified view that the tool picker obscures.\n\n## Managing selected tools\n\n- **selectedToolItem**: The currently selected tool item in the tool picker.\n- **selectedToolItemIdentifier**: The identifier of the selected tool item in the tool picker.\n\n## Customizing picker behavior\n\n- **isRulerActive**: A Boolean value that indicates whether the ruler is visible on the canvas.\n- **colorUserInterfaceStyle**: The user interface style for the tool picker.\n- **overrideUserInterfaceStyle**: The specific user interface style to apply to the tool picker.\n- **showsDrawingPolicyControls**: A Boolean value that indicates whether the default drawing policy UI is visible.\n- **stateAutosaveName**: The name used to automatically save the tool picker’s state in the defaults system.\n\n## Configuring the accessory item\n\n- **accessoryItem**: An optional button that appears at the trailing edge of the tool picker.\n\n## Supporting PencilKit versions\n\n- **maximumSupportedContentVersion**: The maximum version of PencilKit to support.\n\n## Deprecated\n\n- **shared(for:)**: Returns the tool picker object to use for the specified window.\n- **selectedTool**: The currently selected tool in the tool picker.\n\n## Protocols\n\n- **PKToolPicker.Delegate**\n\n## Instance Properties\n\n- **colorMaximumLinearExposure**: Maximum linear exposure for the color picker used by the tool picker. Can be used to enable picking HDR colors.\n- **delegate**: The delegate for the tool picker.\n- **prefersDismissControlVisible**: If this is true the tool picker may show UI that allows dismissing it. If this is false the tool picker will not show this UI. By default this resigns first responder, but is customizable by `PKToolPickerDelegate`’s `toolPickerWillDismiss...` method.\n\n## Type Properties\n\n- **defaultToolItems**: The default tool items for new tool pickers.\n\n## Tools\n\n- **Configuring the PencilKit tool picker**: Incorporate a custom PencilKit tool picker with a variety of system and custom tools into a drawing app.\n- **PKInkingTool**: A structure that defines the drawing characteristics (width, color, pen style) to use when drawing lines on a canvas view.\n- **PKEraserTool**: A tool for erasing previously drawn content in a canvas view.\n- **PKLassoTool**: A tool for selecting stroked lines and shapes in a canvas view.\n- **PKTool**: An interface adopted by drawing and writing tools used by a canvas view.\n\n## Inherits From\n\n- NSObject\n\n## Conforms To\n\n- CVarArg\n- CustomDebugStringConvertible\n- CustomStringConvertible\n- Equatable\n- Hashable\n- NSObjectProtocol\n\n",
  "sections" : [
    {
      "content" : "",
      "items" : [
        {
          "description" : "Creates a new tool picker with a default set of tools.",
          "name" : "init()",
          "url" : "https:\/\/developer.apple.com\/documentation\/PencilKit\/PKToolPicker\/init()"
        },
        {
          "description" : "Creates a new tool picker with the tools you specify.",
          "name" : "init(toolItems:)",
          "url" : "https:\/\/developer.apple.com\/documentation\/PencilKit\/PKToolPicker\/init(toolItems:)"
        },
        {
          "description" : "An item that represents an inking tool in the tool picker.",
          "name" : "PKToolPickerInkingItem",
          "url" : "https:\/\/developer.apple.com\/documentation\/PencilKit\/PKToolPickerInkingItem"
        },
        {
          "description" : "An item that represents an eraser tool in the tool picker.",
          "name" : "PKToolPickerEraserItem",
          "url" : "https:\/\/developer.apple.com\/documentation\/PencilKit\/PKToolPickerEraserItem"
        },
        {
          "description" : "An item that represents a lasso tool in the tool picker.",
          "name" : "PKToolPickerLassoItem",
          "url" : "https:\/\/developer.apple.com\/documentation\/PencilKit\/PKToolPickerLassoItem"
        },
        {
          "description" : "An item that represents a ruler tool in the tool picker.",
          "name" : "PKToolPickerRulerItem",
          "url" : "https:\/\/developer.apple.com\/documentation\/PencilKit\/PKToolPickerRulerItem"
        },
        {
          "description" : "An item that represents a Scribble tool in the tool picker.",
          "name" : "PKToolPickerScribbleItem",
          "url" : "https:\/\/developer.apple.com\/documentation\/PencilKit\/PKToolPickerScribbleItem"
        },
        {
          "description" : "An item that represents a custom tool in the tool picker.",
          "name" : "PKToolPickerCustomItem",
          "url" : "https:\/\/developer.apple.com\/documentation\/PencilKit\/PKToolPickerCustomItem"
        },
        {
          "description" : "The base class for an item in the tool picker.",
          "name" : "PKToolPickerItem",
          "url" : "https:\/\/developer.apple.com\/documentation\/PencilKit\/PKToolPickerItem"
        }
      ],
      "title" : "Creating a tool picker"
    },
    {
      "content" : "",
      "items" : [
        {
          "description" : "All tool items in the tool picker.",
          "name" : "toolItems",
          "url" : "https:\/\/developer.apple.com\/documentation\/PencilKit\/PKToolPicker\/toolItems"
        }
      ],
      "title" : "Accessing the picker’s tools"
    },
    {
      "content" : "",
      "items" : [
        {
          "description" : "Adds the specified object to the list of objects to notify when the picker configuration changes.",
          "name" : "addObserver(_:)",
          "url" : "https:\/\/developer.apple.com\/documentation\/PencilKit\/PKToolPicker\/addObserver(_:)"
        },
        {
          "description" : "Removes the specified object from the list of objects to notify when the picker configuration changes.",
          "name" : "removeObserver(_:)",
          "url" : "https:\/\/developer.apple.com\/documentation\/PencilKit\/PKToolPicker\/removeObserver(_:)"
        },
        {
          "description" : "An interface you use to detect when the user changes the selected tools and drawing characteristics of a tool picker object.",
          "name" : "PKToolPickerObserver",
          "url" : "https:\/\/developer.apple.com\/documentation\/PencilKit\/PKToolPickerObserver"
        }
      ],
      "title" : "Detecting changes to the picker"
    },
    {
      "content" : "",
      "items" : [
        {
          "description" : "Sets the visibility for the tool picker, based on when the specified responder object becomes active.",
          "name" : "setVisible(_:forFirstResponder:)",
          "url" : "https:\/\/developer.apple.com\/documentation\/PencilKit\/PKToolPicker\/setVisible(_:forFirstResponder:)"
        },
        {
          "description" : "A Boolean value that indicates whether the tool picker is currently visible.",
          "name" : "isVisible",
          "url" : "https:\/\/developer.apple.com\/documentation\/PencilKit\/PKToolPicker\/isVisible"
        },
        {
          "description" : "Returns the portion of the specified view that the tool picker obscures.",
          "name" : "frameObscured(in:)",
          "url" : "https:\/\/developer.apple.com\/documentation\/PencilKit\/PKToolPicker\/frameObscured(in:)"
        }
      ],
      "title" : "Coordinating the visibility of the picker"
    },
    {
      "content" : "",
      "items" : [
        {
          "description" : "The currently selected tool item in the tool picker.",
          "name" : "selectedToolItem",
          "url" : "https:\/\/developer.apple.com\/documentation\/PencilKit\/PKToolPicker\/selectedToolItem"
        },
        {
          "description" : "The identifier of the selected tool item in the tool picker.",
          "name" : "selectedToolItemIdentifier",
          "url" : "https:\/\/developer.apple.com\/documentation\/PencilKit\/PKToolPicker\/selectedToolItemIdentifier"
        }
      ],
      "title" : "Managing selected tools"
    },
    {
      "content" : "",
      "items" : [
        {
          "description" : "A Boolean value that indicates whether the ruler is visible on the canvas.",
          "name" : "isRulerActive",
          "url" : "https:\/\/developer.apple.com\/documentation\/PencilKit\/PKToolPicker\/isRulerActive"
        },
        {
          "description" : "The user interface style for the tool picker.",
          "name" : "colorUserInterfaceStyle",
          "url" : "https:\/\/developer.apple.com\/documentation\/PencilKit\/PKToolPicker\/colorUserInterfaceStyle"
        },
        {
          "description" : "The specific user interface style to apply to the tool picker.",
          "name" : "overrideUserInterfaceStyle",
          "url" : "https:\/\/developer.apple.com\/documentation\/PencilKit\/PKToolPicker\/overrideUserInterfaceStyle"
        },
        {
          "description" : "A Boolean value that indicates whether the default drawing policy UI is visible.",
          "name" : "showsDrawingPolicyControls",
          "url" : "https:\/\/developer.apple.com\/documentation\/PencilKit\/PKToolPicker\/showsDrawingPolicyControls"
        },
        {
          "description" : "The name used to automatically save the tool picker’s state in the defaults system.",
          "name" : "stateAutosaveName",
          "url" : "https:\/\/developer.apple.com\/documentation\/PencilKit\/PKToolPicker\/stateAutosaveName"
        }
      ],
      "title" : "Customizing picker behavior"
    },
    {
      "content" : "",
      "items" : [
        {
          "description" : "An optional button that appears at the trailing edge of the tool picker.",
          "name" : "accessoryItem",
          "url" : "https:\/\/developer.apple.com\/documentation\/PencilKit\/PKToolPicker\/accessoryItem"
        }
      ],
      "title" : "Configuring the accessory item"
    },
    {
      "content" : "",
      "items" : [
        {
          "description" : "The maximum version of PencilKit to support.",
          "name" : "maximumSupportedContentVersion",
          "url" : "https:\/\/developer.apple.com\/documentation\/PencilKit\/PKToolPicker\/maximumSupportedContentVersion"
        }
      ],
      "title" : "Supporting PencilKit versions"
    },
    {
      "content" : "",
      "items" : [
        {
          "description" : "Returns the tool picker object to use for the specified window.",
          "name" : "shared(for:)",
          "url" : "https:\/\/developer.apple.com\/documentation\/PencilKit\/PKToolPicker\/shared(for:)"
        },
        {
          "description" : "The currently selected tool in the tool picker.",
          "name" : "selectedTool",
          "url" : "https:\/\/developer.apple.com\/documentation\/PencilKit\/PKToolPicker\/selectedTool-2lptq"
        }
      ],
      "title" : "Deprecated"
    },
    {
      "content" : "",
      "items" : [
        {
          "description" : "",
          "name" : "PKToolPicker.Delegate",
          "url" : "https:\/\/developer.apple.com\/documentation\/PencilKit\/PKToolPicker\/Delegate-swift.protocol"
        }
      ],
      "title" : "Protocols"
    },
    {
      "content" : "",
      "items" : [
        {
          "description" : "Maximum linear exposure for the color picker used by the tool picker. Can be used to enable picking HDR colors.",
          "name" : "colorMaximumLinearExposure",
          "url" : "https:\/\/developer.apple.com\/documentation\/PencilKit\/PKToolPicker\/colorMaximumLinearExposure"
        },
        {
          "description" : "The delegate for the tool picker.",
          "name" : "delegate",
          "url" : "https:\/\/developer.apple.com\/documentation\/PencilKit\/PKToolPicker\/delegate-swift.property"
        },
        {
          "description" : "If this is true the tool picker may show UI that allows dismissing it. If this is false the tool picker will not show this UI. By default this resigns first responder, but is customizable by `PKToolPickerDelegate`’s `toolPickerWillDismiss...` method.",
          "name" : "prefersDismissControlVisible",
          "url" : "https:\/\/developer.apple.com\/documentation\/PencilKit\/PKToolPicker\/prefersDismissControlVisible"
        }
      ],
      "title" : "Instance Properties"
    },
    {
      "content" : "",
      "items" : [
        {
          "description" : "The default tool items for new tool pickers.",
          "name" : "defaultToolItems",
          "url" : "https:\/\/developer.apple.com\/documentation\/PencilKit\/PKToolPicker\/defaultToolItems"
        }
      ],
      "title" : "Type Properties"
    },
    {
      "content" : "",
      "items" : [
        {
          "description" : "Incorporate a custom PencilKit tool picker with a variety of system and custom tools into a drawing app.",
          "name" : "Configuring the PencilKit tool picker",
          "url" : "https:\/\/developer.apple.com\/documentation\/PencilKit\/configuring-the-pencilkit-tool-picker"
        },
        {
          "description" : "A structure that defines the drawing characteristics (width, color, pen style) to use when drawing lines on a canvas view.",
          "name" : "PKInkingTool",
          "url" : "https:\/\/developer.apple.com\/documentation\/PencilKit\/PKInkingTool-swift.struct"
        },
        {
          "description" : "A tool for erasing previously drawn content in a canvas view.",
          "name" : "PKEraserTool",
          "url" : "https:\/\/developer.apple.com\/documentation\/PencilKit\/PKEraserTool-swift.struct"
        },
        {
          "description" : "A tool for selecting stroked lines and shapes in a canvas view.",
          "name" : "PKLassoTool",
          "url" : "https:\/\/developer.apple.com\/documentation\/PencilKit\/PKLassoTool-swift.struct"
        },
        {
          "description" : "An interface adopted by drawing and writing tools used by a canvas view.",
          "name" : "PKTool",
          "url" : "https:\/\/developer.apple.com\/documentation\/PencilKit\/PKTool-swift.protocol"
        }
      ],
      "title" : "Tools"
    },
    {
      "content" : "",
      "items" : [
        {
          "name" : "NSObject"
        }
      ],
      "title" : "Inherits From"
    }
  ],
  "source" : "appleJSON",
  "title" : "PKToolPicker",
  "url" : "https:\/\/developer.apple.com\/documentation\/PencilKit\/PKToolPicker"
}