{
  "abstract" : "Returns the person or group record that matches the given unique ID.",
  "codeExamples" : [

  ],
  "contentHash" : "3dfb69c3d52a1c8a15b4b4051c3073fd38c5396998d8d5d7551a49bc4b7e8d59",
  "crawledAt" : "2025-11-30T20:40:52Z",
  "declaration" : {
    "code" : "func record(forUniqueId uniqueId: String!) -> ABRecord!",
    "language" : "swift"
  },
  "id" : "199CB6C1-9F4C-49D1-AC00-641079D81EB1",
  "kind" : "method",
  "module" : "Address Book",
  "overview" : "## Return Value\n\nThe person or group record that matches the given unique ID.\n\n## Discussion\n\nIf no record has the given ID, this method returns `nil`.",
  "platforms" : [
    "macOS"
  ],
  "rawMarkdown" : "---\nsource: https:\/\/developer.apple.com\/documentation\/AddressBook\/ABAddressBook\/record(forUniqueId:)\ncrawled: 2025-11-30T20:40:52Z\n---\n\n# record(forUniqueId:)\n\n**Instance Method**\n\nReturns the person or group record that matches the given unique ID.\n\n## Declaration\n\n```swift\nfunc record(forUniqueId uniqueId: String!) -> ABRecord!\n```\n\n## Parameters\n\n- **uniqueId**: The unique ID of the record. This value must not be `nil`; otherwise, an exception is raised.\n\n## Return Value\n\nThe person or group record that matches the given unique ID.\n\n## Discussion\n\nIf no record has the given ID, this method returns `nil`.\n\n",
  "sections" : [

  ],
  "source" : "appleJSON",
  "title" : "record(forUniqueId:)",
  "url" : "https:\/\/developer.apple.com\/documentation\/AddressBook\/ABAddressBook\/record(forUniqueId:)"
}