{
  "abstract" : "Implement an Address Book action plug-in to support the display of rollover menus on top of custom items.",
  "codeExamples" : [

  ],
  "contentHash" : "7784b74a59460687e3838e9e517cdecd5088282e8a8995e801e3fc6982496271",
  "crawledAt" : "2025-12-02T15:40:01Z",
  "id" : "DBCEC5A4-D98F-47A3-96AF-FD9EB0D33C6A",
  "kind" : "collection",
  "language" : "swift",
  "module" : "Address Book",
  "overview" : "## Overview\n\nThe `ABActionDelegate` informal protocol allows you to populate the rollover menus of Address Book with custom items. You do this by implementing an Address Book action plug-in. The plug-in’s [doc:\/\/com.apple.documentation\/documentation\/Foundation\/Bundle] must implement [doc:\/\/com.apple.documentation\/documentation\/ObjectiveC\/NSObject-swift.class\/actionProperty()], [doc:\/\/com.apple.documentation\/documentation\/ObjectiveC\/NSObject-swift.class\/title(for:identifier:)], and [doc:\/\/com.apple.documentation\/documentation\/ObjectiveC\/NSObject-swift.class\/performAction(for:identifier:)].\n\nEach action plug-in can implement only one action. Actions can only apply to items with labels. An action can display a simple window inside the Address Book application; if your action actions needs to do anything else, it should launch your own application to perform the action.\n\nUse Xcode to create Address Book action plug-ins. Place action plug-ins in `~\/Library\/Address Book Plug-Ins` or `\/Library\/Address Book Plug-Ins`, depending on the scope you want for the action.",
  "rawMarkdown" : "---\nsource: https:\/\/developer.apple.com\/documentation\/AddressBook\/abactiondelegate\ncrawled: 2025-12-02T15:40:01Z\n---\n\n# ABActionDelegate\n\nImplement an Address Book action plug-in to support the display of rollover menus on top of custom items.\n\n## Overview\n\nThe `ABActionDelegate` informal protocol allows you to populate the rollover menus of Address Book with custom items. You do this by implementing an Address Book action plug-in. The plug-in’s [doc:\/\/com.apple.documentation\/documentation\/Foundation\/Bundle] must implement [doc:\/\/com.apple.documentation\/documentation\/ObjectiveC\/NSObject-swift.class\/actionProperty()], [doc:\/\/com.apple.documentation\/documentation\/ObjectiveC\/NSObject-swift.class\/title(for:identifier:)], and [doc:\/\/com.apple.documentation\/documentation\/ObjectiveC\/NSObject-swift.class\/performAction(for:identifier:)].\n\nEach action plug-in can implement only one action. Actions can only apply to items with labels. An action can display a simple window inside the Address Book application; if your action actions needs to do anything else, it should launch your own application to perform the action.\n\nUse Xcode to create Address Book action plug-ins. Place action plug-ins in `~\/Library\/Address Book Plug-Ins` or `\/Library\/Address Book Plug-Ins`, depending on the scope you want for the action.\n\n## Performing actions\n\n- **performAction(for:identifier:)**: Sent to the delegate to perform the action.\n\n## Querying\n\n- **actionProperty()**: Sent to the delegate to request the property the action applies to.\n- **shouldEnableAction(for:identifier:)**: Sent to the delegate to determine whether the action should be enabled.\n- **title(for:identifier:)**: Sent to the delegate to request the title of the menu item for the action.\n\n",
  "sections" : [
    {
      "content" : "",
      "items" : [
        {
          "description" : "Sent to the delegate to perform the action.",
          "name" : "performAction(for:identifier:)",
          "url" : "https:\/\/developer.apple.com\/documentation\/ObjectiveC\/NSObject-swift.class\/performAction(for:identifier:)"
        }
      ],
      "title" : "Performing actions"
    },
    {
      "content" : "",
      "items" : [
        {
          "description" : "Sent to the delegate to request the property the action applies to.",
          "name" : "actionProperty()",
          "url" : "https:\/\/developer.apple.com\/documentation\/ObjectiveC\/NSObject-swift.class\/actionProperty()"
        },
        {
          "description" : "Sent to the delegate to determine whether the action should be enabled.",
          "name" : "shouldEnableAction(for:identifier:)",
          "url" : "https:\/\/developer.apple.com\/documentation\/ObjectiveC\/NSObject-swift.class\/shouldEnableAction(for:identifier:)"
        },
        {
          "description" : "Sent to the delegate to request the title of the menu item for the action.",
          "name" : "title(for:identifier:)",
          "url" : "https:\/\/developer.apple.com\/documentation\/ObjectiveC\/NSObject-swift.class\/title(for:identifier:)"
        }
      ],
      "title" : "Querying"
    }
  ],
  "source" : "appleJSON",
  "title" : "ABActionDelegate",
  "url" : "https:\/\/developer.apple.com\/documentation\/AddressBook\/abactiondelegate"
}