{
  "abstract" : "An immutable representation of a property that might have multiple values.",
  "codeExamples" : [

  ],
  "conformsTo" : [
    "CVarArg",
    "CustomDebugStringConvertible",
    "CustomStringConvertible",
    "Equatable",
    "Hashable",
    "NSCopying",
    "NSFastEnumeration",
    "NSMutableCopying",
    "NSObjectProtocol"
  ],
  "contentHash" : "d01fca738c96bbdffbf230001917bbced11cde846f65d508847b667c6d55a590",
  "crawledAt" : "2025-12-04T00:22:56Z",
  "declaration" : {
    "code" : "class ABMultiValue",
    "language" : "swift"
  },
  "id" : "45ECFBA4-8DCA-428A-8295-2814DAE77B73",
  "inheritedBy" : [
    "ABMutableMultiValue"
  ],
  "kind" : "class",
  "language" : "swift",
  "module" : "Address Book",
  "overview" : "## Overview\n\nEach value in a multivalue list must be of the same type, and must have an associated predefined or user-defined label, and unique identifier. The labels, however, need not be unique. For example, you can have multiple Home phone numbers. Each multivalue object may have a primary identifier—used as a default value when a label is not provided. For example, a person record may have multiple addresses with the labels Home and Work, where Work is designated as the primary value. Instances of this class are immutable, see [doc:\/\/com.apple.addressbook\/documentation\/AddressBook\/ABMutableMultiValue] for methods that manipulate the content of a multivalue list.\n\nThe `ABMultiValue` class is “toll-free bridged” with its procedural C opaque-type counterpart. This means that the [doc:\/\/com.apple.addressbook\/documentation\/AddressBook\/ABMultiValueRef] type is interchangeable in function or method calls with instances of the `ABMultiValue` class.",
  "platforms" : [
    "macOS"
  ],
  "rawMarkdown" : "---\nsource: https:\/\/developer.apple.com\/documentation\/addressbook\/abmultivalue\ncrawled: 2025-12-04T00:22:56Z\n---\n\n# ABMultiValue\n\n**Class**\n\nAn immutable representation of a property that might have multiple values.\n\n## Declaration\n\n```swift\nclass ABMultiValue\n```\n\n## Overview\n\nEach value in a multivalue list must be of the same type, and must have an associated predefined or user-defined label, and unique identifier. The labels, however, need not be unique. For example, you can have multiple Home phone numbers. Each multivalue object may have a primary identifier—used as a default value when a label is not provided. For example, a person record may have multiple addresses with the labels Home and Work, where Work is designated as the primary value. Instances of this class are immutable, see [doc:\/\/com.apple.addressbook\/documentation\/AddressBook\/ABMutableMultiValue] for methods that manipulate the content of a multivalue list.\n\nThe `ABMultiValue` class is “toll-free bridged” with its procedural C opaque-type counterpart. This means that the [doc:\/\/com.apple.addressbook\/documentation\/AddressBook\/ABMultiValueRef] type is interchangeable in function or method calls with instances of the `ABMultiValue` class.\n\n## Accessing the primary identifier\n\n- **primaryIdentifier()**: Returns the identifier for the primary value.\n\n## Accessing identifiers\n\n- **identifier(at:)**: Returns the identifier for the given index.\n- **index(forIdentifier:)**: Returns the index for the given identifier.\n\n## Accessing entries\n\n- **label(at:)**: Returns the label for the given index.\n- **value(at:)**: Returns the value for the given index.\n- **value(forIdentifier:)**: Returns the value for the given identifier.\n- **label(forIdentifier:)**: Returns the label for the given identifier.\n\n## Querying the list\n\n- **count()**: Returns the number of entries in a multivalue list.\n- **propertyType()**: Returns the type for the values in a multivalue list.\n\n## Data Types\n\n- **ABPerson**: An object that encapsulates all information about a person in the Address Book database.\n- **ABGroup**: An object that represents a group of records in the Address Book database.\n- **ABMutableMultiValue**: A mutable representation of a property that might have multiple values.\n- **ABImageClient**: Methods for responding to a request to load images associated with a contact.\n- **ABRecord**: An abstract class that defines the common properties for all Address Book records.\n\n## Inherits From\n\n- NSObject\n\n## Inherited By\n\n- ABMutableMultiValue\n\n## Conforms To\n\n- CVarArg\n- CustomDebugStringConvertible\n- CustomStringConvertible\n- Equatable\n- Hashable\n- NSCopying\n- NSFastEnumeration\n- NSMutableCopying\n- NSObjectProtocol\n\n",
  "sections" : [
    {
      "content" : "",
      "items" : [
        {
          "description" : "Returns the identifier for the primary value.",
          "name" : "primaryIdentifier()",
          "url" : "https:\/\/developer.apple.com\/documentation\/AddressBook\/ABMultiValue\/primaryIdentifier()"
        }
      ],
      "title" : "Accessing the primary identifier"
    },
    {
      "content" : "",
      "items" : [
        {
          "description" : "Returns the identifier for the given index.",
          "name" : "identifier(at:)",
          "url" : "https:\/\/developer.apple.com\/documentation\/AddressBook\/ABMultiValue\/identifier(at:)"
        },
        {
          "description" : "Returns the index for the given identifier.",
          "name" : "index(forIdentifier:)",
          "url" : "https:\/\/developer.apple.com\/documentation\/AddressBook\/ABMultiValue\/index(forIdentifier:)"
        }
      ],
      "title" : "Accessing identifiers"
    },
    {
      "content" : "",
      "items" : [
        {
          "description" : "Returns the label for the given index.",
          "name" : "label(at:)",
          "url" : "https:\/\/developer.apple.com\/documentation\/AddressBook\/ABMultiValue\/label(at:)"
        },
        {
          "description" : "Returns the value for the given index.",
          "name" : "value(at:)",
          "url" : "https:\/\/developer.apple.com\/documentation\/AddressBook\/ABMultiValue\/value(at:)"
        },
        {
          "description" : "Returns the value for the given identifier.",
          "name" : "value(forIdentifier:)",
          "url" : "https:\/\/developer.apple.com\/documentation\/AddressBook\/ABMultiValue\/value(forIdentifier:)"
        },
        {
          "description" : "Returns the label for the given identifier.",
          "name" : "label(forIdentifier:)",
          "url" : "https:\/\/developer.apple.com\/documentation\/AddressBook\/ABMultiValue\/label(forIdentifier:)"
        }
      ],
      "title" : "Accessing entries"
    },
    {
      "content" : "",
      "items" : [
        {
          "description" : "Returns the number of entries in a multivalue list.",
          "name" : "count()",
          "url" : "https:\/\/developer.apple.com\/documentation\/AddressBook\/ABMultiValue\/count()"
        },
        {
          "description" : "Returns the type for the values in a multivalue list.",
          "name" : "propertyType()",
          "url" : "https:\/\/developer.apple.com\/documentation\/AddressBook\/ABMultiValue\/propertyType()"
        }
      ],
      "title" : "Querying the list"
    },
    {
      "content" : "",
      "items" : [
        {
          "description" : "An object that encapsulates all information about a person in the Address Book database.",
          "name" : "ABPerson",
          "url" : "https:\/\/developer.apple.com\/documentation\/AddressBook\/ABPerson"
        },
        {
          "description" : "An object that represents a group of records in the Address Book database.",
          "name" : "ABGroup",
          "url" : "https:\/\/developer.apple.com\/documentation\/AddressBook\/ABGroup"
        },
        {
          "description" : "A mutable representation of a property that might have multiple values.",
          "name" : "ABMutableMultiValue",
          "url" : "https:\/\/developer.apple.com\/documentation\/AddressBook\/ABMutableMultiValue"
        },
        {
          "description" : "Methods for responding to a request to load images associated with a contact.",
          "name" : "ABImageClient",
          "url" : "https:\/\/developer.apple.com\/documentation\/AddressBook\/ABImageClient"
        },
        {
          "description" : "An abstract class that defines the common properties for all Address Book records.",
          "name" : "ABRecord",
          "url" : "https:\/\/developer.apple.com\/documentation\/AddressBook\/ABRecord"
        }
      ],
      "title" : "Data Types"
    },
    {
      "content" : "",
      "items" : [
        {
          "name" : "NSObject"
        }
      ],
      "title" : "Inherits From"
    }
  ],
  "source" : "appleJSON",
  "title" : "ABMultiValue",
  "url" : "https:\/\/developer.apple.com\/documentation\/addressbook\/abmultivalue"
}