{
  "abstract" : "Requests access to address book data from the user.",
  "codeExamples" : [

  ],
  "contentHash" : "f50647250bb7bb754f9462dd5b89b6c669fe0f571de47492dfa7a2a10c15f1f7",
  "crawledAt" : "2025-12-02T16:39:29Z",
  "declaration" : {
    "code" : "func ABAddressBookRequestAccessWithCompletion(_ addressBook: ABAddressBook!, _ completion: ABAddressBookRequestAccessCompletionHandler!)",
    "language" : "swift"
  },
  "id" : "7E87DE56-2ED9-47B9-93F2-EE23492A5435",
  "kind" : "function",
  "language" : "swift",
  "module" : "Address Book",
  "overview" : "## Discussion\n\nUse this function to request access to address book data. This call will not block while the user is being asked for access, allowing your app to continue running. Until access has been granted, any address book references your app has will not contain any data, and any attempt to modify data will fail with an error type of [doc:\/\/com.apple.addressbook\/documentation\/AddressBook\/kABOperationNotPermittedByUserError]. The user is only asked for permission the first time you request access. Later calls use the permission granted by the user.\n\nThe completion handler is called on an arbitrary queue. If your app uses an address book throughout the app, you are responsible for ensuring that all usage of that address book is dispatched to a single queue to ensure correct thread-safe operation.",
  "platforms" : [
    "iOS",
    "iPadOS",
    "Mac Catalyst"
  ],
  "rawMarkdown" : "---\nsource: https:\/\/developer.apple.com\/documentation\/AddressBook\/ABAddressBookRequestAccessWithCompletion(_:_:)\ncrawled: 2025-12-02T16:39:29Z\n---\n\n# ABAddressBookRequestAccessWithCompletion(_:_:)\n\n**Function**\n\nRequests access to address book data from the user.\n\n## Declaration\n\n```swift\nfunc ABAddressBookRequestAccessWithCompletion(_ addressBook: ABAddressBook!, _ completion: ABAddressBookRequestAccessCompletionHandler!)\n```\n\n## Parameters\n\n- **addressBook**: The address book in question.\n- **completion**: The completion handler, called once access has been granted or denied by the user.\n\n## Discussion\n\nUse this function to request access to address book data. This call will not block while the user is being asked for access, allowing your app to continue running. Until access has been granted, any address book references your app has will not contain any data, and any attempt to modify data will fail with an error type of [doc:\/\/com.apple.addressbook\/documentation\/AddressBook\/kABOperationNotPermittedByUserError]. The user is only asked for permission the first time you request access. Later calls use the permission granted by the user.\n\nThe completion handler is called on an arbitrary queue. If your app uses an address book throughout the app, you are responsible for ensuring that all usage of that address book is dispatched to a single queue to ensure correct thread-safe operation.\n\n## Deprecated\n\n- **ABAddressBookAddRecord(_:_:_:)**: Adds a record to an address book.\n- **ABAddressBookCopyArrayOfAllGroups(_:)**: Returns an array with all the groups in an address book.\n- **ABAddressBookCopyArrayOfAllGroupsInSource(_:_:)**: Returns an array of all groups from a particular source.\n- **ABAddressBookCopyArrayOfAllPeople(_:)**: Returns all the person records in an address book.\n- **ABAddressBookCopyArrayOfAllPeopleInSource(_:_:)**: Returns an array of all person records from a particular source.\n- **ABAddressBookCopyArrayOfAllPeopleInSourceWithSortOrdering(_:_:_:)**: Returns an array of all person records in the address book, sorted with the specified order.\n- **ABAddressBookCopyArrayOfAllSources(_:)**: Returns an array of all sources in the address book.\n- **ABAddressBookCopyDefaultSource(_:)**: Returns the default source.\n- **ABAddressBookCopyLocalizedLabel(_:)**: Returns a localized version of a record-property label.\n- **ABAddressBookCopyPeopleWithName(_:_:)**: Performs a prefix search on the composite names of people in an address book and returns an array of persons that match the search criteria.\n- **ABAddressBookCreate()**: Creates a new address book object with data from the Address Book database.\n- **ABAddressBookCreateWithOptions(_:_:)**: Creates a new address book object with data from the Address Book database.\n- **ABAddressBookGetAuthorizationStatus()**: Returns the authorization status of your app for accessing address book data.\n- **ABAddressBookGetGroupCount(_:)**: Returns the number of groups in an address book.\n- **ABAddressBookGetGroupWithRecordID(_:_:)**: Returns the group with a given record ID.\n\n",
  "sections" : [
    {
      "content" : "",
      "items" : [
        {
          "description" : "Adds a record to an address book.",
          "name" : "ABAddressBookAddRecord(_:_:_:)",
          "url" : "https:\/\/developer.apple.com\/documentation\/AddressBook\/ABAddressBookAddRecord(_:_:_:)"
        },
        {
          "description" : "Returns an array with all the groups in an address book.",
          "name" : "ABAddressBookCopyArrayOfAllGroups(_:)",
          "url" : "https:\/\/developer.apple.com\/documentation\/AddressBook\/ABAddressBookCopyArrayOfAllGroups(_:)"
        },
        {
          "description" : "Returns an array of all groups from a particular source.",
          "name" : "ABAddressBookCopyArrayOfAllGroupsInSource(_:_:)",
          "url" : "https:\/\/developer.apple.com\/documentation\/AddressBook\/ABAddressBookCopyArrayOfAllGroupsInSource(_:_:)"
        },
        {
          "description" : "Returns all the person records in an address book.",
          "name" : "ABAddressBookCopyArrayOfAllPeople(_:)",
          "url" : "https:\/\/developer.apple.com\/documentation\/AddressBook\/ABAddressBookCopyArrayOfAllPeople(_:)"
        },
        {
          "description" : "Returns an array of all person records from a particular source.",
          "name" : "ABAddressBookCopyArrayOfAllPeopleInSource(_:_:)",
          "url" : "https:\/\/developer.apple.com\/documentation\/AddressBook\/ABAddressBookCopyArrayOfAllPeopleInSource(_:_:)"
        },
        {
          "description" : "Returns an array of all person records in the address book, sorted with the specified order.",
          "name" : "ABAddressBookCopyArrayOfAllPeopleInSourceWithSortOrdering(_:_:_:)",
          "url" : "https:\/\/developer.apple.com\/documentation\/AddressBook\/ABAddressBookCopyArrayOfAllPeopleInSourceWithSortOrdering(_:_:_:)"
        },
        {
          "description" : "Returns an array of all sources in the address book.",
          "name" : "ABAddressBookCopyArrayOfAllSources(_:)",
          "url" : "https:\/\/developer.apple.com\/documentation\/AddressBook\/ABAddressBookCopyArrayOfAllSources(_:)"
        },
        {
          "description" : "Returns the default source.",
          "name" : "ABAddressBookCopyDefaultSource(_:)",
          "url" : "https:\/\/developer.apple.com\/documentation\/AddressBook\/ABAddressBookCopyDefaultSource(_:)"
        },
        {
          "description" : "Returns a localized version of a record-property label.",
          "name" : "ABAddressBookCopyLocalizedLabel(_:)",
          "url" : "https:\/\/developer.apple.com\/documentation\/AddressBook\/ABAddressBookCopyLocalizedLabel(_:)"
        },
        {
          "description" : "Performs a prefix search on the composite names of people in an address book and returns an array of persons that match the search criteria.",
          "name" : "ABAddressBookCopyPeopleWithName(_:_:)",
          "url" : "https:\/\/developer.apple.com\/documentation\/AddressBook\/ABAddressBookCopyPeopleWithName(_:_:)"
        },
        {
          "description" : "Creates a new address book object with data from the Address Book database.",
          "name" : "ABAddressBookCreate()",
          "url" : "https:\/\/developer.apple.com\/documentation\/AddressBook\/ABAddressBookCreate()"
        },
        {
          "description" : "Creates a new address book object with data from the Address Book database.",
          "name" : "ABAddressBookCreateWithOptions(_:_:)",
          "url" : "https:\/\/developer.apple.com\/documentation\/AddressBook\/ABAddressBookCreateWithOptions(_:_:)"
        },
        {
          "description" : "Returns the authorization status of your app for accessing address book data.",
          "name" : "ABAddressBookGetAuthorizationStatus()",
          "url" : "https:\/\/developer.apple.com\/documentation\/AddressBook\/ABAddressBookGetAuthorizationStatus()"
        },
        {
          "description" : "Returns the number of groups in an address book.",
          "name" : "ABAddressBookGetGroupCount(_:)",
          "url" : "https:\/\/developer.apple.com\/documentation\/AddressBook\/ABAddressBookGetGroupCount(_:)"
        },
        {
          "description" : "Returns the group with a given record ID.",
          "name" : "ABAddressBookGetGroupWithRecordID(_:_:)",
          "url" : "https:\/\/developer.apple.com\/documentation\/AddressBook\/ABAddressBookGetGroupWithRecordID(_:_:)"
        }
      ],
      "title" : "Deprecated"
    }
  ],
  "source" : "appleJSON",
  "title" : "ABAddressBookRequestAccessWithCompletion(_:_:)",
  "url" : "https:\/\/developer.apple.com\/documentation\/AddressBook\/ABAddressBookRequestAccessWithCompletion(_:_:)"
}