{
  "abstract" : "Initializes a record using the given address book.",
  "codeExamples" : [

  ],
  "contentHash" : "f8996bb5f92ef367b745764cff5207f832d7c2f2d76304df462ab369da4fbab9",
  "crawledAt" : "2025-12-07T14:40:05Z",
  "declaration" : {
    "code" : "init!(addressBook: ABAddressBook!)",
    "language" : "swift"
  },
  "id" : "024CD323-8054-406A-88BD-8716D0B8A6B0",
  "kind" : "unknown",
  "language" : "swift",
  "module" : "Address Book",
  "overview" : "## Discussion\n\nThe record is added to `addressBook` but is not visible to other address books until `addressBook` is saved. This method is the designated initializer for this class.",
  "platforms" : [
    "macOS"
  ],
  "rawMarkdown" : "---\nsource: https:\/\/developer.apple.com\/documentation\/AddressBook\/ABRecord\/init(addressBook:)\ncrawled: 2025-12-07T14:40:05Z\n---\n\n# init(addressBook:)\n\n**Initializer**\n\nInitializes a record using the given address book.\n\n## Declaration\n\n```swift\ninit!(addressBook: ABAddressBook!)\n```\n\n## Parameters\n\n- **addressBook**: The address book with which to initialize the record.\n\n## Discussion\n\nThe record is added to `addressBook` but is not visible to other address books until `addressBook` is saved. This method is the designated initializer for this class.\n\n## Creating a Record\n\n- **init()**: Initializes a record using the shared address book.\n\n",
  "sections" : [
    {
      "content" : "",
      "items" : [
        {
          "description" : "Initializes a record using the shared address book.",
          "name" : "init()",
          "url" : "https:\/\/developer.apple.com\/documentation\/AddressBook\/ABRecord\/init()"
        }
      ],
      "title" : "Creating a Record"
    }
  ],
  "source" : "appleJSON",
  "title" : "init(addressBook:)",
  "url" : "https:\/\/developer.apple.com\/documentation\/AddressBook\/ABRecord\/init(addressBook:)"
}