{
  "abstract" : "An interface for configuring a Control Center module.",
  "codeExamples" : [
    {
      "code" : "struct SelectFocusIntent: ControlConfigurationIntent {\n    static let title: LocalizedStringResource = \"Select Focus\"\n    static let description: IntentDescription = \"Turn Focus on to silence notifications and filter out distractions.\"\n\n    struct FocusOptionsProvider: DynamicOptionsProvider {\n        func results() async throws -> [Focus] {\n            FocusManager.shared.allFocuses\n        }\n    }\n\n    @Parameter(title: \"Focus\", default: .doNotDisturb, optionsProvider: FocusOptionsProvider())\n    var focus: Focus\n}",
      "language" : "swift"
    }
  ],
  "contentHash" : "2afe94782cefa342bea1d9e0df140c0ce37e100925d9475cd4a6f6e9500db5c4",
  "crawledAt" : "2025-12-05T15:14:45Z",
  "declaration" : {
    "code" : "protocol ControlConfigurationIntent : AppIntent",
    "language" : "swift"
  },
  "id" : "1B6DC24B-DF7E-4D5B-B22D-E84567236B22",
  "kind" : "protocol",
  "language" : "swift",
  "module" : "App Intents",
  "overview" : "## Overview\n\nThe parameters of your intent define all of the configuration options for your control.\n\nWhen using this protocol, you don’t need to provide an implementation for [doc:\/\/com.apple.AppIntents\/documentation\/AppIntents\/AppIntent\/perform()]. You can, however, still implement `perform()` to use the same implementation for both control configuration and as an actionable intent.\n\nThe example above provides a default value for the `focus` intent parameter. By providing a default value, you can use a non-optional value for the intent parameter. If you don’t provide a default value for the intent parameter, the parameter’s value must be optional, to allow the system to preview the control before someone configures it.",
  "platforms" : [
    "iOS",
    "iPadOS",
    "Mac Catalyst",
    "macOS",
    "watchOS"
  ],
  "rawMarkdown" : "---\nsource: https:\/\/developer.apple.com\/documentation\/appintents\/controlconfigurationintent\ncrawled: 2025-12-05T15:14:45Z\n---\n\n# ControlConfigurationIntent\n\n**Protocol**\n\nAn interface for configuring a Control Center module.\n\n## Declaration\n\n```swift\nprotocol ControlConfigurationIntent : AppIntent\n```\n\n## Overview\n\nThe parameters of your intent define all of the configuration options for your control.\n\n```swift\nstruct SelectFocusIntent: ControlConfigurationIntent {\n    static let title: LocalizedStringResource = \"Select Focus\"\n    static let description: IntentDescription = \"Turn Focus on to silence notifications and filter out distractions.\"\n\n    struct FocusOptionsProvider: DynamicOptionsProvider {\n        func results() async throws -> [Focus] {\n            FocusManager.shared.allFocuses\n        }\n    }\n\n    @Parameter(title: \"Focus\", default: .doNotDisturb, optionsProvider: FocusOptionsProvider())\n    var focus: Focus\n}\n```\n\nWhen using this protocol, you don’t need to provide an implementation for [doc:\/\/com.apple.AppIntents\/documentation\/AppIntents\/AppIntent\/perform()]. You can, however, still implement `perform()` to use the same implementation for both control configuration and as an actionable intent.\n\nThe example above provides a default value for the `focus` intent parameter. By providing a default value, you can use a non-optional value for the intent parameter. If you don’t provide a default value for the intent parameter, the parameter’s value must be optional, to allow the system to preview the control before someone configures it.\n\n## Associated Types\n\n- **NeverResult**\n\n## Controls, widgets, and Live Activities\n\n- **LiveActivityStartingIntent**: An intent that starts, pauses, or otherwise modifies a Live Activity.\n- **LiveActivityIntent**: An intent that starts, pauses, or otherwise modifies a Live Activity when it runs.\n- **WidgetConfigurationIntent**: An interface for configuring a WidgetKit widget.\n\n## Inherits From\n\n- AppIntent\n- PersistentlyIdentifiable\n- Sendable\n- SendableMetatype\n\n",
  "sections" : [
    {
      "content" : "",
      "items" : [
        {
          "description" : "",
          "name" : "NeverResult",
          "url" : "https:\/\/developer.apple.com\/documentation\/AppIntents\/ControlConfigurationIntent\/NeverResult"
        }
      ],
      "title" : "Associated Types"
    },
    {
      "content" : "",
      "items" : [
        {
          "description" : "An intent that starts, pauses, or otherwise modifies a Live Activity.",
          "name" : "LiveActivityStartingIntent",
          "url" : "https:\/\/developer.apple.com\/documentation\/AppIntents\/LiveActivityStartingIntent"
        },
        {
          "description" : "An intent that starts, pauses, or otherwise modifies a Live Activity when it runs.",
          "name" : "LiveActivityIntent",
          "url" : "https:\/\/developer.apple.com\/documentation\/AppIntents\/LiveActivityIntent"
        },
        {
          "description" : "An interface for configuring a WidgetKit widget.",
          "name" : "WidgetConfigurationIntent",
          "url" : "https:\/\/developer.apple.com\/documentation\/AppIntents\/WidgetConfigurationIntent"
        }
      ],
      "title" : "Controls, widgets, and Live Activities"
    },
    {
      "content" : "",
      "items" : [
        {
          "name" : "AppIntent"
        },
        {
          "name" : "PersistentlyIdentifiable"
        },
        {
          "name" : "Sendable"
        },
        {
          "name" : "SendableMetatype"
        }
      ],
      "title" : "Inherits From"
    }
  ],
  "source" : "appleJSON",
  "title" : "ControlConfigurationIntent",
  "url" : "https:\/\/developer.apple.com\/documentation\/appintents\/controlconfigurationintent"
}