{
  "abstract" : "A value that Siri uses to fulfill a person’s request.",
  "codeExamples" : [

  ],
  "contentHash" : "5385780b7aca7614959d342fa575a62a7055cedbe49f1724d19280515a490a61",
  "crawledAt" : "2025-12-04T09:39:25Z",
  "declaration" : {
    "code" : "protocol AssistantEnum : AppEnum",
    "language" : "swift"
  },
  "id" : "79725207-6A4F-441B-9BBE-DE49325CEE20",
  "inheritedBy" : [
    "AssistantSchemaEnum"
  ],
  "kind" : "protocol",
  "language" : "swift",
  "module" : "App Intents",
  "overview" : "## Overview\n\nDon’t adopt this protocol directly, instead use the [doc:\/\/com.apple.AppIntents\/documentation\/AppIntents\/AssistantEnum(schema:)] macro to meet requirements for making your [doc:\/\/com.apple.AppIntents\/documentation\/AppIntents\/AppEnum] available to Siri.",
  "platforms" : [
    "iOS",
    "iPadOS",
    "Mac Catalyst",
    "macOS",
    "tvOS",
    "visionOS",
    "watchOS"
  ],
  "rawMarkdown" : "---\nsource: https:\/\/developer.apple.com\/documentation\/appintents\/assistantenum\ncrawled: 2025-12-04T09:39:25Z\n---\n\n# AssistantEnum\n\n**Protocol**\n\nA value that Siri uses to fulfill a person’s request.\n\n## Declaration\n\n```swift\nprotocol AssistantEnum : AppEnum\n```\n\n## Overview\n\nDon’t adopt this protocol directly, instead use the [doc:\/\/com.apple.AppIntents\/documentation\/AppIntents\/AssistantEnum(schema:)] macro to meet requirements for making your [doc:\/\/com.apple.AppIntents\/documentation\/AppIntents\/AppEnum] available to Siri.\n\n## Base protocols\n\n- **AssistantIntent**: An app intent that Siri performs to fulfill a person’s request.\n- **AssistantSchemaIntent**\n- **AssistantEntity**: An app entity that Siri can access to fulfill a person’s request.\n- **AssistantSchemaEntity**\n- **AssistantSchemaEnum**\n\n## Inherits From\n\n- AppEnum\n- AppValue\n- CaseDisplayRepresentable\n- CaseIterable\n- CustomLocalizedStringResourceConvertible\n- Equatable\n- Hashable\n- PersistentlyIdentifiable\n- RawRepresentable\n- Sendable\n- SendableMetatype\n- StaticDisplayRepresentable\n- TypeDisplayRepresentable\n\n## Inherited By\n\n- AssistantSchemaEnum\n\n",
  "sections" : [
    {
      "content" : "",
      "items" : [
        {
          "description" : "An app intent that Siri performs to fulfill a person’s request.",
          "name" : "AssistantIntent",
          "url" : "https:\/\/developer.apple.com\/documentation\/AppIntents\/AssistantIntent"
        },
        {
          "description" : "",
          "name" : "AssistantSchemaIntent",
          "url" : "https:\/\/developer.apple.com\/documentation\/AppIntents\/AssistantSchemaIntent"
        },
        {
          "description" : "An app entity that Siri can access to fulfill a person’s request.",
          "name" : "AssistantEntity",
          "url" : "https:\/\/developer.apple.com\/documentation\/AppIntents\/AssistantEntity"
        },
        {
          "description" : "",
          "name" : "AssistantSchemaEntity",
          "url" : "https:\/\/developer.apple.com\/documentation\/AppIntents\/AssistantSchemaEntity"
        },
        {
          "description" : "",
          "name" : "AssistantSchemaEnum",
          "url" : "https:\/\/developer.apple.com\/documentation\/AppIntents\/AssistantSchemaEnum"
        }
      ],
      "title" : "Base protocols"
    },
    {
      "content" : "",
      "items" : [
        {
          "name" : "AppEnum"
        },
        {
          "name" : "AppValue"
        },
        {
          "name" : "CaseDisplayRepresentable"
        },
        {
          "name" : "CaseIterable"
        },
        {
          "name" : "CustomLocalizedStringResourceConvertible"
        },
        {
          "name" : "Equatable"
        },
        {
          "name" : "Hashable"
        },
        {
          "name" : "PersistentlyIdentifiable"
        },
        {
          "name" : "RawRepresentable"
        },
        {
          "name" : "Sendable"
        },
        {
          "name" : "SendableMetatype"
        },
        {
          "name" : "StaticDisplayRepresentable"
        },
        {
          "name" : "TypeDisplayRepresentable"
        }
      ],
      "title" : "Inherits From"
    }
  ],
  "source" : "appleJSON",
  "title" : "AssistantEnum",
  "url" : "https:\/\/developer.apple.com\/documentation\/appintents\/assistantenum"
}