{
  "abstract" : "An interface you use to provide a short list of entities that are relatively small in size.",
  "codeExamples" : [

  ],
  "conformingTypes" : [
    "UniqueAppEntityProvider"
  ],
  "contentHash" : "6f5c2be43a6052aa780868ac6486cf4ac46f34fe10dd0bdf6a6284a90f1da601",
  "crawledAt" : "2025-12-01T10:12:07Z",
  "declaration" : {
    "code" : "protocol EnumerableEntityQuery : EntityQuery",
    "language" : "swift"
  },
  "id" : "68B57E09-0CC9-4E86-837A-DD725D5FEEEF",
  "inheritedBy" : [
    "UniqueAppEntityQuery"
  ],
  "kind" : "protocol",
  "module" : "App Intents",
  "overview" : "## Overview\n\nBy implementing an `EnumerableEntityQuery`, you enable the Shortcuts app to generate a Find action and do filtering automatically. Use it in cases where the count of entities is relatively small, and their size in memory is limited. For situations where there may be many thousands of entities, or where individual entities may become large in memory usage, use [doc:\/\/com.apple.AppIntents\/documentation\/AppIntents\/EntityPropertyQuery] to allow better performance by fetching only the entities matching the criteria from your model.",
  "platforms" : [
    "iOS",
    "iPadOS",
    "Mac Catalyst",
    "macOS",
    "tvOS",
    "visionOS",
    "watchOS"
  ],
  "rawMarkdown" : "---\nsource: https:\/\/developer.apple.com\/documentation\/AppIntents\/EnumerableEntityQuery\ncrawled: 2025-12-01T10:12:07Z\n---\n\n# EnumerableEntityQuery\n\n**Protocol**\n\nAn interface you use to provide a short list of entities that are relatively small in size.\n\n## Declaration\n\n```swift\nprotocol EnumerableEntityQuery : EntityQuery\n```\n\n## Overview\n\nBy implementing an `EnumerableEntityQuery`, you enable the Shortcuts app to generate a Find action and do filtering automatically. Use it in cases where the count of entities is relatively small, and their size in memory is limited. For situations where there may be many thousands of entities, or where individual entities may become large in memory usage, use [doc:\/\/com.apple.AppIntents\/documentation\/AppIntents\/EntityPropertyQuery] to allow better performance by fetching only the entities matching the criteria from your model.\n\n## Instance Methods\n\n- **allEntities()**: Returns all available results.\n\n## Type Properties\n\n- **findIntentDescription**: Defines how the generated ‘Find’ Shortcuts action of this query type is displayed to the user.\n\n## Identifier-based queries\n\n- **EntityQuery**: An interface for locating entities using their identifiers.\n\n## Inherits From\n\n- DynamicOptionsProvider\n- EntityQuery\n- PersistentlyIdentifiable\n- Sendable\n- SendableMetatype\n\n## Inherited By\n\n- UniqueAppEntityQuery\n\n## Conforming Types\n\n- UniqueAppEntityProvider\n\n",
  "sections" : [
    {
      "content" : "",
      "items" : [
        {
          "description" : "Returns all available results.",
          "name" : "allEntities()",
          "url" : "https:\/\/developer.apple.com\/documentation\/AppIntents\/EnumerableEntityQuery\/allEntities()"
        }
      ],
      "title" : "Instance Methods"
    },
    {
      "content" : "",
      "items" : [
        {
          "description" : "Defines how the generated ‘Find’ Shortcuts action of this query type is displayed to the user.",
          "name" : "findIntentDescription",
          "url" : "https:\/\/developer.apple.com\/documentation\/AppIntents\/EnumerableEntityQuery\/findIntentDescription"
        }
      ],
      "title" : "Type Properties"
    },
    {
      "content" : "",
      "items" : [
        {
          "description" : "An interface for locating entities using their identifiers.",
          "name" : "EntityQuery",
          "url" : "https:\/\/developer.apple.com\/documentation\/AppIntents\/EntityQuery"
        }
      ],
      "title" : "Identifier-based queries"
    },
    {
      "content" : "",
      "items" : [
        {
          "name" : "DynamicOptionsProvider"
        },
        {
          "name" : "EntityQuery"
        },
        {
          "name" : "PersistentlyIdentifiable"
        },
        {
          "name" : "Sendable"
        },
        {
          "name" : "SendableMetatype"
        }
      ],
      "title" : "Inherits From"
    }
  ],
  "source" : "appleJSON",
  "title" : "EnumerableEntityQuery",
  "url" : "https:\/\/developer.apple.com\/documentation\/AppIntents\/EnumerableEntityQuery"
}