{
  "abstract" : "Create app intents and entities to integrate your app’s document viewing and editing functionality with Siri and Apple Intelligence.",
  "codeExamples" : [
    {
      "code" : "@AppIntent(schema: .reader.rotatePages)\nstruct ReaderRotatePagesIntent {\n    var pages: [ReaderPageEntity]\n    var isClockwise: Bool\n\n    func perform() async throws -> some IntentResult & ReturnsValue<[ReaderPageEntity]> {\n        return .result(value: [ReaderPageEntity]())\n    }\n}",
      "language" : "swift"
    },
    {
      "code" : "@AppEntity(schema: .reader.document)\nstruct ReaderDocumentEntity {\n    struct Query: EntityStringQuery {\n        func entities(for identifiers: [ReaderDocumentEntity.ID]) async throws -> [ReaderDocumentEntity] { [] }\n        func entities(matching string: String) async throws -> [ReaderDocumentEntity] { [] }\n    }\n    static var defaultQuery = Query()\n    var displayRepresentation: DisplayRepresentation { \"A display representation.\" }\n\n    let id = UUID()\n\n    var title: String\n    var kind: ReaderDocumentKind\n    var width: Int?\n    var height: Int?\n}",
      "language" : "swift"
    },
    {
      "code" : "import Foundation\nimport AppIntents\n\n@AppEnum(schema: .reader.documentKind)\nenum ReaderDocumentKind: String, AppEnum, Codable {\n    case image\n    case pdf\n\n    static var caseDisplayRepresentations: [ReaderDocumentKind: DisplayRepresentation] = [:]\n}\n",
      "language" : "swift"
    }
  ],
  "contentHash" : "cbe62b6addcec947e2f96ffe3e16779270012b865c6931409885f0291d72816a",
  "crawledAt" : "2025-12-03T08:31:40Z",
  "id" : "A06D5ECB-F954-433A-A5F0-D08799C860D0",
  "kind" : "article",
  "language" : "swift",
  "module" : "App Intents",
  "overview" : "## Overview\n\nTo integrate your app’s document viewing and editing capabilities with Siri and Apple Intelligence, you use Swift macros that generate additional properties and add protocol conformance for your app intent, app entity, and app enumeration implementation that Apple Intelligence needs.\n\nFor example, if your app allows people to view and rotate a document, use the [doc:\/\/com.apple.AppIntents\/documentation\/AppIntents\/AppIntent(schema:)] macro and provide the assistant schema that consists of the `.reader` domain and the [doc:\/\/com.apple.AppIntents\/documentation\/AppIntents\/AssistantSchemas\/ReaderIntent\/rotatePages] schema:\n\nTo learn more about assistant schemas, see [doc:\/\/com.apple.AppIntents\/documentation\/AppIntents\/Integrating-actions-with-siri-and-apple-intelligence]. For a list of available app intents in the `.reader` domain, see [doc:\/\/com.apple.AppIntents\/documentation\/AppIntents\/AssistantSchemas\/ReaderIntent].\n\n### Make sure your entity meets requirements\n\nIf you use app entities to describe custom data types, annotate the app entity implementation with the [doc:\/\/com.apple.AppIntents\/documentation\/AppIntents\/AppEntity(schema:)] macro. This makes sure Siri and Apple Intelligence can understand your data. For example, the intent in the previous section uses `ReaderPageEntity`. The following code snippet shows how the `ReaderPageEntity` implementation uses the [doc:\/\/com.apple.AppIntents\/documentation\/AppIntents\/AppEntity(schema:)] macro:\n\nThe assistant schema for the `ReaderPageEntity` consists of the `.reader` domain and the [doc:\/\/com.apple.AppIntents\/documentation\/AppIntents\/AssistantSchemas\/ReaderEntity\/document] schema.\n\nFor a list of available app entity schemas in the `.reader` domain, see [doc:\/\/com.apple.AppIntents\/documentation\/AppIntents\/AssistantSchemas\/ReaderEntity].\n\n### Make sure your enumeration meets requirements\n\nTo make sure Siri and Apple Intelligence understand custom static types for your intent parameters, annotate app enumerations with the [doc:\/\/com.apple.AppIntents\/documentation\/AppIntents\/AppEnum(schema:)] macro. Then, pass the `.reader` domain and a schema to it. The following example uses the [doc:\/\/com.apple.AppIntents\/documentation\/AppIntents\/AssistantSchemas\/ReaderEnum\/documentKind] schema:\n\nFor a list of available app enumeration schemas in the `.reader` domain, see [doc:\/\/com.apple.AppIntents\/documentation\/AppIntents\/AssistantSchemas\/ReaderEnum].",
  "rawMarkdown" : "---\nsource: https:\/\/developer.apple.com\/documentation\/appintents\/making-document-reader-actions-available-to-siri-and-apple-intelligence\ncrawled: 2025-12-03T08:31:40Z\n---\n\n# Making document reader actions available to Siri and Apple Intelligence\n\n**Article**\n\nCreate app intents and entities to integrate your app’s document viewing and editing functionality with Siri and Apple Intelligence.\n\n## Overview\n\nTo integrate your app’s document viewing and editing capabilities with Siri and Apple Intelligence, you use Swift macros that generate additional properties and add protocol conformance for your app intent, app entity, and app enumeration implementation that Apple Intelligence needs.\n\n\n\nFor example, if your app allows people to view and rotate a document, use the [doc:\/\/com.apple.AppIntents\/documentation\/AppIntents\/AppIntent(schema:)] macro and provide the assistant schema that consists of the `.reader` domain and the [doc:\/\/com.apple.AppIntents\/documentation\/AppIntents\/AssistantSchemas\/ReaderIntent\/rotatePages] schema:\n\n```swift\n@AppIntent(schema: .reader.rotatePages)\nstruct ReaderRotatePagesIntent {\n    var pages: [ReaderPageEntity]\n    var isClockwise: Bool\n\n    func perform() async throws -> some IntentResult & ReturnsValue<[ReaderPageEntity]> {\n        return .result(value: [ReaderPageEntity]())\n    }\n}\n```\n\nTo learn more about assistant schemas, see [doc:\/\/com.apple.AppIntents\/documentation\/AppIntents\/Integrating-actions-with-siri-and-apple-intelligence]. For a list of available app intents in the `.reader` domain, see [doc:\/\/com.apple.AppIntents\/documentation\/AppIntents\/AssistantSchemas\/ReaderIntent].\n\n### Make sure your entity meets requirements\n\nIf you use app entities to describe custom data types, annotate the app entity implementation with the [doc:\/\/com.apple.AppIntents\/documentation\/AppIntents\/AppEntity(schema:)] macro. This makes sure Siri and Apple Intelligence can understand your data. For example, the intent in the previous section uses `ReaderPageEntity`. The following code snippet shows how the `ReaderPageEntity` implementation uses the [doc:\/\/com.apple.AppIntents\/documentation\/AppIntents\/AppEntity(schema:)] macro:\n\n```swift\n@AppEntity(schema: .reader.document)\nstruct ReaderDocumentEntity {\n    struct Query: EntityStringQuery {\n        func entities(for identifiers: [ReaderDocumentEntity.ID]) async throws -> [ReaderDocumentEntity] { [] }\n        func entities(matching string: String) async throws -> [ReaderDocumentEntity] { [] }\n    }\n    static var defaultQuery = Query()\n    var displayRepresentation: DisplayRepresentation { \"A display representation.\" }\n\n    let id = UUID()\n\n    var title: String\n    var kind: ReaderDocumentKind\n    var width: Int?\n    var height: Int?\n}\n```\n\nThe assistant schema for the `ReaderPageEntity` consists of the `.reader` domain and the [doc:\/\/com.apple.AppIntents\/documentation\/AppIntents\/AssistantSchemas\/ReaderEntity\/document] schema.\n\nFor a list of available app entity schemas in the `.reader` domain, see [doc:\/\/com.apple.AppIntents\/documentation\/AppIntents\/AssistantSchemas\/ReaderEntity].\n\n### Make sure your enumeration meets requirements\n\nTo make sure Siri and Apple Intelligence understand custom static types for your intent parameters, annotate app enumerations with the [doc:\/\/com.apple.AppIntents\/documentation\/AppIntents\/AppEnum(schema:)] macro. Then, pass the `.reader` domain and a schema to it. The following example uses the [doc:\/\/com.apple.AppIntents\/documentation\/AppIntents\/AssistantSchemas\/ReaderEnum\/documentKind] schema:\n\n```swift\nimport Foundation\nimport AppIntents\n\n@AppEnum(schema: .reader.documentKind)\nenum ReaderDocumentKind: String, AppEnum, Codable {\n    case image\n    case pdf\n\n    static var caseDisplayRepresentations: [ReaderDocumentKind: DisplayRepresentation] = [:]\n}\n\n```\n\nFor a list of available app enumeration schemas in the `.reader` domain, see [doc:\/\/com.apple.AppIntents\/documentation\/AppIntents\/AssistantSchemas\/ReaderEnum].\n\n## Document reader\n\n- **AssistantSchemas.ReaderIntent**: Assistant schema conformance for app intents that offer document viewing and editing functionality.\n- **AssistantSchemas.ReaderEntity**: Assistant schema conformance for app entities that describe documents.\n- **AssistantSchemas.ReaderEnum**: Assistant schema conformance for types you use to describe documents.\n\n",
  "sections" : [
    {
      "content" : "",
      "items" : [
        {
          "description" : "Assistant schema conformance for app intents that offer document viewing and editing functionality.",
          "name" : "AssistantSchemas.ReaderIntent",
          "url" : "https:\/\/developer.apple.com\/documentation\/AppIntents\/AssistantSchemas\/ReaderIntent"
        },
        {
          "description" : "Assistant schema conformance for app entities that describe documents.",
          "name" : "AssistantSchemas.ReaderEntity",
          "url" : "https:\/\/developer.apple.com\/documentation\/AppIntents\/AssistantSchemas\/ReaderEntity"
        },
        {
          "description" : "Assistant schema conformance for types you use to describe documents.",
          "name" : "AssistantSchemas.ReaderEnum",
          "url" : "https:\/\/developer.apple.com\/documentation\/AppIntents\/AssistantSchemas\/ReaderEnum"
        }
      ],
      "title" : "Document reader"
    }
  ],
  "source" : "appleJSON",
  "title" : "Making document reader actions available to Siri and Apple Intelligence",
  "url" : "https:\/\/developer.apple.com\/documentation\/appintents\/making-document-reader-actions-available-to-siri-and-apple-intelligence"
}