{
  "abstract" : "A protocol the system uses to provide context relevant to user notifications.",
  "codeExamples" : [

  ],
  "conformingTypes" : [
    "UNNotificationAttributedMessageContext"
  ],
  "contentHash" : "39817ceac06d16c54dd1614900f85bb4ba26d15ef27009d145d63205b8bf9438",
  "crawledAt" : "2025-12-02T12:45:50Z",
  "declaration" : {
    "code" : "protocol UNNotificationContentProviding : NSObjectProtocol",
    "language" : "swift"
  },
  "id" : "3EC2BD6F-3E3C-465A-B12F-88768A5B77C4",
  "kind" : "protocol",
  "module" : "User Notifications",
  "overview" : "## Overview\n\nThe system allows only objects in the Apple SDK that conform to `UNNotificationContentProviding`. The system ignores objects outside of the Apple SDK that your app conforms to `UNNotificationContentProviding`.",
  "platforms" : [
    "iOS",
    "iPadOS",
    "Mac Catalyst",
    "macOS",
    "tvOS",
    "visionOS",
    "watchOS"
  ],
  "rawMarkdown" : "---\nsource: https:\/\/developer.apple.com\/documentation\/usernotifications\/unnotificationcontentproviding\ncrawled: 2025-12-02T12:45:50Z\n---\n\n# UNNotificationContentProviding\n\n**Protocol**\n\nA protocol the system uses to provide context relevant to user notifications.\n\n## Declaration\n\n```swift\nprotocol UNNotificationContentProviding : NSObjectProtocol\n```\n\n## Overview\n\nThe system allows only objects in the Apple SDK that conform to `UNNotificationContentProviding`. The system ignores objects outside of the Apple SDK that your app conforms to `UNNotificationContentProviding`.\n\n## Notification content\n\n- **Implementing communication notifications**: Configure and display your app’s communication notifications by using intents.\n- **UNNotificationActionIcon**: An icon associated with an action.\n- **UNMutableNotificationContent**: The editable content for a notification.\n- **UNNotificationContent**: The uneditable content of a notification.\n- **UNNotificationAttachment**: A media file associated with a notification.\n- **UNNotificationSound**: The sound played upon delivery of a notification.\n- **UNNotificationSoundName**: A string providing the name of a sound file.\n\n## Inherits From\n\n- NSObjectProtocol\n\n## Conforming Types\n\n- UNNotificationAttributedMessageContext\n\n",
  "sections" : [
    {
      "content" : "",
      "items" : [
        {
          "description" : "Configure and display your app’s communication notifications by using intents.",
          "name" : "Implementing communication notifications",
          "url" : "https:\/\/developer.apple.com\/documentation\/UserNotifications\/implementing-communication-notifications"
        },
        {
          "description" : "An icon associated with an action.",
          "name" : "UNNotificationActionIcon",
          "url" : "https:\/\/developer.apple.com\/documentation\/UserNotifications\/UNNotificationActionIcon"
        },
        {
          "description" : "The editable content for a notification.",
          "name" : "UNMutableNotificationContent",
          "url" : "https:\/\/developer.apple.com\/documentation\/UserNotifications\/UNMutableNotificationContent"
        },
        {
          "description" : "The uneditable content of a notification.",
          "name" : "UNNotificationContent",
          "url" : "https:\/\/developer.apple.com\/documentation\/UserNotifications\/UNNotificationContent"
        },
        {
          "description" : "A media file associated with a notification.",
          "name" : "UNNotificationAttachment",
          "url" : "https:\/\/developer.apple.com\/documentation\/UserNotifications\/UNNotificationAttachment"
        },
        {
          "description" : "The sound played upon delivery of a notification.",
          "name" : "UNNotificationSound",
          "url" : "https:\/\/developer.apple.com\/documentation\/UserNotifications\/UNNotificationSound"
        },
        {
          "description" : "A string providing the name of a sound file.",
          "name" : "UNNotificationSoundName",
          "url" : "https:\/\/developer.apple.com\/documentation\/UserNotifications\/UNNotificationSoundName"
        }
      ],
      "title" : "Notification content"
    },
    {
      "content" : "",
      "items" : [
        {
          "name" : "NSObjectProtocol"
        }
      ],
      "title" : "Inherits From"
    }
  ],
  "source" : "appleJSON",
  "title" : "UNNotificationContentProviding",
  "url" : "https:\/\/developer.apple.com\/documentation\/usernotifications\/unnotificationcontentproviding"
}