{
  "abstract" : "Creates a new schedule.",
  "codeExamples" : [

  ],
  "contentHash" : "62e7891af60bbd4a6ef78fc75a9fcf68cb1a4b5074274a43b8cdf14e27500d6a",
  "crawledAt" : "2025-12-04T08:24:24Z",
  "declaration" : {
    "code" : "init(intervalStart: DateComponents, intervalEnd: DateComponents, repeats: Bool, warningTime: DateComponents? = nil)",
    "language" : "swift"
  },
  "id" : "08ACDB57-7BC7-4F63-8A6C-43238E45F346",
  "kind" : "unknown",
  "language" : "swift",
  "module" : "DeviceActivity",
  "overview" : "## Discussion",
  "platforms" : [
    "iOS",
    "iPadOS",
    "Mac Catalyst"
  ],
  "rawMarkdown" : "---\nsource: https:\/\/developer.apple.com\/documentation\/DeviceActivity\/DeviceActivitySchedule\/init(intervalStart:intervalEnd:repeats:warningTime:)\ncrawled: 2025-12-04T08:24:24Z\n---\n\n# init(intervalStart:intervalEnd:repeats:warningTime:)\n\n**Initializer**\n\nCreates a new schedule.\n\n## Declaration\n\n```swift\ninit(intervalStart: DateComponents, intervalEnd: DateComponents, repeats: Bool, warningTime: DateComponents? = nil)\n```\n\n## Parameters\n\n- **intervalStart**: The date components that represent the start time for a schedule’s interval.\n- **intervalEnd**: The date components that represent the end time for a schedule’s interval.\n- **repeats**: Indicates whether the schedule recurs. If `false`, the extension stops receiving callbacks when the interval ends for the first time.\n- **warningTime**: An optional warning time to receive callbacks. If the components specify a longer time interval than the schedule’s interval, the system clamps the warning callbacks for each event’s threshold to the start time of the interval.\n\n## Discussion\n\n\n\n## Creating a Schedule\n\n- **intervalEnd**: The date components that represent the end time for a schedule’s interval.\n- **intervalStart**: The date components that represent the start time for a schedule’s interval.\n- **nextInterval**: The schedule’s next interval or the current interval if one is ongoing.\n- **repeats**: A Boolean value that indicates whether the schedule recurs.\n- **warningTime**: Optional components that generate a warning prior to regularly scheduled events.\n\n",
  "sections" : [
    {
      "content" : "",
      "items" : [
        {
          "description" : "The date components that represent the end time for a schedule’s interval.",
          "name" : "intervalEnd",
          "url" : "https:\/\/developer.apple.com\/documentation\/DeviceActivity\/DeviceActivitySchedule\/intervalEnd"
        },
        {
          "description" : "The date components that represent the start time for a schedule’s interval.",
          "name" : "intervalStart",
          "url" : "https:\/\/developer.apple.com\/documentation\/DeviceActivity\/DeviceActivitySchedule\/intervalStart"
        },
        {
          "description" : "The schedule’s next interval or the current interval if one is ongoing.",
          "name" : "nextInterval",
          "url" : "https:\/\/developer.apple.com\/documentation\/DeviceActivity\/DeviceActivitySchedule\/nextInterval"
        },
        {
          "description" : "A Boolean value that indicates whether the schedule recurs.",
          "name" : "repeats",
          "url" : "https:\/\/developer.apple.com\/documentation\/DeviceActivity\/DeviceActivitySchedule\/repeats"
        },
        {
          "description" : "Optional components that generate a warning prior to regularly scheduled events.",
          "name" : "warningTime",
          "url" : "https:\/\/developer.apple.com\/documentation\/DeviceActivity\/DeviceActivitySchedule\/warningTime"
        }
      ],
      "title" : "Creating a Schedule"
    }
  ],
  "source" : "appleJSON",
  "title" : "init(intervalStart:intervalEnd:repeats:warningTime:)",
  "url" : "https:\/\/developer.apple.com\/documentation\/DeviceActivity\/DeviceActivitySchedule\/init(intervalStart:intervalEnd:repeats:warningTime:)"
}