{
  "abstract" : "Stops monitoring the specified device activities.",
  "codeExamples" : [

  ],
  "contentHash" : "336fa86d3b376575e77d83de91aa7beccfb621e1226b5c7cf028481b41fe8efe",
  "crawledAt" : "2025-12-02T13:27:36Z",
  "declaration" : {
    "code" : "func stopMonitoring(_ activities: [DeviceActivityName] = [])",
    "language" : "swift"
  },
  "id" : "24465542-4B0B-45A2-8D74-FE79BD4859EA",
  "kind" : "method",
  "module" : "DeviceActivity",
  "overview" : "## Discussion\n\nThis method ignores names that don’t correspond to monitored activities.",
  "platforms" : [
    "iOS",
    "iPadOS",
    "Mac Catalyst"
  ],
  "rawMarkdown" : "---\nsource: https:\/\/developer.apple.com\/documentation\/DeviceActivity\/DeviceActivityCenter\/stopMonitoring(_:)\ncrawled: 2025-12-02T13:27:36Z\n---\n\n# stopMonitoring(_:)\n\n**Instance Method**\n\nStops monitoring the specified device activities.\n\n## Declaration\n\n```swift\nfunc stopMonitoring(_ activities: [DeviceActivityName] = [])\n```\n\n## Parameters\n\n- **activities**: The names of the activities. If the array is empty or no `activities` are explicitly specified, this method stops monitoring all activities.\n\n## Discussion\n\nThis method ignores names that don’t correspond to monitored activities.\n\n## Monitoring Device Activities\n\n- **init()**: Creates an activity center to manage which device activities your application monitors.\n- **startMonitoring(_:during:events:)**: Starts monitoring the specified device activity.\n- **activities**: The activities that the application’s extension currently monitors.\n\n",
  "sections" : [
    {
      "content" : "",
      "items" : [
        {
          "description" : "Creates an activity center to manage which device activities your application monitors.",
          "name" : "init()",
          "url" : "https:\/\/developer.apple.com\/documentation\/DeviceActivity\/DeviceActivityCenter\/init()"
        },
        {
          "description" : "Starts monitoring the specified device activity.",
          "name" : "startMonitoring(_:during:events:)",
          "url" : "https:\/\/developer.apple.com\/documentation\/DeviceActivity\/DeviceActivityCenter\/startMonitoring(_:during:events:)"
        },
        {
          "description" : "The activities that the application’s extension currently monitors.",
          "name" : "activities",
          "url" : "https:\/\/developer.apple.com\/documentation\/DeviceActivity\/DeviceActivityCenter\/activities"
        }
      ],
      "title" : "Monitoring Device Activities"
    }
  ],
  "source" : "appleJSON",
  "title" : "stopMonitoring(_:)",
  "url" : "https:\/\/developer.apple.com\/documentation\/DeviceActivity\/DeviceActivityCenter\/stopMonitoring(_:)"
}