{
  "abstract" : "The unique name of an activity.",
  "codeExamples" : [

  ],
  "conformsTo" : [
    "Equatable",
    "Hashable",
    "RawRepresentable"
  ],
  "contentHash" : "b3fc14048596c4096787be294cd375906dad610bd39b7b8ff8e7aadddbdaba2a",
  "crawledAt" : "2025-12-04T08:24:48Z",
  "declaration" : {
    "code" : "struct DeviceActivityName",
    "language" : "swift"
  },
  "id" : "1CD064C7-B0DF-449C-AFDC-3FF5E8C5AB96",
  "kind" : "struct",
  "language" : "swift",
  "module" : "DeviceActivity",
  "overview" : "## Overview\n\nUse `DeviceActivityName` to associate an activity with some of your application’s data. It’s not possible to have multiple activities with the same name. Monitoring a second activity with the same name as a previous activity overwrites the schedule for the first one.",
  "platforms" : [
    "iOS",
    "iPadOS",
    "Mac Catalyst"
  ],
  "rawMarkdown" : "---\nsource: https:\/\/developer.apple.com\/documentation\/deviceactivity\/deviceactivityname\ncrawled: 2025-12-04T08:24:48Z\n---\n\n# DeviceActivityName\n\n**Structure**\n\nThe unique name of an activity.\n\n## Declaration\n\n```swift\nstruct DeviceActivityName\n```\n\n## Overview\n\nUse `DeviceActivityName` to associate an activity with some of your application’s data. It’s not possible to have multiple activities with the same name. Monitoring a second activity with the same name as a previous activity overwrites the schedule for the first one.\n\n## Creating an Instance\n\n- **init(rawValue:)**: Creates a new instance with the specified raw value.\n- **init(_:)**: Creates a new instance with the specified raw value.\n\n## Manage Activities\n\n- **DeviceActivityEvent**: An event that represents an application, category, or website activity.\n- **DeviceActivitySchedule**: A calendar-based schedule for when to monitor a device’s activity.\n- **DeviceActivityCenter**: A class that enables an application’s extension to start monitoring scheduled device activity.\n\n## Conforms To\n\n- Equatable\n- Hashable\n- RawRepresentable\n\n",
  "sections" : [
    {
      "content" : "",
      "items" : [
        {
          "description" : "Creates a new instance with the specified raw value.",
          "name" : "init(rawValue:)",
          "url" : "https:\/\/developer.apple.com\/documentation\/DeviceActivity\/DeviceActivityName\/init(rawValue:)"
        },
        {
          "description" : "Creates a new instance with the specified raw value.",
          "name" : "init(_:)",
          "url" : "https:\/\/developer.apple.com\/documentation\/DeviceActivity\/DeviceActivityName\/init(_:)"
        }
      ],
      "title" : "Creating an Instance"
    },
    {
      "content" : "",
      "items" : [
        {
          "description" : "An event that represents an application, category, or website activity.",
          "name" : "DeviceActivityEvent",
          "url" : "https:\/\/developer.apple.com\/documentation\/DeviceActivity\/DeviceActivityEvent"
        },
        {
          "description" : "A calendar-based schedule for when to monitor a device’s activity.",
          "name" : "DeviceActivitySchedule",
          "url" : "https:\/\/developer.apple.com\/documentation\/DeviceActivity\/DeviceActivitySchedule"
        },
        {
          "description" : "A class that enables an application’s extension to start monitoring scheduled device activity.",
          "name" : "DeviceActivityCenter",
          "url" : "https:\/\/developer.apple.com\/documentation\/DeviceActivity\/DeviceActivityCenter"
        }
      ],
      "title" : "Manage Activities"
    }
  ],
  "source" : "appleJSON",
  "title" : "DeviceActivityName",
  "url" : "https:\/\/developer.apple.com\/documentation\/deviceactivity\/deviceactivityname"
}