{
  "abstract" : "Train a machine learning model to classify natural language text.",
  "codeExamples" : [
    {
      "code" : "\/\/ JSON file\n[\n    {\n        \"text\": \"The movie was fantastic!\",\n        \"label\": \"positive\"\n    }, {\n        \"text\": \"Very boring. Fell asleep.\",\n        \"label\": \"negative\"\n    }, {\n        \"text\": \"It was just OK.\",\n        \"label\": \"neutral\"\n    } ...\n]",
      "language" : "javascript"
    },
    {
      "code" : "import TabularData\n\nlet data = try DataFrame(contentsOfJSONFile: URL(fileURLWithPath: \"<#\/path\/to\/read\/data.json#>\"))",
      "language" : "swift"
    },
    {
      "code" : "let (trainingData, testingData) = data.stratifiedSplit(on: \"text\", by: 0.8)",
      "language" : "swift"
    },
    {
      "code" : "let parameters = MLTextClassifier.ModelParameters(\n    validation: .split(strategy: .automatic),\n    algorithm: .transferLearning(.bertEmbedding, revision: 1),\n    language: .english\n)",
      "language" : "swift"
    },
    {
      "code" : "let sentimentClassifier = try MLTextClassifier(\n    trainingData: trainingData,\n    textColumn: \"text\",\n    labelColumn: \"label\",\n    parameters: parameters\n)",
      "language" : "swift"
    },
    {
      "code" : "\/\/ Calculate training accuracy as a percentage.\nlet trainingAccuracy = (1.0 - sentimentClassifier.trainingMetrics.classificationError) * 100\n\n\/\/ Calculate validation accuracy as a percentage.\nlet validationAccuracy = (1.0 - sentimentClassifier.validationMetrics.classificationError) * 100",
      "language" : "swift"
    },
    {
      "code" : "let evaluationMetrics = sentimentClassifier.evaluation(on: testingData, textColumn: \"text\", labelColumn: \"label\")",
      "language" : "swift"
    },
    {
      "code" : "\/\/ Calculate evaluation accuracy as a percentage.\nlet evaluationAccuracy = (1.0 - evaluationMetrics.classificationError) * 100",
      "language" : "swift"
    },
    {
      "code" : "let metadata = MLModelMetadata(author: \"John Appleseed\",\n                               shortDescription: \"A model trained to classify movie review sentiment\",\n                               version: \"1.0\")\n\ntry sentimentClassifier.write(to: URL(fileURLWithPath: \"<#\/path\/to\/save\/SentimentClassifier.mlmodel#>\"),\n                              metadata: metadata)",
      "language" : "swift"
    },
    {
      "code" : "import NaturalLanguage\nimport CoreML\n\nlet mlModel = try SentimentClassifier(configuration: MLModelConfiguration()).model\n\nlet sentimentPredictor = try NLModel(mlModel: mlModel)\nsentimentPredictor.predictedLabel(for: \"It was the best I've ever seen!\")",
      "language" : "swift"
    }
  ],
  "contentHash" : "0f867d298082ad509b565699d995a059c09654968084c479ba10480cc5a39ce8",
  "crawledAt" : "2025-12-02T19:31:39Z",
  "id" : "07CF1E4A-A824-48F6-9CE8-4957DEA9CCD3",
  "kind" : "article",
  "language" : "swift",
  "module" : "Create ML",
  "overview" : "## Overview\n\nA text classifier is a machine learning model that’s been trained to recognize patterns in natural language text, like the sentiment expressed by a sentence.\n\n\n\nYou train a text classifier by showing it lots of examples of text you’ve already labeled—for example, movie reviews that you’ve already labeled as positive, negative, or neutral.\n\n\n\n### Import your data\n\nStart by gathering textual data and importing it into an [doc:\/\/com.apple.createml\/documentation\/CreateML\/MLDataTable] instance. You can create a data table from JSON and CSV formats. Or, if your textual data is in a collection of files, you can sort them into folders, using the folder names as labels, similar to the image data source used in [doc:\/\/com.apple.createml\/documentation\/CreateML\/creating-an-image-classifier-model].\n\nAs an example, consider a JSON file containing movie reviews that you’ve categorized by sentiment. Each entry contains a pair of keys, the `text` and the `label`. The values of those keys are the input samples used to train your model. The JSON snippet below shows three pairs of sentences with their sentiment labels.\n\nIn a macOS playground, create a data frame using the [doc:\/\/com.apple.documentation\/documentation\/TabularData] framework.\n\nThe resulting data frame has two columns, named *text* and *label*, derived from the keys in the JSON file. The column names can be anything, as long as they are meaningful to you, because you’ll use them as parameters in other methods.\n\n### Prepare your data for training and evaluation\n\nThe data you use to train your model needs to be different from the data you use to evaluate your model. Use the [doc:\/\/com.apple.documentation\/documentation\/TabularData\/DataFrameProtocol\/stratifiedSplit(on:by:randomSeed:)-9iauf] method to split your data into two data frames, one for training and the other for testing. The training data frame contains the majority of your data, and the testing data frame contains the remaining 20 percent.\n\n### Choose model training parameters\n\nYou can use model training parameters to control the learning process. Choose a classifier algorithm type by specifying the [doc:\/\/com.apple.createml\/documentation\/CreateML\/MLTextClassifier\/ModelAlgorithmType] parameter. The [doc:\/\/com.apple.createml\/documentation\/CreateML\/MLTextClassifier\/ModelAlgorithmType\/maxEnt(revision:)] algorithm trains quickly and performs well for a wide variety of data. It’s a good starting point algorithm while you’re exploring your data and models.\n\nYou can choose a transfer learning algorithm, [doc:\/\/com.apple.createml\/documentation\/CreateML\/MLTextClassifier\/ModelAlgorithmType\/transferLearning(_:revision:)].  Transfer learning models use a pre-trained model as a feature extractor, you specify the [doc:\/\/com.apple.createml\/documentation\/CreateML\/MLTextClassifier\/FeatureExtractorType]. Transfer learning models can take longer to train, but can improve accuracy because the baseline model has already been trained on a large amount of text in a specific language.\n\nIf your data contains multiple languages, choose either the maximum entropy algorithm [doc:\/\/com.apple.createml\/documentation\/CreateML\/MLTextClassifier\/ModelAlgorithmType\/maxEnt(revision:)] or the transfer learning algorithm [doc:\/\/com.apple.createml\/documentation\/CreateML\/MLTextClassifier\/ModelAlgorithmType\/transferLearning(_:revision:)] and set its [doc:\/\/com.apple.createml\/documentation\/CreateML\/MLTextClassifier\/FeatureExtractorType] to the Bidirectional Encoder Representations from Transformers (BERT) embedding feature extractor [doc:\/\/com.apple.createml\/documentation\/CreateML\/MLTextClassifier\/FeatureExtractorType\/bertEmbedding].\n\nIf your data contains a single language, use the conditional random fields algorithm [doc:\/\/com.apple.createml\/documentation\/CreateML\/MLTextClassifier\/ModelAlgorithmType\/crf(revision:)] or the transfer learning algorithm [doc:\/\/com.apple.createml\/documentation\/CreateML\/MLTextClassifier\/ModelAlgorithmType\/transferLearning(_:revision:)] and set its [doc:\/\/com.apple.createml\/documentation\/CreateML\/MLTextClassifier\/FeatureExtractorType] to the Embeddings from Language Models (ELMo) embedding feature extractor [doc:\/\/com.apple.createml\/documentation\/CreateML\/MLTextClassifier\/FeatureExtractorType\/elmoEmbedding].\n\nUse the [doc:\/\/com.apple.createml\/documentation\/CreateML\/MLTextClassifier\/ModelParameters-swift.struct\/ValidationData-swift.enum] parameter to specify the evaluation data that’s held out from training your model. During the training process, use the validation data to estimate your model’s ability to correctly classify new examples. Depending on the validation accuracy, the classifier algorithm might adjust values within the model — or stop the training process, if the accuracy is high enough. Since the split of your data is random, you might get a different result each time you train your model.\n\n### Create and train a text classifier\n\nCreate an instance of [doc:\/\/com.apple.createml\/documentation\/CreateML\/MLTextClassifier] with your training data frame and the column names.\n\nTo measure how accurately the model (`sentimentClassifier`) performs on the training and validation data, use the [doc:\/\/com.apple.createml\/documentation\/CreateML\/MLClassifierMetrics\/classificationError] properties of the model’s [doc:\/\/com.apple.createml\/documentation\/CreateML\/MLTextClassifier\/trainingMetrics] and [doc:\/\/com.apple.createml\/documentation\/CreateML\/MLTextClassifier\/validationMetrics] properties.\n\n### Evaluate a classifier’s accuracy\n\nNext, evaluate your trained model’s performance by testing it against sentences it’s never seen before. Pass your testing data frame to the [doc:\/\/com.apple.createml\/documentation\/CreateML\/MLTextClassifier\/evaluation(on:)-8ch4k] method, which returns an [doc:\/\/com.apple.createml\/documentation\/CreateML\/MLClassifierMetrics] instance.\n\nTo get the evaluation accuracy, use the [doc:\/\/com.apple.createml\/documentation\/CreateML\/MLClassifierMetrics\/classificationError] property of the returned [doc:\/\/com.apple.createml\/documentation\/CreateML\/MLClassifierMetrics] instance.\n\nIf the evaluation performance isn’t good enough, you may need to retrain with more data or make other adjustments. For information about improving model performance, see [doc:\/\/com.apple.createml\/documentation\/CreateML\/improving-your-model-s-accuracy].\n\n### Save a Core ML model\n\nWhen your model is performing well enough, you’re ready to save it so you can use it in your app. Use the [doc:\/\/com.apple.createml\/documentation\/CreateML\/MLTextClassifier\/write(to:metadata:)] method to write the Core ML model file to disk. Provide any information about the model, like its author, version, or description in an [doc:\/\/com.apple.createml\/documentation\/CreateML\/MLModelMetadata] instance.\n\nSpecify the file name using the `fileURLWithPath:` parameter, in the above code, `SentimentClassifier.mlmodel`.\n\n### Add a Core ML model to your app\n\nWith your app open in Xcode, drag the `SentimentClassifier.mlmodel` file into the navigation pane. Xcode compiles the model and generates a `SentimentClassifier` class for use in your app. Select the `SentimentClassifier.mlmodel` file in Xcode to view additional information about the model.\n\nCreate an [doc:\/\/com.apple.documentation\/documentation\/NaturalLanguage\/NLModel] in the Natural Language framework from the `SentimentClassifier` to ensure that the tokenization is consistent between training and deployment. Then use [doc:\/\/com.apple.documentation\/documentation\/NaturalLanguage\/NLModel\/predictedLabel(for:)] to generate predictions on new text inputs.",
  "rawMarkdown" : "---\nsource: https:\/\/developer.apple.com\/documentation\/CreateML\/creating-a-text-classifier-model\ncrawled: 2025-12-02T19:31:39Z\n---\n\n# Creating a text classifier model\n\n**Article**\n\nTrain a machine learning model to classify natural language text.\n\n## Overview\n\nA text classifier is a machine learning model that’s been trained to recognize patterns in natural language text, like the sentiment expressed by a sentence.\n\n\n\nYou train a text classifier by showing it lots of examples of text you’ve already labeled—for example, movie reviews that you’ve already labeled as positive, negative, or neutral.\n\n\n\n### Import your data\n\nStart by gathering textual data and importing it into an [doc:\/\/com.apple.createml\/documentation\/CreateML\/MLDataTable] instance. You can create a data table from JSON and CSV formats. Or, if your textual data is in a collection of files, you can sort them into folders, using the folder names as labels, similar to the image data source used in [doc:\/\/com.apple.createml\/documentation\/CreateML\/creating-an-image-classifier-model].\n\nAs an example, consider a JSON file containing movie reviews that you’ve categorized by sentiment. Each entry contains a pair of keys, the `text` and the `label`. The values of those keys are the input samples used to train your model. The JSON snippet below shows three pairs of sentences with their sentiment labels.\n\n```javascript\n\/\/ JSON file\n[\n    {\n        \"text\": \"The movie was fantastic!\",\n        \"label\": \"positive\"\n    }, {\n        \"text\": \"Very boring. Fell asleep.\",\n        \"label\": \"negative\"\n    }, {\n        \"text\": \"It was just OK.\",\n        \"label\": \"neutral\"\n    } ...\n]\n```\n\nIn a macOS playground, create a data frame using the [doc:\/\/com.apple.documentation\/documentation\/TabularData] framework.\n\n```swift\nimport TabularData\n\nlet data = try DataFrame(contentsOfJSONFile: URL(fileURLWithPath: \"<#\/path\/to\/read\/data.json#>\"))\n```\n\nThe resulting data frame has two columns, named *text* and *label*, derived from the keys in the JSON file. The column names can be anything, as long as they are meaningful to you, because you’ll use them as parameters in other methods.\n\n### Prepare your data for training and evaluation\n\nThe data you use to train your model needs to be different from the data you use to evaluate your model. Use the [doc:\/\/com.apple.documentation\/documentation\/TabularData\/DataFrameProtocol\/stratifiedSplit(on:by:randomSeed:)-9iauf] method to split your data into two data frames, one for training and the other for testing. The training data frame contains the majority of your data, and the testing data frame contains the remaining 20 percent.\n\n```swift\nlet (trainingData, testingData) = data.stratifiedSplit(on: \"text\", by: 0.8)\n```\n\n### Choose model training parameters\n\nYou can use model training parameters to control the learning process. Choose a classifier algorithm type by specifying the [doc:\/\/com.apple.createml\/documentation\/CreateML\/MLTextClassifier\/ModelAlgorithmType] parameter. The [doc:\/\/com.apple.createml\/documentation\/CreateML\/MLTextClassifier\/ModelAlgorithmType\/maxEnt(revision:)] algorithm trains quickly and performs well for a wide variety of data. It’s a good starting point algorithm while you’re exploring your data and models.\n\nYou can choose a transfer learning algorithm, [doc:\/\/com.apple.createml\/documentation\/CreateML\/MLTextClassifier\/ModelAlgorithmType\/transferLearning(_:revision:)].  Transfer learning models use a pre-trained model as a feature extractor, you specify the [doc:\/\/com.apple.createml\/documentation\/CreateML\/MLTextClassifier\/FeatureExtractorType]. Transfer learning models can take longer to train, but can improve accuracy because the baseline model has already been trained on a large amount of text in a specific language.\n\nIf your data contains multiple languages, choose either the maximum entropy algorithm [doc:\/\/com.apple.createml\/documentation\/CreateML\/MLTextClassifier\/ModelAlgorithmType\/maxEnt(revision:)] or the transfer learning algorithm [doc:\/\/com.apple.createml\/documentation\/CreateML\/MLTextClassifier\/ModelAlgorithmType\/transferLearning(_:revision:)] and set its [doc:\/\/com.apple.createml\/documentation\/CreateML\/MLTextClassifier\/FeatureExtractorType] to the Bidirectional Encoder Representations from Transformers (BERT) embedding feature extractor [doc:\/\/com.apple.createml\/documentation\/CreateML\/MLTextClassifier\/FeatureExtractorType\/bertEmbedding].\n\nIf your data contains a single language, use the conditional random fields algorithm [doc:\/\/com.apple.createml\/documentation\/CreateML\/MLTextClassifier\/ModelAlgorithmType\/crf(revision:)] or the transfer learning algorithm [doc:\/\/com.apple.createml\/documentation\/CreateML\/MLTextClassifier\/ModelAlgorithmType\/transferLearning(_:revision:)] and set its [doc:\/\/com.apple.createml\/documentation\/CreateML\/MLTextClassifier\/FeatureExtractorType] to the Embeddings from Language Models (ELMo) embedding feature extractor [doc:\/\/com.apple.createml\/documentation\/CreateML\/MLTextClassifier\/FeatureExtractorType\/elmoEmbedding].\n\nUse the [doc:\/\/com.apple.createml\/documentation\/CreateML\/MLTextClassifier\/ModelParameters-swift.struct\/ValidationData-swift.enum] parameter to specify the evaluation data that’s held out from training your model. During the training process, use the validation data to estimate your model’s ability to correctly classify new examples. Depending on the validation accuracy, the classifier algorithm might adjust values within the model — or stop the training process, if the accuracy is high enough. Since the split of your data is random, you might get a different result each time you train your model.\n\n```swift\nlet parameters = MLTextClassifier.ModelParameters(\n    validation: .split(strategy: .automatic),\n    algorithm: .transferLearning(.bertEmbedding, revision: 1),\n    language: .english\n)\n```\n\n### Create and train a text classifier\n\nCreate an instance of [doc:\/\/com.apple.createml\/documentation\/CreateML\/MLTextClassifier] with your training data frame and the column names.\n\n```swift\nlet sentimentClassifier = try MLTextClassifier(\n    trainingData: trainingData,\n    textColumn: \"text\",\n    labelColumn: \"label\",\n    parameters: parameters\n)\n```\n\nTo measure how accurately the model (`sentimentClassifier`) performs on the training and validation data, use the [doc:\/\/com.apple.createml\/documentation\/CreateML\/MLClassifierMetrics\/classificationError] properties of the model’s [doc:\/\/com.apple.createml\/documentation\/CreateML\/MLTextClassifier\/trainingMetrics] and [doc:\/\/com.apple.createml\/documentation\/CreateML\/MLTextClassifier\/validationMetrics] properties.\n\n```swift\n\/\/ Calculate training accuracy as a percentage.\nlet trainingAccuracy = (1.0 - sentimentClassifier.trainingMetrics.classificationError) * 100\n\n\/\/ Calculate validation accuracy as a percentage.\nlet validationAccuracy = (1.0 - sentimentClassifier.validationMetrics.classificationError) * 100\n```\n\n### Evaluate a classifier’s accuracy\n\nNext, evaluate your trained model’s performance by testing it against sentences it’s never seen before. Pass your testing data frame to the [doc:\/\/com.apple.createml\/documentation\/CreateML\/MLTextClassifier\/evaluation(on:)-8ch4k] method, which returns an [doc:\/\/com.apple.createml\/documentation\/CreateML\/MLClassifierMetrics] instance.\n\n```swift\nlet evaluationMetrics = sentimentClassifier.evaluation(on: testingData, textColumn: \"text\", labelColumn: \"label\")\n```\n\nTo get the evaluation accuracy, use the [doc:\/\/com.apple.createml\/documentation\/CreateML\/MLClassifierMetrics\/classificationError] property of the returned [doc:\/\/com.apple.createml\/documentation\/CreateML\/MLClassifierMetrics] instance.\n\n```swift\n\/\/ Calculate evaluation accuracy as a percentage.\nlet evaluationAccuracy = (1.0 - evaluationMetrics.classificationError) * 100\n```\n\nIf the evaluation performance isn’t good enough, you may need to retrain with more data or make other adjustments. For information about improving model performance, see [doc:\/\/com.apple.createml\/documentation\/CreateML\/improving-your-model-s-accuracy].\n\n### Save a Core ML model\n\nWhen your model is performing well enough, you’re ready to save it so you can use it in your app. Use the [doc:\/\/com.apple.createml\/documentation\/CreateML\/MLTextClassifier\/write(to:metadata:)] method to write the Core ML model file to disk. Provide any information about the model, like its author, version, or description in an [doc:\/\/com.apple.createml\/documentation\/CreateML\/MLModelMetadata] instance.\n\n```swift\nlet metadata = MLModelMetadata(author: \"John Appleseed\",\n                               shortDescription: \"A model trained to classify movie review sentiment\",\n                               version: \"1.0\")\n\ntry sentimentClassifier.write(to: URL(fileURLWithPath: \"<#\/path\/to\/save\/SentimentClassifier.mlmodel#>\"),\n                              metadata: metadata)\n```\n\nSpecify the file name using the `fileURLWithPath:` parameter, in the above code, `SentimentClassifier.mlmodel`.\n\n### Add a Core ML model to your app\n\nWith your app open in Xcode, drag the `SentimentClassifier.mlmodel` file into the navigation pane. Xcode compiles the model and generates a `SentimentClassifier` class for use in your app. Select the `SentimentClassifier.mlmodel` file in Xcode to view additional information about the model.\n\nCreate an [doc:\/\/com.apple.documentation\/documentation\/NaturalLanguage\/NLModel] in the Natural Language framework from the `SentimentClassifier` to ensure that the tokenization is consistent between training and deployment. Then use [doc:\/\/com.apple.documentation\/documentation\/NaturalLanguage\/NLModel\/predictedLabel(for:)] to generate predictions on new text inputs.\n\n```swift\nimport NaturalLanguage\nimport CoreML\n\nlet mlModel = try SentimentClassifier(configuration: MLModelConfiguration()).model\n\nlet sentimentPredictor = try NLModel(mlModel: mlModel)\nsentimentPredictor.predictedLabel(for: \"It was the best I've ever seen!\")\n```\n\n## Text models\n\n- **Creating a word tagger model**: Train a machine learning model to tag individual words in natural language text.\n- **MLTextClassifier**: A model you train to classify natural language text.\n- **MLWordTagger**: A word-tagging model you train to classify natural language text at the word level.\n- **MLGazetteer**: A collection of terms and their labels, which augments a tagger that analyzes natural language text.\n- **MLWordEmbedding**: A map of strings in a vector space that enable your app to find similar strings by looking at a string’s neighbors.\n\n",
  "sections" : [
    {
      "content" : "",
      "items" : [
        {
          "description" : "Train a machine learning model to tag individual words in natural language text.",
          "name" : "Creating a word tagger model",
          "url" : "https:\/\/developer.apple.com\/documentation\/CreateML\/creating-a-word-tagger-model"
        },
        {
          "description" : "A model you train to classify natural language text.",
          "name" : "MLTextClassifier",
          "url" : "https:\/\/developer.apple.com\/documentation\/CreateML\/MLTextClassifier"
        },
        {
          "description" : "A word-tagging model you train to classify natural language text at the word level.",
          "name" : "MLWordTagger",
          "url" : "https:\/\/developer.apple.com\/documentation\/CreateML\/MLWordTagger"
        },
        {
          "description" : "A collection of terms and their labels, which augments a tagger that analyzes natural language text.",
          "name" : "MLGazetteer",
          "url" : "https:\/\/developer.apple.com\/documentation\/CreateML\/MLGazetteer"
        },
        {
          "description" : "A map of strings in a vector space that enable your app to find similar strings by looking at a string’s neighbors.",
          "name" : "MLWordEmbedding",
          "url" : "https:\/\/developer.apple.com\/documentation\/CreateML\/MLWordEmbedding"
        }
      ],
      "title" : "Text models"
    }
  ],
  "source" : "appleJSON",
  "title" : "Creating a text classifier model",
  "url" : "https:\/\/developer.apple.com\/documentation\/CreateML\/creating-a-text-classifier-model"
}