{
  "abstract" : "Exports the action classifier as a Core ML model file to the file path.",
  "codeExamples" : [

  ],
  "contentHash" : "7b4632fdd9f40bfeb9e79b73f5e2677904b58ce61daf325470b222eaadbb6b7c",
  "crawledAt" : "2025-12-09T19:47:48Z",
  "declaration" : {
    "code" : "func write(toFile path: String, metadata: MLModelMetadata? = nil) throws",
    "language" : "swift"
  },
  "id" : "0979CBFB-28D1-4FA0-934C-95D120F6704C",
  "kind" : "method",
  "language" : "swift",
  "module" : "Create ML",
  "platforms" : [
    "macOS"
  ],
  "rawMarkdown" : "---\nsource: https:\/\/developer.apple.com\/documentation\/CreateML\/MLActionClassifier\/write(toFile:metadata:)\ncrawled: 2025-12-09T19:47:48Z\n---\n\n# write(toFile:metadata:)\n\n**Instance Method**\n\nExports the action classifier as a Core ML model file to the file path.\n\n## Declaration\n\n```swift\nfunc write(toFile path: String, metadata: MLModelMetadata? = nil) throws\n```\n\n## Parameters\n\n- **path**: The location path in the file system where you want to save the model.\n- **metadata**: Descriptive information to include with the exported model file.\n\n## Saving an action classifier\n\n- **write(to:metadata:)**: Exports the action classifier as a Core ML model file to a location in the file system.\n\n",
  "sections" : [
    {
      "content" : "",
      "items" : [
        {
          "description" : "Exports the action classifier as a Core ML model file to a location in the file system.",
          "name" : "write(to:metadata:)",
          "url" : "https:\/\/developer.apple.com\/documentation\/CreateML\/MLActionClassifier\/write(to:metadata:)"
        }
      ],
      "title" : "Saving an action classifier"
    }
  ],
  "source" : "appleJSON",
  "title" : "write(toFile:metadata:)",
  "url" : "https:\/\/developer.apple.com\/documentation\/CreateML\/MLActionClassifier\/write(toFile:metadata:)"
}