{
  "abstract" : "A map of strings in a vector space that enable your app to find similar strings by looking at a string’s neighbors.",
  "codeExamples" : [
    {
      "code" : "let wordEmbedding = try! MLWordEmbedding(dictionary: [\n    \"Hello\"   : [0.0, 1.2, 5.0, 0.0],\n    \"Goodbye\" : [0.0, 1.3, -6.2, 0.1]\n])",
      "language" : "swift"
    },
    {
      "code" : "try wordEmbedding.write(toFile: \"~\/Desktop\/WordEmbedding.mlmodel\")",
      "language" : "swift"
    }
  ],
  "conformsTo" : [
    "Copyable",
    "CustomDebugStringConvertible",
    "CustomPlaygroundDisplayConvertible",
    "CustomStringConvertible"
  ],
  "contentHash" : "6b13922aee6ac4c6f77a3fdaee78998736e67ef3fba3d6c72860ef5cdefdd7ee",
  "crawledAt" : "2025-12-06T08:27:44Z",
  "declaration" : {
    "code" : "struct MLWordEmbedding",
    "language" : "swift"
  },
  "id" : "486665BE-CF09-42A3-90EC-31C41FAE2CE0",
  "kind" : "struct",
  "language" : "swift",
  "module" : "Create ML",
  "overview" : "## Overview\n\nUse an [doc:\/\/com.apple.createml\/documentation\/CreateML\/MLWordEmbedding] to configure and save a word embedding to a file, which you then add to your project in Xcode. Your project uses that word embedding file at runtime to create an [doc:\/\/com.apple.documentation\/documentation\/NaturalLanguage\/NLEmbedding] instance, which finds similar strings based on the proximity of their vectors.\n\nYou configure a word embedding with a dictionary, keyed by strings which make up the *vocabulary* of the word embedding. The value for each string is an array of doubles, which represents a vector. The length of the arrays is arbitrary but all arrays in a word embedding must be the same length. The length of the arrays determine the number of dimensions in the vector space. For example, the following listing creates a word embedding with four dimensions and a vocabulary of two strings.\n\nOnce you’ve configured an [doc:\/\/com.apple.createml\/documentation\/CreateML\/MLWordEmbedding], save it to an `.mlmodel` file to include in your app.\n\nA word embedding file can efficiently store many strings and their vectors.",
  "platforms" : [
    "macOS"
  ],
  "rawMarkdown" : "---\nsource: https:\/\/developer.apple.com\/documentation\/createml\/mlwordembedding\ncrawled: 2025-12-06T08:27:44Z\n---\n\n# MLWordEmbedding\n\n**Structure**\n\nA map of strings in a vector space that enable your app to find similar strings by looking at a string’s neighbors.\n\n## Declaration\n\n```swift\nstruct MLWordEmbedding\n```\n\n## Overview\n\nUse an [doc:\/\/com.apple.createml\/documentation\/CreateML\/MLWordEmbedding] to configure and save a word embedding to a file, which you then add to your project in Xcode. Your project uses that word embedding file at runtime to create an [doc:\/\/com.apple.documentation\/documentation\/NaturalLanguage\/NLEmbedding] instance, which finds similar strings based on the proximity of their vectors.\n\nYou configure a word embedding with a dictionary, keyed by strings which make up the *vocabulary* of the word embedding. The value for each string is an array of doubles, which represents a vector. The length of the arrays is arbitrary but all arrays in a word embedding must be the same length. The length of the arrays determine the number of dimensions in the vector space. For example, the following listing creates a word embedding with four dimensions and a vocabulary of two strings.\n\n```swift\nlet wordEmbedding = try! MLWordEmbedding(dictionary: [\n    \"Hello\"   : [0.0, 1.2, 5.0, 0.0],\n    \"Goodbye\" : [0.0, 1.3, -6.2, 0.1]\n])\n```\n\nOnce you’ve configured an [doc:\/\/com.apple.createml\/documentation\/CreateML\/MLWordEmbedding], save it to an `.mlmodel` file to include in your app.\n\n```swift\ntry wordEmbedding.write(toFile: \"~\/Desktop\/WordEmbedding.mlmodel\")\n```\n\nA word embedding file can efficiently store many strings and their vectors.\n\n## Creating a word embedding\n\n- **init(dictionary:parameters:)**: Creates a word embedding.\n- **MLWordEmbedding.ModelParameters**: The model configuration parameters.\n- **modelParameters**: The model configuration parameters.\n\n## Testing a word embedding\n\n- **prediction(from:maxCount:maxDistance:distanceType:)**: Predicts neighbors.\n- **distance(between:and:distanceType:)**: Calculates the distance between two strings in the vocabulary space.\n- **NLDistanceType**: The means of calculating a distance between two locations in a text embedding.\n- **contains(_:)**: Returns a Boolean value indicating whether the vocabulary contains the given string.\n- **vector(for:)**: Accesses the vector associated with the given string in the vocabulary.\n\n## Saving a word embedding\n\n- **write(to:metadata:)**: Exports the word embedding as a Core ML model file at the specified URL.\n- **write(toFile:metadata:)**: Exports the word embedding as a Core ML model file at the specified file path.\n\n## Describing a word embedding\n\n- **dimension**: The number of dimensions in the vocabulary embedding space.\n- **vocabularySize**: The number of strings in the vocabulary.\n- **model**: The word embedding contained within a Core ML model file.\n- **description**: A text representation of the word embedding.\n- **debugDescription**: A text representation of the word embedding that’s suitable for output during debugging.\n- **playgroundDescription**: A description of the word embedding shown in a playground.\n\n## Default Implementations\n\n- **CustomDebugStringConvertible Implementations**\n- **CustomPlaygroundDisplayConvertible Implementations**\n- **CustomStringConvertible Implementations**\n\n## Text models\n\n- **Creating a text classifier model**: Train a machine learning model to classify natural language text.\n- **Creating a word tagger model**: Train a machine learning model to tag individual words in natural language text.\n- **MLTextClassifier**: A model you train to classify natural language text.\n- **MLWordTagger**: A word-tagging model you train to classify natural language text at the word level.\n- **MLGazetteer**: A collection of terms and their labels, which augments a tagger that analyzes natural language text.\n\n## Conforms To\n\n- Copyable\n- CustomDebugStringConvertible\n- CustomPlaygroundDisplayConvertible\n- CustomStringConvertible\n\n",
  "sections" : [
    {
      "content" : "",
      "items" : [
        {
          "description" : "Creates a word embedding.",
          "name" : "init(dictionary:parameters:)",
          "url" : "https:\/\/developer.apple.com\/documentation\/CreateML\/MLWordEmbedding\/init(dictionary:parameters:)"
        },
        {
          "description" : "The model configuration parameters.",
          "name" : "MLWordEmbedding.ModelParameters",
          "url" : "https:\/\/developer.apple.com\/documentation\/CreateML\/MLWordEmbedding\/ModelParameters-swift.struct"
        },
        {
          "description" : "The model configuration parameters.",
          "name" : "modelParameters",
          "url" : "https:\/\/developer.apple.com\/documentation\/CreateML\/MLWordEmbedding\/modelParameters-swift.property"
        }
      ],
      "title" : "Creating a word embedding"
    },
    {
      "content" : "",
      "items" : [
        {
          "description" : "Predicts neighbors.",
          "name" : "prediction(from:maxCount:maxDistance:distanceType:)",
          "url" : "https:\/\/developer.apple.com\/documentation\/CreateML\/MLWordEmbedding\/prediction(from:maxCount:maxDistance:distanceType:)"
        },
        {
          "description" : "Calculates the distance between two strings in the vocabulary space.",
          "name" : "distance(between:and:distanceType:)",
          "url" : "https:\/\/developer.apple.com\/documentation\/CreateML\/MLWordEmbedding\/distance(between:and:distanceType:)"
        },
        {
          "description" : "The means of calculating a distance between two locations in a text embedding.",
          "name" : "NLDistanceType",
          "url" : "https:\/\/developer.apple.com\/documentation\/NaturalLanguage\/NLDistanceType"
        },
        {
          "description" : "Returns a Boolean value indicating whether the vocabulary contains the given string.",
          "name" : "contains(_:)",
          "url" : "https:\/\/developer.apple.com\/documentation\/CreateML\/MLWordEmbedding\/contains(_:)"
        },
        {
          "description" : "Accesses the vector associated with the given string in the vocabulary.",
          "name" : "vector(for:)",
          "url" : "https:\/\/developer.apple.com\/documentation\/CreateML\/MLWordEmbedding\/vector(for:)"
        }
      ],
      "title" : "Testing a word embedding"
    },
    {
      "content" : "",
      "items" : [
        {
          "description" : "Exports the word embedding as a Core ML model file at the specified URL.",
          "name" : "write(to:metadata:)",
          "url" : "https:\/\/developer.apple.com\/documentation\/CreateML\/MLWordEmbedding\/write(to:metadata:)"
        },
        {
          "description" : "Exports the word embedding as a Core ML model file at the specified file path.",
          "name" : "write(toFile:metadata:)",
          "url" : "https:\/\/developer.apple.com\/documentation\/CreateML\/MLWordEmbedding\/write(toFile:metadata:)"
        }
      ],
      "title" : "Saving a word embedding"
    },
    {
      "content" : "",
      "items" : [
        {
          "description" : "The number of dimensions in the vocabulary embedding space.",
          "name" : "dimension",
          "url" : "https:\/\/developer.apple.com\/documentation\/CreateML\/MLWordEmbedding\/dimension"
        },
        {
          "description" : "The number of strings in the vocabulary.",
          "name" : "vocabularySize",
          "url" : "https:\/\/developer.apple.com\/documentation\/CreateML\/MLWordEmbedding\/vocabularySize"
        },
        {
          "description" : "The word embedding contained within a Core ML model file.",
          "name" : "model",
          "url" : "https:\/\/developer.apple.com\/documentation\/CreateML\/MLWordEmbedding\/model"
        },
        {
          "description" : "A text representation of the word embedding.",
          "name" : "description",
          "url" : "https:\/\/developer.apple.com\/documentation\/CreateML\/MLWordEmbedding\/description"
        },
        {
          "description" : "A text representation of the word embedding that’s suitable for output during debugging.",
          "name" : "debugDescription",
          "url" : "https:\/\/developer.apple.com\/documentation\/CreateML\/MLWordEmbedding\/debugDescription"
        },
        {
          "description" : "A description of the word embedding shown in a playground.",
          "name" : "playgroundDescription",
          "url" : "https:\/\/developer.apple.com\/documentation\/CreateML\/MLWordEmbedding\/playgroundDescription"
        }
      ],
      "title" : "Describing a word embedding"
    },
    {
      "content" : "",
      "items" : [
        {
          "description" : "",
          "name" : "CustomDebugStringConvertible Implementations",
          "url" : "https:\/\/developer.apple.com\/documentation\/CreateML\/MLWordEmbedding\/CustomDebugStringConvertible-Implementations"
        },
        {
          "description" : "",
          "name" : "CustomPlaygroundDisplayConvertible Implementations",
          "url" : "https:\/\/developer.apple.com\/documentation\/CreateML\/MLWordEmbedding\/CustomPlaygroundDisplayConvertible-Implementations"
        },
        {
          "description" : "",
          "name" : "CustomStringConvertible Implementations",
          "url" : "https:\/\/developer.apple.com\/documentation\/CreateML\/MLWordEmbedding\/CustomStringConvertible-Implementations"
        }
      ],
      "title" : "Default Implementations"
    },
    {
      "content" : "",
      "items" : [
        {
          "description" : "Train a machine learning model to classify natural language text.",
          "name" : "Creating a text classifier model",
          "url" : "https:\/\/developer.apple.com\/documentation\/CreateML\/creating-a-text-classifier-model"
        },
        {
          "description" : "Train a machine learning model to tag individual words in natural language text.",
          "name" : "Creating a word tagger model",
          "url" : "https:\/\/developer.apple.com\/documentation\/CreateML\/creating-a-word-tagger-model"
        },
        {
          "description" : "A model you train to classify natural language text.",
          "name" : "MLTextClassifier",
          "url" : "https:\/\/developer.apple.com\/documentation\/CreateML\/MLTextClassifier"
        },
        {
          "description" : "A word-tagging model you train to classify natural language text at the word level.",
          "name" : "MLWordTagger",
          "url" : "https:\/\/developer.apple.com\/documentation\/CreateML\/MLWordTagger"
        },
        {
          "description" : "A collection of terms and their labels, which augments a tagger that analyzes natural language text.",
          "name" : "MLGazetteer",
          "url" : "https:\/\/developer.apple.com\/documentation\/CreateML\/MLGazetteer"
        }
      ],
      "title" : "Text models"
    }
  ],
  "source" : "appleJSON",
  "title" : "MLWordEmbedding",
  "url" : "https:\/\/developer.apple.com\/documentation\/createml\/mlwordembedding"
}