{
  "abstract" : "A flag indicating if extended authentication will be negotiated.",
  "codeExamples" : [

  ],
  "contentHash" : "fd8593eee481f316031bca8785cf35e1afe799589dfc3e1460e9b0df1fd538cf",
  "crawledAt" : "2025-12-05T16:13:30Z",
  "declaration" : {
    "code" : "var useExtendedAuthentication: Bool { get set }",
    "language" : "swift"
  },
  "id" : "23407B25-3D06-49E4-B6C2-8B291AC4A4F3",
  "kind" : "property",
  "language" : "swift",
  "module" : "Network Extension",
  "overview" : "## Discussion\n\nThis authentication is in addition to the IKE authentication used to authenticate the endpoints of the IKE session.",
  "platforms" : [
    "iOS",
    "iPadOS",
    "Mac Catalyst",
    "macOS",
    "tvOS",
    "visionOS"
  ],
  "rawMarkdown" : "---\nsource: https:\/\/developer.apple.com\/documentation\/NetworkExtension\/NEVPNProtocolIPSec\/useExtendedAuthentication\ncrawled: 2025-12-05T16:13:30Z\n---\n\n# useExtendedAuthentication\n\n**Instance Property**\n\nA flag indicating if extended authentication will be negotiated.\n\n## Declaration\n\n```swift\nvar useExtendedAuthentication: Bool { get set }\n```\n\n## Discussion\n\nThis authentication is in addition to the IKE authentication used to authenticate the endpoints of the IKE session.\n\n- For IKE version 1, when this flag is set X-Auth authentication will be negotiated as part of the IKE session, using the `username` and `passwordReference` properties as the credential.\n- For IKE version 2, when this flag is set EAP authentication will be negotiated as part of the IKE session, using the `username`, `passwordReference`, and\/or `identityReference` properties as the credential depending on which EAP method the server requires.\n\n## Accessing IPSec properties\n\n- **authenticationMethod**: The method used to authenticate the device with the IPSec server. For IKE version 2, when using extended authentication, this authentication method only affects how the client validates the authentication payload presented by the server.\n- **NEVPNIKEAuthenticationMethod**: Internet Key Exchange (IKE) authentication methods used to authenticate with the IPSec server.\n- **sharedSecretReference**: A persistent keychain reference to a keychain item containing the IKE shared secret.\n- **localIdentifier**: A string identifying the iOS or macOS device for authentication purposes\n- **remoteIdentifier**: A string identifying the IPSec server for authentication purposes\n\n",
  "sections" : [
    {
      "content" : "",
      "items" : [
        {
          "description" : "The method used to authenticate the device with the IPSec server. For IKE version 2, when using extended authentication, this authentication method only affects how the client validates the authentication payload presented by the server.",
          "name" : "authenticationMethod",
          "url" : "https:\/\/developer.apple.com\/documentation\/NetworkExtension\/NEVPNProtocolIPSec\/authenticationMethod"
        },
        {
          "description" : "Internet Key Exchange (IKE) authentication methods used to authenticate with the IPSec server.",
          "name" : "NEVPNIKEAuthenticationMethod",
          "url" : "https:\/\/developer.apple.com\/documentation\/NetworkExtension\/NEVPNIKEAuthenticationMethod"
        },
        {
          "description" : "A persistent keychain reference to a keychain item containing the IKE shared secret.",
          "name" : "sharedSecretReference",
          "url" : "https:\/\/developer.apple.com\/documentation\/NetworkExtension\/NEVPNProtocolIPSec\/sharedSecretReference"
        },
        {
          "description" : "A string identifying the iOS or macOS device for authentication purposes",
          "name" : "localIdentifier",
          "url" : "https:\/\/developer.apple.com\/documentation\/NetworkExtension\/NEVPNProtocolIPSec\/localIdentifier"
        },
        {
          "description" : "A string identifying the IPSec server for authentication purposes",
          "name" : "remoteIdentifier",
          "url" : "https:\/\/developer.apple.com\/documentation\/NetworkExtension\/NEVPNProtocolIPSec\/remoteIdentifier"
        }
      ],
      "title" : "Accessing IPSec properties"
    }
  ],
  "source" : "appleJSON",
  "title" : "useExtendedAuthentication",
  "url" : "https:\/\/developer.apple.com\/documentation\/NetworkExtension\/NEVPNProtocolIPSec\/useExtendedAuthentication"
}