{
  "abstract" : "A protocol that defines an object that’s responsible for fetching pre-filter data.",
  "codeExamples" : [

  ],
  "contentHash" : "993173a4a81e642766cba3f1d6d5dfc61ea07cb272f67978aa413c6b8079abc5",
  "crawledAt" : "2025-12-02T15:46:15Z",
  "declaration" : {
    "code" : "protocol NEURLFilterControlProvider : AppExtension",
    "language" : "swift"
  },
  "id" : "01431673-50E9-4B5C-92D9-4CABE3D289D3",
  "kind" : "protocol",
  "language" : "swift",
  "module" : "Network Extension",
  "overview" : "## Overview\n\nCreate a class that conforms to this protocol in your app extension, then provide the extension’s bundle identifier to the [doc:\/\/com.apple.networkextension\/documentation\/NetworkExtension\/NEURLFilterManager] in [doc:\/\/com.apple.networkextension\/documentation\/NetworkExtension\/NEURLFilterManager\/setConfiguration(pirServerURL:pirPrivacyPassIssuerURL:pirAuthenticationToken:controlProviderBundleIdentifier:)].",
  "platforms" : [
    "iOS",
    "iPadOS",
    "Mac Catalyst",
    "macOS"
  ],
  "rawMarkdown" : "---\nsource: https:\/\/developer.apple.com\/documentation\/NetworkExtension\/NEURLFilterControlProvider\ncrawled: 2025-12-02T15:46:15Z\n---\n\n# NEURLFilterControlProvider\n\n**Protocol**\n\nA protocol that defines an object that’s responsible for fetching pre-filter data.\n\n## Declaration\n\n```swift\nprotocol NEURLFilterControlProvider : AppExtension\n```\n\n## Overview\n\nCreate a class that conforms to this protocol in your app extension, then provide the extension’s bundle identifier to the [doc:\/\/com.apple.networkextension\/documentation\/NetworkExtension\/NEURLFilterManager] in [doc:\/\/com.apple.networkextension\/documentation\/NetworkExtension\/NEURLFilterManager\/setConfiguration(pirServerURL:pirPrivacyPassIssuerURL:pirAuthenticationToken:controlProviderBundleIdentifier:)].\n\n## Starting and stopping the provider\n\n- **start()**: Prepares the filter to start, in response to a call from the framework.\n- **stop(reason:)**: Prepares the filter to stop, in response to a call from the framework.\n\n## Fetching a prefilter\n\n- **fetchPrefilter(existingPrefilterTag:)**: Fetches prefilter data, in response to a call from the framework.\n- **NEURLFilterPrefilter**: A structure containing a prefilter returned by a filter control provider.\n\n## URL filters\n\n- **NEURLFilterManager**: A class you use to configure and control a URL filter.\n- **NEURLFilterControlProviderConfiguration**: A class that defines app extension configurations for the URL Filter control provider app extension.\n- **NEURLFilter**: A class used to voluntarily validate URLs for apps that don’t use WebKit or the URL session API.\n- **Filtering traffic by URL**: Perform fast and robust filtering of full URLs by managing URL filtering configurations.\n\n## Inherits From\n\n- AppExtension\n\n",
  "sections" : [
    {
      "content" : "",
      "items" : [
        {
          "description" : "Prepares the filter to start, in response to a call from the framework.",
          "name" : "start()",
          "url" : "https:\/\/developer.apple.com\/documentation\/NetworkExtension\/NEURLFilterControlProvider\/start()"
        },
        {
          "description" : "Prepares the filter to stop, in response to a call from the framework.",
          "name" : "stop(reason:)",
          "url" : "https:\/\/developer.apple.com\/documentation\/NetworkExtension\/NEURLFilterControlProvider\/stop(reason:)"
        }
      ],
      "title" : "Starting and stopping the provider"
    },
    {
      "content" : "",
      "items" : [
        {
          "description" : "Fetches prefilter data, in response to a call from the framework.",
          "name" : "fetchPrefilter(existingPrefilterTag:)",
          "url" : "https:\/\/developer.apple.com\/documentation\/NetworkExtension\/NEURLFilterControlProvider\/fetchPrefilter(existingPrefilterTag:)"
        },
        {
          "description" : "A structure containing a prefilter returned by a filter control provider.",
          "name" : "NEURLFilterPrefilter",
          "url" : "https:\/\/developer.apple.com\/documentation\/NetworkExtension\/NEURLFilterPrefilter"
        }
      ],
      "title" : "Fetching a prefilter"
    },
    {
      "content" : "",
      "items" : [
        {
          "description" : "A class you use to configure and control a URL filter.",
          "name" : "NEURLFilterManager",
          "url" : "https:\/\/developer.apple.com\/documentation\/NetworkExtension\/NEURLFilterManager"
        },
        {
          "description" : "A class that defines app extension configurations for the URL Filter control provider app extension.",
          "name" : "NEURLFilterControlProviderConfiguration",
          "url" : "https:\/\/developer.apple.com\/documentation\/NetworkExtension\/NEURLFilterControlProviderConfiguration"
        },
        {
          "description" : "A class used to voluntarily validate URLs for apps that don’t use WebKit or the URL session API.",
          "name" : "NEURLFilter",
          "url" : "https:\/\/developer.apple.com\/documentation\/NetworkExtension\/NEURLFilter"
        },
        {
          "description" : "Perform fast and robust filtering of full URLs by managing URL filtering configurations.",
          "name" : "Filtering traffic by URL",
          "url" : "https:\/\/developer.apple.com\/documentation\/NetworkExtension\/filtering-traffic-by-url"
        }
      ],
      "title" : "URL filters"
    },
    {
      "content" : "",
      "items" : [
        {
          "name" : "AppExtension"
        }
      ],
      "title" : "Inherits From"
    }
  ],
  "source" : "appleJSON",
  "title" : "NEURLFilterControlProvider",
  "url" : "https:\/\/developer.apple.com\/documentation\/NetworkExtension\/NEURLFilterControlProvider"
}