{
  "abstract" : "An abstract base class shared by NEPacketTunnelProvider and NEAppProxyProvider.",
  "codeExamples" : [

  ],
  "conformsTo" : [
    "CVarArg",
    "CustomDebugStringConvertible",
    "CustomStringConvertible",
    "Equatable",
    "Hashable",
    "NSObjectProtocol"
  ],
  "contentHash" : "6b16325f74ee04a3418d58edd1d3aa6f4b4a2e35cf6eaa624943ac9925ad273e",
  "crawledAt" : "2025-12-01T22:41:32Z",
  "declaration" : {
    "code" : "class NETunnelProvider",
    "language" : "swift"
  },
  "id" : "4A53D21B-165E-4E4A-B046-E63CE78919F6",
  "inheritedBy" : [
    "NEAppProxyProvider",
    "NEPacketTunnelProvider"
  ],
  "kind" : "class",
  "module" : "Network Extension",
  "overview" : "## Overview\n\nEach [doc:\/\/com.apple.networkextension\/documentation\/NetworkExtension\/NETunnelProvider] instance corresponds to a single tunneling session, with a single associated configuration.\n\n### Subclassing Notes\n\nThe `NETunnelProvider` class should not be subclassed directly. Instead, you should create subclasses of `NETunnelProvider` subclasses.\n\n#### Methods to Override",
  "platforms" : [
    "iOS",
    "iPadOS",
    "Mac Catalyst",
    "macOS",
    "tvOS",
    "visionOS"
  ],
  "rawMarkdown" : "---\nsource: https:\/\/developer.apple.com\/documentation\/NetworkExtension\/NETunnelProvider\ncrawled: 2025-12-01T22:41:32Z\n---\n\n# NETunnelProvider\n\n**Class**\n\nAn abstract base class shared by NEPacketTunnelProvider and NEAppProxyProvider.\n\n## Declaration\n\n```swift\nclass NETunnelProvider\n```\n\n## Overview\n\nEach [doc:\/\/com.apple.networkextension\/documentation\/NetworkExtension\/NETunnelProvider] instance corresponds to a single tunneling session, with a single associated configuration.\n\n\n\n### Subclassing Notes\n\nThe `NETunnelProvider` class should not be subclassed directly. Instead, you should create subclasses of `NETunnelProvider` subclasses.\n\n#### Methods to Override\n\n- [doc:\/\/com.apple.networkextension\/documentation\/NetworkExtension\/NETunnelProvider\/handleAppMessage(_:completionHandler:)]\n\n## Getting the tunnel configuration\n\n- **protocolConfiguration**: The configuration of the current tunneling session.\n- **routingMethod**: The method by which network traffic is routed to the tunnel.\n- **appRules**: The app rules dictating which apps use the current tunneling session.\n\n## Configuring the tunnel interface\n\n- **setTunnelNetworkSettings(_:completionHandler:)**: Specify the network settings for the current tunneling session.\n\n## Communicating with the containing app\n\n- **handleAppMessage(_:completionHandler:)**: Handle messages sent by the tunnel provider extension’s containing app.\n\n## Setting tunnel status\n\n- **reasserting**: Indicate to the system that the tunnel is being re-established.\n\n## Errors\n\n- **NETunnelProviderError.Code**: Error codes that the tunnel provider declares.\n- **NETunnelProviderErrorDomain**: The domain used for Tunnel Provider errors.\n- **NETunnelProviderError.Code**: Error codes that the tunnel provider declares.\n\n## App proxy provider\n\n- **NEAppProxyProvider**: The principal class for an app proxy provider app extension.\n- **NEProvider**: An abstract base class for all NetworkExtension providers.\n- **NETunnelNetworkSettings**: The configuration for a tunnel provider’s virtual interface.\n\n## Inherits From\n\n- NEProvider\n\n## Inherited By\n\n- NEAppProxyProvider\n- NEPacketTunnelProvider\n\n## Conforms To\n\n- CVarArg\n- CustomDebugStringConvertible\n- CustomStringConvertible\n- Equatable\n- Hashable\n- NSObjectProtocol\n\n",
  "sections" : [
    {
      "content" : "",
      "items" : [
        {
          "description" : "The configuration of the current tunneling session.",
          "name" : "protocolConfiguration",
          "url" : "https:\/\/developer.apple.com\/documentation\/NetworkExtension\/NETunnelProvider\/protocolConfiguration"
        },
        {
          "description" : "The method by which network traffic is routed to the tunnel.",
          "name" : "routingMethod",
          "url" : "https:\/\/developer.apple.com\/documentation\/NetworkExtension\/NETunnelProvider\/routingMethod"
        },
        {
          "description" : "The app rules dictating which apps use the current tunneling session.",
          "name" : "appRules",
          "url" : "https:\/\/developer.apple.com\/documentation\/NetworkExtension\/NETunnelProvider\/appRules"
        }
      ],
      "title" : "Getting the tunnel configuration"
    },
    {
      "content" : "",
      "items" : [
        {
          "description" : "Specify the network settings for the current tunneling session.",
          "name" : "setTunnelNetworkSettings(_:completionHandler:)",
          "url" : "https:\/\/developer.apple.com\/documentation\/NetworkExtension\/NETunnelProvider\/setTunnelNetworkSettings(_:completionHandler:)"
        }
      ],
      "title" : "Configuring the tunnel interface"
    },
    {
      "content" : "",
      "items" : [
        {
          "description" : "Handle messages sent by the tunnel provider extension’s containing app.",
          "name" : "handleAppMessage(_:completionHandler:)",
          "url" : "https:\/\/developer.apple.com\/documentation\/NetworkExtension\/NETunnelProvider\/handleAppMessage(_:completionHandler:)"
        }
      ],
      "title" : "Communicating with the containing app"
    },
    {
      "content" : "",
      "items" : [
        {
          "description" : "Indicate to the system that the tunnel is being re-established.",
          "name" : "reasserting",
          "url" : "https:\/\/developer.apple.com\/documentation\/NetworkExtension\/NETunnelProvider\/reasserting"
        }
      ],
      "title" : "Setting tunnel status"
    },
    {
      "content" : "",
      "items" : [
        {
          "description" : "Error codes that the tunnel provider declares.",
          "name" : "NETunnelProviderError.Code",
          "url" : "https:\/\/developer.apple.com\/documentation\/NetworkExtension\/NETunnelProviderError-swift.struct\/Code"
        },
        {
          "description" : "The domain used for Tunnel Provider errors.",
          "name" : "NETunnelProviderErrorDomain",
          "url" : "https:\/\/developer.apple.com\/documentation\/NetworkExtension\/NETunnelProviderErrorDomain"
        },
        {
          "description" : "Error codes that the tunnel provider declares.",
          "name" : "NETunnelProviderError.Code",
          "url" : "https:\/\/developer.apple.com\/documentation\/NetworkExtension\/NETunnelProviderError-swift.struct\/Code"
        }
      ],
      "title" : "Errors"
    },
    {
      "content" : "",
      "items" : [
        {
          "description" : "The principal class for an app proxy provider app extension.",
          "name" : "NEAppProxyProvider",
          "url" : "https:\/\/developer.apple.com\/documentation\/NetworkExtension\/NEAppProxyProvider"
        },
        {
          "description" : "An abstract base class for all NetworkExtension providers.",
          "name" : "NEProvider",
          "url" : "https:\/\/developer.apple.com\/documentation\/NetworkExtension\/NEProvider"
        },
        {
          "description" : "The configuration for a tunnel provider’s virtual interface.",
          "name" : "NETunnelNetworkSettings",
          "url" : "https:\/\/developer.apple.com\/documentation\/NetworkExtension\/NETunnelNetworkSettings"
        }
      ],
      "title" : "App proxy provider"
    },
    {
      "content" : "",
      "items" : [
        {
          "name" : "NEProvider"
        }
      ],
      "title" : "Inherits From"
    }
  ],
  "source" : "appleJSON",
  "title" : "NETunnelProvider",
  "url" : "https:\/\/developer.apple.com\/documentation\/NetworkExtension\/NETunnelProvider"
}