{
  "abstract" : "Applies a set of filtering rules associated with the provider and changes the default filtering action.",
  "codeExamples" : [

  ],
  "contentHash" : "f60d8e97fb22ad61ecacc95cede580bd85555498dffba9acd4c6891e73eeb0b7",
  "crawledAt" : "2025-12-01T22:15:05Z",
  "declaration" : {
    "code" : "func apply(_ settings: NEFilterSettings?, completionHandler: @escaping ((any Error)?) -> Void)",
    "language" : "swift"
  },
  "id" : "3CA3603D-B57C-4C5B-9989-BB77272EA04A",
  "kind" : "method",
  "module" : "Network Extension",
  "platforms" : [
    "macOS"
  ],
  "rawMarkdown" : "---\nsource: https:\/\/developer.apple.com\/documentation\/NetworkExtension\/NEFilterDataProvider\/apply(_:completionHandler:)\ncrawled: 2025-12-01T22:15:05Z\n---\n\n# apply(_:completionHandler:)\n\n**Instance Method**\n\nApplies a set of filtering rules associated with the provider and changes the default filtering action.\n\n## Declaration\n\n```swift\nfunc apply(_ settings: NEFilterSettings?, completionHandler: @escaping ((any Error)?) -> Void)\n```\n\n```swift\nfunc apply(_ settings: NEFilterSettings?) async throws\n```\n\n## Parameters\n\n- **settings**: A [doc:\/\/com.apple.networkextension\/documentation\/NetworkExtension\/NEFilterSettings] object containing the filter settings to apply to the system. Pass `nil` to revert to the default settings, which are an empty list of rules and a default action of [doc:\/\/com.apple.networkextension\/documentation\/NetworkExtension\/NEFilterAction\/filterData].\n- **completionHandler**: A Swift closure or ObjectiveC block that executes when the system finishes applying the settings. It receives an [doc:\/\/com.apple.documentation\/documentation\/Foundation\/NSError] parameter; a non-`nil` value that indicates thereâ€™s an error contidition.\n\n## Changing filter settings\n\n- **NEFilterSettings**: The rules and other settings that define the operation of a filter.\n\n",
  "sections" : [
    {
      "content" : "",
      "items" : [
        {
          "description" : "The rules and other settings that define the operation of a filter.",
          "name" : "NEFilterSettings",
          "url" : "https:\/\/developer.apple.com\/documentation\/NetworkExtension\/NEFilterSettings"
        }
      ],
      "title" : "Changing filter settings"
    }
  ],
  "source" : "appleJSON",
  "title" : "apply(_:completionHandler:)",
  "url" : "https:\/\/developer.apple.com\/documentation\/NetworkExtension\/NEFilterDataProvider\/apply(_:completionHandler:)"
}