{
  "abstract" : "An object representing metrics about your app’s disk space usage.",
  "codeExamples" : [

  ],
  "conformsTo" : [
    "CVarArg",
    "CustomDebugStringConvertible",
    "CustomStringConvertible",
    "Equatable",
    "Hashable",
    "NSCoding",
    "NSObjectProtocol",
    "NSSecureCoding"
  ],
  "contentHash" : "a9a44d63ce50d6acd63eb02fcdbbf66481ca942c99109786a1007daf6dfc6170",
  "crawledAt" : "2025-12-03T04:47:29Z",
  "declaration" : {
    "code" : "class MXDiskSpaceUsageMetric",
    "language" : "swift"
  },
  "id" : "5FFE34CD-E558-42F9-BC57-271C2873CA53",
  "kind" : "class",
  "language" : "swift",
  "module" : "MetricKit",
  "overview" : "## Overview\n\nThis object provides insights on how your app utilizes disk space and related storage technologies, such as cache folders and clone files.\n\nDisk space is a limited resource shared by many apps. Optimize your app’s disk space usage to provide a better customer experience. People can inspect your app’s disk footprint in Settings, and excessive usage may force them to remove your app to install new apps or perform system updates.\n\n### Disk Space Measurements\n\nModern file systems such APFS provide enhanced features to maximize space utilization, such as file cloning. The disk space usage metric reports size accurately without double counting the cloned files.\n\nFor example, if you copy a file using [doc:\/\/com.apple.documentation\/documentation\/Foundation\/FileManager\/copyItem(at:to:)], the file system shows two separate files. However, due to the file system optimization, the copied file shares the same storage space with the original file. If you manually calculate the size of all your files, your calculation may also include the copied file, resulting in a larger size than expected.\n\n### Storing App-Specific Files\n\nUse the [doc:\/\/com.apple.metrickit\/documentation\/MetricKit\/MXDiskSpaceUsageMetric\/totalCacheFolderSize] property of MXDiskSpaceUsageMetric to gain insights into how the operating system manages your app’s cached content in the field. Placing files in the appropriate directories, such as the [doc:\/\/com.apple.documentation\/documentation\/Foundation\/URL\/cachesDirectory] and [doc:\/\/com.apple.documentation\/documentation\/Foundation\/URL\/temporaryDirectory] (see [https:\/\/developer.apple.com\/library\/archive\/documentation\/FileManagement\/Conceptual\/FileSystemProgrammingGuide\/FileSystemOverview\/FileSystemOverview.html]), allows the system to intelligently manage and purge content when necessary, ensuring optimal disk space utilization and a better user experience.",
  "platforms" : [
    "iOS",
    "iPadOS",
    "Mac Catalyst",
    "macOS",
    "visionOS"
  ],
  "rawMarkdown" : "---\nsource: https:\/\/developer.apple.com\/documentation\/MetricKit\/MXDiskSpaceUsageMetric\ncrawled: 2025-12-03T04:47:29Z\n---\n\n# MXDiskSpaceUsageMetric\n\n**Class**\n\nAn object representing metrics about your app’s disk space usage.\n\n## Declaration\n\n```swift\nclass MXDiskSpaceUsageMetric\n```\n\n## Overview\n\nThis object provides insights on how your app utilizes disk space and related storage technologies, such as cache folders and clone files.\n\nDisk space is a limited resource shared by many apps. Optimize your app’s disk space usage to provide a better customer experience. People can inspect your app’s disk footprint in Settings, and excessive usage may force them to remove your app to install new apps or perform system updates.\n\n\n\n### Disk Space Measurements\n\nModern file systems such APFS provide enhanced features to maximize space utilization, such as file cloning. The disk space usage metric reports size accurately without double counting the cloned files.\n\nFor example, if you copy a file using [doc:\/\/com.apple.documentation\/documentation\/Foundation\/FileManager\/copyItem(at:to:)], the file system shows two separate files. However, due to the file system optimization, the copied file shares the same storage space with the original file. If you manually calculate the size of all your files, your calculation may also include the copied file, resulting in a larger size than expected.\n\n### Storing App-Specific Files\n\nUse the [doc:\/\/com.apple.metrickit\/documentation\/MetricKit\/MXDiskSpaceUsageMetric\/totalCacheFolderSize] property of MXDiskSpaceUsageMetric to gain insights into how the operating system manages your app’s cached content in the field. Placing files in the appropriate directories, such as the [doc:\/\/com.apple.documentation\/documentation\/Foundation\/URL\/cachesDirectory] and [doc:\/\/com.apple.documentation\/documentation\/Foundation\/URL\/temporaryDirectory] (see [https:\/\/developer.apple.com\/library\/archive\/documentation\/FileManagement\/Conceptual\/FileSystemProgrammingGuide\/FileSystemOverview\/FileSystemOverview.html]), allows the system to intelligently manage and purge content when necessary, ensuring optimal disk space utilization and a better user experience.\n\n## Reading file counts\n\n- **totalBinaryFileCount**: The total number of your app’s binary files.\n- **totalDataFileCount**: The total number of data files in your app’s container(s).\n\n## Reading file sizes\n\n- **totalBinaryFileSize**: The total size of disk space your app’s binary files occupy.\n- **totalCacheFolderSize**: The total size of your application’s cache folder.\n- **totalCloneSize**: The total size of all clone files that are attributed to your app.\n- **totalDataFileSize**: The total size of disk space your app uses for storing data files.\n\n## Reading disk capacity and space\n\n- **totalDiskSpaceCapacity**: The total disk space capacity of the current device.\n- **totalDiskSpaceUsedSize**: The total amount of used disk storage on the current device.\n\n## Disk usage metrics\n\n- **MXDiskIOMetric**: An object representing metrics about disk usage.\n- **MXDiskWriteExceptionDiagnostic**: An object representing a diagnostic report for a disk write exception.\n\n## Inherits From\n\n- MXMetric\n\n## Conforms To\n\n- CVarArg\n- CustomDebugStringConvertible\n- CustomStringConvertible\n- Equatable\n- Hashable\n- NSCoding\n- NSObjectProtocol\n- NSSecureCoding\n\n",
  "sections" : [
    {
      "content" : "",
      "items" : [
        {
          "description" : "The total number of your app’s binary files.",
          "name" : "totalBinaryFileCount",
          "url" : "https:\/\/developer.apple.com\/documentation\/MetricKit\/MXDiskSpaceUsageMetric\/totalBinaryFileCount"
        },
        {
          "description" : "The total number of data files in your app’s container(s).",
          "name" : "totalDataFileCount",
          "url" : "https:\/\/developer.apple.com\/documentation\/MetricKit\/MXDiskSpaceUsageMetric\/totalDataFileCount"
        }
      ],
      "title" : "Reading file counts"
    },
    {
      "content" : "",
      "items" : [
        {
          "description" : "The total size of disk space your app’s binary files occupy.",
          "name" : "totalBinaryFileSize",
          "url" : "https:\/\/developer.apple.com\/documentation\/MetricKit\/MXDiskSpaceUsageMetric\/totalBinaryFileSize"
        },
        {
          "description" : "The total size of your application’s cache folder.",
          "name" : "totalCacheFolderSize",
          "url" : "https:\/\/developer.apple.com\/documentation\/MetricKit\/MXDiskSpaceUsageMetric\/totalCacheFolderSize"
        },
        {
          "description" : "The total size of all clone files that are attributed to your app.",
          "name" : "totalCloneSize",
          "url" : "https:\/\/developer.apple.com\/documentation\/MetricKit\/MXDiskSpaceUsageMetric\/totalCloneSize"
        },
        {
          "description" : "The total size of disk space your app uses for storing data files.",
          "name" : "totalDataFileSize",
          "url" : "https:\/\/developer.apple.com\/documentation\/MetricKit\/MXDiskSpaceUsageMetric\/totalDataFileSize"
        }
      ],
      "title" : "Reading file sizes"
    },
    {
      "content" : "",
      "items" : [
        {
          "description" : "The total disk space capacity of the current device.",
          "name" : "totalDiskSpaceCapacity",
          "url" : "https:\/\/developer.apple.com\/documentation\/MetricKit\/MXDiskSpaceUsageMetric\/totalDiskSpaceCapacity"
        },
        {
          "description" : "The total amount of used disk storage on the current device.",
          "name" : "totalDiskSpaceUsedSize",
          "url" : "https:\/\/developer.apple.com\/documentation\/MetricKit\/MXDiskSpaceUsageMetric\/totalDiskSpaceUsedSize"
        }
      ],
      "title" : "Reading disk capacity and space"
    },
    {
      "content" : "",
      "items" : [
        {
          "description" : "An object representing metrics about disk usage.",
          "name" : "MXDiskIOMetric",
          "url" : "https:\/\/developer.apple.com\/documentation\/MetricKit\/MXDiskIOMetric"
        },
        {
          "description" : "An object representing a diagnostic report for a disk write exception.",
          "name" : "MXDiskWriteExceptionDiagnostic",
          "url" : "https:\/\/developer.apple.com\/documentation\/MetricKit\/MXDiskWriteExceptionDiagnostic"
        }
      ],
      "title" : "Disk usage metrics"
    },
    {
      "content" : "",
      "items" : [
        {
          "name" : "MXMetric"
        }
      ],
      "title" : "Inherits From"
    }
  ],
  "source" : "appleJSON",
  "title" : "MXDiskSpaceUsageMetric",
  "url" : "https:\/\/developer.apple.com\/documentation\/MetricKit\/MXDiskSpaceUsageMetric"
}