{
  "abstract" : "An instance that describes how to organize and map data to a vertex function.",
  "codeExamples" : [

  ],
  "conformsTo" : [
    "CVarArg",
    "CustomDebugStringConvertible",
    "CustomStringConvertible",
    "Equatable",
    "Hashable",
    "NSCopying",
    "NSObjectProtocol"
  ],
  "contentHash" : "53ae5cee8c6f67ffd9676b429dd072c5371c61fcd99fab0b6babd6b45870ac34",
  "crawledAt" : "2025-12-01T17:58:18Z",
  "declaration" : {
    "code" : "class MTLVertexDescriptor",
    "language" : "swift"
  },
  "id" : "0CF02369-43A8-4E7B-BEA4-A1EDEBA55A26",
  "kind" : "class",
  "module" : "Metal",
  "overview" : "## Overview\n\nAn [doc:\/\/com.apple.metal\/documentation\/Metal\/MTLVertexDescriptor] instance is used to configure how vertex data stored in memory is mapped to attributes in a vertex shader.\n\nA pipeline state is the state of the graphics rendering pipeline, including shaders, blending, multisampling, and visibility testing. For every pipeline state, there can be only one [doc:\/\/com.apple.metal\/documentation\/Metal\/MTLVertexDescriptor] instance. When you configure an [doc:\/\/com.apple.metal\/documentation\/Metal\/MTLRenderPipelineDescriptor] instance to create this pipeline state, you use an [doc:\/\/com.apple.metal\/documentation\/Metal\/MTLVertexDescriptor] instance to establish the vertex layout for the function associated with the pipeline. Create and configure an [doc:\/\/com.apple.metal\/documentation\/Metal\/MTLVertexDescriptor] instance, then use this instance to set the [doc:\/\/com.apple.metal\/documentation\/Metal\/MTLRenderPipelineDescriptor\/vertexDescriptor] property of the [doc:\/\/com.apple.metal\/documentation\/Metal\/MTLRenderPipelineDescriptor] instance.",
  "platforms" : [
    "iOS",
    "iPadOS",
    "Mac Catalyst",
    "macOS",
    "tvOS",
    "visionOS"
  ],
  "rawMarkdown" : "---\nsource: https:\/\/developer.apple.com\/documentation\/Metal\/MTLVertexDescriptor\ncrawled: 2025-12-01T17:58:18Z\n---\n\n# MTLVertexDescriptor\n\n**Class**\n\nAn instance that describes how to organize and map data to a vertex function.\n\n## Declaration\n\n```swift\nclass MTLVertexDescriptor\n```\n\n## Overview\n\nAn [doc:\/\/com.apple.metal\/documentation\/Metal\/MTLVertexDescriptor] instance is used to configure how vertex data stored in memory is mapped to attributes in a vertex shader.\n\nA pipeline state is the state of the graphics rendering pipeline, including shaders, blending, multisampling, and visibility testing. For every pipeline state, there can be only one [doc:\/\/com.apple.metal\/documentation\/Metal\/MTLVertexDescriptor] instance. When you configure an [doc:\/\/com.apple.metal\/documentation\/Metal\/MTLRenderPipelineDescriptor] instance to create this pipeline state, you use an [doc:\/\/com.apple.metal\/documentation\/Metal\/MTLVertexDescriptor] instance to establish the vertex layout for the function associated with the pipeline. Create and configure an [doc:\/\/com.apple.metal\/documentation\/Metal\/MTLVertexDescriptor] instance, then use this instance to set the [doc:\/\/com.apple.metal\/documentation\/Metal\/MTLRenderPipelineDescriptor\/vertexDescriptor] property of the [doc:\/\/com.apple.metal\/documentation\/Metal\/MTLRenderPipelineDescriptor] instance.\n\n## Setting default values\n\n- **reset()**: Resets the default state for the vertex descriptor.\n\n## Accessing the vertex buffer layouts and vertex attributes\n\n- **attributes**: An array of state data that describes how vertex attribute data is stored in memory and is mapped to arguments for a vertex shader function.\n- **layouts**: An array of state data that describes how data are fetched by a vertex shader function when rendering primitives.\n\n## Render pass inputs\n\n- **MTLVertexAttributeDescriptor**: An object that determines how to store attribute data in memory and map it to the arguments of a vertex function.\n- **MTLVertexAttributeDescriptorArray**: An array of vertex attribute descriptor instances.\n- **MTLVertexBufferLayoutDescriptor**: An object that configures how a render pipeline fetches data to send to the vertex function.\n- **MTLVertexBufferLayoutDescriptorArray**: An array of vertex buffer layout descriptor instances.\n- **MTLBufferLayoutStrideDynamic**\n\n## Inherits From\n\n- NSObject\n\n## Conforms To\n\n- CVarArg\n- CustomDebugStringConvertible\n- CustomStringConvertible\n- Equatable\n- Hashable\n- NSCopying\n- NSObjectProtocol\n\n",
  "sections" : [
    {
      "content" : "",
      "items" : [
        {
          "description" : "Resets the default state for the vertex descriptor.",
          "name" : "reset()",
          "url" : "https:\/\/developer.apple.com\/documentation\/Metal\/MTLVertexDescriptor\/reset()"
        }
      ],
      "title" : "Setting default values"
    },
    {
      "content" : "",
      "items" : [
        {
          "description" : "An array of state data that describes how vertex attribute data is stored in memory and is mapped to arguments for a vertex shader function.",
          "name" : "attributes",
          "url" : "https:\/\/developer.apple.com\/documentation\/Metal\/MTLVertexDescriptor\/attributes"
        },
        {
          "description" : "An array of state data that describes how data are fetched by a vertex shader function when rendering primitives.",
          "name" : "layouts",
          "url" : "https:\/\/developer.apple.com\/documentation\/Metal\/MTLVertexDescriptor\/layouts"
        }
      ],
      "title" : "Accessing the vertex buffer layouts and vertex attributes"
    },
    {
      "content" : "",
      "items" : [
        {
          "description" : "An object that determines how to store attribute data in memory and map it to the arguments of a vertex function.",
          "name" : "MTLVertexAttributeDescriptor",
          "url" : "https:\/\/developer.apple.com\/documentation\/Metal\/MTLVertexAttributeDescriptor"
        },
        {
          "description" : "An array of vertex attribute descriptor instances.",
          "name" : "MTLVertexAttributeDescriptorArray",
          "url" : "https:\/\/developer.apple.com\/documentation\/Metal\/MTLVertexAttributeDescriptorArray"
        },
        {
          "description" : "An object that configures how a render pipeline fetches data to send to the vertex function.",
          "name" : "MTLVertexBufferLayoutDescriptor",
          "url" : "https:\/\/developer.apple.com\/documentation\/Metal\/MTLVertexBufferLayoutDescriptor"
        },
        {
          "description" : "An array of vertex buffer layout descriptor instances.",
          "name" : "MTLVertexBufferLayoutDescriptorArray",
          "url" : "https:\/\/developer.apple.com\/documentation\/Metal\/MTLVertexBufferLayoutDescriptorArray"
        },
        {
          "description" : "",
          "name" : "MTLBufferLayoutStrideDynamic",
          "url" : "https:\/\/developer.apple.com\/documentation\/Metal\/MTLBufferLayoutStrideDynamic"
        }
      ],
      "title" : "Render pass inputs"
    },
    {
      "content" : "",
      "items" : [
        {
          "name" : "NSObject"
        }
      ],
      "title" : "Inherits From"
    }
  ],
  "source" : "appleJSON",
  "title" : "MTLVertexDescriptor",
  "url" : "https:\/\/developer.apple.com\/documentation\/Metal\/MTLVertexDescriptor"
}