{
  "abstract" : "The bounds for a subset of an instance’s elements.",
  "codeExamples" : [

  ],
  "conformsTo" : [
    "BitwiseCopyable",
    "Sendable"
  ],
  "contentHash" : "7823a331c9fa89f2f2cfa36023d55f610e310818423d2081587fabb7f08f191d",
  "crawledAt" : "2025-12-03T13:14:35Z",
  "declaration" : {
    "code" : "struct MTLRegion",
    "language" : "swift"
  },
  "id" : "2B6141BC-02F6-451B-A364-A43CA0A802CB",
  "kind" : "struct",
  "language" : "swift",
  "module" : "Metal",
  "overview" : "## Overview\n\nMetal has many instance types that represent arrays of discrete elements. For example, a texture has an array of pixel elements, and a thread grid has an array of computational threads. Use [doc:\/\/com.apple.metal\/documentation\/Metal\/MTLRegion] instances to describe subsets of these instances.\n\nThe origin is the front upper-left corner of the region, and its extents go towards the back lower-right corner. Conceptually, when using an [doc:\/\/com.apple.metal\/documentation\/Metal\/MTLRegion] instance to describe a subset of an instance, treat the instance as a 3D array of elements, even if it has fewer dimensions. For a 2D instance, set the z coordinate of the origin to `0` and the depth to `1`. For a 1D instance, set the y and z coordinates of the origin to `0` and the height and depth to `1`.",
  "platforms" : [
    "iOS",
    "iPadOS",
    "Mac Catalyst",
    "macOS",
    "tvOS",
    "visionOS"
  ],
  "rawMarkdown" : "---\nsource: https:\/\/developer.apple.com\/documentation\/Metal\/MTLRegion\ncrawled: 2025-12-03T13:14:35Z\n---\n\n# MTLRegion\n\n**Structure**\n\nThe bounds for a subset of an instance’s elements.\n\n## Declaration\n\n```swift\nstruct MTLRegion\n```\n\n## Overview\n\nMetal has many instance types that represent arrays of discrete elements. For example, a texture has an array of pixel elements, and a thread grid has an array of computational threads. Use [doc:\/\/com.apple.metal\/documentation\/Metal\/MTLRegion] instances to describe subsets of these instances.\n\nThe origin is the front upper-left corner of the region, and its extents go towards the back lower-right corner. Conceptually, when using an [doc:\/\/com.apple.metal\/documentation\/Metal\/MTLRegion] instance to describe a subset of an instance, treat the instance as a 3D array of elements, even if it has fewer dimensions. For a 2D instance, set the z coordinate of the origin to `0` and the depth to `1`. For a 1D instance, set the y and z coordinates of the origin to `0` and the height and depth to `1`.\n\n## Creating regions\n\n- **init()**: Initializes a new region.\n- **init(origin:size:)**: Initializes a new region with the specified origin and size.\n- **MTLRegionMake1D(_:_:)**: Creates a 3D representation of a 1D region.\n- **MTLRegionMake2D(_:_:_:_:)**: Creates a 3D representation of a 2D region.\n- **MTLRegionMake3D(_:_:_:_:_:_:)**: Creates a 3D region.\n\n## Getting and setting region information\n\n- **origin**: The coordinates of the front upper-left corner of the region.\n- **size**: The dimensions of the region.\n\n## Indirect compute commands\n\n- **MTLIndirectComputeCommand**: A compute command in an indirect command buffer.\n- **MTLSize**: A type that represents one, two, or three dimensions of a type instance, such as an array or texture.\n- **MTLOrigin**: The coordinates for the front upper-left corner of a region.\n- **MTLStageInRegionIndirectArguments**: The data layout required for the arguments needed to specify the stage-in region.\n- **MTLDispatchThreadgroupsIndirectArguments**: The data layout required for arguments needed to specify the size of threadgroups.\n\n## Conforms To\n\n- BitwiseCopyable\n- Sendable\n\n",
  "sections" : [
    {
      "content" : "",
      "items" : [
        {
          "description" : "Initializes a new region.",
          "name" : "init()",
          "url" : "https:\/\/developer.apple.com\/documentation\/Metal\/MTLRegion\/init()"
        },
        {
          "description" : "Initializes a new region with the specified origin and size.",
          "name" : "init(origin:size:)",
          "url" : "https:\/\/developer.apple.com\/documentation\/Metal\/MTLRegion\/init(origin:size:)"
        },
        {
          "description" : "Creates a 3D representation of a 1D region.",
          "name" : "MTLRegionMake1D(_:_:)",
          "url" : "https:\/\/developer.apple.com\/documentation\/Metal\/MTLRegionMake1D(_:_:)"
        },
        {
          "description" : "Creates a 3D representation of a 2D region.",
          "name" : "MTLRegionMake2D(_:_:_:_:)",
          "url" : "https:\/\/developer.apple.com\/documentation\/Metal\/MTLRegionMake2D(_:_:_:_:)"
        },
        {
          "description" : "Creates a 3D region.",
          "name" : "MTLRegionMake3D(_:_:_:_:_:_:)",
          "url" : "https:\/\/developer.apple.com\/documentation\/Metal\/MTLRegionMake3D(_:_:_:_:_:_:)"
        }
      ],
      "title" : "Creating regions"
    },
    {
      "content" : "",
      "items" : [
        {
          "description" : "The coordinates of the front upper-left corner of the region.",
          "name" : "origin",
          "url" : "https:\/\/developer.apple.com\/documentation\/Metal\/MTLRegion\/origin"
        },
        {
          "description" : "The dimensions of the region.",
          "name" : "size",
          "url" : "https:\/\/developer.apple.com\/documentation\/Metal\/MTLRegion\/size"
        }
      ],
      "title" : "Getting and setting region information"
    },
    {
      "content" : "",
      "items" : [
        {
          "description" : "A compute command in an indirect command buffer.",
          "name" : "MTLIndirectComputeCommand",
          "url" : "https:\/\/developer.apple.com\/documentation\/Metal\/MTLIndirectComputeCommand"
        },
        {
          "description" : "A type that represents one, two, or three dimensions of a type instance, such as an array or texture.",
          "name" : "MTLSize",
          "url" : "https:\/\/developer.apple.com\/documentation\/Metal\/MTLSize"
        },
        {
          "description" : "The coordinates for the front upper-left corner of a region.",
          "name" : "MTLOrigin",
          "url" : "https:\/\/developer.apple.com\/documentation\/Metal\/MTLOrigin"
        },
        {
          "description" : "The data layout required for the arguments needed to specify the stage-in region.",
          "name" : "MTLStageInRegionIndirectArguments",
          "url" : "https:\/\/developer.apple.com\/documentation\/Metal\/MTLStageInRegionIndirectArguments"
        },
        {
          "description" : "The data layout required for arguments needed to specify the size of threadgroups.",
          "name" : "MTLDispatchThreadgroupsIndirectArguments",
          "url" : "https:\/\/developer.apple.com\/documentation\/Metal\/MTLDispatchThreadgroupsIndirectArguments"
        }
      ],
      "title" : "Indirect compute commands"
    }
  ],
  "source" : "appleJSON",
  "title" : "MTLRegion",
  "url" : "https:\/\/developer.apple.com\/documentation\/Metal\/MTLRegion"
}