{
  "abstract" : "A Boolean value that determines where commands in the indirect command buffer get their pipeline state from when you execute them.",
  "codeExamples" : [

  ],
  "contentHash" : "c5d6f4ceee931679485bb28cb6b16ebed27049c0820cba74280f1fae39c7f354",
  "crawledAt" : "2025-12-02T19:37:57Z",
  "declaration" : {
    "code" : "var inheritPipelineState: Bool { get set }",
    "language" : "swift"
  },
  "id" : "019A8712-84C3-425D-9D63-9F45A95BBD0E",
  "kind" : "property",
  "language" : "swift",
  "module" : "Metal",
  "overview" : "## Discussion\n\nThe default value is [doc:\/\/com.apple.documentation\/documentation\/Swift\/false]. If the value is [doc:\/\/com.apple.documentation\/documentation\/Swift\/false], set the pipeline state object when you encode the commands into the indirect command buffer. The commands ignore any pipeline state object set on the parent encoder.\n\nIf you set the value to [doc:\/\/com.apple.documentation\/documentation\/Swift\/true], don’t set a pipeline state object when you encode commands into the indirect command buffer. The commands use (inherit) the pipeline stage object that you set on the parent encoder.\n\nThis property doesn’t exist in iOS 12 and earlier, and tvOS 12 and earlier. If you create an indirect command buffer on those systems, it inherits the pipeline state, exactly as if the property existed, with a value of [doc:\/\/com.apple.documentation\/documentation\/Swift\/true]. If you need your app to run on earlier versions of iOS, use an availability attribute to set the property conditionally:",
  "platforms" : [
    "iOS",
    "iPadOS",
    "Mac Catalyst",
    "macOS",
    "tvOS",
    "visionOS"
  ],
  "rawMarkdown" : "---\nsource: https:\/\/developer.apple.com\/documentation\/Metal\/MTLIndirectCommandBufferDescriptor\/inheritPipelineState\ncrawled: 2025-12-02T19:37:57Z\n---\n\n# inheritPipelineState\n\n**Instance Property**\n\nA Boolean value that determines where commands in the indirect command buffer get their pipeline state from when you execute them.\n\n## Declaration\n\n```swift\nvar inheritPipelineState: Bool { get set }\n```\n\n## Discussion\n\nThe default value is [doc:\/\/com.apple.documentation\/documentation\/Swift\/false]. If the value is [doc:\/\/com.apple.documentation\/documentation\/Swift\/false], set the pipeline state object when you encode the commands into the indirect command buffer. The commands ignore any pipeline state object set on the parent encoder.\n\nIf you set the value to [doc:\/\/com.apple.documentation\/documentation\/Swift\/true], don’t set a pipeline state object when you encode commands into the indirect command buffer. The commands use (inherit) the pipeline stage object that you set on the parent encoder.\n\nThis property doesn’t exist in iOS 12 and earlier, and tvOS 12 and earlier. If you create an indirect command buffer on those systems, it inherits the pipeline state, exactly as if the property existed, with a value of [doc:\/\/com.apple.documentation\/documentation\/Swift\/true]. If you need your app to run on earlier versions of iOS, use an availability attribute to set the property conditionally:\n\n\n\n## Declaring command inheritance\n\n- **inheritBuffers**: A Boolean value that determines where commands in the indirect command buffer get their buffer arguments from when you execute them.\n\n",
  "sections" : [
    {
      "content" : "",
      "items" : [
        {
          "description" : "A Boolean value that determines where commands in the indirect command buffer get their buffer arguments from when you execute them.",
          "name" : "inheritBuffers",
          "url" : "https:\/\/developer.apple.com\/documentation\/Metal\/MTLIndirectCommandBufferDescriptor\/inheritBuffers"
        }
      ],
      "title" : "Declaring command inheritance"
    }
  ],
  "source" : "appleJSON",
  "title" : "inheritPipelineState",
  "url" : "https:\/\/developer.apple.com\/documentation\/Metal\/MTLIndirectCommandBufferDescriptor\/inheritPipelineState"
}