{
  "abstract" : "Options that describe how a graphics or compute function uses an argument buffer’s resource.",
  "codeExamples" : [

  ],
  "conformsTo" : [
    "BitwiseCopyable",
    "Equatable",
    "ExpressibleByArrayLiteral",
    "OptionSet",
    "RawRepresentable",
    "Sendable",
    "SendableMetatype",
    "SetAlgebra"
  ],
  "contentHash" : "c514c8ad6aa547c507cfabc9211670ed4eeaa3192b94f1d024d2b4aa22effe04",
  "crawledAt" : "2025-12-04T23:50:08Z",
  "declaration" : {
    "code" : "struct MTLResourceUsage",
    "language" : "swift"
  },
  "id" : "08C26CF2-2317-4E6F-B7C8-8B060C8D9AC5",
  "kind" : "struct",
  "language" : "swift",
  "module" : "Metal",
  "overview" : "## Overview\n\nYou can combine multiple [doc:\/\/com.apple.metal\/documentation\/Metal\/MTLResourceUsage] values with a bitwise OR (`|`) if the resource serves multiple purposes over its lifetime. You can enable options for certain resources that indicate whether the Metal driver needs to convert the resource to another format, such as whether it needs to decompress a color render target.",
  "platforms" : [
    "iOS",
    "iPadOS",
    "Mac Catalyst",
    "macOS",
    "tvOS",
    "visionOS"
  ],
  "rawMarkdown" : "---\nsource: https:\/\/developer.apple.com\/documentation\/metal\/mtlresourceusage\ncrawled: 2025-12-04T23:50:08Z\n---\n\n# MTLResourceUsage\n\n**Structure**\n\nOptions that describe how a graphics or compute function uses an argument buffer’s resource.\n\n## Declaration\n\n```swift\nstruct MTLResourceUsage\n```\n\n## Overview\n\nYou can combine multiple [doc:\/\/com.apple.metal\/documentation\/Metal\/MTLResourceUsage] values with a bitwise OR (`|`) if the resource serves multiple purposes over its lifetime. You can enable options for certain resources that indicate whether the Metal driver needs to convert the resource to another format, such as whether it needs to decompress a color render target.\n\n## Initializers\n\n- **init(rawValue:)**: Creates a set of resource options from a raw value.\n\n## Type Properties\n\n- **read**: An option that enables reading from the resource.\n- **sample**: An option that enables sampling from the resource.\n- **write**: An option that enables writing to the resource.\n\n## Common resource functionality\n\n- **MTLGPUAddress**: A 64-bit unsigned integer type appropriate for storing GPU addresses.\n- **MTLAllocation**: A memory allocation from a Metal GPU device, such as a memory heap, texture, or data buffer.\n- **MTLResource**: An allocation of memory accessible to a GPU.\n- **MTLResourceOptions**: Optional arguments used to set the behavior of a resource.\n- **MTLResourceID**\n\n## Conforms To\n\n- BitwiseCopyable\n- Equatable\n- ExpressibleByArrayLiteral\n- OptionSet\n- RawRepresentable\n- Sendable\n- SendableMetatype\n- SetAlgebra\n\n",
  "sections" : [
    {
      "content" : "",
      "items" : [
        {
          "description" : "Creates a set of resource options from a raw value.",
          "name" : "init(rawValue:)",
          "url" : "https:\/\/developer.apple.com\/documentation\/Metal\/MTLResourceUsage\/init(rawValue:)"
        }
      ],
      "title" : "Initializers"
    },
    {
      "content" : "",
      "items" : [
        {
          "description" : "An option that enables reading from the resource.",
          "name" : "read",
          "url" : "https:\/\/developer.apple.com\/documentation\/Metal\/MTLResourceUsage\/read"
        },
        {
          "description" : "An option that enables sampling from the resource.",
          "name" : "sample",
          "url" : "https:\/\/developer.apple.com\/documentation\/Metal\/MTLResourceUsage\/sample"
        },
        {
          "description" : "An option that enables writing to the resource.",
          "name" : "write",
          "url" : "https:\/\/developer.apple.com\/documentation\/Metal\/MTLResourceUsage\/write"
        }
      ],
      "title" : "Type Properties"
    },
    {
      "content" : "",
      "items" : [
        {
          "description" : "A 64-bit unsigned integer type appropriate for storing GPU addresses.",
          "name" : "MTLGPUAddress",
          "url" : "https:\/\/developer.apple.com\/documentation\/Metal\/MTLGPUAddress"
        },
        {
          "description" : "A memory allocation from a Metal GPU device, such as a memory heap, texture, or data buffer.",
          "name" : "MTLAllocation",
          "url" : "https:\/\/developer.apple.com\/documentation\/Metal\/MTLAllocation"
        },
        {
          "description" : "An allocation of memory accessible to a GPU.",
          "name" : "MTLResource",
          "url" : "https:\/\/developer.apple.com\/documentation\/Metal\/MTLResource"
        },
        {
          "description" : "Optional arguments used to set the behavior of a resource.",
          "name" : "MTLResourceOptions",
          "url" : "https:\/\/developer.apple.com\/documentation\/Metal\/MTLResourceOptions"
        },
        {
          "description" : "",
          "name" : "MTLResourceID",
          "url" : "https:\/\/developer.apple.com\/documentation\/Metal\/MTLResourceID"
        }
      ],
      "title" : "Common resource functionality"
    }
  ],
  "source" : "appleJSON",
  "title" : "MTLResourceUsage",
  "url" : "https:\/\/developer.apple.com\/documentation\/metal\/mtlresourceusage"
}