{
  "abstract" : "Informs the GPU that the CPU has modified a section of the buffer.",
  "codeExamples" : [

  ],
  "contentHash" : "d880499010f8468aba2d834b12d11dc8972c6a29d691865758df29a6da777ffe",
  "crawledAt" : "2025-12-04T23:50:33Z",
  "declaration" : {
    "code" : "func didModifyRange(_ range: Range<Int>)",
    "language" : "swift"
  },
  "id" : "B8FA9A38-F24F-4D0E-B9CB-B800C2668ED1",
  "kind" : "method",
  "language" : "swift",
  "module" : "Metal",
  "overview" : "## Discussion\n\nIf you write information to a buffer created with the [doc:\/\/com.apple.metal\/documentation\/Metal\/MTLStorageMode\/managed] storage mode, you need to call this method to inform the GPU that the information has changed. If you execute GPU commands that read the data without calling this method first, the behavior is undefined.",
  "platforms" : [
    "Mac Catalyst",
    "macOS"
  ],
  "rawMarkdown" : "---\nsource: https:\/\/developer.apple.com\/documentation\/Metal\/MTLBuffer\/didModifyRange(_:)\ncrawled: 2025-12-04T23:50:33Z\n---\n\n# didModifyRange(_:)\n\n**Instance Method**\n\nInforms the GPU that the CPU has modified a section of the buffer.\n\n## Declaration\n\n```swift\nfunc didModifyRange(_ range: Range<Int>)\n```\n\n## Parameters\n\n- **range**: The range of bytes that have been modified.\n\n## Discussion\n\nIf you write information to a buffer created with the [doc:\/\/com.apple.metal\/documentation\/Metal\/MTLStorageMode\/managed] storage mode, you need to call this method to inform the GPU that the information has changed. If you execute GPU commands that read the data without calling this method first, the behavior is undefined.\n\n",
  "sections" : [

  ],
  "source" : "appleJSON",
  "title" : "didModifyRange(_:)",
  "url" : "https:\/\/developer.apple.com\/documentation\/Metal\/MTLBuffer\/didModifyRange(_:)"
}