{
  "abstract" : "An object that defines the front-facing or back-facing stencil operations of a depth and stencil state object.",
  "codeExamples" : [

  ],
  "conformsTo" : [
    "CVarArg",
    "CustomDebugStringConvertible",
    "CustomStringConvertible",
    "Equatable",
    "Hashable",
    "NSCopying",
    "NSObjectProtocol"
  ],
  "contentHash" : "14a7a7ee46ab042934dde4496c5e7dd6d0c4a46125c6aafabeab1b3cf4a08bce",
  "crawledAt" : "2025-12-03T13:12:35Z",
  "declaration" : {
    "code" : "class MTLStencilDescriptor",
    "language" : "swift"
  },
  "id" : "8E01D389-B27A-48DC-9EBB-3EC778D0FE62",
  "kind" : "class",
  "language" : "swift",
  "module" : "Metal",
  "overview" : "## Overview\n\nA stencil test is a comparison between a masked reference value and a masked value stored in a stencil attachment. (A value is *masked* by performing a logical AND operation on it with the [doc:\/\/com.apple.metal\/documentation\/Metal\/MTLStencilDescriptor\/readMask] value.) The [doc:\/\/com.apple.metal\/documentation\/Metal\/MTLStencilDescriptor] object defines how to update the contents of the stencil attachment, based on the results of the stencil test and the depth test.\n\nThe [doc:\/\/com.apple.metal\/documentation\/Metal\/MTLStencilDescriptor\/stencilCompareFunction] property defines the stencil test. The [doc:\/\/com.apple.metal\/documentation\/Metal\/MTLStencilDescriptor\/stencilFailureOperation], [doc:\/\/com.apple.metal\/documentation\/Metal\/MTLStencilDescriptor\/depthFailureOperation], and [doc:\/\/com.apple.metal\/documentation\/Metal\/MTLStencilDescriptor\/depthStencilPassOperation] properties specify what to do to a stencil value stored in the stencil attachment for three different test outcomes: if the stencil test fails, if the stencil test passes and the depth test fails, or if both stencil and depth tests succeed, respectively. [doc:\/\/com.apple.metal\/documentation\/Metal\/MTLStencilDescriptor\/writeMask] determines which stencil bits can be modified as the result of a stencil operation.",
  "platforms" : [
    "iOS",
    "iPadOS",
    "Mac Catalyst",
    "macOS",
    "tvOS",
    "visionOS"
  ],
  "rawMarkdown" : "---\nsource: https:\/\/developer.apple.com\/documentation\/Metal\/MTLStencilDescriptor\ncrawled: 2025-12-03T13:12:35Z\n---\n\n# MTLStencilDescriptor\n\n**Class**\n\nAn object that defines the front-facing or back-facing stencil operations of a depth and stencil state object.\n\n## Declaration\n\n```swift\nclass MTLStencilDescriptor\n```\n\n## Overview\n\nA stencil test is a comparison between a masked reference value and a masked value stored in a stencil attachment. (A value is *masked* by performing a logical AND operation on it with the [doc:\/\/com.apple.metal\/documentation\/Metal\/MTLStencilDescriptor\/readMask] value.) The [doc:\/\/com.apple.metal\/documentation\/Metal\/MTLStencilDescriptor] object defines how to update the contents of the stencil attachment, based on the results of the stencil test and the depth test.\n\nThe [doc:\/\/com.apple.metal\/documentation\/Metal\/MTLStencilDescriptor\/stencilCompareFunction] property defines the stencil test. The [doc:\/\/com.apple.metal\/documentation\/Metal\/MTLStencilDescriptor\/stencilFailureOperation], [doc:\/\/com.apple.metal\/documentation\/Metal\/MTLStencilDescriptor\/depthFailureOperation], and [doc:\/\/com.apple.metal\/documentation\/Metal\/MTLStencilDescriptor\/depthStencilPassOperation] properties specify what to do to a stencil value stored in the stencil attachment for three different test outcomes: if the stencil test fails, if the stencil test passes and the depth test fails, or if both stencil and depth tests succeed, respectively. [doc:\/\/com.apple.metal\/documentation\/Metal\/MTLStencilDescriptor\/writeMask] determines which stencil bits can be modified as the result of a stencil operation.\n\n## Configuring stencil functions and operations\n\n- **stencilFailureOperation**: The operation that is performed to update the values in the stencil attachment when the stencil test fails.\n- **depthFailureOperation**: The operation that is performed to update the values in the stencil attachment when the stencil test passes, but the depth test fails.\n- **depthStencilPassOperation**: The operation that is performed to update the values in the stencil attachment when both the stencil test and the depth test pass.\n- **stencilCompareFunction**: The comparison that is performed between the masked reference value and a masked value in the stencil attachment.\n- **MTLStencilOperation**: The operation performed on a currently stored stencil value when a comparison test passes or fails.\n\n## Configuring stencil bit mask properties\n\n- **readMask**: A bitmask that determines from which bits that stencil comparison tests can read.\n- **writeMask**: A bitmask that determines to which bits that stencil operations can write.\n\n## Depth testing\n\n- **Calculating primitive visibility using depth testing**: Determine which pixels are visible in a scene by using a depth texture.\n- **MTLDepthStencilState**: A depth and stencil state instance that specifies the depth and stencil configuration and operations used in a render pass.\n- **MTLDepthStencilDescriptor**: An instance that configures new [doc:\/\/com.apple.metal\/documentation\/Metal\/MTLDepthStencilState] instances.\n\n## Inherits From\n\n- NSObject\n\n## Conforms To\n\n- CVarArg\n- CustomDebugStringConvertible\n- CustomStringConvertible\n- Equatable\n- Hashable\n- NSCopying\n- NSObjectProtocol\n\n",
  "sections" : [
    {
      "content" : "",
      "items" : [
        {
          "description" : "The operation that is performed to update the values in the stencil attachment when the stencil test fails.",
          "name" : "stencilFailureOperation",
          "url" : "https:\/\/developer.apple.com\/documentation\/Metal\/MTLStencilDescriptor\/stencilFailureOperation"
        },
        {
          "description" : "The operation that is performed to update the values in the stencil attachment when the stencil test passes, but the depth test fails.",
          "name" : "depthFailureOperation",
          "url" : "https:\/\/developer.apple.com\/documentation\/Metal\/MTLStencilDescriptor\/depthFailureOperation"
        },
        {
          "description" : "The operation that is performed to update the values in the stencil attachment when both the stencil test and the depth test pass.",
          "name" : "depthStencilPassOperation",
          "url" : "https:\/\/developer.apple.com\/documentation\/Metal\/MTLStencilDescriptor\/depthStencilPassOperation"
        },
        {
          "description" : "The comparison that is performed between the masked reference value and a masked value in the stencil attachment.",
          "name" : "stencilCompareFunction",
          "url" : "https:\/\/developer.apple.com\/documentation\/Metal\/MTLStencilDescriptor\/stencilCompareFunction"
        },
        {
          "description" : "The operation performed on a currently stored stencil value when a comparison test passes or fails.",
          "name" : "MTLStencilOperation",
          "url" : "https:\/\/developer.apple.com\/documentation\/Metal\/MTLStencilOperation"
        }
      ],
      "title" : "Configuring stencil functions and operations"
    },
    {
      "content" : "",
      "items" : [
        {
          "description" : "A bitmask that determines from which bits that stencil comparison tests can read.",
          "name" : "readMask",
          "url" : "https:\/\/developer.apple.com\/documentation\/Metal\/MTLStencilDescriptor\/readMask"
        },
        {
          "description" : "A bitmask that determines to which bits that stencil operations can write.",
          "name" : "writeMask",
          "url" : "https:\/\/developer.apple.com\/documentation\/Metal\/MTLStencilDescriptor\/writeMask"
        }
      ],
      "title" : "Configuring stencil bit mask properties"
    },
    {
      "content" : "",
      "items" : [
        {
          "description" : "Determine which pixels are visible in a scene by using a depth texture.",
          "name" : "Calculating primitive visibility using depth testing",
          "url" : "https:\/\/developer.apple.com\/documentation\/Metal\/calculating-primitive-visibility-using-depth-testing"
        },
        {
          "description" : "A depth and stencil state instance that specifies the depth and stencil configuration and operations used in a render pass.",
          "name" : "MTLDepthStencilState",
          "url" : "https:\/\/developer.apple.com\/documentation\/Metal\/MTLDepthStencilState"
        },
        {
          "description" : "An instance that configures new [doc:\/\/com.apple.metal\/documentation\/Metal\/MTLDepthStencilState] instances.",
          "name" : "MTLDepthStencilDescriptor",
          "url" : "https:\/\/developer.apple.com\/documentation\/Metal\/MTLDepthStencilDescriptor"
        }
      ],
      "title" : "Depth testing"
    },
    {
      "content" : "",
      "items" : [
        {
          "name" : "NSObject"
        }
      ],
      "title" : "Inherits From"
    }
  ],
  "source" : "appleJSON",
  "title" : "MTLStencilDescriptor",
  "url" : "https:\/\/developer.apple.com\/documentation\/Metal\/MTLStencilDescriptor"
}