{
  "abstract" : "A Boolean value that indicates whether the device uses additional CPU threads for compilation tasks.",
  "codeExamples" : [

  ],
  "contentHash" : "a80269ef2b3a5b3d9edf77168050d83075e775138432119c35592960f2fcfb97",
  "crawledAt" : "2025-12-03T04:19:17Z",
  "declaration" : {
    "code" : "var shouldMaximizeConcurrentCompilation: Bool { get set }",
    "language" : "swift"
  },
  "id" : "3C94C65C-0ADF-4578-9149-D4DE59C4581D",
  "kind" : "property",
  "language" : "swift",
  "module" : "Metal",
  "overview" : "## Discussion\n\nThe property’s default value is [doc:\/\/com.apple.documentation\/documentation\/Swift\/false]. You can retrieve the number of concurrent CPU threads the device is currently using by checking the [doc:\/\/com.apple.metal\/documentation\/Metal\/MTLDevice\/maximumConcurrentCompilationTaskCount] property.",
  "platforms" : [
    "macOS"
  ],
  "rawMarkdown" : "---\nsource: https:\/\/developer.apple.com\/documentation\/Metal\/MTLDevice\/shouldMaximizeConcurrentCompilation\ncrawled: 2025-12-03T04:19:17Z\n---\n\n# shouldMaximizeConcurrentCompilation\n\n**Instance Property**\n\nA Boolean value that indicates whether the device uses additional CPU threads for compilation tasks.\n\n## Declaration\n\n```swift\nvar shouldMaximizeConcurrentCompilation: Bool { get set }\n```\n\n## Discussion\n\nThe property’s default value is [doc:\/\/com.apple.documentation\/documentation\/Swift\/false]. You can retrieve the number of concurrent CPU threads the device is currently using by checking the [doc:\/\/com.apple.metal\/documentation\/Metal\/MTLDevice\/maximumConcurrentCompilationTaskCount] property.\n\n\n\n",
  "sections" : [

  ],
  "source" : "appleJSON",
  "title" : "shouldMaximizeConcurrentCompilation",
  "url" : "https:\/\/developer.apple.com\/documentation\/Metal\/MTLDevice\/shouldMaximizeConcurrentCompilation"
}