{
  "abstract" : "Returns the minimum alignment the GPU device requires to create a texture buffer from a buffer.",
  "codeExamples" : [

  ],
  "contentHash" : "88c70e66e7787a4dde85253a2f6f7ca0ca4ee55f42f8aef6ede98f727fe73dfb",
  "crawledAt" : "2025-12-04T02:47:30Z",
  "declaration" : {
    "code" : "func minimumTextureBufferAlignment(for format: MTLPixelFormat) -> Int",
    "language" : "swift"
  },
  "id" : "75035503-38DE-4B71-9946-94F87A05C44F",
  "kind" : "method",
  "language" : "swift",
  "module" : "Metal",
  "overview" : "## Discussion\n\nMetal aligns textures to their minimum alignment value, which directly affects the [doc:\/\/com.apple.metal\/documentation\/Metal\/MTLBuffer\/makeTexture(descriptor:offset:bytesPerRow:)] method’s `offset` and `bytesPerRow` parameters.",
  "platforms" : [
    "iOS",
    "iPadOS",
    "Mac Catalyst",
    "macOS",
    "tvOS",
    "visionOS"
  ],
  "rawMarkdown" : "---\nsource: https:\/\/developer.apple.com\/documentation\/Metal\/MTLDevice\/minimumTextureBufferAlignment(for:)\ncrawled: 2025-12-04T02:47:30Z\n---\n\n# minimumTextureBufferAlignment(for:)\n\n**Instance Method**\n\nReturns the minimum alignment the GPU device requires to create a texture buffer from a buffer.\n\n## Declaration\n\n```swift\nfunc minimumTextureBufferAlignment(for format: MTLPixelFormat) -> Int\n```\n\n## Parameters\n\n- **format**: An [doc:\/\/com.apple.metal\/documentation\/Metal\/MTLPixelFormat] instance.\n\n## Discussion\n\nMetal aligns textures to their minimum alignment value, which directly affects the [doc:\/\/com.apple.metal\/documentation\/Metal\/MTLBuffer\/makeTexture(descriptor:offset:bytesPerRow:)] method’s `offset` and `bytesPerRow` parameters.\n\n## Creating textures\n\n- **makeTexture(descriptor:)**: Creates a new texture instance.\n- **makeTexture(descriptor:iosurface:plane:)**: Creates a texture instance that uses I\/O surface to store its underlying data.\n- **makeSharedTexture(descriptor:)**: Creates a texture that you can share across process boundaries.\n- **makeSharedTexture(handle:)**: Creates a texture that references a shared texture.\n- **minimumLinearTextureAlignment(for:)**: Returns the minimum alignment the GPU device requires to create a linear texture from a buffer.\n\n",
  "sections" : [
    {
      "content" : "",
      "items" : [
        {
          "description" : "Creates a new texture instance.",
          "name" : "makeTexture(descriptor:)",
          "url" : "https:\/\/developer.apple.com\/documentation\/Metal\/MTLDevice\/makeTexture(descriptor:)"
        },
        {
          "description" : "Creates a texture instance that uses I\/O surface to store its underlying data.",
          "name" : "makeTexture(descriptor:iosurface:plane:)",
          "url" : "https:\/\/developer.apple.com\/documentation\/Metal\/MTLDevice\/makeTexture(descriptor:iosurface:plane:)"
        },
        {
          "description" : "Creates a texture that you can share across process boundaries.",
          "name" : "makeSharedTexture(descriptor:)",
          "url" : "https:\/\/developer.apple.com\/documentation\/Metal\/MTLDevice\/makeSharedTexture(descriptor:)"
        },
        {
          "description" : "Creates a texture that references a shared texture.",
          "name" : "makeSharedTexture(handle:)",
          "url" : "https:\/\/developer.apple.com\/documentation\/Metal\/MTLDevice\/makeSharedTexture(handle:)"
        },
        {
          "description" : "Returns the minimum alignment the GPU device requires to create a linear texture from a buffer.",
          "name" : "minimumLinearTextureAlignment(for:)",
          "url" : "https:\/\/developer.apple.com\/documentation\/Metal\/MTLDevice\/minimumLinearTextureAlignment(for:)"
        }
      ],
      "title" : "Creating textures"
    }
  ],
  "source" : "appleJSON",
  "title" : "minimumTextureBufferAlignment(for:)",
  "url" : "https:\/\/developer.apple.com\/documentation\/Metal\/MTLDevice\/minimumTextureBufferAlignment(for:)"
}