{
  "abstract" : "A set of related functions that Metal links to when necessary to create the function instance.",
  "codeExamples" : [

  ],
  "conformsTo" : [
    "CVarArg",
    "CustomDebugStringConvertible",
    "CustomStringConvertible",
    "Equatable",
    "Hashable",
    "NSCopying",
    "NSObjectProtocol"
  ],
  "contentHash" : "3f071fa4ea9dbf8b90881c5b89ad079b229566fd92271640a897774a8c4c9ac0",
  "crawledAt" : "2025-12-03T14:54:09Z",
  "declaration" : {
    "code" : "class MTLLinkedFunctions",
    "language" : "swift"
  },
  "id" : "37D25026-052C-491D-B4A7-77D690DB6FB7",
  "kind" : "class",
  "language" : "swift",
  "module" : "Metal",
  "overview" : "## Overview\n\nWhen you create a Metal function instance using an [doc:\/\/com.apple.metal\/documentation\/Metal\/MTLFunctionDescriptor], you specify additional functions that Metal needs to link to when it compiles and links the underlying shader code. Most often, you need to do this if your shader takes a visible function table as one or more of its arguments. For Metal to create the [doc:\/\/com.apple.metal\/documentation\/Metal\/MTLFunction] instance, it needs a complete list of functions that your shader can call so that it can resolve any dependencies and generate the correct code to run on the GPU.",
  "platforms" : [
    "iOS",
    "iPadOS",
    "Mac Catalyst",
    "macOS",
    "tvOS",
    "visionOS"
  ],
  "rawMarkdown" : "---\nsource: https:\/\/developer.apple.com\/documentation\/Metal\/MTLLinkedFunctions\ncrawled: 2025-12-03T14:54:09Z\n---\n\n# MTLLinkedFunctions\n\n**Class**\n\nA set of related functions that Metal links to when necessary to create the function instance.\n\n## Declaration\n\n```swift\nclass MTLLinkedFunctions\n```\n\n## Overview\n\nWhen you create a Metal function instance using an [doc:\/\/com.apple.metal\/documentation\/Metal\/MTLFunctionDescriptor], you specify additional functions that Metal needs to link to when it compiles and links the underlying shader code. Most often, you need to do this if your shader takes a visible function table as one or more of its arguments. For Metal to create the [doc:\/\/com.apple.metal\/documentation\/Metal\/MTLFunction] instance, it needs a complete list of functions that your shader can call so that it can resolve any dependencies and generate the correct code to run on the GPU.\n\n## Specifying related functions\n\n- **functions**: An array of function objects to link to the new function.\n- **binaryFunctions**: An array of function objects already compiled to a binary representation to link.\n- **groups**: An optional list of groups specifying which functions your shader can call at each call site.\n- **privateFunctions**: An array of function objects to link to the new function, without exporting the functions publicly.\n\n## Specifying the function configuration\n\n- **name**: The name of the function to fetch from the library.\n- **specializedName**: A new name for the created function object.\n- **constantValues**: The set of constant values assigned to the function constants.\n- **options**: Flags specifying how Metal should create the new function object.\n- **binaryArchives**: The binary archives to search for a previously-compiled version of this function.\n- **MTLFunctionOptions**: Options that define how Metal compiles a GPU function.\n\n## Inherits From\n\n- NSObject\n\n## Conforms To\n\n- CVarArg\n- CustomDebugStringConvertible\n- CustomStringConvertible\n- Equatable\n- Hashable\n- NSCopying\n- NSObjectProtocol\n\n",
  "sections" : [
    {
      "content" : "",
      "items" : [
        {
          "description" : "An array of function objects to link to the new function.",
          "name" : "functions",
          "url" : "https:\/\/developer.apple.com\/documentation\/Metal\/MTLLinkedFunctions\/functions"
        },
        {
          "description" : "An array of function objects already compiled to a binary representation to link.",
          "name" : "binaryFunctions",
          "url" : "https:\/\/developer.apple.com\/documentation\/Metal\/MTLLinkedFunctions\/binaryFunctions"
        },
        {
          "description" : "An optional list of groups specifying which functions your shader can call at each call site.",
          "name" : "groups",
          "url" : "https:\/\/developer.apple.com\/documentation\/Metal\/MTLLinkedFunctions\/groups"
        },
        {
          "description" : "An array of function objects to link to the new function, without exporting the functions publicly.",
          "name" : "privateFunctions",
          "url" : "https:\/\/developer.apple.com\/documentation\/Metal\/MTLLinkedFunctions\/privateFunctions"
        }
      ],
      "title" : "Specifying related functions"
    },
    {
      "content" : "",
      "items" : [
        {
          "description" : "The name of the function to fetch from the library.",
          "name" : "name",
          "url" : "https:\/\/developer.apple.com\/documentation\/Metal\/MTLFunctionDescriptor\/name"
        },
        {
          "description" : "A new name for the created function object.",
          "name" : "specializedName",
          "url" : "https:\/\/developer.apple.com\/documentation\/Metal\/MTLFunctionDescriptor\/specializedName"
        },
        {
          "description" : "The set of constant values assigned to the function constants.",
          "name" : "constantValues",
          "url" : "https:\/\/developer.apple.com\/documentation\/Metal\/MTLFunctionDescriptor\/constantValues"
        },
        {
          "description" : "Flags specifying how Metal should create the new function object.",
          "name" : "options",
          "url" : "https:\/\/developer.apple.com\/documentation\/Metal\/MTLFunctionDescriptor\/options"
        },
        {
          "description" : "The binary archives to search for a previously-compiled version of this function.",
          "name" : "binaryArchives",
          "url" : "https:\/\/developer.apple.com\/documentation\/Metal\/MTLFunctionDescriptor\/binaryArchives"
        },
        {
          "description" : "Options that define how Metal compiles a GPU function.",
          "name" : "MTLFunctionOptions",
          "url" : "https:\/\/developer.apple.com\/documentation\/Metal\/MTLFunctionOptions"
        }
      ],
      "title" : "Specifying the function configuration"
    },
    {
      "content" : "",
      "items" : [
        {
          "name" : "NSObject"
        }
      ],
      "title" : "Inherits From"
    }
  ],
  "source" : "appleJSON",
  "title" : "MTLLinkedFunctions",
  "url" : "https:\/\/developer.apple.com\/documentation\/Metal\/MTLLinkedFunctions"
}