{
  "abstract" : "Options for choosing the partition mode that the tessellator applies when deriving the number and spacing of segments for subdividing a corresponding edge.",
  "codeExamples" : [

  ],
  "conformsTo" : [
    "BitwiseCopyable",
    "Equatable",
    "Hashable",
    "RawRepresentable",
    "Sendable",
    "SendableMetatype"
  ],
  "contentHash" : "0211211e9a9663463a0212161af79cab689582a5a49ba26444fe368015d54d74",
  "crawledAt" : "2025-12-04T22:13:09Z",
  "declaration" : {
    "code" : "enum MTLTessellationPartitionMode",
    "language" : "swift"
  },
  "id" : "3E651B9C-5BE0-486B-B6AB-CA9CDCBE9251",
  "kind" : "enum",
  "language" : "swift",
  "module" : "Metal",
  "overview" : "## Overview\n\nThe table lists the tessellation factor range for each partitioning mode.\n\nThe floating-point tessellation level is always clamped to its corresponding range before calculating the final tessellation factor. After clamping, the calculation depends on the chosen partitioning mode:",
  "platforms" : [
    "iOS",
    "iPadOS",
    "Mac Catalyst",
    "macOS",
    "tvOS",
    "visionOS"
  ],
  "rawMarkdown" : "---\nsource: https:\/\/developer.apple.com\/documentation\/Metal\/MTLTessellationPartitionMode\ncrawled: 2025-12-04T22:13:09Z\n---\n\n# MTLTessellationPartitionMode\n\n**Enumeration**\n\nOptions for choosing the partition mode that the tessellator applies when deriving the number and spacing of segments for subdividing a corresponding edge.\n\n## Declaration\n\n```swift\nenum MTLTessellationPartitionMode\n```\n\n## Overview\n\nThe table lists the tessellation factor range for each partitioning mode.\n\n\n\nThe floating-point tessellation level is always clamped to its corresponding range before calculating the final tessellation factor. After clamping, the calculation depends on the chosen partitioning mode:\n\n- For the [doc:\/\/com.apple.metal\/documentation\/Metal\/MTLTessellationPartitionMode\/pow2] partitioning mode, the result is rounded up to the nearest integer `n`, where `n` is a power of two. The corresponding edge is divided into `n` segments of equal length in (u, v) space.\n- For the [doc:\/\/com.apple.metal\/documentation\/Metal\/MTLTessellationPartitionMode\/integer] partitioning mode, the result is rounded up to the nearest integer `n`. The corresponding edge is divided into `n` segments of equal length in (u, v) space.\n- For the [doc:\/\/com.apple.metal\/documentation\/Metal\/MTLTessellationPartitionMode\/fractionalOdd] partitioning mode, the tessellation level is rounded up the the nearest odd integer `n`. If `n` is `1`, the edge is not subdivided. Otherwise, the corresponding edge is divided into `n-2` segments of equal length, and two additional segments of equal length that are typically shorter than the other segments. The length of the two additional segments relative to the others decreases monotonically by the value of `n-f`, where `f` is the clamped floating-point tessellation level. If `n-f` is `0` the additional segments equal length to the other segments. As `n-f` approaches `2`, the relative length of the additional segments approaches `0`. The two additional segments should be placed symmetrically on opposite sides of the subdivided edge. The relative location of these two segments is undefined, but needs to be identical for any pair of subdivided edges with identical values of `f`.\n- For the [doc:\/\/com.apple.metal\/documentation\/Metal\/MTLTessellationPartitionMode\/fractionalEven] partitioning mode, the tessellation level is rounded up the the nearest even integer `n`.\n\n## Partition modes\n\n- **MTLTessellationPartitionMode.pow2**: A power of two partitioning mode.\n- **MTLTessellationPartitionMode.integer**: An integer partitioning mode.\n- **MTLTessellationPartitionMode.fractionalOdd**: A fractional odd partitioning mode.\n- **MTLTessellationPartitionMode.fractionalEven**: A fractional even partitioning mode.\n\n## Initializers\n\n- **init(rawValue:)**\n\n## Specifying tessellation state\n\n- **maxTessellationFactor**: The maximum tessellation factor that the tessellator uses when tessellating patches.\n- **isTessellationFactorScaleEnabled**: A Boolean value that determines whether the pipeline scales the tessellation factor.\n- **tessellationFactorFormat**: The format of the tessellation factors in the tessellation factor buffer.\n- **tessellationControlPointIndexType**: The size of the control point indices in a control point index buffer.\n- **tessellationFactorStepFunction**: The step function for determining the tessellation factors for a patch from the tessellation factor buffer.\n- **tessellationOutputWindingOrder**: The winding order of triangles from the tessellator.\n- **tessellationPartitionMode**: The partitioning mode that the tessellator uses to derive the number and spacing of segments for subdividing a corresponding edge.\n- **MTLTessellationFactorFormat**: Options for specifying the format of the tessellation factors in a tessellation factor buffer.\n- **MTLTessellationControlPointIndexType**: Options for specifying the size of the control point indices in a control point index buffer.\n- **MTLTessellationFactorStepFunction**: Options for specifying the step function that determines the tessellation factors for a patch from the tessellation factor buffer.\n\n## Conforms To\n\n- BitwiseCopyable\n- Equatable\n- Hashable\n- RawRepresentable\n- Sendable\n- SendableMetatype\n\n",
  "sections" : [
    {
      "content" : "",
      "items" : [
        {
          "description" : "A power of two partitioning mode.",
          "name" : "MTLTessellationPartitionMode.pow2",
          "url" : "https:\/\/developer.apple.com\/documentation\/Metal\/MTLTessellationPartitionMode\/pow2"
        },
        {
          "description" : "An integer partitioning mode.",
          "name" : "MTLTessellationPartitionMode.integer",
          "url" : "https:\/\/developer.apple.com\/documentation\/Metal\/MTLTessellationPartitionMode\/integer"
        },
        {
          "description" : "A fractional odd partitioning mode.",
          "name" : "MTLTessellationPartitionMode.fractionalOdd",
          "url" : "https:\/\/developer.apple.com\/documentation\/Metal\/MTLTessellationPartitionMode\/fractionalOdd"
        },
        {
          "description" : "A fractional even partitioning mode.",
          "name" : "MTLTessellationPartitionMode.fractionalEven",
          "url" : "https:\/\/developer.apple.com\/documentation\/Metal\/MTLTessellationPartitionMode\/fractionalEven"
        }
      ],
      "title" : "Partition modes"
    },
    {
      "content" : "",
      "items" : [
        {
          "description" : "",
          "name" : "init(rawValue:)",
          "url" : "https:\/\/developer.apple.com\/documentation\/Metal\/MTLTessellationPartitionMode\/init(rawValue:)"
        }
      ],
      "title" : "Initializers"
    },
    {
      "content" : "",
      "items" : [
        {
          "description" : "The maximum tessellation factor that the tessellator uses when tessellating patches.",
          "name" : "maxTessellationFactor",
          "url" : "https:\/\/developer.apple.com\/documentation\/Metal\/MTLRenderPipelineDescriptor\/maxTessellationFactor"
        },
        {
          "description" : "A Boolean value that determines whether the pipeline scales the tessellation factor.",
          "name" : "isTessellationFactorScaleEnabled",
          "url" : "https:\/\/developer.apple.com\/documentation\/Metal\/MTLRenderPipelineDescriptor\/isTessellationFactorScaleEnabled"
        },
        {
          "description" : "The format of the tessellation factors in the tessellation factor buffer.",
          "name" : "tessellationFactorFormat",
          "url" : "https:\/\/developer.apple.com\/documentation\/Metal\/MTLRenderPipelineDescriptor\/tessellationFactorFormat"
        },
        {
          "description" : "The size of the control point indices in a control point index buffer.",
          "name" : "tessellationControlPointIndexType",
          "url" : "https:\/\/developer.apple.com\/documentation\/Metal\/MTLRenderPipelineDescriptor\/tessellationControlPointIndexType"
        },
        {
          "description" : "The step function for determining the tessellation factors for a patch from the tessellation factor buffer.",
          "name" : "tessellationFactorStepFunction",
          "url" : "https:\/\/developer.apple.com\/documentation\/Metal\/MTLRenderPipelineDescriptor\/tessellationFactorStepFunction"
        },
        {
          "description" : "The winding order of triangles from the tessellator.",
          "name" : "tessellationOutputWindingOrder",
          "url" : "https:\/\/developer.apple.com\/documentation\/Metal\/MTLRenderPipelineDescriptor\/tessellationOutputWindingOrder"
        },
        {
          "description" : "The partitioning mode that the tessellator uses to derive the number and spacing of segments for subdividing a corresponding edge.",
          "name" : "tessellationPartitionMode",
          "url" : "https:\/\/developer.apple.com\/documentation\/Metal\/MTLRenderPipelineDescriptor\/tessellationPartitionMode"
        },
        {
          "description" : "Options for specifying the format of the tessellation factors in a tessellation factor buffer.",
          "name" : "MTLTessellationFactorFormat",
          "url" : "https:\/\/developer.apple.com\/documentation\/Metal\/MTLTessellationFactorFormat"
        },
        {
          "description" : "Options for specifying the size of the control point indices in a control point index buffer.",
          "name" : "MTLTessellationControlPointIndexType",
          "url" : "https:\/\/developer.apple.com\/documentation\/Metal\/MTLTessellationControlPointIndexType"
        },
        {
          "description" : "Options for specifying the step function that determines the tessellation factors for a patch from the tessellation factor buffer.",
          "name" : "MTLTessellationFactorStepFunction",
          "url" : "https:\/\/developer.apple.com\/documentation\/Metal\/MTLTessellationFactorStepFunction"
        }
      ],
      "title" : "Specifying tessellation state"
    }
  ],
  "source" : "appleJSON",
  "title" : "MTLTessellationPartitionMode",
  "url" : "https:\/\/developer.apple.com\/documentation\/Metal\/MTLTessellationPartitionMode"
}