{
  "abstract" : "Create your mipmaps either when you author content or at runtime.",
  "codeExamples" : [

  ],
  "contentHash" : "b3d15e2c821be161ed6156d00ba4cc91bfe1f0ba4f964a9cf7edf7238bc2d9c6",
  "crawledAt" : "2025-12-04T00:48:16Z",
  "id" : "79EC3BAC-BEC0-4042-9285-3F8016200E96",
  "kind" : "article",
  "language" : "swift",
  "module" : "Metal",
  "overview" : "## Overview\n\nYou create mipmaps for texture sampling by applying a filter to the original image. Different filter algorithms vary in processing time and output quality. You need to determine the right tradeoff for your content by considering file size, quality, and runtime performance.\n\nThese are the options for creating mipmaps:\n\n**Have the device object generate them for you at runtime.** This approach is the simplest way to create mipmaps for color images. After initializing mipmap `0` with data, create a blit command encoder and encode a command to generate the other mipmaps using the [doc:\/\/com.apple.metal\/documentation\/Metal\/MTLBlitCommandEncoder\/generateMipmaps(for:)] method.\n\nAs with any other GPU commands, the GPU creates the mipmaps asynchronously, at some point after the command buffer is committed to a command queue. The filtering that the device object uses to generate the mipmaps is implementation-dependent and may vary from one GPU to another.\n\n**Generate high-quality mipmaps from your source texture.** Many tools are capable of generating high-quality mipmaps from your source texture. In this case, you store all of the mipmaps in your source data and load them at runtime. This approach lets you use higher-quality filters and tools to build your mipmaps, but increases the size of your files and thus the distribution size of your app.\n\n**Use custom filters or Metal Performance Shaders to generate better mipmaps.** You can also create your own tools, using custom filters or Metal Performance Shaders to generate better mipmaps. Depending on exactly what solution you use for your own tools, you might either create your mipmap data at runtime or as an offline process that runs when you create your content.",
  "rawMarkdown" : "---\nsource: https:\/\/developer.apple.com\/documentation\/Metal\/generating-mipmap-data\ncrawled: 2025-12-04T00:48:16Z\n---\n\n# Generating mipmap data\n\n**Article**\n\nCreate your mipmaps either when you author content or at runtime.\n\n## Overview\n\nYou create mipmaps for texture sampling by applying a filter to the original image. Different filter algorithms vary in processing time and output quality. You need to determine the right tradeoff for your content by considering file size, quality, and runtime performance.\n\nThese are the options for creating mipmaps:\n\n**Have the device object generate them for you at runtime.** This approach is the simplest way to create mipmaps for color images. After initializing mipmap `0` with data, create a blit command encoder and encode a command to generate the other mipmaps using the [doc:\/\/com.apple.metal\/documentation\/Metal\/MTLBlitCommandEncoder\/generateMipmaps(for:)] method.\n\n\n\nAs with any other GPU commands, the GPU creates the mipmaps asynchronously, at some point after the command buffer is committed to a command queue. The filtering that the device object uses to generate the mipmaps is implementation-dependent and may vary from one GPU to another.\n\n**Generate high-quality mipmaps from your source texture.** Many tools are capable of generating high-quality mipmaps from your source texture. In this case, you store all of the mipmaps in your source data and load them at runtime. This approach lets you use higher-quality filters and tools to build your mipmaps, but increases the size of your files and thus the distribution size of your app.\n\n**Use custom filters or Metal Performance Shaders to generate better mipmaps.** You can also create your own tools, using custom filters or Metal Performance Shaders to generate better mipmaps. Depending on exactly what solution you use for your own tools, you might either create your mipmap data at runtime or as an offline process that runs when you create your content.\n\n## Texture mipmapping\n\n- **Improving texture sampling quality and performance with mipmaps**: Avoid texture-rendering artifacts and reduce the GPU’s workload by creating smaller versions of a texture.\n- **Creating a mipmapped texture**: Decide whether a texture that you’re creating needs mipmaps.\n- **Copying data into or out of mipmaps**: Specify which mipmaps that the data transfer affects.\n- **Adding mipmap filtering to samplers**: Specify how the GPU samples mipmaps in your textures.\n- **Restricting access to specific mipmaps**: Set the range of mipmap levels that a sampler can access.\n- **Predicting which mips the GPU samples with level-of-detail queries**: Determine in advance which mipmap levels the GPU requires to sample a texture.\n- **Dynamically adjusting texture level of detail**: Defer generating or loading larger mipmaps until that level of detail is needed.\n\n",
  "sections" : [
    {
      "content" : "",
      "items" : [
        {
          "description" : "Avoid texture-rendering artifacts and reduce the GPU’s workload by creating smaller versions of a texture.",
          "name" : "Improving texture sampling quality and performance with mipmaps",
          "url" : "https:\/\/developer.apple.com\/documentation\/Metal\/improving-texture-sampling-quality-and-performance-with-mipmaps"
        },
        {
          "description" : "Decide whether a texture that you’re creating needs mipmaps.",
          "name" : "Creating a mipmapped texture",
          "url" : "https:\/\/developer.apple.com\/documentation\/Metal\/creating-a-mipmapped-texture"
        },
        {
          "description" : "Specify which mipmaps that the data transfer affects.",
          "name" : "Copying data into or out of mipmaps",
          "url" : "https:\/\/developer.apple.com\/documentation\/Metal\/copying-data-into-or-out-of-mipmaps"
        },
        {
          "description" : "Specify how the GPU samples mipmaps in your textures.",
          "name" : "Adding mipmap filtering to samplers",
          "url" : "https:\/\/developer.apple.com\/documentation\/Metal\/adding-mipmap-filtering-to-samplers"
        },
        {
          "description" : "Set the range of mipmap levels that a sampler can access.",
          "name" : "Restricting access to specific mipmaps",
          "url" : "https:\/\/developer.apple.com\/documentation\/Metal\/restricting-access-to-specific-mipmaps"
        },
        {
          "description" : "Determine in advance which mipmap levels the GPU requires to sample a texture.",
          "name" : "Predicting which mips the GPU samples with level-of-detail queries",
          "url" : "https:\/\/developer.apple.com\/documentation\/Metal\/predicting-which-mips-the-gpu-samples-with-level-of-detail-queries"
        },
        {
          "description" : "Defer generating or loading larger mipmaps until that level of detail is needed.",
          "name" : "Dynamically adjusting texture level of detail",
          "url" : "https:\/\/developer.apple.com\/documentation\/Metal\/dynamically-adjusting-texture-level-of-detail"
        }
      ],
      "title" : "Texture mipmapping"
    }
  ],
  "source" : "appleJSON",
  "title" : "Generating mipmap data",
  "url" : "https:\/\/developer.apple.com\/documentation\/Metal\/generating-mipmap-data"
}