{
  "abstract" : "A configuration you create to customize a blit command encoder, which affects the runtime behavior of the blit pass you encode with it.",
  "codeExamples" : [

  ],
  "conformsTo" : [
    "CVarArg",
    "CustomDebugStringConvertible",
    "CustomStringConvertible",
    "Equatable",
    "Hashable",
    "NSCopying",
    "NSObjectProtocol"
  ],
  "contentHash" : "27e454809f2738226a930ffa4f59246fbae0d6bc3f2f619318d278bff11e6599",
  "crawledAt" : "2025-12-04T02:16:29Z",
  "declaration" : {
    "code" : "class MTLBlitPassDescriptor",
    "language" : "swift"
  },
  "id" : "988DC466-8B9C-4C56-B972-89AA6E8989ED",
  "kind" : "class",
  "language" : "swift",
  "module" : "Metal",
  "overview" : "## Overview\n\nYou can customize an encoder for a blit pass by creating and configuring an [doc:\/\/com.apple.metal\/documentation\/Metal\/MTLBlitPassDescriptor] instance and passing it to [doc:\/\/com.apple.metal\/documentation\/Metal\/MTLCommandBuffer\/makeBlitCommandEncoder(descriptor:)].",
  "platforms" : [
    "iOS",
    "iPadOS",
    "Mac Catalyst",
    "macOS",
    "tvOS",
    "visionOS"
  ],
  "rawMarkdown" : "---\nsource: https:\/\/developer.apple.com\/documentation\/Metal\/MTLBlitPassDescriptor\ncrawled: 2025-12-04T02:16:29Z\n---\n\n# MTLBlitPassDescriptor\n\n**Class**\n\nA configuration you create to customize a blit command encoder, which affects the runtime behavior of the blit pass you encode with it.\n\n## Declaration\n\n```swift\nclass MTLBlitPassDescriptor\n```\n\n## Overview\n\nYou can customize an encoder for a blit pass by creating and configuring an [doc:\/\/com.apple.metal\/documentation\/Metal\/MTLBlitPassDescriptor] instance and passing it to [doc:\/\/com.apple.metal\/documentation\/Metal\/MTLCommandBuffer\/makeBlitCommandEncoder(descriptor:)].\n\n## Configuring sample buffer attachment descriptors for a blit pass\n\n- **sampleBufferAttachments**: An array of counter sample buffer attachments that you configure for a blit pass.\n\n## Configuring a blit command encoder\n\n- **MTLBlitPassSampleBufferAttachmentDescriptor**: A configuration that instructs the GPU where to store counter data from the beginning and end of a blit pass.\n- **MTLBlitPassSampleBufferAttachmentDescriptorArray**: A container that stores an array of sample buffer attachments for a blit pass.\n\n## Inherits From\n\n- NSObject\n\n## Conforms To\n\n- CVarArg\n- CustomDebugStringConvertible\n- CustomStringConvertible\n- Equatable\n- Hashable\n- NSCopying\n- NSObjectProtocol\n\n",
  "sections" : [
    {
      "content" : "",
      "items" : [
        {
          "description" : "An array of counter sample buffer attachments that you configure for a blit pass.",
          "name" : "sampleBufferAttachments",
          "url" : "https:\/\/developer.apple.com\/documentation\/Metal\/MTLBlitPassDescriptor\/sampleBufferAttachments"
        }
      ],
      "title" : "Configuring sample buffer attachment descriptors for a blit pass"
    },
    {
      "content" : "",
      "items" : [
        {
          "description" : "A configuration that instructs the GPU where to store counter data from the beginning and end of a blit pass.",
          "name" : "MTLBlitPassSampleBufferAttachmentDescriptor",
          "url" : "https:\/\/developer.apple.com\/documentation\/Metal\/MTLBlitPassSampleBufferAttachmentDescriptor"
        },
        {
          "description" : "A container that stores an array of sample buffer attachments for a blit pass.",
          "name" : "MTLBlitPassSampleBufferAttachmentDescriptorArray",
          "url" : "https:\/\/developer.apple.com\/documentation\/Metal\/MTLBlitPassSampleBufferAttachmentDescriptorArray"
        }
      ],
      "title" : "Configuring a blit command encoder"
    },
    {
      "content" : "",
      "items" : [
        {
          "name" : "NSObject"
        }
      ],
      "title" : "Inherits From"
    }
  ],
  "source" : "appleJSON",
  "title" : "MTLBlitPassDescriptor",
  "url" : "https:\/\/developer.apple.com\/documentation\/Metal\/MTLBlitPassDescriptor"
}