{
  "abstract" : "A Boolean value that indicates whether a person or the app has text selected within the image.",
  "codeExamples" : [

  ],
  "contentHash" : "f80b548ee2d46af66cd07b29465b05ae8a086d1c51da107ad610825028fc7223",
  "crawledAt" : "2025-12-02T06:44:39Z",
  "declaration" : {
    "code" : "@MainActor final var hasActiveTextSelection: Bool { get }",
    "language" : "swift"
  },
  "id" : "6AF4987B-A430-47A8-AA4F-77CFE2A5BCE6",
  "kind" : "property",
  "module" : "VisionKit",
  "overview" : "## Discussion\n\nIf [doc:\/\/com.apple.VisionKit\/documentation\/VisionKit\/ImageAnalysisOverlayView\/InteractionTypes\/textSelection] is an active interaction type, a person can select text using a standard input method and the app can select text through the [doc:\/\/com.apple.VisionKit\/documentation\/VisionKit\/ImageAnalysisOverlayView\/selectedRanges] property. If neither a person nor the app select any text, then this property returns `false`.",
  "platforms" : [
    "macOS"
  ],
  "rawMarkdown" : "---\nsource: https:\/\/developer.apple.com\/documentation\/VisionKit\/ImageAnalysisOverlayView\/hasActiveTextSelection\ncrawled: 2025-12-02T06:44:39Z\n---\n\n# hasActiveTextSelection\n\n**Instance Property**\n\nA Boolean value that indicates whether a person or the app has text selected within the image.\n\n## Declaration\n\n```swift\n@MainActor final var hasActiveTextSelection: Bool { get }\n```\n\n## Discussion\n\nIf [doc:\/\/com.apple.VisionKit\/documentation\/VisionKit\/ImageAnalysisOverlayView\/InteractionTypes\/textSelection] is an active interaction type, a person can select text using a standard input method and the app can select text through the [doc:\/\/com.apple.VisionKit\/documentation\/VisionKit\/ImageAnalysisOverlayView\/selectedRanges] property. If neither a person nor the app select any text, then this property returns `false`.\n\n## Accessing text information\n\n- **text**: The text contents of the current image analysis.\n- **selectedText**: The current selected text.\n- **selectedAttributedText**: The current selected attributed text.\n- **analysisHasText(at:)**: Returns a Boolean value that indicates whether the analysis finds text at the specified point.\n- **hasText(at:)**: Returns a Boolean value that indicates whether active text exists at the specified point.\n- **hasDataDetector(at:)**: Returns a Boolean value that indicates whether the analysis detects data at the specified point.\n\n",
  "sections" : [
    {
      "content" : "",
      "items" : [
        {
          "description" : "The text contents of the current image analysis.",
          "name" : "text",
          "url" : "https:\/\/developer.apple.com\/documentation\/VisionKit\/ImageAnalysisOverlayView\/text"
        },
        {
          "description" : "The current selected text.",
          "name" : "selectedText",
          "url" : "https:\/\/developer.apple.com\/documentation\/VisionKit\/ImageAnalysisOverlayView\/selectedText"
        },
        {
          "description" : "The current selected attributed text.",
          "name" : "selectedAttributedText",
          "url" : "https:\/\/developer.apple.com\/documentation\/VisionKit\/ImageAnalysisOverlayView\/selectedAttributedText"
        },
        {
          "description" : "Returns a Boolean value that indicates whether the analysis finds text at the specified point.",
          "name" : "analysisHasText(at:)",
          "url" : "https:\/\/developer.apple.com\/documentation\/VisionKit\/ImageAnalysisOverlayView\/analysisHasText(at:)"
        },
        {
          "description" : "Returns a Boolean value that indicates whether active text exists at the specified point.",
          "name" : "hasText(at:)",
          "url" : "https:\/\/developer.apple.com\/documentation\/VisionKit\/ImageAnalysisOverlayView\/hasText(at:)"
        },
        {
          "description" : "Returns a Boolean value that indicates whether the analysis detects data at the specified point.",
          "name" : "hasDataDetector(at:)",
          "url" : "https:\/\/developer.apple.com\/documentation\/VisionKit\/ImageAnalysisOverlayView\/hasDataDetector(at:)"
        }
      ],
      "title" : "Accessing text information"
    }
  ],
  "source" : "appleJSON",
  "title" : "hasActiveTextSelection",
  "url" : "https:\/\/developer.apple.com\/documentation\/VisionKit\/ImageAnalysisOverlayView\/hasActiveTextSelection"
}