{
  "abstract" : "A Boolean value that indicates whether the scanner should identify all items in the live video.",
  "codeExamples" : [

  ],
  "contentHash" : "d667cc718f45b28e21f0ee34ec1c88270e1217db6c89229a7fec4d78604b533f",
  "crawledAt" : "2025-12-02T06:45:18Z",
  "declaration" : {
    "code" : "@MainActor final let recognizesMultipleItems: Bool",
    "language" : "swift"
  },
  "id" : "6CC057D6-91A1-44EE-844A-875C7AC6BFA4",
  "kind" : "property",
  "module" : "VisionKit",
  "overview" : "## Discussion\n\nIf `true`, the scanner finds all items in the live video. If `false`, the scanner finds only the item closest to a person’s point of interest. The point of interest is the middle of the view by default or where a person taps in the live video. The default value is `false`.",
  "platforms" : [
    "iOS",
    "iPadOS",
    "visionOS"
  ],
  "rawMarkdown" : "---\nsource: https:\/\/developer.apple.com\/documentation\/VisionKit\/DataScannerViewController\/recognizesMultipleItems\ncrawled: 2025-12-02T06:45:18Z\n---\n\n# recognizesMultipleItems\n\n**Instance Property**\n\nA Boolean value that indicates whether the scanner should identify all items in the live video.\n\n## Declaration\n\n```swift\n@MainActor final let recognizesMultipleItems: Bool\n```\n\n## Discussion\n\nIf `true`, the scanner finds all items in the live video. If `false`, the scanner finds only the item closest to a person’s point of interest. The point of interest is the middle of the view by default or where a person taps in the live video. The default value is `false`.\n\n## Configuring data scanners\n\n- **delegate**: The delegate that handles user interaction with items recognized by the data scanner.\n- **qualityLevel**: The resolution that the scanner uses to find data.\n- **DataScannerViewController.QualityLevel**: The possible quality levels that the scanner uses to find data.\n- **isHighFrameRateTrackingEnabled**: A Boolean value that determines the frequency at which the scanner updates the geometry of recognized items.\n- **isPinchToZoomEnabled**: A Boolean value that indicates whether people can use a two-finger pinch-to-zoom gesture.\n- **isGuidanceEnabled**: A Boolean value that indicates whether the scanner provides help to a person when selecting items.\n- **isHighlightingEnabled**: A Boolean value that indicates whether the scanner displays highlights around recognized items.\n\n",
  "sections" : [
    {
      "content" : "",
      "items" : [
        {
          "description" : "The delegate that handles user interaction with items recognized by the data scanner.",
          "name" : "delegate",
          "url" : "https:\/\/developer.apple.com\/documentation\/VisionKit\/DataScannerViewController\/delegate"
        },
        {
          "description" : "The resolution that the scanner uses to find data.",
          "name" : "qualityLevel",
          "url" : "https:\/\/developer.apple.com\/documentation\/VisionKit\/DataScannerViewController\/qualityLevel-swift.property"
        },
        {
          "description" : "The possible quality levels that the scanner uses to find data.",
          "name" : "DataScannerViewController.QualityLevel",
          "url" : "https:\/\/developer.apple.com\/documentation\/VisionKit\/DataScannerViewController\/QualityLevel-swift.enum"
        },
        {
          "description" : "A Boolean value that determines the frequency at which the scanner updates the geometry of recognized items.",
          "name" : "isHighFrameRateTrackingEnabled",
          "url" : "https:\/\/developer.apple.com\/documentation\/VisionKit\/DataScannerViewController\/isHighFrameRateTrackingEnabled"
        },
        {
          "description" : "A Boolean value that indicates whether people can use a two-finger pinch-to-zoom gesture.",
          "name" : "isPinchToZoomEnabled",
          "url" : "https:\/\/developer.apple.com\/documentation\/VisionKit\/DataScannerViewController\/isPinchToZoomEnabled"
        },
        {
          "description" : "A Boolean value that indicates whether the scanner provides help to a person when selecting items.",
          "name" : "isGuidanceEnabled",
          "url" : "https:\/\/developer.apple.com\/documentation\/VisionKit\/DataScannerViewController\/isGuidanceEnabled"
        },
        {
          "description" : "A Boolean value that indicates whether the scanner displays highlights around recognized items.",
          "name" : "isHighlightingEnabled",
          "url" : "https:\/\/developer.apple.com\/documentation\/VisionKit\/DataScannerViewController\/isHighlightingEnabled"
        }
      ],
      "title" : "Configuring data scanners"
    }
  ],
  "source" : "appleJSON",
  "title" : "recognizesMultipleItems",
  "url" : "https:\/\/developer.apple.com\/documentation\/VisionKit\/DataScannerViewController\/recognizesMultipleItems"
}