{
  "abstract" : "The identifiers for documents.",
  "codeExamples" : [

  ],
  "conformsTo" : [
    "Equatable",
    "Hashable",
    "RawRepresentable",
    "Sendable",
    "SendableMetatype"
  ],
  "contentHash" : "bf32e5aa22310389c021a139923beb2816b2ba6bae3a53b95b231b625522f4c9",
  "crawledAt" : "2025-12-01T12:49:44Z",
  "declaration" : {
    "code" : "struct HKDocumentTypeIdentifier",
    "language" : "swift"
  },
  "id" : "468DEB26-E2A6-4FA3-A121-63DDBC37ED3A",
  "kind" : "struct",
  "module" : "HealthKit",
  "overview" : "## Overview\n\nTo create an [doc:\/\/com.apple.healthkit\/documentation\/HealthKit\/HKDocumentType] instance, pass an [doc:\/\/com.apple.healthkit\/documentation\/HealthKit\/HKDocumentTypeIdentifier] value to the [doc:\/\/com.apple.healthkit\/documentation\/HealthKit\/HKObjectType\/documentType(forIdentifier:)] method.\n\nFor the complete list of quantity type identifiers, see Document Types.",
  "platforms" : [
    "iOS",
    "iPadOS",
    "Mac Catalyst",
    "macOS",
    "visionOS",
    "watchOS"
  ],
  "rawMarkdown" : "---\nsource: https:\/\/developer.apple.com\/documentation\/HealthKit\/HKDocumentTypeIdentifier\ncrawled: 2025-12-01T12:49:44Z\n---\n\n# HKDocumentTypeIdentifier\n\n**Structure**\n\nThe identifiers for documents.\n\n## Declaration\n\n```swift\nstruct HKDocumentTypeIdentifier\n```\n\n## Overview\n\nTo create an [doc:\/\/com.apple.healthkit\/documentation\/HealthKit\/HKDocumentType] instance, pass an [doc:\/\/com.apple.healthkit\/documentation\/HealthKit\/HKDocumentTypeIdentifier] value to the [doc:\/\/com.apple.healthkit\/documentation\/HealthKit\/HKObjectType\/documentType(forIdentifier:)] method.\n\nFor the complete list of quantity type identifiers, see Document Types.\n\n## Document Types\n\n- **CDA**: The CDA Document type identifier, used when requesting permission to read or share CDA documents.\n\n## Initializers\n\n- **init(rawValue:)**: Returns a newly initialized document type identifier using the provided string.\n\n## Creating document types\n\n- **documentType(forIdentifier:)**: Returns the shared document type for the provided identifier.\n\n## Conforms To\n\n- Equatable\n- Hashable\n- RawRepresentable\n- Sendable\n- SendableMetatype\n\n",
  "sections" : [
    {
      "content" : "",
      "items" : [
        {
          "description" : "The CDA Document type identifier, used when requesting permission to read or share CDA documents.",
          "name" : "CDA",
          "url" : "https:\/\/developer.apple.com\/documentation\/HealthKit\/HKDocumentTypeIdentifier\/CDA"
        }
      ],
      "title" : "Document Types"
    },
    {
      "content" : "",
      "items" : [
        {
          "description" : "Returns a newly initialized document type identifier using the provided string.",
          "name" : "init(rawValue:)",
          "url" : "https:\/\/developer.apple.com\/documentation\/HealthKit\/HKDocumentTypeIdentifier\/init(rawValue:)"
        }
      ],
      "title" : "Initializers"
    },
    {
      "content" : "",
      "items" : [
        {
          "description" : "Returns the shared document type for the provided identifier.",
          "name" : "documentType(forIdentifier:)",
          "url" : "https:\/\/developer.apple.com\/documentation\/HealthKit\/HKObjectType\/documentType(forIdentifier:)"
        }
      ],
      "title" : "Creating document types"
    }
  ],
  "source" : "appleJSON",
  "title" : "HKDocumentTypeIdentifier",
  "url" : "https:\/\/developer.apple.com\/documentation\/HealthKit\/HKDocumentTypeIdentifier"
}