{
  "abstract" : "Reads the user’s wheelchair use from the HealthKit store.",
  "codeExamples" : [

  ],
  "contentHash" : "9cab70134366eedaf5f8beee5cc26a61610bbe6ff77bbb3fde2a5a518c416023",
  "crawledAt" : "2025-12-02T17:50:02Z",
  "declaration" : {
    "code" : "func wheelchairUse() throws -> HKWheelchairUseObject",
    "language" : "swift"
  },
  "id" : "9616A7DA-2C15-47C7-B234-7456AABDD3DD",
  "kind" : "method",
  "language" : "swift",
  "module" : "HealthKit",
  "overview" : "## Return Value\n\nAn object indicating whether the user uses a wheelchair.\n\n## Discussion\n\nIf the user has not yet specified their wheelchair use, or if the user has denied your app permission to read the wheelchair use, this method returns [doc:\/\/com.apple.healthkit\/documentation\/HealthKit\/HKWheelchairUse\/notSet].",
  "platforms" : [
    "iOS",
    "iPadOS",
    "Mac Catalyst",
    "macOS",
    "visionOS",
    "watchOS"
  ],
  "rawMarkdown" : "---\nsource: https:\/\/developer.apple.com\/documentation\/HealthKit\/HKHealthStore\/wheelchairUse()\ncrawled: 2025-12-02T17:50:02Z\n---\n\n# wheelchairUse()\n\n**Instance Method**\n\nReads the user’s wheelchair use from the HealthKit store.\n\n## Declaration\n\n```swift\nfunc wheelchairUse() throws -> HKWheelchairUseObject\n```\n\n## Return Value\n\nAn object indicating whether the user uses a wheelchair.\n\n## Discussion\n\nIf the user has not yet specified their wheelchair use, or if the user has denied your app permission to read the wheelchair use, this method returns [doc:\/\/com.apple.healthkit\/documentation\/HealthKit\/HKWheelchairUse\/notSet].\n\n## Possible Values\n\n- **HKWheelchairUseObject**: This class acts as a wrapper for the wheelchair use enumeration.\n- **HKWheelchairUse**: Constants indicating the user’s wheelchair use.\n\n## Reading characteristic data\n\n- **biologicalSex()**: Reads someone’s biological sex from the HealthKit store.\n- **bloodType()**: Reads the user’s blood type from the HealthKit store.\n- **dateOfBirth()**: Reads the user’s date of birth from the HealthKit store as a date value.\n- **dateOfBirthComponents()**: Reads the user’s date of birth from the HealthKit store as date components.\n- **fitzpatrickSkinType()**: Reads the user’s Fitzpatrick Skin Type from the HealthKit store.\n\n",
  "sections" : [
    {
      "content" : "",
      "items" : [
        {
          "description" : "This class acts as a wrapper for the wheelchair use enumeration.",
          "name" : "HKWheelchairUseObject",
          "url" : "https:\/\/developer.apple.com\/documentation\/HealthKit\/HKWheelchairUseObject"
        },
        {
          "description" : "Constants indicating the user’s wheelchair use.",
          "name" : "HKWheelchairUse",
          "url" : "https:\/\/developer.apple.com\/documentation\/HealthKit\/HKWheelchairUse"
        }
      ],
      "title" : "Possible Values"
    },
    {
      "content" : "",
      "items" : [
        {
          "description" : "Reads someone’s biological sex from the HealthKit store.",
          "name" : "biologicalSex()",
          "url" : "https:\/\/developer.apple.com\/documentation\/HealthKit\/HKHealthStore\/biologicalSex()"
        },
        {
          "description" : "Reads the user’s blood type from the HealthKit store.",
          "name" : "bloodType()",
          "url" : "https:\/\/developer.apple.com\/documentation\/HealthKit\/HKHealthStore\/bloodType()"
        },
        {
          "description" : "Reads the user’s date of birth from the HealthKit store as a date value.",
          "name" : "dateOfBirth()",
          "url" : "https:\/\/developer.apple.com\/documentation\/HealthKit\/HKHealthStore\/dateOfBirth()"
        },
        {
          "description" : "Reads the user’s date of birth from the HealthKit store as date components.",
          "name" : "dateOfBirthComponents()",
          "url" : "https:\/\/developer.apple.com\/documentation\/HealthKit\/HKHealthStore\/dateOfBirthComponents()"
        },
        {
          "description" : "Reads the user’s Fitzpatrick Skin Type from the HealthKit store.",
          "name" : "fitzpatrickSkinType()",
          "url" : "https:\/\/developer.apple.com\/documentation\/HealthKit\/HKHealthStore\/fitzpatrickSkinType()"
        }
      ],
      "title" : "Reading characteristic data"
    }
  ],
  "source" : "appleJSON",
  "title" : "wheelchairUse()",
  "url" : "https:\/\/developer.apple.com\/documentation\/HealthKit\/HKHealthStore\/wheelchairUse()"
}