{
  "abstract" : "A sample that represents a discrete quantity.",
  "codeExamples" : [

  ],
  "conformsTo" : [
    "CVarArg",
    "CustomDebugStringConvertible",
    "CustomStringConvertible",
    "Equatable",
    "Hashable",
    "NSCoding",
    "NSObjectProtocol",
    "NSSecureCoding",
    "Sendable",
    "SendableMetatype"
  ],
  "contentHash" : "e118566bd3e9881a17d23e84838ad23bdace9f584dcd644a1739eea6668b30e8",
  "crawledAt" : "2025-12-02T17:52:23Z",
  "declaration" : {
    "code" : "class HKDiscreteQuantitySample",
    "language" : "swift"
  },
  "id" : "1281FC92-9F80-4345-A8DD-F09F7BE96238",
  "kind" : "class",
  "language" : "swift",
  "module" : "HealthKit",
  "overview" : "## Overview\n\nA quantity sample contains one or more [doc:\/\/com.apple.healthkit\/documentation\/HealthKit\/HKQuantity] objects. Each quantity represents a single piece of data with a single numeric value and the value’s associated units. Use these samples to store data representing independent measurements, such as height, heart rate, or temperature.\n\nThe [doc:\/\/com.apple.healthkit\/documentation\/HealthKit\/HKDiscreteQuantitySample] class is a concrete subclass of the [doc:\/\/com.apple.healthkit\/documentation\/HealthKit\/HKQuantitySample] class. Discrete quantity samples are immutable; you set the sample’s properties when you create it, and they cannot change.\n\n### Extend Discrete Quantity Samples\n\nLike many HealthKit classes, you should not subclass the [doc:\/\/com.apple.healthkit\/documentation\/HealthKit\/HKDiscreteQuantitySample] class. You may extend this class by adding metadata with custom keys to save related data used by your app.\n\nFor more information, see [doc:\/\/com.apple.healthkit\/documentation\/HealthKit\/HKQuantitySample\/init(type:quantity:start:end:metadata:)].",
  "platforms" : [
    "iOS",
    "iPadOS",
    "Mac Catalyst",
    "macOS",
    "visionOS",
    "watchOS"
  ],
  "rawMarkdown" : "---\nsource: https:\/\/developer.apple.com\/documentation\/HealthKit\/HKDiscreteQuantitySample\ncrawled: 2025-12-02T17:52:23Z\n---\n\n# HKDiscreteQuantitySample\n\n**Class**\n\nA sample that represents a discrete quantity.\n\n## Declaration\n\n```swift\nclass HKDiscreteQuantitySample\n```\n\n## Overview\n\nA quantity sample contains one or more [doc:\/\/com.apple.healthkit\/documentation\/HealthKit\/HKQuantity] objects. Each quantity represents a single piece of data with a single numeric value and the value’s associated units. Use these samples to store data representing independent measurements, such as height, heart rate, or temperature.\n\nThe [doc:\/\/com.apple.healthkit\/documentation\/HealthKit\/HKDiscreteQuantitySample] class is a concrete subclass of the [doc:\/\/com.apple.healthkit\/documentation\/HealthKit\/HKQuantitySample] class. Discrete quantity samples are immutable; you set the sample’s properties when you create it, and they cannot change.\n\n### Extend Discrete Quantity Samples\n\nLike many HealthKit classes, you should not subclass the [doc:\/\/com.apple.healthkit\/documentation\/HealthKit\/HKDiscreteQuantitySample] class. You may extend this class by adding metadata with custom keys to save related data used by your app.\n\nFor more information, see [doc:\/\/com.apple.healthkit\/documentation\/HealthKit\/HKQuantitySample\/init(type:quantity:start:end:metadata:)].\n\n## Accessing Calculated Values\n\n- **averageQuantity**: The average of all quantities contained by the sample.\n- **maximumQuantity**: The maximum quantity contained by the sample.\n- **minimumQuantity**: The minimum value contained by the sample.\n- **mostRecentQuantity**: The most recent quantity contained by the sample.\n- **mostRecentQuantityDateInterval**: The date interval for the most recent quantity contained by the sample.\n\n## Specifying Predicate Key Paths\n\n- **HKPredicateKeyPathMin**: The key path for the sample’s minimum quantity.\n- **HKPredicateKeyPathAverage**: The key path for the sample’s average quantity.\n- **HKPredicateKeyPathMax**: The key path for the sample’s maximum quantity.\n- **HKPredicateKeyPathMostRecent**: The key path for the sample’s most recent quantity.\n- **HKPredicateKeyPathMostRecentStartDate**: The key path for the start date of the sample’s most recent quantity.\n- **HKPredicateKeyPathMostRecentEndDate**: The key path for the end date of the sample’s most recent quantity.\n- **HKPredicateKeyPathMostRecentDuration**: A key path for the duration of the sample’s most recent quantity.\n\n## Basic samples\n\n- **HKCumulativeQuantitySample**: A sample that represents a cumulative quantity.\n- **HKQuantitySample**: A sample that represents a quantity, including the value and the units.\n- **HKCategorySample**: A sample with values from a short list of possible values.\n- **HKCorrelation**: A sample that groups multiple related samples into a single entry.\n- **Units and quantities**: Objects used to specify a quantity for a given unit, and to convert between units.\n- **Metadata Keys**: Constants used to add metadata to objects stored in HealthKit.\n\n## Inherits From\n\n- HKQuantitySample\n\n## Conforms To\n\n- CVarArg\n- CustomDebugStringConvertible\n- CustomStringConvertible\n- Equatable\n- Hashable\n- NSCoding\n- NSObjectProtocol\n- NSSecureCoding\n- Sendable\n- SendableMetatype\n\n",
  "sections" : [
    {
      "content" : "",
      "items" : [
        {
          "description" : "The average of all quantities contained by the sample.",
          "name" : "averageQuantity",
          "url" : "https:\/\/developer.apple.com\/documentation\/HealthKit\/HKDiscreteQuantitySample\/averageQuantity"
        },
        {
          "description" : "The maximum quantity contained by the sample.",
          "name" : "maximumQuantity",
          "url" : "https:\/\/developer.apple.com\/documentation\/HealthKit\/HKDiscreteQuantitySample\/maximumQuantity"
        },
        {
          "description" : "The minimum value contained by the sample.",
          "name" : "minimumQuantity",
          "url" : "https:\/\/developer.apple.com\/documentation\/HealthKit\/HKDiscreteQuantitySample\/minimumQuantity"
        },
        {
          "description" : "The most recent quantity contained by the sample.",
          "name" : "mostRecentQuantity",
          "url" : "https:\/\/developer.apple.com\/documentation\/HealthKit\/HKDiscreteQuantitySample\/mostRecentQuantity"
        },
        {
          "description" : "The date interval for the most recent quantity contained by the sample.",
          "name" : "mostRecentQuantityDateInterval",
          "url" : "https:\/\/developer.apple.com\/documentation\/HealthKit\/HKDiscreteQuantitySample\/mostRecentQuantityDateInterval"
        }
      ],
      "title" : "Accessing Calculated Values"
    },
    {
      "content" : "",
      "items" : [
        {
          "description" : "The key path for the sample’s minimum quantity.",
          "name" : "HKPredicateKeyPathMin",
          "url" : "https:\/\/developer.apple.com\/documentation\/HealthKit\/HKPredicateKeyPathMin"
        },
        {
          "description" : "The key path for the sample’s average quantity.",
          "name" : "HKPredicateKeyPathAverage",
          "url" : "https:\/\/developer.apple.com\/documentation\/HealthKit\/HKPredicateKeyPathAverage"
        },
        {
          "description" : "The key path for the sample’s maximum quantity.",
          "name" : "HKPredicateKeyPathMax",
          "url" : "https:\/\/developer.apple.com\/documentation\/HealthKit\/HKPredicateKeyPathMax"
        },
        {
          "description" : "The key path for the sample’s most recent quantity.",
          "name" : "HKPredicateKeyPathMostRecent",
          "url" : "https:\/\/developer.apple.com\/documentation\/HealthKit\/HKPredicateKeyPathMostRecent"
        },
        {
          "description" : "The key path for the start date of the sample’s most recent quantity.",
          "name" : "HKPredicateKeyPathMostRecentStartDate",
          "url" : "https:\/\/developer.apple.com\/documentation\/HealthKit\/HKPredicateKeyPathMostRecentStartDate"
        },
        {
          "description" : "The key path for the end date of the sample’s most recent quantity.",
          "name" : "HKPredicateKeyPathMostRecentEndDate",
          "url" : "https:\/\/developer.apple.com\/documentation\/HealthKit\/HKPredicateKeyPathMostRecentEndDate"
        },
        {
          "description" : "A key path for the duration of the sample’s most recent quantity.",
          "name" : "HKPredicateKeyPathMostRecentDuration",
          "url" : "https:\/\/developer.apple.com\/documentation\/HealthKit\/HKPredicateKeyPathMostRecentDuration"
        }
      ],
      "title" : "Specifying Predicate Key Paths"
    },
    {
      "content" : "",
      "items" : [
        {
          "description" : "A sample that represents a cumulative quantity.",
          "name" : "HKCumulativeQuantitySample",
          "url" : "https:\/\/developer.apple.com\/documentation\/HealthKit\/HKCumulativeQuantitySample"
        },
        {
          "description" : "A sample that represents a quantity, including the value and the units.",
          "name" : "HKQuantitySample",
          "url" : "https:\/\/developer.apple.com\/documentation\/HealthKit\/HKQuantitySample"
        },
        {
          "description" : "A sample with values from a short list of possible values.",
          "name" : "HKCategorySample",
          "url" : "https:\/\/developer.apple.com\/documentation\/HealthKit\/HKCategorySample"
        },
        {
          "description" : "A sample that groups multiple related samples into a single entry.",
          "name" : "HKCorrelation",
          "url" : "https:\/\/developer.apple.com\/documentation\/HealthKit\/HKCorrelation"
        },
        {
          "description" : "Objects used to specify a quantity for a given unit, and to convert between units.",
          "name" : "Units and quantities",
          "url" : "https:\/\/developer.apple.com\/documentation\/HealthKit\/units-and-quantities"
        },
        {
          "description" : "Constants used to add metadata to objects stored in HealthKit.",
          "name" : "Metadata Keys",
          "url" : "https:\/\/developer.apple.com\/documentation\/HealthKit\/metadata-keys"
        }
      ],
      "title" : "Basic samples"
    },
    {
      "content" : "",
      "items" : [
        {
          "name" : "HKQuantitySample"
        }
      ],
      "title" : "Inherits From"
    }
  ],
  "source" : "appleJSON",
  "title" : "HKDiscreteQuantitySample",
  "url" : "https:\/\/developer.apple.com\/documentation\/HealthKit\/HKDiscreteQuantitySample"
}