{
  "abstract" : "A reader that provides access to an attachment’s data.",
  "codeExamples" : [
    {
      "code" : "let attachmentStore = HKAttachmentStore(healthStore: store)\n\n\/\/ Get a data reader for the attachment.\nlet dataReader = attachmentStore.dataReader(for: myAttachment)",
      "language" : "swift"
    },
    {
      "code" : "let data: Data\ndo {\n    data = try await dataReader.data\n} catch {\n    \/\/ Handle the error here.\n    fatalError(\"*** An error occurred while accessing the attachment's data. \\(error.localizedDescription) ***\")\n}",
      "language" : "swift"
    },
    {
      "code" : "\/\/ Asynchronously access the attachment's bytes.\nvar data = Data()\ndo {\n    for try await byte in dataReader.bytes {\n        \/\/ Use the bytes here.\n        data.append(byte)\n    }\n} catch {\n    \/\/ Handle the error here.\n    fatalError(\"*** An error occurred while reading the attachment's data: \\(error.localizedDescription) ***\")\n}",
      "language" : "swift"
    }
  ],
  "contentHash" : "0a7505ccfd7163a975572c913f045d94e0bcb71a9fd3d8435c403b1a161e15ee",
  "crawledAt" : "2025-12-02T17:51:03Z",
  "declaration" : {
    "code" : "class HKAttachmentDataReader",
    "language" : "swift"
  },
  "id" : "416462F1-C764-4A05-A5F1-8CB9EC34B946",
  "kind" : "class",
  "language" : "swift",
  "module" : "HealthKit",
  "overview" : "## Overview\n\nTo access the attachment’s data, get a data reader from the attachment store.\n\nYou can then asynchronously access the whole data object.\n\nAlternatively, you can access the file’s contents as an asynchronous sequence of bytes.",
  "platforms" : [
    "iOS",
    "iPadOS",
    "Mac Catalyst",
    "macOS",
    "visionOS",
    "watchOS"
  ],
  "rawMarkdown" : "---\nsource: https:\/\/developer.apple.com\/documentation\/HealthKit\/HKAttachmentDataReader\ncrawled: 2025-12-02T17:51:03Z\n---\n\n# HKAttachmentDataReader\n\n**Class**\n\nA reader that provides access to an attachment’s data.\n\n## Declaration\n\n```swift\nclass HKAttachmentDataReader\n```\n\n## Overview\n\nTo access the attachment’s data, get a data reader from the attachment store.\n\n```swift\nlet attachmentStore = HKAttachmentStore(healthStore: store)\n\n\/\/ Get a data reader for the attachment.\nlet dataReader = attachmentStore.dataReader(for: myAttachment)\n```\n\nYou can then asynchronously access the whole data object.\n\n```swift\nlet data: Data\ndo {\n    data = try await dataReader.data\n} catch {\n    \/\/ Handle the error here.\n    fatalError(\"*** An error occurred while accessing the attachment's data. \\(error.localizedDescription) ***\")\n}\n```\n\nAlternatively, you can access the file’s contents as an asynchronous sequence of bytes.\n\n```swift\n\/\/ Asynchronously access the attachment's bytes.\nvar data = Data()\ndo {\n    for try await byte in dataReader.bytes {\n        \/\/ Use the bytes here.\n        data.append(byte)\n    }\n} catch {\n    \/\/ Handle the error here.\n    fatalError(\"*** An error occurred while reading the attachment's data: \\(error.localizedDescription) ***\")\n}\n```\n\n## Reading attachment data\n\n- **data**: The abstract’s data.\n- **bytes**: An asynchronous sequence that provides the attachment’s data.\n- **progress**: An object you can use to track the progress while reading an attachment’s data.\n\n## Accessing the attachment object\n\n- **attachment**: An attachment object that represents the file from which the reader is reading.\n\n## Attachments\n\n- **HKAttachment**: A file that is attached to a sample in the HealthKit store.\n- **HKAttachmentStore**: The access point for attachments associated with samples in the HealthKit store.\n\n",
  "sections" : [
    {
      "content" : "",
      "items" : [
        {
          "description" : "The abstract’s data.",
          "name" : "data",
          "url" : "https:\/\/developer.apple.com\/documentation\/HealthKit\/HKAttachmentDataReader\/data"
        },
        {
          "description" : "An asynchronous sequence that provides the attachment’s data.",
          "name" : "bytes",
          "url" : "https:\/\/developer.apple.com\/documentation\/HealthKit\/HKAttachmentDataReader\/bytes"
        },
        {
          "description" : "An object you can use to track the progress while reading an attachment’s data.",
          "name" : "progress",
          "url" : "https:\/\/developer.apple.com\/documentation\/HealthKit\/HKAttachmentDataReader\/progress"
        }
      ],
      "title" : "Reading attachment data"
    },
    {
      "content" : "",
      "items" : [
        {
          "description" : "An attachment object that represents the file from which the reader is reading.",
          "name" : "attachment",
          "url" : "https:\/\/developer.apple.com\/documentation\/HealthKit\/HKAttachmentDataReader\/attachment"
        }
      ],
      "title" : "Accessing the attachment object"
    },
    {
      "content" : "",
      "items" : [
        {
          "description" : "A file that is attached to a sample in the HealthKit store.",
          "name" : "HKAttachment",
          "url" : "https:\/\/developer.apple.com\/documentation\/HealthKit\/HKAttachment"
        },
        {
          "description" : "The access point for attachments associated with samples in the HealthKit store.",
          "name" : "HKAttachmentStore",
          "url" : "https:\/\/developer.apple.com\/documentation\/HealthKit\/HKAttachmentStore"
        }
      ],
      "title" : "Attachments"
    }
  ],
  "source" : "appleJSON",
  "title" : "HKAttachmentDataReader",
  "url" : "https:\/\/developer.apple.com\/documentation\/HealthKit\/HKAttachmentDataReader"
}