{
  "abstract" : "A query interface that reads samples using Swift concurrency.",
  "codeExamples" : [
    {
      "code" : "\/\/ Define the type.\nlet stepType = HKQuantityType(.stepCount)\n\n\/\/ Create the descriptor.\nlet descriptor = HKSampleQueryDescriptor(\n    predicates:[.quantitySample(type: stepType)],\n    sortDescriptors: [SortDescriptor(\\.endDate, order: .reverse)],\n    limit: 10)\n\n\/\/ Launch the query and wait for the results.\n\/\/ The system automatically sets results to [HKQuantitySample].\nlet results = try await descriptor.result(for: store)\n\nfor result in results {\n    \/\/ Process the results here.\n}",
      "language" : "swift"
    }
  ],
  "conformsTo" : [
    "Copyable",
    "HKAsyncQuery",
    "Sendable",
    "SendableMetatype"
  ],
  "contentHash" : "696176c7c1e296d3ae10397f276beecda53d9e9ae0df40a6f07f2a3e90d7797a",
  "crawledAt" : "2025-12-02T18:11:08Z",
  "declaration" : {
    "code" : "struct HKSampleQueryDescriptor<Sample> where Sample : HKSample",
    "language" : "swift"
  },
  "id" : "15B90B49-BB46-457E-88DE-718E4A2187C0",
  "kind" : "struct",
  "language" : "swift",
  "module" : "HealthKit",
  "overview" : "## Overview\n\nUse [doc:\/\/com.apple.healthkit\/documentation\/HealthKit\/HKSampleQueryDescriptor] to run a general query that returns a snapshot of all the matching samples currently saved in the HealthKit store.\n\nWhen you call the descriptor’s [doc:\/\/com.apple.healthkit\/documentation\/HealthKit\/HKSampleQueryDescriptor\/result(for:)] method, it creates and executes an [doc:\/\/com.apple.healthkit\/documentation\/HealthKit\/HKSampleQuery] in the background, passing the results from the query’s `resultsHandler` as its return value.",
  "platforms" : [
    "iOS",
    "iPadOS",
    "Mac Catalyst",
    "macOS",
    "visionOS",
    "watchOS"
  ],
  "rawMarkdown" : "---\nsource: https:\/\/developer.apple.com\/documentation\/HealthKit\/HKSampleQueryDescriptor\ncrawled: 2025-12-02T18:11:08Z\n---\n\n# HKSampleQueryDescriptor\n\n**Structure**\n\nA query interface that reads samples using Swift concurrency.\n\n## Declaration\n\n```swift\nstruct HKSampleQueryDescriptor<Sample> where Sample : HKSample\n```\n\n## Overview\n\nUse [doc:\/\/com.apple.healthkit\/documentation\/HealthKit\/HKSampleQueryDescriptor] to run a general query that returns a snapshot of all the matching samples currently saved in the HealthKit store.\n\n```swift\n\/\/ Define the type.\nlet stepType = HKQuantityType(.stepCount)\n\n\/\/ Create the descriptor.\nlet descriptor = HKSampleQueryDescriptor(\n    predicates:[.quantitySample(type: stepType)],\n    sortDescriptors: [SortDescriptor(\\.endDate, order: .reverse)],\n    limit: 10)\n\n\/\/ Launch the query and wait for the results.\n\/\/ The system automatically sets results to [HKQuantitySample].\nlet results = try await descriptor.result(for: store)\n\nfor result in results {\n    \/\/ Process the results here.\n}\n```\n\nWhen you call the descriptor’s [doc:\/\/com.apple.healthkit\/documentation\/HealthKit\/HKSampleQueryDescriptor\/result(for:)] method, it creates and executes an [doc:\/\/com.apple.healthkit\/documentation\/HealthKit\/HKSampleQuery] in the background, passing the results from the query’s `resultsHandler` as its return value.\n\n## Creating Query Descriptors\n\n- **init(predicates:sortDescriptors:limit:)**: Creates a sample query descriptor.\n\n## Running Queries\n\n- **result(for:)**: Runs a one-shot query and asynchronously returns a snapshot of the current matching results.\n\n## Accessing Query Properties\n\n- **limit**: The maximum number of samples that the query returns.\n- **predicates**: An array of sample predicates that define the type of data that the query returns.\n- **sortDescriptors**: An array that specifies the order of the results that the query returns.\n\n## Default Implementations\n\n- **HKAsyncQuery Implementations**\n\n## Basic queries\n\n- **HKSampleQuery**: A general query that returns a snapshot of all the matching samples currently saved in the HealthKit store.\n- **HKCorrelationQuery**: A query that performs complex searches based on the correlation’s contents, and returns a snapshot of all matching samples.\n- **HKQueryDescriptor**: A descriptor that specifies a set of samples based on the data type and a predicate.\n- **HKQuery**: An abstract class for all the query classes in HealthKit.\n\n## Conforms To\n\n- Copyable\n- HKAsyncQuery\n- Sendable\n- SendableMetatype\n\n",
  "sections" : [
    {
      "content" : "",
      "items" : [
        {
          "description" : "Creates a sample query descriptor.",
          "name" : "init(predicates:sortDescriptors:limit:)",
          "url" : "https:\/\/developer.apple.com\/documentation\/HealthKit\/HKSampleQueryDescriptor\/init(predicates:sortDescriptors:limit:)"
        }
      ],
      "title" : "Creating Query Descriptors"
    },
    {
      "content" : "",
      "items" : [
        {
          "description" : "Runs a one-shot query and asynchronously returns a snapshot of the current matching results.",
          "name" : "result(for:)",
          "url" : "https:\/\/developer.apple.com\/documentation\/HealthKit\/HKSampleQueryDescriptor\/result(for:)"
        }
      ],
      "title" : "Running Queries"
    },
    {
      "content" : "",
      "items" : [
        {
          "description" : "The maximum number of samples that the query returns.",
          "name" : "limit",
          "url" : "https:\/\/developer.apple.com\/documentation\/HealthKit\/HKSampleQueryDescriptor\/limit"
        },
        {
          "description" : "An array of sample predicates that define the type of data that the query returns.",
          "name" : "predicates",
          "url" : "https:\/\/developer.apple.com\/documentation\/HealthKit\/HKSampleQueryDescriptor\/predicates"
        },
        {
          "description" : "An array that specifies the order of the results that the query returns.",
          "name" : "sortDescriptors",
          "url" : "https:\/\/developer.apple.com\/documentation\/HealthKit\/HKSampleQueryDescriptor\/sortDescriptors"
        }
      ],
      "title" : "Accessing Query Properties"
    },
    {
      "content" : "",
      "items" : [
        {
          "description" : "",
          "name" : "HKAsyncQuery Implementations",
          "url" : "https:\/\/developer.apple.com\/documentation\/HealthKit\/HKSampleQueryDescriptor\/HKAsyncQuery-Implementations"
        }
      ],
      "title" : "Default Implementations"
    },
    {
      "content" : "",
      "items" : [
        {
          "description" : "A general query that returns a snapshot of all the matching samples currently saved in the HealthKit store.",
          "name" : "HKSampleQuery",
          "url" : "https:\/\/developer.apple.com\/documentation\/HealthKit\/HKSampleQuery"
        },
        {
          "description" : "A query that performs complex searches based on the correlation’s contents, and returns a snapshot of all matching samples.",
          "name" : "HKCorrelationQuery",
          "url" : "https:\/\/developer.apple.com\/documentation\/HealthKit\/HKCorrelationQuery"
        },
        {
          "description" : "A descriptor that specifies a set of samples based on the data type and a predicate.",
          "name" : "HKQueryDescriptor",
          "url" : "https:\/\/developer.apple.com\/documentation\/HealthKit\/HKQueryDescriptor"
        },
        {
          "description" : "An abstract class for all the query classes in HealthKit.",
          "name" : "HKQuery",
          "url" : "https:\/\/developer.apple.com\/documentation\/HealthKit\/HKQuery"
        }
      ],
      "title" : "Basic queries"
    }
  ],
  "source" : "appleJSON",
  "title" : "HKSampleQueryDescriptor",
  "url" : "https:\/\/developer.apple.com\/documentation\/HealthKit\/HKSampleQueryDescriptor"
}