{
  "abstract" : "A sample that stores a clinical record.",
  "codeExamples" : [

  ],
  "conformsTo" : [
    "CVarArg",
    "CustomDebugStringConvertible",
    "CustomStringConvertible",
    "Equatable",
    "Hashable",
    "NSCoding",
    "NSCopying",
    "NSObjectProtocol",
    "NSSecureCoding",
    "Sendable",
    "SendableMetatype"
  ],
  "contentHash" : "22e65b43935cb31ae85a58cdef7fdedab4206f2eca2b2f45924cfef08bd47e81",
  "crawledAt" : "2025-12-02T15:52:57Z",
  "declaration" : {
    "code" : "class HKClinicalRecord",
    "language" : "swift"
  },
  "id" : "A07BF6EC-80A9-4DEC-B543-191420D7F404",
  "kind" : "class",
  "language" : "swift",
  "module" : "HealthKit",
  "overview" : "## Overview\n\nThe clinical record stores information about a single condition, procedure, or result. While the record’s properties expose some high-level information, the  [doc:\/\/com.apple.healthkit\/documentation\/HealthKit\/HKClinicalRecord\/fhirResource] property contains the underlying data from the user’s healthcare institution.\n\nNote that the record inherits the [doc:\/\/com.apple.healthkit\/documentation\/HealthKit\/HKSample] class’s [doc:\/\/com.apple.healthkit\/documentation\/HealthKit\/HKSample\/startDate] and [doc:\/\/com.apple.healthkit\/documentation\/HealthKit\/HKSample\/endDate] properties. However, the system does not populate these properties with information from the FHIR data; instead, the [doc:\/\/com.apple.healthkit\/documentation\/HealthKit\/HKSample\/startDate] and [doc:\/\/com.apple.healthkit\/documentation\/HealthKit\/HKSample\/endDate] reflect the time and date when the system downloaded the FHIR data to the device.",
  "platforms" : [
    "iOS",
    "iPadOS",
    "Mac Catalyst",
    "macOS",
    "visionOS"
  ],
  "rawMarkdown" : "---\nsource: https:\/\/developer.apple.com\/documentation\/HealthKit\/HKClinicalRecord\ncrawled: 2025-12-02T15:52:57Z\n---\n\n# HKClinicalRecord\n\n**Class**\n\nA sample that stores a clinical record.\n\n## Declaration\n\n```swift\nclass HKClinicalRecord\n```\n\n## Overview\n\nThe clinical record stores information about a single condition, procedure, or result. While the record’s properties expose some high-level information, the  [doc:\/\/com.apple.healthkit\/documentation\/HealthKit\/HKClinicalRecord\/fhirResource] property contains the underlying data from the user’s healthcare institution.\n\nNote that the record inherits the [doc:\/\/com.apple.healthkit\/documentation\/HealthKit\/HKSample] class’s [doc:\/\/com.apple.healthkit\/documentation\/HealthKit\/HKSample\/startDate] and [doc:\/\/com.apple.healthkit\/documentation\/HealthKit\/HKSample\/endDate] properties. However, the system does not populate these properties with information from the FHIR data; instead, the [doc:\/\/com.apple.healthkit\/documentation\/HealthKit\/HKSample\/startDate] and [doc:\/\/com.apple.healthkit\/documentation\/HealthKit\/HKSample\/endDate] reflect the time and date when the system downloaded the FHIR data to the device.\n\n## Accessing Clinical Record Data\n\n- **clinicalType**: An identifier that indicates the type of record, such as an allergic reaction, a lab result, or a medical procedure.\n- **displayName**: The primary display name as shown in the Health app.\n- **fhirResource**: The Fast Healthcare Interoperability Resources (FHIR) data for this record.\n\n## Related Documentation\n\n- **HKClinicalType**: A type that identifies samples that contain clinical record data.\n\n## Medical records\n\n- **Accessing Health Records**: Read clinical record data from the HealthKit store.\n- **Accessing Sample Data in the Simulator**: Set up sample accounts to build and test your app.\n- **Accessing a User’s Clinical Records**: Request authorization to query HealthKit for a user’s clinical records and display them in your app.\n- **Accessing Data from a SMART Health Card**: Query for and validate a verifiable clinical record.\n- **HKFHIRResource**: An object containing Fast Healthcare Interoperability Resources (FHIR) data.\n- **HKVerifiableClinicalRecord**: A sample that represents the contents of a SMART Health Card or EU Digital COVID Certificate.\n- **HKVerifiableClinicalRecordSubject**: The subject associated with a signed clinical record.\n- **HKCDADocumentSample**: A Clinical Document Architecture (CDA) sample that stores a single document.\n- **HKDocumentSample**: An abstract class that represents a health document in the HealthKit store.\n- **CDA**: The CDA Document type identifier, used when requesting permission to read or share CDA documents.\n- **HKDocumentType**: A sample type used to create queries for documents.\n\n## Inherits From\n\n- HKSample\n\n## Conforms To\n\n- CVarArg\n- CustomDebugStringConvertible\n- CustomStringConvertible\n- Equatable\n- Hashable\n- NSCoding\n- NSCopying\n- NSObjectProtocol\n- NSSecureCoding\n- Sendable\n- SendableMetatype\n\n",
  "sections" : [
    {
      "content" : "",
      "items" : [
        {
          "description" : "An identifier that indicates the type of record, such as an allergic reaction, a lab result, or a medical procedure.",
          "name" : "clinicalType",
          "url" : "https:\/\/developer.apple.com\/documentation\/HealthKit\/HKClinicalRecord\/clinicalType"
        },
        {
          "description" : "The primary display name as shown in the Health app.",
          "name" : "displayName",
          "url" : "https:\/\/developer.apple.com\/documentation\/HealthKit\/HKClinicalRecord\/displayName"
        },
        {
          "description" : "The Fast Healthcare Interoperability Resources (FHIR) data for this record.",
          "name" : "fhirResource",
          "url" : "https:\/\/developer.apple.com\/documentation\/HealthKit\/HKClinicalRecord\/fhirResource"
        }
      ],
      "title" : "Accessing Clinical Record Data"
    },
    {
      "content" : "",
      "items" : [
        {
          "description" : "A type that identifies samples that contain clinical record data.",
          "name" : "HKClinicalType",
          "url" : "https:\/\/developer.apple.com\/documentation\/HealthKit\/HKClinicalType"
        }
      ],
      "title" : "Related Documentation"
    },
    {
      "content" : "",
      "items" : [
        {
          "description" : "Read clinical record data from the HealthKit store.",
          "name" : "Accessing Health Records",
          "url" : "https:\/\/developer.apple.com\/documentation\/HealthKit\/accessing-health-records"
        },
        {
          "description" : "Set up sample accounts to build and test your app.",
          "name" : "Accessing Sample Data in the Simulator",
          "url" : "https:\/\/developer.apple.com\/documentation\/HealthKit\/accessing-sample-data-in-the-simulator"
        },
        {
          "description" : "Request authorization to query HealthKit for a user’s clinical records and display them in your app.",
          "name" : "Accessing a User’s Clinical Records",
          "url" : "https:\/\/developer.apple.com\/documentation\/HealthKit\/accessing-a-user-s-clinical-records"
        },
        {
          "description" : "Query for and validate a verifiable clinical record.",
          "name" : "Accessing Data from a SMART Health Card",
          "url" : "https:\/\/developer.apple.com\/documentation\/HealthKit\/accessing-data-from-a-smart-health-card"
        },
        {
          "description" : "An object containing Fast Healthcare Interoperability Resources (FHIR) data.",
          "name" : "HKFHIRResource",
          "url" : "https:\/\/developer.apple.com\/documentation\/HealthKit\/HKFHIRResource"
        },
        {
          "description" : "A sample that represents the contents of a SMART Health Card or EU Digital COVID Certificate.",
          "name" : "HKVerifiableClinicalRecord",
          "url" : "https:\/\/developer.apple.com\/documentation\/HealthKit\/HKVerifiableClinicalRecord"
        },
        {
          "description" : "The subject associated with a signed clinical record.",
          "name" : "HKVerifiableClinicalRecordSubject",
          "url" : "https:\/\/developer.apple.com\/documentation\/HealthKit\/HKVerifiableClinicalRecordSubject"
        },
        {
          "description" : "A Clinical Document Architecture (CDA) sample that stores a single document.",
          "name" : "HKCDADocumentSample",
          "url" : "https:\/\/developer.apple.com\/documentation\/HealthKit\/HKCDADocumentSample"
        },
        {
          "description" : "An abstract class that represents a health document in the HealthKit store.",
          "name" : "HKDocumentSample",
          "url" : "https:\/\/developer.apple.com\/documentation\/HealthKit\/HKDocumentSample"
        },
        {
          "description" : "The CDA Document type identifier, used when requesting permission to read or share CDA documents.",
          "name" : "CDA",
          "url" : "https:\/\/developer.apple.com\/documentation\/HealthKit\/HKDocumentTypeIdentifier\/CDA"
        },
        {
          "description" : "A sample type used to create queries for documents.",
          "name" : "HKDocumentType",
          "url" : "https:\/\/developer.apple.com\/documentation\/HealthKit\/HKDocumentType"
        }
      ],
      "title" : "Medical records"
    },
    {
      "content" : "",
      "items" : [
        {
          "name" : "HKSample"
        }
      ],
      "title" : "Inherits From"
    }
  ],
  "source" : "appleJSON",
  "title" : "HKClinicalRecord",
  "url" : "https:\/\/developer.apple.com\/documentation\/HealthKit\/HKClinicalRecord"
}