{
  "abstract" : "A HealthKit sample represents a piece of data associated with a start and end time.",
  "codeExamples" : [

  ],
  "conformsTo" : [
    "CVarArg",
    "CustomDebugStringConvertible",
    "CustomStringConvertible",
    "Equatable",
    "Hashable",
    "NSCoding",
    "NSObjectProtocol",
    "NSSecureCoding",
    "Sendable",
    "SendableMetatype"
  ],
  "contentHash" : "08ecf25271ed14f43f4faa403c316210be9d559a3ca55994ce9a188341adc4ca",
  "crawledAt" : "2025-12-02T18:11:03Z",
  "declaration" : {
    "code" : "class HKSample",
    "language" : "swift"
  },
  "id" : "02C845BF-F116-44F4-A9A0-26B925806B3E",
  "inheritedBy" : [
    "HKAudiogramSample",
    "HKCategorySample",
    "HKClinicalRecord",
    "HKCorrelation",
    "HKDocumentSample",
    "HKElectrocardiogram",
    "HKMedicationDoseEvent",
    "HKQuantitySample",
    "HKScoredAssessment",
    "HKSeriesSample",
    "HKStateOfMind",
    "HKVerifiableClinicalRecord",
    "HKVisionPrescription",
    "HKWorkout"
  ],
  "kind" : "class",
  "language" : "swift",
  "module" : "HealthKit",
  "overview" : "## Overview\n\nThe `HKSample` class is an abstract class. You should never instantiate a `HKSample` object directly. Instead, you always work with one of its concrete subclasses: [doc:\/\/com.apple.healthkit\/documentation\/HealthKit\/HKCategorySample], [doc:\/\/com.apple.healthkit\/documentation\/HealthKit\/HKQuantitySample], [doc:\/\/com.apple.healthkit\/documentation\/HealthKit\/HKCorrelation], or [doc:\/\/com.apple.healthkit\/documentation\/HealthKit\/HKWorkout] classes.\n\nHealthKit samples are all immutable: You set the sample’s properties when you create it, and they cannot change.\n\nIf the sample represents data over a duration, the start time must be earlier than the end time. If the sample represents data at a particular instant, the start and end times can be the same.",
  "platforms" : [
    "iOS",
    "iPadOS",
    "Mac Catalyst",
    "macOS",
    "visionOS",
    "watchOS"
  ],
  "rawMarkdown" : "---\nsource: https:\/\/developer.apple.com\/documentation\/HealthKit\/HKSample\ncrawled: 2025-12-02T18:11:03Z\n---\n\n# HKSample\n\n**Class**\n\nA HealthKit sample represents a piece of data associated with a start and end time.\n\n## Declaration\n\n```swift\nclass HKSample\n```\n\n## Overview\n\nThe `HKSample` class is an abstract class. You should never instantiate a `HKSample` object directly. Instead, you always work with one of its concrete subclasses: [doc:\/\/com.apple.healthkit\/documentation\/HealthKit\/HKCategorySample], [doc:\/\/com.apple.healthkit\/documentation\/HealthKit\/HKQuantitySample], [doc:\/\/com.apple.healthkit\/documentation\/HealthKit\/HKCorrelation], or [doc:\/\/com.apple.healthkit\/documentation\/HealthKit\/HKWorkout] classes.\n\nHealthKit samples are all immutable: You set the sample’s properties when you create it, and they cannot change.\n\nIf the sample represents data over a duration, the start time must be earlier than the end time. If the sample represents data at a particular instant, the start and end times can be the same.\n\n## Accessing the Sample’s Data\n\n- **startDate**: The sample’s start date.\n- **endDate**: The sample’s end date.\n- **hasUndeterminedDuration**: Indicates whether the sample has an unknown duration.\n- **sampleType**: The sample type.\n\n## Specifying Sort Identifiers\n\n- **HKSampleSortIdentifierStartDate**: A constant for sorting samples based on their start date.\n- **HKSampleSortIdentifierEndDate**: A constant for sorting samples based on their end date.\n\n## Specifying Predicate Key Paths\n\n- **HKPredicateKeyPathStartDate**: The key path for accessing the sample’s start date.\n- **HKPredicateKeyPathEndDate**: The key path for accessing the sample’s end date.\n\n## Abstract superclasses\n\n- **HKQuantitySample**: A sample that represents a quantity, including the value and the units.\n- **HKObject**: A piece of data that can be stored inside the HealthKit store.\n\n## Inherits From\n\n- HKObject\n\n## Inherited By\n\n- HKAudiogramSample\n- HKCategorySample\n- HKClinicalRecord\n- HKCorrelation\n- HKDocumentSample\n- HKElectrocardiogram\n- HKMedicationDoseEvent\n- HKQuantitySample\n- HKScoredAssessment\n- HKSeriesSample\n- HKStateOfMind\n- HKVerifiableClinicalRecord\n- HKVisionPrescription\n- HKWorkout\n\n## Conforms To\n\n- CVarArg\n- CustomDebugStringConvertible\n- CustomStringConvertible\n- Equatable\n- Hashable\n- NSCoding\n- NSObjectProtocol\n- NSSecureCoding\n- Sendable\n- SendableMetatype\n\n",
  "sections" : [
    {
      "content" : "",
      "items" : [
        {
          "description" : "The sample’s start date.",
          "name" : "startDate",
          "url" : "https:\/\/developer.apple.com\/documentation\/HealthKit\/HKSample\/startDate"
        },
        {
          "description" : "The sample’s end date.",
          "name" : "endDate",
          "url" : "https:\/\/developer.apple.com\/documentation\/HealthKit\/HKSample\/endDate"
        },
        {
          "description" : "Indicates whether the sample has an unknown duration.",
          "name" : "hasUndeterminedDuration",
          "url" : "https:\/\/developer.apple.com\/documentation\/HealthKit\/HKSample\/hasUndeterminedDuration"
        },
        {
          "description" : "The sample type.",
          "name" : "sampleType",
          "url" : "https:\/\/developer.apple.com\/documentation\/HealthKit\/HKSample\/sampleType"
        }
      ],
      "title" : "Accessing the Sample’s Data"
    },
    {
      "content" : "",
      "items" : [
        {
          "description" : "A constant for sorting samples based on their start date.",
          "name" : "HKSampleSortIdentifierStartDate",
          "url" : "https:\/\/developer.apple.com\/documentation\/HealthKit\/HKSampleSortIdentifierStartDate"
        },
        {
          "description" : "A constant for sorting samples based on their end date.",
          "name" : "HKSampleSortIdentifierEndDate",
          "url" : "https:\/\/developer.apple.com\/documentation\/HealthKit\/HKSampleSortIdentifierEndDate"
        }
      ],
      "title" : "Specifying Sort Identifiers"
    },
    {
      "content" : "",
      "items" : [
        {
          "description" : "The key path for accessing the sample’s start date.",
          "name" : "HKPredicateKeyPathStartDate",
          "url" : "https:\/\/developer.apple.com\/documentation\/HealthKit\/HKPredicateKeyPathStartDate"
        },
        {
          "description" : "The key path for accessing the sample’s end date.",
          "name" : "HKPredicateKeyPathEndDate",
          "url" : "https:\/\/developer.apple.com\/documentation\/HealthKit\/HKPredicateKeyPathEndDate"
        }
      ],
      "title" : "Specifying Predicate Key Paths"
    },
    {
      "content" : "",
      "items" : [
        {
          "description" : "A sample that represents a quantity, including the value and the units.",
          "name" : "HKQuantitySample",
          "url" : "https:\/\/developer.apple.com\/documentation\/HealthKit\/HKQuantitySample"
        },
        {
          "description" : "A piece of data that can be stored inside the HealthKit store.",
          "name" : "HKObject",
          "url" : "https:\/\/developer.apple.com\/documentation\/HealthKit\/HKObject"
        }
      ],
      "title" : "Abstract superclasses"
    },
    {
      "content" : "",
      "items" : [
        {
          "name" : "HKObject"
        }
      ],
      "title" : "Inherits From"
    }
  ],
  "source" : "appleJSON",
  "title" : "HKSample",
  "url" : "https:\/\/developer.apple.com\/documentation\/HealthKit\/HKSample"
}