{
  "abstract" : "Sets the name associated with the stamp annotation.",
  "codeExamples" : [

  ],
  "contentHash" : "93a9381cc0d1d15364c07f5ec5d256210da5a3b292317af74cc570ac1107aa34",
  "crawledAt" : "2025-12-03T12:47:58Z",
  "declaration" : {
    "code" : "func setName(_ name: String!)",
    "language" : "swift"
  },
  "id" : "7E62FF5A-E063-445C-91BF-5545556E4BEF",
  "kind" : "method",
  "language" : "swift",
  "module" : "PDFKit",
  "overview" : "## Discussion\n\nThe name must be representable in ASCII. You can set a stamp annotation’s name to help you identify it, but that name is not displayed on the PDF page. You must provide the string you want displayed on the page, such as “Draft” or “Top Secret”, in the appearance stream for the annotation.",
  "platforms" : [
    "macOS"
  ],
  "rawMarkdown" : "---\nsource: https:\/\/developer.apple.com\/documentation\/PDFKit\/PDFAnnotationStamp\/setName(_:)\ncrawled: 2025-12-03T12:47:58Z\n---\n\n# setName(_:)\n\n**Instance Method**\n\nSets the name associated with the stamp annotation.\n\n## Declaration\n\n```swift\nfunc setName(_ name: String!)\n```\n\n## Discussion\n\nThe name must be representable in ASCII. You can set a stamp annotation’s name to help you identify it, but that name is not displayed on the PDF page. You must provide the string you want displayed on the page, such as “Draft” or “Top Secret”, in the appearance stream for the annotation.\n\n## Accessing and setting the stamp annotation\n\n- **name()**: Returns name associated with the stamp annotation.\n\n",
  "sections" : [
    {
      "content" : "",
      "items" : [
        {
          "description" : "Returns name associated with the stamp annotation.",
          "name" : "name()",
          "url" : "https:\/\/developer.apple.com\/documentation\/PDFKit\/PDFAnnotationStamp\/name()"
        }
      ],
      "title" : "Accessing and setting the stamp annotation"
    }
  ],
  "source" : "appleJSON",
  "title" : "setName(_:)",
  "url" : "https:\/\/developer.apple.com\/documentation\/PDFKit\/PDFAnnotationStamp\/setName(_:)"
}