{
  "abstract" : "Returns a Boolean value that indicates whether the annotation has an appearance stream associated with it.",
  "codeExamples" : [

  ],
  "contentHash" : "83abd2fe2520d014e2b152d728e38b05179f9b0458d5ea27595e997b84f28bba",
  "crawledAt" : "2025-12-02T19:25:07Z",
  "declaration" : {
    "code" : "var hasAppearanceStream: Bool { get }",
    "language" : "swift"
  },
  "id" : "CB046722-A03F-4D25-83F4-DF959F5611A0",
  "kind" : "property",
  "language" : "swift",
  "module" : "PDFKit",
  "overview" : "## Return Value\n\n[doc:\/\/com.apple.documentation\/documentation\/Swift\/true] if the annotation has an appearance stream; otherwise [doc:\/\/com.apple.documentation\/documentation\/Swift\/false].\n\n## Discussion\n\nAn appearance stream is a sequence of draw instructions used to render a PDF item. If an appearance stream exists, PDF Kit draws the annotation using the stream, which may override existing set parameters (such as the stroke color set with `setColor`).",
  "platforms" : [
    "iOS",
    "iPadOS",
    "Mac Catalyst",
    "macOS",
    "tvOS",
    "visionOS"
  ],
  "rawMarkdown" : "---\nsource: https:\/\/developer.apple.com\/documentation\/PDFKit\/PDFAnnotation\/hasAppearanceStream\ncrawled: 2025-12-02T19:25:07Z\n---\n\n# hasAppearanceStream\n\n**Instance Property**\n\nReturns a Boolean value that indicates whether the annotation has an appearance stream associated with it.\n\n## Declaration\n\n```swift\nvar hasAppearanceStream: Bool { get }\n```\n\n## Return Value\n\n[doc:\/\/com.apple.documentation\/documentation\/Swift\/true] if the annotation has an appearance stream; otherwise [doc:\/\/com.apple.documentation\/documentation\/Swift\/false].\n\n## Discussion\n\nAn appearance stream is a sequence of draw instructions used to render a PDF item. If an appearance stream exists, PDF Kit draws the annotation using the stream, which may override existing set parameters (such as the stroke color set with `setColor`).\n\n## Managing Annotation Display Characteristics\n\n- **alignment**: The alignment of the free text and text widget annotation’s text content.\n- **bounds**: Returns the bounding box for the annotation in page space.\n- **contents**: Returns the textual content (if any) associated with the annotation.\n- **font**: The font the annotation uses to display text.\n- **fontColor**: The font color the annotation uses to display text.\n- **border**: Sets the border style for the annotation.\n- **PDFBorder**: An optional border for an annotation that lies completely within the annotation rectangle.\n- **isHighlighted**: A Boolean value that indicates whether the annotation is in a highlighted state, such as when the mouse is down on a link annotation.\n- **color**: Sets the stroke color for the annotation.\n\n",
  "sections" : [
    {
      "content" : "",
      "items" : [
        {
          "description" : "The alignment of the free text and text widget annotation’s text content.",
          "name" : "alignment",
          "url" : "https:\/\/developer.apple.com\/documentation\/PDFKit\/PDFAnnotation\/alignment"
        },
        {
          "description" : "Returns the bounding box for the annotation in page space.",
          "name" : "bounds",
          "url" : "https:\/\/developer.apple.com\/documentation\/PDFKit\/PDFAnnotation\/bounds"
        },
        {
          "description" : "Returns the textual content (if any) associated with the annotation.",
          "name" : "contents",
          "url" : "https:\/\/developer.apple.com\/documentation\/PDFKit\/PDFAnnotation\/contents"
        },
        {
          "description" : "The font the annotation uses to display text.",
          "name" : "font",
          "url" : "https:\/\/developer.apple.com\/documentation\/PDFKit\/PDFAnnotation\/font"
        },
        {
          "description" : "The font color the annotation uses to display text.",
          "name" : "fontColor",
          "url" : "https:\/\/developer.apple.com\/documentation\/PDFKit\/PDFAnnotation\/fontColor"
        },
        {
          "description" : "Sets the border style for the annotation.",
          "name" : "border",
          "url" : "https:\/\/developer.apple.com\/documentation\/PDFKit\/PDFAnnotation\/border"
        },
        {
          "description" : "An optional border for an annotation that lies completely within the annotation rectangle.",
          "name" : "PDFBorder",
          "url" : "https:\/\/developer.apple.com\/documentation\/PDFKit\/PDFBorder"
        },
        {
          "description" : "A Boolean value that indicates whether the annotation is in a highlighted state, such as when the mouse is down on a link annotation.",
          "name" : "isHighlighted",
          "url" : "https:\/\/developer.apple.com\/documentation\/PDFKit\/PDFAnnotation\/isHighlighted"
        },
        {
          "description" : "Sets the stroke color for the annotation.",
          "name" : "color",
          "url" : "https:\/\/developer.apple.com\/documentation\/PDFKit\/PDFAnnotation\/color"
        }
      ],
      "title" : "Managing Annotation Display Characteristics"
    }
  ],
  "source" : "appleJSON",
  "title" : "hasAppearanceStream",
  "url" : "https:\/\/developer.apple.com\/documentation\/PDFKit\/PDFAnnotation\/hasAppearanceStream"
}