{
  "abstract" : "Sets the rotation angle of the annotation text field in degrees.",
  "codeExamples" : [

  ],
  "contentHash" : "cef816f68bc1280daee81d8ba2f33da4b906c8bf488abab76c5a33e29d6f6112",
  "crawledAt" : "2025-12-01T17:34:16Z",
  "declaration" : {
    "code" : "func setRotation(_ rotation: Int32)",
    "language" : "swift"
  },
  "id" : "EA8061F4-A09B-4C1E-B059-534E982593A0",
  "kind" : "method",
  "module" : "PDFKit",
  "platforms" : [
    "macOS"
  ],
  "rawMarkdown" : "---\nsource: https:\/\/developer.apple.com\/documentation\/PDFKit\/PDFAnnotationTextWidget\/setRotation(_:)\ncrawled: 2025-12-01T17:34:16Z\n---\n\n# setRotation(_:)\n\n**Instance Method**\n\nSets the rotation angle of the annotation text field in degrees.\n\n## Declaration\n\n```swift\nfunc setRotation(_ rotation: Int32)\n```\n\n## Parameters\n\n- **rotation**: The rotation angle to be applied to the annotation text field, in degrees. The rotation angle must be a positive or negative multiple of 90 (negative angles are converted to their positive equivalents; for example -90 is changed to 270).\n\n## Related Documentation\n\n- **PDFAnnotationTextWidget**: A `PDFAnnotationTextWidget` object allows you to manage the appearance and content of text fields.\n\n## Managing Background Color, Alignment, and Rotation\n\n- **backgroundColor()**: Returns the background color of the annotation text field.\n- **setBackgroundColor(_:)**: Sets the background color of the annotation text field.\n- **alignment()**: Returns the text alignment setting for the annotation.\n- **setAlignment(_:)**: Sets the text alignment for the annotation.\n- **rotation()**: Returns the rotation angle of the annotation text field in degrees.\n\n",
  "sections" : [
    {
      "content" : "",
      "items" : [
        {
          "description" : "A `PDFAnnotationTextWidget` object allows you to manage the appearance and content of text fields.",
          "name" : "PDFAnnotationTextWidget",
          "url" : "https:\/\/developer.apple.com\/documentation\/PDFKit\/PDFAnnotationTextWidget"
        }
      ],
      "title" : "Related Documentation"
    },
    {
      "content" : "",
      "items" : [
        {
          "description" : "Returns the background color of the annotation text field.",
          "name" : "backgroundColor()",
          "url" : "https:\/\/developer.apple.com\/documentation\/PDFKit\/PDFAnnotationTextWidget\/backgroundColor()"
        },
        {
          "description" : "Sets the background color of the annotation text field.",
          "name" : "setBackgroundColor(_:)",
          "url" : "https:\/\/developer.apple.com\/documentation\/PDFKit\/PDFAnnotationTextWidget\/setBackgroundColor(_:)"
        },
        {
          "description" : "Returns the text alignment setting for the annotation.",
          "name" : "alignment()",
          "url" : "https:\/\/developer.apple.com\/documentation\/PDFKit\/PDFAnnotationTextWidget\/alignment()"
        },
        {
          "description" : "Sets the text alignment for the annotation.",
          "name" : "setAlignment(_:)",
          "url" : "https:\/\/developer.apple.com\/documentation\/PDFKit\/PDFAnnotationTextWidget\/setAlignment(_:)"
        },
        {
          "description" : "Returns the rotation angle of the annotation text field in degrees.",
          "name" : "rotation()",
          "url" : "https:\/\/developer.apple.com\/documentation\/PDFKit\/PDFAnnotationTextWidget\/rotation()"
        }
      ],
      "title" : "Managing Background Color, Alignment, and Rotation"
    }
  ],
  "source" : "appleJSON",
  "title" : "setRotation(_:)",
  "url" : "https:\/\/developer.apple.com\/documentation\/PDFKit\/PDFAnnotationTextWidget\/setRotation(_:)"
}