{
  "abstract" : "Returns name associated with the stamp annotation.",
  "codeExamples" : [

  ],
  "contentHash" : "563e1c59d2eaa978153b14f200de0edc0ee94becda7df0f8701b46e429b8992a",
  "crawledAt" : "2025-12-03T12:47:57Z",
  "declaration" : {
    "code" : "func name() -> String!",
    "language" : "swift"
  },
  "id" : "37B93242-C3AE-45F3-92E1-F99F0C4DEC43",
  "kind" : "method",
  "language" : "swift",
  "module" : "PDFKit",
  "overview" : "## Discussion\n\nNote that the name value of the stamp annotation is not necessarily identical to the user-visible appearance of the stamp annotation. For example, a stamp annotation that displays “Confidential” on a PDF page may not have a name value of “Confidential”.",
  "platforms" : [
    "macOS"
  ],
  "rawMarkdown" : "---\nsource: https:\/\/developer.apple.com\/documentation\/PDFKit\/PDFAnnotationStamp\/name()\ncrawled: 2025-12-03T12:47:57Z\n---\n\n# name()\n\n**Instance Method**\n\nReturns name associated with the stamp annotation.\n\n## Declaration\n\n```swift\nfunc name() -> String!\n```\n\n## Discussion\n\nNote that the name value of the stamp annotation is not necessarily identical to the user-visible appearance of the stamp annotation. For example, a stamp annotation that displays “Confidential” on a PDF page may not have a name value of “Confidential”.\n\n## Accessing and setting the stamp annotation\n\n- **setName(_:)**: Sets the name associated with the stamp annotation.\n\n",
  "sections" : [
    {
      "content" : "",
      "items" : [
        {
          "description" : "Sets the name associated with the stamp annotation.",
          "name" : "setName(_:)",
          "url" : "https:\/\/developer.apple.com\/documentation\/PDFKit\/PDFAnnotationStamp\/setName(_:)"
        }
      ],
      "title" : "Accessing and setting the stamp annotation"
    }
  ],
  "source" : "appleJSON",
  "title" : "name()",
  "url" : "https:\/\/developer.apple.com\/documentation\/PDFKit\/PDFAnnotationStamp\/name()"
}