{
  "abstract" : "Sets the view’s background color to the specified color.",
  "codeExamples" : [

  ],
  "contentHash" : "90f191cf6e6d8f2c155cf410519a00912c3cfef7470fe3b2832f089b49783dfe",
  "crawledAt" : "2025-12-09T20:13:09Z",
  "declaration" : {
    "code" : "@IBAction @MainActor func takeBackgroundColorFrom(_ sender: Any)",
    "language" : "swift"
  },
  "id" : "8CF726B3-D7DA-4A18-BCF0-523BDD4A4D6F",
  "kind" : "method",
  "language" : "swift",
  "module" : "PDFKit",
  "overview" : "## Discussion\n\nA view’s background is the area displayed to either side of a PDF document’s pages. The background also appears between pages when page breaks are enabled. The default color is a 50% gray.",
  "platforms" : [
    "macOS"
  ],
  "rawMarkdown" : "---\nsource: https:\/\/developer.apple.com\/documentation\/PDFKit\/PDFView\/takeBackgroundColorFrom(_:)\ncrawled: 2025-12-09T20:13:09Z\n---\n\n# takeBackgroundColorFrom(_:)\n\n**Instance Method**\n\nSets the view’s background color to the specified color.\n\n## Declaration\n\n```swift\n@IBAction @MainActor func takeBackgroundColorFrom(_ sender: Any)\n```\n\n## Discussion\n\nA view’s background is the area displayed to either side of a PDF document’s pages. The background also appears between pages when page breaks are enabled. The default color is a 50% gray.\n\n## Setting Background Color\n\n- **backgroundColor**: The view’s background color.\n\n",
  "sections" : [
    {
      "content" : "",
      "items" : [
        {
          "description" : "The view’s background color.",
          "name" : "backgroundColor",
          "url" : "https:\/\/developer.apple.com\/documentation\/PDFKit\/PDFView\/backgroundColor"
        }
      ],
      "title" : "Setting Background Color"
    }
  ],
  "source" : "appleJSON",
  "title" : "takeBackgroundColorFrom(_:)",
  "url" : "https:\/\/developer.apple.com\/documentation\/PDFKit\/PDFView\/takeBackgroundColorFrom(_:)"
}