{
  "abstract" : "Create a deep link to a subscription-management page for your app.",
  "codeExamples" : [

  ],
  "contentHash" : "abc741100827b87b66981b8b2226ad04a4dbd32d1aae486ef5576b74566c1fd1",
  "crawledAt" : "2025-12-04T03:02:16Z",
  "id" : "4A2B7DEF-4687-443D-9205-4DBD6625704E",
  "kind" : "article",
  "language" : "data",
  "module" : "Advanced Commerce API",
  "overview" : "## Overview\n\nCustomers use the Settings > Apple Account > Subscriptions page in iOS to manage their subscriptions, including upgrading, downgrading, resubscribing, and canceling. When you offer subscriptions through the Advanced Commerce API, the Subscriptions page displays a “Manage in App” button.\n\n\n\nYou implement a subscription-management page in your app, and create a deep link URL to it that you submit to Apple. The Settings > Apple Account  > Subscriptions page then uses your deep link for the “Manage in App” button.\n\nCreate the deep link by following these guidelines:",
  "rawMarkdown" : "---\nsource: https:\/\/developer.apple.com\/documentation\/AdvancedCommerceAPI\/setupmanagesubscriptions\ncrawled: 2025-12-04T03:02:16Z\n---\n\n# Setting up a link to manage subscriptions\n\n**Article**\n\nCreate a deep link to a subscription-management page for your app.\n\n## Overview\n\nCustomers use the Settings > Apple Account > Subscriptions page in iOS to manage their subscriptions, including upgrading, downgrading, resubscribing, and canceling. When you offer subscriptions through the Advanced Commerce API, the Subscriptions page displays a “Manage in App” button.\n\n\n\nYou implement a subscription-management page in your app, and create a deep link URL to it that you submit to Apple. The Settings > Apple Account  > Subscriptions page then uses your deep link for the “Manage in App” button.\n\n\n\nCreate the deep link by following these guidelines:\n\n- Follow universal link guidelines for the URL. For more information, see [doc:\/\/com.apple.documentation\/documentation\/Xcode\/allowing-apps-and-websites-to-link-to-your-content].\n- Ensure the deep link lands on a page in your app that provides information about the subscription’s state and options for the customer to manage their subscription, for example, to change the plan, or resubscribe.\n- Optionally, provide a unique subscription-management deep link URL for each storefront.\n\n## Essentials\n\n- **Setting up your project for Advanced Commerce API**: Configure your app in App Store Connect, set up your server, and prepare your SKUs.\n- **Advanced Commerce API changelog**: Learn about new features and updates in the Advanced Commerce API.\n\n",
  "sections" : [
    {
      "content" : "",
      "items" : [
        {
          "description" : "Configure your app in App Store Connect, set up your server, and prepare your SKUs.",
          "name" : "Setting up your project for Advanced Commerce API",
          "url" : "https:\/\/developer.apple.com\/documentation\/AdvancedCommerceAPI\/setting-up-your-project-for-advanced-commerce"
        },
        {
          "description" : "Learn about new features and updates in the Advanced Commerce API.",
          "name" : "Advanced Commerce API changelog",
          "url" : "https:\/\/developer.apple.com\/documentation\/AdvancedCommerceAPI\/changelog"
        }
      ],
      "title" : "Essentials"
    }
  ],
  "source" : "appleJSON",
  "title" : "Setting up a link to manage subscriptions",
  "url" : "https:\/\/developer.apple.com\/documentation\/AdvancedCommerceAPI\/setupmanagesubscriptions"
}