{
  "abstract" : "The three-letter ISO 4217 currency code for the price of a product.",
  "codeExamples" : [

  ],
  "contentHash" : "148c2c81ff7fccb960f197fc9dba079388da37dcc73058a1d6f7f795df732d58",
  "crawledAt" : "2025-12-05T11:29:30Z",
  "declaration" : {
    "code" : "string currency",
    "language" : "swift"
  },
  "id" : "3CF71CEF-446B-4760-BBE1-70FA74E0FAF4",
  "kind" : "unknown",
  "language" : "data",
  "module" : "Advanced Commerce API",
  "overview" : "## Discussion\n\nThe currency property contains an ISO 4217 alpha-3 string that represents the currency of the price of a SKU. You provide a currency value each time you create or modify a purchase transaction.\n\nTo get the current storefront’s currency in your app:\n\nFor a list of regions and currencies that the App Store supports, see [https:\/\/developer.apple.com\/help\/app-store-connect\/reference\/financial-report-regions-and-currencies].",
  "platforms" : [
    "Unsupported OS: Advanced Commerce API"
  ],
  "rawMarkdown" : "---\nsource: https:\/\/developer.apple.com\/documentation\/AdvancedCommerceAPI\/currency\ncrawled: 2025-12-05T11:29:30Z\n---\n\n# currency\n\n**Type**\n\nThe three-letter ISO 4217 currency code for the price of a product.\n\n## Declaration\n\n```swift\nstring currency\n```\n\n## Discussion\n\nThe currency property contains an ISO 4217 alpha-3 string that represents the currency of the price of a SKU. You provide a currency value each time you create or modify a purchase transaction.\n\nTo get the current storefront’s currency in your app:\n\n- In iOS 15 through iOS 17, check the `Product.priceFormatStyle.currencyCode` of the generic product ID that represents your Advanced Commerce product. For more information, see [doc:\/\/com.apple.documentation\/documentation\/StoreKit\/Product\/priceFormatStyle].\n- In iOS 17 and later, get the currency value using `Storefront.current.currency`.\n\nFor a list of regions and currencies that the App Store supports, see [https:\/\/developer.apple.com\/help\/app-store-connect\/reference\/financial-report-regions-and-currencies].\n\n## Data types\n\n- **description**: A string you provide that describes a SKU.\n- **displayName**: A string with a product name that you can localize and is suitable for display to customers.\n- **effective**: A string value that indicates when a requested change to an auto-renewable subscription goes into effect.\n- **period**: The duration of a single cycle of an auto-renewable subscription.\n- **price**: A price, in milliunits of a currency, for an Advanced Commerce API SKU.\n- **proratedPrice**: A prorated price, in milliunits of a currency, for an Advanced Commerce API SKU.\n- **retainBillingCycle**: A Boolean value that determines whether to keep the existing billing cycle with the change you request.\n- **refundAmount**: A refund amount, in milliunits of the currency.\n- **refundReason**: A reason to request a refund.\n- **refundRiskingPreference**: A Boolean value that indicates whether the App Store asks you for consumption data to help inform the refund decision.\n- **SKU**: The product identifier of an in-app purchase product you manage in your own system.\n- **storefront**: A three-letter code that represents the country or region associated with the App Store storefront.\n- **taxCode**: A tax code that applies to a SKU.\n- **targetProductId**: A generic product identifier that represents all Advanced Commerce API products to App Store Connect, which you use when you migrate a product.\n- **transactionId**: A unique identifier that the App Store generates for a transaction.\n\n",
  "sections" : [
    {
      "content" : "",
      "items" : [
        {
          "description" : "A string you provide that describes a SKU.",
          "name" : "description",
          "url" : "https:\/\/developer.apple.com\/documentation\/AdvancedCommerceAPI\/description"
        },
        {
          "description" : "A string with a product name that you can localize and is suitable for display to customers.",
          "name" : "displayName",
          "url" : "https:\/\/developer.apple.com\/documentation\/AdvancedCommerceAPI\/displayName"
        },
        {
          "description" : "A string value that indicates when a requested change to an auto-renewable subscription goes into effect.",
          "name" : "effective",
          "url" : "https:\/\/developer.apple.com\/documentation\/AdvancedCommerceAPI\/effective"
        },
        {
          "description" : "The duration of a single cycle of an auto-renewable subscription.",
          "name" : "period",
          "url" : "https:\/\/developer.apple.com\/documentation\/AdvancedCommerceAPI\/period"
        },
        {
          "description" : "A price, in milliunits of a currency, for an Advanced Commerce API SKU.",
          "name" : "price",
          "url" : "https:\/\/developer.apple.com\/documentation\/AdvancedCommerceAPI\/price"
        },
        {
          "description" : "A prorated price, in milliunits of a currency, for an Advanced Commerce API SKU.",
          "name" : "proratedPrice",
          "url" : "https:\/\/developer.apple.com\/documentation\/AdvancedCommerceAPI\/proratedPrice"
        },
        {
          "description" : "A Boolean value that determines whether to keep the existing billing cycle with the change you request.",
          "name" : "retainBillingCycle",
          "url" : "https:\/\/developer.apple.com\/documentation\/AdvancedCommerceAPI\/retainBillingCycle"
        },
        {
          "description" : "A refund amount, in milliunits of the currency.",
          "name" : "refundAmount",
          "url" : "https:\/\/developer.apple.com\/documentation\/AdvancedCommerceAPI\/refundAmount"
        },
        {
          "description" : "A reason to request a refund.",
          "name" : "refundReason",
          "url" : "https:\/\/developer.apple.com\/documentation\/AdvancedCommerceAPI\/refundReason"
        },
        {
          "description" : "A Boolean value that indicates whether the App Store asks you for consumption data to help inform the refund decision.",
          "name" : "refundRiskingPreference",
          "url" : "https:\/\/developer.apple.com\/documentation\/AdvancedCommerceAPI\/refundRiskingPreference"
        },
        {
          "description" : "The product identifier of an in-app purchase product you manage in your own system.",
          "name" : "SKU",
          "url" : "https:\/\/developer.apple.com\/documentation\/AdvancedCommerceAPI\/SKU"
        },
        {
          "description" : "A three-letter code that represents the country or region associated with the App Store storefront.",
          "name" : "storefront",
          "url" : "https:\/\/developer.apple.com\/documentation\/AdvancedCommerceAPI\/storefront"
        },
        {
          "description" : "A tax code that applies to a SKU.",
          "name" : "taxCode",
          "url" : "https:\/\/developer.apple.com\/documentation\/AdvancedCommerceAPI\/taxCode"
        },
        {
          "description" : "A generic product identifier that represents all Advanced Commerce API products to App Store Connect, which you use when you migrate a product.",
          "name" : "targetProductId",
          "url" : "https:\/\/developer.apple.com\/documentation\/AdvancedCommerceAPI\/targetProductId"
        },
        {
          "description" : "A unique identifier that the App Store generates for a transaction.",
          "name" : "transactionId",
          "url" : "https:\/\/developer.apple.com\/documentation\/AdvancedCommerceAPI\/transactionId"
        }
      ],
      "title" : "Data types"
    }
  ],
  "source" : "appleJSON",
  "title" : "currency",
  "url" : "https:\/\/developer.apple.com\/documentation\/AdvancedCommerceAPI\/currency"
}