{
  "abstract" : "A class that defines the context for a single payment token in a payment request for multimerchant payments.",
  "codeExamples" : [

  ],
  "conformsTo" : [
    "CVarArg",
    "CustomDebugStringConvertible",
    "CustomStringConvertible",
    "Equatable",
    "Hashable",
    "NSObjectProtocol"
  ],
  "contentHash" : "d81d85d4cb5c6b22469bec5e2a66155eff3c75dda2a96c3aaf65faa22ce8987e",
  "crawledAt" : "2025-12-02T08:22:00Z",
  "declaration" : {
    "code" : "class PKPaymentTokenContext",
    "language" : "swift"
  },
  "id" : "45AF32B9-21A4-4583-ADB2-5AA9E162782A",
  "kind" : "class",
  "module" : "PassKit (Apple Pay and Wallet)",
  "overview" : "## Overview\n\nUse [doc:\/\/com.apple.passkit\/documentation\/PassKit\/PKPaymentTokenContext] to authorize a payment amount for each payment token in a multimerchant payment request. To enable multiple merchants for a transaction, use one [doc:\/\/com.apple.passkit\/documentation\/PassKit\/PKPaymentTokenContext] object for each merchant.\n\nYou can optionally associate each payment token with the merchant’s top-level domain.",
  "platforms" : [
    "iOS",
    "iPadOS",
    "Mac Catalyst",
    "macOS",
    "visionOS"
  ],
  "rawMarkdown" : "---\nsource: https:\/\/developer.apple.com\/documentation\/PassKit\/PKPaymentTokenContext\ncrawled: 2025-12-02T08:22:00Z\n---\n\n# PKPaymentTokenContext\n\n**Class**\n\nA class that defines the context for a single payment token in a payment request for multimerchant payments.\n\n## Declaration\n\n```swift\nclass PKPaymentTokenContext\n```\n\n## Overview\n\n\n\nUse [doc:\/\/com.apple.passkit\/documentation\/PassKit\/PKPaymentTokenContext] to authorize a payment amount for each payment token in a multimerchant payment request. To enable multiple merchants for a transaction, use one [doc:\/\/com.apple.passkit\/documentation\/PassKit\/PKPaymentTokenContext] object for each merchant.\n\nYou can optionally associate each payment token with the merchant’s top-level domain.\n\n## Creating a payment token context\n\n- **init(merchantIdentifier:externalIdentifier:merchantName:merchantDomain:amount:)**: Create a payment token context for a single merchant.\n\n## Specifying the merchant\n\n- **merchantIdentifier**: The Apply Pay merchant identifier.\n- **merchantDomain**: The merchant’s top-level domain that the Apple Pay server associates with the payment token.\n- **merchantName**: The merchant’s display name that the Apple Pay server associates with the payment token.\n- **externalIdentifier**: An external identifier for the merchant.\n\n## Indicating a payment amount\n\n- **amount**: The amount to authorize for the payment token.\n\n## Payment requests\n\n- **PKPaymentRequest**: An object that represents a request for payment, including details about payment-processing capabilities, the payment amount, and shipping information.\n- **PKRecurringPaymentRequest**: A class that represents a request to set up a recurring payment, typically a subscription.\n- **PKAutomaticReloadPaymentRequest**: A class that represents a request to set up an automatic reload payment, such as a store card top-up or a prepaid account.\n- **PKDeferredPaymentRequest**: An object that represents a request to set up a deferred payment, such as a hotel booking or a pre-order.\n\n## Inherits From\n\n- NSObject\n\n## Conforms To\n\n- CVarArg\n- CustomDebugStringConvertible\n- CustomStringConvertible\n- Equatable\n- Hashable\n- NSObjectProtocol\n\n",
  "sections" : [
    {
      "content" : "",
      "items" : [
        {
          "description" : "Create a payment token context for a single merchant.",
          "name" : "init(merchantIdentifier:externalIdentifier:merchantName:merchantDomain:amount:)",
          "url" : "https:\/\/developer.apple.com\/documentation\/PassKit\/PKPaymentTokenContext\/init(merchantIdentifier:externalIdentifier:merchantName:merchantDomain:amount:)"
        }
      ],
      "title" : "Creating a payment token context"
    },
    {
      "content" : "",
      "items" : [
        {
          "description" : "The Apply Pay merchant identifier.",
          "name" : "merchantIdentifier",
          "url" : "https:\/\/developer.apple.com\/documentation\/PassKit\/PKPaymentTokenContext\/merchantIdentifier"
        },
        {
          "description" : "The merchant’s top-level domain that the Apple Pay server associates with the payment token.",
          "name" : "merchantDomain",
          "url" : "https:\/\/developer.apple.com\/documentation\/PassKit\/PKPaymentTokenContext\/merchantDomain"
        },
        {
          "description" : "The merchant’s display name that the Apple Pay server associates with the payment token.",
          "name" : "merchantName",
          "url" : "https:\/\/developer.apple.com\/documentation\/PassKit\/PKPaymentTokenContext\/merchantName"
        },
        {
          "description" : "An external identifier for the merchant.",
          "name" : "externalIdentifier",
          "url" : "https:\/\/developer.apple.com\/documentation\/PassKit\/PKPaymentTokenContext\/externalIdentifier"
        }
      ],
      "title" : "Specifying the merchant"
    },
    {
      "content" : "",
      "items" : [
        {
          "description" : "The amount to authorize for the payment token.",
          "name" : "amount",
          "url" : "https:\/\/developer.apple.com\/documentation\/PassKit\/PKPaymentTokenContext\/amount"
        }
      ],
      "title" : "Indicating a payment amount"
    },
    {
      "content" : "",
      "items" : [
        {
          "description" : "An object that represents a request for payment, including details about payment-processing capabilities, the payment amount, and shipping information.",
          "name" : "PKPaymentRequest",
          "url" : "https:\/\/developer.apple.com\/documentation\/PassKit\/PKPaymentRequest"
        },
        {
          "description" : "A class that represents a request to set up a recurring payment, typically a subscription.",
          "name" : "PKRecurringPaymentRequest",
          "url" : "https:\/\/developer.apple.com\/documentation\/PassKit\/PKRecurringPaymentRequest"
        },
        {
          "description" : "A class that represents a request to set up an automatic reload payment, such as a store card top-up or a prepaid account.",
          "name" : "PKAutomaticReloadPaymentRequest",
          "url" : "https:\/\/developer.apple.com\/documentation\/PassKit\/PKAutomaticReloadPaymentRequest"
        },
        {
          "description" : "An object that represents a request to set up a deferred payment, such as a hotel booking or a pre-order.",
          "name" : "PKDeferredPaymentRequest",
          "url" : "https:\/\/developer.apple.com\/documentation\/PassKit\/PKDeferredPaymentRequest"
        }
      ],
      "title" : "Payment requests"
    },
    {
      "content" : "",
      "items" : [
        {
          "name" : "NSObject"
        }
      ],
      "title" : "Inherits From"
    }
  ],
  "source" : "appleJSON",
  "title" : "PKPaymentTokenContext",
  "url" : "https:\/\/developer.apple.com\/documentation\/PassKit\/PKPaymentTokenContext"
}