{
  "abstract" : "Presents a user-to-profile configuration panel, which lets the user specify their preferred profile.",
  "codeExamples" : [

  ],
  "contentHash" : "9f2b2a41079074523615ba24aaadb381087e4aff82b4b4aa814be2bdbdb31045",
  "crawledAt" : "2025-12-01T00:57:18Z",
  "declaration" : {
    "code" : "func presentProfilePreferencePanel(currentSettings: [TVUserIdentifier : TVAppProfileDescriptor], availableProfiles: [TVAppProfileDescriptor], completion: @escaping ([TVUserIdentifier : TVAppProfileDescriptor]) -> Void)",
    "language" : "swift"
  },
  "id" : "649B309E-7660-4265-95B4-F509E76C20EE",
  "kind" : "method",
  "module" : "TV Services",
  "overview" : "## Discussion\n\nCalling this method displays a panel that lets the user configure which app-specific profile to associate with each Apple TV user account. The panel gives the user the option to select from any of the profiles in the `availableProfiles` parameter. It also uses the information in the `existingSettings` parameter to configure the initial mapping between users and profiles. After configuring the user accounts and dismissing the panel, the system calls your `completion` handler to deliver the updated mapping between user accounts and profiles.",
  "platforms" : [
    "tvOS"
  ],
  "rawMarkdown" : "---\nsource: https:\/\/developer.apple.com\/documentation\/TVServices\/TVUserManager\/presentProfilePreferencePanel(currentSettings:availableProfiles:completion:)\ncrawled: 2025-12-01T00:57:18Z\n---\n\n# presentProfilePreferencePanel(currentSettings:availableProfiles:completion:)\n\n**Instance Method**\n\nPresents a user-to-profile configuration panel, which lets the user specify their preferred profile.\n\n## Declaration\n\n```swift\nfunc presentProfilePreferencePanel(currentSettings: [TVUserIdentifier : TVAppProfileDescriptor], availableProfiles: [TVAppProfileDescriptor], completion: @escaping ([TVUserIdentifier : TVAppProfileDescriptor]) -> Void)\n```\n\n```swift\nfunc presentProfilePreferencePanel(currentSettings: [TVUserIdentifier : TVAppProfileDescriptor], availableProfiles: [TVAppProfileDescriptor]) async -> [TVUserIdentifier : TVAppProfileDescriptor]\n```\n\n## Parameters\n\n- **availableProfiles**: The complete list of app-specific profiles available in your app. The configuration panel displays this set of profiles to the user.\n- **completion**: The completion handler to call when the user dismisses the configuration panel. This handler has no return value and takes the following parameter:\n\n\n\n## Discussion\n\n\n\nCalling this method displays a panel that lets the user configure which app-specific profile to associate with each Apple TV user account. The panel gives the user the option to select from any of the profiles in the `availableProfiles` parameter. It also uses the information in the `existingSettings` parameter to configure the initial mapping between users and profiles. After configuring the user accounts and dismissing the panel, the system calls your `completion` handler to deliver the updated mapping between user accounts and profiles.\n\n## Deprecated symbols\n\n- **currentUserIdentifier**: A unique identifier representing the currently active Apple TV user.\n- **currentUserIdentifierDidChangeNotification**: The notification the system sends when a different user becomes current.\n- **shouldStorePreferenceForCurrentUser(to:completion:)**: Prompts the user to save the specified profile as the preferred profile for the current user.\n- **TVAppProfileDescriptor**: A model object that you use to represent an app-specific profile.\n- **TVUserIdentifier**: A unique string for differentiating between accounts on Apple TV.\n- **userIdentifiersForCurrentProfile**: An array of system user identifiers that you associated with the current app-specific profile.\n\n",
  "sections" : [
    {
      "content" : "",
      "items" : [
        {
          "description" : "A unique identifier representing the currently active Apple TV user.",
          "name" : "currentUserIdentifier",
          "url" : "https:\/\/developer.apple.com\/documentation\/TVServices\/TVUserManager\/currentUserIdentifier"
        },
        {
          "description" : "The notification the system sends when a different user becomes current.",
          "name" : "currentUserIdentifierDidChangeNotification",
          "url" : "https:\/\/developer.apple.com\/documentation\/TVServices\/TVUserManager\/currentUserIdentifierDidChangeNotification"
        },
        {
          "description" : "Prompts the user to save the specified profile as the preferred profile for the current user.",
          "name" : "shouldStorePreferenceForCurrentUser(to:completion:)",
          "url" : "https:\/\/developer.apple.com\/documentation\/TVServices\/TVUserManager\/shouldStorePreferenceForCurrentUser(to:completion:)"
        },
        {
          "description" : "A model object that you use to represent an app-specific profile.",
          "name" : "TVAppProfileDescriptor",
          "url" : "https:\/\/developer.apple.com\/documentation\/TVServices\/TVAppProfileDescriptor"
        },
        {
          "description" : "A unique string for differentiating between accounts on Apple TV.",
          "name" : "TVUserIdentifier",
          "url" : "https:\/\/developer.apple.com\/documentation\/TVServices\/TVUserIdentifier"
        },
        {
          "description" : "An array of system user identifiers that you associated with the current app-specific profile.",
          "name" : "userIdentifiersForCurrentProfile",
          "url" : "https:\/\/developer.apple.com\/documentation\/TVServices\/TVUserManager\/userIdentifiersForCurrentProfile"
        }
      ],
      "title" : "Deprecated symbols"
    }
  ],
  "source" : "appleJSON",
  "title" : "presentProfilePreferencePanel(currentSettings:availableProfiles:completion:)",
  "url" : "https:\/\/developer.apple.com\/documentation\/TVServices\/TVUserManager\/presentProfilePreferencePanel(currentSettings:availableProfiles:completion:)"
}