{
  "abstract" : "An item to display in a section-based interface.",
  "codeExamples" : [

  ],
  "conformsTo" : [
    "CVarArg",
    "CustomDebugStringConvertible",
    "CustomStringConvertible",
    "Equatable",
    "Hashable",
    "NSObjectProtocol"
  ],
  "contentHash" : "0dc6ace89898432a104bc9a18721efc0cbfb4e02f2bef8abd4dbbb302e5207cc",
  "crawledAt" : "2025-12-07T13:04:07Z",
  "declaration" : {
    "code" : "class TVTopShelfSectionedItem",
    "language" : "swift"
  },
  "id" : "26A5FC76-EDB5-4993-9EE3-324091E70F62",
  "kind" : "class",
  "language" : "swift",
  "module" : "TV Services",
  "overview" : "## Overview\n\nCreate a [doc:\/\/com.apple.tvservices\/documentation\/TVServices\/TVTopShelfSectionedItem] object for each item you want to display in the top shelf. Each sectioned item corresponds to one item of your app’s content. For example, a video playback app uses sectioned items to represent movies or shows. Specify the image for the item using the [doc:\/\/com.apple.tvservices\/documentation\/TVServices\/TVTopShelfItem\/setImageURL(_:for:)] method. Use the inherited [doc:\/\/com.apple.tvservices\/documentation\/TVServices\/TVTopShelfItem\/playAction] and [doc:\/\/com.apple.tvservices\/documentation\/TVServices\/TVTopShelfItem\/displayAction] properties to let the system know what to do when the user interacts with the item.",
  "platforms" : [
    "tvOS"
  ],
  "rawMarkdown" : "---\nsource: https:\/\/developer.apple.com\/documentation\/TVServices\/TVTopShelfSectionedItem\ncrawled: 2025-12-07T13:04:07Z\n---\n\n# TVTopShelfSectionedItem\n\n**Class**\n\nAn item to display in a section-based interface.\n\n## Declaration\n\n```swift\nclass TVTopShelfSectionedItem\n```\n\n## Overview\n\nCreate a [doc:\/\/com.apple.tvservices\/documentation\/TVServices\/TVTopShelfSectionedItem] object for each item you want to display in the top shelf. Each sectioned item corresponds to one item of your app’s content. For example, a video playback app uses sectioned items to represent movies or shows. Specify the image for the item using the [doc:\/\/com.apple.tvservices\/documentation\/TVServices\/TVTopShelfItem\/setImageURL(_:for:)] method. Use the inherited [doc:\/\/com.apple.tvservices\/documentation\/TVServices\/TVTopShelfItem\/playAction] and [doc:\/\/com.apple.tvservices\/documentation\/TVServices\/TVTopShelfItem\/displayAction] properties to let the system know what to do when the user interacts with the item.\n\n## Setting the Image Shape\n\n- **imageShape**: The aspect ratio of the item’s image.\n- **TVTopShelfSectionedItem.ImageShape**: Constants indicating the aspect ratio of an image.\n\n## Setting the Playback Progress\n\n- **playbackProgress**: The percentage of the content that the user has already played, specified as a value between 0.0 and 1.0.\n\n## Sectioned and inset content\n\n- **TVTopShelfItemCollection**: A group of items that you display together in a sectioned interface in the top shelf.\n- **TVTopShelfSectionedContent**: The set of items you want to present using a section-based interface in the top shelf.\n- **TVTopShelfInsetContent**: A set of items to present using an inset-style interface in the top shelf.\n\n## Inherits From\n\n- TVTopShelfItem\n\n## Conforms To\n\n- CVarArg\n- CustomDebugStringConvertible\n- CustomStringConvertible\n- Equatable\n- Hashable\n- NSObjectProtocol\n\n",
  "sections" : [
    {
      "content" : "",
      "items" : [
        {
          "description" : "The aspect ratio of the item’s image.",
          "name" : "imageShape",
          "url" : "https:\/\/developer.apple.com\/documentation\/TVServices\/TVTopShelfSectionedItem\/imageShape-swift.property"
        },
        {
          "description" : "Constants indicating the aspect ratio of an image.",
          "name" : "TVTopShelfSectionedItem.ImageShape",
          "url" : "https:\/\/developer.apple.com\/documentation\/TVServices\/TVTopShelfSectionedItem\/ImageShape-swift.enum"
        }
      ],
      "title" : "Setting the Image Shape"
    },
    {
      "content" : "",
      "items" : [
        {
          "description" : "The percentage of the content that the user has already played, specified as a value between 0.0 and 1.0.",
          "name" : "playbackProgress",
          "url" : "https:\/\/developer.apple.com\/documentation\/TVServices\/TVTopShelfSectionedItem\/playbackProgress"
        }
      ],
      "title" : "Setting the Playback Progress"
    },
    {
      "content" : "",
      "items" : [
        {
          "description" : "A group of items that you display together in a sectioned interface in the top shelf.",
          "name" : "TVTopShelfItemCollection",
          "url" : "https:\/\/developer.apple.com\/documentation\/TVServices\/TVTopShelfItemCollection"
        },
        {
          "description" : "The set of items you want to present using a section-based interface in the top shelf.",
          "name" : "TVTopShelfSectionedContent",
          "url" : "https:\/\/developer.apple.com\/documentation\/TVServices\/TVTopShelfSectionedContent"
        },
        {
          "description" : "A set of items to present using an inset-style interface in the top shelf.",
          "name" : "TVTopShelfInsetContent",
          "url" : "https:\/\/developer.apple.com\/documentation\/TVServices\/TVTopShelfInsetContent"
        }
      ],
      "title" : "Sectioned and inset content"
    },
    {
      "content" : "",
      "items" : [
        {
          "name" : "TVTopShelfItem"
        }
      ],
      "title" : "Inherits From"
    }
  ],
  "source" : "appleJSON",
  "title" : "TVTopShelfSectionedItem",
  "url" : "https:\/\/developer.apple.com\/documentation\/TVServices\/TVTopShelfSectionedItem"
}