{
  "abstract" : "Released March 25, 2019 — Version 12.1 (14607.1.40)",
  "codeExamples" : [

  ],
  "contentHash" : "6521d7716b2761548b29f0eb5e858242e98aeeaa49993f5c2e58bfb932a46e82",
  "crawledAt" : "2025-12-02T16:50:57Z",
  "id" : "62A63F04-2DDB-4555-9924-10F5FF870E3B",
  "kind" : "article",
  "language" : "swift",
  "overview" : "## Overview\n\nSafari 12.1 ships with iOS 12.2 and macOS 10.14.4. It’s also available for macOS 10.13.6 and 10.12.6.\n\nNew features of Safari 12.1 include:\n\n### General\n\n#### New Features\n\n#### Resolved Issues\n\n### Authentication and Passwords\n\n#### New Features\n\n### Security and Privacy\n\n#### New Features\n\n### Intelligent Tracking Prevention\n\n#### New Features\n\n### Web API\n\n#### New Features\n\n### Payment Request API\n\n#### New Features\n\n### CSS and Text\n\n#### New Features\n\n### Media\n\n#### New Features\n\n### Safari App Extension API\n\n#### New Features\n\n### Web Inspector and Tools\n\n#### New Features",
  "rawMarkdown" : "---\nsource: https:\/\/developer.apple.com\/documentation\/Safari-Release-Notes\/safari-12_1-release-notes\ncrawled: 2025-12-02T16:50:57Z\n---\n\n# Safari 12.1 Release Notes\n\n**Article**\n\nReleased March 25, 2019 — Version 12.1 (14607.1.40)\n\n## Overview\n\nSafari 12.1 ships with iOS 12.2 and macOS 10.14.4. It’s also available for macOS 10.13.6 and 10.12.6.\n\nNew features of Safari 12.1 include:\n\n- **Dark Mode for the Web.** The ability to enable color scheme customizations for websites while in Dark Mode.\n- **Intelligent Tracking Prevention.** New permission requirements for third-party cookies and new limits for long-term tracking.\n\n### General\n\n#### New Features\n\n- Updated the push notification prompt for Safari on macOS to require a user gesture.\n\n#### Resolved Issues\n\n- Updated the behavior of websites saved to the home screen on iOS to pause in the background instead of relaunching each time.\n\n### Authentication and Passwords\n\n#### New Features\n\n- Updated Password AutoFill to sign in automatically to websites after filling in the credentials.\n\n### Security and Privacy\n\n#### New Features\n\n- Added warnings displayed to the user when loading insecure pages in both Safari and in [doc:\/\/com.apple.documentation\/documentation\/SafariServices\/SFSafariViewController].\n- Added Motion & Orientation settings on iOS to enable the [doc:\/\/com.apple.documentation\/documentation\/webkitjs\/devicemotionevent] and [doc:\/\/com.apple.documentation\/documentation\/webkitjs\/deviceorientationevent] events.\n- Removed support for the expired Do Not Track standard to prevent potential use as a fingerprinting variable.\n- Updated the link behavior for `\"target=_blank\"` to include `rel=\"noopener\" implicitly`.\n\n### Intelligent Tracking Prevention\n\n#### New Features\n\n- Removed support for partitioned cookies for domains with cross-site tracking capabilities. The Storage Access API now provides third-party access to cookies.\n- Improved Intelligent Tracking Prevention to limit long-term tracking based on client-side first-party cookies and to verify partitioned cache entries.\n\n### Web API\n\n#### New Features\n\n- Added a `supported-color-schemes` meta tag to indicate a website supports `light` and `dark` color schemes.\n- Added support for the Intersection Observer API, which detects the intersection of visible elements relative to other elements. Elements include the viewport of the top-level document.\n- Added support for the Web Share API to invoke the native share dialog provided by the system.\n- Added support for `<input type=\"color\">`.\n- Added support for the `<datalist>` element.\n\n### Payment Request API\n\n#### New Features\n\n- Added support for granular errors.\n- Added support in Wallet & Apple Pay preferences for using the default contact information for the shipping address, email, and phone. On iOS, set preferences in the Transaction Defaults category in Settings > Wallet & Apple Pay. On Mac, set preferences in System Preferences > Wallet & Apple Pay > Contacts and Shipping.\n- Added support for the default addresses and contacts configured in the Contacts and Shipping in the Wallet system preferences on iOS and macOS.\n- Added support for special fields for Japan including `phoneticName`, [doc:\/\/com.apple.documentation\/documentation\/apple_pay_on_the_web\/applepaypaymentcontact\/2937162-sublocality], and [doc:\/\/com.apple.documentation\/documentation\/apple_pay_on_the_web\/applepaypaymentcontact\/2937163-subadministrativearea].\n\n### CSS and Text\n\n#### New Features\n\n- Added support for the CSS media queries `prefers-color-scheme: light` and `prefers-color-scheme: dark`.\n- Added support for CSS rules to customize text decorations like underlines and dashed underlines.\n- Added support for new `rgb()` color functions from the CSS Color 4 specification.\n\n### Media\n\n#### New Features\n\n- Added support for H.264 simulcast and VP8 in WebRTC to improve support for multi-party video conferencing.\n- Enabled cross-browser Encrypted Media Extensions (EME) by adding APIs without the `webkit` prefix.\n\n### Safari App Extension API\n\n#### New Features\n\n- Added [doc:\/\/com.apple.documentation\/documentation\/SafariServices\/SFSafariApplication\/getAllWindows(completionHandler:)] and [doc:\/\/com.apple.documentation\/documentation\/SafariServices\/SFSafariWindow\/getAllTabs(completionHandler:)] for iterating over all open windows and tabs.\n- Added [doc:\/\/com.apple.documentation\/documentation\/SafariServices\/SFSafariPage\/getContainingTab(completionHandler:)] and [doc:\/\/com.apple.documentation\/documentation\/SafariServices\/SFSafariTab\/getContainingWindow(completionHandler:)] access to the containing tab and window objects.\n- Added a `close` method to [doc:\/\/com.apple.documentation\/documentation\/SafariServices\/SFSafariWindow] and [doc:\/\/com.apple.documentation\/documentation\/SafariServices\/SFSafariTab] for closing windows and tabs.\n- Added [doc:\/\/com.apple.documentation\/documentation\/SafariServices\/SFSafariTab\/navigate(to:)] for changing the URL of a tab.\n- Added [doc:\/\/com.apple.documentation\/documentation\/SafariServices\/SFSafariPage\/getScreenshotOfVisibleArea(completionHandler:)] for taking a screenshot of the visible contents of a page.\n- Added [doc:\/\/com.apple.documentation\/documentation\/SafariServices\/SFSafariToolbarItem\/showPopover()] and [doc:\/\/com.apple.documentation\/documentation\/SafariServices\/SFSafariExtensionViewController\/dismissPopover()] for showing and dismissing extension popovers.\n- Added [doc:\/\/com.apple.documentation\/documentation\/SafariServices\/SFSafariExtension\/getBaseURI(completionHandler:)] for retrieving the base URI in the app extension process.\n- Improved support for navigating backwards and forwards.\n\n### Web Inspector and Tools\n\n#### New Features\n\n- Added support for multiple selection of DOM tree nodes and of entries in the Cookies table.\n- Improved styles editing with multiple selection support.\n- Updated Timelines to include media events.\n\n## Version 12\n\n- **Safari 12 Release Notes**: Released September 17, 2018 — Version 12 (14606.1.36)\n\n",
  "sections" : [
    {
      "content" : "",
      "items" : [
        {
          "description" : "Released September 17, 2018 — Version 12 (14606.1.36)",
          "name" : "Safari 12 Release Notes",
          "url" : "https:\/\/developer.apple.com\/documentation\/Safari-Release-Notes\/safari-12-release-notes"
        }
      ],
      "title" : "Version 12"
    }
  ],
  "source" : "appleJSON",
  "title" : "Safari 12.1 Release Notes",
  "url" : "https:\/\/developer.apple.com\/documentation\/Safari-Release-Notes\/safari-12_1-release-notes"
}