{
  "abstract" : "Released October 3, 2024 — 18.0.1 (20619.1.26.30)",
  "codeExamples" : [

  ],
  "contentHash" : "ea9d037ee53becd172a6b6b9f89cffc9d768dad178b0a1e02c9f396b77f6a200",
  "crawledAt" : "2025-12-02T16:50:38Z",
  "id" : "076E4BED-65EA-4288-945F-419DFC8E41A2",
  "kind" : "article",
  "language" : "swift",
  "overview" : "## Overview\n\nSafari 18.0.1 is available for iOS 18.0.1, iPadOS 18.0.1, visionOS 2.0.1, macOS 15.0.1, macOS Sonoma, and macOS Ventura.\n\n### Networking\n\n#### Resolved Issues\n\n### Web Extensions\n\n#### Resolved Issue",
  "rawMarkdown" : "---\nsource: https:\/\/developer.apple.com\/documentation\/Safari-Release-Notes\/safari-18_0_1-release-notes\ncrawled: 2025-12-02T16:50:38Z\n---\n\n# Safari 18.0.1 Release Notes\n\n**Article**\n\nReleased October 3, 2024 — 18.0.1 (20619.1.26.30)\n\n## Overview\n\nSafari 18.0.1 is available for iOS 18.0.1, iPadOS 18.0.1, visionOS 2.0.1, macOS 15.0.1, macOS Sonoma, and macOS Ventura.\n\n### Networking\n\n#### Resolved Issues\n\n- Fixed `SameSite` default behavior.\n\n### Web Extensions\n\n#### Resolved Issue\n\n- Fixed an issue to restore lost Safari Web Extension data.\n\n## Version 18\n\n- **Safari 18.6 Release Notes**: Released July 29, 2025 — 18.6 (20621.3.11)\n- **Safari 18.5 Release Notes**: Released May 12, 2025 — 18.5 (20621.2.5)\n- **Safari 18.4 Release Notes**: Released March 31, 2025 — 18.4 (20621.1.15)\n- **Safari 18.3 Release Notes**: Released January 27, 2025 — 18.3 (20620.2.4)\n- **Safari 18.2 Release Notes**: Released December 11, 2024 — 18.2 (20620.1.16)\n- **Safari 18.1 Release Notes**: Released October 28, 2024 — 18.1 (20619.2.8)\n- **Safari 18.0 Release Notes**: Released September 16, 2024 — 18.0 (20619.1.26)\n\n",
  "sections" : [
    {
      "content" : "",
      "items" : [
        {
          "description" : "Released July 29, 2025 — 18.6 (20621.3.11)",
          "name" : "Safari 18.6 Release Notes",
          "url" : "https:\/\/developer.apple.com\/documentation\/Safari-Release-Notes\/safari-18_6-release-notes"
        },
        {
          "description" : "Released May 12, 2025 — 18.5 (20621.2.5)",
          "name" : "Safari 18.5 Release Notes",
          "url" : "https:\/\/developer.apple.com\/documentation\/Safari-Release-Notes\/safari-18_5-release-notes"
        },
        {
          "description" : "Released March 31, 2025 — 18.4 (20621.1.15)",
          "name" : "Safari 18.4 Release Notes",
          "url" : "https:\/\/developer.apple.com\/documentation\/Safari-Release-Notes\/safari-18_4-release-notes"
        },
        {
          "description" : "Released January 27, 2025 — 18.3 (20620.2.4)",
          "name" : "Safari 18.3 Release Notes",
          "url" : "https:\/\/developer.apple.com\/documentation\/Safari-Release-Notes\/safari-18_3-release-notes"
        },
        {
          "description" : "Released December 11, 2024 — 18.2 (20620.1.16)",
          "name" : "Safari 18.2 Release Notes",
          "url" : "https:\/\/developer.apple.com\/documentation\/Safari-Release-Notes\/safari-18_2-release-notes"
        },
        {
          "description" : "Released October 28, 2024 — 18.1 (20619.2.8)",
          "name" : "Safari 18.1 Release Notes",
          "url" : "https:\/\/developer.apple.com\/documentation\/Safari-Release-Notes\/safari-18_1-release-notes"
        },
        {
          "description" : "Released September 16, 2024 — 18.0 (20619.1.26)",
          "name" : "Safari 18.0 Release Notes",
          "url" : "https:\/\/developer.apple.com\/documentation\/Safari-Release-Notes\/safari-18-release-notes"
        }
      ],
      "title" : "Version 18"
    }
  ],
  "source" : "appleJSON",
  "title" : "Safari 18.0.1 Release Notes",
  "url" : "https:\/\/developer.apple.com\/documentation\/Safari-Release-Notes\/safari-18_0_1-release-notes"
}