{
  "abstract" : "A key that specifies whether the device is a game controller synthetic HID device.",
  "codeExamples" : [
    {
      "code" : "IOHIDManagerRef manager = IOHIDManagerCreate(kCFAllocatorDefault, kIOHIDManagerOptionNone);\nIOHIDManagerSetDeviceMatching(manager, (__bridge CFDictionaryRef)@{\n    @kIOProviderClassKey: @kIOHIDDeviceKey,\n    @kIOHIDGCSyntheticDeviceKey: @(NO)\n});",
      "language" : "objc"
    },
    {
      "code" : "if ( IOHIDDeviceGetProperty(device, CFSTR(kIOHIDGCSyntheticDeviceKey)) == kCFBooleanTrue ) {\n    \/\/ This is a synthetic HID device.\n}",
      "language" : "objc"
    }
  ],
  "contentHash" : "42be77e3df4bc8dcca7185e28509d500c8c326350c14b770f1e64510a076a7fd",
  "crawledAt" : "2025-12-03T04:53:17Z",
  "declaration" : {
    "code" : "var kIOHIDGCSyntheticDeviceKey: String { get }",
    "language" : "swift"
  },
  "id" : "6D2D3258-3104-4FC4-B5FF-892A45F2CD58",
  "kind" : "unknown",
  "language" : "swift",
  "module" : "Game Controller",
  "overview" : "## Discussion\n\nThis key is present with a Boolean value of `true` on all game controller synthetic HID devices that the Game Controller framework creates.\n\nIf your app needs to exclude these synthetic HID devices from discovery by [doc:\/\/com.apple.documentation\/documentation\/iokit\/iohidmanagerref], [doc:\/\/com.apple.documentation\/documentation\/iokit\/1514494-ioservicegetmatchingservices], or [doc:\/\/com.apple.documentation\/documentation\/iokit\/1514362-ioserviceaddmatchingnotification], include the [doc:\/\/com.apple.gamecontroller\/documentation\/GameController\/kIOHIDGCSyntheticDeviceKey] with a value of `false` in the matching criteria.\n\nYour code can check whether an [doc:\/\/com.apple.documentation\/documentation\/iokit\/io_service_t] or an [doc:\/\/com.apple.documentation\/documentation\/iokit\/iohiddeviceref] refers to a game controller synthetic HID device by querying the value of the [doc:\/\/com.apple.gamecontroller\/documentation\/GameController\/kIOHIDGCSyntheticDeviceKey] property.",
  "platforms" : [
    "iOS",
    "iPadOS",
    "Mac Catalyst",
    "macOS",
    "tvOS",
    "visionOS"
  ],
  "rawMarkdown" : "---\nsource: https:\/\/developer.apple.com\/documentation\/GameController\/kIOHIDGCSyntheticDeviceKey\ncrawled: 2025-12-03T04:53:17Z\n---\n\n# kIOHIDGCSyntheticDeviceKey\n\n**Global Variable**\n\nA key that specifies whether the device is a game controller synthetic HID device.\n\n## Declaration\n\n```swift\nvar kIOHIDGCSyntheticDeviceKey: String { get }\n```\n\n## Discussion\n\nThis key is present with a Boolean value of `true` on all game controller synthetic HID devices that the Game Controller framework creates.\n\nIf your app needs to exclude these synthetic HID devices from discovery by [doc:\/\/com.apple.documentation\/documentation\/iokit\/iohidmanagerref], [doc:\/\/com.apple.documentation\/documentation\/iokit\/1514494-ioservicegetmatchingservices], or [doc:\/\/com.apple.documentation\/documentation\/iokit\/1514362-ioserviceaddmatchingnotification], include the [doc:\/\/com.apple.gamecontroller\/documentation\/GameController\/kIOHIDGCSyntheticDeviceKey] with a value of `false` in the matching criteria.\n\n```objc\nIOHIDManagerRef manager = IOHIDManagerCreate(kCFAllocatorDefault, kIOHIDManagerOptionNone);\nIOHIDManagerSetDeviceMatching(manager, (__bridge CFDictionaryRef)@{\n    @kIOProviderClassKey: @kIOHIDDeviceKey,\n    @kIOHIDGCSyntheticDeviceKey: @(NO)\n});\n```\n\nYour code can check whether an [doc:\/\/com.apple.documentation\/documentation\/iokit\/io_service_t] or an [doc:\/\/com.apple.documentation\/documentation\/iokit\/iohiddeviceref] refers to a game controller synthetic HID device by querying the value of the [doc:\/\/com.apple.gamecontroller\/documentation\/GameController\/kIOHIDGCSyntheticDeviceKey] property.\n\n```objc\nif ( IOHIDDeviceGetProperty(device, CFSTR(kIOHIDGCSyntheticDeviceKey)) == kCFBooleanTrue ) {\n    \/\/ This is a synthetic HID device.\n}\n```\n\n## Game Controller framework migration from IOKit\n\n- **Understanding game controller backward compatibility**: Learn how macOS brings support for the latest game controllers to software that predates the introduction of the Game Controller framework.\n\n",
  "sections" : [
    {
      "content" : "",
      "items" : [
        {
          "description" : "Learn how macOS brings support for the latest game controllers to software that predates the introduction of the Game Controller framework.",
          "name" : "Understanding game controller backward compatibility",
          "url" : "https:\/\/developer.apple.com\/documentation\/GameController\/understanding-game-controller-backward-compatibility"
        }
      ],
      "title" : "Game Controller framework migration from IOKit"
    }
  ],
  "source" : "appleJSON",
  "title" : "kIOHIDGCSyntheticDeviceKey",
  "url" : "https:\/\/developer.apple.com\/documentation\/GameController\/kIOHIDGCSyntheticDeviceKey"
}