{
  "abstract" : "A message that posts after a racing wheel accessory connects to the device.",
  "codeExamples" : [
    {
      "code" : "let observation = NotificationCenter.default.addObserver(of: GCRacingWheel.self, for: .didConnect) { message in\n   let racingWheel = message.racingWheel\n}"
    }
  ],
  "conformsTo" : [
    "NotificationCenter.MainActorMessage",
    "SendableMetatype"
  ],
  "contentHash" : "b2d67826bca7e780a4a5c80fe7c6be5a35cab93b796faf9d51286714677b9c37",
  "crawledAt" : "2025-12-04T11:27:06Z",
  "declaration" : {
    "code" : "struct DidConnectMessage",
    "language" : "swift"
  },
  "id" : "6C7D57F8-1663-40F1-AA96-4CA8D55285F0",
  "kind" : "struct",
  "language" : "swift",
  "module" : "Game Controller",
  "overview" : "## Overview\n\nUse the `.didConnect` identifier with `NotificationCenter` to listen for this message.\n\nConnections of controller accessories will be reflected in the `controllers` array of the `GCController` class when the message posts.",
  "platforms" : [
    "Mac Catalyst",
    "macOS"
  ],
  "rawMarkdown" : "---\nsource: https:\/\/developer.apple.com\/documentation\/gamecontroller\/gcracingwheel\/didconnectmessage\ncrawled: 2025-12-04T11:27:06Z\n---\n\n# GCRacingWheel.DidConnectMessage\n\n**Structure**\n\nA message that posts after a racing wheel accessory connects to the device.\n\n## Declaration\n\n```swift\nstruct DidConnectMessage\n```\n\n## Overview\n\nUse the `.didConnect` identifier with `NotificationCenter` to listen for this message.\n\n```\nlet observation = NotificationCenter.default.addObserver(of: GCRacingWheel.self, for: .didConnect) { message in\n   let racingWheel = message.racingWheel\n}\n```\n\nConnections of controller accessories will be reflected in the `controllers` array of the `GCController` class when the message posts.\n\n## Initializers\n\n- **init(racingWheel:)**\n\n## Instance Properties\n\n- **racingWheel**: The racing wheel object that connected to the device.\n\n## Conforms To\n\n- NotificationCenter.MainActorMessage\n- SendableMetatype\n\n",
  "sections" : [
    {
      "content" : "",
      "items" : [
        {
          "description" : "",
          "name" : "init(racingWheel:)",
          "url" : "https:\/\/developer.apple.com\/documentation\/GameController\/GCRacingWheel\/DidConnectMessage\/init(racingWheel:)"
        }
      ],
      "title" : "Initializers"
    },
    {
      "content" : "",
      "items" : [
        {
          "description" : "The racing wheel object that connected to the device.",
          "name" : "racingWheel",
          "url" : "https:\/\/developer.apple.com\/documentation\/GameController\/GCRacingWheel\/DidConnectMessage\/racingWheel"
        }
      ],
      "title" : "Instance Properties"
    }
  ],
  "source" : "appleJSON",
  "title" : "GCRacingWheel.DidConnectMessage",
  "url" : "https:\/\/developer.apple.com\/documentation\/gamecontroller\/gcracingwheel\/didconnectmessage"
}