{
  "abstract" : "Provide uniform type identifiers that describe file types for storage or transfer.",
  "codeExamples" : [

  ],
  "contentHash" : "6da4da047cf684893d4650163c2105c17c3eaf582002d95aee624eaca3570094",
  "crawledAt" : "2025-12-09T22:13:40Z",
  "id" : "F27313A8-F6DA-4FB1-91DF-B79E33C2F0A2",
  "kind" : "framework",
  "language" : "swift",
  "module" : "Uniform Type Identifiers",
  "overview" : "## Overview\n\nThe [doc:\/\/com.apple.uniformtypeidentifiers\/documentation\/UniformTypeIdentifiers] framework provides a collection of common types that map to MIME and file types. Use these types in your project to describe the file types in your app. These descriptions help the system properly handle file storage formats or in-memory data for transfer — for example, transferring data to or from the pasteboard. The identifier types can also identify other resources, such as directories, volumes, or packages.\n\nExplicitly specify relationships between types by marking them as subtypes of other types. For example, the type [doc:\/\/com.apple.uniformtypeidentifiers\/documentation\/UniformTypeIdentifiers\/UTTypePNG] has the identifier `public.png` and is a subtype of [doc:\/\/com.apple.uniformtypeidentifiers\/documentation\/UniformTypeIdentifiers\/UTTypeImage] (`public.image`). [doc:\/\/com.apple.uniformtypeidentifiers\/documentation\/UniformTypeIdentifiers\/UTTypeImage] is in turn a subtype of both of the following:",
  "rawMarkdown" : "---\nsource: https:\/\/developer.apple.com\/documentation\/uniformtypeidentifiers\ncrawled: 2025-12-09T22:13:40Z\n---\n\n# Uniform Type Identifiers\n\n**Framework**\n\nProvide uniform type identifiers that describe file types for storage or transfer.\n\n## Overview\n\nThe [doc:\/\/com.apple.uniformtypeidentifiers\/documentation\/UniformTypeIdentifiers] framework provides a collection of common types that map to MIME and file types. Use these types in your project to describe the file types in your app. These descriptions help the system properly handle file storage formats or in-memory data for transfer — for example, transferring data to or from the pasteboard. The identifier types can also identify other resources, such as directories, volumes, or packages.\n\nExplicitly specify relationships between types by marking them as subtypes of other types. For example, the type [doc:\/\/com.apple.uniformtypeidentifiers\/documentation\/UniformTypeIdentifiers\/UTTypePNG] has the identifier `public.png` and is a subtype of [doc:\/\/com.apple.uniformtypeidentifiers\/documentation\/UniformTypeIdentifiers\/UTTypeImage] (`public.image`). [doc:\/\/com.apple.uniformtypeidentifiers\/documentation\/UniformTypeIdentifiers\/UTTypeImage] is in turn a subtype of both of the following:\n\n- [doc:\/\/com.apple.uniformtypeidentifiers\/documentation\/UniformTypeIdentifiers\/UTTypeContent] (`public.content`), which implies the type can be a document\n- [doc:\/\/com.apple.uniformtypeidentifiers\/documentation\/UniformTypeIdentifiers\/UTTypeData] (`public.data`), which implies the type is representable as a byte stream\n\n\n\n## Essentials\n\n- **Defining file and data types for your app**: Declare uniform type identifiers to support your app’s proprietary data formats.\n- **System-declared uniform type identifiers**: Common types that the system declares.\n\n## Uniform type identifiers\n\n- **UTType**: A structure that represents a type of data to load, send, or receive.\n- **UTTagClass**: A type that represents tag classes.\n- **UTTypeReference**: An object that represents a type of data to load, send, or receive.\n\n## Reference\n\n- **UniformTypeIdentifiers Constants**\n\n",
  "sections" : [
    {
      "content" : "",
      "items" : [
        {
          "description" : "Declare uniform type identifiers to support your app’s proprietary data formats.",
          "name" : "Defining file and data types for your app",
          "url" : "https:\/\/developer.apple.com\/documentation\/UniformTypeIdentifiers\/defining-file-and-data-types-for-your-app"
        },
        {
          "description" : "Common types that the system declares.",
          "name" : "System-declared uniform type identifiers",
          "url" : "https:\/\/developer.apple.com\/documentation\/UniformTypeIdentifiers\/system-declared-uniform-type-identifiers"
        }
      ],
      "title" : "Essentials"
    },
    {
      "content" : "",
      "items" : [
        {
          "description" : "A structure that represents a type of data to load, send, or receive.",
          "name" : "UTType",
          "url" : "https:\/\/developer.apple.com\/documentation\/UniformTypeIdentifiers\/UTType-swift.struct"
        },
        {
          "description" : "A type that represents tag classes.",
          "name" : "UTTagClass",
          "url" : "https:\/\/developer.apple.com\/documentation\/UniformTypeIdentifiers\/UTTagClass"
        },
        {
          "description" : "An object that represents a type of data to load, send, or receive.",
          "name" : "UTTypeReference",
          "url" : "https:\/\/developer.apple.com\/documentation\/UniformTypeIdentifiers\/UTTypeReference"
        }
      ],
      "title" : "Uniform type identifiers"
    },
    {
      "content" : "",
      "items" : [
        {
          "description" : "",
          "name" : "UniformTypeIdentifiers Constants",
          "url" : "https:\/\/developer.apple.com\/documentation\/UniformTypeIdentifiers\/uniformtypeidentifiers-constants"
        }
      ],
      "title" : "Reference"
    }
  ],
  "source" : "appleJSON",
  "title" : "Uniform Type Identifiers",
  "url" : "https:\/\/developer.apple.com\/documentation\/uniformtypeidentifiers"
}