{
  "abstract" : "Reveal your app’s shortcuts inside the Health app.",
  "codeExamples" : [

  ],
  "contentHash" : "6b8b163a32e6565524bbb4bb8c004c2320c77d2bb0e4c29906a94bfef4ebc1bd",
  "crawledAt" : "2025-12-05T18:08:17Z",
  "id" : "B28B2C5A-4B40-4FCE-9B9F-9C62034D8B86",
  "kind" : "unknown",
  "language" : "swift",
  "module" : "Intents",
  "overview" : "## Overview\n\n### Configure the Sample Code Project\n\nBefore you run the sample, select a Team account under the Signing section in the project editor for the targets `Bedtime` and `BedtimeIntents` in Xcode.\n\nOnce you run the sample project for the first time, shortcuts from the sample are visible in the Health app when you set up Sleep.",
  "rawMarkdown" : "---\nsource: https:\/\/developer.apple.com\/documentation\/sirikit\/adding-shortcuts-for-wind-down\ncrawled: 2025-12-05T18:08:17Z\n---\n\n# Adding Shortcuts for Wind Down\n\n**Sample Code**\n\nReveal your app’s shortcuts inside the Health app.\n\n## Overview\n\n\n\n### Configure the Sample Code Project\n\nBefore you run the sample, select a Team account under the Signing section in the project editor for the targets `Bedtime` and `BedtimeIntents` in Xcode.\n\nOnce you run the sample project for the first time, shortcuts from the sample are visible in the Health app when you set up Sleep.\n\n## Sample code\n\n- **Booking Rides with SiriKit**: Add Intents extensions to your app to handle requests to book rides using Siri and Maps.\n- **Handling Payment Requests with SiriKit**: Add an Intent Extension to your app to handle money transfer requests with Siri.\n- **Handling Workout Requests with SiriKit**: Add an Intent Extension to your app that handles requests to control workouts with Siri.\n- **Integrating Your App with Siri Event Suggestions**: Donate reservations and provide quick access to event details throughout the system.\n- **Managing Audio with SiriKit**: Control audio playback and handle requests to add media using SiriKit Media Intents.\n- **Providing Hands-Free App Control with Intents**: Resolve, confirm, and handle intents without an extension.\n- **Soup Chef: Accelerating App Interactions with Shortcuts**: Make it easy for people to use Siri with your app by providing shortcuts to your app’s actions.\n- **Soup Chef with App Intents: Migrating custom intents**: Integrating App Intents to provide your appʼs actions to Siri and Shortcuts.\n\n",
  "sections" : [
    {
      "content" : "",
      "items" : [
        {
          "description" : "Add Intents extensions to your app to handle requests to book rides using Siri and Maps.",
          "name" : "Booking Rides with SiriKit",
          "url" : "https:\/\/developer.apple.com\/documentation\/SiriKit\/booking-rides-with-sirikit"
        },
        {
          "description" : "Add an Intent Extension to your app to handle money transfer requests with Siri.",
          "name" : "Handling Payment Requests with SiriKit",
          "url" : "https:\/\/developer.apple.com\/documentation\/SiriKit\/handling-payment-requests-with-sirikit"
        },
        {
          "description" : "Add an Intent Extension to your app that handles requests to control workouts with Siri.",
          "name" : "Handling Workout Requests with SiriKit",
          "url" : "https:\/\/developer.apple.com\/documentation\/SiriKit\/handling-workout-requests-with-sirikit"
        },
        {
          "description" : "Donate reservations and provide quick access to event details throughout the system.",
          "name" : "Integrating Your App with Siri Event Suggestions",
          "url" : "https:\/\/developer.apple.com\/documentation\/SiriKit\/integrating-your-app-with-siri-event-suggestions"
        },
        {
          "description" : "Control audio playback and handle requests to add media using SiriKit Media Intents.",
          "name" : "Managing Audio with SiriKit",
          "url" : "https:\/\/developer.apple.com\/documentation\/SiriKit\/managing-audio-with-sirikit"
        },
        {
          "description" : "Resolve, confirm, and handle intents without an extension.",
          "name" : "Providing Hands-Free App Control with Intents",
          "url" : "https:\/\/developer.apple.com\/documentation\/SiriKit\/providing-hands-free-app-control-with-intents"
        },
        {
          "description" : "Make it easy for people to use Siri with your app by providing shortcuts to your app’s actions.",
          "name" : "Soup Chef: Accelerating App Interactions with Shortcuts",
          "url" : "https:\/\/developer.apple.com\/documentation\/SiriKit\/soup-chef-accelerating-app-interactions-with-shortcuts"
        },
        {
          "description" : "Integrating App Intents to provide your appʼs actions to Siri and Shortcuts.",
          "name" : "Soup Chef with App Intents: Migrating custom intents",
          "url" : "https:\/\/developer.apple.com\/documentation\/SiriKit\/soup-chef-with-app-intents-migrating-custom-intents"
        }
      ],
      "title" : "Sample code"
    }
  ],
  "source" : "appleJSON",
  "title" : "Adding Shortcuts for Wind Down",
  "url" : "https:\/\/developer.apple.com\/documentation\/sirikit\/adding-shortcuts-for-wind-down"
}