{
  "abstract" : "Build, create, and design 3D content for your RealityKit apps.",
  "codeExamples" : [

  ],
  "contentHash" : "5f6e50c637f80c1d63fbd26f1385555c79f73b6264dc0d5bfa0dc1e9b2a26a08",
  "crawledAt" : "2025-12-02T16:04:10Z",
  "id" : "C1BF96F4-F2D7-4548-AFFC-BB4148CFDA68",
  "kind" : "collection",
  "language" : "swift",
  "overview" : "## Overview\n\nReality Composer Pro provides a collection of tools and editors you can use to build interactive 3D content for your RealityKit apps. With Reality Composer Pro, you can create complex scenes composed of multiple assets — including audio files, 3D models, particle effects, lighting, and animations.\n\n\n\nReality Composer Pro also includes multiple editors to help you import and manage assets in your project, design complex materials with Shader Graph, create animations, and optimize the performance of your content.",
  "rawMarkdown" : "---\nsource: https:\/\/developer.apple.com\/documentation\/RealityComposerPro\ncrawled: 2025-12-02T16:04:10Z\n---\n\n# Reality Composer Pro\n\nBuild, create, and design 3D content for your RealityKit apps.\n\n## Overview\n\nReality Composer Pro provides a collection of tools and editors you can use to build interactive 3D content for your RealityKit apps. With Reality Composer Pro, you can create complex scenes composed of multiple assets — including audio files, 3D models, particle effects, lighting, and animations.\n\n\n\nReality Composer Pro also includes multiple editors to help you import and manage assets in your project, design complex materials with Shader Graph, create animations, and optimize the performance of your content.\n\n## Essentials\n\n- **Creating a Reality Composer Pro package in your app**: Discover how to add a new or existing Reality Composer Pro project as a package to your app in Xcode.\n- **Configuring the Reality Composer Pro project window**: Change the appearance of the Reality Composer Pro project window by showing and hiding views, and learn to navigate your content.\n- **Adding assets to your Reality Composer Pro scene**: Import assets to design Reality Composer Pro scenes for your app.\n- **Building and running Reality Composer Pro scenes in your app**: Preview scenes on your visionOS device and learn how to load them in your app.\n\n## Editors\n\n- **Importing and organizing content in your project**: Manage content in your Reality Composer Pro project with the Project Browser.\n- **Designing materials with Shader Graph**: Create realistic materials with Shader Graph’s node editor in Reality Composer Pro.\n\n## Materials\n\n- **Building materials**: Design and create materials for your 3D assets in Reality Composer Pro.\n\n",
  "sections" : [
    {
      "content" : "",
      "items" : [
        {
          "description" : "Discover how to add a new or existing Reality Composer Pro project as a package to your app in Xcode.",
          "name" : "Creating a Reality Composer Pro package in your app",
          "url" : "https:\/\/developer.apple.com\/documentation\/RealityComposerPro\/Creating-a-Reality-Composer-Pro-package-in-your-app"
        },
        {
          "description" : "Change the appearance of the Reality Composer Pro project window by showing and hiding views, and learn to navigate your content.",
          "name" : "Configuring the Reality Composer Pro project window",
          "url" : "https:\/\/developer.apple.com\/documentation\/RealityComposerPro\/Configure-the-Reality-Composer-Pro-project-window"
        },
        {
          "description" : "Import assets to design Reality Composer Pro scenes for your app.",
          "name" : "Adding assets to your Reality Composer Pro scene",
          "url" : "https:\/\/developer.apple.com\/documentation\/RealityComposerPro\/Adding-assets-into-your-Reality-Composer-Pro-scene"
        },
        {
          "description" : "Preview scenes on your visionOS device and learn how to load them in your app.",
          "name" : "Building and running Reality Composer Pro scenes in your app",
          "url" : "https:\/\/developer.apple.com\/documentation\/RealityComposerPro\/Build-and-run-Reality-Composer-Pro-scenes-in-your-app"
        }
      ],
      "title" : "Essentials"
    },
    {
      "content" : "",
      "items" : [
        {
          "description" : "Manage content in your Reality Composer Pro project with the Project Browser.",
          "name" : "Importing and organizing content in your project",
          "url" : "https:\/\/developer.apple.com\/documentation\/RealityComposerPro\/Editor_ProjectBrowser"
        },
        {
          "description" : "Create realistic materials with Shader Graph’s node editor in Reality Composer Pro.",
          "name" : "Designing materials with Shader Graph",
          "url" : "https:\/\/developer.apple.com\/documentation\/RealityComposerPro\/Editor_ShaderGraph"
        }
      ],
      "title" : "Editors"
    },
    {
      "content" : "",
      "items" : [
        {
          "description" : "Design and create materials for your 3D assets in Reality Composer Pro.",
          "name" : "Building materials",
          "url" : "https:\/\/developer.apple.com\/documentation\/RealityComposerPro\/Building-Materials"
        }
      ],
      "title" : "Materials"
    }
  ],
  "source" : "appleJSON",
  "title" : "Reality Composer Pro",
  "url" : "https:\/\/developer.apple.com\/documentation\/RealityComposerPro"
}