{
  "abstract" : "Sent to the delegate when it is the local player’s turn to act in a turn-based match.",
  "codeExamples" : [

  ],
  "contentHash" : "9c6c2285aa1b9481f35c07335b80ccc56d86d4d08650a134ecbbc5763faf100f",
  "crawledAt" : "2025-12-05T18:14:09Z",
  "declaration" : {
    "code" : "optional func handleTurnEvent(for match: GKTurnBasedMatch)",
    "language" : "swift"
  },
  "id" : "8E1E2D35-ED72-4CDA-8B49-56041D79DC6B",
  "kind" : "method",
  "language" : "swift",
  "module" : "GameKit",
  "overview" : "## Discussion\n\nWhen your delegate receives this message, the player has accepted a push notification for a match already in progress. Your game should end whatever task it was performing and switch to the match information provided by the match object.",
  "platforms" : [
    "visionOS",
    "watchOS"
  ],
  "rawMarkdown" : "---\nsource: https:\/\/developer.apple.com\/documentation\/GameKit\/GKTurnBasedEventHandlerDelegate\/handleTurnEvent(for:)\ncrawled: 2025-12-05T18:14:09Z\n---\n\n# handleTurnEvent(for:)\n\n**Instance Method**\n\nSent to the delegate when it is the local player’s turn to act in a turn-based match.\n\n## Declaration\n\n```swift\noptional func handleTurnEvent(for match: GKTurnBasedMatch)\n```\n\n## Parameters\n\n- **match**: A match object containing the current state of the match.\n\n## Discussion\n\nWhen your delegate receives this message, the player has accepted a push notification for a match already in progress. Your game should end whatever task it was performing and switch to the match information provided by the match object.\n\n## Receiving Turn-based Events\n\n- **handleInvite(fromGameCenter:)**: Sent to the delegate when the local player receives an invitation to join a new turn-based match.\n- **handleTurnEvent(for:didBecomeActive:)**: Sent to the delegate when it is the local player’s turn to act in a turn-based match.\n- **handleMatchEnded(_:)**: Sent to the delegate when a match the local player is participating in has ended.\n\n",
  "sections" : [
    {
      "content" : "",
      "items" : [
        {
          "description" : "Sent to the delegate when the local player receives an invitation to join a new turn-based match.",
          "name" : "handleInvite(fromGameCenter:)",
          "url" : "https:\/\/developer.apple.com\/documentation\/GameKit\/GKTurnBasedEventHandlerDelegate\/handleInvite(fromGameCenter:)"
        },
        {
          "description" : "Sent to the delegate when it is the local player’s turn to act in a turn-based match.",
          "name" : "handleTurnEvent(for:didBecomeActive:)",
          "url" : "https:\/\/developer.apple.com\/documentation\/GameKit\/GKTurnBasedEventHandlerDelegate\/handleTurnEvent(for:didBecomeActive:)"
        },
        {
          "description" : "Sent to the delegate when a match the local player is participating in has ended.",
          "name" : "handleMatchEnded(_:)",
          "url" : "https:\/\/developer.apple.com\/documentation\/GameKit\/GKTurnBasedEventHandlerDelegate\/handleMatchEnded(_:)"
        }
      ],
      "title" : "Receiving Turn-based Events"
    }
  ],
  "source" : "appleJSON",
  "title" : "handleTurnEvent(for:)",
  "url" : "https:\/\/developer.apple.com\/documentation\/GameKit\/GKTurnBasedEventHandlerDelegate\/handleTurnEvent(for:)"
}