{
  "abstract" : "Replaces duplicate saved games that use the same filename with one file containing the specified game data.",
  "codeExamples" : [

  ],
  "contentHash" : "4e98eb3ef751316ca8eac5da0c0375b236dd6cfd1d61ef81ea77e115b8cb5464",
  "crawledAt" : "2025-12-02T14:09:38Z",
  "declaration" : {
    "code" : "func resolveConflictingSavedGames(_ conflictingSavedGames: [GKSavedGame], with data: Data, completionHandler handler: (([GKSavedGame]?, (any Error)?) -> Void)? = nil)",
    "language" : "swift"
  },
  "id" : "F86BB657-926B-4B44-89F2-4B65695D88C2",
  "kind" : "method",
  "module" : "GameKit",
  "overview" : "## Discussion\n\nImplement the [doc:\/\/com.apple.gamekit\/documentation\/GameKit\/GKSavedGameListener\/player(_:hasConflictingSavedGames:)] protocol method to choose the correct game data when there’s a conflict. Then call this method separately for each set of saved games that contain file conflicts. For example, if multiple saved games use the `savedgame1` and `savedgame2` filenames, call this method once for the saved games that use the `savedgame1` filename, and once for the saved games that use the `savedgame2` filename.",
  "platforms" : [
    "iOS",
    "iPadOS",
    "Mac Catalyst",
    "macOS",
    "visionOS"
  ],
  "rawMarkdown" : "---\nsource: https:\/\/developer.apple.com\/documentation\/GameKit\/GKLocalPlayer\/resolveConflictingSavedGames(_:with:completionHandler:)\ncrawled: 2025-12-02T14:09:38Z\n---\n\n# resolveConflictingSavedGames(_:with:completionHandler:)\n\n**Instance Method**\n\nReplaces duplicate saved games that use the same filename with one file containing the specified game data.\n\n## Declaration\n\n```swift\nfunc resolveConflictingSavedGames(_ conflictingSavedGames: [GKSavedGame], with data: Data, completionHandler handler: (([GKSavedGame]?, (any Error)?) -> Void)? = nil)\n```\n\n```swift\nfunc resolveConflictingSavedGames(_ conflictingSavedGames: [GKSavedGame], with data: Data) async throws -> [GKSavedGame]\n```\n\n## Parameters\n\n- **conflictingSavedGames**: The saved games that contain the conflicts.\n- **data**: The correct game data to save.\n- **handler**: The block that this method calls when it completes the request.\n\nThe block receives the following parameters:\n\n\n\nFor example, if there are five saved game files with the same filename, but only three are in `conflictingSavedGames`, this parameter contains the three saved games you provide and the two saved games GameKit finds.\n\n\n\n## Discussion\n\nImplement the [doc:\/\/com.apple.gamekit\/documentation\/GameKit\/GKSavedGameListener\/player(_:hasConflictingSavedGames:)] protocol method to choose the correct game data when there’s a conflict. Then call this method separately for each set of saved games that contain file conflicts. For example, if multiple saved games use the `savedgame1` and `savedgame2` filenames, call this method once for the saved games that use the `savedgame1` filename, and once for the saved games that use the `savedgame2` filename.\n\n## Saving Game Data\n\n- **Saving the player’s game data to an iCloud account**: Save game data during play or after a game in the player’s iCloud account that’s accessible from any device.\n- **saveGameData(_:withName:completionHandler:)**: Saves game data with the specified name.\n- **fetchSavedGames(completionHandler:)**: Retrieves all available saved games.\n- **deleteSavedGames(withName:completionHandler:)**: Deletes saved games with the specified filename.\n- **GKSavedGame**: An object that represents a file containing saved game data.\n- **GKSavedGameListener**: A protocol that handles events related to saving game data.\n\n",
  "sections" : [
    {
      "content" : "",
      "items" : [
        {
          "description" : "Save game data during play or after a game in the player’s iCloud account that’s accessible from any device.",
          "name" : "Saving the player’s game data to an iCloud account",
          "url" : "https:\/\/developer.apple.com\/documentation\/GameKit\/saving-the-player-s-game-data-to-an-icloud-account"
        },
        {
          "description" : "Saves game data with the specified name.",
          "name" : "saveGameData(_:withName:completionHandler:)",
          "url" : "https:\/\/developer.apple.com\/documentation\/GameKit\/GKLocalPlayer\/saveGameData(_:withName:completionHandler:)"
        },
        {
          "description" : "Retrieves all available saved games.",
          "name" : "fetchSavedGames(completionHandler:)",
          "url" : "https:\/\/developer.apple.com\/documentation\/GameKit\/GKLocalPlayer\/fetchSavedGames(completionHandler:)"
        },
        {
          "description" : "Deletes saved games with the specified filename.",
          "name" : "deleteSavedGames(withName:completionHandler:)",
          "url" : "https:\/\/developer.apple.com\/documentation\/GameKit\/GKLocalPlayer\/deleteSavedGames(withName:completionHandler:)"
        },
        {
          "description" : "An object that represents a file containing saved game data.",
          "name" : "GKSavedGame",
          "url" : "https:\/\/developer.apple.com\/documentation\/GameKit\/GKSavedGame"
        },
        {
          "description" : "A protocol that handles events related to saving game data.",
          "name" : "GKSavedGameListener",
          "url" : "https:\/\/developer.apple.com\/documentation\/GameKit\/GKSavedGameListener"
        }
      ],
      "title" : "Saving Game Data"
    }
  ],
  "source" : "appleJSON",
  "title" : "resolveConflictingSavedGames(_:with:completionHandler:)",
  "url" : "https:\/\/developer.apple.com\/documentation\/GameKit\/GKLocalPlayer\/resolveConflictingSavedGames(_:with:completionHandler:)"
}