{
  "abstract" : "A common image that you can display when the player hasn’t completed the achievement.",
  "codeExamples" : [

  ],
  "contentHash" : "413cd98937e57a502f6e4440e1f90a7f562829460d72d7cc7aabbb476c42dac2",
  "crawledAt" : "2025-12-04T10:38:19Z",
  "declaration" : {
    "code" : "class func incompleteAchievementImage() -> UIImage",
    "language" : "swift"
  },
  "id" : "7B01B055-A04F-44F2-AEAA-4421D493DC6B",
  "kind" : "method",
  "language" : "swift",
  "module" : "GameKit",
  "overview" : "## Return Value\n\nA common image that represents an incomplete achievement.\n\n## Discussion\n\nIn macOS versions earlier than macOS 11, this class method returns an [doc:\/\/com.apple.documentation\/documentation\/AppKit\/NSImage] object but otherwise works the same as in iOS, Mac Catalyst, and tvOS.\n\nStarting with iOS 14, macOS 11, and tvOS 14, this method returns a symbol image. To match your game’s appearance, make adjustments to the symbol image as described in [doc:\/\/com.apple.documentation\/documentation\/UIKit\/configuring-and-displaying-symbol-images-in-your-ui].",
  "platforms" : [
    "iOS",
    "iPadOS",
    "Mac Catalyst",
    "tvOS",
    "visionOS"
  ],
  "rawMarkdown" : "---\nsource: https:\/\/developer.apple.com\/documentation\/GameKit\/GKAchievementDescription\/incompleteAchievementImage()\ncrawled: 2025-12-04T10:38:19Z\n---\n\n# incompleteAchievementImage()\n\n**Type Method**\n\nA common image that you can display when the player hasn’t completed the achievement.\n\n## Declaration\n\n```swift\nclass func incompleteAchievementImage() -> UIImage\n```\n\n```swift\nclass func incompleteAchievementImage() -> NSImage\n```\n\n## Return Value\n\nA common image that represents an incomplete achievement.\n\n## Discussion\n\nIn macOS versions earlier than macOS 11, this class method returns an [doc:\/\/com.apple.documentation\/documentation\/AppKit\/NSImage] object but otherwise works the same as in iOS, Mac Catalyst, and tvOS.\n\nStarting with iOS 14, macOS 11, and tvOS 14, this method returns a symbol image. To match your game’s appearance, make adjustments to the symbol image as described in [doc:\/\/com.apple.documentation\/documentation\/UIKit\/configuring-and-displaying-symbol-images-in-your-ui].\n\n## Working with Achievement Images\n\n- **placeholderCompletedAchievementImage()**: A placeholder image that you can display when the player completes the achievement.\n- **loadImage(completionHandler:)**: Loads the image to display when the player completes the achievement.\n\n",
  "sections" : [
    {
      "content" : "",
      "items" : [
        {
          "description" : "A placeholder image that you can display when the player completes the achievement.",
          "name" : "placeholderCompletedAchievementImage()",
          "url" : "https:\/\/developer.apple.com\/documentation\/GameKit\/GKAchievementDescription\/placeholderCompletedAchievementImage()"
        },
        {
          "description" : "Loads the image to display when the player completes the achievement.",
          "name" : "loadImage(completionHandler:)",
          "url" : "https:\/\/developer.apple.com\/documentation\/GameKit\/GKAchievementDescription\/loadImage(completionHandler:)"
        }
      ],
      "title" : "Working with Achievement Images"
    }
  ],
  "source" : "appleJSON",
  "title" : "incompleteAchievementImage()",
  "url" : "https:\/\/developer.apple.com\/documentation\/GameKit\/GKAchievementDescription\/incompleteAchievementImage()"
}