{
  "abstract" : "An `GKAchievementViewController` object provides a standard user interface to display achievement progress for the local player. If the [doc:\/\/com.apple.gamekit\/documentation\/GameKit\/GKGameCenterViewController] class is available, you should use it instead.",
  "codeExamples" : [

  ],
  "conformsTo" : [
    "CVarArg",
    "CustomDebugStringConvertible",
    "CustomStringConvertible",
    "Equatable",
    "GKViewController",
    "Hashable",
    "NSCoding",
    "NSEditor",
    "NSExtensionRequestHandling",
    "NSObjectProtocol",
    "NSSeguePerforming",
    "NSStandardKeyBindingResponding",
    "NSTouchBarProvider",
    "NSUserActivityRestoring",
    "NSUserInterfaceItemIdentification",
    "Sendable",
    "SendableMetatype",
    "UIActivityItemsConfigurationProviding",
    "UIAppearanceContainer",
    "UIContentContainer",
    "UIFocusEnvironment",
    "UIPasteConfigurationSupporting",
    "UIResponderStandardEditActions",
    "UIStateRestoring",
    "UITraitChangeObservable",
    "UITraitEnvironment",
    "UIUserActivityRestoring"
  ],
  "contentHash" : "b5ded92a8c3c61d017dbb2cee68e31d09d687370c9b021ef68782f983ecadf75",
  "crawledAt" : "2025-12-04T22:30:17Z",
  "declaration" : {
    "code" : "@MainActor class GKAchievementViewController",
    "language" : "swift"
  },
  "id" : "748B133B-4320-4AC6-8A05-8201BB04D9D9",
  "kind" : "class",
  "language" : "swift",
  "module" : "GameKit",
  "overview" : "## Overview\n\nTo show achievements for the local player, initialize a new `GKAchievementViewController` object and set the delegate. Then present the new view controller and wait for the delegate to be called. Once the delegate is called, dismiss the view controller.\n\nOn iOS, you present and dismiss the view controller from another view controller in your game, using the methods provided by the [doc:\/\/com.apple.documentation\/documentation\/UIKit\/UIViewController] class. In macOS, you use the [doc:\/\/com.apple.gamekit\/documentation\/GameKit\/GKDialogController] class to present and dismiss the view controller in a window.\n\n### Subclassing Notes\n\nThe `GKAchievementViewController` class is not intended to be subclassed.",
  "platforms" : [
    "macOS",
    "visionOS"
  ],
  "rawMarkdown" : "---\nsource: https:\/\/developer.apple.com\/documentation\/gamekit\/gkachievementviewcontroller\ncrawled: 2025-12-04T22:30:17Z\n---\n\n# GKAchievementViewController\n\n**Class**\n\nAn `GKAchievementViewController` object provides a standard user interface to display achievement progress for the local player. If the [doc:\/\/com.apple.gamekit\/documentation\/GameKit\/GKGameCenterViewController] class is available, you should use it instead.\n\n## Declaration\n\n```swift\n@MainActor class GKAchievementViewController\n```\n\n## Overview\n\n\n\nTo show achievements for the local player, initialize a new `GKAchievementViewController` object and set the delegate. Then present the new view controller and wait for the delegate to be called. Once the delegate is called, dismiss the view controller.\n\nOn iOS, you present and dismiss the view controller from another view controller in your game, using the methods provided by the [doc:\/\/com.apple.documentation\/documentation\/UIKit\/UIViewController] class. In macOS, you use the [doc:\/\/com.apple.gamekit\/documentation\/GameKit\/GKDialogController] class to present and dismiss the view controller in a window.\n\n### Subclassing Notes\n\nThe `GKAchievementViewController` class is not intended to be subclassed.\n\n## Setting the Delegate\n\n- **achievementDelegate**: The achievement view controller’s delegate.\n\n## Deprecated classes\n\n- **GKChallengeEventHandler**: The `GKChallengeEventHandler` class is used to respond to events related to challenges sent or received by the local player.\n- **GKChallengesViewController**\n- **GKChallenge**: A challenge issued by the local player to another player.\n- **GKScoreChallenge**: A type of challenge where a player must beat the leaderboard score of another player.\n- **GKAchievementChallenge**: A type of challenge where a player must earn another player’s achievement.\n- **GKCloudPlayer**: The object representing the currently signed-in iCloud user.\n- **GKGameCenterViewController**: The dashboard that allows players to access their Game Center data in your game.\n- **GKGameSession**: A game session you can use to save game data, invite other players, and create turn-based and real-time game apps.\n- **GKGameSessionSharingViewController**: A user interface you can use to invite other users into a tvOS game session.\n- **GKFriendRequestComposeViewController**: Your game uses the `GKFriendRequestComposeViewController` class to present a screen that allows the local player to send friend requests to other players.\n- **GKLeaderboardViewController**: The `GKLeaderboardViewController` class provides a standard user interface that displays leaderboard scores to the player. If the [doc:\/\/com.apple.gamekit\/documentation\/GameKit\/GKGameCenterViewController] class is available, you should use it instead.\n- **GKPeerPickerController**: Provides a standard user interface to allow one iOS device to discover and connect to another.\n- **GKScore**: An object containing information for a score that was earned by the player.\n- **GKSession**: A [doc:\/\/com.apple.gamekit\/documentation\/GameKit\/GKSession] object provides the ability to discover and connect to nearby iOS devices using Bluetooth or Wi-fi.\n- **GKTurnBasedEventHandler**: The [doc:\/\/com.apple.gamekit\/documentation\/GameKit\/GKTurnBasedEventHandler] class is used to respond to important messages related to turn-based matches. To use it, call the [doc:\/\/com.apple.gamekit\/documentation\/GameKit\/GKTurnBasedEventHandler\/shared()] class method to get the singleton instance and assign an object that implements the [doc:\/\/com.apple.gamekit\/documentation\/GameKit\/GKTurnBasedEventHandlerDelegate] protocol to its [doc:\/\/com.apple.gamekit\/documentation\/GameKit\/GKTurnBasedEventHandler\/delegate] property. All methods are called on the main thread.\n\n## Inherits From\n\n- GKGameCenterViewController\n\n## Conforms To\n\n- CVarArg\n- CustomDebugStringConvertible\n- CustomStringConvertible\n- Equatable\n- GKViewController\n- Hashable\n- NSCoding\n- NSEditor\n- NSExtensionRequestHandling\n- NSObjectProtocol\n- NSSeguePerforming\n- NSStandardKeyBindingResponding\n- NSTouchBarProvider\n- NSUserActivityRestoring\n- NSUserInterfaceItemIdentification\n- Sendable\n- SendableMetatype\n- UIActivityItemsConfigurationProviding\n- UIAppearanceContainer\n- UIContentContainer\n- UIFocusEnvironment\n- UIPasteConfigurationSupporting\n- UIResponderStandardEditActions\n- UIStateRestoring\n- UITraitChangeObservable\n- UITraitEnvironment\n- UIUserActivityRestoring\n\n",
  "sections" : [
    {
      "content" : "",
      "items" : [
        {
          "description" : "The achievement view controller’s delegate.",
          "name" : "achievementDelegate",
          "url" : "https:\/\/developer.apple.com\/documentation\/GameKit\/GKAchievementViewController\/achievementDelegate"
        }
      ],
      "title" : "Setting the Delegate"
    },
    {
      "content" : "",
      "items" : [
        {
          "description" : "The `GKChallengeEventHandler` class is used to respond to events related to challenges sent or received by the local player.",
          "name" : "GKChallengeEventHandler",
          "url" : "https:\/\/developer.apple.com\/documentation\/GameKit\/GKChallengeEventHandler"
        },
        {
          "description" : "",
          "name" : "GKChallengesViewController",
          "url" : "https:\/\/developer.apple.com\/documentation\/GameKit\/GKChallengesViewController"
        },
        {
          "description" : "A challenge issued by the local player to another player.",
          "name" : "GKChallenge",
          "url" : "https:\/\/developer.apple.com\/documentation\/GameKit\/GKChallenge"
        },
        {
          "description" : "A type of challenge where a player must beat the leaderboard score of another player.",
          "name" : "GKScoreChallenge",
          "url" : "https:\/\/developer.apple.com\/documentation\/GameKit\/GKScoreChallenge"
        },
        {
          "description" : "A type of challenge where a player must earn another player’s achievement.",
          "name" : "GKAchievementChallenge",
          "url" : "https:\/\/developer.apple.com\/documentation\/GameKit\/GKAchievementChallenge"
        },
        {
          "description" : "The object representing the currently signed-in iCloud user.",
          "name" : "GKCloudPlayer",
          "url" : "https:\/\/developer.apple.com\/documentation\/GameKit\/GKCloudPlayer"
        },
        {
          "description" : "The dashboard that allows players to access their Game Center data in your game.",
          "name" : "GKGameCenterViewController",
          "url" : "https:\/\/developer.apple.com\/documentation\/GameKit\/GKGameCenterViewController"
        },
        {
          "description" : "A game session you can use to save game data, invite other players, and create turn-based and real-time game apps.",
          "name" : "GKGameSession",
          "url" : "https:\/\/developer.apple.com\/documentation\/GameKit\/GKGameSession"
        },
        {
          "description" : "A user interface you can use to invite other users into a tvOS game session.",
          "name" : "GKGameSessionSharingViewController",
          "url" : "https:\/\/developer.apple.com\/documentation\/GameKit\/GKGameSessionSharingViewController"
        },
        {
          "description" : "Your game uses the `GKFriendRequestComposeViewController` class to present a screen that allows the local player to send friend requests to other players.",
          "name" : "GKFriendRequestComposeViewController",
          "url" : "https:\/\/developer.apple.com\/documentation\/GameKit\/GKFriendRequestComposeViewController"
        },
        {
          "description" : "The `GKLeaderboardViewController` class provides a standard user interface that displays leaderboard scores to the player. If the [doc:\/\/com.apple.gamekit\/documentation\/GameKit\/GKGameCenterViewController] class is available, you should use it instead.",
          "name" : "GKLeaderboardViewController",
          "url" : "https:\/\/developer.apple.com\/documentation\/GameKit\/GKLeaderboardViewController"
        },
        {
          "description" : "Provides a standard user interface to allow one iOS device to discover and connect to another.",
          "name" : "GKPeerPickerController",
          "url" : "https:\/\/developer.apple.com\/documentation\/GameKit\/GKPeerPickerController"
        },
        {
          "description" : "An object containing information for a score that was earned by the player.",
          "name" : "GKScore",
          "url" : "https:\/\/developer.apple.com\/documentation\/GameKit\/GKScore"
        },
        {
          "description" : "A [doc:\/\/com.apple.gamekit\/documentation\/GameKit\/GKSession] object provides the ability to discover and connect to nearby iOS devices using Bluetooth or Wi-fi.",
          "name" : "GKSession",
          "url" : "https:\/\/developer.apple.com\/documentation\/GameKit\/GKSession"
        },
        {
          "description" : "The [doc:\/\/com.apple.gamekit\/documentation\/GameKit\/GKTurnBasedEventHandler] class is used to respond to important messages related to turn-based matches. To use it, call the [doc:\/\/com.apple.gamekit\/documentation\/GameKit\/GKTurnBasedEventHandler\/shared()] class method to get the singleton instance and assign an object that implements the [doc:\/\/com.apple.gamekit\/documentation\/GameKit\/GKTurnBasedEventHandlerDelegate] protocol to its [doc:\/\/com.apple.gamekit\/documentation\/GameKit\/GKTurnBasedEventHandler\/delegate] property. All methods are called on the main thread.",
          "name" : "GKTurnBasedEventHandler",
          "url" : "https:\/\/developer.apple.com\/documentation\/GameKit\/GKTurnBasedEventHandler"
        }
      ],
      "title" : "Deprecated classes"
    },
    {
      "content" : "",
      "items" : [
        {
          "name" : "GKGameCenterViewController"
        }
      ],
      "title" : "Inherits From"
    }
  ],
  "source" : "appleJSON",
  "title" : "GKAchievementViewController",
  "url" : "https:\/\/developer.apple.com\/documentation\/gamekit\/gkachievementviewcontroller"
}