{
  "abstract" : "Reports a score to Game Center.",
  "codeExamples" : [

  ],
  "contentHash" : "eb39d54b8247a2a1dbd12b92f4c3bd4044871a36a4ec398d03c8981e7f859857",
  "crawledAt" : "2025-12-05T18:12:53Z",
  "declaration" : {
    "code" : "func report(completionHandler: (((any Error)?) -> Void)? = nil)",
    "language" : "swift"
  },
  "id" : "2F4F34FC-5F4D-493F-A542-E6BCF7E47FA4",
  "kind" : "method",
  "language" : "swift",
  "module" : "GameKit",
  "overview" : "## Discussion\n\nThe `value` property must be set before calling this method.\n\nWhen this method is called, it creates a new background task to handle the request. The method then returns control to your game. Later, when the task is complete, GameKit calls your completion handler. The completion handler is always called on the main thread.",
  "platforms" : [
    "macOS",
    "visionOS",
    "watchOS"
  ],
  "rawMarkdown" : "---\nsource: https:\/\/developer.apple.com\/documentation\/GameKit\/GKScore\/report(completionHandler:)\ncrawled: 2025-12-05T18:12:53Z\n---\n\n# report(completionHandler:)\n\n**Instance Method**\n\nReports a score to Game Center.\n\n## Declaration\n\n```swift\nfunc report(completionHandler: (((any Error)?) -> Void)? = nil)\n```\n\n```swift\nfunc report() async throws\n```\n\n## Parameters\n\n- **completionHandler**: A block to be called after the score is reported.\n\nThe block receives the following parameter:\n\n\n\n## Discussion\n\nThe `value` property must be set before calling this method.\n\nWhen this method is called, it creates a new background task to handle the request. The method then returns control to your game. Later, when the task is complete, GameKit calls your completion handler. The completion handler is always called on the main thread.\n\n## Deprecated Methods and Properties\n\n- **category**: The leaderboard that this score belongs to.\n- **context**: An integer value used by your game.\n- **date**: The date and time when the score was earned.\n- **formattedValue**: Returns the player’s score as a localized string.\n- **leaderboardIdentifier**: The identifier for the leaderboard.\n- **player**: The player who earned the score.\n- **rank**: The position of the score in the results of a leaderboard search.\n- **value**: The score earned by the player.\n- **shouldSetDefaultLeaderboard**: A Boolean value that indicates whether this score should also update the default leaderboard.\n- **init(leaderboardIdentifier:)**: Returns an initialized score object using the local player and the current date.\n- **init(leaderboardIdentifier:player:)**: Returns an initialized score object for the specified leaderboard and player.\n- **init(category:)**: Returns an initialized score object.\n- **init(leaderboardIdentifier:forPlayer:)**: Returns an initialized score object for the specified leaderboard and player.\n- **issueChallenge(toPlayers:message:)**: Issues a score challenge to a set of players.\n- **playerID**: The player identifier for the player that earned the score.\n\n",
  "sections" : [
    {
      "content" : "",
      "items" : [
        {
          "description" : "The leaderboard that this score belongs to.",
          "name" : "category",
          "url" : "https:\/\/developer.apple.com\/documentation\/GameKit\/GKScore\/category"
        },
        {
          "description" : "An integer value used by your game.",
          "name" : "context",
          "url" : "https:\/\/developer.apple.com\/documentation\/GameKit\/GKScore\/context"
        },
        {
          "description" : "The date and time when the score was earned.",
          "name" : "date",
          "url" : "https:\/\/developer.apple.com\/documentation\/GameKit\/GKScore\/date"
        },
        {
          "description" : "Returns the player’s score as a localized string.",
          "name" : "formattedValue",
          "url" : "https:\/\/developer.apple.com\/documentation\/GameKit\/GKScore\/formattedValue"
        },
        {
          "description" : "The identifier for the leaderboard.",
          "name" : "leaderboardIdentifier",
          "url" : "https:\/\/developer.apple.com\/documentation\/GameKit\/GKScore\/leaderboardIdentifier"
        },
        {
          "description" : "The player who earned the score.",
          "name" : "player",
          "url" : "https:\/\/developer.apple.com\/documentation\/GameKit\/GKScore\/player"
        },
        {
          "description" : "The position of the score in the results of a leaderboard search.",
          "name" : "rank",
          "url" : "https:\/\/developer.apple.com\/documentation\/GameKit\/GKScore\/rank"
        },
        {
          "description" : "The score earned by the player.",
          "name" : "value",
          "url" : "https:\/\/developer.apple.com\/documentation\/GameKit\/GKScore\/value"
        },
        {
          "description" : "A Boolean value that indicates whether this score should also update the default leaderboard.",
          "name" : "shouldSetDefaultLeaderboard",
          "url" : "https:\/\/developer.apple.com\/documentation\/GameKit\/GKScore\/shouldSetDefaultLeaderboard"
        },
        {
          "description" : "Returns an initialized score object using the local player and the current date.",
          "name" : "init(leaderboardIdentifier:)",
          "url" : "https:\/\/developer.apple.com\/documentation\/GameKit\/GKScore\/init(leaderboardIdentifier:)"
        },
        {
          "description" : "Returns an initialized score object for the specified leaderboard and player.",
          "name" : "init(leaderboardIdentifier:player:)",
          "url" : "https:\/\/developer.apple.com\/documentation\/GameKit\/GKScore\/init(leaderboardIdentifier:player:)"
        },
        {
          "description" : "Returns an initialized score object.",
          "name" : "init(category:)",
          "url" : "https:\/\/developer.apple.com\/documentation\/GameKit\/GKScore\/init(category:)"
        },
        {
          "description" : "Returns an initialized score object for the specified leaderboard and player.",
          "name" : "init(leaderboardIdentifier:forPlayer:)",
          "url" : "https:\/\/developer.apple.com\/documentation\/GameKit\/GKScore\/init(leaderboardIdentifier:forPlayer:)"
        },
        {
          "description" : "Issues a score challenge to a set of players.",
          "name" : "issueChallenge(toPlayers:message:)",
          "url" : "https:\/\/developer.apple.com\/documentation\/GameKit\/GKScore\/issueChallenge(toPlayers:message:)"
        },
        {
          "description" : "The player identifier for the player that earned the score.",
          "name" : "playerID",
          "url" : "https:\/\/developer.apple.com\/documentation\/GameKit\/GKScore\/playerID"
        }
      ],
      "title" : "Deprecated Methods and Properties"
    }
  ],
  "source" : "appleJSON",
  "title" : "report(completionHandler:)",
  "url" : "https:\/\/developer.apple.com\/documentation\/GameKit\/GKScore\/report(completionHandler:)"
}