{
  "abstract" : "A request for the client to send data to a participant.",
  "codeExamples" : [

  ],
  "contentHash" : "c8e8697a5408c03dabeff38e5828c85e847f500455b06c61cc747aca975497a4",
  "crawledAt" : "2025-12-05T18:14:12Z",
  "declaration" : {
    "code" : "func voiceChatService(_ voiceChatService: GKVoiceChatService, send data: Data, toParticipantID participantID: String)",
    "language" : "swift"
  },
  "id" : "4681512F-CD03-4A4E-B097-A458A5F65E36",
  "kind" : "method",
  "language" : "swift",
  "module" : "GameKit",
  "overview" : "## Discussion\n\nAn implementation of this method must reliably transmit the data to the participant identified by `participantID`. When the client on the other end receives the data, it should forward it to the voice chat service by calling the service’s [doc:\/\/com.apple.gamekit\/documentation\/GameKit\/GKVoiceChatService\/receivedData(_:fromParticipantID:)] method.",
  "platforms" : [
    "visionOS",
    "watchOS"
  ],
  "rawMarkdown" : "---\nsource: https:\/\/developer.apple.com\/documentation\/GameKit\/GKVoiceChatClient\/voiceChatService(_:send:toParticipantID:)\ncrawled: 2025-12-05T18:14:12Z\n---\n\n# voiceChatService(_:send:toParticipantID:)\n\n**Instance Method**\n\nA request for the client to send data to a participant.\n\n## Declaration\n\n```swift\nfunc voiceChatService(_ voiceChatService: GKVoiceChatService, send data: Data, toParticipantID participantID: String)\n```\n\n## Parameters\n\n- **voiceChatService**: The service that requested the transmission.\n- **data**: The data to send.\n- **participantID**: A string that uniquely identifies the participant to send the data to.\n\n## Discussion\n\nAn implementation of this method must reliably transmit the data to the participant identified by `participantID`. When the client on the other end receives the data, it should forward it to the voice chat service by calling the service’s [doc:\/\/com.apple.gamekit\/documentation\/GameKit\/GKVoiceChatService\/receivedData(_:fromParticipantID:)] method.\n\n## Sending data to other participants\n\n- **voiceChatService(_:sendRealTime:toParticipantID:)**: Asks the client to send data to a participant that must get there quickly.\n\n",
  "sections" : [
    {
      "content" : "",
      "items" : [
        {
          "description" : "Asks the client to send data to a participant that must get there quickly.",
          "name" : "voiceChatService(_:sendRealTime:toParticipantID:)",
          "url" : "https:\/\/developer.apple.com\/documentation\/GameKit\/GKVoiceChatClient\/voiceChatService(_:sendRealTime:toParticipantID:)"
        }
      ],
      "title" : "Sending data to other participants"
    }
  ],
  "source" : "appleJSON",
  "title" : "voiceChatService(_:send:toParticipantID:)",
  "url" : "https:\/\/developer.apple.com\/documentation\/GameKit\/GKVoiceChatClient\/voiceChatService(_:send:toParticipantID:)"
}