{
  "abstract" : "An object that encapsulates the match data for games where players take turns.",
  "codeExamples" : [

  ],
  "conformsTo" : [
    "CVarArg",
    "CustomDebugStringConvertible",
    "CustomStringConvertible",
    "Equatable",
    "Hashable",
    "NSObjectProtocol"
  ],
  "contentHash" : "4e0bb4129a903af73d2241d84d6c9f0e752cd29727a299a7e7aba4a7a66b2bb7",
  "crawledAt" : "2025-12-04T21:00:45Z",
  "declaration" : {
    "code" : "class GKTurnBasedMatch",
    "language" : "swift"
  },
  "id" : "EEE7F55A-11AE-4326-BA44-C2AD8C2F5092",
  "kind" : "class",
  "language" : "swift",
  "module" : "GameKit",
  "overview" : "## Overview\n\nA `GKTurnBasedMatch` object represents a match in a turn-based game that Game Center stores and forwards to participants in the match. In a turn-based game, participants take turns to advance gameplay until they reach an outcome. You end the match when all participants reach an outcome or they can no longer continue.\n\nA turn-based match object contains the status of the match, list of participants, the participant whose turn it is, a message about the last turn, and your game-specific data. You can get more details about the participants through the [doc:\/\/com.apple.gamekit\/documentation\/GameKit\/GKTurnBasedParticipant] objects in the [doc:\/\/com.apple.gamekit\/documentation\/GameKit\/GKTurnBasedMatch\/participants] property.\n\nYou don’t create turn-based match objects directly. When a match event occurs, GameKit passes the match object to listeners that conform to the [doc:\/\/com.apple.gamekit\/documentation\/GameKit\/GKTurnBasedEventListener] protocol. Retain the match object or its match ID in the protocol methods, so you can get the latest match data later during gameplay.\n\nUsing the match object passed to `GKTurnBasedEventListener` protocol methods, you can perform these actions on behalf of the local player:\n\nWhen you end a turn, forfeit a match, or end a match, you update the match data and if gameplay can continue, choose the next participant. If you end a match, you set the individual participant outcomes as well.\n\nIf you present a [doc:\/\/com.apple.gamekit\/documentation\/GameKit\/GKTurnBasedMatchmakerViewController] object for players to manage their turn-based matches, the player can start a match, accept an invitation, open an existing match, and forfeit a match.\n\n### Subclassing Notes\n\nDon’t subclass the [doc:\/\/com.apple.gamekit\/documentation\/GameKit\/GKTurnBasedMatch] class.",
  "platforms" : [
    "iOS",
    "iPadOS",
    "Mac Catalyst",
    "macOS",
    "tvOS",
    "visionOS",
    "watchOS"
  ],
  "rawMarkdown" : "---\nsource: https:\/\/developer.apple.com\/documentation\/gamekit\/gkturnbasedmatch\ncrawled: 2025-12-04T21:00:45Z\n---\n\n# GKTurnBasedMatch\n\n**Class**\n\nAn object that encapsulates the match data for games where players take turns.\n\n## Declaration\n\n```swift\nclass GKTurnBasedMatch\n```\n\n## Overview\n\nA `GKTurnBasedMatch` object represents a match in a turn-based game that Game Center stores and forwards to participants in the match. In a turn-based game, participants take turns to advance gameplay until they reach an outcome. You end the match when all participants reach an outcome or they can no longer continue.\n\nA turn-based match object contains the status of the match, list of participants, the participant whose turn it is, a message about the last turn, and your game-specific data. You can get more details about the participants through the [doc:\/\/com.apple.gamekit\/documentation\/GameKit\/GKTurnBasedParticipant] objects in the [doc:\/\/com.apple.gamekit\/documentation\/GameKit\/GKTurnBasedMatch\/participants] property.\n\nYou don’t create turn-based match objects directly. When a match event occurs, GameKit passes the match object to listeners that conform to the [doc:\/\/com.apple.gamekit\/documentation\/GameKit\/GKTurnBasedEventListener] protocol. Retain the match object or its match ID in the protocol methods, so you can get the latest match data later during gameplay.\n\nUsing the match object passed to `GKTurnBasedEventListener` protocol methods, you can perform these actions on behalf of the local player:\n\n- Save game data\n- End a turn\n- Forfeit a match\n- End a match\n- Send a reminder to the participant whose turn it is\n- Exchange data between participants\n- Remove a completed match from Game Center\n\nWhen you end a turn, forfeit a match, or end a match, you update the match data and if gameplay can continue, choose the next participant. If you end a match, you set the individual participant outcomes as well.\n\nIf you present a [doc:\/\/com.apple.gamekit\/documentation\/GameKit\/GKTurnBasedMatchmakerViewController] object for players to manage their turn-based matches, the player can start a match, accept an invitation, open an existing match, and forfeit a match.\n\n### Subclassing Notes\n\nDon’t subclass the [doc:\/\/com.apple.gamekit\/documentation\/GameKit\/GKTurnBasedMatch] class.\n\n## Creating a Match\n\n- **find(for:withCompletionHandler:)**: Creates a new match or finds an existing match that needs a player.\n- **acceptInvite(completionHandler:)**: Accepts an invitation for the local player to join a turn-based match.\n- **declineInvite(completionHandler:)**: Declines an invitation for the local player to join a turn-based match.\n- **rematch(completionHandler:)**: Creates a new turn-based match with the same participants from an existing match.\n\n## Retrieving Match Details\n\n- **matchID**: A unique identifier for the turn-based match.\n- **creationDate**: The date that Game Center created the match.\n- **participants**: The players that participate in a turn-based match.\n- **currentParticipant**: The participant whose turn it is.\n- **status**: The state of the match, such as whether the match is open or has ended.\n- **GKTurnBasedMatch.Status**: The states of a match from when it’s created to when it ends.\n- **matchData**: The game-specific data that you store in Game Center and pass between participants through a match object.\n- **matchDataMaximumSize**: The maximum size of the match data.\n- **loadMatchData(completionHandler:)**: Fetches your game-specific data that you store in Game Center when ending a turn, saving a turn, or leaving a match.\n\n## Ending Turns and Saving Data\n\n- **endTurn(withNextParticipants:turnTimeout:match:completionHandler:)**: Passes the turn from the current participant to the next participant.\n- **saveCurrentTurn(withMatch:completionHandler:)**: Saves your match data in Game Center without ending the turn.\n- **Turn Timeouts**: A timeout for a player to take their turn.\n\n## Forfeiting a Match\n\n- **participantQuitInTurn(with:nextParticipants:turnTimeout:match:completionHandler:)**: Forfeits the match on behalf of the local player when it’s their turn.\n- **participantQuitOutOfTurn(with:withCompletionHandler:)**: Forfeits the match on behalf of the local player when it’s not their turn.\n- **GKTurnBasedMatch.Outcome**: The state of a participant when they forfeit a match or when a match ends.\n\n## Ending a Match\n\n- **endMatchInTurn(withMatch:completionHandler:)**: Ends the match.\n- **endMatchInTurn(withMatch:leaderboardScores:achievements:completionHandler:)**: Ends the match while submitting scores and achievements for all of the participants.\n\n## Sending Messages Between Participants\n\n- **message**: A message from the current participant to all other participants when you end a turn, forfeit a match, or end a match.\n- **setLocalizableMessageWithKey(_:arguments:)**: Sends a localized message from the current participant to all other participants when you end a turn, forfeit a match, or end a match.\n- **sendReminder(to:localizableMessageKey:arguments:completionHandler:)**: Sends a reminder from one participant to a specific set of other participants.\n\n## Exchanging Data Between Participants\n\n- **sendExchange(to:data:localizableMessageKey:arguments:timeout:completionHandler:)**: Sends an exchange request that contains your game data to one or more participants.\n- **Exchange Timeouts**: The amount of time that passes before an exchange times out.\n- **exchangeDataMaximumSize**: The maximum size of the exchange data.\n- **exchangeMaxInitiatedExchangesPerPlayer**: The maximum number of exchanges the local player can initiate.\n- **activeExchanges**: The exchanges that the local player needs to accept or reject.\n- **completedExchanges**: The exchange requests that all recipients replied to and the current participant needs to save.\n- **exchanges**: The exchange requests that are active or complete.\n- **saveMergedMatch(_:withResolvedExchanges:completionHandler:)**: Saves match data for completed exchanges without ending the turn.\n\n## Loading Existing Matches\n\n- **load(withID:withCompletionHandler:)**: Loads a specific match with the specified identifier.\n- **loadMatches(completionHandler:)**: Fetches the turn-based matches from Game Center that the local player participates in.\n\n## Deleting a Match from Game Center\n\n- **remove(completionHandler:)**: Removes a match from Game Center that the local player participants in.\n\n## Deprecated Methods\n\n- **participantQuitInTurn(with:nextParticipant:match:completionHandler:)**: Resigns the current player from the match without ending the match.\n- **endMatchInTurn(withMatch:scores:achievements:completionHandler:)**: Ends the match while submitting all of the scores and achievements.\n- **endTurn(withNextParticipant:match:completionHandler:)**: Updates the data stored on Game Center for the current match.\n\n## Turn-based games\n\n- **Creating turn-based games**: Develop games where multiple players take turns and can exchange data while waiting for their turn.\n- **Starting turn-based matches and passing turns between players**: Let Game Center store and forward match data between players in a turn-based game.\n- **Sending messages to players in turn-based games**: Notify players of match events by sending messages and game data.\n- **Exchanging data between players in turn-based games**: Add the ability for players to exchange game data and send messages while waiting for their turns.\n- **GKTurnBasedMatchmakerViewController**: An interface that allows a player to invite other players to a turn-based match and automatch to fill any empty slots.\n- **GKTurnBasedParticipant**: A participant in a turn-based match.\n- **GKTurnBasedEventListener**: The protocol that handles turn-based and data-exchange events between participants in a match.\n- **GKTurnBasedExchange**: Exchange request information that participants send in a turn-based match.\n- **GKTurnBasedExchangeReply**: Details about a recipient’s response to an exchange request.\n- **GKGameCenterBadgingDisabled**: A Boolean value indicating whether GameKit can add badges to a turn-based game icon.\n\n## Inherits From\n\n- NSObject\n\n## Conforms To\n\n- CVarArg\n- CustomDebugStringConvertible\n- CustomStringConvertible\n- Equatable\n- Hashable\n- NSObjectProtocol\n\n",
  "sections" : [
    {
      "content" : "",
      "items" : [
        {
          "description" : "Creates a new match or finds an existing match that needs a player.",
          "name" : "find(for:withCompletionHandler:)",
          "url" : "https:\/\/developer.apple.com\/documentation\/GameKit\/GKTurnBasedMatch\/find(for:withCompletionHandler:)"
        },
        {
          "description" : "Accepts an invitation for the local player to join a turn-based match.",
          "name" : "acceptInvite(completionHandler:)",
          "url" : "https:\/\/developer.apple.com\/documentation\/GameKit\/GKTurnBasedMatch\/acceptInvite(completionHandler:)"
        },
        {
          "description" : "Declines an invitation for the local player to join a turn-based match.",
          "name" : "declineInvite(completionHandler:)",
          "url" : "https:\/\/developer.apple.com\/documentation\/GameKit\/GKTurnBasedMatch\/declineInvite(completionHandler:)"
        },
        {
          "description" : "Creates a new turn-based match with the same participants from an existing match.",
          "name" : "rematch(completionHandler:)",
          "url" : "https:\/\/developer.apple.com\/documentation\/GameKit\/GKTurnBasedMatch\/rematch(completionHandler:)"
        }
      ],
      "title" : "Creating a Match"
    },
    {
      "content" : "",
      "items" : [
        {
          "description" : "A unique identifier for the turn-based match.",
          "name" : "matchID",
          "url" : "https:\/\/developer.apple.com\/documentation\/GameKit\/GKTurnBasedMatch\/matchID"
        },
        {
          "description" : "The date that Game Center created the match.",
          "name" : "creationDate",
          "url" : "https:\/\/developer.apple.com\/documentation\/GameKit\/GKTurnBasedMatch\/creationDate"
        },
        {
          "description" : "The players that participate in a turn-based match.",
          "name" : "participants",
          "url" : "https:\/\/developer.apple.com\/documentation\/GameKit\/GKTurnBasedMatch\/participants"
        },
        {
          "description" : "The participant whose turn it is.",
          "name" : "currentParticipant",
          "url" : "https:\/\/developer.apple.com\/documentation\/GameKit\/GKTurnBasedMatch\/currentParticipant"
        },
        {
          "description" : "The state of the match, such as whether the match is open or has ended.",
          "name" : "status",
          "url" : "https:\/\/developer.apple.com\/documentation\/GameKit\/GKTurnBasedMatch\/status-swift.property"
        },
        {
          "description" : "The states of a match from when it’s created to when it ends.",
          "name" : "GKTurnBasedMatch.Status",
          "url" : "https:\/\/developer.apple.com\/documentation\/GameKit\/GKTurnBasedMatch\/Status-swift.enum"
        },
        {
          "description" : "The game-specific data that you store in Game Center and pass between participants through a match object.",
          "name" : "matchData",
          "url" : "https:\/\/developer.apple.com\/documentation\/GameKit\/GKTurnBasedMatch\/matchData"
        },
        {
          "description" : "The maximum size of the match data.",
          "name" : "matchDataMaximumSize",
          "url" : "https:\/\/developer.apple.com\/documentation\/GameKit\/GKTurnBasedMatch\/matchDataMaximumSize"
        },
        {
          "description" : "Fetches your game-specific data that you store in Game Center when ending a turn, saving a turn, or leaving a match.",
          "name" : "loadMatchData(completionHandler:)",
          "url" : "https:\/\/developer.apple.com\/documentation\/GameKit\/GKTurnBasedMatch\/loadMatchData(completionHandler:)"
        }
      ],
      "title" : "Retrieving Match Details"
    },
    {
      "content" : "",
      "items" : [
        {
          "description" : "Passes the turn from the current participant to the next participant.",
          "name" : "endTurn(withNextParticipants:turnTimeout:match:completionHandler:)",
          "url" : "https:\/\/developer.apple.com\/documentation\/GameKit\/GKTurnBasedMatch\/endTurn(withNextParticipants:turnTimeout:match:completionHandler:)"
        },
        {
          "description" : "Saves your match data in Game Center without ending the turn.",
          "name" : "saveCurrentTurn(withMatch:completionHandler:)",
          "url" : "https:\/\/developer.apple.com\/documentation\/GameKit\/GKTurnBasedMatch\/saveCurrentTurn(withMatch:completionHandler:)"
        },
        {
          "description" : "A timeout for a player to take their turn.",
          "name" : "Turn Timeouts",
          "url" : "https:\/\/developer.apple.com\/documentation\/GameKit\/turn-timeouts"
        }
      ],
      "title" : "Ending Turns and Saving Data"
    },
    {
      "content" : "",
      "items" : [
        {
          "description" : "Forfeits the match on behalf of the local player when it’s their turn.",
          "name" : "participantQuitInTurn(with:nextParticipants:turnTimeout:match:completionHandler:)",
          "url" : "https:\/\/developer.apple.com\/documentation\/GameKit\/GKTurnBasedMatch\/participantQuitInTurn(with:nextParticipants:turnTimeout:match:completionHandler:)"
        },
        {
          "description" : "Forfeits the match on behalf of the local player when it’s not their turn.",
          "name" : "participantQuitOutOfTurn(with:withCompletionHandler:)",
          "url" : "https:\/\/developer.apple.com\/documentation\/GameKit\/GKTurnBasedMatch\/participantQuitOutOfTurn(with:withCompletionHandler:)"
        },
        {
          "description" : "The state of a participant when they forfeit a match or when a match ends.",
          "name" : "GKTurnBasedMatch.Outcome",
          "url" : "https:\/\/developer.apple.com\/documentation\/GameKit\/GKTurnBasedMatch\/Outcome"
        }
      ],
      "title" : "Forfeiting a Match"
    },
    {
      "content" : "",
      "items" : [
        {
          "description" : "Ends the match.",
          "name" : "endMatchInTurn(withMatch:completionHandler:)",
          "url" : "https:\/\/developer.apple.com\/documentation\/GameKit\/GKTurnBasedMatch\/endMatchInTurn(withMatch:completionHandler:)"
        },
        {
          "description" : "Ends the match while submitting scores and achievements for all of the participants.",
          "name" : "endMatchInTurn(withMatch:leaderboardScores:achievements:completionHandler:)",
          "url" : "https:\/\/developer.apple.com\/documentation\/GameKit\/GKTurnBasedMatch\/endMatchInTurn(withMatch:leaderboardScores:achievements:completionHandler:)"
        }
      ],
      "title" : "Ending a Match"
    },
    {
      "content" : "",
      "items" : [
        {
          "description" : "A message from the current participant to all other participants when you end a turn, forfeit a match, or end a match.",
          "name" : "message",
          "url" : "https:\/\/developer.apple.com\/documentation\/GameKit\/GKTurnBasedMatch\/message"
        },
        {
          "description" : "Sends a localized message from the current participant to all other participants when you end a turn, forfeit a match, or end a match.",
          "name" : "setLocalizableMessageWithKey(_:arguments:)",
          "url" : "https:\/\/developer.apple.com\/documentation\/GameKit\/GKTurnBasedMatch\/setLocalizableMessageWithKey(_:arguments:)"
        },
        {
          "description" : "Sends a reminder from one participant to a specific set of other participants.",
          "name" : "sendReminder(to:localizableMessageKey:arguments:completionHandler:)",
          "url" : "https:\/\/developer.apple.com\/documentation\/GameKit\/GKTurnBasedMatch\/sendReminder(to:localizableMessageKey:arguments:completionHandler:)"
        }
      ],
      "title" : "Sending Messages Between Participants"
    },
    {
      "content" : "",
      "items" : [
        {
          "description" : "Sends an exchange request that contains your game data to one or more participants.",
          "name" : "sendExchange(to:data:localizableMessageKey:arguments:timeout:completionHandler:)",
          "url" : "https:\/\/developer.apple.com\/documentation\/GameKit\/GKTurnBasedMatch\/sendExchange(to:data:localizableMessageKey:arguments:timeout:completionHandler:)"
        },
        {
          "description" : "The amount of time that passes before an exchange times out.",
          "name" : "Exchange Timeouts",
          "url" : "https:\/\/developer.apple.com\/documentation\/GameKit\/exchange-timeouts"
        },
        {
          "description" : "The maximum size of the exchange data.",
          "name" : "exchangeDataMaximumSize",
          "url" : "https:\/\/developer.apple.com\/documentation\/GameKit\/GKTurnBasedMatch\/exchangeDataMaximumSize"
        },
        {
          "description" : "The maximum number of exchanges the local player can initiate.",
          "name" : "exchangeMaxInitiatedExchangesPerPlayer",
          "url" : "https:\/\/developer.apple.com\/documentation\/GameKit\/GKTurnBasedMatch\/exchangeMaxInitiatedExchangesPerPlayer"
        },
        {
          "description" : "The exchanges that the local player needs to accept or reject.",
          "name" : "activeExchanges",
          "url" : "https:\/\/developer.apple.com\/documentation\/GameKit\/GKTurnBasedMatch\/activeExchanges"
        },
        {
          "description" : "The exchange requests that all recipients replied to and the current participant needs to save.",
          "name" : "completedExchanges",
          "url" : "https:\/\/developer.apple.com\/documentation\/GameKit\/GKTurnBasedMatch\/completedExchanges"
        },
        {
          "description" : "The exchange requests that are active or complete.",
          "name" : "exchanges",
          "url" : "https:\/\/developer.apple.com\/documentation\/GameKit\/GKTurnBasedMatch\/exchanges"
        },
        {
          "description" : "Saves match data for completed exchanges without ending the turn.",
          "name" : "saveMergedMatch(_:withResolvedExchanges:completionHandler:)",
          "url" : "https:\/\/developer.apple.com\/documentation\/GameKit\/GKTurnBasedMatch\/saveMergedMatch(_:withResolvedExchanges:completionHandler:)"
        }
      ],
      "title" : "Exchanging Data Between Participants"
    },
    {
      "content" : "",
      "items" : [
        {
          "description" : "Loads a specific match with the specified identifier.",
          "name" : "load(withID:withCompletionHandler:)",
          "url" : "https:\/\/developer.apple.com\/documentation\/GameKit\/GKTurnBasedMatch\/load(withID:withCompletionHandler:)"
        },
        {
          "description" : "Fetches the turn-based matches from Game Center that the local player participates in.",
          "name" : "loadMatches(completionHandler:)",
          "url" : "https:\/\/developer.apple.com\/documentation\/GameKit\/GKTurnBasedMatch\/loadMatches(completionHandler:)"
        }
      ],
      "title" : "Loading Existing Matches"
    },
    {
      "content" : "",
      "items" : [
        {
          "description" : "Removes a match from Game Center that the local player participants in.",
          "name" : "remove(completionHandler:)",
          "url" : "https:\/\/developer.apple.com\/documentation\/GameKit\/GKTurnBasedMatch\/remove(completionHandler:)"
        }
      ],
      "title" : "Deleting a Match from Game Center"
    },
    {
      "content" : "",
      "items" : [
        {
          "description" : "Resigns the current player from the match without ending the match.",
          "name" : "participantQuitInTurn(with:nextParticipant:match:completionHandler:)",
          "url" : "https:\/\/developer.apple.com\/documentation\/GameKit\/GKTurnBasedMatch\/participantQuitInTurn(with:nextParticipant:match:completionHandler:)"
        },
        {
          "description" : "Ends the match while submitting all of the scores and achievements.",
          "name" : "endMatchInTurn(withMatch:scores:achievements:completionHandler:)",
          "url" : "https:\/\/developer.apple.com\/documentation\/GameKit\/GKTurnBasedMatch\/endMatchInTurn(withMatch:scores:achievements:completionHandler:)"
        },
        {
          "description" : "Updates the data stored on Game Center for the current match.",
          "name" : "endTurn(withNextParticipant:match:completionHandler:)",
          "url" : "https:\/\/developer.apple.com\/documentation\/GameKit\/GKTurnBasedMatch\/endTurn(withNextParticipant:match:completionHandler:)"
        }
      ],
      "title" : "Deprecated Methods"
    },
    {
      "content" : "",
      "items" : [
        {
          "description" : "Develop games where multiple players take turns and can exchange data while waiting for their turn.",
          "name" : "Creating turn-based games",
          "url" : "https:\/\/developer.apple.com\/documentation\/GameKit\/creating-turn-based-games"
        },
        {
          "description" : "Let Game Center store and forward match data between players in a turn-based game.",
          "name" : "Starting turn-based matches and passing turns between players",
          "url" : "https:\/\/developer.apple.com\/documentation\/GameKit\/starting-turn-based-matches-and-passing-turns-between-players"
        },
        {
          "description" : "Notify players of match events by sending messages and game data.",
          "name" : "Sending messages to players in turn-based games",
          "url" : "https:\/\/developer.apple.com\/documentation\/GameKit\/sending-messages-to-players-in-turn-based-games"
        },
        {
          "description" : "Add the ability for players to exchange game data and send messages while waiting for their turns.",
          "name" : "Exchanging data between players in turn-based games",
          "url" : "https:\/\/developer.apple.com\/documentation\/GameKit\/exchanging-data-between-players-in-turn-based-games"
        },
        {
          "description" : "An interface that allows a player to invite other players to a turn-based match and automatch to fill any empty slots.",
          "name" : "GKTurnBasedMatchmakerViewController",
          "url" : "https:\/\/developer.apple.com\/documentation\/GameKit\/GKTurnBasedMatchmakerViewController"
        },
        {
          "description" : "A participant in a turn-based match.",
          "name" : "GKTurnBasedParticipant",
          "url" : "https:\/\/developer.apple.com\/documentation\/GameKit\/GKTurnBasedParticipant"
        },
        {
          "description" : "The protocol that handles turn-based and data-exchange events between participants in a match.",
          "name" : "GKTurnBasedEventListener",
          "url" : "https:\/\/developer.apple.com\/documentation\/GameKit\/GKTurnBasedEventListener"
        },
        {
          "description" : "Exchange request information that participants send in a turn-based match.",
          "name" : "GKTurnBasedExchange",
          "url" : "https:\/\/developer.apple.com\/documentation\/GameKit\/GKTurnBasedExchange"
        },
        {
          "description" : "Details about a recipient’s response to an exchange request.",
          "name" : "GKTurnBasedExchangeReply",
          "url" : "https:\/\/developer.apple.com\/documentation\/GameKit\/GKTurnBasedExchangeReply"
        },
        {
          "description" : "A Boolean value indicating whether GameKit can add badges to a turn-based game icon.",
          "name" : "GKGameCenterBadgingDisabled",
          "url" : "https:\/\/developer.apple.com\/documentation\/BundleResources\/Information-Property-List\/GKGameCenterBadgingDisabled"
        }
      ],
      "title" : "Turn-based games"
    },
    {
      "content" : "",
      "items" : [
        {
          "name" : "NSObject"
        }
      ],
      "title" : "Inherits From"
    }
  ],
  "source" : "appleJSON",
  "title" : "GKTurnBasedMatch",
  "url" : "https:\/\/developer.apple.com\/documentation\/gamekit\/gkturnbasedmatch"
}