{
  "abstract" : "A time filter used to restrict which scores are displayed to the player.",
  "codeExamples" : [

  ],
  "contentHash" : "c9422d3744087a6c12f2558151d1cbf67e0e7c8bf20c7e2e28ab4041fe2105cd",
  "crawledAt" : "2025-12-04T21:00:30Z",
  "declaration" : {
    "code" : "@MainActor var timeScope: GKLeaderboard.TimeScope { get set }",
    "language" : "swift"
  },
  "id" : "26720A61-98D4-4B96-A459-8592EA75FC22",
  "kind" : "property",
  "language" : "swift",
  "module" : "GameKit",
  "overview" : "## Discussion\n\nThis property determines which tab view is displayed to the player. The default value is [doc:\/\/com.apple.gamekit\/documentation\/GameKit\/GKLeaderboard\/TimeScope-swift.enum\/allTime], which shows the best score each player has earned. For more information on time scopes, see [doc:\/\/com.apple.gamekit\/documentation\/GameKit\/GKLeaderboard].\n\nIf the player changes which tab they view, the `timeScope` property is automatically updated. For example, you can read the `timeScope` property after the view controller is dismissed, and set that value the next time you initialize a new leaderboard view controller.",
  "platforms" : [
    "macOS",
    "visionOS"
  ],
  "rawMarkdown" : "---\nsource: https:\/\/developer.apple.com\/documentation\/GameKit\/GKLeaderboardViewController\/timeScope\ncrawled: 2025-12-04T21:00:30Z\n---\n\n# timeScope\n\n**Instance Property**\n\nA time filter used to restrict which scores are displayed to the player.\n\n## Declaration\n\n```swift\n@MainActor var timeScope: GKLeaderboard.TimeScope { get set }\n```\n\n## Discussion\n\nThis property determines which tab view is displayed to the player. The default value is [doc:\/\/com.apple.gamekit\/documentation\/GameKit\/GKLeaderboard\/TimeScope-swift.enum\/allTime], which shows the best score each player has earned. For more information on time scopes, see [doc:\/\/com.apple.gamekit\/documentation\/GameKit\/GKLeaderboard].\n\nIf the player changes which tab they view, the `timeScope` property is automatically updated. For example, you can read the `timeScope` property after the view controller is dismissed, and set that value the next time you initialize a new leaderboard view controller.\n\n## Configuring the Leaderboard View Controller\n\n- **category**: The named leaderboard that is displayed by the view controller.\n- **leaderboardDelegate**: The view controller’s delegate.\n\n",
  "sections" : [
    {
      "content" : "",
      "items" : [
        {
          "description" : "The named leaderboard that is displayed by the view controller.",
          "name" : "category",
          "url" : "https:\/\/developer.apple.com\/documentation\/GameKit\/GKLeaderboardViewController\/category"
        },
        {
          "description" : "The view controller’s delegate.",
          "name" : "leaderboardDelegate",
          "url" : "https:\/\/developer.apple.com\/documentation\/GameKit\/GKLeaderboardViewController\/leaderboardDelegate"
        }
      ],
      "title" : "Configuring the Leaderboard View Controller"
    }
  ],
  "source" : "appleJSON",
  "title" : "timeScope",
  "url" : "https:\/\/developer.apple.com\/documentation\/GameKit\/GKLeaderboardViewController\/timeScope"
}