{
  "abstract" : "Called when the leaderboard view is dismissed.",
  "codeExamples" : [

  ],
  "contentHash" : "21d66898467d91248cc5dc678a0d03f7668c0cdfe000690175f70d721c87faa7",
  "crawledAt" : "2025-12-05T19:44:45Z",
  "declaration" : {
    "code" : "func leaderboardViewControllerDidFinish(_ viewController: GKLeaderboardViewController!)",
    "language" : "swift"
  },
  "id" : "4C04FC4F-896D-46FF-AE51-8F9C4256F769",
  "kind" : "method",
  "language" : "swift",
  "module" : "GameKit",
  "overview" : "## Discussion\n\nYour delegate should dismiss the view controller. If your game paused any gameplay or other activities, it can restart those services in this method.",
  "platforms" : [
    "macOS",
    "visionOS"
  ],
  "rawMarkdown" : "---\nsource: https:\/\/developer.apple.com\/documentation\/GameKit\/GKLeaderboardViewControllerDelegate\/leaderboardViewControllerDidFinish(_:)\ncrawled: 2025-12-05T19:44:45Z\n---\n\n# leaderboardViewControllerDidFinish(_:)\n\n**Instance Method**\n\nCalled when the leaderboard view is dismissed.\n\n## Declaration\n\n```swift\nfunc leaderboardViewControllerDidFinish(_ viewController: GKLeaderboardViewController!)\n```\n\n## Parameters\n\n- **viewController**: The leaderboard view controller that was dismissed by the player.\n\n## Discussion\n\nYour delegate should dismiss the view controller. If your game paused any gameplay or other activities, it can restart those services in this method.\n\n",
  "sections" : [

  ],
  "source" : "appleJSON",
  "title" : "leaderboardViewControllerDidFinish(_:)",
  "url" : "https:\/\/developer.apple.com\/documentation\/GameKit\/GKLeaderboardViewControllerDelegate\/leaderboardViewControllerDidFinish(_:)"
}