{
  "abstract" : "A block that GameKit calls when an invitation to join a match is accepted by the local player.",
  "codeExamples" : [

  ],
  "contentHash" : "8c9d7e20afcc39a5803dff5172428a13519eae1894a80d9da36495caea0c8dd0",
  "crawledAt" : "2025-12-01T17:11:45Z",
  "declaration" : {
    "code" : "var inviteHandler: ((GKInvite, [Any]?) -> Void)? { get set }",
    "language" : "swift"
  },
  "id" : "8607AD7B-4AC5-46C3-BF60-D690A6B6ACD8",
  "kind" : "property",
  "module" : "GameKit",
  "overview" : "## Discussion\n\nThe block takes the following parameters:\n\nYour block needs to respond to the invitation in one of two ways:\n\nIf your game receives an invitation while it’s running, it needs to transition to multiplayer play. It must clean up any existing content, such as ending the current match the player is playing, and then process the invitation.",
  "platforms" : [
    "macOS",
    "visionOS"
  ],
  "rawMarkdown" : "---\nsource: https:\/\/developer.apple.com\/documentation\/gamekit\/gkmatchmaker\/invitehandler\ncrawled: 2025-12-01T17:11:45Z\n---\n\n# inviteHandler\n\n**Instance Property**\n\nA block that GameKit calls when an invitation to join a match is accepted by the local player.\n\n## Declaration\n\n```swift\nvar inviteHandler: ((GKInvite, [Any]?) -> Void)? { get set }\n```\n\n## Discussion\n\nThe block takes the following parameters:\n\n\n\nYour block needs to respond to the invitation in one of two ways:\n\n- Display the standard user interface by initializing a new [doc:\/\/com.apple.gamekit\/documentation\/GameKit\/GKMatchmakerViewController] object, passing the invitation object and the list of player identifiers as parameters.\n- Create a match programmatically by calling the [doc:\/\/com.apple.gamekit\/documentation\/GameKit\/GKMatchmaker\/match(for:completionHandler:)] method on the shared matchmaker instance.\n\nIf your game receives an invitation while it’s running, it needs to transition to multiplayer play. It must clean up any existing content, such as ending the current match the player is playing, and then process the invitation.\n\n",
  "sections" : [

  ],
  "source" : "appleJSON",
  "title" : "inviteHandler",
  "url" : "https:\/\/developer.apple.com\/documentation\/gamekit\/gkmatchmaker\/invitehandler"
}