{
  "abstract" : "Specifies the direction in which text is displayed.",
  "codeExamples" : [

  ],
  "contentHash" : "1a8da8365a675f23e7382634e8af03ce39c15f96d0e8da203f3f366a19cdc170",
  "crawledAt" : "2025-12-02T20:54:09Z",
  "id" : "B90BF60A-735B-48C7-B446-86E021757ACB",
  "kind" : "article",
  "language" : "swift",
  "overview" : "## Overview\n\nUse the `layoutDirection` attribute to set the language layout direction for a template.\n\n### Values for layoutDirection\n\n### Elements that Use layoutDirection\n\n`layoutDirection` can be used with any full-page template.",
  "rawMarkdown" : "---\nsource: https:\/\/developer.apple.com\/documentation\/TVML\/layoutdirection\ncrawled: 2025-12-02T20:54:09Z\n---\n\n# layoutDirection\n\n**Article**\n\nSpecifies the direction in which text is displayed.\n\n## Overview\n\nUse the `layoutDirection` attribute to set the language layout direction for a template.\n\n### Values for layoutDirection\n\n\n\n### Elements that Use layoutDirection\n\n`layoutDirection` can be used with any full-page template.\n\n## Valid TVML Attributes\n\n- **autoHighlight**: Specifies that the element should initially be in focus.\n- **binding**: Associates information in a data item with an element.\n- **prototype**: Associates a data item type with an element.\n- **theme**: Sets the color scheme for an element.\n\n",
  "sections" : [
    {
      "content" : "",
      "items" : [
        {
          "description" : "Specifies that the element should initially be in focus.",
          "name" : "autoHighlight",
          "url" : "https:\/\/developer.apple.com\/documentation\/TVML\/autohighlight"
        },
        {
          "description" : "Associates information in a data item with an element.",
          "name" : "binding",
          "url" : "https:\/\/developer.apple.com\/documentation\/TVML\/binding"
        },
        {
          "description" : "Associates a data item type with an element.",
          "name" : "prototype",
          "url" : "https:\/\/developer.apple.com\/documentation\/TVML\/prototype"
        },
        {
          "description" : "Sets the color scheme for an element.",
          "name" : "theme",
          "url" : "https:\/\/developer.apple.com\/documentation\/TVML\/theme"
        }
      ],
      "title" : "Valid TVML Attributes"
    }
  ],
  "source" : "appleJSON",
  "title" : "layoutDirection",
  "url" : "https:\/\/developer.apple.com\/documentation\/TVML\/layoutdirection"
}