{
  "abstract" : "Initializes the SharePlay sharing controller with a closure that creates the activity object.",
  "codeExamples" : [

  ],
  "contentHash" : "11304fd403fda63b0a2c5b5cdeb79fd306697c77be6a6464c21c9d9bff90444d",
  "crawledAt" : "2025-12-02T00:52:10Z",
  "declaration" : {
    "code" : "@MainActor init<ActivityType>(preparationHandler: @escaping () async throws -> ActivityType) where ActivityType : GroupActivity",
    "language" : "swift"
  },
  "id" : "19A02514-EB08-4268-B55F-9C4B7FC10724",
  "kind" : "unknown",
  "module" : "GroupActivities",
  "overview" : "## Discussion\n\nThe initializer executes the closure asynchronously so that your app can present the view controller in a timely manner. Use this method when the creation of the [doc:\/\/com.apple.GroupActivities\/documentation\/GroupActivities\/GroupActivity] object might take a significant amount of time.",
  "platforms" : [
    "macOS"
  ],
  "rawMarkdown" : "---\nsource: https:\/\/developer.apple.com\/documentation\/GroupActivities\/GroupActivitySharingController-4gtfk\/init(preparationHandler:)\ncrawled: 2025-12-02T00:52:10Z\n---\n\n# init(preparationHandler:)\n\n**Initializer**\n\nInitializes the SharePlay sharing controller with a closure that creates the activity object.\n\n## Declaration\n\n```swift\n@MainActor init<ActivityType>(preparationHandler: @escaping () async throws -> ActivityType) where ActivityType : GroupActivity\n```\n\n## Parameters\n\n- **preparationHandler**: A closure that takes no parameters and returns the activity object.\n\n## Discussion\n\nThe initializer executes the closure asynchronously so that your app can present the view controller in a timely manner. Use this method when the creation of the [doc:\/\/com.apple.GroupActivities\/documentation\/GroupActivities\/GroupActivity] object might take a significant amount of time.\n\n## Creating the group activity sharing controller\n\n- **init(_:)**: Initializes the sharing controller with the specified activity and type information.\n\n",
  "sections" : [
    {
      "content" : "",
      "items" : [
        {
          "description" : "Initializes the sharing controller with the specified activity and type information.",
          "name" : "init(_:)",
          "url" : "https:\/\/developer.apple.com\/documentation\/GroupActivities\/GroupActivitySharingController-4gtfk\/init(_:)"
        }
      ],
      "title" : "Creating the group activity sharing controller"
    }
  ],
  "source" : "appleJSON",
  "title" : "init(preparationHandler:)",
  "url" : "https:\/\/developer.apple.com\/documentation\/GroupActivities\/GroupActivitySharingController-4gtfk\/init(preparationHandler:)"
}