{
  "abstract" : "A representation of an app that users can access during an assessment.",
  "codeExamples" : [
    {
      "code" : "% codesign -v -d \/Applications\/MyApp.app",
      "language" : "shell"
    }
  ],
  "conformsTo" : [
    "CVarArg",
    "CustomDebugStringConvertible",
    "CustomStringConvertible",
    "Equatable",
    "Hashable",
    "NSCopying",
    "NSObjectProtocol"
  ],
  "contentHash" : "3f69e913de4b1911e59eaea94da991002fea2e5b3e45a16c25c6a73951d001b1",
  "crawledAt" : "2025-12-02T18:32:31Z",
  "declaration" : {
    "code" : "class AEAssessmentApplication",
    "language" : "swift"
  },
  "id" : "E81B0B11-6E5D-4BAF-951F-4DC0D59FDA8B",
  "kind" : "class",
  "language" : "swift",
  "module" : "Automatic Assessment Configuration",
  "overview" : "## Overview\n\nUse an instance of this class when you want to make an app besides yours, like a calculator or a dictionary, available during an assessment. Create a representation of the app that you want to allow using the app’s bundle identifier and optionally the identifier of the team that distributes the app. You can get both identifiers for an app that you have installed using the `codesign` command line utility:\n\nBy default, the system requires that the app’s code signature is valid, and that either Apple distributes the app, or the developer notarizes the app or distributes it through the App Store. You can relax these requirements by setting the [doc:\/\/com.apple.automaticassessmentconfiguration\/documentation\/AutomaticAssessmentConfiguration\/AEAssessmentApplication\/requiresSignatureValidation] property to `false`, but that creates a potential security risk. In that case, the only requirement is that the app has the specified bundle and team identifiers. Prefer to keep the signature requirement.\n\nAdd the app to a session configuration by calling the [doc:\/\/com.apple.automaticassessmentconfiguration\/documentation\/AutomaticAssessmentConfiguration\/AEAssessmentConfiguration\/setConfiguration(_:for:)] method, and then apply the configuration to either a new session that you create, or an existing session with the [doc:\/\/com.apple.automaticassessmentconfiguration\/documentation\/AutomaticAssessmentConfiguration\/AEAssessmentSession\/update(to:)] method.",
  "platforms" : [
    "iOS",
    "iPadOS",
    "Mac Catalyst",
    "macOS"
  ],
  "rawMarkdown" : "---\nsource: https:\/\/developer.apple.com\/documentation\/AutomaticAssessmentConfiguration\/AEAssessmentApplication\ncrawled: 2025-12-02T18:32:31Z\n---\n\n# AEAssessmentApplication\n\n**Class**\n\nA representation of an app that users can access during an assessment.\n\n## Declaration\n\n```swift\nclass AEAssessmentApplication\n```\n\n## Overview\n\nUse an instance of this class when you want to make an app besides yours, like a calculator or a dictionary, available during an assessment. Create a representation of the app that you want to allow using the app’s bundle identifier and optionally the identifier of the team that distributes the app. You can get both identifiers for an app that you have installed using the `codesign` command line utility:\n\n```shell\n% codesign -v -d \/Applications\/MyApp.app\n```\n\nBy default, the system requires that the app’s code signature is valid, and that either Apple distributes the app, or the developer notarizes the app or distributes it through the App Store. You can relax these requirements by setting the [doc:\/\/com.apple.automaticassessmentconfiguration\/documentation\/AutomaticAssessmentConfiguration\/AEAssessmentApplication\/requiresSignatureValidation] property to `false`, but that creates a potential security risk. In that case, the only requirement is that the app has the specified bundle and team identifiers. Prefer to keep the signature requirement.\n\nAdd the app to a session configuration by calling the [doc:\/\/com.apple.automaticassessmentconfiguration\/documentation\/AutomaticAssessmentConfiguration\/AEAssessmentConfiguration\/setConfiguration(_:for:)] method, and then apply the configuration to either a new session that you create, or an existing session with the [doc:\/\/com.apple.automaticassessmentconfiguration\/documentation\/AutomaticAssessmentConfiguration\/AEAssessmentSession\/update(to:)] method.\n\n## Creating an assessment application\n\n- **init(bundleIdentifier:teamIdentifier:)**: Creates a representation of an app using its bundle and team identifiers.\n- **init(bundleIdentifier:)**: Creates a representation of an app using its bundle identifier.\n- **bundleIdentifier**: The bundle identifier of the app.\n- **teamIdentifier**: The team identifier of the app.\n\n## Requiring code-signed apps\n\n- **requiresSignatureValidation**: A Boolean that indicates whether the session requires the app to have a valid code signature to run.\n\n## Allowing access to other apps\n\n- **setConfiguration(_:for:)**: Adds an app to the list of apps available during an assessment.\n- **configurationsByApplication**: The collection of apps available during an assessment, along with their associated configurations.\n- **remove(_:)**: Removes the availability of a previously allowed app.\n- **mainParticipantConfiguration**: The app-specific configuration for the app that invokes the assessment.\n- **AEAssessmentParticipantConfiguration**: Configuration information for an app that’s available during an assessment.\n\n## Inherits From\n\n- NSObject\n\n## Conforms To\n\n- CVarArg\n- CustomDebugStringConvertible\n- CustomStringConvertible\n- Equatable\n- Hashable\n- NSCopying\n- NSObjectProtocol\n\n",
  "sections" : [
    {
      "content" : "",
      "items" : [
        {
          "description" : "Creates a representation of an app using its bundle and team identifiers.",
          "name" : "init(bundleIdentifier:teamIdentifier:)",
          "url" : "https:\/\/developer.apple.com\/documentation\/AutomaticAssessmentConfiguration\/AEAssessmentApplication\/init(bundleIdentifier:teamIdentifier:)"
        },
        {
          "description" : "Creates a representation of an app using its bundle identifier.",
          "name" : "init(bundleIdentifier:)",
          "url" : "https:\/\/developer.apple.com\/documentation\/AutomaticAssessmentConfiguration\/AEAssessmentApplication\/init(bundleIdentifier:)"
        },
        {
          "description" : "The bundle identifier of the app.",
          "name" : "bundleIdentifier",
          "url" : "https:\/\/developer.apple.com\/documentation\/AutomaticAssessmentConfiguration\/AEAssessmentApplication\/bundleIdentifier"
        },
        {
          "description" : "The team identifier of the app.",
          "name" : "teamIdentifier",
          "url" : "https:\/\/developer.apple.com\/documentation\/AutomaticAssessmentConfiguration\/AEAssessmentApplication\/teamIdentifier"
        }
      ],
      "title" : "Creating an assessment application"
    },
    {
      "content" : "",
      "items" : [
        {
          "description" : "A Boolean that indicates whether the session requires the app to have a valid code signature to run.",
          "name" : "requiresSignatureValidation",
          "url" : "https:\/\/developer.apple.com\/documentation\/AutomaticAssessmentConfiguration\/AEAssessmentApplication\/requiresSignatureValidation"
        }
      ],
      "title" : "Requiring code-signed apps"
    },
    {
      "content" : "",
      "items" : [
        {
          "description" : "Adds an app to the list of apps available during an assessment.",
          "name" : "setConfiguration(_:for:)",
          "url" : "https:\/\/developer.apple.com\/documentation\/AutomaticAssessmentConfiguration\/AEAssessmentConfiguration\/setConfiguration(_:for:)"
        },
        {
          "description" : "The collection of apps available during an assessment, along with their associated configurations.",
          "name" : "configurationsByApplication",
          "url" : "https:\/\/developer.apple.com\/documentation\/AutomaticAssessmentConfiguration\/AEAssessmentConfiguration\/configurationsByApplication"
        },
        {
          "description" : "Removes the availability of a previously allowed app.",
          "name" : "remove(_:)",
          "url" : "https:\/\/developer.apple.com\/documentation\/AutomaticAssessmentConfiguration\/AEAssessmentConfiguration\/remove(_:)"
        },
        {
          "description" : "The app-specific configuration for the app that invokes the assessment.",
          "name" : "mainParticipantConfiguration",
          "url" : "https:\/\/developer.apple.com\/documentation\/AutomaticAssessmentConfiguration\/AEAssessmentConfiguration\/mainParticipantConfiguration"
        },
        {
          "description" : "Configuration information for an app that’s available during an assessment.",
          "name" : "AEAssessmentParticipantConfiguration",
          "url" : "https:\/\/developer.apple.com\/documentation\/AutomaticAssessmentConfiguration\/AEAssessmentParticipantConfiguration"
        }
      ],
      "title" : "Allowing access to other apps"
    },
    {
      "content" : "",
      "items" : [
        {
          "name" : "NSObject"
        }
      ],
      "title" : "Inherits From"
    }
  ],
  "source" : "appleJSON",
  "title" : "AEAssessmentApplication",
  "url" : "https:\/\/developer.apple.com\/documentation\/AutomaticAssessmentConfiguration\/AEAssessmentApplication"
}