{
  "abstract" : "A session that your app uses to protect an assessment.",
  "codeExamples" : [

  ],
  "conformsTo" : [
    "CVarArg",
    "CustomDebugStringConvertible",
    "CustomStringConvertible",
    "Equatable",
    "Hashable",
    "NSObjectProtocol"
  ],
  "contentHash" : "f9c30de7ec3eddb2846f51d9395f69f67fd4189e9ee35b8fc0a62130fa3185c6",
  "crawledAt" : "2025-12-02T15:47:59Z",
  "declaration" : {
    "code" : "class AEAssessmentSession",
    "language" : "swift"
  },
  "id" : "366E3047-542F-43D6-A178-EC38F0B1A75A",
  "kind" : "class",
  "language" : "swift",
  "module" : "Automatic Assessment Configuration",
  "overview" : "## Overview\n\nUse the [doc:\/\/com.apple.automaticassessmentconfiguration\/documentation\/AutomaticAssessmentConfiguration\/AEAssessmentSession] class to manage an assessment session. The system allows only one active session at a time across all processes. The first session to run gets exclusive access to the system; subsequent session attempts fail until the first session ends.\n\nTo create an assessment session, pass a new [doc:\/\/com.apple.automaticassessmentconfiguration\/documentation\/AutomaticAssessmentConfiguration\/AEAssessmentConfiguration] instance to the [doc:\/\/com.apple.automaticassessmentconfiguration\/documentation\/AutomaticAssessmentConfiguration\/AEAssessmentSession\/init(configuration:)] method. Then, provide the session with a delegate that conforms to the [doc:\/\/com.apple.automaticassessmentconfiguration\/documentation\/AutomaticAssessmentConfiguration\/AEAssessmentSessionDelegate] protocol:\n\nYou can indicate exceptions to the restrictions imposed by an assessment session by setting the properties of the configuration instance, or you can use the default restrictions as shown above. The session tells its delegate about state changes during its life cycle. To start a session, call the session’s [doc:\/\/com.apple.automaticassessmentconfiguration\/documentation\/AutomaticAssessmentConfiguration\/AEAssessmentSession\/begin()] method:\n\nThe method returns immediately, and the session starts disabling system features. After achieving the desired state, the session calls its delegate’s [doc:\/\/com.apple.automaticassessmentconfiguration\/documentation\/AutomaticAssessmentConfiguration\/AEAssessmentSessionDelegate\/assessmentSessionDidBegin(_:)] method. Only after receiving this callback is it safe to begin your assessment. Be sure to keep a strong reference to the session as long as you want it to remain active. If the system deallocates an active session, the session automatically ends.\n\nAfter completing an assessment and hiding all sensitive information, call the session’s [doc:\/\/com.apple.automaticassessmentconfiguration\/documentation\/AutomaticAssessmentConfiguration\/AEAssessmentSession\/end()] method:\n\nAfter making the call, wait for the session to call its delegate’s [doc:\/\/com.apple.automaticassessmentconfiguration\/documentation\/AutomaticAssessmentConfiguration\/AEAssessmentSessionDelegate\/assessmentSessionDidEnd(_:)] method before reporting assessment completion to the user.\n\nDuring assessment, the session’s delegate might receive an [doc:\/\/com.apple.automaticassessmentconfiguration\/documentation\/AutomaticAssessmentConfiguration\/AEAssessmentSessionDelegate\/assessmentSession(_:wasInterruptedWithError:)] callback to indicate a failure. If this happens, immediately stop the assessment, hide all sensitive content, and end the session. Because it might take time for your app to finalize the assessment, the session relies on your app to call the session’s [doc:\/\/com.apple.automaticassessmentconfiguration\/documentation\/AutomaticAssessmentConfiguration\/AEAssessmentSession\/end()] method:",
  "platforms" : [
    "iOS",
    "iPadOS",
    "Mac Catalyst",
    "macOS"
  ],
  "rawMarkdown" : "---\nsource: https:\/\/developer.apple.com\/documentation\/AutomaticAssessmentConfiguration\/AEAssessmentSession\ncrawled: 2025-12-02T15:47:59Z\n---\n\n# AEAssessmentSession\n\n**Class**\n\nA session that your app uses to protect an assessment.\n\n## Declaration\n\n```swift\nclass AEAssessmentSession\n```\n\n## Overview\n\nUse the [doc:\/\/com.apple.automaticassessmentconfiguration\/documentation\/AutomaticAssessmentConfiguration\/AEAssessmentSession] class to manage an assessment session. The system allows only one active session at a time across all processes. The first session to run gets exclusive access to the system; subsequent session attempts fail until the first session ends.\n\nTo create an assessment session, pass a new [doc:\/\/com.apple.automaticassessmentconfiguration\/documentation\/AutomaticAssessmentConfiguration\/AEAssessmentConfiguration] instance to the [doc:\/\/com.apple.automaticassessmentconfiguration\/documentation\/AutomaticAssessmentConfiguration\/AEAssessmentSession\/init(configuration:)] method. Then, provide the session with a delegate that conforms to the [doc:\/\/com.apple.automaticassessmentconfiguration\/documentation\/AutomaticAssessmentConfiguration\/AEAssessmentSessionDelegate] protocol:\n\n\n\nYou can indicate exceptions to the restrictions imposed by an assessment session by setting the properties of the configuration instance, or you can use the default restrictions as shown above. The session tells its delegate about state changes during its life cycle. To start a session, call the session’s [doc:\/\/com.apple.automaticassessmentconfiguration\/documentation\/AutomaticAssessmentConfiguration\/AEAssessmentSession\/begin()] method:\n\n\n\nThe method returns immediately, and the session starts disabling system features. After achieving the desired state, the session calls its delegate’s [doc:\/\/com.apple.automaticassessmentconfiguration\/documentation\/AutomaticAssessmentConfiguration\/AEAssessmentSessionDelegate\/assessmentSessionDidBegin(_:)] method. Only after receiving this callback is it safe to begin your assessment. Be sure to keep a strong reference to the session as long as you want it to remain active. If the system deallocates an active session, the session automatically ends.\n\n\n\nAfter completing an assessment and hiding all sensitive information, call the session’s [doc:\/\/com.apple.automaticassessmentconfiguration\/documentation\/AutomaticAssessmentConfiguration\/AEAssessmentSession\/end()] method:\n\n\n\nAfter making the call, wait for the session to call its delegate’s [doc:\/\/com.apple.automaticassessmentconfiguration\/documentation\/AutomaticAssessmentConfiguration\/AEAssessmentSessionDelegate\/assessmentSessionDidEnd(_:)] method before reporting assessment completion to the user.\n\nDuring assessment, the session’s delegate might receive an [doc:\/\/com.apple.automaticassessmentconfiguration\/documentation\/AutomaticAssessmentConfiguration\/AEAssessmentSessionDelegate\/assessmentSession(_:wasInterruptedWithError:)] callback to indicate a failure. If this happens, immediately stop the assessment, hide all sensitive content, and end the session. Because it might take time for your app to finalize the assessment, the session relies on your app to call the session’s [doc:\/\/com.apple.automaticassessmentconfiguration\/documentation\/AutomaticAssessmentConfiguration\/AEAssessmentSession\/end()] method:\n\n\n\n## Creating a session\n\n- **init(configuration:)**: Creates a new assessment session.\n\n## Managing session configuration\n\n- **update(to:)**: Changes the session to use the specified configuration.\n- **configuration**: The current configuration of the session.\n- **supportsMultipleParticipants**: A Boolean that indicates whether the current device or platform supports a configuration with one or more participant applications.\n- **supportsConfigurationUpdates**: A Boolean that indicates whether the current device or platform supports updating a session’s configuration after the session has begun.\n\n## Responding to session updates\n\n- **delegate**: A delegate to which the session provides state change updates.\n- **AEAssessmentSessionDelegate**: An interface that the session uses to provide information about session state changes to a delegate.\n\n## Starting and stopping a session\n\n- **begin()**: Starts an assessment session.\n- **end()**: Ends an assessment session.\n- **isActive**: A Boolean that indicates whether an assessment session is running.\n\n## Sessions\n\n- **Preparing an educational assessment app for distribution**: Ensure your app maintains academic integrity by reviewing assessment practices and managing system capabilities.\n- **Build an Educational Assessment App**: Ensure the academic integrity of your assessment app by using Automatic Assessment Configuration.\n- **AEAssessmentConfiguration**: Configuration information for an assessment session.\n\n## Inherits From\n\n- NSObject\n\n## Conforms To\n\n- CVarArg\n- CustomDebugStringConvertible\n- CustomStringConvertible\n- Equatable\n- Hashable\n- NSObjectProtocol\n\n",
  "sections" : [
    {
      "content" : "",
      "items" : [
        {
          "description" : "Creates a new assessment session.",
          "name" : "init(configuration:)",
          "url" : "https:\/\/developer.apple.com\/documentation\/AutomaticAssessmentConfiguration\/AEAssessmentSession\/init(configuration:)"
        }
      ],
      "title" : "Creating a session"
    },
    {
      "content" : "",
      "items" : [
        {
          "description" : "Changes the session to use the specified configuration.",
          "name" : "update(to:)",
          "url" : "https:\/\/developer.apple.com\/documentation\/AutomaticAssessmentConfiguration\/AEAssessmentSession\/update(to:)"
        },
        {
          "description" : "The current configuration of the session.",
          "name" : "configuration",
          "url" : "https:\/\/developer.apple.com\/documentation\/AutomaticAssessmentConfiguration\/AEAssessmentSession\/configuration"
        },
        {
          "description" : "A Boolean that indicates whether the current device or platform supports a configuration with one or more participant applications.",
          "name" : "supportsMultipleParticipants",
          "url" : "https:\/\/developer.apple.com\/documentation\/AutomaticAssessmentConfiguration\/AEAssessmentSession\/supportsMultipleParticipants"
        },
        {
          "description" : "A Boolean that indicates whether the current device or platform supports updating a session’s configuration after the session has begun.",
          "name" : "supportsConfigurationUpdates",
          "url" : "https:\/\/developer.apple.com\/documentation\/AutomaticAssessmentConfiguration\/AEAssessmentSession\/supportsConfigurationUpdates"
        }
      ],
      "title" : "Managing session configuration"
    },
    {
      "content" : "",
      "items" : [
        {
          "description" : "A delegate to which the session provides state change updates.",
          "name" : "delegate",
          "url" : "https:\/\/developer.apple.com\/documentation\/AutomaticAssessmentConfiguration\/AEAssessmentSession\/delegate"
        },
        {
          "description" : "An interface that the session uses to provide information about session state changes to a delegate.",
          "name" : "AEAssessmentSessionDelegate",
          "url" : "https:\/\/developer.apple.com\/documentation\/AutomaticAssessmentConfiguration\/AEAssessmentSessionDelegate"
        }
      ],
      "title" : "Responding to session updates"
    },
    {
      "content" : "",
      "items" : [
        {
          "description" : "Starts an assessment session.",
          "name" : "begin()",
          "url" : "https:\/\/developer.apple.com\/documentation\/AutomaticAssessmentConfiguration\/AEAssessmentSession\/begin()"
        },
        {
          "description" : "Ends an assessment session.",
          "name" : "end()",
          "url" : "https:\/\/developer.apple.com\/documentation\/AutomaticAssessmentConfiguration\/AEAssessmentSession\/end()"
        },
        {
          "description" : "A Boolean that indicates whether an assessment session is running.",
          "name" : "isActive",
          "url" : "https:\/\/developer.apple.com\/documentation\/AutomaticAssessmentConfiguration\/AEAssessmentSession\/isActive"
        }
      ],
      "title" : "Starting and stopping a session"
    },
    {
      "content" : "",
      "items" : [
        {
          "description" : "Ensure your app maintains academic integrity by reviewing assessment practices and managing system capabilities.",
          "name" : "Preparing an educational assessment app for distribution",
          "url" : "https:\/\/developer.apple.com\/documentation\/AutomaticAssessmentConfiguration\/preparing-an-educational-assessment-app-for-distribution"
        },
        {
          "description" : "Ensure the academic integrity of your assessment app by using Automatic Assessment Configuration.",
          "name" : "Build an Educational Assessment App",
          "url" : "https:\/\/developer.apple.com\/documentation\/AutomaticAssessmentConfiguration\/build-an-educational-assessment-app"
        },
        {
          "description" : "Configuration information for an assessment session.",
          "name" : "AEAssessmentConfiguration",
          "url" : "https:\/\/developer.apple.com\/documentation\/AutomaticAssessmentConfiguration\/AEAssessmentConfiguration"
        }
      ],
      "title" : "Sessions"
    },
    {
      "content" : "",
      "items" : [
        {
          "name" : "NSObject"
        }
      ],
      "title" : "Inherits From"
    }
  ],
  "source" : "appleJSON",
  "title" : "AEAssessmentSession",
  "url" : "https:\/\/developer.apple.com\/documentation\/AutomaticAssessmentConfiguration\/AEAssessmentSession"
}