{
  "abstract" : "Samples data from an image with provisions for offsetting and tiling in UV space.",
  "codeExamples" : [

  ],
  "contentHash" : "aeb5e0414c8af354e11c38d7d87baeb5d37b0496e2a76bdfcb76bb9ebcae7823",
  "crawledAt" : "2025-12-06T02:26:26Z",
  "id" : "D20FCE04-216E-4979-87CE-F11EEDE7CCE6",
  "kind" : "unknown",
  "language" : "swift",
  "module" : "ShaderGraph",
  "overview" : "## Parameter Types\n\n## Parameter descriptions\n\n## Discussion\n\nThe `Tiled Image` material node maps a texture onto a surface with a repeating tiled pattern. It allows you to specify a texture image and control its tiling and real-world size properties.\n\nThe `UV Tiling` parameter repeats the given file input to produce an image. The `Real World Image Size` parameter determines the image’s size. The resulting image is then applied to a single square 0-1 UV tile. The `Real World Tile Size` parameter determines the size of this tile. The size of the tile and the size of the image may differ. If the image size is larger than the tile it wants to be applied to, the resulting texture only shows part of the image. If the size of the tile is larger than the image, the image repeats in the resulting texture.\n\nBelow is an example of a simple node graph that uses the Tiled Image node:\n\n\n\nIf the `UV Tiling` parameter is `(2,2)`, the pattern repeats twice horizontally and twice vertically:\n\n",
  "rawMarkdown" : "---\nsource: https:\/\/developer.apple.com\/documentation\/ShaderGraph\/2D-Texture\/Tiled-Image\ncrawled: 2025-12-06T02:26:26Z\n---\n\n# Tiled Image\n\n**ShaderGraph Node**\n\nSamples data from an image with provisions for offsetting and tiling in UV space.\n\n## Parameter Types\n\n\n\n## Parameter descriptions\n\n\n\n## Discussion\n\nThe `Tiled Image` material node maps a texture onto a surface with a repeating tiled pattern. It allows you to specify a texture image and control its tiling and real-world size properties.\n\nThe `UV Tiling` parameter repeats the given file input to produce an image. The `Real World Image Size` parameter determines the image’s size. The resulting image is then applied to a single square 0-1 UV tile. The `Real World Tile Size` parameter determines the size of this tile. The size of the tile and the size of the image may differ. If the image size is larger than the tile it wants to be applied to, the resulting texture only shows part of the image. If the size of the tile is larger than the image, the image repeats in the resulting texture.\n\n\n\nBelow is an example of a simple node graph that uses the Tiled Image node:\n\n\n\nIf the `UV Tiling` parameter is `(2,2)`, the pattern repeats twice horizontally and twice vertically:\n\n\n\n## Nodes\n\n- **Image**: A texture referencing a 2D image file.\n- **UV Texture**: A MaterialX version of USD UV Texture reader.\n- **Transform 2D**: A node that applies an affine transformation to a 2d input.\n\n",
  "sections" : [
    {
      "content" : "",
      "items" : [
        {
          "description" : "A texture referencing a 2D image file.",
          "name" : "Image",
          "url" : "https:\/\/developer.apple.com\/documentation\/ShaderGraph\/2D-Texture\/Image"
        },
        {
          "description" : "A MaterialX version of USD UV Texture reader.",
          "name" : "UV Texture",
          "url" : "https:\/\/developer.apple.com\/documentation\/ShaderGraph\/2D-Texture\/UV-Texture"
        },
        {
          "description" : "A node that applies an affine transformation to a 2d input.",
          "name" : "Transform 2D",
          "url" : "https:\/\/developer.apple.com\/documentation\/ShaderGraph\/2D-Texture\/Transform-2D"
        }
      ],
      "title" : "Nodes"
    }
  ],
  "source" : "appleJSON",
  "title" : "Tiled Image",
  "url" : "https:\/\/developer.apple.com\/documentation\/ShaderGraph\/2D-Texture\/Tiled-Image"
}