{
  "abstract" : "A 2D Worley noise generator.",
  "codeExamples" : [

  ],
  "contentHash" : "12266bbbb7dc0366db312059c0ec989448b689a71df5b64f9934d4aad585a4bd",
  "crawledAt" : "2025-12-06T02:26:25Z",
  "id" : "0499BA62-350D-4E59-8080-9BC0EC1BD8F1",
  "kind" : "unknown",
  "language" : "swift",
  "module" : "ShaderGraph",
  "overview" : "## Parameter Types\n\n## Parameter description\n\n# \n\n# Discussion\n\nThe `Worley Noise 2D` node procedurally generates nonuniform cellular regions. Creates a finite number of center points, and each region is a polygon that surrounds the points closest to each center point. Below is an example of a simple node graph that uses the `Worley Noise 2D` node to generate a black and white pattern procedurally:\n\n\n\nMultiply the incoming texture coordinates with a constant float, which changes the frequency of the generated noise. A higher value corresponds to the pattern repeating more often. You then run the output through a convert node to change it to a black and white color value.\nBelow is an example of a simple node graph that uses the `Worley Noise 2D` node to generate a black and white pattern procedurally:\n\n",
  "rawMarkdown" : "---\nsource: https:\/\/developer.apple.com\/documentation\/ShaderGraph\/2D-Procedural\/Worley-Noise-2D\ncrawled: 2025-12-06T02:26:25Z\n---\n\n# Worley Noise 2D\n\n**ShaderGraph Node**\n\nA 2D Worley noise generator.\n\n## Parameter Types\n\n\n\n## Parameter description\n\n\n\n# \n\n# Discussion\n\nThe `Worley Noise 2D` node procedurally generates nonuniform cellular regions. Creates a finite number of center points, and each region is a polygon that surrounds the points closest to each center point. Below is an example of a simple node graph that uses the `Worley Noise 2D` node to generate a black and white pattern procedurally:\n\n\n\nMultiply the incoming texture coordinates with a constant float, which changes the frequency of the generated noise. A higher value corresponds to the pattern repeating more often. You then run the output through a convert node to change it to a black and white color value.\nBelow is an example of a simple node graph that uses the `Worley Noise 2D` node to generate a black and white pattern procedurally:\n\n\n\n## Nodes\n\n- **Ramp Horizontal**: A left-to-right linear value ramp (gradient) generator.\n- **Ramp Vertical**: A top-to-bottom linear value ramp (gradient) generator.\n- **Ramp 4 Corners**: A four-point linear value ramp (gradient) generator.\n- **Split Horizontal**: A left-to-right split matte, split at a specified U value.\n- **Split Vertical**: A top-to-bottom split matte, split at a specified V value.\n- **Noise 2D**: A 2D Perlin noise generator.\n- **Cellular Noise 2D**: A 2D cellular noise generator.\n\n",
  "sections" : [
    {
      "content" : "",
      "items" : [
        {
          "description" : "A left-to-right linear value ramp (gradient) generator.",
          "name" : "Ramp Horizontal",
          "url" : "https:\/\/developer.apple.com\/documentation\/ShaderGraph\/2D-Procedural\/Ramp-Horizontal"
        },
        {
          "description" : "A top-to-bottom linear value ramp (gradient) generator.",
          "name" : "Ramp Vertical",
          "url" : "https:\/\/developer.apple.com\/documentation\/ShaderGraph\/2D-Procedural\/Ramp-Vertical"
        },
        {
          "description" : "A four-point linear value ramp (gradient) generator.",
          "name" : "Ramp 4 Corners",
          "url" : "https:\/\/developer.apple.com\/documentation\/ShaderGraph\/2D-Procedural\/Ramp-4-Corners"
        },
        {
          "description" : "A left-to-right split matte, split at a specified U value.",
          "name" : "Split Horizontal",
          "url" : "https:\/\/developer.apple.com\/documentation\/ShaderGraph\/2D-Procedural\/Split-Horizontal"
        },
        {
          "description" : "A top-to-bottom split matte, split at a specified V value.",
          "name" : "Split Vertical",
          "url" : "https:\/\/developer.apple.com\/documentation\/ShaderGraph\/2D-Procedural\/Split-Vertical"
        },
        {
          "description" : "A 2D Perlin noise generator.",
          "name" : "Noise 2D",
          "url" : "https:\/\/developer.apple.com\/documentation\/ShaderGraph\/2D-Procedural\/Noise-2D"
        },
        {
          "description" : "A 2D cellular noise generator.",
          "name" : "Cellular Noise 2D",
          "url" : "https:\/\/developer.apple.com\/documentation\/ShaderGraph\/2D-Procedural\/Cellular-Noise-2D"
        }
      ],
      "title" : "Nodes"
    }
  ],
  "source" : "appleJSON",
  "title" : "Worley Noise 2D",
  "url" : "https:\/\/developer.apple.com\/documentation\/ShaderGraph\/2D-Procedural\/Worley-Noise-2D"
}