{
  "abstract" : "A top-to-bottom split matte, split at a specified V value.",
  "codeExamples" : [

  ],
  "contentHash" : "d597ebb99281f3491684d863ae0af5771fb5227c25fd95d84913baec4a5e52df",
  "crawledAt" : "2025-12-06T00:56:27Z",
  "id" : "E9093C77-1FEA-4CF5-A80E-13286409E816",
  "kind" : "unknown",
  "language" : "swift",
  "module" : "ShaderGraph",
  "overview" : "## Parameter Types\n\n## Parameter description\n\n## Discussion\n\nThis node creates two distinct regions along the vertical axis. The value of the `Center` input determines the regions. A value of `0` establishes the center at the top-most, position causing the output to always be equal to the `Top` input. A value of `1` establishes the center at the bottom-most position. Below is a an example of a simple node graph that uses `Split Vertical` to create a split color:\n\n\n\nBy editing the center value, you change the texture to show a larger top or bottom region. The image below shows the resulting textures:\n\n",
  "rawMarkdown" : "---\nsource: https:\/\/developer.apple.com\/documentation\/ShaderGraph\/2D-Procedural\/Split-Vertical\ncrawled: 2025-12-06T00:56:27Z\n---\n\n# Split Vertical\n\n**ShaderGraph Node**\n\nA top-to-bottom split matte, split at a specified V value.\n\n## Parameter Types\n\n\n\n## Parameter description\n\n\n\n## Discussion\n\nThis node creates two distinct regions along the vertical axis. The value of the `Center` input determines the regions. A value of `0` establishes the center at the top-most, position causing the output to always be equal to the `Top` input. A value of `1` establishes the center at the bottom-most position. Below is a an example of a simple node graph that uses `Split Vertical` to create a split color:\n\n\n\nBy editing the center value, you change the texture to show a larger top or bottom region. The image below shows the resulting textures:\n\n\n\n\n\n## Nodes\n\n- **Ramp Horizontal**: A left-to-right linear value ramp (gradient) generator.\n- **Ramp Vertical**: A top-to-bottom linear value ramp (gradient) generator.\n- **Ramp 4 Corners**: A four-point linear value ramp (gradient) generator.\n- **Split Horizontal**: A left-to-right split matte, split at a specified U value.\n- **Noise 2D**: A 2D Perlin noise generator.\n- **Cellular Noise 2D**: A 2D cellular noise generator.\n- **Worley Noise 2D**: A 2D Worley noise generator.\n\n",
  "sections" : [
    {
      "content" : "",
      "items" : [
        {
          "description" : "A left-to-right linear value ramp (gradient) generator.",
          "name" : "Ramp Horizontal",
          "url" : "https:\/\/developer.apple.com\/documentation\/ShaderGraph\/2D-Procedural\/Ramp-Horizontal"
        },
        {
          "description" : "A top-to-bottom linear value ramp (gradient) generator.",
          "name" : "Ramp Vertical",
          "url" : "https:\/\/developer.apple.com\/documentation\/ShaderGraph\/2D-Procedural\/Ramp-Vertical"
        },
        {
          "description" : "A four-point linear value ramp (gradient) generator.",
          "name" : "Ramp 4 Corners",
          "url" : "https:\/\/developer.apple.com\/documentation\/ShaderGraph\/2D-Procedural\/Ramp-4-Corners"
        },
        {
          "description" : "A left-to-right split matte, split at a specified U value.",
          "name" : "Split Horizontal",
          "url" : "https:\/\/developer.apple.com\/documentation\/ShaderGraph\/2D-Procedural\/Split-Horizontal"
        },
        {
          "description" : "A 2D Perlin noise generator.",
          "name" : "Noise 2D",
          "url" : "https:\/\/developer.apple.com\/documentation\/ShaderGraph\/2D-Procedural\/Noise-2D"
        },
        {
          "description" : "A 2D cellular noise generator.",
          "name" : "Cellular Noise 2D",
          "url" : "https:\/\/developer.apple.com\/documentation\/ShaderGraph\/2D-Procedural\/Cellular-Noise-2D"
        },
        {
          "description" : "A 2D Worley noise generator.",
          "name" : "Worley Noise 2D",
          "url" : "https:\/\/developer.apple.com\/documentation\/ShaderGraph\/2D-Procedural\/Worley-Noise-2D"
        }
      ],
      "title" : "Nodes"
    }
  ],
  "source" : "appleJSON",
  "title" : "Split Vertical",
  "url" : "https:\/\/developer.apple.com\/documentation\/ShaderGraph\/2D-Procedural\/Split-Vertical"
}