{
  "abstract" : "A merge operation that layers foreground over background color, but assumes no overlap in partially transparent areas covered by both.",
  "codeExamples" : [

  ],
  "contentHash" : "d547d7274b2f4bfc0649662beb7e7394292ef801827a1f4e23f1a9ea0ef99c33",
  "crawledAt" : "2025-12-06T00:56:53Z",
  "id" : "7FD3C23B-DCBD-4F8F-A596-768742EA970A",
  "kind" : "unknown",
  "language" : "swift",
  "module" : "ShaderGraph",
  "overview" : "## Parameter Types\n\n## Parameter descriptions\n\n## Discussion\n\nThe Disjoint Over node performs one of two mixes based on the alpha channels of the foreground and background inputs. If `f+b<=1`, then the RGB component of the output is `F+B`. If `f+b>1`, then the RGB component of the output is `F+b(1-f)\/b`. The alpha component of the output for this node is always the smaller value between `f+b` or 1. Below is a simple node graph that uses the Disjoint Over node to blend a tile and rock texture:\n\n\n\nThe graph remaps the alpha of the rock texture from a range of `0-1` to a range of `-1-2` in order to show more of the effect of both possible modes of the blend. Below are the two original images and their resulting blended texture applied to a cube:\n\n",
  "rawMarkdown" : "---\nsource: https:\/\/developer.apple.com\/documentation\/ShaderGraph\/Compositing\/Disjoint-Over\ncrawled: 2025-12-06T00:56:53Z\n---\n\n# Disjoint Over\n\n**ShaderGraph Node**\n\nA merge operation that layers foreground over background color, but assumes no overlap in partially transparent areas covered by both.\n\n## Parameter Types\n\n\n\n## Parameter descriptions\n\n\n\n## Discussion\n\nThe Disjoint Over node performs one of two mixes based on the alpha channels of the foreground and background inputs. If `f+b<=1`, then the RGB component of the output is `F+B`. If `f+b>1`, then the RGB component of the output is `F+b(1-f)\/b`. The alpha component of the output for this node is always the smaller value between `f+b` or 1. Below is a simple node graph that uses the Disjoint Over node to blend a tile and rock texture:\n\n\n\nThe graph remaps the alpha of the rock texture from a range of `0-1` to a range of `-1-2` in order to show more of the effect of both possible modes of the blend. Below are the two original images and their resulting blended texture applied to a cube:\n\n\n\n\n\n## Nodes\n\n- **Premultiply**: Multiplies the RGB channels of the input by the alpha channel.\n- **Unpremultiply**: Divides the RGB channels of the input by the alpha channel.\n- **Additive Mix**: Adds foreground and background values.\n- **Subtractive Mix**: Subtracts foreground from background values.\n- **Difference**: Outputs the distance between foreground and background values.\n- **Burn**: A blend operation that darkens the foreground layer using the background.\n- **Dodge**: A blend operation that lightens the background layer depending on the foreground.\n- **Screen**: A blend operation that lightens areas that are darker than white.\n- **Overlay**: A blend operation that multiplies dark areas and screens light areas.\n- **In**: Outputs areas of foreground that overlap with the alpha of background.\n- **Mask**: Outputs areas of background that overlap with the alpha of foreground.\n- **Matte**: A merge operation that layers premultiplied foreground over background.\n- **Out**: Outputs areas of foreground that do not overlap with background.\n- **Over**: A merge operation that layers foreground over background, using the alpha of the foreground.\n- **Inside**: Multiplies a mask to all channels of the input.\n\n",
  "sections" : [
    {
      "content" : "",
      "items" : [
        {
          "description" : "Multiplies the RGB channels of the input by the alpha channel.",
          "name" : "Premultiply",
          "url" : "https:\/\/developer.apple.com\/documentation\/ShaderGraph\/Compositing\/Premultiply"
        },
        {
          "description" : "Divides the RGB channels of the input by the alpha channel.",
          "name" : "Unpremultiply",
          "url" : "https:\/\/developer.apple.com\/documentation\/ShaderGraph\/Compositing\/Unpremultiply"
        },
        {
          "description" : "Adds foreground and background values.",
          "name" : "Additive Mix",
          "url" : "https:\/\/developer.apple.com\/documentation\/ShaderGraph\/Compositing\/Additive-Mix"
        },
        {
          "description" : "Subtracts foreground from background values.",
          "name" : "Subtractive Mix",
          "url" : "https:\/\/developer.apple.com\/documentation\/ShaderGraph\/Compositing\/Subtractive-Mix"
        },
        {
          "description" : "Outputs the distance between foreground and background values.",
          "name" : "Difference",
          "url" : "https:\/\/developer.apple.com\/documentation\/ShaderGraph\/Compositing\/Difference"
        },
        {
          "description" : "A blend operation that darkens the foreground layer using the background.",
          "name" : "Burn",
          "url" : "https:\/\/developer.apple.com\/documentation\/ShaderGraph\/Compositing\/Burn"
        },
        {
          "description" : "A blend operation that lightens the background layer depending on the foreground.",
          "name" : "Dodge",
          "url" : "https:\/\/developer.apple.com\/documentation\/ShaderGraph\/Compositing\/Dodge"
        },
        {
          "description" : "A blend operation that lightens areas that are darker than white.",
          "name" : "Screen",
          "url" : "https:\/\/developer.apple.com\/documentation\/ShaderGraph\/Compositing\/Screen"
        },
        {
          "description" : "A blend operation that multiplies dark areas and screens light areas.",
          "name" : "Overlay",
          "url" : "https:\/\/developer.apple.com\/documentation\/ShaderGraph\/Compositing\/Overlay"
        },
        {
          "description" : "Outputs areas of foreground that overlap with the alpha of background.",
          "name" : "In",
          "url" : "https:\/\/developer.apple.com\/documentation\/ShaderGraph\/Compositing\/In"
        },
        {
          "description" : "Outputs areas of background that overlap with the alpha of foreground.",
          "name" : "Mask",
          "url" : "https:\/\/developer.apple.com\/documentation\/ShaderGraph\/Compositing\/Mask"
        },
        {
          "description" : "A merge operation that layers premultiplied foreground over background.",
          "name" : "Matte",
          "url" : "https:\/\/developer.apple.com\/documentation\/ShaderGraph\/Compositing\/Matte"
        },
        {
          "description" : "Outputs areas of foreground that do not overlap with background.",
          "name" : "Out",
          "url" : "https:\/\/developer.apple.com\/documentation\/ShaderGraph\/Compositing\/Out"
        },
        {
          "description" : "A merge operation that layers foreground over background, using the alpha of the foreground.",
          "name" : "Over",
          "url" : "https:\/\/developer.apple.com\/documentation\/ShaderGraph\/Compositing\/Over"
        },
        {
          "description" : "Multiplies a mask to all channels of the input.",
          "name" : "Inside",
          "url" : "https:\/\/developer.apple.com\/documentation\/ShaderGraph\/Compositing\/Inside"
        }
      ],
      "title" : "Nodes"
    }
  ],
  "source" : "appleJSON",
  "title" : "Disjoint Over",
  "url" : "https:\/\/developer.apple.com\/documentation\/ShaderGraph\/Compositing\/Disjoint-Over"
}