{
  "abstract" : "Load and configure 2D texture files.",
  "codeExamples" : [

  ],
  "contentHash" : "583d1e68a048ba30e5910d97d97fb9425b8d8ac7e72450712c9acde91d0a94a4",
  "crawledAt" : "2025-12-04T16:00:55Z",
  "id" : "59327B0F-DC05-40C0-BE69-73A5D40F03A3",
  "kind" : "unknown",
  "language" : "swift",
  "module" : "ShaderGraph",
  "overview" : "## Overview\n\nUse these nodes to incorporate file-based textures into your material. In addition to loading textures from disk, you can use each node to customize the rendering behavior of the texture.\n\nFor example, a Tiled Image node repeats the original image to fill the surface with content. In addition to loading textures, you can use the Transform 2D node to apply an affine transform to a 2D vector.",
  "rawMarkdown" : "---\nsource: https:\/\/developer.apple.com\/documentation\/ShaderGraph\/2D-Texture\ncrawled: 2025-12-04T16:00:55Z\n---\n\n# 2D-Texture\n\n**ShaderGraph Node Group**\n\nLoad and configure 2D texture files.\n\n## Overview\n\nUse these nodes to incorporate file-based textures into your material. In addition to loading textures from disk, you can use each node to customize the rendering behavior of the texture.\n\nFor example, a Tiled Image node repeats the original image to fill the surface with content. In addition to loading textures, you can use the Transform 2D node to apply an affine transform to a 2D vector.\n\n## Nodes\n\n- **Image**: A texture referencing a 2D image file.\n- **Tiled Image**: Samples data from an image with provisions for offsetting and tiling in UV space.\n- **UV Texture**: A MaterialX version of USD UV Texture reader.\n- **Transform 2D**: A node that applies an affine transformation to a 2d input.\n\n## Node Categories\n\n- **2D-Procedural**: Generate 2D gradients, noise, and other patterns programmatically for your material.\n- **3D-Procedural**: Generate 3D noise patterns programmatically for your material.\n- **3D-Texture**: Project multiple 2D images onto a surface to create a 3D texture.\n- **Adjustment**: Modify or convert values, or ranges of values, from one form to another.\n- **Application**: Get system values such as the current time or the direction of the up vector.\n- **Compositing**: Generate a single output from the combination of multiple data values.\n- **Data**: Convert data values to different formats, or manipulate individual elements within a data structure.\n- **Geometric**: Access scene geometry while your graph runs.\n- **Logic**: Perform Boolean operations and other logical comparisons on data values.\n- **Material**: Encapsulate a set of shader graph nodes into a single module.\n- **Math**: Perform a wide variety of mathematical and transformative operations on data values.\n- **Organization**: Modify the visual flow of data within your graph without changing any values.\n- **Procedural**: Add a constant number, vector, matrix, color, string, or other value to your graph.\n- **RealityKit**: Add RealityKit surfaces or textures to your material and access and manipulate scene geometry.\n- **Surface**: Generate a MaterialX preview surface.\n\n",
  "sections" : [
    {
      "content" : "",
      "items" : [
        {
          "description" : "A texture referencing a 2D image file.",
          "name" : "Image",
          "url" : "https:\/\/developer.apple.com\/documentation\/ShaderGraph\/2D-Texture\/Image"
        },
        {
          "description" : "Samples data from an image with provisions for offsetting and tiling in UV space.",
          "name" : "Tiled Image",
          "url" : "https:\/\/developer.apple.com\/documentation\/ShaderGraph\/2D-Texture\/Tiled-Image"
        },
        {
          "description" : "A MaterialX version of USD UV Texture reader.",
          "name" : "UV Texture",
          "url" : "https:\/\/developer.apple.com\/documentation\/ShaderGraph\/2D-Texture\/UV-Texture"
        },
        {
          "description" : "A node that applies an affine transformation to a 2d input.",
          "name" : "Transform 2D",
          "url" : "https:\/\/developer.apple.com\/documentation\/ShaderGraph\/2D-Texture\/Transform-2D"
        }
      ],
      "title" : "Nodes"
    },
    {
      "content" : "",
      "items" : [
        {
          "description" : "Generate 2D gradients, noise, and other patterns programmatically for your material.",
          "name" : "2D-Procedural",
          "url" : "https:\/\/developer.apple.com\/documentation\/ShaderGraph\/2D-Procedural"
        },
        {
          "description" : "Generate 3D noise patterns programmatically for your material.",
          "name" : "3D-Procedural",
          "url" : "https:\/\/developer.apple.com\/documentation\/ShaderGraph\/3D-Procedural"
        },
        {
          "description" : "Project multiple 2D images onto a surface to create a 3D texture.",
          "name" : "3D-Texture",
          "url" : "https:\/\/developer.apple.com\/documentation\/ShaderGraph\/3D-Texture"
        },
        {
          "description" : "Modify or convert values, or ranges of values, from one form to another.",
          "name" : "Adjustment",
          "url" : "https:\/\/developer.apple.com\/documentation\/ShaderGraph\/Adjustment"
        },
        {
          "description" : "Get system values such as the current time or the direction of the up vector.",
          "name" : "Application",
          "url" : "https:\/\/developer.apple.com\/documentation\/ShaderGraph\/Application"
        },
        {
          "description" : "Generate a single output from the combination of multiple data values.",
          "name" : "Compositing",
          "url" : "https:\/\/developer.apple.com\/documentation\/ShaderGraph\/Compositing"
        },
        {
          "description" : "Convert data values to different formats, or manipulate individual elements within a data structure.",
          "name" : "Data",
          "url" : "https:\/\/developer.apple.com\/documentation\/ShaderGraph\/Data"
        },
        {
          "description" : "Access scene geometry while your graph runs.",
          "name" : "Geometric",
          "url" : "https:\/\/developer.apple.com\/documentation\/ShaderGraph\/Geometric"
        },
        {
          "description" : "Perform Boolean operations and other logical comparisons on data values.",
          "name" : "Logic",
          "url" : "https:\/\/developer.apple.com\/documentation\/ShaderGraph\/Logic"
        },
        {
          "description" : "Encapsulate a set of shader graph nodes into a single module.",
          "name" : "Material",
          "url" : "https:\/\/developer.apple.com\/documentation\/ShaderGraph\/Material"
        },
        {
          "description" : "Perform a wide variety of mathematical and transformative operations on data values.",
          "name" : "Math",
          "url" : "https:\/\/developer.apple.com\/documentation\/ShaderGraph\/Math"
        },
        {
          "description" : "Modify the visual flow of data within your graph without changing any values.",
          "name" : "Organization",
          "url" : "https:\/\/developer.apple.com\/documentation\/ShaderGraph\/Organization"
        },
        {
          "description" : "Add a constant number, vector, matrix, color, string, or other value to your graph.",
          "name" : "Procedural",
          "url" : "https:\/\/developer.apple.com\/documentation\/ShaderGraph\/Procedural"
        },
        {
          "description" : "Add RealityKit surfaces or textures to your material and access and manipulate scene geometry.",
          "name" : "RealityKit",
          "url" : "https:\/\/developer.apple.com\/documentation\/ShaderGraph\/realitykit"
        },
        {
          "description" : "Generate a MaterialX preview surface.",
          "name" : "Surface",
          "url" : "https:\/\/developer.apple.com\/documentation\/ShaderGraph\/surface"
        }
      ],
      "title" : "Node Categories"
    }
  ],
  "source" : "appleJSON",
  "title" : "2D-Texture",
  "url" : "https:\/\/developer.apple.com\/documentation\/ShaderGraph\/2D-Texture"
}