{
  "abstract" : "The coefficient describing movement of the right eyelids consistent with a leftward gaze.",
  "codeExamples" : [

  ],
  "contentHash" : "55465f9c92c292f4795488675d3d6cc4fc86d75cf50b9878f90a9007121bf488",
  "crawledAt" : "2025-12-01T14:58:54Z",
  "declaration" : {
    "code" : "static let eyeLookInRight: ARFaceAnchor.BlendShapeLocation",
    "language" : "swift"
  },
  "id" : "C67105E9-A85D-4B1C-A9D0-C7BFD688C9B4",
  "kind" : "property",
  "module" : "ARKit",
  "overview" : "## Discussion\n\nThe figure below shows a face geometry (see [doc:\/\/com.apple.arkit\/documentation\/ARKit\/ARSCNFaceGeometry]) in two states, demonstrating values of `0.0` and `1.0` for this coefficient. In both states, the values for all other [doc:\/\/com.apple.arkit\/documentation\/ARKit\/ARFaceAnchor\/BlendShapeLocation] coefficients are set to `0.0`.\n\n",
  "platforms" : [
    "iOS",
    "iPadOS",
    "Mac Catalyst"
  ],
  "rawMarkdown" : "---\nsource: https:\/\/developer.apple.com\/documentation\/ARKit\/ARFaceAnchor\/BlendShapeLocation\/eyeLookInRight\ncrawled: 2025-12-01T14:58:54Z\n---\n\n# eyeLookInRight\n\n**Type Property**\n\nThe coefficient describing movement of the right eyelids consistent with a leftward gaze.\n\n## Declaration\n\n```swift\nstatic let eyeLookInRight: ARFaceAnchor.BlendShapeLocation\n```\n\n## Discussion\n\nThe figure below shows a face geometry (see [doc:\/\/com.apple.arkit\/documentation\/ARKit\/ARSCNFaceGeometry]) in two states, demonstrating values of `0.0` and `1.0` for this coefficient. In both states, the values for all other [doc:\/\/com.apple.arkit\/documentation\/ARKit\/ARFaceAnchor\/BlendShapeLocation] coefficients are set to `0.0`.\n\n\n\n## Right Eye\n\n- **eyeBlinkRight**: The coefficient describing closure of the eyelids over the right eye.\n- **eyeLookDownRight**: The coefficient describing movement of the right eyelids consistent with a downward gaze.\n- **eyeLookOutRight**: The coefficient describing movement of the right eyelids consistent with a rightward gaze.\n- **eyeLookUpRight**: The coefficient describing movement of the right eyelids consistent with an upward gaze.\n- **eyeSquintRight**: The coefficient describing contraction of the face around the right eye.\n- **eyeWideRight**: The coefficient describing a widening of the eyelids around the right eye.\n\n",
  "sections" : [
    {
      "content" : "",
      "items" : [
        {
          "description" : "The coefficient describing closure of the eyelids over the right eye.",
          "name" : "eyeBlinkRight",
          "url" : "https:\/\/developer.apple.com\/documentation\/ARKit\/ARFaceAnchor\/BlendShapeLocation\/eyeBlinkRight"
        },
        {
          "description" : "The coefficient describing movement of the right eyelids consistent with a downward gaze.",
          "name" : "eyeLookDownRight",
          "url" : "https:\/\/developer.apple.com\/documentation\/ARKit\/ARFaceAnchor\/BlendShapeLocation\/eyeLookDownRight"
        },
        {
          "description" : "The coefficient describing movement of the right eyelids consistent with a rightward gaze.",
          "name" : "eyeLookOutRight",
          "url" : "https:\/\/developer.apple.com\/documentation\/ARKit\/ARFaceAnchor\/BlendShapeLocation\/eyeLookOutRight"
        },
        {
          "description" : "The coefficient describing movement of the right eyelids consistent with an upward gaze.",
          "name" : "eyeLookUpRight",
          "url" : "https:\/\/developer.apple.com\/documentation\/ARKit\/ARFaceAnchor\/BlendShapeLocation\/eyeLookUpRight"
        },
        {
          "description" : "The coefficient describing contraction of the face around the right eye.",
          "name" : "eyeSquintRight",
          "url" : "https:\/\/developer.apple.com\/documentation\/ARKit\/ARFaceAnchor\/BlendShapeLocation\/eyeSquintRight"
        },
        {
          "description" : "The coefficient describing a widening of the eyelids around the right eye.",
          "name" : "eyeWideRight",
          "url" : "https:\/\/developer.apple.com\/documentation\/ARKit\/ARFaceAnchor\/BlendShapeLocation\/eyeWideRight"
        }
      ],
      "title" : "Right Eye"
    }
  ],
  "source" : "appleJSON",
  "title" : "eyeLookInRight",
  "url" : "https:\/\/developer.apple.com\/documentation\/ARKit\/ARFaceAnchor\/BlendShapeLocation\/eyeLookInRight"
}