{
  "abstract" : "A set of callbacks you implement to be notified of coaching events.",
  "codeExamples" : [

  ],
  "contentHash" : "a4dbe2b640612a1601d1b06aaa786bf1bd3a36d0b3859cc409bf5eede05fa7ee",
  "crawledAt" : "2025-12-05T00:07:31Z",
  "declaration" : {
    "code" : "protocol ARCoachingOverlayViewDelegate : NSObjectProtocol",
    "language" : "swift"
  },
  "id" : "A2EE50EE-0E5C-41E8-A1E1-AB0ACD2DDADE",
  "kind" : "protocol",
  "language" : "swift",
  "module" : "ARKit",
  "overview" : "## Overview\n\nImplement a delegate to coordinate your app’s actions with coaching overlay. For example, when the coaching overlay determines the user needs guidance, you hide your app’s UI to allow the user to focus on the coaching experience. When the coaching overlay determines the [doc:\/\/com.apple.arkit\/documentation\/ARKit\/ARCoachingOverlayView\/goal-swift.property] is met, you show your app’s UI and begin your app’s AR experience.",
  "platforms" : [
    "iOS",
    "iPadOS",
    "Mac Catalyst"
  ],
  "rawMarkdown" : "---\nsource: https:\/\/developer.apple.com\/documentation\/ARKit\/ARCoachingOverlayViewDelegate\ncrawled: 2025-12-05T00:07:31Z\n---\n\n# ARCoachingOverlayViewDelegate\n\n**Protocol**\n\nA set of callbacks you implement to be notified of coaching events.\n\n## Declaration\n\n```swift\nprotocol ARCoachingOverlayViewDelegate : NSObjectProtocol\n```\n\n## Overview\n\nImplement a delegate to coordinate your app’s actions with coaching overlay. For example, when the coaching overlay determines the user needs guidance, you hide your app’s UI to allow the user to focus on the coaching experience. When the coaching overlay determines the [doc:\/\/com.apple.arkit\/documentation\/ARKit\/ARCoachingOverlayView\/goal-swift.property] is met, you show your app’s UI and begin your app’s AR experience.\n\n## Enabling Coaching\n\n- **coachingOverlayViewWillActivate(_:)**: Tells you when the coaching overlay view activates.\n- **coachingOverlayViewDidDeactivate(_:)**: Tells you when the coaching experience is completely deactivated.\n\n## Restarting the Session\n\n- **coachingOverlayViewDidRequestSessionReset(_:)**: Tells you when the user taps the coaching overlay view’s Start Over button while the session is relocalizing.\n\n## Delegating Events\n\n- **delegate**: An object you supply that implements coaching event callbacks.\n\n## Inherits From\n\n- NSObjectProtocol\n\n",
  "sections" : [
    {
      "content" : "",
      "items" : [
        {
          "description" : "Tells you when the coaching overlay view activates.",
          "name" : "coachingOverlayViewWillActivate(_:)",
          "url" : "https:\/\/developer.apple.com\/documentation\/ARKit\/ARCoachingOverlayViewDelegate\/coachingOverlayViewWillActivate(_:)"
        },
        {
          "description" : "Tells you when the coaching experience is completely deactivated.",
          "name" : "coachingOverlayViewDidDeactivate(_:)",
          "url" : "https:\/\/developer.apple.com\/documentation\/ARKit\/ARCoachingOverlayViewDelegate\/coachingOverlayViewDidDeactivate(_:)"
        }
      ],
      "title" : "Enabling Coaching"
    },
    {
      "content" : "",
      "items" : [
        {
          "description" : "Tells you when the user taps the coaching overlay view’s Start Over button while the session is relocalizing.",
          "name" : "coachingOverlayViewDidRequestSessionReset(_:)",
          "url" : "https:\/\/developer.apple.com\/documentation\/ARKit\/ARCoachingOverlayViewDelegate\/coachingOverlayViewDidRequestSessionReset(_:)"
        }
      ],
      "title" : "Restarting the Session"
    },
    {
      "content" : "",
      "items" : [
        {
          "description" : "An object you supply that implements coaching event callbacks.",
          "name" : "delegate",
          "url" : "https:\/\/developer.apple.com\/documentation\/ARKit\/ARCoachingOverlayView\/delegate"
        }
      ],
      "title" : "Delegating Events"
    },
    {
      "content" : "",
      "items" : [
        {
          "name" : "NSObjectProtocol"
        }
      ],
      "title" : "Inherits From"
    }
  ],
  "source" : "appleJSON",
  "title" : "ARCoachingOverlayViewDelegate",
  "url" : "https:\/\/developer.apple.com\/documentation\/ARKit\/ARCoachingOverlayViewDelegate"
}