{
  "abstract" : "An object that specifies the position and orientation of an item in the physical environment.",
  "codeExamples" : [

  ],
  "conformsTo" : [
    "ARAnchorCopying",
    "CVarArg",
    "CustomDebugStringConvertible",
    "CustomStringConvertible",
    "Equatable",
    "Hashable",
    "NSCoding",
    "NSCopying",
    "NSObjectProtocol",
    "NSSecureCoding",
    "Sendable",
    "SendableMetatype"
  ],
  "contentHash" : "6d1f4e3b7fe1e8624aa50edff279966d59ee661feb87d08320354f796ca090d4",
  "crawledAt" : "2025-12-02T18:52:32Z",
  "declaration" : {
    "code" : "class ARAnchor",
    "language" : "swift"
  },
  "id" : "E30D6F86-DC6F-4A32-8EB9-75B248BDCEF8",
  "inheritedBy" : [
    "ARAppClipCodeAnchor",
    "ARBodyAnchor",
    "AREnvironmentProbeAnchor",
    "ARFaceAnchor",
    "ARGeoAnchor",
    "ARImageAnchor",
    "ARMeshAnchor",
    "ARObjectAnchor",
    "ARParticipantAnchor",
    "ARPlaneAnchor"
  ],
  "kind" : "class",
  "language" : "swift",
  "module" : "ARKit",
  "overview" : "## Overview\n\nTo track the static positions and orientations of real or virtual objects relative to the camera, create anchor objects and use the [doc:\/\/com.apple.arkit\/documentation\/ARKit\/ARSession\/add(anchor:)] method to add them to your AR session.\n\nSome ARKit features automatically add special anchors to a session. World-tracking sessions can add [doc:\/\/com.apple.arkit\/documentation\/ARKit\/ARPlaneAnchor], [doc:\/\/com.apple.arkit\/documentation\/ARKit\/ARObjectAnchor], and [doc:\/\/com.apple.arkit\/documentation\/ARKit\/ARImageAnchor] objects if you enable the corresponding features; face-tracking sessions add [doc:\/\/com.apple.arkit\/documentation\/ARKit\/ARFaceAnchor] objects.\n\n### Subclassing Notes\n\nIn addition to creating your own `ARAnchor` instances to track the real-world positions of your virtual content, you can also subclass `ARAnchor` to associate custom data with anchors you create. Ensure that your anchor classes behave correctly when ARKit updates frames or saves and loads anchors in an [doc:\/\/com.apple.arkit\/documentation\/ARKit\/ARWorldMap]:",
  "platforms" : [
    "iOS",
    "iPadOS",
    "Mac Catalyst"
  ],
  "rawMarkdown" : "---\nsource: https:\/\/developer.apple.com\/documentation\/ARKit\/ARAnchor\ncrawled: 2025-12-02T18:52:32Z\n---\n\n# ARAnchor\n\n**Class**\n\nAn object that specifies the position and orientation of an item in the physical environment.\n\n## Declaration\n\n```swift\nclass ARAnchor\n```\n\n## Overview\n\nTo track the static positions and orientations of real or virtual objects relative to the camera, create anchor objects and use the [doc:\/\/com.apple.arkit\/documentation\/ARKit\/ARSession\/add(anchor:)] method to add them to your AR session.\n\n\n\nSome ARKit features automatically add special anchors to a session. World-tracking sessions can add [doc:\/\/com.apple.arkit\/documentation\/ARKit\/ARPlaneAnchor], [doc:\/\/com.apple.arkit\/documentation\/ARKit\/ARObjectAnchor], and [doc:\/\/com.apple.arkit\/documentation\/ARKit\/ARImageAnchor] objects if you enable the corresponding features; face-tracking sessions add [doc:\/\/com.apple.arkit\/documentation\/ARKit\/ARFaceAnchor] objects.\n\n### Subclassing Notes\n\nIn addition to creating your own `ARAnchor` instances to track the real-world positions of your virtual content, you can also subclass `ARAnchor` to associate custom data with anchors you create. Ensure that your anchor classes behave correctly when ARKit updates frames or saves and loads anchors in an [doc:\/\/com.apple.arkit\/documentation\/ARKit\/ARWorldMap]:\n\n- Anchor subclasses must fullfill the requirements of the [doc:\/\/com.apple.arkit\/documentation\/ARKit\/ARAnchorCopying] protocol. ARKit calls [doc:\/\/com.apple.arkit\/documentation\/ARKit\/ARAnchorCopying\/init(anchor:)] (on a background thread) to copy instances of your anchor class from each [doc:\/\/com.apple.arkit\/documentation\/ARKit\/ARFrame] to the next. Your implementation of this initializer should copy the values of any custom properties your subclass adds.\n- Anchor subclasses must also adopt the [doc:\/\/com.apple.documentation\/documentation\/Foundation\/NSSecureCoding] protocol. Override [doc:\/\/com.apple.documentation\/documentation\/Foundation\/NSCoding\/encode(with:)] and [doc:\/\/com.apple.documentation\/documentation\/Foundation\/NSCoding\/init(coder:)] to save and restore the values your subclassâ€™ custom properties when ARKit saves and loads them in a world map.\n- Anchors are considered equal based on their [doc:\/\/com.apple.arkit\/documentation\/ARKit\/ARAnchor\/identifier] property.\n- Only anchors that do not adopt [doc:\/\/com.apple.arkit\/documentation\/ARKit\/ARTrackable] are included when you save a world map.\n\n## Creating Anchors\n\n- **init(transform:)**: Creates a new anchor object with the specified transform.\n- **init(name:transform:)**: Creates a new anchor object with the specified transform and a descriptive name.\n- **name**: A descriptive name for the anchor.\n\n## Tracking Anchors\n\n- **identifier**: A unique identifier for the anchor.\n- **sessionIdentifier**: The unique identifier of the session that owns this anchor.\n- **transform**: A matrix encoding the position, orientation, and scale of the anchor relative to the world coordinate space of the AR session the anchor is placed in.\n\n## iOS\n\n- **Verifying Device Support and User Permission**: Check whether your app can use ARKit and respect user privacy at runtime.\n- **ARSession**: The object that manages the major tasks associated with every AR experience, such as motion tracking, camera passthrough, and image analysis.\n- **ARKit in iOS**: Integrate iOS device camera and motion features to produce augmented reality experiences in your app or game.\n\n## Inherits From\n\n- NSObject\n\n## Inherited By\n\n- ARAppClipCodeAnchor\n- ARBodyAnchor\n- AREnvironmentProbeAnchor\n- ARFaceAnchor\n- ARGeoAnchor\n- ARImageAnchor\n- ARMeshAnchor\n- ARObjectAnchor\n- ARParticipantAnchor\n- ARPlaneAnchor\n\n## Conforms To\n\n- ARAnchorCopying\n- CVarArg\n- CustomDebugStringConvertible\n- CustomStringConvertible\n- Equatable\n- Hashable\n- NSCoding\n- NSCopying\n- NSObjectProtocol\n- NSSecureCoding\n- Sendable\n- SendableMetatype\n\n",
  "sections" : [
    {
      "content" : "",
      "items" : [
        {
          "description" : "Creates a new anchor object with the specified transform.",
          "name" : "init(transform:)",
          "url" : "https:\/\/developer.apple.com\/documentation\/ARKit\/ARAnchor\/init(transform:)"
        },
        {
          "description" : "Creates a new anchor object with the specified transform and a descriptive name.",
          "name" : "init(name:transform:)",
          "url" : "https:\/\/developer.apple.com\/documentation\/ARKit\/ARAnchor\/init(name:transform:)"
        },
        {
          "description" : "A descriptive name for the anchor.",
          "name" : "name",
          "url" : "https:\/\/developer.apple.com\/documentation\/ARKit\/ARAnchor\/name"
        }
      ],
      "title" : "Creating Anchors"
    },
    {
      "content" : "",
      "items" : [
        {
          "description" : "A unique identifier for the anchor.",
          "name" : "identifier",
          "url" : "https:\/\/developer.apple.com\/documentation\/ARKit\/ARAnchor\/identifier"
        },
        {
          "description" : "The unique identifier of the session that owns this anchor.",
          "name" : "sessionIdentifier",
          "url" : "https:\/\/developer.apple.com\/documentation\/ARKit\/ARAnchor\/sessionIdentifier"
        },
        {
          "description" : "A matrix encoding the position, orientation, and scale of the anchor relative to the world coordinate space of the AR session the anchor is placed in.",
          "name" : "transform",
          "url" : "https:\/\/developer.apple.com\/documentation\/ARKit\/ARAnchor\/transform"
        }
      ],
      "title" : "Tracking Anchors"
    },
    {
      "content" : "",
      "items" : [
        {
          "description" : "Check whether your app can use ARKit and respect user privacy at runtime.",
          "name" : "Verifying Device Support and User Permission",
          "url" : "https:\/\/developer.apple.com\/documentation\/ARKit\/verifying-device-support-and-user-permission"
        },
        {
          "description" : "The object that manages the major tasks associated with every AR experience, such as motion tracking, camera passthrough, and image analysis.",
          "name" : "ARSession",
          "url" : "https:\/\/developer.apple.com\/documentation\/ARKit\/ARSession"
        },
        {
          "description" : "Integrate iOS device camera and motion features to produce augmented reality experiences in your app or game.",
          "name" : "ARKit in iOS",
          "url" : "https:\/\/developer.apple.com\/documentation\/ARKit\/arkit-in-ios"
        }
      ],
      "title" : "iOS"
    },
    {
      "content" : "",
      "items" : [
        {
          "name" : "NSObject"
        }
      ],
      "title" : "Inherits From"
    }
  ],
  "source" : "appleJSON",
  "title" : "ARAnchor",
  "url" : "https:\/\/developer.apple.com\/documentation\/ARKit\/ARAnchor"
}