{
  "abstract" : "A flag that indicates if the device tracks App Clip Codes.",
  "codeExamples" : [

  ],
  "contentHash" : "850d226c54523635ac6f56ef972042f5707ea53df0999b5897dd4f71e355f7b7",
  "crawledAt" : "2025-12-02T07:49:38Z",
  "declaration" : {
    "code" : "class var supportsAppClipCodeTracking: Bool { get }",
    "language" : "swift"
  },
  "id" : "15D1B550-ADC6-4757-B733-9DE69659A2D8",
  "kind" : "property",
  "module" : "ARKit",
  "overview" : "## Discussion\n\nDevices require the Apple Neural Engine (ANE) to track App Clip Codes. The system sets this property to [doc:\/\/com.apple.documentation\/documentation\/Swift\/true] if the device contains the ANE chip. The default value of this property is [doc:\/\/com.apple.documentation\/documentation\/Swift\/false].\n\nCall this function before setting [doc:\/\/com.apple.arkit\/documentation\/ARKit\/ARWorldTrackingConfiguration\/appClipCodeTrackingEnabled].",
  "platforms" : [
    "iOS",
    "iPadOS",
    "Mac Catalyst"
  ],
  "rawMarkdown" : "---\nsource: https:\/\/developer.apple.com\/documentation\/ARKit\/ARWorldTrackingConfiguration\/supportsAppClipCodeTracking\ncrawled: 2025-12-02T07:49:38Z\n---\n\n# supportsAppClipCodeTracking\n\n**Type Property**\n\nA flag that indicates if the device tracks App Clip Codes.\n\n## Declaration\n\n```swift\nclass var supportsAppClipCodeTracking: Bool { get }\n```\n\n## Discussion\n\nDevices require the Apple Neural Engine (ANE) to track App Clip Codes. The system sets this property to [doc:\/\/com.apple.documentation\/documentation\/Swift\/true] if the device contains the ANE chip. The default value of this property is [doc:\/\/com.apple.documentation\/documentation\/Swift\/false].\n\nCall this function before setting [doc:\/\/com.apple.arkit\/documentation\/ARKit\/ARWorldTrackingConfiguration\/appClipCodeTrackingEnabled].\n\n## Accessing App Clip Codes\n\n- **Interacting with App Clip Codes in AR**: Display content and provide services in an AR experience with App Clip Codes.\n- **appClipCodeTrackingEnabled**: A Boolean value that indicates if the framework searches the physical environment for App Clip Codes.\n- **ARAppClipCodeAnchor**: An anchor that tracks the position and orientation of an App Clip Code in the physical environment.\n\n",
  "sections" : [
    {
      "content" : "",
      "items" : [
        {
          "description" : "Display content and provide services in an AR experience with App Clip Codes.",
          "name" : "Interacting with App Clip Codes in AR",
          "url" : "https:\/\/developer.apple.com\/documentation\/AppClip\/interacting-with-app-clip-codes-in-ar"
        },
        {
          "description" : "A Boolean value that indicates if the framework searches the physical environment for App Clip Codes.",
          "name" : "appClipCodeTrackingEnabled",
          "url" : "https:\/\/developer.apple.com\/documentation\/ARKit\/ARWorldTrackingConfiguration\/appClipCodeTrackingEnabled"
        },
        {
          "description" : "An anchor that tracks the position and orientation of an App Clip Code in the physical environment.",
          "name" : "ARAppClipCodeAnchor",
          "url" : "https:\/\/developer.apple.com\/documentation\/ARKit\/ARAppClipCodeAnchor"
        }
      ],
      "title" : "Accessing App Clip Codes"
    }
  ],
  "source" : "appleJSON",
  "title" : "supportsAppClipCodeTracking",
  "url" : "https:\/\/developer.apple.com\/documentation\/ARKit\/ARWorldTrackingConfiguration\/supportsAppClipCodeTracking"
}