{
  "abstract" : "A matrix encoding the position, orientation, and scale of the anchor relative to the world coordinate space of the AR session the anchor is placed in.",
  "codeExamples" : [

  ],
  "contentHash" : "cda8c263ab8d16b008d70229b8b24fd033572ec500fcc5c5c1c035d993bede1f",
  "crawledAt" : "2025-12-03T10:11:31Z",
  "declaration" : {
    "code" : "var transform: simd_float4x4 { get }",
    "language" : "swift"
  },
  "id" : "F67A3D71-D8C4-4054-813F-EFC4A69B34D2",
  "kind" : "property",
  "language" : "swift",
  "module" : "ARKit",
  "overview" : "## Discussion\n\nWorld coordinate space in ARKit always follows a right-handed convention, but is oriented based on the session configuration. For details, see [doc:\/\/com.apple.arkit\/documentation\/ARKit\/understanding-world-tracking].",
  "platforms" : [
    "iOS",
    "iPadOS",
    "Mac Catalyst"
  ],
  "rawMarkdown" : "---\nsource: https:\/\/developer.apple.com\/documentation\/ARKit\/ARAnchor\/transform\ncrawled: 2025-12-03T10:11:31Z\n---\n\n# transform\n\n**Instance Property**\n\nA matrix encoding the position, orientation, and scale of the anchor relative to the world coordinate space of the AR session the anchor is placed in.\n\n## Declaration\n\n```swift\nvar transform: simd_float4x4 { get }\n```\n\n## Discussion\n\nWorld coordinate space in ARKit always follows a right-handed convention, but is oriented based on the session configuration. For details, see [doc:\/\/com.apple.arkit\/documentation\/ARKit\/understanding-world-tracking].\n\n## Tracking Anchors\n\n- **identifier**: A unique identifier for the anchor.\n- **sessionIdentifier**: The unique identifier of the session that owns this anchor.\n\n",
  "sections" : [
    {
      "content" : "",
      "items" : [
        {
          "description" : "A unique identifier for the anchor.",
          "name" : "identifier",
          "url" : "https:\/\/developer.apple.com\/documentation\/ARKit\/ARAnchor\/identifier"
        },
        {
          "description" : "The unique identifier of the session that owns this anchor.",
          "name" : "sessionIdentifier",
          "url" : "https:\/\/developer.apple.com\/documentation\/ARKit\/ARAnchor\/sessionIdentifier"
        }
      ],
      "title" : "Tracking Anchors"
    }
  ],
  "source" : "appleJSON",
  "title" : "transform",
  "url" : "https:\/\/developer.apple.com\/documentation\/ARKit\/ARAnchor\/transform"
}