{
  "abstract" : "Runs a session with the data providers you supply.",
  "codeExamples" : [

  ],
  "contentHash" : "1e916056756909275329eff8e3ccbd9e8a409f19f7151a8b1b6472cfdde7fec7",
  "crawledAt" : "2025-12-01T02:36:41Z",
  "declaration" : {
    "code" : "final func run(_ dataProviders: [any DataProvider]) async throws",
    "language" : "swift"
  },
  "id" : "FD8F3772-B302-4516-942F-C4CA578175DF",
  "kind" : "method",
  "module" : "ARKit",
  "overview" : "## Discussion\n\nIf you call this method without previously calling the [doc:\/\/com.apple.arkit\/documentation\/ARKit\/ARKitSession\/requestAuthorization(for:)] method, and if any of the data providers you supply require authorization, the system prompts the user for authorization when you call [doc:\/\/com.apple.arkit\/documentation\/ARKit\/ARKitSession\/run(_:)]. If you call this method on an already-running session, ARKit stops the previous providers unless they’re also in the new array of providers.\n\nThis method either throws an [doc:\/\/com.apple.arkit\/documentation\/ARKit\/ARKitSession\/Error] or asserts when there’s a problem with the data providers you supply. Potential problems include:\n\nWhen this method throws an error, its session stops all of the associated data providers.",
  "platforms" : [
    "macOS",
    "visionOS"
  ],
  "rawMarkdown" : "---\nsource: https:\/\/developer.apple.com\/documentation\/ARKit\/ARKitSession\/run(_:)\ncrawled: 2025-12-01T02:36:41Z\n---\n\n# run(_:)\n\n**Instance Method**\n\nRuns a session with the data providers you supply.\n\n## Declaration\n\n```swift\nfinal func run(_ dataProviders: [any DataProvider]) async throws\n```\n\n## Parameters\n\n- **dataProviders**: The providers that supply data during this session.\n\n## Discussion\n\nIf you call this method without previously calling the [doc:\/\/com.apple.arkit\/documentation\/ARKit\/ARKitSession\/requestAuthorization(for:)] method, and if any of the data providers you supply require authorization, the system prompts the user for authorization when you call [doc:\/\/com.apple.arkit\/documentation\/ARKit\/ARKitSession\/run(_:)]. If you call this method on an already-running session, ARKit stops the previous providers unless they’re also in the new array of providers.\n\nThis method either throws an [doc:\/\/com.apple.arkit\/documentation\/ARKit\/ARKitSession\/Error] or asserts when there’s a problem with the data providers you supply. Potential problems include:\n\n- Passing a data provider that’s already in use in another session\n- Passing a data provider that’s stopped\n- Passing a data provider that’s not supported in the current context, such as in Simulator\n\nWhen this method throws an error, its session stops all of the associated data providers.\n\n## Starting and stopping a session\n\n- **init()**: Creates a new session.\n- **stop()**: Stops all data providers running in this session.\n- **ARKitSession.Error**: An error that might occur when running data providers on an ARKit session.\n\n",
  "sections" : [
    {
      "content" : "",
      "items" : [
        {
          "description" : "Creates a new session.",
          "name" : "init()",
          "url" : "https:\/\/developer.apple.com\/documentation\/ARKit\/ARKitSession\/init()"
        },
        {
          "description" : "Stops all data providers running in this session.",
          "name" : "stop()",
          "url" : "https:\/\/developer.apple.com\/documentation\/ARKit\/ARKitSession\/stop()"
        },
        {
          "description" : "An error that might occur when running data providers on an ARKit session.",
          "name" : "ARKitSession.Error",
          "url" : "https:\/\/developer.apple.com\/documentation\/ARKit\/ARKitSession\/Error"
        }
      ],
      "title" : "Starting and stopping a session"
    }
  ],
  "source" : "appleJSON",
  "title" : "run(_:)",
  "url" : "https:\/\/developer.apple.com\/documentation\/ARKit\/ARKitSession\/run(_:)"
}