{
  "abstract" : "An option to reset the device’s position from the session’s previous run.",
  "codeExamples" : [

  ],
  "contentHash" : "649831c266dc8cfb16e96c0d51377b808cb6f5f026711b6bbb70e274c5a896b4",
  "crawledAt" : "2025-12-03T15:28:36Z",
  "declaration" : {
    "code" : "static var resetTracking: ARSession.RunOptions { get }",
    "language" : "swift"
  },
  "id" : "710F7210-C7B3-47DE-8762-E20F943B5AD7",
  "kind" : "property",
  "language" : "swift",
  "module" : "ARKit",
  "overview" : "## Discussion\n\nBy default, when you call the [doc:\/\/com.apple.arkit\/documentation\/ARKit\/ARSession\/run(_:options:)] method on a session that has run before or is already running, the session resumes device position tracking from its last known state. (For example, an [doc:\/\/com.apple.arkit\/documentation\/ARKit\/ARAnchor] object keeps its apparent position relative to the camera.) When you call the [doc:\/\/com.apple.arkit\/documentation\/ARKit\/ARSession\/run(_:options:)] method with a configuration of the same type as the session’s current configuration, you can add this option to force device position tracking to return to its initial state.\n\nWhen you call the [doc:\/\/com.apple.arkit\/documentation\/ARKit\/ARSession\/run(_:options:)] method with a configuration of a different type than the session’s current configuration, the session always resets tracking (that is, this option is implicitly enabled).\n\nIn either case, when you reset tracking, ARKit also removes any existing anchors from the session.",
  "platforms" : [
    "iOS",
    "iPadOS",
    "Mac Catalyst"
  ],
  "rawMarkdown" : "---\nsource: https:\/\/developer.apple.com\/documentation\/ARKit\/ARSession\/RunOptions\/resetTracking\ncrawled: 2025-12-03T15:28:36Z\n---\n\n# resetTracking\n\n**Type Property**\n\nAn option to reset the device’s position from the session’s previous run.\n\n## Declaration\n\n```swift\nstatic var resetTracking: ARSession.RunOptions { get }\n```\n\n## Discussion\n\nBy default, when you call the [doc:\/\/com.apple.arkit\/documentation\/ARKit\/ARSession\/run(_:options:)] method on a session that has run before or is already running, the session resumes device position tracking from its last known state. (For example, an [doc:\/\/com.apple.arkit\/documentation\/ARKit\/ARAnchor] object keeps its apparent position relative to the camera.) When you call the [doc:\/\/com.apple.arkit\/documentation\/ARKit\/ARSession\/run(_:options:)] method with a configuration of the same type as the session’s current configuration, you can add this option to force device position tracking to return to its initial state.\n\nWhen you call the [doc:\/\/com.apple.arkit\/documentation\/ARKit\/ARSession\/run(_:options:)] method with a configuration of a different type than the session’s current configuration, the session always resets tracking (that is, this option is implicitly enabled).\n\nIn either case, when you reset tracking, ARKit also removes any existing anchors from the session.\n\n## Run Options\n\n- **removeExistingAnchors**: An option to remove any anchor objects associated with the session’s previous run.\n- **stopTrackedRaycasts**: An option to stop all active tracked raycasts.\n- **resetSceneReconstruction**: An option to reset the scene mesh.\n\n",
  "sections" : [
    {
      "content" : "",
      "items" : [
        {
          "description" : "An option to remove any anchor objects associated with the session’s previous run.",
          "name" : "removeExistingAnchors",
          "url" : "https:\/\/developer.apple.com\/documentation\/ARKit\/ARSession\/RunOptions\/removeExistingAnchors"
        },
        {
          "description" : "An option to stop all active tracked raycasts.",
          "name" : "stopTrackedRaycasts",
          "url" : "https:\/\/developer.apple.com\/documentation\/ARKit\/ARSession\/RunOptions\/stopTrackedRaycasts"
        },
        {
          "description" : "An option to reset the scene mesh.",
          "name" : "resetSceneReconstruction",
          "url" : "https:\/\/developer.apple.com\/documentation\/ARKit\/ARSession\/RunOptions\/resetSceneReconstruction"
        }
      ],
      "title" : "Run Options"
    }
  ],
  "source" : "appleJSON",
  "title" : "resetTracking",
  "url" : "https:\/\/developer.apple.com\/documentation\/ARKit\/ARSession\/RunOptions\/resetTracking"
}