{
  "abstract" : "A SceneKit representation of the 2D shape of a plane, for use with plane detection results in an AR session.",
  "codeExamples" : [

  ],
  "conformsTo" : [
    "CVarArg",
    "CustomDebugStringConvertible",
    "CustomStringConvertible",
    "Equatable",
    "Hashable",
    "NSCoding",
    "NSCopying",
    "NSObjectProtocol",
    "NSSecureCoding",
    "SCNAnimatable",
    "SCNBoundingVolume",
    "SCNShadable"
  ],
  "contentHash" : "dcea1fffd65dfe62da8b7670435a4ad085b4d43b3cff29eb99015e01efcf9659",
  "crawledAt" : "2025-12-02T18:35:21Z",
  "declaration" : {
    "code" : "class ARSCNPlaneGeometry",
    "language" : "swift"
  },
  "id" : "388780A1-33F3-4446-970D-FCAF1B677767",
  "kind" : "class",
  "language" : "swift",
  "module" : "ARKit",
  "overview" : "## Overview\n\n[doc:\/\/com.apple.arkit\/documentation\/ARKit\/ARSCNPlaneGeometry] is a subclass of [doc:\/\/com.apple.documentation\/documentation\/SceneKit\/SCNGeometry] that wraps the mesh data provided by the [doc:\/\/com.apple.arkit\/documentation\/ARKit\/ARPlaneGeometry] class. You can use [doc:\/\/com.apple.arkit\/documentation\/ARKit\/ARSCNPlaneGeometry] to visualize the plane shape estimates provided by ARKit in a SceneKit view.\n\nAs your AR session continues to run, ARKit provides refined estimates of a detected plane’s 2D shape. Use the [doc:\/\/com.apple.arkit\/documentation\/ARKit\/ARSCNPlaneGeometry\/update(from:)] method to incorporate those refinements into the plane’s SceneKit representation.",
  "platforms" : [
    "iOS",
    "iPadOS",
    "Mac Catalyst"
  ],
  "rawMarkdown" : "---\nsource: https:\/\/developer.apple.com\/documentation\/ARKit\/ARSCNPlaneGeometry\ncrawled: 2025-12-02T18:35:21Z\n---\n\n# ARSCNPlaneGeometry\n\n**Class**\n\nA SceneKit representation of the 2D shape of a plane, for use with plane detection results in an AR session.\n\n## Declaration\n\n```swift\nclass ARSCNPlaneGeometry\n```\n\n## Overview\n\n[doc:\/\/com.apple.arkit\/documentation\/ARKit\/ARSCNPlaneGeometry] is a subclass of [doc:\/\/com.apple.documentation\/documentation\/SceneKit\/SCNGeometry] that wraps the mesh data provided by the [doc:\/\/com.apple.arkit\/documentation\/ARKit\/ARPlaneGeometry] class. You can use [doc:\/\/com.apple.arkit\/documentation\/ARKit\/ARSCNPlaneGeometry] to visualize the plane shape estimates provided by ARKit in a SceneKit view.\n\n\n\nAs your AR session continues to run, ARKit provides refined estimates of a detected plane’s 2D shape. Use the [doc:\/\/com.apple.arkit\/documentation\/ARKit\/ARSCNPlaneGeometry\/update(from:)] method to incorporate those refinements into the plane’s SceneKit representation.\n\n## Creating a Geometry\n\n- **init(device:)**: Creates a SceneKit plane geometry for rendering with the specified Metal device object.\n\n## Updating the Geometry\n\n- **update(from:)**: Reshapes the SceneKit geometry to match the specified plane mesh.\n\n## Geometry\n\n- **geometry**: A coarse triangle mesh representing the general shape of the detected plane.\n- **ARPlaneGeometry**: A 3D mesh describing the shape of a detected plane in world-tracking AR sessions.\n\n## Inherits From\n\n- SCNGeometry\n\n## Conforms To\n\n- CVarArg\n- CustomDebugStringConvertible\n- CustomStringConvertible\n- Equatable\n- Hashable\n- NSCoding\n- NSCopying\n- NSObjectProtocol\n- NSSecureCoding\n- SCNAnimatable\n- SCNBoundingVolume\n- SCNShadable\n\n",
  "sections" : [
    {
      "content" : "",
      "items" : [
        {
          "description" : "Creates a SceneKit plane geometry for rendering with the specified Metal device object.",
          "name" : "init(device:)",
          "url" : "https:\/\/developer.apple.com\/documentation\/ARKit\/ARSCNPlaneGeometry\/init(device:)"
        }
      ],
      "title" : "Creating a Geometry"
    },
    {
      "content" : "",
      "items" : [
        {
          "description" : "Reshapes the SceneKit geometry to match the specified plane mesh.",
          "name" : "update(from:)",
          "url" : "https:\/\/developer.apple.com\/documentation\/ARKit\/ARSCNPlaneGeometry\/update(from:)"
        }
      ],
      "title" : "Updating the Geometry"
    },
    {
      "content" : "",
      "items" : [
        {
          "description" : "A coarse triangle mesh representing the general shape of the detected plane.",
          "name" : "geometry",
          "url" : "https:\/\/developer.apple.com\/documentation\/ARKit\/ARPlaneAnchor\/geometry"
        },
        {
          "description" : "A 3D mesh describing the shape of a detected plane in world-tracking AR sessions.",
          "name" : "ARPlaneGeometry",
          "url" : "https:\/\/developer.apple.com\/documentation\/ARKit\/ARPlaneGeometry"
        }
      ],
      "title" : "Geometry"
    },
    {
      "content" : "",
      "items" : [
        {
          "name" : "SCNGeometry"
        }
      ],
      "title" : "Inherits From"
    }
  ],
  "source" : "appleJSON",
  "title" : "ARSCNPlaneGeometry",
  "url" : "https:\/\/developer.apple.com\/documentation\/ARKit\/ARSCNPlaneGeometry"
}