{
  "abstract" : "A flag that instructs the framework to estimate and set the scale of a detected or tracked image on your behalf.",
  "codeExamples" : [

  ],
  "contentHash" : "4b8e140050b60b82c8afa42b7a4a053b3c809df024386f608b6e571671ea9bbe",
  "crawledAt" : "2025-12-04T02:44:39Z",
  "declaration" : {
    "code" : "var automaticImageScaleEstimationEnabled: Bool { get set }",
    "language" : "swift"
  },
  "id" : "37AEE1CA-31EE-4777-A1B0-E2CDF8F0F7DB",
  "kind" : "property",
  "language" : "swift",
  "module" : "ARKit",
  "overview" : "## Discussion\n\nIf set to [doc:\/\/com.apple.documentation\/documentation\/Swift\/true], ARKit uses its knowledge of the world to set an image anchor’s [doc:\/\/com.apple.arkit\/documentation\/ARKit\/ARImageAnchor\/estimatedScaleFactor] property, which corrects the image anchor’s position in the physical environment.\n\nEnable this property when you want to detect different-sized versions of a reference image. ARKit must know the physical size of an image in the real world to accurately estimate its real-world position. Enable this property to tell ARKit to estimate a recognized image’s physical size before it calculates the real-world position.",
  "platforms" : [
    "iOS",
    "iPadOS",
    "Mac Catalyst"
  ],
  "rawMarkdown" : "---\nsource: https:\/\/developer.apple.com\/documentation\/ARKit\/ARWorldTrackingConfiguration\/automaticImageScaleEstimationEnabled\ncrawled: 2025-12-04T02:44:39Z\n---\n\n# automaticImageScaleEstimationEnabled\n\n**Instance Property**\n\nA flag that instructs the framework to estimate and set the scale of a detected or tracked image on your behalf.\n\n## Declaration\n\n```swift\nvar automaticImageScaleEstimationEnabled: Bool { get set }\n```\n\n## Discussion\n\nIf set to [doc:\/\/com.apple.documentation\/documentation\/Swift\/true], ARKit uses its knowledge of the world to set an image anchor’s [doc:\/\/com.apple.arkit\/documentation\/ARKit\/ARImageAnchor\/estimatedScaleFactor] property, which corrects the image anchor’s position in the physical environment.\n\nEnable this property when you want to detect different-sized versions of a reference image. ARKit must know the physical size of an image in the real world to accurately estimate its real-world position. Enable this property to tell ARKit to estimate a recognized image’s physical size before it calculates the real-world position.\n\n## Detecting or Tracking Images\n\n- **detectionImages**: A set of images that ARKit searches for in the user’s environment.\n- **maximumNumberOfTrackedImages**: The number of image anchors to monitor closely for position and orientation updates.\n\n",
  "sections" : [
    {
      "content" : "",
      "items" : [
        {
          "description" : "A set of images that ARKit searches for in the user’s environment.",
          "name" : "detectionImages",
          "url" : "https:\/\/developer.apple.com\/documentation\/ARKit\/ARWorldTrackingConfiguration\/detectionImages"
        },
        {
          "description" : "The number of image anchors to monitor closely for position and orientation updates.",
          "name" : "maximumNumberOfTrackedImages",
          "url" : "https:\/\/developer.apple.com\/documentation\/ARKit\/ARWorldTrackingConfiguration\/maximumNumberOfTrackedImages"
        }
      ],
      "title" : "Detecting or Tracking Images"
    }
  ],
  "source" : "appleJSON",
  "title" : "automaticImageScaleEstimationEnabled",
  "url" : "https:\/\/developer.apple.com\/documentation\/ARKit\/ARWorldTrackingConfiguration\/automaticImageScaleEstimationEnabled"
}