{
  "abstract" : "Reloads the app.",
  "codeExamples" : [

  ],
  "contentHash" : "c2f1d35b46bf6baa1323b640e71e7d15c91d63e3f978958e24271c998c641812",
  "crawledAt" : "2025-12-02T21:14:42Z",
  "declaration" : {
    "code" : "void reload(\n    in Object options, \n    in optional Object reloadData\n);",
    "language" : "swift"
  },
  "id" : "3C4EB14A-E7B4-4271-A35D-7F1D96F69A49",
  "kind" : "method",
  "language" : "data",
  "module" : "TVMLKit JS",
  "overview" : "## Discussion\n\nThis function reloads the initial TVMLKit JS file without quitting the app. The optional `reloadData` parameter enables you to capture and restart the app in its current state. If the `reloadData` parameter is not present, the app is restarted in its initial state.",
  "platforms" : [
    "tvOS"
  ],
  "rawMarkdown" : "---\nsource: https:\/\/developer.apple.com\/documentation\/tvmljs\/app\/1627357-reload\ncrawled: 2025-12-02T21:14:42Z\n---\n\n# reload\n\n**Instance Method**\n\nReloads the app.\n\n## Declaration\n\n```swift\nvoid reload(\n    in Object options, \n    in optional Object reloadData\n);\n```\n\n## Parameters\n\n- **options**: The options used to determine when the app is reloaded. This parameter is a dictionary with a key-value pair. The key can have the value `when`. The value can have the values `onResume` or `now`.\n- **reloadData**: An optional, developer-defined object that contains information about the current app state.\n\n## Discussion\n\nThis function reloads the initial TVMLKit JS file without quitting the app. The optional `reloadData` parameter enables you to capture and restart the app in its current state. If the `reloadData` parameter is not present, the app is restarted in its initial state.\n\n",
  "sections" : [

  ],
  "source" : "appleJSON",
  "title" : "reload",
  "url" : "https:\/\/developer.apple.com\/documentation\/tvmljs\/app\/1627357-reload"
}