{
  "abstract" : "An array of `interstitial` objects.",
  "codeExamples" : [
    {
      "code" : "var baseURL;\n \nApp.onLaunch = function(options) {\n    baseURL = options.BASEURL;\n    var documentPath = \"path to file on server\/baseball.m3u8\";\n    var videourl = baseURL + documentPath;\n \n    var singleVideo = new MediaItem('video', videourl);\n    var videoInterstitials = [];\n    videoInterstitials.push({\n        starttime: 30,\n        duration: 20\n    });\n    singleVideo.interstitials = videoInterstitials;\n    var videoList = new Playlist();\n    videoList.push(singleVideo);\n    var myPlayer = new Player();\n    myPlayer.playlist = videoList;\n    myPlayer.addEventListener(\"requestSeekToTime\", function(event) {\n        if (event.currentTime > 30 && event.currentTime <50) {return false;} else {return true;}\n        });\n    myPlayer.play();\n}\n \nApp.onExit = function() {\n    console.log(\"exited\");\n}",
      "language" : "javascript"
    }
  ],
  "contentHash" : "6e5235b85e687ce19b57798aa215acd76a62535c8cb065e0d6fddc6d4a904773",
  "crawledAt" : "2025-12-02T21:14:14Z",
  "declaration" : {
    "code" : "attribute Array interstitials;",
    "language" : "swift"
  },
  "id" : "7A7AC9A9-1CE9-45B5-894B-11AC95DCDB72",
  "kind" : "property",
  "language" : "data",
  "module" : "TVMLKit JS",
  "overview" : "## Discussion\n\nAn interstitial object defines a point within a `MediaItem` object where you can insert another media item; for example, a short ad. Each interstitial object in the array contains two keys: `starttime` and `duration`. The `starttime` is the length of time from the beginning of a media item, in seconds. The `duration` is the length of the interstitial, in seconds. Both keys are required. A common use for these objects is to define when and where ads are to be played during a stream. [doc:\/\/com.apple.documentation\/documentation\/tvmljs\/mediaitem\/1627341-interstitials#1943545] shows a complete TVMLKit JS example for incorporating interstitials. A single interstitial is defined. In addition, an event listener is created that prevents users from fast-forwarding or rewinding during the duration of the interstitial.",
  "platforms" : [
    "tvOS"
  ],
  "rawMarkdown" : "---\nsource: https:\/\/developer.apple.com\/documentation\/tvmljs\/mediaitem\/1627341-interstitials\ncrawled: 2025-12-02T21:14:14Z\n---\n\n# interstitials\n\n**Instance Property**\n\nAn array of `interstitial` objects.\n\n## Declaration\n\n```swift\nattribute Array interstitials;\n```\n\n## Discussion\n\nAn interstitial object defines a point within a `MediaItem` object where you can insert another media item; for example, a short ad. Each interstitial object in the array contains two keys: `starttime` and `duration`. The `starttime` is the length of time from the beginning of a media item, in seconds. The `duration` is the length of the interstitial, in seconds. Both keys are required. A common use for these objects is to define when and where ads are to be played during a stream. [doc:\/\/com.apple.documentation\/documentation\/tvmljs\/mediaitem\/1627341-interstitials#1943545] shows a complete TVMLKit JS example for incorporating interstitials. A single interstitial is defined. In addition, an event listener is created that prevents users from fast-forwarding or rewinding during the duration of the interstitial.\n\n```javascript\nvar baseURL;\n \nApp.onLaunch = function(options) {\n    baseURL = options.BASEURL;\n    var documentPath = \"path to file on server\/baseball.m3u8\";\n    var videourl = baseURL + documentPath;\n \n    var singleVideo = new MediaItem('video', videourl);\n    var videoInterstitials = [];\n    videoInterstitials.push({\n        starttime: 30,\n        duration: 20\n    });\n    singleVideo.interstitials = videoInterstitials;\n    var videoList = new Playlist();\n    videoList.push(singleVideo);\n    var myPlayer = new Player();\n    myPlayer.playlist = videoList;\n    myPlayer.addEventListener(\"requestSeekToTime\", function(event) {\n        if (event.currentTime > 30 && event.currentTime <50) {return false;} else {return true;}\n        });\n    myPlayer.play();\n}\n \nApp.onExit = function() {\n    console.log(\"exited\");\n}\n```\n\n## Setting Timing Options\n\n- **highlightGroups**: An array of highlight groups, with each group containing a list of highlights.\n- **resumeTime**: The number of seconds from the beginning of the item at which the item begins playing.\n\n",
  "sections" : [
    {
      "content" : "",
      "items" : [
        {
          "description" : "An array of highlight groups, with each group containing a list of highlights.",
          "name" : "highlightGroups",
          "url" : "https:\/\/developer.apple.com\/documentation\/tvmljs\/mediaitem\/1627413-highlightgroups"
        },
        {
          "description" : "The number of seconds from the beginning of the item at which the item begins playing.",
          "name" : "resumeTime",
          "url" : "https:\/\/developer.apple.com\/documentation\/tvmljs\/mediaitem\/1627400-resumetime"
        }
      ],
      "title" : "Setting Timing Options"
    }
  ],
  "source" : "appleJSON",
  "title" : "interstitials",
  "url" : "https:\/\/developer.apple.com\/documentation\/tvmljs\/mediaitem\/1627341-interstitials"
}