{
  "abstract" : "A time-consuming processing task that runs while the app is in the background.",
  "codeExamples" : [

  ],
  "conformsTo" : [
    "CVarArg",
    "CustomDebugStringConvertible",
    "CustomStringConvertible",
    "Equatable",
    "Hashable",
    "NSObjectProtocol"
  ],
  "contentHash" : "ff814c8ac0c01b249f509d526c5a16aec614163f0a68d3c6d76a0065cc527175",
  "crawledAt" : "2025-12-02T15:49:12Z",
  "declaration" : {
    "code" : "class BGProcessingTask",
    "language" : "swift"
  },
  "id" : "0ACEFC75-DFE6-4975-AD31-FB9DF75BAD98",
  "inheritedBy" : [
    "BGHealthResearchTask"
  ],
  "kind" : "class",
  "language" : "swift",
  "module" : "Background Tasks",
  "overview" : "## Overview\n\nUse processing tasks for long data updates, processing data, and app maintenance. Although processing tasks can run for minutes, the system can interrupt the process. Add an expiration handler by setting [doc:\/\/com.apple.backgroundtasks\/documentation\/BackgroundTasks\/BGTask\/expirationHandler] for any required cleanup.\n\nExecuting processing tasks requires setting the `processing` [doc:\/\/com.apple.documentation\/documentation\/BundleResources\/Information-Property-List\/UIBackgroundModes] capability. For information on setting this capability, see [doc:\/\/com.apple.backgroundtasks\/documentation\/BackgroundTasks\/BGTaskScheduler].\n\nProcessing tasks run only when the device is idle. The system terminates any background processing tasks running when the user starts using the device. Background refresh tasks aren’t affected.",
  "platforms" : [
    "iOS",
    "iPadOS",
    "Mac Catalyst",
    "tvOS",
    "visionOS"
  ],
  "rawMarkdown" : "---\nsource: https:\/\/developer.apple.com\/documentation\/BackgroundTasks\/BGProcessingTask\ncrawled: 2025-12-02T15:49:12Z\n---\n\n# BGProcessingTask\n\n**Class**\n\nA time-consuming processing task that runs while the app is in the background.\n\n## Declaration\n\n```swift\nclass BGProcessingTask\n```\n\n## Overview\n\nUse processing tasks for long data updates, processing data, and app maintenance. Although processing tasks can run for minutes, the system can interrupt the process. Add an expiration handler by setting [doc:\/\/com.apple.backgroundtasks\/documentation\/BackgroundTasks\/BGTask\/expirationHandler] for any required cleanup.\n\nExecuting processing tasks requires setting the `processing` [doc:\/\/com.apple.documentation\/documentation\/BundleResources\/Information-Property-List\/UIBackgroundModes] capability. For information on setting this capability, see [doc:\/\/com.apple.backgroundtasks\/documentation\/BackgroundTasks\/BGTaskScheduler].\n\nProcessing tasks run only when the device is idle. The system terminates any background processing tasks running when the user starts using the device. Background refresh tasks aren’t affected.\n\n## Background tasks\n\n- **Using background tasks to update your app**: Configure your app to perform tasks in the background to make efficient use of processing time and power.\n- **Refreshing and Maintaining Your App Using Background Tasks**: Use scheduled background tasks for refreshing your app content and for performing maintenance.\n- **Choosing Background Strategies for Your App**: Select the best method of scheduling background runtime for your app.\n- **BGAppRefreshTask**: An object representing a short task typically used to refresh content that’s run while the app is in the background.\n- **BGHealthResearchTask**: A time-consuming, necessary processing task that runs while the app is in the background to prepare data essential to a health research study.\n\n## Inherits From\n\n- BGTask\n\n## Inherited By\n\n- BGHealthResearchTask\n\n## Conforms To\n\n- CVarArg\n- CustomDebugStringConvertible\n- CustomStringConvertible\n- Equatable\n- Hashable\n- NSObjectProtocol\n\n",
  "sections" : [
    {
      "content" : "",
      "items" : [
        {
          "description" : "Configure your app to perform tasks in the background to make efficient use of processing time and power.",
          "name" : "Using background tasks to update your app",
          "url" : "https:\/\/developer.apple.com\/documentation\/UIKit\/using-background-tasks-to-update-your-app"
        },
        {
          "description" : "Use scheduled background tasks for refreshing your app content and for performing maintenance.",
          "name" : "Refreshing and Maintaining Your App Using Background Tasks",
          "url" : "https:\/\/developer.apple.com\/documentation\/BackgroundTasks\/refreshing-and-maintaining-your-app-using-background-tasks"
        },
        {
          "description" : "Select the best method of scheduling background runtime for your app.",
          "name" : "Choosing Background Strategies for Your App",
          "url" : "https:\/\/developer.apple.com\/documentation\/BackgroundTasks\/choosing-background-strategies-for-your-app"
        },
        {
          "description" : "An object representing a short task typically used to refresh content that’s run while the app is in the background.",
          "name" : "BGAppRefreshTask",
          "url" : "https:\/\/developer.apple.com\/documentation\/BackgroundTasks\/BGAppRefreshTask"
        },
        {
          "description" : "A time-consuming, necessary processing task that runs while the app is in the background to prepare data essential to a health research study.",
          "name" : "BGHealthResearchTask",
          "url" : "https:\/\/developer.apple.com\/documentation\/BackgroundTasks\/BGHealthResearchTask"
        }
      ],
      "title" : "Background tasks"
    },
    {
      "content" : "",
      "items" : [
        {
          "name" : "BGTask"
        }
      ],
      "title" : "Inherits From"
    }
  ],
  "source" : "appleJSON",
  "title" : "BGProcessingTask",
  "url" : "https:\/\/developer.apple.com\/documentation\/BackgroundTasks\/BGProcessingTask"
}